Updated generic_model.classifier parameters
out\fedrod\mnist\NoBSM_G_P_NoHyper
==================== FedRoD ====================                               
Experiment Arguments:                                                          
{
│   'method': 'fedrod',
│   'dataset': {
│   │   'name': 'mnist',
│   │   'client_num': 100,
│   │   'test_ratio': 0.25,
│   │   'val_ratio': 0.0,
│   │   'seed': 42,
│   │   'split': 'sample',
│   │   'IID_ratio': 0.0,
│   │   'monitor_window_name_suffix': 'mnist-100clients-0%IID-Dir(0.1)-seed42',
│   │   'alpha': 0.1,
│   │   'min_samples_per_client': 10
│   },
│   'model': {
│   │   'name': 'avgcnn',
│   │   'use_torchvision_pretrained_weights': True,
│   │   'external_model_weights_path': None
│   },
│   'optimizer': {
│   │   'lr': 0.01,
│   │   'dampening': 0,
│   │   'weight_decay': 0,
│   │   'momentum': 0,
│   │   'nesterov': False,
│   │   'name': 'sgd'
│   },
│   'mode': 'serial',
│   'parallel': {
│   │   'ray_cluster_addr': None,
│   │   'num_cpus': None,
│   │   'num_gpus': None,
│   │   'num_workers': 2
│   },
│   'common': {
│   │   'seed': 42,
│   │   'join_ratio': 0.1,
│   │   'global_epoch': 400,
│   │   'local_epoch': 5,
│   │   'batch_size': 32,
│   │   'reset_optimizer_on_global_epoch': True,
│   │   'straggler_ratio': 0,
│   │   'straggler_min_local_epoch': 0,
│   │   'buffers': 'global',
│   │   'client_side_evaluation': True,
│   │   'test': {
│   │   │   'client': {
│   │   │   │   'interval': 100,
│   │   │   │   'finetune_epoch': 0,
│   │   │   │   'train': False,
│   │   │   │   'val': False,
│   │   │   │   'test': True
│   │   │   },
│   │   │   'server': {
│   │   │   │   'interval': -1,
│   │   │   │   'train': False,
│   │   │   │   'val': False,
│   │   │   │   'test': False,
│   │   │   │   'model_in_train_mode': False
│   │   │   }
│   │   },
│   │   'verbose_gap': 10,
│   │   'monitor': None,
│   │   'use_cuda': True,
│   │   'save_log': True,
│   │   'save_model': False,
│   │   'save_learning_curve_plot': False,
│   │   'save_metrics': True,
│   │   'delete_useless_run': True
│   },
│   'fedrod': {
│   │   'eval_per': True,
│   │   'phead': True,
│   │   'freeze_generic_classifier': False,
│   │   'bsm': False,
│   │   'ghead': True,
│   │   'gamma': 1,
│   │   'hyper': 0,
│   │   'hyper_lr': 0.1,
│   │   'hyper_hidden_dim': 32
│   }
}
---------------------------- TRAINING EPOCH: 10 ----------------------------   
client [77] (testset)   loss: 0.3942 -> 0.1403  accuracy: 93.15% -> 97.95%     
client [81] (testset)   loss: 0.2923 -> 0.0770  accuracy: 93.83% -> 98.15%     
client [21] (testset)   loss: 0.6531 -> 0.2719  accuracy: 79.41% -> 97.06%     
client [68] (testset)   loss: 0.2783 -> 0.2199  accuracy: 98.31% -> 98.31%     
client [93] (testset)   loss: 0.2599 -> 0.1273  accuracy: 93.55% -> 96.77%     
client [31] (testset)   loss: 0.5193 -> 0.3183  accuracy: 85.71% -> 100.00%    
client [20] (testset)   loss: 0.3679 -> 0.2616  accuracy: 94.12% -> 95.93%     
client [59] (testset)   loss: 0.2550 -> 0.1996  accuracy: 100.00% -> 100.00%   
client [48] (testset)   loss: 0.3827 -> 0.0886  accuracy: 90.29% -> 99.03%     
client [34] (testset)   loss: 0.2237 -> 0.1661  accuracy: 100.00% -> 94.44%    
---------------------------- TRAINING EPOCH: 20 ----------------------------   
client [69] (testset)   loss: 0.2847 -> 0.0969  accuracy: 93.99% -> 99.09%     
client [99] (testset)   loss: 0.4072 -> 0.2748  accuracy: 95.24% -> 95.24%     
client [67] (testset)   loss: 0.3136 -> 0.0187  accuracy: 89.19% -> 100.00%    
client [0]  (testset)   loss: 0.1646 -> 0.0998  accuracy: 96.23% -> 99.06%     
client [76] (testset)   loss: 0.0959 -> 0.0828  accuracy: 100.00% -> 100.00%   
client [41] (testset)   loss: 0.0779 -> 0.0289  accuracy: 98.95% -> 100.00%    
client [62] (testset)   loss: 0.3692 -> 0.0934  accuracy: 93.92% -> 100.00%    
client [2]  (testset)   loss: 0.1490 -> 0.0976  accuracy: 97.53% -> 98.86%     
client [14] (testset)   loss: 0.1791 -> 0.1476  accuracy: 95.83% -> 95.83%     
client [46] (testset)   loss: 0.3938 -> 0.1955  accuracy: 88.74% -> 97.97%     
---------------------------- TRAINING EPOCH: 30 ----------------------------   
client [24] (testset)   loss: 0.1452 -> 0.1353  accuracy: 100.00% -> 100.00%   
client [68] (testset)   loss: 0.1835 -> 0.1449  accuracy: 98.31% -> 98.31%     
client [57] (testset)   loss: 0.0886 -> 0.0753  accuracy: 99.52% -> 99.52%     
client [17] (testset)   loss: 0.1308 -> 0.0424  accuracy: 98.44% -> 99.61%     
client [54] (testset)   loss: 0.1943 -> 0.1628  accuracy: 97.67% -> 97.67%     
client [23] (testset)   loss: 0.2488 -> 0.0973  accuracy: 91.43% -> 100.00%    
client [35] (testset)   loss: 0.5172 -> 0.1644  accuracy: 90.20% -> 97.06%     
client [59] (testset)   loss: 0.0840 -> 0.0830  accuracy: 100.00% -> 100.00%   
client [31] (testset)   loss: 0.2766 -> 0.2594  accuracy: 100.00% -> 100.00%   
client [9]  (testset)   loss: 0.1298 -> 0.0702  accuracy: 97.56% -> 97.88%     
---------------------------- TRAINING EPOCH: 40 ----------------------------   
client [64] (testset)   loss: 0.0575 -> 0.0432  accuracy: 99.44% -> 99.44%     
client [33] (testset)   loss: 0.4042 -> 0.0935  accuracy: 88.74% -> 98.53%     
client [16] (testset)   loss: 0.0968 -> 0.0477  accuracy: 100.00% -> 100.00%   
client [44] (testset)   loss: 0.1710 -> 0.0986  accuracy: 95.82% -> 98.81%     
client [8]  (testset)   loss: 0.3920 -> 0.0308  accuracy: 85.71% -> 100.00%    
client [31] (testset)   loss: 0.4395 -> 0.2662  accuracy: 71.43% -> 100.00%    
client [47] (testset)   loss: 0.5048 -> 0.0737  accuracy: 81.82% -> 100.00%    
client [36] (testset)   loss: 0.4336 -> 0.1194  accuracy: 88.32% -> 96.95%     
client [20] (testset)   loss: 0.4911 -> 0.2086  accuracy: 87.78% -> 95.02%     
client [56] (testset)   loss: 0.1292 -> 0.0689  accuracy: 97.85% -> 98.92%     
---------------------------- TRAINING EPOCH: 50 ----------------------------   
client [4]  (testset)   loss: 0.1911 -> 0.0585  accuracy: 98.53% -> 100.00%    
client [60] (testset)   loss: 0.3232 -> 0.1565  accuracy: 94.00% -> 97.00%     
client [28] (testset)   loss: 0.1669 -> 0.0476  accuracy: 99.33% -> 100.00%    
client [25] (testset)   loss: 0.0455 -> 0.0113  accuracy: 100.00% -> 100.00%   
client [58] (testset)   loss: 0.0504 -> 0.0452  accuracy: 98.58% -> 99.29%     
client [44] (testset)   loss: 0.1940 -> 0.1003  accuracy: 95.82% -> 97.91%     
client [39] (testset)   loss: 0.2654 -> 0.0775  accuracy: 90.17% -> 99.51%     
client [29] (testset)   loss: 0.3661 -> 0.1247  accuracy: 86.72% -> 96.68%     
client [3]  (testset)   loss: 0.2343 -> 0.0658  accuracy: 95.18% -> 98.95%     
client [84] (testset)   loss: 0.0519 -> 0.0272  accuracy: 100.00% -> 100.00%   
---------------------------- TRAINING EPOCH: 60 ----------------------------   
client [21] (testset)   loss: 0.1894 -> 0.1235  accuracy: 97.06% -> 97.06%     
client [84] (testset)   loss: 0.0557 -> 0.0394  accuracy: 100.00% -> 100.00%   
client [10] (testset)   loss: 0.0599 -> 0.0273  accuracy: 100.00% -> 100.00%   
client [36] (testset)   loss: 0.1956 -> 0.0986  accuracy: 95.43% -> 97.97%     
client [65] (testset)   loss: 0.2916 -> 0.1159  accuracy: 96.22% -> 98.74%     
client [81] (testset)   loss: 0.0671 -> 0.0469  accuracy: 99.38% -> 98.15%     
client [79] (testset)   loss: 0.0466 -> 0.0365  accuracy: 98.46% -> 98.46%     
client [42] (testset)   loss: 0.2798 -> 0.1699  accuracy: 93.44% -> 96.17%     
client [11] (testset)   loss: 0.0512 -> 0.0478  accuracy: 100.00% -> 100.00%   
client [96] (testset)   loss: 0.1937 -> 0.1120  accuracy: 96.08% -> 99.02%     
---------------------------- TRAINING EPOCH: 70 ----------------------------   
client [8]  (testset)   loss: 0.0512 -> 0.0325  accuracy: 100.00% -> 100.00%   
client [53] (testset)   loss: 0.1591 -> 0.1375  accuracy: 96.00% -> 100.00%    
client [52] (testset)   loss: 0.6239 -> 0.0882  accuracy: 76.32% -> 100.00%    
client [42] (testset)   loss: 0.1620 -> 0.1537  accuracy: 96.17% -> 96.72%     
client [69] (testset)   loss: 0.1966 -> 0.0518  accuracy: 96.17% -> 99.27%     
client [59] (testset)   loss: 0.0782 -> 0.0728  accuracy: 100.00% -> 100.00%   
client [7]  (testset)   loss: 0.2319 -> 0.1321  accuracy: 100.00% -> 100.00%   
client [26] (testset)   loss: 0.2696 -> 0.2741  accuracy: 91.67% -> 87.50%     
client [49] (testset)   loss: 0.0830 -> 0.0314  accuracy: 100.00% -> 100.00%   
client [98] (testset)   loss: 0.1368 -> 0.1133  accuracy: 97.06% -> 97.06%     
---------------------------- TRAINING EPOCH: 80 ----------------------------   
client [98] (testset)   loss: 0.0964 -> 0.0889  accuracy: 100.00% -> 100.00%   
client [47] (testset)   loss: 0.1611 -> 0.1056  accuracy: 97.73% -> 98.86%     
client [21] (testset)   loss: 0.1749 -> 0.1328  accuracy: 98.04% -> 99.02%     
client [77] (testset)   loss: 0.1003 -> 0.0669  accuracy: 96.58% -> 98.63%     
client [95] (testset)   loss: 0.0557 -> 0.0267  accuracy: 100.00% -> 100.00%   
client [91] (testset)   loss: 0.2682 -> 0.0916  accuracy: 90.76% -> 97.85%     
client [14] (testset)   loss: 0.0750 -> 0.0859  accuracy: 98.61% -> 97.22%     
client [99] (testset)   loss: 0.2128 -> 0.1804  accuracy: 95.24% -> 95.24%     
client [20] (testset)   loss: 0.1462 -> 0.1507  accuracy: 98.64% -> 96.83%     
client [39] (testset)   loss: 0.0835 -> 0.0578  accuracy: 98.53% -> 99.51%     
---------------------------- TRAINING EPOCH: 90 ----------------------------   
client [52] (testset)   loss: 0.0964 -> 0.0829  accuracy: 100.00% -> 100.00%   
client [62] (testset)   loss: 0.1360 -> 0.0560  accuracy: 97.79% -> 100.00%    
client [71] (testset)   loss: 0.0366 -> 0.0362  accuracy: 99.07% -> 98.84%     
client [97] (testset)   loss: 0.1255 -> 0.0527  accuracy: 97.99% -> 99.67%     
client [30] (testset)   loss: 0.0644 -> 0.0559  accuracy: 100.00% -> 100.00%   
client [88] (testset)   loss: 0.2153 -> 0.0597  accuracy: 95.59% -> 98.53%     
client [60] (testset)   loss: 0.4317 -> 0.1907  accuracy: 89.00% -> 96.00%     
client [82] (testset)   loss: 0.1067 -> 0.0649  accuracy: 97.18% -> 100.00%    
client [91] (testset)   loss: 0.1975 -> 0.0875  accuracy: 96.04% -> 99.01%     
client [57] (testset)   loss: 0.0886 -> 0.0463  accuracy: 98.55% -> 99.52%     
---------------------------- TRAINING EPOCH: 100 ----------------------------  
client [31] (testset)   loss: 0.1717 -> 0.1659  accuracy: 100.00% -> 100.00%   
client [15] (testset)   loss: 0.2657 -> 0.0852  accuracy: 93.58% -> 100.00%    
client [71] (testset)   loss: 0.0519 -> 0.0342  accuracy: 98.38% -> 98.84%     
client [97] (testset)   loss: 0.1203 -> 0.0586  accuracy: 97.32% -> 99.33%     
client [53] (testset)   loss: 0.0364 -> 0.0411  accuracy: 100.00% -> 100.00%   
client [77] (testset)   loss: 0.1265 -> 0.0686  accuracy: 97.26% -> 98.63%     
client [76] (testset)   loss: 0.1743 -> 0.0629  accuracy: 96.10% -> 100.00%    
client [79] (testset)   loss: 0.0366 -> 0.0247  accuracy: 98.46% -> 100.00%    
client [28] (testset)   loss: 0.0662 -> 0.0362  accuracy: 100.00% -> 100.00%   
client [99] (testset)   loss: 0.3478 -> 0.1983  accuracy: 90.48% -> 100.00%    
---------------------------- TRAINING EPOCH: 110 ----------------------------  
client [97] (testset)   loss: 0.1634 -> 0.0459  accuracy: 95.65% -> 100.00%    
client [86] (testset)   loss: 0.2937 -> 0.0701  accuracy: 92.33% -> 98.63%     
client [34] (testset)   loss: 0.0960 -> 0.1006  accuracy: 100.00% -> 100.00%   
client [73] (testset)   loss: 0.0689 -> 0.0734  accuracy: 97.06% -> 97.06%     
client [5]  (testset)   loss: 0.0924 -> 0.0842  accuracy: 98.62% -> 98.62%     
client [96] (testset)   loss: 0.5085 -> 0.1558  accuracy: 80.39% -> 96.08%     
client [22] (testset)   loss: 0.1288 -> 0.0660  accuracy: 100.00% -> 100.00%   
client [60] (testset)   loss: 0.1713 -> 0.1451  accuracy: 97.00% -> 97.00%     
client [66] (testset)   loss: 0.1615 -> 0.1067  accuracy: 96.46% -> 98.23%     
client [83] (testset)   loss: 0.1953 -> 0.1192  accuracy: 96.44% -> 96.80%     
---------------------------- TRAINING EPOCH: 120 ----------------------------  
client [76] (testset)   loss: 0.1396 -> 0.0616  accuracy: 94.81% -> 100.00%    
client [65] (testset)   loss: 0.1935 -> 0.1155  accuracy: 97.06% -> 97.48%     
client [95] (testset)   loss: 0.0288 -> 0.0220  accuracy: 99.64% -> 100.00%    
client [17] (testset)   loss: 0.0355 -> 0.0262  accuracy: 99.61% -> 99.61%     
client [8]  (testset)   loss: 0.0397 -> 0.0377  accuracy: 100.00% -> 100.00%   
client [35] (testset)   loss: 0.3348 -> 0.1733  accuracy: 92.16% -> 94.12%     
client [98] (testset)   loss: 0.1442 -> 0.1196  accuracy: 97.06% -> 97.06%     
client [53] (testset)   loss: 0.1107 -> 0.0958  accuracy: 100.00% -> 100.00%   
client [43] (testset)   loss: 0.1961 -> 0.1691  accuracy: 94.65% -> 94.12%     
client [64] (testset)   loss: 0.0427 -> 0.0257  accuracy: 99.17% -> 99.72%     
---------------------------- TRAINING EPOCH: 130 ----------------------------  
client [21] (testset)   loss: 0.1637 -> 0.1176  accuracy: 96.08% -> 98.04%     
client [88] (testset)   loss: 0.0430 -> 0.0335  accuracy: 97.06% -> 100.00%    
client [38] (testset)   loss: 0.1134 -> 0.1081  accuracy: 96.49% -> 96.49%     
client [3]  (testset)   loss: 0.0977 -> 0.0547  accuracy: 97.48% -> 99.37%     
client [5]  (testset)   loss: 0.2083 -> 0.0702  accuracy: 94.48% -> 99.31%     
client [41] (testset)   loss: 0.0251 -> 0.0125  accuracy: 100.00% -> 100.00%   
client [7]  (testset)   loss: 0.0481 -> 0.0468  accuracy: 100.00% -> 100.00%   
client [37] (testset)   loss: 0.1231 -> 0.0857  accuracy: 96.54% -> 97.40%     
client [45] (testset)   loss: 0.1226 -> 0.0548  accuracy: 97.85% -> 99.39%     
client [47] (testset)   loss: 0.1984 -> 0.0938  accuracy: 93.18% -> 98.86%     
---------------------------- TRAINING EPOCH: 140 ----------------------------  
client [16] (testset)   loss: 0.0999 -> 0.0308  accuracy: 100.00% -> 100.00%   
client [11] (testset)   loss: 0.0298 -> 0.0298  accuracy: 100.00% -> 100.00%   
client [37] (testset)   loss: 0.1138 -> 0.0889  accuracy: 96.97% -> 97.40%     
client [41] (testset)   loss: 0.0298 -> 0.0145  accuracy: 100.00% -> 100.00%   
client [95] (testset)   loss: 0.0357 -> 0.0179  accuracy: 99.64% -> 100.00%    
client [53] (testset)   loss: 0.1457 -> 0.1198  accuracy: 96.00% -> 96.00%     
client [22] (testset)   loss: 0.2157 -> 0.0970  accuracy: 91.49% -> 97.87%     
client [25] (testset)   loss: 0.0260 -> 0.0160  accuracy: 100.00% -> 100.00%   
client [69] (testset)   loss: 0.1416 -> 0.0558  accuracy: 96.17% -> 98.72%     
client [46] (testset)   loss: 0.1565 -> 0.0931  accuracy: 95.50% -> 98.20%     
---------------------------- TRAINING EPOCH: 150 ----------------------------  
client [47] (testset)   loss: 0.0758 -> 0.0735  accuracy: 97.73% -> 97.73%     
client [69] (testset)   loss: 0.1513 -> 0.0625  accuracy: 96.36% -> 98.72%     
client [82] (testset)   loss: 0.0528 -> 0.0477  accuracy: 100.00% -> 100.00%   
client [45] (testset)   loss: 0.0742 -> 0.0455  accuracy: 99.08% -> 99.08%     
client [7]  (testset)   loss: 0.1764 -> 0.1506  accuracy: 87.50% -> 87.50%     
client [50] (testset)   loss: 0.1021 -> 0.0599  accuracy: 96.92% -> 98.46%     
client [35] (testset)   loss: 0.1751 -> 0.1574  accuracy: 94.12% -> 94.12%     
client [24] (testset)   loss: 0.1030 -> 0.0884  accuracy: 98.65% -> 98.65%     
client [15] (testset)   loss: 0.0994 -> 0.0879  accuracy: 98.17% -> 99.08%     
client [58] (testset)   loss: 0.0257 -> 0.0197  accuracy: 100.00% -> 100.00%   
---------------------------- TRAINING EPOCH: 160 ----------------------------  
client [48] (testset)   loss: 0.0463 -> 0.0360  accuracy: 98.06% -> 99.03%     
client [76] (testset)   loss: 0.1036 -> 0.0581  accuracy: 97.40% -> 100.00%    
client [67] (testset)   loss: 0.0233 -> 0.0209  accuracy: 100.00% -> 100.00%   
client [37] (testset)   loss: 0.1083 -> 0.0977  accuracy: 96.10% -> 96.10%     
client [58] (testset)   loss: 0.0224 -> 0.0195  accuracy: 100.00% -> 100.00%   
client [64] (testset)   loss: 0.0292 -> 0.0198  accuracy: 98.89% -> 99.72%     
client [77] (testset)   loss: 0.0950 -> 0.0668  accuracy: 97.26% -> 97.26%     
client [55] (testset)   loss: 0.2617 -> 0.0506  accuracy: 92.60% -> 99.23%     
client [12] (testset)   loss: 0.1159 -> 0.0548  accuracy: 96.53% -> 99.01%     
client [89] (testset)   loss: 0.1314 -> 0.1100  accuracy: 96.97% -> 96.97%     
---------------------------- TRAINING EPOCH: 170 ----------------------------  
client [84] (testset)   loss: 0.0168 -> 0.0168  accuracy: 100.00% -> 100.00%   
client [51] (testset)   loss: 0.0516 -> 0.0332  accuracy: 100.00% -> 100.00%   
client [8]  (testset)   loss: 0.1300 -> 0.0795  accuracy: 95.24% -> 97.62%     
client [18] (testset)   loss: 0.0658 -> 0.0593  accuracy: 98.62% -> 98.62%     
client [94] (testset)   loss: 0.0716 -> 0.0414  accuracy: 100.00% -> 100.00%   
client [81] (testset)   loss: 0.0299 -> 0.0285  accuracy: 100.00% -> 99.38%    
client [3]  (testset)   loss: 0.1052 -> 0.0590  accuracy: 97.06% -> 98.53%     
client [11] (testset)   loss: 0.0285 -> 0.0280  accuracy: 100.00% -> 100.00%   
client [95] (testset)   loss: 0.0399 -> 0.0206  accuracy: 98.92% -> 100.00%    
client [67] (testset)   loss: 0.0131 -> 0.0127  accuracy: 100.00% -> 100.00%   
---------------------------- TRAINING EPOCH: 180 ----------------------------  
client [21] (testset)   loss: 0.1286 -> 0.1001  accuracy: 96.08% -> 99.02%     
client [79] (testset)   loss: 0.0164 -> 0.0162  accuracy: 100.00% -> 100.00%   
client [58] (testset)   loss: 0.0196 -> 0.0179  accuracy: 100.00% -> 100.00%   
client [88] (testset)   loss: 0.0350 -> 0.0257  accuracy: 98.53% -> 100.00%    
client [46] (testset)   loss: 0.1681 -> 0.0919  accuracy: 94.82% -> 97.97%     
client [11] (testset)   loss: 0.0268 -> 0.0266  accuracy: 100.00% -> 100.00%   
client [55] (testset)   loss: 0.1169 -> 0.0497  accuracy: 97.70% -> 98.98%     
client [13] (testset)   loss: 0.0434 -> 0.0451  accuracy: 100.00% -> 100.00%   
client [31] (testset)   loss: 0.0765 -> 0.0754  accuracy: 100.00% -> 100.00%   
client [75] (testset)   loss: 0.1874 -> 0.0546  accuracy: 94.74% -> 98.76%     
---------------------------- TRAINING EPOCH: 190 ----------------------------  
client [19] (testset)   loss: 0.1763 -> 0.1547  accuracy: 96.30% -> 96.30%     
client [7]  (testset)   loss: 0.0596 -> 0.0566  accuracy: 100.00% -> 100.00%   
client [57] (testset)   loss: 0.0747 -> 0.0638  accuracy: 98.55% -> 98.07%     
client [13] (testset)   loss: 0.1178 -> 0.1110  accuracy: 100.00% -> 100.00%   
client [43] (testset)   loss: 0.1943 -> 0.1623  accuracy: 94.65% -> 96.26%     
client [91] (testset)   loss: 0.1398 -> 0.0700  accuracy: 95.71% -> 98.35%     
client [10] (testset)   loss: 0.0675 -> 0.0277  accuracy: 99.01% -> 100.00%    
client [64] (testset)   loss: 0.0340 -> 0.0223  accuracy: 99.17% -> 99.44%     
client [82] (testset)   loss: 0.0622 -> 0.0553  accuracy: 98.59% -> 100.00%    
client [22] (testset)   loss: 0.0603 -> 0.0577  accuracy: 100.00% -> 100.00%   
---------------------------- TRAINING EPOCH: 200 ----------------------------  
client [20] (testset)   loss: 0.2461 -> 0.1526  accuracy: 93.67% -> 95.93%     
client [23] (testset)   loss: 0.0485 -> 0.0431  accuracy: 100.00% -> 100.00%   
client [88] (testset)   loss: 0.0629 -> 0.0283  accuracy: 97.06% -> 98.53%     
client [98] (testset)   loss: 0.1003 -> 0.0958  accuracy: 97.06% -> 97.06%     
client [79] (testset)   loss: 0.0146 -> 0.0146  accuracy: 100.00% -> 100.00%   
client [21] (testset)   loss: 0.1261 -> 0.1157  accuracy: 97.06% -> 97.06%     
client [92] (testset)   loss: 0.0187 -> 0.0191  accuracy: 100.00% -> 100.00%   
client [56] (testset)   loss: 0.0609 -> 0.0463  accuracy: 97.85% -> 98.92%     
client [5]  (testset)   loss: 0.1670 -> 0.1029  accuracy: 95.17% -> 97.93%     
client [52] (testset)   loss: 0.2255 -> 0.1601  accuracy: 94.74% -> 98.68%     
---------------------------- TRAINING EPOCH: 210 ----------------------------  
client [67] (testset)   loss: 0.0375 -> 0.0264  accuracy: 100.00% -> 100.00%   
client [54] (testset)   loss: 0.0754 -> 0.0725  accuracy: 100.00% -> 100.00%   
client [14] (testset)   loss: 0.1021 -> 0.1011  accuracy: 96.53% -> 96.53%     
client [99] (testset)   loss: 0.3169 -> 0.2688  accuracy: 80.95% -> 90.48%     
client [36] (testset)   loss: 0.1392 -> 0.1147  accuracy: 97.46% -> 97.97%     
client [30] (testset)   loss: 0.0724 -> 0.0499  accuracy: 97.50% -> 100.00%    
client [38] (testset)   loss: 0.1116 -> 0.1121  accuracy: 96.49% -> 96.49%     
client [15] (testset)   loss: 0.1372 -> 0.0963  accuracy: 96.33% -> 99.08%     
client [6]  (testset)   loss: 0.0511 -> 0.0291  accuracy: 98.44% -> 98.96%     
client [53] (testset)   loss: 0.1122 -> 0.0982  accuracy: 100.00% -> 100.00%   
---------------------------- TRAINING EPOCH: 220 ----------------------------  
client [99] (testset)   loss: 0.2241 -> 0.2107  accuracy: 90.48% -> 90.48%     
client [6]  (testset)   loss: 0.0340 -> 0.0294  accuracy: 99.48% -> 99.22%     
client [83] (testset)   loss: 0.0929 -> 0.0859  accuracy: 97.86% -> 98.22%     
client [42] (testset)   loss: 0.1777 -> 0.1608  accuracy: 93.99% -> 93.99%     
client [34] (testset)   loss: 0.1124 -> 0.1121  accuracy: 94.44% -> 94.44%     
client [15] (testset)   loss: 0.1105 -> 0.0926  accuracy: 97.25% -> 97.25%     
client [47] (testset)   loss: 0.1138 -> 0.0902  accuracy: 96.59% -> 97.73%     
client [55] (testset)   loss: 0.0727 -> 0.0417  accuracy: 97.96% -> 99.49%     
client [51] (testset)   loss: 0.0269 -> 0.0226  accuracy: 100.00% -> 100.00%   
client [95] (testset)   loss: 0.0421 -> 0.0189  accuracy: 99.28% -> 100.00%    
---------------------------- TRAINING EPOCH: 230 ----------------------------  
client [71] (testset)   loss: 0.0414 -> 0.0348  accuracy: 98.61% -> 98.84%     
client [15] (testset)   loss: 0.1750 -> 0.1009  accuracy: 93.58% -> 99.08%     
client [33] (testset)   loss: 0.1778 -> 0.0690  accuracy: 95.92% -> 98.37%     
client [99] (testset)   loss: 0.2285 -> 0.1279  accuracy: 90.48% -> 100.00%    
client [90] (testset)   loss: 0.0851 -> 0.0578  accuracy: 98.54% -> 98.91%     
client [57] (testset)   loss: 0.0534 -> 0.0469  accuracy: 99.03% -> 99.03%     
client [27] (testset)   loss: 0.0172 -> 0.0151  accuracy: 100.00% -> 99.47%    
client [78] (testset)   loss: 0.1386 -> 0.1118  accuracy: 95.54% -> 96.18%     
client [36] (testset)   loss: 0.1431 -> 0.1157  accuracy: 97.97% -> 97.97%     
client [88] (testset)   loss: 0.0481 -> 0.0395  accuracy: 98.53% -> 98.53%     
---------------------------- TRAINING EPOCH: 240 ----------------------------  
client [70] (testset)   loss: 0.0680 -> 0.0665  accuracy: 98.35% -> 97.43%     
client [35] (testset)   loss: 0.3971 -> 0.1955  accuracy: 87.25% -> 93.14%     
client [16] (testset)   loss: 0.0158 -> 0.0150  accuracy: 100.00% -> 100.00%   
client [80] (testset)   loss: 0.0338 -> 0.0150  accuracy: 100.00% -> 100.00%   
client [38] (testset)   loss: 0.1387 -> 0.1234  accuracy: 96.49% -> 96.49%     
client [78] (testset)   loss: 0.1635 -> 0.1205  accuracy: 95.54% -> 96.18%     
client [68] (testset)   loss: 0.0507 -> 0.0499  accuracy: 100.00% -> 100.00%   
client [11] (testset)   loss: 0.0328 -> 0.0326  accuracy: 100.00% -> 100.00%   
client [64] (testset)   loss: 0.0246 -> 0.0205  accuracy: 99.17% -> 99.44%     
client [82] (testset)   loss: 0.0302 -> 0.0299  accuracy: 100.00% -> 100.00%   
---------------------------- TRAINING EPOCH: 250 ----------------------------  
client [30] (testset)   loss: 0.0388 -> 0.0347  accuracy: 100.00% -> 100.00%   
client [27] (testset)   loss: 0.0240 -> 0.0147  accuracy: 98.93% -> 99.47%     
client [74] (testset)   loss: 0.1761 -> 0.1333  accuracy: 94.15% -> 96.31%     
client [45] (testset)   loss: 0.0773 -> 0.0462  accuracy: 97.85% -> 99.39%     
client [6]  (testset)   loss: 0.0278 -> 0.0253  accuracy: 98.96% -> 98.96%     
client [36] (testset)   loss: 0.1034 -> 0.0884  accuracy: 97.97% -> 97.97%     
client [63] (testset)   loss: 0.0194 -> 0.0178  accuracy: 100.00% -> 100.00%   
client [76] (testset)   loss: 0.0506 -> 0.0370  accuracy: 100.00% -> 100.00%   
client [83] (testset)   loss: 0.0967 -> 0.0842  accuracy: 97.51% -> 98.22%     
client [86] (testset)   loss: 0.1223 -> 0.0775  accuracy: 95.89% -> 97.53%     
---------------------------- TRAINING EPOCH: 260 ----------------------------  
client [83] (testset)   loss: 0.1058 -> 0.0822  accuracy: 97.51% -> 96.80%     
client [99] (testset)   loss: 0.1849 -> 0.1289  accuracy: 95.24% -> 100.00%    
client [74] (testset)   loss: 0.1150 -> 0.1161  accuracy: 97.23% -> 97.54%     
client [73] (testset)   loss: 0.0592 -> 0.0606  accuracy: 97.06% -> 97.06%     
client [29] (testset)   loss: 0.1353 -> 0.1073  accuracy: 96.31% -> 97.05%     
client [92] (testset)   loss: 0.0430 -> 0.0382  accuracy: 100.00% -> 100.00%   
client [6]  (testset)   loss: 0.0626 -> 0.0295  accuracy: 97.66% -> 98.96%     
client [61] (testset)   loss: 0.0117 -> 0.0135  accuracy: 100.00% -> 100.00%   
client [21] (testset)   loss: 0.2084 -> 0.1192  accuracy: 92.16% -> 97.06%     
client [67] (testset)   loss: 0.0142 -> 0.0137  accuracy: 100.00% -> 100.00%   
---------------------------- TRAINING EPOCH: 270 ----------------------------  
client [83] (testset)   loss: 0.1214 -> 0.0965  accuracy: 97.86% -> 97.86%     
client [32] (testset)   loss: 0.2112 -> 0.1799  accuracy: 93.65% -> 94.44%     
client [95] (testset)   loss: 0.0188 -> 0.0129  accuracy: 99.64% -> 99.64%     
client [61] (testset)   loss: 0.0097 -> 0.0114  accuracy: 100.00% -> 100.00%   
client [27] (testset)   loss: 0.0231 -> 0.0185  accuracy: 99.47% -> 99.47%     
client [25] (testset)   loss: 0.0105 -> 0.0101  accuracy: 100.00% -> 100.00%   
client [68] (testset)   loss: 0.0559 -> 0.0546  accuracy: 96.61% -> 98.31%     
client [34] (testset)   loss: 0.1359 -> 0.1344  accuracy: 94.44% -> 94.44%     
client [71] (testset)   loss: 0.0475 -> 0.0418  accuracy: 98.38% -> 98.61%     
client [89] (testset)   loss: 0.0533 -> 0.0512  accuracy: 100.00% -> 100.00%   
---------------------------- TRAINING EPOCH: 280 ----------------------------  
client [78] (testset)   loss: 0.1392 -> 0.0968  accuracy: 96.18% -> 96.82%     
client [81] (testset)   loss: 0.0474 -> 0.0381  accuracy: 98.77% -> 98.15%     
client [51] (testset)   loss: 0.0261 -> 0.0198  accuracy: 100.00% -> 100.00%   
client [54] (testset)   loss: 0.0633 -> 0.0608  accuracy: 97.67% -> 97.67%     
client [65] (testset)   loss: 0.1041 -> 0.0894  accuracy: 97.48% -> 97.90%     
client [41] (testset)   loss: 0.0281 -> 0.0199  accuracy: 100.00% -> 100.00%   
client [11] (testset)   loss: 0.0102 -> 0.0102  accuracy: 100.00% -> 100.00%   
client [85] (testset)   loss: 0.0386 -> 0.0349  accuracy: 98.96% -> 98.96%     
client [12] (testset)   loss: 0.0529 -> 0.0448  accuracy: 99.01% -> 99.50%     
client [23] (testset)   loss: 0.0255 -> 0.0253  accuracy: 100.00% -> 100.00%   
---------------------------- TRAINING EPOCH: 290 ----------------------------  
client [16] (testset)   loss: 0.0165 -> 0.0123  accuracy: 100.00% -> 100.00%   
client [65] (testset)   loss: 0.1002 -> 0.0949  accuracy: 97.48% -> 97.48%     
client [53] (testset)   loss: 0.0560 -> 0.0562  accuracy: 100.00% -> 100.00%   
client [58] (testset)   loss: 0.0145 -> 0.0141  accuracy: 100.00% -> 100.00%   
client [72] (testset)   loss: 0.1032 -> 0.0890  accuracy: 97.27% -> 97.27%     
client [7]  (testset)   loss: 0.1296 -> 0.1260  accuracy: 100.00% -> 100.00%   
client [71] (testset)   loss: 0.0398 -> 0.0390  accuracy: 98.61% -> 98.61%     
client [59] (testset)   loss: 0.0239 -> 0.0239  accuracy: 100.00% -> 100.00%   
client [86] (testset)   loss: 0.2004 -> 0.0916  accuracy: 94.79% -> 97.53%     
client [39] (testset)   loss: 0.0887 -> 0.0438  accuracy: 97.30% -> 99.26%     
---------------------------- TRAINING EPOCH: 300 ----------------------------  
client [99] (testset)   loss: 0.1472 -> 0.1457  accuracy: 100.00% -> 100.00%   
client [7]  (testset)   loss: 0.1424 -> 0.1186  accuracy: 100.00% -> 100.00%   
client [17] (testset)   loss: 0.0291 -> 0.0241  accuracy: 99.22% -> 99.61%     
client [64] (testset)   loss: 0.0226 -> 0.0176  accuracy: 99.17% -> 99.17%     
client [37] (testset)   loss: 0.1124 -> 0.0955  accuracy: 96.54% -> 96.97%     
client [29] (testset)   loss: 0.1585 -> 0.1443  accuracy: 96.31% -> 96.68%     
client [93] (testset)   loss: 0.0212 -> 0.0207  accuracy: 100.00% -> 100.00%   
client [73] (testset)   loss: 0.1141 -> 0.1145  accuracy: 97.06% -> 97.06%     
client [40] (testset)   loss: 0.0136 -> 0.0136  accuracy: 100.00% -> 100.00%   
client [76] (testset)   loss: 0.0662 -> 0.0581  accuracy: 97.40% -> 97.40%     
---------------------------- TRAINING EPOCH: 310 ----------------------------  
client [31] (testset)   loss: 0.0618 -> 0.0617  accuracy: 100.00% -> 100.00%   
client [89] (testset)   loss: 0.0487 -> 0.0483  accuracy: 100.00% -> 100.00%   
client [77] (testset)   loss: 0.0782 -> 0.0560  accuracy: 97.26% -> 97.26%     
client [90] (testset)   loss: 0.0623 -> 0.0584  accuracy: 98.91% -> 98.91%     
client [26] (testset)   loss: 0.3191 -> 0.3142  accuracy: 91.67% -> 91.67%     
client [50] (testset)   loss: 0.0711 -> 0.0506  accuracy: 98.97% -> 98.97%     
client [30] (testset)   loss: 0.0284 -> 0.0281  accuracy: 100.00% -> 100.00%   
client [70] (testset)   loss: 0.0659 -> 0.0582  accuracy: 98.17% -> 97.98%     
client [41] (testset)   loss: 0.0172 -> 0.0165  accuracy: 100.00% -> 100.00%   
client [99] (testset)   loss: 0.3093 -> 0.2379  accuracy: 85.71% -> 90.48%     
---------------------------- TRAINING EPOCH: 320 ----------------------------  
client [68] (testset)   loss: 0.0406 -> 0.0401  accuracy: 100.00% -> 100.00%   
client [70] (testset)   loss: 0.0595 -> 0.0535  accuracy: 98.17% -> 98.17%     
client [52] (testset)   loss: 0.3009 -> 0.1869  accuracy: 92.11% -> 96.05%     
client [1]  (testset)   loss: 0.0572 -> 0.0464  accuracy: 98.33% -> 100.00%    
client [2]  (testset)   loss: 0.0941 -> 0.0600  accuracy: 97.53% -> 98.67%     
client [67] (testset)   loss: 0.0067 -> 0.0067  accuracy: 100.00% -> 100.00%   
client [92] (testset)   loss: 0.0158 -> 0.0159  accuracy: 100.00% -> 100.00%   
client [35] (testset)   loss: 0.2828 -> 0.1731  accuracy: 91.18% -> 95.10%     
client [36] (testset)   loss: 0.1422 -> 0.1189  accuracy: 97.46% -> 97.46%     
client [64] (testset)   loss: 0.0248 -> 0.0201  accuracy: 99.17% -> 99.17%     
---------------------------- TRAINING EPOCH: 330 ----------------------------  
client [44] (testset)   loss: 0.0756 -> 0.0587  accuracy: 97.91% -> 98.81%     
client [6]  (testset)   loss: 0.0307 -> 0.0290  accuracy: 98.96% -> 98.70%     
client [12] (testset)   loss: 0.0789 -> 0.0519  accuracy: 97.52% -> 98.51%     
client [55] (testset)   loss: 0.0845 -> 0.0426  accuracy: 98.21% -> 98.98%     
client [29] (testset)   loss: 0.1747 -> 0.1556  accuracy: 94.83% -> 96.31%     
client [9]  (testset)   loss: 0.0750 -> 0.0590  accuracy: 97.88% -> 98.37%     
client [43] (testset)   loss: 0.2147 -> 0.1674  accuracy: 95.19% -> 96.26%     
client [77] (testset)   loss: 0.0740 -> 0.0607  accuracy: 96.58% -> 96.58%     
client [98] (testset)   loss: 0.0601 -> 0.0597  accuracy: 97.06% -> 97.06%     
client [78] (testset)   loss: 0.1082 -> 0.1006  accuracy: 96.82% -> 97.45%     
---------------------------- TRAINING EPOCH: 340 ----------------------------  
client [92] (testset)   loss: 0.0057 -> 0.0057  accuracy: 100.00% -> 100.00%   
client [80] (testset)   loss: 0.0330 -> 0.0276  accuracy: 100.00% -> 100.00%   
client [63] (testset)   loss: 0.0278 -> 0.0254  accuracy: 99.27% -> 99.27%     
client [76] (testset)   loss: 0.0399 -> 0.0379  accuracy: 98.70% -> 98.70%     
client [78] (testset)   loss: 0.0876 -> 0.0844  accuracy: 96.18% -> 96.18%     
client [25] (testset)   loss: 0.0124 -> 0.0112  accuracy: 100.00% -> 100.00%   
client [58] (testset)   loss: 0.0149 -> 0.0140  accuracy: 100.00% -> 100.00%   
client [13] (testset)   loss: 0.0865 -> 0.0711  accuracy: 100.00% -> 100.00%   
client [17] (testset)   loss: 0.0243 -> 0.0197  accuracy: 99.22% -> 99.61%     
client [38] (testset)   loss: 0.1903 -> 0.1668  accuracy: 94.74% -> 94.74%     
---------------------------- TRAINING EPOCH: 350 ----------------------------  
client [72] (testset)   loss: 0.1039 -> 0.0921  accuracy: 95.45% -> 97.27%     
client [82] (testset)   loss: 0.0252 -> 0.0250  accuracy: 100.00% -> 100.00%   
client [86] (testset)   loss: 0.1445 -> 0.0989  accuracy: 96.16% -> 97.26%     
client [51] (testset)   loss: 0.0189 -> 0.0175  accuracy: 100.00% -> 100.00%   
client [96] (testset)   loss: 0.2587 -> 0.1499  accuracy: 91.18% -> 96.08%     
client [42] (testset)   loss: 0.1575 -> 0.1475  accuracy: 92.90% -> 93.44%     
client [55] (testset)   loss: 0.0657 -> 0.0412  accuracy: 98.21% -> 98.98%     
client [13] (testset)   loss: 0.0277 -> 0.0281  accuracy: 100.00% -> 100.00%   
client [1]  (testset)   loss: 0.0904 -> 0.0755  accuracy: 96.67% -> 96.67%     
client [12] (testset)   loss: 0.0708 -> 0.0556  accuracy: 97.03% -> 98.51%     
---------------------------- TRAINING EPOCH: 360 ----------------------------  
client [68] (testset)   loss: 0.0533 -> 0.0532  accuracy: 96.61% -> 96.61%     
client [23] (testset)   loss: 0.0515 -> 0.0403  accuracy: 100.00% -> 100.00%   
client [46] (testset)   loss: 0.1053 -> 0.0859  accuracy: 96.62% -> 96.62%     
client [41] (testset)   loss: 0.0240 -> 0.0180  accuracy: 100.00% -> 100.00%   
client [25] (testset)   loss: 0.0120 -> 0.0106  accuracy: 100.00% -> 100.00%   
client [58] (testset)   loss: 0.0106 -> 0.0105  accuracy: 100.00% -> 100.00%   
client [14] (testset)   loss: 0.1185 -> 0.1114  accuracy: 96.53% -> 97.22%     
client [33] (testset)   loss: 0.1412 -> 0.0739  accuracy: 96.25% -> 97.72%     
client [85] (testset)   loss: 0.0460 -> 0.0415  accuracy: 98.45% -> 98.45%     
client [62] (testset)   loss: 0.0737 -> 0.0250  accuracy: 98.90% -> 99.45%     
---------------------------- TRAINING EPOCH: 370 ----------------------------  
client [98] (testset)   loss: 0.0765 -> 0.0761  accuracy: 97.06% -> 97.06%     
client [63] (testset)   loss: 0.0299 -> 0.0274  accuracy: 99.27% -> 99.27%     
client [70] (testset)   loss: 0.0510 -> 0.0500  accuracy: 98.72% -> 98.53%     
client [65] (testset)   loss: 0.1407 -> 0.1031  accuracy: 97.48% -> 97.48%     
client [14] (testset)   loss: 0.1115 -> 0.1114  accuracy: 96.53% -> 96.53%     
client [73] (testset)   loss: 0.1329 -> 0.1339  accuracy: 97.06% -> 97.06%     
client [34] (testset)   loss: 0.1280 -> 0.1274  accuracy: 94.44% -> 94.44%     
client [99] (testset)   loss: 0.1540 -> 0.1518  accuracy: 95.24% -> 95.24%     
client [69] (testset)   loss: 0.1145 -> 0.0657  accuracy: 96.72% -> 98.36%     
client [46] (testset)   loss: 0.0972 -> 0.0833  accuracy: 97.30% -> 97.75%     
---------------------------- TRAINING EPOCH: 380 ----------------------------  
client [99] (testset)   loss: 0.1660 -> 0.1538  accuracy: 95.24% -> 95.24%     
client [93] (testset)   loss: 0.0159 -> 0.0156  accuracy: 100.00% -> 100.00%   
client [11] (testset)   loss: 0.0124 -> 0.0124  accuracy: 100.00% -> 100.00%   
client [58] (testset)   loss: 0.0130 -> 0.0126  accuracy: 100.00% -> 100.00%   
client [81] (testset)   loss: 0.0526 -> 0.0480  accuracy: 98.15% -> 98.15%     
client [85] (testset)   loss: 0.0467 -> 0.0418  accuracy: 98.96% -> 98.96%     
client [89] (testset)   loss: 0.0530 -> 0.0528  accuracy: 100.00% -> 100.00%   
client [45] (testset)   loss: 0.0591 -> 0.0493  accuracy: 98.77% -> 99.08%     
client [8]  (testset)   loss: 0.0429 -> 0.0425  accuracy: 100.00% -> 100.00%   
client [68] (testset)   loss: 0.0374 -> 0.0374  accuracy: 100.00% -> 100.00%   
---------------------------- TRAINING EPOCH: 390 ----------------------------  
client [67] (testset)   loss: 0.0134 -> 0.0130  accuracy: 100.00% -> 100.00%   
client [72] (testset)   loss: 0.1359 -> 0.0445  accuracy: 95.45% -> 98.18%     
client [1]  (testset)   loss: 0.0353 -> 0.0363  accuracy: 100.00% -> 100.00%   
client [78] (testset)   loss: 0.1059 -> 0.0962  accuracy: 96.18% -> 96.18%     
client [83] (testset)   loss: 0.1213 -> 0.1100  accuracy: 96.80% -> 96.80%     
client [21] (testset)   loss: 0.1015 -> 0.1006  accuracy: 97.06% -> 98.04%     
client [56] (testset)   loss: 0.0453 -> 0.0441  accuracy: 98.92% -> 98.92%     
client [44] (testset)   loss: 0.0760 -> 0.0603  accuracy: 98.21% -> 98.81%     
client [92] (testset)   loss: 0.0051 -> 0.0052  accuracy: 100.00% -> 100.00%   
client [27] (testset)   loss: 0.0204 -> 0.0165  accuracy: 99.47% -> 99.47%     
---------------------------- TRAINING EPOCH: 400 ----------------------------  
client [10] (testset)   loss: 0.0174 -> 0.0163  accuracy: 100.00% -> 100.00%   
client [39] (testset)   loss: 0.0621 -> 0.0444  accuracy: 98.53% -> 99.02%     
client [65] (testset)   loss: 0.1100 -> 0.0998  accuracy: 97.48% -> 97.48%     
client [26] (testset)   loss: 0.2804 -> 0.2805  accuracy: 83.33% -> 83.33%     
client [19] (testset)   loss: 0.1221 -> 0.1214  accuracy: 96.30% -> 96.30%     
client [68] (testset)   loss: 0.0520 -> 0.0517  accuracy: 98.31% -> 98.31%     
client [41] (testset)   loss: 0.0285 -> 0.0233  accuracy: 98.95% -> 98.95%     
client [50] (testset)   loss: 0.0549 -> 0.0538  accuracy: 97.95% -> 97.95%     
client [75] (testset)   loss: 0.0853 -> 0.0774  accuracy: 98.14% -> 98.14%     
client [81] (testset)   loss: 0.0453 -> 0.0371  accuracy: 98.15% -> 98.15%     
Training... ---------------------------------------- 100% 0:15:36
FedRoD's average time taken by each global epoch: 0 min 2.33 sec.              
FedRoD's total running time: 0 h 15 m 36 s.                                    
==================== FedRoD Experiment Results: ====================           
Display format: (before local fine-tuning) -> (after local fine-tuning)        
 So if finetune_epoch = 0, x.xx% -> 0.00% is normal.                           
 Centralized testing ONLY happens after model aggregation, so the stats between
'->' are the same.                                                             
{                                                                              
    "100": {                                                                   
        "all_clients": {                                                       
            "test": {                                                          
                "loss": "0.1212 -> 0.0000",                                    
                "accuracy": "97.30% -> 0.00%"                                  
            }                                                                  
        }                                                                      
    },                                                                         
    "200": {                                                                   
        "all_clients": {                                                       
            "test": {                                                          
                "loss": "0.0867 -> 0.0000",                                    
                "accuracy": "97.92% -> 0.00%"                                  
            }                                                                  
        }                                                                      
    },                                                                         
    "300": {                                                                   
        "all_clients": {                                                       
            "test": {                                                          
                "loss": "0.0900 -> 0.0000",                                    
                "accuracy": "97.54% -> 0.00%"                                  
            }                                                                  
        }                                                                      
    },                                                                         
    "400": {                                                                   
        "all_clients": {                                                       
            "test": {                                                          
                "loss": "0.0786 -> 0.0000",                                    
                "accuracy": "97.85% -> 0.00%"                                  
            }                                                                  
        }                                                                      
    }                                                                          
}                                                                              
==================== FedRoD Max Accuracy ====================                  
all_clients:                                                                   
(test) before fine-tuning: 97.92% at epoch 200                                 
(test) after fine-tuning: 0.00% at epoch 100                                   
[0m