==================== FedRoD ====================                               
Experiment Arguments:                                                          
{
│   'method': 'fedrod',
│   'dataset': {
│   │   'name': 'medmnistA',
│   │   'client_num': 100,
│   │   'test_ratio': 0.25,
│   │   'val_ratio': 0.0,
│   │   'seed': 42,
│   │   'split': 'sample',
│   │   'IID_ratio': 0.0,
│   │   'monitor_window_name_suffix': 'medmnistA-100clients-0%IID-Dir(0.1)-seed42',
│   │   'alpha': 0.1,
│   │   'min_samples_per_client': 10
│   },
│   'model': {
│   │   'name': 'lenet5',
│   │   'use_torchvision_pretrained_weights': True,
│   │   'external_model_weights_path': None
│   },
│   'optimizer': {
│   │   'lr': 0.01,
│   │   'dampening': 0,
│   │   'weight_decay': 0,
│   │   'momentum': 0,
│   │   'nesterov': False,
│   │   'name': 'sgd'
│   },
│   'mode': 'serial',
│   'parallel': {
│   │   'ray_cluster_addr': None,
│   │   'num_cpus': None,
│   │   'num_gpus': None,
│   │   'num_workers': 2
│   },
│   'common': {
│   │   'seed': 42,
│   │   'join_ratio': 0.1,
│   │   'global_epoch': 400,
│   │   'local_epoch': 5,
│   │   'batch_size': 32,
│   │   'reset_optimizer_on_global_epoch': True,
│   │   'straggler_ratio': 0,
│   │   'straggler_min_local_epoch': 0,
│   │   'buffers': 'global',
│   │   'client_side_evaluation': True,
│   │   'test': {
│   │   │   'client': {
│   │   │   │   'interval': 100,
│   │   │   │   'finetune_epoch': 0,
│   │   │   │   'train': False,
│   │   │   │   'val': False,
│   │   │   │   'test': True
│   │   │   },
│   │   │   'server': {
│   │   │   │   'interval': -1,
│   │   │   │   'train': False,
│   │   │   │   'val': False,
│   │   │   │   'test': False,
│   │   │   │   'model_in_train_mode': False
│   │   │   }
│   │   },
│   │   'verbose_gap': 10,
│   │   'monitor': None,
│   │   'use_cuda': True,
│   │   'save_log': True,
│   │   'save_model': False,
│   │   'save_learning_curve_plot': False,
│   │   'save_metrics': True,
│   │   'delete_useless_run': True
│   },
│   'fedrod': {
│   │   'gamma': 1,
│   │   'hyper': 0,
│   │   'hyper_lr': 0.1,
│   │   'hyper_hidden_dim': 32,
│   │   'eval_per': 1
│   }
}
---------------------------- TRAINING EPOCH: 10 ----------------------------   
client [77] (testset)   loss: 1.3825 -> 0.9713  accuracy: 58.33% -> 58.33%     
client [81] (testset)   loss: 0.8602 -> 0.8013  accuracy: 54.74% -> 43.60%     
client [21] (testset)   loss: 3.3625 -> 0.8867  accuracy: 2.91% -> 53.44%      
client [68] (testset)   loss: 0.1598 -> 0.0166  accuracy: 100.00% -> 100.00%   
client [93] (testset)   loss: 0.8955 -> 0.7023  accuracy: 88.89% -> 88.89%     
client [31] (testset)   loss: 2.7734 -> 1.4110  accuracy: 15.00% -> 55.00%     
client [20] (testset)   loss: 0.6121 -> 0.5713  accuracy: 88.08% -> 88.08%     
client [59] (testset)   loss: 6.7265 -> 0.9692  accuracy: 0.00% -> 52.00%      
client [48] (testset)   loss: 1.0082 -> 0.7338  accuracy: 74.14% -> 74.14%     
client [34] (testset)   loss: 1.4062 -> 1.3587  accuracy: 28.40% -> 37.04%     
---------------------------- TRAINING EPOCH: 20 ----------------------------   
client [69] (testset)   loss: 1.5902 -> 1.0433  accuracy: 63.83% -> 63.83%     
client [99] (testset)   loss: 1.2011 -> 1.1869  accuracy: 63.53% -> 63.53%     
client [67] (testset)   loss: 1.1656 -> 1.1787  accuracy: 55.29% -> 55.29%     
client [0]  (testset)   loss: 0.9225 -> 0.9073  accuracy: 60.35% -> 60.35%     
client [76] (testset)   loss: 1.3070 -> 1.2952  accuracy: 52.13% -> 52.13%     
client [41] (testset)   loss: 0.9463 -> 0.8334  accuracy: 59.15% -> 59.15%     
client [62] (testset)   loss: 5.3039 -> 1.1960  accuracy: 10.00% -> 65.00%     
client [2]  (testset)   loss: 3.1532 -> 1.6784  accuracy: 13.57% -> 37.14%     
client [14] (testset)   loss: 0.1897 -> 0.1834  accuracy: 97.22% -> 97.22%     
client [46] (testset)   loss: 0.8316 -> 0.8412  accuracy: 59.30% -> 59.30%     
---------------------------- TRAINING EPOCH: 30 ----------------------------   
client [24] (testset)   loss: 0.1599 -> 0.1592  accuracy: 96.84% -> 96.84%     
client [68] (testset)   loss: 0.0172 -> 0.0184  accuracy: 100.00% -> 100.00%   
client [57] (testset)   loss: 0.5786 -> 0.6890  accuracy: 79.69% -> 79.69%     
client [17] (testset)   loss: 1.5349 -> 1.4716  accuracy: 21.54% -> 21.54%     
client [54] (testset)   loss: 0.8163 -> 0.6631  accuracy: 80.00% -> 80.00%     
client [23] (testset)   loss: 4.6503 -> 1.1790  accuracy: 0.00% -> 36.67%      
client [35] (testset)   loss: 1.2365 -> 1.1737  accuracy: 46.30% -> 46.30%     
client [59] (testset)   loss: 1.1947 -> 0.9385  accuracy: 52.00% -> 52.00%     
client [31] (testset)   loss: 1.5121 -> 1.3936  accuracy: 55.00% -> 55.00%     
client [9]  (testset)   loss: 0.6567 -> 0.7301  accuracy: 83.44% -> 83.44%     
---------------------------- TRAINING EPOCH: 40 ----------------------------   
client [64] (testset)   loss: 0.9433 -> 0.9883  accuracy: 66.67% -> 66.67%     
client [33] (testset)   loss: 0.6760 -> 0.6838  accuracy: 75.00% -> 75.00%     
client [16] (testset)   loss: 0.3010 -> 0.3115  accuracy: 92.63% -> 92.63%     
client [44] (testset)   loss: 1.3339 -> 1.5426  accuracy: 30.77% -> 61.54%     
client [8]  (testset)   loss: 1.7709 -> 1.7884  accuracy: 40.91% -> 40.91%     
client [31] (testset)   loss: 1.3871 -> 1.3949  accuracy: 55.00% -> 55.00%     
client [47] (testset)   loss: 1.0489 -> 0.9923  accuracy: 48.19% -> 48.19%     
client [36] (testset)   loss: 1.4902 -> 1.4331  accuracy: 30.00% -> 30.00%     
client [20] (testset)   loss: 0.5718 -> 0.5865  accuracy: 88.08% -> 88.08%     
client [56] (testset)   loss: 1.8174 -> 1.5773  accuracy: 18.03% -> 44.26%     
---------------------------- TRAINING EPOCH: 50 ----------------------------   
client [4]  (testset)   loss: 0.9168 -> 0.8748  accuracy: 76.74% -> 76.74%     
client [60] (testset)   loss: 0.2242 -> 0.1702  accuracy: 96.62% -> 96.62%     
client [28] (testset)   loss: 0.9515 -> 0.9587  accuracy: 73.37% -> 73.37%     
client [25] (testset)   loss: 0.9018 -> 0.7737  accuracy: 73.02% -> 73.02%     
client [58] (testset)   loss: 0.2441 -> 0.2258  accuracy: 94.34% -> 94.34%     
client [44] (testset)   loss: 1.3504 -> 1.6975  accuracy: 61.54% -> 61.54%     
client [39] (testset)   loss: 1.7073 -> 1.5567  accuracy: 43.40% -> 43.40%     
client [29] (testset)   loss: 0.9191 -> 0.9087  accuracy: 73.87% -> 73.87%     
client [3]  (testset)   loss: 0.9550 -> 0.7244  accuracy: 63.64% -> 63.64%     
client [84] (testset)   loss: 0.8190 -> 0.8296  accuracy: 56.96% -> 40.51%     
---------------------------- TRAINING EPOCH: 60 ----------------------------   
client [21] (testset)   loss: 0.9192 -> 0.8950  accuracy: 53.44% -> 53.44%     
client [84] (testset)   loss: 0.8103 -> 0.8065  accuracy: 56.96% -> 56.96%     
client [10] (testset)   loss: 0.9941 -> 0.9315  accuracy: 53.62% -> 53.62%     
client [36] (testset)   loss: 1.4098 -> 1.4036  accuracy: 37.50% -> 37.50%     
client [65] (testset)   loss: 0.6385 -> 0.5711  accuracy: 83.56% -> 83.56%     
client [81] (testset)   loss: 0.7951 -> 0.8029  accuracy: 54.74% -> 54.74%     
client [79] (testset)   loss: 0.9944 -> 0.9478  accuracy: 77.78% -> 77.78%     
client [42] (testset)   loss: 1.1108 -> 1.1207  accuracy: 58.33% -> 58.33%     
client [11] (testset)   loss: 1.1789 -> 1.1662  accuracy: 50.88% -> 50.88%     
client [96] (testset)   loss: 1.2102 -> 1.2089  accuracy: 55.39% -> 55.39%     
---------------------------- TRAINING EPOCH: 70 ----------------------------   
client [8]  (testset)   loss: 1.7602 -> 1.7395  accuracy: 40.91% -> 40.91%     
client [53] (testset)   loss: 0.3678 -> 0.2287  accuracy: 94.85% -> 94.85%     
client [52] (testset)   loss: 0.8768 -> 0.8832  accuracy: 75.22% -> 75.22%     
client [42] (testset)   loss: 1.1611 -> 1.1228  accuracy: 58.33% -> 58.33%     
client [69] (testset)   loss: 1.0472 -> 1.0597  accuracy: 63.83% -> 63.83%     
client [59] (testset)   loss: 0.9640 -> 0.9420  accuracy: 52.00% -> 52.00%     
client [7]  (testset)   loss: 0.4769 -> 0.4825  accuracy: 88.85% -> 88.85%     
client [26] (testset)   loss: 1.2901 -> 1.2455  accuracy: 50.53% -> 50.53%     
client [49] (testset)   loss: 0.7473 -> 0.7335  accuracy: 79.77% -> 79.77%     
client [98] (testset)   loss: 0.9459 -> 0.9445  accuracy: 74.68% -> 74.68%     
---------------------------- TRAINING EPOCH: 80 ----------------------------   
client [98] (testset)   loss: 0.9875 -> 0.9431  accuracy: 74.68% -> 74.68%     
client [47] (testset)   loss: 0.9917 -> 1.0019  accuracy: 48.19% -> 48.19%     
client [21] (testset)   loss: 0.9514 -> 0.8906  accuracy: 53.44% -> 53.44%     
client [77] (testset)   loss: 0.9741 -> 0.9877  accuracy: 58.33% -> 58.33%     
client [95] (testset)   loss: 0.3214 -> 0.3213  accuracy: 94.83% -> 94.83%     
client [91] (testset)   loss: 0.6961 -> 0.5550  accuracy: 88.24% -> 88.24%     
client [14] (testset)   loss: 0.1565 -> 0.1562  accuracy: 97.22% -> 97.22%     
client [99] (testset)   loss: 1.2679 -> 1.1715  accuracy: 63.53% -> 63.53%     
client [20] (testset)   loss: 0.5687 -> 0.6963  accuracy: 88.08% -> 88.08%     
client [39] (testset)   loss: 1.6321 -> 1.5614  accuracy: 43.40% -> 43.40%     
---------------------------- TRAINING EPOCH: 90 ----------------------------   
client [52] (testset)   loss: 0.8777 -> 0.8804  accuracy: 75.22% -> 75.22%     
client [62] (testset)   loss: 0.8990 -> 0.9009  accuracy: 65.00% -> 65.00%     
client [71] (testset)   loss: 1.2756 -> 1.2560  accuracy: 50.00% -> 50.00%     
client [97] (testset)   loss: 1.3434 -> 1.3199  accuracy: 47.72% -> 47.72%     
client [30] (testset)   loss: 0.9022 -> 0.9305  accuracy: 41.43% -> 41.43%     
client [88] (testset)   loss: 1.1483 -> 1.1006  accuracy: 67.57% -> 67.57%     
client [60] (testset)   loss: 0.1830 -> 0.1768  accuracy: 96.62% -> 96.62%     
client [82] (testset)   loss: 1.5410 -> 1.6220  accuracy: 46.51% -> 46.51%     
client [91] (testset)   loss: 0.9388 -> 0.5888  accuracy: 88.24% -> 88.24%     
client [57] (testset)   loss: 0.5575 -> 0.5692  accuracy: 79.69% -> 79.69%     
---------------------------- TRAINING EPOCH: 100 ----------------------------  
client [31] (testset)   loss: 1.3666 -> 1.3933  accuracy: 55.00% -> 55.00%     
client [15] (testset)   loss: 0.8553 -> 0.8553  accuracy: 76.47% -> 76.47%     
client [71] (testset)   loss: 1.2588 -> 1.2620  accuracy: 50.00% -> 50.00%     
client [97] (testset)   loss: 1.3099 -> 1.3260  accuracy: 47.72% -> 47.72%     
client [53] (testset)   loss: 0.2494 -> 0.2287  accuracy: 94.85% -> 94.85%     
client [77] (testset)   loss: 1.0331 -> 0.9747  accuracy: 58.33% -> 58.33%     
client [76] (testset)   loss: 1.3410 -> 1.2712  accuracy: 52.13% -> 52.13%     
client [79] (testset)   loss: 0.9832 -> 1.0268  accuracy: 77.78% -> 77.78%     
client [28] (testset)   loss: 0.9600 -> 0.9560  accuracy: 73.37% -> 73.37%     
client [99] (testset)   loss: 1.1751 -> 1.1696  accuracy: 63.53% -> 63.53%     
---------------------------- TRAINING EPOCH: 110 ----------------------------  
client [97] (testset)   loss: 1.3301 -> 1.3382  accuracy: 47.72% -> 47.72%     
client [86] (testset)   loss: 0.5180 -> 0.5268  accuracy: 84.66% -> 84.66%     
client [34] (testset)   loss: 1.3487 -> 1.3525  accuracy: 37.04% -> 37.04%     
client [73] (testset)   loss: 0.7494 -> 0.7402  accuracy: 58.95% -> 58.95%     
client [5]  (testset)   loss: 1.4809 -> 1.4596  accuracy: 43.96% -> 43.96%     
client [96] (testset)   loss: 1.2248 -> 1.2073  accuracy: 55.39% -> 55.39%     
client [22] (testset)   loss: 0.5025 -> 0.4136  accuracy: 89.95% -> 89.95%     
client [60] (testset)   loss: 0.1793 -> 0.1761  accuracy: 96.62% -> 96.62%     
client [66] (testset)   loss: 1.0660 -> 1.0628  accuracy: 50.78% -> 50.78%     
client [83] (testset)   loss: 0.7161 -> 0.6573  accuracy: 85.00% -> 85.00%     
---------------------------- TRAINING EPOCH: 120 ----------------------------  
client [76] (testset)   loss: 1.2782 -> 1.2743  accuracy: 52.13% -> 52.13%     
client [65] (testset)   loss: 0.6090 -> 0.5726  accuracy: 83.56% -> 83.56%     
client [95] (testset)   loss: 0.3235 -> 0.2988  accuracy: 94.83% -> 94.83%     
client [17] (testset)   loss: 1.4649 -> 1.5292  accuracy: 21.54% -> 27.69%     
client [8]  (testset)   loss: 1.7236 -> 1.6966  accuracy: 40.91% -> 40.91%     
client [35] (testset)   loss: 1.1690 -> 1.1696  accuracy: 46.30% -> 46.30%     
client [98] (testset)   loss: 0.9493 -> 0.9412  accuracy: 74.68% -> 74.68%     
client [53] (testset)   loss: 0.2408 -> 0.2320  accuracy: 94.85% -> 94.85%     
client [43] (testset)   loss: 0.3236 -> 0.3176  accuracy: 93.29% -> 93.29%     
client [64] (testset)   loss: 0.8780 -> 0.9093  accuracy: 66.67% -> 66.67%     
---------------------------- TRAINING EPOCH: 130 ----------------------------  
client [21] (testset)   loss: 0.9009 -> 0.9064  accuracy: 53.44% -> 53.44%     
client [88] (testset)   loss: 1.0842 -> 1.0982  accuracy: 67.57% -> 67.57%     
client [38] (testset)   loss: 1.0695 -> 1.0649  accuracy: 66.67% -> 66.67%     
client [3]  (testset)   loss: 0.7464 -> 0.7319  accuracy: 63.64% -> 63.64%     
client [5]  (testset)   loss: 1.4613 -> 1.4805  accuracy: 43.96% -> 43.96%     
client [41] (testset)   loss: 0.8409 -> 0.8561  accuracy: 59.15% -> 59.15%     
client [7]  (testset)   loss: 0.4746 -> 0.4847  accuracy: 88.85% -> 88.85%     
client [37] (testset)   loss: 0.4727 -> 0.4841  accuracy: 87.45% -> 87.45%     
client [45] (testset)   loss: 1.5758 -> 1.5521  accuracy: 44.00% -> 44.00%     
client [47] (testset)   loss: 1.0109 -> 0.9918  accuracy: 48.19% -> 48.19%     
---------------------------- TRAINING EPOCH: 140 ----------------------------  
client [16] (testset)   loss: 0.2967 -> 0.2968  accuracy: 92.63% -> 92.63%     
client [11] (testset)   loss: 1.2425 -> 1.1670  accuracy: 50.88% -> 50.88%     
client [37] (testset)   loss: 0.4857 -> 0.4818  accuracy: 87.45% -> 87.45%     
client [41] (testset)   loss: 0.8348 -> 0.8436  accuracy: 59.15% -> 59.15%     
client [95] (testset)   loss: 0.3010 -> 0.2998  accuracy: 94.83% -> 94.83%     
client [53] (testset)   loss: 0.2317 -> 0.2281  accuracy: 94.85% -> 94.85%     
client [22] (testset)   loss: 0.4125 -> 0.4312  accuracy: 89.95% -> 89.95%     
client [25] (testset)   loss: 0.8182 -> 0.7593  accuracy: 73.02% -> 73.02%     
client [69] (testset)   loss: 1.0516 -> 1.0496  accuracy: 63.83% -> 63.83%     
client [46] (testset)   loss: 0.8451 -> 0.8952  accuracy: 59.30% -> 59.30%     
---------------------------- TRAINING EPOCH: 150 ----------------------------  
client [47] (testset)   loss: 0.9886 -> 0.9905  accuracy: 48.19% -> 48.19%     
client [69] (testset)   loss: 1.1297 -> 1.0590  accuracy: 63.83% -> 63.83%     
client [82] (testset)   loss: 1.5621 -> 1.5317  accuracy: 46.51% -> 46.51%     
client [45] (testset)   loss: 1.5685 -> 1.5568  accuracy: 44.00% -> 44.00%     
client [7]  (testset)   loss: 0.4735 -> 0.4752  accuracy: 88.85% -> 88.85%     
client [50] (testset)   loss: 0.6788 -> 0.6745  accuracy: 79.27% -> 79.27%     
client [35] (testset)   loss: 1.1917 -> 1.1709  accuracy: 32.87% -> 46.30%     
client [24] (testset)   loss: 0.2145 -> 0.1603  accuracy: 96.84% -> 96.84%     
client [15] (testset)   loss: 0.8866 -> 0.8675  accuracy: 76.47% -> 76.47%     
client [58] (testset)   loss: 0.2284 -> 0.2303  accuracy: 94.34% -> 94.34%     
---------------------------- TRAINING EPOCH: 160 ----------------------------  
client [48] (testset)   loss: 0.7344 -> 0.7385  accuracy: 74.14% -> 74.14%     
client [76] (testset)   loss: 1.2835 -> 1.2747  accuracy: 52.13% -> 52.13%     
client [67] (testset)   loss: 1.1902 -> 1.1366  accuracy: 55.29% -> 55.29%     
client [37] (testset)   loss: 0.4881 -> 0.5116  accuracy: 87.45% -> 87.45%     
client [58] (testset)   loss: 0.2238 -> 0.2290  accuracy: 94.34% -> 94.34%     
client [64] (testset)   loss: 0.8756 -> 0.8886  accuracy: 66.67% -> 66.67%     
client [77] (testset)   loss: 1.1124 -> 1.0131  accuracy: 58.33% -> 58.33%     
client [55] (testset)   loss: 1.8893 -> 1.8736  accuracy: 50.00% -> 50.00%     
client [12] (testset)   loss: 0.5493 -> 0.5179  accuracy: 86.14% -> 86.14%     
client [89] (testset)   loss: 1.9195 -> 1.9426  accuracy: 18.75% -> 18.75%     
---------------------------- TRAINING EPOCH: 170 ----------------------------  
client [84] (testset)   loss: 0.8091 -> 0.8028  accuracy: 56.96% -> 56.96%     
client [51] (testset)   loss: 0.8010 -> 0.8010  accuracy: 66.67% -> 66.67%     
client [8]  (testset)   loss: 1.6977 -> 1.6699  accuracy: 40.91% -> 40.91%     
client [18] (testset)   loss: 0.9269 -> 0.9273  accuracy: 65.38% -> 65.38%     
client [94] (testset)   loss: 1.3776 -> 1.4713  accuracy: 50.00% -> 50.00%     
client [81] (testset)   loss: 0.7987 -> 0.7901  accuracy: 54.74% -> 54.74%     
client [3]  (testset)   loss: 0.7897 -> 0.7192  accuracy: 63.64% -> 63.64%     
client [11] (testset)   loss: 1.1693 -> 1.1720  accuracy: 50.88% -> 50.88%     
client [95] (testset)   loss: 0.4007 -> 0.3193  accuracy: 94.83% -> 94.83%     
client [67] (testset)   loss: 1.1447 -> 1.1680  accuracy: 55.29% -> 29.31%     
---------------------------- TRAINING EPOCH: 180 ----------------------------  
client [21] (testset)   loss: 0.8864 -> 0.8880  accuracy: 53.44% -> 53.44%     
client [79] (testset)   loss: 0.9798 -> 1.0225  accuracy: 77.78% -> 77.78%     
client [58] (testset)   loss: 0.2368 -> 0.2300  accuracy: 94.34% -> 94.34%     
client [88] (testset)   loss: 1.1091 -> 1.0797  accuracy: 67.57% -> 67.57%     
client [46] (testset)   loss: 0.8338 -> 0.8642  accuracy: 59.30% -> 59.30%     
client [11] (testset)   loss: 1.1913 -> 1.1726  accuracy: 50.88% -> 50.88%     
client [55] (testset)   loss: 1.6979 -> 1.8153  accuracy: 50.00% -> 50.00%     
client [13] (testset)   loss: 0.1227 -> 0.1285  accuracy: 97.78% -> 97.78%     
client [31] (testset)   loss: 1.3787 -> 1.3794  accuracy: 55.00% -> 55.00%     
client [75] (testset)   loss: 1.4738 -> 1.4340  accuracy: 29.15% -> 29.15%     
---------------------------- TRAINING EPOCH: 190 ----------------------------  
client [19] (testset)   loss: 1.5337 -> 1.5213  accuracy: 37.50% -> 37.50%     
client [7]  (testset)   loss: 0.4739 -> 0.4733  accuracy: 88.85% -> 88.85%     
client [57] (testset)   loss: 0.5934 -> 0.5447  accuracy: 79.69% -> 79.69%     
client [13] (testset)   loss: 0.1238 -> 0.1302  accuracy: 97.78% -> 97.78%     
client [43] (testset)   loss: 0.3166 -> 0.3178  accuracy: 93.29% -> 93.29%     
client [91] (testset)   loss: 0.6684 -> 0.5951  accuracy: 88.24% -> 88.24%     
client [10] (testset)   loss: 0.9552 -> 0.9396  accuracy: 53.62% -> 53.62%     
client [64] (testset)   loss: 0.8017 -> 0.8937  accuracy: 66.67% -> 66.67%     
client [82] (testset)   loss: 1.6295 -> 1.5676  accuracy: 46.51% -> 46.51%     
client [22] (testset)   loss: 0.4986 -> 0.4343  accuracy: 89.95% -> 89.95%     
---------------------------- TRAINING EPOCH: 200 ----------------------------  
client [20] (testset)   loss: 0.5719 -> 0.5823  accuracy: 88.08% -> 88.08%     
client [23] (testset)   loss: 0.9430 -> 0.9553  accuracy: 56.67% -> 56.67%     
client [88] (testset)   loss: 1.0788 -> 1.0773  accuracy: 67.57% -> 67.57%     
client [98] (testset)   loss: 0.9760 -> 0.9506  accuracy: 74.68% -> 74.68%     
client [79] (testset)   loss: 1.0040 -> 1.0255  accuracy: 77.78% -> 77.78%     
client [21] (testset)   loss: 0.8910 -> 0.8745  accuracy: 53.44% -> 53.44%     
client [92] (testset)   loss: 0.8629 -> 0.8399  accuracy: 63.64% -> 63.64%     
client [56] (testset)   loss: 1.5809 -> 1.6015  accuracy: 16.39% -> 16.39%     
client [5]  (testset)   loss: 1.4540 -> 1.4508  accuracy: 43.96% -> 43.96%     
client [52] (testset)   loss: 0.8797 -> 0.8697  accuracy: 75.22% -> 75.22%     
---------------------------- TRAINING EPOCH: 210 ----------------------------  
client [67] (testset)   loss: 1.2086 -> 1.1724  accuracy: 55.29% -> 55.29%     
client [54] (testset)   loss: 0.7410 -> 0.6580  accuracy: 80.00% -> 80.00%     
client [14] (testset)   loss: 0.1618 -> 0.1566  accuracy: 97.22% -> 97.22%     
client [99] (testset)   loss: 1.2210 -> 1.1660  accuracy: 63.53% -> 63.53%     
client [36] (testset)   loss: 1.4069 -> 1.4002  accuracy: 37.50% -> 37.50%     
client [30] (testset)   loss: 0.9064 -> 0.8903  accuracy: 54.29% -> 54.29%     
client [38] (testset)   loss: 1.1848 -> 1.0655  accuracy: 66.67% -> 66.67%     
client [15] (testset)   loss: 0.8644 -> 0.8702  accuracy: 76.47% -> 76.47%     
client [6]  (testset)   loss: 1.0970 -> 1.0893  accuracy: 47.09% -> 47.09%     
client [53] (testset)   loss: 0.2311 -> 0.2272  accuracy: 94.85% -> 94.85%     
---------------------------- TRAINING EPOCH: 220 ----------------------------  
client [99] (testset)   loss: 1.1647 -> 1.1674  accuracy: 63.53% -> 63.53%     
client [6]  (testset)   loss: 1.0905 -> 1.0919  accuracy: 47.09% -> 47.09%     
client [83] (testset)   loss: 0.6644 -> 0.6413  accuracy: 85.00% -> 85.00%     
client [42] (testset)   loss: 1.1366 -> 1.1273  accuracy: 58.33% -> 58.33%     
client [34] (testset)   loss: 1.3449 -> 1.3528  accuracy: 37.04% -> 37.04%     
client [15] (testset)   loss: 0.8871 -> 0.8622  accuracy: 76.47% -> 76.47%     
client [47] (testset)   loss: 1.0347 -> 0.9933  accuracy: 48.19% -> 48.19%     
client [55] (testset)   loss: 1.7028 -> 1.8034  accuracy: 50.00% -> 50.00%     
client [51] (testset)   loss: 0.8175 -> 0.8211  accuracy: 66.67% -> 66.67%     
client [95] (testset)   loss: 0.2977 -> 0.2926  accuracy: 94.83% -> 94.83%     
---------------------------- TRAINING EPOCH: 230 ----------------------------  
client [71] (testset)   loss: 1.2997 -> 1.2713  accuracy: 25.00% -> 50.00%     
client [15] (testset)   loss: 0.8555 -> 0.8613  accuracy: 76.47% -> 76.47%     
client [33] (testset)   loss: 0.7259 -> 0.6914  accuracy: 75.00% -> 75.00%     
client [99] (testset)   loss: 1.2099 -> 1.1675  accuracy: 63.53% -> 63.53%     
client [90] (testset)   loss: 1.0902 -> 1.0844  accuracy: 50.00% -> 50.00%     
client [57] (testset)   loss: 0.7859 -> 0.5896  accuracy: 19.53% -> 79.69%     
client [27] (testset)   loss: 0.6542 -> 0.6535  accuracy: 82.43% -> 82.43%     
client [78] (testset)   loss: 0.6147 -> 0.6346  accuracy: 84.72% -> 84.72%     
client [36] (testset)   loss: 1.4247 -> 1.3991  accuracy: 37.50% -> 37.50%     
client [88] (testset)   loss: 1.1084 -> 1.0843  accuracy: 67.57% -> 67.57%     
---------------------------- TRAINING EPOCH: 240 ----------------------------  
client [70] (testset)   loss: 1.5799 -> 1.6386  accuracy: 27.78% -> 27.78%     
client [35] (testset)   loss: 1.1698 -> 1.1799  accuracy: 46.30% -> 46.30%     
client [16] (testset)   loss: 0.3148 -> 0.2975  accuracy: 92.63% -> 92.63%     
client [80] (testset)   loss: 0.7163 -> 0.7144  accuracy: 82.81% -> 82.81%     
client [38] (testset)   loss: 1.0533 -> 1.0418  accuracy: 66.67% -> 66.67%     
client [78] (testset)   loss: 0.6154 -> 0.6176  accuracy: 84.72% -> 84.72%     
client [68] (testset)   loss: 0.0335 -> 0.0141  accuracy: 100.00% -> 100.00%   
client [11] (testset)   loss: 1.1891 -> 1.1662  accuracy: 50.88% -> 50.88%     
client [64] (testset)   loss: 0.7947 -> 0.8867  accuracy: 66.67% -> 66.67%     
client [82] (testset)   loss: 1.5643 -> 1.4994  accuracy: 46.51% -> 46.51%     
---------------------------- TRAINING EPOCH: 250 ----------------------------  
client [30] (testset)   loss: 0.8996 -> 0.8939  accuracy: 54.29% -> 54.29%     
client [27] (testset)   loss: 0.6548 -> 0.6532  accuracy: 82.43% -> 82.43%     
client [74] (testset)   loss: 0.7941 -> 0.8025  accuracy: 75.76% -> 75.76%     
client [45] (testset)   loss: 1.5572 -> 1.5530  accuracy: 44.00% -> 44.00%     
client [6]  (testset)   loss: 1.0913 -> 1.1032  accuracy: 47.09% -> 47.09%     
client [36] (testset)   loss: 1.4087 -> 1.3995  accuracy: 37.50% -> 37.50%     
client [63] (testset)   loss: 0.2817 -> 0.2083  accuracy: 96.00% -> 96.00%     
client [76] (testset)   loss: 1.2699 -> 1.2702  accuracy: 52.13% -> 52.13%     
client [83] (testset)   loss: 0.6776 -> 0.6446  accuracy: 85.00% -> 85.00%     
client [86] (testset)   loss: 0.5349 -> 0.5094  accuracy: 84.66% -> 84.66%     
---------------------------- TRAINING EPOCH: 260 ----------------------------  
client [83] (testset)   loss: 0.6407 -> 0.6436  accuracy: 85.00% -> 85.00%     
client [99] (testset)   loss: 1.2042 -> 1.1729  accuracy: 63.53% -> 63.53%     
client [74] (testset)   loss: 0.8067 -> 0.7850  accuracy: 75.76% -> 75.76%     
client [73] (testset)   loss: 0.7422 -> 0.7360  accuracy: 58.95% -> 58.95%     
client [29] (testset)   loss: 0.9074 -> 0.9098  accuracy: 73.87% -> 73.87%     
client [92] (testset)   loss: 0.8174 -> 1.0860  accuracy: 63.64% -> 63.64%     
client [6]  (testset)   loss: 1.1253 -> 1.0909  accuracy: 47.09% -> 47.09%     
client [61] (testset)   loss: 1.3296 -> 1.3604  accuracy: 53.85% -> 53.85%     
client [21] (testset)   loss: 0.8908 -> 0.8764  accuracy: 53.44% -> 53.44%     
client [67] (testset)   loss: 1.1625 -> 1.1561  accuracy: 55.29% -> 55.29%     
---------------------------- TRAINING EPOCH: 270 ----------------------------  
client [83] (testset)   loss: 0.6706 -> 0.6400  accuracy: 85.00% -> 85.00%     
client [32] (testset)   loss: 1.2839 -> 1.2803  accuracy: 47.22% -> 47.22%     
client [95] (testset)   loss: 0.3266 -> 0.2988  accuracy: 94.83% -> 94.83%     
client [61] (testset)   loss: 1.3827 -> 1.4017  accuracy: 53.85% -> 53.85%     
client [27] (testset)   loss: 0.6784 -> 0.6558  accuracy: 82.43% -> 82.43%     
client [25] (testset)   loss: 0.8304 -> 0.8014  accuracy: 73.02% -> 73.02%     
client [68] (testset)   loss: 0.0255 -> 0.0153  accuracy: 100.00% -> 100.00%   
client [34] (testset)   loss: 1.3549 -> 1.3468  accuracy: 37.04% -> 37.04%     
client [71] (testset)   loss: 1.2548 -> 1.2868  accuracy: 50.00% -> 50.00%     
client [89] (testset)   loss: 1.9212 -> 1.9383  accuracy: 18.75% -> 18.75%     
---------------------------- TRAINING EPOCH: 280 ----------------------------  
client [78] (testset)   loss: 0.6245 -> 0.6114  accuracy: 84.72% -> 84.72%     
client [81] (testset)   loss: 0.7956 -> 0.7917  accuracy: 54.74% -> 54.74%     
client [51] (testset)   loss: 0.8534 -> 0.8074  accuracy: 66.67% -> 66.67%     
client [54] (testset)   loss: 0.7371 -> 0.6575  accuracy: 80.00% -> 80.00%     
client [65] (testset)   loss: 0.5676 -> 0.5673  accuracy: 83.56% -> 83.56%     
client [41] (testset)   loss: 0.8250 -> 0.8267  accuracy: 59.15% -> 59.15%     
client [11] (testset)   loss: 1.1838 -> 1.1745  accuracy: 50.88% -> 50.88%     
client [85] (testset)   loss: 1.0811 -> 1.0359  accuracy: 66.67% -> 66.67%     
client [12] (testset)   loss: 0.5164 -> 0.5170  accuracy: 86.14% -> 86.14%     
client [23] (testset)   loss: 0.9424 -> 0.9205  accuracy: 56.67% -> 56.67%     
---------------------------- TRAINING EPOCH: 290 ----------------------------  
client [16] (testset)   loss: 0.2976 -> 0.2977  accuracy: 92.63% -> 92.63%     
client [65] (testset)   loss: 0.5679 -> 0.5750  accuracy: 83.56% -> 83.56%     
client [53] (testset)   loss: 0.2332 -> 0.2284  accuracy: 94.85% -> 94.85%     
client [58] (testset)   loss: 0.2230 -> 0.2353  accuracy: 94.34% -> 94.34%     
client [72] (testset)   loss: 1.1988 -> 1.3006  accuracy: 55.88% -> 26.47%     
client [7]  (testset)   loss: 0.4713 -> 0.4794  accuracy: 88.85% -> 88.85%     
client [71] (testset)   loss: 1.2864 -> 1.2793  accuracy: 50.00% -> 50.00%     
client [59] (testset)   loss: 0.9325 -> 0.9356  accuracy: 52.00% -> 52.00%     
client [86] (testset)   loss: 0.5120 -> 0.5161  accuracy: 84.66% -> 84.66%     
client [39] (testset)   loss: 1.5877 -> 1.5816  accuracy: 43.40% -> 43.40%     
---------------------------- TRAINING EPOCH: 300 ----------------------------  
client [99] (testset)   loss: 1.1764 -> 1.1667  accuracy: 63.53% -> 63.53%     
client [7]  (testset)   loss: 0.4728 -> 0.4716  accuracy: 88.85% -> 88.85%     
client [17] (testset)   loss: 1.5113 -> 1.4562  accuracy: 21.54% -> 27.69%     
client [64] (testset)   loss: 0.8277 -> 0.8813  accuracy: 66.67% -> 66.67%     
client [37] (testset)   loss: 0.4746 -> 0.4718  accuracy: 87.45% -> 87.45%     
client [29] (testset)   loss: 0.9086 -> 0.9245  accuracy: 73.87% -> 73.87%     
client [93] (testset)   loss: 0.5725 -> 0.6090  accuracy: 88.89% -> 88.89%     
client [73] (testset)   loss: 0.7348 -> 0.7421  accuracy: 58.95% -> 58.95%     
client [40] (testset)   loss: 1.2028 -> 1.2242  accuracy: 65.17% -> 65.17%     
client [76] (testset)   loss: 1.2950 -> 1.2702  accuracy: 52.13% -> 52.13%     
---------------------------- TRAINING EPOCH: 310 ----------------------------  
client [31] (testset)   loss: 1.3601 -> 1.3775  accuracy: 55.00% -> 55.00%     
client [89] (testset)   loss: 1.9649 -> 1.9930  accuracy: 18.75% -> 18.75%     
client [77] (testset)   loss: 0.9848 -> 0.9884  accuracy: 58.33% -> 58.33%     
client [90] (testset)   loss: 1.0835 -> 1.0569  accuracy: 50.00% -> 50.00%     
client [26] (testset)   loss: 1.2388 -> 1.2477  accuracy: 50.53% -> 50.53%     
client [50] (testset)   loss: 0.6658 -> 0.6667  accuracy: 79.27% -> 79.27%     
client [30] (testset)   loss: 0.8989 -> 0.8963  accuracy: 54.29% -> 54.29%     
client [70] (testset)   loss: 1.6085 -> 1.6353  accuracy: 27.78% -> 27.78%     
client [41] (testset)   loss: 0.8328 -> 0.8262  accuracy: 59.15% -> 59.15%     
client [99] (testset)   loss: 1.1847 -> 1.1656  accuracy: 63.53% -> 63.53%     
---------------------------- TRAINING EPOCH: 320 ----------------------------  
client [68] (testset)   loss: 0.0280 -> 0.0180  accuracy: 100.00% -> 100.00%   
client [70] (testset)   loss: 1.6690 -> 1.7212  accuracy: 27.78% -> 27.78%     
client [52] (testset)   loss: 0.8829 -> 0.8703  accuracy: 75.22% -> 75.22%     
client [1]  (testset)   loss: 1.1095 -> 1.0961  accuracy: 57.84% -> 57.84%     
client [2]  (testset)   loss: 1.6504 -> 1.6356  accuracy: 37.14% -> 37.14%     
client [67] (testset)   loss: 1.1404 -> 1.1539  accuracy: 55.29% -> 55.29%     
client [92] (testset)   loss: 0.7991 -> 0.9198  accuracy: 63.64% -> 63.64%     
client [35] (testset)   loss: 1.1783 -> 1.1655  accuracy: 46.30% -> 46.30%     
client [36] (testset)   loss: 1.4024 -> 1.4014  accuracy: 37.50% -> 37.50%     
client [64] (testset)   loss: 0.8111 -> 0.8881  accuracy: 66.67% -> 66.67%     
---------------------------- TRAINING EPOCH: 330 ----------------------------  
client [44] (testset)   loss: 1.6168 -> 1.7033  accuracy: 61.54% -> 61.54%     
client [6]  (testset)   loss: 1.1019 -> 1.0943  accuracy: 47.09% -> 47.09%     
client [12] (testset)   loss: 0.5167 -> 0.5186  accuracy: 86.14% -> 86.14%     
client [55] (testset)   loss: 1.7209 -> 1.8209  accuracy: 50.00% -> 50.00%     
client [29] (testset)   loss: 0.9094 -> 0.9118  accuracy: 73.87% -> 73.87%     
client [9]  (testset)   loss: 0.6629 -> 0.6705  accuracy: 83.44% -> 83.44%     
client [43] (testset)   loss: 0.3362 -> 0.3179  accuracy: 93.29% -> 93.29%     
client [77] (testset)   loss: 0.9602 -> 1.0101  accuracy: 58.33% -> 58.33%     
client [98] (testset)   loss: 0.9616 -> 0.9542  accuracy: 74.68% -> 74.68%     
client [78] (testset)   loss: 0.6161 -> 0.6277  accuracy: 84.72% -> 84.72%     
---------------------------- TRAINING EPOCH: 340 ----------------------------  
client [92] (testset)   loss: 0.9670 -> 0.9733  accuracy: 63.64% -> 63.64%     
client [80] (testset)   loss: 0.7160 -> 0.7174  accuracy: 82.81% -> 82.81%     
client [63] (testset)   loss: 0.2035 -> 0.2041  accuracy: 96.00% -> 96.00%     
client [76] (testset)   loss: 1.2946 -> 1.2704  accuracy: 52.13% -> 52.13%     
client [78] (testset)   loss: 0.6148 -> 0.6393  accuracy: 84.72% -> 84.72%     
client [25] (testset)   loss: 0.7683 -> 0.8088  accuracy: 73.02% -> 73.02%     
client [58] (testset)   loss: 0.2292 -> 0.2338  accuracy: 94.34% -> 94.34%     
client [13] (testset)   loss: 0.1216 -> 0.1262  accuracy: 97.78% -> 97.78%     
client [17] (testset)   loss: 1.4868 -> 1.5346  accuracy: 38.46% -> 21.54%     
client [38] (testset)   loss: 1.0379 -> 1.0417  accuracy: 66.67% -> 66.67%     
---------------------------- TRAINING EPOCH: 350 ----------------------------  
client [72] (testset)   loss: 1.2890 -> 1.2804  accuracy: 26.47% -> 26.47%     
client [82] (testset)   loss: 1.6379 -> 1.5404  accuracy: 46.51% -> 46.51%     
client [86] (testset)   loss: 0.5093 -> 0.5060  accuracy: 84.66% -> 84.66%     
client [51] (testset)   loss: 0.8130 -> 0.8415  accuracy: 66.67% -> 66.67%     
client [96] (testset)   loss: 1.2230 -> 1.2033  accuracy: 55.39% -> 55.39%     
client [42] (testset)   loss: 1.1464 -> 1.1316  accuracy: 58.33% -> 58.33%     
client [55] (testset)   loss: 1.7906 -> 1.8354  accuracy: 50.00% -> 50.00%     
client [13] (testset)   loss: 0.1233 -> 0.1268  accuracy: 97.78% -> 97.78%     
client [1]  (testset)   loss: 1.1020 -> 1.0944  accuracy: 57.84% -> 57.84%     
client [12] (testset)   loss: 0.5167 -> 0.5230  accuracy: 86.14% -> 86.14%     
---------------------------- TRAINING EPOCH: 360 ----------------------------  
client [68] (testset)   loss: 0.0188 -> 0.0136  accuracy: 100.00% -> 100.00%   
client [23] (testset)   loss: 0.9237 -> 0.9508  accuracy: 56.67% -> 56.67%     
client [46] (testset)   loss: 0.8341 -> 0.8302  accuracy: 59.30% -> 59.30%     
client [41] (testset)   loss: 0.8546 -> 0.8382  accuracy: 59.15% -> 59.15%     
client [25] (testset)   loss: 0.7762 -> 0.7660  accuracy: 73.02% -> 73.02%     
client [58] (testset)   loss: 0.2320 -> 0.2265  accuracy: 94.34% -> 94.34%     
client [14] (testset)   loss: 0.1560 -> 0.1561  accuracy: 97.22% -> 97.22%     
client [33] (testset)   loss: 0.6769 -> 0.7182  accuracy: 75.00% -> 75.00%     
client [85] (testset)   loss: 1.0131 -> 1.0111  accuracy: 66.67% -> 66.67%     
client [62] (testset)   loss: 0.8958 -> 0.8955  accuracy: 65.00% -> 65.00%     
---------------------------- TRAINING EPOCH: 370 ----------------------------  
client [98] (testset)   loss: 0.9702 -> 0.9613  accuracy: 74.68% -> 74.68%     
client [63] (testset)   loss: 0.1992 -> 0.2027  accuracy: 96.00% -> 96.00%     
client [70] (testset)   loss: 1.7362 -> 1.6949  accuracy: 27.78% -> 27.78%     
client [65] (testset)   loss: 0.5694 -> 0.5653  accuracy: 83.56% -> 83.56%     
client [14] (testset)   loss: 0.1562 -> 0.1585  accuracy: 97.22% -> 97.22%     
client [73] (testset)   loss: 0.7389 -> 0.7411  accuracy: 58.95% -> 58.95%     
client [34] (testset)   loss: 1.3534 -> 1.3593  accuracy: 37.04% -> 28.40%     
client [99] (testset)   loss: 1.1751 -> 1.1699  accuracy: 63.53% -> 63.53%     
client [69] (testset)   loss: 1.0888 -> 1.0624  accuracy: 63.83% -> 63.83%     
client [46] (testset)   loss: 0.8266 -> 0.8316  accuracy: 59.30% -> 59.30%     
---------------------------- TRAINING EPOCH: 380 ----------------------------  
client [99] (testset)   loss: 1.1725 -> 1.1682  accuracy: 63.53% -> 63.53%     
client [93] (testset)   loss: 0.5708 -> 0.6087  accuracy: 88.89% -> 88.89%     
client [11] (testset)   loss: 1.2027 -> 1.1747  accuracy: 50.88% -> 50.88%     
client [58] (testset)   loss: 0.2495 -> 0.2276  accuracy: 94.34% -> 94.34%     
client [81] (testset)   loss: 0.7977 -> 0.7974  accuracy: 54.74% -> 54.74%     
client [85] (testset)   loss: 1.0827 -> 1.0437  accuracy: 66.67% -> 66.67%     
client [89] (testset)   loss: 1.9147 -> 1.9516  accuracy: 18.75% -> 18.75%     
client [45] (testset)   loss: 1.5498 -> 1.5499  accuracy: 44.00% -> 44.00%     
client [8]  (testset)   loss: 1.6806 -> 1.6994  accuracy: 40.91% -> 40.91%     
client [68] (testset)   loss: 0.0191 -> 0.0150  accuracy: 100.00% -> 100.00%   
---------------------------- TRAINING EPOCH: 390 ----------------------------  
client [67] (testset)   loss: 1.1571 -> 1.1223  accuracy: 55.29% -> 55.29%     
client [72] (testset)   loss: 1.2888 -> 1.2409  accuracy: 55.88% -> 55.88%     
client [1]  (testset)   loss: 1.1159 -> 1.1137  accuracy: 57.84% -> 57.84%     
client [78] (testset)   loss: 0.6120 -> 0.6189  accuracy: 84.72% -> 84.72%     
client [83] (testset)   loss: 0.6387 -> 0.6395  accuracy: 85.00% -> 85.00%     
client [21] (testset)   loss: 0.8847 -> 0.8738  accuracy: 53.44% -> 53.44%     
client [56] (testset)   loss: 1.5663 -> 1.6246  accuracy: 16.39% -> 16.39%     
client [44] (testset)   loss: 1.6050 -> 1.6693  accuracy: 61.54% -> 61.54%     
client [92] (testset)   loss: 0.8334 -> 0.7454  accuracy: 63.64% -> 63.64%     
client [27] (testset)   loss: 0.6628 -> 0.6658  accuracy: 82.43% -> 82.43%     
---------------------------- TRAINING EPOCH: 400 ----------------------------  
client [10] (testset)   loss: 0.9269 -> 0.9449  accuracy: 53.62% -> 53.62%     
client [39] (testset)   loss: 1.6000 -> 1.5787  accuracy: 43.40% -> 43.40%     
client [65] (testset)   loss: 0.5737 -> 0.5692  accuracy: 83.56% -> 83.56%     
client [26] (testset)   loss: 1.2411 -> 1.2419  accuracy: 50.53% -> 50.53%     
client [19] (testset)   loss: 1.5592 -> 1.5247  accuracy: 37.50% -> 37.50%     
client [68] (testset)   loss: 0.0264 -> 0.0189  accuracy: 100.00% -> 100.00%   
client [41] (testset)   loss: 0.8490 -> 0.8278  accuracy: 59.15% -> 59.15%     
client [50] (testset)   loss: 0.6677 -> 0.6692  accuracy: 79.27% -> 79.27%     
client [75] (testset)   loss: 1.4359 -> 1.4374  accuracy: 38.38% -> 29.15%     
client [81] (testset)   loss: 0.7936 -> 0.7957  accuracy: 54.74% -> 54.74%     
Training... ---------------------------------------- 100% 0:12:29
FedRoD's average time taken by each global epoch: 0 min 1.86 sec.              
FedRoD's total running time: 0 h 12 m 29 s.                                    
==================== FedRoD Experiment Results: ====================           
Display format: (before local fine-tuning) -> (after local fine-tuning)        
 So if finetune_epoch = 0, x.xx% -> 0.00% is normal.                           
 Centralized testing ONLY happens after model aggregation, so the stats between
'->' are the same.                                                             
{                                                                              
    "100": {                                                                   
        "all_clients": {                                                       
            "test": {                                                          
                "loss": "0.8640 -> 0.0000",                                    
                "accuracy": "67.47% -> 0.00%"                                  
            }                                                                  
        }                                                                      
    },                                                                         
    "200": {                                                                   
        "all_clients": {                                                       
            "test": {                                                          
                "loss": "0.8546 -> 0.0000",                                    
                "accuracy": "67.06% -> 0.00%"                                  
            }                                                                  
        }                                                                      
    },                                                                         
    "300": {                                                                   
        "all_clients": {                                                       
            "test": {                                                          
                "loss": "0.8485 -> 0.0000",                                    
                "accuracy": "67.43% -> 0.00%"                                  
            }                                                                  
        }                                                                      
    },                                                                         
    "400": {                                                                   
        "all_clients": {                                                       
            "test": {                                                          
                "loss": "0.8544 -> 0.0000",                                    
                "accuracy": "66.76% -> 0.00%"                                  
            }                                                                  
        }                                                                      
    }                                                                          
}                                                                              
==================== FedRoD Max Accuracy ====================                  
all_clients:                                                                   
(test) before fine-tuning: 67.47% at epoch 100                                 
(test) after fine-tuning: 0.00% at epoch 100                                   
[0m