==================== APFL ====================                                 
Experiment Arguments:                                                          
{
│   'method': 'apfl',
│   'dataset': {
│   │   'name': 'fmnist',
│   │   'client_num': 100,
│   │   'test_ratio': 0.25,
│   │   'val_ratio': 0.0,
│   │   'seed': 42,
│   │   'split': 'sample',
│   │   'IID_ratio': 0.0,
│   │   'monitor_window_name_suffix': 'fmnist-100clients-0%IID-Dir(0.5)-seed42',
│   │   'alpha': 0.5,
│   │   'min_samples_per_client': 10
│   },
│   'model': {
│   │   'name': 'avgcnn',
│   │   'use_torchvision_pretrained_weights': True,
│   │   'external_model_weights_path': None
│   },
│   'optimizer': {
│   │   'lr': 0.01,
│   │   'dampening': 0,
│   │   'weight_decay': 0,
│   │   'momentum': 0,
│   │   'nesterov': False,
│   │   'name': 'sgd'
│   },
│   'mode': 'serial',
│   'parallel': {
│   │   'ray_cluster_addr': None,
│   │   'num_cpus': None,
│   │   'num_gpus': None,
│   │   'num_workers': 2
│   },
│   'common': {
│   │   'seed': 42,
│   │   'join_ratio': 0.1,
│   │   'global_epoch': 400,
│   │   'local_epoch': 5,
│   │   'batch_size': 32,
│   │   'reset_optimizer_on_global_epoch': True,
│   │   'straggler_ratio': 0,
│   │   'straggler_min_local_epoch': 0,
│   │   'buffers': 'global',
│   │   'client_side_evaluation': True,
│   │   'test': {
│   │   │   'client': {
│   │   │   │   'interval': 100,
│   │   │   │   'finetune_epoch': 0,
│   │   │   │   'train': False,
│   │   │   │   'val': False,
│   │   │   │   'test': True
│   │   │   },
│   │   │   'server': {
│   │   │   │   'interval': -1,
│   │   │   │   'train': False,
│   │   │   │   'val': False,
│   │   │   │   'test': False,
│   │   │   │   'model_in_train_mode': False
│   │   │   }
│   │   },
│   │   'verbose_gap': 10,
│   │   'monitor': None,
│   │   'use_cuda': True,
│   │   'save_log': True,
│   │   'save_model': False,
│   │   'save_learning_curve_plot': False,
│   │   'save_metrics': True,
│   │   'delete_useless_run': True
│   },
│   'apfl': {
│   │   'alpha': 0.5,
│   │   'adaptive_alpha': 1
│   }
}
---------------------------- TRAINING EPOCH: 10 ----------------------------   
client [77] (testset)   loss: 0.5639 -> 0.4766  accuracy: 85.71% -> 84.00%     
client [81] (testset)   loss: 0.4439 -> 0.3463  accuracy: 89.83% -> 89.83%     
client [21] (testset)   loss: 0.7009 -> 0.5158  accuracy: 79.87% -> 86.79%     
client [68] (testset)   loss: 0.9213 -> 0.5470  accuracy: 63.04% -> 76.71%     
client [93] (testset)   loss: 0.9001 -> 0.9364  accuracy: 64.69% -> 61.19%     
client [31] (testset)   loss: 0.6372 -> 0.5358  accuracy: 83.22% -> 83.22%     
client [20] (testset)   loss: 0.3489 -> 0.2974  accuracy: 91.02% -> 89.39%     
client [59] (testset)   loss: 0.6576 -> 0.7233  accuracy: 83.33% -> 78.70%     
client [48] (testset)   loss: 0.8184 -> 0.6719  accuracy: 69.92% -> 70.73%     
client [34] (testset)   loss: 0.5551 -> 0.5000  accuracy: 87.43% -> 80.87%     
---------------------------- TRAINING EPOCH: 20 ----------------------------   
client [69] (testset)   loss: 0.4381 -> 0.3659  accuracy: 82.31% -> 86.39%     
client [99] (testset)   loss: 0.3847 -> 0.2626  accuracy: 93.27% -> 94.23%     
client [67] (testset)   loss: 0.3944 -> 0.4608  accuracy: 89.18% -> 84.85%     
client [0]  (testset)   loss: 0.5605 -> 0.4740  accuracy: 81.33% -> 85.89%     
client [76] (testset)   loss: 0.5646 -> 0.4982  accuracy: 80.15% -> 76.72%     
client [41] (testset)   loss: 0.6062 -> 0.2473  accuracy: 78.05% -> 91.71%     
client [62] (testset)   loss: 0.5414 -> 0.3188  accuracy: 85.50% -> 92.37%     
client [2]  (testset)   loss: 0.8643 -> 0.4315  accuracy: 67.32% -> 90.85%     
client [14] (testset)   loss: 0.3721 -> 0.3320  accuracy: 89.21% -> 87.55%     
client [46] (testset)   loss: 0.5759 -> 0.4154  accuracy: 79.74% -> 84.97%     
---------------------------- TRAINING EPOCH: 30 ----------------------------   
client [24] (testset)   loss: 0.4754 -> 0.3599  accuracy: 83.78% -> 86.94%     
client [68] (testset)   loss: 0.6032 -> 0.3679  accuracy: 74.22% -> 86.02%     
client [57] (testset)   loss: 0.2869 -> 0.2074  accuracy: 92.88% -> 93.56%     
client [17] (testset)   loss: 0.3174 -> 0.3002  accuracy: 90.41% -> 93.15%     
client [54] (testset)   loss: 0.4372 -> 0.4830  accuracy: 81.96% -> 79.90%     
client [23] (testset)   loss: 0.5950 -> 0.4499  accuracy: 74.29% -> 78.57%     
client [35] (testset)   loss: 0.2193 -> 0.1825  accuracy: 92.90% -> 94.19%     
client [59] (testset)   loss: 0.3408 -> 0.2586  accuracy: 93.52% -> 91.67%     
client [31] (testset)   loss: 0.3840 -> 0.4309  accuracy: 88.59% -> 85.91%     
client [9]  (testset)   loss: 0.2651 -> 0.1230  accuracy: 94.12% -> 96.79%     
---------------------------- TRAINING EPOCH: 40 ----------------------------   
client [64] (testset)   loss: 0.2331 -> 0.1433  accuracy: 93.72% -> 94.98%     
client [33] (testset)   loss: 0.4356 -> 0.3747  accuracy: 83.47% -> 86.36%     
client [16] (testset)   loss: 0.4542 -> 0.3016  accuracy: 86.47% -> 89.47%     
client [44] (testset)   loss: 0.4933 -> 0.4269  accuracy: 84.49% -> 84.76%     
client [8]  (testset)   loss: 0.2869 -> 0.1926  accuracy: 92.16% -> 94.12%     
client [31] (testset)   loss: 0.2993 -> 0.3113  accuracy: 90.60% -> 88.59%     
client [47] (testset)   loss: 0.3841 -> 0.2506  accuracy: 90.28% -> 90.74%     
client [36] (testset)   loss: 0.2625 -> 0.2083  accuracy: 94.93% -> 94.01%     
client [20] (testset)   loss: 0.2209 -> 0.1913  accuracy: 92.24% -> 93.88%     
client [56] (testset)   loss: 0.4693 -> 0.4678  accuracy: 85.20% -> 81.63%     
---------------------------- TRAINING EPOCH: 50 ----------------------------   
client [4]  (testset)   loss: 0.4836 -> 0.4563  accuracy: 83.06% -> 81.45%     
client [60] (testset)   loss: 0.3051 -> 0.1745  accuracy: 94.00% -> 96.00%     
client [28] (testset)   loss: 0.5493 -> 0.3445  accuracy: 81.61% -> 87.89%     
client [25] (testset)   loss: 0.3529 -> 0.2842  accuracy: 86.26% -> 89.69%     
client [58] (testset)   loss: 0.5582 -> 0.3861  accuracy: 76.24% -> 83.98%     
client [44] (testset)   loss: 0.5493 -> 0.4104  accuracy: 79.78% -> 86.15%     
client [39] (testset)   loss: 0.2810 -> 0.3603  accuracy: 91.79% -> 83.58%     
client [29] (testset)   loss: 0.4470 -> 0.3959  accuracy: 86.11% -> 87.22%     
client [3]  (testset)   loss: 0.2418 -> 0.2311  accuracy: 91.03% -> 91.67%     
client [84] (testset)   loss: 0.3930 -> 0.2443  accuracy: 87.11% -> 93.30%     
---------------------------- TRAINING EPOCH: 60 ----------------------------   
client [21] (testset)   loss: 0.4414 -> 0.3191  accuracy: 84.91% -> 86.79%     
client [84] (testset)   loss: 0.2918 -> 0.2365  accuracy: 91.75% -> 93.30%     
client [10] (testset)   loss: 0.1561 -> 0.2753  accuracy: 95.68% -> 93.53%     
client [36] (testset)   loss: 0.2320 -> 0.1452  accuracy: 93.09% -> 96.31%     
client [65] (testset)   loss: 0.3319 -> 0.2708  accuracy: 87.50% -> 89.71%     
client [81] (testset)   loss: 0.1877 -> 0.1229  accuracy: 94.92% -> 96.61%     
client [79] (testset)   loss: 0.3896 -> 0.3233  accuracy: 83.12% -> 87.01%     
client [42] (testset)   loss: 0.3737 -> 0.3120  accuracy: 87.22% -> 88.99%     
client [11] (testset)   loss: 0.2084 -> 0.1337  accuracy: 95.83% -> 95.83%     
client [96] (testset)   loss: 0.3627 -> 0.3135  accuracy: 87.77% -> 89.08%     
---------------------------- TRAINING EPOCH: 70 ----------------------------   
client [8]  (testset)   loss: 0.3155 -> 0.1934  accuracy: 92.16% -> 94.12%     
client [53] (testset)   loss: 0.2988 -> 0.2796  accuracy: 92.65% -> 89.71%     
client [52] (testset)   loss: 0.1898 -> 0.1663  accuracy: 94.67% -> 94.00%     
client [42] (testset)   loss: 0.3081 -> 0.2530  accuracy: 88.99% -> 92.95%     
client [69] (testset)   loss: 0.3340 -> 0.3147  accuracy: 90.48% -> 85.71%     
client [59] (testset)   loss: 0.1839 -> 0.1328  accuracy: 94.44% -> 96.30%     
client [7]  (testset)   loss: 0.2812 -> 0.2014  accuracy: 92.18% -> 94.24%     
client [26] (testset)   loss: 0.2166 -> 0.0766  accuracy: 93.51% -> 98.70%     
client [49] (testset)   loss: 0.3909 -> 0.3530  accuracy: 88.97% -> 89.66%     
client [98] (testset)   loss: 0.1489 -> 0.1281  accuracy: 94.16% -> 94.85%     
---------------------------- TRAINING EPOCH: 80 ----------------------------   
client [98] (testset)   loss: 0.1516 -> 0.1206  accuracy: 94.85% -> 94.85%     
client [47] (testset)   loss: 0.3197 -> 0.2232  accuracy: 86.11% -> 90.28%     
client [21] (testset)   loss: 0.3583 -> 0.3035  accuracy: 88.05% -> 88.68%     
client [77] (testset)   loss: 0.2811 -> 0.3083  accuracy: 90.86% -> 86.86%     
client [95] (testset)   loss: 0.4314 -> 0.3562  accuracy: 89.52% -> 89.52%     
client [91] (testset)   loss: 0.1954 -> 0.1755  accuracy: 94.30% -> 96.20%     
client [14] (testset)   loss: 0.2650 -> 0.1796  accuracy: 89.21% -> 95.44%     
client [99] (testset)   loss: 0.1691 -> 0.1205  accuracy: 95.19% -> 98.08%     
client [20] (testset)   loss: 0.2146 -> 0.1636  accuracy: 92.65% -> 95.51%     
client [39] (testset)   loss: 0.2363 -> 0.2691  accuracy: 89.55% -> 90.30%     
---------------------------- TRAINING EPOCH: 90 ----------------------------   
client [52] (testset)   loss: 0.1513 -> 0.1945  accuracy: 96.00% -> 93.33%     
client [62] (testset)   loss: 0.1436 -> 0.1463  accuracy: 92.37% -> 93.89%     
client [71] (testset)   loss: 0.4342 -> 0.3876  accuracy: 90.62% -> 87.50%     
client [97] (testset)   loss: 0.2115 -> 0.1759  accuracy: 92.11% -> 92.98%     
client [30] (testset)   loss: 0.4468 -> 0.3204  accuracy: 81.32% -> 89.01%     
client [88] (testset)   loss: 0.3098 -> 0.2476  accuracy: 93.29% -> 93.29%     
client [60] (testset)   loss: 0.2035 -> 0.1171  accuracy: 94.67% -> 96.00%     
client [82] (testset)   loss: 0.3043 -> 0.7518  accuracy: 88.14% -> 75.00%     
client [91] (testset)   loss: 0.1582 -> 0.1805  accuracy: 97.47% -> 96.20%     
client [57] (testset)   loss: 0.1956 -> 0.1450  accuracy: 94.92% -> 94.58%     
---------------------------- TRAINING EPOCH: 100 ----------------------------  
client [31] (testset)   loss: 0.2015 -> 1.5835  accuracy: 91.95% -> 71.81%     
client [15] (testset)   loss: 0.2293 -> 0.1601  accuracy: 91.67% -> 93.94%     
client [71] (testset)   loss: 0.5179 -> 0.4099  accuracy: 78.12% -> 87.50%     
client [97] (testset)   loss: 0.2665 -> 0.1477  accuracy: 92.11% -> 94.74%     
client [53] (testset)   loss: 0.3011 -> 0.2470  accuracy: 90.44% -> 92.65%     
client [77] (testset)   loss: 0.3152 -> 0.2162  accuracy: 86.29% -> 93.71%     
client [76] (testset)   loss: 0.4770 -> 0.2532  accuracy: 83.21% -> 90.08%     
client [79] (testset)   loss: 0.3920 -> 0.3784  accuracy: 82.47% -> 83.77%     
client [28] (testset)   loss: 0.4694 -> 0.3001  accuracy: 82.51% -> 89.69%     
client [99] (testset)   loss: 0.1039 -> 0.1071  accuracy: 97.12% -> 98.08%     
---------------------------- TRAINING EPOCH: 110 ----------------------------  
client [97] (testset)   loss: 0.2118 -> 0.1365  accuracy: 92.11% -> 96.49%     
client [86] (testset)   loss: 0.3788 -> 0.4713  accuracy: 87.77% -> 84.72%     
client [34] (testset)   loss: 0.2788 -> 0.2457  accuracy: 90.16% -> 89.62%     
client [73] (testset)   loss: 0.2047 -> 0.1972  accuracy: 92.31% -> 93.67%     
client [5]  (testset)   loss: 0.1984 -> 0.1950  accuracy: 92.54% -> 94.92%     
client [96] (testset)   loss: 0.3303 -> 0.3126  accuracy: 89.96% -> 91.70%     
client [22] (testset)   loss: 0.3211 -> 0.2971  accuracy: 91.87% -> 87.80%     
client [60] (testset)   loss: 0.1541 -> 0.1540  accuracy: 94.67% -> 96.67%     
client [66] (testset)   loss: 0.1700 -> 0.0987  accuracy: 94.69% -> 97.35%     
client [83] (testset)   loss: 0.2648 -> 0.2043  accuracy: 88.24% -> 94.12%     
---------------------------- TRAINING EPOCH: 120 ----------------------------  
client [76] (testset)   loss: 0.3849 -> 0.2793  accuracy: 87.40% -> 89.69%     
client [65] (testset)   loss: 0.2922 -> 0.2198  accuracy: 87.50% -> 91.91%     
client [95] (testset)   loss: 0.4346 -> 0.3271  accuracy: 87.62% -> 91.43%     
client [17] (testset)   loss: 0.2114 -> 0.2295  accuracy: 92.47% -> 91.78%     
client [8]  (testset)   loss: 0.2044 -> 0.1496  accuracy: 94.12% -> 93.14%     
client [35] (testset)   loss: 0.1801 -> 0.1358  accuracy: 92.90% -> 93.55%     
client [98] (testset)   loss: 0.1387 -> 0.1489  accuracy: 94.50% -> 95.19%     
client [53] (testset)   loss: 0.2494 -> 0.2732  accuracy: 90.44% -> 88.97%     
client [43] (testset)   loss: 0.2850 -> 0.2713  accuracy: 88.53% -> 88.99%     
client [64] (testset)   loss: 0.2135 -> 0.1283  accuracy: 93.72% -> 95.40%     
---------------------------- TRAINING EPOCH: 130 ----------------------------  
client [21] (testset)   loss: 0.4023 -> 0.2932  accuracy: 83.02% -> 91.19%     
client [88] (testset)   loss: 0.2893 -> 0.2465  accuracy: 91.95% -> 93.29%     
client [38] (testset)   loss: 0.3114 -> 0.1577  accuracy: 88.51% -> 95.61%     
client [3]  (testset)   loss: 0.2124 -> 0.1817  accuracy: 94.23% -> 94.23%     
client [5]  (testset)   loss: 0.2061 -> 0.1928  accuracy: 94.58% -> 94.92%     
client [41] (testset)   loss: 0.2110 -> 0.1295  accuracy: 93.17% -> 95.61%     
client [7]  (testset)   loss: 0.3765 -> 0.2253  accuracy: 87.65% -> 95.06%     
client [37] (testset)   loss: 0.3892 -> 0.2446  accuracy: 87.57% -> 92.90%     
client [45] (testset)   loss: 0.2097 -> 0.1426  accuracy: 93.89% -> 94.44%     
client [47] (testset)   loss: 0.3462 -> 0.1961  accuracy: 87.50% -> 94.44%     
---------------------------- TRAINING EPOCH: 140 ----------------------------  
client [16] (testset)   loss: 0.2672 -> 0.2600  accuracy: 91.73% -> 92.48%     
client [11] (testset)   loss: 0.1454 -> 0.1034  accuracy: 95.83% -> 97.02%     
client [37] (testset)   loss: 0.4118 -> 0.2505  accuracy: 87.57% -> 92.90%     
client [41] (testset)   loss: 0.2346 -> 0.0985  accuracy: 91.71% -> 97.07%     
client [95] (testset)   loss: 0.4148 -> 0.3199  accuracy: 90.48% -> 92.38%     
client [53] (testset)   loss: 0.2149 -> 0.2262  accuracy: 92.65% -> 91.91%     
client [22] (testset)   loss: 0.3059 -> 0.2806  accuracy: 88.62% -> 91.06%     
client [25] (testset)   loss: 0.3158 -> 0.3111  accuracy: 88.93% -> 91.60%     
client [69] (testset)   loss: 0.2778 -> 0.3774  accuracy: 92.52% -> 87.76%     
client [46] (testset)   loss: 0.2486 -> 0.3430  accuracy: 90.52% -> 89.87%     
---------------------------- TRAINING EPOCH: 150 ----------------------------  
client [47] (testset)   loss: 0.4118 -> 0.1989  accuracy: 85.19% -> 94.91%     
client [69] (testset)   loss: 0.2869 -> 0.4075  accuracy: 90.48% -> 87.76%     
client [82] (testset)   loss: 0.3596 -> 0.2488  accuracy: 87.71% -> 91.95%     
client [45] (testset)   loss: 0.2432 -> 0.1743  accuracy: 91.67% -> 94.44%     
client [7]  (testset)   loss: 0.2764 -> 0.2157  accuracy: 92.59% -> 95.47%     
client [50] (testset)   loss: 0.2285 -> 0.1576  accuracy: 94.04% -> 95.36%     
client [35] (testset)   loss: 0.2855 -> 0.1166  accuracy: 89.03% -> 96.77%     
client [24] (testset)   loss: 0.3106 -> 0.1735  accuracy: 88.29% -> 93.69%     
client [15] (testset)   loss: 0.1845 -> 0.1499  accuracy: 93.18% -> 95.45%     
client [58] (testset)   loss: 0.5766 -> 0.4064  accuracy: 81.77% -> 84.53%     
---------------------------- TRAINING EPOCH: 160 ----------------------------  
client [48] (testset)   loss: 0.7108 -> 0.6366  accuracy: 82.11% -> 84.55%     
client [76] (testset)   loss: 0.4621 -> 0.2793  accuracy: 86.64% -> 91.98%     
client [67] (testset)   loss: 0.1899 -> 0.1447  accuracy: 93.07% -> 95.24%     
client [37] (testset)   loss: 0.4122 -> 0.2570  accuracy: 85.80% -> 94.08%     
client [58] (testset)   loss: 0.6324 -> 0.3927  accuracy: 80.11% -> 86.19%     
client [64] (testset)   loss: 0.1909 -> 0.1270  accuracy: 93.31% -> 94.98%     
client [77] (testset)   loss: 0.3500 -> 0.2392  accuracy: 88.00% -> 93.71%     
client [55] (testset)   loss: 0.1998 -> 0.1652  accuracy: 92.89% -> 92.89%     
client [12] (testset)   loss: 0.1855 -> 0.2670  accuracy: 93.04% -> 91.77%     
client [89] (testset)   loss: 0.1668 -> 0.0727  accuracy: 97.12% -> 97.12%     
---------------------------- TRAINING EPOCH: 170 ----------------------------  
client [84] (testset)   loss: 0.3029 -> 0.2442  accuracy: 90.72% -> 94.85%     
client [51] (testset)   loss: 0.2568 -> 0.1418  accuracy: 90.49% -> 96.58%     
client [8]  (testset)   loss: 0.1926 -> 0.1663  accuracy: 93.14% -> 93.14%     
client [18] (testset)   loss: 0.2223 -> 0.1557  accuracy: 93.13% -> 95.42%     
client [94] (testset)   loss: 0.1918 -> 0.1811  accuracy: 93.79% -> 95.03%     
client [81] (testset)   loss: 0.1480 -> 0.0723  accuracy: 93.22% -> 98.31%     
client [3]  (testset)   loss: 0.1944 -> 0.1745  accuracy: 93.59% -> 94.23%     
client [11] (testset)   loss: 0.1581 -> 0.0989  accuracy: 95.24% -> 98.81%     
client [95] (testset)   loss: 0.4440 -> 0.3318  accuracy: 90.48% -> 91.43%     
client [67] (testset)   loss: 0.1928 -> 0.1473  accuracy: 93.07% -> 94.37%     
---------------------------- TRAINING EPOCH: 180 ----------------------------  
client [21] (testset)   loss: 0.3404 -> 0.2897  accuracy: 89.31% -> 89.31%     
client [79] (testset)   loss: 0.4826 -> 0.3502  accuracy: 82.47% -> 86.36%     
client [58] (testset)   loss: 0.5383 -> 0.4154  accuracy: 81.77% -> 83.98%     
client [88] (testset)   loss: 0.2477 -> 0.2642  accuracy: 93.29% -> 93.29%     
client [46] (testset)   loss: 0.2790 -> 0.2232  accuracy: 91.50% -> 91.50%     
client [11] (testset)   loss: 0.1698 -> 0.0894  accuracy: 95.24% -> 98.21%     
client [55] (testset)   loss: 0.2997 -> 0.1778  accuracy: 89.85% -> 93.91%     
client [13] (testset)   loss: 0.1850 -> 0.1818  accuracy: 92.41% -> 92.86%     
client [31] (testset)   loss: 0.1784 -> 0.3247  accuracy: 93.96% -> 89.93%     
client [75] (testset)   loss: 0.0987 -> 0.0828  accuracy: 96.40% -> 98.56%     
---------------------------- TRAINING EPOCH: 190 ----------------------------  
client [19] (testset)   loss: 0.1978 -> 0.1703  accuracy: 92.22% -> 93.33%     
client [7]  (testset)   loss: 0.5206 -> 0.2320  accuracy: 85.60% -> 95.06%     
client [57] (testset)   loss: 0.1674 -> 0.1116  accuracy: 96.61% -> 96.61%     
client [13] (testset)   loss: 0.1817 -> 1.8085  accuracy: 94.64% -> 85.71%     
client [43] (testset)   loss: 0.2490 -> 0.3058  accuracy: 90.83% -> 88.53%     
client [91] (testset)   loss: 0.1637 -> 0.1668  accuracy: 94.30% -> 95.57%     
client [10] (testset)   loss: 0.2007 -> 0.1176  accuracy: 94.96% -> 97.12%     
client [64] (testset)   loss: 0.1930 -> 0.1341  accuracy: 94.14% -> 95.82%     
client [82] (testset)   loss: 0.5413 -> 0.2389  accuracy: 85.59% -> 91.95%     
client [22] (testset)   loss: 0.4462 -> 0.2978  accuracy: 79.67% -> 91.06%     
---------------------------- TRAINING EPOCH: 200 ----------------------------  
client [20] (testset)   loss: 0.1601 -> 0.1449  accuracy: 94.69% -> 95.10%     
client [23] (testset)   loss: 0.4062 -> 0.3343  accuracy: 85.71% -> 85.71%     
client [88] (testset)   loss: 0.3668 -> 0.2537  accuracy: 87.25% -> 93.29%     
client [98] (testset)   loss: 0.1433 -> 0.1334  accuracy: 95.88% -> 95.88%     
client [79] (testset)   loss: 0.4031 -> 0.3429  accuracy: 85.06% -> 86.36%     
client [21] (testset)   loss: 0.3559 -> 0.2853  accuracy: 89.94% -> 91.82%     
client [92] (testset)   loss: 0.0622 -> 0.0324  accuracy: 98.15% -> 99.07%     
client [56] (testset)   loss: 0.4030 -> 0.3618  accuracy: 87.76% -> 88.78%     
client [5]  (testset)   loss: 0.2661 -> 0.1910  accuracy: 91.86% -> 95.25%     
client [52] (testset)   loss: 0.0971 -> 0.1000  accuracy: 96.00% -> 97.33%     
---------------------------- TRAINING EPOCH: 210 ----------------------------  
client [67] (testset)   loss: 0.2369 -> 0.1540  accuracy: 91.77% -> 94.37%     
client [54] (testset)   loss: 0.3108 -> 0.4307  accuracy: 88.66% -> 88.14%     
client [14] (testset)   loss: 0.2933 -> 0.1493  accuracy: 89.63% -> 94.61%     
client [99] (testset)   loss: 0.1136 -> 0.0650  accuracy: 96.15% -> 99.04%     
client [36] (testset)   loss: 0.1202 -> 0.0954  accuracy: 94.47% -> 96.31%     
client [30] (testset)   loss: 0.2740 -> 0.2707  accuracy: 84.62% -> 85.71%     
client [38] (testset)   loss: 0.2992 -> 0.1646  accuracy: 89.19% -> 94.93%     
client [15] (testset)   loss: 0.1716 -> 0.1741  accuracy: 95.45% -> 94.70%     
client [6]  (testset)   loss: 0.2829 -> 0.2598  accuracy: 93.16% -> 91.03%     
client [53] (testset)   loss: 0.2340 -> 0.2493  accuracy: 91.91% -> 93.38%     
---------------------------- TRAINING EPOCH: 220 ----------------------------  
client [99] (testset)   loss: 0.1184 -> 0.0623  accuracy: 95.19% -> 98.08%     
client [6]  (testset)   loss: 0.3120 -> 0.2693  accuracy: 92.31% -> 92.74%     
client [83] (testset)   loss: 0.2397 -> 0.1940  accuracy: 92.94% -> 92.94%     
client [42] (testset)   loss: 0.3040 -> 0.2122  accuracy: 89.87% -> 92.95%     
client [34] (testset)   loss: 0.4027 -> 0.2064  accuracy: 87.43% -> 92.35%     
client [15] (testset)   loss: 0.1641 -> 0.1591  accuracy: 94.70% -> 95.45%     
client [47] (testset)   loss: 0.5349 -> 0.2297  accuracy: 81.48% -> 95.83%     
client [55] (testset)   loss: 0.2706 -> 0.1755  accuracy: 89.85% -> 93.91%     
client [51] (testset)   loss: 0.2312 -> 0.1657  accuracy: 91.63% -> 96.58%     
client [95] (testset)   loss: 0.4541 -> 0.3459  accuracy: 89.52% -> 93.33%     
---------------------------- TRAINING EPOCH: 230 ----------------------------  
client [71] (testset)   loss: 0.3645 -> 0.5753  accuracy: 93.75% -> 87.50%     
client [15] (testset)   loss: 0.1828 -> 0.1749  accuracy: 94.70% -> 96.21%     
client [33] (testset)   loss: 0.6897 -> 0.3623  accuracy: 80.17% -> 89.67%     
client [99] (testset)   loss: 0.1300 -> 0.0569  accuracy: 96.15% -> 99.04%     
client [90] (testset)   loss: 0.2257 -> 0.1487  accuracy: 92.74% -> 93.85%     
client [57] (testset)   loss: 0.2639 -> 0.1192  accuracy: 93.56% -> 96.27%     
client [27] (testset)   loss: 0.0200 -> 0.0028  accuracy: 100.00% -> 100.00%   
client [78] (testset)   loss: 0.0765 -> 0.0852  accuracy: 98.41% -> 97.62%     
client [36] (testset)   loss: 0.1428 -> 0.0991  accuracy: 96.77% -> 96.77%     
client [88] (testset)   loss: 0.3326 -> 0.2812  accuracy: 93.96% -> 92.62%     
---------------------------- TRAINING EPOCH: 240 ----------------------------  
client [70] (testset)   loss: 0.3384 -> 0.3114  accuracy: 94.19% -> 90.70%     
client [35] (testset)   loss: 0.1973 -> 0.1283  accuracy: 94.19% -> 96.13%     
client [16] (testset)   loss: 0.3548 -> 0.2870  accuracy: 88.72% -> 95.49%     
client [80] (testset)   loss: 0.1542 -> 0.1802  accuracy: 92.45% -> 94.34%     
client [38] (testset)   loss: 0.3550 -> 0.2002  accuracy: 87.84% -> 94.26%     
client [78] (testset)   loss: 0.0711 -> 0.0833  accuracy: 98.41% -> 98.41%     
client [68] (testset)   loss: 0.5961 -> 0.4175  accuracy: 83.85% -> 87.27%     
client [11] (testset)   loss: 0.1643 -> 0.0926  accuracy: 95.83% -> 98.81%     
client [64] (testset)   loss: 0.2457 -> 0.1373  accuracy: 92.89% -> 95.40%     
client [82] (testset)   loss: 0.4401 -> 0.2551  accuracy: 87.71% -> 91.95%     
---------------------------- TRAINING EPOCH: 250 ----------------------------  
client [30] (testset)   loss: 0.4224 -> 0.3031  accuracy: 85.71% -> 86.81%     
client [27] (testset)   loss: 0.0143 -> 0.0009  accuracy: 100.00% -> 100.00%   
client [74] (testset)   loss: 0.2310 -> 0.2052  accuracy: 92.84% -> 94.93%     
client [45] (testset)   loss: 0.1839 -> 0.1102  accuracy: 93.33% -> 96.11%     
client [6]  (testset)   loss: 0.3584 -> 0.2717  accuracy: 90.60% -> 91.88%     
client [36] (testset)   loss: 0.1103 -> 0.0990  accuracy: 96.31% -> 96.31%     
client [63] (testset)   loss: 0.1140 -> 0.0735  accuracy: 95.45% -> 96.97%     
client [76] (testset)   loss: 0.4618 -> 0.2692  accuracy: 88.55% -> 91.98%     
client [83] (testset)   loss: 0.2685 -> 0.1793  accuracy: 90.59% -> 94.12%     
client [86] (testset)   loss: 0.4864 -> 0.4941  accuracy: 87.77% -> 87.77%     
---------------------------- TRAINING EPOCH: 260 ----------------------------  
client [83] (testset)   loss: 0.2323 -> 0.1709  accuracy: 92.94% -> 94.12%     
client [99] (testset)   loss: 0.1630 -> 0.0526  accuracy: 95.19% -> 98.08%     
client [74] (testset)   loss: 0.2030 -> 0.2145  accuracy: 93.43% -> 94.63%     
client [73] (testset)   loss: 0.2850 -> 0.1950  accuracy: 89.59% -> 94.12%     
client [29] (testset)   loss: 0.3031 -> 0.2848  accuracy: 88.33% -> 91.67%     
client [92] (testset)   loss: 0.0599 -> 0.0271  accuracy: 98.15% -> 99.54%     
client [6]  (testset)   loss: 0.4147 -> 0.3023  accuracy: 89.32% -> 92.74%     
client [61] (testset)   loss: 0.4322 -> 0.1962  accuracy: 86.43% -> 93.57%     
client [21] (testset)   loss: 0.4036 -> 0.3079  accuracy: 88.05% -> 89.94%     
client [67] (testset)   loss: 0.1914 -> 0.1582  accuracy: 95.24% -> 94.81%     
---------------------------- TRAINING EPOCH: 270 ----------------------------  
client [83] (testset)   loss: 0.3327 -> 0.1880  accuracy: 89.41% -> 94.12%     
client [32] (testset)   loss: 0.2367 -> 0.1714  accuracy: 93.69% -> 94.59%     
client [95] (testset)   loss: 0.5563 -> 0.3646  accuracy: 91.43% -> 93.33%     
client [61] (testset)   loss: 0.4509 -> 0.2472  accuracy: 88.57% -> 92.14%     
client [27] (testset)   loss: 0.0144 -> 0.0015  accuracy: 98.84% -> 100.00%    
client [25] (testset)   loss: 0.4486 -> 0.3418  accuracy: 86.64% -> 92.37%     
client [68] (testset)   loss: 0.6263 -> 0.3813  accuracy: 81.37% -> 87.89%     
client [34] (testset)   loss: 0.2961 -> 0.2215  accuracy: 91.26% -> 93.99%     
client [71] (testset)   loss: 0.4571 -> 0.4616  accuracy: 84.38% -> 84.38%     
client [89] (testset)   loss: 0.1286 -> 0.0439  accuracy: 95.68% -> 97.12%     
---------------------------- TRAINING EPOCH: 280 ----------------------------  
client [78] (testset)   loss: 0.0613 -> 0.0880  accuracy: 97.62% -> 97.62%     
client [81] (testset)   loss: 0.1288 -> 0.0575  accuracy: 93.22% -> 96.61%     
client [51] (testset)   loss: 0.3467 -> 0.1617  accuracy: 88.59% -> 96.58%     
client [54] (testset)   loss: 0.3244 -> 0.4321  accuracy: 87.63% -> 87.11%     
client [65] (testset)   loss: 0.3143 -> 0.1662  accuracy: 88.97% -> 95.59%     
client [41] (testset)   loss: 0.2903 -> 0.1087  accuracy: 91.71% -> 97.56%     
client [11] (testset)   loss: 0.1633 -> 0.0894  accuracy: 96.43% -> 98.81%     
client [85] (testset)   loss: 0.1300 -> 0.1440  accuracy: 94.57% -> 94.57%     
client [12] (testset)   loss: 0.2419 -> 0.2725  accuracy: 91.14% -> 93.67%     
client [23] (testset)   loss: 0.4581 -> 0.3708  accuracy: 80.00% -> 87.14%     
---------------------------- TRAINING EPOCH: 290 ----------------------------  
client [16] (testset)   loss: 0.2707 -> 0.2895  accuracy: 93.23% -> 93.98%     
client [65] (testset)   loss: 0.4913 -> 0.1647  accuracy: 85.29% -> 92.65%     
client [53] (testset)   loss: 0.2783 -> 0.2611  accuracy: 91.91% -> 92.65%     
client [58] (testset)   loss: 0.6755 -> 0.4397  accuracy: 80.11% -> 86.74%     
client [72] (testset)   loss: 0.5106 -> 0.3274  accuracy: 81.58% -> 92.11%     
client [7]  (testset)   loss: 0.3592 -> 0.2445  accuracy: 92.59% -> 95.47%     
client [71] (testset)   loss: 0.4731 -> 0.5288  accuracy: 84.38% -> 87.50%     
client [59] (testset)   loss: 0.3081 -> 0.1734  accuracy: 89.81% -> 94.44%     
client [86] (testset)   loss: 0.5343 -> 0.4541  accuracy: 85.59% -> 88.65%     
client [39] (testset)   loss: 0.2838 -> 0.3122  accuracy: 91.79% -> 91.04%     
---------------------------- TRAINING EPOCH: 300 ----------------------------  
client [99] (testset)   loss: 0.0720 -> 0.0449  accuracy: 97.12% -> 100.00%    
client [7]  (testset)   loss: 0.4034 -> 0.2562  accuracy: 90.53% -> 95.06%     
client [17] (testset)   loss: 0.3205 -> 0.2465  accuracy: 93.84% -> 93.84%     
client [64] (testset)   loss: 0.2210 -> 0.1278  accuracy: 93.72% -> 95.82%     
client [37] (testset)   loss: 0.4730 -> 0.3126  accuracy: 87.57% -> 94.67%     
client [29] (testset)   loss: 0.2763 -> 0.2942  accuracy: 87.78% -> 89.44%     
client [93] (testset)   loss: 0.5346 -> 0.6166  accuracy: 84.27% -> 81.82%     
client [73] (testset)   loss: 0.1785 -> 0.1979  accuracy: 93.21% -> 93.67%     
client [40] (testset)   loss: 0.1893 -> 0.1332  accuracy: 92.06% -> 93.65%     
client [76] (testset)   loss: 0.5865 -> 0.2713  accuracy: 87.02% -> 93.13%     
---------------------------- TRAINING EPOCH: 310 ----------------------------  
client [31] (testset)   loss: 0.2544 -> 0.2002  accuracy: 91.95% -> 93.29%     
client [89] (testset)   loss: 0.2061 -> 0.0833  accuracy: 94.24% -> 96.40%     
client [77] (testset)   loss: 0.5677 -> 0.2793  accuracy: 84.00% -> 93.71%     
client [90] (testset)   loss: 0.6955 -> 0.1891  accuracy: 78.77% -> 93.30%     
client [26] (testset)   loss: 0.1657 -> 0.0621  accuracy: 94.81% -> 98.70%     
client [50] (testset)   loss: 0.3908 -> 0.1255  accuracy: 86.75% -> 96.03%     
client [30] (testset)   loss: 0.2174 -> 0.2760  accuracy: 90.11% -> 89.01%     
client [70] (testset)   loss: 0.3937 -> 0.2562  accuracy: 93.02% -> 93.02%     
client [41] (testset)   loss: 0.5539 -> 0.1318  accuracy: 85.37% -> 97.07%     
client [99] (testset)   loss: 0.1013 -> 0.0410  accuracy: 96.15% -> 100.00%    
---------------------------- TRAINING EPOCH: 320 ----------------------------  
client [68] (testset)   loss: 0.5256 -> 0.3676  accuracy: 84.16% -> 89.44%     
client [70] (testset)   loss: 0.4141 -> 0.3407  accuracy: 89.53% -> 93.02%     
client [52] (testset)   loss: 0.1071 -> 0.0839  accuracy: 96.00% -> 98.00%     
client [1]  (testset)   loss: 0.3302 -> 0.2586  accuracy: 89.71% -> 91.18%     
client [2]  (testset)   loss: 0.3883 -> 0.2788  accuracy: 87.58% -> 93.46%     
client [67] (testset)   loss: 0.2378 -> 0.1568  accuracy: 92.64% -> 94.81%     
client [92] (testset)   loss: 0.0476 -> 0.0310  accuracy: 98.15% -> 99.54%     
client [35] (testset)   loss: 0.2398 -> 0.1224  accuracy: 92.26% -> 96.77%     
client [36] (testset)   loss: 0.1316 -> 0.0937  accuracy: 95.85% -> 97.24%     
client [64] (testset)   loss: 0.2669 -> 0.1245  accuracy: 92.05% -> 96.23%     
---------------------------- TRAINING EPOCH: 330 ----------------------------  
client [44] (testset)   loss: 0.5546 -> 0.5187  accuracy: 84.76% -> 88.09%     
client [6]  (testset)   loss: 0.3134 -> 0.2871  accuracy: 92.31% -> 92.74%     
client [12] (testset)   loss: 0.2414 -> 0.2702  accuracy: 90.51% -> 93.04%     
client [55] (testset)   loss: 0.3281 -> 0.2079  accuracy: 89.85% -> 94.92%     
client [29] (testset)   loss: 0.3364 -> 0.2738  accuracy: 89.44% -> 90.56%     
client [9]  (testset)   loss: 0.1297 -> 0.1035  accuracy: 96.26% -> 96.26%     
client [43] (testset)   loss: 0.3967 -> 0.2864  accuracy: 88.53% -> 92.66%     
client [77] (testset)   loss: 0.3975 -> 0.2633  accuracy: 90.29% -> 95.43%     
client [98] (testset)   loss: 0.1081 -> 0.1253  accuracy: 97.25% -> 97.59%     
client [78] (testset)   loss: 0.0691 -> 0.0875  accuracy: 98.41% -> 98.41%     
---------------------------- TRAINING EPOCH: 340 ----------------------------  
client [92] (testset)   loss: 0.0605 -> 0.0319  accuracy: 98.15% -> 99.54%     
client [80] (testset)   loss: 0.1855 -> 0.1851  accuracy: 94.34% -> 94.34%     
client [63] (testset)   loss: 0.1124 -> 0.0449  accuracy: 96.97% -> 98.48%     
client [76] (testset)   loss: 0.3860 -> 0.2625  accuracy: 90.84% -> 91.60%     
client [78] (testset)   loss: 0.0621 -> 0.1016  accuracy: 98.41% -> 97.62%     
client [25] (testset)   loss: 0.3441 -> 0.3025  accuracy: 90.08% -> 92.75%     
client [58] (testset)   loss: 0.6159 -> 0.4297  accuracy: 81.77% -> 86.74%     
client [13] (testset)   loss: 0.1783 -> 0.2386  accuracy: 94.64% -> 93.75%     
client [17] (testset)   loss: 0.2603 -> 0.2300  accuracy: 93.84% -> 91.78%     
client [38] (testset)   loss: 0.3031 -> 0.1827  accuracy: 91.22% -> 94.93%     
---------------------------- TRAINING EPOCH: 350 ----------------------------  
client [72] (testset)   loss: 0.4220 -> 0.3386  accuracy: 86.84% -> 92.11%     
client [82] (testset)   loss: 0.2876 -> 0.2550  accuracy: 91.95% -> 92.80%     
client [86] (testset)   loss: 0.4932 -> 0.4638  accuracy: 88.21% -> 89.52%     
client [51] (testset)   loss: 0.2399 -> 0.1619  accuracy: 92.78% -> 96.96%     
client [96] (testset)   loss: 0.2921 -> 0.3356  accuracy: 89.96% -> 91.27%     
client [42] (testset)   loss: 0.3226 -> 0.6617  accuracy: 91.63% -> 84.58%     
client [55] (testset)   loss: 0.3791 -> 0.2239  accuracy: 89.85% -> 94.92%     
client [13] (testset)   loss: 0.2070 -> 0.1839  accuracy: 94.20% -> 94.64%     
client [1]  (testset)   loss: 0.3946 -> 0.3144  accuracy: 90.44% -> 91.18%     
client [12] (testset)   loss: 0.2333 -> 0.2568  accuracy: 92.41% -> 93.67%     
---------------------------- TRAINING EPOCH: 360 ----------------------------  
client [68] (testset)   loss: 0.6872 -> 0.3340  accuracy: 82.30% -> 89.13%     
client [23] (testset)   loss: 0.5382 -> 0.4251  accuracy: 80.00% -> 87.14%     
client [46] (testset)   loss: 0.2817 -> 0.2543  accuracy: 91.50% -> 94.44%     
client [41] (testset)   loss: 0.3047 -> 0.1304  accuracy: 92.68% -> 97.56%     
client [25] (testset)   loss: 0.3946 -> 0.3062  accuracy: 88.93% -> 93.51%     
client [58] (testset)   loss: 0.5954 -> 0.4455  accuracy: 84.53% -> 85.64%     
client [14] (testset)   loss: 0.2986 -> 0.1729  accuracy: 90.87% -> 95.85%     
client [33] (testset)   loss: 0.7657 -> 0.3611  accuracy: 80.17% -> 89.26%     
client [85] (testset)   loss: 0.1409 -> 0.1350  accuracy: 94.57% -> 96.20%     
client [62] (testset)   loss: 0.1392 -> 0.0756  accuracy: 94.66% -> 97.71%     
---------------------------- TRAINING EPOCH: 370 ----------------------------  
client [98] (testset)   loss: 0.1312 -> 0.1292  accuracy: 96.91% -> 96.91%     
client [63] (testset)   loss: 0.1063 -> 0.0411  accuracy: 96.97% -> 98.48%     
client [70] (testset)   loss: 0.4159 -> 0.2611  accuracy: 93.02% -> 93.02%     
client [65] (testset)   loss: 0.2945 -> 0.1306  accuracy: 90.44% -> 95.59%     
client [14] (testset)   loss: 0.2650 -> 0.1574  accuracy: 92.53% -> 94.61%     
client [73] (testset)   loss: 0.1900 -> 0.1815  accuracy: 92.31% -> 93.67%     
client [34] (testset)   loss: 0.3858 -> 0.1993  accuracy: 89.07% -> 92.90%     
client [99] (testset)   loss: 0.0980 -> 0.0395  accuracy: 96.15% -> 99.04%     
client [69] (testset)   loss: 0.2924 -> 0.3167  accuracy: 91.84% -> 93.20%     
client [46] (testset)   loss: 0.2938 -> 0.2675  accuracy: 90.85% -> 94.44%     
---------------------------- TRAINING EPOCH: 380 ----------------------------  
client [99] (testset)   loss: 0.1782 -> 0.0279  accuracy: 94.23% -> 100.00%    
client [93] (testset)   loss: 0.5057 -> 0.5848  accuracy: 86.71% -> 82.87%     
client [11] (testset)   loss: 0.1288 -> 0.0955  accuracy: 96.43% -> 98.81%     
client [58] (testset)   loss: 0.5220 -> 0.5086  accuracy: 85.64% -> 86.19%     
client [81] (testset)   loss: 0.1500 -> 0.0490  accuracy: 89.83% -> 96.61%     
client [85] (testset)   loss: 0.1966 -> 0.1327  accuracy: 93.48% -> 95.65%     
client [89] (testset)   loss: 0.1716 -> 0.0591  accuracy: 94.96% -> 97.84%     
client [45] (testset)   loss: 0.2600 -> 0.1194  accuracy: 91.67% -> 96.11%     
client [8]  (testset)   loss: 0.2308 -> 0.1522  accuracy: 93.14% -> 94.12%     
client [68] (testset)   loss: 0.5089 -> 0.3731  accuracy: 86.34% -> 88.82%     
---------------------------- TRAINING EPOCH: 390 ----------------------------  
client [67] (testset)   loss: 0.2283 -> 0.1493  accuracy: 92.21% -> 94.37%     
client [72] (testset)   loss: 0.5963 -> 0.3626  accuracy: 78.95% -> 89.47%     
client [1]  (testset)   loss: 0.2062 -> 0.3049  accuracy: 90.44% -> 91.18%     
client [78] (testset)   loss: 0.0572 -> 0.1081  accuracy: 98.41% -> 98.41%     
client [83] (testset)   loss: 0.2717 -> 0.1698  accuracy: 91.76% -> 92.94%     
client [21] (testset)   loss: 0.6591 -> 0.4295  accuracy: 85.53% -> 90.57%     
client [56] (testset)   loss: 0.4574 -> 0.3717  accuracy: 87.76% -> 88.78%     
client [44] (testset)   loss: 0.5581 -> 0.5277  accuracy: 87.53% -> 88.92%     
client [92] (testset)   loss: 0.0738 -> 0.0330  accuracy: 98.15% -> 99.54%     
client [27] (testset)   loss: 0.0246 -> 0.0023  accuracy: 100.00% -> 100.00%   
---------------------------- TRAINING EPOCH: 400 ----------------------------  
client [10] (testset)   loss: 0.3187 -> 0.1707  accuracy: 92.81% -> 96.40%     
client [39] (testset)   loss: 0.2647 -> 0.3093  accuracy: 91.04% -> 91.79%     
client [65] (testset)   loss: 0.3753 -> 0.1569  accuracy: 88.97% -> 94.85%     
client [26] (testset)   loss: 0.2174 -> 0.0654  accuracy: 93.51% -> 98.70%     
client [19] (testset)   loss: 0.3859 -> 0.2064  accuracy: 91.11% -> 91.11%     
client [68] (testset)   loss: 0.5631 -> 0.3756  accuracy: 86.02% -> 89.44%     
client [41] (testset)   loss: 0.4167 -> 0.1386  accuracy: 87.80% -> 96.10%     
client [50] (testset)   loss: 0.2664 -> 0.1325  accuracy: 90.73% -> 96.03%     
client [75] (testset)   loss: 0.1669 -> 0.1198  accuracy: 94.96% -> 98.56%     
client [81] (testset)   loss: 0.1542 -> 0.0650  accuracy: 93.22% -> 94.92%     
Training... ---------------------------------------- 100% 0:24:01
APFL's average time taken by each global epoch: 0 min 3.58 sec.                
APFL's total running time: 0 h 24 m 1 s.                                       
==================== APFL Experiment Results: ====================             
Display format: (before local fine-tuning) -> (after local fine-tuning)        
 So if finetune_epoch = 0, x.xx% -> 0.00% is normal.                           
 Centralized testing ONLY happens after model aggregation, so the stats between
'->' are the same.                                                             
{                                                                              
    "100": {                                                                   
        "all_clients": {                                                       
            "test": {                                                          
                "loss": "0.2730 -> 0.0000",                                    
                "accuracy": "90.70% -> 0.00%"                                  
            }                                                                  
        }                                                                      
    },                                                                         
    "200": {                                                                   
        "all_clients": {                                                       
            "test": {                                                          
                "loss": "0.3033 -> 0.0000",                                    
                "accuracy": "90.60% -> 0.00%"                                  
            }                                                                  
        }                                                                      
    },                                                                         
    "300": {                                                                   
        "all_clients": {                                                       
            "test": {                                                          
                "loss": "0.3283 -> 0.0000",                                    
                "accuracy": "90.75% -> 0.00%"                                  
            }                                                                  
        }                                                                      
    },                                                                         
    "400": {                                                                   
        "all_clients": {                                                       
            "test": {                                                          
                "loss": "0.3449 -> 0.0000",                                    
                "accuracy": "90.79% -> 0.00%"                                  
            }                                                                  
        }                                                                      
    }                                                                          
}                                                                              
==================== APFL Max Accuracy ====================                    
all_clients:                                                                   
(test) before fine-tuning: 90.79% at epoch 400                                 
(test) after fine-tuning: 0.00% at epoch 100                                   
[0m