==================== FedAvg ====================                               
Experiment Arguments:                                                          
{
│   'method': 'fedavg',
│   'dataset': {
│   │   'name': 'mnist',
│   │   'client_num': 100,
│   │   'test_ratio': 0.25,
│   │   'val_ratio': 0.0,
│   │   'seed': 42,
│   │   'split': 'sample',
│   │   'IID_ratio': 0.0,
│   │   'monitor_window_name_suffix': 'mnist-100clients-0%IID-Dir(0.5)-seed42',
│   │   'alpha': 0.5,
│   │   'min_samples_per_client': 10
│   },
│   'model': {
│   │   'name': 'avgcnn',
│   │   'use_torchvision_pretrained_weights': True,
│   │   'external_model_weights_path': None
│   },
│   'optimizer': {
│   │   'lr': 0.01,
│   │   'dampening': 0,
│   │   'weight_decay': 0,
│   │   'momentum': 0,
│   │   'nesterov': False,
│   │   'name': 'sgd'
│   },
│   'mode': 'serial',
│   'parallel': {
│   │   'ray_cluster_addr': None,
│   │   'num_cpus': None,
│   │   'num_gpus': None,
│   │   'num_workers': 2
│   },
│   'common': {
│   │   'seed': 42,
│   │   'join_ratio': 0.1,
│   │   'global_epoch': 400,
│   │   'local_epoch': 5,
│   │   'batch_size': 32,
│   │   'reset_optimizer_on_global_epoch': True,
│   │   'straggler_ratio': 0,
│   │   'straggler_min_local_epoch': 0,
│   │   'buffers': 'global',
│   │   'client_side_evaluation': True,
│   │   'test': {
│   │   │   'client': {
│   │   │   │   'interval': 100,
│   │   │   │   'finetune_epoch': 0,
│   │   │   │   'train': False,
│   │   │   │   'val': False,
│   │   │   │   'test': True
│   │   │   },
│   │   │   'server': {
│   │   │   │   'interval': -1,
│   │   │   │   'train': False,
│   │   │   │   'val': False,
│   │   │   │   'test': False,
│   │   │   │   'model_in_train_mode': False
│   │   │   }
│   │   },
│   │   'verbose_gap': 10,
│   │   'monitor': None,
│   │   'use_cuda': True,
│   │   'save_log': True,
│   │   'save_model': False,
│   │   'save_learning_curve_plot': False,
│   │   'save_metrics': True,
│   │   'delete_useless_run': True
│   }
}
---------------------------- TRAINING EPOCH: 10 ----------------------------   
client [77] (testset)   loss: 0.4463 -> 0.2957  accuracy: 87.06% -> 90.59%     
client [81] (testset)   loss: 0.2632 -> 0.2249  accuracy: 90.04% -> 91.70%     
client [21] (testset)   loss: 0.1597 -> 0.1179  accuracy: 95.22% -> 96.17%     
client [68] (testset)   loss: 0.2105 -> 0.0672  accuracy: 93.30% -> 98.21%     
client [93] (testset)   loss: 0.1627 -> 0.0926  accuracy: 94.33% -> 97.16%     
client [31] (testset)   loss: 0.1556 -> 0.1095  accuracy: 96.26% -> 95.72%     
client [20] (testset)   loss: 0.2278 -> 0.1514  accuracy: 92.96% -> 95.07%     
client [59] (testset)   loss: 0.1148 -> 0.0826  accuracy: 97.92% -> 96.88%     
client [48] (testset)   loss: 0.1551 -> 0.1522  accuracy: 95.74% -> 95.04%     
client [34] (testset)   loss: 0.2607 -> 0.1136  accuracy: 92.13% -> 96.25%     
---------------------------- TRAINING EPOCH: 20 ----------------------------   
client [69] (testset)   loss: 0.1029 -> 0.1403  accuracy: 97.86% -> 95.00%     
client [99] (testset)   loss: 0.1872 -> 0.1280  accuracy: 93.49% -> 94.08%     
client [67] (testset)   loss: 0.1949 -> 0.0772  accuracy: 93.71% -> 97.71%     
client [0]  (testset)   loss: 0.1433 -> 0.1135  accuracy: 95.54% -> 96.82%     
client [76] (testset)   loss: 0.0872 -> 0.0652  accuracy: 97.27% -> 97.27%     
client [41] (testset)   loss: 0.1567 -> 0.1100  accuracy: 95.52% -> 96.86%     
client [62] (testset)   loss: 0.1021 -> 0.0249  accuracy: 96.97% -> 99.39%     
client [2]  (testset)   loss: 0.1051 -> 0.0604  accuracy: 96.43% -> 97.73%     
client [14] (testset)   loss: 0.1397 -> 0.1138  accuracy: 95.45% -> 97.73%     
client [46] (testset)   loss: 0.1519 -> 0.1307  accuracy: 93.58% -> 93.58%     
---------------------------- TRAINING EPOCH: 30 ----------------------------   
client [24] (testset)   loss: 0.0857 -> 0.0683  accuracy: 97.37% -> 97.89%     
client [68] (testset)   loss: 0.0521 -> 0.0362  accuracy: 97.32% -> 98.66%     
client [57] (testset)   loss: 0.0767 -> 0.1279  accuracy: 97.87% -> 96.81%     
client [17] (testset)   loss: 0.0743 -> 0.0524  accuracy: 96.77% -> 97.58%     
client [54] (testset)   loss: 0.0676 -> 0.0283  accuracy: 96.90% -> 99.56%     
client [23] (testset)   loss: 0.0523 -> 0.0183  accuracy: 98.26% -> 100.00%    
client [35] (testset)   loss: 0.1327 -> 0.0626  accuracy: 94.12% -> 97.48%     
client [59] (testset)   loss: 0.0390 -> 0.0410  accuracy: 100.00% -> 97.92%    
client [31] (testset)   loss: 0.0836 -> 0.0528  accuracy: 97.33% -> 98.40%     
client [9]  (testset)   loss: 0.0289 -> 0.0272  accuracy: 98.18% -> 98.18%     
---------------------------- TRAINING EPOCH: 40 ----------------------------   
client [64] (testset)   loss: 0.1163 -> 0.1382  accuracy: 96.83% -> 95.24%     
client [33] (testset)   loss: 0.0814 -> 0.0493  accuracy: 96.13% -> 98.34%     
client [16] (testset)   loss: 0.1823 -> 0.1507  accuracy: 94.96% -> 92.44%     
client [44] (testset)   loss: 0.0756 -> 0.7034  accuracy: 97.45% -> 85.84%     
client [8]  (testset)   loss: 0.0663 -> 0.0294  accuracy: 97.06% -> 98.53%     
client [31] (testset)   loss: 0.1226 -> 0.0501  accuracy: 97.33% -> 97.86%     
client [47] (testset)   loss: 0.0513 -> 0.0590  accuracy: 98.30% -> 97.73%     
client [36] (testset)   loss: 0.0671 -> 0.0506  accuracy: 96.91% -> 98.46%     
client [20] (testset)   loss: 0.1525 -> 0.0500  accuracy: 93.66% -> 97.89%     
client [56] (testset)   loss: 0.0821 -> 0.0685  accuracy: 97.31% -> 98.08%     
---------------------------- TRAINING EPOCH: 50 ----------------------------   
client [4]  (testset)   loss: 0.2336 -> 0.1913  accuracy: 98.73% -> 98.73%     
client [60] (testset)   loss: 0.0391 -> 0.0313  accuracy: 99.35% -> 98.69%     
client [28] (testset)   loss: 0.0577 -> 0.0537  accuracy: 98.04% -> 97.55%     
client [25] (testset)   loss: 0.0283 -> 0.0365  accuracy: 98.59% -> 98.59%     
client [58] (testset)   loss: 0.0857 -> 0.0959  accuracy: 97.96% -> 97.96%     
client [44] (testset)   loss: 0.0650 -> 0.0573  accuracy: 98.30% -> 98.30%     
client [39] (testset)   loss: 0.1279 -> 0.1344  accuracy: 96.32% -> 97.55%     
client [29] (testset)   loss: 0.0738 -> 0.0249  accuracy: 97.67% -> 99.42%     
client [3]  (testset)   loss: 0.1517 -> 0.1301  accuracy: 96.97% -> 96.97%     
client [84] (testset)   loss: 0.0449 -> 0.0254  accuracy: 98.21% -> 99.10%     
---------------------------- TRAINING EPOCH: 60 ----------------------------   
client [21] (testset)   loss: 0.0254 -> 0.0264  accuracy: 99.52% -> 98.56%     
client [84] (testset)   loss: 0.0490 -> 0.0180  accuracy: 98.65% -> 99.55%     
client [10] (testset)   loss: 0.0213 -> 0.0069  accuracy: 99.02% -> 99.51%     
client [36] (testset)   loss: 0.0472 -> 0.0550  accuracy: 98.46% -> 96.53%     
client [65] (testset)   loss: 0.0308 -> 0.0207  accuracy: 98.72% -> 99.15%     
client [81] (testset)   loss: 0.0730 -> 0.0760  accuracy: 98.34% -> 97.51%     
client [79] (testset)   loss: 0.1116 -> 0.0979  accuracy: 96.60% -> 97.28%     
client [42] (testset)   loss: 0.0839 -> 0.0820  accuracy: 98.08% -> 97.60%     
client [11] (testset)   loss: 0.0397 -> 0.0443  accuracy: 98.65% -> 96.86%     
client [96] (testset)   loss: 0.0453 -> 0.0267  accuracy: 98.60% -> 99.30%     
---------------------------- TRAINING EPOCH: 70 ----------------------------   
client [8]  (testset)   loss: 0.0704 -> 0.0298  accuracy: 95.59% -> 100.00%    
client [53] (testset)   loss: 0.0314 -> 0.0605  accuracy: 99.19% -> 96.75%     
client [52] (testset)   loss: 0.1843 -> 0.1591  accuracy: 94.81% -> 97.40%     
client [42] (testset)   loss: 0.0768 -> 0.0789  accuracy: 98.56% -> 97.60%     
client [69] (testset)   loss: 0.0771 -> 0.0495  accuracy: 98.57% -> 98.57%     
client [59] (testset)   loss: 0.0301 -> 0.0166  accuracy: 98.96% -> 98.96%     
client [7]  (testset)   loss: 0.0654 -> 0.0114  accuracy: 96.00% -> 99.56%     
client [26] (testset)   loss: 0.0696 -> 0.0328  accuracy: 97.56% -> 98.37%     
client [49] (testset)   loss: 0.0650 -> 0.0516  accuracy: 98.53% -> 97.79%     
client [98] (testset)   loss: 0.0855 -> 0.0570  accuracy: 96.19% -> 98.10%     
---------------------------- TRAINING EPOCH: 80 ----------------------------   
client [98] (testset)   loss: 0.0653 -> 0.0461  accuracy: 96.19% -> 98.10%     
client [47] (testset)   loss: 0.0419 -> 0.0396  accuracy: 98.30% -> 98.49%     
client [21] (testset)   loss: 0.0189 -> 0.0190  accuracy: 99.52% -> 99.52%     
client [77] (testset)   loss: 0.1196 -> 0.0833  accuracy: 95.29% -> 97.65%     
client [95] (testset)   loss: 0.0623 -> 0.0561  accuracy: 98.12% -> 97.18%     
client [91] (testset)   loss: 0.0369 -> 0.0316  accuracy: 98.23% -> 99.12%     
client [14] (testset)   loss: 0.0417 -> 0.0418  accuracy: 98.30% -> 97.73%     
client [99] (testset)   loss: 0.1147 -> 0.0594  accuracy: 95.86% -> 98.22%     
client [20] (testset)   loss: 0.0859 -> 0.0306  accuracy: 95.77% -> 97.89%     
client [39] (testset)   loss: 0.1251 -> 0.1342  accuracy: 97.55% -> 97.55%     
---------------------------- TRAINING EPOCH: 90 ----------------------------   
client [52] (testset)   loss: 0.1989 -> 0.1347  accuracy: 96.10% -> 98.70%     
client [62] (testset)   loss: 0.0170 -> 0.0147  accuracy: 100.00% -> 99.39%    
client [71] (testset)   loss: 0.0037 -> 0.0086  accuracy: 100.00% -> 100.00%   
client [97] (testset)   loss: 0.0533 -> 0.0326  accuracy: 98.88% -> 98.88%     
client [30] (testset)   loss: 0.0099 -> 0.0166  accuracy: 100.00% -> 99.35%    
client [88] (testset)   loss: 0.0219 -> 0.0012  accuracy: 98.99% -> 100.00%    
client [60] (testset)   loss: 0.0231 -> 0.0141  accuracy: 99.35% -> 99.35%     
client [82] (testset)   loss: 0.0711 -> 0.0596  accuracy: 98.74% -> 98.23%     
client [91] (testset)   loss: 0.0180 -> 0.0208  accuracy: 99.12% -> 99.12%     
client [57] (testset)   loss: 0.0433 -> 0.0508  accuracy: 97.87% -> 96.81%     
---------------------------- TRAINING EPOCH: 100 ----------------------------  
client [31] (testset)   loss: 0.0766 -> 0.0463  accuracy: 97.86% -> 98.93%     
client [15] (testset)   loss: 0.0461 -> 0.0232  accuracy: 98.06% -> 98.71%     
client [71] (testset)   loss: 0.0023 -> 0.0037  accuracy: 100.00% -> 100.00%   
client [97] (testset)   loss: 0.0454 -> 0.0286  accuracy: 98.88% -> 98.88%     
client [53] (testset)   loss: 0.0357 -> 0.0448  accuracy: 98.37% -> 97.56%     
client [77] (testset)   loss: 0.1193 -> 0.0859  accuracy: 95.29% -> 97.65%     
client [76] (testset)   loss: 0.0179 -> 0.0273  accuracy: 99.45% -> 99.45%     
client [79] (testset)   loss: 0.1176 -> 0.1049  accuracy: 97.28% -> 97.96%     
client [28] (testset)   loss: 0.0538 -> 0.0291  accuracy: 98.04% -> 98.53%     
client [99] (testset)   loss: 0.0771 -> 0.0543  accuracy: 97.63% -> 98.22%     
---------------------------- TRAINING EPOCH: 110 ----------------------------  
client [97] (testset)   loss: 0.0435 -> 0.0272  accuracy: 98.88% -> 98.88%     
client [86] (testset)   loss: 0.0295 -> 0.0498  accuracy: 99.49% -> 99.49%     
client [34] (testset)   loss: 0.0728 -> 0.0574  accuracy: 97.75% -> 98.13%     
client [73] (testset)   loss: 0.0268 -> 0.0248  accuracy: 99.42% -> 99.42%     
client [5]  (testset)   loss: 0.0658 -> 0.0799  accuracy: 98.24% -> 97.65%     
client [96] (testset)   loss: 0.0490 -> 0.0187  accuracy: 98.60% -> 99.65%     
client [22] (testset)   loss: 0.1060 -> 0.0277  accuracy: 95.56% -> 98.52%     
client [60] (testset)   loss: 0.0336 -> 0.0231  accuracy: 99.35% -> 99.35%     
client [66] (testset)   loss: 0.0603 -> 0.0381  accuracy: 97.07% -> 99.16%     
client [83] (testset)   loss: 0.0647 -> 0.0689  accuracy: 99.16% -> 99.16%     
---------------------------- TRAINING EPOCH: 120 ----------------------------  
client [76] (testset)   loss: 0.0167 -> 0.0232  accuracy: 99.45% -> 99.45%     
client [65] (testset)   loss: 0.0331 -> 0.0150  accuracy: 98.30% -> 99.57%     
client [95] (testset)   loss: 0.0366 -> 0.0407  accuracy: 98.59% -> 98.59%     
client [17] (testset)   loss: 0.0465 -> 0.0530  accuracy: 97.58% -> 97.58%     
client [8]  (testset)   loss: 0.0682 -> 0.0228  accuracy: 97.06% -> 100.00%    
client [35] (testset)   loss: 0.0465 -> 0.0282  accuracy: 98.32% -> 98.32%     
client [98] (testset)   loss: 0.0590 -> 0.0318  accuracy: 97.14% -> 98.10%     
client [53] (testset)   loss: 0.0233 -> 0.0315  accuracy: 99.19% -> 98.37%     
client [43] (testset)   loss: 0.1064 -> 0.1275  accuracy: 99.21% -> 98.41%     
client [64] (testset)   loss: 0.0497 -> 0.0597  accuracy: 97.62% -> 98.41%     
---------------------------- TRAINING EPOCH: 130 ----------------------------  
client [21] (testset)   loss: 0.0115 -> 0.0188  accuracy: 100.00% -> 99.04%    
client [88] (testset)   loss: 0.0133 -> 0.0010  accuracy: 98.99% -> 100.00%    
client [38] (testset)   loss: 0.0721 -> 0.0448  accuracy: 97.91% -> 99.48%     
client [3]  (testset)   loss: 0.1207 -> 0.1135  accuracy: 97.98% -> 97.98%     
client [5]  (testset)   loss: 0.0550 -> 0.0827  accuracy: 98.24% -> 97.65%     
client [41] (testset)   loss: 0.0847 -> 0.0662  accuracy: 98.21% -> 96.41%     
client [7]  (testset)   loss: 0.0513 -> 0.0063  accuracy: 97.33% -> 100.00%    
client [37] (testset)   loss: 0.0251 -> 0.0219  accuracy: 99.17% -> 99.17%     
client [45] (testset)   loss: 0.0561 -> 0.0385  accuracy: 98.59% -> 99.30%     
client [47] (testset)   loss: 0.0313 -> 0.0321  accuracy: 98.49% -> 99.05%     
---------------------------- TRAINING EPOCH: 140 ----------------------------  
client [16] (testset)   loss: 0.1399 -> 0.1116  accuracy: 95.80% -> 96.64%     
client [11] (testset)   loss: 0.0307 -> 0.0181  accuracy: 99.10% -> 99.55%     
client [37] (testset)   loss: 0.0251 -> 0.0263  accuracy: 99.17% -> 99.17%     
client [41] (testset)   loss: 0.0660 -> 0.0666  accuracy: 98.65% -> 96.41%     
client [95] (testset)   loss: 0.0345 -> 0.0325  accuracy: 98.12% -> 99.06%     
client [53] (testset)   loss: 0.0390 -> 0.0251  accuracy: 99.19% -> 99.19%     
client [22] (testset)   loss: 0.0420 -> 0.0200  accuracy: 97.78% -> 98.52%     
client [25] (testset)   loss: 0.0092 -> 0.0157  accuracy: 100.00% -> 98.59%    
client [69] (testset)   loss: 0.0458 -> 0.0362  accuracy: 98.57% -> 98.57%     
client [46] (testset)   loss: 0.0639 -> 0.0227  accuracy: 97.25% -> 100.00%    
---------------------------- TRAINING EPOCH: 150 ----------------------------  
client [47] (testset)   loss: 0.0279 -> 0.0335  accuracy: 98.87% -> 99.05%     
client [69] (testset)   loss: 0.0767 -> 0.0351  accuracy: 98.57% -> 98.57%     
client [82] (testset)   loss: 0.0674 -> 0.0747  accuracy: 98.48% -> 98.23%     
client [45] (testset)   loss: 0.0589 -> 0.0466  accuracy: 98.59% -> 98.59%     
client [7]  (testset)   loss: 0.0545 -> 0.0112  accuracy: 97.33% -> 99.11%     
client [50] (testset)   loss: 0.0499 -> 0.0258  accuracy: 97.75% -> 97.75%     
client [35] (testset)   loss: 0.0598 -> 0.0213  accuracy: 97.48% -> 99.16%     
client [24] (testset)   loss: 0.0188 -> 0.0124  accuracy: 99.47% -> 99.47%     
client [15] (testset)   loss: 0.0659 -> 0.0155  accuracy: 96.77% -> 99.35%     
client [58] (testset)   loss: 0.1093 -> 0.0967  accuracy: 97.45% -> 98.47%     
---------------------------- TRAINING EPOCH: 160 ----------------------------  
client [48] (testset)   loss: 0.0151 -> 0.0122  accuracy: 99.29% -> 99.29%     
client [76] (testset)   loss: 0.0125 -> 0.0187  accuracy: 99.45% -> 98.91%     
client [67] (testset)   loss: 0.0497 -> 0.0180  accuracy: 97.71% -> 99.43%     
client [37] (testset)   loss: 0.0218 -> 0.0214  accuracy: 99.17% -> 99.17%     
client [58] (testset)   loss: 0.0744 -> 0.0800  accuracy: 97.96% -> 98.98%     
client [64] (testset)   loss: 0.0613 -> 0.0513  accuracy: 98.41% -> 98.41%     
client [77] (testset)   loss: 0.1045 -> 0.0848  accuracy: 95.29% -> 95.29%     
client [55] (testset)   loss: 0.0213 -> 0.0093  accuracy: 99.47% -> 99.73%     
client [12] (testset)   loss: 0.0519 -> 0.0678  accuracy: 98.58% -> 98.58%     
client [89] (testset)   loss: 0.0100 -> 0.0079  accuracy: 99.58% -> 100.00%    
---------------------------- TRAINING EPOCH: 170 ----------------------------  
client [84] (testset)   loss: 0.0174 -> 0.0083  accuracy: 98.65% -> 99.55%     
client [51] (testset)   loss: 0.0225 -> 0.0138  accuracy: 98.51% -> 99.00%     
client [8]  (testset)   loss: 0.0671 -> 0.0135  accuracy: 98.53% -> 100.00%    
client [18] (testset)   loss: 0.0179 -> 0.0170  accuracy: 100.00% -> 99.26%    
client [94] (testset)   loss: 0.0393 -> 0.0256  accuracy: 98.78% -> 98.78%     
client [81] (testset)   loss: 0.0510 -> 0.0517  accuracy: 97.51% -> 98.34%     
client [3]  (testset)   loss: 0.1123 -> 0.1159  accuracy: 97.98% -> 97.98%     
client [11] (testset)   loss: 0.0204 -> 0.0133  accuracy: 98.65% -> 100.00%    
client [95] (testset)   loss: 0.0306 -> 0.0304  accuracy: 98.59% -> 99.06%     
client [67] (testset)   loss: 0.0374 -> 0.0204  accuracy: 98.29% -> 99.43%     
---------------------------- TRAINING EPOCH: 180 ----------------------------  
client [21] (testset)   loss: 0.0085 -> 0.0111  accuracy: 100.00% -> 100.00%   
client [79] (testset)   loss: 0.1202 -> 0.1071  accuracy: 97.96% -> 97.96%     
client [58] (testset)   loss: 0.0829 -> 0.0891  accuracy: 98.47% -> 98.47%     
client [88] (testset)   loss: 0.0059 -> 0.0005  accuracy: 100.00% -> 100.00%   
client [46] (testset)   loss: 0.0368 -> 0.0215  accuracy: 99.08% -> 99.08%     
client [11] (testset)   loss: 0.0188 -> 0.0164  accuracy: 99.10% -> 99.55%     
client [55] (testset)   loss: 0.0256 -> 0.0104  accuracy: 99.47% -> 99.73%     
client [13] (testset)   loss: 0.0629 -> 0.0417  accuracy: 98.45% -> 98.14%     
client [31] (testset)   loss: 0.0979 -> 0.0449  accuracy: 97.33% -> 98.93%     
client [75] (testset)   loss: 0.0131 -> 0.0041  accuracy: 100.00% -> 100.00%   
---------------------------- TRAINING EPOCH: 190 ----------------------------  
client [19] (testset)   loss: 0.0370 -> 0.0017  accuracy: 100.00% -> 100.00%   
client [7]  (testset)   loss: 0.0509 -> 0.0163  accuracy: 97.33% -> 100.00%    
client [57] (testset)   loss: 0.0495 -> 0.0325  accuracy: 97.87% -> 97.87%     
client [13] (testset)   loss: 0.0491 -> 0.0415  accuracy: 98.76% -> 98.14%     
client [43] (testset)   loss: 0.1232 -> 0.1601  accuracy: 98.41% -> 97.62%     
client [91] (testset)   loss: 0.0150 -> 0.0219  accuracy: 99.12% -> 99.12%     
client [10] (testset)   loss: 0.0246 -> 0.0036  accuracy: 99.02% -> 100.00%    
client [64] (testset)   loss: 0.0883 -> 0.0512  accuracy: 97.62% -> 98.41%     
client [82] (testset)   loss: 0.0753 -> 0.0710  accuracy: 98.74% -> 98.48%     
client [22] (testset)   loss: 0.0786 -> 0.0195  accuracy: 97.04% -> 99.26%     
---------------------------- TRAINING EPOCH: 200 ----------------------------  
client [20] (testset)   loss: 0.0624 -> 0.0155  accuracy: 96.48% -> 99.30%     
client [23] (testset)   loss: 0.0032 -> 0.0224  accuracy: 100.00% -> 99.13%    
client [88] (testset)   loss: 0.0046 -> 0.0005  accuracy: 100.00% -> 100.00%   
client [98] (testset)   loss: 0.0458 -> 0.0263  accuracy: 97.14% -> 99.05%     
client [79] (testset)   loss: 0.1158 -> 0.1104  accuracy: 97.28% -> 98.64%     
client [21] (testset)   loss: 0.0130 -> 0.0116  accuracy: 99.52% -> 100.00%    
client [92] (testset)   loss: 0.1061 -> 0.0895  accuracy: 98.25% -> 98.25%     
client [56] (testset)   loss: 0.0357 -> 0.0443  accuracy: 98.46% -> 98.46%     
client [5]  (testset)   loss: 0.0680 -> 0.0882  accuracy: 98.82% -> 98.24%     
client [52] (testset)   loss: 0.2078 -> 0.1468  accuracy: 96.10% -> 97.40%     
---------------------------- TRAINING EPOCH: 210 ----------------------------  
client [67] (testset)   loss: 0.0499 -> 0.0254  accuracy: 98.29% -> 98.86%     
client [54] (testset)   loss: 0.0278 -> 0.0048  accuracy: 98.67% -> 100.00%    
client [14] (testset)   loss: 0.0300 -> 0.0331  accuracy: 99.43% -> 98.30%     
client [99] (testset)   loss: 0.0690 -> 0.0537  accuracy: 97.63% -> 98.22%     
client [36] (testset)   loss: 0.0230 -> 0.0116  accuracy: 99.23% -> 99.23%     
client [30] (testset)   loss: 0.0077 -> 0.0144  accuracy: 99.35% -> 99.35%     
client [38] (testset)   loss: 0.0500 -> 0.0381  accuracy: 97.91% -> 99.48%     
client [15] (testset)   loss: 0.0354 -> 0.0112  accuracy: 98.06% -> 100.00%    
client [6]  (testset)   loss: 0.0279 -> 0.0670  accuracy: 99.34% -> 99.34%     
client [53] (testset)   loss: 0.0377 -> 0.0179  accuracy: 97.56% -> 99.19%     
---------------------------- TRAINING EPOCH: 220 ----------------------------  
client [99] (testset)   loss: 0.0697 -> 0.0596  accuracy: 97.63% -> 98.82%     
client [6]  (testset)   loss: 0.0332 -> 0.0618  accuracy: 99.34% -> 99.34%     
client [83] (testset)   loss: 0.0599 -> 0.0688  accuracy: 99.16% -> 99.16%     
client [42] (testset)   loss: 0.0689 -> 0.0548  accuracy: 98.56% -> 99.04%     
client [34] (testset)   loss: 0.0906 -> 0.0559  accuracy: 97.38% -> 98.50%     
client [15] (testset)   loss: 0.0372 -> 0.0125  accuracy: 99.35% -> 100.00%    
client [47] (testset)   loss: 0.0236 -> 0.0267  accuracy: 98.87% -> 99.24%     
client [55] (testset)   loss: 0.0161 -> 0.0071  accuracy: 99.20% -> 99.73%     
client [51] (testset)   loss: 0.0157 -> 0.0134  accuracy: 99.50% -> 99.00%     
client [95] (testset)   loss: 0.0349 -> 0.0334  accuracy: 98.59% -> 99.06%     
---------------------------- TRAINING EPOCH: 230 ----------------------------  
client [71] (testset)   loss: 0.0003 -> 0.0003  accuracy: 100.00% -> 100.00%   
client [15] (testset)   loss: 0.0260 -> 0.0093  accuracy: 98.71% -> 100.00%    
client [33] (testset)   loss: 0.0384 -> 0.0177  accuracy: 98.90% -> 99.45%     
client [99] (testset)   loss: 0.0951 -> 0.0537  accuracy: 97.63% -> 98.82%     
client [90] (testset)   loss: 0.0250 -> 0.0166  accuracy: 100.00% -> 99.28%    
client [57] (testset)   loss: 0.0229 -> 0.0199  accuracy: 98.94% -> 98.94%     
client [27] (testset)   loss: 0.0987 -> 0.1058  accuracy: 98.48% -> 97.46%     
client [78] (testset)   loss: 0.0022 -> 0.0019  accuracy: 100.00% -> 100.00%   
client [36] (testset)   loss: 0.0228 -> 0.0140  accuracy: 99.61% -> 99.23%     
client [88] (testset)   loss: 0.0027 -> 0.0004  accuracy: 100.00% -> 100.00%   
---------------------------- TRAINING EPOCH: 240 ----------------------------  
client [70] (testset)   loss: 0.0106 -> 0.0012  accuracy: 100.00% -> 100.00%   
client [35] (testset)   loss: 0.0334 -> 0.0183  accuracy: 98.32% -> 99.16%     
client [16] (testset)   loss: 0.1338 -> 0.1183  accuracy: 95.80% -> 97.48%     
client [80] (testset)   loss: 0.0091 -> 0.0041  accuracy: 100.00% -> 100.00%   
client [38] (testset)   loss: 0.0456 -> 0.0367  accuracy: 98.43% -> 99.48%     
client [78] (testset)   loss: 0.0037 -> 0.0027  accuracy: 100.00% -> 100.00%   
client [68] (testset)   loss: 0.0248 -> 0.0239  accuracy: 98.66% -> 99.11%     
client [11] (testset)   loss: 0.0150 -> 0.0116  accuracy: 99.10% -> 100.00%    
client [64] (testset)   loss: 0.0318 -> 0.0428  accuracy: 98.41% -> 99.21%     
client [82] (testset)   loss: 0.0648 -> 0.0813  accuracy: 98.99% -> 97.98%     
---------------------------- TRAINING EPOCH: 250 ----------------------------  
client [30] (testset)   loss: 0.0068 -> 0.0111  accuracy: 99.35% -> 99.35%     
client [27] (testset)   loss: 0.0916 -> 0.1130  accuracy: 98.48% -> 97.46%     
client [74] (testset)   loss: 0.0739 -> 0.0440  accuracy: 98.70% -> 98.70%     
client [45] (testset)   loss: 0.0459 -> 0.0478  accuracy: 98.59% -> 99.30%     
client [6]  (testset)   loss: 0.0367 -> 0.0674  accuracy: 98.68% -> 98.68%     
client [36] (testset)   loss: 0.0301 -> 0.0117  accuracy: 98.46% -> 99.61%     
client [63] (testset)   loss: 0.0856 -> 0.0995  accuracy: 99.07% -> 98.61%     
client [76] (testset)   loss: 0.0070 -> 0.0395  accuracy: 100.00% -> 98.36%    
client [83] (testset)   loss: 0.0570 -> 0.0624  accuracy: 99.16% -> 99.16%     
client [86] (testset)   loss: 0.0278 -> 0.0595  accuracy: 98.98% -> 98.98%     
---------------------------- TRAINING EPOCH: 260 ----------------------------  
client [83] (testset)   loss: 0.0650 -> 0.0683  accuracy: 99.16% -> 99.16%     
client [99] (testset)   loss: 0.0973 -> 0.0503  accuracy: 97.04% -> 98.82%     
client [74] (testset)   loss: 0.0694 -> 0.0584  accuracy: 98.70% -> 98.70%     
client [73] (testset)   loss: 0.0482 -> 0.0377  accuracy: 98.84% -> 99.42%     
client [29] (testset)   loss: 0.0538 -> 0.0196  accuracy: 98.26% -> 99.42%     
client [92] (testset)   loss: 0.1235 -> 0.1010  accuracy: 98.25% -> 98.25%     
client [6]  (testset)   loss: 0.0215 -> 0.0605  accuracy: 98.68% -> 98.68%     
client [61] (testset)   loss: 0.0949 -> 0.1189  accuracy: 98.74% -> 98.74%     
client [21] (testset)   loss: 0.0159 -> 0.0089  accuracy: 99.52% -> 99.52%     
client [67] (testset)   loss: 0.0485 -> 0.0169  accuracy: 98.29% -> 98.86%     
---------------------------- TRAINING EPOCH: 270 ----------------------------  
client [83] (testset)   loss: 0.0656 -> 0.0692  accuracy: 99.16% -> 99.16%     
client [32] (testset)   loss: 0.0319 -> 0.0165  accuracy: 98.48% -> 99.24%     
client [95] (testset)   loss: 0.0331 -> 0.0324  accuracy: 99.06% -> 99.06%     
client [61] (testset)   loss: 0.0994 -> 0.1201  accuracy: 98.74% -> 98.74%     
client [27] (testset)   loss: 0.1058 -> 0.1168  accuracy: 98.48% -> 96.95%     
client [25] (testset)   loss: 0.0020 -> 0.0078  accuracy: 100.00% -> 100.00%   
client [68] (testset)   loss: 0.0089 -> 0.0223  accuracy: 100.00% -> 99.11%    
client [34] (testset)   loss: 0.0689 -> 0.0500  accuracy: 98.50% -> 98.50%     
client [71] (testset)   loss: 0.0003 -> 0.0004  accuracy: 100.00% -> 100.00%   
client [89] (testset)   loss: 0.0075 -> 0.0056  accuracy: 100.00% -> 100.00%   
---------------------------- TRAINING EPOCH: 280 ----------------------------  
client [78] (testset)   loss: 0.0046 -> 0.0023  accuracy: 100.00% -> 100.00%   
client [81] (testset)   loss: 0.0598 -> 0.0408  accuracy: 98.34% -> 98.34%     
client [51] (testset)   loss: 0.0109 -> 0.0107  accuracy: 100.00% -> 99.00%    
client [54] (testset)   loss: 0.0176 -> 0.0021  accuracy: 99.12% -> 100.00%    
client [65] (testset)   loss: 0.0279 -> 0.0089  accuracy: 98.72% -> 99.57%     
client [41] (testset)   loss: 0.0507 -> 0.0526  accuracy: 98.65% -> 97.31%     
client [11] (testset)   loss: 0.0135 -> 0.0154  accuracy: 99.10% -> 99.55%     
client [85] (testset)   loss: 0.0450 -> 0.0261  accuracy: 98.50% -> 98.88%     
client [12] (testset)   loss: 0.0505 -> 0.0734  accuracy: 98.58% -> 98.58%     
client [23] (testset)   loss: 0.0087 -> 0.0229  accuracy: 100.00% -> 99.13%    
---------------------------- TRAINING EPOCH: 290 ----------------------------  
client [16] (testset)   loss: 0.1233 -> 0.0976  accuracy: 95.80% -> 95.80%     
client [65] (testset)   loss: 0.0118 -> 0.0069  accuracy: 99.57% -> 100.00%    
client [53] (testset)   loss: 0.0262 -> 0.0106  accuracy: 99.19% -> 100.00%    
client [58] (testset)   loss: 0.0831 -> 0.0827  accuracy: 98.47% -> 98.47%     
client [72] (testset)   loss: 0.0530 -> 0.0265  accuracy: 98.14% -> 99.38%     
client [7]  (testset)   loss: 0.0244 -> 0.0035  accuracy: 99.11% -> 100.00%    
client [71] (testset)   loss: 0.0003 -> 0.0004  accuracy: 100.00% -> 100.00%   
client [59] (testset)   loss: 0.0189 -> 0.0092  accuracy: 98.96% -> 100.00%    
client [86] (testset)   loss: 0.0350 -> 0.0658  accuracy: 99.49% -> 98.98%     
client [39] (testset)   loss: 0.1473 -> 0.1469  accuracy: 98.16% -> 98.16%     
---------------------------- TRAINING EPOCH: 300 ----------------------------  
client [99] (testset)   loss: 0.0584 -> 0.0587  accuracy: 98.82% -> 98.82%     
client [7]  (testset)   loss: 0.0445 -> 0.0055  accuracy: 97.78% -> 99.56%     
client [17] (testset)   loss: 0.0195 -> 0.0495  accuracy: 99.19% -> 98.39%     
client [64] (testset)   loss: 0.0719 -> 0.0448  accuracy: 98.41% -> 98.41%     
client [37] (testset)   loss: 0.0370 -> 0.0243  accuracy: 99.17% -> 99.17%     
client [29] (testset)   loss: 0.0350 -> 0.0199  accuracy: 98.84% -> 99.42%     
client [93] (testset)   loss: 0.0059 -> 0.0170  accuracy: 100.00% -> 98.58%    
client [73] (testset)   loss: 0.0137 -> 0.0315  accuracy: 99.42% -> 99.42%     
client [40] (testset)   loss: 0.0189 -> 0.0162  accuracy: 99.32% -> 99.66%     
client [76] (testset)   loss: 0.0085 -> 0.0148  accuracy: 99.45% -> 98.91%     
---------------------------- TRAINING EPOCH: 310 ----------------------------  
client [31] (testset)   loss: 0.0694 -> 0.0477  accuracy: 98.93% -> 98.93%     
client [89] (testset)   loss: 0.0113 -> 0.0101  accuracy: 99.58% -> 99.58%     
client [77] (testset)   loss: 0.1302 -> 0.1102  accuracy: 96.47% -> 96.47%     
client [90] (testset)   loss: 0.0323 -> 0.0097  accuracy: 97.84% -> 100.00%    
client [26] (testset)   loss: 0.0319 -> 0.0036  accuracy: 99.19% -> 100.00%    
client [50] (testset)   loss: 0.0507 -> 0.0245  accuracy: 97.75% -> 98.88%     
client [30] (testset)   loss: 0.0022 -> 0.0118  accuracy: 100.00% -> 99.35%    
client [70] (testset)   loss: 0.0013 -> 0.0006  accuracy: 100.00% -> 100.00%   
client [41] (testset)   loss: 0.0480 -> 0.0465  accuracy: 98.65% -> 97.76%     
client [99] (testset)   loss: 0.0577 -> 0.0615  accuracy: 98.22% -> 98.82%     
---------------------------- TRAINING EPOCH: 320 ----------------------------  
client [68] (testset)   loss: 0.0214 -> 0.0156  accuracy: 98.66% -> 99.11%     
client [70] (testset)   loss: 0.0151 -> 0.0017  accuracy: 100.00% -> 100.00%   
client [52] (testset)   loss: 0.1837 -> 0.1431  accuracy: 96.10% -> 98.70%     
client [1]  (testset)   loss: 0.0560 -> 0.0604  accuracy: 97.74% -> 97.18%     
client [2]  (testset)   loss: 0.0182 -> 0.0063  accuracy: 99.03% -> 99.68%     
client [67] (testset)   loss: 0.0394 -> 0.0198  accuracy: 98.29% -> 98.86%     
client [92] (testset)   loss: 0.1024 -> 0.0646  accuracy: 98.25% -> 98.25%     
client [35] (testset)   loss: 0.0495 -> 0.0113  accuracy: 98.32% -> 99.16%     
client [36] (testset)   loss: 0.0292 -> 0.0127  accuracy: 99.23% -> 99.61%     
client [64] (testset)   loss: 0.0624 -> 0.0523  accuracy: 97.62% -> 98.41%     
---------------------------- TRAINING EPOCH: 330 ----------------------------  
client [44] (testset)   loss: 0.0552 -> 0.0371  accuracy: 98.58% -> 98.87%     
client [6]  (testset)   loss: 0.0183 -> 0.0546  accuracy: 99.34% -> 99.34%     
client [12] (testset)   loss: 0.0429 -> 0.0672  accuracy: 98.58% -> 98.58%     
client [55] (testset)   loss: 0.0159 -> 0.0049  accuracy: 99.47% -> 99.73%     
client [29] (testset)   loss: 0.0512 -> 0.0181  accuracy: 98.84% -> 99.42%     
client [9]  (testset)   loss: 0.0020 -> 0.0002  accuracy: 100.00% -> 100.00%   
client [43] (testset)   loss: 0.1503 -> 0.1857  accuracy: 98.41% -> 97.62%     
client [77] (testset)   loss: 0.1478 -> 0.1251  accuracy: 96.47% -> 96.47%     
client [98] (testset)   loss: 0.0745 -> 0.0299  accuracy: 97.14% -> 98.10%     
client [78] (testset)   loss: 0.0055 -> 0.0020  accuracy: 100.00% -> 100.00%   
---------------------------- TRAINING EPOCH: 340 ----------------------------  
client [92] (testset)   loss: 0.1302 -> 0.0840  accuracy: 98.25% -> 98.25%     
client [80] (testset)   loss: 0.0027 -> 0.0020  accuracy: 100.00% -> 100.00%   
client [63] (testset)   loss: 0.0875 -> 0.0987  accuracy: 99.07% -> 99.07%     
client [76] (testset)   loss: 0.0078 -> 0.0165  accuracy: 99.45% -> 99.45%     
client [78] (testset)   loss: 0.0074 -> 0.0028  accuracy: 100.00% -> 100.00%   
client [25] (testset)   loss: 0.0036 -> 0.0181  accuracy: 100.00% -> 98.59%    
client [58] (testset)   loss: 0.0706 -> 0.0799  accuracy: 98.98% -> 98.98%     
client [13] (testset)   loss: 0.0415 -> 0.0336  accuracy: 98.76% -> 98.76%     
client [17] (testset)   loss: 0.0441 -> 0.0673  accuracy: 97.58% -> 97.58%     
client [38] (testset)   loss: 0.0271 -> 0.0258  accuracy: 99.48% -> 98.95%     
---------------------------- TRAINING EPOCH: 350 ----------------------------  
client [72] (testset)   loss: 0.0585 -> 0.0261  accuracy: 97.83% -> 98.76%     
client [82] (testset)   loss: 0.0601 -> 0.0779  accuracy: 99.24% -> 98.74%     
client [86] (testset)   loss: 0.0289 -> 0.0630  accuracy: 98.98% -> 98.98%     
client [51] (testset)   loss: 0.0196 -> 0.0137  accuracy: 99.50% -> 99.00%     
client [96] (testset)   loss: 0.0382 -> 0.0136  accuracy: 98.95% -> 99.65%     
client [42] (testset)   loss: 0.0676 -> 0.0535  accuracy: 98.56% -> 99.04%     
client [55] (testset)   loss: 0.0070 -> 0.0043  accuracy: 99.73% -> 99.73%     
client [13] (testset)   loss: 0.0279 -> 0.0329  accuracy: 98.45% -> 98.45%     
client [1]  (testset)   loss: 0.0568 -> 0.0668  accuracy: 98.31% -> 97.74%     
client [12] (testset)   loss: 0.0482 -> 0.0602  accuracy: 97.87% -> 98.58%     
---------------------------- TRAINING EPOCH: 360 ----------------------------  
client [68] (testset)   loss: 0.0300 -> 0.0172  accuracy: 99.11% -> 99.55%     
client [23] (testset)   loss: 0.0089 -> 0.0206  accuracy: 99.13% -> 99.13%     
client [46] (testset)   loss: 0.0365 -> 0.0244  accuracy: 97.25% -> 98.17%     
client [41] (testset)   loss: 0.0395 -> 0.0500  accuracy: 98.21% -> 97.31%     
client [25] (testset)   loss: 0.0021 -> 0.0069  accuracy: 100.00% -> 100.00%   
client [58] (testset)   loss: 0.1036 -> 0.0866  accuracy: 97.96% -> 98.98%     
client [14] (testset)   loss: 0.0378 -> 0.0302  accuracy: 99.43% -> 99.43%     
client [33] (testset)   loss: 0.0382 -> 0.0148  accuracy: 97.79% -> 99.45%     
client [85] (testset)   loss: 0.0596 -> 0.0267  accuracy: 98.13% -> 98.88%     
client [62] (testset)   loss: 0.0221 -> 0.0287  accuracy: 98.79% -> 99.39%     
---------------------------- TRAINING EPOCH: 370 ----------------------------  
client [98] (testset)   loss: 0.0595 -> 0.0276  accuracy: 98.10% -> 98.10%     
client [63] (testset)   loss: 0.0980 -> 0.1053  accuracy: 98.15% -> 99.07%     
client [70] (testset)   loss: 0.0057 -> 0.0007  accuracy: 100.00% -> 100.00%   
client [65] (testset)   loss: 0.0208 -> 0.0077  accuracy: 98.72% -> 99.57%     
client [14] (testset)   loss: 0.0251 -> 0.0291  accuracy: 99.43% -> 98.86%     
client [73] (testset)   loss: 0.0309 -> 0.0391  accuracy: 98.84% -> 99.42%     
client [34] (testset)   loss: 0.0748 -> 0.0465  accuracy: 98.13% -> 98.50%     
client [99] (testset)   loss: 0.0769 -> 0.0627  accuracy: 98.82% -> 98.82%     
client [69] (testset)   loss: 0.0483 -> 0.0412  accuracy: 98.57% -> 98.57%     
client [46] (testset)   loss: 0.0384 -> 0.0239  accuracy: 99.08% -> 99.08%     
---------------------------- TRAINING EPOCH: 380 ----------------------------  
client [99] (testset)   loss: 0.0754 -> 0.0597  accuracy: 98.22% -> 98.82%     
client [93] (testset)   loss: 0.0039 -> 0.0107  accuracy: 100.00% -> 99.29%    
client [11] (testset)   loss: 0.0088 -> 0.0083  accuracy: 99.55% -> 100.00%    
client [58] (testset)   loss: 0.0797 -> 0.0775  accuracy: 97.96% -> 98.47%     
client [81] (testset)   loss: 0.0453 -> 0.0319  accuracy: 97.93% -> 97.93%     
client [85] (testset)   loss: 0.0543 -> 0.0240  accuracy: 98.13% -> 98.88%     
client [89] (testset)   loss: 0.0101 -> 0.0066  accuracy: 99.58% -> 100.00%    
client [45] (testset)   loss: 0.0485 -> 0.0399  accuracy: 98.59% -> 99.30%     
client [8]  (testset)   loss: 0.0458 -> 0.0163  accuracy: 98.53% -> 98.53%     
client [68] (testset)   loss: 0.0168 -> 0.0145  accuracy: 99.11% -> 99.55%     
---------------------------- TRAINING EPOCH: 390 ----------------------------  
client [67] (testset)   loss: 0.0540 -> 0.0190  accuracy: 98.29% -> 99.43%     
client [72] (testset)   loss: 0.0453 -> 0.0248  accuracy: 97.83% -> 99.07%     
client [1]  (testset)   loss: 0.0464 -> 0.0545  accuracy: 98.31% -> 97.74%     
client [78] (testset)   loss: 0.0240 -> 0.0013  accuracy: 98.80% -> 100.00%    
client [83] (testset)   loss: 0.0758 -> 0.0740  accuracy: 99.16% -> 99.16%     
client [21] (testset)   loss: 0.0220 -> 0.0063  accuracy: 99.04% -> 99.52%     
client [56] (testset)   loss: 0.0292 -> 0.0353  accuracy: 98.46% -> 98.46%     
client [44] (testset)   loss: 0.0418 -> 0.0427  accuracy: 98.87% -> 98.87%     
client [92] (testset)   loss: 0.1281 -> 0.0640  accuracy: 96.49% -> 98.25%     
client [27] (testset)   loss: 0.0944 -> 0.1090  accuracy: 97.97% -> 97.46%     
---------------------------- TRAINING EPOCH: 400 ----------------------------  
client [10] (testset)   loss: 0.0208 -> 0.0049  accuracy: 99.02% -> 100.00%    
client [39] (testset)   loss: 0.1707 -> 0.1498  accuracy: 98.16% -> 97.55%     
client [65] (testset)   loss: 0.0218 -> 0.0075  accuracy: 98.72% -> 100.00%    
client [26] (testset)   loss: 0.0423 -> 0.0104  accuracy: 99.19% -> 99.19%     
client [19] (testset)   loss: 0.0176 -> 0.0031  accuracy: 100.00% -> 100.00%   
client [68] (testset)   loss: 0.0118 -> 0.0145  accuracy: 100.00% -> 99.55%    
client [41] (testset)   loss: 0.0653 -> 0.0518  accuracy: 98.21% -> 97.31%     
client [50] (testset)   loss: 0.0415 -> 0.0265  accuracy: 98.88% -> 98.88%     
client [75] (testset)   loss: 0.0344 -> 0.0065  accuracy: 97.44% -> 100.00%    
client [81] (testset)   loss: 0.0422 -> 0.0302  accuracy: 98.34% -> 98.34%     
Training... ---------------------------------------- 100% 0:12:26
FedAvg's average time taken by each global epoch: 0 min 1.86 sec.              
FedAvg's total running time: 0 h 12 m 26 s.                                    
==================== FedAvg Experiment Results: ====================           
Display format: (before local fine-tuning) -> (after local fine-tuning)        
 So if finetune_epoch = 0, x.xx% -> 0.00% is normal.                           
 Centralized testing ONLY happens after model aggregation, so the stats between
'->' are the same.                                                             
{                                                                              
    "100": {                                                                   
        "all_clients": {                                                       
            "test": {                                                          
                "loss": "0.0525 -> 0.0000",                                    
                "accuracy": "98.40% -> 0.00%"                                  
            }                                                                  
        }                                                                      
    },                                                                         
    "200": {                                                                   
        "all_clients": {                                                       
            "test": {                                                          
                "loss": "0.0459 -> 0.0000",                                    
                "accuracy": "98.65% -> 0.00%"                                  
            }                                                                  
        }                                                                      
    },                                                                         
    "300": {                                                                   
        "all_clients": {                                                       
            "test": {                                                          
                "loss": "0.0466 -> 0.0000",                                    
                "accuracy": "98.76% -> 0.00%"                                  
            }                                                                  
        }                                                                      
    },                                                                         
    "400": {                                                                   
        "all_clients": {                                                       
            "test": {                                                          
                "loss": "0.0435 -> 0.0000",                                    
                "accuracy": "98.84% -> 0.00%"                                  
            }                                                                  
        }                                                                      
    }                                                                          
}                                                                              
==================== FedAvg Max Accuracy ====================                  
all_clients:                                                                   
(test) before fine-tuning: 98.84% at epoch 400                                 
(test) after fine-tuning: 0.00% at epoch 100                                   
[0m