==================== FedAvg ====================                               
Experiment Arguments:                                                          
{
│   'method': 'fedavg',
│   'dataset': {
│   │   'name': 'medmnistA',
│   │   'client_num': 100,
│   │   'test_ratio': 0.25,
│   │   'val_ratio': 0.0,
│   │   'seed': 42,
│   │   'split': 'sample',
│   │   'IID_ratio': 0.0,
│   │   'monitor_window_name_suffix': 'medmnistA-100clients-0%IID-Dir(0.5)-seed42',
│   │   'alpha': 0.5,
│   │   'min_samples_per_client': 10
│   },
│   'model': {
│   │   'name': 'lenet5',
│   │   'use_torchvision_pretrained_weights': True,
│   │   'external_model_weights_path': None
│   },
│   'optimizer': {
│   │   'lr': 0.01,
│   │   'dampening': 0,
│   │   'weight_decay': 0,
│   │   'momentum': 0,
│   │   'nesterov': False,
│   │   'name': 'sgd'
│   },
│   'mode': 'serial',
│   'parallel': {
│   │   'ray_cluster_addr': None,
│   │   'num_cpus': None,
│   │   'num_gpus': None,
│   │   'num_workers': 2
│   },
│   'common': {
│   │   'seed': 42,
│   │   'join_ratio': 0.1,
│   │   'global_epoch': 400,
│   │   'local_epoch': 5,
│   │   'batch_size': 32,
│   │   'reset_optimizer_on_global_epoch': True,
│   │   'straggler_ratio': 0,
│   │   'straggler_min_local_epoch': 0,
│   │   'buffers': 'global',
│   │   'client_side_evaluation': True,
│   │   'test': {
│   │   │   'client': {
│   │   │   │   'interval': 100,
│   │   │   │   'finetune_epoch': 0,
│   │   │   │   'train': False,
│   │   │   │   'val': False,
│   │   │   │   'test': True
│   │   │   },
│   │   │   'server': {
│   │   │   │   'interval': -1,
│   │   │   │   'train': False,
│   │   │   │   'val': False,
│   │   │   │   'test': False,
│   │   │   │   'model_in_train_mode': False
│   │   │   }
│   │   },
│   │   'verbose_gap': 10,
│   │   'monitor': None,
│   │   'use_cuda': True,
│   │   'save_log': True,
│   │   'save_model': False,
│   │   'save_learning_curve_plot': False,
│   │   'save_metrics': True,
│   │   'delete_useless_run': True
│   }
}
---------------------------- TRAINING EPOCH: 10 ----------------------------   
client [77] (testset)   loss: 59.5347 -> 51.1504    accuracy: 32.50% -> 32.50% 
client [81] (testset)   loss: 75.6903 -> 139.4797   accuracy: 0.00% -> 10.62%  
client [21] (testset)   loss: 71.1015 -> 23.9571    accuracy: 0.00% -> 9.24%   
client [68] (testset)   loss: 81.2684 -> 192.3340   accuracy: 0.00% -> 20.57%  
client [93] (testset)   loss: 81.6906 -> 17.4477    accuracy: 1.16% -> 70.93%  
client [31] (testset)   loss: 48.0792 -> 87.9808    accuracy: 2.13% -> 58.87%  
client [20] (testset)   loss: 55.3941 -> 43.9212    accuracy: 34.69% -> 8.16%  
client [59] (testset)   loss: 30.5675 -> 49.6071    accuracy: 41.52% -> 27.88% 
client [48] (testset)   loss: 62.9509 -> 40.6484    accuracy: 31.45% -> 5.03%  
client [34] (testset)   loss: 77.7998 -> 98.1978    accuracy: 8.33% -> 8.33%   
---------------------------- TRAINING EPOCH: 20 ----------------------------   
client [69] (testset)   loss: 5.9655 -> 83.8535 accuracy: 9.58% -> 25.15%      
client [99] (testset)   loss: 6.7634 -> 488.6677    accuracy: 15.79% -> 26.32% 
client [67] (testset)   loss: 4.7068 -> 242.2563    accuracy: 16.37% -> 0.00%  
client [0]  (testset)   loss: 4.4143 -> 32.6892 accuracy: 46.99% -> 0.00%      
client [76] (testset)   loss: 3.3688 -> 163.7349    accuracy: 18.75% -> 0.78%  
client [41] (testset)   loss: 5.7467 -> 24.9481 accuracy: 6.75% -> 4.91%       
client [62] (testset)   loss: 3.5553 -> 51.7354 accuracy: 21.33% -> 55.56%     
client [2]  (testset)   loss: 4.5517 -> 160.3072    accuracy: 24.72% -> 20.22% 
client [14] (testset)   loss: 4.1513 -> 53.4433 accuracy: 33.87% -> 6.45%      
client [46] (testset)   loss: 3.3921 -> 830.8642    accuracy: 41.56% -> 2.60%  
---------------------------- TRAINING EPOCH: 30 ----------------------------   
client [24] (testset)   loss: 41.3125 -> 198.8902   accuracy: 1.00% -> 0.00%   
client [68] (testset)   loss: 32.6074 -> 178.2499   accuracy: 20.57% -> 20.57% 
client [57] (testset)   loss: 42.7638 -> 28.3220    accuracy: 0.96% -> 22.97%  
client [17] (testset)   loss: 23.4111 -> 173.1741   accuracy: 58.91% -> 58.91% 
client [54] (testset)   loss: 33.8862 -> 22.6652    accuracy: 2.58% -> 36.16%  
client [23] (testset)   loss: 64.3695 -> 8.7313 accuracy: 0.00% -> 61.22%      
client [35] (testset)   loss: 29.9595 -> 90.4654    accuracy: 36.16% -> 1.69%  
client [59] (testset)   loss: 38.9502 -> 120.6416   accuracy: 27.88% -> 3.33%  
client [31] (testset)   loss: 29.6063 -> 506.1697   accuracy: 58.87% -> 2.13%  
client [9]  (testset)   loss: 61.8594 -> 70.6721    accuracy: 0.52% -> 7.77%   
---------------------------- TRAINING EPOCH: 40 ----------------------------   
client [64] (testset)   loss: 91.1102 -> 8.7472 accuracy: 1.67% -> 17.50%      
client [33] (testset)   loss: 73.6214 -> 74.6223    accuracy: 9.52% -> 9.52%   
client [16] (testset)   loss: 43.6844 -> 303.8666   accuracy: 0.00% -> 10.17%  
client [44] (testset)   loss: 121.5375 -> 10.1579   accuracy: 2.65% -> 65.93%  
client [8]  (testset)   loss: 79.1168 -> 22.2127    accuracy: 13.17% -> 5.35%  
client [31] (testset)   loss: 104.5734 -> 38.9412   accuracy: 13.48% -> 13.48% 
client [47] (testset)   loss: 60.2991 -> 457.6746   accuracy: 1.17% -> 1.17%   
client [36] (testset)   loss: 105.8528 -> 85.7074   accuracy: 0.76% -> 32.58%  
client [20] (testset)   loss: 98.7193 -> 5.6976 accuracy: 8.16% -> 34.69%      
client [56] (testset)   loss: 69.3569 -> 243.4862   accuracy: 4.05% -> 4.05%   
---------------------------- TRAINING EPOCH: 50 ----------------------------   
client [4]  (testset)   loss: 65.7926 -> 125.1670   accuracy: 0.00% -> 23.81%  
client [60] (testset)   loss: 40.6813 -> 19.5542    accuracy: 53.77% -> 1.89%  
client [28] (testset)   loss: 64.2960 -> 84.1228    accuracy: 4.11% -> 4.11%   
client [25] (testset)   loss: 64.0569 -> 35.1590    accuracy: 2.56% -> 2.56%   
client [58] (testset)   loss: 66.2284 -> 238.5729   accuracy: 12.30% -> 0.79%  
client [44] (testset)   loss: 37.6790 -> 163.1721   accuracy: 10.62% -> 10.62% 
client [39] (testset)   loss: 63.8303 -> 24.7021    accuracy: 0.00% -> 7.27%   
client [29] (testset)   loss: 90.0114 -> 77.3877    accuracy: 0.00% -> 21.93%  
client [3]  (testset)   loss: 83.6181 -> 114.6096   accuracy: 9.79% -> 0.00%   
client [84] (testset)   loss: 87.0176 -> 103.4306   accuracy: 3.42% -> 0.68%   
---------------------------- TRAINING EPOCH: 60 ----------------------------   
client [21] (testset)   loss: 10.6633 -> 53.0355    accuracy: 21.85% -> 11.76% 
client [84] (testset)   loss: 7.8568 -> 65.9691 accuracy: 11.64% -> 19.86%     
client [10] (testset)   loss: 13.6744 -> 207.9240   accuracy: 4.29% -> 17.17%  
client [36] (testset)   loss: 15.3607 -> 45.9178    accuracy: 6.82% -> 3.03%   
client [65] (testset)   loss: 12.3431 -> 231.0979   accuracy: 10.19% -> 37.96% 
client [81] (testset)   loss: 11.9336 -> 45.0525    accuracy: 25.88% -> 10.62% 
client [79] (testset)   loss: 17.8652 -> 28.3974    accuracy: 13.33% -> 25.00% 
client [42] (testset)   loss: 12.7192 -> 114.3758   accuracy: 19.05% -> 26.67% 
client [11] (testset)   loss: 16.2227 -> 139.7040   accuracy: 11.93% -> 26.15% 
client [96] (testset)   loss: 4.9668 -> 45.8906 accuracy: 57.89% -> 21.05%     
---------------------------- TRAINING EPOCH: 70 ----------------------------   
client [8]  (testset)   loss: 60.0209 -> 171.6403   accuracy: 3.29% -> 13.17%  
client [53] (testset)   loss: 43.5350 -> 162.0437   accuracy: 28.46% -> 28.46% 
client [52] (testset)   loss: 51.5634 -> 126.1119   accuracy: 13.51% -> 18.92% 
client [42] (testset)   loss: 60.3721 -> 113.3326   accuracy: 4.44% -> 6.35%   
client [69] (testset)   loss: 43.4918 -> 102.9284   accuracy: 25.15% -> 0.60%  
client [59] (testset)   loss: 34.3569 -> 140.0218   accuracy: 41.52% -> 14.55% 
client [7]  (testset)   loss: 23.6555 -> 67.5589    accuracy: 61.40% -> 7.89%  
client [26] (testset)   loss: 67.0582 -> 28.2569    accuracy: 0.00% -> 3.85%   
client [49] (testset)   loss: 61.1851 -> 179.1911   accuracy: 3.00% -> 11.00%  
client [98] (testset)   loss: 57.6957 -> 249.9075   accuracy: 0.66% -> 6.62%   
---------------------------- TRAINING EPOCH: 80 ----------------------------   
client [98] (testset)   loss: 16.4774 -> 825.9691   accuracy: 18.54% -> 6.62%  
client [47] (testset)   loss: 12.1434 -> 144.8591   accuracy: 47.95% -> 40.35% 
client [21] (testset)   loss: 28.5886 -> 97.2111    accuracy: 0.84% -> 18.49%  
client [77] (testset)   loss: 23.0592 -> 36.9636    accuracy: 13.75% -> 26.25% 
client [95] (testset)   loss: 14.0759 -> 19.5336    accuracy: 1.60% -> 71.20%  
client [91] (testset)   loss: 16.3617 -> 47.7697    accuracy: 18.63% -> 2.94%  
client [14] (testset)   loss: 25.1583 -> 151.7820   accuracy: 11.29% -> 19.35% 
client [99] (testset)   loss: 23.8540 -> 74.1638    accuracy: 8.77% -> 26.32%  
client [20] (testset)   loss: 37.7049 -> 104.8917   accuracy: 0.00% -> 0.00%   
client [39] (testset)   loss: 13.9131 -> 42.3511    accuracy: 27.27% -> 24.55% 
---------------------------- TRAINING EPOCH: 90 ----------------------------   
client [52] (testset)   loss: 108.2767 -> 33.8342   accuracy: 13.51% -> 20.27% 
client [62] (testset)   loss: 115.2369 -> 53.9886   accuracy: 2.22% -> 5.33%   
client [71] (testset)   loss: 138.8471 -> 11.7971   accuracy: 2.27% -> 52.27%  
client [97] (testset)   loss: 64.0357 -> 49.5475    accuracy: 48.88% -> 15.73% 
client [30] (testset)   loss: 126.2442 -> 39.4305   accuracy: 9.35% -> 46.04%  
client [88] (testset)   loss: 122.0018 -> 92.3796   accuracy: 0.00% -> 6.80%   
client [60] (testset)   loss: 154.8442 -> 97.0186   accuracy: 1.89% -> 52.83%  
client [82] (testset)   loss: 113.4445 -> 111.0701  accuracy: 11.97% -> 0.00%  
client [91] (testset)   loss: 110.3962 -> 44.4929   accuracy: 11.76% -> 9.80%  
client [57] (testset)   loss: 123.2804 -> 88.1897   accuracy: 20.57% -> 20.57% 
---------------------------- TRAINING EPOCH: 100 ----------------------------  
client [31] (testset)   loss: 78.2014 -> 129.5884   accuracy: 4.26% -> 58.87%  
client [15] (testset)   loss: 77.6047 -> 92.7230    accuracy: 7.85% -> 8.90%   
client [71] (testset)   loss: 33.7881 -> 80.7694    accuracy: 45.45% -> 45.45% 
client [97] (testset)   loss: 80.5612 -> 265.3798   accuracy: 2.25% -> 48.88%  
client [53] (testset)   loss: 77.8566 -> 225.6058   accuracy: 0.77% -> 3.85%   
client [77] (testset)   loss: 63.2972 -> 135.6378   accuracy: 7.50% -> 32.50%  
client [76] (testset)   loss: 59.3116 -> 191.4972   accuracy: 19.53% -> 0.78%  
client [79] (testset)   loss: 56.2870 -> 17.2477    accuracy: 13.33% -> 11.67% 
client [28] (testset)   loss: 44.7214 -> 86.9088    accuracy: 17.81% -> 0.00%  
client [99] (testset)   loss: 70.9532 -> 135.7828   accuracy: 7.02% -> 3.51%   
---------------------------- TRAINING EPOCH: 110 ----------------------------  
client [97] (testset)   loss: 39.6896 -> 11.7099    accuracy: 5.62% -> 23.03%  
client [86] (testset)   loss: 33.5937 -> 7.1911 accuracy: 15.19% -> 35.44%     
client [34] (testset)   loss: 24.4437 -> 106.8448   accuracy: 19.05% -> 17.26% 
client [73] (testset)   loss: 13.3687 -> 28.4414    accuracy: 51.50% -> 25.32% 
client [5]  (testset)   loss: 24.2082 -> 24.5482    accuracy: 7.69% -> 9.40%   
client [96] (testset)   loss: 26.3469 -> 64.7230    accuracy: 23.92% -> 0.48%  
client [22] (testset)   loss: 25.1640 -> 57.9245    accuracy: 0.85% -> 9.40%   
client [60] (testset)   loss: 15.0292 -> 8.0709 accuracy: 56.60% -> 10.38%     
client [66] (testset)   loss: 21.7118 -> 40.6518    accuracy: 29.33% -> 16.00% 
client [83] (testset)   loss: 12.4632 -> 49.8030    accuracy: 64.67% -> 7.07%  
---------------------------- TRAINING EPOCH: 120 ----------------------------  
client [76] (testset)   loss: 45.7484 -> 64.2024    accuracy: 31.25% -> 18.75% 
client [65] (testset)   loss: 45.2286 -> 41.4493    accuracy: 2.78% -> 10.19%  
client [95] (testset)   loss: 15.8435 -> 7.4316 accuracy: 70.40% -> 66.40%     
client [17] (testset)   loss: 23.0532 -> 23.2823    accuracy: 58.91% -> 58.91% 
client [8]  (testset)   loss: 43.5857 -> 65.5865    accuracy: 29.22% -> 18.11% 
client [35] (testset)   loss: 23.5544 -> 66.2223    accuracy: 36.16% -> 6.78%  
client [98] (testset)   loss: 50.0969 -> 327.2287   accuracy: 6.62% -> 0.66%   
client [53] (testset)   loss: 38.3319 -> 10.1149    accuracy: 36.92% -> 36.92% 
client [43] (testset)   loss: 23.0527 -> 102.3100   accuracy: 46.33% -> 26.61% 
client [64] (testset)   loss: 38.1300 -> 92.0129    accuracy: 42.50% -> 2.50%  
---------------------------- TRAINING EPOCH: 130 ----------------------------  
client [21] (testset)   loss: 100.6975 -> 78.3567   accuracy: 18.49% -> 21.01% 
client [88] (testset)   loss: 104.3571 -> 100.2073  accuracy: 0.97% -> 10.68%  
client [38] (testset)   loss: 41.2034 -> 31.4796    accuracy: 73.33% -> 73.33% 
client [3]  (testset)   loss: 130.9497 -> 35.9106   accuracy: 0.00% -> 9.79%   
client [5]  (testset)   loss: 34.4821 -> 16.3908    accuracy: 66.67% -> 66.67% 
client [41] (testset)   loss: 91.6097 -> 88.8534    accuracy: 4.91% -> 3.07%   
client [7]  (testset)   loss: 136.4358 -> 38.6990   accuracy: 0.88% -> 5.26%   
client [37] (testset)   loss: 42.5462 -> 123.5212   accuracy: 60.33% -> 4.96%  
client [45] (testset)   loss: 85.7376 -> 36.1721    accuracy: 23.21% -> 23.21% 
client [47] (testset)   loss: 77.5044 -> 2123.7858  accuracy: 15.20% -> 1.75%  
---------------------------- TRAINING EPOCH: 140 ----------------------------  
client [16] (testset)   loss: 29.0345 -> 132.9204   accuracy: 10.17% -> 30.51% 
client [11] (testset)   loss: 31.2201 -> 91.9593    accuracy: 15.14% -> 0.00%  
client [37] (testset)   loss: 11.7950 -> 30.5150    accuracy: 61.16% -> 1.65%  
client [41] (testset)   loss: 32.3608 -> 125.8903   accuracy: 4.91% -> 3.07%   
client [95] (testset)   loss: 10.8809 -> 21.4638    accuracy: 70.40% -> 34.40% 
client [53] (testset)   loss: 23.0864 -> 98.3948    accuracy: 36.92% -> 0.77%  
client [22] (testset)   loss: 18.8968 -> 48.8410    accuracy: 48.72% -> 2.56%  
client [25] (testset)   loss: 25.5885 -> 600.0237   accuracy: 26.92% -> 2.56%  
client [69] (testset)   loss: 36.1692 -> 90.0650    accuracy: 13.77% -> 7.78%  
client [46] (testset)   loss: 38.3172 -> 21.7628    accuracy: 5.19% -> 18.18%  
---------------------------- TRAINING EPOCH: 150 ----------------------------  
client [47] (testset)   loss: 72.9544 -> 74.5666    accuracy: 1.17% -> 15.20%  
client [69] (testset)   loss: 36.7774 -> 81.3918    accuracy: 7.78% -> 0.60%   
client [82] (testset)   loss: 54.9109 -> 217.0016   accuracy: 1.71% -> 0.85%   
client [45] (testset)   loss: 46.9173 -> 140.7805   accuracy: 0.00% -> 23.21%  
client [7]  (testset)   loss: 47.0724 -> 115.1200   accuracy: 0.00% -> 61.40%  
client [50] (testset)   loss: 73.6498 -> 3.2716 accuracy: 8.51% -> 42.02%      
client [35] (testset)   loss: 66.2835 -> 36.3080    accuracy: 0.00% -> 36.16%  
client [24] (testset)   loss: 49.9862 -> 90.7717    accuracy: 3.00% -> 4.00%   
client [15] (testset)   loss: 53.4491 -> 25.4562    accuracy: 1.57% -> 31.94%  
client [58] (testset)   loss: 73.0067 -> 446.0195   accuracy: 9.52% -> 7.54%   
---------------------------- TRAINING EPOCH: 160 ----------------------------  
client [48] (testset)   loss: 7.7714 -> 38.7885 accuracy: 12.58% -> 8.18%      
client [76] (testset)   loss: 10.5067 -> 100.7441   accuracy: 3.12% -> 19.53%  
client [67] (testset)   loss: 9.1782 -> 743.4516    accuracy: 8.77% -> 37.43%  
client [37] (testset)   loss: 10.4292 -> 3.5780 accuracy: 0.00% -> 50.41%      
client [58] (testset)   loss: 8.1225 -> 49.7323 accuracy: 3.57% -> 35.32%      
client [64] (testset)   loss: 7.4457 -> 29.2184 accuracy: 13.33% -> 11.67%     
client [77] (testset)   loss: 10.2070 -> 79.3494    accuracy: 11.25% -> 32.50% 
client [55] (testset)   loss: 12.4448 -> 11.9283    accuracy: 2.25% -> 61.80%  
client [12] (testset)   loss: 7.5063 -> 30.5868 accuracy: 11.81% -> 14.17%     
client [89] (testset)   loss: 7.7140 -> 379.6978    accuracy: 15.31% -> 0.00%  
---------------------------- TRAINING EPOCH: 170 ----------------------------  
client [84] (testset)   loss: 61.8841 -> 69.2225    accuracy: 4.11% -> 0.00%   
client [51] (testset)   loss: 77.6525 -> 47.6597    accuracy: 6.08% -> 8.11%   
client [8]  (testset)   loss: 94.9800 -> 162.4939   accuracy: 3.29% -> 3.29%   
client [18] (testset)   loss: 94.8562 -> 81.9056    accuracy: 5.30% -> 13.25%  
client [94] (testset)   loss: 97.7573 -> 39.2758    accuracy: 4.26% -> 55.32%  
client [81] (testset)   loss: 100.1447 -> 151.0717  accuracy: 0.88% -> 10.62%  
client [3]  (testset)   loss: 69.1223 -> 319.2928   accuracy: 24.48% -> 0.00%  
client [11] (testset)   loss: 97.1875 -> 50.2639    accuracy: 0.92% -> 33.94%  
client [95] (testset)   loss: 117.9026 -> 14.1660   accuracy: 0.00% -> 72.80%  
client [67] (testset)   loss: 71.5060 -> 355.2436   accuracy: 11.70% -> 0.58%  
---------------------------- TRAINING EPOCH: 180 ----------------------------  
client [21] (testset)   loss: 28.4468 -> 86.5491    accuracy: 21.01% -> 0.00%  
client [79] (testset)   loss: 32.4440 -> 22.1351    accuracy: 0.00% -> 18.33%  
client [58] (testset)   loss: 19.4639 -> 65.3889    accuracy: 44.84% -> 6.75%  
client [88] (testset)   loss: 30.0499 -> 128.3763   accuracy: 0.00% -> 0.00%   
client [46] (testset)   loss: 35.6392 -> 445.6305   accuracy: 0.00% -> 5.19%   
client [11] (testset)   loss: 40.3432 -> 32.5005    accuracy: 11.93% -> 15.14% 
client [55] (testset)   loss: 28.3822 -> 22.4210    accuracy: 3.93% -> 12.36%  
client [13] (testset)   loss: 28.3279 -> 42.4035    accuracy: 0.46% -> 2.78%   
client [31] (testset)   loss: 34.7625 -> 84.9867    accuracy: 1.42% -> 2.13%   
client [75] (testset)   loss: 27.8502 -> 25.6658    accuracy: 0.00% -> 65.00%  
---------------------------- TRAINING EPOCH: 190 ----------------------------  
client [19] (testset)   loss: 33.5121 -> 179.7982   accuracy: 1.01% -> 0.00%   
client [7]  (testset)   loss: 68.2551 -> 101.6257   accuracy: 5.26% -> 61.40%  
client [57] (testset)   loss: 32.8078 -> 36.3963    accuracy: 23.44% -> 20.57% 
client [13] (testset)   loss: 22.9330 -> 37.0083    accuracy: 9.72% -> 4.63%   
client [43] (testset)   loss: 18.9384 -> 60.3383    accuracy: 12.84% -> 46.33% 
client [91] (testset)   loss: 48.3606 -> 9.3617 accuracy: 8.82% -> 33.33%      
client [10] (testset)   loss: 22.3863 -> 62.1636    accuracy: 63.95% -> 17.17% 
client [64] (testset)   loss: 31.3403 -> 41.9029    accuracy: 2.50% -> 42.50%  
client [82] (testset)   loss: 60.2509 -> 93.5111    accuracy: 5.13% -> 1.71%   
client [22] (testset)   loss: 27.7429 -> 56.5405    accuracy: 6.84% -> 6.84%   
---------------------------- TRAINING EPOCH: 200 ----------------------------  
client [20] (testset)   loss: 24.2220 -> 89.2712    accuracy: 0.00% -> 0.00%   
client [23] (testset)   loss: 18.4849 -> 104.0499   accuracy: 2.04% -> 1.02%   
client [88] (testset)   loss: 20.7715 -> 110.3017   accuracy: 7.77% -> 5.83%   
client [98] (testset)   loss: 14.8927 -> 70.4171    accuracy: 18.54% -> 24.50% 
client [79] (testset)   loss: 23.1381 -> 13.4695    accuracy: 13.33% -> 15.00% 
client [21] (testset)   loss: 20.7262 -> 129.5022   accuracy: 0.84% -> 0.00%   
client [92] (testset)   loss: 22.2266 -> 45.4712    accuracy: 0.00% -> 12.82%  
client [56] (testset)   loss: 14.8127 -> 70.7220    accuracy: 18.92% -> 3.38%  
client [5]  (testset)   loss: 30.0097 -> 6.8924 accuracy: 5.98% -> 13.68%      
client [52] (testset)   loss: 22.3919 -> 64.4932    accuracy: 0.90% -> 11.71%  
---------------------------- TRAINING EPOCH: 210 ----------------------------  
client [67] (testset)   loss: 37.3473 -> 244.6492   accuracy: 0.00% -> 7.02%   
client [54] (testset)   loss: 22.1254 -> 32.0364    accuracy: 15.13% -> 12.18% 
client [14] (testset)   loss: 49.3223 -> 54.4173    accuracy: 3.23% -> 30.65%  
client [99] (testset)   loss: 47.9061 -> 38.0874    accuracy: 7.02% -> 1.75%   
client [36] (testset)   loss: 49.3684 -> 43.0074    accuracy: 7.58% -> 3.03%   
client [30] (testset)   loss: 51.3459 -> 130.5079   accuracy: 1.44% -> 9.35%   
client [38] (testset)   loss: 49.1704 -> 30.2362    accuracy: 0.00% -> 73.33%  
client [15] (testset)   loss: 45.6841 -> 11.2229    accuracy: 8.90% -> 63.87%  
client [6]  (testset)   loss: 25.5477 -> 85.8592    accuracy: 24.11% -> 21.43% 
client [53] (testset)   loss: 46.0661 -> 40.1640    accuracy: 0.77% -> 28.46%  
---------------------------- TRAINING EPOCH: 220 ----------------------------  
client [99] (testset)   loss: 16.4372 -> 61.3380    accuracy: 22.81% -> 26.32% 
client [6]  (testset)   loss: 9.0162 -> 35.4566 accuracy: 46.43% -> 22.32%     
client [83] (testset)   loss: 3.1556 -> 70.7140 accuracy: 71.74% -> 3.80%      
client [42] (testset)   loss: 15.8184 -> 47.2942    accuracy: 32.70% -> 4.44%  
client [34] (testset)   loss: 11.7922 -> 72.6546    accuracy: 26.19% -> 8.33%  
client [15] (testset)   loss: 24.6882 -> 64.3756    accuracy: 13.61% -> 7.85%  
client [47] (testset)   loss: 11.7322 -> 1625.3859  accuracy: 53.22% -> 15.20% 
client [55] (testset)   loss: 12.0491 -> 73.3510    accuracy: 53.37% -> 2.81%  
client [51] (testset)   loss: 12.1122 -> 69.3851    accuracy: 40.54% -> 21.62% 
client [95] (testset)   loss: 25.8058 -> 5.8053 accuracy: 12.80% -> 8.80%      
---------------------------- TRAINING EPOCH: 230 ----------------------------  
client [71] (testset)   loss: 41.9266 -> 19.4050    accuracy: 3.41% -> 39.77%  
client [15] (testset)   loss: 55.5963 -> 18.7741    accuracy: 2.09% -> 46.60%  
client [33] (testset)   loss: 42.8691 -> 33.5632    accuracy: 10.71% -> 5.95%  
client [99] (testset)   loss: 44.5129 -> 66.4085    accuracy: 7.02% -> 1.75%   
client [90] (testset)   loss: 49.6436 -> 110.8442   accuracy: 4.17% -> 27.78%  
client [57] (testset)   loss: 39.4943 -> 97.3998    accuracy: 3.83% -> 20.57%  
client [27] (testset)   loss: 40.5356 -> 227.2411   accuracy: 2.97% -> 27.12%  
client [78] (testset)   loss: 42.1731 -> 23.2210    accuracy: 4.95% -> 3.15%   
client [36] (testset)   loss: 45.3578 -> 219.4795   accuracy: 0.76% -> 13.64%  
client [88] (testset)   loss: 29.5700 -> 68.1508    accuracy: 11.65% -> 8.74%  
---------------------------- TRAINING EPOCH: 240 ----------------------------  
client [70] (testset)   loss: 5.2723 -> 22.0254 accuracy: 21.08% -> 9.87%      
client [35] (testset)   loss: 4.8562 -> 76.7184 accuracy: 25.99% -> 1.69%      
client [16] (testset)   loss: 5.9676 -> 451.0367    accuracy: 23.73% -> 0.85%  
client [80] (testset)   loss: 9.5526 -> 75.4419 accuracy: 15.27% -> 5.34%      
client [38] (testset)   loss: 6.1442 -> 35.6114 accuracy: 10.00% -> 73.33%     
client [78] (testset)   loss: 9.5705 -> 53.8788 accuracy: 7.21% -> 0.90%       
client [68] (testset)   loss: 5.6752 -> 18.9855 accuracy: 17.02% -> 43.26%     
client [11] (testset)   loss: 6.6475 -> 5.0111  accuracy: 18.81% -> 46.33%     
client [64] (testset)   loss: 5.1265 -> 19.9327 accuracy: 22.50% -> 14.17%     
client [82] (testset)   loss: 4.2777 -> 37.6201 accuracy: 32.48% -> 3.42%      
---------------------------- TRAINING EPOCH: 250 ----------------------------  
client [30] (testset)   loss: 28.9314 -> 19.0359    accuracy: 23.74% -> 9.35%  
client [27] (testset)   loss: 11.1332 -> 55.0835    accuracy: 50.85% -> 27.12% 
client [74] (testset)   loss: 21.9527 -> 70.8047    accuracy: 10.56% -> 10.56% 
client [45] (testset)   loss: 13.7160 -> 64.8902    accuracy: 39.88% -> 0.00%  
client [6]  (testset)   loss: 13.2199 -> 31.9826    accuracy: 36.61% -> 21.43% 
client [36] (testset)   loss: 10.3993 -> 90.2020    accuracy: 54.55% -> 13.64% 
client [63] (testset)   loss: 18.9582 -> 61.5381    accuracy: 24.59% -> 4.92%  
client [76] (testset)   loss: 12.4217 -> 12.0940    accuracy: 48.44% -> 26.56% 
client [83] (testset)   loss: 10.8212 -> 23.0393    accuracy: 28.26% -> 9.24%  
client [86] (testset)   loss: 8.7859 -> 101.4167    accuracy: 58.23% -> 25.32% 
---------------------------- TRAINING EPOCH: 260 ----------------------------  
client [83] (testset)   loss: 56.3821 -> 1.7885 accuracy: 7.07% -> 75.54%      
client [99] (testset)   loss: 70.1905 -> 53.8702    accuracy: 8.77% -> 0.00%   
client [74] (testset)   loss: 58.8007 -> 8.1095 accuracy: 7.78% -> 22.22%      
client [73] (testset)   loss: 24.4892 -> 1.9019 accuracy: 54.94% -> 71.67%     
client [29] (testset)   loss: 90.9889 -> 63.2602    accuracy: 10.16% -> 21.93% 
client [92] (testset)   loss: 97.1771 -> 56.3324    accuracy: 0.00% -> 47.44%  
client [6]  (testset)   loss: 48.1822 -> 37.9024    accuracy: 25.00% -> 6.25%  
client [61] (testset)   loss: 61.6953 -> 40.0347    accuracy: 8.11% -> 21.62%  
client [21] (testset)   loss: 82.7665 -> 193.7061   accuracy: 0.84% -> 18.49%  
client [67] (testset)   loss: 67.1691 -> 861.0083   accuracy: 28.07% -> 29.82% 
---------------------------- TRAINING EPOCH: 270 ----------------------------  
client [83] (testset)   loss: 65.3664 -> 170.0355   accuracy: 0.00% -> 3.80%   
client [32] (testset)   loss: 42.9423 -> 37.7335    accuracy: 25.00% -> 0.71%  
client [95] (testset)   loss: 17.8518 -> 4.7411 accuracy: 70.40% -> 20.80%     
client [61] (testset)   loss: 54.7751 -> 126.3267   accuracy: 10.81% -> 0.00%  
client [27] (testset)   loss: 51.0855 -> 17.8382    accuracy: 13.14% -> 33.47% 
client [25] (testset)   loss: 43.7096 -> 31.6514    accuracy: 26.92% -> 16.67% 
client [68] (testset)   loss: 51.3029 -> 1055.1571  accuracy: 20.57% -> 20.57% 
client [34] (testset)   loss: 59.2939 -> 35.9893    accuracy: 2.98% -> 16.67%  
client [71] (testset)   loss: 52.5648 -> 285.9451   accuracy: 14.77% -> 2.27%  
client [89] (testset)   loss: 52.8331 -> 86.3855    accuracy: 8.16% -> 3.06%   
---------------------------- TRAINING EPOCH: 280 ----------------------------  
client [78] (testset)   loss: 14.0666 -> 101.1275   accuracy: 31.98% -> 31.08% 
client [81] (testset)   loss: 19.3622 -> 44.5180    accuracy: 0.44% -> 1.11%   
client [51] (testset)   loss: 14.9809 -> 99.2423    accuracy: 4.73% -> 21.62%  
client [54] (testset)   loss: 23.8864 -> 4.1708 accuracy: 3.69% -> 31.37%      
client [65] (testset)   loss: 20.6889 -> 1476.4234  accuracy: 14.81% -> 6.48%  
client [41] (testset)   loss: 18.0338 -> 60.6883    accuracy: 0.61% -> 36.81%  
client [11] (testset)   loss: 10.3630 -> 58.0766    accuracy: 34.86% -> 15.14% 
client [85] (testset)   loss: 16.6864 -> 68.4200    accuracy: 8.00% -> 11.43%  
client [12] (testset)   loss: 12.0859 -> 36.5162    accuracy: 24.41% -> 1.57%  
client [23] (testset)   loss: 13.7185 -> 10.2846    accuracy: 7.14% -> 37.76%  
---------------------------- TRAINING EPOCH: 290 ----------------------------  
client [16] (testset)   loss: 56.9218 -> 31.4899    accuracy: 16.10% -> 23.73% 
client [65] (testset)   loss: 57.0426 -> 43.5723    accuracy: 24.07% -> 3.70%  
client [53] (testset)   loss: 100.6653 -> 52.0445   accuracy: 0.77% -> 3.08%   
client [58] (testset)   loss: 71.3326 -> 67.7314    accuracy: 13.49% -> 20.63% 
client [72] (testset)   loss: 47.9996 -> 28.8586    accuracy: 16.88% -> 8.12%  
client [7]  (testset)   loss: 100.4910 -> 33.0658   accuracy: 5.26% -> 20.18%  
client [71] (testset)   loss: 34.8191 -> 40.8669    accuracy: 51.14% -> 3.41%  
client [59] (testset)   loss: 108.9220 -> 55.6466   accuracy: 0.00% -> 41.52%  
client [86] (testset)   loss: 92.7766 -> 75.4453    accuracy: 11.39% -> 2.53%  
client [39] (testset)   loss: 63.1653 -> 79.4219    accuracy: 23.64% -> 24.55% 
---------------------------- TRAINING EPOCH: 300 ----------------------------  
client [99] (testset)   loss: 47.5413 -> 97.7388    accuracy: 8.77% -> 8.77%   
client [7]  (testset)   loss: 45.9951 -> 53.2864    accuracy: 22.81% -> 12.28% 
client [17] (testset)   loss: 57.8631 -> 6.9171 accuracy: 10.08% -> 18.60%     
client [64] (testset)   loss: 53.0203 -> 142.9200   accuracy: 6.67% -> 42.50%  
client [37] (testset)   loss: 54.1596 -> 17.9247    accuracy: 10.74% -> 4.13%  
client [29] (testset)   loss: 41.0030 -> 369.6382   accuracy: 9.63% -> 5.88%   
client [93] (testset)   loss: 27.7647 -> 137.9093   accuracy: 3.49% -> 13.95%  
client [73] (testset)   loss: 24.1020 -> 1.4318 accuracy: 51.07% -> 73.82%     
client [40] (testset)   loss: 35.8073 -> 60.1463    accuracy: 2.00% -> 6.00%   
client [76] (testset)   loss: 40.2825 -> 102.1878   accuracy: 17.97% -> 18.75% 
---------------------------- TRAINING EPOCH: 310 ----------------------------  
client [31] (testset)   loss: 32.5477 -> 102.0853   accuracy: 2.13% -> 4.26%   
client [89] (testset)   loss: 56.6800 -> 36.1891    accuracy: 3.06% -> 21.43%  
client [77] (testset)   loss: 42.2404 -> 10.8081    accuracy: 32.50% -> 55.00% 
client [90] (testset)   loss: 43.1610 -> 25.0803    accuracy: 0.00% -> 0.00%   
client [26] (testset)   loss: 75.4561 -> 0.5655 accuracy: 0.00% -> 91.67%      
client [50] (testset)   loss: 55.3022 -> 9.7519 accuracy: 0.00% -> 40.43%      
client [30] (testset)   loss: 42.1819 -> 43.5374    accuracy: 9.35% -> 46.04%  
client [70] (testset)   loss: 45.0323 -> 37.7938    accuracy: 3.14% -> 11.66%  
client [41] (testset)   loss: 53.2882 -> 20.7013    accuracy: 0.00% -> 41.10%  
client [99] (testset)   loss: 38.9680 -> 111.5314   accuracy: 3.51% -> 14.04%  
---------------------------- TRAINING EPOCH: 320 ----------------------------  
client [68] (testset)   loss: 18.5262 -> 41.0435    accuracy: 6.38% -> 7.80%   
client [70] (testset)   loss: 10.5576 -> 27.5776    accuracy: 13.90% -> 9.87%  
client [52] (testset)   loss: 14.3319 -> 31.6812    accuracy: 18.92% -> 20.72% 
client [1]  (testset)   loss: 13.6401 -> 12.8064    accuracy: 12.24% -> 26.53% 
client [2]  (testset)   loss: 12.6477 -> 169.5143   accuracy: 14.61% -> 0.00%  
client [67] (testset)   loss: 15.5472 -> 289.9836   accuracy: 4.68% -> 0.00%   
client [92] (testset)   loss: 20.5215 -> 190.5862   accuracy: 17.95% -> 8.97%  
client [35] (testset)   loss: 14.3630 -> 40.7235    accuracy: 6.21% -> 3.39%   
client [36] (testset)   loss: 14.8002 -> 686.7665   accuracy: 33.33% -> 32.58% 
client [64] (testset)   loss: 10.1216 -> 38.0532    accuracy: 10.83% -> 2.50%  
---------------------------- TRAINING EPOCH: 330 ----------------------------  
client [44] (testset)   loss: 16.1171 -> 83.4735    accuracy: 7.96% -> 6.19%   
client [6]  (testset)   loss: 27.1077 -> 5.4818 accuracy: 1.79% -> 34.82%      
client [12] (testset)   loss: 17.6798 -> 75.6265    accuracy: 23.62% -> 11.02% 
client [55] (testset)   loss: 28.9089 -> 13.8966    accuracy: 2.81% -> 12.36%  
client [29] (testset)   loss: 19.2677 -> 149.4116   accuracy: 5.88% -> 10.16%  
client [9]  (testset)   loss: 17.6612 -> 114.4552   accuracy: 13.47% -> 1.55%  
client [43] (testset)   loss: 20.7549 -> 29.9081    accuracy: 0.00% -> 46.33%  
client [77] (testset)   loss: 18.4369 -> 65.6129    accuracy: 32.50% -> 32.50% 
client [98] (testset)   loss: 22.8455 -> 35.2869    accuracy: 0.66% -> 21.19%  
client [78] (testset)   loss: 20.3273 -> 20.4333    accuracy: 31.08% -> 32.88% 
---------------------------- TRAINING EPOCH: 340 ----------------------------  
client [92] (testset)   loss: 176.9411 -> 194.8347  accuracy: 12.82% -> 12.82% 
client [80] (testset)   loss: 292.9286 -> 50.3141   accuracy: 5.34% -> 9.92%   
client [63] (testset)   loss: 265.6872 -> 54.3788   accuracy: 4.92% -> 4.92%   
client [76] (testset)   loss: 228.3051 -> 35.6047   accuracy: 0.78% -> 20.31%  
client [78] (testset)   loss: 213.8080 -> 145.9215  accuracy: 31.08% -> 31.08% 
client [25] (testset)   loss: 249.0452 -> 31.1932   accuracy: 2.56% -> 34.62%  
client [58] (testset)   loss: 286.5424 -> 38.6278   accuracy: 0.00% -> 6.75%   
client [13] (testset)   loss: 286.8762 -> 15.1097   accuracy: 1.39% -> 41.67%  
client [17] (testset)   loss: 193.8281 -> 6.3393    accuracy: 3.88% -> 65.12%  
client [38] (testset)   loss: 177.7363 -> 1.7736    accuracy: 1.11% -> 77.78%  
---------------------------- TRAINING EPOCH: 350 ----------------------------  
client [72] (testset)   loss: 5.1832 -> 3222.7592   accuracy: 32.50% -> 3.12%  
client [82] (testset)   loss: 6.0719 -> 94.2996 accuracy: 21.37% -> 11.97%     
client [86] (testset)   loss: 8.6864 -> 36.9099 accuracy: 6.33% -> 37.97%      
client [51] (testset)   loss: 4.9095 -> 28.5937 accuracy: 29.05% -> 39.19%     
client [96] (testset)   loss: 7.1198 -> 19.2872 accuracy: 8.13% -> 58.85%      
client [42] (testset)   loss: 5.9550 -> 50.5833 accuracy: 22.86% -> 18.10%     
client [55] (testset)   loss: 8.8933 -> 64.1788 accuracy: 3.37% -> 2.81%       
client [13] (testset)   loss: 9.3257 -> 15.0493 accuracy: 20.37% -> 41.20%     
client [1]  (testset)   loss: 8.1062 -> 31.4216 accuracy: 14.29% -> 0.00%      
client [12] (testset)   loss: 7.4367 -> 18.2275 accuracy: 24.41% -> 15.75%     
---------------------------- TRAINING EPOCH: 360 ----------------------------  
client [68] (testset)   loss: 48.9572 -> 37.1556    accuracy: 12.06% -> 20.57% 
client [23] (testset)   loss: 38.6102 -> 250.7543   accuracy: 10.20% -> 1.02%  
client [46] (testset)   loss: 36.7386 -> 27.9373    accuracy: 10.39% -> 2.60%  
client [41] (testset)   loss: 46.3184 -> 17.9725    accuracy: 3.07% -> 31.90%  
client [25] (testset)   loss: 50.8432 -> 24.6429    accuracy: 8.97% -> 17.95%  
client [58] (testset)   loss: 48.3061 -> 51.8302    accuracy: 9.52% -> 0.00%   
client [14] (testset)   loss: 46.0429 -> 131.4635   accuracy: 4.84% -> 1.61%   
client [33] (testset)   loss: 51.3082 -> 16.1352    accuracy: 10.71% -> 28.57% 
client [85] (testset)   loss: 40.3631 -> 188.8281   accuracy: 12.00% -> 22.29% 
client [62] (testset)   loss: 59.6038 -> 25.3260    accuracy: 4.44% -> 2.67%   
---------------------------- TRAINING EPOCH: 370 ----------------------------  
client [98] (testset)   loss: 53.7220 -> 265.9756   accuracy: 0.66% -> 0.66%   
client [63] (testset)   loss: 55.4729 -> 47.2775    accuracy: 4.92% -> 12.30%  
client [70] (testset)   loss: 42.5236 -> 66.0181    accuracy: 4.93% -> 26.01%  
client [65] (testset)   loss: 57.0246 -> 79.6793    accuracy: 10.19% -> 6.48%  
client [14] (testset)   loss: 39.4998 -> 55.4203    accuracy: 1.61% -> 41.94%  
client [73] (testset)   loss: 48.1459 -> 1.4617 accuracy: 2.15% -> 78.54%      
client [34] (testset)   loss: 52.2310 -> 47.5379    accuracy: 8.33% -> 19.05%  
client [99] (testset)   loss: 40.5907 -> 19.7266    accuracy: 5.26% -> 28.07%  
client [69] (testset)   loss: 35.5685 -> 100.3008   accuracy: 25.15% -> 13.77% 
client [46] (testset)   loss: 65.2443 -> 70.0909    accuracy: 2.60% -> 23.38%  
---------------------------- TRAINING EPOCH: 380 ----------------------------  
client [99] (testset)   loss: 8.1059 -> 46.4740 accuracy: 22.81% -> 31.58%     
client [93] (testset)   loss: 11.1966 -> 60.5397    accuracy: 8.14% -> 0.00%   
client [11] (testset)   loss: 4.3573 -> 28.5414 accuracy: 44.95% -> 24.77%     
client [58] (testset)   loss: 8.6366 -> 71.7678 accuracy: 20.63% -> 9.52%      
client [81] (testset)   loss: 7.5456 -> 53.9946 accuracy: 17.92% -> 0.44%      
client [85] (testset)   loss: 6.7170 -> 10.9712 accuracy: 29.71% -> 12.00%     
client [89] (testset)   loss: 8.8095 -> 583.6115    accuracy: 22.45% -> 2.04%  
client [45] (testset)   loss: 3.3589 -> 9.8161  accuracy: 54.76% -> 26.79%     
client [8]  (testset)   loss: 7.5855 -> 148.0304    accuracy: 35.39% -> 5.76%  
client [68] (testset)   loss: 6.0727 -> 35.5830 accuracy: 36.17% -> 20.57%     
---------------------------- TRAINING EPOCH: 390 ----------------------------  
client [67] (testset)   loss: 8.4499 -> 279.3462    accuracy: 21.05% -> 12.28% 
client [72] (testset)   loss: 4.1570 -> 195.2713    accuracy: 45.62% -> 18.75% 
client [1]  (testset)   loss: 8.8099 -> 38.6356 accuracy: 30.61% -> 28.57%     
client [78] (testset)   loss: 10.0281 -> 22.4636    accuracy: 18.47% -> 33.33% 
client [83] (testset)   loss: 4.7864 -> 36.4556 accuracy: 40.22% -> 5.43%      
client [21] (testset)   loss: 9.5142 -> 57.1114 accuracy: 26.89% -> 0.00%      
client [56] (testset)   loss: 7.7582 -> 14.7541 accuracy: 32.43% -> 21.62%     
client [44] (testset)   loss: 4.6236 -> 912.1781    accuracy: 42.92% -> 6.19%  
client [92] (testset)   loss: 9.7531 -> 129.1425    accuracy: 7.69% -> 0.00%   
client [27] (testset)   loss: 8.0488 -> 74.0214 accuracy: 27.97% -> 8.90%      
---------------------------- TRAINING EPOCH: 400 ----------------------------  
client [10] (testset)   loss: 80.4685 -> 9.7704 accuracy: 3.00% -> 10.73%      
client [39] (testset)   loss: 75.5832 -> 18.9063    accuracy: 27.27% -> 22.73% 
client [65] (testset)   loss: 73.3233 -> 291.2457   accuracy: 7.41% -> 6.48%   
client [26] (testset)   loss: 18.2100 -> 0.1952 accuracy: 77.56% -> 94.87%     
client [19] (testset)   loss: 71.1598 -> 19.0991    accuracy: 28.28% -> 18.18% 
client [68] (testset)   loss: 77.0230 -> 33.7703    accuracy: 9.93% -> 9.22%   
client [41] (testset)   loss: 47.3651 -> 91.7685    accuracy: 4.29% -> 0.00%   
client [50] (testset)   loss: 35.0413 -> 67.7754    accuracy: 26.60% -> 0.00%  
client [75] (testset)   loss: 119.8604 -> 0.8354    accuracy: 0.50% -> 89.00%  
client [81] (testset)   loss: 53.4445 -> 31.5483    accuracy: 11.73% -> 27.65% 
Training... ---------------------------------------- 100% 0:15:41
FedAvg's average time taken by each global epoch: 0 min 2.34 sec.              
FedAvg's total running time: 0 h 15 m 41 s.                                    
==================== FedAvg Experiment Results: ====================           
Display format: (before local fine-tuning) -> (after local fine-tuning)        
 So if finetune_epoch = 0, x.xx% -> 0.00% is normal.                           
 Centralized testing ONLY happens after model aggregation, so the stats between
'->' are the same.                                                             
{                                                                              
    "100": {                                                                   
        "all_clients": {                                                       
            "test": {                                                          
                "loss": "120.6820 -> 0.0000",                                  
                "accuracy": "8.86% -> 0.00%"                                   
            }                                                                  
        }                                                                      
    },                                                                         
    "200": {                                                                   
        "all_clients": {                                                       
            "test": {                                                          
                "loss": "11.0867 -> 0.0000",                                   
                "accuracy": "20.37% -> 0.00%"                                  
            }                                                                  
        }                                                                      
    },                                                                         
    "300": {                                                                   
        "all_clients": {                                                       
            "test": {                                                          
                "loss": "26.9288 -> 0.0000",                                   
                "accuracy": "19.80% -> 0.00%"                                  
            }                                                                  
        }                                                                      
    },                                                                         
    "400": {                                                                   
        "all_clients": {                                                       
            "test": {                                                          
                "loss": "8.6298 -> 0.0000",                                    
                "accuracy": "29.15% -> 0.00%"                                  
            }                                                                  
        }                                                                      
    }                                                                          
}                                                                              
==================== FedAvg Max Accuracy ====================                  
all_clients:                                                                   
(test) before fine-tuning: 29.15% at epoch 400                                 
(test) after fine-tuning: 0.00% at epoch 100                                   
[0m