==================== FedAvg ====================                               
Experiment Arguments:                                                          
{
│   'method': 'fedavg',
│   'dataset': {
│   │   'name': 'emnist',
│   │   'client_num': 100,
│   │   'test_ratio': 0.25,
│   │   'val_ratio': 0.0,
│   │   'seed': 42,
│   │   'split': 'sample',
│   │   'IID_ratio': 0.0,
│   │   'monitor_window_name_suffix': 'emnist-100clients-0%IID-Dir(0.5)-seed42',
│   │   'emnist_split': 'byclass',
│   │   'alpha': 0.5,
│   │   'min_samples_per_client': 10
│   },
│   'model': {
│   │   'name': 'avgcnn',
│   │   'use_torchvision_pretrained_weights': True,
│   │   'external_model_weights_path': None
│   },
│   'optimizer': {
│   │   'lr': 0.01,
│   │   'dampening': 0,
│   │   'weight_decay': 0,
│   │   'momentum': 0,
│   │   'nesterov': False,
│   │   'name': 'sgd'
│   },
│   'mode': 'serial',
│   'parallel': {
│   │   'ray_cluster_addr': None,
│   │   'num_cpus': None,
│   │   'num_gpus': None,
│   │   'num_workers': 2
│   },
│   'common': {
│   │   'seed': 42,
│   │   'join_ratio': 0.1,
│   │   'global_epoch': 400,
│   │   'local_epoch': 5,
│   │   'batch_size': 32,
│   │   'reset_optimizer_on_global_epoch': True,
│   │   'straggler_ratio': 0,
│   │   'straggler_min_local_epoch': 0,
│   │   'buffers': 'global',
│   │   'client_side_evaluation': True,
│   │   'test': {
│   │   │   'client': {
│   │   │   │   'interval': 100,
│   │   │   │   'finetune_epoch': 0,
│   │   │   │   'train': False,
│   │   │   │   'val': False,
│   │   │   │   'test': True
│   │   │   },
│   │   │   'server': {
│   │   │   │   'interval': -1,
│   │   │   │   'train': False,
│   │   │   │   'val': False,
│   │   │   │   'test': False,
│   │   │   │   'model_in_train_mode': False
│   │   │   }
│   │   },
│   │   'verbose_gap': 10,
│   │   'monitor': None,
│   │   'use_cuda': True,
│   │   'save_log': True,
│   │   'save_model': False,
│   │   'save_learning_curve_plot': False,
│   │   'save_metrics': True,
│   │   'delete_useless_run': True
│   }
}
---------------------------- TRAINING EPOCH: 10 ----------------------------   
client [77] (testset)   loss: 0.6152 -> 0.4837  accuracy: 78.70% -> 83.19%     
client [81] (testset)   loss: 0.5693 -> 0.6042  accuracy: 79.30% -> 80.13%     
client [21] (testset)   loss: 0.4737 -> 0.2969  accuracy: 82.12% -> 91.42%     
client [68] (testset)   loss: 0.3295 -> 0.2945  accuracy: 87.60% -> 89.25%     
client [93] (testset)   loss: 0.5958 -> 0.3731  accuracy: 79.72% -> 90.18%     
client [31] (testset)   loss: 0.4887 -> 0.3602  accuracy: 83.14% -> 87.67%     
client [20] (testset)   loss: 0.4485 -> 0.3565  accuracy: 84.61% -> 89.80%     
client [59] (testset)   loss: 0.5788 -> 0.4641  accuracy: 79.04% -> 82.11%     
client [48] (testset)   loss: 0.5451 -> 0.3929  accuracy: 80.99% -> 86.51%     
client [34] (testset)   loss: 0.5166 -> 0.3787  accuracy: 82.46% -> 89.27%     
---------------------------- TRAINING EPOCH: 20 ----------------------------   
client [69] (testset)   loss: 0.4549 -> 0.9353  accuracy: 83.57% -> 82.79%     
client [99] (testset)   loss: 0.5152 -> 0.2464  accuracy: 79.31% -> 92.81%     
client [67] (testset)   loss: 0.3880 -> 0.3100  accuracy: 85.83% -> 88.58%     
client [0]  (testset)   loss: 0.4716 -> 0.2517  accuracy: 85.58% -> 93.62%     
client [76] (testset)   loss: 0.7146 -> 0.5077  accuracy: 78.08% -> 83.26%     
client [41] (testset)   loss: 0.6957 -> 0.5421  accuracy: 70.32% -> 81.30%     
client [62] (testset)   loss: 0.5019 -> 0.4007  accuracy: 83.18% -> 88.50%     
client [2]  (testset)   loss: 0.3218 -> 0.2614  accuracy: 89.20% -> 91.00%     
client [14] (testset)   loss: 0.5118 -> 0.2780  accuracy: 81.43% -> 91.36%     
client [46] (testset)   loss: 0.3796 -> 0.3046  accuracy: 86.87% -> 90.81%     
---------------------------- TRAINING EPOCH: 30 ----------------------------   
client [24] (testset)   loss: 0.4652 -> 0.2681  accuracy: 85.11% -> 92.16%     
client [68] (testset)   loss: 0.2822 -> 0.2651  accuracy: 89.76% -> 90.40%     
client [57] (testset)   loss: 0.4724 -> 0.5326  accuracy: 83.86% -> 79.54%     
client [17] (testset)   loss: 0.3781 -> 0.2478  accuracy: 87.87% -> 92.59%     
client [54] (testset)   loss: 0.3376 -> 0.2573  accuracy: 87.61% -> 91.39%     
client [23] (testset)   loss: 0.5444 -> 0.4395  accuracy: 80.68% -> 84.62%     
client [35] (testset)   loss: 0.6017 -> 0.4454  accuracy: 75.44% -> 85.73%     
client [59] (testset)   loss: 0.4973 -> 0.4606  accuracy: 82.00% -> 83.88%     
client [31] (testset)   loss: 0.4076 -> 0.3433  accuracy: 85.51% -> 88.37%     
client [9]  (testset)   loss: 0.8015 -> 0.5575  accuracy: 72.67% -> 81.41%     
---------------------------- TRAINING EPOCH: 40 ----------------------------   
client [64] (testset)   loss: 0.5454 -> 0.3944  accuracy: 79.34% -> 86.66%     
client [33] (testset)   loss: 0.3986 -> 0.4004  accuracy: 84.81% -> 85.70%     
client [16] (testset)   loss: 0.3474 -> 0.2895  accuracy: 88.12% -> 91.77%     
client [44] (testset)   loss: 0.5669 -> 0.5079  accuracy: 78.56% -> 81.16%     
client [8]  (testset)   loss: 0.3934 -> 0.3009  accuracy: 87.72% -> 91.99%     
client [31] (testset)   loss: 0.3964 -> 0.3279  accuracy: 86.66% -> 89.53%     
client [47] (testset)   loss: 0.6000 -> 0.4526  accuracy: 77.99% -> 84.53%     
client [36] (testset)   loss: 0.4483 -> 0.3633  accuracy: 83.59% -> 87.73%     
client [20] (testset)   loss: 0.4346 -> 0.3029  accuracy: 84.67% -> 91.39%     
client [56] (testset)   loss: 0.5535 -> 0.3717  accuracy: 77.44% -> 88.10%     
---------------------------- TRAINING EPOCH: 50 ----------------------------   
client [4]  (testset)   loss: 0.3526 -> 0.3165  accuracy: 88.29% -> 89.65%     
client [60] (testset)   loss: 0.3935 -> 0.2146  accuracy: 84.68% -> 93.85%     
client [28] (testset)   loss: 0.4206 -> 0.3455  accuracy: 85.72% -> 89.15%     
client [25] (testset)   loss: 0.2789 -> 0.1835  accuracy: 90.85% -> 95.53%     
client [58] (testset)   loss: 0.2912 -> 0.2465  accuracy: 87.96% -> 92.08%     
client [44] (testset)   loss: 0.5666 -> 0.5249  accuracy: 79.25% -> 82.05%     
client [39] (testset)   loss: 0.4505 -> 0.4087  accuracy: 83.04% -> 85.84%     
client [29] (testset)   loss: 0.5379 -> 0.4861  accuracy: 81.64% -> 82.45%     
client [3]  (testset)   loss: 0.3523 -> 0.2083  accuracy: 87.08% -> 94.14%     
client [84] (testset)   loss: 0.4250 -> 0.2813  accuracy: 85.18% -> 92.03%     
---------------------------- TRAINING EPOCH: 60 ----------------------------   
client [21] (testset)   loss: 0.3915 -> 0.2745  accuracy: 88.47% -> 92.14%     
client [84] (testset)   loss: 0.4864 -> 0.3063  accuracy: 81.98% -> 91.20%     
client [10] (testset)   loss: 0.3534 -> 0.3284  accuracy: 87.86% -> 90.72%     
client [36] (testset)   loss: 0.4430 -> 0.3684  accuracy: 83.29% -> 88.58%     
client [65] (testset)   loss: 0.7156 -> 0.4259  accuracy: 72.54% -> 87.38%     
client [81] (testset)   loss: 0.5335 -> 0.4637  accuracy: 80.47% -> 85.69%     
client [79] (testset)   loss: 0.2734 -> 0.1841  accuracy: 90.32% -> 95.41%     
client [42] (testset)   loss: 0.3519 -> 0.2570  accuracy: 87.60% -> 92.49%     
client [11] (testset)   loss: 0.4218 -> 0.2270  accuracy: 86.36% -> 94.19%     
client [96] (testset)   loss: 0.5333 -> 0.3708  accuracy: 80.86% -> 89.42%     
---------------------------- TRAINING EPOCH: 70 ----------------------------   
client [8]  (testset)   loss: 0.5239 -> 0.3085  accuracy: 81.50% -> 91.99%     
client [53] (testset)   loss: 0.4347 -> 0.3620  accuracy: 86.35% -> 87.88%     
client [52] (testset)   loss: 0.5304 -> 0.4376  accuracy: 79.47% -> 86.32%     
client [42] (testset)   loss: 0.3969 -> 0.2529  accuracy: 84.22% -> 92.80%     
client [69] (testset)   loss: 0.3184 -> 0.2811  accuracy: 89.59% -> 92.69%     
client [59] (testset)   loss: 0.4976 -> 0.4631  accuracy: 82.75% -> 82.54%     
client [7]  (testset)   loss: 0.3922 -> 0.3108  accuracy: 84.03% -> 88.86%     
client [26] (testset)   loss: 0.3959 -> 0.4344  accuracy: 84.74% -> 87.68%     
client [49] (testset)   loss: 0.2798 -> 0.2599  accuracy: 91.85% -> 93.24%     
client [98] (testset)   loss: 0.2752 -> 0.2764  accuracy: 91.65% -> 91.53%     
---------------------------- TRAINING EPOCH: 80 ----------------------------   
client [98] (testset)   loss: 0.2916 -> 0.2764  accuracy: 92.01% -> 91.89%     
client [47] (testset)   loss: 0.6926 -> 0.4869  accuracy: 74.76% -> 84.28%     
client [21] (testset)   loss: 0.4411 -> 0.3125  accuracy: 86.47% -> 92.52%     
client [77] (testset)   loss: 0.5423 -> 0.4359  accuracy: 81.30% -> 86.00%     
client [95] (testset)   loss: 0.3454 -> 0.2570  accuracy: 88.09% -> 93.29%     
client [91] (testset)   loss: 0.5927 -> 0.3859  accuracy: 79.83% -> 87.89%     
client [14] (testset)   loss: 0.3862 -> 0.2721  accuracy: 87.92% -> 92.22%     
client [99] (testset)   loss: 0.4659 -> 0.2474  accuracy: 84.05% -> 92.97%     
client [20] (testset)   loss: 0.4916 -> 0.3327  accuracy: 83.73% -> 91.16%     
client [39] (testset)   loss: 0.4967 -> 0.4178  accuracy: 82.17% -> 86.23%     
---------------------------- TRAINING EPOCH: 90 ----------------------------   
client [52] (testset)   loss: 0.5777 -> 0.4448  accuracy: 79.57% -> 86.27%     
client [62] (testset)   loss: 0.4566 -> 0.3907  accuracy: 85.65% -> 89.20%     
client [71] (testset)   loss: 0.5853 -> 0.5106  accuracy: 77.39% -> 84.74%     
client [97] (testset)   loss: 0.4386 -> 0.2224  accuracy: 83.78% -> 93.94%     
client [30] (testset)   loss: 0.3275 -> 0.3294  accuracy: 88.60% -> 90.69%     
client [88] (testset)   loss: 0.4060 -> 0.3156  accuracy: 86.03% -> 88.45%     
client [60] (testset)   loss: 0.3976 -> 0.2222  accuracy: 84.63% -> 93.48%     
client [82] (testset)   loss: 0.5888 -> 0.4138  accuracy: 80.14% -> 87.53%     
client [91] (testset)   loss: 0.5264 -> 0.3911  accuracy: 81.28% -> 88.29%     
client [57] (testset)   loss: 0.5252 -> 0.5423  accuracy: 82.06% -> 83.09%     
---------------------------- TRAINING EPOCH: 100 ----------------------------  
client [31] (testset)   loss: 0.4421 -> 0.3378  accuracy: 85.71% -> 89.53%     
client [15] (testset)   loss: 0.5199 -> 0.4831  accuracy: 82.00% -> 84.09%     
client [71] (testset)   loss: 0.6003 -> 0.5302  accuracy: 79.39% -> 84.74%     
client [97] (testset)   loss: 0.3887 -> 0.2405  accuracy: 87.13% -> 94.02%     
client [53] (testset)   loss: 0.4686 -> 0.3683  accuracy: 84.46% -> 88.36%     
client [77] (testset)   loss: 0.5917 -> 0.4483  accuracy: 79.46% -> 85.24%     
client [76] (testset)   loss: 0.7215 -> 0.4860  accuracy: 75.06% -> 85.30%     
client [79] (testset)   loss: 0.3102 -> 0.1916  accuracy: 87.70% -> 95.05%     
client [28] (testset)   loss: 0.4474 -> 0.3630  accuracy: 83.58% -> 88.91%     
client [99] (testset)   loss: 0.4251 -> 0.2392  accuracy: 85.55% -> 93.08%     
---------------------------- TRAINING EPOCH: 110 ----------------------------  
client [97] (testset)   loss: 0.3792 -> 0.2477  accuracy: 87.33% -> 93.39%     
client [86] (testset)   loss: 0.3742 -> 0.2562  accuracy: 89.26% -> 93.57%     
client [34] (testset)   loss: 0.5713 -> 0.3586  accuracy: 81.21% -> 90.41%     
client [73] (testset)   loss: 0.5161 -> 0.5133  accuracy: 83.13% -> 84.84%     
client [5]  (testset)   loss: 0.5515 -> 0.3620  accuracy: 81.07% -> 90.54%     
client [96] (testset)   loss: 0.4825 -> 0.3600  accuracy: 83.31% -> 89.51%     
client [22] (testset)   loss: 0.5859 -> 0.5404  accuracy: 82.15% -> 83.54%     
client [60] (testset)   loss: 0.4524 -> 0.2272  accuracy: 81.77% -> 94.01%     
client [66] (testset)   loss: 0.3948 -> 0.2731  accuracy: 87.88% -> 93.31%     
client [83] (testset)   loss: 0.6287 -> 0.3009  accuracy: 78.60% -> 91.18%     
---------------------------- TRAINING EPOCH: 120 ----------------------------  
client [76] (testset)   loss: 0.7209 -> 0.5109  accuracy: 76.27% -> 85.52%     
client [65] (testset)   loss: 0.7422 -> 0.4585  accuracy: 74.43% -> 86.84%     
client [95] (testset)   loss: 0.4074 -> 0.2522  accuracy: 84.91% -> 93.73%     
client [17] (testset)   loss: 0.4680 -> 0.2788  accuracy: 83.70% -> 92.23%     
client [8]  (testset)   loss: 0.4664 -> 0.3210  accuracy: 83.90% -> 92.51%     
client [35] (testset)   loss: 0.7296 -> 0.4985  accuracy: 76.42% -> 84.04%     
client [98] (testset)   loss: 0.3069 -> 0.2763  accuracy: 90.81% -> 92.81%     
client [53] (testset)   loss: 0.4625 -> 0.3740  accuracy: 86.23% -> 88.65%     
client [43] (testset)   loss: 0.4342 -> 0.3047  accuracy: 84.52% -> 91.87%     
client [64] (testset)   loss: 0.6487 -> 0.4415  accuracy: 76.49% -> 86.93%     
---------------------------- TRAINING EPOCH: 130 ----------------------------  
client [21] (testset)   loss: 0.5476 -> 0.3183  accuracy: 81.41% -> 92.21%     
client [88] (testset)   loss: 0.4226 -> 0.3587  accuracy: 85.09% -> 88.26%     
client [38] (testset)   loss: 0.3493 -> 0.3029  accuracy: 89.98% -> 92.36%     
client [3]  (testset)   loss: 0.3395 -> 0.2163  accuracy: 89.62% -> 94.45%     
client [5]  (testset)   loss: 0.5132 -> 0.3658  accuracy: 81.88% -> 90.24%     
client [41] (testset)   loss: 0.7836 -> 0.5556  accuracy: 69.99% -> 83.04%     
client [7]  (testset)   loss: 0.3512 -> 0.3145  accuracy: 86.91% -> 88.86%     
client [37] (testset)   loss: 0.4193 -> 0.3390  accuracy: 85.94% -> 89.11%     
client [45] (testset)   loss: 0.5427 -> 0.4131  accuracy: 81.94% -> 88.57%     
client [47] (testset)   loss: 0.6546 -> 0.5088  accuracy: 75.93% -> 83.40%     
---------------------------- TRAINING EPOCH: 140 ----------------------------  
client [16] (testset)   loss: 0.3597 -> 0.3473  accuracy: 89.02% -> 91.62%     
client [11] (testset)   loss: 0.5181 -> 0.2270  accuracy: 79.57% -> 94.36%     
client [37] (testset)   loss: 0.4069 -> 0.3252  accuracy: 85.79% -> 90.06%     
client [41] (testset)   loss: 0.7280 -> 0.5622  accuracy: 74.65% -> 82.46%     
client [95] (testset)   loss: 0.3546 -> 0.2602  accuracy: 88.25% -> 93.45%     
client [53] (testset)   loss: 0.5354 -> 0.3709  accuracy: 82.27% -> 90.31%     
client [22] (testset)   loss: 0.6044 -> 0.5586  accuracy: 80.14% -> 82.92%     
client [25] (testset)   loss: 0.3200 -> 0.2094  accuracy: 88.46% -> 95.82%     
client [69] (testset)   loss: 0.4294 -> 0.2907  accuracy: 85.17% -> 93.12%     
client [46] (testset)   loss: 0.4152 -> 0.3021  accuracy: 86.19% -> 91.96%     
---------------------------- TRAINING EPOCH: 150 ----------------------------  
client [47] (testset)   loss: 0.6092 -> 0.5335  accuracy: 78.78% -> 84.28%     
client [69] (testset)   loss: 0.4991 -> 0.2986  accuracy: 83.43% -> 93.34%     
client [82] (testset)   loss: 0.6288 -> 0.4274  accuracy: 80.02% -> 88.26%     
client [45] (testset)   loss: 0.5179 -> 0.4132  accuracy: 82.77% -> 88.90%     
client [7]  (testset)   loss: 0.3871 -> 0.3389  accuracy: 88.03% -> 88.91%     
client [50] (testset)   loss: 0.4327 -> 0.3190  accuracy: 86.98% -> 90.40%     
client [35] (testset)   loss: 0.7177 -> 0.5344  accuracy: 77.39% -> 85.99%     
client [24] (testset)   loss: 0.4502 -> 0.3002  accuracy: 86.41% -> 93.00%     
client [15] (testset)   loss: 0.5381 -> 0.4881  accuracy: 82.58% -> 86.18%     
client [58] (testset)   loss: 0.3791 -> 0.2869  accuracy: 86.53% -> 92.12%     
---------------------------- TRAINING EPOCH: 160 ----------------------------  
client [48] (testset)   loss: 0.4809 -> 0.3871  accuracy: 82.83% -> 86.90%     
client [76] (testset)   loss: 0.7721 -> 0.5396  accuracy: 71.81% -> 84.20%     
client [67] (testset)   loss: 0.3667 -> 0.3379  accuracy: 86.97% -> 90.34%     
client [37] (testset)   loss: 0.3991 -> 0.3327  accuracy: 85.94% -> 90.01%     
client [58] (testset)   loss: 0.3886 -> 0.2974  accuracy: 85.86% -> 92.35%     
client [64] (testset)   loss: 0.5676 -> 0.4666  accuracy: 80.74% -> 86.61%     
client [77] (testset)   loss: 0.5683 -> 0.4895  accuracy: 80.81% -> 85.78%     
client [55] (testset)   loss: 0.5127 -> 0.4181  accuracy: 81.19% -> 87.21%     
client [12] (testset)   loss: 0.5453 -> 0.4443  accuracy: 80.72% -> 87.52%     
client [89] (testset)   loss: 0.5035 -> 0.4619  accuracy: 83.95% -> 86.55%     
---------------------------- TRAINING EPOCH: 170 ----------------------------  
client [84] (testset)   loss: 0.4774 -> 0.3206  accuracy: 85.97% -> 92.74%     
client [51] (testset)   loss: 0.3617 -> 0.3245  accuracy: 88.95% -> 93.01%     
client [8]  (testset)   loss: 0.4813 -> 0.3578  accuracy: 85.77% -> 91.84%     
client [18] (testset)   loss: 0.4617 -> 0.4814  accuracy: 86.43% -> 86.17%     
client [94] (testset)   loss: 0.4535 -> 0.3498  accuracy: 88.37% -> 90.53%     
client [81] (testset)   loss: 0.5411 -> 0.4491  accuracy: 83.84% -> 85.55%     
client [3]  (testset)   loss: 0.3913 -> 0.2237  accuracy: 87.91% -> 94.65%     
client [11] (testset)   loss: 0.4475 -> 0.2472  accuracy: 85.60% -> 94.52%     
client [95] (testset)   loss: 0.3625 -> 0.2677  accuracy: 88.84% -> 93.69%     
client [67] (testset)   loss: 0.4388 -> 0.3541  accuracy: 86.24% -> 89.93%     
---------------------------- TRAINING EPOCH: 180 ----------------------------  
client [21] (testset)   loss: 0.4577 -> 0.2942  accuracy: 87.00% -> 92.63%     
client [79] (testset)   loss: 0.3291 -> 0.1993  accuracy: 89.01% -> 94.54%     
client [58] (testset)   loss: 0.3635 -> 0.2958  accuracy: 87.16% -> 92.27%     
client [88] (testset)   loss: 0.4653 -> 0.3652  accuracy: 84.94% -> 88.26%     
client [46] (testset)   loss: 0.4095 -> 0.3282  accuracy: 88.97% -> 91.12%     
client [11] (testset)   loss: 0.4758 -> 0.2451  accuracy: 84.83% -> 94.47%     
client [55] (testset)   loss: 0.4825 -> 0.4566  accuracy: 84.25% -> 86.09%     
client [13] (testset)   loss: 0.5036 -> 0.4285  accuracy: 82.97% -> 87.24%     
client [31] (testset)   loss: 0.4584 -> 0.3753  accuracy: 85.96% -> 88.63%     
client [75] (testset)   loss: 0.4440 -> 0.3784  accuracy: 84.63% -> 88.34%     
---------------------------- TRAINING EPOCH: 190 ----------------------------  
client [19] (testset)   loss: 0.4353 -> 0.3683  accuracy: 85.96% -> 90.62%     
client [7]  (testset)   loss: 0.3641 -> 0.3363  accuracy: 87.45% -> 89.11%     
client [57] (testset)   loss: 0.5632 -> 0.5457  accuracy: 81.72% -> 86.58%     
client [13] (testset)   loss: 0.5174 -> 0.4272  accuracy: 83.76% -> 88.10%     
client [43] (testset)   loss: 0.4621 -> 0.3357  accuracy: 84.74% -> 91.96%     
client [91] (testset)   loss: 0.5673 -> 0.4351  accuracy: 80.78% -> 87.24%     
client [10] (testset)   loss: 0.4237 -> 0.3500  accuracy: 86.41% -> 90.65%     
client [64] (testset)   loss: 0.5968 -> 0.4887  accuracy: 79.34% -> 85.85%     
client [82] (testset)   loss: 0.6262 -> 0.4816  accuracy: 81.15% -> 87.58%     
client [22] (testset)   loss: 0.6728 -> 0.5904  accuracy: 79.10% -> 83.82%     
---------------------------- TRAINING EPOCH: 200 ----------------------------  
client [20] (testset)   loss: 0.5272 -> 0.3689  accuracy: 83.55% -> 91.57%     
client [23] (testset)   loss: 0.6713 -> 0.5050  accuracy: 78.66% -> 85.99%     
client [88] (testset)   loss: 0.4893 -> 0.4208  accuracy: 84.04% -> 86.84%     
client [98] (testset)   loss: 0.3230 -> 0.3264  accuracy: 91.37% -> 92.49%     
client [79] (testset)   loss: 0.3287 -> 0.1974  accuracy: 89.08% -> 94.98%     
client [21] (testset)   loss: 0.4536 -> 0.3345  accuracy: 87.30% -> 92.86%     
client [92] (testset)   loss: 0.4698 -> 0.2852  accuracy: 85.66% -> 93.12%     
client [56] (testset)   loss: 0.5750 -> 0.4873  accuracy: 80.80% -> 85.69%     
client [5]  (testset)   loss: 0.6082 -> 0.3847  accuracy: 81.36% -> 90.76%     
client [52] (testset)   loss: 0.6808 -> 0.5028  accuracy: 78.18% -> 87.42%     
---------------------------- TRAINING EPOCH: 210 ----------------------------  
client [67] (testset)   loss: 0.4546 -> 0.3613  accuracy: 86.50% -> 89.67%     
client [54] (testset)   loss: 0.3178 -> 0.2477  accuracy: 89.98% -> 92.96%     
client [14] (testset)   loss: 0.4284 -> 0.3186  accuracy: 88.26% -> 92.89%     
client [99] (testset)   loss: 0.6588 -> 0.2862  accuracy: 80.93% -> 92.92%     
client [36] (testset)   loss: 0.5010 -> 0.4775  accuracy: 84.24% -> 87.78%     
client [30] (testset)   loss: 0.3923 -> 0.4070  accuracy: 87.97% -> 90.42%     
client [38] (testset)   loss: 0.3451 -> 0.3219  accuracy: 90.96% -> 92.71%     
client [15] (testset)   loss: 0.6430 -> 0.5123  accuracy: 79.05% -> 84.81%     
client [6]  (testset)   loss: 0.7581 -> 0.4993  accuracy: 75.82% -> 87.21%     
client [53] (testset)   loss: 0.5303 -> 0.4263  accuracy: 86.05% -> 89.01%     
---------------------------- TRAINING EPOCH: 220 ----------------------------  
client [99] (testset)   loss: 0.6430 -> 0.3059  accuracy: 80.20% -> 92.69%     
client [6]  (testset)   loss: 0.7643 -> 0.5059  accuracy: 74.27% -> 87.84%     
client [83] (testset)   loss: 0.5453 -> 0.3600  accuracy: 83.32% -> 90.71%     
client [42] (testset)   loss: 0.4016 -> 0.3137  accuracy: 88.04% -> 92.89%     
client [34] (testset)   loss: 0.5505 -> 0.4260  accuracy: 84.05% -> 90.18%     
client [15] (testset)   loss: 0.6133 -> 0.5176  accuracy: 80.20% -> 85.03%     
client [47] (testset)   loss: 0.7996 -> 0.6126  accuracy: 74.47% -> 82.60%     
client [55] (testset)   loss: 0.5239 -> 0.4671  accuracy: 83.03% -> 86.90%     
client [51] (testset)   loss: 0.4295 -> 0.3497  accuracy: 87.08% -> 92.51%     
client [95] (testset)   loss: 0.4025 -> 0.2813  accuracy: 87.77% -> 93.41%     
---------------------------- TRAINING EPOCH: 230 ----------------------------  
client [71] (testset)   loss: 0.9083 -> 0.6067  accuracy: 70.85% -> 83.76%     
client [15] (testset)   loss: 0.7226 -> 0.5246  accuracy: 76.67% -> 85.67%     
client [33] (testset)   loss: 0.5659 -> 0.4250  accuracy: 82.21% -> 87.31%     
client [99] (testset)   loss: 0.5306 -> 0.2964  accuracy: 83.21% -> 92.92%     
client [90] (testset)   loss: 0.7315 -> 0.5624  accuracy: 78.31% -> 83.87%     
client [57] (testset)   loss: 0.5680 -> 0.5658  accuracy: 84.90% -> 84.80%     
client [27] (testset)   loss: 0.3552 -> 0.2902  accuracy: 90.54% -> 93.66%     
client [78] (testset)   loss: 0.4234 -> 0.3319  accuracy: 87.68% -> 91.99%     
client [36] (testset)   loss: 0.6021 -> 0.4864  accuracy: 82.19% -> 87.58%     
client [88] (testset)   loss: 0.5386 -> 0.3830  accuracy: 83.57% -> 88.21%     
---------------------------- TRAINING EPOCH: 240 ----------------------------  
client [70] (testset)   loss: 0.7614 -> 0.6040  accuracy: 77.84% -> 84.37%     
client [35] (testset)   loss: 0.9412 -> 0.5943  accuracy: 73.62% -> 83.78%     
client [16] (testset)   loss: 0.4339 -> 0.3665  accuracy: 88.03% -> 91.67%     
client [80] (testset)   loss: 0.7371 -> 0.5361  accuracy: 76.03% -> 83.48%     
client [38] (testset)   loss: 0.4081 -> 0.3432  accuracy: 89.72% -> 92.09%     
client [78] (testset)   loss: 0.3909 -> 0.3596  accuracy: 89.94% -> 90.81%     
client [68] (testset)   loss: 0.3370 -> 0.3371  accuracy: 89.35% -> 90.56%     
client [11] (testset)   loss: 0.5989 -> 0.2667  accuracy: 83.08% -> 94.36%     
client [64] (testset)   loss: 0.7038 -> 0.5368  accuracy: 79.83% -> 86.87%     
client [82] (testset)   loss: 0.6224 -> 0.5216  accuracy: 83.86% -> 86.85%     
---------------------------- TRAINING EPOCH: 250 ----------------------------  
client [30] (testset)   loss: 0.4062 -> 0.4193  accuracy: 87.78% -> 90.42%     
client [27] (testset)   loss: 0.4005 -> 0.3056  accuracy: 88.41% -> 93.66%     
client [74] (testset)   loss: 0.5128 -> 0.3660  accuracy: 83.14% -> 91.88%     
client [45] (testset)   loss: 0.6199 -> 0.4715  accuracy: 81.61% -> 87.99%     
client [6]  (testset)   loss: 0.8366 -> 0.5128  accuracy: 73.19% -> 87.52%     
client [36] (testset)   loss: 0.5098 -> 0.4863  accuracy: 84.54% -> 88.03%     
client [63] (testset)   loss: 0.4050 -> 0.3915  accuracy: 88.72% -> 90.92%     
client [76] (testset)   loss: 0.8246 -> 0.5926  accuracy: 77.04% -> 84.69%     
client [83] (testset)   loss: 0.6610 -> 0.3610  accuracy: 79.03% -> 91.39%     
client [86] (testset)   loss: 0.4787 -> 0.2744  accuracy: 85.40% -> 93.57%     
---------------------------- TRAINING EPOCH: 260 ----------------------------  
client [83] (testset)   loss: 0.8040 -> 0.3752  accuracy: 71.60% -> 91.14%     
client [99] (testset)   loss: 0.6268 -> 0.2940  accuracy: 79.03% -> 92.86%     
client [74] (testset)   loss: 0.4043 -> 0.3799  accuracy: 87.74% -> 92.16%     
client [73] (testset)   loss: 0.5796 -> 0.5748  accuracy: 84.04% -> 84.84%     
client [29] (testset)   loss: 0.7944 -> 0.6305  accuracy: 78.52% -> 83.14%     
client [92] (testset)   loss: 0.4109 -> 0.2899  accuracy: 87.98% -> 92.54%     
client [6]  (testset)   loss: 0.6248 -> 0.5328  accuracy: 79.22% -> 87.39%     
client [61] (testset)   loss: 0.3650 -> 0.3369  accuracy: 90.09% -> 92.89%     
client [21] (testset)   loss: 0.5850 -> 0.3200  accuracy: 76.83% -> 92.55%     
client [67] (testset)   loss: 0.4768 -> 0.3852  accuracy: 86.14% -> 90.19%     
---------------------------- TRAINING EPOCH: 270 ----------------------------  
client [83] (testset)   loss: 0.7846 -> 0.3770  accuracy: 73.81% -> 91.21%     
client [32] (testset)   loss: 0.4300 -> 0.3639  accuracy: 88.97% -> 91.60%     
client [95] (testset)   loss: 0.4300 -> 0.2900  accuracy: 87.61% -> 93.37%     
client [61] (testset)   loss: 0.3798 -> 0.3403  accuracy: 90.04% -> 93.08%     
client [27] (testset)   loss: 0.4230 -> 0.3089  accuracy: 87.28% -> 93.33%     
client [25] (testset)   loss: 0.3783 -> 0.2402  accuracy: 87.61% -> 95.63%     
client [68] (testset)   loss: 0.3358 -> 0.3446  accuracy: 89.09% -> 90.84%     
client [34] (testset)   loss: 0.7090 -> 0.4555  accuracy: 77.19% -> 90.18%     
client [71] (testset)   loss: 0.7785 -> 0.6455  accuracy: 74.50% -> 83.36%     
client [89] (testset)   loss: 0.5640 -> 0.5198  accuracy: 85.90% -> 87.07%     
---------------------------- TRAINING EPOCH: 280 ----------------------------  
client [78] (testset)   loss: 0.4115 -> 0.3708  accuracy: 88.55% -> 91.07%     
client [81] (testset)   loss: 0.5956 -> 0.5533  accuracy: 83.84% -> 84.86%     
client [51] (testset)   loss: 0.4025 -> 0.3578  accuracy: 89.45% -> 92.51%     
client [54] (testset)   loss: 0.3400 -> 0.2712  accuracy: 89.53% -> 92.12%     
client [65] (testset)   loss: 0.9837 -> 0.5375  accuracy: 70.04% -> 87.04%     
client [41] (testset)   loss: 1.0923 -> 0.6411  accuracy: 62.43% -> 82.63%     
client [11] (testset)   loss: 0.5335 -> 0.2707  accuracy: 84.67% -> 94.41%     
client [85] (testset)   loss: 0.3333 -> 0.3213  accuracy: 91.65% -> 92.76%     
client [12] (testset)   loss: 0.5889 -> 0.4926  accuracy: 80.96% -> 86.75%     
client [23] (testset)   loss: 0.6113 -> 0.5458  accuracy: 83.06% -> 85.94%     
---------------------------- TRAINING EPOCH: 290 ----------------------------  
client [16] (testset)   loss: 0.4234 -> 0.3929  accuracy: 88.45% -> 91.95%     
client [65] (testset)   loss: 0.7450 -> 0.5574  accuracy: 79.28% -> 87.18%     
client [53] (testset)   loss: 0.6372 -> 0.4406  accuracy: 81.62% -> 89.01%     
client [58] (testset)   loss: 0.4004 -> 0.3438  accuracy: 86.85% -> 92.31%     
client [72] (testset)   loss: 0.5259 -> 0.4884  accuracy: 81.52% -> 85.93%     
client [7]  (testset)   loss: 0.3866 -> 0.3809  accuracy: 87.84% -> 88.86%     
client [71] (testset)   loss: 0.7869 -> 0.6541  accuracy: 75.66% -> 83.44%     
client [59] (testset)   loss: 0.6637 -> 0.5633  accuracy: 78.77% -> 83.88%     
client [86] (testset)   loss: 0.6143 -> 0.2743  accuracy: 76.94% -> 93.37%     
client [39] (testset)   loss: 0.5696 -> 0.5356  accuracy: 81.60% -> 85.53%     
---------------------------- TRAINING EPOCH: 300 ----------------------------  
client [99] (testset)   loss: 0.4943 -> 0.3198  accuracy: 86.11% -> 92.53%     
client [7]  (testset)   loss: 0.4580 -> 0.3839  accuracy: 84.47% -> 89.45%     
client [17] (testset)   loss: 0.5067 -> 0.3437  accuracy: 86.95% -> 92.11%     
client [64] (testset)   loss: 0.8324 -> 0.5715  accuracy: 75.95% -> 86.44%     
client [37] (testset)   loss: 0.5785 -> 0.3803  accuracy: 84.39% -> 89.66%     
client [29] (testset)   loss: 0.7722 -> 0.6794  accuracy: 79.91% -> 83.60%     
client [93] (testset)   loss: 0.8940 -> 0.4303  accuracy: 72.25% -> 92.15%     
client [73] (testset)   loss: 0.6653 -> 0.6008  accuracy: 82.17% -> 85.29%     
client [40] (testset)   loss: 0.5965 -> 0.4317  accuracy: 84.00% -> 89.76%     
client [76] (testset)   loss: 0.9881 -> 0.6407  accuracy: 70.65% -> 85.46%     
---------------------------- TRAINING EPOCH: 310 ----------------------------  
client [31] (testset)   loss: 0.4909 -> 0.4298  accuracy: 85.86% -> 89.13%     
client [89] (testset)   loss: 0.6001 -> 0.5429  accuracy: 84.41% -> 87.20%     
client [77] (testset)   loss: 0.6735 -> 0.5970  accuracy: 82.38% -> 85.46%     
client [90] (testset)   loss: 0.7766 -> 0.6169  accuracy: 78.36% -> 83.23%     
client [26] (testset)   loss: 0.5235 -> 0.4601  accuracy: 84.90% -> 88.50%     
client [50] (testset)   loss: 0.4911 -> 0.3781  accuracy: 87.34% -> 90.15%     
client [30] (testset)   loss: 0.4762 -> 0.4401  accuracy: 86.88% -> 90.60%     
client [70] (testset)   loss: 0.7390 -> 0.6318  accuracy: 79.11% -> 84.30%     
client [41] (testset)   loss: 1.0010 -> 0.6702  accuracy: 67.41% -> 83.29%     
client [99] (testset)   loss: 0.6759 -> 0.3216  accuracy: 80.76% -> 93.03%     
---------------------------- TRAINING EPOCH: 320 ----------------------------  
client [68] (testset)   loss: 0.3603 -> 0.3579  accuracy: 89.06% -> 90.94%     
client [70] (testset)   loss: 0.8538 -> 0.6488  accuracy: 76.48% -> 84.45%     
client [52] (testset)   loss: 0.8197 -> 0.6110  accuracy: 77.16% -> 86.73%     
client [1]  (testset)   loss: 0.5472 -> 0.3915  accuracy: 85.61% -> 91.10%     
client [2]  (testset)   loss: 0.3866 -> 0.3392  accuracy: 89.84% -> 91.81%     
client [67] (testset)   loss: 0.5078 -> 0.4177  accuracy: 86.34% -> 90.08%     
client [92] (testset)   loss: 0.5348 -> 0.2982  accuracy: 85.66% -> 92.95%     
client [35] (testset)   loss: 0.8527 -> 0.6329  accuracy: 77.79% -> 84.17%     
client [36] (testset)   loss: 0.5748 -> 0.5510  accuracy: 83.54% -> 87.53%     
client [64] (testset)   loss: 0.7466 -> 0.5934  accuracy: 79.34% -> 86.61%     
---------------------------- TRAINING EPOCH: 330 ----------------------------  
client [44] (testset)   loss: 0.7540 -> 0.7058  accuracy: 78.56% -> 80.41%     
client [6]  (testset)   loss: 0.9340 -> 0.5737  accuracy: 72.41% -> 86.39%     
client [12] (testset)   loss: 0.5691 -> 0.5222  accuracy: 83.74% -> 86.10%     
client [55] (testset)   loss: 0.5707 -> 0.5329  accuracy: 84.15% -> 87.61%     
client [29] (testset)   loss: 0.7720 -> 0.6743  accuracy: 80.72% -> 83.72%     
client [9]  (testset)   loss: 0.9444 -> 0.7201  accuracy: 75.30% -> 81.58%     
client [43] (testset)   loss: 0.4974 -> 0.4129  accuracy: 85.91% -> 91.53%     
client [77] (testset)   loss: 0.6653 -> 0.6102  accuracy: 82.92% -> 85.51%     
client [98] (testset)   loss: 0.3789 -> 0.3561  accuracy: 91.21% -> 92.49%     
client [78] (testset)   loss: 0.4795 -> 0.3983  accuracy: 86.50% -> 91.38%     
---------------------------- TRAINING EPOCH: 340 ----------------------------  
client [92] (testset)   loss: 0.5169 -> 0.3128  accuracy: 85.66% -> 93.12%     
client [80] (testset)   loss: 0.6907 -> 0.5852  accuracy: 78.11% -> 85.98%     
client [63] (testset)   loss: 0.5304 -> 0.4235  accuracy: 86.23% -> 91.36%     
client [76] (testset)   loss: 0.8986 -> 0.6560  accuracy: 78.69% -> 85.30%     
client [78] (testset)   loss: 0.5336 -> 0.3948  accuracy: 84.91% -> 91.79%     
client [25] (testset)   loss: 0.3487 -> 0.2609  accuracy: 90.39% -> 95.53%     
client [58] (testset)   loss: 0.4362 -> 0.3532  accuracy: 87.68% -> 92.00%     
client [13] (testset)   loss: 0.5830 -> 0.4917  accuracy: 83.88% -> 87.91%     
client [17] (testset)   loss: 0.5466 -> 0.3638  accuracy: 85.73% -> 92.35%     
client [38] (testset)   loss: 0.3678 -> 0.3501  accuracy: 90.96% -> 92.68%     
---------------------------- TRAINING EPOCH: 350 ----------------------------  
client [72] (testset)   loss: 0.5477 -> 0.5357  accuracy: 84.44% -> 86.49%     
client [82] (testset)   loss: 0.6879 -> 0.6103  accuracy: 84.54% -> 85.95%     
client [86] (testset)   loss: 0.4133 -> 0.2943  accuracy: 90.95% -> 93.12%     
client [51] (testset)   loss: 0.4808 -> 0.3990  accuracy: 87.58% -> 92.65%     
client [96] (testset)   loss: 0.7763 -> 0.5037  accuracy: 80.76% -> 89.18%     
client [42] (testset)   loss: 0.4119 -> 0.3651  accuracy: 90.09% -> 92.62%     
client [55] (testset)   loss: 0.5630 -> 0.5587  accuracy: 84.15% -> 87.21%     
client [13] (testset)   loss: 0.5866 -> 0.5017  accuracy: 84.98% -> 88.22%     
client [1]  (testset)   loss: 0.5249 -> 0.3974  accuracy: 86.03% -> 90.78%     
client [12] (testset)   loss: 0.6763 -> 0.5274  accuracy: 81.67% -> 86.87%     
---------------------------- TRAINING EPOCH: 360 ----------------------------  
client [68] (testset)   loss: 0.3764 -> 0.3735  accuracy: 88.97% -> 90.84%     
client [23] (testset)   loss: 0.6730 -> 0.6038  accuracy: 81.82% -> 85.71%     
client [46] (testset)   loss: 0.4899 -> 0.4009  accuracy: 87.82% -> 91.65%     
client [41] (testset)   loss: 1.1809 -> 0.7098  accuracy: 63.26% -> 82.13%     
client [25] (testset)   loss: 0.3417 -> 0.2554  accuracy: 90.39% -> 95.87%     
client [58] (testset)   loss: 0.4492 -> 0.3651  accuracy: 86.69% -> 91.96%     
client [14] (testset)   loss: 0.4337 -> 0.3608  accuracy: 88.16% -> 91.79%     
client [33] (testset)   loss: 0.5792 -> 0.5202  accuracy: 82.82% -> 87.03%     
client [85] (testset)   loss: 0.3535 -> 0.3821  accuracy: 91.47% -> 92.50%     
client [62] (testset)   loss: 0.6157 -> 0.5345  accuracy: 84.49% -> 89.35%     
---------------------------- TRAINING EPOCH: 370 ----------------------------  
client [98] (testset)   loss: 0.3633 -> 0.3562  accuracy: 91.37% -> 92.17%     
client [63] (testset)   loss: 0.5532 -> 0.4333  accuracy: 87.60% -> 90.87%     
client [70] (testset)   loss: 0.8625 -> 0.6585  accuracy: 77.31% -> 83.70%     
client [65] (testset)   loss: 1.0479 -> 0.5696  accuracy: 72.60% -> 86.37%     
client [14] (testset)   loss: 0.5070 -> 0.3744  accuracy: 85.54% -> 92.51%     
client [73] (testset)   loss: 0.7582 -> 0.6725  accuracy: 81.66% -> 84.61%     
client [34] (testset)   loss: 0.6100 -> 0.4865  accuracy: 85.58% -> 90.41%     
client [99] (testset)   loss: 0.6810 -> 0.3569  accuracy: 82.49% -> 92.53%     
client [69] (testset)   loss: 0.6114 -> 0.3843  accuracy: 83.82% -> 93.23%     
client [46] (testset)   loss: 0.5020 -> 0.4053  accuracy: 88.29% -> 90.49%     
---------------------------- TRAINING EPOCH: 380 ----------------------------  
client [99] (testset)   loss: 0.8197 -> 0.3464  accuracy: 76.97% -> 92.92%     
client [93] (testset)   loss: 0.7038 -> 0.4609  accuracy: 80.94% -> 91.86%     
client [11] (testset)   loss: 0.7641 -> 0.3152  accuracy: 76.67% -> 94.36%     
client [58] (testset)   loss: 0.3940 -> 0.3736  accuracy: 88.35% -> 92.00%     
client [81] (testset)   loss: 0.7199 -> 0.6388  accuracy: 80.52% -> 85.01%     
client [85] (testset)   loss: 0.3999 -> 0.3518  accuracy: 89.96% -> 92.68%     
client [89] (testset)   loss: 0.6487 -> 0.5652  accuracy: 84.15% -> 87.39%     
client [45] (testset)   loss: 0.6616 -> 0.5283  accuracy: 81.52% -> 88.24%     
client [8]  (testset)   loss: 0.6284 -> 0.4600  accuracy: 82.25% -> 91.16%     
client [68] (testset)   loss: 0.3882 -> 0.3745  accuracy: 88.87% -> 90.91%     
---------------------------- TRAINING EPOCH: 390 ----------------------------  
client [67] (testset)   loss: 0.4920 -> 0.4420  accuracy: 87.18% -> 89.67%     
client [72] (testset)   loss: 0.5641 -> 0.5533  accuracy: 84.44% -> 86.38%     
client [1]  (testset)   loss: 0.5540 -> 0.4149  accuracy: 85.82% -> 90.51%     
client [78] (testset)   loss: 0.4609 -> 0.4110  accuracy: 87.68% -> 91.22%     
client [83] (testset)   loss: 0.6123 -> 0.4107  accuracy: 84.32% -> 91.57%     
client [21] (testset)   loss: 0.4859 -> 0.3795  accuracy: 87.38% -> 92.59%     
client [56] (testset)   loss: 0.7065 -> 0.5025  accuracy: 78.39% -> 88.63%     
client [44] (testset)   loss: 0.7950 -> 0.7328  accuracy: 77.81% -> 81.10%     
client [92] (testset)   loss: 0.5888 -> 0.3150  accuracy: 84.66% -> 92.79%     
client [27] (testset)   loss: 0.4132 -> 0.3587  accuracy: 90.14% -> 93.00%     
---------------------------- TRAINING EPOCH: 400 ----------------------------  
client [10] (testset)   loss: 0.4898 -> 0.4346  accuracy: 87.47% -> 90.58%     
client [39] (testset)   loss: 0.6598 -> 0.5978  accuracy: 81.86% -> 85.14%     
client [65] (testset)   loss: 1.0755 -> 0.6147  accuracy: 70.65% -> 85.49%     
client [26] (testset)   loss: 0.5907 -> 0.4896  accuracy: 84.04% -> 89.47%     
client [19] (testset)   loss: 0.5400 -> 0.4591  accuracy: 85.88% -> 90.54%     
client [68] (testset)   loss: 0.3434 -> 0.3826  accuracy: 90.05% -> 91.10%     
client [41] (testset)   loss: 1.1108 -> 0.7213  accuracy: 67.33% -> 82.88%     
client [50] (testset)   loss: 0.4899 -> 0.4003  accuracy: 87.76% -> 90.30%     
client [75] (testset)   loss: 0.5522 -> 0.4876  accuracy: 82.77% -> 87.82%     
client [81] (testset)   loss: 0.7092 -> 0.6403  accuracy: 80.91% -> 85.30%     
Training... ---------------------------------------- 100% 2:16:01
FedAvg's average time taken by each global epoch: 0 min 20.29 sec.             
FedAvg's total running time: 2 h 16 m 1 s.                                     
==================== FedAvg Experiment Results: ====================           
Display format: (before local fine-tuning) -> (after local fine-tuning)        
 So if finetune_epoch = 0, x.xx% -> 0.00% is normal.                           
 Centralized testing ONLY happens after model aggregation, so the stats between
'->' are the same.                                                             
{                                                                              
    "100": {                                                                   
        "all_clients": {                                                       
            "test": {                                                          
                "loss": "0.4573 -> 0.0000",                                    
                "accuracy": "83.90% -> 0.00%"                                  
            }                                                                  
        }                                                                      
    },                                                                         
    "200": {                                                                   
        "all_clients": {                                                       
            "test": {                                                          
                "loss": "0.5028 -> 0.0000",                                    
                "accuracy": "84.14% -> 0.00%"                                  
            }                                                                  
        }                                                                      
    },                                                                         
    "300": {                                                                   
        "all_clients": {                                                       
            "test": {                                                          
                "loss": "0.5729 -> 0.0000",                                    
                "accuracy": "82.95% -> 0.00%"                                  
            }                                                                  
        }                                                                      
    },                                                                         
    "400": {                                                                   
        "all_clients": {                                                       
            "test": {                                                          
                "loss": "0.6331 -> 0.0000",                                    
                "accuracy": "82.91% -> 0.00%"                                  
            }                                                                  
        }                                                                      
    }                                                                          
}                                                                              
==================== FedAvg Max Accuracy ====================                  
all_clients:                                                                   
(test) before fine-tuning: 84.14% at epoch 200                                 
(test) after fine-tuning: 0.00% at epoch 100                                   
[0m