==================== FedDpa ====================                               
Experiment Arguments:                                                          
{
│   'method': 'feddpa',
│   'dataset': {
│   │   'name': 'cifar100',
│   │   'client_num': 100,
│   │   'test_ratio': 0.25,
│   │   'val_ratio': 0.0,
│   │   'seed': 42,
│   │   'split': 'sample',
│   │   'IID_ratio': 0.0,
│   │   'monitor_window_name_suffix': 'cifar100-100clients-0%IID-use20superclasses-Dir(0.5)-seed42',
│   │   'super_class': False,
│   │   'alpha': 0.5,
│   │   'min_samples_per_client': 10
│   },
│   'model': {
│   │   'name': 'avgcnn',
│   │   'use_torchvision_pretrained_weights': True,
│   │   'external_model_weights_path': None
│   },
│   'optimizer': {
│   │   'lr': 0.01,
│   │   'dampening': 0,
│   │   'weight_decay': 0,
│   │   'momentum': 0,
│   │   'nesterov': False,
│   │   'name': 'sgd'
│   },
│   'mode': 'serial',
│   'parallel': {
│   │   'ray_cluster_addr': None,
│   │   'num_cpus': None,
│   │   'num_gpus': None,
│   │   'num_workers': 2
│   },
│   'common': {
│   │   'seed': 42,
│   │   'join_ratio': 0.1,
│   │   'global_epoch': 400,
│   │   'local_epoch': 5,
│   │   'batch_size': 32,
│   │   'reset_optimizer_on_global_epoch': True,
│   │   'straggler_ratio': 0,
│   │   'straggler_min_local_epoch': 0,
│   │   'buffers': 'global',
│   │   'client_side_evaluation': True,
│   │   'test': {
│   │   │   'client': {
│   │   │   │   'interval': 100,
│   │   │   │   'finetune_epoch': 0,
│   │   │   │   'train': False,
│   │   │   │   'val': False,
│   │   │   │   'test': True
│   │   │   },
│   │   │   'server': {
│   │   │   │   'interval': -1,
│   │   │   │   'train': False,
│   │   │   │   'val': False,
│   │   │   │   'test': False,
│   │   │   │   'model_in_train_mode': False
│   │   │   }
│   │   },
│   │   'verbose_gap': 10,
│   │   'monitor': None,
│   │   'use_cuda': True,
│   │   'save_log': True,
│   │   'save_model': False,
│   │   'save_learning_curve_plot': False,
│   │   'save_metrics': True,
│   │   'delete_useless_run': True
│   },
│   'feddpa': {
│   │   'fisher_threshold': 0.4
│   }
}
---------------------------- TRAINING EPOCH: 10 ----------------------------   
client [77] (testset)   loss: 3.9884 -> 4.1178  accuracy: 7.69% -> 7.69%       
client [81] (testset)   loss: 3.9136 -> 4.5754  accuracy: 8.85% -> 7.81%       
client [21] (testset)   loss: 4.5691 -> 4.3413  accuracy: 1.69% -> 2.54%       
client [68] (testset)   loss: 3.9637 -> 3.9221  accuracy: 9.77% -> 9.77%       
client [93] (testset)   loss: 4.0813 -> 3.9918  accuracy: 3.62% -> 10.87%      
client [31] (testset)   loss: 4.0764 -> 3.9358  accuracy: 5.74% -> 18.85%      
client [20] (testset)   loss: 3.9812 -> 3.8800  accuracy: 8.09% -> 14.71%      
client [59] (testset)   loss: 4.6122 -> 4.0005  accuracy: 0.61% -> 7.36%       
client [48] (testset)   loss: 4.1371 -> 4.1887  accuracy: 8.89% -> 14.81%      
client [34] (testset)   loss: 3.9583 -> 3.7680  accuracy: 11.20% -> 15.20%     
---------------------------- TRAINING EPOCH: 20 ----------------------------   
client [69] (testset)   loss: 3.8237 -> 3.7739  accuracy: 12.20% -> 16.26%     
client [99] (testset)   loss: 4.0050 -> 3.9921  accuracy: 9.74% -> 11.04%      
client [67] (testset)   loss: 3.8148 -> 3.7263  accuracy: 21.89% -> 16.57%     
client [0]  (testset)   loss: 3.7130 -> 3.9032  accuracy: 14.37% -> 11.49%     
client [76] (testset)   loss: 3.9554 -> 4.1682  accuracy: 17.07% -> 8.94%      
client [41] (testset)   loss: 3.7852 -> 3.6670  accuracy: 16.84% -> 17.89%     
client [62] (testset)   loss: 4.6214 -> 3.8128  accuracy: 1.18% -> 11.24%      
client [2]  (testset)   loss: 4.5657 -> 3.8633  accuracy: 0.00% -> 15.08%      
client [14] (testset)   loss: 4.2175 -> 4.1350  accuracy: 9.88% -> 8.72%       
client [46] (testset)   loss: 4.7144 -> 4.9157  accuracy: 4.07% -> 7.56%       
---------------------------- TRAINING EPOCH: 30 ----------------------------   
client [24] (testset)   loss: 4.0587 -> 4.3895  accuracy: 7.03% -> 10.94%      
client [68] (testset)   loss: 3.8803 -> 4.5291  accuracy: 11.28% -> 12.78%     
client [57] (testset)   loss: 3.8587 -> 3.8089  accuracy: 8.76% -> 8.03%       
client [17] (testset)   loss: 3.8636 -> 3.9975  accuracy: 15.22% -> 17.39%     
client [54] (testset)   loss: 3.8144 -> 4.8148  accuracy: 13.89% -> 11.81%     
client [23] (testset)   loss: 4.6278 -> 4.0534  accuracy: 2.13% -> 9.22%       
client [35] (testset)   loss: 3.9435 -> 4.3181  accuracy: 9.15% -> 10.37%      
client [59] (testset)   loss: 3.7426 -> 4.0014  accuracy: 13.50% -> 11.66%     
client [31] (testset)   loss: 3.7201 -> 5.2655  accuracy: 18.85% -> 5.74%      
client [9]  (testset)   loss: 3.9531 -> 4.1854  accuracy: 11.81% -> 9.72%      
---------------------------- TRAINING EPOCH: 40 ----------------------------   
client [64] (testset)   loss: 3.7094 -> 3.7083  accuracy: 20.22% -> 19.13%     
client [33] (testset)   loss: 4.0230 -> 4.6562  accuracy: 18.25% -> 11.90%     
client [16] (testset)   loss: 3.6413 -> 3.6456  accuracy: 20.13% -> 22.82%     
client [44] (testset)   loss: 4.2309 -> 5.9444  accuracy: 2.01% -> 8.72%       
client [8]  (testset)   loss: 4.6313 -> 5.1527  accuracy: 8.97% -> 9.66%       
client [31] (testset)   loss: 4.7488 -> 4.7676  accuracy: 16.39% -> 14.75%     
client [47] (testset)   loss: 3.7613 -> 3.8369  accuracy: 16.67% -> 15.94%     
client [36] (testset)   loss: 3.9671 -> 3.8599  accuracy: 15.04% -> 16.81%     
client [20] (testset)   loss: 4.2563 -> 4.9316  accuracy: 12.50% -> 11.76%     
client [56] (testset)   loss: 4.1372 -> 3.9832  accuracy: 3.97% -> 11.90%      
---------------------------- TRAINING EPOCH: 50 ----------------------------   
client [4]  (testset)   loss: 4.3851 -> 4.0417  accuracy: 13.33% -> 16.67%     
client [60] (testset)   loss: 3.9635 -> 4.1728  accuracy: 18.85% -> 4.10%      
client [28] (testset)   loss: 4.0600 -> 4.8219  accuracy: 12.73% -> 12.73%     
client [25] (testset)   loss: 3.8555 -> 4.1915  accuracy: 16.67% -> 12.90%     
client [58] (testset)   loss: 4.2782 -> 4.7216  accuracy: 14.19% -> 12.90%     
client [44] (testset)   loss: 5.7084 -> 4.9388  accuracy: 8.72% -> 2.68%       
client [39] (testset)   loss: 3.9577 -> 4.0933  accuracy: 17.52% -> 18.25%     
client [29] (testset)   loss: 4.6670 -> 5.7600  accuracy: 11.11% -> 8.02%      
client [3]  (testset)   loss: 5.0585 -> 4.7597  accuracy: 12.44% -> 14.51%     
client [84] (testset)   loss: 4.0979 -> 5.0893  accuracy: 16.17% -> 13.77%     
---------------------------- TRAINING EPOCH: 60 ----------------------------   
client [21] (testset)   loss: 5.9371 -> 5.7294  accuracy: 4.24% -> 3.39%       
client [84] (testset)   loss: 5.0898 -> 5.3386  accuracy: 12.57% -> 13.17%     
client [10] (testset)   loss: 3.9136 -> 4.3502  accuracy: 13.56% -> 12.99%     
client [36] (testset)   loss: 4.3157 -> 4.8424  accuracy: 14.16% -> 14.16%     
client [65] (testset)   loss: 4.3030 -> 4.9399  accuracy: 14.48% -> 18.62%     
client [81] (testset)   loss: 5.8812 -> 9.1422  accuracy: 12.50% -> 5.73%      
client [79] (testset)   loss: 4.4287 -> 6.0722  accuracy: 15.71% -> 12.86%     
client [42] (testset)   loss: 4.4512 -> 4.6831  accuracy: 15.94% -> 15.94%     
client [11] (testset)   loss: 4.0372 -> 4.1097  accuracy: 12.00% -> 15.20%     
client [96] (testset)   loss: 4.3363 -> 4.7326  accuracy: 16.77% -> 12.90%     
---------------------------- TRAINING EPOCH: 70 ----------------------------   
client [8]  (testset)   loss: 6.0138 -> 6.2426  accuracy: 12.41% -> 11.03%     
client [53] (testset)   loss: 3.9104 -> 4.1709  accuracy: 16.13% -> 15.48%     
client [52] (testset)   loss: 4.5285 -> 4.8879  accuracy: 16.67% -> 19.35%     
client [42] (testset)   loss: 4.7188 -> 5.4944  accuracy: 17.39% -> 18.12%     
client [69] (testset)   loss: 5.3524 -> 6.0228  accuracy: 14.63% -> 16.26%     
client [59] (testset)   loss: 4.5911 -> 5.5526  accuracy: 20.86% -> 18.40%     
client [7]  (testset)   loss: 5.4786 -> 5.8981  accuracy: 12.95% -> 7.19%      
client [26] (testset)   loss: 3.7723 -> 4.4162  accuracy: 19.18% -> 14.38%     
client [49] (testset)   loss: 5.5004 -> 4.9659  accuracy: 9.09% -> 9.09%       
client [98] (testset)   loss: 5.0858 -> 5.6589  accuracy: 14.69% -> 14.69%     
---------------------------- TRAINING EPOCH: 80 ----------------------------   
client [98] (testset)   loss: 5.4099 -> 6.1150  accuracy: 14.12% -> 14.69%     
client [47] (testset)   loss: 4.3382 -> 4.4283  accuracy: 16.67% -> 12.32%     
client [21] (testset)   loss: 9.4408 -> 7.5942  accuracy: 3.39% -> 9.32%       
client [77] (testset)   loss: 5.0002 -> 5.5247  accuracy: 13.99% -> 13.29%     
client [95] (testset)   loss: 5.8580 -> 5.6538  accuracy: 16.87% -> 15.06%     
client [91] (testset)   loss: 5.3972 -> 6.9800  accuracy: 12.42% -> 11.76%     
client [14] (testset)   loss: 6.6362 -> 5.2981  accuracy: 15.12% -> 18.02%     
client [99] (testset)   loss: 4.8656 -> 6.1102  accuracy: 14.94% -> 8.44%      
client [20] (testset)   loss: 6.6963 -> 6.5892  accuracy: 7.35% -> 15.44%      
client [39] (testset)   loss: 4.6191 -> 5.2003  accuracy: 16.06% -> 11.68%     
---------------------------- TRAINING EPOCH: 90 ----------------------------   
client [52] (testset)   loss: 4.8802 -> 5.9232  accuracy: 17.74% -> 15.59%     
client [62] (testset)   loss: 6.0368 -> 6.0678  accuracy: 16.57% -> 18.93%     
client [71] (testset)   loss: 5.2089 -> 4.6824  accuracy: 23.44% -> 18.75%     
client [97] (testset)   loss: 4.7140 -> 5.5004  accuracy: 20.89% -> 19.62%     
client [30] (testset)   loss: 6.7511 -> 6.7051  accuracy: 13.50% -> 13.50%     
client [88] (testset)   loss: 3.9744 -> 4.3492  accuracy: 20.31% -> 21.09%     
client [60] (testset)   loss: 5.4011 -> 5.9217  accuracy: 14.75% -> 18.03%     
client [82] (testset)   loss: 4.7171 -> 5.5812  accuracy: 11.19% -> 10.45%     
client [91] (testset)   loss: 6.9738 -> 6.8249  accuracy: 13.73% -> 13.07%     
client [57] (testset)   loss: 4.8188 -> 4.6700  accuracy: 8.76% -> 15.33%      
---------------------------- TRAINING EPOCH: 100 ----------------------------  
client [31] (testset)   loss: 5.3322 -> 5.8157  accuracy: 19.67% -> 18.85%     
client [15] (testset)   loss: 5.0087 -> 5.6312  accuracy: 17.78% -> 17.78%     
client [71] (testset)   loss: 4.6410 -> 16.9177 accuracy: 17.97% -> 13.28%     
client [97] (testset)   loss: 5.1731 -> 5.6709  accuracy: 22.78% -> 24.68%     
client [53] (testset)   loss: 5.0855 -> 5.3380  accuracy: 16.13% -> 16.77%     
client [77] (testset)   loss: 5.6261 -> 5.8005  accuracy: 11.89% -> 13.99%     
client [76] (testset)   loss: 6.0299 -> 6.4472  accuracy: 16.26% -> 14.63%     
client [79] (testset)   loss: 5.5249 -> 9.2944  accuracy: 22.14% -> 15.71%     
client [28] (testset)   loss: 5.6260 -> 6.2622  accuracy: 20.61% -> 23.03%     
client [99] (testset)   loss: 6.1661 -> 5.9929  accuracy: 14.94% -> 17.53%     
---------------------------- TRAINING EPOCH: 110 ----------------------------  
client [97] (testset)   loss: 5.7897 -> 6.1330  accuracy: 22.78% -> 21.52%     
client [86] (testset)   loss: 5.8067 -> 6.1234  accuracy: 22.44% -> 21.15%     
client [34] (testset)   loss: 5.6872 -> 6.2925  accuracy: 21.60% -> 20.00%     
client [73] (testset)   loss: 6.6919 -> 6.3903  accuracy: 18.75% -> 14.20%     
client [5]  (testset)   loss: 6.1350 -> 6.7282  accuracy: 15.17% -> 15.86%     
client [96] (testset)   loss: 5.8617 -> 6.7219  accuracy: 14.84% -> 15.48%     
client [22] (testset)   loss: 5.7369 -> 6.1411  accuracy: 11.49% -> 11.49%     
client [60] (testset)   loss: 6.7058 -> 6.7329  accuracy: 18.85% -> 18.85%     
client [66] (testset)   loss: 8.4339 -> 9.8769  accuracy: 8.77% -> 4.09%       
client [83] (testset)   loss: 5.8620 -> 6.6478  accuracy: 16.80% -> 13.60%     
---------------------------- TRAINING EPOCH: 120 ----------------------------  
client [76] (testset)   loss: 6.7945 -> 7.2059  accuracy: 13.82% -> 13.82%     
client [65] (testset)   loss: 5.7597 -> 5.9380  accuracy: 17.93% -> 20.00%     
client [95] (testset)   loss: 6.0415 -> 6.4822  accuracy: 18.07% -> 18.07%     
client [17] (testset)   loss: 4.8480 -> 5.3712  accuracy: 15.94% -> 14.49%     
client [8]  (testset)   loss: 6.4656 -> 7.3741  accuracy: 15.17% -> 8.97%      
client [35] (testset)   loss: 7.2286 -> 7.5603  accuracy: 15.24% -> 14.63%     
client [98] (testset)   loss: 6.6625 -> 7.1082  accuracy: 15.82% -> 16.38%     
client [53] (testset)   loss: 5.8181 -> 6.3510  accuracy: 16.13% -> 15.48%     
client [43] (testset)   loss: 6.4867 -> 7.0069  accuracy: 10.77% -> 11.54%     
client [64] (testset)   loss: 10.4132 -> 5.8630 accuracy: 12.57% -> 19.13%     
---------------------------- TRAINING EPOCH: 130 ----------------------------  
client [21] (testset)   loss: 6.0727 -> 11.7604 accuracy: 7.63% -> 6.78%       
client [88] (testset)   loss: 5.0620 -> 5.0354  accuracy: 20.31% -> 21.09%     
client [38] (testset)   loss: 5.1988 -> 5.5624  accuracy: 21.21% -> 25.25%     
client [3]  (testset)   loss: 6.5015 -> 6.8050  accuracy: 17.10% -> 17.62%     
client [5]  (testset)   loss: 6.3703 -> 5.5257  accuracy: 13.10% -> 14.48%     
client [41] (testset)   loss: 5.4870 -> 5.2551  accuracy: 16.84% -> 22.11%     
client [7]  (testset)   loss: 8.0786 -> 5.8695  accuracy: 10.07% -> 10.07%     
client [37] (testset)   loss: 5.7447 -> 5.4139  accuracy: 13.55% -> 13.55%     
client [45] (testset)   loss: 5.2238 -> 5.4953  accuracy: 20.34% -> 15.82%     
client [47] (testset)   loss: 5.5217 -> 5.2885  accuracy: 15.94% -> 14.49%     
---------------------------- TRAINING EPOCH: 140 ----------------------------  
client [16] (testset)   loss: 6.0666 -> 5.6341  accuracy: 20.81% -> 24.16%     
client [11] (testset)   loss: 5.5878 -> 5.3372  accuracy: 18.40% -> 20.00%     
client [37] (testset)   loss: 5.9686 -> 6.3416  accuracy: 14.84% -> 13.55%     
client [41] (testset)   loss: 5.2021 -> 5.7127  accuracy: 20.53% -> 22.63%     
client [95] (testset)   loss: 6.8029 -> 7.0636  accuracy: 17.47% -> 17.47%     
client [53] (testset)   loss: 6.2851 -> 6.5837  accuracy: 14.84% -> 13.55%     
client [22] (testset)   loss: 5.7583 -> 6.5677  accuracy: 14.19% -> 12.84%     
client [25] (testset)   loss: 5.9449 -> 6.3430  accuracy: 17.20% -> 20.97%     
client [69] (testset)   loss: 6.8652 -> 7.2391  accuracy: 17.89% -> 17.07%     
client [46] (testset)   loss: 6.6245 -> 7.2656  accuracy: 5.81% -> 8.14%       
---------------------------- TRAINING EPOCH: 150 ----------------------------  
client [47] (testset)   loss: 5.2536 -> 5.4558  accuracy: 13.04% -> 17.39%     
client [69] (testset)   loss: 7.1936 -> 7.3706  accuracy: 17.07% -> 17.07%     
client [82] (testset)   loss: 5.9987 -> 7.2618  accuracy: 10.45% -> 11.94%     
client [45] (testset)   loss: 5.8924 -> 6.2303  accuracy: 20.90% -> 22.60%     
client [7]  (testset)   loss: 5.9210 -> 6.5600  accuracy: 10.79% -> 10.79%     
client [50] (testset)   loss: 5.7367 -> 6.4276  accuracy: 17.95% -> 18.59%     
client [35] (testset)   loss: 7.8479 -> 8.0834  accuracy: 15.24% -> 15.85%     
client [24] (testset)   loss: 6.8860 -> 7.1532  accuracy: 12.50% -> 11.72%     
client [15] (testset)   loss: 6.6446 -> 7.2298  accuracy: 16.11% -> 15.56%     
client [58] (testset)   loss: 7.1790 -> 7.3945  accuracy: 16.13% -> 16.77%     
---------------------------- TRAINING EPOCH: 160 ----------------------------  
client [48] (testset)   loss: 6.6758 -> 6.8891  accuracy: 15.56% -> 14.07%     
client [76] (testset)   loss: 5.4440 -> 6.3444  accuracy: 18.70% -> 12.20%     
client [67] (testset)   loss: 6.1707 -> 6.5233  accuracy: 20.71% -> 19.53%     
client [37] (testset)   loss: 6.3966 -> 6.6738  accuracy: 14.19% -> 14.19%     
client [58] (testset)   loss: 7.2679 -> 7.5161  accuracy: 14.19% -> 16.77%     
client [64] (testset)   loss: 6.5343 -> 6.8761  accuracy: 20.22% -> 18.58%     
client [77] (testset)   loss: 6.3897 -> 6.7079  accuracy: 16.08% -> 15.38%     
client [55] (testset)   loss: 7.5795 -> 7.9232  accuracy: 14.66% -> 13.79%     
client [12] (testset)   loss: 7.2930 -> 7.9003  accuracy: 15.82% -> 13.92%     
client [89] (testset)   loss: 7.2270 -> 7.4573  accuracy: 13.57% -> 14.29%     
---------------------------- TRAINING EPOCH: 170 ----------------------------  
client [84] (testset)   loss: 7.2696 -> 7.4794  accuracy: 16.77% -> 17.37%     
client [51] (testset)   loss: 6.1548 -> 6.6701  accuracy: 18.75% -> 18.75%     
client [8]  (testset)   loss: 7.3974 -> 7.6922  accuracy: 15.17% -> 14.48%     
client [18] (testset)   loss: 5.7765 -> 6.0322  accuracy: 18.54% -> 20.79%     
client [94] (testset)   loss: 6.8715 -> 7.1208  accuracy: 11.71% -> 13.51%     
client [81] (testset)   loss: 6.4436 -> 6.6812  accuracy: 18.23% -> 17.19%     
client [3]  (testset)   loss: 5.9430 -> 6.4813  accuracy: 22.28% -> 21.24%     
client [11] (testset)   loss: 5.9055 -> 15.0327 accuracy: 14.40% -> 11.20%     
client [95] (testset)   loss: 6.4479 -> 6.6488  accuracy: 19.88% -> 19.28%     
client [67] (testset)   loss: 6.3719 -> 6.7517  accuracy: 18.93% -> 18.93%     
---------------------------- TRAINING EPOCH: 180 ----------------------------  
client [21] (testset)   loss: 6.1288 -> 7.1912  accuracy: 12.71% -> 11.86%     
client [79] (testset)   loss: 5.5557 -> 5.9777  accuracy: 22.14% -> 21.43%     
client [58] (testset)   loss: 7.3907 -> 7.5433  accuracy: 13.55% -> 16.77%     
client [88] (testset)   loss: 5.5565 -> 5.6083  accuracy: 19.53% -> 20.31%     
client [46] (testset)   loss: 7.2931 -> 7.7704  accuracy: 10.47% -> 11.05%     
client [11] (testset)   loss: 14.1916 -> 5.9619 accuracy: 12.00% -> 17.60%     
client [55] (testset)   loss: 6.7193 -> 7.1620  accuracy: 15.52% -> 16.38%     
client [13] (testset)   loss: 7.0624 -> 7.3970  accuracy: 8.15% -> 8.15%       
client [31] (testset)   loss: 6.3250 -> 6.5453  accuracy: 20.49% -> 20.49%     
client [75] (testset)   loss: 7.7590 -> 7.8758  accuracy: 11.43% -> 10.00%     
---------------------------- TRAINING EPOCH: 190 ----------------------------  
client [19] (testset)   loss: 7.7073 -> 7.8653  accuracy: 13.53% -> 14.29%     
client [7]  (testset)   loss: 6.3968 -> 6.8435  accuracy: 10.79% -> 10.79%     
client [57] (testset)   loss: 5.5748 -> 5.8917  accuracy: 18.25% -> 17.52%     
client [13] (testset)   loss: 7.3494 -> 7.4620  accuracy: 8.15% -> 7.41%       
client [43] (testset)   loss: 7.3824 -> 7.7520  accuracy: 12.31% -> 11.54%     
client [91] (testset)   loss: 7.5029 -> 7.7051  accuracy: 15.69% -> 15.03%     
client [10] (testset)   loss: 6.3351 -> 6.5821  accuracy: 21.47% -> 18.64%     
client [64] (testset)   loss: 7.1280 -> 7.2636  accuracy: 18.58% -> 19.13%     
client [82] (testset)   loss: 6.6322 -> 6.8786  accuracy: 11.19% -> 11.94%     
client [22] (testset)   loss: 7.0800 -> 7.2975  accuracy: 12.84% -> 13.51%     
---------------------------- TRAINING EPOCH: 200 ----------------------------  
client [20] (testset)   loss: 7.3583 -> 6.1248  accuracy: 14.71% -> 13.24%     
client [23] (testset)   loss: 5.8364 -> 6.9602  accuracy: 9.22% -> 8.51%       
client [88] (testset)   loss: 5.3602 -> 5.6841  accuracy: 19.53% -> 21.09%     
client [98] (testset)   loss: 7.3473 -> 7.4912  accuracy: 14.69% -> 14.12%     
client [79] (testset)   loss: 6.3417 -> 6.5273  accuracy: 20.71% -> 21.43%     
client [21] (testset)   loss: 6.7507 -> 6.4094  accuracy: 13.56% -> 13.56%     
client [92] (testset)   loss: 6.9401 -> 7.0737  accuracy: 16.89% -> 15.54%     
client [56] (testset)   loss: 8.0655 -> 8.3337  accuracy: 11.11% -> 11.11%     
client [5]  (testset)   loss: 6.5942 -> 6.7788  accuracy: 15.17% -> 14.48%     
client [52] (testset)   loss: 6.6147 -> 6.7667  accuracy: 19.35% -> 19.89%     
---------------------------- TRAINING EPOCH: 210 ----------------------------  
client [67] (testset)   loss: 6.3382 -> 6.6375  accuracy: 21.30% -> 21.30%     
client [54] (testset)   loss: 6.1647 -> 6.3928  accuracy: 15.28% -> 14.58%     
client [14] (testset)   loss: 6.9088 -> 7.0913  accuracy: 20.35% -> 19.77%     
client [99] (testset)   loss: 7.2191 -> 7.2917  accuracy: 13.64% -> 14.94%     
client [36] (testset)   loss: 6.3448 -> 6.8716  accuracy: 15.93% -> 15.93%     
client [30] (testset)   loss: 7.7209 -> 7.9452  accuracy: 19.02% -> 14.72%     
client [38] (testset)   loss: 5.5122 -> 5.8807  accuracy: 26.26% -> 27.78%     
client [15] (testset)   loss: 7.1661 -> 7.4465  accuracy: 17.78% -> 16.11%     
client [6]  (testset)   loss: 7.1401 -> 7.3025  accuracy: 11.02% -> 13.56%     
client [53] (testset)   loss: 5.4150 -> 5.9921  accuracy: 16.13% -> 16.77%     
---------------------------- TRAINING EPOCH: 220 ----------------------------  
client [99] (testset)   loss: 7.1914 -> 7.3955  accuracy: 15.58% -> 14.94%     
client [6]  (testset)   loss: 7.1599 -> 7.4937  accuracy: 12.71% -> 14.41%     
client [83] (testset)   loss: 5.8695 -> 6.1762  accuracy: 13.60% -> 15.20%     
client [42] (testset)   loss: 6.9826 -> 7.1485  accuracy: 18.84% -> 18.84%     
client [34] (testset)   loss: 5.4418 -> 6.2564  accuracy: 19.20% -> 18.40%     
client [15] (testset)   loss: 7.1788 -> 7.4788  accuracy: 17.22% -> 16.11%     
client [47] (testset)   loss: 5.9674 -> 6.1064  accuracy: 14.49% -> 14.49%     
client [55] (testset)   loss: 7.2022 -> 7.4748  accuracy: 15.52% -> 15.52%     
client [51] (testset)   loss: 6.6543 -> 6.9439  accuracy: 20.00% -> 19.38%     
client [95] (testset)   loss: 6.4641 -> 6.7117  accuracy: 18.07% -> 18.07%     
---------------------------- TRAINING EPOCH: 230 ----------------------------  
client [71] (testset)   loss: 5.7828 -> 6.2244  accuracy: 19.53% -> 19.53%     
client [15] (testset)   loss: 6.6879 -> 5.7488  accuracy: 14.44% -> 19.44%     
client [33] (testset)   loss: 6.6723 -> 5.7066  accuracy: 18.25% -> 21.43%     
client [99] (testset)   loss: 5.4659 -> 6.2506  accuracy: 13.64% -> 14.29%     
client [90] (testset)   loss: 5.6171 -> 4.8582  accuracy: 26.06% -> 27.88%     
client [57] (testset)   loss: 5.9476 -> 5.2529  accuracy: 16.06% -> 17.52%     
client [27] (testset)   loss: 6.8814 -> 5.2700  accuracy: 13.91% -> 20.00%     
client [78] (testset)   loss: 5.8106 -> 5.2908  accuracy: 19.42% -> 20.86%     
client [36] (testset)   loss: 6.9423 -> 7.1610  accuracy: 15.04% -> 15.04%     
client [88] (testset)   loss: 5.5622 -> 5.8083  accuracy: 21.09% -> 21.09%     
---------------------------- TRAINING EPOCH: 240 ----------------------------  
client [70] (testset)   loss: 6.8049 -> 7.1141  accuracy: 19.13% -> 18.03%     
client [35] (testset)   loss: 7.8943 -> 8.1644  accuracy: 15.24% -> 15.85%     
client [16] (testset)   loss: 6.4250 -> 6.6248  accuracy: 21.48% -> 19.46%     
client [80] (testset)   loss: 6.4783 -> 6.7720  accuracy: 21.62% -> 19.59%     
client [38] (testset)   loss: 5.9918 -> 6.2088  accuracy: 25.76% -> 26.77%     
client [78] (testset)   loss: 5.4381 -> 5.7022  accuracy: 20.14% -> 18.71%     
client [68] (testset)   loss: 6.3448 -> 6.6814  accuracy: 12.78% -> 13.53%     
client [11] (testset)   loss: 6.2621 -> 6.4873  accuracy: 14.40% -> 15.20%     
client [64] (testset)   loss: 7.2998 -> 7.4667  accuracy: 19.67% -> 18.58%     
client [82] (testset)   loss: 6.2870 -> 6.5634  accuracy: 12.69% -> 13.43%     
---------------------------- TRAINING EPOCH: 250 ----------------------------  
client [30] (testset)   loss: 6.8763 -> 7.1929  accuracy: 16.56% -> 17.79%     
client [27] (testset)   loss: 5.0948 -> 6.0277  accuracy: 20.00% -> 17.39%     
client [74] (testset)   loss: 6.1199 -> 5.4605  accuracy: 16.94% -> 17.74%     
client [45] (testset)   loss: 6.5327 -> 5.2936  accuracy: 21.47% -> 22.60%     
client [6]  (testset)   loss: 7.0811 -> 5.5146  accuracy: 13.56% -> 14.41%     
client [36] (testset)   loss: 6.9587 -> 6.3907  accuracy: 17.70% -> 15.04%     
client [63] (testset)   loss: 6.4094 -> 6.7897  accuracy: 22.41% -> 20.69%     
client [76] (testset)   loss: 7.7289 -> 7.8807  accuracy: 12.20% -> 14.63%     
client [83] (testset)   loss: 6.2235 -> 5.3587  accuracy: 14.40% -> 19.20%     
client [86] (testset)   loss: 6.6193 -> 6.9611  accuracy: 21.15% -> 21.15%     
---------------------------- TRAINING EPOCH: 260 ----------------------------  
client [83] (testset)   loss: 5.3706 -> 5.9269  accuracy: 18.40% -> 13.60%     
client [99] (testset)   loss: 6.4722 -> 6.8695  accuracy: 13.64% -> 14.29%     
client [74] (testset)   loss: 5.6575 -> 5.9892  accuracy: 17.74% -> 17.74%     
client [73] (testset)   loss: 7.5432 -> 7.8558  accuracy: 17.05% -> 16.48%     
client [29] (testset)   loss: 7.4880 -> 7.7130  accuracy: 19.14% -> 18.52%     
client [92] (testset)   loss: 5.9227 -> 6.3678  accuracy: 15.54% -> 15.54%     
client [6]  (testset)   loss: 6.1565 -> 6.6657  accuracy: 13.56% -> 13.56%     
client [61] (testset)   loss: 6.0164 -> 6.5895  accuracy: 18.08% -> 17.51%     
client [21] (testset)   loss: 7.0519 -> 7.2607  accuracy: 15.25% -> 15.25%     
client [67] (testset)   loss: 6.7443 -> 6.9247  accuracy: 20.12% -> 19.53%     
---------------------------- TRAINING EPOCH: 270 ----------------------------  
client [83] (testset)   loss: 5.6828 -> 6.0722  accuracy: 14.40% -> 15.20%     
client [32] (testset)   loss: 6.0972 -> 6.3246  accuracy: 22.83% -> 24.41%     
client [95] (testset)   loss: 6.7787 -> 7.0247  accuracy: 17.47% -> 17.47%     
client [61] (testset)   loss: 6.8309 -> 6.4623  accuracy: 16.38% -> 14.12%     
client [27] (testset)   loss: 5.8453 -> 6.2551  accuracy: 15.65% -> 19.13%     
client [25] (testset)   loss: 6.7523 -> 6.2844  accuracy: 18.82% -> 22.04%     
client [68] (testset)   loss: 5.0058 -> 5.7471  accuracy: 18.80% -> 20.30%     
client [34] (testset)   loss: 6.2982 -> 6.6849  accuracy: 18.40% -> 17.60%     
client [71] (testset)   loss: 6.1465 -> 6.4601  accuracy: 17.97% -> 17.19%     
client [89] (testset)   loss: 6.7291 -> 6.2401  accuracy: 17.14% -> 15.71%     
---------------------------- TRAINING EPOCH: 280 ----------------------------  
client [78] (testset)   loss: 5.1593 -> 5.4595  accuracy: 19.42% -> 18.71%     
client [81] (testset)   loss: 6.1099 -> 6.3428  accuracy: 18.23% -> 15.62%     
client [51] (testset)   loss: 6.4522 -> 6.7636  accuracy: 18.75% -> 20.00%     
client [54] (testset)   loss: 6.6503 -> 6.8311  accuracy: 15.28% -> 15.97%     
client [65] (testset)   loss: 6.7932 -> 6.9565  accuracy: 18.62% -> 20.00%     
client [41] (testset)   loss: 5.6407 -> 5.9322  accuracy: 20.00% -> 20.53%     
client [11] (testset)   loss: 6.3376 -> 6.5522  accuracy: 13.60% -> 16.00%     
client [85] (testset)   loss: 7.6879 -> 8.0246  accuracy: 16.15% -> 14.29%     
client [12] (testset)   loss: 8.0266 -> 8.2644  accuracy: 8.86% -> 11.39%      
client [23] (testset)   loss: 7.2746 -> 7.7321  accuracy: 9.93% -> 9.93%       
---------------------------- TRAINING EPOCH: 290 ----------------------------  
client [16] (testset)   loss: 6.2134 -> 5.8058  accuracy: 23.49% -> 21.48%     
client [65] (testset)   loss: 6.6512 -> 6.9488  accuracy: 22.76% -> 20.00%     
client [53] (testset)   loss: 6.6928 -> 6.8667  accuracy: 14.84% -> 15.48%     
client [58] (testset)   loss: 6.8269 -> 7.3503  accuracy: 18.06% -> 18.06%     
client [72] (testset)   loss: 6.0804 -> 6.3957  accuracy: 14.19% -> 15.48%     
client [7]  (testset)   loss: 6.3457 -> 6.2530  accuracy: 6.47% -> 12.23%      
client [71] (testset)   loss: 5.8418 -> 6.2583  accuracy: 17.19% -> 18.75%     
client [59] (testset)   loss: 5.7064 -> 5.5523  accuracy: 19.63% -> 18.40%     
client [86] (testset)   loss: 6.1827 -> 6.5416  accuracy: 21.15% -> 19.23%     
client [39] (testset)   loss: 6.8373 -> 6.9214  accuracy: 16.06% -> 15.33%     
---------------------------- TRAINING EPOCH: 300 ----------------------------  
client [99] (testset)   loss: 6.6727 -> 6.9747  accuracy: 14.94% -> 17.53%     
client [7]  (testset)   loss: 6.1855 -> 6.6364  accuracy: 10.07% -> 10.07%     
client [17] (testset)   loss: 5.5890 -> 6.0700  accuracy: 13.77% -> 15.22%     
client [64] (testset)   loss: 6.3655 -> 6.6435  accuracy: 21.31% -> 21.31%     
client [37] (testset)   loss: 6.4513 -> 6.6619  accuracy: 13.55% -> 16.77%     
client [29] (testset)   loss: 6.2428 -> 6.7390  accuracy: 16.05% -> 16.67%     
client [93] (testset)   loss: 7.2280 -> 7.6034  accuracy: 17.39% -> 13.77%     
client [73] (testset)   loss: 7.5254 -> 7.7764  accuracy: 15.34% -> 15.91%     
client [40] (testset)   loss: 5.8780 -> 6.0471  accuracy: 22.02% -> 20.83%     
client [76] (testset)   loss: 6.5634 -> 7.0788  accuracy: 13.01% -> 13.01%     
---------------------------- TRAINING EPOCH: 310 ----------------------------  
client [31] (testset)   loss: 5.5919 -> 5.6999  accuracy: 23.77% -> 22.95%     
client [89] (testset)   loss: 6.8436 -> 7.0654  accuracy: 14.29% -> 14.29%     
client [77] (testset)   loss: 6.4645 -> 6.6435  accuracy: 13.99% -> 13.99%     
client [90] (testset)   loss: 5.4244 -> 5.6758  accuracy: 27.88% -> 27.27%     
client [26] (testset)   loss: 6.2044 -> 6.4700  accuracy: 18.49% -> 18.49%     
client [50] (testset)   loss: 6.2340 -> 6.6337  accuracy: 16.67% -> 17.31%     
client [30] (testset)   loss: 6.0915 -> 6.6015  accuracy: 19.63% -> 18.40%     
client [70] (testset)   loss: 7.6529 -> 7.7771  accuracy: 16.39% -> 16.94%     
client [41] (testset)   loss: 6.0496 -> 6.2232  accuracy: 21.05% -> 21.05%     
client [99] (testset)   loss: 6.8393 -> 7.1515  accuracy: 17.53% -> 16.88%     
---------------------------- TRAINING EPOCH: 320 ----------------------------  
client [68] (testset)   loss: 6.3685 -> 6.5796  accuracy: 18.05% -> 17.29%     
client [70] (testset)   loss: 6.8835 -> 7.2044  accuracy: 16.39% -> 15.85%     
client [52] (testset)   loss: 6.1468 -> 6.4057  accuracy: 19.35% -> 19.89%     
client [1]  (testset)   loss: 6.1804 -> 6.3677  accuracy: 18.25% -> 17.52%     
client [2]  (testset)   loss: 6.1663 -> 6.5235  accuracy: 15.64% -> 16.20%     
client [67] (testset)   loss: 5.9635 -> 6.3201  accuracy: 20.12% -> 21.30%     
client [92] (testset)   loss: 6.0621 -> 6.3833  accuracy: 15.54% -> 15.54%     
client [35] (testset)   loss: 7.4935 -> 7.7691  accuracy: 14.63% -> 14.63%     
client [36] (testset)   loss: 6.7233 -> 6.9240  accuracy: 18.58% -> 18.58%     
client [64] (testset)   loss: 6.5846 -> 6.8393  accuracy: 19.67% -> 20.22%     
---------------------------- TRAINING EPOCH: 330 ----------------------------  
client [44] (testset)   loss: 5.3531 -> 5.7552  accuracy: 22.15% -> 22.82%     
client [6]  (testset)   loss: 7.0442 -> 7.1325  accuracy: 13.56% -> 14.41%     
client [12] (testset)   loss: 7.4515 -> 7.8273  accuracy: 9.49% -> 12.66%      
client [55] (testset)   loss: 6.8262 -> 7.1749  accuracy: 18.10% -> 18.10%     
client [29] (testset)   loss: 6.9802 -> 7.2850  accuracy: 16.67% -> 17.90%     
client [9]  (testset)   loss: 7.1009 -> 7.3155  accuracy: 14.58% -> 13.89%     
client [43] (testset)   loss: 7.4434 -> 7.7364  accuracy: 13.85% -> 13.08%     
client [77] (testset)   loss: 6.6239 -> 6.7631  accuracy: 14.69% -> 13.99%     
client [98] (testset)   loss: 7.0680 -> 7.2918  accuracy: 16.38% -> 14.69%     
client [78] (testset)   loss: 5.6958 -> 5.8965  accuracy: 20.86% -> 21.58%     
---------------------------- TRAINING EPOCH: 340 ----------------------------  
client [92] (testset)   loss: 5.9989 -> 6.3131  accuracy: 12.16% -> 14.19%     
client [80] (testset)   loss: 6.7809 -> 7.0276  accuracy: 21.62% -> 22.30%     
client [63] (testset)   loss: 6.9140 -> 7.1217  accuracy: 20.11% -> 20.11%     
client [76] (testset)   loss: 7.2334 -> 7.5104  accuracy: 13.82% -> 13.82%     
client [78] (testset)   loss: 5.7226 -> 5.9679  accuracy: 20.14% -> 19.42%     
client [25] (testset)   loss: 6.8396 -> 7.0521  accuracy: 23.12% -> 22.04%     
client [58] (testset)   loss: 6.5580 -> 6.9150  accuracy: 16.77% -> 15.48%     
client [13] (testset)   loss: 6.9525 -> 6.3397  accuracy: 9.63% -> 11.85%      
client [17] (testset)   loss: 6.0333 -> 5.7611  accuracy: 15.22% -> 15.94%     
client [38] (testset)   loss: 6.1511 -> 6.2684  accuracy: 26.77% -> 27.27%     
---------------------------- TRAINING EPOCH: 350 ----------------------------  
client [72] (testset)   loss: 5.7120 -> 6.2165  accuracy: 15.48% -> 15.48%     
client [82] (testset)   loss: 6.7713 -> 6.8684  accuracy: 11.94% -> 12.69%     
client [86] (testset)   loss: 6.6126 -> 6.7961  accuracy: 23.08% -> 23.08%     
client [51] (testset)   loss: 6.2897 -> 6.6136  accuracy: 18.12% -> 20.00%     
client [96] (testset)   loss: 6.7949 -> 6.0749  accuracy: 18.06% -> 14.84%     
client [42] (testset)   loss: 5.9323 -> 6.2576  accuracy: 23.19% -> 22.46%     
client [55] (testset)   loss: 7.0277 -> 7.3192  accuracy: 15.52% -> 15.52%     
client [13] (testset)   loss: 6.5105 -> 6.9060  accuracy: 11.11% -> 10.37%     
client [1]  (testset)   loss: 6.1881 -> 6.3085  accuracy: 18.25% -> 18.98%     
client [12] (testset)   loss: 7.6298 -> 7.9674  accuracy: 12.03% -> 11.39%     
---------------------------- TRAINING EPOCH: 360 ----------------------------  
client [68] (testset)   loss: 5.6977 -> 6.0699  accuracy: 20.30% -> 18.05%     
client [23] (testset)   loss: 6.3037 -> 6.8084  accuracy: 11.35% -> 12.06%     
client [46] (testset)   loss: 7.6573 -> 7.9465  accuracy: 10.47% -> 11.63%     
client [41] (testset)   loss: 5.9796 -> 6.1686  accuracy: 21.05% -> 21.58%     
client [25] (testset)   loss: 7.2974 -> 7.4545  accuracy: 22.04% -> 23.12%     
client [58] (testset)   loss: 6.4131 -> 6.8196  accuracy: 16.13% -> 17.42%     
client [14] (testset)   loss: 5.8761 -> 6.1743  accuracy: 19.77% -> 10.47%     
client [33] (testset)   loss: 5.5883 -> 5.8666  accuracy: 18.25% -> 21.43%     
client [85] (testset)   loss: 7.5320 -> 7.8219  accuracy: 14.91% -> 14.29%     
client [62] (testset)   loss: 6.4935 -> 6.6331  accuracy: 16.57% -> 17.16%     
---------------------------- TRAINING EPOCH: 370 ----------------------------  
client [98] (testset)   loss: 7.0192 -> 7.1894  accuracy: 16.38% -> 14.69%     
client [63] (testset)   loss: 7.0601 -> 7.1636  accuracy: 20.69% -> 19.54%     
client [70] (testset)   loss: 6.7691 -> 7.1240  accuracy: 16.39% -> 16.94%     
client [65] (testset)   loss: 7.2195 -> 4.8821  accuracy: 17.93% -> 17.24%     
client [14] (testset)   loss: 5.1296 -> 5.6560  accuracy: 20.93% -> 20.35%     
client [73] (testset)   loss: 6.1521 -> 7.0938  accuracy: 14.20% -> 18.75%     
client [34] (testset)   loss: 6.2472 -> 6.4568  accuracy: 21.60% -> 23.20%     
client [99] (testset)   loss: 6.5102 -> 6.8748  accuracy: 16.23% -> 15.58%     
client [69] (testset)   loss: 6.4701 -> 6.7329  accuracy: 15.45% -> 14.63%     
client [46] (testset)   loss: 7.5752 -> 6.5773  accuracy: 11.63% -> 11.63%     
---------------------------- TRAINING EPOCH: 380 ----------------------------  
client [99] (testset)   loss: 6.5821 -> 6.9279  accuracy: 15.58% -> 15.58%     
client [93] (testset)   loss: 6.6146 -> 6.9319  accuracy: 16.67% -> 18.12%     
client [11] (testset)   loss: 5.7329 -> 5.9333  accuracy: 14.40% -> 16.00%     
client [58] (testset)   loss: 6.9630 -> 7.1434  accuracy: 17.42% -> 19.35%     
client [81] (testset)   loss: 6.2183 -> 6.3799  accuracy: 14.58% -> 17.19%     
client [85] (testset)   loss: 7.6420 -> 7.8871  accuracy: 14.29% -> 13.66%     
client [89] (testset)   loss: 7.3690 -> 6.4156  accuracy: 16.43% -> 15.71%     
client [45] (testset)   loss: 5.9674 -> 6.1697  accuracy: 22.03% -> 19.77%     
client [8]  (testset)   loss: 7.0316 -> 7.3357  accuracy: 13.79% -> 13.79%     
client [68] (testset)   loss: 5.7962 -> 6.0394  accuracy: 15.04% -> 15.79%     
---------------------------- TRAINING EPOCH: 390 ----------------------------  
client [67] (testset)   loss: 5.6077 -> 6.2213  accuracy: 21.30% -> 21.30%     
client [72] (testset)   loss: 6.2863 -> 6.4917  accuracy: 18.06% -> 16.77%     
client [1]  (testset)   loss: 6.2644 -> 6.4134  accuracy: 17.52% -> 17.52%     
client [78] (testset)   loss: 4.6438 -> 5.2959  accuracy: 22.30% -> 21.58%     
client [83] (testset)   loss: 5.2910 -> 5.8638  accuracy: 13.60% -> 15.20%     
client [21] (testset)   loss: 6.8289 -> 7.1447  accuracy: 16.10% -> 16.10%     
client [56] (testset)   loss: 6.7820 -> 7.4896  accuracy: 12.70% -> 11.90%     
client [44] (testset)   loss: 5.7744 -> 5.9847  accuracy: 20.13% -> 20.81%     
client [92] (testset)   loss: 6.1344 -> 5.5801  accuracy: 14.19% -> 16.22%     
client [27] (testset)   loss: 5.5341 -> 6.0036  accuracy: 20.87% -> 18.26%     
---------------------------- TRAINING EPOCH: 400 ----------------------------  
client [10] (testset)   loss: 5.5992 -> 5.9509  accuracy: 19.77% -> 18.08%     
client [39] (testset)   loss: 6.9614 -> 7.1704  accuracy: 14.60% -> 16.79%     
client [65] (testset)   loss: 6.0569 -> 6.4046  accuracy: 15.17% -> 16.55%     
client [26] (testset)   loss: 5.9732 -> 5.9162  accuracy: 17.81% -> 19.86%     
client [19] (testset)   loss: 5.4616 -> 6.0843  accuracy: 11.28% -> 13.53%     
client [68] (testset)   loss: 5.9199 -> 6.0683  accuracy: 17.29% -> 15.79%     
client [41] (testset)   loss: 6.0539 -> 6.1959  accuracy: 23.16% -> 21.58%     
client [50] (testset)   loss: 6.5109 -> 6.7415  accuracy: 17.31% -> 17.31%     
client [75] (testset)   loss: 7.1074 -> 7.4140  accuracy: 9.29% -> 8.57%       
client [81] (testset)   loss: 5.5641 -> 5.8405  accuracy: 16.67% -> 17.19%     
Training... ---------------------------------------- 100% 0:44:29
FedDpa's average time taken by each global epoch: 0 min 6.25 sec.              
FedDpa's total running time: 0 h 44 m 29 s.                                    
==================== FedDpa Experiment Results: ====================           
Display format: (before local fine-tuning) -> (after local fine-tuning)        
 So if finetune_epoch = 0, x.xx% -> 0.00% is normal.                           
 Centralized testing ONLY happens after model aggregation, so the stats between
'->' are the same.                                                             
{                                                                              
    "100": {                                                                   
        "all_clients": {                                                       
            "test": {                                                          
                "loss": "5.8376 -> 0.0000",                                    
                "accuracy": "15.76% -> 0.00%"                                  
            }                                                                  
        }                                                                      
    },                                                                         
    "200": {                                                                   
        "all_clients": {                                                       
            "test": {                                                          
                "loss": "6.5952 -> 0.0000",                                    
                "accuracy": "16.72% -> 0.00%"                                  
            }                                                                  
        }                                                                      
    },                                                                         
    "300": {                                                                   
        "all_clients": {                                                       
            "test": {                                                          
                "loss": "6.3893 -> 0.0000",                                    
                "accuracy": "17.04% -> 0.00%"                                  
            }                                                                  
        }                                                                      
    },                                                                         
    "400": {                                                                   
        "all_clients": {                                                       
            "test": {                                                          
                "loss": "6.3827 -> 0.0000",                                    
                "accuracy": "17.52% -> 0.00%"                                  
            }                                                                  
        }                                                                      
    }                                                                          
}                                                                              
==================== FedDpa Max Accuracy ====================                  
all_clients:                                                                   
(test) before fine-tuning: 17.52% at epoch 400                                 
(test) after fine-tuning: 0.00% at epoch 100                                   
[0m