out\fedobp\emnist\Main_GlobalNorm_EMAscore(0.5)_ALL_IG_0.995
==================== FedOBP ====================                               
Experiment Arguments:                                                          
{
│   'method': 'fedobp',
│   'dataset': {
│   │   'name': 'emnist',
│   │   'client_num': 100,
│   │   'test_ratio': 0.25,
│   │   'val_ratio': 0.0,
│   │   'seed': 42,
│   │   'split': 'sample',
│   │   'IID_ratio': 0.0,
│   │   'monitor_window_name_suffix': 'emnist-100clients-0%IID-Dir(0.5)-seed42',
│   │   'emnist_split': 'byclass',
│   │   'alpha': 0.5,
│   │   'min_samples_per_client': 10
│   },
│   'model': {
│   │   'name': 'avgcnn',
│   │   'use_torchvision_pretrained_weights': True,
│   │   'external_model_weights_path': None
│   },
│   'optimizer': {
│   │   'lr': 0.01,
│   │   'dampening': 0,
│   │   'weight_decay': 0,
│   │   'momentum': 0,
│   │   'nesterov': False,
│   │   'name': 'sgd'
│   },
│   'mode': 'serial',
│   'parallel': {
│   │   'ray_cluster_addr': None,
│   │   'num_cpus': None,
│   │   'num_gpus': None,
│   │   'num_workers': 2
│   },
│   'common': {
│   │   'seed': 42,
│   │   'join_ratio': 0.1,
│   │   'global_epoch': 400,
│   │   'local_epoch': 5,
│   │   'batch_size': 32,
│   │   'reset_optimizer_on_global_epoch': True,
│   │   'straggler_ratio': 0,
│   │   'straggler_min_local_epoch': 0,
│   │   'buffers': 'global',
│   │   'client_side_evaluation': True,
│   │   'test': {
│   │   │   'client': {
│   │   │   │   'interval': 100,
│   │   │   │   'finetune_epoch': 0,
│   │   │   │   'train': False,
│   │   │   │   'val': False,
│   │   │   │   'test': True
│   │   │   },
│   │   │   'server': {
│   │   │   │   'interval': -1,
│   │   │   │   'train': False,
│   │   │   │   'val': False,
│   │   │   │   'test': False,
│   │   │   │   'model_in_train_mode': False
│   │   │   }
│   │   },
│   │   'verbose_gap': 10,
│   │   'monitor': None,
│   │   'use_cuda': True,
│   │   'save_log': True,
│   │   'save_model': False,
│   │   'save_learning_curve_plot': False,
│   │   'save_metrics': True,
│   │   'delete_useless_run': True
│   },
│   'fedobp': {
│   │   'ig_ratio': 0.995,
│   │   'alpha': 0.5,
│   │   'norm': 'global',
│   │   'EMA': True,
│   │   'CLS': False,
│   │   'track': False,
│   │   'type': 'Main'
│   }
}
---------------------------- TRAINING EPOCH: 10 ----------------------------   
client [77] (testset)   loss: 0.5489 -> 0.5101  accuracy: 81.73% -> 82.16%     
client [81] (testset)   loss: 0.4982 -> 0.7946  accuracy: 83.84% -> 76.46%     
client [21] (testset)   loss: 0.6967 -> 0.3063  accuracy: 86.02% -> 90.93%     
client [68] (testset)   loss: 0.3099 -> 0.3065  accuracy: 88.93% -> 88.87%     
client [93] (testset)   loss: 0.4677 -> 0.3997  accuracy: 88.75% -> 90.39%     
client [31] (testset)   loss: 0.5009 -> 0.3847  accuracy: 83.95% -> 86.86%     
client [20] (testset)   loss: 0.4132 -> 0.3934  accuracy: 88.21% -> 89.21%     
client [59] (testset)   loss: 0.8827 -> 0.4889  accuracy: 77.70% -> 81.84%     
client [48] (testset)   loss: 0.4882 -> 0.4058  accuracy: 84.58% -> 86.16%     
client [34] (testset)   loss: 0.4198 -> 0.3952  accuracy: 88.20% -> 88.76%     
---------------------------- TRAINING EPOCH: 20 ----------------------------   
client [69] (testset)   loss: 0.3291 -> 1.0527  accuracy: 89.38% -> 78.08%     
client [99] (testset)   loss: 0.4060 -> 0.3605  accuracy: 85.61% -> 89.01%     
client [67] (testset)   loss: 0.3719 -> 0.3160  accuracy: 86.40% -> 88.53%     
client [0]  (testset)   loss: 0.2776 -> 0.2557  accuracy: 92.42% -> 93.20%     
client [76] (testset)   loss: 0.4891 -> 0.5118  accuracy: 83.43% -> 83.09%     
client [41] (testset)   loss: 0.6349 -> 0.5676  accuracy: 77.39% -> 80.80%     
client [62] (testset)   loss: 0.7466 -> 0.4159  accuracy: 81.87% -> 87.27%     
client [2]  (testset)   loss: 0.5453 -> 0.2718  accuracy: 87.23% -> 90.32%     
client [14] (testset)   loss: 0.3237 -> 0.3021  accuracy: 90.93% -> 91.12%     
client [46] (testset)   loss: 0.2903 -> 0.3253  accuracy: 91.18% -> 89.86%     
---------------------------- TRAINING EPOCH: 30 ----------------------------   
client [24] (testset)   loss: 0.2906 -> 0.2910  accuracy: 90.43% -> 91.74%     
client [68] (testset)   loss: 0.2437 -> 0.3004  accuracy: 91.19% -> 89.35%     
client [57] (testset)   loss: 0.4436 -> 0.5935  accuracy: 84.63% -> 76.87%     
client [17] (testset)   loss: 0.2556 -> 0.2508  accuracy: 90.84% -> 91.91%     
client [54] (testset)   loss: 0.2698 -> 0.2870  accuracy: 90.65% -> 90.15%     
client [23] (testset)   loss: 0.7915 -> 0.4450  accuracy: 77.93% -> 83.29%     
client [35] (testset)   loss: 0.4644 -> 0.4649  accuracy: 84.10% -> 84.82%     
client [59] (testset)   loss: 0.4244 -> 0.4599  accuracy: 84.36% -> 83.77%     
client [31] (testset)   loss: 0.3181 -> 0.3633  accuracy: 88.42% -> 87.32%     
client [9]  (testset)   loss: 0.5861 -> 0.5600  accuracy: 80.48% -> 80.22%     
---------------------------- TRAINING EPOCH: 40 ----------------------------   
client [64] (testset)   loss: 0.4063 -> 0.3995  accuracy: 85.91% -> 85.69%     
client [33] (testset)   loss: 0.4071 -> 0.4140  accuracy: 84.37% -> 83.98%     
client [16] (testset)   loss: 0.2882 -> 0.3077  accuracy: 90.30% -> 91.24%     
client [44] (testset)   loss: 0.5142 -> 0.4896  accuracy: 79.32% -> 81.92%     
client [8]  (testset)   loss: 0.3038 -> 0.3088  accuracy: 90.64% -> 91.09%     
client [31] (testset)   loss: 0.3245 -> 0.3286  accuracy: 89.03% -> 88.98%     
client [47] (testset)   loss: 0.4405 -> 0.4562  accuracy: 85.28% -> 84.19%     
client [36] (testset)   loss: 0.4030 -> 0.3491  accuracy: 86.03% -> 87.83%     
client [20] (testset)   loss: 0.3332 -> 0.3417  accuracy: 90.27% -> 90.27%     
client [56] (testset)   loss: 0.3735 -> 0.3926  accuracy: 87.69% -> 86.93%     
---------------------------- TRAINING EPOCH: 50 ----------------------------   
client [4]  (testset)   loss: 0.2672 -> 0.3291  accuracy: 90.69% -> 89.60%     
client [60] (testset)   loss: 0.2541 -> 0.2264  accuracy: 92.69% -> 93.43%     
client [28] (testset)   loss: 0.3431 -> 0.3585  accuracy: 88.91% -> 88.28%     
client [25] (testset)   loss: 0.1810 -> 0.1985  accuracy: 95.15% -> 94.98%     
client [58] (testset)   loss: 0.2357 -> 0.2453  accuracy: 91.72% -> 91.68%     
client [44] (testset)   loss: 0.4821 -> 0.5038  accuracy: 81.03% -> 82.19%     
client [39] (testset)   loss: 0.3877 -> 0.4313  accuracy: 85.75% -> 84.79%     
client [29] (testset)   loss: 0.4775 -> 0.5208  accuracy: 82.79% -> 81.76%     
client [3]  (testset)   loss: 0.2530 -> 0.2322  accuracy: 92.32% -> 92.89%     
client [84] (testset)   loss: 0.2691 -> 0.3106  accuracy: 92.20% -> 90.70%     
---------------------------- TRAINING EPOCH: 60 ----------------------------   
client [21] (testset)   loss: 0.2868 -> 0.2768  accuracy: 92.10% -> 91.99%     
client [84] (testset)   loss: 0.2766 -> 0.3133  accuracy: 91.61% -> 90.49%     
client [10] (testset)   loss: 0.3059 -> 0.3212  accuracy: 90.12% -> 90.38%     
client [36] (testset)   loss: 0.3351 -> 0.3704  accuracy: 88.18% -> 87.48%     
client [65] (testset)   loss: 0.4163 -> 0.4440  accuracy: 86.64% -> 85.96%     
client [81] (testset)   loss: 0.3965 -> 0.4510  accuracy: 86.57% -> 85.74%     
client [79] (testset)   loss: 0.1866 -> 0.1896  accuracy: 94.54% -> 95.05%     
client [42] (testset)   loss: 0.2383 -> 0.2615  accuracy: 92.13% -> 92.27%     
client [11] (testset)   loss: 0.2279 -> 0.2316  accuracy: 94.03% -> 93.81%     
client [96] (testset)   loss: 0.3316 -> 0.3707  accuracy: 90.04% -> 89.47%     
---------------------------- TRAINING EPOCH: 70 ----------------------------   
client [8]  (testset)   loss: 0.3234 -> 0.3049  accuracy: 90.19% -> 91.24%     
client [53] (testset)   loss: 0.3035 -> 0.3644  accuracy: 89.24% -> 87.77%     
client [52] (testset)   loss: 0.4207 -> 0.4566  accuracy: 86.27% -> 85.95%     
client [42] (testset)   loss: 0.2531 -> 0.2594  accuracy: 92.04% -> 92.40%     
client [69] (testset)   loss: 0.2980 -> 0.2783  accuracy: 89.99% -> 92.55%     
client [59] (testset)   loss: 0.4042 -> 0.4565  accuracy: 84.69% -> 82.48%     
client [7]  (testset)   loss: 0.2883 -> 0.3337  accuracy: 88.72% -> 87.98%     
client [26] (testset)   loss: 0.3153 -> 0.5075  accuracy: 88.81% -> 87.30%     
client [49] (testset)   loss: 0.2378 -> 0.2723  accuracy: 92.76% -> 92.63%     
client [98] (testset)   loss: 0.2315 -> 0.3025  accuracy: 93.41% -> 90.77%     
---------------------------- TRAINING EPOCH: 80 ----------------------------   
client [98] (testset)   loss: 0.2472 -> 0.2943  accuracy: 92.81% -> 91.13%     
client [47] (testset)   loss: 0.4439 -> 0.4836  accuracy: 84.49% -> 83.94%     
client [21] (testset)   loss: 0.2593 -> 0.2919  accuracy: 91.95% -> 92.44%     
client [77] (testset)   loss: 0.4233 -> 0.4593  accuracy: 85.41% -> 84.92%     
client [95] (testset)   loss: 0.2301 -> 0.3045  accuracy: 93.09% -> 92.42%     
client [91] (testset)   loss: 0.4051 -> 0.4111  accuracy: 86.59% -> 87.39%     
client [14] (testset)   loss: 0.2727 -> 0.2846  accuracy: 91.93% -> 91.69%     
client [99] (testset)   loss: 0.2280 -> 0.2554  accuracy: 92.64% -> 92.36%     
client [20] (testset)   loss: 0.3441 -> 0.3501  accuracy: 89.80% -> 90.51%     
client [39] (testset)   loss: 0.3904 -> 0.4344  accuracy: 85.53% -> 85.27%     
---------------------------- TRAINING EPOCH: 90 ----------------------------   
client [52] (testset)   loss: 0.4237 -> 0.4648  accuracy: 85.53% -> 85.81%     
client [62] (testset)   loss: 0.3729 -> 0.4225  accuracy: 89.35% -> 88.81%     
client [71] (testset)   loss: 0.4832 -> 0.5315  accuracy: 83.53% -> 82.96%     
client [97] (testset)   loss: 0.2352 -> 0.2354  accuracy: 92.67% -> 93.35%     
client [30] (testset)   loss: 0.3028 -> 0.3405  accuracy: 90.19% -> 90.83%     
client [88] (testset)   loss: 0.3008 -> 0.3027  accuracy: 87.97% -> 88.16%     
client [60] (testset)   loss: 0.2326 -> 0.2356  accuracy: 93.43% -> 93.59%     
client [82] (testset)   loss: 0.3783 -> 0.4207  accuracy: 86.91% -> 87.08%     
client [91] (testset)   loss: 0.4011 -> 0.4078  accuracy: 87.09% -> 88.24%     
client [57] (testset)   loss: 0.4246 -> 0.5854  accuracy: 86.04% -> 81.99%     
---------------------------- TRAINING EPOCH: 100 ----------------------------  
client [31] (testset)   loss: 0.3584 -> 0.3801  accuracy: 88.68% -> 88.42%     
client [15] (testset)   loss: 0.4226 -> 0.5162  accuracy: 85.67% -> 83.51%     
client [71] (testset)   loss: 0.5117 -> 0.5521  accuracy: 83.44% -> 83.53%     
client [97] (testset)   loss: 0.2224 -> 0.2498  accuracy: 93.27% -> 93.51%     
client [53] (testset)   loss: 0.3336 -> 0.3790  accuracy: 89.48% -> 88.53%     
client [77] (testset)   loss: 0.4348 -> 0.4456  accuracy: 85.35% -> 84.81%     
client [76] (testset)   loss: 0.4693 -> 0.5244  accuracy: 83.92% -> 84.69%     
client [79] (testset)   loss: 0.1910 -> 0.1836  accuracy: 94.10% -> 95.41%     
client [28] (testset)   loss: 0.3566 -> 0.4012  accuracy: 88.57% -> 88.10%     
client [99] (testset)   loss: 0.2912 -> 0.2626  accuracy: 89.07% -> 92.41%     
---------------------------- TRAINING EPOCH: 110 ----------------------------  
client [97] (testset)   loss: 0.2328 -> 0.2869  accuracy: 92.91% -> 92.19%     
client [86] (testset)   loss: 0.2650 -> 0.2964  accuracy: 92.53% -> 92.43%     
client [34] (testset)   loss: 0.3559 -> 0.3888  accuracy: 89.73% -> 89.78%     
client [73] (testset)   loss: 0.4545 -> 0.5005  accuracy: 84.72% -> 84.67%     
client [5]  (testset)   loss: 0.3558 -> 0.4141  accuracy: 89.44% -> 89.36%     
client [96] (testset)   loss: 0.3669 -> 0.4108  accuracy: 89.85% -> 88.70%     
client [22] (testset)   loss: 0.4985 -> 0.5679  accuracy: 84.17% -> 82.64%     
client [60] (testset)   loss: 0.2585 -> 0.2490  accuracy: 92.69% -> 93.75%     
client [66] (testset)   loss: 0.2515 -> 0.2728  accuracy: 93.55% -> 92.67%     
client [83] (testset)   loss: 0.3215 -> 0.3384  accuracy: 90.43% -> 90.85%     
---------------------------- TRAINING EPOCH: 120 ----------------------------  
client [76] (testset)   loss: 0.4792 -> 0.5267  accuracy: 84.09% -> 84.47%     
client [65] (testset)   loss: 0.4302 -> 0.4579  accuracy: 87.85% -> 85.36%     
client [95] (testset)   loss: 0.2647 -> 0.2945  accuracy: 93.41% -> 92.66%     
client [17] (testset)   loss: 0.2643 -> 0.2843  accuracy: 91.87% -> 91.99%     
client [8]  (testset)   loss: 0.2968 -> 0.3167  accuracy: 91.69% -> 91.99%     
client [35] (testset)   loss: 0.4946 -> 0.5397  accuracy: 84.63% -> 83.84%     
client [98] (testset)   loss: 0.2756 -> 0.3005  accuracy: 92.01% -> 92.21%     
client [53] (testset)   loss: 0.3532 -> 0.3990  accuracy: 89.36% -> 87.71%     
client [43] (testset)   loss: 0.3047 -> 0.2984  accuracy: 90.40% -> 91.44%     
client [64] (testset)   loss: 0.4087 -> 0.4388  accuracy: 85.42% -> 87.14%     
---------------------------- TRAINING EPOCH: 130 ----------------------------  
client [21] (testset)   loss: 0.3081 -> 0.3311  accuracy: 91.04% -> 92.18%     
client [88] (testset)   loss: 0.3228 -> 0.3596  accuracy: 88.40% -> 87.31%     
client [38] (testset)   loss: 0.3067 -> 0.3474  accuracy: 91.80% -> 91.61%     
client [3]  (testset)   loss: 0.2368 -> 0.2559  accuracy: 93.67% -> 93.82%     
client [5]  (testset)   loss: 0.3681 -> 0.4151  accuracy: 89.95% -> 89.29%     
client [41] (testset)   loss: 0.5166 -> 0.5885  accuracy: 83.46% -> 81.80%     
client [7]  (testset)   loss: 0.2959 -> 0.3236  accuracy: 88.86% -> 89.06%     
client [37] (testset)   loss: 0.3120 -> 0.3365  accuracy: 88.81% -> 89.01%     
client [45] (testset)   loss: 0.3768 -> 0.4018  accuracy: 87.90% -> 87.66%     
client [47] (testset)   loss: 0.4751 -> 0.4920  accuracy: 83.14% -> 82.64%     
---------------------------- TRAINING EPOCH: 140 ----------------------------  
client [16] (testset)   loss: 0.3229 -> 0.4736  accuracy: 91.58% -> 91.72%     
client [11] (testset)   loss: 0.2475 -> 0.2414  accuracy: 94.25% -> 94.36%     
client [37] (testset)   loss: 0.3214 -> 0.3505  accuracy: 89.31% -> 89.11%     
client [41] (testset)   loss: 0.5080 -> 0.6060  accuracy: 83.87% -> 82.38%     
client [95] (testset)   loss: 0.2671 -> 0.3229  accuracy: 93.01% -> 92.54%     
client [53] (testset)   loss: 0.3880 -> 0.4272  accuracy: 88.48% -> 88.95%     
client [22] (testset)   loss: 0.5353 -> 0.6042  accuracy: 84.44% -> 82.57%     
client [25] (testset)   loss: 0.2007 -> 0.2203  accuracy: 95.29% -> 95.39%     
client [69] (testset)   loss: 0.3448 -> 0.3337  accuracy: 89.74% -> 92.41%     
client [46] (testset)   loss: 0.2899 -> 0.3124  accuracy: 90.86% -> 91.44%     
---------------------------- TRAINING EPOCH: 150 ----------------------------  
client [47] (testset)   loss: 0.5113 -> 0.5267  accuracy: 84.86% -> 83.86%     
client [69] (testset)   loss: 0.4111 -> 0.3483  accuracy: 89.81% -> 92.69%     
client [82] (testset)   loss: 0.4285 -> 0.4293  accuracy: 85.61% -> 87.42%     
client [45] (testset)   loss: 0.3585 -> 0.4225  accuracy: 89.31% -> 88.57%     
client [7]  (testset)   loss: 0.3158 -> 0.3691  accuracy: 89.45% -> 88.47%     
client [50] (testset)   loss: 0.2867 -> 0.3405  accuracy: 90.25% -> 89.89%     
client [35] (testset)   loss: 0.5075 -> 0.5775  accuracy: 84.56% -> 84.76%     
client [24] (testset)   loss: 0.3389 -> 0.3308  accuracy: 90.29% -> 92.30%     
client [15] (testset)   loss: 0.4482 -> 0.5599  accuracy: 86.03% -> 84.23%     
client [58] (testset)   loss: 0.2809 -> 0.3109  accuracy: 91.56% -> 91.48%     
---------------------------- TRAINING EPOCH: 160 ----------------------------  
client [48] (testset)   loss: 0.4015 -> 0.4398  accuracy: 86.68% -> 85.59%     
client [76] (testset)   loss: 0.5443 -> 0.7661  accuracy: 82.65% -> 76.60%     
client [67] (testset)   loss: 0.3122 -> 0.3681  accuracy: 89.67% -> 89.77%     
client [37] (testset)   loss: 0.3472 -> 0.3890  accuracy: 88.30% -> 89.01%     
client [58] (testset)   loss: 0.2879 -> 0.3271  accuracy: 91.05% -> 91.48%     
client [64] (testset)   loss: 0.4605 -> 0.4700  accuracy: 84.13% -> 86.01%     
client [77] (testset)   loss: 0.4567 -> 0.4979  accuracy: 85.14% -> 85.51%     
client [55] (testset)   loss: 0.4365 -> 0.4327  accuracy: 85.47% -> 87.87%     
client [12] (testset)   loss: 0.4521 -> 0.4631  accuracy: 85.33% -> 86.87%     
client [89] (testset)   loss: 0.5393 -> 0.5684  accuracy: 83.63% -> 85.38%     
---------------------------- TRAINING EPOCH: 170 ----------------------------  
client [84] (testset)   loss: 0.3629 -> 0.4027  accuracy: 91.57% -> 91.61%     
client [51] (testset)   loss: 0.3197 -> 0.3505  accuracy: 92.56% -> 92.42%     
client [8]  (testset)   loss: 0.3608 -> 0.3819  accuracy: 90.56% -> 91.46%     
client [18] (testset)   loss: 0.4088 -> 0.6483  accuracy: 86.94% -> 84.16%     
client [94] (testset)   loss: 0.3769 -> 0.4093  accuracy: 90.22% -> 90.41%     
client [81] (testset)   loss: 0.5138 -> 0.4878  accuracy: 82.76% -> 85.40%     
client [3]  (testset)   loss: 0.2616 -> 0.2808  accuracy: 93.57% -> 94.03%     
client [11] (testset)   loss: 0.2480 -> 0.2639  accuracy: 94.47% -> 93.98%     
client [95] (testset)   loss: 0.3277 -> 0.3506  accuracy: 92.10% -> 92.85%     
client [67] (testset)   loss: 0.3203 -> 0.3946  accuracy: 89.41% -> 89.41%     
---------------------------- TRAINING EPOCH: 180 ----------------------------  
client [21] (testset)   loss: 0.2914 -> 0.3097  accuracy: 91.99% -> 92.37%     
client [79] (testset)   loss: 0.2256 -> 0.2319  accuracy: 93.38% -> 94.25%     
client [58] (testset)   loss: 0.2985 -> 0.3349  accuracy: 91.05% -> 91.72%     
client [88] (testset)   loss: 0.3609 -> 0.3645  accuracy: 88.40% -> 88.73%     
client [46] (testset)   loss: 0.3146 -> 0.3411  accuracy: 92.07% -> 90.86%     
client [11] (testset)   loss: 0.2499 -> 0.2629  accuracy: 93.87% -> 93.98%     
client [55] (testset)   loss: 0.4340 -> 0.4990  accuracy: 86.54% -> 86.29%     
client [13] (testset)   loss: 0.4560 -> 0.4754  accuracy: 86.20% -> 85.84%     
client [31] (testset)   loss: 0.3900 -> 0.4130  accuracy: 88.58% -> 88.53%     
client [75] (testset)   loss: 0.4049 -> 0.4601  accuracy: 87.94% -> 88.05%     
---------------------------- TRAINING EPOCH: 190 ----------------------------  
client [19] (testset)   loss: 0.3838 -> 0.4390  accuracy: 90.46% -> 90.42%     
client [7]  (testset)   loss: 0.3332 -> 0.3916  accuracy: 89.59% -> 88.28%     
client [57] (testset)   loss: 0.4995 -> 0.5551  accuracy: 85.94% -> 85.67%     
client [13] (testset)   loss: 0.4725 -> 0.4929  accuracy: 85.35% -> 86.32%     
client [43] (testset)   loss: 0.3356 -> 0.3703  accuracy: 91.27% -> 91.35%     
client [91] (testset)   loss: 0.4492 -> 0.4758  accuracy: 85.74% -> 86.99%     
client [10] (testset)   loss: 0.4268 -> 0.4445  accuracy: 88.00% -> 89.12%     
client [64] (testset)   loss: 0.4772 -> 0.5508  accuracy: 85.31% -> 84.62%     
client [82] (testset)   loss: 0.4988 -> 0.5005  accuracy: 85.67% -> 87.75%     
client [22] (testset)   loss: 0.6273 -> 0.6393  accuracy: 82.99% -> 82.36%     
---------------------------- TRAINING EPOCH: 200 ----------------------------  
client [20] (testset)   loss: 0.3572 -> 0.4017  accuracy: 91.21% -> 90.98%     
client [23] (testset)   loss: 0.4653 -> 0.4981  accuracy: 85.85% -> 85.62%     
client [88] (testset)   loss: 0.3946 -> 0.4133  accuracy: 87.55% -> 86.41%     
client [98] (testset)   loss: 0.3340 -> 0.3560  accuracy: 92.21% -> 91.89%     
client [79] (testset)   loss: 0.2289 -> 0.2447  accuracy: 93.89% -> 94.69%     
client [21] (testset)   loss: 0.3096 -> 0.3301  accuracy: 91.87% -> 92.06%     
client [92] (testset)   loss: 0.3145 -> 0.3212  accuracy: 92.37% -> 92.21%     
client [56] (testset)   loss: 0.4629 -> 0.5438  accuracy: 87.87% -> 85.81%     
client [5]  (testset)   loss: 0.4330 -> 0.4660  accuracy: 90.10% -> 88.85%     
client [52] (testset)   loss: 0.5601 -> 0.5720  accuracy: 86.22% -> 85.48%     
---------------------------- TRAINING EPOCH: 210 ----------------------------  
client [67] (testset)   loss: 0.3801 -> 0.4341  accuracy: 89.10% -> 89.10%     
client [54] (testset)   loss: 0.2985 -> 0.3469  accuracy: 91.89% -> 91.16%     
client [14] (testset)   loss: 0.3133 -> 0.3582  accuracy: 92.36% -> 92.17%     
client [99] (testset)   loss: 0.3145 -> 0.3450  accuracy: 91.86% -> 92.14%     
client [36] (testset)   loss: 0.4767 -> 0.5082  accuracy: 88.08% -> 87.23%     
client [30] (testset)   loss: 0.4334 -> 0.4753  accuracy: 90.05% -> 89.83%     
client [38] (testset)   loss: 0.3705 -> 0.4133  accuracy: 91.96% -> 91.57%     
client [15] (testset)   loss: 0.5381 -> 0.5804  accuracy: 84.59% -> 84.59%     
client [6]  (testset)   loss: 0.4818 -> 0.5210  accuracy: 86.71% -> 86.25%     
client [53] (testset)   loss: 0.4735 -> 0.5067  accuracy: 88.83% -> 88.24%     
---------------------------- TRAINING EPOCH: 220 ----------------------------  
client [99] (testset)   loss: 0.3298 -> 0.3641  accuracy: 91.75% -> 91.97%     
client [6]  (testset)   loss: 0.5087 -> 0.5403  accuracy: 84.66% -> 87.39%     
client [83] (testset)   loss: 0.3983 -> 0.4099  accuracy: 90.14% -> 90.35%     
client [42] (testset)   loss: 0.3299 -> 0.3488  accuracy: 91.60% -> 92.27%     
client [34] (testset)   loss: 0.4565 -> 0.4909  accuracy: 89.67% -> 89.67%     
client [15] (testset)   loss: 0.5468 -> 0.5886  accuracy: 84.59% -> 84.09%     
client [47] (testset)   loss: 0.6075 -> 0.6561  accuracy: 84.03% -> 82.22%     
client [55] (testset)   loss: 0.4637 -> 0.4937  accuracy: 85.68% -> 87.31%     
client [51] (testset)   loss: 0.3528 -> 0.3820  accuracy: 92.05% -> 92.15%     
client [95] (testset)   loss: 0.3544 -> 0.3769  accuracy: 92.18% -> 92.58%     
---------------------------- TRAINING EPOCH: 230 ----------------------------  
client [71] (testset)   loss: 0.6080 -> 0.6690  accuracy: 83.13% -> 82.11%     
client [15] (testset)   loss: 0.5815 -> 0.6116  accuracy: 83.44% -> 84.59%     
client [33] (testset)   loss: 0.4125 -> 0.4553  accuracy: 86.14% -> 86.59%     
client [99] (testset)   loss: 0.3269 -> 0.3666  accuracy: 92.81% -> 92.58%     
client [90] (testset)   loss: 0.5084 -> 0.5595  accuracy: 83.60% -> 83.92%     
client [57] (testset)   loss: 0.5727 -> 0.6251  accuracy: 86.17% -> 84.43%     
client [27] (testset)   loss: 0.3278 -> 0.3755  accuracy: 92.45% -> 92.59%     
client [78] (testset)   loss: 0.3338 -> 0.3639  accuracy: 91.99% -> 91.79%     
client [36] (testset)   loss: 0.4915 -> 0.5285  accuracy: 88.13% -> 86.93%     
client [88] (testset)   loss: 0.3885 -> 0.3895  accuracy: 87.83% -> 87.88%     
---------------------------- TRAINING EPOCH: 240 ----------------------------  
client [70] (testset)   loss: 0.6113 -> 0.7028  accuracy: 83.70% -> 83.47%     
client [35] (testset)   loss: 0.6258 -> 0.6208  accuracy: 82.87% -> 85.21%     
client [16] (testset)   loss: 0.4179 -> 0.4640  accuracy: 90.96% -> 91.29%     
client [80] (testset)   loss: 0.5114 -> 0.5504  accuracy: 84.78% -> 83.62%     
client [38] (testset)   loss: 0.3960 -> 0.4332  accuracy: 91.44% -> 91.41%     
client [78] (testset)   loss: 0.3453 -> 0.3773  accuracy: 91.53% -> 90.91%     
client [68] (testset)   loss: 0.3218 -> 0.3786  accuracy: 91.13% -> 90.65%     
client [11] (testset)   loss: 0.2765 -> 0.3010  accuracy: 94.36% -> 94.25%     
client [64] (testset)   loss: 0.5529 -> 0.5957  accuracy: 84.94% -> 85.85%     
client [82] (testset)   loss: 0.5663 -> 0.5746  accuracy: 86.40% -> 86.46%     
---------------------------- TRAINING EPOCH: 250 ----------------------------  
client [30] (testset)   loss: 0.5099 -> 0.5580  accuracy: 90.01% -> 90.05%     
client [27] (testset)   loss: 0.3421 -> 0.3880  accuracy: 92.34% -> 92.78%     
client [74] (testset)   loss: 0.3560 -> 0.3963  accuracy: 91.61% -> 91.66%     
client [45] (testset)   loss: 0.4536 -> 0.5056  accuracy: 88.73% -> 87.49%     
client [6]  (testset)   loss: 0.5350 -> 0.5721  accuracy: 84.80% -> 85.62%     
client [36] (testset)   loss: 0.5235 -> 0.5776  accuracy: 87.93% -> 87.08%     
client [63] (testset)   loss: 0.3746 -> 0.4339  accuracy: 90.72% -> 90.23%     
client [76] (testset)   loss: 0.6434 -> 0.6602  accuracy: 83.70% -> 84.03%     
client [83] (testset)   loss: 0.4146 -> 0.4233  accuracy: 89.96% -> 90.82%     
client [86] (testset)   loss: 0.3218 -> 0.3316  accuracy: 92.87% -> 93.22%     
---------------------------- TRAINING EPOCH: 260 ----------------------------  
client [83] (testset)   loss: 0.4290 -> 0.4240  accuracy: 89.85% -> 90.68%     
client [99] (testset)   loss: 0.3547 -> 0.3933  accuracy: 92.02% -> 91.97%     
client [74] (testset)   loss: 0.3737 -> 0.4280  accuracy: 91.21% -> 91.61%     
client [73] (testset)   loss: 0.6523 -> 0.6782  accuracy: 84.67% -> 84.84%     
client [29] (testset)   loss: 0.5980 -> 0.6325  accuracy: 83.49% -> 83.83%     
client [92] (testset)   loss: 0.3134 -> 0.3491  accuracy: 92.79% -> 92.12%     
client [6]  (testset)   loss: 0.5329 -> 0.5633  accuracy: 85.66% -> 86.75%     
client [61] (testset)   loss: 0.3316 -> 0.3751  accuracy: 92.41% -> 92.51%     
client [21] (testset)   loss: 0.3487 -> 0.3536  accuracy: 91.16% -> 92.10%     
client [67] (testset)   loss: 0.3985 -> 0.4560  accuracy: 89.30% -> 89.25%     
---------------------------- TRAINING EPOCH: 270 ----------------------------  
client [83] (testset)   loss: 0.4345 -> 0.4441  accuracy: 90.25% -> 90.46%     
client [32] (testset)   loss: 0.4214 -> 0.4454  accuracy: 90.82% -> 90.82%     
client [95] (testset)   loss: 0.3778 -> 0.3935  accuracy: 91.70% -> 92.77%     
client [61] (testset)   loss: 0.3585 -> 0.4086  accuracy: 92.79% -> 92.56%     
client [27] (testset)   loss: 0.3570 -> 0.3905  accuracy: 92.08% -> 92.52%     
client [25] (testset)   loss: 0.2500 -> 0.2715  accuracy: 94.95% -> 95.29%     
client [68] (testset)   loss: 0.3556 -> 0.4035  accuracy: 90.72% -> 90.52%     
client [34] (testset)   loss: 0.5273 -> 0.5431  accuracy: 87.85% -> 89.84%     
client [71] (testset)   loss: 0.6725 -> 0.7329  accuracy: 83.09% -> 83.00%     
client [89] (testset)   loss: 0.6188 -> 0.6365  accuracy: 84.60% -> 84.80%     
---------------------------- TRAINING EPOCH: 280 ----------------------------  
client [78] (testset)   loss: 0.3649 -> 0.4034  accuracy: 92.04% -> 91.02%     
client [81] (testset)   loss: 0.6001 -> 0.5922  accuracy: 84.62% -> 84.23%     
client [51] (testset)   loss: 0.3698 -> 0.4079  accuracy: 92.79% -> 92.56%     
client [54] (testset)   loss: 0.3001 -> 0.3545  accuracy: 92.00% -> 90.99%     
client [65] (testset)   loss: 0.5629 -> 0.5824  accuracy: 86.17% -> 86.91%     
client [41] (testset)   loss: 0.7195 -> 0.7725  accuracy: 81.80% -> 81.96%     
client [11] (testset)   loss: 0.2993 -> 0.3083  accuracy: 94.03% -> 94.30%     
client [85] (testset)   loss: 0.3460 -> 0.3841  accuracy: 92.57% -> 92.28%     
client [12] (testset)   loss: 0.5184 -> 0.5712  accuracy: 85.39% -> 85.33%     
client [23] (testset)   loss: 0.5487 -> 0.5854  accuracy: 85.44% -> 85.85%     
---------------------------- TRAINING EPOCH: 290 ----------------------------  
client [16] (testset)   loss: 0.4490 -> 0.4850  accuracy: 90.63% -> 91.67%     
client [65] (testset)   loss: 0.5527 -> 0.6023  accuracy: 87.04% -> 86.37%     
client [53] (testset)   loss: 0.5728 -> 0.5750  accuracy: 88.24% -> 87.59%     
client [58] (testset)   loss: 0.3817 -> 0.4231  accuracy: 91.40% -> 91.52%     
client [72] (testset)   loss: 0.4944 -> 0.5238  accuracy: 85.65% -> 85.97%     
client [7]  (testset)   loss: 0.4323 -> 0.4849  accuracy: 88.81% -> 88.08%     
client [71] (testset)   loss: 0.6983 -> 0.7439  accuracy: 82.73% -> 82.64%     
client [59] (testset)   loss: 0.5427 -> 0.5868  accuracy: 84.26% -> 84.36%     
client [86] (testset)   loss: 0.3401 -> 0.3391  accuracy: 92.73% -> 93.91%     
client [39] (testset)   loss: 0.5893 -> 0.6393  accuracy: 84.48% -> 85.27%     
---------------------------- TRAINING EPOCH: 300 ----------------------------  
client [99] (testset)   loss: 0.3679 -> 0.4098  accuracy: 91.75% -> 92.30%     
client [7]  (testset)   loss: 0.4537 -> 0.5089  accuracy: 88.67% -> 88.86%     
client [17] (testset)   loss: 0.4679 -> 0.4662  accuracy: 91.08% -> 91.55%     
client [64] (testset)   loss: 0.7006 -> 0.6688  accuracy: 82.25% -> 85.53%     
client [37] (testset)   loss: 0.4186 -> 0.4247  accuracy: 88.00% -> 88.91%     
client [29] (testset)   loss: 0.6339 -> 0.6756  accuracy: 85.33% -> 84.18%     
client [93] (testset)   loss: 0.4742 -> 0.4760  accuracy: 89.55% -> 92.49%     
client [73] (testset)   loss: 0.7395 -> 0.7470  accuracy: 84.04% -> 84.04%     
client [40] (testset)   loss: 0.4820 -> 0.5334  accuracy: 88.34% -> 88.41%     
client [76] (testset)   loss: 0.7021 -> 0.6894  accuracy: 83.31% -> 83.87%     
---------------------------- TRAINING EPOCH: 310 ----------------------------  
client [31] (testset)   loss: 0.4504 -> 0.4838  accuracy: 88.98% -> 89.48%     
client [89] (testset)   loss: 0.6379 -> 0.7063  accuracy: 85.77% -> 85.38%     
client [77] (testset)   loss: 0.6562 -> 0.6914  accuracy: 85.03% -> 84.54%     
client [90] (testset)   loss: 0.6215 -> 0.6332  accuracy: 83.46% -> 83.10%     
client [26] (testset)   loss: 0.4578 -> 0.4976  accuracy: 88.73% -> 88.85%     
client [50] (testset)   loss: 0.4379 -> 0.4699  accuracy: 89.94% -> 89.00%     
client [30] (testset)   loss: 0.5732 -> 0.6191  accuracy: 89.55% -> 89.87%     
client [70] (testset)   loss: 0.6706 -> 0.7551  accuracy: 84.22% -> 83.17%     
client [41] (testset)   loss: 0.7816 -> 0.8237  accuracy: 80.96% -> 82.04%     
client [99] (testset)   loss: 0.3880 -> 0.4201  accuracy: 91.91% -> 92.53%     
---------------------------- TRAINING EPOCH: 320 ----------------------------  
client [68] (testset)   loss: 0.4172 -> 0.4587  accuracy: 90.78% -> 90.37%     
client [70] (testset)   loss: 0.7010 -> 0.8097  accuracy: 84.00% -> 82.87%     
client [52] (testset)   loss: 0.6977 -> 0.7644  accuracy: 85.44% -> 84.88%     
client [1]  (testset)   loss: 0.4473 -> 0.4507  accuracy: 90.09% -> 90.25%     
client [2]  (testset)   loss: 0.3569 -> 0.3745  accuracy: 91.16% -> 91.53%     
client [67] (testset)   loss: 0.4444 -> 0.5014  accuracy: 89.30% -> 89.82%     
client [92] (testset)   loss: 0.3709 -> 0.4020  accuracy: 91.87% -> 92.12%     
client [35] (testset)   loss: 0.6614 -> 0.6658  accuracy: 83.39% -> 84.10%     
client [36] (testset)   loss: 0.6218 -> 0.6962  accuracy: 87.28% -> 86.83%     
client [64] (testset)   loss: 0.6708 -> 0.6799  accuracy: 83.65% -> 85.91%     
---------------------------- TRAINING EPOCH: 330 ----------------------------  
client [44] (testset)   loss: 0.7914 -> 0.8186  accuracy: 80.75% -> 80.75%     
client [6]  (testset)   loss: 0.6132 -> 0.6266  accuracy: 84.44% -> 86.03%     
client [12] (testset)   loss: 0.5721 -> 0.6025  accuracy: 84.39% -> 85.57%     
client [55] (testset)   loss: 0.5358 -> 0.5841  accuracy: 86.75% -> 87.82%     
client [29] (testset)   loss: 0.6884 -> 0.7098  accuracy: 84.99% -> 83.60%     
client [9]  (testset)   loss: 0.8600 -> 0.8489  accuracy: 78.78% -> 80.39%     
client [43] (testset)   loss: 0.4405 -> 0.4512  accuracy: 90.58% -> 90.79%     
client [77] (testset)   loss: 0.6777 -> 0.7137  accuracy: 85.24% -> 84.81%     
client [98] (testset)   loss: 0.4208 -> 0.4612  accuracy: 91.81% -> 91.69%     
client [78] (testset)   loss: 0.4250 -> 0.4397  accuracy: 90.71% -> 91.02%     
---------------------------- TRAINING EPOCH: 340 ----------------------------  
client [92] (testset)   loss: 0.3912 -> 0.4241  accuracy: 92.12% -> 91.96%     
client [80] (testset)   loss: 0.5651 -> 0.5991  accuracy: 84.99% -> 85.88%     
client [63] (testset)   loss: 0.4356 -> 0.4965  accuracy: 91.02% -> 90.43%     
client [76] (testset)   loss: 0.7437 -> 0.7361  accuracy: 83.31% -> 84.20%     
client [78] (testset)   loss: 0.4017 -> 0.4298  accuracy: 91.32% -> 91.43%     
client [25] (testset)   loss: 0.2807 -> 0.2943  accuracy: 94.93% -> 95.27%     
client [58] (testset)   loss: 0.4185 -> 0.4487  accuracy: 91.96% -> 91.40%     
client [13] (testset)   loss: 0.5801 -> 0.6300  accuracy: 85.47% -> 86.26%     
client [17] (testset)   loss: 0.4801 -> 0.5012  accuracy: 91.24% -> 91.59%     
client [38] (testset)   loss: 0.5151 -> 0.5495  accuracy: 91.05% -> 92.19%     
---------------------------- TRAINING EPOCH: 350 ----------------------------  
client [72] (testset)   loss: 0.6100 -> 0.6091  accuracy: 86.38% -> 86.21%     
client [82] (testset)   loss: 0.7192 -> 0.7164  accuracy: 85.55% -> 85.27%     
client [86] (testset)   loss: 0.3710 -> 0.3690  accuracy: 92.87% -> 93.22%     
client [51] (testset)   loss: 0.4251 -> 0.4592  accuracy: 92.01% -> 92.65%     
client [96] (testset)   loss: 0.5831 -> 0.6291  accuracy: 88.46% -> 87.88%     
client [42] (testset)   loss: 0.4178 -> 0.4385  accuracy: 91.91% -> 92.04%     
client [55] (testset)   loss: 0.5893 -> 0.6172  accuracy: 85.98% -> 87.67%     
client [13] (testset)   loss: 0.5925 -> 0.6325  accuracy: 86.87% -> 86.69%     
client [1]  (testset)   loss: 0.4443 -> 0.4640  accuracy: 90.57% -> 89.98%     
client [12] (testset)   loss: 0.5932 -> 0.5972  accuracy: 84.21% -> 85.27%     
---------------------------- TRAINING EPOCH: 360 ----------------------------  
client [68] (testset)   loss: 0.4517 -> 0.4936  accuracy: 90.62% -> 90.37%     
client [23] (testset)   loss: 0.6342 -> 0.6816  accuracy: 85.35% -> 85.53%     
client [46] (testset)   loss: 0.4355 -> 0.4799  accuracy: 91.44% -> 90.76%     
client [41] (testset)   loss: 0.8255 -> 0.8480  accuracy: 78.80% -> 82.38%     
client [25] (testset)   loss: 0.2837 -> 0.3176  accuracy: 95.12% -> 95.10%     
client [58] (testset)   loss: 0.4118 -> 0.4561  accuracy: 91.52% -> 91.24%     
client [14] (testset)   loss: 0.3829 -> 0.4169  accuracy: 92.12% -> 91.65%     
client [33] (testset)   loss: 0.4561 -> 0.7699  accuracy: 87.08% -> 84.59%     
client [85] (testset)   loss: 0.4138 -> 0.5018  accuracy: 92.54% -> 92.13%     
client [62] (testset)   loss: 0.5960 -> 0.6274  accuracy: 86.65% -> 88.27%     
---------------------------- TRAINING EPOCH: 370 ----------------------------  
client [98] (testset)   loss: 0.4501 -> 0.4884  accuracy: 91.85% -> 90.89%     
client [63] (testset)   loss: 0.4582 -> 0.5143  accuracy: 90.62% -> 90.62%     
client [70] (testset)   loss: 0.7713 -> 0.9085  accuracy: 83.62% -> 81.37%     
client [65] (testset)   loss: 0.6603 -> 0.6856  accuracy: 86.03% -> 86.50%     
client [14] (testset)   loss: 0.4030 -> 0.4474  accuracy: 91.41% -> 92.12%     
client [73] (testset)   loss: 0.7479 -> 0.8430  accuracy: 84.55% -> 84.27%     
client [34] (testset)   loss: 0.6055 -> 0.6298  accuracy: 89.95% -> 89.84%     
client [99] (testset)   loss: 0.4217 -> 0.4576  accuracy: 92.47% -> 92.41%     
client [69] (testset)   loss: 0.5036 -> 0.4963  accuracy: 90.34% -> 92.73%     
client [46] (testset)   loss: 0.4662 -> 0.5029  accuracy: 91.02% -> 90.55%     
---------------------------- TRAINING EPOCH: 380 ----------------------------  
client [99] (testset)   loss: 0.4282 -> 0.4490  accuracy: 92.19% -> 92.41%     
client [93] (testset)   loss: 0.5157 -> 0.5201  accuracy: 89.67% -> 91.86%     
client [11] (testset)   loss: 0.3570 -> 0.3642  accuracy: 93.65% -> 94.14%     
client [58] (testset)   loss: 0.4342 -> 0.4853  accuracy: 91.16% -> 91.40%     
client [81] (testset)   loss: 0.7243 -> 0.7556  accuracy: 84.38% -> 83.64%     
client [85] (testset)   loss: 0.4157 -> 0.4565  accuracy: 92.50% -> 92.17%     
client [89] (testset)   loss: 0.6959 -> 0.7637  accuracy: 84.93% -> 84.86%     
client [45] (testset)   loss: 0.5388 -> 0.5809  accuracy: 87.66% -> 88.40%     
client [8]  (testset)   loss: 0.4534 -> 0.4633  accuracy: 90.56% -> 91.54%     
client [68] (testset)   loss: 0.4893 -> 0.5172  accuracy: 90.49% -> 90.56%     
---------------------------- TRAINING EPOCH: 390 ----------------------------  
client [67] (testset)   loss: 0.5293 -> 0.5760  accuracy: 89.30% -> 89.20%     
client [72] (testset)   loss: 0.6748 -> 0.6696  accuracy: 85.41% -> 86.11%     
client [1]  (testset)   loss: 0.4907 -> 0.4922  accuracy: 89.77% -> 90.09%     
client [78] (testset)   loss: 0.4488 -> 0.4764  accuracy: 91.07% -> 90.86%     
client [83] (testset)   loss: 0.5389 -> 0.5487  accuracy: 90.14% -> 90.21%     
client [21] (testset)   loss: 0.4145 -> 0.4536  accuracy: 91.84% -> 92.18%     
client [56] (testset)   loss: 0.6318 -> 0.6559  accuracy: 87.87% -> 88.04%     
client [44] (testset)   loss: 0.8644 -> 0.9090  accuracy: 81.30% -> 81.30%     
client [92] (testset)   loss: 0.4118 -> 0.4350  accuracy: 92.12% -> 92.29%     
client [27] (testset)   loss: 0.4099 -> 0.4613  accuracy: 93.14% -> 93.03%     
---------------------------- TRAINING EPOCH: 400 ----------------------------  
client [10] (testset)   loss: 0.6081 -> 0.6105  accuracy: 88.20% -> 89.92%     
client [39] (testset)   loss: 0.6569 -> 0.6679  accuracy: 84.40% -> 85.05%     
client [65] (testset)   loss: 0.6623 -> 0.6849  accuracy: 86.44% -> 86.23%     
client [26] (testset)   loss: 0.5561 -> 0.5851  accuracy: 87.68% -> 88.65%     
client [19] (testset)   loss: 0.5573 -> 0.6278  accuracy: 89.79% -> 89.67%     
client [68] (testset)   loss: 0.4826 -> 0.5502  accuracy: 90.68% -> 90.30%     
client [41] (testset)   loss: 0.8842 -> 0.9024  accuracy: 80.63% -> 80.96%     
client [50] (testset)   loss: 0.5120 -> 0.5551  accuracy: 89.73% -> 89.32%     
client [75] (testset)   loss: 0.5589 -> 0.6038  accuracy: 86.77% -> 87.41%     
client [81] (testset)   loss: 0.7732 -> 0.8064  accuracy: 83.74% -> 84.96%     
Training... ---------------------------------------- 100% 2:39:09
FedOBP's average time taken by each global epoch: 0 min 23.75 sec.             
FedOBP's total running time: 2 h 39 m 9 s.                                     
==================== FedOBP Experiment Results: ====================           
Display format: (before local fine-tuning) -> (after local fine-tuning)        
 So if finetune_epoch = 0, x.xx% -> 0.00% is normal.                           
 Centralized testing ONLY happens after model aggregation, so the stats between
'->' are the same.                                                             
{                                                                              
    "100": {                                                                   
        "all_clients": {                                                       
            "test": {                                                          
                "loss": "0.3273 -> 0.0000",                                    
                "accuracy": "89.45% -> 0.00%"                                  
            }                                                                  
        }                                                                      
    },                                                                         
    "200": {                                                                   
        "all_clients": {                                                       
            "test": {                                                          
                "loss": "0.4049 -> 0.0000",                                    
                "accuracy": "89.09% -> 0.00%"                                  
            }                                                                  
        }                                                                      
    },                                                                         
    "300": {                                                                   
        "all_clients": {                                                       
            "test": {                                                          
                "loss": "0.4839 -> 0.0000",                                    
                "accuracy": "88.72% -> 0.00%"                                  
            }                                                                  
        }                                                                      
    },                                                                         
    "400": {                                                                   
        "all_clients": {                                                       
            "test": {                                                          
                "loss": "0.5689 -> 0.0000",                                    
                "accuracy": "88.32% -> 0.00%"                                  
            }                                                                  
        }                                                                      
    }                                                                          
}                                                                              
==================== FedOBP Max Accuracy ====================                  
all_clients:                                                                   
(test) before fine-tuning: 89.45% at epoch 100                                 
(test) after fine-tuning: 0.00% at epoch 100                                   
[0m