out\fedobp\cifar100\Main_GlobalNorm_EMAscore(0.5)_ALL_IG_0.999
==================== FedOBP ====================                               
Experiment Arguments:                                                          
{
│   'method': 'fedobp',
│   'dataset': {
│   │   'name': 'cifar100',
│   │   'client_num': 100,
│   │   'test_ratio': 0.25,
│   │   'val_ratio': 0.0,
│   │   'seed': 42,
│   │   'split': 'sample',
│   │   'IID_ratio': 0.0,
│   │   'monitor_window_name_suffix': 'cifar100-100clients-0%IID-use20superclasses-Dir(0.5)-seed42',
│   │   'super_class': False,
│   │   'alpha': 0.5,
│   │   'min_samples_per_client': 10
│   },
│   'model': {
│   │   'name': 'avgcnn',
│   │   'use_torchvision_pretrained_weights': True,
│   │   'external_model_weights_path': None
│   },
│   'optimizer': {
│   │   'lr': 0.01,
│   │   'dampening': 0,
│   │   'weight_decay': 0,
│   │   'momentum': 0,
│   │   'nesterov': False,
│   │   'name': 'sgd'
│   },
│   'mode': 'serial',
│   'parallel': {
│   │   'ray_cluster_addr': None,
│   │   'num_cpus': None,
│   │   'num_gpus': None,
│   │   'num_workers': 2
│   },
│   'common': {
│   │   'seed': 42,
│   │   'join_ratio': 0.1,
│   │   'global_epoch': 400,
│   │   'local_epoch': 5,
│   │   'batch_size': 32,
│   │   'reset_optimizer_on_global_epoch': True,
│   │   'straggler_ratio': 0,
│   │   'straggler_min_local_epoch': 0,
│   │   'buffers': 'global',
│   │   'client_side_evaluation': True,
│   │   'test': {
│   │   │   'client': {
│   │   │   │   'interval': 100,
│   │   │   │   'finetune_epoch': 0,
│   │   │   │   'train': False,
│   │   │   │   'val': False,
│   │   │   │   'test': True
│   │   │   },
│   │   │   'server': {
│   │   │   │   'interval': -1,
│   │   │   │   'train': False,
│   │   │   │   'val': False,
│   │   │   │   'test': False,
│   │   │   │   'model_in_train_mode': False
│   │   │   }
│   │   },
│   │   'verbose_gap': 10,
│   │   'monitor': None,
│   │   'use_cuda': True,
│   │   'save_log': True,
│   │   'save_model': False,
│   │   'save_learning_curve_plot': False,
│   │   'save_metrics': True,
│   │   'delete_useless_run': True
│   },
│   'fedobp': {
│   │   'ig_ratio': 0.999,
│   │   'alpha': 0.5,
│   │   'norm': 'global',
│   │   'EMA': True,
│   │   'CLS': False,
│   │   'track': False,
│   │   'type': 'Main'
│   }
}
---------------------------- TRAINING EPOCH: 10 ----------------------------   
client [77] (testset)   loss: 3.9544 -> 3.6555  accuracy: 9.79% -> 11.89%      
client [81] (testset)   loss: 3.7559 -> 4.4496  accuracy: 14.58% -> 7.81%      
client [21] (testset)   loss: 3.9435 -> 4.9504  accuracy: 7.63% -> 7.63%       
client [68] (testset)   loss: 3.8646 -> 3.4825  accuracy: 12.78% -> 18.05%     
client [93] (testset)   loss: 4.0683 -> 3.6575  accuracy: 10.14% -> 16.67%     
client [31] (testset)   loss: 3.8579 -> 3.6069  accuracy: 16.39% -> 18.03%     
client [20] (testset)   loss: 3.6578 -> 3.5798  accuracy: 16.18% -> 16.91%     
client [59] (testset)   loss: 4.1202 -> 3.6412  accuracy: 7.36% -> 15.34%      
client [48] (testset)   loss: 3.8787 -> 3.7807  accuracy: 7.41% -> 11.11%      
client [34] (testset)   loss: 3.8636 -> 3.5378  accuracy: 14.40% -> 23.20%     
---------------------------- TRAINING EPOCH: 20 ----------------------------   
client [69] (testset)   loss: 3.3363 -> 3.2306  accuracy: 18.70% -> 28.46%     
client [99] (testset)   loss: 3.7711 -> 3.7891  accuracy: 14.29% -> 13.64%     
client [67] (testset)   loss: 3.6314 -> 3.6336  accuracy: 17.16% -> 14.20%     
client [0]  (testset)   loss: 3.5161 -> 4.9042  accuracy: 18.97% -> 12.64%     
client [76] (testset)   loss: 3.5780 -> 3.6953  accuracy: 15.45% -> 11.38%     
client [41] (testset)   loss: 3.5928 -> 3.2789  accuracy: 16.32% -> 24.74%     
client [62] (testset)   loss: 3.8602 -> 3.4096  accuracy: 8.28% -> 21.30%      
client [2]  (testset)   loss: 3.6240 -> 3.4401  accuracy: 15.64% -> 18.44%     
client [14] (testset)   loss: 3.3302 -> 4.2689  accuracy: 24.42% -> 11.63%     
client [46] (testset)   loss: 3.7205 -> 4.5129  accuracy: 16.28% -> 11.63%     
---------------------------- TRAINING EPOCH: 30 ----------------------------   
client [24] (testset)   loss: 3.6881 -> 6.4207  accuracy: 17.97% -> 3.91%      
client [68] (testset)   loss: 3.2732 -> 3.4095  accuracy: 23.31% -> 27.07%     
client [57] (testset)   loss: 3.4734 -> 3.3177  accuracy: 21.90% -> 21.90%     
client [17] (testset)   loss: 3.3091 -> 3.2424  accuracy: 18.84% -> 23.19%     
client [54] (testset)   loss: 3.3172 -> 3.4631  accuracy: 24.31% -> 22.92%     
client [23] (testset)   loss: 3.6408 -> 3.6937  accuracy: 16.31% -> 16.31%     
client [35] (testset)   loss: 3.3675 -> 3.4955  accuracy: 20.73% -> 23.78%     
client [59] (testset)   loss: 3.3395 -> 3.8260  accuracy: 24.54% -> 17.79%     
client [31] (testset)   loss: 2.9912 -> 3.3247  accuracy: 29.51% -> 22.13%     
client [9]  (testset)   loss: 3.8012 -> 3.7592  accuracy: 10.42% -> 21.53%     
---------------------------- TRAINING EPOCH: 40 ----------------------------   
client [64] (testset)   loss: 3.1941 -> 3.8153  accuracy: 27.87% -> 20.77%     
client [33] (testset)   loss: 3.3224 -> 3.7102  accuracy: 22.22% -> 19.05%     
client [16] (testset)   loss: 3.3694 -> 3.2876  accuracy: 19.46% -> 25.50%     
client [44] (testset)   loss: 3.1523 -> 8.6185  accuracy: 25.50% -> 3.36%      
client [8]  (testset)   loss: 3.3952 -> 4.1601  accuracy: 24.14% -> 23.45%     
client [31] (testset)   loss: 2.9877 -> 3.3296  accuracy: 27.05% -> 26.23%     
client [47] (testset)   loss: 3.2577 -> 3.2471  accuracy: 23.91% -> 25.36%     
client [36] (testset)   loss: 3.2063 -> 3.6063  accuracy: 23.89% -> 23.89%     
client [20] (testset)   loss: 3.1513 -> 3.8280  accuracy: 22.06% -> 18.38%     
client [56] (testset)   loss: 3.4528 -> 3.5081  accuracy: 18.25% -> 23.02%     
---------------------------- TRAINING EPOCH: 50 ----------------------------   
client [4]  (testset)   loss: 2.8738 -> 3.5487  accuracy: 31.67% -> 26.67%     
client [60] (testset)   loss: 3.3853 -> 4.0308  accuracy: 20.49% -> 20.49%     
client [28] (testset)   loss: 3.4972 -> 4.0429  accuracy: 22.42% -> 25.45%     
client [25] (testset)   loss: 3.3576 -> 3.9994  accuracy: 24.19% -> 25.81%     
client [58] (testset)   loss: 3.4533 -> 3.9491  accuracy: 19.35% -> 25.81%     
client [44] (testset)   loss: 3.2181 -> 6.6014  accuracy: 22.15% -> 10.07%     
client [39] (testset)   loss: 3.3343 -> 3.6211  accuracy: 20.44% -> 22.63%     
client [29] (testset)   loss: 3.1627 -> 3.8554  accuracy: 25.31% -> 21.60%     
client [3]  (testset)   loss: 3.3463 -> 3.9197  accuracy: 22.28% -> 18.65%     
client [84] (testset)   loss: 3.4857 -> 3.9700  accuracy: 23.35% -> 23.95%     
---------------------------- TRAINING EPOCH: 60 ----------------------------   
client [21] (testset)   loss: 3.3380 -> 4.5059  accuracy: 28.81% -> 20.34%     
client [84] (testset)   loss: 3.5771 -> 4.1569  accuracy: 25.15% -> 26.35%     
client [10] (testset)   loss: 3.2470 -> 3.4696  accuracy: 22.03% -> 23.73%     
client [36] (testset)   loss: 3.1872 -> 3.7366  accuracy: 22.12% -> 22.12%     
client [65] (testset)   loss: 3.2736 -> 4.4134  accuracy: 29.66% -> 23.45%     
client [81] (testset)   loss: 3.0871 -> 6.5338  accuracy: 31.25% -> 15.10%     
client [79] (testset)   loss: 3.0644 -> 4.4327  accuracy: 31.43% -> 27.86%     
client [42] (testset)   loss: 3.1649 -> 3.4995  accuracy: 24.64% -> 28.26%     
client [11] (testset)   loss: 3.1982 -> 3.2213  accuracy: 27.20% -> 30.40%     
client [96] (testset)   loss: 3.2531 -> 3.6721  accuracy: 27.10% -> 28.39%     
---------------------------- TRAINING EPOCH: 70 ----------------------------   
client [8]  (testset)   loss: 3.6280 -> 4.3478  accuracy: 25.52% -> 22.07%     
client [53] (testset)   loss: 3.5492 -> 3.8537  accuracy: 17.42% -> 18.71%     
client [52] (testset)   loss: 3.3484 -> 3.6870  accuracy: 25.81% -> 27.96%     
client [42] (testset)   loss: 3.2453 -> 3.6475  accuracy: 30.43% -> 29.71%     
client [69] (testset)   loss: 3.0799 -> 3.9540  accuracy: 30.89% -> 26.02%     
client [59] (testset)   loss: 3.0760 -> 3.7756  accuracy: 34.36% -> 28.22%     
client [7]  (testset)   loss: 3.3918 -> 4.4618  accuracy: 23.74% -> 18.71%     
client [26] (testset)   loss: 3.4151 -> 3.8895  accuracy: 24.66% -> 26.71%     
client [49] (testset)   loss: 3.1922 -> 3.4370  accuracy: 28.18% -> 29.09%     
client [98] (testset)   loss: 3.2462 -> 3.7007  accuracy: 25.99% -> 24.86%     
---------------------------- TRAINING EPOCH: 80 ----------------------------   
client [98] (testset)   loss: 3.5343 -> 3.8835  accuracy: 24.86% -> 25.42%     
client [47] (testset)   loss: 3.3592 -> 3.3500  accuracy: 28.99% -> 25.36%     
client [21] (testset)   loss: 3.3587 -> 4.1406  accuracy: 25.42% -> 22.03%     
client [77] (testset)   loss: 3.4377 -> 3.6953  accuracy: 21.68% -> 23.08%     
client [95] (testset)   loss: 3.5154 -> 4.1440  accuracy: 25.30% -> 22.89%     
client [91] (testset)   loss: 3.3589 -> 4.0733  accuracy: 26.80% -> 29.41%     
client [14] (testset)   loss: 3.2586 -> 4.0458  accuracy: 29.65% -> 24.42%     
client [99] (testset)   loss: 3.6304 -> 4.1440  accuracy: 18.83% -> 23.38%     
client [20] (testset)   loss: 3.5083 -> 4.2650  accuracy: 28.68% -> 22.06%     
client [39] (testset)   loss: 3.2360 -> 3.8602  accuracy: 24.82% -> 24.82%     
---------------------------- TRAINING EPOCH: 90 ----------------------------   
client [52] (testset)   loss: 3.3906 -> 3.9429  accuracy: 26.88% -> 30.11%     
client [62] (testset)   loss: 3.4460 -> 4.0263  accuracy: 26.04% -> 26.04%     
client [71] (testset)   loss: 3.1664 -> 4.1963  accuracy: 27.34% -> 20.31%     
client [97] (testset)   loss: 3.4023 -> 3.4654  accuracy: 22.78% -> 29.75%     
client [30] (testset)   loss: 3.3696 -> 4.0633  accuracy: 23.31% -> 30.06%     
client [88] (testset)   loss: 3.0771 -> 3.1950  accuracy: 27.34% -> 31.25%     
client [60] (testset)   loss: 3.3759 -> 4.1837  accuracy: 27.87% -> 26.23%     
client [82] (testset)   loss: 3.4696 -> 3.9808  accuracy: 25.37% -> 23.88%     
client [91] (testset)   loss: 3.3365 -> 4.3901  accuracy: 29.41% -> 28.76%     
client [57] (testset)   loss: 3.3342 -> 3.6401  accuracy: 25.55% -> 29.93%     
---------------------------- TRAINING EPOCH: 100 ----------------------------  
client [31] (testset)   loss: 3.2632 -> 3.5780  accuracy: 34.43% -> 36.07%     
client [15] (testset)   loss: 3.3510 -> 3.9775  accuracy: 25.00% -> 27.78%     
client [71] (testset)   loss: 3.0531 -> 3.9376  accuracy: 31.25% -> 29.69%     
client [97] (testset)   loss: 3.3797 -> 3.6885  accuracy: 28.48% -> 30.38%     
client [53] (testset)   loss: 3.7084 -> 4.1350  accuracy: 16.13% -> 17.42%     
client [77] (testset)   loss: 3.3693 -> 3.7387  accuracy: 23.08% -> 26.57%     
client [76] (testset)   loss: 3.4011 -> 4.0014  accuracy: 30.08% -> 19.51%     
client [79] (testset)   loss: 3.1280 -> 3.6618  accuracy: 36.43% -> 32.86%     
client [28] (testset)   loss: 3.5582 -> 4.1023  accuracy: 32.73% -> 35.76%     
client [99] (testset)   loss: 3.6367 -> 4.1074  accuracy: 25.32% -> 22.73%     
---------------------------- TRAINING EPOCH: 110 ----------------------------  
client [97] (testset)   loss: 3.2628 -> 3.6677  accuracy: 31.01% -> 32.91%     
client [86] (testset)   loss: 3.3077 -> 3.9378  accuracy: 30.13% -> 32.05%     
client [34] (testset)   loss: 3.8539 -> 4.7610  accuracy: 27.20% -> 28.80%     
client [73] (testset)   loss: 3.3984 -> 4.1834  accuracy: 30.11% -> 29.55%     
client [5]  (testset)   loss: 3.4428 -> 4.0309  accuracy: 26.90% -> 26.21%     
client [96] (testset)   loss: 3.6464 -> 4.1506  accuracy: 27.74% -> 26.45%     
client [22] (testset)   loss: 4.0268 -> 4.6715  accuracy: 20.95% -> 20.27%     
client [60] (testset)   loss: 3.6322 -> 4.3797  accuracy: 31.15% -> 26.23%     
client [66] (testset)   loss: 3.8569 -> 4.3130  accuracy: 18.71% -> 19.30%     
client [83] (testset)   loss: 3.5945 -> 4.1945  accuracy: 29.60% -> 28.80%     
---------------------------- TRAINING EPOCH: 120 ----------------------------  
client [76] (testset)   loss: 3.5988 -> 4.1110  accuracy: 23.58% -> 21.14%     
client [65] (testset)   loss: 3.7149 -> 4.2566  accuracy: 28.28% -> 32.41%     
client [95] (testset)   loss: 3.8766 -> 4.1802  accuracy: 22.29% -> 25.90%     
client [17] (testset)   loss: 3.3543 -> 3.7323  accuracy: 23.19% -> 31.88%     
client [8]  (testset)   loss: 3.9856 -> 4.6336  accuracy: 24.14% -> 24.83%     
client [35] (testset)   loss: 3.7726 -> 4.1328  accuracy: 27.44% -> 28.05%     
client [98] (testset)   loss: 3.5079 -> 3.8715  accuracy: 27.12% -> 25.99%     
client [53] (testset)   loss: 3.7931 -> 4.2943  accuracy: 20.00% -> 19.35%     
client [43] (testset)   loss: 3.7263 -> 4.5001  accuracy: 31.54% -> 28.46%     
client [64] (testset)   loss: 3.4946 -> 3.7794  accuracy: 29.51% -> 30.05%     
---------------------------- TRAINING EPOCH: 130 ----------------------------  
client [21] (testset)   loss: 3.3701 -> 4.8704  accuracy: 29.66% -> 27.97%     
client [88] (testset)   loss: 3.0716 -> 3.4390  accuracy: 33.59% -> 34.38%     
client [38] (testset)   loss: 3.5058 -> 3.9094  accuracy: 29.80% -> 32.32%     
client [3]  (testset)   loss: 4.0204 -> 4.5720  accuracy: 22.80% -> 27.46%     
client [5]  (testset)   loss: 3.6098 -> 4.2936  accuracy: 27.59% -> 25.52%     
client [41] (testset)   loss: 3.1250 -> 3.4753  accuracy: 35.79% -> 35.79%     
client [7]  (testset)   loss: 3.7732 -> 4.4930  accuracy: 23.74% -> 28.06%     
client [37] (testset)   loss: 3.9203 -> 3.9999  accuracy: 25.16% -> 30.97%     
client [45] (testset)   loss: 3.3838 -> 3.9165  accuracy: 24.86% -> 29.38%     
client [47] (testset)   loss: 3.4524 -> 3.5837  accuracy: 28.99% -> 25.36%     
---------------------------- TRAINING EPOCH: 140 ----------------------------  
client [16] (testset)   loss: 3.4568 -> 4.0220  accuracy: 29.53% -> 28.19%     
client [11] (testset)   loss: 3.2329 -> 3.4163  accuracy: 32.80% -> 28.80%     
client [37] (testset)   loss: 3.6716 -> 4.0365  accuracy: 27.10% -> 30.32%     
client [41] (testset)   loss: 3.2052 -> 3.5676  accuracy: 30.00% -> 36.32%     
client [95] (testset)   loss: 4.2010 -> 4.5151  accuracy: 21.08% -> 22.89%     
client [53] (testset)   loss: 3.9105 -> 4.1835  accuracy: 20.65% -> 21.94%     
client [22] (testset)   loss: 4.3142 -> 4.7220  accuracy: 21.62% -> 21.62%     
client [25] (testset)   loss: 3.7534 -> 4.4710  accuracy: 28.49% -> 30.65%     
client [69] (testset)   loss: 3.8166 -> 4.5563  accuracy: 30.08% -> 28.46%     
client [46] (testset)   loss: 3.5751 -> 4.6266  accuracy: 27.33% -> 23.84%     
---------------------------- TRAINING EPOCH: 150 ----------------------------  
client [47] (testset)   loss: 3.5569 -> 3.8822  accuracy: 28.99% -> 23.91%     
client [69] (testset)   loss: 3.7138 -> 4.5427  accuracy: 34.15% -> 32.52%     
client [82] (testset)   loss: 3.9849 -> 4.1728  accuracy: 22.39% -> 24.63%     
client [45] (testset)   loss: 3.5213 -> 3.9825  accuracy: 23.73% -> 29.94%     
client [7]  (testset)   loss: 3.8800 -> 4.3973  accuracy: 25.90% -> 28.06%     
client [50] (testset)   loss: 3.4779 -> 3.9782  accuracy: 28.85% -> 31.41%     
client [35] (testset)   loss: 3.7306 -> 4.2273  accuracy: 26.83% -> 27.44%     
client [24] (testset)   loss: 4.0307 -> 4.3520  accuracy: 23.44% -> 27.34%     
client [15] (testset)   loss: 3.4011 -> 4.3518  accuracy: 28.33% -> 26.11%     
client [58] (testset)   loss: 3.6740 -> 4.2234  accuracy: 30.97% -> 32.26%     
---------------------------- TRAINING EPOCH: 160 ----------------------------  
client [48] (testset)   loss: 3.6761 -> 4.1702  accuracy: 29.63% -> 29.63%     
client [76] (testset)   loss: 3.6503 -> 4.2530  accuracy: 26.02% -> 24.39%     
client [67] (testset)   loss: 3.4744 -> 3.8063  accuracy: 35.50% -> 38.46%     
client [37] (testset)   loss: 3.7419 -> 4.1411  accuracy: 29.03% -> 30.32%     
client [58] (testset)   loss: 3.6420 -> 4.4863  accuracy: 32.26% -> 27.74%     
client [64] (testset)   loss: 3.6286 -> 4.2033  accuracy: 30.60% -> 27.87%     
client [77] (testset)   loss: 3.8259 -> 4.0608  accuracy: 26.57% -> 25.87%     
client [55] (testset)   loss: 3.8161 -> 4.0867  accuracy: 32.76% -> 31.03%     
client [12] (testset)   loss: 4.4295 -> 4.9328  accuracy: 19.62% -> 21.52%     
client [89] (testset)   loss: 3.7363 -> 4.4973  accuracy: 30.00% -> 25.71%     
---------------------------- TRAINING EPOCH: 170 ----------------------------  
client [84] (testset)   loss: 4.2778 -> 4.6778  accuracy: 25.75% -> 29.94%     
client [51] (testset)   loss: 3.5757 -> 4.2005  accuracy: 30.00% -> 26.25%     
client [8]  (testset)   loss: 4.1455 -> 4.4742  accuracy: 27.59% -> 26.21%     
client [18] (testset)   loss: 3.5514 -> 3.9974  accuracy: 31.46% -> 33.15%     
client [94] (testset)   loss: 3.5586 -> 4.3202  accuracy: 23.42% -> 26.13%     
client [81] (testset)   loss: 3.5366 -> 4.0923  accuracy: 32.81% -> 28.65%     
client [3]  (testset)   loss: 4.2983 -> 4.9270  accuracy: 21.24% -> 24.35%     
client [11] (testset)   loss: 3.3576 -> 3.5977  accuracy: 32.00% -> 30.40%     
client [95] (testset)   loss: 4.1378 -> 4.5437  accuracy: 25.90% -> 25.90%     
client [67] (testset)   loss: 3.4953 -> 3.8534  accuracy: 34.32% -> 34.32%     
---------------------------- TRAINING EPOCH: 180 ----------------------------  
client [21] (testset)   loss: 3.5863 -> 4.7739  accuracy: 29.66% -> 27.97%     
client [79] (testset)   loss: 3.5812 -> 4.1084  accuracy: 30.00% -> 37.14%     
client [58] (testset)   loss: 3.5001 -> 4.5009  accuracy: 33.55% -> 29.03%     
client [88] (testset)   loss: 3.3157 -> 3.5838  accuracy: 29.69% -> 32.81%     
client [46] (testset)   loss: 4.0612 -> 4.7860  accuracy: 22.09% -> 27.33%     
client [11] (testset)   loss: 3.5764 -> 3.6681  accuracy: 27.20% -> 30.40%     
client [55] (testset)   loss: 3.8493 -> 4.1026  accuracy: 34.48% -> 31.90%     
client [13] (testset)   loss: 4.4849 -> 4.5601  accuracy: 24.44% -> 31.11%     
client [31] (testset)   loss: 3.5983 -> 3.9773  accuracy: 31.97% -> 39.34%     
client [75] (testset)   loss: 4.1237 -> 4.8800  accuracy: 29.29% -> 27.86%     
---------------------------- TRAINING EPOCH: 190 ----------------------------  
client [19] (testset)   loss: 4.4003 -> 4.9684  accuracy: 21.80% -> 20.30%     
client [7]  (testset)   loss: 3.9785 -> 4.4646  accuracy: 27.34% -> 28.78%     
client [57] (testset)   loss: 3.3675 -> 3.8426  accuracy: 27.74% -> 29.20%     
client [13] (testset)   loss: 4.6015 -> 4.8442  accuracy: 28.89% -> 29.63%     
client [43] (testset)   loss: 4.1687 -> 4.8070  accuracy: 30.00% -> 33.08%     
client [91] (testset)   loss: 3.9216 -> 4.4099  accuracy: 32.68% -> 26.80%     
client [10] (testset)   loss: 3.7008 -> 4.0189  accuracy: 28.81% -> 33.90%     
client [64] (testset)   loss: 3.8348 -> 4.9669  accuracy: 28.96% -> 20.77%     
client [82] (testset)   loss: 4.0702 -> 4.4941  accuracy: 24.63% -> 26.12%     
client [22] (testset)   loss: 4.4686 -> 4.8024  accuracy: 24.32% -> 24.32%     
---------------------------- TRAINING EPOCH: 200 ----------------------------  
client [20] (testset)   loss: 4.0562 -> 4.4071  accuracy: 31.62% -> 28.68%     
client [23] (testset)   loss: 4.1325 -> 4.5662  accuracy: 30.50% -> 23.40%     
client [88] (testset)   loss: 3.3350 -> 3.5897  accuracy: 32.03% -> 32.81%     
client [98] (testset)   loss: 4.2674 -> 4.5574  accuracy: 24.86% -> 27.68%     
client [79] (testset)   loss: 3.7618 -> 4.3491  accuracy: 33.57% -> 35.71%     
client [21] (testset)   loss: 3.6717 -> 4.3271  accuracy: 31.36% -> 29.66%     
client [92] (testset)   loss: 4.3391 -> 4.6153  accuracy: 25.00% -> 27.03%     
client [56] (testset)   loss: 4.3445 -> 4.9519  accuracy: 30.16% -> 28.57%     
client [5]  (testset)   loss: 3.9430 -> 4.6087  accuracy: 29.66% -> 27.59%     
client [52] (testset)   loss: 3.9070 -> 4.2337  accuracy: 29.57% -> 27.42%     
---------------------------- TRAINING EPOCH: 210 ----------------------------  
client [67] (testset)   loss: 3.6878 -> 3.9657  accuracy: 36.09% -> 37.87%     
client [54] (testset)   loss: 3.8854 -> 4.2067  accuracy: 30.56% -> 27.78%     
client [14] (testset)   loss: 3.8797 -> 4.5046  accuracy: 26.16% -> 26.16%     
client [99] (testset)   loss: 4.0960 -> 4.6723  accuracy: 24.68% -> 25.97%     
client [36] (testset)   loss: 3.1862 -> 4.0164  accuracy: 40.71% -> 37.17%     
client [30] (testset)   loss: 3.9278 -> 4.3368  accuracy: 27.61% -> 28.22%     
client [38] (testset)   loss: 4.0330 -> 4.3105  accuracy: 29.29% -> 34.34%     
client [15] (testset)   loss: 3.7352 -> 4.3944  accuracy: 26.67% -> 26.67%     
client [6]  (testset)   loss: 3.7510 -> 4.4005  accuracy: 25.42% -> 25.42%     
client [53] (testset)   loss: 4.3734 -> 4.5757  accuracy: 19.35% -> 23.23%     
---------------------------- TRAINING EPOCH: 220 ----------------------------  
client [99] (testset)   loss: 4.1363 -> 4.8441  accuracy: 26.62% -> 25.32%     
client [6]  (testset)   loss: 3.9117 -> 4.6256  accuracy: 26.27% -> 24.58%     
client [83] (testset)   loss: 4.2054 -> 4.6087  accuracy: 27.20% -> 32.80%     
client [42] (testset)   loss: 4.0088 -> 3.8864  accuracy: 31.16% -> 35.51%     
client [34] (testset)   loss: 4.9335 -> 5.5085  accuracy: 25.60% -> 28.80%     
client [15] (testset)   loss: 3.8793 -> 4.6095  accuracy: 27.22% -> 27.22%     
client [47] (testset)   loss: 3.8483 -> 4.2202  accuracy: 30.43% -> 27.54%     
client [55] (testset)   loss: 3.9366 -> 4.2032  accuracy: 27.59% -> 28.45%     
client [51] (testset)   loss: 3.7842 -> 4.2925  accuracy: 33.75% -> 27.50%     
client [95] (testset)   loss: 4.5261 -> 4.9504  accuracy: 26.51% -> 25.90%     
---------------------------- TRAINING EPOCH: 230 ----------------------------  
client [71] (testset)   loss: 3.7697 -> 4.1578  accuracy: 31.25% -> 26.56%     
client [15] (testset)   loss: 3.8427 -> 4.5266  accuracy: 27.22% -> 27.22%     
client [33] (testset)   loss: 3.7888 -> 3.6375  accuracy: 29.37% -> 32.54%     
client [99] (testset)   loss: 4.3109 -> 4.7632  accuracy: 27.27% -> 24.68%     
client [90] (testset)   loss: 3.4232 -> 3.4384  accuracy: 38.18% -> 41.82%     
client [57] (testset)   loss: 3.7362 -> 3.9696  accuracy: 29.93% -> 29.93%     
client [27] (testset)   loss: 3.2665 -> 3.4738  accuracy: 39.13% -> 40.00%     
client [78] (testset)   loss: 4.0206 -> 4.4273  accuracy: 28.06% -> 28.78%     
client [36] (testset)   loss: 3.3291 -> 3.9288  accuracy: 32.74% -> 33.63%     
client [88] (testset)   loss: 3.3869 -> 3.7179  accuracy: 33.59% -> 38.28%     
---------------------------- TRAINING EPOCH: 240 ----------------------------  
client [70] (testset)   loss: 4.4236 -> 5.1393  accuracy: 30.60% -> 27.87%     
client [35] (testset)   loss: 4.3180 -> 4.4952  accuracy: 25.61% -> 28.05%     
client [16] (testset)   loss: 3.9181 -> 4.4259  accuracy: 32.89% -> 33.56%     
client [80] (testset)   loss: 4.1696 -> 4.3356  accuracy: 26.35% -> 29.73%     
client [38] (testset)   loss: 4.1398 -> 4.4816  accuracy: 29.29% -> 36.36%     
client [78] (testset)   loss: 4.1209 -> 4.1763  accuracy: 30.22% -> 35.97%     
client [68] (testset)   loss: 3.9209 -> 4.0269  accuracy: 31.58% -> 31.58%     
client [11] (testset)   loss: 3.6331 -> 3.7485  accuracy: 30.40% -> 30.40%     
client [64] (testset)   loss: 4.1403 -> 4.6168  accuracy: 32.24% -> 31.15%     
client [82] (testset)   loss: 4.2819 -> 4.7784  accuracy: 26.87% -> 29.10%     
---------------------------- TRAINING EPOCH: 250 ----------------------------  
client [30] (testset)   loss: 4.0937 -> 4.6740  accuracy: 30.06% -> 26.99%     
client [27] (testset)   loss: 3.4853 -> 3.5776  accuracy: 36.52% -> 39.13%     
client [74] (testset)   loss: 4.7156 -> 4.5880  accuracy: 19.35% -> 28.23%     
client [45] (testset)   loss: 3.9927 -> 4.3523  accuracy: 29.38% -> 32.77%     
client [6]  (testset)   loss: 3.9423 -> 4.6330  accuracy: 28.81% -> 27.97%     
client [36] (testset)   loss: 3.2839 -> 3.9733  accuracy: 37.17% -> 35.40%     
client [63] (testset)   loss: 4.5741 -> 5.2552  accuracy: 29.89% -> 29.89%     
client [76] (testset)   loss: 4.0638 -> 4.4415  accuracy: 26.83% -> 27.64%     
client [83] (testset)   loss: 4.4317 -> 4.8293  accuracy: 24.00% -> 30.40%     
client [86] (testset)   loss: 4.0987 -> 4.5717  accuracy: 29.49% -> 36.54%     
---------------------------- TRAINING EPOCH: 260 ----------------------------  
client [83] (testset)   loss: 4.4583 -> 4.9202  accuracy: 22.40% -> 29.60%     
client [99] (testset)   loss: 4.4419 -> 5.2110  accuracy: 28.57% -> 25.32%     
client [74] (testset)   loss: 4.7569 -> 4.8389  accuracy: 17.74% -> 27.42%     
client [73] (testset)   loss: 4.2491 -> 4.9201  accuracy: 26.70% -> 32.95%     
client [29] (testset)   loss: 4.6869 -> 5.3250  accuracy: 25.31% -> 25.93%     
client [92] (testset)   loss: 4.5184 -> 4.7567  accuracy: 20.95% -> 29.05%     
client [6]  (testset)   loss: 4.0876 -> 4.9957  accuracy: 25.42% -> 25.42%     
client [61] (testset)   loss: 3.9608 -> 4.5962  accuracy: 28.25% -> 29.94%     
client [21] (testset)   loss: 3.9375 -> 4.4862  accuracy: 28.81% -> 31.36%     
client [67] (testset)   loss: 3.9806 -> 4.1833  accuracy: 37.28% -> 35.50%     
---------------------------- TRAINING EPOCH: 270 ----------------------------  
client [83] (testset)   loss: 4.4595 -> 4.9157  accuracy: 26.40% -> 29.60%     
client [32] (testset)   loss: 3.5812 -> 3.5349  accuracy: 37.80% -> 42.52%     
client [95] (testset)   loss: 4.6473 -> 4.8135  accuracy: 26.51% -> 25.90%     
client [61] (testset)   loss: 3.8042 -> 4.6467  accuracy: 31.07% -> 29.94%     
client [27] (testset)   loss: 3.3402 -> 3.5962  accuracy: 41.74% -> 40.00%     
client [25] (testset)   loss: 4.8082 -> 4.9207  accuracy: 26.34% -> 33.33%     
client [68] (testset)   loss: 4.0584 -> 4.2581  accuracy: 28.57% -> 29.32%     
client [34] (testset)   loss: 5.3371 -> 5.7011  accuracy: 28.00% -> 28.80%     
client [71] (testset)   loss: 3.8046 -> 4.2708  accuracy: 31.25% -> 28.12%     
client [89] (testset)   loss: 4.2382 -> 4.8956  accuracy: 30.00% -> 26.43%     
---------------------------- TRAINING EPOCH: 280 ----------------------------  
client [78] (testset)   loss: 4.3057 -> 4.3636  accuracy: 28.06% -> 33.09%     
client [81] (testset)   loss: 3.8874 -> 4.3211  accuracy: 34.38% -> 32.81%     
client [51] (testset)   loss: 3.9407 -> 4.2310  accuracy: 31.87% -> 31.25%     
client [54] (testset)   loss: 3.9957 -> 4.0873  accuracy: 29.86% -> 31.94%     
client [65] (testset)   loss: 4.4278 -> 4.9730  accuracy: 33.79% -> 35.17%     
client [41] (testset)   loss: 3.9063 -> 4.0228  accuracy: 31.05% -> 32.11%     
client [11] (testset)   loss: 3.6196 -> 3.7710  accuracy: 35.20% -> 31.20%     
client [85] (testset)   loss: 4.9296 -> 5.2724  accuracy: 29.81% -> 26.09%     
client [12] (testset)   loss: 4.9531 -> 5.2533  accuracy: 20.25% -> 23.42%     
client [23] (testset)   loss: 4.2177 -> 4.6260  accuracy: 29.08% -> 31.21%     
---------------------------- TRAINING EPOCH: 290 ----------------------------  
client [16] (testset)   loss: 4.1930 -> 4.5459  accuracy: 30.20% -> 33.56%     
client [65] (testset)   loss: 4.6223 -> 5.4186  accuracy: 31.03% -> 37.24%     
client [53] (testset)   loss: 4.6167 -> 4.8193  accuracy: 22.58% -> 25.16%     
client [58] (testset)   loss: 4.0803 -> 4.7308  accuracy: 34.84% -> 32.90%     
client [72] (testset)   loss: 4.2458 -> 4.7390  accuracy: 32.26% -> 29.68%     
client [7]  (testset)   loss: 4.5789 -> 5.3010  accuracy: 23.74% -> 30.94%     
client [71] (testset)   loss: 3.8145 -> 4.3259  accuracy: 34.38% -> 27.34%     
client [59] (testset)   loss: 4.2405 -> 4.5437  accuracy: 31.29% -> 34.97%     
client [86] (testset)   loss: 4.2264 -> 4.7559  accuracy: 30.77% -> 39.10%     
client [39] (testset)   loss: 4.1577 -> 4.5969  accuracy: 27.74% -> 29.93%     
---------------------------- TRAINING EPOCH: 300 ----------------------------  
client [99] (testset)   loss: 4.6448 -> 5.2995  accuracy: 25.97% -> 24.68%     
client [7]  (testset)   loss: 4.4476 -> 5.0436  accuracy: 30.22% -> 31.65%     
client [17] (testset)   loss: 4.4850 -> 4.7631  accuracy: 24.64% -> 30.43%     
client [64] (testset)   loss: 4.4656 -> 4.7245  accuracy: 30.60% -> 31.15%     
client [37] (testset)   loss: 4.3351 -> 4.5414  accuracy: 27.74% -> 30.32%     
client [29] (testset)   loss: 4.6024 -> 5.3543  accuracy: 27.78% -> 25.93%     
client [93] (testset)   loss: 5.0002 -> 5.1622  accuracy: 28.26% -> 30.43%     
client [73] (testset)   loss: 4.3601 -> 5.0324  accuracy: 28.41% -> 31.25%     
client [40] (testset)   loss: 4.6588 -> 5.0271  accuracy: 24.40% -> 25.00%     
client [76] (testset)   loss: 4.2645 -> 4.8111  accuracy: 26.02% -> 21.95%     
---------------------------- TRAINING EPOCH: 310 ----------------------------  
client [31] (testset)   loss: 4.1745 -> 4.6199  accuracy: 34.43% -> 34.43%     
client [89] (testset)   loss: 4.4622 -> 5.0980  accuracy: 29.29% -> 26.43%     
client [77] (testset)   loss: 4.4131 -> 4.5263  accuracy: 25.87% -> 26.57%     
client [90] (testset)   loss: 3.8707 -> 4.0059  accuracy: 35.76% -> 40.00%     
client [26] (testset)   loss: 4.2671 -> 4.6426  accuracy: 31.51% -> 35.62%     
client [50] (testset)   loss: 4.6886 -> 4.6430  accuracy: 32.05% -> 32.69%     
client [30] (testset)   loss: 4.4049 -> 5.0044  accuracy: 27.61% -> 30.06%     
client [70] (testset)   loss: 4.7201 -> 5.5039  accuracy: 27.87% -> 26.78%     
client [41] (testset)   loss: 4.1020 -> 4.3827  accuracy: 28.95% -> 32.11%     
client [99] (testset)   loss: 4.7244 -> 5.2413  accuracy: 26.62% -> 24.68%     
---------------------------- TRAINING EPOCH: 320 ----------------------------  
client [68] (testset)   loss: 4.0906 -> 4.4590  accuracy: 30.83% -> 33.08%     
client [70] (testset)   loss: 4.7723 -> 5.4928  accuracy: 31.15% -> 28.42%     
client [52] (testset)   loss: 4.5632 -> 4.7458  accuracy: 26.88% -> 27.96%     
client [1]  (testset)   loss: 4.1158 -> 4.3479  accuracy: 37.96% -> 38.69%     
client [2]  (testset)   loss: 3.6549 -> 4.0206  accuracy: 34.08% -> 33.52%     
client [67] (testset)   loss: 4.0892 -> 4.3937  accuracy: 38.46% -> 38.46%     
client [92] (testset)   loss: 4.8163 -> 5.1342  accuracy: 22.97% -> 29.73%     
client [35] (testset)   loss: 4.4519 -> 4.4209  accuracy: 32.32% -> 31.71%     
client [36] (testset)   loss: 3.3635 -> 3.8632  accuracy: 38.05% -> 38.05%     
client [64] (testset)   loss: 4.6643 -> 4.9915  accuracy: 27.32% -> 28.96%     
---------------------------- TRAINING EPOCH: 330 ----------------------------  
client [44] (testset)   loss: 3.9631 -> 4.3697  accuracy: 37.58% -> 34.90%     
client [6]  (testset)   loss: 4.4032 -> 5.1761  accuracy: 27.12% -> 25.42%     
client [12] (testset)   loss: 5.5875 -> 6.0207  accuracy: 22.15% -> 20.89%     
client [55] (testset)   loss: 4.4702 -> 4.6995  accuracy: 31.03% -> 27.59%     
client [29] (testset)   loss: 5.0884 -> 5.9773  accuracy: 26.54% -> 26.54%     
client [9]  (testset)   loss: 5.2453 -> 5.6542  accuracy: 23.61% -> 25.69%     
client [43] (testset)   loss: 4.9080 -> 5.5701  accuracy: 26.15% -> 26.92%     
client [77] (testset)   loss: 4.5009 -> 4.6956  accuracy: 30.07% -> 32.17%     
client [98] (testset)   loss: 5.1647 -> 5.1173  accuracy: 25.42% -> 27.68%     
client [78] (testset)   loss: 4.5187 -> 4.7989  accuracy: 29.50% -> 32.37%     
---------------------------- TRAINING EPOCH: 340 ----------------------------  
client [92] (testset)   loss: 5.1991 -> 5.4001  accuracy: 22.30% -> 25.00%     
client [80] (testset)   loss: 4.6573 -> 4.6722  accuracy: 27.70% -> 29.73%     
client [63] (testset)   loss: 4.9837 -> 5.7485  accuracy: 29.31% -> 32.76%     
client [76] (testset)   loss: 4.5612 -> 5.0523  accuracy: 27.64% -> 26.83%     
client [78] (testset)   loss: 4.5437 -> 4.8360  accuracy: 30.94% -> 30.94%     
client [25] (testset)   loss: 4.9070 -> 5.1452  accuracy: 29.03% -> 35.48%     
client [58] (testset)   loss: 4.3739 -> 5.2582  accuracy: 36.13% -> 32.26%     
client [13] (testset)   loss: 5.3853 -> 5.6027  accuracy: 25.19% -> 30.37%     
client [17] (testset)   loss: 4.5901 -> 4.8881  accuracy: 27.54% -> 31.16%     
client [38] (testset)   loss: 4.5658 -> 4.7048  accuracy: 28.79% -> 34.85%     
---------------------------- TRAINING EPOCH: 350 ----------------------------  
client [72] (testset)   loss: 4.7009 -> 5.1739  accuracy: 31.61% -> 29.68%     
client [82] (testset)   loss: 5.1657 -> 5.5547  accuracy: 24.63% -> 29.85%     
client [86] (testset)   loss: 4.7747 -> 5.1848  accuracy: 31.41% -> 36.54%     
client [51] (testset)   loss: 4.0650 -> 4.7250  accuracy: 31.87% -> 31.87%     
client [96] (testset)   loss: 4.8580 -> 5.2435  accuracy: 30.97% -> 33.55%     
client [42] (testset)   loss: 4.7405 -> 4.7374  accuracy: 33.33% -> 34.06%     
client [55] (testset)   loss: 4.7291 -> 4.9619  accuracy: 33.62% -> 29.31%     
client [13] (testset)   loss: 5.7267 -> 5.9219  accuracy: 28.15% -> 28.15%     
client [1]  (testset)   loss: 4.2658 -> 4.7205  accuracy: 38.69% -> 39.42%     
client [12] (testset)   loss: 5.8659 -> 6.0182  accuracy: 23.42% -> 24.68%     
---------------------------- TRAINING EPOCH: 360 ----------------------------  
client [68] (testset)   loss: 4.2263 -> 4.5232  accuracy: 29.32% -> 33.08%     
client [23] (testset)   loss: 4.7927 -> 5.0587  accuracy: 29.08% -> 26.95%     
client [46] (testset)   loss: 5.4561 -> 5.9079  accuracy: 23.26% -> 23.26%     
client [41] (testset)   loss: 4.2031 -> 4.6283  accuracy: 30.53% -> 32.11%     
client [25] (testset)   loss: 4.8509 -> 5.1838  accuracy: 31.18% -> 34.41%     
client [58] (testset)   loss: 4.5753 -> 5.0814  accuracy: 36.77% -> 37.42%     
client [14] (testset)   loss: 4.8599 -> 5.0665  accuracy: 27.33% -> 30.81%     
client [33] (testset)   loss: 4.2452 -> 4.2687  accuracy: 26.19% -> 36.51%     
client [85] (testset)   loss: 5.4089 -> 5.9403  accuracy: 27.33% -> 27.33%     
client [62] (testset)   loss: 4.8146 -> 5.0143  accuracy: 26.04% -> 30.18%     
---------------------------- TRAINING EPOCH: 370 ----------------------------  
client [98] (testset)   loss: 5.0532 -> 5.2636  accuracy: 26.55% -> 29.94%     
client [63] (testset)   loss: 5.3667 -> 5.8807  accuracy: 31.61% -> 30.46%     
client [70] (testset)   loss: 5.1732 -> 5.7123  accuracy: 28.96% -> 32.79%     
client [65] (testset)   loss: 5.2733 -> 5.7639  accuracy: 30.34% -> 32.41%     
client [14] (testset)   loss: 4.9075 -> 5.3248  accuracy: 27.91% -> 30.23%     
client [73] (testset)   loss: 4.9496 -> 5.7422  accuracy: 27.27% -> 31.82%     
client [34] (testset)   loss: 6.1152 -> 6.5105  accuracy: 27.20% -> 28.00%     
client [99] (testset)   loss: 5.1454 -> 5.7589  accuracy: 26.62% -> 25.97%     
client [69] (testset)   loss: 4.9343 -> 5.5274  accuracy: 36.59% -> 34.96%     
client [46] (testset)   loss: 5.4623 -> 6.0727  accuracy: 25.00% -> 25.00%     
---------------------------- TRAINING EPOCH: 380 ----------------------------  
client [99] (testset)   loss: 5.2351 -> 5.9304  accuracy: 27.27% -> 25.97%     
client [93] (testset)   loss: 5.6632 -> 5.7934  accuracy: 28.26% -> 31.88%     
client [11] (testset)   loss: 4.3159 -> 4.4557  accuracy: 27.20% -> 30.40%     
client [58] (testset)   loss: 4.7314 -> 5.0931  accuracy: 34.84% -> 36.77%     
client [81] (testset)   loss: 4.5832 -> 4.9040  accuracy: 33.85% -> 36.46%     
client [85] (testset)   loss: 5.7112 -> 6.4112  accuracy: 28.57% -> 25.47%     
client [89] (testset)   loss: 4.7351 -> 5.3218  accuracy: 29.29% -> 25.71%     
client [45] (testset)   loss: 4.8768 -> 5.0888  accuracy: 27.12% -> 30.51%     
client [8]  (testset)   loss: 5.7018 -> 6.0379  accuracy: 28.97% -> 32.41%     
client [68] (testset)   loss: 4.5706 -> 4.9104  accuracy: 33.08% -> 32.33%     
---------------------------- TRAINING EPOCH: 390 ----------------------------  
client [67] (testset)   loss: 4.4304 -> 5.0057  accuracy: 39.05% -> 35.50%     
client [72] (testset)   loss: 4.9588 -> 5.3072  accuracy: 29.68% -> 32.90%     
client [1]  (testset)   loss: 4.5846 -> 4.9349  accuracy: 39.42% -> 37.23%     
client [78] (testset)   loss: 4.9023 -> 5.5892  accuracy: 29.50% -> 32.37%     
client [83] (testset)   loss: 5.2433 -> 5.5320  accuracy: 26.40% -> 28.00%     
client [21] (testset)   loss: 4.7658 -> 5.1451  accuracy: 34.75% -> 32.20%     
client [56] (testset)   loss: 5.3154 -> 5.5638  accuracy: 30.95% -> 30.16%     
client [44] (testset)   loss: 4.3816 -> 4.6419  accuracy: 36.91% -> 35.57%     
client [92] (testset)   loss: 5.5027 -> 5.7867  accuracy: 24.32% -> 26.35%     
client [27] (testset)   loss: 3.8697 -> 4.1990  accuracy: 39.13% -> 35.65%     
---------------------------- TRAINING EPOCH: 400 ----------------------------  
client [10] (testset)   loss: 4.7027 -> 5.1192  accuracy: 33.90% -> 35.03%     
client [39] (testset)   loss: 4.4831 -> 4.7599  accuracy: 27.74% -> 28.47%     
client [65] (testset)   loss: 5.2733 -> 6.0756  accuracy: 34.48% -> 31.72%     
client [26] (testset)   loss: 5.0917 -> 5.5164  accuracy: 29.45% -> 30.82%     
client [19] (testset)   loss: 5.5365 -> 6.1333  accuracy: 24.81% -> 25.56%     
client [68] (testset)   loss: 4.5777 -> 4.9797  accuracy: 33.83% -> 34.59%     
client [41] (testset)   loss: 4.6252 -> 5.0243  accuracy: 32.63% -> 32.63%     
client [50] (testset)   loss: 4.8103 -> 4.9068  accuracy: 32.05% -> 35.90%     
client [75] (testset)   loss: 5.2190 -> 5.6345  accuracy: 27.86% -> 30.00%     
client [81] (testset)   loss: 4.6032 -> 4.8853  accuracy: 34.38% -> 34.90%     
Training... ---------------------------------------- 100% 0:12:34
FedOBP's average time taken by each global epoch: 0 min 1.87 sec.              
FedOBP's total running time: 0 h 12 m 34 s.                                    
==================== FedOBP Experiment Results: ====================           
Display format: (before local fine-tuning) -> (after local fine-tuning)        
 So if finetune_epoch = 0, x.xx% -> 0.00% is normal.                           
 Centralized testing ONLY happens after model aggregation, so the stats between
'->' are the same.                                                             
{                                                                              
    "100": {                                                                   
        "all_clients": {                                                       
            "test": {                                                          
                "loss": "3.4101 -> 0.0000",                                    
                "accuracy": "27.74% -> 0.00%"                                  
            }                                                                  
        }                                                                      
    },                                                                         
    "200": {                                                                   
        "all_clients": {                                                       
            "test": {                                                          
                "loss": "3.9644 -> 0.0000",                                    
                "accuracy": "28.88% -> 0.00%"                                  
            }                                                                  
        }                                                                      
    },                                                                         
    "300": {                                                                   
        "all_clients": {                                                       
            "test": {                                                          
                "loss": "4.3866 -> 0.0000",                                    
                "accuracy": "29.20% -> 0.00%"                                  
            }                                                                  
        }                                                                      
    },                                                                         
    "400": {                                                                   
        "all_clients": {                                                       
            "test": {                                                          
                "loss": "5.0819 -> 0.0000",                                    
                "accuracy": "29.53% -> 0.00%"                                  
            }                                                                  
        }                                                                      
    }                                                                          
}                                                                              
==================== FedOBP Max Accuracy ====================                  
all_clients:                                                                   
(test) before fine-tuning: 29.53% at epoch 400                                 
(test) after fine-tuning: 0.00% at epoch 100                                   
[0m