out\fedobp\fmnist\Main_GlobalNorm_EMAscore(0.5)_ALL_IG_0.9992
==================== FedOBP ====================                               
Experiment Arguments:                                                          
{
│   'method': 'fedobp',
│   'dataset': {
│   │   'name': 'fmnist',
│   │   'client_num': 100,
│   │   'test_ratio': 0.25,
│   │   'val_ratio': 0.0,
│   │   'seed': 42,
│   │   'split': 'sample',
│   │   'IID_ratio': 0.0,
│   │   'monitor_window_name_suffix': 'fmnist-100clients-0%IID-Dir(0.5)-seed42',
│   │   'alpha': 0.5,
│   │   'min_samples_per_client': 10
│   },
│   'model': {
│   │   'name': 'avgcnn',
│   │   'use_torchvision_pretrained_weights': True,
│   │   'external_model_weights_path': None
│   },
│   'optimizer': {
│   │   'lr': 0.01,
│   │   'dampening': 0,
│   │   'weight_decay': 0,
│   │   'momentum': 0,
│   │   'nesterov': False,
│   │   'name': 'sgd'
│   },
│   'mode': 'serial',
│   'parallel': {
│   │   'ray_cluster_addr': None,
│   │   'num_cpus': None,
│   │   'num_gpus': None,
│   │   'num_workers': 2
│   },
│   'common': {
│   │   'seed': 42,
│   │   'join_ratio': 0.1,
│   │   'global_epoch': 400,
│   │   'local_epoch': 5,
│   │   'batch_size': 32,
│   │   'reset_optimizer_on_global_epoch': True,
│   │   'straggler_ratio': 0,
│   │   'straggler_min_local_epoch': 0,
│   │   'buffers': 'global',
│   │   'client_side_evaluation': True,
│   │   'test': {
│   │   │   'client': {
│   │   │   │   'interval': 100,
│   │   │   │   'finetune_epoch': 0,
│   │   │   │   'train': False,
│   │   │   │   'val': False,
│   │   │   │   'test': True
│   │   │   },
│   │   │   'server': {
│   │   │   │   'interval': -1,
│   │   │   │   'train': False,
│   │   │   │   'val': False,
│   │   │   │   'test': False,
│   │   │   │   'model_in_train_mode': False
│   │   │   }
│   │   },
│   │   'verbose_gap': 10,
│   │   'monitor': None,
│   │   'use_cuda': True,
│   │   'save_log': True,
│   │   'save_model': False,
│   │   'save_learning_curve_plot': False,
│   │   'save_metrics': True,
│   │   'delete_useless_run': True
│   },
│   'fedobp': {
│   │   'ig_ratio': 0.9992,
│   │   'alpha': 0.5,
│   │   'norm': 'global',
│   │   'EMA': True,
│   │   'CLS': False,
│   │   'track': False,
│   │   'type': 'Main'
│   }
}
---------------------------- TRAINING EPOCH: 10 ----------------------------   
client [77] (testset)   loss: 0.5055 -> 0.4766  accuracy: 83.43% -> 84.00%     
client [81] (testset)   loss: 0.4134 -> 0.3341  accuracy: 84.75% -> 86.44%     
client [21] (testset)   loss: 0.6616 -> 0.4633  accuracy: 79.87% -> 85.53%     
client [68] (testset)   loss: 1.1465 -> 0.5540  accuracy: 49.07% -> 78.26%     
client [93] (testset)   loss: 0.9420 -> 1.0811  accuracy: 60.14% -> 58.39%     
client [31] (testset)   loss: 0.7041 -> 0.5572  accuracy: 74.50% -> 80.54%     
client [20] (testset)   loss: 0.3673 -> 0.3019  accuracy: 86.12% -> 87.76%     
client [59] (testset)   loss: 0.5589 -> 0.5665  accuracy: 83.33% -> 82.41%     
client [48] (testset)   loss: 0.9085 -> 0.6906  accuracy: 65.04% -> 72.36%     
client [34] (testset)   loss: 0.4902 -> 0.5795  accuracy: 83.61% -> 73.77%     
---------------------------- TRAINING EPOCH: 20 ----------------------------   
client [69] (testset)   loss: 0.4723 -> 0.4178  accuracy: 80.95% -> 86.39%     
client [99] (testset)   loss: 0.3451 -> 0.2301  accuracy: 89.42% -> 95.19%     
client [67] (testset)   loss: 0.4538 -> 0.4731  accuracy: 83.12% -> 80.95%     
client [0]  (testset)   loss: 0.5421 -> 0.5444  accuracy: 82.99% -> 80.91%     
client [76] (testset)   loss: 0.6313 -> 0.6051  accuracy: 75.57% -> 73.28%     
client [41] (testset)   loss: 0.4920 -> 0.2137  accuracy: 83.90% -> 90.73%     
client [62] (testset)   loss: 0.4995 -> 0.3209  accuracy: 80.15% -> 88.55%     
client [2]  (testset)   loss: 0.8954 -> 0.3807  accuracy: 63.40% -> 88.89%     
client [14] (testset)   loss: 0.4306 -> 0.4252  accuracy: 84.23% -> 83.82%     
client [46] (testset)   loss: 0.6008 -> 0.4678  accuracy: 77.78% -> 83.33%     
---------------------------- TRAINING EPOCH: 30 ----------------------------   
client [24] (testset)   loss: 0.5157 -> 0.4113  accuracy: 81.53% -> 82.43%     
client [68] (testset)   loss: 0.5801 -> 0.4366  accuracy: 77.02% -> 84.16%     
client [57] (testset)   loss: 0.2761 -> 0.2274  accuracy: 92.88% -> 92.20%     
client [17] (testset)   loss: 0.3675 -> 0.3489  accuracy: 89.73% -> 91.78%     
client [54] (testset)   loss: 0.4887 -> 0.5567  accuracy: 78.35% -> 77.32%     
client [23] (testset)   loss: 0.6538 -> 0.4388  accuracy: 71.43% -> 84.29%     
client [35] (testset)   loss: 0.2294 -> 0.2151  accuracy: 92.26% -> 91.61%     
client [59] (testset)   loss: 0.2895 -> 0.8387  accuracy: 91.67% -> 76.85%     
client [31] (testset)   loss: 0.4321 -> 0.4581  accuracy: 83.89% -> 83.89%     
client [9]  (testset)   loss: 0.2134 -> 0.1240  accuracy: 91.98% -> 96.26%     
---------------------------- TRAINING EPOCH: 40 ----------------------------   
client [64] (testset)   loss: 0.2516 -> 0.1795  accuracy: 90.79% -> 92.47%     
client [33] (testset)   loss: 0.4172 -> 0.4044  accuracy: 83.47% -> 85.54%     
client [16] (testset)   loss: 0.4263 -> 0.3568  accuracy: 87.97% -> 90.98%     
client [44] (testset)   loss: 0.6011 -> 0.4993  accuracy: 80.06% -> 82.83%     
client [8]  (testset)   loss: 0.2790 -> 0.1862  accuracy: 89.22% -> 94.12%     
client [31] (testset)   loss: 0.3581 -> 0.3286  accuracy: 84.56% -> 86.58%     
client [47] (testset)   loss: 0.4173 -> 0.2543  accuracy: 87.96% -> 92.13%     
client [36] (testset)   loss: 0.2344 -> 0.2080  accuracy: 92.17% -> 93.09%     
client [20] (testset)   loss: 0.2506 -> 0.2511  accuracy: 91.02% -> 89.39%     
client [56] (testset)   loss: 0.4810 -> 0.5153  accuracy: 82.65% -> 82.14%     
---------------------------- TRAINING EPOCH: 50 ----------------------------   
client [4]  (testset)   loss: 0.5447 -> 0.5299  accuracy: 81.45% -> 77.42%     
client [60] (testset)   loss: 0.3051 -> 0.1747  accuracy: 90.00% -> 95.33%     
client [28] (testset)   loss: 0.5565 -> 0.4124  accuracy: 78.48% -> 85.20%     
client [25] (testset)   loss: 0.3432 -> 0.3028  accuracy: 86.64% -> 89.69%     
client [58] (testset)   loss: 0.6033 -> 0.4164  accuracy: 75.69% -> 81.77%     
client [44] (testset)   loss: 0.6646 -> 0.5049  accuracy: 73.13% -> 82.27%     
client [39] (testset)   loss: 0.3156 -> 0.4270  accuracy: 85.82% -> 79.85%     
client [29] (testset)   loss: 0.5450 -> 0.4919  accuracy: 82.22% -> 85.56%     
client [3]  (testset)   loss: 0.2991 -> 0.2895  accuracy: 88.46% -> 89.74%     
client [84] (testset)   loss: 0.3919 -> 0.2944  accuracy: 87.63% -> 91.24%     
---------------------------- TRAINING EPOCH: 60 ----------------------------   
client [21] (testset)   loss: 0.5259 -> 0.3316  accuracy: 82.39% -> 88.05%     
client [84] (testset)   loss: 0.2664 -> 0.2727  accuracy: 93.30% -> 91.75%     
client [10] (testset)   loss: 0.1652 -> 0.3746  accuracy: 95.68% -> 91.37%     
client [36] (testset)   loss: 0.2066 -> 0.1609  accuracy: 93.09% -> 94.93%     
client [65] (testset)   loss: 0.3174 -> 0.2652  accuracy: 86.76% -> 88.97%     
client [81] (testset)   loss: 0.2297 -> 0.1540  accuracy: 93.22% -> 94.92%     
client [79] (testset)   loss: 0.4319 -> 0.3983  accuracy: 83.12% -> 79.87%     
client [42] (testset)   loss: 0.3513 -> 0.3035  accuracy: 87.67% -> 89.43%     
client [11] (testset)   loss: 0.1771 -> 0.1766  accuracy: 95.83% -> 95.24%     
client [96] (testset)   loss: 0.4013 -> 0.3756  accuracy: 85.15% -> 86.90%     
---------------------------- TRAINING EPOCH: 70 ----------------------------   
client [8]  (testset)   loss: 0.2878 -> 0.1857  accuracy: 90.20% -> 94.12%     
client [53] (testset)   loss: 0.3063 -> 0.2878  accuracy: 92.65% -> 90.44%     
client [52] (testset)   loss: 0.2331 -> 0.1965  accuracy: 93.33% -> 90.00%     
client [42] (testset)   loss: 0.3260 -> 0.2979  accuracy: 87.67% -> 88.11%     
client [69] (testset)   loss: 0.3429 -> 0.3384  accuracy: 87.76% -> 85.71%     
client [59] (testset)   loss: 0.1951 -> 0.1954  accuracy: 93.52% -> 94.44%     
client [7]  (testset)   loss: 0.2759 -> 0.2251  accuracy: 92.59% -> 93.00%     
client [26] (testset)   loss: 0.2206 -> 0.0826  accuracy: 90.91% -> 97.40%     
client [49] (testset)   loss: 0.4816 -> 0.5030  accuracy: 85.52% -> 86.21%     
client [98] (testset)   loss: 0.1731 -> 0.1570  accuracy: 94.16% -> 94.85%     
---------------------------- TRAINING EPOCH: 80 ----------------------------   
client [98] (testset)   loss: 0.1707 -> 0.1663  accuracy: 94.85% -> 94.16%     
client [47] (testset)   loss: 0.3284 -> 0.2147  accuracy: 91.20% -> 92.13%     
client [21] (testset)   loss: 0.3883 -> 0.3162  accuracy: 84.91% -> 89.31%     
client [77] (testset)   loss: 0.2768 -> 0.2990  accuracy: 92.00% -> 87.43%     
client [95] (testset)   loss: 0.4649 -> 0.4367  accuracy: 84.76% -> 83.81%     
client [91] (testset)   loss: 0.2063 -> 0.2239  accuracy: 93.04% -> 94.94%     
client [14] (testset)   loss: 0.2458 -> 0.2293  accuracy: 89.63% -> 90.46%     
client [99] (testset)   loss: 0.1760 -> 0.1583  accuracy: 95.19% -> 95.19%     
client [20] (testset)   loss: 0.2206 -> 0.1811  accuracy: 93.06% -> 94.29%     
client [39] (testset)   loss: 0.2933 -> 0.3099  accuracy: 85.07% -> 86.57%     
---------------------------- TRAINING EPOCH: 90 ----------------------------   
client [52] (testset)   loss: 0.1979 -> 0.2101  accuracy: 94.67% -> 92.00%     
client [62] (testset)   loss: 0.2104 -> 0.2174  accuracy: 90.08% -> 91.60%     
client [71] (testset)   loss: 0.5696 -> 0.6861  accuracy: 81.25% -> 84.38%     
client [97] (testset)   loss: 0.2448 -> 0.2387  accuracy: 92.11% -> 92.11%     
client [30] (testset)   loss: 0.3843 -> 0.3926  accuracy: 84.62% -> 84.62%     
client [88] (testset)   loss: 0.3380 -> 0.3064  accuracy: 89.93% -> 90.60%     
client [60] (testset)   loss: 0.1510 -> 0.1378  accuracy: 96.67% -> 94.67%     
client [82] (testset)   loss: 0.2698 -> 0.3702  accuracy: 90.68% -> 83.90%     
client [91] (testset)   loss: 0.1775 -> 0.2220  accuracy: 93.67% -> 94.94%     
client [57] (testset)   loss: 0.2173 -> 0.1912  accuracy: 93.90% -> 94.92%     
---------------------------- TRAINING EPOCH: 100 ----------------------------  
client [31] (testset)   loss: 0.2250 -> 1.4065  accuracy: 89.26% -> 67.11%     
client [15] (testset)   loss: 0.2203 -> 0.1776  accuracy: 90.91% -> 92.42%     
client [71] (testset)   loss: 0.5099 -> 0.6139  accuracy: 81.25% -> 78.12%     
client [97] (testset)   loss: 0.3017 -> 0.2016  accuracy: 92.11% -> 94.74%     
client [53] (testset)   loss: 0.2832 -> 0.2717  accuracy: 92.65% -> 92.65%     
client [77] (testset)   loss: 0.3235 -> 0.2751  accuracy: 86.86% -> 90.86%     
client [76] (testset)   loss: 0.3625 -> 0.2851  accuracy: 85.50% -> 89.69%     
client [79] (testset)   loss: 0.4263 -> 0.3949  accuracy: 81.17% -> 84.42%     
client [28] (testset)   loss: 0.4028 -> 0.3481  accuracy: 84.75% -> 88.34%     
client [99] (testset)   loss: 0.1185 -> 0.1443  accuracy: 97.12% -> 97.12%     
---------------------------- TRAINING EPOCH: 110 ----------------------------  
client [97] (testset)   loss: 0.2333 -> 0.1840  accuracy: 93.86% -> 93.86%     
client [86] (testset)   loss: 0.4363 -> 0.5027  accuracy: 82.97% -> 82.53%     
client [34] (testset)   loss: 0.2354 -> 0.3017  accuracy: 91.26% -> 86.34%     
client [73] (testset)   loss: 0.1893 -> 0.2116  accuracy: 91.86% -> 95.02%     
client [5]  (testset)   loss: 0.2166 -> 0.2288  accuracy: 92.88% -> 92.20%     
client [96] (testset)   loss: 0.3299 -> 0.3548  accuracy: 89.08% -> 89.08%     
client [22] (testset)   loss: 0.2837 -> 0.3053  accuracy: 92.68% -> 91.06%     
client [60] (testset)   loss: 0.1380 -> 0.1338  accuracy: 96.67% -> 96.00%     
client [66] (testset)   loss: 0.1353 -> 0.1163  accuracy: 92.92% -> 95.58%     
client [83] (testset)   loss: 0.2812 -> 0.2593  accuracy: 89.41% -> 91.76%     
---------------------------- TRAINING EPOCH: 120 ----------------------------  
client [76] (testset)   loss: 0.3177 -> 0.2852  accuracy: 87.79% -> 88.93%     
client [65] (testset)   loss: 0.2861 -> 0.2361  accuracy: 87.50% -> 86.76%     
client [95] (testset)   loss: 0.4481 -> 0.3942  accuracy: 85.71% -> 87.62%     
client [17] (testset)   loss: 0.2534 -> 0.2596  accuracy: 91.10% -> 92.47%     
client [8]  (testset)   loss: 0.1969 -> 0.1458  accuracy: 92.16% -> 94.12%     
client [35] (testset)   loss: 0.1514 -> 0.1758  accuracy: 93.55% -> 92.26%     
client [98] (testset)   loss: 0.1557 -> 0.1944  accuracy: 94.85% -> 93.47%     
client [53] (testset)   loss: 0.2591 -> 0.3621  accuracy: 92.65% -> 86.76%     
client [43] (testset)   loss: 0.3177 -> 0.2954  accuracy: 86.70% -> 87.61%     
client [64] (testset)   loss: 0.1804 -> 0.1653  accuracy: 92.47% -> 94.14%     
---------------------------- TRAINING EPOCH: 130 ----------------------------  
client [21] (testset)   loss: 0.3603 -> 0.3083  accuracy: 87.42% -> 88.68%     
client [88] (testset)   loss: 0.3318 -> 0.2869  accuracy: 90.60% -> 90.60%     
client [38] (testset)   loss: 0.2260 -> 0.1936  accuracy: 92.57% -> 93.92%     
client [3]  (testset)   loss: 0.2621 -> 0.2664  accuracy: 92.31% -> 92.31%     
client [5]  (testset)   loss: 0.2127 -> 0.2083  accuracy: 93.22% -> 93.22%     
client [41] (testset)   loss: 0.1269 -> 0.4246  accuracy: 94.63% -> 83.90%     
client [7]  (testset)   loss: 0.2613 -> 0.2275  accuracy: 93.00% -> 92.59%     
client [37] (testset)   loss: 0.3060 -> 0.2896  accuracy: 89.35% -> 91.12%     
client [45] (testset)   loss: 0.1885 -> 0.1425  accuracy: 92.78% -> 94.44%     
client [47] (testset)   loss: 0.2763 -> 0.1937  accuracy: 92.59% -> 93.52%     
---------------------------- TRAINING EPOCH: 140 ----------------------------  
client [16] (testset)   loss: 0.3110 -> 0.3333  accuracy: 91.73% -> 90.23%     
client [11] (testset)   loss: 0.1444 -> 0.1570  accuracy: 95.24% -> 95.24%     
client [37] (testset)   loss: 0.3155 -> 0.2955  accuracy: 89.94% -> 89.94%     
client [41] (testset)   loss: 0.1175 -> 0.0823  accuracy: 97.07% -> 98.05%     
client [95] (testset)   loss: 0.4171 -> 0.3796  accuracy: 86.67% -> 88.57%     
client [53] (testset)   loss: 0.2196 -> 0.2604  accuracy: 94.85% -> 91.18%     
client [22] (testset)   loss: 0.2690 -> 0.2963  accuracy: 89.43% -> 89.43%     
client [25] (testset)   loss: 0.2996 -> 0.3352  accuracy: 89.69% -> 88.55%     
client [69] (testset)   loss: 0.2854 -> 0.3498  accuracy: 91.16% -> 85.71%     
client [46] (testset)   loss: 0.2823 -> 0.3041  accuracy: 89.22% -> 89.54%     
---------------------------- TRAINING EPOCH: 150 ----------------------------  
client [47] (testset)   loss: 0.2809 -> 0.1886  accuracy: 91.67% -> 93.06%     
client [69] (testset)   loss: 0.2865 -> 0.3272  accuracy: 90.48% -> 86.39%     
client [82] (testset)   loss: 0.2621 -> 0.2265  accuracy: 90.68% -> 91.53%     
client [45] (testset)   loss: 0.2101 -> 0.1960  accuracy: 93.33% -> 93.33%     
client [7]  (testset)   loss: 0.2245 -> 0.2120  accuracy: 93.83% -> 95.47%     
client [50] (testset)   loss: 0.2214 -> 0.1917  accuracy: 94.04% -> 94.04%     
client [35] (testset)   loss: 0.2283 -> 0.1565  accuracy: 91.61% -> 94.19%     
client [24] (testset)   loss: 0.2860 -> 0.2538  accuracy: 89.19% -> 90.54%     
client [15] (testset)   loss: 0.1768 -> 0.1840  accuracy: 92.42% -> 92.42%     
client [58] (testset)   loss: 0.4170 -> 0.4423  accuracy: 83.98% -> 83.43%     
---------------------------- TRAINING EPOCH: 160 ----------------------------  
client [48] (testset)   loss: 0.5253 -> 0.6048  accuracy: 82.93% -> 80.49%     
client [76] (testset)   loss: 0.2919 -> 0.3385  accuracy: 88.17% -> 86.64%     
client [67] (testset)   loss: 0.1923 -> 0.1894  accuracy: 93.94% -> 94.37%     
client [37] (testset)   loss: 0.3295 -> 0.2776  accuracy: 89.35% -> 91.12%     
client [58] (testset)   loss: 0.4391 -> 0.4353  accuracy: 81.77% -> 81.22%     
client [64] (testset)   loss: 0.1879 -> 0.1398  accuracy: 92.47% -> 94.56%     
client [77] (testset)   loss: 0.2900 -> 0.2333  accuracy: 88.57% -> 92.57%     
client [55] (testset)   loss: 0.1628 -> 0.1672  accuracy: 93.40% -> 92.89%     
client [12] (testset)   loss: 0.2312 -> 0.2924  accuracy: 93.04% -> 90.51%     
client [89] (testset)   loss: 0.1087 -> 0.0719  accuracy: 96.40% -> 97.12%     
---------------------------- TRAINING EPOCH: 170 ----------------------------  
client [84] (testset)   loss: 0.2122 -> 0.2481  accuracy: 92.78% -> 92.27%     
client [51] (testset)   loss: 0.1007 -> 0.1006  accuracy: 95.82% -> 96.58%     
client [8]  (testset)   loss: 0.1604 -> 0.1614  accuracy: 91.18% -> 94.12%     
client [18] (testset)   loss: 0.1930 -> 0.1623  accuracy: 93.89% -> 95.42%     
client [94] (testset)   loss: 0.1642 -> 0.1770  accuracy: 93.17% -> 91.93%     
client [81] (testset)   loss: 0.1171 -> 0.0959  accuracy: 94.92% -> 98.31%     
client [3]  (testset)   loss: 0.2366 -> 0.2315  accuracy: 92.31% -> 92.31%     
client [11] (testset)   loss: 0.1421 -> 0.1443  accuracy: 95.83% -> 95.83%     
client [95] (testset)   loss: 0.4077 -> 0.3786  accuracy: 87.62% -> 90.48%     
client [67] (testset)   loss: 0.1899 -> 0.1844  accuracy: 93.07% -> 93.94%     
---------------------------- TRAINING EPOCH: 180 ----------------------------  
client [21] (testset)   loss: 0.3458 -> 0.2926  accuracy: 87.42% -> 89.31%     
client [79] (testset)   loss: 0.3082 -> 0.3574  accuracy: 87.01% -> 87.01%     
client [58] (testset)   loss: 0.4352 -> 0.3653  accuracy: 80.66% -> 85.64%     
client [88] (testset)   loss: 0.2890 -> 0.2997  accuracy: 92.62% -> 92.62%     
client [46] (testset)   loss: 0.2702 -> 0.2953  accuracy: 90.85% -> 87.91%     
client [11] (testset)   loss: 0.1338 -> 0.1430  accuracy: 95.83% -> 95.83%     
client [55] (testset)   loss: 0.1490 -> 0.1635  accuracy: 92.89% -> 92.89%     
client [13] (testset)   loss: 0.1640 -> 0.1685  accuracy: 93.30% -> 95.09%     
client [31] (testset)   loss: 0.1949 -> 1.0879  accuracy: 92.62% -> 79.87%     
client [75] (testset)   loss: 0.0717 -> 0.0821  accuracy: 97.12% -> 97.12%     
---------------------------- TRAINING EPOCH: 190 ----------------------------  
client [19] (testset)   loss: 0.1978 -> 0.2051  accuracy: 94.44% -> 94.44%     
client [7]  (testset)   loss: 0.2605 -> 0.2320  accuracy: 94.24% -> 93.42%     
client [57] (testset)   loss: 0.1583 -> 0.1633  accuracy: 95.93% -> 94.58%     
client [13] (testset)   loss: 0.2289 -> 1.3600  accuracy: 93.75% -> 83.48%     
client [43] (testset)   loss: 0.2919 -> 0.3274  accuracy: 88.53% -> 86.70%     
client [91] (testset)   loss: 0.1610 -> 0.1532  accuracy: 93.67% -> 94.30%     
client [10] (testset)   loss: 0.1291 -> 0.0899  accuracy: 94.96% -> 97.84%     
client [64] (testset)   loss: 0.1504 -> 0.1373  accuracy: 93.72% -> 94.56%     
client [82] (testset)   loss: 0.2512 -> 0.2212  accuracy: 89.41% -> 91.10%     
client [22] (testset)   loss: 0.2187 -> 0.2793  accuracy: 91.87% -> 90.24%     
---------------------------- TRAINING EPOCH: 200 ----------------------------  
client [20] (testset)   loss: 0.1602 -> 0.1847  accuracy: 95.92% -> 94.69%     
client [23] (testset)   loss: 0.4278 -> 0.4048  accuracy: 80.00% -> 84.29%     
client [88] (testset)   loss: 0.3126 -> 0.2750  accuracy: 92.62% -> 91.95%     
client [98] (testset)   loss: 0.1702 -> 0.1391  accuracy: 94.50% -> 94.85%     
client [79] (testset)   loss: 0.3039 -> 0.3027  accuracy: 87.66% -> 87.66%     
client [21] (testset)   loss: 0.3934 -> 0.3127  accuracy: 87.42% -> 89.31%     
client [92] (testset)   loss: 0.0503 -> 0.0593  accuracy: 98.61% -> 98.15%     
client [56] (testset)   loss: 0.3838 -> 0.3923  accuracy: 87.24% -> 84.69%     
client [5]  (testset)   loss: 0.2113 -> 0.1962  accuracy: 93.22% -> 94.24%     
client [52] (testset)   loss: 0.1354 -> 0.1189  accuracy: 96.00% -> 94.67%     
---------------------------- TRAINING EPOCH: 210 ----------------------------  
client [67] (testset)   loss: 0.2113 -> 0.1649  accuracy: 92.21% -> 93.51%     
client [54] (testset)   loss: 0.3325 -> 0.3835  accuracy: 85.57% -> 84.54%     
client [14] (testset)   loss: 0.1769 -> 0.1871  accuracy: 93.36% -> 92.12%     
client [99] (testset)   loss: 0.1006 -> 0.1081  accuracy: 97.12% -> 97.12%     
client [36] (testset)   loss: 0.1204 -> 0.1361  accuracy: 96.31% -> 95.85%     
client [30] (testset)   loss: 0.2678 -> 0.2894  accuracy: 86.81% -> 85.71%     
client [38] (testset)   loss: 0.1597 -> 0.1536  accuracy: 94.59% -> 94.59%     
client [15] (testset)   loss: 0.1448 -> 0.1540  accuracy: 94.70% -> 93.18%     
client [6]  (testset)   loss: 0.2001 -> 0.2310  accuracy: 92.74% -> 91.88%     
client [53] (testset)   loss: 0.2072 -> 0.2643  accuracy: 93.38% -> 91.91%     
---------------------------- TRAINING EPOCH: 220 ----------------------------  
client [99] (testset)   loss: 0.1129 -> 0.0935  accuracy: 95.19% -> 99.04%     
client [6]  (testset)   loss: 0.2175 -> 0.2240  accuracy: 92.31% -> 92.31%     
client [83] (testset)   loss: 0.1597 -> 1.7156  accuracy: 94.12% -> 71.76%     
client [42] (testset)   loss: 0.2627 -> 0.2375  accuracy: 90.31% -> 92.95%     
client [34] (testset)   loss: 0.2556 -> 0.2205  accuracy: 91.80% -> 91.26%     
client [15] (testset)   loss: 0.1557 -> 0.1481  accuracy: 95.45% -> 95.45%     
client [47] (testset)   loss: 0.2113 -> 0.2042  accuracy: 92.59% -> 93.06%     
client [55] (testset)   loss: 0.1807 -> 0.1965  accuracy: 93.40% -> 93.40%     
client [51] (testset)   loss: 0.0945 -> 0.0997  accuracy: 96.58% -> 97.34%     
client [95] (testset)   loss: 0.4048 -> 0.3639  accuracy: 88.57% -> 90.48%     
---------------------------- TRAINING EPOCH: 230 ----------------------------  
client [71] (testset)   loss: 0.4510 -> 0.5327  accuracy: 87.50% -> 87.50%     
client [15] (testset)   loss: 0.1498 -> 0.1450  accuracy: 95.45% -> 94.70%     
client [33] (testset)   loss: 0.4310 -> 0.3578  accuracy: 83.88% -> 87.60%     
client [99] (testset)   loss: 0.1044 -> 0.1046  accuracy: 96.15% -> 96.15%     
client [90] (testset)   loss: 0.0846 -> 0.1785  accuracy: 95.53% -> 94.97%     
client [57] (testset)   loss: 0.2271 -> 0.1619  accuracy: 92.88% -> 95.59%     
client [27] (testset)   loss: 0.0135 -> 0.0188  accuracy: 98.84% -> 98.84%     
client [78] (testset)   loss: 0.0857 -> 0.1017  accuracy: 97.62% -> 97.62%     
client [36] (testset)   loss: 0.1223 -> 0.1354  accuracy: 97.24% -> 95.85%     
client [88] (testset)   loss: 0.2856 -> 0.2945  accuracy: 93.96% -> 91.95%     
---------------------------- TRAINING EPOCH: 240 ----------------------------  
client [70] (testset)   loss: 0.2867 -> 0.2419  accuracy: 93.02% -> 93.02%     
client [35] (testset)   loss: 0.1347 -> 0.2698  accuracy: 94.84% -> 90.32%     
client [16] (testset)   loss: 0.3223 -> 0.3439  accuracy: 90.23% -> 90.98%     
client [80] (testset)   loss: 0.2404 -> 0.2526  accuracy: 92.45% -> 92.45%     
client [38] (testset)   loss: 0.1691 -> 0.1630  accuracy: 94.26% -> 94.93%     
client [78] (testset)   loss: 0.0834 -> 0.0966  accuracy: 98.41% -> 96.83%     
client [68] (testset)   loss: 0.2852 -> 0.3761  accuracy: 90.06% -> 84.78%     
client [11] (testset)   loss: 0.1248 -> 0.1288  accuracy: 96.43% -> 95.83%     
client [64] (testset)   loss: 0.1553 -> 0.1430  accuracy: 93.72% -> 94.98%     
client [82] (testset)   loss: 0.2180 -> 0.2359  accuracy: 91.53% -> 91.53%     
---------------------------- TRAINING EPOCH: 250 ----------------------------  
client [30] (testset)   loss: 0.2941 -> 0.3135  accuracy: 89.01% -> 82.42%     
client [27] (testset)   loss: 0.0074 -> 0.0112  accuracy: 100.00% -> 98.84%    
client [74] (testset)   loss: 0.2386 -> 0.2432  accuracy: 92.24% -> 91.64%     
client [45] (testset)   loss: 0.1353 -> 0.1331  accuracy: 95.00% -> 93.33%     
client [6]  (testset)   loss: 0.2104 -> 0.2396  accuracy: 92.74% -> 92.74%     
client [36] (testset)   loss: 0.1207 -> 0.1224  accuracy: 96.31% -> 95.85%     
client [63] (testset)   loss: 0.1087 -> 0.1115  accuracy: 95.45% -> 95.45%     
client [76] (testset)   loss: 0.2403 -> 0.2310  accuracy: 92.75% -> 92.75%     
client [83] (testset)   loss: 0.2179 -> 0.2235  accuracy: 92.94% -> 95.29%     
client [86] (testset)   loss: 0.4416 -> 0.4489  accuracy: 86.90% -> 86.90%     
---------------------------- TRAINING EPOCH: 260 ----------------------------  
client [83] (testset)   loss: 0.2015 -> 0.1748  accuracy: 92.94% -> 95.29%     
client [99] (testset)   loss: 0.0951 -> 0.0994  accuracy: 96.15% -> 98.08%     
client [74] (testset)   loss: 0.2319 -> 0.2623  accuracy: 93.43% -> 90.15%     
client [73] (testset)   loss: 0.2193 -> 0.1959  accuracy: 90.50% -> 92.76%     
client [29] (testset)   loss: 0.3216 -> 0.3370  accuracy: 88.89% -> 88.89%     
client [92] (testset)   loss: 0.0553 -> 0.0449  accuracy: 98.15% -> 99.07%     
client [6]  (testset)   loss: 0.2201 -> 0.2325  accuracy: 91.45% -> 92.74%     
client [61] (testset)   loss: 0.3687 -> 0.5377  accuracy: 88.57% -> 79.29%     
client [21] (testset)   loss: 0.4221 -> 0.3330  accuracy: 84.91% -> 88.68%     
client [67] (testset)   loss: 0.1801 -> 0.1664  accuracy: 94.37% -> 93.51%     
---------------------------- TRAINING EPOCH: 270 ----------------------------  
client [83] (testset)   loss: 0.1961 -> 0.1948  accuracy: 91.76% -> 95.29%     
client [32] (testset)   loss: 0.1961 -> 0.1535  accuracy: 93.69% -> 93.69%     
client [95] (testset)   loss: 0.4390 -> 0.3707  accuracy: 89.52% -> 90.48%     
client [61] (testset)   loss: 0.3094 -> 0.2888  accuracy: 92.14% -> 93.57%     
client [27] (testset)   loss: 0.0055 -> 0.0105  accuracy: 100.00% -> 98.84%    
client [25] (testset)   loss: 0.3037 -> 0.3410  accuracy: 88.93% -> 89.69%     
client [68] (testset)   loss: 0.3165 -> 0.4298  accuracy: 88.51% -> 81.37%     
client [34] (testset)   loss: 0.2139 -> 0.2252  accuracy: 92.90% -> 91.80%     
client [71] (testset)   loss: 0.4127 -> 0.4263  accuracy: 87.50% -> 87.50%     
client [89] (testset)   loss: 0.0846 -> 0.0593  accuracy: 95.68% -> 97.12%     
---------------------------- TRAINING EPOCH: 280 ----------------------------  
client [78] (testset)   loss: 0.0654 -> 0.1318  accuracy: 99.21% -> 96.03%     
client [81] (testset)   loss: 0.1368 -> 0.1129  accuracy: 94.92% -> 94.92%     
client [51] (testset)   loss: 0.0946 -> 0.1165  accuracy: 96.20% -> 96.96%     
client [54] (testset)   loss: 0.3330 -> 0.3421  accuracy: 85.05% -> 84.54%     
client [65] (testset)   loss: 0.2012 -> 0.1788  accuracy: 89.71% -> 91.18%     
client [41] (testset)   loss: 0.1117 -> 0.0976  accuracy: 97.07% -> 96.59%     
client [11] (testset)   loss: 0.1190 -> 0.1290  accuracy: 97.02% -> 96.43%     
client [85] (testset)   loss: 0.1105 -> 0.1219  accuracy: 95.65% -> 95.65%     
client [12] (testset)   loss: 0.2437 -> 0.2458  accuracy: 92.41% -> 93.04%     
client [23] (testset)   loss: 0.4350 -> 0.4135  accuracy: 77.14% -> 78.57%     
---------------------------- TRAINING EPOCH: 290 ----------------------------  
client [16] (testset)   loss: 0.3315 -> 0.3499  accuracy: 91.73% -> 91.73%     
client [65] (testset)   loss: 0.2293 -> 0.2004  accuracy: 86.76% -> 88.97%     
client [53] (testset)   loss: 0.2080 -> 0.2441  accuracy: 93.38% -> 94.12%     
client [58] (testset)   loss: 0.4370 -> 0.3602  accuracy: 83.98% -> 85.64%     
client [72] (testset)   loss: 0.5526 -> 0.4680  accuracy: 86.84% -> 89.47%     
client [7]  (testset)   loss: 0.2574 -> 0.2318  accuracy: 93.83% -> 94.65%     
client [71] (testset)   loss: 0.4440 -> 0.4526  accuracy: 87.50% -> 87.50%     
client [59] (testset)   loss: 0.1757 -> 0.1612  accuracy: 94.44% -> 96.30%     
client [86] (testset)   loss: 0.4494 -> 0.4948  accuracy: 86.03% -> 86.46%     
client [39] (testset)   loss: 0.2926 -> 0.3755  accuracy: 91.04% -> 88.06%     
---------------------------- TRAINING EPOCH: 300 ----------------------------  
client [99] (testset)   loss: 0.0625 -> 0.0726  accuracy: 98.08% -> 99.04%     
client [7]  (testset)   loss: 0.2508 -> 0.2543  accuracy: 93.83% -> 93.83%     
client [17] (testset)   loss: 0.2467 -> 0.2457  accuracy: 92.47% -> 91.78%     
client [64] (testset)   loss: 0.1695 -> 0.1418  accuracy: 93.72% -> 95.40%     
client [37] (testset)   loss: 0.3250 -> 0.3207  accuracy: 91.12% -> 92.31%     
client [29] (testset)   loss: 0.3076 -> 0.3238  accuracy: 88.89% -> 89.44%     
client [93] (testset)   loss: 0.5197 -> 0.5073  accuracy: 80.77% -> 82.52%     
client [73] (testset)   loss: 0.2013 -> 0.2357  accuracy: 91.86% -> 92.76%     
client [40] (testset)   loss: 0.1238 -> 0.1443  accuracy: 93.65% -> 93.65%     
client [76] (testset)   loss: 0.2726 -> 0.3552  accuracy: 91.98% -> 88.55%     
---------------------------- TRAINING EPOCH: 310 ----------------------------  
client [31] (testset)   loss: 0.1968 -> 0.3298  accuracy: 91.95% -> 89.26%     
client [89] (testset)   loss: 0.0831 -> 0.0606  accuracy: 95.68% -> 97.12%     
client [77] (testset)   loss: 0.3064 -> 0.2415  accuracy: 89.71% -> 93.14%     
client [90] (testset)   loss: 0.1824 -> 0.1653  accuracy: 93.30% -> 94.97%     
client [26] (testset)   loss: 0.1516 -> 0.1011  accuracy: 94.81% -> 97.40%     
client [50] (testset)   loss: 0.1944 -> 0.2360  accuracy: 94.70% -> 93.38%     
client [30] (testset)   loss: 0.2467 -> 0.2791  accuracy: 85.71% -> 87.91%     
client [70] (testset)   loss: 0.2859 -> 0.2160  accuracy: 93.02% -> 93.02%     
client [41] (testset)   loss: 0.1191 -> 0.0977  accuracy: 96.59% -> 97.56%     
client [99] (testset)   loss: 0.0611 -> 0.0724  accuracy: 98.08% -> 98.08%     
---------------------------- TRAINING EPOCH: 320 ----------------------------  
client [68] (testset)   loss: 0.3163 -> 0.3313  accuracy: 88.20% -> 88.51%     
client [70] (testset)   loss: 0.2541 -> 0.5067  accuracy: 93.02% -> 86.05%     
client [52] (testset)   loss: 0.1343 -> 0.1091  accuracy: 94.00% -> 95.33%     
client [1]  (testset)   loss: 0.2134 -> 0.2489  accuracy: 89.71% -> 88.24%     
client [2]  (testset)   loss: 0.2743 -> 0.2744  accuracy: 89.54% -> 92.81%     
client [67] (testset)   loss: 0.1866 -> 0.1775  accuracy: 93.51% -> 93.51%     
client [92] (testset)   loss: 0.0422 -> 0.0681  accuracy: 98.15% -> 98.15%     
client [35] (testset)   loss: 0.1502 -> 0.1361  accuracy: 94.84% -> 94.84%     
client [36] (testset)   loss: 0.1072 -> 0.1232  accuracy: 97.24% -> 96.77%     
client [64] (testset)   loss: 0.1528 -> 0.1499  accuracy: 94.14% -> 94.98%     
---------------------------- TRAINING EPOCH: 330 ----------------------------  
client [44] (testset)   loss: 0.4203 -> 0.4006  accuracy: 85.60% -> 87.26%     
client [6]  (testset)   loss: 0.2150 -> 0.2495  accuracy: 92.74% -> 92.31%     
client [12] (testset)   loss: 0.2361 -> 0.2635  accuracy: 91.77% -> 94.30%     
client [55] (testset)   loss: 0.1614 -> 0.1580  accuracy: 94.92% -> 94.42%     
client [29] (testset)   loss: 0.3449 -> 0.3366  accuracy: 88.33% -> 88.89%     
client [9]  (testset)   loss: 0.1136 -> 0.1178  accuracy: 97.33% -> 97.33%     
client [43] (testset)   loss: 0.3641 -> 0.2894  accuracy: 88.99% -> 89.91%     
client [77] (testset)   loss: 0.2964 -> 0.2216  accuracy: 89.71% -> 92.57%     
client [98] (testset)   loss: 0.1509 -> 0.1468  accuracy: 94.85% -> 95.19%     
client [78] (testset)   loss: 0.0622 -> 0.0829  accuracy: 98.41% -> 96.83%     
---------------------------- TRAINING EPOCH: 340 ----------------------------  
client [92] (testset)   loss: 0.0558 -> 0.0703  accuracy: 98.15% -> 97.69%     
client [80] (testset)   loss: 0.2419 -> 0.2610  accuracy: 93.40% -> 93.40%     
client [63] (testset)   loss: 0.0893 -> 0.0671  accuracy: 95.45% -> 96.97%     
client [76] (testset)   loss: 0.2508 -> 0.2392  accuracy: 93.51% -> 92.37%     
client [78] (testset)   loss: 0.0606 -> 0.1119  accuracy: 99.21% -> 96.83%     
client [25] (testset)   loss: 0.2823 -> 0.3148  accuracy: 91.98% -> 90.46%     
client [58] (testset)   loss: 0.4018 -> 0.3589  accuracy: 83.98% -> 85.64%     
client [13] (testset)   loss: 0.1975 -> 0.2381  accuracy: 93.75% -> 94.20%     
client [17] (testset)   loss: 0.2511 -> 0.2444  accuracy: 90.41% -> 92.47%     
client [38] (testset)   loss: 0.1526 -> 0.2145  accuracy: 95.61% -> 94.59%     
---------------------------- TRAINING EPOCH: 350 ----------------------------  
client [72] (testset)   loss: 0.4762 -> 0.4505  accuracy: 89.47% -> 89.47%     
client [82] (testset)   loss: 0.2451 -> 0.2320  accuracy: 93.22% -> 93.22%     
client [86] (testset)   loss: 0.4844 -> 0.4949  accuracy: 87.34% -> 85.15%     
client [51] (testset)   loss: 0.0968 -> 0.1145  accuracy: 96.20% -> 96.96%     
client [96] (testset)   loss: 0.3116 -> 0.3706  accuracy: 91.27% -> 90.83%     
client [42] (testset)   loss: 0.2330 -> 0.8465  accuracy: 93.39% -> 81.50%     
client [55] (testset)   loss: 0.1913 -> 0.1862  accuracy: 92.89% -> 92.39%     
client [13] (testset)   loss: 0.1947 -> 0.2079  accuracy: 94.20% -> 93.30%     
client [1]  (testset)   loss: 0.2483 -> 0.2424  accuracy: 88.97% -> 90.44%     
client [12] (testset)   loss: 0.2128 -> 0.2347  accuracy: 91.77% -> 94.30%     
---------------------------- TRAINING EPOCH: 360 ----------------------------  
client [68] (testset)   loss: 0.3139 -> 0.3571  accuracy: 86.96% -> 87.58%     
client [23] (testset)   loss: 0.4329 -> 0.3926  accuracy: 81.43% -> 84.29%     
client [46] (testset)   loss: 0.2311 -> 0.3120  accuracy: 92.48% -> 91.83%     
client [41] (testset)   loss: 0.1287 -> 0.0966  accuracy: 97.07% -> 97.07%     
client [25] (testset)   loss: 0.2953 -> 0.3383  accuracy: 90.84% -> 90.46%     
client [58] (testset)   loss: 0.4404 -> 0.3945  accuracy: 83.98% -> 84.53%     
client [14] (testset)   loss: 0.1699 -> 0.1547  accuracy: 94.61% -> 94.19%     
client [33] (testset)   loss: 0.4288 -> 0.3891  accuracy: 85.12% -> 84.30%     
client [85] (testset)   loss: 0.1073 -> 0.1412  accuracy: 95.65% -> 95.65%     
client [62] (testset)   loss: 0.0764 -> 0.0970  accuracy: 96.95% -> 97.71%     
---------------------------- TRAINING EPOCH: 370 ----------------------------  
client [98] (testset)   loss: 0.1527 -> 0.1328  accuracy: 95.88% -> 95.88%     
client [63] (testset)   loss: 0.0641 -> 0.0539  accuracy: 96.97% -> 98.48%     
client [70] (testset)   loss: 0.3262 -> 0.2476  accuracy: 93.02% -> 93.02%     
client [65] (testset)   loss: 0.1961 -> 0.1682  accuracy: 89.71% -> 91.91%     
client [14] (testset)   loss: 0.1785 -> 0.1579  accuracy: 93.78% -> 95.44%     
client [73] (testset)   loss: 0.2222 -> 0.2244  accuracy: 90.50% -> 92.31%     
client [34] (testset)   loss: 0.2389 -> 0.2623  accuracy: 92.90% -> 91.26%     
client [99] (testset)   loss: 0.0518 -> 0.0535  accuracy: 98.08% -> 99.04%     
client [69] (testset)   loss: 0.3463 -> 0.3290  accuracy: 90.48% -> 90.48%     
client [46] (testset)   loss: 0.2482 -> 0.3903  accuracy: 92.16% -> 90.20%     
---------------------------- TRAINING EPOCH: 380 ----------------------------  
client [99] (testset)   loss: 0.0547 -> 0.0524  accuracy: 99.04% -> 99.04%     
client [93] (testset)   loss: 0.5471 -> 0.5224  accuracy: 82.52% -> 83.92%     
client [11] (testset)   loss: 0.0965 -> 0.1682  accuracy: 98.81% -> 97.02%     
client [58] (testset)   loss: 0.4314 -> 0.3939  accuracy: 85.08% -> 85.64%     
client [81] (testset)   loss: 0.1483 -> 0.1163  accuracy: 94.92% -> 96.61%     
client [85] (testset)   loss: 0.1272 -> 0.1370  accuracy: 95.65% -> 95.11%     
client [89] (testset)   loss: 0.0647 -> 0.0582  accuracy: 97.12% -> 97.84%     
client [45] (testset)   loss: 0.1312 -> 0.1557  accuracy: 94.44% -> 93.89%     
client [8]  (testset)   loss: 0.1735 -> 0.1535  accuracy: 93.14% -> 95.10%     
client [68] (testset)   loss: 0.3231 -> 0.4321  accuracy: 88.20% -> 88.51%     
---------------------------- TRAINING EPOCH: 390 ----------------------------  
client [67] (testset)   loss: 0.1859 -> 0.1860  accuracy: 95.24% -> 95.67%     
client [72] (testset)   loss: 0.5357 -> 0.4954  accuracy: 89.47% -> 89.47%     
client [1]  (testset)   loss: 0.2044 -> 0.2360  accuracy: 90.44% -> 89.71%     
client [78] (testset)   loss: 0.0602 -> 0.0892  accuracy: 99.21% -> 97.62%     
client [83] (testset)   loss: 0.2309 -> 0.2363  accuracy: 90.59% -> 92.94%     
client [21] (testset)   loss: 0.4643 -> 0.3637  accuracy: 84.28% -> 89.31%     
client [56] (testset)   loss: 0.3500 -> 0.3742  accuracy: 89.29% -> 87.76%     
client [44] (testset)   loss: 0.4210 -> 0.4242  accuracy: 87.53% -> 88.09%     
client [92] (testset)   loss: 0.0600 -> 0.0639  accuracy: 98.15% -> 98.15%     
client [27] (testset)   loss: 0.0162 -> 0.0155  accuracy: 98.84% -> 98.84%     
---------------------------- TRAINING EPOCH: 400 ----------------------------  
client [10] (testset)   loss: 0.1270 -> 0.1456  accuracy: 95.68% -> 95.68%     
client [39] (testset)   loss: 0.2844 -> 0.3942  accuracy: 89.55% -> 88.81%     
client [65] (testset)   loss: 0.2020 -> 0.1622  accuracy: 88.97% -> 91.91%     
client [26] (testset)   loss: 0.1214 -> 0.1024  accuracy: 97.40% -> 98.70%     
client [19] (testset)   loss: 0.2582 -> 0.2402  accuracy: 92.22% -> 93.33%     
client [68] (testset)   loss: 0.3329 -> 0.4884  accuracy: 87.89% -> 86.65%     
client [41] (testset)   loss: 0.1616 -> 0.1124  accuracy: 97.07% -> 97.07%     
client [50] (testset)   loss: 0.1870 -> 0.5971  accuracy: 95.36% -> 88.08%     
client [75] (testset)   loss: 0.0502 -> 0.0754  accuracy: 97.84% -> 97.84%     
client [81] (testset)   loss: 0.1746 -> 0.1315  accuracy: 96.61% -> 96.61%     
Training... ---------------------------------------- 100% 0:14:58
FedOBP's average time taken by each global epoch: 0 min 2.23 sec.              
FedOBP's total running time: 0 h 14 m 58 s.                                    
==================== FedOBP Experiment Results: ====================           
Display format: (before local fine-tuning) -> (after local fine-tuning)        
 So if finetune_epoch = 0, x.xx% -> 0.00% is normal.                           
 Centralized testing ONLY happens after model aggregation, so the stats between
'->' are the same.                                                             
{                                                                              
    "100": {                                                                   
        "all_clients": {                                                       
            "test": {                                                          
                "loss": "0.2710 -> 0.0000",                                    
                "accuracy": "90.40% -> 0.00%"                                  
            }                                                                  
        }                                                                      
    },                                                                         
    "200": {                                                                   
        "all_clients": {                                                       
            "test": {                                                          
                "loss": "0.2392 -> 0.0000",                                    
                "accuracy": "91.72% -> 0.00%"                                  
            }                                                                  
        }                                                                      
    },                                                                         
    "300": {                                                                   
        "all_clients": {                                                       
            "test": {                                                          
                "loss": "0.2327 -> 0.0000",                                    
                "accuracy": "92.17% -> 0.00%"                                  
            }                                                                  
        }                                                                      
    },                                                                         
    "400": {                                                                   
        "all_clients": {                                                       
            "test": {                                                          
                "loss": "0.2428 -> 0.0000",                                    
                "accuracy": "92.34% -> 0.00%"                                  
            }                                                                  
        }                                                                      
    }                                                                          
}                                                                              
==================== FedOBP Max Accuracy ====================                  
all_clients:                                                                   
(test) before fine-tuning: 92.34% at epoch 400                                 
(test) after fine-tuning: 0.00% at epoch 100                                   
[0m