out\fedobp\svhn\Main_GlobalNorm_EMAscore(0.5)_ALL_IG_0.999705
==================== FedOBP ====================                               
Experiment Arguments:                                                          
{
│   'method': 'fedobp',
│   'dataset': {
│   │   'name': 'svhn',
│   │   'client_num': 100,
│   │   'test_ratio': 0.25,
│   │   'val_ratio': 0.0,
│   │   'seed': 42,
│   │   'split': 'sample',
│   │   'IID_ratio': 0.0,
│   │   'monitor_window_name_suffix': 'svhn-100clients-0%IID-Dir(0.5)-seed42',
│   │   'alpha': 0.5,
│   │   'min_samples_per_client': 10
│   },
│   'model': {
│   │   'name': 'avgcnn',
│   │   'use_torchvision_pretrained_weights': True,
│   │   'external_model_weights_path': None
│   },
│   'optimizer': {
│   │   'lr': 0.01,
│   │   'dampening': 0,
│   │   'weight_decay': 0,
│   │   'momentum': 0,
│   │   'nesterov': False,
│   │   'name': 'sgd'
│   },
│   'mode': 'serial',
│   'parallel': {
│   │   'ray_cluster_addr': None,
│   │   'num_cpus': None,
│   │   'num_gpus': None,
│   │   'num_workers': 2
│   },
│   'common': {
│   │   'seed': 42,
│   │   'join_ratio': 0.1,
│   │   'global_epoch': 400,
│   │   'local_epoch': 5,
│   │   'batch_size': 32,
│   │   'reset_optimizer_on_global_epoch': True,
│   │   'straggler_ratio': 0,
│   │   'straggler_min_local_epoch': 0,
│   │   'buffers': 'global',
│   │   'client_side_evaluation': True,
│   │   'test': {
│   │   │   'client': {
│   │   │   │   'interval': 100,
│   │   │   │   'finetune_epoch': 0,
│   │   │   │   'train': False,
│   │   │   │   'val': False,
│   │   │   │   'test': True
│   │   │   },
│   │   │   'server': {
│   │   │   │   'interval': -1,
│   │   │   │   'train': False,
│   │   │   │   'val': False,
│   │   │   │   'test': False,
│   │   │   │   'model_in_train_mode': False
│   │   │   }
│   │   },
│   │   'verbose_gap': 10,
│   │   'monitor': None,
│   │   'use_cuda': True,
│   │   'save_log': True,
│   │   'save_model': False,
│   │   'save_learning_curve_plot': False,
│   │   'save_metrics': True,
│   │   'delete_useless_run': True
│   },
│   'fedobp': {
│   │   'ig_ratio': 0.999705,
│   │   'alpha': 0.5,
│   │   'norm': 'global',
│   │   'EMA': True,
│   │   'CLS': False,
│   │   'track': False,
│   │   'type': 'Main'
│   }
}
---------------------------- TRAINING EPOCH: 10 ----------------------------   
client [77] (testset)   loss: 0.9691 -> 0.7939  accuracy: 68.10% -> 73.28%     
client [81] (testset)   loss: 0.9713 -> 0.7638  accuracy: 74.36% -> 77.95%     
client [21] (testset)   loss: 0.9096 -> 0.6662  accuracy: 72.36% -> 79.27%     
client [68] (testset)   loss: 0.5201 -> 0.5512  accuracy: 84.28% -> 83.45%     
client [93] (testset)   loss: 0.9090 -> 0.5591  accuracy: 72.75% -> 82.24%     
client [31] (testset)   loss: 0.5817 -> 0.6933  accuracy: 83.18% -> 78.18%     
client [20] (testset)   loss: 0.7519 -> 0.9346  accuracy: 78.87% -> 68.04%     
client [59] (testset)   loss: 0.9052 -> 0.6661  accuracy: 72.86% -> 77.89%     
client [48] (testset)   loss: 0.6609 -> 0.6178  accuracy: 81.58% -> 82.33%     
client [34] (testset)   loss: 1.3655 -> 1.1808  accuracy: 50.88% -> 64.91%     
---------------------------- TRAINING EPOCH: 20 ----------------------------   
client [69] (testset)   loss: 0.7274 -> 0.4971  accuracy: 80.95% -> 85.71%     
client [99] (testset)   loss: 0.4231 -> 0.4900  accuracy: 87.84% -> 85.10%     
client [67] (testset)   loss: 0.6736 -> 0.3460  accuracy: 78.43% -> 88.73%     
client [0]  (testset)   loss: 0.7461 -> 0.5987  accuracy: 73.40% -> 78.72%     
client [76] (testset)   loss: 0.5600 -> 0.4976  accuracy: 82.52% -> 83.74%     
client [41] (testset)   loss: 0.6822 -> 0.4530  accuracy: 81.02% -> 84.67%     
client [62] (testset)   loss: 0.6814 -> 0.6020  accuracy: 79.10% -> 79.60%     
client [2]  (testset)   loss: 0.5848 -> 0.4290  accuracy: 83.22% -> 87.58%     
client [14] (testset)   loss: 0.6283 -> 0.5766  accuracy: 85.07% -> 82.93%     
client [46] (testset)   loss: 0.8243 -> 0.5558  accuracy: 73.16% -> 82.63%     
---------------------------- TRAINING EPOCH: 30 ----------------------------   
client [24] (testset)   loss: 0.3451 -> 0.3925  accuracy: 91.48% -> 91.11%     
client [68] (testset)   loss: 0.4164 -> 0.4125  accuracy: 89.15% -> 89.43%     
client [57] (testset)   loss: 0.5294 -> 0.6144  accuracy: 86.36% -> 84.94%     
client [17] (testset)   loss: 0.4550 -> 0.4339  accuracy: 83.89% -> 87.25%     
client [54] (testset)   loss: 0.4026 -> 0.4390  accuracy: 88.59% -> 87.50%     
client [23] (testset)   loss: 0.7333 -> 0.5238  accuracy: 81.30% -> 86.96%     
client [35] (testset)   loss: 0.7065 -> 0.4838  accuracy: 80.86% -> 87.65%     
client [59] (testset)   loss: 0.4652 -> 0.3954  accuracy: 86.43% -> 87.94%     
client [31] (testset)   loss: 0.3923 -> 0.3416  accuracy: 90.91% -> 91.14%     
client [9]  (testset)   loss: 0.6068 -> 0.4949  accuracy: 83.41% -> 86.34%     
---------------------------- TRAINING EPOCH: 40 ----------------------------   
client [64] (testset)   loss: 0.3861 -> 0.5744  accuracy: 90.17% -> 86.75%     
client [33] (testset)   loss: 0.3639 -> 0.4031  accuracy: 91.25% -> 88.75%     
client [16] (testset)   loss: 0.5657 -> 0.4671  accuracy: 83.15% -> 87.08%     
client [44] (testset)   loss: 0.4315 -> 0.4101  accuracy: 87.06% -> 88.50%     
client [8]  (testset)   loss: 0.3306 -> 0.1912  accuracy: 92.31% -> 95.38%     
client [31] (testset)   loss: 0.3401 -> 0.3427  accuracy: 91.14% -> 91.36%     
client [47] (testset)   loss: 0.3794 -> 0.3045  accuracy: 89.20% -> 91.10%     
client [36] (testset)   loss: 0.8108 -> 0.5021  accuracy: 78.43% -> 86.27%     
client [20] (testset)   loss: 0.4370 -> 0.4229  accuracy: 89.18% -> 87.63%     
client [56] (testset)   loss: 0.6287 -> 0.6018  accuracy: 81.59% -> 81.09%     
---------------------------- TRAINING EPOCH: 50 ----------------------------   
client [4]  (testset)   loss: 0.4407 -> 0.4165  accuracy: 87.21% -> 86.76%     
client [60] (testset)   loss: 0.4332 -> 0.3882  accuracy: 85.20% -> 87.44%     
client [28] (testset)   loss: 0.4136 -> 0.4881  accuracy: 87.31% -> 85.82%     
client [25] (testset)   loss: 0.5233 -> 0.5423  accuracy: 83.73% -> 84.92%     
client [58] (testset)   loss: 0.4282 -> 0.4664  accuracy: 87.58% -> 87.88%     
client [44] (testset)   loss: 0.4049 -> 0.4026  accuracy: 87.47% -> 89.53%     
client [39] (testset)   loss: 0.7570 -> 0.5982  accuracy: 84.95% -> 84.41%     
client [29] (testset)   loss: 0.6888 -> 0.4744  accuracy: 81.90% -> 87.62%     
client [3]  (testset)   loss: 0.5858 -> 0.5698  accuracy: 84.97% -> 86.27%     
client [84] (testset)   loss: 0.5379 -> 0.5322  accuracy: 86.59% -> 90.38%     
---------------------------- TRAINING EPOCH: 60 ----------------------------   
client [21] (testset)   loss: 0.4802 -> 0.3473  accuracy: 84.36% -> 89.45%     
client [84] (testset)   loss: 0.4777 -> 0.5222  accuracy: 88.34% -> 90.38%     
client [10] (testset)   loss: 0.3355 -> 0.3092  accuracy: 89.12% -> 92.23%     
client [36] (testset)   loss: 0.6383 -> 0.4586  accuracy: 86.27% -> 86.27%     
client [65] (testset)   loss: 0.4566 -> 0.3424  accuracy: 86.09% -> 90.23%     
client [81] (testset)   loss: 0.5800 -> 0.5204  accuracy: 85.13% -> 88.21%     
client [79] (testset)   loss: 0.5195 -> 0.5785  accuracy: 82.18% -> 86.21%     
client [42] (testset)   loss: 0.4606 -> 0.4102  accuracy: 88.25% -> 88.89%     
client [11] (testset)   loss: 0.4240 -> 0.3993  accuracy: 87.87% -> 88.85%     
client [96] (testset)   loss: 0.4645 -> 0.3705  accuracy: 88.71% -> 87.50%     
---------------------------- TRAINING EPOCH: 70 ----------------------------   
client [8]  (testset)   loss: 0.3187 -> 0.2172  accuracy: 93.33% -> 94.87%     
client [53] (testset)   loss: 0.4988 -> 0.3425  accuracy: 85.31% -> 92.66%     
client [52] (testset)   loss: 0.5518 -> 0.3874  accuracy: 84.44% -> 88.57%     
client [42] (testset)   loss: 0.4865 -> 0.3934  accuracy: 87.30% -> 87.62%     
client [69] (testset)   loss: 0.6470 -> 0.4976  accuracy: 86.67% -> 87.62%     
client [59] (testset)   loss: 0.4093 -> 0.3170  accuracy: 89.95% -> 91.96%     
client [7]  (testset)   loss: 0.7403 -> 0.3813  accuracy: 83.50% -> 88.50%     
client [26] (testset)   loss: 0.2071 -> 0.1972  accuracy: 94.39% -> 94.39%     
client [49] (testset)   loss: 0.3635 -> 0.3040  accuracy: 87.86% -> 93.64%     
client [98] (testset)   loss: 0.3403 -> 0.3688  accuracy: 89.79% -> 89.79%     
---------------------------- TRAINING EPOCH: 80 ----------------------------   
client [98] (testset)   loss: 0.4998 -> 0.4131  accuracy: 85.53% -> 88.94%     
client [47] (testset)   loss: 0.3345 -> 0.3092  accuracy: 91.10% -> 92.42%     
client [21] (testset)   loss: 0.5400 -> 0.3762  accuracy: 85.82% -> 89.45%     
client [77] (testset)   loss: 0.5391 -> 0.4244  accuracy: 84.91% -> 86.21%     
client [95] (testset)   loss: 0.3004 -> 0.2778  accuracy: 93.47% -> 93.77%     
client [91] (testset)   loss: 0.5929 -> 0.5595  accuracy: 84.30% -> 80.81%     
client [14] (testset)   loss: 0.4266 -> 0.4260  accuracy: 90.93% -> 90.13%     
client [99] (testset)   loss: 0.3311 -> 0.3650  accuracy: 91.76% -> 90.20%     
client [20] (testset)   loss: 0.4957 -> 0.4128  accuracy: 86.60% -> 89.69%     
client [39] (testset)   loss: 0.8422 -> 0.5667  accuracy: 81.18% -> 84.41%     
---------------------------- TRAINING EPOCH: 90 ----------------------------   
client [52] (testset)   loss: 0.5903 -> 0.4015  accuracy: 83.17% -> 89.21%     
client [62] (testset)   loss: 0.5180 -> 0.5141  accuracy: 86.12% -> 85.79%     
client [71] (testset)   loss: 0.6017 -> 0.7811  accuracy: 86.23% -> 83.23%     
client [97] (testset)   loss: 0.6969 -> 0.5730  accuracy: 81.30% -> 85.65%     
client [30] (testset)   loss: 0.4254 -> 0.4479  accuracy: 90.23% -> 90.23%     
client [88] (testset)   loss: 0.6096 -> 0.3353  accuracy: 87.14% -> 92.50%     
client [60] (testset)   loss: 0.3232 -> 0.4028  accuracy: 91.03% -> 87.89%     
client [82] (testset)   loss: 0.5246 -> 0.3191  accuracy: 84.33% -> 89.55%     
client [91] (testset)   loss: 0.5088 -> 0.4899  accuracy: 84.30% -> 82.56%     
client [57] (testset)   loss: 0.4782 -> 0.6114  accuracy: 87.22% -> 86.93%     
---------------------------- TRAINING EPOCH: 100 ----------------------------  
client [31] (testset)   loss: 0.3509 -> 0.3537  accuracy: 92.05% -> 92.73%     
client [15] (testset)   loss: 0.6451 -> 0.4458  accuracy: 88.41% -> 90.30%     
client [71] (testset)   loss: 0.5868 -> 0.7430  accuracy: 86.83% -> 85.63%     
client [97] (testset)   loss: 0.6349 -> 0.5422  accuracy: 82.61% -> 86.52%     
client [53] (testset)   loss: 0.4504 -> 0.3172  accuracy: 87.01% -> 94.35%     
client [77] (testset)   loss: 0.5072 -> 0.4497  accuracy: 86.64% -> 85.78%     
client [76] (testset)   loss: 0.4044 -> 0.3302  accuracy: 89.57% -> 90.80%     
client [79] (testset)   loss: 0.5804 -> 0.5681  accuracy: 84.48% -> 87.36%     
client [28] (testset)   loss: 0.3904 -> 0.4975  accuracy: 88.81% -> 85.07%     
client [99] (testset)   loss: 0.3772 -> 0.3637  accuracy: 91.76% -> 89.80%     
---------------------------- TRAINING EPOCH: 110 ----------------------------  
client [97] (testset)   loss: 0.6324 -> 0.5239  accuracy: 81.30% -> 86.96%     
client [86] (testset)   loss: 0.2645 -> 0.3819  accuracy: 92.37% -> 91.22%     
client [34] (testset)   loss: 0.7423 -> 0.6283  accuracy: 82.46% -> 80.70%     
client [73] (testset)   loss: 0.2828 -> 0.2448  accuracy: 90.54% -> 92.91%     
client [5]  (testset)   loss: 0.7111 -> 0.5050  accuracy: 87.84% -> 90.54%     
client [96] (testset)   loss: 0.4592 -> 0.3794  accuracy: 87.50% -> 89.52%     
client [22] (testset)   loss: 0.2759 -> 0.3095  accuracy: 93.64% -> 92.27%     
client [60] (testset)   loss: 0.3476 -> 0.4001  accuracy: 90.13% -> 88.34%     
client [66] (testset)   loss: 0.3124 -> 0.3166  accuracy: 92.79% -> 92.54%     
client [83] (testset)   loss: 0.2906 -> 0.2534  accuracy: 91.00% -> 92.00%     
---------------------------- TRAINING EPOCH: 120 ----------------------------  
client [76] (testset)   loss: 0.3035 -> 0.3415  accuracy: 91.41% -> 91.72%     
client [65] (testset)   loss: 0.5323 -> 0.3669  accuracy: 87.59% -> 90.60%     
client [95] (testset)   loss: 0.3121 -> 0.2842  accuracy: 94.07% -> 93.47%     
client [17] (testset)   loss: 0.2849 -> 0.3211  accuracy: 91.95% -> 91.28%     
client [8]  (testset)   loss: 0.3792 -> 0.2049  accuracy: 92.82% -> 96.92%     
client [35] (testset)   loss: 0.5596 -> 0.4594  accuracy: 88.27% -> 89.51%     
client [98] (testset)   loss: 0.4292 -> 0.3243  accuracy: 87.23% -> 90.21%     
client [53] (testset)   loss: 0.3221 -> 0.3114  accuracy: 90.40% -> 94.35%     
client [43] (testset)   loss: 0.7106 -> 0.6315  accuracy: 87.16% -> 85.81%     
client [64] (testset)   loss: 0.2704 -> 0.4006  accuracy: 91.88% -> 89.32%     
---------------------------- TRAINING EPOCH: 130 ----------------------------  
client [21] (testset)   loss: 0.4613 -> 0.3333  accuracy: 85.45% -> 91.64%     
client [88] (testset)   loss: 0.5596 -> 0.3674  accuracy: 88.57% -> 93.21%     
client [38] (testset)   loss: 0.4860 -> 0.4476  accuracy: 88.84% -> 89.52%     
client [3]  (testset)   loss: 0.7275 -> 0.6645  accuracy: 85.62% -> 88.89%     
client [5]  (testset)   loss: 0.6817 -> 0.5377  accuracy: 89.19% -> 91.89%     
client [41] (testset)   loss: 0.3575 -> 0.2835  accuracy: 90.51% -> 91.24%     
client [7]  (testset)   loss: 0.7289 -> 0.3718  accuracy: 84.50% -> 89.00%     
client [37] (testset)   loss: 0.4636 -> 0.5077  accuracy: 87.96% -> 87.96%     
client [45] (testset)   loss: 0.6409 -> 0.6098  accuracy: 87.97% -> 85.48%     
client [47] (testset)   loss: 0.3533 -> 0.3186  accuracy: 91.48% -> 93.75%     
---------------------------- TRAINING EPOCH: 140 ----------------------------  
client [16] (testset)   loss: 0.5019 -> 0.3949  accuracy: 87.64% -> 91.01%     
client [11] (testset)   loss: 0.5305 -> 0.4055  accuracy: 88.52% -> 89.51%     
client [37] (testset)   loss: 0.4421 -> 0.4769  accuracy: 87.96% -> 89.01%     
client [41] (testset)   loss: 0.4081 -> 0.2673  accuracy: 89.05% -> 91.97%     
client [95] (testset)   loss: 0.3302 -> 0.2810  accuracy: 93.18% -> 93.77%     
client [53] (testset)   loss: 0.3828 -> 0.2998  accuracy: 88.14% -> 93.79%     
client [22] (testset)   loss: 0.2841 -> 0.3143  accuracy: 94.09% -> 93.18%     
client [25] (testset)   loss: 0.5077 -> 0.5434  accuracy: 87.70% -> 86.51%     
client [69] (testset)   loss: 0.4173 -> 0.4485  accuracy: 91.43% -> 87.62%     
client [46] (testset)   loss: 0.4961 -> 0.3343  accuracy: 82.63% -> 90.53%     
---------------------------- TRAINING EPOCH: 150 ----------------------------  
client [47] (testset)   loss: 0.3436 -> 0.3429  accuracy: 92.23% -> 92.99%     
client [69] (testset)   loss: 0.5970 -> 0.5072  accuracy: 86.67% -> 89.52%     
client [82] (testset)   loss: 0.4702 -> 0.3071  accuracy: 85.07% -> 88.81%     
client [45] (testset)   loss: 0.6146 -> 0.6453  accuracy: 87.14% -> 85.48%     
client [7]  (testset)   loss: 0.7209 -> 0.4054  accuracy: 87.00% -> 89.50%     
client [50] (testset)   loss: 0.5940 -> 0.5924  accuracy: 88.31% -> 88.96%     
client [35] (testset)   loss: 0.5245 -> 0.4684  accuracy: 86.42% -> 90.74%     
client [24] (testset)   loss: 0.2564 -> 0.3079  accuracy: 94.07% -> 93.70%     
client [15] (testset)   loss: 0.5773 -> 0.4514  accuracy: 88.95% -> 91.11%     
client [58] (testset)   loss: 0.5452 -> 0.4713  accuracy: 89.09% -> 88.79%     
---------------------------- TRAINING EPOCH: 160 ----------------------------  
client [48] (testset)   loss: 0.4867 -> 0.4851  accuracy: 90.60% -> 88.72%     
client [76] (testset)   loss: 0.3275 -> 0.3262  accuracy: 90.80% -> 91.72%     
client [67] (testset)   loss: 0.2552 -> 0.2096  accuracy: 92.65% -> 92.16%     
client [37] (testset)   loss: 0.4815 -> 0.4889  accuracy: 87.43% -> 89.01%     
client [58] (testset)   loss: 0.6046 -> 0.4751  accuracy: 87.58% -> 90.91%     
client [64] (testset)   loss: 0.3522 -> 0.3797  accuracy: 91.03% -> 91.88%     
client [77] (testset)   loss: 0.4480 -> 0.4690  accuracy: 87.07% -> 87.93%     
client [55] (testset)   loss: 0.3829 -> 0.2720  accuracy: 89.76% -> 91.71%     
client [12] (testset)   loss: 0.2958 -> 0.2653  accuracy: 93.19% -> 94.73%     
client [89] (testset)   loss: 0.2152 -> 0.2304  accuracy: 92.91% -> 92.91%     
---------------------------- TRAINING EPOCH: 170 ----------------------------  
client [84] (testset)   loss: 0.5310 -> 0.5345  accuracy: 89.21% -> 91.55%     
client [51] (testset)   loss: 0.3000 -> 0.3318  accuracy: 92.00% -> 92.00%     
client [8]  (testset)   loss: 0.3016 -> 0.2359  accuracy: 94.87% -> 94.87%     
client [18] (testset)   loss: 0.7503 -> 0.7586  accuracy: 85.64% -> 83.66%     
client [94] (testset)   loss: 0.4387 -> 0.3277  accuracy: 91.32% -> 93.11%     
client [81] (testset)   loss: 0.6277 -> 0.5878  accuracy: 86.67% -> 88.21%     
client [3]  (testset)   loss: 0.6655 -> 0.6404  accuracy: 86.93% -> 88.24%     
client [11] (testset)   loss: 0.5108 -> 0.4259  accuracy: 89.18% -> 90.49%     
client [95] (testset)   loss: 0.3512 -> 0.2957  accuracy: 94.07% -> 94.36%     
client [67] (testset)   loss: 0.2354 -> 0.1856  accuracy: 93.14% -> 94.61%     
---------------------------- TRAINING EPOCH: 180 ----------------------------  
client [21] (testset)   loss: 0.4204 -> 0.3323  accuracy: 88.36% -> 90.91%     
client [79] (testset)   loss: 0.5501 -> 0.5753  accuracy: 86.78% -> 87.36%     
client [58] (testset)   loss: 0.5184 -> 0.4793  accuracy: 87.88% -> 90.61%     
client [88] (testset)   loss: 0.5532 -> 0.4104  accuracy: 91.07% -> 92.50%     
client [46] (testset)   loss: 0.3950 -> 0.3114  accuracy: 86.84% -> 89.47%     
client [11] (testset)   loss: 0.5397 -> 0.4331  accuracy: 87.54% -> 90.16%     
client [55] (testset)   loss: 0.4038 -> 0.2471  accuracy: 89.27% -> 92.68%     
client [13] (testset)   loss: 0.4201 -> 0.3609  accuracy: 91.62% -> 90.58%     
client [31] (testset)   loss: 0.3001 -> 0.3144  accuracy: 92.27% -> 93.18%     
client [75] (testset)   loss: 0.6175 -> 0.5795  accuracy: 87.08% -> 89.17%     
---------------------------- TRAINING EPOCH: 190 ----------------------------  
client [19] (testset)   loss: 0.2438 -> 0.2390  accuracy: 90.48% -> 90.48%     
client [7]  (testset)   loss: 0.5897 -> 0.3950  accuracy: 87.50% -> 88.00%     
client [57] (testset)   loss: 0.4366 -> 0.5386  accuracy: 90.91% -> 89.77%     
client [13] (testset)   loss: 0.3917 -> 0.3550  accuracy: 91.10% -> 91.62%     
client [43] (testset)   loss: 0.8027 -> 0.7461  accuracy: 85.81% -> 85.81%     
client [91] (testset)   loss: 0.5705 -> 0.5667  accuracy: 87.21% -> 84.30%     
client [10] (testset)   loss: 0.3051 -> 0.2850  accuracy: 92.23% -> 93.78%     
client [64] (testset)   loss: 0.2869 -> 0.3569  accuracy: 91.03% -> 90.60%     
client [82] (testset)   loss: 0.5061 -> 0.3346  accuracy: 86.57% -> 89.55%     
client [22] (testset)   loss: 0.2774 -> 0.2831  accuracy: 94.09% -> 92.73%     
---------------------------- TRAINING EPOCH: 200 ----------------------------  
client [20] (testset)   loss: 0.4147 -> 0.3952  accuracy: 89.69% -> 93.30%     
client [23] (testset)   loss: 0.6948 -> 0.5856  accuracy: 83.91% -> 88.70%     
client [88] (testset)   loss: 0.5983 -> 0.4308  accuracy: 90.36% -> 93.21%     
client [98] (testset)   loss: 0.3178 -> 0.3127  accuracy: 91.06% -> 91.06%     
client [79] (testset)   loss: 0.5698 -> 0.5773  accuracy: 89.66% -> 89.66%     
client [21] (testset)   loss: 0.3838 -> 0.3558  accuracy: 88.73% -> 91.27%     
client [92] (testset)   loss: 0.6891 -> 0.6402  accuracy: 88.97% -> 87.59%     
client [56] (testset)   loss: 0.4998 -> 0.4993  accuracy: 87.56% -> 82.59%     
client [5]  (testset)   loss: 0.6417 -> 0.6040  accuracy: 90.54% -> 89.19%     
client [52] (testset)   loss: 0.5268 -> 0.4165  accuracy: 86.98% -> 90.79%     
---------------------------- TRAINING EPOCH: 210 ----------------------------  
client [67] (testset)   loss: 0.2340 -> 0.1560  accuracy: 92.65% -> 94.12%     
client [54] (testset)   loss: 0.3406 -> 0.3115  accuracy: 90.22% -> 91.85%     
client [14] (testset)   loss: 0.4593 -> 0.4826  accuracy: 91.73% -> 91.73%     
client [99] (testset)   loss: 0.3857 -> 0.3672  accuracy: 90.98% -> 92.16%     
client [36] (testset)   loss: 0.7586 -> 0.5873  accuracy: 84.31% -> 84.31%     
client [30] (testset)   loss: 0.4729 -> 0.4797  accuracy: 91.53% -> 92.51%     
client [38] (testset)   loss: 0.5173 -> 0.4845  accuracy: 90.43% -> 89.52%     
client [15] (testset)   loss: 0.5511 -> 0.4280  accuracy: 90.57% -> 92.18%     
client [6]  (testset)   loss: 0.8324 -> 0.8455  accuracy: 86.45% -> 86.92%     
client [53] (testset)   loss: 0.3866 -> 0.3532  accuracy: 90.96% -> 94.35%     
---------------------------- TRAINING EPOCH: 220 ----------------------------  
client [99] (testset)   loss: 0.3555 -> 0.3602  accuracy: 93.33% -> 92.55%     
client [6]  (testset)   loss: 0.7981 -> 0.8116  accuracy: 87.85% -> 85.98%     
client [83] (testset)   loss: 0.3277 -> 0.2507  accuracy: 91.50% -> 94.00%     
client [42] (testset)   loss: 0.4566 -> 0.3534  accuracy: 91.43% -> 90.79%     
client [34] (testset)   loss: 0.7242 -> 0.5344  accuracy: 83.33% -> 89.47%     
client [15] (testset)   loss: 0.5154 -> 0.4491  accuracy: 89.76% -> 92.45%     
client [47] (testset)   loss: 0.3313 -> 0.3381  accuracy: 94.13% -> 93.18%     
client [55] (testset)   loss: 0.3018 -> 0.2387  accuracy: 90.73% -> 93.17%     
client [51] (testset)   loss: 0.2897 -> 0.3817  accuracy: 90.67% -> 86.67%     
client [95] (testset)   loss: 0.3047 -> 0.2890  accuracy: 94.66% -> 94.66%     
---------------------------- TRAINING EPOCH: 230 ----------------------------  
client [71] (testset)   loss: 0.6032 -> 0.8142  accuracy: 87.43% -> 83.23%     
client [15] (testset)   loss: 0.5937 -> 0.4460  accuracy: 90.03% -> 91.91%     
client [33] (testset)   loss: 0.4002 -> 0.5214  accuracy: 90.00% -> 87.50%     
client [99] (testset)   loss: 0.3773 -> 0.3574  accuracy: 91.37% -> 92.55%     
client [90] (testset)   loss: 0.6768 -> 0.6525  accuracy: 86.27% -> 88.66%     
client [57] (testset)   loss: 0.4962 -> 0.5423  accuracy: 90.34% -> 89.49%     
client [27] (testset)   loss: 0.2986 -> 0.3751  accuracy: 92.61% -> 92.61%     
client [78] (testset)   loss: 0.4427 -> 0.4615  accuracy: 91.48% -> 92.61%     
client [36] (testset)   loss: 0.6880 -> 0.5424  accuracy: 84.31% -> 86.27%     
client [88] (testset)   loss: 0.6197 -> 0.4428  accuracy: 90.00% -> 92.50%     
---------------------------- TRAINING EPOCH: 240 ----------------------------  
client [70] (testset)   loss: 0.2694 -> 0.2527  accuracy: 93.14% -> 96.08%     
client [35] (testset)   loss: 0.5722 -> 0.4846  accuracy: 87.04% -> 89.51%     
client [16] (testset)   loss: 0.5484 -> 0.3952  accuracy: 89.33% -> 92.13%     
client [80] (testset)   loss: 0.4482 -> 0.4450  accuracy: 90.21% -> 91.75%     
client [38] (testset)   loss: 0.5331 -> 0.4966  accuracy: 89.52% -> 90.21%     
client [78] (testset)   loss: 0.4644 -> 0.4697  accuracy: 92.05% -> 93.18%     
client [68] (testset)   loss: 0.4352 -> 0.4069  accuracy: 92.63% -> 93.05%     
client [11] (testset)   loss: 0.4887 -> 0.4650  accuracy: 91.48% -> 90.49%     
client [64] (testset)   loss: 0.3013 -> 0.3669  accuracy: 92.31% -> 91.45%     
client [82] (testset)   loss: 0.5296 -> 0.3600  accuracy: 85.82% -> 90.30%     
---------------------------- TRAINING EPOCH: 250 ----------------------------  
client [30] (testset)   loss: 0.5426 -> 0.5046  accuracy: 90.55% -> 92.18%     
client [27] (testset)   loss: 0.3218 -> 0.4080  accuracy: 90.64% -> 91.63%     
client [74] (testset)   loss: 0.4959 -> 0.5380  accuracy: 91.57% -> 91.57%     
client [45] (testset)   loss: 0.6165 -> 0.6996  accuracy: 89.21% -> 85.89%     
client [6]  (testset)   loss: 0.9658 -> 0.8860  accuracy: 85.51% -> 87.38%     
client [36] (testset)   loss: 0.7764 -> 0.6313  accuracy: 84.31% -> 86.27%     
client [63] (testset)   loss: 0.5058 -> 0.4908  accuracy: 89.64% -> 90.04%     
client [76] (testset)   loss: 0.3892 -> 0.3589  accuracy: 91.41% -> 92.94%     
client [83] (testset)   loss: 0.2734 -> 0.2615  accuracy: 91.50% -> 94.50%     
client [86] (testset)   loss: 0.3532 -> 0.4048  accuracy: 91.98% -> 91.22%     
---------------------------- TRAINING EPOCH: 260 ----------------------------  
client [83] (testset)   loss: 0.2584 -> 0.2688  accuracy: 92.50% -> 93.50%     
client [99] (testset)   loss: 0.4229 -> 0.3813  accuracy: 91.76% -> 92.16%     
client [74] (testset)   loss: 0.5224 -> 0.5329  accuracy: 92.37% -> 91.97%     
client [73] (testset)   loss: 0.2826 -> 0.2471  accuracy: 92.91% -> 94.93%     
client [29] (testset)   loss: 0.6863 -> 0.5516  accuracy: 84.76% -> 87.62%     
client [92] (testset)   loss: 0.6606 -> 0.6347  accuracy: 91.03% -> 90.34%     
client [6]  (testset)   loss: 1.0008 -> 0.8746  accuracy: 86.45% -> 86.92%     
client [61] (testset)   loss: 0.5482 -> 0.5005  accuracy: 88.50% -> 89.38%     
client [21] (testset)   loss: 0.3613 -> 0.3497  accuracy: 88.73% -> 91.27%     
client [67] (testset)   loss: 0.2072 -> 0.1860  accuracy: 95.10% -> 94.12%     
---------------------------- TRAINING EPOCH: 270 ----------------------------  
client [83] (testset)   loss: 0.3556 -> 0.2878  accuracy: 92.00% -> 93.50%     
client [32] (testset)   loss: 0.2968 -> 0.3022  accuracy: 89.71% -> 94.12%     
client [95] (testset)   loss: 0.3816 -> 0.3067  accuracy: 93.77% -> 93.77%     
client [61] (testset)   loss: 0.5368 -> 0.4810  accuracy: 88.94% -> 88.94%     
client [27] (testset)   loss: 0.3412 -> 0.4515  accuracy: 90.15% -> 92.61%     
client [25] (testset)   loss: 0.6623 -> 0.6090  accuracy: 85.71% -> 86.51%     
client [68] (testset)   loss: 0.4227 -> 0.4316  accuracy: 92.35% -> 92.49%     
client [34] (testset)   loss: 0.7017 -> 0.5776  accuracy: 83.33% -> 81.58%     
client [71] (testset)   loss: 0.5571 -> 0.7488  accuracy: 88.02% -> 85.03%     
client [89] (testset)   loss: 0.3492 -> 0.2548  accuracy: 90.07% -> 92.20%     
---------------------------- TRAINING EPOCH: 280 ----------------------------  
client [78] (testset)   loss: 0.4701 -> 0.4854  accuracy: 93.47% -> 94.32%     
client [81] (testset)   loss: 0.7299 -> 0.6242  accuracy: 87.18% -> 89.23%     
client [51] (testset)   loss: 0.2929 -> 0.2950  accuracy: 90.67% -> 92.00%     
client [54] (testset)   loss: 0.3026 -> 0.3525  accuracy: 92.93% -> 91.30%     
client [65] (testset)   loss: 0.4634 -> 0.3506  accuracy: 90.60% -> 90.98%     
client [41] (testset)   loss: 0.3057 -> 0.2776  accuracy: 92.34% -> 92.34%     
client [11] (testset)   loss: 0.5278 -> 0.4693  accuracy: 87.54% -> 90.49%     
client [85] (testset)   loss: 0.2598 -> 0.3552  accuracy: 93.36% -> 90.46%     
client [12] (testset)   loss: 0.2536 -> 0.3044  accuracy: 95.16% -> 94.95%     
client [23] (testset)   loss: 0.6834 -> 0.5811  accuracy: 85.22% -> 89.13%     
---------------------------- TRAINING EPOCH: 290 ----------------------------  
client [16] (testset)   loss: 0.5266 -> 0.3840  accuracy: 90.73% -> 92.13%     
client [65] (testset)   loss: 0.4720 -> 0.3741  accuracy: 91.73% -> 92.11%     
client [53] (testset)   loss: 0.4651 -> 0.5089  accuracy: 89.83% -> 93.22%     
client [58] (testset)   loss: 0.5932 -> 0.5239  accuracy: 89.39% -> 91.52%     
client [72] (testset)   loss: 0.5063 -> 0.5285  accuracy: 89.18% -> 88.43%     
client [7]  (testset)   loss: 0.6553 -> 0.3768  accuracy: 88.50% -> 91.00%     
client [71] (testset)   loss: 0.5942 -> 0.7876  accuracy: 88.02% -> 86.83%     
client [59] (testset)   loss: 0.4624 -> 0.3802  accuracy: 92.46% -> 92.96%     
client [86] (testset)   loss: 0.3845 -> 0.4147  accuracy: 92.75% -> 91.98%     
client [39] (testset)   loss: 0.8158 -> 0.7175  accuracy: 87.10% -> 89.78%     
---------------------------- TRAINING EPOCH: 300 ----------------------------  
client [99] (testset)   loss: 0.4122 -> 0.3917  accuracy: 90.98% -> 92.16%     
client [7]  (testset)   loss: 0.6372 -> 0.4194  accuracy: 87.00% -> 90.50%     
client [17] (testset)   loss: 0.2699 -> 0.2941  accuracy: 92.62% -> 91.28%     
client [64] (testset)   loss: 0.3113 -> 0.3940  accuracy: 91.88% -> 90.60%     
client [37] (testset)   loss: 0.5080 -> 0.5702  accuracy: 88.48% -> 89.53%     
client [29] (testset)   loss: 0.6371 -> 0.5735  accuracy: 87.62% -> 89.52%     
client [93] (testset)   loss: 0.5084 -> 0.4242  accuracy: 90.02% -> 91.73%     
client [73] (testset)   loss: 0.2907 -> 0.2520  accuracy: 93.58% -> 93.92%     
client [40] (testset)   loss: 0.5587 -> 0.4637  accuracy: 90.88% -> 91.42%     
client [76] (testset)   loss: 0.3468 -> 0.3821  accuracy: 92.33% -> 92.94%     
---------------------------- TRAINING EPOCH: 310 ----------------------------  
client [31] (testset)   loss: 0.3701 -> 0.3078  accuracy: 92.73% -> 94.09%     
client [89] (testset)   loss: 0.3351 -> 0.2537  accuracy: 92.20% -> 90.78%     
client [77] (testset)   loss: 0.5638 -> 0.5140  accuracy: 87.50% -> 90.09%     
client [90] (testset)   loss: 0.6777 -> 0.6739  accuracy: 87.46% -> 89.55%     
client [26] (testset)   loss: 0.2225 -> 0.2257  accuracy: 95.09% -> 94.39%     
client [50] (testset)   loss: 0.4801 -> 0.5274  accuracy: 89.61% -> 90.26%     
client [30] (testset)   loss: 0.5061 -> 0.5061  accuracy: 93.16% -> 93.16%     
client [70] (testset)   loss: 0.2062 -> 0.3159  accuracy: 96.08% -> 95.59%     
client [41] (testset)   loss: 0.2892 -> 0.2541  accuracy: 92.70% -> 93.80%     
client [99] (testset)   loss: 0.3937 -> 0.3870  accuracy: 91.76% -> 92.16%     
---------------------------- TRAINING EPOCH: 320 ----------------------------  
client [68] (testset)   loss: 0.4357 -> 0.4408  accuracy: 93.60% -> 93.46%     
client [70] (testset)   loss: 0.2181 -> 0.3679  accuracy: 95.10% -> 94.61%     
client [52] (testset)   loss: 0.5103 -> 0.4514  accuracy: 87.94% -> 90.48%     
client [1]  (testset)   loss: 0.8861 -> 0.8889  accuracy: 88.89% -> 88.89%     
client [2]  (testset)   loss: 0.3445 -> 0.3438  accuracy: 92.95% -> 94.30%     
client [67] (testset)   loss: 0.3055 -> 0.2050  accuracy: 92.65% -> 94.12%     
client [92] (testset)   loss: 0.7600 -> 0.8066  accuracy: 90.34% -> 88.97%     
client [35] (testset)   loss: 0.5737 -> 0.5073  accuracy: 87.04% -> 88.89%     
client [36] (testset)   loss: 0.6906 -> 0.5962  accuracy: 86.27% -> 90.20%     
client [64] (testset)   loss: 0.3098 -> 0.3618  accuracy: 90.60% -> 91.45%     
---------------------------- TRAINING EPOCH: 330 ----------------------------  
client [44] (testset)   loss: 0.4410 -> 0.4682  accuracy: 90.35% -> 91.99%     
client [6]  (testset)   loss: 0.8712 -> 0.9041  accuracy: 87.38% -> 88.32%     
client [12] (testset)   loss: 0.3297 -> 0.2934  accuracy: 94.07% -> 94.73%     
client [55] (testset)   loss: 0.3441 -> 0.3002  accuracy: 89.76% -> 93.17%     
client [29] (testset)   loss: 0.5723 -> 0.5520  accuracy: 88.57% -> 91.43%     
client [9]  (testset)   loss: 0.6309 -> 0.6127  accuracy: 89.76% -> 88.78%     
client [43] (testset)   loss: 0.9610 -> 0.7722  accuracy: 83.78% -> 83.78%     
client [77] (testset)   loss: 0.5437 -> 0.5307  accuracy: 88.36% -> 88.79%     
client [98] (testset)   loss: 0.4118 -> 0.3615  accuracy: 89.79% -> 91.49%     
client [78] (testset)   loss: 0.4820 -> 0.5119  accuracy: 93.18% -> 92.90%     
---------------------------- TRAINING EPOCH: 340 ----------------------------  
client [92] (testset)   loss: 0.7476 -> 0.8078  accuracy: 88.97% -> 88.97%     
client [80] (testset)   loss: 0.3907 -> 0.5763  accuracy: 92.78% -> 89.18%     
client [63] (testset)   loss: 0.5592 -> 0.5480  accuracy: 89.24% -> 90.44%     
client [76] (testset)   loss: 0.3656 -> 0.3991  accuracy: 92.94% -> 92.02%     
client [78] (testset)   loss: 0.4990 -> 0.5318  accuracy: 93.18% -> 93.18%     
client [25] (testset)   loss: 0.6774 -> 0.6580  accuracy: 86.51% -> 87.30%     
client [58] (testset)   loss: 0.6757 -> 0.5412  accuracy: 87.88% -> 92.12%     
client [13] (testset)   loss: 0.4083 -> 0.3707  accuracy: 91.62% -> 92.67%     
client [17] (testset)   loss: 0.2896 -> 0.2803  accuracy: 93.29% -> 93.96%     
client [38] (testset)   loss: 0.5503 -> 0.5409  accuracy: 89.75% -> 89.98%     
---------------------------- TRAINING EPOCH: 350 ----------------------------  
client [72] (testset)   loss: 0.5109 -> 0.5551  accuracy: 89.93% -> 88.43%     
client [82] (testset)   loss: 0.4246 -> 0.3362  accuracy: 88.81% -> 91.79%     
client [86] (testset)   loss: 0.4168 -> 0.4351  accuracy: 91.98% -> 92.37%     
client [51] (testset)   loss: 0.2928 -> 0.3541  accuracy: 92.00% -> 89.33%     
client [96] (testset)   loss: 0.5234 -> 0.4441  accuracy: 90.32% -> 91.13%     
client [42] (testset)   loss: 0.3946 -> 0.3592  accuracy: 92.70% -> 93.02%     
client [55] (testset)   loss: 0.3801 -> 0.2838  accuracy: 92.20% -> 92.20%     
client [13] (testset)   loss: 0.4159 -> 0.3668  accuracy: 92.15% -> 90.05%     
client [1]  (testset)   loss: 0.9582 -> 0.8801  accuracy: 88.89% -> 89.58%     
client [12] (testset)   loss: 0.3188 -> 0.3261  accuracy: 94.95% -> 94.95%     
---------------------------- TRAINING EPOCH: 360 ----------------------------  
client [68] (testset)   loss: 0.4498 -> 0.4400  accuracy: 93.46% -> 94.02%     
client [23] (testset)   loss: 0.7933 -> 0.5926  accuracy: 83.91% -> 88.26%     
client [46] (testset)   loss: 0.3636 -> 0.3464  accuracy: 86.32% -> 90.53%     
client [41] (testset)   loss: 0.2962 -> 0.2561  accuracy: 92.70% -> 93.07%     
client [25] (testset)   loss: 0.6505 -> 0.5904  accuracy: 88.49% -> 86.90%     
client [58] (testset)   loss: 0.6902 -> 0.5281  accuracy: 86.67% -> 90.30%     
client [14] (testset)   loss: 0.5688 -> 0.5442  accuracy: 91.20% -> 93.07%     
client [33] (testset)   loss: 0.4932 -> 0.7403  accuracy: 90.00% -> 85.00%     
client [85] (testset)   loss: 0.3255 -> 0.3851  accuracy: 92.53% -> 90.46%     
client [62] (testset)   loss: 0.7052 -> 0.6456  accuracy: 88.29% -> 88.29%     
---------------------------- TRAINING EPOCH: 370 ----------------------------  
client [98] (testset)   loss: 0.4025 -> 0.3317  accuracy: 91.06% -> 92.77%     
client [63] (testset)   loss: 0.6119 -> 0.6220  accuracy: 90.44% -> 90.04%     
client [70] (testset)   loss: 0.2205 -> 0.2795  accuracy: 94.61% -> 96.08%     
client [65] (testset)   loss: 0.5017 -> 0.4138  accuracy: 90.60% -> 91.35%     
client [14] (testset)   loss: 0.5657 -> 0.5628  accuracy: 93.07% -> 93.33%     
client [73] (testset)   loss: 0.3149 -> 0.2681  accuracy: 93.58% -> 93.92%     
client [34] (testset)   loss: 0.7933 -> 0.7635  accuracy: 84.21% -> 83.33%     
client [99] (testset)   loss: 0.4246 -> 0.4115  accuracy: 91.37% -> 92.55%     
client [69] (testset)   loss: 0.8217 -> 0.6935  accuracy: 87.62% -> 87.62%     
client [46] (testset)   loss: 0.4196 -> 0.3125  accuracy: 87.37% -> 90.00%     
---------------------------- TRAINING EPOCH: 380 ----------------------------  
client [99] (testset)   loss: 0.3963 -> 0.4002  accuracy: 92.55% -> 91.76%     
client [93] (testset)   loss: 0.4529 -> 0.4390  accuracy: 91.97% -> 92.21%     
client [11] (testset)   loss: 0.5004 -> 0.5048  accuracy: 91.15% -> 91.48%     
client [58] (testset)   loss: 0.6713 -> 0.5779  accuracy: 88.79% -> 90.91%     
client [81] (testset)   loss: 0.7211 -> 0.6481  accuracy: 88.72% -> 90.26%     
client [85] (testset)   loss: 0.2855 -> 0.3980  accuracy: 92.53% -> 88.80%     
client [89] (testset)   loss: 0.3521 -> 0.2621  accuracy: 92.20% -> 92.20%     
client [45] (testset)   loss: 0.8198 -> 0.7157  accuracy: 89.21% -> 88.80%     
client [8]  (testset)   loss: 0.3970 -> 0.3095  accuracy: 95.38% -> 95.38%     
client [68] (testset)   loss: 0.4752 -> 0.4644  accuracy: 93.05% -> 93.74%     
---------------------------- TRAINING EPOCH: 390 ----------------------------  
client [67] (testset)   loss: 0.3112 -> 0.1906  accuracy: 92.65% -> 94.61%     
client [72] (testset)   loss: 0.5242 -> 0.5479  accuracy: 89.93% -> 89.93%     
client [1]  (testset)   loss: 0.8781 -> 1.0010  accuracy: 88.19% -> 90.97%     
client [78] (testset)   loss: 0.5394 -> 0.5480  accuracy: 93.18% -> 93.47%     
client [83] (testset)   loss: 0.3898 -> 0.2952  accuracy: 92.50% -> 94.00%     
client [21] (testset)   loss: 0.4217 -> 0.3871  accuracy: 89.09% -> 93.09%     
client [56] (testset)   loss: 0.5581 -> 0.5881  accuracy: 88.06% -> 85.57%     
client [44] (testset)   loss: 0.4702 -> 0.4932  accuracy: 91.17% -> 91.79%     
client [92] (testset)   loss: 0.7735 -> 0.8143  accuracy: 90.34% -> 88.97%     
client [27] (testset)   loss: 0.4189 -> 0.4171  accuracy: 90.15% -> 92.12%     
---------------------------- TRAINING EPOCH: 400 ----------------------------  
client [10] (testset)   loss: 0.3414 -> 0.3794  accuracy: 93.26% -> 91.19%     
client [39] (testset)   loss: 0.9028 -> 0.7347  accuracy: 86.02% -> 89.25%     
client [65] (testset)   loss: 0.5059 -> 0.3671  accuracy: 90.23% -> 92.86%     
client [26] (testset)   loss: 0.2345 -> 0.2233  accuracy: 94.74% -> 94.74%     
client [19] (testset)   loss: 0.2531 -> 0.2552  accuracy: 92.46% -> 91.27%     
client [68] (testset)   loss: 0.4446 -> 0.4591  accuracy: 93.18% -> 93.74%     
client [41] (testset)   loss: 0.3202 -> 0.2747  accuracy: 91.24% -> 92.70%     
client [50] (testset)   loss: 0.4687 -> 0.5237  accuracy: 89.61% -> 90.26%     
client [75] (testset)   loss: 0.7824 -> 0.6745  accuracy: 87.50% -> 88.75%     
client [81] (testset)   loss: 0.7204 -> 0.6490  accuracy: 88.21% -> 89.74%     
Training... ---------------------------------------- 100% 0:22:34
FedOBP's average time taken by each global epoch: 0 min 3.36 sec.              
FedOBP's total running time: 0 h 22 m 34 s.                                    
==================== FedOBP Experiment Results: ====================           
Display format: (before local fine-tuning) -> (after local fine-tuning)        
 So if finetune_epoch = 0, x.xx% -> 0.00% is normal.                           
 Centralized testing ONLY happens after model aggregation, so the stats between
'->' are the same.                                                             
{                                                                              
    "100": {                                                                   
        "all_clients": {                                                       
            "test": {                                                          
                "loss": "0.4620 -> 0.0000",                                    
                "accuracy": "88.67% -> 0.00%"                                  
            }                                                                  
        }                                                                      
    },                                                                         
    "200": {                                                                   
        "all_clients": {                                                       
            "test": {                                                          
                "loss": "0.4620 -> 0.0000",                                    
                "accuracy": "89.80% -> 0.00%"                                  
            }                                                                  
        }                                                                      
    },                                                                         
    "300": {                                                                   
        "all_clients": {                                                       
            "test": {                                                          
                "loss": "0.4985 -> 0.0000",                                    
                "accuracy": "90.39% -> 0.00%"                                  
            }                                                                  
        }                                                                      
    },                                                                         
    "400": {                                                                   
        "all_clients": {                                                       
            "test": {                                                          
                "loss": "0.5377 -> 0.0000",                                    
                "accuracy": "90.74% -> 0.00%"                                  
            }                                                                  
        }                                                                      
    }                                                                          
}                                                                              
==================== FedOBP Max Accuracy ====================                  
all_clients:                                                                   
(test) before fine-tuning: 90.74% at epoch 400                                 
(test) after fine-tuning: 0.00% at epoch 100                                   
[0m