out\fedobp\mnist\Main_GlobalNorm_EMAscore(0.5)_ALL_IG_0.99993
==================== FedOBP ====================                               
Experiment Arguments:                                                          
{
│   'method': 'fedobp',
│   'dataset': {
│   │   'name': 'mnist',
│   │   'client_num': 100,
│   │   'test_ratio': 0.25,
│   │   'val_ratio': 0.0,
│   │   'seed': 42,
│   │   'split': 'sample',
│   │   'IID_ratio': 0.0,
│   │   'monitor_window_name_suffix': 'mnist-100clients-0%IID-Dir(0.5)-seed42',
│   │   'alpha': 0.5,
│   │   'min_samples_per_client': 10
│   },
│   'model': {
│   │   'name': 'avgcnn',
│   │   'use_torchvision_pretrained_weights': True,
│   │   'external_model_weights_path': None
│   },
│   'optimizer': {
│   │   'lr': 0.01,
│   │   'dampening': 0,
│   │   'weight_decay': 0,
│   │   'momentum': 0,
│   │   'nesterov': False,
│   │   'name': 'sgd'
│   },
│   'mode': 'serial',
│   'parallel': {
│   │   'ray_cluster_addr': None,
│   │   'num_cpus': None,
│   │   'num_gpus': None,
│   │   'num_workers': 2
│   },
│   'common': {
│   │   'seed': 42,
│   │   'join_ratio': 0.1,
│   │   'global_epoch': 400,
│   │   'local_epoch': 5,
│   │   'batch_size': 32,
│   │   'reset_optimizer_on_global_epoch': True,
│   │   'straggler_ratio': 0,
│   │   'straggler_min_local_epoch': 0,
│   │   'buffers': 'global',
│   │   'client_side_evaluation': True,
│   │   'test': {
│   │   │   'client': {
│   │   │   │   'interval': 100,
│   │   │   │   'finetune_epoch': 0,
│   │   │   │   'train': False,
│   │   │   │   'val': False,
│   │   │   │   'test': True
│   │   │   },
│   │   │   'server': {
│   │   │   │   'interval': -1,
│   │   │   │   'train': False,
│   │   │   │   'val': False,
│   │   │   │   'test': False,
│   │   │   │   'model_in_train_mode': False
│   │   │   }
│   │   },
│   │   'verbose_gap': 10,
│   │   'monitor': None,
│   │   'use_cuda': True,
│   │   'save_log': True,
│   │   'save_model': False,
│   │   'save_learning_curve_plot': False,
│   │   'save_metrics': True,
│   │   'delete_useless_run': True
│   },
│   'fedobp': {
│   │   'ig_ratio': 0.99993,
│   │   'alpha': 0.5,
│   │   'norm': 'global',
│   │   'EMA': True,
│   │   'CLS': False,
│   │   'track': False,
│   │   'type': 'Main'
│   }
}
---------------------------- TRAINING EPOCH: 10 ----------------------------   
client [77] (testset)   loss: 0.4590 -> 0.3001  accuracy: 84.71% -> 90.59%     
client [81] (testset)   loss: 0.2756 -> 0.2301  accuracy: 90.04% -> 91.70%     
client [21] (testset)   loss: 0.1787 -> 0.1293  accuracy: 94.26% -> 96.65%     
client [68] (testset)   loss: 0.2321 -> 0.0727  accuracy: 92.86% -> 98.66%     
client [93] (testset)   loss: 0.1838 -> 0.1008  accuracy: 92.91% -> 97.16%     
client [31] (testset)   loss: 0.1660 -> 0.1133  accuracy: 95.72% -> 96.26%     
client [20] (testset)   loss: 0.2411 -> 0.1570  accuracy: 92.96% -> 95.07%     
client [59] (testset)   loss: 0.1321 -> 0.0925  accuracy: 97.92% -> 96.88%     
client [48] (testset)   loss: 0.1658 -> 0.1490  accuracy: 95.04% -> 95.74%     
client [34] (testset)   loss: 0.2733 -> 0.1194  accuracy: 91.76% -> 96.25%     
---------------------------- TRAINING EPOCH: 20 ----------------------------   
client [69] (testset)   loss: 0.1121 -> 0.1626  accuracy: 97.14% -> 95.00%     
client [99] (testset)   loss: 0.2021 -> 0.1386  accuracy: 93.49% -> 94.08%     
client [67] (testset)   loss: 0.2125 -> 0.0856  accuracy: 92.57% -> 97.71%     
client [0]  (testset)   loss: 0.1519 -> 0.1154  accuracy: 95.86% -> 96.82%     
client [76] (testset)   loss: 0.0973 -> 0.0677  accuracy: 96.72% -> 96.72%     
client [41] (testset)   loss: 0.1686 -> 0.1089  accuracy: 95.07% -> 96.41%     
client [62] (testset)   loss: 0.1150 -> 0.0286  accuracy: 96.36% -> 99.39%     
client [2]  (testset)   loss: 0.1152 -> 0.0629  accuracy: 96.10% -> 98.05%     
client [14] (testset)   loss: 0.1475 -> 0.1166  accuracy: 94.89% -> 96.59%     
client [46] (testset)   loss: 0.1683 -> 0.1808  accuracy: 92.66% -> 92.66%     
---------------------------- TRAINING EPOCH: 30 ----------------------------   
client [24] (testset)   loss: 0.0993 -> 0.0753  accuracy: 96.32% -> 97.37%     
client [68] (testset)   loss: 0.0559 -> 0.0385  accuracy: 97.32% -> 98.66%     
client [57] (testset)   loss: 0.0831 -> 0.1324  accuracy: 97.87% -> 96.81%     
client [17] (testset)   loss: 0.0810 -> 0.0570  accuracy: 96.77% -> 97.58%     
client [54] (testset)   loss: 0.0737 -> 0.0292  accuracy: 97.35% -> 99.56%     
client [23] (testset)   loss: 0.0630 -> 0.0245  accuracy: 99.13% -> 100.00%    
client [35] (testset)   loss: 0.1435 -> 0.0661  accuracy: 94.96% -> 96.64%     
client [59] (testset)   loss: 0.0477 -> 0.0467  accuracy: 100.00% -> 98.96%    
client [31] (testset)   loss: 0.0865 -> 0.0573  accuracy: 97.33% -> 97.86%     
client [9]  (testset)   loss: 0.0394 -> 0.0408  accuracy: 98.18% -> 98.18%     
---------------------------- TRAINING EPOCH: 40 ----------------------------   
client [64] (testset)   loss: 0.1220 -> 0.1490  accuracy: 96.83% -> 94.44%     
client [33] (testset)   loss: 0.0898 -> 0.0560  accuracy: 96.69% -> 98.34%     
client [16] (testset)   loss: 0.1792 -> 0.1404  accuracy: 94.96% -> 94.12%     
client [44] (testset)   loss: 0.0803 -> 0.9481  accuracy: 97.45% -> 82.44%     
client [8]  (testset)   loss: 0.0713 -> 0.0356  accuracy: 97.06% -> 98.53%     
client [31] (testset)   loss: 0.1200 -> 0.0505  accuracy: 97.33% -> 97.86%     
client [47] (testset)   loss: 0.0599 -> 0.0639  accuracy: 97.54% -> 97.35%     
client [36] (testset)   loss: 0.0789 -> 0.0572  accuracy: 96.91% -> 98.84%     
client [20] (testset)   loss: 0.1755 -> 0.0500  accuracy: 92.25% -> 97.89%     
client [56] (testset)   loss: 0.0874 -> 0.0712  accuracy: 96.92% -> 97.69%     
---------------------------- TRAINING EPOCH: 50 ----------------------------   
client [4]  (testset)   loss: 0.2325 -> 0.1858  accuracy: 97.47% -> 97.47%     
client [60] (testset)   loss: 0.0447 -> 0.0337  accuracy: 98.69% -> 98.69%     
client [28] (testset)   loss: 0.0617 -> 0.0645  accuracy: 97.55% -> 98.04%     
client [25] (testset)   loss: 0.0411 -> 0.0508  accuracy: 98.59% -> 98.59%     
client [58] (testset)   loss: 0.0839 -> 0.0953  accuracy: 97.96% -> 97.45%     
client [44] (testset)   loss: 0.0680 -> 0.0586  accuracy: 98.02% -> 97.73%     
client [39] (testset)   loss: 0.1242 -> 0.1266  accuracy: 96.32% -> 96.93%     
client [29] (testset)   loss: 0.0793 -> 0.0298  accuracy: 97.67% -> 99.42%     
client [3]  (testset)   loss: 0.1629 -> 0.1413  accuracy: 95.96% -> 94.95%     
client [84] (testset)   loss: 0.0493 -> 0.0330  accuracy: 97.76% -> 98.65%     
---------------------------- TRAINING EPOCH: 60 ----------------------------   
client [21] (testset)   loss: 0.0315 -> 0.0299  accuracy: 99.04% -> 99.04%     
client [84] (testset)   loss: 0.0518 -> 0.0242  accuracy: 98.21% -> 98.65%     
client [10] (testset)   loss: 0.0242 -> 0.0087  accuracy: 99.02% -> 99.51%     
client [36] (testset)   loss: 0.0554 -> 0.0803  accuracy: 98.07% -> 96.53%     
client [65] (testset)   loss: 0.0358 -> 0.0230  accuracy: 98.72% -> 99.15%     
client [81] (testset)   loss: 0.0731 -> 0.0739  accuracy: 98.34% -> 97.10%     
client [79] (testset)   loss: 0.1136 -> 0.1006  accuracy: 95.92% -> 96.60%     
client [42] (testset)   loss: 0.0854 -> 0.0823  accuracy: 97.60% -> 97.12%     
client [11] (testset)   loss: 0.0452 -> 0.0514  accuracy: 98.21% -> 96.41%     
client [96] (testset)   loss: 0.0541 -> 0.0323  accuracy: 98.60% -> 98.95%     
---------------------------- TRAINING EPOCH: 70 ----------------------------   
client [8]  (testset)   loss: 0.0805 -> 0.0361  accuracy: 95.59% -> 100.00%    
client [53] (testset)   loss: 0.0380 -> 0.0634  accuracy: 99.19% -> 96.75%     
client [52] (testset)   loss: 0.1855 -> 0.1625  accuracy: 96.10% -> 97.40%     
client [42] (testset)   loss: 0.0758 -> 0.0805  accuracy: 98.56% -> 97.12%     
client [69] (testset)   loss: 0.0863 -> 0.0570  accuracy: 97.86% -> 98.57%     
client [59] (testset)   loss: 0.0337 -> 0.0218  accuracy: 98.96% -> 98.96%     
client [7]  (testset)   loss: 0.0696 -> 0.0132  accuracy: 96.44% -> 99.56%     
client [26] (testset)   loss: 0.0802 -> 0.0388  accuracy: 97.56% -> 98.37%     
client [49] (testset)   loss: 0.0752 -> 0.0519  accuracy: 98.53% -> 98.53%     
client [98] (testset)   loss: 0.0930 -> 0.0627  accuracy: 96.19% -> 97.14%     
---------------------------- TRAINING EPOCH: 80 ----------------------------   
client [98] (testset)   loss: 0.0758 -> 0.0558  accuracy: 96.19% -> 97.14%     
client [47] (testset)   loss: 0.0500 -> 0.0432  accuracy: 98.49% -> 98.30%     
client [21] (testset)   loss: 0.0238 -> 0.0228  accuracy: 99.04% -> 99.52%     
client [77] (testset)   loss: 0.1310 -> 0.0863  accuracy: 95.29% -> 97.65%     
client [95] (testset)   loss: 0.0617 -> 0.0603  accuracy: 98.12% -> 96.71%     
client [91] (testset)   loss: 0.0434 -> 0.0368  accuracy: 98.23% -> 98.23%     
client [14] (testset)   loss: 0.0539 -> 0.0464  accuracy: 98.30% -> 97.73%     
client [99] (testset)   loss: 0.1120 -> 0.0619  accuracy: 96.45% -> 97.04%     
client [20] (testset)   loss: 0.0923 -> 0.0330  accuracy: 95.77% -> 97.18%     
client [39] (testset)   loss: 0.1168 -> 0.1243  accuracy: 97.55% -> 97.55%     
---------------------------- TRAINING EPOCH: 90 ----------------------------   
client [52] (testset)   loss: 0.1909 -> 0.1321  accuracy: 96.10% -> 97.40%     
client [62] (testset)   loss: 0.0198 -> 0.0136  accuracy: 99.39% -> 99.39%     
client [71] (testset)   loss: 0.0060 -> 0.0087  accuracy: 100.00% -> 100.00%   
client [97] (testset)   loss: 0.0591 -> 0.0373  accuracy: 98.88% -> 98.31%     
client [30] (testset)   loss: 0.0144 -> 0.0161  accuracy: 99.35% -> 99.35%     
client [88] (testset)   loss: 0.0257 -> 0.0017  accuracy: 98.99% -> 100.00%    
client [60] (testset)   loss: 0.0251 -> 0.0151  accuracy: 99.35% -> 99.35%     
client [82] (testset)   loss: 0.0724 -> 0.0541  accuracy: 98.74% -> 98.23%     
client [91] (testset)   loss: 0.0218 -> 0.0240  accuracy: 99.12% -> 99.12%     
client [57] (testset)   loss: 0.0461 -> 0.0599  accuracy: 97.87% -> 96.81%     
---------------------------- TRAINING EPOCH: 100 ----------------------------  
client [31] (testset)   loss: 0.0777 -> 0.0468  accuracy: 97.86% -> 98.40%     
client [15] (testset)   loss: 0.0626 -> 0.0332  accuracy: 96.77% -> 98.71%     
client [71] (testset)   loss: 0.0042 -> 0.0042  accuracy: 100.00% -> 100.00%   
client [97] (testset)   loss: 0.0494 -> 0.0325  accuracy: 98.88% -> 98.88%     
client [53] (testset)   loss: 0.0458 -> 0.0544  accuracy: 97.56% -> 96.75%     
client [77] (testset)   loss: 0.1269 -> 0.0901  accuracy: 95.29% -> 96.47%     
client [76] (testset)   loss: 0.0223 -> 0.0314  accuracy: 99.45% -> 98.36%     
client [79] (testset)   loss: 0.1134 -> 0.0987  accuracy: 97.28% -> 97.96%     
client [28] (testset)   loss: 0.0531 -> 0.0259  accuracy: 98.04% -> 98.53%     
client [99] (testset)   loss: 0.0791 -> 0.0583  accuracy: 97.04% -> 98.22%     
---------------------------- TRAINING EPOCH: 110 ----------------------------  
client [97] (testset)   loss: 0.0497 -> 0.0314  accuracy: 98.88% -> 98.88%     
client [86] (testset)   loss: 0.0311 -> 0.0477  accuracy: 99.49% -> 99.49%     
client [34] (testset)   loss: 0.0757 -> 0.0571  accuracy: 97.38% -> 98.13%     
client [73] (testset)   loss: 0.0269 -> 0.0217  accuracy: 99.42% -> 99.42%     
client [5]  (testset)   loss: 0.0667 -> 0.0763  accuracy: 98.24% -> 97.65%     
client [96] (testset)   loss: 0.0557 -> 0.0206  accuracy: 98.25% -> 99.65%     
client [22] (testset)   loss: 0.1058 -> 0.0302  accuracy: 95.56% -> 97.78%     
client [60] (testset)   loss: 0.0323 -> 0.0200  accuracy: 99.35% -> 99.35%     
client [66] (testset)   loss: 0.0654 -> 0.0364  accuracy: 97.07% -> 99.16%     
client [83] (testset)   loss: 0.0614 -> 0.0650  accuracy: 99.16% -> 99.16%     
---------------------------- TRAINING EPOCH: 120 ----------------------------  
client [76] (testset)   loss: 0.0202 -> 0.0278  accuracy: 99.45% -> 98.91%     
client [65] (testset)   loss: 0.0360 -> 0.0150  accuracy: 97.87% -> 100.00%    
client [95] (testset)   loss: 0.0398 -> 0.0462  accuracy: 98.59% -> 98.12%     
client [17] (testset)   loss: 0.0424 -> 0.0427  accuracy: 98.39% -> 97.58%     
client [8]  (testset)   loss: 0.0697 -> 0.0257  accuracy: 97.06% -> 100.00%    
client [35] (testset)   loss: 0.0469 -> 0.0336  accuracy: 97.48% -> 98.32%     
client [98] (testset)   loss: 0.0619 -> 0.0404  accuracy: 96.19% -> 98.10%     
client [53] (testset)   loss: 0.0297 -> 0.0399  accuracy: 99.19% -> 97.56%     
client [43] (testset)   loss: 0.0975 -> 0.1169  accuracy: 99.21% -> 98.41%     
client [64] (testset)   loss: 0.0440 -> 0.0716  accuracy: 98.41% -> 97.62%     
---------------------------- TRAINING EPOCH: 130 ----------------------------  
client [21] (testset)   loss: 0.0144 -> 0.0185  accuracy: 99.52% -> 99.52%     
client [88] (testset)   loss: 0.0152 -> 0.0016  accuracy: 98.99% -> 100.00%    
client [38] (testset)   loss: 0.0681 -> 0.0399  accuracy: 97.91% -> 99.48%     
client [3]  (testset)   loss: 0.1212 -> 0.1164  accuracy: 97.98% -> 97.98%     
client [5]  (testset)   loss: 0.0595 -> 0.0775  accuracy: 97.65% -> 97.65%     
client [41] (testset)   loss: 0.0845 -> 0.0716  accuracy: 97.76% -> 96.86%     
client [7]  (testset)   loss: 0.0547 -> 0.0080  accuracy: 96.44% -> 100.00%    
client [37] (testset)   loss: 0.0265 -> 0.0237  accuracy: 98.35% -> 99.17%     
client [45] (testset)   loss: 0.0531 -> 0.0348  accuracy: 98.59% -> 99.30%     
client [47] (testset)   loss: 0.0359 -> 0.0351  accuracy: 98.11% -> 98.87%     
---------------------------- TRAINING EPOCH: 140 ----------------------------  
client [16] (testset)   loss: 0.1426 -> 0.1100  accuracy: 95.80% -> 96.64%     
client [11] (testset)   loss: 0.0381 -> 0.0241  accuracy: 99.10% -> 99.55%     
client [37] (testset)   loss: 0.0284 -> 0.0225  accuracy: 98.35% -> 99.17%     
client [41] (testset)   loss: 0.0690 -> 0.0706  accuracy: 98.21% -> 96.86%     
client [95] (testset)   loss: 0.0356 -> 0.0362  accuracy: 98.59% -> 98.59%     
client [53] (testset)   loss: 0.0473 -> 0.0337  accuracy: 97.56% -> 99.19%     
client [22] (testset)   loss: 0.0379 -> 0.0232  accuracy: 97.78% -> 98.52%     
client [25] (testset)   loss: 0.0149 -> 0.0194  accuracy: 98.59% -> 98.59%     
client [69] (testset)   loss: 0.0536 -> 0.0438  accuracy: 98.57% -> 98.57%     
client [46] (testset)   loss: 0.0658 -> 0.0272  accuracy: 98.17% -> 100.00%    
---------------------------- TRAINING EPOCH: 150 ----------------------------  
client [47] (testset)   loss: 0.0331 -> 0.0381  accuracy: 98.87% -> 98.68%     
client [69] (testset)   loss: 0.0781 -> 0.0373  accuracy: 97.86% -> 98.57%     
client [82] (testset)   loss: 0.0672 -> 0.0698  accuracy: 98.48% -> 98.23%     
client [45] (testset)   loss: 0.0578 -> 0.0443  accuracy: 98.59% -> 99.30%     
client [7]  (testset)   loss: 0.0528 -> 0.0096  accuracy: 96.89% -> 100.00%    
client [50] (testset)   loss: 0.0537 -> 0.0252  accuracy: 98.88% -> 97.75%     
client [35] (testset)   loss: 0.0574 -> 0.0241  accuracy: 98.32% -> 99.16%     
client [24] (testset)   loss: 0.0226 -> 0.0167  accuracy: 98.95% -> 99.47%     
client [15] (testset)   loss: 0.0809 -> 0.0246  accuracy: 96.13% -> 99.35%     
client [58] (testset)   loss: 0.1092 -> 0.1013  accuracy: 97.45% -> 97.96%     
---------------------------- TRAINING EPOCH: 160 ----------------------------  
client [48] (testset)   loss: 0.0198 -> 0.0139  accuracy: 100.00% -> 99.29%    
client [76] (testset)   loss: 0.0172 -> 0.0251  accuracy: 98.91% -> 98.36%     
client [67] (testset)   loss: 0.0531 -> 0.0172  accuracy: 97.71% -> 98.86%     
client [37] (testset)   loss: 0.0185 -> 0.0168  accuracy: 99.17% -> 99.17%     
client [58] (testset)   loss: 0.0722 -> 0.0865  accuracy: 97.96% -> 97.96%     
client [64] (testset)   loss: 0.0582 -> 0.0585  accuracy: 98.41% -> 97.62%     
client [77] (testset)   loss: 0.1054 -> 0.0805  accuracy: 95.29% -> 95.29%     
client [55] (testset)   loss: 0.0204 -> 0.0103  accuracy: 99.20% -> 99.73%     
client [12] (testset)   loss: 0.0573 -> 0.0683  accuracy: 98.58% -> 98.58%     
client [89] (testset)   loss: 0.0098 -> 0.0095  accuracy: 99.58% -> 99.58%     
---------------------------- TRAINING EPOCH: 170 ----------------------------  
client [84] (testset)   loss: 0.0162 -> 0.0105  accuracy: 99.10% -> 99.55%     
client [51] (testset)   loss: 0.0222 -> 0.0135  accuracy: 98.51% -> 99.50%     
client [8]  (testset)   loss: 0.0608 -> 0.0143  accuracy: 98.53% -> 100.00%    
client [18] (testset)   loss: 0.0177 -> 0.0113  accuracy: 100.00% -> 99.26%    
client [94] (testset)   loss: 0.0413 -> 0.0293  accuracy: 98.78% -> 98.78%     
client [81] (testset)   loss: 0.0546 -> 0.0573  accuracy: 97.93% -> 98.34%     
client [3]  (testset)   loss: 0.1181 -> 0.1182  accuracy: 97.98% -> 97.98%     
client [11] (testset)   loss: 0.0243 -> 0.0177  accuracy: 98.65% -> 100.00%    
client [95] (testset)   loss: 0.0298 -> 0.0314  accuracy: 98.59% -> 99.06%     
client [67] (testset)   loss: 0.0390 -> 0.0175  accuracy: 98.29% -> 98.86%     
---------------------------- TRAINING EPOCH: 180 ----------------------------  
client [21] (testset)   loss: 0.0098 -> 0.0131  accuracy: 100.00% -> 99.52%    
client [79] (testset)   loss: 0.1144 -> 0.1034  accuracy: 97.96% -> 98.64%     
client [58] (testset)   loss: 0.0854 -> 0.0975  accuracy: 98.47% -> 97.96%     
client [88] (testset)   loss: 0.0064 -> 0.0007  accuracy: 100.00% -> 100.00%   
client [46] (testset)   loss: 0.0392 -> 0.0239  accuracy: 99.08% -> 99.08%     
client [11] (testset)   loss: 0.0213 -> 0.0228  accuracy: 98.65% -> 99.10%     
client [55] (testset)   loss: 0.0250 -> 0.0105  accuracy: 99.20% -> 99.73%     
client [13] (testset)   loss: 0.0707 -> 0.0494  accuracy: 98.45% -> 98.14%     
client [31] (testset)   loss: 0.0946 -> 0.0484  accuracy: 97.86% -> 98.40%     
client [75] (testset)   loss: 0.0100 -> 0.0044  accuracy: 100.00% -> 100.00%   
---------------------------- TRAINING EPOCH: 190 ----------------------------  
client [19] (testset)   loss: 0.0438 -> 0.0016  accuracy: 98.85% -> 100.00%    
client [7]  (testset)   loss: 0.0420 -> 0.0189  accuracy: 97.78% -> 100.00%    
client [57] (testset)   loss: 0.0525 -> 0.0408  accuracy: 97.87% -> 97.87%     
client [13] (testset)   loss: 0.0559 -> 0.0496  accuracy: 98.76% -> 97.83%     
client [43] (testset)   loss: 0.1136 -> 0.1490  accuracy: 98.41% -> 97.62%     
client [91] (testset)   loss: 0.0161 -> 0.0232  accuracy: 99.12% -> 99.12%     
client [10] (testset)   loss: 0.0211 -> 0.0037  accuracy: 99.02% -> 100.00%    
client [64] (testset)   loss: 0.0826 -> 0.0551  accuracy: 98.41% -> 98.41%     
client [82] (testset)   loss: 0.0755 -> 0.0659  accuracy: 98.74% -> 98.48%     
client [22] (testset)   loss: 0.0789 -> 0.0217  accuracy: 97.04% -> 99.26%     
---------------------------- TRAINING EPOCH: 200 ----------------------------  
client [20] (testset)   loss: 0.0606 -> 0.0212  accuracy: 97.18% -> 98.59%     
client [23] (testset)   loss: 0.0050 -> 0.0232  accuracy: 100.00% -> 99.13%    
client [88] (testset)   loss: 0.0052 -> 0.0006  accuracy: 100.00% -> 100.00%   
client [98] (testset)   loss: 0.0475 -> 0.0353  accuracy: 96.19% -> 98.10%     
client [79] (testset)   loss: 0.1092 -> 0.1059  accuracy: 97.96% -> 98.64%     
client [21] (testset)   loss: 0.0153 -> 0.0126  accuracy: 99.52% -> 99.52%     
client [92] (testset)   loss: 0.1141 -> 0.0896  accuracy: 98.25% -> 98.25%     
client [56] (testset)   loss: 0.0404 -> 0.0486  accuracy: 98.46% -> 98.46%     
client [5]  (testset)   loss: 0.0648 -> 0.0837  accuracy: 98.82% -> 98.24%     
client [52] (testset)   loss: 0.1926 -> 0.1279  accuracy: 96.10% -> 98.70%     
---------------------------- TRAINING EPOCH: 210 ----------------------------  
client [67] (testset)   loss: 0.0490 -> 0.0185  accuracy: 98.29% -> 99.43%     
client [54] (testset)   loss: 0.0232 -> 0.0080  accuracy: 99.12% -> 100.00%    
client [14] (testset)   loss: 0.0312 -> 0.0401  accuracy: 98.86% -> 98.30%     
client [99] (testset)   loss: 0.0617 -> 0.0514  accuracy: 98.22% -> 98.22%     
client [36] (testset)   loss: 0.0273 -> 0.0129  accuracy: 99.23% -> 99.61%     
client [30] (testset)   loss: 0.0143 -> 0.0135  accuracy: 98.71% -> 99.35%     
client [38] (testset)   loss: 0.0460 -> 0.0346  accuracy: 97.91% -> 98.95%     
client [15] (testset)   loss: 0.0422 -> 0.0166  accuracy: 98.06% -> 99.35%     
client [6]  (testset)   loss: 0.0325 -> 0.0699  accuracy: 99.34% -> 98.68%     
client [53] (testset)   loss: 0.0506 -> 0.0285  accuracy: 97.56% -> 99.19%     
---------------------------- TRAINING EPOCH: 220 ----------------------------  
client [99] (testset)   loss: 0.0620 -> 0.0591  accuracy: 97.63% -> 98.22%     
client [6]  (testset)   loss: 0.0372 -> 0.0587  accuracy: 98.68% -> 99.34%     
client [83] (testset)   loss: 0.0565 -> 0.0661  accuracy: 99.16% -> 99.16%     
client [42] (testset)   loss: 0.0657 -> 0.0552  accuracy: 98.56% -> 98.56%     
client [34] (testset)   loss: 0.0899 -> 0.0552  accuracy: 97.38% -> 98.50%     
client [15] (testset)   loss: 0.0487 -> 0.0157  accuracy: 98.06% -> 99.35%     
client [47] (testset)   loss: 0.0284 -> 0.0307  accuracy: 99.05% -> 99.24%     
client [55] (testset)   loss: 0.0170 -> 0.0071  accuracy: 99.47% -> 99.73%     
client [51] (testset)   loss: 0.0150 -> 0.0123  accuracy: 99.50% -> 99.00%     
client [95] (testset)   loss: 0.0337 -> 0.0327  accuracy: 98.59% -> 99.06%     
---------------------------- TRAINING EPOCH: 230 ----------------------------  
client [71] (testset)   loss: 0.0005 -> 0.0005  accuracy: 100.00% -> 100.00%   
client [15] (testset)   loss: 0.0323 -> 0.0139  accuracy: 98.71% -> 99.35%     
client [33] (testset)   loss: 0.0390 -> 0.0223  accuracy: 99.45% -> 99.45%     
client [99] (testset)   loss: 0.0862 -> 0.0505  accuracy: 97.63% -> 98.82%     
client [90] (testset)   loss: 0.0311 -> 0.0204  accuracy: 98.56% -> 99.28%     
client [57] (testset)   loss: 0.0259 -> 0.0332  accuracy: 98.94% -> 97.87%     
client [27] (testset)   loss: 0.0933 -> 0.1013  accuracy: 98.48% -> 97.46%     
client [78] (testset)   loss: 0.0054 -> 0.0049  accuracy: 100.00% -> 100.00%   
client [36] (testset)   loss: 0.0258 -> 0.0139  accuracy: 99.23% -> 99.23%     
client [88] (testset)   loss: 0.0027 -> 0.0005  accuracy: 100.00% -> 100.00%   
---------------------------- TRAINING EPOCH: 240 ----------------------------  
client [70] (testset)   loss: 0.0113 -> 0.0019  accuracy: 100.00% -> 100.00%   
client [35] (testset)   loss: 0.0284 -> 0.0175  accuracy: 98.32% -> 99.16%     
client [16] (testset)   loss: 0.1397 -> 0.1250  accuracy: 95.80% -> 96.64%     
client [80] (testset)   loss: 0.0140 -> 0.0081  accuracy: 100.00% -> 100.00%   
client [38] (testset)   loss: 0.0431 -> 0.0342  accuracy: 97.91% -> 98.95%     
client [78] (testset)   loss: 0.0082 -> 0.0066  accuracy: 100.00% -> 100.00%   
client [68] (testset)   loss: 0.0255 -> 0.0321  accuracy: 98.66% -> 99.11%     
client [11] (testset)   loss: 0.0179 -> 0.0163  accuracy: 98.65% -> 99.55%     
client [64] (testset)   loss: 0.0360 -> 0.0452  accuracy: 99.21% -> 99.21%     
client [82] (testset)   loss: 0.0650 -> 0.0755  accuracy: 98.99% -> 98.48%     
---------------------------- TRAINING EPOCH: 250 ----------------------------  
client [30] (testset)   loss: 0.0126 -> 0.0107  accuracy: 99.35% -> 99.35%     
client [27] (testset)   loss: 0.0889 -> 0.1055  accuracy: 97.97% -> 97.46%     
client [74] (testset)   loss: 0.0749 -> 0.0450  accuracy: 98.70% -> 98.70%     
client [45] (testset)   loss: 0.0487 -> 0.0449  accuracy: 98.59% -> 99.30%     
client [6]  (testset)   loss: 0.0414 -> 0.0641  accuracy: 98.68% -> 99.34%     
client [36] (testset)   loss: 0.0312 -> 0.0122  accuracy: 98.46% -> 99.61%     
client [63] (testset)   loss: 0.0882 -> 0.1037  accuracy: 98.61% -> 98.61%     
client [76] (testset)   loss: 0.0115 -> 0.0428  accuracy: 99.45% -> 98.36%     
client [83] (testset)   loss: 0.0535 -> 0.0601  accuracy: 99.16% -> 99.16%     
client [86] (testset)   loss: 0.0298 -> 0.0579  accuracy: 99.49% -> 98.98%     
---------------------------- TRAINING EPOCH: 260 ----------------------------  
client [83] (testset)   loss: 0.0607 -> 0.0648  accuracy: 99.16% -> 99.16%     
client [99] (testset)   loss: 0.1079 -> 0.0537  accuracy: 96.45% -> 98.82%     
client [74] (testset)   loss: 0.0698 -> 0.0513  accuracy: 98.70% -> 98.70%     
client [73] (testset)   loss: 0.0468 -> 0.0293  accuracy: 98.84% -> 99.42%     
client [29] (testset)   loss: 0.0523 -> 0.0143  accuracy: 98.26% -> 99.42%     
client [92] (testset)   loss: 0.1234 -> 0.1000  accuracy: 98.25% -> 98.25%     
client [6]  (testset)   loss: 0.0275 -> 0.0544  accuracy: 98.68% -> 99.34%     
client [61] (testset)   loss: 0.0917 -> 0.1135  accuracy: 98.74% -> 98.74%     
client [21] (testset)   loss: 0.0149 -> 0.0089  accuracy: 99.52% -> 99.52%     
client [67] (testset)   loss: 0.0506 -> 0.0122  accuracy: 97.71% -> 100.00%    
---------------------------- TRAINING EPOCH: 270 ----------------------------  
client [83] (testset)   loss: 0.0626 -> 0.0670  accuracy: 99.16% -> 99.16%     
client [32] (testset)   loss: 0.0275 -> 0.0182  accuracy: 99.24% -> 99.24%     
client [95] (testset)   loss: 0.0319 -> 0.0319  accuracy: 99.06% -> 99.06%     
client [61] (testset)   loss: 0.0955 -> 0.1139  accuracy: 98.74% -> 98.74%     
client [27] (testset)   loss: 0.1020 -> 0.1126  accuracy: 98.48% -> 97.46%     
client [25] (testset)   loss: 0.0046 -> 0.0125  accuracy: 100.00% -> 98.59%    
client [68] (testset)   loss: 0.0161 -> 0.0280  accuracy: 99.11% -> 99.11%     
client [34] (testset)   loss: 0.0686 -> 0.0479  accuracy: 98.13% -> 98.50%     
client [71] (testset)   loss: 0.0004 -> 0.0005  accuracy: 100.00% -> 100.00%   
client [89] (testset)   loss: 0.0070 -> 0.0056  accuracy: 100.00% -> 100.00%   
---------------------------- TRAINING EPOCH: 280 ----------------------------  
client [78] (testset)   loss: 0.0079 -> 0.0048  accuracy: 100.00% -> 100.00%   
client [81] (testset)   loss: 0.0645 -> 0.0510  accuracy: 98.76% -> 98.34%     
client [51] (testset)   loss: 0.0106 -> 0.0107  accuracy: 100.00% -> 99.00%    
client [54] (testset)   loss: 0.0145 -> 0.0040  accuracy: 99.56% -> 100.00%    
client [65] (testset)   loss: 0.0268 -> 0.0076  accuracy: 98.72% -> 100.00%    
client [41] (testset)   loss: 0.0494 -> 0.0582  accuracy: 98.65% -> 96.86%     
client [11] (testset)   loss: 0.0151 -> 0.0162  accuracy: 99.10% -> 99.55%     
client [85] (testset)   loss: 0.0464 -> 0.0254  accuracy: 98.50% -> 99.25%     
client [12] (testset)   loss: 0.0530 -> 0.0699  accuracy: 98.58% -> 98.58%     
client [23] (testset)   loss: 0.0086 -> 0.0216  accuracy: 100.00% -> 99.13%    
---------------------------- TRAINING EPOCH: 290 ----------------------------  
client [16] (testset)   loss: 0.1310 -> 0.1096  accuracy: 95.80% -> 95.80%     
client [65] (testset)   loss: 0.0106 -> 0.0063  accuracy: 99.57% -> 100.00%    
client [53] (testset)   loss: 0.0358 -> 0.0212  accuracy: 98.37% -> 99.19%     
client [58] (testset)   loss: 0.0815 -> 0.0931  accuracy: 98.47% -> 98.47%     
client [72] (testset)   loss: 0.0523 -> 0.0233  accuracy: 98.45% -> 99.38%     
client [7]  (testset)   loss: 0.0267 -> 0.0039  accuracy: 99.11% -> 100.00%    
client [71] (testset)   loss: 0.0006 -> 0.0005  accuracy: 100.00% -> 100.00%   
client [59] (testset)   loss: 0.0190 -> 0.0156  accuracy: 98.96% -> 98.96%     
client [86] (testset)   loss: 0.0375 -> 0.0644  accuracy: 99.49% -> 98.98%     
client [39] (testset)   loss: 0.1352 -> 0.1297  accuracy: 98.16% -> 98.16%     
---------------------------- TRAINING EPOCH: 300 ----------------------------  
client [99] (testset)   loss: 0.0547 -> 0.0545  accuracy: 98.82% -> 98.22%     
client [7]  (testset)   loss: 0.0397 -> 0.0056  accuracy: 98.22% -> 100.00%    
client [17] (testset)   loss: 0.0216 -> 0.0472  accuracy: 99.19% -> 98.39%     
client [64] (testset)   loss: 0.0854 -> 0.0552  accuracy: 97.62% -> 98.41%     
client [37] (testset)   loss: 0.0292 -> 0.0172  accuracy: 99.17% -> 99.17%     
client [29] (testset)   loss: 0.0298 -> 0.0175  accuracy: 99.42% -> 99.42%     
client [93] (testset)   loss: 0.0074 -> 0.0196  accuracy: 100.00% -> 99.29%    
client [73] (testset)   loss: 0.0120 -> 0.0223  accuracy: 100.00% -> 99.42%    
client [40] (testset)   loss: 0.0161 -> 0.0163  accuracy: 99.66% -> 99.66%     
client [76] (testset)   loss: 0.0132 -> 0.0205  accuracy: 99.45% -> 98.91%     
---------------------------- TRAINING EPOCH: 310 ----------------------------  
client [31] (testset)   loss: 0.0667 -> 0.0545  accuracy: 98.93% -> 98.93%     
client [89] (testset)   loss: 0.0088 -> 0.0078  accuracy: 99.58% -> 100.00%    
client [77] (testset)   loss: 0.1338 -> 0.1107  accuracy: 95.29% -> 95.29%     
client [90] (testset)   loss: 0.0370 -> 0.0115  accuracy: 97.12% -> 100.00%    
client [26] (testset)   loss: 0.0359 -> 0.0182  accuracy: 99.19% -> 98.37%     
client [50] (testset)   loss: 0.0551 -> 0.0266  accuracy: 97.75% -> 98.88%     
client [30] (testset)   loss: 0.0065 -> 0.0103  accuracy: 100.00% -> 99.35%    
client [70] (testset)   loss: 0.0014 -> 0.0009  accuracy: 100.00% -> 100.00%   
client [41] (testset)   loss: 0.0471 -> 0.0508  accuracy: 98.65% -> 97.31%     
client [99] (testset)   loss: 0.0560 -> 0.0570  accuracy: 98.22% -> 98.82%     
---------------------------- TRAINING EPOCH: 320 ----------------------------  
client [68] (testset)   loss: 0.0261 -> 0.0266  accuracy: 99.11% -> 99.11%     
client [70] (testset)   loss: 0.0142 -> 0.0021  accuracy: 100.00% -> 100.00%   
client [52] (testset)   loss: 0.1646 -> 0.1317  accuracy: 96.10% -> 98.70%     
client [1]  (testset)   loss: 0.0484 -> 0.0541  accuracy: 97.74% -> 97.74%     
client [2]  (testset)   loss: 0.0212 -> 0.0111  accuracy: 98.70% -> 99.35%     
client [67] (testset)   loss: 0.0375 -> 0.0141  accuracy: 98.29% -> 99.43%     
client [92] (testset)   loss: 0.1057 -> 0.0863  accuracy: 98.25% -> 98.25%     
client [35] (testset)   loss: 0.0430 -> 0.0122  accuracy: 98.32% -> 99.16%     
client [36] (testset)   loss: 0.0320 -> 0.0125  accuracy: 98.84% -> 99.61%     
client [64] (testset)   loss: 0.0705 -> 0.0621  accuracy: 97.62% -> 97.62%     
---------------------------- TRAINING EPOCH: 330 ----------------------------  
client [44] (testset)   loss: 0.0525 -> 0.0347  accuracy: 98.30% -> 98.87%     
client [6]  (testset)   loss: 0.0246 -> 0.0530  accuracy: 99.34% -> 99.34%     
client [12] (testset)   loss: 0.0553 -> 0.0727  accuracy: 98.58% -> 98.58%     
client [55] (testset)   loss: 0.0153 -> 0.0053  accuracy: 99.47% -> 99.73%     
client [29] (testset)   loss: 0.0390 -> 0.0153  accuracy: 98.84% -> 99.42%     
client [9]  (testset)   loss: 0.0034 -> 0.0007  accuracy: 100.00% -> 100.00%   
client [43] (testset)   loss: 0.1413 -> 0.1676  accuracy: 98.41% -> 97.62%     
client [77] (testset)   loss: 0.1536 -> 0.1256  accuracy: 95.29% -> 95.29%     
client [98] (testset)   loss: 0.0634 -> 0.0326  accuracy: 97.14% -> 99.05%     
client [78] (testset)   loss: 0.0099 -> 0.0043  accuracy: 100.00% -> 100.00%   
---------------------------- TRAINING EPOCH: 340 ----------------------------  
client [92] (testset)   loss: 0.1298 -> 0.0969  accuracy: 98.25% -> 98.25%     
client [80] (testset)   loss: 0.0057 -> 0.0045  accuracy: 100.00% -> 100.00%   
client [63] (testset)   loss: 0.0929 -> 0.1028  accuracy: 98.61% -> 99.07%     
client [76] (testset)   loss: 0.0130 -> 0.0214  accuracy: 99.45% -> 98.91%     
client [78] (testset)   loss: 0.0115 -> 0.0057  accuracy: 100.00% -> 100.00%   
client [25] (testset)   loss: 0.0067 -> 0.0187  accuracy: 100.00% -> 98.59%    
client [58] (testset)   loss: 0.0713 -> 0.0916  accuracy: 99.49% -> 98.47%     
client [13] (testset)   loss: 0.0511 -> 0.0428  accuracy: 98.45% -> 98.14%     
client [17] (testset)   loss: 0.0449 -> 0.0623  accuracy: 98.39% -> 97.58%     
client [38] (testset)   loss: 0.0272 -> 0.0215  accuracy: 98.95% -> 99.48%     
---------------------------- TRAINING EPOCH: 350 ----------------------------  
client [72] (testset)   loss: 0.0562 -> 0.0241  accuracy: 98.14% -> 99.38%     
client [82] (testset)   loss: 0.0605 -> 0.0737  accuracy: 98.99% -> 98.74%     
client [86] (testset)   loss: 0.0295 -> 0.0607  accuracy: 99.49% -> 98.98%     
client [51] (testset)   loss: 0.0173 -> 0.0140  accuracy: 99.50% -> 99.00%     
client [96] (testset)   loss: 0.0404 -> 0.0146  accuracy: 98.95% -> 99.65%     
client [42] (testset)   loss: 0.0622 -> 0.0516  accuracy: 98.56% -> 99.04%     
client [55] (testset)   loss: 0.0064 -> 0.0048  accuracy: 99.73% -> 99.73%     
client [13] (testset)   loss: 0.0368 -> 0.0429  accuracy: 98.45% -> 98.45%     
client [1]  (testset)   loss: 0.0554 -> 0.0610  accuracy: 98.31% -> 98.31%     
client [12] (testset)   loss: 0.0582 -> 0.0595  accuracy: 98.58% -> 98.58%     
---------------------------- TRAINING EPOCH: 360 ----------------------------  
client [68] (testset)   loss: 0.0238 -> 0.0236  accuracy: 98.66% -> 99.11%     
client [23] (testset)   loss: 0.0092 -> 0.0249  accuracy: 100.00% -> 99.13%    
client [46] (testset)   loss: 0.0326 -> 0.0298  accuracy: 98.17% -> 98.17%     
client [41] (testset)   loss: 0.0375 -> 0.0559  accuracy: 98.21% -> 97.31%     
client [25] (testset)   loss: 0.0039 -> 0.0099  accuracy: 100.00% -> 100.00%   
client [58] (testset)   loss: 0.1091 -> 0.1018  accuracy: 97.96% -> 97.96%     
client [14] (testset)   loss: 0.0381 -> 0.0365  accuracy: 98.86% -> 98.30%     
client [33] (testset)   loss: 0.0447 -> 0.0181  accuracy: 98.90% -> 98.90%     
client [85] (testset)   loss: 0.0619 -> 0.0335  accuracy: 98.50% -> 98.88%     
client [62] (testset)   loss: 0.0367 -> 0.0211  accuracy: 98.79% -> 99.39%     
---------------------------- TRAINING EPOCH: 370 ----------------------------  
client [98] (testset)   loss: 0.0555 -> 0.0331  accuracy: 97.14% -> 98.10%     
client [63] (testset)   loss: 0.1031 -> 0.1102  accuracy: 98.15% -> 98.61%     
client [70] (testset)   loss: 0.0040 -> 0.0011  accuracy: 100.00% -> 100.00%   
client [65] (testset)   loss: 0.0187 -> 0.0064  accuracy: 98.72% -> 100.00%    
client [14] (testset)   loss: 0.0311 -> 0.0369  accuracy: 98.30% -> 98.30%     
client [73] (testset)   loss: 0.0224 -> 0.0299  accuracy: 98.84% -> 99.42%     
client [34] (testset)   loss: 0.0747 -> 0.0479  accuracy: 98.13% -> 98.50%     
client [99] (testset)   loss: 0.0688 -> 0.0586  accuracy: 98.82% -> 98.82%     
client [69] (testset)   loss: 0.0487 -> 0.0390  accuracy: 98.57% -> 98.57%     
client [46] (testset)   loss: 0.0397 -> 0.0286  accuracy: 99.08% -> 98.17%     
---------------------------- TRAINING EPOCH: 380 ----------------------------  
client [99] (testset)   loss: 0.0702 -> 0.0560  accuracy: 98.82% -> 98.82%     
client [93] (testset)   loss: 0.0039 -> 0.0107  accuracy: 100.00% -> 99.29%    
client [11] (testset)   loss: 0.0120 -> 0.0089  accuracy: 99.55% -> 100.00%    
client [58] (testset)   loss: 0.0827 -> 0.0916  accuracy: 97.96% -> 98.47%     
client [81] (testset)   loss: 0.0556 -> 0.0493  accuracy: 98.76% -> 97.93%     
client [85] (testset)   loss: 0.0581 -> 0.0292  accuracy: 98.50% -> 98.88%     
client [89] (testset)   loss: 0.0079 -> 0.0054  accuracy: 99.58% -> 100.00%    
client [45] (testset)   loss: 0.0525 -> 0.0395  accuracy: 98.59% -> 99.30%     
client [8]  (testset)   loss: 0.0396 -> 0.0155  accuracy: 98.53% -> 100.00%    
client [68] (testset)   loss: 0.0209 -> 0.0222  accuracy: 99.11% -> 99.11%     
---------------------------- TRAINING EPOCH: 390 ----------------------------  
client [67] (testset)   loss: 0.0542 -> 0.0116  accuracy: 98.29% -> 99.43%     
client [72] (testset)   loss: 0.0454 -> 0.0226  accuracy: 97.83% -> 99.38%     
client [1]  (testset)   loss: 0.0516 -> 0.0624  accuracy: 98.31% -> 97.74%     
client [78] (testset)   loss: 0.0333 -> 0.0033  accuracy: 98.80% -> 100.00%    
client [83] (testset)   loss: 0.0713 -> 0.0689  accuracy: 99.16% -> 99.16%     
client [21] (testset)   loss: 0.0234 -> 0.0084  accuracy: 99.04% -> 99.52%     
client [56] (testset)   loss: 0.0420 -> 0.0485  accuracy: 98.46% -> 98.46%     
client [44] (testset)   loss: 0.0382 -> 0.0388  accuracy: 99.15% -> 98.87%     
client [92] (testset)   loss: 0.1370 -> 0.0745  accuracy: 96.49% -> 98.25%     
client [27] (testset)   loss: 0.0928 -> 0.1018  accuracy: 97.97% -> 97.46%     
---------------------------- TRAINING EPOCH: 400 ----------------------------  
client [10] (testset)   loss: 0.0158 -> 0.0042  accuracy: 99.02% -> 100.00%    
client [39] (testset)   loss: 0.1575 -> 0.1377  accuracy: 98.16% -> 98.16%     
client [65] (testset)   loss: 0.0200 -> 0.0071  accuracy: 98.72% -> 100.00%    
client [26] (testset)   loss: 0.0411 -> 0.0200  accuracy: 99.19% -> 99.19%     
client [19] (testset)   loss: 0.0067 -> 0.0011  accuracy: 100.00% -> 100.00%   
client [68] (testset)   loss: 0.0202 -> 0.0224  accuracy: 99.11% -> 99.11%     
client [41] (testset)   loss: 0.0633 -> 0.0557  accuracy: 98.65% -> 97.31%     
client [50] (testset)   loss: 0.0464 -> 0.0271  accuracy: 98.88% -> 98.88%     
client [75] (testset)   loss: 0.0181 -> 0.0063  accuracy: 100.00% -> 100.00%   
client [81] (testset)   loss: 0.0457 -> 0.0452  accuracy: 98.76% -> 98.34%     
Training... ---------------------------------------- 100% 0:15:01
FedOBP's average time taken by each global epoch: 0 min 2.23 sec.              
FedOBP's total running time: 0 h 15 m 1 s.                                     
==================== FedOBP Experiment Results: ====================           
Display format: (before local fine-tuning) -> (after local fine-tuning)        
 So if finetune_epoch = 0, x.xx% -> 0.00% is normal.                           
 Centralized testing ONLY happens after model aggregation, so the stats between
'->' are the same.                                                             
{                                                                              
    "100": {                                                                   
        "all_clients": {                                                       
            "test": {                                                          
                "loss": "0.0552 -> 0.0000",                                    
                "accuracy": "98.27% -> 0.00%"                                  
            }                                                                  
        }                                                                      
    },                                                                         
    "200": {                                                                   
        "all_clients": {                                                       
            "test": {                                                          
                "loss": "0.0466 -> 0.0000",                                    
                "accuracy": "98.62% -> 0.00%"                                  
            }                                                                  
        }                                                                      
    },                                                                         
    "300": {                                                                   
        "all_clients": {                                                       
            "test": {                                                          
                "loss": "0.0471 -> 0.0000",                                    
                "accuracy": "98.74% -> 0.00%"                                  
            }                                                                  
        }                                                                      
    },                                                                         
    "400": {                                                                   
        "all_clients": {                                                       
            "test": {                                                          
                "loss": "0.0441 -> 0.0000",                                    
                "accuracy": "98.85% -> 0.00%"                                  
            }                                                                  
        }                                                                      
    }                                                                          
}                                                                              
==================== FedOBP Max Accuracy ====================                  
all_clients:                                                                   
(test) before fine-tuning: 98.85% at epoch 400                                 
(test) after fine-tuning: 0.00% at epoch 100                                   
[0m