out\fedobp\cifar10\Main_GlobalNorm_EMAscore(0.5)_ALL_IG_0.999
==================== FedOBP ====================                               
Experiment Arguments:                                                          
{
│   'method': 'fedobp',
│   'dataset': {
│   │   'name': 'cifar10',
│   │   'client_num': 100,
│   │   'test_ratio': 0.25,
│   │   'val_ratio': 0.0,
│   │   'seed': 42,
│   │   'split': 'sample',
│   │   'IID_ratio': 0.0,
│   │   'monitor_window_name_suffix': 'cifar10-100clients-0%IID-Dir(0.5)-seed42',
│   │   'alpha': 0.5,
│   │   'min_samples_per_client': 10
│   },
│   'model': {
│   │   'name': 'avgcnn',
│   │   'use_torchvision_pretrained_weights': True,
│   │   'external_model_weights_path': None
│   },
│   'optimizer': {
│   │   'lr': 0.01,
│   │   'dampening': 0,
│   │   'weight_decay': 0,
│   │   'momentum': 0,
│   │   'nesterov': False,
│   │   'name': 'sgd'
│   },
│   'mode': 'serial',
│   'parallel': {
│   │   'ray_cluster_addr': None,
│   │   'num_cpus': None,
│   │   'num_gpus': None,
│   │   'num_workers': 2
│   },
│   'common': {
│   │   'seed': 42,
│   │   'join_ratio': 0.1,
│   │   'global_epoch': 400,
│   │   'local_epoch': 5,
│   │   'batch_size': 32,
│   │   'reset_optimizer_on_global_epoch': True,
│   │   'straggler_ratio': 0,
│   │   'straggler_min_local_epoch': 0,
│   │   'buffers': 'global',
│   │   'client_side_evaluation': True,
│   │   'test': {
│   │   │   'client': {
│   │   │   │   'interval': 100,
│   │   │   │   'finetune_epoch': 0,
│   │   │   │   'train': False,
│   │   │   │   'val': False,
│   │   │   │   'test': True
│   │   │   },
│   │   │   'server': {
│   │   │   │   'interval': -1,
│   │   │   │   'train': False,
│   │   │   │   'val': False,
│   │   │   │   'test': False,
│   │   │   │   'model_in_train_mode': False
│   │   │   }
│   │   },
│   │   'verbose_gap': 10,
│   │   'monitor': None,
│   │   'use_cuda': True,
│   │   'save_log': True,
│   │   'save_model': False,
│   │   'save_learning_curve_plot': False,
│   │   'save_metrics': True,
│   │   'delete_useless_run': True
│   },
│   'fedobp': {
│   │   'ig_ratio': 0.999,
│   │   'alpha': 0.5,
│   │   'norm': 'global',
│   │   'EMA': True,
│   │   'CLS': False,
│   │   'track': False,
│   │   'type': 'Main'
│   }
}
---------------------------- TRAINING EPOCH: 10 ----------------------------   
client [77] (testset)   loss: 1.5943 -> 1.4391  accuracy: 45.76% -> 49.15%     
client [81] (testset)   loss: 1.5168 -> 1.3397  accuracy: 52.38% -> 52.38%     
client [21] (testset)   loss: 1.6505 -> 1.2589  accuracy: 43.66% -> 59.15%     
client [68] (testset)   loss: 1.6356 -> 1.1501  accuracy: 45.07% -> 54.93%     
client [93] (testset)   loss: 1.5411 -> 1.3027  accuracy: 44.15% -> 53.21%     
client [31] (testset)   loss: 1.4273 -> 1.4419  accuracy: 55.71% -> 44.64%     
client [20] (testset)   loss: 1.7239 -> 1.4157  accuracy: 44.16% -> 49.35%     
client [59] (testset)   loss: 1.9092 -> 1.4007  accuracy: 32.48% -> 50.96%     
client [48] (testset)   loss: 1.5942 -> 1.5824  accuracy: 40.32% -> 37.10%     
client [34] (testset)   loss: 1.3761 -> 1.3041  accuracy: 49.78% -> 45.78%     
---------------------------- TRAINING EPOCH: 20 ----------------------------   
client [69] (testset)   loss: 1.3761 -> 1.1669  accuracy: 52.32% -> 60.93%     
client [99] (testset)   loss: 1.6050 -> 1.5508  accuracy: 38.92% -> 45.95%     
client [67] (testset)   loss: 1.3014 -> 1.1243  accuracy: 48.92% -> 60.61%     
client [0]  (testset)   loss: 1.3380 -> 1.1604  accuracy: 56.59% -> 57.36%     
client [76] (testset)   loss: 1.5329 -> 0.8616  accuracy: 51.52% -> 72.73%     
client [41] (testset)   loss: 1.4921 -> 0.9763  accuracy: 45.45% -> 67.13%     
client [62] (testset)   loss: 1.8312 -> 0.9401  accuracy: 33.33% -> 65.66%     
client [2]  (testset)   loss: 1.4930 -> 1.1716  accuracy: 48.08% -> 55.77%     
client [14] (testset)   loss: 1.5599 -> 1.4860  accuracy: 41.18% -> 52.10%     
client [46] (testset)   loss: 1.4432 -> 1.3127  accuracy: 50.69% -> 54.17%     
---------------------------- TRAINING EPOCH: 30 ----------------------------   
client [24] (testset)   loss: 1.1582 -> 1.0583  accuracy: 61.45% -> 61.07%     
client [68] (testset)   loss: 1.0436 -> 1.0133  accuracy: 73.24% -> 63.38%     
client [57] (testset)   loss: 1.1870 -> 1.0554  accuracy: 54.84% -> 62.90%     
client [17] (testset)   loss: 0.7270 -> 0.5924  accuracy: 73.20% -> 79.08%     
client [54] (testset)   loss: 1.0510 -> 1.1124  accuracy: 61.68% -> 57.01%     
client [23] (testset)   loss: 1.4554 -> 1.9475  accuracy: 48.84% -> 43.41%     
client [35] (testset)   loss: 0.9617 -> 2.1702  accuracy: 72.22% -> 44.44%     
client [59] (testset)   loss: 1.3219 -> 1.2474  accuracy: 52.23% -> 52.87%     
client [31] (testset)   loss: 1.1511 -> 0.9706  accuracy: 57.14% -> 67.86%     
client [9]  (testset)   loss: 1.3456 -> 1.3136  accuracy: 53.48% -> 55.65%     
---------------------------- TRAINING EPOCH: 40 ----------------------------   
client [64] (testset)   loss: 0.9906 -> 0.8563  accuracy: 67.89% -> 66.32%     
client [33] (testset)   loss: 0.9806 -> 1.0607  accuracy: 69.35% -> 66.33%     
client [16] (testset)   loss: 1.4068 -> 1.1097  accuracy: 47.20% -> 64.80%     
client [44] (testset)   loss: 0.9872 -> 0.9017  accuracy: 65.56% -> 70.53%     
client [8]  (testset)   loss: 0.7831 -> 1.1013  accuracy: 70.67% -> 60.00%     
client [31] (testset)   loss: 1.1984 -> 1.0365  accuracy: 53.21% -> 67.14%     
client [47] (testset)   loss: 1.1207 -> 1.0766  accuracy: 60.19% -> 60.19%     
client [36] (testset)   loss: 1.3599 -> 0.9106  accuracy: 48.48% -> 69.70%     
client [20] (testset)   loss: 1.3247 -> 1.2943  accuracy: 58.87% -> 56.28%     
client [56] (testset)   loss: 1.7031 -> 1.3322  accuracy: 40.00% -> 48.00%     
---------------------------- TRAINING EPOCH: 50 ----------------------------   
client [4]  (testset)   loss: 0.7196 -> 0.7242  accuracy: 74.38% -> 74.88%     
client [60] (testset)   loss: 1.3426 -> 1.7708  accuracy: 53.16% -> 43.88%     
client [28] (testset)   loss: 1.2291 -> 1.4920  accuracy: 55.49% -> 52.44%     
client [25] (testset)   loss: 1.0268 -> 1.1524  accuracy: 60.00% -> 58.33%     
client [58] (testset)   loss: 1.1037 -> 1.1202  accuracy: 62.89% -> 61.64%     
client [44] (testset)   loss: 1.0077 -> 0.8815  accuracy: 66.23% -> 67.88%     
client [39] (testset)   loss: 1.0503 -> 1.0598  accuracy: 61.21% -> 59.48%     
client [29] (testset)   loss: 1.2948 -> 1.5183  accuracy: 56.15% -> 52.31%     
client [3]  (testset)   loss: 1.1313 -> 1.0534  accuracy: 62.16% -> 66.02%     
client [84] (testset)   loss: 1.0779 -> 1.1056  accuracy: 61.84% -> 63.16%     
---------------------------- TRAINING EPOCH: 60 ----------------------------   
client [21] (testset)   loss: 1.1996 -> 1.0557  accuracy: 60.56% -> 61.97%     
client [84] (testset)   loss: 1.0839 -> 1.1489  accuracy: 61.84% -> 60.53%     
client [10] (testset)   loss: 0.9218 -> 0.8153  accuracy: 66.93% -> 66.93%     
client [36] (testset)   loss: 1.0002 -> 1.0237  accuracy: 59.60% -> 67.68%     
client [65] (testset)   loss: 0.8627 -> 1.1101  accuracy: 75.00% -> 61.36%     
client [81] (testset)   loss: 1.0724 -> 0.9736  accuracy: 67.62% -> 69.52%     
client [79] (testset)   loss: 0.7600 -> 1.0184  accuracy: 74.58% -> 72.88%     
client [42] (testset)   loss: 0.9508 -> 0.8230  accuracy: 76.04% -> 77.08%     
client [11] (testset)   loss: 0.9917 -> 1.1607  accuracy: 59.23% -> 56.15%     
client [96] (testset)   loss: 0.8767 -> 1.1383  accuracy: 68.42% -> 58.65%     
---------------------------- TRAINING EPOCH: 70 ----------------------------   
client [8]  (testset)   loss: 0.6821 -> 0.7898  accuracy: 73.33% -> 65.33%     
client [53] (testset)   loss: 1.1805 -> 1.3507  accuracy: 61.84% -> 56.58%     
client [52] (testset)   loss: 1.0510 -> 0.9445  accuracy: 63.95% -> 68.03%     
client [42] (testset)   loss: 0.6764 -> 0.7171  accuracy: 81.25% -> 73.96%     
client [69] (testset)   loss: 1.0470 -> 1.2691  accuracy: 60.93% -> 54.30%     
client [59] (testset)   loss: 1.1566 -> 1.2105  accuracy: 56.05% -> 60.51%     
client [7]  (testset)   loss: 1.1009 -> 1.1439  accuracy: 62.21% -> 63.59%     
client [26] (testset)   loss: 0.7341 -> 0.7550  accuracy: 75.28% -> 73.60%     
client [49] (testset)   loss: 0.9251 -> 0.9681  accuracy: 67.43% -> 69.71%     
client [98] (testset)   loss: 0.8608 -> 1.0406  accuracy: 69.74% -> 67.11%     
---------------------------- TRAINING EPOCH: 80 ----------------------------   
client [98] (testset)   loss: 0.8727 -> 1.5100  accuracy: 71.71% -> 61.18%     
client [47] (testset)   loss: 0.8628 -> 0.8088  accuracy: 72.22% -> 70.37%     
client [21] (testset)   loss: 1.0105 -> 1.0380  accuracy: 66.20% -> 63.38%     
client [77] (testset)   loss: 1.1297 -> 1.2118  accuracy: 58.76% -> 61.58%     
client [95] (testset)   loss: 1.5282 -> 1.9321  accuracy: 50.89% -> 47.32%     
client [91] (testset)   loss: 0.9467 -> 1.0580  accuracy: 68.27% -> 64.90%     
client [14] (testset)   loss: 1.3840 -> 1.3283  accuracy: 52.94% -> 54.62%     
client [99] (testset)   loss: 1.2195 -> 1.3935  accuracy: 61.62% -> 59.46%     
client [20] (testset)   loss: 1.3834 -> 1.2608  accuracy: 55.84% -> 61.47%     
client [39] (testset)   loss: 1.0278 -> 0.9810  accuracy: 61.21% -> 65.52%     
---------------------------- TRAINING EPOCH: 90 ----------------------------   
client [52] (testset)   loss: 1.2844 -> 1.0396  accuracy: 55.10% -> 61.22%     
client [62] (testset)   loss: 1.1434 -> 1.9499  accuracy: 62.63% -> 50.51%     
client [71] (testset)   loss: 0.5710 -> 0.5659  accuracy: 81.58% -> 82.11%     
client [97] (testset)   loss: 1.0302 -> 1.0502  accuracy: 65.32% -> 68.79%     
client [30] (testset)   loss: 1.1151 -> 1.3741  accuracy: 57.43% -> 55.45%     
client [88] (testset)   loss: 1.2310 -> 1.1073  accuracy: 57.38% -> 64.48%     
client [60] (testset)   loss: 1.0889 -> 1.5177  accuracy: 60.76% -> 54.01%     
client [82] (testset)   loss: 1.0141 -> 0.8465  accuracy: 70.71% -> 77.14%     
client [91] (testset)   loss: 0.9801 -> 1.1752  accuracy: 69.23% -> 62.02%     
client [57] (testset)   loss: 1.2388 -> 1.0831  accuracy: 54.03% -> 63.71%     
---------------------------- TRAINING EPOCH: 100 ----------------------------  
client [31] (testset)   loss: 0.9903 -> 1.1087  accuracy: 69.29% -> 72.50%     
client [15] (testset)   loss: 0.9888 -> 0.9781  accuracy: 71.76% -> 71.18%     
client [71] (testset)   loss: 0.6976 -> 0.5813  accuracy: 78.42% -> 82.11%     
client [97] (testset)   loss: 0.9215 -> 1.1047  accuracy: 70.52% -> 64.74%     
client [53] (testset)   loss: 1.3323 -> 1.4137  accuracy: 60.53% -> 59.21%     
client [77] (testset)   loss: 1.0553 -> 1.3065  accuracy: 62.15% -> 59.89%     
client [76] (testset)   loss: 0.8189 -> 0.8111  accuracy: 74.55% -> 78.18%     
client [79] (testset)   loss: 0.7539 -> 1.5560  accuracy: 77.12% -> 65.68%     
client [28] (testset)   loss: 1.1278 -> 1.3469  accuracy: 57.32% -> 61.59%     
client [99] (testset)   loss: 1.2334 -> 1.4434  accuracy: 59.46% -> 61.62%     
---------------------------- TRAINING EPOCH: 110 ----------------------------  
client [97] (testset)   loss: 0.8890 -> 1.1635  accuracy: 72.25% -> 67.05%     
client [86] (testset)   loss: 0.8964 -> 0.9717  accuracy: 74.62% -> 74.62%     
client [34] (testset)   loss: 0.9056 -> 0.9304  accuracy: 67.11% -> 69.78%     
client [73] (testset)   loss: 1.0631 -> 1.2430  accuracy: 65.89% -> 63.18%     
client [5]  (testset)   loss: 0.9459 -> 1.3106  accuracy: 65.18% -> 59.82%     
client [96] (testset)   loss: 0.8929 -> 0.8600  accuracy: 75.19% -> 75.19%     
client [22] (testset)   loss: 1.1117 -> 1.4776  accuracy: 56.92% -> 57.69%     
client [60] (testset)   loss: 1.1995 -> 1.2150  accuracy: 60.76% -> 62.87%     
client [66] (testset)   loss: 1.3558 -> 1.4150  accuracy: 53.26% -> 55.98%     
client [83] (testset)   loss: 0.7102 -> 0.7573  accuracy: 82.00% -> 78.00%     
---------------------------- TRAINING EPOCH: 120 ----------------------------  
client [76] (testset)   loss: 0.8496 -> 0.8197  accuracy: 73.94% -> 75.76%     
client [65] (testset)   loss: 0.8566 -> 1.2857  accuracy: 75.00% -> 65.91%     
client [95] (testset)   loss: 1.4585 -> 1.8499  accuracy: 57.14% -> 49.11%     
client [17] (testset)   loss: 0.7430 -> 0.4909  accuracy: 76.47% -> 80.39%     
client [8]  (testset)   loss: 0.8533 -> 1.3069  accuracy: 66.67% -> 58.67%     
client [35] (testset)   loss: 0.7240 -> 0.7227  accuracy: 75.93% -> 81.48%     
client [98] (testset)   loss: 0.7580 -> 1.0728  accuracy: 74.34% -> 72.37%     
client [53] (testset)   loss: 1.2849 -> 2.3920  accuracy: 67.11% -> 47.37%     
client [43] (testset)   loss: 0.9780 -> 1.0081  accuracy: 64.96% -> 71.53%     
client [64] (testset)   loss: 0.7550 -> 0.8066  accuracy: 73.68% -> 76.32%     
---------------------------- TRAINING EPOCH: 130 ----------------------------  
client [21] (testset)   loss: 0.9519 -> 1.0870  accuracy: 63.38% -> 64.79%     
client [88] (testset)   loss: 1.0150 -> 1.0305  accuracy: 67.76% -> 68.85%     
client [38] (testset)   loss: 0.9620 -> 1.1010  accuracy: 67.47% -> 74.70%     
client [3]  (testset)   loss: 1.2001 -> 1.1880  accuracy: 65.64% -> 68.73%     
client [5]  (testset)   loss: 0.9929 -> 1.2551  accuracy: 62.50% -> 62.50%     
client [41] (testset)   loss: 0.7835 -> 0.8180  accuracy: 73.43% -> 76.22%     
client [7]  (testset)   loss: 1.1731 -> 1.2219  accuracy: 61.75% -> 65.44%     
client [37] (testset)   loss: 1.1141 -> 1.3776  accuracy: 66.23% -> 66.23%     
client [45] (testset)   loss: 1.1813 -> 1.2668  accuracy: 61.25% -> 62.73%     
client [47] (testset)   loss: 0.8109 -> 0.7751  accuracy: 72.22% -> 75.93%     
---------------------------- TRAINING EPOCH: 140 ----------------------------  
client [16] (testset)   loss: 1.1398 -> 1.3306  accuracy: 68.00% -> 65.60%     
client [11] (testset)   loss: 0.9577 -> 2.0606  accuracy: 73.85% -> 47.69%     
client [37] (testset)   loss: 1.0691 -> 1.3704  accuracy: 66.23% -> 70.13%     
client [41] (testset)   loss: 0.8155 -> 0.8716  accuracy: 69.23% -> 74.83%     
client [95] (testset)   loss: 1.5177 -> 1.9512  accuracy: 54.46% -> 50.00%     
client [53] (testset)   loss: 1.2836 -> 1.3677  accuracy: 67.11% -> 63.16%     
client [22] (testset)   loss: 1.1734 -> 1.3288  accuracy: 54.62% -> 68.46%     
client [25] (testset)   loss: 0.6641 -> 0.9257  accuracy: 70.00% -> 70.00%     
client [69] (testset)   loss: 1.0753 -> 1.2416  accuracy: 60.93% -> 65.56%     
client [46] (testset)   loss: 1.0681 -> 1.2135  accuracy: 68.40% -> 65.97%     
---------------------------- TRAINING EPOCH: 150 ----------------------------  
client [47] (testset)   loss: 0.7396 -> 0.8172  accuracy: 76.85% -> 75.00%     
client [69] (testset)   loss: 1.0980 -> 1.2662  accuracy: 62.91% -> 65.56%     
client [82] (testset)   loss: 0.9595 -> 0.8128  accuracy: 75.00% -> 77.86%     
client [45] (testset)   loss: 1.2802 -> 1.3833  accuracy: 61.62% -> 62.36%     
client [7]  (testset)   loss: 1.0977 -> 1.2101  accuracy: 64.52% -> 67.28%     
client [50] (testset)   loss: 0.7021 -> 0.5733  accuracy: 74.81% -> 82.44%     
client [35] (testset)   loss: 0.7212 -> 0.8498  accuracy: 74.07% -> 79.63%     
client [24] (testset)   loss: 1.1296 -> 1.1621  accuracy: 68.32% -> 66.41%     
client [15] (testset)   loss: 0.9116 -> 1.0285  accuracy: 74.71% -> 74.71%     
client [58] (testset)   loss: 1.2700 -> 1.1801  accuracy: 67.30% -> 71.07%     
---------------------------- TRAINING EPOCH: 160 ----------------------------  
client [48] (testset)   loss: 1.2593 -> 1.4909  accuracy: 56.45% -> 56.45%     
client [76] (testset)   loss: 0.8159 -> 0.8418  accuracy: 73.94% -> 76.36%     
client [67] (testset)   loss: 0.9688 -> 1.2201  accuracy: 68.83% -> 63.20%     
client [37] (testset)   loss: 1.1892 -> 1.3953  accuracy: 74.03% -> 70.13%     
client [58] (testset)   loss: 1.0998 -> 1.1725  accuracy: 67.92% -> 70.44%     
client [64] (testset)   loss: 0.7632 -> 0.7834  accuracy: 76.84% -> 77.37%     
client [77] (testset)   loss: 1.1803 -> 1.3487  accuracy: 62.15% -> 67.80%     
client [55] (testset)   loss: 0.8474 -> 0.9062  accuracy: 76.42% -> 75.47%     
client [12] (testset)   loss: 0.7190 -> 0.6892  accuracy: 78.00% -> 82.67%     
client [89] (testset)   loss: 1.0901 -> 1.1174  accuracy: 66.67% -> 66.67%     
---------------------------- TRAINING EPOCH: 170 ----------------------------  
client [84] (testset)   loss: 1.0631 -> 1.1798  accuracy: 69.08% -> 71.71%     
client [51] (testset)   loss: 1.0991 -> 1.1692  accuracy: 76.19% -> 71.43%     
client [8]  (testset)   loss: 0.8444 -> 0.8773  accuracy: 77.33% -> 70.67%     
client [18] (testset)   loss: 0.8184 -> 0.8606  accuracy: 76.12% -> 73.63%     
client [94] (testset)   loss: 1.2195 -> 1.4313  accuracy: 68.00% -> 66.40%     
client [81] (testset)   loss: 0.9285 -> 1.0868  accuracy: 71.43% -> 73.33%     
client [3]  (testset)   loss: 1.2050 -> 1.2101  accuracy: 65.64% -> 69.11%     
client [11] (testset)   loss: 1.0573 -> 1.3085  accuracy: 70.00% -> 61.54%     
client [95] (testset)   loss: 1.6509 -> 2.0467  accuracy: 59.82% -> 49.11%     
client [67] (testset)   loss: 0.9867 -> 1.2077  accuracy: 66.67% -> 66.23%     
---------------------------- TRAINING EPOCH: 180 ----------------------------  
client [21] (testset)   loss: 0.8619 -> 1.1146  accuracy: 71.83% -> 66.20%     
client [79] (testset)   loss: 0.8541 -> 0.9228  accuracy: 75.85% -> 84.75%     
client [58] (testset)   loss: 1.2015 -> 1.2426  accuracy: 69.81% -> 69.18%     
client [88] (testset)   loss: 1.1604 -> 1.0639  accuracy: 62.84% -> 68.31%     
client [46] (testset)   loss: 1.2170 -> 1.3109  accuracy: 68.06% -> 63.89%     
client [11] (testset)   loss: 1.1354 -> 1.1278  accuracy: 68.46% -> 69.23%     
client [55] (testset)   loss: 0.8687 -> 0.8501  accuracy: 79.25% -> 78.30%     
client [13] (testset)   loss: 1.0849 -> 1.1281  accuracy: 73.14% -> 72.73%     
client [31] (testset)   loss: 1.0019 -> 1.1452  accuracy: 74.29% -> 75.00%     
client [75] (testset)   loss: 1.0424 -> 1.2347  accuracy: 67.50% -> 63.75%     
---------------------------- TRAINING EPOCH: 190 ----------------------------  
client [19] (testset)   loss: 0.6740 -> 0.6780  accuracy: 78.29% -> 76.32%     
client [7]  (testset)   loss: 1.2137 -> 1.3141  accuracy: 64.52% -> 67.74%     
client [57] (testset)   loss: 0.9540 -> 0.9891  accuracy: 69.35% -> 70.16%     
client [13] (testset)   loss: 1.0528 -> 1.1814  accuracy: 73.14% -> 73.14%     
client [43] (testset)   loss: 1.0957 -> 1.1258  accuracy: 67.15% -> 68.61%     
client [91] (testset)   loss: 1.0590 -> 1.2794  accuracy: 67.31% -> 66.35%     
client [10] (testset)   loss: 0.9209 -> 0.8861  accuracy: 69.29% -> 70.08%     
client [64] (testset)   loss: 0.7297 -> 0.8183  accuracy: 77.89% -> 76.84%     
client [82] (testset)   loss: 0.8312 -> 0.8451  accuracy: 79.29% -> 79.29%     
client [22] (testset)   loss: 1.2807 -> 1.4291  accuracy: 57.69% -> 61.54%     
---------------------------- TRAINING EPOCH: 200 ----------------------------  
client [20] (testset)   loss: 1.5030 -> 1.4367  accuracy: 63.20% -> 62.77%     
client [23] (testset)   loss: 1.1131 -> 1.2409  accuracy: 63.57% -> 66.67%     
client [88] (testset)   loss: 1.2448 -> 1.1167  accuracy: 66.12% -> 68.85%     
client [98] (testset)   loss: 0.8440 -> 0.9594  accuracy: 74.34% -> 72.37%     
client [79] (testset)   loss: 0.7997 -> 0.9241  accuracy: 82.63% -> 84.32%     
client [21] (testset)   loss: 0.8683 -> 1.1353  accuracy: 70.42% -> 70.42%     
client [92] (testset)   loss: 0.6697 -> 0.7203  accuracy: 81.34% -> 81.34%     
client [56] (testset)   loss: 1.1340 -> 1.0956  accuracy: 66.00% -> 68.00%     
client [5]  (testset)   loss: 1.1033 -> 1.1597  accuracy: 66.07% -> 66.07%     
client [52] (testset)   loss: 1.3607 -> 1.1536  accuracy: 56.46% -> 65.99%     
---------------------------- TRAINING EPOCH: 210 ----------------------------  
client [67] (testset)   loss: 1.0849 -> 1.3100  accuracy: 64.50% -> 65.80%     
client [54] (testset)   loss: 1.2032 -> 1.3233  accuracy: 72.90% -> 74.77%     
client [14] (testset)   loss: 1.2978 -> 1.5112  accuracy: 61.34% -> 63.87%     
client [99] (testset)   loss: 1.3390 -> 1.4933  accuracy: 67.03% -> 68.65%     
client [36] (testset)   loss: 0.7587 -> 0.8702  accuracy: 75.76% -> 75.76%     
client [30] (testset)   loss: 1.3094 -> 1.4481  accuracy: 61.39% -> 60.40%     
client [38] (testset)   loss: 0.9599 -> 1.0630  accuracy: 74.70% -> 75.90%     
client [15] (testset)   loss: 1.0633 -> 1.0577  accuracy: 68.82% -> 74.12%     
client [6]  (testset)   loss: 1.1234 -> 1.0535  accuracy: 69.20% -> 76.40%     
client [53] (testset)   loss: 1.4397 -> 1.5590  accuracy: 68.42% -> 61.84%     
---------------------------- TRAINING EPOCH: 220 ----------------------------  
client [99] (testset)   loss: 1.4193 -> 1.5636  accuracy: 62.16% -> 68.65%     
client [6]  (testset)   loss: 1.0975 -> 1.1172  accuracy: 71.20% -> 76.80%     
client [83] (testset)   loss: 0.6696 -> 0.7528  accuracy: 83.00% -> 82.00%     
client [42] (testset)   loss: 0.6807 -> 0.5755  accuracy: 82.29% -> 85.42%     
client [34] (testset)   loss: 0.9481 -> 0.9932  accuracy: 72.00% -> 70.67%     
client [15] (testset)   loss: 1.0818 -> 1.1149  accuracy: 68.82% -> 75.29%     
client [47] (testset)   loss: 0.8132 -> 0.8565  accuracy: 77.78% -> 77.78%     
client [55] (testset)   loss: 0.8090 -> 0.9161  accuracy: 80.19% -> 76.42%     
client [51] (testset)   loss: 1.2457 -> 1.2415  accuracy: 72.62% -> 73.81%     
client [95] (testset)   loss: 1.7455 -> 2.1374  accuracy: 61.61% -> 50.89%     
---------------------------- TRAINING EPOCH: 230 ----------------------------  
client [71] (testset)   loss: 0.6417 -> 0.6926  accuracy: 80.53% -> 80.53%     
client [15] (testset)   loss: 1.1049 -> 1.0478  accuracy: 68.82% -> 74.12%     
client [33] (testset)   loss: 1.0125 -> 1.1191  accuracy: 72.36% -> 73.87%     
client [99] (testset)   loss: 1.4099 -> 1.5806  accuracy: 62.16% -> 68.11%     
client [90] (testset)   loss: 0.9927 -> 1.0347  accuracy: 71.30% -> 71.30%     
client [57] (testset)   loss: 1.1554 -> 1.1205  accuracy: 65.32% -> 67.74%     
client [27] (testset)   loss: 1.0996 -> 1.2364  accuracy: 69.33% -> 66.67%     
client [78] (testset)   loss: 0.8638 -> 0.6158  accuracy: 75.19% -> 86.47%     
client [36] (testset)   loss: 0.7469 -> 0.8906  accuracy: 75.76% -> 76.77%     
client [88] (testset)   loss: 1.1090 -> 1.1643  accuracy: 65.57% -> 64.48%     
---------------------------- TRAINING EPOCH: 240 ----------------------------  
client [70] (testset)   loss: 1.1215 -> 1.2310  accuracy: 73.48% -> 70.45%     
client [35] (testset)   loss: 0.8552 -> 0.7810  accuracy: 75.93% -> 81.48%     
client [16] (testset)   loss: 1.3894 -> 1.4977  accuracy: 68.80% -> 68.80%     
client [80] (testset)   loss: 1.3063 -> 1.4408  accuracy: 58.94% -> 62.25%     
client [38] (testset)   loss: 1.0085 -> 1.0887  accuracy: 71.08% -> 74.70%     
client [78] (testset)   loss: 0.8381 -> 0.6393  accuracy: 76.69% -> 87.22%     
client [68] (testset)   loss: 0.7853 -> 1.0376  accuracy: 76.06% -> 78.87%     
client [11] (testset)   loss: 1.1645 -> 1.2799  accuracy: 66.92% -> 66.92%     
client [64] (testset)   loss: 0.8278 -> 0.8541  accuracy: 77.89% -> 77.89%     
client [82] (testset)   loss: 1.0859 -> 0.9435  accuracy: 70.71% -> 80.71%     
---------------------------- TRAINING EPOCH: 250 ----------------------------  
client [30] (testset)   loss: 1.3308 -> 1.5039  accuracy: 64.36% -> 64.36%     
client [27] (testset)   loss: 1.2678 -> 1.2931  accuracy: 66.67% -> 69.33%     
client [74] (testset)   loss: 1.2678 -> 1.2383  accuracy: 56.15% -> 63.85%     
client [45] (testset)   loss: 1.4754 -> 1.5575  accuracy: 64.94% -> 63.10%     
client [6]  (testset)   loss: 1.0832 -> 1.1480  accuracy: 73.20% -> 76.80%     
client [36] (testset)   loss: 0.8378 -> 0.9481  accuracy: 76.77% -> 77.78%     
client [63] (testset)   loss: 1.7813 -> 1.7706  accuracy: 52.94% -> 57.98%     
client [76] (testset)   loss: 0.8867 -> 0.8964  accuracy: 76.97% -> 78.79%     
client [83] (testset)   loss: 0.6583 -> 0.7263  accuracy: 83.00% -> 84.00%     
client [86] (testset)   loss: 1.1726 -> 1.2302  accuracy: 73.08% -> 73.08%     
---------------------------- TRAINING EPOCH: 260 ----------------------------  
client [83] (testset)   loss: 0.6286 -> 0.7507  accuracy: 82.00% -> 80.00%     
client [99] (testset)   loss: 1.4722 -> 1.6449  accuracy: 62.16% -> 69.19%     
client [74] (testset)   loss: 1.2088 -> 1.3288  accuracy: 61.54% -> 66.92%     
client [73] (testset)   loss: 1.4125 -> 1.3596  accuracy: 66.28% -> 71.71%     
client [29] (testset)   loss: 1.6360 -> 1.6597  accuracy: 62.31% -> 64.62%     
client [92] (testset)   loss: 0.6492 -> 0.7018  accuracy: 79.43% -> 82.30%     
client [6]  (testset)   loss: 1.1413 -> 1.1463  accuracy: 74.40% -> 77.60%     
client [61] (testset)   loss: 1.3794 -> 1.3641  accuracy: 62.50% -> 61.67%     
client [21] (testset)   loss: 0.9614 -> 1.2072  accuracy: 73.24% -> 71.83%     
client [67] (testset)   loss: 1.1305 -> 1.3647  accuracy: 68.40% -> 65.80%     
---------------------------- TRAINING EPOCH: 270 ----------------------------  
client [83] (testset)   loss: 0.7120 -> 0.7836  accuracy: 80.00% -> 82.00%     
client [32] (testset)   loss: 1.2793 -> 1.3813  accuracy: 67.02% -> 69.15%     
client [95] (testset)   loss: 1.9677 -> 2.2939  accuracy: 58.93% -> 52.68%     
client [61] (testset)   loss: 1.5184 -> 1.4660  accuracy: 55.83% -> 60.83%     
client [27] (testset)   loss: 1.3747 -> 1.3507  accuracy: 64.00% -> 65.33%     
client [25] (testset)   loss: 0.6412 -> 1.0642  accuracy: 70.00% -> 66.67%     
client [68] (testset)   loss: 0.7910 -> 1.1369  accuracy: 81.69% -> 76.06%     
client [34] (testset)   loss: 0.9811 -> 1.0062  accuracy: 73.78% -> 73.78%     
client [71] (testset)   loss: 0.7562 -> 0.7923  accuracy: 83.16% -> 82.11%     
client [89] (testset)   loss: 1.4446 -> 1.4080  accuracy: 69.57% -> 65.22%     
---------------------------- TRAINING EPOCH: 280 ----------------------------  
client [78] (testset)   loss: 0.6910 -> 0.6678  accuracy: 81.95% -> 86.47%     
client [81] (testset)   loss: 1.1003 -> 1.1143  accuracy: 70.48% -> 75.24%     
client [51] (testset)   loss: 1.2576 -> 1.3611  accuracy: 73.81% -> 71.43%     
client [54] (testset)   loss: 1.4278 -> 1.4421  accuracy: 68.22% -> 73.83%     
client [65] (testset)   loss: 1.1660 -> 1.1390  accuracy: 75.00% -> 68.18%     
client [41] (testset)   loss: 0.8535 -> 1.0133  accuracy: 77.62% -> 79.72%     
client [11] (testset)   loss: 1.2157 -> 1.3450  accuracy: 70.00% -> 67.69%     
client [85] (testset)   loss: 1.2811 -> 1.4261  accuracy: 57.43% -> 59.41%     
client [12] (testset)   loss: 0.7353 -> 0.7497  accuracy: 82.67% -> 83.33%     
client [23] (testset)   loss: 1.0017 -> 1.2123  accuracy: 72.09% -> 65.89%     
---------------------------- TRAINING EPOCH: 290 ----------------------------  
client [16] (testset)   loss: 1.4771 -> 1.6004  accuracy: 69.60% -> 68.80%     
client [65] (testset)   loss: 1.0723 -> 1.0885  accuracy: 72.73% -> 75.00%     
client [53] (testset)   loss: 1.5329 -> 1.6566  accuracy: 64.47% -> 65.79%     
client [58] (testset)   loss: 1.2354 -> 1.3148  accuracy: 71.70% -> 74.21%     
client [72] (testset)   loss: 1.3425 -> 1.3414  accuracy: 55.38% -> 60.77%     
client [7]  (testset)   loss: 1.4770 -> 1.4243  accuracy: 63.59% -> 67.28%     
client [71] (testset)   loss: 0.7960 -> 0.7915  accuracy: 79.47% -> 81.05%     
client [59] (testset)   loss: 1.4304 -> 1.5463  accuracy: 60.51% -> 64.97%     
client [86] (testset)   loss: 1.2153 -> 1.2575  accuracy: 76.15% -> 74.62%     
client [39] (testset)   loss: 1.0133 -> 1.0760  accuracy: 73.28% -> 72.41%     
---------------------------- TRAINING EPOCH: 300 ----------------------------  
client [99] (testset)   loss: 1.4715 -> 1.6602  accuracy: 62.16% -> 66.49%     
client [7]  (testset)   loss: 1.4910 -> 1.4143  accuracy: 64.52% -> 68.20%     
client [17] (testset)   loss: 0.6555 -> 0.5237  accuracy: 81.05% -> 84.97%     
client [64] (testset)   loss: 0.9278 -> 0.8780  accuracy: 75.26% -> 80.00%     
client [37] (testset)   loss: 1.1633 -> 1.4617  accuracy: 70.13% -> 74.03%     
client [29] (testset)   loss: 1.6066 -> 1.8096  accuracy: 66.15% -> 66.15%     
client [93] (testset)   loss: 1.4853 -> 1.4941  accuracy: 65.28% -> 68.30%     
client [73] (testset)   loss: 1.4524 -> 1.4510  accuracy: 69.77% -> 70.54%     
client [40] (testset)   loss: 1.0737 -> 1.0509  accuracy: 69.11% -> 69.92%     
client [76] (testset)   loss: 0.8735 -> 0.9053  accuracy: 78.79% -> 79.39%     
---------------------------- TRAINING EPOCH: 310 ----------------------------  
client [31] (testset)   loss: 1.1516 -> 1.3348  accuracy: 75.36% -> 76.43%     
client [89] (testset)   loss: 1.2599 -> 1.4079  accuracy: 69.57% -> 63.77%     
client [77] (testset)   loss: 1.4047 -> 1.5434  accuracy: 66.67% -> 66.10%     
client [90] (testset)   loss: 1.1553 -> 1.2577  accuracy: 71.30% -> 73.15%     
client [26] (testset)   loss: 0.7454 -> 0.6978  accuracy: 78.09% -> 79.78%     
client [50] (testset)   loss: 0.6141 -> 0.6438  accuracy: 78.63% -> 80.92%     
client [30] (testset)   loss: 1.4479 -> 1.5995  accuracy: 65.35% -> 66.34%     
client [70] (testset)   loss: 1.1958 -> 1.4315  accuracy: 72.73% -> 69.70%     
client [41] (testset)   loss: 0.9265 -> 1.0490  accuracy: 77.62% -> 78.32%     
client [99] (testset)   loss: 1.5437 -> 1.7088  accuracy: 63.78% -> 67.03%     
---------------------------- TRAINING EPOCH: 320 ----------------------------  
client [68] (testset)   loss: 0.8474 -> 0.9935  accuracy: 81.69% -> 80.28%     
client [70] (testset)   loss: 1.2038 -> 1.3541  accuracy: 71.97% -> 71.21%     
client [52] (testset)   loss: 1.2592 -> 1.2181  accuracy: 65.31% -> 68.71%     
client [1]  (testset)   loss: 1.3225 -> 1.3028  accuracy: 68.79% -> 74.57%     
client [2]  (testset)   loss: 0.8399 -> 0.8253  accuracy: 76.92% -> 78.85%     
client [67] (testset)   loss: 1.2752 -> 1.4703  accuracy: 68.40% -> 66.23%     
client [92] (testset)   loss: 0.6669 -> 0.7189  accuracy: 82.30% -> 82.30%     
client [35] (testset)   loss: 0.8801 -> 0.7625  accuracy: 75.93% -> 81.48%     
client [36] (testset)   loss: 0.8779 -> 0.9530  accuracy: 74.75% -> 73.74%     
client [64] (testset)   loss: 0.8774 -> 0.8677  accuracy: 79.47% -> 79.47%     
---------------------------- TRAINING EPOCH: 330 ----------------------------  
client [44] (testset)   loss: 1.0481 -> 1.0597  accuracy: 76.16% -> 77.81%     
client [6]  (testset)   loss: 1.2018 -> 1.2407  accuracy: 74.00% -> 75.20%     
client [12] (testset)   loss: 0.7673 -> 0.7380  accuracy: 82.00% -> 84.00%     
client [55] (testset)   loss: 0.8745 -> 0.9869  accuracy: 79.25% -> 78.30%     
client [29] (testset)   loss: 1.7793 -> 1.9519  accuracy: 60.77% -> 65.38%     
client [9]  (testset)   loss: 1.4286 -> 1.4300  accuracy: 67.83% -> 65.22%     
client [43] (testset)   loss: 1.2979 -> 1.2879  accuracy: 64.23% -> 70.07%     
client [77] (testset)   loss: 1.3810 -> 1.5904  accuracy: 67.23% -> 67.23%     
client [98] (testset)   loss: 0.9592 -> 1.0960  accuracy: 76.32% -> 74.34%     
client [78] (testset)   loss: 0.7384 -> 0.6832  accuracy: 84.21% -> 87.22%     
---------------------------- TRAINING EPOCH: 340 ----------------------------  
client [92] (testset)   loss: 0.7696 -> 0.7710  accuracy: 81.82% -> 80.38%     
client [80] (testset)   loss: 1.5302 -> 1.5409  accuracy: 62.25% -> 58.94%     
client [63] (testset)   loss: 2.0984 -> 1.9261  accuracy: 53.78% -> 54.62%     
client [76] (testset)   loss: 0.9162 -> 0.9379  accuracy: 78.18% -> 81.82%     
client [78] (testset)   loss: 0.7252 -> 0.7844  accuracy: 81.95% -> 84.21%     
client [25] (testset)   loss: 0.6603 -> 0.9900  accuracy: 76.67% -> 71.67%     
client [58] (testset)   loss: 1.3818 -> 1.3909  accuracy: 71.70% -> 73.58%     
client [13] (testset)   loss: 1.3141 -> 1.4260  accuracy: 70.66% -> 71.49%     
client [17] (testset)   loss: 0.7224 -> 0.6256  accuracy: 79.74% -> 83.66%     
client [38] (testset)   loss: 1.0575 -> 1.1429  accuracy: 75.90% -> 77.11%     
---------------------------- TRAINING EPOCH: 350 ----------------------------  
client [72] (testset)   loss: 1.3896 -> 1.6163  accuracy: 59.23% -> 58.46%     
client [82] (testset)   loss: 1.0501 -> 0.9978  accuracy: 79.29% -> 83.57%     
client [86] (testset)   loss: 1.2439 -> 1.4056  accuracy: 73.85% -> 74.62%     
client [51] (testset)   loss: 1.3075 -> 1.4844  accuracy: 75.00% -> 69.05%     
client [96] (testset)   loss: 1.1115 -> 1.0846  accuracy: 70.68% -> 71.43%     
client [42] (testset)   loss: 0.7634 -> 0.7134  accuracy: 79.17% -> 87.50%     
client [55] (testset)   loss: 0.8517 -> 0.9656  accuracy: 81.13% -> 81.13%     
client [13] (testset)   loss: 1.3689 -> 1.4400  accuracy: 70.66% -> 72.73%     
client [1]  (testset)   loss: 1.5396 -> 1.2828  accuracy: 66.47% -> 73.99%     
client [12] (testset)   loss: 0.7619 -> 0.8211  accuracy: 82.67% -> 86.00%     
---------------------------- TRAINING EPOCH: 360 ----------------------------  
client [68] (testset)   loss: 0.8380 -> 1.0355  accuracy: 83.10% -> 80.28%     
client [23] (testset)   loss: 1.0884 -> 1.1349  accuracy: 69.77% -> 68.99%     
client [46] (testset)   loss: 1.4838 -> 1.6053  accuracy: 71.53% -> 68.40%     
client [41] (testset)   loss: 0.9808 -> 1.0969  accuracy: 77.62% -> 79.72%     
client [25] (testset)   loss: 0.6924 -> 0.9877  accuracy: 75.00% -> 66.67%     
client [58] (testset)   loss: 1.4143 -> 1.4202  accuracy: 70.44% -> 73.58%     
client [14] (testset)   loss: 1.6480 -> 1.8850  accuracy: 63.87% -> 59.66%     
client [33] (testset)   loss: 1.1844 -> 1.3604  accuracy: 71.36% -> 71.36%     
client [85] (testset)   loss: 1.4323 -> 1.5210  accuracy: 55.45% -> 59.41%     
client [62] (testset)   loss: 1.3397 -> 1.0388  accuracy: 64.65% -> 68.69%     
---------------------------- TRAINING EPOCH: 370 ----------------------------  
client [98] (testset)   loss: 0.9976 -> 1.1127  accuracy: 73.03% -> 71.71%     
client [63] (testset)   loss: 2.0624 -> 2.0345  accuracy: 55.46% -> 53.78%     
client [70] (testset)   loss: 1.2633 -> 1.4039  accuracy: 70.45% -> 70.45%     
client [65] (testset)   loss: 1.2697 -> 1.0081  accuracy: 70.45% -> 70.45%     
client [14] (testset)   loss: 1.6698 -> 1.7873  accuracy: 63.03% -> 58.82%     
client [73] (testset)   loss: 1.6343 -> 1.5942  accuracy: 66.67% -> 70.16%     
client [34] (testset)   loss: 0.9990 -> 1.0815  accuracy: 74.22% -> 76.89%     
client [99] (testset)   loss: 1.5922 -> 1.7671  accuracy: 66.49% -> 67.57%     
client [69] (testset)   loss: 1.4460 -> 1.6969  accuracy: 59.60% -> 64.24%     
client [46] (testset)   loss: 1.4963 -> 1.6423  accuracy: 71.88% -> 70.14%     
---------------------------- TRAINING EPOCH: 380 ----------------------------  
client [99] (testset)   loss: 1.6193 -> 1.7960  accuracy: 64.86% -> 67.03%     
client [93] (testset)   loss: 1.5850 -> 1.6481  accuracy: 63.40% -> 67.55%     
client [11] (testset)   loss: 1.3800 -> 1.5250  accuracy: 69.23% -> 68.46%     
client [58] (testset)   loss: 1.3170 -> 1.3924  accuracy: 74.84% -> 74.21%     
client [81] (testset)   loss: 1.2115 -> 1.2556  accuracy: 71.43% -> 77.14%     
client [85] (testset)   loss: 1.4535 -> 1.4407  accuracy: 56.44% -> 59.41%     
client [89] (testset)   loss: 1.4215 -> 1.3745  accuracy: 68.12% -> 65.22%     
client [45] (testset)   loss: 1.7644 -> 1.7911  accuracy: 65.68% -> 65.31%     
client [8]  (testset)   loss: 1.3532 -> 1.1749  accuracy: 76.00% -> 80.00%     
client [68] (testset)   loss: 0.8722 -> 1.0789  accuracy: 81.69% -> 81.69%     
---------------------------- TRAINING EPOCH: 390 ----------------------------  
client [67] (testset)   loss: 1.3892 -> 1.5746  accuracy: 68.83% -> 65.80%     
client [72] (testset)   loss: 1.5169 -> 1.5835  accuracy: 59.23% -> 61.54%     
client [1]  (testset)   loss: 1.5648 -> 1.3930  accuracy: 68.21% -> 75.72%     
client [78] (testset)   loss: 0.7024 -> 0.6819  accuracy: 84.21% -> 85.71%     
client [83] (testset)   loss: 0.7547 -> 0.8351  accuracy: 84.00% -> 84.00%     
client [21] (testset)   loss: 1.0554 -> 1.3013  accuracy: 67.61% -> 67.61%     
client [56] (testset)   loss: 1.4447 -> 1.4659  accuracy: 70.00% -> 68.00%     
client [44] (testset)   loss: 1.1419 -> 1.1328  accuracy: 74.83% -> 78.15%     
client [92] (testset)   loss: 0.7274 -> 0.7592  accuracy: 83.25% -> 83.25%     
client [27] (testset)   loss: 1.5508 -> 1.5147  accuracy: 64.00% -> 66.67%     
---------------------------- TRAINING EPOCH: 400 ----------------------------  
client [10] (testset)   loss: 1.1778 -> 1.1973  accuracy: 69.29% -> 67.72%     
client [39] (testset)   loss: 1.0943 -> 1.1265  accuracy: 71.55% -> 74.14%     
client [65] (testset)   loss: 1.4030 -> 1.2452  accuracy: 70.45% -> 68.18%     
client [26] (testset)   loss: 0.7556 -> 0.7637  accuracy: 79.78% -> 81.46%     
client [19] (testset)   loss: 0.7925 -> 0.8696  accuracy: 76.32% -> 77.63%     
client [68] (testset)   loss: 0.9570 -> 1.1608  accuracy: 80.28% -> 80.28%     
client [41] (testset)   loss: 1.0843 -> 1.1239  accuracy: 74.83% -> 79.72%     
client [50] (testset)   loss: 0.6574 -> 0.6355  accuracy: 80.92% -> 79.39%     
client [75] (testset)   loss: 1.5599 -> 1.5426  accuracy: 62.50% -> 68.75%     
client [81] (testset)   loss: 1.2380 -> 1.2880  accuracy: 68.57% -> 75.24%     
Training... ---------------------------------------- 100% 0:14:00
FedOBP's average time taken by each global epoch: 0 min 2.08 sec.              
FedOBP's total running time: 0 h 14 m 0 s.                                     
==================== FedOBP Experiment Results: ====================           
Display format: (before local fine-tuning) -> (after local fine-tuning)        
 So if finetune_epoch = 0, x.xx% -> 0.00% is normal.                           
 Centralized testing ONLY happens after model aggregation, so the stats between
'->' are the same.                                                             
{                                                                              
    "100": {                                                                   
        "all_clients": {                                                       
            "test": {                                                          
                "loss": "0.9976 -> 0.0000",                                    
                "accuracy": "67.61% -> 0.00%"                                  
            }                                                                  
        }                                                                      
    },                                                                         
    "200": {                                                                   
        "all_clients": {                                                       
            "test": {                                                          
                "loss": "1.0715 -> 0.0000",                                    
                "accuracy": "69.80% -> 0.00%"                                  
            }                                                                  
        }                                                                      
    },                                                                         
    "300": {                                                                   
        "all_clients": {                                                       
            "test": {                                                          
                "loss": "1.2006 -> 0.0000",                                    
                "accuracy": "70.31% -> 0.00%"                                  
            }                                                                  
        }                                                                      
    },                                                                         
    "400": {                                                                   
        "all_clients": {                                                       
            "test": {                                                          
                "loss": "1.3123 -> 0.0000",                                    
                "accuracy": "71.00% -> 0.00%"                                  
            }                                                                  
        }                                                                      
    }                                                                          
}                                                                              
==================== FedOBP Max Accuracy ====================                  
all_clients:                                                                   
(test) before fine-tuning: 71.00% at epoch 400                                 
(test) after fine-tuning: 0.00% at epoch 100                                   
[0m