==================== FedProto ====================                             
Experiment Arguments:                                                          
{
│   'method': 'fedproto',
│   'dataset': {
│   │   'name': 'emnist',
│   │   'client_num': 100,
│   │   'test_ratio': 0.25,
│   │   'val_ratio': 0.0,
│   │   'seed': 42,
│   │   'split': 'sample',
│   │   'IID_ratio': 0.0,
│   │   'monitor_window_name_suffix': 'emnist-100clients-0%IID-Dir(0.5)-seed42',
│   │   'emnist_split': 'byclass',
│   │   'alpha': 0.5,
│   │   'min_samples_per_client': 10
│   },
│   'model': {
│   │   'name': 'avgcnn',
│   │   'use_torchvision_pretrained_weights': True,
│   │   'external_model_weights_path': None
│   },
│   'optimizer': {
│   │   'lr': 0.01,
│   │   'dampening': 0,
│   │   'weight_decay': 0,
│   │   'momentum': 0,
│   │   'nesterov': False,
│   │   'name': 'sgd'
│   },
│   'mode': 'serial',
│   'parallel': {
│   │   'ray_cluster_addr': None,
│   │   'num_cpus': None,
│   │   'num_gpus': None,
│   │   'num_workers': 2
│   },
│   'common': {
│   │   'seed': 42,
│   │   'join_ratio': 0.1,
│   │   'global_epoch': 400,
│   │   'local_epoch': 5,
│   │   'batch_size': 32,
│   │   'reset_optimizer_on_global_epoch': True,
│   │   'straggler_ratio': 0,
│   │   'straggler_min_local_epoch': 0,
│   │   'buffers': 'global',
│   │   'client_side_evaluation': True,
│   │   'test': {
│   │   │   'client': {
│   │   │   │   'interval': 100,
│   │   │   │   'finetune_epoch': 0,
│   │   │   │   'train': False,
│   │   │   │   'val': False,
│   │   │   │   'test': True
│   │   │   },
│   │   │   'server': {
│   │   │   │   'interval': -1,
│   │   │   │   'train': False,
│   │   │   │   'val': False,
│   │   │   │   'test': False,
│   │   │   │   'model_in_train_mode': False
│   │   │   }
│   │   },
│   │   'verbose_gap': 10,
│   │   'monitor': None,
│   │   'use_cuda': True,
│   │   'save_log': True,
│   │   'save_model': False,
│   │   'save_learning_curve_plot': False,
│   │   'save_metrics': True,
│   │   'delete_useless_run': True
│   },
│   'fedproto': {
│   │   'lamda': 1
│   }
}
---------------------------- TRAINING EPOCH: 10 ----------------------------   
client [77] (testset)   loss: 0.7292 -> 0.6415  accuracy: 78.81% -> 81.30%     
client [81] (testset)   loss: 0.7267 -> 0.8187  accuracy: 78.61% -> 75.78%     
client [21] (testset)   loss: 4.1336 -> 0.6476  accuracy: 0.15% -> 84.35%      
client [68] (testset)   loss: 0.5872 -> 0.4523  accuracy: 82.89% -> 86.07%     
client [93] (testset)   loss: 0.7703 -> 0.6019  accuracy: 81.78% -> 86.73%     
client [31] (testset)   loss: 0.8123 -> 0.6074  accuracy: 75.74% -> 82.28%     
client [20] (testset)   loss: 0.6770 -> 0.5747  accuracy: 82.78% -> 84.96%     
client [59] (testset)   loss: 4.1158 -> 0.9665  accuracy: 0.11% -> 73.19%      
client [48] (testset)   loss: 0.5664 -> 0.5168  accuracy: 82.48% -> 84.54%     
client [34] (testset)   loss: 1.0250 -> 0.6566  accuracy: 74.23% -> 83.77%     
---------------------------- TRAINING EPOCH: 20 ----------------------------   
client [69] (testset)   loss: 0.6791 -> 0.9346  accuracy: 79.79% -> 73.13%     
client [99] (testset)   loss: 0.8994 -> 1.7710  accuracy: 77.64% -> 56.22%     
client [67] (testset)   loss: 0.7792 -> 0.5932  accuracy: 79.49% -> 83.70%     
client [0]  (testset)   loss: 0.4575 -> 0.3917  accuracy: 88.15% -> 89.62%     
client [76] (testset)   loss: 0.8137 -> 0.7045  accuracy: 77.15% -> 79.13%     
client [41] (testset)   loss: 1.3057 -> 0.9794  accuracy: 65.34% -> 73.57%     
client [62] (testset)   loss: 4.1210 -> 1.1254  accuracy: 0.23% -> 73.30%      
client [2]  (testset)   loss: 4.1064 -> 0.6561  accuracy: 1.61% -> 82.45%      
client [14] (testset)   loss: 0.4945 -> 0.4430  accuracy: 88.26% -> 88.93%     
client [46] (testset)   loss: 0.4802 -> 0.4476  accuracy: 87.50% -> 87.39%     
---------------------------- TRAINING EPOCH: 30 ----------------------------   
client [24] (testset)   loss: 0.4594 -> 0.4231  accuracy: 88.38% -> 89.26%     
client [68] (testset)   loss: 0.3444 -> 0.3475  accuracy: 88.39% -> 88.30%     
client [57] (testset)   loss: 0.7129 -> 0.6875  accuracy: 79.54% -> 73.62%     
client [17] (testset)   loss: 0.4025 -> 0.3472  accuracy: 88.38% -> 90.36%     
client [54] (testset)   loss: 0.5254 -> 0.4094  accuracy: 83.45% -> 87.27%     
client [23] (testset)   loss: 4.1140 -> 0.8869  accuracy: 0.23% -> 76.88%      
client [35] (testset)   loss: 0.6393 -> 0.6009  accuracy: 81.56% -> 82.28%     
client [59] (testset)   loss: 0.6498 -> 0.5953  accuracy: 79.58% -> 80.55%     
client [31] (testset)   loss: 0.4208 -> 0.4237  accuracy: 87.17% -> 86.56%     
client [9]  (testset)   loss: 0.9320 -> 0.8384  accuracy: 74.02% -> 75.55%     
---------------------------- TRAINING EPOCH: 40 ----------------------------   
client [64] (testset)   loss: 0.5991 -> 0.5571  accuracy: 81.50% -> 82.03%     
client [33] (testset)   loss: 0.4617 -> 0.5123  accuracy: 85.20% -> 82.59%     
client [16] (testset)   loss: 0.5002 -> 0.4837  accuracy: 85.61% -> 86.65%     
client [44] (testset)   loss: 1.1962 -> 0.8483  accuracy: 66.99% -> 74.38%     
client [8]  (testset)   loss: 0.4270 -> 0.4071  accuracy: 88.61% -> 89.14%     
client [31] (testset)   loss: 0.4450 -> 0.4032  accuracy: 85.51% -> 86.97%     
client [47] (testset)   loss: 0.6513 -> 0.5846  accuracy: 79.20% -> 81.13%     
client [36] (testset)   loss: 0.8999 -> 0.6711  accuracy: 74.86% -> 81.20%     
client [20] (testset)   loss: 0.4344 -> 0.4319  accuracy: 87.79% -> 88.09%     
client [56] (testset)   loss: 0.7313 -> 0.6602  accuracy: 80.15% -> 80.68%     
---------------------------- TRAINING EPOCH: 50 ----------------------------   
client [4]  (testset)   loss: 0.4344 -> 0.4254  accuracy: 87.57% -> 87.03%     
client [60] (testset)   loss: 0.5098 -> 0.4321  accuracy: 87.55% -> 89.45%     
client [28] (testset)   loss: 0.4755 -> 0.4696  accuracy: 86.88% -> 86.07%     
client [25] (testset)   loss: 0.2911 -> 0.2684  accuracy: 92.73% -> 93.22%     
client [58] (testset)   loss: 0.3139 -> 0.3038  accuracy: 90.53% -> 90.57%     
client [44] (testset)   loss: 0.8483 -> 0.7440  accuracy: 74.38% -> 75.68%     
client [39] (testset)   loss: 0.6125 -> 0.5701  accuracy: 80.20% -> 82.34%     
client [29] (testset)   loss: 0.7988 -> 0.7592  accuracy: 74.48% -> 75.64%     
client [3]  (testset)   loss: 0.4026 -> 0.3540  accuracy: 89.62% -> 90.71%     
client [84] (testset)   loss: 0.3526 -> 0.3512  accuracy: 89.66% -> 89.50%     
---------------------------- TRAINING EPOCH: 60 ----------------------------   
client [21] (testset)   loss: 0.4156 -> 0.3791  accuracy: 88.70% -> 89.76%     
client [84] (testset)   loss: 0.3465 -> 0.3458  accuracy: 90.24% -> 89.62%     
client [10] (testset)   loss: 0.5231 -> 0.4605  accuracy: 85.34% -> 87.07%     
client [36] (testset)   loss: 0.5265 -> 0.4967  accuracy: 85.04% -> 84.64%     
client [65] (testset)   loss: 0.5658 -> 0.5410  accuracy: 82.66% -> 84.21%     
client [81] (testset)   loss: 0.4902 -> 0.5487  accuracy: 83.89% -> 83.79%     
client [79] (testset)   loss: 0.3705 -> 0.3407  accuracy: 91.19% -> 91.99%     
client [42] (testset)   loss: 0.3659 -> 0.3520  accuracy: 89.91% -> 89.96%     
client [11] (testset)   loss: 0.3843 -> 0.3598  accuracy: 90.69% -> 91.35%     
client [96] (testset)   loss: 0.4732 -> 0.4645  accuracy: 87.25% -> 87.59%     
---------------------------- TRAINING EPOCH: 70 ----------------------------   
client [8]  (testset)   loss: 0.4108 -> 0.4057  accuracy: 88.76% -> 88.24%     
client [53] (testset)   loss: 0.5363 -> 0.5132  accuracy: 83.75% -> 85.05%     
client [52] (testset)   loss: 0.5229 -> 0.5135  accuracy: 84.42% -> 84.79%     
client [42] (testset)   loss: 0.3421 -> 0.3347  accuracy: 89.87% -> 90.40%     
client [69] (testset)   loss: 1.6305 -> 0.3227  accuracy: 58.48% -> 91.34%     
client [59] (testset)   loss: 0.5453 -> 0.5637  accuracy: 81.35% -> 78.56%     
client [7]  (testset)   loss: 0.3997 -> 0.4080  accuracy: 86.57% -> 86.22%     
client [26] (testset)   loss: 0.5432 -> 0.4624  accuracy: 84.31% -> 84.93%     
client [49] (testset)   loss: 0.3307 -> 0.3184  accuracy: 91.06% -> 90.94%     
client [98] (testset)   loss: 0.3363 -> 0.3549  accuracy: 90.21% -> 89.17%     
---------------------------- TRAINING EPOCH: 80 ----------------------------   
client [98] (testset)   loss: 0.3549 -> 0.3458  accuracy: 89.17% -> 89.73%     
client [47] (testset)   loss: 0.5545 -> 0.5586  accuracy: 81.80% -> 81.64%     
client [21] (testset)   loss: 0.3641 -> 0.3767  accuracy: 90.51% -> 89.91%     
client [77] (testset)   loss: 0.5210 -> 0.5119  accuracy: 83.19% -> 83.68%     
client [95] (testset)   loss: 0.3080 -> 0.3067  accuracy: 91.43% -> 91.58%     
client [91] (testset)   loss: 0.4763 -> 0.4703  accuracy: 85.14% -> 85.94%     
client [14] (testset)   loss: 0.3840 -> 0.3621  accuracy: 90.26% -> 90.36%     
client [99] (testset)   loss: 0.3812 -> 0.3594  accuracy: 89.35% -> 89.74%     
client [20] (testset)   loss: 0.4160 -> 0.4147  accuracy: 88.27% -> 88.21%     
client [39] (testset)   loss: 0.5374 -> 0.5111  accuracy: 82.87% -> 83.65%     
---------------------------- TRAINING EPOCH: 90 ----------------------------   
client [52] (testset)   loss: 0.5135 -> 0.5058  accuracy: 84.79% -> 84.37%     
client [62] (testset)   loss: 0.5211 -> 0.5195  accuracy: 85.19% -> 85.11%     
client [71] (testset)   loss: 0.5758 -> 0.5696  accuracy: 81.62% -> 82.15%     
client [97] (testset)   loss: 0.3248 -> 0.3162  accuracy: 90.84% -> 91.00%     
client [30] (testset)   loss: 0.3679 -> 0.3747  accuracy: 88.24% -> 88.83%     
client [88] (testset)   loss: 0.3969 -> 0.3879  accuracy: 86.79% -> 86.32%     
client [60] (testset)   loss: 0.3564 -> 0.3367  accuracy: 91.15% -> 91.04%     
client [82] (testset)   loss: 0.5281 -> 0.4913  accuracy: 82.90% -> 85.27%     
client [91] (testset)   loss: 0.4819 -> 0.4643  accuracy: 85.34% -> 86.04%     
client [57] (testset)   loss: 0.5486 -> 0.8685  accuracy: 83.60% -> 72.31%     
---------------------------- TRAINING EPOCH: 100 ----------------------------  
client [31] (testset)   loss: 0.3950 -> 0.4013  accuracy: 87.17% -> 86.91%     
client [15] (testset)   loss: 0.5998 -> 0.5954  accuracy: 81.86% -> 80.99%     
client [71] (testset)   loss: 0.5696 -> 0.5923  accuracy: 82.15% -> 81.17%     
client [97] (testset)   loss: 0.3158 -> 0.3102  accuracy: 90.80% -> 91.20%     
client [53] (testset)   loss: 0.4463 -> 0.4402  accuracy: 85.58% -> 86.29%     
client [77] (testset)   loss: 0.5119 -> 0.5034  accuracy: 83.68% -> 82.86%     
client [76] (testset)   loss: 0.5702 -> 0.5558  accuracy: 82.05% -> 82.93%     
client [79] (testset)   loss: 0.3146 -> 0.3008  accuracy: 92.21% -> 92.36%     
client [28] (testset)   loss: 0.4336 -> 0.4386  accuracy: 87.29% -> 87.17%     
client [99] (testset)   loss: 0.7231 -> 0.3495  accuracy: 77.97% -> 89.74%     
---------------------------- TRAINING EPOCH: 110 ----------------------------  
client [97] (testset)   loss: 0.3120 -> 0.3494  accuracy: 91.04% -> 89.20%     
client [86] (testset)   loss: 0.3512 -> 0.3664  accuracy: 89.76% -> 89.81%     
client [34] (testset)   loss: 0.4352 -> 0.4380  accuracy: 86.83% -> 87.51%     
client [73] (testset)   loss: 0.5872 -> 0.5672  accuracy: 81.37% -> 81.15%     
client [5]  (testset)   loss: 0.4691 -> 0.4782  accuracy: 86.65% -> 86.57%     
client [96] (testset)   loss: 0.4322 -> 0.4370  accuracy: 88.12% -> 87.93%     
client [22] (testset)   loss: 0.6352 -> 0.6320  accuracy: 81.32% -> 80.42%     
client [60] (testset)   loss: 0.3359 -> 0.3330  accuracy: 91.15% -> 91.26%     
client [66] (testset)   loss: 0.3306 -> 0.3261  accuracy: 91.16% -> 91.26%     
client [83] (testset)   loss: 0.3469 -> 0.3500  accuracy: 89.25% -> 89.00%     
---------------------------- TRAINING EPOCH: 120 ----------------------------  
client [76] (testset)   loss: 0.5696 -> 0.5501  accuracy: 82.27% -> 82.98%     
client [65] (testset)   loss: 0.5360 -> 0.5318  accuracy: 84.01% -> 83.74%     
client [95] (testset)   loss: 0.3083 -> 0.3168  accuracy: 91.82% -> 91.54%     
client [17] (testset)   loss: 0.3086 -> 0.3194  accuracy: 90.48% -> 90.13%     
client [8]  (testset)   loss: 0.3812 -> 0.4128  accuracy: 89.66% -> 88.61%     
client [35] (testset)   loss: 0.5525 -> 0.5504  accuracy: 83.84% -> 83.39%     
client [98] (testset)   loss: 0.3282 -> 0.3309  accuracy: 90.33% -> 90.21%     
client [53] (testset)   loss: 0.4441 -> 0.4420  accuracy: 86.17% -> 85.64%     
client [43] (testset)   loss: 0.3514 -> 0.3522  accuracy: 89.32% -> 89.62%     
client [64] (testset)   loss: 0.5192 -> 0.4968  accuracy: 83.86% -> 83.38%     
---------------------------- TRAINING EPOCH: 130 ----------------------------  
client [21] (testset)   loss: 0.3393 -> 0.3459  accuracy: 90.33% -> 90.55%     
client [88] (testset)   loss: 0.3740 -> 0.3837  accuracy: 86.70% -> 86.55%     
client [38] (testset)   loss: 0.3393 -> 0.3261  accuracy: 89.92% -> 90.57%     
client [3]  (testset)   loss: 0.2898 -> 0.2863  accuracy: 91.85% -> 91.90%     
client [5]  (testset)   loss: 0.4745 -> 0.4647  accuracy: 85.84% -> 86.79%     
client [41] (testset)   loss: 0.6083 -> 0.6169  accuracy: 80.30% -> 78.89%     
client [7]  (testset)   loss: 0.3887 -> 0.3790  accuracy: 86.71% -> 87.25%     
client [37] (testset)   loss: 0.4168 -> 0.4193  accuracy: 87.15% -> 87.45%     
client [45] (testset)   loss: 0.5315 -> 0.5343  accuracy: 85.34% -> 84.76%     
client [47] (testset)   loss: 0.5374 -> 0.5327  accuracy: 81.55% -> 82.10%     
---------------------------- TRAINING EPOCH: 140 ----------------------------  
client [16] (testset)   loss: 0.3775 -> 0.6523  accuracy: 88.88% -> 86.56%     
client [11] (testset)   loss: 0.3148 -> 0.3089  accuracy: 91.84% -> 91.95%     
client [37] (testset)   loss: 0.4098 -> 0.4061  accuracy: 87.05% -> 87.65%     
client [41] (testset)   loss: 0.6169 -> 0.6368  accuracy: 78.89% -> 79.97%     
client [95] (testset)   loss: 0.3845 -> 0.3129  accuracy: 88.41% -> 91.35%     
client [53] (testset)   loss: 0.4420 -> 0.4298  accuracy: 85.64% -> 86.64%     
client [22] (testset)   loss: 0.6302 -> 0.6365  accuracy: 81.39% -> 80.28%     
client [25] (testset)   loss: 0.2237 -> 0.2190  accuracy: 94.30% -> 94.28%     
client [69] (testset)   loss: 0.3313 -> 0.3375  accuracy: 91.63% -> 91.30%     
client [46] (testset)   loss: 0.3683 -> 0.3563  accuracy: 89.08% -> 89.34%     
---------------------------- TRAINING EPOCH: 150 ----------------------------  
client [47] (testset)   loss: 0.5926 -> 0.5301  accuracy: 82.64% -> 82.05%     
client [69] (testset)   loss: 0.3317 -> 0.3347  accuracy: 91.41% -> 91.27%     
client [82] (testset)   loss: 0.4860 -> 0.4939  accuracy: 85.55% -> 85.61%     
client [45] (testset)   loss: 0.4937 -> 0.5043  accuracy: 86.16% -> 85.42%     
client [7]  (testset)   loss: 0.3790 -> 0.3856  accuracy: 87.25% -> 87.01%     
client [50] (testset)   loss: 0.3684 -> 0.3633  accuracy: 87.14% -> 87.24%     
client [35] (testset)   loss: 0.5684 -> 0.5778  accuracy: 83.65% -> 83.84%     
client [24] (testset)   loss: 0.3446 -> 0.3488  accuracy: 89.73% -> 90.66%     
client [15] (testset)   loss: 0.5640 -> 0.6507  accuracy: 82.29% -> 78.98%     
client [58] (testset)   loss: 0.3141 -> 0.3105  accuracy: 90.89% -> 90.69%     
---------------------------- TRAINING EPOCH: 160 ----------------------------  
client [48] (testset)   loss: 0.4472 -> 0.4751  accuracy: 85.33% -> 84.28%     
client [76] (testset)   loss: 0.6277 -> 0.5692  accuracy: 82.05% -> 81.72%     
client [67] (testset)   loss: 0.3752 -> 0.3784  accuracy: 87.59% -> 87.80%     
client [37] (testset)   loss: 0.4094 -> 0.4179  accuracy: 88.10% -> 87.45%     
client [58] (testset)   loss: 0.3183 -> 0.3245  accuracy: 90.97% -> 90.97%     
client [64] (testset)   loss: 0.5225 -> 0.5201  accuracy: 82.84% -> 83.06%     
client [77] (testset)   loss: 0.5339 -> 0.5191  accuracy: 81.68% -> 82.27%     
client [55] (testset)   loss: 0.4512 -> 0.4670  accuracy: 84.86% -> 83.38%     
client [12] (testset)   loss: 0.5292 -> 0.5143  accuracy: 83.15% -> 82.85%     
client [89] (testset)   loss: 0.5355 -> 0.5299  accuracy: 83.11% -> 82.65%     
---------------------------- TRAINING EPOCH: 170 ----------------------------  
client [84] (testset)   loss: 0.3442 -> 0.3538  accuracy: 90.24% -> 89.87%     
client [51] (testset)   loss: 0.3678 -> 0.3525  accuracy: 90.18% -> 90.27%     
client [8]  (testset)   loss: 0.3908 -> 0.3902  accuracy: 88.46% -> 88.84%     
client [18] (testset)   loss: 0.5118 -> 0.5432  accuracy: 84.23% -> 82.55%     
client [94] (testset)   loss: 0.4300 -> 0.4197  accuracy: 88.43% -> 88.74%     
client [81] (testset)   loss: 0.7807 -> 0.5247  accuracy: 76.66% -> 83.50%     
client [3]  (testset)   loss: 0.2860 -> 0.2822  accuracy: 92.01% -> 92.11%     
client [11] (testset)   loss: 0.3019 -> 0.3025  accuracy: 92.06% -> 91.84%     
client [95] (testset)   loss: 0.3182 -> 0.3257  accuracy: 91.54% -> 91.35%     
client [67] (testset)   loss: 0.3784 -> 0.3784  accuracy: 87.80% -> 87.80%     
---------------------------- TRAINING EPOCH: 180 ----------------------------  
client [21] (testset)   loss: 0.3353 -> 0.3353  accuracy: 90.70% -> 90.63%     
client [79] (testset)   loss: 0.2742 -> 0.2786  accuracy: 92.14% -> 92.21%     
client [58] (testset)   loss: 0.3176 -> 0.3258  accuracy: 90.81% -> 90.77%     
client [88] (testset)   loss: 0.3899 -> 0.3858  accuracy: 86.17% -> 86.70%     
client [46] (testset)   loss: 0.3457 -> 0.3441  accuracy: 89.71% -> 89.65%     
client [11] (testset)   loss: 0.3025 -> 0.3003  accuracy: 91.84% -> 92.17%     
client [55] (testset)   loss: 0.4876 -> 0.4923  accuracy: 85.12% -> 84.45%     
client [13] (testset)   loss: 0.5231 -> 0.5198  accuracy: 82.97% -> 83.27%     
client [31] (testset)   loss: 0.5031 -> 0.4028  accuracy: 83.64% -> 86.86%     
client [75] (testset)   loss: 0.4712 -> 0.4833  accuracy: 85.21% -> 85.56%     
---------------------------- TRAINING EPOCH: 190 ----------------------------  
client [19] (testset)   loss: 0.3881 -> 0.4016  accuracy: 88.92% -> 88.64%     
client [7]  (testset)   loss: 0.4101 -> 0.3934  accuracy: 86.42% -> 86.76%     
client [57] (testset)   loss: 0.5212 -> 0.5418  accuracy: 84.37% -> 84.27%     
client [13] (testset)   loss: 0.5283 -> 0.5223  accuracy: 83.15% -> 83.58%     
client [43] (testset)   loss: 0.3580 -> 0.3564  accuracy: 89.80% -> 89.71%     
client [91] (testset)   loss: 0.4890 -> 0.4780  accuracy: 84.83% -> 85.09%     
client [10] (testset)   loss: 0.4253 -> 0.4674  accuracy: 87.14% -> 85.01%     
client [64] (testset)   loss: 0.5191 -> 0.5678  accuracy: 84.13% -> 82.09%     
client [82] (testset)   loss: 0.5043 -> 0.5261  accuracy: 85.78% -> 85.84%     
client [22] (testset)   loss: 0.6361 -> 0.6558  accuracy: 80.62% -> 80.14%     
---------------------------- TRAINING EPOCH: 200 ----------------------------  
client [20] (testset)   loss: 0.4210 -> 0.4224  accuracy: 87.97% -> 88.21%     
client [23] (testset)   loss: 0.5136 -> 0.5132  accuracy: 83.61% -> 83.61%     
client [88] (testset)   loss: 0.3858 -> 0.4188  accuracy: 86.70% -> 84.94%     
client [98] (testset)   loss: 0.3374 -> 0.3407  accuracy: 90.29% -> 90.17%     
client [79] (testset)   loss: 0.2791 -> 0.2735  accuracy: 91.99% -> 92.07%     
client [21] (testset)   loss: 0.3448 -> 0.4838  accuracy: 90.55% -> 88.81%     
client [92] (testset)   loss: 0.4018 -> 0.4111  accuracy: 88.81% -> 88.89%     
client [56] (testset)   loss: 0.4985 -> 0.5681  accuracy: 85.22% -> 80.86%     
client [5]  (testset)   loss: 0.4642 -> 0.4615  accuracy: 86.50% -> 86.79%     
client [52] (testset)   loss: 0.5194 -> 0.5254  accuracy: 84.42% -> 84.84%     
---------------------------- TRAINING EPOCH: 210 ----------------------------  
client [67] (testset)   loss: 0.3850 -> 0.3932  accuracy: 88.16% -> 87.90%     
client [54] (testset)   loss: 0.3845 -> 0.3822  accuracy: 88.68% -> 88.85%     
client [14] (testset)   loss: 0.3846 -> 0.3946  accuracy: 90.60% -> 90.36%     
client [99] (testset)   loss: 0.3541 -> 0.3433  accuracy: 89.79% -> 89.96%     
client [36] (testset)   loss: 0.5003 -> 0.4737  accuracy: 84.84% -> 86.43%     
client [30] (testset)   loss: 0.3981 -> 0.4003  accuracy: 88.01% -> 87.87%     
client [38] (testset)   loss: 0.3242 -> 0.3262  accuracy: 90.83% -> 90.57%     
client [15] (testset)   loss: 0.5820 -> 0.5767  accuracy: 81.93% -> 81.64%     
client [6]  (testset)   loss: 0.5145 -> 0.5255  accuracy: 84.80% -> 84.66%     
client [53] (testset)   loss: 0.4525 -> 0.4571  accuracy: 85.93% -> 86.41%     
---------------------------- TRAINING EPOCH: 220 ----------------------------  
client [99] (testset)   loss: 0.3596 -> 0.3623  accuracy: 89.74% -> 89.57%     
client [6]  (testset)   loss: 0.5255 -> 0.5271  accuracy: 84.66% -> 84.89%     
client [83] (testset)   loss: 0.3710 -> 0.3789  accuracy: 89.57% -> 89.10%     
client [42] (testset)   loss: 0.3287 -> 0.3320  accuracy: 90.58% -> 90.36%     
client [34] (testset)   loss: 0.4535 -> 0.4930  accuracy: 87.29% -> 86.49%     
client [15] (testset)   loss: 0.5767 -> 0.5750  accuracy: 81.64% -> 81.35%     
client [47] (testset)   loss: 0.6084 -> 0.6110  accuracy: 82.35% -> 81.89%     
client [55] (testset)   loss: 0.5043 -> 0.4932  accuracy: 83.89% -> 84.76%     
client [51] (testset)   loss: 0.3504 -> 0.3550  accuracy: 90.23% -> 90.23%     
client [95] (testset)   loss: 0.3302 -> 0.3327  accuracy: 91.39% -> 91.70%     
---------------------------- TRAINING EPOCH: 230 ----------------------------  
client [71] (testset)   loss: 0.6263 -> 0.6291  accuracy: 80.51% -> 81.58%     
client [15] (testset)   loss: 0.5750 -> 0.5781  accuracy: 81.35% -> 82.58%     
client [33] (testset)   loss: 0.5678 -> 0.5321  accuracy: 82.98% -> 84.65%     
client [99] (testset)   loss: 0.3528 -> 0.3571  accuracy: 89.79% -> 89.79%     
client [90] (testset)   loss: 0.5190 -> 0.5674  accuracy: 81.82% -> 83.33%     
client [57] (testset)   loss: 0.5460 -> 0.5747  accuracy: 83.90% -> 81.99%     
client [27] (testset)   loss: 0.3147 -> 0.3148  accuracy: 91.64% -> 91.97%     
client [78] (testset)   loss: 0.3729 -> 0.3796  accuracy: 89.58% -> 89.78%     
client [36] (testset)   loss: 0.4843 -> 0.4912  accuracy: 86.48% -> 85.89%     
client [88] (testset)   loss: 0.3906 -> 0.4017  accuracy: 86.17% -> 85.89%     
---------------------------- TRAINING EPOCH: 240 ----------------------------  
client [70] (testset)   loss: 0.6710 -> 0.6350  accuracy: 80.02% -> 80.62%     
client [35] (testset)   loss: 0.5889 -> 0.6306  accuracy: 82.87% -> 83.06%     
client [16] (testset)   loss: 0.3755 -> 0.3745  accuracy: 88.97% -> 88.93%     
client [80] (testset)   loss: 0.5059 -> 0.6516  accuracy: 84.61% -> 78.90%     
client [38] (testset)   loss: 0.3356 -> 0.3288  accuracy: 90.60% -> 90.73%     
client [78] (testset)   loss: 0.3855 -> 0.3885  accuracy: 89.43% -> 89.01%     
client [68] (testset)   loss: 0.3475 -> 0.3512  accuracy: 88.90% -> 88.87%     
client [11] (testset)   loss: 0.3010 -> 0.3044  accuracy: 92.00% -> 92.00%     
client [64] (testset)   loss: 0.5428 -> 0.5480  accuracy: 83.49% -> 83.54%     
client [82] (testset)   loss: 0.5509 -> 0.5527  accuracy: 85.33% -> 85.21%     
---------------------------- TRAINING EPOCH: 250 ----------------------------  
client [30] (testset)   loss: 0.4195 -> 0.4198  accuracy: 88.28% -> 88.51%     
client [27] (testset)   loss: 0.3148 -> 0.3146  accuracy: 91.97% -> 91.75%     
client [74] (testset)   loss: 0.3655 -> 0.3618  accuracy: 89.95% -> 89.50%     
client [45] (testset)   loss: 0.5093 -> 0.5139  accuracy: 85.17% -> 86.00%     
client [6]  (testset)   loss: 0.5408 -> 0.5421  accuracy: 84.07% -> 84.21%     
client [36] (testset)   loss: 0.4870 -> 0.4978  accuracy: 86.33% -> 86.58%     
client [63] (testset)   loss: 0.3951 -> 0.4034  accuracy: 88.13% -> 88.53%     
client [76] (testset)   loss: 0.6138 -> 0.6429  accuracy: 82.60% -> 81.66%     
client [83] (testset)   loss: 0.3955 -> 0.3770  accuracy: 88.60% -> 89.46%     
client [86] (testset)   loss: 0.3446 -> 0.3427  accuracy: 90.35% -> 89.86%     
---------------------------- TRAINING EPOCH: 260 ----------------------------  
client [83] (testset)   loss: 0.3770 -> 0.3839  accuracy: 89.46% -> 89.42%     
client [99] (testset)   loss: 0.3733 -> 0.3606  accuracy: 89.35% -> 89.74%     
client [74] (testset)   loss: 0.3606 -> 0.3683  accuracy: 90.31% -> 90.22%     
client [73] (testset)   loss: 0.6265 -> 0.6297  accuracy: 80.75% -> 81.37%     
client [29] (testset)   loss: 0.7316 -> 0.7457  accuracy: 77.60% -> 78.06%     
client [92] (testset)   loss: 0.4038 -> 0.4015  accuracy: 88.47% -> 89.39%     
client [6]  (testset)   loss: 0.5503 -> 0.5459  accuracy: 83.71% -> 83.98%     
client [61] (testset)   loss: 0.3249 -> 0.3242  accuracy: 91.23% -> 90.99%     
client [21] (testset)   loss: 0.3369 -> 0.3392  accuracy: 90.74% -> 90.63%     
client [67] (testset)   loss: 0.4109 -> 0.4090  accuracy: 88.16% -> 88.06%     
---------------------------- TRAINING EPOCH: 270 ----------------------------  
client [83] (testset)   loss: 0.3839 -> 0.3840  accuracy: 89.42% -> 89.21%     
client [32] (testset)   loss: 0.3842 -> 0.3931  accuracy: 89.12% -> 88.76%     
client [95] (testset)   loss: 0.3278 -> 0.3282  accuracy: 91.43% -> 91.54%     
client [61] (testset)   loss: 0.3244 -> 0.3249  accuracy: 90.61% -> 91.13%     
client [27] (testset)   loss: 0.3146 -> 0.3184  accuracy: 91.75% -> 91.57%     
client [25] (testset)   loss: 0.2249 -> 0.2311  accuracy: 94.35% -> 94.13%     
client [68] (testset)   loss: 0.3636 -> 0.3727  accuracy: 89.03% -> 88.52%     
client [34] (testset)   loss: 0.4777 -> 0.4649  accuracy: 86.32% -> 86.49%     
client [71] (testset)   loss: 0.6908 -> 0.6671  accuracy: 81.44% -> 80.55%     
client [89] (testset)   loss: 0.5578 -> 0.5627  accuracy: 82.91% -> 82.91%     
---------------------------- TRAINING EPOCH: 280 ----------------------------  
client [78] (testset)   loss: 0.3956 -> 0.4100  accuracy: 89.27% -> 88.30%     
client [81] (testset)   loss: 0.6203 -> 0.6210  accuracy: 83.25% -> 82.71%     
client [51] (testset)   loss: 0.3851 -> 0.3666  accuracy: 89.36% -> 90.32%     
client [54] (testset)   loss: 0.3849 -> 0.3896  accuracy: 88.91% -> 88.91%     
client [65] (testset)   loss: 0.5482 -> 0.5542  accuracy: 83.13% -> 84.01%     
client [41] (testset)   loss: 0.6460 -> 0.6463  accuracy: 80.13% -> 79.80%     
client [11] (testset)   loss: 0.3024 -> 0.3056  accuracy: 92.50% -> 92.17%     
client [85] (testset)   loss: 0.3130 -> 0.3093  accuracy: 91.32% -> 91.29%     
client [12] (testset)   loss: 0.5444 -> 0.5452  accuracy: 82.61% -> 82.32%     
client [23] (testset)   loss: 0.5439 -> 0.5831  accuracy: 82.51% -> 82.65%     
---------------------------- TRAINING EPOCH: 290 ----------------------------  
client [16] (testset)   loss: 0.3700 -> 0.3719  accuracy: 89.68% -> 89.64%     
client [65] (testset)   loss: 0.5642 -> 0.5909  accuracy: 83.81% -> 83.47%     
client [53] (testset)   loss: 0.4660 -> 0.4716  accuracy: 86.29% -> 86.41%     
client [58] (testset)   loss: 0.3432 -> 0.3403  accuracy: 90.93% -> 91.05%     
client [72] (testset)   loss: 0.4742 -> 0.4851  accuracy: 84.86% -> 84.86%     
client [7]  (testset)   loss: 0.4361 -> 0.4374  accuracy: 86.47% -> 86.22%     
client [71] (testset)   loss: 0.6671 -> 0.6933  accuracy: 80.55% -> 81.93%     
client [59] (testset)   loss: 0.6103 -> 0.6028  accuracy: 79.96% -> 81.52%     
client [86] (testset)   loss: 0.3990 -> 0.3550  accuracy: 86.54% -> 90.20%     
client [39] (testset)   loss: 0.5781 -> 0.5738  accuracy: 82.56% -> 82.91%     
---------------------------- TRAINING EPOCH: 300 ----------------------------  
client [99] (testset)   loss: 0.3593 -> 0.3625  accuracy: 89.74% -> 90.02%     
client [7]  (testset)   loss: 0.4436 -> 0.4633  accuracy: 86.32% -> 86.37%     
client [17] (testset)   loss: 0.3365 -> 0.3371  accuracy: 89.81% -> 90.29%     
client [64] (testset)   loss: 0.5716 -> 0.5705  accuracy: 84.13% -> 84.13%     
client [37] (testset)   loss: 0.4319 -> 0.4296  accuracy: 87.55% -> 87.70%     
client [29] (testset)   loss: 0.8083 -> 0.7539  accuracy: 78.87% -> 78.06%     
client [93] (testset)   loss: 0.4280 -> 0.4332  accuracy: 90.47% -> 90.72%     
client [73] (testset)   loss: 0.6511 -> 0.6554  accuracy: 80.92% -> 81.20%     
client [40] (testset)   loss: 0.4895 -> 0.4929  accuracy: 86.06% -> 86.63%     
client [76] (testset)   loss: 0.6264 -> 0.6264  accuracy: 81.83% -> 81.72%     
---------------------------- TRAINING EPOCH: 310 ----------------------------  
client [31] (testset)   loss: 0.4381 -> 0.4381  accuracy: 86.56% -> 86.76%     
client [89] (testset)   loss: 0.5561 -> 0.5638  accuracy: 82.91% -> 82.78%     
client [77] (testset)   loss: 0.6193 -> 0.6233  accuracy: 81.95% -> 81.68%     
client [90] (testset)   loss: 0.5908 -> 0.6468  accuracy: 81.87% -> 81.28%     
client [26] (testset)   loss: 0.4423 -> 0.3979  accuracy: 87.18% -> 87.41%     
client [50] (testset)   loss: 0.3577 -> 0.3752  accuracy: 87.76% -> 87.09%     
client [30] (testset)   loss: 0.4337 -> 0.4388  accuracy: 88.24% -> 88.10%     
client [70] (testset)   loss: 0.6522 -> 0.6445  accuracy: 80.99% -> 80.92%     
client [41] (testset)   loss: 0.6817 -> 0.6737  accuracy: 80.05% -> 79.38%     
client [99] (testset)   loss: 0.3625 -> 0.3636  accuracy: 90.02% -> 89.91%     
---------------------------- TRAINING EPOCH: 320 ----------------------------  
client [68] (testset)   loss: 0.3919 -> 0.3812  accuracy: 89.00% -> 89.13%     
client [70] (testset)   loss: 0.6624 -> 0.6606  accuracy: 80.39% -> 80.39%     
client [52] (testset)   loss: 0.5449 -> 0.5533  accuracy: 84.37% -> 84.88%     
client [1]  (testset)   loss: 0.4212 -> 0.4228  accuracy: 88.43% -> 88.75%     
client [2]  (testset)   loss: 0.3624 -> 0.3589  accuracy: 89.76% -> 89.28%     
client [67] (testset)   loss: 0.4304 -> 0.4280  accuracy: 87.69% -> 88.32%     
client [92] (testset)   loss: 0.4206 -> 0.4127  accuracy: 89.22% -> 89.14%     
client [35] (testset)   loss: 0.6039 -> 0.6169  accuracy: 82.93% -> 83.00%     
client [36] (testset)   loss: 0.5173 -> 0.5348  accuracy: 85.99% -> 86.38%     
client [64] (testset)   loss: 0.5817 -> 0.5770  accuracy: 83.86% -> 83.86%     
---------------------------- TRAINING EPOCH: 330 ----------------------------  
client [44] (testset)   loss: 0.6770 -> 0.6949  accuracy: 78.70% -> 78.90%     
client [6]  (testset)   loss: 0.5800 -> 0.5765  accuracy: 83.94% -> 83.98%     
client [12] (testset)   loss: 0.5470 -> 0.5617  accuracy: 82.85% -> 82.73%     
client [55] (testset)   loss: 0.5422 -> 0.5439  accuracy: 83.84% -> 84.81%     
client [29] (testset)   loss: 0.7669 -> 0.7766  accuracy: 78.29% -> 78.64%     
client [9]  (testset)   loss: 0.8109 -> 0.8029  accuracy: 76.15% -> 76.40%     
client [43] (testset)   loss: 0.3840 -> 0.3894  accuracy: 89.11% -> 88.80%     
client [77] (testset)   loss: 0.6233 -> 0.6228  accuracy: 81.68% -> 82.59%     
client [98] (testset)   loss: 0.3632 -> 0.3737  accuracy: 90.49% -> 89.77%     
client [78] (testset)   loss: 0.4099 -> 0.4075  accuracy: 88.91% -> 88.76%     
---------------------------- TRAINING EPOCH: 340 ----------------------------  
client [92] (testset)   loss: 0.4108 -> 0.4109  accuracy: 89.30% -> 89.05%     
client [80] (testset)   loss: 0.6027 -> 0.5669  accuracy: 84.75% -> 84.64%     
client [63] (testset)   loss: 0.4089 -> 0.4081  accuracy: 88.18% -> 88.48%     
client [76] (testset)   loss: 0.6830 -> 0.6475  accuracy: 82.21% -> 82.27%     
client [78] (testset)   loss: 0.4075 -> 0.4199  accuracy: 88.76% -> 88.35%     
client [25] (testset)   loss: 0.2295 -> 0.2240  accuracy: 94.47% -> 94.33%     
client [58] (testset)   loss: 0.3560 -> 0.3392  accuracy: 90.81% -> 90.81%     
client [13] (testset)   loss: 0.5538 -> 0.5742  accuracy: 83.46% -> 83.46%     
client [17] (testset)   loss: 0.3412 -> 0.3407  accuracy: 90.44% -> 90.52%     
client [38] (testset)   loss: 0.3399 -> 0.3457  accuracy: 90.76% -> 90.89%     
---------------------------- TRAINING EPOCH: 350 ----------------------------  
client [72] (testset)   loss: 0.5513 -> 0.5321  accuracy: 83.67% -> 84.40%     
client [82] (testset)   loss: 0.5790 -> 0.5875  accuracy: 84.65% -> 84.09%     
client [86] (testset)   loss: 0.3665 -> 0.3704  accuracy: 90.00% -> 90.10%     
client [51] (testset)   loss: 0.3732 -> 0.3815  accuracy: 90.32% -> 90.37%     
client [96] (testset)   loss: 0.4908 -> 0.4810  accuracy: 88.07% -> 87.59%     
client [42] (testset)   loss: 0.3407 -> 0.3465  accuracy: 91.07% -> 90.49%     
client [55] (testset)   loss: 0.5594 -> 0.5595  accuracy: 84.91% -> 84.51%     
client [13] (testset)   loss: 0.5587 -> 0.5588  accuracy: 83.27% -> 83.15%     
client [1]  (testset)   loss: 0.4255 -> 0.4266  accuracy: 88.49% -> 88.75%     
client [12] (testset)   loss: 0.5617 -> 0.5467  accuracy: 82.73% -> 83.44%     
---------------------------- TRAINING EPOCH: 360 ----------------------------  
client [68] (testset)   loss: 0.3909 -> 0.3914  accuracy: 88.90% -> 88.90%     
client [23] (testset)   loss: 0.5814 -> 0.6014  accuracy: 82.46% -> 83.10%     
client [46] (testset)   loss: 0.3826 -> 0.3972  accuracy: 89.55% -> 89.39%     
client [41] (testset)   loss: 0.6853 -> 0.7138  accuracy: 79.97% -> 78.55%     
client [25] (testset)   loss: 0.2378 -> 0.2371  accuracy: 94.13% -> 94.30%     
client [58] (testset)   loss: 0.3443 -> 0.3450  accuracy: 90.85% -> 90.93%     
client [14] (testset)   loss: 0.3981 -> 0.3985  accuracy: 90.26% -> 89.74%     
client [33] (testset)   loss: 0.5402 -> 0.5546  accuracy: 84.65% -> 85.03%     
client [85] (testset)   loss: 0.3167 -> 0.4069  accuracy: 91.80% -> 90.88%     
client [62] (testset)   loss: 0.5582 -> 0.5522  accuracy: 85.42% -> 85.03%     
---------------------------- TRAINING EPOCH: 370 ----------------------------  
client [98] (testset)   loss: 0.3716 -> 0.3769  accuracy: 89.89% -> 89.57%     
client [63] (testset)   loss: 0.4177 -> 0.4129  accuracy: 88.18% -> 88.18%     
client [70] (testset)   loss: 0.6620 -> 0.6589  accuracy: 80.77% -> 81.29%     
client [65] (testset)   loss: 0.5782 -> 0.5870  accuracy: 83.87% -> 84.21%     
client [14] (testset)   loss: 0.4119 -> 0.4183  accuracy: 89.79% -> 89.64%     
client [73] (testset)   loss: 0.6727 -> 0.6890  accuracy: 80.86% -> 80.24%     
client [34] (testset)   loss: 0.4866 -> 0.4866  accuracy: 87.00% -> 86.55%     
client [99] (testset)   loss: 0.3708 -> 0.3694  accuracy: 89.91% -> 90.13%     
client [69] (testset)   loss: 0.3562 -> 0.3668  accuracy: 91.70% -> 91.52%     
client [46] (testset)   loss: 0.3972 -> 0.3879  accuracy: 89.39% -> 89.23%     
---------------------------- TRAINING EPOCH: 380 ----------------------------  
client [99] (testset)   loss: 0.3670 -> 0.3740  accuracy: 89.85% -> 89.74%     
client [93] (testset)   loss: 0.4682 -> 0.4435  accuracy: 89.29% -> 90.72%     
client [11] (testset)   loss: 0.3147 -> 0.3095  accuracy: 91.84% -> 92.22%     
client [58] (testset)   loss: 0.3451 -> 0.3611  accuracy: 90.69% -> 90.89%     
client [81] (testset)   loss: 0.6709 -> 0.6979  accuracy: 82.62% -> 83.35%     
client [85] (testset)   loss: 0.4069 -> 0.3174  accuracy: 90.88% -> 91.69%     
client [89] (testset)   loss: 0.5849 -> 0.5766  accuracy: 82.72% -> 82.98%     
client [45] (testset)   loss: 0.5209 -> 0.5171  accuracy: 85.83% -> 86.50%     
client [8]  (testset)   loss: 0.3920 -> 0.3939  accuracy: 89.44% -> 89.36%     
client [68] (testset)   loss: 0.3969 -> 0.3963  accuracy: 88.84% -> 89.03%     
---------------------------- TRAINING EPOCH: 390 ----------------------------  
client [67] (testset)   loss: 0.4355 -> 0.4363  accuracy: 87.59% -> 87.59%     
client [72] (testset)   loss: 0.5435 -> 0.5499  accuracy: 84.96% -> 84.54%     
client [1]  (testset)   loss: 0.4330 -> 0.4333  accuracy: 88.43% -> 88.75%     
client [78] (testset)   loss: 0.4365 -> 0.4438  accuracy: 88.45% -> 89.12%     
client [83] (testset)   loss: 0.4222 -> 0.4195  accuracy: 89.07% -> 89.21%     
client [21] (testset)   loss: 0.3663 -> 0.3766  accuracy: 90.55% -> 90.21%     
client [56] (testset)   loss: 0.5528 -> 0.5600  accuracy: 84.22% -> 85.45%     
client [44] (testset)   loss: 0.7308 -> 0.7497  accuracy: 77.88% -> 78.42%     
client [92] (testset)   loss: 0.4048 -> 0.4124  accuracy: 88.72% -> 88.89%     
client [27] (testset)   loss: 0.3267 -> 0.3249  accuracy: 91.79% -> 91.79%     
---------------------------- TRAINING EPOCH: 400 ----------------------------  
client [10] (testset)   loss: 0.4467 -> 0.4451  accuracy: 88.00% -> 87.60%     
client [39] (testset)   loss: 0.6077 -> 0.6165  accuracy: 83.48% -> 83.00%     
client [65] (testset)   loss: 0.6010 -> 0.6284  accuracy: 83.27% -> 83.47%     
client [26] (testset)   loss: 0.5685 -> 0.4376  accuracy: 85.86% -> 87.14%     
client [19] (testset)   loss: 0.4369 -> 0.4455  accuracy: 88.92% -> 88.76%     
client [68] (testset)   loss: 0.4050 -> 0.4059  accuracy: 88.74% -> 89.06%     
client [41] (testset)   loss: 0.7060 -> 0.7425  accuracy: 79.30% -> 76.31%     
client [50] (testset)   loss: 0.3789 -> 0.3823  accuracy: 87.34% -> 87.66%     
client [75] (testset)   loss: 0.5389 -> 0.5410  accuracy: 84.92% -> 85.03%     
client [81] (testset)   loss: 0.6927 -> 0.7029  accuracy: 83.01% -> 83.15%     
Training... ---------------------------------------- 100% 5:01:49
FedProto's average time taken by each global epoch: 0 min 45.17 sec.           
FedProto's total running time: 5 h 1 m 53 s.                                   
==================== FedProto Experiment Results: ====================         
Display format: (before local fine-tuning) -> (after local fine-tuning)        
 So if finetune_epoch = 0, x.xx% -> 0.00% is normal.                           
 Centralized testing ONLY happens after model aggregation, so the stats between
'->' are the same.                                                             
{                                                                              
    "100": {                                                                   
        "all_clients": {                                                       
            "test": {                                                          
                "loss": "0.4312 -> 0.0000",                                    
                "accuracy": "86.85% -> 0.00%"                                  
            }                                                                  
        }                                                                      
    },                                                                         
    "200": {                                                                   
        "all_clients": {                                                       
            "test": {                                                          
                "loss": "0.4317 -> 0.0000",                                    
                "accuracy": "87.14% -> 0.00%"                                  
            }                                                                  
        }                                                                      
    },                                                                         
    "300": {                                                                   
        "all_clients": {                                                       
            "test": {                                                          
                "loss": "0.4568 -> 0.0000",                                    
                "accuracy": "87.12% -> 0.00%"                                  
            }                                                                  
        }                                                                      
    },                                                                         
    "400": {                                                                   
        "all_clients": {                                                       
            "test": {                                                          
                "loss": "0.4755 -> 0.0000",                                    
                "accuracy": "87.22% -> 0.00%"                                  
            }                                                                  
        }                                                                      
    }                                                                          
}                                                                              
==================== FedProto Max Accuracy ====================                
all_clients:                                                                   
(test) before fine-tuning: 87.22% at epoch 400                                 
(test) after fine-tuning: 0.00% at epoch 100                                   
[0m