==================== FedPer ====================                               
Experiment Arguments:                                                          
{
│   'method': 'fedper',
│   'dataset': {
│   │   'name': 'mnist',
│   │   'client_num': 100,
│   │   'test_ratio': 0.25,
│   │   'val_ratio': 0.0,
│   │   'seed': 42,
│   │   'split': 'sample',
│   │   'IID_ratio': 0.0,
│   │   'monitor_window_name_suffix': 'mnist-100clients-0%IID-Dir(0.5)-seed42',
│   │   'alpha': 0.5,
│   │   'min_samples_per_client': 10
│   },
│   'model': {
│   │   'name': 'avgcnn',
│   │   'use_torchvision_pretrained_weights': True,
│   │   'external_model_weights_path': None
│   },
│   'optimizer': {
│   │   'lr': 0.01,
│   │   'dampening': 0,
│   │   'weight_decay': 0,
│   │   'momentum': 0,
│   │   'nesterov': False,
│   │   'name': 'sgd'
│   },
│   'mode': 'serial',
│   'parallel': {
│   │   'ray_cluster_addr': None,
│   │   'num_cpus': None,
│   │   'num_gpus': None,
│   │   'num_workers': 2
│   },
│   'common': {
│   │   'seed': 42,
│   │   'join_ratio': 0.1,
│   │   'global_epoch': 400,
│   │   'local_epoch': 5,
│   │   'batch_size': 32,
│   │   'reset_optimizer_on_global_epoch': True,
│   │   'straggler_ratio': 0,
│   │   'straggler_min_local_epoch': 0,
│   │   'buffers': 'global',
│   │   'client_side_evaluation': True,
│   │   'test': {
│   │   │   'client': {
│   │   │   │   'interval': 100,
│   │   │   │   'finetune_epoch': 0,
│   │   │   │   'train': False,
│   │   │   │   'val': False,
│   │   │   │   'test': True
│   │   │   },
│   │   │   'server': {
│   │   │   │   'interval': -1,
│   │   │   │   'train': False,
│   │   │   │   'val': False,
│   │   │   │   'test': False,
│   │   │   │   'model_in_train_mode': False
│   │   │   }
│   │   },
│   │   'verbose_gap': 10,
│   │   'monitor': None,
│   │   'use_cuda': True,
│   │   'save_log': True,
│   │   'save_model': False,
│   │   'save_learning_curve_plot': False,
│   │   'save_metrics': True,
│   │   'delete_useless_run': True
│   }
}
---------------------------- TRAINING EPOCH: 10 ----------------------------   
client [77] (testset)   loss: 0.3748 -> 0.3272  accuracy: 88.24% -> 90.59%     
client [81] (testset)   loss: 0.2374 -> 0.2442  accuracy: 92.53% -> 91.29%     
client [21] (testset)   loss: 0.1742 -> 0.1239  accuracy: 94.74% -> 96.17%     
client [68] (testset)   loss: 0.1057 -> 0.0735  accuracy: 96.88% -> 98.21%     
client [93] (testset)   loss: 0.1321 -> 0.1252  accuracy: 95.74% -> 95.04%     
client [31] (testset)   loss: 0.1910 -> 0.1258  accuracy: 94.12% -> 96.26%     
client [20] (testset)   loss: 0.2201 -> 0.1828  accuracy: 94.37% -> 95.07%     
client [59] (testset)   loss: 0.1255 -> 0.0907  accuracy: 96.88% -> 97.92%     
client [48] (testset)   loss: 0.0850 -> 0.1637  accuracy: 97.16% -> 95.74%     
client [34] (testset)   loss: 0.1379 -> 0.1169  accuracy: 95.88% -> 96.25%     
---------------------------- TRAINING EPOCH: 20 ----------------------------   
client [69] (testset)   loss: 0.1338 -> 0.2324  accuracy: 96.43% -> 92.14%     
client [99] (testset)   loss: 0.1762 -> 0.1509  accuracy: 92.31% -> 94.08%     
client [67] (testset)   loss: 0.1001 -> 0.0872  accuracy: 96.57% -> 97.14%     
client [0]  (testset)   loss: 0.1359 -> 0.1329  accuracy: 96.82% -> 96.50%     
client [76] (testset)   loss: 0.0903 -> 0.0790  accuracy: 96.17% -> 96.17%     
client [41] (testset)   loss: 0.1284 -> 0.1174  accuracy: 95.52% -> 96.41%     
client [62] (testset)   loss: 0.1236 -> 0.0303  accuracy: 95.76% -> 98.79%     
client [2]  (testset)   loss: 0.1181 -> 0.0670  accuracy: 95.78% -> 97.40%     
client [14] (testset)   loss: 0.1205 -> 0.1251  accuracy: 96.59% -> 94.89%     
client [46] (testset)   loss: 0.1063 -> 0.1226  accuracy: 95.41% -> 94.50%     
---------------------------- TRAINING EPOCH: 30 ----------------------------   
client [24] (testset)   loss: 0.0863 -> 0.0986  accuracy: 96.32% -> 96.84%     
client [68] (testset)   loss: 0.0550 -> 0.0471  accuracy: 98.66% -> 98.66%     
client [57] (testset)   loss: 0.1369 -> 0.1425  accuracy: 96.81% -> 97.87%     
client [17] (testset)   loss: 0.1161 -> 0.0966  accuracy: 95.16% -> 95.16%     
client [54] (testset)   loss: 0.0379 -> 0.0520  accuracy: 99.12% -> 98.67%     
client [23] (testset)   loss: 0.0883 -> 0.0259  accuracy: 97.39% -> 100.00%    
client [35] (testset)   loss: 0.0990 -> 0.0938  accuracy: 95.80% -> 95.80%     
client [59] (testset)   loss: 0.0314 -> 0.0535  accuracy: 98.96% -> 97.92%     
client [31] (testset)   loss: 0.0513 -> 0.0541  accuracy: 98.93% -> 97.86%     
client [9]  (testset)   loss: 0.0518 -> 0.0673  accuracy: 98.18% -> 98.18%     
---------------------------- TRAINING EPOCH: 40 ----------------------------   
client [64] (testset)   loss: 0.1278 -> 0.1702  accuracy: 94.44% -> 94.44%     
client [33] (testset)   loss: 0.0688 -> 0.0684  accuracy: 97.79% -> 97.24%     
client [16] (testset)   loss: 0.1740 -> 0.1992  accuracy: 93.28% -> 92.44%     
client [44] (testset)   loss: 0.0823 -> 1.7054  accuracy: 97.45% -> 75.92%     
client [8]  (testset)   loss: 0.0287 -> 0.0311  accuracy: 100.00% -> 98.53%    
client [31] (testset)   loss: 0.0458 -> 0.0478  accuracy: 98.40% -> 97.86%     
client [47] (testset)   loss: 0.0599 -> 0.0731  accuracy: 98.11% -> 97.54%     
client [36] (testset)   loss: 0.0569 -> 0.0622  accuracy: 98.46% -> 98.46%     
client [20] (testset)   loss: 0.0595 -> 0.0760  accuracy: 97.18% -> 97.18%     
client [56] (testset)   loss: 0.0902 -> 0.0846  accuracy: 97.31% -> 97.69%     
---------------------------- TRAINING EPOCH: 50 ----------------------------   
client [4]  (testset)   loss: 0.2324 -> 0.2235  accuracy: 96.84% -> 96.84%     
client [60] (testset)   loss: 0.0431 -> 0.0401  accuracy: 98.69% -> 98.69%     
client [28] (testset)   loss: 0.0326 -> 0.0487  accuracy: 98.53% -> 99.02%     
client [25] (testset)   loss: 0.1225 -> 0.1124  accuracy: 97.18% -> 97.18%     
client [58] (testset)   loss: 0.1088 -> 0.1216  accuracy: 97.45% -> 96.94%     
client [44] (testset)   loss: 0.1713 -> 0.0634  accuracy: 95.47% -> 97.73%     
client [39] (testset)   loss: 0.1221 -> 0.1613  accuracy: 96.93% -> 96.32%     
client [29] (testset)   loss: 0.0700 -> 0.0393  accuracy: 98.26% -> 98.84%     
client [3]  (testset)   loss: 0.1934 -> 0.1869  accuracy: 95.96% -> 93.94%     
client [84] (testset)   loss: 0.0344 -> 0.0348  accuracy: 99.10% -> 99.10%     
---------------------------- TRAINING EPOCH: 60 ----------------------------   
client [21] (testset)   loss: 0.0270 -> 0.0377  accuracy: 98.56% -> 98.09%     
client [84] (testset)   loss: 0.0268 -> 0.0287  accuracy: 99.10% -> 99.10%     
client [10] (testset)   loss: 0.0159 -> 0.0147  accuracy: 98.53% -> 99.51%     
client [36] (testset)   loss: 0.0408 -> 0.1308  accuracy: 98.46% -> 94.59%     
client [65] (testset)   loss: 0.0498 -> 0.0489  accuracy: 98.72% -> 98.30%     
client [81] (testset)   loss: 0.0869 -> 0.0966  accuracy: 97.10% -> 97.51%     
client [79] (testset)   loss: 0.1373 -> 0.1389  accuracy: 95.24% -> 95.92%     
client [42] (testset)   loss: 0.1178 -> 0.1303  accuracy: 96.15% -> 95.67%     
client [11] (testset)   loss: 0.0394 -> 0.0575  accuracy: 98.21% -> 95.96%     
client [96] (testset)   loss: 0.0318 -> 0.0376  accuracy: 98.60% -> 98.60%     
---------------------------- TRAINING EPOCH: 70 ----------------------------   
client [8]  (testset)   loss: 0.0227 -> 0.0256  accuracy: 100.00% -> 98.53%    
client [53] (testset)   loss: 0.0886 -> 0.1039  accuracy: 97.56% -> 96.75%     
client [52] (testset)   loss: 0.1948 -> 0.1876  accuracy: 97.40% -> 97.40%     
client [42] (testset)   loss: 0.1186 -> 0.1319  accuracy: 96.63% -> 95.67%     
client [69] (testset)   loss: 0.0826 -> 0.0794  accuracy: 97.86% -> 97.86%     
client [59] (testset)   loss: 0.0325 -> 0.0341  accuracy: 97.92% -> 97.92%     
client [7]  (testset)   loss: 0.0190 -> 0.0292  accuracy: 99.11% -> 99.11%     
client [26] (testset)   loss: 0.0577 -> 0.0543  accuracy: 97.56% -> 97.56%     
client [49] (testset)   loss: 0.0780 -> 0.0802  accuracy: 97.79% -> 97.06%     
client [98] (testset)   loss: 0.1158 -> 0.0914  accuracy: 97.14% -> 97.14%     
---------------------------- TRAINING EPOCH: 80 ----------------------------   
client [98] (testset)   loss: 0.0911 -> 0.0846  accuracy: 97.14% -> 97.14%     
client [47] (testset)   loss: 0.0624 -> 0.0664  accuracy: 97.73% -> 97.92%     
client [21] (testset)   loss: 0.0249 -> 0.0340  accuracy: 99.04% -> 98.56%     
client [77] (testset)   loss: 0.1774 -> 0.1765  accuracy: 97.65% -> 96.47%     
client [95] (testset)   loss: 0.0902 -> 0.0836  accuracy: 95.77% -> 96.24%     
client [91] (testset)   loss: 0.0370 -> 0.0397  accuracy: 99.12% -> 99.12%     
client [14] (testset)   loss: 0.0900 -> 0.0728  accuracy: 96.02% -> 97.16%     
client [99] (testset)   loss: 0.1049 -> 0.1014  accuracy: 95.86% -> 95.86%     
client [20] (testset)   loss: 0.0567 -> 0.0504  accuracy: 97.89% -> 97.89%     
client [39] (testset)   loss: 0.1628 -> 0.1698  accuracy: 96.32% -> 96.93%     
---------------------------- TRAINING EPOCH: 90 ----------------------------   
client [52] (testset)   loss: 0.1986 -> 0.1898  accuracy: 97.40% -> 97.40%     
client [62] (testset)   loss: 0.0147 -> 0.0192  accuracy: 99.39% -> 99.39%     
client [71] (testset)   loss: 0.0476 -> 0.0493  accuracy: 97.44% -> 97.44%     
client [97] (testset)   loss: 0.0716 -> 0.0691  accuracy: 97.19% -> 97.19%     
client [30] (testset)   loss: 0.0312 -> 0.0334  accuracy: 99.35% -> 99.35%     
client [88] (testset)   loss: 0.0007 -> 0.0007  accuracy: 100.00% -> 100.00%   
client [60] (testset)   loss: 0.0323 -> 0.0307  accuracy: 98.69% -> 98.69%     
client [82] (testset)   loss: 0.0606 -> 0.0575  accuracy: 98.74% -> 98.74%     
client [91] (testset)   loss: 0.0435 -> 0.0420  accuracy: 99.12% -> 99.12%     
client [57] (testset)   loss: 0.1437 -> 0.1499  accuracy: 96.81% -> 96.81%     
---------------------------- TRAINING EPOCH: 100 ----------------------------  
client [31] (testset)   loss: 0.0260 -> 0.0298  accuracy: 99.47% -> 99.47%     
client [15] (testset)   loss: 0.0668 -> 0.0690  accuracy: 98.71% -> 98.06%     
client [71] (testset)   loss: 0.0502 -> 0.0459  accuracy: 97.44% -> 97.44%     
client [97] (testset)   loss: 0.0759 -> 0.0721  accuracy: 97.19% -> 97.19%     
client [53] (testset)   loss: 0.1080 -> 0.1211  accuracy: 96.75% -> 96.75%     
client [77] (testset)   loss: 0.1863 -> 0.1782  accuracy: 95.29% -> 96.47%     
client [76] (testset)   loss: 0.0440 -> 0.0422  accuracy: 97.81% -> 97.81%     
client [79] (testset)   loss: 0.1439 -> 0.1419  accuracy: 95.92% -> 96.60%     
client [28] (testset)   loss: 0.0293 -> 0.0296  accuracy: 99.02% -> 98.53%     
client [99] (testset)   loss: 0.0983 -> 0.1023  accuracy: 95.86% -> 95.86%     
---------------------------- TRAINING EPOCH: 110 ----------------------------  
client [97] (testset)   loss: 0.0762 -> 0.0733  accuracy: 97.19% -> 97.19%     
client [86] (testset)   loss: 0.0993 -> 0.1050  accuracy: 97.46% -> 96.95%     
client [34] (testset)   loss: 0.0816 -> 0.0808  accuracy: 97.75% -> 97.75%     
client [73] (testset)   loss: 0.0169 -> 0.0237  accuracy: 99.42% -> 98.84%     
client [5]  (testset)   loss: 0.1097 -> 0.1126  accuracy: 96.47% -> 95.88%     
client [96] (testset)   loss: 0.0324 -> 0.0323  accuracy: 98.60% -> 98.60%     
client [22] (testset)   loss: 0.0387 -> 0.0313  accuracy: 97.78% -> 98.52%     
client [60] (testset)   loss: 0.0308 -> 0.0319  accuracy: 98.69% -> 98.69%     
client [66] (testset)   loss: 0.0719 -> 0.0711  accuracy: 97.49% -> 97.07%     
client [83] (testset)   loss: 0.0891 -> 0.0881  accuracy: 99.16% -> 99.16%     
---------------------------- TRAINING EPOCH: 120 ----------------------------  
client [76] (testset)   loss: 0.0467 -> 0.0437  accuracy: 97.81% -> 97.81%     
client [65] (testset)   loss: 0.0510 -> 0.0491  accuracy: 98.30% -> 97.87%     
client [95] (testset)   loss: 0.0753 -> 0.0762  accuracy: 96.24% -> 97.18%     
client [17] (testset)   loss: 0.0655 -> 0.0692  accuracy: 97.58% -> 97.58%     
client [8]  (testset)   loss: 0.0158 -> 0.0165  accuracy: 100.00% -> 100.00%   
client [35] (testset)   loss: 0.0720 -> 0.0747  accuracy: 96.64% -> 96.64%     
client [98] (testset)   loss: 0.0928 -> 0.0861  accuracy: 97.14% -> 98.10%     
client [53] (testset)   loss: 0.1193 -> 0.1094  accuracy: 96.75% -> 96.75%     
client [43] (testset)   loss: 0.1289 -> 0.1333  accuracy: 96.03% -> 96.03%     
client [64] (testset)   loss: 0.1248 -> 0.1318  accuracy: 96.03% -> 96.03%     
---------------------------- TRAINING EPOCH: 130 ----------------------------  
client [21] (testset)   loss: 0.0312 -> 0.0301  accuracy: 98.56% -> 99.04%     
client [88] (testset)   loss: 0.0004 -> 0.0004  accuracy: 100.00% -> 100.00%   
client [38] (testset)   loss: 0.0807 -> 0.0814  accuracy: 98.43% -> 98.95%     
client [3]  (testset)   loss: 0.2359 -> 0.2303  accuracy: 94.95% -> 94.95%     
client [5]  (testset)   loss: 0.1138 -> 0.1157  accuracy: 96.47% -> 95.88%     
client [41] (testset)   loss: 0.1381 -> 0.1420  accuracy: 95.52% -> 94.62%     
client [7]  (testset)   loss: 0.0240 -> 0.0381  accuracy: 99.11% -> 98.67%     
client [37] (testset)   loss: 0.0483 -> 0.0575  accuracy: 98.35% -> 98.35%     
client [45] (testset)   loss: 0.0554 -> 0.0645  accuracy: 97.89% -> 97.89%     
client [47] (testset)   loss: 0.0662 -> 0.0679  accuracy: 98.11% -> 98.11%     
---------------------------- TRAINING EPOCH: 140 ----------------------------  
client [16] (testset)   loss: 0.2196 -> 0.2197  accuracy: 94.12% -> 94.12%     
client [11] (testset)   loss: 0.0461 -> 0.0462  accuracy: 97.31% -> 97.31%     
client [37] (testset)   loss: 0.0463 -> 0.0558  accuracy: 97.52% -> 98.35%     
client [41] (testset)   loss: 0.1402 -> 0.1403  accuracy: 95.96% -> 95.52%     
client [95] (testset)   loss: 0.0790 -> 0.0776  accuracy: 97.18% -> 97.18%     
client [53] (testset)   loss: 0.1245 -> 0.1282  accuracy: 96.75% -> 96.75%     
client [22] (testset)   loss: 0.0320 -> 0.0284  accuracy: 98.52% -> 98.52%     
client [25] (testset)   loss: 0.1332 -> 0.1325  accuracy: 97.18% -> 97.18%     
client [69] (testset)   loss: 0.0778 -> 0.0779  accuracy: 97.86% -> 97.86%     
client [46] (testset)   loss: 0.0769 -> 0.0768  accuracy: 97.25% -> 97.25%     
---------------------------- TRAINING EPOCH: 150 ----------------------------  
client [47] (testset)   loss: 0.0711 -> 0.0728  accuracy: 98.11% -> 98.11%     
client [69] (testset)   loss: 0.0786 -> 0.0791  accuracy: 97.86% -> 97.86%     
client [82] (testset)   loss: 0.0681 -> 0.0677  accuracy: 98.74% -> 98.74%     
client [45] (testset)   loss: 0.0610 -> 0.0681  accuracy: 97.89% -> 97.89%     
client [7]  (testset)   loss: 0.0275 -> 0.0431  accuracy: 99.11% -> 98.67%     
client [50] (testset)   loss: 0.0579 -> 0.0615  accuracy: 98.88% -> 98.88%     
client [35] (testset)   loss: 0.0723 -> 0.0758  accuracy: 96.64% -> 96.64%     
client [24] (testset)   loss: 0.0550 -> 0.0530  accuracy: 97.89% -> 98.42%     
client [15] (testset)   loss: 0.0723 -> 0.0720  accuracy: 98.71% -> 98.71%     
client [58] (testset)   loss: 0.1625 -> 0.1662  accuracy: 96.94% -> 96.94%     
---------------------------- TRAINING EPOCH: 160 ----------------------------  
client [48] (testset)   loss: 0.0762 -> 0.0763  accuracy: 98.58% -> 98.58%     
client [76] (testset)   loss: 0.0483 -> 0.0485  accuracy: 97.81% -> 97.27%     
client [67] (testset)   loss: 0.0364 -> 0.0355  accuracy: 98.86% -> 98.86%     
client [37] (testset)   loss: 0.0537 -> 0.0565  accuracy: 98.35% -> 98.35%     
client [58] (testset)   loss: 0.1643 -> 0.1705  accuracy: 96.94% -> 96.94%     
client [64] (testset)   loss: 0.1369 -> 0.1374  accuracy: 96.03% -> 96.03%     
client [77] (testset)   loss: 0.1885 -> 0.1887  accuracy: 96.47% -> 96.47%     
client [55] (testset)   loss: 0.0397 -> 0.0395  accuracy: 98.93% -> 99.20%     
client [12] (testset)   loss: 0.0928 -> 0.0932  accuracy: 99.29% -> 98.58%     
client [89] (testset)   loss: 0.0758 -> 0.0672  accuracy: 98.31% -> 98.31%     
---------------------------- TRAINING EPOCH: 170 ----------------------------  
client [84] (testset)   loss: 0.0254 -> 0.0249  accuracy: 99.10% -> 99.10%     
client [51] (testset)   loss: 0.0080 -> 0.0077  accuracy: 100.00% -> 100.00%   
client [8]  (testset)   loss: 0.0119 -> 0.0134  accuracy: 100.00% -> 100.00%   
client [18] (testset)   loss: 0.0673 -> 0.0547  accuracy: 97.79% -> 97.79%     
client [94] (testset)   loss: 0.0739 -> 0.0825  accuracy: 96.95% -> 96.34%     
client [81] (testset)   loss: 0.0978 -> 0.0990  accuracy: 97.93% -> 97.93%     
client [3]  (testset)   loss: 0.2549 -> 0.2559  accuracy: 94.95% -> 94.95%     
client [11] (testset)   loss: 0.0479 -> 0.0460  accuracy: 96.86% -> 97.31%     
client [95] (testset)   loss: 0.0828 -> 0.0824  accuracy: 97.18% -> 97.18%     
client [67] (testset)   loss: 0.0378 -> 0.0382  accuracy: 98.86% -> 98.86%     
---------------------------- TRAINING EPOCH: 180 ----------------------------  
client [21] (testset)   loss: 0.0294 -> 0.0289  accuracy: 98.56% -> 99.04%     
client [79] (testset)   loss: 0.1686 -> 0.1685  accuracy: 96.60% -> 97.28%     
client [58] (testset)   loss: 0.1728 -> 0.1702  accuracy: 96.94% -> 96.94%     
client [88] (testset)   loss: 0.0002 -> 0.0002  accuracy: 100.00% -> 100.00%   
client [46] (testset)   loss: 0.0814 -> 0.0819  accuracy: 97.25% -> 97.25%     
client [11] (testset)   loss: 0.0470 -> 0.0561  accuracy: 97.31% -> 96.86%     
client [55] (testset)   loss: 0.0414 -> 0.0421  accuracy: 99.20% -> 99.20%     
client [13] (testset)   loss: 0.1344 -> 0.1327  accuracy: 96.28% -> 96.59%     
client [31] (testset)   loss: 0.0275 -> 0.0309  accuracy: 99.47% -> 98.93%     
client [75] (testset)   loss: 0.0008 -> 0.0008  accuracy: 100.00% -> 100.00%   
---------------------------- TRAINING EPOCH: 190 ----------------------------  
client [19] (testset)   loss: 0.0115 -> 0.0124  accuracy: 100.00% -> 100.00%   
client [7]  (testset)   loss: 0.0398 -> 0.0461  accuracy: 98.67% -> 98.67%     
client [57] (testset)   loss: 0.1878 -> 0.1873  accuracy: 96.81% -> 96.81%     
client [13] (testset)   loss: 0.1339 -> 0.1314  accuracy: 96.90% -> 96.90%     
client [43] (testset)   loss: 0.1581 -> 0.1595  accuracy: 96.83% -> 96.83%     
client [91] (testset)   loss: 0.0513 -> 0.0512  accuracy: 99.12% -> 99.12%     
client [10] (testset)   loss: 0.0159 -> 0.0162  accuracy: 99.51% -> 99.51%     
client [64] (testset)   loss: 0.1363 -> 0.1391  accuracy: 96.03% -> 96.83%     
client [82] (testset)   loss: 0.0705 -> 0.0703  accuracy: 98.74% -> 98.74%     
client [22] (testset)   loss: 0.0304 -> 0.0292  accuracy: 98.52% -> 98.52%     
---------------------------- TRAINING EPOCH: 200 ----------------------------  
client [20] (testset)   loss: 0.0578 -> 0.0520  accuracy: 97.18% -> 97.89%     
client [23] (testset)   loss: 0.0357 -> 0.0367  accuracy: 99.13% -> 99.13%     
client [88] (testset)   loss: 0.0001 -> 0.0001  accuracy: 100.00% -> 100.00%   
client [98] (testset)   loss: 0.0957 -> 0.0958  accuracy: 98.10% -> 98.10%     
client [79] (testset)   loss: 0.1727 -> 0.1718  accuracy: 97.28% -> 97.28%     
client [21] (testset)   loss: 0.0305 -> 0.0318  accuracy: 98.56% -> 99.04%     
client [92] (testset)   loss: 0.1910 -> 0.1898  accuracy: 98.25% -> 98.25%     
client [56] (testset)   loss: 0.1029 -> 0.1025  accuracy: 97.69% -> 97.69%     
client [5]  (testset)   loss: 0.1295 -> 0.1310  accuracy: 95.88% -> 95.88%     
client [52] (testset)   loss: 0.2373 -> 0.2324  accuracy: 97.40% -> 97.40%     
---------------------------- TRAINING EPOCH: 210 ----------------------------  
client [67] (testset)   loss: 0.0421 -> 0.0387  accuracy: 98.86% -> 98.86%     
client [54] (testset)   loss: 0.0606 -> 0.0607  accuracy: 98.67% -> 98.67%     
client [14] (testset)   loss: 0.0962 -> 0.0950  accuracy: 97.16% -> 97.16%     
client [99] (testset)   loss: 0.1207 -> 0.1185  accuracy: 95.86% -> 95.86%     
client [36] (testset)   loss: 0.0312 -> 0.0357  accuracy: 98.84% -> 98.46%     
client [30] (testset)   loss: 0.0340 -> 0.0330  accuracy: 98.71% -> 98.71%     
client [38] (testset)   loss: 0.0957 -> 0.0959  accuracy: 97.91% -> 97.91%     
client [15] (testset)   loss: 0.0741 -> 0.0718  accuracy: 98.71% -> 98.71%     
client [6]  (testset)   loss: 0.1052 -> 0.1100  accuracy: 98.03% -> 97.37%     
client [53] (testset)   loss: 0.1325 -> 0.1344  accuracy: 96.75% -> 96.75%     
---------------------------- TRAINING EPOCH: 220 ----------------------------  
client [99] (testset)   loss: 0.1214 -> 0.1207  accuracy: 95.86% -> 95.86%     
client [6]  (testset)   loss: 0.1088 -> 0.1009  accuracy: 97.37% -> 98.03%     
client [83] (testset)   loss: 0.1025 -> 0.1032  accuracy: 99.16% -> 99.16%     
client [42] (testset)   loss: 0.1570 -> 0.1583  accuracy: 96.63% -> 96.63%     
client [34] (testset)   loss: 0.1000 -> 0.0987  accuracy: 97.75% -> 97.75%     
client [15] (testset)   loss: 0.0731 -> 0.0711  accuracy: 98.71% -> 98.71%     
client [47] (testset)   loss: 0.0797 -> 0.0808  accuracy: 98.11% -> 98.11%     
client [55] (testset)   loss: 0.0433 -> 0.0429  accuracy: 99.20% -> 99.20%     
client [51] (testset)   loss: 0.0065 -> 0.0065  accuracy: 100.00% -> 100.00%   
client [95] (testset)   loss: 0.0884 -> 0.0873  accuracy: 97.18% -> 97.18%     
---------------------------- TRAINING EPOCH: 230 ----------------------------  
client [71] (testset)   loss: 0.0474 -> 0.0484  accuracy: 98.72% -> 98.72%     
client [15] (testset)   loss: 0.0721 -> 0.0709  accuracy: 98.71% -> 98.71%     
client [33] (testset)   loss: 0.0442 -> 0.0460  accuracy: 98.34% -> 98.34%     
client [99] (testset)   loss: 0.1218 -> 0.1219  accuracy: 95.86% -> 95.86%     
client [90] (testset)   loss: 0.0777 -> 0.0776  accuracy: 99.28% -> 99.28%     
client [57] (testset)   loss: 0.2015 -> 0.2014  accuracy: 96.81% -> 96.81%     
client [27] (testset)   loss: 0.1050 -> 0.0997  accuracy: 97.97% -> 97.97%     
client [78] (testset)   loss: 0.0580 -> 0.0580  accuracy: 97.59% -> 97.59%     
client [36] (testset)   loss: 0.0333 -> 0.0326  accuracy: 98.46% -> 98.46%     
client [88] (testset)   loss: 0.0001 -> 0.0001  accuracy: 100.00% -> 100.00%   
---------------------------- TRAINING EPOCH: 240 ----------------------------  
client [70] (testset)   loss: 0.0147 -> 0.0146  accuracy: 100.00% -> 100.00%   
client [35] (testset)   loss: 0.0770 -> 0.0773  accuracy: 96.64% -> 96.64%     
client [16] (testset)   loss: 0.2557 -> 0.2533  accuracy: 93.28% -> 93.28%     
client [80] (testset)   loss: 0.0015 -> 0.0015  accuracy: 100.00% -> 100.00%   
client [38] (testset)   loss: 0.0965 -> 0.0976  accuracy: 97.91% -> 97.91%     
client [78] (testset)   loss: 0.0589 -> 0.0591  accuracy: 97.59% -> 97.59%     
client [68] (testset)   loss: 0.0557 -> 0.0534  accuracy: 98.66% -> 98.66%     
client [11] (testset)   loss: 0.0484 -> 0.0515  accuracy: 97.31% -> 96.86%     
client [64] (testset)   loss: 0.1424 -> 0.1432  accuracy: 96.83% -> 96.83%     
client [82] (testset)   loss: 0.0751 -> 0.0753  accuracy: 98.74% -> 98.74%     
---------------------------- TRAINING EPOCH: 250 ----------------------------  
client [30] (testset)   loss: 0.0332 -> 0.0330  accuracy: 98.71% -> 98.71%     
client [27] (testset)   loss: 0.1049 -> 0.1007  accuracy: 97.97% -> 97.97%     
client [74] (testset)   loss: 0.0797 -> 0.0808  accuracy: 98.05% -> 98.05%     
client [45] (testset)   loss: 0.0801 -> 0.0823  accuracy: 97.89% -> 97.89%     
client [6]  (testset)   loss: 0.1092 -> 0.1115  accuracy: 98.03% -> 97.37%     
client [36] (testset)   loss: 0.0340 -> 0.0330  accuracy: 98.46% -> 98.46%     
client [63] (testset)   loss: 0.1988 -> 0.2084  accuracy: 97.69% -> 97.69%     
client [76] (testset)   loss: 0.0499 -> 0.0504  accuracy: 97.81% -> 97.81%     
client [83] (testset)   loss: 0.1051 -> 0.1052  accuracy: 99.16% -> 99.16%     
client [86] (testset)   loss: 0.1252 -> 0.1274  accuracy: 96.45% -> 96.95%     
---------------------------- TRAINING EPOCH: 260 ----------------------------  
client [83] (testset)   loss: 0.1064 -> 0.1066  accuracy: 99.16% -> 99.16%     
client [99] (testset)   loss: 0.1247 -> 0.1236  accuracy: 95.86% -> 95.86%     
client [74] (testset)   loss: 0.0806 -> 0.0827  accuracy: 98.05% -> 98.05%     
client [73] (testset)   loss: 0.0158 -> 0.0176  accuracy: 99.42% -> 99.42%     
client [29] (testset)   loss: 0.0118 -> 0.0122  accuracy: 99.42% -> 99.42%     
client [92] (testset)   loss: 0.2006 -> 0.2004  accuracy: 98.25% -> 98.25%     
client [6]  (testset)   loss: 0.1130 -> 0.1009  accuracy: 96.71% -> 98.03%     
client [61] (testset)   loss: 0.1751 -> 0.1760  accuracy: 98.74% -> 98.74%     
client [21] (testset)   loss: 0.0337 -> 0.0328  accuracy: 98.56% -> 98.56%     
client [67] (testset)   loss: 0.0412 -> 0.0397  accuracy: 98.86% -> 98.86%     
---------------------------- TRAINING EPOCH: 270 ----------------------------  
client [83] (testset)   loss: 0.1067 -> 0.1064  accuracy: 99.16% -> 99.16%     
client [32] (testset)   loss: 0.0972 -> 0.1007  accuracy: 96.21% -> 96.21%     
client [95] (testset)   loss: 0.0907 -> 0.0897  accuracy: 97.18% -> 97.18%     
client [61] (testset)   loss: 0.1766 -> 0.1759  accuracy: 98.74% -> 98.74%     
client [27] (testset)   loss: 0.1053 -> 0.1055  accuracy: 97.97% -> 97.97%     
client [25] (testset)   loss: 0.1604 -> 0.1601  accuracy: 97.18% -> 97.18%     
client [68] (testset)   loss: 0.0561 -> 0.0540  accuracy: 98.66% -> 98.66%     
client [34] (testset)   loss: 0.1023 -> 0.1030  accuracy: 97.75% -> 97.75%     
client [71] (testset)   loss: 0.0477 -> 0.0447  accuracy: 98.72% -> 98.72%     
client [89] (testset)   loss: 0.0768 -> 0.0748  accuracy: 98.31% -> 98.31%     
---------------------------- TRAINING EPOCH: 280 ----------------------------  
client [78] (testset)   loss: 0.0608 -> 0.0611  accuracy: 97.59% -> 97.59%     
client [81] (testset)   loss: 0.1084 -> 0.1090  accuracy: 97.93% -> 97.93%     
client [51] (testset)   loss: 0.0055 -> 0.0057  accuracy: 100.00% -> 100.00%   
client [54] (testset)   loss: 0.0636 -> 0.0642  accuracy: 98.67% -> 98.67%     
client [65] (testset)   loss: 0.0599 -> 0.0602  accuracy: 98.30% -> 98.30%     
client [41] (testset)   loss: 0.1892 -> 0.1863  accuracy: 95.52% -> 94.62%     
client [11] (testset)   loss: 0.0515 -> 0.0541  accuracy: 97.31% -> 96.86%     
client [85] (testset)   loss: 0.0722 -> 0.0746  accuracy: 98.13% -> 98.13%     
client [12] (testset)   loss: 0.1069 -> 0.1066  accuracy: 98.58% -> 98.58%     
client [23] (testset)   loss: 0.0414 -> 0.0413  accuracy: 99.13% -> 99.13%     
---------------------------- TRAINING EPOCH: 290 ----------------------------  
client [16] (testset)   loss: 0.2664 -> 0.2664  accuracy: 93.28% -> 93.28%     
client [65] (testset)   loss: 0.0608 -> 0.0611  accuracy: 98.30% -> 98.30%     
client [53] (testset)   loss: 0.1444 -> 0.1452  accuracy: 96.75% -> 96.75%     
client [58] (testset)   loss: 0.1922 -> 0.1918  accuracy: 96.94% -> 96.94%     
client [72] (testset)   loss: 0.0219 -> 0.0235  accuracy: 98.76% -> 98.76%     
client [7]  (testset)   loss: 0.0502 -> 0.0522  accuracy: 98.67% -> 98.67%     
client [71] (testset)   loss: 0.0497 -> 0.0490  accuracy: 98.72% -> 98.72%     
client [59] (testset)   loss: 0.0327 -> 0.0317  accuracy: 97.92% -> 97.92%     
client [86] (testset)   loss: 0.1298 -> 0.1314  accuracy: 96.95% -> 96.45%     
client [39] (testset)   loss: 0.2441 -> 0.2459  accuracy: 96.32% -> 96.32%     
---------------------------- TRAINING EPOCH: 300 ----------------------------  
client [99] (testset)   loss: 0.1272 -> 0.1264  accuracy: 95.86% -> 95.86%     
client [7]  (testset)   loss: 0.0496 -> 0.0505  accuracy: 98.22% -> 98.67%     
client [17] (testset)   loss: 0.0810 -> 0.0820  accuracy: 96.77% -> 96.77%     
client [64] (testset)   loss: 0.1479 -> 0.1504  accuracy: 96.83% -> 96.83%     
client [37] (testset)   loss: 0.0721 -> 0.0731  accuracy: 98.35% -> 98.35%     
client [29] (testset)   loss: 0.0104 -> 0.0107  accuracy: 99.42% -> 99.42%     
client [93] (testset)   loss: 0.0403 -> 0.0419  accuracy: 98.58% -> 98.58%     
client [73] (testset)   loss: 0.0171 -> 0.0171  accuracy: 99.42% -> 99.42%     
client [40] (testset)   loss: 0.0551 -> 0.0562  accuracy: 99.66% -> 99.66%     
client [76] (testset)   loss: 0.0520 -> 0.0529  accuracy: 97.81% -> 97.81%     
---------------------------- TRAINING EPOCH: 310 ----------------------------  
client [31] (testset)   loss: 0.0319 -> 0.0321  accuracy: 98.93% -> 98.93%     
client [89] (testset)   loss: 0.0782 -> 0.0740  accuracy: 98.31% -> 98.31%     
client [77] (testset)   loss: 0.2045 -> 0.2052  accuracy: 95.29% -> 95.29%     
client [90] (testset)   loss: 0.0818 -> 0.0816  accuracy: 99.28% -> 99.28%     
client [26] (testset)   loss: 0.0638 -> 0.0634  accuracy: 97.56% -> 97.56%     
client [50] (testset)   loss: 0.0709 -> 0.0742  accuracy: 98.88% -> 98.88%     
client [30] (testset)   loss: 0.0344 -> 0.0340  accuracy: 98.71% -> 98.71%     
client [70] (testset)   loss: 0.0127 -> 0.0125  accuracy: 100.00% -> 100.00%   
client [41] (testset)   loss: 0.1911 -> 0.1850  accuracy: 95.07% -> 95.07%     
client [99] (testset)   loss: 0.1275 -> 0.1273  accuracy: 95.86% -> 95.86%     
---------------------------- TRAINING EPOCH: 320 ----------------------------  
client [68] (testset)   loss: 0.0563 -> 0.0556  accuracy: 98.66% -> 98.66%     
client [70] (testset)   loss: 0.0133 -> 0.0132  accuracy: 100.00% -> 100.00%   
client [52] (testset)   loss: 0.2616 -> 0.2598  accuracy: 97.40% -> 97.40%     
client [1]  (testset)   loss: 0.1883 -> 0.1894  accuracy: 95.48% -> 95.48%     
client [2]  (testset)   loss: 0.0655 -> 0.0660  accuracy: 98.38% -> 98.38%     
client [67] (testset)   loss: 0.0422 -> 0.0411  accuracy: 98.86% -> 98.86%     
client [92] (testset)   loss: 0.2119 -> 0.2117  accuracy: 98.25% -> 98.25%     
client [35] (testset)   loss: 0.0826 -> 0.0808  accuracy: 96.64% -> 96.64%     
client [36] (testset)   loss: 0.0330 -> 0.0339  accuracy: 98.46% -> 98.46%     
client [64] (testset)   loss: 0.1512 -> 0.1524  accuracy: 96.83% -> 96.83%     
---------------------------- TRAINING EPOCH: 330 ----------------------------  
client [44] (testset)   loss: 0.0554 -> 0.0521  accuracy: 98.87% -> 98.87%     
client [6]  (testset)   loss: 0.1092 -> 0.1091  accuracy: 97.37% -> 97.37%     
client [12] (testset)   loss: 0.1100 -> 0.1097  accuracy: 98.58% -> 98.58%     
client [55] (testset)   loss: 0.0466 -> 0.0466  accuracy: 99.20% -> 99.20%     
client [29] (testset)   loss: 0.0096 -> 0.0100  accuracy: 99.42% -> 99.42%     
client [9]  (testset)   loss: 0.0750 -> 0.0752  accuracy: 98.18% -> 98.18%     
client [43] (testset)   loss: 0.1795 -> 0.1798  accuracy: 96.83% -> 96.83%     
client [77] (testset)   loss: 0.2057 -> 0.2061  accuracy: 95.29% -> 95.29%     
client [98] (testset)   loss: 0.1075 -> 0.1072  accuracy: 98.10% -> 98.10%     
client [78] (testset)   loss: 0.0614 -> 0.0616  accuracy: 97.59% -> 97.59%     
---------------------------- TRAINING EPOCH: 340 ----------------------------  
client [92] (testset)   loss: 0.2144 -> 0.2142  accuracy: 98.25% -> 98.25%     
client [80] (testset)   loss: 0.0012 -> 0.0012  accuracy: 100.00% -> 100.00%   
client [63] (testset)   loss: 0.2185 -> 0.2197  accuracy: 97.69% -> 97.69%     
client [76] (testset)   loss: 0.0527 -> 0.0539  accuracy: 97.81% -> 97.81%     
client [78] (testset)   loss: 0.0621 -> 0.0621  accuracy: 97.59% -> 97.59%     
client [25] (testset)   loss: 0.1695 -> 0.1696  accuracy: 97.18% -> 97.18%     
client [58] (testset)   loss: 0.1971 -> 0.2003  accuracy: 96.94% -> 96.94%     
client [13] (testset)   loss: 0.1490 -> 0.1445  accuracy: 96.59% -> 96.59%     
client [17] (testset)   loss: 0.0848 -> 0.0854  accuracy: 96.77% -> 96.77%     
client [38] (testset)   loss: 0.1062 -> 0.1065  accuracy: 97.91% -> 98.43%     
---------------------------- TRAINING EPOCH: 350 ----------------------------  
client [72] (testset)   loss: 0.0227 -> 0.0234  accuracy: 98.76% -> 98.76%     
client [82] (testset)   loss: 0.0792 -> 0.0802  accuracy: 98.74% -> 98.74%     
client [86] (testset)   loss: 0.1337 -> 0.1344  accuracy: 96.45% -> 96.45%     
client [51] (testset)   loss: 0.0053 -> 0.0052  accuracy: 100.00% -> 100.00%   
client [96] (testset)   loss: 0.0386 -> 0.0389  accuracy: 98.25% -> 98.25%     
client [42] (testset)   loss: 0.1744 -> 0.1754  accuracy: 96.63% -> 96.63%     
client [55] (testset)   loss: 0.0475 -> 0.0477  accuracy: 99.20% -> 99.20%     
client [13] (testset)   loss: 0.1486 -> 0.1492  accuracy: 96.59% -> 96.90%     
client [1]  (testset)   loss: 0.1929 -> 0.1913  accuracy: 95.48% -> 95.48%     
client [12] (testset)   loss: 0.1119 -> 0.1113  accuracy: 98.58% -> 98.58%     
---------------------------- TRAINING EPOCH: 360 ----------------------------  
client [68] (testset)   loss: 0.0574 -> 0.0565  accuracy: 98.66% -> 98.66%     
client [23] (testset)   loss: 0.0468 -> 0.0462  accuracy: 98.26% -> 98.26%     
client [46] (testset)   loss: 0.0956 -> 0.0961  accuracy: 97.25% -> 97.25%     
client [41] (testset)   loss: 0.1924 -> 0.2009  accuracy: 95.07% -> 95.07%     
client [25] (testset)   loss: 0.1692 -> 0.1693  accuracy: 97.18% -> 97.18%     
client [58] (testset)   loss: 0.2014 -> 0.2081  accuracy: 96.94% -> 96.94%     
client [14] (testset)   loss: 0.1068 -> 0.1064  accuracy: 97.16% -> 97.16%     
client [33] (testset)   loss: 0.0475 -> 0.0479  accuracy: 98.34% -> 98.34%     
client [85] (testset)   loss: 0.0789 -> 0.0798  accuracy: 98.13% -> 98.13%     
client [62] (testset)   loss: 0.0335 -> 0.0338  accuracy: 98.79% -> 98.79%     
---------------------------- TRAINING EPOCH: 370 ----------------------------  
client [98] (testset)   loss: 0.1102 -> 0.1103  accuracy: 98.10% -> 98.10%     
client [63] (testset)   loss: 0.2231 -> 0.2245  accuracy: 97.69% -> 97.69%     
client [70] (testset)   loss: 0.0126 -> 0.0125  accuracy: 100.00% -> 100.00%   
client [65] (testset)   loss: 0.0633 -> 0.0636  accuracy: 98.30% -> 98.30%     
client [14] (testset)   loss: 0.1072 -> 0.1062  accuracy: 97.16% -> 97.16%     
client [73] (testset)   loss: 0.0165 -> 0.0163  accuracy: 99.42% -> 99.42%     
client [34] (testset)   loss: 0.1114 -> 0.1119  accuracy: 97.75% -> 97.75%     
client [99] (testset)   loss: 0.1301 -> 0.1302  accuracy: 95.86% -> 95.86%     
client [69] (testset)   loss: 0.0992 -> 0.1002  accuracy: 97.86% -> 97.86%     
client [46] (testset)   loss: 0.0968 -> 0.0967  accuracy: 97.25% -> 97.25%     
---------------------------- TRAINING EPOCH: 380 ----------------------------  
client [99] (testset)   loss: 0.1302 -> 0.1304  accuracy: 95.86% -> 95.86%     
client [93] (testset)   loss: 0.0444 -> 0.0459  accuracy: 98.58% -> 98.58%     
client [11] (testset)   loss: 0.0553 -> 0.0536  accuracy: 96.86% -> 96.86%     
client [58] (testset)   loss: 0.2065 -> 0.2050  accuracy: 96.94% -> 96.94%     
client [81] (testset)   loss: 0.1158 -> 0.1159  accuracy: 97.93% -> 97.93%     
client [85] (testset)   loss: 0.0798 -> 0.0805  accuracy: 98.13% -> 98.13%     
client [89] (testset)   loss: 0.0799 -> 0.0818  accuracy: 98.31% -> 98.31%     
client [45] (testset)   loss: 0.0908 -> 0.0918  accuracy: 97.89% -> 97.89%     
client [8]  (testset)   loss: 0.0082 -> 0.0083  accuracy: 100.00% -> 100.00%   
client [68] (testset)   loss: 0.0568 -> 0.0565  accuracy: 98.66% -> 98.66%     
---------------------------- TRAINING EPOCH: 390 ----------------------------  
client [67] (testset)   loss: 0.0427 -> 0.0433  accuracy: 98.86% -> 98.86%     
client [72] (testset)   loss: 0.0232 -> 0.0227  accuracy: 98.76% -> 98.76%     
client [1]  (testset)   loss: 0.1968 -> 0.1973  accuracy: 95.48% -> 95.48%     
client [78] (testset)   loss: 0.0628 -> 0.0630  accuracy: 97.59% -> 97.59%     
client [83] (testset)   loss: 0.1159 -> 0.1160  accuracy: 99.16% -> 99.16%     
client [21] (testset)   loss: 0.0381 -> 0.0386  accuracy: 98.56% -> 98.56%     
client [56] (testset)   loss: 0.1205 -> 0.1209  accuracy: 97.69% -> 97.69%     
client [44] (testset)   loss: 0.0584 -> 0.0569  accuracy: 98.87% -> 98.87%     
client [92] (testset)   loss: 0.2199 -> 0.2205  accuracy: 98.25% -> 98.25%     
client [27] (testset)   loss: 0.1152 -> 0.1153  accuracy: 97.97% -> 97.97%     
---------------------------- TRAINING EPOCH: 400 ----------------------------  
client [10] (testset)   loss: 0.0186 -> 0.0187  accuracy: 99.51% -> 99.51%     
client [39] (testset)   loss: 0.2587 -> 0.2584  accuracy: 96.32% -> 96.32%     
client [65] (testset)   loss: 0.0645 -> 0.0645  accuracy: 98.30% -> 98.30%     
client [26] (testset)   loss: 0.0684 -> 0.0675  accuracy: 97.56% -> 97.56%     
client [19] (testset)   loss: 0.0119 -> 0.0120  accuracy: 100.00% -> 100.00%   
client [68] (testset)   loss: 0.0577 -> 0.0577  accuracy: 98.66% -> 98.66%     
client [41] (testset)   loss: 0.2009 -> 0.2015  accuracy: 95.52% -> 95.52%     
client [50] (testset)   loss: 0.0746 -> 0.0745  accuracy: 98.88% -> 98.88%     
client [75] (testset)   loss: 0.0003 -> 0.0003  accuracy: 100.00% -> 100.00%   
client [81] (testset)   loss: 0.1170 -> 0.1172  accuracy: 97.93% -> 97.93%     
Training... ---------------------------------------- 100% 0:14:20
FedPer's average time taken by each global epoch: 0 min 2.14 sec.              
FedPer's total running time: 0 h 14 m 20 s.                                    
==================== FedPer Experiment Results: ====================           
Display format: (before local fine-tuning) -> (after local fine-tuning)        
 So if finetune_epoch = 0, x.xx% -> 0.00% is normal.                           
 Centralized testing ONLY happens after model aggregation, so the stats between
'->' are the same.                                                             
{                                                                              
    "100": {                                                                   
        "all_clients": {                                                       
            "test": {                                                          
                "loss": "0.0695 -> 0.0000",                                    
                "accuracy": "97.94% -> 0.00%"                                  
            }                                                                  
        }                                                                      
    },                                                                         
    "200": {                                                                   
        "all_clients": {                                                       
            "test": {                                                          
                "loss": "0.0836 -> 0.0000",                                    
                "accuracy": "97.98% -> 0.00%"                                  
            }                                                                  
        }                                                                      
    },                                                                         
    "300": {                                                                   
        "all_clients": {                                                       
            "test": {                                                          
                "loss": "0.0910 -> 0.0000",                                    
                "accuracy": "97.96% -> 0.00%"                                  
            }                                                                  
        }                                                                      
    },                                                                         
    "400": {                                                                   
        "all_clients": {                                                       
            "test": {                                                          
                "loss": "0.0962 -> 0.0000",                                    
                "accuracy": "97.94% -> 0.00%"                                  
            }                                                                  
        }                                                                      
    }                                                                          
}                                                                              
==================== FedPer Max Accuracy ====================                  
all_clients:                                                                   
(test) before fine-tuning: 97.98% at epoch 200                                 
(test) after fine-tuning: 0.00% at epoch 100                                   
[0m