==================== FedRoD ====================                               
Experiment Arguments:                                                          
{
│   'method': 'fedrod',
│   'dataset': {
│   │   'name': 'mnist',
│   │   'client_num': 100,
│   │   'test_ratio': 0.25,
│   │   'val_ratio': 0.0,
│   │   'seed': 42,
│   │   'split': 'sample',
│   │   'IID_ratio': 0.0,
│   │   'monitor_window_name_suffix': 'mnist-100clients-0%IID-Dir(0.5)-seed42',
│   │   'alpha': 0.5,
│   │   'min_samples_per_client': 10
│   },
│   'model': {
│   │   'name': 'avgcnn',
│   │   'use_torchvision_pretrained_weights': True,
│   │   'external_model_weights_path': None
│   },
│   'optimizer': {
│   │   'lr': 0.01,
│   │   'dampening': 0,
│   │   'weight_decay': 0,
│   │   'momentum': 0,
│   │   'nesterov': False,
│   │   'name': 'sgd'
│   },
│   'mode': 'serial',
│   'parallel': {
│   │   'ray_cluster_addr': None,
│   │   'num_cpus': None,
│   │   'num_gpus': None,
│   │   'num_workers': 2
│   },
│   'common': {
│   │   'seed': 42,
│   │   'join_ratio': 0.1,
│   │   'global_epoch': 400,
│   │   'local_epoch': 5,
│   │   'batch_size': 32,
│   │   'reset_optimizer_on_global_epoch': True,
│   │   'straggler_ratio': 0,
│   │   'straggler_min_local_epoch': 0,
│   │   'buffers': 'global',
│   │   'client_side_evaluation': True,
│   │   'test': {
│   │   │   'client': {
│   │   │   │   'interval': 100,
│   │   │   │   'finetune_epoch': 0,
│   │   │   │   'train': False,
│   │   │   │   'val': False,
│   │   │   │   'test': True
│   │   │   },
│   │   │   'server': {
│   │   │   │   'interval': -1,
│   │   │   │   'train': False,
│   │   │   │   'val': False,
│   │   │   │   'test': False,
│   │   │   │   'model_in_train_mode': False
│   │   │   }
│   │   },
│   │   'verbose_gap': 10,
│   │   'monitor': None,
│   │   'use_cuda': True,
│   │   'save_log': True,
│   │   'save_model': False,
│   │   'save_learning_curve_plot': False,
│   │   'save_metrics': True,
│   │   'delete_useless_run': True
│   },
│   'fedrod': {
│   │   'gamma': 1,
│   │   'hyper': 0,
│   │   'hyper_lr': 0.1,
│   │   'hyper_hidden_dim': 32,
│   │   'eval_per': 1
│   }
}
---------------------------- TRAINING EPOCH: 10 ----------------------------   
client [77] (testset)   loss: 0.2883 -> 0.1625  accuracy: 92.94% -> 95.29%     
client [81] (testset)   loss: 0.0811 -> 0.0554  accuracy: 97.51% -> 97.93%     
client [21] (testset)   loss: 0.0828 -> 0.0206  accuracy: 97.61% -> 100.00%    
client [68] (testset)   loss: 0.0299 -> 0.0308  accuracy: 99.11% -> 99.11%     
client [93] (testset)   loss: 0.0329 -> 0.0208  accuracy: 99.29% -> 99.29%     
client [31] (testset)   loss: 0.0593 -> 0.0450  accuracy: 99.47% -> 98.93%     
client [20] (testset)   loss: 0.0554 -> 0.0415  accuracy: 97.89% -> 97.18%     
client [59] (testset)   loss: 0.1114 -> 0.0200  accuracy: 95.83% -> 98.96%     
client [48] (testset)   loss: 0.0249 -> 0.0219  accuracy: 99.29% -> 98.58%     
client [34] (testset)   loss: 0.0902 -> 0.0797  accuracy: 98.13% -> 97.75%     
---------------------------- TRAINING EPOCH: 20 ----------------------------   
client [69] (testset)   loss: 0.0804 -> 0.0600  accuracy: 98.57% -> 98.57%     
client [99] (testset)   loss: 0.0774 -> 0.0612  accuracy: 97.04% -> 98.22%     
client [67] (testset)   loss: 0.0308 -> 0.0214  accuracy: 98.86% -> 99.43%     
client [0]  (testset)   loss: 0.0652 -> 0.0621  accuracy: 97.77% -> 98.09%     
client [76] (testset)   loss: 0.0221 -> 0.0274  accuracy: 98.91% -> 98.91%     
client [41] (testset)   loss: 0.0478 -> 0.0633  accuracy: 97.31% -> 96.41%     
client [62] (testset)   loss: 0.0625 -> 0.0228  accuracy: 97.58% -> 99.39%     
client [2]  (testset)   loss: 0.0655 -> 0.0171  accuracy: 97.73% -> 99.68%     
client [14] (testset)   loss: 0.0519 -> 0.0413  accuracy: 97.73% -> 98.30%     
client [46] (testset)   loss: 0.0268 -> 0.0274  accuracy: 99.08% -> 99.08%     
---------------------------- TRAINING EPOCH: 30 ----------------------------   
client [24] (testset)   loss: 0.0018 -> 0.0017  accuracy: 100.00% -> 100.00%   
client [68] (testset)   loss: 0.0274 -> 0.0255  accuracy: 99.11% -> 99.55%     
client [57] (testset)   loss: 0.0399 -> 0.0285  accuracy: 98.94% -> 98.94%     
client [17] (testset)   loss: 0.0312 -> 0.0303  accuracy: 98.39% -> 99.19%     
client [54] (testset)   loss: 0.0044 -> 0.0047  accuracy: 100.00% -> 100.00%   
client [23] (testset)   loss: 0.1007 -> 0.0128  accuracy: 95.65% -> 100.00%    
client [35] (testset)   loss: 0.0571 -> 0.0248  accuracy: 98.32% -> 98.32%     
client [59] (testset)   loss: 0.0366 -> 0.0153  accuracy: 98.96% -> 98.96%     
client [31] (testset)   loss: 0.0520 -> 0.0499  accuracy: 98.40% -> 98.40%     
client [9]  (testset)   loss: 0.0004 -> 0.0004  accuracy: 100.00% -> 100.00%   
---------------------------- TRAINING EPOCH: 40 ----------------------------   
client [64] (testset)   loss: 0.0320 -> 0.0413  accuracy: 99.21% -> 98.41%     
client [33] (testset)   loss: 0.0223 -> 0.0245  accuracy: 98.90% -> 98.90%     
client [16] (testset)   loss: 0.1286 -> 0.1233  accuracy: 94.96% -> 94.12%     
client [44] (testset)   loss: 0.0471 -> 0.0333  accuracy: 98.58% -> 98.58%     
client [8]  (testset)   loss: 0.0096 -> 0.0021  accuracy: 100.00% -> 100.00%   
client [31] (testset)   loss: 0.0345 -> 0.0356  accuracy: 98.93% -> 98.93%     
client [47] (testset)   loss: 0.0237 -> 0.0309  accuracy: 99.24% -> 99.43%     
client [36] (testset)   loss: 0.0155 -> 0.0200  accuracy: 99.61% -> 99.23%     
client [20] (testset)   loss: 0.0088 -> 0.0084  accuracy: 99.30% -> 100.00%    
client [56] (testset)   loss: 0.0129 -> 0.0246  accuracy: 99.62% -> 99.23%     
---------------------------- TRAINING EPOCH: 50 ----------------------------   
client [4]  (testset)   loss: 0.2125 -> 0.2250  accuracy: 98.73% -> 98.73%     
client [60] (testset)   loss: 0.0086 -> 0.0075  accuracy: 99.35% -> 99.35%     
client [28] (testset)   loss: 0.0065 -> 0.0089  accuracy: 99.51% -> 99.51%     
client [25] (testset)   loss: 0.0212 -> 0.0291  accuracy: 98.59% -> 98.59%     
client [58] (testset)   loss: 0.0778 -> 0.0744  accuracy: 98.47% -> 98.98%     
client [44] (testset)   loss: 0.0394 -> 0.0315  accuracy: 98.87% -> 98.87%     
client [39] (testset)   loss: 0.1433 -> 0.1474  accuracy: 98.77% -> 98.16%     
client [29] (testset)   loss: 0.0147 -> 0.0130  accuracy: 99.42% -> 99.42%     
client [3]  (testset)   loss: 0.0951 -> 0.1119  accuracy: 97.98% -> 97.98%     
client [84] (testset)   loss: 0.0133 -> 0.0163  accuracy: 99.55% -> 99.10%     
---------------------------- TRAINING EPOCH: 60 ----------------------------   
client [21] (testset)   loss: 0.0112 -> 0.0155  accuracy: 99.52% -> 99.52%     
client [84] (testset)   loss: 0.0161 -> 0.0133  accuracy: 99.55% -> 99.55%     
client [10] (testset)   loss: 0.0103 -> 0.0108  accuracy: 99.51% -> 99.51%     
client [36] (testset)   loss: 0.0189 -> 0.0205  accuracy: 98.84% -> 98.84%     
client [65] (testset)   loss: 0.0057 -> 0.0044  accuracy: 99.57% -> 100.00%    
client [81] (testset)   loss: 0.0359 -> 0.0343  accuracy: 98.76% -> 98.76%     
client [79] (testset)   loss: 0.1061 -> 0.1082  accuracy: 97.96% -> 97.96%     
client [42] (testset)   loss: 0.0525 -> 0.0573  accuracy: 98.56% -> 98.56%     
client [11] (testset)   loss: 0.0103 -> 0.0193  accuracy: 99.55% -> 98.65%     
client [96] (testset)   loss: 0.0109 -> 0.0094  accuracy: 99.30% -> 99.65%     
---------------------------- TRAINING EPOCH: 70 ----------------------------   
client [8]  (testset)   loss: 0.0032 -> 0.0020  accuracy: 100.00% -> 100.00%   
client [53] (testset)   loss: 0.0030 -> 0.0042  accuracy: 100.00% -> 100.00%   
client [52] (testset)   loss: 0.1307 -> 0.1381  accuracy: 97.40% -> 97.40%     
client [42] (testset)   loss: 0.0675 -> 0.0663  accuracy: 99.04% -> 99.04%     
client [69] (testset)   loss: 0.0562 -> 0.0586  accuracy: 98.57% -> 98.57%     
client [59] (testset)   loss: 0.0203 -> 0.0298  accuracy: 98.96% -> 98.96%     
client [7]  (testset)   loss: 0.0030 -> 0.0034  accuracy: 100.00% -> 100.00%   
client [26] (testset)   loss: 0.0257 -> 0.0086  accuracy: 99.19% -> 99.19%     
client [49] (testset)   loss: 0.0218 -> 0.0230  accuracy: 99.26% -> 99.26%     
client [98] (testset)   loss: 0.0251 -> 0.0214  accuracy: 98.10% -> 98.10%     
---------------------------- TRAINING EPOCH: 80 ----------------------------   
client [98] (testset)   loss: 0.0194 -> 0.0167  accuracy: 99.05% -> 100.00%    
client [47] (testset)   loss: 0.0230 -> 0.0292  accuracy: 99.24% -> 99.43%     
client [21] (testset)   loss: 0.0128 -> 0.0168  accuracy: 99.52% -> 99.52%     
client [77] (testset)   loss: 0.1493 -> 0.1481  accuracy: 95.29% -> 95.29%     
client [95] (testset)   loss: 0.0328 -> 0.0368  accuracy: 99.06% -> 99.06%     
client [91] (testset)   loss: 0.0111 -> 0.0126  accuracy: 99.12% -> 99.12%     
client [14] (testset)   loss: 0.0176 -> 0.0191  accuracy: 98.30% -> 98.86%     
client [99] (testset)   loss: 0.0621 -> 0.0478  accuracy: 98.22% -> 97.63%     
client [20] (testset)   loss: 0.0088 -> 0.0109  accuracy: 100.00% -> 99.30%    
client [39] (testset)   loss: 0.1632 -> 0.1594  accuracy: 98.16% -> 98.16%     
---------------------------- TRAINING EPOCH: 90 ----------------------------   
client [52] (testset)   loss: 0.1225 -> 0.1256  accuracy: 97.40% -> 97.40%     
client [62] (testset)   loss: 0.0265 -> 0.0335  accuracy: 99.39% -> 99.39%     
client [71] (testset)   loss: 0.0003 -> 0.0003  accuracy: 100.00% -> 100.00%   
client [97] (testset)   loss: 0.0145 -> 0.0135  accuracy: 99.44% -> 99.44%     
client [30] (testset)   loss: 0.0085 -> 0.0101  accuracy: 99.35% -> 99.35%     
client [88] (testset)   loss: 0.0002 -> 0.0002  accuracy: 100.00% -> 100.00%   
client [60] (testset)   loss: 0.0057 -> 0.0066  accuracy: 100.00% -> 99.35%    
client [82] (testset)   loss: 0.0600 -> 0.0657  accuracy: 99.24% -> 98.74%     
client [91] (testset)   loss: 0.0194 -> 0.0202  accuracy: 99.12% -> 99.12%     
client [57] (testset)   loss: 0.0023 -> 0.0028  accuracy: 100.00% -> 100.00%   
---------------------------- TRAINING EPOCH: 100 ----------------------------  
client [31] (testset)   loss: 0.0312 -> 0.0330  accuracy: 98.93% -> 98.93%     
client [15] (testset)   loss: 0.0079 -> 0.0125  accuracy: 100.00% -> 99.35%    
client [71] (testset)   loss: 0.0001 -> 0.0001  accuracy: 100.00% -> 100.00%   
client [97] (testset)   loss: 0.0112 -> 0.0110  accuracy: 99.44% -> 99.44%     
client [53] (testset)   loss: 0.0019 -> 0.0019  accuracy: 100.00% -> 100.00%   
client [77] (testset)   loss: 0.1398 -> 0.1423  accuracy: 95.29% -> 95.29%     
client [76] (testset)   loss: 0.0068 -> 0.0159  accuracy: 99.45% -> 98.91%     
client [79] (testset)   loss: 0.1025 -> 0.1035  accuracy: 98.64% -> 98.64%     
client [28] (testset)   loss: 0.0106 -> 0.0080  accuracy: 99.51% -> 99.51%     
client [99] (testset)   loss: 0.0317 -> 0.0320  accuracy: 98.82% -> 98.22%     
---------------------------- TRAINING EPOCH: 110 ----------------------------  
client [97] (testset)   loss: 0.0116 -> 0.0107  accuracy: 99.44% -> 99.44%     
client [86] (testset)   loss: 0.0707 -> 0.0728  accuracy: 98.98% -> 98.98%     
client [34] (testset)   loss: 0.0485 -> 0.0467  accuracy: 98.88% -> 98.88%     
client [73] (testset)   loss: 0.0503 -> 0.0515  accuracy: 99.42% -> 99.42%     
client [5]  (testset)   loss: 0.0732 -> 0.0784  accuracy: 98.24% -> 98.24%     
client [96] (testset)   loss: 0.0137 -> 0.0097  accuracy: 99.30% -> 99.65%     
client [22] (testset)   loss: 0.0161 -> 0.0131  accuracy: 99.26% -> 99.26%     
client [60] (testset)   loss: 0.0026 -> 0.0032  accuracy: 100.00% -> 100.00%   
client [66] (testset)   loss: 0.0570 -> 0.0571  accuracy: 98.33% -> 98.33%     
client [83] (testset)   loss: 0.0885 -> 0.0914  accuracy: 99.16% -> 99.16%     
---------------------------- TRAINING EPOCH: 120 ----------------------------  
client [76] (testset)   loss: 0.0057 -> 0.0095  accuracy: 100.00% -> 99.45%    
client [65] (testset)   loss: 0.0054 -> 0.0045  accuracy: 99.57% -> 99.57%     
client [95] (testset)   loss: 0.0286 -> 0.0305  accuracy: 99.06% -> 99.06%     
client [17] (testset)   loss: 0.0623 -> 0.0585  accuracy: 98.39% -> 98.39%     
client [8]  (testset)   loss: 0.0003 -> 0.0002  accuracy: 100.00% -> 100.00%   
client [35] (testset)   loss: 0.0099 -> 0.0082  accuracy: 100.00% -> 100.00%   
client [98] (testset)   loss: 0.0352 -> 0.0327  accuracy: 98.10% -> 99.05%     
client [53] (testset)   loss: 0.0020 -> 0.0020  accuracy: 100.00% -> 100.00%   
client [43] (testset)   loss: 0.1897 -> 0.1867  accuracy: 97.62% -> 97.62%     
client [64] (testset)   loss: 0.0105 -> 0.0137  accuracy: 100.00% -> 100.00%   
---------------------------- TRAINING EPOCH: 130 ----------------------------  
client [21] (testset)   loss: 0.0173 -> 0.0167  accuracy: 99.52% -> 99.52%     
client [88] (testset)   loss: 0.0002 -> 0.0002  accuracy: 100.00% -> 100.00%   
client [38] (testset)   loss: 0.0342 -> 0.0312  accuracy: 98.95% -> 98.95%     
client [3]  (testset)   loss: 0.1113 -> 0.1127  accuracy: 97.98% -> 97.98%     
client [5]  (testset)   loss: 0.0801 -> 0.0842  accuracy: 98.24% -> 98.24%     
client [41] (testset)   loss: 0.0540 -> 0.0582  accuracy: 97.31% -> 97.76%     
client [7]  (testset)   loss: 0.0044 -> 0.0041  accuracy: 99.56% -> 99.56%     
client [37] (testset)   loss: 0.0383 -> 0.0346  accuracy: 99.17% -> 99.17%     
client [45] (testset)   loss: 0.0374 -> 0.0373  accuracy: 99.30% -> 99.30%     
client [47] (testset)   loss: 0.0296 -> 0.0324  accuracy: 99.43% -> 99.24%     
---------------------------- TRAINING EPOCH: 140 ----------------------------  
client [16] (testset)   loss: 0.1480 -> 0.1426  accuracy: 94.96% -> 94.96%     
client [11] (testset)   loss: 0.0172 -> 0.0229  accuracy: 99.10% -> 99.10%     
client [37] (testset)   loss: 0.0155 -> 0.0134  accuracy: 99.17% -> 99.17%     
client [41] (testset)   loss: 0.0583 -> 0.0633  accuracy: 98.21% -> 98.21%     
client [95] (testset)   loss: 0.0319 -> 0.0357  accuracy: 99.06% -> 98.59%     
client [53] (testset)   loss: 0.0022 -> 0.0019  accuracy: 100.00% -> 100.00%   
client [22] (testset)   loss: 0.0081 -> 0.0055  accuracy: 99.26% -> 100.00%    
client [25] (testset)   loss: 0.0400 -> 0.0381  accuracy: 98.59% -> 98.59%     
client [69] (testset)   loss: 0.0617 -> 0.0691  accuracy: 98.57% -> 98.57%     
client [46] (testset)   loss: 0.0156 -> 0.0174  accuracy: 99.08% -> 99.08%     
---------------------------- TRAINING EPOCH: 150 ----------------------------  
client [47] (testset)   loss: 0.0281 -> 0.0306  accuracy: 99.43% -> 99.43%     
client [69] (testset)   loss: 0.0762 -> 0.0733  accuracy: 98.57% -> 98.57%     
client [82] (testset)   loss: 0.0612 -> 0.0665  accuracy: 99.24% -> 98.74%     
client [45] (testset)   loss: 0.0381 -> 0.0349  accuracy: 99.30% -> 99.30%     
client [7]  (testset)   loss: 0.0060 -> 0.0035  accuracy: 99.56% -> 100.00%    
client [50] (testset)   loss: 0.0344 -> 0.0334  accuracy: 98.88% -> 98.88%     
client [35] (testset)   loss: 0.0094 -> 0.0062  accuracy: 100.00% -> 100.00%   
client [24] (testset)   loss: 0.0008 -> 0.0006  accuracy: 100.00% -> 100.00%   
client [15] (testset)   loss: 0.0221 -> 0.0186  accuracy: 98.71% -> 100.00%    
client [58] (testset)   loss: 0.0727 -> 0.0816  accuracy: 99.49% -> 98.98%     
---------------------------- TRAINING EPOCH: 160 ----------------------------  
client [48] (testset)   loss: 0.0144 -> 0.0134  accuracy: 99.29% -> 99.29%     
client [76] (testset)   loss: 0.0064 -> 0.0082  accuracy: 99.45% -> 99.45%     
client [67] (testset)   loss: 0.0042 -> 0.0050  accuracy: 100.00% -> 100.00%   
client [37] (testset)   loss: 0.0203 -> 0.0215  accuracy: 99.17% -> 99.17%     
client [58] (testset)   loss: 0.0740 -> 0.0785  accuracy: 99.49% -> 98.98%     
client [64] (testset)   loss: 0.0118 -> 0.0118  accuracy: 100.00% -> 100.00%   
client [77] (testset)   loss: 0.1149 -> 0.1191  accuracy: 95.29% -> 95.29%     
client [55] (testset)   loss: 0.0012 -> 0.0008  accuracy: 100.00% -> 100.00%   
client [12] (testset)   loss: 0.0443 -> 0.0457  accuracy: 99.29% -> 99.29%     
client [89] (testset)   loss: 0.0180 -> 0.0171  accuracy: 99.15% -> 99.15%     
---------------------------- TRAINING EPOCH: 170 ----------------------------  
client [84] (testset)   loss: 0.0078 -> 0.0084  accuracy: 99.55% -> 99.55%     
client [51] (testset)   loss: 0.0175 -> 0.0170  accuracy: 99.00% -> 99.00%     
client [8]  (testset)   loss: 0.0001 -> 0.0001  accuracy: 100.00% -> 100.00%   
client [18] (testset)   loss: 0.0554 -> 0.0583  accuracy: 99.26% -> 99.26%     
client [94] (testset)   loss: 0.0195 -> 0.0237  accuracy: 99.39% -> 99.39%     
client [81] (testset)   loss: 0.0236 -> 0.0200  accuracy: 99.17% -> 98.76%     
client [3]  (testset)   loss: 0.1163 -> 0.1158  accuracy: 97.98% -> 97.98%     
client [11] (testset)   loss: 0.0147 -> 0.0179  accuracy: 99.55% -> 99.55%     
client [95] (testset)   loss: 0.0322 -> 0.0332  accuracy: 99.06% -> 99.06%     
client [67] (testset)   loss: 0.0051 -> 0.0066  accuracy: 100.00% -> 99.43%    
---------------------------- TRAINING EPOCH: 180 ----------------------------  
client [21] (testset)   loss: 0.0165 -> 0.0161  accuracy: 99.52% -> 99.52%     
client [79] (testset)   loss: 0.1340 -> 0.1346  accuracy: 98.64% -> 98.64%     
client [58] (testset)   loss: 0.0803 -> 0.0838  accuracy: 99.49% -> 98.98%     
client [88] (testset)   loss: 0.0002 -> 0.0002  accuracy: 100.00% -> 100.00%   
client [46] (testset)   loss: 0.0144 -> 0.0163  accuracy: 99.08% -> 99.08%     
client [11] (testset)   loss: 0.0127 -> 0.0175  accuracy: 99.10% -> 99.10%     
client [55] (testset)   loss: 0.0007 -> 0.0008  accuracy: 100.00% -> 100.00%   
client [13] (testset)   loss: 0.0342 -> 0.0353  accuracy: 99.07% -> 98.76%     
client [31] (testset)   loss: 0.0264 -> 0.0287  accuracy: 98.93% -> 98.93%     
client [75] (testset)   loss: 0.0005 -> 0.0005  accuracy: 100.00% -> 100.00%   
---------------------------- TRAINING EPOCH: 190 ----------------------------  
client [19] (testset)   loss: 0.0002 -> 0.0002  accuracy: 100.00% -> 100.00%   
client [7]  (testset)   loss: 0.0021 -> 0.0018  accuracy: 100.00% -> 100.00%   
client [57] (testset)   loss: 0.0092 -> 0.0085  accuracy: 98.94% -> 98.94%     
client [13] (testset)   loss: 0.0316 -> 0.0360  accuracy: 99.07% -> 98.76%     
client [43] (testset)   loss: 0.2226 -> 0.2226  accuracy: 97.62% -> 97.62%     
client [91] (testset)   loss: 0.0218 -> 0.0220  accuracy: 99.12% -> 99.12%     
client [10] (testset)   loss: 0.0031 -> 0.0032  accuracy: 100.00% -> 100.00%   
client [64] (testset)   loss: 0.0085 -> 0.0091  accuracy: 100.00% -> 100.00%   
client [82] (testset)   loss: 0.0699 -> 0.0744  accuracy: 98.99% -> 98.74%     
client [22] (testset)   loss: 0.0079 -> 0.0070  accuracy: 99.26% -> 99.26%     
---------------------------- TRAINING EPOCH: 200 ----------------------------  
client [20] (testset)   loss: 0.0100 -> 0.0076  accuracy: 99.30% -> 100.00%    
client [23] (testset)   loss: 0.0057 -> 0.0072  accuracy: 100.00% -> 99.13%    
client [88] (testset)   loss: 0.0001 -> 0.0001  accuracy: 100.00% -> 100.00%   
client [98] (testset)   loss: 0.0394 -> 0.0401  accuracy: 98.10% -> 98.10%     
client [79] (testset)   loss: 0.1358 -> 0.1363  accuracy: 98.64% -> 98.64%     
client [21] (testset)   loss: 0.0143 -> 0.0147  accuracy: 99.52% -> 99.52%     
client [92] (testset)   loss: 0.1584 -> 0.1565  accuracy: 98.25% -> 98.25%     
client [56] (testset)   loss: 0.0215 -> 0.0235  accuracy: 98.85% -> 98.85%     
client [5]  (testset)   loss: 0.0941 -> 0.0963  accuracy: 98.24% -> 98.24%     
client [52] (testset)   loss: 0.1295 -> 0.1308  accuracy: 97.40% -> 97.40%     
---------------------------- TRAINING EPOCH: 210 ----------------------------  
client [67] (testset)   loss: 0.0023 -> 0.0026  accuracy: 100.00% -> 100.00%   
client [54] (testset)   loss: 0.0004 -> 0.0005  accuracy: 100.00% -> 100.00%   
client [14] (testset)   loss: 0.0208 -> 0.0215  accuracy: 98.86% -> 98.86%     
client [99] (testset)   loss: 0.0330 -> 0.0338  accuracy: 98.22% -> 97.63%     
client [36] (testset)   loss: 0.0113 -> 0.0180  accuracy: 99.61% -> 99.23%     
client [30] (testset)   loss: 0.0046 -> 0.0058  accuracy: 100.00% -> 99.35%    
client [38] (testset)   loss: 0.0219 -> 0.0248  accuracy: 98.95% -> 98.95%     
client [15] (testset)   loss: 0.0090 -> 0.0135  accuracy: 100.00% -> 99.35%    
client [6]  (testset)   loss: 0.0806 -> 0.0838  accuracy: 98.68% -> 98.68%     
client [53] (testset)   loss: 0.0009 -> 0.0009  accuracy: 100.00% -> 100.00%   
---------------------------- TRAINING EPOCH: 220 ----------------------------  
client [99] (testset)   loss: 0.0397 -> 0.0380  accuracy: 97.63% -> 97.63%     
client [6]  (testset)   loss: 0.0772 -> 0.0824  accuracy: 99.34% -> 98.68%     
client [83] (testset)   loss: 0.1281 -> 0.1238  accuracy: 99.16% -> 99.16%     
client [42] (testset)   loss: 0.0680 -> 0.0692  accuracy: 99.04% -> 99.04%     
client [34] (testset)   loss: 0.0562 -> 0.0546  accuracy: 98.88% -> 98.88%     
client [15] (testset)   loss: 0.0141 -> 0.0176  accuracy: 99.35% -> 98.71%     
client [47] (testset)   loss: 0.0348 -> 0.0334  accuracy: 99.43% -> 99.24%     
client [55] (testset)   loss: 0.0006 -> 0.0006  accuracy: 100.00% -> 100.00%   
client [51] (testset)   loss: 0.0205 -> 0.0207  accuracy: 99.00% -> 99.00%     
client [95] (testset)   loss: 0.0348 -> 0.0339  accuracy: 99.06% -> 99.06%     
---------------------------- TRAINING EPOCH: 230 ----------------------------  
client [71] (testset)   loss: 0.0001 -> 0.0001  accuracy: 100.00% -> 100.00%   
client [15] (testset)   loss: 0.0103 -> 0.0129  accuracy: 100.00% -> 99.35%    
client [33] (testset)   loss: 0.0516 -> 0.0452  accuracy: 98.34% -> 98.34%     
client [99] (testset)   loss: 0.0346 -> 0.0339  accuracy: 98.22% -> 97.63%     
client [90] (testset)   loss: 0.0010 -> 0.0010  accuracy: 100.00% -> 100.00%   
client [57] (testset)   loss: 0.0054 -> 0.0053  accuracy: 100.00% -> 100.00%   
client [27] (testset)   loss: 0.1386 -> 0.1416  accuracy: 97.97% -> 97.97%     
client [78] (testset)   loss: 0.0004 -> 0.0002  accuracy: 100.00% -> 100.00%   
client [36] (testset)   loss: 0.0103 -> 0.0186  accuracy: 99.61% -> 98.84%     
client [88] (testset)   loss: 0.0001 -> 0.0001  accuracy: 100.00% -> 100.00%   
---------------------------- TRAINING EPOCH: 240 ----------------------------  
client [70] (testset)   loss: 0.0001 -> 0.0001  accuracy: 100.00% -> 100.00%   
client [35] (testset)   loss: 0.0151 -> 0.0131  accuracy: 99.16% -> 100.00%    
client [16] (testset)   loss: 0.1150 -> 0.1147  accuracy: 95.80% -> 95.80%     
client [80] (testset)   loss: 0.0020 -> 0.0021  accuracy: 100.00% -> 100.00%   
client [38] (testset)   loss: 0.0255 -> 0.0265  accuracy: 98.95% -> 98.95%     
client [78] (testset)   loss: 0.0001 -> 0.0002  accuracy: 100.00% -> 100.00%   
client [68] (testset)   loss: 0.0046 -> 0.0072  accuracy: 100.00% -> 99.11%    
client [11] (testset)   loss: 0.0200 -> 0.0221  accuracy: 99.10% -> 99.10%     
client [64] (testset)   loss: 0.0064 -> 0.0066  accuracy: 100.00% -> 100.00%   
client [82] (testset)   loss: 0.0718 -> 0.0765  accuracy: 98.99% -> 98.74%     
---------------------------- TRAINING EPOCH: 250 ----------------------------  
client [30] (testset)   loss: 0.0051 -> 0.0070  accuracy: 100.00% -> 99.35%    
client [27] (testset)   loss: 0.1402 -> 0.1431  accuracy: 97.97% -> 97.97%     
client [74] (testset)   loss: 0.0708 -> 0.0676  accuracy: 98.70% -> 98.70%     
client [45] (testset)   loss: 0.0390 -> 0.0409  accuracy: 99.30% -> 99.30%     
client [6]  (testset)   loss: 0.0744 -> 0.0914  accuracy: 99.34% -> 98.68%     
client [36] (testset)   loss: 0.0071 -> 0.0154  accuracy: 99.61% -> 98.84%     
client [63] (testset)   loss: 0.0871 -> 0.0848  accuracy: 98.61% -> 99.07%     
client [76] (testset)   loss: 0.0066 -> 0.0119  accuracy: 99.45% -> 98.91%     
client [83] (testset)   loss: 0.1271 -> 0.1214  accuracy: 99.16% -> 99.16%     
client [86] (testset)   loss: 0.0893 -> 0.0913  accuracy: 98.98% -> 98.98%     
---------------------------- TRAINING EPOCH: 260 ----------------------------  
client [83] (testset)   loss: 0.1299 -> 0.1288  accuracy: 99.16% -> 99.16%     
client [99] (testset)   loss: 0.0378 -> 0.0377  accuracy: 98.22% -> 97.63%     
client [74] (testset)   loss: 0.0695 -> 0.0709  accuracy: 98.70% -> 98.70%     
client [73] (testset)   loss: 0.0508 -> 0.0568  accuracy: 99.42% -> 99.42%     
client [29] (testset)   loss: 0.0111 -> 0.0039  accuracy: 99.42% -> 100.00%    
client [92] (testset)   loss: 0.2104 -> 0.1810  accuracy: 98.25% -> 98.25%     
client [6]  (testset)   loss: 0.1055 -> 0.1041  accuracy: 98.68% -> 98.68%     
client [61] (testset)   loss: 0.1488 -> 0.1541  accuracy: 98.74% -> 98.74%     
client [21] (testset)   loss: 0.0170 -> 0.0162  accuracy: 99.52% -> 99.52%     
client [67] (testset)   loss: 0.0030 -> 0.0035  accuracy: 100.00% -> 100.00%   
---------------------------- TRAINING EPOCH: 270 ----------------------------  
client [83] (testset)   loss: 0.1300 -> 0.1286  accuracy: 99.16% -> 99.16%     
client [32] (testset)   loss: 0.0222 -> 0.0216  accuracy: 99.24% -> 99.24%     
client [95] (testset)   loss: 0.0321 -> 0.0329  accuracy: 99.06% -> 99.06%     
client [61] (testset)   loss: 0.1587 -> 0.1605  accuracy: 98.74% -> 98.74%     
client [27] (testset)   loss: 0.1418 -> 0.1446  accuracy: 97.97% -> 97.97%     
client [25] (testset)   loss: 0.0376 -> 0.0391  accuracy: 98.59% -> 98.59%     
client [68] (testset)   loss: 0.0046 -> 0.0075  accuracy: 100.00% -> 99.55%    
client [34] (testset)   loss: 0.0582 -> 0.0554  accuracy: 98.88% -> 98.88%     
client [71] (testset)   loss: 0.0002 -> 0.0002  accuracy: 100.00% -> 100.00%   
client [89] (testset)   loss: 0.0133 -> 0.0138  accuracy: 99.15% -> 99.15%     
---------------------------- TRAINING EPOCH: 280 ----------------------------  
client [78] (testset)   loss: 0.0001 -> 0.0001  accuracy: 100.00% -> 100.00%   
client [81] (testset)   loss: 0.0257 -> 0.0238  accuracy: 99.17% -> 98.76%     
client [51] (testset)   loss: 0.0153 -> 0.0170  accuracy: 99.00% -> 99.00%     
client [54] (testset)   loss: 0.0010 -> 0.0009  accuracy: 100.00% -> 100.00%   
client [65] (testset)   loss: 0.0018 -> 0.0017  accuracy: 100.00% -> 100.00%   
client [41] (testset)   loss: 0.0487 -> 0.0553  accuracy: 98.65% -> 97.76%     
client [11] (testset)   loss: 0.0178 -> 0.0205  accuracy: 99.10% -> 99.10%     
client [85] (testset)   loss: 0.0341 -> 0.0336  accuracy: 99.25% -> 99.25%     
client [12] (testset)   loss: 0.0395 -> 0.0414  accuracy: 98.58% -> 99.29%     
client [23] (testset)   loss: 0.0041 -> 0.0052  accuracy: 100.00% -> 100.00%   
---------------------------- TRAINING EPOCH: 290 ----------------------------  
client [16] (testset)   loss: 0.1171 -> 0.1174  accuracy: 95.80% -> 95.80%     
client [65] (testset)   loss: 0.0017 -> 0.0017  accuracy: 100.00% -> 100.00%   
client [53] (testset)   loss: 0.0007 -> 0.0007  accuracy: 100.00% -> 100.00%   
client [58] (testset)   loss: 0.0848 -> 0.0878  accuracy: 99.49% -> 98.98%     
client [72] (testset)   loss: 0.0166 -> 0.0157  accuracy: 99.38% -> 99.38%     
client [7]  (testset)   loss: 0.0032 -> 0.0028  accuracy: 99.56% -> 100.00%    
client [71] (testset)   loss: 0.0001 -> 0.0001  accuracy: 100.00% -> 100.00%   
client [59] (testset)   loss: 0.0391 -> 0.0399  accuracy: 97.92% -> 97.92%     
client [86] (testset)   loss: 0.0787 -> 0.0834  accuracy: 98.98% -> 98.98%     
client [39] (testset)   loss: 0.1898 -> 0.1905  accuracy: 98.16% -> 98.16%     
---------------------------- TRAINING EPOCH: 300 ----------------------------  
client [99] (testset)   loss: 0.0328 -> 0.0362  accuracy: 98.22% -> 98.22%     
client [7]  (testset)   loss: 0.0035 -> 0.0028  accuracy: 99.56% -> 100.00%    
client [17] (testset)   loss: 0.0588 -> 0.0590  accuracy: 98.39% -> 98.39%     
client [64] (testset)   loss: 0.0077 -> 0.0073  accuracy: 100.00% -> 100.00%   
client [37] (testset)   loss: 0.0210 -> 0.0209  accuracy: 99.17% -> 99.17%     
client [29] (testset)   loss: 0.0109 -> 0.0083  accuracy: 99.42% -> 99.42%     
client [93] (testset)   loss: 0.0120 -> 0.0135  accuracy: 99.29% -> 99.29%     
client [73] (testset)   loss: 0.0522 -> 0.0567  accuracy: 99.42% -> 99.42%     
client [40] (testset)   loss: 0.0156 -> 0.0163  accuracy: 99.66% -> 99.66%     
client [76] (testset)   loss: 0.0053 -> 0.0061  accuracy: 100.00% -> 100.00%   
---------------------------- TRAINING EPOCH: 310 ----------------------------  
client [31] (testset)   loss: 0.0431 -> 0.0412  accuracy: 98.93% -> 98.93%     
client [89] (testset)   loss: 0.0209 -> 0.0212  accuracy: 99.15% -> 99.15%     
client [77] (testset)   loss: 0.1069 -> 0.1090  accuracy: 95.29% -> 95.29%     
client [90] (testset)   loss: 0.0009 -> 0.0008  accuracy: 100.00% -> 100.00%   
client [26] (testset)   loss: 0.0146 -> 0.0129  accuracy: 99.19% -> 99.19%     
client [50] (testset)   loss: 0.0340 -> 0.0336  accuracy: 98.88% -> 98.88%     
client [30] (testset)   loss: 0.0093 -> 0.0098  accuracy: 99.35% -> 99.35%     
client [70] (testset)   loss: 0.0001 -> 0.0001  accuracy: 100.00% -> 100.00%   
client [41] (testset)   loss: 0.0632 -> 0.0627  accuracy: 97.76% -> 97.76%     
client [99] (testset)   loss: 0.0377 -> 0.0373  accuracy: 98.22% -> 98.22%     
---------------------------- TRAINING EPOCH: 320 ----------------------------  
client [68] (testset)   loss: 0.0053 -> 0.0064  accuracy: 100.00% -> 100.00%   
client [70] (testset)   loss: 0.0000 -> 0.0000  accuracy: 100.00% -> 100.00%   
client [52] (testset)   loss: 0.1362 -> 0.1367  accuracy: 98.70% -> 98.70%     
client [1]  (testset)   loss: 0.0812 -> 0.0806  accuracy: 98.31% -> 98.31%     
client [2]  (testset)   loss: 0.0024 -> 0.0022  accuracy: 100.00% -> 100.00%   
client [67] (testset)   loss: 0.0023 -> 0.0025  accuracy: 100.00% -> 100.00%   
client [92] (testset)   loss: 0.1834 -> 0.1826  accuracy: 98.25% -> 98.25%     
client [35] (testset)   loss: 0.0187 -> 0.0180  accuracy: 98.32% -> 98.32%     
client [36] (testset)   loss: 0.0156 -> 0.0177  accuracy: 99.61% -> 99.23%     
client [64] (testset)   loss: 0.0071 -> 0.0067  accuracy: 100.00% -> 100.00%   
---------------------------- TRAINING EPOCH: 330 ----------------------------  
client [44] (testset)   loss: 0.0458 -> 0.0443  accuracy: 98.87% -> 99.15%     
client [6]  (testset)   loss: 0.0771 -> 0.1079  accuracy: 99.34% -> 98.68%     
client [12] (testset)   loss: 0.0516 -> 0.0518  accuracy: 99.29% -> 99.29%     
client [55] (testset)   loss: 0.0006 -> 0.0006  accuracy: 100.00% -> 100.00%   
client [29] (testset)   loss: 0.0061 -> 0.0056  accuracy: 99.42% -> 99.42%     
client [9]  (testset)   loss: 0.0000 -> 0.0000  accuracy: 100.00% -> 100.00%   
client [43] (testset)   loss: 0.2388 -> 0.2372  accuracy: 97.62% -> 97.62%     
client [77] (testset)   loss: 0.1170 -> 0.1190  accuracy: 95.29% -> 95.29%     
client [98] (testset)   loss: 0.0561 -> 0.0558  accuracy: 98.10% -> 98.10%     
client [78] (testset)   loss: 0.0001 -> 0.0001  accuracy: 100.00% -> 100.00%   
---------------------------- TRAINING EPOCH: 340 ----------------------------  
client [92] (testset)   loss: 0.1861 -> 0.1853  accuracy: 98.25% -> 98.25%     
client [80] (testset)   loss: 0.0014 -> 0.0014  accuracy: 100.00% -> 100.00%   
client [63] (testset)   loss: 0.0930 -> 0.0879  accuracy: 98.61% -> 98.61%     
client [76] (testset)   loss: 0.0074 -> 0.0082  accuracy: 99.45% -> 99.45%     
client [78] (testset)   loss: 0.0001 -> 0.0001  accuracy: 100.00% -> 100.00%   
client [25] (testset)   loss: 0.0409 -> 0.0416  accuracy: 98.59% -> 98.59%     
client [58] (testset)   loss: 0.0868 -> 0.0886  accuracy: 98.98% -> 98.98%     
client [13] (testset)   loss: 0.0374 -> 0.0386  accuracy: 98.76% -> 98.45%     
client [17] (testset)   loss: 0.0636 -> 0.0634  accuracy: 98.39% -> 98.39%     
client [38] (testset)   loss: 0.0236 -> 0.0235  accuracy: 98.95% -> 98.95%     
---------------------------- TRAINING EPOCH: 350 ----------------------------  
client [72] (testset)   loss: 0.0171 -> 0.0163  accuracy: 99.38% -> 99.38%     
client [82] (testset)   loss: 0.0771 -> 0.0792  accuracy: 98.74% -> 98.74%     
client [86] (testset)   loss: 0.0776 -> 0.0814  accuracy: 98.98% -> 98.98%     
client [51] (testset)   loss: 0.0137 -> 0.0146  accuracy: 99.50% -> 99.50%     
client [96] (testset)   loss: 0.0099 -> 0.0098  accuracy: 99.65% -> 99.65%     
client [42] (testset)   loss: 0.0705 -> 0.0709  accuracy: 99.04% -> 99.04%     
client [55] (testset)   loss: 0.0005 -> 0.0005  accuracy: 100.00% -> 100.00%   
client [13] (testset)   loss: 0.0385 -> 0.0383  accuracy: 98.45% -> 98.45%     
client [1]  (testset)   loss: 0.0785 -> 0.0795  accuracy: 98.31% -> 98.31%     
client [12] (testset)   loss: 0.0466 -> 0.0479  accuracy: 99.29% -> 99.29%     
---------------------------- TRAINING EPOCH: 360 ----------------------------  
client [68] (testset)   loss: 0.0047 -> 0.0056  accuracy: 100.00% -> 100.00%   
client [23] (testset)   loss: 0.0040 -> 0.0053  accuracy: 100.00% -> 100.00%   
client [46] (testset)   loss: 0.0181 -> 0.0180  accuracy: 99.08% -> 99.08%     
client [41] (testset)   loss: 0.0619 -> 0.0629  accuracy: 97.76% -> 97.76%     
client [25] (testset)   loss: 0.0384 -> 0.0382  accuracy: 98.59% -> 98.59%     
client [58] (testset)   loss: 0.0888 -> 0.0911  accuracy: 99.49% -> 98.98%     
client [14] (testset)   loss: 0.0203 -> 0.0200  accuracy: 98.86% -> 98.86%     
client [33] (testset)   loss: 0.0364 -> 0.0365  accuracy: 98.90% -> 98.90%     
client [85] (testset)   loss: 0.0374 -> 0.0361  accuracy: 99.25% -> 99.25%     
client [62] (testset)   loss: 0.0437 -> 0.0449  accuracy: 99.39% -> 99.39%     
---------------------------- TRAINING EPOCH: 370 ----------------------------  
client [98] (testset)   loss: 0.0555 -> 0.0546  accuracy: 98.10% -> 98.10%     
client [63] (testset)   loss: 0.0933 -> 0.0882  accuracy: 98.61% -> 99.07%     
client [70] (testset)   loss: 0.0000 -> 0.0000  accuracy: 100.00% -> 100.00%   
client [65] (testset)   loss: 0.0011 -> 0.0011  accuracy: 100.00% -> 100.00%   
client [14] (testset)   loss: 0.0180 -> 0.0183  accuracy: 98.30% -> 98.30%     
client [73] (testset)   loss: 0.0585 -> 0.0607  accuracy: 99.42% -> 99.42%     
client [34] (testset)   loss: 0.0567 -> 0.0568  accuracy: 98.88% -> 98.88%     
client [99] (testset)   loss: 0.0375 -> 0.0351  accuracy: 98.22% -> 98.22%     
client [69] (testset)   loss: 0.0803 -> 0.0831  accuracy: 98.57% -> 98.57%     
client [46] (testset)   loss: 0.0184 -> 0.0182  accuracy: 99.08% -> 99.08%     
---------------------------- TRAINING EPOCH: 380 ----------------------------  
client [99] (testset)   loss: 0.0273 -> 0.0296  accuracy: 99.41% -> 98.82%     
client [93] (testset)   loss: 0.0135 -> 0.0163  accuracy: 99.29% -> 99.29%     
client [11] (testset)   loss: 0.0183 -> 0.0210  accuracy: 99.55% -> 99.55%     
client [58] (testset)   loss: 0.0937 -> 0.0933  accuracy: 98.98% -> 98.98%     
client [81] (testset)   loss: 0.0254 -> 0.0243  accuracy: 98.76% -> 98.76%     
client [85] (testset)   loss: 0.0362 -> 0.0353  accuracy: 99.25% -> 99.25%     
client [89] (testset)   loss: 0.0182 -> 0.0184  accuracy: 99.15% -> 99.15%     
client [45] (testset)   loss: 0.0451 -> 0.0459  accuracy: 99.30% -> 99.30%     
client [8]  (testset)   loss: 0.0000 -> 0.0000  accuracy: 100.00% -> 100.00%   
client [68] (testset)   loss: 0.0057 -> 0.0061  accuracy: 99.55% -> 99.55%     
---------------------------- TRAINING EPOCH: 390 ----------------------------  
client [67] (testset)   loss: 0.0020 -> 0.0025  accuracy: 100.00% -> 100.00%   
client [72] (testset)   loss: 0.0159 -> 0.0157  accuracy: 99.38% -> 99.38%     
client [1]  (testset)   loss: 0.0809 -> 0.0813  accuracy: 98.31% -> 98.31%     
client [78] (testset)   loss: 0.0001 -> 0.0001  accuracy: 100.00% -> 100.00%   
client [83] (testset)   loss: 0.1368 -> 0.1362  accuracy: 99.16% -> 99.16%     
client [21] (testset)   loss: 0.0203 -> 0.0199  accuracy: 99.52% -> 99.52%     
client [56] (testset)   loss: 0.0297 -> 0.0302  accuracy: 98.46% -> 98.46%     
client [44] (testset)   loss: 0.0452 -> 0.0461  accuracy: 98.87% -> 98.87%     
client [92] (testset)   loss: 0.1877 -> 0.1867  accuracy: 98.25% -> 98.25%     
client [27] (testset)   loss: 0.1456 -> 0.1486  accuracy: 97.97% -> 97.97%     
---------------------------- TRAINING EPOCH: 400 ----------------------------  
client [10] (testset)   loss: 0.0032 -> 0.0031  accuracy: 100.00% -> 100.00%   
client [39] (testset)   loss: 0.1956 -> 0.1958  accuracy: 98.16% -> 98.16%     
client [65] (testset)   loss: 0.0012 -> 0.0011  accuracy: 100.00% -> 100.00%   
client [26] (testset)   loss: 0.0173 -> 0.0155  accuracy: 99.19% -> 99.19%     
client [19] (testset)   loss: 0.0001 -> 0.0001  accuracy: 100.00% -> 100.00%   
client [68] (testset)   loss: 0.0064 -> 0.0069  accuracy: 100.00% -> 100.00%   
client [41] (testset)   loss: 0.0603 -> 0.0612  accuracy: 97.76% -> 97.76%     
client [50] (testset)   loss: 0.0387 -> 0.0384  accuracy: 98.88% -> 98.88%     
client [75] (testset)   loss: 0.0001 -> 0.0001  accuracy: 100.00% -> 100.00%   
client [81] (testset)   loss: 0.0239 -> 0.0237  accuracy: 99.17% -> 98.76%     
Training... ---------------------------------------- 100% 0:14:16
FedRoD's average time taken by each global epoch: 0 min 2.13 sec.              
FedRoD's total running time: 0 h 14 m 16 s.                                    
==================== FedRoD Experiment Results: ====================           
Display format: (before local fine-tuning) -> (after local fine-tuning)        
 So if finetune_epoch = 0, x.xx% -> 0.00% is normal.                           
 Centralized testing ONLY happens after model aggregation, so the stats between
'->' are the same.                                                             
{                                                                              
    "100": {                                                                   
        "all_clients": {                                                       
            "test": {                                                          
                "loss": "0.0352 -> 0.0000",                                    
                "accuracy": "99.16% -> 0.00%"                                  
            }                                                                  
        }                                                                      
    },                                                                         
    "200": {                                                                   
        "all_clients": {                                                       
            "test": {                                                          
                "loss": "0.0393 -> 0.0000",                                    
                "accuracy": "99.14% -> 0.00%"                                  
            }                                                                  
        }                                                                      
    },                                                                         
    "300": {                                                                   
        "all_clients": {                                                       
            "test": {                                                          
                "loss": "0.0416 -> 0.0000",                                    
                "accuracy": "99.18% -> 0.00%"                                  
            }                                                                  
        }                                                                      
    },                                                                         
    "400": {                                                                   
        "all_clients": {                                                       
            "test": {                                                          
                "loss": "0.0429 -> 0.0000",                                    
                "accuracy": "99.15% -> 0.00%"                                  
            }                                                                  
        }                                                                      
    }                                                                          
}                                                                              
==================== FedRoD Max Accuracy ====================                  
all_clients:                                                                   
(test) before fine-tuning: 99.18% at epoch 300                                 
(test) after fine-tuning: 0.00% at epoch 100                                   
[0m