==================== FedRoD ====================                               
Experiment Arguments:                                                          
{
│   'method': 'fedrod',
│   'dataset': {
│   │   'name': 'emnist',
│   │   'client_num': 100,
│   │   'test_ratio': 0.25,
│   │   'val_ratio': 0.0,
│   │   'seed': 42,
│   │   'split': 'sample',
│   │   'IID_ratio': 0.0,
│   │   'monitor_window_name_suffix': 'emnist-100clients-0%IID-Dir(0.5)-seed42',
│   │   'emnist_split': 'byclass',
│   │   'alpha': 0.5,
│   │   'min_samples_per_client': 10
│   },
│   'model': {
│   │   'name': 'avgcnn',
│   │   'use_torchvision_pretrained_weights': True,
│   │   'external_model_weights_path': None
│   },
│   'optimizer': {
│   │   'lr': 0.01,
│   │   'dampening': 0,
│   │   'weight_decay': 0,
│   │   'momentum': 0,
│   │   'nesterov': False,
│   │   'name': 'sgd'
│   },
│   'mode': 'serial',
│   'parallel': {
│   │   'ray_cluster_addr': None,
│   │   'num_cpus': None,
│   │   'num_gpus': None,
│   │   'num_workers': 2
│   },
│   'common': {
│   │   'seed': 42,
│   │   'join_ratio': 0.1,
│   │   'global_epoch': 400,
│   │   'local_epoch': 5,
│   │   'batch_size': 32,
│   │   'reset_optimizer_on_global_epoch': True,
│   │   'straggler_ratio': 0,
│   │   'straggler_min_local_epoch': 0,
│   │   'buffers': 'global',
│   │   'client_side_evaluation': True,
│   │   'test': {
│   │   │   'client': {
│   │   │   │   'interval': 100,
│   │   │   │   'finetune_epoch': 0,
│   │   │   │   'train': False,
│   │   │   │   'val': False,
│   │   │   │   'test': True
│   │   │   },
│   │   │   'server': {
│   │   │   │   'interval': -1,
│   │   │   │   'train': False,
│   │   │   │   'val': False,
│   │   │   │   'test': False,
│   │   │   │   'model_in_train_mode': False
│   │   │   }
│   │   },
│   │   'verbose_gap': 10,
│   │   'monitor': None,
│   │   'use_cuda': True,
│   │   'save_log': True,
│   │   'save_model': False,
│   │   'save_learning_curve_plot': False,
│   │   'save_metrics': True,
│   │   'delete_useless_run': True
│   },
│   'fedrod': {
│   │   'gamma': 1,
│   │   'hyper': 0,
│   │   'hyper_lr': 0.1,
│   │   'hyper_hidden_dim': 32,
│   │   'eval_per': 1
│   }
}
---------------------------- TRAINING EPOCH: 10 ----------------------------   
client [77] (testset)   loss: 0.4544 -> 0.4625  accuracy: 85.19% -> 84.97%     
client [81] (testset)   loss: 0.4397 -> 0.4393  accuracy: 85.30% -> 85.60%     
client [21] (testset)   loss: 0.9278 -> 0.3007  accuracy: 79.55% -> 91.65%     
client [68] (testset)   loss: 0.2826 -> 0.2902  accuracy: 90.46% -> 90.68%     
client [93] (testset)   loss: 0.3533 -> 0.3401  accuracy: 91.35% -> 92.32%     
client [31] (testset)   loss: 0.3589 -> 0.3191  accuracy: 87.02% -> 89.03%     
client [20] (testset)   loss: 0.3363 -> 0.3797  accuracy: 91.45% -> 91.16%     
client [59] (testset)   loss: 1.3067 -> 0.4559  accuracy: 70.66% -> 84.79%     
client [48] (testset)   loss: 0.4118 -> 0.4142  accuracy: 84.76% -> 87.21%     
client [34] (testset)   loss: 0.4046 -> 0.3906  accuracy: 89.16% -> 89.67%     
---------------------------- TRAINING EPOCH: 20 ----------------------------   
client [69] (testset)   loss: 0.2893 -> 0.6124  accuracy: 92.02% -> 86.64%     
client [99] (testset)   loss: 0.3218 -> 0.2691  accuracy: 90.91% -> 92.97%     
client [67] (testset)   loss: 0.3657 -> 0.3216  accuracy: 87.59% -> 90.29%     
client [0]  (testset)   loss: 0.2199 -> 0.2228  accuracy: 92.79% -> 94.49%     
client [76] (testset)   loss: 0.5682 -> 0.5611  accuracy: 84.58% -> 84.80%     
client [41] (testset)   loss: 0.5995 -> 0.5995  accuracy: 81.88% -> 83.29%     
client [62] (testset)   loss: 1.0180 -> 0.4232  accuracy: 71.53% -> 89.35%     
client [2]  (testset)   loss: 0.6291 -> 0.2608  accuracy: 82.73% -> 91.57%     
client [14] (testset)   loss: 0.3093 -> 0.3030  accuracy: 91.69% -> 92.60%     
client [46] (testset)   loss: 0.3084 -> 0.3250  accuracy: 91.65% -> 91.39%     
---------------------------- TRAINING EPOCH: 30 ----------------------------   
client [24] (testset)   loss: 0.3159 -> 0.3428  accuracy: 92.90% -> 92.86%     
client [68] (testset)   loss: 0.3884 -> 0.3979  accuracy: 90.65% -> 91.00%     
client [57] (testset)   loss: 0.5162 -> 0.5623  accuracy: 85.81% -> 82.42%     
client [17] (testset)   loss: 0.2953 -> 0.3066  accuracy: 91.79% -> 92.55%     
client [54] (testset)   loss: 0.3214 -> 0.3652  accuracy: 91.50% -> 91.33%     
client [23] (testset)   loss: 1.8382 -> 0.4814  accuracy: 67.03% -> 85.30%     
client [35] (testset)   loss: 0.4851 -> 0.5508  accuracy: 85.21% -> 85.67%     
client [59] (testset)   loss: 0.5031 -> 0.5379  accuracy: 83.77% -> 84.26%     
client [31] (testset)   loss: 0.3634 -> 0.4033  accuracy: 88.73% -> 88.83%     
client [9]  (testset)   loss: 0.6682 -> 0.6787  accuracy: 83.11% -> 82.00%     
---------------------------- TRAINING EPOCH: 40 ----------------------------   
client [64] (testset)   loss: 0.5603 -> 0.5660  accuracy: 85.31% -> 85.10%     
client [33] (testset)   loss: 0.5658 -> 0.6623  accuracy: 86.97% -> 86.86%     
client [16] (testset)   loss: 0.3900 -> 0.4028  accuracy: 91.77% -> 91.77%     
client [44] (testset)   loss: 0.5997 -> 0.5614  accuracy: 82.33% -> 82.33%     
client [8]  (testset)   loss: 0.3591 -> 0.3880  accuracy: 90.79% -> 91.54%     
client [31] (testset)   loss: 0.4356 -> 0.4516  accuracy: 87.47% -> 88.73%     
client [47] (testset)   loss: 0.6414 -> 0.6244  accuracy: 82.68% -> 83.27%     
client [36] (testset)   loss: 0.4259 -> 0.4216  accuracy: 88.63% -> 87.93%     
client [20] (testset)   loss: 0.4403 -> 0.4607  accuracy: 89.74% -> 90.80%     
client [56] (testset)   loss: 0.5022 -> 0.4804  accuracy: 87.99% -> 89.10%     
---------------------------- TRAINING EPOCH: 50 ----------------------------   
client [4]  (testset)   loss: 0.3876 -> 0.3672  accuracy: 90.19% -> 91.05%     
client [60] (testset)   loss: 0.2852 -> 0.2763  accuracy: 93.53% -> 93.85%     
client [28] (testset)   loss: 0.4577 -> 0.4602  accuracy: 87.46% -> 89.09%     
client [25] (testset)   loss: 0.2355 -> 0.2453  accuracy: 94.83% -> 95.24%     
client [58] (testset)   loss: 0.3834 -> 0.3949  accuracy: 91.96% -> 91.68%     
client [44] (testset)   loss: 0.6278 -> 0.6170  accuracy: 82.60% -> 82.67%     
client [39] (testset)   loss: 0.5193 -> 0.5503  accuracy: 85.71% -> 85.93%     
client [29] (testset)   loss: 0.6519 -> 0.6830  accuracy: 84.64% -> 83.95%     
client [3]  (testset)   loss: 0.2193 -> 0.2265  accuracy: 94.24% -> 94.03%     
client [84] (testset)   loss: 0.3943 -> 0.4024  accuracy: 91.74% -> 91.91%     
---------------------------- TRAINING EPOCH: 60 ----------------------------   
client [21] (testset)   loss: 0.3341 -> 0.3625  accuracy: 92.25% -> 92.03%     
client [84] (testset)   loss: 0.3830 -> 0.4235  accuracy: 91.74% -> 92.20%     
client [10] (testset)   loss: 0.4480 -> 0.4872  accuracy: 89.99% -> 89.99%     
client [36] (testset)   loss: 0.4919 -> 0.5244  accuracy: 88.73% -> 87.38%     
client [65] (testset)   loss: 0.6004 -> 0.6522  accuracy: 86.03% -> 86.30%     
client [81] (testset)   loss: 0.6831 -> 0.6898  accuracy: 82.81% -> 84.72%     
client [79] (testset)   loss: 0.2687 -> 0.2605  accuracy: 93.23% -> 94.18%     
client [42] (testset)   loss: 0.3732 -> 0.3780  accuracy: 91.73% -> 92.62%     
client [11] (testset)   loss: 0.2764 -> 0.2737  accuracy: 93.76% -> 94.41%     
client [96] (testset)   loss: 0.5338 -> 0.5485  accuracy: 88.79% -> 89.75%     
---------------------------- TRAINING EPOCH: 70 ----------------------------   
client [8]  (testset)   loss: 0.4673 -> 0.4627  accuracy: 91.76% -> 92.21%     
client [53] (testset)   loss: 0.5217 -> 0.5384  accuracy: 88.12% -> 87.53%     
client [52] (testset)   loss: 0.7022 -> 0.6940  accuracy: 83.68% -> 84.97%     
client [42] (testset)   loss: 0.3856 -> 0.4120  accuracy: 91.82% -> 92.71%     
client [69] (testset)   loss: 0.4267 -> 0.4697  accuracy: 91.80% -> 92.37%     
client [59] (testset)   loss: 0.7140 -> 0.6737  accuracy: 85.17% -> 84.26%     
client [7]  (testset)   loss: 0.5076 -> 0.5306  accuracy: 87.98% -> 88.23%     
client [26] (testset)   loss: 0.4828 -> 0.5209  accuracy: 87.92% -> 89.12%     
client [49] (testset)   loss: 0.3690 -> 0.3945  accuracy: 93.06% -> 93.03%     
client [98] (testset)   loss: 0.3937 -> 0.4196  accuracy: 90.89% -> 91.33%     
---------------------------- TRAINING EPOCH: 80 ----------------------------   
client [98] (testset)   loss: 0.4155 -> 0.4158  accuracy: 91.49% -> 92.21%     
client [47] (testset)   loss: 0.8164 -> 0.7891  accuracy: 80.38% -> 83.31%     
client [21] (testset)   loss: 0.3561 -> 0.3844  accuracy: 91.80% -> 92.21%     
client [77] (testset)   loss: 0.6348 -> 0.7084  accuracy: 84.32% -> 84.49%     
client [95] (testset)   loss: 0.3293 -> 0.3638  accuracy: 93.17% -> 93.05%     
client [91] (testset)   loss: 0.6296 -> 0.6495  accuracy: 85.99% -> 86.74%     
client [14] (testset)   loss: 0.4227 -> 0.4248  accuracy: 89.02% -> 92.22%     
client [99] (testset)   loss: 0.3888 -> 0.3604  accuracy: 92.30% -> 92.64%     
client [20] (testset)   loss: 0.5539 -> 0.5734  accuracy: 89.92% -> 90.62%     
client [39] (testset)   loss: 0.7044 -> 0.6758  accuracy: 86.23% -> 85.27%     
---------------------------- TRAINING EPOCH: 90 ----------------------------   
client [52] (testset)   loss: 0.6897 -> 0.7269  accuracy: 84.93% -> 85.58%     
client [62] (testset)   loss: 0.6432 -> 0.6686  accuracy: 88.19% -> 88.04%     
client [71] (testset)   loss: 0.8150 -> 0.9403  accuracy: 81.44% -> 81.09%     
client [97] (testset)   loss: 0.3621 -> 0.3502  accuracy: 93.19% -> 92.99%     
client [30] (testset)   loss: 0.5676 -> 0.6055  accuracy: 89.10% -> 89.55%     
client [88] (testset)   loss: 0.4779 -> 0.5137  accuracy: 89.02% -> 88.97%     
client [60] (testset)   loss: 0.3288 -> 0.3584  accuracy: 93.06% -> 92.95%     
client [82] (testset)   loss: 0.7220 -> 0.7005  accuracy: 84.09% -> 86.23%     
client [91] (testset)   loss: 0.6357 -> 0.6713  accuracy: 86.59% -> 87.14%     
client [57] (testset)   loss: 0.6912 -> 0.7148  accuracy: 84.93% -> 84.53%     
---------------------------- TRAINING EPOCH: 100 ----------------------------  
client [31] (testset)   loss: 0.6249 -> 0.6600  accuracy: 86.41% -> 87.72%     
client [15] (testset)   loss: 0.6933 -> 0.6944  accuracy: 85.75% -> 85.10%     
client [71] (testset)   loss: 0.8899 -> 1.0054  accuracy: 81.04% -> 81.49%     
client [97] (testset)   loss: 0.3871 -> 0.3816  accuracy: 92.79% -> 93.11%     
client [53] (testset)   loss: 0.6481 -> 0.6307  accuracy: 86.88% -> 87.23%     
client [77] (testset)   loss: 0.7272 -> 0.7728  accuracy: 84.54% -> 84.81%     
client [76] (testset)   loss: 0.8156 -> 0.8260  accuracy: 84.91% -> 84.86%     
client [79] (testset)   loss: 0.2705 -> 0.2883  accuracy: 93.60% -> 94.40%     
client [28] (testset)   loss: 0.6017 -> 0.6195  accuracy: 87.35% -> 88.74%     
client [99] (testset)   loss: 0.3822 -> 0.3755  accuracy: 92.86% -> 92.53%     
---------------------------- TRAINING EPOCH: 110 ----------------------------  
client [97] (testset)   loss: 0.3607 -> 0.3869  accuracy: 92.47% -> 92.99%     
client [86] (testset)   loss: 0.3415 -> 0.3638  accuracy: 92.63% -> 93.22%     
client [34] (testset)   loss: 0.6273 -> 0.6896  accuracy: 88.88% -> 89.27%     
client [73] (testset)   loss: 0.7807 -> 0.8157  accuracy: 84.84% -> 85.29%     
client [5]  (testset)   loss: 0.5312 -> 0.5538  accuracy: 89.66% -> 89.66%     
client [96] (testset)   loss: 0.6977 -> 0.7065  accuracy: 88.55% -> 89.80%     
client [22] (testset)   loss: 0.9697 -> 1.0196  accuracy: 82.36% -> 82.50%     
client [60] (testset)   loss: 0.3655 -> 0.3800  accuracy: 92.90% -> 93.27%     
client [66] (testset)   loss: 0.4081 -> 0.4233  accuracy: 92.62% -> 92.62%     
client [83] (testset)   loss: 0.4776 -> 0.5117  accuracy: 90.35% -> 90.57%     
---------------------------- TRAINING EPOCH: 120 ----------------------------  
client [76] (testset)   loss: 0.8269 -> 0.8311  accuracy: 83.70% -> 84.91%     
client [65] (testset)   loss: 0.6779 -> 0.7356  accuracy: 85.76% -> 86.03%     
client [95] (testset)   loss: 0.3617 -> 0.4000  accuracy: 93.29% -> 93.09%     
client [17] (testset)   loss: 0.3784 -> 0.4080  accuracy: 92.27% -> 92.55%     
client [8]  (testset)   loss: 0.5173 -> 0.5218  accuracy: 90.41% -> 90.79%     
client [35] (testset)   loss: 0.8635 -> 0.8816  accuracy: 83.06% -> 84.10%     
client [98] (testset)   loss: 0.4673 -> 0.4800  accuracy: 91.57% -> 91.57%     
client [53] (testset)   loss: 0.6372 -> 0.6418  accuracy: 87.00% -> 86.94%     
client [43] (testset)   loss: 0.4689 -> 0.4926  accuracy: 90.58% -> 90.66%     
client [64] (testset)   loss: 0.7512 -> 0.7339  accuracy: 85.64% -> 85.75%     
---------------------------- TRAINING EPOCH: 130 ----------------------------  
client [21] (testset)   loss: 0.4243 -> 0.4464  accuracy: 91.16% -> 91.80%     
client [88] (testset)   loss: 0.6122 -> 0.6300  accuracy: 87.45% -> 88.40%     
client [38] (testset)   loss: 0.4388 -> 0.4405  accuracy: 92.16% -> 92.03%     
client [3]  (testset)   loss: 0.3054 -> 0.2986  accuracy: 94.03% -> 94.24%     
client [5]  (testset)   loss: 0.6178 -> 0.6047  accuracy: 88.48% -> 89.07%     
client [41] (testset)   loss: 0.9621 -> 0.9654  accuracy: 81.71% -> 81.80%     
client [7]  (testset)   loss: 0.5641 -> 0.5850  accuracy: 88.81% -> 88.08%     
client [37] (testset)   loss: 0.5538 -> 0.5709  accuracy: 88.20% -> 88.05%     
client [45] (testset)   loss: 0.5851 -> 0.6458  accuracy: 87.99% -> 87.74%     
client [47] (testset)   loss: 0.9204 -> 0.9297  accuracy: 81.47% -> 82.77%     
---------------------------- TRAINING EPOCH: 140 ----------------------------  
client [16] (testset)   loss: 0.4762 -> 0.4869  accuracy: 91.43% -> 91.58%     
client [11] (testset)   loss: 0.3619 -> 0.3596  accuracy: 93.81% -> 94.19%     
client [37] (testset)   loss: 0.5667 -> 0.5779  accuracy: 89.06% -> 88.35%     
client [41] (testset)   loss: 0.9262 -> 0.9546  accuracy: 83.04% -> 81.63%     
client [95] (testset)   loss: 0.3663 -> 0.3922  accuracy: 93.77% -> 93.61%     
client [53] (testset)   loss: 0.6759 -> 0.6629  accuracy: 87.53% -> 87.47%     
client [22] (testset)   loss: 1.0064 -> 1.0770  accuracy: 80.97% -> 82.01%     
client [25] (testset)   loss: 0.3040 -> 0.3278  accuracy: 94.62% -> 95.15%     
client [69] (testset)   loss: 0.4811 -> 0.5137  accuracy: 91.63% -> 92.41%     
client [46] (testset)   loss: 0.5080 -> 0.4992  accuracy: 90.60% -> 90.65%     
---------------------------- TRAINING EPOCH: 150 ----------------------------  
client [47] (testset)   loss: 1.0444 -> 1.0762  accuracy: 81.47% -> 83.40%     
client [69] (testset)   loss: 0.4670 -> 0.5321  accuracy: 91.91% -> 92.34%     
client [82] (testset)   loss: 0.8913 -> 0.8027  accuracy: 84.31% -> 86.46%     
client [45] (testset)   loss: 0.6572 -> 0.7108  accuracy: 87.74% -> 87.57%     
client [7]  (testset)   loss: 0.6047 -> 0.6259  accuracy: 87.84% -> 88.08%     
client [50] (testset)   loss: 0.4589 -> 0.4739  accuracy: 89.94% -> 89.52%     
client [35] (testset)   loss: 0.8886 -> 0.9266  accuracy: 83.78% -> 84.43%     
client [24] (testset)   loss: 0.4981 -> 0.4955  accuracy: 91.78% -> 92.06%     
client [15] (testset)   loss: 0.7747 -> 0.7766  accuracy: 84.74% -> 84.59%     
client [58] (testset)   loss: 0.5159 -> 0.5665  accuracy: 90.77% -> 91.01%     
---------------------------- TRAINING EPOCH: 160 ----------------------------  
client [48] (testset)   loss: 0.7542 -> 0.7694  accuracy: 85.76% -> 86.25%     
client [76] (testset)   loss: 0.9125 -> 0.9088  accuracy: 84.09% -> 83.98%     
client [67] (testset)   loss: 0.5381 -> 0.5568  accuracy: 88.63% -> 89.25%     
client [37] (testset)   loss: 0.5939 -> 0.6130  accuracy: 88.35% -> 88.55%     
client [58] (testset)   loss: 0.5249 -> 0.5700  accuracy: 91.20% -> 91.80%     
client [64] (testset)   loss: 0.8607 -> 0.8468  accuracy: 84.40% -> 84.94%     
client [77] (testset)   loss: 0.8425 -> 0.9033  accuracy: 83.84% -> 84.05%     
client [55] (testset)   loss: 0.8548 -> 0.8735  accuracy: 85.27% -> 86.29%     
client [12] (testset)   loss: 0.7602 -> 0.7775  accuracy: 85.27% -> 84.98%     
client [89] (testset)   loss: 0.7817 -> 0.8153  accuracy: 85.58% -> 85.64%     
---------------------------- TRAINING EPOCH: 170 ----------------------------  
client [84] (testset)   loss: 0.5577 -> 0.5806  accuracy: 91.24% -> 91.70%     
client [51] (testset)   loss: 0.4734 -> 0.5116  accuracy: 91.92% -> 92.19%     
client [8]  (testset)   loss: 0.5784 -> 0.5782  accuracy: 91.46% -> 91.46%     
client [18] (testset)   loss: 0.7479 -> 0.7550  accuracy: 85.39% -> 85.46%     
client [94] (testset)   loss: 0.5403 -> 0.5752  accuracy: 90.35% -> 90.47%     
client [81] (testset)   loss: 0.9073 -> 0.9685  accuracy: 82.37% -> 83.35%     
client [3]  (testset)   loss: 0.3137 -> 0.3141  accuracy: 94.03% -> 94.34%     
client [11] (testset)   loss: 0.3883 -> 0.3818  accuracy: 94.14% -> 94.19%     
client [95] (testset)   loss: 0.4258 -> 0.4248  accuracy: 93.41% -> 93.13%     
client [67] (testset)   loss: 0.5433 -> 0.5690  accuracy: 88.99% -> 88.84%     
---------------------------- TRAINING EPOCH: 180 ----------------------------  
client [21] (testset)   loss: 0.4406 -> 0.4771  accuracy: 91.65% -> 91.84%     
client [79] (testset)   loss: 0.3328 -> 0.3435  accuracy: 93.60% -> 94.03%     
client [58] (testset)   loss: 0.5842 -> 0.6179  accuracy: 91.32% -> 91.32%     
client [88] (testset)   loss: 0.6871 -> 0.6893  accuracy: 88.12% -> 88.35%     
client [46] (testset)   loss: 0.5204 -> 0.5416  accuracy: 90.18% -> 90.65%     
client [11] (testset)   loss: 0.3777 -> 0.3866  accuracy: 94.63% -> 94.36%     
client [55] (testset)   loss: 0.8878 -> 0.9006  accuracy: 85.22% -> 86.19%     
client [13] (testset)   loss: 0.7154 -> 0.7162  accuracy: 86.51% -> 87.12%     
client [31] (testset)   loss: 0.7254 -> 0.7507  accuracy: 87.07% -> 86.61%     
client [75] (testset)   loss: 0.7006 -> 0.7205  accuracy: 86.48% -> 86.77%     
---------------------------- TRAINING EPOCH: 190 ----------------------------  
client [19] (testset)   loss: 0.6513 -> 0.6741  accuracy: 89.31% -> 89.67%     
client [7]  (testset)   loss: 0.6587 -> 0.6667  accuracy: 87.84% -> 88.32%     
client [57] (testset)   loss: 0.9551 -> 1.0023  accuracy: 82.89% -> 84.40%     
client [13] (testset)   loss: 0.6999 -> 0.7652  accuracy: 87.06% -> 86.87%     
client [43] (testset)   loss: 0.5673 -> 0.5814  accuracy: 90.62% -> 90.88%     
client [91] (testset)   loss: 0.8019 -> 0.7938  accuracy: 86.69% -> 86.79%     
client [10] (testset)   loss: 0.6437 -> 0.6534  accuracy: 89.59% -> 89.26%     
client [64] (testset)   loss: 0.8520 -> 0.9002  accuracy: 84.99% -> 85.05%     
client [82] (testset)   loss: 0.8895 -> 0.8824  accuracy: 85.21% -> 85.89%     
client [22] (testset)   loss: 1.2473 -> 1.2406  accuracy: 81.11% -> 81.67%     
---------------------------- TRAINING EPOCH: 200 ----------------------------  
client [20] (testset)   loss: 0.6503 -> 0.6766  accuracy: 90.04% -> 90.21%     
client [23] (testset)   loss: 0.9570 -> 0.9452  accuracy: 82.37% -> 83.70%     
client [88] (testset)   loss: 0.6138 -> 0.6599  accuracy: 88.35% -> 89.20%     
client [98] (testset)   loss: 0.5135 -> 0.5270  accuracy: 91.13% -> 92.05%     
client [79] (testset)   loss: 0.3460 -> 0.3542  accuracy: 94.32% -> 94.32%     
client [21] (testset)   loss: 0.4796 -> 0.5135  accuracy: 92.21% -> 91.87%     
client [92] (testset)   loss: 0.4442 -> 0.4576  accuracy: 92.21% -> 92.12%     
client [56] (testset)   loss: 0.7102 -> 0.7431  accuracy: 87.34% -> 88.75%     
client [5]  (testset)   loss: 0.6109 -> 0.6250  accuracy: 89.44% -> 89.88%     
client [52] (testset)   loss: 0.8922 -> 0.9330  accuracy: 84.93% -> 85.07%     
---------------------------- TRAINING EPOCH: 210 ----------------------------  
client [67] (testset)   loss: 0.6251 -> 0.6496  accuracy: 88.73% -> 88.68%     
client [54] (testset)   loss: 0.5212 -> 0.5370  accuracy: 91.05% -> 91.50%     
client [14] (testset)   loss: 0.5408 -> 0.5829  accuracy: 89.83% -> 91.12%     
client [99] (testset)   loss: 0.4620 -> 0.4554  accuracy: 91.63% -> 91.75%     
client [36] (testset)   loss: 0.7602 -> 0.7761  accuracy: 87.48% -> 88.23%     
client [30] (testset)   loss: 0.6828 -> 0.7294  accuracy: 89.24% -> 89.83%     
client [38] (testset)   loss: 0.4727 -> 0.4739  accuracy: 91.87% -> 92.00%     
client [15] (testset)   loss: 0.8319 -> 0.8664  accuracy: 84.52% -> 84.16%     
client [6]  (testset)   loss: 0.8810 -> 0.9446  accuracy: 85.57% -> 85.71%     
client [53] (testset)   loss: 0.7657 -> 0.7569  accuracy: 86.94% -> 87.29%     
---------------------------- TRAINING EPOCH: 220 ----------------------------  
client [99] (testset)   loss: 0.4574 -> 0.4557  accuracy: 92.08% -> 92.02%     
client [6]  (testset)   loss: 0.9248 -> 0.9576  accuracy: 85.44% -> 85.71%     
client [83] (testset)   loss: 0.6166 -> 0.6414  accuracy: 88.46% -> 90.43%     
client [42] (testset)   loss: 0.5372 -> 0.5532  accuracy: 91.51% -> 91.64%     
client [34] (testset)   loss: 0.7577 -> 0.7800  accuracy: 88.65% -> 88.71%     
client [15] (testset)   loss: 0.8924 -> 0.8942  accuracy: 83.66% -> 83.73%     
client [47] (testset)   loss: 1.1361 -> 1.2046  accuracy: 81.64% -> 82.52%     
client [55] (testset)   loss: 0.8933 -> 0.9547  accuracy: 85.47% -> 85.68%     
client [51] (testset)   loss: 0.5000 -> 0.5464  accuracy: 91.83% -> 92.10%     
client [95] (testset)   loss: 0.4708 -> 0.4591  accuracy: 92.97% -> 93.41%     
---------------------------- TRAINING EPOCH: 230 ----------------------------  
client [71] (testset)   loss: 1.0045 -> 1.1506  accuracy: 80.02% -> 81.44%     
client [15] (testset)   loss: 0.9034 -> 0.9010  accuracy: 84.23% -> 83.87%     
client [33] (testset)   loss: 0.7867 -> 0.9284  accuracy: 86.36% -> 86.25%     
client [99] (testset)   loss: 0.4570 -> 0.4418  accuracy: 92.08% -> 92.14%     
client [90] (testset)   loss: 1.1223 -> 1.0780  accuracy: 82.51% -> 81.69%     
client [57] (testset)   loss: 1.0089 -> 1.0704  accuracy: 83.86% -> 84.23%     
client [27] (testset)   loss: 0.4484 -> 0.4870  accuracy: 93.03% -> 93.33%     
client [78] (testset)   loss: 0.5781 -> 0.5852  accuracy: 90.55% -> 91.07%     
client [36] (testset)   loss: 0.7768 -> 0.7845  accuracy: 87.58% -> 87.68%     
client [88] (testset)   loss: 0.6700 -> 0.7007  accuracy: 88.16% -> 88.49%     
---------------------------- TRAINING EPOCH: 240 ----------------------------  
client [70] (testset)   loss: 0.9725 -> 0.9666  accuracy: 83.70% -> 83.77%     
client [35] (testset)   loss: 1.0195 -> 1.0515  accuracy: 84.17% -> 84.50%     
client [16] (testset)   loss: 0.5471 -> 0.5494  accuracy: 91.58% -> 91.67%     
client [80] (testset)   loss: 1.0406 -> 1.0195  accuracy: 84.75% -> 85.50%     
client [38] (testset)   loss: 0.5123 -> 0.4925  accuracy: 92.45% -> 92.42%     
client [78] (testset)   loss: 0.5719 -> 0.5707  accuracy: 90.35% -> 91.32%     
client [68] (testset)   loss: 0.5517 -> 0.6444  accuracy: 90.24% -> 90.33%     
client [11] (testset)   loss: 0.4231 -> 0.4197  accuracy: 93.10% -> 93.59%     
client [64] (testset)   loss: 0.9067 -> 0.9397  accuracy: 84.02% -> 84.56%     
client [82] (testset)   loss: 0.8800 -> 0.9116  accuracy: 85.72% -> 86.57%     
---------------------------- TRAINING EPOCH: 250 ----------------------------  
client [30] (testset)   loss: 0.7318 -> 0.7521  accuracy: 89.60% -> 89.55%     
client [27] (testset)   loss: 0.4841 -> 0.4890  accuracy: 92.52% -> 93.18%     
client [74] (testset)   loss: 0.5185 -> 0.5342  accuracy: 90.98% -> 91.30%     
client [45] (testset)   loss: 0.7109 -> 0.7313  accuracy: 88.15% -> 87.99%     
client [6]  (testset)   loss: 0.9585 -> 0.9995  accuracy: 85.71% -> 85.66%     
client [36] (testset)   loss: 0.8050 -> 0.7981  accuracy: 87.28% -> 88.08%     
client [63] (testset)   loss: 0.5513 -> 0.5771  accuracy: 90.38% -> 90.38%     
client [76] (testset)   loss: 0.9873 -> 0.9876  accuracy: 85.30% -> 84.42%     
client [83] (testset)   loss: 0.6244 -> 0.6326  accuracy: 89.42% -> 90.39%     
client [86] (testset)   loss: 0.4678 -> 0.4773  accuracy: 93.02% -> 92.68%     
---------------------------- TRAINING EPOCH: 260 ----------------------------  
client [83] (testset)   loss: 0.7121 -> 0.6383  accuracy: 86.78% -> 89.92%     
client [99] (testset)   loss: 0.4708 -> 0.4581  accuracy: 91.63% -> 92.02%     
client [74] (testset)   loss: 0.5158 -> 0.5371  accuracy: 91.34% -> 91.79%     
client [73] (testset)   loss: 1.0154 -> 1.0287  accuracy: 84.21% -> 83.99%     
client [29] (testset)   loss: 1.0106 -> 1.0196  accuracy: 82.56% -> 81.64%     
client [92] (testset)   loss: 0.4340 -> 0.4368  accuracy: 91.96% -> 92.54%     
client [6]  (testset)   loss: 0.9245 -> 0.9761  accuracy: 85.03% -> 85.71%     
client [61] (testset)   loss: 0.5222 -> 0.5043  accuracy: 92.37% -> 92.56%     
client [21] (testset)   loss: 0.5066 -> 0.5460  accuracy: 91.80% -> 91.61%     
client [67] (testset)   loss: 0.6297 -> 0.6661  accuracy: 88.16% -> 88.47%     
---------------------------- TRAINING EPOCH: 270 ----------------------------  
client [83] (testset)   loss: 0.6541 -> 0.6598  accuracy: 88.39% -> 90.18%     
client [32] (testset)   loss: 0.5641 -> 0.5738  accuracy: 91.13% -> 91.49%     
client [95] (testset)   loss: 0.4965 -> 0.5091  accuracy: 93.29% -> 93.61%     
client [61] (testset)   loss: 0.5437 -> 0.5362  accuracy: 92.08% -> 92.27%     
client [27] (testset)   loss: 0.4865 -> 0.5079  accuracy: 93.03% -> 93.25%     
client [25] (testset)   loss: 0.3808 -> 0.3952  accuracy: 94.37% -> 95.03%     
client [68] (testset)   loss: 0.6279 -> 0.6485  accuracy: 89.79% -> 90.17%     
client [34] (testset)   loss: 0.7751 -> 0.8011  accuracy: 88.42% -> 88.93%     
client [71] (testset)   loss: 1.1168 -> 1.2103  accuracy: 80.69% -> 81.89%     
client [89] (testset)   loss: 0.8848 -> 0.8946  accuracy: 85.25% -> 85.71%     
---------------------------- TRAINING EPOCH: 280 ----------------------------  
client [78] (testset)   loss: 0.5941 -> 0.6157  accuracy: 90.09% -> 91.07%     
client [81] (testset)   loss: 0.9738 -> 1.0690  accuracy: 82.57% -> 83.54%     
client [51] (testset)   loss: 0.5360 -> 0.5631  accuracy: 92.33% -> 92.15%     
client [54] (testset)   loss: 0.5452 -> 0.5422  accuracy: 91.44% -> 91.27%     
client [65] (testset)   loss: 0.8627 -> 0.9014  accuracy: 86.03% -> 85.76%     
client [41] (testset)   loss: 1.1203 -> 1.1822  accuracy: 81.05% -> 81.96%     
client [11] (testset)   loss: 0.4126 -> 0.4102  accuracy: 93.26% -> 93.65%     
client [85] (testset)   loss: 0.4743 -> 0.4947  accuracy: 92.65% -> 92.90%     
client [12] (testset)   loss: 0.8623 -> 0.8833  accuracy: 85.69% -> 85.10%     
client [23] (testset)   loss: 0.9926 -> 0.9948  accuracy: 82.78% -> 83.88%     
---------------------------- TRAINING EPOCH: 290 ----------------------------  
client [16] (testset)   loss: 0.5791 -> 0.5799  accuracy: 91.95% -> 91.81%     
client [65] (testset)   loss: 0.8727 -> 0.9137  accuracy: 86.37% -> 85.90%     
client [53] (testset)   loss: 0.7794 -> 0.7996  accuracy: 87.71% -> 87.41%     
client [58] (testset)   loss: 0.6114 -> 0.6474  accuracy: 90.65% -> 91.16%     
client [72] (testset)   loss: 0.8209 -> 0.8226  accuracy: 86.11% -> 86.31%     
client [7]  (testset)   loss: 0.7145 -> 0.7325  accuracy: 88.08% -> 88.52%     
client [71] (testset)   loss: 1.1029 -> 1.2352  accuracy: 81.71% -> 81.66%     
client [59] (testset)   loss: 0.9791 -> 1.0091  accuracy: 84.15% -> 84.04%     
client [86] (testset)   loss: 0.4564 -> 0.4854  accuracy: 91.98% -> 92.28%     
client [39] (testset)   loss: 1.0888 -> 1.0974  accuracy: 84.44% -> 84.92%     
---------------------------- TRAINING EPOCH: 300 ----------------------------  
client [99] (testset)   loss: 0.4971 -> 0.4781  accuracy: 92.02% -> 92.30%     
client [7]  (testset)   loss: 0.6928 -> 0.7182  accuracy: 88.13% -> 88.86%     
client [17] (testset)   loss: 0.4993 -> 0.5157  accuracy: 91.83% -> 91.99%     
client [64] (testset)   loss: 0.9759 -> 0.9790  accuracy: 84.78% -> 84.56%     
client [37] (testset)   loss: 0.6710 -> 0.6935  accuracy: 88.70% -> 88.65%     
client [29] (testset)   loss: 1.0624 -> 1.0657  accuracy: 81.64% -> 81.87%     
client [93] (testset)   loss: 0.7468 -> 0.7554  accuracy: 90.18% -> 90.47%     
client [73] (testset)   loss: 1.0541 -> 1.0333  accuracy: 83.87% -> 84.44%     
client [40] (testset)   loss: 0.6203 -> 0.6719  accuracy: 88.41% -> 88.41%     
client [76] (testset)   loss: 1.0489 -> 1.0134  accuracy: 84.25% -> 83.76%     
---------------------------- TRAINING EPOCH: 310 ----------------------------  
client [31] (testset)   loss: 0.7578 -> 0.7858  accuracy: 86.11% -> 86.81%     
client [89] (testset)   loss: 0.9448 -> 0.9377  accuracy: 85.77% -> 85.38%     
client [77] (testset)   loss: 1.0258 -> 1.0438  accuracy: 84.49% -> 84.43%     
client [90] (testset)   loss: 1.1335 -> 1.1513  accuracy: 81.96% -> 82.55%     
client [26] (testset)   loss: 0.7053 -> 0.7309  accuracy: 88.73% -> 88.88%     
client [50] (testset)   loss: 0.5612 -> 0.5580  accuracy: 89.83% -> 89.68%     
client [30] (testset)   loss: 0.7519 -> 0.7770  accuracy: 89.15% -> 89.33%     
client [70] (testset)   loss: 0.9556 -> 1.0112  accuracy: 82.95% -> 83.70%     
client [41] (testset)   loss: 1.2216 -> 1.2370  accuracy: 81.21% -> 80.88%     
client [99] (testset)   loss: 0.4832 -> 0.4970  accuracy: 91.97% -> 91.91%     
---------------------------- TRAINING EPOCH: 320 ----------------------------  
client [68] (testset)   loss: 0.6581 -> 0.6428  accuracy: 89.98% -> 90.59%     
client [70] (testset)   loss: 1.0023 -> 0.9907  accuracy: 83.77% -> 83.25%     
client [52] (testset)   loss: 0.9982 -> 0.9994  accuracy: 84.74% -> 85.11%     
client [1]  (testset)   loss: 0.6504 -> 0.6692  accuracy: 88.65% -> 90.25%     
client [2]  (testset)   loss: 0.5179 -> 0.5156  accuracy: 91.20% -> 91.04%     
client [67] (testset)   loss: 0.6510 -> 0.6768  accuracy: 88.99% -> 89.41%     
client [92] (testset)   loss: 0.4716 -> 0.4698  accuracy: 91.87% -> 92.29%     
client [35] (testset)   loss: 1.0090 -> 1.0782  accuracy: 83.78% -> 84.04%     
client [36] (testset)   loss: 0.8249 -> 0.8392  accuracy: 87.43% -> 87.38%     
client [64] (testset)   loss: 0.9603 -> 0.9836  accuracy: 84.02% -> 84.35%     
---------------------------- TRAINING EPOCH: 330 ----------------------------  
client [44] (testset)   loss: 1.2664 -> 1.2562  accuracy: 80.62% -> 80.68%     
client [6]  (testset)   loss: 0.9948 -> 1.0380  accuracy: 84.94% -> 85.57%     
client [12] (testset)   loss: 0.8622 -> 0.8748  accuracy: 84.15% -> 84.98%     
client [55] (testset)   loss: 1.0075 -> 1.0526  accuracy: 84.66% -> 85.93%     
client [29] (testset)   loss: 1.0616 -> 1.0998  accuracy: 82.22% -> 82.56%     
client [9]  (testset)   loss: 1.2607 -> 1.2140  accuracy: 79.29% -> 79.54%     
client [43] (testset)   loss: 0.5948 -> 0.6472  accuracy: 90.32% -> 90.32%     
client [77] (testset)   loss: 0.9730 -> 1.0214  accuracy: 85.03% -> 84.27%     
client [98] (testset)   loss: 0.5738 -> 0.5801  accuracy: 90.85% -> 91.41%     
client [78] (testset)   loss: 0.6738 -> 0.6534  accuracy: 90.25% -> 90.97%     
---------------------------- TRAINING EPOCH: 340 ----------------------------  
client [92] (testset)   loss: 0.5076 -> 0.5119  accuracy: 92.21% -> 91.71%     
client [80] (testset)   loss: 1.0227 -> 1.0389  accuracy: 84.92% -> 85.33%     
client [63] (testset)   loss: 0.6003 -> 0.6183  accuracy: 90.19% -> 90.28%     
client [76] (testset)   loss: 1.0487 -> 1.0599  accuracy: 84.36% -> 83.92%     
client [78] (testset)   loss: 0.6339 -> 0.6414  accuracy: 91.02% -> 90.66%     
client [25] (testset)   loss: 0.3969 -> 0.4116  accuracy: 94.66% -> 95.00%     
client [58] (testset)   loss: 0.6681 -> 0.6629  accuracy: 90.93% -> 91.52%     
client [13] (testset)   loss: 0.8138 -> 0.8293  accuracy: 86.45% -> 86.69%     
client [17] (testset)   loss: 0.5203 -> 0.5278  accuracy: 92.23% -> 92.07%     
client [38] (testset)   loss: 0.5197 -> 0.5129  accuracy: 92.19% -> 92.32%     
---------------------------- TRAINING EPOCH: 350 ----------------------------  
client [72] (testset)   loss: 0.8718 -> 0.8952  accuracy: 85.86% -> 86.14%     
client [82] (testset)   loss: 0.9417 -> 0.9632  accuracy: 86.12% -> 85.95%     
client [86] (testset)   loss: 0.5130 -> 0.5208  accuracy: 92.78% -> 92.33%     
client [51] (testset)   loss: 0.5958 -> 0.6208  accuracy: 91.74% -> 91.64%     
client [96] (testset)   loss: 0.8801 -> 0.8754  accuracy: 88.84% -> 89.23%     
client [42] (testset)   loss: 0.5773 -> 0.5888  accuracy: 91.16% -> 91.38%     
client [55] (testset)   loss: 1.0746 -> 1.0702  accuracy: 86.03% -> 86.24%     
client [13] (testset)   loss: 0.8119 -> 0.8238  accuracy: 86.32% -> 86.69%     
client [1]  (testset)   loss: 0.6579 -> 0.6843  accuracy: 89.50% -> 90.35%     
client [12] (testset)   loss: 0.8722 -> 0.8805  accuracy: 84.33% -> 85.57%     
---------------------------- TRAINING EPOCH: 360 ----------------------------  
client [68] (testset)   loss: 0.6611 -> 0.6854  accuracy: 90.27% -> 90.52%     
client [23] (testset)   loss: 1.0588 -> 1.0559  accuracy: 82.83% -> 83.20%     
client [46] (testset)   loss: 0.6352 -> 0.6678  accuracy: 90.55% -> 90.70%     
client [41] (testset)   loss: 1.2396 -> 1.2502  accuracy: 80.47% -> 81.46%     
client [25] (testset)   loss: 0.4024 -> 0.4195  accuracy: 94.01% -> 94.93%     
client [58] (testset)   loss: 0.6750 -> 0.6886  accuracy: 91.09% -> 91.32%     
client [14] (testset)   loss: 0.6527 -> 0.6717  accuracy: 90.60% -> 91.03%     
client [33] (testset)   loss: 0.9411 -> 1.0065  accuracy: 86.92% -> 86.42%     
client [85] (testset)   loss: 0.4974 -> 0.5085  accuracy: 92.61% -> 92.72%     
client [62] (testset)   loss: 0.9803 -> 0.9529  accuracy: 87.27% -> 87.35%     
---------------------------- TRAINING EPOCH: 370 ----------------------------  
client [98] (testset)   loss: 0.5879 -> 0.5940  accuracy: 91.81% -> 91.89%     
client [63] (testset)   loss: 0.6560 -> 0.6391  accuracy: 90.38% -> 90.33%     
client [70] (testset)   loss: 1.0211 -> 1.0277  accuracy: 83.62% -> 83.55%     
client [65] (testset)   loss: 0.9900 -> 0.9867  accuracy: 85.22% -> 85.43%     
client [14] (testset)   loss: 0.6495 -> 0.6627  accuracy: 88.83% -> 90.79%     
client [73] (testset)   loss: 1.1491 -> 1.1258  accuracy: 83.19% -> 83.70%     
client [34] (testset)   loss: 0.8162 -> 0.8695  accuracy: 88.71% -> 89.22%     
client [99] (testset)   loss: 0.5057 -> 0.5069  accuracy: 91.75% -> 91.69%     
client [69] (testset)   loss: 0.5722 -> 0.5933  accuracy: 91.91% -> 92.05%     
client [46] (testset)   loss: 0.6803 -> 0.6753  accuracy: 90.44% -> 90.28%     
---------------------------- TRAINING EPOCH: 380 ----------------------------  
client [99] (testset)   loss: 0.5012 -> 0.5228  accuracy: 91.63% -> 91.52%     
client [93] (testset)   loss: 0.7448 -> 0.7730  accuracy: 90.26% -> 90.47%     
client [11] (testset)   loss: 0.4350 -> 0.4402  accuracy: 93.48% -> 93.54%     
client [58] (testset)   loss: 0.6361 -> 0.6649  accuracy: 90.25% -> 91.32%     
client [81] (testset)   loss: 1.1458 -> 1.1376  accuracy: 83.40% -> 83.40%     
client [85] (testset)   loss: 0.4953 -> 0.5136  accuracy: 92.57% -> 92.65%     
client [89] (testset)   loss: 0.9555 -> 0.9820  accuracy: 86.55% -> 86.16%     
client [45] (testset)   loss: 0.8280 -> 0.8288  accuracy: 87.24% -> 87.57%     
client [8]  (testset)   loss: 0.6260 -> 0.6376  accuracy: 90.56% -> 90.11%     
client [68] (testset)   loss: 0.6736 -> 0.6795  accuracy: 90.02% -> 90.59%     
---------------------------- TRAINING EPOCH: 390 ----------------------------  
client [67] (testset)   loss: 0.6833 -> 0.6978  accuracy: 88.37% -> 88.63%     
client [72] (testset)   loss: 0.8883 -> 0.9135  accuracy: 86.45% -> 86.56%     
client [1]  (testset)   loss: 0.6893 -> 0.7164  accuracy: 89.61% -> 89.82%     
client [78] (testset)   loss: 0.6750 -> 0.6555  accuracy: 90.25% -> 90.71%     
client [83] (testset)   loss: 0.6803 -> 0.7070  accuracy: 89.64% -> 90.18%     
client [21] (testset)   loss: 0.5861 -> 0.6035  accuracy: 91.87% -> 92.06%     
client [56] (testset)   loss: 0.8045 -> 0.8247  accuracy: 87.69% -> 88.87%     
client [44] (testset)   loss: 1.2965 -> 1.3424  accuracy: 80.62% -> 79.73%     
client [92] (testset)   loss: 0.4824 -> 0.4830  accuracy: 91.21% -> 91.46%     
client [27] (testset)   loss: 0.5073 -> 0.5281  accuracy: 92.96% -> 93.22%     
---------------------------- TRAINING EPOCH: 400 ----------------------------  
client [10] (testset)   loss: 0.7222 -> 0.7281  accuracy: 88.40% -> 88.06%     
client [39] (testset)   loss: 1.1375 -> 1.1636  accuracy: 84.48% -> 84.62%     
client [65] (testset)   loss: 0.9313 -> 0.9851  accuracy: 85.63% -> 85.36%     
client [26] (testset)   loss: 0.7450 -> 0.7512  accuracy: 88.26% -> 88.96%     
client [19] (testset)   loss: 0.7854 -> 0.8124  accuracy: 88.60% -> 89.35%     
client [68] (testset)   loss: 0.6997 -> 0.7109  accuracy: 90.40% -> 90.56%     
client [41] (testset)   loss: 1.3319 -> 1.3190  accuracy: 80.96% -> 81.13%     
client [50] (testset)   loss: 0.6099 -> 0.6178  accuracy: 89.16% -> 88.90%     
client [75] (testset)   loss: 0.8312 -> 0.8414  accuracy: 86.66% -> 87.70%     
client [81] (testset)   loss: 1.1087 -> 1.1523  accuracy: 83.50% -> 83.89%     
Training... ---------------------------------------- 100% 2:38:05
FedRoD's average time taken by each global epoch: 0 min 23.60 sec.             
FedRoD's total running time: 2 h 38 m 5 s.                                     
==================== FedRoD Experiment Results: ====================           
Display format: (before local fine-tuning) -> (after local fine-tuning)        
 So if finetune_epoch = 0, x.xx% -> 0.00% is normal.                           
 Centralized testing ONLY happens after model aggregation, so the stats between
'->' are the same.                                                             
{                                                                              
    "100": {                                                                   
        "all_clients": {                                                       
            "test": {                                                          
                "loss": "0.5674 -> 0.0000",                                    
                "accuracy": "88.74% -> 0.00%"                                  
            }                                                                  
        }                                                                      
    },                                                                         
    "200": {                                                                   
        "all_clients": {                                                       
            "test": {                                                          
                "loss": "0.6624 -> 0.0000",                                    
                "accuracy": "88.58% -> 0.00%"                                  
            }                                                                  
        }                                                                      
    },                                                                         
    "300": {                                                                   
        "all_clients": {                                                       
            "test": {                                                          
                "loss": "0.7263 -> 0.0000",                                    
                "accuracy": "88.40% -> 0.00%"                                  
            }                                                                  
        }                                                                      
    },                                                                         
    "400": {                                                                   
        "all_clients": {                                                       
            "test": {                                                          
                "loss": "0.7823 -> 0.0000",                                    
                "accuracy": "88.53% -> 0.00%"                                  
            }                                                                  
        }                                                                      
    }                                                                          
}                                                                              
==================== FedRoD Max Accuracy ====================                  
all_clients:                                                                   
(test) before fine-tuning: 88.74% at epoch 100                                 
(test) after fine-tuning: 0.00% at epoch 100                                   
[0m