==================== FedRep ====================                               
Experiment Arguments:                                                          
{
│   'method': 'fedrep',
│   'dataset': {
│   │   'name': 'mnist',
│   │   'client_num': 100,
│   │   'test_ratio': 0.25,
│   │   'val_ratio': 0.0,
│   │   'seed': 42,
│   │   'split': 'sample',
│   │   'IID_ratio': 0.0,
│   │   'monitor_window_name_suffix': 'mnist-100clients-0%IID-Dir(0.5)-seed42',
│   │   'alpha': 0.5,
│   │   'min_samples_per_client': 10
│   },
│   'model': {
│   │   'name': 'avgcnn',
│   │   'use_torchvision_pretrained_weights': True,
│   │   'external_model_weights_path': None
│   },
│   'optimizer': {
│   │   'lr': 0.01,
│   │   'dampening': 0,
│   │   'weight_decay': 0,
│   │   'momentum': 0,
│   │   'nesterov': False,
│   │   'name': 'sgd'
│   },
│   'mode': 'serial',
│   'parallel': {
│   │   'ray_cluster_addr': None,
│   │   'num_cpus': None,
│   │   'num_gpus': None,
│   │   'num_workers': 2
│   },
│   'common': {
│   │   'seed': 42,
│   │   'join_ratio': 0.1,
│   │   'global_epoch': 400,
│   │   'local_epoch': 5,
│   │   'batch_size': 32,
│   │   'reset_optimizer_on_global_epoch': True,
│   │   'straggler_ratio': 0,
│   │   'straggler_min_local_epoch': 0,
│   │   'buffers': 'global',
│   │   'client_side_evaluation': True,
│   │   'test': {
│   │   │   'client': {
│   │   │   │   'interval': 100,
│   │   │   │   'finetune_epoch': 0,
│   │   │   │   'train': False,
│   │   │   │   'val': False,
│   │   │   │   'test': True
│   │   │   },
│   │   │   'server': {
│   │   │   │   'interval': -1,
│   │   │   │   'train': False,
│   │   │   │   'val': False,
│   │   │   │   'test': False,
│   │   │   │   'model_in_train_mode': False
│   │   │   }
│   │   },
│   │   'verbose_gap': 10,
│   │   'monitor': None,
│   │   'use_cuda': True,
│   │   'save_log': True,
│   │   'save_model': False,
│   │   'save_learning_curve_plot': False,
│   │   'save_metrics': True,
│   │   'delete_useless_run': True
│   },
│   'fedrep': {
│   │   'train_body_epoch': 1
│   }
}
---------------------------- TRAINING EPOCH: 10 ----------------------------   
client [77] (testset)   loss: 0.6388 -> 0.5241  accuracy: 77.65% -> 80.00%     
client [81] (testset)   loss: 0.5962 -> 0.5288  accuracy: 80.08% -> 84.65%     
client [21] (testset)   loss: 0.4760 -> 0.3587  accuracy: 85.17% -> 89.47%     
client [68] (testset)   loss: 0.3492 -> 0.1955  accuracy: 86.61% -> 92.86%     
client [93] (testset)   loss: 0.4508 -> 0.4199  accuracy: 81.56% -> 90.78%     
client [31] (testset)   loss: 1.7113 -> 0.4376  accuracy: 44.39% -> 87.17%     
client [20] (testset)   loss: 0.3685 -> 0.4441  accuracy: 91.55% -> 88.03%     
client [59] (testset)   loss: 0.3486 -> 0.2246  accuracy: 89.58% -> 91.67%     
client [48] (testset)   loss: 0.2291 -> 0.2502  accuracy: 90.07% -> 92.91%     
client [34] (testset)   loss: 0.2184 -> 0.2026  accuracy: 94.76% -> 94.01%     
---------------------------- TRAINING EPOCH: 20 ----------------------------   
client [69] (testset)   loss: 1.1487 -> 0.4220  accuracy: 71.43% -> 89.29%     
client [99] (testset)   loss: 0.4969 -> 0.5213  accuracy: 81.07% -> 83.43%     
client [67] (testset)   loss: 0.2622 -> 0.2253  accuracy: 91.43% -> 92.57%     
client [0]  (testset)   loss: 0.3073 -> 0.3977  accuracy: 90.76% -> 89.81%     
client [76] (testset)   loss: 0.2450 -> 0.2282  accuracy: 92.35% -> 93.44%     
client [41] (testset)   loss: 0.3670 -> 0.2588  accuracy: 85.20% -> 92.38%     
client [62] (testset)   loss: 0.2759 -> 0.0734  accuracy: 90.30% -> 96.97%     
client [2]  (testset)   loss: 0.3272 -> 0.1486  accuracy: 92.21% -> 95.13%     
client [14] (testset)   loss: 0.2843 -> 0.2437  accuracy: 92.61% -> 93.75%     
client [46] (testset)   loss: 0.2609 -> 0.3891  accuracy: 90.83% -> 85.32%     
---------------------------- TRAINING EPOCH: 30 ----------------------------   
client [24] (testset)   loss: 0.2456 -> 0.2360  accuracy: 93.16% -> 93.16%     
client [68] (testset)   loss: 0.0994 -> 0.0960  accuracy: 97.32% -> 97.32%     
client [57] (testset)   loss: 0.3227 -> 0.2778  accuracy: 92.55% -> 95.74%     
client [17] (testset)   loss: 0.2702 -> 0.2266  accuracy: 91.94% -> 94.35%     
client [54] (testset)   loss: 0.1834 -> 0.1997  accuracy: 96.02% -> 95.13%     
client [23] (testset)   loss: 0.3198 -> 0.1275  accuracy: 93.91% -> 95.65%     
client [35] (testset)   loss: 0.3235 -> 0.2928  accuracy: 90.76% -> 92.44%     
client [59] (testset)   loss: 0.1068 -> 0.1156  accuracy: 95.83% -> 95.83%     
client [31] (testset)   loss: 0.1683 -> 0.1901  accuracy: 95.19% -> 94.12%     
client [9]  (testset)   loss: 0.2189 -> 0.2391  accuracy: 90.91% -> 90.91%     
---------------------------- TRAINING EPOCH: 40 ----------------------------   
client [64] (testset)   loss: 0.3085 -> 0.2917  accuracy: 89.68% -> 91.27%     
client [33] (testset)   loss: 0.1781 -> 0.1700  accuracy: 93.37% -> 94.48%     
client [16] (testset)   loss: 0.2537 -> 0.3019  accuracy: 89.92% -> 90.76%     
client [44] (testset)   loss: 0.4774 -> 2.0971  accuracy: 86.97% -> 62.04%     
client [8]  (testset)   loss: 0.1529 -> 0.0800  accuracy: 94.12% -> 97.06%     
client [31] (testset)   loss: 0.1578 -> 0.1424  accuracy: 96.79% -> 96.26%     
client [47] (testset)   loss: 0.1495 -> 0.1514  accuracy: 94.90% -> 95.09%     
client [36] (testset)   loss: 0.1679 -> 0.1443  accuracy: 95.75% -> 95.75%     
client [20] (testset)   loss: 0.2784 -> 0.2181  accuracy: 92.25% -> 94.37%     
client [56] (testset)   loss: 0.2703 -> 0.1692  accuracy: 93.46% -> 95.00%     
---------------------------- TRAINING EPOCH: 50 ----------------------------   
client [4]  (testset)   loss: 0.2974 -> 0.2563  accuracy: 93.04% -> 94.94%     
client [60] (testset)   loss: 0.1254 -> 0.1103  accuracy: 96.73% -> 97.39%     
client [28] (testset)   loss: 0.1330 -> 0.1681  accuracy: 96.57% -> 95.59%     
client [25] (testset)   loss: 0.4089 -> 0.2660  accuracy: 87.32% -> 94.37%     
client [58] (testset)   loss: 0.3252 -> 0.1737  accuracy: 89.29% -> 94.90%     
client [44] (testset)   loss: 0.3694 -> 0.1369  accuracy: 85.55% -> 94.62%     
client [39] (testset)   loss: 0.1963 -> 0.1851  accuracy: 92.64% -> 93.87%     
client [29] (testset)   loss: 0.2698 -> 0.2905  accuracy: 92.44% -> 87.79%     
client [3]  (testset)   loss: 0.3165 -> 0.2711  accuracy: 94.95% -> 93.94%     
client [84] (testset)   loss: 0.1237 -> 0.1155  accuracy: 94.62% -> 95.07%     
---------------------------- TRAINING EPOCH: 60 ----------------------------   
client [21] (testset)   loss: 0.1497 -> 0.1092  accuracy: 93.78% -> 96.65%     
client [84] (testset)   loss: 0.1089 -> 0.1105  accuracy: 95.52% -> 95.07%     
client [10] (testset)   loss: 0.1063 -> 0.0367  accuracy: 96.57% -> 98.53%     
client [36] (testset)   loss: 0.1124 -> 1.1315  accuracy: 96.53% -> 66.02%     
client [65] (testset)   loss: 0.1045 -> 0.1165  accuracy: 96.60% -> 96.17%     
client [81] (testset)   loss: 0.1890 -> 0.2985  accuracy: 93.36% -> 88.80%     
client [79] (testset)   loss: 0.2176 -> 0.2255  accuracy: 93.88% -> 93.88%     
client [42] (testset)   loss: 0.1960 -> 0.2721  accuracy: 93.75% -> 89.90%     
client [11] (testset)   loss: 0.1200 -> 0.1015  accuracy: 96.86% -> 95.96%     
client [96] (testset)   loss: 0.1511 -> 0.1225  accuracy: 95.79% -> 96.14%     
---------------------------- TRAINING EPOCH: 70 ----------------------------   
client [8]  (testset)   loss: 0.0598 -> 0.0609  accuracy: 97.06% -> 97.06%     
client [53] (testset)   loss: 0.1600 -> 0.1658  accuracy: 94.31% -> 95.12%     
client [52] (testset)   loss: 0.2797 -> 0.2672  accuracy: 94.81% -> 96.10%     
client [42] (testset)   loss: 0.1812 -> 0.1859  accuracy: 95.19% -> 94.23%     
client [69] (testset)   loss: 0.2261 -> 0.1671  accuracy: 93.57% -> 95.71%     
client [59] (testset)   loss: 0.0784 -> 0.0862  accuracy: 96.88% -> 95.83%     
client [7]  (testset)   loss: 0.0722 -> 0.0586  accuracy: 97.33% -> 98.22%     
client [26] (testset)   loss: 0.1620 -> 0.1547  accuracy: 95.93% -> 95.12%     
client [49] (testset)   loss: 0.1541 -> 0.1528  accuracy: 96.32% -> 94.85%     
client [98] (testset)   loss: 0.2031 -> 0.1754  accuracy: 94.29% -> 95.24%     
---------------------------- TRAINING EPOCH: 80 ----------------------------   
client [98] (testset)   loss: 0.1863 -> 0.1909  accuracy: 93.33% -> 95.24%     
client [47] (testset)   loss: 0.1382 -> 0.1118  accuracy: 95.65% -> 96.03%     
client [21] (testset)   loss: 0.1101 -> 0.1283  accuracy: 96.17% -> 93.78%     
client [77] (testset)   loss: 0.3016 -> 0.2818  accuracy: 89.41% -> 91.76%     
client [95] (testset)   loss: 0.1633 -> 0.1592  accuracy: 93.90% -> 93.90%     
client [91] (testset)   loss: 0.0641 -> 0.0651  accuracy: 98.23% -> 98.23%     
client [14] (testset)   loss: 0.1196 -> 0.1773  accuracy: 96.59% -> 95.45%     
client [99] (testset)   loss: 0.1978 -> 0.1793  accuracy: 92.90% -> 92.90%     
client [20] (testset)   loss: 0.1848 -> 0.1700  accuracy: 93.66% -> 95.07%     
client [39] (testset)   loss: 0.2094 -> 0.1573  accuracy: 92.64% -> 95.71%     
---------------------------- TRAINING EPOCH: 90 ----------------------------   
client [52] (testset)   loss: 0.2527 -> 0.2416  accuracy: 96.10% -> 96.10%     
client [62] (testset)   loss: 0.0381 -> 0.0331  accuracy: 97.58% -> 98.79%     
client [71] (testset)   loss: 0.1090 -> 0.1006  accuracy: 94.87% -> 94.87%     
client [97] (testset)   loss: 0.1423 -> 0.1343  accuracy: 95.51% -> 95.51%     
client [30] (testset)   loss: 0.1177 -> 0.0991  accuracy: 96.77% -> 98.06%     
client [88] (testset)   loss: 0.0203 -> 0.0255  accuracy: 100.00% -> 100.00%   
client [60] (testset)   loss: 0.1187 -> 0.0933  accuracy: 97.39% -> 97.39%     
client [82] (testset)   loss: 0.0749 -> 0.0609  accuracy: 98.23% -> 98.48%     
client [91] (testset)   loss: 0.0701 -> 0.0587  accuracy: 98.23% -> 98.23%     
client [57] (testset)   loss: 0.2317 -> 0.2281  accuracy: 96.81% -> 96.81%     
---------------------------- TRAINING EPOCH: 100 ----------------------------  
client [31] (testset)   loss: 0.1097 -> 0.0849  accuracy: 95.72% -> 96.79%     
client [15] (testset)   loss: 0.1653 -> 0.1579  accuracy: 94.19% -> 94.19%     
client [71] (testset)   loss: 0.0974 -> 0.1203  accuracy: 94.87% -> 93.59%     
client [97] (testset)   loss: 0.1285 -> 0.1391  accuracy: 96.63% -> 95.51%     
client [53] (testset)   loss: 0.1558 -> 0.1613  accuracy: 95.12% -> 94.31%     
client [77] (testset)   loss: 0.2933 -> 0.2967  accuracy: 89.41% -> 91.76%     
client [76] (testset)   loss: 0.0841 -> 0.0802  accuracy: 97.27% -> 96.72%     
client [79] (testset)   loss: 0.2100 -> 0.2045  accuracy: 95.24% -> 94.56%     
client [28] (testset)   loss: 0.0622 -> 0.0584  accuracy: 97.06% -> 98.04%     
client [99] (testset)   loss: 0.1760 -> 0.1766  accuracy: 92.90% -> 92.90%     
---------------------------- TRAINING EPOCH: 110 ----------------------------  
client [97] (testset)   loss: 0.1483 -> 0.1412  accuracy: 94.94% -> 95.51%     
client [86] (testset)   loss: 0.1293 -> 0.1369  accuracy: 96.95% -> 95.43%     
client [34] (testset)   loss: 0.0941 -> 0.0906  accuracy: 96.25% -> 96.25%     
client [73] (testset)   loss: 0.0680 -> 0.1002  accuracy: 97.09% -> 95.93%     
client [5]  (testset)   loss: 0.1686 -> 0.1687  accuracy: 93.53% -> 94.12%     
client [96] (testset)   loss: 0.0745 -> 0.0697  accuracy: 97.54% -> 97.89%     
client [22] (testset)   loss: 0.0880 -> 0.0690  accuracy: 95.56% -> 96.30%     
client [60] (testset)   loss: 0.0859 -> 0.0950  accuracy: 98.04% -> 97.39%     
client [66] (testset)   loss: 0.1236 -> 0.1086  accuracy: 96.65% -> 96.23%     
client [83] (testset)   loss: 0.1256 -> 0.0976  accuracy: 96.64% -> 97.48%     
---------------------------- TRAINING EPOCH: 120 ----------------------------  
client [76] (testset)   loss: 0.0724 -> 0.0771  accuracy: 96.72% -> 96.72%     
client [65] (testset)   loss: 0.0848 -> 0.1025  accuracy: 97.45% -> 96.17%     
client [95] (testset)   loss: 0.1352 -> 0.1282  accuracy: 95.77% -> 94.84%     
client [17] (testset)   loss: 0.1766 -> 0.1762  accuracy: 93.55% -> 95.16%     
client [8]  (testset)   loss: 0.0675 -> 0.0464  accuracy: 97.06% -> 98.53%     
client [35] (testset)   loss: 0.1536 -> 0.1641  accuracy: 97.48% -> 94.96%     
client [98] (testset)   loss: 0.1527 -> 0.1519  accuracy: 96.19% -> 95.24%     
client [53] (testset)   loss: 0.1429 -> 0.1425  accuracy: 95.12% -> 95.12%     
client [43] (testset)   loss: 0.2036 -> 0.1740  accuracy: 92.06% -> 93.65%     
client [64] (testset)   loss: 0.2167 -> 0.2071  accuracy: 93.65% -> 92.86%     
---------------------------- TRAINING EPOCH: 130 ----------------------------  
client [21] (testset)   loss: 0.0599 -> 0.0712  accuracy: 98.09% -> 97.61%     
client [88] (testset)   loss: 0.0073 -> 0.0068  accuracy: 100.00% -> 100.00%   
client [38] (testset)   loss: 0.1230 -> 0.1007  accuracy: 97.38% -> 97.91%     
client [3]  (testset)   loss: 0.2520 -> 0.2291  accuracy: 93.94% -> 92.93%     
client [5]  (testset)   loss: 0.1835 -> 0.1628  accuracy: 93.53% -> 94.12%     
client [41] (testset)   loss: 0.1296 -> 0.1408  accuracy: 95.07% -> 94.62%     
client [7]  (testset)   loss: 0.0481 -> 0.0501  accuracy: 98.22% -> 99.11%     
client [37] (testset)   loss: 0.1275 -> 0.1432  accuracy: 98.35% -> 97.52%     
client [45] (testset)   loss: 0.0734 -> 0.0698  accuracy: 97.18% -> 97.89%     
client [47] (testset)   loss: 0.0930 -> 0.1294  accuracy: 96.22% -> 95.84%     
---------------------------- TRAINING EPOCH: 140 ----------------------------  
client [16] (testset)   loss: 0.2351 -> 0.2263  accuracy: 93.28% -> 90.76%     
client [11] (testset)   loss: 0.0954 -> 0.0892  accuracy: 95.52% -> 95.96%     
client [37] (testset)   loss: 0.1395 -> 0.5674  accuracy: 95.04% -> 88.43%     
client [41] (testset)   loss: 0.1422 -> 0.1202  accuracy: 94.17% -> 95.52%     
client [95] (testset)   loss: 0.1358 -> 0.1279  accuracy: 95.31% -> 94.84%     
client [53] (testset)   loss: 0.1598 -> 0.1630  accuracy: 93.50% -> 95.12%     
client [22] (testset)   loss: 0.0743 -> 0.0714  accuracy: 97.78% -> 97.04%     
client [25] (testset)   loss: 0.2041 -> 0.2012  accuracy: 95.77% -> 95.77%     
client [69] (testset)   loss: 0.1219 -> 0.1225  accuracy: 95.00% -> 95.00%     
client [46] (testset)   loss: 0.1213 -> 0.1238  accuracy: 95.41% -> 95.41%     
---------------------------- TRAINING EPOCH: 150 ----------------------------  
client [47] (testset)   loss: 0.0973 -> 0.0973  accuracy: 96.79% -> 96.79%     
client [69] (testset)   loss: 0.1213 -> 0.1228  accuracy: 96.43% -> 95.00%     
client [82] (testset)   loss: 0.0677 -> 0.0613  accuracy: 98.48% -> 98.74%     
client [45] (testset)   loss: 0.1256 -> 0.0715  accuracy: 94.37% -> 97.89%     
client [7]  (testset)   loss: 0.1191 -> 0.0506  accuracy: 95.11% -> 98.67%     
client [50] (testset)   loss: 0.0722 -> 0.1029  accuracy: 97.75% -> 97.75%     
client [35] (testset)   loss: 0.1603 -> 0.1629  accuracy: 96.64% -> 96.64%     
client [24] (testset)   loss: 0.1616 -> 0.1629  accuracy: 95.26% -> 95.79%     
client [15] (testset)   loss: 0.1289 -> 0.1345  accuracy: 96.13% -> 95.48%     
client [58] (testset)   loss: 0.1917 -> 0.1793  accuracy: 95.41% -> 96.43%     
---------------------------- TRAINING EPOCH: 160 ----------------------------  
client [48] (testset)   loss: 0.0943 -> 0.0980  accuracy: 97.87% -> 97.87%     
client [76] (testset)   loss: 0.0726 -> 0.0912  accuracy: 96.72% -> 96.72%     
client [67] (testset)   loss: 0.0671 -> 0.0731  accuracy: 97.71% -> 96.57%     
client [37] (testset)   loss: 0.1137 -> 0.1055  accuracy: 96.69% -> 98.35%     
client [58] (testset)   loss: 0.1613 -> 0.1935  accuracy: 96.43% -> 95.92%     
client [64] (testset)   loss: 0.2049 -> 0.1950  accuracy: 94.44% -> 94.44%     
client [77] (testset)   loss: 0.2635 -> 0.2723  accuracy: 94.12% -> 94.12%     
client [55] (testset)   loss: 0.0780 -> 0.0696  accuracy: 98.13% -> 98.13%     
client [12] (testset)   loss: 0.1057 -> 0.1157  accuracy: 96.45% -> 96.45%     
client [89] (testset)   loss: 0.1226 -> 0.1232  accuracy: 96.19% -> 97.03%     
---------------------------- TRAINING EPOCH: 170 ----------------------------  
client [84] (testset)   loss: 0.0618 -> 0.0622  accuracy: 97.31% -> 98.21%     
client [51] (testset)   loss: 0.0367 -> 0.0283  accuracy: 99.00% -> 99.00%     
client [8]  (testset)   loss: 0.0317 -> 0.0301  accuracy: 98.53% -> 98.53%     
client [18] (testset)   loss: 0.1007 -> 0.0720  accuracy: 95.59% -> 97.06%     
client [94] (testset)   loss: 0.1204 -> 0.1192  accuracy: 95.12% -> 95.12%     
client [81] (testset)   loss: 0.1173 -> 0.2103  accuracy: 97.10% -> 92.12%     
client [3]  (testset)   loss: 0.2424 -> 0.2509  accuracy: 95.96% -> 95.96%     
client [11] (testset)   loss: 0.0613 -> 0.0698  accuracy: 97.31% -> 95.96%     
client [95] (testset)   loss: 0.1158 -> 0.1195  accuracy: 95.31% -> 94.84%     
client [67] (testset)   loss: 0.0736 -> 0.0768  accuracy: 97.14% -> 97.14%     
---------------------------- TRAINING EPOCH: 180 ----------------------------  
client [21] (testset)   loss: 0.0823 -> 0.0646  accuracy: 96.65% -> 98.56%     
client [79] (testset)   loss: 0.2109 -> 0.2122  accuracy: 95.24% -> 94.56%     
client [58] (testset)   loss: 0.1797 -> 0.1594  accuracy: 95.92% -> 96.94%     
client [88] (testset)   loss: 0.0037 -> 0.0045  accuracy: 100.00% -> 100.00%   
client [46] (testset)   loss: 0.1373 -> 0.1244  accuracy: 94.50% -> 95.41%     
client [11] (testset)   loss: 0.0662 -> 0.0757  accuracy: 96.86% -> 95.52%     
client [55] (testset)   loss: 0.0609 -> 0.0645  accuracy: 98.13% -> 98.13%     
client [13] (testset)   loss: 0.2048 -> 0.2565  accuracy: 95.05% -> 92.88%     
client [31] (testset)   loss: 0.0656 -> 0.0886  accuracy: 98.93% -> 97.33%     
client [75] (testset)   loss: 0.0188 -> 0.0161  accuracy: 100.00% -> 100.00%   
---------------------------- TRAINING EPOCH: 190 ----------------------------  
client [19] (testset)   loss: 0.0465 -> 0.0464  accuracy: 97.70% -> 97.70%     
client [7]  (testset)   loss: 0.0520 -> 0.0487  accuracy: 98.22% -> 98.22%     
client [57] (testset)   loss: 0.2541 -> 0.2460  accuracy: 96.81% -> 96.81%     
client [13] (testset)   loss: 0.1553 -> 0.2020  accuracy: 95.67% -> 94.43%     
client [43] (testset)   loss: 0.1896 -> 0.1773  accuracy: 94.44% -> 94.44%     
client [91] (testset)   loss: 0.0561 -> 0.0527  accuracy: 98.23% -> 98.23%     
client [10] (testset)   loss: 0.0258 -> 0.0246  accuracy: 99.51% -> 99.51%     
client [64] (testset)   loss: 0.1954 -> 0.1968  accuracy: 94.44% -> 94.44%     
client [82] (testset)   loss: 0.0579 -> 0.0617  accuracy: 98.74% -> 98.74%     
client [22] (testset)   loss: 0.0579 -> 0.0646  accuracy: 97.04% -> 96.30%     
---------------------------- TRAINING EPOCH: 200 ----------------------------  
client [20] (testset)   loss: 0.1871 -> 0.2109  accuracy: 94.37% -> 95.07%     
client [23] (testset)   loss: 0.0444 -> 0.0492  accuracy: 98.26% -> 98.26%     
client [88] (testset)   loss: 0.0038 -> 0.0033  accuracy: 100.00% -> 100.00%   
client [98] (testset)   loss: 0.1297 -> 0.1334  accuracy: 96.19% -> 96.19%     
client [79] (testset)   loss: 0.2167 -> 0.2158  accuracy: 95.24% -> 95.24%     
client [21] (testset)   loss: 0.0573 -> 0.0667  accuracy: 98.56% -> 98.56%     
client [92] (testset)   loss: 0.1389 -> 0.1407  accuracy: 96.49% -> 98.25%     
client [56] (testset)   loss: 0.1323 -> 0.1260  accuracy: 98.08% -> 98.08%     
client [5]  (testset)   loss: 0.1532 -> 0.1497  accuracy: 94.12% -> 94.12%     
client [52] (testset)   loss: 0.2333 -> 0.2409  accuracy: 96.10% -> 96.10%     
---------------------------- TRAINING EPOCH: 210 ----------------------------  
client [67] (testset)   loss: 0.0688 -> 0.0620  accuracy: 97.71% -> 97.71%     
client [54] (testset)   loss: 0.1664 -> 0.1707  accuracy: 97.35% -> 97.35%     
client [14] (testset)   loss: 0.1311 -> 0.1291  accuracy: 96.02% -> 96.02%     
client [99] (testset)   loss: 0.1877 -> 0.1629  accuracy: 95.27% -> 94.67%     
client [36] (testset)   loss: 0.0907 -> 0.2215  accuracy: 96.91% -> 93.82%     
client [30] (testset)   loss: 0.0543 -> 0.0527  accuracy: 99.35% -> 99.35%     
client [38] (testset)   loss: 0.1064 -> 0.1054  accuracy: 96.86% -> 97.38%     
client [15] (testset)   loss: 0.1231 -> 0.1216  accuracy: 96.13% -> 96.13%     
client [6]  (testset)   loss: 0.1179 -> 0.1385  accuracy: 96.71% -> 96.05%     
client [53] (testset)   loss: 0.1813 -> 0.1633  accuracy: 95.93% -> 95.93%     
---------------------------- TRAINING EPOCH: 220 ----------------------------  
client [99] (testset)   loss: 0.1581 -> 0.1648  accuracy: 94.67% -> 94.67%     
client [6]  (testset)   loss: 0.1193 -> 0.1075  accuracy: 97.37% -> 96.71%     
client [83] (testset)   loss: 0.1020 -> 0.1007  accuracy: 97.48% -> 98.32%     
client [42] (testset)   loss: 0.1866 -> 0.1913  accuracy: 95.19% -> 94.23%     
client [34] (testset)   loss: 0.0955 -> 0.1022  accuracy: 96.63% -> 97.00%     
client [15] (testset)   loss: 0.1203 -> 0.1212  accuracy: 96.13% -> 96.13%     
client [47] (testset)   loss: 0.0979 -> 0.0970  accuracy: 96.98% -> 96.98%     
client [55] (testset)   loss: 0.0617 -> 0.0602  accuracy: 98.93% -> 98.13%     
client [51] (testset)   loss: 0.0242 -> 0.0287  accuracy: 98.51% -> 99.00%     
client [95] (testset)   loss: 0.1307 -> 0.1277  accuracy: 94.84% -> 94.84%     
---------------------------- TRAINING EPOCH: 230 ----------------------------  
client [71] (testset)   loss: 0.0935 -> 0.0824  accuracy: 94.87% -> 96.15%     
client [15] (testset)   loss: 0.1253 -> 0.1206  accuracy: 95.48% -> 95.48%     
client [33] (testset)   loss: 0.0851 -> 0.0828  accuracy: 97.24% -> 96.69%     
client [99] (testset)   loss: 0.1649 -> 0.1635  accuracy: 94.08% -> 94.08%     
client [90] (testset)   loss: 0.1072 -> 0.1071  accuracy: 97.12% -> 97.12%     
client [57] (testset)   loss: 0.2480 -> 0.2552  accuracy: 96.81% -> 96.81%     
client [27] (testset)   loss: 0.0872 -> 0.0849  accuracy: 97.46% -> 97.46%     
client [78] (testset)   loss: 0.0806 -> 0.0798  accuracy: 96.39% -> 96.39%     
client [36] (testset)   loss: 0.0768 -> 0.0910  accuracy: 97.30% -> 96.91%     
client [88] (testset)   loss: 0.0030 -> 0.0030  accuracy: 100.00% -> 100.00%   
---------------------------- TRAINING EPOCH: 240 ----------------------------  
client [70] (testset)   loss: 0.1315 -> 0.1301  accuracy: 94.59% -> 91.89%     
client [35] (testset)   loss: 0.1594 -> 0.1628  accuracy: 96.64% -> 96.64%     
client [16] (testset)   loss: 0.2556 -> 0.2548  accuracy: 91.60% -> 91.60%     
client [80] (testset)   loss: 0.0282 -> 0.0258  accuracy: 98.72% -> 98.72%     
client [38] (testset)   loss: 0.0987 -> 0.1009  accuracy: 97.91% -> 97.91%     
client [78] (testset)   loss: 0.0787 -> 0.0800  accuracy: 97.59% -> 96.39%     
client [68] (testset)   loss: 0.0667 -> 0.0717  accuracy: 98.21% -> 98.21%     
client [11] (testset)   loss: 0.0687 -> 0.0743  accuracy: 95.96% -> 95.96%     
client [64] (testset)   loss: 0.1878 -> 0.1848  accuracy: 95.24% -> 94.44%     
client [82] (testset)   loss: 0.0652 -> 0.0691  accuracy: 98.74% -> 98.74%     
---------------------------- TRAINING EPOCH: 250 ----------------------------  
client [30] (testset)   loss: 0.0465 -> 0.0496  accuracy: 99.35% -> 99.35%     
client [27] (testset)   loss: 0.0828 -> 0.0849  accuracy: 97.46% -> 97.97%     
client [74] (testset)   loss: 0.0628 -> 0.0583  accuracy: 98.05% -> 97.40%     
client [45] (testset)   loss: 0.0778 -> 0.0777  accuracy: 97.89% -> 97.89%     
client [6]  (testset)   loss: 0.1260 -> 0.1246  accuracy: 96.05% -> 96.71%     
client [36] (testset)   loss: 0.0837 -> 0.0817  accuracy: 96.53% -> 95.75%     
client [63] (testset)   loss: 0.1610 -> 0.1778  accuracy: 97.22% -> 97.22%     
client [76] (testset)   loss: 0.0685 -> 0.0693  accuracy: 97.27% -> 96.72%     
client [83] (testset)   loss: 0.1033 -> 0.0971  accuracy: 97.48% -> 98.32%     
client [86] (testset)   loss: 0.1429 -> 0.1532  accuracy: 96.45% -> 96.45%     
---------------------------- TRAINING EPOCH: 260 ----------------------------  
client [83] (testset)   loss: 0.1037 -> 0.1011  accuracy: 99.16% -> 98.32%     
client [99] (testset)   loss: 0.1726 -> 0.1687  accuracy: 94.67% -> 94.67%     
client [74] (testset)   loss: 0.0660 -> 0.0706  accuracy: 98.05% -> 98.05%     
client [73] (testset)   loss: 0.0542 -> 0.0577  accuracy: 97.67% -> 97.67%     
client [29] (testset)   loss: 0.0484 -> 0.0346  accuracy: 98.26% -> 98.26%     
client [92] (testset)   loss: 0.1493 -> 0.1513  accuracy: 96.49% -> 96.49%     
client [6]  (testset)   loss: 0.1285 -> 0.1061  accuracy: 96.05% -> 96.71%     
client [61] (testset)   loss: 0.1316 -> 0.1330  accuracy: 98.11% -> 98.11%     
client [21] (testset)   loss: 0.0604 -> 0.0678  accuracy: 98.56% -> 98.09%     
client [67] (testset)   loss: 0.0663 -> 0.0617  accuracy: 97.71% -> 97.71%     
---------------------------- TRAINING EPOCH: 270 ----------------------------  
client [83] (testset)   loss: 0.0961 -> 0.1001  accuracy: 99.16% -> 98.32%     
client [32] (testset)   loss: 0.1366 -> 0.1442  accuracy: 94.70% -> 94.70%     
client [95] (testset)   loss: 0.1162 -> 0.1201  accuracy: 95.31% -> 95.77%     
client [61] (testset)   loss: 0.1344 -> 0.1288  accuracy: 98.11% -> 98.11%     
client [27] (testset)   loss: 0.0883 -> 0.0918  accuracy: 97.97% -> 97.46%     
client [25] (testset)   loss: 0.1884 -> 0.1908  accuracy: 95.77% -> 95.77%     
client [68] (testset)   loss: 0.0683 -> 0.0671  accuracy: 98.21% -> 98.21%     
client [34] (testset)   loss: 0.1050 -> 0.0949  accuracy: 96.63% -> 97.00%     
client [71] (testset)   loss: 0.0833 -> 0.0798  accuracy: 96.15% -> 96.15%     
client [89] (testset)   loss: 0.1091 -> 0.1265  accuracy: 97.88% -> 97.03%     
---------------------------- TRAINING EPOCH: 280 ----------------------------  
client [78] (testset)   loss: 0.0892 -> 0.0878  accuracy: 96.39% -> 96.39%     
client [81] (testset)   loss: 0.1135 -> 0.1181  accuracy: 97.51% -> 96.68%     
client [51] (testset)   loss: 0.0242 -> 0.0247  accuracy: 99.00% -> 99.00%     
client [54] (testset)   loss: 0.1816 -> 0.1816  accuracy: 97.35% -> 97.79%     
client [65] (testset)   loss: 0.0856 -> 0.0849  accuracy: 97.02% -> 97.45%     
client [41] (testset)   loss: 0.1469 -> 0.1523  accuracy: 95.07% -> 94.62%     
client [11] (testset)   loss: 0.0630 -> 0.0732  accuracy: 96.86% -> 95.52%     
client [85] (testset)   loss: 0.0783 -> 0.0782  accuracy: 97.38% -> 97.38%     
client [12] (testset)   loss: 0.1192 -> 0.1198  accuracy: 97.87% -> 97.87%     
client [23] (testset)   loss: 0.0432 -> 0.0450  accuracy: 98.26% -> 98.26%     
---------------------------- TRAINING EPOCH: 290 ----------------------------  
client [16] (testset)   loss: 0.2524 -> 0.2580  accuracy: 91.60% -> 91.60%     
client [65] (testset)   loss: 0.0872 -> 0.0878  accuracy: 97.02% -> 97.02%     
client [53] (testset)   loss: 0.1693 -> 0.1813  accuracy: 95.93% -> 95.93%     
client [58] (testset)   loss: 0.1794 -> 0.1817  accuracy: 96.94% -> 96.94%     
client [72] (testset)   loss: 0.0328 -> 0.0361  accuracy: 99.07% -> 98.14%     
client [7]  (testset)   loss: 0.0561 -> 0.0617  accuracy: 98.22% -> 97.78%     
client [71] (testset)   loss: 0.0908 -> 0.0861  accuracy: 94.87% -> 96.15%     
client [59] (testset)   loss: 0.0781 -> 0.0765  accuracy: 95.83% -> 96.88%     
client [86] (testset)   loss: 0.1487 -> 0.1520  accuracy: 96.45% -> 96.45%     
client [39] (testset)   loss: 0.2018 -> 0.2186  accuracy: 95.71% -> 95.09%     
---------------------------- TRAINING EPOCH: 300 ----------------------------  
client [99] (testset)   loss: 0.1692 -> 0.1670  accuracy: 94.08% -> 94.67%     
client [7]  (testset)   loss: 0.0514 -> 0.0498  accuracy: 98.67% -> 98.67%     
client [17] (testset)   loss: 0.1798 -> 0.1819  accuracy: 95.16% -> 94.35%     
client [64] (testset)   loss: 0.2009 -> 0.2015  accuracy: 94.44% -> 93.65%     
client [37] (testset)   loss: 0.0989 -> 0.1054  accuracy: 97.52% -> 98.35%     
client [29] (testset)   loss: 0.0369 -> 0.0352  accuracy: 98.26% -> 98.84%     
client [93] (testset)   loss: 0.0613 -> 0.0674  accuracy: 97.87% -> 97.87%     
client [73] (testset)   loss: 0.0519 -> 0.0527  accuracy: 98.26% -> 97.67%     
client [40] (testset)   loss: 0.0699 -> 0.0884  accuracy: 98.64% -> 98.64%     
client [76] (testset)   loss: 0.0677 -> 0.0685  accuracy: 96.72% -> 96.72%     
---------------------------- TRAINING EPOCH: 310 ----------------------------  
client [31] (testset)   loss: 0.0881 -> 0.0881  accuracy: 97.33% -> 97.33%     
client [89] (testset)   loss: 0.1195 -> 0.1201  accuracy: 97.46% -> 97.46%     
client [77] (testset)   loss: 0.2919 -> 0.2951  accuracy: 92.94% -> 92.94%     
client [90] (testset)   loss: 0.1116 -> 0.1134  accuracy: 97.12% -> 97.12%     
client [26] (testset)   loss: 0.1099 -> 0.1090  accuracy: 97.56% -> 97.56%     
client [50] (testset)   loss: 0.0885 -> 0.1030  accuracy: 97.75% -> 97.75%     
client [30] (testset)   loss: 0.0476 -> 0.0466  accuracy: 99.35% -> 99.35%     
client [70] (testset)   loss: 0.1243 -> 0.1162  accuracy: 89.19% -> 91.89%     
client [41] (testset)   loss: 0.1654 -> 0.1509  accuracy: 95.07% -> 95.07%     
client [99] (testset)   loss: 0.1770 -> 0.1745  accuracy: 95.86% -> 95.27%     
---------------------------- TRAINING EPOCH: 320 ----------------------------  
client [68] (testset)   loss: 0.0729 -> 0.0691  accuracy: 97.77% -> 98.21%     
client [70] (testset)   loss: 0.1282 -> 0.1280  accuracy: 94.59% -> 94.59%     
client [52] (testset)   loss: 0.2810 -> 0.2786  accuracy: 96.10% -> 96.10%     
client [1]  (testset)   loss: 0.2422 -> 0.2393  accuracy: 94.35% -> 94.92%     
client [2]  (testset)   loss: 0.0676 -> 0.0679  accuracy: 98.38% -> 98.05%     
client [67] (testset)   loss: 0.0655 -> 0.0619  accuracy: 97.71% -> 97.71%     
client [92] (testset)   loss: 0.1656 -> 0.1683  accuracy: 96.49% -> 96.49%     
client [35] (testset)   loss: 0.1823 -> 0.1764  accuracy: 95.80% -> 95.80%     
client [36] (testset)   loss: 0.0832 -> 0.0862  accuracy: 96.14% -> 96.14%     
client [64] (testset)   loss: 0.2113 -> 0.2021  accuracy: 94.44% -> 93.65%     
---------------------------- TRAINING EPOCH: 330 ----------------------------  
client [44] (testset)   loss: 0.0564 -> 0.2306  accuracy: 98.58% -> 92.35%     
client [6]  (testset)   loss: 0.1085 -> 0.1239  accuracy: 97.37% -> 96.05%     
client [12] (testset)   loss: 0.1230 -> 0.1270  accuracy: 97.87% -> 97.16%     
client [55] (testset)   loss: 0.0658 -> 0.0674  accuracy: 98.13% -> 98.13%     
client [29] (testset)   loss: 0.0295 -> 0.0324  accuracy: 99.42% -> 98.26%     
client [9]  (testset)   loss: 0.2351 -> 0.2350  accuracy: 94.55% -> 94.55%     
client [43] (testset)   loss: 0.1882 -> 0.1897  accuracy: 95.24% -> 95.24%     
client [77] (testset)   loss: 0.3113 -> 0.3032  accuracy: 92.94% -> 92.94%     
client [98] (testset)   loss: 0.1335 -> 0.1281  accuracy: 97.14% -> 98.10%     
client [78] (testset)   loss: 0.0865 -> 0.0848  accuracy: 96.39% -> 96.39%     
---------------------------- TRAINING EPOCH: 340 ----------------------------  
client [92] (testset)   loss: 0.1808 -> 0.1783  accuracy: 98.25% -> 98.25%     
client [80] (testset)   loss: 0.0260 -> 0.0255  accuracy: 98.72% -> 98.72%     
client [63] (testset)   loss: 0.1847 -> 0.1913  accuracy: 97.22% -> 97.22%     
client [76] (testset)   loss: 0.0695 -> 0.0850  accuracy: 96.72% -> 96.72%     
client [78] (testset)   loss: 0.0849 -> 0.0853  accuracy: 96.39% -> 96.39%     
client [25] (testset)   loss: 0.2125 -> 0.2040  accuracy: 95.77% -> 95.77%     
client [58] (testset)   loss: 0.1883 -> 0.1815  accuracy: 96.43% -> 96.43%     
client [13] (testset)   loss: 0.1736 -> 0.1979  accuracy: 95.36% -> 95.05%     
client [17] (testset)   loss: 0.1906 -> 0.1923  accuracy: 95.16% -> 95.16%     
client [38] (testset)   loss: 0.1110 -> 0.1116  accuracy: 97.91% -> 97.91%     
---------------------------- TRAINING EPOCH: 350 ----------------------------  
client [72] (testset)   loss: 0.0379 -> 0.0342  accuracy: 98.76% -> 98.76%     
client [82] (testset)   loss: 0.0709 -> 0.0771  accuracy: 98.74% -> 98.74%     
client [86] (testset)   loss: 0.1582 -> 0.1544  accuracy: 96.45% -> 96.45%     
client [51] (testset)   loss: 0.0201 -> 0.0220  accuracy: 99.50% -> 99.50%     
client [96] (testset)   loss: 0.0637 -> 0.0627  accuracy: 97.19% -> 98.25%     
client [42] (testset)   loss: 0.2230 -> 0.2123  accuracy: 94.71% -> 95.19%     
client [55] (testset)   loss: 0.0703 -> 0.0695  accuracy: 98.13% -> 98.40%     
client [13] (testset)   loss: 0.1874 -> 0.1861  accuracy: 95.67% -> 95.36%     
client [1]  (testset)   loss: 0.2513 -> 0.2404  accuracy: 94.92% -> 94.92%     
client [12] (testset)   loss: 0.1284 -> 0.1266  accuracy: 97.16% -> 97.87%     
---------------------------- TRAINING EPOCH: 360 ----------------------------  
client [68] (testset)   loss: 0.0785 -> 0.0704  accuracy: 97.77% -> 98.21%     
client [23] (testset)   loss: 0.0556 -> 0.0511  accuracy: 98.26% -> 98.26%     
client [46] (testset)   loss: 0.1404 -> 0.1412  accuracy: 95.41% -> 95.41%     
client [41] (testset)   loss: 0.1601 -> 0.1678  accuracy: 94.62% -> 95.07%     
client [25] (testset)   loss: 0.1982 -> 0.2002  accuracy: 95.77% -> 95.77%     
client [58] (testset)   loss: 0.1882 -> 0.2003  accuracy: 96.94% -> 96.43%     
client [14] (testset)   loss: 0.1412 -> 0.1417  accuracy: 96.59% -> 96.59%     
client [33] (testset)   loss: 0.0730 -> 0.0729  accuracy: 96.69% -> 96.69%     
client [85] (testset)   loss: 0.0798 -> 0.0764  accuracy: 98.50% -> 97.38%     
client [62] (testset)   loss: 0.0397 -> 0.0362  accuracy: 98.79% -> 98.18%     
---------------------------- TRAINING EPOCH: 370 ----------------------------  
client [98] (testset)   loss: 0.1312 -> 0.1323  accuracy: 98.10% -> 97.14%     
client [63] (testset)   loss: 0.1923 -> 0.2000  accuracy: 97.22% -> 96.76%     
client [70] (testset)   loss: 0.1188 -> 0.1182  accuracy: 91.89% -> 91.89%     
client [65] (testset)   loss: 0.0898 -> 0.0921  accuracy: 97.02% -> 97.02%     
client [14] (testset)   loss: 0.1395 -> 0.1389  accuracy: 96.59% -> 96.59%     
client [73] (testset)   loss: 0.0515 -> 0.0527  accuracy: 97.67% -> 97.67%     
client [34] (testset)   loss: 0.1213 -> 0.1179  accuracy: 96.63% -> 96.63%     
client [99] (testset)   loss: 0.1738 -> 0.1748  accuracy: 94.67% -> 95.27%     
client [69] (testset)   loss: 0.1220 -> 0.1194  accuracy: 96.43% -> 96.43%     
client [46] (testset)   loss: 0.1399 -> 0.1406  accuracy: 95.41% -> 95.41%     
---------------------------- TRAINING EPOCH: 380 ----------------------------  
client [99] (testset)   loss: 0.1648 -> 0.1672  accuracy: 94.08% -> 94.67%     
client [93] (testset)   loss: 0.0584 -> 0.0647  accuracy: 97.87% -> 97.87%     
client [11] (testset)   loss: 0.0689 -> 0.0677  accuracy: 96.41% -> 96.41%     
client [58] (testset)   loss: 0.1829 -> 0.1817  accuracy: 96.43% -> 96.94%     
client [81] (testset)   loss: 0.1230 -> 0.1221  accuracy: 97.10% -> 97.51%     
client [85] (testset)   loss: 0.0553 -> 0.0825  accuracy: 98.50% -> 98.13%     
client [89] (testset)   loss: 0.1203 -> 0.1399  accuracy: 97.46% -> 96.61%     
client [45] (testset)   loss: 0.1106 -> 0.0949  accuracy: 97.18% -> 97.89%     
client [8]  (testset)   loss: 0.1002 -> 0.0608  accuracy: 95.59% -> 97.06%     
client [68] (testset)   loss: 0.0731 -> 0.0718  accuracy: 98.21% -> 98.21%     
---------------------------- TRAINING EPOCH: 390 ----------------------------  
client [67] (testset)   loss: 0.1302 -> 0.0657  accuracy: 97.14% -> 97.71%     
client [72] (testset)   loss: 0.0335 -> 0.0355  accuracy: 98.45% -> 98.45%     
client [1]  (testset)   loss: 0.2349 -> 0.2345  accuracy: 94.92% -> 94.92%     
client [78] (testset)   loss: 0.0774 -> 0.0812  accuracy: 97.59% -> 97.59%     
client [83] (testset)   loss: 0.1033 -> 0.1060  accuracy: 99.16% -> 99.16%     
client [21] (testset)   loss: 0.0658 -> 0.0688  accuracy: 98.56% -> 98.56%     
client [56] (testset)   loss: 0.1566 -> 0.1613  accuracy: 98.08% -> 98.08%     
client [44] (testset)   loss: 0.0652 -> 0.0563  accuracy: 98.30% -> 98.58%     
client [92] (testset)   loss: 0.1732 -> 0.1715  accuracy: 96.49% -> 96.49%     
client [27] (testset)   loss: 0.1063 -> 0.1039  accuracy: 97.46% -> 97.46%     
---------------------------- TRAINING EPOCH: 400 ----------------------------  
client [10] (testset)   loss: 0.0256 -> 0.0257  accuracy: 99.51% -> 99.51%     
client [39] (testset)   loss: 0.2606 -> 0.2443  accuracy: 95.09% -> 95.09%     
client [65] (testset)   loss: 0.0978 -> 0.0958  accuracy: 97.02% -> 97.02%     
client [26] (testset)   loss: 0.1154 -> 0.1101  accuracy: 97.56% -> 97.56%     
client [19] (testset)   loss: 0.0440 -> 0.0459  accuracy: 97.70% -> 97.70%     
client [68] (testset)   loss: 0.0718 -> 0.0732  accuracy: 98.21% -> 98.21%     
client [41] (testset)   loss: 0.1700 -> 0.1645  accuracy: 94.17% -> 94.62%     
client [50] (testset)   loss: 0.0905 -> 0.0877  accuracy: 97.75% -> 97.75%     
client [75] (testset)   loss: 0.0058 -> 0.0061  accuracy: 100.00% -> 100.00%   
client [81] (testset)   loss: 0.1205 -> 0.1214  accuracy: 97.51% -> 97.51%     
Training... ---------------------------------------- 100% 0:13:01
FedRep's average time taken by each global epoch: 0 min 1.94 sec.              
FedRep's total running time: 0 h 13 m 1 s.                                     
==================== FedRep Experiment Results: ====================           
Display format: (before local fine-tuning) -> (after local fine-tuning)        
 So if finetune_epoch = 0, x.xx% -> 0.00% is normal.                           
 Centralized testing ONLY happens after model aggregation, so the stats between
'->' are the same.                                                             
{                                                                              
    "100": {                                                                   
        "all_clients": {                                                       
            "test": {                                                          
                "loss": "0.1182 -> 0.0000",                                    
                "accuracy": "96.30% -> 0.00%"                                  
            }                                                                  
        }                                                                      
    },                                                                         
    "200": {                                                                   
        "all_clients": {                                                       
            "test": {                                                          
                "loss": "0.1075 -> 0.0000",                                    
                "accuracy": "97.00% -> 0.00%"                                  
            }                                                                  
        }                                                                      
    },                                                                         
    "300": {                                                                   
        "all_clients": {                                                       
            "test": {                                                          
                "loss": "0.1137 -> 0.0000",                                    
                "accuracy": "97.04% -> 0.00%"                                  
            }                                                                  
        }                                                                      
    },                                                                         
    "400": {                                                                   
        "all_clients": {                                                       
            "test": {                                                          
                "loss": "0.1212 -> 0.0000",                                    
                "accuracy": "97.02% -> 0.00%"                                  
            }                                                                  
        }                                                                      
    }                                                                          
}                                                                              
==================== FedRep Max Accuracy ====================                  
all_clients:                                                                   
(test) before fine-tuning: 97.04% at epoch 300                                 
(test) after fine-tuning: 0.00% at epoch 100                                   
[0m