==================== FedRep ====================                               
Experiment Arguments:                                                          
{
│   'method': 'fedrep',
│   'dataset': {
│   │   'name': 'svhn',
│   │   'client_num': 100,
│   │   'test_ratio': 0.25,
│   │   'val_ratio': 0.0,
│   │   'seed': 42,
│   │   'split': 'sample',
│   │   'IID_ratio': 0.0,
│   │   'monitor_window_name_suffix': 'svhn-100clients-0%IID-Dir(0.5)-seed42',
│   │   'alpha': 0.5,
│   │   'min_samples_per_client': 10
│   },
│   'model': {
│   │   'name': 'avgcnn',
│   │   'use_torchvision_pretrained_weights': True,
│   │   'external_model_weights_path': None
│   },
│   'optimizer': {
│   │   'lr': 0.01,
│   │   'dampening': 0,
│   │   'weight_decay': 0,
│   │   'momentum': 0,
│   │   'nesterov': False,
│   │   'name': 'sgd'
│   },
│   'mode': 'serial',
│   'parallel': {
│   │   'ray_cluster_addr': None,
│   │   'num_cpus': None,
│   │   'num_gpus': None,
│   │   'num_workers': 2
│   },
│   'common': {
│   │   'seed': 42,
│   │   'join_ratio': 0.1,
│   │   'global_epoch': 400,
│   │   'local_epoch': 5,
│   │   'batch_size': 32,
│   │   'reset_optimizer_on_global_epoch': True,
│   │   'straggler_ratio': 0,
│   │   'straggler_min_local_epoch': 0,
│   │   'buffers': 'global',
│   │   'client_side_evaluation': True,
│   │   'test': {
│   │   │   'client': {
│   │   │   │   'interval': 100,
│   │   │   │   'finetune_epoch': 0,
│   │   │   │   'train': False,
│   │   │   │   'val': False,
│   │   │   │   'test': True
│   │   │   },
│   │   │   'server': {
│   │   │   │   'interval': -1,
│   │   │   │   'train': False,
│   │   │   │   'val': False,
│   │   │   │   'test': False,
│   │   │   │   'model_in_train_mode': False
│   │   │   }
│   │   },
│   │   'verbose_gap': 10,
│   │   'monitor': None,
│   │   'use_cuda': True,
│   │   'save_log': True,
│   │   'save_model': False,
│   │   'save_learning_curve_plot': False,
│   │   'save_metrics': True,
│   │   'delete_useless_run': True
│   },
│   'fedrep': {
│   │   'train_body_epoch': 1
│   }
}
---------------------------- TRAINING EPOCH: 10 ----------------------------   
client [77] (testset)   loss: 1.6251 -> 1.5435  accuracy: 32.33% -> 43.97%     
client [81] (testset)   loss: 1.6710 -> 1.6314  accuracy: 35.38% -> 37.95%     
client [21] (testset)   loss: 2.3907 -> 1.3904  accuracy: 16.73% -> 52.00%     
client [68] (testset)   loss: 1.3551 -> 1.1861  accuracy: 57.44% -> 62.17%     
client [93] (testset)   loss: 1.6867 -> 1.5464  accuracy: 41.12% -> 44.53%     
client [31] (testset)   loss: 1.8146 -> 1.1830  accuracy: 62.05% -> 62.05%     
client [20] (testset)   loss: 1.7703 -> 1.7303  accuracy: 38.14% -> 49.48%     
client [59] (testset)   loss: 2.2525 -> 1.7141  accuracy: 22.11% -> 40.20%     
client [48] (testset)   loss: 1.8408 -> 1.7239  accuracy: 43.98% -> 48.12%     
client [34] (testset)   loss: 1.7374 -> 1.7433  accuracy: 37.72% -> 35.09%     
---------------------------- TRAINING EPOCH: 20 ----------------------------   
client [69] (testset)   loss: 1.4707 -> 1.0818  accuracy: 47.62% -> 66.67%     
client [99] (testset)   loss: 0.9196 -> 0.8421  accuracy: 71.37% -> 75.29%     
client [67] (testset)   loss: 0.8627 -> 0.9606  accuracy: 71.57% -> 69.61%     
client [0]  (testset)   loss: 1.0823 -> 1.0789  accuracy: 65.96% -> 67.02%     
client [76] (testset)   loss: 0.7990 -> 0.9382  accuracy: 77.30% -> 72.39%     
client [41] (testset)   loss: 1.2075 -> 0.9576  accuracy: 60.95% -> 72.26%     
client [62] (testset)   loss: 1.4690 -> 1.1329  accuracy: 46.49% -> 59.03%     
client [2]  (testset)   loss: 1.3098 -> 0.8055  accuracy: 52.68% -> 79.87%     
client [14] (testset)   loss: 0.8095 -> 0.9027  accuracy: 77.07% -> 75.47%     
client [46] (testset)   loss: 1.3674 -> 1.2401  accuracy: 53.68% -> 55.26%     
---------------------------- TRAINING EPOCH: 30 ----------------------------   
client [24] (testset)   loss: 0.4906 -> 0.5417  accuracy: 85.56% -> 84.44%     
client [68] (testset)   loss: 0.5625 -> 0.5201  accuracy: 83.45% -> 84.56%     
client [57] (testset)   loss: 0.9151 -> 0.8693  accuracy: 71.02% -> 74.43%     
client [17] (testset)   loss: 0.8902 -> 0.7963  accuracy: 72.48% -> 77.18%     
client [54] (testset)   loss: 0.6816 -> 0.7375  accuracy: 80.98% -> 78.80%     
client [23] (testset)   loss: 0.9580 -> 0.6042  accuracy: 73.48% -> 83.04%     
client [35] (testset)   loss: 0.7883 -> 0.9503  accuracy: 79.63% -> 67.28%     
client [59] (testset)   loss: 0.7465 -> 0.7437  accuracy: 77.39% -> 78.39%     
client [31] (testset)   loss: 0.4720 -> 0.7302  accuracy: 85.00% -> 78.18%     
client [9]  (testset)   loss: 0.7377 -> 1.8726  accuracy: 74.15% -> 47.32%     
---------------------------- TRAINING EPOCH: 40 ----------------------------   
client [64] (testset)   loss: 0.6114 -> 0.6256  accuracy: 82.48% -> 80.77%     
client [33] (testset)   loss: 0.6713 -> 0.6454  accuracy: 83.75% -> 83.75%     
client [16] (testset)   loss: 0.5302 -> 0.5568  accuracy: 82.87% -> 82.02%     
client [44] (testset)   loss: 1.0166 -> 0.6655  accuracy: 68.99% -> 82.14%     
client [8]  (testset)   loss: 0.3247 -> 0.3671  accuracy: 90.26% -> 88.72%     
client [31] (testset)   loss: 0.4436 -> 0.4206  accuracy: 86.59% -> 87.05%     
client [47] (testset)   loss: 0.4755 -> 0.4418  accuracy: 84.47% -> 85.98%     
client [36] (testset)   loss: 0.8252 -> 0.8070  accuracy: 70.59% -> 66.67%     
client [20] (testset)   loss: 0.7295 -> 0.6885  accuracy: 80.41% -> 83.51%     
client [56] (testset)   loss: 0.9243 -> 0.8898  accuracy: 69.15% -> 73.13%     
---------------------------- TRAINING EPOCH: 50 ----------------------------   
client [4]  (testset)   loss: 0.6557 -> 0.6905  accuracy: 76.26% -> 75.80%     
client [60] (testset)   loss: 0.5193 -> 0.5265  accuracy: 80.72% -> 82.51%     
client [28] (testset)   loss: 0.7758 -> 0.7069  accuracy: 76.12% -> 79.10%     
client [25] (testset)   loss: 0.8119 -> 0.7486  accuracy: 75.00% -> 77.38%     
client [58] (testset)   loss: 0.5620 -> 0.5576  accuracy: 86.36% -> 82.73%     
client [44] (testset)   loss: 0.5915 -> 0.5947  accuracy: 82.96% -> 83.16%     
client [39] (testset)   loss: 0.5065 -> 0.5121  accuracy: 83.87% -> 86.02%     
client [29] (testset)   loss: 0.5359 -> 0.5296  accuracy: 83.81% -> 85.71%     
client [3]  (testset)   loss: 0.7679 -> 0.7043  accuracy: 79.08% -> 81.05%     
client [84] (testset)   loss: 0.7084 -> 1.0940  accuracy: 82.22% -> 71.72%     
---------------------------- TRAINING EPOCH: 60 ----------------------------   
client [21] (testset)   loss: 0.5043 -> 0.4988  accuracy: 84.36% -> 85.45%     
client [84] (testset)   loss: 0.6375 -> 1.1658  accuracy: 84.55% -> 70.55%     
client [10] (testset)   loss: 0.6555 -> 0.6246  accuracy: 84.46% -> 86.53%     
client [36] (testset)   loss: 0.7396 -> 0.6663  accuracy: 70.59% -> 68.63%     
client [65] (testset)   loss: 0.4504 -> 0.4626  accuracy: 87.22% -> 86.47%     
client [81] (testset)   loss: 0.6279 -> 0.6579  accuracy: 80.51% -> 81.54%     
client [79] (testset)   loss: 0.7395 -> 0.6758  accuracy: 78.16% -> 78.16%     
client [42] (testset)   loss: 0.4790 -> 0.8325  accuracy: 83.81% -> 75.24%     
client [11] (testset)   loss: 0.5373 -> 0.6121  accuracy: 83.61% -> 83.61%     
client [96] (testset)   loss: 0.4651 -> 0.5836  accuracy: 87.90% -> 83.47%     
---------------------------- TRAINING EPOCH: 70 ----------------------------   
client [8]  (testset)   loss: 0.2876 -> 0.4584  accuracy: 90.26% -> 86.67%     
client [53] (testset)   loss: 0.4054 -> 0.4053  accuracy: 89.83% -> 90.96%     
client [52] (testset)   loss: 0.5168 -> 0.4568  accuracy: 83.17% -> 85.08%     
client [42] (testset)   loss: 0.4673 -> 0.4919  accuracy: 86.03% -> 83.17%     
client [69] (testset)   loss: 0.4849 -> 0.5042  accuracy: 86.67% -> 85.71%     
client [59] (testset)   loss: 0.5388 -> 0.5111  accuracy: 83.92% -> 83.92%     
client [7]  (testset)   loss: 0.5158 -> 0.4988  accuracy: 84.00% -> 80.50%     
client [26] (testset)   loss: 0.2826 -> 0.2723  accuracy: 91.93% -> 92.28%     
client [49] (testset)   loss: 0.3776 -> 0.4196  accuracy: 90.75% -> 89.60%     
client [98] (testset)   loss: 0.7820 -> 0.8268  accuracy: 80.00% -> 77.02%     
---------------------------- TRAINING EPOCH: 80 ----------------------------   
client [98] (testset)   loss: 0.5486 -> 0.5636  accuracy: 85.11% -> 86.38%     
client [47] (testset)   loss: 0.5606 -> 0.3643  accuracy: 85.23% -> 89.39%     
client [21] (testset)   loss: 0.4688 -> 0.5851  accuracy: 85.82% -> 82.55%     
client [77] (testset)   loss: 0.5895 -> 0.6001  accuracy: 80.17% -> 81.90%     
client [95] (testset)   loss: 0.2989 -> 0.2967  accuracy: 91.10% -> 90.50%     
client [91] (testset)   loss: 0.8196 -> 0.7011  accuracy: 77.33% -> 81.40%     
client [14] (testset)   loss: 0.4873 -> 0.5988  accuracy: 87.73% -> 85.87%     
client [99] (testset)   loss: 0.4442 -> 0.4426  accuracy: 88.24% -> 87.06%     
client [20] (testset)   loss: 0.5580 -> 0.6117  accuracy: 87.11% -> 83.51%     
client [39] (testset)   loss: 0.6441 -> 0.5130  accuracy: 83.87% -> 86.02%     
---------------------------- TRAINING EPOCH: 90 ----------------------------   
client [52] (testset)   loss: 0.4322 -> 0.5433  accuracy: 86.98% -> 82.54%     
client [62] (testset)   loss: 0.6218 -> 2.4596  accuracy: 79.60% -> 60.54%     
client [71] (testset)   loss: 0.8010 -> 0.8848  accuracy: 78.44% -> 73.65%     
client [97] (testset)   loss: 0.6175 -> 0.5982  accuracy: 81.30% -> 82.17%     
client [30] (testset)   loss: 0.4420 -> 0.4891  accuracy: 88.93% -> 85.67%     
client [88] (testset)   loss: 0.4178 -> 0.4219  accuracy: 87.50% -> 87.86%     
client [60] (testset)   loss: 0.4802 -> 0.6110  accuracy: 84.75% -> 83.41%     
client [82] (testset)   loss: 0.4842 -> 0.5449  accuracy: 86.57% -> 80.60%     
client [91] (testset)   loss: 0.7285 -> 0.7274  accuracy: 77.33% -> 79.07%     
client [57] (testset)   loss: 0.6508 -> 1.7491  accuracy: 82.67% -> 62.22%     
---------------------------- TRAINING EPOCH: 100 ----------------------------  
client [31] (testset)   loss: 0.4568 -> 0.4192  accuracy: 88.64% -> 90.00%     
client [15] (testset)   loss: 0.5230 -> 0.5732  accuracy: 87.33% -> 87.33%     
client [71] (testset)   loss: 0.8043 -> 0.8493  accuracy: 75.45% -> 76.65%     
client [97] (testset)   loss: 0.5701 -> 0.6126  accuracy: 81.74% -> 83.48%     
client [53] (testset)   loss: 0.4034 -> 0.3984  accuracy: 90.96% -> 92.09%     
client [77] (testset)   loss: 0.7043 -> 0.6491  accuracy: 76.29% -> 80.60%     
client [76] (testset)   loss: 0.4492 -> 0.4734  accuracy: 88.04% -> 86.81%     
client [79] (testset)   loss: 0.7775 -> 0.6638  accuracy: 77.59% -> 79.89%     
client [28] (testset)   loss: 0.8003 -> 0.8566  accuracy: 79.10% -> 78.36%     
client [99] (testset)   loss: 0.4018 -> 0.4317  accuracy: 89.02% -> 87.84%     
---------------------------- TRAINING EPOCH: 110 ----------------------------  
client [97] (testset)   loss: 0.6121 -> 0.6343  accuracy: 84.78% -> 81.30%     
client [86] (testset)   loss: 0.4677 -> 0.5131  accuracy: 87.40% -> 86.64%     
client [34] (testset)   loss: 0.9128 -> 1.0173  accuracy: 75.44% -> 70.18%     
client [73] (testset)   loss: 0.2972 -> 0.3206  accuracy: 89.19% -> 89.86%     
client [5]  (testset)   loss: 0.6595 -> 0.7063  accuracy: 87.84% -> 87.84%     
client [96] (testset)   loss: 0.5736 -> 0.5168  accuracy: 84.27% -> 85.89%     
client [22] (testset)   loss: 0.5227 -> 0.5301  accuracy: 83.64% -> 84.09%     
client [60] (testset)   loss: 0.4803 -> 0.4955  accuracy: 85.65% -> 85.65%     
client [66] (testset)   loss: 0.4040 -> 0.3586  accuracy: 88.56% -> 91.04%     
client [83] (testset)   loss: 0.4379 -> 0.4147  accuracy: 87.50% -> 87.00%     
---------------------------- TRAINING EPOCH: 120 ----------------------------  
client [76] (testset)   loss: 0.4600 -> 0.5136  accuracy: 86.50% -> 86.20%     
client [65] (testset)   loss: 0.4225 -> 0.4334  accuracy: 89.47% -> 89.10%     
client [95] (testset)   loss: 0.3256 -> 0.3102  accuracy: 90.50% -> 90.50%     
client [17] (testset)   loss: 0.4982 -> 0.5279  accuracy: 87.25% -> 87.25%     
client [8]  (testset)   loss: 0.2679 -> 0.2704  accuracy: 93.33% -> 94.36%     
client [35] (testset)   loss: 0.6317 -> 0.7334  accuracy: 84.57% -> 85.80%     
client [98] (testset)   loss: 0.5438 -> 1.3858  accuracy: 87.23% -> 69.79%     
client [53] (testset)   loss: 0.4180 -> 0.4313  accuracy: 91.53% -> 91.53%     
client [43] (testset)   loss: 0.8150 -> 0.7707  accuracy: 78.38% -> 82.43%     
client [64] (testset)   loss: 0.4989 -> 0.5054  accuracy: 85.47% -> 85.90%     
---------------------------- TRAINING EPOCH: 130 ----------------------------  
client [21] (testset)   loss: 0.4761 -> 0.4536  accuracy: 87.27% -> 87.64%     
client [88] (testset)   loss: 0.4414 -> 0.4545  accuracy: 88.93% -> 87.86%     
client [38] (testset)   loss: 0.5445 -> 0.8711  accuracy: 85.42% -> 79.27%     
client [3]  (testset)   loss: 0.7019 -> 0.9401  accuracy: 84.31% -> 81.05%     
client [5]  (testset)   loss: 0.6835 -> 0.7533  accuracy: 89.19% -> 87.84%     
client [41] (testset)   loss: 0.4964 -> 0.4748  accuracy: 86.13% -> 85.77%     
client [7]  (testset)   loss: 0.4509 -> 0.4205  accuracy: 85.50% -> 86.50%     
client [37] (testset)   loss: 0.7211 -> 0.7087  accuracy: 82.20% -> 83.25%     
client [45] (testset)   loss: 0.6074 -> 0.5919  accuracy: 83.40% -> 83.82%     
client [47] (testset)   loss: 0.3829 -> 0.3623  accuracy: 89.58% -> 89.20%     
---------------------------- TRAINING EPOCH: 140 ----------------------------  
client [16] (testset)   loss: 0.6387 -> 0.6213  accuracy: 84.27% -> 83.71%     
client [11] (testset)   loss: 0.5976 -> 0.4912  accuracy: 82.30% -> 84.92%     
client [37] (testset)   loss: 0.7761 -> 0.7884  accuracy: 81.15% -> 81.68%     
client [41] (testset)   loss: 0.4799 -> 0.6116  accuracy: 86.13% -> 83.94%     
client [95] (testset)   loss: 0.3391 -> 0.3510  accuracy: 90.80% -> 90.21%     
client [53] (testset)   loss: 0.5228 -> 0.4303  accuracy: 90.40% -> 91.53%     
client [22] (testset)   loss: 0.5848 -> 0.5166  accuracy: 83.64% -> 85.91%     
client [25] (testset)   loss: 0.7292 -> 0.7187  accuracy: 80.16% -> 81.75%     
client [69] (testset)   loss: 0.5375 -> 0.5103  accuracy: 84.76% -> 85.71%     
client [46] (testset)   loss: 0.5379 -> 0.5672  accuracy: 82.63% -> 80.53%     
---------------------------- TRAINING EPOCH: 150 ----------------------------  
client [47] (testset)   loss: 0.3996 -> 0.4715  accuracy: 88.07% -> 85.80%     
client [69] (testset)   loss: 0.4994 -> 0.4817  accuracy: 88.57% -> 85.71%     
client [82] (testset)   loss: 0.5279 -> 0.5377  accuracy: 85.07% -> 86.57%     
client [45] (testset)   loss: 0.6605 -> 0.7271  accuracy: 85.48% -> 82.16%     
client [7]  (testset)   loss: 0.4100 -> 0.4647  accuracy: 90.50% -> 86.00%     
client [50] (testset)   loss: 0.6715 -> 0.6483  accuracy: 85.71% -> 87.01%     
client [35] (testset)   loss: 0.6582 -> 0.7141  accuracy: 85.80% -> 84.57%     
client [24] (testset)   loss: 0.5100 -> 0.5593  accuracy: 90.37% -> 90.00%     
client [15] (testset)   loss: 0.5224 -> 0.5426  accuracy: 88.95% -> 88.95%     
client [58] (testset)   loss: 0.5927 -> 0.7157  accuracy: 86.06% -> 83.33%     
---------------------------- TRAINING EPOCH: 160 ----------------------------  
client [48] (testset)   loss: 0.6410 -> 0.7130  accuracy: 83.46% -> 82.71%     
client [76] (testset)   loss: 0.5402 -> 0.5600  accuracy: 88.04% -> 86.50%     
client [67] (testset)   loss: 0.3107 -> 0.4632  accuracy: 88.24% -> 84.80%     
client [37] (testset)   loss: 0.8100 -> 0.8282  accuracy: 82.72% -> 81.15%     
client [58] (testset)   loss: 0.6179 -> 0.6440  accuracy: 83.94% -> 84.55%     
client [64] (testset)   loss: 0.5157 -> 0.6062  accuracy: 86.75% -> 84.62%     
client [77] (testset)   loss: 0.5860 -> 0.6457  accuracy: 85.34% -> 83.62%     
client [55] (testset)   loss: 0.3312 -> 0.3244  accuracy: 92.20% -> 91.71%     
client [12] (testset)   loss: 0.3825 -> 0.4340  accuracy: 90.11% -> 87.91%     
client [89] (testset)   loss: 0.4488 -> 0.4018  accuracy: 86.52% -> 87.23%     
---------------------------- TRAINING EPOCH: 170 ----------------------------  
client [84] (testset)   loss: 0.8005 -> 0.9210  accuracy: 84.84% -> 83.67%     
client [51] (testset)   loss: 0.5777 -> 0.5496  accuracy: 85.33% -> 86.67%     
client [8]  (testset)   loss: 0.2933 -> 0.4024  accuracy: 93.85% -> 88.21%     
client [18] (testset)   loss: 0.7203 -> 0.7366  accuracy: 84.16% -> 83.17%     
client [94] (testset)   loss: 0.4342 -> 0.4660  accuracy: 88.92% -> 87.13%     
client [81] (testset)   loss: 0.7227 -> 0.8889  accuracy: 82.56% -> 78.97%     
client [3]  (testset)   loss: 0.8905 -> 0.9723  accuracy: 85.62% -> 83.01%     
client [11] (testset)   loss: 0.5792 -> 1.4441  accuracy: 84.92% -> 70.82%     
client [95] (testset)   loss: 0.3895 -> 0.3571  accuracy: 90.50% -> 90.21%     
client [67] (testset)   loss: 0.3145 -> 0.3119  accuracy: 89.71% -> 90.69%     
---------------------------- TRAINING EPOCH: 180 ----------------------------  
client [21] (testset)   loss: 0.4915 -> 0.5712  accuracy: 88.00% -> 85.82%     
client [79] (testset)   loss: 0.7421 -> 0.7525  accuracy: 80.46% -> 80.46%     
client [58] (testset)   loss: 0.6502 -> 0.7415  accuracy: 85.76% -> 85.15%     
client [88] (testset)   loss: 0.4744 -> 0.5006  accuracy: 90.71% -> 89.64%     
client [46] (testset)   loss: 0.6846 -> 0.6116  accuracy: 80.00% -> 80.00%     
client [11] (testset)   loss: 0.5667 -> 0.5419  accuracy: 86.23% -> 85.57%     
client [55] (testset)   loss: 0.3043 -> 0.3229  accuracy: 92.68% -> 93.66%     
client [13] (testset)   loss: 0.7342 -> 0.7488  accuracy: 87.43% -> 86.39%     
client [31] (testset)   loss: 0.5203 -> 0.5297  accuracy: 90.00% -> 90.00%     
client [75] (testset)   loss: 0.7649 -> 0.7866  accuracy: 81.25% -> 83.33%     
---------------------------- TRAINING EPOCH: 190 ----------------------------  
client [19] (testset)   loss: 0.4533 -> 0.4297  accuracy: 88.49% -> 88.49%     
client [7]  (testset)   loss: 0.6370 -> 0.5851  accuracy: 84.00% -> 83.00%     
client [57] (testset)   loss: 0.7380 -> 0.7651  accuracy: 84.94% -> 85.51%     
client [13] (testset)   loss: 0.7296 -> 0.7617  accuracy: 88.48% -> 87.96%     
client [43] (testset)   loss: 0.8679 -> 0.9982  accuracy: 85.14% -> 83.11%     
client [91] (testset)   loss: 0.9295 -> 0.9500  accuracy: 80.23% -> 80.81%     
client [10] (testset)   loss: 0.7478 -> 0.7207  accuracy: 88.08% -> 89.64%     
client [64] (testset)   loss: 0.6179 -> 0.6446  accuracy: 85.47% -> 85.47%     
client [82] (testset)   loss: 0.5957 -> 0.5959  accuracy: 85.82% -> 85.82%     
client [22] (testset)   loss: 0.5741 -> 0.5743  accuracy: 85.45% -> 86.36%     
---------------------------- TRAINING EPOCH: 200 ----------------------------  
client [20] (testset)   loss: 0.6113 -> 0.6602  accuracy: 86.60% -> 88.14%     
client [23] (testset)   loss: 0.6136 -> 0.6581  accuracy: 85.65% -> 87.83%     
client [88] (testset)   loss: 0.5175 -> 0.5008  accuracy: 90.00% -> 90.71%     
client [98] (testset)   loss: 0.7234 -> 0.6111  accuracy: 84.26% -> 87.23%     
client [79] (testset)   loss: 0.7729 -> 0.7813  accuracy: 82.18% -> 81.03%     
client [21] (testset)   loss: 0.5435 -> 0.5905  accuracy: 86.91% -> 86.55%     
client [92] (testset)   loss: 0.7023 -> 0.6896  accuracy: 84.14% -> 85.52%     
client [56] (testset)   loss: 0.8223 -> 0.8110  accuracy: 78.61% -> 77.11%     
client [5]  (testset)   loss: 0.8854 -> 0.8611  accuracy: 87.84% -> 87.84%     
client [52] (testset)   loss: 0.5369 -> 0.5845  accuracy: 87.94% -> 86.67%     
---------------------------- TRAINING EPOCH: 210 ----------------------------  
client [67] (testset)   loss: 0.3149 -> 0.3403  accuracy: 90.20% -> 89.22%     
client [54] (testset)   loss: 0.5863 -> 0.5797  accuracy: 87.50% -> 85.87%     
client [14] (testset)   loss: 0.6316 -> 0.6416  accuracy: 89.33% -> 88.80%     
client [99] (testset)   loss: 0.5414 -> 0.5673  accuracy: 88.24% -> 87.84%     
client [36] (testset)   loss: 0.6788 -> 0.6820  accuracy: 80.39% -> 80.39%     
client [30] (testset)   loss: 0.6206 -> 0.6485  accuracy: 87.95% -> 87.95%     
client [38] (testset)   loss: 0.6273 -> 0.6781  accuracy: 87.24% -> 84.28%     
client [15] (testset)   loss: 0.5958 -> 0.5960  accuracy: 88.41% -> 87.06%     
client [6]  (testset)   loss: 1.2500 -> 1.3839  accuracy: 79.44% -> 79.44%     
client [53] (testset)   loss: 0.5404 -> 0.5581  accuracy: 90.96% -> 91.53%     
---------------------------- TRAINING EPOCH: 220 ----------------------------  
client [99] (testset)   loss: 0.6079 -> 0.6781  accuracy: 87.45% -> 85.10%     
client [6]  (testset)   loss: 1.3024 -> 1.3804  accuracy: 78.97% -> 79.44%     
client [83] (testset)   loss: 0.5997 -> 0.5217  accuracy: 86.00% -> 86.50%     
client [42] (testset)   loss: 0.7376 -> 0.6453  accuracy: 83.81% -> 81.90%     
client [34] (testset)   loss: 1.2141 -> 1.1344  accuracy: 78.95% -> 78.07%     
client [15] (testset)   loss: 0.6142 -> 0.6121  accuracy: 86.52% -> 87.60%     
client [47] (testset)   loss: 0.4632 -> 0.5981  accuracy: 88.26% -> 86.17%     
client [55] (testset)   loss: 0.3291 -> 0.3116  accuracy: 92.68% -> 92.20%     
client [51] (testset)   loss: 0.5161 -> 0.5185  accuracy: 89.33% -> 88.00%     
client [95] (testset)   loss: 0.4231 -> 0.4341  accuracy: 90.50% -> 89.61%     
---------------------------- TRAINING EPOCH: 230 ----------------------------  
client [71] (testset)   loss: 1.1176 -> 1.0662  accuracy: 77.25% -> 75.45%     
client [15] (testset)   loss: 0.5880 -> 0.5999  accuracy: 86.52% -> 86.52%     
client [33] (testset)   loss: 0.7552 -> 0.8562  accuracy: 83.75% -> 82.50%     
client [99] (testset)   loss: 0.5891 -> 0.5976  accuracy: 87.84% -> 87.84%     
client [90] (testset)   loss: 0.8590 -> 0.9078  accuracy: 85.07% -> 85.97%     
client [57] (testset)   loss: 0.8120 -> 0.8424  accuracy: 85.23% -> 84.94%     
client [27] (testset)   loss: 0.7991 -> 0.7996  accuracy: 84.73% -> 86.70%     
client [78] (testset)   loss: 0.5742 -> 0.5800  accuracy: 89.49% -> 90.06%     
client [36] (testset)   loss: 0.6910 -> 0.6886  accuracy: 78.43% -> 80.39%     
client [88] (testset)   loss: 0.5237 -> 0.5355  accuracy: 89.29% -> 89.29%     
---------------------------- TRAINING EPOCH: 240 ----------------------------  
client [70] (testset)   loss: 0.6819 -> 0.7212  accuracy: 90.20% -> 89.71%     
client [35] (testset)   loss: 0.8567 -> 0.8515  accuracy: 86.42% -> 85.80%     
client [16] (testset)   loss: 0.7456 -> 0.7529  accuracy: 87.64% -> 87.92%     
client [80] (testset)   loss: 0.7045 -> 0.7557  accuracy: 85.05% -> 81.96%     
client [38] (testset)   loss: 0.6670 -> 0.7377  accuracy: 87.02% -> 84.51%     
client [78] (testset)   loss: 0.5915 -> 1.4202  accuracy: 89.20% -> 76.99%     
client [68] (testset)   loss: 0.5955 -> 0.6184  accuracy: 88.46% -> 86.93%     
client [11] (testset)   loss: 0.5867 -> 0.5908  accuracy: 86.56% -> 86.23%     
client [64] (testset)   loss: 0.7101 -> 0.7434  accuracy: 84.62% -> 85.47%     
client [82] (testset)   loss: 0.6610 -> 0.6566  accuracy: 85.07% -> 86.57%     
---------------------------- TRAINING EPOCH: 250 ----------------------------  
client [30] (testset)   loss: 0.7021 -> 0.6938  accuracy: 88.27% -> 88.27%     
client [27] (testset)   loss: 0.7933 -> 0.8338  accuracy: 86.21% -> 87.19%     
client [74] (testset)   loss: 0.7946 -> 0.7903  accuracy: 85.54% -> 85.54%     
client [45] (testset)   loss: 0.9286 -> 0.9788  accuracy: 83.40% -> 83.82%     
client [6]  (testset)   loss: 1.3566 -> 1.4124  accuracy: 79.91% -> 79.91%     
client [36] (testset)   loss: 0.7396 -> 0.7075  accuracy: 82.35% -> 82.35%     
client [63] (testset)   loss: 0.6855 -> 0.5576  accuracy: 87.25% -> 86.06%     
client [76] (testset)   loss: 0.6883 -> 0.7109  accuracy: 88.04% -> 87.73%     
client [83] (testset)   loss: 0.6169 -> 0.6010  accuracy: 86.50% -> 86.50%     
client [86] (testset)   loss: 0.7028 -> 0.6787  accuracy: 87.02% -> 88.17%     
---------------------------- TRAINING EPOCH: 260 ----------------------------  
client [83] (testset)   loss: 0.6151 -> 0.6170  accuracy: 86.50% -> 86.50%     
client [99] (testset)   loss: 0.6542 -> 0.6651  accuracy: 87.84% -> 86.67%     
client [74] (testset)   loss: 0.8327 -> 0.8409  accuracy: 85.14% -> 84.74%     
client [73] (testset)   loss: 0.4471 -> 0.4414  accuracy: 88.18% -> 89.19%     
client [29] (testset)   loss: 0.6715 -> 0.6762  accuracy: 85.71% -> 86.67%     
client [92] (testset)   loss: 0.8071 -> 0.8147  accuracy: 83.45% -> 82.76%     
client [6]  (testset)   loss: 1.4350 -> 1.4067  accuracy: 80.37% -> 80.84%     
client [61] (testset)   loss: 0.6876 -> 0.7070  accuracy: 84.96% -> 83.63%     
client [21] (testset)   loss: 0.6036 -> 0.6278  accuracy: 87.27% -> 85.82%     
client [67] (testset)   loss: 0.3309 -> 0.3459  accuracy: 89.71% -> 89.22%     
---------------------------- TRAINING EPOCH: 270 ----------------------------  
client [83] (testset)   loss: 0.6073 -> 0.6273  accuracy: 86.50% -> 86.50%     
client [32] (testset)   loss: 0.6991 -> 0.7184  accuracy: 86.76% -> 88.24%     
client [95] (testset)   loss: 0.4992 -> 0.4832  accuracy: 89.32% -> 89.91%     
client [61] (testset)   loss: 0.7348 -> 0.7460  accuracy: 83.19% -> 81.86%     
client [27] (testset)   loss: 0.8352 -> 0.8499  accuracy: 87.19% -> 88.18%     
client [25] (testset)   loss: 0.8319 -> 0.8302  accuracy: 84.13% -> 84.92%     
client [68] (testset)   loss: 0.5615 -> 0.5556  accuracy: 88.60% -> 89.99%     
client [34] (testset)   loss: 1.2621 -> 1.2237  accuracy: 78.95% -> 78.07%     
client [71] (testset)   loss: 1.2514 -> 1.2688  accuracy: 74.85% -> 76.65%     
client [89] (testset)   loss: 0.4213 -> 0.4267  accuracy: 88.65% -> 89.36%     
---------------------------- TRAINING EPOCH: 280 ----------------------------  
client [78] (testset)   loss: 0.6527 -> 0.6711  accuracy: 88.07% -> 89.49%     
client [81] (testset)   loss: 0.9442 -> 0.9470  accuracy: 84.62% -> 84.10%     
client [51] (testset)   loss: 0.5585 -> 0.5612  accuracy: 88.00% -> 86.67%     
client [54] (testset)   loss: 0.6128 -> 0.6438  accuracy: 87.50% -> 85.87%     
client [65] (testset)   loss: 0.4888 -> 0.4856  accuracy: 87.59% -> 88.72%     
client [41] (testset)   loss: 0.5928 -> 0.6606  accuracy: 87.59% -> 85.77%     
client [11] (testset)   loss: 0.6362 -> 0.6628  accuracy: 86.23% -> 86.56%     
client [85] (testset)   loss: 0.6439 -> 0.6480  accuracy: 90.04% -> 90.04%     
client [12] (testset)   loss: 0.5204 -> 0.5436  accuracy: 88.79% -> 89.45%     
client [23] (testset)   loss: 0.7696 -> 0.7772  accuracy: 86.96% -> 86.96%     
---------------------------- TRAINING EPOCH: 290 ----------------------------  
client [16] (testset)   loss: 0.7538 -> 0.7906  accuracy: 87.36% -> 87.64%     
client [65] (testset)   loss: 0.4771 -> 0.5159  accuracy: 88.35% -> 87.97%     
client [53] (testset)   loss: 0.6626 -> 0.6868  accuracy: 90.40% -> 90.40%     
client [58] (testset)   loss: 0.8407 -> 0.8467  accuracy: 86.36% -> 85.76%     
client [72] (testset)   loss: 0.7254 -> 0.7400  accuracy: 86.57% -> 86.94%     
client [7]  (testset)   loss: 0.7411 -> 0.8085  accuracy: 84.00% -> 83.50%     
client [71] (testset)   loss: 1.2591 -> 1.2951  accuracy: 74.85% -> 76.65%     
client [59] (testset)   loss: 0.6880 -> 0.6693  accuracy: 87.94% -> 87.94%     
client [86] (testset)   loss: 0.8131 -> 0.7596  accuracy: 87.40% -> 87.40%     
client [39] (testset)   loss: 0.9789 -> 0.9327  accuracy: 84.95% -> 87.10%     
---------------------------- TRAINING EPOCH: 300 ----------------------------  
client [99] (testset)   loss: 0.7846 -> 0.7472  accuracy: 87.06% -> 87.06%     
client [7]  (testset)   loss: 0.7606 -> 0.6823  accuracy: 86.00% -> 85.50%     
client [17] (testset)   loss: 0.7130 -> 0.7132  accuracy: 87.92% -> 87.25%     
client [64] (testset)   loss: 0.8642 -> 0.8618  accuracy: 85.47% -> 85.47%     
client [37] (testset)   loss: 1.1749 -> 1.2166  accuracy: 81.15% -> 80.10%     
client [29] (testset)   loss: 0.7275 -> 0.7410  accuracy: 86.67% -> 86.67%     
client [93] (testset)   loss: 0.7178 -> 0.7559  accuracy: 87.59% -> 87.10%     
client [73] (testset)   loss: 0.4868 -> 0.4893  accuracy: 89.19% -> 88.85%     
client [40] (testset)   loss: 0.8271 -> 0.8186  accuracy: 87.67% -> 89.01%     
client [76] (testset)   loss: 0.7340 -> 0.7652  accuracy: 88.04% -> 88.04%     
---------------------------- TRAINING EPOCH: 310 ----------------------------  
client [31] (testset)   loss: 0.6985 -> 0.6996  accuracy: 90.00% -> 90.00%     
client [89] (testset)   loss: 0.4737 -> 0.4697  accuracy: 88.65% -> 88.65%     
client [77] (testset)   loss: 0.8075 -> 0.9161  accuracy: 84.91% -> 83.19%     
client [90] (testset)   loss: 1.0197 -> 1.0480  accuracy: 86.87% -> 85.97%     
client [26] (testset)   loss: 0.2719 -> 0.2623  accuracy: 91.23% -> 91.58%     
client [50] (testset)   loss: 0.9456 -> 0.9471  accuracy: 87.66% -> 85.71%     
client [30] (testset)   loss: 0.8091 -> 0.7886  accuracy: 88.27% -> 88.27%     
client [70] (testset)   loss: 0.7706 -> 0.7875  accuracy: 89.71% -> 89.71%     
client [41] (testset)   loss: 0.6726 -> 0.6882  accuracy: 86.86% -> 87.23%     
client [99] (testset)   loss: 0.7419 -> 0.7617  accuracy: 87.45% -> 87.45%     
---------------------------- TRAINING EPOCH: 320 ----------------------------  
client [68] (testset)   loss: 0.6527 -> 0.6602  accuracy: 89.15% -> 88.87%     
client [70] (testset)   loss: 0.7988 -> 0.8039  accuracy: 89.71% -> 89.71%     
client [52] (testset)   loss: 0.6649 -> 0.6813  accuracy: 88.25% -> 88.25%     
client [1]  (testset)   loss: 1.0560 -> 1.0567  accuracy: 82.64% -> 81.94%     
client [2]  (testset)   loss: 0.6735 -> 0.6840  accuracy: 87.92% -> 88.26%     
client [67] (testset)   loss: 0.4014 -> 0.3994  accuracy: 89.22% -> 89.22%     
client [92] (testset)   loss: 0.9286 -> 0.9412  accuracy: 83.45% -> 82.76%     
client [35] (testset)   loss: 0.9787 -> 1.0098  accuracy: 85.80% -> 85.19%     
client [36] (testset)   loss: 0.7450 -> 0.7545  accuracy: 86.27% -> 86.27%     
client [64] (testset)   loss: 0.8687 -> 0.8428  accuracy: 85.04% -> 84.19%     
---------------------------- TRAINING EPOCH: 330 ----------------------------  
client [44] (testset)   loss: 0.7270 -> 0.7278  accuracy: 87.89% -> 87.89%     
client [6]  (testset)   loss: 1.6332 -> 1.6807  accuracy: 79.91% -> 79.91%     
client [12] (testset)   loss: 0.5968 -> 0.6198  accuracy: 90.11% -> 88.57%     
client [55] (testset)   loss: 0.3888 -> 0.4230  accuracy: 92.68% -> 91.22%     
client [29] (testset)   loss: 0.7848 -> 0.7983  accuracy: 86.67% -> 85.71%     
client [9]  (testset)   loss: 0.8838 -> 0.9001  accuracy: 85.37% -> 85.37%     
client [43] (testset)   loss: 1.2385 -> 1.2838  accuracy: 81.76% -> 82.43%     
client [77] (testset)   loss: 0.8291 -> 0.8559  accuracy: 85.34% -> 84.05%     
client [98] (testset)   loss: 0.8347 -> 0.8244  accuracy: 85.96% -> 86.81%     
client [78] (testset)   loss: 0.7580 -> 0.7570  accuracy: 89.20% -> 88.92%     
---------------------------- TRAINING EPOCH: 340 ----------------------------  
client [92] (testset)   loss: 1.0200 -> 1.0106  accuracy: 82.07% -> 82.07%     
client [80] (testset)   loss: 0.9414 -> 0.9742  accuracy: 84.54% -> 84.02%     
client [63] (testset)   loss: 0.8413 -> 1.3215  accuracy: 87.25% -> 78.09%     
client [76] (testset)   loss: 0.8251 -> 0.8283  accuracy: 87.73% -> 88.04%     
client [78] (testset)   loss: 0.7793 -> 0.7817  accuracy: 89.20% -> 88.92%     
client [25] (testset)   loss: 0.9996 -> 0.9953  accuracy: 82.94% -> 83.73%     
client [58] (testset)   loss: 0.9736 -> 0.9816  accuracy: 86.36% -> 86.36%     
client [13] (testset)   loss: 1.0623 -> 1.0677  accuracy: 86.39% -> 86.39%     
client [17] (testset)   loss: 0.7788 -> 0.7876  accuracy: 87.25% -> 87.25%     
client [38] (testset)   loss: 0.9115 -> 0.9533  accuracy: 85.19% -> 85.19%     
---------------------------- TRAINING EPOCH: 350 ----------------------------  
client [72] (testset)   loss: 0.8453 -> 0.8598  accuracy: 86.57% -> 85.82%     
client [82] (testset)   loss: 0.7742 -> 0.7800  accuracy: 85.07% -> 85.82%     
client [86] (testset)   loss: 0.8666 -> 0.8612  accuracy: 87.79% -> 87.79%     
client [51] (testset)   loss: 0.6418 -> 0.6353  accuracy: 84.00% -> 85.33%     
client [96] (testset)   loss: 0.6999 -> 0.7188  accuracy: 87.10% -> 87.10%     
client [42] (testset)   loss: 0.9226 -> 0.8848  accuracy: 83.81% -> 82.22%     
client [55] (testset)   loss: 0.3940 -> 0.3915  accuracy: 92.68% -> 92.68%     
client [13] (testset)   loss: 1.0452 -> 1.0564  accuracy: 86.39% -> 86.39%     
client [1]  (testset)   loss: 1.0990 -> 1.1209  accuracy: 82.64% -> 83.33%     
client [12] (testset)   loss: 0.6153 -> 0.6229  accuracy: 89.89% -> 89.67%     
---------------------------- TRAINING EPOCH: 360 ----------------------------  
client [68] (testset)   loss: 0.7354 -> 0.7774  accuracy: 88.60% -> 88.73%     
client [23] (testset)   loss: 0.8993 -> 0.9157  accuracy: 87.83% -> 88.70%     
client [46] (testset)   loss: 0.9402 -> 0.9349  accuracy: 77.89% -> 76.32%     
client [41] (testset)   loss: 0.7436 -> 0.7472  accuracy: 86.86% -> 86.50%     
client [25] (testset)   loss: 0.9867 -> 1.0190  accuracy: 83.73% -> 84.13%     
client [58] (testset)   loss: 0.9408 -> 0.9768  accuracy: 86.97% -> 86.36%     
client [14] (testset)   loss: 0.8162 -> 0.8432  accuracy: 89.60% -> 90.13%     
client [33] (testset)   loss: 1.1064 -> 1.1306  accuracy: 85.00% -> 86.25%     
client [85] (testset)   loss: 0.7628 -> 0.7920  accuracy: 88.80% -> 89.63%     
client [62] (testset)   loss: 0.9773 -> 0.9609  accuracy: 84.11% -> 83.95%     
---------------------------- TRAINING EPOCH: 370 ----------------------------  
client [98] (testset)   loss: 0.8711 -> 0.8531  accuracy: 86.81% -> 85.96%     
client [63] (testset)   loss: 0.9066 -> 0.9418  accuracy: 86.85% -> 86.45%     
client [70] (testset)   loss: 0.9135 -> 0.9144  accuracy: 89.71% -> 89.71%     
client [65] (testset)   loss: 0.5691 -> 0.5643  accuracy: 88.35% -> 88.72%     
client [14] (testset)   loss: 0.8769 -> 0.8673  accuracy: 89.60% -> 90.13%     
client [73] (testset)   loss: 0.5509 -> 0.5472  accuracy: 89.86% -> 90.20%     
client [34] (testset)   loss: 1.4609 -> 1.4521  accuracy: 77.19% -> 77.19%     
client [99] (testset)   loss: 0.8383 -> 0.8459  accuracy: 87.45% -> 87.06%     
client [69] (testset)   loss: 0.6968 -> 0.7032  accuracy: 83.81% -> 84.76%     
client [46] (testset)   loss: 1.0006 -> 0.9708  accuracy: 75.26% -> 77.37%     
---------------------------- TRAINING EPOCH: 380 ----------------------------  
client [99] (testset)   loss: 0.8617 -> 0.8486  accuracy: 86.67% -> 87.84%     
client [93] (testset)   loss: 0.8129 -> 0.8776  accuracy: 87.35% -> 87.59%     
client [11] (testset)   loss: 0.7939 -> 0.8460  accuracy: 87.21% -> 85.90%     
client [58] (testset)   loss: 1.0417 -> 1.0495  accuracy: 86.06% -> 85.76%     
client [81] (testset)   loss: 1.1841 -> 1.1938  accuracy: 84.62% -> 85.13%     
client [85] (testset)   loss: 0.8277 -> 0.8175  accuracy: 90.46% -> 89.21%     
client [89] (testset)   loss: 0.5213 -> 0.5282  accuracy: 88.65% -> 88.65%     
client [45] (testset)   loss: 1.1788 -> 1.2067  accuracy: 84.23% -> 83.82%     
client [8]  (testset)   loss: 0.5022 -> 0.4846  accuracy: 92.31% -> 92.82%     
client [68] (testset)   loss: 0.7549 -> 0.7426  accuracy: 89.43% -> 89.43%     
---------------------------- TRAINING EPOCH: 390 ----------------------------  
client [67] (testset)   loss: 0.4378 -> 0.4430  accuracy: 89.22% -> 88.73%     
client [72] (testset)   loss: 0.9296 -> 0.9246  accuracy: 85.45% -> 85.82%     
client [1]  (testset)   loss: 1.2116 -> 1.2079  accuracy: 83.33% -> 84.72%     
client [78] (testset)   loss: 0.8437 -> 0.8313  accuracy: 89.49% -> 88.64%     
client [83] (testset)   loss: 0.7275 -> 0.7427  accuracy: 86.50% -> 87.00%     
client [21] (testset)   loss: 0.8154 -> 0.8408  accuracy: 85.45% -> 85.09%     
client [56] (testset)   loss: 1.1852 -> 1.2301  accuracy: 76.62% -> 76.62%     
client [44] (testset)   loss: 0.7794 -> 0.7964  accuracy: 88.09% -> 88.30%     
client [92] (testset)   loss: 1.0517 -> 1.0705  accuracy: 82.76% -> 82.76%     
client [27] (testset)   loss: 1.0709 -> 1.0892  accuracy: 86.70% -> 86.21%     
---------------------------- TRAINING EPOCH: 400 ----------------------------  
client [10] (testset)   loss: 1.0154 -> 1.0165  accuracy: 90.16% -> 90.16%     
client [39] (testset)   loss: 1.1047 -> 1.0866  accuracy: 86.02% -> 86.56%     
client [65] (testset)   loss: 0.5677 -> 0.5871  accuracy: 88.35% -> 84.96%     
client [26] (testset)   loss: 0.3184 -> 0.3155  accuracy: 91.23% -> 91.23%     
client [19] (testset)   loss: 0.5966 -> 0.5974  accuracy: 89.29% -> 89.29%     
client [68] (testset)   loss: 0.7435 -> 0.7623  accuracy: 88.73% -> 88.60%     
client [41] (testset)   loss: 0.8582 -> 0.8110  accuracy: 84.67% -> 85.04%     
client [50] (testset)   loss: 1.0450 -> 1.0608  accuracy: 87.66% -> 87.66%     
client [75] (testset)   loss: 1.1048 -> 1.1174  accuracy: 82.92% -> 82.50%     
client [81] (testset)   loss: 1.1525 -> 1.1581  accuracy: 84.10% -> 84.62%     
Training... ---------------------------------------- 100% 0:19:25
FedRep's average time taken by each global epoch: 0 min 2.90 sec.              
FedRep's total running time: 0 h 19 m 25 s.                                    
==================== FedRep Experiment Results: ====================           
Display format: (before local fine-tuning) -> (after local fine-tuning)        
 So if finetune_epoch = 0, x.xx% -> 0.00% is normal.                           
 Centralized testing ONLY happens after model aggregation, so the stats between
'->' are the same.                                                             
{                                                                              
    "100": {                                                                   
        "all_clients": {                                                       
            "test": {                                                          
                "loss": "0.5242 -> 0.0000",                                    
                "accuracy": "85.76% -> 0.00%"                                  
            }                                                                  
        }                                                                      
    },                                                                         
    "200": {                                                                   
        "all_clients": {                                                       
            "test": {                                                          
                "loss": "0.6333 -> 0.0000",                                    
                "accuracy": "86.66% -> 0.00%"                                  
            }                                                                  
        }                                                                      
    },                                                                         
    "300": {                                                                   
        "all_clients": {                                                       
            "test": {                                                          
                "loss": "0.7761 -> 0.0000",                                    
                "accuracy": "86.75% -> 0.00%"                                  
            }                                                                  
        }                                                                      
    },                                                                         
    "400": {                                                                   
        "all_clients": {                                                       
            "test": {                                                          
                "loss": "0.8433 -> 0.0000",                                    
                "accuracy": "86.56% -> 0.00%"                                  
            }                                                                  
        }                                                                      
    }                                                                          
}                                                                              
==================== FedRep Max Accuracy ====================                  
all_clients:                                                                   
(test) before fine-tuning: 86.75% at epoch 300                                 
(test) after fine-tuning: 0.00% at epoch 100                                   
[0m