==================== Floco ====================                                
Experiment Arguments:                                                          
{
│   'method': 'floco',
│   'dataset': {
│   │   'name': 'medmnistA',
│   │   'client_num': 100,
│   │   'test_ratio': 0.25,
│   │   'val_ratio': 0.0,
│   │   'seed': 42,
│   │   'split': 'sample',
│   │   'IID_ratio': 0.0,
│   │   'monitor_window_name_suffix': 'medmnistA-100clients-0%IID-Dir(0.5)-seed42',
│   │   'alpha': 0.5,
│   │   'min_samples_per_client': 10
│   },
│   'model': {
│   │   'name': 'lenet5',
│   │   'use_torchvision_pretrained_weights': True,
│   │   'external_model_weights_path': None
│   },
│   'optimizer': {
│   │   'lr': 0.01,
│   │   'dampening': 0,
│   │   'weight_decay': 0,
│   │   'momentum': 0,
│   │   'nesterov': False,
│   │   'name': 'sgd'
│   },
│   'mode': 'serial',
│   'parallel': {
│   │   'ray_cluster_addr': None,
│   │   'num_cpus': None,
│   │   'num_gpus': None,
│   │   'num_workers': 2
│   },
│   'common': {
│   │   'seed': 42,
│   │   'join_ratio': 0.1,
│   │   'global_epoch': 400,
│   │   'local_epoch': 5,
│   │   'batch_size': 32,
│   │   'reset_optimizer_on_global_epoch': True,
│   │   'straggler_ratio': 0,
│   │   'straggler_min_local_epoch': 0,
│   │   'buffers': 'global',
│   │   'client_side_evaluation': True,
│   │   'test': {
│   │   │   'client': {
│   │   │   │   'interval': 100,
│   │   │   │   'finetune_epoch': 0,
│   │   │   │   'train': False,
│   │   │   │   'val': False,
│   │   │   │   'test': True
│   │   │   },
│   │   │   'server': {
│   │   │   │   'interval': -1,
│   │   │   │   'train': False,
│   │   │   │   'val': False,
│   │   │   │   'test': False,
│   │   │   │   'model_in_train_mode': False
│   │   │   }
│   │   },
│   │   'verbose_gap': 10,
│   │   'monitor': None,
│   │   'use_cuda': True,
│   │   'save_log': True,
│   │   'save_model': False,
│   │   'save_learning_curve_plot': False,
│   │   'save_metrics': True,
│   │   'delete_useless_run': True
│   },
│   'floco': {
│   │   'endpoints': 10,
│   │   'tau': 10,
│   │   'rho': 0.1,
│   │   'pers_epoch': 0,
│   │   'lamda': 1
│   }
}
---------------------------- TRAINING EPOCH: 10 ----------------------------   
client [77] (testset)   loss: 4.5965 -> 9.0125  accuracy: 0.00% -> 32.50%      
client [81] (testset)   loss: 3.9157 -> 2.0635  accuracy: 10.62% -> 38.94%     
client [21] (testset)   loss: 4.4060 -> 9.9074  accuracy: 18.49% -> 2.52%      
client [68] (testset)   loss: 4.9956 -> 12.2028 accuracy: 20.57% -> 16.31%     
client [93] (testset)   loss: 4.9514 -> 9.6203  accuracy: 2.33% -> 70.93%      
client [31] (testset)   loss: 2.6877 -> 2.8526  accuracy: 58.87% -> 10.64%     
client [20] (testset)   loss: 4.9390 -> 6.3274  accuracy: 0.00% -> 8.16%       
client [59] (testset)   loss: 2.2757 -> 372.3569    accuracy: 28.18% -> 27.88% 
client [48] (testset)   loss: 4.3245 -> 60.0122 accuracy: 5.66% -> 31.45%      
client [34] (testset)   loss: 4.3958 -> 34.2033 accuracy: 2.98% -> 8.33%       
Projecting gradients ... 
---------------------------- TRAINING EPOCH: 20 ----------------------------   
client [69] (testset)   loss: 8.2041 -> 3.3375  accuracy: 29.34% -> 4.79%      
client [99] (testset)   loss: 21.6165 -> 4.2993 accuracy: 26.32% -> 29.82%     
client [67] (testset)   loss: 21.6958 -> 568.1551   accuracy: 37.43% -> 7.02%  
client [0]  (testset)   loss: 16.6735 -> 45.3238    accuracy: 18.07% -> 46.99% 
client [76] (testset)   loss: 23.2067 -> 4.8342 accuracy: 12.50% -> 12.50%     
client [41] (testset)   loss: 26.8504 -> 90.4714    accuracy: 36.81% -> 4.29%  
client [62] (testset)   loss: 12.7912 -> 28.0230    accuracy: 55.56% -> 24.89% 
client [2]  (testset)   loss: 17.8563 -> 28.7058    accuracy: 11.24% -> 0.00%  
client [14] (testset)   loss: 17.4040 -> 14.9888    accuracy: 41.94% -> 19.35% 
client [46] (testset)   loss: 17.9343 -> 192.5543   accuracy: 18.18% -> 23.38% 
---------------------------- TRAINING EPOCH: 30 ----------------------------   
client [24] (testset)   loss: 37.4993 -> 3.7066 accuracy: 7.00% -> 35.00%      
client [68] (testset)   loss: 17.7374 -> 64.0301    accuracy: 16.31% -> 12.06% 
client [57] (testset)   loss: 27.4916 -> 67.9787    accuracy: 26.79% -> 1.44%  
client [17] (testset)   loss: 22.1253 -> 39.8602    accuracy: 3.88% -> 58.91%  
client [54] (testset)   loss: 26.9047 -> 32.7747    accuracy: 1.11% -> 1.11%   
client [23] (testset)   loss: 18.5084 -> 21.8285    accuracy: 1.02% -> 1.02%   
client [35] (testset)   loss: 52.9493 -> 82.0592    accuracy: 0.00% -> 0.00%   
client [59] (testset)   loss: 32.2894 -> 132.0228   accuracy: 1.52% -> 27.88%  
client [31] (testset)   loss: 19.9655 -> 41.7047    accuracy: 12.77% -> 56.74% 
client [9]  (testset)   loss: 38.0250 -> 227.5479   accuracy: 2.07% -> 11.40%  
---------------------------- TRAINING EPOCH: 40 ----------------------------   
client [64] (testset)   loss: 26.1517 -> 237.8368   accuracy: 42.50% -> 44.17% 
client [33] (testset)   loss: 29.3796 -> 119.8398   accuracy: 27.38% -> 9.52%  
client [16] (testset)   loss: 48.4430 -> 457.5438   accuracy: 0.85% -> 15.25%  
client [44] (testset)   loss: 21.9512 -> 75.2295    accuracy: 57.08% -> 57.08% 
client [8]  (testset)   loss: 34.8607 -> 140.3820   accuracy: 12.76% -> 29.22% 
client [31] (testset)   loss: 23.2590 -> 70.5423    accuracy: 53.90% -> 58.87% 
client [47] (testset)   loss: 27.5048 -> 88.5692    accuracy: 0.00% -> 40.35%  
client [36] (testset)   loss: 37.4515 -> 180.4145   accuracy: 13.64% -> 32.58% 
client [20] (testset)   loss: 24.3595 -> 129.5580   accuracy: 8.16% -> 0.00%   
client [56] (testset)   loss: 34.1412 -> 23.0284    accuracy: 0.00% -> 47.30%  
---------------------------- TRAINING EPOCH: 50 ----------------------------   
client [4]  (testset)   loss: 63.9468 -> 87.8006    accuracy: 32.38% -> 18.10% 
client [60] (testset)   loss: 79.2801 -> 656.8690   accuracy: 1.89% -> 1.89%   
client [28] (testset)   loss: 88.0866 -> 104.9989   accuracy: 17.81% -> 17.81% 
client [25] (testset)   loss: 32.8630 -> 152.5078   accuracy: 7.69% -> 2.56%   
client [58] (testset)   loss: 60.5109 -> 7.3350 accuracy: 6.75% -> 11.51%      
client [44] (testset)   loss: 24.9742 -> 134.7850   accuracy: 62.39% -> 57.08% 
client [39] (testset)   loss: 49.7097 -> 106.9714   accuracy: 24.55% -> 24.55% 
client [29] (testset)   loss: 75.3279 -> 153.4137   accuracy: 10.16% -> 5.88%  
client [3]  (testset)   loss: 68.3786 -> 19.2198    accuracy: 13.29% -> 12.59% 
client [84] (testset)   loss: 104.7019 -> 165.0989  accuracy: 0.68% -> 2.05%   
---------------------------- TRAINING EPOCH: 60 ----------------------------   
client [21] (testset)   loss: 27.9956 -> 563.5491   accuracy: 6.72% -> 0.00%   
client [84] (testset)   loss: 16.2301 -> 43.6968    accuracy: 21.23% -> 0.00%  
client [10] (testset)   loss: 30.4103 -> 180.5521   accuracy: 3.00% -> 3.00%   
client [36] (testset)   loss: 15.8447 -> 94.3683    accuracy: 3.03% -> 32.58%  
client [65] (testset)   loss: 38.6679 -> 245.7641   accuracy: 7.41% -> 6.48%   
client [81] (testset)   loss: 24.5442 -> 5.2870 accuracy: 3.32% -> 21.02%      
client [79] (testset)   loss: 21.1251 -> 63.0555    accuracy: 1.67% -> 13.33%  
client [42] (testset)   loss: 43.6201 -> 171.1496   accuracy: 0.63% -> 26.67%  
client [11] (testset)   loss: 24.5916 -> 245.5243   accuracy: 1.38% -> 0.46%   
client [96] (testset)   loss: 22.8017 -> 19.8400    accuracy: 5.26% -> 22.49%  
---------------------------- TRAINING EPOCH: 70 ----------------------------   
client [8]  (testset)   loss: 32.5477 -> 34.1898    accuracy: 18.11% -> 8.64%  
client [53] (testset)   loss: 38.8147 -> 116.2697   accuracy: 2.31% -> 3.85%   
client [52] (testset)   loss: 21.6123 -> 207.6945   accuracy: 13.06% -> 6.76%  
client [42] (testset)   loss: 32.5782 -> 118.6363   accuracy: 14.60% -> 7.94%  
client [69] (testset)   loss: 27.1093 -> 157.8774   accuracy: 1.80% -> 1.80%   
client [59] (testset)   loss: 21.4742 -> 133.8778   accuracy: 7.88% -> 3.33%   
client [7]  (testset)   loss: 33.9034 -> 163.6541   accuracy: 5.26% -> 2.63%   
client [26] (testset)   loss: 28.9716 -> 7.2709 accuracy: 14.74% -> 70.51%     
client [49] (testset)   loss: 43.4085 -> 116.2438   accuracy: 1.00% -> 17.00%  
client [98] (testset)   loss: 38.9727 -> 166.1961   accuracy: 0.66% -> 18.54%  
---------------------------- TRAINING EPOCH: 80 ----------------------------   
client [98] (testset)   loss: 587.9250 -> 60.3193   accuracy: 18.54% -> 0.00%  
client [47] (testset)   loss: 464.2370 -> 22.4344   accuracy: 40.35% -> 40.35% 
client [21] (testset)   loss: 587.7425 -> 22.6693   accuracy: 0.84% -> 10.08%  
client [77] (testset)   loss: 749.0581 -> 96.3352   accuracy: 7.50% -> 32.50%  
client [95] (testset)   loss: 448.9017 -> 13.3949   accuracy: 0.00% -> 71.20%  
client [91] (testset)   loss: 731.9411 -> 138.0441  accuracy: 18.63% -> 11.76% 
client [14] (testset)   loss: 375.5967 -> 8.2240    accuracy: 8.06% -> 9.68%   
client [99] (testset)   loss: 471.3175 -> 58.5586   accuracy: 7.02% -> 7.02%   
client [20] (testset)   loss: 628.6034 -> 27.4684   accuracy: 0.00% -> 8.16%   
client [39] (testset)   loss: 525.4360 -> 75.1659   accuracy: 24.55% -> 10.00% 
---------------------------- TRAINING EPOCH: 90 ----------------------------   
client [52] (testset)   loss: 158.5692 -> 145.7440  accuracy: 0.45% -> 0.00%   
client [62] (testset)   loss: 169.8585 -> 43.6375   accuracy: 15.11% -> 15.11% 
client [71] (testset)   loss: 166.5772 -> 99.9016   accuracy: 45.45% -> 2.27%  
client [97] (testset)   loss: 260.2369 -> 44.6226   accuracy: 4.49% -> 8.43%   
client [30] (testset)   loss: 90.3165 -> 35.6822    accuracy: 0.72% -> 13.67%  
client [88] (testset)   loss: 117.5745 -> 68.9426   accuracy: 6.80% -> 15.53%  
client [60] (testset)   loss: 99.0451 -> 87.3513    accuracy: 1.89% -> 1.89%   
client [82] (testset)   loss: 263.2470 -> 589.8071  accuracy: 3.42% -> 3.42%   
client [91] (testset)   loss: 263.7629 -> 50.8006   accuracy: 18.63% -> 43.14% 
client [57] (testset)   loss: 248.5938 -> 83.7519   accuracy: 31.58% -> 0.96%  
---------------------------- TRAINING EPOCH: 100 ----------------------------  
client [31] (testset)   loss: 41.0405 -> 29.4379    accuracy: 4.26% -> 12.06%  
client [15] (testset)   loss: 54.5339 -> 69.4066    accuracy: 36.13% -> 31.94% 
client [71] (testset)   loss: 54.2697 -> 4.6933 accuracy: 45.45% -> 46.59%     
client [97] (testset)   loss: 103.1954 -> 17.6539   accuracy: 23.03% -> 48.88% 
client [53] (testset)   loss: 53.0840 -> 120.2428   accuracy: 36.92% -> 33.08% 
client [77] (testset)   loss: 85.9716 -> 29.8451    accuracy: 7.50% -> 26.25%  
client [76] (testset)   loss: 57.8110 -> 69.4988    accuracy: 19.53% -> 10.94% 
client [79] (testset)   loss: 51.0711 -> 1.9797 accuracy: 13.33% -> 51.67%     
client [28] (testset)   loss: 52.1409 -> 63.9475    accuracy: 17.81% -> 15.07% 
client [99] (testset)   loss: 52.6616 -> 113.0629   accuracy: 7.02% -> 3.51%   
---------------------------- TRAINING EPOCH: 110 ----------------------------  
client [97] (testset)   loss: 70.5964 -> 41.4995    accuracy: 3.37% -> 2.81%   
client [86] (testset)   loss: 46.8661 -> 53.3023    accuracy: 18.99% -> 7.59%  
client [34] (testset)   loss: 60.7594 -> 71.5657    accuracy: 14.29% -> 0.00%  
client [73] (testset)   loss: 37.0677 -> 39.7411    accuracy: 0.00% -> 0.00%   
client [5]  (testset)   loss: 56.5804 -> 144.8034   accuracy: 2.56% -> 0.85%   
client [96] (testset)   loss: 59.1235 -> 245.6145   accuracy: 26.79% -> 1.44%  
client [22] (testset)   loss: 34.1190 -> 75.3475    accuracy: 0.85% -> 1.71%   
client [60] (testset)   loss: 20.2096 -> 2724.2839  accuracy: 61.32% -> 2.83%  
client [66] (testset)   loss: 45.4921 -> 50.7566    accuracy: 33.33% -> 30.67% 
client [83] (testset)   loss: 14.0685 -> 47.1936    accuracy: 65.76% -> 3.80%  
---------------------------- TRAINING EPOCH: 120 ----------------------------  
client [76] (testset)   loss: 200.7979 -> 129.7849  accuracy: 36.72% -> 18.75% 
client [65] (testset)   loss: 239.8265 -> 127.0921  accuracy: 37.96% -> 6.48%  
client [95] (testset)   loss: 97.7506 -> 79.1389    accuracy: 70.40% -> 70.40% 
client [17] (testset)   loss: 132.2408 -> 8.3189    accuracy: 58.91% -> 58.91% 
client [8]  (testset)   loss: 288.0043 -> 56.1390   accuracy: 12.35% -> 17.28% 
client [35] (testset)   loss: 231.4970 -> 76.6032   accuracy: 36.16% -> 19.21% 
client [98] (testset)   loss: 224.5384 -> 93.5515   accuracy: 6.62% -> 7.28%   
client [53] (testset)   loss: 252.9957 -> 358.7851  accuracy: 36.92% -> 3.85%  
client [43] (testset)   loss: 128.4064 -> 31.5872   accuracy: 46.33% -> 26.61% 
client [64] (testset)   loss: 241.6738 -> 177.1908  accuracy: 42.50% -> 2.50%  
---------------------------- TRAINING EPOCH: 130 ----------------------------  
client [21] (testset)   loss: 18.1540 -> 703.8578   accuracy: 0.00% -> 2.52%   
client [88] (testset)   loss: 23.5577 -> 117.4268   accuracy: 0.00% -> 0.00%   
client [38] (testset)   loss: 16.2939 -> 26.2613    accuracy: 1.11% -> 73.33%  
client [3]  (testset)   loss: 31.8796 -> 137.5415   accuracy: 2.10% -> 9.79%   
client [5]  (testset)   loss: 18.4777 -> 65.5396    accuracy: 3.42% -> 2.56%   
client [41] (testset)   loss: 13.2221 -> 193.1518   accuracy: 1.23% -> 0.00%   
client [7]  (testset)   loss: 17.6711 -> 50.0874    accuracy: 61.40% -> 1.75%  
client [37] (testset)   loss: 17.3148 -> 56.3406    accuracy: 2.48% -> 2.48%   
client [45] (testset)   loss: 17.3667 -> 45.0740    accuracy: 9.52% -> 8.33%   
client [47] (testset)   loss: 31.3739 -> 6.4726 accuracy: 1.75% -> 19.30%      
---------------------------- TRAINING EPOCH: 140 ----------------------------  
client [16] (testset)   loss: 85.3401 -> 1357.4436  accuracy: 0.85% -> 0.85%   
client [11] (testset)   loss: 103.8936 -> 135.8265  accuracy: 0.92% -> 1.38%   
client [37] (testset)   loss: 62.0308 -> 5.6963 accuracy: 2.48% -> 33.88%      
client [41] (testset)   loss: 130.5965 -> 36.3135   accuracy: 1.23% -> 0.00%   
client [95] (testset)   loss: 47.2743 -> 8.4562 accuracy: 3.20% -> 24.80%      
client [53] (testset)   loss: 77.7313 -> 276.0138   accuracy: 0.77% -> 6.92%   
client [22] (testset)   loss: 56.4148 -> 318.4270   accuracy: 0.00% -> 0.00%   
client [25] (testset)   loss: 77.4076 -> 499.1878   accuracy: 8.97% -> 2.56%   
client [69] (testset)   loss: 102.2990 -> 70.1399   accuracy: 2.40% -> 25.15%  
client [46] (testset)   loss: 63.4149 -> 444.3575   accuracy: 24.68% -> 23.38% 
---------------------------- TRAINING EPOCH: 150 ----------------------------  
client [47] (testset)   loss: 67.7086 -> 86.4331    accuracy: 40.35% -> 1.17%  
client [69] (testset)   loss: 82.0461 -> 41.3029    accuracy: 34.73% -> 10.18% 
client [82] (testset)   loss: 88.7684 -> 213.1133   accuracy: 3.42% -> 0.00%   
client [45] (testset)   loss: 53.3231 -> 56.8739    accuracy: 31.55% -> 10.12% 
client [7]  (testset)   loss: 101.3706 -> 42.8250   accuracy: 2.63% -> 5.26%   
client [50] (testset)   loss: 80.0016 -> 256.6785   accuracy: 20.21% -> 12.23% 
client [35] (testset)   loss: 90.5971 -> 32.9892    accuracy: 6.78% -> 6.78%   
client [24] (testset)   loss: 57.6126 -> 77.6832    accuracy: 21.00% -> 5.00%  
client [15] (testset)   loss: 94.5193 -> 13.1347    accuracy: 7.85% -> 36.13%  
client [58] (testset)   loss: 97.0416 -> 31.3181    accuracy: 6.75% -> 8.33%   
---------------------------- TRAINING EPOCH: 160 ----------------------------  
client [48] (testset)   loss: 12.7675 -> 141.9308   accuracy: 35.22% -> 0.00%  
client [76] (testset)   loss: 8.1646 -> 779.1042    accuracy: 32.03% -> 18.75% 
client [67] (testset)   loss: 17.4627 -> 211.3453   accuracy: 37.43% -> 0.00%  
client [37] (testset)   loss: 10.9728 -> 51.5381    accuracy: 60.33% -> 2.48%  
client [58] (testset)   loss: 25.9758 -> 138.7097   accuracy: 9.13% -> 7.54%   
client [64] (testset)   loss: 7.0822 -> 10.5502 accuracy: 48.33% -> 43.33%     
client [77] (testset)   loss: 11.5627 -> 168.7532   accuracy: 0.00% -> 26.25%  
client [55] (testset)   loss: 6.1284 -> 12.0849 accuracy: 28.65% -> 1.12%      
client [12] (testset)   loss: 9.1696 -> 45.1887 accuracy: 6.30% -> 21.26%      
client [89] (testset)   loss: 26.6650 -> 221.2288   accuracy: 8.16% -> 4.08%   
---------------------------- TRAINING EPOCH: 170 ----------------------------  
client [84] (testset)   loss: 116.9216 -> 270.5742  accuracy: 3.42% -> 0.00%   
client [51] (testset)   loss: 77.9994 -> 50.3116    accuracy: 14.86% -> 7.43%  
client [8]  (testset)   loss: 91.1490 -> 6.5721 accuracy: 12.35% -> 16.05%     
client [18] (testset)   loss: 75.8492 -> 167.0931   accuracy: 33.11% -> 3.97%  
client [94] (testset)   loss: 35.9613 -> 50.8217    accuracy: 61.70% -> 55.32% 
client [81] (testset)   loss: 76.5266 -> 165.5286   accuracy: 10.62% -> 9.29%  
client [3]  (testset)   loss: 88.6355 -> 115.7902   accuracy: 0.00% -> 9.79%   
client [11] (testset)   loss: 100.5045 -> 97.8486   accuracy: 15.14% -> 15.14% 
client [95] (testset)   loss: 31.8838 -> 18.4431    accuracy: 70.40% -> 10.40% 
client [67] (testset)   loss: 122.5814 -> 2686.6320 accuracy: 0.00% -> 7.02%   
---------------------------- TRAINING EPOCH: 180 ----------------------------  
client [21] (testset)   loss: 49.9123 -> 461.7363   accuracy: 0.00% -> 10.08%  
client [79] (testset)   loss: 41.4996 -> 6.7105 accuracy: 1.67% -> 21.67%      
client [58] (testset)   loss: 32.8610 -> 89.8783    accuracy: 1.98% -> 8.73%   
client [88] (testset)   loss: 50.6454 -> 74.4755    accuracy: 0.00% -> 6.80%   
client [46] (testset)   loss: 47.2522 -> 202.9273   accuracy: 2.60% -> 23.38%  
client [11] (testset)   loss: 48.7540 -> 138.0700   accuracy: 33.94% -> 1.38%  
client [55] (testset)   loss: 44.5990 -> 30.9026    accuracy: 2.81% -> 0.00%   
client [13] (testset)   loss: 27.1154 -> 8.7802 accuracy: 31.02% -> 45.83%     
client [31] (testset)   loss: 52.1989 -> 37.5684    accuracy: 2.13% -> 4.26%   
client [75] (testset)   loss: 36.8086 -> 28.2465    accuracy: 0.50% -> 21.00%  
---------------------------- TRAINING EPOCH: 190 ----------------------------  
client [19] (testset)   loss: 29.8869 -> 29.3041    accuracy: 9.09% -> 7.07%   
client [7]  (testset)   loss: 28.1648 -> 377.4811   accuracy: 20.18% -> 2.63%  
client [57] (testset)   loss: 26.1216 -> 40.0362    accuracy: 33.01% -> 24.40% 
client [13] (testset)   loss: 19.3319 -> 15.1783    accuracy: 38.89% -> 25.46% 
client [43] (testset)   loss: 24.9583 -> 46.8691    accuracy: 4.13% -> 26.61%  
client [91] (testset)   loss: 33.5978 -> 84.9008    accuracy: 15.69% -> 11.76% 
client [10] (testset)   loss: 45.7995 -> 61.8782    accuracy: 2.15% -> 64.38%  
client [64] (testset)   loss: 37.2741 -> 492.0814   accuracy: 2.50% -> 2.50%   
client [82] (testset)   loss: 37.6266 -> 280.5219   accuracy: 0.00% -> 3.42%   
client [22] (testset)   loss: 19.1049 -> 3969.3427  accuracy: 15.38% -> 15.38% 
---------------------------- TRAINING EPOCH: 200 ----------------------------  
client [20] (testset)   loss: 354.4781 -> 86.2861   accuracy: 0.00% -> 0.00%   
client [23] (testset)   loss: 205.5058 -> 204.3059  accuracy: 1.02% -> 1.02%   
client [88] (testset)   loss: 174.9835 -> 196.9876  accuracy: 6.80% -> 6.80%   
client [98] (testset)   loss: 375.1173 -> 77.2883   accuracy: 18.54% -> 24.50% 
client [79] (testset)   loss: 329.0402 -> 7.3470    accuracy: 13.33% -> 25.00% 
client [21] (testset)   loss: 350.1711 -> 224.7857  accuracy: 0.84% -> 0.00%   
client [92] (testset)   loss: 219.9858 -> 232.7206  accuracy: 0.00% -> 8.97%   
client [56] (testset)   loss: 297.3407 -> 49.6705   accuracy: 18.92% -> 3.38%  
client [5]  (testset)   loss: 343.7439 -> 45.2745   accuracy: 7.69% -> 7.69%   
client [52] (testset)   loss: 262.0494 -> 30.3756   accuracy: 1.35% -> 6.76%   
---------------------------- TRAINING EPOCH: 210 ----------------------------  
client [67] (testset)   loss: 187.4311 -> 2662.6914 accuracy: 0.58% -> 0.58%   
client [54] (testset)   loss: 105.2679 -> 200.4818  accuracy: 36.16% -> 3.69%  
client [14] (testset)   loss: 131.5336 -> 29.9719   accuracy: 0.00% -> 1.61%   
client [99] (testset)   loss: 67.4044 -> 49.4420    accuracy: 7.02% -> 35.09%  
client [36] (testset)   loss: 111.8026 -> 18.3379   accuracy: 8.33% -> 37.12%  
client [30] (testset)   loss: 82.6133 -> 101.3598   accuracy: 9.35% -> 15.11%  
client [38] (testset)   loss: 104.8576 -> 50.6517   accuracy: 0.00% -> 1.11%   
client [15] (testset)   loss: 114.1904 -> 33.9939   accuracy: 5.76% -> 36.13%  
client [6]  (testset)   loss: 136.8127 -> 42.0715   accuracy: 20.54% -> 1.79%  
client [53] (testset)   loss: 145.0961 -> 62.4903   accuracy: 0.77% -> 1.54%   
---------------------------- TRAINING EPOCH: 220 ----------------------------  
client [99] (testset)   loss: 99.7381 -> 83.3970    accuracy: 7.02% -> 7.02%   
client [6]  (testset)   loss: 127.0396 -> 46.3610   accuracy: 23.21% -> 21.43% 
client [83] (testset)   loss: 88.1328 -> 108.1782   accuracy: 66.30% -> 5.98%  
client [42] (testset)   loss: 103.3283 -> 79.6049   accuracy: 26.67% -> 35.24% 
client [34] (testset)   loss: 160.9241 -> 43.7716   accuracy: 0.00% -> 21.43%  
client [15] (testset)   loss: 121.2737 -> 6.8148    accuracy: 36.13% -> 36.13% 
client [47] (testset)   loss: 83.9432 -> 85.8334    accuracy: 40.35% -> 40.35% 
client [55] (testset)   loss: 40.6195 -> 16.6498    accuracy: 24.72% -> 16.29% 
client [51] (testset)   loss: 114.2947 -> 34.4819   accuracy: 10.14% -> 11.49% 
client [95] (testset)   loss: 44.8485 -> 28.1136    accuracy: 70.40% -> 12.00% 
---------------------------- TRAINING EPOCH: 230 ----------------------------  
client [71] (testset)   loss: 23.7151 -> 32.9874    accuracy: 12.50% -> 45.45% 
client [15] (testset)   loss: 28.5878 -> 11.7447    accuracy: 36.13% -> 5.76%  
client [33] (testset)   loss: 24.3053 -> 114.3980   accuracy: 29.76% -> 7.14%  
client [99] (testset)   loss: 20.0255 -> 47.7910    accuracy: 33.33% -> 3.51%  
client [90] (testset)   loss: 39.4377 -> 89.8003    accuracy: 20.83% -> 23.61% 
client [57] (testset)   loss: 41.2121 -> 61.5195    accuracy: 22.97% -> 32.54% 
client [27] (testset)   loss: 34.2253 -> 40.2224    accuracy: 12.29% -> 27.12% 
client [78] (testset)   loss: 45.0794 -> 5.6594 accuracy: 3.15% -> 21.62%      
client [36] (testset)   loss: 22.4036 -> 39.6003    accuracy: 14.39% -> 32.58% 
client [88] (testset)   loss: 12.4650 -> 21.0812    accuracy: 1.94% -> 23.30%  
---------------------------- TRAINING EPOCH: 240 ----------------------------  
client [70] (testset)   loss: 46.2413 -> 39.3264    accuracy: 0.00% -> 11.66%  
client [35] (testset)   loss: 77.4302 -> 347.7039   accuracy: 1.13% -> 1.69%   
client [16] (testset)   loss: 53.2294 -> 44.1535    accuracy: 0.85% -> 0.85%   
client [80] (testset)   loss: 29.7085 -> 50.8376    accuracy: 56.49% -> 5.34%  
client [38] (testset)   loss: 40.6534 -> 25.4054    accuracy: 0.00% -> 73.33%  
client [78] (testset)   loss: 58.1816 -> 124.2023   accuracy: 10.81% -> 0.90%  
client [68] (testset)   loss: 35.4175 -> 44.6324    accuracy: 41.84% -> 30.50% 
client [11] (testset)   loss: 73.8450 -> 70.1204    accuracy: 1.38% -> 1.38%   
client [64] (testset)   loss: 63.6149 -> 44.9325    accuracy: 2.50% -> 6.67%   
client [82] (testset)   loss: 70.7967 -> 75.1533    accuracy: 0.00% -> 31.62%  
---------------------------- TRAINING EPOCH: 250 ----------------------------  
client [30] (testset)   loss: 45.3136 -> 1580.5594  accuracy: 46.04% -> 1.44%  
client [27] (testset)   loss: 66.8546 -> 860.5875   accuracy: 3.81% -> 27.12%  
client [74] (testset)   loss: 69.9203 -> 81.1803    accuracy: 10.56% -> 10.56% 
client [45] (testset)   loss: 63.8032 -> 211.7378   accuracy: 0.00% -> 8.93%   
client [6]  (testset)   loss: 67.4366 -> 16.6786    accuracy: 6.25% -> 25.00%  
client [36] (testset)   loss: 55.0980 -> 41.5433    accuracy: 0.76% -> 32.58%  
client [63] (testset)   loss: 75.5875 -> 106.2523   accuracy: 3.28% -> 4.92%   
client [76] (testset)   loss: 84.3805 -> 46.1695    accuracy: 18.75% -> 31.25% 
client [83] (testset)   loss: 55.3361 -> 16.2417    accuracy: 5.98% -> 63.59%  
client [86] (testset)   loss: 76.8558 -> 223.8776   accuracy: 7.59% -> 12.66%  
---------------------------- TRAINING EPOCH: 260 ----------------------------  
client [83] (testset)   loss: 30.2994 -> 62.8846    accuracy: 3.80% -> 5.43%   
client [99] (testset)   loss: 16.2297 -> 77.0487    accuracy: 3.51% -> 31.58%  
client [74] (testset)   loss: 20.9114 -> 180.8015   accuracy: 1.11% -> 7.22%   
client [73] (testset)   loss: 26.1200 -> 11.3250    accuracy: 1.72% -> 12.88%  
client [29] (testset)   loss: 20.9600 -> 32.0323    accuracy: 5.88% -> 31.02%  
client [92] (testset)   loss: 13.9517 -> 45.9188    accuracy: 12.82% -> 5.13%  
client [6]  (testset)   loss: 25.8746 -> 13.5430    accuracy: 1.79% -> 14.29%  
client [61] (testset)   loss: 27.7909 -> 147.6288   accuracy: 0.00% -> 6.31%   
client [21] (testset)   loss: 20.0015 -> 106.1687   accuracy: 0.00% -> 7.56%   
client [67] (testset)   loss: 26.6296 -> 253.9339   accuracy: 0.00% -> 37.43%  
---------------------------- TRAINING EPOCH: 270 ----------------------------  
client [83] (testset)   loss: 57.8783 -> 152.1894   accuracy: 3.80% -> 3.80%   
client [32] (testset)   loss: 37.2684 -> 59.5290    accuracy: 10.00% -> 7.14%  
client [95] (testset)   loss: 47.7676 -> 1.9617 accuracy: 3.20% -> 70.40%      
client [61] (testset)   loss: 44.0284 -> 123.4963   accuracy: 0.00% -> 8.11%   
client [27] (testset)   loss: 48.3606 -> 115.9512   accuracy: 8.90% -> 12.29%  
client [25] (testset)   loss: 24.3245 -> 251.9535   accuracy: 2.56% -> 7.69%   
client [68] (testset)   loss: 50.0560 -> 203.7155   accuracy: 0.00% -> 5.67%   
client [34] (testset)   loss: 47.3834 -> 174.1323   accuracy: 8.33% -> 7.74%   
client [71] (testset)   loss: 45.2569 -> 17.9953    accuracy: 2.27% -> 19.32%  
client [89] (testset)   loss: 32.2329 -> 1000.0778  accuracy: 3.06% -> 18.37%  
---------------------------- TRAINING EPOCH: 280 ----------------------------  
client [78] (testset)   loss: 8.2891 -> 60.1533 accuracy: 47.75% -> 4.05%      
client [81] (testset)   loss: 7.5247 -> 144.9754    accuracy: 48.45% -> 9.29%  
client [51] (testset)   loss: 8.1980 -> 27.2652 accuracy: 42.57% -> 13.51%     
client [54] (testset)   loss: 7.1383 -> 10.2869 accuracy: 55.72% -> 12.18%     
client [65] (testset)   loss: 5.8412 -> 874.1523    accuracy: 51.85% -> 6.48%  
client [41] (testset)   loss: 18.6288 -> 139.7064   accuracy: 38.65% -> 1.23%  
client [11] (testset)   loss: 12.2729 -> 144.8655   accuracy: 30.28% -> 15.14% 
client [85] (testset)   loss: 5.7465 -> 105.5099    accuracy: 37.14% -> 30.29% 
client [12] (testset)   loss: 6.7173 -> 58.3454 accuracy: 37.01% -> 21.26%     
client [23] (testset)   loss: 5.5973 -> 206.6807    accuracy: 61.22% -> 1.02%  
---------------------------- TRAINING EPOCH: 290 ----------------------------  
client [16] (testset)   loss: 2.2871 -> 37.9276 accuracy: 54.24% -> 6.78%      
client [65] (testset)   loss: 1.8624 -> 28.5300 accuracy: 57.41% -> 22.22%     
client [53] (testset)   loss: 1.6120 -> 29.3184 accuracy: 67.69% -> 6.92%      
client [58] (testset)   loss: 2.4836 -> 108.6296    accuracy: 56.35% -> 6.75%  
client [72] (testset)   loss: 2.5750 -> 94.4754 accuracy: 46.88% -> 2.50%      
client [7]  (testset)   loss: 1.4325 -> 17.6910 accuracy: 66.67% -> 7.02%      
client [71] (testset)   loss: 1.9276 -> 82.1538 accuracy: 72.73% -> 45.45%     
client [59] (testset)   loss: 1.4106 -> 28.3907 accuracy: 71.82% -> 27.88%     
client [86] (testset)   loss: 1.9945 -> 18.9537 accuracy: 55.70% -> 12.66%     
client [39] (testset)   loss: 2.3764 -> 9.8357  accuracy: 52.73% -> 22.73%     
---------------------------- TRAINING EPOCH: 300 ----------------------------  
client [99] (testset)   loss: 11.1084 -> 48.8073    accuracy: 12.28% -> 7.02%  
client [7]  (testset)   loss: 19.2137 -> 95.1623    accuracy: 6.14% -> 5.26%   
client [17] (testset)   loss: 11.8974 -> 124.0518   accuracy: 8.53% -> 58.91%  
client [64] (testset)   loss: 19.3969 -> 147.5232   accuracy: 20.00% -> 1.67%  
client [37] (testset)   loss: 12.2629 -> 19.8560    accuracy: 46.28% -> 3.31%  
client [29] (testset)   loss: 10.2386 -> 32.9415    accuracy: 19.25% -> 2.14%  
client [93] (testset)   loss: 34.5596 -> 46.0105    accuracy: 8.14% -> 0.00%   
client [73] (testset)   loss: 13.0336 -> 4.8600 accuracy: 26.61% -> 48.50%     
client [40] (testset)   loss: 33.1328 -> 222.5884   accuracy: 24.00% -> 1.00%  
client [76] (testset)   loss: 21.1447 -> 930.6506   accuracy: 12.50% -> 18.75% 
---------------------------- TRAINING EPOCH: 310 ----------------------------  
client [31] (testset)   loss: 4.6337 -> 19.8187 accuracy: 57.45% -> 58.87%     
client [89] (testset)   loss: 8.2049 -> 45.7493 accuracy: 12.24% -> 5.10%      
client [77] (testset)   loss: 6.2229 -> 59.4244 accuracy: 35.00% -> 7.50%      
client [90] (testset)   loss: 6.5409 -> 49.9183 accuracy: 26.39% -> 0.00%      
client [26] (testset)   loss: 9.8625 -> 4.4367  accuracy: 5.77% -> 11.54%      
client [50] (testset)   loss: 7.8615 -> 83.7187 accuracy: 18.62% -> 0.00%      
client [30] (testset)   loss: 3.9915 -> 557.4322    accuracy: 43.88% -> 9.35%  
client [70] (testset)   loss: 10.3930 -> 16.1700    accuracy: 11.66% -> 34.98% 
client [41] (testset)   loss: 8.3729 -> 67.1616 accuracy: 9.20% -> 0.00%       
client [99] (testset)   loss: 5.6577 -> 33.1552 accuracy: 35.09% -> 3.51%      
---------------------------- TRAINING EPOCH: 320 ----------------------------  
client [68] (testset)   loss: 30.4535 -> 58.0970    accuracy: 41.84% -> 7.09%  
client [70] (testset)   loss: 68.2318 -> 81.4820    accuracy: 26.01% -> 11.66% 
client [52] (testset)   loss: 94.6392 -> 50.7163    accuracy: 18.92% -> 22.07% 
client [1]  (testset)   loss: 60.0077 -> 34.0923    accuracy: 28.57% -> 18.37% 
client [2]  (testset)   loss: 71.6315 -> 17.4699    accuracy: 20.22% -> 23.60% 
client [67] (testset)   loss: 96.1509 -> 207.4031   accuracy: 0.58% -> 0.58%   
client [92] (testset)   loss: 52.5954 -> 108.5407   accuracy: 2.56% -> 0.00%   
client [35] (testset)   loss: 102.3468 -> 19.1281   accuracy: 36.16% -> 46.89% 
client [36] (testset)   loss: 55.3995 -> 40.7806    accuracy: 13.64% -> 8.33%  
client [64] (testset)   loss: 62.8138 -> 146.9588   accuracy: 42.50% -> 42.50% 
---------------------------- TRAINING EPOCH: 330 ----------------------------  
client [44] (testset)   loss: 6.1800 -> 57.7354 accuracy: 60.18% -> 6.19%      
client [6]  (testset)   loss: 12.2980 -> 27.1844    accuracy: 12.50% -> 16.07% 
client [12] (testset)   loss: 8.0110 -> 97.3749 accuracy: 15.75% -> 3.94%      
client [55] (testset)   loss: 15.2722 -> 36.3723    accuracy: 26.97% -> 61.80% 
client [29] (testset)   loss: 8.4164 -> 86.2118 accuracy: 21.93% -> 22.99%     
client [9]  (testset)   loss: 7.9556 -> 258.2551    accuracy: 15.54% -> 1.04%  
client [43] (testset)   loss: 6.1346 -> 32.7774 accuracy: 46.33% -> 0.00%      
client [77] (testset)   loss: 10.8174 -> 44.2330    accuracy: 3.75% -> 7.50%   
client [98] (testset)   loss: 9.2454 -> 182.9887    accuracy: 12.58% -> 0.66%  
client [78] (testset)   loss: 6.6917 -> 11.3648 accuracy: 8.11% -> 35.59%      
---------------------------- TRAINING EPOCH: 340 ----------------------------  
client [92] (testset)   loss: 18.8228 -> 48.4253    accuracy: 0.00% -> 5.13%   
client [80] (testset)   loss: 18.3896 -> 11.3976    accuracy: 53.44% -> 11.45% 
client [63] (testset)   loss: 28.2130 -> 100.4814   accuracy: 15.57% -> 7.38%  
client [76] (testset)   loss: 23.1018 -> 128.0134   accuracy: 19.53% -> 31.25% 
client [78] (testset)   loss: 32.3006 -> 41.7390    accuracy: 35.14% -> 31.98% 
client [25] (testset)   loss: 29.7802 -> 86.8385    accuracy: 8.97% -> 8.97%   
client [58] (testset)   loss: 28.8910 -> 68.7690    accuracy: 10.71% -> 12.30% 
client [13] (testset)   loss: 20.4154 -> 221.4451   accuracy: 41.67% -> 9.72%  
client [17] (testset)   loss: 16.8111 -> 35.8006    accuracy: 10.08% -> 58.91% 
client [38] (testset)   loss: 22.8775 -> 37.5016    accuracy: 7.78% -> 1.11%   
---------------------------- TRAINING EPOCH: 350 ----------------------------  
client [72] (testset)   loss: 102.4240 -> 37.6592   accuracy: 0.62% -> 19.38%  
client [82] (testset)   loss: 83.8266 -> 97.3857    accuracy: 11.97% -> 24.79% 
client [86] (testset)   loss: 93.2282 -> 42.7973    accuracy: 32.91% -> 25.32% 
client [51] (testset)   loss: 93.4935 -> 37.1859    accuracy: 3.38% -> 7.43%   
client [96] (testset)   loss: 63.4506 -> 30.2769    accuracy: 0.48% -> 18.18%  
client [42] (testset)   loss: 125.7160 -> 138.7783  accuracy: 4.44% -> 0.63%   
client [55] (testset)   loss: 139.0487 -> 12.3874   accuracy: 2.81% -> 62.36%  
client [13] (testset)   loss: 95.5660 -> 5.6668 accuracy: 1.39% -> 40.28%      
client [1]  (testset)   loss: 125.7692 -> 21.2842   accuracy: 0.00% -> 28.57%  
client [12] (testset)   loss: 82.1412 -> 45.6788    accuracy: 23.62% -> 21.26% 
---------------------------- TRAINING EPOCH: 360 ----------------------------  
client [68] (testset)   loss: 13.4380 -> 558.6927   accuracy: 0.71% -> 0.00%   
client [23] (testset)   loss: 6.0321 -> 65.9922 accuracy: 37.76% -> 6.12%      
client [46] (testset)   loss: 11.7287 -> 36.5696    accuracy: 3.90% -> 23.38%  
client [41] (testset)   loss: 9.4422 -> 55.5864 accuracy: 4.29% -> 3.68%       
client [25] (testset)   loss: 7.7542 -> 198.1383    accuracy: 8.97% -> 2.56%   
client [58] (testset)   loss: 8.2376 -> 223.3891    accuracy: 3.97% -> 12.30%  
client [14] (testset)   loss: 16.0260 -> 16.5225    accuracy: 1.61% -> 41.94%  
client [33] (testset)   loss: 12.1765 -> 12.6849    accuracy: 0.00% -> 25.00%  
client [85] (testset)   loss: 10.7958 -> 154.8753   accuracy: 1.71% -> 30.29%  
client [62] (testset)   loss: 14.9818 -> 88.4955    accuracy: 2.67% -> 18.22%  
---------------------------- TRAINING EPOCH: 370 ----------------------------  
client [98] (testset)   loss: 43.6429 -> 156.2264   accuracy: 0.66% -> 18.54%  
client [63] (testset)   loss: 56.2659 -> 41.8817    accuracy: 4.92% -> 13.93%  
client [70] (testset)   loss: 62.5866 -> 14.6998    accuracy: 3.14% -> 6.28%   
client [65] (testset)   loss: 36.5920 -> 193.5846   accuracy: 10.19% -> 10.19% 
client [14] (testset)   loss: 46.5139 -> 33.7382    accuracy: 1.61% -> 11.29%  
client [73] (testset)   loss: 19.6884 -> 9.1984 accuracy: 9.87% -> 58.80%      
client [34] (testset)   loss: 60.0999 -> 149.5377   accuracy: 8.33% -> 8.33%   
client [99] (testset)   loss: 31.7640 -> 13.8267    accuracy: 7.02% -> 29.82%  
client [69] (testset)   loss: 77.4250 -> 118.0597   accuracy: 25.15% -> 1.80%  
client [46] (testset)   loss: 45.2874 -> 227.1256   accuracy: 2.60% -> 7.79%   
---------------------------- TRAINING EPOCH: 380 ----------------------------  
client [99] (testset)   loss: 33.3720 -> 49.9291    accuracy: 7.02% -> 31.58%  
client [93] (testset)   loss: 100.0882 -> 162.3571  accuracy: 13.95% -> 2.33%  
client [11] (testset)   loss: 117.1659 -> 80.0140   accuracy: 1.38% -> 0.46%   
client [58] (testset)   loss: 113.7671 -> 175.5361  accuracy: 12.30% -> 12.30% 
client [81] (testset)   loss: 107.1351 -> 179.0884  accuracy: 9.29% -> 9.29%   
client [85] (testset)   loss: 75.8870 -> 36.9854    accuracy: 1.14% -> 30.29%  
client [89] (testset)   loss: 89.9925 -> 132.0654   accuracy: 4.08% -> 18.37%  
client [45] (testset)   loss: 62.8336 -> 44.0624    accuracy: 4.17% -> 8.93%   
client [8]  (testset)   loss: 98.9068 -> 55.3734    accuracy: 12.35% -> 5.76%  
client [68] (testset)   loss: 54.1389 -> 104.2031   accuracy: 41.84% -> 12.77% 
---------------------------- TRAINING EPOCH: 390 ----------------------------  
client [67] (testset)   loss: 23.8155 -> 3.7326 accuracy: 4.09% -> 36.84%      
client [72] (testset)   loss: 25.9475 -> 50.3844    accuracy: 3.12% -> 6.88%   
client [1]  (testset)   loss: 32.0092 -> 69.2135    accuracy: 24.49% -> 28.57% 
client [78] (testset)   loss: 35.8816 -> 41.1257    accuracy: 17.12% -> 31.08% 
client [83] (testset)   loss: 35.3176 -> 1010.2063  accuracy: 0.54% -> 3.80%   
client [21] (testset)   loss: 38.3024 -> 972.4226   accuracy: 4.20% -> 21.01%  
client [56] (testset)   loss: 26.6255 -> 17.5498    accuracy: 0.00% -> 4.05%   
client [44] (testset)   loss: 49.7947 -> 14.6246    accuracy: 4.87% -> 7.96%   
client [92] (testset)   loss: 30.4491 -> 45.9121    accuracy: 8.97% -> 3.85%   
client [27] (testset)   loss: 33.8248 -> 116.8326   accuracy: 1.27% -> 12.29%  
---------------------------- TRAINING EPOCH: 400 ----------------------------  
client [10] (testset)   loss: 27.0667 -> 49.0032    accuracy: 17.17% -> 3.00%  
client [39] (testset)   loss: 20.4858 -> 69.6221    accuracy: 10.00% -> 0.91%  
client [65] (testset)   loss: 21.9108 -> 6.6499 accuracy: 10.19% -> 46.30%     
client [26] (testset)   loss: 22.8427 -> 3.7023 accuracy: 0.00% -> 57.69%      
client [19] (testset)   loss: 15.0711 -> 64.9055    accuracy: 1.01% -> 0.00%   
client [68] (testset)   loss: 21.7009 -> 49.5219    accuracy: 3.55% -> 10.64%  
client [41] (testset)   loss: 18.2626 -> 50.1847    accuracy: 0.00% -> 26.99%  
client [50] (testset)   loss: 12.8627 -> 113.6286   accuracy: 1.60% -> 8.51%   
client [75] (testset)   loss: 11.2398 -> 4.6604 accuracy: 27.00% -> 25.50%     
client [81] (testset)   loss: 11.8914 -> 25.7485    accuracy: 8.41% -> 11.50%  
Training... ---------------------------------------- 100% 0:19:41
Floco's average time taken by each global epoch: 0 min 2.93 sec.               
Floco's total running time: 0 h 19 m 41 s.                                     
==================== Floco Experiment Results: ====================            
Display format: (before local fine-tuning) -> (after local fine-tuning)        
 So if finetune_epoch = 0, x.xx% -> 0.00% is normal.                           
 Centralized testing ONLY happens after model aggregation, so the stats between
'->' are the same.                                                             
{                                                                              
    "100": {                                                                   
        "all_clients": {                                                       
            "test": {                                                          
                "loss": "20.7222 -> 0.0000",                                   
                "accuracy": "21.46% -> 0.00%"                                  
            }                                                                  
        }                                                                      
    },                                                                         
    "200": {                                                                   
        "all_clients": {                                                       
            "test": {                                                          
                "loss": "45.8546 -> 0.0000",                                   
                "accuracy": "25.43% -> 0.00%"                                  
            }                                                                  
        }                                                                      
    },                                                                         
    "300": {                                                                   
        "all_clients": {                                                       
            "test": {                                                          
                "loss": "105.2446 -> 0.0000",                                  
                "accuracy": "6.25% -> 0.00%"                                   
            }                                                                  
        }                                                                      
    },                                                                         
    "400": {                                                                   
        "all_clients": {                                                       
            "test": {                                                          
                "loss": "15.0201 -> 0.0000",                                   
                "accuracy": "22.09% -> 0.00%"                                  
            }                                                                  
        }                                                                      
    }                                                                          
}                                                                              
==================== Floco Max Accuracy ====================                   
all_clients:                                                                   
(test) before fine-tuning: 25.43% at epoch 200                                 
(test) after fine-tuning: 0.00% at epoch 100                                   
[0m