==================== FLUTE ====================                                
Experiment Arguments:                                                          
{
│   'method': 'flute',
│   'dataset': {
│   │   'name': 'cifar100',
│   │   'client_num': 100,
│   │   'test_ratio': 0.25,
│   │   'val_ratio': 0.0,
│   │   'seed': 42,
│   │   'split': 'sample',
│   │   'IID_ratio': 0.0,
│   │   'monitor_window_name_suffix': 'cifar100-100clients-0%IID-use20superclasses-Dir(0.5)-seed42',
│   │   'super_class': False,
│   │   'alpha': 0.5,
│   │   'min_samples_per_client': 10
│   },
│   'model': {
│   │   'name': 'avgcnn',
│   │   'use_torchvision_pretrained_weights': True,
│   │   'external_model_weights_path': None
│   },
│   'optimizer': {
│   │   'lr': 0.01,
│   │   'dampening': 0,
│   │   'weight_decay': 0,
│   │   'momentum': 0,
│   │   'nesterov': False,
│   │   'name': 'sgd'
│   },
│   'mode': 'serial',
│   'parallel': {
│   │   'ray_cluster_addr': None,
│   │   'num_cpus': None,
│   │   'num_gpus': None,
│   │   'num_workers': 2
│   },
│   'common': {
│   │   'seed': 42,
│   │   'join_ratio': 0.1,
│   │   'global_epoch': 400,
│   │   'local_epoch': 5,
│   │   'batch_size': 32,
│   │   'reset_optimizer_on_global_epoch': True,
│   │   'straggler_ratio': 0,
│   │   'straggler_min_local_epoch': 0,
│   │   'buffers': 'global',
│   │   'client_side_evaluation': True,
│   │   'test': {
│   │   │   'client': {
│   │   │   │   'interval': 100,
│   │   │   │   'finetune_epoch': 0,
│   │   │   │   'train': False,
│   │   │   │   'val': False,
│   │   │   │   'test': True
│   │   │   },
│   │   │   'server': {
│   │   │   │   'interval': -1,
│   │   │   │   'train': False,
│   │   │   │   'val': False,
│   │   │   │   'test': False,
│   │   │   │   'model_in_train_mode': False
│   │   │   }
│   │   },
│   │   'verbose_gap': 10,
│   │   'monitor': None,
│   │   'use_cuda': True,
│   │   'save_log': True,
│   │   'save_model': False,
│   │   'save_learning_curve_plot': False,
│   │   'save_metrics': True,
│   │   'delete_useless_run': True
│   },
│   'flute': {
│   │   'rep_round': 1,
│   │   'lamda1': 0.25,
│   │   'lamda2': 0.0025,
│   │   'lamda3': 0.0005,
│   │   'gamma1': 1,
│   │   'gamma2': 1,
│   │   'nc2_lr': 0.5
│   }
}
---------------------------- TRAINING EPOCH: 10 ----------------------------   
client [77] (testset)   loss: 4.4015 -> 4.3296  accuracy: 4.90% -> 4.90%       
client [81] (testset)   loss: 4.3680 -> 4.2887  accuracy: 5.21% -> 5.21%       
client [21] (testset)   loss: 4.5652 -> 4.4937  accuracy: 9.32% -> 5.08%       
client [68] (testset)   loss: 4.4958 -> 4.4087  accuracy: 6.77% -> 6.77%       
client [93] (testset)   loss: 4.4963 -> 4.4157  accuracy: 5.80% -> 5.80%       
client [31] (testset)   loss: 4.4741 -> 4.3672  accuracy: 4.92% -> 5.74%       
client [20] (testset)   loss: 4.4506 -> 4.3820  accuracy: 5.88% -> 5.88%       
client [59] (testset)   loss: 4.6427 -> 4.5298  accuracy: 0.00% -> 3.68%       
client [48] (testset)   loss: 4.3570 -> 4.3082  accuracy: 8.89% -> 8.89%       
client [34] (testset)   loss: 4.5048 -> 4.4247  accuracy: 2.40% -> 3.20%       
---------------------------- TRAINING EPOCH: 20 ----------------------------   
client [69] (testset)   loss: 4.3464 -> 4.2548  accuracy: 7.32% -> 8.13%       
client [99] (testset)   loss: 4.4885 -> 4.3972  accuracy: 7.79% -> 9.09%       
client [67] (testset)   loss: 4.4847 -> 4.3927  accuracy: 7.69% -> 5.33%       
client [0]  (testset)   loss: 4.3235 -> 4.2425  accuracy: 9.20% -> 9.20%       
client [76] (testset)   loss: 4.4314 -> 4.3667  accuracy: 13.01% -> 12.20%     
client [41] (testset)   loss: 4.4265 -> 4.2911  accuracy: 12.63% -> 13.68%     
client [62] (testset)   loss: 4.6151 -> 4.4724  accuracy: 0.00% -> 5.33%       
client [2]  (testset)   loss: 4.5870 -> 4.4675  accuracy: 1.12% -> 6.15%       
client [14] (testset)   loss: 4.2556 -> 4.1990  accuracy: 8.14% -> 8.14%       
client [46] (testset)   loss: 4.3854 -> 4.3448  accuracy: 9.30% -> 9.30%       
---------------------------- TRAINING EPOCH: 30 ----------------------------   
client [24] (testset)   loss: 4.3157 -> 4.2523  accuracy: 5.47% -> 3.91%       
client [68] (testset)   loss: 4.2456 -> 4.2122  accuracy: 6.02% -> 6.77%       
client [57] (testset)   loss: 4.4279 -> 4.3634  accuracy: 8.76% -> 5.84%       
client [17] (testset)   loss: 4.2246 -> 4.1569  accuracy: 13.77% -> 13.77%     
client [54] (testset)   loss: 4.1546 -> 4.1230  accuracy: 9.03% -> 8.33%       
client [23] (testset)   loss: 4.6012 -> 4.5203  accuracy: 0.00% -> 4.26%       
client [35] (testset)   loss: 4.2547 -> 4.2111  accuracy: 8.54% -> 8.54%       
client [59] (testset)   loss: 4.3600 -> 4.3009  accuracy: 6.13% -> 6.75%       
client [31] (testset)   loss: 4.1953 -> 4.1748  accuracy: 5.74% -> 5.74%       
client [9]  (testset)   loss: 4.3641 -> 4.3160  accuracy: 5.56% -> 6.25%       
---------------------------- TRAINING EPOCH: 40 ----------------------------   
client [64] (testset)   loss: 4.0759 -> 4.0312  accuracy: 6.56% -> 6.56%       
client [33] (testset)   loss: 4.1349 -> 4.1098  accuracy: 4.76% -> 4.76%       
client [16] (testset)   loss: 4.2170 -> 4.1541  accuracy: 12.08% -> 12.08%     
client [44] (testset)   loss: 4.4595 -> 4.3547  accuracy: 8.72% -> 8.72%       
client [8]  (testset)   loss: 4.1806 -> 4.1552  accuracy: 4.83% -> 6.90%       
client [31] (testset)   loss: 4.1593 -> 4.1463  accuracy: 5.74% -> 5.74%       
client [47] (testset)   loss: 4.3130 -> 4.2528  accuracy: 4.35% -> 4.35%       
client [36] (testset)   loss: 4.5139 -> 4.4338  accuracy: 8.85% -> 8.85%       
client [20] (testset)   loss: 4.2226 -> 4.1993  accuracy: 5.88% -> 5.88%       
client [56] (testset)   loss: 4.4840 -> 4.4415  accuracy: 3.17% -> 2.38%       
---------------------------- TRAINING EPOCH: 50 ----------------------------   
client [4]  (testset)   loss: 4.2942 -> 4.2448  accuracy: 9.17% -> 9.17%       
client [60] (testset)   loss: 4.3958 -> 4.3217  accuracy: 13.93% -> 13.11%     
client [28] (testset)   loss: 4.1419 -> 4.1164  accuracy: 10.91% -> 10.91%     
client [25] (testset)   loss: 4.2849 -> 4.2282  accuracy: 5.91% -> 6.45%       
client [58] (testset)   loss: 4.1414 -> 4.1236  accuracy: 10.32% -> 10.32%     
client [44] (testset)   loss: 4.3553 -> 4.2835  accuracy: 8.72% -> 8.72%       
client [39] (testset)   loss: 4.3982 -> 4.3614  accuracy: 3.65% -> 3.65%       
client [29] (testset)   loss: 4.0976 -> 4.0772  accuracy: 7.41% -> 8.64%       
client [3]  (testset)   loss: 4.1942 -> 4.1578  accuracy: 10.88% -> 11.40%     
client [84] (testset)   loss: 4.2621 -> 4.2392  accuracy: 9.58% -> 9.58%       
---------------------------- TRAINING EPOCH: 60 ----------------------------   
client [21] (testset)   loss: 4.3854 -> 4.3481  accuracy: 4.24% -> 4.24%       
client [84] (testset)   loss: 4.2243 -> 4.2077  accuracy: 8.38% -> 7.19%       
client [10] (testset)   loss: 4.1950 -> 4.1665  accuracy: 6.21% -> 6.21%       
client [36] (testset)   loss: 4.3260 -> 4.2904  accuracy: 8.85% -> 8.85%       
client [65] (testset)   loss: 4.2114 -> 4.1893  accuracy: 6.90% -> 6.90%       
client [81] (testset)   loss: 4.1414 -> 4.1204  accuracy: 5.21% -> 5.21%       
client [79] (testset)   loss: 4.1934 -> 4.1506  accuracy: 6.43% -> 6.43%       
client [42] (testset)   loss: 4.0973 -> 4.0602  accuracy: 5.07% -> 5.07%       
client [11] (testset)   loss: 4.2788 -> 4.2411  accuracy: 11.20% -> 11.20%     
client [96] (testset)   loss: 4.2636 -> 4.2265  accuracy: 3.87% -> 3.87%       
---------------------------- TRAINING EPOCH: 70 ----------------------------   
client [8]  (testset)   loss: 4.1227 -> 4.1063  accuracy: 8.97% -> 10.34%      
client [53] (testset)   loss: 4.0433 -> 3.9953  accuracy: 9.68% -> 10.97%      
client [52] (testset)   loss: 4.1846 -> 4.1650  accuracy: 7.53% -> 8.60%       
client [42] (testset)   loss: 4.0336 -> 4.0065  accuracy: 5.07% -> 5.07%       
client [69] (testset)   loss: 4.0171 -> 4.0030  accuracy: 13.01% -> 13.01%     
client [59] (testset)   loss: 4.1972 -> 4.1740  accuracy: 7.98% -> 8.59%       
client [7]  (testset)   loss: 4.2508 -> 4.2322  accuracy: 5.76% -> 5.76%       
client [26] (testset)   loss: 4.0810 -> 4.0534  accuracy: 18.49% -> 18.49%     
client [49] (testset)   loss: 4.3410 -> 4.3119  accuracy: 7.27% -> 6.36%       
client [98] (testset)   loss: 4.2111 -> 4.1996  accuracy: 5.65% -> 5.08%       
---------------------------- TRAINING EPOCH: 80 ----------------------------   
client [98] (testset)   loss: 4.2019 -> 4.1924  accuracy: 5.08% -> 5.65%       
client [47] (testset)   loss: 4.2090 -> 4.1708  accuracy: 4.35% -> 4.35%       
client [21] (testset)   loss: 4.3186 -> 4.2922  accuracy: 5.08% -> 5.08%       
client [77] (testset)   loss: 4.1510 -> 4.1355  accuracy: 4.90% -> 4.90%       
client [95] (testset)   loss: 4.1373 -> 4.1220  accuracy: 8.43% -> 8.43%       
client [91] (testset)   loss: 4.1038 -> 4.0839  accuracy: 5.88% -> 5.88%       
client [14] (testset)   loss: 4.0925 -> 4.0792  accuracy: 8.14% -> 8.14%       
client [99] (testset)   loss: 4.2295 -> 4.2094  accuracy: 7.14% -> 7.14%       
client [20] (testset)   loss: 4.1478 -> 4.1369  accuracy: 8.82% -> 8.82%       
client [39] (testset)   loss: 4.3167 -> 4.3002  accuracy: 3.65% -> 4.38%       
---------------------------- TRAINING EPOCH: 90 ----------------------------   
client [52] (testset)   loss: 4.1670 -> 4.1498  accuracy: 8.60% -> 8.60%       
client [62] (testset)   loss: 4.0485 -> 4.0350  accuracy: 10.06% -> 10.06%     
client [71] (testset)   loss: 4.0964 -> 4.0811  accuracy: 17.19% -> 17.97%     
client [97] (testset)   loss: 4.1176 -> 4.0949  accuracy: 6.33% -> 6.96%       
client [30] (testset)   loss: 4.2531 -> 4.2411  accuracy: 4.91% -> 4.91%       
client [88] (testset)   loss: 4.1189 -> 4.0894  accuracy: 9.38% -> 9.38%       
client [60] (testset)   loss: 4.1643 -> 4.1501  accuracy: 13.11% -> 13.11%     
client [82] (testset)   loss: 4.1595 -> 4.1402  accuracy: 9.70% -> 9.70%       
client [91] (testset)   loss: 4.0715 -> 4.0573  accuracy: 6.54% -> 6.54%       
client [57] (testset)   loss: 4.2444 -> 4.2183  accuracy: 5.11% -> 5.11%       
---------------------------- TRAINING EPOCH: 100 ----------------------------  
client [31] (testset)   loss: 4.0596 -> 4.0544  accuracy: 8.20% -> 8.20%       
client [15] (testset)   loss: 4.1020 -> 4.0814  accuracy: 11.11% -> 11.11%     
client [71] (testset)   loss: 4.0837 -> 4.0732  accuracy: 17.97% -> 17.97%     
client [97] (testset)   loss: 4.0663 -> 4.0521  accuracy: 8.86% -> 9.49%       
client [53] (testset)   loss: 3.9304 -> 3.9151  accuracy: 10.32% -> 10.32%     
client [77] (testset)   loss: 4.1376 -> 4.1236  accuracy: 4.90% -> 6.29%       
client [76] (testset)   loss: 4.1894 -> 4.1758  accuracy: 13.01% -> 13.01%     
client [79] (testset)   loss: 4.0956 -> 4.0721  accuracy: 6.43% -> 6.43%       
client [28] (testset)   loss: 4.0482 -> 4.0388  accuracy: 13.33% -> 15.15%     
client [99] (testset)   loss: 4.2005 -> 4.1869  accuracy: 7.14% -> 7.14%       
---------------------------- TRAINING EPOCH: 110 ----------------------------  
client [97] (testset)   loss: 4.0431 -> 4.0317  accuracy: 9.49% -> 9.49%       
client [86] (testset)   loss: 4.1163 -> 4.1030  accuracy: 11.54% -> 11.54%     
client [34] (testset)   loss: 4.1076 -> 4.0958  accuracy: 13.60% -> 14.40%     
client [73] (testset)   loss: 4.1871 -> 4.1737  accuracy: 10.23% -> 10.23%     
client [5]  (testset)   loss: 4.1070 -> 4.0931  accuracy: 13.10% -> 14.48%     
client [96] (testset)   loss: 4.1077 -> 4.0969  accuracy: 9.68% -> 10.32%      
client [22] (testset)   loss: 4.1093 -> 4.0946  accuracy: 9.46% -> 9.46%       
client [60] (testset)   loss: 4.1276 -> 4.1188  accuracy: 13.11% -> 13.11%     
client [66] (testset)   loss: 4.1564 -> 4.1407  accuracy: 8.77% -> 8.77%       
client [83] (testset)   loss: 4.2472 -> 4.2380  accuracy: 8.00% -> 8.00%       
---------------------------- TRAINING EPOCH: 120 ----------------------------  
client [76] (testset)   loss: 4.1546 -> 4.1465  accuracy: 13.01% -> 13.01%     
client [65] (testset)   loss: 4.1617 -> 4.1484  accuracy: 8.28% -> 8.97%       
client [95] (testset)   loss: 4.0923 -> 4.0818  accuracy: 8.43% -> 8.43%       
client [17] (testset)   loss: 4.0339 -> 4.0152  accuracy: 13.77% -> 13.77%     
client [8]  (testset)   loss: 4.0782 -> 4.0665  accuracy: 11.72% -> 12.41%     
client [35] (testset)   loss: 4.0683 -> 4.0597  accuracy: 8.54% -> 8.54%       
client [98] (testset)   loss: 4.1821 -> 4.1743  accuracy: 6.21% -> 6.21%       
client [53] (testset)   loss: 3.9070 -> 3.8949  accuracy: 10.32% -> 11.61%     
client [43] (testset)   loss: 4.1725 -> 4.1593  accuracy: 3.08% -> 3.08%       
client [64] (testset)   loss: 3.9054 -> 3.8891  accuracy: 8.20% -> 8.20%       
---------------------------- TRAINING EPOCH: 130 ----------------------------  
client [21] (testset)   loss: 4.2783 -> 4.2643  accuracy: 5.93% -> 5.93%       
client [88] (testset)   loss: 3.9999 -> 3.9889  accuracy: 9.38% -> 9.38%       
client [38] (testset)   loss: 3.9380 -> 3.9241  accuracy: 9.09% -> 9.60%       
client [3]  (testset)   loss: 4.0291 -> 4.0209  accuracy: 16.06% -> 18.13%     
client [5]  (testset)   loss: 4.0864 -> 4.0751  accuracy: 13.79% -> 13.79%     
client [41] (testset)   loss: 4.0297 -> 4.0186  accuracy: 14.74% -> 15.26%     
client [7]  (testset)   loss: 4.2106 -> 4.2018  accuracy: 5.76% -> 5.76%       
client [37] (testset)   loss: 4.0622 -> 4.0472  accuracy: 6.45% -> 7.74%       
client [45] (testset)   loss: 4.1850 -> 4.1661  accuracy: 6.21% -> 6.21%       
client [47] (testset)   loss: 4.1226 -> 4.1007  accuracy: 4.35% -> 7.25%       
---------------------------- TRAINING EPOCH: 140 ----------------------------  
client [16] (testset)   loss: 3.9807 -> 3.9700  accuracy: 17.45% -> 17.45%     
client [11] (testset)   loss: 4.1273 -> 4.1161  accuracy: 13.60% -> 13.60%     
client [37] (testset)   loss: 4.0310 -> 4.0200  accuracy: 8.39% -> 9.03%       
client [41] (testset)   loss: 4.0200 -> 4.0098  accuracy: 15.26% -> 15.26%     
client [95] (testset)   loss: 4.0626 -> 4.0542  accuracy: 8.43% -> 8.43%       
client [53] (testset)   loss: 3.8975 -> 3.8870  accuracy: 11.61% -> 10.32%     
client [22] (testset)   loss: 4.0861 -> 4.0747  accuracy: 10.14% -> 8.78%      
client [25] (testset)   loss: 4.0899 -> 4.0756  accuracy: 11.83% -> 11.83%     
client [69] (testset)   loss: 3.9403 -> 3.9332  accuracy: 17.07% -> 17.07%     
client [46] (testset)   loss: 4.2650 -> 4.2581  accuracy: 9.88% -> 9.88%       
---------------------------- TRAINING EPOCH: 150 ----------------------------  
client [47] (testset)   loss: 4.0527 -> 4.0402  accuracy: 8.70% -> 9.42%       
client [69] (testset)   loss: 3.9286 -> 3.9225  accuracy: 17.89% -> 17.89%     
client [82] (testset)   loss: 4.0989 -> 4.0888  accuracy: 9.70% -> 8.96%       
client [45] (testset)   loss: 4.1382 -> 4.1249  accuracy: 5.08% -> 5.08%       
client [7]  (testset)   loss: 4.2034 -> 4.1937  accuracy: 5.76% -> 5.76%       
client [50] (testset)   loss: 4.2906 -> 4.2755  accuracy: 3.85% -> 3.85%       
client [35] (testset)   loss: 4.0512 -> 4.0436  accuracy: 8.54% -> 9.15%       
client [24] (testset)   loss: 4.0642 -> 4.0546  accuracy: 8.59% -> 7.81%       
client [15] (testset)   loss: 4.0297 -> 4.0177  accuracy: 11.11% -> 11.11%     
client [58] (testset)   loss: 4.0295 -> 4.0250  accuracy: 10.32% -> 10.32%     
---------------------------- TRAINING EPOCH: 160 ----------------------------  
client [48] (testset)   loss: 4.1567 -> 4.1516  accuracy: 8.89% -> 8.89%       
client [76] (testset)   loss: 4.1386 -> 4.1322  accuracy: 13.01% -> 13.01%     
client [67] (testset)   loss: 4.1060 -> 4.0941  accuracy: 14.79% -> 15.98%     
client [37] (testset)   loss: 4.0152 -> 4.0055  accuracy: 8.39% -> 9.03%       
client [58] (testset)   loss: 4.0231 -> 4.0178  accuracy: 10.97% -> 10.32%     
client [64] (testset)   loss: 3.8518 -> 3.8386  accuracy: 9.84% -> 9.84%       
client [77] (testset)   loss: 4.0907 -> 4.0826  accuracy: 6.29% -> 6.29%       
client [55] (testset)   loss: 4.2715 -> 4.2653  accuracy: 7.76% -> 7.76%       
client [12] (testset)   loss: 4.0824 -> 4.0740  accuracy: 6.33% -> 6.96%       
client [89] (testset)   loss: 4.1121 -> 4.1063  accuracy: 12.14% -> 12.14%     
---------------------------- TRAINING EPOCH: 170 ----------------------------  
client [84] (testset)   loss: 4.1030 -> 4.0974  accuracy: 11.98% -> 11.98%     
client [51] (testset)   loss: 4.0138 -> 4.0063  accuracy: 12.50% -> 12.50%     
client [8]  (testset)   loss: 4.0300 -> 4.0221  accuracy: 13.10% -> 13.10%     
client [18] (testset)   loss: 4.0033 -> 3.9940  accuracy: 11.80% -> 12.36%     
client [94] (testset)   loss: 4.2312 -> 4.2247  accuracy: 7.21% -> 7.21%       
client [81] (testset)   loss: 4.0159 -> 4.0098  accuracy: 6.25% -> 6.25%       
client [3]  (testset)   loss: 3.9981 -> 3.9925  accuracy: 18.13% -> 17.10%     
client [11] (testset)   loss: 4.0978 -> 4.0893  accuracy: 14.40% -> 15.20%     
client [95] (testset)   loss: 4.0260 -> 4.0198  accuracy: 9.64% -> 9.64%       
client [67] (testset)   loss: 4.0968 -> 4.0856  accuracy: 15.98% -> 15.98%     
---------------------------- TRAINING EPOCH: 180 ----------------------------  
client [21] (testset)   loss: 4.2480 -> 4.2379  accuracy: 5.93% -> 5.93%       
client [79] (testset)   loss: 3.9466 -> 3.9373  accuracy: 10.71% -> 12.14%     
client [58] (testset)   loss: 4.0108 -> 4.0068  accuracy: 10.32% -> 10.32%     
client [88] (testset)   loss: 3.9674 -> 3.9593  accuracy: 9.38% -> 9.38%       
client [46] (testset)   loss: 4.2464 -> 4.2409  accuracy: 9.88% -> 9.88%       
client [11] (testset)   loss: 4.0916 -> 4.0839  accuracy: 15.20% -> 15.20%     
client [55] (testset)   loss: 4.2488 -> 4.2443  accuracy: 7.76% -> 7.76%       
client [13] (testset)   loss: 4.1856 -> 4.1803  accuracy: 9.63% -> 10.37%      
client [31] (testset)   loss: 4.0426 -> 4.0387  accuracy: 9.84% -> 9.02%       
client [75] (testset)   loss: 4.0633 -> 4.0586  accuracy: 7.86% -> 7.86%       
---------------------------- TRAINING EPOCH: 190 ----------------------------  
client [19] (testset)   loss: 4.2243 -> 4.2196  accuracy: 8.27% -> 8.27%       
client [7]  (testset)   loss: 4.1657 -> 4.1613  accuracy: 5.76% -> 5.76%       
client [57] (testset)   loss: 4.1197 -> 4.1108  accuracy: 7.30% -> 7.30%       
client [13] (testset)   loss: 4.1791 -> 4.1744  accuracy: 10.37% -> 10.37%     
client [43] (testset)   loss: 4.1104 -> 4.1010  accuracy: 3.08% -> 4.62%       
client [91] (testset)   loss: 4.0214 -> 4.0119  accuracy: 7.84% -> 7.84%       
client [10] (testset)   loss: 4.0382 -> 4.0324  accuracy: 8.47% -> 8.47%       
client [64] (testset)   loss: 3.7964 -> 3.7877  accuracy: 9.84% -> 9.84%       
client [82] (testset)   loss: 4.0596 -> 4.0524  accuracy: 7.46% -> 7.46%       
client [22] (testset)   loss: 4.0423 -> 4.0352  accuracy: 9.46% -> 9.46%       
---------------------------- TRAINING EPOCH: 200 ----------------------------  
client [20] (testset)   loss: 4.0960 -> 4.0896  accuracy: 14.71% -> 14.71%     
client [23] (testset)   loss: 4.2304 -> 4.2195  accuracy: 4.96% -> 4.96%       
client [88] (testset)   loss: 3.9608 -> 3.9532  accuracy: 9.38% -> 9.38%       
client [98] (testset)   loss: 4.1454 -> 4.1401  accuracy: 6.78% -> 6.78%       
client [79] (testset)   loss: 3.9224 -> 3.9163  accuracy: 12.14% -> 12.86%     
client [21] (testset)   loss: 4.2332 -> 4.2287  accuracy: 5.93% -> 5.93%       
client [92] (testset)   loss: 4.0770 -> 4.0684  accuracy: 11.49% -> 10.81%     
client [56] (testset)   loss: 4.2683 -> 4.2650  accuracy: 7.94% -> 7.94%       
client [5]  (testset)   loss: 4.0359 -> 4.0283  accuracy: 15.17% -> 15.17%     
client [52] (testset)   loss: 4.0600 -> 4.0541  accuracy: 9.14% -> 9.68%       
---------------------------- TRAINING EPOCH: 210 ----------------------------  
client [67] (testset)   loss: 4.0413 -> 4.0335  accuracy: 17.16% -> 17.16%     
client [54] (testset)   loss: 3.9270 -> 3.9193  accuracy: 13.89% -> 13.89%     
client [14] (testset)   loss: 4.0096 -> 4.0030  accuracy: 9.30% -> 9.30%       
client [99] (testset)   loss: 4.1400 -> 4.1337  accuracy: 6.49% -> 6.49%       
client [36] (testset)   loss: 4.0949 -> 4.0901  accuracy: 8.85% -> 8.85%       
client [30] (testset)   loss: 4.1696 -> 4.1634  accuracy: 7.36% -> 7.36%       
client [38] (testset)   loss: 3.8672 -> 3.8582  accuracy: 11.11% -> 11.11%     
client [15] (testset)   loss: 3.9925 -> 3.9832  accuracy: 11.11% -> 11.11%     
client [6]  (testset)   loss: 4.2141 -> 4.2100  accuracy: 9.32% -> 9.32%       
client [53] (testset)   loss: 3.8486 -> 3.8435  accuracy: 12.90% -> 12.90%     
---------------------------- TRAINING EPOCH: 220 ----------------------------  
client [99] (testset)   loss: 4.1311 -> 4.1249  accuracy: 7.14% -> 7.14%       
client [6]  (testset)   loss: 4.2110 -> 4.2072  accuracy: 9.32% -> 9.32%       
client [83] (testset)   loss: 4.1844 -> 4.1806  accuracy: 8.00% -> 8.00%       
client [42] (testset)   loss: 3.8435 -> 3.8355  accuracy: 7.25% -> 7.25%       
client [34] (testset)   loss: 4.0466 -> 4.0395  accuracy: 15.20% -> 15.20%     
client [15] (testset)   loss: 3.9846 -> 3.9759  accuracy: 11.11% -> 11.11%     
client [47] (testset)   loss: 3.9837 -> 3.9762  accuracy: 13.04% -> 13.77%     
client [55] (testset)   loss: 4.2431 -> 4.2389  accuracy: 7.76% -> 7.76%       
client [51] (testset)   loss: 3.9979 -> 3.9900  accuracy: 12.50% -> 12.50%     
client [95] (testset)   loss: 4.0065 -> 4.0015  accuracy: 9.64% -> 9.64%       
---------------------------- TRAINING EPOCH: 230 ----------------------------  
client [71] (testset)   loss: 4.0085 -> 4.0066  accuracy: 20.31% -> 21.09%     
client [15] (testset)   loss: 3.9772 -> 3.9690  accuracy: 11.11% -> 11.11%     
client [33] (testset)   loss: 3.9648 -> 3.9564  accuracy: 7.14% -> 7.14%       
client [99] (testset)   loss: 4.1253 -> 4.1201  accuracy: 7.14% -> 7.14%       
client [90] (testset)   loss: 3.9192 -> 3.9078  accuracy: 18.79% -> 19.39%     
client [57] (testset)   loss: 4.0733 -> 4.0676  accuracy: 10.22% -> 10.22%     
client [27] (testset)   loss: 4.1628 -> 4.1573  accuracy: 5.22% -> 5.22%       
client [78] (testset)   loss: 4.0656 -> 4.0581  accuracy: 9.35% -> 9.35%       
client [36] (testset)   loss: 4.0874 -> 4.0829  accuracy: 8.85% -> 8.85%       
client [88] (testset)   loss: 3.9436 -> 3.9373  accuracy: 9.38% -> 9.38%       
---------------------------- TRAINING EPOCH: 240 ----------------------------  
client [70] (testset)   loss: 4.0852 -> 4.0810  accuracy: 9.29% -> 8.74%       
client [35] (testset)   loss: 4.0221 -> 4.0158  accuracy: 9.15% -> 9.15%       
client [16] (testset)   loss: 3.8851 -> 3.8798  accuracy: 16.11% -> 16.11%     
client [80] (testset)   loss: 3.9652 -> 3.9585  accuracy: 10.81% -> 10.81%     
client [38] (testset)   loss: 3.8447 -> 3.8369  accuracy: 12.12% -> 12.12%     
client [78] (testset)   loss: 4.0536 -> 4.0453  accuracy: 10.07% -> 9.35%      
client [68] (testset)   loss: 4.0511 -> 4.0445  accuracy: 10.53% -> 10.53%     
client [11] (testset)   loss: 4.0637 -> 4.0573  accuracy: 15.20% -> 14.40%     
client [64] (testset)   loss: 3.7615 -> 3.7536  accuracy: 10.38% -> 10.93%     
client [82] (testset)   loss: 4.0319 -> 4.0267  accuracy: 6.72% -> 6.72%       
---------------------------- TRAINING EPOCH: 250 ----------------------------  
client [30] (testset)   loss: 4.1447 -> 4.1407  accuracy: 9.20% -> 9.20%       
client [27] (testset)   loss: 4.1586 -> 4.1534  accuracy: 5.22% -> 5.22%       
client [74] (testset)   loss: 3.9264 -> 3.9192  accuracy: 8.87% -> 8.87%       
client [45] (testset)   loss: 4.0524 -> 4.0455  accuracy: 6.78% -> 7.34%       
client [6]  (testset)   loss: 4.2026 -> 4.1989  accuracy: 9.32% -> 10.17%      
client [36] (testset)   loss: 4.0810 -> 4.0769  accuracy: 9.73% -> 9.73%       
client [63] (testset)   loss: 4.0502 -> 4.0433  accuracy: 9.20% -> 9.20%       
client [76] (testset)   loss: 4.1057 -> 4.1008  accuracy: 16.26% -> 16.26%     
client [83] (testset)   loss: 4.1735 -> 4.1701  accuracy: 7.20% -> 7.20%       
client [86] (testset)   loss: 4.0032 -> 3.9977  accuracy: 12.82% -> 13.46%     
---------------------------- TRAINING EPOCH: 260 ----------------------------  
client [83] (testset)   loss: 4.1703 -> 4.1671  accuracy: 7.20% -> 7.20%       
client [99] (testset)   loss: 4.1206 -> 4.1147  accuracy: 7.14% -> 7.14%       
client [74] (testset)   loss: 3.9165 -> 3.9099  accuracy: 8.87% -> 8.87%       
client [73] (testset)   loss: 4.0800 -> 4.0755  accuracy: 11.36% -> 11.36%     
client [29] (testset)   loss: 3.9523 -> 3.9480  accuracy: 10.49% -> 10.49%     
client [92] (testset)   loss: 4.0465 -> 4.0398  accuracy: 11.49% -> 11.49%     
client [6]  (testset)   loss: 4.1967 -> 4.1932  accuracy: 10.17% -> 11.86%     
client [61] (testset)   loss: 4.1621 -> 4.1548  accuracy: 10.17% -> 10.17%     
client [21] (testset)   loss: 4.2065 -> 4.2007  accuracy: 6.78% -> 6.78%       
client [67] (testset)   loss: 4.0212 -> 4.0142  accuracy: 17.16% -> 17.16%     
---------------------------- TRAINING EPOCH: 270 ----------------------------  
client [83] (testset)   loss: 4.1673 -> 4.1640  accuracy: 7.20% -> 7.20%       
client [32] (testset)   loss: 3.8736 -> 3.8666  accuracy: 11.81% -> 11.81%     
client [95] (testset)   loss: 3.9996 -> 3.9946  accuracy: 9.64% -> 9.64%       
client [61] (testset)   loss: 4.1386 -> 4.1325  accuracy: 10.73% -> 10.73%     
client [27] (testset)   loss: 4.1548 -> 4.1500  accuracy: 5.22% -> 5.22%       
client [25] (testset)   loss: 4.0170 -> 4.0088  accuracy: 11.83% -> 11.83%     
client [68] (testset)   loss: 4.0340 -> 4.0289  accuracy: 9.02% -> 9.02%       
client [34] (testset)   loss: 4.0325 -> 4.0262  accuracy: 15.20% -> 15.20%     
client [71] (testset)   loss: 3.9734 -> 3.9654  accuracy: 21.09% -> 21.09%     
client [89] (testset)   loss: 4.0878 -> 4.0848  accuracy: 12.14% -> 11.43%     
---------------------------- TRAINING EPOCH: 280 ----------------------------  
client [78] (testset)   loss: 4.0191 -> 4.0134  accuracy: 12.23% -> 13.67%     
client [81] (testset)   loss: 3.9633 -> 3.9565  accuracy: 8.85% -> 8.85%       
client [51] (testset)   loss: 3.9660 -> 3.9597  accuracy: 13.12% -> 12.50%     
client [54] (testset)   loss: 3.9052 -> 3.8984  accuracy: 15.28% -> 15.28%     
client [65] (testset)   loss: 4.0672 -> 4.0626  accuracy: 9.66% -> 9.66%       
client [41] (testset)   loss: 3.9182 -> 3.9138  accuracy: 16.84% -> 17.37%     
client [11] (testset)   loss: 4.0519 -> 4.0461  accuracy: 14.40% -> 14.40%     
client [85] (testset)   loss: 4.1126 -> 4.1074  accuracy: 7.45% -> 6.83%       
client [12] (testset)   loss: 4.0434 -> 4.0378  accuracy: 8.23% -> 8.86%       
client [23] (testset)   loss: 4.1766 -> 4.1723  accuracy: 6.38% -> 6.38%       
---------------------------- TRAINING EPOCH: 290 ----------------------------  
client [16] (testset)   loss: 3.8731 -> 3.8680  accuracy: 16.11% -> 16.11%     
client [65] (testset)   loss: 4.0602 -> 4.0554  accuracy: 10.34% -> 10.34%     
client [53] (testset)   loss: 3.8262 -> 3.8228  accuracy: 12.90% -> 12.90%     
client [58] (testset)   loss: 3.9826 -> 3.9795  accuracy: 9.68% -> 9.68%       
client [72] (testset)   loss: 4.0642 -> 4.0586  accuracy: 10.97% -> 10.97%     
client [7]  (testset)   loss: 4.1329 -> 4.1312  accuracy: 6.47% -> 6.47%       
client [71] (testset)   loss: 3.9677 -> 3.9614  accuracy: 21.09% -> 21.09%     
client [59] (testset)   loss: 4.0036 -> 3.9992  accuracy: 11.04% -> 11.04%     
client [86] (testset)   loss: 3.9838 -> 3.9793  accuracy: 12.18% -> 12.18%     
client [39] (testset)   loss: 4.1997 -> 4.1967  accuracy: 8.76% -> 8.76%       
---------------------------- TRAINING EPOCH: 300 ----------------------------  
client [99] (testset)   loss: 4.1125 -> 4.1084  accuracy: 7.14% -> 7.79%       
client [7]  (testset)   loss: 4.1286 -> 4.1241  accuracy: 6.47% -> 6.47%       
client [17] (testset)   loss: 3.8841 -> 3.8804  accuracy: 15.22% -> 15.94%     
client [64] (testset)   loss: 3.7167 -> 3.7125  accuracy: 12.02% -> 12.02%     
client [37] (testset)   loss: 3.9431 -> 3.9377  accuracy: 12.90% -> 12.90%     
client [29] (testset)   loss: 3.9361 -> 3.9326  accuracy: 10.49% -> 10.49%     
client [93] (testset)   loss: 4.0980 -> 4.0935  accuracy: 10.14% -> 10.14%     
client [73] (testset)   loss: 4.0588 -> 4.0543  accuracy: 11.36% -> 11.36%     
client [40] (testset)   loss: 3.9668 -> 3.9604  accuracy: 10.71% -> 10.71%     
client [76] (testset)   loss: 4.0949 -> 4.0911  accuracy: 17.89% -> 17.89%     
---------------------------- TRAINING EPOCH: 310 ----------------------------  
client [31] (testset)   loss: 3.9943 -> 3.9923  accuracy: 13.11% -> 13.11%     
client [89] (testset)   loss: 4.0804 -> 4.0764  accuracy: 10.71% -> 11.43%     
client [77] (testset)   loss: 4.0111 -> 4.0066  accuracy: 6.99% -> 6.99%       
client [90] (testset)   loss: 3.8357 -> 3.8287  accuracy: 21.82% -> 22.42%     
client [26] (testset)   loss: 3.9263 -> 3.9185  accuracy: 18.49% -> 18.49%     
client [50] (testset)   loss: 4.1877 -> 4.1825  accuracy: 9.62% -> 9.62%       
client [30] (testset)   loss: 4.1264 -> 4.1230  accuracy: 9.82% -> 9.82%       
client [70] (testset)   loss: 4.0679 -> 4.0631  accuracy: 8.74% -> 8.20%       
client [41] (testset)   loss: 3.9035 -> 3.8996  accuracy: 17.89% -> 17.89%     
client [99] (testset)   loss: 4.1109 -> 4.1067  accuracy: 7.79% -> 7.79%       
---------------------------- TRAINING EPOCH: 320 ----------------------------  
client [68] (testset)   loss: 4.0045 -> 4.0005  accuracy: 9.02% -> 9.77%       
client [70] (testset)   loss: 4.0590 -> 4.0547  accuracy: 8.20% -> 8.20%       
client [52] (testset)   loss: 4.0136 -> 4.0101  accuracy: 9.68% -> 9.14%       
client [1]  (testset)   loss: 4.0827 -> 4.0756  accuracy: 15.33% -> 15.33%     
client [2]  (testset)   loss: 4.0858 -> 4.0811  accuracy: 11.17% -> 11.17%     
client [67] (testset)   loss: 3.9851 -> 3.9794  accuracy: 18.34% -> 18.34%     
client [92] (testset)   loss: 3.9948 -> 3.9900  accuracy: 11.49% -> 11.49%     
client [35] (testset)   loss: 4.0038 -> 3.9982  accuracy: 9.76% -> 9.76%       
client [36] (testset)   loss: 4.0532 -> 4.0498  accuracy: 10.62% -> 10.62%     
client [64] (testset)   loss: 3.7096 -> 3.7053  accuracy: 12.02% -> 11.48%     
---------------------------- TRAINING EPOCH: 330 ----------------------------  
client [44] (testset)   loss: 4.0459 -> 4.0405  accuracy: 12.75% -> 12.75%     
client [6]  (testset)   loss: 4.1778 -> 4.1748  accuracy: 10.17% -> 13.56%     
client [12] (testset)   loss: 4.0304 -> 4.0255  accuracy: 9.49% -> 10.13%      
client [55] (testset)   loss: 4.2268 -> 4.2235  accuracy: 7.76% -> 7.76%       
client [29] (testset)   loss: 3.9235 -> 3.9202  accuracy: 11.11% -> 10.49%     
client [9]  (testset)   loss: 4.1142 -> 4.1100  accuracy: 13.19% -> 13.19%     
client [43] (testset)   loss: 4.0553 -> 4.0505  accuracy: 4.62% -> 4.62%       
client [77] (testset)   loss: 4.0080 -> 4.0037  accuracy: 6.99% -> 6.99%       
client [98] (testset)   loss: 4.1080 -> 4.1045  accuracy: 7.34% -> 7.34%       
client [78] (testset)   loss: 4.0067 -> 4.0013  accuracy: 12.23% -> 12.23%     
---------------------------- TRAINING EPOCH: 340 ----------------------------  
client [92] (testset)   loss: 3.9866 -> 3.9820  accuracy: 11.49% -> 11.49%     
client [80] (testset)   loss: 3.9373 -> 3.9320  accuracy: 10.81% -> 10.81%     
client [63] (testset)   loss: 4.0189 -> 4.0139  accuracy: 9.20% -> 9.20%       
client [76] (testset)   loss: 4.0880 -> 4.0848  accuracy: 17.89% -> 17.89%     
client [78] (testset)   loss: 4.0023 -> 3.9967  accuracy: 12.23% -> 13.67%     
client [25] (testset)   loss: 3.9920 -> 3.9849  accuracy: 11.83% -> 11.83%     
client [58] (testset)   loss: 3.9725 -> 3.9690  accuracy: 9.68% -> 10.32%      
client [13] (testset)   loss: 4.1496 -> 4.1461  accuracy: 11.11% -> 11.11%     
client [17] (testset)   loss: 3.8694 -> 3.8662  accuracy: 15.94% -> 15.94%     
client [38] (testset)   loss: 3.7471 -> 3.7429  accuracy: 13.64% -> 13.64%     
---------------------------- TRAINING EPOCH: 350 ----------------------------  
client [72] (testset)   loss: 4.0420 -> 4.0376  accuracy: 10.97% -> 10.97%     
client [82] (testset)   loss: 3.9962 -> 3.9917  accuracy: 6.72% -> 6.72%       
client [86] (testset)   loss: 3.9555 -> 3.9520  accuracy: 13.46% -> 13.46%     
client [51] (testset)   loss: 3.9437 -> 3.9404  accuracy: 13.75% -> 14.37%     
client [96] (testset)   loss: 4.0109 -> 4.0057  accuracy: 14.19% -> 14.19%     
client [42] (testset)   loss: 3.7781 -> 3.7729  accuracy: 10.87% -> 10.87%     
client [55] (testset)   loss: 4.2176 -> 4.2145  accuracy: 7.76% -> 7.76%       
client [13] (testset)   loss: 4.1460 -> 4.1420  accuracy: 11.11% -> 11.11%     
client [1]  (testset)   loss: 4.0680 -> 4.0616  accuracy: 15.33% -> 16.06%     
client [12] (testset)   loss: 4.0281 -> 4.0232  accuracy: 10.13% -> 10.13%     
---------------------------- TRAINING EPOCH: 360 ----------------------------  
client [68] (testset)   loss: 3.9970 -> 3.9934  accuracy: 9.77% -> 10.53%      
client [23] (testset)   loss: 4.1566 -> 4.1516  accuracy: 5.67% -> 5.67%       
client [46] (testset)   loss: 4.1857 -> 4.1840  accuracy: 11.63% -> 11.05%     
client [41] (testset)   loss: 3.8879 -> 3.8846  accuracy: 18.95% -> 19.47%     
client [25] (testset)   loss: 3.9715 -> 3.9657  accuracy: 13.44% -> 13.44%     
client [58] (testset)   loss: 3.9679 -> 3.9655  accuracy: 10.97% -> 10.32%     
client [14] (testset)   loss: 3.9708 -> 3.9668  accuracy: 9.30% -> 9.30%       
client [33] (testset)   loss: 3.9094 -> 3.9035  accuracy: 11.90% -> 12.70%     
client [85] (testset)   loss: 4.0871 -> 4.0845  accuracy: 7.45% -> 7.45%       
client [62] (testset)   loss: 3.9297 -> 3.9245  accuracy: 12.43% -> 12.43%     
---------------------------- TRAINING EPOCH: 370 ----------------------------  
client [98] (testset)   loss: 4.0958 -> 4.0924  accuracy: 7.34% -> 7.34%       
client [63] (testset)   loss: 4.0095 -> 4.0056  accuracy: 9.20% -> 9.20%       
client [70] (testset)   loss: 4.0471 -> 4.0421  accuracy: 8.74% -> 8.74%       
client [65] (testset)   loss: 4.0450 -> 4.0411  accuracy: 10.34% -> 10.34%     
client [14] (testset)   loss: 3.9646 -> 3.9587  accuracy: 10.47% -> 10.47%     
client [73] (testset)   loss: 4.0417 -> 4.0388  accuracy: 10.80% -> 11.36%     
client [34] (testset)   loss: 3.9922 -> 3.9870  accuracy: 14.40% -> 14.40%     
client [99] (testset)   loss: 4.1026 -> 4.0983  accuracy: 7.14% -> 7.14%       
client [69] (testset)   loss: 3.8540 -> 3.8505  accuracy: 16.26% -> 16.26%     
client [46] (testset)   loss: 4.1849 -> 4.1823  accuracy: 11.05% -> 11.05%     
---------------------------- TRAINING EPOCH: 380 ----------------------------  
client [99] (testset)   loss: 4.0988 -> 4.0948  accuracy: 7.14% -> 7.14%       
client [93] (testset)   loss: 4.0860 -> 4.0820  accuracy: 11.59% -> 11.59%     
client [11] (testset)   loss: 4.0235 -> 4.0188  accuracy: 13.60% -> 13.60%     
client [58] (testset)   loss: 3.9617 -> 3.9587  accuracy: 10.32% -> 10.97%     
client [81] (testset)   loss: 3.9286 -> 3.9235  accuracy: 12.50% -> 13.02%     
client [85] (testset)   loss: 4.0857 -> 4.0814  accuracy: 7.45% -> 7.45%       
client [89] (testset)   loss: 4.0644 -> 4.0611  accuracy: 11.43% -> 10.71%     
client [45] (testset)   loss: 3.9994 -> 3.9939  accuracy: 8.47% -> 8.47%       
client [8]  (testset)   loss: 3.9628 -> 3.9585  accuracy: 14.48% -> 14.48%     
client [68] (testset)   loss: 3.9848 -> 3.9813  accuracy: 10.53% -> 10.53%     
---------------------------- TRAINING EPOCH: 390 ----------------------------  
client [67] (testset)   loss: 3.9689 -> 3.9638  accuracy: 19.53% -> 18.93%     
client [72] (testset)   loss: 4.0312 -> 4.0271  accuracy: 10.32% -> 10.32%     
client [1]  (testset)   loss: 4.0552 -> 4.0492  accuracy: 16.06% -> 15.33%     
client [78] (testset)   loss: 3.9807 -> 3.9753  accuracy: 13.67% -> 13.67%     
client [83] (testset)   loss: 4.1292 -> 4.1273  accuracy: 7.20% -> 7.20%       
client [21] (testset)   loss: 4.1638 -> 4.1610  accuracy: 7.63% -> 8.47%       
client [56] (testset)   loss: 4.2241 -> 4.2225  accuracy: 6.35% -> 6.35%       
client [44] (testset)   loss: 4.0202 -> 4.0181  accuracy: 13.42% -> 13.42%     
client [92] (testset)   loss: 3.9766 -> 3.9722  accuracy: 11.49% -> 11.49%     
client [27] (testset)   loss: 4.1176 -> 4.1140  accuracy: 5.22% -> 5.22%       
---------------------------- TRAINING EPOCH: 400 ----------------------------  
client [10] (testset)   loss: 3.9517 -> 3.9494  accuracy: 11.30% -> 11.30%     
client [39] (testset)   loss: 4.1889 -> 4.1863  accuracy: 9.49% -> 9.49%       
client [65] (testset)   loss: 4.0334 -> 4.0297  accuracy: 10.34% -> 10.34%     
client [26] (testset)   loss: 3.8872 -> 3.8815  accuracy: 18.49% -> 18.49%     
client [19] (testset)   loss: 4.1725 -> 4.1689  accuracy: 11.28% -> 11.28%     
client [68] (testset)   loss: 3.9802 -> 3.9770  accuracy: 9.77% -> 9.77%       
client [41] (testset)   loss: 3.8742 -> 3.8713  accuracy: 19.47% -> 19.47%     
client [50] (testset)   loss: 4.1445 -> 4.1412  accuracy: 10.90% -> 10.26%     
client [75] (testset)   loss: 4.0157 -> 4.0130  accuracy: 8.57% -> 9.29%       
client [81] (testset)   loss: 3.9185 -> 3.9169  accuracy: 11.46% -> 11.98%     
Training... ---------------------------------------- 100% 0:16:19
FLUTE's average time taken by each global epoch: 0 min 2.44 sec.               
FLUTE's total running time: 0 h 16 m 19 s.                                     
==================== FLUTE Experiment Results: ====================            
Display format: (before local fine-tuning) -> (after local fine-tuning)        
 So if finetune_epoch = 0, x.xx% -> 0.00% is normal.                           
 Centralized testing ONLY happens after model aggregation, so the stats between
'->' are the same.                                                             
{                                                                              
    "100": {                                                                   
        "all_clients": {                                                       
            "test": {                                                          
                "loss": "4.1349 -> 0.0000",                                    
                "accuracy": "8.89% -> 0.00%"                                   
            }                                                                  
        }                                                                      
    },                                                                         
    "200": {                                                                   
        "all_clients": {                                                       
            "test": {                                                          
                "loss": "4.0565 -> 0.0000",                                    
                "accuracy": "10.57% -> 0.00%"                                  
            }                                                                  
        }                                                                      
    },                                                                         
    "300": {                                                                   
        "all_clients": {                                                       
            "test": {                                                          
                "loss": "4.0142 -> 0.0000",                                    
                "accuracy": "11.55% -> 0.00%"                                  
            }                                                                  
        }                                                                      
    },                                                                         
    "400": {                                                                   
        "all_clients": {                                                       
            "test": {                                                          
                "loss": "3.9854 -> 0.0000",                                    
                "accuracy": "12.05% -> 0.00%"                                  
            }                                                                  
        }                                                                      
    }                                                                          
}                                                                              
==================== FLUTE Max Accuracy ====================                   
all_clients:                                                                   
(test) before fine-tuning: 12.05% at epoch 400                                 
(test) after fine-tuning: 0.00% at epoch 100                                   
[0m