==================== FLUTE ====================                                
Experiment Arguments:                                                          
{
│   'method': 'flute',
│   'dataset': {
│   │   'name': 'mnist',
│   │   'client_num': 100,
│   │   'test_ratio': 0.25,
│   │   'val_ratio': 0.0,
│   │   'seed': 42,
│   │   'split': 'sample',
│   │   'IID_ratio': 0.0,
│   │   'monitor_window_name_suffix': 'mnist-100clients-0%IID-Dir(0.5)-seed42',
│   │   'alpha': 0.5,
│   │   'min_samples_per_client': 10
│   },
│   'model': {
│   │   'name': 'avgcnn',
│   │   'use_torchvision_pretrained_weights': True,
│   │   'external_model_weights_path': None
│   },
│   'optimizer': {
│   │   'lr': 0.01,
│   │   'dampening': 0,
│   │   'weight_decay': 0,
│   │   'momentum': 0,
│   │   'nesterov': False,
│   │   'name': 'sgd'
│   },
│   'mode': 'serial',
│   'parallel': {
│   │   'ray_cluster_addr': None,
│   │   'num_cpus': None,
│   │   'num_gpus': None,
│   │   'num_workers': 2
│   },
│   'common': {
│   │   'seed': 42,
│   │   'join_ratio': 0.1,
│   │   'global_epoch': 400,
│   │   'local_epoch': 5,
│   │   'batch_size': 32,
│   │   'reset_optimizer_on_global_epoch': True,
│   │   'straggler_ratio': 0,
│   │   'straggler_min_local_epoch': 0,
│   │   'buffers': 'global',
│   │   'client_side_evaluation': True,
│   │   'test': {
│   │   │   'client': {
│   │   │   │   'interval': 100,
│   │   │   │   'finetune_epoch': 0,
│   │   │   │   'train': False,
│   │   │   │   'val': False,
│   │   │   │   'test': True
│   │   │   },
│   │   │   'server': {
│   │   │   │   'interval': -1,
│   │   │   │   'train': False,
│   │   │   │   'val': False,
│   │   │   │   'test': False,
│   │   │   │   'model_in_train_mode': False
│   │   │   }
│   │   },
│   │   'verbose_gap': 10,
│   │   'monitor': None,
│   │   'use_cuda': True,
│   │   'save_log': True,
│   │   'save_model': False,
│   │   'save_learning_curve_plot': False,
│   │   'save_metrics': True,
│   │   'delete_useless_run': True
│   },
│   'flute': {
│   │   'rep_round': 1,
│   │   'lamda1': 0.25,
│   │   'lamda2': 0.0025,
│   │   'lamda3': 0.0005,
│   │   'gamma1': 1,
│   │   'gamma2': 1,
│   │   'nc2_lr': 0.5
│   }
}
---------------------------- TRAINING EPOCH: 10 ----------------------------   
client [77] (testset)   loss: 1.6885 -> 1.6344  accuracy: 44.71% -> 44.71%     
client [81] (testset)   loss: 1.8285 -> 1.7581  accuracy: 35.27% -> 42.74%     
client [21] (testset)   loss: 1.9944 -> 1.6130  accuracy: 49.76% -> 51.20%     
client [68] (testset)   loss: 1.1007 -> 1.0249  accuracy: 64.73% -> 64.73%     
client [93] (testset)   loss: 1.4630 -> 1.3493  accuracy: 45.39% -> 46.10%     
client [31] (testset)   loss: 1.6132 -> 1.5021  accuracy: 43.32% -> 43.32%     
client [20] (testset)   loss: 1.1882 -> 1.1322  accuracy: 64.08% -> 64.08%     
client [59] (testset)   loss: 1.8495 -> 1.5258  accuracy: 63.54% -> 67.71%     
client [48] (testset)   loss: 1.2551 -> 1.1998  accuracy: 60.99% -> 64.54%     
client [34] (testset)   loss: 1.0972 -> 0.9942  accuracy: 61.80% -> 67.04%     
---------------------------- TRAINING EPOCH: 20 ----------------------------   
client [69] (testset)   loss: 1.8675 -> 1.8108  accuracy: 34.29% -> 34.29%     
client [99] (testset)   loss: 1.6117 -> 1.5376  accuracy: 41.42% -> 41.42%     
client [67] (testset)   loss: 1.5377 -> 1.4588  accuracy: 51.43% -> 53.14%     
client [0]  (testset)   loss: 1.5272 -> 1.4662  accuracy: 45.54% -> 50.96%     
client [76] (testset)   loss: 1.4352 -> 1.3747  accuracy: 57.92% -> 59.56%     
client [41] (testset)   loss: 1.6051 -> 1.5089  accuracy: 37.67% -> 37.67%     
client [62] (testset)   loss: 1.9473 -> 0.5721  accuracy: 20.61% -> 85.45%     
client [2]  (testset)   loss: 2.0622 -> 1.3761  accuracy: 30.19% -> 68.51%     
client [14] (testset)   loss: 1.5748 -> 1.5195  accuracy: 53.41% -> 56.25%     
client [46] (testset)   loss: 1.3954 -> 1.3353  accuracy: 71.56% -> 72.48%     
---------------------------- TRAINING EPOCH: 30 ----------------------------   
client [24] (testset)   loss: 1.4493 -> 1.3977  accuracy: 60.00% -> 61.58%     
client [68] (testset)   loss: 0.9206 -> 0.8907  accuracy: 69.64% -> 72.32%     
client [57] (testset)   loss: 1.7614 -> 1.7054  accuracy: 40.43% -> 43.62%     
client [17] (testset)   loss: 1.8669 -> 1.8159  accuracy: 20.97% -> 22.58%     
client [54] (testset)   loss: 1.1600 -> 1.1253  accuracy: 71.24% -> 73.01%     
client [23] (testset)   loss: 2.0214 -> 1.3920  accuracy: 35.65% -> 52.17%     
client [35] (testset)   loss: 1.5384 -> 1.4928  accuracy: 41.18% -> 51.26%     
client [59] (testset)   loss: 1.3933 -> 1.3539  accuracy: 64.58% -> 67.71%     
client [31] (testset)   loss: 1.3290 -> 1.2956  accuracy: 54.01% -> 55.61%     
client [9]  (testset)   loss: 1.6248 -> 1.5867  accuracy: 47.27% -> 47.27%     
---------------------------- TRAINING EPOCH: 40 ----------------------------   
client [64] (testset)   loss: 1.6068 -> 1.5713  accuracy: 61.11% -> 61.11%     
client [33] (testset)   loss: 1.4532 -> 1.4238  accuracy: 62.43% -> 62.98%     
client [16] (testset)   loss: 1.5348 -> 1.4983  accuracy: 47.90% -> 47.90%     
client [44] (testset)   loss: 1.6298 -> 1.5158  accuracy: 37.68% -> 45.04%     
client [8]  (testset)   loss: 1.4668 -> 1.4411  accuracy: 41.18% -> 42.65%     
client [31] (testset)   loss: 1.2737 -> 1.2468  accuracy: 57.22% -> 60.43%     
client [47] (testset)   loss: 1.4269 -> 1.3541  accuracy: 69.38% -> 70.32%     
client [36] (testset)   loss: 1.3674 -> 1.2840  accuracy: 51.74% -> 52.90%     
client [20] (testset)   loss: 1.0421 -> 1.0153  accuracy: 64.08% -> 64.08%     
client [56] (testset)   loss: 1.4813 -> 1.4104  accuracy: 64.23% -> 65.38%     
---------------------------- TRAINING EPOCH: 50 ----------------------------   
client [4]  (testset)   loss: 1.3982 -> 1.3584  accuracy: 53.80% -> 53.80%     
client [60] (testset)   loss: 1.2460 -> 1.1848  accuracy: 70.59% -> 71.90%     
client [28] (testset)   loss: 1.1701 -> 1.1348  accuracy: 67.16% -> 66.67%     
client [25] (testset)   loss: 1.6200 -> 1.5802  accuracy: 45.07% -> 45.07%     
client [58] (testset)   loss: 1.3407 -> 1.3120  accuracy: 69.90% -> 70.92%     
client [44] (testset)   loss: 1.5215 -> 1.4398  accuracy: 44.76% -> 51.27%     
client [39] (testset)   loss: 1.2802 -> 1.2206  accuracy: 60.12% -> 60.12%     
client [29] (testset)   loss: 1.7040 -> 1.6713  accuracy: 43.60% -> 46.51%     
client [3]  (testset)   loss: 1.5062 -> 1.4549  accuracy: 54.55% -> 56.57%     
client [84] (testset)   loss: 1.2416 -> 1.2081  accuracy: 72.65% -> 72.65%     
---------------------------- TRAINING EPOCH: 60 ----------------------------   
client [21] (testset)   loss: 1.5072 -> 1.4685  accuracy: 52.63% -> 52.63%     
client [84] (testset)   loss: 1.1851 -> 1.1575  accuracy: 73.99% -> 75.34%     
client [10] (testset)   loss: 1.0173 -> 0.9766  accuracy: 73.04% -> 74.51%     
client [36] (testset)   loss: 1.1996 -> 1.1617  accuracy: 57.14% -> 58.69%     
client [65] (testset)   loss: 1.3613 -> 1.3275  accuracy: 65.11% -> 66.81%     
client [81] (testset)   loss: 1.5790 -> 1.5433  accuracy: 53.94% -> 55.19%     
client [79] (testset)   loss: 1.1626 -> 1.1369  accuracy: 72.11% -> 72.11%     
client [42] (testset)   loss: 1.4779 -> 1.4506  accuracy: 52.40% -> 54.33%     
client [11] (testset)   loss: 1.3250 -> 1.2732  accuracy: 65.47% -> 70.40%     
client [96] (testset)   loss: 1.3891 -> 1.3569  accuracy: 63.86% -> 65.26%     
---------------------------- TRAINING EPOCH: 70 ----------------------------   
client [8]  (testset)   loss: 1.4076 -> 1.3822  accuracy: 47.06% -> 57.35%     
client [53] (testset)   loss: 1.6640 -> 1.6234  accuracy: 60.98% -> 61.79%     
client [52] (testset)   loss: 1.3730 -> 1.3438  accuracy: 74.03% -> 77.92%     
client [42] (testset)   loss: 1.4304 -> 1.4045  accuracy: 55.77% -> 56.25%     
client [69] (testset)   loss: 1.6259 -> 1.6025  accuracy: 65.71% -> 66.43%     
client [59] (testset)   loss: 1.2673 -> 1.2462  accuracy: 69.79% -> 68.75%     
client [7]  (testset)   loss: 0.8589 -> 0.8348  accuracy: 70.67% -> 69.78%     
client [26] (testset)   loss: 1.4105 -> 1.3779  accuracy: 58.54% -> 60.98%     
client [49] (testset)   loss: 1.7364 -> 1.7113  accuracy: 58.82% -> 61.03%     
client [98] (testset)   loss: 1.5139 -> 1.4911  accuracy: 53.33% -> 57.14%     
---------------------------- TRAINING EPOCH: 80 ----------------------------   
client [98] (testset)   loss: 1.4944 -> 1.4729  accuracy: 55.24% -> 57.14%     
client [47] (testset)   loss: 1.2994 -> 1.2434  accuracy: 72.02% -> 75.24%     
client [21] (testset)   loss: 1.4379 -> 1.4049  accuracy: 54.07% -> 55.02%     
client [77] (testset)   loss: 1.5056 -> 1.4786  accuracy: 48.24% -> 48.24%     
client [95] (testset)   loss: 0.9644 -> 0.9401  accuracy: 73.71% -> 74.65%     
client [91] (testset)   loss: 1.2559 -> 1.2229  accuracy: 68.14% -> 69.91%     
client [14] (testset)   loss: 1.3503 -> 1.3205  accuracy: 58.52% -> 59.66%     
client [99] (testset)   loss: 1.4115 -> 1.3863  accuracy: 44.97% -> 46.15%     
client [20] (testset)   loss: 0.9681 -> 0.9508  accuracy: 65.49% -> 65.49%     
client [39] (testset)   loss: 1.1417 -> 1.1101  accuracy: 65.64% -> 65.64%     
---------------------------- TRAINING EPOCH: 90 ----------------------------   
client [52] (testset)   loss: 1.3462 -> 1.3129  accuracy: 79.22% -> 80.52%     
client [62] (testset)   loss: 0.4640 -> 0.4559  accuracy: 85.45% -> 85.45%     
client [71] (testset)   loss: 1.2958 -> 1.2774  accuracy: 61.54% -> 61.54%     
client [97] (testset)   loss: 1.4983 -> 1.4626  accuracy: 56.18% -> 58.43%     
client [30] (testset)   loss: 1.4656 -> 1.4430  accuracy: 65.16% -> 65.16%     
client [88] (testset)   loss: 0.9604 -> 0.9374  accuracy: 66.67% -> 66.67%     
client [60] (testset)   loss: 1.0232 -> 0.9969  accuracy: 73.20% -> 73.20%     
client [82] (testset)   loss: 0.8934 -> 0.8590  accuracy: 83.08% -> 83.08%     
client [91] (testset)   loss: 1.1998 -> 1.1717  accuracy: 69.91% -> 70.80%     
client [57] (testset)   loss: 1.6073 -> 1.5771  accuracy: 53.19% -> 57.45%     
---------------------------- TRAINING EPOCH: 100 ----------------------------  
client [31] (testset)   loss: 1.0633 -> 1.0483  accuracy: 74.33% -> 74.87%     
client [15] (testset)   loss: 1.3595 -> 1.3297  accuracy: 63.87% -> 63.87%     
client [71] (testset)   loss: 1.2821 -> 1.2656  accuracy: 61.54% -> 61.54%     
client [97] (testset)   loss: 1.4078 -> 1.3791  accuracy: 63.48% -> 66.85%     
client [53] (testset)   loss: 1.5432 -> 1.5152  accuracy: 69.11% -> 69.92%     
client [77] (testset)   loss: 1.4896 -> 1.4636  accuracy: 50.59% -> 50.59%     
client [76] (testset)   loss: 1.1892 -> 1.1613  accuracy: 68.85% -> 69.40%     
client [79] (testset)   loss: 1.1086 -> 1.0894  accuracy: 72.79% -> 72.79%     
client [28] (testset)   loss: 1.0081 -> 0.9895  accuracy: 70.10% -> 70.59%     
client [99] (testset)   loss: 1.3688 -> 1.3481  accuracy: 47.93% -> 49.70%     
---------------------------- TRAINING EPOCH: 110 ----------------------------  
client [97] (testset)   loss: 1.3574 -> 1.3312  accuracy: 69.10% -> 69.66%     
client [86] (testset)   loss: 1.3573 -> 1.3204  accuracy: 77.66% -> 78.68%     
client [34] (testset)   loss: 0.7008 -> 0.6853  accuracy: 77.53% -> 77.90%     
client [73] (testset)   loss: 1.3029 -> 1.2782  accuracy: 71.51% -> 76.16%     
client [5]  (testset)   loss: 1.4169 -> 1.3894  accuracy: 60.59% -> 62.94%     
client [96] (testset)   loss: 1.1933 -> 1.1744  accuracy: 70.18% -> 70.18%     
client [22] (testset)   loss: 0.9414 -> 0.9203  accuracy: 79.26% -> 79.26%     
client [60] (testset)   loss: 0.9367 -> 0.9172  accuracy: 73.86% -> 74.51%     
client [66] (testset)   loss: 0.8899 -> 0.8723  accuracy: 69.87% -> 70.71%     
client [83] (testset)   loss: 1.5582 -> 1.5267  accuracy: 76.47% -> 76.47%     
---------------------------- TRAINING EPOCH: 120 ----------------------------  
client [76] (testset)   loss: 1.1080 -> 1.0861  accuracy: 70.49% -> 72.13%     
client [65] (testset)   loss: 1.2881 -> 1.2596  accuracy: 69.79% -> 71.49%     
client [95] (testset)   loss: 0.8860 -> 0.8685  accuracy: 77.93% -> 78.40%     
client [17] (testset)   loss: 1.6566 -> 1.6226  accuracy: 48.39% -> 50.00%     
client [8]  (testset)   loss: 1.3390 -> 1.3246  accuracy: 63.24% -> 63.24%     
client [35] (testset)   loss: 1.2368 -> 1.2201  accuracy: 61.34% -> 63.03%     
client [98] (testset)   loss: 1.4434 -> 1.4255  accuracy: 59.05% -> 61.90%     
client [53] (testset)   loss: 1.4981 -> 1.4752  accuracy: 69.11% -> 69.92%     
client [43] (testset)   loss: 1.7086 -> 1.6828  accuracy: 59.52% -> 58.73%     
client [64] (testset)   loss: 1.4694 -> 1.4479  accuracy: 62.70% -> 62.70%     
---------------------------- TRAINING EPOCH: 130 ----------------------------  
client [21] (testset)   loss: 1.3793 -> 1.3513  accuracy: 56.46% -> 56.94%     
client [88] (testset)   loss: 0.8618 -> 0.8439  accuracy: 66.67% -> 66.67%     
client [38] (testset)   loss: 0.9829 -> 0.9656  accuracy: 75.92% -> 76.96%     
client [3]  (testset)   loss: 1.1927 -> 1.1690  accuracy: 60.61% -> 61.62%     
client [5]  (testset)   loss: 1.3683 -> 1.3433  accuracy: 64.71% -> 66.47%     
client [41] (testset)   loss: 1.2214 -> 1.1997  accuracy: 57.85% -> 60.09%     
client [7]  (testset)   loss: 0.7969 -> 0.7760  accuracy: 74.22% -> 73.33%     
client [37] (testset)   loss: 1.1134 -> 1.0994  accuracy: 60.33% -> 60.33%     
client [45] (testset)   loss: 0.7879 -> 0.7595  accuracy: 87.32% -> 88.03%     
client [47] (testset)   loss: 1.1576 -> 1.1179  accuracy: 76.56% -> 77.32%     
---------------------------- TRAINING EPOCH: 140 ----------------------------  
client [16] (testset)   loss: 1.3109 -> 1.2917  accuracy: 62.18% -> 62.18%     
client [11] (testset)   loss: 1.0538 -> 1.0306  accuracy: 78.48% -> 78.48%     
client [37] (testset)   loss: 1.0815 -> 1.0696  accuracy: 60.33% -> 60.33%     
client [41] (testset)   loss: 1.2023 -> 1.1820  accuracy: 60.54% -> 61.88%     
client [95] (testset)   loss: 0.8288 -> 0.8150  accuracy: 79.81% -> 80.28%     
client [53] (testset)   loss: 1.4788 -> 1.4548  accuracy: 69.92% -> 69.92%     
client [22] (testset)   loss: 0.9063 -> 0.8879  accuracy: 80.00% -> 80.74%     
client [25] (testset)   loss: 1.4526 -> 1.4345  accuracy: 45.07% -> 45.07%     
client [69] (testset)   loss: 1.4791 -> 1.4637  accuracy: 72.86% -> 72.86%     
client [46] (testset)   loss: 1.1285 -> 1.1008  accuracy: 77.98% -> 78.90%     
---------------------------- TRAINING EPOCH: 150 ----------------------------  
client [47] (testset)   loss: 0.9969 -> 0.9707  accuracy: 79.21% -> 79.40%     
client [69] (testset)   loss: 1.4539 -> 1.4359  accuracy: 73.57% -> 73.57%     
client [82] (testset)   loss: 0.7658 -> 0.7441  accuracy: 86.62% -> 87.12%     
client [45] (testset)   loss: 0.7304 -> 0.7072  accuracy: 88.03% -> 88.03%     
client [7]  (testset)   loss: 0.7774 -> 0.7621  accuracy: 73.33% -> 74.67%     
client [50] (testset)   loss: 1.4386 -> 1.4110  accuracy: 66.29% -> 69.66%     
client [35] (testset)   loss: 1.1944 -> 1.1802  accuracy: 63.87% -> 63.87%     
client [24] (testset)   loss: 1.0624 -> 1.0451  accuracy: 74.74% -> 75.26%     
client [15] (testset)   loss: 1.2564 -> 1.2355  accuracy: 69.03% -> 69.03%     
client [58] (testset)   loss: 1.0824 -> 1.0681  accuracy: 77.55% -> 77.04%     
---------------------------- TRAINING EPOCH: 160 ----------------------------  
client [48] (testset)   loss: 0.8839 -> 0.8709  accuracy: 83.69% -> 84.40%     
client [76] (testset)   loss: 1.0558 -> 1.0390  accuracy: 75.96% -> 76.50%     
client [67] (testset)   loss: 1.1998 -> 1.1805  accuracy: 63.43% -> 64.00%     
client [37] (testset)   loss: 1.0620 -> 1.0523  accuracy: 60.33% -> 60.33%     
client [58] (testset)   loss: 1.0598 -> 1.0466  accuracy: 77.55% -> 77.55%     
client [64] (testset)   loss: 1.4050 -> 1.3867  accuracy: 63.49% -> 63.49%     
client [77] (testset)   loss: 1.4233 -> 1.4020  accuracy: 57.65% -> 58.82%     
client [55] (testset)   loss: 0.6439 -> 0.6313  accuracy: 89.07% -> 89.07%     
client [12] (testset)   loss: 1.2588 -> 1.2416  accuracy: 68.09% -> 70.21%     
client [89] (testset)   loss: 1.2016 -> 1.1823  accuracy: 72.88% -> 72.88%     
---------------------------- TRAINING EPOCH: 170 ----------------------------  
client [84] (testset)   loss: 0.9131 -> 0.9010  accuracy: 80.72% -> 80.72%     
client [51] (testset)   loss: 0.9129 -> 0.8978  accuracy: 83.08% -> 83.08%     
client [8]  (testset)   loss: 1.2531 -> 1.2394  accuracy: 72.06% -> 73.53%     
client [18] (testset)   loss: 0.9396 -> 0.9231  accuracy: 80.15% -> 80.88%     
client [94] (testset)   loss: 1.6465 -> 1.6264  accuracy: 61.59% -> 63.41%     
client [81] (testset)   loss: 1.2785 -> 1.2598  accuracy: 70.12% -> 70.54%     
client [3]  (testset)   loss: 1.1060 -> 1.0894  accuracy: 64.65% -> 64.65%     
client [11] (testset)   loss: 0.9704 -> 0.9503  accuracy: 80.72% -> 81.17%     
client [95] (testset)   loss: 0.7567 -> 0.7474  accuracy: 83.10% -> 83.10%     
client [67] (testset)   loss: 1.1836 -> 1.1646  accuracy: 64.00% -> 64.00%     
---------------------------- TRAINING EPOCH: 180 ----------------------------  
client [21] (testset)   loss: 1.3020 -> 1.2773  accuracy: 57.89% -> 57.89%     
client [79] (testset)   loss: 0.9851 -> 0.9742  accuracy: 73.47% -> 73.47%     
client [58] (testset)   loss: 1.0181 -> 1.0067  accuracy: 78.06% -> 78.06%     
client [88] (testset)   loss: 0.8183 -> 0.8063  accuracy: 67.68% -> 67.68%     
client [46] (testset)   loss: 1.0391 -> 1.0177  accuracy: 79.82% -> 79.82%     
client [11] (testset)   loss: 0.9521 -> 0.9342  accuracy: 81.61% -> 81.17%     
client [55] (testset)   loss: 0.5875 -> 0.5776  accuracy: 89.60% -> 89.60%     
client [13] (testset)   loss: 1.1199 -> 1.1004  accuracy: 66.56% -> 69.04%     
client [31] (testset)   loss: 1.0149 -> 1.0032  accuracy: 75.94% -> 76.47%     
client [75] (testset)   loss: 1.0184 -> 1.0037  accuracy: 76.92% -> 76.92%     
---------------------------- TRAINING EPOCH: 190 ----------------------------  
client [19] (testset)   loss: 1.1394 -> 1.1318  accuracy: 67.82% -> 67.82%     
client [7]  (testset)   loss: 0.6963 -> 0.6846  accuracy: 77.33% -> 77.33%     
client [57] (testset)   loss: 1.4144 -> 1.3959  accuracy: 68.09% -> 69.15%     
client [13] (testset)   loss: 1.0880 -> 1.0704  accuracy: 68.42% -> 69.35%     
client [43] (testset)   loss: 1.5706 -> 1.5498  accuracy: 64.29% -> 64.29%     
client [91] (testset)   loss: 1.0886 -> 1.0676  accuracy: 75.22% -> 74.34%     
client [10] (testset)   loss: 0.7489 -> 0.7346  accuracy: 84.80% -> 84.80%     
client [64] (testset)   loss: 1.3251 -> 1.3099  accuracy: 65.08% -> 65.87%     
client [82] (testset)   loss: 0.6584 -> 0.6468  accuracy: 88.38% -> 89.39%     
client [22] (testset)   loss: 0.8232 -> 0.8093  accuracy: 82.22% -> 82.22%     
---------------------------- TRAINING EPOCH: 200 ----------------------------  
client [20] (testset)   loss: 0.8987 -> 0.8886  accuracy: 68.31% -> 68.31%     
client [23] (testset)   loss: 1.0618 -> 1.0441  accuracy: 63.48% -> 63.48%     
client [88] (testset)   loss: 0.8106 -> 0.7955  accuracy: 67.68% -> 67.68%     
client [98] (testset)   loss: 1.3263 -> 1.3121  accuracy: 68.57% -> 68.57%     
client [79] (testset)   loss: 0.9616 -> 0.9522  accuracy: 74.15% -> 73.47%     
client [21] (testset)   loss: 1.2576 -> 1.2343  accuracy: 58.37% -> 58.37%     
client [92] (testset)   loss: 0.9073 -> 0.8971  accuracy: 73.68% -> 73.68%     
client [56] (testset)   loss: 0.8813 -> 0.8677  accuracy: 83.46% -> 83.46%     
client [5]  (testset)   loss: 1.2121 -> 1.1945  accuracy: 72.35% -> 71.76%     
client [52] (testset)   loss: 1.0887 -> 1.0766  accuracy: 85.71% -> 85.71%     
---------------------------- TRAINING EPOCH: 210 ----------------------------  
client [67] (testset)   loss: 1.0810 -> 1.0682  accuracy: 67.43% -> 67.43%     
client [54] (testset)   loss: 0.8679 -> 0.8564  accuracy: 85.84% -> 85.84%     
client [14] (testset)   loss: 1.0699 -> 1.0551  accuracy: 71.02% -> 72.73%     
client [99] (testset)   loss: 1.2248 -> 1.2128  accuracy: 58.58% -> 59.17%     
client [36] (testset)   loss: 0.8442 -> 0.8328  accuracy: 77.99% -> 78.38%     
client [30] (testset)   loss: 1.2366 -> 1.2225  accuracy: 70.32% -> 70.32%     
client [38] (testset)   loss: 0.9028 -> 0.8906  accuracy: 80.63% -> 80.63%     
client [15] (testset)   loss: 1.1943 -> 1.1759  accuracy: 70.32% -> 70.32%     
client [6]  (testset)   loss: 1.0720 -> 1.0588  accuracy: 69.74% -> 69.08%     
client [53] (testset)   loss: 1.3253 -> 1.3099  accuracy: 71.54% -> 73.98%     
---------------------------- TRAINING EPOCH: 220 ----------------------------  
client [99] (testset)   loss: 1.1984 -> 1.1880  accuracy: 59.76% -> 60.95%     
client [6]  (testset)   loss: 1.0619 -> 1.0519  accuracy: 69.74% -> 72.37%     
client [83] (testset)   loss: 1.2935 -> 1.2764  accuracy: 78.15% -> 80.67%     
client [42] (testset)   loss: 1.1793 -> 1.1664  accuracy: 65.38% -> 65.38%     
client [34] (testset)   loss: 0.6019 -> 0.5925  accuracy: 82.77% -> 82.77%     
client [15] (testset)   loss: 1.1797 -> 1.1616  accuracy: 70.32% -> 70.32%     
client [47] (testset)   loss: 0.8111 -> 0.7991  accuracy: 81.85% -> 82.04%     
client [55] (testset)   loss: 0.5724 -> 0.5650  accuracy: 89.87% -> 89.87%     
client [51] (testset)   loss: 0.8789 -> 0.8658  accuracy: 83.08% -> 83.08%     
client [95] (testset)   loss: 0.7191 -> 0.7112  accuracy: 83.10% -> 83.10%     
---------------------------- TRAINING EPOCH: 230 ----------------------------  
client [71] (testset)   loss: 1.1798 -> 1.1689  accuracy: 61.54% -> 61.54%     
client [15] (testset)   loss: 1.1658 -> 1.1501  accuracy: 70.32% -> 70.32%     
client [33] (testset)   loss: 1.1979 -> 1.1854  accuracy: 71.82% -> 74.03%     
client [99] (testset)   loss: 1.1828 -> 1.1729  accuracy: 61.54% -> 61.54%     
client [90] (testset)   loss: 0.9912 -> 0.9721  accuracy: 73.38% -> 76.26%     
client [57] (testset)   loss: 1.3011 -> 1.2872  accuracy: 77.66% -> 77.66%     
client [27] (testset)   loss: 0.8821 -> 0.8690  accuracy: 81.22% -> 81.73%     
client [78] (testset)   loss: 1.1587 -> 1.1456  accuracy: 65.06% -> 65.06%     
client [36] (testset)   loss: 0.8267 -> 0.8168  accuracy: 77.61% -> 80.31%     
client [88] (testset)   loss: 0.7817 -> 0.7705  accuracy: 69.70% -> 68.69%     
---------------------------- TRAINING EPOCH: 240 ----------------------------  
client [70] (testset)   loss: 1.6877 -> 1.6796  accuracy: 37.84% -> 37.84%     
client [35] (testset)   loss: 1.1108 -> 1.1018  accuracy: 66.39% -> 66.39%     
client [16] (testset)   loss: 1.1221 -> 1.1105  accuracy: 66.39% -> 66.39%     
client [80] (testset)   loss: 1.2755 -> 1.2613  accuracy: 60.26% -> 60.26%     
client [38] (testset)   loss: 0.8757 -> 0.8646  accuracy: 80.63% -> 80.63%     
client [78] (testset)   loss: 1.1379 -> 1.1258  accuracy: 66.27% -> 67.47%     
client [68] (testset)   loss: 0.6684 -> 0.6585  accuracy: 81.25% -> 81.25%     
client [11] (testset)   loss: 0.8629 -> 0.8488  accuracy: 84.30% -> 84.30%     
client [64] (testset)   loss: 1.2585 -> 1.2457  accuracy: 67.46% -> 67.46%     
client [82] (testset)   loss: 0.5854 -> 0.5768  accuracy: 90.15% -> 90.40%     
---------------------------- TRAINING EPOCH: 250 ----------------------------  
client [30] (testset)   loss: 1.1567 -> 1.1452  accuracy: 70.32% -> 70.32%     
client [27] (testset)   loss: 0.8718 -> 0.8597  accuracy: 81.73% -> 81.73%     
client [74] (testset)   loss: 1.0603 -> 1.0480  accuracy: 68.18% -> 68.18%     
client [45] (testset)   loss: 0.6148 -> 0.6019  accuracy: 88.03% -> 88.03%     
client [6]  (testset)   loss: 1.0455 -> 1.0342  accuracy: 72.37% -> 71.71%     
client [36] (testset)   loss: 0.8107 -> 0.8015  accuracy: 79.92% -> 81.08%     
client [63] (testset)   loss: 1.1954 -> 1.1804  accuracy: 68.52% -> 68.98%     
client [76] (testset)   loss: 0.9389 -> 0.9268  accuracy: 79.23% -> 78.69%     
client [83] (testset)   loss: 1.2391 -> 1.2213  accuracy: 80.67% -> 80.67%     
client [86] (testset)   loss: 0.9836 -> 0.9679  accuracy: 86.80% -> 87.31%     
---------------------------- TRAINING EPOCH: 260 ----------------------------  
client [83] (testset)   loss: 1.2228 -> 1.2062  accuracy: 80.67% -> 80.67%     
client [99] (testset)   loss: 1.1679 -> 1.1591  accuracy: 61.54% -> 61.54%     
client [74] (testset)   loss: 1.0387 -> 1.0261  accuracy: 68.18% -> 68.18%     
client [73] (testset)   loss: 1.0471 -> 1.0346  accuracy: 80.23% -> 79.65%     
client [29] (testset)   loss: 1.3645 -> 1.3486  accuracy: 62.79% -> 62.21%     
client [92] (testset)   loss: 0.8492 -> 0.8418  accuracy: 73.68% -> 73.68%     
client [6]  (testset)   loss: 1.0292 -> 1.0168  accuracy: 74.34% -> 75.00%     
client [61] (testset)   loss: 0.8714 -> 0.8582  accuracy: 79.25% -> 79.25%     
client [21] (testset)   loss: 1.1805 -> 1.1610  accuracy: 60.29% -> 60.29%     
client [67] (testset)   loss: 1.0420 -> 1.0315  accuracy: 68.00% -> 68.00%     
---------------------------- TRAINING EPOCH: 270 ----------------------------  
client [83] (testset)   loss: 1.2077 -> 1.1888  accuracy: 80.67% -> 80.67%     
client [32] (testset)   loss: 1.0117 -> 1.0005  accuracy: 75.76% -> 75.76%     
client [95] (testset)   loss: 0.7061 -> 0.6991  accuracy: 83.10% -> 83.10%     
client [61] (testset)   loss: 0.8372 -> 0.8259  accuracy: 79.87% -> 79.87%     
client [27] (testset)   loss: 0.8623 -> 0.8506  accuracy: 81.73% -> 82.74%     
client [25] (testset)   loss: 1.3515 -> 1.3414  accuracy: 45.07% -> 45.07%     
client [68] (testset)   loss: 0.6367 -> 0.6282  accuracy: 82.14% -> 82.59%     
client [34] (testset)   loss: 0.5784 -> 0.5705  accuracy: 84.64% -> 84.64%     
client [71] (testset)   loss: 1.1308 -> 1.1223  accuracy: 61.54% -> 61.54%     
client [89] (testset)   loss: 1.0822 -> 1.0682  accuracy: 78.39% -> 79.66%     
---------------------------- TRAINING EPOCH: 280 ----------------------------  
client [78] (testset)   loss: 1.0675 -> 1.0572  accuracy: 75.90% -> 75.90%     
client [81] (testset)   loss: 1.1196 -> 1.1070  accuracy: 77.18% -> 77.18%     
client [51] (testset)   loss: 0.8242 -> 0.8138  accuracy: 83.08% -> 83.08%     
client [54] (testset)   loss: 0.8368 -> 0.8284  accuracy: 85.84% -> 85.84%     
client [65] (testset)   loss: 1.0289 -> 1.0136  accuracy: 77.45% -> 77.87%     
client [41] (testset)   loss: 0.9963 -> 0.9857  accuracy: 73.54% -> 73.99%     
client [11] (testset)   loss: 0.8264 -> 0.8146  accuracy: 84.75% -> 84.75%     
client [85] (testset)   loss: 0.8252 -> 0.8145  accuracy: 78.28% -> 78.28%     
client [12] (testset)   loss: 1.1355 -> 1.1214  accuracy: 71.63% -> 71.63%     
client [23] (testset)   loss: 0.9484 -> 0.9368  accuracy: 66.96% -> 66.96%     
---------------------------- TRAINING EPOCH: 290 ----------------------------  
client [16] (testset)   loss: 1.0958 -> 1.0842  accuracy: 67.23% -> 68.91%     
client [65] (testset)   loss: 1.0042 -> 0.9932  accuracy: 79.15% -> 80.43%     
client [53] (testset)   loss: 1.2318 -> 1.2210  accuracy: 73.98% -> 73.98%     
client [58] (testset)   loss: 0.9276 -> 0.9209  accuracy: 79.08% -> 78.57%     
client [72] (testset)   loss: 0.5046 -> 0.4990  accuracy: 90.37% -> 90.68%     
client [7]  (testset)   loss: 0.6172 -> 0.6105  accuracy: 82.67% -> 82.67%     
client [71] (testset)   loss: 1.1248 -> 1.1167  accuracy: 61.54% -> 61.54%     
client [59] (testset)   loss: 0.9459 -> 0.9371  accuracy: 76.04% -> 77.08%     
client [86] (testset)   loss: 0.9231 -> 0.9119  accuracy: 87.31% -> 87.31%     
client [39] (testset)   loss: 0.7927 -> 0.7849  accuracy: 80.98% -> 80.98%     
---------------------------- TRAINING EPOCH: 300 ----------------------------  
client [99] (testset)   loss: 1.1480 -> 1.1396  accuracy: 61.54% -> 62.13%     
client [7]  (testset)   loss: 0.6021 -> 0.5946  accuracy: 83.56% -> 84.00%     
client [17] (testset)   loss: 1.1932 -> 1.1801  accuracy: 67.74% -> 67.74%     
client [64] (testset)   loss: 1.1757 -> 1.1658  accuracy: 67.46% -> 67.46%     
client [37] (testset)   loss: 0.9562 -> 0.9492  accuracy: 61.98% -> 61.98%     
client [29] (testset)   loss: 1.2930 -> 1.2766  accuracy: 68.02% -> 69.77%     
client [93] (testset)   loss: 0.9333 -> 0.9236  accuracy: 71.63% -> 71.63%     
client [73] (testset)   loss: 0.9819 -> 0.9732  accuracy: 81.40% -> 80.81%     
client [40] (testset)   loss: 0.6387 -> 0.6296  accuracy: 88.10% -> 88.44%     
client [76] (testset)   loss: 0.9008 -> 0.8901  accuracy: 80.33% -> 80.87%     
---------------------------- TRAINING EPOCH: 310 ----------------------------  
client [31] (testset)   loss: 0.8933 -> 0.8852  accuracy: 81.82% -> 82.89%     
client [89] (testset)   loss: 1.0343 -> 1.0235  accuracy: 80.08% -> 80.51%     
client [77] (testset)   loss: 1.2506 -> 1.2404  accuracy: 65.88% -> 68.24%     
client [90] (testset)   loss: 0.8688 -> 0.8555  accuracy: 79.86% -> 79.86%     
client [26] (testset)   loss: 1.1485 -> 1.1345  accuracy: 67.48% -> 66.67%     
client [50] (testset)   loss: 1.2072 -> 1.1951  accuracy: 77.53% -> 77.53%     
client [30] (testset)   loss: 1.0915 -> 1.0814  accuracy: 71.61% -> 71.61%     
client [70] (testset)   loss: 1.6534 -> 1.6467  accuracy: 45.95% -> 51.35%     
client [41] (testset)   loss: 0.9650 -> 0.9559  accuracy: 74.89% -> 74.89%     
client [99] (testset)   loss: 1.1416 -> 1.1335  accuracy: 62.13% -> 62.13%     
---------------------------- TRAINING EPOCH: 320 ----------------------------  
client [68] (testset)   loss: 0.5812 -> 0.5750  accuracy: 84.38% -> 84.38%     
client [70] (testset)   loss: 1.6363 -> 1.6304  accuracy: 51.35% -> 51.35%     
client [52] (testset)   loss: 0.9575 -> 0.9483  accuracy: 90.91% -> 89.61%     
client [1]  (testset)   loss: 1.0169 -> 1.0024  accuracy: 79.10% -> 79.10%     
client [2]  (testset)   loss: 0.7059 -> 0.6961  accuracy: 87.66% -> 87.99%     
client [67] (testset)   loss: 0.9698 -> 0.9604  accuracy: 69.14% -> 70.86%     
client [92] (testset)   loss: 0.7391 -> 0.7330  accuracy: 77.19% -> 77.19%     
client [35] (testset)   loss: 1.0519 -> 1.0421  accuracy: 71.43% -> 71.43%     
client [36] (testset)   loss: 0.7467 -> 0.7405  accuracy: 81.47% -> 81.85%     
client [64] (testset)   loss: 1.1597 -> 1.1501  accuracy: 67.46% -> 67.46%     
---------------------------- TRAINING EPOCH: 330 ----------------------------  
client [44] (testset)   loss: 0.8084 -> 0.7971  accuracy: 83.57% -> 83.57%     
client [6]  (testset)   loss: 0.9768 -> 0.9674  accuracy: 76.32% -> 76.97%     
client [12] (testset)   loss: 1.0868 -> 1.0739  accuracy: 72.34% -> 72.34%     
client [55] (testset)   loss: 0.5340 -> 0.5280  accuracy: 90.40% -> 90.40%     
client [29] (testset)   loss: 1.2404 -> 1.2261  accuracy: 70.93% -> 73.26%     
client [9]  (testset)   loss: 1.3411 -> 1.3349  accuracy: 76.36% -> 76.36%     
client [43] (testset)   loss: 1.3735 -> 1.3586  accuracy: 75.40% -> 75.40%     
client [77] (testset)   loss: 1.2450 -> 1.2345  accuracy: 68.24% -> 68.24%     
client [98] (testset)   loss: 1.1883 -> 1.1771  accuracy: 75.24% -> 75.24%     
client [78] (testset)   loss: 1.0368 -> 1.0276  accuracy: 77.11% -> 78.31%     
---------------------------- TRAINING EPOCH: 340 ----------------------------  
client [92] (testset)   loss: 0.7254 -> 0.7185  accuracy: 77.19% -> 77.19%     
client [80] (testset)   loss: 1.2188 -> 1.2096  accuracy: 64.10% -> 65.38%     
client [63] (testset)   loss: 1.1021 -> 1.0915  accuracy: 69.91% -> 70.83%     
client [76] (testset)   loss: 0.8758 -> 0.8667  accuracy: 80.87% -> 80.33%     
client [78] (testset)   loss: 1.0298 -> 1.0205  accuracy: 78.31% -> 78.31%     
client [25] (testset)   loss: 1.3163 -> 1.3053  accuracy: 45.07% -> 45.07%     
client [58] (testset)   loss: 0.8954 -> 0.8899  accuracy: 80.10% -> 80.10%     
client [13] (testset)   loss: 0.9453 -> 0.9348  accuracy: 74.92% -> 75.85%     
client [17] (testset)   loss: 1.1258 -> 1.1159  accuracy: 69.35% -> 70.16%     
client [38] (testset)   loss: 0.7560 -> 0.7496  accuracy: 81.68% -> 81.68%     
---------------------------- TRAINING EPOCH: 350 ----------------------------  
client [72] (testset)   loss: 0.4688 -> 0.4657  accuracy: 91.61% -> 91.61%     
client [82] (testset)   loss: 0.5160 -> 0.5118  accuracy: 91.41% -> 91.41%     
client [86] (testset)   loss: 0.8436 -> 0.8358  accuracy: 88.32% -> 88.83%     
client [51] (testset)   loss: 0.7809 -> 0.7726  accuracy: 83.08% -> 83.08%     
client [96] (testset)   loss: 0.9423 -> 0.9334  accuracy: 78.95% -> 78.95%     
client [42] (testset)   loss: 1.0480 -> 1.0376  accuracy: 71.15% -> 71.63%     
client [55] (testset)   loss: 0.5140 -> 0.5097  accuracy: 90.67% -> 90.93%     
client [13] (testset)   loss: 0.9282 -> 0.9190  accuracy: 75.85% -> 76.16%     
client [1]  (testset)   loss: 0.9837 -> 0.9714  accuracy: 79.66% -> 79.66%     
client [12] (testset)   loss: 1.0766 -> 1.0665  accuracy: 72.34% -> 72.34%     
---------------------------- TRAINING EPOCH: 360 ----------------------------  
client [68] (testset)   loss: 0.5663 -> 0.5609  accuracy: 84.38% -> 84.38%     
client [23] (testset)   loss: 0.8766 -> 0.8674  accuracy: 66.96% -> 66.96%     
client [46] (testset)   loss: 0.7852 -> 0.7768  accuracy: 83.49% -> 84.40%     
client [41] (testset)   loss: 0.9311 -> 0.9233  accuracy: 75.78% -> 77.13%     
client [25] (testset)   loss: 1.2845 -> 1.2761  accuracy: 45.07% -> 45.07%     
client [58] (testset)   loss: 0.8850 -> 0.8792  accuracy: 79.59% -> 80.10%     
client [14] (testset)   loss: 0.9299 -> 0.9195  accuracy: 78.98% -> 80.11%     
client [33] (testset)   loss: 1.0805 -> 1.0683  accuracy: 75.14% -> 74.59%     
client [85] (testset)   loss: 0.7657 -> 0.7562  accuracy: 81.27% -> 81.65%     
client [62] (testset)   loss: 0.3940 -> 0.3903  accuracy: 88.48% -> 88.48%     
---------------------------- TRAINING EPOCH: 370 ----------------------------  
client [98] (testset)   loss: 1.1441 -> 1.1350  accuracy: 75.24% -> 76.19%     
client [63] (testset)   loss: 1.0728 -> 1.0624  accuracy: 71.30% -> 71.30%     
client [70] (testset)   loss: 1.6073 -> 1.6015  accuracy: 54.05% -> 54.05%     
client [65] (testset)   loss: 0.9560 -> 0.9427  accuracy: 81.70% -> 82.13%     
client [14] (testset)   loss: 0.9031 -> 0.8940  accuracy: 80.11% -> 80.11%     
client [73] (testset)   loss: 0.9312 -> 0.9222  accuracy: 83.72% -> 83.14%     
client [34] (testset)   loss: 0.5158 -> 0.5107  accuracy: 85.39% -> 85.39%     
client [99] (testset)   loss: 1.1181 -> 1.1110  accuracy: 63.31% -> 63.91%     
client [69] (testset)   loss: 1.2298 -> 1.2183  accuracy: 76.43% -> 76.43%     
client [46] (testset)   loss: 0.7777 -> 0.7690  accuracy: 84.40% -> 84.40%     
---------------------------- TRAINING EPOCH: 380 ----------------------------  
client [99] (testset)   loss: 1.1075 -> 1.1005  accuracy: 63.91% -> 64.50%     
client [93] (testset)   loss: 0.9044 -> 0.8968  accuracy: 71.63% -> 71.63%     
client [11] (testset)   loss: 0.7439 -> 0.7348  accuracy: 87.89% -> 88.34%     
client [58] (testset)   loss: 0.8653 -> 0.8590  accuracy: 81.12% -> 81.12%     
client [81] (testset)   loss: 1.0029 -> 0.9943  accuracy: 78.01% -> 78.01%     
client [85] (testset)   loss: 0.7578 -> 0.7498  accuracy: 81.65% -> 82.02%     
client [89] (testset)   loss: 0.9666 -> 0.9587  accuracy: 81.36% -> 80.93%     
client [45] (testset)   loss: 0.5470 -> 0.5400  accuracy: 88.03% -> 88.03%     
client [8]  (testset)   loss: 1.1034 -> 1.0936  accuracy: 76.47% -> 76.47%     
client [68] (testset)   loss: 0.5446 -> 0.5399  accuracy: 84.38% -> 84.38%     
---------------------------- TRAINING EPOCH: 390 ----------------------------  
client [67] (testset)   loss: 0.9377 -> 0.9302  accuracy: 70.86% -> 70.86%     
client [72] (testset)   loss: 0.4546 -> 0.4501  accuracy: 92.55% -> 91.93%     
client [1]  (testset)   loss: 0.9545 -> 0.9422  accuracy: 80.23% -> 80.23%     
client [78] (testset)   loss: 0.9837 -> 0.9762  accuracy: 83.13% -> 83.13%     
client [83] (testset)   loss: 0.9898 -> 0.9804  accuracy: 80.67% -> 80.67%     
client [21] (testset)   loss: 0.9884 -> 0.9784  accuracy: 70.81% -> 70.81%     
client [56] (testset)   loss: 0.6979 -> 0.6929  accuracy: 85.38% -> 85.00%     
client [44] (testset)   loss: 0.7407 -> 0.7335  accuracy: 84.99% -> 86.12%     
client [92] (testset)   loss: 0.7033 -> 0.7008  accuracy: 77.19% -> 77.19%     
client [27] (testset)   loss: 0.7673 -> 0.7587  accuracy: 85.79% -> 86.29%     
---------------------------- TRAINING EPOCH: 400 ----------------------------  
client [10] (testset)   loss: 0.5657 -> 0.5614  accuracy: 92.16% -> 92.16%     
client [39] (testset)   loss: 0.7556 -> 0.7500  accuracy: 83.44% -> 82.82%     
client [65] (testset)   loss: 0.9174 -> 0.9084  accuracy: 82.55% -> 82.55%     
client [26] (testset)   loss: 1.0548 -> 1.0443  accuracy: 68.29% -> 68.29%     
client [19] (testset)   loss: 1.0130 -> 1.0037  accuracy: 75.86% -> 75.86%     
client [68] (testset)   loss: 0.5368 -> 0.5324  accuracy: 84.38% -> 84.38%     
client [41] (testset)   loss: 0.9022 -> 0.8954  accuracy: 77.58% -> 77.58%     
client [50] (testset)   loss: 1.0904 -> 1.0802  accuracy: 78.65% -> 78.65%     
client [75] (testset)   loss: 0.9286 -> 0.9201  accuracy: 79.49% -> 79.49%     
client [81] (testset)   loss: 0.9812 -> 0.9734  accuracy: 78.42% -> 78.42%     
Training... ---------------------------------------- 100% 0:17:57
FLUTE's average time taken by each global epoch: 0 min 2.68 sec.               
FLUTE's total running time: 0 h 17 m 57 s.                                     
==================== FLUTE Experiment Results: ====================            
Display format: (before local fine-tuning) -> (after local fine-tuning)        
 So if finetune_epoch = 0, x.xx% -> 0.00% is normal.                           
 Centralized testing ONLY happens after model aggregation, so the stats between
'->' are the same.                                                             
{                                                                              
    "100": {                                                                   
        "all_clients": {                                                       
            "test": {                                                          
                "loss": "1.1679 -> 0.0000",                                    
                "accuracy": "69.43% -> 0.00%"                                  
            }                                                                  
        }                                                                      
    },                                                                         
    "200": {                                                                   
        "all_clients": {                                                       
            "test": {                                                          
                "loss": "1.0031 -> 0.0000",                                    
                "accuracy": "75.22% -> 0.00%"                                  
            }                                                                  
        }                                                                      
    },                                                                         
    "300": {                                                                   
        "all_clients": {                                                       
            "test": {                                                          
                "loss": "0.9016 -> 0.0000",                                    
                "accuracy": "78.46% -> 0.00%"                                  
            }                                                                  
        }                                                                      
    },                                                                         
    "400": {                                                                   
        "all_clients": {                                                       
            "test": {                                                          
                "loss": "0.8316 -> 0.0000",                                    
                "accuracy": "80.48% -> 0.00%"                                  
            }                                                                  
        }                                                                      
    }                                                                          
}                                                                              
==================== FLUTE Max Accuracy ====================                   
all_clients:                                                                   
(test) before fine-tuning: 80.48% at epoch 400                                 
(test) after fine-tuning: 0.00% at epoch 100                                   
[0m