==================== FLUTE ====================                                
Experiment Arguments:                                                          
{
│   'method': 'flute',
│   'dataset': {
│   │   'name': 'cifar10',
│   │   'client_num': 100,
│   │   'test_ratio': 0.25,
│   │   'val_ratio': 0.0,
│   │   'seed': 42,
│   │   'split': 'sample',
│   │   'IID_ratio': 0.0,
│   │   'monitor_window_name_suffix': 'cifar10-100clients-0%IID-Dir(0.5)-seed42',
│   │   'alpha': 0.5,
│   │   'min_samples_per_client': 10
│   },
│   'model': {
│   │   'name': 'avgcnn',
│   │   'use_torchvision_pretrained_weights': True,
│   │   'external_model_weights_path': None
│   },
│   'optimizer': {
│   │   'lr': 0.01,
│   │   'dampening': 0,
│   │   'weight_decay': 0,
│   │   'momentum': 0,
│   │   'nesterov': False,
│   │   'name': 'sgd'
│   },
│   'mode': 'serial',
│   'parallel': {
│   │   'ray_cluster_addr': None,
│   │   'num_cpus': None,
│   │   'num_gpus': None,
│   │   'num_workers': 2
│   },
│   'common': {
│   │   'seed': 42,
│   │   'join_ratio': 0.1,
│   │   'global_epoch': 400,
│   │   'local_epoch': 5,
│   │   'batch_size': 32,
│   │   'reset_optimizer_on_global_epoch': True,
│   │   'straggler_ratio': 0,
│   │   'straggler_min_local_epoch': 0,
│   │   'buffers': 'global',
│   │   'client_side_evaluation': True,
│   │   'test': {
│   │   │   'client': {
│   │   │   │   'interval': 100,
│   │   │   │   'finetune_epoch': 0,
│   │   │   │   'train': False,
│   │   │   │   'val': False,
│   │   │   │   'test': True
│   │   │   },
│   │   │   'server': {
│   │   │   │   'interval': -1,
│   │   │   │   'train': False,
│   │   │   │   'val': False,
│   │   │   │   'test': False,
│   │   │   │   'model_in_train_mode': False
│   │   │   }
│   │   },
│   │   'verbose_gap': 10,
│   │   'monitor': None,
│   │   'use_cuda': True,
│   │   'save_log': True,
│   │   'save_model': False,
│   │   'save_learning_curve_plot': False,
│   │   'save_metrics': True,
│   │   'delete_useless_run': True
│   },
│   'flute': {
│   │   'rep_round': 1,
│   │   'lamda1': 0.25,
│   │   'lamda2': 0.0025,
│   │   'lamda3': 0.0005,
│   │   'gamma1': 1,
│   │   'gamma2': 1,
│   │   'nc2_lr': 0.5
│   }
}
---------------------------- TRAINING EPOCH: 10 ----------------------------   
client [77] (testset)   loss: 1.9776 -> 1.9508  accuracy: 23.16% -> 23.73%     
client [81] (testset)   loss: 1.8264 -> 1.7755  accuracy: 29.52% -> 38.10%     
client [21] (testset)   loss: 2.1709 -> 1.9006  accuracy: 38.03% -> 39.44%     
client [68] (testset)   loss: 1.8324 -> 1.6892  accuracy: 46.48% -> 46.48%     
client [93] (testset)   loss: 1.9665 -> 1.9078  accuracy: 35.47% -> 35.09%     
client [31] (testset)   loss: 1.6265 -> 1.5616  accuracy: 46.79% -> 46.79%     
client [20] (testset)   loss: 1.9397 -> 1.9082  accuracy: 31.60% -> 32.90%     
client [59] (testset)   loss: 2.2604 -> 1.9292  accuracy: 17.20% -> 33.76%     
client [48] (testset)   loss: 2.1351 -> 2.1164  accuracy: 22.58% -> 22.58%     
client [34] (testset)   loss: 1.7887 -> 1.6797  accuracy: 32.44% -> 32.44%     
---------------------------- TRAINING EPOCH: 20 ----------------------------   
client [69] (testset)   loss: 1.6970 -> 1.6674  accuracy: 47.68% -> 47.68%     
client [99] (testset)   loss: 2.0083 -> 1.9468  accuracy: 29.73% -> 33.51%     
client [67] (testset)   loss: 1.8625 -> 1.7982  accuracy: 33.77% -> 34.63%     
client [0]  (testset)   loss: 1.7809 -> 1.7381  accuracy: 46.51% -> 46.51%     
client [76] (testset)   loss: 1.4629 -> 1.3976  accuracy: 53.94% -> 59.39%     
client [41] (testset)   loss: 1.7881 -> 1.6338  accuracy: 54.55% -> 52.45%     
client [62] (testset)   loss: 2.5117 -> 1.9204  accuracy: 0.00% -> 48.48%      
client [2]  (testset)   loss: 2.3137 -> 2.1893  accuracy: 3.85% -> 23.08%      
client [14] (testset)   loss: 1.8877 -> 1.8655  accuracy: 36.13% -> 36.13%     
client [46] (testset)   loss: 1.8982 -> 1.8812  accuracy: 39.58% -> 38.19%     
---------------------------- TRAINING EPOCH: 30 ----------------------------   
client [24] (testset)   loss: 1.7679 -> 1.7473  accuracy: 47.33% -> 46.56%     
client [68] (testset)   loss: 1.6155 -> 1.6000  accuracy: 46.48% -> 46.48%     
client [57] (testset)   loss: 1.8486 -> 1.7855  accuracy: 34.68% -> 34.68%     
client [17] (testset)   loss: 1.1749 -> 1.1477  accuracy: 69.93% -> 69.93%     
client [54] (testset)   loss: 1.7364 -> 1.7186  accuracy: 35.51% -> 34.58%     
client [23] (testset)   loss: 2.1375 -> 1.8429  accuracy: 37.98% -> 51.16%     
client [35] (testset)   loss: 1.3841 -> 1.3355  accuracy: 40.74% -> 40.74%     
client [59] (testset)   loss: 1.8634 -> 1.8445  accuracy: 33.76% -> 33.76%     
client [31] (testset)   loss: 1.4868 -> 1.4738  accuracy: 50.36% -> 51.79%     
client [9]  (testset)   loss: 1.9461 -> 1.9310  accuracy: 29.57% -> 31.30%     
---------------------------- TRAINING EPOCH: 40 ----------------------------   
client [64] (testset)   loss: 1.7594 -> 1.7338  accuracy: 36.84% -> 36.84%     
client [33] (testset)   loss: 1.5970 -> 1.5855  accuracy: 39.70% -> 40.70%     
client [16] (testset)   loss: 1.7443 -> 1.7201  accuracy: 40.00% -> 40.80%     
client [44] (testset)   loss: 1.6669 -> 1.6328  accuracy: 48.01% -> 48.01%     
client [8]  (testset)   loss: 1.6126 -> 1.5981  accuracy: 41.33% -> 44.00%     
client [31] (testset)   loss: 1.4686 -> 1.4558  accuracy: 52.50% -> 52.86%     
client [47] (testset)   loss: 1.4821 -> 1.4415  accuracy: 41.67% -> 41.67%     
client [36] (testset)   loss: 1.9063 -> 1.7912  accuracy: 42.42% -> 40.40%     
client [20] (testset)   loss: 1.8544 -> 1.8446  accuracy: 32.03% -> 32.47%     
client [56] (testset)   loss: 2.1343 -> 2.1010  accuracy: 24.00% -> 24.00%     
---------------------------- TRAINING EPOCH: 50 ----------------------------   
client [4]  (testset)   loss: 1.5486 -> 1.5318  accuracy: 54.19% -> 54.19%     
client [60] (testset)   loss: 1.8655 -> 1.8403  accuracy: 32.49% -> 33.76%     
client [28] (testset)   loss: 1.7807 -> 1.7656  accuracy: 35.37% -> 35.37%     
client [25] (testset)   loss: 1.6498 -> 1.6029  accuracy: 41.67% -> 41.67%     
client [58] (testset)   loss: 1.7738 -> 1.7592  accuracy: 42.77% -> 42.77%     
client [44] (testset)   loss: 1.6369 -> 1.6160  accuracy: 48.01% -> 48.01%     
client [39] (testset)   loss: 1.8537 -> 1.8199  accuracy: 33.62% -> 31.90%     
client [29] (testset)   loss: 1.6864 -> 1.6741  accuracy: 51.54% -> 51.54%     
client [3]  (testset)   loss: 1.6777 -> 1.6512  accuracy: 47.49% -> 48.65%     
client [84] (testset)   loss: 1.8438 -> 1.8283  accuracy: 38.82% -> 38.82%     
---------------------------- TRAINING EPOCH: 60 ----------------------------   
client [21] (testset)   loss: 1.7724 -> 1.7434  accuracy: 38.03% -> 38.03%     
client [84] (testset)   loss: 1.8180 -> 1.8057  accuracy: 38.82% -> 38.82%     
client [10] (testset)   loss: 1.6865 -> 1.6721  accuracy: 44.88% -> 44.88%     
client [36] (testset)   loss: 1.7328 -> 1.7045  accuracy: 41.41% -> 43.43%     
client [65] (testset)   loss: 1.8409 -> 1.8188  accuracy: 43.18% -> 47.73%     
client [81] (testset)   loss: 1.7122 -> 1.6959  accuracy: 43.81% -> 43.81%     
client [79] (testset)   loss: 1.4093 -> 1.3867  accuracy: 57.63% -> 56.78%     
client [42] (testset)   loss: 1.4695 -> 1.4285  accuracy: 44.79% -> 48.96%     
client [11] (testset)   loss: 1.8092 -> 1.7960  accuracy: 32.31% -> 32.31%     
client [96] (testset)   loss: 1.5994 -> 1.5761  accuracy: 47.37% -> 50.38%     
---------------------------- TRAINING EPOCH: 70 ----------------------------   
client [8]  (testset)   loss: 1.5788 -> 1.5738  accuracy: 48.00% -> 45.33%     
client [53] (testset)   loss: 1.9407 -> 1.9202  accuracy: 36.84% -> 34.21%     
client [52] (testset)   loss: 1.4178 -> 1.4056  accuracy: 59.86% -> 59.86%     
client [42] (testset)   loss: 1.4227 -> 1.4110  accuracy: 48.96% -> 51.04%     
client [69] (testset)   loss: 1.6030 -> 1.5967  accuracy: 47.68% -> 47.68%     
client [59] (testset)   loss: 1.8194 -> 1.8127  accuracy: 36.94% -> 36.31%     
client [7]  (testset)   loss: 1.8304 -> 1.8273  accuracy: 36.41% -> 37.33%     
client [26] (testset)   loss: 1.5401 -> 1.5209  accuracy: 51.69% -> 51.69%     
client [49] (testset)   loss: 1.6920 -> 1.6787  accuracy: 44.57% -> 44.57%     
client [98] (testset)   loss: 1.8776 -> 1.8697  accuracy: 37.50% -> 37.50%     
---------------------------- TRAINING EPOCH: 80 ----------------------------   
client [98] (testset)   loss: 1.8730 -> 1.8656  accuracy: 36.84% -> 37.50%     
client [47] (testset)   loss: 1.4193 -> 1.3938  accuracy: 44.44% -> 45.37%     
client [21] (testset)   loss: 1.7352 -> 1.7187  accuracy: 39.44% -> 39.44%     
client [77] (testset)   loss: 1.8894 -> 1.8817  accuracy: 27.68% -> 28.81%     
client [95] (testset)   loss: 2.1376 -> 2.1296  accuracy: 26.79% -> 27.68%     
client [91] (testset)   loss: 1.8273 -> 1.8179  accuracy: 39.90% -> 40.38%     
client [14] (testset)   loss: 1.8242 -> 1.8199  accuracy: 36.13% -> 36.13%     
client [99] (testset)   loss: 1.8875 -> 1.8761  accuracy: 32.43% -> 33.51%     
client [20] (testset)   loss: 1.8179 -> 1.8129  accuracy: 32.90% -> 32.47%     
client [39] (testset)   loss: 1.7951 -> 1.7783  accuracy: 35.34% -> 34.48%     
---------------------------- TRAINING EPOCH: 90 ----------------------------   
client [52] (testset)   loss: 1.4124 -> 1.3985  accuracy: 59.86% -> 59.86%     
client [62] (testset)   loss: 1.5397 -> 1.5256  accuracy: 45.45% -> 46.46%     
client [71] (testset)   loss: 1.4225 -> 1.4081  accuracy: 43.68% -> 43.68%     
client [97] (testset)   loss: 1.8401 -> 1.8247  accuracy: 39.31% -> 39.31%     
client [30] (testset)   loss: 2.1141 -> 2.1146  accuracy: 26.73% -> 27.72%     
client [88] (testset)   loss: 1.7702 -> 1.7604  accuracy: 38.25% -> 40.98%     
client [60] (testset)   loss: 1.7962 -> 1.7904  accuracy: 38.82% -> 37.97%     
client [82] (testset)   loss: 1.3128 -> 1.2993  accuracy: 57.14% -> 57.14%     
client [91] (testset)   loss: 1.8136 -> 1.8060  accuracy: 39.90% -> 39.42%     
client [57] (testset)   loss: 1.7112 -> 1.6875  accuracy: 34.68% -> 34.68%     
---------------------------- TRAINING EPOCH: 100 ----------------------------  
client [31] (testset)   loss: 1.4072 -> 1.4042  accuracy: 55.36% -> 55.36%     
client [15] (testset)   loss: 1.4807 -> 1.4669  accuracy: 51.76% -> 51.76%     
client [71] (testset)   loss: 1.4101 -> 1.3968  accuracy: 43.68% -> 44.21%     
client [97] (testset)   loss: 1.8103 -> 1.8021  accuracy: 39.31% -> 39.31%     
client [53] (testset)   loss: 1.8777 -> 1.8603  accuracy: 32.89% -> 38.16%     
client [77] (testset)   loss: 1.8828 -> 1.8753  accuracy: 29.38% -> 29.94%     
client [76] (testset)   loss: 1.2911 -> 1.2773  accuracy: 58.79% -> 58.79%     
client [79] (testset)   loss: 1.3665 -> 1.3528  accuracy: 58.05% -> 58.05%     
client [28] (testset)   loss: 1.7168 -> 1.7165  accuracy: 35.37% -> 35.37%     
client [99] (testset)   loss: 1.8691 -> 1.8601  accuracy: 32.43% -> 32.97%     
---------------------------- TRAINING EPOCH: 110 ----------------------------  
client [97] (testset)   loss: 1.7987 -> 1.7895  accuracy: 39.88% -> 39.88%     
client [86] (testset)   loss: 1.5390 -> 1.5299  accuracy: 53.85% -> 53.85%     
client [34] (testset)   loss: 1.4985 -> 1.4893  accuracy: 37.78% -> 38.22%     
client [73] (testset)   loss: 1.8710 -> 1.8634  accuracy: 35.27% -> 35.27%     
client [5]  (testset)   loss: 1.6059 -> 1.5976  accuracy: 46.43% -> 45.54%     
client [96] (testset)   loss: 1.5036 -> 1.4996  accuracy: 52.63% -> 53.38%     
client [22] (testset)   loss: 1.8528 -> 1.8465  accuracy: 32.31% -> 35.38%     
client [60] (testset)   loss: 1.7775 -> 1.7717  accuracy: 38.40% -> 38.40%     
client [66] (testset)   loss: 1.4022 -> 1.3884  accuracy: 54.35% -> 52.72%     
client [83] (testset)   loss: 1.3512 -> 1.3394  accuracy: 61.00% -> 64.00%     
---------------------------- TRAINING EPOCH: 120 ----------------------------  
client [76] (testset)   loss: 1.2584 -> 1.2510  accuracy: 59.39% -> 59.39%     
client [65] (testset)   loss: 1.7915 -> 1.7828  accuracy: 43.18% -> 43.18%     
client [95] (testset)   loss: 2.1231 -> 2.1177  accuracy: 27.68% -> 27.68%     
client [17] (testset)   loss: 1.1115 -> 1.0917  accuracy: 69.93% -> 69.93%     
client [8]  (testset)   loss: 1.5530 -> 1.5423  accuracy: 45.33% -> 49.33%     
client [35] (testset)   loss: 1.1411 -> 1.1432  accuracy: 48.15% -> 46.30%     
client [98] (testset)   loss: 1.8591 -> 1.8541  accuracy: 38.16% -> 38.16%     
client [53] (testset)   loss: 1.8567 -> 1.8345  accuracy: 32.89% -> 38.16%     
client [43] (testset)   loss: 1.7471 -> 1.7379  accuracy: 39.42% -> 40.15%     
client [64] (testset)   loss: 1.6635 -> 1.6511  accuracy: 36.32% -> 37.37%     
---------------------------- TRAINING EPOCH: 130 ----------------------------  
client [21] (testset)   loss: 1.7152 -> 1.7023  accuracy: 40.85% -> 40.85%     
client [88] (testset)   loss: 1.7257 -> 1.7218  accuracy: 44.26% -> 44.26%     
client [38] (testset)   loss: 1.6258 -> 1.6176  accuracy: 50.60% -> 49.40%     
client [3]  (testset)   loss: 1.5531 -> 1.5479  accuracy: 50.97% -> 50.97%     
client [5]  (testset)   loss: 1.5922 -> 1.5868  accuracy: 47.32% -> 44.64%     
client [41] (testset)   loss: 1.4422 -> 1.4304  accuracy: 55.24% -> 54.55%     
client [7]  (testset)   loss: 1.8209 -> 1.8176  accuracy: 39.63% -> 39.17%     
client [37] (testset)   loss: 1.7072 -> 1.6999  accuracy: 37.66% -> 37.66%     
client [45] (testset)   loss: 1.7978 -> 1.7885  accuracy: 32.84% -> 31.73%     
client [47] (testset)   loss: 1.3714 -> 1.3572  accuracy: 45.37% -> 49.07%     
---------------------------- TRAINING EPOCH: 140 ----------------------------  
client [16] (testset)   loss: 1.6508 -> 1.6434  accuracy: 48.00% -> 47.20%     
client [11] (testset)   loss: 1.7554 -> 1.7492  accuracy: 33.08% -> 33.08%     
client [37] (testset)   loss: 1.6874 -> 1.6802  accuracy: 38.96% -> 41.56%     
client [41] (testset)   loss: 1.4353 -> 1.4234  accuracy: 54.55% -> 54.55%     
client [95] (testset)   loss: 2.1102 -> 2.1061  accuracy: 27.68% -> 27.68%     
client [53] (testset)   loss: 1.8380 -> 1.8263  accuracy: 38.16% -> 36.84%     
client [22] (testset)   loss: 1.8424 -> 1.8346  accuracy: 34.62% -> 35.38%     
client [25] (testset)   loss: 1.5624 -> 1.5500  accuracy: 43.33% -> 43.33%     
client [69] (testset)   loss: 1.5755 -> 1.5749  accuracy: 47.68% -> 47.68%     
client [46] (testset)   loss: 1.8354 -> 1.8280  accuracy: 40.97% -> 41.32%     
---------------------------- TRAINING EPOCH: 150 ----------------------------  
client [47] (testset)   loss: 1.3210 -> 1.3101  accuracy: 50.00% -> 51.85%     
client [69] (testset)   loss: 1.5716 -> 1.5716  accuracy: 47.68% -> 47.68%     
client [82] (testset)   loss: 1.2790 -> 1.2690  accuracy: 57.14% -> 57.14%     
client [45] (testset)   loss: 1.7725 -> 1.7662  accuracy: 33.21% -> 34.69%     
client [7]  (testset)   loss: 1.8177 -> 1.8148  accuracy: 39.17% -> 38.25%     
client [50] (testset)   loss: 1.3714 -> 1.3557  accuracy: 54.20% -> 54.96%     
client [35] (testset)   loss: 1.1259 -> 1.1088  accuracy: 48.15% -> 53.70%     
client [24] (testset)   loss: 1.6616 -> 1.6568  accuracy: 49.62% -> 49.24%     
client [15] (testset)   loss: 1.4518 -> 1.4393  accuracy: 51.76% -> 51.76%     
client [58] (testset)   loss: 1.6761 -> 1.6711  accuracy: 44.03% -> 44.03%     
---------------------------- TRAINING EPOCH: 160 ----------------------------  
client [48] (testset)   loss: 2.0541 -> 2.0557  accuracy: 30.65% -> 29.03%     
client [76] (testset)   loss: 1.2421 -> 1.2348  accuracy: 60.00% -> 60.00%     
client [67] (testset)   loss: 1.6759 -> 1.6664  accuracy: 39.83% -> 40.26%     
client [37] (testset)   loss: 1.6788 -> 1.6718  accuracy: 42.86% -> 42.86%     
client [58] (testset)   loss: 1.6686 -> 1.6649  accuracy: 44.65% -> 44.65%     
client [64] (testset)   loss: 1.6272 -> 1.6190  accuracy: 38.95% -> 38.42%     
client [77] (testset)   loss: 1.8552 -> 1.8495  accuracy: 31.64% -> 31.07%     
client [55] (testset)   loss: 1.5156 -> 1.5083  accuracy: 49.06% -> 49.06%     
client [12] (testset)   loss: 0.8386 -> 0.8298  accuracy: 79.33% -> 79.33%     
client [89] (testset)   loss: 1.6262 -> 1.6199  accuracy: 42.03% -> 42.03%     
---------------------------- TRAINING EPOCH: 170 ----------------------------  
client [84] (testset)   loss: 1.7163 -> 1.7109  accuracy: 41.45% -> 41.45%     
client [51] (testset)   loss: 1.6443 -> 1.6359  accuracy: 35.71% -> 35.71%     
client [8]  (testset)   loss: 1.5198 -> 1.5087  accuracy: 49.33% -> 48.00%     
client [18] (testset)   loss: 1.5816 -> 1.5733  accuracy: 39.80% -> 39.80%     
client [94] (testset)   loss: 1.6875 -> 1.6810  accuracy: 46.40% -> 45.60%     
client [81] (testset)   loss: 1.6271 -> 1.6238  accuracy: 48.57% -> 46.67%     
client [3]  (testset)   loss: 1.5344 -> 1.5273  accuracy: 50.97% -> 50.97%     
client [11] (testset)   loss: 1.7364 -> 1.7331  accuracy: 34.62% -> 33.85%     
client [95] (testset)   loss: 2.0950 -> 2.0905  accuracy: 28.57% -> 29.46%     
client [67] (testset)   loss: 1.6660 -> 1.6613  accuracy: 40.26% -> 41.13%     
---------------------------- TRAINING EPOCH: 180 ----------------------------  
client [21] (testset)   loss: 1.6940 -> 1.6845  accuracy: 42.25% -> 42.25%     
client [79] (testset)   loss: 1.2945 -> 1.2887  accuracy: 58.47% -> 58.47%     
client [58] (testset)   loss: 1.6564 -> 1.6527  accuracy: 44.03% -> 44.65%     
client [88] (testset)   loss: 1.7100 -> 1.7069  accuracy: 44.81% -> 43.72%     
client [46] (testset)   loss: 1.8137 -> 1.8101  accuracy: 42.36% -> 42.36%     
client [11] (testset)   loss: 1.7337 -> 1.7298  accuracy: 33.85% -> 35.38%     
client [55] (testset)   loss: 1.4872 -> 1.4816  accuracy: 50.00% -> 50.00%     
client [13] (testset)   loss: 1.3152 -> 1.3100  accuracy: 53.31% -> 53.31%     
client [31] (testset)   loss: 1.3965 -> 1.3916  accuracy: 55.71% -> 56.07%     
client [75] (testset)   loss: 1.8102 -> 1.8024  accuracy: 43.75% -> 42.50%     
---------------------------- TRAINING EPOCH: 190 ----------------------------  
client [19] (testset)   loss: 1.5437 -> 1.5363  accuracy: 49.34% -> 49.34%     
client [7]  (testset)   loss: 1.8061 -> 1.8014  accuracy: 39.63% -> 39.63%     
client [57] (testset)   loss: 1.6133 -> 1.6056  accuracy: 37.90% -> 41.94%     
client [13] (testset)   loss: 1.3061 -> 1.3015  accuracy: 53.31% -> 53.31%     
client [43] (testset)   loss: 1.7015 -> 1.6958  accuracy: 40.88% -> 40.88%     
client [91] (testset)   loss: 1.7866 -> 1.7790  accuracy: 40.87% -> 40.38%     
client [10] (testset)   loss: 1.6190 -> 1.6157  accuracy: 44.88% -> 44.88%     
client [64] (testset)   loss: 1.5895 -> 1.5838  accuracy: 41.58% -> 41.58%     
client [82] (testset)   loss: 1.2468 -> 1.2431  accuracy: 57.14% -> 57.14%     
client [22] (testset)   loss: 1.8126 -> 1.8098  accuracy: 38.46% -> 38.46%     
---------------------------- TRAINING EPOCH: 200 ----------------------------  
client [20] (testset)   loss: 1.7861 -> 1.7822  accuracy: 33.77% -> 33.33%     
client [23] (testset)   loss: 1.6346 -> 1.6302  accuracy: 52.71% -> 55.04%     
client [88] (testset)   loss: 1.7080 -> 1.7049  accuracy: 45.36% -> 44.26%     
client [98] (testset)   loss: 1.8323 -> 1.8273  accuracy: 38.82% -> 38.82%     
client [79] (testset)   loss: 1.2833 -> 1.2805  accuracy: 57.63% -> 59.32%     
client [21] (testset)   loss: 1.6832 -> 1.6755  accuracy: 42.25% -> 43.66%     
client [92] (testset)   loss: 1.4979 -> 1.4915  accuracy: 51.20% -> 51.20%     
client [56] (testset)   loss: 2.0237 -> 2.0200  accuracy: 32.00% -> 30.00%     
client [5]  (testset)   loss: 1.5570 -> 1.5547  accuracy: 50.00% -> 48.21%     
client [52] (testset)   loss: 1.3650 -> 1.3579  accuracy: 61.22% -> 61.22%     
---------------------------- TRAINING EPOCH: 210 ----------------------------  
client [67] (testset)   loss: 1.6361 -> 1.6301  accuracy: 42.42% -> 44.16%     
client [54] (testset)   loss: 1.6232 -> 1.6196  accuracy: 36.45% -> 36.45%     
client [14] (testset)   loss: 1.7824 -> 1.7786  accuracy: 37.82% -> 36.97%     
client [99] (testset)   loss: 1.8116 -> 1.8088  accuracy: 34.05% -> 33.51%     
client [36] (testset)   loss: 1.6069 -> 1.6025  accuracy: 49.49% -> 48.48%     
client [30] (testset)   loss: 2.0945 -> 2.0960  accuracy: 28.71% -> 28.71%     
client [38] (testset)   loss: 1.5949 -> 1.5891  accuracy: 50.60% -> 50.60%     
client [15] (testset)   loss: 1.4313 -> 1.4248  accuracy: 51.76% -> 51.76%     
client [6]  (testset)   loss: 1.5314 -> 1.5285  accuracy: 48.80% -> 48.80%     
client [53] (testset)   loss: 1.7858 -> 1.7763  accuracy: 36.84% -> 39.47%     
---------------------------- TRAINING EPOCH: 220 ----------------------------  
client [99] (testset)   loss: 1.8032 -> 1.7998  accuracy: 34.05% -> 34.05%     
client [6]  (testset)   loss: 1.5285 -> 1.5253  accuracy: 49.20% -> 49.20%     
client [83] (testset)   loss: 1.2800 -> 1.2739  accuracy: 64.00% -> 62.00%     
client [42] (testset)   loss: 1.3074 -> 1.3056  accuracy: 54.17% -> 55.21%     
client [34] (testset)   loss: 1.4523 -> 1.4475  accuracy: 40.89% -> 40.89%     
client [15] (testset)   loss: 1.4296 -> 1.4220  accuracy: 51.76% -> 51.76%     
client [47] (testset)   loss: 1.2591 -> 1.2529  accuracy: 54.63% -> 54.63%     
client [55] (testset)   loss: 1.4791 -> 1.4748  accuracy: 50.00% -> 50.00%     
client [51] (testset)   loss: 1.6272 -> 1.6208  accuracy: 35.71% -> 35.71%     
client [95] (testset)   loss: 2.0824 -> 2.0792  accuracy: 28.57% -> 29.46%     
---------------------------- TRAINING EPOCH: 230 ----------------------------  
client [71] (testset)   loss: 1.3280 -> 1.3218  accuracy: 48.42% -> 48.42%     
client [15] (testset)   loss: 1.4269 -> 1.4189  accuracy: 51.76% -> 51.76%     
client [33] (testset)   loss: 1.5219 -> 1.5192  accuracy: 48.24% -> 48.74%     
client [99] (testset)   loss: 1.7973 -> 1.7934  accuracy: 34.05% -> 34.05%     
client [90] (testset)   loss: 1.5573 -> 1.5501  accuracy: 49.07% -> 47.22%     
client [57] (testset)   loss: 1.5756 -> 1.5712  accuracy: 44.35% -> 48.39%     
client [27] (testset)   loss: 1.8187 -> 1.8169  accuracy: 37.33% -> 36.00%     
client [78] (testset)   loss: 1.0941 -> 1.0849  accuracy: 60.15% -> 60.15%     
client [36] (testset)   loss: 1.6005 -> 1.6001  accuracy: 48.48% -> 49.49%     
client [88] (testset)   loss: 1.6999 -> 1.6962  accuracy: 46.45% -> 45.90%     
---------------------------- TRAINING EPOCH: 240 ----------------------------  
client [70] (testset)   loss: 1.5928 -> 1.5881  accuracy: 56.82% -> 56.06%     
client [35] (testset)   loss: 1.0855 -> 1.0849  accuracy: 53.70% -> 53.70%     
client [16] (testset)   loss: 1.5939 -> 1.5917  accuracy: 51.20% -> 48.00%     
client [80] (testset)   loss: 1.9233 -> 1.9228  accuracy: 33.11% -> 33.77%     
client [38] (testset)   loss: 1.5869 -> 1.5802  accuracy: 53.01% -> 53.01%     
client [78] (testset)   loss: 1.0839 -> 1.0775  accuracy: 60.15% -> 60.15%     
client [68] (testset)   loss: 1.5366 -> 1.5333  accuracy: 46.48% -> 46.48%     
client [11] (testset)   loss: 1.7139 -> 1.7101  accuracy: 36.15% -> 36.15%     
client [64] (testset)   loss: 1.5630 -> 1.5587  accuracy: 43.16% -> 42.63%     
client [82] (testset)   loss: 1.2241 -> 1.2205  accuracy: 57.14% -> 57.14%     
---------------------------- TRAINING EPOCH: 250 ----------------------------  
client [30] (testset)   loss: 2.0930 -> 2.0890  accuracy: 28.71% -> 28.71%     
client [27] (testset)   loss: 1.8142 -> 1.8138  accuracy: 37.33% -> 36.00%     
client [74] (testset)   loss: 1.7716 -> 1.7678  accuracy: 34.62% -> 34.62%     
client [45] (testset)   loss: 1.7269 -> 1.7236  accuracy: 38.01% -> 38.01%     
client [6]  (testset)   loss: 1.5222 -> 1.5184  accuracy: 48.80% -> 49.20%     
client [36] (testset)   loss: 1.5989 -> 1.5993  accuracy: 48.48% -> 48.48%     
client [63] (testset)   loss: 1.7905 -> 1.7853  accuracy: 38.66% -> 39.50%     
client [76] (testset)   loss: 1.2120 -> 1.2075  accuracy: 59.39% -> 60.00%     
client [83] (testset)   loss: 1.2689 -> 1.2639  accuracy: 62.00% -> 62.00%     
client [86] (testset)   loss: 1.4816 -> 1.4783  accuracy: 53.85% -> 53.85%     
---------------------------- TRAINING EPOCH: 260 ----------------------------  
client [83] (testset)   loss: 1.2651 -> 1.2607  accuracy: 62.00% -> 62.00%     
client [99] (testset)   loss: 1.7911 -> 1.7883  accuracy: 34.05% -> 34.59%     
client [74] (testset)   loss: 1.7647 -> 1.7624  accuracy: 34.62% -> 34.62%     
client [73] (testset)   loss: 1.7867 -> 1.7811  accuracy: 37.60% -> 37.98%     
client [29] (testset)   loss: 1.6101 -> 1.6091  accuracy: 51.54% -> 51.54%     
client [92] (testset)   loss: 1.4672 -> 1.4638  accuracy: 51.67% -> 51.67%     
client [6]  (testset)   loss: 1.5169 -> 1.5128  accuracy: 50.00% -> 49.60%     
client [61] (testset)   loss: 1.7702 -> 1.7678  accuracy: 47.50% -> 45.83%     
client [21] (testset)   loss: 1.6672 -> 1.6611  accuracy: 46.48% -> 46.48%     
client [67] (testset)   loss: 1.6217 -> 1.6191  accuracy: 45.45% -> 45.45%     
---------------------------- TRAINING EPOCH: 270 ----------------------------  
client [83] (testset)   loss: 1.2619 -> 1.2570  accuracy: 62.00% -> 62.00%     
client [32] (testset)   loss: 1.7143 -> 1.7117  accuracy: 45.74% -> 45.74%     
client [95] (testset)   loss: 2.0763 -> 2.0752  accuracy: 29.46% -> 29.46%     
client [61] (testset)   loss: 1.7637 -> 1.7614  accuracy: 45.83% -> 45.83%     
client [27] (testset)   loss: 1.8145 -> 1.8102  accuracy: 36.00% -> 36.00%     
client [25] (testset)   loss: 1.5346 -> 1.5263  accuracy: 41.67% -> 40.00%     
client [68] (testset)   loss: 1.5267 -> 1.5241  accuracy: 47.89% -> 47.89%     
client [34] (testset)   loss: 1.4431 -> 1.4377  accuracy: 42.22% -> 43.11%     
client [71] (testset)   loss: 1.2946 -> 1.2896  accuracy: 52.11% -> 52.11%     
client [89] (testset)   loss: 1.5970 -> 1.5921  accuracy: 43.48% -> 43.48%     
---------------------------- TRAINING EPOCH: 280 ----------------------------  
client [78] (testset)   loss: 1.0526 -> 1.0475  accuracy: 63.16% -> 63.16%     
client [81] (testset)   loss: 1.5973 -> 1.5944  accuracy: 47.62% -> 48.57%     
client [51] (testset)   loss: 1.6005 -> 1.5950  accuracy: 38.10% -> 38.10%     
client [54] (testset)   loss: 1.6128 -> 1.6094  accuracy: 36.45% -> 36.45%     
client [65] (testset)   loss: 1.7084 -> 1.7033  accuracy: 43.18% -> 43.18%     
client [41] (testset)   loss: 1.3566 -> 1.3525  accuracy: 58.74% -> 56.64%     
client [11] (testset)   loss: 1.7049 -> 1.7023  accuracy: 36.15% -> 36.15%     
client [85] (testset)   loss: 1.8011 -> 1.7992  accuracy: 36.63% -> 37.62%     
client [12] (testset)   loss: 0.7930 -> 0.7901  accuracy: 79.33% -> 79.33%     
client [23] (testset)   loss: 1.5949 -> 1.5921  accuracy: 53.49% -> 54.26%     
---------------------------- TRAINING EPOCH: 290 ----------------------------  
client [16] (testset)   loss: 1.5892 -> 1.5845  accuracy: 48.00% -> 50.40%     
client [65] (testset)   loss: 1.6996 -> 1.6912  accuracy: 43.18% -> 43.18%     
client [53] (testset)   loss: 1.7588 -> 1.7518  accuracy: 38.16% -> 38.16%     
client [58] (testset)   loss: 1.6326 -> 1.6277  accuracy: 45.91% -> 45.91%     
client [72] (testset)   loss: 1.6846 -> 1.6841  accuracy: 38.46% -> 39.23%     
client [7]  (testset)   loss: 1.7901 -> 1.7869  accuracy: 40.09% -> 40.55%     
client [71] (testset)   loss: 1.2903 -> 1.2854  accuracy: 52.11% -> 51.58%     
client [59] (testset)   loss: 1.7596 -> 1.7588  accuracy: 39.49% -> 39.49%     
client [86] (testset)   loss: 1.4702 -> 1.4688  accuracy: 53.85% -> 53.85%     
client [39] (testset)   loss: 1.6949 -> 1.6877  accuracy: 42.24% -> 40.52%     
---------------------------- TRAINING EPOCH: 300 ----------------------------  
client [99] (testset)   loss: 1.7836 -> 1.7815  accuracy: 35.68% -> 36.76%     
client [7]  (testset)   loss: 1.7861 -> 1.7832  accuracy: 40.55% -> 41.01%     
client [17] (testset)   loss: 1.0079 -> 1.0049  accuracy: 69.93% -> 69.93%     
client [64] (testset)   loss: 1.5345 -> 1.5308  accuracy: 44.21% -> 45.26%     
client [37] (testset)   loss: 1.6283 -> 1.6311  accuracy: 45.45% -> 42.86%     
client [29] (testset)   loss: 1.6034 -> 1.5998  accuracy: 51.54% -> 51.54%     
client [93] (testset)   loss: 1.7359 -> 1.7325  accuracy: 41.89% -> 41.13%     
client [73] (testset)   loss: 1.7658 -> 1.7629  accuracy: 38.37% -> 37.98%     
client [40] (testset)   loss: 1.5559 -> 1.5517  accuracy: 46.34% -> 46.34%     
client [76] (testset)   loss: 1.2034 -> 1.1998  accuracy: 59.39% -> 58.79%     
---------------------------- TRAINING EPOCH: 310 ----------------------------  
client [31] (testset)   loss: 1.3673 -> 1.3669  accuracy: 56.43% -> 56.43%     
client [89] (testset)   loss: 1.5850 -> 1.5812  accuracy: 43.48% -> 43.48%     
client [77] (testset)   loss: 1.7955 -> 1.7945  accuracy: 37.29% -> 36.16%     
client [90] (testset)   loss: 1.5193 -> 1.5155  accuracy: 48.15% -> 47.22%     
client [26] (testset)   loss: 1.4167 -> 1.4111  accuracy: 52.81% -> 53.37%     
client [50] (testset)   loss: 1.2935 -> 1.2874  accuracy: 58.78% -> 58.78%     
client [30] (testset)   loss: 2.0863 -> 2.0826  accuracy: 28.71% -> 28.71%     
client [70] (testset)   loss: 1.5766 -> 1.5712  accuracy: 56.06% -> 56.06%     
client [41] (testset)   loss: 1.3465 -> 1.3433  accuracy: 58.74% -> 58.04%     
client [99] (testset)   loss: 1.7817 -> 1.7803  accuracy: 36.76% -> 36.22%     
---------------------------- TRAINING EPOCH: 320 ----------------------------  
client [68] (testset)   loss: 1.5092 -> 1.5072  accuracy: 47.89% -> 46.48%     
client [70] (testset)   loss: 1.5686 -> 1.5642  accuracy: 56.06% -> 59.09%     
client [52] (testset)   loss: 1.3486 -> 1.3429  accuracy: 60.54% -> 60.54%     
client [1]  (testset)   loss: 1.4545 -> 1.4517  accuracy: 45.66% -> 45.66%     
client [2]  (testset)   loss: 1.9169 -> 1.9154  accuracy: 32.69% -> 32.69%     
client [67] (testset)   loss: 1.6008 -> 1.5979  accuracy: 46.32% -> 46.32%     
client [92] (testset)   loss: 1.4186 -> 1.4149  accuracy: 50.72% -> 50.24%     
client [35] (testset)   loss: 1.0596 -> 1.0539  accuracy: 59.26% -> 59.26%     
client [36] (testset)   loss: 1.5900 -> 1.5899  accuracy: 50.51% -> 48.48%     
client [64] (testset)   loss: 1.5286 -> 1.5264  accuracy: 45.26% -> 45.26%     
---------------------------- TRAINING EPOCH: 330 ----------------------------  
client [44] (testset)   loss: 1.4968 -> 1.4945  accuracy: 48.34% -> 48.34%     
client [6]  (testset)   loss: 1.4987 -> 1.4953  accuracy: 49.60% -> 50.00%     
client [12] (testset)   loss: 0.7746 -> 0.7731  accuracy: 79.33% -> 79.33%     
client [55] (testset)   loss: 1.4586 -> 1.4553  accuracy: 50.00% -> 50.00%     
client [29] (testset)   loss: 1.5930 -> 1.5933  accuracy: 51.54% -> 51.54%     
client [9]  (testset)   loss: 1.8248 -> 1.8251  accuracy: 36.52% -> 37.39%     
client [43] (testset)   loss: 1.6524 -> 1.6484  accuracy: 43.07% -> 44.53%     
client [77] (testset)   loss: 1.7947 -> 1.7913  accuracy: 36.16% -> 36.16%     
client [98] (testset)   loss: 1.7934 -> 1.7910  accuracy: 40.13% -> 40.13%     
client [78] (testset)   loss: 1.0421 -> 1.0373  accuracy: 63.91% -> 63.91%     
---------------------------- TRAINING EPOCH: 340 ----------------------------  
client [92] (testset)   loss: 1.4117 -> 1.4076  accuracy: 50.24% -> 50.24%     
client [80] (testset)   loss: 1.9113 -> 1.9062  accuracy: 35.10% -> 35.76%     
client [63] (testset)   loss: 1.7711 -> 1.7708  accuracy: 40.34% -> 39.50%     
client [76] (testset)   loss: 1.1995 -> 1.1955  accuracy: 60.00% -> 58.79%     
client [78] (testset)   loss: 1.0393 -> 1.0332  accuracy: 63.91% -> 63.91%     
client [25] (testset)   loss: 1.5253 -> 1.5188  accuracy: 40.00% -> 40.00%     
client [58] (testset)   loss: 1.6206 -> 1.6192  accuracy: 45.91% -> 45.91%     
client [13] (testset)   loss: 1.2661 -> 1.2637  accuracy: 53.72% -> 54.13%     
client [17] (testset)   loss: 0.9956 -> 0.9918  accuracy: 69.93% -> 69.93%     
client [38] (testset)   loss: 1.5507 -> 1.5490  accuracy: 55.42% -> 55.42%     
---------------------------- TRAINING EPOCH: 350 ----------------------------  
client [72] (testset)   loss: 1.6716 -> 1.6729  accuracy: 40.77% -> 41.54%     
client [82] (testset)   loss: 1.1978 -> 1.1952  accuracy: 57.14% -> 57.14%     
client [86] (testset)   loss: 1.4566 -> 1.4556  accuracy: 53.85% -> 53.85%     
client [51] (testset)   loss: 1.5789 -> 1.5743  accuracy: 39.29% -> 38.10%     
client [96] (testset)   loss: 1.4294 -> 1.4248  accuracy: 58.65% -> 58.65%     
client [42] (testset)   loss: 1.2748 -> 1.2662  accuracy: 56.25% -> 54.17%     
client [55] (testset)   loss: 1.4465 -> 1.4437  accuracy: 50.00% -> 51.89%     
client [13] (testset)   loss: 1.2611 -> 1.2594  accuracy: 54.13% -> 54.13%     
client [1]  (testset)   loss: 1.4482 -> 1.4454  accuracy: 45.66% -> 45.66%     
client [12] (testset)   loss: 0.7739 -> 0.7713  accuracy: 79.33% -> 79.33%     
---------------------------- TRAINING EPOCH: 360 ----------------------------  
client [68] (testset)   loss: 1.5043 -> 1.5027  accuracy: 47.89% -> 46.48%     
client [23] (testset)   loss: 1.5739 -> 1.5726  accuracy: 53.49% -> 53.49%     
client [46] (testset)   loss: 1.7541 -> 1.7509  accuracy: 43.06% -> 44.44%     
client [41] (testset)   loss: 1.3361 -> 1.3338  accuracy: 60.14% -> 57.34%     
client [25] (testset)   loss: 1.5178 -> 1.5116  accuracy: 40.00% -> 40.00%     
client [58] (testset)   loss: 1.6177 -> 1.6158  accuracy: 45.91% -> 45.91%     
client [14] (testset)   loss: 1.7699 -> 1.7716  accuracy: 38.66% -> 36.97%     
client [33] (testset)   loss: 1.5019 -> 1.5002  accuracy: 50.25% -> 50.75%     
client [85] (testset)   loss: 1.7879 -> 1.7912  accuracy: 40.59% -> 37.62%     
client [62] (testset)   loss: 1.4388 -> 1.4344  accuracy: 51.52% -> 52.53%     
---------------------------- TRAINING EPOCH: 370 ----------------------------  
client [98] (testset)   loss: 1.7802 -> 1.7783  accuracy: 39.47% -> 39.47%     
client [63] (testset)   loss: 1.7667 -> 1.7661  accuracy: 39.50% -> 41.18%     
client [70] (testset)   loss: 1.5530 -> 1.5500  accuracy: 59.09% -> 59.09%     
client [65] (testset)   loss: 1.6856 -> 1.6761  accuracy: 40.91% -> 40.91%     
client [14] (testset)   loss: 1.7701 -> 1.7689  accuracy: 39.50% -> 38.66%     
client [73] (testset)   loss: 1.7502 -> 1.7477  accuracy: 38.37% -> 39.92%     
client [34] (testset)   loss: 1.4202 -> 1.4141  accuracy: 40.89% -> 44.00%     
client [99] (testset)   loss: 1.7719 -> 1.7711  accuracy: 37.30% -> 36.76%     
client [69] (testset)   loss: 1.5570 -> 1.5602  accuracy: 47.68% -> 47.68%     
client [46] (testset)   loss: 1.7519 -> 1.7488  accuracy: 44.10% -> 44.79%     
---------------------------- TRAINING EPOCH: 380 ----------------------------  
client [99] (testset)   loss: 1.7693 -> 1.7667  accuracy: 37.30% -> 37.84%     
client [93] (testset)   loss: 1.7256 -> 1.7240  accuracy: 41.13% -> 40.75%     
client [11] (testset)   loss: 1.6850 -> 1.6819  accuracy: 38.46% -> 39.23%     
client [58] (testset)   loss: 1.6115 -> 1.6103  accuracy: 45.91% -> 45.91%     
client [81] (testset)   loss: 1.5767 -> 1.5744  accuracy: 48.57% -> 48.57%     
client [85] (testset)   loss: 1.7905 -> 1.7895  accuracy: 36.63% -> 37.62%     
client [89] (testset)   loss: 1.5691 -> 1.5659  accuracy: 43.48% -> 43.48%     
client [45] (testset)   loss: 1.7016 -> 1.6974  accuracy: 41.33% -> 40.96%     
client [8]  (testset)   loss: 1.4859 -> 1.4897  accuracy: 49.33% -> 49.33%     
client [68] (testset)   loss: 1.4967 -> 1.4951  accuracy: 49.30% -> 49.30%     
---------------------------- TRAINING EPOCH: 390 ----------------------------  
client [67] (testset)   loss: 1.5909 -> 1.5878  accuracy: 47.19% -> 47.19%     
client [72] (testset)   loss: 1.6716 -> 1.6663  accuracy: 41.54% -> 41.54%     
client [1]  (testset)   loss: 1.4415 -> 1.4400  accuracy: 45.66% -> 45.66%     
client [78] (testset)   loss: 1.0233 -> 1.0196  accuracy: 63.91% -> 63.91%     
client [83] (testset)   loss: 1.2244 -> 1.2212  accuracy: 62.00% -> 63.00%     
client [21] (testset)   loss: 1.6343 -> 1.6320  accuracy: 46.48% -> 47.89%     
client [56] (testset)   loss: 1.9789 -> 1.9770  accuracy: 36.00% -> 36.00%     
client [44] (testset)   loss: 1.4817 -> 1.4800  accuracy: 48.68% -> 48.68%     
client [92] (testset)   loss: 1.4017 -> 1.3997  accuracy: 50.72% -> 50.72%     
client [27] (testset)   loss: 1.7847 -> 1.7827  accuracy: 37.33% -> 36.00%     
---------------------------- TRAINING EPOCH: 400 ----------------------------  
client [10] (testset)   loss: 1.5840 -> 1.5838  accuracy: 45.67% -> 45.67%     
client [39] (testset)   loss: 1.6794 -> 1.6783  accuracy: 37.93% -> 40.52%     
client [65] (testset)   loss: 1.6782 -> 1.6769  accuracy: 40.91% -> 43.18%     
client [26] (testset)   loss: 1.3818 -> 1.3784  accuracy: 53.37% -> 53.37%     
client [19] (testset)   loss: 1.4823 -> 1.4769  accuracy: 52.63% -> 51.97%     
client [68] (testset)   loss: 1.4938 -> 1.4925  accuracy: 49.30% -> 49.30%     
client [41] (testset)   loss: 1.3302 -> 1.3266  accuracy: 58.04% -> 60.14%     
client [50] (testset)   loss: 1.2611 -> 1.2600  accuracy: 58.78% -> 59.54%     
client [75] (testset)   loss: 1.7750 -> 1.7724  accuracy: 42.50% -> 42.50%     
client [81] (testset)   loss: 1.5710 -> 1.5708  accuracy: 47.62% -> 49.52%     
Training... ---------------------------------------- 100% 0:16:17
FLUTE's average time taken by each global epoch: 0 min 2.43 sec.               
FLUTE's total running time: 0 h 16 m 17 s.                                     
==================== FLUTE Experiment Results: ====================            
Display format: (before local fine-tuning) -> (after local fine-tuning)        
 So if finetune_epoch = 0, x.xx% -> 0.00% is normal.                           
 Centralized testing ONLY happens after model aggregation, so the stats between
'->' are the same.                                                             
{                                                                              
    "100": {                                                                   
        "all_clients": {                                                       
            "test": {                                                          
                "loss": "1.6478 -> 0.0000",                                    
                "accuracy": "43.87% -> 0.00%"                                  
            }                                                                  
        }                                                                      
    },                                                                         
    "200": {                                                                   
        "all_clients": {                                                       
            "test": {                                                          
                "loss": "1.5967 -> 0.0000",                                    
                "accuracy": "45.71% -> 0.00%"                                  
            }                                                                  
        }                                                                      
    },                                                                         
    "300": {                                                                   
        "all_clients": {                                                       
            "test": {                                                          
                "loss": "1.5682 -> 0.0000",                                    
                "accuracy": "46.78% -> 0.00%"                                  
            }                                                                  
        }                                                                      
    },                                                                         
    "400": {                                                                   
        "all_clients": {                                                       
            "test": {                                                          
                "loss": "1.5492 -> 0.0000",                                    
                "accuracy": "47.56% -> 0.00%"                                  
            }                                                                  
        }                                                                      
    }                                                                          
}                                                                              
==================== FLUTE Max Accuracy ====================                   
all_clients:                                                                   
(test) before fine-tuning: 47.56% at epoch 400                                 
(test) after fine-tuning: 0.00% at epoch 100                                   
[0m