==================== LG-FedAvg ====================                            
Experiment Arguments:                                                          
{
│   'method': 'lgfedavg',
│   'dataset': {
│   │   'name': 'mnist',
│   │   'client_num': 100,
│   │   'test_ratio': 0.25,
│   │   'val_ratio': 0.0,
│   │   'seed': 42,
│   │   'split': 'sample',
│   │   'IID_ratio': 0.0,
│   │   'monitor_window_name_suffix': 'mnist-100clients-0%IID-Dir(0.5)-seed42',
│   │   'alpha': 0.5,
│   │   'min_samples_per_client': 10
│   },
│   'model': {
│   │   'name': 'avgcnn',
│   │   'use_torchvision_pretrained_weights': True,
│   │   'external_model_weights_path': None
│   },
│   'optimizer': {
│   │   'lr': 0.01,
│   │   'dampening': 0,
│   │   'weight_decay': 0,
│   │   'momentum': 0,
│   │   'nesterov': False,
│   │   'name': 'sgd'
│   },
│   'mode': 'serial',
│   'parallel': {
│   │   'ray_cluster_addr': None,
│   │   'num_cpus': None,
│   │   'num_gpus': None,
│   │   'num_workers': 2
│   },
│   'common': {
│   │   'seed': 42,
│   │   'join_ratio': 0.1,
│   │   'global_epoch': 400,
│   │   'local_epoch': 5,
│   │   'batch_size': 32,
│   │   'reset_optimizer_on_global_epoch': True,
│   │   'straggler_ratio': 0,
│   │   'straggler_min_local_epoch': 0,
│   │   'buffers': 'global',
│   │   'client_side_evaluation': True,
│   │   'test': {
│   │   │   'client': {
│   │   │   │   'interval': 100,
│   │   │   │   'finetune_epoch': 0,
│   │   │   │   'train': False,
│   │   │   │   'val': False,
│   │   │   │   'test': True
│   │   │   },
│   │   │   'server': {
│   │   │   │   'interval': -1,
│   │   │   │   'train': False,
│   │   │   │   'val': False,
│   │   │   │   'test': False,
│   │   │   │   'model_in_train_mode': False
│   │   │   }
│   │   },
│   │   'verbose_gap': 10,
│   │   'monitor': None,
│   │   'use_cuda': True,
│   │   'save_log': True,
│   │   'save_model': False,
│   │   'save_learning_curve_plot': False,
│   │   'save_metrics': True,
│   │   'delete_useless_run': True
│   },
│   'lgfedavg': {
│   │   'num_global_layers': 1
│   }
}
---------------------------- TRAINING EPOCH: 10 ----------------------------   
client [77] (testset)   loss: 0.5189 -> 0.4353  accuracy: 87.06% -> 90.59%     
client [81] (testset)   loss: 0.4293 -> 0.3433  accuracy: 87.97% -> 88.80%     
client [21] (testset)   loss: 0.2321 -> 0.1544  accuracy: 91.39% -> 95.69%     
client [68] (testset)   loss: 0.1114 -> 0.1023  accuracy: 96.43% -> 96.88%     
client [93] (testset)   loss: 0.5474 -> 0.3070  accuracy: 79.43% -> 90.78%     
client [31] (testset)   loss: 0.7247 -> 0.3467  accuracy: 78.61% -> 90.37%     
client [20] (testset)   loss: 0.5749 -> 0.2904  accuracy: 85.92% -> 92.96%     
client [59] (testset)   loss: 0.1669 -> 0.1208  accuracy: 95.83% -> 96.88%     
client [48] (testset)   loss: 0.2322 -> 0.1768  accuracy: 91.49% -> 92.91%     
client [34] (testset)   loss: 0.1318 -> 0.1412  accuracy: 96.25% -> 95.88%     
---------------------------- TRAINING EPOCH: 20 ----------------------------   
client [69] (testset)   loss: 0.8033 -> 0.6658  accuracy: 77.14% -> 70.00%     
client [99] (testset)   loss: 0.3140 -> 0.4414  accuracy: 86.39% -> 86.98%     
client [67] (testset)   loss: 0.1784 -> 0.1431  accuracy: 94.29% -> 95.43%     
client [0]  (testset)   loss: 0.2020 -> 0.1909  accuracy: 94.27% -> 94.59%     
client [76] (testset)   loss: 0.5120 -> 0.1653  accuracy: 84.15% -> 93.99%     
client [41] (testset)   loss: 0.2940 -> 0.1711  accuracy: 88.34% -> 94.62%     
client [62] (testset)   loss: 0.2073 -> 0.0494  accuracy: 90.91% -> 97.58%     
client [2]  (testset)   loss: 0.2231 -> 0.1013  accuracy: 94.48% -> 96.10%     
client [14] (testset)   loss: 0.2638 -> 0.2301  accuracy: 90.34% -> 92.61%     
client [46] (testset)   loss: 0.2334 -> 0.2146  accuracy: 94.50% -> 93.58%     
---------------------------- TRAINING EPOCH: 30 ----------------------------   
client [24] (testset)   loss: 0.2199 -> 0.2271  accuracy: 94.21% -> 94.74%     
client [68] (testset)   loss: 0.0750 -> 0.0782  accuracy: 97.77% -> 97.77%     
client [57] (testset)   loss: 0.2796 -> 0.2733  accuracy: 95.74% -> 95.74%     
client [17] (testset)   loss: 0.3623 -> 0.2933  accuracy: 89.52% -> 94.35%     
client [54] (testset)   loss: 0.1844 -> 0.1884  accuracy: 94.69% -> 94.69%     
client [23] (testset)   loss: 0.3186 -> 0.1030  accuracy: 93.04% -> 94.78%     
client [35] (testset)   loss: 0.4911 -> 0.4569  accuracy: 84.87% -> 87.39%     
client [59] (testset)   loss: 0.1026 -> 0.1145  accuracy: 96.88% -> 96.88%     
client [31] (testset)   loss: 0.1679 -> 0.1646  accuracy: 95.19% -> 95.72%     
client [9]  (testset)   loss: 0.3176 -> 0.3427  accuracy: 90.91% -> 90.91%     
---------------------------- TRAINING EPOCH: 40 ----------------------------   
client [64] (testset)   loss: 0.4552 -> 0.3779  accuracy: 88.10% -> 87.30%     
client [33] (testset)   loss: 0.1637 -> 0.1576  accuracy: 93.92% -> 93.37%     
client [16] (testset)   loss: 0.2742 -> 0.2828  accuracy: 90.76% -> 90.76%     
client [44] (testset)   loss: 0.2035 -> 2.4072  accuracy: 92.07% -> 64.87%     
client [8]  (testset)   loss: 0.0669 -> 0.0698  accuracy: 95.59% -> 95.59%     
client [31] (testset)   loss: 0.1436 -> 0.1570  accuracy: 97.33% -> 95.72%     
client [47] (testset)   loss: 0.1506 -> 0.1311  accuracy: 95.27% -> 96.03%     
client [36] (testset)   loss: 0.1684 -> 0.1218  accuracy: 94.98% -> 96.14%     
client [20] (testset)   loss: 0.3757 -> 0.3578  accuracy: 92.96% -> 91.55%     
client [56] (testset)   loss: 0.1454 -> 0.1398  accuracy: 95.38% -> 96.15%     
---------------------------- TRAINING EPOCH: 50 ----------------------------   
client [4]  (testset)   loss: 0.3239 -> 0.3463  accuracy: 94.30% -> 93.67%     
client [60] (testset)   loss: 0.1270 -> 0.1204  accuracy: 98.04% -> 97.39%     
client [28] (testset)   loss: 0.1272 -> 0.1290  accuracy: 95.10% -> 93.63%     
client [25] (testset)   loss: 0.5349 -> 0.6216  accuracy: 90.14% -> 87.32%     
client [58] (testset)   loss: 0.1999 -> 0.2275  accuracy: 93.88% -> 93.88%     
client [44] (testset)   loss: 2.5483 -> 0.1195  accuracy: 64.59% -> 96.60%     
client [39] (testset)   loss: 0.2209 -> 0.2132  accuracy: 92.64% -> 93.25%     
client [29] (testset)   loss: 0.1807 -> 0.1469  accuracy: 94.77% -> 95.35%     
client [3]  (testset)   loss: 0.4114 -> 0.4391  accuracy: 86.87% -> 87.88%     
client [84] (testset)   loss: 0.1790 -> 0.1823  accuracy: 93.27% -> 94.17%     
---------------------------- TRAINING EPOCH: 60 ----------------------------   
client [21] (testset)   loss: 0.1136 -> 0.1241  accuracy: 94.74% -> 94.74%     
client [84] (testset)   loss: 0.1717 -> 0.1900  accuracy: 94.17% -> 93.72%     
client [10] (testset)   loss: 0.0659 -> 0.0482  accuracy: 98.04% -> 98.53%     
client [36] (testset)   loss: 0.1236 -> 0.2136  accuracy: 95.75% -> 94.59%     
client [65] (testset)   loss: 0.1450 -> 0.1503  accuracy: 97.45% -> 96.60%     
client [81] (testset)   loss: 0.1821 -> 0.2026  accuracy: 94.19% -> 93.78%     
client [79] (testset)   loss: 0.2881 -> 0.2895  accuracy: 93.88% -> 94.56%     
client [42] (testset)   loss: 0.2549 -> 0.2649  accuracy: 93.75% -> 93.75%     
client [11] (testset)   loss: 0.1541 -> 0.1379  accuracy: 95.07% -> 95.07%     
client [96] (testset)   loss: 0.1056 -> 0.1159  accuracy: 97.54% -> 97.19%     
---------------------------- TRAINING EPOCH: 70 ----------------------------   
client [8]  (testset)   loss: 0.0649 -> 0.0690  accuracy: 95.59% -> 95.59%     
client [53] (testset)   loss: 0.3377 -> 0.3086  accuracy: 91.87% -> 91.87%     
client [52] (testset)   loss: 0.3440 -> 0.3498  accuracy: 94.81% -> 94.81%     
client [42] (testset)   loss: 0.2708 -> 0.2769  accuracy: 93.75% -> 93.75%     
client [69] (testset)   loss: 0.2718 -> 0.2634  accuracy: 94.29% -> 94.29%     
client [59] (testset)   loss: 0.1312 -> 0.1355  accuracy: 95.83% -> 95.83%     
client [7]  (testset)   loss: 0.0647 -> 0.0702  accuracy: 97.78% -> 97.78%     
client [26] (testset)   loss: 0.2193 -> 0.2101  accuracy: 92.68% -> 93.50%     
client [49] (testset)   loss: 0.1884 -> 0.1788  accuracy: 94.12% -> 94.12%     
client [98] (testset)   loss: 0.2825 -> 0.2822  accuracy: 92.38% -> 92.38%     
---------------------------- TRAINING EPOCH: 80 ----------------------------   
client [98] (testset)   loss: 0.2869 -> 0.2917  accuracy: 92.38% -> 93.33%     
client [47] (testset)   loss: 0.1323 -> 0.1293  accuracy: 95.84% -> 96.22%     
client [21] (testset)   loss: 0.1123 -> 0.1183  accuracy: 95.22% -> 95.22%     
client [77] (testset)   loss: 0.7163 -> 0.7107  accuracy: 89.41% -> 89.41%     
client [95] (testset)   loss: 0.2013 -> 0.2043  accuracy: 93.43% -> 93.90%     
client [91] (testset)   loss: 0.1063 -> 0.1133  accuracy: 98.23% -> 96.46%     
client [14] (testset)   loss: 0.2027 -> 0.2091  accuracy: 94.32% -> 94.32%     
client [99] (testset)   loss: 0.2317 -> 0.2421  accuracy: 90.53% -> 91.72%     
client [20] (testset)   loss: 0.4165 -> 0.4224  accuracy: 91.55% -> 91.55%     
client [39] (testset)   loss: 0.2483 -> 0.2135  accuracy: 92.64% -> 94.48%     
---------------------------- TRAINING EPOCH: 90 ----------------------------   
client [52] (testset)   loss: 0.3627 -> 0.3603  accuracy: 94.81% -> 96.10%     
client [62] (testset)   loss: 0.0616 -> 0.0622  accuracy: 97.58% -> 97.58%     
client [71] (testset)   loss: 0.3242 -> 0.2998  accuracy: 92.31% -> 93.59%     
client [97] (testset)   loss: 0.2496 -> 0.2639  accuracy: 92.13% -> 91.57%     
client [30] (testset)   loss: 0.0781 -> 0.0846  accuracy: 98.71% -> 98.06%     
client [88] (testset)   loss: 0.0371 -> 0.0267  accuracy: 98.99% -> 98.99%     
client [60] (testset)   loss: 0.1561 -> 0.1533  accuracy: 97.39% -> 97.39%     
client [82] (testset)   loss: 0.0588 -> 0.0618  accuracy: 98.23% -> 98.23%     
client [91] (testset)   loss: 0.1107 -> 0.1094  accuracy: 98.23% -> 98.23%     
client [57] (testset)   loss: 0.3175 -> 0.3375  accuracy: 93.62% -> 93.62%     
---------------------------- TRAINING EPOCH: 100 ----------------------------  
client [31] (testset)   loss: 0.1830 -> 0.1798  accuracy: 96.26% -> 96.26%     
client [15] (testset)   loss: 0.2104 -> 0.2146  accuracy: 92.90% -> 93.55%     
client [71] (testset)   loss: 0.3035 -> 0.3524  accuracy: 93.59% -> 92.31%     
client [97] (testset)   loss: 0.2606 -> 0.2636  accuracy: 92.13% -> 92.13%     
client [53] (testset)   loss: 0.3088 -> 0.3432  accuracy: 91.06% -> 92.68%     
client [77] (testset)   loss: 0.7319 -> 0.7673  accuracy: 89.41% -> 89.41%     
client [76] (testset)   loss: 0.1794 -> 0.1791  accuracy: 95.08% -> 95.08%     
client [79] (testset)   loss: 0.3218 -> 0.3237  accuracy: 94.56% -> 93.88%     
client [28] (testset)   loss: 0.1061 -> 0.1215  accuracy: 95.59% -> 96.57%     
client [99] (testset)   loss: 0.2462 -> 0.2476  accuracy: 91.12% -> 91.72%     
---------------------------- TRAINING EPOCH: 110 ----------------------------  
client [97] (testset)   loss: 0.2658 -> 0.2689  accuracy: 92.13% -> 92.13%     
client [86] (testset)   loss: 0.3224 -> 0.3217  accuracy: 93.91% -> 93.91%     
client [34] (testset)   loss: 0.1527 -> 0.1556  accuracy: 96.25% -> 96.25%     
client [73] (testset)   loss: 0.1077 -> 0.1264  accuracy: 96.51% -> 95.35%     
client [5]  (testset)   loss: 0.3000 -> 0.2987  accuracy: 91.18% -> 91.18%     
client [96] (testset)   loss: 0.1026 -> 0.1024  accuracy: 97.89% -> 97.89%     
client [22] (testset)   loss: 0.1360 -> 0.1408  accuracy: 96.30% -> 95.56%     
client [60] (testset)   loss: 0.1645 -> 0.1666  accuracy: 97.39% -> 97.39%     
client [66] (testset)   loss: 0.1530 -> 0.1508  accuracy: 94.14% -> 94.14%     
client [83] (testset)   loss: 0.1864 -> 0.1831  accuracy: 95.80% -> 95.80%     
---------------------------- TRAINING EPOCH: 120 ----------------------------  
client [76] (testset)   loss: 0.1863 -> 0.1869  accuracy: 95.08% -> 95.08%     
client [65] (testset)   loss: 0.1572 -> 0.1534  accuracy: 97.02% -> 97.02%     
client [95] (testset)   loss: 0.2115 -> 0.2152  accuracy: 94.37% -> 93.90%     
client [17] (testset)   loss: 0.3246 -> 0.3359  accuracy: 92.74% -> 91.13%     
client [8]  (testset)   loss: 0.0666 -> 0.0645  accuracy: 95.59% -> 95.59%     
client [35] (testset)   loss: 0.4815 -> 0.4879  accuracy: 90.76% -> 89.08%     
client [98] (testset)   loss: 0.3053 -> 0.3070  accuracy: 93.33% -> 93.33%     
client [53] (testset)   loss: 0.3394 -> 0.3299  accuracy: 91.06% -> 93.50%     
client [43] (testset)   loss: 0.3196 -> 0.3254  accuracy: 92.86% -> 92.86%     
client [64] (testset)   loss: 0.4167 -> 0.4062  accuracy: 88.89% -> 88.89%     
---------------------------- TRAINING EPOCH: 130 ----------------------------  
client [21] (testset)   loss: 0.1133 -> 0.1126  accuracy: 95.69% -> 95.69%     
client [88] (testset)   loss: 0.0311 -> 0.0306  accuracy: 98.99% -> 97.98%     
client [38] (testset)   loss: 0.1493 -> 0.1507  accuracy: 95.81% -> 95.81%     
client [3]  (testset)   loss: 0.5321 -> 0.5240  accuracy: 86.87% -> 86.87%     
client [5]  (testset)   loss: 0.3049 -> 0.3071  accuracy: 91.18% -> 91.76%     
client [41] (testset)   loss: 0.1912 -> 0.1915  accuracy: 93.27% -> 93.27%     
client [7]  (testset)   loss: 0.0763 -> 0.0763  accuracy: 97.78% -> 97.78%     
client [37] (testset)   loss: 0.1762 -> 0.1838  accuracy: 97.52% -> 97.52%     
client [45] (testset)   loss: 0.0970 -> 0.0969  accuracy: 97.89% -> 97.89%     
client [47] (testset)   loss: 0.1401 -> 0.1389  accuracy: 95.65% -> 96.03%     
---------------------------- TRAINING EPOCH: 140 ----------------------------  
client [16] (testset)   loss: 0.3540 -> 0.3570  accuracy: 89.92% -> 89.92%     
client [11] (testset)   loss: 0.1516 -> 0.1530  accuracy: 94.62% -> 95.07%     
client [37] (testset)   loss: 0.1790 -> 0.1880  accuracy: 95.04% -> 97.52%     
client [41] (testset)   loss: 0.1927 -> 0.1946  accuracy: 93.27% -> 93.27%     
client [95] (testset)   loss: 0.2215 -> 0.2213  accuracy: 93.90% -> 94.37%     
client [53] (testset)   loss: 0.3344 -> 0.3521  accuracy: 93.50% -> 92.68%     
client [22] (testset)   loss: 0.1462 -> 0.1408  accuracy: 95.56% -> 96.30%     
client [25] (testset)   loss: 0.6909 -> 0.7007  accuracy: 90.14% -> 90.14%     
client [69] (testset)   loss: 0.3034 -> 0.3039  accuracy: 94.29% -> 94.29%     
client [46] (testset)   loss: 0.2656 -> 0.2687  accuracy: 92.66% -> 92.66%     
---------------------------- TRAINING EPOCH: 150 ----------------------------  
client [47] (testset)   loss: 0.1429 -> 0.1444  accuracy: 95.84% -> 96.03%     
client [69] (testset)   loss: 0.3050 -> 0.3062  accuracy: 94.29% -> 93.57%     
client [82] (testset)   loss: 0.0648 -> 0.0675  accuracy: 98.23% -> 98.23%     
client [45] (testset)   loss: 0.0976 -> 0.1042  accuracy: 97.89% -> 97.18%     
client [7]  (testset)   loss: 0.0771 -> 0.0791  accuracy: 97.78% -> 97.78%     
client [50] (testset)   loss: 0.2612 -> 0.2671  accuracy: 95.51% -> 96.63%     
client [35] (testset)   loss: 0.5033 -> 0.5095  accuracy: 89.92% -> 89.08%     
client [24] (testset)   loss: 0.3410 -> 0.3450  accuracy: 94.74% -> 94.74%     
client [15] (testset)   loss: 0.2099 -> 0.2103  accuracy: 93.55% -> 93.55%     
client [58] (testset)   loss: 0.2937 -> 0.3017  accuracy: 93.37% -> 91.84%     
---------------------------- TRAINING EPOCH: 160 ----------------------------  
client [48] (testset)   loss: 0.1292 -> 0.1285  accuracy: 96.45% -> 96.45%     
client [76] (testset)   loss: 0.1959 -> 0.1998  accuracy: 95.08% -> 95.08%     
client [67] (testset)   loss: 0.1642 -> 0.1636  accuracy: 95.43% -> 96.00%     
client [37] (testset)   loss: 0.1891 -> 0.1952  accuracy: 97.52% -> 96.69%     
client [58] (testset)   loss: 0.2922 -> 0.2991  accuracy: 93.37% -> 92.35%     
client [64] (testset)   loss: 0.4256 -> 0.4289  accuracy: 89.68% -> 90.48%     
client [77] (testset)   loss: 0.8194 -> 0.8400  accuracy: 89.41% -> 89.41%     
client [55] (testset)   loss: 0.1035 -> 0.1042  accuracy: 97.87% -> 97.87%     
client [12] (testset)   loss: 0.2376 -> 0.2338  accuracy: 93.62% -> 93.62%     
client [89] (testset)   loss: 0.2566 -> 0.2392  accuracy: 94.92% -> 94.49%     
---------------------------- TRAINING EPOCH: 170 ----------------------------  
client [84] (testset)   loss: 0.2292 -> 0.2290  accuracy: 94.62% -> 94.62%     
client [51] (testset)   loss: 0.0761 -> 0.0760  accuracy: 97.01% -> 97.01%     
client [8]  (testset)   loss: 0.0654 -> 0.0663  accuracy: 95.59% -> 95.59%     
client [18] (testset)   loss: 0.1889 -> 0.1888  accuracy: 95.59% -> 95.59%     
client [94] (testset)   loss: 0.2574 -> 0.2596  accuracy: 92.07% -> 91.46%     
client [81] (testset)   loss: 0.1913 -> 0.1942  accuracy: 94.19% -> 94.19%     
client [3]  (testset)   loss: 0.5527 -> 0.5518  accuracy: 86.87% -> 86.87%     
client [11] (testset)   loss: 0.1565 -> 0.1584  accuracy: 95.07% -> 95.07%     
client [95] (testset)   loss: 0.2307 -> 0.2305  accuracy: 94.37% -> 94.37%     
client [67] (testset)   loss: 0.1643 -> 0.1678  accuracy: 96.00% -> 95.43%     
---------------------------- TRAINING EPOCH: 180 ----------------------------  
client [21] (testset)   loss: 0.1190 -> 0.1193  accuracy: 96.17% -> 96.17%     
client [79] (testset)   loss: 0.3694 -> 0.3716  accuracy: 93.88% -> 93.88%     
client [58] (testset)   loss: 0.3030 -> 0.3085  accuracy: 92.35% -> 92.35%     
client [88] (testset)   loss: 0.0308 -> 0.0311  accuracy: 97.98% -> 97.98%     
client [46] (testset)   loss: 0.2757 -> 0.2782  accuracy: 92.66% -> 92.66%     
client [11] (testset)   loss: 0.1591 -> 0.1644  accuracy: 95.07% -> 94.62%     
client [55] (testset)   loss: 0.1053 -> 0.1066  accuracy: 97.87% -> 97.87%     
client [13] (testset)   loss: 0.3489 -> 0.3588  accuracy: 93.50% -> 93.50%     
client [31] (testset)   loss: 0.1927 -> 0.1954  accuracy: 96.26% -> 96.26%     
client [75] (testset)   loss: 0.2060 -> 0.2159  accuracy: 92.31% -> 92.31%     
---------------------------- TRAINING EPOCH: 190 ----------------------------  
client [19] (testset)   loss: 0.1293 -> 0.1289  accuracy: 96.55% -> 96.55%     
client [7]  (testset)   loss: 0.0792 -> 0.0785  accuracy: 97.78% -> 97.78%     
client [57] (testset)   loss: 0.3781 -> 0.3824  accuracy: 94.68% -> 94.68%     
client [13] (testset)   loss: 0.3617 -> 0.3605  accuracy: 93.50% -> 93.50%     
client [43] (testset)   loss: 0.3447 -> 0.3473  accuracy: 92.86% -> 92.86%     
client [91] (testset)   loss: 0.1208 -> 0.1185  accuracy: 98.23% -> 98.23%     
client [10] (testset)   loss: 0.0558 -> 0.0561  accuracy: 98.53% -> 98.53%     
client [64] (testset)   loss: 0.4405 -> 0.4443  accuracy: 90.48% -> 90.48%     
client [82] (testset)   loss: 0.0685 -> 0.0695  accuracy: 98.23% -> 98.23%     
client [22] (testset)   loss: 0.1509 -> 0.1535  accuracy: 95.56% -> 95.56%     
---------------------------- TRAINING EPOCH: 200 ----------------------------  
client [20] (testset)   loss: 0.4938 -> 0.4863  accuracy: 91.55% -> 91.55%     
client [23] (testset)   loss: 0.1143 -> 0.1136  accuracy: 95.65% -> 95.65%     
client [88] (testset)   loss: 0.0311 -> 0.0304  accuracy: 97.98% -> 97.98%     
client [98] (testset)   loss: 0.3269 -> 0.3263  accuracy: 93.33% -> 93.33%     
client [79] (testset)   loss: 0.3767 -> 0.3769  accuracy: 93.88% -> 93.88%     
client [21] (testset)   loss: 0.1161 -> 0.1179  accuracy: 95.69% -> 95.69%     
client [92] (testset)   loss: 0.2144 -> 0.2097  accuracy: 94.74% -> 94.74%     
client [56] (testset)   loss: 0.1713 -> 0.1711  accuracy: 97.69% -> 97.69%     
client [5]  (testset)   loss: 0.3242 -> 0.3229  accuracy: 91.76% -> 91.76%     
client [52] (testset)   loss: 0.4171 -> 0.4174  accuracy: 94.81% -> 94.81%     
---------------------------- TRAINING EPOCH: 210 ----------------------------  
client [67] (testset)   loss: 0.1756 -> 0.1759  accuracy: 95.43% -> 95.43%     
client [54] (testset)   loss: 0.2509 -> 0.2512  accuracy: 95.13% -> 95.13%     
client [14] (testset)   loss: 0.2381 -> 0.2442  accuracy: 94.89% -> 94.89%     
client [99] (testset)   loss: 0.2811 -> 0.2818  accuracy: 91.12% -> 91.12%     
client [36] (testset)   loss: 0.1635 -> 0.1659  accuracy: 96.14% -> 95.75%     
client [30] (testset)   loss: 0.0860 -> 0.0865  accuracy: 98.71% -> 98.71%     
client [38] (testset)   loss: 0.1592 -> 0.1585  accuracy: 95.81% -> 95.81%     
client [15] (testset)   loss: 0.2158 -> 0.2140  accuracy: 93.55% -> 93.55%     
client [6]  (testset)   loss: 0.2143 -> 0.2127  accuracy: 94.74% -> 94.74%     
client [53] (testset)   loss: 0.3914 -> 0.3924  accuracy: 91.87% -> 92.68%     
---------------------------- TRAINING EPOCH: 220 ----------------------------  
client [99] (testset)   loss: 0.2857 -> 0.2864  accuracy: 91.12% -> 91.12%     
client [6]  (testset)   loss: 0.2135 -> 0.2109  accuracy: 94.74% -> 94.74%     
client [83] (testset)   loss: 0.2008 -> 0.2076  accuracy: 95.80% -> 95.80%     
client [42] (testset)   loss: 0.3398 -> 0.3417  accuracy: 93.75% -> 93.75%     
client [34] (testset)   loss: 0.1691 -> 0.1690  accuracy: 96.25% -> 96.25%     
client [15] (testset)   loss: 0.2146 -> 0.2143  accuracy: 93.55% -> 93.55%     
client [47] (testset)   loss: 0.1529 -> 0.1528  accuracy: 96.22% -> 96.22%     
client [55] (testset)   loss: 0.1089 -> 0.1073  accuracy: 97.87% -> 97.87%     
client [51] (testset)   loss: 0.0782 -> 0.0788  accuracy: 97.01% -> 97.01%     
client [95] (testset)   loss: 0.2383 -> 0.2394  accuracy: 94.37% -> 94.37%     
---------------------------- TRAINING EPOCH: 230 ----------------------------  
client [71] (testset)   loss: 0.3842 -> 0.3727  accuracy: 92.31% -> 92.31%     
client [15] (testset)   loss: 0.2148 -> 0.2151  accuracy: 94.19% -> 94.19%     
client [33] (testset)   loss: 0.1880 -> 0.1880  accuracy: 94.48% -> 94.48%     
client [99] (testset)   loss: 0.2883 -> 0.2892  accuracy: 91.72% -> 91.72%     
client [90] (testset)   loss: 0.2299 -> 0.2284  accuracy: 95.68% -> 95.68%     
client [57] (testset)   loss: 0.4016 -> 0.4028  accuracy: 94.68% -> 94.68%     
client [27] (testset)   loss: 0.1540 -> 0.1535  accuracy: 96.95% -> 96.95%     
client [78] (testset)   loss: 0.1177 -> 0.1189  accuracy: 96.39% -> 96.39%     
client [36] (testset)   loss: 0.1665 -> 0.1669  accuracy: 96.14% -> 95.75%     
client [88] (testset)   loss: 0.0316 -> 0.0320  accuracy: 97.98% -> 97.98%     
---------------------------- TRAINING EPOCH: 240 ----------------------------  
client [70] (testset)   loss: 0.8177 -> 0.8244  accuracy: 78.38% -> 78.38%     
client [35] (testset)   loss: 0.5410 -> 0.5420  accuracy: 89.92% -> 89.92%     
client [16] (testset)   loss: 0.3935 -> 0.3947  accuracy: 89.92% -> 89.92%     
client [80] (testset)   loss: 0.1337 -> 0.1312  accuracy: 96.15% -> 96.15%     
client [38] (testset)   loss: 0.1626 -> 0.1630  accuracy: 96.34% -> 96.34%     
client [78] (testset)   loss: 0.1188 -> 0.1192  accuracy: 96.39% -> 96.39%     
client [68] (testset)   loss: 0.0950 -> 0.0982  accuracy: 97.77% -> 97.77%     
client [11] (testset)   loss: 0.1663 -> 0.1688  accuracy: 95.07% -> 95.07%     
client [64] (testset)   loss: 0.4594 -> 0.4608  accuracy: 90.48% -> 90.48%     
client [82] (testset)   loss: 0.0714 -> 0.0736  accuracy: 98.23% -> 98.23%     
---------------------------- TRAINING EPOCH: 250 ----------------------------  
client [30] (testset)   loss: 0.0877 -> 0.0879  accuracy: 98.71% -> 98.71%     
client [27] (testset)   loss: 0.1545 -> 0.1583  accuracy: 96.95% -> 96.95%     
client [74] (testset)   loss: 0.1091 -> 0.1066  accuracy: 95.45% -> 95.45%     
client [45] (testset)   loss: 0.1071 -> 0.1068  accuracy: 97.89% -> 97.89%     
client [6]  (testset)   loss: 0.2174 -> 0.2156  accuracy: 94.74% -> 95.39%     
client [36] (testset)   loss: 0.1707 -> 0.1702  accuracy: 96.14% -> 96.14%     
client [63] (testset)   loss: 0.2933 -> 0.2942  accuracy: 93.52% -> 93.52%     
client [76] (testset)   loss: 0.2104 -> 0.2094  accuracy: 95.08% -> 95.08%     
client [83] (testset)   loss: 0.2050 -> 0.2031  accuracy: 95.80% -> 95.80%     
client [86] (testset)   loss: 0.3929 -> 0.3982  accuracy: 93.91% -> 93.91%     
---------------------------- TRAINING EPOCH: 260 ----------------------------  
client [83] (testset)   loss: 0.2035 -> 0.2056  accuracy: 95.80% -> 95.80%     
client [99] (testset)   loss: 0.2926 -> 0.2935  accuracy: 91.12% -> 91.12%     
client [74] (testset)   loss: 0.1064 -> 0.1086  accuracy: 95.45% -> 95.45%     
client [73] (testset)   loss: 0.1090 -> 0.1219  accuracy: 96.51% -> 96.51%     
client [29] (testset)   loss: 0.0916 -> 0.0863  accuracy: 97.09% -> 97.67%     
client [92] (testset)   loss: 0.2226 -> 0.2229  accuracy: 94.74% -> 94.74%     
client [6]  (testset)   loss: 0.2195 -> 0.2138  accuracy: 94.74% -> 94.74%     
client [61] (testset)   loss: 0.1908 -> 0.1922  accuracy: 96.23% -> 96.23%     
client [21] (testset)   loss: 0.1210 -> 0.1201  accuracy: 96.17% -> 96.17%     
client [67] (testset)   loss: 0.1817 -> 0.1804  accuracy: 95.43% -> 95.43%     
---------------------------- TRAINING EPOCH: 270 ----------------------------  
client [83] (testset)   loss: 0.2061 -> 0.2068  accuracy: 95.80% -> 95.80%     
client [32] (testset)   loss: 0.2406 -> 0.2391  accuracy: 92.42% -> 92.42%     
client [95] (testset)   loss: 0.2429 -> 0.2437  accuracy: 94.37% -> 94.37%     
client [61] (testset)   loss: 0.1929 -> 0.1922  accuracy: 96.23% -> 96.23%     
client [27] (testset)   loss: 0.1592 -> 0.1586  accuracy: 96.95% -> 96.95%     
client [25] (testset)   loss: 0.7684 -> 0.7745  accuracy: 91.55% -> 91.55%     
client [68] (testset)   loss: 0.0980 -> 0.0988  accuracy: 97.77% -> 97.77%     
client [34] (testset)   loss: 0.1711 -> 0.1727  accuracy: 96.25% -> 96.25%     
client [71] (testset)   loss: 0.4003 -> 0.3950  accuracy: 92.31% -> 92.31%     
client [89] (testset)   loss: 0.2504 -> 0.2489  accuracy: 94.49% -> 94.49%     
---------------------------- TRAINING EPOCH: 280 ----------------------------  
client [78] (testset)   loss: 0.1223 -> 0.1228  accuracy: 96.39% -> 96.39%     
client [81] (testset)   loss: 0.2040 -> 0.2047  accuracy: 94.61% -> 94.19%     
client [51] (testset)   loss: 0.0813 -> 0.0814  accuracy: 97.01% -> 97.01%     
client [54] (testset)   loss: 0.2607 -> 0.2633  accuracy: 95.13% -> 95.13%     
client [65] (testset)   loss: 0.1737 -> 0.1736  accuracy: 97.87% -> 97.87%     
client [41] (testset)   loss: 0.2196 -> 0.2217  accuracy: 93.27% -> 93.27%     
client [11] (testset)   loss: 0.1699 -> 0.1735  accuracy: 95.07% -> 95.07%     
client [85] (testset)   loss: 0.1144 -> 0.1153  accuracy: 95.88% -> 95.88%     
client [12] (testset)   loss: 0.2505 -> 0.2503  accuracy: 93.62% -> 93.62%     
client [23] (testset)   loss: 0.1181 -> 0.1175  accuracy: 95.65% -> 95.65%     
---------------------------- TRAINING EPOCH: 290 ----------------------------  
client [16] (testset)   loss: 0.4033 -> 0.4043  accuracy: 89.92% -> 89.92%     
client [65] (testset)   loss: 0.1742 -> 0.1757  accuracy: 97.02% -> 97.87%     
client [53] (testset)   loss: 0.4229 -> 0.4269  accuracy: 91.87% -> 91.87%     
client [58] (testset)   loss: 0.3228 -> 0.3269  accuracy: 92.35% -> 92.86%     
client [72] (testset)   loss: 0.0730 -> 0.0726  accuracy: 98.14% -> 98.14%     
client [7]  (testset)   loss: 0.0872 -> 0.0848  accuracy: 97.78% -> 97.78%     
client [71] (testset)   loss: 0.3973 -> 0.4002  accuracy: 92.31% -> 92.31%     
client [59] (testset)   loss: 0.1847 -> 0.1827  accuracy: 95.83% -> 95.83%     
client [86] (testset)   loss: 0.4021 -> 0.4052  accuracy: 93.91% -> 93.91%     
client [39] (testset)   loss: 0.2770 -> 0.2848  accuracy: 92.64% -> 92.64%     
---------------------------- TRAINING EPOCH: 300 ----------------------------  
client [99] (testset)   loss: 0.2984 -> 0.2992  accuracy: 91.72% -> 91.12%     
client [7]  (testset)   loss: 0.0829 -> 0.0812  accuracy: 97.78% -> 97.78%     
client [17] (testset)   loss: 0.4311 -> 0.4339  accuracy: 91.13% -> 91.13%     
client [64] (testset)   loss: 0.4802 -> 0.4822  accuracy: 90.48% -> 90.48%     
client [37] (testset)   loss: 0.2068 -> 0.2092  accuracy: 97.52% -> 96.69%     
client [29] (testset)   loss: 0.0888 -> 0.0863  accuracy: 97.67% -> 97.67%     
client [93] (testset)   loss: 0.2569 -> 0.2581  accuracy: 96.45% -> 96.45%     
client [73] (testset)   loss: 0.1152 -> 0.1206  accuracy: 96.51% -> 96.51%     
client [40] (testset)   loss: 0.1441 -> 0.1454  accuracy: 97.96% -> 97.96%     
client [76] (testset)   loss: 0.2142 -> 0.2146  accuracy: 95.08% -> 95.08%     
---------------------------- TRAINING EPOCH: 310 ----------------------------  
client [31] (testset)   loss: 0.2090 -> 0.2079  accuracy: 96.26% -> 96.26%     
client [89] (testset)   loss: 0.2572 -> 0.2525  accuracy: 94.49% -> 94.49%     
client [77] (testset)   loss: 0.9564 -> 0.9507  accuracy: 89.41% -> 89.41%     
client [90] (testset)   loss: 0.2406 -> 0.2405  accuracy: 95.68% -> 95.68%     
client [26] (testset)   loss: 0.2384 -> 0.2428  accuracy: 94.31% -> 93.50%     
client [50] (testset)   loss: 0.3001 -> 0.3061  accuracy: 94.38% -> 94.38%     
client [30] (testset)   loss: 0.0895 -> 0.0890  accuracy: 98.71% -> 98.71%     
client [70] (testset)   loss: 0.8493 -> 0.8479  accuracy: 78.38% -> 78.38%     
client [41] (testset)   loss: 0.2222 -> 0.2235  accuracy: 93.27% -> 93.27%     
client [99] (testset)   loss: 0.2997 -> 0.3002  accuracy: 91.12% -> 91.12%     
---------------------------- TRAINING EPOCH: 320 ----------------------------  
client [68] (testset)   loss: 0.0999 -> 0.0981  accuracy: 97.77% -> 97.77%     
client [70] (testset)   loss: 0.8549 -> 0.8560  accuracy: 78.38% -> 78.38%     
client [52] (testset)   loss: 0.4463 -> 0.4464  accuracy: 94.81% -> 94.81%     
client [1]  (testset)   loss: 0.4072 -> 0.4074  accuracy: 91.53% -> 91.53%     
client [2]  (testset)   loss: 0.1199 -> 0.1204  accuracy: 97.08% -> 96.75%     
client [67] (testset)   loss: 0.1879 -> 0.1866  accuracy: 94.86% -> 94.86%     
client [92] (testset)   loss: 0.2222 -> 0.2269  accuracy: 94.74% -> 94.74%     
client [35] (testset)   loss: 0.5560 -> 0.5647  accuracy: 89.92% -> 90.76%     
client [36] (testset)   loss: 0.1786 -> 0.1797  accuracy: 96.14% -> 96.14%     
client [64] (testset)   loss: 0.4838 -> 0.4851  accuracy: 90.48% -> 90.48%     
---------------------------- TRAINING EPOCH: 330 ----------------------------  
client [44] (testset)   loss: 0.1140 -> 0.1138  accuracy: 96.60% -> 96.88%     
client [6]  (testset)   loss: 0.2247 -> 0.2216  accuracy: 94.74% -> 94.74%     
client [12] (testset)   loss: 0.2520 -> 0.2511  accuracy: 93.62% -> 93.62%     
client [55] (testset)   loss: 0.1126 -> 0.1126  accuracy: 97.87% -> 97.87%     
client [29] (testset)   loss: 0.0849 -> 0.0874  accuracy: 97.67% -> 97.67%     
client [9]  (testset)   loss: 0.5780 -> 0.5793  accuracy: 90.91% -> 90.91%     
client [43] (testset)   loss: 0.3716 -> 0.3713  accuracy: 93.65% -> 93.65%     
client [77] (testset)   loss: 0.9553 -> 0.9596  accuracy: 89.41% -> 89.41%     
client [98] (testset)   loss: 0.3461 -> 0.3462  accuracy: 93.33% -> 93.33%     
client [78] (testset)   loss: 0.1240 -> 0.1242  accuracy: 96.39% -> 96.39%     
---------------------------- TRAINING EPOCH: 340 ----------------------------  
client [92] (testset)   loss: 0.2270 -> 0.2275  accuracy: 94.74% -> 94.74%     
client [80] (testset)   loss: 0.1360 -> 0.1346  accuracy: 96.15% -> 96.15%     
client [63] (testset)   loss: 0.3098 -> 0.3120  accuracy: 93.52% -> 93.52%     
client [76] (testset)   loss: 0.2165 -> 0.2171  accuracy: 95.08% -> 95.08%     
client [78] (testset)   loss: 0.1244 -> 0.1252  accuracy: 96.39% -> 96.39%     
client [25] (testset)   loss: 0.7979 -> 0.8026  accuracy: 91.55% -> 91.55%     
client [58] (testset)   loss: 0.3307 -> 0.3319  accuracy: 92.35% -> 92.35%     
client [13] (testset)   loss: 0.3953 -> 0.3963  accuracy: 93.50% -> 93.50%     
client [17] (testset)   loss: 0.4453 -> 0.4450  accuracy: 91.13% -> 91.13%     
client [38] (testset)   loss: 0.1725 -> 0.1729  accuracy: 96.34% -> 96.34%     
---------------------------- TRAINING EPOCH: 350 ----------------------------  
client [72] (testset)   loss: 0.0739 -> 0.0736  accuracy: 98.14% -> 98.14%     
client [82] (testset)   loss: 0.0747 -> 0.0764  accuracy: 98.23% -> 98.23%     
client [86] (testset)   loss: 0.4203 -> 0.4209  accuracy: 93.91% -> 93.91%     
client [51] (testset)   loss: 0.0838 -> 0.0839  accuracy: 97.01% -> 97.01%     
client [96] (testset)   loss: 0.1158 -> 0.1159  accuracy: 97.89% -> 97.89%     
client [42] (testset)   loss: 0.3654 -> 0.3645  accuracy: 93.75% -> 93.75%     
client [55] (testset)   loss: 0.1135 -> 0.1141  accuracy: 97.87% -> 97.87%     
client [13] (testset)   loss: 0.3986 -> 0.3999  accuracy: 93.50% -> 93.50%     
client [1]  (testset)   loss: 0.4156 -> 0.4135  accuracy: 91.53% -> 91.53%     
client [12] (testset)   loss: 0.2520 -> 0.2560  accuracy: 93.62% -> 93.62%     
---------------------------- TRAINING EPOCH: 360 ----------------------------  
client [68] (testset)   loss: 0.1004 -> 0.1001  accuracy: 97.77% -> 97.77%     
client [23] (testset)   loss: 0.1219 -> 0.1212  accuracy: 95.65% -> 95.65%     
client [46] (testset)   loss: 0.3069 -> 0.3040  accuracy: 92.66% -> 92.66%     
client [41] (testset)   loss: 0.2280 -> 0.2314  accuracy: 93.27% -> 93.27%     
client [25] (testset)   loss: 0.8089 -> 0.8119  accuracy: 91.55% -> 91.55%     
client [58] (testset)   loss: 0.3325 -> 0.3336  accuracy: 92.86% -> 92.35%     
client [14] (testset)   loss: 0.2659 -> 0.2677  accuracy: 94.32% -> 94.89%     
client [33] (testset)   loss: 0.1966 -> 0.1957  accuracy: 93.92% -> 94.48%     
client [85] (testset)   loss: 0.1177 -> 0.1182  accuracy: 95.88% -> 95.88%     
client [62] (testset)   loss: 0.0686 -> 0.0690  accuracy: 96.97% -> 96.97%     
---------------------------- TRAINING EPOCH: 370 ----------------------------  
client [98] (testset)   loss: 0.3515 -> 0.3518  accuracy: 93.33% -> 93.33%     
client [63] (testset)   loss: 0.3161 -> 0.3152  accuracy: 93.52% -> 93.52%     
client [70] (testset)   loss: 0.8729 -> 0.8739  accuracy: 78.38% -> 78.38%     
client [65] (testset)   loss: 0.1782 -> 0.1797  accuracy: 97.45% -> 97.02%     
client [14] (testset)   loss: 0.2651 -> 0.2677  accuracy: 94.89% -> 94.89%     
client [73] (testset)   loss: 0.1177 -> 0.1231  accuracy: 96.51% -> 96.51%     
client [34] (testset)   loss: 0.1795 -> 0.1784  accuracy: 96.25% -> 96.25%     
client [99] (testset)   loss: 0.3066 -> 0.3065  accuracy: 91.12% -> 91.12%     
client [69] (testset)   loss: 0.3493 -> 0.3496  accuracy: 94.29% -> 94.29%     
client [46] (testset)   loss: 0.3045 -> 0.3039  accuracy: 92.66% -> 92.66%     
---------------------------- TRAINING EPOCH: 380 ----------------------------  
client [99] (testset)   loss: 0.3086 -> 0.3095  accuracy: 91.12% -> 91.72%     
client [93] (testset)   loss: 0.2664 -> 0.2701  accuracy: 96.45% -> 95.74%     
client [11] (testset)   loss: 0.1806 -> 0.1798  accuracy: 95.07% -> 95.07%     
client [58] (testset)   loss: 0.3368 -> 0.3370  accuracy: 92.35% -> 92.35%     
client [81] (testset)   loss: 0.2129 -> 0.2128  accuracy: 94.19% -> 94.61%     
client [85] (testset)   loss: 0.1185 -> 0.1186  accuracy: 95.88% -> 95.88%     
client [89] (testset)   loss: 0.2621 -> 0.2604  accuracy: 94.49% -> 94.49%     
client [45] (testset)   loss: 0.1115 -> 0.1138  accuracy: 97.89% -> 97.89%     
client [8]  (testset)   loss: 0.0694 -> 0.0697  accuracy: 95.59% -> 95.59%     
client [68] (testset)   loss: 0.0992 -> 0.0994  accuracy: 97.77% -> 97.77%     
---------------------------- TRAINING EPOCH: 390 ----------------------------  
client [67] (testset)   loss: 0.1912 -> 0.1920  accuracy: 94.86% -> 94.86%     
client [72] (testset)   loss: 0.0742 -> 0.0745  accuracy: 98.14% -> 98.14%     
client [1]  (testset)   loss: 0.4221 -> 0.4213  accuracy: 91.53% -> 91.53%     
client [78] (testset)   loss: 0.1273 -> 0.1274  accuracy: 96.39% -> 96.39%     
client [83] (testset)   loss: 0.2163 -> 0.2169  accuracy: 95.80% -> 95.80%     
client [21] (testset)   loss: 0.1263 -> 0.1267  accuracy: 96.17% -> 96.65%     
client [56] (testset)   loss: 0.1860 -> 0.1867  accuracy: 97.69% -> 97.69%     
client [44] (testset)   loss: 0.1211 -> 0.1219  accuracy: 96.32% -> 96.32%     
client [92] (testset)   loss: 0.2306 -> 0.2315  accuracy: 94.74% -> 94.74%     
client [27] (testset)   loss: 0.1673 -> 0.1670  accuracy: 96.95% -> 96.95%     
---------------------------- TRAINING EPOCH: 400 ----------------------------  
client [10] (testset)   loss: 0.0629 -> 0.0624  accuracy: 98.53% -> 98.53%     
client [39] (testset)   loss: 0.2906 -> 0.2892  accuracy: 92.64% -> 92.64%     
client [65] (testset)   loss: 0.1803 -> 0.1805  accuracy: 97.45% -> 97.45%     
client [26] (testset)   loss: 0.2537 -> 0.2498  accuracy: 93.50% -> 93.50%     
client [19] (testset)   loss: 0.1414 -> 0.1403  accuracy: 96.55% -> 95.40%     
client [68] (testset)   loss: 0.0999 -> 0.1009  accuracy: 97.77% -> 97.77%     
client [41] (testset)   loss: 0.2322 -> 0.2336  accuracy: 93.27% -> 93.27%     
client [50] (testset)   loss: 0.3179 -> 0.3163  accuracy: 95.51% -> 94.38%     
client [75] (testset)   loss: 0.2317 -> 0.2331  accuracy: 92.31% -> 92.31%     
client [81] (testset)   loss: 0.2141 -> 0.2143  accuracy: 94.61% -> 95.02%     
Training... ---------------------------------------- 100% 0:14:26
LG-FedAvg's average time taken by each global epoch: 0 min 2.15 sec.           
LG-FedAvg's total running time: 0 h 14 m 26 s.                                 
==================== LG-FedAvg Experiment Results: ====================        
Display format: (before local fine-tuning) -> (after local fine-tuning)        
 So if finetune_epoch = 0, x.xx% -> 0.00% is normal.                           
 Centralized testing ONLY happens after model aggregation, so the stats between
'->' are the same.                                                             
{                                                                              
    "100": {                                                                   
        "all_clients": {                                                       
            "test": {                                                          
                "loss": "0.1912 -> 0.0000",                                    
                "accuracy": "95.08% -> 0.00%"                                  
            }                                                                  
        }                                                                      
    },                                                                         
    "200": {                                                                   
        "all_clients": {                                                       
            "test": {                                                          
                "loss": "0.2119 -> 0.0000",                                    
                "accuracy": "95.20% -> 0.00%"                                  
            }                                                                  
        }                                                                      
    },                                                                         
    "300": {                                                                   
        "all_clients": {                                                       
            "test": {                                                          
                "loss": "0.2251 -> 0.0000",                                    
                "accuracy": "95.18% -> 0.00%"                                  
            }                                                                  
        }                                                                      
    },                                                                         
    "400": {                                                                   
        "all_clients": {                                                       
            "test": {                                                          
                "loss": "0.2339 -> 0.0000",                                    
                "accuracy": "95.20% -> 0.00%"                                  
            }                                                                  
        }                                                                      
    }                                                                          
}                                                                              
==================== LG-FedAvg Max Accuracy ====================               
all_clients:                                                                   
(test) before fine-tuning: 95.20% at epoch 200                                 
(test) after fine-tuning: 0.00% at epoch 100                                   
[0m