==================== Local-only ====================                           
Experiment Arguments:                                                          
{
│   'method': 'local',
│   'dataset': {
│   │   'name': 'medmnistA',
│   │   'client_num': 100,
│   │   'test_ratio': 0.25,
│   │   'val_ratio': 0.0,
│   │   'seed': 42,
│   │   'split': 'sample',
│   │   'IID_ratio': 0.0,
│   │   'monitor_window_name_suffix': 'medmnistA-100clients-0%IID-Dir(0.5)-seed42',
│   │   'alpha': 0.5,
│   │   'min_samples_per_client': 10
│   },
│   'model': {
│   │   'name': 'lenet5',
│   │   'use_torchvision_pretrained_weights': True,
│   │   'external_model_weights_path': None
│   },
│   'optimizer': {
│   │   'lr': 0.01,
│   │   'dampening': 0,
│   │   'weight_decay': 0,
│   │   'momentum': 0,
│   │   'nesterov': False,
│   │   'name': 'sgd'
│   },
│   'mode': 'serial',
│   'parallel': {
│   │   'ray_cluster_addr': None,
│   │   'num_cpus': None,
│   │   'num_gpus': None,
│   │   'num_workers': 2
│   },
│   'common': {
│   │   'seed': 42,
│   │   'join_ratio': 0.1,
│   │   'global_epoch': 400,
│   │   'local_epoch': 5,
│   │   'batch_size': 32,
│   │   'reset_optimizer_on_global_epoch': True,
│   │   'straggler_ratio': 0,
│   │   'straggler_min_local_epoch': 0,
│   │   'buffers': 'global',
│   │   'client_side_evaluation': True,
│   │   'test': {
│   │   │   'client': {
│   │   │   │   'interval': 100,
│   │   │   │   'finetune_epoch': 0,
│   │   │   │   'train': False,
│   │   │   │   'val': False,
│   │   │   │   'test': True
│   │   │   },
│   │   │   'server': {
│   │   │   │   'interval': -1,
│   │   │   │   'train': False,
│   │   │   │   'val': False,
│   │   │   │   'test': False,
│   │   │   │   'model_in_train_mode': False
│   │   │   }
│   │   },
│   │   'verbose_gap': 10,
│   │   'monitor': None,
│   │   'use_cuda': True,
│   │   'save_log': True,
│   │   'save_model': False,
│   │   'save_learning_curve_plot': False,
│   │   'save_metrics': True,
│   │   'delete_useless_run': True
│   }
}
---------------------------- TRAINING EPOCH: 10 ----------------------------   
client [77] (testset)   loss: 2.5408 -> 11.8491 accuracy: 26.25% -> 26.25%     
client [81] (testset)   loss: 16.3935 -> 34.8716    accuracy: 11.28% -> 11.28% 
client [21] (testset)   loss: 2.3766 -> 2.2324  accuracy: 25.21% -> 21.01%     
client [68] (testset)   loss: 1.8796 -> 11.1304 accuracy: 41.84% -> 41.84%     
client [93] (testset)   loss: 1.8791 -> 1.1607  accuracy: 70.93% -> 70.93%     
client [31] (testset)   loss: 1.9374 -> 14.9688 accuracy: 58.87% -> 58.87%     
client [20] (testset)   loss: 2.1157 -> 1.7608  accuracy: 34.69% -> 34.69%     
client [59] (testset)   loss: 2.3580 -> 4.9031  accuracy: 3.33% -> 41.52%      
client [48] (testset)   loss: 4.2732 -> 12.7219 accuracy: 17.61% -> 31.45%     
client [34] (testset)   loss: 1.9195 -> 1.9473  accuracy: 40.48% -> 37.50%     
---------------------------- TRAINING EPOCH: 20 ----------------------------   
client [69] (testset)   loss: 3.9011 -> 5.5470  accuracy: 34.13% -> 13.77%     
client [99] (testset)   loss: 2.2430 -> 2.0109  accuracy: 31.58% -> 31.58%     
client [67] (testset)   loss: 1.9992 -> 25.7309 accuracy: 37.43% -> 37.43%     
client [0]  (testset)   loss: 2.1542 -> 7.5767  accuracy: 46.99% -> 46.99%     
client [76] (testset)   loss: 252.0874 -> 36.7092   accuracy: 31.25% -> 31.25% 
client [41] (testset)   loss: 1.5281 -> 2.5376  accuracy: 36.81% -> 39.88%     
client [62] (testset)   loss: 2.3527 -> 27.3565 accuracy: 0.00% -> 55.56%      
client [2]  (testset)   loss: 2.4127 -> 2.2750  accuracy: 11.24% -> 20.22%     
client [14] (testset)   loss: 5.6329 -> 2.1976  accuracy: 41.94% -> 19.35%     
client [46] (testset)   loss: 3.1025 -> 1.9844  accuracy: 23.38% -> 29.87%     
---------------------------- TRAINING EPOCH: 30 ----------------------------   
client [24] (testset)   loss: 1.6470 -> 1.5714  accuracy: 54.00% -> 40.00%     
client [68] (testset)   loss: 18.7563 -> 44.0728    accuracy: 41.84% -> 60.28% 
client [57] (testset)   loss: 15.9533 -> 1.1777 accuracy: 22.97% -> 60.29%     
client [17] (testset)   loss: 1.8490 -> 91.2666 accuracy: 10.85% -> 58.91%     
client [54] (testset)   loss: 5.9661 -> 21.2962 accuracy: 9.96% -> 9.96%       
client [23] (testset)   loss: 2.4472 -> 1.4306  accuracy: 0.00% -> 61.22%      
client [35] (testset)   loss: 13.3142 -> 29.1426    accuracy: 36.16% -> 36.16% 
client [59] (testset)   loss: 2.3790 -> 3.8191  accuracy: 6.97% -> 16.06%      
client [31] (testset)   loss: 2.0296 -> 58.2441 accuracy: 58.87% -> 58.87%     
client [9]  (testset)   loss: 20.5489 -> 24.0056    accuracy: 35.23% -> 11.40% 
---------------------------- TRAINING EPOCH: 40 ----------------------------   
client [64] (testset)   loss: 2.3498 -> 23.2592 accuracy: 23.33% -> 42.50%     
client [33] (testset)   loss: 106.5150 -> 4.3956    accuracy: 27.38% -> 25.00% 
client [16] (testset)   loss: 2.3474 -> 4.2467  accuracy: 35.59% -> 29.66%     
client [44] (testset)   loss: 6.4925 -> 43.4206 accuracy: 57.08% -> 57.08%     
client [8]  (testset)   loss: 26.3620 -> 33.6157    accuracy: 16.05% -> 13.17% 
client [31] (testset)   loss: 191.4492 -> 59.2636   accuracy: 58.87% -> 58.87% 
client [47] (testset)   loss: 2.0134 -> 29.6305 accuracy: 32.16% -> 40.35%     
client [36] (testset)   loss: 1.9097 -> 1.8857  accuracy: 32.58% -> 25.00%     
client [20] (testset)   loss: 2.0182 -> 1.9431  accuracy: 36.73% -> 38.78%     
client [56] (testset)   loss: 5.8605 -> 4.8497  accuracy: 47.30% -> 32.43%     
---------------------------- TRAINING EPOCH: 50 ----------------------------   
client [4]  (testset)   loss: 15.1135 -> 23.4356    accuracy: 23.81% -> 23.81% 
client [60] (testset)   loss: 2.0266 -> 2.1080  accuracy: 53.77% -> 54.72%     
client [28] (testset)   loss: 7.2289 -> 3.4897  accuracy: 15.07% -> 34.25%     
client [25] (testset)   loss: 2.1395 -> 15.3114 accuracy: 34.62% -> 26.92%     
client [58] (testset)   loss: 183.0753 -> 108.8744  accuracy: 12.30% -> 12.30% 
client [44] (testset)   loss: 43.4206 -> 108.1610   accuracy: 57.08% -> 57.08% 
client [39] (testset)   loss: 42.5083 -> 58.4496    accuracy: 25.45% -> 25.45% 
client [29] (testset)   loss: 24.2718 -> 34.2444    accuracy: 21.93% -> 21.93% 
client [3]  (testset)   loss: 17.7388 -> 33.1870    accuracy: 13.29% -> 9.79%  
client [84] (testset)   loss: 4.5629 -> 6.4315  accuracy: 28.77% -> 15.75%     
---------------------------- TRAINING EPOCH: 60 ----------------------------   
client [21] (testset)   loss: 4.5573 -> 62.1726 accuracy: 18.49% -> 18.49%     
client [84] (testset)   loss: 2.2027 -> 18.9509 accuracy: 26.03% -> 29.45%     
client [10] (testset)   loss: 17.9426 -> 29.2415    accuracy: 64.38% -> 17.17% 
client [36] (testset)   loss: 10.0486 -> 9.1874 accuracy: 6.06% -> 13.64%      
client [65] (testset)   loss: 8.9096 -> 2.5991  accuracy: 37.96% -> 34.26%     
client [81] (testset)   loss: 43.1724 -> 164.1844   accuracy: 19.47% -> 27.65% 
client [79] (testset)   loss: 7.0511 -> 1.7899  accuracy: 30.00% -> 50.00%     
client [42] (testset)   loss: 45.0203 -> 108.5738   accuracy: 26.67% -> 26.67% 
client [11] (testset)   loss: 73.7466 -> 14.9815    accuracy: 33.94% -> 33.94% 
client [96] (testset)   loss: 60.8566 -> 14.6409    accuracy: 22.49% -> 58.85% 
---------------------------- TRAINING EPOCH: 70 ----------------------------   
client [8]  (testset)   loss: 151.6875 -> 87.4531   accuracy: 29.22% -> 29.22% 
client [53] (testset)   loss: 26.0531 -> 2.7778 accuracy: 36.92% -> 34.62%     
client [52] (testset)   loss: 14.1875 -> 94.9069    accuracy: 16.22% -> 18.92% 
client [42] (testset)   loss: 97.8598 -> 72.4650    accuracy: 26.67% -> 26.67% 
client [69] (testset)   loss: 133.2172 -> 30.4167   accuracy: 25.15% -> 7.78%  
client [59] (testset)   loss: 39.3708 -> 140.9707   accuracy: 3.33% -> 14.55%  
client [7]  (testset)   loss: 4.3814 -> 3.4320  accuracy: 6.14% -> 65.79%      
client [26] (testset)   loss: 25.3781 -> 18.1919    accuracy: 14.74% -> 14.74% 
client [49] (testset)   loss: 3.9904 -> 5.6781  accuracy: 17.00% -> 25.00%     
client [98] (testset)   loss: 37.9782 -> 8.9676 accuracy: 13.25% -> 18.54%     
---------------------------- TRAINING EPOCH: 80 ----------------------------   
client [98] (testset)   loss: 8.9676 -> 2.1488  accuracy: 18.54% -> 45.03%     
client [47] (testset)   loss: 58.7080 -> 103.4549   accuracy: 15.20% -> 15.20% 
client [21] (testset)   loss: 62.8803 -> 39.1306    accuracy: 18.49% -> 18.49% 
client [77] (testset)   loss: 5.4957 -> 17.7872 accuracy: 32.50% -> 32.50%     
client [95] (testset)   loss: 0.9497 -> 56.4132 accuracy: 77.60% -> 70.40%     
client [91] (testset)   loss: 37.6098 -> 222.4113   accuracy: 11.76% -> 18.63% 
client [14] (testset)   loss: 10.2650 -> 1.8027 accuracy: 41.94% -> 41.94%     
client [99] (testset)   loss: 2.2285 -> 43.5145 accuracy: 49.12% -> 26.32%     
client [20] (testset)   loss: 13.2876 -> 6.4319 accuracy: 8.16% -> 8.16%       
client [39] (testset)   loss: 79.9352 -> 48.5144    accuracy: 25.45% -> 25.45% 
---------------------------- TRAINING EPOCH: 90 ----------------------------   
client [52] (testset)   loss: 94.9069 -> 122.0939   accuracy: 18.92% -> 18.92% 
client [62] (testset)   loss: 13.3401 -> 8.3245 accuracy: 56.00% -> 16.44%     
client [71] (testset)   loss: 2.5249 -> 53.1844 accuracy: 14.77% -> 14.77%     
client [97] (testset)   loss: 49.9543 -> 6.3714 accuracy: 23.03% -> 4.49%      
client [30] (testset)   loss: 150.4882 -> 192.3383  accuracy: 15.11% -> 15.11% 
client [88] (testset)   loss: 9.3823 -> 80.4426 accuracy: 22.33% -> 23.30%     
client [60] (testset)   loss: 3.1708 -> 6.2317  accuracy: 12.26% -> 53.77%     
client [82] (testset)   loss: 11.9530 -> 6.7777 accuracy: 25.64% -> 3.42%      
client [91] (testset)   loss: 99.2316 -> 130.5124   accuracy: 18.63% -> 11.76% 
client [57] (testset)   loss: 4.4573 -> 77.6031 accuracy: 39.71% -> 31.58%     
---------------------------- TRAINING EPOCH: 100 ----------------------------  
client [31] (testset)   loss: 125.5851 -> 4.4611    accuracy: 58.87% -> 58.87% 
client [15] (testset)   loss: 22.1662 -> 18.3781    accuracy: 31.94% -> 31.94% 
client [71] (testset)   loss: 53.1844 -> 39.9140    accuracy: 14.77% -> 45.45% 
client [97] (testset)   loss: 34.8461 -> 53.1500    accuracy: 23.03% -> 47.19% 
client [53] (testset)   loss: 59.1769 -> 102.0468   accuracy: 28.46% -> 28.46% 
client [77] (testset)   loss: 17.7872 -> 3.1853 accuracy: 32.50% -> 50.00%     
client [76] (testset)   loss: 164.4624 -> 61.1886   accuracy: 18.75% -> 9.38%  
client [79] (testset)   loss: 7.3924 -> 11.1362 accuracy: 30.00% -> 30.00%     
client [28] (testset)   loss: 5.6003 -> 1.7552  accuracy: 34.25% -> 46.58%     
client [99] (testset)   loss: 7.7109 -> 42.0077 accuracy: 26.32% -> 26.32%     
---------------------------- TRAINING EPOCH: 110 ----------------------------  
client [97] (testset)   loss: 19.6912 -> 4.2050 accuracy: 23.03% -> 13.48%     
client [86] (testset)   loss: 60.9567 -> 54.1679    accuracy: 25.32% -> 25.32% 
client [34] (testset)   loss: 89.3491 -> 30.1974    accuracy: 17.26% -> 17.26% 
client [73] (testset)   loss: 101.4236 -> 7.4495    accuracy: 24.46% -> 24.46% 
client [5]  (testset)   loss: 2.3959 -> 30.8707 accuracy: 15.38% -> 66.67%     
client [96] (testset)   loss: 55.6584 -> 10.7322    accuracy: 22.49% -> 58.85% 
client [22] (testset)   loss: 6.4024 -> 13.3803 accuracy: 19.66% -> 48.72%     
client [60] (testset)   loss: 4.0757 -> 3.9059  accuracy: 56.60% -> 51.89%     
client [66] (testset)   loss: 21.5507 -> 58.5916    accuracy: 28.00% -> 28.00% 
client [83] (testset)   loss: 27.3462 -> 23.5766    accuracy: 63.04% -> 5.43%  
---------------------------- TRAINING EPOCH: 120 ----------------------------  
client [76] (testset)   loss: 4275.4216 -> 23.0238  accuracy: 31.25% -> 9.38%  
client [65] (testset)   loss: 10.7341 -> 9.0662 accuracy: 37.96% -> 37.96%     
client [95] (testset)   loss: 12.4235 -> 26.0402    accuracy: 70.40% -> 70.40% 
client [17] (testset)   loss: 2.6958 -> 5.9945  accuracy: 7.75% -> 7.75%       
client [8]  (testset)   loss: 18.1784 -> 12.3943    accuracy: 29.22% -> 13.17% 
client [35] (testset)   loss: 80.1983 -> 13.7405    accuracy: 36.16% -> 19.21% 
client [98] (testset)   loss: 41.3015 -> 289.9328   accuracy: 7.28% -> 9.27%   
client [53] (testset)   loss: 70.2091 -> 9.9690 accuracy: 28.46% -> 47.69%     
client [43] (testset)   loss: 49.3760 -> 26.2597    accuracy: 11.01% -> 6.88%  
client [64] (testset)   loss: 54.5203 -> 137.0143   accuracy: 42.50% -> 42.50% 
---------------------------- TRAINING EPOCH: 130 ----------------------------  
client [21] (testset)   loss: 7.3893 -> 61.3549 accuracy: 7.56% -> 18.49%      
client [88] (testset)   loss: 38.2437 -> 25.9755    accuracy: 46.60% -> 23.30% 
client [38] (testset)   loss: 10.2820 -> 24.2039    accuracy: 10.00% -> 73.33% 
client [3]  (testset)   loss: 4.9604 -> 47.8330 accuracy: 18.18% -> 13.29%     
client [5]  (testset)   loss: 4.1897 -> 40.4859 accuracy: 67.52% -> 66.67%     
client [41] (testset)   loss: 60.8527 -> 146.4574   accuracy: 4.91% -> 4.91%   
client [7]  (testset)   loss: 10.6494 -> 1.1965 accuracy: 20.18% -> 63.16%     
client [37] (testset)   loss: 20.9592 -> 43.8655    accuracy: 60.33% -> 60.33% 
client [45] (testset)   loss: 82.0541 -> 14.0649    accuracy: 23.21% -> 26.19% 
client [47] (testset)   loss: 43.7574 -> 81.0185    accuracy: 7.60% -> 15.20%  
---------------------------- TRAINING EPOCH: 140 ----------------------------  
client [16] (testset)   loss: 7.8839 -> 21.9353 accuracy: 18.64% -> 6.78%      
client [11] (testset)   loss: 305.1033 -> 64.4839   accuracy: 15.14% -> 33.94% 
client [37] (testset)   loss: 342.7115 -> 73.9304   accuracy: 8.26% -> 60.33%  
client [41] (testset)   loss: 146.4574 -> 38.9758   accuracy: 4.91% -> 4.29%   
client [95] (testset)   loss: 3.9861 -> 50.3258 accuracy: 70.40% -> 70.40%     
client [53] (testset)   loss: 9.9690 -> 135.3239    accuracy: 47.69% -> 36.92% 
client [22] (testset)   loss: 39.4697 -> 70.3277    accuracy: 48.72% -> 48.72% 
client [25] (testset)   loss: 163.3852 -> 4.0933    accuracy: 26.92% -> 10.26% 
client [69] (testset)   loss: 6.0105 -> 6.2881  accuracy: 34.13% -> 12.57%     
client [46] (testset)   loss: 19.7746 -> 5.6764 accuracy: 25.97% -> 25.97%     
---------------------------- TRAINING EPOCH: 150 ----------------------------  
client [47] (testset)   loss: 124.3400 -> 751.3468  accuracy: 6.43% -> 6.43%   
client [69] (testset)   loss: 108.6443 -> 86.8066   accuracy: 25.15% -> 34.13% 
client [82] (testset)   loss: 26.1799 -> 5.0901 accuracy: 3.42% -> 5.98%       
client [45] (testset)   loss: 5.7579 -> 59.6678 accuracy: 7.74% -> 23.21%      
client [7]  (testset)   loss: 1.1965 -> 18.8834 accuracy: 63.16% -> 61.40%     
client [50] (testset)   loss: 47.0431 -> 26.2341    accuracy: 12.77% -> 8.51%  
client [35] (testset)   loss: 21.9314 -> 74.0361    accuracy: 19.21% -> 36.16% 
client [24] (testset)   loss: 89.6592 -> 43.4893    accuracy: 7.00% -> 33.00%  
client [15] (testset)   loss: 48.7490 -> 36.5539    accuracy: 51.83% -> 36.13% 
client [58] (testset)   loss: 87.5712 -> 354.3674   accuracy: 8.73% -> 6.75%   
---------------------------- TRAINING EPOCH: 160 ----------------------------  
client [48] (testset)   loss: 6.0273 -> 65.0069 accuracy: 29.56% -> 13.21%     
client [76] (testset)   loss: 55.5829 -> 83.0129    accuracy: 31.25% -> 18.75% 
client [67] (testset)   loss: 94.2117 -> 40.2470    accuracy: 29.82% -> 37.43% 
client [37] (testset)   loss: 36.5790 -> 4.2636 accuracy: 60.33% -> 61.98%     
client [58] (testset)   loss: 406.4272 -> 75.0934   accuracy: 2.38% -> 3.97%   
client [64] (testset)   loss: 253.4741 -> 75.0252   accuracy: 42.50% -> 42.50% 
client [77] (testset)   loss: 67.3591 -> 114.1083   accuracy: 32.50% -> 32.50% 
client [55] (testset)   loss: 2.3209 -> 28.6477 accuracy: 28.09% -> 26.97%     
client [12] (testset)   loss: 101.5364 -> 24.3786   accuracy: 23.62% -> 23.62% 
client [89] (testset)   loss: 87.3239 -> 24.5636    accuracy: 3.06% -> 8.16%   
---------------------------- TRAINING EPOCH: 170 ----------------------------  
client [84] (testset)   loss: 29.4468 -> 41.3819    accuracy: 26.71% -> 29.45% 
client [51] (testset)   loss: 48.3730 -> 117.5536   accuracy: 21.62% -> 7.43%  
client [8]  (testset)   loss: 56.7407 -> 64.5584    accuracy: 3.29% -> 29.22%  
client [18] (testset)   loss: 9.5363 -> 53.3135 accuracy: 22.52% -> 36.42%     
client [94] (testset)   loss: 4.7027 -> 9.1302  accuracy: 59.57% -> 55.32%     
client [81] (testset)   loss: 23.5283 -> 15.4585    accuracy: 21.46% -> 14.82% 
client [3]  (testset)   loss: 38.0325 -> 62.1922    accuracy: 9.79% -> 23.78%  
client [11] (testset)   loss: 39.3185 -> 21.7423    accuracy: 33.94% -> 33.94% 
client [95] (testset)   loss: 2.7338 -> 63.7901 accuracy: 9.60% -> 70.40%      
client [67] (testset)   loss: 40.2470 -> 18.4642    accuracy: 37.43% -> 37.43% 
---------------------------- TRAINING EPOCH: 180 ----------------------------  
client [21] (testset)   loss: 20.3991 -> 118.7987   accuracy: 2.52% -> 18.49%  
client [79] (testset)   loss: 37.1262 -> 11.0746    accuracy: 1.67% -> 25.00%  
client [58] (testset)   loss: 41.2116 -> 96.3333    accuracy: 12.30% -> 12.70% 
client [88] (testset)   loss: 16.0698 -> 56.6444    accuracy: 46.60% -> 0.97%  
client [46] (testset)   loss: 34.9430 -> 142.3924   accuracy: 5.19% -> 5.19%   
client [11] (testset)   loss: 21.7423 -> 24.4485    accuracy: 33.94% -> 35.78% 
client [55] (testset)   loss: 386.7017 -> 48.3993   accuracy: 26.97% -> 4.49%  
client [13] (testset)   loss: 46.1245 -> 31.2915    accuracy: 41.67% -> 21.30% 
client [31] (testset)   loss: 8.1055 -> 35.1223 accuracy: 58.87% -> 58.87%     
client [75] (testset)   loss: 1.7917 -> 1.7142  accuracy: 66.50% -> 70.00%     
---------------------------- TRAINING EPOCH: 190 ----------------------------  
client [19] (testset)   loss: 13.5945 -> 96.1972    accuracy: 38.38% -> 38.38% 
client [7]  (testset)   loss: 2.5747 -> 9.7039  accuracy: 59.65% -> 61.40%     
client [57] (testset)   loss: 191.0518 -> 120.5711  accuracy: 0.96% -> 31.58%  
client [13] (testset)   loss: 21.7426 -> 1.8494 accuracy: 43.06% -> 61.57%     
client [43] (testset)   loss: 57.9360 -> 48.2756    accuracy: 46.33% -> 11.01% 
client [91] (testset)   loss: 4.0816 -> 30.0073 accuracy: 43.14% -> 24.51%     
client [10] (testset)   loss: 2.2231 -> 3.3483  accuracy: 57.94% -> 66.52%     
client [64] (testset)   loss: 194.5118 -> 44.2696   accuracy: 42.50% -> 42.50% 
client [82] (testset)   loss: 55.2437 -> 17.0703    accuracy: 12.82% -> 25.64% 
client [22] (testset)   loss: 1.9728 -> 6.5347  accuracy: 36.75% -> 23.08%     
---------------------------- TRAINING EPOCH: 200 ----------------------------  
client [20] (testset)   loss: 4.0086 -> 5.9480  accuracy: 36.73% -> 34.69%     
client [23] (testset)   loss: 1.3517 -> 87.3998 accuracy: 61.22% -> 25.51%     
client [88] (testset)   loss: 56.6444 -> 29.8328    accuracy: 0.97% -> 23.30%  
client [98] (testset)   loss: 156.6459 -> 63.7531   accuracy: 0.66% -> 7.28%   
client [79] (testset)   loss: 4.8696 -> 37.9784 accuracy: 35.00% -> 1.67%      
client [21] (testset)   loss: 61.1230 -> 359.3180   accuracy: 18.49% -> 18.49% 
client [92] (testset)   loss: 43.5473 -> 9.8817 accuracy: 47.44% -> 6.41%      
client [56] (testset)   loss: 24.1954 -> 173.5567   accuracy: 18.92% -> 4.05%  
client [5]  (testset)   loss: 6.9988 -> 2.5896  accuracy: 64.96% -> 24.79%     
client [52] (testset)   loss: 68.0121 -> 135.6253   accuracy: 13.51% -> 13.51% 
---------------------------- TRAINING EPOCH: 210 ----------------------------  
client [67] (testset)   loss: 103.3709 -> 156.0854  accuracy: 37.43% -> 12.28% 
client [54] (testset)   loss: 23.2570 -> 90.4071    accuracy: 33.58% -> 36.16% 
client [14] (testset)   loss: 59.9616 -> 21.4429    accuracy: 41.94% -> 41.94% 
client [99] (testset)   loss: 2.0476 -> 57.4719 accuracy: 33.33% -> 26.32%     
client [36] (testset)   loss: 12.9526 -> 22.2509    accuracy: 28.79% -> 8.33%  
client [30] (testset)   loss: 92.5638 -> 27.3579    accuracy: 15.11% -> 15.11% 
client [38] (testset)   loss: 10.6930 -> 12.3757    accuracy: 73.33% -> 10.00% 
client [15] (testset)   loss: 34.7628 -> 2.9002 accuracy: 36.13% -> 62.30%     
client [6]  (testset)   loss: 37.2050 -> 84.6661    accuracy: 6.25% -> 20.54%  
client [53] (testset)   loss: 39.0796 -> 44.9135    accuracy: 28.46% -> 20.00% 
---------------------------- TRAINING EPOCH: 220 ----------------------------  
client [99] (testset)   loss: 13.5084 -> 16.5156    accuracy: 31.58% -> 26.32% 
client [6]  (testset)   loss: 84.6661 -> 7.9495 accuracy: 20.54% -> 4.46%      
client [83] (testset)   loss: 9.3309 -> 27.2854 accuracy: 5.98% -> 63.04%      
client [42] (testset)   loss: 12.5351 -> 35.6498    accuracy: 26.67% -> 26.67% 
client [34] (testset)   loss: 29.5385 -> 48.9325    accuracy: 1.79% -> 8.33%   
client [15] (testset)   loss: 2.9002 -> 5.5033  accuracy: 62.30% -> 38.74%     
client [47] (testset)   loss: 28.2958 -> 248.7787   accuracy: 53.80% -> 15.20% 
client [55] (testset)   loss: 150.4728 -> 132.5536  accuracy: 26.97% -> 2.81%  
client [51] (testset)   loss: 186.3451 -> 149.3464  accuracy: 7.43% -> 21.62%  
client [95] (testset)   loss: 2.2874 -> 5.9970  accuracy: 77.60% -> 16.80%     
---------------------------- TRAINING EPOCH: 230 ----------------------------  
client [71] (testset)   loss: 2.4177 -> 137.9201    accuracy: 43.18% -> 45.45% 
client [15] (testset)   loss: 5.5033 -> 30.6342 accuracy: 38.74% -> 36.13%     
client [33] (testset)   loss: 3.0586 -> 9.4798  accuracy: 35.71% -> 14.29%     
client [99] (testset)   loss: 48.8470 -> 13.3116    accuracy: 26.32% -> 8.77%  
client [90] (testset)   loss: 209.3997 -> 58.4713   accuracy: 27.78% -> 27.78% 
client [57] (testset)   loss: 46.8069 -> 95.1988    accuracy: 22.97% -> 31.58% 
client [27] (testset)   loss: 113.1245 -> 282.2365  accuracy: 17.37% -> 8.90%  
client [78] (testset)   loss: 38.9349 -> 30.1495    accuracy: 13.96% -> 31.08% 
client [36] (testset)   loss: 7.8240 -> 98.2489 accuracy: 35.61% -> 13.64%     
client [88] (testset)   loss: 25.6446 -> 33.7215    accuracy: 0.97% -> 46.60%  
---------------------------- TRAINING EPOCH: 240 ----------------------------  
client [70] (testset)   loss: 141.3884 -> 26.5637   accuracy: 26.01% -> 19.28% 
client [35] (testset)   loss: 16.8223 -> 33.3220    accuracy: 1.13% -> 36.72%  
client [16] (testset)   loss: 36.1976 -> 107.5931   accuracy: 6.78% -> 18.64%  
client [80] (testset)   loss: 12.5409 -> 24.4691    accuracy: 58.78% -> 54.20% 
client [38] (testset)   loss: 2.5930 -> 9.3771  accuracy: 73.33% -> 8.89%      
client [78] (testset)   loss: 3.6985 -> 48.1172 accuracy: 63.96% -> 33.78%     
client [68] (testset)   loss: 116.1992 -> 59.6307   accuracy: 20.57% -> 7.80%  
client [11] (testset)   loss: 51.2726 -> 24.1429    accuracy: 11.93% -> 11.93% 
client [64] (testset)   loss: 106.9131 -> 126.1464  accuracy: 42.50% -> 8.33%  
client [82] (testset)   loss: 31.4863 -> 49.0014    accuracy: 23.93% -> 11.97% 
---------------------------- TRAINING EPOCH: 250 ----------------------------  
client [30] (testset)   loss: 13.6799 -> 7.5023 accuracy: 5.76% -> 46.04%      
client [27] (testset)   loss: 282.2365 -> 178.3992  accuracy: 8.90% -> 13.14%  
client [74] (testset)   loss: 22.1229 -> 7.7424 accuracy: 63.33% -> 18.33%     
client [45] (testset)   loss: 185.6981 -> 147.4031  accuracy: 23.21% -> 8.93%  
client [6]  (testset)   loss: 68.8520 -> 33.8757    accuracy: 20.54% -> 1.79%  
client [36] (testset)   loss: 49.6905 -> 72.0835    accuracy: 16.67% -> 32.58% 
client [63] (testset)   loss: 30.2049 -> 70.9765    accuracy: 4.92% -> 7.38%   
client [76] (testset)   loss: 86.8811 -> 19.1303    accuracy: 31.25% -> 31.25% 
client [83] (testset)   loss: 14.1542 -> 2.7218 accuracy: 16.30% -> 63.04%     
client [86] (testset)   loss: 10.0413 -> 46.2675    accuracy: 34.18% -> 25.32% 
---------------------------- TRAINING EPOCH: 260 ----------------------------  
client [83] (testset)   loss: 2.7218 -> 0.6385  accuracy: 63.04% -> 83.15%     
client [99] (testset)   loss: 11.2504 -> 58.5451    accuracy: 33.33% -> 26.32% 
client [74] (testset)   loss: 32.5447 -> 64.8155    accuracy: 63.33% -> 10.56% 
client [73] (testset)   loss: 19.5144 -> 26.6935    accuracy: 50.21% -> 24.46% 
client [29] (testset)   loss: 14.6415 -> 17.7673    accuracy: 41.18% -> 26.20% 
client [92] (testset)   loss: 33.2671 -> 19.7742    accuracy: 47.44% -> 5.13%  
client [6]  (testset)   loss: 116.1873 -> 17.5610   accuracy: 20.54% -> 33.04% 
client [61] (testset)   loss: 116.7438 -> 38.4399   accuracy: 10.81% -> 10.81% 
client [21] (testset)   loss: 35.8351 -> 312.0206   accuracy: 25.21% -> 18.49% 
client [67] (testset)   loss: 175.4058 -> 39.8612   accuracy: 12.28% -> 12.28% 
---------------------------- TRAINING EPOCH: 270 ----------------------------  
client [83] (testset)   loss: 0.6385 -> 163.0201    accuracy: 83.15% -> 3.80%  
client [32] (testset)   loss: 108.2185 -> 41.1323   accuracy: 3.57% -> 12.14%  
client [95] (testset)   loss: 24.2950 -> 4.3386 accuracy: 70.40% -> 76.80%     
client [61] (testset)   loss: 315.9391 -> 59.9886   accuracy: 10.81% -> 16.22% 
client [27] (testset)   loss: 178.3992 -> 69.6993   accuracy: 13.14% -> 17.37% 
client [25] (testset)   loss: 27.4014 -> 4.4683 accuracy: 7.69% -> 15.38%      
client [68] (testset)   loss: 34.7659 -> 320.4856   accuracy: 53.90% -> 20.57% 
client [34] (testset)   loss: 41.7535 -> 14.2282    accuracy: 2.98% -> 16.67%  
client [71] (testset)   loss: 3.2756 -> 4.3250  accuracy: 9.09% -> 46.59%      
client [89] (testset)   loss: 55.0223 -> 53.6142    accuracy: 10.20% -> 2.04%  
---------------------------- TRAINING EPOCH: 280 ----------------------------  
client [78] (testset)   loss: 25.7258 -> 126.0595   accuracy: 31.98% -> 9.01%  
client [81] (testset)   loss: 30.3925 -> 134.4400   accuracy: 8.19% -> 10.62%  
client [51] (testset)   loss: 44.6076 -> 123.9428   accuracy: 21.62% -> 21.62% 
client [54] (testset)   loss: 45.0783 -> 9.4593 accuracy: 3.69% -> 3.32%       
client [65] (testset)   loss: 288.5787 -> 230.4602  accuracy: 8.33% -> 2.78%   
client [41] (testset)   loss: 23.3474 -> 18.7890    accuracy: 4.91% -> 35.58%  
client [11] (testset)   loss: 26.2568 -> 80.6158    accuracy: 36.70% -> 33.94% 
client [85] (testset)   loss: 22.0463 -> 14.2557    accuracy: 34.86% -> 18.86% 
client [12] (testset)   loss: 88.1139 -> 49.9358    accuracy: 23.62% -> 23.62% 
client [23] (testset)   loss: 8.9896 -> 210.2979    accuracy: 61.22% -> 25.51% 
---------------------------- TRAINING EPOCH: 290 ----------------------------  
client [16] (testset)   loss: 229.5510 -> 118.8090  accuracy: 15.25% -> 6.78%  
client [65] (testset)   loss: 71.3588 -> 35.4949    accuracy: 10.19% -> 37.96% 
client [53] (testset)   loss: 8.8109 -> 55.2753 accuracy: 8.46% -> 36.92%      
client [58] (testset)   loss: 197.3329 -> 40.5507   accuracy: 12.30% -> 21.03% 
client [72] (testset)   loss: 7.1332 -> 29.2031 accuracy: 48.12% -> 18.75%     
client [7]  (testset)   loss: 0.8122 -> 34.7666 accuracy: 79.82% -> 61.40%     
client [71] (testset)   loss: 4.3250 -> 19.8146 accuracy: 46.59% -> 17.05%     
client [59] (testset)   loss: 21.0586 -> 23.9993    accuracy: 3.64% -> 1.82%   
client [86] (testset)   loss: 8.8173 -> 117.5231    accuracy: 34.18% -> 25.32% 
client [39] (testset)   loss: 61.3828 -> 112.0135   accuracy: 25.45% -> 25.45% 
---------------------------- TRAINING EPOCH: 300 ----------------------------  
client [99] (testset)   loss: 27.7777 -> 44.9625    accuracy: 26.32% -> 26.32% 
client [7]  (testset)   loss: 9.6256 -> 2.9757  accuracy: 25.44% -> 59.65%     
client [17] (testset)   loss: 4.4827 -> 15.6370 accuracy: 13.95% -> 10.85%     
client [64] (testset)   loss: 4.6431 -> 6.5430  accuracy: 45.00% -> 23.33%     
client [37] (testset)   loss: 28.8559 -> 35.1326    accuracy: 60.33% -> 60.33% 
client [29] (testset)   loss: 15.3662 -> 133.9559   accuracy: 31.02% -> 22.99% 
client [93] (testset)   loss: 20.7921 -> 16.2798    accuracy: 16.28% -> 70.93% 
client [73] (testset)   loss: 109.8162 -> 65.7614   accuracy: 24.46% -> 24.46% 
client [40] (testset)   loss: 7.5685 -> 76.0834 accuracy: 20.00% -> 8.00%      
client [76] (testset)   loss: 11.2554 -> 31.8445    accuracy: 10.16% -> 3.12%  
---------------------------- TRAINING EPOCH: 310 ----------------------------  
client [31] (testset)   loss: 5.9179 -> 5.9314  accuracy: 45.39% -> 9.22%      
client [89] (testset)   loss: 36.2653 -> 25.9907    accuracy: 8.16% -> 8.16%   
client [77] (testset)   loss: 5.9189 -> 9.5248  accuracy: 43.75% -> 25.00%     
client [90] (testset)   loss: 11.7784 -> 7.1767 accuracy: 40.28% -> 27.78%     
client [26] (testset)   loss: 18.6604 -> 3.9674 accuracy: 3.85% -> 5.77%       
client [50] (testset)   loss: 89.2739 -> 49.3734    accuracy: 12.23% -> 12.23% 
client [30] (testset)   loss: 35.3919 -> 10.8563    accuracy: 6.47% -> 46.04%  
client [70] (testset)   loss: 43.7317 -> 133.3534   accuracy: 26.01% -> 26.01% 
client [41] (testset)   loss: 42.2863 -> 46.4738    accuracy: 4.91% -> 39.88%  
client [99] (testset)   loss: 44.9625 -> 55.0148    accuracy: 26.32% -> 31.58% 
---------------------------- TRAINING EPOCH: 320 ----------------------------  
client [68] (testset)   loss: 44.7841 -> 36.2532    accuracy: 7.09% -> 12.06%  
client [70] (testset)   loss: 41.3735 -> 37.9409    accuracy: 7.62% -> 19.28%  
client [52] (testset)   loss: 53.5227 -> 24.3422    accuracy: 13.51% -> 29.73% 
client [1]  (testset)   loss: 17.1430 -> 11.3654    accuracy: 28.57% -> 28.57% 
client [2]  (testset)   loss: 188.1132 -> 58.5730   accuracy: 1.12% -> 28.09%  
client [67] (testset)   loss: 594.3002 -> 85.7291   accuracy: 7.02% -> 12.28%  
client [92] (testset)   loss: 20.9033 -> 4.0866 accuracy: 5.13% -> 12.82%      
client [35] (testset)   loss: 5.0783 -> 3.2896  accuracy: 42.37% -> 48.02%     
client [36] (testset)   loss: 7.2085 -> 144.9217    accuracy: 13.64% -> 13.64% 
client [64] (testset)   loss: 120.0003 -> 20.5761   accuracy: 8.33% -> 42.50%  
---------------------------- TRAINING EPOCH: 330 ----------------------------  
client [44] (testset)   loss: 33.9097 -> 21.0728    accuracy: 57.08% -> 12.83% 
client [6]  (testset)   loss: 71.9594 -> 20.1766    accuracy: 6.25% -> 21.43%  
client [12] (testset)   loss: 30.1549 -> 28.9463    accuracy: 11.02% -> 37.80% 
client [55] (testset)   loss: 45.8587 -> 20.7131    accuracy: 61.80% -> 11.24% 
client [29] (testset)   loss: 59.5147 -> 422.4286   accuracy: 20.32% -> 2.67%  
client [9]  (testset)   loss: 599.5414 -> 77.4211   accuracy: 13.47% -> 13.47% 
client [43] (testset)   loss: 8.9637 -> 72.8768 accuracy: 36.24% -> 11.01%     
client [77] (testset)   loss: 9.5248 -> 24.0255 accuracy: 25.00% -> 32.50%     
client [98] (testset)   loss: 30.4722 -> 62.2141    accuracy: 5.96% -> 6.62%   
client [78] (testset)   loss: 8.8827 -> 31.0145 accuracy: 15.77% -> 17.12%     
---------------------------- TRAINING EPOCH: 340 ----------------------------  
client [92] (testset)   loss: 10.0222 -> 11.0167    accuracy: 20.51% -> 47.44% 
client [80] (testset)   loss: 37.1327 -> 8.2959 accuracy: 7.63% -> 28.24%      
client [63] (testset)   loss: 27.4263 -> 30.3717    accuracy: 4.92% -> 11.48%  
client [76] (testset)   loss: 129.1572 -> 248.3733  accuracy: 18.75% -> 31.25% 
client [78] (testset)   loss: 31.0145 -> 26.2817    accuracy: 17.12% -> 31.53% 
client [25] (testset)   loss: 97.2691 -> 143.3047   accuracy: 10.26% -> 26.92% 
client [58] (testset)   loss: 41.8630 -> 8.3196 accuracy: 9.52% -> 17.86%      
client [13] (testset)   loss: 15.5927 -> 53.1809    accuracy: 9.72% -> 15.28%  
client [17] (testset)   loss: 11.0314 -> 157.4253   accuracy: 8.53% -> 58.91%  
client [38] (testset)   loss: 7.6670 -> 4.6024  accuracy: 73.33% -> 14.44%     
---------------------------- TRAINING EPOCH: 350 ----------------------------  
client [72] (testset)   loss: 47.9445 -> 141.3329   accuracy: 5.00% -> 3.12%   
client [82] (testset)   loss: 23.0238 -> 97.3164    accuracy: 28.21% -> 11.97% 
client [86] (testset)   loss: 7.5370 -> 5.7213  accuracy: 12.66% -> 27.85%     
client [51] (testset)   loss: 23.6363 -> 28.0727    accuracy: 14.86% -> 6.76%  
client [96] (testset)   loss: 1.8646 -> 27.0871 accuracy: 39.23% -> 22.49%     
client [42] (testset)   loss: 9.2266 -> 28.4144 accuracy: 4.76% -> 24.76%      
client [55] (testset)   loss: 51.9523 -> 98.0699    accuracy: 61.80% -> 2.81%  
client [13] (testset)   loss: 99.4730 -> 42.8382    accuracy: 9.72% -> 2.31%   
client [1]  (testset)   loss: 5.5917 -> 5.1537  accuracy: 26.53% -> 51.02%     
client [12] (testset)   loss: 28.9463 -> 137.7921   accuracy: 37.80% -> 21.26% 
---------------------------- TRAINING EPOCH: 360 ----------------------------  
client [68] (testset)   loss: 104.9802 -> 14.6912   accuracy: 20.57% -> 46.10% 
client [23] (testset)   loss: 76.8356 -> 40.0988    accuracy: 25.51% -> 9.18%  
client [46] (testset)   loss: 20.7435 -> 30.2704    accuracy: 27.27% -> 36.36% 
client [41] (testset)   loss: 203.4725 -> 3.7887    accuracy: 4.91% -> 40.49%  
client [25] (testset)   loss: 2.0141 -> 42.9474 accuracy: 30.77% -> 2.56%      
client [58] (testset)   loss: 53.4889 -> 21.2256    accuracy: 9.52% -> 31.35%  
client [14] (testset)   loss: 51.1472 -> 99.1189    accuracy: 41.94% -> 41.94% 
client [33] (testset)   loss: 12.3023 -> 34.4612    accuracy: 42.86% -> 27.38% 
client [85] (testset)   loss: 171.7891 -> 113.3817  accuracy: 18.86% -> 30.29% 
client [62] (testset)   loss: 16.3508 -> 115.4940   accuracy: 55.56% -> 15.11% 
---------------------------- TRAINING EPOCH: 370 ----------------------------  
client [98] (testset)   loss: 10.5870 -> 212.5820   accuracy: 14.57% -> 7.28%  
client [63] (testset)   loss: 122.8667 -> 82.5181   accuracy: 4.92% -> 4.92%   
client [70] (testset)   loss: 69.1782 -> 41.0842    accuracy: 7.62% -> 26.01%  
client [65] (testset)   loss: 240.3473 -> 7.4130    accuracy: 7.41% -> 20.37%  
client [14] (testset)   loss: 55.9279 -> 29.9029    accuracy: 41.94% -> 41.94% 
client [73] (testset)   loss: 12.6988 -> 101.4444   accuracy: 26.61% -> 24.46% 
client [34] (testset)   loss: 20.6735 -> 12.2153    accuracy: 30.95% -> 9.52%  
client [99] (testset)   loss: 8.8754 -> 53.4073 accuracy: 54.39% -> 26.32%     
client [69] (testset)   loss: 39.1696 -> 59.6879    accuracy: 25.15% -> 34.13% 
client [46] (testset)   loss: 30.2704 -> 29.7300    accuracy: 36.36% -> 5.19%  
---------------------------- TRAINING EPOCH: 380 ----------------------------  
client [99] (testset)   loss: 53.8048 -> 27.3132    accuracy: 26.32% -> 26.32% 
client [93] (testset)   loss: 20.3145 -> 444.4497   accuracy: 5.81% -> 13.95%  
client [11] (testset)   loss: 24.3585 -> 12.8349    accuracy: 15.14% -> 1.38%  
client [58] (testset)   loss: 22.3393 -> 16.1814    accuracy: 2.38% -> 54.37%  
client [81] (testset)   loss: 60.5247 -> 12.0274    accuracy: 10.62% -> 42.48% 
client [85] (testset)   loss: 113.3817 -> 3.5258    accuracy: 30.29% -> 51.43% 
client [89] (testset)   loss: 9.4496 -> 13.9695 accuracy: 6.12% -> 10.20%      
client [45] (testset)   loss: 73.1566 -> 196.1694   accuracy: 26.19% -> 23.21% 
client [8]  (testset)   loss: 7.1772 -> 132.1371    accuracy: 29.22% -> 29.22% 
client [68] (testset)   loss: 11.5550 -> 4.0509 accuracy: 12.77% -> 51.77%     
---------------------------- TRAINING EPOCH: 390 ----------------------------  
client [67] (testset)   loss: 43.9601 -> 28.4640    accuracy: 8.77% -> 15.79%  
client [72] (testset)   loss: 8.5944 -> 5.2973  accuracy: 27.50% -> 33.12%     
client [1]  (testset)   loss: 61.0340 -> 90.2659    accuracy: 24.49% -> 28.57% 
client [78] (testset)   loss: 4.5279 -> 16.1088 accuracy: 63.06% -> 9.01%      
client [83] (testset)   loss: 29.9543 -> 181.1959   accuracy: 3.80% -> 5.43%   
client [21] (testset)   loss: 72.3112 -> 51.1780    accuracy: 18.49% -> 7.56%  
client [56] (testset)   loss: 15.9298 -> 52.1797    accuracy: 4.05% -> 4.73%   
client [44] (testset)   loss: 11.7534 -> 23.6742    accuracy: 15.93% -> 20.35% 
client [92] (testset)   loss: 48.3434 -> 25.1618    accuracy: 7.69% -> 3.85%   
client [27] (testset)   loss: 58.7983 -> 216.1166   accuracy: 8.90% -> 8.90%   
---------------------------- TRAINING EPOCH: 400 ----------------------------  
client [10] (testset)   loss: 2.7997 -> 2.1948  accuracy: 76.39% -> 42.06%     
client [39] (testset)   loss: 262.3507 -> 20.7187   accuracy: 1.82% -> 26.36%  
client [65] (testset)   loss: 65.6925 -> 302.9950   accuracy: 37.96% -> 10.19% 
client [26] (testset)   loss: 3.0634 -> 3.1931  accuracy: 46.15% -> 77.56%     
client [19] (testset)   loss: 49.6861 -> 6.8817 accuracy: 38.38% -> 11.11%     
client [68] (testset)   loss: 186.6228 -> 40.0248   accuracy: 6.38% -> 43.26%  
client [41] (testset)   loss: 27.0769 -> 37.2583    accuracy: 4.29% -> 6.13%   
client [50] (testset)   loss: 22.7510 -> 488.1898   accuracy: 12.23% -> 12.77% 
client [75] (testset)   loss: 0.4974 -> 0.7938  accuracy: 87.50% -> 83.50%     
client [81] (testset)   loss: 155.4296 -> 7.1145    accuracy: 10.62% -> 12.83% 
Training... ---------------------------------------- 100% 0:15:59
Local-only's average time taken by each global epoch: 0 min 2.38 sec.          
Local-only's total running time: 0 h 15 m 59 s.                                
==================== Local-only Experiment Results: ====================       
Display format: (before local fine-tuning) -> (after local fine-tuning)        
 So if finetune_epoch = 0, x.xx% -> 0.00% is normal.                           
 Centralized testing ONLY happens after model aggregation, so the stats between
'->' are the same.                                                             
{                                                                              
    "100": {                                                                   
        "all_clients": {                                                       
            "test": {                                                          
                "loss": "66.3652 -> 0.0000",                                   
                "accuracy": "26.67% -> 0.00%"                                  
            }                                                                  
        }                                                                      
    },                                                                         
    "200": {                                                                   
        "all_clients": {                                                       
            "test": {                                                          
                "loss": "69.6332 -> 0.0000",                                   
                "accuracy": "27.10% -> 0.00%"                                  
            }                                                                  
        }                                                                      
    },                                                                         
    "300": {                                                                   
        "all_clients": {                                                       
            "test": {                                                          
                "loss": "76.2766 -> 0.0000",                                   
                "accuracy": "23.44% -> 0.00%"                                  
            }                                                                  
        }                                                                      
    },                                                                         
    "400": {                                                                   
        "all_clients": {                                                       
            "test": {                                                          
                "loss": "59.5626 -> 0.0000",                                   
                "accuracy": "26.14% -> 0.00%"                                  
            }                                                                  
        }                                                                      
    }                                                                          
}                                                                              
==================== Local-only Max Accuracy ====================              
all_clients:                                                                   
(test) before fine-tuning: 27.10% at epoch 200                                 
(test) after fine-tuning: 0.00% at epoch 100                                   
[0m