==================== Local-only ====================                           
Experiment Arguments:                                                          
{
│   'method': 'local',
│   'dataset': {
│   │   'name': 'emnist',
│   │   'client_num': 100,
│   │   'test_ratio': 0.25,
│   │   'val_ratio': 0.0,
│   │   'seed': 42,
│   │   'split': 'sample',
│   │   'IID_ratio': 0.0,
│   │   'monitor_window_name_suffix': 'emnist-100clients-0%IID-Dir(0.5)-seed42',
│   │   'emnist_split': 'byclass',
│   │   'alpha': 0.5,
│   │   'min_samples_per_client': 10
│   },
│   'model': {
│   │   'name': 'avgcnn',
│   │   'use_torchvision_pretrained_weights': True,
│   │   'external_model_weights_path': None
│   },
│   'optimizer': {
│   │   'lr': 0.01,
│   │   'dampening': 0,
│   │   'weight_decay': 0,
│   │   'momentum': 0,
│   │   'nesterov': False,
│   │   'name': 'sgd'
│   },
│   'mode': 'serial',
│   'parallel': {
│   │   'ray_cluster_addr': None,
│   │   'num_cpus': None,
│   │   'num_gpus': None,
│   │   'num_workers': 2
│   },
│   'common': {
│   │   'seed': 42,
│   │   'join_ratio': 0.1,
│   │   'global_epoch': 400,
│   │   'local_epoch': 5,
│   │   'batch_size': 32,
│   │   'reset_optimizer_on_global_epoch': True,
│   │   'straggler_ratio': 0,
│   │   'straggler_min_local_epoch': 0,
│   │   'buffers': 'global',
│   │   'client_side_evaluation': True,
│   │   'test': {
│   │   │   'client': {
│   │   │   │   'interval': 100,
│   │   │   │   'finetune_epoch': 0,
│   │   │   │   'train': False,
│   │   │   │   'val': False,
│   │   │   │   'test': True
│   │   │   },
│   │   │   'server': {
│   │   │   │   'interval': -1,
│   │   │   │   'train': False,
│   │   │   │   'val': False,
│   │   │   │   'test': False,
│   │   │   │   'model_in_train_mode': False
│   │   │   }
│   │   },
│   │   'verbose_gap': 10,
│   │   'monitor': None,
│   │   'use_cuda': True,
│   │   'save_log': True,
│   │   'save_model': False,
│   │   'save_learning_curve_plot': False,
│   │   'save_metrics': True,
│   │   'delete_useless_run': True
│   }
}
---------------------------- TRAINING EPOCH: 10 ----------------------------   
client [77] (testset)   loss: 0.7062 -> 0.6881  accuracy: 76.70% -> 77.95%     
client [81] (testset)   loss: 0.6302 -> 1.6405  accuracy: 80.86% -> 69.29%     
client [21] (testset)   loss: 4.1336 -> 0.7760  accuracy: 0.15% -> 77.06%      
client [68] (testset)   loss: 0.5518 -> 0.4124  accuracy: 82.64% -> 86.45%     
client [93] (testset)   loss: 0.7388 -> 0.6507  accuracy: 81.91% -> 82.96%     
client [31] (testset)   loss: 0.8123 -> 0.5552  accuracy: 75.74% -> 82.23%     
client [20] (testset)   loss: 0.6197 -> 0.5624  accuracy: 82.90% -> 85.02%     
client [59] (testset)   loss: 4.1158 -> 0.8816  accuracy: 0.11% -> 71.95%      
client [48] (testset)   loss: 0.5518 -> 0.5239  accuracy: 82.87% -> 83.62%     
client [34] (testset)   loss: 1.7156 -> 0.6167  accuracy: 61.46% -> 83.94%     
---------------------------- TRAINING EPOCH: 20 ----------------------------   
client [69] (testset)   loss: 0.4998 -> 2.0183  accuracy: 86.60% -> 65.11%     
client [99] (testset)   loss: 1.8850 -> 5.2592  accuracy: 48.08% -> 28.17%     
client [67] (testset)   loss: 0.7456 -> 0.5464  accuracy: 78.09% -> 82.97%     
client [0]  (testset)   loss: 0.4148 -> 0.4163  accuracy: 88.43% -> 89.07%     
client [76] (testset)   loss: 0.7823 -> 0.7031  accuracy: 76.71% -> 79.13%     
client [41] (testset)   loss: 1.2929 -> 0.9845  accuracy: 61.85% -> 71.82%     
client [62] (testset)   loss: 4.1210 -> 1.0820  accuracy: 0.23% -> 72.30%      
client [2]  (testset)   loss: 4.1064 -> 0.6023  accuracy: 1.61% -> 83.29%      
client [14] (testset)   loss: 0.4757 -> 0.4753  accuracy: 87.64% -> 87.54%     
client [46] (testset)   loss: 0.5055 -> 0.5121  accuracy: 86.45% -> 86.66%     
---------------------------- TRAINING EPOCH: 30 ----------------------------   
client [24] (testset)   loss: 0.4589 -> 0.4503  accuracy: 87.54% -> 88.38%     
client [68] (testset)   loss: 0.4112 -> 0.5177  accuracy: 87.85% -> 84.36%     
client [57] (testset)   loss: 0.6784 -> 0.7744  accuracy: 80.25% -> 71.51%     
client [17] (testset)   loss: 0.4460 -> 0.3733  accuracy: 86.92% -> 89.61%     
client [54] (testset)   loss: 1.0176 -> 0.5597  accuracy: 76.63% -> 85.02%     
client [23] (testset)   loss: 4.1140 -> 0.8997  accuracy: 0.23% -> 72.44%      
client [35] (testset)   loss: 0.7221 -> 0.7095  accuracy: 79.02% -> 81.17%     
client [59] (testset)   loss: 0.6634 -> 0.6616  accuracy: 78.51% -> 80.12%     
client [31] (testset)   loss: 0.5069 -> 0.5662  accuracy: 85.81% -> 84.25%     
client [9]  (testset)   loss: 0.9621 -> 0.9957  accuracy: 71.90% -> 71.56%     
---------------------------- TRAINING EPOCH: 40 ----------------------------   
client [64] (testset)   loss: 0.6669 -> 0.6330  accuracy: 78.97% -> 80.85%     
client [33] (testset)   loss: 0.6419 -> 0.7145  accuracy: 81.98% -> 79.82%     
client [16] (testset)   loss: 0.4912 -> 0.5454  accuracy: 86.46% -> 85.42%     
client [44] (testset)   loss: 1.2054 -> 0.8164  accuracy: 62.88% -> 73.70%     
client [8]  (testset)   loss: 0.6209 -> 0.6278  accuracy: 85.92% -> 86.07%     
client [31] (testset)   loss: 0.7280 -> 0.5752  accuracy: 81.93% -> 85.46%     
client [47] (testset)   loss: 0.7156 -> 0.6504  accuracy: 77.78% -> 78.28%     
client [36] (testset)   loss: 0.8405 -> 0.6232  accuracy: 76.06% -> 81.15%     
client [20] (testset)   loss: 0.6376 -> 0.6816  accuracy: 85.20% -> 85.20%     
client [56] (testset)   loss: 0.7698 -> 0.7471  accuracy: 78.39% -> 79.45%     
---------------------------- TRAINING EPOCH: 50 ----------------------------   
client [4]  (testset)   loss: 0.4835 -> 0.5449  accuracy: 85.35% -> 83.36%     
client [60] (testset)   loss: 0.4731 -> 0.4624  accuracy: 87.65% -> 88.50%     
client [28] (testset)   loss: 0.6130 -> 0.6434  accuracy: 84.97% -> 82.01%     
client [25] (testset)   loss: 0.2792 -> 0.3110  accuracy: 93.22% -> 93.00%     
client [58] (testset)   loss: 0.4372 -> 0.4677  accuracy: 88.59% -> 87.28%     
client [44] (testset)   loss: 0.8164 -> 0.7679  accuracy: 73.70% -> 75.14%     
client [39] (testset)   loss: 0.6920 -> 0.6410  accuracy: 78.02% -> 80.68%     
client [29] (testset)   loss: 0.9934 -> 1.0412  accuracy: 71.59% -> 73.44%     
client [3]  (testset)   loss: 0.5498 -> 0.4614  accuracy: 86.46% -> 88.69%     
client [84] (testset)   loss: 0.4757 -> 0.5356  accuracy: 88.13% -> 88.17%     
---------------------------- TRAINING EPOCH: 60 ----------------------------   
client [21] (testset)   loss: 0.4099 -> 0.4057  accuracy: 88.70% -> 89.00%     
client [84] (testset)   loss: 0.5680 -> 0.5972  accuracy: 87.46% -> 87.84%     
client [10] (testset)   loss: 0.6756 -> 0.6116  accuracy: 80.57% -> 84.88%     
client [36] (testset)   loss: 0.5853 -> 0.5835  accuracy: 82.34% -> 83.24%     
client [65] (testset)   loss: 0.6910 -> 0.6956  accuracy: 81.24% -> 82.66%     
client [81] (testset)   loss: 0.6170 -> 0.8091  accuracy: 82.86% -> 81.64%     
client [79] (testset)   loss: 0.4913 -> 0.4409  accuracy: 84.79% -> 88.28%     
client [42] (testset)   loss: 0.4609 -> 0.4783  accuracy: 88.93% -> 88.49%     
client [11] (testset)   loss: 0.4758 -> 0.4638  accuracy: 88.50% -> 89.98%     
client [96] (testset)   loss: 0.5983 -> 0.6561  accuracy: 86.44% -> 84.37%     
---------------------------- TRAINING EPOCH: 70 ----------------------------   
client [8]  (testset)   loss: 0.6492 -> 0.6629  accuracy: 85.99% -> 86.52%     
client [53] (testset)   loss: 0.5829 -> 0.7406  accuracy: 82.21% -> 79.37%     
client [52] (testset)   loss: 0.7141 -> 0.7334  accuracy: 81.74% -> 82.15%     
client [42] (testset)   loss: 0.5030 -> 0.5105  accuracy: 89.24% -> 88.84%     
client [69] (testset)   loss: 0.5820 -> 0.6277  accuracy: 88.06% -> 88.70%     
client [59] (testset)   loss: 0.7243 -> 0.7554  accuracy: 79.96% -> 77.32%     
client [7]  (testset)   loss: 0.5279 -> 0.5513  accuracy: 84.27% -> 85.05%     
client [26] (testset)   loss: 0.8987 -> 0.8880  accuracy: 82.96% -> 83.11%     
client [49] (testset)   loss: 0.3994 -> 0.4100  accuracy: 89.60% -> 90.15%     
client [98] (testset)   loss: 0.5064 -> 0.5590  accuracy: 88.97% -> 87.45%     
---------------------------- TRAINING EPOCH: 80 ----------------------------   
client [98] (testset)   loss: 0.5590 -> 0.5762  accuracy: 87.45% -> 86.45%     
client [47] (testset)   loss: 0.6352 -> 0.7244  accuracy: 80.21% -> 79.66%     
client [21] (testset)   loss: 0.4397 -> 0.5569  accuracy: 89.00% -> 87.11%     
client [77] (testset)   loss: 0.8082 -> 0.8272  accuracy: 78.76% -> 80.32%     
client [95] (testset)   loss: 0.5038 -> 0.5360  accuracy: 90.12% -> 90.15%     
client [91] (testset)   loss: 0.7146 -> 0.7197  accuracy: 83.68% -> 84.18%     
client [14] (testset)   loss: 0.6230 -> 0.5344  accuracy: 82.77% -> 89.50%     
client [99] (testset)   loss: 0.5699 -> 0.5403  accuracy: 87.23% -> 88.23%     
client [20] (testset)   loss: 0.7982 -> 0.8031  accuracy: 85.20% -> 84.61%     
client [39] (testset)   loss: 0.8166 -> 0.6930  accuracy: 76.22% -> 81.42%     
---------------------------- TRAINING EPOCH: 90 ----------------------------   
client [52] (testset)   loss: 0.7334 -> 0.7522  accuracy: 82.15% -> 81.51%     
client [62] (testset)   loss: 0.8268 -> 0.8531  accuracy: 82.48% -> 82.48%     
client [71] (testset)   loss: 0.8774 -> 0.8940  accuracy: 79.75% -> 79.48%     
client [97] (testset)   loss: 0.4908 -> 0.4714  accuracy: 89.68% -> 88.29%     
client [30] (testset)   loss: 0.5841 -> 0.6161  accuracy: 85.79% -> 85.83%     
client [88] (testset)   loss: 0.4669 -> 0.4668  accuracy: 85.23% -> 85.23%     
client [60] (testset)   loss: 0.5617 -> 0.5200  accuracy: 86.59% -> 89.72%     
client [82] (testset)   loss: 0.8762 -> 0.7367  accuracy: 76.47% -> 81.60%     
client [91] (testset)   loss: 0.7461 -> 0.8095  accuracy: 83.58% -> 83.88%     
client [57] (testset)   loss: 0.6915 -> 1.0847  accuracy: 82.52% -> 76.87%     
---------------------------- TRAINING EPOCH: 100 ----------------------------  
client [31] (testset)   loss: 0.7968 -> 0.7993  accuracy: 85.15% -> 84.95%     
client [15] (testset)   loss: 0.8349 -> 0.8582  accuracy: 80.06% -> 79.48%     
client [71] (testset)   loss: 0.8940 -> 0.9591  accuracy: 79.48% -> 78.99%     
client [97] (testset)   loss: 0.5185 -> 0.5435  accuracy: 88.76% -> 89.72%     
client [53] (testset)   loss: 0.6819 -> 0.7112  accuracy: 83.75% -> 84.04%     
client [77] (testset)   loss: 0.8272 -> 0.7790  accuracy: 80.32% -> 79.84%     
client [76] (testset)   loss: 0.8787 -> 0.8795  accuracy: 78.80% -> 79.63%     
client [79] (testset)   loss: 0.4537 -> 0.4611  accuracy: 89.81% -> 90.32%     
client [28] (testset)   loss: 0.7463 -> 0.7685  accuracy: 84.27% -> 83.75%     
client [99] (testset)   loss: 3.6099 -> 0.5760  accuracy: 72.28% -> 87.90%     
---------------------------- TRAINING EPOCH: 110 ----------------------------  
client [97] (testset)   loss: 0.5443 -> 0.5912  accuracy: 88.96% -> 88.33%     
client [86] (testset)   loss: 0.5329 -> 0.5668  accuracy: 87.58% -> 87.88%     
client [34] (testset)   loss: 0.8266 -> 0.8512  accuracy: 84.85% -> 84.85%     
client [73] (testset)   loss: 0.9206 -> 0.9639  accuracy: 78.31% -> 77.91%     
client [5]  (testset)   loss: 0.8497 -> 0.9108  accuracy: 82.91% -> 83.13%     
client [96] (testset)   loss: 0.8465 -> 0.8661  accuracy: 85.14% -> 83.98%     
client [22] (testset)   loss: 0.9412 -> 0.9518  accuracy: 77.29% -> 77.64%     
client [60] (testset)   loss: 0.5812 -> 0.6066  accuracy: 88.92% -> 89.67%     
client [66] (testset)   loss: 0.4628 -> 0.4971  accuracy: 89.94% -> 89.06%     
client [83] (testset)   loss: 0.5753 -> 0.5998  accuracy: 87.67% -> 87.50%     
---------------------------- TRAINING EPOCH: 120 ----------------------------  
client [76] (testset)   loss: 1.0070 -> 1.0034  accuracy: 79.30% -> 79.79%     
client [65] (testset)   loss: 0.7681 -> 0.7838  accuracy: 82.59% -> 81.65%     
client [95] (testset)   loss: 0.6123 -> 0.6122  accuracy: 90.19% -> 90.31%     
client [17] (testset)   loss: 0.4975 -> 0.4688  accuracy: 87.75% -> 89.33%     
client [8]  (testset)   loss: 0.6904 -> 0.7240  accuracy: 85.99% -> 86.14%     
client [35] (testset)   loss: 1.0866 -> 1.1477  accuracy: 78.70% -> 79.35%     
client [98] (testset)   loss: 0.5844 -> 0.6128  accuracy: 87.77% -> 88.45%     
client [53] (testset)   loss: 0.7421 -> 0.7521  accuracy: 83.92% -> 83.51%     
client [43] (testset)   loss: 0.5930 -> 0.5923  accuracy: 86.25% -> 87.94%     
client [64] (testset)   loss: 0.8207 -> 0.8328  accuracy: 81.82% -> 79.77%     
---------------------------- TRAINING EPOCH: 130 ----------------------------  
client [21] (testset)   loss: 0.4467 -> 0.8717  accuracy: 88.70% -> 87.19%     
client [88] (testset)   loss: 0.5730 -> 0.6944  accuracy: 84.42% -> 82.91%     
client [38] (testset)   loss: 0.6368 -> 0.6622  accuracy: 89.20% -> 89.10%     
client [3]  (testset)   loss: 0.6069 -> 0.6229  accuracy: 90.30% -> 90.35%     
client [5]  (testset)   loss: 0.9241 -> 0.9404  accuracy: 82.91% -> 82.61%     
client [41] (testset)   loss: 0.9896 -> 1.0164  accuracy: 76.81% -> 76.39%     
client [7]  (testset)   loss: 0.6009 -> 0.5893  accuracy: 84.86% -> 84.61%     
client [37] (testset)   loss: 0.6554 -> 0.6658  accuracy: 84.34% -> 84.04%     
client [45] (testset)   loss: 0.7215 -> 0.7882  accuracy: 82.77% -> 80.78%     
client [47] (testset)   loss: 0.7068 -> 0.7890  accuracy: 79.87% -> 76.10%     
---------------------------- TRAINING EPOCH: 140 ----------------------------  
client [16] (testset)   loss: 0.6635 -> 0.8068  accuracy: 87.98% -> 88.12%     
client [11] (testset)   loss: 0.5816 -> 0.5908  accuracy: 89.70% -> 89.98%     
client [37] (testset)   loss: 0.7220 -> 0.7256  accuracy: 84.04% -> 84.69%     
client [41] (testset)   loss: 1.0164 -> 1.0804  accuracy: 76.39% -> 77.14%     
client [95] (testset)   loss: 0.6523 -> 0.6622  accuracy: 90.00% -> 90.12%     
client [53] (testset)   loss: 0.7521 -> 0.7828  accuracy: 83.51% -> 83.98%     
client [22] (testset)   loss: 0.9877 -> 1.0425  accuracy: 77.92% -> 76.18%     
client [25] (testset)   loss: 0.4125 -> 0.4192  accuracy: 93.48% -> 93.43%     
client [69] (testset)   loss: 0.7317 -> 0.7587  accuracy: 88.60% -> 88.88%     
client [46] (testset)   loss: 0.5959 -> 0.5832  accuracy: 86.87% -> 87.55%     
---------------------------- TRAINING EPOCH: 150 ----------------------------  
client [47] (testset)   loss: 0.9635 -> 0.9417  accuracy: 80.59% -> 79.41%     
client [69] (testset)   loss: 0.7685 -> 0.7795  accuracy: 88.74% -> 88.81%     
client [82] (testset)   loss: 1.1344 -> 0.9013  accuracy: 82.96% -> 81.38%     
client [45] (testset)   loss: 0.7792 -> 0.7854  accuracy: 82.02% -> 82.44%     
client [7]  (testset)   loss: 0.5893 -> 0.6384  accuracy: 84.61% -> 84.71%     
client [50] (testset)   loss: 0.5498 -> 0.5784  accuracy: 85.74% -> 85.58%     
client [35] (testset)   loss: 1.2221 -> 1.2957  accuracy: 79.35% -> 78.63%     
client [24] (testset)   loss: 0.6662 -> 0.6804  accuracy: 87.16% -> 88.10%     
client [15] (testset)   loss: 0.9475 -> 1.1131  accuracy: 80.27% -> 77.47%     
client [58] (testset)   loss: 0.7192 -> 0.7301  accuracy: 88.55% -> 88.27%     
---------------------------- TRAINING EPOCH: 160 ----------------------------  
client [48] (testset)   loss: 0.8178 -> 0.8693  accuracy: 83.71% -> 82.04%     
client [76] (testset)   loss: 1.1419 -> 1.1055  accuracy: 79.52% -> 79.24%     
client [67] (testset)   loss: 0.6242 -> 0.6413  accuracy: 86.14% -> 86.55%     
client [37] (testset)   loss: 0.7435 -> 0.7782  accuracy: 84.99% -> 84.84%     
client [58] (testset)   loss: 0.7418 -> 0.7572  accuracy: 88.87% -> 88.75%     
client [64] (testset)   loss: 0.9920 -> 0.9963  accuracy: 80.20% -> 79.45%     
client [77] (testset)   loss: 0.9381 -> 0.9679  accuracy: 79.30% -> 79.84%     
client [55] (testset)   loss: 0.7956 -> 0.7856  accuracy: 81.86% -> 82.42%     
client [12] (testset)   loss: 0.9525 -> 0.9765  accuracy: 80.84% -> 80.48%     
client [89] (testset)   loss: 1.1440 -> 1.1549  accuracy: 79.86% -> 79.86%     
---------------------------- TRAINING EPOCH: 170 ----------------------------  
client [84] (testset)   loss: 0.8009 -> 0.8142  accuracy: 88.04% -> 87.96%     
client [51] (testset)   loss: 0.8213 -> 0.8235  accuracy: 88.17% -> 88.04%     
client [8]  (testset)   loss: 0.8039 -> 0.8124  accuracy: 86.14% -> 86.37%     
client [18] (testset)   loss: 0.9255 -> 1.0251  accuracy: 81.58% -> 78.73%     
client [94] (testset)   loss: 0.8361 -> 0.8299  accuracy: 85.02% -> 86.51%     
client [81] (testset)   loss: 1.2513 -> 1.0457  accuracy: 75.34% -> 79.44%     
client [3]  (testset)   loss: 0.6492 -> 0.6574  accuracy: 90.35% -> 90.40%     
client [11] (testset)   loss: 0.6243 -> 0.6380  accuracy: 90.03% -> 90.03%     
client [95] (testset)   loss: 0.7223 -> 0.7373  accuracy: 89.96% -> 90.04%     
client [67] (testset)   loss: 0.6413 -> 0.6574  accuracy: 86.55% -> 86.29%     
---------------------------- TRAINING EPOCH: 180 ----------------------------  
client [21] (testset)   loss: 0.5406 -> 0.5459  accuracy: 88.78% -> 88.78%     
client [79] (testset)   loss: 0.5622 -> 0.5781  accuracy: 89.37% -> 88.86%     
client [58] (testset)   loss: 0.7774 -> 0.7951  accuracy: 88.47% -> 88.51%     
client [88] (testset)   loss: 0.6655 -> 0.6900  accuracy: 84.94% -> 84.75%     
client [46] (testset)   loss: 0.6318 -> 0.6423  accuracy: 86.82% -> 87.08%     
client [11] (testset)   loss: 0.6380 -> 0.6447  accuracy: 90.03% -> 89.92%     
client [55] (testset)   loss: 0.9803 -> 0.9921  accuracy: 82.82% -> 82.67%     
client [13] (testset)   loss: 1.0317 -> 1.0341  accuracy: 79.30% -> 80.65%     
client [31] (testset)   loss: 0.9535 -> 0.8522  accuracy: 82.79% -> 84.55%     
client [75] (testset)   loss: 0.9943 -> 1.0403  accuracy: 81.50% -> 82.02%     
---------------------------- TRAINING EPOCH: 190 ----------------------------  
client [19] (testset)   loss: 0.8825 -> 0.9241  accuracy: 86.36% -> 86.24%     
client [7]  (testset)   loss: 0.7096 -> 0.7418  accuracy: 84.27% -> 84.61%     
client [57] (testset)   loss: 0.9088 -> 0.9335  accuracy: 81.72% -> 81.62%     
client [13] (testset)   loss: 1.0742 -> 1.0753  accuracy: 79.37% -> 80.53%     
client [43] (testset)   loss: 0.6994 -> 0.7135  accuracy: 87.20% -> 87.81%     
client [91] (testset)   loss: 0.9202 -> 0.9435  accuracy: 83.18% -> 83.23%     
client [10] (testset)   loss: 0.8680 -> 0.8795  accuracy: 84.55% -> 84.22%     
client [64] (testset)   loss: 1.1425 -> 1.1473  accuracy: 80.90% -> 80.85%     
client [82] (testset)   loss: 1.0893 -> 1.1747  accuracy: 82.51% -> 82.67%     
client [22] (testset)   loss: 1.2274 -> 1.2804  accuracy: 75.76% -> 76.46%     
---------------------------- TRAINING EPOCH: 200 ----------------------------  
client [20] (testset)   loss: 0.9604 -> 0.9746  accuracy: 85.32% -> 85.32%     
client [23] (testset)   loss: 0.8291 -> 0.8292  accuracy: 81.32% -> 81.64%     
client [88] (testset)   loss: 0.6900 -> 0.7186  accuracy: 84.75% -> 83.66%     
client [98] (testset)   loss: 0.7344 -> 0.7670  accuracy: 87.65% -> 86.89%     
client [79] (testset)   loss: 0.5972 -> 0.5968  accuracy: 89.23% -> 89.74%     
client [21] (testset)   loss: 0.6038 -> 0.6584  accuracy: 89.00% -> 88.96%     
client [92] (testset)   loss: 0.7597 -> 0.7431  accuracy: 86.57% -> 86.24%     
client [56] (testset)   loss: 1.0681 -> 1.2575  accuracy: 82.98% -> 77.39%     
client [5]  (testset)   loss: 1.0748 -> 1.0759  accuracy: 82.76% -> 83.05%     
client [52] (testset)   loss: 1.1291 -> 1.1525  accuracy: 81.09% -> 81.65%     
---------------------------- TRAINING EPOCH: 210 ----------------------------  
client [67] (testset)   loss: 0.8072 -> 0.8196  accuracy: 86.14% -> 86.03%     
client [54] (testset)   loss: 0.8377 -> 0.8526  accuracy: 85.87% -> 85.92%     
client [14] (testset)   loss: 0.7318 -> 0.7375  accuracy: 88.93% -> 88.59%     
client [99] (testset)   loss: 0.7636 -> 0.7752  accuracy: 87.90% -> 88.06%     
client [36] (testset)   loss: 1.1253 -> 1.1300  accuracy: 83.14% -> 83.34%     
client [30] (testset)   loss: 0.9115 -> 0.9217  accuracy: 85.79% -> 85.56%     
client [38] (testset)   loss: 0.7395 -> 0.7430  accuracy: 89.26% -> 89.07%     
client [15] (testset)   loss: 1.0896 -> 1.1044  accuracy: 79.55% -> 79.55%     
client [6]  (testset)   loss: 1.0117 -> 1.0379  accuracy: 81.81% -> 82.71%     
client [53] (testset)   loss: 0.9880 -> 0.9950  accuracy: 83.51% -> 83.57%     
---------------------------- TRAINING EPOCH: 220 ----------------------------  
client [99] (testset)   loss: 0.8170 -> 0.8226  accuracy: 88.29% -> 88.23%     
client [6]  (testset)   loss: 1.0379 -> 1.0430  accuracy: 82.71% -> 82.85%     
client [83] (testset)   loss: 0.7742 -> 0.7819  accuracy: 87.32% -> 87.00%     
client [42] (testset)   loss: 0.7493 -> 0.7589  accuracy: 88.49% -> 88.00%     
client [34] (testset)   loss: 1.0169 -> 1.0132  accuracy: 84.62% -> 84.62%     
client [15] (testset)   loss: 1.1044 -> 1.1073  accuracy: 79.55% -> 79.63%     
client [47] (testset)   loss: 1.3127 -> 1.3791  accuracy: 78.95% -> 78.24%     
client [55] (testset)   loss: 1.0244 -> 1.0379  accuracy: 82.72% -> 81.96%     
client [51] (testset)   loss: 0.8636 -> 0.8780  accuracy: 87.90% -> 87.76%     
client [95] (testset)   loss: 0.7596 -> 0.7691  accuracy: 89.80% -> 89.84%     
---------------------------- TRAINING EPOCH: 230 ----------------------------  
client [71] (testset)   loss: 1.2612 -> 1.2890  accuracy: 78.37% -> 78.19%     
client [15] (testset)   loss: 1.1073 -> 1.1714  accuracy: 79.63% -> 79.77%     
client [33] (testset)   loss: 1.0607 -> 1.0746  accuracy: 81.37% -> 81.15%     
client [99] (testset)   loss: 0.8358 -> 0.8485  accuracy: 88.40% -> 88.18%     
client [90] (testset)   loss: 0.9105 -> 0.9895  accuracy: 78.86% -> 79.91%     
client [57] (testset)   loss: 1.1361 -> 1.1834  accuracy: 80.48% -> 79.44%     
client [27] (testset)   loss: 0.6846 -> 0.6933  accuracy: 89.92% -> 89.77%     
client [78] (testset)   loss: 0.6955 -> 0.7175  accuracy: 86.91% -> 87.22%     
client [36] (testset)   loss: 1.1595 -> 1.1677  accuracy: 82.49% -> 82.84%     
client [88] (testset)   loss: 0.7337 -> 0.8015  accuracy: 84.09% -> 84.47%     
---------------------------- TRAINING EPOCH: 240 ----------------------------  
client [70] (testset)   loss: 1.6181 -> 1.5498  accuracy: 76.33% -> 76.48%     
client [35] (testset)   loss: 1.4242 -> 1.4579  accuracy: 78.96% -> 78.83%     
client [16] (testset)   loss: 0.8711 -> 0.8854  accuracy: 88.17% -> 87.93%     
client [80] (testset)   loss: 1.0250 -> 1.0100  accuracy: 82.46% -> 79.41%     
client [38] (testset)   loss: 0.8570 -> 0.7740  accuracy: 88.48% -> 89.17%     
client [78] (testset)   loss: 0.7250 -> 0.7323  accuracy: 86.86% -> 87.01%     
client [68] (testset)   loss: 0.7830 -> 0.8018  accuracy: 87.00% -> 87.38%     
client [11] (testset)   loss: 0.6960 -> 0.7114  accuracy: 90.14% -> 89.92%     
client [64] (testset)   loss: 1.2753 -> 1.3409  accuracy: 80.74% -> 79.24%     
client [82] (testset)   loss: 1.3453 -> 1.3683  accuracy: 82.34% -> 82.34%     
---------------------------- TRAINING EPOCH: 250 ----------------------------  
client [30] (testset)   loss: 1.0196 -> 1.0358  accuracy: 85.51% -> 85.56%     
client [27] (testset)   loss: 0.6933 -> 0.7110  accuracy: 89.77% -> 90.06%     
client [74] (testset)   loss: 0.7926 -> 0.7915  accuracy: 86.74% -> 86.88%     
client [45] (testset)   loss: 0.9647 -> 1.0066  accuracy: 82.52% -> 82.27%     
client [6]  (testset)   loss: 1.0494 -> 1.0788  accuracy: 82.58% -> 82.40%     
client [36] (testset)   loss: 1.1765 -> 1.1968  accuracy: 82.54% -> 82.79%     
client [63] (testset)   loss: 0.9114 -> 0.9326  accuracy: 85.89% -> 85.94%     
client [76] (testset)   loss: 1.3376 -> 1.4425  accuracy: 79.07% -> 78.52%     
client [83] (testset)   loss: 0.8481 -> 0.8535  accuracy: 86.28% -> 87.03%     
client [86] (testset)   loss: 0.6767 -> 0.6915  accuracy: 87.68% -> 87.43%     
---------------------------- TRAINING EPOCH: 260 ----------------------------  
client [83] (testset)   loss: 0.8535 -> 0.8514  accuracy: 87.03% -> 86.85%     
client [99] (testset)   loss: 0.8609 -> 0.8716  accuracy: 88.12% -> 88.18%     
client [74] (testset)   loss: 0.7995 -> 0.8216  accuracy: 86.97% -> 86.88%     
client [73] (testset)   loss: 1.4249 -> 1.4493  accuracy: 78.59% -> 76.32%     
client [29] (testset)   loss: 1.7015 -> 1.5613  accuracy: 72.40% -> 72.29%     
client [92] (testset)   loss: 0.8194 -> 0.8194  accuracy: 86.40% -> 86.24%     
client [6]  (testset)   loss: 1.1196 -> 1.1093  accuracy: 81.35% -> 82.49%     
client [61] (testset)   loss: 0.7423 -> 0.7594  accuracy: 88.76% -> 88.62%     
client [21] (testset)   loss: 0.6571 -> 0.6608  accuracy: 89.00% -> 88.89%     
client [67] (testset)   loss: 0.8727 -> 0.8734  accuracy: 86.24% -> 86.03%     
---------------------------- TRAINING EPOCH: 270 ----------------------------  
client [83] (testset)   loss: 0.8514 -> 0.8826  accuracy: 86.85% -> 87.00%     
client [32] (testset)   loss: 0.8938 -> 0.9040  accuracy: 87.16% -> 87.27%     
client [95] (testset)   loss: 0.7734 -> 0.7756  accuracy: 89.84% -> 89.80%     
client [61] (testset)   loss: 0.7823 -> 0.8108  accuracy: 88.72% -> 88.62%     
client [27] (testset)   loss: 0.7110 -> 0.7236  accuracy: 90.06% -> 90.25%     
client [25] (testset)   loss: 0.5030 -> 0.5234  accuracy: 93.19% -> 93.14%     
client [68] (testset)   loss: 0.8425 -> 0.8665  accuracy: 87.12% -> 86.84%     
client [34] (testset)   loss: 1.0874 -> 1.0622  accuracy: 83.65% -> 84.62%     
client [71] (testset)   loss: 1.5458 -> 1.5577  accuracy: 78.28% -> 77.66%     
client [89] (testset)   loss: 1.2800 -> 1.2725  accuracy: 79.86% -> 79.86%     
---------------------------- TRAINING EPOCH: 280 ----------------------------  
client [78] (testset)   loss: 0.8292 -> 0.8512  accuracy: 86.50% -> 86.04%     
client [81] (testset)   loss: 1.4039 -> 1.3772  accuracy: 80.42% -> 80.03%     
client [51] (testset)   loss: 0.9363 -> 0.9476  accuracy: 87.99% -> 88.04%     
client [54] (testset)   loss: 0.8823 -> 0.9125  accuracy: 85.87% -> 85.81%     
client [65] (testset)   loss: 1.0802 -> 1.0921  accuracy: 82.52% -> 81.65%     
client [41] (testset)   loss: 1.4702 -> 1.4973  accuracy: 75.98% -> 73.98%     
client [11] (testset)   loss: 0.7192 -> 0.7290  accuracy: 90.14% -> 89.98%     
client [85] (testset)   loss: 0.6714 -> 0.6846  accuracy: 89.60% -> 89.78%     
client [12] (testset)   loss: 1.2076 -> 1.2125  accuracy: 80.13% -> 80.48%     
client [23] (testset)   loss: 1.1109 -> 1.0972  accuracy: 80.68% -> 81.23%     
---------------------------- TRAINING EPOCH: 290 ----------------------------  
client [16] (testset)   loss: 0.8967 -> 0.9062  accuracy: 87.93% -> 88.26%     
client [65] (testset)   loss: 1.1352 -> 1.1743  accuracy: 80.97% -> 82.19%     
client [53] (testset)   loss: 1.1107 -> 1.1144  accuracy: 83.16% -> 83.39%     
client [58] (testset)   loss: 0.8730 -> 0.8758  accuracy: 88.59% -> 88.47%     
client [72] (testset)   loss: 1.0167 -> 1.0520  accuracy: 82.56% -> 82.60%     
client [7]  (testset)   loss: 0.9030 -> 0.9262  accuracy: 84.56% -> 84.07%     
client [71] (testset)   loss: 1.5577 -> 1.6122  accuracy: 77.66% -> 77.84%     
client [59] (testset)   loss: 1.1743 -> 1.2014  accuracy: 79.20% -> 78.13%     
client [86] (testset)   loss: 0.7437 -> 0.7381  accuracy: 86.00% -> 87.58%     
client [39] (testset)   loss: 1.3903 -> 1.2528  accuracy: 80.59% -> 79.37%     
---------------------------- TRAINING EPOCH: 300 ----------------------------  
client [99] (testset)   loss: 0.8880 -> 0.8984  accuracy: 88.18% -> 88.12%     
client [7]  (testset)   loss: 0.9245 -> 0.9435  accuracy: 84.42% -> 84.17%     
client [17] (testset)   loss: 0.6817 -> 0.6871  accuracy: 88.94% -> 89.33%     
client [64] (testset)   loss: 1.4550 -> 1.4644  accuracy: 80.37% -> 80.37%     
client [37] (testset)   loss: 0.9064 -> 0.9177  accuracy: 83.89% -> 84.19%     
client [29] (testset)   loss: 1.8205 -> 1.8251  accuracy: 72.98% -> 71.94%     
client [93] (testset)   loss: 0.9780 -> 0.9925  accuracy: 88.33% -> 88.50%     
client [73] (testset)   loss: 1.4843 -> 1.5208  accuracy: 78.19% -> 78.59%     
client [40] (testset)   loss: 1.1513 -> 1.1581  accuracy: 83.00% -> 83.07%     
client [76] (testset)   loss: 1.4148 -> 1.4500  accuracy: 79.41% -> 78.96%     
---------------------------- TRAINING EPOCH: 310 ----------------------------  
client [31] (testset)   loss: 0.8901 -> 0.9407  accuracy: 84.45% -> 84.65%     
client [89] (testset)   loss: 1.3147 -> 1.3116  accuracy: 80.18% -> 80.25%     
client [77] (testset)   loss: 1.4837 -> 1.4977  accuracy: 78.54% -> 78.59%     
client [90] (testset)   loss: 1.3062 -> 1.3362  accuracy: 78.59% -> 78.41%     
client [26] (testset)   loss: 0.8680 -> 0.8716  accuracy: 85.71% -> 84.70%     
client [50] (testset)   loss: 0.7295 -> 0.7465  accuracy: 85.27% -> 85.43%     
client [30] (testset)   loss: 1.1230 -> 1.0961  accuracy: 85.24% -> 85.51%     
client [70] (testset)   loss: 1.6506 -> 1.6509  accuracy: 77.08% -> 76.33%     
client [41] (testset)   loss: 1.5932 -> 1.6657  accuracy: 75.73% -> 75.81%     
client [99] (testset)   loss: 0.8984 -> 0.9050  accuracy: 88.12% -> 88.23%     
---------------------------- TRAINING EPOCH: 320 ----------------------------  
client [68] (testset)   loss: 0.9454 -> 0.9482  accuracy: 87.15% -> 87.15%     
client [70] (testset)   loss: 1.7009 -> 1.7156  accuracy: 76.78% -> 76.78%     
client [52] (testset)   loss: 1.3222 -> 1.3151  accuracy: 81.09% -> 81.18%     
client [1]  (testset)   loss: 0.9371 -> 0.9457  accuracy: 85.82% -> 86.19%     
client [2]  (testset)   loss: 0.7584 -> 0.7703  accuracy: 87.27% -> 87.35%     
client [67] (testset)   loss: 0.9728 -> 0.9634  accuracy: 85.93% -> 85.98%     
client [92] (testset)   loss: 0.9603 -> 0.9612  accuracy: 86.48% -> 86.98%     
client [35] (testset)   loss: 1.5469 -> 1.5601  accuracy: 78.96% -> 78.63%     
client [36] (testset)   loss: 1.3296 -> 1.3471  accuracy: 82.89% -> 82.64%     
client [64] (testset)   loss: 1.5032 -> 1.5050  accuracy: 80.42% -> 80.31%     
---------------------------- TRAINING EPOCH: 330 ----------------------------  
client [44] (testset)   loss: 1.6053 -> 1.5272  accuracy: 75.68% -> 73.42%     
client [6]  (testset)   loss: 1.2188 -> 1.2279  accuracy: 82.53% -> 81.44%     
client [12] (testset)   loss: 1.3286 -> 1.3296  accuracy: 79.54% -> 80.01%     
client [55] (testset)   loss: 1.1785 -> 1.2030  accuracy: 80.43% -> 82.36%     
client [29] (testset)   loss: 1.8959 -> 1.9195  accuracy: 72.63% -> 72.75%     
client [9]  (testset)   loss: 1.8135 -> 1.8320  accuracy: 73.60% -> 73.17%     
client [43] (testset)   loss: 0.8703 -> 0.8813  accuracy: 86.64% -> 86.86%     
client [77] (testset)   loss: 1.4977 -> 1.5335  accuracy: 78.59% -> 78.81%     
client [98] (testset)   loss: 0.9356 -> 0.9488  accuracy: 87.01% -> 86.93%     
client [78] (testset)   loss: 1.0671 -> 0.8378  accuracy: 81.72% -> 86.65%     
---------------------------- TRAINING EPOCH: 340 ----------------------------  
client [92] (testset)   loss: 0.9720 -> 0.9824  accuracy: 86.32% -> 86.65%     
client [80] (testset)   loss: 1.1829 -> 1.1666  accuracy: 82.69% -> 82.59%     
client [63] (testset)   loss: 0.9902 -> 1.0100  accuracy: 85.94% -> 85.99%     
client [76] (testset)   loss: 1.5120 -> 1.5251  accuracy: 79.19% -> 79.41%     
client [78] (testset)   loss: 0.8378 -> 0.8638  accuracy: 86.65% -> 86.45%     
client [25] (testset)   loss: 0.5300 -> 0.5370  accuracy: 93.24% -> 93.29%     
client [58] (testset)   loss: 0.9007 -> 0.9023  accuracy: 88.55% -> 88.47%     
client [13] (testset)   loss: 1.3023 -> 1.1410  accuracy: 79.18% -> 80.34%     
client [17] (testset)   loss: 0.7106 -> 0.7122  accuracy: 89.33% -> 89.33%     
client [38] (testset)   loss: 0.9028 -> 0.9095  accuracy: 89.13% -> 89.13%     
---------------------------- TRAINING EPOCH: 350 ----------------------------  
client [72] (testset)   loss: 1.1887 -> 1.2444  accuracy: 81.83% -> 82.46%     
client [82] (testset)   loss: 1.5545 -> 1.5650  accuracy: 82.28% -> 82.28%     
client [86] (testset)   loss: 0.7715 -> 0.7761  accuracy: 87.53% -> 87.78%     
client [51] (testset)   loss: 0.9951 -> 1.0042  accuracy: 88.26% -> 87.95%     
client [96] (testset)   loss: 1.2196 -> 1.2377  accuracy: 84.51% -> 84.32%     
client [42] (testset)   loss: 0.8991 -> 0.9134  accuracy: 88.13% -> 88.40%     
client [55] (testset)   loss: 1.3094 -> 1.3184  accuracy: 82.52% -> 82.26%     
client [13] (testset)   loss: 1.1955 -> 1.2269  accuracy: 80.04% -> 80.04%     
client [1]  (testset)   loss: 0.9702 -> 0.9901  accuracy: 85.50% -> 86.35%     
client [12] (testset)   loss: 1.3296 -> 1.3355  accuracy: 80.01% -> 80.54%     
---------------------------- TRAINING EPOCH: 360 ----------------------------  
client [68] (testset)   loss: 0.9664 -> 0.9720  accuracy: 87.00% -> 87.06%     
client [23] (testset)   loss: 1.2041 -> 1.2337  accuracy: 78.98% -> 80.95%     
client [46] (testset)   loss: 0.9672 -> 0.9539  accuracy: 86.40% -> 86.61%     
client [41] (testset)   loss: 1.7048 -> 1.7146  accuracy: 75.89% -> 74.40%     
client [25] (testset)   loss: 0.5509 -> 0.5661  accuracy: 93.07% -> 93.41%     
client [58] (testset)   loss: 0.9028 -> 0.9092  accuracy: 88.55% -> 88.59%     
client [14] (testset)   loss: 0.8975 -> 0.8181  accuracy: 87.45% -> 86.92%     
client [33] (testset)   loss: 1.1731 -> 1.1945  accuracy: 81.60% -> 82.04%     
client [85] (testset)   loss: 0.7531 -> 0.8734  accuracy: 89.82% -> 89.08%     
client [62] (testset)   loss: 1.2924 -> 1.3144  accuracy: 82.33% -> 82.25%     
---------------------------- TRAINING EPOCH: 370 ----------------------------  
client [98] (testset)   loss: 0.9932 -> 0.9995  accuracy: 87.05% -> 86.77%     
client [63] (testset)   loss: 1.0183 -> 1.0303  accuracy: 85.84% -> 86.08%     
client [70] (testset)   loss: 1.7805 -> 1.7889  accuracy: 77.08% -> 77.16%     
client [65] (testset)   loss: 1.2549 -> 1.2386  accuracy: 81.65% -> 80.63%     
client [14] (testset)   loss: 0.8753 -> 0.9506  accuracy: 87.92% -> 88.21%     
client [73] (testset)   loss: 1.6246 -> 1.6431  accuracy: 78.82% -> 78.48%     
client [34] (testset)   loss: 1.1543 -> 1.1574  accuracy: 84.79% -> 84.34%     
client [99] (testset)   loss: 0.9271 -> 0.9356  accuracy: 88.29% -> 88.23%     
client [69] (testset)   loss: 0.9256 -> 0.9302  accuracy: 88.45% -> 88.35%     
client [46] (testset)   loss: 0.9539 -> 0.9617  accuracy: 86.61% -> 85.98%     
---------------------------- TRAINING EPOCH: 380 ----------------------------  
client [99] (testset)   loss: 0.9414 -> 0.9469  accuracy: 88.23% -> 88.34%     
client [93] (testset)   loss: 1.0407 -> 1.0360  accuracy: 88.37% -> 88.37%     
client [11] (testset)   loss: 0.8094 -> 0.8025  accuracy: 90.14% -> 90.20%     
client [58] (testset)   loss: 0.9191 -> 0.9260  accuracy: 88.59% -> 88.55%     
client [81] (testset)   loss: 1.6319 -> 1.6337  accuracy: 80.22% -> 80.52%     
client [85] (testset)   loss: 0.8734 -> 0.7564  accuracy: 89.08% -> 89.49%     
client [89] (testset)   loss: 1.4014 -> 1.4005  accuracy: 80.05% -> 79.66%     
client [45] (testset)   loss: 1.1495 -> 1.1758  accuracy: 82.35% -> 82.27%     
client [8]  (testset)   loss: 0.9278 -> 0.9403  accuracy: 86.44% -> 86.14%     
client [68] (testset)   loss: 0.9961 -> 1.0031  accuracy: 87.22% -> 87.15%     
---------------------------- TRAINING EPOCH: 390 ----------------------------  
client [67] (testset)   loss: 1.0112 -> 1.0012  accuracy: 85.93% -> 85.98%     
client [72] (testset)   loss: 1.1145 -> 1.1603  accuracy: 82.35% -> 82.70%     
client [1]  (testset)   loss: 1.0190 -> 1.0349  accuracy: 86.30% -> 85.07%     
client [78] (testset)   loss: 0.9697 -> 1.0180  accuracy: 85.99% -> 86.14%     
client [83] (testset)   loss: 1.0385 -> 1.0435  accuracy: 86.67% -> 87.42%     
client [21] (testset)   loss: 0.8336 -> 0.8390  accuracy: 88.25% -> 88.40%     
client [56] (testset)   loss: 1.3681 -> 1.3656  accuracy: 81.10% -> 82.27%     
client [44] (testset)   loss: 1.6855 -> 1.7773  accuracy: 73.90% -> 74.86%     
client [92] (testset)   loss: 0.9980 -> 1.0074  accuracy: 86.48% -> 86.73%     
client [27] (testset)   loss: 0.6500 -> 0.6820  accuracy: 89.95% -> 89.73%     
---------------------------- TRAINING EPOCH: 400 ----------------------------  
client [10] (testset)   loss: 1.0774 -> 1.0826  accuracy: 84.08% -> 84.02%     
client [39] (testset)   loss: 1.4621 -> 1.5091  accuracy: 80.59% -> 80.90%     
client [65] (testset)   loss: 1.3123 -> 1.3590  accuracy: 82.05% -> 80.84%     
client [26] (testset)   loss: 1.0400 -> 1.0520  accuracy: 84.90% -> 84.70%     
client [19] (testset)   loss: 1.1466 -> 1.1609  accuracy: 86.20% -> 86.08%     
client [68] (testset)   loss: 1.0081 -> 1.0144  accuracy: 87.12% -> 87.06%     
client [41] (testset)   loss: 1.7297 -> 1.7412  accuracy: 75.73% -> 74.15%     
client [50] (testset)   loss: 0.8641 -> 0.8761  accuracy: 85.43% -> 85.22%     
client [75] (testset)   loss: 1.3834 -> 1.3932  accuracy: 81.03% -> 81.61%     
client [81] (testset)   loss: 1.6617 -> 1.6808  accuracy: 80.37% -> 80.52%     
Training... ---------------------------------------- 100% 2:16:04
Local-only's average time taken by each global epoch: 0 min 20.30 sec.         
Local-only's total running time: 2 h 16 m 4 s.                                 
==================== Local-only Experiment Results: ====================       
Display format: (before local fine-tuning) -> (after local fine-tuning)        
 So if finetune_epoch = 0, x.xx% -> 0.00% is normal.                           
 Centralized testing ONLY happens after model aggregation, so the stats between
'->' are the same.                                                             
{                                                                              
    "100": {                                                                   
        "all_clients": {                                                       
            "test": {                                                          
                "loss": "0.6860 -> 0.0000",                                    
                "accuracy": "84.88% -> 0.00%"                                  
            }                                                                  
        }                                                                      
    },                                                                         
    "200": {                                                                   
        "all_clients": {                                                       
            "test": {                                                          
                "loss": "0.8815 -> 0.0000",                                    
                "accuracy": "84.88% -> 0.00%"                                  
            }                                                                  
        }                                                                      
    },                                                                         
    "300": {                                                                   
        "all_clients": {                                                       
            "test": {                                                          
                "loss": "1.0325 -> 0.0000",                                    
                "accuracy": "84.65% -> 0.00%"                                  
            }                                                                  
        }                                                                      
    },                                                                         
    "400": {                                                                   
        "all_clients": {                                                       
            "test": {                                                          
                "loss": "1.1523 -> 0.0000",                                    
                "accuracy": "84.74% -> 0.00%"                                  
            }                                                                  
        }                                                                      
    }                                                                          
}                                                                              
==================== Local-only Max Accuracy ====================              
all_clients:                                                                   
(test) before fine-tuning: 84.88% at epoch 100                                 
(test) after fine-tuning: 0.00% at epoch 100                                   
[0m