==================== Local-only ====================                           
Experiment Arguments:                                                          
{
│   'method': 'local',
│   'dataset': {
│   │   'name': 'mnist',
│   │   'client_num': 100,
│   │   'test_ratio': 0.25,
│   │   'val_ratio': 0.0,
│   │   'seed': 42,
│   │   'split': 'sample',
│   │   'IID_ratio': 0.0,
│   │   'monitor_window_name_suffix': 'mnist-100clients-0%IID-Dir(0.5)-seed42',
│   │   'alpha': 0.5,
│   │   'min_samples_per_client': 10
│   },
│   'model': {
│   │   'name': 'avgcnn',
│   │   'use_torchvision_pretrained_weights': True,
│   │   'external_model_weights_path': None
│   },
│   'optimizer': {
│   │   'lr': 0.01,
│   │   'dampening': 0,
│   │   'weight_decay': 0,
│   │   'momentum': 0,
│   │   'nesterov': False,
│   │   'name': 'sgd'
│   },
│   'mode': 'serial',
│   'parallel': {
│   │   'ray_cluster_addr': None,
│   │   'num_cpus': None,
│   │   'num_gpus': None,
│   │   'num_workers': 2
│   },
│   'common': {
│   │   'seed': 42,
│   │   'join_ratio': 0.1,
│   │   'global_epoch': 400,
│   │   'local_epoch': 5,
│   │   'batch_size': 32,
│   │   'reset_optimizer_on_global_epoch': True,
│   │   'straggler_ratio': 0,
│   │   'straggler_min_local_epoch': 0,
│   │   'buffers': 'global',
│   │   'client_side_evaluation': True,
│   │   'test': {
│   │   │   'client': {
│   │   │   │   'interval': 100,
│   │   │   │   'finetune_epoch': 0,
│   │   │   │   'train': False,
│   │   │   │   'val': False,
│   │   │   │   'test': True
│   │   │   },
│   │   │   'server': {
│   │   │   │   'interval': -1,
│   │   │   │   'train': False,
│   │   │   │   'val': False,
│   │   │   │   'test': False,
│   │   │   │   'model_in_train_mode': False
│   │   │   }
│   │   },
│   │   'verbose_gap': 10,
│   │   'monitor': None,
│   │   'use_cuda': True,
│   │   'save_log': True,
│   │   'save_model': False,
│   │   'save_learning_curve_plot': False,
│   │   'save_metrics': True,
│   │   'delete_useless_run': True
│   }
}
---------------------------- TRAINING EPOCH: 10 ----------------------------   
client [77] (testset)   loss: 1.0159 -> 0.6944  accuracy: 72.94% -> 78.82%     
client [81] (testset)   loss: 0.4580 -> 0.3721  accuracy: 88.38% -> 88.38%     
client [21] (testset)   loss: 2.2843 -> 0.8906  accuracy: 5.26% -> 71.77%      
client [68] (testset)   loss: 0.4670 -> 0.2482  accuracy: 89.29% -> 90.62%     
client [93] (testset)   loss: 0.9426 -> 0.6010  accuracy: 65.96% -> 84.40%     
client [31] (testset)   loss: 0.7759 -> 0.4209  accuracy: 78.61% -> 88.24%     
client [20] (testset)   loss: 0.8191 -> 0.4652  accuracy: 71.83% -> 84.51%     
client [59] (testset)   loss: 2.2689 -> 1.2518  accuracy: 20.83% -> 59.38%     
client [48] (testset)   loss: 0.4018 -> 0.2389  accuracy: 84.40% -> 90.78%     
client [34] (testset)   loss: 0.3872 -> 0.2494  accuracy: 88.39% -> 92.13%     
---------------------------- TRAINING EPOCH: 20 ----------------------------   
client [69] (testset)   loss: 0.8987 -> 0.5694  accuracy: 70.00% -> 84.29%     
client [99] (testset)   loss: 1.1560 -> 0.8685  accuracy: 62.72% -> 73.96%     
client [67] (testset)   loss: 0.9234 -> 0.4634  accuracy: 69.14% -> 85.71%     
client [0]  (testset)   loss: 0.4061 -> 0.2618  accuracy: 89.49% -> 92.36%     
client [76] (testset)   loss: 0.5282 -> 0.3646  accuracy: 83.06% -> 91.26%     
client [41] (testset)   loss: 0.7051 -> 0.3631  accuracy: 80.27% -> 88.79%     
client [62] (testset)   loss: 2.3161 -> 0.3473  accuracy: 8.48% -> 90.30%      
client [2]  (testset)   loss: 2.2852 -> 0.3869  accuracy: 8.44% -> 90.91%      
client [14] (testset)   loss: 0.2940 -> 0.2491  accuracy: 90.91% -> 90.91%     
client [46] (testset)   loss: 0.4432 -> 0.6615  accuracy: 84.40% -> 77.98%     
---------------------------- TRAINING EPOCH: 30 ----------------------------   
client [24] (testset)   loss: 0.3012 -> 0.2713  accuracy: 93.16% -> 93.16%     
client [68] (testset)   loss: 0.1284 -> 0.1220  accuracy: 96.43% -> 95.98%     
client [57] (testset)   loss: 0.9339 -> 0.6001  accuracy: 73.40% -> 82.98%     
client [17] (testset)   loss: 0.4362 -> 0.3440  accuracy: 87.90% -> 91.13%     
client [54] (testset)   loss: 0.2813 -> 0.2641  accuracy: 92.04% -> 92.92%     
client [23] (testset)   loss: 2.3293 -> 1.0128  accuracy: 0.00% -> 66.09%      
client [35] (testset)   loss: 0.4742 -> 0.4723  accuracy: 88.24% -> 88.24%     
client [59] (testset)   loss: 0.4807 -> 0.3356  accuracy: 86.46% -> 89.58%     
client [31] (testset)   loss: 0.1901 -> 0.1881  accuracy: 94.12% -> 95.19%     
client [9]  (testset)   loss: 0.9361 -> 0.7813  accuracy: 78.18% -> 80.00%     
---------------------------- TRAINING EPOCH: 40 ----------------------------   
client [64] (testset)   loss: 0.6021 -> 0.4809  accuracy: 82.54% -> 84.92%     
client [33] (testset)   loss: 0.2380 -> 0.2356  accuracy: 93.37% -> 93.37%     
client [16] (testset)   loss: 0.4922 -> 0.6946  accuracy: 82.35% -> 79.83%     
client [44] (testset)   loss: 0.6406 -> 2.5020  accuracy: 76.49% -> 54.39%     
client [8]  (testset)   loss: 0.3494 -> 0.2686  accuracy: 86.76% -> 92.65%     
client [31] (testset)   loss: 0.1484 -> 0.1613  accuracy: 97.33% -> 95.19%     
client [47] (testset)   loss: 0.2001 -> 0.1713  accuracy: 93.76% -> 94.33%     
client [36] (testset)   loss: 0.6201 -> 0.3807  accuracy: 79.54% -> 87.64%     
client [20] (testset)   loss: 0.4002 -> 0.3122  accuracy: 90.85% -> 92.25%     
client [56] (testset)   loss: 0.3422 -> 0.3279  accuracy: 89.23% -> 88.46%     
---------------------------- TRAINING EPOCH: 50 ----------------------------   
client [4]  (testset)   loss: 0.3646 -> 0.3467  accuracy: 89.87% -> 91.14%     
client [60] (testset)   loss: 0.4330 -> 0.3221  accuracy: 85.62% -> 93.46%     
client [28] (testset)   loss: 0.1471 -> 0.1650  accuracy: 94.61% -> 92.16%     
client [25] (testset)   loss: 0.7465 -> 0.6239  accuracy: 78.87% -> 88.73%     
client [58] (testset)   loss: 0.3347 -> 0.2851  accuracy: 88.78% -> 90.82%     
client [44] (testset)   loss: 2.5020 -> 0.1722  accuracy: 54.39% -> 93.48%     
client [39] (testset)   loss: 0.3449 -> 0.3003  accuracy: 89.57% -> 90.80%     
client [29] (testset)   loss: 0.2389 -> 0.2910  accuracy: 93.60% -> 87.79%     
client [3]  (testset)   loss: 0.4294 -> 0.4180  accuracy: 85.86% -> 86.87%     
client [84] (testset)   loss: 0.2605 -> 0.2718  accuracy: 92.83% -> 92.38%     
---------------------------- TRAINING EPOCH: 60 ----------------------------   
client [21] (testset)   loss: 0.2844 -> 0.2132  accuracy: 90.91% -> 93.30%     
client [84] (testset)   loss: 0.2507 -> 0.2754  accuracy: 92.83% -> 92.83%     
client [10] (testset)   loss: 0.4362 -> 0.1159  accuracy: 84.31% -> 97.06%     
client [36] (testset)   loss: 0.2634 -> 0.8810  accuracy: 90.73% -> 73.36%     
client [65] (testset)   loss: 0.2071 -> 0.2711  accuracy: 95.74% -> 91.49%     
client [81] (testset)   loss: 0.1916 -> 0.6063  accuracy: 94.19% -> 80.91%     
client [79] (testset)   loss: 0.3498 -> 0.3269  accuracy: 91.84% -> 93.20%     
client [42] (testset)   loss: 0.3530 -> 0.3271  accuracy: 89.90% -> 92.31%     
client [11] (testset)   loss: 0.2376 -> 0.1667  accuracy: 93.72% -> 93.72%     
client [96] (testset)   loss: 0.1710 -> 0.1461  accuracy: 95.09% -> 96.49%     
---------------------------- TRAINING EPOCH: 70 ----------------------------   
client [8]  (testset)   loss: 0.2284 -> 0.2229  accuracy: 92.65% -> 94.12%     
client [53] (testset)   loss: 0.4401 -> 0.4529  accuracy: 85.37% -> 85.37%     
client [52] (testset)   loss: 0.5409 -> 0.3524  accuracy: 85.71% -> 94.81%     
client [42] (testset)   loss: 0.3418 -> 0.3328  accuracy: 91.83% -> 91.83%     
client [69] (testset)   loss: 0.2764 -> 0.2580  accuracy: 92.86% -> 94.29%     
client [59] (testset)   loss: 0.2333 -> 0.2465  accuracy: 94.79% -> 92.71%     
client [7]  (testset)   loss: 0.1067 -> 0.1054  accuracy: 96.00% -> 96.00%     
client [26] (testset)   loss: 1.0143 -> 0.2385  accuracy: 65.85% -> 91.87%     
client [49] (testset)   loss: 0.3348 -> 0.2742  accuracy: 90.44% -> 91.18%     
client [98] (testset)   loss: 0.4270 -> 0.4293  accuracy: 87.62% -> 88.57%     
---------------------------- TRAINING EPOCH: 80 ----------------------------   
client [98] (testset)   loss: 0.4293 -> 0.4567  accuracy: 88.57% -> 87.62%     
client [47] (testset)   loss: 0.1472 -> 0.1328  accuracy: 95.27% -> 95.46%     
client [21] (testset)   loss: 0.1952 -> 0.2019  accuracy: 93.78% -> 92.82%     
client [77] (testset)   loss: 0.5658 -> 0.5461  accuracy: 87.06% -> 88.24%     
client [95] (testset)   loss: 0.2425 -> 0.2587  accuracy: 92.49% -> 92.49%     
client [91] (testset)   loss: 0.1400 -> 0.1563  accuracy: 96.46% -> 94.69%     
client [14] (testset)   loss: 0.2018 -> 0.2269  accuracy: 94.32% -> 92.05%     
client [99] (testset)   loss: 0.3911 -> 0.3566  accuracy: 89.35% -> 89.94%     
client [20] (testset)   loss: 0.3173 -> 0.3182  accuracy: 93.66% -> 92.96%     
client [39] (testset)   loss: 0.2774 -> 0.2307  accuracy: 91.41% -> 91.41%     
---------------------------- TRAINING EPOCH: 90 ----------------------------   
client [52] (testset)   loss: 0.3524 -> 0.3213  accuracy: 94.81% -> 94.81%     
client [62] (testset)   loss: 0.1140 -> 0.1175  accuracy: 96.36% -> 97.58%     
client [71] (testset)   loss: 0.3073 -> 0.3279  accuracy: 91.03% -> 88.46%     
client [97] (testset)   loss: 0.2613 -> 0.2715  accuracy: 91.01% -> 91.57%     
client [30] (testset)   loss: 0.1267 -> 0.1516  accuracy: 96.13% -> 94.19%     
client [88] (testset)   loss: 0.1970 -> 0.2797  accuracy: 93.94% -> 90.91%     
client [60] (testset)   loss: 0.3449 -> 0.3117  accuracy: 94.12% -> 91.50%     
client [82] (testset)   loss: 0.0655 -> 0.0615  accuracy: 97.98% -> 98.48%     
client [91] (testset)   loss: 0.1395 -> 0.1299  accuracy: 96.46% -> 96.46%     
client [57] (testset)   loss: 0.4165 -> 0.4582  accuracy: 89.36% -> 88.30%     
---------------------------- TRAINING EPOCH: 100 ----------------------------  
client [31] (testset)   loss: 0.1704 -> 0.1678  accuracy: 95.19% -> 96.26%     
client [15] (testset)   loss: 0.2691 -> 0.2516  accuracy: 90.97% -> 92.90%     
client [71] (testset)   loss: 0.3279 -> 0.3588  accuracy: 88.46% -> 88.46%     
client [97] (testset)   loss: 0.2715 -> 0.2845  accuracy: 90.45% -> 91.01%     
client [53] (testset)   loss: 0.3291 -> 0.4022  accuracy: 86.99% -> 85.37%     
client [77] (testset)   loss: 0.5461 -> 0.5963  accuracy: 88.24% -> 85.88%     
client [76] (testset)   loss: 0.2372 -> 0.2396  accuracy: 92.35% -> 92.90%     
client [79] (testset)   loss: 0.3267 -> 0.3221  accuracy: 93.20% -> 93.20%     
client [28] (testset)   loss: 0.1062 -> 0.1214  accuracy: 96.08% -> 96.57%     
client [99] (testset)   loss: 0.3586 -> 0.3245  accuracy: 88.76% -> 89.94%     
---------------------------- TRAINING EPOCH: 110 ----------------------------  
client [97] (testset)   loss: 0.2818 -> 0.2839  accuracy: 92.13% -> 91.57%     
client [86] (testset)   loss: 0.3337 -> 0.2985  accuracy: 93.40% -> 93.40%     
client [34] (testset)   loss: 0.1797 -> 0.1889  accuracy: 96.25% -> 95.88%     
client [73] (testset)   loss: 0.1463 -> 0.1611  accuracy: 93.60% -> 93.60%     
client [5]  (testset)   loss: 0.2835 -> 0.2756  accuracy: 90.59% -> 91.18%     
client [96] (testset)   loss: 0.1174 -> 0.1133  accuracy: 97.19% -> 97.54%     
client [22] (testset)   loss: 0.1370 -> 0.1322  accuracy: 97.04% -> 95.56%     
client [60] (testset)   loss: 0.3152 -> 0.3213  accuracy: 93.46% -> 93.46%     
client [66] (testset)   loss: 0.2748 -> 0.2701  accuracy: 90.79% -> 91.63%     
client [83] (testset)   loss: 0.1996 -> 0.1943  accuracy: 94.12% -> 93.28%     
---------------------------- TRAINING EPOCH: 120 ----------------------------  
client [76] (testset)   loss: 0.2597 -> 0.2432  accuracy: 92.90% -> 92.90%     
client [65] (testset)   loss: 0.2067 -> 0.2006  accuracy: 94.89% -> 95.32%     
client [95] (testset)   loss: 0.2510 -> 0.2688  accuracy: 92.49% -> 92.96%     
client [17] (testset)   loss: 0.3276 -> 0.3515  accuracy: 90.32% -> 91.13%     
client [8]  (testset)   loss: 0.2130 -> 0.2348  accuracy: 95.59% -> 94.12%     
client [35] (testset)   loss: 0.4397 -> 0.4428  accuracy: 89.92% -> 89.92%     
client [98] (testset)   loss: 0.5003 -> 0.4660  accuracy: 85.71% -> 88.57%     
client [53] (testset)   loss: 0.3500 -> 0.3306  accuracy: 86.99% -> 88.62%     
client [43] (testset)   loss: 0.3171 -> 0.3310  accuracy: 89.68% -> 89.68%     
client [64] (testset)   loss: 0.4205 -> 0.4095  accuracy: 87.30% -> 87.30%     
---------------------------- TRAINING EPOCH: 130 ----------------------------  
client [21] (testset)   loss: 0.1862 -> 0.1742  accuracy: 94.26% -> 95.69%     
client [88] (testset)   loss: 0.1142 -> 0.1069  accuracy: 95.96% -> 94.95%     
client [38] (testset)   loss: 0.1581 -> 0.1661  accuracy: 95.29% -> 95.29%     
client [3]  (testset)   loss: 0.4819 -> 0.4677  accuracy: 86.87% -> 85.86%     
client [5]  (testset)   loss: 0.2814 -> 0.2817  accuracy: 90.00% -> 90.59%     
client [41] (testset)   loss: 0.2114 -> 0.2064  accuracy: 94.62% -> 94.62%     
client [7]  (testset)   loss: 0.1059 -> 0.0908  accuracy: 97.33% -> 97.33%     
client [37] (testset)   loss: 0.2626 -> 0.2555  accuracy: 92.56% -> 94.21%     
client [45] (testset)   loss: 0.1458 -> 0.1522  accuracy: 95.77% -> 95.77%     
client [47] (testset)   loss: 0.1500 -> 0.1422  accuracy: 95.27% -> 95.27%     
---------------------------- TRAINING EPOCH: 140 ----------------------------  
client [16] (testset)   loss: 0.4126 -> 0.4286  accuracy: 88.24% -> 86.55%     
client [11] (testset)   loss: 0.1380 -> 0.1445  accuracy: 95.52% -> 95.52%     
client [37] (testset)   loss: 0.3341 -> 0.2464  accuracy: 89.26% -> 93.39%     
client [41] (testset)   loss: 0.2064 -> 0.2090  accuracy: 94.62% -> 94.62%     
client [95] (testset)   loss: 0.2749 -> 0.2724  accuracy: 92.49% -> 92.96%     
client [53] (testset)   loss: 0.3306 -> 0.3668  accuracy: 88.62% -> 87.80%     
client [22] (testset)   loss: 0.1259 -> 0.1132  accuracy: 96.30% -> 97.04%     
client [25] (testset)   loss: 0.5662 -> 0.5978  accuracy: 91.55% -> 91.55%     
client [69] (testset)   loss: 0.2820 -> 0.2846  accuracy: 95.00% -> 95.00%     
client [46] (testset)   loss: 0.3426 -> 0.3564  accuracy: 90.83% -> 89.91%     
---------------------------- TRAINING EPOCH: 150 ----------------------------  
client [47] (testset)   loss: 0.1455 -> 0.1472  accuracy: 95.46% -> 95.84%     
client [69] (testset)   loss: 0.2819 -> 0.2880  accuracy: 95.71% -> 95.00%     
client [82] (testset)   loss: 0.0623 -> 0.0631  accuracy: 97.98% -> 98.23%     
client [45] (testset)   loss: 0.1411 -> 0.1459  accuracy: 96.48% -> 95.77%     
client [7]  (testset)   loss: 0.0908 -> 0.0930  accuracy: 97.33% -> 97.33%     
client [50] (testset)   loss: 0.4442 -> 0.4220  accuracy: 89.89% -> 91.01%     
client [35] (testset)   loss: 0.4493 -> 0.4567  accuracy: 90.76% -> 90.76%     
client [24] (testset)   loss: 0.3288 -> 0.3407  accuracy: 94.74% -> 94.21%     
client [15] (testset)   loss: 0.2202 -> 0.2198  accuracy: 93.55% -> 94.19%     
client [58] (testset)   loss: 0.3430 -> 0.3553  accuracy: 91.33% -> 90.82%     
---------------------------- TRAINING EPOCH: 160 ----------------------------  
client [48] (testset)   loss: 0.1476 -> 0.1493  accuracy: 96.45% -> 96.45%     
client [76] (testset)   loss: 0.2510 -> 0.2577  accuracy: 92.90% -> 92.90%     
client [67] (testset)   loss: 0.1701 -> 0.1878  accuracy: 95.43% -> 93.14%     
client [37] (testset)   loss: 0.2298 -> 0.2362  accuracy: 93.39% -> 93.39%     
client [58] (testset)   loss: 0.3251 -> 0.3434  accuracy: 91.33% -> 91.33%     
client [64] (testset)   loss: 0.4214 -> 0.4311  accuracy: 88.10% -> 87.30%     
client [77] (testset)   loss: 0.6348 -> 0.6659  accuracy: 85.88% -> 85.88%     
client [55] (testset)   loss: 0.1043 -> 0.1067  accuracy: 96.80% -> 96.80%     
client [12] (testset)   loss: 0.1935 -> 0.1896  accuracy: 94.33% -> 95.74%     
client [89] (testset)   loss: 0.2692 -> 0.2269  accuracy: 93.22% -> 95.34%     
---------------------------- TRAINING EPOCH: 170 ----------------------------  
client [84] (testset)   loss: 0.3325 -> 0.3347  accuracy: 93.72% -> 93.72%     
client [51] (testset)   loss: 0.1357 -> 0.1368  accuracy: 95.02% -> 95.02%     
client [8]  (testset)   loss: 0.2509 -> 0.2442  accuracy: 92.65% -> 92.65%     
client [18] (testset)   loss: 0.2221 -> 0.2173  accuracy: 94.12% -> 92.65%     
client [94] (testset)   loss: 0.2440 -> 0.2464  accuracy: 92.07% -> 91.46%     
client [81] (testset)   loss: 0.1718 -> 0.1757  accuracy: 94.61% -> 94.61%     
client [3]  (testset)   loss: 0.4968 -> 0.4908  accuracy: 85.86% -> 85.86%     
client [11] (testset)   loss: 0.1407 -> 0.1435  accuracy: 95.07% -> 95.07%     
client [95] (testset)   loss: 0.2902 -> 0.2889  accuracy: 92.96% -> 92.96%     
client [67] (testset)   loss: 0.1878 -> 0.1745  accuracy: 93.14% -> 94.29%     
---------------------------- TRAINING EPOCH: 180 ----------------------------  
client [21] (testset)   loss: 0.1783 -> 0.1695  accuracy: 95.22% -> 94.74%     
client [79] (testset)   loss: 0.3851 -> 0.3941  accuracy: 94.56% -> 93.88%     
client [58] (testset)   loss: 0.3509 -> 0.3592  accuracy: 91.33% -> 91.33%     
client [88] (testset)   loss: 0.1057 -> 0.1127  accuracy: 95.96% -> 95.96%     
client [46] (testset)   loss: 0.3677 -> 0.3761  accuracy: 91.74% -> 91.74%     
client [11] (testset)   loss: 0.1435 -> 0.1522  accuracy: 95.07% -> 94.62%     
client [55] (testset)   loss: 0.1073 -> 0.1086  accuracy: 96.80% -> 96.80%     
client [13] (testset)   loss: 0.3166 -> 0.3302  accuracy: 93.81% -> 93.50%     
client [31] (testset)   loss: 0.1701 -> 0.1747  accuracy: 96.79% -> 95.72%     
client [75] (testset)   loss: 0.3812 -> 0.4049  accuracy: 84.62% -> 84.62%     
---------------------------- TRAINING EPOCH: 190 ----------------------------  
client [19] (testset)   loss: 0.2295 -> 0.2279  accuracy: 91.95% -> 91.95%     
client [7]  (testset)   loss: 0.0817 -> 0.0830  accuracy: 97.33% -> 97.33%     
client [57] (testset)   loss: 0.4224 -> 0.4303  accuracy: 92.55% -> 92.55%     
client [13] (testset)   loss: 0.3315 -> 0.3316  accuracy: 93.50% -> 93.50%     
client [43] (testset)   loss: 0.3438 -> 0.3527  accuracy: 90.48% -> 90.48%     
client [91] (testset)   loss: 0.1380 -> 0.1328  accuracy: 96.46% -> 96.46%     
client [10] (testset)   loss: 0.0940 -> 0.0939  accuracy: 97.55% -> 97.06%     
client [64] (testset)   loss: 0.4365 -> 0.4411  accuracy: 88.10% -> 88.89%     
client [82] (testset)   loss: 0.0641 -> 0.0650  accuracy: 98.48% -> 98.23%     
client [22] (testset)   loss: 0.1165 -> 0.1218  accuracy: 96.30% -> 96.30%     
---------------------------- TRAINING EPOCH: 200 ----------------------------  
client [20] (testset)   loss: 0.3811 -> 0.3707  accuracy: 93.66% -> 93.66%     
client [23] (testset)   loss: 0.1798 -> 0.1642  accuracy: 93.04% -> 93.04%     
client [88] (testset)   loss: 0.1127 -> 0.1063  accuracy: 95.96% -> 94.95%     
client [98] (testset)   loss: 0.4820 -> 0.4875  accuracy: 89.52% -> 89.52%     
client [79] (testset)   loss: 0.3980 -> 0.4010  accuracy: 93.88% -> 93.88%     
client [21] (testset)   loss: 0.1509 -> 0.1555  accuracy: 95.22% -> 94.74%     
client [92] (testset)   loss: 0.1919 -> 0.1745  accuracy: 92.98% -> 92.98%     
client [56] (testset)   loss: 0.2021 -> 0.2031  accuracy: 95.38% -> 95.38%     
client [5]  (testset)   loss: 0.2949 -> 0.2943  accuracy: 91.18% -> 91.18%     
client [52] (testset)   loss: 0.3901 -> 0.3970  accuracy: 93.51% -> 94.81%     
---------------------------- TRAINING EPOCH: 210 ----------------------------  
client [67] (testset)   loss: 0.1941 -> 0.1922  accuracy: 94.29% -> 94.29%     
client [54] (testset)   loss: 0.2615 -> 0.2624  accuracy: 94.25% -> 94.25%     
client [14] (testset)   loss: 0.2231 -> 0.2328  accuracy: 94.89% -> 95.45%     
client [99] (testset)   loss: 0.3477 -> 0.3380  accuracy: 88.76% -> 89.94%     
client [36] (testset)   loss: 0.2639 -> 0.2689  accuracy: 93.82% -> 94.21%     
client [30] (testset)   loss: 0.1228 -> 0.1235  accuracy: 96.77% -> 96.13%     
client [38] (testset)   loss: 0.1754 -> 0.1703  accuracy: 95.29% -> 95.29%     
client [15] (testset)   loss: 0.2174 -> 0.2165  accuracy: 93.55% -> 93.55%     
client [6]  (testset)   loss: 0.2647 -> 0.2610  accuracy: 91.45% -> 91.45%     
client [53] (testset)   loss: 0.4013 -> 0.4105  accuracy: 88.62% -> 88.62%     
---------------------------- TRAINING EPOCH: 220 ----------------------------  
client [99] (testset)   loss: 0.3456 -> 0.3482  accuracy: 90.53% -> 90.53%     
client [6]  (testset)   loss: 0.2610 -> 0.2651  accuracy: 91.45% -> 92.76%     
client [83] (testset)   loss: 0.2048 -> 0.2125  accuracy: 95.80% -> 95.80%     
client [42] (testset)   loss: 0.3916 -> 0.3940  accuracy: 91.83% -> 92.31%     
client [34] (testset)   loss: 0.2070 -> 0.2104  accuracy: 95.88% -> 95.88%     
client [15] (testset)   loss: 0.2165 -> 0.2130  accuracy: 93.55% -> 92.90%     
client [47] (testset)   loss: 0.1577 -> 0.1572  accuracy: 95.46% -> 95.46%     
client [55] (testset)   loss: 0.1102 -> 0.1076  accuracy: 96.80% -> 96.80%     
client [51] (testset)   loss: 0.1391 -> 0.1427  accuracy: 95.02% -> 95.02%     
client [95] (testset)   loss: 0.2963 -> 0.2999  accuracy: 92.96% -> 92.96%     
---------------------------- TRAINING EPOCH: 230 ----------------------------  
client [71] (testset)   loss: 0.3580 -> 0.3482  accuracy: 91.03% -> 91.03%     
client [15] (testset)   loss: 0.2130 -> 0.2165  accuracy: 92.90% -> 92.90%     
client [33] (testset)   loss: 0.2263 -> 0.2266  accuracy: 93.37% -> 93.37%     
client [99] (testset)   loss: 0.3566 -> 0.3582  accuracy: 90.53% -> 89.94%     
client [90] (testset)   loss: 0.2317 -> 0.2302  accuracy: 94.96% -> 94.96%     
client [57] (testset)   loss: 0.4593 -> 0.4626  accuracy: 91.49% -> 91.49%     
client [27] (testset)   loss: 0.1242 -> 0.1231  accuracy: 96.95% -> 97.46%     
client [78] (testset)   loss: 0.2604 -> 0.2777  accuracy: 91.57% -> 91.57%     
client [36] (testset)   loss: 0.2690 -> 0.2700  accuracy: 93.05% -> 93.82%     
client [88] (testset)   loss: 0.1097 -> 0.1117  accuracy: 94.95% -> 94.95%     
---------------------------- TRAINING EPOCH: 240 ----------------------------  
client [70] (testset)   loss: 0.9659 -> 0.9747  accuracy: 75.68% -> 75.68%     
client [35] (testset)   loss: 0.4799 -> 0.4825  accuracy: 90.76% -> 90.76%     
client [16] (testset)   loss: 0.4921 -> 0.4978  accuracy: 87.39% -> 87.39%     
client [80] (testset)   loss: 0.3926 -> 0.3630  accuracy: 92.31% -> 92.31%     
client [38] (testset)   loss: 0.1716 -> 0.1772  accuracy: 95.29% -> 95.29%     
client [78] (testset)   loss: 0.2759 -> 0.2743  accuracy: 91.57% -> 91.57%     
client [68] (testset)   loss: 0.0985 -> 0.1044  accuracy: 97.32% -> 96.88%     
client [11] (testset)   loss: 0.1485 -> 0.1507  accuracy: 95.52% -> 95.07%     
client [64] (testset)   loss: 0.4547 -> 0.4569  accuracy: 88.89% -> 88.89%     
client [82] (testset)   loss: 0.0674 -> 0.0698  accuracy: 98.23% -> 97.98%     
---------------------------- TRAINING EPOCH: 250 ----------------------------  
client [30] (testset)   loss: 0.1252 -> 0.1252  accuracy: 96.13% -> 96.13%     
client [27] (testset)   loss: 0.1231 -> 0.1286  accuracy: 97.46% -> 96.95%     
client [74] (testset)   loss: 0.1518 -> 0.1479  accuracy: 95.45% -> 95.45%     
client [45] (testset)   loss: 0.1545 -> 0.1564  accuracy: 96.48% -> 96.48%     
client [6]  (testset)   loss: 0.2653 -> 0.2602  accuracy: 91.45% -> 91.45%     
client [36] (testset)   loss: 0.2723 -> 0.2735  accuracy: 93.82% -> 93.05%     
client [63] (testset)   loss: 0.2844 -> 0.2873  accuracy: 93.06% -> 92.59%     
client [76] (testset)   loss: 0.2748 -> 0.2752  accuracy: 92.90% -> 92.90%     
client [83] (testset)   loss: 0.2070 -> 0.2029  accuracy: 95.80% -> 95.80%     
client [86] (testset)   loss: 0.3706 -> 0.3829  accuracy: 93.91% -> 93.40%     
---------------------------- TRAINING EPOCH: 260 ----------------------------  
client [83] (testset)   loss: 0.2029 -> 0.2087  accuracy: 95.80% -> 95.80%     
client [99] (testset)   loss: 0.3525 -> 0.3580  accuracy: 91.12% -> 90.53%     
client [74] (testset)   loss: 0.1466 -> 0.1523  accuracy: 95.45% -> 95.45%     
client [73] (testset)   loss: 0.1310 -> 0.1499  accuracy: 94.77% -> 94.77%     
client [29] (testset)   loss: 0.1037 -> 0.0955  accuracy: 97.09% -> 97.09%     
client [92] (testset)   loss: 0.1918 -> 0.1921  accuracy: 92.98% -> 92.98%     
client [6]  (testset)   loss: 0.2681 -> 0.2551  accuracy: 91.45% -> 91.45%     
client [61] (testset)   loss: 0.2128 -> 0.2185  accuracy: 95.60% -> 94.97%     
client [21] (testset)   loss: 0.1630 -> 0.1601  accuracy: 95.22% -> 95.69%     
client [67] (testset)   loss: 0.2047 -> 0.1995  accuracy: 94.29% -> 94.29%     
---------------------------- TRAINING EPOCH: 270 ----------------------------  
client [83] (testset)   loss: 0.2087 -> 0.2098  accuracy: 95.80% -> 95.80%     
client [32] (testset)   loss: 0.2684 -> 0.2689  accuracy: 91.67% -> 92.42%     
client [95] (testset)   loss: 0.2999 -> 0.3039  accuracy: 92.96% -> 92.96%     
client [61] (testset)   loss: 0.2188 -> 0.2164  accuracy: 95.60% -> 94.34%     
client [27] (testset)   loss: 0.1286 -> 0.1275  accuracy: 96.95% -> 97.46%     
client [25] (testset)   loss: 0.6702 -> 0.6866  accuracy: 91.55% -> 90.14%     
client [68] (testset)   loss: 0.1011 -> 0.1068  accuracy: 97.32% -> 96.88%     
client [34] (testset)   loss: 0.2114 -> 0.2160  accuracy: 95.88% -> 95.88%     
client [71] (testset)   loss: 0.3801 -> 0.3702  accuracy: 92.31% -> 92.31%     
client [89] (testset)   loss: 0.2316 -> 0.2285  accuracy: 94.49% -> 94.49%     
---------------------------- TRAINING EPOCH: 280 ----------------------------  
client [78] (testset)   loss: 0.2880 -> 0.2934  accuracy: 91.57% -> 91.57%     
client [81] (testset)   loss: 0.1818 -> 0.1827  accuracy: 94.61% -> 94.61%     
client [51] (testset)   loss: 0.1482 -> 0.1456  accuracy: 95.02% -> 95.02%     
client [54] (testset)   loss: 0.2689 -> 0.2728  accuracy: 94.25% -> 94.25%     
client [65] (testset)   loss: 0.2235 -> 0.2223  accuracy: 95.32% -> 95.32%     
client [41] (testset)   loss: 0.2412 -> 0.2434  accuracy: 95.07% -> 94.62%     
client [11] (testset)   loss: 0.1507 -> 0.1553  accuracy: 95.07% -> 95.07%     
client [85] (testset)   loss: 0.1950 -> 0.1980  accuracy: 95.13% -> 95.13%     
client [12] (testset)   loss: 0.1904 -> 0.1914  accuracy: 95.74% -> 95.04%     
client [23] (testset)   loss: 0.1752 -> 0.1707  accuracy: 93.04% -> 93.04%     
---------------------------- TRAINING EPOCH: 290 ----------------------------  
client [16] (testset)   loss: 0.5012 -> 0.5044  accuracy: 87.39% -> 87.39%     
client [65] (testset)   loss: 0.2247 -> 0.2265  accuracy: 95.32% -> 95.32%     
client [53] (testset)   loss: 0.4443 -> 0.4543  accuracy: 88.62% -> 88.62%     
client [58] (testset)   loss: 0.3682 -> 0.3742  accuracy: 91.33% -> 91.33%     
client [72] (testset)   loss: 0.0961 -> 0.0906  accuracy: 97.52% -> 98.14%     
client [7]  (testset)   loss: 0.1015 -> 0.0871  accuracy: 97.33% -> 97.33%     
client [71] (testset)   loss: 0.3702 -> 0.3784  accuracy: 92.31% -> 92.31%     
client [59] (testset)   loss: 0.3001 -> 0.3062  accuracy: 94.79% -> 94.79%     
client [86] (testset)   loss: 0.3779 -> 0.3833  accuracy: 93.91% -> 93.91%     
client [39] (testset)   loss: 0.2673 -> 0.2871  accuracy: 92.64% -> 92.02%     
---------------------------- TRAINING EPOCH: 300 ----------------------------  
client [99] (testset)   loss: 0.3628 -> 0.3640  accuracy: 89.94% -> 89.94%     
client [7]  (testset)   loss: 0.0845 -> 0.0799  accuracy: 97.78% -> 97.78%     
client [17] (testset)   loss: 0.4272 -> 0.4309  accuracy: 91.94% -> 91.13%     
client [64] (testset)   loss: 0.4761 -> 0.4786  accuracy: 89.68% -> 89.68%     
client [37] (testset)   loss: 0.2473 -> 0.2501  accuracy: 94.21% -> 93.39%     
client [29] (testset)   loss: 0.0954 -> 0.0905  accuracy: 97.09% -> 97.09%     
client [93] (testset)   loss: 0.2623 -> 0.2654  accuracy: 94.33% -> 94.33%     
client [73] (testset)   loss: 0.1398 -> 0.1497  accuracy: 95.35% -> 95.35%     
client [40] (testset)   loss: 0.1587 -> 0.1623  accuracy: 97.28% -> 97.62%     
client [76] (testset)   loss: 0.2766 -> 0.2803  accuracy: 93.44% -> 92.90%     
---------------------------- TRAINING EPOCH: 310 ----------------------------  
client [31] (testset)   loss: 0.1851 -> 0.1839  accuracy: 95.72% -> 95.72%     
client [89] (testset)   loss: 0.2406 -> 0.2309  accuracy: 94.92% -> 94.49%     
client [77] (testset)   loss: 0.8268 -> 0.8133  accuracy: 87.06% -> 85.88%     
client [90] (testset)   loss: 0.2552 -> 0.2546  accuracy: 94.96% -> 94.96%     
client [26] (testset)   loss: 0.2222 -> 0.2330  accuracy: 93.50% -> 93.50%     
client [50] (testset)   loss: 0.4686 -> 0.4938  accuracy: 93.26% -> 92.13%     
client [30] (testset)   loss: 0.1272 -> 0.1257  accuracy: 96.13% -> 96.13%     
client [70] (testset)   loss: 0.9959 -> 0.9997  accuracy: 75.68% -> 75.68%     
client [41] (testset)   loss: 0.2442 -> 0.2455  accuracy: 95.07% -> 94.62%     
client [99] (testset)   loss: 0.3640 -> 0.3640  accuracy: 89.94% -> 89.94%     
---------------------------- TRAINING EPOCH: 320 ----------------------------  
client [68] (testset)   loss: 0.1081 -> 0.1030  accuracy: 96.43% -> 97.32%     
client [70] (testset)   loss: 1.0154 -> 1.0196  accuracy: 75.68% -> 75.68%     
client [52] (testset)   loss: 0.4318 -> 0.4335  accuracy: 94.81% -> 94.81%     
client [1]  (testset)   loss: 0.4695 -> 0.4732  accuracy: 90.96% -> 90.96%     
client [2]  (testset)   loss: 0.1371 -> 0.1360  accuracy: 96.10% -> 96.43%     
client [67] (testset)   loss: 0.2099 -> 0.2071  accuracy: 94.86% -> 94.86%     
client [92] (testset)   loss: 0.1925 -> 0.2029  accuracy: 92.98% -> 92.98%     
client [35] (testset)   loss: 0.4888 -> 0.5003  accuracy: 90.76% -> 90.76%     
client [36] (testset)   loss: 0.2847 -> 0.2860  accuracy: 93.05% -> 93.05%     
client [64] (testset)   loss: 0.4797 -> 0.4817  accuracy: 88.89% -> 89.68%     
---------------------------- TRAINING EPOCH: 330 ----------------------------  
client [44] (testset)   loss: 0.0954 -> 0.0955  accuracy: 97.45% -> 97.45%     
client [6]  (testset)   loss: 0.2786 -> 0.2755  accuracy: 92.11% -> 92.11%     
client [12] (testset)   loss: 0.1911 -> 0.1899  accuracy: 95.74% -> 95.74%     
client [55] (testset)   loss: 0.1122 -> 0.1125  accuracy: 97.07% -> 97.07%     
client [29] (testset)   loss: 0.0889 -> 0.0918  accuracy: 97.09% -> 97.09%     
client [9]  (testset)   loss: 0.7747 -> 0.7801  accuracy: 87.27% -> 87.27%     
client [43] (testset)   loss: 0.3770 -> 0.3773  accuracy: 91.27% -> 90.48%     
client [77] (testset)   loss: 0.8133 -> 0.8234  accuracy: 85.88% -> 87.06%     
client [98] (testset)   loss: 0.5217 -> 0.5247  accuracy: 89.52% -> 89.52%     
client [78] (testset)   loss: 0.2907 -> 0.2925  accuracy: 91.57% -> 91.57%     
---------------------------- TRAINING EPOCH: 340 ----------------------------  
client [92] (testset)   loss: 0.2021 -> 0.2025  accuracy: 92.98% -> 92.98%     
client [80] (testset)   loss: 0.3753 -> 0.3654  accuracy: 92.31% -> 93.59%     
client [63] (testset)   loss: 0.3040 -> 0.3081  accuracy: 93.06% -> 93.06%     
client [76] (testset)   loss: 0.2838 -> 0.2846  accuracy: 93.99% -> 92.90%     
client [78] (testset)   loss: 0.2925 -> 0.2969  accuracy: 91.57% -> 91.57%     
client [25] (testset)   loss: 0.7092 -> 0.7216  accuracy: 91.55% -> 91.55%     
client [58] (testset)   loss: 0.3809 -> 0.3826  accuracy: 91.33% -> 91.33%     
client [13] (testset)   loss: 0.3596 -> 0.3607  accuracy: 93.50% -> 93.50%     
client [17] (testset)   loss: 0.4434 -> 0.4423  accuracy: 91.94% -> 91.94%     
client [38] (testset)   loss: 0.1938 -> 0.1944  accuracy: 95.29% -> 95.29%     
---------------------------- TRAINING EPOCH: 350 ----------------------------  
client [72] (testset)   loss: 0.0953 -> 0.0949  accuracy: 98.14% -> 98.45%     
client [82] (testset)   loss: 0.0698 -> 0.0720  accuracy: 98.23% -> 97.98%     
client [86] (testset)   loss: 0.3989 -> 0.3995  accuracy: 93.91% -> 93.91%     
client [51] (testset)   loss: 0.1502 -> 0.1499  accuracy: 95.02% -> 95.02%     
client [96] (testset)   loss: 0.1234 -> 0.1227  accuracy: 97.19% -> 97.54%     
client [42] (testset)   loss: 0.4156 -> 0.4127  accuracy: 92.31% -> 92.31%     
client [55] (testset)   loss: 0.1131 -> 0.1143  accuracy: 97.07% -> 97.07%     
client [13] (testset)   loss: 0.3637 -> 0.3657  accuracy: 93.50% -> 93.50%     
client [1]  (testset)   loss: 0.4883 -> 0.4830  accuracy: 90.96% -> 90.96%     
client [12] (testset)   loss: 0.1899 -> 0.1935  accuracy: 95.74% -> 95.04%     
---------------------------- TRAINING EPOCH: 360 ----------------------------  
client [68] (testset)   loss: 0.1066 -> 0.1064  accuracy: 96.43% -> 96.88%     
client [23] (testset)   loss: 0.1760 -> 0.1759  accuracy: 93.04% -> 93.04%     
client [46] (testset)   loss: 0.4500 -> 0.4445  accuracy: 89.91% -> 91.74%     
client [41] (testset)   loss: 0.2509 -> 0.2539  accuracy: 94.62% -> 94.62%     
client [25] (testset)   loss: 0.7410 -> 0.7426  accuracy: 90.14% -> 90.14%     
client [58] (testset)   loss: 0.3763 -> 0.3818  accuracy: 91.33% -> 91.33%     
client [14] (testset)   loss: 0.2528 -> 0.2558  accuracy: 94.89% -> 94.89%     
client [33] (testset)   loss: 0.2327 -> 0.2326  accuracy: 93.37% -> 93.37%     
client [85] (testset)   loss: 0.2034 -> 0.2044  accuracy: 95.13% -> 95.13%     
client [62] (testset)   loss: 0.1290 -> 0.1306  accuracy: 95.76% -> 95.76%     
---------------------------- TRAINING EPOCH: 370 ----------------------------  
client [98] (testset)   loss: 0.5364 -> 0.5379  accuracy: 89.52% -> 89.52%     
client [63] (testset)   loss: 0.3123 -> 0.3105  accuracy: 93.06% -> 93.06%     
client [70] (testset)   loss: 1.0425 -> 1.0492  accuracy: 75.68% -> 75.68%     
client [65] (testset)   loss: 0.2292 -> 0.2351  accuracy: 95.32% -> 95.32%     
client [14] (testset)   loss: 0.2503 -> 0.2547  accuracy: 95.45% -> 94.89%     
client [73] (testset)   loss: 0.1468 -> 0.1520  accuracy: 93.60% -> 95.35%     
client [34] (testset)   loss: 0.2287 -> 0.2283  accuracy: 95.88% -> 95.88%     
client [99] (testset)   loss: 0.3699 -> 0.3684  accuracy: 89.94% -> 89.94%     
client [69] (testset)   loss: 0.3157 -> 0.3167  accuracy: 95.00% -> 95.00%     
client [46] (testset)   loss: 0.4445 -> 0.4465  accuracy: 91.74% -> 91.74%     
---------------------------- TRAINING EPOCH: 380 ----------------------------  
client [99] (testset)   loss: 0.3736 -> 0.3754  accuracy: 89.94% -> 89.94%     
client [93] (testset)   loss: 0.2737 -> 0.2738  accuracy: 94.33% -> 94.33%     
client [11] (testset)   loss: 0.1595 -> 0.1585  accuracy: 95.52% -> 95.52%     
client [58] (testset)   loss: 0.3891 -> 0.3887  accuracy: 91.33% -> 91.33%     
client [81] (testset)   loss: 0.1894 -> 0.1893  accuracy: 94.61% -> 94.61%     
client [85] (testset)   loss: 0.2044 -> 0.2031  accuracy: 95.13% -> 95.13%     
client [89] (testset)   loss: 0.2416 -> 0.2405  accuracy: 94.49% -> 94.49%     
client [45] (testset)   loss: 0.1627 -> 0.1646  accuracy: 96.48% -> 96.48%     
client [8]  (testset)   loss: 0.2756 -> 0.2776  accuracy: 92.65% -> 92.65%     
client [68] (testset)   loss: 0.1045 -> 0.1042  accuracy: 96.88% -> 97.32%     
---------------------------- TRAINING EPOCH: 390 ----------------------------  
client [67] (testset)   loss: 0.2121 -> 0.2147  accuracy: 94.86% -> 94.86%     
client [72] (testset)   loss: 0.0945 -> 0.0954  accuracy: 98.14% -> 98.14%     
client [1]  (testset)   loss: 0.4982 -> 0.4973  accuracy: 90.96% -> 90.96%     
client [78] (testset)   loss: 0.3026 -> 0.3055  accuracy: 91.57% -> 91.57%     
client [83] (testset)   loss: 0.2164 -> 0.2165  accuracy: 95.80% -> 95.80%     
client [21] (testset)   loss: 0.1685 -> 0.1711  accuracy: 95.22% -> 94.74%     
client [56] (testset)   loss: 0.2191 -> 0.2196  accuracy: 95.38% -> 95.38%     
client [44] (testset)   loss: 0.1036 -> 0.1033  accuracy: 97.45% -> 97.45%     
client [92] (testset)   loss: 0.2055 -> 0.2059  accuracy: 92.98% -> 92.98%     
client [27] (testset)   loss: 0.1330 -> 0.1311  accuracy: 97.46% -> 97.46%     
---------------------------- TRAINING EPOCH: 400 ----------------------------  
client [10] (testset)   loss: 0.1069 -> 0.1053  accuracy: 97.55% -> 97.55%     
client [39] (testset)   loss: 0.2852 -> 0.2788  accuracy: 92.64% -> 92.64%     
client [65] (testset)   loss: 0.2323 -> 0.2350  accuracy: 95.32% -> 95.32%     
client [26] (testset)   loss: 0.2448 -> 0.2398  accuracy: 93.50% -> 95.12%     
client [19] (testset)   loss: 0.2487 -> 0.2459  accuracy: 90.80% -> 90.80%     
client [68] (testset)   loss: 0.1040 -> 0.1074  accuracy: 96.88% -> 96.88%     
client [41] (testset)   loss: 0.2566 -> 0.2575  accuracy: 94.62% -> 94.62%     
client [50] (testset)   loss: 0.5115 -> 0.5115  accuracy: 92.13% -> 92.13%     
client [75] (testset)   loss: 0.4461 -> 0.4509  accuracy: 84.62% -> 84.62%     
client [81] (testset)   loss: 0.1904 -> 0.1907  accuracy: 94.61% -> 94.61%     
Training... ---------------------------------------- 100% 0:12:31
Local-only's average time taken by each global epoch: 0 min 1.87 sec.          
Local-only's total running time: 0 h 12 m 31 s.                                
==================== Local-only Experiment Results: ====================       
Display format: (before local fine-tuning) -> (after local fine-tuning)        
 So if finetune_epoch = 0, x.xx% -> 0.00% is normal.                           
 Centralized testing ONLY happens after model aggregation, so the stats between
'->' are the same.                                                             
{                                                                              
    "100": {                                                                   
        "all_clients": {                                                       
            "test": {                                                          
                "loss": "0.2255 -> 0.0000",                                    
                "accuracy": "93.51% -> 0.00%"                                  
            }                                                                  
        }                                                                      
    },                                                                         
    "200": {                                                                   
        "all_clients": {                                                       
            "test": {                                                          
                "loss": "0.2324 -> 0.0000",                                    
                "accuracy": "94.27% -> 0.00%"                                  
            }                                                                  
        }                                                                      
    },                                                                         
    "300": {                                                                   
        "all_clients": {                                                       
            "test": {                                                          
                "loss": "0.2481 -> 0.0000",                                    
                "accuracy": "94.27% -> 0.00%"                                  
            }                                                                  
        }                                                                      
    },                                                                         
    "400": {                                                                   
        "all_clients": {                                                       
            "test": {                                                          
                "loss": "0.2591 -> 0.0000",                                    
                "accuracy": "94.35% -> 0.00%"                                  
            }                                                                  
        }                                                                      
    }                                                                          
}                                                                              
==================== Local-only Max Accuracy ====================              
all_clients:                                                                   
(test) before fine-tuning: 94.35% at epoch 400                                 
(test) after fine-tuning: 0.00% at epoch 100                                   
[0m