==================== Local-only ====================                           
Experiment Arguments:                                                          
{
│   'method': 'local',
│   'dataset': {
│   │   'name': 'cifar10',
│   │   'client_num': 100,
│   │   'test_ratio': 0.25,
│   │   'val_ratio': 0.0,
│   │   'seed': 42,
│   │   'split': 'sample',
│   │   'IID_ratio': 0.0,
│   │   'monitor_window_name_suffix': 'cifar10-100clients-0%IID-Dir(0.5)-seed42',
│   │   'alpha': 0.5,
│   │   'min_samples_per_client': 10
│   },
│   'model': {
│   │   'name': 'avgcnn',
│   │   'use_torchvision_pretrained_weights': True,
│   │   'external_model_weights_path': None
│   },
│   'optimizer': {
│   │   'lr': 0.01,
│   │   'dampening': 0,
│   │   'weight_decay': 0,
│   │   'momentum': 0,
│   │   'nesterov': False,
│   │   'name': 'sgd'
│   },
│   'mode': 'serial',
│   'parallel': {
│   │   'ray_cluster_addr': None,
│   │   'num_cpus': None,
│   │   'num_gpus': None,
│   │   'num_workers': 2
│   },
│   'common': {
│   │   'seed': 42,
│   │   'join_ratio': 0.1,
│   │   'global_epoch': 400,
│   │   'local_epoch': 5,
│   │   'batch_size': 32,
│   │   'reset_optimizer_on_global_epoch': True,
│   │   'straggler_ratio': 0,
│   │   'straggler_min_local_epoch': 0,
│   │   'buffers': 'global',
│   │   'client_side_evaluation': True,
│   │   'test': {
│   │   │   'client': {
│   │   │   │   'interval': 100,
│   │   │   │   'finetune_epoch': 0,
│   │   │   │   'train': False,
│   │   │   │   'val': False,
│   │   │   │   'test': True
│   │   │   },
│   │   │   'server': {
│   │   │   │   'interval': -1,
│   │   │   │   'train': False,
│   │   │   │   'val': False,
│   │   │   │   'test': False,
│   │   │   │   'model_in_train_mode': False
│   │   │   }
│   │   },
│   │   'verbose_gap': 10,
│   │   'monitor': None,
│   │   'use_cuda': True,
│   │   'save_log': True,
│   │   'save_model': False,
│   │   'save_learning_curve_plot': False,
│   │   'save_metrics': True,
│   │   'delete_useless_run': True
│   }
}
---------------------------- TRAINING EPOCH: 10 ----------------------------   
client [77] (testset)   loss: 1.7354 -> 1.6374  accuracy: 36.72% -> 41.24%     
client [81] (testset)   loss: 1.5419 -> 1.5662  accuracy: 48.57% -> 49.52%     
client [21] (testset)   loss: 2.3130 -> 1.6887  accuracy: 9.86% -> 38.03%      
client [68] (testset)   loss: 1.5705 -> 1.5002  accuracy: 46.48% -> 50.70%     
client [93] (testset)   loss: 1.7230 -> 1.5968  accuracy: 41.89% -> 42.26%     
client [31] (testset)   loss: 1.4303 -> 1.6679  accuracy: 54.64% -> 32.50%     
client [20] (testset)   loss: 1.6597 -> 1.5628  accuracy: 37.66% -> 44.16%     
client [59] (testset)   loss: 2.2814 -> 1.7763  accuracy: 25.48% -> 36.31%     
client [48] (testset)   loss: 2.0538 -> 2.0447  accuracy: 29.03% -> 37.10%     
client [34] (testset)   loss: 1.5315 -> 1.3379  accuracy: 35.11% -> 43.56%     
---------------------------- TRAINING EPOCH: 20 ----------------------------   
client [69] (testset)   loss: 1.5583 -> 1.5354  accuracy: 49.67% -> 47.68%     
client [99] (testset)   loss: 1.9129 -> 1.9092  accuracy: 26.49% -> 28.65%     
client [67] (testset)   loss: 1.6470 -> 1.4808  accuracy: 36.80% -> 47.62%     
client [0]  (testset)   loss: 1.7812 -> 1.5335  accuracy: 30.23% -> 47.29%     
client [76] (testset)   loss: 1.0830 -> 1.0269  accuracy: 58.79% -> 64.85%     
client [41] (testset)   loss: 1.3802 -> 1.2623  accuracy: 52.45% -> 63.64%     
client [62] (testset)   loss: 2.2708 -> 1.4790  accuracy: 22.22% -> 42.42%     
client [2]  (testset)   loss: 2.3146 -> 2.0474  accuracy: 0.00% -> 25.00%      
client [14] (testset)   loss: 1.7989 -> 1.6845  accuracy: 41.18% -> 45.38%     
client [46] (testset)   loss: 1.5653 -> 1.5182  accuracy: 46.18% -> 43.75%     
---------------------------- TRAINING EPOCH: 30 ----------------------------   
client [24] (testset)   loss: 1.6467 -> 1.3536  accuracy: 45.80% -> 54.20%     
client [68] (testset)   loss: 1.3280 -> 1.4017  accuracy: 56.34% -> 52.11%     
client [57] (testset)   loss: 1.4458 -> 1.4303  accuracy: 53.23% -> 54.03%     
client [17] (testset)   loss: 0.8730 -> 0.8459  accuracy: 72.55% -> 73.20%     
client [54] (testset)   loss: 1.4414 -> 1.4710  accuracy: 46.73% -> 45.79%     
client [23] (testset)   loss: 2.3377 -> 1.7593  accuracy: 4.65% -> 31.78%      
client [35] (testset)   loss: 1.0512 -> 1.6782  accuracy: 66.67% -> 44.44%     
client [59] (testset)   loss: 1.7028 -> 1.6912  accuracy: 42.68% -> 39.49%     
client [31] (testset)   loss: 1.1289 -> 1.1620  accuracy: 63.21% -> 63.21%     
client [9]  (testset)   loss: 2.0069 -> 1.6495  accuracy: 28.26% -> 44.35%     
---------------------------- TRAINING EPOCH: 40 ----------------------------   
client [64] (testset)   loss: 1.3168 -> 1.3685  accuracy: 55.26% -> 50.00%     
client [33] (testset)   loss: 1.4246 -> 1.5675  accuracy: 56.78% -> 57.79%     
client [16] (testset)   loss: 1.5016 -> 1.5475  accuracy: 50.40% -> 48.80%     
client [44] (testset)   loss: 1.5504 -> 1.2803  accuracy: 35.43% -> 56.62%     
client [8]  (testset)   loss: 1.6900 -> 1.5452  accuracy: 52.00% -> 50.67%     
client [31] (testset)   loss: 1.7763 -> 1.2908  accuracy: 36.79% -> 62.14%     
client [47] (testset)   loss: 1.5243 -> 1.6794  accuracy: 42.59% -> 46.30%     
client [36] (testset)   loss: 1.6705 -> 1.6036  accuracy: 47.47% -> 44.44%     
client [20] (testset)   loss: 1.6600 -> 1.8222  accuracy: 51.08% -> 48.48%     
client [56] (testset)   loss: 1.9857 -> 1.8758  accuracy: 32.00% -> 38.00%     
---------------------------- TRAINING EPOCH: 50 ----------------------------   
client [4]  (testset)   loss: 1.2336 -> 1.1378  accuracy: 62.07% -> 64.04%     
client [60] (testset)   loss: 1.8073 -> 1.8840  accuracy: 32.07% -> 31.22%     
client [28] (testset)   loss: 1.6906 -> 1.8840  accuracy: 48.17% -> 42.68%     
client [25] (testset)   loss: 1.5101 -> 1.5645  accuracy: 41.67% -> 43.33%     
client [58] (testset)   loss: 1.4737 -> 1.4689  accuracy: 51.57% -> 52.83%     
client [44] (testset)   loss: 1.2803 -> 1.2875  accuracy: 56.62% -> 56.29%     
client [39] (testset)   loss: 1.5109 -> 1.4809  accuracy: 45.69% -> 47.41%     
client [29] (testset)   loss: 1.6182 -> 1.6409  accuracy: 58.46% -> 46.15%     
client [3]  (testset)   loss: 1.3436 -> 1.3258  accuracy: 53.28% -> 56.76%     
client [84] (testset)   loss: 1.6663 -> 1.5019  accuracy: 48.03% -> 51.32%     
---------------------------- TRAINING EPOCH: 60 ----------------------------   
client [21] (testset)   loss: 1.5880 -> 1.6050  accuracy: 53.52% -> 49.30%     
client [84] (testset)   loss: 1.4417 -> 1.5656  accuracy: 54.61% -> 45.39%     
client [10] (testset)   loss: 1.3781 -> 1.3330  accuracy: 57.48% -> 59.84%     
client [36] (testset)   loss: 1.6432 -> 1.6219  accuracy: 43.43% -> 48.48%     
client [65] (testset)   loss: 1.7526 -> 2.0280  accuracy: 43.18% -> 43.18%     
client [81] (testset)   loss: 1.3164 -> 1.3229  accuracy: 56.19% -> 53.33%     
client [79] (testset)   loss: 0.8981 -> 1.1036  accuracy: 72.03% -> 68.64%     
client [42] (testset)   loss: 1.0523 -> 1.0842  accuracy: 62.50% -> 61.46%     
client [11] (testset)   loss: 1.5427 -> 1.4873  accuracy: 40.77% -> 46.15%     
client [96] (testset)   loss: 1.1957 -> 1.5161  accuracy: 63.16% -> 43.61%     
---------------------------- TRAINING EPOCH: 70 ----------------------------   
client [8]  (testset)   loss: 1.6357 -> 1.4255  accuracy: 53.33% -> 54.67%     
client [53] (testset)   loss: 1.6427 -> 1.6456  accuracy: 39.47% -> 38.16%     
client [52] (testset)   loss: 1.3642 -> 1.3255  accuracy: 55.78% -> 59.86%     
client [42] (testset)   loss: 1.1538 -> 1.0289  accuracy: 56.25% -> 58.33%     
client [69] (testset)   loss: 1.4621 -> 1.7693  accuracy: 52.98% -> 47.68%     
client [59] (testset)   loss: 1.5915 -> 1.6383  accuracy: 43.31% -> 43.95%     
client [7]  (testset)   loss: 1.5937 -> 1.6406  accuracy: 44.24% -> 45.16%     
client [26] (testset)   loss: 1.0899 -> 1.1094  accuracy: 62.92% -> 60.67%     
client [49] (testset)   loss: 1.3545 -> 1.3602  accuracy: 56.00% -> 60.00%     
client [98] (testset)   loss: 2.1222 -> 2.1136  accuracy: 46.05% -> 48.68%     
---------------------------- TRAINING EPOCH: 80 ----------------------------   
client [98] (testset)   loss: 2.1136 -> 2.2698  accuracy: 48.68% -> 46.71%     
client [47] (testset)   loss: 1.1983 -> 1.2088  accuracy: 59.26% -> 60.19%     
client [21] (testset)   loss: 1.4741 -> 1.4864  accuracy: 52.11% -> 46.48%     
client [77] (testset)   loss: 1.6520 -> 1.8271  accuracy: 46.89% -> 37.29%     
client [95] (testset)   loss: 2.5349 -> 2.7563  accuracy: 33.04% -> 31.25%     
client [91] (testset)   loss: 1.5747 -> 1.6733  accuracy: 49.52% -> 45.67%     
client [14] (testset)   loss: 3.8797 -> 1.9404  accuracy: 26.05% -> 45.38%     
client [99] (testset)   loss: 1.6588 -> 1.8509  accuracy: 42.70% -> 42.16%     
client [20] (testset)   loss: 2.3254 -> 2.4562  accuracy: 50.22% -> 49.78%     
client [39] (testset)   loss: 1.3588 -> 1.3817  accuracy: 50.00% -> 45.69%     
---------------------------- TRAINING EPOCH: 90 ----------------------------   
client [52] (testset)   loss: 1.3255 -> 1.4414  accuracy: 59.86% -> 53.74%     
client [62] (testset)   loss: 1.3722 -> 3.2156  accuracy: 53.54% -> 33.33%     
client [71] (testset)   loss: 0.8549 -> 0.9728  accuracy: 72.63% -> 73.68%     
client [97] (testset)   loss: 1.5444 -> 1.4070  accuracy: 53.18% -> 54.91%     
client [30] (testset)   loss: 2.2187 -> 2.5547  accuracy: 31.68% -> 29.70%     
client [88] (testset)   loss: 1.6327 -> 2.1407  accuracy: 40.98% -> 39.34%     
client [60] (testset)   loss: 1.5755 -> 2.0513  accuracy: 46.84% -> 44.30%     
client [82] (testset)   loss: 1.4408 -> 1.1207  accuracy: 53.57% -> 65.71%     
client [91] (testset)   loss: 1.9171 -> 2.0972  accuracy: 49.52% -> 46.63%     
client [57] (testset)   loss: 1.5386 -> 1.5614  accuracy: 45.97% -> 54.84%     
---------------------------- TRAINING EPOCH: 100 ----------------------------  
client [31] (testset)   loss: 1.8863 -> 1.9118  accuracy: 65.36% -> 65.36%     
client [15] (testset)   loss: 1.1505 -> 1.1823  accuracy: 61.18% -> 60.59%     
client [71] (testset)   loss: 0.9728 -> 0.9295  accuracy: 73.68% -> 72.63%     
client [97] (testset)   loss: 1.7354 -> 2.3117  accuracy: 52.60% -> 46.82%     
client [53] (testset)   loss: 1.6840 -> 1.7463  accuracy: 52.63% -> 53.95%     
client [77] (testset)   loss: 1.8271 -> 1.9435  accuracy: 37.29% -> 38.98%     
client [76] (testset)   loss: 1.0299 -> 1.1789  accuracy: 67.27% -> 67.88%     
client [79] (testset)   loss: 0.9457 -> 1.4014  accuracy: 74.15% -> 63.14%     
client [28] (testset)   loss: 2.6394 -> 2.4710  accuracy: 47.56% -> 49.39%     
client [99] (testset)   loss: 1.6460 -> 1.9094  accuracy: 47.03% -> 47.03%     
---------------------------- TRAINING EPOCH: 110 ----------------------------  
client [97] (testset)   loss: 1.6423 -> 2.0033  accuracy: 56.07% -> 54.91%     
client [86] (testset)   loss: 1.3077 -> 1.3846  accuracy: 63.85% -> 63.08%     
client [34] (testset)   loss: 1.5368 -> 1.6219  accuracy: 58.22% -> 55.11%     
client [73] (testset)   loss: 2.1351 -> 2.1674  accuracy: 40.70% -> 44.96%     
client [5]  (testset)   loss: 1.8192 -> 2.3015  accuracy: 50.89% -> 42.86%     
client [96] (testset)   loss: 1.7945 -> 1.8792  accuracy: 51.13% -> 52.63%     
client [22] (testset)   loss: 1.6071 -> 2.3545  accuracy: 49.23% -> 40.00%     
client [60] (testset)   loss: 1.9445 -> 2.1245  accuracy: 49.37% -> 51.48%     
client [66] (testset)   loss: 1.2130 -> 1.2367  accuracy: 59.78% -> 52.72%     
client [83] (testset)   loss: 1.4288 -> 1.4040  accuracy: 62.00% -> 63.00%     
---------------------------- TRAINING EPOCH: 120 ----------------------------  
client [76] (testset)   loss: 1.4578 -> 1.5351  accuracy: 67.88% -> 67.88%     
client [65] (testset)   loss: 1.6038 -> 3.0334  accuracy: 45.45% -> 22.73%     
client [95] (testset)   loss: 3.4244 -> 3.5237  accuracy: 29.46% -> 28.57%     
client [17] (testset)   loss: 0.8503 -> 0.7805  accuracy: 74.51% -> 75.16%     
client [8]  (testset)   loss: 2.2412 -> 2.2829  accuracy: 56.00% -> 40.00%     
client [35] (testset)   loss: 1.4495 -> 1.6752  accuracy: 68.52% -> 70.37%     
client [98] (testset)   loss: 2.4709 -> 2.5348  accuracy: 47.37% -> 48.68%     
client [53] (testset)   loss: 1.7178 -> 2.1508  accuracy: 51.32% -> 40.79%     
client [43] (testset)   loss: 1.5314 -> 1.5775  accuracy: 57.66% -> 56.93%     
client [64] (testset)   loss: 1.3650 -> 1.5195  accuracy: 55.79% -> 56.32%     
---------------------------- TRAINING EPOCH: 130 ----------------------------  
client [21] (testset)   loss: 1.5091 -> 1.4689  accuracy: 45.07% -> 50.70%     
client [88] (testset)   loss: 2.1494 -> 2.2387  accuracy: 42.62% -> 49.18%     
client [38] (testset)   loss: 1.7108 -> 1.7693  accuracy: 57.83% -> 56.63%     
client [3]  (testset)   loss: 2.2775 -> 2.3970  accuracy: 58.30% -> 58.30%     
client [5]  (testset)   loss: 2.0465 -> 2.1763  accuracy: 52.68% -> 50.89%     
client [41] (testset)   loss: 1.6978 -> 1.4991  accuracy: 55.24% -> 60.84%     
client [7]  (testset)   loss: 1.6196 -> 1.7940  accuracy: 51.61% -> 53.00%     
client [37] (testset)   loss: 2.0717 -> 2.1165  accuracy: 51.95% -> 48.05%     
client [45] (testset)   loss: 1.7439 -> 1.7466  accuracy: 47.97% -> 50.55%     
client [47] (testset)   loss: 1.5255 -> 1.1383  accuracy: 53.70% -> 62.96%     
---------------------------- TRAINING EPOCH: 140 ----------------------------  
client [16] (testset)   loss: 1.9686 -> 2.4013  accuracy: 55.20% -> 47.20%     
client [11] (testset)   loss: 1.7137 -> 2.4048  accuracy: 50.00% -> 40.00%     
client [37] (testset)   loss: 2.2173 -> 2.5490  accuracy: 49.35% -> 51.95%     
client [41] (testset)   loss: 1.4991 -> 1.5702  accuracy: 60.84% -> 62.24%     
client [95] (testset)   loss: 4.3259 -> 4.3924  accuracy: 24.11% -> 25.89%     
client [53] (testset)   loss: 2.1508 -> 2.3473  accuracy: 40.79% -> 46.05%     
client [22] (testset)   loss: 1.9124 -> 2.0819  accuracy: 46.15% -> 46.92%     
client [25] (testset)   loss: 1.7762 -> 1.7045  accuracy: 43.33% -> 41.67%     
client [69] (testset)   loss: 2.4206 -> 2.4788  accuracy: 54.30% -> 53.64%     
client [46] (testset)   loss: 1.8693 -> 2.2481  accuracy: 46.53% -> 43.75%     
---------------------------- TRAINING EPOCH: 150 ----------------------------  
client [47] (testset)   loss: 1.2960 -> 1.3859  accuracy: 63.89% -> 66.67%     
client [69] (testset)   loss: 2.5387 -> 2.6102  accuracy: 54.30% -> 53.64%     
client [82] (testset)   loss: 1.4780 -> 1.1830  accuracy: 55.71% -> 68.57%     
client [45] (testset)   loss: 2.0480 -> 2.3847  accuracy: 49.08% -> 47.97%     
client [7]  (testset)   loss: 1.7940 -> 2.4004  accuracy: 53.00% -> 50.23%     
client [50] (testset)   loss: 1.2812 -> 1.1570  accuracy: 59.54% -> 58.78%     
client [35] (testset)   loss: 2.0757 -> 1.5863  accuracy: 59.26% -> 68.52%     
client [24] (testset)   loss: 2.3102 -> 2.3894  accuracy: 52.29% -> 52.29%     
client [15] (testset)   loss: 1.4192 -> 1.5321  accuracy: 60.00% -> 60.59%     
client [58] (testset)   loss: 2.5767 -> 2.6309  accuracy: 56.60% -> 57.23%     
---------------------------- TRAINING EPOCH: 160 ----------------------------  
client [48] (testset)   loss: 3.1539 -> 3.3994  accuracy: 30.65% -> 30.65%     
client [76] (testset)   loss: 1.5314 -> 1.5903  accuracy: 64.24% -> 65.45%     
client [67] (testset)   loss: 1.8786 -> 1.8967  accuracy: 47.62% -> 48.92%     
client [37] (testset)   loss: 2.2559 -> 2.6367  accuracy: 49.35% -> 46.75%     
client [58] (testset)   loss: 2.6831 -> 2.7134  accuracy: 57.23% -> 55.97%     
client [64] (testset)   loss: 1.7156 -> 1.8258  accuracy: 55.26% -> 54.21%     
client [77] (testset)   loss: 2.2238 -> 2.3870  accuracy: 48.59% -> 45.76%     
client [55] (testset)   loss: 1.9936 -> 2.1382  accuracy: 50.00% -> 52.83%     
client [12] (testset)   loss: 2.0126 -> 1.2150  accuracy: 80.00% -> 80.67%     
client [89] (testset)   loss: 2.4929 -> 2.5556  accuracy: 50.72% -> 49.28%     
---------------------------- TRAINING EPOCH: 170 ----------------------------  
client [84] (testset)   loss: 2.5990 -> 2.6392  accuracy: 54.61% -> 52.63%     
client [51] (testset)   loss: 2.5047 -> 2.5917  accuracy: 46.43% -> 50.00%     
client [8]  (testset)   loss: 2.3866 -> 2.5035  accuracy: 53.33% -> 50.67%     
client [18] (testset)   loss: 1.7900 -> 1.6888  accuracy: 55.72% -> 54.73%     
client [94] (testset)   loss: 2.1866 -> 2.2671  accuracy: 53.60% -> 52.80%     
client [81] (testset)   loss: 2.1504 -> 2.1562  accuracy: 57.14% -> 56.19%     
client [3]  (testset)   loss: 2.6944 -> 2.7587  accuracy: 57.92% -> 57.92%     
client [11] (testset)   loss: 1.9957 -> 2.1202  accuracy: 42.31% -> 50.77%     
client [95] (testset)   loss: 5.1368 -> 5.2381  accuracy: 24.11% -> 23.21%     
client [67] (testset)   loss: 1.8967 -> 2.0793  accuracy: 48.92% -> 50.22%     
---------------------------- TRAINING EPOCH: 180 ----------------------------  
client [21] (testset)   loss: 1.8480 -> 1.8143  accuracy: 40.85% -> 49.30%     
client [79] (testset)   loss: 1.6643 -> 1.7296  accuracy: 72.46% -> 74.15%     
client [58] (testset)   loss: 2.8245 -> 2.8552  accuracy: 55.97% -> 55.97%     
client [88] (testset)   loss: 2.7133 -> 2.5309  accuracy: 43.17% -> 48.09%     
client [46] (testset)   loss: 2.4723 -> 2.5974  accuracy: 48.96% -> 50.35%     
client [11] (testset)   loss: 2.1202 -> 2.1766  accuracy: 50.77% -> 47.69%     
client [55] (testset)   loss: 2.3863 -> 2.4787  accuracy: 54.72% -> 55.66%     
client [13] (testset)   loss: 1.9485 -> 1.9888  accuracy: 64.05% -> 63.64%     
client [31] (testset)   loss: 2.0048 -> 2.0240  accuracy: 65.71% -> 66.79%     
client [75] (testset)   loss: 2.8450 -> 2.9979  accuracy: 46.25% -> 45.00%     
---------------------------- TRAINING EPOCH: 190 ----------------------------  
client [19] (testset)   loss: 1.9759 -> 2.0100  accuracy: 63.82% -> 63.16%     
client [7]  (testset)   loss: 2.4622 -> 2.5431  accuracy: 51.61% -> 50.69%     
client [57] (testset)   loss: 2.0765 -> 2.3987  accuracy: 49.19% -> 56.45%     
client [13] (testset)   loss: 2.0219 -> 2.0470  accuracy: 63.64% -> 64.46%     
client [43] (testset)   loss: 2.0537 -> 2.1675  accuracy: 56.20% -> 56.20%     
client [91] (testset)   loss: 2.6597 -> 2.7066  accuracy: 46.63% -> 48.08%     
client [10] (testset)   loss: 2.3062 -> 2.3951  accuracy: 55.12% -> 55.12%     
client [64] (testset)   loss: 2.1473 -> 2.1931  accuracy: 54.21% -> 51.58%     
client [82] (testset)   loss: 1.5206 -> 1.6054  accuracy: 65.71% -> 65.00%     
client [22] (testset)   loss: 2.5295 -> 2.5719  accuracy: 46.92% -> 48.46%     
---------------------------- TRAINING EPOCH: 200 ----------------------------  
client [20] (testset)   loss: 3.1940 -> 3.2423  accuracy: 48.92% -> 49.78%     
client [23] (testset)   loss: 1.8778 -> 1.7943  accuracy: 48.06% -> 51.16%     
client [88] (testset)   loss: 2.5309 -> 2.6279  accuracy: 48.09% -> 48.09%     
client [98] (testset)   loss: 3.4214 -> 3.5308  accuracy: 48.68% -> 48.03%     
client [79] (testset)   loss: 1.7957 -> 1.7947  accuracy: 74.15% -> 72.03%     
client [21] (testset)   loss: 1.7907 -> 1.7439  accuracy: 47.89% -> 46.48%     
client [92] (testset)   loss: 1.4575 -> 1.4631  accuracy: 65.55% -> 66.51%     
client [56] (testset)   loss: 3.5067 -> 3.5783  accuracy: 24.00% -> 24.00%     
client [5]  (testset)   loss: 2.8933 -> 2.9644  accuracy: 50.00% -> 50.89%     
client [52] (testset)   loss: 2.4878 -> 2.5614  accuracy: 55.10% -> 53.74%     
---------------------------- TRAINING EPOCH: 210 ----------------------------  
client [67] (testset)   loss: 2.7021 -> 2.7339  accuracy: 51.08% -> 50.65%     
client [54] (testset)   loss: 2.8972 -> 3.0326  accuracy: 48.60% -> 47.66%     
client [14] (testset)   loss: 2.9464 -> 3.1307  accuracy: 53.78% -> 55.46%     
client [99] (testset)   loss: 2.9169 -> 2.9444  accuracy: 48.11% -> 46.49%     
client [36] (testset)   loss: 2.8442 -> 2.9036  accuracy: 48.48% -> 47.47%     
client [30] (testset)   loss: 4.0739 -> 4.1560  accuracy: 29.70% -> 28.71%     
client [38] (testset)   loss: 2.2412 -> 2.3849  accuracy: 55.42% -> 53.01%     
client [15] (testset)   loss: 1.9456 -> 2.0136  accuracy: 61.18% -> 55.29%     
client [6]  (testset)   loss: 2.0961 -> 2.1747  accuracy: 59.20% -> 59.20%     
client [53] (testset)   loss: 2.9627 -> 3.1851  accuracy: 53.95% -> 56.58%     
---------------------------- TRAINING EPOCH: 220 ----------------------------  
client [99] (testset)   loss: 3.0806 -> 3.1468  accuracy: 46.49% -> 46.49%     
client [6]  (testset)   loss: 2.1747 -> 2.2113  accuracy: 59.20% -> 58.80%     
client [83] (testset)   loss: 1.9445 -> 2.0392  accuracy: 65.00% -> 67.00%     
client [42] (testset)   loss: 1.4381 -> 1.4469  accuracy: 67.71% -> 69.79%     
client [34] (testset)   loss: 2.1954 -> 2.1961  accuracy: 53.78% -> 54.22%     
client [15] (testset)   loss: 2.0136 -> 1.7930  accuracy: 55.29% -> 57.65%     
client [47] (testset)   loss: 2.0270 -> 2.0573  accuracy: 65.74% -> 65.74%     
client [55] (testset)   loss: 2.5360 -> 2.5979  accuracy: 53.77% -> 56.60%     
client [51] (testset)   loss: 2.7867 -> 2.8155  accuracy: 47.62% -> 48.81%     
client [95] (testset)   loss: 5.5188 -> 5.5648  accuracy: 25.00% -> 23.21%     
---------------------------- TRAINING EPOCH: 230 ----------------------------  
client [71] (testset)   loss: 1.4146 -> 1.4276  accuracy: 72.63% -> 73.68%     
client [15] (testset)   loss: 1.7930 -> 1.9646  accuracy: 57.65% -> 58.24%     
client [33] (testset)   loss: 3.0799 -> 3.1501  accuracy: 57.79% -> 58.79%     
client [99] (testset)   loss: 3.2326 -> 3.2359  accuracy: 46.49% -> 45.95%     
client [90] (testset)   loss: 1.9986 -> 2.3482  accuracy: 51.85% -> 50.93%     
client [57] (testset)   loss: 3.0318 -> 3.0916  accuracy: 50.00% -> 48.39%     
client [27] (testset)   loss: 3.3292 -> 3.4518  accuracy: 46.67% -> 49.33%     
client [78] (testset)   loss: 1.2891 -> 1.3190  accuracy: 74.44% -> 73.68%     
client [36] (testset)   loss: 2.9407 -> 2.9845  accuracy: 48.48% -> 48.48%     
client [88] (testset)   loss: 2.7225 -> 2.8537  accuracy: 51.37% -> 48.63%     
---------------------------- TRAINING EPOCH: 240 ----------------------------  
client [70] (testset)   loss: 2.6919 -> 2.6908  accuracy: 50.00% -> 50.00%     
client [35] (testset)   loss: 1.9754 -> 1.9484  accuracy: 68.52% -> 70.37%     
client [16] (testset)   loss: 3.1086 -> 3.1449  accuracy: 54.40% -> 54.40%     
client [80] (testset)   loss: 3.1504 -> 3.2156  accuracy: 41.06% -> 40.40%     
client [38] (testset)   loss: 2.5001 -> 2.5475  accuracy: 54.22% -> 55.42%     
client [78] (testset)   loss: 1.3465 -> 1.3669  accuracy: 72.18% -> 72.18%     
client [68] (testset)   loss: 2.2070 -> 2.3611  accuracy: 56.34% -> 54.93%     
client [11] (testset)   loss: 2.4642 -> 2.5217  accuracy: 51.54% -> 49.23%     
client [64] (testset)   loss: 2.3730 -> 2.4087  accuracy: 52.63% -> 53.16%     
client [82] (testset)   loss: 1.8568 -> 1.8945  accuracy: 65.00% -> 64.29%     
---------------------------- TRAINING EPOCH: 250 ----------------------------  
client [30] (testset)   loss: 4.4637 -> 4.5254  accuracy: 28.71% -> 27.72%     
client [27] (testset)   loss: 3.4518 -> 3.5238  accuracy: 49.33% -> 49.33%     
client [74] (testset)   loss: 2.4949 -> 2.5662  accuracy: 53.08% -> 51.54%     
client [45] (testset)   loss: 3.4124 -> 3.4930  accuracy: 49.45% -> 50.18%     
client [6]  (testset)   loss: 2.2277 -> 2.2844  accuracy: 59.60% -> 60.40%     
client [36] (testset)   loss: 3.0224 -> 3.0774  accuracy: 49.49% -> 48.48%     
client [63] (testset)   loss: 3.4013 -> 3.4563  accuracy: 44.54% -> 42.86%     
client [76] (testset)   loss: 2.1295 -> 2.1469  accuracy: 65.45% -> 65.45%     
client [83] (testset)   loss: 2.1598 -> 2.2204  accuracy: 65.00% -> 63.00%     
client [86] (testset)   loss: 2.3010 -> 2.2983  accuracy: 63.08% -> 63.85%     
---------------------------- TRAINING EPOCH: 260 ----------------------------  
client [83] (testset)   loss: 2.2204 -> 2.2768  accuracy: 63.00% -> 61.00%     
client [99] (testset)   loss: 3.2722 -> 3.3178  accuracy: 45.41% -> 46.49%     
client [74] (testset)   loss: 2.6245 -> 2.6824  accuracy: 50.77% -> 53.08%     
client [73] (testset)   loss: 2.8841 -> 2.8800  accuracy: 55.04% -> 54.65%     
client [29] (testset)   loss: 2.8013 -> 2.8429  accuracy: 55.38% -> 53.08%     
client [92] (testset)   loss: 1.6501 -> 1.6715  accuracy: 65.07% -> 66.51%     
client [6]  (testset)   loss: 2.3401 -> 2.3281  accuracy: 59.20% -> 60.00%     
client [61] (testset)   loss: 2.4784 -> 2.7457  accuracy: 46.67% -> 46.67%     
client [21] (testset)   loss: 2.2205 -> 2.1986  accuracy: 46.48% -> 46.48%     
client [67] (testset)   loss: 2.9095 -> 2.9206  accuracy: 50.65% -> 51.08%     
---------------------------- TRAINING EPOCH: 270 ----------------------------  
client [83] (testset)   loss: 2.2768 -> 2.2907  accuracy: 61.00% -> 63.00%     
client [32] (testset)   loss: 2.6521 -> 2.6509  accuracy: 52.13% -> 52.13%     
client [95] (testset)   loss: 5.6434 -> 5.6904  accuracy: 24.11% -> 25.00%     
client [61] (testset)   loss: 3.1978 -> 3.2382  accuracy: 44.17% -> 45.00%     
client [27] (testset)   loss: 3.5238 -> 3.5689  accuracy: 49.33% -> 48.00%     
client [25] (testset)   loss: 2.7904 -> 3.0307  accuracy: 45.00% -> 40.00%     
client [68] (testset)   loss: 2.6302 -> 2.6391  accuracy: 52.11% -> 53.52%     
client [34] (testset)   loss: 2.2553 -> 2.2788  accuracy: 55.11% -> 54.22%     
client [71] (testset)   loss: 1.5612 -> 1.6069  accuracy: 72.11% -> 72.11%     
client [89] (testset)   loss: 2.8938 -> 2.9339  accuracy: 50.72% -> 49.28%     
---------------------------- TRAINING EPOCH: 280 ----------------------------  
client [78] (testset)   loss: 1.4923 -> 1.5095  accuracy: 73.68% -> 71.43%     
client [81] (testset)   loss: 2.6504 -> 2.6879  accuracy: 54.29% -> 55.24%     
client [51] (testset)   loss: 3.1210 -> 3.1620  accuracy: 47.62% -> 47.62%     
client [54] (testset)   loss: 3.0944 -> 3.1516  accuracy: 47.66% -> 47.66%     
client [65] (testset)   loss: 3.0134 -> 2.7923  accuracy: 43.18% -> 45.45%     
client [41] (testset)   loss: 2.5856 -> 2.6469  accuracy: 60.14% -> 60.84%     
client [11] (testset)   loss: 2.6071 -> 2.6241  accuracy: 50.77% -> 51.54%     
client [85] (testset)   loss: 3.6767 -> 3.7193  accuracy: 33.66% -> 33.66%     
client [12] (testset)   loss: 1.6836 -> 1.7192  accuracy: 79.33% -> 80.00%     
client [23] (testset)   loss: 2.4759 -> 2.5385  accuracy: 54.26% -> 53.49%     
---------------------------- TRAINING EPOCH: 290 ----------------------------  
client [16] (testset)   loss: 3.1876 -> 3.2238  accuracy: 54.40% -> 54.40%     
client [65] (testset)   loss: 2.7868 -> 2.7495  accuracy: 45.45% -> 43.18%     
client [53] (testset)   loss: 3.5537 -> 3.5771  accuracy: 57.89% -> 56.58%     
client [58] (testset)   loss: 3.0923 -> 3.1133  accuracy: 55.97% -> 55.35%     
client [72] (testset)   loss: 3.7516 -> 3.7592  accuracy: 38.46% -> 40.00%     
client [7]  (testset)   loss: 2.8861 -> 2.9275  accuracy: 49.31% -> 49.77%     
client [71] (testset)   loss: 1.6069 -> 1.6043  accuracy: 72.11% -> 72.63%     
client [59] (testset)   loss: 2.9810 -> 3.0067  accuracy: 47.13% -> 47.13%     
client [86] (testset)   loss: 2.4090 -> 2.4382  accuracy: 64.62% -> 63.85%     
client [39] (testset)   loss: 2.8898 -> 2.8992  accuracy: 42.24% -> 43.97%     
---------------------------- TRAINING EPOCH: 300 ----------------------------  
client [99] (testset)   loss: 3.3895 -> 3.4281  accuracy: 45.41% -> 45.95%     
client [7]  (testset)   loss: 2.9349 -> 2.9655  accuracy: 49.77% -> 49.77%     
client [17] (testset)   loss: 1.4489 -> 1.4708  accuracy: 73.20% -> 72.55%     
client [64] (testset)   loss: 2.6087 -> 2.6190  accuracy: 52.63% -> 52.63%     
client [37] (testset)   loss: 3.8360 -> 3.8910  accuracy: 49.35% -> 49.35%     
client [29] (testset)   loss: 3.0928 -> 3.1125  accuracy: 53.85% -> 53.85%     
client [93] (testset)   loss: 2.9195 -> 2.9559  accuracy: 50.94% -> 51.70%     
client [73] (testset)   loss: 3.0263 -> 3.0453  accuracy: 55.81% -> 55.43%     
client [40] (testset)   loss: 2.9754 -> 2.9990  accuracy: 54.47% -> 54.47%     
client [76] (testset)   loss: 2.2607 -> 2.2791  accuracy: 65.45% -> 65.45%     
---------------------------- TRAINING EPOCH: 310 ----------------------------  
client [31] (testset)   loss: 2.2417 -> 2.2558  accuracy: 66.07% -> 66.07%     
client [89] (testset)   loss: 3.0346 -> 3.0695  accuracy: 50.72% -> 49.28%     
client [77] (testset)   loss: 3.2927 -> 3.3187  accuracy: 43.50% -> 42.94%     
client [90] (testset)   loss: 2.6302 -> 2.6627  accuracy: 52.78% -> 51.85%     
client [26] (testset)   loss: 1.9420 -> 1.9599  accuracy: 64.61% -> 62.36%     
client [50] (testset)   loss: 1.9094 -> 1.9669  accuracy: 61.83% -> 64.12%     
client [30] (testset)   loss: 4.7243 -> 4.7508  accuracy: 27.72% -> 27.72%     
client [70] (testset)   loss: 2.8264 -> 2.8386  accuracy: 49.24% -> 50.00%     
client [41] (testset)   loss: 2.7276 -> 2.7290  accuracy: 61.54% -> 60.14%     
client [99] (testset)   loss: 3.4281 -> 3.4762  accuracy: 45.95% -> 45.41%     
---------------------------- TRAINING EPOCH: 320 ----------------------------  
client [68] (testset)   loss: 3.0533 -> 3.1054  accuracy: 53.52% -> 52.11%     
client [70] (testset)   loss: 2.8661 -> 2.8906  accuracy: 49.24% -> 50.00%     
client [52] (testset)   loss: 3.0344 -> 3.0614  accuracy: 55.78% -> 55.10%     
client [1]  (testset)   loss: 2.2917 -> 2.3604  accuracy: 58.38% -> 54.91%     
client [2]  (testset)   loss: 2.4404 -> 2.5070  accuracy: 48.08% -> 48.08%     
client [67] (testset)   loss: 3.1595 -> 3.1764  accuracy: 51.52% -> 51.52%     
client [92] (testset)   loss: 1.8999 -> 1.9044  accuracy: 65.55% -> 65.55%     
client [35] (testset)   loss: 2.0996 -> 2.1235  accuracy: 68.52% -> 68.52%     
client [36] (testset)   loss: 3.3337 -> 3.3528  accuracy: 47.47% -> 49.49%     
client [64] (testset)   loss: 2.6340 -> 2.6637  accuracy: 52.63% -> 52.63%     
---------------------------- TRAINING EPOCH: 330 ----------------------------  
client [44] (testset)   loss: 2.5103 -> 2.5330  accuracy: 61.59% -> 60.26%     
client [6]  (testset)   loss: 2.4797 -> 2.4779  accuracy: 59.60% -> 60.00%     
client [12] (testset)   loss: 1.8150 -> 1.8423  accuracy: 80.00% -> 79.33%     
client [55] (testset)   loss: 2.8126 -> 2.8441  accuracy: 54.72% -> 55.66%     
client [29] (testset)   loss: 3.2376 -> 3.3170  accuracy: 53.85% -> 54.62%     
client [9]  (testset)   loss: 3.6614 -> 3.6889  accuracy: 48.26% -> 48.70%     
client [43] (testset)   loss: 2.7050 -> 2.7489  accuracy: 56.20% -> 56.20%     
client [77] (testset)   loss: 3.3187 -> 3.3371  accuracy: 42.94% -> 42.37%     
client [98] (testset)   loss: 4.0767 -> 4.1015  accuracy: 48.03% -> 48.03%     
client [78] (testset)   loss: 1.5683 -> 1.5722  accuracy: 71.43% -> 72.18%     
---------------------------- TRAINING EPOCH: 340 ----------------------------  
client [92] (testset)   loss: 1.9250 -> 1.9373  accuracy: 65.55% -> 65.07%     
client [80] (testset)   loss: 3.4681 -> 3.4952  accuracy: 39.74% -> 38.41%     
client [63] (testset)   loss: 4.0325 -> 4.1025  accuracy: 42.02% -> 42.86%     
client [76] (testset)   loss: 2.3417 -> 2.3585  accuracy: 65.45% -> 65.45%     
client [78] (testset)   loss: 1.5722 -> 1.5897  accuracy: 72.18% -> 72.93%     
client [25] (testset)   loss: 3.3577 -> 3.4640  accuracy: 40.00% -> 38.33%     
client [58] (testset)   loss: 3.1778 -> 3.1987  accuracy: 55.35% -> 55.35%     
client [13] (testset)   loss: 2.3268 -> 2.3442  accuracy: 64.88% -> 65.29%     
client [17] (testset)   loss: 1.5224 -> 1.5220  accuracy: 73.20% -> 73.86%     
client [38] (testset)   loss: 3.2235 -> 3.2491  accuracy: 54.22% -> 54.22%     
---------------------------- TRAINING EPOCH: 350 ----------------------------  
client [72] (testset)   loss: 4.1069 -> 4.1346  accuracy: 39.23% -> 40.00%     
client [82] (testset)   loss: 2.1204 -> 2.1368  accuracy: 63.57% -> 63.57%     
client [86] (testset)   loss: 2.5819 -> 2.6054  accuracy: 63.85% -> 63.08%     
client [51] (testset)   loss: 3.3819 -> 3.4035  accuracy: 47.62% -> 47.62%     
client [96] (testset)   loss: 2.8654 -> 2.8731  accuracy: 53.38% -> 53.38%     
client [42] (testset)   loss: 1.7013 -> 1.7375  accuracy: 68.75% -> 70.83%     
client [55] (testset)   loss: 2.9497 -> 2.9694  accuracy: 55.66% -> 55.66%     
client [13] (testset)   loss: 2.3589 -> 2.3681  accuracy: 64.05% -> 64.46%     
client [1]  (testset)   loss: 2.4541 -> 2.4742  accuracy: 57.80% -> 57.80%     
client [12] (testset)   loss: 1.8423 -> 1.8075  accuracy: 79.33% -> 80.00%     
---------------------------- TRAINING EPOCH: 360 ----------------------------  
client [68] (testset)   loss: 3.1542 -> 3.1794  accuracy: 53.52% -> 50.70%     
client [23] (testset)   loss: 2.8835 -> 2.9185  accuracy: 57.36% -> 54.26%     
client [46] (testset)   loss: 3.5617 -> 3.5834  accuracy: 49.65% -> 50.00%     
client [41] (testset)   loss: 2.8307 -> 2.8355  accuracy: 60.14% -> 60.14%     
client [25] (testset)   loss: 3.7576 -> 3.8081  accuracy: 40.00% -> 38.33%     
client [58] (testset)   loss: 3.2105 -> 3.2254  accuracy: 55.35% -> 55.97%     
client [14] (testset)   loss: 3.4130 -> 3.4803  accuracy: 53.78% -> 53.78%     
client [33] (testset)   loss: 3.5339 -> 3.5660  accuracy: 58.29% -> 57.79%     
client [85] (testset)   loss: 4.0040 -> 4.0512  accuracy: 32.67% -> 32.67%     
client [62] (testset)   loss: 2.3126 -> 2.3294  accuracy: 55.56% -> 55.56%     
---------------------------- TRAINING EPOCH: 370 ----------------------------  
client [98] (testset)   loss: 4.2287 -> 4.2564  accuracy: 48.68% -> 48.03%     
client [63] (testset)   loss: 4.1908 -> 4.2407  accuracy: 43.70% -> 43.70%     
client [70] (testset)   loss: 2.9865 -> 2.9941  accuracy: 49.24% -> 49.24%     
client [65] (testset)   loss: 3.3366 -> 2.9939  accuracy: 40.91% -> 45.45%     
client [14] (testset)   loss: 3.5152 -> 3.5158  accuracy: 55.46% -> 53.78%     
client [73] (testset)   loss: 3.1519 -> 3.1575  accuracy: 55.04% -> 55.81%     
client [34] (testset)   loss: 2.5171 -> 2.5326  accuracy: 55.11% -> 53.78%     
client [99] (testset)   loss: 3.5462 -> 3.5681  accuracy: 44.86% -> 44.86%     
client [69] (testset)   loss: 3.1972 -> 3.2338  accuracy: 54.30% -> 53.64%     
client [46] (testset)   loss: 3.5834 -> 3.5987  accuracy: 50.00% -> 50.00%     
---------------------------- TRAINING EPOCH: 380 ----------------------------  
client [99] (testset)   loss: 3.6018 -> 3.6180  accuracy: 44.86% -> 44.86%     
client [93] (testset)   loss: 3.0453 -> 3.0690  accuracy: 51.70% -> 51.32%     
client [11] (testset)   loss: 2.8702 -> 2.9032  accuracy: 49.23% -> 48.46%     
client [58] (testset)   loss: 3.2677 -> 3.2812  accuracy: 55.35% -> 55.35%     
client [81] (testset)   loss: 2.9216 -> 2.9360  accuracy: 55.24% -> 55.24%     
client [85] (testset)   loss: 4.0512 -> 4.0661  accuracy: 32.67% -> 32.67%     
client [89] (testset)   loss: 3.2385 -> 3.2477  accuracy: 49.28% -> 50.72%     
client [45] (testset)   loss: 3.8208 -> 3.8515  accuracy: 49.82% -> 50.55%     
client [8]  (testset)   loss: 3.2902 -> 3.3557  accuracy: 50.67% -> 50.67%     
client [68] (testset)   loss: 3.2788 -> 3.3306  accuracy: 53.52% -> 53.52%     
---------------------------- TRAINING EPOCH: 390 ----------------------------  
client [67] (testset)   loss: 3.2390 -> 3.2532  accuracy: 51.08% -> 50.65%     
client [72] (testset)   loss: 4.2367 -> 4.2734  accuracy: 40.00% -> 39.23%     
client [1]  (testset)   loss: 2.5611 -> 2.5845  accuracy: 57.80% -> 58.38%     
client [78] (testset)   loss: 1.6495 -> 1.6670  accuracy: 72.18% -> 72.93%     
client [83] (testset)   loss: 2.6314 -> 2.6546  accuracy: 63.00% -> 63.00%     
client [21] (testset)   loss: 3.0294 -> 3.0455  accuracy: 46.48% -> 46.48%     
client [56] (testset)   loss: 4.7470 -> 4.8044  accuracy: 26.00% -> 26.00%     
client [44] (testset)   loss: 2.6558 -> 2.6735  accuracy: 60.26% -> 60.60%     
client [92] (testset)   loss: 1.9714 -> 1.9862  accuracy: 65.55% -> 66.03%     
client [27] (testset)   loss: 4.0465 -> 4.0858  accuracy: 48.00% -> 48.00%     
---------------------------- TRAINING EPOCH: 400 ----------------------------  
client [10] (testset)   loss: 3.4049 -> 3.4250  accuracy: 53.54% -> 53.54%     
client [39] (testset)   loss: 3.0190 -> 3.0524  accuracy: 43.97% -> 43.10%     
client [65] (testset)   loss: 3.1848 -> 3.2760  accuracy: 45.45% -> 47.73%     
client [26] (testset)   loss: 2.3086 -> 2.3431  accuracy: 63.48% -> 63.48%     
client [19] (testset)   loss: 2.4567 -> 2.4701  accuracy: 64.47% -> 64.47%     
client [68] (testset)   loss: 3.3155 -> 3.3747  accuracy: 53.52% -> 52.11%     
client [41] (testset)   loss: 2.8981 -> 2.9330  accuracy: 59.44% -> 60.14%     
client [50] (testset)   loss: 2.2780 -> 2.2762  accuracy: 64.89% -> 61.83%     
client [75] (testset)   loss: 3.7676 -> 3.7953  accuracy: 45.00% -> 45.00%     
client [81] (testset)   loss: 2.9640 -> 2.9827  accuracy: 54.29% -> 54.29%     
Training... ---------------------------------------- 100% 0:11:31
Local-only's average time taken by each global epoch: 0 min 1.72 sec.          
Local-only's total running time: 0 h 11 m 31 s.                                
==================== Local-only Experiment Results: ====================       
Display format: (before local fine-tuning) -> (after local fine-tuning)        
 So if finetune_epoch = 0, x.xx% -> 0.00% is normal.                           
 Centralized testing ONLY happens after model aggregation, so the stats between
'->' are the same.                                                             
{                                                                              
    "100": {                                                                   
        "all_clients": {                                                       
            "test": {                                                          
                "loss": "1.7435 -> 0.0000",                                    
                "accuracy": "51.29% -> 0.00%"                                  
            }                                                                  
        }                                                                      
    },                                                                         
    "200": {                                                                   
        "all_clients": {                                                       
            "test": {                                                          
                "loss": "2.4068 -> 0.0000",                                    
                "accuracy": "54.49% -> 0.00%"                                  
            }                                                                  
        }                                                                      
    },                                                                         
    "300": {                                                                   
        "all_clients": {                                                       
            "test": {                                                          
                "loss": "2.8593 -> 0.0000",                                    
                "accuracy": "54.61% -> 0.00%"                                  
            }                                                                  
        }                                                                      
    },                                                                         
    "400": {                                                                   
        "all_clients": {                                                       
            "test": {                                                          
                "loss": "3.0969 -> 0.0000",                                    
                "accuracy": "54.54% -> 0.00%"                                  
            }                                                                  
        }                                                                      
    }                                                                          
}                                                                              
==================== Local-only Max Accuracy ====================              
all_clients:                                                                   
(test) before fine-tuning: 54.61% at epoch 300                                 
(test) after fine-tuning: 0.00% at epoch 100                                   
[0m