==================== Local-only ====================                           
Experiment Arguments:                                                          
{
│   'method': 'local',
│   'dataset': {
│   │   'name': 'cifar100',
│   │   'client_num': 100,
│   │   'test_ratio': 0.25,
│   │   'val_ratio': 0.0,
│   │   'seed': 42,
│   │   'split': 'sample',
│   │   'IID_ratio': 0.0,
│   │   'monitor_window_name_suffix': 'cifar100-100clients-0%IID-use20superclasses-Dir(0.5)-seed42',
│   │   'super_class': False,
│   │   'alpha': 0.5,
│   │   'min_samples_per_client': 10
│   },
│   'model': {
│   │   'name': 'avgcnn',
│   │   'use_torchvision_pretrained_weights': True,
│   │   'external_model_weights_path': None
│   },
│   'optimizer': {
│   │   'lr': 0.01,
│   │   'dampening': 0,
│   │   'weight_decay': 0,
│   │   'momentum': 0,
│   │   'nesterov': False,
│   │   'name': 'sgd'
│   },
│   'mode': 'serial',
│   'parallel': {
│   │   'ray_cluster_addr': None,
│   │   'num_cpus': None,
│   │   'num_gpus': None,
│   │   'num_workers': 2
│   },
│   'common': {
│   │   'seed': 42,
│   │   'join_ratio': 0.1,
│   │   'global_epoch': 400,
│   │   'local_epoch': 5,
│   │   'batch_size': 32,
│   │   'reset_optimizer_on_global_epoch': True,
│   │   'straggler_ratio': 0,
│   │   'straggler_min_local_epoch': 0,
│   │   'buffers': 'global',
│   │   'client_side_evaluation': True,
│   │   'test': {
│   │   │   'client': {
│   │   │   │   'interval': 100,
│   │   │   │   'finetune_epoch': 0,
│   │   │   │   'train': False,
│   │   │   │   'val': False,
│   │   │   │   'test': True
│   │   │   },
│   │   │   'server': {
│   │   │   │   'interval': -1,
│   │   │   │   'train': False,
│   │   │   │   'val': False,
│   │   │   │   'test': False,
│   │   │   │   'model_in_train_mode': False
│   │   │   }
│   │   },
│   │   'verbose_gap': 10,
│   │   'monitor': None,
│   │   'use_cuda': True,
│   │   'save_log': True,
│   │   'save_model': False,
│   │   'save_learning_curve_plot': False,
│   │   'save_metrics': True,
│   │   'delete_useless_run': True
│   }
}
---------------------------- TRAINING EPOCH: 10 ----------------------------   
client [77] (testset)   loss: 3.9998 -> 3.9166  accuracy: 6.99% -> 9.09%       
client [81] (testset)   loss: 5.2579 -> 4.4336  accuracy: 3.65% -> 8.85%       
client [21] (testset)   loss: 4.5774 -> 4.3611  accuracy: 1.69% -> 2.54%       
client [68] (testset)   loss: 4.0355 -> 3.9347  accuracy: 7.52% -> 9.77%       
client [93] (testset)   loss: 4.1280 -> 3.9846  accuracy: 5.80% -> 13.77%      
client [31] (testset)   loss: 4.0193 -> 3.9785  accuracy: 9.02% -> 13.93%      
client [20] (testset)   loss: 4.0925 -> 4.0494  accuracy: 8.82% -> 10.29%      
client [59] (testset)   loss: 4.6138 -> 4.0970  accuracy: 1.23% -> 7.98%       
client [48] (testset)   loss: 4.1212 -> 4.1991  accuracy: 13.33% -> 11.11%     
client [34] (testset)   loss: 4.0496 -> 3.9234  accuracy: 8.80% -> 10.40%      
---------------------------- TRAINING EPOCH: 20 ----------------------------   
client [69] (testset)   loss: 3.8598 -> 3.8064  accuracy: 15.45% -> 18.70%     
client [99] (testset)   loss: 4.1124 -> 4.0780  accuracy: 5.84% -> 7.14%       
client [67] (testset)   loss: 3.9629 -> 3.8421  accuracy: 16.57% -> 13.61%     
client [0]  (testset)   loss: 3.8518 -> 4.6668  accuracy: 10.92% -> 9.77%      
client [76] (testset)   loss: 4.1577 -> 4.2485  accuracy: 13.82% -> 9.76%      
client [41] (testset)   loss: 3.9109 -> 3.7167  accuracy: 16.84% -> 18.95%     
client [62] (testset)   loss: 4.6212 -> 3.9382  accuracy: 0.59% -> 7.69%       
client [2]  (testset)   loss: 4.6050 -> 4.1141  accuracy: 0.00% -> 11.17%      
client [14] (testset)   loss: 4.0873 -> 4.1442  accuracy: 9.30% -> 9.88%       
client [46] (testset)   loss: 4.5900 -> 4.8808  accuracy: 5.81% -> 11.63%      
---------------------------- TRAINING EPOCH: 30 ----------------------------   
client [24] (testset)   loss: 3.9209 -> 4.4078  accuracy: 9.38% -> 6.25%       
client [68] (testset)   loss: 4.0328 -> 4.4493  accuracy: 13.53% -> 12.78%     
client [57] (testset)   loss: 3.9787 -> 3.9798  accuracy: 5.84% -> 8.76%       
client [17] (testset)   loss: 3.9797 -> 4.0206  accuracy: 15.22% -> 12.32%     
client [54] (testset)   loss: 4.1263 -> 4.6236  accuracy: 15.28% -> 15.97%     
client [23] (testset)   loss: 4.6235 -> 4.1930  accuracy: 4.26% -> 4.26%       
client [35] (testset)   loss: 3.9217 -> 4.0722  accuracy: 9.76% -> 10.98%      
client [59] (testset)   loss: 3.8228 -> 4.3012  accuracy: 13.50% -> 7.98%      
client [31] (testset)   loss: 4.4768 -> 4.3264  accuracy: 13.11% -> 13.11%     
client [9]  (testset)   loss: 4.1211 -> 4.0851  accuracy: 4.86% -> 12.50%      
---------------------------- TRAINING EPOCH: 40 ----------------------------   
client [64] (testset)   loss: 3.8977 -> 4.0646  accuracy: 16.94% -> 14.75%     
client [33] (testset)   loss: 4.7662 -> 5.7812  accuracy: 16.67% -> 8.73%      
client [16] (testset)   loss: 3.9199 -> 3.8125  accuracy: 16.78% -> 19.46%     
client [44] (testset)   loss: 4.2150 -> 4.3989  accuracy: 2.01% -> 1.34%       
client [8]  (testset)   loss: 5.1112 -> 5.4626  accuracy: 11.03% -> 8.28%      
client [31] (testset)   loss: 4.9449 -> 4.8655  accuracy: 11.48% -> 18.85%     
client [47] (testset)   loss: 3.7160 -> 3.7828  accuracy: 16.67% -> 18.84%     
client [36] (testset)   loss: 4.1154 -> 4.0409  accuracy: 8.85% -> 15.93%      
client [20] (testset)   loss: 5.3440 -> 5.8805  accuracy: 6.62% -> 9.56%       
client [56] (testset)   loss: 4.2116 -> 4.1797  accuracy: 7.14% -> 3.97%       
---------------------------- TRAINING EPOCH: 50 ----------------------------   
client [4]  (testset)   loss: 4.0061 -> 4.1315  accuracy: 10.00% -> 15.00%     
client [60] (testset)   loss: 4.1068 -> 4.1515  accuracy: 10.66% -> 10.66%     
client [28] (testset)   loss: 4.4534 -> 4.7960  accuracy: 12.12% -> 13.33%     
client [25] (testset)   loss: 3.9113 -> 4.1050  accuracy: 13.98% -> 15.05%     
client [58] (testset)   loss: 4.5705 -> 5.3065  accuracy: 13.55% -> 11.61%     
client [44] (testset)   loss: 4.3989 -> 4.4994  accuracy: 1.34% -> 3.36%       
client [39] (testset)   loss: 4.2199 -> 4.2176  accuracy: 14.60% -> 12.41%     
client [29] (testset)   loss: 5.2784 -> 5.0597  accuracy: 9.88% -> 17.28%      
client [3]  (testset)   loss: 4.3540 -> 4.9375  accuracy: 15.03% -> 6.22%      
client [84] (testset)   loss: 4.3220 -> 4.7941  accuracy: 13.17% -> 11.38%     
---------------------------- TRAINING EPOCH: 60 ----------------------------   
client [21] (testset)   loss: 4.7721 -> 6.1724  accuracy: 5.08% -> 2.54%       
client [84] (testset)   loss: 5.2493 -> 6.3133  accuracy: 14.97% -> 10.78%     
client [10] (testset)   loss: 4.0661 -> 4.0347  accuracy: 14.69% -> 12.99%     
client [36] (testset)   loss: 4.1748 -> 4.3215  accuracy: 13.27% -> 15.93%     
client [65] (testset)   loss: 4.0559 -> 5.2776  accuracy: 16.55% -> 5.52%      
client [81] (testset)   loss: 5.2455 -> 7.4762  accuracy: 8.33% -> 7.81%       
client [79] (testset)   loss: 7.9138 -> 6.2142  accuracy: 7.14% -> 18.57%      
client [42] (testset)   loss: 3.9733 -> 4.3333  accuracy: 14.49% -> 14.49%     
client [11] (testset)   loss: 4.1077 -> 4.0128  accuracy: 10.40% -> 15.20%     
client [96] (testset)   loss: 4.4844 -> 4.4481  accuracy: 12.26% -> 16.13%     
---------------------------- TRAINING EPOCH: 70 ----------------------------   
client [8]  (testset)   loss: 6.4538 -> 7.0136  accuracy: 8.28% -> 11.03%      
client [53] (testset)   loss: 3.8673 -> 4.2481  accuracy: 15.48% -> 9.03%      
client [52] (testset)   loss: 4.2602 -> 4.6412  accuracy: 19.89% -> 13.98%     
client [42] (testset)   loss: 4.6681 -> 4.9691  accuracy: 13.77% -> 16.67%     
client [69] (testset)   loss: 5.9556 -> 6.6254  accuracy: 17.07% -> 13.82%     
client [59] (testset)   loss: 5.6597 -> 5.6087  accuracy: 9.20% -> 11.66%      
client [7]  (testset)   loss: 5.2805 -> 5.4529  accuracy: 7.19% -> 11.51%      
client [26] (testset)   loss: 4.2526 -> 4.1017  accuracy: 9.59% -> 17.12%      
client [49] (testset)   loss: 4.6965 -> 4.2929  accuracy: 7.27% -> 8.18%       
client [98] (testset)   loss: 5.6608 -> 6.3478  accuracy: 12.43% -> 11.30%     
---------------------------- TRAINING EPOCH: 80 ----------------------------   
client [98] (testset)   loss: 6.3478 -> 6.5487  accuracy: 11.30% -> 12.99%     
client [47] (testset)   loss: 4.0628 -> 4.2202  accuracy: 15.94% -> 12.32%     
client [21] (testset)   loss: 12.0452 -> 5.0975 accuracy: 5.08% -> 6.78%       
client [77] (testset)   loss: 5.8479 -> 6.2648  accuracy: 11.19% -> 13.29%     
client [95] (testset)   loss: 5.0571 -> 5.9005  accuracy: 16.87% -> 15.06%     
client [91] (testset)   loss: 5.5051 -> 6.5571  accuracy: 11.76% -> 14.38%     
client [14] (testset)   loss: 5.1315 -> 6.1003  accuracy: 14.53% -> 15.12%     
client [99] (testset)   loss: 5.1966 -> 5.2592  accuracy: 9.74% -> 12.99%      
client [20] (testset)   loss: 7.6756 -> 8.2553  accuracy: 13.24% -> 12.50%     
client [39] (testset)   loss: 4.4870 -> 4.5799  accuracy: 13.87% -> 10.95%     
---------------------------- TRAINING EPOCH: 90 ----------------------------   
client [52] (testset)   loss: 4.6412 -> 5.6228  accuracy: 13.98% -> 16.67%     
client [62] (testset)   loss: 5.9138 -> 6.3886  accuracy: 17.75% -> 15.38%     
client [71] (testset)   loss: 8.6533 -> 6.3777  accuracy: 3.12% -> 13.28%      
client [97] (testset)   loss: 4.2365 -> 4.7328  accuracy: 15.19% -> 17.09%     
client [30] (testset)   loss: 6.3761 -> 7.1707  accuracy: 11.66% -> 14.72%     
client [88] (testset)   loss: 4.1613 -> 4.4391  accuracy: 19.53% -> 15.62%     
client [60] (testset)   loss: 5.4883 -> 6.2693  accuracy: 15.57% -> 10.66%     
client [82] (testset)   loss: 5.0475 -> 5.3281  accuracy: 14.18% -> 11.94%     
client [91] (testset)   loss: 6.5640 -> 6.3968  accuracy: 15.69% -> 15.03%     
client [57] (testset)   loss: 4.2414 -> 4.5939  accuracy: 12.41% -> 11.68%     
---------------------------- TRAINING EPOCH: 100 ----------------------------  
client [31] (testset)   loss: 8.6452 -> 8.8049  accuracy: 18.03% -> 19.67%     
client [15] (testset)   loss: 4.6436 -> 4.9454  accuracy: 15.56% -> 13.33%     
client [71] (testset)   loss: 6.3777 -> 6.5351  accuracy: 13.28% -> 12.50%     
client [97] (testset)   loss: 5.6363 -> 6.4040  accuracy: 19.62% -> 17.72%     
client [53] (testset)   loss: 5.3937 -> 5.2166  accuracy: 13.55% -> 12.90%     
client [77] (testset)   loss: 6.2648 -> 6.7568  accuracy: 13.29% -> 14.69%     
client [76] (testset)   loss: 6.0771 -> 6.3398  accuracy: 10.57% -> 7.32%      
client [79] (testset)   loss: 5.9137 -> 4.9865  accuracy: 12.86% -> 15.71%     
client [28] (testset)   loss: 7.2355 -> 7.5737  accuracy: 20.00% -> 18.79%     
client [99] (testset)   loss: 5.5391 -> 6.3058  accuracy: 11.04% -> 10.39%     
---------------------------- TRAINING EPOCH: 110 ----------------------------  
client [97] (testset)   loss: 6.8536 -> 7.3589  accuracy: 18.99% -> 19.62%     
client [86] (testset)   loss: 5.5823 -> 6.3448  accuracy: 24.36% -> 19.23%     
client [34] (testset)   loss: 7.1333 -> 7.2994  accuracy: 16.00% -> 17.60%     
client [73] (testset)   loss: 6.0155 -> 6.8420  accuracy: 12.50% -> 12.50%     
client [5]  (testset)   loss: 6.3737 -> 6.6672  accuracy: 12.41% -> 15.86%     
client [96] (testset)   loss: 8.2269 -> 8.6663  accuracy: 12.90% -> 12.90%     
client [22] (testset)   loss: 5.3902 -> 5.5205  accuracy: 9.46% -> 10.14%      
client [60] (testset)   loss: 7.2739 -> 7.3244  accuracy: 12.30% -> 10.66%     
client [66] (testset)   loss: 10.8030 -> 15.1151    accuracy: 0.00% -> 2.34%   
client [83] (testset)   loss: 5.9988 -> 6.3619  accuracy: 12.00% -> 15.20%     
---------------------------- TRAINING EPOCH: 120 ----------------------------  
client [76] (testset)   loss: 8.0122 -> 8.6748  accuracy: 8.94% -> 10.57%      
client [65] (testset)   loss: 5.5378 -> 6.1296  accuracy: 15.17% -> 17.24%     
client [95] (testset)   loss: 6.9565 -> 7.4676  accuracy: 18.07% -> 16.87%     
client [17] (testset)   loss: 4.7677 -> 5.2884  accuracy: 16.67% -> 10.87%     
client [8]  (testset)   loss: 8.1340 -> 8.5121  accuracy: 10.34% -> 11.72%     
client [35] (testset)   loss: 9.0727 -> 9.3244  accuracy: 11.59% -> 13.41%     
client [98] (testset)   loss: 7.6155 -> 8.0269  accuracy: 12.43% -> 14.12%     
client [53] (testset)   loss: 6.2724 -> 6.8519  accuracy: 12.90% -> 16.77%     
client [43] (testset)   loss: 7.3324 -> 6.9298  accuracy: 7.69% -> 12.31%      
client [64] (testset)   loss: 5.4494 -> 5.8767  accuracy: 17.49% -> 17.49%     
---------------------------- TRAINING EPOCH: 130 ----------------------------  
client [21] (testset)   loss: 6.4897 -> 7.2070  accuracy: 3.39% -> 5.08%       
client [88] (testset)   loss: 7.0062 -> 6.6943  accuracy: 8.59% -> 18.75%      
client [38] (testset)   loss: 6.0541 -> 6.4322  accuracy: 25.25% -> 26.26%     
client [3]  (testset)   loss: 7.6025 -> 7.8040  accuracy: 20.21% -> 20.21%     
client [5]  (testset)   loss: 7.0913 -> 7.4706  accuracy: 15.86% -> 15.17%     
client [41] (testset)   loss: 6.0348 -> 6.1387  accuracy: 22.11% -> 18.42%     
client [7]  (testset)   loss: 7.0255 -> 6.7484  accuracy: 10.07% -> 10.79%     
client [37] (testset)   loss: 5.9837 -> 6.1563  accuracy: 12.26% -> 12.90%     
client [45] (testset)   loss: 4.6988 -> 5.1774  accuracy: 14.69% -> 18.64%     
client [47] (testset)   loss: 5.0952 -> 5.0672  accuracy: 13.04% -> 14.49%     
---------------------------- TRAINING EPOCH: 140 ----------------------------  
client [16] (testset)   loss: 6.5241 -> 6.8559  accuracy: 17.45% -> 16.11%     
client [11] (testset)   loss: 6.3356 -> 6.5581  accuracy: 12.00% -> 12.80%     
client [37] (testset)   loss: 7.0824 -> 7.4631  accuracy: 14.19% -> 11.61%     
client [41] (testset)   loss: 6.1387 -> 6.5904  accuracy: 18.42% -> 22.63%     
client [95] (testset)   loss: 8.3588 -> 8.6293  accuracy: 16.27% -> 15.66%     
client [53] (testset)   loss: 6.8519 -> 6.8734  accuracy: 16.77% -> 14.19%     
client [22] (testset)   loss: 6.1884 -> 6.8752  accuracy: 8.78% -> 9.46%       
client [25] (testset)   loss: 5.8170 -> 6.4908  accuracy: 20.97% -> 21.51%     
client [69] (testset)   loss: 8.7595 -> 8.9644  accuracy: 13.82% -> 15.45%     
client [46] (testset)   loss: 7.9657 -> 7.5792  accuracy: 5.81% -> 8.14%       
---------------------------- TRAINING EPOCH: 150 ----------------------------  
client [47] (testset)   loss: 6.6250 -> 6.9369  accuracy: 13.04% -> 13.77%     
client [69] (testset)   loss: 9.1410 -> 9.2663  accuracy: 14.63% -> 14.63%     
client [82] (testset)   loss: 6.5631 -> 6.9753  accuracy: 11.19% -> 11.94%     
client [45] (testset)   loss: 6.1815 -> 6.9970  accuracy: 17.51% -> 19.77%     
client [7]  (testset)   loss: 6.7484 -> 7.3744  accuracy: 10.79% -> 7.91%      
client [50] (testset)   loss: 6.4789 -> 6.4970  accuracy: 9.62% -> 14.74%      
client [35] (testset)   loss: 9.6813 -> 9.8420  accuracy: 11.59% -> 13.41%     
client [24] (testset)   loss: 7.8304 -> 7.6741  accuracy: 10.94% -> 14.06%     
client [15] (testset)   loss: 7.2440 -> 7.7374  accuracy: 17.22% -> 18.89%     
client [58] (testset)   loss: 9.4540 -> 9.5616  accuracy: 15.48% -> 15.48%     
---------------------------- TRAINING EPOCH: 160 ----------------------------  
client [48] (testset)   loss: 8.4412 -> 8.6047  accuracy: 17.78% -> 17.78%     
client [76] (testset)   loss: 9.5391 -> 9.8741  accuracy: 13.01% -> 11.38%     
client [67] (testset)   loss: 7.4036 -> 6.7905  accuracy: 19.53% -> 19.53%     
client [37] (testset)   loss: 7.7738 -> 7.9286  accuracy: 10.32% -> 11.61%     
client [58] (testset)   loss: 9.6618 -> 9.7563  accuracy: 15.48% -> 15.48%     
client [64] (testset)   loss: 7.1395 -> 7.4190  accuracy: 19.13% -> 18.58%     
client [77] (testset)   loss: 7.3861 -> 7.8145  accuracy: 15.38% -> 16.08%     
client [55] (testset)   loss: 8.8422 -> 9.4347  accuracy: 13.79% -> 14.66%     
client [12] (testset)   loss: 8.8748 -> 9.1298  accuracy: 12.66% -> 12.03%     
client [89] (testset)   loss: 9.9887 -> 9.2360  accuracy: 12.14% -> 12.14%     
---------------------------- TRAINING EPOCH: 170 ----------------------------  
client [84] (testset)   loss: 9.6368 -> 9.7181  accuracy: 14.97% -> 14.97%     
client [51] (testset)   loss: 8.6418 -> 8.9086  accuracy: 20.62% -> 20.62%     
client [8]  (testset)   loss: 9.7675 -> 9.8961  accuracy: 11.03% -> 11.72%     
client [18] (testset)   loss: 6.7564 -> 7.0255  accuracy: 19.66% -> 22.47%     
client [94] (testset)   loss: 8.6022 -> 9.0002  accuracy: 10.81% -> 11.71%     
client [81] (testset)   loss: 7.5262 -> 7.7195  accuracy: 17.71% -> 17.19%     
client [3]  (testset)   loss: 8.3887 -> 8.5013  accuracy: 20.21% -> 19.17%     
client [11] (testset)   loss: 7.4421 -> 7.5871  accuracy: 12.00% -> 14.40%     
client [95] (testset)   loss: 9.3820 -> 9.4573  accuracy: 16.27% -> 16.27%     
client [67] (testset)   loss: 6.7905 -> 7.6257  accuracy: 19.53% -> 17.75%     
---------------------------- TRAINING EPOCH: 180 ----------------------------  
client [21] (testset)   loss: 9.5408 -> 7.3850  accuracy: 8.47% -> 8.47%       
client [79] (testset)   loss: 7.4417 -> 7.3114  accuracy: 23.57% -> 22.86%     
client [58] (testset)   loss: 9.9937 -> 10.0653 accuracy: 15.48% -> 15.48%     
client [88] (testset)   loss: 7.7774 -> 7.9390  accuracy: 17.97% -> 19.53%     
client [46] (testset)   loss: 9.6951 -> 10.1694 accuracy: 8.14% -> 8.14%       
client [11] (testset)   loss: 7.5871 -> 7.7971  accuracy: 14.40% -> 13.60%     
client [55] (testset)   loss: 10.7300 -> 10.8945    accuracy: 12.07% -> 12.07% 
client [13] (testset)   loss: 9.5146 -> 9.6167  accuracy: 11.11% -> 11.11%     
client [31] (testset)   loss: 9.1559 -> 9.2221  accuracy: 18.85% -> 18.85%     
client [75] (testset)   loss: 9.5469 -> 9.7591  accuracy: 11.43% -> 10.00%     
---------------------------- TRAINING EPOCH: 190 ----------------------------  
client [19] (testset)   loss: 9.5389 -> 9.6434  accuracy: 11.28% -> 11.28%     
client [7]  (testset)   loss: 9.0343 -> 9.3199  accuracy: 10.07% -> 10.07%     
client [57] (testset)   loss: 7.6913 -> 8.0070  accuracy: 14.60% -> 16.06%     
client [13] (testset)   loss: 9.7492 -> 9.8997  accuracy: 11.11% -> 11.11%     
client [43] (testset)   loss: 9.4219 -> 9.6193  accuracy: 11.54% -> 13.08%     
client [91] (testset)   loss: 8.5437 -> 8.6751  accuracy: 14.38% -> 13.07%     
client [10] (testset)   loss: 8.3255 -> 8.4587  accuracy: 17.51% -> 18.08%     
client [64] (testset)   loss: 8.1962 -> 8.3420  accuracy: 18.58% -> 18.03%     
client [82] (testset)   loss: 7.9128 -> 8.1323  accuracy: 12.69% -> 11.94%     
client [22] (testset)   loss: 8.6922 -> 8.9404  accuracy: 12.16% -> 11.49%     
---------------------------- TRAINING EPOCH: 200 ----------------------------  
client [20] (testset)   loss: 9.8007 -> 9.9366  accuracy: 14.71% -> 15.44%     
client [23] (testset)   loss: 8.0625 -> 7.1972  accuracy: 6.38% -> 8.51%       
client [88] (testset)   loss: 7.9390 -> 8.1904  accuracy: 19.53% -> 20.31%     
client [98] (testset)   loss: 9.6504 -> 9.7618  accuracy: 13.56% -> 13.56%     
client [79] (testset)   loss: 7.7922 -> 7.9938  accuracy: 22.86% -> 24.29%     
client [21] (testset)   loss: 7.1022 -> 7.9121  accuracy: 9.32% -> 8.47%       
client [92] (testset)   loss: 8.2864 -> 8.4357  accuracy: 14.19% -> 13.51%     
client [56] (testset)   loss: 11.0816 -> 11.2031    accuracy: 11.90% -> 11.90% 
client [5]  (testset)   loss: 8.5538 -> 8.6400  accuracy: 15.86% -> 15.86%     
client [52] (testset)   loss: 8.2643 -> 8.3639  accuracy: 19.89% -> 19.89%     
---------------------------- TRAINING EPOCH: 210 ----------------------------  
client [67] (testset)   loss: 9.3781 -> 9.5037  accuracy: 19.53% -> 19.53%     
client [54] (testset)   loss: 8.1453 -> 8.2324  accuracy: 15.28% -> 15.28%     
client [14] (testset)   loss: 8.6287 -> 8.7197  accuracy: 16.86% -> 16.86%     
client [99] (testset)   loss: 9.4429 -> 9.6518  accuracy: 15.58% -> 14.94%     
client [36] (testset)   loss: 10.5035 -> 10.5882    accuracy: 15.04% -> 15.04% 
client [30] (testset)   loss: 10.1712 -> 10.2734    accuracy: 12.88% -> 13.50% 
client [38] (testset)   loss: 7.5987 -> 7.7536  accuracy: 23.74% -> 23.74%     
client [15] (testset)   loss: 7.8809 -> 8.2354  accuracy: 16.11% -> 18.33%     
client [6]  (testset)   loss: 9.5471 -> 9.8305  accuracy: 9.32% -> 9.32%       
client [53] (testset)   loss: 9.0269 -> 9.1446  accuracy: 17.42% -> 17.42%     
---------------------------- TRAINING EPOCH: 220 ----------------------------  
client [99] (testset)   loss: 9.9119 -> 10.0114 accuracy: 14.94% -> 14.94%     
client [6]  (testset)   loss: 9.8305 -> 10.0829 accuracy: 9.32% -> 9.32%       
client [83] (testset)   loss: 9.3573 -> 9.4991  accuracy: 13.60% -> 14.40%     
client [42] (testset)   loss: 8.6114 -> 8.6980  accuracy: 16.67% -> 17.39%     
client [34] (testset)   loss: 8.8461 -> 8.9381  accuracy: 16.80% -> 16.80%     
client [15] (testset)   loss: 8.2354 -> 8.5619  accuracy: 18.33% -> 17.22%     
client [47] (testset)   loss: 8.5589 -> 8.6203  accuracy: 13.04% -> 13.77%     
client [55] (testset)   loss: 11.0350 -> 11.1559    accuracy: 12.07% -> 12.93% 
client [51] (testset)   loss: 9.2284 -> 9.3342  accuracy: 20.62% -> 20.62%     
client [95] (testset)   loss: 9.7839 -> 9.8553  accuracy: 16.27% -> 16.27%     
---------------------------- TRAINING EPOCH: 230 ----------------------------  
client [71] (testset)   loss: 8.3624 -> 8.7773  accuracy: 16.41% -> 17.97%     
client [15] (testset)   loss: 8.5619 -> 8.8265  accuracy: 17.22% -> 16.67%     
client [33] (testset)   loss: 7.7527 -> 7.8393  accuracy: 19.05% -> 19.05%     
client [99] (testset)   loss: 10.1346 -> 10.2188    accuracy: 14.29% -> 14.94% 
client [90] (testset)   loss: 8.0571 -> 8.1743  accuracy: 26.06% -> 26.06%     
client [57] (testset)   loss: 9.0813 -> 9.1731  accuracy: 16.06% -> 16.06%     
client [27] (testset)   loss: 9.6519 -> 9.7048  accuracy: 12.17% -> 13.04%     
client [78] (testset)   loss: 7.9136 -> 8.0992  accuracy: 19.42% -> 20.14%     
client [36] (testset)   loss: 10.6933 -> 10.7719    accuracy: 15.04% -> 15.04% 
client [88] (testset)   loss: 8.4182 -> 8.5744  accuracy: 19.53% -> 19.53%     
---------------------------- TRAINING EPOCH: 240 ----------------------------  
client [70] (testset)   loss: 9.8657 -> 9.9307  accuracy: 14.75% -> 14.75%     
client [35] (testset)   loss: 10.4982 -> 10.5692    accuracy: 11.59% -> 11.59% 
client [16] (testset)   loss: 9.3059 -> 9.3715  accuracy: 16.78% -> 17.45%     
client [80] (testset)   loss: 8.3444 -> 8.4753  accuracy: 15.54% -> 14.86%     
client [38] (testset)   loss: 7.9869 -> 8.0807  accuracy: 24.24% -> 24.24%     
client [78] (testset)   loss: 8.2477 -> 8.3518  accuracy: 19.42% -> 18.71%     
client [68] (testset)   loss: 8.4252 -> 8.5940  accuracy: 13.53% -> 13.53%     
client [11] (testset)   loss: 8.4035 -> 8.4954  accuracy: 14.40% -> 14.40%     
client [64] (testset)   loss: 8.7659 -> 8.8288  accuracy: 17.49% -> 18.03%     
client [82] (testset)   loss: 8.8903 -> 8.9925  accuracy: 11.94% -> 11.94%     
---------------------------- TRAINING EPOCH: 250 ----------------------------  
client [30] (testset)   loss: 10.7497 -> 10.8189    accuracy: 14.11% -> 13.50% 
client [27] (testset)   loss: 9.7048 -> 9.8217  accuracy: 13.04% -> 12.17%     
client [74] (testset)   loss: 7.8898 -> 8.0320  accuracy: 12.10% -> 12.10%     
client [45] (testset)   loss: 8.8507 -> 8.9531  accuracy: 19.21% -> 19.77%     
client [6]  (testset)   loss: 10.2297 -> 10.4094    accuracy: 9.32% -> 8.47%   
client [36] (testset)   loss: 10.8529 -> 10.9353    accuracy: 15.93% -> 15.93% 
client [63] (testset)   loss: 9.1143 -> 9.2589  accuracy: 17.24% -> 18.97%     
client [76] (testset)   loss: 11.1758 -> 11.2958    accuracy: 12.20% -> 12.20% 
client [83] (testset)   loss: 9.6991 -> 9.7924  accuracy: 14.40% -> 14.40%     
client [86] (testset)   loss: 10.4443 -> 10.5218    accuracy: 22.44% -> 22.44% 
---------------------------- TRAINING EPOCH: 260 ----------------------------  
client [83] (testset)   loss: 9.7924 -> 9.8940  accuracy: 14.40% -> 13.60%     
client [99] (testset)   loss: 10.3155 -> 10.4251    accuracy: 14.94% -> 13.64% 
client [74] (testset)   loss: 8.1521 -> 8.2655  accuracy: 12.10% -> 12.10%     
client [73] (testset)   loss: 10.8023 -> 10.9097    accuracy: 13.07% -> 13.07% 
client [29] (testset)   loss: 9.6257 -> 9.7426  accuracy: 17.28% -> 17.28%     
client [92] (testset)   loss: 9.0068 -> 9.1112  accuracy: 14.19% -> 13.51%     
client [6]  (testset)   loss: 10.5483 -> 10.6636    accuracy: 9.32% -> 8.47%   
client [61] (testset)   loss: 8.6024 -> 8.8307  accuracy: 15.82% -> 15.82%     
client [21] (testset)   loss: 9.5896 -> 9.8222  accuracy: 8.47% -> 8.47%       
client [67] (testset)   loss: 9.8200 -> 9.9076  accuracy: 19.53% -> 19.53%     
---------------------------- TRAINING EPOCH: 270 ----------------------------  
client [83] (testset)   loss: 9.8940 -> 9.9703  accuracy: 13.60% -> 14.40%     
client [32] (testset)   loss: 8.2032 -> 8.2767  accuracy: 19.69% -> 18.90%     
client [95] (testset)   loss: 9.9241 -> 9.9728  accuracy: 16.27% -> 16.27%     
client [61] (testset)   loss: 9.3075 -> 9.4661  accuracy: 15.25% -> 16.38%     
client [27] (testset)   loss: 9.8217 -> 9.8821  accuracy: 12.17% -> 13.04%     
client [25] (testset)   loss: 8.1659 -> 8.3353  accuracy: 17.74% -> 17.74%     
client [68] (testset)   loss: 9.0457 -> 9.1878  accuracy: 12.78% -> 13.53%     
client [34] (testset)   loss: 9.1281 -> 9.2156  accuracy: 17.60% -> 17.60%     
client [71] (testset)   loss: 9.3679 -> 9.4986  accuracy: 17.19% -> 17.19%     
client [89] (testset)   loss: 10.4932 -> 10.5534    accuracy: 12.14% -> 12.14% 
---------------------------- TRAINING EPOCH: 280 ----------------------------  
client [78] (testset)   loss: 9.0188 -> 9.0924  accuracy: 18.71% -> 18.71%     
client [81] (testset)   loss: 8.6853 -> 8.7323  accuracy: 16.67% -> 16.67%     
client [51] (testset)   loss: 9.8545 -> 9.9482  accuracy: 20.62% -> 19.38%     
client [54] (testset)   loss: 8.4197 -> 8.4776  accuracy: 15.28% -> 15.28%     
client [65] (testset)   loss: 9.8800 -> 9.9732  accuracy: 15.17% -> 14.48%     
client [41] (testset)   loss: 8.5312 -> 8.5792  accuracy: 21.58% -> 20.53%     
client [11] (testset)   loss: 8.6574 -> 8.7322  accuracy: 14.40% -> 14.40%     
client [85] (testset)   loss: 9.9313 -> 10.0505 accuracy: 14.91% -> 14.29%     
client [12] (testset)   loss: 10.3668 -> 10.4563    accuracy: 11.39% -> 11.39% 
client [23] (testset)   loss: 9.8560 -> 10.1258 accuracy: 7.80% -> 8.51%       
---------------------------- TRAINING EPOCH: 290 ----------------------------  
client [16] (testset)   loss: 9.5054 -> 9.5768  accuracy: 17.45% -> 16.78%     
client [65] (testset)   loss: 10.0506 -> 10.1412    accuracy: 13.79% -> 14.48% 
client [53] (testset)   loss: 9.7703 -> 9.8469  accuracy: 17.42% -> 17.42%     
client [58] (testset)   loss: 10.6062 -> 10.6458    accuracy: 15.48% -> 15.48% 
client [72] (testset)   loss: 10.5940 -> 10.6793    accuracy: 11.61% -> 11.61% 
client [7]  (testset)   loss: 10.5792 -> 10.5375    accuracy: 10.79% -> 10.07% 
client [71] (testset)   loss: 9.4986 -> 9.6317  accuracy: 17.19% -> 17.19%     
client [59] (testset)   loss: 9.5138 -> 9.5756  accuracy: 20.86% -> 19.63%     
client [86] (testset)   loss: 10.8362 -> 10.9013    accuracy: 22.44% -> 21.79% 
client [39] (testset)   loss: 10.4210 -> 10.4852    accuracy: 13.87% -> 13.87% 
---------------------------- TRAINING EPOCH: 300 ----------------------------  
client [99] (testset)   loss: 10.6095 -> 10.6422    accuracy: 14.29% -> 14.29% 
client [7]  (testset)   loss: 10.6019 -> 10.7072    accuracy: 10.07% -> 10.07% 
client [17] (testset)   loss: 9.9671 -> 10.0326 accuracy: 15.22% -> 14.49%     
client [64] (testset)   loss: 9.2635 -> 9.3103  accuracy: 17.49% -> 17.49%     
client [37] (testset)   loss: 9.4233 -> 9.4823  accuracy: 12.90% -> 12.90%     
client [29] (testset)   loss: 10.1274 -> 10.2064    accuracy: 17.28% -> 17.28% 
client [93] (testset)   loss: 10.0701 -> 10.1536    accuracy: 13.77% -> 13.77% 
client [73] (testset)   loss: 11.3223 -> 11.3938    accuracy: 13.07% -> 13.07% 
client [40] (testset)   loss: 9.0103 -> 9.0734  accuracy: 17.86% -> 17.86%     
client [76] (testset)   loss: 11.5801 -> 11.6691    accuracy: 12.20% -> 12.20% 
---------------------------- TRAINING EPOCH: 310 ----------------------------  
client [31] (testset)   loss: 10.0446 -> 10.0821    accuracy: 18.03% -> 18.85% 
client [89] (testset)   loss: 10.8208 -> 10.9032    accuracy: 12.14% -> 12.14% 
client [77] (testset)   loss: 9.8662 -> 9.9188  accuracy: 14.69% -> 14.69%     
client [90] (testset)   loss: 9.0328 -> 9.0879  accuracy: 26.06% -> 26.06%     
client [26] (testset)   loss: 8.3322 -> 8.4995  accuracy: 19.18% -> 19.18%     
client [50] (testset)   loss: 10.7587 -> 10.8485    accuracy: 14.74% -> 14.74% 
client [30] (testset)   loss: 11.1584 -> 11.2185    accuracy: 13.50% -> 13.50% 
client [70] (testset)   loss: 10.1907 -> 10.2343    accuracy: 14.75% -> 14.21% 
client [41] (testset)   loss: 8.7158 -> 8.7638  accuracy: 21.05% -> 21.05%     
client [99] (testset)   loss: 10.6422 -> 10.7131    accuracy: 14.29% -> 14.94% 
---------------------------- TRAINING EPOCH: 320 ----------------------------  
client [68] (testset)   loss: 9.8545 -> 9.9060  accuracy: 13.53% -> 13.53%     
client [70] (testset)   loss: 10.3232 -> 10.3639    accuracy: 14.75% -> 14.21% 
client [52] (testset)   loss: 9.0871 -> 9.1383  accuracy: 19.89% -> 19.89%     
client [1]  (testset)   loss: 9.1113 -> 9.2343  accuracy: 16.06% -> 16.79%     
client [2]  (testset)   loss: 9.6705 -> 9.7509  accuracy: 13.97% -> 13.97%     
client [67] (testset)   loss: 10.4844 -> 10.5417    accuracy: 19.53% -> 19.53% 
client [92] (testset)   loss: 9.9640 -> 10.0112 accuracy: 13.51% -> 13.51%     
client [35] (testset)   loss: 10.9215 -> 10.9861    accuracy: 11.59% -> 11.59% 
client [36] (testset)   loss: 11.4889 -> 11.5402    accuracy: 15.93% -> 15.04% 
client [64] (testset)   loss: 9.3603 -> 9.3961  accuracy: 17.49% -> 17.49%     
---------------------------- TRAINING EPOCH: 330 ----------------------------  
client [44] (testset)   loss: 9.2016 -> 9.2360  accuracy: 18.12% -> 20.13%     
client [6]  (testset)   loss: 11.2533 -> 11.3216    accuracy: 8.47% -> 7.63%   
client [12] (testset)   loss: 10.7574 -> 10.8204    accuracy: 10.76% -> 10.76% 
client [55] (testset)   loss: 11.7955 -> 11.8731    accuracy: 12.93% -> 12.93% 
client [29] (testset)   loss: 10.4369 -> 10.4927    accuracy: 16.67% -> 17.28% 
client [9]  (testset)   loss: 10.7341 -> 10.7794    accuracy: 11.81% -> 11.11% 
client [43] (testset)   loss: 11.0235 -> 11.0852    accuracy: 12.31% -> 12.31% 
client [77] (testset)   loss: 9.9188 -> 9.9711  accuracy: 14.69% -> 14.69%     
client [98] (testset)   loss: 10.7378 -> 10.7906    accuracy: 12.99% -> 14.12% 
client [78] (testset)   loss: 9.3143 -> 9.3297  accuracy: 18.71% -> 18.71%     
---------------------------- TRAINING EPOCH: 340 ----------------------------  
client [92] (testset)   loss: 10.0959 -> 10.1305    accuracy: 13.51% -> 13.51% 
client [80] (testset)   loss: 8.8906 -> 8.9565  accuracy: 15.54% -> 15.54%     
client [63] (testset)   loss: 9.9145 -> 9.9782  accuracy: 17.82% -> 17.82%     
client [76] (testset)   loss: 11.8395 -> 11.9099    accuracy: 12.20% -> 12.20% 
client [78] (testset)   loss: 9.3297 -> 9.3687  accuracy: 18.71% -> 19.42%     
client [25] (testset)   loss: 8.6967 -> 8.7958  accuracy: 17.74% -> 17.74%     
client [58] (testset)   loss: 10.8093 -> 10.8459    accuracy: 15.48% -> 15.48% 
client [13] (testset)   loss: 10.7722 -> 10.8385    accuracy: 11.11% -> 11.11% 
client [17] (testset)   loss: 10.3207 -> 10.3747    accuracy: 15.22% -> 15.22% 
client [38] (testset)   loss: 9.0713 -> 9.1000  accuracy: 23.74% -> 23.74%     
---------------------------- TRAINING EPOCH: 350 ----------------------------  
client [72] (testset)   loss: 11.2116 -> 11.2702    accuracy: 11.61% -> 11.61% 
client [82] (testset)   loss: 9.6709 -> 9.7107  accuracy: 11.94% -> 11.94%     
client [86] (testset)   loss: 11.3624 -> 11.4102    accuracy: 22.44% -> 21.15% 
client [51] (testset)   loss: 10.1723 -> 10.2785    accuracy: 20.62% -> 20.62% 
client [96] (testset)   loss: 11.1897 -> 11.2405    accuracy: 12.90% -> 12.90% 
client [42] (testset)   loss: 9.4721 -> 9.5133  accuracy: 17.39% -> 17.39%     
client [55] (testset)   loss: 12.1672 -> 12.2373    accuracy: 12.93% -> 13.79% 
client [13] (testset)   loss: 10.8972 -> 10.9456    accuracy: 11.11% -> 11.11% 
client [1]  (testset)   loss: 9.4278 -> 9.5092  accuracy: 15.33% -> 16.06%     
client [12] (testset)   loss: 10.8204 -> 10.8810    accuracy: 10.76% -> 11.39% 
---------------------------- TRAINING EPOCH: 360 ----------------------------  
client [68] (testset)   loss: 10.0318 -> 10.0893    accuracy: 13.53% -> 13.53% 
client [23] (testset)   loss: 11.0118 -> 11.1138    accuracy: 7.80% -> 7.80%   
client [46] (testset)   loss: 12.9500 -> 13.0257    accuracy: 6.98% -> 6.98%   
client [41] (testset)   loss: 8.9197 -> 8.9584  accuracy: 21.05% -> 21.05%     
client [25] (testset)   loss: 9.0528 -> 9.1244  accuracy: 17.74% -> 17.74%     
client [58] (testset)   loss: 10.8850 -> 10.9184    accuracy: 15.48% -> 15.48% 
client [14] (testset)   loss: 9.3467 -> 9.3913  accuracy: 16.86% -> 16.86%     
client [33] (testset)   loss: 8.4505 -> 8.4999  accuracy: 19.84% -> 19.84%     
client [85] (testset)   loss: 10.6182 -> 10.6783    accuracy: 14.91% -> 14.91% 
client [62] (testset)   loss: 9.3201 -> 9.3823  accuracy: 17.16% -> 17.16%     
---------------------------- TRAINING EPOCH: 370 ----------------------------  
client [98] (testset)   loss: 11.0086 -> 11.0463    accuracy: 12.99% -> 13.56% 
client [63] (testset)   loss: 10.1177 -> 10.1752    accuracy: 17.82% -> 17.24% 
client [70] (testset)   loss: 10.5586 -> 10.5866    accuracy: 14.75% -> 14.75% 
client [65] (testset)   loss: 10.4116 -> 10.4830    accuracy: 13.79% -> 13.79% 
client [14] (testset)   loss: 9.4839 -> 9.5276  accuracy: 16.86% -> 16.86%     
client [73] (testset)   loss: 11.7034 -> 11.7663    accuracy: 13.07% -> 13.07% 
client [34] (testset)   loss: 9.8418 -> 9.8909  accuracy: 16.80% -> 17.60%     
client [99] (testset)   loss: 10.8997 -> 10.9649    accuracy: 14.94% -> 14.29% 
client [69] (testset)   loss: 10.7680 -> 10.7928    accuracy: 15.45% -> 15.45% 
client [46] (testset)   loss: 13.0257 -> 13.0779    accuracy: 6.98% -> 6.98%   
---------------------------- TRAINING EPOCH: 380 ----------------------------  
client [99] (testset)   loss: 11.0279 -> 11.0773    accuracy: 13.64% -> 13.64% 
client [93] (testset)   loss: 10.3979 -> 10.4670    accuracy: 13.77% -> 13.04% 
client [11] (testset)   loss: 9.2026 -> 9.2484  accuracy: 14.40% -> 14.40%     
client [58] (testset)   loss: 11.0189 -> 11.0489    accuracy: 15.48% -> 15.48% 
client [81] (testset)   loss: 9.2738 -> 9.3173  accuracy: 16.15% -> 16.15%     
client [85] (testset)   loss: 10.6783 -> 10.7454    accuracy: 14.91% -> 14.91% 
client [89] (testset)   loss: 11.2537 -> 11.3166    accuracy: 12.14% -> 12.86% 
client [45] (testset)   loss: 9.6277 -> 9.6823  accuracy: 19.77% -> 19.21%     
client [8]  (testset)   loss: 11.1357 -> 11.1914    accuracy: 11.72% -> 11.72% 
client [68] (testset)   loss: 10.2889 -> 10.3363    accuracy: 13.53% -> 13.53% 
---------------------------- TRAINING EPOCH: 390 ----------------------------  
client [67] (testset)   loss: 10.7444 -> 10.7933    accuracy: 19.53% -> 19.53% 
client [72] (testset)   loss: 11.4707 -> 11.5211    accuracy: 11.61% -> 11.61% 
client [1]  (testset)   loss: 9.6709 -> 9.7556  accuracy: 16.06% -> 16.06%     
client [78] (testset)   loss: 9.6743 -> 9.7212  accuracy: 19.42% -> 18.71%     
client [83] (testset)   loss: 10.8458 -> 10.8909    accuracy: 14.40% -> 14.40% 
client [21] (testset)   loss: 11.1817 -> 11.3606    accuracy: 7.63% -> 7.63%   
client [56] (testset)   loss: 12.7424 -> 12.7837    accuracy: 11.90% -> 11.90% 
client [44] (testset)   loss: 9.6166 -> 9.6630  accuracy: 18.12% -> 19.46%     
client [92] (testset)   loss: 10.2528 -> 10.2786    accuracy: 13.51% -> 13.51% 
client [27] (testset)   loss: 10.5497 -> 10.5856    accuracy: 13.04% -> 13.04% 
---------------------------- TRAINING EPOCH: 400 ----------------------------  
client [10] (testset)   loss: 10.0095 -> 10.0380    accuracy: 18.64% -> 18.64% 
client [39] (testset)   loss: 10.7450 -> 10.7965    accuracy: 13.87% -> 13.87% 
client [65] (testset)   loss: 10.6495 -> 10.7051    accuracy: 13.79% -> 13.79% 
client [26] (testset)   loss: 9.3548 -> 9.4300  accuracy: 19.18% -> 17.81%     
client [19] (testset)   loss: 10.9915 -> 11.0262    accuracy: 11.28% -> 11.28% 
client [68] (testset)   loss: 10.3789 -> 10.4200    accuracy: 13.53% -> 13.53% 
client [41] (testset)   loss: 9.0902 -> 9.1203  accuracy: 21.05% -> 21.05%     
client [50] (testset)   loss: 11.7592 -> 11.8049    accuracy: 16.03% -> 16.03% 
client [75] (testset)   loss: 11.3274 -> 11.3613    accuracy: 10.00% -> 10.71% 
client [81] (testset)   loss: 9.3746 -> 9.4118  accuracy: 16.67% -> 16.67%     
Training... ---------------------------------------- 100% 0:11:36
Local-only's average time taken by each global epoch: 0 min 1.73 sec.          
Local-only's total running time: 0 h 11 m 36 s.                                
==================== Local-only Experiment Results: ====================       
Display format: (before local fine-tuning) -> (after local fine-tuning)        
 So if finetune_epoch = 0, x.xx% -> 0.00% is normal.                           
 Centralized testing ONLY happens after model aggregation, so the stats between
'->' are the same.                                                             
{                                                                              
    "100": {                                                                   
        "all_clients": {                                                       
            "test": {                                                          
                "loss": "6.2952 -> 0.0000",                                    
                "accuracy": "13.53% -> 0.00%"                                  
            }                                                                  
        }                                                                      
    },                                                                         
    "200": {                                                                   
        "all_clients": {                                                       
            "test": {                                                          
                "loss": "8.7566 -> 0.0000",                                    
                "accuracy": "15.49% -> 0.00%"                                  
            }                                                                  
        }                                                                      
    },                                                                         
    "300": {                                                                   
        "all_clients": {                                                       
            "test": {                                                          
                "loss": "9.8763 -> 0.0000",                                    
                "accuracy": "15.37% -> 0.00%"                                  
            }                                                                  
        }                                                                      
    },                                                                         
    "400": {                                                                   
        "all_clients": {                                                       
            "test": {                                                          
                "loss": "10.4441 -> 0.0000",                                   
                "accuracy": "15.31% -> 0.00%"                                  
            }                                                                  
        }                                                                      
    }                                                                          
}                                                                              
==================== Local-only Max Accuracy ====================              
all_clients:                                                                   
(test) before fine-tuning: 15.49% at epoch 200                                 
(test) after fine-tuning: 0.00% at epoch 100                                   
[0m