==================== PSFL ====================                                 
Experiment Arguments:                                                          
{
│   'method': 'psfl',
│   'dataset': {
│   │   'name': 'fmnist',
│   │   'client_num': 100,
│   │   'test_ratio': 0.25,
│   │   'val_ratio': 0.0,
│   │   'seed': 42,
│   │   'split': 'sample',
│   │   'IID_ratio': 0.0,
│   │   'monitor_window_name_suffix': 'fmnist-100clients-0%IID-Dir(0.5)-seed42',
│   │   'alpha': 0.5,
│   │   'min_samples_per_client': 10
│   },
│   'model': {
│   │   'name': 'avgcnn',
│   │   'use_torchvision_pretrained_weights': True,
│   │   'external_model_weights_path': None
│   },
│   'optimizer': {
│   │   'lr': 0.01,
│   │   'dampening': 0,
│   │   'weight_decay': 0,
│   │   'momentum': 0,
│   │   'nesterov': False,
│   │   'name': 'sgd'
│   },
│   'mode': 'sequential',
│   'parallel': {
│   │   'ray_cluster_addr': None,
│   │   'num_cpus': None,
│   │   'num_gpus': None,
│   │   'num_workers': 2
│   },
│   'common': {
│   │   'seed': 42,
│   │   'join_ratio': 0.1,
│   │   'global_epoch': 400,
│   │   'local_epoch': 5,
│   │   'batch_size': 32,
│   │   'reset_optimizer_on_global_epoch': True,
│   │   'straggler_ratio': 0,
│   │   'straggler_min_local_epoch': 0,
│   │   'buffers': 'global',
│   │   'client_side_evaluation': True,
│   │   'test': {
│   │   │   'client': {
│   │   │   │   'interval': 100,
│   │   │   │   'finetune_epoch': 0,
│   │   │   │   'train': False,
│   │   │   │   'val': False,
│   │   │   │   'test': True
│   │   │   },
│   │   │   'server': {
│   │   │   │   'interval': -1,
│   │   │   │   'train': False,
│   │   │   │   'val': False,
│   │   │   │   'test': False,
│   │   │   │   'model_in_train_mode': False
│   │   │   }
│   │   },
│   │   'verbose_gap': 10,
│   │   'monitor': None,
│   │   'use_cuda': True,
│   │   'save_log': True,
│   │   'save_model': False,
│   │   'save_learning_curve_plot': False,
│   │   'save_metrics': True,
│   │   'delete_useless_run': True
│   },
│   'psfl': {
│   │   'alpha': 0.0,
│   │   'CLS': False,
│   │   'ig_ratio': 0.9997,
│   │   'track': False
│   }
}
---------------------------- TRAINING EPOCH: 10 ----------------------------   
client [77] (testset)   loss: 0.4288 -> 0.2563  accuracy: 81.14% -> 91.43%     
client [81] (testset)   loss: 0.3504 -> 0.1679  accuracy: 88.14% -> 91.53%     
client [21] (testset)   loss: 1.0413 -> 0.3187  accuracy: 63.52% -> 87.42%     
client [68] (testset)   loss: 0.8448 -> 0.3423  accuracy: 65.22% -> 87.27%     
client [93] (testset)   loss: 0.7956 -> 0.7437  accuracy: 71.33% -> 70.28%     
client [31] (testset)   loss: 0.3265 -> 0.2887  accuracy: 88.59% -> 87.25%     
client [20] (testset)   loss: 0.3416 -> 0.1670  accuracy: 85.71% -> 94.69%     
client [59] (testset)   loss: 0.5404 -> 0.3314  accuracy: 79.63% -> 92.59%     
client [48] (testset)   loss: 1.2505 -> 0.5505  accuracy: 68.29% -> 74.80%     
client [34] (testset)   loss: 0.4252 -> 0.2287  accuracy: 87.43% -> 91.80%     
---------------------------- TRAINING EPOCH: 20 ----------------------------   
client [69] (testset)   loss: 0.2781 -> 0.2735  accuracy: 89.12% -> 89.12%     
client [99] (testset)   loss: 0.1298 -> 0.1165  accuracy: 95.19% -> 96.15%     
client [67] (testset)   loss: 0.4627 -> 0.1999  accuracy: 84.85% -> 91.77%     
client [0]  (testset)   loss: 0.3989 -> 0.3392  accuracy: 85.89% -> 89.63%     
client [76] (testset)   loss: 0.9793 -> 0.3352  accuracy: 62.60% -> 87.40%     
client [41] (testset)   loss: 0.7001 -> 0.0990  accuracy: 76.59% -> 96.10%     
client [62] (testset)   loss: 0.3821 -> 0.1572  accuracy: 87.79% -> 93.89%     
client [2]  (testset)   loss: 0.4413 -> 0.2585  accuracy: 83.66% -> 92.16%     
client [14] (testset)   loss: 0.4406 -> 0.2064  accuracy: 82.99% -> 91.70%     
client [46] (testset)   loss: 0.4300 -> 0.2975  accuracy: 82.68% -> 89.22%     
---------------------------- TRAINING EPOCH: 30 ----------------------------   
client [24] (testset)   loss: 0.2196 -> 0.2146  accuracy: 92.79% -> 93.24%     
client [68] (testset)   loss: 0.3377 -> 0.3186  accuracy: 87.27% -> 87.89%     
client [57] (testset)   loss: 0.5480 -> 0.1427  accuracy: 84.07% -> 95.59%     
client [17] (testset)   loss: 0.4179 -> 0.2281  accuracy: 88.36% -> 93.84%     
client [54] (testset)   loss: 0.6140 -> 0.3116  accuracy: 81.44% -> 85.05%     
client [23] (testset)   loss: 0.7887 -> 0.4570  accuracy: 80.00% -> 81.43%     
client [35] (testset)   loss: 0.2496 -> 0.1424  accuracy: 92.26% -> 94.19%     
client [59] (testset)   loss: 0.1638 -> 0.1582  accuracy: 95.37% -> 96.30%     
client [31] (testset)   loss: 0.5336 -> 0.2015  accuracy: 82.55% -> 91.95%     
client [9]  (testset)   loss: 0.1474 -> 0.0958  accuracy: 95.19% -> 96.79%     
---------------------------- TRAINING EPOCH: 40 ----------------------------   
client [64] (testset)   loss: 0.3226 -> 0.1275  accuracy: 89.54% -> 94.98%     
client [33] (testset)   loss: 0.4461 -> 0.3597  accuracy: 84.71% -> 87.60%     
client [16] (testset)   loss: 0.4295 -> 0.3113  accuracy: 87.22% -> 90.23%     
client [44] (testset)   loss: 0.7795 -> 0.3798  accuracy: 74.52% -> 86.98%     
client [8]  (testset)   loss: 0.1928 -> 0.1396  accuracy: 93.14% -> 94.12%     
client [31] (testset)   loss: 0.2524 -> 0.1961  accuracy: 91.95% -> 90.60%     
client [47] (testset)   loss: 0.7611 -> 0.1701  accuracy: 73.61% -> 93.06%     
client [36] (testset)   loss: 0.3428 -> 0.1240  accuracy: 86.18% -> 95.39%     
client [20] (testset)   loss: 0.3583 -> 0.1469  accuracy: 89.80% -> 96.33%     
client [56] (testset)   loss: 0.5735 -> 0.3475  accuracy: 79.08% -> 86.73%     
---------------------------- TRAINING EPOCH: 50 ----------------------------   
client [4]  (testset)   loss: 0.9799 -> 0.4795  accuracy: 70.16% -> 86.29%     
client [60] (testset)   loss: 0.2449 -> 0.1124  accuracy: 93.33% -> 96.00%     
client [28] (testset)   loss: 0.4938 -> 0.3055  accuracy: 87.00% -> 89.69%     
client [25] (testset)   loss: 0.5319 -> 0.2519  accuracy: 84.35% -> 91.98%     
client [58] (testset)   loss: 0.4367 -> 0.3307  accuracy: 82.32% -> 87.29%     
client [44] (testset)   loss: 0.4748 -> 0.3670  accuracy: 84.76% -> 88.64%     
client [39] (testset)   loss: 0.2320 -> 0.2803  accuracy: 91.04% -> 90.30%     
client [29] (testset)   loss: 0.4365 -> 0.2854  accuracy: 83.33% -> 88.33%     
client [3]  (testset)   loss: 0.2049 -> 0.1736  accuracy: 93.59% -> 92.31%     
client [84] (testset)   loss: 0.2219 -> 0.2644  accuracy: 93.30% -> 93.81%     
---------------------------- TRAINING EPOCH: 60 ----------------------------   
client [21] (testset)   loss: 0.6731 -> 0.3224  accuracy: 78.62% -> 87.42%     
client [84] (testset)   loss: 0.4485 -> 0.2653  accuracy: 87.11% -> 94.85%     
client [10] (testset)   loss: 0.3023 -> 0.2549  accuracy: 89.93% -> 94.24%     
client [36] (testset)   loss: 0.2979 -> 0.0940  accuracy: 91.71% -> 97.24%     
client [65] (testset)   loss: 0.5864 -> 0.1480  accuracy: 82.35% -> 94.85%     
client [81] (testset)   loss: 0.1455 -> 0.0490  accuracy: 94.92% -> 98.31%     
client [79] (testset)   loss: 0.3719 -> 0.2723  accuracy: 85.06% -> 87.66%     
client [42] (testset)   loss: 0.8983 -> 0.2210  accuracy: 73.57% -> 92.95%     
client [11] (testset)   loss: 0.2284 -> 0.1006  accuracy: 93.45% -> 97.62%     
client [96] (testset)   loss: 0.3368 -> 0.3000  accuracy: 88.65% -> 91.70%     
---------------------------- TRAINING EPOCH: 70 ----------------------------   
client [8]  (testset)   loss: 1.1711 -> 0.1855  accuracy: 73.53% -> 94.12%     
client [53] (testset)   loss: 0.2839 -> 0.2060  accuracy: 90.44% -> 94.12%     
client [52] (testset)   loss: 0.1489 -> 0.1082  accuracy: 92.67% -> 94.67%     
client [42] (testset)   loss: 0.2979 -> 0.2068  accuracy: 89.87% -> 93.83%     
client [69] (testset)   loss: 0.3949 -> 0.3056  accuracy: 87.07% -> 90.48%     
client [59] (testset)   loss: 0.1936 -> 0.1432  accuracy: 92.59% -> 97.22%     
client [7]  (testset)   loss: 0.2590 -> 0.2197  accuracy: 94.24% -> 94.65%     
client [26] (testset)   loss: 0.3754 -> 0.1052  accuracy: 89.61% -> 97.40%     
client [49] (testset)   loss: 0.7027 -> 0.2747  accuracy: 77.93% -> 86.21%     
client [98] (testset)   loss: 0.1383 -> 0.0954  accuracy: 94.50% -> 96.22%     
---------------------------- TRAINING EPOCH: 80 ----------------------------   
client [98] (testset)   loss: 0.1759 -> 0.1147  accuracy: 95.19% -> 97.25%     
client [47] (testset)   loss: 0.4928 -> 0.1944  accuracy: 86.11% -> 94.44%     
client [21] (testset)   loss: 0.6661 -> 0.2838  accuracy: 84.28% -> 90.57%     
client [77] (testset)   loss: 0.3243 -> 0.2321  accuracy: 91.43% -> 92.00%     
client [95] (testset)   loss: 0.5776 -> 0.3433  accuracy: 88.57% -> 92.38%     
client [91] (testset)   loss: 0.3086 -> 0.2183  accuracy: 91.14% -> 94.94%     
client [14] (testset)   loss: 0.2568 -> 0.1935  accuracy: 92.12% -> 90.87%     
client [99] (testset)   loss: 0.0913 -> 0.0503  accuracy: 96.15% -> 98.08%     
client [20] (testset)   loss: 0.2439 -> 0.1319  accuracy: 93.06% -> 96.33%     
client [39] (testset)   loss: 0.3133 -> 0.3659  accuracy: 91.04% -> 91.04%     
---------------------------- TRAINING EPOCH: 90 ----------------------------   
client [52] (testset)   loss: 0.1451 -> 0.0888  accuracy: 95.33% -> 98.00%     
client [62] (testset)   loss: 0.0768 -> 0.0516  accuracy: 96.95% -> 98.47%     
client [71] (testset)   loss: 0.2127 -> 0.2587  accuracy: 93.75% -> 93.75%     
client [97] (testset)   loss: 0.1592 -> 0.0948  accuracy: 93.86% -> 95.61%     
client [30] (testset)   loss: 0.2761 -> 0.2569  accuracy: 89.01% -> 90.11%     
client [88] (testset)   loss: 0.3963 -> 0.3333  accuracy: 91.28% -> 93.29%     
client [60] (testset)   loss: 0.1598 -> 0.1092  accuracy: 96.00% -> 96.00%     
client [82] (testset)   loss: 0.3514 -> 0.6132  accuracy: 89.41% -> 84.32%     
client [91] (testset)   loss: 1.0869 -> 0.1861  accuracy: 79.75% -> 95.57%     
client [57] (testset)   loss: 0.2240 -> 0.1154  accuracy: 92.20% -> 95.93%     
---------------------------- TRAINING EPOCH: 100 ----------------------------  
client [31] (testset)   loss: 0.2402 -> 0.2010  accuracy: 91.95% -> 91.95%     
client [15] (testset)   loss: 0.1639 -> 0.1489  accuracy: 95.45% -> 95.45%     
client [71] (testset)   loss: 0.1922 -> 0.3058  accuracy: 93.75% -> 87.50%     
client [97] (testset)   loss: 0.1480 -> 0.1178  accuracy: 94.74% -> 95.61%     
client [53] (testset)   loss: 0.1577 -> 0.1586  accuracy: 94.85% -> 94.12%     
client [77] (testset)   loss: 0.4049 -> 0.2305  accuracy: 89.71% -> 92.57%     
client [76] (testset)   loss: 0.6170 -> 0.2352  accuracy: 82.82% -> 92.37%     
client [79] (testset)   loss: 0.6235 -> 0.7002  accuracy: 79.22% -> 83.12%     
client [28] (testset)   loss: 0.7801 -> 0.3348  accuracy: 77.13% -> 92.38%     
client [99] (testset)   loss: 0.3358 -> 0.0584  accuracy: 87.50% -> 97.12%     
---------------------------- TRAINING EPOCH: 110 ----------------------------  
client [97] (testset)   loss: 0.1763 -> 0.1034  accuracy: 93.86% -> 95.61%     
client [86] (testset)   loss: 0.5554 -> 0.5167  accuracy: 86.46% -> 86.46%     
client [34] (testset)   loss: 0.3704 -> 0.2276  accuracy: 90.16% -> 91.26%     
client [73] (testset)   loss: 0.4174 -> 0.2251  accuracy: 91.40% -> 93.67%     
client [5]  (testset)   loss: 0.1896 -> 0.2036  accuracy: 95.25% -> 95.59%     
client [96] (testset)   loss: 0.4894 -> 0.3397  accuracy: 87.77% -> 92.14%     
client [22] (testset)   loss: 0.2515 -> 0.2949  accuracy: 91.06% -> 94.31%     
client [60] (testset)   loss: 0.2532 -> 0.1372  accuracy: 92.00% -> 96.67%     
client [66] (testset)   loss: 0.3781 -> 0.0904  accuracy: 88.50% -> 96.46%     
client [83] (testset)   loss: 0.2437 -> 0.1760  accuracy: 90.59% -> 92.94%     
---------------------------- TRAINING EPOCH: 120 ----------------------------  
client [76] (testset)   loss: 0.3352 -> 0.2768  accuracy: 92.37% -> 92.37%     
client [65] (testset)   loss: 0.4412 -> 0.2115  accuracy: 89.71% -> 93.38%     
client [95] (testset)   loss: 0.4189 -> 0.3995  accuracy: 93.33% -> 93.33%     
client [17] (testset)   loss: 0.3108 -> 0.2210  accuracy: 92.47% -> 93.84%     
client [8]  (testset)   loss: 0.4170 -> 0.1818  accuracy: 88.24% -> 95.10%     
client [35] (testset)   loss: 0.1561 -> 0.0757  accuracy: 96.13% -> 97.42%     
client [98] (testset)   loss: 0.1353 -> 0.1140  accuracy: 95.53% -> 97.59%     
client [53] (testset)   loss: 0.2780 -> 0.1977  accuracy: 93.38% -> 96.32%     
client [43] (testset)   loss: 0.4830 -> 0.3103  accuracy: 88.07% -> 93.12%     
client [64] (testset)   loss: 0.2510 -> 0.1760  accuracy: 93.72% -> 94.98%     
---------------------------- TRAINING EPOCH: 130 ----------------------------  
client [21] (testset)   loss: 0.4840 -> 0.4001  accuracy: 85.53% -> 87.42%     
client [88] (testset)   loss: 0.3955 -> 0.4317  accuracy: 92.62% -> 91.95%     
client [38] (testset)   loss: 0.2217 -> 0.1609  accuracy: 92.57% -> 95.27%     
client [3]  (testset)   loss: 0.1451 -> 0.1259  accuracy: 98.72% -> 96.79%     
client [5]  (testset)   loss: 0.2832 -> 0.2350  accuracy: 93.56% -> 94.58%     
client [41] (testset)   loss: 0.1841 -> 0.1486  accuracy: 94.63% -> 96.59%     
client [7]  (testset)   loss: 0.4002 -> 0.2581  accuracy: 90.53% -> 95.06%     
client [37] (testset)   loss: 0.3166 -> 0.1818  accuracy: 93.49% -> 94.67%     
client [45] (testset)   loss: 0.1957 -> 0.1594  accuracy: 94.44% -> 96.11%     
client [47] (testset)   loss: 1.2433 -> 0.1918  accuracy: 73.15% -> 94.44%     
---------------------------- TRAINING EPOCH: 140 ----------------------------  
client [16] (testset)   loss: 0.3905 -> 0.3238  accuracy: 91.73% -> 94.74%     
client [11] (testset)   loss: 0.1311 -> 0.1035  accuracy: 98.21% -> 98.81%     
client [37] (testset)   loss: 0.3777 -> 0.2101  accuracy: 90.53% -> 92.90%     
client [41] (testset)   loss: 0.1785 -> 0.1227  accuracy: 95.61% -> 97.07%     
client [95] (testset)   loss: 0.6409 -> 0.4839  accuracy: 89.52% -> 91.43%     
client [53] (testset)   loss: 0.2200 -> 0.2003  accuracy: 94.12% -> 94.12%     
client [22] (testset)   loss: 0.3638 -> 0.3877  accuracy: 92.68% -> 91.87%     
client [25] (testset)   loss: 0.3796 -> 0.2751  accuracy: 91.22% -> 93.13%     
client [69] (testset)   loss: 0.3894 -> 0.4145  accuracy: 90.48% -> 90.48%     
client [46] (testset)   loss: 0.2946 -> 0.3011  accuracy: 92.48% -> 92.48%     
---------------------------- TRAINING EPOCH: 150 ----------------------------  
client [47] (testset)   loss: 0.6735 -> 0.2160  accuracy: 84.26% -> 93.98%     
client [69] (testset)   loss: 0.4222 -> 0.4206  accuracy: 90.48% -> 89.80%     
client [82] (testset)   loss: 0.2597 -> 0.2129  accuracy: 91.95% -> 94.07%     
client [45] (testset)   loss: 0.2487 -> 0.1668  accuracy: 92.78% -> 96.67%     
client [7]  (testset)   loss: 0.2938 -> 0.2765  accuracy: 94.65% -> 95.88%     
client [50] (testset)   loss: 0.2572 -> 0.1778  accuracy: 94.04% -> 94.70%     
client [35] (testset)   loss: 0.1907 -> 0.0952  accuracy: 95.48% -> 98.06%     
client [24] (testset)   loss: 0.3789 -> 0.1987  accuracy: 88.74% -> 94.59%     
client [15] (testset)   loss: 0.2301 -> 0.1924  accuracy: 94.70% -> 95.45%     
client [58] (testset)   loss: 0.5237 -> 0.4638  accuracy: 85.64% -> 89.50%     
---------------------------- TRAINING EPOCH: 160 ----------------------------  
client [48] (testset)   loss: 0.8542 -> 0.7392  accuracy: 86.99% -> 87.80%     
client [76] (testset)   loss: 0.6486 -> 0.3315  accuracy: 87.02% -> 91.60%     
client [67] (testset)   loss: 0.2280 -> 0.2181  accuracy: 94.37% -> 95.67%     
client [37] (testset)   loss: 0.3365 -> 0.2143  accuracy: 90.53% -> 94.67%     
client [58] (testset)   loss: 0.8598 -> 0.4908  accuracy: 81.22% -> 86.74%     
client [64] (testset)   loss: 0.3377 -> 0.1987  accuracy: 93.72% -> 94.98%     
client [77] (testset)   loss: 0.4736 -> 0.2758  accuracy: 85.71% -> 93.71%     
client [55] (testset)   loss: 0.3122 -> 0.1670  accuracy: 90.36% -> 94.92%     
client [12] (testset)   loss: 0.3526 -> 0.3204  accuracy: 89.87% -> 92.41%     
client [89] (testset)   loss: 0.1867 -> 0.1501  accuracy: 97.12% -> 97.84%     
---------------------------- TRAINING EPOCH: 170 ----------------------------  
client [84] (testset)   loss: 0.4896 -> 0.4405  accuracy: 91.75% -> 92.78%     
client [51] (testset)   loss: 0.1466 -> 0.1371  accuracy: 96.58% -> 97.34%     
client [8]  (testset)   loss: 0.3806 -> 0.2422  accuracy: 92.16% -> 95.10%     
client [18] (testset)   loss: 0.2937 -> 0.2021  accuracy: 95.42% -> 96.18%     
client [94] (testset)   loss: 0.2907 -> 0.2669  accuracy: 94.41% -> 93.79%     
client [81] (testset)   loss: 0.1793 -> 0.1950  accuracy: 96.61% -> 96.61%     
client [3]  (testset)   loss: 0.1997 -> 0.1547  accuracy: 96.15% -> 97.44%     
client [11] (testset)   loss: 0.1115 -> 0.1055  accuracy: 98.21% -> 98.21%     
client [95] (testset)   loss: 0.5457 -> 0.5519  accuracy: 91.43% -> 92.38%     
client [67] (testset)   loss: 0.3184 -> 0.2464  accuracy: 93.51% -> 95.67%     
---------------------------- TRAINING EPOCH: 180 ----------------------------  
client [21] (testset)   loss: 0.5596 -> 0.4845  accuracy: 88.05% -> 88.05%     
client [79] (testset)   loss: 0.4847 -> 0.4685  accuracy: 85.71% -> 87.66%     
client [58] (testset)   loss: 0.6228 -> 0.5610  accuracy: 85.64% -> 87.29%     
client [88] (testset)   loss: 0.4952 -> 0.5447  accuracy: 92.62% -> 92.62%     
client [46] (testset)   loss: 0.4216 -> 0.3452  accuracy: 91.50% -> 92.16%     
client [11] (testset)   loss: 0.1298 -> 0.1313  accuracy: 98.21% -> 98.21%     
client [55] (testset)   loss: 0.2367 -> 0.2241  accuracy: 93.91% -> 94.92%     
client [13] (testset)   loss: 0.3017 -> 0.2772  accuracy: 94.64% -> 95.09%     
client [31] (testset)   loss: 0.1861 -> 0.2731  accuracy: 94.63% -> 92.62%     
client [75] (testset)   loss: 0.1215 -> 0.1080  accuracy: 98.56% -> 97.84%     
---------------------------- TRAINING EPOCH: 190 ----------------------------  
client [19] (testset)   loss: 0.2475 -> 0.2672  accuracy: 93.33% -> 93.33%     
client [7]  (testset)   loss: 0.4968 -> 0.3380  accuracy: 90.95% -> 95.06%     
client [57] (testset)   loss: 0.1115 -> 0.1177  accuracy: 96.95% -> 96.95%     
client [13] (testset)   loss: 0.2576 -> 0.2568  accuracy: 95.54% -> 95.09%     
client [43] (testset)   loss: 0.3235 -> 0.3607  accuracy: 92.20% -> 93.12%     
client [91] (testset)   loss: 0.2693 -> 0.2439  accuracy: 95.57% -> 94.94%     
client [10] (testset)   loss: 0.2766 -> 0.2101  accuracy: 94.24% -> 95.68%     
client [64] (testset)   loss: 0.3312 -> 0.2097  accuracy: 93.72% -> 94.56%     
client [82] (testset)   loss: 0.2945 -> 0.2192  accuracy: 93.22% -> 94.49%     
client [22] (testset)   loss: 0.4649 -> 0.3907  accuracy: 91.87% -> 92.68%     
---------------------------- TRAINING EPOCH: 200 ----------------------------  
client [20] (testset)   loss: 0.2442 -> 0.2035  accuracy: 94.69% -> 95.10%     
client [23] (testset)   loss: 0.6845 -> 0.7390  accuracy: 84.29% -> 84.29%     
client [88] (testset)   loss: 0.4748 -> 0.5131  accuracy: 91.95% -> 92.62%     
client [98] (testset)   loss: 0.1606 -> 0.1365  accuracy: 96.91% -> 97.25%     
client [79] (testset)   loss: 0.3984 -> 0.4147  accuracy: 89.61% -> 89.61%     
client [21] (testset)   loss: 0.6637 -> 0.5045  accuracy: 85.53% -> 87.42%     
client [92] (testset)   loss: 0.0444 -> 0.0368  accuracy: 98.15% -> 98.61%     
client [56] (testset)   loss: 0.4998 -> 0.4533  accuracy: 89.29% -> 90.31%     
client [5]  (testset)   loss: 0.2765 -> 0.2880  accuracy: 94.58% -> 94.92%     
client [52] (testset)   loss: 0.1968 -> 0.1742  accuracy: 96.00% -> 96.67%     
---------------------------- TRAINING EPOCH: 210 ----------------------------  
client [67] (testset)   loss: 0.4077 -> 0.3063  accuracy: 91.34% -> 95.24%     
client [54] (testset)   loss: 0.5656 -> 0.5612  accuracy: 87.11% -> 87.11%     
client [14] (testset)   loss: 0.4771 -> 0.2131  accuracy: 88.80% -> 93.78%     
client [99] (testset)   loss: 0.0385 -> 0.0336  accuracy: 98.08% -> 98.08%     
client [36] (testset)   loss: 0.1471 -> 0.1453  accuracy: 96.77% -> 97.70%     
client [30] (testset)   loss: 0.7042 -> 0.5335  accuracy: 85.71% -> 91.21%     
client [38] (testset)   loss: 0.1329 -> 0.1397  accuracy: 97.30% -> 96.96%     
client [15] (testset)   loss: 0.2566 -> 0.2471  accuracy: 96.21% -> 96.97%     
client [6]  (testset)   loss: 0.4901 -> 0.4097  accuracy: 91.03% -> 92.74%     
client [53] (testset)   loss: 0.2187 -> 0.1997  accuracy: 96.32% -> 95.59%     
---------------------------- TRAINING EPOCH: 220 ----------------------------  
client [99] (testset)   loss: 0.0286 -> 0.0222  accuracy: 99.04% -> 99.04%     
client [6]  (testset)   loss: 0.4648 -> 0.4272  accuracy: 92.74% -> 92.74%     
client [83] (testset)   loss: 0.2684 -> 0.1771  accuracy: 91.76% -> 92.94%     
client [42] (testset)   loss: 0.2839 -> 0.2888  accuracy: 95.15% -> 93.39%     
client [34] (testset)   loss: 0.3629 -> 0.3584  accuracy: 91.26% -> 91.26%     
client [15] (testset)   loss: 0.2705 -> 0.2487  accuracy: 95.45% -> 96.21%     
client [47] (testset)   loss: 0.3440 -> 0.3469  accuracy: 94.44% -> 93.52%     
client [55] (testset)   loss: 0.1945 -> 0.1946  accuracy: 93.40% -> 94.92%     
client [51] (testset)   loss: 0.1579 -> 0.1562  accuracy: 96.58% -> 97.34%     
client [95] (testset)   loss: 0.5923 -> 0.6397  accuracy: 94.29% -> 92.38%     
---------------------------- TRAINING EPOCH: 230 ----------------------------  
client [71] (testset)   loss: 0.4829 -> 0.4991  accuracy: 93.75% -> 93.75%     
client [15] (testset)   loss: 0.2539 -> 0.2682  accuracy: 96.21% -> 96.97%     
client [33] (testset)   loss: 0.6406 -> 0.5272  accuracy: 87.60% -> 88.84%     
client [99] (testset)   loss: 0.0835 -> 0.0258  accuracy: 97.12% -> 99.04%     
client [90] (testset)   loss: 0.4109 -> 0.2950  accuracy: 92.18% -> 93.30%     
client [57] (testset)   loss: 0.1783 -> 0.1409  accuracy: 95.93% -> 96.27%     
client [27] (testset)   loss: 0.0293 -> 0.0000  accuracy: 98.84% -> 100.00%    
client [78] (testset)   loss: 0.0227 -> 0.0543  accuracy: 99.21% -> 98.41%     
client [36] (testset)   loss: 0.1239 -> 0.1341  accuracy: 97.70% -> 98.62%     
client [88] (testset)   loss: 0.6172 -> 0.5604  accuracy: 89.93% -> 91.95%     
---------------------------- TRAINING EPOCH: 240 ----------------------------  
client [70] (testset)   loss: 0.2850 -> 0.2574  accuracy: 94.19% -> 94.19%     
client [35] (testset)   loss: 0.1118 -> 0.1065  accuracy: 96.77% -> 97.42%     
client [16] (testset)   loss: 0.4517 -> 0.4398  accuracy: 92.48% -> 93.23%     
client [80] (testset)   loss: 0.3388 -> 0.3451  accuracy: 94.34% -> 94.34%     
client [38] (testset)   loss: 0.1906 -> 0.1789  accuracy: 94.93% -> 96.28%     
client [78] (testset)   loss: 0.0211 -> 0.0495  accuracy: 98.41% -> 99.21%     
client [68] (testset)   loss: 0.5254 -> 0.5033  accuracy: 89.75% -> 88.82%     
client [11] (testset)   loss: 0.1225 -> 0.1279  accuracy: 98.81% -> 98.21%     
client [64] (testset)   loss: 0.3319 -> 0.2264  accuracy: 92.47% -> 95.40%     
client [82] (testset)   loss: 0.2146 -> 0.2249  accuracy: 95.34% -> 95.76%     
---------------------------- TRAINING EPOCH: 250 ----------------------------  
client [30] (testset)   loss: 0.5407 -> 0.5149  accuracy: 90.11% -> 90.11%     
client [27] (testset)   loss: 0.0006 -> 0.0002  accuracy: 100.00% -> 100.00%   
client [74] (testset)   loss: 0.3589 -> 0.3412  accuracy: 92.54% -> 92.54%     
client [45] (testset)   loss: 0.2214 -> 0.1780  accuracy: 94.44% -> 95.56%     
client [6]  (testset)   loss: 0.5330 -> 0.4677  accuracy: 91.45% -> 92.74%     
client [36] (testset)   loss: 0.1975 -> 0.1710  accuracy: 96.77% -> 97.70%     
client [63] (testset)   loss: 0.1121 -> 0.0591  accuracy: 98.48% -> 98.48%     
client [76] (testset)   loss: 0.5091 -> 0.3900  accuracy: 91.60% -> 92.75%     
client [83] (testset)   loss: 0.1119 -> 0.1592  accuracy: 95.29% -> 92.94%     
client [86] (testset)   loss: 0.7218 -> 0.6622  accuracy: 85.59% -> 86.90%     
---------------------------- TRAINING EPOCH: 260 ----------------------------  
client [83] (testset)   loss: 0.2847 -> 0.2054  accuracy: 94.12% -> 94.12%     
client [99] (testset)   loss: 0.0480 -> 0.0433  accuracy: 99.04% -> 98.08%     
client [74] (testset)   loss: 0.3534 -> 0.3622  accuracy: 93.13% -> 93.73%     
client [73] (testset)   loss: 0.3140 -> 0.2755  accuracy: 92.76% -> 93.67%     
client [29] (testset)   loss: 0.4426 -> 0.4285  accuracy: 91.11% -> 90.56%     
client [92] (testset)   loss: 0.0204 -> 0.0288  accuracy: 99.54% -> 99.07%     
client [6]  (testset)   loss: 0.4986 -> 0.4480  accuracy: 92.31% -> 93.16%     
client [61] (testset)   loss: 0.4453 -> 0.4229  accuracy: 93.57% -> 92.86%     
client [21] (testset)   loss: 0.6701 -> 0.6244  accuracy: 86.16% -> 86.16%     
client [67] (testset)   loss: 0.3225 -> 0.3056  accuracy: 94.81% -> 95.67%     
---------------------------- TRAINING EPOCH: 270 ----------------------------  
client [83] (testset)   loss: 0.3528 -> 0.2915  accuracy: 91.76% -> 92.94%     
client [32] (testset)   loss: 0.1778 -> 0.1567  accuracy: 93.69% -> 93.69%     
client [95] (testset)   loss: 0.6839 -> 0.6768  accuracy: 92.38% -> 93.33%     
client [61] (testset)   loss: 0.4046 -> 0.3656  accuracy: 92.14% -> 93.57%     
client [27] (testset)   loss: 0.0003 -> 0.0000  accuracy: 100.00% -> 100.00%   
client [25] (testset)   loss: 0.4061 -> 0.3450  accuracy: 92.37% -> 92.37%     
client [68] (testset)   loss: 0.5610 -> 0.5565  accuracy: 88.51% -> 88.51%     
client [34] (testset)   loss: 0.3516 -> 0.3324  accuracy: 90.71% -> 91.26%     
client [71] (testset)   loss: 0.5236 -> 0.4640  accuracy: 87.50% -> 90.62%     
client [89] (testset)   loss: 0.1824 -> 0.1626  accuracy: 97.84% -> 97.84%     
---------------------------- TRAINING EPOCH: 280 ----------------------------  
client [78] (testset)   loss: 0.0419 -> 0.0502  accuracy: 99.21% -> 99.21%     
client [81] (testset)   loss: 0.2345 -> 0.2418  accuracy: 96.61% -> 96.61%     
client [51] (testset)   loss: 0.1851 -> 0.1738  accuracy: 96.96% -> 97.34%     
client [54] (testset)   loss: 0.4977 -> 0.5596  accuracy: 88.66% -> 87.11%     
client [65] (testset)   loss: 0.2755 -> 0.2822  accuracy: 94.85% -> 93.38%     
client [41] (testset)   loss: 0.2274 -> 0.2177  accuracy: 95.12% -> 96.10%     
client [11] (testset)   loss: 0.1333 -> 0.1454  accuracy: 98.81% -> 98.21%     
client [85] (testset)   loss: 0.1783 -> 0.1338  accuracy: 95.65% -> 97.28%     
client [12] (testset)   loss: 0.4365 -> 0.4186  accuracy: 92.41% -> 92.41%     
client [23] (testset)   loss: 0.7342 -> 0.7769  accuracy: 82.86% -> 87.14%     
---------------------------- TRAINING EPOCH: 290 ----------------------------  
client [16] (testset)   loss: 0.4658 -> 0.4460  accuracy: 93.98% -> 93.98%     
client [65] (testset)   loss: 0.2850 -> 0.2788  accuracy: 92.65% -> 93.38%     
client [53] (testset)   loss: 0.2010 -> 0.2108  accuracy: 95.59% -> 96.32%     
client [58] (testset)   loss: 0.6564 -> 0.6845  accuracy: 86.19% -> 86.19%     
client [72] (testset)   loss: 0.5285 -> 0.5373  accuracy: 86.84% -> 86.84%     
client [7]  (testset)   loss: 0.4039 -> 0.4151  accuracy: 94.24% -> 94.65%     
client [71] (testset)   loss: 0.6090 -> 0.6149  accuracy: 87.50% -> 87.50%     
client [59] (testset)   loss: 0.2159 -> 0.2149  accuracy: 96.30% -> 96.30%     
client [86] (testset)   loss: 0.8213 -> 0.7925  accuracy: 86.03% -> 87.34%     
client [39] (testset)   loss: 0.3837 -> 0.4197  accuracy: 92.54% -> 91.79%     
---------------------------- TRAINING EPOCH: 300 ----------------------------  
client [99] (testset)   loss: 0.0444 -> 0.0430  accuracy: 99.04% -> 99.04%     
client [7]  (testset)   loss: 0.4476 -> 0.4301  accuracy: 94.24% -> 95.06%     
client [17] (testset)   loss: 0.3809 -> 0.3799  accuracy: 93.84% -> 93.84%     
client [64] (testset)   loss: 0.3000 -> 0.2687  accuracy: 94.56% -> 94.56%     
client [37] (testset)   loss: 0.3446 -> 0.3286  accuracy: 94.08% -> 94.08%     
client [29] (testset)   loss: 0.4656 -> 0.4397  accuracy: 91.11% -> 90.56%     
client [93] (testset)   loss: 0.9132 -> 0.8502  accuracy: 84.97% -> 84.62%     
client [73] (testset)   loss: 0.2394 -> 0.2614  accuracy: 94.12% -> 95.02%     
client [40] (testset)   loss: 0.3712 -> 0.3713  accuracy: 92.06% -> 92.06%     
client [76] (testset)   loss: 0.5258 -> 0.4380  accuracy: 92.37% -> 92.37%     
---------------------------- TRAINING EPOCH: 310 ----------------------------  
client [31] (testset)   loss: 0.2507 -> 0.2442  accuracy: 92.62% -> 93.96%     
client [89] (testset)   loss: 0.2008 -> 0.1828  accuracy: 97.84% -> 97.84%     
client [77] (testset)   loss: 0.4156 -> 0.3882  accuracy: 93.14% -> 94.29%     
client [90] (testset)   loss: 0.5012 -> 0.4130  accuracy: 91.62% -> 92.18%     
client [26] (testset)   loss: 0.1651 -> 0.1483  accuracy: 97.40% -> 98.70%     
client [50] (testset)   loss: 0.2228 -> 0.2137  accuracy: 96.03% -> 95.36%     
client [30] (testset)   loss: 0.7389 -> 0.6570  accuracy: 89.01% -> 91.21%     
client [70] (testset)   loss: 0.3170 -> 0.2767  accuracy: 94.19% -> 94.19%     
client [41] (testset)   loss: 0.2241 -> 0.2109  accuracy: 95.61% -> 96.10%     
client [99] (testset)   loss: 0.0347 -> 0.0340  accuracy: 99.04% -> 99.04%     
---------------------------- TRAINING EPOCH: 320 ----------------------------  
client [68] (testset)   loss: 0.6157 -> 0.5965  accuracy: 88.51% -> 88.82%     
client [70] (testset)   loss: 0.3053 -> 0.2970  accuracy: 95.35% -> 95.35%     
client [52] (testset)   loss: 0.2096 -> 0.1863  accuracy: 96.67% -> 96.67%     
client [1]  (testset)   loss: 0.3227 -> 0.2726  accuracy: 92.65% -> 94.12%     
client [2]  (testset)   loss: 0.7259 -> 0.6217  accuracy: 90.85% -> 92.81%     
client [67] (testset)   loss: 0.3802 -> 0.3406  accuracy: 93.07% -> 95.67%     
client [92] (testset)   loss: 0.0719 -> 0.0468  accuracy: 99.07% -> 99.07%     
client [35] (testset)   loss: 0.1067 -> 0.1100  accuracy: 97.42% -> 97.42%     
client [36] (testset)   loss: 0.2224 -> 0.2149  accuracy: 97.24% -> 97.70%     
client [64] (testset)   loss: 0.2958 -> 0.2660  accuracy: 93.72% -> 94.56%     
---------------------------- TRAINING EPOCH: 330 ----------------------------  
client [44] (testset)   loss: 0.9373 -> 0.8949  accuracy: 87.53% -> 87.26%     
client [6]  (testset)   loss: 0.6000 -> 0.5731  accuracy: 91.45% -> 92.74%     
client [12] (testset)   loss: 0.4752 -> 0.4558  accuracy: 92.41% -> 91.77%     
client [55] (testset)   loss: 0.2536 -> 0.2462  accuracy: 93.91% -> 93.91%     
client [29] (testset)   loss: 0.4473 -> 0.4436  accuracy: 91.11% -> 90.56%     
client [9]  (testset)   loss: 0.1270 -> 0.1272  accuracy: 96.79% -> 96.79%     
client [43] (testset)   loss: 0.4387 -> 0.4229  accuracy: 93.12% -> 92.66%     
client [77] (testset)   loss: 0.5077 -> 0.4270  accuracy: 93.14% -> 93.71%     
client [98] (testset)   loss: 0.2003 -> 0.1923  accuracy: 97.59% -> 97.25%     
client [78] (testset)   loss: 0.0350 -> 0.0363  accuracy: 98.41% -> 99.21%     
---------------------------- TRAINING EPOCH: 340 ----------------------------  
client [92] (testset)   loss: 0.0482 -> 0.0450  accuracy: 99.07% -> 99.07%     
client [80] (testset)   loss: 0.4574 -> 0.4222  accuracy: 94.34% -> 94.34%     
client [63] (testset)   loss: 0.1339 -> 0.1223  accuracy: 96.97% -> 96.97%     
client [76] (testset)   loss: 0.5012 -> 0.4505  accuracy: 92.75% -> 92.75%     
client [78] (testset)   loss: 0.0375 -> 0.0472  accuracy: 98.41% -> 99.21%     
client [25] (testset)   loss: 0.4286 -> 0.3825  accuracy: 93.13% -> 93.89%     
client [58] (testset)   loss: 0.7052 -> 0.7146  accuracy: 86.74% -> 86.19%     
client [13] (testset)   loss: 0.3353 -> 0.3335  accuracy: 94.64% -> 94.64%     
client [17] (testset)   loss: 0.4131 -> 0.4013  accuracy: 93.84% -> 93.84%     
client [38] (testset)   loss: 0.2062 -> 0.1832  accuracy: 95.95% -> 96.28%     
---------------------------- TRAINING EPOCH: 350 ----------------------------  
client [72] (testset)   loss: 0.5875 -> 0.5635  accuracy: 89.47% -> 89.47%     
client [82] (testset)   loss: 0.2636 -> 0.2437  accuracy: 94.92% -> 95.34%     
client [86] (testset)   loss: 0.9303 -> 0.8468  accuracy: 86.03% -> 87.34%     
client [51] (testset)   loss: 0.1991 -> 0.1901  accuracy: 96.96% -> 96.96%     
client [96] (testset)   loss: 0.4987 -> 0.4297  accuracy: 90.39% -> 91.70%     
client [42] (testset)   loss: 0.3497 -> 0.3519  accuracy: 92.07% -> 92.51%     
client [55] (testset)   loss: 0.2242 -> 0.2401  accuracy: 93.40% -> 93.91%     
client [13] (testset)   loss: 0.3831 -> 0.3227  accuracy: 94.64% -> 94.64%     
client [1]  (testset)   loss: 0.2969 -> 0.2917  accuracy: 93.38% -> 94.12%     
client [12] (testset)   loss: 0.4517 -> 0.4498  accuracy: 92.41% -> 91.77%     
---------------------------- TRAINING EPOCH: 360 ----------------------------  
client [68] (testset)   loss: 0.5663 -> 0.5881  accuracy: 89.13% -> 89.13%     
client [23] (testset)   loss: 0.6279 -> 0.6623  accuracy: 85.71% -> 88.57%     
client [46] (testset)   loss: 0.4217 -> 0.4284  accuracy: 93.79% -> 92.81%     
client [41] (testset)   loss: 0.2636 -> 0.2495  accuracy: 96.10% -> 96.10%     
client [25] (testset)   loss: 0.4440 -> 0.4004  accuracy: 93.13% -> 93.89%     
client [58] (testset)   loss: 0.7287 -> 0.7172  accuracy: 86.19% -> 86.74%     
client [14] (testset)   loss: 0.3299 -> 0.2575  accuracy: 93.78% -> 95.02%     
client [33] (testset)   loss: 0.6432 -> 0.6006  accuracy: 88.43% -> 89.67%     
client [85] (testset)   loss: 0.1537 -> 0.1268  accuracy: 96.20% -> 96.74%     
client [62] (testset)   loss: 0.0882 -> 0.0980  accuracy: 96.95% -> 98.47%     
---------------------------- TRAINING EPOCH: 370 ----------------------------  
client [98] (testset)   loss: 0.1877 -> 0.1857  accuracy: 97.59% -> 97.59%     
client [63] (testset)   loss: 0.1024 -> 0.0847  accuracy: 96.97% -> 98.48%     
client [70] (testset)   loss: 0.3414 -> 0.3164  accuracy: 95.35% -> 95.35%     
client [65] (testset)   loss: 0.3299 -> 0.3197  accuracy: 91.91% -> 91.91%     
client [14] (testset)   loss: 0.3348 -> 0.2781  accuracy: 93.78% -> 94.61%     
client [73] (testset)   loss: 0.2684 -> 0.2817  accuracy: 94.12% -> 94.12%     
client [34] (testset)   loss: 0.4154 -> 0.4307  accuracy: 92.35% -> 91.26%     
client [99] (testset)   loss: 0.0310 -> 0.0316  accuracy: 99.04% -> 99.04%     
client [69] (testset)   loss: 0.6622 -> 0.6439  accuracy: 89.12% -> 89.80%     
client [46] (testset)   loss: 0.4355 -> 0.4538  accuracy: 93.46% -> 92.81%     
---------------------------- TRAINING EPOCH: 380 ----------------------------  
client [99] (testset)   loss: 0.0369 -> 0.0244  accuracy: 97.12% -> 99.04%     
client [93] (testset)   loss: 0.9865 -> 0.9263  accuracy: 83.92% -> 83.92%     
client [11] (testset)   loss: 0.1703 -> 0.1626  accuracy: 98.21% -> 98.81%     
client [58] (testset)   loss: 0.6915 -> 0.7142  accuracy: 87.29% -> 87.85%     
client [81] (testset)   loss: 0.2587 -> 0.2641  accuracy: 96.61% -> 96.61%     
client [85] (testset)   loss: 0.1452 -> 0.1322  accuracy: 96.74% -> 96.74%     
client [89] (testset)   loss: 0.2179 -> 0.2063  accuracy: 97.12% -> 97.84%     
client [45] (testset)   loss: 0.2643 -> 0.2455  accuracy: 94.44% -> 95.00%     
client [8]  (testset)   loss: 0.4327 -> 0.3426  accuracy: 94.12% -> 95.10%     
client [68] (testset)   loss: 0.6332 -> 0.6295  accuracy: 88.51% -> 90.06%     
---------------------------- TRAINING EPOCH: 390 ----------------------------  
client [67] (testset)   loss: 0.3880 -> 0.3481  accuracy: 94.81% -> 96.10%     
client [72] (testset)   loss: 0.3847 -> 0.4144  accuracy: 89.47% -> 92.11%     
client [1]  (testset)   loss: 0.3467 -> 0.3081  accuracy: 94.12% -> 94.85%     
client [78] (testset)   loss: 0.0127 -> 0.0343  accuracy: 99.21% -> 99.21%     
client [83] (testset)   loss: 0.2717 -> 0.2623  accuracy: 92.94% -> 94.12%     
client [21] (testset)   loss: 0.8404 -> 0.7941  accuracy: 86.79% -> 86.79%     
client [56] (testset)   loss: 0.7551 -> 0.7395  accuracy: 88.78% -> 88.78%     
client [44] (testset)   loss: 0.9762 -> 0.9570  accuracy: 86.70% -> 86.70%     
client [92] (testset)   loss: 0.0586 -> 0.0538  accuracy: 99.07% -> 99.07%     
client [27] (testset)   loss: 0.0001 -> 0.0000  accuracy: 100.00% -> 100.00%   
---------------------------- TRAINING EPOCH: 400 ----------------------------  
client [10] (testset)   loss: 0.2394 -> 0.2556  accuracy: 94.24% -> 94.24%     
client [39] (testset)   loss: 0.4663 -> 0.4771  accuracy: 91.04% -> 91.04%     
client [65] (testset)   loss: 0.2949 -> 0.2997  accuracy: 92.65% -> 92.65%     
client [26] (testset)   loss: 0.3008 -> 0.1689  accuracy: 94.81% -> 98.70%     
client [19] (testset)   loss: 0.2739 -> 0.2767  accuracy: 94.44% -> 94.44%     
client [68] (testset)   loss: 0.6111 -> 0.6192  accuracy: 89.75% -> 89.75%     
client [41] (testset)   loss: 0.2716 -> 0.2602  accuracy: 95.61% -> 96.10%     
client [50] (testset)   loss: 0.2258 -> 0.2249  accuracy: 96.03% -> 96.03%     
client [75] (testset)   loss: 0.2065 -> 0.2027  accuracy: 98.56% -> 98.56%     
client [81] (testset)   loss: 0.3057 -> 0.2993  accuracy: 94.92% -> 94.92%     
Training... ---------------------------------------- 100% 0:15:39
PSFL's average time taken by each global epoch: 0 min 2.33 sec.                
PSFL's total running time: 0 h 15 m 39 s.                                      
==================== PSFL Experiment Results: ====================             
Display format: (before local fine-tuning) -> (after local fine-tuning)        
 So if finetune_epoch = 0, x.xx% -> 0.00% is normal.                           
 Centralized testing ONLY happens after model aggregation, so the stats between
'->' are the same.                                                             
{                                                                              
    "100": {                                                                   
        "all_clients": {                                                       
            "test": {                                                          
                "loss": "0.3242 -> 0.0000",                                    
                "accuracy": "90.45% -> 0.00%"                                  
            }                                                                  
        }                                                                      
    },                                                                         
    "200": {                                                                   
        "all_clients": {                                                       
            "test": {                                                          
                "loss": "0.3441 -> 0.0000",                                    
                "accuracy": "92.96% -> 0.00%"                                  
            }                                                                  
        }                                                                      
    },                                                                         
    "300": {                                                                   
        "all_clients": {                                                       
            "test": {                                                          
                "loss": "0.3925 -> 0.0000",                                    
                "accuracy": "93.25% -> 0.00%"                                  
            }                                                                  
        }                                                                      
    },                                                                         
    "400": {                                                                   
        "all_clients": {                                                       
            "test": {                                                          
                "loss": "0.4252 -> 0.0000",                                    
                "accuracy": "93.31% -> 0.00%"                                  
            }                                                                  
        }                                                                      
    }                                                                          
}                                                                              
==================== PSFL Max Accuracy ====================                    
all_clients:                                                                   
(test) before fine-tuning: 93.31% at epoch 400                                 
(test) after fine-tuning: 0.00% at epoch 100                                   
[0m