==================== PSFL ====================                                 
Experiment Arguments:                                                          
{
│   'method': 'psfl',
│   'dataset': {
│   │   'name': 'fmnist',
│   │   'client_num': 100,
│   │   'test_ratio': 0.25,
│   │   'val_ratio': 0.0,
│   │   'seed': 42,
│   │   'split': 'sample',
│   │   'IID_ratio': 0.0,
│   │   'monitor_window_name_suffix': 'fmnist-100clients-0%IID-Dir(0.5)-seed42',
│   │   'alpha': 0.5,
│   │   'min_samples_per_client': 10
│   },
│   'model': {
│   │   'name': 'avgcnn',
│   │   'use_torchvision_pretrained_weights': True,
│   │   'external_model_weights_path': None
│   },
│   'optimizer': {
│   │   'lr': 0.01,
│   │   'dampening': 0,
│   │   'weight_decay': 0,
│   │   'momentum': 0,
│   │   'nesterov': False,
│   │   'name': 'sgd'
│   },
│   'mode': 'sequential',
│   'parallel': {
│   │   'ray_cluster_addr': None,
│   │   'num_cpus': None,
│   │   'num_gpus': None,
│   │   'num_workers': 2
│   },
│   'common': {
│   │   'seed': 42,
│   │   'join_ratio': 0.1,
│   │   'global_epoch': 400,
│   │   'local_epoch': 5,
│   │   'batch_size': 32,
│   │   'reset_optimizer_on_global_epoch': True,
│   │   'straggler_ratio': 0,
│   │   'straggler_min_local_epoch': 0,
│   │   'buffers': 'global',
│   │   'client_side_evaluation': True,
│   │   'test': {
│   │   │   'client': {
│   │   │   │   'interval': 100,
│   │   │   │   'finetune_epoch': 0,
│   │   │   │   'train': False,
│   │   │   │   'val': False,
│   │   │   │   'test': True
│   │   │   },
│   │   │   'server': {
│   │   │   │   'interval': -1,
│   │   │   │   'train': False,
│   │   │   │   'val': False,
│   │   │   │   'test': False,
│   │   │   │   'model_in_train_mode': False
│   │   │   }
│   │   },
│   │   'verbose_gap': 10,
│   │   'monitor': None,
│   │   'use_cuda': True,
│   │   'save_log': True,
│   │   'save_model': False,
│   │   'save_learning_curve_plot': False,
│   │   'save_metrics': True,
│   │   'delete_useless_run': True
│   },
│   'psfl': {
│   │   'alpha': 0.0,
│   │   'CLS': False,
│   │   'ig_ratio': 0.9991,
│   │   'track': False
│   }
}
---------------------------- TRAINING EPOCH: 10 ----------------------------   
client [77] (testset)   loss: 0.4426 -> 0.3208  accuracy: 85.71% -> 88.57%     
client [81] (testset)   loss: 0.3680 -> 0.2070  accuracy: 88.14% -> 91.53%     
client [21] (testset)   loss: 1.1051 -> 0.3663  accuracy: 55.97% -> 87.42%     
client [68] (testset)   loss: 0.7000 -> 0.4067  accuracy: 72.67% -> 85.71%     
client [93] (testset)   loss: 0.7728 -> 0.8728  accuracy: 70.63% -> 64.69%     
client [31] (testset)   loss: 0.5443 -> 0.3576  accuracy: 79.19% -> 87.25%     
client [20] (testset)   loss: 0.3478 -> 0.1919  accuracy: 84.08% -> 93.47%     
client [59] (testset)   loss: 0.7589 -> 0.3585  accuracy: 75.00% -> 89.81%     
client [48] (testset)   loss: 1.1337 -> 0.6110  accuracy: 66.67% -> 71.54%     
client [34] (testset)   loss: 0.3343 -> 0.3174  accuracy: 89.07% -> 87.98%     
---------------------------- TRAINING EPOCH: 20 ----------------------------   
client [69] (testset)   loss: 0.3363 -> 0.3152  accuracy: 85.03% -> 87.07%     
client [99] (testset)   loss: 0.1530 -> 0.1627  accuracy: 96.15% -> 95.19%     
client [67] (testset)   loss: 0.5251 -> 0.2512  accuracy: 80.95% -> 92.21%     
client [0]  (testset)   loss: 0.3725 -> 0.4025  accuracy: 89.21% -> 85.06%     
client [76] (testset)   loss: 0.6201 -> 0.5163  accuracy: 75.19% -> 79.39%     
client [41] (testset)   loss: 0.3455 -> 0.1047  accuracy: 88.29% -> 96.10%     
client [62] (testset)   loss: 0.5467 -> 0.2228  accuracy: 78.63% -> 93.13%     
client [2]  (testset)   loss: 0.5814 -> 0.2829  accuracy: 78.43% -> 92.81%     
client [14] (testset)   loss: 0.4381 -> 0.2641  accuracy: 82.99% -> 89.63%     
client [46] (testset)   loss: 0.4247 -> 0.3412  accuracy: 83.33% -> 87.25%     
---------------------------- TRAINING EPOCH: 30 ----------------------------   
client [24] (testset)   loss: 0.2881 -> 0.2822  accuracy: 90.09% -> 91.44%     
client [68] (testset)   loss: 0.3385 -> 0.3402  accuracy: 86.65% -> 86.96%     
client [57] (testset)   loss: 0.3146 -> 0.1636  accuracy: 91.19% -> 93.90%     
client [17] (testset)   loss: 0.3712 -> 0.2709  accuracy: 88.36% -> 91.78%     
client [54] (testset)   loss: 0.4972 -> 0.4081  accuracy: 81.44% -> 80.93%     
client [23] (testset)   loss: 0.6790 -> 0.4316  accuracy: 74.29% -> 82.86%     
client [35] (testset)   loss: 0.2279 -> 0.1717  accuracy: 92.26% -> 94.19%     
client [59] (testset)   loss: 0.1732 -> 0.1866  accuracy: 95.37% -> 95.37%     
client [31] (testset)   loss: 0.4582 -> 0.2705  accuracy: 85.91% -> 89.93%     
client [9]  (testset)   loss: 0.1358 -> 0.1100  accuracy: 96.79% -> 96.79%     
---------------------------- TRAINING EPOCH: 40 ----------------------------   
client [64] (testset)   loss: 0.2990 -> 0.1386  accuracy: 89.54% -> 94.56%     
client [33] (testset)   loss: 0.3968 -> 0.3618  accuracy: 85.95% -> 87.60%     
client [16] (testset)   loss: 0.3183 -> 0.3258  accuracy: 89.47% -> 92.48%     
client [44] (testset)   loss: 0.7038 -> 0.4016  accuracy: 74.24% -> 86.70%     
client [8]  (testset)   loss: 0.2266 -> 0.1427  accuracy: 92.16% -> 94.12%     
client [31] (testset)   loss: 0.2521 -> 0.2305  accuracy: 89.26% -> 92.62%     
client [47] (testset)   loss: 0.5282 -> 0.1835  accuracy: 80.56% -> 93.06%     
client [36] (testset)   loss: 0.2551 -> 0.1400  accuracy: 88.48% -> 95.39%     
client [20] (testset)   loss: 0.3113 -> 0.1694  accuracy: 90.61% -> 94.29%     
client [56] (testset)   loss: 0.5230 -> 0.4024  accuracy: 81.12% -> 85.20%     
---------------------------- TRAINING EPOCH: 50 ----------------------------   
client [4]  (testset)   loss: 0.5427 -> 0.4567  accuracy: 78.23% -> 81.45%     
client [60] (testset)   loss: 0.1542 -> 0.1206  accuracy: 94.67% -> 96.00%     
client [28] (testset)   loss: 0.5079 -> 0.3215  accuracy: 84.30% -> 87.89%     
client [25] (testset)   loss: 0.4028 -> 0.2705  accuracy: 86.26% -> 91.60%     
client [58] (testset)   loss: 0.4038 -> 0.3337  accuracy: 84.53% -> 86.19%     
client [44] (testset)   loss: 0.4312 -> 0.3691  accuracy: 83.93% -> 86.70%     
client [39] (testset)   loss: 0.2388 -> 0.2931  accuracy: 91.79% -> 89.55%     
client [29] (testset)   loss: 0.4516 -> 0.3728  accuracy: 84.44% -> 86.67%     
client [3]  (testset)   loss: 0.2377 -> 0.2155  accuracy: 92.95% -> 91.67%     
client [84] (testset)   loss: 0.2390 -> 0.2418  accuracy: 92.78% -> 92.78%     
---------------------------- TRAINING EPOCH: 60 ----------------------------   
client [21] (testset)   loss: 0.4887 -> 0.3111  accuracy: 83.02% -> 88.05%     
client [84] (testset)   loss: 0.3314 -> 0.2572  accuracy: 88.66% -> 93.81%     
client [10] (testset)   loss: 0.2886 -> 0.4670  accuracy: 93.53% -> 91.37%     
client [36] (testset)   loss: 0.2955 -> 0.1071  accuracy: 89.86% -> 97.24%     
client [65] (testset)   loss: 0.3076 -> 0.1779  accuracy: 86.03% -> 92.65%     
client [81] (testset)   loss: 0.1404 -> 0.0663  accuracy: 91.53% -> 98.31%     
client [79] (testset)   loss: 0.3631 -> 0.2988  accuracy: 83.12% -> 85.71%     
client [42] (testset)   loss: 0.4854 -> 0.2514  accuracy: 81.50% -> 90.75%     
client [11] (testset)   loss: 0.1379 -> 0.1134  accuracy: 97.02% -> 97.62%     
client [96] (testset)   loss: 0.3116 -> 0.2979  accuracy: 89.08% -> 89.08%     
---------------------------- TRAINING EPOCH: 70 ----------------------------   
client [8]  (testset)   loss: 0.7577 -> 0.1881  accuracy: 79.41% -> 93.14%     
client [53] (testset)   loss: 0.2671 -> 0.2241  accuracy: 88.97% -> 92.65%     
client [52] (testset)   loss: 0.1533 -> 0.1153  accuracy: 94.67% -> 96.00%     
client [42] (testset)   loss: 0.3594 -> 0.2368  accuracy: 86.78% -> 91.63%     
client [69] (testset)   loss: 0.3402 -> 0.2974  accuracy: 90.48% -> 88.44%     
client [59] (testset)   loss: 0.1556 -> 0.1483  accuracy: 94.44% -> 96.30%     
client [7]  (testset)   loss: 0.2006 -> 0.1884  accuracy: 93.83% -> 95.47%     
client [26] (testset)   loss: 0.2282 -> 0.0892  accuracy: 93.51% -> 97.40%     
client [49] (testset)   loss: 0.4266 -> 0.3107  accuracy: 84.83% -> 88.97%     
client [98] (testset)   loss: 0.1282 -> 0.1003  accuracy: 94.85% -> 96.22%     
---------------------------- TRAINING EPOCH: 80 ----------------------------   
client [98] (testset)   loss: 0.1476 -> 0.1138  accuracy: 95.88% -> 95.88%     
client [47] (testset)   loss: 0.2661 -> 0.1835  accuracy: 89.81% -> 93.52%     
client [21] (testset)   loss: 0.4104 -> 0.2949  accuracy: 88.05% -> 89.94%     
client [77] (testset)   loss: 0.2826 -> 0.3663  accuracy: 90.86% -> 86.29%     
client [95] (testset)   loss: 0.5052 -> 0.3599  accuracy: 88.57% -> 92.38%     
client [91] (testset)   loss: 0.1647 -> 0.1698  accuracy: 93.67% -> 93.67%     
client [14] (testset)   loss: 0.2082 -> 0.1821  accuracy: 92.53% -> 92.53%     
client [99] (testset)   loss: 0.1221 -> 0.1072  accuracy: 97.12% -> 96.15%     
client [20] (testset)   loss: 0.2223 -> 0.1596  accuracy: 92.24% -> 95.92%     
client [39] (testset)   loss: 0.2328 -> 0.3138  accuracy: 91.79% -> 91.04%     
---------------------------- TRAINING EPOCH: 90 ----------------------------   
client [52] (testset)   loss: 0.1754 -> 0.1269  accuracy: 94.67% -> 94.67%     
client [62] (testset)   loss: 0.0892 -> 0.0993  accuracy: 94.66% -> 96.95%     
client [71] (testset)   loss: 0.4027 -> 0.2686  accuracy: 90.62% -> 90.62%     
client [97] (testset)   loss: 0.2237 -> 0.1530  accuracy: 93.86% -> 93.86%     
client [30] (testset)   loss: 0.3644 -> 0.3104  accuracy: 87.91% -> 86.81%     
client [88] (testset)   loss: 0.3033 -> 0.2674  accuracy: 90.60% -> 92.62%     
client [60] (testset)   loss: 0.1290 -> 0.1013  accuracy: 96.00% -> 96.00%     
client [82] (testset)   loss: 0.3093 -> 0.6079  accuracy: 88.14% -> 82.63%     
client [91] (testset)   loss: 0.5776 -> 0.1794  accuracy: 82.91% -> 95.57%     
client [57] (testset)   loss: 0.1608 -> 0.1307  accuracy: 94.92% -> 96.27%     
---------------------------- TRAINING EPOCH: 100 ----------------------------  
client [31] (testset)   loss: 0.2208 -> 1.5677  accuracy: 91.95% -> 69.13%     
client [15] (testset)   loss: 0.4006 -> 0.1161  accuracy: 91.67% -> 95.45%     
client [71] (testset)   loss: 0.2444 -> 0.3365  accuracy: 93.75% -> 90.62%     
client [97] (testset)   loss: 0.2499 -> 0.1414  accuracy: 91.23% -> 94.74%     
client [53] (testset)   loss: 0.2810 -> 0.2433  accuracy: 92.65% -> 90.44%     
client [77] (testset)   loss: 0.2405 -> 0.2167  accuracy: 91.43% -> 93.71%     
client [76] (testset)   loss: 0.3613 -> 0.2276  accuracy: 87.79% -> 91.98%     
client [79] (testset)   loss: 0.5474 -> 0.4841  accuracy: 80.52% -> 82.47%     
client [28] (testset)   loss: 0.4168 -> 0.2973  accuracy: 83.41% -> 91.03%     
client [99] (testset)   loss: 0.1684 -> 0.1074  accuracy: 92.31% -> 94.23%     
---------------------------- TRAINING EPOCH: 110 ----------------------------  
client [97] (testset)   loss: 0.1596 -> 0.1074  accuracy: 92.98% -> 96.49%     
client [86] (testset)   loss: 0.4729 -> 0.4370  accuracy: 82.97% -> 86.90%     
client [34] (testset)   loss: 0.2139 -> 0.2395  accuracy: 93.99% -> 92.90%     
client [73] (testset)   loss: 0.2810 -> 0.2251  accuracy: 91.86% -> 93.67%     
client [5]  (testset)   loss: 0.1734 -> 0.2032  accuracy: 94.92% -> 93.90%     
client [96] (testset)   loss: 0.4384 -> 0.3138  accuracy: 87.34% -> 91.70%     
client [22] (testset)   loss: 0.2306 -> 0.2835  accuracy: 92.68% -> 91.87%     
client [60] (testset)   loss: 0.0931 -> 0.1237  accuracy: 95.33% -> 96.00%     
client [66] (testset)   loss: 0.2205 -> 0.0969  accuracy: 91.15% -> 95.58%     
client [83] (testset)   loss: 0.2671 -> 0.2810  accuracy: 92.94% -> 91.76%     
---------------------------- TRAINING EPOCH: 120 ----------------------------  
client [76] (testset)   loss: 0.2715 -> 0.2661  accuracy: 91.98% -> 91.60%     
client [65] (testset)   loss: 0.2440 -> 0.1848  accuracy: 88.97% -> 93.38%     
client [95] (testset)   loss: 0.3808 -> 0.3565  accuracy: 91.43% -> 95.24%     
client [17] (testset)   loss: 0.2474 -> 0.2091  accuracy: 91.78% -> 92.47%     
client [8]  (testset)   loss: 0.2827 -> 0.1721  accuracy: 93.14% -> 96.08%     
client [35] (testset)   loss: 0.1234 -> 0.0836  accuracy: 96.13% -> 96.13%     
client [98] (testset)   loss: 0.1619 -> 0.1255  accuracy: 94.16% -> 95.88%     
client [53] (testset)   loss: 0.2796 -> 0.2330  accuracy: 91.91% -> 92.65%     
client [43] (testset)   loss: 0.3759 -> 0.2607  accuracy: 87.61% -> 91.28%     
client [64] (testset)   loss: 0.2241 -> 0.1274  accuracy: 93.31% -> 95.82%     
---------------------------- TRAINING EPOCH: 130 ----------------------------  
client [21] (testset)   loss: 0.3553 -> 0.3162  accuracy: 86.79% -> 89.94%     
client [88] (testset)   loss: 0.2563 -> 0.2869  accuracy: 91.28% -> 93.29%     
client [38] (testset)   loss: 0.1709 -> 0.1506  accuracy: 94.59% -> 95.61%     
client [3]  (testset)   loss: 0.1271 -> 0.1224  accuracy: 96.15% -> 94.87%     
client [5]  (testset)   loss: 0.2349 -> 0.2069  accuracy: 91.19% -> 94.92%     
client [41] (testset)   loss: 0.1296 -> 0.1296  accuracy: 96.10% -> 96.59%     
client [7]  (testset)   loss: 0.3372 -> 0.2121  accuracy: 88.89% -> 94.24%     
client [37] (testset)   loss: 0.3533 -> 0.2393  accuracy: 91.72% -> 92.31%     
client [45] (testset)   loss: 0.1610 -> 0.1524  accuracy: 93.89% -> 95.56%     
client [47] (testset)   loss: 0.5273 -> 0.2343  accuracy: 83.80% -> 93.52%     
---------------------------- TRAINING EPOCH: 140 ----------------------------  
client [16] (testset)   loss: 0.2858 -> 0.2542  accuracy: 91.73% -> 94.74%     
client [11] (testset)   loss: 0.1136 -> 0.0986  accuracy: 98.21% -> 98.21%     
client [37] (testset)   loss: 0.3357 -> 0.2929  accuracy: 91.72% -> 92.90%     
client [41] (testset)   loss: 0.1200 -> 0.1004  accuracy: 96.10% -> 98.05%     
client [95] (testset)   loss: 0.5488 -> 0.4353  accuracy: 87.62% -> 93.33%     
client [53] (testset)   loss: 0.2810 -> 0.2847  accuracy: 91.91% -> 92.65%     
client [22] (testset)   loss: 0.1948 -> 0.2976  accuracy: 92.68% -> 93.50%     
client [25] (testset)   loss: 0.2999 -> 0.3276  accuracy: 91.98% -> 91.98%     
client [69] (testset)   loss: 0.2803 -> 0.3207  accuracy: 91.84% -> 89.12%     
client [46] (testset)   loss: 0.2627 -> 0.3568  accuracy: 91.18% -> 90.85%     
---------------------------- TRAINING EPOCH: 150 ----------------------------  
client [47] (testset)   loss: 0.3192 -> 0.2222  accuracy: 90.74% -> 95.83%     
client [69] (testset)   loss: 0.3168 -> 0.3374  accuracy: 91.16% -> 91.84%     
client [82] (testset)   loss: 0.2201 -> 0.2206  accuracy: 93.22% -> 93.22%     
client [45] (testset)   loss: 0.2122 -> 0.2896  accuracy: 94.44% -> 93.33%     
client [7]  (testset)   loss: 0.2220 -> 0.2039  accuracy: 93.83% -> 96.30%     
client [50] (testset)   loss: 0.1982 -> 0.1745  accuracy: 95.36% -> 95.36%     
client [35] (testset)   loss: 0.1825 -> 0.0782  accuracy: 94.19% -> 97.42%     
client [24] (testset)   loss: 0.2454 -> 0.1417  accuracy: 91.89% -> 96.85%     
client [15] (testset)   loss: 0.1858 -> 0.1665  accuracy: 94.70% -> 96.21%     
client [58] (testset)   loss: 0.3655 -> 0.3751  accuracy: 85.64% -> 87.29%     
---------------------------- TRAINING EPOCH: 160 ----------------------------  
client [48] (testset)   loss: 0.7473 -> 0.6539  accuracy: 82.11% -> 86.99%     
client [76] (testset)   loss: 0.3232 -> 0.3443  accuracy: 91.98% -> 90.46%     
client [67] (testset)   loss: 0.1712 -> 0.1203  accuracy: 94.81% -> 96.10%     
client [37] (testset)   loss: 0.4344 -> 0.3223  accuracy: 91.12% -> 92.90%     
client [58] (testset)   loss: 0.6083 -> 0.3358  accuracy: 82.32% -> 86.19%     
client [64] (testset)   loss: 0.2130 -> 0.1095  accuracy: 92.05% -> 96.65%     
client [77] (testset)   loss: 0.3786 -> 0.2534  accuracy: 87.43% -> 92.57%     
client [55] (testset)   loss: 0.1427 -> 0.1615  accuracy: 93.91% -> 94.42%     
client [12] (testset)   loss: 0.2925 -> 0.2916  accuracy: 91.14% -> 91.77%     
client [89] (testset)   loss: 0.2326 -> 0.1612  accuracy: 95.68% -> 97.84%     
---------------------------- TRAINING EPOCH: 170 ----------------------------  
client [84] (testset)   loss: 0.3086 -> 0.3171  accuracy: 92.78% -> 92.78%     
client [51] (testset)   loss: 0.1331 -> 0.1355  accuracy: 96.96% -> 96.58%     
client [8]  (testset)   loss: 0.3420 -> 0.1895  accuracy: 94.12% -> 95.10%     
client [18] (testset)   loss: 0.1970 -> 0.1798  accuracy: 96.18% -> 95.42%     
client [94] (testset)   loss: 0.2116 -> 0.1687  accuracy: 91.93% -> 93.79%     
client [81] (testset)   loss: 0.0464 -> 0.0530  accuracy: 98.31% -> 98.31%     
client [3]  (testset)   loss: 0.1138 -> 0.1048  accuracy: 97.44% -> 96.79%     
client [11] (testset)   loss: 0.1165 -> 0.1006  accuracy: 97.02% -> 98.81%     
client [95] (testset)   loss: 0.4967 -> 0.4709  accuracy: 93.33% -> 94.29%     
client [67] (testset)   loss: 0.1724 -> 0.1284  accuracy: 94.37% -> 95.67%     
---------------------------- TRAINING EPOCH: 180 ----------------------------  
client [21] (testset)   loss: 0.4784 -> 0.3657  accuracy: 85.53% -> 89.94%     
client [79] (testset)   loss: 0.3951 -> 0.4269  accuracy: 85.71% -> 85.71%     
client [58] (testset)   loss: 0.4142 -> 0.4269  accuracy: 85.64% -> 84.53%     
client [88] (testset)   loss: 0.3395 -> 0.3755  accuracy: 89.93% -> 90.60%     
client [46] (testset)   loss: 0.2996 -> 0.3076  accuracy: 90.20% -> 91.18%     
client [11] (testset)   loss: 0.0920 -> 0.0915  accuracy: 99.40% -> 99.40%     
client [55] (testset)   loss: 0.2595 -> 0.2175  accuracy: 93.91% -> 93.91%     
client [13] (testset)   loss: 0.1988 -> 0.2034  accuracy: 95.09% -> 95.09%     
client [31] (testset)   loss: 0.1513 -> 0.7087  accuracy: 96.64% -> 86.58%     
client [75] (testset)   loss: 0.1996 -> 0.1051  accuracy: 97.12% -> 97.84%     
---------------------------- TRAINING EPOCH: 190 ----------------------------  
client [19] (testset)   loss: 0.2418 -> 0.2556  accuracy: 92.22% -> 94.44%     
client [7]  (testset)   loss: 0.3747 -> 0.2588  accuracy: 91.36% -> 96.30%     
client [57] (testset)   loss: 0.1190 -> 0.1237  accuracy: 95.93% -> 96.27%     
client [13] (testset)   loss: 0.1774 -> 0.2622  accuracy: 96.43% -> 95.09%     
client [43] (testset)   loss: 0.3115 -> 0.2799  accuracy: 91.74% -> 91.28%     
client [91] (testset)   loss: 0.2077 -> 0.1880  accuracy: 93.04% -> 94.94%     
client [10] (testset)   loss: 0.2033 -> 0.1823  accuracy: 94.96% -> 95.68%     
client [64] (testset)   loss: 0.1929 -> 0.1311  accuracy: 92.05% -> 95.82%     
client [82] (testset)   loss: 0.2584 -> 0.2220  accuracy: 93.22% -> 94.92%     
client [22] (testset)   loss: 0.3887 -> 0.3278  accuracy: 88.62% -> 92.68%     
---------------------------- TRAINING EPOCH: 200 ----------------------------  
client [20] (testset)   loss: 0.2362 -> 0.2403  accuracy: 95.10% -> 95.92%     
client [23] (testset)   loss: 0.4986 -> 0.5092  accuracy: 82.86% -> 84.29%     
client [88] (testset)   loss: 0.3311 -> 0.3527  accuracy: 90.60% -> 91.28%     
client [98] (testset)   loss: 0.1526 -> 0.1341  accuracy: 96.56% -> 96.91%     
client [79] (testset)   loss: 0.4073 -> 0.4788  accuracy: 85.06% -> 85.71%     
client [21] (testset)   loss: 0.5465 -> 0.4202  accuracy: 88.05% -> 88.68%     
client [92] (testset)   loss: 0.0184 -> 0.0282  accuracy: 99.54% -> 99.07%     
client [56] (testset)   loss: 0.5032 -> 0.5164  accuracy: 88.78% -> 87.76%     
client [5]  (testset)   loss: 0.2837 -> 0.2445  accuracy: 93.22% -> 95.59%     
client [52] (testset)   loss: 0.1639 -> 0.1003  accuracy: 94.67% -> 96.67%     
---------------------------- TRAINING EPOCH: 210 ----------------------------  
client [67] (testset)   loss: 0.1827 -> 0.1515  accuracy: 96.10% -> 96.97%     
client [54] (testset)   loss: 0.5601 -> 0.5101  accuracy: 86.60% -> 86.60%     
client [14] (testset)   loss: 0.2741 -> 0.1958  accuracy: 90.87% -> 93.36%     
client [99] (testset)   loss: 0.0602 -> 0.0714  accuracy: 99.04% -> 98.08%     
client [36] (testset)   loss: 0.1728 -> 0.1565  accuracy: 95.85% -> 97.24%     
client [30] (testset)   loss: 0.5417 -> 0.4366  accuracy: 89.01% -> 86.81%     
client [38] (testset)   loss: 0.1302 -> 0.1330  accuracy: 95.61% -> 95.95%     
client [15] (testset)   loss: 0.2833 -> 0.2090  accuracy: 94.70% -> 95.45%     
client [6]  (testset)   loss: 0.3191 -> 0.2355  accuracy: 91.45% -> 94.44%     
client [53] (testset)   loss: 0.2654 -> 0.2781  accuracy: 94.85% -> 94.85%     
---------------------------- TRAINING EPOCH: 220 ----------------------------  
client [99] (testset)   loss: 0.0875 -> 0.0665  accuracy: 98.08% -> 99.04%     
client [6]  (testset)   loss: 0.3311 -> 0.2629  accuracy: 92.74% -> 93.59%     
client [83] (testset)   loss: 0.3576 -> 0.4033  accuracy: 92.94% -> 90.59%     
client [42] (testset)   loss: 0.3560 -> 0.3073  accuracy: 89.87% -> 92.51%     
client [34] (testset)   loss: 0.2270 -> 0.2791  accuracy: 93.44% -> 92.90%     
client [15] (testset)   loss: 0.2909 -> 0.2365  accuracy: 93.94% -> 93.94%     
client [47] (testset)   loss: 0.3038 -> 0.3036  accuracy: 91.20% -> 95.83%     
client [55] (testset)   loss: 0.1923 -> 0.1806  accuracy: 94.42% -> 93.91%     
client [51] (testset)   loss: 0.1321 -> 0.1108  accuracy: 96.58% -> 98.10%     
client [95] (testset)   loss: 0.6450 -> 0.5787  accuracy: 92.38% -> 95.24%     
---------------------------- TRAINING EPOCH: 230 ----------------------------  
client [71] (testset)   loss: 0.2549 -> 0.2747  accuracy: 93.75% -> 93.75%     
client [15] (testset)   loss: 0.2077 -> 0.2150  accuracy: 96.21% -> 94.70%     
client [33] (testset)   loss: 0.6117 -> 0.4515  accuracy: 83.06% -> 88.84%     
client [99] (testset)   loss: 0.0631 -> 0.0539  accuracy: 97.12% -> 97.12%     
client [90] (testset)   loss: 0.2185 -> 0.2030  accuracy: 94.41% -> 94.97%     
client [57] (testset)   loss: 0.2175 -> 0.1474  accuracy: 94.24% -> 96.95%     
client [27] (testset)   loss: 0.0003 -> 0.0001  accuracy: 100.00% -> 100.00%   
client [78] (testset)   loss: 0.0439 -> 0.0660  accuracy: 98.41% -> 98.41%     
client [36] (testset)   loss: 0.1474 -> 0.1696  accuracy: 96.77% -> 96.77%     
client [88] (testset)   loss: 0.5304 -> 0.4503  accuracy: 91.28% -> 90.60%     
---------------------------- TRAINING EPOCH: 240 ----------------------------  
client [70] (testset)   loss: 0.3053 -> 0.2537  accuracy: 96.51% -> 96.51%     
client [35] (testset)   loss: 0.1998 -> 0.1120  accuracy: 94.19% -> 96.13%     
client [16] (testset)   loss: 0.4442 -> 0.4130  accuracy: 92.48% -> 93.98%     
client [80] (testset)   loss: 0.2904 -> 0.3121  accuracy: 96.23% -> 94.34%     
client [38] (testset)   loss: 0.1636 -> 0.1703  accuracy: 95.27% -> 95.95%     
client [78] (testset)   loss: 0.1026 -> 0.1025  accuracy: 98.41% -> 99.21%     
client [68] (testset)   loss: 0.4937 -> 0.4896  accuracy: 88.20% -> 87.89%     
client [11] (testset)   loss: 0.1033 -> 0.0871  accuracy: 98.81% -> 99.40%     
client [64] (testset)   loss: 0.2006 -> 0.1484  accuracy: 94.14% -> 95.40%     
client [82] (testset)   loss: 0.1945 -> 0.2157  accuracy: 95.34% -> 95.76%     
---------------------------- TRAINING EPOCH: 250 ----------------------------  
client [30] (testset)   loss: 0.3543 -> 0.4284  accuracy: 87.91% -> 90.11%     
client [27] (testset)   loss: 0.0001 -> 0.0001  accuracy: 100.00% -> 100.00%   
client [74] (testset)   loss: 0.2366 -> 0.2361  accuracy: 94.33% -> 94.33%     
client [45] (testset)   loss: 0.1968 -> 0.1938  accuracy: 95.00% -> 95.56%     
client [6]  (testset)   loss: 0.3287 -> 0.3035  accuracy: 91.88% -> 93.16%     
client [36] (testset)   loss: 0.2016 -> 0.1819  accuracy: 96.31% -> 97.24%     
client [63] (testset)   loss: 0.0495 -> 0.0288  accuracy: 98.48% -> 98.48%     
client [76] (testset)   loss: 0.4560 -> 0.3848  accuracy: 92.37% -> 92.75%     
client [83] (testset)   loss: 0.2149 -> 0.3431  accuracy: 94.12% -> 94.12%     
client [86] (testset)   loss: 0.5221 -> 0.4851  accuracy: 87.34% -> 90.39%     
---------------------------- TRAINING EPOCH: 260 ----------------------------  
client [83] (testset)   loss: 0.4904 -> 0.3781  accuracy: 90.59% -> 92.94%     
client [99] (testset)   loss: 0.0651 -> 0.0613  accuracy: 97.12% -> 98.08%     
client [74] (testset)   loss: 0.3373 -> 0.2642  accuracy: 91.94% -> 94.03%     
client [73] (testset)   loss: 0.3219 -> 0.2851  accuracy: 94.57% -> 94.12%     
client [29] (testset)   loss: 0.3891 -> 0.3594  accuracy: 91.11% -> 91.11%     
client [92] (testset)   loss: 0.0195 -> 0.0309  accuracy: 99.54% -> 99.54%     
client [6]  (testset)   loss: 0.2753 -> 0.2636  accuracy: 92.31% -> 92.74%     
client [61] (testset)   loss: 0.3723 -> 0.3095  accuracy: 90.71% -> 92.14%     
client [21] (testset)   loss: 0.6169 -> 0.5005  accuracy: 86.79% -> 89.31%     
client [67] (testset)   loss: 0.2098 -> 0.1621  accuracy: 94.81% -> 96.54%     
---------------------------- TRAINING EPOCH: 270 ----------------------------  
client [83] (testset)   loss: 0.4976 -> 0.3628  accuracy: 92.94% -> 92.94%     
client [32] (testset)   loss: 0.2932 -> 0.3429  accuracy: 92.79% -> 90.09%     
client [95] (testset)   loss: 0.7034 -> 0.6183  accuracy: 94.29% -> 94.29%     
client [61] (testset)   loss: 0.3016 -> 0.2946  accuracy: 92.86% -> 92.86%     
client [27] (testset)   loss: 0.0002 -> 0.0001  accuracy: 100.00% -> 100.00%   
client [25] (testset)   loss: 0.4742 -> 0.4663  accuracy: 91.60% -> 93.13%     
client [68] (testset)   loss: 0.5807 -> 0.5470  accuracy: 87.89% -> 86.96%     
client [34] (testset)   loss: 0.3126 -> 0.3006  accuracy: 91.80% -> 93.44%     
client [71] (testset)   loss: 0.3564 -> 0.6797  accuracy: 90.62% -> 87.50%     
client [89] (testset)   loss: 0.2318 -> 0.1761  accuracy: 97.84% -> 96.40%     
---------------------------- TRAINING EPOCH: 280 ----------------------------  
client [78] (testset)   loss: 0.1005 -> 0.0881  accuracy: 98.41% -> 99.21%     
client [81] (testset)   loss: 0.1581 -> 0.1515  accuracy: 96.61% -> 96.61%     
client [51] (testset)   loss: 0.1530 -> 0.1623  accuracy: 96.58% -> 97.34%     
client [54] (testset)   loss: 0.5171 -> 0.5748  accuracy: 88.66% -> 88.66%     
client [65] (testset)   loss: 0.3130 -> 0.2252  accuracy: 91.18% -> 92.65%     
client [41] (testset)   loss: 0.2784 -> 0.1990  accuracy: 94.63% -> 96.10%     
client [11] (testset)   loss: 0.1291 -> 0.1044  accuracy: 98.21% -> 99.40%     
client [85] (testset)   loss: 0.2087 -> 0.2162  accuracy: 95.65% -> 95.11%     
client [12] (testset)   loss: 0.3701 -> 0.3440  accuracy: 93.04% -> 93.04%     
client [23] (testset)   loss: 0.4304 -> 0.4842  accuracy: 85.71% -> 85.71%     
---------------------------- TRAINING EPOCH: 290 ----------------------------  
client [16] (testset)   loss: 0.4330 -> 0.4039  accuracy: 92.48% -> 93.98%     
client [65] (testset)   loss: 0.2048 -> 0.1921  accuracy: 94.12% -> 94.85%     
client [53] (testset)   loss: 0.3403 -> 0.3572  accuracy: 94.12% -> 93.38%     
client [58] (testset)   loss: 0.5829 -> 0.5680  accuracy: 86.74% -> 85.64%     
client [72] (testset)   loss: 0.6523 -> 0.6486  accuracy: 89.47% -> 89.47%     
client [7]  (testset)   loss: 0.2710 -> 0.2963  accuracy: 96.71% -> 97.12%     
client [71] (testset)   loss: 0.4074 -> 0.4138  accuracy: 90.62% -> 90.62%     
client [59] (testset)   loss: 0.1530 -> 0.1371  accuracy: 94.44% -> 95.37%     
client [86] (testset)   loss: 0.6532 -> 0.5961  accuracy: 87.77% -> 89.08%     
client [39] (testset)   loss: 0.4784 -> 0.4860  accuracy: 92.54% -> 91.04%     
---------------------------- TRAINING EPOCH: 300 ----------------------------  
client [99] (testset)   loss: 0.0779 -> 0.0640  accuracy: 97.12% -> 97.12%     
client [7]  (testset)   loss: 0.3213 -> 0.3354  accuracy: 95.06% -> 95.47%     
client [17] (testset)   loss: 0.3101 -> 0.3220  accuracy: 92.47% -> 90.41%     
client [64] (testset)   loss: 0.2077 -> 0.1765  accuracy: 94.98% -> 95.40%     
client [37] (testset)   loss: 0.4787 -> 0.4785  accuracy: 92.31% -> 92.31%     
client [29] (testset)   loss: 0.3509 -> 0.3705  accuracy: 91.67% -> 92.22%     
client [93] (testset)   loss: 0.8426 -> 0.7801  accuracy: 85.31% -> 84.97%     
client [73] (testset)   loss: 0.2856 -> 0.2871  accuracy: 93.21% -> 95.48%     
client [40] (testset)   loss: 0.3838 -> 0.3734  accuracy: 92.06% -> 90.48%     
client [76] (testset)   loss: 0.4367 -> 0.4381  accuracy: 91.60% -> 92.37%     
---------------------------- TRAINING EPOCH: 310 ----------------------------  
client [31] (testset)   loss: 0.2320 -> 0.2578  accuracy: 93.96% -> 93.29%     
client [89] (testset)   loss: 0.1964 -> 0.1928  accuracy: 97.84% -> 97.12%     
client [77] (testset)   loss: 0.3511 -> 0.3526  accuracy: 93.71% -> 93.14%     
client [90] (testset)   loss: 0.2649 -> 0.2396  accuracy: 93.85% -> 94.41%     
client [26] (testset)   loss: 0.1521 -> 0.1374  accuracy: 97.40% -> 98.70%     
client [50] (testset)   loss: 0.2698 -> 0.2389  accuracy: 95.36% -> 97.35%     
client [30] (testset)   loss: 0.6646 -> 0.6323  accuracy: 86.81% -> 87.91%     
client [70] (testset)   loss: 0.2905 -> 0.2425  accuracy: 95.35% -> 95.35%     
client [41] (testset)   loss: 0.2549 -> 0.2255  accuracy: 95.12% -> 97.07%     
client [99] (testset)   loss: 0.0720 -> 0.0606  accuracy: 97.12% -> 97.12%     
---------------------------- TRAINING EPOCH: 320 ----------------------------  
client [68] (testset)   loss: 0.6873 -> 0.5948  accuracy: 86.02% -> 87.27%     
client [70] (testset)   loss: 0.2793 -> 0.2561  accuracy: 95.35% -> 96.51%     
client [52] (testset)   loss: 0.1569 -> 0.1410  accuracy: 95.33% -> 96.67%     
client [1]  (testset)   loss: 0.3579 -> 0.2645  accuracy: 92.65% -> 94.12%     
client [2]  (testset)   loss: 0.7496 -> 0.5820  accuracy: 88.24% -> 92.81%     
client [67] (testset)   loss: 0.2064 -> 0.1897  accuracy: 95.67% -> 96.97%     
client [92] (testset)   loss: 0.0788 -> 0.0482  accuracy: 99.07% -> 99.07%     
client [35] (testset)   loss: 0.2040 -> 0.1280  accuracy: 94.19% -> 95.48%     
client [36] (testset)   loss: 0.2180 -> 0.2283  accuracy: 95.85% -> 96.31%     
client [64] (testset)   loss: 0.1836 -> 0.1645  accuracy: 95.82% -> 95.82%     
---------------------------- TRAINING EPOCH: 330 ----------------------------  
client [44] (testset)   loss: 0.7905 -> 0.7643  accuracy: 87.26% -> 86.98%     
client [6]  (testset)   loss: 0.3427 -> 0.3323  accuracy: 93.16% -> 93.59%     
client [12] (testset)   loss: 0.3457 -> 0.3725  accuracy: 93.67% -> 92.41%     
client [55] (testset)   loss: 0.2609 -> 0.2805  accuracy: 93.91% -> 93.91%     
client [29] (testset)   loss: 0.3884 -> 0.3901  accuracy: 92.22% -> 91.67%     
client [9]  (testset)   loss: 0.1080 -> 0.1169  accuracy: 97.33% -> 97.33%     
client [43] (testset)   loss: 0.3544 -> 0.3578  accuracy: 92.66% -> 92.20%     
client [77] (testset)   loss: 0.4227 -> 0.4084  accuracy: 93.71% -> 93.71%     
client [98] (testset)   loss: 0.1598 -> 0.1624  accuracy: 97.25% -> 97.25%     
client [78] (testset)   loss: 0.0519 -> 0.0781  accuracy: 99.21% -> 99.21%     
---------------------------- TRAINING EPOCH: 340 ----------------------------  
client [92] (testset)   loss: 0.0916 -> 0.0732  accuracy: 98.15% -> 98.61%     
client [80] (testset)   loss: 0.3390 -> 0.3773  accuracy: 94.34% -> 95.28%     
client [63] (testset)   loss: 0.0373 -> 0.0413  accuracy: 96.97% -> 96.97%     
client [76] (testset)   loss: 0.4809 -> 0.4642  accuracy: 91.60% -> 92.75%     
client [78] (testset)   loss: 0.0832 -> 0.0766  accuracy: 99.21% -> 99.21%     
client [25] (testset)   loss: 0.4407 -> 0.4927  accuracy: 94.27% -> 93.13%     
client [58] (testset)   loss: 0.5344 -> 0.5963  accuracy: 86.74% -> 84.53%     
client [13] (testset)   loss: 0.2213 -> 0.2322  accuracy: 94.64% -> 94.20%     
client [17] (testset)   loss: 0.3612 -> 0.3364  accuracy: 92.47% -> 93.15%     
client [38] (testset)   loss: 0.2167 -> 0.1869  accuracy: 95.61% -> 95.95%     
---------------------------- TRAINING EPOCH: 350 ----------------------------  
client [72] (testset)   loss: 0.6142 -> 0.5811  accuracy: 89.47% -> 89.47%     
client [82] (testset)   loss: 0.2593 -> 0.2593  accuracy: 94.92% -> 94.92%     
client [86] (testset)   loss: 0.6263 -> 0.5877  accuracy: 86.03% -> 88.21%     
client [51] (testset)   loss: 0.1270 -> 0.1378  accuracy: 97.34% -> 98.10%     
client [96] (testset)   loss: 0.4070 -> 0.3933  accuracy: 90.39% -> 90.83%     
client [42] (testset)   loss: 0.2863 -> 0.3478  accuracy: 92.07% -> 92.51%     
client [55] (testset)   loss: 0.2537 -> 0.2796  accuracy: 94.42% -> 93.91%     
client [13] (testset)   loss: 0.2217 -> 0.2316  accuracy: 95.09% -> 95.09%     
client [1]  (testset)   loss: 0.3483 -> 0.3353  accuracy: 91.91% -> 91.91%     
client [12] (testset)   loss: 0.3401 -> 0.3737  accuracy: 92.41% -> 91.77%     
---------------------------- TRAINING EPOCH: 360 ----------------------------  
client [68] (testset)   loss: 0.6868 -> 0.6763  accuracy: 86.96% -> 86.34%     
client [23] (testset)   loss: 0.5043 -> 0.5114  accuracy: 85.71% -> 85.71%     
client [46] (testset)   loss: 0.4048 -> 0.4306  accuracy: 90.85% -> 91.50%     
client [41] (testset)   loss: 0.3997 -> 0.2541  accuracy: 94.15% -> 96.59%     
client [25] (testset)   loss: 0.4479 -> 0.4715  accuracy: 93.13% -> 93.51%     
client [58] (testset)   loss: 0.5628 -> 0.6347  accuracy: 87.29% -> 85.08%     
client [14] (testset)   loss: 0.2567 -> 0.2537  accuracy: 94.19% -> 93.36%     
client [33] (testset)   loss: 0.6691 -> 0.6323  accuracy: 89.67% -> 90.50%     
client [85] (testset)   loss: 0.2780 -> 0.2727  accuracy: 95.65% -> 96.20%     
client [62] (testset)   loss: 0.1203 -> 0.0796  accuracy: 95.42% -> 96.18%     
---------------------------- TRAINING EPOCH: 370 ----------------------------  
client [98] (testset)   loss: 0.1695 -> 0.1697  accuracy: 97.25% -> 97.25%     
client [63] (testset)   loss: 0.0864 -> 0.0668  accuracy: 96.97% -> 96.97%     
client [70] (testset)   loss: 0.3138 -> 0.2870  accuracy: 95.35% -> 95.35%     
client [65] (testset)   loss: 0.3244 -> 0.2467  accuracy: 92.65% -> 93.38%     
client [14] (testset)   loss: 0.2229 -> 0.2526  accuracy: 93.78% -> 93.36%     
client [73] (testset)   loss: 0.3185 -> 0.3277  accuracy: 94.12% -> 95.48%     
client [34] (testset)   loss: 0.3887 -> 0.3980  accuracy: 92.90% -> 93.44%     
client [99] (testset)   loss: 0.0791 -> 0.0795  accuracy: 98.08% -> 98.08%     
client [69] (testset)   loss: 0.4549 -> 0.3916  accuracy: 94.56% -> 93.88%     
client [46] (testset)   loss: 0.3416 -> 0.3948  accuracy: 91.83% -> 91.83%     
---------------------------- TRAINING EPOCH: 380 ----------------------------  
client [99] (testset)   loss: 0.0547 -> 0.0538  accuracy: 99.04% -> 98.08%     
client [93] (testset)   loss: 0.8923 -> 0.8222  accuracy: 85.66% -> 84.62%     
client [11] (testset)   loss: 0.1338 -> 0.1300  accuracy: 98.81% -> 98.81%     
client [58] (testset)   loss: 0.6267 -> 0.6453  accuracy: 87.29% -> 85.64%     
client [81] (testset)   loss: 0.0405 -> 0.0486  accuracy: 98.31% -> 98.31%     
client [85] (testset)   loss: 0.2347 -> 0.2524  accuracy: 96.20% -> 96.20%     
client [89] (testset)   loss: 0.1796 -> 0.1635  accuracy: 98.56% -> 97.84%     
client [45] (testset)   loss: 0.1966 -> 0.2243  accuracy: 95.00% -> 94.44%     
client [8]  (testset)   loss: 0.3190 -> 0.2468  accuracy: 96.08% -> 96.08%     
client [68] (testset)   loss: 0.6685 -> 0.6819  accuracy: 88.20% -> 87.58%     
---------------------------- TRAINING EPOCH: 390 ----------------------------  
client [67] (testset)   loss: 0.2188 -> 0.1914  accuracy: 95.67% -> 96.10%     
client [72] (testset)   loss: 0.5508 -> 0.5527  accuracy: 86.84% -> 89.47%     
client [1]  (testset)   loss: 0.2890 -> 0.3034  accuracy: 92.65% -> 93.38%     
client [78] (testset)   loss: 0.0699 -> 0.0926  accuracy: 99.21% -> 99.21%     
client [83] (testset)   loss: 0.3733 -> 0.3264  accuracy: 92.94% -> 92.94%     
client [21] (testset)   loss: 0.6257 -> 0.5808  accuracy: 89.94% -> 89.31%     
client [56] (testset)   loss: 0.7164 -> 0.7220  accuracy: 89.80% -> 89.80%     
client [44] (testset)   loss: 0.8779 -> 0.8323  accuracy: 86.43% -> 86.70%     
client [92] (testset)   loss: 0.0645 -> 0.0618  accuracy: 98.61% -> 99.07%     
client [27] (testset)   loss: 0.0000 -> 0.0000  accuracy: 100.00% -> 100.00%   
---------------------------- TRAINING EPOCH: 400 ----------------------------  
client [10] (testset)   loss: 0.3070 -> 0.3246  accuracy: 97.12% -> 95.68%     
client [39] (testset)   loss: 0.4556 -> 0.5100  accuracy: 92.54% -> 92.54%     
client [65] (testset)   loss: 0.2600 -> 0.2332  accuracy: 92.65% -> 94.12%     
client [26] (testset)   loss: 0.2021 -> 0.1807  accuracy: 97.40% -> 97.40%     
client [19] (testset)   loss: 0.3895 -> 0.4015  accuracy: 95.56% -> 94.44%     
client [68] (testset)   loss: 0.7581 -> 0.7133  accuracy: 87.89% -> 88.51%     
client [41] (testset)   loss: 0.3264 -> 0.2822  accuracy: 95.12% -> 96.10%     
client [50] (testset)   loss: 0.2441 -> 0.2545  accuracy: 97.35% -> 97.35%     
client [75] (testset)   loss: 0.1682 -> 0.1558  accuracy: 97.84% -> 97.84%     
client [81] (testset)   loss: 0.0766 -> 0.0778  accuracy: 98.31% -> 98.31%     
Training... ---------------------------------------- 100% 0:15:19
PSFL's average time taken by each global epoch: 0 min 2.28 sec.                
PSFL's total running time: 0 h 15 m 19 s.                                      
==================== PSFL Experiment Results: ====================             
Display format: (before local fine-tuning) -> (after local fine-tuning)        
 So if finetune_epoch = 0, x.xx% -> 0.00% is normal.                           
 Centralized testing ONLY happens after model aggregation, so the stats between
'->' are the same.                                                             
{                                                                              
    "100": {                                                                   
        "all_clients": {                                                       
            "test": {                                                          
                "loss": "0.2483 -> 0.0000",                                    
                "accuracy": "91.52% -> 0.00%"                                  
            }                                                                  
        }                                                                      
    },                                                                         
    "200": {                                                                   
        "all_clients": {                                                       
            "test": {                                                          
                "loss": "0.3142 -> 0.0000",                                    
                "accuracy": "92.46% -> 0.00%"                                  
            }                                                                  
        }                                                                      
    },                                                                         
    "300": {                                                                   
        "all_clients": {                                                       
            "test": {                                                          
                "loss": "0.3791 -> 0.0000",                                    
                "accuracy": "92.81% -> 0.00%"                                  
            }                                                                  
        }                                                                      
    },                                                                         
    "400": {                                                                   
        "all_clients": {                                                       
            "test": {                                                          
                "loss": "0.3880 -> 0.0000",                                    
                "accuracy": "93.52% -> 0.00%"                                  
            }                                                                  
        }                                                                      
    }                                                                          
}                                                                              
==================== PSFL Max Accuracy ====================                    
all_clients:                                                                   
(test) before fine-tuning: 93.52% at epoch 400                                 
(test) after fine-tuning: 0.00% at epoch 100                                   
[0m