==================== PSFL ====================                                 
Experiment Arguments:                                                          
{
│   'method': 'psfl',
│   'dataset': {
│   │   'name': 'mnist',
│   │   'client_num': 100,
│   │   'test_ratio': 0.25,
│   │   'val_ratio': 0.0,
│   │   'seed': 42,
│   │   'split': 'sample',
│   │   'IID_ratio': 0.0,
│   │   'monitor_window_name_suffix': 'mnist-100clients-0%IID-Dir(0.5)-seed42',
│   │   'alpha': 0.5,
│   │   'min_samples_per_client': 10
│   },
│   'model': {
│   │   'name': 'avgcnn',
│   │   'use_torchvision_pretrained_weights': True,
│   │   'external_model_weights_path': None
│   },
│   'optimizer': {
│   │   'lr': 0.01,
│   │   'dampening': 0,
│   │   'weight_decay': 0,
│   │   'momentum': 0,
│   │   'nesterov': False,
│   │   'name': 'sgd'
│   },
│   'mode': 'sequential',
│   'parallel': {
│   │   'ray_cluster_addr': None,
│   │   'num_cpus': None,
│   │   'num_gpus': None,
│   │   'num_workers': 2
│   },
│   'common': {
│   │   'seed': 42,
│   │   'join_ratio': 0.1,
│   │   'global_epoch': 400,
│   │   'local_epoch': 5,
│   │   'batch_size': 32,
│   │   'reset_optimizer_on_global_epoch': True,
│   │   'straggler_ratio': 0,
│   │   'straggler_min_local_epoch': 0,
│   │   'buffers': 'global',
│   │   'client_side_evaluation': True,
│   │   'test': {
│   │   │   'client': {
│   │   │   │   'interval': 100,
│   │   │   │   'finetune_epoch': 0,
│   │   │   │   'train': False,
│   │   │   │   'val': False,
│   │   │   │   'test': True
│   │   │   },
│   │   │   'server': {
│   │   │   │   'interval': -1,
│   │   │   │   'train': False,
│   │   │   │   'val': False,
│   │   │   │   'test': False,
│   │   │   │   'model_in_train_mode': False
│   │   │   }
│   │   },
│   │   'verbose_gap': 10,
│   │   'monitor': None,
│   │   'use_cuda': True,
│   │   'save_log': True,
│   │   'save_model': False,
│   │   'save_learning_curve_plot': False,
│   │   'save_metrics': True,
│   │   'delete_useless_run': True
│   },
│   'psfl': {
│   │   'alpha': 0.0,
│   │   'CLS': False,
│   │   'ig_ratio': 0.99,
│   │   'track': False
│   }
}
---------------------------- TRAINING EPOCH: 10 ----------------------------   
client [77] (testset)   loss: 0.3838 -> 0.2516  accuracy: 92.94% -> 91.76%     
client [81] (testset)   loss: 0.1213 -> 0.1455  accuracy: 96.68% -> 96.68%     
client [21] (testset)   loss: 0.2589 -> 0.1101  accuracy: 94.26% -> 97.61%     
client [68] (testset)   loss: 0.0780 -> 0.0547  accuracy: 97.32% -> 98.66%     
client [93] (testset)   loss: 0.0774 -> 0.0658  accuracy: 97.16% -> 97.87%     
client [31] (testset)   loss: 0.1053 -> 0.0869  accuracy: 97.33% -> 96.26%     
client [20] (testset)   loss: 0.1200 -> 0.1145  accuracy: 96.48% -> 95.77%     
client [59] (testset)   loss: 0.1409 -> 0.0808  accuracy: 95.83% -> 95.83%     
client [48] (testset)   loss: 0.0603 -> 0.0749  accuracy: 97.16% -> 98.58%     
client [34] (testset)   loss: 0.1015 -> 0.0931  accuracy: 97.00% -> 97.00%     
---------------------------- TRAINING EPOCH: 20 ----------------------------   
client [69] (testset)   loss: 0.0911 -> 0.0996  accuracy: 97.14% -> 96.43%     
client [99] (testset)   loss: 0.1398 -> 0.1130  accuracy: 93.49% -> 94.08%     
client [67] (testset)   loss: 0.0896 -> 0.0646  accuracy: 97.14% -> 98.29%     
client [0]  (testset)   loss: 0.1002 -> 0.0959  accuracy: 96.82% -> 97.45%     
client [76] (testset)   loss: 0.0777 -> 0.0511  accuracy: 96.72% -> 98.36%     
client [41] (testset)   loss: 0.1004 -> 0.0818  accuracy: 97.76% -> 97.31%     
client [62] (testset)   loss: 0.0953 -> 0.0239  accuracy: 97.58% -> 99.39%     
client [2]  (testset)   loss: 0.1358 -> 0.0461  accuracy: 97.40% -> 98.05%     
client [14] (testset)   loss: 0.1350 -> 0.0961  accuracy: 96.02% -> 96.59%     
client [46] (testset)   loss: 0.0637 -> 0.1145  accuracy: 98.17% -> 94.50%     
---------------------------- TRAINING EPOCH: 30 ----------------------------   
client [24] (testset)   loss: 0.0562 -> 0.0607  accuracy: 98.95% -> 98.42%     
client [68] (testset)   loss: 0.0341 -> 0.0279  accuracy: 98.21% -> 98.66%     
client [57] (testset)   loss: 0.0989 -> 0.1014  accuracy: 96.81% -> 97.87%     
client [17] (testset)   loss: 0.0440 -> 0.0420  accuracy: 99.19% -> 99.19%     
client [54] (testset)   loss: 0.0167 -> 0.0252  accuracy: 99.56% -> 99.56%     
client [23] (testset)   loss: 0.0832 -> 0.0307  accuracy: 99.13% -> 100.00%    
client [35] (testset)   loss: 0.0590 -> 0.0560  accuracy: 97.48% -> 97.48%     
client [59] (testset)   loss: 0.0467 -> 0.0391  accuracy: 98.96% -> 97.92%     
client [31] (testset)   loss: 0.0604 -> 0.0470  accuracy: 97.86% -> 98.40%     
client [9]  (testset)   loss: 0.0423 -> 0.0547  accuracy: 98.18% -> 98.18%     
---------------------------- TRAINING EPOCH: 40 ----------------------------   
client [64] (testset)   loss: 0.0975 -> 0.1113  accuracy: 97.62% -> 96.03%     
client [33] (testset)   loss: 0.0725 -> 0.0585  accuracy: 97.79% -> 97.24%     
client [16] (testset)   loss: 0.1370 -> 0.1376  accuracy: 93.28% -> 94.12%     
client [44] (testset)   loss: 0.0615 -> 0.5503  accuracy: 97.73% -> 87.25%     
client [8]  (testset)   loss: 0.1795 -> 0.0434  accuracy: 92.65% -> 98.53%     
client [31] (testset)   loss: 0.0428 -> 0.0492  accuracy: 98.40% -> 97.33%     
client [47] (testset)   loss: 0.0548 -> 0.0534  accuracy: 98.30% -> 97.92%     
client [36] (testset)   loss: 0.0683 -> 0.0465  accuracy: 96.53% -> 98.84%     
client [20] (testset)   loss: 0.0479 -> 0.0523  accuracy: 98.59% -> 97.18%     
client [56] (testset)   loss: 0.0429 -> 0.0557  accuracy: 98.85% -> 98.08%     
---------------------------- TRAINING EPOCH: 50 ----------------------------   
client [4]  (testset)   loss: 0.1917 -> 0.1855  accuracy: 96.84% -> 97.47%     
client [60] (testset)   loss: 0.0431 -> 0.0319  accuracy: 98.69% -> 98.69%     
client [28] (testset)   loss: 0.0206 -> 0.0347  accuracy: 99.02% -> 99.02%     
client [25] (testset)   loss: 0.0779 -> 0.0846  accuracy: 98.59% -> 98.59%     
client [58] (testset)   loss: 0.1149 -> 0.0971  accuracy: 97.45% -> 98.47%     
client [44] (testset)   loss: 0.1628 -> 0.0492  accuracy: 95.18% -> 98.02%     
client [39] (testset)   loss: 0.1076 -> 0.1120  accuracy: 98.16% -> 97.55%     
client [29] (testset)   loss: 0.0568 -> 0.0300  accuracy: 97.67% -> 98.84%     
client [3]  (testset)   loss: 0.1790 -> 0.1466  accuracy: 96.97% -> 96.97%     
client [84] (testset)   loss: 0.0342 -> 0.0327  accuracy: 99.10% -> 99.10%     
---------------------------- TRAINING EPOCH: 60 ----------------------------   
client [21] (testset)   loss: 0.0257 -> 0.0262  accuracy: 98.56% -> 99.04%     
client [84] (testset)   loss: 0.0300 -> 0.0271  accuracy: 99.10% -> 99.10%     
client [10] (testset)   loss: 0.0187 -> 0.0138  accuracy: 99.02% -> 99.51%     
client [36] (testset)   loss: 0.0382 -> 0.0643  accuracy: 98.07% -> 98.07%     
client [65] (testset)   loss: 0.0301 -> 0.0248  accuracy: 98.72% -> 99.15%     
client [81] (testset)   loss: 0.0760 -> 0.0816  accuracy: 97.10% -> 97.10%     
client [79] (testset)   loss: 0.1172 -> 0.1196  accuracy: 97.28% -> 96.60%     
client [42] (testset)   loss: 0.0853 -> 0.0861  accuracy: 96.63% -> 97.12%     
client [11] (testset)   loss: 0.0303 -> 0.0571  accuracy: 98.65% -> 96.86%     
client [96] (testset)   loss: 0.0218 -> 0.0232  accuracy: 98.95% -> 98.95%     
---------------------------- TRAINING EPOCH: 70 ----------------------------   
client [8]  (testset)   loss: 0.0304 -> 0.0401  accuracy: 98.53% -> 97.06%     
client [53] (testset)   loss: 0.0480 -> 0.0607  accuracy: 97.56% -> 97.56%     
client [52] (testset)   loss: 0.1474 -> 0.1517  accuracy: 97.40% -> 97.40%     
client [42] (testset)   loss: 0.0918 -> 0.0846  accuracy: 96.15% -> 97.12%     
client [69] (testset)   loss: 0.0695 -> 0.0634  accuracy: 97.14% -> 97.86%     
client [59] (testset)   loss: 0.0312 -> 0.0369  accuracy: 97.92% -> 97.92%     
client [7]  (testset)   loss: 0.0112 -> 0.0097  accuracy: 99.56% -> 100.00%    
client [26] (testset)   loss: 0.0554 -> 0.0462  accuracy: 98.37% -> 97.56%     
client [49] (testset)   loss: 0.0415 -> 0.0446  accuracy: 98.53% -> 98.53%     
client [98] (testset)   loss: 0.0787 -> 0.0711  accuracy: 97.14% -> 97.14%     
---------------------------- TRAINING EPOCH: 80 ----------------------------   
client [98] (testset)   loss: 0.0681 -> 0.0660  accuracy: 97.14% -> 97.14%     
client [47] (testset)   loss: 0.0396 -> 0.0405  accuracy: 98.68% -> 98.49%     
client [21] (testset)   loss: 0.0200 -> 0.0201  accuracy: 99.52% -> 99.52%     
client [77] (testset)   loss: 0.1298 -> 0.1147  accuracy: 95.29% -> 95.29%     
client [95] (testset)   loss: 0.0438 -> 0.0503  accuracy: 97.65% -> 97.65%     
client [91] (testset)   loss: 0.0428 -> 0.0444  accuracy: 99.12% -> 99.12%     
client [14] (testset)   loss: 0.0834 -> 0.0652  accuracy: 96.59% -> 97.73%     
client [99] (testset)   loss: 0.0832 -> 0.0823  accuracy: 96.45% -> 96.45%     
client [20] (testset)   loss: 0.0251 -> 0.0397  accuracy: 98.59% -> 98.59%     
client [39] (testset)   loss: 0.1119 -> 0.1228  accuracy: 97.55% -> 97.55%     
---------------------------- TRAINING EPOCH: 90 ----------------------------   
client [52] (testset)   loss: 0.1424 -> 0.1456  accuracy: 97.40% -> 97.40%     
client [62] (testset)   loss: 0.0081 -> 0.0085  accuracy: 99.39% -> 99.39%     
client [71] (testset)   loss: 0.0128 -> 0.0125  accuracy: 100.00% -> 100.00%   
client [97] (testset)   loss: 0.0470 -> 0.0468  accuracy: 97.75% -> 97.75%     
client [30] (testset)   loss: 0.0246 -> 0.0180  accuracy: 99.35% -> 99.35%     
client [88] (testset)   loss: 0.0012 -> 0.0011  accuracy: 100.00% -> 100.00%   
client [60] (testset)   loss: 0.0248 -> 0.0227  accuracy: 98.69% -> 98.69%     
client [82] (testset)   loss: 0.0563 -> 0.0560  accuracy: 98.74% -> 98.74%     
client [91] (testset)   loss: 0.0416 -> 0.0429  accuracy: 99.12% -> 99.12%     
client [57] (testset)   loss: 0.0506 -> 0.0585  accuracy: 97.87% -> 97.87%     
---------------------------- TRAINING EPOCH: 100 ----------------------------  
client [31] (testset)   loss: 0.0398 -> 0.0443  accuracy: 98.93% -> 97.86%     
client [15] (testset)   loss: 0.0508 -> 0.0543  accuracy: 99.35% -> 99.35%     
client [71] (testset)   loss: 0.0098 -> 0.0093  accuracy: 100.00% -> 100.00%   
client [97] (testset)   loss: 0.0427 -> 0.0443  accuracy: 97.75% -> 97.75%     
client [53] (testset)   loss: 0.0559 -> 0.0698  accuracy: 97.56% -> 97.56%     
client [77] (testset)   loss: 0.1039 -> 0.1125  accuracy: 96.47% -> 96.47%     
client [76] (testset)   loss: 0.0272 -> 0.0338  accuracy: 98.91% -> 98.91%     
client [79] (testset)   loss: 0.1176 -> 0.1206  accuracy: 97.28% -> 97.28%     
client [28] (testset)   loss: 0.0139 -> 0.0131  accuracy: 99.51% -> 99.51%     
client [99] (testset)   loss: 0.0745 -> 0.0785  accuracy: 97.04% -> 96.45%     
---------------------------- TRAINING EPOCH: 110 ----------------------------  
client [97] (testset)   loss: 0.0362 -> 0.0355  accuracy: 98.31% -> 98.31%     
client [86] (testset)   loss: 0.0791 -> 0.0798  accuracy: 98.48% -> 97.97%     
client [34] (testset)   loss: 0.0663 -> 0.0710  accuracy: 98.13% -> 98.13%     
client [73] (testset)   loss: 0.0150 -> 0.0170  accuracy: 99.42% -> 99.42%     
client [5]  (testset)   loss: 0.0686 -> 0.0676  accuracy: 97.06% -> 97.65%     
client [96] (testset)   loss: 0.0196 -> 0.0206  accuracy: 99.30% -> 98.95%     
client [22] (testset)   loss: 0.0292 -> 0.0252  accuracy: 98.52% -> 98.52%     
client [60] (testset)   loss: 0.0238 -> 0.0244  accuracy: 98.69% -> 98.69%     
client [66] (testset)   loss: 0.0438 -> 0.0407  accuracy: 98.33% -> 98.74%     
client [83] (testset)   loss: 0.0855 -> 0.0855  accuracy: 98.32% -> 98.32%     
---------------------------- TRAINING EPOCH: 120 ----------------------------  
client [76] (testset)   loss: 0.0331 -> 0.0359  accuracy: 98.91% -> 98.91%     
client [65] (testset)   loss: 0.0161 -> 0.0170  accuracy: 99.15% -> 99.15%     
client [95] (testset)   loss: 0.0463 -> 0.0480  accuracy: 97.65% -> 97.65%     
client [17] (testset)   loss: 0.0320 -> 0.0269  accuracy: 97.58% -> 98.39%     
client [8]  (testset)   loss: 0.0220 -> 0.0231  accuracy: 100.00% -> 98.53%    
client [35] (testset)   loss: 0.0442 -> 0.0492  accuracy: 97.48% -> 97.48%     
client [98] (testset)   loss: 0.0746 -> 0.0724  accuracy: 98.10% -> 98.10%     
client [53] (testset)   loss: 0.0645 -> 0.0665  accuracy: 97.56% -> 97.56%     
client [43] (testset)   loss: 0.1222 -> 0.1271  accuracy: 98.41% -> 98.41%     
client [64] (testset)   loss: 0.0960 -> 0.1080  accuracy: 97.62% -> 97.62%     
---------------------------- TRAINING EPOCH: 130 ----------------------------  
client [21] (testset)   loss: 0.0221 -> 0.0217  accuracy: 99.04% -> 99.04%     
client [88] (testset)   loss: 0.0005 -> 0.0009  accuracy: 100.00% -> 100.00%   
client [38] (testset)   loss: 0.0682 -> 0.0662  accuracy: 98.43% -> 98.43%     
client [3]  (testset)   loss: 0.2024 -> 0.1977  accuracy: 97.98% -> 96.97%     
client [5]  (testset)   loss: 0.0693 -> 0.0705  accuracy: 97.06% -> 97.65%     
client [41] (testset)   loss: 0.0901 -> 0.0903  accuracy: 96.41% -> 96.86%     
client [7]  (testset)   loss: 0.0055 -> 0.0066  accuracy: 100.00% -> 100.00%   
client [37] (testset)   loss: 0.0286 -> 0.0283  accuracy: 98.35% -> 98.35%     
client [45] (testset)   loss: 0.0325 -> 0.0296  accuracy: 99.30% -> 99.30%     
client [47] (testset)   loss: 0.0375 -> 0.0431  accuracy: 98.87% -> 98.68%     
---------------------------- TRAINING EPOCH: 140 ----------------------------  
client [16] (testset)   loss: 0.1456 -> 0.1482  accuracy: 94.96% -> 94.96%     
client [11] (testset)   loss: 0.0345 -> 0.0394  accuracy: 98.65% -> 98.21%     
client [37] (testset)   loss: 0.0299 -> 0.0299  accuracy: 98.35% -> 98.35%     
client [41] (testset)   loss: 0.0829 -> 0.0974  accuracy: 96.86% -> 97.31%     
client [95] (testset)   loss: 0.0471 -> 0.0468  accuracy: 98.59% -> 98.12%     
client [53] (testset)   loss: 0.0648 -> 0.0731  accuracy: 97.56% -> 97.56%     
client [22] (testset)   loss: 0.0307 -> 0.0272  accuracy: 98.52% -> 98.52%     
client [25] (testset)   loss: 0.0956 -> 0.0943  accuracy: 98.59% -> 98.59%     
client [69] (testset)   loss: 0.0634 -> 0.0637  accuracy: 98.57% -> 98.57%     
client [46] (testset)   loss: 0.0208 -> 0.0195  accuracy: 99.08% -> 99.08%     
---------------------------- TRAINING EPOCH: 150 ----------------------------  
client [47] (testset)   loss: 0.0460 -> 0.0466  accuracy: 98.68% -> 98.68%     
client [69] (testset)   loss: 0.0637 -> 0.0618  accuracy: 98.57% -> 98.57%     
client [82] (testset)   loss: 0.0707 -> 0.0661  accuracy: 98.74% -> 98.48%     
client [45] (testset)   loss: 0.0316 -> 0.0333  accuracy: 99.30% -> 99.30%     
client [7]  (testset)   loss: 0.0051 -> 0.0076  accuracy: 100.00% -> 100.00%   
client [50] (testset)   loss: 0.0355 -> 0.0418  accuracy: 98.88% -> 98.88%     
client [35] (testset)   loss: 0.0517 -> 0.0533  accuracy: 97.48% -> 97.48%     
client [24] (testset)   loss: 0.0249 -> 0.0249  accuracy: 99.47% -> 99.47%     
client [15] (testset)   loss: 0.0631 -> 0.0621  accuracy: 99.35% -> 98.71%     
client [58] (testset)   loss: 0.1264 -> 0.1280  accuracy: 98.47% -> 98.47%     
---------------------------- TRAINING EPOCH: 160 ----------------------------  
client [48] (testset)   loss: 0.0205 -> 0.0226  accuracy: 99.29% -> 99.29%     
client [76] (testset)   loss: 0.0280 -> 0.0285  accuracy: 98.91% -> 98.91%     
client [67] (testset)   loss: 0.0169 -> 0.0165  accuracy: 98.86% -> 98.86%     
client [37] (testset)   loss: 0.0364 -> 0.0292  accuracy: 98.35% -> 98.35%     
client [58] (testset)   loss: 0.1269 -> 0.1223  accuracy: 98.47% -> 98.47%     
client [64] (testset)   loss: 0.0964 -> 0.1046  accuracy: 97.62% -> 97.62%     
client [77] (testset)   loss: 0.0788 -> 0.0845  accuracy: 96.47% -> 96.47%     
client [55] (testset)   loss: 0.0137 -> 0.0147  accuracy: 99.47% -> 99.47%     
client [12] (testset)   loss: 0.1126 -> 0.1139  accuracy: 97.87% -> 97.87%     
client [89] (testset)   loss: 0.0228 -> 0.0204  accuracy: 99.15% -> 99.15%     
---------------------------- TRAINING EPOCH: 170 ----------------------------  
client [84] (testset)   loss: 0.0287 -> 0.0293  accuracy: 99.10% -> 99.10%     
client [51] (testset)   loss: 0.0051 -> 0.0051  accuracy: 99.50% -> 100.00%    
client [8]  (testset)   loss: 0.0188 -> 0.0210  accuracy: 98.53% -> 98.53%     
client [18] (testset)   loss: 0.0507 -> 0.0528  accuracy: 99.26% -> 99.26%     
client [94] (testset)   loss: 0.0369 -> 0.0438  accuracy: 98.78% -> 98.17%     
client [81] (testset)   loss: 0.0663 -> 0.0658  accuracy: 97.93% -> 97.93%     
client [3]  (testset)   loss: 0.2109 -> 0.2153  accuracy: 97.98% -> 97.98%     
client [11] (testset)   loss: 0.0352 -> 0.0397  accuracy: 98.65% -> 98.21%     
client [95] (testset)   loss: 0.0534 -> 0.0528  accuracy: 97.65% -> 97.65%     
client [67] (testset)   loss: 0.0180 -> 0.0183  accuracy: 98.86% -> 98.86%     
---------------------------- TRAINING EPOCH: 180 ----------------------------  
client [21] (testset)   loss: 0.0158 -> 0.0165  accuracy: 98.56% -> 99.04%     
client [79] (testset)   loss: 0.1479 -> 0.1495  accuracy: 97.28% -> 97.28%     
client [58] (testset)   loss: 0.1347 -> 0.1342  accuracy: 98.47% -> 98.47%     
client [88] (testset)   loss: 0.0004 -> 0.0005  accuracy: 100.00% -> 100.00%   
client [46] (testset)   loss: 0.0155 -> 0.0169  accuracy: 99.08% -> 99.08%     
client [11] (testset)   loss: 0.0372 -> 0.0464  accuracy: 98.21% -> 98.21%     
client [55] (testset)   loss: 0.0146 -> 0.0160  accuracy: 99.47% -> 99.47%     
client [13] (testset)   loss: 0.1250 -> 0.1252  accuracy: 97.52% -> 97.83%     
client [31] (testset)   loss: 0.0534 -> 0.0542  accuracy: 97.86% -> 97.86%     
client [75] (testset)   loss: 0.0037 -> 0.0036  accuracy: 100.00% -> 100.00%   
---------------------------- TRAINING EPOCH: 190 ----------------------------  
client [19] (testset)   loss: 0.0039 -> 0.0032  accuracy: 100.00% -> 100.00%   
client [7]  (testset)   loss: 0.0053 -> 0.0060  accuracy: 100.00% -> 100.00%   
client [57] (testset)   loss: 0.0631 -> 0.0675  accuracy: 97.87% -> 96.81%     
client [13] (testset)   loss: 0.1294 -> 0.1283  accuracy: 97.52% -> 97.83%     
client [43] (testset)   loss: 0.1574 -> 0.1580  accuracy: 97.62% -> 97.62%     
client [91] (testset)   loss: 0.0458 -> 0.0461  accuracy: 99.12% -> 99.12%     
client [10] (testset)   loss: 0.0090 -> 0.0088  accuracy: 99.02% -> 99.02%     
client [64] (testset)   loss: 0.1045 -> 0.1054  accuracy: 97.62% -> 97.62%     
client [82] (testset)   loss: 0.0698 -> 0.0690  accuracy: 98.74% -> 98.74%     
client [22] (testset)   loss: 0.0323 -> 0.0281  accuracy: 98.52% -> 98.52%     
---------------------------- TRAINING EPOCH: 200 ----------------------------  
client [20] (testset)   loss: 0.0446 -> 0.0420  accuracy: 97.89% -> 97.89%     
client [23] (testset)   loss: 0.0107 -> 0.0142  accuracy: 100.00% -> 99.13%    
client [88] (testset)   loss: 0.0003 -> 0.0004  accuracy: 100.00% -> 100.00%   
client [98] (testset)   loss: 0.0679 -> 0.0707  accuracy: 97.14% -> 97.14%     
client [79] (testset)   loss: 0.1492 -> 0.1498  accuracy: 97.96% -> 97.28%     
client [21] (testset)   loss: 0.0185 -> 0.0181  accuracy: 99.04% -> 99.04%     
client [92] (testset)   loss: 0.1145 -> 0.1141  accuracy: 98.25% -> 98.25%     
client [56] (testset)   loss: 0.0723 -> 0.0758  accuracy: 98.46% -> 98.46%     
client [5]  (testset)   loss: 0.0849 -> 0.0800  accuracy: 97.06% -> 97.65%     
client [52] (testset)   loss: 0.1728 -> 0.1711  accuracy: 97.40% -> 97.40%     
---------------------------- TRAINING EPOCH: 210 ----------------------------  
client [67] (testset)   loss: 0.0189 -> 0.0193  accuracy: 98.86% -> 98.86%     
client [54] (testset)   loss: 0.0092 -> 0.0097  accuracy: 99.56% -> 99.56%     
client [14] (testset)   loss: 0.0975 -> 0.0979  accuracy: 97.16% -> 97.16%     
client [99] (testset)   loss: 0.0896 -> 0.0899  accuracy: 95.86% -> 95.86%     
client [36] (testset)   loss: 0.0221 -> 0.0229  accuracy: 98.46% -> 98.46%     
client [30] (testset)   loss: 0.0177 -> 0.0152  accuracy: 98.71% -> 98.71%     
client [38] (testset)   loss: 0.0678 -> 0.0706  accuracy: 98.43% -> 98.43%     
client [15] (testset)   loss: 0.0617 -> 0.0617  accuracy: 99.35% -> 98.71%     
client [6]  (testset)   loss: 0.0945 -> 0.1013  accuracy: 98.68% -> 98.03%     
client [53] (testset)   loss: 0.0663 -> 0.0714  accuracy: 98.37% -> 97.56%     
---------------------------- TRAINING EPOCH: 220 ----------------------------  
client [99] (testset)   loss: 0.0851 -> 0.0888  accuracy: 95.86% -> 95.86%     
client [6]  (testset)   loss: 0.0972 -> 0.1026  accuracy: 98.03% -> 98.03%     
client [83] (testset)   loss: 0.1014 -> 0.1013  accuracy: 99.16% -> 99.16%     
client [42] (testset)   loss: 0.0952 -> 0.0956  accuracy: 98.08% -> 98.08%     
client [34] (testset)   loss: 0.0815 -> 0.0844  accuracy: 98.13% -> 98.13%     
client [15] (testset)   loss: 0.0625 -> 0.0630  accuracy: 98.71% -> 98.71%     
client [47] (testset)   loss: 0.0497 -> 0.0504  accuracy: 98.68% -> 98.68%     
client [55] (testset)   loss: 0.0152 -> 0.0155  accuracy: 99.47% -> 99.47%     
client [51] (testset)   loss: 0.0061 -> 0.0059  accuracy: 99.50% -> 99.50%     
client [95] (testset)   loss: 0.0567 -> 0.0577  accuracy: 97.65% -> 97.65%     
---------------------------- TRAINING EPOCH: 230 ----------------------------  
client [71] (testset)   loss: 0.0025 -> 0.0031  accuracy: 100.00% -> 100.00%   
client [15] (testset)   loss: 0.0641 -> 0.0633  accuracy: 98.71% -> 98.71%     
client [33] (testset)   loss: 0.0492 -> 0.0489  accuracy: 97.24% -> 97.24%     
client [99] (testset)   loss: 0.0852 -> 0.0861  accuracy: 96.45% -> 96.45%     
client [90] (testset)   loss: 0.0297 -> 0.0302  accuracy: 99.28% -> 99.28%     
client [57] (testset)   loss: 0.0620 -> 0.0638  accuracy: 96.81% -> 96.81%     
client [27] (testset)   loss: 0.1036 -> 0.1042  accuracy: 97.46% -> 97.46%     
client [78] (testset)   loss: 0.0055 -> 0.0057  accuracy: 100.00% -> 100.00%   
client [36] (testset)   loss: 0.0232 -> 0.0232  accuracy: 98.46% -> 98.46%     
client [88] (testset)   loss: 0.0003 -> 0.0004  accuracy: 100.00% -> 100.00%   
---------------------------- TRAINING EPOCH: 240 ----------------------------  
client [70] (testset)   loss: 0.0032 -> 0.0031  accuracy: 100.00% -> 100.00%   
client [35] (testset)   loss: 0.0455 -> 0.0480  accuracy: 97.48% -> 97.48%     
client [16] (testset)   loss: 0.1855 -> 0.1842  accuracy: 94.12% -> 94.12%     
client [80] (testset)   loss: 0.0096 -> 0.0095  accuracy: 100.00% -> 100.00%   
client [38] (testset)   loss: 0.0698 -> 0.0720  accuracy: 98.95% -> 98.95%     
client [78] (testset)   loss: 0.0056 -> 0.0056  accuracy: 100.00% -> 100.00%   
client [68] (testset)   loss: 0.0312 -> 0.0318  accuracy: 99.11% -> 99.11%     
client [11] (testset)   loss: 0.0467 -> 0.0480  accuracy: 98.21% -> 98.21%     
client [64] (testset)   loss: 0.1026 -> 0.1072  accuracy: 97.62% -> 97.62%     
client [82] (testset)   loss: 0.0772 -> 0.0765  accuracy: 98.48% -> 98.48%     
---------------------------- TRAINING EPOCH: 250 ----------------------------  
client [30] (testset)   loss: 0.0138 -> 0.0133  accuracy: 98.71% -> 99.35%     
client [27] (testset)   loss: 0.1065 -> 0.1050  accuracy: 97.46% -> 97.46%     
client [74] (testset)   loss: 0.0619 -> 0.0623  accuracy: 98.70% -> 98.70%     
client [45] (testset)   loss: 0.0380 -> 0.0377  accuracy: 99.30% -> 99.30%     
client [6]  (testset)   loss: 0.0972 -> 0.1067  accuracy: 98.03% -> 98.03%     
client [36] (testset)   loss: 0.0228 -> 0.0224  accuracy: 98.46% -> 98.46%     
client [63] (testset)   loss: 0.1579 -> 0.1605  accuracy: 97.69% -> 97.69%     
client [76] (testset)   loss: 0.0340 -> 0.0359  accuracy: 98.91% -> 98.91%     
client [83] (testset)   loss: 0.1046 -> 0.1046  accuracy: 99.16% -> 99.16%     
client [86] (testset)   loss: 0.1025 -> 0.1068  accuracy: 97.97% -> 97.97%     
---------------------------- TRAINING EPOCH: 260 ----------------------------  
client [83] (testset)   loss: 0.1084 -> 0.1078  accuracy: 99.16% -> 99.16%     
client [99] (testset)   loss: 0.0937 -> 0.0922  accuracy: 96.45% -> 95.27%     
client [74] (testset)   loss: 0.0667 -> 0.0668  accuracy: 98.70% -> 98.70%     
client [73] (testset)   loss: 0.0140 -> 0.0153  accuracy: 99.42% -> 99.42%     
client [29] (testset)   loss: 0.0236 -> 0.0222  accuracy: 99.42% -> 99.42%     
client [92] (testset)   loss: 0.1247 -> 0.1249  accuracy: 98.25% -> 98.25%     
client [6]  (testset)   loss: 0.1093 -> 0.0963  accuracy: 98.03% -> 98.03%     
client [61] (testset)   loss: 0.1495 -> 0.1528  accuracy: 98.74% -> 98.74%     
client [21] (testset)   loss: 0.0179 -> 0.0168  accuracy: 98.56% -> 99.04%     
client [67] (testset)   loss: 0.0186 -> 0.0177  accuracy: 98.86% -> 98.86%     
---------------------------- TRAINING EPOCH: 270 ----------------------------  
client [83] (testset)   loss: 0.1085 -> 0.1083  accuracy: 99.16% -> 99.16%     
client [32] (testset)   loss: 0.0226 -> 0.0246  accuracy: 98.48% -> 98.48%     
client [95] (testset)   loss: 0.0631 -> 0.0638  accuracy: 97.65% -> 97.65%     
client [61] (testset)   loss: 0.1520 -> 0.1532  accuracy: 98.74% -> 98.74%     
client [27] (testset)   loss: 0.1105 -> 0.1094  accuracy: 97.46% -> 97.46%     
client [25] (testset)   loss: 0.1004 -> 0.1029  accuracy: 98.59% -> 98.59%     
client [68] (testset)   loss: 0.0322 -> 0.0326  accuracy: 99.11% -> 99.11%     
client [34] (testset)   loss: 0.0853 -> 0.0886  accuracy: 98.13% -> 98.13%     
client [71] (testset)   loss: 0.0024 -> 0.0025  accuracy: 100.00% -> 100.00%   
client [89] (testset)   loss: 0.0204 -> 0.0199  accuracy: 99.15% -> 99.15%     
---------------------------- TRAINING EPOCH: 280 ----------------------------  
client [78] (testset)   loss: 0.0047 -> 0.0046  accuracy: 100.00% -> 100.00%   
client [81] (testset)   loss: 0.0694 -> 0.0694  accuracy: 97.93% -> 97.93%     
client [51] (testset)   loss: 0.0044 -> 0.0044  accuracy: 100.00% -> 100.00%   
client [54] (testset)   loss: 0.0094 -> 0.0093  accuracy: 99.56% -> 99.56%     
client [65] (testset)   loss: 0.0101 -> 0.0105  accuracy: 99.57% -> 99.57%     
client [41] (testset)   loss: 0.1197 -> 0.1205  accuracy: 96.86% -> 96.86%     
client [11] (testset)   loss: 0.0454 -> 0.0503  accuracy: 98.21% -> 98.21%     
client [85] (testset)   loss: 0.0525 -> 0.0514  accuracy: 98.88% -> 98.88%     
client [12] (testset)   loss: 0.1430 -> 0.1419  accuracy: 97.87% -> 97.87%     
client [23] (testset)   loss: 0.0096 -> 0.0110  accuracy: 100.00% -> 99.13%    
---------------------------- TRAINING EPOCH: 290 ----------------------------  
client [16] (testset)   loss: 0.1964 -> 0.1964  accuracy: 94.12% -> 94.12%     
client [65] (testset)   loss: 0.0097 -> 0.0101  accuracy: 99.57% -> 99.57%     
client [53] (testset)   loss: 0.0679 -> 0.0723  accuracy: 97.56% -> 97.56%     
client [58] (testset)   loss: 0.1492 -> 0.1527  accuracy: 98.47% -> 98.47%     
client [72] (testset)   loss: 0.0348 -> 0.0354  accuracy: 99.07% -> 99.07%     
client [7]  (testset)   loss: 0.0049 -> 0.0045  accuracy: 100.00% -> 100.00%   
client [71] (testset)   loss: 0.0020 -> 0.0025  accuracy: 100.00% -> 100.00%   
client [59] (testset)   loss: 0.0330 -> 0.0320  accuracy: 97.92% -> 97.92%     
client [86] (testset)   loss: 0.1131 -> 0.1148  accuracy: 97.97% -> 97.97%     
client [39] (testset)   loss: 0.1843 -> 0.1841  accuracy: 97.55% -> 97.55%     
---------------------------- TRAINING EPOCH: 300 ----------------------------  
client [99] (testset)   loss: 0.0971 -> 0.0985  accuracy: 95.27% -> 95.27%     
client [7]  (testset)   loss: 0.0035 -> 0.0044  accuracy: 100.00% -> 100.00%   
client [17] (testset)   loss: 0.0180 -> 0.0183  accuracy: 99.19% -> 99.19%     
client [64] (testset)   loss: 0.1183 -> 0.1186  accuracy: 97.62% -> 97.62%     
client [37] (testset)   loss: 0.0392 -> 0.0387  accuracy: 98.35% -> 98.35%     
client [29] (testset)   loss: 0.0250 -> 0.0251  accuracy: 99.42% -> 99.42%     
client [93] (testset)   loss: 0.0182 -> 0.0203  accuracy: 98.58% -> 98.58%     
client [73] (testset)   loss: 0.0151 -> 0.0148  accuracy: 99.42% -> 99.42%     
client [40] (testset)   loss: 0.0405 -> 0.0408  accuracy: 99.66% -> 99.66%     
client [76] (testset)   loss: 0.0333 -> 0.0358  accuracy: 98.91% -> 98.91%     
---------------------------- TRAINING EPOCH: 310 ----------------------------  
client [31] (testset)   loss: 0.0631 -> 0.0662  accuracy: 97.86% -> 97.86%     
client [89] (testset)   loss: 0.0190 -> 0.0190  accuracy: 99.15% -> 99.15%     
client [77] (testset)   loss: 0.1012 -> 0.0964  accuracy: 96.47% -> 96.47%     
client [90] (testset)   loss: 0.0275 -> 0.0274  accuracy: 99.28% -> 99.28%     
client [26] (testset)   loss: 0.0395 -> 0.0408  accuracy: 98.37% -> 98.37%     
client [50] (testset)   loss: 0.0429 -> 0.0488  accuracy: 98.88% -> 98.88%     
client [30] (testset)   loss: 0.0142 -> 0.0139  accuracy: 98.71% -> 98.71%     
client [70] (testset)   loss: 0.0021 -> 0.0021  accuracy: 100.00% -> 100.00%   
client [41] (testset)   loss: 0.1253 -> 0.1217  accuracy: 96.86% -> 96.86%     
client [99] (testset)   loss: 0.0941 -> 0.0993  accuracy: 95.27% -> 95.27%     
---------------------------- TRAINING EPOCH: 320 ----------------------------  
client [68] (testset)   loss: 0.0288 -> 0.0291  accuracy: 99.11% -> 99.11%     
client [70] (testset)   loss: 0.0033 -> 0.0033  accuracy: 100.00% -> 100.00%   
client [52] (testset)   loss: 0.1914 -> 0.1924  accuracy: 97.40% -> 97.40%     
client [1]  (testset)   loss: 0.1366 -> 0.1399  accuracy: 96.05% -> 96.05%     
client [2]  (testset)   loss: 0.0363 -> 0.0379  accuracy: 99.03% -> 99.03%     
client [67] (testset)   loss: 0.0171 -> 0.0176  accuracy: 99.43% -> 98.86%     
client [92] (testset)   loss: 0.1281 -> 0.1300  accuracy: 98.25% -> 98.25%     
client [35] (testset)   loss: 0.0578 -> 0.0541  accuracy: 97.48% -> 97.48%     
client [36] (testset)   loss: 0.0213 -> 0.0211  accuracy: 98.46% -> 98.46%     
client [64] (testset)   loss: 0.1186 -> 0.1200  accuracy: 97.62% -> 97.62%     
---------------------------- TRAINING EPOCH: 330 ----------------------------  
client [44] (testset)   loss: 0.0547 -> 0.0545  accuracy: 98.58% -> 98.58%     
client [6]  (testset)   loss: 0.1050 -> 0.1038  accuracy: 98.03% -> 98.03%     
client [12] (testset)   loss: 0.1507 -> 0.1504  accuracy: 97.87% -> 97.87%     
client [55] (testset)   loss: 0.0178 -> 0.0177  accuracy: 99.47% -> 99.47%     
client [29] (testset)   loss: 0.0209 -> 0.0226  accuracy: 99.42% -> 99.42%     
client [9]  (testset)   loss: 0.0177 -> 0.0179  accuracy: 98.18% -> 98.18%     
client [43] (testset)   loss: 0.1728 -> 0.1721  accuracy: 97.62% -> 97.62%     
client [77] (testset)   loss: 0.0910 -> 0.0898  accuracy: 96.47% -> 96.47%     
client [98] (testset)   loss: 0.0750 -> 0.0744  accuracy: 98.10% -> 98.10%     
client [78] (testset)   loss: 0.0044 -> 0.0042  accuracy: 100.00% -> 100.00%   
---------------------------- TRAINING EPOCH: 340 ----------------------------  
client [92] (testset)   loss: 0.1368 -> 0.1364  accuracy: 98.25% -> 98.25%     
client [80] (testset)   loss: 0.0089 -> 0.0088  accuracy: 100.00% -> 100.00%   
client [63] (testset)   loss: 0.1682 -> 0.1710  accuracy: 97.69% -> 97.69%     
client [76] (testset)   loss: 0.0371 -> 0.0366  accuracy: 98.91% -> 98.91%     
client [78] (testset)   loss: 0.0042 -> 0.0040  accuracy: 100.00% -> 100.00%   
client [25] (testset)   loss: 0.1031 -> 0.1037  accuracy: 98.59% -> 98.59%     
client [58] (testset)   loss: 0.1572 -> 0.1572  accuracy: 98.47% -> 98.47%     
client [13] (testset)   loss: 0.1486 -> 0.1472  accuracy: 97.83% -> 97.83%     
client [17] (testset)   loss: 0.0193 -> 0.0192  accuracy: 99.19% -> 99.19%     
client [38] (testset)   loss: 0.0778 -> 0.0803  accuracy: 98.43% -> 98.43%     
---------------------------- TRAINING EPOCH: 350 ----------------------------  
client [72] (testset)   loss: 0.0363 -> 0.0368  accuracy: 99.07% -> 99.07%     
client [82] (testset)   loss: 0.0816 -> 0.0821  accuracy: 98.74% -> 98.74%     
client [86] (testset)   loss: 0.1166 -> 0.1166  accuracy: 97.97% -> 97.97%     
client [51] (testset)   loss: 0.0045 -> 0.0045  accuracy: 100.00% -> 100.00%   
client [96] (testset)   loss: 0.0219 -> 0.0222  accuracy: 98.95% -> 98.95%     
client [42] (testset)   loss: 0.1005 -> 0.1011  accuracy: 98.08% -> 98.08%     
client [55] (testset)   loss: 0.0174 -> 0.0176  accuracy: 99.47% -> 99.47%     
client [13] (testset)   loss: 0.1509 -> 0.1497  accuracy: 97.83% -> 97.83%     
client [1]  (testset)   loss: 0.1413 -> 0.1411  accuracy: 96.05% -> 96.05%     
client [12] (testset)   loss: 0.1492 -> 0.1493  accuracy: 97.87% -> 97.87%     
---------------------------- TRAINING EPOCH: 360 ----------------------------  
client [68] (testset)   loss: 0.0310 -> 0.0305  accuracy: 99.11% -> 99.11%     
client [23] (testset)   loss: 0.0120 -> 0.0126  accuracy: 99.13% -> 99.13%     
client [46] (testset)   loss: 0.0179 -> 0.0182  accuracy: 99.08% -> 99.08%     
client [41] (testset)   loss: 0.1240 -> 0.1272  accuracy: 96.86% -> 96.86%     
client [25] (testset)   loss: 0.1022 -> 0.1008  accuracy: 98.59% -> 98.59%     
client [58] (testset)   loss: 0.1530 -> 0.1579  accuracy: 98.47% -> 98.47%     
client [14] (testset)   loss: 0.1082 -> 0.1060  accuracy: 96.59% -> 97.16%     
client [33] (testset)   loss: 0.0540 -> 0.0551  accuracy: 97.79% -> 97.79%     
client [85] (testset)   loss: 0.0553 -> 0.0555  accuracy: 98.88% -> 98.88%     
client [62] (testset)   loss: 0.0093 -> 0.0086  accuracy: 99.39% -> 99.39%     
---------------------------- TRAINING EPOCH: 370 ----------------------------  
client [98] (testset)   loss: 0.0791 -> 0.0790  accuracy: 98.10% -> 98.10%     
client [63] (testset)   loss: 0.1744 -> 0.1740  accuracy: 97.22% -> 97.69%     
client [70] (testset)   loss: 0.0026 -> 0.0025  accuracy: 100.00% -> 100.00%   
client [65] (testset)   loss: 0.0108 -> 0.0105  accuracy: 99.57% -> 99.57%     
client [14] (testset)   loss: 0.1088 -> 0.1067  accuracy: 97.16% -> 97.16%     
client [73] (testset)   loss: 0.0165 -> 0.0157  accuracy: 99.42% -> 99.42%     
client [34] (testset)   loss: 0.0935 -> 0.0949  accuracy: 98.13% -> 97.75%     
client [99] (testset)   loss: 0.0975 -> 0.0966  accuracy: 95.27% -> 95.27%     
client [69] (testset)   loss: 0.0730 -> 0.0716  accuracy: 98.57% -> 98.57%     
client [46] (testset)   loss: 0.0180 -> 0.0179  accuracy: 99.08% -> 99.08%     
---------------------------- TRAINING EPOCH: 380 ----------------------------  
client [99] (testset)   loss: 0.0997 -> 0.0979  accuracy: 95.86% -> 95.27%     
client [93] (testset)   loss: 0.0192 -> 0.0208  accuracy: 98.58% -> 98.58%     
client [11] (testset)   loss: 0.0520 -> 0.0513  accuracy: 98.21% -> 98.21%     
client [58] (testset)   loss: 0.1612 -> 0.1591  accuracy: 97.96% -> 98.47%     
client [81] (testset)   loss: 0.0733 -> 0.0727  accuracy: 97.93% -> 97.93%     
client [85] (testset)   loss: 0.0553 -> 0.0564  accuracy: 98.88% -> 98.88%     
client [89] (testset)   loss: 0.0207 -> 0.0215  accuracy: 99.15% -> 99.15%     
client [45] (testset)   loss: 0.0390 -> 0.0397  accuracy: 99.30% -> 99.30%     
client [8]  (testset)   loss: 0.0185 -> 0.0187  accuracy: 98.53% -> 98.53%     
client [68] (testset)   loss: 0.0305 -> 0.0302  accuracy: 99.11% -> 99.11%     
---------------------------- TRAINING EPOCH: 390 ----------------------------  
client [67] (testset)   loss: 0.0194 -> 0.0193  accuracy: 98.86% -> 98.86%     
client [72] (testset)   loss: 0.0362 -> 0.0365  accuracy: 99.07% -> 99.07%     
client [1]  (testset)   loss: 0.1420 -> 0.1469  accuracy: 96.05% -> 96.05%     
client [78] (testset)   loss: 0.0036 -> 0.0036  accuracy: 100.00% -> 100.00%   
client [83] (testset)   loss: 0.1157 -> 0.1167  accuracy: 99.16% -> 99.16%     
client [21] (testset)   loss: 0.0212 -> 0.0212  accuracy: 99.04% -> 98.56%     
client [56] (testset)   loss: 0.0845 -> 0.0854  accuracy: 98.46% -> 98.46%     
client [44] (testset)   loss: 0.0572 -> 0.0567  accuracy: 98.58% -> 98.58%     
client [92] (testset)   loss: 0.1406 -> 0.1406  accuracy: 98.25% -> 98.25%     
client [27] (testset)   loss: 0.1183 -> 0.1162  accuracy: 97.97% -> 97.97%     
---------------------------- TRAINING EPOCH: 400 ----------------------------  
client [10] (testset)   loss: 0.0083 -> 0.0084  accuracy: 99.02% -> 99.02%     
client [39] (testset)   loss: 0.1892 -> 0.1909  accuracy: 97.55% -> 97.55%     
client [65] (testset)   loss: 0.0105 -> 0.0107  accuracy: 99.57% -> 99.57%     
client [26] (testset)   loss: 0.0375 -> 0.0424  accuracy: 98.37% -> 98.37%     
client [19] (testset)   loss: 0.0015 -> 0.0016  accuracy: 100.00% -> 100.00%   
client [68] (testset)   loss: 0.0297 -> 0.0299  accuracy: 99.11% -> 99.11%     
client [41] (testset)   loss: 0.1325 -> 0.1328  accuracy: 96.86% -> 96.86%     
client [50] (testset)   loss: 0.0585 -> 0.0575  accuracy: 98.88% -> 98.88%     
client [75] (testset)   loss: 0.0022 -> 0.0021  accuracy: 100.00% -> 100.00%   
client [81] (testset)   loss: 0.0710 -> 0.0726  accuracy: 98.34% -> 98.34%     
Training... ---------------------------------------- 100% 0:15:44
PSFL's average time taken by each global epoch: 0 min 2.34 sec.                
PSFL's total running time: 0 h 15 m 44 s.                                      
==================== PSFL Experiment Results: ====================             
Display format: (before local fine-tuning) -> (after local fine-tuning)        
 So if finetune_epoch = 0, x.xx% -> 0.00% is normal.                           
 Centralized testing ONLY happens after model aggregation, so the stats between
'->' are the same.                                                             
{                                                                              
    "100": {                                                                   
        "all_clients": {                                                       
            "test": {                                                          
                "loss": "0.0499 -> 0.0000",                                    
                "accuracy": "98.55% -> 0.00%"                                  
            }                                                                  
        }                                                                      
    },                                                                         
    "200": {                                                                   
        "all_clients": {                                                       
            "test": {                                                          
                "loss": "0.0587 -> 0.0000",                                    
                "accuracy": "98.53% -> 0.00%"                                  
            }                                                                  
        }                                                                      
    },                                                                         
    "300": {                                                                   
        "all_clients": {                                                       
            "test": {                                                          
                "loss": "0.0638 -> 0.0000",                                    
                "accuracy": "98.55% -> 0.00%"                                  
            }                                                                  
        }                                                                      
    },                                                                         
    "400": {                                                                   
        "all_clients": {                                                       
            "test": {                                                          
                "loss": "0.0674 -> 0.0000",                                    
                "accuracy": "98.54% -> 0.00%"                                  
            }                                                                  
        }                                                                      
    }                                                                          
}                                                                              
==================== PSFL Max Accuracy ====================                    
all_clients:                                                                   
(test) before fine-tuning: 98.55% at epoch 100                                 
(test) after fine-tuning: 0.00% at epoch 100                                   
[0m