==================== PSFL ====================                                 
Experiment Arguments:                                                          
{
│   'method': 'psfl',
│   'dataset': {
│   │   'name': 'svhn',
│   │   'client_num': 100,
│   │   'test_ratio': 0.25,
│   │   'val_ratio': 0.0,
│   │   'seed': 42,
│   │   'split': 'sample',
│   │   'IID_ratio': 0.0,
│   │   'monitor_window_name_suffix': 'svhn-100clients-0%IID-Dir(0.5)-seed42',
│   │   'alpha': 0.5,
│   │   'min_samples_per_client': 10
│   },
│   'model': {
│   │   'name': 'avgcnn',
│   │   'use_torchvision_pretrained_weights': True,
│   │   'external_model_weights_path': None
│   },
│   'optimizer': {
│   │   'lr': 0.01,
│   │   'dampening': 0,
│   │   'weight_decay': 0,
│   │   'momentum': 0,
│   │   'nesterov': False,
│   │   'name': 'sgd'
│   },
│   'mode': 'sequential',
│   'parallel': {
│   │   'ray_cluster_addr': None,
│   │   'num_cpus': None,
│   │   'num_gpus': None,
│   │   'num_workers': 2
│   },
│   'common': {
│   │   'seed': 42,
│   │   'join_ratio': 0.1,
│   │   'global_epoch': 400,
│   │   'local_epoch': 5,
│   │   'batch_size': 32,
│   │   'reset_optimizer_on_global_epoch': True,
│   │   'straggler_ratio': 0,
│   │   'straggler_min_local_epoch': 0,
│   │   'buffers': 'global',
│   │   'client_side_evaluation': True,
│   │   'test': {
│   │   │   'client': {
│   │   │   │   'interval': 100,
│   │   │   │   'finetune_epoch': 0,
│   │   │   │   'train': False,
│   │   │   │   'val': False,
│   │   │   │   'test': True
│   │   │   },
│   │   │   'server': {
│   │   │   │   'interval': -1,
│   │   │   │   'train': False,
│   │   │   │   'val': False,
│   │   │   │   'test': False,
│   │   │   │   'model_in_train_mode': False
│   │   │   }
│   │   },
│   │   'verbose_gap': 10,
│   │   'monitor': None,
│   │   'use_cuda': True,
│   │   'save_log': True,
│   │   'save_model': False,
│   │   'save_learning_curve_plot': False,
│   │   'save_metrics': True,
│   │   'delete_useless_run': True
│   },
│   'psfl': {
│   │   'alpha': 0.0,
│   │   'CLS': False,
│   │   'ig_ratio': 0.9993,
│   │   'track': False
│   }
}
---------------------------- TRAINING EPOCH: 10 ----------------------------   
client [77] (testset)   loss: 0.6200 -> 0.4987  accuracy: 83.19% -> 84.48%     
client [81] (testset)   loss: 0.7313 -> 0.5966  accuracy: 82.56% -> 85.13%     
client [21] (testset)   loss: 0.6854 -> 0.4868  accuracy: 80.00% -> 86.91%     
client [68] (testset)   loss: 0.6437 -> 0.3975  accuracy: 81.08% -> 89.01%     
client [93] (testset)   loss: 1.1057 -> 0.3636  accuracy: 68.61% -> 89.29%     
client [31] (testset)   loss: 1.0874 -> 0.3952  accuracy: 71.82% -> 89.55%     
client [20] (testset)   loss: 0.7624 -> 0.7560  accuracy: 82.99% -> 78.35%     
client [59] (testset)   loss: 0.6943 -> 0.3729  accuracy: 79.40% -> 85.43%     
client [48] (testset)   loss: 0.6474 -> 0.5160  accuracy: 82.33% -> 87.22%     
client [34] (testset)   loss: 1.0867 -> 0.7583  accuracy: 72.81% -> 78.95%     
---------------------------- TRAINING EPOCH: 20 ----------------------------   
client [69] (testset)   loss: 0.5865 -> 0.4307  accuracy: 86.67% -> 87.62%     
client [99] (testset)   loss: 0.5320 -> 0.4006  accuracy: 86.67% -> 89.02%     
client [67] (testset)   loss: 0.7927 -> 0.2589  accuracy: 77.94% -> 91.18%     
client [0]  (testset)   loss: 1.1994 -> 0.4779  accuracy: 71.28% -> 82.98%     
client [76] (testset)   loss: 0.4058 -> 0.3408  accuracy: 88.34% -> 89.26%     
client [41] (testset)   loss: 0.6519 -> 0.3165  accuracy: 81.02% -> 88.69%     
client [62] (testset)   loss: 0.8125 -> 0.4316  accuracy: 75.75% -> 86.79%     
client [2]  (testset)   loss: 0.6200 -> 0.3121  accuracy: 79.87% -> 93.29%     
client [14] (testset)   loss: 0.4975 -> 0.3656  accuracy: 88.80% -> 91.73%     
client [46] (testset)   loss: 0.6964 -> 0.4678  accuracy: 76.84% -> 85.26%     
---------------------------- TRAINING EPOCH: 30 ----------------------------   
client [24] (testset)   loss: 0.3163 -> 0.3473  accuracy: 93.33% -> 93.33%     
client [68] (testset)   loss: 0.5496 -> 0.4038  accuracy: 89.15% -> 91.10%     
client [57] (testset)   loss: 0.6754 -> 0.6323  accuracy: 85.23% -> 86.93%     
client [17] (testset)   loss: 0.3834 -> 0.4141  accuracy: 89.93% -> 90.60%     
client [54] (testset)   loss: 0.7613 -> 0.3829  accuracy: 78.80% -> 93.48%     
client [23] (testset)   loss: 0.8188 -> 0.4656  accuracy: 78.26% -> 89.57%     
client [35] (testset)   loss: 0.9590 -> 0.3951  accuracy: 75.93% -> 89.51%     
client [59] (testset)   loss: 0.5920 -> 0.3361  accuracy: 82.41% -> 91.46%     
client [31] (testset)   loss: 0.6299 -> 0.3588  accuracy: 83.86% -> 93.18%     
client [9]  (testset)   loss: 0.7080 -> 0.4663  accuracy: 80.49% -> 87.32%     
---------------------------- TRAINING EPOCH: 40 ----------------------------   
client [64] (testset)   loss: 0.5643 -> 0.5581  accuracy: 89.32% -> 88.46%     
client [33] (testset)   loss: 0.7805 -> 0.5937  accuracy: 82.50% -> 86.25%     
client [16] (testset)   loss: 0.5395 -> 0.4039  accuracy: 87.36% -> 90.17%     
client [44] (testset)   loss: 0.7126 -> 0.3893  accuracy: 83.57% -> 90.55%     
client [8]  (testset)   loss: 0.3972 -> 0.2384  accuracy: 93.33% -> 93.85%     
client [31] (testset)   loss: 0.4399 -> 0.3258  accuracy: 89.09% -> 92.50%     
client [47] (testset)   loss: 0.5250 -> 0.2954  accuracy: 87.50% -> 92.99%     
client [36] (testset)   loss: 0.5683 -> 0.4437  accuracy: 82.35% -> 90.20%     
client [20] (testset)   loss: 0.7068 -> 0.3781  accuracy: 81.44% -> 89.69%     
client [56] (testset)   loss: 0.7575 -> 0.6166  accuracy: 81.59% -> 81.59%     
---------------------------- TRAINING EPOCH: 50 ----------------------------   
client [4]  (testset)   loss: 0.7226 -> 0.4391  accuracy: 84.47% -> 89.04%     
client [60] (testset)   loss: 0.5456 -> 0.4415  accuracy: 85.65% -> 89.24%     
client [28] (testset)   loss: 0.7407 -> 0.5385  accuracy: 82.84% -> 87.31%     
client [25] (testset)   loss: 0.6148 -> 0.5291  accuracy: 84.92% -> 85.71%     
client [58] (testset)   loss: 0.5674 -> 0.4668  accuracy: 85.15% -> 88.79%     
client [44] (testset)   loss: 0.4697 -> 0.4133  accuracy: 87.47% -> 91.17%     
client [39] (testset)   loss: 0.7512 -> 0.6937  accuracy: 86.02% -> 87.63%     
client [29] (testset)   loss: 0.6095 -> 0.5316  accuracy: 88.57% -> 86.67%     
client [3]  (testset)   loss: 0.8142 -> 0.5286  accuracy: 84.97% -> 89.54%     
client [84] (testset)   loss: 0.5949 -> 0.4772  accuracy: 87.46% -> 90.09%     
---------------------------- TRAINING EPOCH: 60 ----------------------------   
client [21] (testset)   loss: 0.6698 -> 0.4164  accuracy: 83.27% -> 89.09%     
client [84] (testset)   loss: 0.6765 -> 0.5098  accuracy: 85.13% -> 92.13%     
client [10] (testset)   loss: 0.3528 -> 0.2532  accuracy: 92.75% -> 92.75%     
client [36] (testset)   loss: 0.9842 -> 0.5300  accuracy: 80.39% -> 88.24%     
client [65] (testset)   loss: 0.3612 -> 0.3367  accuracy: 89.85% -> 90.98%     
client [81] (testset)   loss: 0.5861 -> 0.5606  accuracy: 87.69% -> 89.23%     
client [79] (testset)   loss: 0.6877 -> 0.6606  accuracy: 86.21% -> 87.93%     
client [42] (testset)   loss: 0.4880 -> 0.3680  accuracy: 89.84% -> 90.79%     
client [11] (testset)   loss: 0.5292 -> 0.4722  accuracy: 89.51% -> 91.48%     
client [96] (testset)   loss: 0.6236 -> 0.4425  accuracy: 85.89% -> 88.31%     
---------------------------- TRAINING EPOCH: 70 ----------------------------   
client [8]  (testset)   loss: 0.4933 -> 0.2316  accuracy: 92.82% -> 95.38%     
client [53] (testset)   loss: 0.5267 -> 0.3764  accuracy: 88.70% -> 93.79%     
client [52] (testset)   loss: 0.8552 -> 0.4333  accuracy: 81.90% -> 89.84%     
client [42] (testset)   loss: 0.7229 -> 0.3843  accuracy: 84.13% -> 90.48%     
client [69] (testset)   loss: 0.6807 -> 0.6350  accuracy: 86.67% -> 88.57%     
client [59] (testset)   loss: 0.6804 -> 0.3537  accuracy: 90.45% -> 93.47%     
client [7]  (testset)   loss: 0.6504 -> 0.4231  accuracy: 86.00% -> 91.00%     
client [26] (testset)   loss: 0.4905 -> 0.2239  accuracy: 90.53% -> 93.68%     
client [49] (testset)   loss: 0.4453 -> 0.2675  accuracy: 89.02% -> 92.49%     
client [98] (testset)   loss: 0.4293 -> 0.3143  accuracy: 89.36% -> 91.49%     
---------------------------- TRAINING EPOCH: 80 ----------------------------   
client [98] (testset)   loss: 0.4627 -> 0.4282  accuracy: 88.94% -> 91.91%     
client [47] (testset)   loss: 0.5112 -> 0.3469  accuracy: 91.29% -> 93.18%     
client [21] (testset)   loss: 0.7731 -> 0.4218  accuracy: 82.91% -> 89.45%     
client [77] (testset)   loss: 0.6778 -> 0.5709  accuracy: 80.60% -> 87.50%     
client [95] (testset)   loss: 0.3607 -> 0.3490  accuracy: 93.47% -> 94.07%     
client [91] (testset)   loss: 0.6670 -> 0.6315  accuracy: 84.88% -> 83.72%     
client [14] (testset)   loss: 0.5430 -> 0.4971  accuracy: 91.20% -> 92.27%     
client [99] (testset)   loss: 0.3920 -> 0.3653  accuracy: 93.33% -> 94.12%     
client [20] (testset)   loss: 0.5875 -> 0.4316  accuracy: 86.60% -> 91.75%     
client [39] (testset)   loss: 0.9726 -> 0.7112  accuracy: 84.41% -> 88.71%     
---------------------------- TRAINING EPOCH: 90 ----------------------------   
client [52] (testset)   loss: 0.7935 -> 0.4418  accuracy: 84.76% -> 90.16%     
client [62] (testset)   loss: 0.7907 -> 0.5462  accuracy: 85.62% -> 90.30%     
client [71] (testset)   loss: 0.7104 -> 0.7439  accuracy: 88.62% -> 87.43%     
client [97] (testset)   loss: 0.7409 -> 0.5670  accuracy: 85.22% -> 88.26%     
client [30] (testset)   loss: 0.9154 -> 0.5170  accuracy: 87.30% -> 91.86%     
client [88] (testset)   loss: 0.6682 -> 0.4689  accuracy: 88.93% -> 93.21%     
client [60] (testset)   loss: 0.4416 -> 0.3857  accuracy: 88.79% -> 91.03%     
client [82] (testset)   loss: 0.6145 -> 0.3754  accuracy: 86.57% -> 91.79%     
client [91] (testset)   loss: 0.8488 -> 0.7575  accuracy: 84.30% -> 86.63%     
client [57] (testset)   loss: 0.7050 -> 0.7333  accuracy: 89.49% -> 89.49%     
---------------------------- TRAINING EPOCH: 100 ----------------------------  
client [31] (testset)   loss: 0.4429 -> 0.3668  accuracy: 92.05% -> 94.09%     
client [15] (testset)   loss: 0.8874 -> 0.6472  accuracy: 87.33% -> 91.64%     
client [71] (testset)   loss: 0.7328 -> 0.7486  accuracy: 86.83% -> 86.23%     
client [97] (testset)   loss: 0.6750 -> 0.5934  accuracy: 87.39% -> 90.00%     
client [53] (testset)   loss: 0.6441 -> 0.4542  accuracy: 89.83% -> 93.22%     
client [77] (testset)   loss: 0.6615 -> 0.6397  accuracy: 85.34% -> 88.36%     
client [76] (testset)   loss: 0.3901 -> 0.3073  accuracy: 92.94% -> 92.94%     
client [79] (testset)   loss: 0.6642 -> 0.6608  accuracy: 88.51% -> 89.66%     
client [28] (testset)   loss: 0.4863 -> 0.5931  accuracy: 90.30% -> 88.81%     
client [99] (testset)   loss: 0.4976 -> 0.4786  accuracy: 93.33% -> 93.73%     
---------------------------- TRAINING EPOCH: 110 ----------------------------  
client [97] (testset)   loss: 1.3142 -> 0.6345  accuracy: 76.96% -> 90.00%     
client [86] (testset)   loss: 0.5093 -> 0.5283  accuracy: 91.22% -> 90.08%     
client [34] (testset)   loss: 0.8639 -> 0.7825  accuracy: 83.33% -> 83.33%     
client [73] (testset)   loss: 0.2538 -> 0.2844  accuracy: 94.93% -> 93.92%     
client [5]  (testset)   loss: 0.6923 -> 0.6124  accuracy: 89.19% -> 89.19%     
client [96] (testset)   loss: 0.6279 -> 0.5526  accuracy: 89.92% -> 90.32%     
client [22] (testset)   loss: 0.3756 -> 0.3764  accuracy: 93.64% -> 93.18%     
client [60] (testset)   loss: 0.4471 -> 0.4324  accuracy: 91.03% -> 90.58%     
client [66] (testset)   loss: 0.5131 -> 0.4049  accuracy: 92.04% -> 94.03%     
client [83] (testset)   loss: 0.4836 -> 0.3389  accuracy: 91.50% -> 92.00%     
---------------------------- TRAINING EPOCH: 120 ----------------------------  
client [76] (testset)   loss: 0.4116 -> 0.3894  accuracy: 92.02% -> 92.94%     
client [65] (testset)   loss: 0.3901 -> 0.3516  accuracy: 91.35% -> 92.48%     
client [95] (testset)   loss: 0.4188 -> 0.4058  accuracy: 92.88% -> 94.07%     
client [17] (testset)   loss: 0.4944 -> 0.3662  accuracy: 89.93% -> 89.93%     
client [8]  (testset)   loss: 0.4686 -> 0.2670  accuracy: 93.85% -> 95.90%     
client [35] (testset)   loss: 0.6621 -> 0.4469  accuracy: 86.42% -> 92.59%     
client [98] (testset)   loss: 0.6406 -> 0.4450  accuracy: 87.66% -> 90.64%     
client [53] (testset)   loss: 0.6227 -> 0.5348  accuracy: 92.09% -> 92.09%     
client [43] (testset)   loss: 1.6186 -> 1.3072  accuracy: 85.14% -> 87.16%     
client [64] (testset)   loss: 0.7241 -> 0.4398  accuracy: 86.75% -> 91.03%     
---------------------------- TRAINING EPOCH: 130 ----------------------------  
client [21] (testset)   loss: 0.6372 -> 0.4474  accuracy: 88.36% -> 90.18%     
client [88] (testset)   loss: 0.7486 -> 0.6028  accuracy: 91.07% -> 93.21%     
client [38] (testset)   loss: 0.7572 -> 0.6974  accuracy: 89.07% -> 89.75%     
client [3]  (testset)   loss: 1.0595 -> 0.9824  accuracy: 88.24% -> 90.20%     
client [5]  (testset)   loss: 0.7475 -> 0.7419  accuracy: 89.19% -> 89.19%     
client [41] (testset)   loss: 0.4204 -> 0.3163  accuracy: 87.96% -> 90.88%     
client [7]  (testset)   loss: 1.2497 -> 0.5968  accuracy: 85.50% -> 91.00%     
client [37] (testset)   loss: 0.9187 -> 0.5840  accuracy: 85.86% -> 89.01%     
client [45] (testset)   loss: 1.2166 -> 0.9645  accuracy: 84.65% -> 87.97%     
client [47] (testset)   loss: 0.3773 -> 0.3485  accuracy: 92.42% -> 93.37%     
---------------------------- TRAINING EPOCH: 140 ----------------------------  
client [16] (testset)   loss: 0.7512 -> 0.4602  accuracy: 90.45% -> 92.42%     
client [11] (testset)   loss: 0.6276 -> 0.5274  accuracy: 90.82% -> 92.46%     
client [37] (testset)   loss: 0.8166 -> 0.6453  accuracy: 87.96% -> 90.58%     
client [41] (testset)   loss: 0.3630 -> 0.3657  accuracy: 90.88% -> 91.24%     
client [95] (testset)   loss: 0.5487 -> 0.4477  accuracy: 93.47% -> 93.77%     
client [53] (testset)   loss: 0.7493 -> 0.5996  accuracy: 90.40% -> 92.09%     
client [22] (testset)   loss: 0.6189 -> 0.4793  accuracy: 90.45% -> 93.18%     
client [25] (testset)   loss: 0.7726 -> 0.7220  accuracy: 88.10% -> 89.29%     
client [69] (testset)   loss: 0.9546 -> 0.8172  accuracy: 87.62% -> 89.52%     
client [46] (testset)   loss: 0.5862 -> 0.6046  accuracy: 89.47% -> 88.42%     
---------------------------- TRAINING EPOCH: 150 ----------------------------  
client [47] (testset)   loss: 0.3987 -> 0.3322  accuracy: 93.56% -> 94.13%     
client [69] (testset)   loss: 1.2353 -> 1.0486  accuracy: 84.76% -> 86.67%     
client [82] (testset)   loss: 0.6910 -> 0.5290  accuracy: 89.55% -> 91.04%     
client [45] (testset)   loss: 1.0956 -> 1.0342  accuracy: 86.31% -> 87.55%     
client [7]  (testset)   loss: 1.2112 -> 0.5626  accuracy: 88.00% -> 92.50%     
client [50] (testset)   loss: 1.0181 -> 0.5554  accuracy: 84.42% -> 91.56%     
client [35] (testset)   loss: 0.7287 -> 0.4744  accuracy: 91.36% -> 93.83%     
client [24] (testset)   loss: 0.4413 -> 0.4900  accuracy: 95.56% -> 93.70%     
client [15] (testset)   loss: 0.7586 -> 0.7558  accuracy: 90.57% -> 92.45%     
client [58] (testset)   loss: 0.8537 -> 0.6789  accuracy: 86.97% -> 90.61%     
---------------------------- TRAINING EPOCH: 160 ----------------------------  
client [48] (testset)   loss: 0.8500 -> 0.7390  accuracy: 89.10% -> 90.98%     
client [76] (testset)   loss: 0.4135 -> 0.3352  accuracy: 92.02% -> 93.56%     
client [67] (testset)   loss: 0.3800 -> 0.3335  accuracy: 93.63% -> 94.12%     
client [37] (testset)   loss: 1.0216 -> 0.6715  accuracy: 86.91% -> 90.05%     
client [58] (testset)   loss: 0.7784 -> 0.6696  accuracy: 88.48% -> 90.30%     
client [64] (testset)   loss: 0.4131 -> 0.4197  accuracy: 91.45% -> 91.45%     
client [77] (testset)   loss: 0.8611 -> 0.8862  accuracy: 85.78% -> 87.93%     
client [55] (testset)   loss: 0.4542 -> 0.3427  accuracy: 91.71% -> 92.68%     
client [12] (testset)   loss: 0.5942 -> 0.4919  accuracy: 92.09% -> 94.95%     
client [89] (testset)   loss: 0.5048 -> 0.3596  accuracy: 89.36% -> 92.20%     
---------------------------- TRAINING EPOCH: 170 ----------------------------  
client [84] (testset)   loss: 0.8460 -> 0.6688  accuracy: 88.34% -> 92.71%     
client [51] (testset)   loss: 0.2617 -> 0.2057  accuracy: 86.67% -> 92.00%     
client [8]  (testset)   loss: 0.4861 -> 0.3914  accuracy: 93.85% -> 94.36%     
client [18] (testset)   loss: 1.3509 -> 1.3517  accuracy: 85.15% -> 84.16%     
client [94] (testset)   loss: 0.5271 -> 0.4042  accuracy: 92.22% -> 92.51%     
client [81] (testset)   loss: 0.9749 -> 0.9087  accuracy: 85.13% -> 88.21%     
client [3]  (testset)   loss: 1.0780 -> 0.9575  accuracy: 87.58% -> 88.89%     
client [11] (testset)   loss: 0.6921 -> 0.6220  accuracy: 88.20% -> 91.15%     
client [95] (testset)   loss: 0.4352 -> 0.4174  accuracy: 94.96% -> 95.85%     
client [67] (testset)   loss: 0.3172 -> 0.2863  accuracy: 94.12% -> 93.63%     
---------------------------- TRAINING EPOCH: 180 ----------------------------  
client [21] (testset)   loss: 0.5580 -> 0.4902  accuracy: 90.91% -> 89.09%     
client [79] (testset)   loss: 0.8728 -> 0.7738  accuracy: 85.63% -> 89.08%     
client [58] (testset)   loss: 0.6091 -> 0.5815  accuracy: 91.52% -> 90.91%     
client [88] (testset)   loss: 0.7917 -> 0.7256  accuracy: 92.50% -> 92.50%     
client [46] (testset)   loss: 0.7754 -> 0.5378  accuracy: 86.84% -> 87.89%     
client [11] (testset)   loss: 0.7094 -> 0.6269  accuracy: 89.84% -> 90.49%     
client [55] (testset)   loss: 0.4334 -> 0.4061  accuracy: 93.17% -> 94.15%     
client [13] (testset)   loss: 0.5543 -> 0.5056  accuracy: 92.15% -> 92.15%     
client [31] (testset)   loss: 0.6198 -> 0.4754  accuracy: 92.05% -> 94.09%     
client [75] (testset)   loss: 1.1282 -> 1.0472  accuracy: 87.50% -> 87.50%     
---------------------------- TRAINING EPOCH: 190 ----------------------------  
client [19] (testset)   loss: 0.4450 -> 0.4373  accuracy: 92.46% -> 92.46%     
client [7]  (testset)   loss: 0.8144 -> 0.5756  accuracy: 90.50% -> 91.50%     
client [57] (testset)   loss: 0.9286 -> 0.9301  accuracy: 89.49% -> 89.49%     
client [13] (testset)   loss: 0.5497 -> 0.4873  accuracy: 92.15% -> 92.67%     
client [43] (testset)   loss: 1.6022 -> 1.5446  accuracy: 88.51% -> 89.19%     
client [91] (testset)   loss: 0.9945 -> 0.8720  accuracy: 87.21% -> 86.63%     
client [10] (testset)   loss: 0.5086 -> 0.4320  accuracy: 91.19% -> 92.75%     
client [64] (testset)   loss: 0.6514 -> 0.4791  accuracy: 91.45% -> 91.03%     
client [82] (testset)   loss: 0.6403 -> 0.6218  accuracy: 88.06% -> 87.31%     
client [22] (testset)   loss: 0.5131 -> 0.5000  accuracy: 92.73% -> 91.82%     
---------------------------- TRAINING EPOCH: 200 ----------------------------  
client [20] (testset)   loss: 0.5522 -> 0.4659  accuracy: 90.21% -> 93.81%     
client [23] (testset)   loss: 0.8091 -> 0.8945  accuracy: 90.00% -> 89.13%     
client [88] (testset)   loss: 0.9781 -> 0.7936  accuracy: 90.36% -> 91.79%     
client [98] (testset)   loss: 0.5785 -> 0.4659  accuracy: 88.09% -> 91.06%     
client [79] (testset)   loss: 0.9806 -> 0.9045  accuracy: 87.93% -> 87.93%     
client [21] (testset)   loss: 0.5856 -> 0.5208  accuracy: 89.45% -> 90.91%     
client [92] (testset)   loss: 1.2318 -> 1.2166  accuracy: 91.03% -> 91.03%     
client [56] (testset)   loss: 0.7666 -> 0.7423  accuracy: 86.07% -> 84.58%     
client [5]  (testset)   loss: 0.9084 -> 0.9117  accuracy: 91.89% -> 90.54%     
client [52] (testset)   loss: 0.7584 -> 0.6598  accuracy: 89.21% -> 90.48%     
---------------------------- TRAINING EPOCH: 210 ----------------------------  
client [67] (testset)   loss: 0.3584 -> 0.3167  accuracy: 93.14% -> 94.12%     
client [54] (testset)   loss: 0.6142 -> 0.5224  accuracy: 90.22% -> 90.76%     
client [14] (testset)   loss: 0.7578 -> 0.7571  accuracy: 92.80% -> 92.53%     
client [99] (testset)   loss: 0.4606 -> 0.5143  accuracy: 95.29% -> 94.51%     
client [36] (testset)   loss: 1.2295 -> 1.1403  accuracy: 82.35% -> 82.35%     
client [30] (testset)   loss: 0.7619 -> 0.7622  accuracy: 93.16% -> 93.81%     
client [38] (testset)   loss: 0.7651 -> 0.6928  accuracy: 90.66% -> 90.66%     
client [15] (testset)   loss: 0.9955 -> 0.8943  accuracy: 88.95% -> 90.57%     
client [6]  (testset)   loss: 1.3562 -> 1.2598  accuracy: 85.51% -> 86.45%     
client [53] (testset)   loss: 0.8922 -> 0.8275  accuracy: 90.40% -> 92.66%     
---------------------------- TRAINING EPOCH: 220 ----------------------------  
client [99] (testset)   loss: 0.6337 -> 0.6483  accuracy: 94.12% -> 94.90%     
client [6]  (testset)   loss: 1.3425 -> 1.3370  accuracy: 87.85% -> 86.92%     
client [83] (testset)   loss: 0.3319 -> 0.3005  accuracy: 95.50% -> 94.50%     
client [42] (testset)   loss: 0.5960 -> 0.5346  accuracy: 92.06% -> 92.70%     
client [34] (testset)   loss: 1.3010 -> 1.2608  accuracy: 83.33% -> 85.09%     
client [15] (testset)   loss: 1.0254 -> 0.9092  accuracy: 89.76% -> 90.57%     
client [47] (testset)   loss: 0.5235 -> 0.4723  accuracy: 92.42% -> 93.56%     
client [55] (testset)   loss: 0.4603 -> 0.4483  accuracy: 93.17% -> 93.66%     
client [51] (testset)   loss: 0.2527 -> 0.1530  accuracy: 94.67% -> 94.67%     
client [95] (testset)   loss: 0.4986 -> 0.4957  accuracy: 94.07% -> 94.66%     
---------------------------- TRAINING EPOCH: 230 ----------------------------  
client [71] (testset)   loss: 0.9824 -> 1.1075  accuracy: 88.02% -> 87.43%     
client [15] (testset)   loss: 1.1036 -> 0.9513  accuracy: 90.57% -> 91.11%     
client [33] (testset)   loss: 0.9082 -> 1.3430  accuracy: 85.00% -> 83.75%     
client [99] (testset)   loss: 0.6462 -> 0.6773  accuracy: 94.90% -> 94.12%     
client [90] (testset)   loss: 1.1854 -> 1.0708  accuracy: 88.96% -> 88.36%     
client [57] (testset)   loss: 1.0043 -> 0.9457  accuracy: 89.77% -> 90.34%     
client [27] (testset)   loss: 0.3801 -> 0.4287  accuracy: 93.10% -> 94.09%     
client [78] (testset)   loss: 0.6952 -> 0.7471  accuracy: 92.61% -> 92.33%     
client [36] (testset)   loss: 1.0147 -> 0.9859  accuracy: 86.27% -> 86.27%     
client [88] (testset)   loss: 1.0543 -> 0.9995  accuracy: 92.14% -> 92.14%     
---------------------------- TRAINING EPOCH: 240 ----------------------------  
client [70] (testset)   loss: 0.3299 -> 0.3334  accuracy: 95.10% -> 95.59%     
client [35] (testset)   loss: 0.6895 -> 0.5933  accuracy: 91.36% -> 93.83%     
client [16] (testset)   loss: 0.6372 -> 0.5506  accuracy: 91.29% -> 93.26%     
client [80] (testset)   loss: 0.9024 -> 0.9804  accuracy: 90.72% -> 89.69%     
client [38] (testset)   loss: 0.8770 -> 0.8650  accuracy: 90.21% -> 90.43%     
client [78] (testset)   loss: 0.7272 -> 0.7166  accuracy: 92.61% -> 92.90%     
client [68] (testset)   loss: 0.7725 -> 0.7577  accuracy: 93.05% -> 92.35%     
client [11] (testset)   loss: 1.0935 -> 0.8136  accuracy: 87.21% -> 89.84%     
client [64] (testset)   loss: 0.4906 -> 0.4296  accuracy: 91.88% -> 92.31%     
client [82] (testset)   loss: 0.5295 -> 0.4658  accuracy: 91.04% -> 91.04%     
---------------------------- TRAINING EPOCH: 250 ----------------------------  
client [30] (testset)   loss: 0.9517 -> 0.9072  accuracy: 93.49% -> 92.18%     
client [27] (testset)   loss: 0.4037 -> 0.3592  accuracy: 93.10% -> 94.09%     
client [74] (testset)   loss: 1.1158 -> 1.0840  accuracy: 93.17% -> 91.97%     
client [45] (testset)   loss: 1.2291 -> 1.1804  accuracy: 88.38% -> 89.63%     
client [6]  (testset)   loss: 1.6554 -> 1.5755  accuracy: 86.45% -> 85.98%     
client [36] (testset)   loss: 1.0723 -> 0.9356  accuracy: 86.27% -> 86.27%     
client [63] (testset)   loss: 0.9162 -> 0.9086  accuracy: 90.84% -> 91.24%     
client [76] (testset)   loss: 0.5372 -> 0.4364  accuracy: 93.25% -> 92.64%     
client [83] (testset)   loss: 0.3907 -> 0.3650  accuracy: 94.50% -> 95.00%     
client [86] (testset)   loss: 0.5232 -> 0.5520  accuracy: 93.13% -> 91.60%     
---------------------------- TRAINING EPOCH: 260 ----------------------------  
client [83] (testset)   loss: 0.3867 -> 0.3411  accuracy: 94.00% -> 93.50%     
client [99] (testset)   loss: 0.6879 -> 0.6729  accuracy: 93.73% -> 94.12%     
client [74] (testset)   loss: 1.0740 -> 1.0696  accuracy: 91.57% -> 91.97%     
client [73] (testset)   loss: 0.3566 -> 0.4120  accuracy: 93.92% -> 94.26%     
client [29] (testset)   loss: 1.0070 -> 0.8431  accuracy: 85.71% -> 90.48%     
client [92] (testset)   loss: 1.0510 -> 1.0976  accuracy: 91.03% -> 91.03%     
client [6]  (testset)   loss: 1.4286 -> 1.3915  accuracy: 87.85% -> 87.85%     
client [61] (testset)   loss: 0.8972 -> 0.8430  accuracy: 90.27% -> 89.82%     
client [21] (testset)   loss: 0.6324 -> 0.5976  accuracy: 89.09% -> 90.18%     
client [67] (testset)   loss: 0.3952 -> 0.4122  accuracy: 96.08% -> 94.61%     
---------------------------- TRAINING EPOCH: 270 ----------------------------  
client [83] (testset)   loss: 0.4119 -> 0.3440  accuracy: 94.00% -> 93.50%     
client [32] (testset)   loss: 0.5685 -> 0.5538  accuracy: 91.18% -> 91.18%     
client [95] (testset)   loss: 0.6330 -> 0.6062  accuracy: 94.36% -> 94.96%     
client [61] (testset)   loss: 0.9333 -> 0.8717  accuracy: 87.61% -> 88.50%     
client [27] (testset)   loss: 0.4565 -> 0.4959  accuracy: 92.12% -> 91.63%     
client [25] (testset)   loss: 1.3074 -> 1.1380  accuracy: 86.90% -> 89.68%     
client [68] (testset)   loss: 0.8579 -> 0.8183  accuracy: 92.07% -> 93.05%     
client [34] (testset)   loss: 1.4525 -> 1.3668  accuracy: 85.09% -> 85.96%     
client [71] (testset)   loss: 1.1702 -> 1.1497  accuracy: 87.43% -> 88.02%     
client [89] (testset)   loss: 0.6415 -> 0.5913  accuracy: 90.07% -> 92.20%     
---------------------------- TRAINING EPOCH: 280 ----------------------------  
client [78] (testset)   loss: 0.8590 -> 0.8487  accuracy: 93.18% -> 93.75%     
client [81] (testset)   loss: 1.0214 -> 0.9946  accuracy: 89.74% -> 89.74%     
client [51] (testset)   loss: 0.4110 -> 0.4087  accuracy: 90.67% -> 90.67%     
client [54] (testset)   loss: 0.7410 -> 0.6594  accuracy: 90.76% -> 91.30%     
client [65] (testset)   loss: 0.6881 -> 0.5412  accuracy: 91.35% -> 92.86%     
client [41] (testset)   loss: 0.5472 -> 0.4967  accuracy: 93.43% -> 93.07%     
client [11] (testset)   loss: 0.8439 -> 0.7597  accuracy: 91.15% -> 92.46%     
client [85] (testset)   loss: 0.9101 -> 0.6035  accuracy: 87.14% -> 92.53%     
client [12] (testset)   loss: 0.6240 -> 0.5839  accuracy: 94.29% -> 94.73%     
client [23] (testset)   loss: 1.0409 -> 0.9302  accuracy: 90.43% -> 89.13%     
---------------------------- TRAINING EPOCH: 290 ----------------------------  
client [16] (testset)   loss: 0.7901 -> 0.6927  accuracy: 90.73% -> 91.85%     
client [65] (testset)   loss: 0.6238 -> 0.5962  accuracy: 90.98% -> 91.35%     
client [53] (testset)   loss: 0.9525 -> 0.8688  accuracy: 92.66% -> 92.66%     
client [58] (testset)   loss: 1.0454 -> 0.8630  accuracy: 88.79% -> 90.00%     
client [72] (testset)   loss: 0.8475 -> 0.8317  accuracy: 90.67% -> 90.67%     
client [7]  (testset)   loss: 0.9506 -> 0.9057  accuracy: 91.00% -> 91.50%     
client [71] (testset)   loss: 1.0853 -> 1.0918  accuracy: 88.62% -> 90.42%     
client [59] (testset)   loss: 0.9115 -> 0.8974  accuracy: 92.46% -> 92.46%     
client [86] (testset)   loss: 0.6026 -> 0.6402  accuracy: 92.37% -> 91.98%     
client [39] (testset)   loss: 1.1597 -> 1.2244  accuracy: 87.10% -> 88.17%     
---------------------------- TRAINING EPOCH: 300 ----------------------------  
client [99] (testset)   loss: 0.8126 -> 0.7975  accuracy: 92.94% -> 93.73%     
client [7]  (testset)   loss: 1.1429 -> 0.7753  accuracy: 92.00% -> 92.00%     
client [17] (testset)   loss: 0.7175 -> 0.7085  accuracy: 91.95% -> 91.28%     
client [64] (testset)   loss: 0.6676 -> 0.5361  accuracy: 90.17% -> 91.45%     
client [37] (testset)   loss: 1.1087 -> 1.0691  accuracy: 90.58% -> 90.05%     
client [29] (testset)   loss: 1.3222 -> 1.1378  accuracy: 88.57% -> 90.48%     
client [93] (testset)   loss: 0.8733 -> 0.8969  accuracy: 93.19% -> 93.19%     
client [73] (testset)   loss: 0.3909 -> 0.3814  accuracy: 94.26% -> 94.59%     
client [40] (testset)   loss: 0.9579 -> 0.9054  accuracy: 90.35% -> 90.88%     
client [76] (testset)   loss: 0.5055 -> 0.4849  accuracy: 94.17% -> 93.87%     
---------------------------- TRAINING EPOCH: 310 ----------------------------  
client [31] (testset)   loss: 0.6920 -> 0.6625  accuracy: 93.86% -> 93.64%     
client [89] (testset)   loss: 0.6264 -> 0.5693  accuracy: 90.78% -> 91.49%     
client [77] (testset)   loss: 1.1685 -> 1.0539  accuracy: 87.93% -> 90.95%     
client [90] (testset)   loss: 1.3742 -> 1.3163  accuracy: 87.76% -> 87.16%     
client [26] (testset)   loss: 0.4397 -> 0.3805  accuracy: 94.74% -> 94.39%     
client [50] (testset)   loss: 0.6370 -> 0.5933  accuracy: 90.26% -> 92.86%     
client [30] (testset)   loss: 1.0535 -> 0.9828  accuracy: 91.86% -> 91.53%     
client [70] (testset)   loss: 0.4388 -> 0.4473  accuracy: 95.10% -> 96.08%     
client [41] (testset)   loss: 0.5587 -> 0.4997  accuracy: 92.34% -> 93.07%     
client [99] (testset)   loss: 0.7175 -> 0.7266  accuracy: 94.90% -> 94.51%     
---------------------------- TRAINING EPOCH: 320 ----------------------------  
client [68] (testset)   loss: 0.8108 -> 0.8083  accuracy: 93.18% -> 92.91%     
client [70] (testset)   loss: 0.4052 -> 0.4089  accuracy: 96.08% -> 96.08%     
client [52] (testset)   loss: 0.7659 -> 0.7331  accuracy: 91.75% -> 92.06%     
client [1]  (testset)   loss: 1.1247 -> 1.1338  accuracy: 92.36% -> 91.67%     
client [2]  (testset)   loss: 0.6296 -> 0.6138  accuracy: 92.95% -> 92.95%     
client [67] (testset)   loss: 0.3996 -> 0.3947  accuracy: 95.10% -> 95.10%     
client [92] (testset)   loss: 1.2308 -> 1.2341  accuracy: 91.72% -> 91.72%     
client [35] (testset)   loss: 0.9662 -> 0.8994  accuracy: 91.36% -> 91.36%     
client [36] (testset)   loss: 1.2982 -> 1.2943  accuracy: 86.27% -> 86.27%     
client [64] (testset)   loss: 0.5677 -> 0.5691  accuracy: 91.88% -> 91.03%     
---------------------------- TRAINING EPOCH: 330 ----------------------------  
client [44] (testset)   loss: 0.7380 -> 0.7038  accuracy: 92.20% -> 91.99%     
client [6]  (testset)   loss: 1.8213 -> 1.7345  accuracy: 86.92% -> 87.38%     
client [12] (testset)   loss: 0.6259 -> 0.6363  accuracy: 94.29% -> 93.63%     
client [55] (testset)   loss: 0.5766 -> 0.4155  accuracy: 91.71% -> 94.15%     
client [29] (testset)   loss: 1.2039 -> 1.2094  accuracy: 90.48% -> 90.48%     
client [9]  (testset)   loss: 1.5835 -> 1.4596  accuracy: 87.32% -> 87.80%     
client [43] (testset)   loss: 2.4648 -> 2.3193  accuracy: 86.49% -> 85.14%     
client [77] (testset)   loss: 1.3725 -> 1.2049  accuracy: 87.07% -> 87.93%     
client [98] (testset)   loss: 0.6876 -> 0.6504  accuracy: 90.64% -> 91.91%     
client [78] (testset)   loss: 0.8794 -> 0.8708  accuracy: 94.03% -> 93.18%     
---------------------------- TRAINING EPOCH: 340 ----------------------------  
client [92] (testset)   loss: 1.3105 -> 1.3394  accuracy: 91.03% -> 90.34%     
client [80] (testset)   loss: 0.9994 -> 1.0253  accuracy: 91.75% -> 92.27%     
client [63] (testset)   loss: 1.1723 -> 1.2237  accuracy: 90.84% -> 90.84%     
client [76] (testset)   loss: 0.6623 -> 0.6291  accuracy: 93.87% -> 93.56%     
client [78] (testset)   loss: 0.8094 -> 0.8397  accuracy: 94.32% -> 94.03%     
client [25] (testset)   loss: 1.1414 -> 1.1168  accuracy: 90.08% -> 90.48%     
client [58] (testset)   loss: 0.9593 -> 0.7946  accuracy: 89.39% -> 91.21%     
client [13] (testset)   loss: 0.6935 -> 0.6669  accuracy: 92.15% -> 92.15%     
client [17] (testset)   loss: 0.9183 -> 0.8571  accuracy: 91.95% -> 91.95%     
client [38] (testset)   loss: 1.0664 -> 1.0580  accuracy: 89.29% -> 89.98%     
---------------------------- TRAINING EPOCH: 350 ----------------------------  
client [72] (testset)   loss: 0.9115 -> 0.8656  accuracy: 91.79% -> 90.67%     
client [82] (testset)   loss: 0.6223 -> 0.6199  accuracy: 91.04% -> 91.04%     
client [86] (testset)   loss: 0.6926 -> 0.6977  accuracy: 92.75% -> 92.75%     
client [51] (testset)   loss: 0.3334 -> 0.3218  accuracy: 92.00% -> 92.00%     
client [96] (testset)   loss: 0.7685 -> 0.7025  accuracy: 90.73% -> 92.34%     
client [42] (testset)   loss: 0.8304 -> 0.5535  accuracy: 92.06% -> 92.38%     
client [55] (testset)   loss: 0.5461 -> 0.4176  accuracy: 92.68% -> 92.20%     
client [13] (testset)   loss: 0.7139 -> 0.6503  accuracy: 93.19% -> 92.15%     
client [1]  (testset)   loss: 1.2180 -> 1.3099  accuracy: 92.36% -> 90.97%     
client [12] (testset)   loss: 0.7904 -> 0.7554  accuracy: 93.63% -> 92.97%     
---------------------------- TRAINING EPOCH: 360 ----------------------------  
client [68] (testset)   loss: 0.8125 -> 0.8504  accuracy: 92.35% -> 92.77%     
client [23] (testset)   loss: 0.9506 -> 0.9612  accuracy: 90.87% -> 90.00%     
client [46] (testset)   loss: 0.8227 -> 0.7313  accuracy: 88.42% -> 88.42%     
client [41] (testset)   loss: 0.4334 -> 0.4718  accuracy: 91.97% -> 90.51%     
client [25] (testset)   loss: 0.9504 -> 0.9941  accuracy: 90.08% -> 90.48%     
client [58] (testset)   loss: 0.9275 -> 0.8829  accuracy: 91.21% -> 91.82%     
client [14] (testset)   loss: 1.1139 -> 1.0594  accuracy: 93.60% -> 93.33%     
client [33] (testset)   loss: 1.3440 -> 1.3349  accuracy: 82.50% -> 82.50%     
client [85] (testset)   loss: 0.5755 -> 0.6372  accuracy: 91.70% -> 90.87%     
client [62] (testset)   loss: 1.0995 -> 1.0457  accuracy: 89.80% -> 89.97%     
---------------------------- TRAINING EPOCH: 370 ----------------------------  
client [98] (testset)   loss: 0.7760 -> 0.7714  accuracy: 90.21% -> 90.21%     
client [63] (testset)   loss: 1.1035 -> 1.1201  accuracy: 91.63% -> 92.43%     
client [70] (testset)   loss: 0.3966 -> 0.3720  accuracy: 95.59% -> 95.59%     
client [65] (testset)   loss: 0.6668 -> 0.6538  accuracy: 92.11% -> 92.11%     
client [14] (testset)   loss: 1.0930 -> 1.0845  accuracy: 93.07% -> 93.07%     
client [73] (testset)   loss: 0.4963 -> 0.5046  accuracy: 94.26% -> 93.92%     
client [34] (testset)   loss: 1.4298 -> 1.5279  accuracy: 86.84% -> 84.21%     
client [99] (testset)   loss: 0.8169 -> 0.8298  accuracy: 93.33% -> 94.12%     
client [69] (testset)   loss: 1.8990 -> 2.0781  accuracy: 84.76% -> 84.76%     
client [46] (testset)   loss: 0.9435 -> 0.7260  accuracy: 86.32% -> 91.58%     
---------------------------- TRAINING EPOCH: 380 ----------------------------  
client [99] (testset)   loss: 0.8355 -> 0.8358  accuracy: 94.12% -> 94.12%     
client [93] (testset)   loss: 0.8980 -> 0.9365  accuracy: 92.21% -> 92.94%     
client [11] (testset)   loss: 0.8925 -> 0.8713  accuracy: 93.11% -> 92.13%     
client [58] (testset)   loss: 0.9485 -> 0.8126  accuracy: 89.70% -> 90.91%     
client [81] (testset)   loss: 1.1866 -> 1.1837  accuracy: 90.77% -> 90.77%     
client [85] (testset)   loss: 0.5765 -> 0.6657  accuracy: 91.29% -> 91.29%     
client [89] (testset)   loss: 0.8464 -> 0.6541  accuracy: 89.36% -> 90.78%     
client [45] (testset)   loss: 1.3615 -> 1.3324  accuracy: 89.21% -> 88.80%     
client [8]  (testset)   loss: 0.7614 -> 0.6716  accuracy: 93.85% -> 93.33%     
client [68] (testset)   loss: 0.9492 -> 0.9792  accuracy: 92.77% -> 92.91%     
---------------------------- TRAINING EPOCH: 390 ----------------------------  
client [67] (testset)   loss: 0.4631 -> 0.4441  accuracy: 94.12% -> 95.10%     
client [72] (testset)   loss: 1.0114 -> 0.9271  accuracy: 91.04% -> 91.42%     
client [1]  (testset)   loss: 1.3917 -> 1.3572  accuracy: 90.28% -> 90.28%     
client [78] (testset)   loss: 0.8858 -> 0.8762  accuracy: 93.18% -> 93.18%     
client [83] (testset)   loss: 0.4760 -> 0.4716  accuracy: 95.00% -> 95.00%     
client [21] (testset)   loss: 0.7497 -> 0.7284  accuracy: 90.18% -> 90.18%     
client [56] (testset)   loss: 1.2640 -> 1.2162  accuracy: 85.07% -> 86.07%     
client [44] (testset)   loss: 0.7437 -> 0.7200  accuracy: 91.58% -> 92.40%     
client [92] (testset)   loss: 1.3482 -> 1.5411  accuracy: 93.10% -> 91.72%     
client [27] (testset)   loss: 0.5625 -> 0.5889  accuracy: 92.61% -> 91.63%     
---------------------------- TRAINING EPOCH: 400 ----------------------------  
client [10] (testset)   loss: 0.7946 -> 0.7917  accuracy: 92.75% -> 92.75%     
client [39] (testset)   loss: 1.2695 -> 1.1759  accuracy: 87.63% -> 89.25%     
client [65] (testset)   loss: 0.6727 -> 0.6571  accuracy: 92.86% -> 92.86%     
client [26] (testset)   loss: 0.4471 -> 0.4418  accuracy: 93.33% -> 93.68%     
client [19] (testset)   loss: 0.6149 -> 0.6036  accuracy: 92.46% -> 92.46%     
client [68] (testset)   loss: 0.8765 -> 0.8756  accuracy: 93.32% -> 93.18%     
client [41] (testset)   loss: 0.4677 -> 0.4561  accuracy: 93.80% -> 93.43%     
client [50] (testset)   loss: 0.6862 -> 0.6794  accuracy: 89.61% -> 88.96%     
client [75] (testset)   loss: 1.6973 -> 1.6860  accuracy: 87.92% -> 87.50%     
client [81] (testset)   loss: 1.2433 -> 1.2405  accuracy: 90.77% -> 90.77%     
Training... ---------------------------------------- 100% 0:22:14
PSFL's average time taken by each global epoch: 0 min 3.31 sec.                
PSFL's total running time: 0 h 22 m 14 s.                                      
==================== PSFL Experiment Results: ====================             
Display format: (before local fine-tuning) -> (after local fine-tuning)        
 So if finetune_epoch = 0, x.xx% -> 0.00% is normal.                           
 Centralized testing ONLY happens after model aggregation, so the stats between
'->' are the same.                                                             
{                                                                              
    "100": {                                                                   
        "all_clients": {                                                       
            "test": {                                                          
                "loss": "0.6896 -> 0.0000",                                    
                "accuracy": "88.49% -> 0.00%"                                  
            }                                                                  
        }                                                                      
    },                                                                         
    "200": {                                                                   
        "all_clients": {                                                       
            "test": {                                                          
                "loss": "0.7873 -> 0.0000",                                    
                "accuracy": "90.42% -> 0.00%"                                  
            }                                                                  
        }                                                                      
    },                                                                         
    "300": {                                                                   
        "all_clients": {                                                       
            "test": {                                                          
                "loss": "0.8598 -> 0.0000",                                    
                "accuracy": "91.15% -> 0.00%"                                  
            }                                                                  
        }                                                                      
    },                                                                         
    "400": {                                                                   
        "all_clients": {                                                       
            "test": {                                                          
                "loss": "0.9501 -> 0.0000",                                    
                "accuracy": "91.81% -> 0.00%"                                  
            }                                                                  
        }                                                                      
    }                                                                          
}                                                                              
==================== PSFL Max Accuracy ====================                    
all_clients:                                                                   
(test) before fine-tuning: 91.81% at epoch 400                                 
(test) after fine-tuning: 0.00% at epoch 100                                   
[0m