==================== PSFL ====================                                 
Experiment Arguments:                                                          
{
│   'method': 'psfl',
│   'dataset': {
│   │   'name': 'fmnist',
│   │   'client_num': 100,
│   │   'test_ratio': 0.25,
│   │   'val_ratio': 0.0,
│   │   'seed': 42,
│   │   'split': 'sample',
│   │   'IID_ratio': 0.0,
│   │   'monitor_window_name_suffix': 'fmnist-100clients-0%IID-Dir(0.5)-seed42',
│   │   'alpha': 0.5,
│   │   'min_samples_per_client': 10
│   },
│   'model': {
│   │   'name': 'avgcnn',
│   │   'use_torchvision_pretrained_weights': True,
│   │   'external_model_weights_path': None
│   },
│   'optimizer': {
│   │   'lr': 0.01,
│   │   'dampening': 0,
│   │   'weight_decay': 0,
│   │   'momentum': 0,
│   │   'nesterov': False,
│   │   'name': 'sgd'
│   },
│   'mode': 'sequential',
│   'parallel': {
│   │   'ray_cluster_addr': None,
│   │   'num_cpus': None,
│   │   'num_gpus': None,
│   │   'num_workers': 2
│   },
│   'common': {
│   │   'seed': 42,
│   │   'join_ratio': 0.1,
│   │   'global_epoch': 400,
│   │   'local_epoch': 5,
│   │   'batch_size': 32,
│   │   'reset_optimizer_on_global_epoch': True,
│   │   'straggler_ratio': 0,
│   │   'straggler_min_local_epoch': 0,
│   │   'buffers': 'global',
│   │   'client_side_evaluation': True,
│   │   'test': {
│   │   │   'client': {
│   │   │   │   'interval': 100,
│   │   │   │   'finetune_epoch': 0,
│   │   │   │   'train': False,
│   │   │   │   'val': False,
│   │   │   │   'test': True
│   │   │   },
│   │   │   'server': {
│   │   │   │   'interval': -1,
│   │   │   │   'train': False,
│   │   │   │   'val': False,
│   │   │   │   'test': False,
│   │   │   │   'model_in_train_mode': False
│   │   │   }
│   │   },
│   │   'verbose_gap': 10,
│   │   'monitor': None,
│   │   'use_cuda': True,
│   │   'save_log': True,
│   │   'save_model': False,
│   │   'save_learning_curve_plot': False,
│   │   'save_metrics': True,
│   │   'delete_useless_run': True
│   },
│   'psfl': {
│   │   'alpha': 0.0,
│   │   'CLS': False,
│   │   'ig_ratio': 0.999,
│   │   'track': False
│   }
}
---------------------------- TRAINING EPOCH: 10 ----------------------------   
client [77] (testset)   loss: 0.4461 -> 0.3188  accuracy: 84.57% -> 89.14%     
client [81] (testset)   loss: 0.3694 -> 0.2016  accuracy: 88.14% -> 91.53%     
client [21] (testset)   loss: 1.1164 -> 0.3678  accuracy: 54.09% -> 87.42%     
client [68] (testset)   loss: 0.7066 -> 0.4107  accuracy: 70.50% -> 85.40%     
client [93] (testset)   loss: 0.7545 -> 0.8717  accuracy: 71.33% -> 64.34%     
client [31] (testset)   loss: 0.5840 -> 0.3579  accuracy: 77.85% -> 87.25%     
client [20] (testset)   loss: 0.3890 -> 0.1966  accuracy: 83.27% -> 93.47%     
client [59] (testset)   loss: 0.7581 -> 0.3508  accuracy: 74.07% -> 88.89%     
client [48] (testset)   loss: 1.1447 -> 0.6067  accuracy: 65.04% -> 72.36%     
client [34] (testset)   loss: 0.3435 -> 0.3383  accuracy: 90.16% -> 86.89%     
---------------------------- TRAINING EPOCH: 20 ----------------------------   
client [69] (testset)   loss: 0.3418 -> 0.3285  accuracy: 84.35% -> 87.07%     
client [99] (testset)   loss: 0.1449 -> 0.1637  accuracy: 94.23% -> 95.19%     
client [67] (testset)   loss: 0.5149 -> 0.2530  accuracy: 81.82% -> 91.34%     
client [0]  (testset)   loss: 0.3871 -> 0.4027  accuracy: 87.14% -> 85.06%     
client [76] (testset)   loss: 0.6953 -> 0.5025  accuracy: 71.76% -> 79.01%     
client [41] (testset)   loss: 0.3645 -> 0.1091  accuracy: 88.29% -> 95.61%     
client [62] (testset)   loss: 0.5781 -> 0.2270  accuracy: 77.10% -> 93.13%     
client [2]  (testset)   loss: 0.5259 -> 0.2855  accuracy: 80.39% -> 92.81%     
client [14] (testset)   loss: 0.3949 -> 0.2692  accuracy: 85.48% -> 88.80%     
client [46] (testset)   loss: 0.4199 -> 0.3451  accuracy: 83.33% -> 87.58%     
---------------------------- TRAINING EPOCH: 30 ----------------------------   
client [24] (testset)   loss: 0.2882 -> 0.2834  accuracy: 89.64% -> 90.09%     
client [68] (testset)   loss: 0.3583 -> 0.3395  accuracy: 87.27% -> 87.27%     
client [57] (testset)   loss: 0.3172 -> 0.1636  accuracy: 90.51% -> 93.90%     
client [17] (testset)   loss: 0.3759 -> 0.2720  accuracy: 88.36% -> 91.78%     
client [54] (testset)   loss: 0.5499 -> 0.4216  accuracy: 78.87% -> 80.41%     
client [23] (testset)   loss: 0.6483 -> 0.4156  accuracy: 75.71% -> 84.29%     
client [35] (testset)   loss: 0.2499 -> 0.1772  accuracy: 91.61% -> 94.84%     
client [59] (testset)   loss: 0.1919 -> 0.1910  accuracy: 95.37% -> 95.37%     
client [31] (testset)   loss: 0.4840 -> 0.2891  accuracy: 83.89% -> 89.26%     
client [9]  (testset)   loss: 0.1404 -> 0.1125  accuracy: 96.26% -> 96.79%     
---------------------------- TRAINING EPOCH: 40 ----------------------------   
client [64] (testset)   loss: 0.3071 -> 0.1378  accuracy: 89.96% -> 94.14%     
client [33] (testset)   loss: 0.3789 -> 0.3695  accuracy: 86.78% -> 87.19%     
client [16] (testset)   loss: 0.3354 -> 0.3424  accuracy: 88.72% -> 88.72%     
client [44] (testset)   loss: 0.7182 -> 0.4048  accuracy: 75.35% -> 86.15%     
client [8]  (testset)   loss: 0.1948 -> 0.1429  accuracy: 92.16% -> 95.10%     
client [31] (testset)   loss: 0.2388 -> 0.2427  accuracy: 89.93% -> 91.28%     
client [47] (testset)   loss: 0.5801 -> 0.1789  accuracy: 78.24% -> 93.98%     
client [36] (testset)   loss: 0.2484 -> 0.1356  accuracy: 89.40% -> 95.39%     
client [20] (testset)   loss: 0.3363 -> 0.1751  accuracy: 89.39% -> 93.47%     
client [56] (testset)   loss: 0.5550 -> 0.3923  accuracy: 79.59% -> 85.71%     
---------------------------- TRAINING EPOCH: 50 ----------------------------   
client [4]  (testset)   loss: 0.6237 -> 0.4582  accuracy: 75.00% -> 81.45%     
client [60] (testset)   loss: 0.1602 -> 0.1243  accuracy: 94.67% -> 96.00%     
client [28] (testset)   loss: 0.4967 -> 0.3169  accuracy: 83.41% -> 90.13%     
client [25] (testset)   loss: 0.4034 -> 0.2864  accuracy: 85.88% -> 91.22%     
client [58] (testset)   loss: 0.3808 -> 0.3389  accuracy: 83.98% -> 85.64%     
client [44] (testset)   loss: 0.3976 -> 0.3697  accuracy: 84.76% -> 87.26%     
client [39] (testset)   loss: 0.2304 -> 0.3007  accuracy: 91.79% -> 87.31%     
client [29] (testset)   loss: 0.4778 -> 0.3820  accuracy: 82.78% -> 86.11%     
client [3]  (testset)   loss: 0.2300 -> 0.2050  accuracy: 92.31% -> 92.31%     
client [84] (testset)   loss: 0.2378 -> 0.2478  accuracy: 91.75% -> 93.30%     
---------------------------- TRAINING EPOCH: 60 ----------------------------   
client [21] (testset)   loss: 0.5092 -> 0.3063  accuracy: 79.25% -> 87.42%     
client [84] (testset)   loss: 0.3469 -> 0.2709  accuracy: 89.18% -> 93.30%     
client [10] (testset)   loss: 0.2599 -> 0.4073  accuracy: 92.09% -> 91.37%     
client [36] (testset)   loss: 0.2604 -> 0.1083  accuracy: 89.40% -> 96.77%     
client [65] (testset)   loss: 0.3606 -> 0.1866  accuracy: 83.09% -> 92.65%     
client [81] (testset)   loss: 0.1275 -> 0.0618  accuracy: 94.92% -> 96.61%     
client [79] (testset)   loss: 0.3180 -> 0.2914  accuracy: 85.71% -> 85.71%     
client [42] (testset)   loss: 0.5308 -> 0.2502  accuracy: 81.94% -> 92.51%     
client [11] (testset)   loss: 0.1879 -> 0.1306  accuracy: 94.64% -> 96.43%     
client [96] (testset)   loss: 0.3152 -> 0.3054  accuracy: 88.21% -> 88.65%     
---------------------------- TRAINING EPOCH: 70 ----------------------------   
client [8]  (testset)   loss: 0.5944 -> 0.1790  accuracy: 84.31% -> 93.14%     
client [53] (testset)   loss: 0.3002 -> 0.2089  accuracy: 88.97% -> 92.65%     
client [52] (testset)   loss: 0.1494 -> 0.1184  accuracy: 94.00% -> 96.00%     
client [42] (testset)   loss: 0.2970 -> 0.2386  accuracy: 90.31% -> 92.07%     
client [69] (testset)   loss: 0.3580 -> 0.2985  accuracy: 88.44% -> 89.80%     
client [59] (testset)   loss: 0.1799 -> 0.1446  accuracy: 92.59% -> 97.22%     
client [7]  (testset)   loss: 0.1983 -> 0.1849  accuracy: 93.83% -> 95.88%     
client [26] (testset)   loss: 0.1806 -> 0.0786  accuracy: 94.81% -> 98.70%     
client [49] (testset)   loss: 0.4169 -> 0.3255  accuracy: 83.45% -> 88.28%     
client [98] (testset)   loss: 0.1198 -> 0.1024  accuracy: 95.19% -> 95.88%     
---------------------------- TRAINING EPOCH: 80 ----------------------------   
client [98] (testset)   loss: 0.1465 -> 0.1189  accuracy: 95.88% -> 95.88%     
client [47] (testset)   loss: 0.2640 -> 0.1858  accuracy: 90.28% -> 93.98%     
client [21] (testset)   loss: 0.3799 -> 0.3011  accuracy: 86.79% -> 89.94%     
client [77] (testset)   loss: 0.2669 -> 0.3297  accuracy: 92.00% -> 86.29%     
client [95] (testset)   loss: 0.4502 -> 0.3684  accuracy: 88.57% -> 93.33%     
client [91] (testset)   loss: 0.1555 -> 0.1568  accuracy: 94.30% -> 94.30%     
client [14] (testset)   loss: 0.2380 -> 0.1778  accuracy: 90.46% -> 94.19%     
client [99] (testset)   loss: 0.1304 -> 0.1210  accuracy: 94.23% -> 95.19%     
client [20] (testset)   loss: 0.2076 -> 0.1654  accuracy: 93.88% -> 95.51%     
client [39] (testset)   loss: 0.2348 -> 0.2984  accuracy: 91.79% -> 91.04%     
---------------------------- TRAINING EPOCH: 90 ----------------------------   
client [52] (testset)   loss: 0.1967 -> 0.1492  accuracy: 94.00% -> 93.33%     
client [62] (testset)   loss: 0.0774 -> 0.0896  accuracy: 97.71% -> 96.95%     
client [71] (testset)   loss: 0.3773 -> 0.3124  accuracy: 90.62% -> 87.50%     
client [97] (testset)   loss: 0.1778 -> 0.1279  accuracy: 95.61% -> 93.86%     
client [30] (testset)   loss: 0.3704 -> 0.3208  accuracy: 86.81% -> 86.81%     
client [88] (testset)   loss: 0.2918 -> 0.2566  accuracy: 92.62% -> 92.62%     
client [60] (testset)   loss: 0.1289 -> 0.1130  accuracy: 95.33% -> 95.33%     
client [82] (testset)   loss: 0.3179 -> 0.6601  accuracy: 88.14% -> 78.81%     
client [91] (testset)   loss: 0.4690 -> 0.1758  accuracy: 83.54% -> 94.94%     
client [57] (testset)   loss: 0.1371 -> 0.1424  accuracy: 95.93% -> 96.27%     
---------------------------- TRAINING EPOCH: 100 ----------------------------  
client [31] (testset)   loss: 0.2211 -> 1.4180  accuracy: 91.95% -> 71.14%     
client [15] (testset)   loss: 0.3865 -> 0.1107  accuracy: 91.67% -> 95.45%     
client [71] (testset)   loss: 0.3912 -> 0.4747  accuracy: 90.62% -> 87.50%     
client [97] (testset)   loss: 0.1852 -> 0.1206  accuracy: 92.11% -> 94.74%     
client [53] (testset)   loss: 0.2273 -> 0.2123  accuracy: 93.38% -> 91.18%     
client [77] (testset)   loss: 0.2716 -> 0.2186  accuracy: 92.00% -> 92.57%     
client [76] (testset)   loss: 0.3150 -> 0.2274  accuracy: 90.08% -> 92.37%     
client [79] (testset)   loss: 0.5701 -> 0.4332  accuracy: 81.17% -> 83.12%     
client [28] (testset)   loss: 0.4404 -> 0.3063  accuracy: 82.96% -> 90.58%     
client [99] (testset)   loss: 0.1950 -> 0.1152  accuracy: 94.23% -> 94.23%     
---------------------------- TRAINING EPOCH: 110 ----------------------------  
client [97] (testset)   loss: 0.1577 -> 0.1117  accuracy: 92.98% -> 96.49%     
client [86] (testset)   loss: 0.4839 -> 0.4549  accuracy: 83.41% -> 84.72%     
client [34] (testset)   loss: 0.2265 -> 0.2463  accuracy: 93.99% -> 92.35%     
client [73] (testset)   loss: 0.2930 -> 0.2334  accuracy: 91.40% -> 93.21%     
client [5]  (testset)   loss: 0.1981 -> 0.2029  accuracy: 94.24% -> 93.90%     
client [96] (testset)   loss: 0.4329 -> 0.3213  accuracy: 88.21% -> 92.14%     
client [22] (testset)   loss: 0.2444 -> 0.2734  accuracy: 92.68% -> 92.68%     
client [60] (testset)   loss: 0.1133 -> 0.1181  accuracy: 95.33% -> 97.33%     
client [66] (testset)   loss: 0.2348 -> 0.1011  accuracy: 92.04% -> 95.58%     
client [83] (testset)   loss: 0.2607 -> 0.2786  accuracy: 94.12% -> 92.94%     
---------------------------- TRAINING EPOCH: 120 ----------------------------  
client [76] (testset)   loss: 0.3038 -> 0.2758  accuracy: 89.69% -> 90.46%     
client [65] (testset)   loss: 0.2604 -> 0.1765  accuracy: 89.71% -> 91.18%     
client [95] (testset)   loss: 0.3514 -> 0.3464  accuracy: 93.33% -> 94.29%     
client [17] (testset)   loss: 0.2814 -> 0.2302  accuracy: 91.78% -> 91.78%     
client [8]  (testset)   loss: 0.2400 -> 0.1404  accuracy: 92.16% -> 96.08%     
client [35] (testset)   loss: 0.1158 -> 0.1151  accuracy: 96.13% -> 96.13%     
client [98] (testset)   loss: 0.1222 -> 0.1270  accuracy: 95.19% -> 96.56%     
client [53] (testset)   loss: 0.1897 -> 0.2160  accuracy: 91.91% -> 91.91%     
client [43] (testset)   loss: 0.4648 -> 0.2445  accuracy: 86.70% -> 93.12%     
client [64] (testset)   loss: 0.1582 -> 0.1169  accuracy: 94.14% -> 95.82%     
---------------------------- TRAINING EPOCH: 130 ----------------------------  
client [21] (testset)   loss: 0.4258 -> 0.3393  accuracy: 84.91% -> 88.68%     
client [88] (testset)   loss: 0.2700 -> 0.2959  accuracy: 91.95% -> 92.62%     
client [38] (testset)   loss: 0.1890 -> 0.1666  accuracy: 94.93% -> 95.27%     
client [3]  (testset)   loss: 0.1710 -> 0.1611  accuracy: 95.51% -> 92.95%     
client [5]  (testset)   loss: 0.2468 -> 0.2088  accuracy: 91.86% -> 94.58%     
client [41] (testset)   loss: 0.1364 -> 0.1387  accuracy: 96.10% -> 97.56%     
client [7]  (testset)   loss: 0.3740 -> 0.2275  accuracy: 88.48% -> 94.24%     
client [37] (testset)   loss: 0.3093 -> 0.2382  accuracy: 93.49% -> 92.31%     
client [45] (testset)   loss: 0.1443 -> 0.1607  accuracy: 94.44% -> 95.56%     
client [47] (testset)   loss: 0.5007 -> 0.2281  accuracy: 82.87% -> 93.98%     
---------------------------- TRAINING EPOCH: 140 ----------------------------  
client [16] (testset)   loss: 0.3020 -> 0.2640  accuracy: 90.98% -> 93.23%     
client [11] (testset)   loss: 0.1315 -> 0.1154  accuracy: 98.21% -> 97.62%     
client [37] (testset)   loss: 0.2699 -> 0.2604  accuracy: 92.31% -> 92.31%     
client [41] (testset)   loss: 0.1390 -> 0.1176  accuracy: 96.59% -> 98.05%     
client [95] (testset)   loss: 0.5573 -> 0.4486  accuracy: 87.62% -> 94.29%     
client [53] (testset)   loss: 0.2201 -> 0.2274  accuracy: 92.65% -> 93.38%     
client [22] (testset)   loss: 0.1949 -> 0.2598  accuracy: 92.68% -> 92.68%     
client [25] (testset)   loss: 0.2875 -> 0.3207  accuracy: 92.75% -> 91.98%     
client [69] (testset)   loss: 0.2875 -> 0.3226  accuracy: 89.80% -> 89.12%     
client [46] (testset)   loss: 0.3101 -> 0.3299  accuracy: 91.18% -> 90.85%     
---------------------------- TRAINING EPOCH: 150 ----------------------------  
client [47] (testset)   loss: 0.2786 -> 0.2156  accuracy: 93.06% -> 95.37%     
client [69] (testset)   loss: 0.3286 -> 0.3631  accuracy: 90.48% -> 91.84%     
client [82] (testset)   loss: 0.2177 -> 0.2154  accuracy: 92.37% -> 92.80%     
client [45] (testset)   loss: 0.1886 -> 0.2363  accuracy: 94.44% -> 93.89%     
client [7]  (testset)   loss: 0.2329 -> 0.2158  accuracy: 95.06% -> 96.30%     
client [50] (testset)   loss: 0.1923 -> 0.1719  accuracy: 96.03% -> 96.69%     
client [35] (testset)   loss: 0.1677 -> 0.1167  accuracy: 95.48% -> 96.77%     
client [24] (testset)   loss: 0.3317 -> 0.1627  accuracy: 89.19% -> 95.05%     
client [15] (testset)   loss: 0.1746 -> 0.1664  accuracy: 95.45% -> 95.45%     
client [58] (testset)   loss: 0.4765 -> 0.3959  accuracy: 82.32% -> 86.19%     
---------------------------- TRAINING EPOCH: 160 ----------------------------  
client [48] (testset)   loss: 0.6762 -> 0.6472  accuracy: 86.18% -> 86.99%     
client [76] (testset)   loss: 0.4383 -> 0.3322  accuracy: 87.79% -> 90.84%     
client [67] (testset)   loss: 0.1553 -> 0.1436  accuracy: 94.81% -> 95.24%     
client [37] (testset)   loss: 0.3571 -> 0.2874  accuracy: 90.53% -> 92.90%     
client [58] (testset)   loss: 0.7358 -> 0.3330  accuracy: 80.11% -> 86.74%     
client [64] (testset)   loss: 0.2253 -> 0.1179  accuracy: 91.21% -> 94.98%     
client [77] (testset)   loss: 0.3676 -> 0.2504  accuracy: 88.00% -> 92.57%     
client [55] (testset)   loss: 0.2434 -> 0.1768  accuracy: 91.37% -> 92.89%     
client [12] (testset)   loss: 0.3157 -> 0.3406  accuracy: 90.51% -> 91.14%     
client [89] (testset)   loss: 0.2353 -> 0.1526  accuracy: 94.96% -> 97.12%     
---------------------------- TRAINING EPOCH: 170 ----------------------------  
client [84] (testset)   loss: 0.3595 -> 0.3542  accuracy: 92.78% -> 92.27%     
client [51] (testset)   loss: 0.1027 -> 0.1281  accuracy: 96.96% -> 96.20%     
client [8]  (testset)   loss: 0.2857 -> 0.1774  accuracy: 94.12% -> 95.10%     
client [18] (testset)   loss: 0.2269 -> 0.1685  accuracy: 96.18% -> 96.95%     
client [94] (testset)   loss: 0.1633 -> 0.1695  accuracy: 94.41% -> 93.17%     
client [81] (testset)   loss: 0.0642 -> 0.0827  accuracy: 98.31% -> 98.31%     
client [3]  (testset)   loss: 0.1936 -> 0.1350  accuracy: 94.23% -> 95.51%     
client [11] (testset)   loss: 0.1410 -> 0.1205  accuracy: 96.43% -> 97.62%     
client [95] (testset)   loss: 0.4655 -> 0.4233  accuracy: 92.38% -> 95.24%     
client [67] (testset)   loss: 0.2206 -> 0.1458  accuracy: 92.21% -> 94.81%     
---------------------------- TRAINING EPOCH: 180 ----------------------------  
client [21] (testset)   loss: 0.4906 -> 0.3793  accuracy: 83.02% -> 89.94%     
client [79] (testset)   loss: 0.3809 -> 0.4122  accuracy: 88.31% -> 85.71%     
client [58] (testset)   loss: 0.4324 -> 0.4093  accuracy: 85.64% -> 85.64%     
client [88] (testset)   loss: 0.3356 -> 0.3512  accuracy: 91.28% -> 92.62%     
client [46] (testset)   loss: 0.3113 -> 0.2870  accuracy: 91.83% -> 89.54%     
client [11] (testset)   loss: 0.1125 -> 0.1021  accuracy: 97.62% -> 98.21%     
client [55] (testset)   loss: 0.3624 -> 0.2248  accuracy: 93.40% -> 93.40%     
client [13] (testset)   loss: 0.2140 -> 0.2129  accuracy: 95.54% -> 94.64%     
client [31] (testset)   loss: 0.1724 -> 0.6531  accuracy: 93.29% -> 87.92%     
client [75] (testset)   loss: 0.1568 -> 0.0825  accuracy: 97.12% -> 98.56%     
---------------------------- TRAINING EPOCH: 190 ----------------------------  
client [19] (testset)   loss: 0.2209 -> 0.2428  accuracy: 94.44% -> 93.33%     
client [7]  (testset)   loss: 0.4377 -> 0.2435  accuracy: 90.12% -> 95.88%     
client [57] (testset)   loss: 0.1889 -> 0.1546  accuracy: 95.59% -> 96.61%     
client [13] (testset)   loss: 0.1965 -> 0.4954  accuracy: 95.54% -> 93.30%     
client [43] (testset)   loss: 0.3080 -> 0.2830  accuracy: 90.37% -> 91.74%     
client [91] (testset)   loss: 0.1877 -> 0.1487  accuracy: 94.30% -> 96.20%     
client [10] (testset)   loss: 0.2161 -> 0.1429  accuracy: 95.68% -> 94.96%     
client [64] (testset)   loss: 0.2068 -> 0.1190  accuracy: 93.31% -> 96.23%     
client [82] (testset)   loss: 0.2815 -> 0.2195  accuracy: 91.95% -> 94.07%     
client [22] (testset)   loss: 0.4112 -> 0.3868  accuracy: 89.43% -> 91.87%     
---------------------------- TRAINING EPOCH: 200 ----------------------------  
client [20] (testset)   loss: 0.2194 -> 0.2200  accuracy: 95.51% -> 93.88%     
client [23] (testset)   loss: 0.4419 -> 0.5150  accuracy: 84.29% -> 87.14%     
client [88] (testset)   loss: 0.3100 -> 0.3519  accuracy: 91.95% -> 91.28%     
client [98] (testset)   loss: 0.1634 -> 0.1526  accuracy: 96.91% -> 96.91%     
client [79] (testset)   loss: 0.3887 -> 0.4649  accuracy: 88.96% -> 85.71%     
client [21] (testset)   loss: 0.4569 -> 0.4299  accuracy: 88.68% -> 88.05%     
client [92] (testset)   loss: 0.0254 -> 0.0236  accuracy: 99.07% -> 99.54%     
client [56] (testset)   loss: 0.5371 -> 0.4981  accuracy: 86.22% -> 87.76%     
client [5]  (testset)   loss: 0.2997 -> 0.2801  accuracy: 93.56% -> 94.58%     
client [52] (testset)   loss: 0.1295 -> 0.0926  accuracy: 96.00% -> 98.00%     
---------------------------- TRAINING EPOCH: 210 ----------------------------  
client [67] (testset)   loss: 0.3213 -> 0.1734  accuracy: 90.04% -> 95.24%     
client [54] (testset)   loss: 0.5007 -> 0.4669  accuracy: 86.60% -> 88.66%     
client [14] (testset)   loss: 0.4328 -> 0.1636  accuracy: 88.80% -> 93.78%     
client [99] (testset)   loss: 0.0799 -> 0.0797  accuracy: 98.08% -> 98.08%     
client [36] (testset)   loss: 0.1324 -> 0.1283  accuracy: 96.77% -> 97.24%     
client [30] (testset)   loss: 0.6841 -> 0.4153  accuracy: 83.52% -> 87.91%     
client [38] (testset)   loss: 0.1583 -> 0.1579  accuracy: 96.28% -> 95.95%     
client [15] (testset)   loss: 0.1715 -> 0.1794  accuracy: 96.21% -> 95.45%     
client [6]  (testset)   loss: 0.2317 -> 0.2085  accuracy: 93.16% -> 95.30%     
client [53] (testset)   loss: 0.2681 -> 0.2513  accuracy: 94.12% -> 94.12%     
---------------------------- TRAINING EPOCH: 220 ----------------------------  
client [99] (testset)   loss: 0.1151 -> 0.0628  accuracy: 96.15% -> 98.08%     
client [6]  (testset)   loss: 0.3022 -> 0.2364  accuracy: 94.02% -> 94.87%     
client [83] (testset)   loss: 0.3032 -> 0.3396  accuracy: 92.94% -> 92.94%     
client [42] (testset)   loss: 0.3415 -> 0.3106  accuracy: 89.43% -> 91.63%     
client [34] (testset)   loss: 0.3388 -> 0.3021  accuracy: 91.80% -> 92.90%     
client [15] (testset)   loss: 0.1866 -> 0.1971  accuracy: 95.45% -> 95.45%     
client [47] (testset)   loss: 0.2759 -> 0.3073  accuracy: 91.67% -> 95.37%     
client [55] (testset)   loss: 0.2419 -> 0.2199  accuracy: 93.91% -> 94.42%     
client [51] (testset)   loss: 0.1243 -> 0.1097  accuracy: 96.96% -> 97.72%     
client [95] (testset)   loss: 0.5075 -> 0.5041  accuracy: 95.24% -> 95.24%     
---------------------------- TRAINING EPOCH: 230 ----------------------------  
client [71] (testset)   loss: 0.5284 -> 0.4956  accuracy: 90.62% -> 90.62%     
client [15] (testset)   loss: 0.1829 -> 0.2099  accuracy: 95.45% -> 94.70%     
client [33] (testset)   loss: 0.4838 -> 0.3993  accuracy: 86.78% -> 91.74%     
client [99] (testset)   loss: 0.1166 -> 0.0548  accuracy: 96.15% -> 97.12%     
client [90] (testset)   loss: 0.1731 -> 0.1958  accuracy: 94.97% -> 94.97%     
client [57] (testset)   loss: 0.2425 -> 0.1804  accuracy: 95.25% -> 96.95%     
client [27] (testset)   loss: 0.0009 -> 0.0001  accuracy: 100.00% -> 100.00%   
client [78] (testset)   loss: 0.0711 -> 0.0902  accuracy: 98.41% -> 98.41%     
client [36] (testset)   loss: 0.0952 -> 0.1135  accuracy: 97.70% -> 97.70%     
client [88] (testset)   loss: 0.4789 -> 0.4296  accuracy: 91.28% -> 92.62%     
---------------------------- TRAINING EPOCH: 240 ----------------------------  
client [70] (testset)   loss: 0.3065 -> 0.2235  accuracy: 95.35% -> 96.51%     
client [35] (testset)   loss: 0.1332 -> 0.1084  accuracy: 96.77% -> 97.42%     
client [16] (testset)   loss: 0.3744 -> 0.3522  accuracy: 91.73% -> 93.98%     
client [80] (testset)   loss: 0.2778 -> 0.3449  accuracy: 95.28% -> 95.28%     
client [38] (testset)   loss: 0.2131 -> 0.1820  accuracy: 94.59% -> 95.61%     
client [78] (testset)   loss: 0.0798 -> 0.0866  accuracy: 99.21% -> 98.41%     
client [68] (testset)   loss: 0.4185 -> 0.5195  accuracy: 89.44% -> 86.96%     
client [11] (testset)   loss: 0.1561 -> 0.1127  accuracy: 97.62% -> 97.62%     
client [64] (testset)   loss: 0.2175 -> 0.1457  accuracy: 93.31% -> 95.40%     
client [82] (testset)   loss: 0.2127 -> 0.2082  accuracy: 94.92% -> 95.76%     
---------------------------- TRAINING EPOCH: 250 ----------------------------  
client [30] (testset)   loss: 0.4077 -> 0.4726  accuracy: 86.81% -> 87.91%     
client [27] (testset)   loss: 0.0000 -> 0.0000  accuracy: 100.00% -> 100.00%   
client [74] (testset)   loss: 0.2508 -> 0.2232  accuracy: 93.43% -> 94.33%     
client [45] (testset)   loss: 0.1703 -> 0.1271  accuracy: 96.11% -> 97.22%     
client [6]  (testset)   loss: 0.4167 -> 0.2894  accuracy: 91.45% -> 94.87%     
client [36] (testset)   loss: 0.1377 -> 0.1386  accuracy: 97.70% -> 97.24%     
client [63] (testset)   loss: 0.1219 -> 0.0742  accuracy: 98.48% -> 96.97%     
client [76] (testset)   loss: 0.4330 -> 0.4477  accuracy: 91.60% -> 91.60%     
client [83] (testset)   loss: 0.2640 -> 0.3014  accuracy: 94.12% -> 94.12%     
client [86] (testset)   loss: 0.5550 -> 0.5017  accuracy: 86.46% -> 88.65%     
---------------------------- TRAINING EPOCH: 260 ----------------------------  
client [83] (testset)   loss: 0.4036 -> 0.3216  accuracy: 92.94% -> 94.12%     
client [99] (testset)   loss: 0.1004 -> 0.0734  accuracy: 96.15% -> 97.12%     
client [74] (testset)   loss: 0.3238 -> 0.2524  accuracy: 91.04% -> 94.33%     
client [73] (testset)   loss: 0.3275 -> 0.3208  accuracy: 94.57% -> 94.12%     
client [29] (testset)   loss: 0.3950 -> 0.3534  accuracy: 90.56% -> 89.44%     
client [92] (testset)   loss: 0.0324 -> 0.0277  accuracy: 99.07% -> 99.54%     
client [6]  (testset)   loss: 0.3004 -> 0.2397  accuracy: 92.31% -> 94.44%     
client [61] (testset)   loss: 0.3131 -> 0.3234  accuracy: 92.86% -> 93.57%     
client [21] (testset)   loss: 0.6657 -> 0.4791  accuracy: 84.28% -> 88.68%     
client [67] (testset)   loss: 0.2109 -> 0.1853  accuracy: 94.81% -> 95.24%     
---------------------------- TRAINING EPOCH: 270 ----------------------------  
client [83] (testset)   loss: 0.4217 -> 0.3329  accuracy: 91.76% -> 95.29%     
client [32] (testset)   loss: 0.2191 -> 0.2207  accuracy: 93.69% -> 94.59%     
client [95] (testset)   loss: 0.5988 -> 0.5814  accuracy: 94.29% -> 95.24%     
client [61] (testset)   loss: 0.3890 -> 0.3565  accuracy: 92.14% -> 92.14%     
client [27] (testset)   loss: 0.0000 -> 0.0000  accuracy: 100.00% -> 100.00%   
client [25] (testset)   loss: 0.5049 -> 0.4741  accuracy: 91.22% -> 92.37%     
client [68] (testset)   loss: 0.5668 -> 0.5572  accuracy: 88.51% -> 86.34%     
client [34] (testset)   loss: 0.3486 -> 0.3634  accuracy: 93.44% -> 92.90%     
client [71] (testset)   loss: 0.6213 -> 0.4640  accuracy: 90.62% -> 93.75%     
client [89] (testset)   loss: 0.1926 -> 0.2080  accuracy: 96.40% -> 97.12%     
---------------------------- TRAINING EPOCH: 280 ----------------------------  
client [78] (testset)   loss: 0.0792 -> 0.0734  accuracy: 99.21% -> 99.21%     
client [81] (testset)   loss: 0.1646 -> 0.1461  accuracy: 96.61% -> 98.31%     
client [51] (testset)   loss: 0.1108 -> 0.1319  accuracy: 98.10% -> 97.34%     
client [54] (testset)   loss: 0.4807 -> 0.5286  accuracy: 87.63% -> 89.69%     
client [65] (testset)   loss: 0.2068 -> 0.2046  accuracy: 95.59% -> 94.85%     
client [41] (testset)   loss: 0.2502 -> 0.2261  accuracy: 95.61% -> 96.10%     
client [11] (testset)   loss: 0.1028 -> 0.1112  accuracy: 98.21% -> 99.40%     
client [85] (testset)   loss: 0.2419 -> 0.1902  accuracy: 95.65% -> 96.20%     
client [12] (testset)   loss: 0.3616 -> 0.3561  accuracy: 91.14% -> 93.67%     
client [23] (testset)   loss: 0.6802 -> 0.7049  accuracy: 82.86% -> 88.57%     
---------------------------- TRAINING EPOCH: 290 ----------------------------  
client [16] (testset)   loss: 0.3841 -> 0.3696  accuracy: 93.23% -> 93.98%     
client [65] (testset)   loss: 0.2414 -> 0.2074  accuracy: 93.38% -> 93.38%     
client [53] (testset)   loss: 0.3339 -> 0.3395  accuracy: 91.91% -> 94.12%     
client [58] (testset)   loss: 0.5416 -> 0.4966  accuracy: 85.64% -> 86.19%     
client [72] (testset)   loss: 0.8776 -> 0.8579  accuracy: 89.47% -> 89.47%     
client [7]  (testset)   loss: 0.2843 -> 0.3111  accuracy: 95.88% -> 95.88%     
client [71] (testset)   loss: 0.7047 -> 0.7655  accuracy: 90.62% -> 87.50%     
client [59] (testset)   loss: 0.2418 -> 0.2363  accuracy: 94.44% -> 94.44%     
client [86] (testset)   loss: 0.5961 -> 0.5759  accuracy: 88.65% -> 89.52%     
client [39] (testset)   loss: 0.3646 -> 0.4040  accuracy: 93.28% -> 91.79%     
---------------------------- TRAINING EPOCH: 300 ----------------------------  
client [99] (testset)   loss: 0.0921 -> 0.0935  accuracy: 97.12% -> 97.12%     
client [7]  (testset)   loss: 0.2913 -> 0.3249  accuracy: 96.71% -> 96.30%     
client [17] (testset)   loss: 0.4135 -> 0.3877  accuracy: 89.73% -> 91.78%     
client [64] (testset)   loss: 0.2591 -> 0.1727  accuracy: 94.56% -> 94.56%     
client [37] (testset)   loss: 0.4938 -> 0.4602  accuracy: 92.90% -> 92.90%     
client [29] (testset)   loss: 0.3396 -> 0.3602  accuracy: 90.00% -> 90.00%     
client [93] (testset)   loss: 0.7343 -> 0.6791  accuracy: 85.66% -> 86.01%     
client [73] (testset)   loss: 0.3160 -> 0.3229  accuracy: 93.67% -> 94.57%     
client [40] (testset)   loss: 0.3279 -> 0.3035  accuracy: 92.06% -> 93.65%     
client [76] (testset)   loss: 0.4853 -> 0.4373  accuracy: 91.98% -> 91.98%     
---------------------------- TRAINING EPOCH: 310 ----------------------------  
client [31] (testset)   loss: 0.2038 -> 0.2148  accuracy: 91.95% -> 92.62%     
client [89] (testset)   loss: 0.2422 -> 0.2376  accuracy: 95.68% -> 96.40%     
client [77] (testset)   loss: 0.4489 -> 0.4193  accuracy: 90.86% -> 90.86%     
client [90] (testset)   loss: 0.2465 -> 0.2629  accuracy: 94.97% -> 93.85%     
client [26] (testset)   loss: 0.1445 -> 0.1137  accuracy: 97.40% -> 97.40%     
client [50] (testset)   loss: 0.2241 -> 0.2083  accuracy: 96.69% -> 96.69%     
client [30] (testset)   loss: 0.6981 -> 0.5713  accuracy: 89.01% -> 89.01%     
client [70] (testset)   loss: 0.2567 -> 0.2057  accuracy: 93.02% -> 96.51%     
client [41] (testset)   loss: 0.1975 -> 0.1968  accuracy: 97.07% -> 96.59%     
client [99] (testset)   loss: 0.1459 -> 0.0819  accuracy: 96.15% -> 98.08%     
---------------------------- TRAINING EPOCH: 320 ----------------------------  
client [68] (testset)   loss: 0.5990 -> 0.6120  accuracy: 88.51% -> 88.82%     
client [70] (testset)   loss: 0.3280 -> 0.2918  accuracy: 94.19% -> 95.35%     
client [52] (testset)   loss: 0.1407 -> 0.1303  accuracy: 95.33% -> 96.00%     
client [1]  (testset)   loss: 0.2772 -> 0.2542  accuracy: 91.91% -> 93.38%     
client [2]  (testset)   loss: 0.5168 -> 0.4820  accuracy: 91.50% -> 92.16%     
client [67] (testset)   loss: 0.2320 -> 0.2179  accuracy: 95.24% -> 95.24%     
client [92] (testset)   loss: 0.0504 -> 0.0385  accuracy: 98.61% -> 98.61%     
client [35] (testset)   loss: 0.1666 -> 0.1524  accuracy: 96.13% -> 97.42%     
client [36] (testset)   loss: 0.1606 -> 0.1571  accuracy: 97.24% -> 97.70%     
client [64] (testset)   loss: 0.1732 -> 0.1650  accuracy: 94.98% -> 94.56%     
---------------------------- TRAINING EPOCH: 330 ----------------------------  
client [44] (testset)   loss: 0.7824 -> 0.6995  accuracy: 86.98% -> 87.81%     
client [6]  (testset)   loss: 0.3629 -> 0.3330  accuracy: 92.74% -> 93.59%     
client [12] (testset)   loss: 0.3608 -> 0.3506  accuracy: 93.67% -> 94.94%     
client [55] (testset)   loss: 0.3913 -> 0.3066  accuracy: 92.89% -> 93.91%     
client [29] (testset)   loss: 0.4442 -> 0.3973  accuracy: 90.00% -> 88.89%     
client [9]  (testset)   loss: 0.1401 -> 0.1451  accuracy: 96.79% -> 97.33%     
client [43] (testset)   loss: 0.3935 -> 0.3736  accuracy: 90.83% -> 91.74%     
client [77] (testset)   loss: 0.5109 -> 0.4214  accuracy: 90.86% -> 92.00%     
client [98] (testset)   loss: 0.1473 -> 0.1706  accuracy: 97.94% -> 97.59%     
client [78] (testset)   loss: 0.0711 -> 0.0797  accuracy: 99.21% -> 99.21%     
---------------------------- TRAINING EPOCH: 340 ----------------------------  
client [92] (testset)   loss: 0.0457 -> 0.0494  accuracy: 99.07% -> 99.07%     
client [80] (testset)   loss: 0.3807 -> 0.4280  accuracy: 95.28% -> 95.28%     
client [63] (testset)   loss: 0.1387 -> 0.1277  accuracy: 98.48% -> 96.97%     
client [76] (testset)   loss: 0.5604 -> 0.4616  accuracy: 91.60% -> 92.37%     
client [78] (testset)   loss: 0.0925 -> 0.0838  accuracy: 99.21% -> 99.21%     
client [25] (testset)   loss: 0.4503 -> 0.5249  accuracy: 91.98% -> 91.22%     
client [58] (testset)   loss: 0.5029 -> 0.5595  accuracy: 85.64% -> 85.08%     
client [13] (testset)   loss: 0.3242 -> 0.2911  accuracy: 94.64% -> 94.64%     
client [17] (testset)   loss: 0.4519 -> 0.4132  accuracy: 93.15% -> 91.78%     
client [38] (testset)   loss: 0.2254 -> 0.2046  accuracy: 95.27% -> 95.61%     
---------------------------- TRAINING EPOCH: 350 ----------------------------  
client [72] (testset)   loss: 0.8189 -> 0.8037  accuracy: 86.84% -> 89.47%     
client [82] (testset)   loss: 0.2847 -> 0.2786  accuracy: 94.49% -> 94.49%     
client [86] (testset)   loss: 0.6661 -> 0.6348  accuracy: 88.65% -> 88.21%     
client [51] (testset)   loss: 0.1268 -> 0.1333  accuracy: 98.10% -> 98.10%     
client [96] (testset)   loss: 0.5134 -> 0.4177  accuracy: 91.27% -> 92.58%     
client [42] (testset)   loss: 0.2957 -> 0.3410  accuracy: 92.51% -> 92.51%     
client [55] (testset)   loss: 0.3771 -> 0.3102  accuracy: 92.89% -> 94.42%     
client [13] (testset)   loss: 0.3530 -> 0.3340  accuracy: 95.09% -> 94.64%     
client [1]  (testset)   loss: 0.2758 -> 0.2399  accuracy: 94.12% -> 94.12%     
client [12] (testset)   loss: 0.3502 -> 0.3568  accuracy: 92.41% -> 93.67%     
---------------------------- TRAINING EPOCH: 360 ----------------------------  
client [68] (testset)   loss: 0.6457 -> 0.6553  accuracy: 88.51% -> 88.51%     
client [23] (testset)   loss: 0.8668 -> 0.7968  accuracy: 87.14% -> 87.14%     
client [46] (testset)   loss: 0.3841 -> 0.3943  accuracy: 91.50% -> 92.48%     
client [41] (testset)   loss: 0.2734 -> 0.2394  accuracy: 95.61% -> 97.07%     
client [25] (testset)   loss: 0.5085 -> 0.4972  accuracy: 91.60% -> 91.22%     
client [58] (testset)   loss: 0.6189 -> 0.5986  accuracy: 86.74% -> 86.74%     
client [14] (testset)   loss: 0.3206 -> 0.2310  accuracy: 92.53% -> 94.19%     
client [33] (testset)   loss: 0.5892 -> 0.5434  accuracy: 90.08% -> 90.91%     
client [85] (testset)   loss: 0.1917 -> 0.2134  accuracy: 95.65% -> 96.20%     
client [62] (testset)   loss: 0.0589 -> 0.0652  accuracy: 96.18% -> 96.18%     
---------------------------- TRAINING EPOCH: 370 ----------------------------  
client [98] (testset)   loss: 0.1750 -> 0.1771  accuracy: 97.25% -> 97.25%     
client [63] (testset)   loss: 0.1715 -> 0.1183  accuracy: 96.97% -> 96.97%     
client [70] (testset)   loss: 0.3116 -> 0.2862  accuracy: 94.19% -> 96.51%     
client [65] (testset)   loss: 0.2395 -> 0.1815  accuracy: 92.65% -> 94.85%     
client [14] (testset)   loss: 0.2491 -> 0.2226  accuracy: 92.12% -> 92.95%     
client [73] (testset)   loss: 0.3451 -> 0.3615  accuracy: 92.76% -> 94.12%     
client [34] (testset)   loss: 0.3950 -> 0.4037  accuracy: 93.44% -> 92.35%     
client [99] (testset)   loss: 0.0767 -> 0.0578  accuracy: 97.12% -> 98.08%     
client [69] (testset)   loss: 0.5211 -> 0.4910  accuracy: 91.16% -> 91.84%     
client [46] (testset)   loss: 0.3636 -> 0.4302  accuracy: 91.50% -> 91.83%     
---------------------------- TRAINING EPOCH: 380 ----------------------------  
client [99] (testset)   loss: 0.1115 -> 0.0778  accuracy: 97.12% -> 98.08%     
client [93] (testset)   loss: 0.8246 -> 0.7907  accuracy: 84.97% -> 84.97%     
client [11] (testset)   loss: 0.1334 -> 0.1265  accuracy: 97.62% -> 98.81%     
client [58] (testset)   loss: 0.6120 -> 0.5827  accuracy: 86.19% -> 86.19%     
client [81] (testset)   loss: 0.1568 -> 0.1616  accuracy: 98.31% -> 98.31%     
client [85] (testset)   loss: 0.2100 -> 0.2181  accuracy: 95.65% -> 95.65%     
client [89] (testset)   loss: 0.2102 -> 0.2028  accuracy: 97.12% -> 97.12%     
client [45] (testset)   loss: 0.2028 -> 0.1732  accuracy: 95.00% -> 96.67%     
client [8]  (testset)   loss: 0.2888 -> 0.2401  accuracy: 96.08% -> 96.08%     
client [68] (testset)   loss: 0.7137 -> 0.6759  accuracy: 87.58% -> 87.89%     
---------------------------- TRAINING EPOCH: 390 ----------------------------  
client [67] (testset)   loss: 0.2683 -> 0.2340  accuracy: 95.67% -> 95.67%     
client [72] (testset)   loss: 0.8297 -> 0.8708  accuracy: 89.47% -> 89.47%     
client [1]  (testset)   loss: 0.2836 -> 0.2797  accuracy: 93.38% -> 94.12%     
client [78] (testset)   loss: 0.0956 -> 0.1083  accuracy: 98.41% -> 99.21%     
client [83] (testset)   loss: 0.3852 -> 0.3196  accuracy: 96.47% -> 96.47%     
client [21] (testset)   loss: 0.5904 -> 0.5842  accuracy: 88.68% -> 89.31%     
client [56] (testset)   loss: 0.7542 -> 0.7645  accuracy: 87.24% -> 87.24%     
client [44] (testset)   loss: 0.7924 -> 0.7747  accuracy: 88.09% -> 88.09%     
client [92] (testset)   loss: 0.0491 -> 0.0404  accuracy: 98.61% -> 98.61%     
client [27] (testset)   loss: 0.0000 -> 0.0000  accuracy: 100.00% -> 100.00%   
---------------------------- TRAINING EPOCH: 400 ----------------------------  
client [10] (testset)   loss: 0.2556 -> 0.2806  accuracy: 95.68% -> 95.68%     
client [39] (testset)   loss: 0.4012 -> 0.4476  accuracy: 94.03% -> 92.54%     
client [65] (testset)   loss: 0.2234 -> 0.1903  accuracy: 94.85% -> 96.32%     
client [26] (testset)   loss: 0.1729 -> 0.1480  accuracy: 97.40% -> 97.40%     
client [19] (testset)   loss: 0.4070 -> 0.3752  accuracy: 94.44% -> 93.33%     
client [68] (testset)   loss: 0.6606 -> 0.6612  accuracy: 88.20% -> 89.44%     
client [41] (testset)   loss: 0.2394 -> 0.2159  accuracy: 94.63% -> 98.05%     
client [50] (testset)   loss: 0.2039 -> 0.2183  accuracy: 96.69% -> 96.03%     
client [75] (testset)   loss: 0.0958 -> 0.0929  accuracy: 98.56% -> 98.56%     
client [81] (testset)   loss: 0.1994 -> 0.1934  accuracy: 96.61% -> 96.61%     
Training... ---------------------------------------- 100% 0:14:32
PSFL's average time taken by each global epoch: 0 min 2.16 sec.                
PSFL's total running time: 0 h 14 m 32 s.                                      
==================== PSFL Experiment Results: ====================             
Display format: (before local fine-tuning) -> (after local fine-tuning)        
 So if finetune_epoch = 0, x.xx% -> 0.00% is normal.                           
 Centralized testing ONLY happens after model aggregation, so the stats between
'->' are the same.                                                             
{                                                                              
    "100": {                                                                   
        "all_clients": {                                                       
            "test": {                                                          
                "loss": "0.2472 -> 0.0000",                                    
                "accuracy": "91.54% -> 0.00%"                                  
            }                                                                  
        }                                                                      
    },                                                                         
    "200": {                                                                   
        "all_clients": {                                                       
            "test": {                                                          
                "loss": "0.2882 -> 0.0000",                                    
                "accuracy": "92.94% -> 0.00%"                                  
            }                                                                  
        }                                                                      
    },                                                                         
    "300": {                                                                   
        "all_clients": {                                                       
            "test": {                                                          
                "loss": "0.3442 -> 0.0000",                                    
                "accuracy": "93.12% -> 0.00%"                                  
            }                                                                  
        }                                                                      
    },                                                                         
    "400": {                                                                   
        "all_clients": {                                                       
            "test": {                                                          
                "loss": "0.3768 -> 0.0000",                                    
                "accuracy": "93.46% -> 0.00%"                                  
            }                                                                  
        }                                                                      
    }                                                                          
}                                                                              
==================== PSFL Max Accuracy ====================                    
all_clients:                                                                   
(test) before fine-tuning: 93.46% at epoch 400                                 
(test) after fine-tuning: 0.00% at epoch 100                                   
[0m