==================== PSFL ====================                                 
Experiment Arguments:                                                          
{
│   'method': 'psfl',
│   'dataset': {
│   │   'name': 'emnist',
│   │   'client_num': 100,
│   │   'test_ratio': 0.25,
│   │   'val_ratio': 0.0,
│   │   'seed': 42,
│   │   'split': 'sample',
│   │   'IID_ratio': 0.0,
│   │   'monitor_window_name_suffix': 'emnist-100clients-0%IID-Dir(0.5)-seed42',
│   │   'emnist_split': 'byclass',
│   │   'alpha': 0.5,
│   │   'min_samples_per_client': 10
│   },
│   'model': {
│   │   'name': 'avgcnn',
│   │   'use_torchvision_pretrained_weights': True,
│   │   'external_model_weights_path': None
│   },
│   'optimizer': {
│   │   'lr': 0.01,
│   │   'dampening': 0,
│   │   'weight_decay': 0,
│   │   'momentum': 0,
│   │   'nesterov': False,
│   │   'name': 'sgd'
│   },
│   'mode': 'sequential',
│   'parallel': {
│   │   'ray_cluster_addr': None,
│   │   'num_cpus': None,
│   │   'num_gpus': None,
│   │   'num_workers': 2
│   },
│   'common': {
│   │   'seed': 42,
│   │   'join_ratio': 0.1,
│   │   'global_epoch': 400,
│   │   'local_epoch': 5,
│   │   'batch_size': 32,
│   │   'reset_optimizer_on_global_epoch': True,
│   │   'straggler_ratio': 0,
│   │   'straggler_min_local_epoch': 0,
│   │   'buffers': 'global',
│   │   'client_side_evaluation': True,
│   │   'test': {
│   │   │   'client': {
│   │   │   │   'interval': 100,
│   │   │   │   'finetune_epoch': 0,
│   │   │   │   'train': False,
│   │   │   │   'val': False,
│   │   │   │   'test': True
│   │   │   },
│   │   │   'server': {
│   │   │   │   'interval': -1,
│   │   │   │   'train': False,
│   │   │   │   'val': False,
│   │   │   │   'test': False,
│   │   │   │   'model_in_train_mode': False
│   │   │   }
│   │   },
│   │   'verbose_gap': 10,
│   │   'monitor': None,
│   │   'use_cuda': True,
│   │   'save_log': True,
│   │   'save_model': False,
│   │   'save_learning_curve_plot': False,
│   │   'save_metrics': True,
│   │   'delete_useless_run': True
│   },
│   'psfl': {
│   │   'alpha': 0.0,
│   │   'CLS': False,
│   │   'ig_ratio': 0.991,
│   │   'track': False
│   }
}
---------------------------- TRAINING EPOCH: 10 ----------------------------   
client [77] (testset)   loss: 0.6684 -> 0.4502  accuracy: 76.22% -> 84.86%     
client [81] (testset)   loss: 0.5786 -> 0.4931  accuracy: 78.81% -> 82.76%     
client [21] (testset)   loss: 0.9675 -> 0.2826  accuracy: 74.87% -> 91.61%     
client [68] (testset)   loss: 0.3373 -> 0.2776  accuracy: 87.89% -> 89.70%     
client [93] (testset)   loss: 0.4257 -> 0.3564  accuracy: 88.87% -> 91.10%     
client [31] (testset)   loss: 0.5677 -> 0.3358  accuracy: 80.37% -> 87.97%     
client [20] (testset)   loss: 0.4531 -> 0.3524  accuracy: 84.61% -> 90.51%     
client [59] (testset)   loss: 0.8896 -> 0.4371  accuracy: 74.64% -> 83.66%     
client [48] (testset)   loss: 0.6313 -> 0.3784  accuracy: 80.81% -> 86.82%     
client [34] (testset)   loss: 0.5498 -> 0.3493  accuracy: 79.80% -> 89.39%     
---------------------------- TRAINING EPOCH: 20 ----------------------------   
client [69] (testset)   loss: 0.2969 -> 0.6898  accuracy: 90.52% -> 83.75%     
client [99] (testset)   loss: 0.5151 -> 0.2664  accuracy: 80.70% -> 91.97%     
client [67] (testset)   loss: 0.5112 -> 0.2979  accuracy: 83.07% -> 89.10%     
client [0]  (testset)   loss: 0.3437 -> 0.2282  accuracy: 89.12% -> 93.89%     
client [76] (testset)   loss: 0.6939 -> 0.4967  accuracy: 79.57% -> 84.14%     
client [41] (testset)   loss: 0.6631 -> 0.5484  accuracy: 77.64% -> 81.71%     
client [62] (testset)   loss: 0.7606 -> 0.3914  accuracy: 75.08% -> 88.43%     
client [2]  (testset)   loss: 0.5912 -> 0.2566  accuracy: 80.96% -> 90.64%     
client [14] (testset)   loss: 0.4091 -> 0.2909  accuracy: 88.07% -> 91.17%     
client [46] (testset)   loss: 0.3593 -> 0.3046  accuracy: 89.44% -> 90.91%     
---------------------------- TRAINING EPOCH: 30 ----------------------------   
client [24] (testset)   loss: 0.2849 -> 0.2931  accuracy: 91.69% -> 91.64%     
client [68] (testset)   loss: 0.3866 -> 0.2778  accuracy: 87.12% -> 89.98%     
client [57] (testset)   loss: 0.5387 -> 0.5717  accuracy: 82.86% -> 78.31%     
client [17] (testset)   loss: 0.3289 -> 0.2568  accuracy: 88.58% -> 92.03%     
client [54] (testset)   loss: 0.3622 -> 0.2799  accuracy: 89.19% -> 90.82%     
client [23] (testset)   loss: 0.7430 -> 0.4119  accuracy: 77.20% -> 84.89%     
client [35] (testset)   loss: 0.5539 -> 0.4560  accuracy: 79.80% -> 85.80%     
client [59] (testset)   loss: 0.6098 -> 0.4564  accuracy: 76.68% -> 83.40%     
client [31] (testset)   loss: 0.4689 -> 0.3571  accuracy: 84.50% -> 88.27%     
client [9]  (testset)   loss: 0.6511 -> 0.5551  accuracy: 77.50% -> 80.39%     
---------------------------- TRAINING EPOCH: 40 ----------------------------   
client [64] (testset)   loss: 0.4639 -> 0.3981  accuracy: 85.80% -> 86.71%     
client [33] (testset)   loss: 0.4708 -> 0.4261  accuracy: 84.65% -> 85.59%     
client [16] (testset)   loss: 0.3174 -> 0.3235  accuracy: 91.43% -> 91.39%     
client [44] (testset)   loss: 0.8189 -> 0.5040  accuracy: 71.85% -> 82.12%     
client [8]  (testset)   loss: 0.3841 -> 0.3150  accuracy: 88.84% -> 91.09%     
client [31] (testset)   loss: 0.3950 -> 0.3557  accuracy: 87.42% -> 89.08%     
client [47] (testset)   loss: 0.5691 -> 0.4669  accuracy: 81.72% -> 83.31%     
client [36] (testset)   loss: 0.4766 -> 0.3391  accuracy: 82.89% -> 88.28%     
client [20] (testset)   loss: 0.4392 -> 0.3381  accuracy: 87.56% -> 90.62%     
client [56] (testset)   loss: 0.4652 -> 0.3844  accuracy: 85.51% -> 88.40%     
---------------------------- TRAINING EPOCH: 50 ----------------------------   
client [4]  (testset)   loss: 0.4093 -> 0.3263  accuracy: 87.34% -> 90.19%     
client [60] (testset)   loss: 0.3031 -> 0.2238  accuracy: 91.26% -> 93.80%     
client [28] (testset)   loss: 0.4973 -> 0.3471  accuracy: 82.12% -> 88.74%     
client [25] (testset)   loss: 0.2086 -> 0.1951  accuracy: 94.64% -> 95.22%     
client [58] (testset)   loss: 0.3755 -> 0.2577  accuracy: 88.47% -> 91.56%     
client [44] (testset)   loss: 0.5917 -> 0.5331  accuracy: 79.45% -> 82.47%     
client [39] (testset)   loss: 0.5267 -> 0.4406  accuracy: 81.16% -> 85.10%     
client [29] (testset)   loss: 0.6708 -> 0.6204  accuracy: 80.02% -> 80.95%     
client [3]  (testset)   loss: 0.3720 -> 0.2082  accuracy: 87.80% -> 93.72%     
client [84] (testset)   loss: 0.4139 -> 0.2907  accuracy: 87.17% -> 91.45%     
---------------------------- TRAINING EPOCH: 60 ----------------------------   
client [21] (testset)   loss: 0.3481 -> 0.2915  accuracy: 89.64% -> 92.03%     
client [84] (testset)   loss: 0.3773 -> 0.3199  accuracy: 89.37% -> 91.20%     
client [10] (testset)   loss: 0.4726 -> 0.3426  accuracy: 83.62% -> 90.72%     
client [36] (testset)   loss: 0.4216 -> 0.3744  accuracy: 84.69% -> 87.98%     
client [65] (testset)   loss: 0.5565 -> 0.4826  accuracy: 83.60% -> 86.84%     
client [81] (testset)   loss: 0.6662 -> 0.4873  accuracy: 78.42% -> 85.21%     
client [79] (testset)   loss: 0.2835 -> 0.2119  accuracy: 90.83% -> 93.67%     
client [42] (testset)   loss: 0.3130 -> 0.2811  accuracy: 90.40% -> 92.80%     
client [11] (testset)   loss: 0.3017 -> 0.2369  accuracy: 91.68% -> 93.65%     
client [96] (testset)   loss: 0.5567 -> 0.4305  accuracy: 82.01% -> 89.08%     
---------------------------- TRAINING EPOCH: 70 ----------------------------   
client [8]  (testset)   loss: 0.4321 -> 0.3494  accuracy: 86.67% -> 91.09%     
client [53] (testset)   loss: 0.5231 -> 0.4331  accuracy: 85.52% -> 87.00%     
client [52] (testset)   loss: 0.5740 -> 0.4965  accuracy: 83.22% -> 86.18%     
client [42] (testset)   loss: 0.3620 -> 0.2834  accuracy: 89.38% -> 92.89%     
client [69] (testset)   loss: 0.4913 -> 0.3386  accuracy: 86.21% -> 92.34%     
client [59] (testset)   loss: 0.5570 -> 0.5138  accuracy: 83.66% -> 82.54%     
client [7]  (testset)   loss: 0.4200 -> 0.3438  accuracy: 86.71% -> 88.62%     
client [26] (testset)   loss: 0.4279 -> 0.5076  accuracy: 87.18% -> 87.49%     
client [49] (testset)   loss: 0.3613 -> 0.2838  accuracy: 88.00% -> 93.03%     
client [98] (testset)   loss: 0.3178 -> 0.3007  accuracy: 91.53% -> 91.85%     
---------------------------- TRAINING EPOCH: 80 ----------------------------   
client [98] (testset)   loss: 0.3292 -> 0.2978  accuracy: 91.17% -> 92.09%     
client [47] (testset)   loss: 0.6186 -> 0.5138  accuracy: 80.00% -> 83.82%     
client [21] (testset)   loss: 0.4783 -> 0.3328  accuracy: 84.85% -> 92.55%     
client [77] (testset)   loss: 0.4869 -> 0.5083  accuracy: 84.97% -> 84.76%     
client [95] (testset)   loss: 0.3421 -> 0.2945  accuracy: 91.54% -> 93.49%     
client [91] (testset)   loss: 0.4912 -> 0.4633  accuracy: 85.39% -> 87.99%     
client [14] (testset)   loss: 0.4878 -> 0.3165  accuracy: 84.15% -> 92.41%     
client [99] (testset)   loss: 0.3964 -> 0.3215  accuracy: 88.23% -> 92.25%     
client [20] (testset)   loss: 0.5197 -> 0.4006  accuracy: 85.44% -> 91.10%     
client [39] (testset)   loss: 0.5395 -> 0.5054  accuracy: 83.35% -> 85.23%     
---------------------------- TRAINING EPOCH: 90 ----------------------------   
client [52] (testset)   loss: 0.6165 -> 0.5268  accuracy: 82.66% -> 85.44%     
client [62] (testset)   loss: 0.5839 -> 0.4956  accuracy: 82.25% -> 88.35%     
client [71] (testset)   loss: 0.6575 -> 0.6254  accuracy: 80.37% -> 83.22%     
client [97] (testset)   loss: 0.3491 -> 0.2469  accuracy: 90.28% -> 93.67%     
client [30] (testset)   loss: 0.4222 -> 0.4040  accuracy: 88.28% -> 89.87%     
client [88] (testset)   loss: 0.3987 -> 0.3416  accuracy: 86.27% -> 88.73%     
client [60] (testset)   loss: 0.2943 -> 0.2724  accuracy: 92.37% -> 93.22%     
client [82] (testset)   loss: 0.6431 -> 0.5105  accuracy: 79.29% -> 85.05%     
client [91] (testset)   loss: 0.5652 -> 0.5022  accuracy: 83.93% -> 87.39%     
client [57] (testset)   loss: 0.5784 -> 0.6768  accuracy: 80.78% -> 81.85%     
---------------------------- TRAINING EPOCH: 100 ----------------------------  
client [31] (testset)   loss: 0.5159 -> 0.4444  accuracy: 85.66% -> 88.68%     
client [15] (testset)   loss: 0.5476 -> 0.5991  accuracy: 83.44% -> 83.59%     
client [71] (testset)   loss: 0.7771 -> 0.6593  accuracy: 79.35% -> 83.36%     
client [97] (testset)   loss: 0.3744 -> 0.2767  accuracy: 90.08% -> 93.55%     
client [53] (testset)   loss: 0.5988 -> 0.5064  accuracy: 86.35% -> 87.65%     
client [77] (testset)   loss: 0.5876 -> 0.5253  accuracy: 83.41% -> 84.76%     
client [76] (testset)   loss: 0.6568 -> 0.5993  accuracy: 80.67% -> 83.87%     
client [79] (testset)   loss: 0.2928 -> 0.2495  accuracy: 92.07% -> 93.74%     
client [28] (testset)   loss: 0.5275 -> 0.4368  accuracy: 85.03% -> 88.97%     
client [99] (testset)   loss: 0.6417 -> 0.3451  accuracy: 83.49% -> 92.53%     
---------------------------- TRAINING EPOCH: 110 ----------------------------  
client [97] (testset)   loss: 0.4525 -> 0.2978  accuracy: 89.00% -> 93.03%     
client [86] (testset)   loss: 0.6033 -> 0.3504  accuracy: 79.02% -> 92.48%     
client [34] (testset)   loss: 0.5611 -> 0.4888  accuracy: 86.95% -> 89.67%     
client [73] (testset)   loss: 0.7570 -> 0.6610  accuracy: 82.91% -> 85.07%     
client [5]  (testset)   loss: 0.5344 -> 0.4710  accuracy: 87.16% -> 89.88%     
client [96] (testset)   loss: 0.6484 -> 0.5422  accuracy: 86.10% -> 89.56%     
client [22] (testset)   loss: 0.8362 -> 0.7746  accuracy: 81.88% -> 82.01%     
client [60] (testset)   loss: 0.3420 -> 0.3247  accuracy: 91.10% -> 93.22%     
client [66] (testset)   loss: 0.4263 -> 0.3275  accuracy: 89.84% -> 92.23%     
client [83] (testset)   loss: 0.4660 -> 0.4095  accuracy: 89.21% -> 90.82%     
---------------------------- TRAINING EPOCH: 120 ----------------------------  
client [76] (testset)   loss: 0.7637 -> 0.6694  accuracy: 82.71% -> 83.98%     
client [65] (testset)   loss: 0.7829 -> 0.6336  accuracy: 79.89% -> 84.55%     
client [95] (testset)   loss: 0.4009 -> 0.3498  accuracy: 91.62% -> 93.05%     
client [17] (testset)   loss: 0.4189 -> 0.3449  accuracy: 89.49% -> 92.03%     
client [8]  (testset)   loss: 0.4819 -> 0.4375  accuracy: 88.99% -> 90.19%     
client [35] (testset)   loss: 0.9781 -> 0.7641  accuracy: 77.46% -> 82.80%     
client [98] (testset)   loss: 0.3573 -> 0.3517  accuracy: 91.77% -> 92.29%     
client [53] (testset)   loss: 0.6302 -> 0.5458  accuracy: 86.94% -> 88.30%     
client [43] (testset)   loss: 0.4459 -> 0.3931  accuracy: 89.02% -> 90.96%     
client [64] (testset)   loss: 0.6586 -> 0.5633  accuracy: 84.83% -> 86.23%     
---------------------------- TRAINING EPOCH: 130 ----------------------------  
client [21] (testset)   loss: 0.4703 -> 0.3808  accuracy: 88.06% -> 92.21%     
client [88] (testset)   loss: 0.4784 -> 0.4619  accuracy: 87.07% -> 87.74%     
client [38] (testset)   loss: 0.5105 -> 0.4066  accuracy: 89.43% -> 92.00%     
client [3]  (testset)   loss: 0.2856 -> 0.2700  accuracy: 92.94% -> 94.65%     
client [5]  (testset)   loss: 0.5990 -> 0.5003  accuracy: 87.89% -> 90.54%     
client [41] (testset)   loss: 0.8717 -> 0.7640  accuracy: 79.30% -> 81.96%     
client [7]  (testset)   loss: 0.4816 -> 0.4255  accuracy: 87.15% -> 88.47%     
client [37] (testset)   loss: 0.5032 -> 0.4038  accuracy: 86.50% -> 88.76%     
client [45] (testset)   loss: 0.6139 -> 0.5112  accuracy: 85.92% -> 87.82%     
client [47] (testset)   loss: 0.7741 -> 0.6138  accuracy: 76.69% -> 81.80%     
---------------------------- TRAINING EPOCH: 140 ----------------------------  
client [16] (testset)   loss: 0.5528 -> 0.5006  accuracy: 88.78% -> 91.15%     
client [11] (testset)   loss: 0.4411 -> 0.3151  accuracy: 89.76% -> 93.76%     
client [37] (testset)   loss: 0.5424 -> 0.4539  accuracy: 87.90% -> 89.51%     
client [41] (testset)   loss: 0.9065 -> 0.8100  accuracy: 76.72% -> 82.38%     
client [95] (testset)   loss: 0.4021 -> 0.3853  accuracy: 91.90% -> 93.01%     
client [53] (testset)   loss: 0.6795 -> 0.6118  accuracy: 86.47% -> 87.53%     
client [22] (testset)   loss: 0.9673 -> 0.8384  accuracy: 78.96% -> 82.78%     
client [25] (testset)   loss: 0.2970 -> 0.2905  accuracy: 93.87% -> 95.32%     
client [69] (testset)   loss: 0.5539 -> 0.4442  accuracy: 87.99% -> 92.62%     
client [46] (testset)   loss: 0.5250 -> 0.4178  accuracy: 89.55% -> 91.86%     
---------------------------- TRAINING EPOCH: 150 ----------------------------  
client [47] (testset)   loss: 0.9667 -> 0.8259  accuracy: 75.05% -> 81.84%     
client [69] (testset)   loss: 0.5280 -> 0.4785  accuracy: 90.38% -> 92.20%     
client [82] (testset)   loss: 0.7471 -> 0.7194  accuracy: 85.38% -> 85.95%     
client [45] (testset)   loss: 0.7067 -> 0.6319  accuracy: 85.58% -> 87.66%     
client [7]  (testset)   loss: 0.5192 -> 0.4722  accuracy: 87.40% -> 88.28%     
client [50] (testset)   loss: 0.5404 -> 0.4289  accuracy: 88.69% -> 89.73%     
client [35] (testset)   loss: 1.0471 -> 0.8260  accuracy: 79.48% -> 83.45%     
client [24] (testset)   loss: 0.5697 -> 0.4824  accuracy: 89.22% -> 91.36%     
client [15] (testset)   loss: 0.7425 -> 0.7142  accuracy: 83.66% -> 84.88%     
client [58] (testset)   loss: 0.5288 -> 0.4613  accuracy: 89.06% -> 90.97%     
---------------------------- TRAINING EPOCH: 160 ----------------------------  
client [48] (testset)   loss: 0.7148 -> 0.6158  accuracy: 83.88% -> 85.46%     
client [76] (testset)   loss: 0.9216 -> 0.7852  accuracy: 80.89% -> 83.76%     
client [67] (testset)   loss: 0.5268 -> 0.4768  accuracy: 88.37% -> 89.72%     
client [37] (testset)   loss: 0.5815 -> 0.5080  accuracy: 87.70% -> 89.26%     
client [58] (testset)   loss: 0.5405 -> 0.4874  accuracy: 89.10% -> 90.93%     
client [64] (testset)   loss: 0.8228 -> 0.7377  accuracy: 84.19% -> 85.48%     
client [77] (testset)   loss: 0.8527 -> 0.7668  accuracy: 80.59% -> 84.43%     
client [55] (testset)   loss: 0.7506 -> 0.6564  accuracy: 84.30% -> 86.29%     
client [12] (testset)   loss: 0.6965 -> 0.6189  accuracy: 83.32% -> 84.74%     
client [89] (testset)   loss: 0.8501 -> 0.8072  accuracy: 83.43% -> 85.90%     
---------------------------- TRAINING EPOCH: 170 ----------------------------  
client [84] (testset)   loss: 0.5565 -> 0.5130  accuracy: 90.08% -> 91.82%     
client [51] (testset)   loss: 0.5542 -> 0.5059  accuracy: 90.32% -> 91.32%     
client [8]  (testset)   loss: 0.5827 -> 0.5429  accuracy: 88.69% -> 90.94%     
client [18] (testset)   loss: 0.6661 -> 0.6555  accuracy: 85.20% -> 84.94%     
client [94] (testset)   loss: 0.6402 -> 0.5721  accuracy: 87.31% -> 89.67%     
client [81] (testset)   loss: 0.9960 -> 0.8121  accuracy: 80.13% -> 84.18%     
client [3]  (testset)   loss: 0.4090 -> 0.3249  accuracy: 92.84% -> 94.40%     
client [11] (testset)   loss: 0.4464 -> 0.3779  accuracy: 90.74% -> 93.92%     
client [95] (testset)   loss: 0.4744 -> 0.4513  accuracy: 91.54% -> 92.97%     
client [67] (testset)   loss: 0.6344 -> 0.5129  accuracy: 86.81% -> 89.98%     
---------------------------- TRAINING EPOCH: 180 ----------------------------  
client [21] (testset)   loss: 0.5182 -> 0.4240  accuracy: 88.78% -> 91.91%     
client [79] (testset)   loss: 0.3384 -> 0.3040  accuracy: 92.36% -> 93.67%     
client [58] (testset)   loss: 0.5829 -> 0.5303  accuracy: 88.79% -> 91.09%     
client [88] (testset)   loss: 0.6031 -> 0.5773  accuracy: 86.98% -> 86.88%     
client [46] (testset)   loss: 0.5549 -> 0.4753  accuracy: 90.13% -> 91.65%     
client [11] (testset)   loss: 0.4435 -> 0.3813  accuracy: 93.04% -> 93.70%     
client [55] (testset)   loss: 0.9482 -> 0.8274  accuracy: 83.23% -> 86.14%     
client [13] (testset)   loss: 0.7696 -> 0.7150  accuracy: 84.19% -> 86.57%     
client [31] (testset)   loss: 0.6260 -> 0.5966  accuracy: 86.36% -> 87.77%     
client [75] (testset)   loss: 0.6829 -> 0.6221  accuracy: 84.80% -> 87.06%     
---------------------------- TRAINING EPOCH: 190 ----------------------------  
client [19] (testset)   loss: 0.6673 -> 0.6273  accuracy: 88.45% -> 90.46%     
client [7]  (testset)   loss: 0.6997 -> 0.6230  accuracy: 86.08% -> 88.08%     
client [57] (testset)   loss: 0.8783 -> 0.7806  accuracy: 81.08% -> 84.77%     
client [13] (testset)   loss: 0.7748 -> 0.7485  accuracy: 84.55% -> 86.45%     
client [43] (testset)   loss: 0.5755 -> 0.5530  accuracy: 89.32% -> 90.96%     
client [91] (testset)   loss: 0.8696 -> 0.7498  accuracy: 83.68% -> 86.59%     
client [10] (testset)   loss: 0.6901 -> 0.6375  accuracy: 87.53% -> 88.73%     
client [64] (testset)   loss: 0.8305 -> 0.8242  accuracy: 84.45% -> 85.48%     
client [82] (testset)   loss: 0.9856 -> 0.8940  accuracy: 82.51% -> 86.46%     
client [22] (testset)   loss: 1.2087 -> 1.1023  accuracy: 79.93% -> 82.85%     
---------------------------- TRAINING EPOCH: 200 ----------------------------  
client [20] (testset)   loss: 0.7056 -> 0.6463  accuracy: 88.97% -> 90.09%     
client [23] (testset)   loss: 0.9645 -> 0.8128  accuracy: 81.04% -> 84.94%     
client [88] (testset)   loss: 0.6605 -> 0.5931  accuracy: 86.70% -> 87.31%     
client [98] (testset)   loss: 0.5780 -> 0.4941  accuracy: 90.21% -> 92.21%     
client [79] (testset)   loss: 0.4445 -> 0.3862  accuracy: 92.07% -> 93.30%     
client [21] (testset)   loss: 0.5194 -> 0.4652  accuracy: 91.01% -> 92.18%     
client [92] (testset)   loss: 0.5467 -> 0.4540  accuracy: 88.97% -> 91.63%     
client [56] (testset)   loss: 0.7579 -> 0.7546  accuracy: 85.75% -> 85.92%     
client [5]  (testset)   loss: 0.6916 -> 0.6285  accuracy: 88.48% -> 89.88%     
client [52] (testset)   loss: 0.9642 -> 0.8580  accuracy: 84.10% -> 86.36%     
---------------------------- TRAINING EPOCH: 210 ----------------------------  
client [67] (testset)   loss: 0.6897 -> 0.6584  accuracy: 88.27% -> 88.89%     
client [54] (testset)   loss: 0.5300 -> 0.4887  accuracy: 89.41% -> 91.16%     
client [14] (testset)   loss: 0.5380 -> 0.4987  accuracy: 88.97% -> 92.08%     
client [99] (testset)   loss: 0.5954 -> 0.4865  accuracy: 88.73% -> 92.86%     
client [36] (testset)   loss: 0.8998 -> 0.8376  accuracy: 84.99% -> 86.23%     
client [30] (testset)   loss: 0.7937 -> 0.7142  accuracy: 88.28% -> 89.24%     
client [38] (testset)   loss: 0.5626 -> 0.5508  accuracy: 91.25% -> 91.18%     
client [15] (testset)   loss: 0.8976 -> 0.8565  accuracy: 83.37% -> 84.67%     
client [6]  (testset)   loss: 0.9417 -> 0.8812  accuracy: 81.99% -> 86.52%     
client [53] (testset)   loss: 0.8969 -> 0.8259  accuracy: 87.00% -> 88.42%     
---------------------------- TRAINING EPOCH: 220 ----------------------------  
client [99] (testset)   loss: 0.5858 -> 0.5678  accuracy: 91.08% -> 92.47%     
client [6]  (testset)   loss: 0.9386 -> 0.9242  accuracy: 83.98% -> 85.93%     
client [83] (testset)   loss: 0.6772 -> 0.6482  accuracy: 88.64% -> 90.14%     
client [42] (testset)   loss: 0.5827 -> 0.5531  accuracy: 90.13% -> 91.82%     
client [34] (testset)   loss: 0.7660 -> 0.7782  accuracy: 88.59% -> 88.31%     
client [15] (testset)   loss: 0.8481 -> 0.8399  accuracy: 83.80% -> 84.95%     
client [47] (testset)   loss: 1.2575 -> 1.1091  accuracy: 77.99% -> 81.84%     
client [55] (testset)   loss: 1.0424 -> 0.9284  accuracy: 83.03% -> 85.22%     
client [51] (testset)   loss: 0.6389 -> 0.5930  accuracy: 90.32% -> 91.19%     
client [95] (testset)   loss: 0.5171 -> 0.4994  accuracy: 91.94% -> 92.85%     
---------------------------- TRAINING EPOCH: 230 ----------------------------  
client [71] (testset)   loss: 1.0999 -> 1.0144  accuracy: 80.77% -> 81.71%     
client [15] (testset)   loss: 0.9675 -> 0.9203  accuracy: 82.79% -> 84.95%     
client [33] (testset)   loss: 0.9383 -> 0.7150  accuracy: 83.43% -> 86.42%     
client [99] (testset)   loss: 0.5865 -> 0.5134  accuracy: 90.96% -> 92.75%     
client [90] (testset)   loss: 0.9948 -> 0.9082  accuracy: 82.46% -> 81.87%     
client [57] (testset)   loss: 0.9552 -> 0.9367  accuracy: 80.85% -> 83.13%     
client [27] (testset)   loss: 0.6102 -> 0.5839  accuracy: 91.13% -> 92.96%     
client [78] (testset)   loss: 0.5448 -> 0.5190  accuracy: 89.12% -> 91.12%     
client [36] (testset)   loss: 0.8860 -> 0.9090  accuracy: 85.84% -> 87.43%     
client [88] (testset)   loss: 0.6686 -> 0.6670  accuracy: 86.27% -> 86.93%     
---------------------------- TRAINING EPOCH: 240 ----------------------------  
client [70] (testset)   loss: 1.2605 -> 1.2293  accuracy: 81.89% -> 83.10%     
client [35] (testset)   loss: 1.2515 -> 1.1263  accuracy: 80.91% -> 83.65%     
client [16] (testset)   loss: 0.7812 -> 0.7175  accuracy: 90.25% -> 90.96%     
client [80] (testset)   loss: 1.0059 -> 0.9916  accuracy: 81.40% -> 82.69%     
client [38] (testset)   loss: 0.5477 -> 0.5797  accuracy: 91.64% -> 91.77%     
client [78] (testset)   loss: 0.5709 -> 0.5435  accuracy: 89.27% -> 89.94%     
client [68] (testset)   loss: 0.6217 -> 0.6023  accuracy: 88.68% -> 89.76%     
client [11] (testset)   loss: 0.5089 -> 0.4487  accuracy: 91.57% -> 93.70%     
client [64] (testset)   loss: 1.0799 -> 0.9574  accuracy: 82.46% -> 85.64%     
client [82] (testset)   loss: 1.0773 -> 1.0582  accuracy: 84.59% -> 86.12%     
---------------------------- TRAINING EPOCH: 250 ----------------------------  
client [30] (testset)   loss: 0.7839 -> 0.7711  accuracy: 89.55% -> 90.10%     
client [27] (testset)   loss: 0.6477 -> 0.6286  accuracy: 91.97% -> 92.92%     
client [74] (testset)   loss: 0.7117 -> 0.6773  accuracy: 89.72% -> 90.80%     
client [45] (testset)   loss: 0.9557 -> 0.9066  accuracy: 83.76% -> 86.66%     
client [6]  (testset)   loss: 1.0170 -> 0.9809  accuracy: 83.58% -> 86.21%     
client [36] (testset)   loss: 0.9155 -> 0.9783  accuracy: 86.28% -> 86.38%     
client [63] (testset)   loss: 0.6621 -> 0.6218  accuracy: 90.38% -> 90.87%     
client [76] (testset)   loss: 1.1121 -> 1.0773  accuracy: 82.93% -> 83.59%     
client [83] (testset)   loss: 0.7555 -> 0.6819  accuracy: 87.39% -> 90.25%     
client [86] (testset)   loss: 0.5229 -> 0.5043  accuracy: 92.53% -> 92.63%     
---------------------------- TRAINING EPOCH: 260 ----------------------------  
client [83] (testset)   loss: 0.8333 -> 0.7264  accuracy: 85.60% -> 89.92%     
client [99] (testset)   loss: 0.6451 -> 0.5856  accuracy: 90.46% -> 92.81%     
client [74] (testset)   loss: 0.6626 -> 0.6752  accuracy: 90.17% -> 91.03%     
client [73] (testset)   loss: 1.1209 -> 1.0589  accuracy: 83.13% -> 84.72%     
client [29] (testset)   loss: 1.4548 -> 1.3232  accuracy: 79.91% -> 80.83%     
client [92] (testset)   loss: 0.5666 -> 0.5416  accuracy: 90.88% -> 91.79%     
client [6]  (testset)   loss: 1.0125 -> 1.0607  accuracy: 84.71% -> 85.34%     
client [61] (testset)   loss: 0.6293 -> 0.6106  accuracy: 92.41% -> 92.46%     
client [21] (testset)   loss: 0.6088 -> 0.5469  accuracy: 90.63% -> 92.21%     
client [67] (testset)   loss: 0.7329 -> 0.7071  accuracy: 88.94% -> 89.51%     
---------------------------- TRAINING EPOCH: 270 ----------------------------  
client [83] (testset)   loss: 0.7620 -> 0.7473  accuracy: 89.50% -> 90.25%     
client [32] (testset)   loss: 0.7221 -> 0.6837  accuracy: 89.90% -> 91.39%     
client [95] (testset)   loss: 0.5783 -> 0.5571  accuracy: 93.05% -> 92.70%     
client [61] (testset)   loss: 0.6690 -> 0.6388  accuracy: 91.65% -> 92.22%     
client [27] (testset)   loss: 0.6282 -> 0.6128  accuracy: 91.75% -> 92.52%     
client [25] (testset)   loss: 0.4455 -> 0.4271  accuracy: 94.59% -> 94.81%     
client [68] (testset)   loss: 0.6810 -> 0.6518  accuracy: 89.22% -> 90.30%     
client [34] (testset)   loss: 0.8797 -> 0.8162  accuracy: 87.34% -> 89.27%     
client [71] (testset)   loss: 1.3716 -> 1.3019  accuracy: 78.64% -> 81.84%     
client [89] (testset)   loss: 1.1107 -> 1.0696  accuracy: 84.21% -> 85.77%     
---------------------------- TRAINING EPOCH: 280 ----------------------------  
client [78] (testset)   loss: 0.6149 -> 0.6141  accuracy: 90.25% -> 90.20%     
client [81] (testset)   loss: 1.3626 -> 1.2054  accuracy: 82.37% -> 83.89%     
client [51] (testset)   loss: 0.6869 -> 0.6866  accuracy: 91.05% -> 91.78%     
client [54] (testset)   loss: 0.5984 -> 0.6072  accuracy: 90.54% -> 90.37%     
client [65] (testset)   loss: 1.2312 -> 1.0708  accuracy: 83.33% -> 85.43%     
client [41] (testset)   loss: 1.4144 -> 1.2882  accuracy: 78.97% -> 81.30%     
client [11] (testset)   loss: 0.6426 -> 0.5326  accuracy: 91.02% -> 93.54%     
client [85] (testset)   loss: 0.6267 -> 0.5914  accuracy: 91.32% -> 92.28%     
client [12] (testset)   loss: 1.0352 -> 0.9189  accuracy: 83.56% -> 84.45%     
client [23] (testset)   loss: 1.0977 -> 1.0410  accuracy: 82.01% -> 84.66%     
---------------------------- TRAINING EPOCH: 290 ----------------------------  
client [16] (testset)   loss: 0.7964 -> 0.7661  accuracy: 90.72% -> 91.10%     
client [65] (testset)   loss: 1.3052 -> 1.2177  accuracy: 83.47% -> 84.95%     
client [53] (testset)   loss: 1.0336 -> 0.9998  accuracy: 88.77% -> 88.30%     
client [58] (testset)   loss: 0.7099 -> 0.7185  accuracy: 90.69% -> 91.09%     
client [72] (testset)   loss: 1.0121 -> 0.9257  accuracy: 84.20% -> 86.21%     
client [7]  (testset)   loss: 0.8330 -> 0.8196  accuracy: 86.91% -> 87.59%     
client [71] (testset)   loss: 1.4437 -> 1.3377  accuracy: 79.88% -> 81.98%     
client [59] (testset)   loss: 1.1259 -> 1.0457  accuracy: 82.38% -> 83.56%     
client [86] (testset)   loss: 0.6068 -> 0.5890  accuracy: 91.84% -> 92.83%     
client [39] (testset)   loss: 1.1350 -> 1.1428  accuracy: 83.83% -> 84.48%     
---------------------------- TRAINING EPOCH: 300 ----------------------------  
client [99] (testset)   loss: 0.6764 -> 0.6595  accuracy: 91.75% -> 92.41%     
client [7]  (testset)   loss: 0.8342 -> 0.8010  accuracy: 87.20% -> 87.93%     
client [17] (testset)   loss: 0.7416 -> 0.6933  accuracy: 89.85% -> 91.20%     
client [64] (testset)   loss: 1.1564 -> 1.1180  accuracy: 85.10% -> 85.80%     
client [37] (testset)   loss: 0.9117 -> 0.8284  accuracy: 87.85% -> 88.25%     
client [29] (testset)   loss: 1.6342 -> 1.5497  accuracy: 81.18% -> 80.60%     
client [93] (testset)   loss: 0.8512 -> 0.8157  accuracy: 88.37% -> 91.06%     
client [73] (testset)   loss: 1.2137 -> 1.1872  accuracy: 83.30% -> 84.27%     
client [40] (testset)   loss: 0.9728 -> 0.9693  accuracy: 87.13% -> 86.84%     
client [76] (testset)   loss: 1.2007 -> 1.1876  accuracy: 83.20% -> 84.09%     
---------------------------- TRAINING EPOCH: 310 ----------------------------  
client [31] (testset)   loss: 0.9604 -> 0.8945  accuracy: 87.12% -> 86.91%     
client [89] (testset)   loss: 1.2375 -> 1.2867  accuracy: 85.64% -> 86.16%     
client [77] (testset)   loss: 1.3263 -> 1.2229  accuracy: 82.97% -> 83.95%     
client [90] (testset)   loss: 1.4211 -> 1.2603  accuracy: 78.31% -> 82.10%     
client [26] (testset)   loss: 0.9624 -> 0.8470  accuracy: 86.56% -> 88.34%     
client [50] (testset)   loss: 0.8243 -> 0.7380  accuracy: 87.97% -> 88.74%     
client [30] (testset)   loss: 0.9408 -> 0.9113  accuracy: 88.51% -> 89.51%     
client [70] (testset)   loss: 1.4123 -> 1.4479  accuracy: 82.57% -> 83.25%     
client [41] (testset)   loss: 1.4512 -> 1.4088  accuracy: 82.13% -> 81.96%     
client [99] (testset)   loss: 0.7028 -> 0.6432  accuracy: 90.74% -> 92.47%     
---------------------------- TRAINING EPOCH: 320 ----------------------------  
client [68] (testset)   loss: 0.7817 -> 0.7691  accuracy: 89.28% -> 90.05%     
client [70] (testset)   loss: 1.4616 -> 1.3895  accuracy: 81.22% -> 83.17%     
client [52] (testset)   loss: 1.2111 -> 1.1629  accuracy: 85.16% -> 85.76%     
client [1]  (testset)   loss: 0.8445 -> 0.7904  accuracy: 88.33% -> 90.03%     
client [2]  (testset)   loss: 0.7185 -> 0.7064  accuracy: 90.20% -> 90.64%     
client [67] (testset)   loss: 0.8993 -> 0.8922  accuracy: 89.10% -> 89.56%     
client [92] (testset)   loss: 0.6935 -> 0.7116  accuracy: 91.29% -> 92.45%     
client [35] (testset)   loss: 1.3844 -> 1.3336  accuracy: 83.39% -> 83.00%     
client [36] (testset)   loss: 1.2321 -> 1.1436  accuracy: 84.49% -> 86.78%     
client [64] (testset)   loss: 1.2439 -> 1.2102  accuracy: 84.35% -> 85.21%     
---------------------------- TRAINING EPOCH: 330 ----------------------------  
client [44] (testset)   loss: 1.6164 -> 1.5645  accuracy: 80.48% -> 79.86%     
client [6]  (testset)   loss: 1.2144 -> 1.2196  accuracy: 84.89% -> 85.57%     
client [12] (testset)   loss: 1.1424 -> 1.0076  accuracy: 83.91% -> 84.86%     
client [55] (testset)   loss: 1.2444 -> 1.2100  accuracy: 83.33% -> 85.63%     
client [29] (testset)   loss: 1.6923 -> 1.6086  accuracy: 81.99% -> 80.48%     
client [9]  (testset)   loss: 1.6277 -> 1.5002  accuracy: 77.76% -> 79.88%     
client [43] (testset)   loss: 0.9253 -> 0.8114  accuracy: 87.81% -> 90.88%     
client [77] (testset)   loss: 1.3269 -> 1.2955  accuracy: 83.08% -> 83.78%     
client [98] (testset)   loss: 0.6784 -> 0.6727  accuracy: 91.81% -> 91.89%     
client [78] (testset)   loss: 0.7380 -> 0.7200  accuracy: 89.12% -> 89.94%     
---------------------------- TRAINING EPOCH: 340 ----------------------------  
client [92] (testset)   loss: 0.7276 -> 0.7063  accuracy: 91.29% -> 92.37%     
client [80] (testset)   loss: 1.2380 -> 1.1385  accuracy: 81.84% -> 84.95%     
client [63] (testset)   loss: 0.8734 -> 0.7753  accuracy: 90.53% -> 91.26%     
client [76] (testset)   loss: 1.2936 -> 1.3029  accuracy: 84.25% -> 84.53%     
client [78] (testset)   loss: 0.7528 -> 0.6739  accuracy: 88.66% -> 90.20%     
client [25] (testset)   loss: 0.5174 -> 0.4908  accuracy: 93.96% -> 94.47%     
client [58] (testset)   loss: 0.8170 -> 0.8067  accuracy: 89.70% -> 90.57%     
client [13] (testset)   loss: 1.0183 -> 1.0206  accuracy: 85.35% -> 86.02%     
client [17] (testset)   loss: 0.8032 -> 0.7356  accuracy: 90.01% -> 91.36%     
client [38] (testset)   loss: 0.7547 -> 0.7249  accuracy: 91.44% -> 91.54%     
---------------------------- TRAINING EPOCH: 350 ----------------------------  
client [72] (testset)   loss: 1.1301 -> 1.1195  accuracy: 85.13% -> 85.97%     
client [82] (testset)   loss: 1.3932 -> 1.3607  accuracy: 84.93% -> 86.57%     
client [86] (testset)   loss: 0.6761 -> 0.6949  accuracy: 92.28% -> 92.38%     
client [51] (testset)   loss: 0.8866 -> 0.8557  accuracy: 90.37% -> 91.37%     
client [96] (testset)   loss: 1.1190 -> 0.9987  accuracy: 88.12% -> 88.89%     
client [42] (testset)   loss: 0.7058 -> 0.7425  accuracy: 91.64% -> 91.73%     
client [55] (testset)   loss: 1.3697 -> 1.2866  accuracy: 84.66% -> 85.88%     
client [13] (testset)   loss: 1.0292 -> 1.0523  accuracy: 85.96% -> 86.45%     
client [1]  (testset)   loss: 0.8951 -> 0.8556  accuracy: 88.22% -> 89.39%     
client [12] (testset)   loss: 1.1412 -> 0.9851  accuracy: 82.97% -> 85.45%     
---------------------------- TRAINING EPOCH: 360 ----------------------------  
client [68] (testset)   loss: 0.8174 -> 0.8014  accuracy: 89.51% -> 90.14%     
client [23] (testset)   loss: 1.4037 -> 1.2948  accuracy: 81.27% -> 84.11%     
client [46] (testset)   loss: 0.9803 -> 0.9336  accuracy: 89.76% -> 90.28%     
client [41] (testset)   loss: 1.5289 -> 1.4873  accuracy: 80.47% -> 83.21%     
client [25] (testset)   loss: 0.5550 -> 0.5524  accuracy: 93.67% -> 94.50%     
client [58] (testset)   loss: 0.8972 -> 0.8281  accuracy: 90.49% -> 91.09%     
client [14] (testset)   loss: 0.7542 -> 0.6814  accuracy: 89.83% -> 91.50%     
client [33] (testset)   loss: 1.3059 -> 1.0745  accuracy: 84.48% -> 86.03%     
client [85] (testset)   loss: 0.6439 -> 0.6443  accuracy: 91.80% -> 92.13%     
client [62] (testset)   loss: 1.2443 -> 1.2477  accuracy: 87.27% -> 87.65%     
---------------------------- TRAINING EPOCH: 370 ----------------------------  
client [98] (testset)   loss: 0.7476 -> 0.7567  accuracy: 92.13% -> 92.09%     
client [63] (testset)   loss: 0.9338 -> 0.8633  accuracy: 90.28% -> 90.67%     
client [70] (testset)   loss: 1.5216 -> 1.4797  accuracy: 82.12% -> 82.49%     
client [65] (testset)   loss: 1.4345 -> 1.3586  accuracy: 83.60% -> 84.01%     
client [14] (testset)   loss: 0.7824 -> 0.7531  accuracy: 89.36% -> 91.79%     
client [73] (testset)   loss: 1.4734 -> 1.4066  accuracy: 82.85% -> 84.78%     
client [34] (testset)   loss: 1.1698 -> 1.0870  accuracy: 87.12% -> 88.71%     
client [99] (testset)   loss: 0.7587 -> 0.7354  accuracy: 92.08% -> 92.64%     
client [69] (testset)   loss: 0.8387 -> 0.8209  accuracy: 91.27% -> 92.05%     
client [46] (testset)   loss: 0.9933 -> 0.9142  accuracy: 89.92% -> 89.97%     
---------------------------- TRAINING EPOCH: 380 ----------------------------  
client [99] (testset)   loss: 0.7744 -> 0.7257  accuracy: 91.30% -> 93.14%     
client [93] (testset)   loss: 0.9830 -> 0.9090  accuracy: 89.59% -> 91.18%     
client [11] (testset)   loss: 0.6974 -> 0.6466  accuracy: 92.99% -> 93.26%     
client [58] (testset)   loss: 0.8936 -> 0.8917  accuracy: 90.02% -> 91.01%     
client [81] (testset)   loss: 1.5534 -> 1.4522  accuracy: 83.79% -> 83.50%     
client [85] (testset)   loss: 0.7033 -> 0.6755  accuracy: 91.69% -> 92.21%     
client [89] (testset)   loss: 1.4593 -> 1.4112  accuracy: 85.25% -> 85.51%     
client [45] (testset)   loss: 1.1007 -> 1.0272  accuracy: 86.99% -> 87.49%     
client [8]  (testset)   loss: 1.0715 -> 1.0182  accuracy: 89.66% -> 90.04%     
client [68] (testset)   loss: 0.8585 -> 0.8506  accuracy: 89.83% -> 89.86%     
---------------------------- TRAINING EPOCH: 390 ----------------------------  
client [67] (testset)   loss: 0.9926 -> 0.9706  accuracy: 88.89% -> 89.46%     
client [72] (testset)   loss: 1.2248 -> 1.1706  accuracy: 84.79% -> 85.38%     
client [1]  (testset)   loss: 0.9124 -> 0.9074  accuracy: 87.95% -> 89.66%     
client [78] (testset)   loss: 0.8483 -> 0.7518  accuracy: 87.89% -> 89.99%     
client [83] (testset)   loss: 1.0333 -> 0.9887  accuracy: 87.89% -> 89.78%     
client [21] (testset)   loss: 0.6824 -> 0.6935  accuracy: 91.53% -> 92.40%     
client [56] (testset)   loss: 1.1392 -> 1.1227  accuracy: 87.75% -> 87.93%     
client [44] (testset)   loss: 1.7851 -> 1.7533  accuracy: 79.18% -> 79.52%     
client [92] (testset)   loss: 0.8412 -> 0.8199  accuracy: 91.71% -> 91.96%     
client [27] (testset)   loss: 0.8146 -> 0.8065  accuracy: 92.26% -> 92.92%     
---------------------------- TRAINING EPOCH: 400 ----------------------------  
client [10] (testset)   loss: 1.1079 -> 1.0447  accuracy: 88.46% -> 88.93%     
client [39] (testset)   loss: 1.3913 -> 1.3282  accuracy: 84.35% -> 84.70%     
client [65] (testset)   loss: 1.6786 -> 1.4848  accuracy: 82.39% -> 83.87%     
client [26] (testset)   loss: 1.0200 -> 0.9772  accuracy: 86.87% -> 88.57%     
client [19] (testset)   loss: 1.0436 -> 1.0254  accuracy: 89.67% -> 90.22%     
client [68] (testset)   loss: 0.9056 -> 0.8928  accuracy: 90.46% -> 90.21%     
client [41] (testset)   loss: 1.7201 -> 1.7358  accuracy: 82.79% -> 82.79%     
client [50] (testset)   loss: 0.8633 -> 0.8747  accuracy: 88.95% -> 88.95%     
client [75] (testset)   loss: 1.0647 -> 1.0425  accuracy: 86.54% -> 87.24%     
client [81] (testset)   loss: 1.6638 -> 1.5262  accuracy: 82.37% -> 83.59%     
Training... ---------------------------------------- 100% 2:37:18
PSFL's average time taken by each global epoch: 0 min 23.47 sec.               
PSFL's total running time: 2 h 37 m 18 s.                                      
==================== PSFL Experiment Results: ====================             
Display format: (before local fine-tuning) -> (after local fine-tuning)        
 So if finetune_epoch = 0, x.xx% -> 0.00% is normal.                           
 Centralized testing ONLY happens after model aggregation, so the stats between
'->' are the same.                                                             
{                                                                              
    "100": {                                                                   
        "all_clients": {                                                       
            "test": {                                                          
                "loss": "0.5328 -> 0.0000",                                    
                "accuracy": "86.23% -> 0.00%"                                  
            }                                                                  
        }                                                                      
    },                                                                         
    "200": {                                                                   
        "all_clients": {                                                       
            "test": {                                                          
                "loss": "0.7281 -> 0.0000",                                    
                "accuracy": "86.83% -> 0.00%"                                  
            }                                                                  
        }                                                                      
    },                                                                         
    "300": {                                                                   
        "all_clients": {                                                       
            "test": {                                                          
                "loss": "0.9220 -> 0.0000",                                    
                "accuracy": "87.44% -> 0.00%"                                  
            }                                                                  
        }                                                                      
    },                                                                         
    "400": {                                                                   
        "all_clients": {                                                       
            "test": {                                                          
                "loss": "1.1083 -> 0.0000",                                    
                "accuracy": "87.80% -> 0.00%"                                  
            }                                                                  
        }                                                                      
    }                                                                          
}                                                                              
==================== PSFL Max Accuracy ====================                    
all_clients:                                                                   
(test) before fine-tuning: 87.80% at epoch 400                                 
(test) after fine-tuning: 0.00% at epoch 100                                   
[0m