==================== PSFL ====================                                 
Experiment Arguments:                                                          
{
│   'method': 'psfl',
│   'dataset': {
│   │   'name': 'svhn',
│   │   'client_num': 100,
│   │   'test_ratio': 0.25,
│   │   'val_ratio': 0.0,
│   │   'seed': 42,
│   │   'split': 'sample',
│   │   'IID_ratio': 0.0,
│   │   'monitor_window_name_suffix': 'svhn-100clients-0%IID-Dir(0.5)-seed42',
│   │   'alpha': 0.5,
│   │   'min_samples_per_client': 10
│   },
│   'model': {
│   │   'name': 'avgcnn',
│   │   'use_torchvision_pretrained_weights': True,
│   │   'external_model_weights_path': None
│   },
│   'optimizer': {
│   │   'lr': 0.01,
│   │   'dampening': 0,
│   │   'weight_decay': 0,
│   │   'momentum': 0,
│   │   'nesterov': False,
│   │   'name': 'sgd'
│   },
│   'mode': 'sequential',
│   'parallel': {
│   │   'ray_cluster_addr': None,
│   │   'num_cpus': None,
│   │   'num_gpus': None,
│   │   'num_workers': 2
│   },
│   'common': {
│   │   'seed': 42,
│   │   'join_ratio': 0.1,
│   │   'global_epoch': 400,
│   │   'local_epoch': 5,
│   │   'batch_size': 32,
│   │   'reset_optimizer_on_global_epoch': True,
│   │   'straggler_ratio': 0,
│   │   'straggler_min_local_epoch': 0,
│   │   'buffers': 'global',
│   │   'client_side_evaluation': True,
│   │   'test': {
│   │   │   'client': {
│   │   │   │   'interval': 100,
│   │   │   │   'finetune_epoch': 0,
│   │   │   │   'train': False,
│   │   │   │   'val': False,
│   │   │   │   'test': True
│   │   │   },
│   │   │   'server': {
│   │   │   │   'interval': -1,
│   │   │   │   'train': False,
│   │   │   │   'val': False,
│   │   │   │   'test': False,
│   │   │   │   'model_in_train_mode': False
│   │   │   }
│   │   },
│   │   'verbose_gap': 10,
│   │   'monitor': None,
│   │   'use_cuda': True,
│   │   'save_log': True,
│   │   'save_model': False,
│   │   'save_learning_curve_plot': False,
│   │   'save_metrics': True,
│   │   'delete_useless_run': True
│   },
│   'psfl': {
│   │   'alpha': 0.0,
│   │   'CLS': False,
│   │   'ig_ratio': 0.9997,
│   │   'track': False
│   }
}
---------------------------- TRAINING EPOCH: 10 ----------------------------   
client [77] (testset)   loss: 0.6373 -> 0.4905  accuracy: 81.90% -> 84.91%     
client [81] (testset)   loss: 0.7361 -> 0.5545  accuracy: 82.56% -> 85.64%     
client [21] (testset)   loss: 0.7764 -> 0.3872  accuracy: 81.09% -> 88.36%     
client [68] (testset)   loss: 0.7301 -> 0.3628  accuracy: 81.36% -> 90.13%     
client [93] (testset)   loss: 1.1600 -> 0.3577  accuracy: 67.40% -> 90.75%     
client [31] (testset)   loss: 1.5351 -> 0.4188  accuracy: 62.95% -> 89.77%     
client [20] (testset)   loss: 1.1178 -> 0.5084  accuracy: 76.29% -> 84.54%     
client [59] (testset)   loss: 0.6449 -> 0.3491  accuracy: 82.41% -> 90.95%     
client [48] (testset)   loss: 0.7125 -> 0.5184  accuracy: 84.59% -> 87.97%     
client [34] (testset)   loss: 1.2194 -> 0.7188  accuracy: 69.30% -> 78.95%     
---------------------------- TRAINING EPOCH: 20 ----------------------------   
client [69] (testset)   loss: 0.7056 -> 0.3655  accuracy: 83.81% -> 86.67%     
client [99] (testset)   loss: 0.5832 -> 0.3310  accuracy: 85.49% -> 93.73%     
client [67] (testset)   loss: 1.0550 -> 0.2020  accuracy: 75.00% -> 92.16%     
client [0]  (testset)   loss: 1.1313 -> 0.4536  accuracy: 71.28% -> 87.23%     
client [76] (testset)   loss: 0.4465 -> 0.3210  accuracy: 88.04% -> 92.02%     
client [41] (testset)   loss: 0.7336 -> 0.2464  accuracy: 82.12% -> 90.51%     
client [62] (testset)   loss: 0.8972 -> 0.4666  accuracy: 78.76% -> 86.79%     
client [2]  (testset)   loss: 0.4161 -> 0.2479  accuracy: 85.91% -> 92.28%     
client [14] (testset)   loss: 0.5211 -> 0.3728  accuracy: 87.73% -> 92.53%     
client [46] (testset)   loss: 0.9151 -> 0.3612  accuracy: 71.58% -> 87.37%     
---------------------------- TRAINING EPOCH: 30 ----------------------------   
client [24] (testset)   loss: 0.3096 -> 0.3325  accuracy: 94.81% -> 94.44%     
client [68] (testset)   loss: 0.5626 -> 0.3911  accuracy: 91.24% -> 92.77%     
client [57] (testset)   loss: 0.8510 -> 0.5923  accuracy: 86.08% -> 88.35%     
client [17] (testset)   loss: 0.4723 -> 0.2824  accuracy: 86.58% -> 92.62%     
client [54] (testset)   loss: 0.7524 -> 0.3521  accuracy: 79.89% -> 91.85%     
client [23] (testset)   loss: 0.8606 -> 0.4700  accuracy: 76.52% -> 90.87%     
client [35] (testset)   loss: 1.3590 -> 0.4262  accuracy: 72.84% -> 88.89%     
client [59] (testset)   loss: 0.6794 -> 0.3160  accuracy: 83.42% -> 91.46%     
client [31] (testset)   loss: 1.2032 -> 0.2894  accuracy: 72.95% -> 93.86%     
client [9]  (testset)   loss: 0.9190 -> 0.3915  accuracy: 79.02% -> 89.27%     
---------------------------- TRAINING EPOCH: 40 ----------------------------   
client [64] (testset)   loss: 0.4451 -> 0.3872  accuracy: 90.17% -> 89.74%     
client [33] (testset)   loss: 0.8885 -> 0.4459  accuracy: 83.75% -> 90.00%     
client [16] (testset)   loss: 0.6139 -> 0.3470  accuracy: 87.64% -> 92.70%     
client [44] (testset)   loss: 0.7744 -> 0.4061  accuracy: 83.57% -> 91.58%     
client [8]  (testset)   loss: 0.5365 -> 0.2233  accuracy: 90.77% -> 96.41%     
client [31] (testset)   loss: 0.8580 -> 0.2736  accuracy: 81.59% -> 94.55%     
client [47] (testset)   loss: 0.7514 -> 0.3400  accuracy: 85.98% -> 92.80%     
client [36] (testset)   loss: 0.6743 -> 0.5725  accuracy: 86.27% -> 86.27%     
client [20] (testset)   loss: 0.7087 -> 0.3300  accuracy: 87.63% -> 94.85%     
client [56] (testset)   loss: 0.7765 -> 0.4627  accuracy: 82.59% -> 86.07%     
---------------------------- TRAINING EPOCH: 50 ----------------------------   
client [4]  (testset)   loss: 0.6232 -> 0.4053  accuracy: 86.76% -> 92.24%     
client [60] (testset)   loss: 0.6958 -> 0.3209  accuracy: 84.30% -> 91.93%     
client [28] (testset)   loss: 0.5581 -> 0.5454  accuracy: 88.81% -> 87.31%     
client [25] (testset)   loss: 0.5369 -> 0.5005  accuracy: 86.51% -> 88.10%     
client [58] (testset)   loss: 0.6997 -> 0.3859  accuracy: 84.55% -> 92.12%     
client [44] (testset)   loss: 0.6198 -> 0.4186  accuracy: 85.63% -> 91.99%     
client [39] (testset)   loss: 0.7929 -> 0.5170  accuracy: 84.41% -> 88.17%     
client [29] (testset)   loss: 0.6124 -> 0.4913  accuracy: 86.67% -> 91.43%     
client [3]  (testset)   loss: 1.0466 -> 0.5232  accuracy: 82.35% -> 89.54%     
client [84] (testset)   loss: 0.7731 -> 0.5053  accuracy: 86.88% -> 93.00%     
---------------------------- TRAINING EPOCH: 60 ----------------------------   
client [21] (testset)   loss: 0.7719 -> 0.3362  accuracy: 81.82% -> 90.55%     
client [84] (testset)   loss: 0.7470 -> 0.5014  accuracy: 86.30% -> 93.59%     
client [10] (testset)   loss: 0.3918 -> 0.2134  accuracy: 91.71% -> 94.82%     
client [36] (testset)   loss: 0.9135 -> 0.6242  accuracy: 88.24% -> 92.16%     
client [65] (testset)   loss: 0.5135 -> 0.4086  accuracy: 88.35% -> 89.85%     
client [81] (testset)   loss: 0.8181 -> 0.6976  accuracy: 85.64% -> 88.21%     
client [79] (testset)   loss: 0.5971 -> 0.5688  accuracy: 87.93% -> 91.38%     
client [42] (testset)   loss: 0.5086 -> 0.3819  accuracy: 91.11% -> 92.38%     
client [11] (testset)   loss: 0.5127 -> 0.3913  accuracy: 89.51% -> 92.79%     
client [96] (testset)   loss: 0.4705 -> 0.3852  accuracy: 87.90% -> 91.13%     
---------------------------- TRAINING EPOCH: 70 ----------------------------   
client [8]  (testset)   loss: 0.5441 -> 0.3509  accuracy: 92.82% -> 93.85%     
client [53] (testset)   loss: 0.5339 -> 0.4185  accuracy: 89.83% -> 93.22%     
client [52] (testset)   loss: 0.9295 -> 0.3817  accuracy: 81.27% -> 91.75%     
client [42] (testset)   loss: 0.6560 -> 0.3584  accuracy: 88.25% -> 91.11%     
client [69] (testset)   loss: 1.0825 -> 0.7147  accuracy: 81.90% -> 86.67%     
client [59] (testset)   loss: 0.6247 -> 0.3702  accuracy: 89.95% -> 94.97%     
client [7]  (testset)   loss: 0.8507 -> 0.4689  accuracy: 85.50% -> 90.50%     
client [26] (testset)   loss: 0.7549 -> 0.3140  accuracy: 87.02% -> 92.98%     
client [49] (testset)   loss: 0.3987 -> 0.2114  accuracy: 87.86% -> 94.22%     
client [98] (testset)   loss: 0.5900 -> 0.3448  accuracy: 87.23% -> 92.34%     
---------------------------- TRAINING EPOCH: 80 ----------------------------   
client [98] (testset)   loss: 0.5650 -> 0.3560  accuracy: 88.51% -> 92.34%     
client [47] (testset)   loss: 0.5790 -> 0.3272  accuracy: 89.96% -> 93.18%     
client [21] (testset)   loss: 1.1934 -> 0.3592  accuracy: 77.45% -> 91.64%     
client [77] (testset)   loss: 0.9346 -> 0.4956  accuracy: 79.74% -> 89.66%     
client [95] (testset)   loss: 0.5317 -> 0.3782  accuracy: 91.39% -> 94.36%     
client [91] (testset)   loss: 0.8329 -> 0.7467  accuracy: 84.88% -> 83.72%     
client [14] (testset)   loss: 0.5804 -> 0.4168  accuracy: 90.93% -> 94.67%     
client [99] (testset)   loss: 0.4169 -> 0.3619  accuracy: 92.55% -> 94.12%     
client [20] (testset)   loss: 0.7128 -> 0.4608  accuracy: 89.69% -> 92.27%     
client [39] (testset)   loss: 0.9937 -> 0.5697  accuracy: 83.33% -> 90.86%     
---------------------------- TRAINING EPOCH: 90 ----------------------------   
client [52] (testset)   loss: 0.8215 -> 0.4895  accuracy: 87.30% -> 90.48%     
client [62] (testset)   loss: 0.9322 -> 0.5902  accuracy: 84.11% -> 90.47%     
client [71] (testset)   loss: 0.7794 -> 0.7705  accuracy: 89.82% -> 90.42%     
client [97] (testset)   loss: 0.7803 -> 0.6590  accuracy: 84.35% -> 88.26%     
client [30] (testset)   loss: 1.1048 -> 0.4758  accuracy: 85.02% -> 94.79%     
client [88] (testset)   loss: 0.8888 -> 0.6529  accuracy: 89.64% -> 91.43%     
client [60] (testset)   loss: 0.4371 -> 0.4123  accuracy: 88.34% -> 91.03%     
client [82] (testset)   loss: 0.8564 -> 0.4217  accuracy: 82.09% -> 88.81%     
client [91] (testset)   loss: 0.8585 -> 0.7609  accuracy: 88.95% -> 88.95%     
client [57] (testset)   loss: 0.7163 -> 0.7185  accuracy: 89.49% -> 90.91%     
---------------------------- TRAINING EPOCH: 100 ----------------------------  
client [31] (testset)   loss: 0.6087 -> 0.3720  accuracy: 91.14% -> 94.09%     
client [15] (testset)   loss: 1.0288 -> 0.7037  accuracy: 87.33% -> 91.64%     
client [71] (testset)   loss: 0.8295 -> 0.7985  accuracy: 86.83% -> 90.42%     
client [97] (testset)   loss: 0.6712 -> 0.5921  accuracy: 86.09% -> 90.43%     
client [53] (testset)   loss: 0.9333 -> 0.4440  accuracy: 86.44% -> 92.66%     
client [77] (testset)   loss: 0.5833 -> 0.5435  accuracy: 88.79% -> 91.81%     
client [76] (testset)   loss: 0.5886 -> 0.3738  accuracy: 91.72% -> 92.33%     
client [79] (testset)   loss: 0.7680 -> 0.7163  accuracy: 89.66% -> 90.23%     
client [28] (testset)   loss: 0.4543 -> 0.4859  accuracy: 91.79% -> 91.04%     
client [99] (testset)   loss: 0.4681 -> 0.4123  accuracy: 92.55% -> 94.12%     
---------------------------- TRAINING EPOCH: 110 ----------------------------  
client [97] (testset)   loss: 1.0154 -> 0.5591  accuracy: 82.61% -> 88.70%     
client [86] (testset)   loss: 0.4272 -> 0.4343  accuracy: 91.22% -> 91.98%     
client [34] (testset)   loss: 0.9554 -> 0.8835  accuracy: 79.82% -> 81.58%     
client [73] (testset)   loss: 0.2645 -> 0.2450  accuracy: 93.58% -> 95.27%     
client [5]  (testset)   loss: 1.3349 -> 0.7143  accuracy: 89.19% -> 90.54%     
client [96] (testset)   loss: 0.7042 -> 0.5666  accuracy: 90.73% -> 93.15%     
client [22] (testset)   loss: 0.4036 -> 0.4362  accuracy: 93.18% -> 91.82%     
client [60] (testset)   loss: 0.4780 -> 0.3890  accuracy: 89.24% -> 92.83%     
client [66] (testset)   loss: 0.4131 -> 0.3899  accuracy: 92.29% -> 94.78%     
client [83] (testset)   loss: 0.3043 -> 0.1599  accuracy: 91.00% -> 94.50%     
---------------------------- TRAINING EPOCH: 120 ----------------------------  
client [76] (testset)   loss: 0.6074 -> 0.4192  accuracy: 91.41% -> 92.94%     
client [65] (testset)   loss: 0.5298 -> 0.4217  accuracy: 88.35% -> 89.47%     
client [95] (testset)   loss: 0.5040 -> 0.4431  accuracy: 94.07% -> 94.66%     
client [17] (testset)   loss: 0.3095 -> 0.2467  accuracy: 91.28% -> 91.95%     
client [8]  (testset)   loss: 0.4261 -> 0.3213  accuracy: 94.87% -> 95.90%     
client [35] (testset)   loss: 0.5509 -> 0.3808  accuracy: 89.51% -> 91.98%     
client [98] (testset)   loss: 0.7235 -> 0.4768  accuracy: 87.23% -> 92.77%     
client [53] (testset)   loss: 0.5613 -> 0.4658  accuracy: 91.53% -> 92.66%     
client [43] (testset)   loss: 1.6504 -> 1.2852  accuracy: 85.81% -> 89.86%     
client [64] (testset)   loss: 0.4338 -> 0.2759  accuracy: 89.74% -> 93.16%     
---------------------------- TRAINING EPOCH: 130 ----------------------------  
client [21] (testset)   loss: 0.5986 -> 0.3978  accuracy: 88.36% -> 92.36%     
client [88] (testset)   loss: 1.0699 -> 0.8522  accuracy: 87.86% -> 90.71%     
client [38] (testset)   loss: 0.6995 -> 0.6452  accuracy: 89.52% -> 89.98%     
client [3]  (testset)   loss: 0.8854 -> 0.7423  accuracy: 89.54% -> 92.16%     
client [5]  (testset)   loss: 0.8141 -> 0.6673  accuracy: 90.54% -> 91.89%     
client [41] (testset)   loss: 0.3866 -> 0.2753  accuracy: 92.34% -> 93.07%     
client [7]  (testset)   loss: 1.1738 -> 0.7480  accuracy: 89.50% -> 90.50%     
client [37] (testset)   loss: 0.7525 -> 0.7886  accuracy: 89.53% -> 89.53%     
client [45] (testset)   loss: 1.1154 -> 0.8523  accuracy: 85.06% -> 89.21%     
client [47] (testset)   loss: 0.5065 -> 0.3862  accuracy: 91.86% -> 92.99%     
---------------------------- TRAINING EPOCH: 140 ----------------------------  
client [16] (testset)   loss: 0.7480 -> 0.4875  accuracy: 90.45% -> 91.01%     
client [11] (testset)   loss: 0.5270 -> 0.4624  accuracy: 92.13% -> 92.79%     
client [37] (testset)   loss: 0.9429 -> 0.8166  accuracy: 86.39% -> 87.43%     
client [41] (testset)   loss: 0.4107 -> 0.3336  accuracy: 93.80% -> 94.16%     
client [95] (testset)   loss: 0.4769 -> 0.4214  accuracy: 95.25% -> 95.25%     
client [53] (testset)   loss: 0.4429 -> 0.4182  accuracy: 93.22% -> 92.66%     
client [22] (testset)   loss: 0.5981 -> 0.5549  accuracy: 90.00% -> 90.91%     
client [25] (testset)   loss: 0.6885 -> 0.6098  accuracy: 88.49% -> 89.29%     
client [69] (testset)   loss: 1.0061 -> 0.9917  accuracy: 87.62% -> 88.57%     
client [46] (testset)   loss: 0.4909 -> 0.4806  accuracy: 91.58% -> 91.58%     
---------------------------- TRAINING EPOCH: 150 ----------------------------  
client [47] (testset)   loss: 0.4836 -> 0.4553  accuracy: 93.94% -> 93.94%     
client [69] (testset)   loss: 1.1836 -> 1.1626  accuracy: 84.76% -> 85.71%     
client [82] (testset)   loss: 0.4817 -> 0.4745  accuracy: 92.54% -> 93.28%     
client [45] (testset)   loss: 0.9559 -> 0.9463  accuracy: 88.80% -> 90.46%     
client [7]  (testset)   loss: 1.4829 -> 0.7902  accuracy: 87.00% -> 91.50%     
client [50] (testset)   loss: 0.8462 -> 0.7324  accuracy: 88.96% -> 88.96%     
client [35] (testset)   loss: 0.6906 -> 0.5393  accuracy: 90.74% -> 92.59%     
client [24] (testset)   loss: 0.3973 -> 0.3537  accuracy: 96.30% -> 95.19%     
client [15] (testset)   loss: 0.7995 -> 0.7197  accuracy: 90.03% -> 89.76%     
client [58] (testset)   loss: 0.5280 -> 0.5472  accuracy: 92.42% -> 91.21%     
---------------------------- TRAINING EPOCH: 160 ----------------------------  
client [48] (testset)   loss: 0.6603 -> 0.6597  accuracy: 90.98% -> 91.73%     
client [76] (testset)   loss: 0.6857 -> 0.5706  accuracy: 92.02% -> 91.72%     
client [67] (testset)   loss: 0.2720 -> 0.2232  accuracy: 94.61% -> 95.59%     
client [37] (testset)   loss: 0.8079 -> 0.7776  accuracy: 89.53% -> 88.48%     
client [58] (testset)   loss: 0.6740 -> 0.6211  accuracy: 90.91% -> 91.52%     
client [64] (testset)   loss: 0.3134 -> 0.2845  accuracy: 93.16% -> 94.44%     
client [77] (testset)   loss: 0.7564 -> 0.7086  accuracy: 90.09% -> 90.09%     
client [55] (testset)   loss: 0.4366 -> 0.3803  accuracy: 91.22% -> 92.68%     
client [12] (testset)   loss: 0.4707 -> 0.4458  accuracy: 95.38% -> 95.60%     
client [89] (testset)   loss: 0.5315 -> 0.4310  accuracy: 91.49% -> 92.91%     
---------------------------- TRAINING EPOCH: 170 ----------------------------  
client [84] (testset)   loss: 0.8407 -> 0.7290  accuracy: 90.38% -> 92.42%     
client [51] (testset)   loss: 0.3667 -> 0.3558  accuracy: 93.33% -> 93.33%     
client [8]  (testset)   loss: 0.4253 -> 0.4065  accuracy: 95.38% -> 94.87%     
client [18] (testset)   loss: 1.1532 -> 1.1492  accuracy: 89.60% -> 89.11%     
client [94] (testset)   loss: 0.3499 -> 0.3426  accuracy: 94.61% -> 94.01%     
client [81] (testset)   loss: 1.2725 -> 1.1893  accuracy: 86.67% -> 89.23%     
client [3]  (testset)   loss: 0.7310 -> 0.7633  accuracy: 92.81% -> 93.46%     
client [11] (testset)   loss: 0.5795 -> 0.5879  accuracy: 93.11% -> 92.46%     
client [95] (testset)   loss: 0.4774 -> 0.4757  accuracy: 94.96% -> 94.96%     
client [67] (testset)   loss: 0.3018 -> 0.2118  accuracy: 94.61% -> 95.10%     
---------------------------- TRAINING EPOCH: 180 ----------------------------  
client [21] (testset)   loss: 0.4857 -> 0.4677  accuracy: 89.82% -> 91.64%     
client [79] (testset)   loss: 0.9328 -> 0.8931  accuracy: 89.66% -> 90.80%     
client [58] (testset)   loss: 0.5803 -> 0.5576  accuracy: 91.82% -> 92.42%     
client [88] (testset)   loss: 1.0238 -> 0.9370  accuracy: 92.14% -> 92.14%     
client [46] (testset)   loss: 0.5303 -> 0.4883  accuracy: 91.05% -> 93.16%     
client [11] (testset)   loss: 0.6171 -> 0.5926  accuracy: 92.46% -> 92.46%     
client [55] (testset)   loss: 0.4486 -> 0.4380  accuracy: 93.17% -> 92.68%     
client [13] (testset)   loss: 0.4398 -> 0.3870  accuracy: 93.72% -> 93.72%     
client [31] (testset)   loss: 0.5244 -> 0.4707  accuracy: 92.05% -> 92.95%     
client [75] (testset)   loss: 1.0563 -> 1.0064  accuracy: 90.83% -> 89.58%     
---------------------------- TRAINING EPOCH: 190 ----------------------------  
client [19] (testset)   loss: 0.2459 -> 0.2318  accuracy: 94.05% -> 93.25%     
client [7]  (testset)   loss: 1.0751 -> 0.9779  accuracy: 90.50% -> 91.50%     
client [57] (testset)   loss: 0.9864 -> 0.9640  accuracy: 89.77% -> 91.48%     
client [13] (testset)   loss: 0.4897 -> 0.4484  accuracy: 93.19% -> 93.72%     
client [43] (testset)   loss: 1.6112 -> 1.5852  accuracy: 87.16% -> 88.51%     
client [91] (testset)   loss: 1.1838 -> 1.0767  accuracy: 86.05% -> 86.63%     
client [10] (testset)   loss: 0.5135 -> 0.4919  accuracy: 93.78% -> 93.78%     
client [64] (testset)   loss: 0.4349 -> 0.3934  accuracy: 91.88% -> 91.88%     
client [82] (testset)   loss: 0.7327 -> 0.7447  accuracy: 91.04% -> 91.04%     
client [22] (testset)   loss: 0.6156 -> 0.6557  accuracy: 92.27% -> 93.18%     
---------------------------- TRAINING EPOCH: 200 ----------------------------  
client [20] (testset)   loss: 0.6344 -> 0.6375  accuracy: 92.78% -> 93.30%     
client [23] (testset)   loss: 0.9838 -> 0.9557  accuracy: 90.43% -> 91.30%     
client [88] (testset)   loss: 1.0828 -> 1.1038  accuracy: 91.79% -> 92.50%     
client [98] (testset)   loss: 0.5864 -> 0.5576  accuracy: 89.79% -> 91.91%     
client [79] (testset)   loss: 1.0129 -> 1.0052  accuracy: 90.80% -> 90.80%     
client [21] (testset)   loss: 0.6044 -> 0.5356  accuracy: 90.91% -> 90.91%     
client [92] (testset)   loss: 1.2337 -> 1.1759  accuracy: 91.03% -> 91.72%     
client [56] (testset)   loss: 0.7387 -> 0.7706  accuracy: 86.07% -> 87.06%     
client [5]  (testset)   loss: 1.3576 -> 1.2838  accuracy: 90.54% -> 90.54%     
client [52] (testset)   loss: 0.6875 -> 0.6544  accuracy: 90.48% -> 91.75%     
---------------------------- TRAINING EPOCH: 210 ----------------------------  
client [67] (testset)   loss: 0.4685 -> 0.3313  accuracy: 94.12% -> 95.59%     
client [54] (testset)   loss: 0.4694 -> 0.4161  accuracy: 92.39% -> 92.93%     
client [14] (testset)   loss: 0.7411 -> 0.6954  accuracy: 93.87% -> 94.67%     
client [99] (testset)   loss: 0.4710 -> 0.4831  accuracy: 94.90% -> 94.90%     
client [36] (testset)   loss: 1.0192 -> 1.0303  accuracy: 88.24% -> 90.20%     
client [30] (testset)   loss: 0.7387 -> 0.7166  accuracy: 94.46% -> 94.46%     
client [38] (testset)   loss: 0.7829 -> 0.8521  accuracy: 90.43% -> 89.98%     
client [15] (testset)   loss: 1.0005 -> 0.8913  accuracy: 89.76% -> 90.84%     
client [6]  (testset)   loss: 1.1844 -> 1.2356  accuracy: 88.32% -> 88.79%     
client [53] (testset)   loss: 0.7455 -> 0.7400  accuracy: 92.66% -> 93.22%     
---------------------------- TRAINING EPOCH: 220 ----------------------------  
client [99] (testset)   loss: 0.4689 -> 0.4643  accuracy: 95.29% -> 94.90%     
client [6]  (testset)   loss: 1.3227 -> 1.3372  accuracy: 87.38% -> 87.38%     
client [83] (testset)   loss: 0.3568 -> 0.3521  accuracy: 94.00% -> 95.00%     
client [42] (testset)   loss: 0.5682 -> 0.5614  accuracy: 91.75% -> 91.11%     
client [34] (testset)   loss: 1.1061 -> 1.1399  accuracy: 85.09% -> 84.21%     
client [15] (testset)   loss: 0.9763 -> 0.9702  accuracy: 90.30% -> 90.30%     
client [47] (testset)   loss: 0.5460 -> 0.5306  accuracy: 94.13% -> 93.75%     
client [55] (testset)   loss: 0.4159 -> 0.3996  accuracy: 93.17% -> 92.68%     
client [51] (testset)   loss: 0.3320 -> 0.3170  accuracy: 93.33% -> 93.33%     
client [95] (testset)   loss: 0.5128 -> 0.5085  accuracy: 94.96% -> 94.96%     
---------------------------- TRAINING EPOCH: 230 ----------------------------  
client [71] (testset)   loss: 1.3172 -> 1.3108  accuracy: 87.43% -> 88.02%     
client [15] (testset)   loss: 0.9268 -> 0.9114  accuracy: 91.37% -> 91.91%     
client [33] (testset)   loss: 1.4319 -> 1.5069  accuracy: 87.50% -> 86.25%     
client [99] (testset)   loss: 0.5234 -> 0.5135  accuracy: 94.51% -> 93.73%     
client [90] (testset)   loss: 0.9425 -> 0.9595  accuracy: 90.75% -> 90.75%     
client [57] (testset)   loss: 1.0164 -> 1.0284  accuracy: 91.48% -> 91.76%     
client [27] (testset)   loss: 0.3756 -> 0.3712  accuracy: 94.09% -> 95.07%     
client [78] (testset)   loss: 0.6002 -> 0.6034  accuracy: 93.18% -> 93.75%     
client [36] (testset)   loss: 1.0084 -> 1.0038  accuracy: 88.24% -> 88.24%     
client [88] (testset)   loss: 1.2224 -> 1.2040  accuracy: 91.79% -> 91.79%     
---------------------------- TRAINING EPOCH: 240 ----------------------------  
client [70] (testset)   loss: 0.3998 -> 0.3782  accuracy: 94.61% -> 94.61%     
client [35] (testset)   loss: 0.6171 -> 0.6122  accuracy: 93.83% -> 93.83%     
client [16] (testset)   loss: 0.6723 -> 0.6705  accuracy: 91.57% -> 91.57%     
client [80] (testset)   loss: 0.8363 -> 0.8502  accuracy: 91.75% -> 91.75%     
client [38] (testset)   loss: 0.8978 -> 0.8870  accuracy: 90.89% -> 90.89%     
client [78] (testset)   loss: 0.6317 -> 0.6319  accuracy: 94.03% -> 94.03%     
client [68] (testset)   loss: 0.6161 -> 0.6244  accuracy: 93.88% -> 94.44%     
client [11] (testset)   loss: 0.6663 -> 0.6643  accuracy: 92.13% -> 92.46%     
client [64] (testset)   loss: 0.4489 -> 0.4274  accuracy: 93.59% -> 93.16%     
client [82] (testset)   loss: 0.7291 -> 0.7315  accuracy: 91.04% -> 91.04%     
---------------------------- TRAINING EPOCH: 250 ----------------------------  
client [30] (testset)   loss: 0.7893 -> 0.7837  accuracy: 94.14% -> 94.14%     
client [27] (testset)   loss: 0.3779 -> 0.3813  accuracy: 94.09% -> 94.58%     
client [74] (testset)   loss: 0.9365 -> 0.9354  accuracy: 93.57% -> 93.98%     
client [45] (testset)   loss: 1.1072 -> 1.1066  accuracy: 88.80% -> 88.38%     
client [6]  (testset)   loss: 1.3525 -> 1.3579  accuracy: 88.79% -> 88.79%     
client [36] (testset)   loss: 1.0384 -> 1.0365  accuracy: 90.20% -> 90.20%     
client [63] (testset)   loss: 0.7883 -> 0.7879  accuracy: 92.83% -> 92.83%     
client [76] (testset)   loss: 0.6382 -> 0.6405  accuracy: 93.25% -> 92.94%     
client [83] (testset)   loss: 0.3946 -> 0.3992  accuracy: 95.00% -> 94.50%     
client [86] (testset)   loss: 0.5682 -> 0.5669  accuracy: 93.51% -> 92.37%     
---------------------------- TRAINING EPOCH: 260 ----------------------------  
client [83] (testset)   loss: 0.3955 -> 0.4011  accuracy: 96.00% -> 96.00%     
client [99] (testset)   loss: 0.5283 -> 0.5264  accuracy: 94.51% -> 94.51%     
client [74] (testset)   loss: 0.9169 -> 0.9118  accuracy: 93.98% -> 94.38%     
client [73] (testset)   loss: 0.4192 -> 0.3959  accuracy: 94.26% -> 94.26%     
client [29] (testset)   loss: 0.9792 -> 0.9642  accuracy: 89.52% -> 89.52%     
client [92] (testset)   loss: 1.2372 -> 1.2374  accuracy: 91.03% -> 91.03%     
client [6]  (testset)   loss: 1.4855 -> 1.4789  accuracy: 87.38% -> 87.38%     
client [61] (testset)   loss: 0.7183 -> 0.7093  accuracy: 91.59% -> 92.48%     
client [21] (testset)   loss: 0.5589 -> 0.5103  accuracy: 91.27% -> 91.27%     
client [67] (testset)   loss: 0.3345 -> 0.3079  accuracy: 94.61% -> 94.61%     
---------------------------- TRAINING EPOCH: 270 ----------------------------  
client [83] (testset)   loss: 0.4287 -> 0.4258  accuracy: 95.50% -> 95.50%     
client [32] (testset)   loss: 1.1968 -> 1.1570  accuracy: 86.76% -> 86.76%     
client [95] (testset)   loss: 0.5706 -> 0.5711  accuracy: 94.36% -> 94.36%     
client [61] (testset)   loss: 0.7232 -> 0.7240  accuracy: 91.59% -> 92.04%     
client [27] (testset)   loss: 0.4074 -> 0.4112  accuracy: 94.58% -> 94.58%     
client [25] (testset)   loss: 0.8472 -> 0.8232  accuracy: 90.08% -> 90.48%     
client [68] (testset)   loss: 0.6807 -> 0.6634  accuracy: 93.60% -> 94.44%     
client [34] (testset)   loss: 1.2469 -> 1.2361  accuracy: 85.09% -> 85.09%     
client [71] (testset)   loss: 1.3273 -> 1.3291  accuracy: 88.62% -> 88.62%     
client [89] (testset)   loss: 0.4862 -> 0.4748  accuracy: 92.20% -> 92.20%     
---------------------------- TRAINING EPOCH: 280 ----------------------------  
client [78] (testset)   loss: 0.6709 -> 0.6691  accuracy: 94.03% -> 93.47%     
client [81] (testset)   loss: 1.2860 -> 1.2753  accuracy: 90.26% -> 90.26%     
client [51] (testset)   loss: 0.4004 -> 0.4008  accuracy: 89.33% -> 89.33%     
client [54] (testset)   loss: 0.4699 -> 0.4715  accuracy: 92.93% -> 92.39%     
client [65] (testset)   loss: 0.6477 -> 0.6249  accuracy: 90.60% -> 90.98%     
client [41] (testset)   loss: 0.3357 -> 0.3368  accuracy: 93.80% -> 93.80%     
client [11] (testset)   loss: 0.6678 -> 0.6794  accuracy: 92.13% -> 92.13%     
client [85] (testset)   loss: 0.6029 -> 0.5974  accuracy: 92.12% -> 92.12%     
client [12] (testset)   loss: 0.5178 -> 0.4971  accuracy: 96.04% -> 95.60%     
client [23] (testset)   loss: 1.1071 -> 1.0996  accuracy: 90.43% -> 90.43%     
---------------------------- TRAINING EPOCH: 290 ----------------------------  
client [16] (testset)   loss: 0.6998 -> 0.7023  accuracy: 92.13% -> 92.13%     
client [65] (testset)   loss: 0.6269 -> 0.6225  accuracy: 90.98% -> 90.98%     
client [53] (testset)   loss: 0.6745 -> 0.6745  accuracy: 94.35% -> 94.35%     
client [58] (testset)   loss: 0.6767 -> 0.6821  accuracy: 91.82% -> 91.82%     
client [72] (testset)   loss: 0.7761 -> 0.7794  accuracy: 90.30% -> 90.30%     
client [7]  (testset)   loss: 1.0887 -> 1.0771  accuracy: 91.50% -> 91.00%     
client [71] (testset)   loss: 1.3747 -> 1.3769  accuracy: 88.02% -> 88.62%     
client [59] (testset)   loss: 0.7700 -> 0.7591  accuracy: 94.47% -> 94.47%     
client [86] (testset)   loss: 0.5922 -> 0.5936  accuracy: 92.37% -> 92.37%     
client [39] (testset)   loss: 1.0697 -> 1.0558  accuracy: 87.63% -> 87.63%     
---------------------------- TRAINING EPOCH: 300 ----------------------------  
client [99] (testset)   loss: 0.5837 -> 0.5805  accuracy: 94.12% -> 94.51%     
client [7]  (testset)   loss: 1.0976 -> 1.0970  accuracy: 90.00% -> 90.00%     
client [17] (testset)   loss: 0.4569 -> 0.4515  accuracy: 93.96% -> 93.96%     
client [64] (testset)   loss: 0.3942 -> 0.3939  accuracy: 92.31% -> 92.31%     
client [37] (testset)   loss: 0.9217 -> 0.9184  accuracy: 89.01% -> 89.01%     
client [29] (testset)   loss: 1.1284 -> 1.1275  accuracy: 89.52% -> 89.52%     
client [93] (testset)   loss: 0.7506 -> 0.7479  accuracy: 94.65% -> 94.65%     
client [73] (testset)   loss: 0.4334 -> 0.4148  accuracy: 93.24% -> 93.92%     
client [40] (testset)   loss: 0.8201 -> 0.8059  accuracy: 92.23% -> 92.23%     
client [76] (testset)   loss: 0.7304 -> 0.7119  accuracy: 93.87% -> 92.94%     
---------------------------- TRAINING EPOCH: 310 ----------------------------  
client [31] (testset)   loss: 0.6870 -> 0.6800  accuracy: 93.41% -> 93.41%     
client [89] (testset)   loss: 0.4899 -> 0.4852  accuracy: 91.49% -> 91.49%     
client [77] (testset)   loss: 1.0160 -> 1.0060  accuracy: 90.95% -> 90.95%     
client [90] (testset)   loss: 1.1465 -> 1.1429  accuracy: 91.34% -> 91.34%     
client [26] (testset)   loss: 0.5759 -> 0.5654  accuracy: 92.98% -> 92.98%     
client [50] (testset)   loss: 0.8094 -> 0.8080  accuracy: 92.21% -> 92.21%     
client [30] (testset)   loss: 0.7852 -> 0.7889  accuracy: 93.81% -> 93.81%     
client [70] (testset)   loss: 0.4777 -> 0.4604  accuracy: 94.61% -> 94.61%     
client [41] (testset)   loss: 0.3993 -> 0.3950  accuracy: 94.16% -> 94.16%     
client [99] (testset)   loss: 0.5793 -> 0.5772  accuracy: 93.73% -> 94.12%     
---------------------------- TRAINING EPOCH: 320 ----------------------------  
client [68] (testset)   loss: 0.6827 -> 0.6763  accuracy: 94.02% -> 94.16%     
client [70] (testset)   loss: 0.4598 -> 0.4557  accuracy: 95.10% -> 95.10%     
client [52] (testset)   loss: 0.7556 -> 0.7497  accuracy: 90.16% -> 89.84%     
client [1]  (testset)   loss: 1.2530 -> 1.2571  accuracy: 93.06% -> 93.06%     
client [2]  (testset)   loss: 0.5563 -> 0.5447  accuracy: 92.95% -> 92.95%     
client [67] (testset)   loss: 0.4172 -> 0.3754  accuracy: 94.12% -> 94.61%     
client [92] (testset)   loss: 1.4208 -> 1.4024  accuracy: 91.03% -> 91.03%     
client [35] (testset)   loss: 0.7845 -> 0.7819  accuracy: 93.21% -> 93.21%     
client [36] (testset)   loss: 1.0010 -> 0.9997  accuracy: 92.16% -> 92.16%     
client [64] (testset)   loss: 0.4220 -> 0.4193  accuracy: 93.59% -> 93.59%     
---------------------------- TRAINING EPOCH: 330 ----------------------------  
client [44] (testset)   loss: 0.7162 -> 0.7130  accuracy: 92.20% -> 91.99%     
client [6]  (testset)   loss: 1.6073 -> 1.5996  accuracy: 88.32% -> 88.79%     
client [12] (testset)   loss: 0.5055 -> 0.5051  accuracy: 96.26% -> 96.26%     
client [55] (testset)   loss: 0.5129 -> 0.5103  accuracy: 92.20% -> 92.20%     
client [29] (testset)   loss: 1.2236 -> 1.2126  accuracy: 89.52% -> 89.52%     
client [9]  (testset)   loss: 0.9832 -> 0.9819  accuracy: 91.22% -> 91.22%     
client [43] (testset)   loss: 1.9940 -> 1.9952  accuracy: 88.51% -> 88.51%     
client [77] (testset)   loss: 1.0111 -> 1.0132  accuracy: 91.38% -> 91.38%     
client [98] (testset)   loss: 0.6648 -> 0.6569  accuracy: 91.91% -> 92.34%     
client [78] (testset)   loss: 0.7020 -> 0.7002  accuracy: 93.47% -> 93.47%     
---------------------------- TRAINING EPOCH: 340 ----------------------------  
client [92] (testset)   loss: 1.3857 -> 1.3782  accuracy: 91.03% -> 91.03%     
client [80] (testset)   loss: 0.8707 -> 0.8855  accuracy: 91.75% -> 91.75%     
client [63] (testset)   loss: 0.8779 -> 0.8770  accuracy: 92.83% -> 92.83%     
client [76] (testset)   loss: 0.7754 -> 0.7654  accuracy: 93.25% -> 92.94%     
client [78] (testset)   loss: 0.7077 -> 0.7079  accuracy: 93.18% -> 93.47%     
client [25] (testset)   loss: 0.9086 -> 0.9080  accuracy: 89.68% -> 89.68%     
client [58] (testset)   loss: 0.7038 -> 0.7074  accuracy: 92.42% -> 92.12%     
client [13] (testset)   loss: 0.4709 -> 0.4688  accuracy: 93.72% -> 94.24%     
client [17] (testset)   loss: 0.4720 -> 0.4710  accuracy: 93.96% -> 93.96%     
client [38] (testset)   loss: 0.9888 -> 0.9822  accuracy: 90.43% -> 90.66%     
---------------------------- TRAINING EPOCH: 350 ----------------------------  
client [72] (testset)   loss: 0.8358 -> 0.8358  accuracy: 90.30% -> 90.67%     
client [82] (testset)   loss: 0.8416 -> 0.8424  accuracy: 91.04% -> 91.04%     
client [86] (testset)   loss: 0.5864 -> 0.5908  accuracy: 92.37% -> 92.37%     
client [51] (testset)   loss: 0.4071 -> 0.4050  accuracy: 90.67% -> 90.67%     
client [96] (testset)   loss: 0.7373 -> 0.7391  accuracy: 92.74% -> 93.15%     
client [42] (testset)   loss: 0.7161 -> 0.7161  accuracy: 92.06% -> 92.06%     
client [55] (testset)   loss: 0.5286 -> 0.5275  accuracy: 92.20% -> 92.20%     
client [13] (testset)   loss: 0.4937 -> 0.4917  accuracy: 93.72% -> 93.72%     
client [1]  (testset)   loss: 1.2990 -> 1.2983  accuracy: 92.36% -> 92.36%     
client [12] (testset)   loss: 0.5231 -> 0.5186  accuracy: 96.26% -> 96.04%     
---------------------------- TRAINING EPOCH: 360 ----------------------------  
client [68] (testset)   loss: 0.6915 -> 0.6860  accuracy: 94.02% -> 94.30%     
client [23] (testset)   loss: 1.1574 -> 1.1535  accuracy: 90.87% -> 91.30%     
client [46] (testset)   loss: 0.5247 -> 0.5258  accuracy: 93.68% -> 93.16%     
client [41] (testset)   loss: 0.4166 -> 0.4139  accuracy: 94.16% -> 94.53%     
client [25] (testset)   loss: 0.9430 -> 0.9272  accuracy: 90.48% -> 90.48%     
client [58] (testset)   loss: 0.7071 -> 0.7129  accuracy: 92.73% -> 92.73%     
client [14] (testset)   loss: 0.8478 -> 0.8420  accuracy: 94.13% -> 94.40%     
client [33] (testset)   loss: 1.4050 -> 1.4197  accuracy: 88.75% -> 88.75%     
client [85] (testset)   loss: 0.6057 -> 0.6061  accuracy: 91.70% -> 91.29%     
client [62] (testset)   loss: 1.0738 -> 1.0707  accuracy: 89.13% -> 89.46%     
---------------------------- TRAINING EPOCH: 370 ----------------------------  
client [98] (testset)   loss: 0.6677 -> 0.6629  accuracy: 91.06% -> 92.34%     
client [63] (testset)   loss: 0.9092 -> 0.9073  accuracy: 92.83% -> 92.83%     
client [70] (testset)   loss: 0.4467 -> 0.4469  accuracy: 96.08% -> 96.08%     
client [65] (testset)   loss: 0.6628 -> 0.6600  accuracy: 90.60% -> 90.60%     
client [14] (testset)   loss: 0.8532 -> 0.8487  accuracy: 94.40% -> 94.40%     
client [73] (testset)   loss: 0.4964 -> 0.4765  accuracy: 93.24% -> 93.24%     
client [34] (testset)   loss: 1.3375 -> 1.3348  accuracy: 86.84% -> 86.84%     
client [99] (testset)   loss: 0.6136 -> 0.6123  accuracy: 94.12% -> 94.51%     
client [69] (testset)   loss: 1.5375 -> 1.5348  accuracy: 89.52% -> 89.52%     
client [46] (testset)   loss: 0.5273 -> 0.5288  accuracy: 93.68% -> 93.16%     
---------------------------- TRAINING EPOCH: 380 ----------------------------  
client [99] (testset)   loss: 0.6144 -> 0.6143  accuracy: 94.12% -> 94.12%     
client [93] (testset)   loss: 0.8151 -> 0.7951  accuracy: 93.67% -> 94.40%     
client [11] (testset)   loss: 0.7067 -> 0.7101  accuracy: 92.79% -> 92.79%     
client [58] (testset)   loss: 0.7298 -> 0.7321  accuracy: 92.12% -> 92.12%     
client [81] (testset)   loss: 1.4173 -> 1.4151  accuracy: 90.26% -> 90.26%     
client [85] (testset)   loss: 0.6199 -> 0.6148  accuracy: 92.12% -> 91.70%     
client [89] (testset)   loss: 0.4977 -> 0.4932  accuracy: 92.91% -> 92.20%     
client [45] (testset)   loss: 1.2363 -> 1.2288  accuracy: 90.04% -> 90.04%     
client [8]  (testset)   loss: 0.5660 -> 0.5670  accuracy: 94.87% -> 94.87%     
client [68] (testset)   loss: 0.6946 -> 0.6921  accuracy: 94.02% -> 94.02%     
---------------------------- TRAINING EPOCH: 390 ----------------------------  
client [67] (testset)   loss: 0.4227 -> 0.3986  accuracy: 94.61% -> 94.61%     
client [72] (testset)   loss: 0.8418 -> 0.8447  accuracy: 90.67% -> 90.67%     
client [1]  (testset)   loss: 1.3255 -> 1.3276  accuracy: 92.36% -> 93.06%     
client [78] (testset)   loss: 0.7132 -> 0.7140  accuracy: 93.75% -> 93.75%     
client [83] (testset)   loss: 0.4851 -> 0.4847  accuracy: 95.00% -> 95.00%     
client [21] (testset)   loss: 0.6393 -> 0.6355  accuracy: 89.82% -> 89.82%     
client [56] (testset)   loss: 0.9302 -> 0.9331  accuracy: 86.07% -> 86.57%     
client [44] (testset)   loss: 0.7327 -> 0.7296  accuracy: 91.79% -> 91.79%     
client [92] (testset)   loss: 1.4447 -> 1.4356  accuracy: 91.03% -> 91.03%     
client [27] (testset)   loss: 0.4584 -> 0.4587  accuracy: 95.07% -> 95.07%     
---------------------------- TRAINING EPOCH: 400 ----------------------------  
client [10] (testset)   loss: 0.5767 -> 0.5760  accuracy: 93.26% -> 93.26%     
client [39] (testset)   loss: 1.1079 -> 1.1048  accuracy: 87.63% -> 87.63%     
client [65] (testset)   loss: 0.6723 -> 0.6693  accuracy: 90.23% -> 90.23%     
client [26] (testset)   loss: 0.6186 -> 0.6103  accuracy: 93.33% -> 93.33%     
client [19] (testset)   loss: 0.2486 -> 0.2468  accuracy: 94.05% -> 94.05%     
client [68] (testset)   loss: 0.6979 -> 0.6926  accuracy: 94.30% -> 94.16%     
client [41] (testset)   loss: 0.4310 -> 0.4283  accuracy: 94.16% -> 94.16%     
client [50] (testset)   loss: 0.8480 -> 0.8488  accuracy: 92.21% -> 92.21%     
client [75] (testset)   loss: 1.3671 -> 1.3634  accuracy: 90.00% -> 90.00%     
client [81] (testset)   loss: 1.4207 -> 1.4190  accuracy: 89.74% -> 89.74%     
Training... ---------------------------------------- 100% 0:23:55
PSFL's average time taken by each global epoch: 0 min 3.56 sec.                
PSFL's total running time: 0 h 23 m 55 s.                                      
==================== PSFL Experiment Results: ====================             
Display format: (before local fine-tuning) -> (after local fine-tuning)        
 So if finetune_epoch = 0, x.xx% -> 0.00% is normal.                           
 Centralized testing ONLY happens after model aggregation, so the stats between
'->' are the same.                                                             
{                                                                              
    "100": {                                                                   
        "all_clients": {                                                       
            "test": {                                                          
                "loss": "0.7032 -> 0.0000",                                    
                "accuracy": "89.27% -> 0.00%"                                  
            }                                                                  
        }                                                                      
    },                                                                         
    "200": {                                                                   
        "all_clients": {                                                       
            "test": {                                                          
                "loss": "0.6917 -> 0.0000",                                    
                "accuracy": "92.09% -> 0.00%"                                  
            }                                                                  
        }                                                                      
    },                                                                         
    "300": {                                                                   
        "all_clients": {                                                       
            "test": {                                                          
                "loss": "0.7919 -> 0.0000",                                    
                "accuracy": "92.29% -> 0.00%"                                  
            }                                                                  
        }                                                                      
    },                                                                         
    "400": {                                                                   
        "all_clients": {                                                       
            "test": {                                                          
                "loss": "0.8352 -> 0.0000",                                    
                "accuracy": "92.27% -> 0.00%"                                  
            }                                                                  
        }                                                                      
    }                                                                          
}                                                                              
==================== PSFL Max Accuracy ====================                    
all_clients:                                                                   
(test) before fine-tuning: 92.29% at epoch 300                                 
(test) after fine-tuning: 0.00% at epoch 100                                   
[0m