==================== SFL ====================                                  
Experiment Arguments:                                                          
{
│   'method': 'sfl',
│   'dataset': {
│   │   'name': 'fmnist',
│   │   'client_num': 100,
│   │   'test_ratio': 0.25,
│   │   'val_ratio': 0.0,
│   │   'seed': 42,
│   │   'split': 'sample',
│   │   'IID_ratio': 0.0,
│   │   'monitor_window_name_suffix': 'fmnist-100clients-0%IID-Dir(0.5)-seed42',
│   │   'alpha': 0.5,
│   │   'min_samples_per_client': 10
│   },
│   'model': {
│   │   'name': 'avgcnn',
│   │   'use_torchvision_pretrained_weights': True,
│   │   'external_model_weights_path': None
│   },
│   'optimizer': {
│   │   'lr': 0.01,
│   │   'dampening': 0,
│   │   'weight_decay': 0,
│   │   'momentum': 0,
│   │   'nesterov': False,
│   │   'name': 'sgd'
│   },
│   'mode': 'sequential',
│   'parallel': {
│   │   'ray_cluster_addr': None,
│   │   'num_cpus': None,
│   │   'num_gpus': None,
│   │   'num_workers': 2
│   },
│   'common': {
│   │   'seed': 42,
│   │   'join_ratio': 0.1,
│   │   'global_epoch': 400,
│   │   'local_epoch': 5,
│   │   'batch_size': 32,
│   │   'reset_optimizer_on_global_epoch': True,
│   │   'straggler_ratio': 0,
│   │   'straggler_min_local_epoch': 0,
│   │   'buffers': 'global',
│   │   'client_side_evaluation': True,
│   │   'test': {
│   │   │   'client': {
│   │   │   │   'interval': 100,
│   │   │   │   'finetune_epoch': 0,
│   │   │   │   'train': False,
│   │   │   │   'val': False,
│   │   │   │   'test': True
│   │   │   },
│   │   │   'server': {
│   │   │   │   'interval': -1,
│   │   │   │   'train': False,
│   │   │   │   'val': False,
│   │   │   │   'test': False,
│   │   │   │   'model_in_train_mode': False
│   │   │   }
│   │   },
│   │   'verbose_gap': 10,
│   │   'monitor': None,
│   │   'use_cuda': True,
│   │   'save_log': True,
│   │   'save_model': False,
│   │   'save_learning_curve_plot': False,
│   │   'save_metrics': True,
│   │   'delete_useless_run': True
│   }
}
---------------------------- TRAINING EPOCH: 10 ----------------------------   
client [77] (testset)   loss: 0.4829 -> 0.2494  accuracy: 77.14% -> 91.43%     
client [81] (testset)   loss: 0.2732 -> 0.1372  accuracy: 88.14% -> 96.61%     
client [21] (testset)   loss: 0.9698 -> 0.3126  accuracy: 64.15% -> 88.68%     
client [68] (testset)   loss: 0.8888 -> 0.3348  accuracy: 61.80% -> 89.13%     
client [93] (testset)   loss: 0.8543 -> 0.6236  accuracy: 70.28% -> 75.17%     
client [31] (testset)   loss: 0.2807 -> 0.2347  accuracy: 88.59% -> 91.95%     
client [20] (testset)   loss: 0.2827 -> 0.1456  accuracy: 89.39% -> 95.10%     
client [59] (testset)   loss: 0.5424 -> 0.3427  accuracy: 81.48% -> 90.74%     
client [48] (testset)   loss: 1.3607 -> 0.5441  accuracy: 69.11% -> 80.49%     
client [34] (testset)   loss: 0.5940 -> 0.2066  accuracy: 82.51% -> 92.35%     
---------------------------- TRAINING EPOCH: 20 ----------------------------   
client [69] (testset)   loss: 0.2621 -> 0.2743  accuracy: 90.48% -> 91.16%     
client [99] (testset)   loss: 0.1308 -> 0.1083  accuracy: 95.19% -> 96.15%     
client [67] (testset)   loss: 0.4492 -> 0.1584  accuracy: 85.28% -> 94.81%     
client [0]  (testset)   loss: 0.3729 -> 0.3041  accuracy: 85.89% -> 89.21%     
client [76] (testset)   loss: 1.0041 -> 0.2923  accuracy: 62.21% -> 89.31%     
client [41] (testset)   loss: 0.8170 -> 0.0901  accuracy: 73.66% -> 97.56%     
client [62] (testset)   loss: 0.3852 -> 0.1315  accuracy: 85.50% -> 96.18%     
client [2]  (testset)   loss: 0.4983 -> 0.2440  accuracy: 84.31% -> 93.46%     
client [14] (testset)   loss: 0.4029 -> 0.1642  accuracy: 82.57% -> 94.19%     
client [46] (testset)   loss: 0.4048 -> 0.2353  accuracy: 84.64% -> 90.85%     
---------------------------- TRAINING EPOCH: 30 ----------------------------   
client [24] (testset)   loss: 0.1689 -> 0.1661  accuracy: 94.59% -> 94.14%     
client [68] (testset)   loss: 0.2804 -> 0.3637  accuracy: 90.37% -> 86.96%     
client [57] (testset)   loss: 0.7653 -> 0.1306  accuracy: 80.00% -> 96.61%     
client [17] (testset)   loss: 0.3820 -> 0.2402  accuracy: 89.04% -> 93.15%     
client [54] (testset)   loss: 0.5544 -> 0.3127  accuracy: 82.99% -> 88.14%     
client [23] (testset)   loss: 0.9909 -> 0.5226  accuracy: 77.14% -> 87.14%     
client [35] (testset)   loss: 0.2319 -> 0.1323  accuracy: 92.90% -> 94.19%     
client [59] (testset)   loss: 0.1813 -> 0.1388  accuracy: 94.44% -> 95.37%     
client [31] (testset)   loss: 0.4397 -> 0.1767  accuracy: 84.56% -> 93.29%     
client [9]  (testset)   loss: 0.1461 -> 0.1047  accuracy: 95.19% -> 96.79%     
---------------------------- TRAINING EPOCH: 40 ----------------------------   
client [64] (testset)   loss: 0.3680 -> 0.1483  accuracy: 89.54% -> 95.40%     
client [33] (testset)   loss: 0.4781 -> 0.3484  accuracy: 84.30% -> 88.43%     
client [16] (testset)   loss: 0.4997 -> 0.2955  accuracy: 84.96% -> 93.23%     
client [44] (testset)   loss: 0.8597 -> 0.3906  accuracy: 76.45% -> 87.53%     
client [8]  (testset)   loss: 0.2268 -> 0.1494  accuracy: 92.16% -> 95.10%     
client [31] (testset)   loss: 0.2842 -> 0.1971  accuracy: 89.93% -> 91.28%     
client [47] (testset)   loss: 0.8737 -> 0.1870  accuracy: 73.61% -> 93.98%     
client [36] (testset)   loss: 0.3493 -> 0.0921  accuracy: 87.10% -> 96.77%     
client [20] (testset)   loss: 0.3181 -> 0.1342  accuracy: 91.02% -> 96.33%     
client [56] (testset)   loss: 0.5667 -> 0.3365  accuracy: 81.12% -> 90.31%     
---------------------------- TRAINING EPOCH: 50 ----------------------------   
client [4]  (testset)   loss: 1.6033 -> 0.4301  accuracy: 62.90% -> 88.71%     
client [60] (testset)   loss: 0.3745 -> 0.1151  accuracy: 89.33% -> 94.00%     
client [28] (testset)   loss: 0.4980 -> 0.2978  accuracy: 85.65% -> 90.58%     
client [25] (testset)   loss: 0.6836 -> 0.2333  accuracy: 81.68% -> 93.51%     
client [58] (testset)   loss: 0.5741 -> 0.3289  accuracy: 81.22% -> 87.85%     
client [44] (testset)   loss: 0.6119 -> 0.3974  accuracy: 82.27% -> 87.81%     
client [39] (testset)   loss: 0.2085 -> 0.2974  accuracy: 94.78% -> 91.79%     
client [29] (testset)   loss: 0.4934 -> 0.2819  accuracy: 83.33% -> 90.56%     
client [3]  (testset)   loss: 0.3000 -> 0.2198  accuracy: 92.31% -> 93.59%     
client [84] (testset)   loss: 0.2417 -> 0.2169  accuracy: 93.30% -> 95.88%     
---------------------------- TRAINING EPOCH: 60 ----------------------------   
client [21] (testset)   loss: 0.8345 -> 0.3258  accuracy: 77.36% -> 91.19%     
client [84] (testset)   loss: 0.6055 -> 0.2497  accuracy: 82.99% -> 92.78%     
client [10] (testset)   loss: 0.5425 -> 0.2196  accuracy: 89.93% -> 96.40%     
client [36] (testset)   loss: 0.3229 -> 0.0943  accuracy: 88.94% -> 97.24%     
client [65] (testset)   loss: 0.6571 -> 0.1731  accuracy: 83.09% -> 94.85%     
client [81] (testset)   loss: 0.2822 -> 0.0663  accuracy: 91.53% -> 96.61%     
client [79] (testset)   loss: 0.4137 -> 0.2660  accuracy: 87.01% -> 87.01%     
client [42] (testset)   loss: 1.1406 -> 0.2021  accuracy: 73.13% -> 94.71%     
client [11] (testset)   loss: 0.2823 -> 0.1194  accuracy: 93.45% -> 98.21%     
client [96] (testset)   loss: 0.3279 -> 0.2738  accuracy: 90.39% -> 93.01%     
---------------------------- TRAINING EPOCH: 70 ----------------------------   
client [8]  (testset)   loss: 1.2431 -> 0.1935  accuracy: 78.43% -> 94.12%     
client [53] (testset)   loss: 0.6223 -> 0.3191  accuracy: 80.15% -> 91.18%     
client [52] (testset)   loss: 0.1898 -> 0.0904  accuracy: 92.00% -> 96.00%     
client [42] (testset)   loss: 0.4493 -> 0.2357  accuracy: 88.55% -> 92.51%     
client [69] (testset)   loss: 0.4442 -> 0.2971  accuracy: 87.76% -> 91.84%     
client [59] (testset)   loss: 0.3301 -> 0.2083  accuracy: 89.81% -> 94.44%     
client [7]  (testset)   loss: 0.2700 -> 0.1882  accuracy: 93.83% -> 95.06%     
client [26] (testset)   loss: 0.4762 -> 0.1295  accuracy: 89.61% -> 96.10%     
client [49] (testset)   loss: 0.9921 -> 0.3889  accuracy: 76.55% -> 87.59%     
client [98] (testset)   loss: 0.1408 -> 0.1197  accuracy: 96.22% -> 96.91%     
---------------------------- TRAINING EPOCH: 80 ----------------------------   
client [98] (testset)   loss: 0.1848 -> 0.1256  accuracy: 95.88% -> 96.56%     
client [47] (testset)   loss: 0.5541 -> 0.2629  accuracy: 86.11% -> 93.52%     
client [21] (testset)   loss: 1.1181 -> 0.2736  accuracy: 77.99% -> 91.19%     
client [77] (testset)   loss: 0.4735 -> 0.2474  accuracy: 89.14% -> 94.29%     
client [95] (testset)   loss: 0.9331 -> 0.4088  accuracy: 83.81% -> 92.38%     
client [91] (testset)   loss: 0.4012 -> 0.1797  accuracy: 89.87% -> 96.20%     
client [14] (testset)   loss: 0.3005 -> 0.1697  accuracy: 90.87% -> 92.12%     
client [99] (testset)   loss: 0.1132 -> 0.0857  accuracy: 95.19% -> 96.15%     
client [20] (testset)   loss: 0.2305 -> 0.1070  accuracy: 93.06% -> 97.14%     
client [39] (testset)   loss: 0.3914 -> 0.3955  accuracy: 91.04% -> 92.54%     
---------------------------- TRAINING EPOCH: 90 ----------------------------   
client [52] (testset)   loss: 0.1205 -> 0.0967  accuracy: 96.00% -> 96.67%     
client [62] (testset)   loss: 0.1509 -> 0.0869  accuracy: 94.66% -> 97.71%     
client [71] (testset)   loss: 0.4009 -> 0.2679  accuracy: 90.62% -> 90.62%     
client [97] (testset)   loss: 0.2729 -> 0.1738  accuracy: 92.98% -> 94.74%     
client [30] (testset)   loss: 0.2743 -> 0.2959  accuracy: 92.31% -> 91.21%     
client [88] (testset)   loss: 0.3917 -> 0.3325  accuracy: 91.95% -> 93.29%     
client [60] (testset)   loss: 0.1770 -> 0.0951  accuracy: 94.00% -> 96.00%     
client [82] (testset)   loss: 0.6564 -> 0.2417  accuracy: 83.90% -> 94.49%     
client [91] (testset)   loss: 0.8459 -> 0.1356  accuracy: 82.91% -> 97.47%     
client [57] (testset)   loss: 0.2506 -> 0.1214  accuracy: 93.22% -> 96.61%     
---------------------------- TRAINING EPOCH: 100 ----------------------------  
client [31] (testset)   loss: 0.2738 -> 0.2300  accuracy: 89.93% -> 91.28%     
client [15] (testset)   loss: 0.2718 -> 0.1166  accuracy: 93.18% -> 96.21%     
client [71] (testset)   loss: 0.2763 -> 0.2762  accuracy: 93.75% -> 93.75%     
client [97] (testset)   loss: 0.2273 -> 0.1780  accuracy: 93.86% -> 92.98%     
client [53] (testset)   loss: 0.5334 -> 0.3748  accuracy: 86.03% -> 90.44%     
client [77] (testset)   loss: 0.6388 -> 0.3086  accuracy: 86.29% -> 93.71%     
client [76] (testset)   loss: 0.5699 -> 0.2158  accuracy: 85.50% -> 93.51%     
client [79] (testset)   loss: 1.1648 -> 0.3521  accuracy: 72.08% -> 85.71%     
client [28] (testset)   loss: 0.5925 -> 0.3268  accuracy: 82.51% -> 91.03%     
client [99] (testset)   loss: 0.4624 -> 0.0895  accuracy: 85.58% -> 94.23%     
---------------------------- TRAINING EPOCH: 110 ----------------------------  
client [97] (testset)   loss: 0.4125 -> 0.1631  accuracy: 89.47% -> 93.86%     
client [86] (testset)   loss: 0.5406 -> 0.4840  accuracy: 87.77% -> 89.52%     
client [34] (testset)   loss: 0.4870 -> 0.2571  accuracy: 89.62% -> 92.90%     
client [73] (testset)   loss: 0.5104 -> 0.2940  accuracy: 89.59% -> 92.31%     
client [5]  (testset)   loss: 0.3225 -> 0.2590  accuracy: 92.88% -> 93.22%     
client [96] (testset)   loss: 0.5538 -> 0.2855  accuracy: 87.77% -> 94.32%     
client [22] (testset)   loss: 0.3866 -> 0.3626  accuracy: 90.24% -> 93.50%     
client [60] (testset)   loss: 1.1783 -> 0.0820  accuracy: 72.67% -> 95.33%     
client [66] (testset)   loss: 0.5963 -> 0.1360  accuracy: 84.96% -> 98.23%     
client [83] (testset)   loss: 0.2987 -> 0.2074  accuracy: 92.94% -> 92.94%     
---------------------------- TRAINING EPOCH: 120 ----------------------------  
client [76] (testset)   loss: 0.4679 -> 0.2142  accuracy: 88.17% -> 94.27%     
client [65] (testset)   loss: 0.8806 -> 0.2909  accuracy: 84.56% -> 91.91%     
client [95] (testset)   loss: 0.5298 -> 0.4524  accuracy: 87.62% -> 92.38%     
client [17] (testset)   loss: 0.3972 -> 0.2866  accuracy: 92.47% -> 92.47%     
client [8]  (testset)   loss: 0.4972 -> 0.1636  accuracy: 91.18% -> 96.08%     
client [35] (testset)   loss: 0.2528 -> 0.0819  accuracy: 91.61% -> 96.77%     
client [98] (testset)   loss: 0.1568 -> 0.1185  accuracy: 96.91% -> 96.56%     
client [53] (testset)   loss: 0.5282 -> 0.4202  accuracy: 88.24% -> 88.97%     
client [43] (testset)   loss: 0.6372 -> 0.2907  accuracy: 87.61% -> 93.12%     
client [64] (testset)   loss: 0.2965 -> 0.1879  accuracy: 92.89% -> 93.72%     
---------------------------- TRAINING EPOCH: 130 ----------------------------  
client [21] (testset)   loss: 1.0883 -> 0.4399  accuracy: 77.36% -> 88.68%     
client [88] (testset)   loss: 0.4456 -> 0.3711  accuracy: 87.25% -> 92.62%     
client [38] (testset)   loss: 0.7803 -> 0.1457  accuracy: 84.46% -> 95.61%     
client [3]  (testset)   loss: 0.2368 -> 0.2084  accuracy: 95.51% -> 96.79%     
client [5]  (testset)   loss: 0.5921 -> 0.2525  accuracy: 88.47% -> 93.56%     
client [41] (testset)   loss: 0.2010 -> 0.1162  accuracy: 94.63% -> 97.56%     
client [7]  (testset)   loss: 0.7811 -> 0.2047  accuracy: 83.13% -> 95.47%     
client [37] (testset)   loss: 0.4434 -> 0.2350  accuracy: 91.72% -> 94.08%     
client [45] (testset)   loss: 0.1830 -> 0.1309  accuracy: 95.56% -> 96.67%     
client [47] (testset)   loss: 2.6963 -> 0.1941  accuracy: 63.43% -> 94.91%     
---------------------------- TRAINING EPOCH: 140 ----------------------------  
client [16] (testset)   loss: 0.4050 -> 0.4094  accuracy: 91.73% -> 93.23%     
client [11] (testset)   loss: 0.1427 -> 0.1197  accuracy: 98.21% -> 98.81%     
client [37] (testset)   loss: 0.6646 -> 0.2485  accuracy: 82.25% -> 94.67%     
client [41] (testset)   loss: 0.2623 -> 0.1163  accuracy: 93.66% -> 98.05%     
client [95] (testset)   loss: 1.8067 -> 0.5132  accuracy: 73.33% -> 90.48%     
client [53] (testset)   loss: 0.4525 -> 0.3694  accuracy: 87.50% -> 91.18%     
client [22] (testset)   loss: 0.7685 -> 0.3922  accuracy: 83.74% -> 89.43%     
client [25] (testset)   loss: 0.5980 -> 0.2780  accuracy: 85.50% -> 93.13%     
client [69] (testset)   loss: 0.4847 -> 0.2773  accuracy: 86.39% -> 91.16%     
client [46] (testset)   loss: 0.3029 -> 0.2316  accuracy: 90.52% -> 94.77%     
---------------------------- TRAINING EPOCH: 150 ----------------------------  
client [47] (testset)   loss: 1.4855 -> 0.2066  accuracy: 71.30% -> 95.83%     
client [69] (testset)   loss: 0.7946 -> 0.3253  accuracy: 85.03% -> 91.84%     
client [82] (testset)   loss: 0.4668 -> 0.1951  accuracy: 88.14% -> 95.34%     
client [45] (testset)   loss: 0.7407 -> 0.1361  accuracy: 84.44% -> 96.67%     
client [7]  (testset)   loss: 0.3585 -> 0.2130  accuracy: 92.59% -> 96.71%     
client [50] (testset)   loss: 0.2377 -> 0.1647  accuracy: 95.36% -> 96.03%     
client [35] (testset)   loss: 0.2553 -> 0.1267  accuracy: 93.55% -> 95.48%     
client [24] (testset)   loss: 1.1499 -> 0.1890  accuracy: 77.93% -> 92.79%     
client [15] (testset)   loss: 0.4089 -> 0.1860  accuracy: 93.94% -> 96.21%     
client [58] (testset)   loss: 0.5724 -> 0.5490  accuracy: 88.95% -> 87.29%     
---------------------------- TRAINING EPOCH: 160 ----------------------------  
client [48] (testset)   loss: 1.5532 -> 0.7051  accuracy: 81.30% -> 88.62%     
client [76] (testset)   loss: 1.5672 -> 0.2821  accuracy: 74.43% -> 91.98%     
client [67] (testset)   loss: 0.2380 -> 0.1911  accuracy: 94.37% -> 94.81%     
client [37] (testset)   loss: 0.7895 -> 0.2777  accuracy: 85.21% -> 93.49%     
client [58] (testset)   loss: 1.4939 -> 0.5614  accuracy: 77.35% -> 87.29%     
client [64] (testset)   loss: 0.5025 -> 0.2278  accuracy: 89.12% -> 94.14%     
client [77] (testset)   loss: 0.8675 -> 0.3426  accuracy: 82.86% -> 93.14%     
client [55] (testset)   loss: 0.5258 -> 0.1951  accuracy: 88.32% -> 94.92%     
client [12] (testset)   loss: 0.3540 -> 0.2753  accuracy: 91.77% -> 93.67%     
client [89] (testset)   loss: 0.3073 -> 0.2106  accuracy: 95.68% -> 97.84%     
---------------------------- TRAINING EPOCH: 170 ----------------------------  
client [84] (testset)   loss: 1.0231 -> 0.2453  accuracy: 81.96% -> 95.88%     
client [51] (testset)   loss: 0.7568 -> 0.1253  accuracy: 80.99% -> 96.20%     
client [8]  (testset)   loss: 0.8683 -> 0.2191  accuracy: 84.31% -> 97.06%     
client [18] (testset)   loss: 0.3401 -> 0.2040  accuracy: 91.60% -> 96.18%     
client [94] (testset)   loss: 0.3075 -> 0.2078  accuracy: 93.79% -> 95.03%     
client [81] (testset)   loss: 0.0508 -> 0.0311  accuracy: 98.31% -> 98.31%     
client [3]  (testset)   loss: 0.3427 -> 0.2708  accuracy: 94.23% -> 96.15%     
client [11] (testset)   loss: 0.2317 -> 0.1439  accuracy: 94.64% -> 98.21%     
client [95] (testset)   loss: 0.7411 -> 0.5446  accuracy: 89.52% -> 93.33%     
client [67] (testset)   loss: 0.3796 -> 0.2036  accuracy: 90.48% -> 94.37%     
---------------------------- TRAINING EPOCH: 180 ----------------------------  
client [21] (testset)   loss: 1.1387 -> 0.4327  accuracy: 80.50% -> 89.31%     
client [79] (testset)   loss: 0.6282 -> 0.3728  accuracy: 81.17% -> 87.66%     
client [58] (testset)   loss: 0.7671 -> 0.6225  accuracy: 87.85% -> 88.40%     
client [88] (testset)   loss: 0.4702 -> 0.3903  accuracy: 90.60% -> 93.29%     
client [46] (testset)   loss: 0.4227 -> 0.2299  accuracy: 91.83% -> 94.77%     
client [11] (testset)   loss: 0.3313 -> 0.1433  accuracy: 94.64% -> 97.62%     
client [55] (testset)   loss: 0.6328 -> 0.2951  accuracy: 88.83% -> 93.40%     
client [13] (testset)   loss: 0.2384 -> 0.1989  accuracy: 95.54% -> 95.54%     
client [31] (testset)   loss: 0.2839 -> 0.2784  accuracy: 93.29% -> 92.62%     
client [75] (testset)   loss: 0.2207 -> 0.1697  accuracy: 97.12% -> 97.84%     
---------------------------- TRAINING EPOCH: 190 ----------------------------  
client [19] (testset)   loss: 0.2055 -> 0.1174  accuracy: 93.33% -> 95.56%     
client [7]  (testset)   loss: 0.8579 -> 0.2731  accuracy: 84.36% -> 96.30%     
client [57] (testset)   loss: 0.1527 -> 0.1040  accuracy: 96.95% -> 98.64%     
client [13] (testset)   loss: 0.1334 -> 0.1527  accuracy: 95.54% -> 95.98%     
client [43] (testset)   loss: 0.2942 -> 0.3395  accuracy: 94.04% -> 94.04%     
client [91] (testset)   loss: 0.2267 -> 0.1957  accuracy: 94.94% -> 96.20%     
client [10] (testset)   loss: 0.4146 -> 0.3217  accuracy: 95.68% -> 95.68%     
client [64] (testset)   loss: 0.3701 -> 0.2311  accuracy: 91.21% -> 92.89%     
client [82] (testset)   loss: 0.7324 -> 0.2242  accuracy: 85.17% -> 95.34%     
client [22] (testset)   loss: 1.2402 -> 0.5337  accuracy: 80.49% -> 88.62%     
---------------------------- TRAINING EPOCH: 200 ----------------------------  
client [20] (testset)   loss: 0.2748 -> 0.1489  accuracy: 94.69% -> 95.92%     
client [23] (testset)   loss: 0.5176 -> 0.4618  accuracy: 85.71% -> 87.14%     
client [88] (testset)   loss: 0.6063 -> 0.3958  accuracy: 87.92% -> 91.28%     
client [98] (testset)   loss: 0.2162 -> 0.1435  accuracy: 95.88% -> 96.56%     
client [79] (testset)   loss: 0.4464 -> 0.3226  accuracy: 87.66% -> 90.26%     
client [21] (testset)   loss: 1.2208 -> 0.4989  accuracy: 78.62% -> 90.57%     
client [92] (testset)   loss: 0.0415 -> 0.0328  accuracy: 98.15% -> 99.07%     
client [56] (testset)   loss: 0.5641 -> 0.4729  accuracy: 86.73% -> 89.80%     
client [5]  (testset)   loss: 0.3824 -> 0.3125  accuracy: 92.88% -> 94.58%     
client [52] (testset)   loss: 0.1715 -> 0.1059  accuracy: 96.67% -> 96.00%     
---------------------------- TRAINING EPOCH: 210 ----------------------------  
client [67] (testset)   loss: 0.3407 -> 0.1989  accuracy: 90.91% -> 95.24%     
client [54] (testset)   loss: 0.5913 -> 0.5484  accuracy: 87.63% -> 89.18%     
client [14] (testset)   loss: 0.7203 -> 0.3160  accuracy: 86.31% -> 91.70%     
client [99] (testset)   loss: 0.1178 -> 0.0941  accuracy: 95.19% -> 97.12%     
client [36] (testset)   loss: 0.1526 -> 0.1487  accuracy: 97.24% -> 97.70%     
client [30] (testset)   loss: 0.8406 -> 0.5213  accuracy: 83.52% -> 87.91%     
client [38] (testset)   loss: 0.3365 -> 0.1512  accuracy: 90.54% -> 96.28%     
client [15] (testset)   loss: 0.5437 -> 0.2252  accuracy: 92.42% -> 96.21%     
client [6]  (testset)   loss: 0.4531 -> 0.3499  accuracy: 92.31% -> 92.31%     
client [53] (testset)   loss: 0.6359 -> 0.4445  accuracy: 88.97% -> 91.18%     
---------------------------- TRAINING EPOCH: 220 ----------------------------  
client [99] (testset)   loss: 0.3439 -> 0.1058  accuracy: 92.31% -> 96.15%     
client [6]  (testset)   loss: 0.4308 -> 0.3718  accuracy: 92.31% -> 92.74%     
client [83] (testset)   loss: 0.4658 -> 0.2656  accuracy: 92.94% -> 92.94%     
client [42] (testset)   loss: 0.4302 -> 0.3160  accuracy: 91.19% -> 93.83%     
client [34] (testset)   loss: 0.6772 -> 0.2682  accuracy: 86.89% -> 93.99%     
client [15] (testset)   loss: 0.3029 -> 0.1639  accuracy: 95.45% -> 97.73%     
client [47] (testset)   loss: 0.7445 -> 0.2511  accuracy: 83.33% -> 95.37%     
client [55] (testset)   loss: 0.9036 -> 0.2268  accuracy: 81.73% -> 94.42%     
client [51] (testset)   loss: 1.2180 -> 0.1305  accuracy: 77.19% -> 96.20%     
client [95] (testset)   loss: 1.3370 -> 0.5440  accuracy: 84.76% -> 93.33%     
---------------------------- TRAINING EPOCH: 230 ----------------------------  
client [71] (testset)   loss: 0.3266 -> 0.3325  accuracy: 96.88% -> 96.88%     
client [15] (testset)   loss: 0.2294 -> 0.2070  accuracy: 96.21% -> 96.97%     
client [33] (testset)   loss: 1.4656 -> 0.5611  accuracy: 73.14% -> 90.08%     
client [99] (testset)   loss: 0.2659 -> 0.1412  accuracy: 93.27% -> 96.15%     
client [90] (testset)   loss: 0.9219 -> 0.2008  accuracy: 83.80% -> 96.65%     
client [57] (testset)   loss: 0.4607 -> 0.1311  accuracy: 91.86% -> 97.29%     
client [27] (testset)   loss: 0.3090 -> 0.0001  accuracy: 94.19% -> 100.00%    
client [78] (testset)   loss: 0.0602 -> 0.1499  accuracy: 98.41% -> 97.62%     
client [36] (testset)   loss: 0.1537 -> 0.1408  accuracy: 96.31% -> 98.16%     
client [88] (testset)   loss: 0.8899 -> 0.5372  accuracy: 86.58% -> 90.60%     
---------------------------- TRAINING EPOCH: 240 ----------------------------  
client [70] (testset)   loss: 0.4003 -> 0.3333  accuracy: 91.86% -> 94.19%     
client [35] (testset)   loss: 0.3276 -> 0.2264  accuracy: 92.90% -> 94.19%     
client [16] (testset)   loss: 0.5103 -> 0.4472  accuracy: 91.73% -> 92.48%     
client [80] (testset)   loss: 0.1974 -> 0.2367  accuracy: 95.28% -> 95.28%     
client [38] (testset)   loss: 0.4767 -> 0.1341  accuracy: 88.51% -> 96.28%     
client [78] (testset)   loss: 0.0954 -> 0.1751  accuracy: 98.41% -> 98.41%     
client [68] (testset)   loss: 0.6241 -> 0.5598  accuracy: 89.13% -> 89.75%     
client [11] (testset)   loss: 0.2273 -> 0.1317  accuracy: 94.64% -> 99.40%     
client [64] (testset)   loss: 0.4285 -> 0.2638  accuracy: 91.21% -> 93.72%     
client [82] (testset)   loss: 0.7779 -> 0.2719  accuracy: 83.90% -> 94.92%     
---------------------------- TRAINING EPOCH: 250 ----------------------------  
client [30] (testset)   loss: 0.6512 -> 0.5517  accuracy: 86.81% -> 87.91%     
client [27] (testset)   loss: 0.0728 -> 0.0020  accuracy: 96.51% -> 100.00%    
client [74] (testset)   loss: 0.5232 -> 0.2754  accuracy: 89.55% -> 94.63%     
client [45] (testset)   loss: 0.4889 -> 0.1739  accuracy: 87.78% -> 95.56%     
client [6]  (testset)   loss: 0.6077 -> 0.3866  accuracy: 89.74% -> 91.88%     
client [36] (testset)   loss: 0.1894 -> 0.1803  accuracy: 96.31% -> 96.77%     
client [63] (testset)   loss: 0.1579 -> 0.0758  accuracy: 96.97% -> 96.97%     
client [76] (testset)   loss: 0.6077 -> 0.3500  accuracy: 89.69% -> 92.37%     
client [83] (testset)   loss: 0.2102 -> 0.2249  accuracy: 95.29% -> 94.12%     
client [86] (testset)   loss: 0.7070 -> 0.6282  accuracy: 85.59% -> 88.65%     
---------------------------- TRAINING EPOCH: 260 ----------------------------  
client [83] (testset)   loss: 0.6139 -> 0.2859  accuracy: 88.24% -> 92.94%     
client [99] (testset)   loss: 0.3721 -> 0.1726  accuracy: 90.38% -> 94.23%     
client [74] (testset)   loss: 0.4763 -> 0.2912  accuracy: 91.94% -> 94.03%     
client [73] (testset)   loss: 0.5998 -> 0.3836  accuracy: 89.59% -> 92.76%     
client [29] (testset)   loss: 0.4207 -> 0.4323  accuracy: 90.56% -> 92.22%     
client [92] (testset)   loss: 0.0609 -> 0.0674  accuracy: 98.61% -> 98.61%     
client [6]  (testset)   loss: 0.4749 -> 0.3948  accuracy: 90.60% -> 92.31%     
client [61] (testset)   loss: 0.6218 -> 0.3915  accuracy: 87.86% -> 95.71%     
client [21] (testset)   loss: 1.2085 -> 0.6054  accuracy: 81.13% -> 89.31%     
client [67] (testset)   loss: 0.3091 -> 0.2098  accuracy: 92.21% -> 96.10%     
---------------------------- TRAINING EPOCH: 270 ----------------------------  
client [83] (testset)   loss: 0.6556 -> 0.3868  accuracy: 90.59% -> 94.12%     
client [32] (testset)   loss: 0.2344 -> 0.1921  accuracy: 95.50% -> 94.59%     
client [95] (testset)   loss: 0.7478 -> 0.5947  accuracy: 85.71% -> 90.48%     
client [61] (testset)   loss: 0.7789 -> 0.3847  accuracy: 84.29% -> 95.00%     
client [27] (testset)   loss: 0.0321 -> 0.0000  accuracy: 97.67% -> 100.00%    
client [25] (testset)   loss: 4.1789 -> 0.3134  accuracy: 55.34% -> 94.66%     
client [68] (testset)   loss: 0.5874 -> 0.5509  accuracy: 88.20% -> 90.68%     
client [34] (testset)   loss: 0.8608 -> 0.2689  accuracy: 82.51% -> 93.99%     
client [71] (testset)   loss: 0.7210 -> 0.4589  accuracy: 90.62% -> 90.62%     
client [89] (testset)   loss: 0.2776 -> 0.2056  accuracy: 96.40% -> 97.84%     
---------------------------- TRAINING EPOCH: 280 ----------------------------  
client [78] (testset)   loss: 0.2438 -> 0.1754  accuracy: 97.62% -> 97.62%     
client [81] (testset)   loss: 0.4819 -> 0.3843  accuracy: 91.53% -> 94.92%     
client [51] (testset)   loss: 0.6178 -> 0.1104  accuracy: 88.21% -> 97.34%     
client [54] (testset)   loss: 0.6602 -> 0.5571  accuracy: 86.60% -> 88.66%     
client [65] (testset)   loss: 0.4416 -> 0.3549  accuracy: 88.97% -> 93.38%     
client [41] (testset)   loss: 0.6868 -> 0.2138  accuracy: 87.80% -> 95.61%     
client [11] (testset)   loss: 0.2119 -> 0.1326  accuracy: 95.83% -> 99.40%     
client [85] (testset)   loss: 0.2364 -> 0.1797  accuracy: 94.57% -> 95.65%     
client [12] (testset)   loss: 0.5274 -> 0.3896  accuracy: 92.41% -> 92.41%     
client [23] (testset)   loss: 0.7957 -> 0.5580  accuracy: 81.43% -> 85.71%     
---------------------------- TRAINING EPOCH: 290 ----------------------------  
client [16] (testset)   loss: 0.4470 -> 0.3979  accuracy: 92.48% -> 92.48%     
client [65] (testset)   loss: 0.4184 -> 0.3360  accuracy: 88.97% -> 91.91%     
client [53] (testset)   loss: 0.5893 -> 0.5201  accuracy: 90.44% -> 89.71%     
client [58] (testset)   loss: 0.9272 -> 0.8061  accuracy: 83.98% -> 85.08%     
client [72] (testset)   loss: 0.9103 -> 0.8975  accuracy: 86.84% -> 86.84%     
client [7]  (testset)   loss: 0.4610 -> 0.2608  accuracy: 92.18% -> 96.71%     
client [71] (testset)   loss: 0.4165 -> 0.4220  accuracy: 93.75% -> 93.75%     
client [59] (testset)   loss: 0.3352 -> 0.3413  accuracy: 94.44% -> 94.44%     
client [86] (testset)   loss: 0.8902 -> 0.6575  accuracy: 86.03% -> 89.08%     
client [39] (testset)   loss: 0.3296 -> 0.3437  accuracy: 94.03% -> 92.54%     
---------------------------- TRAINING EPOCH: 300 ----------------------------  
client [99] (testset)   loss: 0.2041 -> 0.1524  accuracy: 95.19% -> 98.08%     
client [7]  (testset)   loss: 0.5960 -> 0.2872  accuracy: 88.89% -> 95.88%     
client [17] (testset)   loss: 0.3031 -> 0.3098  accuracy: 92.47% -> 94.52%     
client [64] (testset)   loss: 0.5746 -> 0.2938  accuracy: 89.54% -> 92.89%     
client [37] (testset)   loss: 0.7110 -> 0.3686  accuracy: 86.39% -> 92.90%     
client [29] (testset)   loss: 0.5059 -> 0.4377  accuracy: 91.67% -> 91.11%     
client [93] (testset)   loss: 0.8267 -> 0.6238  accuracy: 86.01% -> 88.46%     
client [73] (testset)   loss: 0.3836 -> 0.3238  accuracy: 91.86% -> 92.76%     
client [40] (testset)   loss: 0.5960 -> 0.3946  accuracy: 92.06% -> 92.06%     
client [76] (testset)   loss: 1.0262 -> 0.3591  accuracy: 82.82% -> 92.37%     
---------------------------- TRAINING EPOCH: 310 ----------------------------  
client [31] (testset)   loss: 0.3571 -> 0.3237  accuracy: 91.95% -> 89.93%     
client [89] (testset)   loss: 0.2756 -> 0.2456  accuracy: 96.40% -> 97.84%     
client [77] (testset)   loss: 0.4755 -> 0.4160  accuracy: 93.71% -> 92.57%     
client [90] (testset)   loss: 0.3818 -> 0.2510  accuracy: 92.74% -> 94.97%     
client [26] (testset)   loss: 0.3553 -> 0.2214  accuracy: 93.51% -> 93.51%     
client [50] (testset)   loss: 0.3885 -> 0.2075  accuracy: 94.04% -> 98.01%     
client [30] (testset)   loss: 1.4788 -> 0.7436  accuracy: 80.22% -> 86.81%     
client [70] (testset)   loss: 0.5454 -> 0.3845  accuracy: 89.53% -> 94.19%     
client [41] (testset)   loss: 0.4889 -> 0.1784  accuracy: 90.24% -> 97.56%     
client [99] (testset)   loss: 0.3659 -> 0.1848  accuracy: 93.27% -> 96.15%     
---------------------------- TRAINING EPOCH: 320 ----------------------------  
client [68] (testset)   loss: 0.7412 -> 0.5384  accuracy: 86.02% -> 91.30%     
client [70] (testset)   loss: 0.6394 -> 0.3954  accuracy: 89.53% -> 94.19%     
client [52] (testset)   loss: 0.1345 -> 0.1205  accuracy: 97.33% -> 96.00%     
client [1]  (testset)   loss: 0.7670 -> 0.3925  accuracy: 88.97% -> 92.65%     
client [2]  (testset)   loss: 1.2206 -> 0.7018  accuracy: 83.66% -> 88.89%     
client [67] (testset)   loss: 0.3002 -> 0.2122  accuracy: 92.64% -> 94.81%     
client [92] (testset)   loss: 0.1248 -> 0.0785  accuracy: 96.76% -> 98.61%     
client [35] (testset)   loss: 0.3197 -> 0.2869  accuracy: 93.55% -> 93.55%     
client [36] (testset)   loss: 0.1902 -> 0.1623  accuracy: 95.39% -> 97.24%     
client [64] (testset)   loss: 0.2930 -> 0.2568  accuracy: 93.72% -> 93.31%     
---------------------------- TRAINING EPOCH: 330 ----------------------------  
client [44] (testset)   loss: 0.9600 -> 0.8464  accuracy: 84.49% -> 88.37%     
client [6]  (testset)   loss: 0.7053 -> 0.4158  accuracy: 89.74% -> 92.31%     
client [12] (testset)   loss: 0.3315 -> 0.3647  accuracy: 93.67% -> 93.67%     
client [55] (testset)   loss: 0.5366 -> 0.3126  accuracy: 91.37% -> 92.39%     
client [29] (testset)   loss: 0.5896 -> 0.4086  accuracy: 90.00% -> 92.78%     
client [9]  (testset)   loss: 0.2600 -> 0.1317  accuracy: 95.19% -> 97.86%     
client [43] (testset)   loss: 0.4665 -> 0.4235  accuracy: 92.66% -> 92.66%     
client [77] (testset)   loss: 0.5854 -> 0.4528  accuracy: 90.86% -> 93.71%     
client [98] (testset)   loss: 0.1491 -> 0.1438  accuracy: 97.25% -> 97.25%     
client [78] (testset)   loss: 0.1493 -> 0.1724  accuracy: 97.62% -> 98.41%     
---------------------------- TRAINING EPOCH: 340 ----------------------------  
client [92] (testset)   loss: 0.0551 -> 0.0494  accuracy: 98.61% -> 99.07%     
client [80] (testset)   loss: 0.2629 -> 0.2579  accuracy: 94.34% -> 95.28%     
client [63] (testset)   loss: 0.2065 -> 0.1998  accuracy: 96.97% -> 96.97%     
client [76] (testset)   loss: 0.7568 -> 0.3708  accuracy: 88.93% -> 91.60%     
client [78] (testset)   loss: 0.1934 -> 0.1919  accuracy: 97.62% -> 98.41%     
client [25] (testset)   loss: 0.5182 -> 0.3050  accuracy: 89.69% -> 93.13%     
client [58] (testset)   loss: 1.0677 -> 0.9391  accuracy: 83.43% -> 85.64%     
client [13] (testset)   loss: 0.3505 -> 0.1844  accuracy: 92.41% -> 96.43%     
client [17] (testset)   loss: 0.6213 -> 0.3410  accuracy: 93.15% -> 93.84%     
client [38] (testset)   loss: 0.4702 -> 0.1563  accuracy: 91.55% -> 96.28%     
---------------------------- TRAINING EPOCH: 350 ----------------------------  
client [72] (testset)   loss: 1.0339 -> 1.0031  accuracy: 81.58% -> 81.58%     
client [82] (testset)   loss: 0.5461 -> 0.2621  accuracy: 89.41% -> 95.34%     
client [86] (testset)   loss: 0.9163 -> 0.7112  accuracy: 85.59% -> 88.21%     
client [51] (testset)   loss: 0.3627 -> 0.1133  accuracy: 91.25% -> 96.96%     
client [96] (testset)   loss: 0.6747 -> 0.3429  accuracy: 88.21% -> 92.14%     
client [42] (testset)   loss: 0.5083 -> 0.3134  accuracy: 89.43% -> 92.95%     
client [55] (testset)   loss: 0.7176 -> 0.3211  accuracy: 88.32% -> 94.42%     
client [13] (testset)   loss: 0.2325 -> 0.1786  accuracy: 94.64% -> 95.98%     
client [1]  (testset)   loss: 0.8695 -> 0.3297  accuracy: 90.44% -> 93.38%     
client [12] (testset)   loss: 0.4443 -> 0.3736  accuracy: 91.77% -> 93.04%     
---------------------------- TRAINING EPOCH: 360 ----------------------------  
client [68] (testset)   loss: 1.1142 -> 0.5372  accuracy: 83.54% -> 91.30%     
client [23] (testset)   loss: 1.0406 -> 0.5819  accuracy: 85.71% -> 87.14%     
client [46] (testset)   loss: 0.3921 -> 0.3169  accuracy: 92.48% -> 93.79%     
client [41] (testset)   loss: 0.6636 -> 0.2564  accuracy: 90.24% -> 95.61%     
client [25] (testset)   loss: 1.0020 -> 0.2891  accuracy: 83.21% -> 93.89%     
client [58] (testset)   loss: 0.9972 -> 0.8027  accuracy: 85.64% -> 87.29%     
client [14] (testset)   loss: 0.6917 -> 0.3420  accuracy: 87.14% -> 92.12%     
client [33] (testset)   loss: 0.8471 -> 0.6579  accuracy: 84.30% -> 88.43%     
client [85] (testset)   loss: 0.3656 -> 0.2224  accuracy: 92.93% -> 95.65%     
client [62] (testset)   loss: 0.3557 -> 0.1843  accuracy: 92.37% -> 92.37%     
---------------------------- TRAINING EPOCH: 370 ----------------------------  
client [98] (testset)   loss: 0.1500 -> 0.1480  accuracy: 96.91% -> 97.25%     
client [63] (testset)   loss: 0.1965 -> 0.1421  accuracy: 96.97% -> 96.97%     
client [70] (testset)   loss: 0.5811 -> 0.5215  accuracy: 93.02% -> 93.02%     
client [65] (testset)   loss: 0.5494 -> 0.3893  accuracy: 91.91% -> 92.65%     
client [14] (testset)   loss: 0.5251 -> 0.3591  accuracy: 91.29% -> 91.70%     
client [73] (testset)   loss: 0.3556 -> 0.3230  accuracy: 92.31% -> 93.67%     
client [34] (testset)   loss: 0.4255 -> 0.3327  accuracy: 91.80% -> 92.90%     
client [99] (testset)   loss: 0.2553 -> 0.2053  accuracy: 93.27% -> 93.27%     
client [69] (testset)   loss: 0.4323 -> 0.4374  accuracy: 91.16% -> 90.48%     
client [46] (testset)   loss: 0.3915 -> 0.2881  accuracy: 91.50% -> 94.44%     
---------------------------- TRAINING EPOCH: 380 ----------------------------  
client [99] (testset)   loss: 0.6100 -> 0.1967  accuracy: 90.38% -> 96.15%     
client [93] (testset)   loss: 0.7681 -> 0.7097  accuracy: 87.06% -> 86.36%     
client [11] (testset)   loss: 0.1544 -> 0.1574  accuracy: 99.40% -> 99.40%     
client [58] (testset)   loss: 0.9327 -> 0.8227  accuracy: 84.53% -> 85.64%     
client [81] (testset)   loss: 0.3871 -> 0.3393  accuracy: 94.92% -> 94.92%     
client [85] (testset)   loss: 0.2125 -> 0.2028  accuracy: 95.11% -> 95.11%     
client [89] (testset)   loss: 0.3226 -> 0.2691  accuracy: 95.68% -> 97.84%     
client [45] (testset)   loss: 0.3653 -> 0.2646  accuracy: 93.33% -> 95.56%     
client [8]  (testset)   loss: 0.3583 -> 0.3262  accuracy: 94.12% -> 94.12%     
client [68] (testset)   loss: 1.4569 -> 0.5645  accuracy: 82.30% -> 90.68%     
---------------------------- TRAINING EPOCH: 390 ----------------------------  
client [67] (testset)   loss: 0.3406 -> 0.2183  accuracy: 93.51% -> 95.24%     
client [72] (testset)   loss: 0.8619 -> 0.8413  accuracy: 86.84% -> 86.84%     
client [1]  (testset)   loss: 0.6822 -> 0.3429  accuracy: 89.71% -> 91.91%     
client [78] (testset)   loss: 0.0957 -> 0.1551  accuracy: 98.41% -> 98.41%     
client [83] (testset)   loss: 0.4316 -> 0.3130  accuracy: 94.12% -> 95.29%     
client [21] (testset)   loss: 0.8284 -> 0.7105  accuracy: 86.16% -> 89.94%     
client [56] (testset)   loss: 0.7179 -> 0.6167  accuracy: 87.24% -> 89.29%     
client [44] (testset)   loss: 1.2445 -> 0.8755  accuracy: 82.27% -> 88.37%     
client [92] (testset)   loss: 0.0830 -> 0.0720  accuracy: 99.07% -> 99.07%     
client [27] (testset)   loss: 0.0963 -> 0.0040  accuracy: 96.51% -> 100.00%    
---------------------------- TRAINING EPOCH: 400 ----------------------------  
client [10] (testset)   loss: 0.6252 -> 0.4843  accuracy: 94.24% -> 95.68%     
client [39] (testset)   loss: 0.2830 -> 0.3297  accuracy: 92.54% -> 92.54%     
client [65] (testset)   loss: 0.4107 -> 0.3882  accuracy: 91.18% -> 91.91%     
client [26] (testset)   loss: 0.2559 -> 0.2227  accuracy: 96.10% -> 96.10%     
client [19] (testset)   loss: 0.2487 -> 0.1331  accuracy: 95.56% -> 96.67%     
client [68] (testset)   loss: 0.8030 -> 0.5805  accuracy: 87.58% -> 91.30%     
client [41] (testset)   loss: 1.0646 -> 0.3042  accuracy: 86.34% -> 95.12%     
client [50] (testset)   loss: 0.8321 -> 0.2579  accuracy: 88.08% -> 95.36%     
client [75] (testset)   loss: 0.2071 -> 0.1641  accuracy: 96.40% -> 97.84%     
client [81] (testset)   loss: 0.3906 -> 0.3665  accuracy: 94.92% -> 94.92%     
Training... ---------------------------------------- 100% 0:12:27
SFL's average time taken by each global epoch: 0 min 1.86 sec.                 
SFL's total running time: 0 h 12 m 27 s.                                       
==================== SFL Experiment Results: ====================              
Display format: (before local fine-tuning) -> (after local fine-tuning)        
 So if finetune_epoch = 0, x.xx% -> 0.00% is normal.                           
 Centralized testing ONLY happens after model aggregation, so the stats between
'->' are the same.                                                             
{                                                                              
    "100": {                                                                   
        "all_clients": {                                                       
            "test": {                                                          
                "loss": "0.4642 -> 0.0000",                                    
                "accuracy": "88.53% -> 0.00%"                                  
            }                                                                  
        }                                                                      
    },                                                                         
    "200": {                                                                   
        "all_clients": {                                                       
            "test": {                                                          
                "loss": "0.5003 -> 0.0000",                                    
                "accuracy": "90.67% -> 0.00%"                                  
            }                                                                  
        }                                                                      
    },                                                                         
    "300": {                                                                   
        "all_clients": {                                                       
            "test": {                                                          
                "loss": "0.5776 -> 0.0000",                                    
                "accuracy": "89.84% -> 0.00%"                                  
            }                                                                  
        }                                                                      
    },                                                                         
    "400": {                                                                   
        "all_clients": {                                                       
            "test": {                                                          
                "loss": "0.5611 -> 0.0000",                                    
                "accuracy": "90.69% -> 0.00%"                                  
            }                                                                  
        }                                                                      
    }                                                                          
}                                                                              
==================== SFL Max Accuracy ====================                     
all_clients:                                                                   
(test) before fine-tuning: 90.69% at epoch 400                                 
(test) after fine-tuning: 0.00% at epoch 100                                   
[0m