==================== APFL ====================                                 
Experiment Arguments:                                                          
{
│   'method': 'apfl',
│   'dataset': {
│   │   'name': 'fmnist',
│   │   'client_num': 100,
│   │   'test_ratio': 0.25,
│   │   'val_ratio': 0.0,
│   │   'seed': 42,
│   │   'split': 'sample',
│   │   'IID_ratio': 0.0,
│   │   'monitor_window_name_suffix': 'fmnist-100clients-0%IID-Dir(1.0)-seed42',
│   │   'alpha': 1.0,
│   │   'min_samples_per_client': 10
│   },
│   'model': {
│   │   'name': 'avgcnn',
│   │   'use_torchvision_pretrained_weights': True,
│   │   'external_model_weights_path': None
│   },
│   'optimizer': {
│   │   'lr': 0.01,
│   │   'dampening': 0,
│   │   'weight_decay': 0,
│   │   'momentum': 0,
│   │   'nesterov': False,
│   │   'name': 'sgd'
│   },
│   'mode': 'serial',
│   'parallel': {
│   │   'ray_cluster_addr': None,
│   │   'num_cpus': None,
│   │   'num_gpus': None,
│   │   'num_workers': 2
│   },
│   'common': {
│   │   'seed': 42,
│   │   'join_ratio': 0.1,
│   │   'global_epoch': 400,
│   │   'local_epoch': 5,
│   │   'batch_size': 32,
│   │   'reset_optimizer_on_global_epoch': True,
│   │   'straggler_ratio': 0,
│   │   'straggler_min_local_epoch': 0,
│   │   'buffers': 'global',
│   │   'client_side_evaluation': True,
│   │   'test': {
│   │   │   'client': {
│   │   │   │   'interval': 100,
│   │   │   │   'finetune_epoch': 0,
│   │   │   │   'train': False,
│   │   │   │   'val': False,
│   │   │   │   'test': True
│   │   │   },
│   │   │   'server': {
│   │   │   │   'interval': -1,
│   │   │   │   'train': False,
│   │   │   │   'val': False,
│   │   │   │   'test': False,
│   │   │   │   'model_in_train_mode': False
│   │   │   }
│   │   },
│   │   'verbose_gap': 10,
│   │   'monitor': None,
│   │   'use_cuda': True,
│   │   'save_log': True,
│   │   'save_model': False,
│   │   'save_learning_curve_plot': False,
│   │   'save_metrics': True,
│   │   'delete_useless_run': True
│   },
│   'apfl': {
│   │   'alpha': 0.5,
│   │   'adaptive_alpha': 1
│   }
}
---------------------------- TRAINING EPOCH: 10 ----------------------------   
client [77] (testset)   loss: 0.6725 -> 0.6230  accuracy: 76.67% -> 80.00%     
client [81] (testset)   loss: 0.6355 -> 0.5619  accuracy: 82.38% -> 78.41%     
client [21] (testset)   loss: 0.6487 -> 0.6684  accuracy: 82.21% -> 82.21%     
client [68] (testset)   loss: 0.7550 -> 0.7496  accuracy: 77.78% -> 80.56%     
client [93] (testset)   loss: 0.7586 -> 0.6383  accuracy: 77.34% -> 77.34%     
client [31] (testset)   loss: 0.6359 -> 0.6164  accuracy: 81.29% -> 80.58%     
client [20] (testset)   loss: 0.6276 -> 0.6166  accuracy: 82.86% -> 82.86%     
client [59] (testset)   loss: 0.5022 -> 0.3487  accuracy: 92.15% -> 92.15%     
client [48] (testset)   loss: 0.5081 -> 0.3460  accuracy: 87.62% -> 89.60%     
client [34] (testset)   loss: 0.5634 -> 0.5470  accuracy: 84.82% -> 80.10%     
---------------------------- TRAINING EPOCH: 20 ----------------------------   
client [69] (testset)   loss: 0.4374 -> 0.3745  accuracy: 85.62% -> 84.93%     
client [99] (testset)   loss: 0.4412 -> 0.3612  accuracy: 89.57% -> 87.12%     
client [67] (testset)   loss: 0.4953 -> 0.4168  accuracy: 87.36% -> 87.93%     
client [0]  (testset)   loss: 0.4476 -> 0.4275  accuracy: 84.68% -> 87.66%     
client [76] (testset)   loss: 0.3574 -> 0.3499  accuracy: 88.83% -> 89.94%     
client [41] (testset)   loss: 0.6179 -> 0.6289  accuracy: 79.84% -> 73.64%     
client [62] (testset)   loss: 0.6067 -> 0.6163  accuracy: 85.00% -> 80.71%     
client [2]  (testset)   loss: 0.5406 -> 0.4767  accuracy: 80.97% -> 82.74%     
client [14] (testset)   loss: 0.3245 -> 0.2392  accuracy: 89.67% -> 92.49%     
client [46] (testset)   loss: 0.4219 -> 0.3217  accuracy: 88.81% -> 88.06%     
---------------------------- TRAINING EPOCH: 30 ----------------------------   
client [24] (testset)   loss: 0.3084 -> 0.2625  accuracy: 89.82% -> 90.71%     
client [68] (testset)   loss: 0.5230 -> 0.5035  accuracy: 77.78% -> 84.72%     
client [57] (testset)   loss: 0.3943 -> 0.2873  accuracy: 87.90% -> 92.74%     
client [17] (testset)   loss: 0.2685 -> 0.1695  accuracy: 93.37% -> 94.39%     
client [54] (testset)   loss: 0.2180 -> 0.1792  accuracy: 93.68% -> 94.25%     
client [23] (testset)   loss: 0.7458 -> 0.4159  accuracy: 72.73% -> 87.66%     
client [35] (testset)   loss: 0.2656 -> 0.2207  accuracy: 93.05% -> 92.05%     
client [59] (testset)   loss: 0.3663 -> 0.2325  accuracy: 90.05% -> 92.67%     
client [31] (testset)   loss: 0.3807 -> 2.0513  accuracy: 87.41% -> 51.80%     
client [9]  (testset)   loss: 0.4620 -> 0.4167  accuracy: 85.80% -> 84.02%     
---------------------------- TRAINING EPOCH: 40 ----------------------------   
client [64] (testset)   loss: 0.3884 -> 0.3952  accuracy: 86.83% -> 86.53%     
client [33] (testset)   loss: 0.2632 -> 0.2674  accuracy: 90.40% -> 89.90%     
client [16] (testset)   loss: 0.2771 -> 0.1323  accuracy: 92.06% -> 98.41%     
client [44] (testset)   loss: 0.2935 -> 0.2861  accuracy: 89.73% -> 90.27%     
client [8]  (testset)   loss: 0.3982 -> 0.3903  accuracy: 84.17% -> 84.17%     
client [31] (testset)   loss: 0.3390 -> 0.3607  accuracy: 85.61% -> 85.61%     
client [47] (testset)   loss: 0.2719 -> 0.2310  accuracy: 94.40% -> 94.40%     
client [36] (testset)   loss: 0.4529 -> 0.4517  accuracy: 86.52% -> 83.69%     
client [20] (testset)   loss: 0.4343 -> 0.4273  accuracy: 87.14% -> 83.57%     
client [56] (testset)   loss: 0.3204 -> 0.3270  accuracy: 88.37% -> 90.70%     
---------------------------- TRAINING EPOCH: 50 ----------------------------   
client [4]  (testset)   loss: 0.5125 -> 0.5832  accuracy: 80.47% -> 75.74%     
client [60] (testset)   loss: 0.3073 -> 0.2117  accuracy: 90.83% -> 94.32%     
client [28] (testset)   loss: 0.3094 -> 0.3593  accuracy: 90.10% -> 89.11%     
client [25] (testset)   loss: 0.2787 -> 0.2566  accuracy: 90.68% -> 92.11%     
client [58] (testset)   loss: 0.4608 -> 0.4594  accuracy: 82.93% -> 81.71%     
client [44] (testset)   loss: 0.2801 -> 0.2676  accuracy: 90.81% -> 89.73%     
client [39] (testset)   loss: 0.4222 -> 0.2959  accuracy: 85.45% -> 89.67%     
client [29] (testset)   loss: 0.3598 -> 0.3630  accuracy: 87.07% -> 86.39%     
client [3]  (testset)   loss: 0.3259 -> 0.3419  accuracy: 89.64% -> 88.05%     
client [84] (testset)   loss: 0.4358 -> 0.3487  accuracy: 86.84% -> 89.47%     
---------------------------- TRAINING EPOCH: 60 ----------------------------   
client [21] (testset)   loss: 0.3325 -> 0.2868  accuracy: 88.96% -> 90.80%     
client [84] (testset)   loss: 0.3995 -> 0.3317  accuracy: 87.50% -> 88.82%     
client [10] (testset)   loss: 0.2603 -> 0.3011  accuracy: 91.84% -> 89.80%     
client [36] (testset)   loss: 0.3739 -> 0.3654  accuracy: 88.65% -> 87.23%     
client [65] (testset)   loss: 0.2773 -> 0.2848  accuracy: 91.67% -> 91.67%     
client [81] (testset)   loss: 0.3531 -> 0.2823  accuracy: 86.78% -> 89.87%     
client [79] (testset)   loss: 0.3623 -> 0.2928  accuracy: 86.43% -> 89.14%     
client [42] (testset)   loss: 0.3687 -> 0.2889  accuracy: 86.67% -> 88.89%     
client [11] (testset)   loss: 0.2636 -> 0.2979  accuracy: 91.80% -> 88.52%     
client [96] (testset)   loss: 0.2550 -> 0.2187  accuracy: 91.48% -> 92.61%     
---------------------------- TRAINING EPOCH: 70 ----------------------------   
client [8]  (testset)   loss: 0.2647 -> 0.3145  accuracy: 89.93% -> 89.93%     
client [53] (testset)   loss: 0.2485 -> 0.2603  accuracy: 91.87% -> 91.52%     
client [52] (testset)   loss: 0.3090 -> 0.2695  accuracy: 89.83% -> 88.14%     
client [42] (testset)   loss: 0.3407 -> 0.2818  accuracy: 86.67% -> 90.00%     
client [69] (testset)   loss: 0.2290 -> 0.2663  accuracy: 91.10% -> 88.36%     
client [59] (testset)   loss: 0.2032 -> 0.1642  accuracy: 94.76% -> 95.29%     
client [7]  (testset)   loss: 0.3017 -> 0.3478  accuracy: 86.45% -> 87.10%     
client [26] (testset)   loss: 0.1529 -> 0.1824  accuracy: 95.58% -> 92.04%     
client [49] (testset)   loss: 0.3156 -> 0.3498  accuracy: 90.12% -> 86.05%     
client [98] (testset)   loss: 0.4263 -> 0.3565  accuracy: 86.26% -> 90.11%     
---------------------------- TRAINING EPOCH: 80 ----------------------------   
client [98] (testset)   loss: 0.4948 -> 0.6650  accuracy: 82.42% -> 81.87%     
client [47] (testset)   loss: 0.2634 -> 0.1912  accuracy: 90.40% -> 95.20%     
client [21] (testset)   loss: 0.2906 -> 0.2363  accuracy: 90.18% -> 91.41%     
client [77] (testset)   loss: 0.3771 -> 0.3578  accuracy: 84.17% -> 87.50%     
client [95] (testset)   loss: 0.2240 -> 0.2001  accuracy: 93.79% -> 94.41%     
client [91] (testset)   loss: 0.4589 -> 0.5228  accuracy: 81.99% -> 80.75%     
client [14] (testset)   loss: 0.1443 -> 0.1143  accuracy: 92.96% -> 95.31%     
client [99] (testset)   loss: 0.2374 -> 0.2578  accuracy: 90.18% -> 87.73%     
client [20] (testset)   loss: 0.3230 -> 0.3291  accuracy: 88.57% -> 87.14%     
client [39] (testset)   loss: 0.4820 -> 0.2522  accuracy: 83.57% -> 90.61%     
---------------------------- TRAINING EPOCH: 90 ----------------------------   
client [52] (testset)   loss: 0.3014 -> 0.2675  accuracy: 87.57% -> 90.96%     
client [62] (testset)   loss: 0.3289 -> 0.3789  accuracy: 91.43% -> 87.14%     
client [71] (testset)   loss: 0.1872 -> 0.2146  accuracy: 93.67% -> 93.04%     
client [97] (testset)   loss: 0.3424 -> 0.3888  accuracy: 87.80% -> 86.99%     
client [30] (testset)   loss: 0.2140 -> 0.1516  accuracy: 90.68% -> 94.92%     
client [88] (testset)   loss: 0.4426 -> 0.4475  accuracy: 83.85% -> 81.77%     
client [60] (testset)   loss: 0.2110 -> 0.1461  accuracy: 93.01% -> 96.07%     
client [82] (testset)   loss: 0.2490 -> 0.1866  accuracy: 91.07% -> 92.26%     
client [91] (testset)   loss: 0.3955 -> 0.4186  accuracy: 84.47% -> 86.96%     
client [57] (testset)   loss: 0.2115 -> 0.1656  accuracy: 95.97% -> 95.16%     
---------------------------- TRAINING EPOCH: 100 ----------------------------  
client [31] (testset)   loss: 0.3808 -> 1.4756  accuracy: 84.17% -> 78.42%     
client [15] (testset)   loss: 0.1826 -> 0.1601  accuracy: 93.90% -> 95.12%     
client [71] (testset)   loss: 0.1892 -> 0.2019  accuracy: 93.67% -> 94.30%     
client [97] (testset)   loss: 0.3337 -> 0.3742  accuracy: 86.99% -> 85.37%     
client [53] (testset)   loss: 0.2402 -> 0.2639  accuracy: 90.81% -> 91.87%     
client [77] (testset)   loss: 0.3135 -> 0.3146  accuracy: 88.33% -> 89.17%     
client [76] (testset)   loss: 0.1487 -> 0.1707  accuracy: 94.97% -> 93.85%     
client [79] (testset)   loss: 0.3022 -> 0.2829  accuracy: 89.14% -> 90.05%     
client [28] (testset)   loss: 0.2113 -> 0.3007  accuracy: 93.07% -> 91.09%     
client [99] (testset)   loss: 0.2325 -> 0.2225  accuracy: 90.80% -> 94.48%     
---------------------------- TRAINING EPOCH: 110 ----------------------------  
client [97] (testset)   loss: 0.3186 -> 0.3567  accuracy: 90.24% -> 86.18%     
client [86] (testset)   loss: 0.1429 -> 0.1514  accuracy: 93.68% -> 93.68%     
client [34] (testset)   loss: 0.1570 -> 0.1339  accuracy: 93.19% -> 94.24%     
client [73] (testset)   loss: 0.3856 -> 4.1003  accuracy: 89.93% -> 50.34%     
client [5]  (testset)   loss: 0.2362 -> 0.2178  accuracy: 89.17% -> 91.67%     
client [96] (testset)   loss: 0.2326 -> 0.2124  accuracy: 92.05% -> 93.18%     
client [22] (testset)   loss: 0.3932 -> 0.3506  accuracy: 89.13% -> 87.68%     
client [60] (testset)   loss: 0.2361 -> 0.1509  accuracy: 91.70% -> 95.63%     
client [66] (testset)   loss: 0.2420 -> 0.2504  accuracy: 90.52% -> 88.79%     
client [83] (testset)   loss: 0.4208 -> 0.3456  accuracy: 86.14% -> 87.27%     
---------------------------- TRAINING EPOCH: 120 ----------------------------  
client [76] (testset)   loss: 0.1444 -> 0.1646  accuracy: 94.41% -> 93.85%     
client [65] (testset)   loss: 0.2395 -> 0.2625  accuracy: 91.67% -> 92.71%     
client [95] (testset)   loss: 0.2319 -> 0.1775  accuracy: 91.93% -> 93.79%     
client [17] (testset)   loss: 0.1473 -> 0.1154  accuracy: 95.41% -> 95.92%     
client [8]  (testset)   loss: 0.2537 -> 0.3004  accuracy: 91.37% -> 91.37%     
client [35] (testset)   loss: 0.1652 -> 0.1711  accuracy: 93.71% -> 92.72%     
client [98] (testset)   loss: 0.3776 -> 0.3664  accuracy: 88.46% -> 89.01%     
client [53] (testset)   loss: 0.2297 -> 0.2237  accuracy: 91.87% -> 92.58%     
client [43] (testset)   loss: 0.0931 -> 0.0726  accuracy: 97.47% -> 97.47%     
client [64] (testset)   loss: 0.3017 -> 0.2684  accuracy: 90.72% -> 91.02%     
---------------------------- TRAINING EPOCH: 130 ----------------------------  
client [21] (testset)   loss: 0.2969 -> 0.2350  accuracy: 90.18% -> 91.41%     
client [88] (testset)   loss: 0.5361 -> 0.3867  accuracy: 83.85% -> 87.50%     
client [38] (testset)   loss: 0.3758 -> 0.3612  accuracy: 89.21% -> 90.65%     
client [3]  (testset)   loss: 0.3378 -> 0.2989  accuracy: 89.24% -> 92.83%     
client [5]  (testset)   loss: 0.2242 -> 0.2133  accuracy: 91.67% -> 94.17%     
client [41] (testset)   loss: 0.3110 -> 0.3400  accuracy: 91.47% -> 89.15%     
client [7]  (testset)   loss: 0.3061 -> 0.3063  accuracy: 89.68% -> 90.32%     
client [37] (testset)   loss: 0.2124 -> 0.2153  accuracy: 90.97% -> 92.26%     
client [45] (testset)   loss: 0.3155 -> 0.2448  accuracy: 89.45% -> 92.20%     
client [47] (testset)   loss: 0.2201 -> 0.1740  accuracy: 89.60% -> 93.60%     
---------------------------- TRAINING EPOCH: 140 ----------------------------  
client [16] (testset)   loss: 0.1561 -> 0.0758  accuracy: 93.12% -> 97.35%     
client [11] (testset)   loss: 0.2840 -> 0.1820  accuracy: 86.89% -> 90.98%     
client [37] (testset)   loss: 0.2597 -> 0.2230  accuracy: 90.32% -> 90.97%     
client [41] (testset)   loss: 0.4732 -> 0.3617  accuracy: 83.72% -> 89.15%     
client [95] (testset)   loss: 0.3135 -> 0.1584  accuracy: 88.20% -> 95.03%     
client [53] (testset)   loss: 0.2170 -> 0.2299  accuracy: 91.87% -> 93.29%     
client [22] (testset)   loss: 0.3701 -> 0.3275  accuracy: 86.96% -> 86.96%     
client [25] (testset)   loss: 0.3098 -> 0.1671  accuracy: 87.10% -> 93.19%     
client [69] (testset)   loss: 0.2145 -> 0.1991  accuracy: 91.10% -> 91.10%     
client [46] (testset)   loss: 0.3217 -> 0.2328  accuracy: 90.30% -> 94.03%     
---------------------------- TRAINING EPOCH: 150 ----------------------------  
client [47] (testset)   loss: 0.1615 -> 0.1539  accuracy: 92.80% -> 94.40%     
client [69] (testset)   loss: 0.2152 -> 0.2018  accuracy: 93.15% -> 89.73%     
client [82] (testset)   loss: 0.2066 -> 0.1412  accuracy: 91.67% -> 94.64%     
client [45] (testset)   loss: 0.3769 -> 0.2618  accuracy: 87.16% -> 92.66%     
client [7]  (testset)   loss: 0.2626 -> 0.2779  accuracy: 89.68% -> 92.26%     
client [50] (testset)   loss: 0.2651 -> 0.2639  accuracy: 89.12% -> 89.12%     
client [35] (testset)   loss: 0.1538 -> 0.1734  accuracy: 94.37% -> 93.71%     
client [24] (testset)   loss: 0.2462 -> 0.1925  accuracy: 91.59% -> 94.25%     
client [15] (testset)   loss: 0.1488 -> 0.1775  accuracy: 96.34% -> 95.12%     
client [58] (testset)   loss: 0.4807 -> 0.4573  accuracy: 84.96% -> 85.77%     
---------------------------- TRAINING EPOCH: 160 ----------------------------  
client [48] (testset)   loss: 0.3576 -> 0.1640  accuracy: 87.62% -> 95.05%     
client [76] (testset)   loss: 0.1255 -> 0.1478  accuracy: 94.97% -> 94.97%     
client [67] (testset)   loss: 0.1126 -> 0.1502  accuracy: 98.85% -> 95.40%     
client [37] (testset)   loss: 0.2229 -> 0.2446  accuracy: 94.19% -> 92.26%     
client [58] (testset)   loss: 0.4672 -> 0.4981  accuracy: 86.18% -> 85.37%     
client [64] (testset)   loss: 0.2875 -> 0.2736  accuracy: 93.41% -> 93.11%     
client [77] (testset)   loss: 0.2974 -> 0.3268  accuracy: 88.33% -> 87.50%     
client [55] (testset)   loss: 0.4183 -> 0.4161  accuracy: 85.48% -> 89.52%     
client [12] (testset)   loss: 0.3898 -> 0.4725  accuracy: 86.00% -> 80.00%     
client [89] (testset)   loss: 0.2567 -> 0.2062  accuracy: 91.97% -> 94.16%     
---------------------------- TRAINING EPOCH: 170 ----------------------------  
client [84] (testset)   loss: 0.5355 -> 0.4278  accuracy: 83.55% -> 89.47%     
client [51] (testset)   loss: 0.2615 -> 0.2906  accuracy: 91.43% -> 90.00%     
client [8]  (testset)   loss: 0.2738 -> 0.2897  accuracy: 92.09% -> 89.93%     
client [18] (testset)   loss: 0.1929 -> 0.1805  accuracy: 93.28% -> 91.79%     
client [94] (testset)   loss: 0.3324 -> 0.2806  accuracy: 87.57% -> 90.53%     
client [81] (testset)   loss: 0.3473 -> 0.2492  accuracy: 91.63% -> 91.63%     
client [3]  (testset)   loss: 0.3572 -> 0.2981  accuracy: 88.45% -> 91.24%     
client [11] (testset)   loss: 0.1784 -> 0.1784  accuracy: 93.44% -> 94.26%     
client [95] (testset)   loss: 0.2203 -> 0.1833  accuracy: 93.79% -> 95.03%     
client [67] (testset)   loss: 0.1372 -> 0.1482  accuracy: 94.83% -> 94.83%     
---------------------------- TRAINING EPOCH: 180 ----------------------------  
client [21] (testset)   loss: 0.2981 -> 0.2255  accuracy: 88.96% -> 92.02%     
client [79] (testset)   loss: 0.3644 -> 0.3323  accuracy: 89.14% -> 91.40%     
client [58] (testset)   loss: 0.5318 -> 0.4501  accuracy: 85.77% -> 86.18%     
client [88] (testset)   loss: 0.4807 -> 0.4172  accuracy: 86.98% -> 88.02%     
client [46] (testset)   loss: 0.2428 -> 0.2564  accuracy: 91.79% -> 92.54%     
client [11] (testset)   loss: 0.2211 -> 0.1705  accuracy: 92.62% -> 92.62%     
client [55] (testset)   loss: 0.4690 -> 0.3919  accuracy: 87.50% -> 90.73%     
client [13] (testset)   loss: 0.3510 -> 0.2695  accuracy: 90.00% -> 92.11%     
client [31] (testset)   loss: 0.3363 -> 0.7781  accuracy: 85.61% -> 84.89%     
client [75] (testset)   loss: 0.2152 -> 0.1644  accuracy: 92.31% -> 94.87%     
---------------------------- TRAINING EPOCH: 190 ----------------------------  
client [19] (testset)   loss: 0.1982 -> 0.1828  accuracy: 93.85% -> 95.38%     
client [7]  (testset)   loss: 0.3419 -> 0.3378  accuracy: 86.45% -> 90.32%     
client [57] (testset)   loss: 0.1145 -> 0.1367  accuracy: 98.39% -> 95.97%     
client [13] (testset)   loss: 0.3611 -> 0.2920  accuracy: 89.47% -> 93.16%     
client [43] (testset)   loss: 0.0818 -> 0.0429  accuracy: 97.47% -> 98.73%     
client [91] (testset)   loss: 0.4502 -> 0.3989  accuracy: 84.47% -> 86.96%     
client [10] (testset)   loss: 0.1474 -> 0.1116  accuracy: 97.45% -> 97.45%     
client [64] (testset)   loss: 0.2803 -> 0.2749  accuracy: 93.71% -> 93.41%     
client [82] (testset)   loss: 0.1602 -> 0.1054  accuracy: 93.45% -> 95.24%     
client [22] (testset)   loss: 0.4579 -> 0.3659  accuracy: 86.96% -> 86.23%     
---------------------------- TRAINING EPOCH: 200 ----------------------------  
client [20] (testset)   loss: 0.3373 -> 0.3800  accuracy: 88.57% -> 87.86%     
client [23] (testset)   loss: 0.4080 -> 0.2690  accuracy: 88.64% -> 92.86%     
client [88] (testset)   loss: 0.5024 -> 0.4160  accuracy: 86.98% -> 86.46%     
client [98] (testset)   loss: 0.3733 -> 0.3805  accuracy: 90.66% -> 90.66%     
client [79] (testset)   loss: 0.4118 -> 0.3191  accuracy: 88.24% -> 91.40%     
client [21] (testset)   loss: 0.2926 -> 0.2473  accuracy: 88.96% -> 92.02%     
client [92] (testset)   loss: 0.3407 -> 0.2646  accuracy: 89.64% -> 91.44%     
client [56] (testset)   loss: 0.3211 -> 0.3213  accuracy: 90.70% -> 93.02%     
client [5]  (testset)   loss: 0.1959 -> 0.1990  accuracy: 92.50% -> 93.33%     
client [52] (testset)   loss: 0.3301 -> 0.3088  accuracy: 89.27% -> 91.53%     
---------------------------- TRAINING EPOCH: 210 ----------------------------  
client [67] (testset)   loss: 0.1061 -> 0.1321  accuracy: 96.55% -> 95.98%     
client [54] (testset)   loss: 0.1597 -> 0.1155  accuracy: 95.40% -> 95.40%     
client [14] (testset)   loss: 0.1127 -> 0.0819  accuracy: 96.71% -> 97.18%     
client [99] (testset)   loss: 0.2798 -> 0.2369  accuracy: 88.34% -> 95.71%     
client [36] (testset)   loss: 0.2783 -> 0.3416  accuracy: 89.36% -> 90.78%     
client [30] (testset)   loss: 0.2305 -> 0.1373  accuracy: 92.37% -> 93.22%     
client [38] (testset)   loss: 0.5756 -> 0.4353  accuracy: 88.49% -> 89.21%     
client [15] (testset)   loss: 0.1983 -> 0.1925  accuracy: 95.12% -> 95.12%     
client [6]  (testset)   loss: 0.2772 -> 0.3145  accuracy: 89.77% -> 90.91%     
client [53] (testset)   loss: 0.2735 -> 0.2659  accuracy: 92.58% -> 92.93%     
---------------------------- TRAINING EPOCH: 220 ----------------------------  
client [99] (testset)   loss: 0.3819 -> 0.2562  accuracy: 88.96% -> 93.25%     
client [6]  (testset)   loss: 0.3186 -> 0.2996  accuracy: 89.20% -> 92.05%     
client [83] (testset)   loss: 0.4474 -> 0.3742  accuracy: 89.51% -> 89.14%     
client [42] (testset)   loss: 0.4656 -> 0.1443  accuracy: 80.00% -> 94.44%     
client [34] (testset)   loss: 0.2781 -> 0.1565  accuracy: 91.62% -> 94.76%     
client [15] (testset)   loss: 0.2380 -> 0.2174  accuracy: 93.90% -> 96.34%     
client [47] (testset)   loss: 0.3258 -> 0.1652  accuracy: 90.40% -> 94.40%     
client [55] (testset)   loss: 0.2900 -> 0.3335  accuracy: 90.73% -> 91.94%     
client [51] (testset)   loss: 0.3344 -> 0.3227  accuracy: 87.86% -> 88.57%     
client [95] (testset)   loss: 0.3248 -> 0.1593  accuracy: 91.30% -> 95.03%     
---------------------------- TRAINING EPOCH: 230 ----------------------------  
client [71] (testset)   loss: 0.1826 -> 0.2042  accuracy: 94.30% -> 94.30%     
client [15] (testset)   loss: 0.1948 -> 0.1962  accuracy: 96.95% -> 95.73%     
client [33] (testset)   loss: 0.1981 -> 0.1752  accuracy: 92.93% -> 93.43%     
client [99] (testset)   loss: 0.2805 -> 0.2526  accuracy: 90.18% -> 94.48%     
client [90] (testset)   loss: 0.3662 -> 0.1842  accuracy: 88.52% -> 93.99%     
client [57] (testset)   loss: 0.1164 -> 0.1398  accuracy: 95.97% -> 98.39%     
client [27] (testset)   loss: 0.3026 -> 0.2913  accuracy: 93.21% -> 94.44%     
client [78] (testset)   loss: 0.5210 -> 0.4477  accuracy: 87.07% -> 85.78%     
client [36] (testset)   loss: 0.3058 -> 0.3279  accuracy: 88.65% -> 90.07%     
client [88] (testset)   loss: 0.4705 -> 0.4046  accuracy: 88.02% -> 84.38%     
---------------------------- TRAINING EPOCH: 240 ----------------------------  
client [70] (testset)   loss: 0.2169 -> 0.2061  accuracy: 93.33% -> 93.33%     
client [35] (testset)   loss: 0.1961 -> 0.2135  accuracy: 93.71% -> 93.05%     
client [16] (testset)   loss: 0.1275 -> 0.0936  accuracy: 97.88% -> 97.88%     
client [80] (testset)   loss: 0.6774 -> 0.6368  accuracy: 86.43% -> 87.94%     
client [38] (testset)   loss: 0.5173 -> 0.4150  accuracy: 89.21% -> 90.65%     
client [78] (testset)   loss: 0.5190 -> 0.4279  accuracy: 86.21% -> 88.79%     
client [68] (testset)   loss: 0.4179 -> 0.3658  accuracy: 84.72% -> 83.33%     
client [11] (testset)   loss: 0.1784 -> 0.1686  accuracy: 93.44% -> 92.62%     
client [64] (testset)   loss: 0.2920 -> 0.2849  accuracy: 93.41% -> 93.11%     
client [82] (testset)   loss: 0.2232 -> 0.1102  accuracy: 92.86% -> 95.24%     
---------------------------- TRAINING EPOCH: 250 ----------------------------  
client [30] (testset)   loss: 0.2170 -> 0.1562  accuracy: 92.37% -> 94.07%     
client [27] (testset)   loss: 0.2816 -> 0.2744  accuracy: 93.21% -> 96.30%     
client [74] (testset)   loss: 0.3655 -> 0.3802  accuracy: 88.02% -> 87.43%     
client [45] (testset)   loss: 0.2707 -> 0.2639  accuracy: 92.20% -> 92.20%     
client [6]  (testset)   loss: 0.3199 -> 0.3069  accuracy: 90.34% -> 91.48%     
client [36] (testset)   loss: 0.3312 -> 0.3606  accuracy: 90.07% -> 90.78%     
client [63] (testset)   loss: 0.1817 -> 0.1547  accuracy: 91.67% -> 93.33%     
client [76] (testset)   loss: 0.1636 -> 0.1689  accuracy: 94.41% -> 94.41%     
client [83] (testset)   loss: 0.4956 -> 0.3991  accuracy: 88.76% -> 89.14%     
client [86] (testset)   loss: 0.1800 -> 0.1796  accuracy: 93.16% -> 95.26%     
---------------------------- TRAINING EPOCH: 260 ----------------------------  
client [83] (testset)   loss: 0.5374 -> 0.4166  accuracy: 86.89% -> 91.01%     
client [99] (testset)   loss: 0.2806 -> 0.2728  accuracy: 90.80% -> 95.09%     
client [74] (testset)   loss: 0.4038 -> 0.3778  accuracy: 87.43% -> 88.02%     
client [73] (testset)   loss: 0.4308 -> 0.4250  accuracy: 87.92% -> 89.26%     
client [29] (testset)   loss: 0.3681 -> 0.4089  accuracy: 91.16% -> 87.07%     
client [92] (testset)   loss: 0.2885 -> 0.2481  accuracy: 89.64% -> 91.89%     
client [6]  (testset)   loss: 0.2615 -> 0.3147  accuracy: 92.05% -> 92.05%     
client [61] (testset)   loss: 0.1829 -> 0.1872  accuracy: 88.99% -> 92.66%     
client [21] (testset)   loss: 0.3510 -> 0.2675  accuracy: 88.96% -> 90.80%     
client [67] (testset)   loss: 0.1547 -> 0.1373  accuracy: 94.83% -> 96.55%     
---------------------------- TRAINING EPOCH: 270 ----------------------------  
client [83] (testset)   loss: 0.4786 -> 0.4111  accuracy: 88.01% -> 90.26%     
client [32] (testset)   loss: 0.3709 -> 0.4672  accuracy: 88.98% -> 90.68%     
client [95] (testset)   loss: 0.2868 -> 0.1669  accuracy: 91.30% -> 94.41%     
client [61] (testset)   loss: 0.2097 -> 0.2122  accuracy: 91.74% -> 92.66%     
client [27] (testset)   loss: 0.2857 -> 0.2967  accuracy: 95.06% -> 93.21%     
client [25] (testset)   loss: 0.2472 -> 0.1422  accuracy: 90.68% -> 94.62%     
client [68] (testset)   loss: 0.4691 -> 0.4495  accuracy: 80.56% -> 83.33%     
client [34] (testset)   loss: 0.2212 -> 0.1611  accuracy: 93.72% -> 94.24%     
client [71] (testset)   loss: 0.2258 -> 0.2480  accuracy: 93.67% -> 93.04%     
client [89] (testset)   loss: 0.3217 -> 0.1864  accuracy: 91.24% -> 93.43%     
---------------------------- TRAINING EPOCH: 280 ----------------------------  
client [78] (testset)   loss: 0.5851 -> 0.4369  accuracy: 87.07% -> 89.22%     
client [81] (testset)   loss: 0.4169 -> 0.2726  accuracy: 89.87% -> 92.51%     
client [51] (testset)   loss: 0.3371 -> 0.3816  accuracy: 90.71% -> 88.57%     
client [54] (testset)   loss: 0.1801 -> 0.1496  accuracy: 94.25% -> 95.98%     
client [65] (testset)   loss: 0.3345 -> 0.3475  accuracy: 92.71% -> 94.27%     
client [41] (testset)   loss: 0.3139 -> 0.3744  accuracy: 87.60% -> 89.92%     
client [11] (testset)   loss: 0.1789 -> 0.2104  accuracy: 94.26% -> 91.80%     
client [85] (testset)   loss: 0.3712 -> 0.3206  accuracy: 88.72% -> 90.23%     
client [12] (testset)   loss: 0.4149 -> 0.5360  accuracy: 87.00% -> 81.00%     
client [23] (testset)   loss: 0.4417 -> 0.2987  accuracy: 90.58% -> 93.18%     
---------------------------- TRAINING EPOCH: 290 ----------------------------  
client [16] (testset)   loss: 0.1454 -> 0.1152  accuracy: 96.83% -> 97.88%     
client [65] (testset)   loss: 0.3121 -> 0.3467  accuracy: 92.19% -> 92.71%     
client [53] (testset)   loss: 0.3195 -> 0.2856  accuracy: 92.93% -> 92.23%     
client [58] (testset)   loss: 0.4128 -> 0.4390  accuracy: 90.24% -> 88.62%     
client [72] (testset)   loss: 0.4288 -> 0.3285  accuracy: 90.06% -> 91.93%     
client [7]  (testset)   loss: 0.3535 -> 0.3344  accuracy: 89.03% -> 89.03%     
client [71] (testset)   loss: 0.2133 -> 0.2471  accuracy: 93.67% -> 94.30%     
client [59] (testset)   loss: 0.1626 -> 0.1296  accuracy: 93.72% -> 97.38%     
client [86] (testset)   loss: 0.2097 -> 0.2005  accuracy: 94.21% -> 95.26%     
client [39] (testset)   loss: 0.5760 -> 0.2986  accuracy: 86.85% -> 92.02%     
---------------------------- TRAINING EPOCH: 300 ----------------------------  
client [99] (testset)   loss: 0.3865 -> 0.2490  accuracy: 86.50% -> 95.71%     
client [7]  (testset)   loss: 0.3315 -> 0.3577  accuracy: 88.39% -> 87.10%     
client [17] (testset)   loss: 0.2192 -> 0.0957  accuracy: 92.35% -> 96.94%     
client [64] (testset)   loss: 0.3318 -> 0.2916  accuracy: 91.62% -> 93.71%     
client [37] (testset)   loss: 0.2705 -> 0.2743  accuracy: 92.26% -> 91.61%     
client [29] (testset)   loss: 0.4394 -> 0.4453  accuracy: 89.80% -> 87.76%     
client [93] (testset)   loss: 0.3911 -> 0.3376  accuracy: 88.28% -> 90.62%     
client [73] (testset)   loss: 0.5626 -> 0.4539  accuracy: 84.56% -> 89.26%     
client [40] (testset)   loss: 0.2924 -> 0.1281  accuracy: 90.91% -> 93.94%     
client [76] (testset)   loss: 0.1688 -> 0.1733  accuracy: 93.30% -> 94.41%     
---------------------------- TRAINING EPOCH: 310 ----------------------------  
client [31] (testset)   loss: 0.3121 -> 0.3912  accuracy: 88.85% -> 91.73%     
client [89] (testset)   loss: 0.3407 -> 0.1831  accuracy: 91.24% -> 94.89%     
client [77] (testset)   loss: 0.3360 -> 0.3543  accuracy: 90.00% -> 90.00%     
client [90] (testset)   loss: 0.4332 -> 0.2111  accuracy: 87.98% -> 92.90%     
client [26] (testset)   loss: 0.1192 -> 0.0746  accuracy: 96.46% -> 98.23%     
client [50] (testset)   loss: 0.3458 -> 0.2991  accuracy: 90.79% -> 89.96%     
client [30] (testset)   loss: 0.3230 -> 0.1501  accuracy: 91.53% -> 94.07%     
client [70] (testset)   loss: 0.2329 -> 0.2377  accuracy: 92.55% -> 92.55%     
client [41] (testset)   loss: 0.3971 -> 0.4023  accuracy: 87.60% -> 88.37%     
client [99] (testset)   loss: 0.3173 -> 0.2308  accuracy: 88.96% -> 95.71%     
---------------------------- TRAINING EPOCH: 320 ----------------------------  
client [68] (testset)   loss: 0.4733 -> 0.4329  accuracy: 83.33% -> 86.11%     
client [70] (testset)   loss: 0.2570 -> 0.2175  accuracy: 92.94% -> 94.51%     
client [52] (testset)   loss: 0.3066 -> 0.3071  accuracy: 92.66% -> 92.09%     
client [1]  (testset)   loss: 0.1540 -> 0.2772  accuracy: 91.36% -> 87.65%     
client [2]  (testset)   loss: 0.3760 -> 0.4110  accuracy: 88.94% -> 91.15%     
client [67] (testset)   loss: 0.1243 -> 0.2379  accuracy: 95.98% -> 93.10%     
client [92] (testset)   loss: 0.3232 -> 0.2495  accuracy: 90.09% -> 91.89%     
client [35] (testset)   loss: 0.2044 -> 0.2038  accuracy: 94.37% -> 94.70%     
client [36] (testset)   loss: 0.2928 -> 0.3238  accuracy: 92.20% -> 88.65%     
client [64] (testset)   loss: 0.3188 -> 0.3014  accuracy: 93.11% -> 93.11%     
---------------------------- TRAINING EPOCH: 330 ----------------------------  
client [44] (testset)   loss: 0.3082 -> 0.3048  accuracy: 93.51% -> 92.97%     
client [6]  (testset)   loss: 0.3131 -> 0.3180  accuracy: 90.34% -> 90.91%     
client [12] (testset)   loss: 0.4862 -> 0.5805  accuracy: 87.00% -> 86.00%     
client [55] (testset)   loss: 0.4439 -> 0.3573  accuracy: 85.48% -> 91.13%     
client [29] (testset)   loss: 0.5146 -> 0.4552  accuracy: 87.07% -> 87.07%     
client [9]  (testset)   loss: 0.3608 -> 0.4385  accuracy: 90.53% -> 92.31%     
client [43] (testset)   loss: 0.0687 -> 0.0488  accuracy: 96.20% -> 98.73%     
client [77] (testset)   loss: 0.3592 -> 0.4128  accuracy: 90.83% -> 90.00%     
client [98] (testset)   loss: 0.4539 -> 0.3525  accuracy: 89.56% -> 92.31%     
client [78] (testset)   loss: 0.6120 -> 0.4589  accuracy: 85.34% -> 88.36%     
---------------------------- TRAINING EPOCH: 340 ----------------------------  
client [92] (testset)   loss: 0.3316 -> 0.2586  accuracy: 91.44% -> 91.89%     
client [80] (testset)   loss: 0.7138 -> 0.6951  accuracy: 86.43% -> 86.93%     
client [63] (testset)   loss: 0.2611 -> 0.1790  accuracy: 89.17% -> 93.33%     
client [76] (testset)   loss: 0.1786 -> 0.1919  accuracy: 93.85% -> 94.97%     
client [78] (testset)   loss: 0.5653 -> 0.4444  accuracy: 85.78% -> 88.36%     
client [25] (testset)   loss: 0.2794 -> 0.1417  accuracy: 90.68% -> 94.62%     
client [58] (testset)   loss: 0.4510 -> 0.4277  accuracy: 89.02% -> 88.62%     
client [13] (testset)   loss: 0.3761 -> 0.3391  accuracy: 91.05% -> 92.63%     
client [17] (testset)   loss: 0.1554 -> 0.0915  accuracy: 94.90% -> 96.43%     
client [38] (testset)   loss: 0.6384 -> 0.4194  accuracy: 87.05% -> 90.65%     
---------------------------- TRAINING EPOCH: 350 ----------------------------  
client [72] (testset)   loss: 0.4406 -> 0.3245  accuracy: 90.06% -> 91.30%     
client [82] (testset)   loss: 0.1488 -> 0.1213  accuracy: 95.24% -> 96.43%     
client [86] (testset)   loss: 0.2060 -> 0.1991  accuracy: 95.26% -> 95.26%     
client [51] (testset)   loss: 0.3997 -> 0.3904  accuracy: 89.29% -> 88.57%     
client [96] (testset)   loss: 0.2696 -> 0.2669  accuracy: 92.05% -> 93.18%     
client [42] (testset)   loss: 0.4517 -> 0.1604  accuracy: 84.44% -> 95.56%     
client [55] (testset)   loss: 0.3224 -> 0.3540  accuracy: 89.52% -> 91.53%     
client [13] (testset)   loss: 0.4616 -> 0.3439  accuracy: 90.00% -> 92.11%     
client [1]  (testset)   loss: 0.2022 -> 0.3531  accuracy: 92.59% -> 86.42%     
client [12] (testset)   loss: 0.4734 -> 0.6075  accuracy: 89.00% -> 86.00%     
---------------------------- TRAINING EPOCH: 360 ----------------------------  
client [68] (testset)   loss: 0.4750 -> 0.3991  accuracy: 84.72% -> 86.11%     
client [23] (testset)   loss: 0.4151 -> 0.2921  accuracy: 91.88% -> 93.83%     
client [46] (testset)   loss: 0.2950 -> 0.3442  accuracy: 93.28% -> 92.54%     
client [41] (testset)   loss: 0.3796 -> 0.3467  accuracy: 88.37% -> 89.92%     
client [25] (testset)   loss: 0.2503 -> 0.1465  accuracy: 91.04% -> 94.98%     
client [58] (testset)   loss: 0.4669 -> 0.4550  accuracy: 89.02% -> 87.40%     
client [14] (testset)   loss: 0.1748 -> 0.0772  accuracy: 94.37% -> 97.18%     
client [33] (testset)   loss: 0.2773 -> 0.1568  accuracy: 91.41% -> 94.95%     
client [85] (testset)   loss: 0.3404 -> 0.2899  accuracy: 90.98% -> 91.73%     
client [62] (testset)   loss: 0.3682 -> 0.3395  accuracy: 90.00% -> 89.29%     
---------------------------- TRAINING EPOCH: 370 ----------------------------  
client [98] (testset)   loss: 0.4262 -> 0.3860  accuracy: 89.56% -> 91.76%     
client [63] (testset)   loss: 0.1801 -> 0.1597  accuracy: 92.50% -> 95.00%     
client [70] (testset)   loss: 0.2196 -> 0.2261  accuracy: 93.73% -> 93.73%     
client [65] (testset)   loss: 0.3483 -> 0.3516  accuracy: 92.71% -> 93.75%     
client [14] (testset)   loss: 0.1267 -> 0.0848  accuracy: 97.18% -> 96.71%     
client [73] (testset)   loss: 0.4616 -> 0.4268  accuracy: 89.26% -> 90.60%     
client [34] (testset)   loss: 0.1636 -> 0.1515  accuracy: 95.81% -> 96.34%     
client [99] (testset)   loss: 0.2608 -> 0.2980  accuracy: 91.41% -> 95.09%     
client [69] (testset)   loss: 0.2113 -> 0.2008  accuracy: 92.47% -> 91.78%     
client [46] (testset)   loss: 0.2937 -> 0.3077  accuracy: 91.79% -> 92.54%     
---------------------------- TRAINING EPOCH: 380 ----------------------------  
client [99] (testset)   loss: 0.2983 -> 0.2930  accuracy: 92.02% -> 95.71%     
client [93] (testset)   loss: 0.4745 -> 0.3883  accuracy: 88.28% -> 90.62%     
client [11] (testset)   loss: 0.1752 -> 0.2023  accuracy: 94.26% -> 92.62%     
client [58] (testset)   loss: 0.4289 -> 0.4416  accuracy: 89.02% -> 88.62%     
client [81] (testset)   loss: 0.4289 -> 0.2763  accuracy: 89.87% -> 91.19%     
client [85] (testset)   loss: 0.3178 -> 0.2671  accuracy: 90.23% -> 90.98%     
client [89] (testset)   loss: 0.3374 -> 0.2257  accuracy: 90.51% -> 94.89%     
client [45] (testset)   loss: 0.3656 -> 0.2246  accuracy: 89.91% -> 94.04%     
client [8]  (testset)   loss: 0.3178 -> 0.2955  accuracy: 91.37% -> 92.81%     
client [68] (testset)   loss: 0.4107 -> 0.4392  accuracy: 86.11% -> 83.33%     
---------------------------- TRAINING EPOCH: 390 ----------------------------  
client [67] (testset)   loss: 0.1171 -> 0.1379  accuracy: 96.55% -> 95.40%     
client [72] (testset)   loss: 0.3805 -> 0.3255  accuracy: 90.06% -> 91.93%     
client [1]  (testset)   loss: 0.2083 -> 0.3466  accuracy: 90.12% -> 90.12%     
client [78] (testset)   loss: 0.5363 -> 0.4771  accuracy: 87.50% -> 87.93%     
client [83] (testset)   loss: 0.5421 -> 0.4724  accuracy: 88.76% -> 91.01%     
client [21] (testset)   loss: 0.3228 -> 0.2819  accuracy: 90.80% -> 92.64%     
client [56] (testset)   loss: 0.3121 -> 0.2977  accuracy: 91.47% -> 93.02%     
client [44] (testset)   loss: 0.2797 -> 0.3044  accuracy: 94.59% -> 93.51%     
client [92] (testset)   loss: 0.3568 -> 0.2643  accuracy: 90.54% -> 92.34%     
client [27] (testset)   loss: 0.3045 -> 0.3218  accuracy: 93.21% -> 93.21%     
---------------------------- TRAINING EPOCH: 400 ----------------------------  
client [10] (testset)   loss: 0.1855 -> 0.1058  accuracy: 94.90% -> 97.96%     
client [39] (testset)   loss: 0.5867 -> 0.2926  accuracy: 87.79% -> 92.96%     
client [65] (testset)   loss: 0.3550 -> 0.3556  accuracy: 92.19% -> 93.75%     
client [26] (testset)   loss: 0.0903 -> 0.0727  accuracy: 98.23% -> 98.23%     
client [19] (testset)   loss: 0.2527 -> 0.2689  accuracy: 94.62% -> 95.38%     
client [68] (testset)   loss: 0.4856 -> 0.4281  accuracy: 83.33% -> 84.72%     
client [41] (testset)   loss: 0.3931 -> 0.4118  accuracy: 88.37% -> 86.82%     
client [50] (testset)   loss: 0.3188 -> 0.3125  accuracy: 92.47% -> 92.47%     
client [75] (testset)   loss: 0.1657 -> 0.1321  accuracy: 94.87% -> 94.87%     
client [81] (testset)   loss: 0.4167 -> 0.3033  accuracy: 90.75% -> 91.63%     
Training... ---------------------------------------- 100% 0:23:56
APFL's average time taken by each global epoch: 0 min 3.57 sec.                
APFL's total running time: 0 h 23 m 56 s.                                      
==================== APFL Experiment Results: ====================             
Display format: (before local fine-tuning) -> (after local fine-tuning)        
 So if finetune_epoch = 0, x.xx% -> 0.00% is normal.                           
 Centralized testing ONLY happens after model aggregation, so the stats between
'->' are the same.                                                             
{                                                                              
    "100": {                                                                   
        "all_clients": {                                                       
            "test": {                                                          
                "loss": "0.3193 -> 0.0000",                                    
                "accuracy": "88.61% -> 0.00%"                                  
            }                                                                  
        }                                                                      
    },                                                                         
    "200": {                                                                   
        "all_clients": {                                                       
            "test": {                                                          
                "loss": "0.3072 -> 0.0000",                                    
                "accuracy": "90.53% -> 0.00%"                                  
            }                                                                  
        }                                                                      
    },                                                                         
    "300": {                                                                   
        "all_clients": {                                                       
            "test": {                                                          
                "loss": "0.3208 -> 0.0000",                                    
                "accuracy": "90.96% -> 0.00%"                                  
            }                                                                  
        }                                                                      
    },                                                                         
    "400": {                                                                   
        "all_clients": {                                                       
            "test": {                                                          
                "loss": "0.3398 -> 0.0000",                                    
                "accuracy": "91.19% -> 0.00%"                                  
            }                                                                  
        }                                                                      
    }                                                                          
}                                                                              
==================== APFL Max Accuracy ====================                    
all_clients:                                                                   
(test) before fine-tuning: 91.19% at epoch 400                                 
(test) after fine-tuning: 0.00% at epoch 100                                   
[0m