==================== APFL ====================                                 
Experiment Arguments:                                                          
{
│   'method': 'apfl',
│   'dataset': {
│   │   'name': 'emnist',
│   │   'client_num': 100,
│   │   'test_ratio': 0.25,
│   │   'val_ratio': 0.0,
│   │   'seed': 42,
│   │   'split': 'sample',
│   │   'IID_ratio': 0.0,
│   │   'monitor_window_name_suffix': 'emnist-100clients-0%IID-Dir(1.0)-seed42',
│   │   'emnist_split': 'byclass',
│   │   'alpha': 1.0,
│   │   'min_samples_per_client': 10
│   },
│   'model': {
│   │   'name': 'avgcnn',
│   │   'use_torchvision_pretrained_weights': True,
│   │   'external_model_weights_path': None
│   },
│   'optimizer': {
│   │   'lr': 0.01,
│   │   'dampening': 0,
│   │   'weight_decay': 0,
│   │   'momentum': 0,
│   │   'nesterov': False,
│   │   'name': 'sgd'
│   },
│   'mode': 'serial',
│   'parallel': {
│   │   'ray_cluster_addr': None,
│   │   'num_cpus': None,
│   │   'num_gpus': None,
│   │   'num_workers': 2
│   },
│   'common': {
│   │   'seed': 42,
│   │   'join_ratio': 0.1,
│   │   'global_epoch': 400,
│   │   'local_epoch': 5,
│   │   'batch_size': 32,
│   │   'reset_optimizer_on_global_epoch': True,
│   │   'straggler_ratio': 0,
│   │   'straggler_min_local_epoch': 0,
│   │   'buffers': 'global',
│   │   'client_side_evaluation': True,
│   │   'test': {
│   │   │   'client': {
│   │   │   │   'interval': 100,
│   │   │   │   'finetune_epoch': 0,
│   │   │   │   'train': False,
│   │   │   │   'val': False,
│   │   │   │   'test': True
│   │   │   },
│   │   │   'server': {
│   │   │   │   'interval': -1,
│   │   │   │   'train': False,
│   │   │   │   'val': False,
│   │   │   │   'test': False,
│   │   │   │   'model_in_train_mode': False
│   │   │   }
│   │   },
│   │   'verbose_gap': 10,
│   │   'monitor': None,
│   │   'use_cuda': True,
│   │   'save_log': True,
│   │   'save_model': False,
│   │   'save_learning_curve_plot': False,
│   │   'save_metrics': True,
│   │   'delete_useless_run': True
│   },
│   'apfl': {
│   │   'alpha': 0.5,
│   │   'adaptive_alpha': 1
│   }
}
---------------------------- TRAINING EPOCH: 10 ----------------------------   
client [77] (testset)   loss: 0.4360 -> 0.4572  accuracy: 81.75% -> 85.30%     
client [81] (testset)   loss: 0.3685 -> 0.4712  accuracy: 87.43% -> 80.08%     
client [21] (testset)   loss: 0.6534 -> 0.5322  accuracy: 83.19% -> 83.24%     
client [68] (testset)   loss: 0.4247 -> 0.6575  accuracy: 85.44% -> 84.20%     
client [93] (testset)   loss: 0.4612 -> 0.5439  accuracy: 83.21% -> 82.34%     
client [31] (testset)   loss: 0.5016 -> 0.5601  accuracy: 82.06% -> 81.35%     
client [20] (testset)   loss: 0.5803 -> 0.5816  accuracy: 80.64% -> 80.95%     
client [59] (testset)   loss: 0.4910 -> 0.3321  accuracy: 87.70% -> 90.60%     
client [48] (testset)   loss: 0.4967 -> 0.4500  accuracy: 81.46% -> 85.92%     
client [34] (testset)   loss: 0.4715 -> 0.4785  accuracy: 79.97% -> 83.64%     
---------------------------- TRAINING EPOCH: 20 ----------------------------   
client [69] (testset)   loss: 0.5128 -> 0.3761  accuracy: 79.35% -> 87.63%     
client [99] (testset)   loss: 0.5072 -> 0.5111  accuracy: 81.99% -> 83.25%     
client [67] (testset)   loss: 0.4846 -> 0.3635  accuracy: 81.86% -> 89.55%     
client [0]  (testset)   loss: 0.3909 -> 0.4134  accuracy: 85.92% -> 87.41%     
client [76] (testset)   loss: 0.5481 -> 0.4860  accuracy: 81.64% -> 83.94%     
client [41] (testset)   loss: 0.5413 -> 0.5408  accuracy: 78.81% -> 80.85%     
client [62] (testset)   loss: 0.5102 -> 0.3747  accuracy: 87.64% -> 88.74%     
client [2]  (testset)   loss: 0.4517 -> 0.3585  accuracy: 87.40% -> 89.48%     
client [14] (testset)   loss: 0.4858 -> 0.4947  accuracy: 84.07% -> 83.76%     
client [46] (testset)   loss: 0.5360 -> 0.4020  accuracy: 75.92% -> 87.29%     
---------------------------- TRAINING EPOCH: 30 ----------------------------   
client [24] (testset)   loss: 0.4101 -> 0.4552  accuracy: 84.63% -> 83.67%     
client [68] (testset)   loss: 0.4115 -> 0.3999  accuracy: 86.19% -> 88.04%     
client [57] (testset)   loss: 0.3572 -> 0.3633  accuracy: 88.07% -> 88.64%     
client [17] (testset)   loss: 0.4848 -> 0.4942  accuracy: 83.50% -> 85.98%     
client [54] (testset)   loss: 0.4652 -> 0.4833  accuracy: 83.17% -> 84.04%     
client [23] (testset)   loss: 0.5231 -> 0.4471  accuracy: 84.42% -> 86.07%     
client [35] (testset)   loss: 0.5211 -> 0.5042  accuracy: 83.61% -> 86.01%     
client [59] (testset)   loss: 0.3750 -> 0.3210  accuracy: 86.65% -> 91.35%     
client [31] (testset)   loss: 0.4561 -> 0.5338  accuracy: 84.06% -> 84.51%     
client [9]  (testset)   loss: 0.5075 -> 0.4175  accuracy: 85.43% -> 85.72%     
---------------------------- TRAINING EPOCH: 40 ----------------------------   
client [64] (testset)   loss: 0.3654 -> 0.3802  accuracy: 88.72% -> 89.52%     
client [33] (testset)   loss: 0.4417 -> 0.4232  accuracy: 84.49% -> 86.09%     
client [16] (testset)   loss: 0.4716 -> 0.5135  accuracy: 84.65% -> 84.86%     
client [44] (testset)   loss: 0.5033 -> 0.5044  accuracy: 83.85% -> 83.79%     
client [8]  (testset)   loss: 0.4404 -> 0.4329  accuracy: 87.06% -> 87.81%     
client [31] (testset)   loss: 0.4918 -> 0.5155  accuracy: 83.96% -> 84.61%     
client [47] (testset)   loss: 0.4937 -> 0.4001  accuracy: 82.81% -> 88.26%     
client [36] (testset)   loss: 0.3602 -> 0.2826  accuracy: 86.89% -> 90.91%     
client [20] (testset)   loss: 0.6089 -> 0.5748  accuracy: 81.13% -> 83.13%     
client [56] (testset)   loss: 0.5382 -> 0.4896  accuracy: 83.45% -> 82.96%     
---------------------------- TRAINING EPOCH: 50 ----------------------------   
client [4]  (testset)   loss: 0.3713 -> 0.3516  accuracy: 86.74% -> 88.56%     
client [60] (testset)   loss: 0.4036 -> 0.4267  accuracy: 86.95% -> 87.16%     
client [28] (testset)   loss: 0.4098 -> 0.3605  accuracy: 86.38% -> 90.24%     
client [25] (testset)   loss: 0.4079 -> 0.4323  accuracy: 87.04% -> 87.49%     
client [58] (testset)   loss: 0.4297 -> 0.4159  accuracy: 87.22% -> 88.97%     
client [44] (testset)   loss: 0.5130 -> 0.5247  accuracy: 82.96% -> 82.96%     
client [39] (testset)   loss: 0.4669 -> 0.4393  accuracy: 83.02% -> 85.09%     
client [29] (testset)   loss: 0.5363 -> 0.5008  accuracy: 82.78% -> 85.59%     
client [3]  (testset)   loss: 0.3898 -> 0.4333  accuracy: 86.30% -> 86.35%     
client [84] (testset)   loss: 0.4785 -> 0.4847  accuracy: 84.79% -> 87.17%     
---------------------------- TRAINING EPOCH: 60 ----------------------------   
client [21] (testset)   loss: 0.5211 -> 0.5538  accuracy: 84.05% -> 85.23%     
client [84] (testset)   loss: 0.5295 -> 0.4739  accuracy: 83.32% -> 87.11%     
client [10] (testset)   loss: 0.5271 -> 0.4148  accuracy: 81.89% -> 88.78%     
client [36] (testset)   loss: 0.3056 -> 0.3027  accuracy: 88.69% -> 90.70%     
client [65] (testset)   loss: 0.3500 -> 0.3879  accuracy: 88.52% -> 89.82%     
client [81] (testset)   loss: 0.3457 -> 0.3297  accuracy: 89.34% -> 90.80%     
client [79] (testset)   loss: 0.3350 -> 0.3289  accuracy: 90.54% -> 91.65%     
client [42] (testset)   loss: 0.4567 -> 0.3941  accuracy: 82.42% -> 89.54%     
client [11] (testset)   loss: 0.4474 -> 0.4759  accuracy: 86.50% -> 87.48%     
client [96] (testset)   loss: 0.4168 -> 0.4245  accuracy: 86.20% -> 86.85%     
---------------------------- TRAINING EPOCH: 70 ----------------------------   
client [8]  (testset)   loss: 0.4470 -> 0.4322  accuracy: 87.20% -> 88.65%     
client [53] (testset)   loss: 0.4012 -> 0.3655  accuracy: 88.04% -> 89.72%     
client [52] (testset)   loss: 0.5472 -> 0.3947  accuracy: 80.41% -> 88.02%     
client [42] (testset)   loss: 0.4494 -> 0.3913  accuracy: 83.57% -> 89.54%     
client [69] (testset)   loss: 0.4415 -> 0.4348  accuracy: 84.44% -> 88.44%     
client [59] (testset)   loss: 0.3442 -> 0.3471  accuracy: 89.38% -> 91.86%     
client [7]  (testset)   loss: 0.5474 -> 0.5038  accuracy: 80.69% -> 84.98%     
client [26] (testset)   loss: 0.3438 -> 0.3653  accuracy: 90.24% -> 90.49%     
client [49] (testset)   loss: 0.4711 -> 0.4655  accuracy: 84.20% -> 87.31%     
client [98] (testset)   loss: 0.4976 -> 0.4671  accuracy: 85.27% -> 86.55%     
---------------------------- TRAINING EPOCH: 80 ----------------------------   
client [98] (testset)   loss: 0.5719 -> 0.4841  accuracy: 82.96% -> 86.17%     
client [47] (testset)   loss: 0.4588 -> 0.4214  accuracy: 85.53% -> 88.34%     
client [21] (testset)   loss: 0.5486 -> 0.5730  accuracy: 84.46% -> 84.78%     
client [77] (testset)   loss: 0.4187 -> 0.4569  accuracy: 85.26% -> 88.11%     
client [95] (testset)   loss: 0.4336 -> 0.4055  accuracy: 86.73% -> 90.20%     
client [91] (testset)   loss: 0.6116 -> 0.5688  accuracy: 81.66% -> 84.77%     
client [14] (testset)   loss: 0.4929 -> 0.5387  accuracy: 84.98% -> 86.04%     
client [99] (testset)   loss: 0.5431 -> 0.7111  accuracy: 82.15% -> 82.78%     
client [20] (testset)   loss: 0.6331 -> 0.6088  accuracy: 81.04% -> 83.36%     
client [39] (testset)   loss: 0.4553 -> 0.4716  accuracy: 85.09% -> 85.54%     
---------------------------- TRAINING EPOCH: 90 ----------------------------   
client [52] (testset)   loss: 0.5581 -> 0.4028  accuracy: 80.17% -> 87.30%     
client [62] (testset)   loss: 0.4523 -> 0.4124  accuracy: 87.23% -> 89.38%     
client [71] (testset)   loss: 0.5006 -> 0.5024  accuracy: 85.55% -> 87.49%     
client [97] (testset)   loss: 0.4449 -> 0.4571  accuracy: 85.90% -> 88.23%     
client [30] (testset)   loss: 0.4526 -> 0.4507  accuracy: 84.90% -> 87.43%     
client [88] (testset)   loss: 0.4981 -> 0.4377  accuracy: 85.19% -> 88.19%     
client [60] (testset)   loss: 0.4075 -> 0.4674  accuracy: 87.40% -> 87.24%     
client [82] (testset)   loss: 0.4624 -> 0.4768  accuracy: 85.75% -> 87.02%     
client [91] (testset)   loss: 0.6454 -> 0.5418  accuracy: 81.40% -> 85.55%     
client [57] (testset)   loss: 0.4218 -> 0.4056  accuracy: 87.94% -> 88.90%     
---------------------------- TRAINING EPOCH: 100 ----------------------------  
client [31] (testset)   loss: 0.5325 -> 0.5917  accuracy: 82.41% -> 85.56%     
client [15] (testset)   loss: 0.4113 -> 0.4456  accuracy: 85.64% -> 86.13%     
client [71] (testset)   loss: 0.5628 -> 0.5114  accuracy: 84.04% -> 86.20%     
client [97] (testset)   loss: 0.4641 -> 0.4642  accuracy: 85.73% -> 87.84%     
client [53] (testset)   loss: 0.4546 -> 0.3886  accuracy: 85.09% -> 89.08%     
client [77] (testset)   loss: 0.4259 -> 0.4661  accuracy: 83.96% -> 87.04%     
client [76] (testset)   loss: 0.6047 -> 0.5114  accuracy: 81.79% -> 87.94%     
client [79] (testset)   loss: 0.4049 -> 0.3628  accuracy: 88.18% -> 91.51%     
client [28] (testset)   loss: 0.4530 -> 0.3885  accuracy: 85.88% -> 90.46%     
client [99] (testset)   loss: 0.5590 -> 0.6629  accuracy: 82.83% -> 81.89%     
---------------------------- TRAINING EPOCH: 110 ----------------------------  
client [97] (testset)   loss: 0.4488 -> 0.4908  accuracy: 86.76% -> 88.61%     
client [86] (testset)   loss: 0.3819 -> 0.4042  accuracy: 88.64% -> 90.34%     
client [34] (testset)   loss: 0.5277 -> 0.5101  accuracy: 81.05% -> 84.72%     
client [73] (testset)   loss: 0.4188 -> 0.4551  accuracy: 86.46% -> 88.75%     
client [5]  (testset)   loss: 0.5197 -> 0.3612  accuracy: 85.79% -> 90.85%     
client [96] (testset)   loss: 0.4480 -> 0.5021  accuracy: 86.24% -> 86.89%     
client [22] (testset)   loss: 0.5518 -> 0.5146  accuracy: 84.17% -> 87.58%     
client [60] (testset)   loss: 0.4387 -> 0.5020  accuracy: 87.08% -> 87.44%     
client [66] (testset)   loss: 0.5572 -> 0.4701  accuracy: 83.42% -> 86.89%     
client [83] (testset)   loss: 0.5836 -> 0.4234  accuracy: 82.55% -> 89.01%     
---------------------------- TRAINING EPOCH: 120 ----------------------------  
client [76] (testset)   loss: 0.5527 -> 0.5385  accuracy: 85.04% -> 87.94%     
client [65] (testset)   loss: 0.3915 -> 0.4404  accuracy: 88.73% -> 89.26%     
client [95] (testset)   loss: 0.4297 -> 0.4260  accuracy: 88.53% -> 89.96%     
client [17] (testset)   loss: 0.5615 -> 0.5785  accuracy: 84.44% -> 86.58%     
client [8]  (testset)   loss: 0.4552 -> 0.4830  accuracy: 88.33% -> 88.65%     
client [35] (testset)   loss: 0.5867 -> 0.5712  accuracy: 84.66% -> 86.81%     
client [98] (testset)   loss: 0.5552 -> 0.5154  accuracy: 85.87% -> 86.59%     
client [53] (testset)   loss: 0.4039 -> 0.4473  accuracy: 88.92% -> 86.25%     
client [43] (testset)   loss: 0.4106 -> 0.4138  accuracy: 86.87% -> 89.06%     
client [64] (testset)   loss: 0.4017 -> 0.4215  accuracy: 88.89% -> 89.18%     
---------------------------- TRAINING EPOCH: 130 ----------------------------  
client [21] (testset)   loss: 0.6243 -> 0.6100  accuracy: 84.19% -> 85.00%     
client [88] (testset)   loss: 0.5424 -> 0.4871  accuracy: 85.84% -> 87.74%     
client [38] (testset)   loss: 0.4852 -> 0.4890  accuracy: 86.54% -> 87.77%     
client [3]  (testset)   loss: 0.5317 -> 0.5169  accuracy: 84.58% -> 86.53%     
client [5]  (testset)   loss: 0.5336 -> 0.3998  accuracy: 86.75% -> 90.65%     
client [41] (testset)   loss: 0.6562 -> 0.6459  accuracy: 80.74% -> 81.11%     
client [7]  (testset)   loss: 0.6991 -> 0.5753  accuracy: 80.17% -> 84.20%     
client [37] (testset)   loss: 0.6273 -> 0.5784  accuracy: 82.59% -> 83.90%     
client [45] (testset)   loss: 0.4817 -> 0.4842  accuracy: 85.90% -> 86.83%     
client [47] (testset)   loss: 0.5123 -> 0.4596  accuracy: 86.16% -> 87.67%     
---------------------------- TRAINING EPOCH: 140 ----------------------------  
client [16] (testset)   loss: 0.5745 -> 0.5770  accuracy: 81.25% -> 85.00%     
client [11] (testset)   loss: 0.5344 -> 0.5325  accuracy: 84.87% -> 88.37%     
client [37] (testset)   loss: 0.5636 -> 0.5977  accuracy: 84.55% -> 83.84%     
client [41] (testset)   loss: 0.6038 -> 0.6466  accuracy: 78.97% -> 81.47%     
client [95] (testset)   loss: 0.4865 -> 0.4434  accuracy: 85.16% -> 89.68%     
client [53] (testset)   loss: 0.4883 -> 0.4165  accuracy: 84.14% -> 89.76%     
client [22] (testset)   loss: 0.5718 -> 0.5300  accuracy: 83.82% -> 87.69%     
client [25] (testset)   loss: 0.4779 -> 0.4521  accuracy: 86.06% -> 88.06%     
client [69] (testset)   loss: 0.5624 -> 0.5018  accuracy: 82.22% -> 87.63%     
client [46] (testset)   loss: 0.5421 -> 0.4453  accuracy: 80.75% -> 88.75%     
---------------------------- TRAINING EPOCH: 150 ----------------------------  
client [47] (testset)   loss: 0.4712 -> 0.5075  accuracy: 85.70% -> 88.43%     
client [69] (testset)   loss: 0.5793 -> 0.5058  accuracy: 81.53% -> 88.28%     
client [82] (testset)   loss: 0.5088 -> 0.5254  accuracy: 85.61% -> 87.02%     
client [45] (testset)   loss: 0.4778 -> 0.4898  accuracy: 85.80% -> 87.02%     
client [7]  (testset)   loss: 0.6120 -> 0.5671  accuracy: 81.68% -> 83.73%     
client [50] (testset)   loss: 0.3827 -> 0.4020  accuracy: 89.03% -> 91.41%     
client [35] (testset)   loss: 0.6025 -> 0.6227  accuracy: 84.10% -> 86.20%     
client [24] (testset)   loss: 0.5220 -> 0.5560  accuracy: 82.59% -> 84.15%     
client [15] (testset)   loss: 0.4590 -> 0.5165  accuracy: 84.65% -> 84.65%     
client [58] (testset)   loss: 0.5131 -> 0.5190  accuracy: 85.07% -> 88.75%     
---------------------------- TRAINING EPOCH: 160 ----------------------------  
client [48] (testset)   loss: 0.5405 -> 0.5103  accuracy: 85.56% -> 87.76%     
client [76] (testset)   loss: 0.6385 -> 0.5407  accuracy: 84.04% -> 87.64%     
client [67] (testset)   loss: 0.5457 -> 0.4351  accuracy: 84.75% -> 90.10%     
client [37] (testset)   loss: 0.5969 -> 0.6240  accuracy: 83.44% -> 83.57%     
client [58] (testset)   loss: 0.4946 -> 0.5154  accuracy: 87.17% -> 89.01%     
client [64] (testset)   loss: 0.4328 -> 0.4525  accuracy: 87.85% -> 89.06%     
client [77] (testset)   loss: 0.5158 -> 0.5124  accuracy: 83.45% -> 88.38%     
client [55] (testset)   loss: 0.4872 -> 0.5235  accuracy: 86.54% -> 87.79%     
client [12] (testset)   loss: 0.4942 -> 0.4607  accuracy: 87.35% -> 89.42%     
client [89] (testset)   loss: 0.5068 -> 0.4628  accuracy: 87.84% -> 89.29%     
---------------------------- TRAINING EPOCH: 170 ----------------------------  
client [84] (testset)   loss: 0.6303 -> 0.6175  accuracy: 79.84% -> 86.56%     
client [51] (testset)   loss: 0.7320 -> 0.7425  accuracy: 77.16% -> 82.13%     
client [8]  (testset)   loss: 0.5428 -> 0.5164  accuracy: 84.67% -> 88.70%     
client [18] (testset)   loss: 0.5272 -> 0.5017  accuracy: 84.14% -> 86.98%     
client [94] (testset)   loss: 0.6156 -> 0.5776  accuracy: 81.83% -> 84.73%     
client [81] (testset)   loss: 0.4388 -> 0.3665  accuracy: 86.25% -> 91.02%     
client [3]  (testset)   loss: 0.5118 -> 0.5748  accuracy: 84.81% -> 86.62%     
client [11] (testset)   loss: 0.5635 -> 0.6246  accuracy: 84.33% -> 86.55%     
client [95] (testset)   loss: 0.5023 -> 0.4490  accuracy: 84.54% -> 90.63%     
client [67] (testset)   loss: 0.5348 -> 0.4471  accuracy: 84.62% -> 90.18%     
---------------------------- TRAINING EPOCH: 180 ----------------------------  
client [21] (testset)   loss: 0.6264 -> 0.6299  accuracy: 83.87% -> 84.28%     
client [79] (testset)   loss: 0.4106 -> 0.4035  accuracy: 89.12% -> 91.96%     
client [58] (testset)   loss: 0.5318 -> 0.5441  accuracy: 86.03% -> 88.44%     
client [88] (testset)   loss: 0.5893 -> 0.5433  accuracy: 85.34% -> 88.09%     
client [46] (testset)   loss: 0.6518 -> 0.4630  accuracy: 77.57% -> 87.93%     
client [11] (testset)   loss: 0.5581 -> 0.5744  accuracy: 85.51% -> 87.83%     
client [55] (testset)   loss: 0.4912 -> 0.5337  accuracy: 86.49% -> 87.73%     
client [13] (testset)   loss: 0.5732 -> 0.3883  accuracy: 82.66% -> 90.58%     
client [31] (testset)   loss: 0.5612 -> 0.6732  accuracy: 84.06% -> 84.61%     
client [75] (testset)   loss: 0.5351 -> 0.5029  accuracy: 85.86% -> 88.77%     
---------------------------- TRAINING EPOCH: 190 ----------------------------  
client [19] (testset)   loss: 0.4720 -> 0.4607  accuracy: 87.89% -> 89.00%     
client [7]  (testset)   loss: 0.6808 -> 0.5838  accuracy: 81.16% -> 84.51%     
client [57] (testset)   loss: 0.5141 -> 0.4812  accuracy: 86.72% -> 88.99%     
client [13] (testset)   loss: 0.6338 -> 0.3906  accuracy: 81.55% -> 91.14%     
client [43] (testset)   loss: 0.4611 -> 0.4446  accuracy: 86.03% -> 88.36%     
client [91] (testset)   loss: 0.7449 -> 0.6435  accuracy: 81.98% -> 84.25%     
client [10] (testset)   loss: 0.6510 -> 0.5049  accuracy: 83.11% -> 88.58%     
client [64] (testset)   loss: 0.4648 -> 0.4886  accuracy: 86.70% -> 89.18%     
client [82] (testset)   loss: 0.5153 -> 0.5616  accuracy: 86.70% -> 86.93%     
client [22] (testset)   loss: 0.6632 -> 0.5885  accuracy: 82.90% -> 88.21%     
---------------------------- TRAINING EPOCH: 200 ----------------------------  
client [20] (testset)   loss: 0.8485 -> 0.7512  accuracy: 79.57% -> 83.44%     
client [23] (testset)   loss: 0.6030 -> 0.6162  accuracy: 84.82% -> 86.41%     
client [88] (testset)   loss: 0.6168 -> 0.5402  accuracy: 85.24% -> 87.99%     
client [98] (testset)   loss: 0.5844 -> 0.6111  accuracy: 85.65% -> 86.04%     
client [79] (testset)   loss: 0.3853 -> 0.4476  accuracy: 90.85% -> 91.65%     
client [21] (testset)   loss: 0.7147 -> 0.6478  accuracy: 82.96% -> 84.50%     
client [92] (testset)   loss: 0.6637 -> 0.6028  accuracy: 85.66% -> 87.07%     
client [56] (testset)   loss: 0.7060 -> 0.7452  accuracy: 82.96% -> 83.32%     
client [5]  (testset)   loss: 0.6250 -> 0.4439  accuracy: 85.47% -> 90.65%     
client [52] (testset)   loss: 0.8357 -> 0.4884  accuracy: 78.49% -> 87.00%     
---------------------------- TRAINING EPOCH: 210 ----------------------------  
client [67] (testset)   loss: 0.7116 -> 0.4688  accuracy: 81.53% -> 91.02%     
client [54] (testset)   loss: 0.6695 -> 0.6610  accuracy: 81.22% -> 84.20%     
client [14] (testset)   loss: 0.6495 -> 0.6689  accuracy: 83.76% -> 86.04%     
client [99] (testset)   loss: 0.7074 -> 0.7205  accuracy: 81.41% -> 83.62%     
client [36] (testset)   loss: 0.3496 -> 0.3815  accuracy: 90.21% -> 92.29%     
client [30] (testset)   loss: 0.5787 -> 0.5564  accuracy: 84.94% -> 86.95%     
client [38] (testset)   loss: 0.5197 -> 0.5383  accuracy: 87.03% -> 87.28%     
client [15] (testset)   loss: 0.4786 -> 0.5404  accuracy: 84.70% -> 85.04%     
client [6]  (testset)   loss: 0.5362 -> 0.5599  accuracy: 85.50% -> 87.71%     
client [53] (testset)   loss: 0.5433 -> 0.5049  accuracy: 83.58% -> 89.04%     
---------------------------- TRAINING EPOCH: 220 ----------------------------  
client [99] (testset)   loss: 0.6889 -> 0.7605  accuracy: 82.41% -> 83.31%     
client [6]  (testset)   loss: 0.6114 -> 0.5689  accuracy: 82.84% -> 87.88%     
client [83] (testset)   loss: 0.7262 -> 0.5581  accuracy: 83.13% -> 88.25%     
client [42] (testset)   loss: 0.5503 -> 0.4906  accuracy: 84.17% -> 89.43%     
client [34] (testset)   loss: 0.6465 -> 0.5734  accuracy: 80.08% -> 85.53%     
client [15] (testset)   loss: 0.5028 -> 0.5531  accuracy: 84.85% -> 85.59%     
client [47] (testset)   loss: 0.5541 -> 0.5475  accuracy: 85.91% -> 88.97%     
client [55] (testset)   loss: 0.5175 -> 0.5528  accuracy: 86.54% -> 87.63%     
client [51] (testset)   loss: 0.7908 -> 0.7928  accuracy: 78.19% -> 81.30%     
client [95] (testset)   loss: 0.5094 -> 0.5034  accuracy: 87.54% -> 90.44%     
---------------------------- TRAINING EPOCH: 230 ----------------------------  
client [71] (testset)   loss: 0.5902 -> 0.6218  accuracy: 85.82% -> 86.52%     
client [15] (testset)   loss: 0.5298 -> 0.5529  accuracy: 84.60% -> 86.13%     
client [33] (testset)   loss: 0.5691 -> 0.5496  accuracy: 85.35% -> 86.28%     
client [99] (testset)   loss: 0.7004 -> 0.7551  accuracy: 82.04% -> 83.57%     
client [90] (testset)   loss: 0.6960 -> 0.7153  accuracy: 79.83% -> 82.89%     
client [57] (testset)   loss: 0.5636 -> 0.5143  accuracy: 86.06% -> 88.73%     
client [27] (testset)   loss: 0.5622 -> 0.5809  accuracy: 85.70% -> 86.87%     
client [78] (testset)   loss: 0.5457 -> 0.5501  accuracy: 84.81% -> 85.26%     
client [36] (testset)   loss: 0.4377 -> 0.3886  accuracy: 87.66% -> 91.77%     
client [88] (testset)   loss: 0.5943 -> 0.5822  accuracy: 85.89% -> 87.84%     
---------------------------- TRAINING EPOCH: 240 ----------------------------  
client [70] (testset)   loss: 0.5004 -> 0.5592  accuracy: 86.32% -> 87.75%     
client [35] (testset)   loss: 0.6610 -> 0.7106  accuracy: 85.77% -> 85.77%     
client [16] (testset)   loss: 0.7432 -> 0.6935  accuracy: 79.44% -> 84.79%     
client [80] (testset)   loss: 0.5725 -> 0.6084  accuracy: 86.49% -> 87.19%     
client [38] (testset)   loss: 0.5537 -> 0.5959  accuracy: 86.97% -> 87.22%     
client [78] (testset)   loss: 0.5868 -> 0.5586  accuracy: 84.27% -> 85.12%     
client [68] (testset)   loss: 0.5381 -> 0.5313  accuracy: 85.74% -> 88.19%     
client [11] (testset)   loss: 0.6126 -> 0.6376  accuracy: 84.57% -> 86.84%     
client [64] (testset)   loss: 0.5614 -> 0.4958  accuracy: 85.32% -> 90.16%     
client [82] (testset)   loss: 0.5528 -> 0.6058  accuracy: 87.06% -> 86.70%     
---------------------------- TRAINING EPOCH: 250 ----------------------------  
client [30] (testset)   loss: 0.6743 -> 0.5858  accuracy: 83.53% -> 87.21%     
client [27] (testset)   loss: 0.6153 -> 0.6183  accuracy: 85.23% -> 85.95%     
client [74] (testset)   loss: 0.4755 -> 0.4479  accuracy: 87.27% -> 89.24%     
client [45] (testset)   loss: 0.5792 -> 0.5652  accuracy: 85.46% -> 87.17%     
client [6]  (testset)   loss: 0.6508 -> 0.6213  accuracy: 83.40% -> 87.11%     
client [36] (testset)   loss: 0.4087 -> 0.3870  accuracy: 88.80% -> 92.25%     
client [63] (testset)   loss: 0.4927 -> 0.4659  accuracy: 88.60% -> 90.88%     
client [76] (testset)   loss: 0.7067 -> 0.6273  accuracy: 83.39% -> 88.24%     
client [83] (testset)   loss: 0.7900 -> 0.5693  accuracy: 81.70% -> 88.11%     
client [86] (testset)   loss: 0.4796 -> 0.4926  accuracy: 87.98% -> 89.46%     
---------------------------- TRAINING EPOCH: 260 ----------------------------  
client [83] (testset)   loss: 0.7197 -> 0.5862  accuracy: 82.19% -> 88.69%     
client [99] (testset)   loss: 0.6947 -> 0.7750  accuracy: 81.67% -> 83.36%     
client [74] (testset)   loss: 0.4407 -> 0.4516  accuracy: 88.05% -> 89.86%     
client [73] (testset)   loss: 0.5773 -> 0.5230  accuracy: 84.62% -> 88.13%     
client [29] (testset)   loss: 0.7669 -> 0.6744  accuracy: 81.23% -> 84.95%     
client [92] (testset)   loss: 0.6785 -> 0.6705  accuracy: 85.06% -> 87.37%     
client [6]  (testset)   loss: 0.7769 -> 0.6176  accuracy: 79.19% -> 87.33%     
client [61] (testset)   loss: 0.6378 -> 0.6066  accuracy: 83.46% -> 85.36%     
client [21] (testset)   loss: 0.7205 -> 0.7180  accuracy: 82.42% -> 84.19%     
client [67] (testset)   loss: 0.5872 -> 0.4917  accuracy: 85.25% -> 90.76%     
---------------------------- TRAINING EPOCH: 270 ----------------------------  
client [83] (testset)   loss: 0.8400 -> 0.5534  accuracy: 81.11% -> 89.19%     
client [32] (testset)   loss: 0.6105 -> 0.6868  accuracy: 82.17% -> 82.40%     
client [95] (testset)   loss: 0.5456 -> 0.5327  accuracy: 87.73% -> 89.49%     
client [61] (testset)   loss: 0.7072 -> 0.6309  accuracy: 83.33% -> 84.77%     
client [27] (testset)   loss: 0.6629 -> 0.6139  accuracy: 83.93% -> 86.83%     
client [25] (testset)   loss: 0.5499 -> 0.5595  accuracy: 86.75% -> 87.16%     
client [68] (testset)   loss: 0.5987 -> 0.5572  accuracy: 85.79% -> 88.38%     
client [34] (testset)   loss: 0.7375 -> 0.6212  accuracy: 79.75% -> 84.72%     
client [71] (testset)   loss: 0.7491 -> 0.6677  accuracy: 83.88% -> 85.88%     
client [89] (testset)   loss: 0.5771 -> 0.5439  accuracy: 87.74% -> 88.95%     
---------------------------- TRAINING EPOCH: 280 ----------------------------  
client [78] (testset)   loss: 0.5556 -> 0.6086  accuracy: 84.99% -> 85.71%     
client [81] (testset)   loss: 0.4891 -> 0.4681  accuracy: 87.71% -> 90.57%     
client [51] (testset)   loss: 0.8626 -> 0.8462  accuracy: 77.50% -> 81.50%     
client [54] (testset)   loss: 0.6609 -> 0.7297  accuracy: 83.33% -> 84.28%     
client [65] (testset)   loss: 0.4815 -> 0.5245  accuracy: 88.08% -> 89.39%     
client [41] (testset)   loss: 0.6714 -> 0.7577  accuracy: 81.05% -> 82.46%     
client [11] (testset)   loss: 0.6659 -> 0.6498  accuracy: 83.74% -> 86.69%     
client [85] (testset)   loss: 0.3923 -> 0.4137  accuracy: 91.51% -> 90.46%     
client [12] (testset)   loss: 0.6061 -> 0.5706  accuracy: 85.35% -> 89.36%     
client [23] (testset)   loss: 0.6763 -> 0.6457  accuracy: 83.85% -> 86.19%     
---------------------------- TRAINING EPOCH: 290 ----------------------------  
client [16] (testset)   loss: 0.8017 -> 0.6962  accuracy: 78.19% -> 85.76%     
client [65] (testset)   loss: 0.4581 -> 0.5044  accuracy: 89.39% -> 89.65%     
client [53] (testset)   loss: 0.6415 -> 0.5551  accuracy: 83.14% -> 88.56%     
client [58] (testset)   loss: 0.5467 -> 0.6133  accuracy: 86.82% -> 88.70%     
client [72] (testset)   loss: 0.5997 -> 0.6826  accuracy: 84.82% -> 86.31%     
client [7]  (testset)   loss: 0.7037 -> 0.6766  accuracy: 81.74% -> 83.83%     
client [71] (testset)   loss: 0.7766 -> 0.7115  accuracy: 82.53% -> 85.98%     
client [59] (testset)   loss: 0.5787 -> 0.4497  accuracy: 85.22% -> 91.81%     
client [86] (testset)   loss: 0.4910 -> 0.5056  accuracy: 87.59% -> 89.29%     
client [39] (testset)   loss: 0.6514 -> 0.6160  accuracy: 82.68% -> 84.53%     
---------------------------- TRAINING EPOCH: 300 ----------------------------  
client [99] (testset)   loss: 0.7518 -> 0.8093  accuracy: 81.52% -> 83.04%     
client [7]  (testset)   loss: 0.8294 -> 0.7163  accuracy: 79.43% -> 83.73%     
client [17] (testset)   loss: 0.7122 -> 0.7451  accuracy: 82.44% -> 86.75%     
client [64] (testset)   loss: 0.5393 -> 0.5596  accuracy: 86.99% -> 88.89%     
client [37] (testset)   loss: 0.6772 -> 0.7373  accuracy: 83.57% -> 83.64%     
client [29] (testset)   loss: 0.7456 -> 0.7363  accuracy: 82.62% -> 85.91%     
client [93] (testset)   loss: 0.7033 -> 0.6794  accuracy: 83.15% -> 85.57%     
client [73] (testset)   loss: 0.6365 -> 0.5565  accuracy: 84.35% -> 88.64%     
client [40] (testset)   loss: 0.7652 -> 0.7520  accuracy: 80.47% -> 81.46%     
client [76] (testset)   loss: 0.8164 -> 0.6372  accuracy: 81.04% -> 87.84%     
---------------------------- TRAINING EPOCH: 310 ----------------------------  
client [31] (testset)   loss: 0.7099 -> 0.7871  accuracy: 83.01% -> 84.31%     
client [89] (testset)   loss: 0.6351 -> 0.5661  accuracy: 86.78% -> 89.29%     
client [77] (testset)   loss: 0.6187 -> 0.6665  accuracy: 84.31% -> 87.83%     
client [90] (testset)   loss: 0.7900 -> 0.8073  accuracy: 79.04% -> 83.23%     
client [26] (testset)   loss: 0.5261 -> 0.4983  accuracy: 88.10% -> 90.89%     
client [50] (testset)   loss: 0.4711 -> 0.4712  accuracy: 88.57% -> 91.41%     
client [30] (testset)   loss: 0.7291 -> 0.6397  accuracy: 83.62% -> 87.30%     
client [70] (testset)   loss: 0.6078 -> 0.6095  accuracy: 85.68% -> 87.47%     
client [41] (testset)   loss: 0.7262 -> 0.7901  accuracy: 81.05% -> 82.36%     
client [99] (testset)   loss: 0.7729 -> 0.8139  accuracy: 82.62% -> 82.94%     
---------------------------- TRAINING EPOCH: 320 ----------------------------  
client [68] (testset)   loss: 0.6100 -> 0.5832  accuracy: 84.85% -> 88.43%     
client [70] (testset)   loss: 0.5502 -> 0.6137  accuracy: 86.60% -> 87.39%     
client [52] (testset)   loss: 0.7727 -> 0.6257  accuracy: 80.89% -> 86.70%     
client [1]  (testset)   loss: 0.5671 -> 0.5923  accuracy: 87.12% -> 89.02%     
client [2]  (testset)   loss: 0.5561 -> 0.5408  accuracy: 87.21% -> 88.44%     
client [67] (testset)   loss: 0.6526 -> 0.5430  accuracy: 85.04% -> 90.51%     
client [92] (testset)   loss: 0.7168 -> 0.7036  accuracy: 86.07% -> 87.82%     
client [35] (testset)   loss: 0.7122 -> 0.7517  accuracy: 85.64% -> 85.40%     
client [36] (testset)   loss: 0.4394 -> 0.4341  accuracy: 89.18% -> 92.29%     
client [64] (testset)   loss: 0.5756 -> 0.5730  accuracy: 87.28% -> 88.49%     
---------------------------- TRAINING EPOCH: 330 ----------------------------  
client [44] (testset)   loss: 0.7965 -> 0.7783  accuracy: 84.17% -> 83.09%     
client [6]  (testset)   loss: 0.8154 -> 0.6791  accuracy: 80.02% -> 87.33%     
client [12] (testset)   loss: 0.6360 -> 0.6042  accuracy: 85.85% -> 88.67%     
client [55] (testset)   loss: 0.6075 -> 0.6301  accuracy: 86.07% -> 87.68%     
client [29] (testset)   loss: 0.8657 -> 0.7798  accuracy: 82.72% -> 85.54%     
client [9]  (testset)   loss: 0.8159 -> 0.6662  accuracy: 84.78% -> 86.67%     
client [43] (testset)   loss: 0.5668 -> 0.5231  accuracy: 86.23% -> 88.61%     
client [77] (testset)   loss: 0.6789 -> 0.6742  accuracy: 82.97% -> 87.48%     
client [98] (testset)   loss: 0.7405 -> 0.7242  accuracy: 83.90% -> 85.48%     
client [78] (testset)   loss: 0.6313 -> 0.6359  accuracy: 84.81% -> 85.35%     
---------------------------- TRAINING EPOCH: 340 ----------------------------  
client [92] (testset)   loss: 0.7409 -> 0.7214  accuracy: 84.66% -> 87.12%     
client [80] (testset)   loss: 0.6306 -> 0.6670  accuracy: 86.35% -> 86.35%     
client [63] (testset)   loss: 0.6064 -> 0.5482  accuracy: 86.67% -> 90.07%     
client [76] (testset)   loss: 0.8057 -> 0.6443  accuracy: 82.04% -> 87.59%     
client [78] (testset)   loss: 0.6472 -> 0.6432  accuracy: 83.99% -> 85.17%     
client [25] (testset)   loss: 0.6176 -> 0.5685  accuracy: 85.45% -> 87.29%     
client [58] (testset)   loss: 0.6680 -> 0.6713  accuracy: 84.37% -> 87.74%     
client [13] (testset)   loss: 0.6653 -> 0.5278  accuracy: 83.32% -> 90.30%     
client [17] (testset)   loss: 0.7165 -> 0.7722  accuracy: 84.23% -> 86.45%     
client [38] (testset)   loss: 0.5873 -> 0.6293  accuracy: 87.16% -> 87.09%     
---------------------------- TRAINING EPOCH: 350 ----------------------------  
client [72] (testset)   loss: 0.6797 -> 0.7360  accuracy: 83.93% -> 85.96%     
client [82] (testset)   loss: 0.6550 -> 0.6954  accuracy: 85.66% -> 86.88%     
client [86] (testset)   loss: 0.5097 -> 0.5449  accuracy: 88.20% -> 89.16%     
client [51] (testset)   loss: 0.9322 -> 0.9587  accuracy: 77.85% -> 81.78%     
client [96] (testset)   loss: 0.6266 -> 0.7343  accuracy: 85.63% -> 86.40%     
client [42] (testset)   loss: 0.6402 -> 0.5817  accuracy: 84.23% -> 88.50%     
client [55] (testset)   loss: 0.5884 -> 0.6580  accuracy: 86.95% -> 87.42%     
client [13] (testset)   loss: 0.6305 -> 0.5291  accuracy: 84.93% -> 89.97%     
client [1]  (testset)   loss: 0.6426 -> 0.6071  accuracy: 86.01% -> 88.54%     
client [12] (testset)   loss: 0.7458 -> 0.6204  accuracy: 83.53% -> 88.35%     
---------------------------- TRAINING EPOCH: 360 ----------------------------  
client [68] (testset)   loss: 0.6439 -> 0.6261  accuracy: 85.34% -> 88.83%     
client [23] (testset)   loss: 0.7825 -> 0.7307  accuracy: 82.43% -> 85.62%     
client [46] (testset)   loss: 0.9383 -> 0.5377  accuracy: 75.60% -> 88.75%     
client [41] (testset)   loss: 0.8521 -> 0.8287  accuracy: 79.85% -> 81.63%     
client [25] (testset)   loss: 0.6473 -> 0.5973  accuracy: 85.85% -> 87.45%     
client [58] (testset)   loss: 0.6224 -> 0.6698  accuracy: 85.38% -> 88.53%     
client [14] (testset)   loss: 0.7475 -> 0.8296  accuracy: 83.51% -> 84.57%     
client [33] (testset)   loss: 0.6481 -> 0.6328  accuracy: 84.73% -> 86.90%     
client [85] (testset)   loss: 0.4793 -> 0.4644  accuracy: 90.28% -> 90.22%     
client [62] (testset)   loss: 0.6567 -> 0.5227  accuracy: 86.24% -> 89.84%     
---------------------------- TRAINING EPOCH: 370 ----------------------------  
client [98] (testset)   loss: 0.8014 -> 0.7800  accuracy: 85.18% -> 86.38%     
client [63] (testset)   loss: 0.6104 -> 0.5665  accuracy: 88.18% -> 90.04%     
client [70] (testset)   loss: 0.6276 -> 0.6480  accuracy: 85.76% -> 86.95%     
client [65] (testset)   loss: 0.5601 -> 0.5761  accuracy: 89.17% -> 88.91%     
client [14] (testset)   loss: 0.8166 -> 0.8464  accuracy: 83.56% -> 85.13%     
client [73] (testset)   loss: 0.6817 -> 0.5833  accuracy: 85.24% -> 88.36%     
client [34] (testset)   loss: 0.8442 -> 0.6587  accuracy: 80.24% -> 84.40%     
client [99] (testset)   loss: 0.8157 -> 0.8827  accuracy: 83.52% -> 83.68%     
client [69] (testset)   loss: 0.8717 -> 0.6359  accuracy: 81.57% -> 88.56%     
client [46] (testset)   loss: 1.0975 -> 0.5667  accuracy: 74.46% -> 88.06%     
---------------------------- TRAINING EPOCH: 380 ----------------------------  
client [99] (testset)   loss: 0.8116 -> 0.8587  accuracy: 82.41% -> 83.62%     
client [93] (testset)   loss: 0.8126 -> 0.7311  accuracy: 83.55% -> 84.36%     
client [11] (testset)   loss: 0.7303 -> 0.7351  accuracy: 84.18% -> 87.19%     
client [58] (testset)   loss: 0.6142 -> 0.6936  accuracy: 86.43% -> 88.40%     
client [81] (testset)   loss: 0.5183 -> 0.5520  accuracy: 89.17% -> 89.84%     
client [85] (testset)   loss: 0.5105 -> 0.4788  accuracy: 90.03% -> 90.34%     
client [89] (testset)   loss: 0.6736 -> 0.5816  accuracy: 87.11% -> 89.04%     
client [45] (testset)   loss: 0.6272 -> 0.6441  accuracy: 86.19% -> 87.80%     
client [8]  (testset)   loss: 0.6476 -> 0.6475  accuracy: 86.83% -> 88.65%     
client [68] (testset)   loss: 0.7342 -> 0.6545  accuracy: 83.40% -> 88.43%     
---------------------------- TRAINING EPOCH: 390 ----------------------------  
client [67] (testset)   loss: 0.7175 -> 0.5838  accuracy: 84.58% -> 90.31%     
client [72] (testset)   loss: 0.7367 -> 0.7787  accuracy: 83.80% -> 86.27%     
client [1]  (testset)   loss: 0.6680 -> 0.6230  accuracy: 87.06% -> 88.86%     
client [78] (testset)   loss: 0.7307 -> 0.6885  accuracy: 83.90% -> 85.53%     
client [83] (testset)   loss: 0.8898 -> 0.6532  accuracy: 82.41% -> 88.43%     
client [21] (testset)   loss: 0.8075 -> 0.8365  accuracy: 82.78% -> 83.91%     
client [56] (testset)   loss: 0.7747 -> 0.9568  accuracy: 83.99% -> 83.00%     
client [44] (testset)   loss: 0.8028 -> 0.8641  accuracy: 83.92% -> 83.02%     
client [92] (testset)   loss: 0.8347 -> 0.7410  accuracy: 85.11% -> 86.97%     
client [27] (testset)   loss: 0.7607 -> 0.7368  accuracy: 84.10% -> 85.91%     
---------------------------- TRAINING EPOCH: 400 ----------------------------  
client [10] (testset)   loss: 0.7451 -> 0.6847  accuracy: 84.29% -> 88.19%     
client [39] (testset)   loss: 0.7037 -> 0.6764  accuracy: 83.97% -> 84.64%     
client [65] (testset)   loss: 0.5320 -> 0.5626  accuracy: 88.47% -> 89.65%     
client [26] (testset)   loss: 0.5782 -> 0.5635  accuracy: 87.94% -> 90.45%     
client [19] (testset)   loss: 0.5510 -> 0.5726  accuracy: 88.69% -> 89.09%     
client [68] (testset)   loss: 0.6379 -> 0.6473  accuracy: 85.39% -> 87.99%     
client [41] (testset)   loss: 0.8899 -> 0.8616  accuracy: 79.75% -> 82.62%     
client [50] (testset)   loss: 0.5278 -> 0.4936  accuracy: 87.36% -> 91.25%     
client [75] (testset)   loss: 0.7012 -> 0.6317  accuracy: 86.91% -> 88.49%     
client [81] (testset)   loss: 0.5337 -> 0.5470  accuracy: 87.88% -> 90.07%     
Training... ---------------------------------------- 100% 4:09:29
APFL's average time taken by each global epoch: 0 min 37.30 sec.               
APFL's total running time: 4 h 9 m 29 s.                                       
==================== APFL Experiment Results: ====================             
Display format: (before local fine-tuning) -> (after local fine-tuning)        
 So if finetune_epoch = 0, x.xx% -> 0.00% is normal.                           
 Centralized testing ONLY happens after model aggregation, so the stats between
'->' are the same.                                                             
{                                                                              
    "100": {                                                                   
        "all_clients": {                                                       
            "test": {                                                          
                "loss": "0.4958 -> 0.0000",                                    
                "accuracy": "85.25% -> 0.00%"                                  
            }                                                                  
        }                                                                      
    },                                                                         
    "200": {                                                                   
        "all_clients": {                                                       
            "test": {                                                          
                "loss": "0.5710 -> 0.0000",                                    
                "accuracy": "84.78% -> 0.00%"                                  
            }                                                                  
        }                                                                      
    },                                                                         
    "300": {                                                                   
        "all_clients": {                                                       
            "test": {                                                          
                "loss": "0.6425 -> 0.0000",                                    
                "accuracy": "84.45% -> 0.00%"                                  
            }                                                                  
        }                                                                      
    },                                                                         
    "400": {                                                                   
        "all_clients": {                                                       
            "test": {                                                          
                "loss": "0.7292 -> 0.0000",                                    
                "accuracy": "84.09% -> 0.00%"                                  
            }                                                                  
        }                                                                      
    }                                                                          
}                                                                              
==================== APFL Max Accuracy ====================                    
all_clients:                                                                   
(test) before fine-tuning: 85.25% at epoch 100                                 
(test) after fine-tuning: 0.00% at epoch 100                                   
[0m