==================== APFL ====================                                 
Experiment Arguments:                                                          
{
│   'method': 'apfl',
│   'dataset': {
│   │   'name': 'medmnistC',
│   │   'client_num': 100,
│   │   'test_ratio': 0.25,
│   │   'val_ratio': 0.0,
│   │   'seed': 42,
│   │   'split': 'sample',
│   │   'IID_ratio': 0.0,
│   │   'monitor_window_name_suffix': 'medmnistC-100clients-0%IID-Dir(1.0)-seed42',
│   │   'alpha': 1.0,
│   │   'min_samples_per_client': 10
│   },
│   'model': {
│   │   'name': 'lenet5',
│   │   'use_torchvision_pretrained_weights': True,
│   │   'external_model_weights_path': None
│   },
│   'optimizer': {
│   │   'lr': 0.01,
│   │   'dampening': 0,
│   │   'weight_decay': 0,
│   │   'momentum': 0,
│   │   'nesterov': False,
│   │   'name': 'sgd'
│   },
│   'mode': 'serial',
│   'parallel': {
│   │   'ray_cluster_addr': None,
│   │   'num_cpus': None,
│   │   'num_gpus': None,
│   │   'num_workers': 2
│   },
│   'common': {
│   │   'seed': 42,
│   │   'join_ratio': 0.1,
│   │   'global_epoch': 400,
│   │   'local_epoch': 5,
│   │   'batch_size': 32,
│   │   'reset_optimizer_on_global_epoch': True,
│   │   'straggler_ratio': 0,
│   │   'straggler_min_local_epoch': 0,
│   │   'buffers': 'global',
│   │   'client_side_evaluation': True,
│   │   'test': {
│   │   │   'client': {
│   │   │   │   'interval': 100,
│   │   │   │   'finetune_epoch': 0,
│   │   │   │   'train': False,
│   │   │   │   'val': False,
│   │   │   │   'test': True
│   │   │   },
│   │   │   'server': {
│   │   │   │   'interval': -1,
│   │   │   │   'train': False,
│   │   │   │   'val': False,
│   │   │   │   'test': False,
│   │   │   │   'model_in_train_mode': False
│   │   │   }
│   │   },
│   │   'verbose_gap': 10,
│   │   'monitor': None,
│   │   'use_cuda': True,
│   │   'save_log': True,
│   │   'save_model': False,
│   │   'save_learning_curve_plot': False,
│   │   'save_metrics': True,
│   │   'delete_useless_run': True
│   },
│   'apfl': {
│   │   'alpha': 0.5,
│   │   'adaptive_alpha': 1
│   }
}
---------------------------- TRAINING EPOCH: 10 ----------------------------   
client [77] (testset)   loss: 2.3437 -> 2.0557  accuracy: 16.67% -> 16.67%     
client [81] (testset)   loss: 2.3149 -> 2.0327  accuracy: 4.05% -> 35.14%      
client [21] (testset)   loss: 2.3221 -> 2.0844  accuracy: 24.56% -> 26.32%     
client [68] (testset)   loss: 2.1874 -> 1.7898  accuracy: 31.11% -> 37.78%     
client [93] (testset)   loss: 1.9974 -> 1.6866  accuracy: 45.65% -> 45.65%     
client [31] (testset)   loss: 2.3310 -> 1.9454  accuracy: 22.22% -> 44.44%     
client [20] (testset)   loss: 2.3210 -> 2.1736  accuracy: 4.92% -> 18.03%      
client [59] (testset)   loss: 2.3819 -> 2.1882  accuracy: 24.14% -> 24.14%     
client [48] (testset)   loss: 2.3922 -> 2.2515  accuracy: 17.39% -> 17.39%     
client [34] (testset)   loss: 2.1820 -> 1.9651  accuracy: 31.15% -> 24.59%     
---------------------------- TRAINING EPOCH: 20 ----------------------------   
client [69] (testset)   loss: 2.3700 -> 2.1024  accuracy: 7.84% -> 29.41%      
client [99] (testset)   loss: 2.2997 -> 2.1367  accuracy: 20.51% -> 20.51%     
client [67] (testset)   loss: 2.2930 -> 2.0941  accuracy: 22.81% -> 22.81%     
client [0]  (testset)   loss: 2.2301 -> 1.7203  accuracy: 20.55% -> 36.99%     
client [76] (testset)   loss: 2.2431 -> 1.9136  accuracy: 27.78% -> 27.78%     
client [41] (testset)   loss: 2.3516 -> 2.0906  accuracy: 26.92% -> 26.92%     
client [62] (testset)   loss: 2.4250 -> 1.9955  accuracy: 3.45% -> 41.38%      
client [2]  (testset)   loss: 2.2669 -> 1.8346  accuracy: 49.40% -> 49.40%     
client [14] (testset)   loss: 2.2090 -> 2.0753  accuracy: 31.88% -> 31.88%     
client [46] (testset)   loss: 2.1224 -> 1.8061  accuracy: 48.94% -> 48.94%     
---------------------------- TRAINING EPOCH: 30 ----------------------------   
client [24] (testset)   loss: 2.6039 -> 2.2833  accuracy: 0.00% -> 20.00%      
client [68] (testset)   loss: 1.8841 -> 1.7833  accuracy: 31.11% -> 37.78%     
client [57] (testset)   loss: 2.1150 -> 2.0789  accuracy: 17.39% -> 34.78%     
client [17] (testset)   loss: 2.1672 -> 1.9951  accuracy: 20.00% -> 32.00%     
client [54] (testset)   loss: 2.2534 -> 2.5042  accuracy: 18.75% -> 18.75%     
client [23] (testset)   loss: 2.3041 -> 2.1227  accuracy: 20.59% -> 20.59%     
client [35] (testset)   loss: 2.2537 -> 2.0074  accuracy: 11.11% -> 33.33%     
client [59] (testset)   loss: 2.2491 -> 2.1187  accuracy: 24.14% -> 24.14%     
client [31] (testset)   loss: 2.1171 -> 1.8401  accuracy: 22.22% -> 44.44%     
client [9]  (testset)   loss: 2.3826 -> 2.2848  accuracy: 11.11% -> 13.33%     
---------------------------- TRAINING EPOCH: 40 ----------------------------   
client [64] (testset)   loss: 2.3059 -> 2.1733  accuracy: 20.00% -> 20.00%     
client [33] (testset)   loss: 1.8268 -> 1.8843  accuracy: 44.44% -> 22.22%     
client [16] (testset)   loss: 2.3515 -> 2.0769  accuracy: 6.67% -> 26.67%      
client [44] (testset)   loss: 2.3025 -> 2.1187  accuracy: 12.50% -> 23.21%     
client [8]  (testset)   loss: 1.9440 -> 1.9701  accuracy: 34.17% -> 34.17%     
client [31] (testset)   loss: 2.0103 -> 1.9510  accuracy: 44.44% -> 44.44%     
client [47] (testset)   loss: 2.0012 -> 1.7345  accuracy: 16.67% -> 47.22%     
client [36] (testset)   loss: 2.4758 -> 2.0785  accuracy: 4.08% -> 24.49%      
client [20] (testset)   loss: 2.1724 -> 2.1575  accuracy: 18.03% -> 18.03%     
client [56] (testset)   loss: 2.3897 -> 2.1780  accuracy: 32.73% -> 7.27%      
---------------------------- TRAINING EPOCH: 50 ----------------------------   
client [4]  (testset)   loss: 2.1645 -> 2.0419  accuracy: 30.19% -> 18.87%     
client [60] (testset)   loss: 2.4173 -> 2.2225  accuracy: 11.43% -> 28.57%     
client [28] (testset)   loss: 2.1973 -> 2.1924  accuracy: 31.51% -> 12.33%     
client [25] (testset)   loss: 2.3513 -> 2.4148  accuracy: 14.00% -> 12.00%     
client [58] (testset)   loss: 1.7611 -> 1.6910  accuracy: 42.47% -> 42.47%     
client [44] (testset)   loss: 2.2838 -> 2.1222  accuracy: 19.64% -> 23.21%     
client [39] (testset)   loss: 1.5677 -> 1.4065  accuracy: 53.77% -> 53.77%     
client [29] (testset)   loss: 1.9248 -> 1.7784  accuracy: 37.66% -> 37.66%     
client [3]  (testset)   loss: 2.4100 -> 2.5286  accuracy: 14.81% -> 9.26%      
client [84] (testset)   loss: 1.7889 -> 1.6795  accuracy: 38.53% -> 38.53%     
---------------------------- TRAINING EPOCH: 60 ----------------------------   
client [21] (testset)   loss: 2.1320 -> 1.9955  accuracy: 24.56% -> 26.32%     
client [84] (testset)   loss: 1.7715 -> 1.6936  accuracy: 38.53% -> 38.53%     
client [10] (testset)   loss: 2.6065 -> 2.1545  accuracy: 5.56% -> 38.89%      
client [36] (testset)   loss: 2.2408 -> 2.1065  accuracy: 4.08% -> 24.49%      
client [65] (testset)   loss: 2.1383 -> 2.0460  accuracy: 37.74% -> 37.74%     
client [81] (testset)   loss: 2.1331 -> 1.9946  accuracy: 35.14% -> 35.14%     
client [79] (testset)   loss: 2.2206 -> 2.2386  accuracy: 19.23% -> 21.15%     
client [42] (testset)   loss: 2.3533 -> 2.2618  accuracy: 5.36% -> 7.14%       
client [11] (testset)   loss: 2.0657 -> 1.9399  accuracy: 12.50% -> 21.43%     
client [96] (testset)   loss: 2.1259 -> 2.1015  accuracy: 30.36% -> 30.36%     
---------------------------- TRAINING EPOCH: 70 ----------------------------   
client [8]  (testset)   loss: 1.9850 -> 1.9376  accuracy: 34.17% -> 34.17%     
client [53] (testset)   loss: 2.1246 -> 2.0966  accuracy: 38.71% -> 38.71%     
client [52] (testset)   loss: 1.6141 -> 1.3051  accuracy: 57.14% -> 57.14%     
client [42] (testset)   loss: 2.2790 -> 2.2577  accuracy: 23.21% -> 7.14%      
client [69] (testset)   loss: 2.1128 -> 2.0186  accuracy: 29.41% -> 29.41%     
client [59] (testset)   loss: 2.1665 -> 2.1308  accuracy: 24.14% -> 24.14%     
client [7]  (testset)   loss: 2.0023 -> 1.9206  accuracy: 32.79% -> 32.79%     
client [26] (testset)   loss: 2.3520 -> 2.1969  accuracy: 22.81% -> 22.81%     
client [49] (testset)   loss: 2.1941 -> 1.9692  accuracy: 24.24% -> 24.24%     
client [98] (testset)   loss: 2.0826 -> 2.0579  accuracy: 37.74% -> 37.74%     
---------------------------- TRAINING EPOCH: 80 ----------------------------   
client [98] (testset)   loss: 2.0572 -> 2.0666  accuracy: 37.74% -> 37.74%     
client [47] (testset)   loss: 1.9952 -> 1.7266  accuracy: 16.67% -> 47.22%     
client [21] (testset)   loss: 2.0294 -> 1.9551  accuracy: 24.56% -> 26.32%     
client [77] (testset)   loss: 2.0623 -> 1.9760  accuracy: 16.67% -> 30.00%     
client [95] (testset)   loss: 2.0131 -> 2.0354  accuracy: 34.25% -> 34.25%     
client [91] (testset)   loss: 2.1163 -> 2.0232  accuracy: 37.93% -> 37.93%     
client [14] (testset)   loss: 2.0867 -> 2.0341  accuracy: 31.88% -> 31.88%     
client [99] (testset)   loss: 2.2113 -> 2.1011  accuracy: 20.51% -> 12.82%     
client [20] (testset)   loss: 2.1997 -> 2.1907  accuracy: 18.03% -> 18.03%     
client [39] (testset)   loss: 1.5507 -> 1.4036  accuracy: 53.77% -> 53.77%     
---------------------------- TRAINING EPOCH: 90 ----------------------------   
client [52] (testset)   loss: 1.7175 -> 1.3161  accuracy: 7.14% -> 57.14%      
client [62] (testset)   loss: 1.9120 -> 1.8424  accuracy: 41.38% -> 41.38%     
client [71] (testset)   loss: 2.0355 -> 2.1067  accuracy: 23.33% -> 23.33%     
client [97] (testset)   loss: 1.9836 -> 1.8588  accuracy: 25.76% -> 31.82%     
client [30] (testset)   loss: 2.3540 -> 2.3670  accuracy: 10.61% -> 15.15%     
client [88] (testset)   loss: 2.2159 -> 2.2087  accuracy: 8.77% -> 22.81%      
client [60] (testset)   loss: 2.2935 -> 2.2202  accuracy: 11.43% -> 28.57%     
client [82] (testset)   loss: 1.8905 -> 1.9554  accuracy: 40.30% -> 11.94%     
client [91] (testset)   loss: 2.0743 -> 2.0838  accuracy: 13.79% -> 13.79%     
client [57] (testset)   loss: 2.0479 -> 2.1227  accuracy: 34.78% -> 34.78%     
---------------------------- TRAINING EPOCH: 100 ----------------------------  
client [31] (testset)   loss: 1.8946 -> 1.9245  accuracy: 44.44% -> 44.44%     
client [15] (testset)   loss: 1.6864 -> 1.4706  accuracy: 61.04% -> 61.04%     
client [71] (testset)   loss: 2.0583 -> 2.0322  accuracy: 23.33% -> 23.33%     
client [97] (testset)   loss: 1.9225 -> 2.0658  accuracy: 25.76% -> 25.76%     
client [53] (testset)   loss: 2.0672 -> 2.1052  accuracy: 38.71% -> 38.71%     
client [77] (testset)   loss: 2.0840 -> 1.9799  accuracy: 16.67% -> 30.00%     
client [76] (testset)   loss: 1.9571 -> 1.9018  accuracy: 27.78% -> 27.78%     
client [79] (testset)   loss: 2.2095 -> 2.3042  accuracy: 21.15% -> 21.15%     
client [28] (testset)   loss: 2.1965 -> 2.1888  accuracy: 31.51% -> 12.33%     
client [99] (testset)   loss: 2.1520 -> 2.0952  accuracy: 20.51% -> 12.82%     
---------------------------- TRAINING EPOCH: 110 ----------------------------  
client [97] (testset)   loss: 1.9170 -> 1.9392  accuracy: 31.82% -> 25.76%     
client [86] (testset)   loss: 1.7461 -> 1.7580  accuracy: 48.44% -> 48.44%     
client [34] (testset)   loss: 1.9522 -> 1.8996  accuracy: 31.15% -> 31.15%     
client [73] (testset)   loss: 2.3347 -> 2.3243  accuracy: 12.28% -> 12.28%     
client [5]  (testset)   loss: 2.1299 -> 2.1922  accuracy: 26.09% -> 26.09%     
client [96] (testset)   loss: 2.0934 -> 2.0994  accuracy: 30.36% -> 30.36%     
client [22] (testset)   loss: 2.1089 -> 1.8481  accuracy: 46.00% -> 46.00%     
client [60] (testset)   loss: 2.2729 -> 2.1856  accuracy: 11.43% -> 28.57%     
client [66] (testset)   loss: 2.1876 -> 2.1763  accuracy: 19.05% -> 19.05%     
client [83] (testset)   loss: 2.1947 -> 2.1292  accuracy: 19.57% -> 19.57%     
---------------------------- TRAINING EPOCH: 120 ----------------------------  
client [76] (testset)   loss: 1.9680 -> 1.9120  accuracy: 27.78% -> 27.78%     
client [65] (testset)   loss: 2.1299 -> 2.0285  accuracy: 37.74% -> 37.74%     
client [95] (testset)   loss: 2.0390 -> 2.0111  accuracy: 16.44% -> 34.25%     
client [17] (testset)   loss: 2.0411 -> 2.0330  accuracy: 20.00% -> 32.00%     
client [8]  (testset)   loss: 1.9507 -> 1.8974  accuracy: 34.17% -> 34.17%     
client [35] (testset)   loss: 2.1077 -> 1.9690  accuracy: 11.11% -> 33.33%     
client [98] (testset)   loss: 2.0505 -> 2.0580  accuracy: 37.74% -> 37.74%     
client [53] (testset)   loss: 2.0569 -> 2.1241  accuracy: 38.71% -> 38.71%     
client [43] (testset)   loss: 1.5306 -> 1.4951  accuracy: 57.89% -> 57.89%     
client [64] (testset)   loss: 2.1899 -> 2.1876  accuracy: 20.00% -> 20.00%     
---------------------------- TRAINING EPOCH: 130 ----------------------------  
client [21] (testset)   loss: 2.0368 -> 2.0531  accuracy: 26.32% -> 26.32%     
client [88] (testset)   loss: 2.1519 -> 2.1749  accuracy: 8.77% -> 22.81%      
client [38] (testset)   loss: 2.1955 -> 2.2037  accuracy: 24.32% -> 18.92%     
client [3]  (testset)   loss: 2.3467 -> 2.5588  accuracy: 9.26% -> 9.26%       
client [5]  (testset)   loss: 2.1259 -> 2.1600  accuracy: 26.09% -> 26.09%     
client [41] (testset)   loss: 2.0627 -> 2.0143  accuracy: 26.92% -> 26.92%     
client [7]  (testset)   loss: 2.0266 -> 1.9446  accuracy: 32.79% -> 32.79%     
client [37] (testset)   loss: 1.9906 -> 1.9445  accuracy: 40.48% -> 40.48%     
client [45] (testset)   loss: 2.1142 -> 2.0825  accuracy: 34.78% -> 34.78%     
client [47] (testset)   loss: 1.8211 -> 1.6788  accuracy: 16.67% -> 47.22%     
---------------------------- TRAINING EPOCH: 140 ----------------------------  
client [16] (testset)   loss: 2.0837 -> 2.0556  accuracy: 26.67% -> 26.67%     
client [11] (testset)   loss: 1.9695 -> 2.0017  accuracy: 30.36% -> 30.36%     
client [37] (testset)   loss: 1.9816 -> 1.9588  accuracy: 40.48% -> 40.48%     
client [41] (testset)   loss: 2.0470 -> 2.0148  accuracy: 26.92% -> 26.92%     
client [95] (testset)   loss: 1.9936 -> 2.0032  accuracy: 34.25% -> 34.25%     
client [53] (testset)   loss: 2.0537 -> 2.1188  accuracy: 38.71% -> 38.71%     
client [22] (testset)   loss: 1.9456 -> 1.8742  accuracy: 46.00% -> 46.00%     
client [25] (testset)   loss: 2.3972 -> 2.4994  accuracy: 14.00% -> 12.00%     
client [69] (testset)   loss: 2.0988 -> 2.0378  accuracy: 17.65% -> 29.41%     
client [46] (testset)   loss: 1.8556 -> 1.8506  accuracy: 48.94% -> 48.94%     
---------------------------- TRAINING EPOCH: 150 ----------------------------  
client [47] (testset)   loss: 1.8804 -> 1.7365  accuracy: 16.67% -> 16.67%     
client [69] (testset)   loss: 2.0920 -> 2.0117  accuracy: 29.41% -> 29.41%     
client [82] (testset)   loss: 1.9032 -> 1.8921  accuracy: 40.30% -> 40.30%     
client [45] (testset)   loss: 2.1366 -> 2.0633  accuracy: 34.78% -> 34.78%     
client [7]  (testset)   loss: 1.9597 -> 1.9532  accuracy: 32.79% -> 32.79%     
client [50] (testset)   loss: 2.1397 -> 2.0822  accuracy: 29.87% -> 29.87%     
client [35] (testset)   loss: 2.0422 -> 1.9908  accuracy: 33.33% -> 33.33%     
client [24] (testset)   loss: 2.2804 -> 2.1838  accuracy: 36.00% -> 36.00%     
client [15] (testset)   loss: 1.5969 -> 1.4802  accuracy: 61.04% -> 61.04%     
client [58] (testset)   loss: 1.7213 -> 1.6873  accuracy: 42.47% -> 42.47%     
---------------------------- TRAINING EPOCH: 160 ----------------------------  
client [48] (testset)   loss: 2.2652 -> 2.3000  accuracy: 17.39% -> 17.39%     
client [76] (testset)   loss: 1.9376 -> 1.9456  accuracy: 27.78% -> 27.78%     
client [67] (testset)   loss: 2.0748 -> 2.0614  accuracy: 22.81% -> 17.54%     
client [37] (testset)   loss: 2.0014 -> 1.9372  accuracy: 40.48% -> 40.48%     
client [58] (testset)   loss: 1.7152 -> 1.6831  accuracy: 42.47% -> 42.47%     
client [64] (testset)   loss: 2.2225 -> 2.1780  accuracy: 20.00% -> 20.00%     
client [77] (testset)   loss: 2.0565 -> 1.9662  accuracy: 16.67% -> 30.00%     
client [55] (testset)   loss: 1.9138 -> 1.9059  accuracy: 42.62% -> 42.62%     
client [12] (testset)   loss: 1.9301 -> 1.8918  accuracy: 23.73% -> 23.73%     
client [89] (testset)   loss: 1.8765 -> 1.9349  accuracy: 46.88% -> 46.88%     
---------------------------- TRAINING EPOCH: 170 ----------------------------  
client [84] (testset)   loss: 1.7824 -> 1.6282  accuracy: 38.53% -> 38.53%     
client [51] (testset)   loss: 1.8192 -> 1.8027  accuracy: 47.42% -> 47.42%     
client [8]  (testset)   loss: 1.9131 -> 1.8715  accuracy: 34.17% -> 34.17%     
client [18] (testset)   loss: 2.2771 -> 2.3939  accuracy: 20.93% -> 20.93%     
client [94] (testset)   loss: 1.9527 -> 1.7686  accuracy: 19.51% -> 31.71%     
client [81] (testset)   loss: 2.1867 -> 2.0094  accuracy: 4.05% -> 35.14%      
client [3]  (testset)   loss: 2.3650 -> 2.3957  accuracy: 14.81% -> 9.26%      
client [11] (testset)   loss: 2.0380 -> 1.9936  accuracy: 30.36% -> 30.36%     
client [95] (testset)   loss: 2.0122 -> 2.0208  accuracy: 34.25% -> 34.25%     
client [67] (testset)   loss: 2.1159 -> 2.0960  accuracy: 22.81% -> 19.30%     
---------------------------- TRAINING EPOCH: 180 ----------------------------  
client [21] (testset)   loss: 2.0420 -> 1.9512  accuracy: 24.56% -> 26.32%     
client [79] (testset)   loss: 2.2082 -> 2.3094  accuracy: 21.15% -> 21.15%     
client [58] (testset)   loss: 1.7330 -> 1.6772  accuracy: 42.47% -> 42.47%     
client [88] (testset)   loss: 2.1607 -> 2.2255  accuracy: 15.79% -> 22.81%     
client [46] (testset)   loss: 1.9385 -> 1.8415  accuracy: 48.94% -> 48.94%     
client [11] (testset)   loss: 2.0128 -> 2.0079  accuracy: 30.36% -> 21.43%     
client [55] (testset)   loss: 1.9174 -> 1.9183  accuracy: 42.62% -> 42.62%     
client [13] (testset)   loss: 2.3857 -> 2.5293  accuracy: 5.56% -> 22.22%      
client [31] (testset)   loss: 1.8890 -> 1.8912  accuracy: 44.44% -> 44.44%     
client [75] (testset)   loss: 2.1519 -> 2.2117  accuracy: 22.22% -> 22.22%     
---------------------------- TRAINING EPOCH: 190 ----------------------------  
client [19] (testset)   loss: 2.1985 -> 2.1937  accuracy: 16.07% -> 23.21%     
client [7]  (testset)   loss: 1.9787 -> 1.9277  accuracy: 32.79% -> 32.79%     
client [57] (testset)   loss: 2.0734 -> 2.1222  accuracy: 34.78% -> 34.78%     
client [13] (testset)   loss: 2.3487 -> 2.5373  accuracy: 22.22% -> 22.22%     
client [43] (testset)   loss: 1.5362 -> 1.4938  accuracy: 57.89% -> 57.89%     
client [91] (testset)   loss: 1.9845 -> 2.1316  accuracy: 37.93% -> 13.79%     
client [10] (testset)   loss: 2.2604 -> 2.0906  accuracy: 22.22% -> 38.89%     
client [64] (testset)   loss: 2.2031 -> 2.1916  accuracy: 20.00% -> 20.00%     
client [82] (testset)   loss: 1.8829 -> 1.9230  accuracy: 40.30% -> 11.94%     
client [22] (testset)   loss: 1.9822 -> 1.8574  accuracy: 46.00% -> 46.00%     
---------------------------- TRAINING EPOCH: 200 ----------------------------  
client [20] (testset)   loss: 2.2081 -> 2.2058  accuracy: 18.03% -> 18.03%     
client [23] (testset)   loss: 2.1566 -> 2.1470  accuracy: 20.59% -> 23.53%     
client [88] (testset)   loss: 2.1546 -> 2.1613  accuracy: 15.79% -> 15.79%     
client [98] (testset)   loss: 2.0339 -> 2.0575  accuracy: 37.74% -> 37.74%     
client [79] (testset)   loss: 2.2124 -> 2.2758  accuracy: 21.15% -> 21.15%     
client [21] (testset)   loss: 1.9907 -> 1.9565  accuracy: 24.56% -> 26.32%     
client [92] (testset)   loss: 2.1703 -> 2.1009  accuracy: 26.47% -> 26.47%     
client [56] (testset)   loss: 2.0702 -> 2.1861  accuracy: 32.73% -> 7.27%      
client [5]  (testset)   loss: 2.1601 -> 2.2754  accuracy: 26.09% -> 26.09%     
client [52] (testset)   loss: 1.5265 -> 1.2740  accuracy: 57.14% -> 57.14%     
---------------------------- TRAINING EPOCH: 210 ----------------------------  
client [67] (testset)   loss: 2.0562 -> 2.0857  accuracy: 22.81% -> 17.54%     
client [54] (testset)   loss: 2.2593 -> 3.0540  accuracy: 18.75% -> 18.75%     
client [14] (testset)   loss: 2.0827 -> 2.0563  accuracy: 31.88% -> 31.88%     
client [99] (testset)   loss: 2.0963 -> 2.0728  accuracy: 20.51% -> 10.26%     
client [36] (testset)   loss: 2.1407 -> 2.0581  accuracy: 24.49% -> 24.49%     
client [30] (testset)   loss: 2.3212 -> 2.3742  accuracy: 15.15% -> 15.15%     
client [38] (testset)   loss: 2.1671 -> 2.2026  accuracy: 24.32% -> 18.92%     
client [15] (testset)   loss: 1.5413 -> 1.5062  accuracy: 61.04% -> 61.04%     
client [6]  (testset)   loss: 2.0918 -> 2.0494  accuracy: 21.54% -> 21.54%     
client [53] (testset)   loss: 2.0224 -> 2.0730  accuracy: 38.71% -> 38.71%     
---------------------------- TRAINING EPOCH: 220 ----------------------------  
client [99] (testset)   loss: 2.0464 -> 2.0857  accuracy: 20.51% -> 20.51%     
client [6]  (testset)   loss: 2.0984 -> 2.0267  accuracy: 23.08% -> 21.54%     
client [83] (testset)   loss: 2.1813 -> 2.1231  accuracy: 19.57% -> 30.43%     
client [42] (testset)   loss: 2.2610 -> 2.3232  accuracy: 5.36% -> 17.86%      
client [34] (testset)   loss: 1.9226 -> 1.9038  accuracy: 31.15% -> 24.59%     
client [15] (testset)   loss: 1.5522 -> 1.5203  accuracy: 61.04% -> 61.04%     
client [47] (testset)   loss: 1.8877 -> 1.7098  accuracy: 16.67% -> 47.22%     
client [55] (testset)   loss: 1.9354 -> 1.9138  accuracy: 42.62% -> 42.62%     
client [51] (testset)   loss: 1.7828 -> 1.8195  accuracy: 47.42% -> 47.42%     
client [95] (testset)   loss: 2.0194 -> 2.0111  accuracy: 16.44% -> 34.25%     
---------------------------- TRAINING EPOCH: 230 ----------------------------  
client [71] (testset)   loss: 2.0603 -> 1.9970  accuracy: 23.33% -> 23.33%     
client [15] (testset)   loss: 1.5836 -> 1.4766  accuracy: 61.04% -> 61.04%     
client [33] (testset)   loss: 1.7832 -> 1.8300  accuracy: 44.44% -> 22.22%     
client [99] (testset)   loss: 2.0700 -> 2.0977  accuracy: 20.51% -> 10.26%     
client [90] (testset)   loss: 2.0168 -> 1.9700  accuracy: 25.00% -> 25.00%     
client [57] (testset)   loss: 2.1007 -> 2.0870  accuracy: 34.78% -> 34.78%     
client [27] (testset)   loss: 1.9844 -> 2.0010  accuracy: 38.75% -> 38.75%     
client [78] (testset)   loss: 1.9599 -> 1.9486  accuracy: 24.24% -> 22.73%     
client [36] (testset)   loss: 2.1742 -> 2.0683  accuracy: 24.49% -> 24.49%     
client [88] (testset)   loss: 2.1287 -> 2.2081  accuracy: 22.81% -> 15.79%     
---------------------------- TRAINING EPOCH: 240 ----------------------------  
client [70] (testset)   loss: 2.1905 -> 2.2477  accuracy: 25.00% -> 25.00%     
client [35] (testset)   loss: 2.0461 -> 2.0349  accuracy: 33.33% -> 33.33%     
client [16] (testset)   loss: 2.0723 -> 2.0319  accuracy: 26.67% -> 26.67%     
client [80] (testset)   loss: 2.1983 -> 2.2004  accuracy: 38.18% -> 38.18%     
client [38] (testset)   loss: 2.1728 -> 2.2050  accuracy: 24.32% -> 18.92%     
client [78] (testset)   loss: 1.9271 -> 1.9490  accuracy: 24.24% -> 22.73%     
client [68] (testset)   loss: 1.8108 -> 1.7695  accuracy: 37.78% -> 37.78%     
client [11] (testset)   loss: 2.0111 -> 2.0429  accuracy: 30.36% -> 30.36%     
client [64] (testset)   loss: 2.2198 -> 2.1972  accuracy: 20.00% -> 20.00%     
client [82] (testset)   loss: 1.9066 -> 1.8901  accuracy: 40.30% -> 40.30%     
---------------------------- TRAINING EPOCH: 250 ----------------------------  
client [30] (testset)   loss: 2.3476 -> 2.3443  accuracy: 12.12% -> 15.15%     
client [27] (testset)   loss: 1.9465 -> 1.9819  accuracy: 38.75% -> 38.75%     
client [74] (testset)   loss: 1.9969 -> 2.0194  accuracy: 28.07% -> 19.30%     
client [45] (testset)   loss: 2.0532 -> 2.0384  accuracy: 34.78% -> 34.78%     
client [6]  (testset)   loss: 2.0920 -> 2.0479  accuracy: 21.54% -> 21.54%     
client [36] (testset)   loss: 2.1939 -> 2.0693  accuracy: 4.08% -> 24.49%      
client [63] (testset)   loss: 1.9938 -> 1.9951  accuracy: 31.67% -> 31.67%     
client [76] (testset)   loss: 1.9463 -> 1.8623  accuracy: 27.78% -> 27.78%     
client [83] (testset)   loss: 2.1818 -> 2.1302  accuracy: 19.57% -> 19.57%     
client [86] (testset)   loss: 1.7221 -> 1.7026  accuracy: 48.44% -> 48.44%     
---------------------------- TRAINING EPOCH: 260 ----------------------------  
client [83] (testset)   loss: 2.1716 -> 2.1195  accuracy: 19.57% -> 19.57%     
client [99] (testset)   loss: 2.0549 -> 2.0758  accuracy: 20.51% -> 7.69%      
client [74] (testset)   loss: 2.0049 -> 2.0025  accuracy: 28.07% -> 19.30%     
client [73] (testset)   loss: 2.3319 -> 2.3400  accuracy: 12.28% -> 21.05%     
client [29] (testset)   loss: 1.9082 -> 1.7591  accuracy: 37.66% -> 37.66%     
client [92] (testset)   loss: 2.1349 -> 2.1249  accuracy: 26.47% -> 26.47%     
client [6]  (testset)   loss: 2.0627 -> 2.0026  accuracy: 23.08% -> 21.54%     
client [61] (testset)   loss: 2.1711 -> 2.2888  accuracy: 26.67% -> 26.67%     
client [21] (testset)   loss: 1.9762 -> 1.9745  accuracy: 24.56% -> 26.32%     
client [67] (testset)   loss: 2.0671 -> 2.1079  accuracy: 22.81% -> 19.30%     
---------------------------- TRAINING EPOCH: 270 ----------------------------  
client [83] (testset)   loss: 2.1287 -> 2.1026  accuracy: 30.43% -> 19.57%     
client [32] (testset)   loss: 1.9921 -> 2.0252  accuracy: 30.43% -> 30.43%     
client [95] (testset)   loss: 1.9821 -> 2.0169  accuracy: 34.25% -> 34.25%     
client [61] (testset)   loss: 2.1828 -> 2.2104  accuracy: 26.67% -> 26.67%     
client [27] (testset)   loss: 1.9432 -> 2.0474  accuracy: 38.75% -> 38.75%     
client [25] (testset)   loss: 2.3709 -> 2.4803  accuracy: 14.00% -> 12.00%     
client [68] (testset)   loss: 1.8040 -> 1.7556  accuracy: 37.78% -> 37.78%     
client [34] (testset)   loss: 1.9134 -> 1.9113  accuracy: 24.59% -> 24.59%     
client [71] (testset)   loss: 2.0223 -> 2.0335  accuracy: 23.33% -> 23.33%     
client [89] (testset)   loss: 1.8761 -> 2.0780  accuracy: 46.88% -> 46.88%     
---------------------------- TRAINING EPOCH: 280 ----------------------------  
client [78] (testset)   loss: 1.9379 -> 1.9443  accuracy: 24.24% -> 22.73%     
client [81] (testset)   loss: 2.1255 -> 2.0315  accuracy: 22.97% -> 35.14%     
client [51] (testset)   loss: 1.7860 -> 1.8083  accuracy: 47.42% -> 47.42%     
client [54] (testset)   loss: 2.2638 -> 2.3432  accuracy: 18.75% -> 18.75%     
client [65] (testset)   loss: 2.1175 -> 1.9968  accuracy: 37.74% -> 37.74%     
client [41] (testset)   loss: 2.0170 -> 2.0202  accuracy: 26.92% -> 26.92%     
client [11] (testset)   loss: 2.0379 -> 2.0044  accuracy: 30.36% -> 30.36%     
client [85] (testset)   loss: 2.1428 -> 2.0553  accuracy: 18.67% -> 29.33%     
client [12] (testset)   loss: 1.9346 -> 1.9097  accuracy: 23.73% -> 23.73%     
client [23] (testset)   loss: 2.2498 -> 2.2048  accuracy: 20.59% -> 20.59%     
---------------------------- TRAINING EPOCH: 290 ----------------------------  
client [16] (testset)   loss: 2.1025 -> 2.0427  accuracy: 26.67% -> 26.67%     
client [65] (testset)   loss: 2.0895 -> 1.9926  accuracy: 37.74% -> 37.74%     
client [53] (testset)   loss: 2.0557 -> 2.1056  accuracy: 38.71% -> 38.71%     
client [58] (testset)   loss: 1.6927 -> 1.6836  accuracy: 42.47% -> 42.47%     
client [72] (testset)   loss: 2.0732 -> 1.7734  accuracy: 53.70% -> 53.70%     
client [7]  (testset)   loss: 1.9610 -> 1.9267  accuracy: 32.79% -> 32.79%     
client [71] (testset)   loss: 2.0345 -> 2.0289  accuracy: 23.33% -> 23.33%     
client [59] (testset)   loss: 2.1351 -> 2.1041  accuracy: 24.14% -> 24.14%     
client [86] (testset)   loss: 1.7751 -> 1.7007  accuracy: 48.44% -> 48.44%     
client [39] (testset)   loss: 1.5449 -> 1.4121  accuracy: 53.77% -> 53.77%     
---------------------------- TRAINING EPOCH: 300 ----------------------------  
client [99] (testset)   loss: 2.0672 -> 2.0775  accuracy: 20.51% -> 7.69%      
client [7]  (testset)   loss: 1.9626 -> 1.9349  accuracy: 32.79% -> 32.79%     
client [17] (testset)   loss: 2.0407 -> 2.0056  accuracy: 20.00% -> 32.00%     
client [64] (testset)   loss: 2.2403 -> 2.1815  accuracy: 20.00% -> 20.00%     
client [37] (testset)   loss: 2.0226 -> 1.9511  accuracy: 40.48% -> 40.48%     
client [29] (testset)   loss: 1.8742 -> 1.7812  accuracy: 37.66% -> 37.66%     
client [93] (testset)   loss: 1.7443 -> 1.7134  accuracy: 45.65% -> 45.65%     
client [73] (testset)   loss: 2.3385 -> 2.3378  accuracy: 12.28% -> 12.28%     
client [40] (testset)   loss: 2.1640 -> 2.1447  accuracy: 21.74% -> 21.74%     
client [76] (testset)   loss: 1.8959 -> 1.8730  accuracy: 27.78% -> 27.78%     
---------------------------- TRAINING EPOCH: 310 ----------------------------  
client [31] (testset)   loss: 1.8663 -> 1.8556  accuracy: 44.44% -> 44.44%     
client [89] (testset)   loss: 1.8705 -> 1.8566  accuracy: 46.88% -> 46.88%     
client [77] (testset)   loss: 2.0799 -> 1.9819  accuracy: 16.67% -> 30.00%     
client [90] (testset)   loss: 2.0362 -> 1.9740  accuracy: 25.00% -> 25.00%     
client [26] (testset)   loss: 2.2156 -> 2.1844  accuracy: 22.81% -> 22.81%     
client [50] (testset)   loss: 2.1160 -> 2.0937  accuracy: 29.87% -> 29.87%     
client [30] (testset)   loss: 2.3562 -> 2.3551  accuracy: 15.15% -> 15.15%     
client [70] (testset)   loss: 2.2493 -> 2.2220  accuracy: 12.50% -> 25.00%     
client [41] (testset)   loss: 2.0839 -> 2.0291  accuracy: 26.92% -> 26.92%     
client [99] (testset)   loss: 2.1124 -> 2.0513  accuracy: 20.51% -> 20.51%     
---------------------------- TRAINING EPOCH: 320 ----------------------------  
client [68] (testset)   loss: 1.7982 -> 1.7796  accuracy: 31.11% -> 37.78%     
client [70] (testset)   loss: 2.2094 -> 2.3217  accuracy: 25.00% -> 25.00%     
client [52] (testset)   loss: 1.6005 -> 1.3575  accuracy: 57.14% -> 57.14%     
client [1]  (testset)   loss: 2.3007 -> 2.4262  accuracy: 4.17% -> 12.50%      
client [2]  (testset)   loss: 1.7952 -> 1.7775  accuracy: 49.40% -> 49.40%     
client [67] (testset)   loss: 2.0711 -> 2.1164  accuracy: 22.81% -> 19.30%     
client [92] (testset)   loss: 2.1291 -> 2.1093  accuracy: 26.47% -> 26.47%     
client [35] (testset)   loss: 2.0753 -> 2.0120  accuracy: 11.11% -> 33.33%     
client [36] (testset)   loss: 2.1566 -> 2.0581  accuracy: 24.49% -> 24.49%     
client [64] (testset)   loss: 2.2225 -> 2.1906  accuracy: 20.00% -> 20.00%     
---------------------------- TRAINING EPOCH: 330 ----------------------------  
client [44] (testset)   loss: 2.1012 -> 2.1304  accuracy: 19.64% -> 23.21%     
client [6]  (testset)   loss: 2.0762 -> 2.0137  accuracy: 23.08% -> 21.54%     
client [12] (testset)   loss: 1.9266 -> 1.8887  accuracy: 23.73% -> 22.03%     
client [55] (testset)   loss: 1.9275 -> 1.9203  accuracy: 42.62% -> 42.62%     
client [29] (testset)   loss: 1.9013 -> 1.8042  accuracy: 37.66% -> 37.66%     
client [9]  (testset)   loss: 2.2877 -> 2.3740  accuracy: 13.33% -> 13.33%     
client [43] (testset)   loss: 1.5054 -> 1.5030  accuracy: 57.89% -> 57.89%     
client [77] (testset)   loss: 2.0345 -> 1.9822  accuracy: 16.67% -> 30.00%     
client [98] (testset)   loss: 2.0890 -> 2.0614  accuracy: 37.74% -> 37.74%     
client [78] (testset)   loss: 1.9312 -> 1.9511  accuracy: 24.24% -> 22.73%     
---------------------------- TRAINING EPOCH: 340 ----------------------------  
client [92] (testset)   loss: 2.1348 -> 2.1026  accuracy: 26.47% -> 26.47%     
client [80] (testset)   loss: 2.2385 -> 2.1599  accuracy: 3.64% -> 38.18%      
client [63] (testset)   loss: 2.0126 -> 1.9680  accuracy: 31.67% -> 31.67%     
client [76] (testset)   loss: 1.9365 -> 1.8854  accuracy: 27.78% -> 27.78%     
client [78] (testset)   loss: 1.9241 -> 1.9261  accuracy: 24.24% -> 22.73%     
client [25] (testset)   loss: 2.3775 -> 2.4795  accuracy: 12.00% -> 12.00%     
client [58] (testset)   loss: 1.6785 -> 1.6785  accuracy: 42.47% -> 42.47%     
client [13] (testset)   loss: 2.3952 -> 2.5508  accuracy: 22.22% -> 22.22%     
client [17] (testset)   loss: 2.0480 -> 2.0534  accuracy: 20.00% -> 32.00%     
client [38] (testset)   loss: 2.1767 -> 2.1843  accuracy: 24.32% -> 18.92%     
---------------------------- TRAINING EPOCH: 350 ----------------------------  
client [72] (testset)   loss: 2.1007 -> 1.7818  accuracy: 53.70% -> 53.70%     
client [82] (testset)   loss: 1.9011 -> 1.9443  accuracy: 40.30% -> 11.94%     
client [86] (testset)   loss: 1.7611 -> 1.6884  accuracy: 48.44% -> 48.44%     
client [51] (testset)   loss: 1.8289 -> 1.7924  accuracy: 47.42% -> 47.42%     
client [96] (testset)   loss: 2.0844 -> 2.1005  accuracy: 30.36% -> 30.36%     
client [42] (testset)   loss: 2.3209 -> 2.2912  accuracy: 7.14% -> 7.14%       
client [55] (testset)   loss: 1.9217 -> 1.9073  accuracy: 42.62% -> 42.62%     
client [13] (testset)   loss: 2.4075 -> 2.5407  accuracy: 22.22% -> 22.22%     
client [1]  (testset)   loss: 2.3305 -> 2.4810  accuracy: 4.17% -> 4.17%       
client [12] (testset)   loss: 1.9125 -> 1.9082  accuracy: 23.73% -> 23.73%     
---------------------------- TRAINING EPOCH: 360 ----------------------------  
client [68] (testset)   loss: 1.8069 -> 1.8362  accuracy: 31.11% -> 37.78%     
client [23] (testset)   loss: 2.1809 -> 2.1719  accuracy: 20.59% -> 20.59%     
client [46] (testset)   loss: 1.8959 -> 1.8583  accuracy: 48.94% -> 48.94%     
client [41] (testset)   loss: 2.0316 -> 2.0238  accuracy: 26.92% -> 26.92%     
client [25] (testset)   loss: 2.3735 -> 2.4865  accuracy: 14.00% -> 12.00%     
client [58] (testset)   loss: 1.7202 -> 1.6903  accuracy: 42.47% -> 42.47%     
client [14] (testset)   loss: 2.1148 -> 2.0421  accuracy: 31.88% -> 31.88%     
client [33] (testset)   loss: 1.9093 -> 1.7421  accuracy: 22.22% -> 44.44%     
client [85] (testset)   loss: 2.0890 -> 2.0524  accuracy: 29.33% -> 29.33%     
client [62] (testset)   loss: 1.9372 -> 1.9118  accuracy: 41.38% -> 41.38%     
---------------------------- TRAINING EPOCH: 370 ----------------------------  
client [98] (testset)   loss: 2.0806 -> 2.0621  accuracy: 37.74% -> 37.74%     
client [63] (testset)   loss: 1.9788 -> 1.9877  accuracy: 31.67% -> 31.67%     
client [70] (testset)   loss: 2.1775 -> 2.2433  accuracy: 25.00% -> 25.00%     
client [65] (testset)   loss: 2.0629 -> 2.0278  accuracy: 37.74% -> 37.74%     
client [14] (testset)   loss: 2.0673 -> 2.0525  accuracy: 31.88% -> 31.88%     
client [73] (testset)   loss: 2.3575 -> 2.3440  accuracy: 12.28% -> 21.05%     
client [34] (testset)   loss: 1.9091 -> 1.9039  accuracy: 31.15% -> 24.59%     
client [99] (testset)   loss: 2.0877 -> 2.0689  accuracy: 20.51% -> 12.82%     
client [69] (testset)   loss: 2.0428 -> 2.0171  accuracy: 29.41% -> 29.41%     
client [46] (testset)   loss: 1.8726 -> 1.8580  accuracy: 48.94% -> 48.94%     
---------------------------- TRAINING EPOCH: 380 ----------------------------  
client [99] (testset)   loss: 2.0879 -> 2.0728  accuracy: 20.51% -> 7.69%      
client [93] (testset)   loss: 1.7264 -> 1.7187  accuracy: 45.65% -> 45.65%     
client [11] (testset)   loss: 2.0092 -> 2.0265  accuracy: 30.36% -> 30.36%     
client [58] (testset)   loss: 1.6910 -> 1.6709  accuracy: 42.47% -> 42.47%     
client [81] (testset)   loss: 2.0721 -> 2.0259  accuracy: 35.14% -> 22.97%     
client [85] (testset)   loss: 2.0732 -> 2.0912  accuracy: 29.33% -> 29.33%     
client [89] (testset)   loss: 1.8836 -> 1.9071  accuracy: 46.88% -> 46.88%     
client [45] (testset)   loss: 2.0667 -> 2.0629  accuracy: 34.78% -> 34.78%     
client [8]  (testset)   loss: 1.9029 -> 1.8907  accuracy: 34.17% -> 34.17%     
client [68] (testset)   loss: 1.7524 -> 1.7372  accuracy: 31.11% -> 37.78%     
---------------------------- TRAINING EPOCH: 390 ----------------------------  
client [67] (testset)   loss: 2.0579 -> 2.1011  accuracy: 22.81% -> 19.30%     
client [72] (testset)   loss: 2.0377 -> 1.7971  accuracy: 53.70% -> 53.70%     
client [1]  (testset)   loss: 2.3012 -> 2.4726  accuracy: 4.17% -> 4.17%       
client [78] (testset)   loss: 1.9126 -> 1.9198  accuracy: 24.24% -> 22.73%     
client [83] (testset)   loss: 2.1699 -> 2.1208  accuracy: 19.57% -> 19.57%     
client [21] (testset)   loss: 2.0301 -> 1.9717  accuracy: 24.56% -> 26.32%     
client [56] (testset)   loss: 2.0943 -> 2.0896  accuracy: 32.73% -> 7.27%      
client [44] (testset)   loss: 2.1430 -> 2.1524  accuracy: 12.50% -> 23.21%     
client [92] (testset)   loss: 2.1517 -> 2.0965  accuracy: 26.47% -> 26.47%     
client [27] (testset)   loss: 1.9603 -> 2.0509  accuracy: 38.75% -> 38.75%     
---------------------------- TRAINING EPOCH: 400 ----------------------------  
client [10] (testset)   loss: 2.2038 -> 2.0984  accuracy: 0.00% -> 38.89%      
client [39] (testset)   loss: 1.5579 -> 1.4472  accuracy: 53.77% -> 53.77%     
client [65] (testset)   loss: 2.1088 -> 2.0155  accuracy: 37.74% -> 37.74%     
client [26] (testset)   loss: 2.2091 -> 2.1616  accuracy: 22.81% -> 22.81%     
client [19] (testset)   loss: 2.1939 -> 2.2310  accuracy: 23.21% -> 23.21%     
client [68] (testset)   loss: 1.7402 -> 1.8127  accuracy: 37.78% -> 37.78%     
client [41] (testset)   loss: 2.0620 -> 2.0212  accuracy: 26.92% -> 26.92%     
client [50] (testset)   loss: 2.0694 -> 2.1096  accuracy: 29.87% -> 29.87%     
client [75] (testset)   loss: 2.1286 -> 2.1656  accuracy: 22.22% -> 22.22%     
client [81] (testset)   loss: 2.0371 -> 2.0058  accuracy: 35.14% -> 35.14%     
Training... ---------------------------------------- 100% 0:10:49
APFL's average time taken by each global epoch: 0 min 1.61 sec.                
APFL's total running time: 0 h 10 m 49 s.                                      
==================== APFL Experiment Results: ====================             
Display format: (before local fine-tuning) -> (after local fine-tuning)        
 So if finetune_epoch = 0, x.xx% -> 0.00% is normal.                           
 Centralized testing ONLY happens after model aggregation, so the stats between
'->' are the same.                                                             
{                                                                              
    "100": {                                                                   
        "all_clients": {                                                       
            "test": {                                                          
                "loss": "2.0289 -> 0.0000",                                    
                "accuracy": "28.18% -> 0.00%"                                  
            }                                                                  
        }                                                                      
    },                                                                         
    "200": {                                                                   
        "all_clients": {                                                       
            "test": {                                                          
                "loss": "2.0118 -> 0.0000",                                    
                "accuracy": "30.37% -> 0.00%"                                  
            }                                                                  
        }                                                                      
    },                                                                         
    "300": {                                                                   
        "all_clients": {                                                       
            "test": {                                                          
                "loss": "2.0066 -> 0.0000",                                    
                "accuracy": "30.54% -> 0.00%"                                  
            }                                                                  
        }                                                                      
    },                                                                         
    "400": {                                                                   
        "all_clients": {                                                       
            "test": {                                                          
                "loss": "2.0144 -> 0.0000",                                    
                "accuracy": "30.49% -> 0.00%"                                  
            }                                                                  
        }                                                                      
    }                                                                          
}                                                                              
==================== APFL Max Accuracy ====================                    
all_clients:                                                                   
(test) before fine-tuning: 30.54% at epoch 300                                 
(test) after fine-tuning: 0.00% at epoch 100                                   
[0m