==================== FedAvg ====================                               
Experiment Arguments:                                                          
{
│   'method': 'fedavg',
│   'dataset': {
│   │   'name': 'cifar100',
│   │   'client_num': 100,
│   │   'test_ratio': 0.25,
│   │   'val_ratio': 0.0,
│   │   'seed': 42,
│   │   'split': 'sample',
│   │   'IID_ratio': 0.0,
│   │   'monitor_window_name_suffix': 'cifar100-100clients-0%IID-use20superclasses-Dir(1.0)-seed42',
│   │   'super_class': False,
│   │   'alpha': 1.0,
│   │   'min_samples_per_client': 10
│   },
│   'model': {
│   │   'name': 'avgcnn',
│   │   'use_torchvision_pretrained_weights': True,
│   │   'external_model_weights_path': None
│   },
│   'optimizer': {
│   │   'lr': 0.01,
│   │   'dampening': 0,
│   │   'weight_decay': 0,
│   │   'momentum': 0,
│   │   'nesterov': False,
│   │   'name': 'sgd'
│   },
│   'mode': 'serial',
│   'parallel': {
│   │   'ray_cluster_addr': None,
│   │   'num_cpus': None,
│   │   'num_gpus': None,
│   │   'num_workers': 2
│   },
│   'common': {
│   │   'seed': 42,
│   │   'join_ratio': 0.1,
│   │   'global_epoch': 400,
│   │   'local_epoch': 5,
│   │   'batch_size': 32,
│   │   'reset_optimizer_on_global_epoch': True,
│   │   'straggler_ratio': 0,
│   │   'straggler_min_local_epoch': 0,
│   │   'buffers': 'global',
│   │   'client_side_evaluation': True,
│   │   'test': {
│   │   │   'client': {
│   │   │   │   'interval': 100,
│   │   │   │   'finetune_epoch': 0,
│   │   │   │   'train': False,
│   │   │   │   'val': False,
│   │   │   │   'test': True
│   │   │   },
│   │   │   'server': {
│   │   │   │   'interval': -1,
│   │   │   │   'train': False,
│   │   │   │   'val': False,
│   │   │   │   'test': False,
│   │   │   │   'model_in_train_mode': False
│   │   │   }
│   │   },
│   │   'verbose_gap': 10,
│   │   'monitor': None,
│   │   'use_cuda': True,
│   │   'save_log': True,
│   │   'save_model': False,
│   │   'save_learning_curve_plot': False,
│   │   'save_metrics': True,
│   │   'delete_useless_run': True
│   }
}
---------------------------- TRAINING EPOCH: 10 ----------------------------   
client [77] (testset)   loss: 3.9661 -> 5.5114  accuracy: 10.62% -> 3.75%      
client [81] (testset)   loss: 3.9657 -> 3.9772  accuracy: 4.83% -> 9.66%       
client [21] (testset)   loss: 4.0534 -> 3.9511  accuracy: 7.53% -> 13.01%      
client [68] (testset)   loss: 3.7580 -> 4.2112  accuracy: 14.46% -> 5.42%      
client [93] (testset)   loss: 4.0668 -> 4.9456  accuracy: 8.63% -> 4.32%       
client [31] (testset)   loss: 4.1943 -> 4.6570  accuracy: 7.69% -> 4.62%       
client [20] (testset)   loss: 3.9017 -> 4.4159  accuracy: 12.31% -> 7.69%      
client [59] (testset)   loss: 4.0577 -> 3.9742  accuracy: 9.42% -> 10.14%      
client [48] (testset)   loss: 3.7666 -> 3.9520  accuracy: 14.69% -> 6.21%      
client [34] (testset)   loss: 3.8764 -> 3.8822  accuracy: 17.09% -> 15.19%     
---------------------------- TRAINING EPOCH: 20 ----------------------------   
client [69] (testset)   loss: 3.4412 -> 4.2598  accuracy: 19.25% -> 14.29%     
client [99] (testset)   loss: 3.5150 -> 4.4861  accuracy: 21.43% -> 9.34%      
client [67] (testset)   loss: 3.6748 -> 4.5670  accuracy: 15.13% -> 12.50%     
client [0]  (testset)   loss: 3.7013 -> 3.8904  accuracy: 17.65% -> 11.76%     
client [76] (testset)   loss: 3.8810 -> 4.7695  accuracy: 16.53% -> 4.96%      
client [41] (testset)   loss: 3.5678 -> 4.0950  accuracy: 15.11% -> 14.39%     
client [62] (testset)   loss: 3.5607 -> 3.5981  accuracy: 16.80% -> 16.80%     
client [2]  (testset)   loss: 3.5814 -> 3.7179  accuracy: 17.18% -> 21.47%     
client [14] (testset)   loss: 3.6352 -> 5.5231  accuracy: 17.83% -> 5.43%      
client [46] (testset)   loss: 3.7162 -> 5.3963  accuracy: 15.53% -> 14.29%     
---------------------------- TRAINING EPOCH: 30 ----------------------------   
client [24] (testset)   loss: 3.6254 -> 4.2836  accuracy: 19.57% -> 18.12%     
client [68] (testset)   loss: 3.3824 -> 4.3678  accuracy: 21.69% -> 19.88%     
client [57] (testset)   loss: 3.4013 -> 3.8845  accuracy: 23.08% -> 25.64%     
client [17] (testset)   loss: 3.7231 -> 6.1515  accuracy: 16.67% -> 6.67%      
client [54] (testset)   loss: 3.6324 -> 6.0111  accuracy: 18.64% -> 8.47%      
client [23] (testset)   loss: 3.8220 -> 3.9722  accuracy: 15.29% -> 22.35%     
client [35] (testset)   loss: 3.6255 -> 4.1556  accuracy: 18.56% -> 17.37%     
client [59] (testset)   loss: 3.5174 -> 4.1399  accuracy: 20.29% -> 16.67%     
client [31] (testset)   loss: 3.5811 -> 5.1751  accuracy: 21.54% -> 11.54%     
client [9]  (testset)   loss: 3.6643 -> 4.0692  accuracy: 17.65% -> 16.47%     
---------------------------- TRAINING EPOCH: 40 ----------------------------   
client [64] (testset)   loss: 4.0542 -> 4.8942  accuracy: 15.75% -> 17.12%     
client [33] (testset)   loss: 3.8058 -> 4.7221  accuracy: 22.44% -> 15.38%     
client [16] (testset)   loss: 3.8632 -> 5.7394  accuracy: 20.31% -> 17.97%     
client [44] (testset)   loss: 3.6651 -> 4.4845  accuracy: 22.86% -> 15.00%     
client [8]  (testset)   loss: 3.5059 -> 4.6278  accuracy: 26.81% -> 15.94%     
client [31] (testset)   loss: 3.9254 -> 5.5021  accuracy: 20.00% -> 15.38%     
client [47] (testset)   loss: 3.9961 -> 4.7098  accuracy: 18.75% -> 13.64%     
client [36] (testset)   loss: 3.8905 -> 4.5391  accuracy: 18.07% -> 19.28%     
client [20] (testset)   loss: 3.6877 -> 4.8018  accuracy: 20.77% -> 21.54%     
client [56] (testset)   loss: 3.7662 -> 4.2130  accuracy: 19.12% -> 25.74%     
---------------------------- TRAINING EPOCH: 50 ----------------------------   
client [4]  (testset)   loss: 3.8100 -> 5.1636  accuracy: 23.20% -> 16.57%     
client [60] (testset)   loss: 4.7841 -> 5.1802  accuracy: 12.86% -> 12.86%     
client [28] (testset)   loss: 3.4256 -> 4.2029  accuracy: 22.76% -> 21.38%     
client [25] (testset)   loss: 3.7810 -> 4.5355  accuracy: 20.31% -> 17.97%     
client [58] (testset)   loss: 3.6949 -> 4.4545  accuracy: 26.45% -> 22.31%     
client [44] (testset)   loss: 3.6529 -> 6.1822  accuracy: 22.86% -> 15.00%     
client [39] (testset)   loss: 3.9013 -> 4.5628  accuracy: 22.73% -> 18.18%     
client [29] (testset)   loss: 3.5918 -> 4.4095  accuracy: 23.24% -> 17.30%     
client [3]  (testset)   loss: 3.9102 -> 4.4071  accuracy: 18.81% -> 22.28%     
client [84] (testset)   loss: 3.4168 -> 3.9767  accuracy: 27.46% -> 21.83%     
---------------------------- TRAINING EPOCH: 60 ----------------------------   
client [21] (testset)   loss: 3.5727 -> 4.1531  accuracy: 27.40% -> 24.66%     
client [84] (testset)   loss: 3.5725 -> 4.1439  accuracy: 26.76% -> 21.83%     
client [10] (testset)   loss: 3.6830 -> 4.3148  accuracy: 18.42% -> 17.11%     
client [36] (testset)   loss: 3.7011 -> 4.6725  accuracy: 17.47% -> 17.47%     
client [65] (testset)   loss: 4.1123 -> 5.1892  accuracy: 11.33% -> 12.67%     
client [81] (testset)   loss: 3.6902 -> 4.4345  accuracy: 19.31% -> 21.38%     
client [79] (testset)   loss: 3.5516 -> 4.2316  accuracy: 23.30% -> 22.73%     
client [42] (testset)   loss: 3.6554 -> 4.5527  accuracy: 16.56% -> 17.83%     
client [11] (testset)   loss: 3.5602 -> 4.2000  accuracy: 26.81% -> 27.54%     
client [96] (testset)   loss: 3.5889 -> 4.4076  accuracy: 29.51% -> 27.05%     
---------------------------- TRAINING EPOCH: 70 ----------------------------   
client [8]  (testset)   loss: 3.3736 -> 4.5084  accuracy: 26.81% -> 19.57%     
client [53] (testset)   loss: 3.3623 -> 3.9753  accuracy: 23.29% -> 28.08%     
client [52] (testset)   loss: 3.5475 -> 4.1340  accuracy: 27.92% -> 29.87%     
client [42] (testset)   loss: 3.6358 -> 4.3399  accuracy: 19.75% -> 20.38%     
client [69] (testset)   loss: 3.3703 -> 4.0317  accuracy: 26.09% -> 25.47%     
client [59] (testset)   loss: 3.4062 -> 3.9845  accuracy: 29.71% -> 28.26%     
client [7]  (testset)   loss: 3.8523 -> 4.5127  accuracy: 25.00% -> 23.57%     
client [26] (testset)   loss: 3.5926 -> 4.3597  accuracy: 25.31% -> 24.07%     
client [49] (testset)   loss: 3.6708 -> 4.6975  accuracy: 21.71% -> 17.76%     
client [98] (testset)   loss: 3.5325 -> 4.3791  accuracy: 20.67% -> 17.33%     
---------------------------- TRAINING EPOCH: 80 ----------------------------   
client [98] (testset)   loss: 3.8350 -> 4.4164  accuracy: 20.00% -> 18.67%     
client [47] (testset)   loss: 4.2879 -> 4.7644  accuracy: 17.05% -> 21.02%     
client [21] (testset)   loss: 3.8282 -> 4.2705  accuracy: 24.66% -> 28.08%     
client [77] (testset)   loss: 3.9660 -> 4.4275  accuracy: 26.88% -> 24.38%     
client [95] (testset)   loss: 3.7786 -> 4.4078  accuracy: 28.47% -> 27.74%     
client [91] (testset)   loss: 3.8116 -> 4.4249  accuracy: 22.78% -> 20.56%     
client [14] (testset)   loss: 3.3953 -> 4.2313  accuracy: 30.23% -> 23.26%     
client [99] (testset)   loss: 3.6683 -> 4.3911  accuracy: 22.53% -> 23.08%     
client [20] (testset)   loss: 3.8035 -> 4.3986  accuracy: 21.54% -> 24.62%     
client [39] (testset)   loss: 3.8375 -> 4.3735  accuracy: 22.73% -> 22.08%     
---------------------------- TRAINING EPOCH: 90 ----------------------------   
client [52] (testset)   loss: 3.5071 -> 3.9489  accuracy: 29.22% -> 31.17%     
client [62] (testset)   loss: 3.3035 -> 3.8482  accuracy: 28.80% -> 30.40%     
client [71] (testset)   loss: 4.3498 -> 5.1098  accuracy: 22.78% -> 19.62%     
client [97] (testset)   loss: 3.7582 -> 4.3549  accuracy: 24.22% -> 18.01%     
client [30] (testset)   loss: 3.7534 -> 4.5100  accuracy: 27.53% -> 28.09%     
client [88] (testset)   loss: 3.8584 -> 4.7412  accuracy: 17.14% -> 16.43%     
client [60] (testset)   loss: 4.8875 -> 5.4891  accuracy: 20.00% -> 15.00%     
client [82] (testset)   loss: 3.4603 -> 4.1665  accuracy: 31.36% -> 26.63%     
client [91] (testset)   loss: 3.6791 -> 4.3962  accuracy: 25.56% -> 23.89%     
client [57] (testset)   loss: 3.5784 -> 3.9780  accuracy: 26.28% -> 26.28%     
---------------------------- TRAINING EPOCH: 100 ----------------------------  
client [31] (testset)   loss: 4.2317 -> 4.8742  accuracy: 14.62% -> 16.15%     
client [15] (testset)   loss: 3.4428 -> 4.1467  accuracy: 26.43% -> 28.57%     
client [71] (testset)   loss: 4.2308 -> 4.9298  accuracy: 24.68% -> 21.52%     
client [97] (testset)   loss: 3.7830 -> 4.5051  accuracy: 24.22% -> 20.50%     
client [53] (testset)   loss: 3.4455 -> 3.8609  accuracy: 23.29% -> 32.19%     
client [77] (testset)   loss: 3.9740 -> 4.6750  accuracy: 25.62% -> 23.75%     
client [76] (testset)   loss: 4.2799 -> 5.2004  accuracy: 17.36% -> 15.70%     
client [79] (testset)   loss: 3.6989 -> 4.2078  accuracy: 24.43% -> 25.57%     
client [28] (testset)   loss: 3.5514 -> 4.3074  accuracy: 28.28% -> 24.83%     
client [99] (testset)   loss: 3.5296 -> 4.2029  accuracy: 26.92% -> 21.43%     
---------------------------- TRAINING EPOCH: 110 ----------------------------  
client [97] (testset)   loss: 3.8629 -> 4.5882  accuracy: 24.84% -> 18.01%     
client [86] (testset)   loss: 3.6552 -> 4.3661  accuracy: 23.24% -> 23.24%     
client [34] (testset)   loss: 3.6049 -> 4.2818  accuracy: 29.75% -> 26.58%     
client [73] (testset)   loss: 4.0070 -> 4.7904  accuracy: 18.90% -> 23.17%     
client [5]  (testset)   loss: 3.5525 -> 4.3307  accuracy: 25.66% -> 26.97%     
client [96] (testset)   loss: 3.6176 -> 4.4838  accuracy: 31.15% -> 27.87%     
client [22] (testset)   loss: 3.9878 -> 4.4163  accuracy: 21.13% -> 21.83%     
client [60] (testset)   loss: 4.9711 -> 5.4254  accuracy: 17.14% -> 16.43%     
client [66] (testset)   loss: 3.5626 -> 4.0103  accuracy: 27.03% -> 29.05%     
client [83] (testset)   loss: 3.8948 -> 4.1411  accuracy: 22.93% -> 30.57%     
---------------------------- TRAINING EPOCH: 120 ----------------------------  
client [76] (testset)   loss: 4.3477 -> 5.0612  accuracy: 18.18% -> 15.70%     
client [65] (testset)   loss: 4.4044 -> 5.2464  accuracy: 18.00% -> 13.33%     
client [95] (testset)   loss: 3.6561 -> 3.9869  accuracy: 26.28% -> 28.47%     
client [17] (testset)   loss: 3.7918 -> 4.4215  accuracy: 18.00% -> 16.00%     
client [8]  (testset)   loss: 3.4499 -> 4.4040  accuracy: 28.26% -> 25.36%     
client [35] (testset)   loss: 4.1542 -> 4.3927  accuracy: 17.96% -> 20.36%     
client [98] (testset)   loss: 3.7386 -> 4.2945  accuracy: 27.33% -> 20.00%     
client [53] (testset)   loss: 3.3629 -> 4.0526  accuracy: 24.66% -> 30.82%     
client [43] (testset)   loss: 3.9705 -> 4.5337  accuracy: 27.59% -> 24.83%     
client [64] (testset)   loss: 4.0435 -> 4.7783  accuracy: 23.97% -> 22.60%     
---------------------------- TRAINING EPOCH: 130 ----------------------------  
client [21] (testset)   loss: 3.7971 -> 4.2937  accuracy: 25.34% -> 26.71%     
client [88] (testset)   loss: 3.8846 -> 4.5563  accuracy: 19.29% -> 18.57%     
client [38] (testset)   loss: 4.0085 -> 4.4929  accuracy: 25.71% -> 23.57%     
client [3]  (testset)   loss: 4.2882 -> 4.7802  accuracy: 22.28% -> 22.28%     
client [5]  (testset)   loss: 3.6187 -> 4.3320  accuracy: 26.97% -> 23.68%     
client [41] (testset)   loss: 4.0411 -> 4.7244  accuracy: 18.71% -> 18.71%     
client [7]  (testset)   loss: 4.4290 -> 4.8432  accuracy: 20.71% -> 27.14%     
client [37] (testset)   loss: 4.1431 -> 4.4691  accuracy: 23.61% -> 27.08%     
client [45] (testset)   loss: 3.9068 -> 4.2022  accuracy: 27.43% -> 24.00%     
client [47] (testset)   loss: 4.2508 -> 4.7669  accuracy: 21.02% -> 22.73%     
---------------------------- TRAINING EPOCH: 140 ----------------------------  
client [16] (testset)   loss: 3.6887 -> 4.3275  accuracy: 27.34% -> 29.69%     
client [11] (testset)   loss: 3.7907 -> 4.2964  accuracy: 28.26% -> 25.36%     
client [37] (testset)   loss: 3.9886 -> 4.4699  accuracy: 24.31% -> 25.00%     
client [41] (testset)   loss: 4.0341 -> 4.5655  accuracy: 22.30% -> 16.55%     
client [95] (testset)   loss: 3.6889 -> 3.9369  accuracy: 32.12% -> 29.20%     
client [53] (testset)   loss: 3.4874 -> 3.7482  accuracy: 21.92% -> 31.51%     
client [22] (testset)   loss: 4.0406 -> 4.3606  accuracy: 21.83% -> 26.76%     
client [25] (testset)   loss: 4.0555 -> 4.8207  accuracy: 21.09% -> 24.22%     
client [69] (testset)   loss: 3.4756 -> 3.8685  accuracy: 30.43% -> 31.06%     
client [46] (testset)   loss: 3.7733 -> 4.3195  accuracy: 23.60% -> 28.57%     
---------------------------- TRAINING EPOCH: 150 ----------------------------  
client [47] (testset)   loss: 4.2128 -> 5.0350  accuracy: 21.59% -> 22.73%     
client [69] (testset)   loss: 3.6071 -> 4.0055  accuracy: 26.09% -> 33.54%     
client [82] (testset)   loss: 3.9276 -> 4.2452  accuracy: 28.40% -> 26.04%     
client [45] (testset)   loss: 3.9353 -> 4.3248  accuracy: 28.57% -> 29.71%     
client [7]  (testset)   loss: 4.4135 -> 4.9645  accuracy: 24.29% -> 23.57%     
client [50] (testset)   loss: 3.6755 -> 3.7608  accuracy: 31.15% -> 30.33%     
client [35] (testset)   loss: 4.2230 -> 4.5310  accuracy: 23.95% -> 22.75%     
client [24] (testset)   loss: 4.2126 -> 4.6180  accuracy: 23.91% -> 26.81%     
client [15] (testset)   loss: 3.8256 -> 4.0797  accuracy: 25.00% -> 32.86%     
client [58] (testset)   loss: 3.6876 -> 4.2696  accuracy: 25.62% -> 28.10%     
---------------------------- TRAINING EPOCH: 160 ----------------------------  
client [48] (testset)   loss: 4.0745 -> 4.6003  accuracy: 28.81% -> 28.81%     
client [76] (testset)   loss: 4.5408 -> 5.1915  accuracy: 19.01% -> 15.70%     
client [67] (testset)   loss: 3.8517 -> 4.4364  accuracy: 29.61% -> 23.03%     
client [37] (testset)   loss: 4.2349 -> 4.6165  accuracy: 24.31% -> 25.69%     
client [58] (testset)   loss: 3.5586 -> 4.0414  accuracy: 30.58% -> 32.23%     
client [64] (testset)   loss: 4.3567 -> 4.8791  accuracy: 24.66% -> 23.29%     
client [77] (testset)   loss: 4.2271 -> 4.9761  accuracy: 24.38% -> 23.75%     
client [55] (testset)   loss: 4.0216 -> 4.4653  accuracy: 24.65% -> 29.58%     
client [12] (testset)   loss: 3.7959 -> 4.2808  accuracy: 25.50% -> 26.85%     
client [89] (testset)   loss: 3.5134 -> 3.7947  accuracy: 26.03% -> 30.14%     
---------------------------- TRAINING EPOCH: 170 ----------------------------  
client [84] (testset)   loss: 3.8763 -> 4.5122  accuracy: 21.83% -> 26.06%     
client [51] (testset)   loss: 3.7596 -> 4.4241  accuracy: 26.76% -> 27.46%     
client [8]  (testset)   loss: 3.5813 -> 4.3975  accuracy: 28.99% -> 23.91%     
client [18] (testset)   loss: 3.4991 -> 3.8716  accuracy: 29.41% -> 29.41%     
client [94] (testset)   loss: 4.1582 -> 4.3762  accuracy: 23.57% -> 26.43%     
client [81] (testset)   loss: 3.9997 -> 4.5326  accuracy: 24.83% -> 24.83%     
client [3]  (testset)   loss: 4.1684 -> 4.8224  accuracy: 19.80% -> 24.75%     
client [11] (testset)   loss: 3.7761 -> 4.3363  accuracy: 29.71% -> 25.36%     
client [95] (testset)   loss: 3.6105 -> 3.9131  accuracy: 33.58% -> 28.47%     
client [67] (testset)   loss: 3.8082 -> 4.4953  accuracy: 29.61% -> 25.00%     
---------------------------- TRAINING EPOCH: 180 ----------------------------  
client [21] (testset)   loss: 3.8425 -> 4.1747  accuracy: 28.77% -> 28.08%     
client [79] (testset)   loss: 4.0081 -> 4.3072  accuracy: 27.27% -> 30.11%     
client [58] (testset)   loss: 3.6725 -> 4.0280  accuracy: 27.27% -> 28.93%     
client [88] (testset)   loss: 4.0656 -> 4.6165  accuracy: 18.57% -> 19.29%     
client [46] (testset)   loss: 3.9788 -> 4.2376  accuracy: 24.84% -> 29.19%     
client [11] (testset)   loss: 3.7559 -> 4.3182  accuracy: 30.43% -> 27.54%     
client [55] (testset)   loss: 4.1616 -> 4.5239  accuracy: 26.76% -> 23.94%     
client [13] (testset)   loss: 4.0205 -> 4.3105  accuracy: 29.93% -> 27.21%     
client [31] (testset)   loss: 4.4013 -> 5.0484  accuracy: 21.54% -> 18.46%     
client [75] (testset)   loss: 3.5084 -> 3.8797  accuracy: 29.88% -> 25.00%     
---------------------------- TRAINING EPOCH: 190 ----------------------------  
client [19] (testset)   loss: 3.8833 -> 4.6406  accuracy: 28.49% -> 29.07%     
client [7]  (testset)   loss: 4.5110 -> 5.0083  accuracy: 24.29% -> 25.71%     
client [57] (testset)   loss: 3.7802 -> 3.9943  accuracy: 30.13% -> 33.97%     
client [13] (testset)   loss: 3.9037 -> 4.3239  accuracy: 29.25% -> 25.85%     
client [43] (testset)   loss: 4.1652 -> 4.5241  accuracy: 27.59% -> 28.97%     
client [91] (testset)   loss: 3.8806 -> 4.3482  accuracy: 29.44% -> 26.11%     
client [10] (testset)   loss: 3.9788 -> 4.4572  accuracy: 24.34% -> 26.97%     
client [64] (testset)   loss: 4.2385 -> 4.9776  accuracy: 27.40% -> 22.60%     
client [82] (testset)   loss: 4.0455 -> 4.4435  accuracy: 26.04% -> 28.99%     
client [22] (testset)   loss: 4.1812 -> 4.4425  accuracy: 23.24% -> 28.87%     
---------------------------- TRAINING EPOCH: 200 ----------------------------  
client [20] (testset)   loss: 3.9743 -> 4.1674  accuracy: 26.15% -> 27.69%     
client [23] (testset)   loss: 4.7609 -> 5.2292  accuracy: 20.59% -> 24.71%     
client [88] (testset)   loss: 4.1726 -> 4.5768  accuracy: 20.00% -> 22.14%     
client [98] (testset)   loss: 3.9129 -> 4.2103  accuracy: 27.33% -> 25.33%     
client [79] (testset)   loss: 4.1413 -> 4.4237  accuracy: 30.11% -> 34.09%     
client [21] (testset)   loss: 3.9132 -> 4.3167  accuracy: 31.51% -> 31.51%     
client [92] (testset)   loss: 3.9800 -> 4.5930  accuracy: 30.99% -> 26.76%     
client [56] (testset)   loss: 4.0996 -> 4.3646  accuracy: 25.00% -> 30.15%     
client [5]  (testset)   loss: 3.8206 -> 4.4949  accuracy: 28.29% -> 25.00%     
client [52] (testset)   loss: 3.9644 -> 4.1216  accuracy: 31.82% -> 31.17%     
---------------------------- TRAINING EPOCH: 210 ----------------------------  
client [67] (testset)   loss: 3.9001 -> 4.5029  accuracy: 28.29% -> 25.66%     
client [54] (testset)   loss: 3.9741 -> 4.6956  accuracy: 26.27% -> 22.03%     
client [14] (testset)   loss: 3.7942 -> 4.1392  accuracy: 27.91% -> 25.58%     
client [99] (testset)   loss: 3.7541 -> 4.2533  accuracy: 27.47% -> 26.37%     
client [36] (testset)   loss: 4.0973 -> 4.7735  accuracy: 24.70% -> 27.11%     
client [30] (testset)   loss: 3.7965 -> 4.3118  accuracy: 26.97% -> 28.65%     
client [38] (testset)   loss: 4.2256 -> 4.2298  accuracy: 27.14% -> 29.29%     
client [15] (testset)   loss: 4.0723 -> 4.2407  accuracy: 28.57% -> 35.00%     
client [6]  (testset)   loss: 3.9689 -> 4.4875  accuracy: 29.41% -> 30.72%     
client [53] (testset)   loss: 3.6255 -> 4.0442  accuracy: 21.23% -> 31.51%     
---------------------------- TRAINING EPOCH: 220 ----------------------------  
client [99] (testset)   loss: 3.8159 -> 4.4428  accuracy: 26.92% -> 23.63%     
client [6]  (testset)   loss: 4.1509 -> 4.6556  accuracy: 32.03% -> 30.72%     
client [83] (testset)   loss: 4.3836 -> 4.4731  accuracy: 22.93% -> 26.11%     
client [42] (testset)   loss: 4.2419 -> 4.5010  accuracy: 21.02% -> 26.11%     
client [34] (testset)   loss: 4.0400 -> 4.4928  accuracy: 31.01% -> 28.48%     
client [15] (testset)   loss: 3.9164 -> 4.0842  accuracy: 27.86% -> 27.14%     
client [47] (testset)   loss: 4.6612 -> 5.0541  accuracy: 23.86% -> 24.43%     
client [55] (testset)   loss: 4.3104 -> 4.7925  accuracy: 23.94% -> 25.35%     
client [51] (testset)   loss: 4.0124 -> 4.6232  accuracy: 26.76% -> 26.76%     
client [95] (testset)   loss: 3.7909 -> 4.2182  accuracy: 35.77% -> 26.28%     
---------------------------- TRAINING EPOCH: 230 ----------------------------  
client [71] (testset)   loss: 4.8303 -> 5.2231  accuracy: 24.68% -> 22.78%     
client [15] (testset)   loss: 4.1030 -> 4.1614  accuracy: 27.86% -> 28.57%     
client [33] (testset)   loss: 4.2533 -> 4.4658  accuracy: 26.28% -> 23.08%     
client [99] (testset)   loss: 3.8548 -> 4.4072  accuracy: 26.37% -> 28.02%     
client [90] (testset)   loss: 4.2421 -> 5.2078  accuracy: 26.24% -> 24.11%     
client [57] (testset)   loss: 4.0473 -> 4.0831  accuracy: 28.21% -> 31.41%     
client [27] (testset)   loss: 4.1341 -> 4.3306  accuracy: 27.59% -> 27.59%     
client [78] (testset)   loss: 4.3875 -> 4.4552  accuracy: 16.55% -> 24.14%     
client [36] (testset)   loss: 4.3116 -> 4.9483  accuracy: 24.70% -> 24.70%     
client [88] (testset)   loss: 4.1394 -> 4.5713  accuracy: 20.71% -> 21.43%     
---------------------------- TRAINING EPOCH: 240 ----------------------------  
client [70] (testset)   loss: 3.9725 -> 4.1426  accuracy: 28.77% -> 32.19%     
client [35] (testset)   loss: 4.7400 -> 4.9310  accuracy: 22.75% -> 21.56%     
client [16] (testset)   loss: 4.4737 -> 4.8425  accuracy: 28.91% -> 32.81%     
client [80] (testset)   loss: 4.4276 -> 4.4903  accuracy: 23.42% -> 31.01%     
client [38] (testset)   loss: 4.4095 -> 4.7771  accuracy: 24.29% -> 30.00%     
client [78] (testset)   loss: 4.3971 -> 4.4828  accuracy: 18.62% -> 20.00%     
client [68] (testset)   loss: 4.4247 -> 5.0198  accuracy: 27.71% -> 25.90%     
client [11] (testset)   loss: 4.1360 -> 4.3951  accuracy: 26.81% -> 29.71%     
client [64] (testset)   loss: 4.9198 -> 4.9767  accuracy: 23.29% -> 21.92%     
client [82] (testset)   loss: 4.1864 -> 4.3918  accuracy: 27.81% -> 28.40%     
---------------------------- TRAINING EPOCH: 250 ----------------------------  
client [30] (testset)   loss: 3.9808 -> 4.1560  accuracy: 25.84% -> 27.53%     
client [27] (testset)   loss: 4.2848 -> 4.5735  accuracy: 26.21% -> 26.90%     
client [74] (testset)   loss: 4.3716 -> 4.8161  accuracy: 22.14% -> 24.29%     
client [45] (testset)   loss: 4.2196 -> 4.4552  accuracy: 27.43% -> 30.86%     
client [6]  (testset)   loss: 4.0825 -> 4.6049  accuracy: 28.76% -> 33.33%     
client [36] (testset)   loss: 4.3889 -> 4.7947  accuracy: 24.70% -> 28.92%     
client [63] (testset)   loss: 4.0486 -> 4.9017  accuracy: 28.10% -> 24.79%     
client [76] (testset)   loss: 4.9899 -> 5.2911  accuracy: 19.01% -> 17.36%     
client [83] (testset)   loss: 4.5303 -> 4.6230  accuracy: 22.93% -> 29.94%     
client [86] (testset)   loss: 4.3431 -> 4.5434  accuracy: 28.17% -> 30.28%     
---------------------------- TRAINING EPOCH: 260 ----------------------------  
client [83] (testset)   loss: 4.6485 -> 4.7721  accuracy: 22.29% -> 30.57%     
client [99] (testset)   loss: 4.0259 -> 4.6290  accuracy: 27.47% -> 24.18%     
client [74] (testset)   loss: 4.4179 -> 5.0344  accuracy: 22.14% -> 22.14%     
client [73] (testset)   loss: 4.5948 -> 4.8475  accuracy: 23.17% -> 26.83%     
client [29] (testset)   loss: 4.0784 -> 4.6112  accuracy: 24.32% -> 28.11%     
client [92] (testset)   loss: 3.9799 -> 4.6020  accuracy: 28.17% -> 26.76%     
client [6]  (testset)   loss: 4.3857 -> 4.8744  accuracy: 30.72% -> 29.41%     
client [61] (testset)   loss: 4.2357 -> 4.6939  accuracy: 20.00% -> 26.15%     
client [21] (testset)   loss: 4.2165 -> 4.5685  accuracy: 26.71% -> 27.40%     
client [67] (testset)   loss: 4.0711 -> 4.8801  accuracy: 32.89% -> 25.00%     
---------------------------- TRAINING EPOCH: 270 ----------------------------  
client [83] (testset)   loss: 4.7413 -> 4.9680  accuracy: 26.11% -> 26.75%     
client [32] (testset)   loss: 4.4932 -> 5.0146  accuracy: 29.27% -> 26.83%     
client [95] (testset)   loss: 3.8615 -> 4.1084  accuracy: 37.96% -> 27.74%     
client [61] (testset)   loss: 4.2965 -> 4.7779  accuracy: 21.54% -> 23.08%     
client [27] (testset)   loss: 4.4532 -> 4.5735  accuracy: 26.21% -> 26.90%     
client [25] (testset)   loss: 4.3930 -> 5.7833  accuracy: 28.12% -> 21.88%     
client [68] (testset)   loss: 4.3484 -> 5.2074  accuracy: 30.12% -> 25.30%     
client [34] (testset)   loss: 4.4461 -> 4.5585  accuracy: 29.75% -> 24.68%     
client [71] (testset)   loss: 5.0360 -> 5.1401  accuracy: 24.05% -> 27.85%     
client [89] (testset)   loss: 4.0064 -> 4.0970  accuracy: 28.08% -> 28.08%     
---------------------------- TRAINING EPOCH: 280 ----------------------------  
client [78] (testset)   loss: 4.4539 -> 4.6946  accuracy: 14.48% -> 21.38%     
client [81] (testset)   loss: 4.5426 -> 4.9454  accuracy: 23.45% -> 25.52%     
client [51] (testset)   loss: 4.0930 -> 4.6793  accuracy: 27.46% -> 28.17%     
client [54] (testset)   loss: 4.2180 -> 5.0545  accuracy: 24.58% -> 24.58%     
client [65] (testset)   loss: 5.3867 -> 5.7432  accuracy: 14.67% -> 15.33%     
client [41] (testset)   loss: 4.6802 -> 5.0339  accuracy: 19.42% -> 21.58%     
client [11] (testset)   loss: 4.2268 -> 4.5631  accuracy: 30.43% -> 28.99%     
client [85] (testset)   loss: 5.2414 -> 5.9033  accuracy: 25.60% -> 22.02%     
client [12] (testset)   loss: 4.3468 -> 4.8135  accuracy: 23.49% -> 24.16%     
client [23] (testset)   loss: 4.8351 -> 5.5127  accuracy: 21.76% -> 26.47%     
---------------------------- TRAINING EPOCH: 290 ----------------------------  
client [16] (testset)   loss: 4.7249 -> 4.9220  accuracy: 24.22% -> 30.47%     
client [65] (testset)   loss: 5.2915 -> 5.6666  accuracy: 16.67% -> 16.67%     
client [53] (testset)   loss: 4.0380 -> 4.4723  accuracy: 17.81% -> 27.40%     
client [58] (testset)   loss: 3.9943 -> 4.2243  accuracy: 29.75% -> 33.88%     
client [72] (testset)   loss: 4.5847 -> 4.8749  accuracy: 28.07% -> 28.95%     
client [7]  (testset)   loss: 5.0667 -> 5.5907  accuracy: 25.00% -> 27.14%     
client [71] (testset)   loss: 5.0491 -> 5.4304  accuracy: 26.58% -> 26.58%     
client [59] (testset)   loss: 4.0800 -> 4.7761  accuracy: 26.81% -> 24.64%     
client [86] (testset)   loss: 4.6095 -> 4.5802  accuracy: 25.35% -> 30.99%     
client [39] (testset)   loss: 4.2265 -> 4.8430  accuracy: 26.62% -> 24.68%     
---------------------------- TRAINING EPOCH: 300 ----------------------------  
client [99] (testset)   loss: 4.1479 -> 4.6256  accuracy: 25.82% -> 26.37%     
client [7]  (testset)   loss: 4.8827 -> 5.4935  accuracy: 27.14% -> 29.29%     
client [17] (testset)   loss: 4.3214 -> 4.7176  accuracy: 24.00% -> 27.33%     
client [64] (testset)   loss: 5.1100 -> 5.3819  accuracy: 21.92% -> 23.29%     
client [37] (testset)   loss: 4.6507 -> 4.9255  accuracy: 25.69% -> 26.39%     
client [29] (testset)   loss: 4.0492 -> 4.6418  accuracy: 27.57% -> 29.19%     
client [93] (testset)   loss: 4.3551 -> 4.8557  accuracy: 28.78% -> 20.14%     
client [73] (testset)   loss: 4.6067 -> 4.8414  accuracy: 20.73% -> 25.00%     
client [40] (testset)   loss: 4.9836 -> 5.4520  accuracy: 22.16% -> 22.16%     
client [76] (testset)   loss: 5.1618 -> 5.8208  accuracy: 22.31% -> 18.18%     
---------------------------- TRAINING EPOCH: 310 ----------------------------  
client [31] (testset)   loss: 5.1374 -> 5.4309  accuracy: 17.69% -> 20.77%     
client [89] (testset)   loss: 4.1963 -> 4.6155  accuracy: 30.82% -> 29.45%     
client [77] (testset)   loss: 4.9298 -> 5.5416  accuracy: 25.00% -> 26.25%     
client [90] (testset)   loss: 4.6202 -> 5.3404  accuracy: 28.37% -> 22.70%     
client [26] (testset)   loss: 4.3265 -> 4.9385  accuracy: 29.63% -> 32.72%     
client [50] (testset)   loss: 4.1400 -> 4.5268  accuracy: 30.33% -> 26.23%     
client [30] (testset)   loss: 4.2041 -> 4.3801  accuracy: 28.09% -> 29.21%     
client [70] (testset)   loss: 4.5348 -> 4.6811  accuracy: 26.71% -> 28.77%     
client [41] (testset)   loss: 4.8723 -> 5.4771  accuracy: 22.30% -> 21.58%     
client [99] (testset)   loss: 4.1863 -> 4.7815  accuracy: 28.02% -> 25.27%     
---------------------------- TRAINING EPOCH: 320 ----------------------------  
client [68] (testset)   loss: 4.7645 -> 5.0829  accuracy: 27.11% -> 25.30%     
client [70] (testset)   loss: 4.5382 -> 4.6697  accuracy: 26.71% -> 32.19%     
client [52] (testset)   loss: 4.2360 -> 4.4949  accuracy: 32.47% -> 30.52%     
client [1]  (testset)   loss: 4.8568 -> 5.6238  accuracy: 22.70% -> 20.57%     
client [2]  (testset)   loss: 4.0709 -> 4.5597  accuracy: 33.74% -> 31.29%     
client [67] (testset)   loss: 4.5374 -> 4.9522  accuracy: 23.68% -> 26.32%     
client [92] (testset)   loss: 4.3532 -> 4.6783  accuracy: 27.46% -> 25.35%     
client [35] (testset)   loss: 5.0713 -> 5.2717  accuracy: 23.95% -> 23.95%     
client [36] (testset)   loss: 4.8512 -> 5.3930  accuracy: 25.90% -> 24.70%     
client [64] (testset)   loss: 5.3112 -> 5.5167  accuracy: 21.23% -> 21.23%     
---------------------------- TRAINING EPOCH: 330 ----------------------------  
client [44] (testset)   loss: 4.7061 -> 5.2588  accuracy: 27.86% -> 25.71%     
client [6]  (testset)   loss: 4.5222 -> 5.2434  accuracy: 33.33% -> 28.76%     
client [12] (testset)   loss: 4.7895 -> 5.0725  accuracy: 19.46% -> 26.85%     
client [55] (testset)   loss: 4.7844 -> 5.3259  accuracy: 25.35% -> 28.17%     
client [29] (testset)   loss: 4.3750 -> 4.8805  accuracy: 23.78% -> 25.95%     
client [9]  (testset)   loss: 4.8160 -> 4.9192  accuracy: 25.29% -> 27.06%     
client [43] (testset)   loss: 4.9377 -> 5.2187  accuracy: 26.90% -> 24.83%     
client [77] (testset)   loss: 5.0714 -> 5.7856  accuracy: 23.12% -> 26.88%     
client [98] (testset)   loss: 4.4309 -> 4.8692  accuracy: 22.67% -> 28.67%     
client [78] (testset)   loss: 4.8068 -> 5.0982  accuracy: 19.31% -> 23.45%     
---------------------------- TRAINING EPOCH: 340 ----------------------------  
client [92] (testset)   loss: 4.6213 -> 4.7821  accuracy: 30.28% -> 24.65%     
client [80] (testset)   loss: 4.9724 -> 5.3246  accuracy: 25.32% -> 31.01%     
client [63] (testset)   loss: 4.5822 -> 5.1225  accuracy: 28.93% -> 26.45%     
client [76] (testset)   loss: 5.7548 -> 6.1270  accuracy: 19.01% -> 17.36%     
client [78] (testset)   loss: 4.8969 -> 5.2563  accuracy: 19.31% -> 21.38%     
client [25] (testset)   loss: 4.7412 -> 5.7420  accuracy: 21.09% -> 19.53%     
client [58] (testset)   loss: 4.1374 -> 4.5029  accuracy: 29.75% -> 31.40%     
client [13] (testset)   loss: 4.7122 -> 5.1083  accuracy: 32.65% -> 30.61%     
client [17] (testset)   loss: 4.5777 -> 4.8809  accuracy: 25.33% -> 26.67%     
client [38] (testset)   loss: 4.6988 -> 4.6769  accuracy: 25.00% -> 30.00%     
---------------------------- TRAINING EPOCH: 350 ----------------------------  
client [72] (testset)   loss: 4.9826 -> 5.2270  accuracy: 27.19% -> 24.56%     
client [82] (testset)   loss: 4.8765 -> 5.0023  accuracy: 24.26% -> 28.40%     
client [86] (testset)   loss: 4.7094 -> 4.8510  accuracy: 26.06% -> 27.46%     
client [51] (testset)   loss: 4.5168 -> 5.0771  accuracy: 30.99% -> 29.58%     
client [96] (testset)   loss: 4.8970 -> 5.6381  accuracy: 32.79% -> 29.51%     
client [42] (testset)   loss: 4.7766 -> 5.0238  accuracy: 21.02% -> 26.75%     
client [55] (testset)   loss: 4.8733 -> 5.0672  accuracy: 26.06% -> 24.65%     
client [13] (testset)   loss: 4.7725 -> 5.0837  accuracy: 33.33% -> 30.61%     
client [1]  (testset)   loss: 5.1128 -> 5.8731  accuracy: 24.82% -> 19.15%     
client [12] (testset)   loss: 4.8458 -> 4.9691  accuracy: 22.15% -> 24.83%     
---------------------------- TRAINING EPOCH: 360 ----------------------------  
client [68] (testset)   loss: 4.8041 -> 5.3052  accuracy: 25.90% -> 25.30%     
client [23] (testset)   loss: 5.3195 -> 6.0226  accuracy: 23.53% -> 25.88%     
client [46] (testset)   loss: 4.6185 -> 4.9245  accuracy: 23.60% -> 31.06%     
client [41] (testset)   loss: 5.0439 -> 5.2603  accuracy: 21.58% -> 17.99%     
client [25] (testset)   loss: 4.7988 -> 6.2046  accuracy: 21.09% -> 21.88%     
client [58] (testset)   loss: 4.1990 -> 4.4525  accuracy: 27.27% -> 35.54%     
client [14] (testset)   loss: 4.4355 -> 4.8219  accuracy: 26.36% -> 26.36%     
client [33] (testset)   loss: 4.5724 -> 5.0642  accuracy: 23.72% -> 25.00%     
client [85] (testset)   loss: 5.5165 -> 6.3884  accuracy: 26.79% -> 22.62%     
client [62] (testset)   loss: 4.7338 -> 5.1627  accuracy: 28.00% -> 27.20%     
---------------------------- TRAINING EPOCH: 370 ----------------------------  
client [98] (testset)   loss: 4.6534 -> 4.8257  accuracy: 26.00% -> 27.33%     
client [63] (testset)   loss: 4.9024 -> 5.5329  accuracy: 24.79% -> 23.97%     
client [70] (testset)   loss: 4.8833 -> 4.8686  accuracy: 30.14% -> 32.88%     
client [65] (testset)   loss: 5.8208 -> 6.3112  accuracy: 17.33% -> 15.33%     
client [14] (testset)   loss: 4.5184 -> 4.5701  accuracy: 31.78% -> 31.78%     
client [73] (testset)   loss: 5.0683 -> 5.2493  accuracy: 23.17% -> 28.05%     
client [34] (testset)   loss: 4.8128 -> 5.0343  accuracy: 30.38% -> 29.11%     
client [99] (testset)   loss: 4.4086 -> 4.8976  accuracy: 30.77% -> 28.02%     
client [69] (testset)   loss: 4.7301 -> 4.8582  accuracy: 25.47% -> 29.81%     
client [46] (testset)   loss: 5.0153 -> 5.1759  accuracy: 22.36% -> 28.57%     
---------------------------- TRAINING EPOCH: 380 ----------------------------  
client [99] (testset)   loss: 4.5631 -> 5.1989  accuracy: 28.57% -> 26.37%     
client [93] (testset)   loss: 4.7748 -> 5.6643  accuracy: 29.50% -> 28.78%     
client [11] (testset)   loss: 4.6703 -> 5.1002  accuracy: 29.71% -> 31.16%     
client [58] (testset)   loss: 4.2461 -> 4.4563  accuracy: 28.93% -> 36.36%     
client [81] (testset)   loss: 4.8701 -> 5.4518  accuracy: 20.69% -> 22.76%     
client [85] (testset)   loss: 5.8915 -> 6.6127  accuracy: 23.21% -> 23.21%     
client [89] (testset)   loss: 4.4256 -> 4.5635  accuracy: 29.45% -> 28.08%     
client [45] (testset)   loss: 4.8101 -> 5.0180  accuracy: 29.14% -> 27.43%     
client [8]  (testset)   loss: 4.5163 -> 5.1811  accuracy: 32.61% -> 27.54%     
client [68] (testset)   loss: 4.9980 -> 5.3162  accuracy: 24.70% -> 26.51%     
---------------------------- TRAINING EPOCH: 390 ----------------------------  
client [67] (testset)   loss: 4.6707 -> 5.4613  accuracy: 30.92% -> 26.97%     
client [72] (testset)   loss: 5.2681 -> 5.3864  accuracy: 25.44% -> 26.32%     
client [1]  (testset)   loss: 5.4251 -> 5.9100  accuracy: 22.70% -> 21.99%     
client [78] (testset)   loss: 5.2462 -> 5.2095  accuracy: 18.62% -> 23.45%     
client [83] (testset)   loss: 5.3335 -> 5.3930  accuracy: 26.11% -> 27.39%     
client [21] (testset)   loss: 4.8688 -> 5.2957  accuracy: 26.03% -> 26.03%     
client [56] (testset)   loss: 4.8935 -> 4.7106  accuracy: 23.53% -> 32.35%     
client [44] (testset)   loss: 4.8485 -> 5.6185  accuracy: 29.29% -> 26.43%     
client [92] (testset)   loss: 4.6710 -> 4.8355  accuracy: 27.46% -> 29.58%     
client [27] (testset)   loss: 5.3069 -> 5.3338  accuracy: 26.90% -> 28.97%     
---------------------------- TRAINING EPOCH: 400 ----------------------------  
client [10] (testset)   loss: 5.0223 -> 5.2122  accuracy: 26.97% -> 26.32%     
client [39] (testset)   loss: 4.9152 -> 5.5172  accuracy: 25.32% -> 25.32%     
client [65] (testset)   loss: 6.0079 -> 6.3946  accuracy: 17.33% -> 16.00%     
client [26] (testset)   loss: 4.9005 -> 5.3946  accuracy: 27.78% -> 33.33%     
client [19] (testset)   loss: 4.7862 -> 5.2165  accuracy: 28.49% -> 28.49%     
client [68] (testset)   loss: 5.1947 -> 5.4870  accuracy: 27.11% -> 24.10%     
client [41] (testset)   loss: 5.3687 -> 6.2968  accuracy: 21.58% -> 19.42%     
client [50] (testset)   loss: 4.4057 -> 4.7811  accuracy: 30.33% -> 35.25%     
client [75] (testset)   loss: 4.6134 -> 4.7264  accuracy: 28.66% -> 27.44%     
client [81] (testset)   loss: 4.9232 -> 5.3597  accuracy: 25.52% -> 22.76%     
Training... ---------------------------------------- 100% 0:11:36
FedAvg's average time taken by each global epoch: 0 min 1.73 sec.              
FedAvg's total running time: 0 h 11 m 36 s.                                    
==================== FedAvg Experiment Results: ====================           
Display format: (before local fine-tuning) -> (after local fine-tuning)        
 So if finetune_epoch = 0, x.xx% -> 0.00% is normal.                           
 Centralized testing ONLY happens after model aggregation, so the stats between
'->' are the same.                                                             
{                                                                              
    "100": {                                                                   
        "all_clients": {                                                       
            "test": {                                                          
                "loss": "3.7571 -> 0.0000",                                    
                "accuracy": "24.79% -> 0.00%"                                  
            }                                                                  
        }                                                                      
    },                                                                         
    "200": {                                                                   
        "all_clients": {                                                       
            "test": {                                                          
                "loss": "4.1294 -> 0.0000",                                    
                "accuracy": "25.78% -> 0.00%"                                  
            }                                                                  
        }                                                                      
    },                                                                         
    "300": {                                                                   
        "all_clients": {                                                       
            "test": {                                                          
                "loss": "4.5115 -> 0.0000",                                    
                "accuracy": "26.12% -> 0.00%"                                  
            }                                                                  
        }                                                                      
    },                                                                         
    "400": {                                                                   
        "all_clients": {                                                       
            "test": {                                                          
                "loss": "5.1624 -> 0.0000",                                    
                "accuracy": "26.43% -> 0.00%"                                  
            }                                                                  
        }                                                                      
    }                                                                          
}                                                                              
==================== FedAvg Max Accuracy ====================                  
all_clients:                                                                   
(test) before fine-tuning: 26.43% at epoch 400                                 
(test) after fine-tuning: 0.00% at epoch 100                                   
[0m