==================== FedALA ====================                               
Experiment Arguments:                                                          
{
│   'method': 'fedala',
│   'dataset': {
│   │   'name': 'medmnistA',
│   │   'client_num': 100,
│   │   'test_ratio': 0.25,
│   │   'val_ratio': 0.0,
│   │   'seed': 42,
│   │   'split': 'sample',
│   │   'IID_ratio': 0.0,
│   │   'monitor_window_name_suffix': 'medmnistA-100clients-0%IID-Dir(1.0)-seed42',
│   │   'alpha': 1.0,
│   │   'min_samples_per_client': 10
│   },
│   'model': {
│   │   'name': 'lenet5',
│   │   'use_torchvision_pretrained_weights': True,
│   │   'external_model_weights_path': None
│   },
│   'optimizer': {
│   │   'lr': 0.01,
│   │   'dampening': 0,
│   │   'weight_decay': 0,
│   │   'momentum': 0,
│   │   'nesterov': False,
│   │   'name': 'sgd'
│   },
│   'mode': 'serial',
│   'parallel': {
│   │   'ray_cluster_addr': None,
│   │   'num_cpus': None,
│   │   'num_gpus': None,
│   │   'num_workers': 2
│   },
│   'common': {
│   │   'seed': 42,
│   │   'join_ratio': 0.1,
│   │   'global_epoch': 400,
│   │   'local_epoch': 5,
│   │   'batch_size': 32,
│   │   'reset_optimizer_on_global_epoch': True,
│   │   'straggler_ratio': 0,
│   │   'straggler_min_local_epoch': 0,
│   │   'buffers': 'global',
│   │   'client_side_evaluation': True,
│   │   'test': {
│   │   │   'client': {
│   │   │   │   'interval': 100,
│   │   │   │   'finetune_epoch': 0,
│   │   │   │   'train': False,
│   │   │   │   'val': False,
│   │   │   │   'test': True
│   │   │   },
│   │   │   'server': {
│   │   │   │   'interval': -1,
│   │   │   │   'train': False,
│   │   │   │   'val': False,
│   │   │   │   'test': False,
│   │   │   │   'model_in_train_mode': False
│   │   │   }
│   │   },
│   │   'verbose_gap': 10,
│   │   'monitor': None,
│   │   'use_cuda': True,
│   │   'save_log': True,
│   │   'save_model': False,
│   │   'save_learning_curve_plot': False,
│   │   'save_metrics': True,
│   │   'delete_useless_run': True
│   },
│   'fedala': {
│   │   'layer_idx': 2,
│   │   'num_pre_loss': 10,
│   │   'eta': 1.0,
│   │   'threshold': 0.1,
│   │   'rand_percent': 0.8
│   }
}
---------------------------- TRAINING EPOCH: 10 ----------------------------   
client [77] (testset)   loss: 2.3124 -> 2.0713  accuracy: 19.61% -> 24.84%     
client [81] (testset)   loss: 2.6377 -> 2.3215  accuracy: 5.21% -> 20.83%      
client [21] (testset)   loss: 2.3770 -> 2.0110  accuracy: 4.52% -> 27.10%      
client [68] (testset)   loss: 2.3970 -> 2.0642  accuracy: 16.80% -> 23.20%     
client [93] (testset)   loss: 1.8295 -> 1.1984  accuracy: 69.57% -> 69.57%     
client [31] (testset)   loss: 2.6561 -> 2.2243  accuracy: 4.12% -> 15.46%      
client [20] (testset)   loss: 2.1777 -> 1.9987  accuracy: 19.18% -> 32.42%     
client [59] (testset)   loss: 2.5165 -> 2.0606  accuracy: 6.80% -> 24.49%      
client [48] (testset)   loss: 2.2543 -> 2.1502  accuracy: 7.76% -> 21.98%      
client [34] (testset)   loss: 2.1173 -> 2.0070  accuracy: 32.74% -> 32.74%     
---------------------------- TRAINING EPOCH: 20 ----------------------------   
client [69] (testset)   loss: 2.4878 -> 1.9097  accuracy: 0.64% -> 30.13%      
client [99] (testset)   loss: 2.2097 -> 1.9734  accuracy: 12.30% -> 32.79%     
client [67] (testset)   loss: 2.3676 -> 2.0512  accuracy: 7.34% -> 19.27%      
client [0]  (testset)   loss: 2.3567 -> 2.1165  accuracy: 12.04% -> 18.85%     
client [76] (testset)   loss: 2.3588 -> 2.1750  accuracy: 10.53% -> 20.39%     
client [41] (testset)   loss: 3.0072 -> 1.9335  accuracy: 4.42% -> 44.25%      
client [62] (testset)   loss: 2.3477 -> 2.0507  accuracy: 7.06% -> 33.83%      
client [2]  (testset)   loss: 2.3955 -> 2.0025  accuracy: 11.98% -> 33.85%     
client [14] (testset)   loss: 2.1365 -> 1.9939  accuracy: 35.56% -> 13.33%     
client [46] (testset)   loss: 2.1724 -> 1.9682  accuracy: 30.39% -> 30.39%     
---------------------------- TRAINING EPOCH: 30 ----------------------------   
client [24] (testset)   loss: 2.0035 -> 1.8241  accuracy: 19.63% -> 19.63%     
client [68] (testset)   loss: 2.3277 -> 2.0877  accuracy: 16.80% -> 16.80%     
client [57] (testset)   loss: 2.4899 -> 2.2480  accuracy: 11.11% -> 19.75%     
client [17] (testset)   loss: 2.4618 -> 2.1212  accuracy: 9.23% -> 12.31%      
client [54] (testset)   loss: 2.3633 -> 2.0315  accuracy: 10.43% -> 20.00%     
client [23] (testset)   loss: 2.2933 -> 2.0397  accuracy: 24.23% -> 24.23%     
client [35] (testset)   loss: 2.3196 -> 2.0695  accuracy: 17.78% -> 23.33%     
client [59] (testset)   loss: 2.5553 -> 2.0586  accuracy: 7.48% -> 24.49%      
client [31] (testset)   loss: 2.3564 -> 2.2362  accuracy: 4.12% -> 11.34%      
client [9]  (testset)   loss: 2.4188 -> 2.0799  accuracy: 4.44% -> 31.11%      
---------------------------- TRAINING EPOCH: 40 ----------------------------   
client [64] (testset)   loss: 2.1422 -> 2.1422  accuracy: 11.11% -> 15.87%     
client [33] (testset)   loss: 2.2571 -> 2.1127  accuracy: 5.29% -> 28.82%      
client [16] (testset)   loss: 2.1118 -> 1.3952  accuracy: 16.54% -> 59.84%     
client [44] (testset)   loss: 2.3340 -> 2.0755  accuracy: 2.03% -> 28.38%      
client [8]  (testset)   loss: 2.4260 -> 1.8555  accuracy: 0.71% -> 46.10%      
client [31] (testset)   loss: 2.4224 -> 2.1899  accuracy: 0.00% -> 18.56%      
client [47] (testset)   loss: 2.2552 -> 1.7772  accuracy: 15.38% -> 27.97%     
client [36] (testset)   loss: 2.3027 -> 1.8151  accuracy: 3.85% -> 36.54%      
client [20] (testset)   loss: 2.2764 -> 1.9904  accuracy: 3.65% -> 19.18%      
client [56] (testset)   loss: 2.1511 -> 1.9382  accuracy: 11.80% -> 32.58%     
---------------------------- TRAINING EPOCH: 50 ----------------------------   
client [4]  (testset)   loss: 2.1948 -> 1.9086  accuracy: 14.91% -> 32.92%     
client [60] (testset)   loss: 2.0777 -> 1.9614  accuracy: 28.35% -> 28.35%     
client [28] (testset)   loss: 2.6592 -> 2.1263  accuracy: 2.65% -> 18.58%      
client [25] (testset)   loss: 2.1053 -> 1.8641  accuracy: 40.30% -> 40.30%     
client [58] (testset)   loss: 2.3080 -> 1.7326  accuracy: 1.11% -> 32.22%      
client [44] (testset)   loss: 2.2619 -> 2.0903  accuracy: 28.38% -> 28.38%     
client [39] (testset)   loss: 2.2836 -> 1.9981  accuracy: 10.65% -> 20.12%     
client [29] (testset)   loss: 2.6080 -> 2.3008  accuracy: 9.62% -> 24.04%      
client [3]  (testset)   loss: 2.2477 -> 1.4220  accuracy: 7.59% -> 62.66%      
client [84] (testset)   loss: 2.3427 -> 2.1736  accuracy: 13.16% -> 21.93%     
---------------------------- TRAINING EPOCH: 60 ----------------------------   
client [21] (testset)   loss: 2.3457 -> 2.0159  accuracy: 27.10% -> 27.10%     
client [84] (testset)   loss: 2.2889 -> 2.1840  accuracy: 13.16% -> 21.93%     
client [10] (testset)   loss: 2.3317 -> 1.8910  accuracy: 2.70% -> 36.94%      
client [36] (testset)   loss: 2.4752 -> 1.8228  accuracy: 4.49% -> 36.54%      
client [65] (testset)   loss: 2.3652 -> 1.9688  accuracy: 28.26% -> 28.26%     
client [81] (testset)   loss: 2.5504 -> 2.2151  accuracy: 5.21% -> 25.00%      
client [79] (testset)   loss: 2.4164 -> 2.0982  accuracy: 1.98% -> 21.78%      
client [42] (testset)   loss: 2.3506 -> 2.0866  accuracy: 0.00% -> 20.95%      
client [11] (testset)   loss: 2.6348 -> 2.0307  accuracy: 7.96% -> 36.28%      
client [96] (testset)   loss: 2.3509 -> 2.0101  accuracy: 6.90% -> 22.41%      
---------------------------- TRAINING EPOCH: 70 ----------------------------   
client [8]  (testset)   loss: 2.3027 -> 1.8558  accuracy: 0.71% -> 46.10%      
client [53] (testset)   loss: 2.2863 -> 1.8911  accuracy: 2.78% -> 28.70%      
client [52] (testset)   loss: 2.2934 -> 1.9210  accuracy: 19.21% -> 28.38%     
client [42] (testset)   loss: 2.3360 -> 2.0893  accuracy: 8.11% -> 20.95%      
client [69] (testset)   loss: 2.2249 -> 1.9057  accuracy: 30.13% -> 30.13%     
client [59] (testset)   loss: 2.5069 -> 2.0693  accuracy: 7.48% -> 24.49%      
client [7]  (testset)   loss: 2.1751 -> 1.8816  accuracy: 41.94% -> 41.94%     
client [26] (testset)   loss: 2.0694 -> 1.4968  accuracy: 54.98% -> 54.98%     
client [49] (testset)   loss: 2.0661 -> 1.7255  accuracy: 48.28% -> 48.28%     
client [98] (testset)   loss: 2.4108 -> 2.2010  accuracy: 3.45% -> 18.39%      
---------------------------- TRAINING EPOCH: 80 ----------------------------   
client [98] (testset)   loss: 2.5777 -> 2.1847  accuracy: 3.45% -> 28.74%      
client [47] (testset)   loss: 2.5718 -> 1.8007  accuracy: 0.70% -> 27.97%      
client [21] (testset)   loss: 2.4017 -> 2.0032  accuracy: 27.10% -> 27.10%     
client [77] (testset)   loss: 2.5333 -> 2.0752  accuracy: 2.61% -> 24.84%      
client [95] (testset)   loss: 2.5758 -> 2.2006  accuracy: 1.83% -> 20.18%      
client [91] (testset)   loss: 2.6058 -> 2.2652  accuracy: 8.33% -> 13.10%      
client [14] (testset)   loss: 2.1781 -> 1.9423  accuracy: 9.63% -> 35.56%      
client [99] (testset)   loss: 2.1123 -> 2.0307  accuracy: 32.79% -> 32.79%     
client [20] (testset)   loss: 2.3206 -> 1.9958  accuracy: 8.68% -> 32.42%      
client [39] (testset)   loss: 2.4968 -> 2.0036  accuracy: 10.65% -> 20.12%     
---------------------------- TRAINING EPOCH: 90 ----------------------------   
client [52] (testset)   loss: 2.2467 -> 1.9446  accuracy: 1.31% -> 28.38%      
client [62] (testset)   loss: 2.1984 -> 2.0360  accuracy: 11.90% -> 33.83%     
client [71] (testset)   loss: 2.6941 -> 1.7369  accuracy: 0.00% -> 40.35%      
client [97] (testset)   loss: 2.3490 -> 1.9286  accuracy: 3.86% -> 21.26%      
client [30] (testset)   loss: 2.3178 -> 1.7926  accuracy: 7.14% -> 32.47%      
client [88] (testset)   loss: 2.3652 -> 1.8850  accuracy: 6.51% -> 41.42%      
client [60] (testset)   loss: 2.2220 -> 1.9274  accuracy: 28.35% -> 28.35%     
client [82] (testset)   loss: 2.2432 -> 1.8939  accuracy: 1.74% -> 38.26%      
client [91] (testset)   loss: 2.4920 -> 2.2607  accuracy: 8.33% -> 13.10%      
client [57] (testset)   loss: 2.3921 -> 2.2345  accuracy: 11.11% -> 19.75%     
---------------------------- TRAINING EPOCH: 100 ----------------------------  
client [31] (testset)   loss: 2.4412 -> 2.2106  accuracy: 4.12% -> 18.56%      
client [15] (testset)   loss: 2.2871 -> 1.9938  accuracy: 35.54% -> 35.54%     
client [71] (testset)   loss: 2.5047 -> 1.7486  accuracy: 0.00% -> 40.35%      
client [97] (testset)   loss: 2.2745 -> 1.9387  accuracy: 3.86% -> 21.26%      
client [53] (testset)   loss: 2.2615 -> 1.9624  accuracy: 6.48% -> 32.41%      
client [77] (testset)   loss: 2.4352 -> 2.0635  accuracy: 2.61% -> 19.61%      
client [76] (testset)   loss: 2.3153 -> 2.1415  accuracy: 20.39% -> 12.50%     
client [79] (testset)   loss: 2.2969 -> 2.0481  accuracy: 14.85% -> 21.78%     
client [28] (testset)   loss: 2.6267 -> 2.1483  accuracy: 2.65% -> 18.58%      
client [99] (testset)   loss: 2.1914 -> 1.9704  accuracy: 32.79% -> 32.79%     
---------------------------- TRAINING EPOCH: 110 ----------------------------  
client [97] (testset)   loss: 2.3650 -> 1.9448  accuracy: 8.21% -> 23.19%      
client [86] (testset)   loss: 2.2927 -> 2.0383  accuracy: 22.62% -> 16.67%     
client [34] (testset)   loss: 2.2401 -> 2.0093  accuracy: 15.66% -> 32.74%     
client [73] (testset)   loss: 2.1318 -> 1.8757  accuracy: 8.74% -> 27.18%      
client [5]  (testset)   loss: 2.1953 -> 1.6491  accuracy: 0.89% -> 51.79%      
client [96] (testset)   loss: 2.3953 -> 2.0245  accuracy: 6.90% -> 22.41%      
client [22] (testset)   loss: 2.3688 -> 2.0677  accuracy: 30.86% -> 30.86%     
client [60] (testset)   loss: 2.2543 -> 1.9434  accuracy: 1.03% -> 28.35%      
client [66] (testset)   loss: 2.3435 -> 2.0742  accuracy: 8.53% -> 20.16%      
client [83] (testset)   loss: 2.4626 -> 1.7793  accuracy: 0.63% -> 30.82%      
---------------------------- TRAINING EPOCH: 120 ----------------------------  
client [76] (testset)   loss: 2.4296 -> 2.1603  accuracy: 20.39% -> 20.39%     
client [65] (testset)   loss: 2.6993 -> 1.9782  accuracy: 1.45% -> 28.26%      
client [95] (testset)   loss: 2.5016 -> 2.1986  accuracy: 1.83% -> 12.84%      
client [17] (testset)   loss: 2.5459 -> 2.1873  accuracy: 9.23% -> 20.00%      
client [8]  (testset)   loss: 2.5905 -> 1.8697  accuracy: 0.71% -> 46.10%      
client [35] (testset)   loss: 2.3446 -> 2.0544  accuracy: 16.67% -> 23.33%     
client [98] (testset)   loss: 2.6678 -> 2.1532  accuracy: 3.45% -> 28.74%      
client [53] (testset)   loss: 2.1523 -> 1.8960  accuracy: 6.48% -> 32.41%      
client [43] (testset)   loss: 2.4429 -> 2.1660  accuracy: 8.33% -> 24.17%      
client [64] (testset)   loss: 2.2382 -> 2.1285  accuracy: 11.11% -> 15.87%     
---------------------------- TRAINING EPOCH: 130 ----------------------------  
client [21] (testset)   loss: 2.7168 -> 1.9858  accuracy: 11.61% -> 27.10%     
client [88] (testset)   loss: 2.0622 -> 1.8710  accuracy: 41.42% -> 41.42%     
client [38] (testset)   loss: 2.7893 -> 2.0204  accuracy: 8.67% -> 39.31%      
client [3]  (testset)   loss: 1.9913 -> 1.4692  accuracy: 62.66% -> 62.66%     
client [5]  (testset)   loss: 2.3622 -> 1.6485  accuracy: 6.70% -> 51.79%      
client [41] (testset)   loss: 3.0917 -> 1.8955  accuracy: 11.50% -> 44.25%     
client [7]  (testset)   loss: 2.4665 -> 1.8493  accuracy: 6.99% -> 41.94%      
client [37] (testset)   loss: 2.5981 -> 2.2607  accuracy: 2.44% -> 13.01%      
client [45] (testset)   loss: 2.3217 -> 1.8857  accuracy: 2.10% -> 33.57%      
client [47] (testset)   loss: 2.0959 -> 1.7533  accuracy: 27.27% -> 27.27%     
---------------------------- TRAINING EPOCH: 140 ----------------------------  
client [16] (testset)   loss: 1.7812 -> 1.4001  accuracy: 59.84% -> 59.84%     
client [11] (testset)   loss: 2.5954 -> 2.0233  accuracy: 7.96% -> 36.28%      
client [37] (testset)   loss: 2.4266 -> 2.2861  accuracy: 19.51% -> 13.01%     
client [41] (testset)   loss: 3.1366 -> 1.8782  accuracy: 0.00% -> 44.25%      
client [95] (testset)   loss: 2.4538 -> 2.1909  accuracy: 1.83% -> 12.84%      
client [53] (testset)   loss: 2.1897 -> 1.8960  accuracy: 6.48% -> 32.41%      
client [22] (testset)   loss: 2.5380 -> 2.0774  accuracy: 4.94% -> 30.86%      
client [25] (testset)   loss: 2.0188 -> 1.8117  accuracy: 40.30% -> 40.30%     
client [69] (testset)   loss: 2.1743 -> 1.9344  accuracy: 30.13% -> 25.64%     
client [46] (testset)   loss: 2.3035 -> 1.9734  accuracy: 6.86% -> 30.39%      
---------------------------- TRAINING EPOCH: 150 ----------------------------  
client [47] (testset)   loss: 2.0878 -> 1.7721  accuracy: 27.97% -> 27.97%     
client [69] (testset)   loss: 2.3888 -> 1.9244  accuracy: 14.10% -> 25.64%     
client [82] (testset)   loss: 2.2483 -> 1.8452  accuracy: 23.48% -> 38.26%     
client [45] (testset)   loss: 2.1758 -> 1.8864  accuracy: 9.09% -> 33.57%      
client [7]  (testset)   loss: 2.2711 -> 1.8745  accuracy: 7.53% -> 41.94%      
client [50] (testset)   loss: 2.5300 -> 2.1250  accuracy: 12.82% -> 23.08%     
client [35] (testset)   loss: 2.2610 -> 2.0369  accuracy: 16.67% -> 23.33%     
client [24] (testset)   loss: 2.4190 -> 1.7642  accuracy: 7.98% -> 39.88%      
client [15] (testset)   loss: 2.2560 -> 1.9910  accuracy: 19.88% -> 19.88%     
client [58] (testset)   loss: 2.4832 -> 1.7365  accuracy: 4.44% -> 31.11%      
---------------------------- TRAINING EPOCH: 160 ----------------------------  
client [48] (testset)   loss: 2.3333 -> 2.1528  accuracy: 16.38% -> 16.38%     
client [76] (testset)   loss: 2.2149 -> 2.1804  accuracy: 20.39% -> 20.39%     
client [67] (testset)   loss: 2.2366 -> 2.0074  accuracy: 19.27% -> 19.27%     
client [37] (testset)   loss: 2.4518 -> 2.2753  accuracy: 10.57% -> 13.01%     
client [58] (testset)   loss: 2.6453 -> 1.7342  accuracy: 9.44% -> 32.22%      
client [64] (testset)   loss: 2.2957 -> 2.1230  accuracy: 22.22% -> 15.87%     
client [77] (testset)   loss: 2.3569 -> 2.0633  accuracy: 24.84% -> 24.84%     
client [55] (testset)   loss: 2.4395 -> 2.1020  accuracy: 1.27% -> 11.39%      
client [12] (testset)   loss: 2.3033 -> 2.2185  accuracy: 12.73% -> 27.27%     
client [89] (testset)   loss: 2.4190 -> 2.0386  accuracy: 4.32% -> 21.60%      
---------------------------- TRAINING EPOCH: 170 ----------------------------  
client [84] (testset)   loss: 2.4373 -> 2.1892  accuracy: 5.26% -> 21.93%      
client [51] (testset)   loss: 2.3944 -> 2.0144  accuracy: 7.62% -> 36.19%      
client [8]  (testset)   loss: 2.5186 -> 1.8484  accuracy: 9.22% -> 46.10%      
client [18] (testset)   loss: 2.0025 -> 1.6000  accuracy: 32.46% -> 32.46%     
client [94] (testset)   loss: 2.1408 -> 1.8892  accuracy: 38.84% -> 38.84%     
client [81] (testset)   loss: 2.7034 -> 2.2209  accuracy: 3.12% -> 25.00%      
client [3]  (testset)   loss: 2.2767 -> 1.4581  accuracy: 2.53% -> 62.66%      
client [11] (testset)   loss: 2.6808 -> 2.0183  accuracy: 6.19% -> 36.28%      
client [95] (testset)   loss: 2.4146 -> 2.1942  accuracy: 12.84% -> 12.84%     
client [67] (testset)   loss: 2.3879 -> 2.0684  accuracy: 17.43% -> 20.18%     
---------------------------- TRAINING EPOCH: 180 ----------------------------  
client [21] (testset)   loss: 2.5437 -> 1.9832  accuracy: 13.55% -> 27.10%     
client [79] (testset)   loss: 2.3627 -> 2.0559  accuracy: 0.00% -> 14.85%      
client [58] (testset)   loss: 2.1656 -> 1.7368  accuracy: 6.11% -> 31.11%      
client [88] (testset)   loss: 2.1990 -> 1.8944  accuracy: 5.92% -> 41.42%      
client [46] (testset)   loss: 2.2399 -> 1.9723  accuracy: 7.84% -> 30.39%      
client [11] (testset)   loss: 2.4885 -> 2.0215  accuracy: 2.65% -> 36.28%      
client [55] (testset)   loss: 2.7597 -> 2.1396  accuracy: 1.27% -> 13.92%      
client [13] (testset)   loss: 2.5131 -> 2.1812  accuracy: 6.43% -> 19.30%      
client [31] (testset)   loss: 2.4342 -> 2.2196  accuracy: 7.22% -> 18.56%      
client [75] (testset)   loss: 2.4921 -> 1.8570  accuracy: 4.76% -> 22.62%      
---------------------------- TRAINING EPOCH: 190 ----------------------------  
client [19] (testset)   loss: 2.5843 -> 2.0643  accuracy: 11.80% -> 34.16%     
client [7]  (testset)   loss: 2.1522 -> 1.8359  accuracy: 41.94% -> 41.94%     
client [57] (testset)   loss: 2.4445 -> 2.2221  accuracy: 11.11% -> 19.75%     
client [13] (testset)   loss: 2.5850 -> 2.1253  accuracy: 18.71% -> 19.88%     
client [43] (testset)   loss: 2.4018 -> 2.1471  accuracy: 8.33% -> 24.17%      
client [91] (testset)   loss: 2.5948 -> 2.2695  accuracy: 8.33% -> 13.10%      
client [10] (testset)   loss: 2.3808 -> 1.7885  accuracy: 2.70% -> 36.94%      
client [64] (testset)   loss: 2.2135 -> 2.1222  accuracy: 7.94% -> 15.87%      
client [82] (testset)   loss: 2.1913 -> 1.8307  accuracy: 1.74% -> 38.26%      
client [22] (testset)   loss: 2.5354 -> 2.0768  accuracy: 4.94% -> 30.86%      
---------------------------- TRAINING EPOCH: 200 ----------------------------  
client [20] (testset)   loss: 2.4012 -> 1.9874  accuracy: 19.18% -> 32.42%     
client [23] (testset)   loss: 2.2240 -> 2.0431  accuracy: 24.23% -> 24.23%     
client [88] (testset)   loss: 2.2787 -> 1.9127  accuracy: 6.51% -> 41.42%      
client [98] (testset)   loss: 2.4364 -> 2.1627  accuracy: 3.45% -> 18.39%      
client [79] (testset)   loss: 2.2690 -> 2.0515  accuracy: 1.98% -> 21.78%      
client [21] (testset)   loss: 2.4076 -> 1.9978  accuracy: 27.10% -> 27.10%     
client [92] (testset)   loss: 2.5817 -> 2.1161  accuracy: 2.48% -> 19.83%      
client [56] (testset)   loss: 2.1864 -> 1.9340  accuracy: 21.35% -> 32.58%     
client [5]  (testset)   loss: 2.0867 -> 1.7601  accuracy: 51.79% -> 51.79%     
client [52] (testset)   loss: 2.2901 -> 1.9273  accuracy: 1.31% -> 19.21%      
---------------------------- TRAINING EPOCH: 210 ----------------------------  
client [67] (testset)   loss: 2.3530 -> 2.0188  accuracy: 7.34% -> 19.27%      
client [54] (testset)   loss: 2.5726 -> 2.0373  accuracy: 6.96% -> 20.00%      
client [14] (testset)   loss: 2.1880 -> 2.0598  accuracy: 35.56% -> 14.07%     
client [99] (testset)   loss: 2.1883 -> 1.9947  accuracy: 12.30% -> 32.79%     
client [36] (testset)   loss: 2.4150 -> 1.8442  accuracy: 4.49% -> 36.54%      
client [30] (testset)   loss: 2.3667 -> 1.8179  accuracy: 32.47% -> 32.47%     
client [38] (testset)   loss: 2.5958 -> 1.9678  accuracy: 4.05% -> 39.31%      
client [15] (testset)   loss: 2.2890 -> 2.0049  accuracy: 6.02% -> 35.54%      
client [6]  (testset)   loss: 2.1557 -> 2.0661  accuracy: 24.72% -> 24.72%     
client [53] (testset)   loss: 2.4263 -> 1.9766  accuracy: 2.78% -> 32.41%      
---------------------------- TRAINING EPOCH: 220 ----------------------------  
client [99] (testset)   loss: 2.2210 -> 1.9706  accuracy: 32.79% -> 32.79%     
client [6]  (testset)   loss: 2.3327 -> 2.0802  accuracy: 24.72% -> 24.72%     
client [83] (testset)   loss: 2.2321 -> 1.8115  accuracy: 2.52% -> 30.82%      
client [42] (testset)   loss: 2.2467 -> 2.0869  accuracy: 20.95% -> 20.95%     
client [34] (testset)   loss: 2.3607 -> 1.9895  accuracy: 32.74% -> 32.74%     
client [15] (testset)   loss: 2.1771 -> 1.9702  accuracy: 35.54% -> 35.54%     
client [47] (testset)   loss: 2.4994 -> 1.7583  accuracy: 0.70% -> 27.27%      
client [55] (testset)   loss: 2.6558 -> 2.0847  accuracy: 13.92% -> 17.72%     
client [51] (testset)   loss: 2.6334 -> 2.0394  accuracy: 8.57% -> 36.19%      
client [95] (testset)   loss: 2.4424 -> 2.1956  accuracy: 1.83% -> 12.84%      
---------------------------- TRAINING EPOCH: 230 ----------------------------  
client [71] (testset)   loss: 2.7275 -> 1.7484  accuracy: 0.00% -> 40.35%      
client [15] (testset)   loss: 2.1660 -> 1.9890  accuracy: 35.54% -> 35.54%     
client [33] (testset)   loss: 2.3673 -> 2.1149  accuracy: 5.29% -> 28.82%      
client [99] (testset)   loss: 2.2824 -> 2.0001  accuracy: 32.79% -> 32.79%     
client [90] (testset)   loss: 2.6235 -> 1.7878  accuracy: 0.00% -> 30.90%      
client [57] (testset)   loss: 2.4712 -> 2.2230  accuracy: 11.11% -> 19.75%     
client [27] (testset)   loss: 2.4902 -> 1.9721  accuracy: 12.78% -> 30.83%     
client [78] (testset)   loss: 2.3344 -> 2.0706  accuracy: 8.20% -> 26.23%      
client [36] (testset)   loss: 2.3383 -> 1.8313  accuracy: 3.21% -> 36.54%      
client [88] (testset)   loss: 2.2605 -> 1.8686  accuracy: 6.51% -> 41.42%      
---------------------------- TRAINING EPOCH: 240 ----------------------------  
client [70] (testset)   loss: 2.4702 -> 1.7801  accuracy: 0.00% -> 30.17%      
client [35] (testset)   loss: 2.4261 -> 2.0698  accuracy: 7.78% -> 15.00%      
client [16] (testset)   loss: 2.1490 -> 1.4231  accuracy: 59.84% -> 59.84%     
client [80] (testset)   loss: 2.3338 -> 1.9912  accuracy: 7.14% -> 35.71%      
client [38] (testset)   loss: 2.4844 -> 1.9224  accuracy: 9.83% -> 39.31%      
client [78] (testset)   loss: 2.3240 -> 2.0788  accuracy: 17.21% -> 26.23%     
client [68] (testset)   loss: 2.3184 -> 2.0792  accuracy: 20.00% -> 23.20%     
client [11] (testset)   loss: 2.3016 -> 2.0128  accuracy: 36.28% -> 36.28%     
client [64] (testset)   loss: 2.3129 -> 2.1228  accuracy: 12.70% -> 15.87%     
client [82] (testset)   loss: 2.3136 -> 1.8595  accuracy: 16.52% -> 38.26%     
---------------------------- TRAINING EPOCH: 250 ----------------------------  
client [30] (testset)   loss: 2.5260 -> 1.8143  accuracy: 1.30% -> 32.47%      
client [27] (testset)   loss: 2.4666 -> 1.9626  accuracy: 1.50% -> 30.83%      
client [74] (testset)   loss: 2.4374 -> 2.1490  accuracy: 1.05% -> 27.37%      
client [45] (testset)   loss: 2.2081 -> 1.8723  accuracy: 1.40% -> 33.57%      
client [6]  (testset)   loss: 2.2351 -> 2.0741  accuracy: 1.69% -> 24.72%      
client [36] (testset)   loss: 2.2122 -> 1.8343  accuracy: 3.21% -> 36.54%      
client [63] (testset)   loss: 2.2350 -> 2.0450  accuracy: 14.84% -> 14.84%     
client [76] (testset)   loss: 2.3647 -> 2.1383  accuracy: 11.84% -> 20.39%     
client [83] (testset)   loss: 2.3470 -> 1.7766  accuracy: 0.63% -> 30.82%      
client [86] (testset)   loss: 2.3588 -> 2.0032  accuracy: 3.57% -> 22.62%      
---------------------------- TRAINING EPOCH: 260 ----------------------------  
client [83] (testset)   loss: 2.3210 -> 1.7761  accuracy: 22.01% -> 30.82%     
client [99] (testset)   loss: 2.3263 -> 1.9742  accuracy: 1.64% -> 32.79%      
client [74] (testset)   loss: 2.4458 -> 2.1424  accuracy: 15.79% -> 27.37%     
client [73] (testset)   loss: 2.2040 -> 1.8364  accuracy: 26.21% -> 27.18%     
client [29] (testset)   loss: 2.5634 -> 2.3030  accuracy: 9.62% -> 24.04%      
client [92] (testset)   loss: 2.5985 -> 2.1058  accuracy: 6.61% -> 19.83%      
client [6]  (testset)   loss: 2.2549 -> 2.0676  accuracy: 7.30% -> 24.72%      
client [61] (testset)   loss: 2.3314 -> 2.0452  accuracy: 18.25% -> 15.08%     
client [21] (testset)   loss: 2.5973 -> 1.9943  accuracy: 27.10% -> 27.10%     
client [67] (testset)   loss: 2.4350 -> 2.0545  accuracy: 20.18% -> 20.18%     
---------------------------- TRAINING EPOCH: 270 ----------------------------  
client [83] (testset)   loss: 2.2219 -> 1.7745  accuracy: 2.52% -> 30.82%      
client [32] (testset)   loss: 2.1155 -> 1.9639  accuracy: 20.48% -> 26.51%     
client [95] (testset)   loss: 2.4523 -> 2.2397  accuracy: 1.83% -> 12.84%      
client [61] (testset)   loss: 2.2235 -> 2.0075  accuracy: 15.08% -> 15.08%     
client [27] (testset)   loss: 2.7043 -> 1.9705  accuracy: 0.00% -> 30.83%      
client [25] (testset)   loss: 2.0767 -> 1.8545  accuracy: 40.30% -> 40.30%     
client [68] (testset)   loss: 2.2042 -> 2.0772  accuracy: 16.80% -> 20.00%     
client [34] (testset)   loss: 2.3494 -> 1.9982  accuracy: 32.74% -> 32.74%     
client [71] (testset)   loss: 2.8154 -> 1.7685  accuracy: 0.00% -> 40.35%      
client [89] (testset)   loss: 2.2580 -> 2.0437  accuracy: 21.60% -> 21.60%     
---------------------------- TRAINING EPOCH: 280 ----------------------------  
client [78] (testset)   loss: 2.3133 -> 2.0581  accuracy: 8.20% -> 26.23%      
client [81] (testset)   loss: 2.5525 -> 2.1971  accuracy: 4.17% -> 25.00%      
client [51] (testset)   loss: 2.3655 -> 2.0115  accuracy: 8.57% -> 36.19%      
client [54] (testset)   loss: 2.3745 -> 2.0488  accuracy: 10.43% -> 20.00%     
client [65] (testset)   loss: 2.5811 -> 1.9679  accuracy: 1.45% -> 28.26%      
client [41] (testset)   loss: 3.0076 -> 1.9002  accuracy: 0.00% -> 44.25%      
client [11] (testset)   loss: 2.4399 -> 2.0501  accuracy: 7.96% -> 36.28%      
client [85] (testset)   loss: 2.3930 -> 2.1377  accuracy: 27.76% -> 27.76%     
client [12] (testset)   loss: 2.2564 -> 2.2505  accuracy: 12.73% -> 27.27%     
client [23] (testset)   loss: 2.1910 -> 2.0619  accuracy: 24.23% -> 24.23%     
---------------------------- TRAINING EPOCH: 290 ----------------------------  
client [16] (testset)   loss: 1.9473 -> 1.4032  accuracy: 16.54% -> 59.84%     
client [65] (testset)   loss: 2.4088 -> 1.9691  accuracy: 1.45% -> 28.26%      
client [53] (testset)   loss: 2.3750 -> 2.0716  accuracy: 6.48% -> 9.26%       
client [58] (testset)   loss: 2.1493 -> 1.7274  accuracy: 1.11% -> 31.11%      
client [72] (testset)   loss: 2.4715 -> 2.0876  accuracy: 5.33% -> 26.63%      
client [7]  (testset)   loss: 2.0934 -> 1.8652  accuracy: 41.94% -> 41.94%     
client [71] (testset)   loss: 2.5942 -> 1.7689  accuracy: 0.00% -> 40.35%      
client [59] (testset)   loss: 2.5966 -> 2.0589  accuracy: 7.48% -> 24.49%      
client [86] (testset)   loss: 2.3576 -> 2.0227  accuracy: 7.14% -> 16.67%      
client [39] (testset)   loss: 2.4988 -> 1.9842  accuracy: 10.65% -> 19.53%     
---------------------------- TRAINING EPOCH: 300 ----------------------------  
client [99] (testset)   loss: 2.2613 -> 1.9728  accuracy: 32.79% -> 32.79%     
client [7]  (testset)   loss: 2.1144 -> 1.8761  accuracy: 41.94% -> 41.94%     
client [17] (testset)   loss: 2.4762 -> 2.1943  accuracy: 9.23% -> 20.00%      
client [64] (testset)   loss: 2.3105 -> 2.1173  accuracy: 11.11% -> 15.87%     
client [37] (testset)   loss: 2.4971 -> 2.2759  accuracy: 19.51% -> 10.57%     
client [29] (testset)   loss: 2.5076 -> 2.2964  accuracy: 9.62% -> 24.04%      
client [93] (testset)   loss: 1.9013 -> 1.2143  accuracy: 69.57% -> 69.57%     
client [73] (testset)   loss: 2.3006 -> 1.8616  accuracy: 26.21% -> 27.18%     
client [40] (testset)   loss: 2.2392 -> 1.8908  accuracy: 23.21% -> 31.25%     
client [76] (testset)   loss: 2.2808 -> 2.1485  accuracy: 20.39% -> 20.39%     
---------------------------- TRAINING EPOCH: 310 ----------------------------  
client [31] (testset)   loss: 2.4034 -> 2.2171  accuracy: 4.12% -> 12.37%      
client [89] (testset)   loss: 2.2902 -> 2.0516  accuracy: 21.60% -> 23.46%     
client [77] (testset)   loss: 2.4970 -> 2.0739  accuracy: 2.61% -> 19.61%      
client [90] (testset)   loss: 2.5861 -> 1.8094  accuracy: 0.00% -> 30.90%      
client [26] (testset)   loss: 2.0296 -> 1.4793  accuracy: 54.98% -> 54.98%     
client [50] (testset)   loss: 2.5156 -> 2.1578  accuracy: 14.53% -> 17.09%     
client [30] (testset)   loss: 2.5352 -> 1.7917  accuracy: 7.14% -> 32.47%      
client [70] (testset)   loss: 2.2956 -> 1.7750  accuracy: 30.17% -> 30.17%     
client [41] (testset)   loss: 2.8750 -> 1.8896  accuracy: 0.00% -> 44.25%      
client [99] (testset)   loss: 2.2118 -> 1.9825  accuracy: 32.79% -> 32.79%     
---------------------------- TRAINING EPOCH: 320 ----------------------------  
client [68] (testset)   loss: 2.3930 -> 2.1083  accuracy: 0.80% -> 20.00%      
client [70] (testset)   loss: 2.2820 -> 1.7865  accuracy: 30.17% -> 30.17%     
client [52] (testset)   loss: 2.3439 -> 1.9060  accuracy: 1.31% -> 28.38%      
client [1]  (testset)   loss: 2.2348 -> 2.0205  accuracy: 23.66% -> 16.13%     
client [2]  (testset)   loss: 2.1931 -> 1.9865  accuracy: 8.33% -> 33.85%      
client [67] (testset)   loss: 2.4095 -> 2.0136  accuracy: 11.01% -> 16.51%     
client [92] (testset)   loss: 2.5587 -> 2.1301  accuracy: 2.48% -> 19.83%      
client [35] (testset)   loss: 2.3669 -> 2.0490  accuracy: 7.78% -> 23.33%      
client [36] (testset)   loss: 2.2127 -> 1.8486  accuracy: 3.21% -> 36.54%      
client [64] (testset)   loss: 2.1905 -> 2.1241  accuracy: 9.52% -> 15.87%      
---------------------------- TRAINING EPOCH: 330 ----------------------------  
client [44] (testset)   loss: 2.2294 -> 2.0708  accuracy: 21.62% -> 28.38%     
client [6]  (testset)   loss: 2.2767 -> 2.0908  accuracy: 7.30% -> 24.72%      
client [12] (testset)   loss: 2.2071 -> 2.2159  accuracy: 12.73% -> 27.27%     
client [55] (testset)   loss: 2.6059 -> 2.1411  accuracy: 17.72% -> 17.72%     
client [29] (testset)   loss: 2.4995 -> 2.3310  accuracy: 24.04% -> 24.04%     
client [9]  (testset)   loss: 2.3423 -> 2.1036  accuracy: 16.30% -> 31.11%     
client [43] (testset)   loss: 2.2971 -> 2.1615  accuracy: 24.17% -> 24.17%     
client [77] (testset)   loss: 2.5501 -> 2.0784  accuracy: 4.58% -> 24.84%      
client [98] (testset)   loss: 2.5158 -> 2.1240  accuracy: 4.60% -> 28.74%      
client [78] (testset)   loss: 2.2966 -> 2.0885  accuracy: 1.64% -> 26.23%      
---------------------------- TRAINING EPOCH: 340 ----------------------------  
client [92] (testset)   loss: 2.7178 -> 2.1144  accuracy: 6.61% -> 19.83%      
client [80] (testset)   loss: 2.3948 -> 2.0011  accuracy: 7.14% -> 35.71%      
client [63] (testset)   loss: 2.2791 -> 2.0507  accuracy: 16.41% -> 14.84%     
client [76] (testset)   loss: 2.3551 -> 2.1593  accuracy: 20.39% -> 20.39%     
client [78] (testset)   loss: 2.3626 -> 2.0859  accuracy: 8.20% -> 17.21%      
client [25] (testset)   loss: 2.1179 -> 1.8969  accuracy: 40.30% -> 40.30%     
client [58] (testset)   loss: 2.3054 -> 1.7334  accuracy: 1.11% -> 32.22%      
client [13] (testset)   loss: 2.5228 -> 2.1969  accuracy: 18.71% -> 19.30%     
client [17] (testset)   loss: 2.4225 -> 2.2767  accuracy: 9.23% -> 23.08%      
client [38] (testset)   loss: 2.4857 -> 1.9663  accuracy: 11.56% -> 39.31%     
---------------------------- TRAINING EPOCH: 350 ----------------------------  
client [72] (testset)   loss: 2.3890 -> 2.1076  accuracy: 26.63% -> 26.63%     
client [82] (testset)   loss: 2.4281 -> 1.8315  accuracy: 1.74% -> 38.26%      
client [86] (testset)   loss: 2.4169 -> 2.0012  accuracy: 7.14% -> 22.62%      
client [51] (testset)   loss: 2.4144 -> 2.0126  accuracy: 8.57% -> 36.19%      
client [96] (testset)   loss: 2.3242 -> 2.0284  accuracy: 6.90% -> 22.41%      
client [42] (testset)   loss: 2.2255 -> 2.1127  accuracy: 20.95% -> 20.95%     
client [55] (testset)   loss: 2.5947 -> 2.1411  accuracy: 13.92% -> 13.92%     
client [13] (testset)   loss: 2.5410 -> 2.2714  accuracy: 18.71% -> 19.30%     
client [1]  (testset)   loss: 2.1467 -> 2.0418  accuracy: 23.66% -> 16.13%     
client [12] (testset)   loss: 2.4094 -> 2.2514  accuracy: 12.73% -> 27.27%     
---------------------------- TRAINING EPOCH: 360 ----------------------------  
client [68] (testset)   loss: 2.3911 -> 2.0949  accuracy: 16.80% -> 16.80%     
client [23] (testset)   loss: 2.1814 -> 2.0521  accuracy: 24.23% -> 24.23%     
client [46] (testset)   loss: 2.2147 -> 1.9837  accuracy: 6.86% -> 30.39%      
client [41] (testset)   loss: 2.9445 -> 1.9013  accuracy: 4.42% -> 44.25%      
client [25] (testset)   loss: 2.1047 -> 1.8252  accuracy: 40.30% -> 40.30%     
client [58] (testset)   loss: 2.3232 -> 1.7275  accuracy: 1.11% -> 32.22%      
client [14] (testset)   loss: 2.1830 -> 1.9677  accuracy: 35.56% -> 35.56%     
client [33] (testset)   loss: 2.3684 -> 2.1279  accuracy: 17.65% -> 28.82%     
client [85] (testset)   loss: 2.3210 -> 2.1036  accuracy: 13.06% -> 27.76%     
client [62] (testset)   loss: 2.1933 -> 2.0397  accuracy: 33.83% -> 33.83%     
---------------------------- TRAINING EPOCH: 370 ----------------------------  
client [98] (testset)   loss: 2.4453 -> 2.1757  accuracy: 28.74% -> 28.74%     
client [63] (testset)   loss: 2.2683 -> 2.0460  accuracy: 21.88% -> 14.84%     
client [70] (testset)   loss: 2.3395 -> 1.7780  accuracy: 30.17% -> 30.17%     
client [65] (testset)   loss: 2.5134 -> 1.9588  accuracy: 1.45% -> 28.26%      
client [14] (testset)   loss: 2.3200 -> 1.9505  accuracy: 9.63% -> 35.56%      
client [73] (testset)   loss: 2.2518 -> 1.8484  accuracy: 26.21% -> 27.18%     
client [34] (testset)   loss: 2.2077 -> 1.9766  accuracy: 32.74% -> 32.74%     
client [99] (testset)   loss: 2.2149 -> 1.9665  accuracy: 32.79% -> 32.79%     
client [69] (testset)   loss: 2.2353 -> 1.9422  accuracy: 30.13% -> 25.64%     
client [46] (testset)   loss: 2.3168 -> 1.9560  accuracy: 6.86% -> 30.39%      
---------------------------- TRAINING EPOCH: 380 ----------------------------  
client [99] (testset)   loss: 2.4313 -> 1.9805  accuracy: 4.10% -> 32.79%      
client [93] (testset)   loss: 2.2826 -> 1.1917  accuracy: 5.80% -> 69.57%      
client [11] (testset)   loss: 2.6215 -> 2.0280  accuracy: 7.08% -> 36.28%      
client [58] (testset)   loss: 2.2147 -> 1.7280  accuracy: 6.11% -> 31.11%      
client [81] (testset)   loss: 2.5841 -> 2.2656  accuracy: 25.00% -> 9.38%      
client [85] (testset)   loss: 2.4934 -> 2.1028  accuracy: 14.29% -> 27.76%     
client [89] (testset)   loss: 2.2972 -> 2.0087  accuracy: 0.62% -> 23.46%      
client [45] (testset)   loss: 2.1958 -> 1.8722  accuracy: 20.28% -> 33.57%     
client [8]  (testset)   loss: 2.3848 -> 1.8708  accuracy: 46.10% -> 46.10%     
client [68] (testset)   loss: 2.3410 -> 2.0664  accuracy: 14.40% -> 23.20%     
---------------------------- TRAINING EPOCH: 390 ----------------------------  
client [67] (testset)   loss: 2.3575 -> 2.0613  accuracy: 19.27% -> 19.27%     
client [72] (testset)   loss: 2.3293 -> 2.0813  accuracy: 14.79% -> 26.63%     
client [1]  (testset)   loss: 2.2951 -> 2.1000  accuracy: 6.45% -> 16.13%      
client [78] (testset)   loss: 2.2519 -> 2.0570  accuracy: 17.21% -> 26.23%     
client [83] (testset)   loss: 2.2493 -> 1.7778  accuracy: 30.82% -> 30.82%     
client [21] (testset)   loss: 2.4708 -> 1.9893  accuracy: 3.87% -> 27.10%      
client [56] (testset)   loss: 2.2061 -> 1.9045  accuracy: 11.80% -> 32.58%     
client [44] (testset)   loss: 2.2793 -> 2.0649  accuracy: 10.14% -> 28.38%     
client [92] (testset)   loss: 2.5699 -> 2.0996  accuracy: 14.05% -> 21.49%     
client [27] (testset)   loss: 2.5180 -> 1.9792  accuracy: 4.51% -> 30.83%      
---------------------------- TRAINING EPOCH: 400 ----------------------------  
client [10] (testset)   loss: 2.3305 -> 1.8165  accuracy: 5.41% -> 36.94%      
client [39] (testset)   loss: 2.3019 -> 1.9854  accuracy: 20.71% -> 20.71%     
client [65] (testset)   loss: 2.4339 -> 1.9876  accuracy: 1.45% -> 28.26%      
client [26] (testset)   loss: 2.1173 -> 1.4715  accuracy: 18.82% -> 54.98%     
client [19] (testset)   loss: 2.3527 -> 2.1352  accuracy: 11.80% -> 34.16%     
client [68] (testset)   loss: 2.1985 -> 2.0814  accuracy: 14.40% -> 23.20%     
client [41] (testset)   loss: 2.9086 -> 1.8889  accuracy: 0.00% -> 44.25%      
client [50] (testset)   loss: 2.5417 -> 2.1394  accuracy: 9.40% -> 17.09%      
client [75] (testset)   loss: 2.2077 -> 1.8099  accuracy: 14.29% -> 22.62%     
client [81] (testset)   loss: 2.6612 -> 2.2312  accuracy: 3.12% -> 20.83%      
Training... ---------------------------------------- 100% 0:17:23
FedALA's average time taken by each global epoch: 0 min 2.56 sec.              
FedALA's total running time: 0 h 17 m 23 s.                                    
==================== FedALA Experiment Results: ====================           
Display format: (before local fine-tuning) -> (after local fine-tuning)        
 So if finetune_epoch = 0, x.xx% -> 0.00% is normal.                           
 Centralized testing ONLY happens after model aggregation, so the stats between
'->' are the same.                                                             
{                                                                              
    "100": {                                                                   
        "all_clients": {                                                       
            "test": {                                                          
                "loss": "2.3588 -> 0.0000",                                    
                "accuracy": "9.86% -> 0.00%"                                   
            }                                                                  
        }                                                                      
    },                                                                         
    "200": {                                                                   
        "all_clients": {                                                       
            "test": {                                                          
                "loss": "2.3366 -> 0.0000",                                    
                "accuracy": "18.34% -> 0.00%"                                  
            }                                                                  
        }                                                                      
    },                                                                         
    "300": {                                                                   
        "all_clients": {                                                       
            "test": {                                                          
                "loss": "2.3561 -> 0.0000",                                    
                "accuracy": "18.16% -> 0.00%"                                  
            }                                                                  
        }                                                                      
    },                                                                         
    "400": {                                                                   
        "all_clients": {                                                       
            "test": {                                                          
                "loss": "2.3265 -> 0.0000",                                    
                "accuracy": "18.25% -> 0.00%"                                  
            }                                                                  
        }                                                                      
    }                                                                          
}                                                                              
==================== FedALA Max Accuracy ====================                  
all_clients:                                                                   
(test) before fine-tuning: 18.34% at epoch 200                                 
(test) after fine-tuning: 0.00% at epoch 100                                   
[0m