==================== FedALA ====================                               
Experiment Arguments:                                                          
{
│   'method': 'fedala',
│   'dataset': {
│   │   'name': 'medmnistC',
│   │   'client_num': 100,
│   │   'test_ratio': 0.25,
│   │   'val_ratio': 0.0,
│   │   'seed': 42,
│   │   'split': 'sample',
│   │   'IID_ratio': 0.0,
│   │   'monitor_window_name_suffix': 'medmnistC-100clients-0%IID-Dir(1.0)-seed42',
│   │   'alpha': 1.0,
│   │   'min_samples_per_client': 10
│   },
│   'model': {
│   │   'name': 'lenet5',
│   │   'use_torchvision_pretrained_weights': True,
│   │   'external_model_weights_path': None
│   },
│   'optimizer': {
│   │   'lr': 0.01,
│   │   'dampening': 0,
│   │   'weight_decay': 0,
│   │   'momentum': 0,
│   │   'nesterov': False,
│   │   'name': 'sgd'
│   },
│   'mode': 'serial',
│   'parallel': {
│   │   'ray_cluster_addr': None,
│   │   'num_cpus': None,
│   │   'num_gpus': None,
│   │   'num_workers': 2
│   },
│   'common': {
│   │   'seed': 42,
│   │   'join_ratio': 0.1,
│   │   'global_epoch': 400,
│   │   'local_epoch': 5,
│   │   'batch_size': 32,
│   │   'reset_optimizer_on_global_epoch': True,
│   │   'straggler_ratio': 0,
│   │   'straggler_min_local_epoch': 0,
│   │   'buffers': 'global',
│   │   'client_side_evaluation': True,
│   │   'test': {
│   │   │   'client': {
│   │   │   │   'interval': 100,
│   │   │   │   'finetune_epoch': 0,
│   │   │   │   'train': False,
│   │   │   │   'val': False,
│   │   │   │   'test': True
│   │   │   },
│   │   │   'server': {
│   │   │   │   'interval': -1,
│   │   │   │   'train': False,
│   │   │   │   'val': False,
│   │   │   │   'test': False,
│   │   │   │   'model_in_train_mode': False
│   │   │   }
│   │   },
│   │   'verbose_gap': 10,
│   │   'monitor': None,
│   │   'use_cuda': True,
│   │   'save_log': True,
│   │   'save_model': False,
│   │   'save_learning_curve_plot': False,
│   │   'save_metrics': True,
│   │   'delete_useless_run': True
│   },
│   'fedala': {
│   │   'layer_idx': 2,
│   │   'num_pre_loss': 10,
│   │   'eta': 1.0,
│   │   'threshold': 0.1,
│   │   'rand_percent': 0.8
│   }
}
---------------------------- TRAINING EPOCH: 10 ----------------------------   
client [77] (testset)   loss: 2.5227 -> 2.0274  accuracy: 16.67% -> 16.67%     
client [81] (testset)   loss: 2.4941 -> 1.9941  accuracy: 4.05% -> 35.14%      
client [21] (testset)   loss: 2.3446 -> 1.9591  accuracy: 24.56% -> 26.32%     
client [68] (testset)   loss: 2.1929 -> 1.7103  accuracy: 31.11% -> 31.11%     
client [93] (testset)   loss: 1.9368 -> 1.7222  accuracy: 45.65% -> 45.65%     
client [31] (testset)   loss: 2.2809 -> 1.9093  accuracy: 22.22% -> 44.44%     
client [20] (testset)   loss: 2.3785 -> 2.1952  accuracy: 4.92% -> 18.03%      
client [59] (testset)   loss: 2.4784 -> 2.1150  accuracy: 24.14% -> 24.14%     
client [48] (testset)   loss: 2.5287 -> 2.3080  accuracy: 17.39% -> 17.39%     
client [34] (testset)   loss: 2.0924 -> 1.9392  accuracy: 31.15% -> 31.15%     
---------------------------- TRAINING EPOCH: 20 ----------------------------   
client [69] (testset)   loss: 2.4384 -> 2.0667  accuracy: 7.84% -> 29.41%      
client [99] (testset)   loss: 2.2721 -> 2.0795  accuracy: 20.51% -> 12.82%     
client [67] (testset)   loss: 2.2720 -> 2.1542  accuracy: 22.81% -> 17.54%     
client [0]  (testset)   loss: 2.3150 -> 1.7602  accuracy: 20.55% -> 20.55%     
client [76] (testset)   loss: 2.2522 -> 1.9281  accuracy: 27.78% -> 27.78%     
client [41] (testset)   loss: 2.4131 -> 2.0247  accuracy: 26.92% -> 26.92%     
client [62] (testset)   loss: 2.4918 -> 1.8513  accuracy: 3.45% -> 41.38%      
client [2]  (testset)   loss: 2.1919 -> 1.7769  accuracy: 49.40% -> 49.40%     
client [14] (testset)   loss: 2.2871 -> 2.0895  accuracy: 31.88% -> 31.88%     
client [46] (testset)   loss: 2.4584 -> 1.8504  accuracy: 2.13% -> 48.94%      
---------------------------- TRAINING EPOCH: 30 ----------------------------   
client [24] (testset)   loss: 2.9218 -> 2.1731  accuracy: 0.00% -> 36.00%      
client [68] (testset)   loss: 2.2519 -> 1.7958  accuracy: 31.11% -> 31.11%     
client [57] (testset)   loss: 2.2057 -> 2.0819  accuracy: 17.39% -> 34.78%     
client [17] (testset)   loss: 2.4513 -> 2.0307  accuracy: 20.00% -> 32.00%     
client [54] (testset)   loss: 2.5297 -> 2.3174  accuracy: 3.12% -> 18.75%      
client [23] (testset)   loss: 2.3662 -> 2.1167  accuracy: 20.59% -> 23.53%     
client [35] (testset)   loss: 2.4040 -> 2.0939  accuracy: 11.11% -> 16.67%     
client [59] (testset)   loss: 2.3679 -> 2.1340  accuracy: 24.14% -> 24.14%     
client [31] (testset)   loss: 2.6331 -> 1.8674  accuracy: 22.22% -> 44.44%     
client [9]  (testset)   loss: 2.6333 -> 2.2956  accuracy: 11.11% -> 20.00%     
---------------------------- TRAINING EPOCH: 40 ----------------------------   
client [64] (testset)   loss: 2.4844 -> 2.1941  accuracy: 20.00% -> 20.00%     
client [33] (testset)   loss: 2.2731 -> 1.7947  accuracy: 0.00% -> 44.44%      
client [16] (testset)   loss: 2.3888 -> 2.0601  accuracy: 6.67% -> 26.67%      
client [44] (testset)   loss: 2.3209 -> 2.1355  accuracy: 8.93% -> 23.21%      
client [8]  (testset)   loss: 2.1563 -> 1.9706  accuracy: 34.17% -> 34.17%     
client [31] (testset)   loss: 2.5374 -> 1.8670  accuracy: 22.22% -> 44.44%     
client [47] (testset)   loss: 2.1669 -> 1.7832  accuracy: 16.67% -> 16.67%     
client [36] (testset)   loss: 2.6708 -> 2.0610  accuracy: 4.08% -> 24.49%      
client [20] (testset)   loss: 2.4209 -> 2.1550  accuracy: 4.92% -> 18.03%      
client [56] (testset)   loss: 2.5294 -> 2.0617  accuracy: 32.73% -> 21.82%     
---------------------------- TRAINING EPOCH: 50 ----------------------------   
client [4]  (testset)   loss: 2.3119 -> 2.0243  accuracy: 30.19% -> 30.19%     
client [60] (testset)   loss: 2.5534 -> 2.1789  accuracy: 11.43% -> 28.57%     
client [28] (testset)   loss: 2.2333 -> 2.2148  accuracy: 31.51% -> 12.33%     
client [25] (testset)   loss: 2.4572 -> 2.3822  accuracy: 10.00% -> 12.00%     
client [58] (testset)   loss: 2.2026 -> 1.6848  accuracy: 42.47% -> 42.47%     
client [44] (testset)   loss: 2.3881 -> 2.2168  accuracy: 12.50% -> 12.50%     
client [39] (testset)   loss: 1.7679 -> 1.3999  accuracy: 53.77% -> 53.77%     
client [29] (testset)   loss: 2.2994 -> 1.7877  accuracy: 37.66% -> 25.97%     
client [3]  (testset)   loss: 2.5809 -> 2.5642  accuracy: 14.81% -> 9.26%      
client [84] (testset)   loss: 2.1686 -> 1.6977  accuracy: 38.53% -> 38.53%     
---------------------------- TRAINING EPOCH: 60 ----------------------------   
client [21] (testset)   loss: 2.3124 -> 1.9950  accuracy: 24.56% -> 26.32%     
client [84] (testset)   loss: 2.1424 -> 1.6618  accuracy: 38.53% -> 32.11%     
client [10] (testset)   loss: 2.9089 -> 2.0517  accuracy: 5.56% -> 38.89%      
client [36] (testset)   loss: 2.5549 -> 2.0498  accuracy: 4.08% -> 24.49%      
client [65] (testset)   loss: 2.5551 -> 2.0308  accuracy: 0.00% -> 37.74%      
client [81] (testset)   loss: 2.4893 -> 1.9971  accuracy: 4.05% -> 22.97%      
client [79] (testset)   loss: 2.3142 -> 2.2488  accuracy: 19.23% -> 21.15%     
client [42] (testset)   loss: 2.4353 -> 2.4111  accuracy: 5.36% -> 7.14%       
client [11] (testset)   loss: 2.3505 -> 1.9847  accuracy: 12.50% -> 30.36%     
client [96] (testset)   loss: 2.2704 -> 2.1215  accuracy: 30.36% -> 30.36%     
---------------------------- TRAINING EPOCH: 70 ----------------------------   
client [8]  (testset)   loss: 2.3246 -> 1.8845  accuracy: 34.17% -> 34.17%     
client [53] (testset)   loss: 2.2427 -> 2.0459  accuracy: 38.71% -> 38.71%     
client [52] (testset)   loss: 2.5909 -> 1.5911  accuracy: 7.14% -> 25.00%      
client [42] (testset)   loss: 2.5155 -> 2.2498  accuracy: 5.36% -> 7.14%       
client [69] (testset)   loss: 2.3930 -> 2.0471  accuracy: 7.84% -> 29.41%      
client [59] (testset)   loss: 2.3311 -> 2.1357  accuracy: 12.64% -> 24.14%     
client [7]  (testset)   loss: 2.2189 -> 1.9234  accuracy: 32.79% -> 32.79%     
client [26] (testset)   loss: 2.5695 -> 2.1916  accuracy: 3.51% -> 19.30%      
client [49] (testset)   loss: 2.3746 -> 1.8651  accuracy: 15.15% -> 30.30%     
client [98] (testset)   loss: 2.2253 -> 2.0667  accuracy: 37.74% -> 37.74%     
---------------------------- TRAINING EPOCH: 80 ----------------------------   
client [98] (testset)   loss: 2.2261 -> 2.0535  accuracy: 37.74% -> 37.74%     
client [47] (testset)   loss: 2.4572 -> 1.7973  accuracy: 16.67% -> 16.67%     
client [21] (testset)   loss: 2.2948 -> 1.9632  accuracy: 24.56% -> 26.32%     
client [77] (testset)   loss: 2.3518 -> 1.9974  accuracy: 16.67% -> 30.00%     
client [95] (testset)   loss: 2.3371 -> 1.9910  accuracy: 16.44% -> 34.25%     
client [91] (testset)   loss: 2.4125 -> 2.0623  accuracy: 10.34% -> 13.79%     
client [14] (testset)   loss: 2.2529 -> 2.0684  accuracy: 31.88% -> 31.88%     
client [99] (testset)   loss: 2.2517 -> 2.1082  accuracy: 20.51% -> 10.26%     
client [20] (testset)   loss: 2.4803 -> 2.1636  accuracy: 4.92% -> 18.03%      
client [39] (testset)   loss: 1.9436 -> 1.4295  accuracy: 53.77% -> 53.77%     
---------------------------- TRAINING EPOCH: 90 ----------------------------   
client [52] (testset)   loss: 2.7409 -> 1.4176  accuracy: 7.14% -> 57.14%      
client [62] (testset)   loss: 2.3873 -> 1.8418  accuracy: 3.45% -> 41.38%      
client [71] (testset)   loss: 2.2421 -> 2.0465  accuracy: 23.33% -> 23.33%     
client [97] (testset)   loss: 2.5118 -> 2.0213  accuracy: 12.12% -> 25.76%     
client [30] (testset)   loss: 2.5179 -> 2.3377  accuracy: 12.12% -> 15.15%     
client [88] (testset)   loss: 2.4377 -> 2.1894  accuracy: 14.04% -> 22.81%     
client [60] (testset)   loss: 2.4944 -> 2.2724  accuracy: 11.43% -> 28.57%     
client [82] (testset)   loss: 2.1343 -> 1.9158  accuracy: 40.30% -> 11.94%     
client [91] (testset)   loss: 2.3774 -> 2.0453  accuracy: 10.34% -> 13.79%     
client [57] (testset)   loss: 2.2701 -> 2.0938  accuracy: 17.39% -> 34.78%     
---------------------------- TRAINING EPOCH: 100 ----------------------------  
client [31] (testset)   loss: 2.4396 -> 1.9685  accuracy: 2.78% -> 44.44%      
client [15] (testset)   loss: 2.3479 -> 1.5170  accuracy: 3.90% -> 61.04%      
client [71] (testset)   loss: 2.4262 -> 2.0378  accuracy: 23.33% -> 23.33%     
client [97] (testset)   loss: 2.3374 -> 1.8954  accuracy: 12.12% -> 31.82%     
client [53] (testset)   loss: 2.2594 -> 2.0998  accuracy: 38.71% -> 38.71%     
client [77] (testset)   loss: 2.4748 -> 1.9969  accuracy: 16.67% -> 30.00%     
client [76] (testset)   loss: 2.1191 -> 1.9287  accuracy: 27.78% -> 27.78%     
client [79] (testset)   loss: 2.2437 -> 2.2714  accuracy: 19.23% -> 21.15%     
client [28] (testset)   loss: 2.2870 -> 2.2054  accuracy: 31.51% -> 12.33%     
client [99] (testset)   loss: 2.3334 -> 2.0926  accuracy: 20.51% -> 7.69%      
---------------------------- TRAINING EPOCH: 110 ----------------------------  
client [97] (testset)   loss: 2.4083 -> 1.8729  accuracy: 12.12% -> 31.82%     
client [86] (testset)   loss: 1.9088 -> 1.6986  accuracy: 48.44% -> 48.44%     
client [34] (testset)   loss: 2.3032 -> 1.9434  accuracy: 31.15% -> 24.59%     
client [73] (testset)   loss: 2.4010 -> 2.3332  accuracy: 12.28% -> 12.28%     
client [5]  (testset)   loss: 2.5433 -> 2.1855  accuracy: 2.17% -> 26.09%      
client [96] (testset)   loss: 2.2503 -> 2.1427  accuracy: 30.36% -> 30.36%     
client [22] (testset)   loss: 2.6632 -> 1.8779  accuracy: 4.00% -> 46.00%      
client [60] (testset)   loss: 2.4433 -> 2.2145  accuracy: 11.43% -> 28.57%     
client [66] (testset)   loss: 2.3153 -> 2.1804  accuracy: 19.05% -> 19.05%     
client [83] (testset)   loss: 2.5619 -> 2.2172  accuracy: 0.00% -> 19.57%      
---------------------------- TRAINING EPOCH: 120 ----------------------------  
client [76] (testset)   loss: 2.1215 -> 1.8933  accuracy: 27.78% -> 30.56%     
client [65] (testset)   loss: 2.6336 -> 2.1695  accuracy: 0.00% -> 37.74%      
client [95] (testset)   loss: 2.4394 -> 2.0071  accuracy: 16.44% -> 34.25%     
client [17] (testset)   loss: 2.4664 -> 2.0192  accuracy: 20.00% -> 32.00%     
client [8]  (testset)   loss: 2.1871 -> 1.9265  accuracy: 34.17% -> 34.17%     
client [35] (testset)   loss: 2.5987 -> 1.9827  accuracy: 11.11% -> 33.33%     
client [98] (testset)   loss: 2.1763 -> 2.0482  accuracy: 37.74% -> 37.74%     
client [53] (testset)   loss: 2.0946 -> 2.0966  accuracy: 38.71% -> 38.71%     
client [43] (testset)   loss: 1.9725 -> 1.5059  accuracy: 57.89% -> 57.89%     
client [64] (testset)   loss: 2.3266 -> 2.2286  accuracy: 20.00% -> 17.14%     
---------------------------- TRAINING EPOCH: 130 ----------------------------  
client [21] (testset)   loss: 2.3804 -> 1.9566  accuracy: 1.75% -> 24.56%      
client [88] (testset)   loss: 2.4428 -> 2.1544  accuracy: 3.51% -> 15.79%      
client [38] (testset)   loss: 2.3122 -> 2.1741  accuracy: 10.81% -> 24.32%     
client [3]  (testset)   loss: 2.4294 -> 2.4573  accuracy: 11.11% -> 11.11%     
client [5]  (testset)   loss: 2.2611 -> 2.1688  accuracy: 26.09% -> 26.09%     
client [41] (testset)   loss: 2.4399 -> 2.0180  accuracy: 3.85% -> 26.92%      
client [7]  (testset)   loss: 2.3328 -> 1.9722  accuracy: 6.56% -> 32.79%      
client [37] (testset)   loss: 2.3752 -> 1.9938  accuracy: 7.14% -> 40.48%      
client [45] (testset)   loss: 2.2040 -> 2.0589  accuracy: 6.52% -> 34.78%      
client [47] (testset)   loss: 2.1601 -> 1.6955  accuracy: 8.33% -> 47.22%      
---------------------------- TRAINING EPOCH: 140 ----------------------------  
client [16] (testset)   loss: 2.4173 -> 2.0349  accuracy: 6.67% -> 26.67%      
client [11] (testset)   loss: 2.2050 -> 1.9670  accuracy: 12.50% -> 30.36%     
client [37] (testset)   loss: 2.1741 -> 1.9367  accuracy: 9.52% -> 40.48%      
client [41] (testset)   loss: 2.2933 -> 2.0021  accuracy: 26.92% -> 26.92%     
client [95] (testset)   loss: 2.1958 -> 1.9841  accuracy: 16.44% -> 34.25%     
client [53] (testset)   loss: 2.1432 -> 2.1396  accuracy: 38.71% -> 38.71%     
client [22] (testset)   loss: 2.4869 -> 1.8900  accuracy: 4.00% -> 46.00%      
client [25] (testset)   loss: 2.4414 -> 2.4989  accuracy: 10.00% -> 12.00%     
client [69] (testset)   loss: 2.6629 -> 2.0417  accuracy: 7.84% -> 29.41%      
client [46] (testset)   loss: 2.1442 -> 1.8385  accuracy: 2.13% -> 48.94%      
---------------------------- TRAINING EPOCH: 150 ----------------------------  
client [47] (testset)   loss: 2.4320 -> 1.9452  accuracy: 12.50% -> 16.67%     
client [69] (testset)   loss: 2.7275 -> 2.0642  accuracy: 7.84% -> 7.84%       
client [82] (testset)   loss: 2.1417 -> 2.0030  accuracy: 40.30% -> 11.94%     
client [45] (testset)   loss: 2.2930 -> 2.0931  accuracy: 34.78% -> 34.78%     
client [7]  (testset)   loss: 2.1679 -> 1.9554  accuracy: 32.79% -> 32.79%     
client [50] (testset)   loss: 2.3606 -> 2.1187  accuracy: 29.87% -> 29.87%     
client [35] (testset)   loss: 2.4622 -> 1.9700  accuracy: 11.11% -> 33.33%     
client [24] (testset)   loss: 2.8225 -> 2.2522  accuracy: 0.00% -> 12.00%      
client [15] (testset)   loss: 2.0695 -> 1.6644  accuracy: 61.04% -> 61.04%     
client [58] (testset)   loss: 2.0875 -> 1.6726  accuracy: 42.47% -> 42.47%     
---------------------------- TRAINING EPOCH: 160 ----------------------------  
client [48] (testset)   loss: 2.4007 -> 2.2901  accuracy: 17.39% -> 17.39%     
client [76] (testset)   loss: 2.2320 -> 1.9667  accuracy: 27.78% -> 27.78%     
client [67] (testset)   loss: 2.2631 -> 2.1366  accuracy: 22.81% -> 15.79%     
client [37] (testset)   loss: 2.3485 -> 1.9579  accuracy: 9.52% -> 40.48%      
client [58] (testset)   loss: 2.1324 -> 1.6924  accuracy: 42.47% -> 42.47%     
client [64] (testset)   loss: 2.4025 -> 2.1728  accuracy: 20.00% -> 20.00%     
client [77] (testset)   loss: 2.4005 -> 2.0331  accuracy: 16.67% -> 16.67%     
client [55] (testset)   loss: 2.0766 -> 1.8904  accuracy: 42.62% -> 42.62%     
client [12] (testset)   loss: 2.5489 -> 1.9656  accuracy: 0.00% -> 22.03%      
client [89] (testset)   loss: 2.1599 -> 1.8876  accuracy: 46.88% -> 46.88%     
---------------------------- TRAINING EPOCH: 170 ----------------------------  
client [84] (testset)   loss: 2.3121 -> 1.6680  accuracy: 38.53% -> 38.53%     
client [51] (testset)   loss: 2.0264 -> 1.8152  accuracy: 47.42% -> 47.42%     
client [8]  (testset)   loss: 2.0312 -> 1.9353  accuracy: 34.17% -> 34.17%     
client [18] (testset)   loss: 2.4798 -> 2.3342  accuracy: 11.63% -> 6.98%      
client [94] (testset)   loss: 2.5146 -> 1.8387  accuracy: 19.51% -> 31.71%     
client [81] (testset)   loss: 2.8572 -> 1.9913  accuracy: 4.05% -> 35.14%      
client [3]  (testset)   loss: 2.6611 -> 2.5520  accuracy: 14.81% -> 9.26%      
client [11] (testset)   loss: 2.3860 -> 2.0501  accuracy: 12.50% -> 12.50%     
client [95] (testset)   loss: 2.1450 -> 2.0198  accuracy: 16.44% -> 34.25%     
client [67] (testset)   loss: 2.3343 -> 2.1360  accuracy: 22.81% -> 17.54%     
---------------------------- TRAINING EPOCH: 180 ----------------------------  
client [21] (testset)   loss: 2.3757 -> 1.9560  accuracy: 24.56% -> 26.32%     
client [79] (testset)   loss: 2.4545 -> 2.3520  accuracy: 19.23% -> 21.15%     
client [58] (testset)   loss: 2.2268 -> 1.6879  accuracy: 42.47% -> 42.47%     
client [88] (testset)   loss: 2.5104 -> 2.2308  accuracy: 14.04% -> 22.81%     
client [46] (testset)   loss: 2.3567 -> 1.8278  accuracy: 2.13% -> 48.94%      
client [11] (testset)   loss: 2.2286 -> 1.9802  accuracy: 12.50% -> 30.36%     
client [55] (testset)   loss: 2.1640 -> 1.8835  accuracy: 42.62% -> 42.62%     
client [13] (testset)   loss: 2.4847 -> 2.3925  accuracy: 19.44% -> 22.22%     
client [31] (testset)   loss: 2.5225 -> 1.8816  accuracy: 22.22% -> 44.44%     
client [75] (testset)   loss: 2.4771 -> 2.1526  accuracy: 1.85% -> 22.22%      
---------------------------- TRAINING EPOCH: 190 ----------------------------  
client [19] (testset)   loss: 2.5921 -> 2.1848  accuracy: 3.57% -> 19.64%      
client [7]  (testset)   loss: 2.2580 -> 1.9390  accuracy: 32.79% -> 32.79%     
client [57] (testset)   loss: 2.2597 -> 2.0376  accuracy: 17.39% -> 34.78%     
client [13] (testset)   loss: 2.3835 -> 2.4733  accuracy: 19.44% -> 22.22%     
client [43] (testset)   loss: 2.2140 -> 1.5707  accuracy: 57.89% -> 57.89%     
client [91] (testset)   loss: 2.3852 -> 2.0932  accuracy: 10.34% -> 13.79%     
client [10] (testset)   loss: 2.8406 -> 2.0692  accuracy: 5.56% -> 22.22%      
client [64] (testset)   loss: 2.3192 -> 2.2149  accuracy: 20.00% -> 20.00%     
client [82] (testset)   loss: 2.1313 -> 2.0109  accuracy: 40.30% -> 11.94%     
client [22] (testset)   loss: 2.6210 -> 1.8240  accuracy: 4.00% -> 46.00%      
---------------------------- TRAINING EPOCH: 200 ----------------------------  
client [20] (testset)   loss: 2.5213 -> 2.1937  accuracy: 4.92% -> 13.11%      
client [23] (testset)   loss: 2.3223 -> 2.1209  accuracy: 20.59% -> 20.59%     
client [88] (testset)   loss: 2.4403 -> 2.2182  accuracy: 14.04% -> 15.79%     
client [98] (testset)   loss: 2.1050 -> 2.0825  accuracy: 37.74% -> 37.74%     
client [79] (testset)   loss: 2.4503 -> 2.2816  accuracy: 19.23% -> 21.15%     
client [21] (testset)   loss: 2.3262 -> 1.9710  accuracy: 24.56% -> 26.32%     
client [92] (testset)   loss: 2.5516 -> 2.1145  accuracy: 7.35% -> 26.47%      
client [56] (testset)   loss: 2.2563 -> 2.2458  accuracy: 32.73% -> 7.27%      
client [5]  (testset)   loss: 2.5765 -> 2.2292  accuracy: 2.17% -> 26.09%      
client [52] (testset)   loss: 2.5846 -> 1.3739  accuracy: 7.14% -> 25.00%      
---------------------------- TRAINING EPOCH: 210 ----------------------------  
client [67] (testset)   loss: 2.2976 -> 2.1152  accuracy: 22.81% -> 19.30%     
client [54] (testset)   loss: 2.5675 -> 2.2974  accuracy: 3.12% -> 18.75%      
client [14] (testset)   loss: 2.2901 -> 2.0855  accuracy: 31.88% -> 31.88%     
client [99] (testset)   loss: 2.3400 -> 2.1332  accuracy: 20.51% -> 12.82%     
client [36] (testset)   loss: 2.5685 -> 2.0756  accuracy: 4.08% -> 24.49%      
client [30] (testset)   loss: 2.4652 -> 2.3636  accuracy: 12.12% -> 15.15%     
client [38] (testset)   loss: 2.2937 -> 2.2464  accuracy: 24.32% -> 18.92%     
client [15] (testset)   loss: 1.8227 -> 1.6865  accuracy: 61.04% -> 11.69%     
client [6]  (testset)   loss: 2.6107 -> 2.0732  accuracy: 1.54% -> 21.54%      
client [53] (testset)   loss: 2.0857 -> 2.0934  accuracy: 38.71% -> 38.71%     
---------------------------- TRAINING EPOCH: 220 ----------------------------  
client [99] (testset)   loss: 2.2617 -> 2.0992  accuracy: 20.51% -> 12.82%     
client [6]  (testset)   loss: 2.5174 -> 2.0957  accuracy: 1.54% -> 23.08%      
client [83] (testset)   loss: 2.6137 -> 2.1425  accuracy: 0.00% -> 19.57%      
client [42] (testset)   loss: 2.4415 -> 2.2979  accuracy: 5.36% -> 17.86%      
client [34] (testset)   loss: 2.2582 -> 1.9498  accuracy: 31.15% -> 24.59%     
client [15] (testset)   loss: 1.9339 -> 1.8845  accuracy: 61.04% -> 11.69%     
client [47] (testset)   loss: 2.4549 -> 1.8749  accuracy: 16.67% -> 16.67%     
client [55] (testset)   loss: 2.0784 -> 1.8946  accuracy: 42.62% -> 42.62%     
client [51] (testset)   loss: 1.9551 -> 1.8136  accuracy: 47.42% -> 47.42%     
client [95] (testset)   loss: 2.4573 -> 2.0186  accuracy: 16.44% -> 34.25%     
---------------------------- TRAINING EPOCH: 230 ----------------------------  
client [71] (testset)   loss: 2.4484 -> 2.0160  accuracy: 23.33% -> 23.33%     
client [15] (testset)   loss: 1.8624 -> 1.4361  accuracy: 61.04% -> 61.04%     
client [33] (testset)   loss: 2.3580 -> 1.9122  accuracy: 0.00% -> 22.22%      
client [99] (testset)   loss: 2.3046 -> 2.1090  accuracy: 20.51% -> 12.82%     
client [90] (testset)   loss: 2.6360 -> 1.9988  accuracy: 2.27% -> 25.00%      
client [57] (testset)   loss: 2.4109 -> 2.1285  accuracy: 17.39% -> 34.78%     
client [27] (testset)   loss: 2.1596 -> 2.0477  accuracy: 38.75% -> 38.75%     
client [78] (testset)   loss: 2.5017 -> 2.0932  accuracy: 24.24% -> 22.73%     
client [36] (testset)   loss: 2.6520 -> 2.0506  accuracy: 4.08% -> 24.49%      
client [88] (testset)   loss: 2.3552 -> 2.1909  accuracy: 14.04% -> 22.81%     
---------------------------- TRAINING EPOCH: 240 ----------------------------  
client [70] (testset)   loss: 2.4308 -> 2.2440  accuracy: 18.75% -> 25.00%     
client [35] (testset)   loss: 2.3056 -> 1.9779  accuracy: 11.11% -> 33.33%     
client [16] (testset)   loss: 2.3741 -> 2.0100  accuracy: 6.67% -> 26.67%      
client [80] (testset)   loss: 2.3930 -> 2.1524  accuracy: 14.55% -> 38.18%     
client [38] (testset)   loss: 2.3178 -> 2.2365  accuracy: 24.32% -> 18.92%     
client [78] (testset)   loss: 2.2601 -> 1.9168  accuracy: 24.24% -> 22.73%     
client [68] (testset)   loss: 2.3050 -> 1.7410  accuracy: 31.11% -> 31.11%     
client [11] (testset)   loss: 2.2415 -> 1.9742  accuracy: 12.50% -> 30.36%     
client [64] (testset)   loss: 2.4072 -> 2.2066  accuracy: 20.00% -> 20.00%     
client [82] (testset)   loss: 2.1356 -> 1.9452  accuracy: 40.30% -> 11.94%     
---------------------------- TRAINING EPOCH: 250 ----------------------------  
client [30] (testset)   loss: 2.6198 -> 2.3850  accuracy: 12.12% -> 15.15%     
client [27] (testset)   loss: 2.0181 -> 2.0187  accuracy: 38.75% -> 38.75%     
client [74] (testset)   loss: 2.2640 -> 2.0536  accuracy: 28.07% -> 19.30%     
client [45] (testset)   loss: 2.1256 -> 2.0572  accuracy: 34.78% -> 34.78%     
client [6]  (testset)   loss: 2.6117 -> 2.0950  accuracy: 1.54% -> 23.08%      
client [36] (testset)   loss: 2.6643 -> 2.0558  accuracy: 4.08% -> 24.49%      
client [63] (testset)   loss: 2.2223 -> 1.9922  accuracy: 31.67% -> 31.67%     
client [76] (testset)   loss: 2.1846 -> 1.9202  accuracy: 27.78% -> 27.78%     
client [83] (testset)   loss: 2.7123 -> 2.1685  accuracy: 0.00% -> 19.57%      
client [86] (testset)   loss: 1.8835 -> 1.7024  accuracy: 48.44% -> 48.44%     
---------------------------- TRAINING EPOCH: 260 ----------------------------  
client [83] (testset)   loss: 2.5080 -> 2.1333  accuracy: 0.00% -> 30.43%      
client [99] (testset)   loss: 2.2180 -> 2.0671  accuracy: 20.51% -> 20.51%     
client [74] (testset)   loss: 2.1967 -> 2.0924  accuracy: 28.07% -> 28.07%     
client [73] (testset)   loss: 2.3698 -> 2.3576  accuracy: 12.28% -> 12.28%     
client [29] (testset)   loss: 2.2529 -> 1.7838  accuracy: 37.66% -> 37.66%     
client [92] (testset)   loss: 2.4112 -> 2.1207  accuracy: 7.35% -> 26.47%      
client [6]  (testset)   loss: 2.4282 -> 2.0954  accuracy: 1.54% -> 12.31%      
client [61] (testset)   loss: 2.2523 -> 2.2004  accuracy: 26.67% -> 26.67%     
client [21] (testset)   loss: 2.2633 -> 1.9779  accuracy: 24.56% -> 26.32%     
client [67] (testset)   loss: 2.3641 -> 2.1992  accuracy: 22.81% -> 17.54%     
---------------------------- TRAINING EPOCH: 270 ----------------------------  
client [83] (testset)   loss: 2.4467 -> 2.1423  accuracy: 0.00% -> 19.57%      
client [32] (testset)   loss: 2.5309 -> 1.9728  accuracy: 17.39% -> 30.43%     
client [95] (testset)   loss: 2.2316 -> 2.0562  accuracy: 16.44% -> 34.25%     
client [61] (testset)   loss: 2.3634 -> 2.2262  accuracy: 26.67% -> 26.67%     
client [27] (testset)   loss: 2.1017 -> 2.0113  accuracy: 38.75% -> 38.75%     
client [25] (testset)   loss: 2.3818 -> 2.4385  accuracy: 10.00% -> 14.00%     
client [68] (testset)   loss: 2.2097 -> 1.7591  accuracy: 31.11% -> 37.78%     
client [34] (testset)   loss: 2.1243 -> 1.8994  accuracy: 31.15% -> 31.15%     
client [71] (testset)   loss: 2.2584 -> 2.0741  accuracy: 23.33% -> 23.33%     
client [89] (testset)   loss: 2.0778 -> 1.8371  accuracy: 46.88% -> 46.88%     
---------------------------- TRAINING EPOCH: 280 ----------------------------  
client [78] (testset)   loss: 2.3385 -> 1.9460  accuracy: 24.24% -> 22.73%     
client [81] (testset)   loss: 2.7080 -> 1.9839  accuracy: 4.05% -> 35.14%      
client [51] (testset)   loss: 1.9839 -> 1.8403  accuracy: 47.42% -> 47.42%     
client [54] (testset)   loss: 2.6969 -> 2.3975  accuracy: 3.12% -> 18.75%      
client [65] (testset)   loss: 2.6569 -> 2.0544  accuracy: 0.00% -> 13.21%      
client [41] (testset)   loss: 2.2436 -> 2.0162  accuracy: 26.92% -> 26.92%     
client [11] (testset)   loss: 2.3829 -> 2.0370  accuracy: 12.50% -> 30.36%     
client [85] (testset)   loss: 2.3341 -> 2.0680  accuracy: 18.67% -> 29.33%     
client [12] (testset)   loss: 2.6578 -> 1.8990  accuracy: 0.00% -> 23.73%      
client [23] (testset)   loss: 2.5390 -> 2.1521  accuracy: 20.59% -> 20.59%     
---------------------------- TRAINING EPOCH: 290 ----------------------------  
client [16] (testset)   loss: 2.5837 -> 2.0324  accuracy: 6.67% -> 26.67%      
client [65] (testset)   loss: 2.5070 -> 2.0624  accuracy: 0.00% -> 37.74%      
client [53] (testset)   loss: 2.2424 -> 2.0682  accuracy: 38.71% -> 38.71%     
client [58] (testset)   loss: 2.0303 -> 1.6758  accuracy: 42.47% -> 42.47%     
client [72] (testset)   loss: 2.7827 -> 1.7858  accuracy: 1.85% -> 53.70%      
client [7]  (testset)   loss: 2.1744 -> 1.9442  accuracy: 32.79% -> 32.79%     
client [71] (testset)   loss: 2.3436 -> 2.0443  accuracy: 23.33% -> 23.33%     
client [59] (testset)   loss: 2.2756 -> 2.1150  accuracy: 24.14% -> 24.14%     
client [86] (testset)   loss: 2.0552 -> 1.7013  accuracy: 48.44% -> 48.44%     
client [39] (testset)   loss: 1.9094 -> 1.4556  accuracy: 53.77% -> 53.77%     
---------------------------- TRAINING EPOCH: 300 ----------------------------  
client [99] (testset)   loss: 2.2514 -> 2.0485  accuracy: 20.51% -> 20.51%     
client [7]  (testset)   loss: 2.2379 -> 1.9912  accuracy: 32.79% -> 32.79%     
client [17] (testset)   loss: 2.4579 -> 2.0712  accuracy: 20.00% -> 32.00%     
client [64] (testset)   loss: 2.4117 -> 2.1882  accuracy: 20.00% -> 17.14%     
client [37] (testset)   loss: 2.5101 -> 1.9487  accuracy: 9.52% -> 40.48%      
client [29] (testset)   loss: 2.1291 -> 1.7804  accuracy: 37.66% -> 37.66%     
client [93] (testset)   loss: 2.0852 -> 1.7492  accuracy: 45.65% -> 45.65%     
client [73] (testset)   loss: 2.3992 -> 2.3284  accuracy: 12.28% -> 21.05%     
client [40] (testset)   loss: 2.4110 -> 2.1514  accuracy: 7.61% -> 21.74%      
client [76] (testset)   loss: 2.0864 -> 1.8923  accuracy: 27.78% -> 30.56%     
---------------------------- TRAINING EPOCH: 310 ----------------------------  
client [31] (testset)   loss: 2.4361 -> 1.9166  accuracy: 22.22% -> 44.44%     
client [89] (testset)   loss: 2.0041 -> 1.8959  accuracy: 46.88% -> 46.88%     
client [77] (testset)   loss: 2.6946 -> 2.0016  accuracy: 16.67% -> 16.67%     
client [90] (testset)   loss: 2.8709 -> 2.0015  accuracy: 2.27% -> 25.00%      
client [26] (testset)   loss: 2.5810 -> 2.1777  accuracy: 3.51% -> 22.81%      
client [50] (testset)   loss: 2.2691 -> 2.1003  accuracy: 29.87% -> 29.87%     
client [30] (testset)   loss: 2.6627 -> 2.3211  accuracy: 12.12% -> 15.15%     
client [70] (testset)   loss: 2.5157 -> 2.3062  accuracy: 18.75% -> 25.00%     
client [41] (testset)   loss: 2.3550 -> 2.0278  accuracy: 26.92% -> 26.92%     
client [99] (testset)   loss: 2.3864 -> 2.1015  accuracy: 20.51% -> 10.26%     
---------------------------- TRAINING EPOCH: 320 ----------------------------  
client [68] (testset)   loss: 2.1004 -> 1.7503  accuracy: 31.11% -> 37.78%     
client [70] (testset)   loss: 2.3968 -> 2.3442  accuracy: 18.75% -> 6.25%      
client [52] (testset)   loss: 3.1335 -> 1.5459  accuracy: 7.14% -> 25.00%      
client [1]  (testset)   loss: 2.2541 -> 2.4205  accuracy: 20.83% -> 12.50%     
client [2]  (testset)   loss: 2.0306 -> 1.7926  accuracy: 49.40% -> 49.40%     
client [67] (testset)   loss: 2.2952 -> 2.0871  accuracy: 22.81% -> 19.30%     
client [92] (testset)   loss: 2.4673 -> 2.1219  accuracy: 7.35% -> 26.47%      
client [35] (testset)   loss: 2.4354 -> 2.0157  accuracy: 11.11% -> 33.33%     
client [36] (testset)   loss: 2.6448 -> 2.0501  accuracy: 4.08% -> 24.49%      
client [64] (testset)   loss: 2.4234 -> 2.1928  accuracy: 20.00% -> 22.86%     
---------------------------- TRAINING EPOCH: 330 ----------------------------  
client [44] (testset)   loss: 2.4312 -> 2.1448  accuracy: 12.50% -> 23.21%     
client [6]  (testset)   loss: 2.3395 -> 2.0369  accuracy: 1.54% -> 21.54%      
client [12] (testset)   loss: 2.6111 -> 1.9225  accuracy: 0.00% -> 22.03%      
client [55] (testset)   loss: 2.1872 -> 1.9013  accuracy: 42.62% -> 42.62%     
client [29] (testset)   loss: 2.2494 -> 1.8092  accuracy: 37.66% -> 37.66%     
client [9]  (testset)   loss: 2.3763 -> 2.4890  accuracy: 11.11% -> 13.33%     
client [43] (testset)   loss: 2.1968 -> 1.5471  accuracy: 57.89% -> 57.89%     
client [77] (testset)   loss: 2.4269 -> 2.0213  accuracy: 16.67% -> 16.67%     
client [98] (testset)   loss: 2.3067 -> 2.0459  accuracy: 37.74% -> 37.74%     
client [78] (testset)   loss: 2.4561 -> 1.9465  accuracy: 24.24% -> 24.24%     
---------------------------- TRAINING EPOCH: 340 ----------------------------  
client [92] (testset)   loss: 2.4618 -> 2.1350  accuracy: 7.35% -> 26.47%      
client [80] (testset)   loss: 2.4677 -> 2.1586  accuracy: 3.64% -> 38.18%      
client [63] (testset)   loss: 2.2422 -> 1.9729  accuracy: 31.67% -> 31.67%     
client [76] (testset)   loss: 2.2192 -> 1.9208  accuracy: 27.78% -> 27.78%     
client [78] (testset)   loss: 2.3113 -> 1.9402  accuracy: 24.24% -> 22.73%     
client [25] (testset)   loss: 2.4339 -> 2.4338  accuracy: 10.00% -> 14.00%     
client [58] (testset)   loss: 1.9887 -> 1.6844  accuracy: 42.47% -> 42.47%     
client [13] (testset)   loss: 2.3586 -> 2.5152  accuracy: 19.44% -> 22.22%     
client [17] (testset)   loss: 2.6245 -> 1.9912  accuracy: 20.00% -> 32.00%     
client [38] (testset)   loss: 2.2570 -> 2.2154  accuracy: 24.32% -> 18.92%     
---------------------------- TRAINING EPOCH: 350 ----------------------------  
client [72] (testset)   loss: 2.7188 -> 1.8302  accuracy: 1.85% -> 53.70%      
client [82] (testset)   loss: 2.0055 -> 1.8696  accuracy: 40.30% -> 40.30%     
client [86] (testset)   loss: 2.0050 -> 1.6905  accuracy: 48.44% -> 48.44%     
client [51] (testset)   loss: 2.0551 -> 1.8437  accuracy: 47.42% -> 47.42%     
client [96] (testset)   loss: 2.2940 -> 2.0569  accuracy: 30.36% -> 30.36%     
client [42] (testset)   loss: 2.6460 -> 2.3732  accuracy: 5.36% -> 17.86%      
client [55] (testset)   loss: 2.1449 -> 1.9021  accuracy: 42.62% -> 42.62%     
client [13] (testset)   loss: 2.4078 -> 2.4099  accuracy: 19.44% -> 22.22%     
client [1]  (testset)   loss: 2.3225 -> 2.3934  accuracy: 20.83% -> 4.17%      
client [12] (testset)   loss: 2.6272 -> 1.8976  accuracy: 0.00% -> 23.73%      
---------------------------- TRAINING EPOCH: 360 ----------------------------  
client [68] (testset)   loss: 2.3526 -> 1.8407  accuracy: 31.11% -> 37.78%     
client [23] (testset)   loss: 2.4195 -> 2.2102  accuracy: 20.59% -> 20.59%     
client [46] (testset)   loss: 2.2235 -> 1.8585  accuracy: 2.13% -> 48.94%      
client [41] (testset)   loss: 2.2334 -> 2.0176  accuracy: 26.92% -> 26.92%     
client [25] (testset)   loss: 2.4422 -> 2.5110  accuracy: 10.00% -> 12.00%     
client [58] (testset)   loss: 2.2439 -> 1.6808  accuracy: 42.47% -> 42.47%     
client [14] (testset)   loss: 2.3128 -> 2.1206  accuracy: 31.88% -> 8.70%      
client [33] (testset)   loss: 2.5407 -> 2.0609  accuracy: 0.00% -> 22.22%      
client [85] (testset)   loss: 2.2306 -> 2.0399  accuracy: 18.67% -> 29.33%     
client [62] (testset)   loss: 2.3384 -> 1.8957  accuracy: 3.45% -> 41.38%      
---------------------------- TRAINING EPOCH: 370 ----------------------------  
client [98] (testset)   loss: 2.2322 -> 2.0436  accuracy: 37.74% -> 37.74%     
client [63] (testset)   loss: 2.1485 -> 2.0352  accuracy: 31.67% -> 31.67%     
client [70] (testset)   loss: 2.4042 -> 2.3041  accuracy: 18.75% -> 9.38%      
client [65] (testset)   loss: 2.4930 -> 2.0978  accuracy: 0.00% -> 13.21%      
client [14] (testset)   loss: 2.1796 -> 2.0371  accuracy: 31.88% -> 31.88%     
client [73] (testset)   loss: 2.4241 -> 2.3556  accuracy: 12.28% -> 21.05%     
client [34] (testset)   loss: 2.1926 -> 1.9370  accuracy: 31.15% -> 24.59%     
client [99] (testset)   loss: 2.2899 -> 2.1004  accuracy: 20.51% -> 12.82%     
client [69] (testset)   loss: 2.5012 -> 2.0360  accuracy: 7.84% -> 29.41%      
client [46] (testset)   loss: 2.3636 -> 1.8676  accuracy: 2.13% -> 48.94%      
---------------------------- TRAINING EPOCH: 380 ----------------------------  
client [99] (testset)   loss: 2.2882 -> 2.1587  accuracy: 20.51% -> 10.26%     
client [93] (testset)   loss: 1.9873 -> 1.7075  accuracy: 45.65% -> 45.65%     
client [11] (testset)   loss: 2.2832 -> 2.0145  accuracy: 12.50% -> 30.36%     
client [58] (testset)   loss: 2.0739 -> 1.6901  accuracy: 42.47% -> 42.47%     
client [81] (testset)   loss: 2.5271 -> 2.0072  accuracy: 4.05% -> 35.14%      
client [85] (testset)   loss: 2.2227 -> 2.2167  accuracy: 18.67% -> 29.33%     
client [89] (testset)   loss: 2.0817 -> 2.0579  accuracy: 46.88% -> 46.88%     
client [45] (testset)   loss: 2.1140 -> 2.0272  accuracy: 34.78% -> 34.78%     
client [8]  (testset)   loss: 2.0546 -> 1.9004  accuracy: 34.17% -> 34.17%     
client [68] (testset)   loss: 2.1557 -> 1.7802  accuracy: 31.11% -> 31.11%     
---------------------------- TRAINING EPOCH: 390 ----------------------------  
client [67] (testset)   loss: 2.3095 -> 2.1000  accuracy: 22.81% -> 22.81%     
client [72] (testset)   loss: 2.7103 -> 1.8395  accuracy: 1.85% -> 53.70%      
client [1]  (testset)   loss: 2.3069 -> 2.4954  accuracy: 20.83% -> 12.50%     
client [78] (testset)   loss: 2.2757 -> 1.9481  accuracy: 24.24% -> 22.73%     
client [83] (testset)   loss: 2.6091 -> 2.1461  accuracy: 0.00% -> 19.57%      
client [21] (testset)   loss: 2.4109 -> 1.9457  accuracy: 24.56% -> 26.32%     
client [56] (testset)   loss: 2.3302 -> 2.0769  accuracy: 32.73% -> 32.73%     
client [44] (testset)   loss: 2.4088 -> 2.2136  accuracy: 12.50% -> 8.93%      
client [92] (testset)   loss: 2.5749 -> 2.1318  accuracy: 7.35% -> 26.47%      
client [27] (testset)   loss: 2.0368 -> 1.9940  accuracy: 38.75% -> 38.75%     
---------------------------- TRAINING EPOCH: 400 ----------------------------  
client [10] (testset)   loss: 2.7669 -> 2.1151  accuracy: 5.56% -> 38.89%      
client [39] (testset)   loss: 1.9123 -> 1.3987  accuracy: 53.77% -> 53.77%     
client [65] (testset)   loss: 2.5204 -> 2.0031  accuracy: 0.00% -> 37.74%      
client [26] (testset)   loss: 2.6873 -> 2.1507  accuracy: 3.51% -> 22.81%      
client [19] (testset)   loss: 2.6296 -> 2.1455  accuracy: 3.57% -> 19.64%      
client [68] (testset)   loss: 1.9583 -> 1.7625  accuracy: 31.11% -> 37.78%     
client [41] (testset)   loss: 2.4077 -> 2.0142  accuracy: 26.92% -> 26.92%     
client [50] (testset)   loss: 2.1613 -> 2.1417  accuracy: 29.87% -> 29.87%     
client [75] (testset)   loss: 2.5599 -> 2.2613  accuracy: 1.85% -> 12.96%      
client [81] (testset)   loss: 2.2542 -> 1.9706  accuracy: 4.05% -> 35.14%      
Training... ---------------------------------------- 100% 0:07:38
FedALA's average time taken by each global epoch: 0 min 1.12 sec.              
FedALA's total running time: 0 h 7 m 38 s.                                     
==================== FedALA Experiment Results: ====================           
Display format: (before local fine-tuning) -> (after local fine-tuning)        
 So if finetune_epoch = 0, x.xx% -> 0.00% is normal.                           
 Centralized testing ONLY happens after model aggregation, so the stats between
'->' are the same.                                                             
{                                                                              
    "100": {                                                                   
        "all_clients": {                                                       
            "test": {                                                          
                "loss": "2.3027 -> 0.0000",                                    
                "accuracy": "22.61% -> 0.00%"                                  
            }                                                                  
        }                                                                      
    },                                                                         
    "200": {                                                                   
        "all_clients": {                                                       
            "test": {                                                          
                "loss": "2.3216 -> 0.0000",                                    
                "accuracy": "22.61% -> 0.00%"                                  
            }                                                                  
        }                                                                      
    },                                                                         
    "300": {                                                                   
        "all_clients": {                                                       
            "test": {                                                          
                "loss": "2.3228 -> 0.0000",                                    
                "accuracy": "22.61% -> 0.00%"                                  
            }                                                                  
        }                                                                      
    },                                                                         
    "400": {                                                                   
        "all_clients": {                                                       
            "test": {                                                          
                "loss": "2.3370 -> 0.0000",                                    
                "accuracy": "22.61% -> 0.00%"                                  
            }                                                                  
        }                                                                      
    }                                                                          
}                                                                              
==================== FedALA Max Accuracy ====================                  
all_clients:                                                                   
(test) before fine-tuning: 22.61% at epoch 100                                 
(test) after fine-tuning: 0.00% at epoch 100                                   
[0m