==================== FedALA ====================                               
Experiment Arguments:                                                          
{
│   'method': 'fedala',
│   'dataset': {
│   │   'name': 'mnist',
│   │   'client_num': 100,
│   │   'test_ratio': 0.25,
│   │   'val_ratio': 0.0,
│   │   'seed': 42,
│   │   'split': 'sample',
│   │   'IID_ratio': 0.0,
│   │   'monitor_window_name_suffix': 'mnist-100clients-0%IID-Dir(1.0)-seed42',
│   │   'alpha': 1.0,
│   │   'min_samples_per_client': 10
│   },
│   'model': {
│   │   'name': 'avgcnn',
│   │   'use_torchvision_pretrained_weights': True,
│   │   'external_model_weights_path': None
│   },
│   'optimizer': {
│   │   'lr': 0.01,
│   │   'dampening': 0,
│   │   'weight_decay': 0,
│   │   'momentum': 0,
│   │   'nesterov': False,
│   │   'name': 'sgd'
│   },
│   'mode': 'serial',
│   'parallel': {
│   │   'ray_cluster_addr': None,
│   │   'num_cpus': None,
│   │   'num_gpus': None,
│   │   'num_workers': 2
│   },
│   'common': {
│   │   'seed': 42,
│   │   'join_ratio': 0.1,
│   │   'global_epoch': 400,
│   │   'local_epoch': 5,
│   │   'batch_size': 32,
│   │   'reset_optimizer_on_global_epoch': True,
│   │   'straggler_ratio': 0,
│   │   'straggler_min_local_epoch': 0,
│   │   'buffers': 'global',
│   │   'client_side_evaluation': True,
│   │   'test': {
│   │   │   'client': {
│   │   │   │   'interval': 100,
│   │   │   │   'finetune_epoch': 0,
│   │   │   │   'train': False,
│   │   │   │   'val': False,
│   │   │   │   'test': True
│   │   │   },
│   │   │   'server': {
│   │   │   │   'interval': -1,
│   │   │   │   'train': False,
│   │   │   │   'val': False,
│   │   │   │   'test': False,
│   │   │   │   'model_in_train_mode': False
│   │   │   }
│   │   },
│   │   'verbose_gap': 10,
│   │   'monitor': None,
│   │   'use_cuda': True,
│   │   'save_log': True,
│   │   'save_model': False,
│   │   'save_learning_curve_plot': False,
│   │   'save_metrics': True,
│   │   'delete_useless_run': True
│   },
│   'fedala': {
│   │   'layer_idx': 2,
│   │   'num_pre_loss': 10,
│   │   'eta': 1.0,
│   │   'threshold': 0.1,
│   │   'rand_percent': 0.8
│   }
}
---------------------------- TRAINING EPOCH: 10 ----------------------------   
client [77] (testset)   loss: 0.1693 -> 0.2681  accuracy: 96.39% -> 91.16%     
client [81] (testset)   loss: 0.2367 -> 0.2625  accuracy: 94.55% -> 92.73%     
client [21] (testset)   loss: 0.2322 -> 0.1610  accuracy: 93.81% -> 94.69%     
client [68] (testset)   loss: 0.1266 -> 0.0779  accuracy: 97.78% -> 98.33%     
client [93] (testset)   loss: 0.1404 -> 0.1472  accuracy: 95.63% -> 96.43%     
client [31] (testset)   loss: 0.1571 -> 0.1314  accuracy: 91.96% -> 94.64%     
client [20] (testset)   loss: 0.2096 -> 0.1483  accuracy: 93.42% -> 95.61%     
client [59] (testset)   loss: 0.1632 -> 0.1609  accuracy: 93.75% -> 94.79%     
client [48] (testset)   loss: 0.1406 -> 0.2062  accuracy: 95.74% -> 93.62%     
client [34] (testset)   loss: 0.1215 -> 0.1324  accuracy: 95.95% -> 95.27%     
---------------------------- TRAINING EPOCH: 20 ----------------------------   
client [69] (testset)   loss: 0.0930 -> 0.0863  accuracy: 96.99% -> 96.39%     
client [99] (testset)   loss: 0.1526 -> 0.1903  accuracy: 95.53% -> 92.74%     
client [67] (testset)   loss: 0.1532 -> 0.1605  accuracy: 97.44% -> 96.58%     
client [0]  (testset)   loss: 0.0906 -> 0.0864  accuracy: 97.47% -> 97.47%     
client [76] (testset)   loss: 0.0367 -> 0.0130  accuracy: 98.00% -> 100.00%    
client [41] (testset)   loss: 0.1177 -> 0.0943  accuracy: 96.43% -> 97.02%     
client [62] (testset)   loss: 0.0655 -> 0.0514  accuracy: 97.84% -> 98.92%     
client [2]  (testset)   loss: 0.0893 -> 0.0700  accuracy: 96.85% -> 96.85%     
client [14] (testset)   loss: 0.1811 -> 0.2205  accuracy: 92.77% -> 92.77%     
client [46] (testset)   loss: 0.1307 -> 0.0903  accuracy: 95.49% -> 96.99%     
---------------------------- TRAINING EPOCH: 30 ----------------------------   
client [24] (testset)   loss: 0.0494 -> 0.0542  accuracy: 98.25% -> 98.25%     
client [68] (testset)   loss: 0.0392 -> 0.0277  accuracy: 98.89% -> 99.44%     
client [57] (testset)   loss: 0.1750 -> 0.1431  accuracy: 95.85% -> 96.31%     
client [17] (testset)   loss: 0.0739 -> 0.0738  accuracy: 96.94% -> 97.38%     
client [54] (testset)   loss: 0.1032 -> 0.1278  accuracy: 96.63% -> 96.63%     
client [23] (testset)   loss: 0.0836 -> 0.0954  accuracy: 97.85% -> 96.77%     
client [35] (testset)   loss: 0.0378 -> 0.0307  accuracy: 99.40% -> 98.80%     
client [59] (testset)   loss: 0.0725 -> 0.0885  accuracy: 98.96% -> 97.40%     
client [31] (testset)   loss: 0.0936 -> 0.0668  accuracy: 98.21% -> 99.11%     
client [9]  (testset)   loss: 0.0648 -> 0.0452  accuracy: 98.13% -> 98.13%     
---------------------------- TRAINING EPOCH: 40 ----------------------------   
client [64] (testset)   loss: 0.0704 -> 0.0523  accuracy: 97.10% -> 97.93%     
client [33] (testset)   loss: 0.0633 -> 0.0883  accuracy: 98.58% -> 97.16%     
client [16] (testset)   loss: 0.0984 -> 0.0782  accuracy: 97.72% -> 96.35%     
client [44] (testset)   loss: 0.1847 -> 0.1542  accuracy: 97.59% -> 97.59%     
client [8]  (testset)   loss: 0.0341 -> 0.0657  accuracy: 98.78% -> 98.78%     
client [31] (testset)   loss: 0.0871 -> 0.0621  accuracy: 96.43% -> 99.11%     
client [47] (testset)   loss: 0.0546 -> 0.0670  accuracy: 98.79% -> 98.79%     
client [36] (testset)   loss: 0.0303 -> 0.0427  accuracy: 98.91% -> 98.36%     
client [20] (testset)   loss: 0.0688 -> 0.0488  accuracy: 97.37% -> 98.25%     
client [56] (testset)   loss: 0.0582 -> 0.0616  accuracy: 98.42% -> 97.37%     
---------------------------- TRAINING EPOCH: 50 ----------------------------   
client [4]  (testset)   loss: 0.1133 -> 0.1101  accuracy: 98.29% -> 97.71%     
client [60] (testset)   loss: 0.0456 -> 0.0448  accuracy: 97.83% -> 98.19%     
client [28] (testset)   loss: 0.0420 -> 0.0895  accuracy: 99.27% -> 97.08%     
client [25] (testset)   loss: 0.0937 -> 0.0702  accuracy: 97.63% -> 96.68%     
client [58] (testset)   loss: 0.0325 -> 0.0211  accuracy: 98.46% -> 99.49%     
client [44] (testset)   loss: 0.1713 -> 0.1386  accuracy: 98.19% -> 99.40%     
client [39] (testset)   loss: 0.0191 -> 0.0291  accuracy: 99.45% -> 99.45%     
client [29] (testset)   loss: 0.0462 -> 0.0175  accuracy: 98.26% -> 99.13%     
client [3]  (testset)   loss: 0.1245 -> 0.1586  accuracy: 96.09% -> 95.22%     
client [84] (testset)   loss: 0.0745 -> 0.0569  accuracy: 97.65% -> 98.82%     
---------------------------- TRAINING EPOCH: 60 ----------------------------   
client [21] (testset)   loss: 0.0538 -> 0.0340  accuracy: 98.23% -> 97.35%     
client [84] (testset)   loss: 0.0631 -> 0.0482  accuracy: 97.65% -> 98.82%     
client [10] (testset)   loss: 0.0506 -> 0.0573  accuracy: 98.68% -> 98.01%     
client [36] (testset)   loss: 0.0210 -> 0.0369  accuracy: 99.45% -> 98.36%     
client [65] (testset)   loss: 0.0871 -> 0.0773  accuracy: 97.65% -> 96.47%     
client [81] (testset)   loss: 0.1497 -> 0.1630  accuracy: 96.36% -> 97.27%     
client [79] (testset)   loss: 0.0761 -> 0.0246  accuracy: 97.85% -> 98.92%     
client [42] (testset)   loss: 0.1058 -> 0.0892  accuracy: 96.49% -> 97.37%     
client [11] (testset)   loss: 0.0645 -> 0.0499  accuracy: 98.45% -> 98.97%     
client [96] (testset)   loss: 0.0658 -> 0.0602  accuracy: 98.56% -> 98.09%     
---------------------------- TRAINING EPOCH: 70 ----------------------------   
client [8]  (testset)   loss: 0.0437 -> 0.0684  accuracy: 99.39% -> 98.78%     
client [53] (testset)   loss: 0.1000 -> 0.0710  accuracy: 98.21% -> 97.32%     
client [52] (testset)   loss: 0.0276 -> 0.0804  accuracy: 99.08% -> 98.17%     
client [42] (testset)   loss: 0.0911 -> 0.0825  accuracy: 96.49% -> 97.37%     
client [69] (testset)   loss: 0.0659 -> 0.0316  accuracy: 97.59% -> 99.40%     
client [59] (testset)   loss: 0.0322 -> 0.0545  accuracy: 99.48% -> 97.40%     
client [7]  (testset)   loss: 0.0716 -> 0.0228  accuracy: 97.62% -> 100.00%    
client [26] (testset)   loss: 0.0712 -> 0.0434  accuracy: 96.61% -> 99.15%     
client [49] (testset)   loss: 0.0403 -> 0.0192  accuracy: 98.15% -> 98.77%     
client [98] (testset)   loss: 0.0225 -> 0.0397  accuracy: 99.19% -> 97.56%     
---------------------------- TRAINING EPOCH: 80 ----------------------------   
client [98] (testset)   loss: 0.0199 -> 0.0295  accuracy: 100.00% -> 99.19%    
client [47] (testset)   loss: 0.0282 -> 0.0378  accuracy: 98.79% -> 99.19%     
client [21] (testset)   loss: 0.0620 -> 0.0236  accuracy: 97.35% -> 99.12%     
client [77] (testset)   loss: 0.0813 -> 0.0428  accuracy: 97.99% -> 98.39%     
client [95] (testset)   loss: 0.0660 -> 0.0870  accuracy: 98.05% -> 96.59%     
client [91] (testset)   loss: 0.0818 -> 0.0550  accuracy: 97.00% -> 97.00%     
client [14] (testset)   loss: 0.1340 -> 0.1547  accuracy: 96.39% -> 95.18%     
client [99] (testset)   loss: 0.0658 -> 0.0695  accuracy: 97.77% -> 96.65%     
client [20] (testset)   loss: 0.0574 -> 0.0460  accuracy: 98.68% -> 98.25%     
client [39] (testset)   loss: 0.0148 -> 1.5989  accuracy: 99.45% -> 73.08%     
---------------------------- TRAINING EPOCH: 90 ----------------------------   
client [52] (testset)   loss: 0.0191 -> 0.0625  accuracy: 99.08% -> 99.08%     
client [62] (testset)   loss: 0.0390 -> 0.0304  accuracy: 98.92% -> 99.46%     
client [71] (testset)   loss: 0.0944 -> 0.0894  accuracy: 97.91% -> 97.91%     
client [97] (testset)   loss: 0.0779 -> 0.0556  accuracy: 97.99% -> 98.66%     
client [30] (testset)   loss: 0.0567 -> 0.0477  accuracy: 97.78% -> 98.67%     
client [88] (testset)   loss: 0.0858 -> 0.0674  accuracy: 97.23% -> 97.23%     
client [60] (testset)   loss: 0.0208 -> 0.0264  accuracy: 99.28% -> 98.91%     
client [82] (testset)   loss: 0.0569 -> 0.0547  accuracy: 98.97% -> 98.97%     
client [91] (testset)   loss: 0.0645 -> 0.0530  accuracy: 97.00% -> 97.00%     
client [57] (testset)   loss: 0.1286 -> 0.1164  accuracy: 97.70% -> 97.70%     
---------------------------- TRAINING EPOCH: 100 ----------------------------  
client [31] (testset)   loss: 0.0433 -> 0.0422  accuracy: 99.11% -> 99.11%     
client [15] (testset)   loss: 0.0407 -> 0.0711  accuracy: 98.03% -> 97.04%     
client [71] (testset)   loss: 0.1162 -> 0.0846  accuracy: 96.34% -> 98.43%     
client [97] (testset)   loss: 0.0719 -> 0.0536  accuracy: 97.32% -> 98.66%     
client [53] (testset)   loss: 0.1035 -> 0.0621  accuracy: 95.54% -> 97.32%     
client [77] (testset)   loss: 0.0701 -> 0.0404  accuracy: 98.39% -> 98.39%     
client [76] (testset)   loss: 0.0022 -> 0.0018  accuracy: 100.00% -> 100.00%   
client [79] (testset)   loss: 0.0589 -> 0.0252  accuracy: 97.85% -> 98.92%     
client [28] (testset)   loss: 0.0613 -> 0.0574  accuracy: 97.81% -> 97.81%     
client [99] (testset)   loss: 0.0533 -> 0.0625  accuracy: 97.77% -> 97.21%     
---------------------------- TRAINING EPOCH: 110 ----------------------------  
client [97] (testset)   loss: 0.0778 -> 0.0539  accuracy: 97.99% -> 98.66%     
client [86] (testset)   loss: 0.0103 -> 0.0117  accuracy: 100.00% -> 99.25%    
client [34] (testset)   loss: 0.0372 -> 0.0540  accuracy: 97.97% -> 97.97%     
client [73] (testset)   loss: 0.1328 -> 0.1368  accuracy: 97.50% -> 96.25%     
client [5]  (testset)   loss: 0.0307 -> 0.0468  accuracy: 98.15% -> 98.77%     
client [96] (testset)   loss: 0.0695 -> 0.0550  accuracy: 97.61% -> 98.56%     
client [22] (testset)   loss: 0.0501 -> 0.0385  accuracy: 99.09% -> 99.09%     
client [60] (testset)   loss: 0.0234 -> 0.0230  accuracy: 98.91% -> 99.28%     
client [66] (testset)   loss: 0.1251 -> 0.0804  accuracy: 97.94% -> 97.94%     
client [83] (testset)   loss: 0.0643 -> 0.0539  accuracy: 98.09% -> 98.56%     
---------------------------- TRAINING EPOCH: 120 ----------------------------  
client [76] (testset)   loss: 0.0034 -> 0.0030  accuracy: 100.00% -> 100.00%   
client [65] (testset)   loss: 0.0804 -> 0.0918  accuracy: 97.06% -> 97.06%     
client [95] (testset)   loss: 0.0585 -> 0.0732  accuracy: 98.54% -> 97.56%     
client [17] (testset)   loss: 0.0354 -> 0.0336  accuracy: 99.13% -> 99.13%     
client [8]  (testset)   loss: 0.0416 -> 0.0623  accuracy: 98.78% -> 99.39%     
client [35] (testset)   loss: 0.0093 -> 0.0096  accuracy: 100.00% -> 99.40%    
client [98] (testset)   loss: 0.0146 -> 0.0251  accuracy: 99.19% -> 99.19%     
client [53] (testset)   loss: 0.0744 -> 0.0731  accuracy: 98.21% -> 97.32%     
client [43] (testset)   loss: 0.0618 -> 0.0506  accuracy: 98.20% -> 98.20%     
client [64] (testset)   loss: 0.0357 -> 0.0263  accuracy: 97.51% -> 98.34%     
---------------------------- TRAINING EPOCH: 130 ----------------------------  
client [21] (testset)   loss: 0.0548 -> 0.0202  accuracy: 98.23% -> 99.12%     
client [88] (testset)   loss: 0.0676 -> 0.0500  accuracy: 97.23% -> 97.58%     
client [38] (testset)   loss: 0.0376 -> 0.0402  accuracy: 99.51% -> 99.01%     
client [3]  (testset)   loss: 0.0913 -> 0.1479  accuracy: 97.39% -> 96.52%     
client [5]  (testset)   loss: 0.0257 -> 0.0390  accuracy: 99.38% -> 98.77%     
client [41] (testset)   loss: 0.0151 -> 0.0235  accuracy: 99.40% -> 99.40%     
client [7]  (testset)   loss: 0.0378 -> 0.0148  accuracy: 98.81% -> 98.81%     
client [37] (testset)   loss: 0.0531 -> 0.0637  accuracy: 98.71% -> 97.85%     
client [45] (testset)   loss: 0.0514 -> 0.0496  accuracy: 98.85% -> 98.85%     
client [47] (testset)   loss: 0.0230 -> 0.0272  accuracy: 99.19% -> 99.60%     
---------------------------- TRAINING EPOCH: 140 ----------------------------  
client [16] (testset)   loss: 0.0830 -> 0.0650  accuracy: 97.26% -> 96.80%     
client [11] (testset)   loss: 0.0460 -> 0.0338  accuracy: 98.45% -> 98.97%     
client [37] (testset)   loss: 0.0595 -> 0.0645  accuracy: 98.71% -> 97.85%     
client [41] (testset)   loss: 0.0155 -> 0.0221  accuracy: 100.00% -> 99.40%    
client [95] (testset)   loss: 0.0572 -> 0.0757  accuracy: 97.56% -> 97.07%     
client [53] (testset)   loss: 0.0920 -> 0.0603  accuracy: 95.54% -> 96.43%     
client [22] (testset)   loss: 0.0446 -> 0.0349  accuracy: 99.09% -> 99.09%     
client [25] (testset)   loss: 0.0621 -> 0.0492  accuracy: 98.58% -> 99.05%     
client [69] (testset)   loss: 0.0415 -> 0.0150  accuracy: 97.59% -> 100.00%    
client [46] (testset)   loss: 0.0178 -> 0.0089  accuracy: 100.00% -> 100.00%   
---------------------------- TRAINING EPOCH: 150 ----------------------------  
client [47] (testset)   loss: 0.0295 -> 0.0303  accuracy: 99.19% -> 99.60%     
client [69] (testset)   loss: 0.0487 -> 0.0201  accuracy: 97.59% -> 98.80%     
client [82] (testset)   loss: 0.0385 -> 0.0382  accuracy: 98.97% -> 98.97%     
client [45] (testset)   loss: 0.0434 -> 0.0365  accuracy: 99.23% -> 99.23%     
client [7]  (testset)   loss: 0.0508 -> 0.0175  accuracy: 98.81% -> 99.40%     
client [50] (testset)   loss: 0.0533 -> 0.0374  accuracy: 98.24% -> 99.30%     
client [35] (testset)   loss: 0.0085 -> 0.0043  accuracy: 99.40% -> 100.00%    
client [24] (testset)   loss: 0.0134 -> 0.0216  accuracy: 100.00% -> 100.00%   
client [15] (testset)   loss: 0.0367 -> 0.0487  accuracy: 98.03% -> 98.03%     
client [58] (testset)   loss: 0.0082 -> 0.0113  accuracy: 100.00% -> 99.49%    
---------------------------- TRAINING EPOCH: 160 ----------------------------  
client [48] (testset)   loss: 0.0349 -> 0.0374  accuracy: 98.58% -> 98.58%     
client [76] (testset)   loss: 0.0012 -> 0.0012  accuracy: 100.00% -> 100.00%   
client [67] (testset)   loss: 0.0397 -> 0.0600  accuracy: 98.29% -> 98.29%     
client [37] (testset)   loss: 0.0602 -> 0.0626  accuracy: 98.28% -> 97.85%     
client [58] (testset)   loss: 0.0123 -> 0.0107  accuracy: 100.00% -> 100.00%   
client [64] (testset)   loss: 0.0304 -> 0.0211  accuracy: 98.76% -> 99.17%     
client [77] (testset)   loss: 0.0802 -> 0.0311  accuracy: 98.80% -> 98.80%     
client [55] (testset)   loss: 0.0825 -> 0.0350  accuracy: 95.96% -> 98.99%     
client [12] (testset)   loss: 0.0063 -> 0.0140  accuracy: 100.00% -> 98.94%    
client [89] (testset)   loss: 0.0909 -> 0.0884  accuracy: 98.23% -> 98.23%     
---------------------------- TRAINING EPOCH: 170 ----------------------------  
client [84] (testset)   loss: 0.0431 -> 0.0251  accuracy: 98.82% -> 98.82%     
client [51] (testset)   loss: 0.0527 -> 0.0560  accuracy: 98.13% -> 97.20%     
client [8]  (testset)   loss: 0.0308 -> 0.0441  accuracy: 98.78% -> 99.39%     
client [18] (testset)   loss: 0.0047 -> 0.0022  accuracy: 100.00% -> 100.00%   
client [94] (testset)   loss: 0.0440 -> 0.0494  accuracy: 99.22% -> 99.22%     
client [81] (testset)   loss: 0.1422 -> 0.1531  accuracy: 97.27% -> 97.27%     
client [3]  (testset)   loss: 0.0857 -> 0.1390  accuracy: 97.39% -> 96.52%     
client [11] (testset)   loss: 0.0396 -> 0.0334  accuracy: 98.45% -> 98.45%     
client [95] (testset)   loss: 0.0516 -> 0.0612  accuracy: 97.56% -> 98.05%     
client [67] (testset)   loss: 0.0430 -> 0.0554  accuracy: 98.29% -> 98.29%     
---------------------------- TRAINING EPOCH: 180 ----------------------------  
client [21] (testset)   loss: 0.0383 -> 0.0194  accuracy: 99.12% -> 99.12%     
client [79] (testset)   loss: 0.0480 -> 0.0154  accuracy: 97.85% -> 99.28%     
client [58] (testset)   loss: 0.0068 -> 0.0087  accuracy: 100.00% -> 100.00%   
client [88] (testset)   loss: 0.0574 -> 0.0583  accuracy: 97.92% -> 97.92%     
client [46] (testset)   loss: 0.0119 -> 0.0079  accuracy: 100.00% -> 100.00%   
client [11] (testset)   loss: 0.0519 -> 0.0362  accuracy: 97.94% -> 98.45%     
client [55] (testset)   loss: 0.1034 -> 0.0305  accuracy: 95.96% -> 100.00%    
client [13] (testset)   loss: 0.1484 -> 0.1441  accuracy: 96.00% -> 97.60%     
client [31] (testset)   loss: 0.0431 -> 0.0389  accuracy: 98.21% -> 99.11%     
client [75] (testset)   loss: 0.0084 -> 0.0081  accuracy: 99.47% -> 99.47%     
---------------------------- TRAINING EPOCH: 190 ----------------------------  
client [19] (testset)   loss: 0.0163 -> 0.0065  accuracy: 99.41% -> 100.00%    
client [7]  (testset)   loss: 0.0547 -> 0.0239  accuracy: 98.81% -> 98.81%     
client [57] (testset)   loss: 0.1181 -> 0.1066  accuracy: 97.24% -> 98.16%     
client [13] (testset)   loss: 0.1553 -> 0.1465  accuracy: 96.00% -> 97.60%     
client [43] (testset)   loss: 0.0525 -> 0.0400  accuracy: 99.10% -> 99.10%     
client [91] (testset)   loss: 0.0364 -> 0.0180  accuracy: 98.00% -> 100.00%    
client [10] (testset)   loss: 0.0571 -> 0.0598  accuracy: 99.34% -> 98.68%     
client [64] (testset)   loss: 0.0182 -> 0.0148  accuracy: 99.59% -> 99.59%     
client [82] (testset)   loss: 0.0321 -> 0.0347  accuracy: 98.97% -> 98.97%     
client [22] (testset)   loss: 0.0540 -> 0.0421  accuracy: 99.09% -> 99.09%     
---------------------------- TRAINING EPOCH: 200 ----------------------------  
client [20] (testset)   loss: 0.0514 -> 0.0383  accuracy: 98.68% -> 98.68%     
client [23] (testset)   loss: 0.0548 -> 0.0425  accuracy: 98.92% -> 98.92%     
client [88] (testset)   loss: 0.0588 -> 0.0493  accuracy: 98.27% -> 98.27%     
client [98] (testset)   loss: 0.0060 -> 0.0086  accuracy: 100.00% -> 100.00%   
client [79] (testset)   loss: 0.0377 -> 0.0161  accuracy: 98.57% -> 98.92%     
client [21] (testset)   loss: 0.0378 -> 0.0193  accuracy: 98.23% -> 99.12%     
client [92] (testset)   loss: 0.0816 -> 0.0832  accuracy: 97.12% -> 97.60%     
client [56] (testset)   loss: 0.0149 -> 0.0142  accuracy: 99.47% -> 99.47%     
client [5]  (testset)   loss: 0.0148 -> 0.0280  accuracy: 99.38% -> 98.77%     
client [52] (testset)   loss: 0.0120 -> 0.0387  accuracy: 100.00% -> 99.08%    
---------------------------- TRAINING EPOCH: 210 ----------------------------  
client [67] (testset)   loss: 0.0506 -> 0.0625  accuracy: 98.29% -> 98.29%     
client [54] (testset)   loss: 0.1074 -> 0.0890  accuracy: 97.75% -> 98.31%     
client [14] (testset)   loss: 0.1720 -> 0.1699  accuracy: 96.39% -> 96.39%     
client [99] (testset)   loss: 0.0303 -> 0.0276  accuracy: 97.77% -> 98.88%     
client [36] (testset)   loss: 0.0051 -> 0.0081  accuracy: 100.00% -> 100.00%   
client [30] (testset)   loss: 0.0487 -> 0.0414  accuracy: 98.67% -> 99.11%     
client [38] (testset)   loss: 0.0286 -> 0.0373  accuracy: 99.51% -> 99.51%     
client [15] (testset)   loss: 0.0417 -> 0.0405  accuracy: 98.52% -> 98.52%     
client [6]  (testset)   loss: 0.0678 -> 0.1034  accuracy: 97.95% -> 97.95%     
client [53] (testset)   loss: 0.0771 -> 0.0460  accuracy: 96.43% -> 99.11%     
---------------------------- TRAINING EPOCH: 220 ----------------------------  
client [99] (testset)   loss: 0.0420 -> 0.0273  accuracy: 98.88% -> 98.32%     
client [6]  (testset)   loss: 0.0617 -> 0.0973  accuracy: 97.95% -> 97.95%     
client [83] (testset)   loss: 0.0655 -> 0.0519  accuracy: 97.61% -> 98.56%     
client [42] (testset)   loss: 0.0620 -> 0.0528  accuracy: 97.37% -> 98.25%     
client [34] (testset)   loss: 0.0355 -> 0.0477  accuracy: 99.32% -> 97.97%     
client [15] (testset)   loss: 0.0509 -> 0.0519  accuracy: 98.52% -> 98.03%     
client [47] (testset)   loss: 0.0207 -> 0.0233  accuracy: 99.60% -> 99.60%     
client [55] (testset)   loss: 0.0639 -> 0.0200  accuracy: 96.97% -> 100.00%    
client [51] (testset)   loss: 0.0595 -> 0.0960  accuracy: 97.66% -> 97.20%     
client [95] (testset)   loss: 0.0541 -> 0.0591  accuracy: 98.05% -> 97.56%     
---------------------------- TRAINING EPOCH: 230 ----------------------------  
client [71] (testset)   loss: 0.0908 -> 0.0890  accuracy: 97.91% -> 97.91%     
client [15] (testset)   loss: 0.0491 -> 0.0541  accuracy: 97.54% -> 97.54%     
client [33] (testset)   loss: 0.0277 -> 0.0533  accuracy: 99.29% -> 99.29%     
client [99] (testset)   loss: 0.0591 -> 0.0360  accuracy: 97.21% -> 97.77%     
client [90] (testset)   loss: 0.0580 -> 0.0579  accuracy: 98.58% -> 99.29%     
client [57] (testset)   loss: 0.1237 -> 0.1061  accuracy: 97.70% -> 98.16%     
client [27] (testset)   loss: 0.0371 -> 0.0435  accuracy: 98.82% -> 99.41%     
client [78] (testset)   loss: 0.1562 -> 0.0836  accuracy: 96.36% -> 96.97%     
client [36] (testset)   loss: 0.0036 -> 0.0109  accuracy: 100.00% -> 100.00%   
client [88] (testset)   loss: 0.0593 -> 0.0578  accuracy: 97.92% -> 98.27%     
---------------------------- TRAINING EPOCH: 240 ----------------------------  
client [70] (testset)   loss: 0.0109 -> 0.0077  accuracy: 99.58% -> 100.00%    
client [35] (testset)   loss: 0.0098 -> 0.0054  accuracy: 99.40% -> 100.00%    
client [16] (testset)   loss: 0.0725 -> 0.0557  accuracy: 97.26% -> 97.72%     
client [80] (testset)   loss: 0.0547 -> 0.0505  accuracy: 98.87% -> 97.36%     
client [38] (testset)   loss: 0.0325 -> 0.0353  accuracy: 99.51% -> 99.51%     
client [78] (testset)   loss: 0.1482 -> 0.0780  accuracy: 96.36% -> 97.58%     
client [68] (testset)   loss: 0.0105 -> 0.0054  accuracy: 99.44% -> 99.44%     
client [11] (testset)   loss: 0.0444 -> 0.0308  accuracy: 98.45% -> 98.45%     
client [64] (testset)   loss: 0.0159 -> 0.0115  accuracy: 99.17% -> 99.17%     
client [82] (testset)   loss: 0.0387 -> 0.0410  accuracy: 98.97% -> 98.97%     
---------------------------- TRAINING EPOCH: 250 ----------------------------  
client [30] (testset)   loss: 0.0419 -> 0.0400  accuracy: 98.67% -> 98.67%     
client [27] (testset)   loss: 0.0486 -> 0.0503  accuracy: 98.82% -> 98.82%     
client [74] (testset)   loss: 0.0201 -> 0.0264  accuracy: 98.75% -> 98.12%     
client [45] (testset)   loss: 0.0406 -> 0.0407  accuracy: 99.23% -> 99.23%     
client [6]  (testset)   loss: 0.0723 -> 0.1095  accuracy: 97.95% -> 97.95%     
client [36] (testset)   loss: 0.0049 -> 0.0107  accuracy: 100.00% -> 100.00%   
client [63] (testset)   loss: 0.0024 -> 0.0029  accuracy: 100.00% -> 100.00%   
client [76] (testset)   loss: 0.0004 -> 0.0004  accuracy: 100.00% -> 100.00%   
client [83] (testset)   loss: 0.0681 -> 0.0525  accuracy: 97.61% -> 98.56%     
client [86] (testset)   loss: 0.0060 -> 0.0075  accuracy: 100.00% -> 100.00%   
---------------------------- TRAINING EPOCH: 260 ----------------------------  
client [83] (testset)   loss: 0.0752 -> 0.0557  accuracy: 97.61% -> 98.56%     
client [99] (testset)   loss: 0.0308 -> 0.0247  accuracy: 98.88% -> 99.44%     
client [74] (testset)   loss: 0.0224 -> 0.0313  accuracy: 99.38% -> 98.12%     
client [73] (testset)   loss: 0.1411 -> 0.1411  accuracy: 97.92% -> 98.33%     
client [29] (testset)   loss: 0.0341 -> 0.0133  accuracy: 98.26% -> 99.13%     
client [92] (testset)   loss: 0.0900 -> 0.0787  accuracy: 97.12% -> 97.60%     
client [6]  (testset)   loss: 0.0571 -> 0.0989  accuracy: 97.95% -> 97.95%     
client [61] (testset)   loss: 0.0495 -> 0.0267  accuracy: 98.89% -> 99.44%     
client [21] (testset)   loss: 0.0265 -> 0.0112  accuracy: 99.12% -> 99.12%     
client [67] (testset)   loss: 0.0349 -> 0.0458  accuracy: 98.29% -> 99.15%     
---------------------------- TRAINING EPOCH: 270 ----------------------------  
client [83] (testset)   loss: 0.0741 -> 0.0542  accuracy: 97.13% -> 98.56%     
client [32] (testset)   loss: 0.0506 -> 0.0443  accuracy: 98.70% -> 98.70%     
client [95] (testset)   loss: 0.0582 -> 0.0631  accuracy: 97.07% -> 97.07%     
client [61] (testset)   loss: 0.0388 -> 0.0254  accuracy: 98.89% -> 99.44%     
client [27] (testset)   loss: 0.0354 -> 0.0424  accuracy: 98.82% -> 98.82%     
client [25] (testset)   loss: 0.0515 -> 0.0345  accuracy: 98.58% -> 99.05%     
client [68] (testset)   loss: 0.0071 -> 0.0018  accuracy: 99.44% -> 100.00%    
client [34] (testset)   loss: 0.0478 -> 0.0436  accuracy: 98.65% -> 97.97%     
client [71] (testset)   loss: 0.1068 -> 0.0855  accuracy: 96.86% -> 97.91%     
client [89] (testset)   loss: 0.1014 -> 0.0904  accuracy: 97.35% -> 97.35%     
---------------------------- TRAINING EPOCH: 280 ----------------------------  
client [78] (testset)   loss: 0.1332 -> 0.0790  accuracy: 96.97% -> 96.97%     
client [81] (testset)   loss: 0.1184 -> 0.1331  accuracy: 97.27% -> 97.27%     
client [51] (testset)   loss: 0.0596 -> 0.0625  accuracy: 97.20% -> 97.66%     
client [54] (testset)   loss: 0.0964 -> 0.0886  accuracy: 97.75% -> 99.44%     
client [65] (testset)   loss: 0.0632 -> 0.0836  accuracy: 97.65% -> 97.06%     
client [41] (testset)   loss: 0.0096 -> 0.0210  accuracy: 99.40% -> 99.40%     
client [11] (testset)   loss: 0.0400 -> 0.0252  accuracy: 98.45% -> 98.45%     
client [85] (testset)   loss: 0.0329 -> 0.0300  accuracy: 97.18% -> 98.59%     
client [12] (testset)   loss: 0.0052 -> 0.0108  accuracy: 100.00% -> 99.47%    
client [23] (testset)   loss: 0.0534 -> 0.0391  accuracy: 98.92% -> 99.46%     
---------------------------- TRAINING EPOCH: 290 ----------------------------  
client [16] (testset)   loss: 0.0738 -> 0.0462  accuracy: 97.72% -> 97.72%     
client [65] (testset)   loss: 0.0467 -> 0.0753  accuracy: 98.24% -> 97.65%     
client [53] (testset)   loss: 0.0364 -> 0.0482  accuracy: 98.21% -> 98.21%     
client [58] (testset)   loss: 0.0071 -> 0.0076  accuracy: 100.00% -> 100.00%   
client [72] (testset)   loss: 0.0069 -> 0.0138  accuracy: 100.00% -> 99.60%    
client [7]  (testset)   loss: 0.0540 -> 0.0319  accuracy: 98.81% -> 98.81%     
client [71] (testset)   loss: 0.1059 -> 0.0977  accuracy: 97.91% -> 97.91%     
client [59] (testset)   loss: 0.0110 -> 0.0336  accuracy: 99.48% -> 97.92%     
client [86] (testset)   loss: 0.0024 -> 0.0025  accuracy: 100.00% -> 100.00%   
client [39] (testset)   loss: 0.0126 -> 0.0153  accuracy: 99.45% -> 99.45%     
---------------------------- TRAINING EPOCH: 300 ----------------------------  
client [99] (testset)   loss: 0.0351 -> 0.0271  accuracy: 98.32% -> 98.88%     
client [7]  (testset)   loss: 0.0465 -> 0.0216  accuracy: 98.81% -> 98.81%     
client [17] (testset)   loss: 0.0376 -> 0.0351  accuracy: 98.25% -> 99.13%     
client [64] (testset)   loss: 0.0167 -> 0.0105  accuracy: 99.17% -> 99.17%     
client [37] (testset)   loss: 0.0261 -> 0.0341  accuracy: 98.71% -> 98.71%     
client [29] (testset)   loss: 0.0135 -> 0.0081  accuracy: 99.13% -> 100.00%    
client [93] (testset)   loss: 0.0289 -> 0.0244  accuracy: 98.81% -> 99.21%     
client [73] (testset)   loss: 0.1395 -> 0.1414  accuracy: 97.50% -> 97.50%     
client [40] (testset)   loss: 0.0481 -> 0.0059  accuracy: 98.40% -> 100.00%    
client [76] (testset)   loss: 0.0003 -> 0.0002  accuracy: 100.00% -> 100.00%   
---------------------------- TRAINING EPOCH: 310 ----------------------------  
client [31] (testset)   loss: 0.0365 -> 0.0505  accuracy: 99.11% -> 99.11%     
client [89] (testset)   loss: 0.1229 -> 0.0914  accuracy: 98.23% -> 98.23%     
client [77] (testset)   loss: 0.0748 -> 0.0393  accuracy: 98.39% -> 99.20%     
client [90] (testset)   loss: 0.0303 -> 0.0436  accuracy: 99.29% -> 99.29%     
client [26] (testset)   loss: 0.0502 -> 0.0190  accuracy: 98.31% -> 99.58%     
client [50] (testset)   loss: 0.0691 -> 0.0320  accuracy: 97.89% -> 98.94%     
client [30] (testset)   loss: 0.0489 -> 0.0409  accuracy: 99.11% -> 99.11%     
client [70] (testset)   loss: 0.0138 -> 0.0059  accuracy: 99.17% -> 100.00%    
client [41] (testset)   loss: 0.0091 -> 0.0206  accuracy: 99.40% -> 99.40%     
client [99] (testset)   loss: 0.0408 -> 0.0317  accuracy: 98.32% -> 98.88%     
---------------------------- TRAINING EPOCH: 320 ----------------------------  
client [68] (testset)   loss: 0.0119 -> 0.0030  accuracy: 99.44% -> 100.00%    
client [70] (testset)   loss: 0.0119 -> 0.0061  accuracy: 99.58% -> 100.00%    
client [52] (testset)   loss: 0.0057 -> 0.0167  accuracy: 100.00% -> 98.17%    
client [1]  (testset)   loss: 0.0486 -> 0.0626  accuracy: 99.02% -> 99.02%     
client [2]  (testset)   loss: 0.0331 -> 0.0296  accuracy: 98.43% -> 99.21%     
client [67] (testset)   loss: 0.0329 -> 0.0455  accuracy: 98.29% -> 99.15%     
client [92] (testset)   loss: 0.0936 -> 0.0751  accuracy: 97.60% -> 97.12%     
client [35] (testset)   loss: 0.0104 -> 0.0067  accuracy: 99.40% -> 99.40%     
client [36] (testset)   loss: 0.0027 -> 0.0079  accuracy: 100.00% -> 100.00%   
client [64] (testset)   loss: 0.0191 -> 0.0115  accuracy: 99.17% -> 99.17%     
---------------------------- TRAINING EPOCH: 330 ----------------------------  
client [44] (testset)   loss: 0.2265 -> 0.2017  accuracy: 99.40% -> 99.40%     
client [6]  (testset)   loss: 0.0742 -> 0.1175  accuracy: 97.95% -> 97.95%     
client [12] (testset)   loss: 0.0030 -> 0.0106  accuracy: 100.00% -> 98.94%    
client [55] (testset)   loss: 0.0513 -> 0.0139  accuracy: 96.97% -> 100.00%    
client [29] (testset)   loss: 0.0163 -> 0.0104  accuracy: 99.13% -> 99.13%     
client [9]  (testset)   loss: 0.0266 -> 0.0142  accuracy: 99.07% -> 100.00%    
client [43] (testset)   loss: 0.0354 -> 0.0294  accuracy: 99.10% -> 98.20%     
client [77] (testset)   loss: 0.0695 -> 0.0309  accuracy: 98.80% -> 99.20%     
client [98] (testset)   loss: 0.0062 -> 0.0105  accuracy: 100.00% -> 99.19%    
client [78] (testset)   loss: 0.1279 -> 0.0782  accuracy: 96.97% -> 96.97%     
---------------------------- TRAINING EPOCH: 340 ----------------------------  
client [92] (testset)   loss: 0.0854 -> 0.0852  accuracy: 97.60% -> 97.60%     
client [80] (testset)   loss: 0.0514 -> 0.0384  accuracy: 98.49% -> 98.11%     
client [63] (testset)   loss: 0.0018 -> 0.0033  accuracy: 100.00% -> 100.00%   
client [76] (testset)   loss: 0.0001 -> 0.0001  accuracy: 100.00% -> 100.00%   
client [78] (testset)   loss: 0.1357 -> 0.0773  accuracy: 96.36% -> 96.97%     
client [25] (testset)   loss: 0.0565 -> 0.0357  accuracy: 98.58% -> 99.05%     
client [58] (testset)   loss: 0.0054 -> 0.0079  accuracy: 100.00% -> 100.00%   
client [13] (testset)   loss: 0.1431 -> 0.1467  accuracy: 96.00% -> 96.80%     
client [17] (testset)   loss: 0.0322 -> 0.0333  accuracy: 99.13% -> 99.13%     
client [38] (testset)   loss: 0.0266 -> 0.0320  accuracy: 99.51% -> 99.51%     
---------------------------- TRAINING EPOCH: 350 ----------------------------  
client [72] (testset)   loss: 0.0150 -> 0.0150  accuracy: 99.20% -> 99.60%     
client [82] (testset)   loss: 0.0335 -> 0.0356  accuracy: 98.97% -> 98.97%     
client [86] (testset)   loss: 0.0018 -> 0.0042  accuracy: 100.00% -> 100.00%   
client [51] (testset)   loss: 0.0566 -> 0.0598  accuracy: 97.20% -> 97.20%     
client [96] (testset)   loss: 0.0743 -> 0.0548  accuracy: 98.09% -> 98.56%     
client [42] (testset)   loss: 0.0528 -> 0.0415  accuracy: 99.12% -> 99.12%     
client [55] (testset)   loss: 0.0377 -> 0.0162  accuracy: 97.98% -> 100.00%    
client [13] (testset)   loss: 0.1225 -> 0.1460  accuracy: 97.60% -> 97.60%     
client [1]  (testset)   loss: 0.0612 -> 0.0680  accuracy: 99.02% -> 99.02%     
client [12] (testset)   loss: 0.0041 -> 0.0112  accuracy: 100.00% -> 98.94%    
---------------------------- TRAINING EPOCH: 360 ----------------------------  
client [68] (testset)   loss: 0.0102 -> 0.0033  accuracy: 99.44% -> 100.00%    
client [23] (testset)   loss: 0.0502 -> 0.0392  accuracy: 98.92% -> 99.46%     
client [46] (testset)   loss: 0.0105 -> 0.0101  accuracy: 100.00% -> 100.00%   
client [41] (testset)   loss: 0.0084 -> 0.0179  accuracy: 99.40% -> 99.40%     
client [25] (testset)   loss: 0.0596 -> 0.0399  accuracy: 98.10% -> 99.05%     
client [58] (testset)   loss: 0.0053 -> 0.0052  accuracy: 100.00% -> 100.00%   
client [14] (testset)   loss: 0.2037 -> 0.1889  accuracy: 96.39% -> 96.39%     
client [33] (testset)   loss: 0.0366 -> 0.0616  accuracy: 99.29% -> 98.58%     
client [85] (testset)   loss: 0.0328 -> 0.0289  accuracy: 98.59% -> 98.59%     
client [62] (testset)   loss: 0.0292 -> 0.0275  accuracy: 99.46% -> 99.46%     
---------------------------- TRAINING EPOCH: 370 ----------------------------  
client [98] (testset)   loss: 0.0058 -> 0.0066  accuracy: 100.00% -> 100.00%   
client [63] (testset)   loss: 0.0021 -> 0.0030  accuracy: 100.00% -> 100.00%   
client [70] (testset)   loss: 0.0058 -> 0.0040  accuracy: 100.00% -> 100.00%   
client [65] (testset)   loss: 0.0440 -> 0.0766  accuracy: 98.24% -> 97.65%     
client [14] (testset)   loss: 0.1901 -> 0.1727  accuracy: 96.39% -> 96.39%     
client [73] (testset)   loss: 0.1400 -> 0.1452  accuracy: 97.92% -> 98.33%     
client [34] (testset)   loss: 0.0285 -> 0.0302  accuracy: 99.32% -> 97.97%     
client [99] (testset)   loss: 0.0356 -> 0.0274  accuracy: 98.32% -> 98.88%     
client [69] (testset)   loss: 0.0151 -> 0.0121  accuracy: 99.40% -> 99.40%     
client [46] (testset)   loss: 0.0113 -> 0.0080  accuracy: 100.00% -> 100.00%   
---------------------------- TRAINING EPOCH: 380 ----------------------------  
client [99] (testset)   loss: 0.0514 -> 0.0286  accuracy: 97.77% -> 98.32%     
client [93] (testset)   loss: 0.0143 -> 0.0150  accuracy: 99.21% -> 99.21%     
client [11] (testset)   loss: 0.0336 -> 0.0221  accuracy: 98.45% -> 98.45%     
client [58] (testset)   loss: 0.0048 -> 0.0064  accuracy: 100.00% -> 100.00%   
client [81] (testset)   loss: 0.1139 -> 0.1265  accuracy: 98.18% -> 97.27%     
client [85] (testset)   loss: 0.0381 -> 0.0339  accuracy: 98.59% -> 98.59%     
client [89] (testset)   loss: 0.0936 -> 0.0810  accuracy: 98.23% -> 98.23%     
client [45] (testset)   loss: 0.0372 -> 0.0386  accuracy: 99.62% -> 99.62%     
client [8]  (testset)   loss: 0.0401 -> 0.0514  accuracy: 98.78% -> 98.78%     
client [68] (testset)   loss: 0.0075 -> 0.0019  accuracy: 100.00% -> 100.00%   
---------------------------- TRAINING EPOCH: 390 ----------------------------  
client [67] (testset)   loss: 0.0419 -> 0.0518  accuracy: 98.29% -> 98.29%     
client [72] (testset)   loss: 0.0043 -> 0.0074  accuracy: 100.00% -> 99.60%    
client [1]  (testset)   loss: 0.0588 -> 0.0595  accuracy: 99.02% -> 99.02%     
client [78] (testset)   loss: 0.1289 -> 0.0757  accuracy: 96.97% -> 96.97%     
client [83] (testset)   loss: 0.0633 -> 0.0576  accuracy: 98.09% -> 98.56%     
client [21] (testset)   loss: 0.0351 -> 0.0269  accuracy: 99.12% -> 99.12%     
client [56] (testset)   loss: 0.0061 -> 0.0059  accuracy: 100.00% -> 99.47%    
client [44] (testset)   loss: 0.2375 -> 0.2062  accuracy: 98.19% -> 98.80%     
client [92] (testset)   loss: 0.0792 -> 0.0838  accuracy: 97.12% -> 96.63%     
client [27] (testset)   loss: 0.0418 -> 0.0523  accuracy: 98.82% -> 99.41%     
---------------------------- TRAINING EPOCH: 400 ----------------------------  
client [10] (testset)   loss: 0.0671 -> 0.0638  accuracy: 99.34% -> 98.68%     
client [39] (testset)   loss: 0.0043 -> 0.0089  accuracy: 100.00% -> 99.45%    
client [65] (testset)   loss: 0.0431 -> 0.0745  accuracy: 97.65% -> 97.65%     
client [26] (testset)   loss: 0.0408 -> 0.0233  accuracy: 98.31% -> 99.15%     
client [19] (testset)   loss: 0.0111 -> 0.0062  accuracy: 99.41% -> 100.00%    
client [68] (testset)   loss: 0.0087 -> 0.0018  accuracy: 99.44% -> 100.00%    
client [41] (testset)   loss: 0.0075 -> 0.0210  accuracy: 100.00% -> 98.81%    
client [50] (testset)   loss: 0.0738 -> 0.0443  accuracy: 97.89% -> 98.24%     
client [75] (testset)   loss: 0.0040 -> 0.0019  accuracy: 100.00% -> 100.00%   
client [81] (testset)   loss: 0.1167 -> 0.1309  accuracy: 97.27% -> 97.27%     
Training... ---------------------------------------- 100% 0:17:35
FedALA's average time taken by each global epoch: 0 min 2.59 sec.              
FedALA's total running time: 0 h 17 m 35 s.                                    
==================== FedALA Experiment Results: ====================           
Display format: (before local fine-tuning) -> (after local fine-tuning)        
 So if finetune_epoch = 0, x.xx% -> 0.00% is normal.                           
 Centralized testing ONLY happens after model aggregation, so the stats between
'->' are the same.                                                             
{                                                                              
    "100": {                                                                   
        "all_clients": {                                                       
            "test": {                                                          
                "loss": "0.0584 -> 0.0000",                                    
                "accuracy": "98.25% -> 0.00%"                                  
            }                                                                  
        }                                                                      
    },                                                                         
    "200": {                                                                   
        "all_clients": {                                                       
            "test": {                                                          
                "loss": "0.0503 -> 0.0000",                                    
                "accuracy": "98.58% -> 0.00%"                                  
            }                                                                  
        }                                                                      
    },                                                                         
    "300": {                                                                   
        "all_clients": {                                                       
            "test": {                                                          
                "loss": "0.0477 -> 0.0000",                                    
                "accuracy": "98.67% -> 0.00%"                                  
            }                                                                  
        }                                                                      
    },                                                                         
    "400": {                                                                   
        "all_clients": {                                                       
            "test": {                                                          
                "loss": "0.0460 -> 0.0000",                                    
                "accuracy": "98.81% -> 0.00%"                                  
            }                                                                  
        }                                                                      
    }                                                                          
}                                                                              
==================== FedALA Max Accuracy ====================                  
all_clients:                                                                   
(test) before fine-tuning: 98.81% at epoch 400                                 
(test) after fine-tuning: 0.00% at epoch 100                                   
[0m