==================== FedDpa ====================                               
Experiment Arguments:                                                          
{
│   'method': 'feddpa',
│   'dataset': {
│   │   'name': 'emnist',
│   │   'client_num': 100,
│   │   'test_ratio': 0.25,
│   │   'val_ratio': 0.0,
│   │   'seed': 42,
│   │   'split': 'sample',
│   │   'IID_ratio': 0.0,
│   │   'monitor_window_name_suffix': 'emnist-100clients-0%IID-Dir(1.0)-seed42',
│   │   'emnist_split': 'byclass',
│   │   'alpha': 1.0,
│   │   'min_samples_per_client': 10
│   },
│   'model': {
│   │   'name': 'avgcnn',
│   │   'use_torchvision_pretrained_weights': True,
│   │   'external_model_weights_path': None
│   },
│   'optimizer': {
│   │   'lr': 0.01,
│   │   'dampening': 0,
│   │   'weight_decay': 0,
│   │   'momentum': 0,
│   │   'nesterov': False,
│   │   'name': 'sgd'
│   },
│   'mode': 'serial',
│   'parallel': {
│   │   'ray_cluster_addr': None,
│   │   'num_cpus': None,
│   │   'num_gpus': None,
│   │   'num_workers': 2
│   },
│   'common': {
│   │   'seed': 42,
│   │   'join_ratio': 0.1,
│   │   'global_epoch': 400,
│   │   'local_epoch': 5,
│   │   'batch_size': 32,
│   │   'reset_optimizer_on_global_epoch': True,
│   │   'straggler_ratio': 0,
│   │   'straggler_min_local_epoch': 0,
│   │   'buffers': 'global',
│   │   'client_side_evaluation': True,
│   │   'test': {
│   │   │   'client': {
│   │   │   │   'interval': 100,
│   │   │   │   'finetune_epoch': 0,
│   │   │   │   'train': False,
│   │   │   │   'val': False,
│   │   │   │   'test': True
│   │   │   },
│   │   │   'server': {
│   │   │   │   'interval': -1,
│   │   │   │   'train': False,
│   │   │   │   'val': False,
│   │   │   │   'test': False,
│   │   │   │   'model_in_train_mode': False
│   │   │   }
│   │   },
│   │   'verbose_gap': 10,
│   │   'monitor': None,
│   │   'use_cuda': True,
│   │   'save_log': True,
│   │   'save_model': False,
│   │   'save_learning_curve_plot': False,
│   │   'save_metrics': True,
│   │   'delete_useless_run': True
│   },
│   'feddpa': {
│   │   'fisher_threshold': 0.4
│   }
}
---------------------------- TRAINING EPOCH: 10 ----------------------------   
client [77] (testset)   loss: 0.6299 -> 0.5451  accuracy: 79.57% -> 81.86%     
client [81] (testset)   loss: 0.7004 -> 0.5581  accuracy: 80.13% -> 84.34%     
client [21] (testset)   loss: 3.8278 -> 0.8037  accuracy: 26.28% -> 77.44%     
client [68] (testset)   loss: 0.6579 -> 0.5525  accuracy: 79.86% -> 82.60%     
client [93] (testset)   loss: 0.7564 -> 0.7115  accuracy: 77.15% -> 76.80%     
client [31] (testset)   loss: 1.4627 -> 0.7382  accuracy: 63.26% -> 75.54%     
client [20] (testset)   loss: 0.7370 -> 0.6919  accuracy: 75.88% -> 79.31%     
client [59] (testset)   loss: 3.8426 -> 0.4825  accuracy: 39.21% -> 86.40%     
client [48] (testset)   loss: 0.6019 -> 0.5923  accuracy: 82.09% -> 83.04%     
client [34] (testset)   loss: 0.6735 -> 0.5738  accuracy: 76.94% -> 81.10%     
---------------------------- TRAINING EPOCH: 20 ----------------------------   
client [69] (testset)   loss: 0.5958 -> 0.4988  accuracy: 82.58% -> 84.60%     
client [99] (testset)   loss: 1.0481 -> 0.7528  accuracy: 67.51% -> 76.67%     
client [67] (testset)   loss: 0.5387 -> 0.4506  accuracy: 84.91% -> 86.92%     
client [0]  (testset)   loss: 0.6003 -> 0.5646  accuracy: 81.51% -> 81.93%     
client [76] (testset)   loss: 0.6967 -> 0.6409  accuracy: 79.24% -> 80.59%     
client [41] (testset)   loss: 0.7057 -> 0.6879  accuracy: 75.42% -> 75.78%     
client [62] (testset)   loss: 3.7883 -> 0.5177  accuracy: 20.55% -> 85.72%     
client [2]  (testset)   loss: 3.7879 -> 0.6451  accuracy: 14.03% -> 80.91%     
client [14] (testset)   loss: 0.5954 -> 0.6620  accuracy: 80.78% -> 79.92%     
client [46] (testset)   loss: 0.5100 -> 0.5173  accuracy: 83.35% -> 81.96%     
---------------------------- TRAINING EPOCH: 30 ----------------------------   
client [24] (testset)   loss: 0.5914 -> 0.5601  accuracy: 79.94% -> 80.85%     
client [68] (testset)   loss: 0.5020 -> 0.6177  accuracy: 85.24% -> 84.20%     
client [57] (testset)   loss: 0.5179 -> 0.5049  accuracy: 83.70% -> 84.75%     
client [17] (testset)   loss: 0.6224 -> 0.6285  accuracy: 82.22% -> 81.79%     
client [54] (testset)   loss: 0.5946 -> 0.6219  accuracy: 78.95% -> 79.39%     
client [23] (testset)   loss: 3.7788 -> 0.6465  accuracy: 25.70% -> 81.35%     
client [35] (testset)   loss: 0.6478 -> 1.1427  accuracy: 80.41% -> 70.55%     
client [59] (testset)   loss: 0.4140 -> 0.5051  accuracy: 87.91% -> 82.96%     
client [31] (testset)   loss: 0.6802 -> 0.6797  accuracy: 80.30% -> 78.80%     
client [9]  (testset)   loss: 0.5494 -> 0.5744  accuracy: 82.01% -> 82.48%     
---------------------------- TRAINING EPOCH: 40 ----------------------------   
client [64] (testset)   loss: 0.5559 -> 0.6293  accuracy: 84.23% -> 84.23%     
client [33] (testset)   loss: 0.5668 -> 0.6605  accuracy: 83.25% -> 83.44%     
client [16] (testset)   loss: 0.6048 -> 0.7267  accuracy: 80.62% -> 77.78%     
client [44] (testset)   loss: 0.7190 -> 0.6431  accuracy: 75.88% -> 79.51%     
client [8]  (testset)   loss: 0.7663 -> 0.5821  accuracy: 82.04% -> 83.26%     
client [31] (testset)   loss: 0.9328 -> 0.8486  accuracy: 75.99% -> 79.55%     
client [47] (testset)   loss: 0.4349 -> 0.4840  accuracy: 86.16% -> 84.95%     
client [36] (testset)   loss: 0.8675 -> 0.3607  accuracy: 77.56% -> 88.55%     
client [20] (testset)   loss: 0.7003 -> 0.7530  accuracy: 80.33% -> 79.93%     
client [56] (testset)   loss: 0.5619 -> 0.5947  accuracy: 81.33% -> 80.57%     
---------------------------- TRAINING EPOCH: 50 ----------------------------   
client [4]  (testset)   loss: 0.5236 -> 0.4628  accuracy: 84.49% -> 85.81%     
client [60] (testset)   loss: 0.6012 -> 0.6198  accuracy: 82.71% -> 82.63%     
client [28] (testset)   loss: 0.4882 -> 0.5326  accuracy: 86.42% -> 85.97%     
client [25] (testset)   loss: 0.5924 -> 0.5432  accuracy: 78.45% -> 85.24%     
client [58] (testset)   loss: 0.5640 -> 0.7432  accuracy: 84.98% -> 77.10%     
client [44] (testset)   loss: 0.6186 -> 0.6214  accuracy: 79.26% -> 80.22%     
client [39] (testset)   loss: 0.6234 -> 0.6279  accuracy: 79.48% -> 80.38%     
client [29] (testset)   loss: 0.6604 -> 0.6547  accuracy: 81.13% -> 82.83%     
client [3]  (testset)   loss: 0.5221 -> 0.5696  accuracy: 83.63% -> 83.77%     
client [84] (testset)   loss: 0.6668 -> 0.6783  accuracy: 80.88% -> 81.92%     
---------------------------- TRAINING EPOCH: 60 ----------------------------   
client [21] (testset)   loss: 0.5866 -> 0.6306  accuracy: 82.01% -> 81.24%     
client [84] (testset)   loss: 0.6327 -> 1.0273  accuracy: 81.61% -> 76.36%     
client [10] (testset)   loss: 0.6714 -> 0.5763  accuracy: 82.48% -> 85.51%     
client [36] (testset)   loss: 0.3987 -> 0.4059  accuracy: 87.28% -> 87.69%     
client [65] (testset)   loss: 0.4829 -> 0.5285  accuracy: 86.60% -> 83.82%     
client [81] (testset)   loss: 1.1177 -> 0.5419  accuracy: 75.53% -> 85.75%     
client [79] (testset)   loss: 1.0352 -> 0.5764  accuracy: 83.34% -> 87.29%     
client [42] (testset)   loss: 0.5376 -> 0.6186  accuracy: 84.99% -> 83.13%     
client [11] (testset)   loss: 0.5623 -> 0.6285  accuracy: 84.43% -> 82.31%     
client [96] (testset)   loss: 0.4772 -> 0.4770  accuracy: 84.38% -> 84.14%     
---------------------------- TRAINING EPOCH: 70 ----------------------------   
client [8]  (testset)   loss: 0.7239 -> 0.6352  accuracy: 83.31% -> 83.59%     
client [53] (testset)   loss: 0.6577 -> 0.4853  accuracy: 75.97% -> 84.81%     
client [52] (testset)   loss: 0.5576 -> 0.5912  accuracy: 82.32% -> 83.82%     
client [42] (testset)   loss: 0.5595 -> 0.6222  accuracy: 85.05% -> 85.49%     
client [69] (testset)   loss: 0.5327 -> 0.5866  accuracy: 84.52% -> 84.76%     
client [59] (testset)   loss: 0.4844 -> 0.4641  accuracy: 85.43% -> 88.96%     
client [7]  (testset)   loss: 0.6053 -> 0.6927  accuracy: 81.84% -> 79.70%     
client [26] (testset)   loss: 0.3945 -> 0.4522  accuracy: 88.66% -> 88.18%     
client [49] (testset)   loss: 0.4688 -> 0.5283  accuracy: 83.78% -> 82.41%     
client [98] (testset)   loss: 0.6533 -> 0.6653  accuracy: 82.71% -> 83.48%     
---------------------------- TRAINING EPOCH: 80 ----------------------------   
client [98] (testset)   loss: 0.6364 -> 0.6613  accuracy: 84.07% -> 82.45%     
client [47] (testset)   loss: 0.4495 -> 0.4899  accuracy: 86.83% -> 85.37%     
client [21] (testset)   loss: 0.6267 -> 0.6925  accuracy: 81.47% -> 81.47%     
client [77] (testset)   loss: 0.5375 -> 0.6287  accuracy: 84.59% -> 81.04%     
client [95] (testset)   loss: 0.5176 -> 0.5607  accuracy: 87.73% -> 87.96%     
client [91] (testset)   loss: 0.7478 -> 0.7322  accuracy: 81.08% -> 80.23%     
client [14] (testset)   loss: 0.7362 -> 0.7056  accuracy: 81.28% -> 81.89%     
client [99] (testset)   loss: 0.6837 -> 0.7412  accuracy: 79.36% -> 79.15%     
client [20] (testset)   loss: 0.8393 -> 0.8534  accuracy: 78.86% -> 80.11%     
client [39] (testset)   loss: 0.5974 -> 0.6524  accuracy: 81.22% -> 81.33%     
---------------------------- TRAINING EPOCH: 90 ----------------------------   
client [52] (testset)   loss: 0.5465 -> 0.5834  accuracy: 83.70% -> 84.00%     
client [62] (testset)   loss: 0.5397 -> 0.5703  accuracy: 87.46% -> 86.48%     
client [71] (testset)   loss: 0.6830 -> 0.7464  accuracy: 82.48% -> 82.21%     
client [97] (testset)   loss: 0.6141 -> 0.6779  accuracy: 84.87% -> 83.67%     
client [30] (testset)   loss: 0.5836 -> 0.6240  accuracy: 84.22% -> 83.79%     
client [88] (testset)   loss: 0.5941 -> 0.5629  accuracy: 82.63% -> 83.88%     
client [60] (testset)   loss: 0.6368 -> 0.6603  accuracy: 83.40% -> 83.16%     
client [82] (testset)   loss: 0.5649 -> 0.5934  accuracy: 83.11% -> 83.75%     
client [91] (testset)   loss: 0.7301 -> 0.7759  accuracy: 80.17% -> 81.08%     
client [57] (testset)   loss: 0.5034 -> 0.5434  accuracy: 86.59% -> 85.89%     
---------------------------- TRAINING EPOCH: 100 ----------------------------  
client [31] (testset)   loss: 0.8337 -> 0.8995  accuracy: 81.40% -> 81.30%     
client [15] (testset)   loss: 0.6153 -> 0.6254  accuracy: 81.44% -> 79.96%     
client [71] (testset)   loss: 0.6985 -> 0.7330  accuracy: 82.53% -> 83.56%     
client [97] (testset)   loss: 0.6863 -> 0.7386  accuracy: 84.53% -> 84.10%     
client [53] (testset)   loss: 0.7089 -> 0.5801  accuracy: 81.15% -> 84.26%     
client [77] (testset)   loss: 0.6076 -> 0.6137  accuracy: 82.06% -> 84.27%     
client [76] (testset)   loss: 0.6429 -> 0.8469  accuracy: 83.69% -> 79.89%     
client [79] (testset)   loss: 0.5488 -> 0.4979  accuracy: 87.61% -> 88.98%     
client [28] (testset)   loss: 0.6294 -> 0.6617  accuracy: 87.01% -> 86.51%     
client [99] (testset)   loss: 0.7449 -> 0.7587  accuracy: 79.94% -> 79.67%     
---------------------------- TRAINING EPOCH: 110 ----------------------------  
client [97] (testset)   loss: 0.7461 -> 0.7825  accuracy: 82.47% -> 83.71%     
client [86] (testset)   loss: 0.5542 -> 0.5815  accuracy: 85.46% -> 86.42%     
client [34] (testset)   loss: 0.7321 -> 0.7603  accuracy: 81.37% -> 82.67%     
client [73] (testset)   loss: 0.6023 -> 0.6272  accuracy: 85.63% -> 85.91%     
client [5]  (testset)   loss: 0.4903 -> 0.5290  accuracy: 87.58% -> 87.39%     
client [96] (testset)   loss: 0.5687 -> 0.6834  accuracy: 84.50% -> 84.38%     
client [22] (testset)   loss: 0.6515 -> 0.6436  accuracy: 84.98% -> 85.44%     
client [60] (testset)   loss: 0.6674 -> 0.6981  accuracy: 83.28% -> 84.37%     
client [66] (testset)   loss: 0.5725 -> 0.5999  accuracy: 83.42% -> 83.00%     
client [83] (testset)   loss: 0.5375 -> 0.5887  accuracy: 86.14% -> 86.05%     
---------------------------- TRAINING EPOCH: 120 ----------------------------  
client [76] (testset)   loss: 0.7599 -> 0.7833  accuracy: 83.24% -> 83.44%     
client [65] (testset)   loss: 0.5314 -> 0.5667  accuracy: 84.91% -> 85.73%     
client [95] (testset)   loss: 0.6681 -> 0.6231  accuracy: 86.54% -> 87.77%     
client [17] (testset)   loss: 0.7620 -> 0.9338  accuracy: 83.03% -> 80.43%     
client [8]  (testset)   loss: 0.6600 -> 0.7024  accuracy: 84.76% -> 84.25%     
client [35] (testset)   loss: 0.8353 -> 1.0102  accuracy: 83.49% -> 81.39%     
client [98] (testset)   loss: 0.7321 -> 0.7325  accuracy: 82.28% -> 83.43%     
client [53] (testset)   loss: 0.5452 -> 0.5690  accuracy: 84.38% -> 86.09%     
client [43] (testset)   loss: 0.6922 -> 0.6871  accuracy: 84.04% -> 84.09%     
client [64] (testset)   loss: 0.6510 -> 0.6903  accuracy: 85.61% -> 84.69%     
---------------------------- TRAINING EPOCH: 130 ----------------------------  
client [21] (testset)   loss: 0.7031 -> 0.7444  accuracy: 81.60% -> 82.10%     
client [88] (testset)   loss: 0.6325 -> 0.7019  accuracy: 84.63% -> 83.78%     
client [38] (testset)   loss: 0.6521 -> 0.7439  accuracy: 84.22% -> 84.10%     
client [3]  (testset)   loss: 0.7518 -> 0.7804  accuracy: 83.05% -> 82.96%     
client [5]  (testset)   loss: 0.5431 -> 0.5468  accuracy: 87.32% -> 87.84%     
client [41] (testset)   loss: 0.7560 -> 0.7943  accuracy: 78.29% -> 78.65%     
client [7]  (testset)   loss: 0.6865 -> 0.7342  accuracy: 81.68% -> 80.59%     
client [37] (testset)   loss: 0.7361 -> 0.8606  accuracy: 80.82% -> 79.58%     
client [45] (testset)   loss: 0.5382 -> 0.5801  accuracy: 85.03% -> 84.01%     
client [47] (testset)   loss: 0.5333 -> 0.5812  accuracy: 85.28% -> 83.65%     
---------------------------- TRAINING EPOCH: 140 ----------------------------  
client [16] (testset)   loss: 0.8776 -> 0.9452  accuracy: 81.53% -> 79.44%     
client [11] (testset)   loss: 0.9737 -> 0.7822  accuracy: 78.31% -> 84.62%     
client [37] (testset)   loss: 0.8434 -> 0.8934  accuracy: 80.82% -> 78.66%     
client [41] (testset)   loss: 0.7606 -> 0.8108  accuracy: 78.97% -> 79.54%     
client [95] (testset)   loss: 0.6453 -> 0.7445  accuracy: 87.87% -> 86.63%     
client [53] (testset)   loss: 0.5493 -> 0.5661  accuracy: 86.57% -> 86.85%     
client [22] (testset)   loss: 0.6514 -> 0.6892  accuracy: 85.90% -> 85.33%     
client [25] (testset)   loss: 0.6609 -> 0.7085  accuracy: 84.96% -> 83.48%     
client [69] (testset)   loss: 0.6721 -> 0.7241  accuracy: 84.11% -> 85.25%     
client [46] (testset)   loss: 0.5287 -> 0.5444  accuracy: 86.34% -> 86.53%     
---------------------------- TRAINING EPOCH: 150 ----------------------------  
client [47] (testset)   loss: 0.6354 -> 0.6369  accuracy: 83.73% -> 83.94%     
client [69] (testset)   loss: 0.7324 -> 0.7152  accuracy: 84.60% -> 83.83%     
client [82] (testset)   loss: 0.6431 -> 0.7371  accuracy: 83.79% -> 82.34%     
client [45] (testset)   loss: 0.6100 -> 0.6188  accuracy: 83.13% -> 84.93%     
client [7]  (testset)   loss: 0.7077 -> 0.7862  accuracy: 81.16% -> 79.33%     
client [50] (testset)   loss: 0.5113 -> 0.5838  accuracy: 88.27% -> 87.06%     
client [35] (testset)   loss: 0.9198 -> 0.9438  accuracy: 83.12% -> 83.24%     
client [24] (testset)   loss: 0.7182 -> 0.7676  accuracy: 80.42% -> 80.50%     
client [15] (testset)   loss: 0.6608 -> 0.7201  accuracy: 81.84% -> 81.84%     
client [58] (testset)   loss: 0.7847 -> 0.8253  accuracy: 85.33% -> 84.15%     
---------------------------- TRAINING EPOCH: 160 ----------------------------  
client [48] (testset)   loss: 0.8049 -> 0.8522  accuracy: 83.19% -> 84.87%     
client [76] (testset)   loss: 0.8324 -> 0.8988  accuracy: 83.04% -> 83.34%     
client [67] (testset)   loss: 0.5214 -> 0.5593  accuracy: 88.38% -> 87.71%     
client [37] (testset)   loss: 0.8687 -> 0.9010  accuracy: 80.24% -> 79.45%     
client [58] (testset)   loss: 0.7914 -> 0.8189  accuracy: 85.29% -> 84.76%     
client [64] (testset)   loss: 0.7298 -> 0.7876  accuracy: 85.38% -> 85.90%     
client [77] (testset)   loss: 0.6746 -> 0.6978  accuracy: 84.91% -> 84.79%     
client [55] (testset)   loss: 0.6558 -> 0.7625  accuracy: 84.93% -> 83.47%     
client [12] (testset)   loss: 0.6310 -> 0.6768  accuracy: 86.91% -> 86.73%     
client [89] (testset)   loss: 0.8195 -> 0.8426  accuracy: 84.41% -> 84.22%     
---------------------------- TRAINING EPOCH: 170 ----------------------------  
client [84] (testset)   loss: 0.8927 -> 0.9008  accuracy: 83.38% -> 82.10%     
client [51] (testset)   loss: 1.0577 -> 1.0907  accuracy: 77.23% -> 77.43%     
client [8]  (testset)   loss: 0.7768 -> 0.8074  accuracy: 84.67% -> 84.58%     
client [18] (testset)   loss: 0.6572 -> 0.7195  accuracy: 84.03% -> 83.24%     
client [94] (testset)   loss: 0.7395 -> 0.7969  accuracy: 81.48% -> 80.61%     
client [81] (testset)   loss: 0.6043 -> 0.9414  accuracy: 87.26% -> 79.52%     
client [3]  (testset)   loss: 0.8742 -> 0.9144  accuracy: 83.54% -> 83.63%     
client [11] (testset)   loss: 0.8311 -> 0.8498  accuracy: 84.33% -> 84.03%     
client [95] (testset)   loss: 0.7133 -> 0.7331  accuracy: 87.77% -> 87.58%     
client [67] (testset)   loss: 0.5526 -> 0.5783  accuracy: 87.80% -> 88.01%     
---------------------------- TRAINING EPOCH: 180 ----------------------------  
client [21] (testset)   loss: 0.7686 -> 0.8121  accuracy: 80.79% -> 81.15%     
client [79] (testset)   loss: 0.6024 -> 0.6135  accuracy: 89.25% -> 89.03%     
client [58] (testset)   loss: 0.8064 -> 0.8355  accuracy: 84.72% -> 84.94%     
client [88] (testset)   loss: 0.6802 -> 0.7276  accuracy: 84.48% -> 84.43%     
client [46] (testset)   loss: 0.5838 -> 0.6139  accuracy: 86.28% -> 86.02%     
client [11] (testset)   loss: 0.8384 -> 0.8861  accuracy: 83.69% -> 82.21%     
client [55] (testset)   loss: 0.7608 -> 0.7913  accuracy: 84.98% -> 85.03%     
client [13] (testset)   loss: 0.6145 -> 0.6542  accuracy: 87.92% -> 87.76%     
client [31] (testset)   loss: 0.9605 -> 1.5051  accuracy: 81.40% -> 75.44%     
client [75] (testset)   loss: 0.8732 -> 0.8652  accuracy: 85.19% -> 85.14%     
---------------------------- TRAINING EPOCH: 190 ----------------------------  
client [19] (testset)   loss: 0.7629 -> 0.7844  accuracy: 84.89% -> 85.52%     
client [7]  (testset)   loss: 0.7701 -> 0.8492  accuracy: 82.16% -> 81.27%     
client [57] (testset)   loss: 0.6738 -> 0.6894  accuracy: 86.46% -> 86.89%     
client [13] (testset)   loss: 0.6226 -> 0.6622  accuracy: 87.87% -> 88.09%     
client [43] (testset)   loss: 0.7959 -> 0.8432  accuracy: 83.99% -> 82.55%     
client [91] (testset)   loss: 0.8752 -> 0.9003  accuracy: 81.08% -> 81.27%     
client [10] (testset)   loss: 0.7508 -> 0.7292  accuracy: 85.65% -> 85.70%     
client [64] (testset)   loss: 0.8358 -> 0.8625  accuracy: 85.32% -> 85.43%     
client [82] (testset)   loss: 0.7441 -> 0.7908  accuracy: 83.98% -> 83.39%     
client [22] (testset)   loss: 0.7404 -> 0.7931  accuracy: 85.38% -> 86.14%     
---------------------------- TRAINING EPOCH: 200 ----------------------------  
client [20] (testset)   loss: 1.0748 -> 1.1256  accuracy: 79.39% -> 78.50%     
client [23] (testset)   loss: 0.6963 -> 0.7854  accuracy: 84.20% -> 83.85%     
client [88] (testset)   loss: 0.7131 -> 0.7334  accuracy: 84.68% -> 83.83%     
client [98] (testset)   loss: 0.8713 -> 0.8509  accuracy: 83.69% -> 80.83%     
client [79] (testset)   loss: 0.6368 -> 0.6601  accuracy: 89.25% -> 89.38%     
client [21] (testset)   loss: 0.8229 -> 0.8906  accuracy: 82.28% -> 81.01%     
client [92] (testset)   loss: 0.8365 -> 7.0681  accuracy: 84.21% -> 58.40%     
client [56] (testset)   loss: 1.0453 -> 1.0391  accuracy: 80.16% -> 78.94%     
client [5]  (testset)   loss: 0.5959 -> 0.6378  accuracy: 87.39% -> 87.26%     
client [52] (testset)   loss: 0.6725 -> 0.8559  accuracy: 84.06% -> 80.89%     
---------------------------- TRAINING EPOCH: 210 ----------------------------  
client [67] (testset)   loss: 0.6411 -> 0.8579  accuracy: 87.42% -> 85.96%     
client [54] (testset)   loss: 0.9830 -> 1.0347  accuracy: 79.86% -> 79.39%     
client [14] (testset)   loss: 0.9952 -> 0.9864  accuracy: 80.48% -> 81.49%     
client [99] (testset)   loss: 1.1649 -> 1.6293  accuracy: 75.09% -> 72.35%     
client [36] (testset)   loss: 0.6164 -> 0.6281  accuracy: 88.49% -> 89.28%     
client [30] (testset)   loss: 0.7747 -> 0.8109  accuracy: 84.26% -> 83.06%     
client [38] (testset)   loss: 0.7683 -> 0.8094  accuracy: 84.46% -> 84.34%     
client [15] (testset)   loss: 0.7203 -> 0.7421  accuracy: 82.23% -> 81.24%     
client [6]  (testset)   loss: 0.7921 -> 0.8304  accuracy: 84.62% -> 84.56%     
client [53] (testset)   loss: 0.6837 -> 0.7105  accuracy: 86.13% -> 86.13%     
---------------------------- TRAINING EPOCH: 220 ----------------------------  
client [99] (testset)   loss: 1.0775 -> 1.1629  accuracy: 79.52% -> 78.52%     
client [6]  (testset)   loss: 0.8112 -> 0.8361  accuracy: 84.39% -> 83.95%     
client [83] (testset)   loss: 0.7101 -> 0.7488  accuracy: 86.41% -> 86.63%     
client [42] (testset)   loss: 0.8054 -> 0.8199  accuracy: 85.43% -> 85.21%     
client [34] (testset)   loss: 0.8482 -> 0.9239  accuracy: 81.97% -> 81.59%     
client [15] (testset)   loss: 0.7307 -> 0.7705  accuracy: 81.29% -> 80.36%     
client [47] (testset)   loss: 0.7600 -> 0.7935  accuracy: 84.91% -> 84.95%     
client [55] (testset)   loss: 0.8050 -> 0.8306  accuracy: 84.98% -> 84.88%     
client [51] (testset)   loss: 1.1172 -> 1.1606  accuracy: 76.33% -> 75.85%     
client [95] (testset)   loss: 2.3658 -> 0.7441  accuracy: 68.93% -> 87.01%     
---------------------------- TRAINING EPOCH: 230 ----------------------------  
client [71] (testset)   loss: 0.9282 -> 0.9763  accuracy: 82.21% -> 82.16%     
client [15] (testset)   loss: 0.7545 -> 0.7894  accuracy: 80.80% -> 81.74%     
client [33] (testset)   loss: 0.8030 -> 0.9373  accuracy: 83.93% -> 83.44%     
client [99] (testset)   loss: 1.0948 -> 1.4414  accuracy: 79.62% -> 79.52%     
client [90] (testset)   loss: 0.9630 -> 1.2158  accuracy: 79.34% -> 78.50%     
client [57] (testset)   loss: 0.7645 -> 0.7801  accuracy: 86.98% -> 87.29%     
client [27] (testset)   loss: 0.8584 -> 0.8938  accuracy: 82.08% -> 82.54%     
client [78] (testset)   loss: 0.7341 -> 0.7532  accuracy: 81.65% -> 83.18%     
client [36] (testset)   loss: 0.6306 -> 0.6472  accuracy: 88.73% -> 88.76%     
client [88] (testset)   loss: 0.7457 -> 0.7813  accuracy: 84.68% -> 84.48%     
---------------------------- TRAINING EPOCH: 240 ----------------------------  
client [70] (testset)   loss: 0.8943 -> 0.7710  accuracy: 83.41% -> 84.21%     
client [35] (testset)   loss: 1.0872 -> 1.0537  accuracy: 82.50% -> 82.75%     
client [16] (testset)   loss: 1.1641 -> 1.1982  accuracy: 80.42% -> 80.28%     
client [80] (testset)   loss: 0.8501 -> 0.9034  accuracy: 83.27% -> 83.91%     
client [38] (testset)   loss: 0.8315 -> 0.8738  accuracy: 84.16% -> 83.73%     
client [78] (testset)   loss: 0.7518 -> 0.8001  accuracy: 82.51% -> 81.88%     
client [68] (testset)   loss: 0.8153 -> 0.8099  accuracy: 84.85% -> 85.94%     
client [11] (testset)   loss: 0.9915 -> 0.9892  accuracy: 82.11% -> 83.59%     
client [64] (testset)   loss: 0.8894 -> 0.9212  accuracy: 85.84% -> 85.66%     
client [82] (testset)   loss: 0.8602 -> 0.8988  accuracy: 83.93% -> 83.61%     
---------------------------- TRAINING EPOCH: 250 ----------------------------  
client [30] (testset)   loss: 0.8757 -> 0.8833  accuracy: 83.58% -> 83.92%     
client [27] (testset)   loss: 0.8794 -> 0.9179  accuracy: 82.46% -> 82.08%     
client [74] (testset)   loss: 0.6479 -> 0.7524  accuracy: 86.80% -> 86.33%     
client [45] (testset)   loss: 0.8326 -> 0.8677  accuracy: 82.74% -> 83.96%     
client [6]  (testset)   loss: 0.8448 -> 0.8960  accuracy: 84.56% -> 84.39%     
client [36] (testset)   loss: 0.6493 -> 0.6668  accuracy: 88.87% -> 89.11%     
client [63] (testset)   loss: 0.6169 -> 0.6401  accuracy: 88.60% -> 87.92%     
client [76] (testset)   loss: 0.9899 -> 1.0151  accuracy: 83.19% -> 83.94%     
client [83] (testset)   loss: 0.7585 -> 0.8000  accuracy: 86.59% -> 86.23%     
client [86] (testset)   loss: 0.7900 -> 0.8168  accuracy: 85.15% -> 85.63%     
---------------------------- TRAINING EPOCH: 260 ----------------------------  
client [83] (testset)   loss: 0.7977 -> 0.8138  accuracy: 86.27% -> 86.00%     
client [99] (testset)   loss: 1.1625 -> 1.2227  accuracy: 79.41% -> 79.73%     
client [74] (testset)   loss: 0.6604 -> 0.6824  accuracy: 86.43% -> 87.16%     
client [73] (testset)   loss: 0.7807 -> 0.8133  accuracy: 85.96% -> 85.63%     
client [29] (testset)   loss: 0.9327 -> 1.0225  accuracy: 82.40% -> 79.74%     
client [92] (testset)   loss: 0.9430 -> 1.0223  accuracy: 83.21% -> 80.55%     
client [6]  (testset)   loss: 0.8436 -> 0.8922  accuracy: 84.23% -> 84.01%     
client [61] (testset)   loss: 0.8805 -> 0.8892  accuracy: 80.78% -> 81.31%     
client [21] (testset)   loss: 0.9479 -> 0.9745  accuracy: 80.79% -> 81.38%     
client [67] (testset)   loss: 0.6615 -> 0.6846  accuracy: 87.84% -> 88.05%     
---------------------------- TRAINING EPOCH: 270 ----------------------------  
client [83] (testset)   loss: 0.8090 -> 0.8132  accuracy: 86.14% -> 85.60%     
client [32] (testset)   loss: 0.9646 -> 1.0261  accuracy: 79.14% -> 79.59%     
client [95] (testset)   loss: 0.7639 -> 0.8024  accuracy: 87.82% -> 87.68%     
client [61] (testset)   loss: 0.9538 -> 0.9486  accuracy: 80.98% -> 80.65%     
client [27] (testset)   loss: 0.8889 -> 0.9032  accuracy: 82.88% -> 83.72%     
client [25] (testset)   loss: 0.8311 -> 0.8706  accuracy: 84.38% -> 84.14%     
client [68] (testset)   loss: 0.8445 -> 0.8850  accuracy: 85.44% -> 84.70%     
client [34] (testset)   loss: 0.9147 -> 0.9396  accuracy: 81.64% -> 81.43%     
client [71] (testset)   loss: 1.0043 -> 1.0598  accuracy: 82.21% -> 82.70%     
client [89] (testset)   loss: 0.9444 -> 0.9662  accuracy: 84.07% -> 84.07%     
---------------------------- TRAINING EPOCH: 280 ----------------------------  
client [78] (testset)   loss: 0.8543 -> 0.8748  accuracy: 82.10% -> 82.06%     
client [81] (testset)   loss: 0.7272 -> 0.7791  accuracy: 86.92% -> 86.70%     
client [51] (testset)   loss: 1.2881 -> 1.3668  accuracy: 75.78% -> 76.54%     
client [54] (testset)   loss: 1.1201 -> 1.1367  accuracy: 79.86% -> 79.98%     
client [65] (testset)   loss: 0.7909 -> 0.7936  accuracy: 86.39% -> 86.04%     
client [41] (testset)   loss: 1.1984 -> 1.1564  accuracy: 76.46% -> 77.04%     
client [11] (testset)   loss: 0.9927 -> 1.0486  accuracy: 83.74% -> 83.79%     
client [85] (testset)   loss: 0.6565 -> 0.6653  accuracy: 87.88% -> 88.06%     
client [12] (testset)   loss: 0.7784 -> 0.7778  accuracy: 85.60% -> 86.66%     
client [23] (testset)   loss: 0.8713 -> 0.9263  accuracy: 83.46% -> 83.63%     
---------------------------- TRAINING EPOCH: 290 ----------------------------  
client [16] (testset)   loss: 1.3005 -> 1.1173  accuracy: 77.22% -> 79.58%     
client [65] (testset)   loss: 0.8046 -> 0.8456  accuracy: 85.30% -> 86.78%     
client [53] (testset)   loss: 0.7863 -> 0.8082  accuracy: 84.77% -> 85.57%     
client [58] (testset)   loss: 0.8931 -> 1.4416  accuracy: 84.72% -> 76.84%     
client [72] (testset)   loss: 0.9008 -> 1.2169  accuracy: 83.67% -> 81.73%     
client [7]  (testset)   loss: 1.0019 -> 0.9583  accuracy: 81.11% -> 80.85%     
client [71] (testset)   loss: 1.0362 -> 1.0529  accuracy: 82.53% -> 82.70%     
client [59] (testset)   loss: 0.7191 -> 0.7212  accuracy: 89.55% -> 89.38%     
client [86] (testset)   loss: 1.2489 -> 0.8300  accuracy: 80.15% -> 85.37%     
client [39] (testset)   loss: 0.9664 -> 1.0455  accuracy: 81.78% -> 81.73%     
---------------------------- TRAINING EPOCH: 300 ----------------------------  
client [99] (testset)   loss: 1.2428 -> 1.2897  accuracy: 79.30% -> 79.46%     
client [7]  (testset)   loss: 0.9970 -> 0.9371  accuracy: 79.75% -> 80.01%     
client [17] (testset)   loss: 1.2397 -> 1.2408  accuracy: 82.39% -> 82.01%     
client [64] (testset)   loss: 0.9921 -> 1.0079  accuracy: 85.09% -> 84.92%     
client [37] (testset)   loss: 1.1463 -> 1.2378  accuracy: 80.24% -> 76.31%     
client [29] (testset)   loss: 0.9785 -> 1.0431  accuracy: 82.62% -> 82.46%     
client [93] (testset)   loss: 0.9751 -> 0.9914  accuracy: 81.71% -> 82.40%     
client [73] (testset)   loss: 0.8231 -> 0.8520  accuracy: 86.13% -> 85.79%     
client [40] (testset)   loss: 1.0306 -> 1.0341  accuracy: 77.50% -> 76.89%     
client [76] (testset)   loss: 1.0547 -> 1.0660  accuracy: 83.89% -> 83.59%     
---------------------------- TRAINING EPOCH: 310 ----------------------------  
client [31] (testset)   loss: 1.2378 -> 1.3090  accuracy: 80.50% -> 80.40%     
client [89] (testset)   loss: 0.8792 -> 0.8945  accuracy: 83.64% -> 83.20%     
client [77] (testset)   loss: 0.9334 -> 0.9590  accuracy: 84.63% -> 85.07%     
client [90] (testset)   loss: 1.2436 -> 1.3143  accuracy: 78.40% -> 78.25%     
client [26] (testset)   loss: 0.6469 -> 0.6428  accuracy: 87.17% -> 87.94%     
client [50] (testset)   loss: 0.7415 -> 0.7719  accuracy: 87.26% -> 87.56%     
client [30] (testset)   loss: 0.9190 -> 0.9532  accuracy: 83.83% -> 84.05%     
client [70] (testset)   loss: 0.8966 -> 0.9206  accuracy: 84.81% -> 84.45%     
client [41] (testset)   loss: 1.1508 -> 1.1901  accuracy: 77.82% -> 77.61%     
client [99] (testset)   loss: 1.2710 -> 2.4778  accuracy: 79.36% -> 72.25%     
---------------------------- TRAINING EPOCH: 320 ----------------------------  
client [68] (testset)   loss: 0.8923 -> 0.9201  accuracy: 85.24% -> 85.09%     
client [70] (testset)   loss: 0.9144 -> 0.9357  accuracy: 84.45% -> 84.53%     
client [52] (testset)   loss: 0.8495 -> 0.8497  accuracy: 83.88% -> 83.70%     
client [1]  (testset)   loss: 0.8540 -> 0.8631  accuracy: 85.80% -> 85.96%     
client [2]  (testset)   loss: 0.8286 -> 0.8689  accuracy: 86.43% -> 86.23%     
client [67] (testset)   loss: 0.6877 -> 0.7330  accuracy: 87.80% -> 88.05%     
client [92] (testset)   loss: 1.0876 -> 1.1143  accuracy: 83.36% -> 82.86%     
client [35] (testset)   loss: 1.1201 -> 1.0225  accuracy: 80.71% -> 81.58%     
client [36] (testset)   loss: 0.7009 -> 0.6089  accuracy: 88.90% -> 88.45%     
client [64] (testset)   loss: 1.0148 -> 0.9952  accuracy: 85.72% -> 85.26%     
---------------------------- TRAINING EPOCH: 330 ----------------------------  
client [44] (testset)   loss: 1.1079 -> 1.1371  accuracy: 79.90% -> 79.45%     
client [6]  (testset)   loss: 0.8875 -> 0.9370  accuracy: 84.01% -> 84.39%     
client [12] (testset)   loss: 0.8134 -> 0.8333  accuracy: 86.35% -> 86.35%     
client [55] (testset)   loss: 0.9121 -> 0.9130  accuracy: 84.46% -> 84.77%     
client [29] (testset)   loss: 1.0759 -> 1.1593  accuracy: 82.24% -> 80.81%     
client [9]  (testset)   loss: 1.0473 -> 1.0666  accuracy: 82.48% -> 82.65%     
client [43] (testset)   loss: 0.9391 -> 0.9668  accuracy: 83.24% -> 83.49%     
client [77] (testset)   loss: 0.9525 -> 0.9719  accuracy: 85.30% -> 84.87%     
client [98] (testset)   loss: 1.0254 -> 1.1894  accuracy: 83.35% -> 83.35%     
client [78] (testset)   loss: 0.9573 -> 0.9690  accuracy: 81.47% -> 82.15%     
---------------------------- TRAINING EPOCH: 340 ----------------------------  
client [92] (testset)   loss: 1.1450 -> 1.1437  accuracy: 83.66% -> 82.91%     
client [80] (testset)   loss: 0.9723 -> 0.9106  accuracy: 84.36% -> 82.72%     
client [63] (testset)   loss: 0.6892 -> 0.6992  accuracy: 88.66% -> 88.15%     
client [76] (testset)   loss: 1.0818 -> 1.1085  accuracy: 83.49% -> 83.24%     
client [78] (testset)   loss: 0.9545 -> 0.9891  accuracy: 82.01% -> 82.15%     
client [25] (testset)   loss: 0.8326 -> 0.8455  accuracy: 84.01% -> 84.75%     
client [58] (testset)   loss: 0.9906 -> 1.0387  accuracy: 84.59% -> 84.46%     
client [13] (testset)   loss: 0.7846 -> 0.7947  accuracy: 87.48% -> 87.65%     
client [17] (testset)   loss: 1.1158 -> 1.1763  accuracy: 82.09% -> 82.09%     
client [38] (testset)   loss: 0.9663 -> 0.9746  accuracy: 84.16% -> 84.34%     
---------------------------- TRAINING EPOCH: 350 ----------------------------  
client [72] (testset)   loss: 1.0630 -> 1.0732  accuracy: 83.01% -> 83.05%     
client [82] (testset)   loss: 1.0068 -> 1.0318  accuracy: 83.57% -> 83.30%     
client [86] (testset)   loss: 0.8797 -> 0.9274  accuracy: 85.42% -> 85.72%     
client [51] (testset)   loss: 1.5241 -> 1.2988  accuracy: 77.23% -> 76.88%     
client [96] (testset)   loss: 0.9206 -> 0.9350  accuracy: 84.66% -> 84.90%     
client [42] (testset)   loss: 0.9416 -> 0.9548  accuracy: 85.21% -> 84.99%     
client [55] (testset)   loss: 0.9240 -> 0.8359  accuracy: 83.73% -> 84.25%     
client [13] (testset)   loss: 0.8087 -> 0.8639  accuracy: 87.92% -> 87.87%     
client [1]  (testset)   loss: 0.8703 -> 0.8855  accuracy: 85.96% -> 85.90%     
client [12] (testset)   loss: 0.8184 -> 0.8477  accuracy: 86.41% -> 86.79%     
---------------------------- TRAINING EPOCH: 360 ----------------------------  
client [68] (testset)   loss: 0.9343 -> 0.9473  accuracy: 85.14% -> 85.49%     
client [23] (testset)   loss: 0.9870 -> 1.0463  accuracy: 83.57% -> 82.89%     
client [46] (testset)   loss: 0.7977 -> 0.8556  accuracy: 85.51% -> 84.82%     
client [41] (testset)   loss: 1.1980 -> 1.2641  accuracy: 77.92% -> 77.71%     
client [25] (testset)   loss: 0.8939 -> 0.8985  accuracy: 84.59% -> 84.79%     
client [58] (testset)   loss: 1.0367 -> 1.0627  accuracy: 84.85% -> 84.59%     
client [14] (testset)   loss: 1.1187 -> 1.1495  accuracy: 80.78% -> 80.22%     
client [33] (testset)   loss: 0.9990 -> 1.0729  accuracy: 84.18% -> 82.32%     
client [85] (testset)   loss: 0.6914 -> 0.7320  accuracy: 88.06% -> 87.32%     
client [62] (testset)   loss: 0.7759 -> 0.8073  accuracy: 87.93% -> 87.99%     
---------------------------- TRAINING EPOCH: 370 ----------------------------  
client [98] (testset)   loss: 1.0785 -> 1.1122  accuracy: 81.30% -> 82.88%     
client [63] (testset)   loss: 0.7133 -> 0.7447  accuracy: 88.34% -> 88.79%     
client [70] (testset)   loss: 0.9734 -> 0.9915  accuracy: 84.88% -> 84.81%     
client [65] (testset)   loss: 0.8156 -> 0.8601  accuracy: 85.73% -> 84.69%     
client [14] (testset)   loss: 1.1318 -> 1.1746  accuracy: 80.63% -> 80.02%     
client [73] (testset)   loss: 0.8460 -> 0.8748  accuracy: 85.96% -> 86.24%     
client [34] (testset)   loss: 1.0532 -> 1.1102  accuracy: 80.94% -> 80.62%     
client [99] (testset)   loss: 1.2923 -> 1.3741  accuracy: 78.94% -> 78.94%     
client [69] (testset)   loss: 1.0220 -> 1.0498  accuracy: 84.72% -> 84.40%     
client [46] (testset)   loss: 0.8414 -> 0.8163  accuracy: 84.43% -> 86.34%     
---------------------------- TRAINING EPOCH: 380 ----------------------------  
client [99] (testset)   loss: 1.3685 -> 1.3914  accuracy: 79.20% -> 78.78%     
client [93] (testset)   loss: 1.0545 -> 1.1453  accuracy: 81.53% -> 80.38%     
client [11] (testset)   loss: 1.1105 -> 1.1426  accuracy: 83.54% -> 83.24%     
client [58] (testset)   loss: 1.0836 -> 1.1012  accuracy: 84.76% -> 84.81%     
client [81] (testset)   loss: 0.8205 -> 0.8000  accuracy: 87.21% -> 86.53%     
client [85] (testset)   loss: 0.7225 -> 0.7166  accuracy: 87.82% -> 87.88%     
client [89] (testset)   loss: 0.9828 -> 0.9980  accuracy: 84.17% -> 84.17%     
client [45] (testset)   loss: 0.9358 -> 0.9701  accuracy: 84.64% -> 84.83%     
client [8]  (testset)   loss: 0.9862 -> 1.0009  accuracy: 84.15% -> 84.67%     
client [68] (testset)   loss: 0.9426 -> 0.9732  accuracy: 85.39% -> 85.49%     
---------------------------- TRAINING EPOCH: 390 ----------------------------  
client [67] (testset)   loss: 0.7721 -> 0.7776  accuracy: 88.01% -> 88.05%     
client [72] (testset)   loss: 1.0379 -> 1.0686  accuracy: 82.61% -> 82.97%     
client [1]  (testset)   loss: 0.9095 -> 0.9253  accuracy: 85.90% -> 85.80%     
client [78] (testset)   loss: 1.0794 -> 1.0976  accuracy: 81.47% -> 81.92%     
client [83] (testset)   loss: 0.9214 -> 0.9470  accuracy: 86.18% -> 86.18%     
client [21] (testset)   loss: 1.0404 -> 1.0780  accuracy: 80.65% -> 81.24%     
client [56] (testset)   loss: 1.4254 -> 1.4320  accuracy: 79.89% -> 79.53%     
client [44] (testset)   loss: 1.3041 -> 1.2962  accuracy: 78.17% -> 79.00%     
client [92] (testset)   loss: 1.1908 -> 1.2365  accuracy: 83.76% -> 83.61%     
client [27] (testset)   loss: 1.0137 -> 1.0762  accuracy: 81.74% -> 83.55%     
---------------------------- TRAINING EPOCH: 400 ----------------------------  
client [10] (testset)   loss: 0.9388 -> 0.9552  accuracy: 85.94% -> 85.65%     
client [39] (testset)   loss: 1.0922 -> 1.0797  accuracy: 80.38% -> 81.50%     
client [65] (testset)   loss: 0.8919 -> 0.9187  accuracy: 86.43% -> 84.91%     
client [26] (testset)   loss: 0.7200 -> 0.6866  accuracy: 86.07% -> 87.41%     
client [19] (testset)   loss: 0.9416 -> 0.9620  accuracy: 85.70% -> 85.65%     
client [68] (testset)   loss: 0.9772 -> 1.0080  accuracy: 85.44% -> 85.19%     
client [41] (testset)   loss: 1.3103 -> 1.3810  accuracy: 77.97% -> 75.89%     
client [50] (testset)   loss: 0.8552 -> 2.3496  accuracy: 88.02% -> 71.79%     
client [75] (testset)   loss: 1.0587 -> 0.9685  accuracy: 84.66% -> 84.76%     
client [81] (testset)   loss: 0.7298 -> 0.7771  accuracy: 86.59% -> 86.42%     
Training... ---------------------------------------- 100% 10:55:00
FedDpa's average time taken by each global epoch: 1 min 31.26 sec.             
FedDpa's total running time: 10 h 55 m 0 s.                                    
==================== FedDpa Experiment Results: ====================           
Display format: (before local fine-tuning) -> (after local fine-tuning)        
 So if finetune_epoch = 0, x.xx% -> 0.00% is normal.                           
 Centralized testing ONLY happens after model aggregation, so the stats between
'->' are the same.                                                             
{                                                                              
    "100": {                                                                   
        "all_clients": {                                                       
            "test": {                                                          
                "loss": "0.6151 -> 0.0000",                                    
                "accuracy": "84.02% -> 0.00%"                                  
            }                                                                  
        }                                                                      
    },                                                                         
    "200": {                                                                   
        "all_clients": {                                                       
            "test": {                                                          
                "loss": "0.8539 -> 0.0000",                                    
                "accuracy": "83.67% -> 0.00%"                                  
            }                                                                  
        }                                                                      
    },                                                                         
    "300": {                                                                   
        "all_clients": {                                                       
            "test": {                                                          
                "loss": "0.9335 -> 0.0000",                                    
                "accuracy": "83.69% -> 0.00%"                                  
            }                                                                  
        }                                                                      
    },                                                                         
    "400": {                                                                   
        "all_clients": {                                                       
            "test": {                                                          
                "loss": "1.0313 -> 0.0000",                                    
                "accuracy": "83.61% -> 0.00%"                                  
            }                                                                  
        }                                                                      
    }                                                                          
}                                                                              
==================== FedDpa Max Accuracy ====================                  
all_clients:                                                                   
(test) before fine-tuning: 84.02% at epoch 100                                 
(test) after fine-tuning: 0.00% at epoch 100                                   
[0m