==================== FedPer ====================                               
Experiment Arguments:                                                          
{
│   'method': 'fedper',
│   'dataset': {
│   │   'name': 'mnist',
│   │   'client_num': 100,
│   │   'test_ratio': 0.25,
│   │   'val_ratio': 0.0,
│   │   'seed': 42,
│   │   'split': 'sample',
│   │   'IID_ratio': 0.0,
│   │   'monitor_window_name_suffix': 'mnist-100clients-0%IID-Dir(1.0)-seed42',
│   │   'alpha': 1.0,
│   │   'min_samples_per_client': 10
│   },
│   'model': {
│   │   'name': 'avgcnn',
│   │   'use_torchvision_pretrained_weights': True,
│   │   'external_model_weights_path': None
│   },
│   'optimizer': {
│   │   'lr': 0.01,
│   │   'dampening': 0,
│   │   'weight_decay': 0,
│   │   'momentum': 0,
│   │   'nesterov': False,
│   │   'name': 'sgd'
│   },
│   'mode': 'serial',
│   'parallel': {
│   │   'ray_cluster_addr': None,
│   │   'num_cpus': None,
│   │   'num_gpus': None,
│   │   'num_workers': 2
│   },
│   'common': {
│   │   'seed': 42,
│   │   'join_ratio': 0.1,
│   │   'global_epoch': 400,
│   │   'local_epoch': 5,
│   │   'batch_size': 32,
│   │   'reset_optimizer_on_global_epoch': True,
│   │   'straggler_ratio': 0,
│   │   'straggler_min_local_epoch': 0,
│   │   'buffers': 'global',
│   │   'client_side_evaluation': True,
│   │   'test': {
│   │   │   'client': {
│   │   │   │   'interval': 100,
│   │   │   │   'finetune_epoch': 0,
│   │   │   │   'train': False,
│   │   │   │   'val': False,
│   │   │   │   'test': True
│   │   │   },
│   │   │   'server': {
│   │   │   │   'interval': -1,
│   │   │   │   'train': False,
│   │   │   │   'val': False,
│   │   │   │   'test': False,
│   │   │   │   'model_in_train_mode': False
│   │   │   }
│   │   },
│   │   'verbose_gap': 10,
│   │   'monitor': None,
│   │   'use_cuda': True,
│   │   'save_log': True,
│   │   'save_model': False,
│   │   'save_learning_curve_plot': False,
│   │   'save_metrics': True,
│   │   'delete_useless_run': True
│   }
}
---------------------------- TRAINING EPOCH: 10 ----------------------------   
client [77] (testset)   loss: 0.1584 -> 0.1639  accuracy: 95.58% -> 95.98%     
client [81] (testset)   loss: 0.2572 -> 0.2513  accuracy: 93.64% -> 94.55%     
client [21] (testset)   loss: 0.2345 -> 0.1681  accuracy: 93.81% -> 92.92%     
client [68] (testset)   loss: 0.0881 -> 0.0813  accuracy: 98.33% -> 97.78%     
client [93] (testset)   loss: 0.1606 -> 0.1630  accuracy: 96.43% -> 95.24%     
client [31] (testset)   loss: 0.2083 -> 0.1837  accuracy: 95.54% -> 92.86%     
client [20] (testset)   loss: 0.1534 -> 0.1647  accuracy: 94.74% -> 93.86%     
client [59] (testset)   loss: 0.1756 -> 0.1838  accuracy: 94.27% -> 93.23%     
client [48] (testset)   loss: 0.1070 -> 0.0981  accuracy: 94.33% -> 94.33%     
client [34] (testset)   loss: 0.1290 -> 0.1607  accuracy: 95.95% -> 95.27%     
---------------------------- TRAINING EPOCH: 20 ----------------------------   
client [69] (testset)   loss: 0.1175 -> 0.1231  accuracy: 93.98% -> 94.58%     
client [99] (testset)   loss: 0.1686 -> 0.2101  accuracy: 93.85% -> 91.62%     
client [67] (testset)   loss: 0.1612 -> 0.1912  accuracy: 97.44% -> 95.73%     
client [0]  (testset)   loss: 0.1058 -> 0.1269  accuracy: 96.46% -> 95.45%     
client [76] (testset)   loss: 0.0140 -> 0.0114  accuracy: 100.00% -> 100.00%   
client [41] (testset)   loss: 0.1153 -> 0.1131  accuracy: 95.24% -> 96.43%     
client [62] (testset)   loss: 0.0710 -> 0.0585  accuracy: 97.84% -> 97.84%     
client [2]  (testset)   loss: 0.0905 -> 0.0703  accuracy: 96.85% -> 96.85%     
client [14] (testset)   loss: 0.2311 -> 0.2963  accuracy: 92.77% -> 90.36%     
client [46] (testset)   loss: 0.1221 -> 0.1122  accuracy: 94.74% -> 96.99%     
---------------------------- TRAINING EPOCH: 30 ----------------------------   
client [24] (testset)   loss: 0.0764 -> 0.0876  accuracy: 97.37% -> 96.49%     
client [68] (testset)   loss: 0.0417 -> 0.0512  accuracy: 98.89% -> 98.33%     
client [57] (testset)   loss: 0.1765 -> 0.1853  accuracy: 94.01% -> 93.55%     
client [17] (testset)   loss: 0.0932 -> 0.1067  accuracy: 96.51% -> 95.63%     
client [54] (testset)   loss: 0.1486 -> 0.1587  accuracy: 94.38% -> 96.07%     
client [23] (testset)   loss: 0.0986 -> 0.1081  accuracy: 97.85% -> 97.31%     
client [35] (testset)   loss: 0.0390 -> 0.0351  accuracy: 98.80% -> 99.40%     
client [59] (testset)   loss: 0.0959 -> 0.1077  accuracy: 96.88% -> 95.31%     
client [31] (testset)   loss: 0.0752 -> 0.1741  accuracy: 98.21% -> 92.86%     
client [9]  (testset)   loss: 0.0689 -> 0.0516  accuracy: 96.26% -> 98.13%     
---------------------------- TRAINING EPOCH: 40 ----------------------------   
client [64] (testset)   loss: 0.0533 -> 0.0749  accuracy: 98.34% -> 97.51%     
client [33] (testset)   loss: 0.1353 -> 0.1400  accuracy: 96.45% -> 97.16%     
client [16] (testset)   loss: 0.0801 -> 0.0858  accuracy: 96.35% -> 95.89%     
client [44] (testset)   loss: 0.1659 -> 0.1400  accuracy: 97.59% -> 98.19%     
client [8]  (testset)   loss: 0.0610 -> 0.0757  accuracy: 99.39% -> 98.78%     
client [31] (testset)   loss: 0.1031 -> 0.0931  accuracy: 97.32% -> 98.21%     
client [47] (testset)   loss: 0.0744 -> 0.0737  accuracy: 98.38% -> 98.38%     
client [36] (testset)   loss: 0.0393 -> 0.0553  accuracy: 99.45% -> 97.81%     
client [20] (testset)   loss: 0.0697 -> 0.0757  accuracy: 97.81% -> 96.93%     
client [56] (testset)   loss: 0.0878 -> 0.0931  accuracy: 97.37% -> 96.84%     
---------------------------- TRAINING EPOCH: 50 ----------------------------   
client [4]  (testset)   loss: 0.1210 -> 0.1165  accuracy: 97.71% -> 97.71%     
client [60] (testset)   loss: 0.0655 -> 0.0886  accuracy: 97.83% -> 96.74%     
client [28] (testset)   loss: 0.0581 -> 0.0800  accuracy: 97.81% -> 96.35%     
client [25] (testset)   loss: 0.0933 -> 0.0926  accuracy: 97.16% -> 97.16%     
client [58] (testset)   loss: 0.0355 -> 0.0346  accuracy: 98.46% -> 97.95%     
client [44] (testset)   loss: 0.1484 -> 0.1487  accuracy: 98.19% -> 98.19%     
client [39] (testset)   loss: 0.0376 -> 0.0515  accuracy: 98.35% -> 97.80%     
client [29] (testset)   loss: 0.0516 -> 0.0483  accuracy: 97.39% -> 97.39%     
client [3]  (testset)   loss: 0.2514 -> 0.2359  accuracy: 94.35% -> 94.78%     
client [84] (testset)   loss: 0.0612 -> 0.0632  accuracy: 97.65% -> 98.24%     
---------------------------- TRAINING EPOCH: 60 ----------------------------   
client [21] (testset)   loss: 0.0461 -> 0.0541  accuracy: 98.23% -> 98.23%     
client [84] (testset)   loss: 0.0621 -> 0.0643  accuracy: 97.65% -> 98.82%     
client [10] (testset)   loss: 0.0905 -> 0.0839  accuracy: 96.03% -> 97.35%     
client [36] (testset)   loss: 0.0586 -> 0.0719  accuracy: 98.91% -> 97.81%     
client [65] (testset)   loss: 0.1304 -> 0.1227  accuracy: 94.71% -> 94.71%     
client [81] (testset)   loss: 0.1827 -> 0.1985  accuracy: 97.27% -> 96.36%     
client [79] (testset)   loss: 0.0286 -> 0.0455  accuracy: 98.92% -> 97.85%     
client [42] (testset)   loss: 0.1305 -> 0.1414  accuracy: 94.74% -> 93.86%     
client [11] (testset)   loss: 0.0648 -> 0.0785  accuracy: 98.97% -> 97.94%     
client [96] (testset)   loss: 0.0730 -> 0.0782  accuracy: 98.09% -> 97.61%     
---------------------------- TRAINING EPOCH: 70 ----------------------------   
client [8]  (testset)   loss: 0.0723 -> 0.0811  accuracy: 98.78% -> 98.17%     
client [53] (testset)   loss: 0.1016 -> 0.0952  accuracy: 97.32% -> 96.43%     
client [52] (testset)   loss: 0.1098 -> 0.1312  accuracy: 98.17% -> 98.17%     
client [42] (testset)   loss: 0.1345 -> 0.1380  accuracy: 94.74% -> 93.86%     
client [69] (testset)   loss: 0.0567 -> 0.0598  accuracy: 96.99% -> 96.99%     
client [59] (testset)   loss: 0.0854 -> 0.0945  accuracy: 96.35% -> 97.40%     
client [7]  (testset)   loss: 0.0636 -> 0.0571  accuracy: 98.21% -> 98.81%     
client [26] (testset)   loss: 0.1311 -> 0.0669  accuracy: 95.34% -> 98.31%     
client [49] (testset)   loss: 0.0230 -> 0.0212  accuracy: 99.38% -> 99.38%     
client [98] (testset)   loss: 0.0893 -> 0.0957  accuracy: 95.93% -> 95.12%     
---------------------------- TRAINING EPOCH: 80 ----------------------------   
client [98] (testset)   loss: 0.0885 -> 0.0881  accuracy: 95.12% -> 95.93%     
client [47] (testset)   loss: 0.0669 -> 0.0722  accuracy: 98.38% -> 99.19%     
client [21] (testset)   loss: 0.0366 -> 0.0445  accuracy: 98.23% -> 97.35%     
client [77] (testset)   loss: 0.0764 -> 0.0843  accuracy: 97.59% -> 97.59%     
client [95] (testset)   loss: 0.1166 -> 0.1206  accuracy: 97.07% -> 97.07%     
client [91] (testset)   loss: 0.1060 -> 0.1100  accuracy: 97.00% -> 97.00%     
client [14] (testset)   loss: 0.2384 -> 0.2528  accuracy: 91.57% -> 91.57%     
client [99] (testset)   loss: 0.1461 -> 0.1485  accuracy: 93.85% -> 94.97%     
client [20] (testset)   loss: 0.0688 -> 0.0705  accuracy: 98.25% -> 98.25%     
client [39] (testset)   loss: 0.0363 -> 0.0512  accuracy: 98.35% -> 98.35%     
---------------------------- TRAINING EPOCH: 90 ----------------------------   
client [52] (testset)   loss: 0.1237 -> 0.1317  accuracy: 98.17% -> 98.17%     
client [62] (testset)   loss: 0.0443 -> 0.0475  accuracy: 98.92% -> 98.92%     
client [71] (testset)   loss: 0.1184 -> 0.1270  accuracy: 96.86% -> 96.86%     
client [97] (testset)   loss: 0.1132 -> 0.1203  accuracy: 96.64% -> 96.64%     
client [30] (testset)   loss: 0.0631 -> 0.0731  accuracy: 97.78% -> 97.33%     
client [88] (testset)   loss: 0.0935 -> 0.1094  accuracy: 97.92% -> 97.58%     
client [60] (testset)   loss: 0.0670 -> 0.0771  accuracy: 97.46% -> 97.46%     
client [82] (testset)   loss: 0.0756 -> 0.0757  accuracy: 98.97% -> 98.97%     
client [91] (testset)   loss: 0.1073 -> 0.1094  accuracy: 97.00% -> 97.00%     
client [57] (testset)   loss: 0.1694 -> 0.1697  accuracy: 95.85% -> 95.85%     
---------------------------- TRAINING EPOCH: 100 ----------------------------  
client [31] (testset)   loss: 0.0738 -> 0.0781  accuracy: 98.21% -> 99.11%     
client [15] (testset)   loss: 0.0765 -> 0.0755  accuracy: 97.04% -> 96.06%     
client [71] (testset)   loss: 0.1131 -> 0.1199  accuracy: 96.86% -> 96.86%     
client [97] (testset)   loss: 0.1167 -> 0.1180  accuracy: 96.64% -> 96.64%     
client [53] (testset)   loss: 0.0983 -> 0.1094  accuracy: 96.43% -> 96.43%     
client [77] (testset)   loss: 0.0768 -> 0.0869  accuracy: 97.19% -> 97.19%     
client [76] (testset)   loss: 0.0014 -> 0.0014  accuracy: 100.00% -> 100.00%   
client [79] (testset)   loss: 0.0331 -> 0.0353  accuracy: 99.28% -> 99.28%     
client [28] (testset)   loss: 0.0741 -> 0.0771  accuracy: 95.62% -> 95.62%     
client [99] (testset)   loss: 0.1394 -> 0.1523  accuracy: 95.53% -> 94.97%     
---------------------------- TRAINING EPOCH: 110 ----------------------------  
client [97] (testset)   loss: 0.1172 -> 0.1279  accuracy: 96.64% -> 96.64%     
client [86] (testset)   loss: 0.0211 -> 0.0185  accuracy: 99.25% -> 99.25%     
client [34] (testset)   loss: 0.0733 -> 0.0703  accuracy: 97.30% -> 97.30%     
client [73] (testset)   loss: 0.2251 -> 0.2234  accuracy: 96.25% -> 96.25%     
client [5]  (testset)   loss: 0.0749 -> 0.0807  accuracy: 96.30% -> 96.30%     
client [96] (testset)   loss: 0.0929 -> 0.0925  accuracy: 97.61% -> 97.61%     
client [22] (testset)   loss: 0.0321 -> 0.0285  accuracy: 98.63% -> 98.17%     
client [60] (testset)   loss: 0.0705 -> 0.0758  accuracy: 97.46% -> 97.46%     
client [66] (testset)   loss: 0.1042 -> 0.1006  accuracy: 97.42% -> 96.91%     
client [83] (testset)   loss: 0.0917 -> 0.0910  accuracy: 97.61% -> 98.09%     
---------------------------- TRAINING EPOCH: 120 ----------------------------  
client [76] (testset)   loss: 0.0006 -> 0.0006  accuracy: 100.00% -> 100.00%   
client [65] (testset)   loss: 0.1541 -> 0.1516  accuracy: 94.71% -> 95.29%     
client [95] (testset)   loss: 0.1247 -> 0.1265  accuracy: 97.07% -> 97.07%     
client [17] (testset)   loss: 0.0685 -> 0.0765  accuracy: 96.51% -> 96.51%     
client [8]  (testset)   loss: 0.0831 -> 0.0887  accuracy: 98.17% -> 98.17%     
client [35] (testset)   loss: 0.0117 -> 0.0121  accuracy: 99.40% -> 99.40%     
client [98] (testset)   loss: 0.0839 -> 0.0862  accuracy: 95.93% -> 95.93%     
client [53] (testset)   loss: 0.1081 -> 0.1116  accuracy: 97.32% -> 96.43%     
client [43] (testset)   loss: 0.1273 -> 0.1330  accuracy: 97.30% -> 97.30%     
client [64] (testset)   loss: 0.0546 -> 0.0683  accuracy: 97.93% -> 97.10%     
---------------------------- TRAINING EPOCH: 130 ----------------------------  
client [21] (testset)   loss: 0.0353 -> 0.0445  accuracy: 98.23% -> 98.23%     
client [88] (testset)   loss: 0.1060 -> 0.1191  accuracy: 97.58% -> 97.58%     
client [38] (testset)   loss: 0.0835 -> 0.0809  accuracy: 98.52% -> 98.52%     
client [3]  (testset)   loss: 0.2814 -> 0.2823  accuracy: 95.22% -> 95.22%     
client [5]  (testset)   loss: 0.0751 -> 0.0964  accuracy: 96.30% -> 96.30%     
client [41] (testset)   loss: 0.0437 -> 0.0459  accuracy: 98.81% -> 98.81%     
client [7]  (testset)   loss: 0.0589 -> 0.0581  accuracy: 98.81% -> 98.81%     
client [37] (testset)   loss: 0.0899 -> 0.0908  accuracy: 97.85% -> 98.28%     
client [45] (testset)   loss: 0.0691 -> 0.0745  accuracy: 98.47% -> 98.47%     
client [47] (testset)   loss: 0.0730 -> 0.0709  accuracy: 98.38% -> 98.79%     
---------------------------- TRAINING EPOCH: 140 ----------------------------  
client [16] (testset)   loss: 0.0783 -> 0.0795  accuracy: 97.26% -> 96.80%     
client [11] (testset)   loss: 0.0736 -> 0.0783  accuracy: 98.45% -> 97.42%     
client [37] (testset)   loss: 0.0927 -> 0.0899  accuracy: 98.28% -> 98.28%     
client [41] (testset)   loss: 0.0454 -> 0.0491  accuracy: 98.81% -> 98.81%     
client [95] (testset)   loss: 0.1310 -> 0.1302  accuracy: 97.07% -> 97.07%     
client [53] (testset)   loss: 0.1117 -> 0.1102  accuracy: 96.43% -> 96.43%     
client [22] (testset)   loss: 0.0323 -> 0.0293  accuracy: 98.63% -> 98.63%     
client [25] (testset)   loss: 0.0999 -> 0.1073  accuracy: 97.16% -> 97.16%     
client [69] (testset)   loss: 0.0548 -> 0.0561  accuracy: 97.59% -> 96.99%     
client [46] (testset)   loss: 0.0275 -> 0.0278  accuracy: 99.25% -> 99.25%     
---------------------------- TRAINING EPOCH: 150 ----------------------------  
client [47] (testset)   loss: 0.0812 -> 0.0806  accuracy: 98.79% -> 98.79%     
client [69] (testset)   loss: 0.0558 -> 0.0565  accuracy: 96.99% -> 97.59%     
client [82] (testset)   loss: 0.0808 -> 0.0951  accuracy: 98.97% -> 97.94%     
client [45] (testset)   loss: 0.0758 -> 0.0907  accuracy: 98.47% -> 98.08%     
client [7]  (testset)   loss: 0.0581 -> 0.0544  accuracy: 98.81% -> 98.81%     
client [50] (testset)   loss: 0.0769 -> 0.0773  accuracy: 98.24% -> 98.24%     
client [35] (testset)   loss: 0.0113 -> 0.0119  accuracy: 99.40% -> 99.40%     
client [24] (testset)   loss: 0.0826 -> 0.0783  accuracy: 97.37% -> 97.37%     
client [15] (testset)   loss: 0.0808 -> 0.0847  accuracy: 96.55% -> 97.04%     
client [58] (testset)   loss: 0.0299 -> 0.0309  accuracy: 98.46% -> 98.46%     
---------------------------- TRAINING EPOCH: 160 ----------------------------  
client [48] (testset)   loss: 0.0845 -> 0.0834  accuracy: 98.58% -> 98.58%     
client [76] (testset)   loss: 0.0004 -> 0.0004  accuracy: 100.00% -> 100.00%   
client [67] (testset)   loss: 0.1126 -> 0.1140  accuracy: 98.29% -> 98.29%     
client [37] (testset)   loss: 0.0956 -> 0.0972  accuracy: 98.28% -> 98.28%     
client [58] (testset)   loss: 0.0322 -> 0.0324  accuracy: 98.46% -> 98.46%     
client [64] (testset)   loss: 0.0572 -> 0.0630  accuracy: 97.51% -> 97.51%     
client [77] (testset)   loss: 0.0951 -> 0.0987  accuracy: 97.19% -> 97.19%     
client [55] (testset)   loss: 0.1194 -> 0.1278  accuracy: 93.94% -> 93.94%     
client [12] (testset)   loss: 0.0599 -> 0.0540  accuracy: 98.41% -> 98.94%     
client [89] (testset)   loss: 0.1337 -> 0.1352  accuracy: 97.35% -> 97.35%     
---------------------------- TRAINING EPOCH: 170 ----------------------------  
client [84] (testset)   loss: 0.0643 -> 0.0639  accuracy: 98.24% -> 98.24%     
client [51] (testset)   loss: 0.1886 -> 0.1948  accuracy: 95.79% -> 95.79%     
client [8]  (testset)   loss: 0.0893 -> 0.0902  accuracy: 98.78% -> 98.78%     
client [18] (testset)   loss: 0.0035 -> 0.0038  accuracy: 100.00% -> 100.00%   
client [94] (testset)   loss: 0.0902 -> 0.0900  accuracy: 98.06% -> 98.45%     
client [81] (testset)   loss: 0.2456 -> 0.2485  accuracy: 96.36% -> 96.36%     
client [3]  (testset)   loss: 0.3069 -> 0.3130  accuracy: 95.22% -> 95.22%     
client [11] (testset)   loss: 0.0827 -> 0.0820  accuracy: 97.42% -> 97.42%     
client [95] (testset)   loss: 0.1367 -> 0.1360  accuracy: 97.07% -> 97.07%     
client [67] (testset)   loss: 0.1125 -> 0.1167  accuracy: 98.29% -> 98.29%     
---------------------------- TRAINING EPOCH: 180 ----------------------------  
client [21] (testset)   loss: 0.0386 -> 0.0449  accuracy: 98.23% -> 97.35%     
client [79] (testset)   loss: 0.0401 -> 0.0413  accuracy: 99.28% -> 99.28%     
client [58] (testset)   loss: 0.0340 -> 0.0337  accuracy: 98.46% -> 98.46%     
client [88] (testset)   loss: 0.1166 -> 0.1214  accuracy: 97.58% -> 97.58%     
client [46] (testset)   loss: 0.0251 -> 0.0268  accuracy: 99.25% -> 99.25%     
client [11] (testset)   loss: 0.0846 -> 0.0857  accuracy: 97.42% -> 97.42%     
client [55] (testset)   loss: 0.1296 -> 0.1306  accuracy: 93.94% -> 93.94%     
client [13] (testset)   loss: 0.2122 -> 0.2162  accuracy: 96.80% -> 96.80%     
client [31] (testset)   loss: 0.0838 -> 0.0864  accuracy: 98.21% -> 99.11%     
client [75] (testset)   loss: 0.0213 -> 0.0216  accuracy: 99.47% -> 99.47%     
---------------------------- TRAINING EPOCH: 190 ----------------------------  
client [19] (testset)   loss: 0.0164 -> 0.0175  accuracy: 98.82% -> 98.82%     
client [7]  (testset)   loss: 0.0568 -> 0.0579  accuracy: 98.81% -> 98.81%     
client [57] (testset)   loss: 0.1858 -> 0.1828  accuracy: 96.31% -> 96.31%     
client [13] (testset)   loss: 0.2200 -> 0.2221  accuracy: 96.80% -> 96.80%     
client [43] (testset)   loss: 0.1408 -> 0.1409  accuracy: 97.30% -> 97.30%     
client [91] (testset)   loss: 0.1178 -> 0.1191  accuracy: 97.00% -> 97.00%     
client [10] (testset)   loss: 0.1045 -> 0.1027  accuracy: 96.69% -> 96.69%     
client [64] (testset)   loss: 0.0639 -> 0.0671  accuracy: 97.10% -> 97.10%     
client [82] (testset)   loss: 0.0816 -> 0.0814  accuracy: 98.97% -> 98.97%     
client [22] (testset)   loss: 0.0300 -> 0.0312  accuracy: 98.63% -> 98.63%     
---------------------------- TRAINING EPOCH: 200 ----------------------------  
client [20] (testset)   loss: 0.0871 -> 0.0879  accuracy: 98.25% -> 98.25%     
client [23] (testset)   loss: 0.1188 -> 0.1195  accuracy: 97.31% -> 97.31%     
client [88] (testset)   loss: 0.1219 -> 0.1250  accuracy: 97.58% -> 97.58%     
client [98] (testset)   loss: 0.0853 -> 0.0856  accuracy: 95.93% -> 95.93%     
client [79] (testset)   loss: 0.0406 -> 0.0420  accuracy: 99.28% -> 99.28%     
client [21] (testset)   loss: 0.0387 -> 0.0440  accuracy: 98.23% -> 98.23%     
client [92] (testset)   loss: 0.1787 -> 0.1826  accuracy: 95.67% -> 95.67%     
client [56] (testset)   loss: 0.0945 -> 0.0932  accuracy: 96.84% -> 96.84%     
client [5]  (testset)   loss: 0.0899 -> 0.0901  accuracy: 96.30% -> 96.30%     
client [52] (testset)   loss: 0.1622 -> 0.1615  accuracy: 98.17% -> 98.17%     
---------------------------- TRAINING EPOCH: 210 ----------------------------  
client [67] (testset)   loss: 0.1231 -> 0.1242  accuracy: 98.29% -> 98.29%     
client [54] (testset)   loss: 0.1814 -> 0.1830  accuracy: 96.07% -> 96.63%     
client [14] (testset)   loss: 0.3116 -> 0.3150  accuracy: 91.57% -> 91.57%     
client [99] (testset)   loss: 0.1946 -> 0.1939  accuracy: 94.97% -> 94.97%     
client [36] (testset)   loss: 0.0776 -> 0.0749  accuracy: 98.36% -> 98.36%     
client [30] (testset)   loss: 0.0826 -> 0.0856  accuracy: 96.89% -> 96.89%     
client [38] (testset)   loss: 0.0895 -> 0.0836  accuracy: 98.03% -> 98.03%     
client [15] (testset)   loss: 0.0869 -> 0.0883  accuracy: 96.06% -> 97.04%     
client [6]  (testset)   loss: 0.1937 -> 0.2033  accuracy: 95.89% -> 95.89%     
client [53] (testset)   loss: 0.1215 -> 0.1230  accuracy: 95.54% -> 95.54%     
---------------------------- TRAINING EPOCH: 220 ----------------------------  
client [99] (testset)   loss: 0.1987 -> 0.1997  accuracy: 94.97% -> 94.97%     
client [6]  (testset)   loss: 0.1982 -> 0.2092  accuracy: 95.89% -> 95.21%     
client [83] (testset)   loss: 0.1091 -> 0.1070  accuracy: 98.09% -> 98.09%     
client [42] (testset)   loss: 0.1613 -> 0.1635  accuracy: 93.86% -> 93.86%     
client [34] (testset)   loss: 0.0799 -> 0.0782  accuracy: 97.30% -> 97.30%     
client [15] (testset)   loss: 0.0897 -> 0.0934  accuracy: 96.06% -> 97.04%     
client [47] (testset)   loss: 0.0913 -> 0.0898  accuracy: 98.38% -> 98.38%     
client [55] (testset)   loss: 0.1277 -> 0.1306  accuracy: 93.94% -> 93.94%     
client [51] (testset)   loss: 0.2046 -> 0.2573  accuracy: 95.79% -> 95.79%     
client [95] (testset)   loss: 0.1448 -> 0.1469  accuracy: 97.07% -> 97.07%     
---------------------------- TRAINING EPOCH: 230 ----------------------------  
client [71] (testset)   loss: 0.1527 -> 0.1592  accuracy: 97.38% -> 96.86%     
client [15] (testset)   loss: 0.0907 -> 0.0938  accuracy: 96.55% -> 97.04%     
client [33] (testset)   loss: 0.2150 -> 0.2162  accuracy: 97.16% -> 97.16%     
client [99] (testset)   loss: 0.2020 -> 0.2009  accuracy: 94.97% -> 94.97%     
client [90] (testset)   loss: 0.1123 -> 0.1130  accuracy: 98.58% -> 98.58%     
client [57] (testset)   loss: 0.1925 -> 0.1914  accuracy: 96.31% -> 96.31%     
client [27] (testset)   loss: 0.0424 -> 0.0432  accuracy: 98.24% -> 98.24%     
client [78] (testset)   loss: 0.1140 -> 0.1109  accuracy: 96.97% -> 96.97%     
client [36] (testset)   loss: 0.0789 -> 0.0756  accuracy: 98.36% -> 98.36%     
client [88] (testset)   loss: 0.1282 -> 0.1359  accuracy: 97.58% -> 97.58%     
---------------------------- TRAINING EPOCH: 240 ----------------------------  
client [70] (testset)   loss: 0.0344 -> 0.0365  accuracy: 98.33% -> 98.33%     
client [35] (testset)   loss: 0.0107 -> 0.0108  accuracy: 99.40% -> 99.40%     
client [16] (testset)   loss: 0.0890 -> 0.0892  accuracy: 96.80% -> 96.80%     
client [80] (testset)   loss: 0.1277 -> 0.1288  accuracy: 96.98% -> 97.36%     
client [38] (testset)   loss: 0.0866 -> 0.0862  accuracy: 98.52% -> 98.03%     
client [78] (testset)   loss: 0.1133 -> 0.1095  accuracy: 96.97% -> 97.58%     
client [68] (testset)   loss: 0.0275 -> 0.0264  accuracy: 98.89% -> 98.89%     
client [11] (testset)   loss: 0.0951 -> 0.0947  accuracy: 97.42% -> 97.42%     
client [64] (testset)   loss: 0.0684 -> 0.0706  accuracy: 97.10% -> 97.10%     
client [82] (testset)   loss: 0.0859 -> 0.0845  accuracy: 98.97% -> 98.97%     
---------------------------- TRAINING EPOCH: 250 ----------------------------  
client [30] (testset)   loss: 0.0874 -> 0.0894  accuracy: 96.89% -> 97.33%     
client [27] (testset)   loss: 0.0452 -> 0.0433  accuracy: 98.24% -> 98.24%     
client [74] (testset)   loss: 0.0970 -> 0.0955  accuracy: 98.75% -> 98.12%     
client [45] (testset)   loss: 0.0910 -> 0.0994  accuracy: 98.47% -> 98.47%     
client [6]  (testset)   loss: 0.2060 -> 0.2072  accuracy: 95.89% -> 95.89%     
client [36] (testset)   loss: 0.0790 -> 0.0761  accuracy: 98.36% -> 98.36%     
client [63] (testset)   loss: 0.0096 -> 0.0097  accuracy: 99.35% -> 100.00%    
client [76] (testset)   loss: 0.0002 -> 0.0002  accuracy: 100.00% -> 100.00%   
client [83] (testset)   loss: 0.1118 -> 0.1127  accuracy: 98.09% -> 98.09%     
client [86] (testset)   loss: 0.0121 -> 0.0117  accuracy: 99.25% -> 99.25%     
---------------------------- TRAINING EPOCH: 260 ----------------------------  
client [83] (testset)   loss: 0.1150 -> 0.1108  accuracy: 98.09% -> 97.61%     
client [99] (testset)   loss: 0.2108 -> 0.2092  accuracy: 95.53% -> 94.97%     
client [74] (testset)   loss: 0.0968 -> 0.0958  accuracy: 98.12% -> 98.75%     
client [73] (testset)   loss: 0.2874 -> 0.2889  accuracy: 95.83% -> 95.42%     
client [29] (testset)   loss: 0.0435 -> 0.0436  accuracy: 97.39% -> 97.39%     
client [92] (testset)   loss: 0.1946 -> 0.1963  accuracy: 95.67% -> 95.67%     
client [6]  (testset)   loss: 0.2056 -> 0.2119  accuracy: 95.89% -> 95.89%     
client [61] (testset)   loss: 0.0500 -> 0.0495  accuracy: 97.78% -> 97.78%     
client [21] (testset)   loss: 0.0434 -> 0.0447  accuracy: 98.23% -> 97.35%     
client [67] (testset)   loss: 0.1295 -> 0.1287  accuracy: 98.29% -> 98.29%     
---------------------------- TRAINING EPOCH: 270 ----------------------------  
client [83] (testset)   loss: 0.1133 -> 0.1140  accuracy: 98.09% -> 98.09%     
client [32] (testset)   loss: 0.0386 -> 0.0388  accuracy: 98.70% -> 98.70%     
client [95] (testset)   loss: 0.1527 -> 0.1526  accuracy: 97.07% -> 97.07%     
client [61] (testset)   loss: 0.0495 -> 0.0495  accuracy: 97.78% -> 97.78%     
client [27] (testset)   loss: 0.0450 -> 0.0437  accuracy: 98.24% -> 98.24%     
client [25] (testset)   loss: 0.1327 -> 0.1330  accuracy: 97.16% -> 96.68%     
client [68] (testset)   loss: 0.0277 -> 0.0267  accuracy: 98.89% -> 98.89%     
client [34] (testset)   loss: 0.0835 -> 0.0822  accuracy: 97.30% -> 97.30%     
client [71] (testset)   loss: 0.1642 -> 0.1663  accuracy: 96.86% -> 96.86%     
client [89] (testset)   loss: 0.1453 -> 0.1468  accuracy: 97.35% -> 97.35%     
---------------------------- TRAINING EPOCH: 280 ----------------------------  
client [78] (testset)   loss: 0.1117 -> 0.1093  accuracy: 96.97% -> 97.58%     
client [81] (testset)   loss: 0.2808 -> 0.2791  accuracy: 96.36% -> 96.36%     
client [51] (testset)   loss: 0.2205 -> 0.2187  accuracy: 95.33% -> 95.79%     
client [54] (testset)   loss: 0.1933 -> 0.1930  accuracy: 96.07% -> 96.07%     
client [65] (testset)   loss: 0.1848 -> 0.1827  accuracy: 94.71% -> 94.71%     
client [41] (testset)   loss: 0.0587 -> 0.0590  accuracy: 98.81% -> 98.81%     
client [11] (testset)   loss: 0.0954 -> 0.0962  accuracy: 97.42% -> 97.42%     
client [85] (testset)   loss: 0.3312 -> 0.3289  accuracy: 95.77% -> 95.77%     
client [12] (testset)   loss: 0.0653 -> 0.0624  accuracy: 97.88% -> 97.88%     
client [23] (testset)   loss: 0.1301 -> 0.1316  accuracy: 97.31% -> 97.31%     
---------------------------- TRAINING EPOCH: 290 ----------------------------  
client [16] (testset)   loss: 0.0919 -> 0.0920  accuracy: 96.80% -> 96.80%     
client [65] (testset)   loss: 0.1864 -> 0.1855  accuracy: 94.71% -> 94.71%     
client [53] (testset)   loss: 0.1278 -> 0.1290  accuracy: 95.54% -> 95.54%     
client [58] (testset)   loss: 0.0366 -> 0.0369  accuracy: 98.46% -> 98.46%     
client [72] (testset)   loss: 0.0643 -> 0.0650  accuracy: 98.00% -> 98.00%     
client [7]  (testset)   loss: 0.0669 -> 0.0663  accuracy: 98.81% -> 98.81%     
client [71] (testset)   loss: 0.1673 -> 0.1695  accuracy: 96.86% -> 96.86%     
client [59] (testset)   loss: 0.1430 -> 0.1394  accuracy: 96.35% -> 96.88%     
client [86] (testset)   loss: 0.0110 -> 0.0106  accuracy: 99.25% -> 99.25%     
client [39] (testset)   loss: 0.0380 -> 0.0384  accuracy: 99.45% -> 99.45%     
---------------------------- TRAINING EPOCH: 300 ----------------------------  
client [99] (testset)   loss: 0.2171 -> 0.2153  accuracy: 94.97% -> 95.53%     
client [7]  (testset)   loss: 0.0667 -> 0.0683  accuracy: 98.81% -> 98.81%     
client [17] (testset)   loss: 0.0990 -> 0.1004  accuracy: 96.51% -> 96.07%     
client [64] (testset)   loss: 0.0711 -> 0.0730  accuracy: 96.68% -> 96.68%     
client [37] (testset)   loss: 0.1070 -> 0.1069  accuracy: 98.28% -> 98.28%     
client [29] (testset)   loss: 0.0440 -> 0.0441  accuracy: 97.39% -> 97.39%     
client [93] (testset)   loss: 0.0999 -> 0.0998  accuracy: 98.02% -> 98.02%     
client [73] (testset)   loss: 0.2984 -> 0.2990  accuracy: 95.83% -> 95.83%     
client [40] (testset)   loss: 0.0350 -> 0.0351  accuracy: 99.20% -> 99.20%     
client [76] (testset)   loss: 0.0001 -> 0.0001  accuracy: 100.00% -> 100.00%   
---------------------------- TRAINING EPOCH: 310 ----------------------------  
client [31] (testset)   loss: 0.1021 -> 0.1010  accuracy: 99.11% -> 99.11%     
client [89] (testset)   loss: 0.1490 -> 0.1487  accuracy: 97.35% -> 97.35%     
client [77] (testset)   loss: 0.1167 -> 0.1181  accuracy: 97.19% -> 97.19%     
client [90] (testset)   loss: 0.1180 -> 0.1174  accuracy: 98.58% -> 98.58%     
client [26] (testset)   loss: 0.0750 -> 0.0752  accuracy: 98.73% -> 98.31%     
client [50] (testset)   loss: 0.0882 -> 0.0897  accuracy: 98.24% -> 97.89%     
client [30] (testset)   loss: 0.0944 -> 0.0954  accuracy: 97.33% -> 96.89%     
client [70] (testset)   loss: 0.0368 -> 0.0405  accuracy: 98.33% -> 97.92%     
client [41] (testset)   loss: 0.0609 -> 0.0613  accuracy: 98.81% -> 98.81%     
client [99] (testset)   loss: 0.2182 -> 0.2168  accuracy: 95.53% -> 95.53%     
---------------------------- TRAINING EPOCH: 320 ----------------------------  
client [68] (testset)   loss: 0.0271 -> 0.0268  accuracy: 98.89% -> 98.89%     
client [70] (testset)   loss: 0.0378 -> 0.0381  accuracy: 98.33% -> 98.33%     
client [52] (testset)   loss: 0.1824 -> 0.1822  accuracy: 98.17% -> 98.17%     
client [1]  (testset)   loss: 0.1852 -> 0.1866  accuracy: 96.59% -> 96.10%     
client [2]  (testset)   loss: 0.0795 -> 0.0800  accuracy: 97.64% -> 97.64%     
client [67] (testset)   loss: 0.1351 -> 0.1349  accuracy: 98.29% -> 98.29%     
client [92] (testset)   loss: 0.2082 -> 0.2139  accuracy: 95.67% -> 96.15%     
client [35] (testset)   loss: 0.0111 -> 0.0113  accuracy: 99.40% -> 99.40%     
client [36] (testset)   loss: 0.0818 -> 0.0811  accuracy: 97.81% -> 98.36%     
client [64] (testset)   loss: 0.0720 -> 0.0736  accuracy: 96.68% -> 97.10%     
---------------------------- TRAINING EPOCH: 330 ----------------------------  
client [44] (testset)   loss: 0.2131 -> 0.2121  accuracy: 98.19% -> 98.19%     
client [6]  (testset)   loss: 0.2170 -> 0.2204  accuracy: 95.89% -> 95.89%     
client [12] (testset)   loss: 0.0680 -> 0.0661  accuracy: 97.88% -> 97.35%     
client [55] (testset)   loss: 0.1349 -> 0.1357  accuracy: 93.94% -> 93.94%     
client [29] (testset)   loss: 0.0443 -> 0.0442  accuracy: 97.39% -> 97.39%     
client [9]  (testset)   loss: 0.0466 -> 0.0467  accuracy: 97.20% -> 97.20%     
client [43] (testset)   loss: 0.1576 -> 0.1589  accuracy: 97.30% -> 97.30%     
client [77] (testset)   loss: 0.1181 -> 0.1185  accuracy: 97.19% -> 97.19%     
client [98] (testset)   loss: 0.0959 -> 0.0957  accuracy: 95.12% -> 95.12%     
client [78] (testset)   loss: 0.1143 -> 0.1119  accuracy: 96.97% -> 97.58%     
---------------------------- TRAINING EPOCH: 340 ----------------------------  
client [92] (testset)   loss: 0.2110 -> 0.2138  accuracy: 96.15% -> 96.15%     
client [80] (testset)   loss: 0.1396 -> 0.1408  accuracy: 96.98% -> 96.98%     
client [63] (testset)   loss: 0.0090 -> 0.0089  accuracy: 100.00% -> 100.00%   
client [76] (testset)   loss: 0.0001 -> 0.0001  accuracy: 100.00% -> 100.00%   
client [78] (testset)   loss: 0.1139 -> 0.1123  accuracy: 96.97% -> 96.97%     
client [25] (testset)   loss: 0.1418 -> 0.1410  accuracy: 96.68% -> 96.21%     
client [58] (testset)   loss: 0.0395 -> 0.0396  accuracy: 98.46% -> 98.46%     
client [13] (testset)   loss: 0.2593 -> 0.2598  accuracy: 96.80% -> 96.80%     
client [17] (testset)   loss: 0.1033 -> 0.1044  accuracy: 95.63% -> 95.63%     
client [38] (testset)   loss: 0.0916 -> 0.0917  accuracy: 98.03% -> 98.03%     
---------------------------- TRAINING EPOCH: 350 ----------------------------  
client [72] (testset)   loss: 0.0672 -> 0.0676  accuracy: 98.00% -> 98.00%     
client [82] (testset)   loss: 0.0915 -> 0.0922  accuracy: 98.97% -> 98.97%     
client [86] (testset)   loss: 0.0099 -> 0.0096  accuracy: 99.25% -> 99.25%     
client [51] (testset)   loss: 0.2292 -> 0.2298  accuracy: 95.33% -> 95.33%     
client [96] (testset)   loss: 0.1301 -> 0.1302  accuracy: 97.13% -> 97.13%     
client [42] (testset)   loss: 0.1803 -> 0.1805  accuracy: 93.86% -> 93.86%     
client [55] (testset)   loss: 0.1356 -> 0.1366  accuracy: 93.94% -> 93.94%     
client [13] (testset)   loss: 0.2622 -> 0.2628  accuracy: 96.80% -> 96.80%     
client [1]  (testset)   loss: 0.1892 -> 0.1931  accuracy: 96.59% -> 96.10%     
client [12] (testset)   loss: 0.0669 -> 0.0658  accuracy: 97.88% -> 98.41%     
---------------------------- TRAINING EPOCH: 360 ----------------------------  
client [68] (testset)   loss: 0.0273 -> 0.0271  accuracy: 98.89% -> 99.44%     
client [23] (testset)   loss: 0.1370 -> 0.1366  accuracy: 97.31% -> 97.31%     
client [46] (testset)   loss: 0.0303 -> 0.0304  accuracy: 99.25% -> 99.25%     
client [41] (testset)   loss: 0.0626 -> 0.0633  accuracy: 98.81% -> 98.81%     
client [25] (testset)   loss: 0.1438 -> 0.1449  accuracy: 96.68% -> 96.68%     
client [58] (testset)   loss: 0.0394 -> 0.0391  accuracy: 98.46% -> 98.46%     
client [14] (testset)   loss: 0.3517 -> 0.3527  accuracy: 91.57% -> 91.57%     
client [33] (testset)   loss: 0.2415 -> 0.2410  accuracy: 97.16% -> 97.16%     
client [85] (testset)   loss: 0.3495 -> 0.3488  accuracy: 95.77% -> 95.77%     
client [62] (testset)   loss: 0.0640 -> 0.0640  accuracy: 98.92% -> 98.92%     
---------------------------- TRAINING EPOCH: 370 ----------------------------  
client [98] (testset)   loss: 0.0971 -> 0.0973  accuracy: 95.12% -> 95.12%     
client [63] (testset)   loss: 0.0088 -> 0.0088  accuracy: 100.00% -> 100.00%   
client [70] (testset)   loss: 0.0381 -> 0.0396  accuracy: 98.33% -> 98.33%     
client [65] (testset)   loss: 0.1934 -> 0.1934  accuracy: 94.71% -> 94.71%     
client [14] (testset)   loss: 0.3544 -> 0.3552  accuracy: 91.57% -> 91.57%     
client [73] (testset)   loss: 0.3108 -> 0.3104  accuracy: 95.83% -> 95.83%     
client [34] (testset)   loss: 0.0855 -> 0.0848  accuracy: 97.30% -> 97.30%     
client [99] (testset)   loss: 0.2253 -> 0.2250  accuracy: 95.53% -> 95.53%     
client [69] (testset)   loss: 0.0683 -> 0.0688  accuracy: 97.59% -> 96.99%     
client [46] (testset)   loss: 0.0301 -> 0.0308  accuracy: 99.25% -> 99.25%     
---------------------------- TRAINING EPOCH: 380 ----------------------------  
client [99] (testset)   loss: 0.2270 -> 0.2268  accuracy: 95.53% -> 95.53%     
client [93] (testset)   loss: 0.1036 -> 0.1037  accuracy: 98.02% -> 98.02%     
client [11] (testset)   loss: 0.1016 -> 0.1018  accuracy: 97.94% -> 97.94%     
client [58] (testset)   loss: 0.0398 -> 0.0399  accuracy: 98.46% -> 98.46%     
client [81] (testset)   loss: 0.2948 -> 0.2952  accuracy: 96.36% -> 96.36%     
client [85] (testset)   loss: 0.3514 -> 0.3526  accuracy: 95.77% -> 95.77%     
client [89] (testset)   loss: 0.1533 -> 0.1527  accuracy: 97.35% -> 97.35%     
client [45] (testset)   loss: 0.1032 -> 0.1055  accuracy: 98.47% -> 98.47%     
client [8]  (testset)   loss: 0.1140 -> 0.1143  accuracy: 98.17% -> 98.17%     
client [68] (testset)   loss: 0.0276 -> 0.0274  accuracy: 99.44% -> 99.44%     
---------------------------- TRAINING EPOCH: 390 ----------------------------  
client [67] (testset)   loss: 0.1389 -> 0.1386  accuracy: 98.29% -> 98.29%     
client [72] (testset)   loss: 0.0688 -> 0.0692  accuracy: 98.00% -> 98.00%     
client [1]  (testset)   loss: 0.1933 -> 0.1964  accuracy: 96.59% -> 96.10%     
client [78] (testset)   loss: 0.1133 -> 0.1129  accuracy: 97.58% -> 97.58%     
client [83] (testset)   loss: 0.1218 -> 0.1218  accuracy: 98.09% -> 97.61%     
client [21] (testset)   loss: 0.0457 -> 0.0460  accuracy: 97.35% -> 97.35%     
client [56] (testset)   loss: 0.1118 -> 0.1117  accuracy: 96.84% -> 96.84%     
client [44] (testset)   loss: 0.2186 -> 0.2191  accuracy: 98.19% -> 98.19%     
client [92] (testset)   loss: 0.2170 -> 0.2203  accuracy: 96.15% -> 96.15%     
client [27] (testset)   loss: 0.0461 -> 0.0458  accuracy: 98.24% -> 98.24%     
---------------------------- TRAINING EPOCH: 400 ----------------------------  
client [10] (testset)   loss: 0.1142 -> 0.1146  accuracy: 96.69% -> 96.69%     
client [39] (testset)   loss: 0.0401 -> 0.0400  accuracy: 99.45% -> 99.45%     
client [65] (testset)   loss: 0.1981 -> 0.1972  accuracy: 94.71% -> 94.71%     
client [26] (testset)   loss: 0.0800 -> 0.0846  accuracy: 98.31% -> 98.31%     
client [19] (testset)   loss: 0.0164 -> 0.0167  accuracy: 98.82% -> 98.82%     
client [68] (testset)   loss: 0.0282 -> 0.0281  accuracy: 99.44% -> 99.44%     
client [41] (testset)   loss: 0.0637 -> 0.0641  accuracy: 98.81% -> 98.81%     
client [50] (testset)   loss: 0.0932 -> 0.0937  accuracy: 97.54% -> 97.54%     
client [75] (testset)   loss: 0.0237 -> 0.0237  accuracy: 98.94% -> 98.94%     
client [81] (testset)   loss: 0.2976 -> 0.2971  accuracy: 96.36% -> 96.36%     
Training... ---------------------------------------- 100% 0:12:34
FedPer's average time taken by each global epoch: 0 min 1.88 sec.              
FedPer's total running time: 0 h 12 m 34 s.                                    
==================== FedPer Experiment Results: ====================           
Display format: (before local fine-tuning) -> (after local fine-tuning)        
 So if finetune_epoch = 0, x.xx% -> 0.00% is normal.                           
 Centralized testing ONLY happens after model aggregation, so the stats between
'->' are the same.                                                             
{                                                                              
    "100": {                                                                   
        "all_clients": {                                                       
            "test": {                                                          
                "loss": "0.0842 -> 0.0000",                                    
                "accuracy": "97.59% -> 0.00%"                                  
            }                                                                  
        }                                                                      
    },                                                                         
    "200": {                                                                   
        "all_clients": {                                                       
            "test": {                                                          
                "loss": "0.1013 -> 0.0000",                                    
                "accuracy": "97.55% -> 0.00%"                                  
            }                                                                  
        }                                                                      
    },                                                                         
    "300": {                                                                   
        "all_clients": {                                                       
            "test": {                                                          
                "loss": "0.1123 -> 0.0000",                                    
                "accuracy": "97.51% -> 0.00%"                                  
            }                                                                  
        }                                                                      
    },                                                                         
    "400": {                                                                   
        "all_clients": {                                                       
            "test": {                                                          
                "loss": "0.1187 -> 0.0000",                                    
                "accuracy": "97.51% -> 0.00%"                                  
            }                                                                  
        }                                                                      
    }                                                                          
}                                                                              
==================== FedPer Max Accuracy ====================                  
all_clients:                                                                   
(test) before fine-tuning: 97.59% at epoch 100                                 
(test) after fine-tuning: 0.00% at epoch 100                                   
[0m