==================== FedProto ====================                             
Experiment Arguments:                                                          
{
│   'method': 'fedproto',
│   'dataset': {
│   │   'name': 'cifar100',
│   │   'client_num': 100,
│   │   'test_ratio': 0.25,
│   │   'val_ratio': 0.0,
│   │   'seed': 42,
│   │   'split': 'sample',
│   │   'IID_ratio': 0.0,
│   │   'monitor_window_name_suffix': 'cifar100-100clients-0%IID-use20superclasses-Dir(1.0)-seed42',
│   │   'super_class': False,
│   │   'alpha': 1.0,
│   │   'min_samples_per_client': 10
│   },
│   'model': {
│   │   'name': 'avgcnn',
│   │   'use_torchvision_pretrained_weights': True,
│   │   'external_model_weights_path': None
│   },
│   'optimizer': {
│   │   'lr': 0.01,
│   │   'dampening': 0,
│   │   'weight_decay': 0,
│   │   'momentum': 0,
│   │   'nesterov': False,
│   │   'name': 'sgd'
│   },
│   'mode': 'serial',
│   'parallel': {
│   │   'ray_cluster_addr': None,
│   │   'num_cpus': None,
│   │   'num_gpus': None,
│   │   'num_workers': 2
│   },
│   'common': {
│   │   'seed': 42,
│   │   'join_ratio': 0.1,
│   │   'global_epoch': 400,
│   │   'local_epoch': 5,
│   │   'batch_size': 32,
│   │   'reset_optimizer_on_global_epoch': True,
│   │   'straggler_ratio': 0,
│   │   'straggler_min_local_epoch': 0,
│   │   'buffers': 'global',
│   │   'client_side_evaluation': True,
│   │   'test': {
│   │   │   'client': {
│   │   │   │   'interval': 100,
│   │   │   │   'finetune_epoch': 0,
│   │   │   │   'train': False,
│   │   │   │   'val': False,
│   │   │   │   'test': True
│   │   │   },
│   │   │   'server': {
│   │   │   │   'interval': -1,
│   │   │   │   'train': False,
│   │   │   │   'val': False,
│   │   │   │   'test': False,
│   │   │   │   'model_in_train_mode': False
│   │   │   }
│   │   },
│   │   'verbose_gap': 10,
│   │   'monitor': None,
│   │   'use_cuda': True,
│   │   'save_log': True,
│   │   'save_model': False,
│   │   'save_learning_curve_plot': False,
│   │   'save_metrics': True,
│   │   'delete_useless_run': True
│   },
│   'fedproto': {
│   │   'lamda': 1
│   }
}
---------------------------- TRAINING EPOCH: 10 ----------------------------   
client [77] (testset)   loss: 4.3379 -> 4.2226  accuracy: 5.00% -> 10.00%      
client [81] (testset)   loss: 4.3053 -> 4.2142  accuracy: 4.83% -> 8.28%       
client [21] (testset)   loss: 4.6088 -> 4.4395  accuracy: 1.37% -> 2.05%       
client [68] (testset)   loss: 4.3995 -> 4.3341  accuracy: 6.02% -> 6.63%       
client [93] (testset)   loss: 4.4060 -> 4.3476  accuracy: 2.88% -> 5.04%       
client [31] (testset)   loss: 4.5452 -> 4.4553  accuracy: 2.31% -> 2.31%       
client [20] (testset)   loss: 4.3307 -> 4.2511  accuracy: 8.46% -> 6.15%       
client [59] (testset)   loss: 4.6075 -> 4.3915  accuracy: 1.45% -> 3.62%       
client [48] (testset)   loss: 4.2057 -> 4.1268  accuracy: 9.04% -> 9.04%       
client [34] (testset)   loss: 4.2749 -> 4.1742  accuracy: 3.80% -> 5.06%       
---------------------------- TRAINING EPOCH: 20 ----------------------------   
client [69] (testset)   loss: 4.0737 -> 4.0030  accuracy: 7.45% -> 13.04%      
client [99] (testset)   loss: 4.4092 -> 4.3218  accuracy: 7.14% -> 4.95%       
client [67] (testset)   loss: 4.4862 -> 4.4374  accuracy: 0.66% -> 2.63%       
client [0]  (testset)   loss: 4.2677 -> 4.1753  accuracy: 3.68% -> 5.15%       
client [76] (testset)   loss: 4.5212 -> 4.5309  accuracy: 3.31% -> 3.31%       
client [41] (testset)   loss: 4.4044 -> 4.2998  accuracy: 0.72% -> 2.88%       
client [62] (testset)   loss: 4.6012 -> 4.3347  accuracy: 0.00% -> 3.20%       
client [2]  (testset)   loss: 4.6009 -> 4.3572  accuracy: 3.07% -> 6.13%       
client [14] (testset)   loss: 4.2229 -> 4.1986  accuracy: 6.20% -> 5.43%       
client [46] (testset)   loss: 3.9914 -> 3.9556  accuracy: 18.01% -> 16.77%     
---------------------------- TRAINING EPOCH: 30 ----------------------------   
client [24] (testset)   loss: 4.2271 -> 4.1489  accuracy: 8.70% -> 12.32%      
client [68] (testset)   loss: 4.1878 -> 4.1570  accuracy: 12.05% -> 12.05%     
client [57] (testset)   loss: 4.1949 -> 4.0991  accuracy: 9.62% -> 12.82%      
client [17] (testset)   loss: 4.3580 -> 4.3421  accuracy: 8.00% -> 7.33%       
client [54] (testset)   loss: 4.3826 -> 4.4465  accuracy: 4.24% -> 5.08%       
client [23] (testset)   loss: 4.5992 -> 4.1817  accuracy: 2.94% -> 7.06%       
client [35] (testset)   loss: 4.2280 -> 4.1669  accuracy: 5.99% -> 10.18%      
client [59] (testset)   loss: 4.2007 -> 4.1408  accuracy: 6.52% -> 9.42%       
client [31] (testset)   loss: 4.3266 -> 4.5758  accuracy: 10.00% -> 6.15%      
client [9]  (testset)   loss: 4.0855 -> 3.9789  accuracy: 11.76% -> 13.53%     
---------------------------- TRAINING EPOCH: 40 ----------------------------   
client [64] (testset)   loss: 4.2841 -> 4.2502  accuracy: 8.22% -> 8.22%       
client [33] (testset)   loss: 4.3928 -> 4.3790  accuracy: 8.97% -> 9.62%       
client [16] (testset)   loss: 4.3582 -> 4.2865  accuracy: 4.69% -> 10.16%      
client [44] (testset)   loss: 4.3541 -> 4.3213  accuracy: 4.29% -> 6.43%       
client [8]  (testset)   loss: 4.2425 -> 4.3250  accuracy: 8.70% -> 10.14%      
client [31] (testset)   loss: 4.6041 -> 5.0921  accuracy: 3.08% -> 7.69%       
client [47] (testset)   loss: 4.0925 -> 4.1270  accuracy: 10.80% -> 8.52%      
client [36] (testset)   loss: 4.2852 -> 4.2145  accuracy: 7.23% -> 6.63%       
client [20] (testset)   loss: 4.0647 -> 4.7150  accuracy: 10.00% -> 10.00%     
client [56] (testset)   loss: 4.2670 -> 4.2135  accuracy: 8.82% -> 11.03%      
---------------------------- TRAINING EPOCH: 50 ----------------------------   
client [4]  (testset)   loss: 4.1666 -> 4.6974  accuracy: 6.63% -> 8.29%       
client [60] (testset)   loss: 4.2985 -> 4.2289  accuracy: 6.43% -> 8.57%       
client [28] (testset)   loss: 3.9750 -> 3.9900  accuracy: 9.66% -> 10.34%      
client [25] (testset)   loss: 4.3728 -> 4.3305  accuracy: 7.81% -> 10.94%      
client [58] (testset)   loss: 3.7529 -> 3.8255  accuracy: 19.83% -> 21.49%     
client [44] (testset)   loss: 4.3213 -> 4.1797  accuracy: 6.43% -> 11.43%      
client [39] (testset)   loss: 4.2021 -> 4.1759  accuracy: 12.34% -> 11.04%     
client [29] (testset)   loss: 3.9595 -> 4.0246  accuracy: 12.97% -> 13.51%     
client [3]  (testset)   loss: 3.9835 -> 3.9135  accuracy: 12.38% -> 16.83%     
client [84] (testset)   loss: 4.0727 -> 3.9947  accuracy: 7.75% -> 8.45%       
---------------------------- TRAINING EPOCH: 60 ----------------------------   
client [21] (testset)   loss: 4.2579 -> 4.1569  accuracy: 6.85% -> 7.53%       
client [84] (testset)   loss: 4.1102 -> 4.1060  accuracy: 7.04% -> 8.45%       
client [10] (testset)   loss: 4.2618 -> 4.1325  accuracy: 4.61% -> 9.21%       
client [36] (testset)   loss: 4.0561 -> 4.0182  accuracy: 10.84% -> 13.86%     
client [65] (testset)   loss: 4.4150 -> 4.4574  accuracy: 2.00% -> 4.00%       
client [81] (testset)   loss: 4.0964 -> 4.0666  accuracy: 11.03% -> 15.86%     
client [79] (testset)   loss: 4.0846 -> 3.9974  accuracy: 10.23% -> 11.93%     
client [42] (testset)   loss: 3.8869 -> 3.8843  accuracy: 13.38% -> 12.10%     
client [11] (testset)   loss: 4.2234 -> 4.1931  accuracy: 8.70% -> 9.42%       
client [96] (testset)   loss: 4.1260 -> 4.1314  accuracy: 6.56% -> 8.20%       
---------------------------- TRAINING EPOCH: 70 ----------------------------   
client [8]  (testset)   loss: 4.3573 -> 4.3995  accuracy: 8.70% -> 10.14%      
client [53] (testset)   loss: 4.1693 -> 4.1171  accuracy: 13.70% -> 15.75%     
client [52] (testset)   loss: 3.7781 -> 3.8977  accuracy: 16.88% -> 16.23%     
client [42] (testset)   loss: 3.8619 -> 3.8463  accuracy: 14.01% -> 11.46%     
client [69] (testset)   loss: 4.1238 -> 4.0872  accuracy: 13.04% -> 16.77%     
client [59] (testset)   loss: 4.0772 -> 4.0253  accuracy: 12.32% -> 13.04%     
client [7]  (testset)   loss: 4.2922 -> 4.3798  accuracy: 7.86% -> 9.29%       
client [26] (testset)   loss: 3.9497 -> 4.0520  accuracy: 12.96% -> 9.88%      
client [49] (testset)   loss: 4.1979 -> 4.1499  accuracy: 9.21% -> 8.55%       
client [98] (testset)   loss: 4.3444 -> 4.4334  accuracy: 6.00% -> 10.00%      
---------------------------- TRAINING EPOCH: 80 ----------------------------   
client [98] (testset)   loss: 4.4334 -> 4.9180  accuracy: 10.00% -> 6.67%      
client [47] (testset)   loss: 4.0584 -> 4.0809  accuracy: 13.07% -> 11.93%     
client [21] (testset)   loss: 4.0719 -> 4.0772  accuracy: 10.27% -> 11.64%     
client [77] (testset)   loss: 4.3443 -> 4.2807  accuracy: 7.50% -> 8.12%       
client [95] (testset)   loss: 3.8883 -> 4.1209  accuracy: 15.33% -> 14.60%     
client [91] (testset)   loss: 4.0746 -> 4.1556  accuracy: 12.22% -> 11.67%     
client [14] (testset)   loss: 4.3717 -> 4.3283  accuracy: 6.98% -> 6.20%       
client [99] (testset)   loss: 4.0406 -> 4.5302  accuracy: 10.99% -> 10.44%     
client [20] (testset)   loss: 4.2557 -> 4.2145  accuracy: 10.77% -> 13.85%     
client [39] (testset)   loss: 4.1952 -> 4.2537  accuracy: 12.99% -> 13.64%     
---------------------------- TRAINING EPOCH: 90 ----------------------------   
client [52] (testset)   loss: 3.8977 -> 3.9066  accuracy: 16.23% -> 16.88%     
client [62] (testset)   loss: 4.1208 -> 4.0557  accuracy: 12.80% -> 12.80%     
client [71] (testset)   loss: 4.1191 -> 4.2862  accuracy: 12.03% -> 12.66%     
client [97] (testset)   loss: 4.1189 -> 4.3244  accuracy: 10.56% -> 8.07%      
client [30] (testset)   loss: 4.1847 -> 4.2676  accuracy: 12.92% -> 12.36%     
client [88] (testset)   loss: 3.9905 -> 4.1643  accuracy: 12.86% -> 10.00%     
client [60] (testset)   loss: 4.3610 -> 4.3874  accuracy: 6.43% -> 9.29%       
client [82] (testset)   loss: 4.0624 -> 4.1538  accuracy: 16.57% -> 13.02%     
client [91] (testset)   loss: 4.1973 -> 4.2429  accuracy: 11.67% -> 15.56%     
client [57] (testset)   loss: 3.8993 -> 3.9199  accuracy: 14.10% -> 14.74%     
---------------------------- TRAINING EPOCH: 100 ----------------------------  
client [31] (testset)   loss: 4.9883 -> 5.0289  accuracy: 6.15% -> 8.46%       
client [15] (testset)   loss: 3.8194 -> 4.2620  accuracy: 15.71% -> 10.00%     
client [71] (testset)   loss: 4.2862 -> 4.3330  accuracy: 12.66% -> 12.03%     
client [97] (testset)   loss: 4.2016 -> 4.4794  accuracy: 10.56% -> 12.42%     
client [53] (testset)   loss: 4.1301 -> 4.1123  accuracy: 16.44% -> 15.75%     
client [77] (testset)   loss: 4.2807 -> 4.1636  accuracy: 8.12% -> 11.25%      
client [76] (testset)   loss: 4.7492 -> 4.8504  accuracy: 7.44% -> 3.31%       
client [79] (testset)   loss: 3.9138 -> 4.1124  accuracy: 15.34% -> 13.64%     
client [28] (testset)   loss: 4.3123 -> 4.4122  accuracy: 10.34% -> 8.28%      
client [99] (testset)   loss: 4.2274 -> 4.5263  accuracy: 10.99% -> 9.34%      
---------------------------- TRAINING EPOCH: 110 ----------------------------  
client [97] (testset)   loss: 4.1724 -> 4.2215  accuracy: 13.66% -> 14.91%     
client [86] (testset)   loss: 4.4132 -> 4.4017  accuracy: 9.86% -> 11.97%      
client [34] (testset)   loss: 4.3111 -> 4.2880  accuracy: 13.92% -> 15.19%     
client [73] (testset)   loss: 4.3931 -> 4.5647  accuracy: 10.98% -> 12.80%     
client [5]  (testset)   loss: 4.6480 -> 4.5845  accuracy: 9.87% -> 9.21%       
client [96] (testset)   loss: 4.4341 -> 4.5801  accuracy: 11.48% -> 10.66%     
client [22] (testset)   loss: 4.2839 -> 4.2383  accuracy: 10.56% -> 11.27%     
client [60] (testset)   loss: 4.4669 -> 4.7525  accuracy: 9.29% -> 8.57%       
client [66] (testset)   loss: 4.0796 -> 4.1061  accuracy: 14.19% -> 15.54%     
client [83] (testset)   loss: 3.8027 -> 3.7415  accuracy: 20.38% -> 24.20%     
---------------------------- TRAINING EPOCH: 120 ----------------------------  
client [76] (testset)   loss: 4.9476 -> 4.9937  accuracy: 7.44% -> 7.44%       
client [65] (testset)   loss: 4.5874 -> 4.7477  accuracy: 6.00% -> 7.33%       
client [95] (testset)   loss: 4.0972 -> 4.1099  accuracy: 16.06% -> 18.25%     
client [17] (testset)   loss: 4.7091 -> 4.3373  accuracy: 7.33% -> 8.67%       
client [8]  (testset)   loss: 4.5656 -> 4.6441  accuracy: 10.87% -> 11.59%     
client [35] (testset)   loss: 4.2553 -> 4.2914  accuracy: 9.58% -> 9.58%       
client [98] (testset)   loss: 4.5103 -> 4.5379  accuracy: 8.67% -> 5.33%       
client [53] (testset)   loss: 4.1673 -> 4.2494  accuracy: 13.70% -> 16.44%     
client [43] (testset)   loss: 4.3102 -> 4.2715  accuracy: 13.10% -> 13.10%     
client [64] (testset)   loss: 4.3247 -> 4.4269  accuracy: 9.59% -> 9.59%       
---------------------------- TRAINING EPOCH: 130 ----------------------------  
client [21] (testset)   loss: 4.0570 -> 4.0156  accuracy: 12.33% -> 15.07%     
client [88] (testset)   loss: 5.8348 -> 4.8785  accuracy: 10.71% -> 9.29%      
client [38] (testset)   loss: 4.3979 -> 4.6281  accuracy: 16.43% -> 15.71%     
client [3]  (testset)   loss: 3.8560 -> 3.8718  accuracy: 16.83% -> 20.79%     
client [5]  (testset)   loss: 4.4847 -> 4.6615  accuracy: 7.89% -> 7.89%       
client [41] (testset)   loss: 4.4967 -> 4.3526  accuracy: 12.95% -> 8.63%      
client [7]  (testset)   loss: 4.3989 -> 4.6454  accuracy: 10.00% -> 7.86%      
client [37] (testset)   loss: 4.1750 -> 4.2990  accuracy: 13.89% -> 14.58%     
client [45] (testset)   loss: 4.0890 -> 4.1680  accuracy: 7.43% -> 10.29%      
client [47] (testset)   loss: 4.2404 -> 4.2127  accuracy: 14.20% -> 11.36%     
---------------------------- TRAINING EPOCH: 140 ----------------------------  
client [16] (testset)   loss: 4.4087 -> 4.3922  accuracy: 11.72% -> 9.38%      
client [11] (testset)   loss: 4.4280 -> 4.4374  accuracy: 13.04% -> 13.77%     
client [37] (testset)   loss: 4.3746 -> 4.3905  accuracy: 19.44% -> 15.97%     
client [41] (testset)   loss: 4.3526 -> 5.1485  accuracy: 8.63% -> 7.91%       
client [95] (testset)   loss: 4.1247 -> 4.1421  accuracy: 18.25% -> 18.25%     
client [53] (testset)   loss: 4.2494 -> 4.2291  accuracy: 16.44% -> 16.44%     
client [22] (testset)   loss: 4.2563 -> 4.2836  accuracy: 12.68% -> 9.15%      
client [25] (testset)   loss: 4.9935 -> 5.2131  accuracy: 8.59% -> 7.03%       
client [69] (testset)   loss: 4.0836 -> 4.1000  accuracy: 20.50% -> 19.88%     
client [46] (testset)   loss: 4.2152 -> 4.4327  accuracy: 19.25% -> 16.15%     
---------------------------- TRAINING EPOCH: 150 ----------------------------  
client [47] (testset)   loss: 4.3286 -> 4.4773  accuracy: 11.36% -> 13.07%     
client [69] (testset)   loss: 4.0700 -> 4.4857  accuracy: 19.88% -> 15.53%     
client [82] (testset)   loss: 4.2104 -> 4.2028  accuracy: 17.16% -> 15.38%     
client [45] (testset)   loss: 4.2362 -> 4.2528  accuracy: 9.71% -> 9.71%       
client [7]  (testset)   loss: 4.6454 -> 5.1186  accuracy: 7.86% -> 7.86%       
client [50] (testset)   loss: 3.8413 -> 3.8747  accuracy: 18.03% -> 12.30%     
client [35] (testset)   loss: 4.2827 -> 4.2845  accuracy: 9.58% -> 10.18%      
client [24] (testset)   loss: 4.4813 -> 4.5250  accuracy: 12.32% -> 10.14%     
client [15] (testset)   loss: 3.9423 -> 3.9767  accuracy: 15.00% -> 15.00%     
client [58] (testset)   loss: 4.2480 -> 4.1867  accuracy: 15.70% -> 18.18%     
---------------------------- TRAINING EPOCH: 160 ----------------------------  
client [48] (testset)   loss: 4.1323 -> 4.1627  accuracy: 15.25% -> 15.82%     
client [76] (testset)   loss: 5.0342 -> 5.0421  accuracy: 7.44% -> 8.26%       
client [67] (testset)   loss: 4.7903 -> 4.8221  accuracy: 13.82% -> 13.16%     
client [37] (testset)   loss: 4.5495 -> 4.4228  accuracy: 13.19% -> 20.14%     
client [58] (testset)   loss: 4.1465 -> 4.1856  accuracy: 18.18% -> 18.18%     
client [64] (testset)   loss: 4.5100 -> 4.5780  accuracy: 10.96% -> 10.27%     
client [77] (testset)   loss: 4.2433 -> 4.3550  accuracy: 13.12% -> 11.25%     
client [55] (testset)   loss: 4.3604 -> 4.4151  accuracy: 16.20% -> 11.27%     
client [12] (testset)   loss: 4.2353 -> 4.2878  accuracy: 14.09% -> 14.09%     
client [89] (testset)   loss: 4.2066 -> 4.2146  accuracy: 10.96% -> 11.64%     
---------------------------- TRAINING EPOCH: 170 ----------------------------  
client [84] (testset)   loss: 4.1696 -> 4.1560  accuracy: 13.38% -> 12.68%     
client [51] (testset)   loss: 4.2492 -> 4.2678  accuracy: 15.49% -> 16.20%     
client [8]  (testset)   loss: 4.6701 -> 4.6237  accuracy: 10.14% -> 9.42%      
client [18] (testset)   loss: 3.9285 -> 3.8895  accuracy: 16.34% -> 18.95%     
client [94] (testset)   loss: 4.4023 -> 4.2564  accuracy: 12.86% -> 10.71%     
client [81] (testset)   loss: 4.4098 -> 4.4047  accuracy: 11.72% -> 13.10%     
client [3]  (testset)   loss: 3.8224 -> 3.8299  accuracy: 19.31% -> 17.82%     
client [11] (testset)   loss: 4.4706 -> 4.4741  accuracy: 14.49% -> 15.94%     
client [95] (testset)   loss: 4.1878 -> 4.1628  accuracy: 17.52% -> 16.79%     
client [67] (testset)   loss: 4.8221 -> 4.7728  accuracy: 13.16% -> 11.18%     
---------------------------- TRAINING EPOCH: 180 ----------------------------  
client [21] (testset)   loss: 4.1231 -> 4.1757  accuracy: 11.64% -> 12.33%     
client [79] (testset)   loss: 4.1068 -> 4.1007  accuracy: 18.18% -> 17.61%     
client [58] (testset)   loss: 4.1171 -> 4.1666  accuracy: 18.18% -> 16.53%     
client [88] (testset)   loss: 4.5883 -> 4.6347  accuracy: 12.86% -> 12.14%     
client [46] (testset)   loss: 4.1331 -> 4.2595  accuracy: 16.15% -> 17.39%     
client [11] (testset)   loss: 4.4741 -> 4.4332  accuracy: 15.94% -> 15.22%     
client [55] (testset)   loss: 4.4174 -> 4.4864  accuracy: 12.68% -> 9.15%      
client [13] (testset)   loss: 4.1801 -> 4.1538  accuracy: 15.65% -> 14.29%     
client [31] (testset)   loss: 5.0925 -> 4.9787  accuracy: 6.92% -> 8.46%       
client [75] (testset)   loss: 4.2066 -> 4.2219  accuracy: 15.24% -> 15.85%     
---------------------------- TRAINING EPOCH: 190 ----------------------------  
client [19] (testset)   loss: 4.2103 -> 4.2806  accuracy: 16.86% -> 13.95%     
client [7]  (testset)   loss: 4.5745 -> 4.5698  accuracy: 12.86% -> 13.57%     
client [57] (testset)   loss: 4.1421 -> 4.1873  accuracy: 14.10% -> 15.38%     
client [13] (testset)   loss: 4.2147 -> 4.1434  accuracy: 14.97% -> 15.65%     
client [43] (testset)   loss: 4.3683 -> 4.3608  accuracy: 15.17% -> 16.55%     
client [91] (testset)   loss: 4.3749 -> 4.3482  accuracy: 11.11% -> 10.56%     
client [10] (testset)   loss: 4.3652 -> 4.3832  accuracy: 14.47% -> 13.82%     
client [64] (testset)   loss: 4.6137 -> 4.6454  accuracy: 10.96% -> 10.27%     
client [82] (testset)   loss: 4.1544 -> 4.1224  accuracy: 15.38% -> 17.75%     
client [22] (testset)   loss: 4.5219 -> 4.4697  accuracy: 7.75% -> 8.45%       
---------------------------- TRAINING EPOCH: 200 ----------------------------  
client [20] (testset)   loss: 4.3379 -> 4.3230  accuracy: 10.77% -> 11.54%     
client [23] (testset)   loss: 3.9991 -> 4.0636  accuracy: 18.24% -> 17.65%     
client [88] (testset)   loss: 4.6347 -> 4.5821  accuracy: 12.14% -> 12.14%     
client [98] (testset)   loss: 4.4026 -> 4.5152  accuracy: 10.00% -> 9.33%      
client [79] (testset)   loss: 4.0403 -> 4.0645  accuracy: 19.32% -> 18.75%     
client [21] (testset)   loss: 4.1443 -> 4.1545  accuracy: 13.01% -> 14.38%     
client [92] (testset)   loss: 4.3962 -> 4.4591  accuracy: 10.56% -> 11.97%     
client [56] (testset)   loss: 4.2196 -> 4.2436  accuracy: 14.71% -> 15.44%     
client [5]  (testset)   loss: 4.5543 -> 4.4836  accuracy: 9.21% -> 9.87%       
client [52] (testset)   loss: 3.8860 -> 3.8986  accuracy: 22.73% -> 20.78%     
---------------------------- TRAINING EPOCH: 210 ----------------------------  
client [67] (testset)   loss: 4.7732 -> 4.7679  accuracy: 12.50% -> 12.50%     
client [54] (testset)   loss: 4.5679 -> 4.5976  accuracy: 11.02% -> 9.32%      
client [14] (testset)   loss: 4.6020 -> 4.5009  accuracy: 10.08% -> 8.53%      
client [99] (testset)   loss: 4.2905 -> 4.2632  accuracy: 13.74% -> 14.84%     
client [36] (testset)   loss: 4.3703 -> 4.3228  accuracy: 13.25% -> 12.65%     
client [30] (testset)   loss: 4.4021 -> 4.3765  accuracy: 11.80% -> 14.04%     
client [38] (testset)   loss: 4.2894 -> 4.4175  accuracy: 16.43% -> 15.71%     
client [15] (testset)   loss: 4.0061 -> 4.1362  accuracy: 12.14% -> 12.86%     
client [6]  (testset)   loss: 4.2810 -> 4.1984  accuracy: 13.73% -> 13.07%     
client [53] (testset)   loss: 4.2567 -> 4.2719  accuracy: 17.12% -> 17.12%     
---------------------------- TRAINING EPOCH: 220 ----------------------------  
client [99] (testset)   loss: 4.2002 -> 4.2432  accuracy: 14.29% -> 13.19%     
client [6]  (testset)   loss: 4.1984 -> 4.1699  accuracy: 13.07% -> 14.38%     
client [83] (testset)   loss: 3.7881 -> 3.7935  accuracy: 21.66% -> 19.75%     
client [42] (testset)   loss: 4.1509 -> 4.1484  accuracy: 15.29% -> 15.29%     
client [34] (testset)   loss: 4.3053 -> 4.2864  accuracy: 13.29% -> 15.82%     
client [15] (testset)   loss: 4.1362 -> 4.0626  accuracy: 12.86% -> 14.29%     
client [47] (testset)   loss: 4.4043 -> 4.3935  accuracy: 15.91% -> 14.20%     
client [55] (testset)   loss: 4.4206 -> 4.4351  accuracy: 12.68% -> 13.38%     
client [51] (testset)   loss: 4.2900 -> 4.2060  accuracy: 14.08% -> 15.49%     
client [95] (testset)   loss: 4.1260 -> 4.0867  accuracy: 18.98% -> 18.98%     
---------------------------- TRAINING EPOCH: 230 ----------------------------  
client [71] (testset)   loss: 4.5831 -> 4.5636  accuracy: 13.92% -> 13.29%     
client [15] (testset)   loss: 4.0626 -> 4.0272  accuracy: 14.29% -> 14.29%     
client [33] (testset)   loss: 4.7357 -> 4.6621  accuracy: 12.18% -> 14.74%     
client [99] (testset)   loss: 4.2284 -> 4.2739  accuracy: 12.64% -> 12.64%     
client [90] (testset)   loss: 4.9438 -> 4.7345  accuracy: 12.77% -> 11.35%     
client [57] (testset)   loss: 4.2022 -> 4.2043  accuracy: 15.38% -> 14.10%     
client [27] (testset)   loss: 4.1455 -> 4.0508  accuracy: 16.55% -> 15.86%     
client [78] (testset)   loss: 4.4024 -> 4.4265  accuracy: 9.66% -> 11.03%      
client [36] (testset)   loss: 4.3793 -> 4.3561  accuracy: 13.86% -> 12.65%     
client [88] (testset)   loss: 4.5560 -> 4.5351  accuracy: 10.71% -> 11.43%     
---------------------------- TRAINING EPOCH: 240 ----------------------------  
client [70] (testset)   loss: 3.8539 -> 3.8638  accuracy: 17.81% -> 17.12%     
client [35] (testset)   loss: 4.2873 -> 4.2899  accuracy: 10.18% -> 10.78%     
client [16] (testset)   loss: 4.4890 -> 4.3951  accuracy: 10.94% -> 11.72%     
client [80] (testset)   loss: 4.2921 -> 4.2485  accuracy: 13.92% -> 13.29%     
client [38] (testset)   loss: 4.3252 -> 4.3314  accuracy: 17.14% -> 15.00%     
client [78] (testset)   loss: 4.4357 -> 4.3801  accuracy: 11.03% -> 10.34%     
client [68] (testset)   loss: 4.4208 -> 4.3662  accuracy: 14.46% -> 15.06%     
client [11] (testset)   loss: 4.3904 -> 4.3995  accuracy: 15.22% -> 15.94%     
client [64] (testset)   loss: 4.5876 -> 4.6278  accuracy: 12.33% -> 11.64%     
client [82] (testset)   loss: 4.1001 -> 4.1109  accuracy: 16.57% -> 16.57%     
---------------------------- TRAINING EPOCH: 250 ----------------------------  
client [30] (testset)   loss: 4.3629 -> 4.3765  accuracy: 13.48% -> 12.92%     
client [27] (testset)   loss: 4.0508 -> 4.0964  accuracy: 15.86% -> 16.55%     
client [74] (testset)   loss: 4.4100 -> 4.4284  accuracy: 10.71% -> 10.71%     
client [45] (testset)   loss: 4.2683 -> 4.2573  accuracy: 13.14% -> 12.57%     
client [6]  (testset)   loss: 4.2331 -> 4.2644  accuracy: 13.73% -> 14.38%     
client [36] (testset)   loss: 4.4112 -> 4.3958  accuracy: 12.65% -> 12.65%     
client [63] (testset)   loss: 4.5786 -> 4.5676  accuracy: 6.61% -> 10.74%      
client [76] (testset)   loss: 5.1114 -> 5.0472  accuracy: 8.26% -> 9.09%       
client [83] (testset)   loss: 3.7850 -> 3.7605  accuracy: 20.38% -> 21.02%     
client [86] (testset)   loss: 4.4862 -> 4.4565  accuracy: 12.68% -> 13.38%     
---------------------------- TRAINING EPOCH: 260 ----------------------------  
client [83] (testset)   loss: 3.7605 -> 3.7667  accuracy: 21.02% -> 21.66%     
client [99] (testset)   loss: 4.3035 -> 4.2354  accuracy: 12.09% -> 12.09%     
client [74] (testset)   loss: 4.4452 -> 4.5340  accuracy: 10.71% -> 10.71%     
client [73] (testset)   loss: 4.4674 -> 4.4644  accuracy: 14.02% -> 15.24%     
client [29] (testset)   loss: 4.0240 -> 4.0330  accuracy: 14.59% -> 14.59%     
client [92] (testset)   loss: 4.3052 -> 4.3661  accuracy: 11.97% -> 11.97%     
client [6]  (testset)   loss: 4.2060 -> 4.2459  accuracy: 14.38% -> 14.38%     
client [61] (testset)   loss: 4.5339 -> 4.6725  accuracy: 9.23% -> 9.23%       
client [21] (testset)   loss: 4.2951 -> 4.2529  accuracy: 13.70% -> 14.38%     
client [67] (testset)   loss: 4.7571 -> 4.7619  accuracy: 11.84% -> 11.18%     
---------------------------- TRAINING EPOCH: 270 ----------------------------  
client [83] (testset)   loss: 3.7667 -> 3.7459  accuracy: 21.66% -> 21.02%     
client [32] (testset)   loss: 4.2738 -> 4.2786  accuracy: 16.46% -> 16.46%     
client [95] (testset)   loss: 4.1026 -> 4.0951  accuracy: 18.98% -> 19.71%     
client [61] (testset)   loss: 4.6257 -> 4.6078  accuracy: 6.92% -> 10.77%      
client [27] (testset)   loss: 4.0964 -> 4.1306  accuracy: 16.55% -> 16.55%     
client [25] (testset)   loss: 4.4838 -> 4.5618  accuracy: 10.94% -> 13.28%     
client [68] (testset)   loss: 4.3096 -> 4.3443  accuracy: 15.66% -> 16.27%     
client [34] (testset)   loss: 4.2866 -> 4.2858  accuracy: 13.29% -> 14.56%     
client [71] (testset)   loss: 4.5394 -> 4.5234  accuracy: 13.29% -> 13.29%     
client [89] (testset)   loss: 4.1963 -> 4.1645  accuracy: 14.38% -> 13.70%     
---------------------------- TRAINING EPOCH: 280 ----------------------------  
client [78] (testset)   loss: 4.3901 -> 4.4190  accuracy: 10.34% -> 11.03%     
client [81] (testset)   loss: 4.3569 -> 4.3880  accuracy: 11.03% -> 11.72%     
client [51] (testset)   loss: 4.2631 -> 4.2015  accuracy: 14.08% -> 14.79%     
client [54] (testset)   loss: 4.5428 -> 4.5771  accuracy: 11.02% -> 10.17%     
client [65] (testset)   loss: 4.4270 -> 4.4621  accuracy: 10.00% -> 10.00%     
client [41] (testset)   loss: 4.3717 -> 4.3668  accuracy: 11.51% -> 12.95%     
client [11] (testset)   loss: 4.3803 -> 4.3981  accuracy: 14.49% -> 15.22%     
client [85] (testset)   loss: 4.3655 -> 4.3321  accuracy: 7.14% -> 8.33%       
client [12] (testset)   loss: 4.2154 -> 4.2333  accuracy: 14.77% -> 14.77%     
client [23] (testset)   loss: 4.1460 -> 4.1417  accuracy: 17.06% -> 18.24%     
---------------------------- TRAINING EPOCH: 290 ----------------------------  
client [16] (testset)   loss: 4.4731 -> 4.4308  accuracy: 11.72% -> 14.06%     
client [65] (testset)   loss: 4.3630 -> 4.3891  accuracy: 10.67% -> 9.33%      
client [53] (testset)   loss: 4.1884 -> 4.2252  accuracy: 18.49% -> 15.75%     
client [58] (testset)   loss: 4.0909 -> 4.1731  accuracy: 19.01% -> 17.36%     
client [72] (testset)   loss: 4.9010 -> 4.9525  accuracy: 8.77% -> 7.89%       
client [7]  (testset)   loss: 4.3973 -> 4.4487  accuracy: 14.29% -> 13.57%     
client [71] (testset)   loss: 4.5234 -> 4.5419  accuracy: 13.29% -> 13.92%     
client [59] (testset)   loss: 4.1409 -> 4.1428  accuracy: 12.32% -> 12.32%     
client [86] (testset)   loss: 4.4716 -> 4.4477  accuracy: 13.38% -> 16.90%     
client [39] (testset)   loss: 4.4385 -> 4.4097  accuracy: 12.34% -> 12.99%     
---------------------------- TRAINING EPOCH: 300 ----------------------------  
client [99] (testset)   loss: 4.2582 -> 4.1948  accuracy: 12.09% -> 12.64%     
client [7]  (testset)   loss: 4.4125 -> 4.4190  accuracy: 15.00% -> 14.29%     
client [17] (testset)   loss: 4.4389 -> 4.3729  accuracy: 14.00% -> 12.67%     
client [64] (testset)   loss: 4.5946 -> 4.5861  accuracy: 10.96% -> 11.64%     
client [37] (testset)   loss: 4.3907 -> 4.3777  accuracy: 14.58% -> 16.67%     
client [29] (testset)   loss: 4.0458 -> 4.0519  accuracy: 15.68% -> 14.05%     
client [93] (testset)   loss: 4.8075 -> 4.7589  accuracy: 10.07% -> 10.79%     
client [73] (testset)   loss: 4.4464 -> 4.4151  accuracy: 14.02% -> 14.02%     
client [40] (testset)   loss: 4.2310 -> 4.2158  accuracy: 11.98% -> 13.77%     
client [76] (testset)   loss: 4.9960 -> 5.0212  accuracy: 9.92% -> 9.09%       
---------------------------- TRAINING EPOCH: 310 ----------------------------  
client [31] (testset)   loss: 4.8584 -> 4.7777  accuracy: 7.69% -> 7.69%       
client [89] (testset)   loss: 4.2009 -> 4.1929  accuracy: 12.33% -> 13.70%     
client [77] (testset)   loss: 4.2059 -> 4.2010  accuracy: 10.00% -> 10.00%     
client [90] (testset)   loss: 4.7892 -> 4.7391  accuracy: 12.06% -> 12.77%     
client [26] (testset)   loss: 4.2212 -> 4.2333  accuracy: 18.52% -> 18.52%     
client [50] (testset)   loss: 4.0942 -> 4.1666  accuracy: 20.49% -> 21.31%     
client [30] (testset)   loss: 4.3460 -> 4.3570  accuracy: 12.36% -> 12.92%     
client [70] (testset)   loss: 3.8438 -> 3.8453  accuracy: 17.81% -> 17.81%     
client [41] (testset)   loss: 5.0642 -> 4.4225  accuracy: 9.35% -> 12.95%      
client [99] (testset)   loss: 4.1948 -> 4.2172  accuracy: 12.64% -> 12.09%     
---------------------------- TRAINING EPOCH: 320 ----------------------------  
client [68] (testset)   loss: 4.3240 -> 4.3025  accuracy: 17.47% -> 16.87%     
client [70] (testset)   loss: 3.8490 -> 3.8403  accuracy: 17.81% -> 17.81%     
client [52] (testset)   loss: 3.9373 -> 3.9016  accuracy: 22.08% -> 20.13%     
client [1]  (testset)   loss: 4.3620 -> 4.4077  accuracy: 10.64% -> 11.35%     
client [2]  (testset)   loss: 3.9913 -> 3.9999  accuracy: 17.18% -> 17.18%     
client [67] (testset)   loss: 4.6767 -> 4.6821  accuracy: 12.50% -> 11.84%     
client [92] (testset)   loss: 4.3071 -> 4.3119  accuracy: 13.38% -> 14.08%     
client [35] (testset)   loss: 4.2611 -> 4.2538  accuracy: 9.58% -> 11.98%      
client [36] (testset)   loss: 4.3564 -> 4.3372  accuracy: 11.45% -> 11.45%     
client [64] (testset)   loss: 4.6001 -> 4.6345  accuracy: 10.96% -> 12.33%     
---------------------------- TRAINING EPOCH: 330 ----------------------------  
client [44] (testset)   loss: 4.4406 -> 4.4080  accuracy: 17.86% -> 15.71%     
client [6]  (testset)   loss: 4.1496 -> 4.1570  accuracy: 14.38% -> 16.34%     
client [12] (testset)   loss: 4.2407 -> 4.2167  accuracy: 14.09% -> 14.09%     
client [55] (testset)   loss: 4.3712 -> 4.3635  accuracy: 14.08% -> 12.68%     
client [29] (testset)   loss: 4.0430 -> 4.0567  accuracy: 14.59% -> 14.59%     
client [9]  (testset)   loss: 4.0652 -> 4.0843  accuracy: 14.71% -> 14.12%     
client [43] (testset)   loss: 4.2839 -> 4.2969  accuracy: 17.24% -> 17.93%     
client [77] (testset)   loss: 4.2010 -> 4.2619  accuracy: 10.00% -> 11.88%     
client [98] (testset)   loss: 4.3585 -> 4.3308  accuracy: 13.33% -> 11.33%     
client [78] (testset)   loss: 4.3789 -> 4.3867  accuracy: 9.66% -> 11.03%      
---------------------------- TRAINING EPOCH: 340 ----------------------------  
client [92] (testset)   loss: 4.3261 -> 4.3208  accuracy: 11.97% -> 14.08%     
client [80] (testset)   loss: 4.2316 -> 4.2340  accuracy: 13.92% -> 12.66%     
client [63] (testset)   loss: 4.4826 -> 4.4796  accuracy: 9.09% -> 9.09%       
client [76] (testset)   loss: 4.9736 -> 4.9066  accuracy: 8.26% -> 8.26%       
client [78] (testset)   loss: 4.3867 -> 4.4102  accuracy: 11.03% -> 9.66%      
client [25] (testset)   loss: 4.5996 -> 4.6786  accuracy: 12.50% -> 10.16%     
client [58] (testset)   loss: 4.1029 -> 4.1130  accuracy: 17.36% -> 18.18%     
client [13] (testset)   loss: 4.1453 -> 4.1130  accuracy: 16.33% -> 17.01%     
client [17] (testset)   loss: 4.3396 -> 4.4328  accuracy: 12.67% -> 12.67%     
client [38] (testset)   loss: 4.4286 -> 4.3006  accuracy: 14.29% -> 15.00%     
---------------------------- TRAINING EPOCH: 350 ----------------------------  
client [72] (testset)   loss: 4.8470 -> 4.8797  accuracy: 6.14% -> 7.89%       
client [82] (testset)   loss: 4.0438 -> 4.0433  accuracy: 17.75% -> 17.16%     
client [86] (testset)   loss: 4.4076 -> 4.4154  accuracy: 15.49% -> 15.49%     
client [51] (testset)   loss: 4.1815 -> 4.2204  accuracy: 14.08% -> 15.49%     
client [96] (testset)   loss: 4.3197 -> 4.3353  accuracy: 12.30% -> 11.48%     
client [42] (testset)   loss: 4.1316 -> 4.1203  accuracy: 15.29% -> 14.01%     
client [55] (testset)   loss: 4.3633 -> 4.3563  accuracy: 15.49% -> 14.79%     
client [13] (testset)   loss: 4.1108 -> 4.1357  accuracy: 15.65% -> 17.69%     
client [1]  (testset)   loss: 4.4450 -> 4.4197  accuracy: 12.06% -> 12.77%     
client [12] (testset)   loss: 4.2167 -> 4.2079  accuracy: 14.09% -> 14.77%     
---------------------------- TRAINING EPOCH: 360 ----------------------------  
client [68] (testset)   loss: 4.3406 -> 4.3115  accuracy: 15.66% -> 17.47%     
client [23] (testset)   loss: 4.1107 -> 4.0910  accuracy: 17.06% -> 18.82%     
client [46] (testset)   loss: 3.9286 -> 3.9998  accuracy: 21.12% -> 19.88%     
client [41] (testset)   loss: 4.3690 -> 4.3961  accuracy: 11.51% -> 13.67%     
client [25] (testset)   loss: 4.6031 -> 4.6187  accuracy: 12.50% -> 10.94%     
client [58] (testset)   loss: 4.1201 -> 4.0873  accuracy: 17.36% -> 17.36%     
client [14] (testset)   loss: 4.3408 -> 4.4027  accuracy: 11.63% -> 10.85%     
client [33] (testset)   loss: 4.6396 -> 4.6712  accuracy: 13.46% -> 12.18%     
client [85] (testset)   loss: 4.3031 -> 4.2786  accuracy: 8.93% -> 9.52%       
client [62] (testset)   loss: 4.3235 -> 4.3323  accuracy: 12.00% -> 12.80%     
---------------------------- TRAINING EPOCH: 370 ----------------------------  
client [98] (testset)   loss: 4.2921 -> 4.2967  accuracy: 13.33% -> 13.33%     
client [63] (testset)   loss: 4.5434 -> 4.5159  accuracy: 9.92% -> 9.92%       
client [70] (testset)   loss: 3.8364 -> 3.8642  accuracy: 18.49% -> 17.12%     
client [65] (testset)   loss: 4.3814 -> 4.3741  accuracy: 9.33% -> 10.67%      
client [14] (testset)   loss: 4.3287 -> 4.3088  accuracy: 10.85% -> 10.85%     
client [73] (testset)   loss: 4.4152 -> 4.4706  accuracy: 14.02% -> 14.63%     
client [34] (testset)   loss: 4.2373 -> 4.2490  accuracy: 15.19% -> 16.46%     
client [99] (testset)   loss: 4.2527 -> 4.2601  accuracy: 13.74% -> 12.09%     
client [69] (testset)   loss: 4.0155 -> 3.9955  accuracy: 18.01% -> 20.50%     
client [46] (testset)   loss: 3.9998 -> 3.9319  accuracy: 19.88% -> 21.12%     
---------------------------- TRAINING EPOCH: 380 ----------------------------  
client [99] (testset)   loss: 4.2217 -> 4.2035  accuracy: 13.19% -> 12.64%     
client [93] (testset)   loss: 4.7132 -> 4.8337  accuracy: 10.07% -> 10.07%     
client [11] (testset)   loss: 4.3445 -> 4.3182  accuracy: 15.94% -> 16.67%     
client [58] (testset)   loss: 4.1273 -> 4.1364  accuracy: 17.36% -> 18.18%     
client [81] (testset)   loss: 4.3393 -> 4.3240  accuracy: 11.03% -> 11.03%     
client [85] (testset)   loss: 4.2786 -> 4.2750  accuracy: 9.52% -> 9.52%       
client [89] (testset)   loss: 4.1685 -> 4.1868  accuracy: 14.38% -> 12.33%     
client [45] (testset)   loss: 4.1722 -> 4.1926  accuracy: 13.14% -> 14.29%     
client [8]  (testset)   loss: 4.5674 -> 4.5605  accuracy: 8.70% -> 7.97%       
client [68] (testset)   loss: 4.2829 -> 4.2935  accuracy: 15.66% -> 16.87%     
---------------------------- TRAINING EPOCH: 390 ----------------------------  
client [67] (testset)   loss: 4.6322 -> 4.6269  accuracy: 12.50% -> 12.50%     
client [72] (testset)   loss: 4.8822 -> 4.8890  accuracy: 7.02% -> 7.02%       
client [1]  (testset)   loss: 4.3856 -> 4.4887  accuracy: 12.06% -> 11.35%     
client [78] (testset)   loss: 4.3860 -> 4.4410  accuracy: 10.34% -> 9.66%      
client [83] (testset)   loss: 3.7367 -> 3.7431  accuracy: 22.29% -> 22.93%     
client [21] (testset)   loss: 4.2342 -> 4.2404  accuracy: 15.07% -> 14.38%     
client [56] (testset)   loss: 4.1955 -> 4.1906  accuracy: 13.97% -> 14.71%     
client [44] (testset)   loss: 4.3206 -> 4.4289  accuracy: 17.14% -> 16.43%     
client [92] (testset)   loss: 4.2898 -> 4.2795  accuracy: 14.08% -> 12.68%     
client [27] (testset)   loss: 4.0543 -> 4.0064  accuracy: 17.24% -> 16.55%     
---------------------------- TRAINING EPOCH: 400 ----------------------------  
client [10] (testset)   loss: 4.3168 -> 4.3216  accuracy: 14.47% -> 14.47%     
client [39] (testset)   loss: 4.3970 -> 4.3827  accuracy: 12.34% -> 12.34%     
client [65] (testset)   loss: 4.4192 -> 4.3565  accuracy: 11.33% -> 10.67%     
client [26] (testset)   loss: 4.1574 -> 4.2421  accuracy: 18.52% -> 19.14%     
client [19] (testset)   loss: 4.1701 -> 4.1676  accuracy: 18.02% -> 16.86%     
client [68] (testset)   loss: 4.2812 -> 4.2879  accuracy: 16.87% -> 17.47%     
client [41] (testset)   loss: 4.4268 -> 4.3377  accuracy: 12.23% -> 11.51%     
client [50] (testset)   loss: 4.1575 -> 4.1228  accuracy: 17.21% -> 18.03%     
client [75] (testset)   loss: 4.1920 -> 4.2280  accuracy: 14.63% -> 14.02%     
client [81] (testset)   loss: 4.3283 -> 4.3123  accuracy: 11.03% -> 11.03%     
Training... ---------------------------------------- 100% 0:53:07
FedProto's average time taken by each global epoch: 0 min 7.94 sec.            
FedProto's total running time: 0 h 53 m 7 s.                                   
==================== FedProto Experiment Results: ====================         
Display format: (before local fine-tuning) -> (after local fine-tuning)        
 So if finetune_epoch = 0, x.xx% -> 0.00% is normal.                           
 Centralized testing ONLY happens after model aggregation, so the stats between
'->' are the same.                                                             
{                                                                              
    "100": {                                                                   
        "all_clients": {                                                       
            "test": {                                                          
                "loss": "4.2833 -> 0.0000",                                    
                "accuracy": "11.88% -> 0.00%"                                  
            }                                                                  
        }                                                                      
    },                                                                         
    "200": {                                                                   
        "all_clients": {                                                       
            "test": {                                                          
                "loss": "4.3695 -> 0.0000",                                    
                "accuracy": "13.45% -> 0.00%"                                  
            }                                                                  
        }                                                                      
    },                                                                         
    "300": {                                                                   
        "all_clients": {                                                       
            "test": {                                                          
                "loss": "4.3075 -> 0.0000",                                    
                "accuracy": "14.08% -> 0.00%"                                  
            }                                                                  
        }                                                                      
    },                                                                         
    "400": {                                                                   
        "all_clients": {                                                       
            "test": {                                                          
                "loss": "4.2803 -> 0.0000",                                    
                "accuracy": "13.94% -> 0.00%"                                  
            }                                                                  
        }                                                                      
    }                                                                          
}                                                                              
==================== FedProto Max Accuracy ====================                
all_clients:                                                                   
(test) before fine-tuning: 14.08% at epoch 300                                 
(test) after fine-tuning: 0.00% at epoch 100                                   
[0m