==================== FedPer ====================                               
Experiment Arguments:                                                          
{
│   'method': 'fedper',
│   'dataset': {
│   │   'name': 'cifar100',
│   │   'client_num': 100,
│   │   'test_ratio': 0.25,
│   │   'val_ratio': 0.0,
│   │   'seed': 42,
│   │   'split': 'sample',
│   │   'IID_ratio': 0.0,
│   │   'monitor_window_name_suffix': 'cifar100-100clients-0%IID-use20superclasses-Dir(1.0)-seed42',
│   │   'super_class': False,
│   │   'alpha': 1.0,
│   │   'min_samples_per_client': 10
│   },
│   'model': {
│   │   'name': 'avgcnn',
│   │   'use_torchvision_pretrained_weights': True,
│   │   'external_model_weights_path': None
│   },
│   'optimizer': {
│   │   'lr': 0.01,
│   │   'dampening': 0,
│   │   'weight_decay': 0,
│   │   'momentum': 0,
│   │   'nesterov': False,
│   │   'name': 'sgd'
│   },
│   'mode': 'serial',
│   'parallel': {
│   │   'ray_cluster_addr': None,
│   │   'num_cpus': None,
│   │   'num_gpus': None,
│   │   'num_workers': 2
│   },
│   'common': {
│   │   'seed': 42,
│   │   'join_ratio': 0.1,
│   │   'global_epoch': 400,
│   │   'local_epoch': 5,
│   │   'batch_size': 32,
│   │   'reset_optimizer_on_global_epoch': True,
│   │   'straggler_ratio': 0,
│   │   'straggler_min_local_epoch': 0,
│   │   'buffers': 'global',
│   │   'client_side_evaluation': True,
│   │   'test': {
│   │   │   'client': {
│   │   │   │   'interval': 100,
│   │   │   │   'finetune_epoch': 0,
│   │   │   │   'train': False,
│   │   │   │   'val': False,
│   │   │   │   'test': True
│   │   │   },
│   │   │   'server': {
│   │   │   │   'interval': -1,
│   │   │   │   'train': False,
│   │   │   │   'val': False,
│   │   │   │   'test': False,
│   │   │   │   'model_in_train_mode': False
│   │   │   }
│   │   },
│   │   'verbose_gap': 10,
│   │   'monitor': None,
│   │   'use_cuda': True,
│   │   'save_log': True,
│   │   'save_model': False,
│   │   'save_learning_curve_plot': False,
│   │   'save_metrics': True,
│   │   'delete_useless_run': True
│   }
}
---------------------------- TRAINING EPOCH: 10 ----------------------------   
client [77] (testset)   loss: 4.0394 -> 5.8721  accuracy: 7.50% -> 3.75%       
client [81] (testset)   loss: 3.8490 -> 4.2034  accuracy: 11.72% -> 8.28%      
client [21] (testset)   loss: 4.0892 -> 4.0058  accuracy: 6.16% -> 10.96%      
client [68] (testset)   loss: 3.7716 -> 4.4216  accuracy: 12.65% -> 4.22%      
client [93] (testset)   loss: 3.9609 -> 5.2112  accuracy: 9.35% -> 3.60%       
client [31] (testset)   loss: 4.1471 -> 4.8157  accuracy: 6.92% -> 4.62%       
client [20] (testset)   loss: 3.8264 -> 4.7345  accuracy: 13.08% -> 6.92%      
client [59] (testset)   loss: 4.1019 -> 4.0353  accuracy: 8.70% -> 9.42%       
client [48] (testset)   loss: 3.7050 -> 4.2392  accuracy: 13.56% -> 6.21%      
client [34] (testset)   loss: 3.7164 -> 4.1043  accuracy: 17.09% -> 13.92%     
---------------------------- TRAINING EPOCH: 20 ----------------------------   
client [69] (testset)   loss: 3.4021 -> 4.5673  accuracy: 18.01% -> 13.66%     
client [99] (testset)   loss: 3.6765 -> 5.0366  accuracy: 17.03% -> 9.34%      
client [67] (testset)   loss: 3.9250 -> 5.4465  accuracy: 17.11% -> 10.53%     
client [0]  (testset)   loss: 3.6483 -> 4.4792  accuracy: 16.18% -> 11.03%     
client [76] (testset)   loss: 4.3342 -> 6.3053  accuracy: 11.57% -> 5.79%      
client [41] (testset)   loss: 4.1707 -> 4.5257  accuracy: 15.83% -> 12.95%     
client [62] (testset)   loss: 3.7838 -> 3.8366  accuracy: 12.80% -> 16.00%     
client [2]  (testset)   loss: 3.8061 -> 3.8981  accuracy: 15.34% -> 15.95%     
client [14] (testset)   loss: 3.8388 -> 5.9148  accuracy: 12.40% -> 6.20%      
client [46] (testset)   loss: 4.2869 -> 6.4106  accuracy: 14.91% -> 12.42%     
---------------------------- TRAINING EPOCH: 30 ----------------------------   
client [24] (testset)   loss: 4.6688 -> 5.7018  accuracy: 15.22% -> 11.59%     
client [68] (testset)   loss: 5.3283 -> 6.6261  accuracy: 16.27% -> 18.07%     
client [57] (testset)   loss: 4.2466 -> 5.2982  accuracy: 20.51% -> 19.87%     
client [17] (testset)   loss: 5.9636 -> 6.9482  accuracy: 7.33% -> 10.00%      
client [54] (testset)   loss: 5.8273 -> 6.6526  accuracy: 13.56% -> 12.71%     
client [23] (testset)   loss: 4.5079 -> 4.4451  accuracy: 10.59% -> 15.29%     
client [35] (testset)   loss: 4.4182 -> 5.2251  accuracy: 15.57% -> 13.17%     
client [59] (testset)   loss: 4.6218 -> 5.7663  accuracy: 12.32% -> 14.49%     
client [31] (testset)   loss: 5.6881 -> 7.0950  accuracy: 12.31% -> 12.31%     
client [9]  (testset)   loss: 4.4897 -> 5.2311  accuracy: 14.71% -> 15.29%     
---------------------------- TRAINING EPOCH: 40 ----------------------------   
client [64] (testset)   loss: 5.6988 -> 6.5979  accuracy: 14.38% -> 10.96%     
client [33] (testset)   loss: 7.0458 -> 8.1586  accuracy: 15.38% -> 14.74%     
client [16] (testset)   loss: 6.4333 -> 7.0578  accuracy: 14.84% -> 16.41%     
client [44] (testset)   loss: 4.9095 -> 6.3431  accuracy: 21.43% -> 7.86%      
client [8]  (testset)   loss: 6.4487 -> 7.7162  accuracy: 16.67% -> 14.49%     
client [31] (testset)   loss: 7.3730 -> 8.4361  accuracy: 12.31% -> 12.31%     
client [47] (testset)   loss: 6.0970 -> 6.5950  accuracy: 13.64% -> 12.50%     
client [36] (testset)   loss: 4.9746 -> 5.9228  accuracy: 20.48% -> 17.47%     
client [20] (testset)   loss: 6.3858 -> 7.3983  accuracy: 13.85% -> 12.31%     
client [56] (testset)   loss: 4.9508 -> 5.7774  accuracy: 16.91% -> 17.65%     
---------------------------- TRAINING EPOCH: 50 ----------------------------   
client [4]  (testset)   loss: 8.2640 -> 6.7692  accuracy: 13.26% -> 12.15%     
client [60] (testset)   loss: 6.2891 -> 6.8478  accuracy: 15.71% -> 10.00%     
client [28] (testset)   loss: 6.2490 -> 6.8753  accuracy: 17.24% -> 16.55%     
client [25] (testset)   loss: 7.2002 -> 6.0398  accuracy: 15.62% -> 12.50%     
client [58] (testset)   loss: 6.7461 -> 7.5511  accuracy: 19.83% -> 16.53%     
client [44] (testset)   loss: 5.4724 -> 6.7892  accuracy: 15.71% -> 11.43%     
client [39] (testset)   loss: 6.2297 -> 6.9953  accuracy: 18.18% -> 14.94%     
client [29] (testset)   loss: 6.1541 -> 6.6144  accuracy: 14.05% -> 15.14%     
client [3]  (testset)   loss: 5.0606 -> 5.5419  accuracy: 21.29% -> 16.34%     
client [84] (testset)   loss: 6.0230 -> 6.7208  accuracy: 16.20% -> 19.01%     
---------------------------- TRAINING EPOCH: 60 ----------------------------   
client [21] (testset)   loss: 5.6488 -> 6.5817  accuracy: 17.81% -> 19.86%     
client [84] (testset)   loss: 6.2683 -> 6.8724  accuracy: 16.20% -> 17.61%     
client [10] (testset)   loss: 6.6414 -> 7.6562  accuracy: 13.16% -> 11.18%     
client [36] (testset)   loss: 6.5518 -> 7.6647  accuracy: 18.07% -> 15.06%     
client [65] (testset)   loss: 7.5727 -> 8.0771  accuracy: 10.67% -> 11.33%     
client [81] (testset)   loss: 6.8207 -> 7.9488  accuracy: 17.24% -> 17.24%     
client [79] (testset)   loss: 6.1821 -> 6.7956  accuracy: 18.75% -> 22.73%     
client [42] (testset)   loss: 6.7327 -> 7.3920  accuracy: 11.46% -> 10.19%     
client [11] (testset)   loss: 6.2067 -> 7.2724  accuracy: 17.39% -> 18.12%     
client [96] (testset)   loss: 6.9901 -> 8.1547  accuracy: 18.85% -> 18.03%     
---------------------------- TRAINING EPOCH: 70 ----------------------------   
client [8]  (testset)   loss: 8.3512 -> 8.9554  accuracy: 15.22% -> 16.67%     
client [53] (testset)   loss: 6.2530 -> 6.7409  accuracy: 17.81% -> 18.49%     
client [52] (testset)   loss: 6.7179 -> 7.3493  accuracy: 22.73% -> 21.43%     
client [42] (testset)   loss: 7.6212 -> 7.9929  accuracy: 10.19% -> 10.19%     
client [69] (testset)   loss: 7.2997 -> 7.7080  accuracy: 22.36% -> 21.74%     
client [59] (testset)   loss: 7.4295 -> 8.0481  accuracy: 12.32% -> 12.32%     
client [7]  (testset)   loss: 8.4635 -> 9.3585  accuracy: 15.00% -> 16.43%     
client [26] (testset)   loss: 7.2914 -> 7.8700  accuracy: 17.28% -> 19.14%     
client [49] (testset)   loss: 7.2692 -> 7.6808  accuracy: 15.79% -> 15.79%     
client [98] (testset)   loss: 8.5687 -> 8.9648  accuracy: 11.33% -> 11.33%     
---------------------------- TRAINING EPOCH: 80 ----------------------------   
client [98] (testset)   loss: 8.9669 -> 9.2678  accuracy: 10.00% -> 10.00%     
client [47] (testset)   loss: 8.9090 -> 8.4135  accuracy: 13.07% -> 13.07%     
client [21] (testset)   loss: 7.3559 -> 8.0294  accuracy: 17.81% -> 17.12%     
client [77] (testset)   loss: 9.3170 -> 9.3961  accuracy: 13.12% -> 13.12%     
client [95] (testset)   loss: 7.8609 -> 8.1242  accuracy: 16.79% -> 15.33%     
client [91] (testset)   loss: 7.6531 -> 8.1730  accuracy: 15.56% -> 16.11%     
client [14] (testset)   loss: 7.8358 -> 8.2198  accuracy: 15.50% -> 15.50%     
client [99] (testset)   loss: 7.8540 -> 8.3016  accuracy: 15.38% -> 13.74%     
client [20] (testset)   loss: 9.1195 -> 9.3856  accuracy: 13.08% -> 13.85%     
client [39] (testset)   loss: 8.2320 -> 8.6713  accuracy: 14.94% -> 14.94%     
---------------------------- TRAINING EPOCH: 90 ----------------------------   
client [52] (testset)   loss: 7.5887 -> 7.9670  accuracy: 20.78% -> 19.48%     
client [62] (testset)   loss: 8.0454 -> 8.2261  accuracy: 23.20% -> 23.20%     
client [71] (testset)   loss: 9.5798 -> 9.9051  accuracy: 12.03% -> 11.39%     
client [97] (testset)   loss: 8.7632 -> 8.4944  accuracy: 16.77% -> 13.04%     
client [30] (testset)   loss: 8.5425 -> 8.8800  accuracy: 16.29% -> 15.73%     
client [88] (testset)   loss: 8.7956 -> 9.0366  accuracy: 15.71% -> 14.29%     
client [60] (testset)   loss: 9.7586 -> 9.9253  accuracy: 11.43% -> 11.43%     
client [82] (testset)   loss: 8.3244 -> 8.7460  accuracy: 21.30% -> 21.30%     
client [91] (testset)   loss: 8.1616 -> 8.5254  accuracy: 16.11% -> 16.11%     
client [57] (testset)   loss: 7.6463 -> 8.0828  accuracy: 17.95% -> 16.67%     
---------------------------- TRAINING EPOCH: 100 ----------------------------  
client [31] (testset)   loss: 12.1287 -> 12.1710    accuracy: 12.31% -> 12.31% 
client [15] (testset)   loss: 8.8661 -> 8.9810  accuracy: 18.57% -> 19.29%     
client [71] (testset)   loss: 10.5661 -> 10.7179    accuracy: 12.03% -> 12.66% 
client [97] (testset)   loss: 9.9303 -> 10.1208 accuracy: 15.53% -> 15.53%     
client [53] (testset)   loss: 7.8603 -> 8.0196  accuracy: 16.44% -> 17.81%     
client [77] (testset)   loss: 10.8315 -> 10.9107    accuracy: 13.75% -> 12.50% 
client [76] (testset)   loss: 10.8746 -> 11.0760    accuracy: 11.57% -> 11.57% 
client [79] (testset)   loss: 8.3900 -> 8.5152  accuracy: 21.59% -> 21.02%     
client [28] (testset)   loss: 9.8635 -> 10.0188 accuracy: 17.24% -> 17.24%     
client [99] (testset)   loss: 9.2320 -> 9.3526  accuracy: 15.38% -> 15.93%     
---------------------------- TRAINING EPOCH: 110 ----------------------------  
client [97] (testset)   loss: 9.9453 -> 10.1181 accuracy: 16.15% -> 14.91%     
client [86] (testset)   loss: 8.9571 -> 9.1374  accuracy: 12.68% -> 13.38%     
client [34] (testset)   loss: 9.0409 -> 9.2604  accuracy: 23.42% -> 22.78%     
client [73] (testset)   loss: 9.9061 -> 10.0947 accuracy: 13.41% -> 13.41%     
client [5]  (testset)   loss: 9.5718 -> 9.7753  accuracy: 13.16% -> 12.50%     
client [96] (testset)   loss: 10.3664 -> 10.5443    accuracy: 18.03% -> 18.85% 
client [22] (testset)   loss: 8.3110 -> 8.5551  accuracy: 14.08% -> 15.49%     
client [60] (testset)   loss: 10.6289 -> 10.7339    accuracy: 11.43% -> 11.43% 
client [66] (testset)   loss: 7.5469 -> 7.7176  accuracy: 20.95% -> 22.30%     
client [83] (testset)   loss: 8.5897 -> 8.6880  accuracy: 23.57% -> 23.57%     
---------------------------- TRAINING EPOCH: 120 ----------------------------  
client [76] (testset)   loss: 10.9532 -> 11.1302    accuracy: 11.57% -> 11.57% 
client [65] (testset)   loss: 10.3820 -> 10.4573    accuracy: 10.00% -> 10.67% 
client [95] (testset)   loss: 9.1605 -> 9.2171  accuracy: 15.33% -> 16.06%     
client [17] (testset)   loss: 10.9758 -> 11.7857    accuracy: 10.00% -> 11.33% 
client [8]  (testset)   loss: 10.4255 -> 10.5868    accuracy: 16.67% -> 17.39% 
client [35] (testset)   loss: 9.1481 -> 9.2534  accuracy: 13.17% -> 13.17%     
client [98] (testset)   loss: 10.6570 -> 10.8010    accuracy: 10.00% -> 10.00% 
client [53] (testset)   loss: 7.9839 -> 8.1242  accuracy: 15.75% -> 15.75%     
client [43] (testset)   loss: 9.8717 -> 10.1406 accuracy: 15.86% -> 15.86%     
client [64] (testset)   loss: 9.2148 -> 9.1965  accuracy: 11.64% -> 13.01%     
---------------------------- TRAINING EPOCH: 130 ----------------------------  
client [21] (testset)   loss: 8.4614 -> 8.7427  accuracy: 17.12% -> 17.81%     
client [88] (testset)   loss: 9.3170 -> 9.5011  accuracy: 15.00% -> 15.00%     
client [38] (testset)   loss: 9.4137 -> 9.5450  accuracy: 16.43% -> 16.43%     
client [3]  (testset)   loss: 8.1474 -> 8.3028  accuracy: 19.80% -> 19.31%     
client [5]  (testset)   loss: 9.2426 -> 9.5130  accuracy: 13.16% -> 12.50%     
client [41] (testset)   loss: 11.3048 -> 11.4258    accuracy: 9.35% -> 12.23%  
client [7]  (testset)   loss: 10.2471 -> 10.5690    accuracy: 17.14% -> 16.43% 
client [37] (testset)   loss: 9.1346 -> 9.4212  accuracy: 15.97% -> 15.97%     
client [45] (testset)   loss: 9.0986 -> 9.1891  accuracy: 17.14% -> 17.14%     
client [47] (testset)   loss: 10.5933 -> 10.6774    accuracy: 15.34% -> 15.34% 
---------------------------- TRAINING EPOCH: 140 ----------------------------  
client [16] (testset)   loss: 11.3320 -> 11.4122    accuracy: 14.06% -> 13.28% 
client [11] (testset)   loss: 9.3242 -> 9.5276  accuracy: 18.12% -> 18.12%     
client [37] (testset)   loss: 9.6521 -> 9.8272  accuracy: 17.36% -> 17.36%     
client [41] (testset)   loss: 11.9516 -> 11.7797    accuracy: 10.79% -> 10.07% 
client [95] (testset)   loss: 9.3132 -> 9.4089  accuracy: 13.87% -> 13.87%     
client [53] (testset)   loss: 8.0243 -> 8.1658  accuracy: 17.12% -> 17.12%     
client [22] (testset)   loss: 8.6749 -> 8.8225  accuracy: 14.79% -> 15.49%     
client [25] (testset)   loss: 11.9328 -> 11.8828    accuracy: 16.41% -> 16.41% 
client [69] (testset)   loss: 9.2505 -> 9.3348  accuracy: 19.88% -> 20.50%     
client [46] (testset)   loss: 9.9799 -> 10.0981 accuracy: 17.39% -> 17.39%     
---------------------------- TRAINING EPOCH: 150 ----------------------------  
client [47] (testset)   loss: 10.7412 -> 10.8854    accuracy: 15.34% -> 15.34% 
client [69] (testset)   loss: 8.8500 -> 8.9798  accuracy: 18.01% -> 18.01%     
client [82] (testset)   loss: 9.0435 -> 9.3093  accuracy: 20.71% -> 19.53%     
client [45] (testset)   loss: 9.1790 -> 9.3201  accuracy: 14.86% -> 16.00%     
client [7]  (testset)   loss: 10.3496 -> 10.5760    accuracy: 17.14% -> 17.14% 
client [50] (testset)   loss: 7.4440 -> 7.5282  accuracy: 20.49% -> 19.67%     
client [35] (testset)   loss: 8.9031 -> 9.0537  accuracy: 12.57% -> 13.17%     
client [24] (testset)   loss: 9.2244 -> 9.4024  accuracy: 13.77% -> 13.77%     
client [15] (testset)   loss: 8.6517 -> 8.8530  accuracy: 20.71% -> 20.00%     
client [58] (testset)   loss: 9.8322 -> 9.9682  accuracy: 17.36% -> 17.36%     
---------------------------- TRAINING EPOCH: 160 ----------------------------  
client [48] (testset)   loss: 10.5032 -> 10.6019    accuracy: 15.82% -> 16.38% 
client [76] (testset)   loss: 11.6614 -> 11.7624    accuracy: 11.57% -> 11.57% 
client [67] (testset)   loss: 11.6450 -> 11.8260    accuracy: 13.82% -> 13.82% 
client [37] (testset)   loss: 10.2055 -> 10.2971    accuracy: 16.67% -> 17.36% 
client [58] (testset)   loss: 10.9585 -> 10.9986    accuracy: 16.53% -> 16.53% 
client [64] (testset)   loss: 9.9099 -> 9.8635  accuracy: 12.33% -> 11.64%     
client [77] (testset)   loss: 11.5505 -> 11.6220    accuracy: 13.75% -> 13.75% 
client [55] (testset)   loss: 9.3839 -> 9.4689  accuracy: 17.61% -> 16.20%     
client [12] (testset)   loss: 10.1262 -> 10.1853    accuracy: 13.42% -> 13.42% 
client [89] (testset)   loss: 9.3942 -> 9.4399  accuracy: 17.81% -> 15.75%     
---------------------------- TRAINING EPOCH: 170 ----------------------------  
client [84] (testset)   loss: 10.0150 -> 10.0542    accuracy: 15.49% -> 15.49% 
client [51] (testset)   loss: 10.9124 -> 10.9483    accuracy: 16.90% -> 16.90% 
client [8]  (testset)   loss: 11.8500 -> 11.9053    accuracy: 16.67% -> 16.67% 
client [18] (testset)   loss: 9.0174 -> 9.0411  accuracy: 24.84% -> 23.53%     
client [94] (testset)   loss: 9.4994 -> 9.5095  accuracy: 15.71% -> 15.00%     
client [81] (testset)   loss: 11.3567 -> 11.4258    accuracy: 15.17% -> 15.86% 
client [3]  (testset)   loss: 9.5169 -> 9.5708  accuracy: 19.80% -> 19.31%     
client [11] (testset)   loss: 10.3750 -> 10.4361    accuracy: 18.12% -> 18.12% 
client [95] (testset)   loss: 10.2210 -> 10.2471    accuracy: 15.33% -> 14.60% 
client [67] (testset)   loss: 12.2501 -> 12.3583    accuracy: 13.82% -> 13.82% 
---------------------------- TRAINING EPOCH: 180 ----------------------------  
client [21] (testset)   loss: 10.3491 -> 10.3782    accuracy: 15.07% -> 16.44% 
client [79] (testset)   loss: 9.9140 -> 9.9327  accuracy: 21.02% -> 21.59%     
client [58] (testset)   loss: 11.8827 -> 11.8991    accuracy: 16.53% -> 16.53% 
client [88] (testset)   loss: 11.3402 -> 11.3335    accuracy: 13.57% -> 14.29% 
client [46] (testset)   loss: 11.5130 -> 11.5388    accuracy: 17.39% -> 17.39% 
client [11] (testset)   loss: 10.7039 -> 10.7533    accuracy: 18.12% -> 18.12% 
client [55] (testset)   loss: 10.1570 -> 10.1935    accuracy: 16.90% -> 17.61% 
client [13] (testset)   loss: 9.8181 -> 9.8579  accuracy: 19.05% -> 19.05%     
client [31] (testset)   loss: 14.3156 -> 14.3140    accuracy: 10.77% -> 10.77% 
client [75] (testset)   loss: 10.1432 -> 10.1708    accuracy: 15.24% -> 14.63% 
---------------------------- TRAINING EPOCH: 190 ----------------------------  
client [19] (testset)   loss: 11.6590 -> 11.7195    accuracy: 16.86% -> 16.86% 
client [7]  (testset)   loss: 12.0985 -> 12.1669    accuracy: 17.86% -> 17.86% 
client [57] (testset)   loss: 9.8058 -> 9.9138  accuracy: 16.67% -> 16.67%     
client [13] (testset)   loss: 9.5912 -> 9.6348  accuracy: 19.05% -> 19.05%     
client [43] (testset)   loss: 11.3462 -> 11.4380    accuracy: 14.48% -> 14.48% 
client [91] (testset)   loss: 10.4439 -> 10.5221    accuracy: 16.11% -> 16.11% 
client [10] (testset)   loss: 11.2162 -> 11.2779    accuracy: 12.50% -> 12.50% 
client [64] (testset)   loss: 10.4875 -> 10.4046    accuracy: 10.96% -> 10.96% 
client [82] (testset)   loss: 10.6664 -> 10.7471    accuracy: 18.93% -> 18.93% 
client [22] (testset)   loss: 9.5851 -> 9.6638  accuracy: 15.49% -> 15.49%     
---------------------------- TRAINING EPOCH: 200 ----------------------------  
client [20] (testset)   loss: 11.8051 -> 11.8943    accuracy: 12.31% -> 12.31% 
client [23] (testset)   loss: 10.3418 -> 10.4435    accuracy: 15.88% -> 15.88% 
client [88] (testset)   loss: 10.9528 -> 11.0100    accuracy: 13.57% -> 13.57% 
client [98] (testset)   loss: 12.0326 -> 12.0983    accuracy: 10.00% -> 10.00% 
client [79] (testset)   loss: 9.6575 -> 9.7048  accuracy: 21.02% -> 21.02%     
client [21] (testset)   loss: 9.9473 -> 10.0523 accuracy: 15.75% -> 15.75%     
client [92] (testset)   loss: 11.2912 -> 11.3647    accuracy: 15.49% -> 15.49% 
client [56] (testset)   loss: 9.7747 -> 9.8074  accuracy: 16.18% -> 16.18%     
client [5]  (testset)   loss: 10.9012 -> 10.9632    accuracy: 11.84% -> 11.84% 
client [52] (testset)   loss: 9.6806 -> 9.7375  accuracy: 18.83% -> 18.18%     
---------------------------- TRAINING EPOCH: 210 ----------------------------  
client [67] (testset)   loss: 10.2164 -> 10.5118    accuracy: 13.82% -> 13.82% 
client [54] (testset)   loss: 10.1965 -> 10.3782    accuracy: 16.95% -> 16.10% 
client [14] (testset)   loss: 8.7373 -> 9.0283  accuracy: 14.73% -> 14.73%     
client [99] (testset)   loss: 8.4146 -> 8.7686  accuracy: 15.38% -> 14.29%     
client [36] (testset)   loss: 8.8408 -> 9.2214  accuracy: 15.66% -> 15.06%     
client [30] (testset)   loss: 8.9149 -> 9.0753  accuracy: 16.29% -> 16.29%     
client [38] (testset)   loss: 8.9058 -> 9.0532  accuracy: 12.14% -> 15.00%     
client [15] (testset)   loss: 8.3905 -> 8.5120  accuracy: 18.57% -> 19.29%     
client [6]  (testset)   loss: 8.3296 -> 8.6918  accuracy: 19.61% -> 20.92%     
client [53] (testset)   loss: 7.4800 -> 7.6992  accuracy: 15.07% -> 17.81%     
---------------------------- TRAINING EPOCH: 220 ----------------------------  
client [99] (testset)   loss: 9.0675 -> 9.2361  accuracy: 14.29% -> 13.74%     
client [6]  (testset)   loss: 8.8482 -> 9.0287  accuracy: 19.61% -> 18.95%     
client [83] (testset)   loss: 8.3898 -> 8.4558  accuracy: 21.66% -> 22.29%     
client [42] (testset)   loss: 9.0359 -> 9.2646  accuracy: 8.28% -> 8.28%       
client [34] (testset)   loss: 8.6678 -> 9.0176  accuracy: 21.52% -> 22.78%     
client [15] (testset)   loss: 8.5820 -> 8.7104  accuracy: 17.86% -> 17.14%     
client [47] (testset)   loss: 10.4119 -> 10.5568    accuracy: 12.50% -> 14.20% 
client [55] (testset)   loss: 8.6395 -> 8.6949  accuracy: 13.38% -> 14.08%     
client [51] (testset)   loss: 9.0184 -> 9.2403  accuracy: 13.38% -> 16.90%     
client [95] (testset)   loss: 9.0578 -> 9.0077  accuracy: 15.33% -> 16.06%     
---------------------------- TRAINING EPOCH: 230 ----------------------------  
client [71] (testset)   loss: 10.4814 -> 10.7029    accuracy: 13.29% -> 12.66% 
client [15] (testset)   loss: 8.9428 -> 9.0445  accuracy: 17.14% -> 17.86%     
client [33] (testset)   loss: 10.9579 -> 11.1542    accuracy: 13.46% -> 14.74% 
client [99] (testset)   loss: 9.4981 -> 9.5849  accuracy: 13.74% -> 12.64%     
client [90] (testset)   loss: 11.0678 -> 11.2560    accuracy: 12.06% -> 12.06% 
client [57] (testset)   loss: 8.6990 -> 8.8828  accuracy: 17.31% -> 17.95%     
client [27] (testset)   loss: 9.1209 -> 9.2012  accuracy: 19.31% -> 19.31%     
client [78] (testset)   loss: 8.1306 -> 8.1899  accuracy: 11.72% -> 11.72%     
client [36] (testset)   loss: 9.7350 -> 9.9354  accuracy: 13.25% -> 13.86%     
client [88] (testset)   loss: 9.4554 -> 9.5974  accuracy: 12.86% -> 12.86%     
---------------------------- TRAINING EPOCH: 240 ----------------------------  
client [70] (testset)   loss: 9.8262 -> 9.8811  accuracy: 17.81% -> 17.81%     
client [35] (testset)   loss: 10.2358 -> 10.2294    accuracy: 11.38% -> 11.98% 
client [16] (testset)   loss: 11.5281 -> 11.6172    accuracy: 16.41% -> 16.41% 
client [80] (testset)   loss: 10.3832 -> 10.4795    accuracy: 13.29% -> 13.29% 
client [38] (testset)   loss: 10.1877 -> 10.2435    accuracy: 15.71% -> 15.71% 
client [78] (testset)   loss: 8.6612 -> 8.6968  accuracy: 12.41% -> 12.41%     
client [68] (testset)   loss: 12.0145 -> 12.1824    accuracy: 16.87% -> 16.87% 
client [11] (testset)   loss: 9.7486 -> 9.8654  accuracy: 18.12% -> 18.12%     
client [64] (testset)   loss: 9.8212 -> 9.8276  accuracy: 12.33% -> 10.96%     
client [82] (testset)   loss: 9.9181 -> 10.0158 accuracy: 17.75% -> 18.34%     
---------------------------- TRAINING EPOCH: 250 ----------------------------  
client [30] (testset)   loss: 10.6418 -> 10.6922    accuracy: 15.73% -> 16.29% 
client [27] (testset)   loss: 10.2085 -> 10.2662    accuracy: 18.62% -> 19.31% 
client [74] (testset)   loss: 10.6178 -> 10.6842    accuracy: 12.14% -> 12.14% 
client [45] (testset)   loss: 10.2601 -> 10.3049    accuracy: 17.14% -> 17.14% 
client [6]  (testset)   loss: 10.3529 -> 10.4111    accuracy: 20.26% -> 20.92% 
client [36] (testset)   loss: 10.9461 -> 10.9817    accuracy: 14.46% -> 13.86% 
client [63] (testset)   loss: 10.6351 -> 10.6787    accuracy: 14.05% -> 14.05% 
client [76] (testset)   loss: 12.1419 -> 12.1715    accuracy: 11.57% -> 11.57% 
client [83] (testset)   loss: 9.6485 -> 9.7111  accuracy: 22.93% -> 22.93%     
client [86] (testset)   loss: 10.1231 -> 10.1350    accuracy: 13.38% -> 14.08% 
---------------------------- TRAINING EPOCH: 260 ----------------------------  
client [83] (testset)   loss: 9.8248 -> 9.8602  accuracy: 22.29% -> 22.29%     
client [99] (testset)   loss: 10.7212 -> 10.7447    accuracy: 14.29% -> 14.84% 
client [74] (testset)   loss: 10.7777 -> 10.8300    accuracy: 12.14% -> 12.14% 
client [73] (testset)   loss: 11.0643 -> 11.1062    accuracy: 15.85% -> 15.24% 
client [29] (testset)   loss: 10.5851 -> 10.6555    accuracy: 16.22% -> 16.76% 
client [92] (testset)   loss: 11.2409 -> 11.3042    accuracy: 14.08% -> 14.79% 
client [6]  (testset)   loss: 10.5247 -> 10.5771    accuracy: 20.26% -> 20.26% 
client [61] (testset)   loss: 10.0657 -> 10.1445    accuracy: 18.46% -> 18.46% 
client [21] (testset)   loss: 9.7816 -> 9.8660  accuracy: 17.12% -> 17.12%     
client [67] (testset)   loss: 12.5014 -> 12.5683    accuracy: 14.47% -> 14.47% 
---------------------------- TRAINING EPOCH: 270 ----------------------------  
client [83] (testset)   loss: 9.9694 -> 9.9966  accuracy: 22.29% -> 22.29%     
client [32] (testset)   loss: 11.0521 -> 11.0921    accuracy: 16.46% -> 15.85% 
client [95] (testset)   loss: 10.5380 -> 10.5100    accuracy: 13.87% -> 14.60% 
client [61] (testset)   loss: 10.2433 -> 10.2949    accuracy: 16.92% -> 16.92% 
client [27] (testset)   loss: 10.5058 -> 10.5495    accuracy: 17.24% -> 17.24% 
client [25] (testset)   loss: 12.9624 -> 12.9780    accuracy: 17.19% -> 17.19% 
client [68] (testset)   loss: 12.9815 -> 13.0676    accuracy: 16.87% -> 16.27% 
client [34] (testset)   loss: 10.6223 -> 10.6971    accuracy: 24.05% -> 24.05% 
client [71] (testset)   loss: 12.0437 -> 12.1021    accuracy: 12.66% -> 12.66% 
client [89] (testset)   loss: 9.8586 -> 9.8885  accuracy: 18.49% -> 17.12%     
---------------------------- TRAINING EPOCH: 280 ----------------------------  
client [78] (testset)   loss: 9.1812 -> 9.2073  accuracy: 11.72% -> 12.41%     
client [81] (testset)   loss: 11.2460 -> 11.3340    accuracy: 15.86% -> 15.86% 
client [51] (testset)   loss: 10.6160 -> 10.6809    accuracy: 16.90% -> 16.20% 
client [54] (testset)   loss: 12.6946 -> 12.7541    accuracy: 15.25% -> 14.41% 
client [65] (testset)   loss: 11.5569 -> 11.6146    accuracy: 10.67% -> 11.33% 
client [41] (testset)   loss: 12.9279 -> 12.9702    accuracy: 12.23% -> 11.51% 
client [11] (testset)   loss: 10.2127 -> 10.3006    accuracy: 17.39% -> 17.39% 
client [85] (testset)   loss: 11.2600 -> 11.3202    accuracy: 11.90% -> 11.90% 
client [12] (testset)   loss: 10.3943 -> 10.4948    accuracy: 14.09% -> 14.09% 
client [23] (testset)   loss: 10.4504 -> 10.5274    accuracy: 15.88% -> 15.29% 
---------------------------- TRAINING EPOCH: 290 ----------------------------  
client [16] (testset)   loss: 12.5795 -> 12.6192    accuracy: 17.97% -> 17.97% 
client [65] (testset)   loss: 11.9888 -> 12.0130    accuracy: 12.00% -> 12.00% 
client [53] (testset)   loss: 9.4575 -> 9.4831  accuracy: 16.44% -> 15.75%     
client [58] (testset)   loss: 11.8491 -> 11.8776    accuracy: 18.18% -> 18.18% 
client [72] (testset)   loss: 11.0408 -> 11.0863    accuracy: 8.77% -> 8.77%   
client [7]  (testset)   loss: 12.3316 -> 12.3801    accuracy: 16.43% -> 16.43% 
client [71] (testset)   loss: 12.1800 -> 12.2362    accuracy: 12.03% -> 12.03% 
client [59] (testset)   loss: 11.1397 -> 11.1739    accuracy: 13.77% -> 13.77% 
client [86] (testset)   loss: 10.4187 -> 10.4401    accuracy: 14.08% -> 14.08% 
client [39] (testset)   loss: 11.2706 -> 11.3084    accuracy: 16.88% -> 16.88% 
---------------------------- TRAINING EPOCH: 300 ----------------------------  
client [99] (testset)   loss: 11.2513 -> 11.2608    accuracy: 14.29% -> 14.29% 
client [7]  (testset)   loss: 12.5831 -> 12.6230    accuracy: 16.43% -> 16.43% 
client [17] (testset)   loss: 13.3196 -> 13.3425    accuracy: 8.67% -> 8.67%   
client [64] (testset)   loss: 11.0138 -> 10.9394    accuracy: 12.33% -> 11.64% 
client [37] (testset)   loss: 11.2164 -> 11.2530    accuracy: 16.67% -> 16.67% 
client [29] (testset)   loss: 11.0677 -> 11.1476    accuracy: 17.30% -> 17.30% 
client [93] (testset)   loss: 14.4607 -> 14.4996    accuracy: 11.51% -> 11.51% 
client [73] (testset)   loss: 11.6025 -> 11.6426    accuracy: 14.63% -> 14.63% 
client [40] (testset)   loss: 11.9106 -> 11.9128    accuracy: 15.57% -> 14.37% 
client [76] (testset)   loss: 12.8679 -> 12.9089    accuracy: 11.57% -> 11.57% 
---------------------------- TRAINING EPOCH: 310 ----------------------------  
client [31] (testset)   loss: 14.7610 -> 14.7733    accuracy: 10.00% -> 10.00% 
client [89] (testset)   loss: 10.3647 -> 10.3858    accuracy: 19.18% -> 18.49% 
client [77] (testset)   loss: 12.9222 -> 12.9317    accuracy: 11.88% -> 11.88% 
client [90] (testset)   loss: 13.7747 -> 13.8005    accuracy: 12.77% -> 12.77% 
client [26] (testset)   loss: 11.0924 -> 11.1622    accuracy: 18.52% -> 19.14% 
client [50] (testset)   loss: 9.0943 -> 9.1054  accuracy: 20.49% -> 20.49%     
client [30] (testset)   loss: 11.4953 -> 11.5249    accuracy: 16.29% -> 16.29% 
client [70] (testset)   loss: 11.3085 -> 11.3157    accuracy: 17.81% -> 17.12% 
client [41] (testset)   loss: 14.1466 -> 14.1337    accuracy: 11.51% -> 11.51% 
client [99] (testset)   loss: 11.4971 -> 11.5165    accuracy: 14.29% -> 14.29% 
---------------------------- TRAINING EPOCH: 320 ----------------------------  
client [68] (testset)   loss: 13.7641 -> 13.8225    accuracy: 16.27% -> 16.27% 
client [70] (testset)   loss: 11.2945 -> 11.3035    accuracy: 17.81% -> 17.81% 
client [52] (testset)   loss: 10.3408 -> 10.3608    accuracy: 20.78% -> 21.43% 
client [1]  (testset)   loss: 12.4001 -> 12.4272    accuracy: 12.77% -> 12.77% 
client [2]  (testset)   loss: 9.5361 -> 9.5642  accuracy: 20.25% -> 19.63%     
client [67] (testset)   loss: 13.4963 -> 13.5350    accuracy: 13.82% -> 13.82% 
client [92] (testset)   loss: 12.0557 -> 12.0815    accuracy: 15.49% -> 15.49% 
client [35] (testset)   loss: 11.6276 -> 11.6314    accuracy: 13.17% -> 13.17% 
client [36] (testset)   loss: 11.8074 -> 11.8570    accuracy: 13.25% -> 13.86% 
client [64] (testset)   loss: 11.2513 -> 11.1636    accuracy: 11.64% -> 11.64% 
---------------------------- TRAINING EPOCH: 330 ----------------------------  
client [44] (testset)   loss: 11.8332 -> 11.8578    accuracy: 15.00% -> 15.00% 
client [6]  (testset)   loss: 11.5316 -> 11.5574    accuracy: 19.61% -> 20.26% 
client [12] (testset)   loss: 11.4327 -> 11.4693    accuracy: 15.44% -> 14.77% 
client [55] (testset)   loss: 10.7989 -> 10.8044    accuracy: 13.38% -> 13.38% 
client [29] (testset)   loss: 11.5715 -> 11.6215    accuracy: 17.30% -> 17.30% 
client [9]  (testset)   loss: 10.6911 -> 10.7095    accuracy: 17.65% -> 17.65% 
client [43] (testset)   loss: 12.2074 -> 12.2367    accuracy: 15.17% -> 15.17% 
client [77] (testset)   loss: 13.1368 -> 13.1505    accuracy: 10.62% -> 10.00% 
client [98] (testset)   loss: 13.0954 -> 13.1180    accuracy: 9.33% -> 9.33%   
client [78] (testset)   loss: 9.9997 -> 10.0100 accuracy: 11.72% -> 12.41%     
---------------------------- TRAINING EPOCH: 340 ----------------------------  
client [92] (testset)   loss: 12.4830 -> 12.5050    accuracy: 15.49% -> 15.49% 
client [80] (testset)   loss: 12.3541 -> 12.3733    accuracy: 12.03% -> 12.03% 
client [63] (testset)   loss: 11.8756 -> 11.8863    accuracy: 14.88% -> 14.88% 
client [76] (testset)   loss: 13.6435 -> 13.6664    accuracy: 12.40% -> 11.57% 
client [78] (testset)   loss: 10.1651 -> 10.1735    accuracy: 11.03% -> 11.72% 
client [25] (testset)   loss: 14.2485 -> 14.2523    accuracy: 17.19% -> 17.19% 
client [58] (testset)   loss: 12.8094 -> 12.8222    accuracy: 17.36% -> 17.36% 
client [13] (testset)   loss: 10.4674 -> 10.4887    accuracy: 20.41% -> 20.41% 
client [17] (testset)   loss: 14.1118 -> 14.1233    accuracy: 8.67% -> 8.67%   
client [38] (testset)   loss: 11.9444 -> 11.9579    accuracy: 17.14% -> 17.14% 
---------------------------- TRAINING EPOCH: 350 ----------------------------  
client [72] (testset)   loss: 12.0417 -> 12.0603    accuracy: 8.77% -> 8.77%   
client [82] (testset)   loss: 11.9723 -> 11.9931    accuracy: 18.34% -> 18.34% 
client [86] (testset)   loss: 11.3664 -> 11.3775    accuracy: 13.38% -> 13.38% 
client [51] (testset)   loss: 12.0950 -> 12.1087    accuracy: 16.20% -> 16.20% 
client [96] (testset)   loss: 13.2077 -> 13.2259    accuracy: 15.57% -> 15.57% 
client [42] (testset)   loss: 11.8948 -> 11.9121    accuracy: 10.19% -> 10.83% 
client [55] (testset)   loss: 11.0566 -> 11.0712    accuracy: 13.38% -> 13.38% 
client [13] (testset)   loss: 10.5845 -> 10.6038    accuracy: 20.41% -> 20.41% 
client [1]  (testset)   loss: 12.9954 -> 13.0011    accuracy: 13.48% -> 13.48% 
client [12] (testset)   loss: 11.7558 -> 11.7755    accuracy: 15.44% -> 15.44% 
---------------------------- TRAINING EPOCH: 360 ----------------------------  
client [68] (testset)   loss: 14.6108 -> 14.6417    accuracy: 15.66% -> 15.66% 
client [23] (testset)   loss: 11.8662 -> 11.8813    accuracy: 14.71% -> 14.71% 
client [46] (testset)   loss: 12.6798 -> 12.6888    accuracy: 15.53% -> 15.53% 
client [41] (testset)   loss: 14.9343 -> 14.9340    accuracy: 11.51% -> 11.51% 
client [25] (testset)   loss: 14.5917 -> 14.5730    accuracy: 16.41% -> 16.41% 
client [58] (testset)   loss: 13.1020 -> 13.1129    accuracy: 17.36% -> 17.36% 
client [14] (testset)   loss: 12.1281 -> 12.1385    accuracy: 14.73% -> 14.73% 
client [33] (testset)   loss: 14.4803 -> 14.4905    accuracy: 14.10% -> 14.10% 
client [85] (testset)   loss: 12.9061 -> 12.9248    accuracy: 8.93% -> 8.93%   
client [62] (testset)   loss: 11.6254 -> 11.6311    accuracy: 22.40% -> 22.40% 
---------------------------- TRAINING EPOCH: 370 ----------------------------  
client [98] (testset)   loss: 13.3433 -> 13.3713    accuracy: 10.67% -> 11.33% 
client [63] (testset)   loss: 11.8377 -> 11.8517    accuracy: 14.88% -> 14.88% 
client [70] (testset)   loss: 11.6403 -> 11.6575    accuracy: 17.12% -> 17.81% 
client [65] (testset)   loss: 12.9357 -> 12.9546    accuracy: 12.00% -> 12.00% 
client [14] (testset)   loss: 11.8396 -> 11.8674    accuracy: 13.95% -> 13.95% 
client [73] (testset)   loss: 12.3021 -> 12.3224    accuracy: 14.63% -> 14.63% 
client [34] (testset)   loss: 11.5875 -> 11.6414    accuracy: 24.05% -> 24.05% 
client [99] (testset)   loss: 11.8953 -> 11.8972    accuracy: 14.84% -> 14.84% 
client [69] (testset)   loss: 11.3681 -> 11.3804    accuracy: 21.12% -> 21.12% 
client [46] (testset)   loss: 12.3701 -> 12.3884    accuracy: 16.15% -> 16.77% 
---------------------------- TRAINING EPOCH: 380 ----------------------------  
client [99] (testset)   loss: 12.0338 -> 12.0483    accuracy: 14.29% -> 14.29% 
client [93] (testset)   loss: 15.5125 -> 15.5300    accuracy: 10.79% -> 10.79% 
client [11] (testset)   loss: 11.5299 -> 11.5594    accuracy: 17.39% -> 17.39% 
client [58] (testset)   loss: 12.9338 -> 12.9472    accuracy: 17.36% -> 17.36% 
client [81] (testset)   loss: 12.8727 -> 12.9035    accuracy: 15.86% -> 15.17% 
client [85] (testset)   loss: 12.7855 -> 12.8012    accuracy: 9.52% -> 8.33%   
client [89] (testset)   loss: 10.8416 -> 10.8590    accuracy: 18.49% -> 18.49% 
client [45] (testset)   loss: 11.6176 -> 11.6392    accuracy: 17.14% -> 18.29% 
client [8]  (testset)   loss: 13.3081 -> 13.3148    accuracy: 15.94% -> 15.94% 
client [68] (testset)   loss: 14.4962 -> 14.5282    accuracy: 16.27% -> 16.27% 
---------------------------- TRAINING EPOCH: 390 ----------------------------  
client [67] (testset)   loss: 14.3519 -> 14.3715    accuracy: 13.82% -> 13.82% 
client [72] (testset)   loss: 12.1620 -> 12.1838    accuracy: 8.77% -> 8.77%   
client [1]  (testset)   loss: 13.1715 -> 13.1891    accuracy: 13.48% -> 14.18% 
client [78] (testset)   loss: 10.4349 -> 10.4432    accuracy: 10.34% -> 10.34% 
client [83] (testset)   loss: 11.1156 -> 11.1278    accuracy: 21.66% -> 21.66% 
client [21] (testset)   loss: 11.2047 -> 11.2337    accuracy: 17.12% -> 17.12% 
client [56] (testset)   loss: 11.2065 -> 11.2204    accuracy: 16.18% -> 16.18% 
client [44] (testset)   loss: 12.3959 -> 12.4174    accuracy: 15.00% -> 15.00% 
client [92] (testset)   loss: 12.8323 -> 12.8487    accuracy: 15.49% -> 15.49% 
client [27] (testset)   loss: 11.7447 -> 11.7670    accuracy: 18.62% -> 18.62% 
---------------------------- TRAINING EPOCH: 400 ----------------------------  
client [10] (testset)   loss: 12.9606 -> 12.9663    accuracy: 11.84% -> 11.84% 
client [39] (testset)   loss: 12.6606 -> 12.6744    accuracy: 15.58% -> 14.94% 
client [65] (testset)   loss: 13.3627 -> 13.3719    accuracy: 12.00% -> 12.00% 
client [26] (testset)   loss: 11.9309 -> 11.9628    accuracy: 19.14% -> 19.14% 
client [19] (testset)   loss: 14.7528 -> 14.7491    accuracy: 15.70% -> 15.70% 
client [68] (testset)   loss: 14.8258 -> 14.8517    accuracy: 16.27% -> 16.27% 
client [41] (testset)   loss: 15.1289 -> 15.1280    accuracy: 11.51% -> 11.51% 
client [50] (testset)   loss: 9.7081 -> 9.7118  accuracy: 20.49% -> 20.49%     
client [75] (testset)   loss: 11.1463 -> 11.1682    accuracy: 16.46% -> 16.46% 
client [81] (testset)   loss: 13.1781 -> 13.2017    accuracy: 14.48% -> 14.48% 
Training... ---------------------------------------- 100% 0:12:45
FedPer's average time taken by each global epoch: 0 min 1.90 sec.              
FedPer's total running time: 0 h 12 m 45 s.                                    
==================== FedPer Experiment Results: ====================           
Display format: (before local fine-tuning) -> (after local fine-tuning)        
 So if finetune_epoch = 0, x.xx% -> 0.00% is normal.                           
 Centralized testing ONLY happens after model aggregation, so the stats between
'->' are the same.                                                             
{                                                                              
    "100": {                                                                   
        "all_clients": {                                                       
            "test": {                                                          
                "loss": "9.7517 -> 0.0000",                                    
                "accuracy": "16.04% -> 0.00%"                                  
            }                                                                  
        }                                                                      
    },                                                                         
    "200": {                                                                   
        "all_clients": {                                                       
            "test": {                                                          
                "loss": "11.0181 -> 0.0000",                                   
                "accuracy": "15.49% -> 0.00%"                                  
            }                                                                  
        }                                                                      
    },                                                                         
    "300": {                                                                   
        "all_clients": {                                                       
            "test": {                                                          
                "loss": "11.5384 -> 0.0000",                                   
                "accuracy": "15.52% -> 0.00%"                                  
            }                                                                  
        }                                                                      
    },                                                                         
    "400": {                                                                   
        "all_clients": {                                                       
            "test": {                                                          
                "loss": "12.6397 -> 0.0000",                                   
                "accuracy": "15.44% -> 0.00%"                                  
            }                                                                  
        }                                                                      
    }                                                                          
}                                                                              
==================== FedPer Max Accuracy ====================                  
all_clients:                                                                   
(test) before fine-tuning: 16.04% at epoch 100                                 
(test) after fine-tuning: 0.00% at epoch 100                                   
[0m