==================== FedProto ====================                             
Experiment Arguments:                                                          
{
│   'method': 'fedproto',
│   'dataset': {
│   │   'name': 'emnist',
│   │   'client_num': 100,
│   │   'test_ratio': 0.25,
│   │   'val_ratio': 0.0,
│   │   'seed': 42,
│   │   'split': 'sample',
│   │   'IID_ratio': 0.0,
│   │   'monitor_window_name_suffix': 'emnist-100clients-0%IID-Dir(1.0)-seed42',
│   │   'emnist_split': 'byclass',
│   │   'alpha': 1.0,
│   │   'min_samples_per_client': 10
│   },
│   'model': {
│   │   'name': 'avgcnn',
│   │   'use_torchvision_pretrained_weights': True,
│   │   'external_model_weights_path': None
│   },
│   'optimizer': {
│   │   'lr': 0.01,
│   │   'dampening': 0,
│   │   'weight_decay': 0,
│   │   'momentum': 0,
│   │   'nesterov': False,
│   │   'name': 'sgd'
│   },
│   'mode': 'serial',
│   'parallel': {
│   │   'ray_cluster_addr': None,
│   │   'num_cpus': None,
│   │   'num_gpus': None,
│   │   'num_workers': 2
│   },
│   'common': {
│   │   'seed': 42,
│   │   'join_ratio': 0.1,
│   │   'global_epoch': 400,
│   │   'local_epoch': 5,
│   │   'batch_size': 32,
│   │   'reset_optimizer_on_global_epoch': True,
│   │   'straggler_ratio': 0,
│   │   'straggler_min_local_epoch': 0,
│   │   'buffers': 'global',
│   │   'client_side_evaluation': True,
│   │   'test': {
│   │   │   'client': {
│   │   │   │   'interval': 100,
│   │   │   │   'finetune_epoch': 0,
│   │   │   │   'train': False,
│   │   │   │   'val': False,
│   │   │   │   'test': True
│   │   │   },
│   │   │   'server': {
│   │   │   │   'interval': -1,
│   │   │   │   'train': False,
│   │   │   │   'val': False,
│   │   │   │   'test': False,
│   │   │   │   'model_in_train_mode': False
│   │   │   }
│   │   },
│   │   'verbose_gap': 10,
│   │   'monitor': None,
│   │   'use_cuda': True,
│   │   'save_log': True,
│   │   'save_model': False,
│   │   'save_learning_curve_plot': False,
│   │   'save_metrics': True,
│   │   'delete_useless_run': True
│   },
│   'fedproto': {
│   │   'lamda': 1
│   }
}
---------------------------- TRAINING EPOCH: 10 ----------------------------   
client [77] (testset)   loss: 0.6821 -> 0.5994  accuracy: 79.57% -> 81.31%     
client [81] (testset)   loss: 0.7140 -> 0.7062  accuracy: 81.76% -> 80.25%     
client [21] (testset)   loss: 4.1244 -> 1.0202  accuracy: 0.72% -> 73.09%      
client [68] (testset)   loss: 1.3293 -> 0.7604  accuracy: 61.67% -> 76.72%     
client [93] (testset)   loss: 1.1167 -> 0.8520  accuracy: 69.13% -> 75.07%     
client [31] (testset)   loss: 1.2873 -> 0.8571  accuracy: 64.46% -> 75.19%     
client [20] (testset)   loss: 0.7981 -> 0.7191  accuracy: 76.77% -> 78.28%     
client [59] (testset)   loss: 4.1194 -> 0.7587  accuracy: 0.84% -> 81.65%      
client [48] (testset)   loss: 0.6600 -> 0.5983  accuracy: 81.62% -> 82.56%     
client [34] (testset)   loss: 1.0215 -> 0.7641  accuracy: 71.81% -> 77.27%     
---------------------------- TRAINING EPOCH: 20 ----------------------------   
client [69] (testset)   loss: 0.6484 -> 0.5603  accuracy: 82.22% -> 83.67%     
client [99] (testset)   loss: 1.1848 -> 0.8770  accuracy: 68.46% -> 74.88%     
client [67] (testset)   loss: 0.7811 -> 0.5864  accuracy: 80.90% -> 84.58%     
client [0]  (testset)   loss: 0.7472 -> 0.6452  accuracy: 78.80% -> 80.71%     
client [76] (testset)   loss: 0.8483 -> 0.7412  accuracy: 75.94% -> 78.64%     
client [41] (testset)   loss: 1.1042 -> 0.8823  accuracy: 68.32% -> 71.40%     
client [62] (testset)   loss: 4.1150 -> 0.9209  accuracy: 0.35% -> 78.70%      
client [2]  (testset)   loss: 4.1232 -> 1.0463  accuracy: 1.43% -> 74.94%      
client [14] (testset)   loss: 0.6676 -> 0.6376  accuracy: 79.56% -> 81.03%     
client [46] (testset)   loss: 0.6570 -> 0.6105  accuracy: 82.21% -> 82.85%     
---------------------------- TRAINING EPOCH: 30 ----------------------------   
client [24] (testset)   loss: 0.6635 -> 0.6110  accuracy: 79.20% -> 80.07%     
client [68] (testset)   loss: 0.5064 -> 0.4833  accuracy: 84.20% -> 84.85%     
client [57] (testset)   loss: 0.6266 -> 0.5347  accuracy: 81.21% -> 84.01%     
client [17] (testset)   loss: 0.6554 -> 0.6094  accuracy: 81.79% -> 81.92%     
client [54] (testset)   loss: 0.5447 -> 0.5347  accuracy: 81.22% -> 81.38%     
client [23] (testset)   loss: 4.1146 -> 1.0551  accuracy: 0.17% -> 72.71%      
client [35] (testset)   loss: 0.6708 -> 0.6794  accuracy: 81.64% -> 80.35%     
client [59] (testset)   loss: 0.4837 -> 0.4505  accuracy: 86.86% -> 86.90%     
client [31] (testset)   loss: 0.5767 -> 0.7016  accuracy: 81.35% -> 77.94%     
client [9]  (testset)   loss: 0.7044 -> 0.6112  accuracy: 78.35% -> 81.77%     
---------------------------- TRAINING EPOCH: 40 ----------------------------   
client [64] (testset)   loss: 0.5930 -> 0.5517  accuracy: 83.65% -> 84.57%     
client [33] (testset)   loss: 0.5477 -> 0.5184  accuracy: 83.13% -> 83.93%     
client [16] (testset)   loss: 0.7836 -> 0.7013  accuracy: 78.33% -> 79.86%     
client [44] (testset)   loss: 1.1178 -> 0.8697  accuracy: 68.35% -> 74.73%     
client [8]  (testset)   loss: 0.6819 -> 0.4730  accuracy: 79.51% -> 85.56%     
client [31] (testset)   loss: 0.7020 -> 0.5604  accuracy: 73.28% -> 81.00%     
client [47] (testset)   loss: 0.5614 -> 0.5050  accuracy: 83.56% -> 84.32%     
client [36] (testset)   loss: 0.7359 -> 0.5379  accuracy: 80.60% -> 84.44%     
client [20] (testset)   loss: 0.6231 -> 0.6187  accuracy: 80.64% -> 79.71%     
client [56] (testset)   loss: 0.7658 -> 0.6528  accuracy: 75.38% -> 78.04%     
---------------------------- TRAINING EPOCH: 50 ----------------------------   
client [4]  (testset)   loss: 0.4818 -> 0.4492  accuracy: 85.75% -> 86.08%     
client [60] (testset)   loss: 0.7802 -> 0.6210  accuracy: 76.90% -> 81.58%     
client [28] (testset)   loss: 0.4854 -> 0.4281  accuracy: 84.60% -> 87.47%     
client [25] (testset)   loss: 0.5791 -> 0.5265  accuracy: 83.36% -> 83.52%     
client [58] (testset)   loss: 0.5522 -> 0.4764  accuracy: 83.23% -> 86.65%     
client [44] (testset)   loss: 0.8697 -> 0.7829  accuracy: 74.73% -> 75.75%     
client [39] (testset)   loss: 0.7047 -> 0.6537  accuracy: 78.25% -> 79.54%     
client [29] (testset)   loss: 0.6020 -> 0.5768  accuracy: 82.83% -> 82.78%     
client [3]  (testset)   loss: 0.5264 -> 0.4958  accuracy: 82.78% -> 83.68%     
client [84] (testset)   loss: 0.6190 -> 0.5977  accuracy: 81.06% -> 82.35%     
---------------------------- TRAINING EPOCH: 60 ----------------------------   
client [21] (testset)   loss: 0.6636 -> 0.6244  accuracy: 80.56% -> 81.79%     
client [84] (testset)   loss: 0.5804 -> 0.5895  accuracy: 82.28% -> 82.59%     
client [10] (testset)   loss: 0.5158 -> 0.4832  accuracy: 85.11% -> 85.36%     
client [36] (testset)   loss: 0.3849 -> 0.4312  accuracy: 88.97% -> 86.72%     
client [65] (testset)   loss: 0.4369 -> 0.4331  accuracy: 86.56% -> 86.78%     
client [81] (testset)   loss: 0.4528 -> 0.4663  accuracy: 87.49% -> 86.53%     
client [79] (testset)   loss: 0.4057 -> 0.5266  accuracy: 88.67% -> 86.05%     
client [42] (testset)   loss: 0.5671 -> 0.5043  accuracy: 83.13% -> 85.76%     
client [11] (testset)   loss: 0.5731 -> 0.5412  accuracy: 83.64% -> 84.62%     
client [96] (testset)   loss: 0.5059 -> 0.4685  accuracy: 83.77% -> 84.74%     
---------------------------- TRAINING EPOCH: 70 ----------------------------   
client [8]  (testset)   loss: 0.4540 -> 0.4657  accuracy: 86.31% -> 84.86%     
client [53] (testset)   loss: 0.4993 -> 0.4703  accuracy: 85.57% -> 86.69%     
client [52] (testset)   loss: 0.5274 -> 0.5298  accuracy: 82.92% -> 83.76%     
client [42] (testset)   loss: 0.5022 -> 0.4835  accuracy: 86.04% -> 86.09%     
client [69] (testset)   loss: 0.4461 -> 0.4483  accuracy: 85.61% -> 85.81%     
client [59] (testset)   loss: 0.3790 -> 0.3585  accuracy: 89.25% -> 89.88%     
client [7]  (testset)   loss: 0.5713 -> 0.5626  accuracy: 80.95% -> 81.53%     
client [26] (testset)   loss: 0.3986 -> 0.4012  accuracy: 87.85% -> 87.53%     
client [49] (testset)   loss: 0.5060 -> 0.5052  accuracy: 83.33% -> 83.92%     
client [98] (testset)   loss: 0.5024 -> 0.4954  accuracy: 83.43% -> 83.69%     
---------------------------- TRAINING EPOCH: 80 ----------------------------   
client [98] (testset)   loss: 0.4954 -> 0.4984  accuracy: 83.69% -> 83.69%     
client [47] (testset)   loss: 0.4738 -> 0.4662  accuracy: 85.20% -> 85.16%     
client [21] (testset)   loss: 0.5875 -> 0.5826  accuracy: 82.10% -> 82.46%     
client [77] (testset)   loss: 0.4605 -> 0.4546  accuracy: 84.91% -> 85.30%     
client [95] (testset)   loss: 0.4759 -> 0.4732  accuracy: 86.54% -> 86.44%     
client [91] (testset)   loss: 0.5995 -> 0.5944  accuracy: 81.34% -> 80.04%     
client [14] (testset)   loss: 0.5617 -> 0.5400  accuracy: 81.54% -> 82.14%     
client [99] (testset)   loss: 0.7695 -> 0.9132  accuracy: 72.25% -> 76.57%     
client [20] (testset)   loss: 0.6234 -> 0.6115  accuracy: 79.17% -> 80.02%     
client [39] (testset)   loss: 0.5695 -> 0.5560  accuracy: 81.50% -> 81.84%     
---------------------------- TRAINING EPOCH: 90 ----------------------------   
client [52] (testset)   loss: 0.5298 -> 0.5074  accuracy: 83.76% -> 83.40%     
client [62] (testset)   loss: 0.4427 -> 0.4412  accuracy: 87.23% -> 87.29%     
client [71] (testset)   loss: 0.5734 -> 0.5491  accuracy: 81.35% -> 83.07%     
client [97] (testset)   loss: 0.4830 -> 0.4695  accuracy: 85.47% -> 85.43%     
client [30] (testset)   loss: 0.4693 -> 0.4718  accuracy: 84.00% -> 85.37%     
client [88] (testset)   loss: 0.6083 -> 0.5298  accuracy: 81.28% -> 84.73%     
client [60] (testset)   loss: 0.5399 -> 0.5011  accuracy: 82.88% -> 84.29%     
client [82] (testset)   loss: 0.4510 -> 0.4506  accuracy: 84.52% -> 84.57%     
client [91] (testset)   loss: 0.5841 -> 0.5757  accuracy: 81.14% -> 82.24%     
client [57] (testset)   loss: 0.4492 -> 0.4563  accuracy: 86.28% -> 85.19%     
---------------------------- TRAINING EPOCH: 100 ----------------------------  
client [31] (testset)   loss: 0.5749 -> 0.5837  accuracy: 81.95% -> 82.31%     
client [15] (testset)   loss: 0.5184 -> 0.5042  accuracy: 82.18% -> 81.74%     
client [71] (testset)   loss: 0.5491 -> 0.5470  accuracy: 83.07% -> 83.13%     
client [97] (testset)   loss: 0.4610 -> 0.4656  accuracy: 85.35% -> 85.56%     
client [53] (testset)   loss: 0.4531 -> 0.4350  accuracy: 86.17% -> 87.49%     
client [77] (testset)   loss: 0.4546 -> 0.4734  accuracy: 85.30% -> 85.03%     
client [76] (testset)   loss: 0.5640 -> 0.5568  accuracy: 82.74% -> 82.19%     
client [79] (testset)   loss: 0.3743 -> 0.3693  accuracy: 89.47% -> 89.43%     
client [28] (testset)   loss: 0.4295 -> 0.4118  accuracy: 87.01% -> 87.60%     
client [99] (testset)   loss: 0.6663 -> 0.7465  accuracy: 76.78% -> 74.04%     
---------------------------- TRAINING EPOCH: 110 ----------------------------  
client [97] (testset)   loss: 0.4654 -> 0.4731  accuracy: 85.26% -> 85.22%     
client [86] (testset)   loss: 0.4435 -> 0.4534  accuracy: 86.20% -> 86.16%     
client [34] (testset)   loss: 0.4889 -> 0.5041  accuracy: 82.88% -> 82.45%     
client [73] (testset)   loss: 0.4889 -> 0.4790  accuracy: 84.51% -> 85.57%     
client [5]  (testset)   loss: 0.4164 -> 0.4164  accuracy: 88.28% -> 87.84%     
client [96] (testset)   loss: 0.4590 -> 0.4775  accuracy: 85.51% -> 85.31%     
client [22] (testset)   loss: 0.5363 -> 0.5195  accuracy: 84.40% -> 85.56%     
client [60] (testset)   loss: 0.5119 -> 0.5138  accuracy: 84.73% -> 83.80%     
client [66] (testset)   loss: 0.4607 -> 0.4716  accuracy: 83.71% -> 83.50%     
client [83] (testset)   loss: 0.4237 -> 0.4244  accuracy: 87.62% -> 87.12%     
---------------------------- TRAINING EPOCH: 120 ----------------------------  
client [76] (testset)   loss: 0.5485 -> 0.5539  accuracy: 83.29% -> 82.49%     
client [65] (testset)   loss: 0.4144 -> 0.4121  accuracy: 86.86% -> 87.39%     
client [95] (testset)   loss: 0.4596 -> 0.4571  accuracy: 86.68% -> 86.30%     
client [17] (testset)   loss: 0.5355 -> 0.5280  accuracy: 83.76% -> 83.59%     
client [8]  (testset)   loss: 0.4503 -> 0.8820  accuracy: 85.98% -> 73.04%     
client [35] (testset)   loss: 0.5861 -> 0.5845  accuracy: 84.41% -> 84.53%     
client [98] (testset)   loss: 0.5172 -> 0.5094  accuracy: 84.16% -> 83.86%     
client [53] (testset)   loss: 0.4571 -> 0.4854  accuracy: 86.13% -> 82.14%     
client [43] (testset)   loss: 0.4532 -> 0.4561  accuracy: 85.78% -> 85.43%     
client [64] (testset)   loss: 0.5140 -> 0.5023  accuracy: 84.97% -> 85.20%     
---------------------------- TRAINING EPOCH: 130 ----------------------------  
client [21] (testset)   loss: 0.5667 -> 0.5654  accuracy: 82.19% -> 82.46%     
client [88] (testset)   loss: 0.4952 -> 0.4692  accuracy: 84.38% -> 85.14%     
client [38] (testset)   loss: 0.5078 -> 0.5045  accuracy: 84.46% -> 84.65%     
client [3]  (testset)   loss: 0.4750 -> 0.4547  accuracy: 83.77% -> 84.09%     
client [5]  (testset)   loss: 0.4191 -> 0.4187  accuracy: 88.35% -> 87.45%     
client [41] (testset)   loss: 0.6114 -> 0.6243  accuracy: 77.82% -> 77.09%     
client [7]  (testset)   loss: 0.5599 -> 0.5910  accuracy: 81.53% -> 79.70%     
client [37] (testset)   loss: 0.6100 -> 0.6072  accuracy: 80.50% -> 79.19%     
client [45] (testset)   loss: 0.4601 -> 0.4471  accuracy: 84.25% -> 84.64%     
client [47] (testset)   loss: 0.4757 -> 0.4439  accuracy: 84.49% -> 86.00%     
---------------------------- TRAINING EPOCH: 140 ----------------------------  
client [16] (testset)   loss: 0.6187 -> 0.6204  accuracy: 80.49% -> 80.49%     
client [11] (testset)   loss: 0.5239 -> 0.5540  accuracy: 85.46% -> 83.98%     
client [37] (testset)   loss: 0.6018 -> 0.6138  accuracy: 79.65% -> 79.78%     
client [41] (testset)   loss: 0.6243 -> 0.6334  accuracy: 77.09% -> 77.51%     
client [95] (testset)   loss: 0.4617 -> 0.4618  accuracy: 86.68% -> 87.11%     
client [53] (testset)   loss: 0.4854 -> 0.4336  accuracy: 82.14% -> 86.97%     
client [22] (testset)   loss: 0.5250 -> 0.5062  accuracy: 85.15% -> 85.10%     
client [25] (testset)   loss: 0.4622 -> 0.4712  accuracy: 85.28% -> 85.49%     
client [69] (testset)   loss: 0.4567 -> 0.4753  accuracy: 86.34% -> 84.36%     
client [46] (testset)   loss: 0.4720 -> 0.4697  accuracy: 85.90% -> 86.21%     
---------------------------- TRAINING EPOCH: 150 ----------------------------  
client [47] (testset)   loss: 0.4646 -> 0.4547  accuracy: 86.46% -> 85.28%     
client [69] (testset)   loss: 0.4732 -> 0.4766  accuracy: 84.96% -> 85.49%     
client [82] (testset)   loss: 0.4481 -> 0.4434  accuracy: 85.16% -> 84.98%     
client [45] (testset)   loss: 0.4491 -> 0.4433  accuracy: 83.47% -> 85.08%     
client [7]  (testset)   loss: 0.5910 -> 0.5781  accuracy: 79.70% -> 81.32%     
client [50] (testset)   loss: 0.4374 -> 0.4366  accuracy: 88.02% -> 87.66%     
client [35] (testset)   loss: 0.5979 -> 0.6079  accuracy: 84.41% -> 83.61%     
client [24] (testset)   loss: 0.5368 -> 0.5606  accuracy: 81.11% -> 80.03%     
client [15] (testset)   loss: 0.4934 -> 0.5033  accuracy: 82.82% -> 82.33%     
client [58] (testset)   loss: 0.4876 -> 0.5665  accuracy: 85.95% -> 82.88%     
---------------------------- TRAINING EPOCH: 160 ----------------------------  
client [48] (testset)   loss: 0.5091 -> 0.5372  accuracy: 84.40% -> 85.08%     
client [76] (testset)   loss: 0.5492 -> 0.5463  accuracy: 83.54% -> 82.59%     
client [67] (testset)   loss: 0.4178 -> 0.4144  accuracy: 88.68% -> 88.47%     
client [37] (testset)   loss: 0.6061 -> 0.6298  accuracy: 79.91% -> 79.58%     
client [58] (testset)   loss: 0.4835 -> 0.4899  accuracy: 86.47% -> 86.30%     
client [64] (testset)   loss: 0.4930 -> 0.5099  accuracy: 85.66% -> 85.61%     
client [77] (testset)   loss: 0.4719 -> 0.5054  accuracy: 85.30% -> 84.79%     
client [55] (testset)   loss: 0.4933 -> 0.4893  accuracy: 84.30% -> 84.67%     
client [12] (testset)   loss: 0.4653 -> 0.4747  accuracy: 87.16% -> 86.47%     
client [89] (testset)   loss: 0.4733 -> 0.5100  accuracy: 85.23% -> 84.22%     
---------------------------- TRAINING EPOCH: 170 ----------------------------  
client [84] (testset)   loss: 0.6401 -> 0.6221  accuracy: 83.20% -> 81.80%     
client [51] (testset)   loss: 0.7217 -> 0.7476  accuracy: 77.43% -> 77.92%     
client [8]  (testset)   loss: 0.4683 -> 0.4733  accuracy: 86.17% -> 85.51%     
client [18] (testset)   loss: 0.5008 -> 0.5154  accuracy: 84.65% -> 83.47%     
client [94] (testset)   loss: 0.5066 -> 0.5129  accuracy: 83.20% -> 82.46%     
client [81] (testset)   loss: 0.4389 -> 0.4512  accuracy: 87.43% -> 86.70%     
client [3]  (testset)   loss: 0.4916 -> 0.4818  accuracy: 84.49% -> 84.31%     
client [11] (testset)   loss: 0.5603 -> 0.6244  accuracy: 83.44% -> 79.30%     
client [95] (testset)   loss: 0.4696 -> 0.4983  accuracy: 86.82% -> 86.49%     
client [67] (testset)   loss: 0.4144 -> 0.4086  accuracy: 88.47% -> 89.13%     
---------------------------- TRAINING EPOCH: 180 ----------------------------  
client [21] (testset)   loss: 0.5764 -> 0.5576  accuracy: 81.24% -> 82.46%     
client [79] (testset)   loss: 0.3816 -> 0.3899  accuracy: 89.52% -> 88.80%     
client [58] (testset)   loss: 0.4935 -> 0.4940  accuracy: 86.69% -> 86.47%     
client [88] (testset)   loss: 0.4811 -> 0.4726  accuracy: 84.78% -> 85.09%     
client [46] (testset)   loss: 0.4778 -> 0.4589  accuracy: 85.90% -> 86.09%     
client [11] (testset)   loss: 0.6244 -> 0.6058  accuracy: 79.30% -> 81.37%     
client [55] (testset)   loss: 0.5167 -> 0.5026  accuracy: 84.36% -> 83.99%     
client [13] (testset)   loss: 0.4269 -> 0.4313  accuracy: 87.98% -> 88.14%     
client [31] (testset)   loss: 0.6090 -> 0.6230  accuracy: 82.26% -> 82.16%     
client [75] (testset)   loss: 0.4883 -> 0.4935  accuracy: 85.81% -> 85.57%     
---------------------------- TRAINING EPOCH: 190 ----------------------------  
client [19] (testset)   loss: 0.4347 -> 0.4395  accuracy: 86.59% -> 86.46%     
client [7]  (testset)   loss: 0.5681 -> 0.5523  accuracy: 81.00% -> 81.84%     
client [57] (testset)   loss: 0.4164 -> 0.4207  accuracy: 85.85% -> 85.98%     
client [13] (testset)   loss: 0.4309 -> 0.4492  accuracy: 88.09% -> 87.76%     
client [43] (testset)   loss: 0.4702 -> 0.4696  accuracy: 85.08% -> 85.43%     
client [91] (testset)   loss: 0.5783 -> 0.5843  accuracy: 81.85% -> 81.79%     
client [10] (testset)   loss: 0.4492 -> 0.4757  accuracy: 85.94% -> 86.24%     
client [64] (testset)   loss: 0.5337 -> 0.5150  accuracy: 85.20% -> 85.20%     
client [82] (testset)   loss: 0.4565 -> 0.4542  accuracy: 84.75% -> 85.34%     
client [22] (testset)   loss: 0.5012 -> 0.5081  accuracy: 85.33% -> 85.62%     
---------------------------- TRAINING EPOCH: 200 ----------------------------  
client [20] (testset)   loss: 0.7371 -> 0.6584  accuracy: 76.86% -> 80.20%     
client [23] (testset)   loss: 0.5743 -> 0.5819  accuracy: 84.03% -> 83.29%     
client [88] (testset)   loss: 0.4726 -> 0.4876  accuracy: 85.09% -> 85.29%     
client [98] (testset)   loss: 0.5356 -> 0.5332  accuracy: 83.86% -> 84.24%     
client [79] (testset)   loss: 0.4018 -> 0.4077  accuracy: 89.38% -> 89.34%     
client [21] (testset)   loss: 0.5710 -> 0.5637  accuracy: 81.69% -> 82.28%     
client [92] (testset)   loss: 0.5562 -> 0.5442  accuracy: 84.16% -> 83.66%     
client [56] (testset)   loss: 0.6210 -> 0.6071  accuracy: 80.34% -> 80.61%     
client [5]  (testset)   loss: 0.4289 -> 0.4259  accuracy: 87.96% -> 87.26%     
client [52] (testset)   loss: 0.5215 -> 0.5311  accuracy: 83.46% -> 83.16%     
---------------------------- TRAINING EPOCH: 210 ----------------------------  
client [67] (testset)   loss: 0.4390 -> 0.4319  accuracy: 88.05% -> 88.34%     
client [54] (testset)   loss: 0.6002 -> 0.6082  accuracy: 80.70% -> 81.46%     
client [14] (testset)   loss: 0.5834 -> 0.5996  accuracy: 82.50% -> 82.04%     
client [99] (testset)   loss: 0.6308 -> 0.6694  accuracy: 79.83% -> 79.67%     
client [36] (testset)   loss: 0.3711 -> 0.3791  accuracy: 88.76% -> 89.76%     
client [30] (testset)   loss: 0.4913 -> 0.4931  accuracy: 85.76% -> 84.94%     
client [38] (testset)   loss: 0.5011 -> 0.5033  accuracy: 85.14% -> 84.83%     
client [15] (testset)   loss: 0.5536 -> 0.5017  accuracy: 77.99% -> 82.63%     
client [6]  (testset)   loss: 0.5120 -> 0.5210  accuracy: 83.73% -> 83.56%     
client [53] (testset)   loss: 0.4544 -> 0.4654  accuracy: 87.33% -> 87.41%     
---------------------------- TRAINING EPOCH: 220 ----------------------------  
client [99] (testset)   loss: 0.6501 -> 0.6699  accuracy: 79.88% -> 79.20%     
client [6]  (testset)   loss: 0.5210 -> 0.5318  accuracy: 83.56% -> 82.79%     
client [83] (testset)   loss: 0.4475 -> 0.4452  accuracy: 86.63% -> 87.48%     
client [42] (testset)   loss: 0.4983 -> 0.4948  accuracy: 86.42% -> 85.82%     
client [34] (testset)   loss: 0.5158 -> 0.5131  accuracy: 82.34% -> 82.07%     
client [15] (testset)   loss: 0.5017 -> 0.5079  accuracy: 82.63% -> 82.18%     
client [47] (testset)   loss: 0.4852 -> 0.5071  accuracy: 85.41% -> 85.03%     
client [55] (testset)   loss: 0.5160 -> 0.5159  accuracy: 84.10% -> 83.58%     
client [51] (testset)   loss: 0.7341 -> 0.7635  accuracy: 77.78% -> 77.50%     
client [95] (testset)   loss: 0.8545 -> 0.4958  accuracy: 78.64% -> 86.82%     
---------------------------- TRAINING EPOCH: 230 ----------------------------  
client [71] (testset)   loss: 0.5699 -> 0.5568  accuracy: 82.26% -> 83.50%     
client [15] (testset)   loss: 0.5079 -> 0.5077  accuracy: 82.18% -> 82.48%     
client [33] (testset)   loss: 0.5772 -> 0.5265  accuracy: 83.87% -> 85.17%     
client [99] (testset)   loss: 0.6692 -> 0.7072  accuracy: 79.52% -> 80.62%     
client [90] (testset)   loss: 0.6006 -> 0.6361  accuracy: 80.08% -> 79.88%     
client [57] (testset)   loss: 0.4434 -> 0.4450  accuracy: 86.19% -> 86.68%     
client [27] (testset)   loss: 0.5168 -> 0.5112  accuracy: 83.26% -> 83.97%     
client [78] (testset)   loss: 0.4878 -> 0.4957  accuracy: 83.63% -> 83.05%     
client [36] (testset)   loss: 0.3680 -> 0.3697  accuracy: 89.59% -> 89.14%     
client [88] (testset)   loss: 0.4764 -> 0.4759  accuracy: 85.19% -> 85.34%     
---------------------------- TRAINING EPOCH: 240 ----------------------------  
client [70] (testset)   loss: 0.4768 -> 0.4833  accuracy: 86.12% -> 85.68%     
client [35] (testset)   loss: 0.6058 -> 0.6067  accuracy: 84.78% -> 84.23%     
client [16] (testset)   loss: 0.6587 -> 0.6715  accuracy: 80.28% -> 80.42%     
client [80] (testset)   loss: 0.5269 -> 0.5210  accuracy: 83.52% -> 83.27%     
client [38] (testset)   loss: 0.5302 -> 0.5272  accuracy: 84.22% -> 84.22%     
client [78] (testset)   loss: 0.5048 -> 0.5128  accuracy: 83.81% -> 83.00%     
client [68] (testset)   loss: 0.4705 -> 0.4738  accuracy: 85.24% -> 84.80%     
client [11] (testset)   loss: 0.5624 -> 0.5801  accuracy: 83.88% -> 84.48%     
client [64] (testset)   loss: 0.5425 -> 0.5225  accuracy: 85.84% -> 85.55%     
client [82] (testset)   loss: 0.4839 -> 0.4742  accuracy: 85.07% -> 85.38%     
---------------------------- TRAINING EPOCH: 250 ----------------------------  
client [30] (testset)   loss: 0.5133 -> 0.5162  accuracy: 85.16% -> 85.12%     
client [27] (testset)   loss: 0.5112 -> 0.5570  accuracy: 83.97% -> 82.12%     
client [74] (testset)   loss: 0.4217 -> 0.4096  accuracy: 87.11% -> 87.79%     
client [45] (testset)   loss: 0.4596 -> 0.4686  accuracy: 84.78% -> 84.64%     
client [6]  (testset)   loss: 0.5321 -> 0.5308  accuracy: 83.84% -> 82.96%     
client [36] (testset)   loss: 0.3740 -> 0.3783  accuracy: 89.52% -> 89.59%     
client [63] (testset)   loss: 0.3858 -> 0.3773  accuracy: 88.63% -> 88.89%     
client [76] (testset)   loss: 0.5760 -> 0.5689  accuracy: 82.79% -> 83.49%     
client [83] (testset)   loss: 0.4583 -> 0.4720  accuracy: 87.26% -> 86.50%     
client [86] (testset)   loss: 0.4681 -> 0.5517  accuracy: 86.68% -> 80.80%     
---------------------------- TRAINING EPOCH: 260 ----------------------------  
client [83] (testset)   loss: 0.4720 -> 0.4673  accuracy: 86.50% -> 86.41%     
client [99] (testset)   loss: 0.6950 -> 0.7174  accuracy: 79.88% -> 80.15%     
client [74] (testset)   loss: 0.4117 -> 0.4139  accuracy: 87.37% -> 87.42%     
client [73] (testset)   loss: 0.5041 -> 0.5017  accuracy: 85.63% -> 85.52%     
client [29] (testset)   loss: 0.5675 -> 0.6482  accuracy: 83.31% -> 79.80%     
client [92] (testset)   loss: 0.6223 -> 0.5831  accuracy: 83.16% -> 83.81%     
client [6]  (testset)   loss: 0.5301 -> 0.5394  accuracy: 83.29% -> 82.90%     
client [61] (testset)   loss: 0.5937 -> 0.5849  accuracy: 79.80% -> 80.39%     
client [21] (testset)   loss: 0.5872 -> 0.5748  accuracy: 82.42% -> 82.10%     
client [67] (testset)   loss: 0.4374 -> 0.4484  accuracy: 88.63% -> 88.05%     
---------------------------- TRAINING EPOCH: 270 ----------------------------  
client [83] (testset)   loss: 0.4673 -> 0.4586  accuracy: 86.41% -> 87.75%     
client [32] (testset)   loss: 0.7530 -> 0.6393  accuracy: 75.29% -> 79.32%     
client [95] (testset)   loss: 0.4983 -> 0.5986  accuracy: 86.58% -> 82.16%     
client [61] (testset)   loss: 0.5893 -> 0.5897  accuracy: 79.93% -> 79.41%     
client [27] (testset)   loss: 0.5570 -> 0.5333  accuracy: 82.12% -> 84.81%     
client [25] (testset)   loss: 0.4745 -> 0.4753  accuracy: 85.81% -> 85.40%     
client [68] (testset)   loss: 0.4722 -> 0.4879  accuracy: 85.00% -> 84.70%     
client [34] (testset)   loss: 0.5219 -> 0.5362  accuracy: 82.13% -> 82.02%     
client [71] (testset)   loss: 0.5914 -> 0.5983  accuracy: 83.02% -> 82.64%     
client [89] (testset)   loss: 0.4880 -> 0.4923  accuracy: 85.62% -> 85.62%     
---------------------------- TRAINING EPOCH: 280 ----------------------------  
client [78] (testset)   loss: 0.5344 -> 0.5415  accuracy: 82.91% -> 82.82%     
client [81] (testset)   loss: 0.4459 -> 0.4637  accuracy: 87.54% -> 87.37%     
client [51] (testset)   loss: 0.7798 -> 0.7839  accuracy: 78.12% -> 77.78%     
client [54] (testset)   loss: 0.6175 -> 0.6238  accuracy: 80.94% -> 80.50%     
client [65] (testset)   loss: 0.4429 -> 0.4405  accuracy: 87.21% -> 87.17%     
client [41] (testset)   loss: 0.7266 -> 0.7226  accuracy: 75.47% -> 75.94%     
client [11] (testset)   loss: 0.6001 -> 0.6027  accuracy: 84.33% -> 83.19%     
client [85] (testset)   loss: 0.4311 -> 0.4371  accuracy: 87.51% -> 87.08%     
client [12] (testset)   loss: 0.4835 -> 0.4814  accuracy: 86.91% -> 86.91%     
client [23] (testset)   loss: 0.5948 -> 0.5938  accuracy: 83.91% -> 83.85%     
---------------------------- TRAINING EPOCH: 290 ----------------------------  
client [16] (testset)   loss: 0.6683 -> 0.6769  accuracy: 80.76% -> 80.76%     
client [65] (testset)   loss: 0.4503 -> 0.4479  accuracy: 85.86% -> 87.26%     
client [53] (testset)   loss: 0.5193 -> 0.5008  accuracy: 87.17% -> 86.89%     
client [58] (testset)   loss: 0.5167 -> 0.5132  accuracy: 86.65% -> 86.43%     
client [72] (testset)   loss: 0.5569 -> 0.5639  accuracy: 83.85% -> 83.85%     
client [7]  (testset)   loss: 0.6037 -> 0.6019  accuracy: 81.06% -> 80.69%     
client [71] (testset)   loss: 0.5983 -> 0.6095  accuracy: 82.64% -> 82.59%     
client [59] (testset)   loss: 0.3608 -> 0.3634  accuracy: 90.13% -> 90.09%     
client [86] (testset)   loss: 0.4815 -> 0.4740  accuracy: 86.90% -> 86.16%     
client [39] (testset)   loss: 0.5978 -> 0.5730  accuracy: 82.23% -> 81.67%     
---------------------------- TRAINING EPOCH: 300 ----------------------------  
client [99] (testset)   loss: 0.7341 -> 0.8301  accuracy: 80.46% -> 75.46%     
client [7]  (testset)   loss: 0.6049 -> 0.6017  accuracy: 80.43% -> 81.27%     
client [17] (testset)   loss: 0.6118 -> 0.6121  accuracy: 83.93% -> 84.06%     
client [64] (testset)   loss: 0.5484 -> 0.5549  accuracy: 86.18% -> 85.15%     
client [37] (testset)   loss: 0.6634 -> 0.6680  accuracy: 80.69% -> 79.84%     
client [29] (testset)   loss: 0.5916 -> 0.5931  accuracy: 82.14% -> 83.31%     
client [93] (testset)   loss: 0.5979 -> 0.6142  accuracy: 81.94% -> 82.52%     
client [73] (testset)   loss: 0.5158 -> 0.5198  accuracy: 85.57% -> 85.79%     
client [40] (testset)   loss: 0.7150 -> 0.6853  accuracy: 75.09% -> 76.64%     
client [76] (testset)   loss: 0.5763 -> 0.5810  accuracy: 82.89% -> 83.04%     
---------------------------- TRAINING EPOCH: 310 ----------------------------  
client [31] (testset)   loss: 0.6587 -> 0.6594  accuracy: 82.11% -> 82.26%     
client [89] (testset)   loss: 0.5107 -> 0.4977  accuracy: 84.75% -> 85.62%     
client [77] (testset)   loss: 0.5578 -> 0.5816  accuracy: 84.47% -> 84.35%     
client [90] (testset)   loss: 0.6994 -> 0.7023  accuracy: 80.28% -> 79.34%     
client [26] (testset)   loss: 0.3790 -> 0.3619  accuracy: 88.18% -> 88.74%     
client [50] (testset)   loss: 0.4499 -> 0.4529  accuracy: 87.87% -> 87.46%     
client [30] (testset)   loss: 0.5359 -> 0.5413  accuracy: 85.37% -> 85.16%     
client [70] (testset)   loss: 0.4924 -> 0.5000  accuracy: 85.36% -> 85.56%     
client [41] (testset)   loss: 0.7240 -> 0.7528  accuracy: 76.04% -> 76.83%     
client [99] (testset)   loss: 0.8301 -> 0.7682  accuracy: 75.46% -> 79.52%     
---------------------------- TRAINING EPOCH: 320 ----------------------------  
client [68] (testset)   loss: 0.4966 -> 0.4943  accuracy: 84.65% -> 85.04%     
client [70] (testset)   loss: 0.4999 -> 0.5015  accuracy: 85.24% -> 85.32%     
client [52] (testset)   loss: 0.5496 -> 0.5603  accuracy: 83.46% -> 83.58%     
client [1]  (testset)   loss: 0.4716 -> 0.4794  accuracy: 86.80% -> 86.11%     
client [2]  (testset)   loss: 0.4977 -> 0.4964  accuracy: 86.04% -> 86.23%     
client [67] (testset)   loss: 0.4604 -> 0.4703  accuracy: 87.55% -> 88.09%     
client [92] (testset)   loss: 0.6316 -> 0.6417  accuracy: 84.06% -> 82.76%     
client [35] (testset)   loss: 0.6344 -> 0.6344  accuracy: 82.99% -> 83.67%     
client [36] (testset)   loss: 0.3825 -> 0.3870  accuracy: 89.63% -> 88.83%     
client [64] (testset)   loss: 0.5568 -> 0.5603  accuracy: 85.49% -> 85.32%     
---------------------------- TRAINING EPOCH: 330 ----------------------------  
client [44] (testset)   loss: 0.6983 -> 0.6980  accuracy: 78.62% -> 78.62%     
client [6]  (testset)   loss: 0.5692 -> 0.5555  accuracy: 82.68% -> 83.51%     
client [12] (testset)   loss: 0.4977 -> 0.5034  accuracy: 86.60% -> 85.66%     
client [55] (testset)   loss: 0.5259 -> 0.5285  accuracy: 83.94% -> 84.10%     
client [29] (testset)   loss: 0.5914 -> 0.6027  accuracy: 82.88% -> 83.36%     
client [9]  (testset)   loss: 0.6245 -> 0.6169  accuracy: 82.48% -> 82.24%     
client [43] (testset)   loss: 0.5045 -> 0.5071  accuracy: 84.93% -> 84.73%     
client [77] (testset)   loss: 0.5816 -> 0.5734  accuracy: 84.35% -> 84.63%     
client [98] (testset)   loss: 0.6021 -> 0.6053  accuracy: 83.52% -> 84.12%     
client [78] (testset)   loss: 0.5526 -> 0.5563  accuracy: 83.45% -> 83.27%     
---------------------------- TRAINING EPOCH: 340 ----------------------------  
client [92] (testset)   loss: 0.6340 -> 0.6466  accuracy: 83.36% -> 84.16%     
client [80] (testset)   loss: 0.5531 -> 0.5408  accuracy: 83.61% -> 83.86%     
client [63] (testset)   loss: 0.4034 -> 0.4052  accuracy: 88.44% -> 88.44%     
client [76] (testset)   loss: 0.5937 -> 0.6035  accuracy: 82.74% -> 83.19%     
client [78] (testset)   loss: 0.5563 -> 0.5703  accuracy: 83.27% -> 82.69%     
client [25] (testset)   loss: 0.4880 -> 0.4891  accuracy: 85.77% -> 85.32%     
client [58] (testset)   loss: 0.5281 -> 0.5277  accuracy: 85.99% -> 85.60%     
client [13] (testset)   loss: 0.4754 -> 0.4599  accuracy: 87.65% -> 88.14%     
client [17] (testset)   loss: 0.6188 -> 0.6258  accuracy: 83.80% -> 83.33%     
client [38] (testset)   loss: 0.5411 -> 0.5403  accuracy: 84.77% -> 84.83%     
---------------------------- TRAINING EPOCH: 350 ----------------------------  
client [72] (testset)   loss: 0.7162 -> 0.6143  accuracy: 80.19% -> 83.63%     
client [82] (testset)   loss: 0.5205 -> 0.5131  accuracy: 85.07% -> 85.34%     
client [86] (testset)   loss: 0.5074 -> 0.5152  accuracy: 86.85% -> 86.90%     
client [51] (testset)   loss: 0.8338 -> 0.8340  accuracy: 76.67% -> 77.23%     
client [96] (testset)   loss: 0.5325 -> 0.5440  accuracy: 84.99% -> 85.07%     
client [42] (testset)   loss: 0.5156 -> 0.5312  accuracy: 85.93% -> 85.87%     
client [55] (testset)   loss: 0.5471 -> 0.5463  accuracy: 83.94% -> 83.99%     
client [13] (testset)   loss: 0.4645 -> 0.5190  accuracy: 87.65% -> 87.31%     
client [1]  (testset)   loss: 0.4648 -> 0.4660  accuracy: 86.96% -> 86.64%     
client [12] (testset)   loss: 0.5034 -> 0.4920  accuracy: 85.66% -> 86.41%     
---------------------------- TRAINING EPOCH: 360 ----------------------------  
client [68] (testset)   loss: 0.4935 -> 0.5403  accuracy: 84.85% -> 84.70%     
client [23] (testset)   loss: 0.6101 -> 0.6062  accuracy: 83.57% -> 83.51%     
client [46] (testset)   loss: 0.5056 -> 0.5062  accuracy: 85.13% -> 85.07%     
client [41] (testset)   loss: 0.7785 -> 0.7582  accuracy: 76.20% -> 75.89%     
client [25] (testset)   loss: 0.4935 -> 0.5011  accuracy: 85.81% -> 85.98%     
client [58] (testset)   loss: 0.7519 -> 0.5556  accuracy: 85.20% -> 86.47%     
client [14] (testset)   loss: 0.6392 -> 0.6952  accuracy: 82.40% -> 80.07%     
client [33] (testset)   loss: 0.5538 -> 0.5662  accuracy: 84.80% -> 84.61%     
client [85] (testset)   loss: 0.4403 -> 0.4422  accuracy: 87.82% -> 87.63%     
client [62] (testset)   loss: 0.4695 -> 0.4709  accuracy: 86.83% -> 86.77%     
---------------------------- TRAINING EPOCH: 370 ----------------------------  
client [98] (testset)   loss: 0.6112 -> 0.6343  accuracy: 84.03% -> 84.29%     
client [63] (testset)   loss: 0.4176 -> 0.4150  accuracy: 88.69% -> 88.60%     
client [70] (testset)   loss: 0.5088 -> 0.5260  accuracy: 85.36% -> 84.65%     
client [65] (testset)   loss: 0.4672 -> 0.4723  accuracy: 86.25% -> 85.30%     
client [14] (testset)   loss: 0.6468 -> 0.6576  accuracy: 82.55% -> 82.45%     
client [73] (testset)   loss: 0.5163 -> 0.5395  accuracy: 85.63% -> 84.79%     
client [34] (testset)   loss: 0.5608 -> 0.5705  accuracy: 82.07% -> 81.80%     
client [99] (testset)   loss: 0.7374 -> 0.7188  accuracy: 80.25% -> 79.15%     
client [69] (testset)   loss: 0.5632 -> 0.5636  accuracy: 85.17% -> 85.61%     
client [46] (testset)   loss: 0.5062 -> 0.5167  accuracy: 85.07% -> 85.58%     
---------------------------- TRAINING EPOCH: 380 ----------------------------  
client [99] (testset)   loss: 0.7484 -> 0.7636  accuracy: 79.20% -> 80.09%     
client [93] (testset)   loss: 0.6128 -> 0.6159  accuracy: 82.00% -> 82.75%     
client [11] (testset)   loss: 0.7000 -> 0.6041  accuracy: 80.09% -> 84.18%     
client [58] (testset)   loss: 0.5512 -> 0.5507  accuracy: 86.43% -> 86.21%     
client [81] (testset)   loss: 0.4762 -> 0.4775  accuracy: 86.98% -> 87.26%     
client [85] (testset)   loss: 0.4422 -> 0.4444  accuracy: 87.63% -> 87.75%     
client [89] (testset)   loss: 0.5052 -> 0.5076  accuracy: 85.52% -> 85.33%     
client [45] (testset)   loss: 0.4781 -> 0.4939  accuracy: 85.03% -> 84.88%     
client [8]  (testset)   loss: 0.5160 -> 0.5127  accuracy: 85.94% -> 86.50%     
client [68] (testset)   loss: 0.4989 -> 0.5121  accuracy: 85.04% -> 85.44%     
---------------------------- TRAINING EPOCH: 390 ----------------------------  
client [67] (testset)   loss: 0.4685 -> 0.4699  accuracy: 88.34% -> 88.05%     
client [72] (testset)   loss: 0.6035 -> 0.6115  accuracy: 83.63% -> 83.58%     
client [1]  (testset)   loss: 0.4682 -> 0.4776  accuracy: 87.06% -> 86.75%     
client [78] (testset)   loss: 0.6067 -> 0.6136  accuracy: 82.28% -> 83.09%     
client [83] (testset)   loss: 0.5157 -> 0.5226  accuracy: 87.21% -> 87.12%     
client [21] (testset)   loss: 0.6413 -> 0.6364  accuracy: 82.10% -> 81.97%     
client [56] (testset)   loss: 0.7063 -> 0.7155  accuracy: 80.84% -> 80.79%     
client [44] (testset)   loss: 0.7215 -> 0.7260  accuracy: 79.90% -> 79.90%     
client [92] (testset)   loss: 0.6607 -> 0.6633  accuracy: 84.21% -> 83.36%     
client [27] (testset)   loss: 0.5740 -> 0.5695  accuracy: 83.68% -> 83.85%     
---------------------------- TRAINING EPOCH: 400 ----------------------------  
client [10] (testset)   loss: 0.5291 -> 0.5217  accuracy: 85.75% -> 86.19%     
client [39] (testset)   loss: 0.6044 -> 0.6151  accuracy: 81.33% -> 81.33%     
client [65] (testset)   loss: 0.4744 -> 0.5642  accuracy: 87.04% -> 83.69%     
client [26] (testset)   loss: 0.4167 -> 0.3889  accuracy: 88.14% -> 88.22%     
client [19] (testset)   loss: 0.4862 -> 0.4848  accuracy: 85.25% -> 85.96%     
client [68] (testset)   loss: 0.5079 -> 0.5199  accuracy: 85.00% -> 84.75%     
client [41] (testset)   loss: 0.8121 -> 0.7997  accuracy: 76.51% -> 77.09%     
client [50] (testset)   loss: 0.4807 -> 0.4738  accuracy: 87.51% -> 87.56%     
client [75] (testset)   loss: 0.5432 -> 0.5402  accuracy: 85.33% -> 85.24%     
client [81] (testset)   loss: 0.4808 -> 0.4810  accuracy: 87.09% -> 87.26%     
Training... ---------------------------------------- 100% 8:03:54
FedProto's average time taken by each global epoch: 1 min 12.45 sec.           
FedProto's total running time: 8 h 3 m 54 s.                                   
==================== FedProto Experiment Results: ====================         
Display format: (before local fine-tuning) -> (after local fine-tuning)        
 So if finetune_epoch = 0, x.xx% -> 0.00% is normal.                           
 Centralized testing ONLY happens after model aggregation, so the stats between
'->' are the same.                                                             
{                                                                              
    "100": {                                                                   
        "all_clients": {                                                       
            "test": {                                                          
                "loss": "0.5025 -> 0.0000",                                    
                "accuracy": "84.12% -> 0.00%"                                  
            }                                                                  
        }                                                                      
    },                                                                         
    "200": {                                                                   
        "all_clients": {                                                       
            "test": {                                                          
                "loss": "0.5069 -> 0.0000",                                    
                "accuracy": "84.49% -> 0.00%"                                  
            }                                                                  
        }                                                                      
    },                                                                         
    "300": {                                                                   
        "all_clients": {                                                       
            "test": {                                                          
                "loss": "0.5421 -> 0.0000",                                    
                "accuracy": "84.36% -> 0.00%"                                  
            }                                                                  
        }                                                                      
    },                                                                         
    "400": {                                                                   
        "all_clients": {                                                       
            "test": {                                                          
                "loss": "0.5741 -> 0.0000",                                    
                "accuracy": "84.23% -> 0.00%"                                  
            }                                                                  
        }                                                                      
    }                                                                          
}                                                                              
==================== FedProto Max Accuracy ====================                
all_clients:                                                                   
(test) before fine-tuning: 84.49% at epoch 200                                 
(test) after fine-tuning: 0.00% at epoch 100                                   
[0m