==================== FedRoD ====================                               
Experiment Arguments:                                                          
{
│   'method': 'fedrod',
│   'dataset': {
│   │   'name': 'mnist',
│   │   'client_num': 100,
│   │   'test_ratio': 0.25,
│   │   'val_ratio': 0.0,
│   │   'seed': 42,
│   │   'split': 'sample',
│   │   'IID_ratio': 0.0,
│   │   'monitor_window_name_suffix': 'mnist-100clients-0%IID-Dir(1.0)-seed42',
│   │   'alpha': 1.0,
│   │   'min_samples_per_client': 10
│   },
│   'model': {
│   │   'name': 'avgcnn',
│   │   'use_torchvision_pretrained_weights': True,
│   │   'external_model_weights_path': None
│   },
│   'optimizer': {
│   │   'lr': 0.01,
│   │   'dampening': 0,
│   │   'weight_decay': 0,
│   │   'momentum': 0,
│   │   'nesterov': False,
│   │   'name': 'sgd'
│   },
│   'mode': 'serial',
│   'parallel': {
│   │   'ray_cluster_addr': None,
│   │   'num_cpus': None,
│   │   'num_gpus': None,
│   │   'num_workers': 2
│   },
│   'common': {
│   │   'seed': 42,
│   │   'join_ratio': 0.1,
│   │   'global_epoch': 400,
│   │   'local_epoch': 5,
│   │   'batch_size': 32,
│   │   'reset_optimizer_on_global_epoch': True,
│   │   'straggler_ratio': 0,
│   │   'straggler_min_local_epoch': 0,
│   │   'buffers': 'global',
│   │   'client_side_evaluation': True,
│   │   'test': {
│   │   │   'client': {
│   │   │   │   'interval': 100,
│   │   │   │   'finetune_epoch': 0,
│   │   │   │   'train': False,
│   │   │   │   'val': False,
│   │   │   │   'test': True
│   │   │   },
│   │   │   'server': {
│   │   │   │   'interval': -1,
│   │   │   │   'train': False,
│   │   │   │   'val': False,
│   │   │   │   'test': False,
│   │   │   │   'model_in_train_mode': False
│   │   │   }
│   │   },
│   │   'verbose_gap': 10,
│   │   'monitor': None,
│   │   'use_cuda': True,
│   │   'save_log': True,
│   │   'save_model': False,
│   │   'save_learning_curve_plot': False,
│   │   'save_metrics': True,
│   │   'delete_useless_run': True
│   },
│   'fedrod': {
│   │   'gamma': 1,
│   │   'hyper': 0,
│   │   'hyper_lr': 0.1,
│   │   'hyper_hidden_dim': 32,
│   │   'eval_per': 1
│   }
}
---------------------------- TRAINING EPOCH: 10 ----------------------------   
client [77] (testset)   loss: 0.0492 -> 0.0433  accuracy: 98.39% -> 98.39%     
client [81] (testset)   loss: 0.0945 -> 0.1053  accuracy: 98.18% -> 98.18%     
client [21] (testset)   loss: 0.0804 -> 0.0306  accuracy: 97.35% -> 99.12%     
client [68] (testset)   loss: 0.0104 -> 0.0091  accuracy: 100.00% -> 99.44%    
client [93] (testset)   loss: 0.0563 -> 0.0465  accuracy: 98.41% -> 98.41%     
client [31] (testset)   loss: 0.0785 -> 0.0643  accuracy: 98.21% -> 98.21%     
client [20] (testset)   loss: 0.0490 -> 0.0484  accuracy: 98.68% -> 98.68%     
client [59] (testset)   loss: 0.0377 -> 0.0558  accuracy: 98.96% -> 97.92%     
client [48] (testset)   loss: 0.0368 -> 0.0367  accuracy: 99.29% -> 98.58%     
client [34] (testset)   loss: 0.0340 -> 0.0472  accuracy: 98.65% -> 98.65%     
---------------------------- TRAINING EPOCH: 20 ----------------------------   
client [69] (testset)   loss: 0.0351 -> 0.0353  accuracy: 98.19% -> 96.99%     
client [99] (testset)   loss: 0.0627 -> 0.0623  accuracy: 97.77% -> 97.21%     
client [67] (testset)   loss: 0.0460 -> 0.0498  accuracy: 99.15% -> 99.15%     
client [0]  (testset)   loss: 0.0227 -> 0.0326  accuracy: 98.48% -> 98.99%     
client [76] (testset)   loss: 0.0003 -> 0.0003  accuracy: 100.00% -> 100.00%   
client [41] (testset)   loss: 0.0282 -> 0.0338  accuracy: 99.40% -> 99.40%     
client [62] (testset)   loss: 0.0559 -> 0.0246  accuracy: 98.92% -> 99.46%     
client [2]  (testset)   loss: 0.0535 -> 0.0419  accuracy: 97.64% -> 97.64%     
client [14] (testset)   loss: 0.1369 -> 0.1233  accuracy: 96.39% -> 96.39%     
client [46] (testset)   loss: 0.0157 -> 0.0102  accuracy: 100.00% -> 100.00%   
---------------------------- TRAINING EPOCH: 30 ----------------------------   
client [24] (testset)   loss: 0.0127 -> 0.0134  accuracy: 100.00% -> 100.00%   
client [68] (testset)   loss: 0.0015 -> 0.0011  accuracy: 100.00% -> 100.00%   
client [57] (testset)   loss: 0.1070 -> 0.1096  accuracy: 97.70% -> 97.70%     
client [17] (testset)   loss: 0.0214 -> 0.0215  accuracy: 98.69% -> 99.13%     
client [54] (testset)   loss: 0.0873 -> 0.1064  accuracy: 98.31% -> 97.75%     
client [23] (testset)   loss: 0.0543 -> 0.0534  accuracy: 98.92% -> 98.92%     
client [35] (testset)   loss: 0.0041 -> 0.0039  accuracy: 100.00% -> 100.00%   
client [59] (testset)   loss: 0.0324 -> 0.0540  accuracy: 98.44% -> 97.92%     
client [31] (testset)   loss: 0.0316 -> 0.0444  accuracy: 98.21% -> 98.21%     
client [9]  (testset)   loss: 0.0181 -> 0.0070  accuracy: 99.07% -> 100.00%    
---------------------------- TRAINING EPOCH: 40 ----------------------------   
client [64] (testset)   loss: 0.0073 -> 0.0156  accuracy: 100.00% -> 99.59%    
client [33] (testset)   loss: 0.0257 -> 0.0307  accuracy: 99.29% -> 99.29%     
client [16] (testset)   loss: 0.0556 -> 0.0520  accuracy: 97.26% -> 97.72%     
client [44] (testset)   loss: 0.1927 -> 0.1774  accuracy: 99.40% -> 99.40%     
client [8]  (testset)   loss: 0.0788 -> 0.0734  accuracy: 98.78% -> 98.78%     
client [31] (testset)   loss: 0.0408 -> 0.0412  accuracy: 99.11% -> 99.11%     
client [47] (testset)   loss: 0.0075 -> 0.0220  accuracy: 99.60% -> 99.19%     
client [36] (testset)   loss: 0.0049 -> 0.0215  accuracy: 100.00% -> 98.36%    
client [20] (testset)   loss: 0.0495 -> 0.0396  accuracy: 99.12% -> 98.68%     
client [56] (testset)   loss: 0.0059 -> 0.0128  accuracy: 100.00% -> 99.47%    
---------------------------- TRAINING EPOCH: 50 ----------------------------   
client [4]  (testset)   loss: 0.1372 -> 0.1354  accuracy: 98.29% -> 98.29%     
client [60] (testset)   loss: 0.0014 -> 0.0033  accuracy: 100.00% -> 100.00%   
client [28] (testset)   loss: 0.0067 -> 0.0083  accuracy: 100.00% -> 100.00%   
client [25] (testset)   loss: 0.0480 -> 0.0321  accuracy: 98.58% -> 98.58%     
client [58] (testset)   loss: 0.0111 -> 0.0170  accuracy: 99.49% -> 99.49%     
client [44] (testset)   loss: 0.1925 -> 0.1824  accuracy: 98.80% -> 98.80%     
client [39] (testset)   loss: 0.0200 -> 0.0222  accuracy: 99.45% -> 99.45%     
client [29] (testset)   loss: 0.0151 -> 0.0284  accuracy: 99.13% -> 98.26%     
client [3]  (testset)   loss: 0.0957 -> 0.1357  accuracy: 96.96% -> 96.52%     
client [84] (testset)   loss: 0.0206 -> 0.0239  accuracy: 99.41% -> 99.41%     
---------------------------- TRAINING EPOCH: 60 ----------------------------   
client [21] (testset)   loss: 0.0037 -> 0.0049  accuracy: 100.00% -> 100.00%   
client [84] (testset)   loss: 0.0191 -> 0.0189  accuracy: 99.41% -> 99.41%     
client [10] (testset)   loss: 0.0485 -> 0.0490  accuracy: 99.34% -> 99.34%     
client [36] (testset)   loss: 0.0083 -> 0.0099  accuracy: 100.00% -> 100.00%   
client [65] (testset)   loss: 0.0610 -> 0.0705  accuracy: 98.24% -> 98.24%     
client [81] (testset)   loss: 0.0891 -> 0.1084  accuracy: 98.18% -> 98.18%     
client [79] (testset)   loss: 0.0061 -> 0.0101  accuracy: 99.64% -> 99.28%     
client [42] (testset)   loss: 0.0462 -> 0.0442  accuracy: 99.12% -> 99.12%     
client [11] (testset)   loss: 0.0299 -> 0.0326  accuracy: 98.45% -> 98.45%     
client [96] (testset)   loss: 0.0315 -> 0.0273  accuracy: 99.04% -> 99.04%     
---------------------------- TRAINING EPOCH: 70 ----------------------------   
client [8]  (testset)   loss: 0.0764 -> 0.0791  accuracy: 98.78% -> 98.78%     
client [53] (testset)   loss: 0.0702 -> 0.0594  accuracy: 97.32% -> 97.32%     
client [52] (testset)   loss: 0.0068 -> 0.0106  accuracy: 99.08% -> 99.08%     
client [42] (testset)   loss: 0.0431 -> 0.0409  accuracy: 99.12% -> 99.12%     
client [69] (testset)   loss: 0.0175 -> 0.0202  accuracy: 99.40% -> 98.80%     
client [59] (testset)   loss: 0.0202 -> 0.0284  accuracy: 99.48% -> 97.92%     
client [7]  (testset)   loss: 0.0039 -> 0.0048  accuracy: 100.00% -> 100.00%   
client [26] (testset)   loss: 0.0097 -> 0.0125  accuracy: 99.58% -> 99.58%     
client [49] (testset)   loss: 0.0084 -> 0.0078  accuracy: 99.38% -> 99.38%     
client [98] (testset)   loss: 0.0137 -> 0.0205  accuracy: 99.19% -> 99.19%     
---------------------------- TRAINING EPOCH: 80 ----------------------------   
client [98] (testset)   loss: 0.0082 -> 0.0126  accuracy: 100.00% -> 99.19%    
client [47] (testset)   loss: 0.0203 -> 0.0251  accuracy: 99.19% -> 99.19%     
client [21] (testset)   loss: 0.0049 -> 0.0053  accuracy: 100.00% -> 100.00%   
client [77] (testset)   loss: 0.0128 -> 0.0131  accuracy: 99.20% -> 99.20%     
client [95] (testset)   loss: 0.0732 -> 0.0738  accuracy: 97.56% -> 98.05%     
client [91] (testset)   loss: 0.0097 -> 0.0101  accuracy: 100.00% -> 100.00%   
client [14] (testset)   loss: 0.1927 -> 0.1970  accuracy: 96.39% -> 96.39%     
client [99] (testset)   loss: 0.0414 -> 0.0429  accuracy: 98.88% -> 98.32%     
client [20] (testset)   loss: 0.0453 -> 0.0410  accuracy: 99.12% -> 99.12%     
client [39] (testset)   loss: 0.0175 -> 0.0194  accuracy: 99.45% -> 99.45%     
---------------------------- TRAINING EPOCH: 90 ----------------------------   
client [52] (testset)   loss: 0.0077 -> 0.0073  accuracy: 99.08% -> 99.08%     
client [62] (testset)   loss: 0.0066 -> 0.0069  accuracy: 100.00% -> 100.00%   
client [71] (testset)   loss: 0.1058 -> 0.1014  accuracy: 96.86% -> 96.86%     
client [97] (testset)   loss: 0.0313 -> 0.0285  accuracy: 98.66% -> 98.66%     
client [30] (testset)   loss: 0.0244 -> 0.0216  accuracy: 99.11% -> 99.11%     
client [88] (testset)   loss: 0.0384 -> 0.0362  accuracy: 98.62% -> 98.62%     
client [60] (testset)   loss: 0.0010 -> 0.0015  accuracy: 100.00% -> 100.00%   
client [82] (testset)   loss: 0.0231 -> 0.0233  accuracy: 98.97% -> 98.97%     
client [91] (testset)   loss: 0.0103 -> 0.0107  accuracy: 100.00% -> 100.00%   
client [57] (testset)   loss: 0.1181 -> 0.1188  accuracy: 98.16% -> 97.70%     
---------------------------- TRAINING EPOCH: 100 ----------------------------  
client [31] (testset)   loss: 0.0410 -> 0.0409  accuracy: 98.21% -> 99.11%     
client [15] (testset)   loss: 0.0750 -> 0.0762  accuracy: 98.52% -> 98.03%     
client [71] (testset)   loss: 0.0965 -> 0.0910  accuracy: 97.38% -> 97.91%     
client [97] (testset)   loss: 0.0319 -> 0.0338  accuracy: 98.66% -> 98.66%     
client [53] (testset)   loss: 0.0511 -> 0.0421  accuracy: 98.21% -> 98.21%     
client [77] (testset)   loss: 0.0234 -> 0.0178  accuracy: 99.20% -> 99.20%     
client [76] (testset)   loss: 0.0000 -> 0.0000  accuracy: 100.00% -> 100.00%   
client [79] (testset)   loss: 0.0071 -> 0.0102  accuracy: 99.64% -> 99.64%     
client [28] (testset)   loss: 0.0115 -> 0.0074  accuracy: 99.27% -> 100.00%    
client [99] (testset)   loss: 0.0545 -> 0.0511  accuracy: 98.32% -> 98.32%     
---------------------------- TRAINING EPOCH: 110 ----------------------------  
client [97] (testset)   loss: 0.0295 -> 0.0312  accuracy: 98.66% -> 98.66%     
client [86] (testset)   loss: 0.0145 -> 0.0095  accuracy: 99.25% -> 99.25%     
client [34] (testset)   loss: 0.0332 -> 0.0238  accuracy: 99.32% -> 99.32%     
client [73] (testset)   loss: 0.1571 -> 0.1553  accuracy: 97.92% -> 97.92%     
client [5]  (testset)   loss: 0.0191 -> 0.0140  accuracy: 99.38% -> 99.38%     
client [96] (testset)   loss: 0.0329 -> 0.0320  accuracy: 99.04% -> 99.04%     
client [22] (testset)   loss: 0.0575 -> 0.0541  accuracy: 99.09% -> 99.09%     
client [60] (testset)   loss: 0.0019 -> 0.0019  accuracy: 100.00% -> 100.00%   
client [66] (testset)   loss: 0.0639 -> 0.0593  accuracy: 98.45% -> 98.45%     
client [83] (testset)   loss: 0.0371 -> 0.0356  accuracy: 98.09% -> 99.04%     
---------------------------- TRAINING EPOCH: 120 ----------------------------  
client [76] (testset)   loss: 0.0000 -> 0.0000  accuracy: 100.00% -> 100.00%   
client [65] (testset)   loss: 0.0846 -> 0.0875  accuracy: 97.06% -> 97.06%     
client [95] (testset)   loss: 0.0771 -> 0.0770  accuracy: 98.54% -> 98.54%     
client [17] (testset)   loss: 0.0368 -> 0.0337  accuracy: 99.13% -> 99.13%     
client [8]  (testset)   loss: 0.1048 -> 0.1066  accuracy: 98.78% -> 98.78%     
client [35] (testset)   loss: 0.0020 -> 0.0026  accuracy: 100.00% -> 100.00%   
client [98] (testset)   loss: 0.0369 -> 0.0449  accuracy: 99.19% -> 98.37%     
client [53] (testset)   loss: 0.0306 -> 0.0306  accuracy: 98.21% -> 98.21%     
client [43] (testset)   loss: 0.0432 -> 0.0493  accuracy: 99.10% -> 99.10%     
client [64] (testset)   loss: 0.0063 -> 0.0086  accuracy: 99.59% -> 100.00%    
---------------------------- TRAINING EPOCH: 130 ----------------------------  
client [21] (testset)   loss: 0.0064 -> 0.0042  accuracy: 100.00% -> 100.00%   
client [88] (testset)   loss: 0.0357 -> 0.0337  accuracy: 98.62% -> 98.62%     
client [38] (testset)   loss: 0.0409 -> 0.0445  accuracy: 99.51% -> 99.51%     
client [3]  (testset)   loss: 0.1466 -> 0.1475  accuracy: 96.09% -> 96.96%     
client [5]  (testset)   loss: 0.0059 -> 0.0100  accuracy: 99.38% -> 99.38%     
client [41] (testset)   loss: 0.0180 -> 0.0294  accuracy: 98.81% -> 98.81%     
client [7]  (testset)   loss: 0.0015 -> 0.0014  accuracy: 100.00% -> 100.00%   
client [37] (testset)   loss: 0.0615 -> 0.0634  accuracy: 97.85% -> 97.85%     
client [45] (testset)   loss: 0.0344 -> 0.0376  accuracy: 99.23% -> 99.23%     
client [47] (testset)   loss: 0.0197 -> 0.0373  accuracy: 99.19% -> 99.19%     
---------------------------- TRAINING EPOCH: 140 ----------------------------  
client [16] (testset)   loss: 0.0531 -> 0.0505  accuracy: 98.17% -> 98.17%     
client [11] (testset)   loss: 0.0650 -> 0.0595  accuracy: 98.45% -> 98.45%     
client [37] (testset)   loss: 0.0678 -> 0.0667  accuracy: 98.28% -> 98.28%     
client [41] (testset)   loss: 0.0297 -> 0.0407  accuracy: 98.81% -> 98.81%     
client [95] (testset)   loss: 0.0737 -> 0.0738  accuracy: 98.05% -> 98.54%     
client [53] (testset)   loss: 0.0533 -> 0.0524  accuracy: 97.32% -> 97.32%     
client [22] (testset)   loss: 0.0553 -> 0.0536  accuracy: 99.09% -> 99.09%     
client [25] (testset)   loss: 0.0329 -> 0.0341  accuracy: 99.05% -> 99.05%     
client [69] (testset)   loss: 0.0111 -> 0.0140  accuracy: 99.40% -> 99.40%     
client [46] (testset)   loss: 0.0007 -> 0.0005  accuracy: 100.00% -> 100.00%   
---------------------------- TRAINING EPOCH: 150 ----------------------------  
client [47] (testset)   loss: 0.0188 -> 0.0222  accuracy: 99.19% -> 99.19%     
client [69] (testset)   loss: 0.0054 -> 0.0062  accuracy: 100.00% -> 99.40%    
client [82] (testset)   loss: 0.0160 -> 0.0147  accuracy: 98.97% -> 98.97%     
client [45] (testset)   loss: 0.0364 -> 0.0374  accuracy: 99.23% -> 99.23%     
client [7]  (testset)   loss: 0.0025 -> 0.0031  accuracy: 100.00% -> 100.00%   
client [50] (testset)   loss: 0.0363 -> 0.0363  accuracy: 99.30% -> 99.30%     
client [35] (testset)   loss: 0.0006 -> 0.0006  accuracy: 100.00% -> 100.00%   
client [24] (testset)   loss: 0.0380 -> 0.0263  accuracy: 99.12% -> 99.12%     
client [15] (testset)   loss: 0.0720 -> 0.0720  accuracy: 98.03% -> 98.03%     
client [58] (testset)   loss: 0.0139 -> 0.0182  accuracy: 98.97% -> 98.97%     
---------------------------- TRAINING EPOCH: 160 ----------------------------  
client [48] (testset)   loss: 0.0280 -> 0.0277  accuracy: 98.58% -> 98.58%     
client [76] (testset)   loss: 0.0000 -> 0.0000  accuracy: 100.00% -> 100.00%   
client [67] (testset)   loss: 0.0571 -> 0.0537  accuracy: 98.29% -> 98.29%     
client [37] (testset)   loss: 0.0633 -> 0.0633  accuracy: 98.28% -> 98.28%     
client [58] (testset)   loss: 0.0178 -> 0.0182  accuracy: 98.97% -> 98.97%     
client [64] (testset)   loss: 0.0039 -> 0.0039  accuracy: 100.00% -> 100.00%   
client [77] (testset)   loss: 0.0132 -> 0.0120  accuracy: 99.20% -> 99.60%     
client [55] (testset)   loss: 0.0141 -> 0.0135  accuracy: 98.99% -> 98.99%     
client [12] (testset)   loss: 0.0048 -> 0.0071  accuracy: 99.47% -> 99.47%     
client [89] (testset)   loss: 0.0783 -> 0.0778  accuracy: 98.23% -> 98.23%     
---------------------------- TRAINING EPOCH: 170 ----------------------------  
client [84] (testset)   loss: 0.0265 -> 0.0264  accuracy: 99.41% -> 99.41%     
client [51] (testset)   loss: 0.0365 -> 0.0445  accuracy: 98.13% -> 98.60%     
client [8]  (testset)   loss: 0.0869 -> 0.0856  accuracy: 98.78% -> 98.78%     
client [18] (testset)   loss: 0.0000 -> 0.0000  accuracy: 100.00% -> 100.00%   
client [94] (testset)   loss: 0.0526 -> 0.0538  accuracy: 99.61% -> 99.61%     
client [81] (testset)   loss: 0.1196 -> 0.1259  accuracy: 98.18% -> 98.18%     
client [3]  (testset)   loss: 0.1552 -> 0.1591  accuracy: 96.96% -> 96.96%     
client [11] (testset)   loss: 0.0308 -> 0.0313  accuracy: 98.97% -> 98.97%     
client [95] (testset)   loss: 0.0800 -> 0.0818  accuracy: 98.05% -> 98.05%     
client [67] (testset)   loss: 0.0613 -> 0.0581  accuracy: 98.29% -> 98.29%     
---------------------------- TRAINING EPOCH: 180 ----------------------------  
client [21] (testset)   loss: 0.0034 -> 0.0033  accuracy: 100.00% -> 100.00%   
client [79] (testset)   loss: 0.0047 -> 0.0037  accuracy: 100.00% -> 100.00%   
client [58] (testset)   loss: 0.0188 -> 0.0197  accuracy: 98.97% -> 98.97%     
client [88] (testset)   loss: 0.0268 -> 0.0291  accuracy: 98.62% -> 97.92%     
client [46] (testset)   loss: 0.0003 -> 0.0003  accuracy: 100.00% -> 100.00%   
client [11] (testset)   loss: 0.0413 -> 0.0410  accuracy: 98.45% -> 98.45%     
client [55] (testset)   loss: 0.0249 -> 0.0243  accuracy: 98.99% -> 98.99%     
client [13] (testset)   loss: 0.1182 -> 0.1213  accuracy: 97.60% -> 97.60%     
client [31] (testset)   loss: 0.0344 -> 0.0384  accuracy: 99.11% -> 99.11%     
client [75] (testset)   loss: 0.0060 -> 0.0074  accuracy: 99.47% -> 99.47%     
---------------------------- TRAINING EPOCH: 190 ----------------------------  
client [19] (testset)   loss: 0.0014 -> 0.0012  accuracy: 100.00% -> 100.00%   
client [7]  (testset)   loss: 0.0019 -> 0.0019  accuracy: 100.00% -> 100.00%   
client [57] (testset)   loss: 0.1266 -> 0.1276  accuracy: 97.70% -> 97.70%     
client [13] (testset)   loss: 0.1218 -> 0.1234  accuracy: 97.60% -> 97.60%     
client [43] (testset)   loss: 0.0497 -> 0.0492  accuracy: 99.10% -> 99.10%     
client [91] (testset)   loss: 0.0054 -> 0.0055  accuracy: 100.00% -> 100.00%   
client [10] (testset)   loss: 0.0602 -> 0.0610  accuracy: 99.34% -> 99.34%     
client [64] (testset)   loss: 0.0038 -> 0.0037  accuracy: 100.00% -> 100.00%   
client [82] (testset)   loss: 0.0211 -> 0.0207  accuracy: 98.97% -> 98.97%     
client [22] (testset)   loss: 0.0542 -> 0.0537  accuracy: 99.09% -> 99.09%     
---------------------------- TRAINING EPOCH: 200 ----------------------------  
client [20] (testset)   loss: 0.0570 -> 0.0558  accuracy: 98.68% -> 98.68%     
client [23] (testset)   loss: 0.0660 -> 0.0641  accuracy: 98.92% -> 98.92%     
client [88] (testset)   loss: 0.0277 -> 0.0302  accuracy: 98.62% -> 98.27%     
client [98] (testset)   loss: 0.0241 -> 0.0245  accuracy: 99.19% -> 99.19%     
client [79] (testset)   loss: 0.0085 -> 0.0083  accuracy: 99.64% -> 99.64%     
client [21] (testset)   loss: 0.0033 -> 0.0033  accuracy: 100.00% -> 100.00%   
client [92] (testset)   loss: 0.1160 -> 0.1202  accuracy: 97.12% -> 97.60%     
client [56] (testset)   loss: 0.0012 -> 0.0013  accuracy: 100.00% -> 100.00%   
client [5]  (testset)   loss: 0.0142 -> 0.0131  accuracy: 99.38% -> 99.38%     
client [52] (testset)   loss: 0.0079 -> 0.0089  accuracy: 99.08% -> 99.08%     
---------------------------- TRAINING EPOCH: 210 ----------------------------  
client [67] (testset)   loss: 0.0600 -> 0.0604  accuracy: 99.15% -> 99.15%     
client [54] (testset)   loss: 0.1141 -> 0.1156  accuracy: 98.31% -> 97.75%     
client [14] (testset)   loss: 0.2194 -> 0.2172  accuracy: 96.39% -> 96.39%     
client [99] (testset)   loss: 0.0601 -> 0.0562  accuracy: 98.32% -> 98.32%     
client [36] (testset)   loss: 0.0102 -> 0.0104  accuracy: 99.45% -> 99.45%     
client [30] (testset)   loss: 0.0379 -> 0.0326  accuracy: 99.11% -> 99.11%     
client [38] (testset)   loss: 0.0523 -> 0.0528  accuracy: 99.51% -> 99.51%     
client [15] (testset)   loss: 0.0948 -> 0.0869  accuracy: 98.03% -> 98.03%     
client [6]  (testset)   loss: 0.1380 -> 0.1499  accuracy: 97.95% -> 97.95%     
client [53] (testset)   loss: 0.0535 -> 0.0526  accuracy: 98.21% -> 98.21%     
---------------------------- TRAINING EPOCH: 220 ----------------------------  
client [99] (testset)   loss: 0.0468 -> 0.0489  accuracy: 97.77% -> 97.77%     
client [6]  (testset)   loss: 0.1505 -> 0.1682  accuracy: 97.95% -> 97.95%     
client [83] (testset)   loss: 0.0520 -> 0.0598  accuracy: 98.09% -> 98.09%     
client [42] (testset)   loss: 0.0423 -> 0.0422  accuracy: 99.12% -> 99.12%     
client [34] (testset)   loss: 0.0239 -> 0.0237  accuracy: 99.32% -> 99.32%     
client [15] (testset)   loss: 0.0775 -> 0.0798  accuracy: 98.03% -> 98.03%     
client [47] (testset)   loss: 0.0239 -> 0.0279  accuracy: 99.19% -> 99.19%     
client [55] (testset)   loss: 0.0264 -> 0.0250  accuracy: 98.99% -> 98.99%     
client [51] (testset)   loss: 0.0566 -> 0.0603  accuracy: 98.13% -> 98.13%     
client [95] (testset)   loss: 0.0832 -> 0.0834  accuracy: 98.05% -> 98.05%     
---------------------------- TRAINING EPOCH: 230 ----------------------------  
client [71] (testset)   loss: 0.1002 -> 0.0999  accuracy: 97.91% -> 98.43%     
client [15] (testset)   loss: 0.0734 -> 0.0740  accuracy: 98.03% -> 98.03%     
client [33] (testset)   loss: 0.0420 -> 0.0485  accuracy: 99.29% -> 99.29%     
client [99] (testset)   loss: 0.0504 -> 0.0528  accuracy: 98.32% -> 98.32%     
client [90] (testset)   loss: 0.0607 -> 0.0607  accuracy: 99.29% -> 99.29%     
client [57] (testset)   loss: 0.1370 -> 0.1392  accuracy: 97.70% -> 97.70%     
client [27] (testset)   loss: 0.0401 -> 0.0435  accuracy: 99.41% -> 99.41%     
client [78] (testset)   loss: 0.0722 -> 0.0713  accuracy: 97.58% -> 97.58%     
client [36] (testset)   loss: 0.0072 -> 0.0076  accuracy: 99.45% -> 99.45%     
client [88] (testset)   loss: 0.0297 -> 0.0304  accuracy: 98.96% -> 98.96%     
---------------------------- TRAINING EPOCH: 240 ----------------------------  
client [70] (testset)   loss: 0.0066 -> 0.0075  accuracy: 100.00% -> 99.58%    
client [35] (testset)   loss: 0.0010 -> 0.0010  accuracy: 100.00% -> 100.00%   
client [16] (testset)   loss: 0.0596 -> 0.0588  accuracy: 98.17% -> 98.17%     
client [80] (testset)   loss: 0.0577 -> 0.0573  accuracy: 98.49% -> 98.49%     
client [38] (testset)   loss: 0.0464 -> 0.0480  accuracy: 99.51% -> 99.51%     
client [78] (testset)   loss: 0.0738 -> 0.0732  accuracy: 98.18% -> 98.79%     
client [68] (testset)   loss: 0.0001 -> 0.0000  accuracy: 100.00% -> 100.00%   
client [11] (testset)   loss: 0.0376 -> 0.0359  accuracy: 98.97% -> 98.97%     
client [64] (testset)   loss: 0.0045 -> 0.0029  accuracy: 100.00% -> 100.00%   
client [82] (testset)   loss: 0.0249 -> 0.0245  accuracy: 98.97% -> 98.97%     
---------------------------- TRAINING EPOCH: 250 ----------------------------  
client [30] (testset)   loss: 0.0331 -> 0.0322  accuracy: 99.11% -> 99.11%     
client [27] (testset)   loss: 0.0434 -> 0.0469  accuracy: 99.41% -> 99.41%     
client [74] (testset)   loss: 0.0069 -> 0.0070  accuracy: 99.38% -> 99.38%     
client [45] (testset)   loss: 0.0355 -> 0.0363  accuracy: 99.23% -> 99.23%     
client [6]  (testset)   loss: 0.1451 -> 0.1605  accuracy: 97.95% -> 97.95%     
client [36] (testset)   loss: 0.0042 -> 0.0044  accuracy: 100.00% -> 100.00%   
client [63] (testset)   loss: 0.0010 -> 0.0011  accuracy: 100.00% -> 100.00%   
client [76] (testset)   loss: 0.0000 -> 0.0000  accuracy: 100.00% -> 100.00%   
client [83] (testset)   loss: 0.0628 -> 0.0673  accuracy: 98.09% -> 98.56%     
client [86] (testset)   loss: 0.0094 -> 0.0092  accuracy: 99.25% -> 99.25%     
---------------------------- TRAINING EPOCH: 260 ----------------------------  
client [83] (testset)   loss: 0.0572 -> 0.0606  accuracy: 98.09% -> 98.56%     
client [99] (testset)   loss: 0.0426 -> 0.0438  accuracy: 98.32% -> 98.32%     
client [74] (testset)   loss: 0.0060 -> 0.0064  accuracy: 99.38% -> 99.38%     
client [73] (testset)   loss: 0.1942 -> 0.1986  accuracy: 97.50% -> 97.50%     
client [29] (testset)   loss: 0.0045 -> 0.0050  accuracy: 100.00% -> 100.00%   
client [92] (testset)   loss: 0.1198 -> 0.1204  accuracy: 98.08% -> 97.60%     
client [6]  (testset)   loss: 0.1713 -> 0.1743  accuracy: 97.95% -> 97.95%     
client [61] (testset)   loss: 0.0143 -> 0.0140  accuracy: 98.89% -> 98.89%     
client [21] (testset)   loss: 0.0051 -> 0.0051  accuracy: 100.00% -> 100.00%   
client [67] (testset)   loss: 0.0662 -> 0.0600  accuracy: 99.15% -> 99.15%     
---------------------------- TRAINING EPOCH: 270 ----------------------------  
client [83] (testset)   loss: 0.0545 -> 0.0684  accuracy: 98.09% -> 98.09%     
client [32] (testset)   loss: 0.0069 -> 0.0068  accuracy: 100.00% -> 100.00%   
client [95] (testset)   loss: 0.0879 -> 0.0886  accuracy: 98.54% -> 98.54%     
client [61] (testset)   loss: 0.0255 -> 0.0224  accuracy: 98.89% -> 98.89%     
client [27] (testset)   loss: 0.0432 -> 0.0465  accuracy: 99.41% -> 99.41%     
client [25] (testset)   loss: 0.0350 -> 0.0371  accuracy: 99.05% -> 99.05%     
client [68] (testset)   loss: 0.0001 -> 0.0000  accuracy: 100.00% -> 100.00%   
client [34] (testset)   loss: 0.0243 -> 0.0266  accuracy: 98.65% -> 98.65%     
client [71] (testset)   loss: 0.1146 -> 0.1134  accuracy: 97.91% -> 98.43%     
client [89] (testset)   loss: 0.1051 -> 0.0946  accuracy: 98.23% -> 98.23%     
---------------------------- TRAINING EPOCH: 280 ----------------------------  
client [78] (testset)   loss: 0.0726 -> 0.0719  accuracy: 98.18% -> 98.18%     
client [81] (testset)   loss: 0.1352 -> 0.1366  accuracy: 98.18% -> 98.18%     
client [51] (testset)   loss: 0.0583 -> 0.0620  accuracy: 98.13% -> 98.13%     
client [54] (testset)   loss: 0.1144 -> 0.1159  accuracy: 98.31% -> 98.31%     
client [65] (testset)   loss: 0.0674 -> 0.0709  accuracy: 97.65% -> 97.06%     
client [41] (testset)   loss: 0.0283 -> 0.0311  accuracy: 98.81% -> 98.81%     
client [11] (testset)   loss: 0.0326 -> 0.0321  accuracy: 98.97% -> 98.97%     
client [85] (testset)   loss: 0.0578 -> 0.0574  accuracy: 98.59% -> 98.59%     
client [12] (testset)   loss: 0.0085 -> 0.0113  accuracy: 99.47% -> 99.47%     
client [23] (testset)   loss: 0.0609 -> 0.0607  accuracy: 98.92% -> 98.92%     
---------------------------- TRAINING EPOCH: 290 ----------------------------  
client [16] (testset)   loss: 0.0609 -> 0.0591  accuracy: 98.17% -> 98.17%     
client [65] (testset)   loss: 0.0758 -> 0.0770  accuracy: 97.65% -> 97.65%     
client [53] (testset)   loss: 0.0597 -> 0.0599  accuracy: 98.21% -> 98.21%     
client [58] (testset)   loss: 0.0183 -> 0.0189  accuracy: 98.97% -> 98.97%     
client [72] (testset)   loss: 0.0154 -> 0.0158  accuracy: 99.60% -> 99.60%     
client [7]  (testset)   loss: 0.0021 -> 0.0019  accuracy: 100.00% -> 100.00%   
client [71] (testset)   loss: 0.1048 -> 0.1047  accuracy: 97.91% -> 98.43%     
client [59] (testset)   loss: 0.0364 -> 0.0379  accuracy: 97.92% -> 97.92%     
client [86] (testset)   loss: 0.0052 -> 0.0052  accuracy: 100.00% -> 100.00%   
client [39] (testset)   loss: 0.0284 -> 0.0278  accuracy: 99.45% -> 99.45%     
---------------------------- TRAINING EPOCH: 300 ----------------------------  
client [99] (testset)   loss: 0.0405 -> 0.0430  accuracy: 98.32% -> 98.32%     
client [7]  (testset)   loss: 0.0022 -> 0.0025  accuracy: 100.00% -> 100.00%   
client [17] (testset)   loss: 0.0376 -> 0.0379  accuracy: 99.13% -> 99.13%     
client [64] (testset)   loss: 0.0022 -> 0.0022  accuracy: 100.00% -> 100.00%   
client [37] (testset)   loss: 0.0654 -> 0.0653  accuracy: 98.28% -> 98.28%     
client [29] (testset)   loss: 0.0037 -> 0.0038  accuracy: 100.00% -> 100.00%   
client [93] (testset)   loss: 0.0251 -> 0.0241  accuracy: 99.60% -> 99.60%     
client [73] (testset)   loss: 0.2011 -> 0.2018  accuracy: 97.50% -> 97.50%     
client [40] (testset)   loss: 0.0023 -> 0.0018  accuracy: 100.00% -> 100.00%   
client [76] (testset)   loss: 0.0000 -> 0.0000  accuracy: 100.00% -> 100.00%   
---------------------------- TRAINING EPOCH: 310 ----------------------------  
client [31] (testset)   loss: 0.0419 -> 0.0431  accuracy: 99.11% -> 99.11%     
client [89] (testset)   loss: 0.0913 -> 0.0914  accuracy: 98.23% -> 98.23%     
client [77] (testset)   loss: 0.0162 -> 0.0148  accuracy: 99.20% -> 99.20%     
client [90] (testset)   loss: 0.0567 -> 0.0566  accuracy: 99.29% -> 99.29%     
client [26] (testset)   loss: 0.0100 -> 0.0107  accuracy: 99.15% -> 99.15%     
client [50] (testset)   loss: 0.0375 -> 0.0362  accuracy: 99.30% -> 99.30%     
client [30] (testset)   loss: 0.0391 -> 0.0382  accuracy: 99.11% -> 99.11%     
client [70] (testset)   loss: 0.0065 -> 0.0067  accuracy: 99.58% -> 99.58%     
client [41] (testset)   loss: 0.0254 -> 0.0278  accuracy: 98.81% -> 98.81%     
client [99] (testset)   loss: 0.0448 -> 0.0465  accuracy: 98.32% -> 98.32%     
---------------------------- TRAINING EPOCH: 320 ----------------------------  
client [68] (testset)   loss: 0.0000 -> 0.0000  accuracy: 100.00% -> 100.00%   
client [70] (testset)   loss: 0.0048 -> 0.0053  accuracy: 100.00% -> 100.00%   
client [52] (testset)   loss: 0.0090 -> 0.0092  accuracy: 99.08% -> 99.08%     
client [1]  (testset)   loss: 0.0911 -> 0.0931  accuracy: 99.02% -> 99.02%     
client [2]  (testset)   loss: 0.0324 -> 0.0324  accuracy: 97.64% -> 97.64%     
client [67] (testset)   loss: 0.0702 -> 0.0685  accuracy: 98.29% -> 98.29%     
client [92] (testset)   loss: 0.1199 -> 0.1219  accuracy: 98.08% -> 98.08%     
client [35] (testset)   loss: 0.0005 -> 0.0005  accuracy: 100.00% -> 100.00%   
client [36] (testset)   loss: 0.0072 -> 0.0075  accuracy: 99.45% -> 99.45%     
client [64] (testset)   loss: 0.0024 -> 0.0025  accuracy: 100.00% -> 100.00%   
---------------------------- TRAINING EPOCH: 330 ----------------------------  
client [44] (testset)   loss: 0.2640 -> 0.2638  accuracy: 99.40% -> 99.40%     
client [6]  (testset)   loss: 0.1791 -> 0.1818  accuracy: 97.95% -> 97.95%     
client [12] (testset)   loss: 0.0101 -> 0.0124  accuracy: 99.47% -> 99.47%     
client [55] (testset)   loss: 0.0237 -> 0.0231  accuracy: 98.99% -> 98.99%     
client [29] (testset)   loss: 0.0039 -> 0.0039  accuracy: 100.00% -> 100.00%   
client [9]  (testset)   loss: 0.0091 -> 0.0091  accuracy: 100.00% -> 100.00%   
client [43] (testset)   loss: 0.0628 -> 0.0600  accuracy: 99.10% -> 99.10%     
client [77] (testset)   loss: 0.0144 -> 0.0132  accuracy: 99.20% -> 99.20%     
client [98] (testset)   loss: 0.0275 -> 0.0278  accuracy: 99.19% -> 99.19%     
client [78] (testset)   loss: 0.0738 -> 0.0733  accuracy: 98.79% -> 98.79%     
---------------------------- TRAINING EPOCH: 340 ----------------------------  
client [92] (testset)   loss: 0.1173 -> 0.1175  accuracy: 97.60% -> 97.60%     
client [80] (testset)   loss: 0.0588 -> 0.0583  accuracy: 98.49% -> 98.49%     
client [63] (testset)   loss: 0.0011 -> 0.0011  accuracy: 100.00% -> 100.00%   
client [76] (testset)   loss: 0.0000 -> 0.0000  accuracy: 100.00% -> 100.00%   
client [78] (testset)   loss: 0.0727 -> 0.0725  accuracy: 98.79% -> 98.79%     
client [25] (testset)   loss: 0.0392 -> 0.0373  accuracy: 99.05% -> 99.05%     
client [58] (testset)   loss: 0.0175 -> 0.0223  accuracy: 98.97% -> 98.97%     
client [13] (testset)   loss: 0.1275 -> 0.1285  accuracy: 97.60% -> 97.60%     
client [17] (testset)   loss: 0.0395 -> 0.0394  accuracy: 99.13% -> 99.13%     
client [38] (testset)   loss: 0.0479 -> 0.0488  accuracy: 99.51% -> 99.51%     
---------------------------- TRAINING EPOCH: 350 ----------------------------  
client [72] (testset)   loss: 0.0205 -> 0.0206  accuracy: 99.60% -> 99.60%     
client [82] (testset)   loss: 0.0204 -> 0.0204  accuracy: 98.97% -> 98.97%     
client [86] (testset)   loss: 0.0036 -> 0.0036  accuracy: 100.00% -> 100.00%   
client [51] (testset)   loss: 0.0668 -> 0.0691  accuracy: 98.13% -> 98.13%     
client [96] (testset)   loss: 0.0336 -> 0.0334  accuracy: 99.04% -> 99.04%     
client [42] (testset)   loss: 0.0461 -> 0.0461  accuracy: 99.12% -> 99.12%     
client [55] (testset)   loss: 0.0218 -> 0.0214  accuracy: 98.99% -> 98.99%     
client [13] (testset)   loss: 0.1495 -> 0.1495  accuracy: 97.60% -> 97.60%     
client [1]  (testset)   loss: 0.0953 -> 0.0942  accuracy: 99.02% -> 99.02%     
client [12] (testset)   loss: 0.0095 -> 0.0115  accuracy: 99.47% -> 99.47%     
---------------------------- TRAINING EPOCH: 360 ----------------------------  
client [68] (testset)   loss: 0.0001 -> 0.0001  accuracy: 100.00% -> 100.00%   
client [23] (testset)   loss: 0.0663 -> 0.0635  accuracy: 98.92% -> 98.92%     
client [46] (testset)   loss: 0.0002 -> 0.0002  accuracy: 100.00% -> 100.00%   
client [41] (testset)   loss: 0.0256 -> 0.0283  accuracy: 98.81% -> 98.81%     
client [25] (testset)   loss: 0.0371 -> 0.0359  accuracy: 99.05% -> 99.05%     
client [58] (testset)   loss: 0.0167 -> 0.0178  accuracy: 98.97% -> 98.97%     
client [14] (testset)   loss: 0.2298 -> 0.2302  accuracy: 96.39% -> 96.39%     
client [33] (testset)   loss: 0.0517 -> 0.0529  accuracy: 99.29% -> 99.29%     
client [85] (testset)   loss: 0.0412 -> 0.0411  accuracy: 98.59% -> 98.59%     
client [62] (testset)   loss: 0.0217 -> 0.0220  accuracy: 99.46% -> 99.46%     
---------------------------- TRAINING EPOCH: 370 ----------------------------  
client [98] (testset)   loss: 0.0227 -> 0.0230  accuracy: 99.19% -> 99.19%     
client [63] (testset)   loss: 0.0008 -> 0.0009  accuracy: 100.00% -> 100.00%   
client [70] (testset)   loss: 0.0057 -> 0.0062  accuracy: 100.00% -> 100.00%   
client [65] (testset)   loss: 0.0707 -> 0.0739  accuracy: 97.65% -> 97.65%     
client [14] (testset)   loss: 0.2281 -> 0.2291  accuracy: 96.39% -> 96.39%     
client [73] (testset)   loss: 0.2105 -> 0.2122  accuracy: 97.50% -> 97.50%     
client [34] (testset)   loss: 0.0263 -> 0.0258  accuracy: 98.65% -> 98.65%     
client [99] (testset)   loss: 0.0446 -> 0.0449  accuracy: 98.32% -> 98.32%     
client [69] (testset)   loss: 0.0051 -> 0.0052  accuracy: 100.00% -> 100.00%   
client [46] (testset)   loss: 0.0001 -> 0.0002  accuracy: 100.00% -> 100.00%   
---------------------------- TRAINING EPOCH: 380 ----------------------------  
client [99] (testset)   loss: 0.0503 -> 0.0507  accuracy: 98.32% -> 98.32%     
client [93] (testset)   loss: 0.0221 -> 0.0216  accuracy: 99.60% -> 99.60%     
client [11] (testset)   loss: 0.0476 -> 0.0475  accuracy: 98.45% -> 98.45%     
client [58] (testset)   loss: 0.0179 -> 0.0182  accuracy: 98.97% -> 98.97%     
client [81] (testset)   loss: 0.1451 -> 0.1465  accuracy: 98.18% -> 98.18%     
client [85] (testset)   loss: 0.0393 -> 0.0392  accuracy: 98.59% -> 98.59%     
client [89] (testset)   loss: 0.0813 -> 0.0823  accuracy: 98.23% -> 98.23%     
client [45] (testset)   loss: 0.0392 -> 0.0396  accuracy: 99.23% -> 99.23%     
client [8]  (testset)   loss: 0.1065 -> 0.1075  accuracy: 98.78% -> 98.78%     
client [68] (testset)   loss: 0.0000 -> 0.0000  accuracy: 100.00% -> 100.00%   
---------------------------- TRAINING EPOCH: 390 ----------------------------  
client [67] (testset)   loss: 0.0663 -> 0.0647  accuracy: 98.29% -> 98.29%     
client [72] (testset)   loss: 0.0188 -> 0.0190  accuracy: 99.60% -> 99.60%     
client [1]  (testset)   loss: 0.0942 -> 0.0951  accuracy: 99.02% -> 99.02%     
client [78] (testset)   loss: 0.0734 -> 0.0729  accuracy: 98.18% -> 98.18%     
client [83] (testset)   loss: 0.0582 -> 0.0599  accuracy: 98.56% -> 98.56%     
client [21] (testset)   loss: 0.0027 -> 0.0027  accuracy: 100.00% -> 100.00%   
client [56] (testset)   loss: 0.0007 -> 0.0008  accuracy: 100.00% -> 100.00%   
client [44] (testset)   loss: 0.2703 -> 0.2702  accuracy: 99.40% -> 99.40%     
client [92] (testset)   loss: 0.1146 -> 0.1163  accuracy: 97.60% -> 97.60%     
client [27] (testset)   loss: 0.0439 -> 0.0451  accuracy: 99.41% -> 99.41%     
---------------------------- TRAINING EPOCH: 400 ----------------------------  
client [10] (testset)   loss: 0.0705 -> 0.0704  accuracy: 99.34% -> 99.34%     
client [39] (testset)   loss: 0.0263 -> 0.0262  accuracy: 99.45% -> 99.45%     
client [65] (testset)   loss: 0.0703 -> 0.0728  accuracy: 97.65% -> 97.65%     
client [26] (testset)   loss: 0.0118 -> 0.0131  accuracy: 99.15% -> 99.15%     
client [19] (testset)   loss: 0.0004 -> 0.0004  accuracy: 100.00% -> 100.00%   
client [68] (testset)   loss: 0.0000 -> 0.0000  accuracy: 100.00% -> 100.00%   
client [41] (testset)   loss: 0.0268 -> 0.0290  accuracy: 98.81% -> 98.81%     
client [50] (testset)   loss: 0.0371 -> 0.0367  accuracy: 99.30% -> 99.30%     
client [75] (testset)   loss: 0.0093 -> 0.0104  accuracy: 99.47% -> 99.47%     
client [81] (testset)   loss: 0.1530 -> 0.1533  accuracy: 98.18% -> 98.18%     
Training... ---------------------------------------- 100% 0:17:21
FedRoD's average time taken by each global epoch: 0 min 2.59 sec.              
FedRoD's total running time: 0 h 17 m 21 s.                                    
==================== FedRoD Experiment Results: ====================           
Display format: (before local fine-tuning) -> (after local fine-tuning)        
 So if finetune_epoch = 0, x.xx% -> 0.00% is normal.                           
 Centralized testing ONLY happens after model aggregation, so the stats between
'->' are the same.                                                             
{                                                                              
    "100": {                                                                   
        "all_clients": {                                                       
            "test": {                                                          
                "loss": "0.0413 -> 0.0000",                                    
                "accuracy": "98.99% -> 0.00%"                                  
            }                                                                  
        }                                                                      
    },                                                                         
    "200": {                                                                   
        "all_clients": {                                                       
            "test": {                                                          
                "loss": "0.0455 -> 0.0000",                                    
                "accuracy": "98.97% -> 0.00%"                                  
            }                                                                  
        }                                                                      
    },                                                                         
    "300": {                                                                   
        "all_clients": {                                                       
            "test": {                                                          
                "loss": "0.0485 -> 0.0000",                                    
                "accuracy": "99.00% -> 0.00%"                                  
            }                                                                  
        }                                                                      
    },                                                                         
    "400": {                                                                   
        "all_clients": {                                                       
            "test": {                                                          
                "loss": "0.0507 -> 0.0000",                                    
                "accuracy": "98.97% -> 0.00%"                                  
            }                                                                  
        }                                                                      
    }                                                                          
}                                                                              
==================== FedRoD Max Accuracy ====================                  
all_clients:                                                                   
(test) before fine-tuning: 99.00% at epoch 300                                 
(test) after fine-tuning: 0.00% at epoch 100                                   
[0m