==================== FedRep ====================                               
Experiment Arguments:                                                          
{
│   'method': 'fedrep',
│   'dataset': {
│   │   'name': 'mnist',
│   │   'client_num': 100,
│   │   'test_ratio': 0.25,
│   │   'val_ratio': 0.0,
│   │   'seed': 42,
│   │   'split': 'sample',
│   │   'IID_ratio': 0.0,
│   │   'monitor_window_name_suffix': 'mnist-100clients-0%IID-Dir(1.0)-seed42',
│   │   'alpha': 1.0,
│   │   'min_samples_per_client': 10
│   },
│   'model': {
│   │   'name': 'avgcnn',
│   │   'use_torchvision_pretrained_weights': True,
│   │   'external_model_weights_path': None
│   },
│   'optimizer': {
│   │   'lr': 0.01,
│   │   'dampening': 0,
│   │   'weight_decay': 0,
│   │   'momentum': 0,
│   │   'nesterov': False,
│   │   'name': 'sgd'
│   },
│   'mode': 'serial',
│   'parallel': {
│   │   'ray_cluster_addr': None,
│   │   'num_cpus': None,
│   │   'num_gpus': None,
│   │   'num_workers': 2
│   },
│   'common': {
│   │   'seed': 42,
│   │   'join_ratio': 0.1,
│   │   'global_epoch': 400,
│   │   'local_epoch': 5,
│   │   'batch_size': 32,
│   │   'reset_optimizer_on_global_epoch': True,
│   │   'straggler_ratio': 0,
│   │   'straggler_min_local_epoch': 0,
│   │   'buffers': 'global',
│   │   'client_side_evaluation': True,
│   │   'test': {
│   │   │   'client': {
│   │   │   │   'interval': 100,
│   │   │   │   'finetune_epoch': 0,
│   │   │   │   'train': False,
│   │   │   │   'val': False,
│   │   │   │   'test': True
│   │   │   },
│   │   │   'server': {
│   │   │   │   'interval': -1,
│   │   │   │   'train': False,
│   │   │   │   'val': False,
│   │   │   │   'test': False,
│   │   │   │   'model_in_train_mode': False
│   │   │   }
│   │   },
│   │   'verbose_gap': 10,
│   │   'monitor': None,
│   │   'use_cuda': True,
│   │   'save_log': True,
│   │   'save_model': False,
│   │   'save_learning_curve_plot': False,
│   │   'save_metrics': True,
│   │   'delete_useless_run': True
│   },
│   'fedrep': {
│   │   'train_body_epoch': 1
│   }
}
---------------------------- TRAINING EPOCH: 10 ----------------------------   
client [77] (testset)   loss: 0.4990 -> 0.3801  accuracy: 84.74% -> 87.95%     
client [81] (testset)   loss: 0.6603 -> 0.6293  accuracy: 82.73% -> 80.91%     
client [21] (testset)   loss: 0.4682 -> 0.3558  accuracy: 88.50% -> 90.27%     
client [68] (testset)   loss: 0.2528 -> 0.2303  accuracy: 93.89% -> 94.44%     
client [93] (testset)   loss: 0.4109 -> 0.3606  accuracy: 88.89% -> 90.87%     
client [31] (testset)   loss: 1.7919 -> 0.5569  accuracy: 42.86% -> 83.93%     
client [20] (testset)   loss: 0.3612 -> 0.6206  accuracy: 89.91% -> 78.07%     
client [59] (testset)   loss: 0.4670 -> 0.3589  accuracy: 85.94% -> 89.06%     
client [48] (testset)   loss: 0.2330 -> 0.2294  accuracy: 94.33% -> 93.62%     
client [34] (testset)   loss: 0.4074 -> 0.3710  accuracy: 90.54% -> 87.16%     
---------------------------- TRAINING EPOCH: 20 ----------------------------   
client [69] (testset)   loss: 1.2780 -> 0.3098  accuracy: 72.29% -> 87.95%     
client [99] (testset)   loss: 0.3666 -> 0.3353  accuracy: 88.27% -> 90.50%     
client [67] (testset)   loss: 0.3549 -> 0.3714  accuracy: 88.89% -> 88.03%     
client [0]  (testset)   loss: 0.3041 -> 0.3882  accuracy: 90.91% -> 87.37%     
client [76] (testset)   loss: 0.0432 -> 0.0364  accuracy: 100.00% -> 100.00%   
client [41] (testset)   loss: 0.3140 -> 0.3454  accuracy: 89.88% -> 89.29%     
client [62] (testset)   loss: 0.2361 -> 0.2082  accuracy: 94.59% -> 94.05%     
client [2]  (testset)   loss: 0.1779 -> 0.1622  accuracy: 96.06% -> 95.28%     
client [14] (testset)   loss: 0.4224 -> 0.4472  accuracy: 86.75% -> 86.75%     
client [46] (testset)   loss: 0.4046 -> 0.3434  accuracy: 90.23% -> 90.23%     
---------------------------- TRAINING EPOCH: 30 ----------------------------   
client [24] (testset)   loss: 0.2207 -> 0.2307  accuracy: 90.35% -> 92.98%     
client [68] (testset)   loss: 0.1248 -> 0.1370  accuracy: 97.22% -> 96.11%     
client [57] (testset)   loss: 0.3061 -> 0.2998  accuracy: 92.17% -> 92.17%     
client [17] (testset)   loss: 0.4186 -> 0.2365  accuracy: 86.46% -> 92.14%     
client [54] (testset)   loss: 0.2191 -> 0.2754  accuracy: 94.38% -> 89.89%     
client [23] (testset)   loss: 0.2114 -> 0.1940  accuracy: 90.86% -> 94.09%     
client [35] (testset)   loss: 0.1833 -> 0.1654  accuracy: 94.61% -> 95.81%     
client [59] (testset)   loss: 0.2053 -> 0.2219  accuracy: 92.19% -> 92.71%     
client [31] (testset)   loss: 0.2078 -> 0.3093  accuracy: 93.75% -> 90.18%     
client [9]  (testset)   loss: 0.1940 -> 0.1917  accuracy: 94.39% -> 92.52%     
---------------------------- TRAINING EPOCH: 40 ----------------------------   
client [64] (testset)   loss: 0.1547 -> 0.1485  accuracy: 95.44% -> 95.44%     
client [33] (testset)   loss: 0.2371 -> 0.2223  accuracy: 92.20% -> 92.20%     
client [16] (testset)   loss: 0.1791 -> 0.1911  accuracy: 91.32% -> 91.78%     
client [44] (testset)   loss: 0.2797 -> 0.2017  accuracy: 90.36% -> 95.78%     
client [8]  (testset)   loss: 0.1759 -> 0.2440  accuracy: 95.12% -> 92.68%     
client [31] (testset)   loss: 0.1749 -> 0.1829  accuracy: 95.54% -> 95.54%     
client [47] (testset)   loss: 0.1869 -> 0.1737  accuracy: 93.93% -> 94.74%     
client [36] (testset)   loss: 0.1370 -> 0.4046  accuracy: 95.63% -> 88.52%     
client [20] (testset)   loss: 0.1931 -> 0.1625  accuracy: 94.30% -> 93.86%     
client [56] (testset)   loss: 0.2352 -> 0.2227  accuracy: 92.11% -> 93.16%     
---------------------------- TRAINING EPOCH: 50 ----------------------------   
client [4]  (testset)   loss: 0.1933 -> 0.2057  accuracy: 94.86% -> 93.71%     
client [60] (testset)   loss: 0.1949 -> 0.1735  accuracy: 93.84% -> 94.93%     
client [28] (testset)   loss: 0.1920 -> 0.1945  accuracy: 93.43% -> 91.97%     
client [25] (testset)   loss: 0.2624 -> 0.1890  accuracy: 91.47% -> 93.36%     
client [58] (testset)   loss: 0.0790 -> 0.0867  accuracy: 98.46% -> 97.95%     
client [44] (testset)   loss: 0.1993 -> 0.1893  accuracy: 96.39% -> 95.78%     
client [39] (testset)   loss: 0.1091 -> 0.1467  accuracy: 95.60% -> 93.96%     
client [29] (testset)   loss: 0.1328 -> 0.1223  accuracy: 95.65% -> 95.65%     
client [3]  (testset)   loss: 0.3796 -> 0.3830  accuracy: 90.43% -> 90.87%     
client [84] (testset)   loss: 0.1966 -> 0.1735  accuracy: 92.94% -> 94.12%     
---------------------------- TRAINING EPOCH: 60 ----------------------------   
client [21] (testset)   loss: 0.1010 -> 0.1789  accuracy: 96.46% -> 93.81%     
client [84] (testset)   loss: 0.1817 -> 0.1563  accuracy: 93.53% -> 94.71%     
client [10] (testset)   loss: 0.1389 -> 0.1004  accuracy: 96.03% -> 97.35%     
client [36] (testset)   loss: 0.1093 -> 0.1336  accuracy: 97.27% -> 96.72%     
client [65] (testset)   loss: 0.1669 -> 0.1445  accuracy: 95.29% -> 94.71%     
client [81] (testset)   loss: 0.3671 -> 0.2360  accuracy: 90.00% -> 95.45%     
client [79] (testset)   loss: 0.1227 -> 0.1556  accuracy: 96.42% -> 94.98%     
client [42] (testset)   loss: 0.2809 -> 0.2765  accuracy: 91.23% -> 89.47%     
client [11] (testset)   loss: 0.2265 -> 0.1703  accuracy: 93.81% -> 95.36%     
client [96] (testset)   loss: 0.1313 -> 0.1180  accuracy: 95.22% -> 95.69%     
---------------------------- TRAINING EPOCH: 70 ----------------------------   
client [8]  (testset)   loss: 0.1697 -> 0.1963  accuracy: 94.51% -> 93.90%     
client [53] (testset)   loss: 0.1324 -> 0.1461  accuracy: 95.54% -> 95.54%     
client [52] (testset)   loss: 0.2254 -> 0.1711  accuracy: 94.50% -> 95.41%     
client [42] (testset)   loss: 0.2395 -> 0.2322  accuracy: 91.23% -> 91.23%     
client [69] (testset)   loss: 0.1374 -> 0.1485  accuracy: 93.37% -> 93.98%     
client [59] (testset)   loss: 0.1780 -> 0.1796  accuracy: 93.75% -> 94.79%     
client [7]  (testset)   loss: 0.1266 -> 0.1088  accuracy: 95.83% -> 95.83%     
client [26] (testset)   loss: 0.2602 -> 0.1340  accuracy: 92.37% -> 96.61%     
client [49] (testset)   loss: 0.0612 -> 0.0444  accuracy: 97.53% -> 98.15%     
client [98] (testset)   loss: 0.2412 -> 0.2788  accuracy: 91.87% -> 91.06%     
---------------------------- TRAINING EPOCH: 80 ----------------------------   
client [98] (testset)   loss: 0.2966 -> 0.2564  accuracy: 87.80% -> 92.68%     
client [47] (testset)   loss: 0.2101 -> 0.1267  accuracy: 93.93% -> 96.36%     
client [21] (testset)   loss: 0.1405 -> 0.1223  accuracy: 93.81% -> 95.58%     
client [77] (testset)   loss: 0.1318 -> 0.1810  accuracy: 95.98% -> 93.17%     
client [95] (testset)   loss: 0.1487 -> 0.3396  accuracy: 96.10% -> 89.27%     
client [91] (testset)   loss: 0.1668 -> 0.1606  accuracy: 96.00% -> 96.00%     
client [14] (testset)   loss: 0.3287 -> 0.3503  accuracy: 91.57% -> 90.36%     
client [99] (testset)   loss: 0.2654 -> 0.2710  accuracy: 92.18% -> 90.50%     
client [20] (testset)   loss: 0.1119 -> 0.1254  accuracy: 95.18% -> 96.49%     
client [39] (testset)   loss: 0.1078 -> 0.1031  accuracy: 96.15% -> 96.70%     
---------------------------- TRAINING EPOCH: 90 ----------------------------   
client [52] (testset)   loss: 0.1577 -> 0.1532  accuracy: 97.25% -> 97.25%     
client [62] (testset)   loss: 0.0629 -> 0.0642  accuracy: 97.84% -> 98.92%     
client [71] (testset)   loss: 0.1613 -> 0.1862  accuracy: 94.76% -> 93.19%     
client [97] (testset)   loss: 0.1827 -> 0.1749  accuracy: 96.64% -> 95.97%     
client [30] (testset)   loss: 0.1498 -> 0.1536  accuracy: 96.00% -> 95.56%     
client [88] (testset)   loss: 0.1299 -> 0.2182  accuracy: 97.58% -> 94.81%     
client [60] (testset)   loss: 0.1784 -> 0.1388  accuracy: 95.29% -> 95.65%     
client [82] (testset)   loss: 0.1132 -> 0.1123  accuracy: 96.91% -> 96.91%     
client [91] (testset)   loss: 0.1688 -> 0.1529  accuracy: 96.00% -> 96.00%     
client [57] (testset)   loss: 0.2074 -> 0.2297  accuracy: 94.01% -> 94.01%     
---------------------------- TRAINING EPOCH: 100 ----------------------------  
client [31] (testset)   loss: 0.1008 -> 0.1277  accuracy: 97.32% -> 96.43%     
client [15] (testset)   loss: 0.1365 -> 0.1079  accuracy: 96.06% -> 98.03%     
client [71] (testset)   loss: 0.2035 -> 0.1633  accuracy: 91.62% -> 93.72%     
client [97] (testset)   loss: 0.1855 -> 0.1753  accuracy: 95.30% -> 95.97%     
client [53] (testset)   loss: 0.1367 -> 0.1613  accuracy: 96.43% -> 94.64%     
client [77] (testset)   loss: 0.1179 -> 0.1124  accuracy: 96.79% -> 96.79%     
client [76] (testset)   loss: 0.0086 -> 0.0095  accuracy: 100.00% -> 100.00%   
client [79] (testset)   loss: 0.0984 -> 0.1031  accuracy: 96.77% -> 95.34%     
client [28] (testset)   loss: 0.1063 -> 0.1324  accuracy: 94.89% -> 94.89%     
client [99] (testset)   loss: 0.2539 -> 0.2604  accuracy: 92.18% -> 92.18%     
---------------------------- TRAINING EPOCH: 110 ----------------------------  
client [97] (testset)   loss: 0.1679 -> 0.2347  accuracy: 97.32% -> 95.97%     
client [86] (testset)   loss: 0.0482 -> 0.0473  accuracy: 98.51% -> 98.51%     
client [34] (testset)   loss: 0.0906 -> 0.1266  accuracy: 97.30% -> 94.59%     
client [73] (testset)   loss: 0.2616 -> 0.2610  accuracy: 94.58% -> 95.42%     
client [5]  (testset)   loss: 0.1554 -> 0.1747  accuracy: 95.68% -> 93.83%     
client [96] (testset)   loss: 0.1116 -> 0.1213  accuracy: 96.65% -> 96.17%     
client [22] (testset)   loss: 0.0642 -> 0.0731  accuracy: 98.17% -> 97.72%     
client [60] (testset)   loss: 0.1490 -> 0.1211  accuracy: 95.29% -> 95.65%     
client [66] (testset)   loss: 0.1343 -> 0.1450  accuracy: 95.88% -> 95.88%     
client [83] (testset)   loss: 0.1543 -> 0.1444  accuracy: 95.22% -> 94.26%     
---------------------------- TRAINING EPOCH: 120 ----------------------------  
client [76] (testset)   loss: 0.0086 -> 0.0087  accuracy: 100.00% -> 100.00%   
client [65] (testset)   loss: 0.1403 -> 0.1619  accuracy: 95.29% -> 94.71%     
client [95] (testset)   loss: 0.1470 -> 0.1389  accuracy: 96.59% -> 97.07%     
client [17] (testset)   loss: 0.1229 -> 0.1171  accuracy: 96.07% -> 95.20%     
client [8]  (testset)   loss: 0.1596 -> 0.1252  accuracy: 95.73% -> 96.34%     
client [35] (testset)   loss: 0.0392 -> 0.0354  accuracy: 98.80% -> 98.80%     
client [98] (testset)   loss: 0.2440 -> 0.2672  accuracy: 92.68% -> 91.06%     
client [53] (testset)   loss: 0.1212 -> 0.1229  accuracy: 96.43% -> 96.43%     
client [43] (testset)   loss: 0.1693 -> 0.1953  accuracy: 95.50% -> 95.50%     
client [64] (testset)   loss: 0.0838 -> 0.1099  accuracy: 97.10% -> 96.27%     
---------------------------- TRAINING EPOCH: 130 ----------------------------  
client [21] (testset)   loss: 0.0769 -> 0.0820  accuracy: 95.58% -> 94.69%     
client [88] (testset)   loss: 0.1396 -> 0.1939  accuracy: 97.23% -> 94.46%     
client [38] (testset)   loss: 0.3946 -> 0.1290  accuracy: 86.70% -> 96.06%     
client [3]  (testset)   loss: 0.3502 -> 0.2942  accuracy: 92.61% -> 93.48%     
client [5]  (testset)   loss: 0.1769 -> 0.1755  accuracy: 94.44% -> 95.06%     
client [41] (testset)   loss: 0.1225 -> 0.1147  accuracy: 95.24% -> 97.02%     
client [7]  (testset)   loss: 0.0899 -> 0.1039  accuracy: 97.02% -> 96.43%     
client [37] (testset)   loss: 0.1070 -> 0.1033  accuracy: 97.00% -> 97.00%     
client [45] (testset)   loss: 0.1422 -> 0.0863  accuracy: 96.55% -> 98.08%     
client [47] (testset)   loss: 0.1410 -> 0.1406  accuracy: 96.76% -> 96.76%     
---------------------------- TRAINING EPOCH: 140 ----------------------------  
client [16] (testset)   loss: 0.1101 -> 0.0947  accuracy: 96.35% -> 96.35%     
client [11] (testset)   loss: 0.1012 -> 0.1108  accuracy: 97.42% -> 97.42%     
client [37] (testset)   loss: 0.1002 -> 0.0874  accuracy: 97.85% -> 97.42%     
client [41] (testset)   loss: 0.0991 -> 0.1121  accuracy: 96.43% -> 96.43%     
client [95] (testset)   loss: 0.1303 -> 0.2959  accuracy: 97.07% -> 90.73%     
client [53] (testset)   loss: 0.1138 -> 0.1190  accuracy: 96.43% -> 96.43%     
client [22] (testset)   loss: 0.0589 -> 0.0543  accuracy: 98.17% -> 98.63%     
client [25] (testset)   loss: 0.1211 -> 0.1179  accuracy: 96.21% -> 96.68%     
client [69] (testset)   loss: 0.1492 -> 0.1041  accuracy: 94.58% -> 95.78%     
client [46] (testset)   loss: 0.1082 -> 0.1087  accuracy: 96.24% -> 96.24%     
---------------------------- TRAINING EPOCH: 150 ----------------------------  
client [47] (testset)   loss: 0.1398 -> 0.1246  accuracy: 96.76% -> 96.76%     
client [69] (testset)   loss: 0.1025 -> 0.1049  accuracy: 96.39% -> 95.78%     
client [82] (testset)   loss: 0.1038 -> 0.5972  accuracy: 97.94% -> 88.66%     
client [45] (testset)   loss: 0.1081 -> 0.1156  accuracy: 97.70% -> 96.93%     
client [7]  (testset)   loss: 0.1158 -> 0.0779  accuracy: 95.24% -> 96.43%     
client [50] (testset)   loss: 0.1184 -> 0.1448  accuracy: 96.13% -> 96.48%     
client [35] (testset)   loss: 0.0319 -> 0.0318  accuracy: 98.80% -> 98.80%     
client [24] (testset)   loss: 0.1230 -> 0.1153  accuracy: 95.61% -> 95.61%     
client [15] (testset)   loss: 0.0987 -> 0.1050  accuracy: 98.03% -> 97.04%     
client [58] (testset)   loss: 0.0498 -> 0.0530  accuracy: 97.95% -> 97.44%     
---------------------------- TRAINING EPOCH: 160 ----------------------------  
client [48] (testset)   loss: 0.0747 -> 0.0745  accuracy: 97.16% -> 97.16%     
client [76] (testset)   loss: 0.0064 -> 0.0063  accuracy: 100.00% -> 100.00%   
client [67] (testset)   loss: 0.2060 -> 0.2248  accuracy: 94.87% -> 93.16%     
client [37] (testset)   loss: 0.0973 -> 0.1163  accuracy: 97.00% -> 97.42%     
client [58] (testset)   loss: 0.0577 -> 0.0559  accuracy: 97.44% -> 97.44%     
client [64] (testset)   loss: 0.0814 -> 0.0824  accuracy: 97.10% -> 97.10%     
client [77] (testset)   loss: 0.1173 -> 0.1294  accuracy: 95.98% -> 97.19%     
client [55] (testset)   loss: 0.2063 -> 0.2160  accuracy: 94.95% -> 91.92%     
client [12] (testset)   loss: 0.0814 -> 0.1176  accuracy: 96.83% -> 95.77%     
client [89] (testset)   loss: 0.1689 -> 0.1643  accuracy: 94.69% -> 94.69%     
---------------------------- TRAINING EPOCH: 170 ----------------------------  
client [84] (testset)   loss: 0.1079 -> 0.0838  accuracy: 96.47% -> 96.47%     
client [51] (testset)   loss: 0.2472 -> 0.2499  accuracy: 94.86% -> 95.33%     
client [8]  (testset)   loss: 0.1226 -> 0.1280  accuracy: 95.73% -> 96.34%     
client [18] (testset)   loss: 0.1095 -> 0.0544  accuracy: 95.31% -> 96.88%     
client [94] (testset)   loss: 0.0909 -> 0.0833  accuracy: 98.06% -> 98.06%     
client [81] (testset)   loss: 0.2472 -> 0.2423  accuracy: 96.36% -> 96.36%     
client [3]  (testset)   loss: 0.2967 -> 0.2791  accuracy: 93.91% -> 93.91%     
client [11] (testset)   loss: 0.0929 -> 0.1098  accuracy: 97.94% -> 97.42%     
client [95] (testset)   loss: 0.1370 -> 0.1363  accuracy: 97.07% -> 97.07%     
client [67] (testset)   loss: 0.2114 -> 0.2193  accuracy: 93.16% -> 94.02%     
---------------------------- TRAINING EPOCH: 180 ----------------------------  
client [21] (testset)   loss: 0.0513 -> 0.0769  accuracy: 98.23% -> 95.58%     
client [79] (testset)   loss: 0.0699 -> 0.0773  accuracy: 97.49% -> 97.13%     
client [58] (testset)   loss: 0.0544 -> 0.0652  accuracy: 97.44% -> 97.44%     
client [88] (testset)   loss: 0.1415 -> 0.1358  accuracy: 96.54% -> 96.54%     
client [46] (testset)   loss: 0.1043 -> 0.1025  accuracy: 95.49% -> 95.49%     
client [11] (testset)   loss: 0.0816 -> 0.0988  accuracy: 97.42% -> 97.94%     
client [55] (testset)   loss: 0.1967 -> 0.1965  accuracy: 93.94% -> 93.94%     
client [13] (testset)   loss: 0.2101 -> 0.1968  accuracy: 96.00% -> 96.00%     
client [31] (testset)   loss: 0.1433 -> 0.1070  accuracy: 97.32% -> 98.21%     
client [75] (testset)   loss: 0.0432 -> 0.0502  accuracy: 98.94% -> 98.40%     
---------------------------- TRAINING EPOCH: 190 ----------------------------  
client [19] (testset)   loss: 0.0577 -> 0.0471  accuracy: 97.65% -> 98.82%     
client [7]  (testset)   loss: 0.1038 -> 0.0875  accuracy: 95.24% -> 97.02%     
client [57] (testset)   loss: 0.1993 -> 0.2501  accuracy: 94.01% -> 93.55%     
client [13] (testset)   loss: 0.1829 -> 0.1870  accuracy: 96.00% -> 96.80%     
client [43] (testset)   loss: 0.1732 -> 0.1739  accuracy: 95.50% -> 95.50%     
client [91] (testset)   loss: 0.1476 -> 0.1490  accuracy: 97.00% -> 96.00%     
client [10] (testset)   loss: 0.1016 -> 0.0975  accuracy: 96.69% -> 96.69%     
client [64] (testset)   loss: 0.0839 -> 0.0947  accuracy: 95.85% -> 95.85%     
client [82] (testset)   loss: 0.1019 -> 0.1065  accuracy: 97.94% -> 97.94%     
client [22] (testset)   loss: 0.0641 -> 0.0729  accuracy: 97.26% -> 97.72%     
---------------------------- TRAINING EPOCH: 200 ----------------------------  
client [20] (testset)   loss: 0.0987 -> 0.1074  accuracy: 97.81% -> 97.37%     
client [23] (testset)   loss: 0.1172 -> 0.1238  accuracy: 96.77% -> 96.77%     
client [88] (testset)   loss: 0.1347 -> 0.1425  accuracy: 96.89% -> 96.89%     
client [98] (testset)   loss: 0.2465 -> 0.2547  accuracy: 91.87% -> 91.87%     
client [79] (testset)   loss: 0.0700 -> 0.0675  accuracy: 97.49% -> 97.49%     
client [21] (testset)   loss: 0.0594 -> 0.0764  accuracy: 97.35% -> 95.58%     
client [92] (testset)   loss: 0.2456 -> 0.2174  accuracy: 94.23% -> 94.23%     
client [56] (testset)   loss: 0.1547 -> 0.1625  accuracy: 95.26% -> 95.79%     
client [5]  (testset)   loss: 0.1535 -> 0.1504  accuracy: 94.44% -> 95.06%     
client [52] (testset)   loss: 0.1882 -> 0.1992  accuracy: 96.33% -> 96.33%     
---------------------------- TRAINING EPOCH: 210 ----------------------------  
client [67] (testset)   loss: 0.2168 -> 0.2316  accuracy: 94.87% -> 93.16%     
client [54] (testset)   loss: 0.1788 -> 0.1870  accuracy: 94.94% -> 94.38%     
client [14] (testset)   loss: 0.3985 -> 0.4086  accuracy: 90.36% -> 90.36%     
client [99] (testset)   loss: 0.3379 -> 0.2871  accuracy: 91.62% -> 92.74%     
client [36] (testset)   loss: 0.1079 -> 0.1092  accuracy: 97.27% -> 97.27%     
client [30] (testset)   loss: 0.1370 -> 0.1603  accuracy: 95.56% -> 96.00%     
client [38] (testset)   loss: 0.1187 -> 0.1192  accuracy: 96.06% -> 95.57%     
client [15] (testset)   loss: 0.1005 -> 0.0979  accuracy: 98.03% -> 98.03%     
client [6]  (testset)   loss: 0.3171 -> 0.3278  accuracy: 94.52% -> 93.15%     
client [53] (testset)   loss: 0.1333 -> 0.1373  accuracy: 96.43% -> 96.43%     
---------------------------- TRAINING EPOCH: 220 ----------------------------  
client [99] (testset)   loss: 0.2975 -> 0.3038  accuracy: 92.74% -> 92.74%     
client [6]  (testset)   loss: 0.3314 -> 0.3354  accuracy: 94.52% -> 93.84%     
client [83] (testset)   loss: 0.1401 -> 0.1350  accuracy: 94.26% -> 95.22%     
client [42] (testset)   loss: 0.2226 -> 0.2271  accuracy: 92.11% -> 92.98%     
client [34] (testset)   loss: 0.1099 -> 0.1010  accuracy: 97.30% -> 97.30%     
client [15] (testset)   loss: 0.0995 -> 0.0986  accuracy: 96.55% -> 97.54%     
client [47] (testset)   loss: 0.1683 -> 0.1407  accuracy: 95.95% -> 96.36%     
client [55] (testset)   loss: 0.2314 -> 0.2112  accuracy: 91.92% -> 92.93%     
client [51] (testset)   loss: 0.3064 -> 3.2983  accuracy: 94.86% -> 70.09%     
client [95] (testset)   loss: 0.1588 -> 0.1556  accuracy: 97.07% -> 97.07%     
---------------------------- TRAINING EPOCH: 230 ----------------------------  
client [71] (testset)   loss: 0.1911 -> 0.1587  accuracy: 94.76% -> 96.34%     
client [15] (testset)   loss: 0.1282 -> 0.0981  accuracy: 95.57% -> 98.03%     
client [33] (testset)   loss: 0.1820 -> 0.2200  accuracy: 97.16% -> 96.45%     
client [99] (testset)   loss: 0.2925 -> 0.2895  accuracy: 92.74% -> 92.18%     
client [90] (testset)   loss: 0.1656 -> 0.1514  accuracy: 97.16% -> 97.16%     
client [57] (testset)   loss: 0.1997 -> 0.1989  accuracy: 94.93% -> 94.47%     
client [27] (testset)   loss: 0.1007 -> 0.0826  accuracy: 97.65% -> 97.65%     
client [78] (testset)   loss: 0.1395 -> 0.1335  accuracy: 95.76% -> 95.76%     
client [36] (testset)   loss: 0.1235 -> 0.1099  accuracy: 97.27% -> 97.81%     
client [88] (testset)   loss: 0.1498 -> 0.1469  accuracy: 96.89% -> 96.89%     
---------------------------- TRAINING EPOCH: 240 ----------------------------  
client [70] (testset)   loss: 0.0618 -> 0.0531  accuracy: 97.50% -> 97.50%     
client [35] (testset)   loss: 0.0325 -> 0.0286  accuracy: 98.80% -> 98.80%     
client [16] (testset)   loss: 0.0950 -> 0.0950  accuracy: 96.35% -> 96.35%     
client [80] (testset)   loss: 0.1640 -> 0.1704  accuracy: 95.09% -> 95.85%     
client [38] (testset)   loss: 0.1093 -> 0.1045  accuracy: 96.06% -> 96.55%     
client [78] (testset)   loss: 0.1337 -> 0.1370  accuracy: 95.76% -> 95.76%     
client [68] (testset)   loss: 0.0779 -> 0.0621  accuracy: 96.67% -> 98.33%     
client [11] (testset)   loss: 0.1067 -> 0.1045  accuracy: 97.94% -> 97.94%     
client [64] (testset)   loss: 0.0866 -> 0.0928  accuracy: 96.27% -> 96.27%     
client [82] (testset)   loss: 0.0999 -> 0.0943  accuracy: 97.94% -> 98.97%     
---------------------------- TRAINING EPOCH: 250 ----------------------------  
client [30] (testset)   loss: 0.1556 -> 0.1593  accuracy: 96.44% -> 96.44%     
client [27] (testset)   loss: 0.0747 -> 0.0738  accuracy: 97.06% -> 96.47%     
client [74] (testset)   loss: 0.1235 -> 0.1389  accuracy: 96.88% -> 96.25%     
client [45] (testset)   loss: 0.0949 -> 0.1093  accuracy: 98.08% -> 97.70%     
client [6]  (testset)   loss: 0.3096 -> 0.3298  accuracy: 95.21% -> 93.84%     
client [36] (testset)   loss: 0.1141 -> 0.1138  accuracy: 97.81% -> 98.36%     
client [63] (testset)   loss: 0.0242 -> 0.0240  accuracy: 98.70% -> 99.35%     
client [76] (testset)   loss: 0.0048 -> 0.0045  accuracy: 100.00% -> 100.00%   
client [83] (testset)   loss: 0.1447 -> 0.1557  accuracy: 95.69% -> 93.78%     
client [86] (testset)   loss: 0.0303 -> 0.0268  accuracy: 98.51% -> 98.51%     
---------------------------- TRAINING EPOCH: 260 ----------------------------  
client [83] (testset)   loss: 0.1490 -> 0.1352  accuracy: 95.22% -> 94.74%     
client [99] (testset)   loss: 0.3113 -> 0.3108  accuracy: 92.74% -> 93.30%     
client [74] (testset)   loss: 0.1342 -> 0.1150  accuracy: 95.00% -> 97.50%     
client [73] (testset)   loss: 0.3128 -> 0.3218  accuracy: 94.58% -> 94.17%     
client [29] (testset)   loss: 0.0931 -> 0.1038  accuracy: 97.39% -> 97.39%     
client [92] (testset)   loss: 0.2225 -> 0.2333  accuracy: 94.71% -> 94.23%     
client [6]  (testset)   loss: 0.3053 -> 0.3228  accuracy: 95.21% -> 95.21%     
client [61] (testset)   loss: 0.0637 -> 0.0656  accuracy: 97.78% -> 97.78%     
client [21] (testset)   loss: 0.0822 -> 0.0816  accuracy: 96.46% -> 97.35%     
client [67] (testset)   loss: 0.2709 -> 0.2470  accuracy: 93.16% -> 94.02%     
---------------------------- TRAINING EPOCH: 270 ----------------------------  
client [83] (testset)   loss: 0.1577 -> 0.1649  accuracy: 94.26% -> 94.26%     
client [32] (testset)   loss: 0.0792 -> 0.0651  accuracy: 97.40% -> 97.40%     
client [95] (testset)   loss: 0.1599 -> 0.1565  accuracy: 97.07% -> 97.07%     
client [61] (testset)   loss: 0.0675 -> 0.0663  accuracy: 97.78% -> 97.78%     
client [27] (testset)   loss: 0.1046 -> 0.0767  accuracy: 95.29% -> 97.65%     
client [25] (testset)   loss: 0.1154 -> 0.1322  accuracy: 96.21% -> 96.68%     
client [68] (testset)   loss: 0.0499 -> 0.0538  accuracy: 98.89% -> 98.33%     
client [34] (testset)   loss: 0.1023 -> 0.0991  accuracy: 97.30% -> 97.30%     
client [71] (testset)   loss: 0.1569 -> 0.1624  accuracy: 96.34% -> 95.81%     
client [89] (testset)   loss: 0.2017 -> 0.1701  accuracy: 93.81% -> 94.69%     
---------------------------- TRAINING EPOCH: 280 ----------------------------  
client [78] (testset)   loss: 0.1318 -> 0.1313  accuracy: 96.36% -> 96.36%     
client [81] (testset)   loss: 0.2825 -> 0.2778  accuracy: 96.36% -> 96.36%     
client [51] (testset)   loss: 0.2816 -> 0.2535  accuracy: 95.33% -> 95.79%     
client [54] (testset)   loss: 0.1858 -> 0.1903  accuracy: 95.51% -> 95.51%     
client [65] (testset)   loss: 0.1780 -> 0.1891  accuracy: 94.12% -> 94.71%     
client [41] (testset)   loss: 0.0963 -> 0.0902  accuracy: 96.43% -> 98.21%     
client [11] (testset)   loss: 0.1030 -> 0.1053  accuracy: 97.94% -> 97.94%     
client [85] (testset)   loss: 0.3579 -> 0.3509  accuracy: 94.37% -> 94.37%     
client [12] (testset)   loss: 0.0794 -> 0.0812  accuracy: 96.83% -> 97.35%     
client [23] (testset)   loss: 0.1313 -> 0.1308  accuracy: 96.77% -> 96.24%     
---------------------------- TRAINING EPOCH: 290 ----------------------------  
client [16] (testset)   loss: 0.1191 -> 0.1042  accuracy: 95.43% -> 96.35%     
client [65] (testset)   loss: 0.1926 -> 0.1906  accuracy: 94.71% -> 94.71%     
client [53] (testset)   loss: 0.1428 -> 0.1399  accuracy: 96.43% -> 96.43%     
client [58] (testset)   loss: 0.0512 -> 0.0526  accuracy: 97.44% -> 97.44%     
client [72] (testset)   loss: 0.0648 -> 0.0663  accuracy: 97.60% -> 97.60%     
client [7]  (testset)   loss: 0.1116 -> 0.0980  accuracy: 96.43% -> 97.02%     
client [71] (testset)   loss: 0.1557 -> 0.1563  accuracy: 95.29% -> 96.86%     
client [59] (testset)   loss: 0.2095 -> 0.2037  accuracy: 93.75% -> 93.75%     
client [86] (testset)   loss: 0.0293 -> 0.0254  accuracy: 98.51% -> 98.51%     
client [39] (testset)   loss: 0.0807 -> 0.0840  accuracy: 96.15% -> 96.70%     
---------------------------- TRAINING EPOCH: 300 ----------------------------  
client [99] (testset)   loss: 0.3463 -> 0.3103  accuracy: 92.18% -> 92.18%     
client [7]  (testset)   loss: 0.1069 -> 0.1138  accuracy: 97.02% -> 95.83%     
client [17] (testset)   loss: 0.1432 -> 0.1435  accuracy: 94.76% -> 94.76%     
client [64] (testset)   loss: 0.0934 -> 0.0976  accuracy: 95.85% -> 96.27%     
client [37] (testset)   loss: 0.1085 -> 0.1154  accuracy: 97.42% -> 97.42%     
client [29] (testset)   loss: 0.1149 -> 0.1152  accuracy: 97.39% -> 97.39%     
client [93] (testset)   loss: 0.1057 -> 0.0964  accuracy: 96.83% -> 97.22%     
client [73] (testset)   loss: 0.3389 -> 0.3309  accuracy: 94.17% -> 94.58%     
client [40] (testset)   loss: 0.0541 -> 0.0484  accuracy: 98.40% -> 98.40%     
client [76] (testset)   loss: 0.0108 -> 0.0089  accuracy: 100.00% -> 100.00%   
---------------------------- TRAINING EPOCH: 310 ----------------------------  
client [31] (testset)   loss: 0.1260 -> 0.1249  accuracy: 98.21% -> 98.21%     
client [89] (testset)   loss: 0.1586 -> 0.1631  accuracy: 95.58% -> 95.58%     
client [77] (testset)   loss: 0.1327 -> 0.1425  accuracy: 97.59% -> 97.19%     
client [90] (testset)   loss: 0.1651 -> 0.1594  accuracy: 97.16% -> 97.16%     
client [26] (testset)   loss: 0.1007 -> 0.0944  accuracy: 98.31% -> 97.46%     
client [50] (testset)   loss: 0.1348 -> 0.1355  accuracy: 96.83% -> 96.48%     
client [30] (testset)   loss: 0.1669 -> 0.1696  accuracy: 96.44% -> 96.44%     
client [70] (testset)   loss: 0.0490 -> 0.0846  accuracy: 97.92% -> 97.08%     
client [41] (testset)   loss: 0.0932 -> 0.0953  accuracy: 97.62% -> 97.62%     
client [99] (testset)   loss: 0.3169 -> 0.3215  accuracy: 92.74% -> 92.18%     
---------------------------- TRAINING EPOCH: 320 ----------------------------  
client [68] (testset)   loss: 0.0599 -> 0.0585  accuracy: 98.89% -> 98.33%     
client [70] (testset)   loss: 0.0440 -> 0.0499  accuracy: 97.92% -> 97.92%     
client [52] (testset)   loss: 0.2272 -> 0.2224  accuracy: 96.33% -> 95.41%     
client [1]  (testset)   loss: 0.2407 -> 0.2419  accuracy: 93.66% -> 93.66%     
client [2]  (testset)   loss: 0.0977 -> 0.0984  accuracy: 96.06% -> 96.06%     
client [67] (testset)   loss: 0.2710 -> 0.2679  accuracy: 92.31% -> 93.16%     
client [92] (testset)   loss: 0.2214 -> 0.2484  accuracy: 95.67% -> 95.19%     
client [35] (testset)   loss: 0.0248 -> 0.0293  accuracy: 99.40% -> 98.80%     
client [36] (testset)   loss: 0.1173 -> 0.1236  accuracy: 97.81% -> 97.81%     
client [64] (testset)   loss: 0.0939 -> 0.0931  accuracy: 95.85% -> 96.27%     
---------------------------- TRAINING EPOCH: 330 ----------------------------  
client [44] (testset)   loss: 0.1761 -> 0.1759  accuracy: 97.59% -> 97.59%     
client [6]  (testset)   loss: 0.3290 -> 0.3311  accuracy: 95.89% -> 95.89%     
client [12] (testset)   loss: 0.0913 -> 0.0936  accuracy: 96.83% -> 97.35%     
client [55] (testset)   loss: 0.2292 -> 0.2252  accuracy: 90.91% -> 90.91%     
client [29] (testset)   loss: 0.1156 -> 0.1155  accuracy: 97.39% -> 97.39%     
client [9]  (testset)   loss: 0.1128 -> 0.1174  accuracy: 96.26% -> 96.26%     
client [43] (testset)   loss: 0.1755 -> 0.1863  accuracy: 95.50% -> 95.50%     
client [77] (testset)   loss: 0.1340 -> 0.1316  accuracy: 97.59% -> 97.19%     
client [98] (testset)   loss: 0.2895 -> 0.2782  accuracy: 92.68% -> 91.87%     
client [78] (testset)   loss: 0.1425 -> 0.1336  accuracy: 96.36% -> 96.36%     
---------------------------- TRAINING EPOCH: 340 ----------------------------  
client [92] (testset)   loss: 0.2430 -> 0.2443  accuracy: 95.19% -> 94.71%     
client [80] (testset)   loss: 0.1694 -> 0.1828  accuracy: 95.85% -> 95.85%     
client [63] (testset)   loss: 0.0227 -> 0.0190  accuracy: 99.35% -> 99.35%     
client [76] (testset)   loss: 0.0038 -> 0.0037  accuracy: 100.00% -> 100.00%   
client [78] (testset)   loss: 0.1380 -> 0.1430  accuracy: 96.36% -> 96.36%     
client [25] (testset)   loss: 0.1413 -> 0.1251  accuracy: 96.21% -> 97.16%     
client [58] (testset)   loss: 0.0540 -> 0.0530  accuracy: 97.44% -> 97.44%     
client [13] (testset)   loss: 0.2317 -> 0.2355  accuracy: 96.00% -> 96.00%     
client [17] (testset)   loss: 0.1513 -> 0.1489  accuracy: 94.76% -> 94.76%     
client [38] (testset)   loss: 0.1121 -> 0.1239  accuracy: 96.55% -> 96.06%     
---------------------------- TRAINING EPOCH: 350 ----------------------------  
client [72] (testset)   loss: 0.0684 -> 0.0724  accuracy: 97.60% -> 97.60%     
client [82] (testset)   loss: 0.0999 -> 0.1012  accuracy: 98.97% -> 98.97%     
client [86] (testset)   loss: 0.0239 -> 0.0247  accuracy: 98.51% -> 98.51%     
client [51] (testset)   loss: 0.2619 -> 0.2626  accuracy: 95.79% -> 95.79%     
client [96] (testset)   loss: 0.1391 -> 0.1398  accuracy: 97.61% -> 97.61%     
client [42] (testset)   loss: 0.2333 -> 0.2325  accuracy: 93.86% -> 93.86%     
client [55] (testset)   loss: 0.2216 -> 0.2191  accuracy: 91.92% -> 91.92%     
client [13] (testset)   loss: 0.2249 -> 0.2286  accuracy: 96.00% -> 96.00%     
client [1]  (testset)   loss: 0.2394 -> 0.2539  accuracy: 92.20% -> 93.66%     
client [12] (testset)   loss: 0.0820 -> 0.0836  accuracy: 97.88% -> 96.83%     
---------------------------- TRAINING EPOCH: 360 ----------------------------  
client [68] (testset)   loss: 0.0593 -> 0.0581  accuracy: 98.33% -> 98.33%     
client [23] (testset)   loss: 0.1321 -> 0.1315  accuracy: 96.24% -> 96.24%     
client [46] (testset)   loss: 0.1176 -> 0.1190  accuracy: 95.49% -> 96.24%     
client [41] (testset)   loss: 0.1039 -> 0.0958  accuracy: 97.02% -> 97.62%     
client [25] (testset)   loss: 0.1303 -> 0.1302  accuracy: 96.68% -> 97.16%     
client [58] (testset)   loss: 0.0523 -> 0.0527  accuracy: 97.44% -> 97.44%     
client [14] (testset)   loss: 0.4522 -> 0.4535  accuracy: 90.36% -> 90.36%     
client [33] (testset)   loss: 0.2388 -> 0.2404  accuracy: 96.45% -> 96.45%     
client [85] (testset)   loss: 0.4108 -> 0.3982  accuracy: 91.55% -> 91.55%     
client [62] (testset)   loss: 0.0540 -> 0.0546  accuracy: 98.92% -> 98.92%     
---------------------------- TRAINING EPOCH: 370 ----------------------------  
client [98] (testset)   loss: 0.2764 -> 0.2788  accuracy: 92.68% -> 91.87%     
client [63] (testset)   loss: 0.0209 -> 0.0208  accuracy: 99.35% -> 99.35%     
client [70] (testset)   loss: 0.0501 -> 0.1023  accuracy: 97.50% -> 96.67%     
client [65] (testset)   loss: 0.1939 -> 0.1947  accuracy: 94.71% -> 94.71%     
client [14] (testset)   loss: 0.4574 -> 0.4598  accuracy: 90.36% -> 90.36%     
client [73] (testset)   loss: 0.3393 -> 0.3439  accuracy: 94.17% -> 94.58%     
client [34] (testset)   loss: 0.0989 -> 0.0994  accuracy: 97.30% -> 97.30%     
client [99] (testset)   loss: 0.3284 -> 0.3230  accuracy: 92.74% -> 92.18%     
client [69] (testset)   loss: 0.1049 -> 0.1021  accuracy: 95.78% -> 96.99%     
client [46] (testset)   loss: 0.1171 -> 0.1187  accuracy: 96.24% -> 96.24%     
---------------------------- TRAINING EPOCH: 380 ----------------------------  
client [99] (testset)   loss: 0.3111 -> 0.3130  accuracy: 93.30% -> 92.74%     
client [93] (testset)   loss: 0.0952 -> 0.1002  accuracy: 97.22% -> 97.62%     
client [11] (testset)   loss: 0.0981 -> 0.0983  accuracy: 97.94% -> 97.42%     
client [58] (testset)   loss: 0.0485 -> 0.0481  accuracy: 97.44% -> 97.44%     
client [81] (testset)   loss: 0.2839 -> 0.2841  accuracy: 96.36% -> 96.36%     
client [85] (testset)   loss: 0.3815 -> 0.3788  accuracy: 91.55% -> 91.55%     
client [89] (testset)   loss: 0.1556 -> 0.1557  accuracy: 94.69% -> 94.69%     
client [45] (testset)   loss: 0.1040 -> 0.1083  accuracy: 98.08% -> 97.70%     
client [8]  (testset)   loss: 0.1296 -> 0.1297  accuracy: 95.73% -> 95.73%     
client [68] (testset)   loss: 0.0530 -> 0.0548  accuracy: 98.33% -> 98.33%     
---------------------------- TRAINING EPOCH: 390 ----------------------------  
client [67] (testset)   loss: 0.2440 -> 0.2501  accuracy: 93.16% -> 93.16%     
client [72] (testset)   loss: 0.0704 -> 0.0720  accuracy: 97.60% -> 97.60%     
client [1]  (testset)   loss: 0.2290 -> 0.2458  accuracy: 93.66% -> 92.68%     
client [78] (testset)   loss: 0.1402 -> 0.1406  accuracy: 96.36% -> 96.36%     
client [83] (testset)   loss: 0.1345 -> 0.1345  accuracy: 95.22% -> 95.22%     
client [21] (testset)   loss: 0.0735 -> 0.0738  accuracy: 96.46% -> 96.46%     
client [56] (testset)   loss: 0.1721 -> 0.1708  accuracy: 95.79% -> 95.79%     
client [44] (testset)   loss: 0.1821 -> 0.1856  accuracy: 97.59% -> 97.59%     
client [92] (testset)   loss: 0.2304 -> 0.2330  accuracy: 95.19% -> 94.71%     
client [27] (testset)   loss: 0.0713 -> 0.0700  accuracy: 98.24% -> 97.06%     
---------------------------- TRAINING EPOCH: 400 ----------------------------  
client [10] (testset)   loss: 0.1015 -> 0.1047  accuracy: 96.69% -> 96.69%     
client [39] (testset)   loss: 0.0808 -> 0.0773  accuracy: 96.70% -> 96.70%     
client [65] (testset)   loss: 0.1909 -> 0.1899  accuracy: 94.71% -> 94.71%     
client [26] (testset)   loss: 0.0991 -> 0.1009  accuracy: 97.88% -> 97.88%     
client [19] (testset)   loss: 0.0477 -> 0.0473  accuracy: 98.82% -> 98.82%     
client [68] (testset)   loss: 0.0564 -> 0.0565  accuracy: 98.33% -> 98.33%     
client [41] (testset)   loss: 0.0977 -> 0.0972  accuracy: 98.21% -> 98.21%     
client [50] (testset)   loss: 0.1339 -> 0.1374  accuracy: 96.83% -> 96.83%     
client [75] (testset)   loss: 0.0511 -> 0.0518  accuracy: 98.40% -> 98.40%     
client [81] (testset)   loss: 0.2892 -> 0.2871  accuracy: 96.36% -> 96.36%     
Training... ---------------------------------------- 100% 0:16:11
FedRep's average time taken by each global epoch: 0 min 2.41 sec.              
FedRep's total running time: 0 h 16 m 11 s.                                    
==================== FedRep Experiment Results: ====================           
Display format: (before local fine-tuning) -> (after local fine-tuning)        
 So if finetune_epoch = 0, x.xx% -> 0.00% is normal.                           
 Centralized testing ONLY happens after model aggregation, so the stats between
'->' are the same.                                                             
{                                                                              
    "100": {                                                                   
        "all_clients": {                                                       
            "test": {                                                          
                "loss": "0.1377 -> 0.0000",                                    
                "accuracy": "96.05% -> 0.00%"                                  
            }                                                                  
        }                                                                      
    },                                                                         
    "200": {                                                                   
        "all_clients": {                                                       
            "test": {                                                          
                "loss": "0.1322 -> 0.0000",                                    
                "accuracy": "96.41% -> 0.00%"                                  
            }                                                                  
        }                                                                      
    },                                                                         
    "300": {                                                                   
        "all_clients": {                                                       
            "test": {                                                          
                "loss": "0.1399 -> 0.0000",                                    
                "accuracy": "96.48% -> 0.00%"                                  
            }                                                                  
        }                                                                      
    },                                                                         
    "400": {                                                                   
        "all_clients": {                                                       
            "test": {                                                          
                "loss": "0.1393 -> 0.0000",                                    
                "accuracy": "96.62% -> 0.00%"                                  
            }                                                                  
        }                                                                      
    }                                                                          
}                                                                              
==================== FedRep Max Accuracy ====================                  
all_clients:                                                                   
(test) before fine-tuning: 96.62% at epoch 400                                 
(test) after fine-tuning: 0.00% at epoch 100                                   
[0m