==================== FedRoD ====================                               
Experiment Arguments:                                                          
{
│   'method': 'fedrod',
│   'dataset': {
│   │   'name': 'emnist',
│   │   'client_num': 100,
│   │   'test_ratio': 0.25,
│   │   'val_ratio': 0.0,
│   │   'seed': 42,
│   │   'split': 'sample',
│   │   'IID_ratio': 0.0,
│   │   'monitor_window_name_suffix': 'emnist-100clients-0%IID-Dir(1.0)-seed42',
│   │   'emnist_split': 'byclass',
│   │   'alpha': 1.0,
│   │   'min_samples_per_client': 10
│   },
│   'model': {
│   │   'name': 'avgcnn',
│   │   'use_torchvision_pretrained_weights': True,
│   │   'external_model_weights_path': None
│   },
│   'optimizer': {
│   │   'lr': 0.01,
│   │   'dampening': 0,
│   │   'weight_decay': 0,
│   │   'momentum': 0,
│   │   'nesterov': False,
│   │   'name': 'sgd'
│   },
│   'mode': 'serial',
│   'parallel': {
│   │   'ray_cluster_addr': None,
│   │   'num_cpus': None,
│   │   'num_gpus': None,
│   │   'num_workers': 2
│   },
│   'common': {
│   │   'seed': 42,
│   │   'join_ratio': 0.1,
│   │   'global_epoch': 400,
│   │   'local_epoch': 5,
│   │   'batch_size': 32,
│   │   'reset_optimizer_on_global_epoch': True,
│   │   'straggler_ratio': 0,
│   │   'straggler_min_local_epoch': 0,
│   │   'buffers': 'global',
│   │   'client_side_evaluation': True,
│   │   'test': {
│   │   │   'client': {
│   │   │   │   'interval': 100,
│   │   │   │   'finetune_epoch': 0,
│   │   │   │   'train': False,
│   │   │   │   'val': False,
│   │   │   │   'test': True
│   │   │   },
│   │   │   'server': {
│   │   │   │   'interval': -1,
│   │   │   │   'train': False,
│   │   │   │   'val': False,
│   │   │   │   'test': False,
│   │   │   │   'model_in_train_mode': False
│   │   │   }
│   │   },
│   │   'verbose_gap': 10,
│   │   'monitor': None,
│   │   'use_cuda': True,
│   │   'save_log': True,
│   │   'save_model': False,
│   │   'save_learning_curve_plot': False,
│   │   'save_metrics': True,
│   │   'delete_useless_run': True
│   },
│   'fedrod': {
│   │   'gamma': 1,
│   │   'hyper': 0,
│   │   'hyper_lr': 0.1,
│   │   'hyper_hidden_dim': 32,
│   │   'eval_per': 1
│   }
}
---------------------------- TRAINING EPOCH: 10 ----------------------------   
client [77] (testset)   loss: 0.3868 -> 0.4146  accuracy: 87.08% -> 87.24%     
client [81] (testset)   loss: 0.3759 -> 0.4488  accuracy: 86.92% -> 81.82%     
client [21] (testset)   loss: 0.7616 -> 0.4925  accuracy: 75.31% -> 85.27%     
client [68] (testset)   loss: 0.4037 -> 0.4071  accuracy: 88.53% -> 88.19%     
client [93] (testset)   loss: 0.4781 -> 0.5052  accuracy: 84.48% -> 84.25%     
client [31] (testset)   loss: 0.4637 -> 0.4742  accuracy: 82.56% -> 84.56%     
client [20] (testset)   loss: 0.5416 -> 0.6175  accuracy: 83.71% -> 82.33%     
client [59] (testset)   loss: 0.5771 -> 0.3059  accuracy: 84.34% -> 91.02%     
client [48] (testset)   loss: 0.4441 -> 0.4660  accuracy: 86.40% -> 86.92%     
client [34] (testset)   loss: 0.4534 -> 0.4844  accuracy: 85.42% -> 85.64%     
---------------------------- TRAINING EPOCH: 20 ----------------------------   
client [69] (testset)   loss: 0.4185 -> 0.3993  accuracy: 87.51% -> 87.87%     
client [99] (testset)   loss: 0.6008 -> 0.5538  accuracy: 83.73% -> 84.04%     
client [67] (testset)   loss: 0.3647 -> 0.3648  accuracy: 89.97% -> 90.56%     
client [0]  (testset)   loss: 0.4100 -> 0.4557  accuracy: 87.57% -> 87.94%     
client [76] (testset)   loss: 0.5469 -> 0.5234  accuracy: 85.84% -> 87.49%     
client [41] (testset)   loss: 0.5693 -> 0.5554  accuracy: 81.21% -> 82.41%     
client [62] (testset)   loss: 0.6371 -> 0.4039  accuracy: 82.82% -> 89.55%     
client [2]  (testset)   loss: 0.6500 -> 0.4093  accuracy: 82.86% -> 89.03%     
client [14] (testset)   loss: 0.4919 -> 0.5386  accuracy: 84.83% -> 85.84%     
client [46] (testset)   loss: 0.3412 -> 0.3981  accuracy: 90.03% -> 88.56%     
---------------------------- TRAINING EPOCH: 30 ----------------------------   
client [24] (testset)   loss: 0.5078 -> 0.5617  accuracy: 83.63% -> 83.46%     
client [68] (testset)   loss: 0.4965 -> 0.5342  accuracy: 88.78% -> 88.09%     
client [57] (testset)   loss: 0.4358 -> 0.4622  accuracy: 88.20% -> 88.34%     
client [17] (testset)   loss: 0.5644 -> 0.5593  accuracy: 86.24% -> 86.20%     
client [54] (testset)   loss: 0.5696 -> 0.6178  accuracy: 84.56% -> 84.20%     
client [23] (testset)   loss: 1.0753 -> 0.5097  accuracy: 77.83% -> 86.07%     
client [35] (testset)   loss: 0.5375 -> 0.5961  accuracy: 86.08% -> 86.38%     
client [59] (testset)   loss: 0.3504 -> 0.3667  accuracy: 91.77% -> 91.69%     
client [31] (testset)   loss: 0.6159 -> 0.6811  accuracy: 85.21% -> 84.71%     
client [9]  (testset)   loss: 0.5647 -> 0.5289  accuracy: 86.02% -> 85.43%     
---------------------------- TRAINING EPOCH: 40 ----------------------------   
client [64] (testset)   loss: 0.4530 -> 0.4676  accuracy: 88.49% -> 89.87%     
client [33] (testset)   loss: 0.5767 -> 0.6185  accuracy: 87.21% -> 87.76%     
client [16] (testset)   loss: 0.7464 -> 0.7070  accuracy: 84.03% -> 83.47%     
client [44] (testset)   loss: 0.5652 -> 0.5780  accuracy: 83.92% -> 83.15%     
client [8]  (testset)   loss: 0.5125 -> 0.5538  accuracy: 87.06% -> 88.65%     
client [31] (testset)   loss: 0.6775 -> 0.7110  accuracy: 83.21% -> 84.21%     
client [47] (testset)   loss: 0.4804 -> 0.4959  accuracy: 88.05% -> 87.51%     
client [36] (testset)   loss: 0.3337 -> 0.3291  accuracy: 90.66% -> 91.25%     
client [20] (testset)   loss: 0.7023 -> 0.8173  accuracy: 82.42% -> 82.06%     
client [56] (testset)   loss: 0.6596 -> 0.5966  accuracy: 82.60% -> 83.05%     
---------------------------- TRAINING EPOCH: 50 ----------------------------   
client [4]  (testset)   loss: 0.4078 -> 0.4372  accuracy: 88.67% -> 88.61%     
client [60] (testset)   loss: 0.5176 -> 0.5207  accuracy: 88.00% -> 87.56%     
client [28] (testset)   loss: 0.4829 -> 0.4903  accuracy: 88.60% -> 88.92%     
client [25] (testset)   loss: 0.4603 -> 0.4841  accuracy: 88.35% -> 87.74%     
client [58] (testset)   loss: 0.5779 -> 0.5717  accuracy: 87.35% -> 88.00%     
client [44] (testset)   loss: 0.6142 -> 0.6213  accuracy: 82.64% -> 82.90%     
client [39] (testset)   loss: 0.5246 -> 0.5574  accuracy: 85.03% -> 84.59%     
client [29] (testset)   loss: 0.5895 -> 0.6515  accuracy: 84.74% -> 84.85%     
client [3]  (testset)   loss: 0.4786 -> 0.4910  accuracy: 85.44% -> 87.07%     
client [84] (testset)   loss: 0.7053 -> 0.6858  accuracy: 85.16% -> 85.58%     
---------------------------- TRAINING EPOCH: 60 ----------------------------   
client [21] (testset)   loss: 0.6265 -> 0.6772  accuracy: 83.28% -> 83.42%     
client [84] (testset)   loss: 0.6992 -> 0.6983  accuracy: 86.01% -> 85.58%     
client [10] (testset)   loss: 0.5161 -> 0.5364  accuracy: 88.53% -> 88.48%     
client [36] (testset)   loss: 0.3749 -> 0.3785  accuracy: 92.05% -> 91.91%     
client [65] (testset)   loss: 0.4760 -> 0.5349  accuracy: 88.47% -> 88.17%     
client [81] (testset)   loss: 0.4561 -> 0.4811  accuracy: 89.06% -> 89.79%     
client [79] (testset)   loss: 0.4402 -> 0.4399  accuracy: 91.34% -> 91.91%     
client [42] (testset)   loss: 0.4752 -> 0.5111  accuracy: 88.34% -> 88.55%     
client [11] (testset)   loss: 0.5578 -> 0.5983  accuracy: 86.35% -> 88.57%     
client [96] (testset)   loss: 0.5419 -> 0.5892  accuracy: 86.93% -> 86.60%     
---------------------------- TRAINING EPOCH: 70 ----------------------------   
client [8]  (testset)   loss: 0.6451 -> 0.6589  accuracy: 87.39% -> 88.51%     
client [53] (testset)   loss: 0.4979 -> 0.4826  accuracy: 88.40% -> 88.28%     
client [52] (testset)   loss: 0.5505 -> 0.5650  accuracy: 86.70% -> 87.06%     
client [42] (testset)   loss: 0.5500 -> 0.5538  accuracy: 87.35% -> 87.84%     
client [69] (testset)   loss: 0.6034 -> 0.6603  accuracy: 86.10% -> 86.58%     
client [59] (testset)   loss: 0.4788 -> 0.4738  accuracy: 90.60% -> 91.27%     
client [7]  (testset)   loss: 0.6992 -> 0.6940  accuracy: 82.31% -> 84.62%     
client [26] (testset)   loss: 0.4233 -> 0.4643  accuracy: 90.24% -> 90.36%     
client [49] (testset)   loss: 0.6677 -> 0.7233  accuracy: 85.71% -> 86.53%     
client [98] (testset)   loss: 0.6167 -> 0.6876  accuracy: 85.40% -> 85.74%     
---------------------------- TRAINING EPOCH: 80 ----------------------------   
client [98] (testset)   loss: 0.6368 -> 0.7214  accuracy: 84.71% -> 85.61%     
client [47] (testset)   loss: 0.5800 -> 0.5730  accuracy: 87.63% -> 87.63%     
client [21] (testset)   loss: 0.7288 -> 0.7403  accuracy: 82.37% -> 83.87%     
client [77] (testset)   loss: 0.6645 -> 0.7358  accuracy: 86.37% -> 87.28%     
client [95] (testset)   loss: 0.5593 -> 0.5987  accuracy: 88.96% -> 89.68%     
client [91] (testset)   loss: 0.7361 -> 0.7645  accuracy: 84.06% -> 83.47%     
client [14] (testset)   loss: 0.7568 -> 0.8127  accuracy: 83.71% -> 84.22%     
client [99] (testset)   loss: 0.8358 -> 0.8366  accuracy: 81.46% -> 83.15%     
client [20] (testset)   loss: 0.9800 -> 1.0822  accuracy: 82.20% -> 81.98%     
client [39] (testset)   loss: 0.7293 -> 0.6977  accuracy: 83.58% -> 84.47%     
---------------------------- TRAINING EPOCH: 90 ----------------------------   
client [52] (testset)   loss: 0.5803 -> 0.6014  accuracy: 85.50% -> 85.98%     
client [62] (testset)   loss: 0.5554 -> 0.5905  accuracy: 89.44% -> 89.50%     
client [71] (testset)   loss: 0.6463 -> 0.7177  accuracy: 86.52% -> 85.98%     
client [97] (testset)   loss: 0.6297 -> 0.6265  accuracy: 87.71% -> 87.84%     
client [30] (testset)   loss: 0.6184 -> 0.6798  accuracy: 86.70% -> 87.38%     
client [88] (testset)   loss: 0.6050 -> 0.6242  accuracy: 86.79% -> 86.79%     
client [60] (testset)   loss: 0.6905 -> 0.7169  accuracy: 86.07% -> 86.55%     
client [82] (testset)   loss: 0.6244 -> 0.6287  accuracy: 86.16% -> 86.43%     
client [91] (testset)   loss: 0.7586 -> 0.8184  accuracy: 83.28% -> 84.25%     
client [57] (testset)   loss: 0.6072 -> 0.6076  accuracy: 87.77% -> 87.68%     
---------------------------- TRAINING EPOCH: 100 ----------------------------  
client [31] (testset)   loss: 0.8519 -> 0.9354  accuracy: 84.16% -> 84.31%     
client [15] (testset)   loss: 0.6403 -> 0.6431  accuracy: 84.60% -> 84.35%     
client [71] (testset)   loss: 0.6554 -> 0.7193  accuracy: 84.15% -> 85.23%     
client [97] (testset)   loss: 0.6493 -> 0.6546  accuracy: 87.84% -> 88.10%     
client [53] (testset)   loss: 0.5799 -> 0.5755  accuracy: 88.20% -> 88.60%     
client [77] (testset)   loss: 0.7403 -> 0.7725  accuracy: 85.54% -> 85.93%     
client [76] (testset)   loss: 0.7409 -> 0.7664  accuracy: 86.84% -> 86.79%     
client [79] (testset)   loss: 0.5069 -> 0.5096  accuracy: 90.72% -> 90.98%     
client [28] (testset)   loss: 0.5819 -> 0.6315  accuracy: 88.56% -> 88.69%     
client [99] (testset)   loss: 0.8619 -> 0.8832  accuracy: 82.62% -> 83.15%     
---------------------------- TRAINING EPOCH: 110 ----------------------------  
client [97] (testset)   loss: 0.6490 -> 0.6638  accuracy: 88.27% -> 88.35%     
client [86] (testset)   loss: 0.5391 -> 0.5839  accuracy: 89.25% -> 89.03%     
client [34] (testset)   loss: 0.7129 -> 0.7728  accuracy: 84.83% -> 85.26%     
client [73] (testset)   loss: 0.6136 -> 0.6354  accuracy: 88.41% -> 88.30%     
client [5]  (testset)   loss: 0.5191 -> 0.5345  accuracy: 88.99% -> 89.76%     
client [96] (testset)   loss: 0.7691 -> 0.8116  accuracy: 85.92% -> 85.71%     
client [22] (testset)   loss: 0.7541 -> 0.7550  accuracy: 87.18% -> 87.18%     
client [60] (testset)   loss: 0.7339 -> 0.7769  accuracy: 87.12% -> 87.24%     
client [66] (testset)   loss: 0.6631 -> 0.6704  accuracy: 86.52% -> 85.97%     
client [83] (testset)   loss: 0.5619 -> 0.6289  accuracy: 88.07% -> 89.23%     
---------------------------- TRAINING EPOCH: 120 ----------------------------  
client [76] (testset)   loss: 0.7561 -> 0.7922  accuracy: 86.34% -> 86.39%     
client [65] (testset)   loss: 0.5727 -> 0.6025  accuracy: 87.69% -> 88.56%     
client [95] (testset)   loss: 0.6369 -> 0.6441  accuracy: 88.11% -> 89.44%     
client [17] (testset)   loss: 0.7585 -> 0.7628  accuracy: 85.60% -> 86.20%     
client [8]  (testset)   loss: 0.6657 -> 0.7288  accuracy: 88.61% -> 88.94%     
client [35] (testset)   loss: 0.9073 -> 0.8866  accuracy: 85.34% -> 85.34%     
client [98] (testset)   loss: 0.8016 -> 0.7978  accuracy: 84.67% -> 86.46%     
client [53] (testset)   loss: 0.6423 -> 0.6237  accuracy: 87.56% -> 87.84%     
client [43] (testset)   loss: 0.6498 -> 0.6869  accuracy: 86.42% -> 86.87%     
client [64] (testset)   loss: 0.6301 -> 0.6486  accuracy: 88.72% -> 88.83%     
---------------------------- TRAINING EPOCH: 130 ----------------------------  
client [21] (testset)   loss: 0.8126 -> 0.8315  accuracy: 83.24% -> 82.56%     
client [88] (testset)   loss: 0.6927 -> 0.7353  accuracy: 86.39% -> 86.49%     
client [38] (testset)   loss: 0.7327 -> 0.7210  accuracy: 87.16% -> 86.85%     
client [3]  (testset)   loss: 0.7023 -> 0.7761  accuracy: 85.85% -> 86.08%     
client [5]  (testset)   loss: 0.5171 -> 0.5226  accuracy: 89.69% -> 90.27%     
client [41] (testset)   loss: 1.0034 -> 0.9540  accuracy: 79.38% -> 79.91%     
client [7]  (testset)   loss: 0.7473 -> 0.7967  accuracy: 82.05% -> 84.46%     
client [37] (testset)   loss: 0.8308 -> 0.8741  accuracy: 82.72% -> 82.46%     
client [45] (testset)   loss: 0.6448 -> 0.6533  accuracy: 86.44% -> 86.49%     
client [47] (testset)   loss: 0.6436 -> 0.6627  accuracy: 86.12% -> 87.09%     
---------------------------- TRAINING EPOCH: 140 ----------------------------  
client [16] (testset)   loss: 0.9284 -> 0.9412  accuracy: 82.29% -> 82.43%     
client [11] (testset)   loss: 0.7377 -> 0.7771  accuracy: 86.35% -> 86.69%     
client [37] (testset)   loss: 0.9249 -> 0.9707  accuracy: 82.46% -> 82.85%     
client [41] (testset)   loss: 0.9878 -> 0.9856  accuracy: 79.65% -> 79.02%     
client [95] (testset)   loss: 0.6578 -> 0.6767  accuracy: 87.73% -> 88.87%     
client [53] (testset)   loss: 0.6247 -> 0.6327  accuracy: 87.92% -> 87.72%     
client [22] (testset)   loss: 0.7195 -> 0.7566  accuracy: 86.94% -> 87.35%     
client [25] (testset)   loss: 0.6186 -> 0.6539  accuracy: 87.65% -> 88.02%     
client [69] (testset)   loss: 0.7512 -> 0.8211  accuracy: 85.69% -> 86.46%     
client [46] (testset)   loss: 0.5810 -> 0.5919  accuracy: 89.14% -> 88.37%     
---------------------------- TRAINING EPOCH: 150 ----------------------------  
client [47] (testset)   loss: 0.7592 -> 0.7921  accuracy: 86.58% -> 87.13%     
client [69] (testset)   loss: 0.8237 -> 0.8679  accuracy: 85.49% -> 86.46%     
client [82] (testset)   loss: 0.7045 -> 0.7069  accuracy: 86.06% -> 86.75%     
client [45] (testset)   loss: 0.6688 -> 0.6985  accuracy: 86.49% -> 86.87%     
client [7]  (testset)   loss: 0.8266 -> 0.8297  accuracy: 82.57% -> 83.99%     
client [50] (testset)   loss: 0.5378 -> 0.5583  accuracy: 89.94% -> 90.60%     
client [35] (testset)   loss: 0.8997 -> 0.9526  accuracy: 85.03% -> 85.09%     
client [24] (testset)   loss: 0.8584 -> 0.9178  accuracy: 83.50% -> 83.46%     
client [15] (testset)   loss: 0.7817 -> 0.7523  accuracy: 83.56% -> 84.65%     
client [58] (testset)   loss: 0.7769 -> 0.8164  accuracy: 87.17% -> 87.96%     
---------------------------- TRAINING EPOCH: 160 ----------------------------  
client [48] (testset)   loss: 0.8149 -> 0.8959  accuracy: 85.40% -> 85.71%     
client [76] (testset)   loss: 0.8303 -> 0.8589  accuracy: 85.99% -> 86.64%     
client [67] (testset)   loss: 0.5843 -> 0.6097  accuracy: 89.59% -> 89.80%     
client [37] (testset)   loss: 0.9533 -> 1.0017  accuracy: 82.07% -> 82.33%     
client [58] (testset)   loss: 0.8063 -> 0.8568  accuracy: 86.73% -> 87.96%     
client [64] (testset)   loss: 0.6956 -> 0.6865  accuracy: 87.97% -> 88.31%     
client [77] (testset)   loss: 0.8595 -> 0.8869  accuracy: 86.09% -> 86.29%     
client [55] (testset)   loss: 0.8312 -> 0.8362  accuracy: 86.80% -> 87.42%     
client [12] (testset)   loss: 0.6213 -> 0.6392  accuracy: 89.67% -> 89.61%     
client [89] (testset)   loss: 0.6640 -> 0.7155  accuracy: 87.93% -> 87.69%     
---------------------------- TRAINING EPOCH: 170 ----------------------------  
client [84] (testset)   loss: 0.8670 -> 0.9089  accuracy: 84.67% -> 85.40%     
client [51] (testset)   loss: 1.3066 -> 1.4069  accuracy: 79.09% -> 78.95%     
client [8]  (testset)   loss: 0.7831 -> 0.8296  accuracy: 87.76% -> 88.09%     
client [18] (testset)   loss: 0.7014 -> 0.7220  accuracy: 86.58% -> 87.32%     
client [94] (testset)   loss: 0.9023 -> 0.9001  accuracy: 83.24% -> 83.63%     
client [81] (testset)   loss: 0.6226 -> 0.6393  accuracy: 86.98% -> 88.66%     
client [3]  (testset)   loss: 0.7777 -> 0.8074  accuracy: 85.94% -> 86.17%     
client [11] (testset)   loss: 0.8556 -> 0.8785  accuracy: 86.00% -> 86.40%     
client [95] (testset)   loss: 0.7428 -> 0.7630  accuracy: 88.87% -> 88.87%     
client [67] (testset)   loss: 0.5797 -> 0.5935  accuracy: 90.26% -> 90.39%     
---------------------------- TRAINING EPOCH: 180 ----------------------------  
client [21] (testset)   loss: 0.9015 -> 0.9448  accuracy: 81.83% -> 82.33%     
client [79] (testset)   loss: 0.6126 -> 0.6127  accuracy: 90.40% -> 91.38%     
client [58] (testset)   loss: 0.7994 -> 0.8466  accuracy: 87.78% -> 88.27%     
client [88] (testset)   loss: 0.8360 -> 0.7933  accuracy: 85.99% -> 86.24%     
client [46] (testset)   loss: 0.6427 -> 0.6319  accuracy: 87.93% -> 89.14%     
client [11] (testset)   loss: 0.8176 -> 0.8655  accuracy: 85.31% -> 86.35%     
client [55] (testset)   loss: 0.8349 -> 0.8474  accuracy: 86.80% -> 86.75%     
client [13] (testset)   loss: 0.6207 -> 0.6465  accuracy: 89.14% -> 89.58%     
client [31] (testset)   loss: 0.9599 -> 1.0445  accuracy: 82.91% -> 83.51%     
client [75] (testset)   loss: 0.7586 -> 0.7265  accuracy: 87.63% -> 88.25%     
---------------------------- TRAINING EPOCH: 190 ----------------------------  
client [19] (testset)   loss: 0.6662 -> 0.6935  accuracy: 87.89% -> 87.66%     
client [7]  (testset)   loss: 0.9614 -> 0.9621  accuracy: 82.57% -> 83.62%     
client [57] (testset)   loss: 0.7122 -> 0.7548  accuracy: 87.72% -> 88.03%     
client [13] (testset)   loss: 0.6382 -> 0.6801  accuracy: 89.92% -> 89.42%     
client [43] (testset)   loss: 0.7527 -> 0.7770  accuracy: 85.68% -> 86.77%     
client [91] (testset)   loss: 0.8994 -> 0.9326  accuracy: 83.21% -> 82.50%     
client [10] (testset)   loss: 0.7903 -> 0.8074  accuracy: 86.53% -> 87.41%     
client [64] (testset)   loss: 0.6982 -> 0.7090  accuracy: 88.43% -> 88.20%     
client [82] (testset)   loss: 0.7916 -> 0.7574  accuracy: 86.20% -> 86.56%     
client [22] (testset)   loss: 0.8008 -> 0.8279  accuracy: 87.58% -> 87.46%     
---------------------------- TRAINING EPOCH: 200 ----------------------------  
client [20] (testset)   loss: 1.1549 -> 1.2954  accuracy: 82.15% -> 81.62%     
client [23] (testset)   loss: 0.9524 -> 0.8743  accuracy: 85.33% -> 85.56%     
client [88] (testset)   loss: 0.7956 -> 0.8309  accuracy: 86.24% -> 85.94%     
client [98] (testset)   loss: 0.8787 -> 0.9442  accuracy: 85.18% -> 86.17%     
client [79] (testset)   loss: 0.6286 -> 0.6208  accuracy: 91.20% -> 91.60%     
client [21] (testset)   loss: 0.9631 -> 0.9711  accuracy: 82.96% -> 82.83%     
client [92] (testset)   loss: 0.9397 -> 0.9666  accuracy: 86.27% -> 85.76%     
client [56] (testset)   loss: 1.0608 -> 1.0912  accuracy: 82.73% -> 82.60%     
client [5]  (testset)   loss: 0.5581 -> 0.5613  accuracy: 90.08% -> 90.08%     
client [52] (testset)   loss: 0.7806 -> 0.7707  accuracy: 85.50% -> 86.22%     
---------------------------- TRAINING EPOCH: 210 ----------------------------  
client [67] (testset)   loss: 0.6412 -> 0.6336  accuracy: 90.14% -> 90.26%     
client [54] (testset)   loss: 1.0056 -> 1.0860  accuracy: 83.57% -> 83.68%     
client [14] (testset)   loss: 1.0205 -> 1.0330  accuracy: 84.67% -> 84.52%     
client [99] (testset)   loss: 1.1079 -> 1.0972  accuracy: 82.15% -> 82.73%     
client [36] (testset)   loss: 0.5811 -> 0.5857  accuracy: 90.98% -> 91.36%     
client [30] (testset)   loss: 0.7982 -> 0.8670  accuracy: 86.10% -> 86.70%     
client [38] (testset)   loss: 0.7784 -> 0.7893  accuracy: 87.28% -> 87.40%     
client [15] (testset)   loss: 0.7900 -> 0.8058  accuracy: 82.87% -> 83.86%     
client [6]  (testset)   loss: 0.7929 -> 0.8117  accuracy: 86.11% -> 86.16%     
client [53] (testset)   loss: 0.7361 -> 0.7770  accuracy: 87.25% -> 88.04%     
---------------------------- TRAINING EPOCH: 220 ----------------------------  
client [99] (testset)   loss: 1.1140 -> 1.1480  accuracy: 81.41% -> 82.20%     
client [6]  (testset)   loss: 0.8312 -> 0.8384  accuracy: 86.16% -> 86.28%     
client [83] (testset)   loss: 0.7181 -> 0.7767  accuracy: 88.87% -> 89.01%     
client [42] (testset)   loss: 0.6911 -> 0.7205  accuracy: 88.17% -> 88.50%     
client [34] (testset)   loss: 0.8381 -> 0.8774  accuracy: 84.67% -> 84.88%     
client [15] (testset)   loss: 0.8654 -> 0.8140  accuracy: 83.17% -> 84.25%     
client [47] (testset)   loss: 0.8463 -> 0.8984  accuracy: 87.00% -> 87.13%     
client [55] (testset)   loss: 0.8649 -> 0.8718  accuracy: 86.64% -> 87.32%     
client [51] (testset)   loss: 1.3475 -> 1.4792  accuracy: 78.19% -> 78.61%     
client [95] (testset)   loss: 0.7846 -> 0.7914  accuracy: 87.73% -> 88.20%     
---------------------------- TRAINING EPOCH: 230 ----------------------------  
client [71] (testset)   loss: 0.8148 -> 0.8835  accuracy: 85.18% -> 85.93%     
client [15] (testset)   loss: 0.8171 -> 0.8351  accuracy: 84.30% -> 83.61%     
client [33] (testset)   loss: 0.8885 -> 0.9777  accuracy: 85.29% -> 85.97%     
client [99] (testset)   loss: 1.1320 -> 1.1252  accuracy: 81.46% -> 81.89%     
client [90] (testset)   loss: 1.0366 -> 1.0974  accuracy: 81.80% -> 81.90%     
client [57] (testset)   loss: 0.7509 -> 0.7662  accuracy: 87.02% -> 87.94%     
client [27] (testset)   loss: 0.8421 -> 0.8961  accuracy: 85.61% -> 85.99%     
client [78] (testset)   loss: 0.8250 -> 0.8240  accuracy: 84.85% -> 84.40%     
client [36] (testset)   loss: 0.5642 -> 0.5930  accuracy: 90.39% -> 91.01%     
client [88] (testset)   loss: 0.8241 -> 0.8538  accuracy: 85.49% -> 85.29%     
---------------------------- TRAINING EPOCH: 240 ----------------------------  
client [70] (testset)   loss: 0.8908 -> 0.9207  accuracy: 86.99% -> 86.95%     
client [35] (testset)   loss: 1.0567 -> 1.0675  accuracy: 84.41% -> 83.92%     
client [16] (testset)   loss: 1.0882 -> 1.1061  accuracy: 83.61% -> 83.26%     
client [80] (testset)   loss: 0.8758 -> 0.8723  accuracy: 86.59% -> 86.15%     
client [38] (testset)   loss: 0.8274 -> 0.8526  accuracy: 87.16% -> 86.85%     
client [78] (testset)   loss: 0.9542 -> 0.8969  accuracy: 84.54% -> 84.08%     
client [68] (testset)   loss: 0.7606 -> 0.7992  accuracy: 86.94% -> 87.44%     
client [11] (testset)   loss: 0.9035 -> 0.9395  accuracy: 85.41% -> 86.59%     
client [64] (testset)   loss: 0.7410 -> 0.7814  accuracy: 87.74% -> 87.91%     
client [82] (testset)   loss: 0.7986 -> 0.7758  accuracy: 86.52% -> 86.75%     
---------------------------- TRAINING EPOCH: 250 ----------------------------  
client [30] (testset)   loss: 0.9067 -> 0.8907  accuracy: 86.61% -> 87.08%     
client [27] (testset)   loss: 0.8899 -> 0.9146  accuracy: 85.74% -> 85.78%     
client [74] (testset)   loss: 0.6205 -> 0.6490  accuracy: 89.45% -> 89.19%     
client [45] (testset)   loss: 0.8069 -> 0.8092  accuracy: 86.34% -> 86.14%     
client [6]  (testset)   loss: 0.8250 -> 0.8405  accuracy: 85.61% -> 86.22%     
client [36] (testset)   loss: 0.5840 -> 0.5949  accuracy: 91.04% -> 91.11%     
client [63] (testset)   loss: 0.6742 -> 0.6770  accuracy: 89.78% -> 89.56%     
client [76] (testset)   loss: 0.8984 -> 0.9401  accuracy: 86.44% -> 86.19%     
client [83] (testset)   loss: 0.7471 -> 0.7789  accuracy: 88.65% -> 88.65%     
client [86] (testset)   loss: 0.6999 -> 0.7332  accuracy: 88.16% -> 88.59%     
---------------------------- TRAINING EPOCH: 260 ----------------------------  
client [83] (testset)   loss: 0.7381 -> 0.7844  accuracy: 89.19% -> 89.05%     
client [99] (testset)   loss: 1.1617 -> 1.1914  accuracy: 82.52% -> 81.57%     
client [74] (testset)   loss: 0.6414 -> 0.6493  accuracy: 88.93% -> 89.40%     
client [73] (testset)   loss: 0.7224 -> 0.7300  accuracy: 88.75% -> 88.69%     
client [29] (testset)   loss: 0.9958 -> 1.0496  accuracy: 83.47% -> 83.20%     
client [92] (testset)   loss: 1.0015 -> 1.0446  accuracy: 86.02% -> 85.86%     
client [6]  (testset)   loss: 0.8617 -> 0.8343  accuracy: 85.33% -> 86.66%     
client [61] (testset)   loss: 0.9730 -> 0.9772  accuracy: 82.94% -> 83.14%     
client [21] (testset)   loss: 0.9697 -> 1.0182  accuracy: 81.56% -> 82.33%     
client [67] (testset)   loss: 0.6358 -> 0.6430  accuracy: 89.80% -> 90.31%     
---------------------------- TRAINING EPOCH: 270 ----------------------------  
client [83] (testset)   loss: 0.7873 -> 0.8091  accuracy: 88.92% -> 89.50%     
client [32] (testset)   loss: 1.1306 -> 1.1166  accuracy: 80.81% -> 80.77%     
client [95] (testset)   loss: 0.8235 -> 0.8472  accuracy: 87.63% -> 88.15%     
client [61] (testset)   loss: 0.9958 -> 0.9969  accuracy: 83.27% -> 82.42%     
client [27] (testset)   loss: 0.8872 -> 0.9474  accuracy: 85.40% -> 86.20%     
client [25] (testset)   loss: 0.7943 -> 0.7883  accuracy: 87.29% -> 87.37%     
client [68] (testset)   loss: 0.7778 -> 0.7937  accuracy: 87.54% -> 87.44%     
client [34] (testset)   loss: 0.8729 -> 0.9069  accuracy: 84.83% -> 85.04%     
client [71] (testset)   loss: 0.8701 -> 0.9222  accuracy: 85.34% -> 85.82%     
client [89] (testset)   loss: 0.7789 -> 0.7883  accuracy: 87.40% -> 87.45%     
---------------------------- TRAINING EPOCH: 280 ----------------------------  
client [78] (testset)   loss: 0.9478 -> 0.9236  accuracy: 84.36% -> 84.17%     
client [81] (testset)   loss: 0.6690 -> 0.6969  accuracy: 87.09% -> 88.89%     
client [51] (testset)   loss: 1.5138 -> 1.5177  accuracy: 79.78% -> 79.02%     
client [54] (testset)   loss: 1.1047 -> 1.1890  accuracy: 82.57% -> 82.89%     
client [65] (testset)   loss: 0.7953 -> 0.8016  accuracy: 88.34% -> 88.34%     
client [41] (testset)   loss: 1.2863 -> 1.2696  accuracy: 79.28% -> 78.97%     
client [11] (testset)   loss: 0.9275 -> 0.9752  accuracy: 85.26% -> 86.05%     
client [85] (testset)   loss: 0.6228 -> 0.6155  accuracy: 90.03% -> 89.72%     
client [12] (testset)   loss: 0.6757 -> 0.7048  accuracy: 88.79% -> 89.04%     
client [23] (testset)   loss: 1.0046 -> 0.9811  accuracy: 85.62% -> 84.76%     
---------------------------- TRAINING EPOCH: 290 ----------------------------  
client [16] (testset)   loss: 1.1293 -> 1.1062  accuracy: 83.40% -> 83.61%     
client [65] (testset)   loss: 0.7752 -> 0.8072  accuracy: 88.26% -> 88.26%     
client [53] (testset)   loss: 0.8375 -> 0.8688  accuracy: 87.09% -> 87.68%     
client [58] (testset)   loss: 0.8933 -> 0.9371  accuracy: 86.51% -> 87.30%     
client [72] (testset)   loss: 1.0192 -> 1.0363  accuracy: 85.21% -> 84.55%     
client [7]  (testset)   loss: 1.0947 -> 1.1037  accuracy: 82.26% -> 83.20%     
client [71] (testset)   loss: 0.9014 -> 0.9697  accuracy: 85.18% -> 85.18%     
client [59] (testset)   loss: 0.6195 -> 0.6310  accuracy: 90.85% -> 90.93%     
client [86] (testset)   loss: 0.7391 -> 0.7741  accuracy: 88.33% -> 87.85%     
client [39] (testset)   loss: 0.9941 -> 1.0287  accuracy: 83.58% -> 83.97%     
---------------------------- TRAINING EPOCH: 300 ----------------------------  
client [99] (testset)   loss: 1.2333 -> 1.1900  accuracy: 82.78% -> 81.62%     
client [7]  (testset)   loss: 1.0875 -> 1.1054  accuracy: 83.36% -> 83.57%     
client [17] (testset)   loss: 0.9918 -> 0.9884  accuracy: 85.98% -> 85.85%     
client [64] (testset)   loss: 0.7683 -> 0.7942  accuracy: 88.66% -> 88.83%     
client [37] (testset)   loss: 1.1286 -> 1.1320  accuracy: 81.35% -> 82.20%     
client [29] (testset)   loss: 1.1091 -> 1.0891  accuracy: 83.84% -> 83.89%     
client [93] (testset)   loss: 0.9093 -> 0.9488  accuracy: 86.27% -> 86.15%     
client [73] (testset)   loss: 0.7932 -> 0.8015  accuracy: 88.47% -> 88.13%     
client [40] (testset)   loss: 1.2110 -> 1.2491  accuracy: 79.60% -> 80.53%     
client [76] (testset)   loss: 0.9435 -> 0.9650  accuracy: 85.44% -> 85.64%     
---------------------------- TRAINING EPOCH: 310 ----------------------------  
client [31] (testset)   loss: 1.0006 -> 1.1091  accuracy: 83.36% -> 83.76%     
client [89] (testset)   loss: 0.8305 -> 0.8155  accuracy: 87.79% -> 87.69%     
client [77] (testset)   loss: 1.0569 -> 1.0656  accuracy: 85.50% -> 85.82%     
client [90] (testset)   loss: 1.2333 -> 1.2448  accuracy: 81.85% -> 82.40%     
client [26] (testset)   loss: 0.6712 -> 0.6569  accuracy: 89.19% -> 89.64%     
client [50] (testset)   loss: 0.6703 -> 0.6756  accuracy: 89.59% -> 89.84%     
client [30] (testset)   loss: 0.8671 -> 0.9276  accuracy: 86.48% -> 86.78%     
client [70] (testset)   loss: 0.8827 -> 0.9345  accuracy: 87.03% -> 87.19%     
client [41] (testset)   loss: 1.3437 -> 1.3071  accuracy: 78.55% -> 79.12%     
client [99] (testset)   loss: 1.1932 -> 1.2239  accuracy: 81.57% -> 81.57%     
---------------------------- TRAINING EPOCH: 320 ----------------------------  
client [68] (testset)   loss: 0.7902 -> 0.8212  accuracy: 87.74% -> 87.49%     
client [70] (testset)   loss: 0.9192 -> 0.9535  accuracy: 87.07% -> 87.03%     
client [52] (testset)   loss: 0.9105 -> 0.8712  accuracy: 86.04% -> 86.10%     
client [1]  (testset)   loss: 0.8188 -> 0.8146  accuracy: 88.60% -> 88.65%     
client [2]  (testset)   loss: 0.7855 -> 0.8110  accuracy: 88.51% -> 88.83%     
client [67] (testset)   loss: 0.6605 -> 0.6887  accuracy: 89.64% -> 90.01%     
client [92] (testset)   loss: 1.0923 -> 1.1057  accuracy: 85.96% -> 86.52%     
client [35] (testset)   loss: 1.0429 -> 1.1093  accuracy: 84.17% -> 84.60%     
client [36] (testset)   loss: 0.6398 -> 0.6417  accuracy: 91.42% -> 90.98%     
client [64] (testset)   loss: 0.7565 -> 0.7891  accuracy: 87.68% -> 88.03%     
---------------------------- TRAINING EPOCH: 330 ----------------------------  
client [44] (testset)   loss: 1.2493 -> 1.2393  accuracy: 81.62% -> 81.11%     
client [6]  (testset)   loss: 0.8787 -> 0.9045  accuracy: 85.28% -> 86.28%     
client [12] (testset)   loss: 0.7073 -> 0.7176  accuracy: 88.73% -> 89.10%     
client [55] (testset)   loss: 0.8855 -> 0.8968  accuracy: 87.06% -> 86.95%     
client [29] (testset)   loss: 1.1033 -> 1.1014  accuracy: 83.73% -> 83.89%     
client [9]  (testset)   loss: 0.9453 -> 0.9501  accuracy: 85.13% -> 85.60%     
client [43] (testset)   loss: 0.8012 -> 0.8346  accuracy: 86.67% -> 86.82%     
client [77] (testset)   loss: 1.0035 -> 1.0403  accuracy: 85.54% -> 85.50%     
client [98] (testset)   loss: 0.9881 -> 1.0543  accuracy: 85.10% -> 86.04%     
client [78] (testset)   loss: 0.9569 -> 0.9334  accuracy: 84.31% -> 84.40%     
---------------------------- TRAINING EPOCH: 340 ----------------------------  
client [92] (testset)   loss: 1.1238 -> 1.1172  accuracy: 86.82% -> 86.12%     
client [80] (testset)   loss: 0.9184 -> 0.9166  accuracy: 86.44% -> 86.25%     
client [63] (testset)   loss: 0.7413 -> 0.7528  accuracy: 88.63% -> 89.53%     
client [76] (testset)   loss: 0.9357 -> 0.9680  accuracy: 86.04% -> 86.04%     
client [78] (testset)   loss: 1.0033 -> 0.9895  accuracy: 85.03% -> 83.99%     
client [25] (testset)   loss: 0.7551 -> 0.8068  accuracy: 86.63% -> 87.16%     
client [58] (testset)   loss: 0.8874 -> 0.9561  accuracy: 86.16% -> 87.17%     
client [13] (testset)   loss: 0.7474 -> 0.7549  accuracy: 89.36% -> 89.09%     
client [17] (testset)   loss: 1.0507 -> 1.0148  accuracy: 85.77% -> 85.94%     
client [38] (testset)   loss: 0.8640 -> 0.8887  accuracy: 87.03% -> 87.71%     
---------------------------- TRAINING EPOCH: 350 ----------------------------  
client [72] (testset)   loss: 1.0173 -> 1.0952  accuracy: 84.86% -> 84.68%     
client [82] (testset)   loss: 0.8636 -> 0.8579  accuracy: 86.29% -> 86.38%     
client [86] (testset)   loss: 0.8003 -> 0.8346  accuracy: 87.72% -> 87.98%     
client [51] (testset)   loss: 1.4929 -> 1.5128  accuracy: 78.74% -> 79.23%     
client [96] (testset)   loss: 1.0220 -> 1.0301  accuracy: 85.27% -> 86.12%     
client [42] (testset)   loss: 0.7990 -> 0.8144  accuracy: 88.17% -> 88.44%     
client [55] (testset)   loss: 0.9603 -> 0.9280  accuracy: 86.90% -> 87.06%     
client [13] (testset)   loss: 0.7293 -> 0.7366  accuracy: 89.20% -> 89.86%     
client [1]  (testset)   loss: 0.8083 -> 0.8150  accuracy: 87.86% -> 88.97%     
client [12] (testset)   loss: 0.7040 -> 0.7344  accuracy: 89.48% -> 89.17%     
---------------------------- TRAINING EPOCH: 360 ----------------------------  
client [68] (testset)   loss: 0.8583 -> 0.8545  accuracy: 87.34% -> 87.09%     
client [23] (testset)   loss: 1.0476 -> 1.0574  accuracy: 84.65% -> 84.71%     
client [46] (testset)   loss: 0.7119 -> 0.7522  accuracy: 88.75% -> 88.44%     
client [41] (testset)   loss: 1.3586 -> 1.2688  accuracy: 78.18% -> 78.60%     
client [25] (testset)   loss: 0.7865 -> 0.8181  accuracy: 86.59% -> 87.20%     
client [58] (testset)   loss: 0.9171 -> 0.9861  accuracy: 86.60% -> 86.91%     
client [14] (testset)   loss: 1.1466 -> 1.1582  accuracy: 84.32% -> 84.02%     
client [33] (testset)   loss: 1.0226 -> 1.0552  accuracy: 85.29% -> 86.34%     
client [85] (testset)   loss: 0.6610 -> 0.6753  accuracy: 90.40% -> 89.91%     
client [62] (testset)   loss: 0.8654 -> 0.8712  accuracy: 88.10% -> 88.39%     
---------------------------- TRAINING EPOCH: 370 ----------------------------  
client [98] (testset)   loss: 1.0928 -> 1.1052  accuracy: 85.65% -> 85.78%     
client [63] (testset)   loss: 0.8037 -> 0.7669  accuracy: 89.91% -> 89.21%     
client [70] (testset)   loss: 0.9251 -> 0.9483  accuracy: 87.19% -> 87.95%     
client [65] (testset)   loss: 0.8452 -> 0.8367  accuracy: 87.60% -> 87.65%     
client [14] (testset)   loss: 1.1407 -> 1.1799  accuracy: 83.92% -> 83.81%     
client [73] (testset)   loss: 0.8020 -> 0.8117  accuracy: 87.97% -> 88.13%     
client [34] (testset)   loss: 0.9667 -> 0.9871  accuracy: 85.04% -> 84.88%     
client [99] (testset)   loss: 1.2530 -> 1.2392  accuracy: 81.73% -> 81.67%     
client [69] (testset)   loss: 0.9376 -> 1.0245  accuracy: 85.41% -> 86.34%     
client [46] (testset)   loss: 0.7325 -> 0.7621  accuracy: 87.87% -> 88.18%     
---------------------------- TRAINING EPOCH: 380 ----------------------------  
client [99] (testset)   loss: 1.2571 -> 1.2528  accuracy: 81.99% -> 82.10%     
client [93] (testset)   loss: 0.9122 -> 0.9652  accuracy: 85.17% -> 85.98%     
client [11] (testset)   loss: 1.0370 -> 1.0617  accuracy: 85.61% -> 85.66%     
client [58] (testset)   loss: 0.9436 -> 0.9729  accuracy: 86.82% -> 87.30%     
client [81] (testset)   loss: 0.7643 -> 0.7547  accuracy: 87.49% -> 87.71%     
client [85] (testset)   loss: 0.6588 -> 0.6575  accuracy: 90.28% -> 90.52%     
client [89] (testset)   loss: 0.8469 -> 0.8420  accuracy: 86.92% -> 87.64%     
client [45] (testset)   loss: 0.8899 -> 0.8864  accuracy: 86.34% -> 86.49%     
client [8]  (testset)   loss: 0.8766 -> 0.9453  accuracy: 87.76% -> 87.48%     
client [68] (testset)   loss: 0.8825 -> 0.8715  accuracy: 87.79% -> 86.89%     
---------------------------- TRAINING EPOCH: 390 ----------------------------  
client [67] (testset)   loss: 0.7124 -> 0.7165  accuracy: 90.39% -> 89.97%     
client [72] (testset)   loss: 1.0858 -> 1.1069  accuracy: 84.55% -> 84.64%     
client [1]  (testset)   loss: 0.8545 -> 0.8264  accuracy: 88.33% -> 87.96%     
client [78] (testset)   loss: 1.0040 -> 0.9934  accuracy: 84.63% -> 84.90%     
client [83] (testset)   loss: 0.7810 -> 0.8530  accuracy: 88.60% -> 89.23%     
client [21] (testset)   loss: 1.1271 -> 1.1853  accuracy: 82.24% -> 82.56%     
client [56] (testset)   loss: 1.2500 -> 1.2401  accuracy: 82.55% -> 82.10%     
client [44] (testset)   loss: 1.3181 -> 1.3308  accuracy: 81.56% -> 81.11%     
client [92] (testset)   loss: 1.1290 -> 1.1497  accuracy: 85.71% -> 85.81%     
client [27] (testset)   loss: 1.0270 -> 1.0365  accuracy: 85.11% -> 85.15%     
---------------------------- TRAINING EPOCH: 400 ----------------------------  
client [10] (testset)   loss: 0.9379 -> 0.9096  accuracy: 86.73% -> 86.97%     
client [39] (testset)   loss: 1.0744 -> 1.0832  accuracy: 83.58% -> 84.02%     
client [65] (testset)   loss: 0.8422 -> 0.8677  accuracy: 87.34% -> 87.65%     
client [26] (testset)   loss: 0.7072 -> 0.7076  accuracy: 89.84% -> 90.00%     
client [19] (testset)   loss: 0.7963 -> 0.8285  accuracy: 88.15% -> 88.20%     
client [68] (testset)   loss: 0.8456 -> 0.8567  accuracy: 87.34% -> 87.49%     
client [41] (testset)   loss: 1.3625 -> 1.3250  accuracy: 79.18% -> 79.12%     
client [50] (testset)   loss: 0.7114 -> 0.7255  accuracy: 89.08% -> 89.59%     
client [75] (testset)   loss: 0.9292 -> 0.9080  accuracy: 87.53% -> 87.43%     
client [81] (testset)   loss: 0.7265 -> 0.7698  accuracy: 87.65% -> 88.10%     
Training... ---------------------------------------- 100% 3:08:24
FedRoD's average time taken by each global epoch: 0 min 28.13 sec.             
FedRoD's total running time: 3 h 8 m 24 s.                                     
==================== FedRoD Experiment Results: ====================           
Display format: (before local fine-tuning) -> (after local fine-tuning)        
 So if finetune_epoch = 0, x.xx% -> 0.00% is normal.                           
 Centralized testing ONLY happens after model aggregation, so the stats between
'->' are the same.                                                             
{                                                                              
    "100": {                                                                   
        "all_clients": {                                                       
            "test": {                                                          
                "loss": "0.6566 -> 0.0000",                                    
                "accuracy": "86.29% -> 0.00%"                                  
            }                                                                  
        }                                                                      
    },                                                                         
    "200": {                                                                   
        "all_clients": {                                                       
            "test": {                                                          
                "loss": "0.8114 -> 0.0000",                                    
                "accuracy": "86.27% -> 0.00%"                                  
            }                                                                  
        }                                                                      
    },                                                                         
    "300": {                                                                   
        "all_clients": {                                                       
            "test": {                                                          
                "loss": "0.9020 -> 0.0000",                                    
                "accuracy": "85.88% -> 0.00%"                                  
            }                                                                  
        }                                                                      
    },                                                                         
    "400": {                                                                   
        "all_clients": {                                                       
            "test": {                                                          
                "loss": "0.9899 -> 0.0000",                                    
                "accuracy": "86.26% -> 0.00%"                                  
            }                                                                  
        }                                                                      
    }                                                                          
}                                                                              
==================== FedRoD Max Accuracy ====================                  
all_clients:                                                                   
(test) before fine-tuning: 86.29% at epoch 100                                 
(test) after fine-tuning: 0.00% at epoch 100                                   
[0m