==================== FedRep ====================                               
Experiment Arguments:                                                          
{
│   'method': 'fedrep',
│   'dataset': {
│   │   'name': 'fmnist',
│   │   'client_num': 100,
│   │   'test_ratio': 0.25,
│   │   'val_ratio': 0.0,
│   │   'seed': 42,
│   │   'split': 'sample',
│   │   'IID_ratio': 0.0,
│   │   'monitor_window_name_suffix': 'fmnist-100clients-0%IID-Dir(1.0)-seed42',
│   │   'alpha': 1.0,
│   │   'min_samples_per_client': 10
│   },
│   'model': {
│   │   'name': 'avgcnn',
│   │   'use_torchvision_pretrained_weights': True,
│   │   'external_model_weights_path': None
│   },
│   'optimizer': {
│   │   'lr': 0.01,
│   │   'dampening': 0,
│   │   'weight_decay': 0,
│   │   'momentum': 0,
│   │   'nesterov': False,
│   │   'name': 'sgd'
│   },
│   'mode': 'serial',
│   'parallel': {
│   │   'ray_cluster_addr': None,
│   │   'num_cpus': None,
│   │   'num_gpus': None,
│   │   'num_workers': 2
│   },
│   'common': {
│   │   'seed': 42,
│   │   'join_ratio': 0.1,
│   │   'global_epoch': 400,
│   │   'local_epoch': 5,
│   │   'batch_size': 32,
│   │   'reset_optimizer_on_global_epoch': True,
│   │   'straggler_ratio': 0,
│   │   'straggler_min_local_epoch': 0,
│   │   'buffers': 'global',
│   │   'client_side_evaluation': True,
│   │   'test': {
│   │   │   'client': {
│   │   │   │   'interval': 100,
│   │   │   │   'finetune_epoch': 0,
│   │   │   │   'train': False,
│   │   │   │   'val': False,
│   │   │   │   'test': True
│   │   │   },
│   │   │   'server': {
│   │   │   │   'interval': -1,
│   │   │   │   'train': False,
│   │   │   │   'val': False,
│   │   │   │   'test': False,
│   │   │   │   'model_in_train_mode': False
│   │   │   }
│   │   },
│   │   'verbose_gap': 10,
│   │   'monitor': None,
│   │   'use_cuda': True,
│   │   'save_log': True,
│   │   'save_model': False,
│   │   'save_learning_curve_plot': False,
│   │   'save_metrics': True,
│   │   'delete_useless_run': True
│   },
│   'fedrep': {
│   │   'train_body_epoch': 1
│   }
}
---------------------------- TRAINING EPOCH: 10 ----------------------------   
client [77] (testset)   loss: 0.9289 -> 0.8719  accuracy: 61.67% -> 68.33%     
client [81] (testset)   loss: 0.9600 -> 0.8223  accuracy: 61.23% -> 70.48%     
client [21] (testset)   loss: 0.7983 -> 0.7292  accuracy: 77.91% -> 77.91%     
client [68] (testset)   loss: 1.1620 -> 1.0794  accuracy: 51.39% -> 58.33%     
client [93] (testset)   loss: 0.7946 -> 1.0131  accuracy: 72.66% -> 67.19%     
client [31] (testset)   loss: 2.0404 -> 1.1442  accuracy: 40.29% -> 53.60%     
client [20] (testset)   loss: 0.9148 -> 0.8673  accuracy: 72.14% -> 70.00%     
client [59] (testset)   loss: 0.6563 -> 0.4946  accuracy: 82.20% -> 84.29%     
client [48] (testset)   loss: 0.4884 -> 0.4760  accuracy: 83.17% -> 84.16%     
client [34] (testset)   loss: 0.6577 -> 0.6180  accuracy: 78.01% -> 76.44%     
---------------------------- TRAINING EPOCH: 20 ----------------------------   
client [69] (testset)   loss: 0.9422 -> 0.5108  accuracy: 75.34% -> 84.93%     
client [99] (testset)   loss: 0.5438 -> 0.5305  accuracy: 80.37% -> 82.82%     
client [67] (testset)   loss: 0.6232 -> 0.5565  accuracy: 81.61% -> 81.03%     
client [0]  (testset)   loss: 0.6060 -> 0.5881  accuracy: 80.43% -> 78.30%     
client [76] (testset)   loss: 0.5425 -> 0.5235  accuracy: 80.45% -> 81.56%     
client [41] (testset)   loss: 0.9252 -> 0.7685  accuracy: 70.54% -> 69.77%     
client [62] (testset)   loss: 0.7930 -> 0.6392  accuracy: 74.29% -> 79.29%     
client [2]  (testset)   loss: 0.7688 -> 0.6296  accuracy: 71.24% -> 77.43%     
client [14] (testset)   loss: 0.4574 -> 0.6422  accuracy: 84.04% -> 76.53%     
client [46] (testset)   loss: 0.4516 -> 0.4608  accuracy: 82.84% -> 82.09%     
---------------------------- TRAINING EPOCH: 30 ----------------------------   
client [24] (testset)   loss: 0.4447 -> 0.3959  accuracy: 83.63% -> 88.50%     
client [68] (testset)   loss: 0.8068 -> 0.7594  accuracy: 69.44% -> 70.83%     
client [57] (testset)   loss: 0.5751 -> 0.4169  accuracy: 77.42% -> 86.29%     
client [17] (testset)   loss: 0.2867 -> 0.2494  accuracy: 89.80% -> 92.86%     
client [54] (testset)   loss: 0.3590 -> 0.3567  accuracy: 87.93% -> 90.23%     
client [23] (testset)   loss: 1.0011 -> 0.5350  accuracy: 53.57% -> 81.17%     
client [35] (testset)   loss: 0.4305 -> 0.4106  accuracy: 86.09% -> 86.75%     
client [59] (testset)   loss: 0.3116 -> 0.3175  accuracy: 85.34% -> 86.39%     
client [31] (testset)   loss: 0.6509 -> 1.3370  accuracy: 76.26% -> 60.79%     
client [9]  (testset)   loss: 0.7534 -> 0.5723  accuracy: 71.60% -> 77.51%     
---------------------------- TRAINING EPOCH: 40 ----------------------------   
client [64] (testset)   loss: 0.6579 -> 0.6005  accuracy: 73.65% -> 78.74%     
client [33] (testset)   loss: 0.5135 -> 0.5734  accuracy: 81.82% -> 77.27%     
client [16] (testset)   loss: 0.2363 -> 0.2070  accuracy: 92.06% -> 93.65%     
client [44] (testset)   loss: 0.6285 -> 0.4321  accuracy: 80.54% -> 85.95%     
client [8]  (testset)   loss: 0.6650 -> 0.5238  accuracy: 74.82% -> 78.42%     
client [31] (testset)   loss: 0.7421 -> 0.6087  accuracy: 75.18% -> 76.98%     
client [47] (testset)   loss: 0.6250 -> 0.3914  accuracy: 79.20% -> 87.20%     
client [36] (testset)   loss: 0.6349 -> 0.7217  accuracy: 76.60% -> 70.92%     
client [20] (testset)   loss: 0.6095 -> 0.8631  accuracy: 75.00% -> 71.43%     
client [56] (testset)   loss: 0.6216 -> 0.4887  accuracy: 74.42% -> 85.27%     
---------------------------- TRAINING EPOCH: 50 ----------------------------   
client [4]  (testset)   loss: 0.9179 -> 0.8530  accuracy: 63.31% -> 63.31%     
client [60] (testset)   loss: 0.4627 -> 0.3441  accuracy: 86.46% -> 89.52%     
client [28] (testset)   loss: 0.9274 -> 0.6794  accuracy: 58.42% -> 78.22%     
client [25] (testset)   loss: 0.4427 -> 0.4658  accuracy: 84.23% -> 83.15%     
client [58] (testset)   loss: 0.8218 -> 0.8264  accuracy: 72.36% -> 69.92%     
client [44] (testset)   loss: 0.4261 -> 0.4283  accuracy: 83.24% -> 85.41%     
client [39] (testset)   loss: 0.5639 -> 0.5439  accuracy: 78.40% -> 80.75%     
client [29] (testset)   loss: 0.7319 -> 0.6339  accuracy: 78.91% -> 74.83%     
client [3]  (testset)   loss: 0.6173 -> 0.6159  accuracy: 80.08% -> 76.10%     
client [84] (testset)   loss: 0.4827 -> 0.5261  accuracy: 84.87% -> 82.24%     
---------------------------- TRAINING EPOCH: 60 ----------------------------   
client [21] (testset)   loss: 0.6661 -> 0.5027  accuracy: 76.07% -> 84.66%     
client [84] (testset)   loss: 0.4835 -> 0.5360  accuracy: 82.24% -> 80.92%     
client [10] (testset)   loss: 0.4813 -> 0.6591  accuracy: 82.14% -> 80.61%     
client [36] (testset)   loss: 0.5779 -> 0.5556  accuracy: 77.30% -> 77.30%     
client [65] (testset)   loss: 0.4312 -> 0.4481  accuracy: 86.46% -> 86.98%     
client [81] (testset)   loss: 0.6605 -> 0.4895  accuracy: 73.57% -> 82.38%     
client [79] (testset)   loss: 0.4104 -> 0.3920  accuracy: 83.71% -> 83.26%     
client [42] (testset)   loss: 0.4501 -> 0.4605  accuracy: 86.67% -> 84.44%     
client [11] (testset)   loss: 0.4706 -> 0.4649  accuracy: 82.79% -> 82.79%     
client [96] (testset)   loss: 0.3527 -> 0.3407  accuracy: 85.80% -> 86.93%     
---------------------------- TRAINING EPOCH: 70 ----------------------------   
client [8]  (testset)   loss: 0.6765 -> 0.6203  accuracy: 74.82% -> 80.58%     
client [53] (testset)   loss: 0.4275 -> 0.4287  accuracy: 84.10% -> 84.45%     
client [52] (testset)   loss: 0.9123 -> 0.5546  accuracy: 60.45% -> 78.53%     
client [42] (testset)   loss: 0.4748 -> 0.4331  accuracy: 82.22% -> 85.56%     
client [69] (testset)   loss: 0.3994 -> 0.3962  accuracy: 84.93% -> 84.93%     
client [59] (testset)   loss: 0.3027 -> 0.2437  accuracy: 87.96% -> 89.01%     
client [7]  (testset)   loss: 0.8809 -> 0.6314  accuracy: 69.68% -> 74.19%     
client [26] (testset)   loss: 0.4560 -> 0.3610  accuracy: 86.73% -> 87.61%     
client [49] (testset)   loss: 0.5592 -> 0.5879  accuracy: 77.33% -> 72.67%     
client [98] (testset)   loss: 0.7413 -> 0.6467  accuracy: 71.98% -> 76.37%     
---------------------------- TRAINING EPOCH: 80 ----------------------------   
client [98] (testset)   loss: 1.0111 -> 1.6742  accuracy: 70.88% -> 56.59%     
client [47] (testset)   loss: 0.3031 -> 0.3192  accuracy: 89.60% -> 90.40%     
client [21] (testset)   loss: 0.4681 -> 0.4973  accuracy: 85.89% -> 85.28%     
client [77] (testset)   loss: 0.6487 -> 0.6080  accuracy: 77.50% -> 75.83%     
client [95] (testset)   loss: 0.4715 -> 0.4213  accuracy: 83.23% -> 86.96%     
client [91] (testset)   loss: 1.0125 -> 0.9988  accuracy: 63.98% -> 67.08%     
client [14] (testset)   loss: 0.2935 -> 0.2701  accuracy: 87.32% -> 89.20%     
client [99] (testset)   loss: 0.3444 -> 0.3397  accuracy: 90.18% -> 85.89%     
client [20] (testset)   loss: 0.6769 -> 0.6745  accuracy: 77.86% -> 75.00%     
client [39] (testset)   loss: 0.5263 -> 0.4831  accuracy: 80.28% -> 82.63%     
---------------------------- TRAINING EPOCH: 90 ----------------------------   
client [52] (testset)   loss: 0.6834 -> 0.5565  accuracy: 71.75% -> 77.40%     
client [62] (testset)   loss: 0.5307 -> 0.5285  accuracy: 80.71% -> 81.43%     
client [71] (testset)   loss: 0.3267 -> 0.2967  accuracy: 87.97% -> 88.61%     
client [97] (testset)   loss: 0.8627 -> 0.6707  accuracy: 74.80% -> 78.05%     
client [30] (testset)   loss: 0.3196 -> 0.3342  accuracy: 89.83% -> 90.68%     
client [88] (testset)   loss: 0.7963 -> 0.6961  accuracy: 72.92% -> 74.48%     
client [60] (testset)   loss: 0.3232 -> 0.2721  accuracy: 89.08% -> 91.27%     
client [82] (testset)   loss: 0.3775 -> 0.4100  accuracy: 82.74% -> 83.93%     
client [91] (testset)   loss: 0.8427 -> 0.6328  accuracy: 67.70% -> 72.67%     
client [57] (testset)   loss: 0.3110 -> 0.3435  accuracy: 89.52% -> 86.29%     
---------------------------- TRAINING EPOCH: 100 ----------------------------  
client [31] (testset)   loss: 0.7191 -> 0.5518  accuracy: 75.18% -> 81.29%     
client [15] (testset)   loss: 0.3134 -> 0.3435  accuracy: 90.24% -> 87.80%     
client [71] (testset)   loss: 0.3266 -> 0.2884  accuracy: 89.87% -> 89.87%     
client [97] (testset)   loss: 0.6713 -> 0.7121  accuracy: 77.24% -> 76.42%     
client [53] (testset)   loss: 0.3961 -> 0.3764  accuracy: 87.63% -> 87.28%     
client [77] (testset)   loss: 0.5804 -> 0.5488  accuracy: 78.33% -> 76.67%     
client [76] (testset)   loss: 0.3470 -> 0.3516  accuracy: 88.27% -> 87.71%     
client [79] (testset)   loss: 0.4017 -> 0.3673  accuracy: 86.43% -> 85.52%     
client [28] (testset)   loss: 0.5394 -> 0.5409  accuracy: 84.16% -> 83.17%     
client [99] (testset)   loss: 0.3159 -> 0.3424  accuracy: 89.57% -> 88.34%     
---------------------------- TRAINING EPOCH: 110 ----------------------------  
client [97] (testset)   loss: 0.6511 -> 0.6598  accuracy: 77.24% -> 78.05%     
client [86] (testset)   loss: 0.2643 -> 0.2532  accuracy: 90.53% -> 90.53%     
client [34] (testset)   loss: 0.3050 -> 0.3326  accuracy: 89.53% -> 89.53%     
client [73] (testset)   loss: 0.4122 -> 1.7046  accuracy: 88.59% -> 61.07%     
client [5]  (testset)   loss: 0.4511 -> 0.5717  accuracy: 81.67% -> 75.83%     
client [96] (testset)   loss: 0.4195 -> 0.4080  accuracy: 89.20% -> 85.80%     
client [22] (testset)   loss: 0.5079 -> 0.4397  accuracy: 83.33% -> 84.78%     
client [60] (testset)   loss: 0.2583 -> 0.2590  accuracy: 90.83% -> 90.83%     
client [66] (testset)   loss: 0.3993 -> 0.3579  accuracy: 81.90% -> 89.66%     
client [83] (testset)   loss: 0.6033 -> 0.5277  accuracy: 80.15% -> 83.52%     
---------------------------- TRAINING EPOCH: 120 ----------------------------  
client [76] (testset)   loss: 0.3272 -> 0.3526  accuracy: 87.71% -> 88.27%     
client [65] (testset)   loss: 0.4047 -> 0.4118  accuracy: 85.94% -> 84.38%     
client [95] (testset)   loss: 0.3608 -> 0.4140  accuracy: 88.82% -> 86.34%     
client [17] (testset)   loss: 0.1749 -> 0.1837  accuracy: 94.90% -> 92.86%     
client [8]  (testset)   loss: 0.4673 -> 0.6750  accuracy: 84.89% -> 75.54%     
client [35] (testset)   loss: 0.2471 -> 0.2699  accuracy: 92.72% -> 91.39%     
client [98] (testset)   loss: 0.9607 -> 0.6428  accuracy: 69.78% -> 75.82%     
client [53] (testset)   loss: 0.3680 -> 0.3264  accuracy: 85.51% -> 88.69%     
client [43] (testset)   loss: 0.2705 -> 0.2084  accuracy: 89.87% -> 89.87%     
client [64] (testset)   loss: 0.4852 -> 0.5883  accuracy: 81.74% -> 79.04%     
---------------------------- TRAINING EPOCH: 130 ----------------------------  
client [21] (testset)   loss: 0.4357 -> 0.4447  accuracy: 87.73% -> 86.50%     
client [88] (testset)   loss: 0.9126 -> 0.5831  accuracy: 75.00% -> 82.81%     
client [38] (testset)   loss: 0.8728 -> 0.4948  accuracy: 71.22% -> 84.17%     
client [3]  (testset)   loss: 0.5225 -> 0.4776  accuracy: 80.88% -> 84.06%     
client [5]  (testset)   loss: 0.3786 -> 0.4014  accuracy: 85.00% -> 85.83%     
client [41] (testset)   loss: 0.5152 -> 0.5589  accuracy: 77.52% -> 79.07%     
client [7]  (testset)   loss: 0.5956 -> 0.6325  accuracy: 76.13% -> 72.90%     
client [37] (testset)   loss: 0.4267 -> 0.3553  accuracy: 87.10% -> 89.68%     
client [45] (testset)   loss: 0.5218 -> 0.4608  accuracy: 84.86% -> 85.78%     
client [47] (testset)   loss: 0.4141 -> 0.2651  accuracy: 85.60% -> 92.80%     
---------------------------- TRAINING EPOCH: 140 ----------------------------  
client [16] (testset)   loss: 0.1406 -> 0.1668  accuracy: 95.77% -> 93.12%     
client [11] (testset)   loss: 0.4361 -> 0.4099  accuracy: 84.43% -> 83.61%     
client [37] (testset)   loss: 0.3552 -> 0.3768  accuracy: 89.03% -> 89.68%     
client [41] (testset)   loss: 0.6723 -> 0.5901  accuracy: 76.74% -> 75.97%     
client [95] (testset)   loss: 0.3585 -> 0.3556  accuracy: 89.44% -> 90.68%     
client [53] (testset)   loss: 0.3179 -> 0.3499  accuracy: 88.34% -> 86.93%     
client [22] (testset)   loss: 0.4436 -> 0.4576  accuracy: 85.51% -> 85.51%     
client [25] (testset)   loss: 0.2659 -> 0.3413  accuracy: 89.61% -> 86.74%     
client [69] (testset)   loss: 0.3639 -> 0.3498  accuracy: 83.56% -> 83.56%     
client [46] (testset)   loss: 0.3611 -> 0.3848  accuracy: 84.33% -> 83.58%     
---------------------------- TRAINING EPOCH: 150 ----------------------------  
client [47] (testset)   loss: 0.2744 -> 0.2601  accuracy: 90.40% -> 90.40%     
client [69] (testset)   loss: 0.3560 -> 0.3455  accuracy: 84.93% -> 84.93%     
client [82] (testset)   loss: 0.3669 -> 0.3493  accuracy: 85.71% -> 87.50%     
client [45] (testset)   loss: 0.4843 -> 0.4639  accuracy: 86.24% -> 85.78%     
client [7]  (testset)   loss: 0.5565 -> 0.5493  accuracy: 79.35% -> 75.48%     
client [50] (testset)   loss: 0.5492 -> 0.4948  accuracy: 82.43% -> 82.85%     
client [35] (testset)   loss: 0.2686 -> 0.2598  accuracy: 91.39% -> 88.74%     
client [24] (testset)   loss: 0.2626 -> 0.2551  accuracy: 89.38% -> 89.82%     
client [15] (testset)   loss: 0.3157 -> 0.2956  accuracy: 89.63% -> 89.63%     
client [58] (testset)   loss: 0.7247 -> 0.8141  accuracy: 73.17% -> 71.95%     
---------------------------- TRAINING EPOCH: 160 ----------------------------  
client [48] (testset)   loss: 0.2875 -> 0.3014  accuracy: 89.11% -> 90.10%     
client [76] (testset)   loss: 0.3254 -> 0.3095  accuracy: 88.83% -> 88.83%     
client [67] (testset)   loss: 0.4272 -> 0.3772  accuracy: 86.21% -> 87.93%     
client [37] (testset)   loss: 0.4333 -> 0.3369  accuracy: 87.74% -> 89.68%     
client [58] (testset)   loss: 0.6173 -> 0.8378  accuracy: 76.02% -> 71.95%     
client [64] (testset)   loss: 0.4318 -> 0.5103  accuracy: 82.93% -> 81.14%     
client [77] (testset)   loss: 0.5164 -> 0.5433  accuracy: 75.83% -> 80.83%     
client [55] (testset)   loss: 0.6270 -> 0.5631  accuracy: 84.27% -> 80.65%     
client [12] (testset)   loss: 0.8438 -> 0.8283  accuracy: 68.00% -> 66.00%     
client [89] (testset)   loss: 0.3586 -> 0.3532  accuracy: 87.59% -> 87.59%     
---------------------------- TRAINING EPOCH: 170 ----------------------------  
client [84] (testset)   loss: 0.4719 -> 0.4909  accuracy: 87.50% -> 87.50%     
client [51] (testset)   loss: 0.4657 -> 0.3693  accuracy: 81.43% -> 85.00%     
client [8]  (testset)   loss: 0.4372 -> 0.4775  accuracy: 84.89% -> 83.45%     
client [18] (testset)   loss: 0.3668 -> 0.3559  accuracy: 89.55% -> 88.06%     
client [94] (testset)   loss: 0.3730 -> 0.4069  accuracy: 85.21% -> 84.02%     
client [81] (testset)   loss: 0.5857 -> 0.4413  accuracy: 74.45% -> 83.26%     
client [3]  (testset)   loss: 0.4474 -> 0.4343  accuracy: 83.67% -> 85.66%     
client [11] (testset)   loss: 0.4027 -> 0.3812  accuracy: 84.43% -> 86.89%     
client [95] (testset)   loss: 0.4444 -> 0.3694  accuracy: 86.34% -> 90.06%     
client [67] (testset)   loss: 0.4119 -> 0.3764  accuracy: 85.06% -> 87.36%     
---------------------------- TRAINING EPOCH: 180 ----------------------------  
client [21] (testset)   loss: 0.6106 -> 0.4205  accuracy: 80.98% -> 88.34%     
client [79] (testset)   loss: 0.3512 -> 0.7107  accuracy: 85.52% -> 71.49%     
client [58] (testset)   loss: 0.5651 -> 0.5762  accuracy: 79.67% -> 80.89%     
client [88] (testset)   loss: 0.6815 -> 0.6630  accuracy: 73.96% -> 79.69%     
client [46] (testset)   loss: 0.3397 -> 0.3487  accuracy: 88.06% -> 86.57%     
client [11] (testset)   loss: 0.4103 -> 0.4194  accuracy: 85.25% -> 86.07%     
client [55] (testset)   loss: 0.4459 -> 0.5787  accuracy: 86.29% -> 82.66%     
client [13] (testset)   loss: 0.2899 -> 0.3081  accuracy: 93.16% -> 91.58%     
client [31] (testset)   loss: 0.4456 -> 0.9943  accuracy: 83.45% -> 72.66%     
client [75] (testset)   loss: 0.2487 -> 0.2448  accuracy: 88.46% -> 88.46%     
---------------------------- TRAINING EPOCH: 190 ----------------------------  
client [19] (testset)   loss: 0.2429 -> 0.2693  accuracy: 91.54% -> 91.54%     
client [7]  (testset)   loss: 0.4817 -> 0.5016  accuracy: 81.94% -> 78.71%     
client [57] (testset)   loss: 0.3367 -> 0.3383  accuracy: 87.90% -> 87.90%     
client [13] (testset)   loss: 0.3471 -> 0.3175  accuracy: 88.95% -> 91.58%     
client [43] (testset)   loss: 0.1790 -> 0.1634  accuracy: 93.67% -> 92.41%     
client [91] (testset)   loss: 0.6105 -> 0.7375  accuracy: 75.16% -> 73.29%     
client [10] (testset)   loss: 0.2931 -> 0.2556  accuracy: 88.78% -> 90.82%     
client [64] (testset)   loss: 0.4480 -> 0.4612  accuracy: 83.83% -> 82.04%     
client [82] (testset)   loss: 0.3700 -> 0.3266  accuracy: 85.71% -> 87.50%     
client [22] (testset)   loss: 0.4318 -> 0.4511  accuracy: 86.23% -> 84.78%     
---------------------------- TRAINING EPOCH: 200 ----------------------------  
client [20] (testset)   loss: 0.4697 -> 0.4720  accuracy: 81.43% -> 82.14%     
client [23] (testset)   loss: 0.3468 -> 0.3583  accuracy: 86.36% -> 86.04%     
client [88] (testset)   loss: 0.6397 -> 0.9451  accuracy: 77.08% -> 72.40%     
client [98] (testset)   loss: 0.5541 -> 0.7917  accuracy: 84.07% -> 73.63%     
client [79] (testset)   loss: 0.3505 -> 0.6726  accuracy: 84.62% -> 81.00%     
client [21] (testset)   loss: 0.4719 -> 0.4249  accuracy: 86.50% -> 87.12%     
client [92] (testset)   loss: 0.4006 -> 0.4507  accuracy: 85.14% -> 84.23%     
client [56] (testset)   loss: 0.3819 -> 0.4993  accuracy: 86.82% -> 86.05%     
client [5]  (testset)   loss: 0.3234 -> 0.4598  accuracy: 90.83% -> 80.00%     
client [52] (testset)   loss: 0.3276 -> 0.3669  accuracy: 85.31% -> 85.31%     
---------------------------- TRAINING EPOCH: 210 ----------------------------  
client [67] (testset)   loss: 0.4154 -> 0.4090  accuracy: 86.21% -> 87.93%     
client [54] (testset)   loss: 0.2408 -> 0.2008  accuracy: 93.10% -> 93.10%     
client [14] (testset)   loss: 0.2302 -> 0.2138  accuracy: 92.49% -> 93.90%     
client [99] (testset)   loss: 0.2639 -> 0.2950  accuracy: 88.96% -> 88.96%     
client [36] (testset)   loss: 0.4979 -> 0.9491  accuracy: 82.27% -> 71.63%     
client [30] (testset)   loss: 0.2907 -> 0.2766  accuracy: 87.29% -> 88.98%     
client [38] (testset)   loss: 0.4972 -> 0.8711  accuracy: 83.45% -> 76.98%     
client [15] (testset)   loss: 0.2739 -> 0.2573  accuracy: 90.85% -> 92.68%     
client [6]  (testset)   loss: 0.4074 -> 0.4541  accuracy: 85.80% -> 83.52%     
client [53] (testset)   loss: 0.3044 -> 0.2894  accuracy: 90.81% -> 90.46%     
---------------------------- TRAINING EPOCH: 220 ----------------------------  
client [99] (testset)   loss: 0.2793 -> 0.2820  accuracy: 90.18% -> 90.80%     
client [6]  (testset)   loss: 0.4204 -> 0.4084  accuracy: 87.50% -> 87.50%     
client [83] (testset)   loss: 0.4832 -> 0.4636  accuracy: 82.77% -> 85.39%     
client [42] (testset)   loss: 0.4007 -> 0.4155  accuracy: 85.56% -> 85.56%     
client [34] (testset)   loss: 0.3213 -> 0.2755  accuracy: 87.43% -> 88.48%     
client [15] (testset)   loss: 0.2595 -> 0.2924  accuracy: 92.68% -> 90.24%     
client [47] (testset)   loss: 0.2571 -> 0.2531  accuracy: 89.60% -> 92.80%     
client [55] (testset)   loss: 0.4632 -> 0.4711  accuracy: 86.69% -> 85.89%     
client [51] (testset)   loss: 0.3647 -> 0.3905  accuracy: 84.29% -> 87.86%     
client [95] (testset)   loss: 0.3454 -> 0.4290  accuracy: 91.30% -> 88.82%     
---------------------------- TRAINING EPOCH: 230 ----------------------------  
client [71] (testset)   loss: 0.2596 -> 0.2475  accuracy: 91.14% -> 93.04%     
client [15] (testset)   loss: 0.2741 -> 0.2638  accuracy: 91.46% -> 91.46%     
client [33] (testset)   loss: 0.4170 -> 0.3880  accuracy: 82.32% -> 85.35%     
client [99] (testset)   loss: 0.2736 -> 0.2695  accuracy: 90.18% -> 91.41%     
client [90] (testset)   loss: 0.4089 -> 0.3229  accuracy: 84.70% -> 88.52%     
client [57] (testset)   loss: 0.3393 -> 0.3232  accuracy: 89.52% -> 89.52%     
client [27] (testset)   loss: 0.5178 -> 0.5409  accuracy: 77.78% -> 79.01%     
client [78] (testset)   loss: 0.6298 -> 0.6116  accuracy: 81.90% -> 81.90%     
client [36] (testset)   loss: 0.4543 -> 0.5173  accuracy: 83.69% -> 75.18%     
client [88] (testset)   loss: 0.8731 -> 0.5904  accuracy: 72.40% -> 81.77%     
---------------------------- TRAINING EPOCH: 240 ----------------------------  
client [70] (testset)   loss: 0.2781 -> 0.2683  accuracy: 92.16% -> 92.55%     
client [35] (testset)   loss: 0.2422 -> 0.2158  accuracy: 91.39% -> 92.72%     
client [16] (testset)   loss: 0.1257 -> 0.1236  accuracy: 95.24% -> 94.18%     
client [80] (testset)   loss: 0.6920 -> 0.6926  accuracy: 73.37% -> 74.87%     
client [38] (testset)   loss: 0.4476 -> 0.5359  accuracy: 84.89% -> 83.45%     
client [78] (testset)   loss: 0.6333 -> 0.8002  accuracy: 79.31% -> 75.00%     
client [68] (testset)   loss: 0.5637 -> 0.4773  accuracy: 79.17% -> 83.33%     
client [11] (testset)   loss: 0.3753 -> 0.4193  accuracy: 87.70% -> 86.07%     
client [64] (testset)   loss: 0.3910 -> 0.4389  accuracy: 84.73% -> 84.43%     
client [82] (testset)   loss: 0.3166 -> 0.3613  accuracy: 87.50% -> 85.12%     
---------------------------- TRAINING EPOCH: 250 ----------------------------  
client [30] (testset)   loss: 0.2678 -> 0.3447  accuracy: 88.98% -> 88.14%     
client [27] (testset)   loss: 0.6860 -> 0.5094  accuracy: 75.31% -> 78.40%     
client [74] (testset)   loss: 0.5648 -> 0.4728  accuracy: 80.84% -> 83.83%     
client [45] (testset)   loss: 0.4679 -> 0.4291  accuracy: 85.32% -> 85.78%     
client [6]  (testset)   loss: 0.3811 -> 0.3861  accuracy: 89.20% -> 86.93%     
client [36] (testset)   loss: 0.4438 -> 0.5142  accuracy: 82.98% -> 79.43%     
client [63] (testset)   loss: 0.2354 -> 0.1955  accuracy: 91.67% -> 94.17%     
client [76] (testset)   loss: 0.2993 -> 0.2778  accuracy: 89.39% -> 89.39%     
client [83] (testset)   loss: 0.5260 -> 0.4831  accuracy: 82.02% -> 83.15%     
client [86] (testset)   loss: 0.2042 -> 0.1890  accuracy: 93.68% -> 92.11%     
---------------------------- TRAINING EPOCH: 260 ----------------------------  
client [83] (testset)   loss: 0.4497 -> 0.5152  accuracy: 85.77% -> 83.15%     
client [99] (testset)   loss: 0.3369 -> 0.2627  accuracy: 89.57% -> 90.80%     
client [74] (testset)   loss: 0.4992 -> 0.4872  accuracy: 83.83% -> 83.83%     
client [73] (testset)   loss: 0.5863 -> 0.8314  accuracy: 81.88% -> 75.84%     
client [29] (testset)   loss: 0.5038 -> 0.4647  accuracy: 80.95% -> 81.63%     
client [92] (testset)   loss: 0.3834 -> 0.4413  accuracy: 86.94% -> 86.94%     
client [6]  (testset)   loss: 0.3872 -> 0.3842  accuracy: 86.93% -> 87.50%     
client [61] (testset)   loss: 0.2253 -> 0.3373  accuracy: 90.83% -> 86.24%     
client [21] (testset)   loss: 0.4666 -> 0.3902  accuracy: 85.89% -> 88.96%     
client [67] (testset)   loss: 0.3496 -> 0.4060  accuracy: 89.08% -> 86.78%     
---------------------------- TRAINING EPOCH: 270 ----------------------------  
client [83] (testset)   loss: 0.4685 -> 0.4474  accuracy: 82.77% -> 86.14%     
client [32] (testset)   loss: 0.6006 -> 0.3320  accuracy: 82.20% -> 89.83%     
client [95] (testset)   loss: 0.3526 -> 0.3731  accuracy: 91.93% -> 90.06%     
client [61] (testset)   loss: 0.2305 -> 0.2510  accuracy: 88.07% -> 87.16%     
client [27] (testset)   loss: 0.5073 -> 0.6945  accuracy: 77.78% -> 72.84%     
client [25] (testset)   loss: 0.2223 -> 0.2286  accuracy: 90.68% -> 91.40%     
client [68] (testset)   loss: 0.5238 -> 0.4801  accuracy: 81.94% -> 83.33%     
client [34] (testset)   loss: 0.2638 -> 0.2752  accuracy: 90.05% -> 89.01%     
client [71] (testset)   loss: 0.2731 -> 0.2955  accuracy: 91.77% -> 92.41%     
client [89] (testset)   loss: 0.3585 -> 0.3308  accuracy: 88.32% -> 88.32%     
---------------------------- TRAINING EPOCH: 280 ----------------------------  
client [78] (testset)   loss: 0.7633 -> 0.6182  accuracy: 78.45% -> 81.90%     
client [81] (testset)   loss: 0.3812 -> 0.3778  accuracy: 84.14% -> 84.14%     
client [51] (testset)   loss: 0.3436 -> 0.3736  accuracy: 87.86% -> 87.14%     
client [54] (testset)   loss: 0.2146 -> 0.2300  accuracy: 94.25% -> 93.10%     
client [65] (testset)   loss: 0.4145 -> 0.3571  accuracy: 86.98% -> 90.10%     
client [41] (testset)   loss: 0.6289 -> 0.5794  accuracy: 76.74% -> 79.84%     
client [11] (testset)   loss: 0.3939 -> 0.3961  accuracy: 88.52% -> 86.07%     
client [85] (testset)   loss: 0.4915 -> 0.4787  accuracy: 83.46% -> 86.47%     
client [12] (testset)   loss: 0.9439 -> 0.8212  accuracy: 69.00% -> 70.00%     
client [23] (testset)   loss: 0.3402 -> 0.3312  accuracy: 87.66% -> 87.66%     
---------------------------- TRAINING EPOCH: 290 ----------------------------  
client [16] (testset)   loss: 0.1495 -> 0.1287  accuracy: 94.18% -> 94.71%     
client [65] (testset)   loss: 0.4003 -> 0.3773  accuracy: 88.54% -> 89.58%     
client [53] (testset)   loss: 0.3119 -> 0.3301  accuracy: 89.75% -> 90.46%     
client [58] (testset)   loss: 0.6425 -> 0.7103  accuracy: 78.86% -> 74.80%     
client [72] (testset)   loss: 0.4483 -> 0.3927  accuracy: 85.71% -> 87.58%     
client [7]  (testset)   loss: 0.4169 -> 0.4977  accuracy: 83.23% -> 80.00%     
client [71] (testset)   loss: 0.2466 -> 0.2982  accuracy: 92.41% -> 89.87%     
client [59] (testset)   loss: 0.2379 -> 0.2119  accuracy: 89.53% -> 92.15%     
client [86] (testset)   loss: 0.1758 -> 0.1657  accuracy: 94.21% -> 93.68%     
client [39] (testset)   loss: 0.4141 -> 0.5276  accuracy: 86.85% -> 84.51%     
---------------------------- TRAINING EPOCH: 300 ----------------------------  
client [99] (testset)   loss: 0.2724 -> 0.2568  accuracy: 91.41% -> 91.41%     
client [7]  (testset)   loss: 0.4234 -> 0.5384  accuracy: 85.16% -> 81.94%     
client [17] (testset)   loss: 0.2082 -> 0.2172  accuracy: 91.33% -> 91.84%     
client [64] (testset)   loss: 0.3976 -> 0.5406  accuracy: 84.43% -> 82.63%     
client [37] (testset)   loss: 0.3721 -> 0.3435  accuracy: 89.03% -> 91.61%     
client [29] (testset)   loss: 0.5011 -> 0.5488  accuracy: 82.99% -> 82.99%     
client [93] (testset)   loss: 0.4720 -> 0.4766  accuracy: 82.03% -> 82.81%     
client [73] (testset)   loss: 0.8519 -> 0.5046  accuracy: 78.52% -> 87.25%     
client [40] (testset)   loss: 0.2863 -> 0.2585  accuracy: 91.67% -> 90.91%     
client [76] (testset)   loss: 0.2793 -> 0.2761  accuracy: 90.50% -> 90.50%     
---------------------------- TRAINING EPOCH: 310 ----------------------------  
client [31] (testset)   loss: 0.4395 -> 0.9101  accuracy: 86.33% -> 71.58%     
client [89] (testset)   loss: 0.3411 -> 0.3365  accuracy: 89.05% -> 89.05%     
client [77] (testset)   loss: 0.4905 -> 0.4899  accuracy: 80.83% -> 80.00%     
client [90] (testset)   loss: 0.2779 -> 0.3812  accuracy: 89.62% -> 85.25%     
client [26] (testset)   loss: 0.3362 -> 0.3503  accuracy: 89.38% -> 89.38%     
client [50] (testset)   loss: 0.4293 -> 0.4079  accuracy: 86.61% -> 87.03%     
client [30] (testset)   loss: 0.2694 -> 0.2813  accuracy: 90.68% -> 90.68%     
client [70] (testset)   loss: 0.2674 -> 0.2570  accuracy: 93.33% -> 93.33%     
client [41] (testset)   loss: 0.4114 -> 0.4746  accuracy: 82.17% -> 80.62%     
client [99] (testset)   loss: 0.2553 -> 0.2925  accuracy: 93.25% -> 90.80%     
---------------------------- TRAINING EPOCH: 320 ----------------------------  
client [68] (testset)   loss: 0.5450 -> 0.5467  accuracy: 81.94% -> 83.33%     
client [70] (testset)   loss: 0.2855 -> 0.2734  accuracy: 92.55% -> 92.94%     
client [52] (testset)   loss: 0.3859 -> 0.2929  accuracy: 87.01% -> 88.70%     
client [1]  (testset)   loss: 0.3410 -> 0.3494  accuracy: 85.19% -> 83.95%     
client [2]  (testset)   loss: 0.4147 -> 0.4219  accuracy: 84.51% -> 84.96%     
client [67] (testset)   loss: 0.3537 -> 0.3544  accuracy: 90.23% -> 89.66%     
client [92] (testset)   loss: 0.3909 -> 0.3937  accuracy: 86.49% -> 86.04%     
client [35] (testset)   loss: 0.2433 -> 0.2234  accuracy: 91.72% -> 92.72%     
client [36] (testset)   loss: 0.4677 -> 0.9262  accuracy: 82.98% -> 73.76%     
client [64] (testset)   loss: 0.4028 -> 0.4332  accuracy: 85.03% -> 85.03%     
---------------------------- TRAINING EPOCH: 330 ----------------------------  
client [44] (testset)   loss: 0.3489 -> 0.3712  accuracy: 88.11% -> 88.11%     
client [6]  (testset)   loss: 0.3771 -> 0.4443  accuracy: 89.20% -> 87.50%     
client [12] (testset)   loss: 0.9339 -> 0.9836  accuracy: 68.00% -> 68.00%     
client [55] (testset)   loss: 0.4503 -> 0.4445  accuracy: 86.29% -> 85.08%     
client [29] (testset)   loss: 0.4775 -> 0.5287  accuracy: 84.35% -> 82.99%     
client [9]  (testset)   loss: 0.4540 -> 0.4877  accuracy: 84.02% -> 82.84%     
client [43] (testset)   loss: 0.1556 -> 0.1568  accuracy: 92.41% -> 94.94%     
client [77] (testset)   loss: 0.4712 -> 0.5675  accuracy: 80.83% -> 74.17%     
client [98] (testset)   loss: 0.8860 -> 1.1471  accuracy: 70.33% -> 71.98%     
client [78] (testset)   loss: 0.5876 -> 0.6358  accuracy: 82.33% -> 81.90%     
---------------------------- TRAINING EPOCH: 340 ----------------------------  
client [92] (testset)   loss: 0.3853 -> 0.3930  accuracy: 86.94% -> 87.39%     
client [80] (testset)   loss: 0.5918 -> 0.6039  accuracy: 79.90% -> 79.90%     
client [63] (testset)   loss: 0.1997 -> 0.1820  accuracy: 90.83% -> 95.00%     
client [76] (testset)   loss: 0.2822 -> 0.2729  accuracy: 91.06% -> 90.50%     
client [78] (testset)   loss: 0.5897 -> 0.5595  accuracy: 82.76% -> 82.76%     
client [25] (testset)   loss: 0.2041 -> 0.2456  accuracy: 91.04% -> 89.61%     
client [58] (testset)   loss: 0.6826 -> 0.8086  accuracy: 77.64% -> 76.02%     
client [13] (testset)   loss: 0.2890 -> 0.3218  accuracy: 92.63% -> 90.53%     
client [17] (testset)   loss: 0.2218 -> 0.1996  accuracy: 91.84% -> 92.86%     
client [38] (testset)   loss: 0.4855 -> 0.4986  accuracy: 87.05% -> 86.33%     
---------------------------- TRAINING EPOCH: 350 ----------------------------  
client [72] (testset)   loss: 0.4782 -> 0.4769  accuracy: 85.71% -> 86.96%     
client [82] (testset)   loss: 0.3354 -> 0.3457  accuracy: 85.71% -> 85.12%     
client [86] (testset)   loss: 0.1799 -> 0.2046  accuracy: 93.16% -> 91.58%     
client [51] (testset)   loss: 0.4549 -> 0.3559  accuracy: 83.57% -> 85.71%     
client [96] (testset)   loss: 0.4304 -> 0.3579  accuracy: 88.64% -> 90.91%     
client [42] (testset)   loss: 0.4166 -> 0.4604  accuracy: 90.00% -> 87.78%     
client [55] (testset)   loss: 0.4749 -> 0.4822  accuracy: 85.89% -> 85.08%     
client [13] (testset)   loss: 0.2827 -> 0.6330  accuracy: 92.63% -> 84.74%     
client [1]  (testset)   loss: 0.4015 -> 0.3437  accuracy: 86.42% -> 86.42%     
client [12] (testset)   loss: 0.8429 -> 0.8322  accuracy: 68.00% -> 72.00%     
---------------------------- TRAINING EPOCH: 360 ----------------------------  
client [68] (testset)   loss: 0.5572 -> 0.5888  accuracy: 81.94% -> 81.94%     
client [23] (testset)   loss: 0.3445 -> 0.3576  accuracy: 88.64% -> 87.01%     
client [46] (testset)   loss: 0.3586 -> 0.3605  accuracy: 89.55% -> 88.81%     
client [41] (testset)   loss: 0.4430 -> 1.3298  accuracy: 82.17% -> 73.64%     
client [25] (testset)   loss: 0.2100 -> 0.2280  accuracy: 91.76% -> 90.32%     
client [58] (testset)   loss: 0.6804 -> 2.2542  accuracy: 80.08% -> 50.81%     
client [14] (testset)   loss: 0.1869 -> 0.1854  accuracy: 93.90% -> 93.43%     
client [33] (testset)   loss: 0.3086 -> 0.3283  accuracy: 88.89% -> 88.89%     
client [85] (testset)   loss: 0.4637 -> 0.4823  accuracy: 85.71% -> 86.47%     
client [62] (testset)   loss: 0.4616 -> 0.4807  accuracy: 86.43% -> 85.71%     
---------------------------- TRAINING EPOCH: 370 ----------------------------  
client [98] (testset)   loss: 0.5293 -> 0.5706  accuracy: 86.81% -> 86.81%     
client [63] (testset)   loss: 0.2302 -> 0.2197  accuracy: 90.00% -> 93.33%     
client [70] (testset)   loss: 0.2786 -> 0.2687  accuracy: 92.16% -> 92.16%     
client [65] (testset)   loss: 0.3987 -> 0.4039  accuracy: 90.62% -> 89.58%     
client [14] (testset)   loss: 0.1817 -> 2.4351  accuracy: 93.43% -> 67.14%     
client [73] (testset)   loss: 0.4716 -> 0.5339  accuracy: 88.59% -> 84.56%     
client [34] (testset)   loss: 0.2837 -> 0.2375  accuracy: 90.58% -> 91.62%     
client [99] (testset)   loss: 0.2922 -> 0.3333  accuracy: 90.80% -> 90.80%     
client [69] (testset)   loss: 0.3600 -> 0.3188  accuracy: 85.62% -> 86.99%     
client [46] (testset)   loss: 0.3760 -> 0.3748  accuracy: 88.06% -> 88.81%     
---------------------------- TRAINING EPOCH: 380 ----------------------------  
client [99] (testset)   loss: 0.2753 -> 0.3266  accuracy: 90.18% -> 90.80%     
client [93] (testset)   loss: 0.5496 -> 0.8761  accuracy: 84.38% -> 72.66%     
client [11] (testset)   loss: 0.3794 -> 0.3794  accuracy: 87.70% -> 88.52%     
client [58] (testset)   loss: 0.5649 -> 0.6307  accuracy: 84.15% -> 80.08%     
client [81] (testset)   loss: 0.3950 -> 0.3738  accuracy: 84.14% -> 87.22%     
client [85] (testset)   loss: 0.5241 -> 0.5983  accuracy: 87.22% -> 81.95%     
client [89] (testset)   loss: 0.3375 -> 0.3314  accuracy: 87.59% -> 89.78%     
client [45] (testset)   loss: 0.4510 -> 0.3736  accuracy: 85.32% -> 87.16%     
client [8]  (testset)   loss: 0.4657 -> 0.5153  accuracy: 85.61% -> 88.49%     
client [68] (testset)   loss: 0.6042 -> 0.6148  accuracy: 81.94% -> 81.94%     
---------------------------- TRAINING EPOCH: 390 ----------------------------  
client [67] (testset)   loss: 0.3608 -> 0.3654  accuracy: 88.51% -> 87.36%     
client [72] (testset)   loss: 0.4825 -> 0.5514  accuracy: 88.20% -> 85.71%     
client [1]  (testset)   loss: 0.3389 -> 0.3404  accuracy: 85.19% -> 86.42%     
client [78] (testset)   loss: 0.7184 -> 0.7855  accuracy: 78.88% -> 76.29%     
client [83] (testset)   loss: 0.4580 -> 0.4601  accuracy: 84.64% -> 87.27%     
client [21] (testset)   loss: 0.4381 -> 0.4514  accuracy: 88.34% -> 88.34%     
client [56] (testset)   loss: 0.3797 -> 0.5896  accuracy: 86.82% -> 80.62%     
client [44] (testset)   loss: 0.3947 -> 0.3978  accuracy: 89.19% -> 89.19%     
client [92] (testset)   loss: 0.4289 -> 0.4109  accuracy: 85.59% -> 86.04%     
client [27] (testset)   loss: 0.4983 -> 0.5232  accuracy: 83.95% -> 80.25%     
---------------------------- TRAINING EPOCH: 400 ----------------------------  
client [10] (testset)   loss: 0.2607 -> 0.2477  accuracy: 91.84% -> 92.35%     
client [39] (testset)   loss: 0.4361 -> 0.3916  accuracy: 86.85% -> 88.26%     
client [65] (testset)   loss: 0.4142 -> 0.3943  accuracy: 88.54% -> 90.62%     
client [26] (testset)   loss: 0.5031 -> 0.3317  accuracy: 86.73% -> 92.04%     
client [19] (testset)   loss: 0.2464 -> 0.2390  accuracy: 90.77% -> 90.77%     
client [68] (testset)   loss: 0.5902 -> 0.6069  accuracy: 84.72% -> 83.33%     
client [41] (testset)   loss: 0.4647 -> 0.8635  accuracy: 82.17% -> 69.77%     
client [50] (testset)   loss: 0.4597 -> 0.4856  accuracy: 87.03% -> 83.68%     
client [75] (testset)   loss: 0.2477 -> 0.3774  accuracy: 87.18% -> 85.90%     
client [81] (testset)   loss: 0.3422 -> 0.4007  accuracy: 86.78% -> 85.02%     
Training... ---------------------------------------- 100% 0:16:16
FedRep's average time taken by each global epoch: 0 min 2.42 sec.              
FedRep's total running time: 0 h 16 m 16 s.                                    
==================== FedRep Experiment Results: ====================           
Display format: (before local fine-tuning) -> (after local fine-tuning)        
 So if finetune_epoch = 0, x.xx% -> 0.00% is normal.                           
 Centralized testing ONLY happens after model aggregation, so the stats between
'->' are the same.                                                             
{                                                                              
    "100": {                                                                   
        "all_clients": {                                                       
            "test": {                                                          
                "loss": "0.4612 -> 0.0000",                                    
                "accuracy": "83.49% -> 0.00%"                                  
            }                                                                  
        }                                                                      
    },                                                                         
    "200": {                                                                   
        "all_clients": {                                                       
            "test": {                                                          
                "loss": "0.4178 -> 0.0000",                                    
                "accuracy": "85.44% -> 0.00%"                                  
            }                                                                  
        }                                                                      
    },                                                                         
    "300": {                                                                   
        "all_clients": {                                                       
            "test": {                                                          
                "loss": "0.3817 -> 0.0000",                                    
                "accuracy": "87.27% -> 0.00%"                                  
            }                                                                  
        }                                                                      
    },                                                                         
    "400": {                                                                   
        "all_clients": {                                                       
            "test": {                                                          
                "loss": "0.3994 -> 0.0000",                                    
                "accuracy": "87.61% -> 0.00%"                                  
            }                                                                  
        }                                                                      
    }                                                                          
}                                                                              
==================== FedRep Max Accuracy ====================                  
all_clients:                                                                   
(test) before fine-tuning: 87.61% at epoch 400                                 
(test) after fine-tuning: 0.00% at epoch 100                                   
[0m