==================== FedRoD ====================                               
Experiment Arguments:                                                          
{
│   'method': 'fedrod',
│   'dataset': {
│   │   'name': 'svhn',
│   │   'client_num': 100,
│   │   'test_ratio': 0.25,
│   │   'val_ratio': 0.0,
│   │   'seed': 42,
│   │   'split': 'sample',
│   │   'IID_ratio': 0.0,
│   │   'monitor_window_name_suffix': 'svhn-100clients-0%IID-Dir(1.0)-seed42',
│   │   'alpha': 1.0,
│   │   'min_samples_per_client': 10
│   },
│   'model': {
│   │   'name': 'avgcnn',
│   │   'use_torchvision_pretrained_weights': True,
│   │   'external_model_weights_path': None
│   },
│   'optimizer': {
│   │   'lr': 0.01,
│   │   'dampening': 0,
│   │   'weight_decay': 0,
│   │   'momentum': 0,
│   │   'nesterov': False,
│   │   'name': 'sgd'
│   },
│   'mode': 'serial',
│   'parallel': {
│   │   'ray_cluster_addr': None,
│   │   'num_cpus': None,
│   │   'num_gpus': None,
│   │   'num_workers': 2
│   },
│   'common': {
│   │   'seed': 42,
│   │   'join_ratio': 0.1,
│   │   'global_epoch': 400,
│   │   'local_epoch': 5,
│   │   'batch_size': 32,
│   │   'reset_optimizer_on_global_epoch': True,
│   │   'straggler_ratio': 0,
│   │   'straggler_min_local_epoch': 0,
│   │   'buffers': 'global',
│   │   'client_side_evaluation': True,
│   │   'test': {
│   │   │   'client': {
│   │   │   │   'interval': 100,
│   │   │   │   'finetune_epoch': 0,
│   │   │   │   'train': False,
│   │   │   │   'val': False,
│   │   │   │   'test': True
│   │   │   },
│   │   │   'server': {
│   │   │   │   'interval': -1,
│   │   │   │   'train': False,
│   │   │   │   'val': False,
│   │   │   │   'test': False,
│   │   │   │   'model_in_train_mode': False
│   │   │   }
│   │   },
│   │   'verbose_gap': 10,
│   │   'monitor': None,
│   │   'use_cuda': True,
│   │   'save_log': True,
│   │   'save_model': False,
│   │   'save_learning_curve_plot': False,
│   │   'save_metrics': True,
│   │   'delete_useless_run': True
│   },
│   'fedrod': {
│   │   'gamma': 1,
│   │   'hyper': 0,
│   │   'hyper_lr': 0.1,
│   │   'hyper_hidden_dim': 32,
│   │   'eval_per': 1
│   }
}
---------------------------- TRAINING EPOCH: 10 ----------------------------   
client [77] (testset)   loss: 0.4133 -> 0.4890  accuracy: 90.03% -> 89.74%     
client [81] (testset)   loss: 0.4416 -> 0.5268  accuracy: 86.80% -> 84.26%     
client [21] (testset)   loss: 0.7711 -> 0.4508  accuracy: 83.44% -> 89.40%     
client [68] (testset)   loss: 0.7750 -> 0.5953  accuracy: 88.31% -> 87.10%     
client [93] (testset)   loss: 0.2797 -> 0.2976  accuracy: 93.93% -> 94.22%     
client [31] (testset)   loss: 0.3030 -> 0.2079  accuracy: 92.00% -> 92.67%     
client [20] (testset)   loss: 0.7121 -> 0.7878  accuracy: 84.62% -> 85.71%     
client [59] (testset)   loss: 0.7478 -> 0.4688  accuracy: 83.65% -> 88.68%     
client [48] (testset)   loss: 0.4964 -> 0.5173  accuracy: 84.84% -> 87.10%     
client [34] (testset)   loss: 0.7288 -> 0.5608  accuracy: 84.77% -> 84.26%     
---------------------------- TRAINING EPOCH: 20 ----------------------------   
client [69] (testset)   loss: 0.3870 -> 0.3671  accuracy: 89.66% -> 91.38%     
client [99] (testset)   loss: 0.4175 -> 0.3990  accuracy: 92.28% -> 92.98%     
client [67] (testset)   loss: 0.2721 -> 0.2565  accuracy: 92.75% -> 93.48%     
client [0]  (testset)   loss: 0.1567 -> 0.1486  accuracy: 95.22% -> 95.65%     
client [76] (testset)   loss: 0.1906 -> 0.2410  accuracy: 93.94% -> 93.94%     
client [41] (testset)   loss: 0.4610 -> 0.4353  accuracy: 89.96% -> 92.47%     
client [62] (testset)   loss: 0.4950 -> 0.3073  accuracy: 88.24% -> 91.60%     
client [2]  (testset)   loss: 0.4657 -> 0.3475  accuracy: 88.93% -> 90.71%     
client [14] (testset)   loss: 0.3416 -> 0.3142  accuracy: 91.88% -> 91.25%     
client [46] (testset)   loss: 0.1473 -> 0.1586  accuracy: 96.18% -> 95.42%     
---------------------------- TRAINING EPOCH: 30 ----------------------------   
client [24] (testset)   loss: 0.3470 -> 0.3507  accuracy: 89.66% -> 89.66%     
client [68] (testset)   loss: 0.5681 -> 0.5129  accuracy: 87.90% -> 88.31%     
client [57] (testset)   loss: 0.4061 -> 0.4303  accuracy: 91.85% -> 91.11%     
client [17] (testset)   loss: 0.6530 -> 0.6440  accuracy: 87.23% -> 88.51%     
client [54] (testset)   loss: 0.5315 -> 0.5344  accuracy: 87.46% -> 87.46%     
client [23] (testset)   loss: 0.7843 -> 0.4274  accuracy: 86.44% -> 91.53%     
client [35] (testset)   loss: 0.6252 -> 0.5298  accuracy: 86.47% -> 88.33%     
client [59] (testset)   loss: 0.4947 -> 0.4718  accuracy: 91.19% -> 92.45%     
client [31] (testset)   loss: 0.2226 -> 0.2220  accuracy: 92.67% -> 94.00%     
client [9]  (testset)   loss: 0.1336 -> 0.1412  accuracy: 96.79% -> 96.07%     
---------------------------- TRAINING EPOCH: 40 ----------------------------   
client [64] (testset)   loss: 0.3374 -> 0.3253  accuracy: 92.57% -> 92.57%     
client [33] (testset)   loss: 0.6075 -> 0.5837  accuracy: 92.39% -> 92.12%     
client [16] (testset)   loss: 0.3839 -> 0.4091  accuracy: 92.71% -> 91.96%     
client [44] (testset)   loss: 0.4150 -> 0.3559  accuracy: 91.30% -> 91.58%     
client [8]  (testset)   loss: 0.4438 -> 0.4275  accuracy: 88.71% -> 89.78%     
client [31] (testset)   loss: 0.2353 -> 0.2286  accuracy: 92.67% -> 92.67%     
client [47] (testset)   loss: 0.2623 -> 0.2551  accuracy: 92.34% -> 93.87%     
client [36] (testset)   loss: 0.3587 -> 0.3571  accuracy: 93.10% -> 92.82%     
client [20] (testset)   loss: 0.7951 -> 0.7959  accuracy: 87.91% -> 86.81%     
client [56] (testset)   loss: 0.4329 -> 0.4199  accuracy: 91.23% -> 90.35%     
---------------------------- TRAINING EPOCH: 50 ----------------------------   
client [4]  (testset)   loss: 0.3220 -> 0.3628  accuracy: 90.71% -> 91.43%     
client [60] (testset)   loss: 0.4572 -> 0.3473  accuracy: 88.73% -> 87.75%     
client [28] (testset)   loss: 0.3488 -> 0.3295  accuracy: 92.68% -> 92.68%     
client [25] (testset)   loss: 0.7804 -> 0.8512  accuracy: 88.74% -> 85.59%     
client [58] (testset)   loss: 0.4207 -> 0.4147  accuracy: 89.77% -> 89.77%     
client [44] (testset)   loss: 0.3434 -> 0.3452  accuracy: 92.93% -> 92.12%     
client [39] (testset)   loss: 0.5203 -> 0.4922  accuracy: 89.42% -> 89.90%     
client [29] (testset)   loss: 0.3871 -> 0.3867  accuracy: 91.99% -> 91.35%     
client [3]  (testset)   loss: 0.3374 -> 0.3626  accuracy: 91.75% -> 92.44%     
client [84] (testset)   loss: 0.3640 -> 0.4225  accuracy: 92.90% -> 92.35%     
---------------------------- TRAINING EPOCH: 60 ----------------------------   
client [21] (testset)   loss: 0.3572 -> 0.3916  accuracy: 92.38% -> 91.39%     
client [84] (testset)   loss: 0.3839 -> 0.4068  accuracy: 93.99% -> 92.90%     
client [10] (testset)   loss: 0.3875 -> 0.3831  accuracy: 93.85% -> 93.33%     
client [36] (testset)   loss: 0.3852 -> 0.3742  accuracy: 93.97% -> 94.54%     
client [65] (testset)   loss: 0.3750 -> 0.3617  accuracy: 92.94% -> 94.12%     
client [81] (testset)   loss: 0.3259 -> 0.3630  accuracy: 90.36% -> 91.37%     
client [79] (testset)   loss: 0.4263 -> 0.4327  accuracy: 92.29% -> 92.52%     
client [42] (testset)   loss: 0.3347 -> 0.3719  accuracy: 92.36% -> 91.40%     
client [11] (testset)   loss: 0.4762 -> 0.4969  accuracy: 91.33% -> 91.91%     
client [96] (testset)   loss: 0.3646 -> 0.4009  accuracy: 92.41% -> 92.41%     
---------------------------- TRAINING EPOCH: 70 ----------------------------   
client [8]  (testset)   loss: 0.4869 -> 0.5281  accuracy: 89.25% -> 89.78%     
client [53] (testset)   loss: 0.8499 -> 0.9207  accuracy: 91.33% -> 89.33%     
client [52] (testset)   loss: 0.5121 -> 0.5521  accuracy: 90.63% -> 90.38%     
client [42] (testset)   loss: 0.3392 -> 0.3558  accuracy: 92.04% -> 92.36%     
client [69] (testset)   loss: 0.3191 -> 0.2990  accuracy: 92.67% -> 93.53%     
client [59] (testset)   loss: 0.6882 -> 0.5769  accuracy: 89.94% -> 91.19%     
client [7]  (testset)   loss: 0.3840 -> 0.3811  accuracy: 93.42% -> 93.00%     
client [26] (testset)   loss: 0.5690 -> 0.5165  accuracy: 92.33% -> 92.01%     
client [49] (testset)   loss: 0.1942 -> 0.1809  accuracy: 95.03% -> 95.65%     
client [98] (testset)   loss: 0.3633 -> 0.3380  accuracy: 92.31% -> 91.88%     
---------------------------- TRAINING EPOCH: 80 ----------------------------   
client [98] (testset)   loss: 0.4114 -> 0.4113  accuracy: 92.31% -> 92.74%     
client [47] (testset)   loss: 0.2797 -> 0.2300  accuracy: 94.64% -> 95.02%     
client [21] (testset)   loss: 0.4192 -> 0.4338  accuracy: 93.05% -> 92.38%     
client [77] (testset)   loss: 0.4905 -> 0.4760  accuracy: 90.62% -> 92.38%     
client [95] (testset)   loss: 0.4901 -> 0.5002  accuracy: 93.51% -> 92.97%     
client [91] (testset)   loss: 0.2063 -> 0.2010  accuracy: 93.06% -> 94.22%     
client [14] (testset)   loss: 0.2973 -> 0.2897  accuracy: 93.12% -> 94.38%     
client [99] (testset)   loss: 0.5151 -> 0.5208  accuracy: 93.33% -> 92.98%     
client [20] (testset)   loss: 0.7819 -> 0.8067  accuracy: 89.01% -> 87.91%     
client [39] (testset)   loss: 0.6754 -> 0.6537  accuracy: 89.90% -> 89.90%     
---------------------------- TRAINING EPOCH: 90 ----------------------------   
client [52] (testset)   loss: 0.5124 -> 0.5847  accuracy: 90.63% -> 90.38%     
client [62] (testset)   loss: 0.2951 -> 0.2797  accuracy: 93.70% -> 93.28%     
client [71] (testset)   loss: 0.2290 -> 0.2181  accuracy: 93.53% -> 93.53%     
client [97] (testset)   loss: 0.4192 -> 0.4253  accuracy: 91.44% -> 90.91%     
client [30] (testset)   loss: 0.4140 -> 0.4088  accuracy: 92.65% -> 93.38%     
client [88] (testset)   loss: 0.6309 -> 0.6416  accuracy: 90.10% -> 90.10%     
client [60] (testset)   loss: 0.4667 -> 0.4346  accuracy: 91.18% -> 90.20%     
client [82] (testset)   loss: 0.5002 -> 0.4976  accuracy: 90.28% -> 90.28%     
client [91] (testset)   loss: 0.1923 -> 0.2035  accuracy: 92.49% -> 91.91%     
client [57] (testset)   loss: 0.4198 -> 0.4271  accuracy: 90.37% -> 90.37%     
---------------------------- TRAINING EPOCH: 100 ----------------------------  
client [31] (testset)   loss: 0.2315 -> 0.2128  accuracy: 91.33% -> 94.00%     
client [15] (testset)   loss: 0.6275 -> 0.5961  accuracy: 89.10% -> 89.57%     
client [71] (testset)   loss: 0.1520 -> 0.1631  accuracy: 94.83% -> 94.83%     
client [97] (testset)   loss: 0.4359 -> 0.4362  accuracy: 94.12% -> 93.05%     
client [53] (testset)   loss: 0.8215 -> 0.8448  accuracy: 92.00% -> 92.67%     
client [77] (testset)   loss: 0.5076 -> 0.5249  accuracy: 91.20% -> 92.96%     
client [76] (testset)   loss: 0.2652 -> 0.2479  accuracy: 94.70% -> 94.70%     
client [79] (testset)   loss: 0.4526 -> 0.4342  accuracy: 93.69% -> 94.16%     
client [28] (testset)   loss: 0.4560 -> 0.4232  accuracy: 92.68% -> 92.68%     
client [99] (testset)   loss: 0.4952 -> 0.5267  accuracy: 91.58% -> 91.23%     
---------------------------- TRAINING EPOCH: 110 ----------------------------  
client [97] (testset)   loss: 0.4512 -> 0.4413  accuracy: 91.98% -> 91.98%     
client [86] (testset)   loss: 0.7331 -> 0.7077  accuracy: 92.95% -> 92.95%     
client [34] (testset)   loss: 0.4997 -> 0.5326  accuracy: 89.34% -> 88.83%     
client [73] (testset)   loss: 0.4988 -> 0.5077  accuracy: 92.64% -> 92.94%     
client [5]  (testset)   loss: 0.5343 -> 0.5309  accuracy: 89.66% -> 90.15%     
client [96] (testset)   loss: 0.3268 -> 0.3557  accuracy: 91.77% -> 91.77%     
client [22] (testset)   loss: 0.6064 -> 0.6020  accuracy: 91.69% -> 92.00%     
client [60] (testset)   loss: 0.3988 -> 0.3925  accuracy: 90.20% -> 90.69%     
client [66] (testset)   loss: 0.3973 -> 0.3983  accuracy: 94.27% -> 93.58%     
client [83] (testset)   loss: 0.5587 -> 0.6161  accuracy: 90.76% -> 89.67%     
---------------------------- TRAINING EPOCH: 120 ----------------------------  
client [76] (testset)   loss: 0.2560 -> 0.2524  accuracy: 95.45% -> 95.45%     
client [65] (testset)   loss: 0.3725 -> 0.3882  accuracy: 92.94% -> 92.65%     
client [95] (testset)   loss: 0.4845 -> 0.4865  accuracy: 91.08% -> 91.35%     
client [17] (testset)   loss: 0.6352 -> 0.6652  accuracy: 92.77% -> 92.77%     
client [8]  (testset)   loss: 0.5626 -> 0.5995  accuracy: 87.63% -> 88.17%     
client [35] (testset)   loss: 0.5922 -> 0.5961  accuracy: 89.66% -> 89.66%     
client [98] (testset)   loss: 0.4171 -> 0.4253  accuracy: 91.88% -> 91.45%     
client [53] (testset)   loss: 0.8005 -> 0.7976  accuracy: 91.33% -> 92.00%     
client [43] (testset)   loss: 0.9496 -> 0.9408  accuracy: 88.46% -> 88.46%     
client [64] (testset)   loss: 0.3042 -> 0.2992  accuracy: 94.59% -> 94.59%     
---------------------------- TRAINING EPOCH: 130 ----------------------------  
client [21] (testset)   loss: 0.4516 -> 0.4374  accuracy: 92.05% -> 91.39%     
client [88] (testset)   loss: 0.6321 -> 0.6196  accuracy: 90.10% -> 90.59%     
client [38] (testset)   loss: 0.4656 -> 0.4834  accuracy: 92.34% -> 92.70%     
client [3]  (testset)   loss: 0.3507 -> 0.3641  accuracy: 93.47% -> 93.13%     
client [5]  (testset)   loss: 0.5158 -> 0.5273  accuracy: 89.16% -> 88.67%     
client [41] (testset)   loss: 0.4482 -> 0.4611  accuracy: 94.56% -> 94.56%     
client [7]  (testset)   loss: 0.4229 -> 0.4310  accuracy: 93.83% -> 92.59%     
client [37] (testset)   loss: 0.8097 -> 0.8332  accuracy: 91.13% -> 91.13%     
client [45] (testset)   loss: 0.5244 -> 0.5605  accuracy: 92.78% -> 92.02%     
client [47] (testset)   loss: 0.3224 -> 0.2896  accuracy: 94.25% -> 95.40%     
---------------------------- TRAINING EPOCH: 140 ----------------------------  
client [16] (testset)   loss: 0.4272 -> 0.4183  accuracy: 93.72% -> 93.22%     
client [11] (testset)   loss: 0.5120 -> 0.4993  accuracy: 91.33% -> 91.33%     
client [37] (testset)   loss: 0.8491 -> 0.8678  accuracy: 90.15% -> 89.66%     
client [41] (testset)   loss: 0.5034 -> 0.4979  accuracy: 94.56% -> 94.14%     
client [95] (testset)   loss: 0.4783 -> 0.4802  accuracy: 91.35% -> 93.24%     
client [53] (testset)   loss: 0.8477 -> 0.8389  accuracy: 90.67% -> 90.67%     
client [22] (testset)   loss: 0.5838 -> 0.5873  accuracy: 91.69% -> 92.92%     
client [25] (testset)   loss: 1.0797 -> 1.0314  accuracy: 90.09% -> 90.09%     
client [69] (testset)   loss: 0.3844 -> 0.3607  accuracy: 92.24% -> 92.24%     
client [46] (testset)   loss: 0.1896 -> 0.2076  accuracy: 94.27% -> 93.89%     
---------------------------- TRAINING EPOCH: 150 ----------------------------  
client [47] (testset)   loss: 0.2693 -> 0.2697  accuracy: 94.64% -> 95.40%     
client [69] (testset)   loss: 0.3545 -> 0.3608  accuracy: 93.97% -> 92.67%     
client [82] (testset)   loss: 0.5548 -> 0.5542  accuracy: 90.97% -> 91.67%     
client [45] (testset)   loss: 0.5769 -> 0.5915  accuracy: 92.02% -> 92.02%     
client [7]  (testset)   loss: 0.4492 -> 0.4334  accuracy: 93.42% -> 91.77%     
client [50] (testset)   loss: 0.5548 -> 0.5380  accuracy: 90.50% -> 90.50%     
client [35] (testset)   loss: 0.6184 -> 0.6272  accuracy: 89.92% -> 89.92%     
client [24] (testset)   loss: 0.3268 -> 0.3380  accuracy: 91.38% -> 91.38%     
client [15] (testset)   loss: 0.6745 -> 0.7497  accuracy: 91.94% -> 91.00%     
client [58] (testset)   loss: 0.6460 -> 0.6331  accuracy: 91.63% -> 91.63%     
---------------------------- TRAINING EPOCH: 160 ----------------------------  
client [48] (testset)   loss: 0.5573 -> 0.5543  accuracy: 90.00% -> 90.32%     
client [76] (testset)   loss: 0.3048 -> 0.3080  accuracy: 95.45% -> 95.45%     
client [67] (testset)   loss: 0.2664 -> 0.2643  accuracy: 94.93% -> 94.93%     
client [37] (testset)   loss: 0.9636 -> 0.9517  accuracy: 88.18% -> 89.16%     
client [58] (testset)   loss: 0.6137 -> 0.6041  accuracy: 89.77% -> 89.30%     
client [64] (testset)   loss: 0.3046 -> 0.3110  accuracy: 93.92% -> 93.24%     
client [77] (testset)   loss: 0.5287 -> 0.5303  accuracy: 91.79% -> 92.08%     
client [55] (testset)   loss: 0.5159 -> 0.5236  accuracy: 94.52% -> 94.52%     
client [12] (testset)   loss: 0.3084 -> 0.3353  accuracy: 93.67% -> 93.67%     
client [89] (testset)   loss: 0.3441 -> 0.3563  accuracy: 94.95% -> 94.44%     
---------------------------- TRAINING EPOCH: 170 ----------------------------  
client [84] (testset)   loss: 0.4857 -> 0.4899  accuracy: 95.63% -> 95.08%     
client [51] (testset)   loss: 0.4814 -> 0.4806  accuracy: 92.23% -> 90.78%     
client [8]  (testset)   loss: 0.5746 -> 0.5792  accuracy: 88.71% -> 87.63%     
client [18] (testset)   loss: 0.7144 -> 0.7179  accuracy: 90.85% -> 90.85%     
client [94] (testset)   loss: 0.5434 -> 0.5473  accuracy: 91.70% -> 91.70%     
client [81] (testset)   loss: 0.3601 -> 0.3743  accuracy: 93.40% -> 93.40%     
client [3]  (testset)   loss: 0.3744 -> 0.3809  accuracy: 94.50% -> 94.85%     
client [11] (testset)   loss: 0.5424 -> 0.5488  accuracy: 91.91% -> 91.91%     
client [95] (testset)   loss: 0.5472 -> 0.5473  accuracy: 92.97% -> 93.24%     
client [67] (testset)   loss: 0.2649 -> 0.2701  accuracy: 95.65% -> 95.65%     
---------------------------- TRAINING EPOCH: 180 ----------------------------  
client [21] (testset)   loss: 0.4844 -> 0.4885  accuracy: 93.05% -> 92.72%     
client [79] (testset)   loss: 0.4914 -> 0.5016  accuracy: 93.93% -> 93.69%     
client [58] (testset)   loss: 0.6604 -> 0.6592  accuracy: 89.30% -> 89.30%     
client [88] (testset)   loss: 0.6594 -> 0.6582  accuracy: 90.10% -> 89.60%     
client [46] (testset)   loss: 0.1789 -> 0.1907  accuracy: 94.27% -> 93.89%     
client [11] (testset)   loss: 0.6013 -> 0.6000  accuracy: 91.62% -> 91.91%     
client [55] (testset)   loss: 0.5542 -> 0.5529  accuracy: 93.55% -> 93.87%     
client [13] (testset)   loss: 0.3356 -> 0.3310  accuracy: 95.88% -> 95.16%     
client [31] (testset)   loss: 0.3055 -> 0.2987  accuracy: 92.67% -> 93.33%     
client [75] (testset)   loss: 0.4467 -> 0.4519  accuracy: 91.07% -> 91.79%     
---------------------------- TRAINING EPOCH: 190 ----------------------------  
client [19] (testset)   loss: 0.5536 -> 0.5541  accuracy: 92.86% -> 92.86%     
client [7]  (testset)   loss: 0.4668 -> 0.4665  accuracy: 94.24% -> 94.24%     
client [57] (testset)   loss: 0.4811 -> 0.4847  accuracy: 92.59% -> 92.59%     
client [13] (testset)   loss: 0.3403 -> 0.3389  accuracy: 95.40% -> 95.40%     
client [43] (testset)   loss: 1.2284 -> 1.2215  accuracy: 89.42% -> 90.38%     
client [91] (testset)   loss: 0.1628 -> 0.1652  accuracy: 95.95% -> 95.95%     
client [10] (testset)   loss: 0.4158 -> 0.4188  accuracy: 94.36% -> 94.36%     
client [64] (testset)   loss: 0.3277 -> 0.3286  accuracy: 93.92% -> 93.92%     
client [82] (testset)   loss: 0.6128 -> 0.6122  accuracy: 90.97% -> 90.97%     
client [22] (testset)   loss: 0.7286 -> 0.7236  accuracy: 92.62% -> 92.31%     
---------------------------- TRAINING EPOCH: 200 ----------------------------  
client [20] (testset)   loss: 0.9837 -> 0.9855  accuracy: 87.91% -> 87.91%     
client [23] (testset)   loss: 0.6348 -> 0.6341  accuracy: 91.53% -> 91.10%     
client [88] (testset)   loss: 0.6696 -> 0.6716  accuracy: 90.10% -> 90.10%     
client [98] (testset)   loss: 0.5107 -> 0.5101  accuracy: 91.88% -> 91.88%     
client [79] (testset)   loss: 0.4903 -> 0.4929  accuracy: 94.63% -> 94.63%     
client [21] (testset)   loss: 0.4586 -> 0.4764  accuracy: 91.72% -> 92.05%     
client [92] (testset)   loss: 0.8474 -> 0.8399  accuracy: 92.11% -> 92.63%     
client [56] (testset)   loss: 0.5036 -> 0.5005  accuracy: 93.27% -> 93.27%     
client [5]  (testset)   loss: 0.6506 -> 0.6598  accuracy: 88.67% -> 88.67%     
client [52] (testset)   loss: 0.6273 -> 0.6327  accuracy: 90.63% -> 90.89%     
---------------------------- TRAINING EPOCH: 210 ----------------------------  
client [67] (testset)   loss: 0.3214 -> 0.3221  accuracy: 94.93% -> 94.93%     
client [54] (testset)   loss: 0.6434 -> 0.6406  accuracy: 89.77% -> 89.77%     
client [14] (testset)   loss: 0.2809 -> 0.2796  accuracy: 93.12% -> 93.12%     
client [99] (testset)   loss: 0.6315 -> 0.6303  accuracy: 93.68% -> 93.68%     
client [36] (testset)   loss: 0.4521 -> 0.4483  accuracy: 94.25% -> 94.25%     
client [30] (testset)   loss: 0.3668 -> 0.3683  accuracy: 93.38% -> 93.38%     
client [38] (testset)   loss: 0.5711 -> 0.5737  accuracy: 92.34% -> 91.97%     
client [15] (testset)   loss: 0.6750 -> 0.6776  accuracy: 91.47% -> 91.00%     
client [6]  (testset)   loss: 0.4851 -> 0.4855  accuracy: 96.04% -> 96.04%     
client [53] (testset)   loss: 0.9406 -> 0.9419  accuracy: 92.67% -> 92.67%     
---------------------------- TRAINING EPOCH: 220 ----------------------------  
client [99] (testset)   loss: 0.6602 -> 0.6584  accuracy: 93.68% -> 93.68%     
client [6]  (testset)   loss: 0.5122 -> 0.5129  accuracy: 95.81% -> 96.04%     
client [83] (testset)   loss: 0.6492 -> 0.6507  accuracy: 90.76% -> 90.76%     
client [42] (testset)   loss: 0.4338 -> 0.4349  accuracy: 92.36% -> 92.68%     
client [34] (testset)   loss: 0.7066 -> 0.6998  accuracy: 87.31% -> 87.82%     
client [15] (testset)   loss: 0.6878 -> 0.6902  accuracy: 91.94% -> 91.94%     
client [47] (testset)   loss: 0.3358 -> 0.3359  accuracy: 94.64% -> 94.64%     
client [55] (testset)   loss: 0.5837 -> 0.5833  accuracy: 93.87% -> 93.87%     
client [51] (testset)   loss: 0.5344 -> 0.5384  accuracy: 91.26% -> 91.75%     
client [95] (testset)   loss: 0.5914 -> 0.5888  accuracy: 92.43% -> 92.70%     
---------------------------- TRAINING EPOCH: 230 ----------------------------  
client [71] (testset)   loss: 0.2189 -> 0.2040  accuracy: 96.55% -> 96.55%     
client [15] (testset)   loss: 0.6578 -> 0.6614  accuracy: 92.89% -> 92.89%     
client [33] (testset)   loss: 0.9818 -> 0.9702  accuracy: 92.66% -> 93.21%     
client [99] (testset)   loss: 0.6652 -> 0.6559  accuracy: 93.33% -> 93.33%     
client [90] (testset)   loss: 0.7461 -> 0.7456  accuracy: 92.17% -> 91.10%     
client [57] (testset)   loss: 0.5795 -> 0.5705  accuracy: 91.11% -> 91.11%     
client [27] (testset)   loss: 0.8234 -> 0.8200  accuracy: 92.41% -> 92.18%     
client [78] (testset)   loss: 0.5415 -> 0.5425  accuracy: 95.04% -> 95.04%     
client [36] (testset)   loss: 0.4381 -> 0.4370  accuracy: 94.83% -> 94.83%     
client [88] (testset)   loss: 0.7059 -> 0.7375  accuracy: 90.10% -> 90.59%     
---------------------------- TRAINING EPOCH: 240 ----------------------------  
client [70] (testset)   loss: 0.6770 -> 0.6727  accuracy: 90.00% -> 90.40%     
client [35] (testset)   loss: 0.7347 -> 0.7367  accuracy: 89.39% -> 89.39%     
client [16] (testset)   loss: 0.5699 -> 0.5679  accuracy: 93.72% -> 93.72%     
client [80] (testset)   loss: 0.9221 -> 0.9250  accuracy: 90.91% -> 91.34%     
client [38] (testset)   loss: 0.6178 -> 0.6180  accuracy: 91.61% -> 91.61%     
client [78] (testset)   loss: 0.5484 -> 0.5494  accuracy: 94.77% -> 94.77%     
client [68] (testset)   loss: 0.6720 -> 0.6716  accuracy: 89.92% -> 89.92%     
client [11] (testset)   loss: 0.6635 -> 0.6669  accuracy: 91.91% -> 91.91%     
client [64] (testset)   loss: 0.3471 -> 0.3488  accuracy: 93.92% -> 93.92%     
client [82] (testset)   loss: 0.6100 -> 0.6102  accuracy: 90.97% -> 90.97%     
---------------------------- TRAINING EPOCH: 250 ----------------------------  
client [30] (testset)   loss: 0.3659 -> 0.3678  accuracy: 94.49% -> 94.49%     
client [27] (testset)   loss: 0.7952 -> 0.7972  accuracy: 92.18% -> 92.18%     
client [74] (testset)   loss: 0.4807 -> 0.4820  accuracy: 90.91% -> 90.91%     
client [45] (testset)   loss: 0.6327 -> 0.6560  accuracy: 92.40% -> 93.16%     
client [6]  (testset)   loss: 0.5107 -> 0.4962  accuracy: 95.59% -> 95.59%     
client [36] (testset)   loss: 0.4438 -> 0.4465  accuracy: 94.83% -> 94.83%     
client [63] (testset)   loss: 0.3529 -> 0.3564  accuracy: 91.34% -> 91.34%     
client [76] (testset)   loss: 0.3980 -> 0.3987  accuracy: 94.70% -> 94.70%     
client [83] (testset)   loss: 0.6774 -> 0.6804  accuracy: 91.30% -> 91.30%     
client [86] (testset)   loss: 0.7866 -> 0.7831  accuracy: 93.39% -> 92.95%     
---------------------------- TRAINING EPOCH: 260 ----------------------------  
client [83] (testset)   loss: 0.7152 -> 0.7159  accuracy: 90.76% -> 90.76%     
client [99] (testset)   loss: 0.6777 -> 0.6746  accuracy: 92.98% -> 92.98%     
client [74] (testset)   loss: 0.4975 -> 0.4977  accuracy: 90.91% -> 90.91%     
client [73] (testset)   loss: 0.6995 -> 0.7040  accuracy: 92.64% -> 92.64%     
client [29] (testset)   loss: 0.6612 -> 0.6568  accuracy: 90.38% -> 90.38%     
client [92] (testset)   loss: 0.8830 -> 0.8821  accuracy: 91.58% -> 91.58%     
client [6]  (testset)   loss: 0.4950 -> 0.4963  accuracy: 95.81% -> 95.81%     
client [61] (testset)   loss: 0.4150 -> 0.4183  accuracy: 93.48% -> 93.48%     
client [21] (testset)   loss: 0.5371 -> 0.5378  accuracy: 92.72% -> 92.72%     
client [67] (testset)   loss: 0.3055 -> 0.3059  accuracy: 94.93% -> 94.93%     
---------------------------- TRAINING EPOCH: 270 ----------------------------  
client [83] (testset)   loss: 0.7311 -> 0.7318  accuracy: 90.76% -> 90.76%     
client [32] (testset)   loss: 0.4470 -> 0.4521  accuracy: 88.29% -> 88.29%     
client [95] (testset)   loss: 0.6055 -> 0.5996  accuracy: 92.70% -> 92.70%     
client [61] (testset)   loss: 0.4244 -> 0.4254  accuracy: 93.48% -> 93.48%     
client [27] (testset)   loss: 0.8379 -> 0.8391  accuracy: 92.87% -> 92.87%     
client [25] (testset)   loss: 1.2592 -> 1.2638  accuracy: 90.54% -> 90.54%     
client [68] (testset)   loss: 0.6785 -> 0.6792  accuracy: 90.32% -> 90.32%     
client [34] (testset)   loss: 0.7522 -> 0.7510  accuracy: 86.80% -> 86.80%     
client [71] (testset)   loss: 0.2062 -> 0.2057  accuracy: 96.55% -> 96.55%     
client [89] (testset)   loss: 0.3930 -> 0.3929  accuracy: 95.45% -> 95.45%     
---------------------------- TRAINING EPOCH: 280 ----------------------------  
client [78] (testset)   loss: 0.5184 -> 0.5144  accuracy: 95.04% -> 95.32%     
client [81] (testset)   loss: 0.4488 -> 0.4510  accuracy: 92.39% -> 92.39%     
client [51] (testset)   loss: 0.5189 -> 0.5181  accuracy: 90.78% -> 90.78%     
client [54] (testset)   loss: 0.6797 -> 0.6807  accuracy: 89.44% -> 89.44%     
client [65] (testset)   loss: 0.4502 -> 0.4581  accuracy: 93.24% -> 92.94%     
client [41] (testset)   loss: 0.5269 -> 0.5327  accuracy: 95.40% -> 94.98%     
client [11] (testset)   loss: 0.6464 -> 0.6483  accuracy: 91.91% -> 91.91%     
client [85] (testset)   loss: 0.3333 -> 0.3236  accuracy: 91.95% -> 91.95%     
client [12] (testset)   loss: 0.2917 -> 0.2948  accuracy: 94.30% -> 94.30%     
client [23] (testset)   loss: 0.6728 -> 0.6667  accuracy: 91.10% -> 91.53%     
---------------------------- TRAINING EPOCH: 290 ----------------------------  
client [16] (testset)   loss: 0.5781 -> 0.6075  accuracy: 93.72% -> 93.47%     
client [65] (testset)   loss: 0.4656 -> 0.4607  accuracy: 92.35% -> 92.94%     
client [53] (testset)   loss: 0.9839 -> 0.9851  accuracy: 92.67% -> 92.67%     
client [58] (testset)   loss: 0.6896 -> 0.6899  accuracy: 90.70% -> 90.70%     
client [72] (testset)   loss: 0.2402 -> 0.2407  accuracy: 94.31% -> 94.31%     
client [7]  (testset)   loss: 0.4891 -> 0.4864  accuracy: 93.83% -> 94.24%     
client [71] (testset)   loss: 0.2174 -> 0.2217  accuracy: 96.12% -> 96.12%     
client [59] (testset)   loss: 0.7564 -> 0.7510  accuracy: 93.08% -> 93.08%     
client [86] (testset)   loss: 0.8362 -> 0.8269  accuracy: 92.51% -> 92.51%     
client [39] (testset)   loss: 0.7407 -> 0.7505  accuracy: 89.90% -> 89.90%     
---------------------------- TRAINING EPOCH: 300 ----------------------------  
client [99] (testset)   loss: 0.6291 -> 0.6311  accuracy: 92.98% -> 92.98%     
client [7]  (testset)   loss: 0.4756 -> 0.4762  accuracy: 94.65% -> 94.65%     
client [17] (testset)   loss: 0.8481 -> 0.8497  accuracy: 91.49% -> 91.49%     
client [64] (testset)   loss: 0.3449 -> 0.3453  accuracy: 93.92% -> 93.92%     
client [37] (testset)   loss: 1.0334 -> 1.0358  accuracy: 89.66% -> 89.66%     
client [29] (testset)   loss: 0.6320 -> 0.6334  accuracy: 90.38% -> 90.38%     
client [93] (testset)   loss: 0.5133 -> 0.5140  accuracy: 95.09% -> 95.09%     
client [73] (testset)   loss: 0.6797 -> 0.6807  accuracy: 92.94% -> 92.94%     
client [40] (testset)   loss: 0.4176 -> 0.4176  accuracy: 95.98% -> 95.98%     
client [76] (testset)   loss: 0.3608 -> 0.3617  accuracy: 95.45% -> 95.45%     
---------------------------- TRAINING EPOCH: 310 ----------------------------  
client [31] (testset)   loss: 0.3048 -> 0.3048  accuracy: 94.00% -> 94.00%     
client [89] (testset)   loss: 0.4028 -> 0.4033  accuracy: 94.95% -> 94.95%     
client [77] (testset)   loss: 0.6617 -> 0.6612  accuracy: 91.79% -> 91.79%     
client [90] (testset)   loss: 0.8445 -> 0.8455  accuracy: 91.81% -> 91.46%     
client [26] (testset)   loss: 0.7014 -> 0.7019  accuracy: 91.37% -> 91.37%     
client [50] (testset)   loss: 0.6209 -> 0.6240  accuracy: 90.91% -> 90.91%     
client [30] (testset)   loss: 0.3714 -> 0.3731  accuracy: 94.49% -> 94.49%     
client [70] (testset)   loss: 0.6841 -> 0.6884  accuracy: 89.60% -> 89.20%     
client [41] (testset)   loss: 0.5493 -> 0.5498  accuracy: 95.82% -> 95.82%     
client [99] (testset)   loss: 0.6454 -> 0.6477  accuracy: 93.68% -> 93.68%     
---------------------------- TRAINING EPOCH: 320 ----------------------------  
client [68] (testset)   loss: 0.6741 -> 0.6744  accuracy: 90.73% -> 90.73%     
client [70] (testset)   loss: 0.6970 -> 0.6971  accuracy: 90.00% -> 89.60%     
client [52] (testset)   loss: 0.6821 -> 0.6838  accuracy: 91.39% -> 91.39%     
client [1]  (testset)   loss: 0.5981 -> 0.5998  accuracy: 92.61% -> 92.61%     
client [2]  (testset)   loss: 0.5407 -> 0.5417  accuracy: 92.86% -> 92.86%     
client [67] (testset)   loss: 0.3309 -> 0.3315  accuracy: 94.93% -> 94.93%     
client [92] (testset)   loss: 0.8326 -> 0.8329  accuracy: 91.58% -> 91.58%     
client [35] (testset)   loss: 0.7915 -> 0.7925  accuracy: 89.39% -> 89.39%     
client [36] (testset)   loss: 0.4578 -> 0.4562  accuracy: 94.83% -> 94.83%     
client [64] (testset)   loss: 0.3565 -> 0.3564  accuracy: 93.92% -> 93.92%     
---------------------------- TRAINING EPOCH: 330 ----------------------------  
client [44] (testset)   loss: 0.5910 -> 0.5920  accuracy: 91.58% -> 91.58%     
client [6]  (testset)   loss: 0.5533 -> 0.5540  accuracy: 96.04% -> 96.04%     
client [12] (testset)   loss: 0.2558 -> 0.2574  accuracy: 94.30% -> 94.30%     
client [55] (testset)   loss: 0.6271 -> 0.6273  accuracy: 93.55% -> 93.55%     
client [29] (testset)   loss: 0.6714 -> 0.6726  accuracy: 90.06% -> 90.06%     
client [9]  (testset)   loss: 0.2380 -> 0.2384  accuracy: 96.43% -> 96.43%     
client [43] (testset)   loss: 1.2828 -> 1.2822  accuracy: 89.42% -> 89.42%     
client [77] (testset)   loss: 0.6772 -> 0.6763  accuracy: 91.79% -> 91.79%     
client [98] (testset)   loss: 0.5586 -> 0.5583  accuracy: 92.31% -> 92.31%     
client [78] (testset)   loss: 0.5861 -> 0.5856  accuracy: 94.77% -> 94.77%     
---------------------------- TRAINING EPOCH: 340 ----------------------------  
client [92] (testset)   loss: 0.8494 -> 0.8496  accuracy: 91.58% -> 91.58%     
client [80] (testset)   loss: 1.0114 -> 1.0127  accuracy: 91.34% -> 91.77%     
client [63] (testset)   loss: 0.4553 -> 0.4543  accuracy: 90.55% -> 90.55%     
client [76] (testset)   loss: 0.4009 -> 0.4009  accuracy: 95.45% -> 95.45%     
client [78] (testset)   loss: 0.5948 -> 0.5940  accuracy: 94.77% -> 94.77%     
client [25] (testset)   loss: 1.3572 -> 1.3596  accuracy: 90.54% -> 90.54%     
client [58] (testset)   loss: 0.6968 -> 0.6964  accuracy: 89.77% -> 89.77%     
client [13] (testset)   loss: 0.3813 -> 0.3808  accuracy: 94.43% -> 94.43%     
client [17] (testset)   loss: 0.9121 -> 0.9126  accuracy: 91.91% -> 91.91%     
client [38] (testset)   loss: 0.6599 -> 0.6605  accuracy: 93.07% -> 93.07%     
---------------------------- TRAINING EPOCH: 350 ----------------------------  
client [72] (testset)   loss: 0.2807 -> 0.2807  accuracy: 94.31% -> 94.31%     
client [82] (testset)   loss: 0.6561 -> 0.6561  accuracy: 90.97% -> 90.97%     
client [86] (testset)   loss: 0.8870 -> 0.8870  accuracy: 92.95% -> 92.95%     
client [51] (testset)   loss: 0.5901 -> 0.5898  accuracy: 90.78% -> 90.78%     
client [96] (testset)   loss: 0.6254 -> 0.6262  accuracy: 91.77% -> 91.77%     
client [42] (testset)   loss: 0.5123 -> 0.5127  accuracy: 93.63% -> 93.63%     
client [55] (testset)   loss: 0.6421 -> 0.6422  accuracy: 93.55% -> 93.55%     
client [13] (testset)   loss: 0.3849 -> 0.3847  accuracy: 94.43% -> 94.43%     
client [1]  (testset)   loss: 0.6211 -> 0.6225  accuracy: 92.61% -> 92.61%     
client [12] (testset)   loss: 0.2669 -> 0.2681  accuracy: 94.30% -> 93.67%     
---------------------------- TRAINING EPOCH: 360 ----------------------------  
client [68] (testset)   loss: 0.6982 -> 0.6984  accuracy: 90.73% -> 90.73%     
client [23] (testset)   loss: 0.6797 -> 0.6792  accuracy: 92.37% -> 92.37%     
client [46] (testset)   loss: 0.2196 -> 0.2198  accuracy: 95.04% -> 95.04%     
client [41] (testset)   loss: 0.5869 -> 0.5864  accuracy: 95.82% -> 95.82%     
client [25] (testset)   loss: 1.3862 -> 1.3872  accuracy: 90.54% -> 90.54%     
client [58] (testset)   loss: 0.7082 -> 0.7079  accuracy: 89.77% -> 89.77%     
client [14] (testset)   loss: 0.2881 -> 0.2885  accuracy: 93.12% -> 93.12%     
client [33] (testset)   loss: 1.0672 -> 1.0668  accuracy: 93.21% -> 93.21%     
client [85] (testset)   loss: 0.3664 -> 0.3658  accuracy: 91.38% -> 90.80%     
client [62] (testset)   loss: 0.4359 -> 0.4362  accuracy: 93.70% -> 93.70%     
---------------------------- TRAINING EPOCH: 370 ----------------------------  
client [98] (testset)   loss: 0.5837 -> 0.5836  accuracy: 92.31% -> 92.31%     
client [63] (testset)   loss: 0.4739 -> 0.4731  accuracy: 90.55% -> 90.55%     
client [70] (testset)   loss: 0.7360 -> 0.7360  accuracy: 90.00% -> 89.60%     
client [65] (testset)   loss: 0.5347 -> 0.5345  accuracy: 92.35% -> 92.35%     
client [14] (testset)   loss: 0.2915 -> 0.2913  accuracy: 93.12% -> 93.12%     
client [73] (testset)   loss: 0.7375 -> 0.7380  accuracy: 92.94% -> 92.94%     
client [34] (testset)   loss: 0.8206 -> 0.8201  accuracy: 87.82% -> 87.82%     
client [99] (testset)   loss: 0.7013 -> 0.7014  accuracy: 93.33% -> 93.33%     
client [69] (testset)   loss: 0.4692 -> 0.4694  accuracy: 93.10% -> 93.10%     
client [46] (testset)   loss: 0.2219 -> 0.2221  accuracy: 95.04% -> 95.04%     
---------------------------- TRAINING EPOCH: 380 ----------------------------  
client [99] (testset)   loss: 0.7069 -> 0.7071  accuracy: 93.33% -> 93.33%     
client [93] (testset)   loss: 0.5548 -> 0.5552  accuracy: 94.80% -> 94.80%     
client [11] (testset)   loss: 0.7253 -> 0.7261  accuracy: 91.91% -> 91.91%     
client [58] (testset)   loss: 0.7201 -> 0.7199  accuracy: 89.77% -> 89.77%     
client [81] (testset)   loss: 0.4660 -> 0.4663  accuracy: 93.40% -> 93.40%     
client [85] (testset)   loss: 0.3706 -> 0.3700  accuracy: 90.80% -> 90.80%     
client [89] (testset)   loss: 0.4233 -> 0.4234  accuracy: 94.44% -> 94.44%     
client [45] (testset)   loss: 0.7252 -> 0.7265  accuracy: 92.40% -> 92.40%     
client [8]  (testset)   loss: 0.6259 -> 0.6259  accuracy: 87.63% -> 88.17%     
client [68] (testset)   loss: 0.7072 -> 0.7073  accuracy: 90.32% -> 90.32%     
---------------------------- TRAINING EPOCH: 390 ----------------------------  
client [67] (testset)   loss: 0.3622 -> 0.3624  accuracy: 94.20% -> 94.20%     
client [72] (testset)   loss: 0.2832 -> 0.2831  accuracy: 94.31% -> 94.31%     
client [1]  (testset)   loss: 0.6423 -> 0.6434  accuracy: 92.61% -> 92.61%     
client [78] (testset)   loss: 0.6186 -> 0.6179  accuracy: 95.04% -> 95.04%     
client [83] (testset)   loss: 0.7970 -> 0.7975  accuracy: 90.76% -> 90.76%     
client [21] (testset)   loss: 0.5698 -> 0.5707  accuracy: 92.72% -> 92.72%     
client [56] (testset)   loss: 0.5866 -> 0.5866  accuracy: 92.40% -> 92.40%     
client [44] (testset)   loss: 0.6211 -> 0.6211  accuracy: 91.85% -> 91.85%     
client [92] (testset)   loss: 0.8768 -> 0.8767  accuracy: 91.05% -> 91.05%     
client [27] (testset)   loss: 0.9157 -> 0.9158  accuracy: 92.64% -> 92.64%     
---------------------------- TRAINING EPOCH: 400 ----------------------------  
client [10] (testset)   loss: 0.5204 -> 0.5205  accuracy: 94.36% -> 94.36%     
client [39] (testset)   loss: 0.7467 -> 0.7465  accuracy: 90.87% -> 90.87%     
client [65] (testset)   loss: 0.5413 -> 0.5411  accuracy: 92.35% -> 92.35%     
client [26] (testset)   loss: 0.7638 -> 0.7635  accuracy: 91.05% -> 91.05%     
client [19] (testset)   loss: 0.7244 -> 0.7246  accuracy: 92.86% -> 92.86%     
client [68] (testset)   loss: 0.7095 -> 0.7097  accuracy: 90.32% -> 90.32%     
client [41] (testset)   loss: 0.5961 -> 0.5960  accuracy: 95.82% -> 95.82%     
client [50] (testset)   loss: 0.6730 -> 0.6737  accuracy: 91.74% -> 91.74%     
client [75] (testset)   loss: 0.5275 -> 0.5287  accuracy: 91.07% -> 91.07%     
client [81] (testset)   loss: 0.4678 -> 0.4682  accuracy: 92.89% -> 92.89%     
Training... ---------------------------------------- 100% 0:26:27
FedRoD's average time taken by each global epoch: 0 min 3.95 sec.              
FedRoD's total running time: 0 h 26 m 27 s.                                    
==================== FedRoD Experiment Results: ====================           
Display format: (before local fine-tuning) -> (after local fine-tuning)        
 So if finetune_epoch = 0, x.xx% -> 0.00% is normal.                           
 Centralized testing ONLY happens after model aggregation, so the stats between
'->' are the same.                                                             
{                                                                              
    "100": {                                                                   
        "all_clients": {                                                       
            "test": {                                                          
                "loss": "0.4711 -> 0.0000",                                    
                "accuracy": "92.37% -> 0.00%"                                  
            }                                                                  
        }                                                                      
    },                                                                         
    "200": {                                                                   
        "all_clients": {                                                       
            "test": {                                                          
                "loss": "0.5471 -> 0.0000",                                    
                "accuracy": "92.47% -> 0.00%"                                  
            }                                                                  
        }                                                                      
    },                                                                         
    "300": {                                                                   
        "all_clients": {                                                       
            "test": {                                                          
                "loss": "0.5877 -> 0.0000",                                    
                "accuracy": "92.54% -> 0.00%"                                  
            }                                                                  
        }                                                                      
    },                                                                         
    "400": {                                                                   
        "all_clients": {                                                       
            "test": {                                                          
                "loss": "0.6471 -> 0.0000",                                    
                "accuracy": "92.56% -> 0.00%"                                  
            }                                                                  
        }                                                                      
    }                                                                          
}                                                                              
==================== FedRoD Max Accuracy ====================                  
all_clients:                                                                   
(test) before fine-tuning: 92.56% at epoch 400                                 
(test) after fine-tuning: 0.00% at epoch 100                                   
[0m