==================== Floco ====================                                
Experiment Arguments:                                                          
{
│   'method': 'floco',
│   'dataset': {
│   │   'name': 'svhn',
│   │   'client_num': 100,
│   │   'test_ratio': 0.25,
│   │   'val_ratio': 0.0,
│   │   'seed': 42,
│   │   'split': 'sample',
│   │   'IID_ratio': 0.0,
│   │   'monitor_window_name_suffix': 'svhn-100clients-0%IID-Dir(1.0)-seed42',
│   │   'alpha': 1.0,
│   │   'min_samples_per_client': 10
│   },
│   'model': {
│   │   'name': 'avgcnn',
│   │   'use_torchvision_pretrained_weights': True,
│   │   'external_model_weights_path': None
│   },
│   'optimizer': {
│   │   'lr': 0.01,
│   │   'dampening': 0,
│   │   'weight_decay': 0,
│   │   'momentum': 0,
│   │   'nesterov': False,
│   │   'name': 'sgd'
│   },
│   'mode': 'serial',
│   'parallel': {
│   │   'ray_cluster_addr': None,
│   │   'num_cpus': None,
│   │   'num_gpus': None,
│   │   'num_workers': 2
│   },
│   'common': {
│   │   'seed': 42,
│   │   'join_ratio': 0.1,
│   │   'global_epoch': 400,
│   │   'local_epoch': 5,
│   │   'batch_size': 32,
│   │   'reset_optimizer_on_global_epoch': True,
│   │   'straggler_ratio': 0,
│   │   'straggler_min_local_epoch': 0,
│   │   'buffers': 'global',
│   │   'client_side_evaluation': True,
│   │   'test': {
│   │   │   'client': {
│   │   │   │   'interval': 100,
│   │   │   │   'finetune_epoch': 0,
│   │   │   │   'train': False,
│   │   │   │   'val': False,
│   │   │   │   'test': True
│   │   │   },
│   │   │   'server': {
│   │   │   │   'interval': -1,
│   │   │   │   'train': False,
│   │   │   │   'val': False,
│   │   │   │   'test': False,
│   │   │   │   'model_in_train_mode': False
│   │   │   }
│   │   },
│   │   'verbose_gap': 10,
│   │   'monitor': None,
│   │   'use_cuda': True,
│   │   'save_log': True,
│   │   'save_model': False,
│   │   'save_learning_curve_plot': False,
│   │   'save_metrics': True,
│   │   'delete_useless_run': True
│   },
│   'floco': {
│   │   'endpoints': 10,
│   │   'tau': 10,
│   │   'rho': 0.1,
│   │   'pers_epoch': 0,
│   │   'lamda': 1
│   }
}
---------------------------- TRAINING EPOCH: 10 ----------------------------   
client [77] (testset)   loss: 0.9129 -> 1.9175  accuracy: 73.31% -> 52.79%     
client [81] (testset)   loss: 1.0839 -> 1.0121  accuracy: 67.51% -> 70.56%     
client [21] (testset)   loss: 0.7812 -> 0.6749  accuracy: 79.14% -> 76.82%     
client [68] (testset)   loss: 1.0780 -> 1.0861  accuracy: 71.77% -> 66.94%     
client [93] (testset)   loss: 0.7681 -> 0.6577  accuracy: 79.48% -> 80.35%     
client [31] (testset)   loss: 1.0933 -> 0.6900  accuracy: 63.33% -> 77.33%     
client [20] (testset)   loss: 1.1713 -> 1.0766  accuracy: 62.64% -> 61.54%     
client [59] (testset)   loss: 1.0186 -> 0.8540  accuracy: 71.07% -> 74.84%     
client [48] (testset)   loss: 1.0529 -> 0.7832  accuracy: 65.81% -> 74.84%     
client [34] (testset)   loss: 1.1996 -> 1.1408  accuracy: 59.39% -> 64.97%     
Projecting gradients ... 
---------------------------- TRAINING EPOCH: 20 ----------------------------   
client [69] (testset)   loss: 0.8811 -> 0.6933  accuracy: 73.28% -> 80.17%     
client [99] (testset)   loss: 0.5102 -> 0.5424  accuracy: 87.02% -> 86.67%     
client [67] (testset)   loss: 0.3930 -> 0.4839  accuracy: 86.23% -> 81.16%     
client [0]  (testset)   loss: 0.4337 -> 0.3988  accuracy: 88.26% -> 88.70%     
client [76] (testset)   loss: 0.4789 -> 0.7157  accuracy: 87.88% -> 81.82%     
client [41] (testset)   loss: 0.5873 -> 0.5582  accuracy: 80.75% -> 82.43%     
client [62] (testset)   loss: 0.5398 -> 0.6652  accuracy: 86.55% -> 81.93%     
client [2]  (testset)   loss: 0.6230 -> 0.6211  accuracy: 84.64% -> 83.93%     
client [14] (testset)   loss: 0.5392 -> 0.6746  accuracy: 85.62% -> 79.38%     
client [46] (testset)   loss: 0.4750 -> 0.4577  accuracy: 88.17% -> 88.17%     
---------------------------- TRAINING EPOCH: 30 ----------------------------   
client [24] (testset)   loss: 0.6027 -> 0.6204  accuracy: 77.59% -> 79.31%     
client [68] (testset)   loss: 0.6757 -> 0.9015  accuracy: 84.68% -> 77.82%     
client [57] (testset)   loss: 0.6103 -> 0.5668  accuracy: 82.22% -> 84.44%     
client [17] (testset)   loss: 0.7432 -> 0.7981  accuracy: 83.40% -> 78.30%     
client [54] (testset)   loss: 0.6238 -> 0.7036  accuracy: 84.49% -> 81.52%     
client [23] (testset)   loss: 0.5954 -> 0.4244  accuracy: 83.90% -> 86.86%     
client [35] (testset)   loss: 0.7147 -> 0.7519  accuracy: 84.08% -> 82.76%     
client [59] (testset)   loss: 0.7452 -> 0.6729  accuracy: 84.91% -> 83.65%     
client [31] (testset)   loss: 0.5400 -> 0.4923  accuracy: 84.67% -> 85.33%     
client [9]  (testset)   loss: 0.3211 -> 0.2392  accuracy: 90.71% -> 92.14%     
---------------------------- TRAINING EPOCH: 40 ----------------------------   
client [64] (testset)   loss: 0.3870 -> 0.4368  accuracy: 88.51% -> 87.16%     
client [33] (testset)   loss: 0.5988 -> 0.6546  accuracy: 87.23% -> 87.50%     
client [16] (testset)   loss: 0.5498 -> 0.4906  accuracy: 84.42% -> 86.18%     
client [44] (testset)   loss: 0.5488 -> 0.5227  accuracy: 86.41% -> 85.87%     
client [8]  (testset)   loss: 0.5713 -> 0.5423  accuracy: 84.41% -> 86.56%     
client [31] (testset)   loss: 0.5476 -> 1.0205  accuracy: 84.00% -> 74.00%     
client [47] (testset)   loss: 0.5902 -> 0.5364  accuracy: 88.51% -> 88.12%     
client [36] (testset)   loss: 0.4894 -> 0.4188  accuracy: 86.78% -> 87.64%     
client [20] (testset)   loss: 0.8482 -> 0.9974  accuracy: 78.02% -> 79.12%     
client [56] (testset)   loss: 0.4752 -> 0.6369  accuracy: 88.89% -> 85.09%     
---------------------------- TRAINING EPOCH: 50 ----------------------------   
client [4]  (testset)   loss: 0.5827 -> 0.5612  accuracy: 83.57% -> 88.57%     
client [60] (testset)   loss: 0.6980 -> 0.6310  accuracy: 81.86% -> 84.80%     
client [28] (testset)   loss: 0.6358 -> 1.0593  accuracy: 81.71% -> 78.05%     
client [25] (testset)   loss: 1.0279 -> 1.0309  accuracy: 80.63% -> 80.63%     
client [58] (testset)   loss: 0.7129 -> 0.6976  accuracy: 81.40% -> 81.40%     
client [44] (testset)   loss: 0.5554 -> 0.4613  accuracy: 85.60% -> 86.14%     
client [39] (testset)   loss: 0.7161 -> 0.6651  accuracy: 82.69% -> 84.13%     
client [29] (testset)   loss: 0.7122 -> 0.6658  accuracy: 83.33% -> 84.29%     
client [3]  (testset)   loss: 0.5944 -> 0.5920  accuracy: 86.25% -> 84.19%     
client [84] (testset)   loss: 0.5776 -> 0.4968  accuracy: 86.89% -> 89.07%     
---------------------------- TRAINING EPOCH: 60 ----------------------------   
client [21] (testset)   loss: 0.4635 -> 0.4862  accuracy: 88.74% -> 88.08%     
client [84] (testset)   loss: 0.5379 -> 0.4511  accuracy: 88.52% -> 89.62%     
client [10] (testset)   loss: 0.5456 -> 0.4984  accuracy: 84.62% -> 87.18%     
client [36] (testset)   loss: 0.3974 -> 0.4355  accuracy: 89.66% -> 87.93%     
client [65] (testset)   loss: 0.5601 -> 0.5024  accuracy: 86.76% -> 88.24%     
client [81] (testset)   loss: 0.5793 -> 0.5676  accuracy: 82.23% -> 86.29%     
client [79] (testset)   loss: 0.4909 -> 0.4432  accuracy: 88.32% -> 89.72%     
client [42] (testset)   loss: 0.4268 -> 0.4644  accuracy: 87.26% -> 86.62%     
client [11] (testset)   loss: 0.4179 -> 0.5418  accuracy: 87.57% -> 87.57%     
client [96] (testset)   loss: 0.4178 -> 0.4275  accuracy: 87.34% -> 88.61%     
---------------------------- TRAINING EPOCH: 70 ----------------------------   
client [8]  (testset)   loss: 0.5374 -> 0.5185  accuracy: 84.41% -> 87.10%     
client [53] (testset)   loss: 0.7743 -> 0.7675  accuracy: 86.67% -> 84.00%     
client [52] (testset)   loss: 0.6552 -> 0.5706  accuracy: 80.76% -> 85.06%     
client [42] (testset)   loss: 0.4253 -> 0.4839  accuracy: 87.58% -> 87.90%     
client [69] (testset)   loss: 0.5927 -> 0.4814  accuracy: 84.05% -> 89.22%     
client [59] (testset)   loss: 0.8012 -> 0.6332  accuracy: 86.16% -> 84.28%     
client [7]  (testset)   loss: 0.4942 -> 0.5194  accuracy: 86.42% -> 83.13%     
client [26] (testset)   loss: 0.4805 -> 0.4609  accuracy: 88.82% -> 88.82%     
client [49] (testset)   loss: 0.3896 -> 0.4122  accuracy: 85.71% -> 86.34%     
client [98] (testset)   loss: 0.5349 -> 0.6678  accuracy: 86.75% -> 80.77%     
---------------------------- TRAINING EPOCH: 80 ----------------------------   
client [98] (testset)   loss: 0.5825 -> 0.7150  accuracy: 86.75% -> 85.47%     
client [47] (testset)   loss: 0.4885 -> 0.4592  accuracy: 89.66% -> 90.80%     
client [21] (testset)   loss: 0.4526 -> 0.4607  accuracy: 89.40% -> 88.08%     
client [77] (testset)   loss: 0.6084 -> 0.5794  accuracy: 84.75% -> 87.10%     
client [95] (testset)   loss: 0.5820 -> 0.6514  accuracy: 88.38% -> 87.57%     
client [91] (testset)   loss: 0.2454 -> 0.3196  accuracy: 90.17% -> 89.60%     
client [14] (testset)   loss: 0.4653 -> 0.4799  accuracy: 89.38% -> 89.38%     
client [99] (testset)   loss: 0.4678 -> 0.4726  accuracy: 91.58% -> 90.18%     
client [20] (testset)   loss: 0.8495 -> 1.0089  accuracy: 83.52% -> 84.62%     
client [39] (testset)   loss: 0.7184 -> 0.6861  accuracy: 82.21% -> 83.65%     
---------------------------- TRAINING EPOCH: 90 ----------------------------   
client [52] (testset)   loss: 0.6243 -> 0.6405  accuracy: 82.78% -> 85.82%     
client [62] (testset)   loss: 0.4329 -> 0.4209  accuracy: 90.76% -> 90.34%     
client [71] (testset)   loss: 0.3812 -> 0.3510  accuracy: 90.09% -> 89.22%     
client [97] (testset)   loss: 0.3879 -> 0.4999  accuracy: 86.63% -> 86.63%     
client [30] (testset)   loss: 0.4212 -> 0.4496  accuracy: 91.18% -> 89.34%     
client [88] (testset)   loss: 0.7482 -> 0.7273  accuracy: 82.18% -> 86.14%     
client [60] (testset)   loss: 0.6287 -> 0.5997  accuracy: 86.27% -> 87.75%     
client [82] (testset)   loss: 0.4146 -> 0.3710  accuracy: 85.42% -> 89.58%     
client [91] (testset)   loss: 0.2627 -> 0.3237  accuracy: 91.33% -> 90.75%     
client [57] (testset)   loss: 0.5076 -> 0.4571  accuracy: 89.63% -> 86.67%     
---------------------------- TRAINING EPOCH: 100 ----------------------------  
client [31] (testset)   loss: 0.6196 -> 0.6055  accuracy: 86.67% -> 86.00%     
client [15] (testset)   loss: 0.4868 -> 0.5335  accuracy: 90.52% -> 88.63%     
client [71] (testset)   loss: 0.3745 -> 0.3610  accuracy: 90.09% -> 88.36%     
client [97] (testset)   loss: 0.4014 -> 0.4851  accuracy: 88.77% -> 88.24%     
client [53] (testset)   loss: 0.8518 -> 0.8454  accuracy: 87.33% -> 84.00%     
client [77] (testset)   loss: 0.5673 -> 0.5800  accuracy: 86.51% -> 87.10%     
client [76] (testset)   loss: 0.2365 -> 0.3808  accuracy: 93.94% -> 91.67%     
client [79] (testset)   loss: 0.4997 -> 0.4710  accuracy: 89.72% -> 89.25%     
client [28] (testset)   loss: 0.5498 -> 0.4591  accuracy: 86.99% -> 87.40%     
client [99] (testset)   loss: 0.5119 -> 0.4948  accuracy: 89.82% -> 91.58%     
---------------------------- TRAINING EPOCH: 110 ----------------------------  
client [97] (testset)   loss: 0.3773 -> 0.4913  accuracy: 87.70% -> 87.70%     
client [86] (testset)   loss: 0.5386 -> 0.4719  accuracy: 88.55% -> 90.31%     
client [34] (testset)   loss: 0.6290 -> 0.7355  accuracy: 83.76% -> 84.26%     
client [73] (testset)   loss: 0.3605 -> 0.3685  accuracy: 89.57% -> 90.80%     
client [5]  (testset)   loss: 0.5804 -> 0.5551  accuracy: 86.70% -> 88.18%     
client [96] (testset)   loss: 0.3702 -> 0.3972  accuracy: 88.61% -> 89.87%     
client [22] (testset)   loss: 0.6290 -> 0.5725  accuracy: 87.38% -> 89.54%     
client [60] (testset)   loss: 0.6336 -> 0.5754  accuracy: 85.78% -> 86.76%     
client [66] (testset)   loss: 0.3549 -> 0.4125  accuracy: 91.51% -> 91.74%     
client [83] (testset)   loss: 0.6444 -> 0.6449  accuracy: 83.70% -> 87.50%     
---------------------------- TRAINING EPOCH: 120 ----------------------------  
client [76] (testset)   loss: 0.2811 -> 0.3969  accuracy: 92.42% -> 90.91%     
client [65] (testset)   loss: 0.5863 -> 0.5083  accuracy: 87.35% -> 89.41%     
client [95] (testset)   loss: 0.5715 -> 0.6256  accuracy: 88.92% -> 88.11%     
client [17] (testset)   loss: 0.6987 -> 0.6510  accuracy: 85.96% -> 88.09%     
client [8]  (testset)   loss: 0.4941 -> 0.4892  accuracy: 87.10% -> 87.10%     
client [35] (testset)   loss: 0.7324 -> 0.8097  accuracy: 85.94% -> 85.15%     
client [98] (testset)   loss: 0.5453 -> 0.5324  accuracy: 88.89% -> 89.32%     
client [53] (testset)   loss: 0.8339 -> 0.8536  accuracy: 86.67% -> 83.33%     
client [43] (testset)   loss: 0.6036 -> 0.5484  accuracy: 89.42% -> 90.38%     
client [64] (testset)   loss: 0.3780 -> 0.3468  accuracy: 91.22% -> 89.86%     
---------------------------- TRAINING EPOCH: 130 ----------------------------  
client [21] (testset)   loss: 0.4593 -> 0.4428  accuracy: 89.74% -> 89.40%     
client [88] (testset)   loss: 0.7966 -> 0.8235  accuracy: 82.18% -> 84.65%     
client [38] (testset)   loss: 0.4481 -> 0.4576  accuracy: 89.42% -> 88.69%     
client [3]  (testset)   loss: 0.5299 -> 0.5319  accuracy: 90.38% -> 89.35%     
client [5]  (testset)   loss: 0.6212 -> 0.9515  accuracy: 86.70% -> 82.27%     
client [41] (testset)   loss: 0.4670 -> 0.4936  accuracy: 89.54% -> 89.12%     
client [7]  (testset)   loss: 0.5003 -> 0.4685  accuracy: 86.83% -> 86.83%     
client [37] (testset)   loss: 0.6096 -> 0.6331  accuracy: 86.70% -> 86.70%     
client [45] (testset)   loss: 0.4894 -> 0.5357  accuracy: 89.73% -> 87.45%     
client [47] (testset)   loss: 0.4821 -> 0.4365  accuracy: 89.66% -> 91.19%     
---------------------------- TRAINING EPOCH: 140 ----------------------------  
client [16] (testset)   loss: 0.5485 -> 0.5255  accuracy: 87.94% -> 86.93%     
client [11] (testset)   loss: 0.4381 -> 0.5011  accuracy: 86.71% -> 89.88%     
client [37] (testset)   loss: 0.5995 -> 0.6511  accuracy: 85.71% -> 86.70%     
client [41] (testset)   loss: 0.4397 -> 0.4841  accuracy: 90.38% -> 87.03%     
client [95] (testset)   loss: 0.5831 -> 0.6009  accuracy: 87.57% -> 89.19%     
client [53] (testset)   loss: 0.8861 -> 0.8506  accuracy: 87.33% -> 84.67%     
client [22] (testset)   loss: 0.6746 -> 0.5867  accuracy: 87.08% -> 89.54%     
client [25] (testset)   loss: 1.1215 -> 1.1237  accuracy: 82.43% -> 81.98%     
client [69] (testset)   loss: 0.6498 -> 0.5469  accuracy: 84.91% -> 88.79%     
client [46] (testset)   loss: 0.2772 -> 0.3277  accuracy: 91.98% -> 90.84%     
---------------------------- TRAINING EPOCH: 150 ----------------------------  
client [47] (testset)   loss: 0.4890 -> 0.4493  accuracy: 90.42% -> 91.57%     
client [69] (testset)   loss: 0.6643 -> 0.5907  accuracy: 84.05% -> 87.93%     
client [82] (testset)   loss: 0.3875 -> 0.3496  accuracy: 89.58% -> 89.58%     
client [45] (testset)   loss: 0.5206 -> 0.5504  accuracy: 89.73% -> 87.83%     
client [7]  (testset)   loss: 0.4850 -> 0.4718  accuracy: 87.65% -> 86.83%     
client [50] (testset)   loss: 0.7329 -> 0.7885  accuracy: 87.19% -> 85.95%     
client [35] (testset)   loss: 0.7675 -> 0.8170  accuracy: 85.94% -> 85.68%     
client [24] (testset)   loss: 0.4873 -> 0.4365  accuracy: 79.31% -> 84.48%     
client [15] (testset)   loss: 0.4705 -> 0.4931  accuracy: 91.47% -> 91.00%     
client [58] (testset)   loss: 0.7124 -> 0.7025  accuracy: 85.58% -> 85.58%     
---------------------------- TRAINING EPOCH: 160 ----------------------------  
client [48] (testset)   loss: 0.7782 -> 0.8033  accuracy: 83.23% -> 84.19%     
client [76] (testset)   loss: 0.3041 -> 0.4228  accuracy: 93.18% -> 90.91%     
client [67] (testset)   loss: 0.2412 -> 0.3533  accuracy: 92.03% -> 91.30%     
client [37] (testset)   loss: 0.6269 -> 0.7358  accuracy: 86.70% -> 85.71%     
client [58] (testset)   loss: 0.7445 -> 0.7742  accuracy: 85.58% -> 84.65%     
client [64] (testset)   loss: 0.3900 -> 0.4092  accuracy: 89.19% -> 91.22%     
client [77] (testset)   loss: 0.5742 -> 0.5315  accuracy: 86.80% -> 87.68%     
client [55] (testset)   loss: 0.6867 -> 0.6511  accuracy: 87.10% -> 85.81%     
client [12] (testset)   loss: 0.2306 -> 0.2740  accuracy: 94.30% -> 94.94%     
client [89] (testset)   loss: 0.5908 -> 0.4374  accuracy: 86.87% -> 89.39%     
---------------------------- TRAINING EPOCH: 170 ----------------------------  
client [84] (testset)   loss: 0.4754 -> 0.3673  accuracy: 89.62% -> 92.90%     
client [51] (testset)   loss: 0.6625 -> 0.6731  accuracy: 84.95% -> 85.44%     
client [8]  (testset)   loss: 0.5103 -> 0.5086  accuracy: 87.10% -> 89.25%     
client [18] (testset)   loss: 0.7094 -> 0.7024  accuracy: 84.31% -> 84.97%     
client [94] (testset)   loss: 0.6927 -> 0.6996  accuracy: 87.00% -> 87.36%     
client [81] (testset)   loss: 0.5899 -> 0.6199  accuracy: 86.29% -> 88.83%     
client [3]  (testset)   loss: 0.5513 -> 0.5522  accuracy: 90.38% -> 88.66%     
client [11] (testset)   loss: 0.4481 -> 0.5082  accuracy: 89.88% -> 90.17%     
client [95] (testset)   loss: 0.6250 -> 0.6042  accuracy: 87.57% -> 90.00%     
client [67] (testset)   loss: 0.2700 -> 0.3324  accuracy: 92.03% -> 89.86%     
---------------------------- TRAINING EPOCH: 180 ----------------------------  
client [21] (testset)   loss: 0.4700 -> 0.4823  accuracy: 89.40% -> 90.40%     
client [79] (testset)   loss: 0.5865 -> 0.5176  accuracy: 88.79% -> 89.72%     
client [58] (testset)   loss: 0.6981 -> 0.7255  accuracy: 87.44% -> 86.05%     
client [88] (testset)   loss: 0.9101 -> 0.8118  accuracy: 81.19% -> 79.70%     
client [46] (testset)   loss: 0.2593 -> 0.2577  accuracy: 92.37% -> 92.37%     
client [11] (testset)   loss: 0.4840 -> 0.5294  accuracy: 88.15% -> 89.31%     
client [55] (testset)   loss: 0.5857 -> 0.5646  accuracy: 88.71% -> 88.39%     
client [13] (testset)   loss: 0.3515 -> 0.3561  accuracy: 91.04% -> 92.01%     
client [31] (testset)   loss: 0.5675 -> 0.5921  accuracy: 86.00% -> 84.67%     
client [75] (testset)   loss: 0.5665 -> 0.4967  accuracy: 87.86% -> 91.07%     
---------------------------- TRAINING EPOCH: 190 ----------------------------  
client [19] (testset)   loss: 0.5803 -> 0.6563  accuracy: 87.80% -> 88.10%     
client [7]  (testset)   loss: 0.5141 -> 0.4982  accuracy: 86.83% -> 87.24%     
client [57] (testset)   loss: 0.5204 -> 0.5038  accuracy: 89.63% -> 87.41%     
client [13] (testset)   loss: 0.3361 -> 0.3503  accuracy: 91.53% -> 91.77%     
client [43] (testset)   loss: 0.6804 -> 0.6039  accuracy: 87.50% -> 88.46%     
client [91] (testset)   loss: 0.2551 -> 0.2842  accuracy: 90.75% -> 91.33%     
client [10] (testset)   loss: 0.4420 -> 0.4859  accuracy: 87.69% -> 89.23%     
client [64] (testset)   loss: 0.3676 -> 0.3760  accuracy: 90.54% -> 90.54%     
client [82] (testset)   loss: 0.4262 -> 0.3919  accuracy: 86.81% -> 88.89%     
client [22] (testset)   loss: 0.6489 -> 0.6264  accuracy: 89.85% -> 89.85%     
---------------------------- TRAINING EPOCH: 200 ----------------------------  
client [20] (testset)   loss: 0.9472 -> 1.1195  accuracy: 86.81% -> 83.52%     
client [23] (testset)   loss: 0.6021 -> 0.5190  accuracy: 89.41% -> 91.10%     
client [88] (testset)   loss: 0.9425 -> 1.0641  accuracy: 79.21% -> 85.15%     
client [98] (testset)   loss: 0.5866 -> 0.5390  accuracy: 90.17% -> 90.60%     
client [79] (testset)   loss: 0.5948 -> 0.5212  accuracy: 89.95% -> 90.65%     
client [21] (testset)   loss: 0.4970 -> 0.4942  accuracy: 89.74% -> 89.40%     
client [92] (testset)   loss: 0.9232 -> 0.8117  accuracy: 85.26% -> 86.32%     
client [56] (testset)   loss: 0.5322 -> 0.5417  accuracy: 90.64% -> 88.89%     
client [5]  (testset)   loss: 0.7602 -> 0.5972  accuracy: 85.22% -> 88.18%     
client [52] (testset)   loss: 0.6105 -> 0.5537  accuracy: 86.33% -> 88.35%     
---------------------------- TRAINING EPOCH: 210 ----------------------------  
client [67] (testset)   loss: 0.2700 -> 0.2998  accuracy: 92.03% -> 90.58%     
client [54] (testset)   loss: 0.8284 -> 0.8248  accuracy: 84.49% -> 86.14%     
client [14] (testset)   loss: 0.4872 -> 0.5380  accuracy: 88.12% -> 89.38%     
client [99] (testset)   loss: 0.6145 -> 0.6048  accuracy: 91.23% -> 92.28%     
client [36] (testset)   loss: 0.4166 -> 0.4483  accuracy: 91.09% -> 91.09%     
client [30] (testset)   loss: 0.4350 -> 0.4350  accuracy: 91.54% -> 91.54%     
client [38] (testset)   loss: 0.4926 -> 0.5626  accuracy: 89.78% -> 89.05%     
client [15] (testset)   loss: 0.4615 -> 0.4985  accuracy: 91.47% -> 91.47%     
client [6]  (testset)   loss: 0.3721 -> 0.3631  accuracy: 94.05% -> 94.27%     
client [53] (testset)   loss: 1.0355 -> 0.9945  accuracy: 87.33% -> 82.67%     
---------------------------- TRAINING EPOCH: 220 ----------------------------  
client [99] (testset)   loss: 0.6134 -> 0.6112  accuracy: 91.23% -> 90.88%     
client [6]  (testset)   loss: 0.3903 -> 0.3831  accuracy: 94.49% -> 94.93%     
client [83] (testset)   loss: 0.7070 -> 0.7214  accuracy: 86.96% -> 86.41%     
client [42] (testset)   loss: 0.4957 -> 0.5222  accuracy: 88.85% -> 89.17%     
client [34] (testset)   loss: 0.6649 -> 0.7637  accuracy: 84.77% -> 84.26%     
client [15] (testset)   loss: 0.4870 -> 0.5487  accuracy: 91.94% -> 91.47%     
client [47] (testset)   loss: 0.4979 -> 0.4316  accuracy: 90.80% -> 91.95%     
client [55] (testset)   loss: 0.6654 -> 0.6350  accuracy: 88.39% -> 86.77%     
client [51] (testset)   loss: 0.7525 -> 0.7554  accuracy: 84.95% -> 84.95%     
client [95] (testset)   loss: 0.5985 -> 0.6150  accuracy: 88.38% -> 89.46%     
---------------------------- TRAINING EPOCH: 230 ----------------------------  
client [71] (testset)   loss: 0.3570 -> 0.3668  accuracy: 91.38% -> 90.09%     
client [15] (testset)   loss: 0.4920 -> 0.5610  accuracy: 91.00% -> 90.52%     
client [33] (testset)   loss: 0.7819 -> 0.7640  accuracy: 90.22% -> 91.30%     
client [99] (testset)   loss: 0.6572 -> 0.6233  accuracy: 91.23% -> 90.88%     
client [90] (testset)   loss: 0.5633 -> 0.5571  accuracy: 90.39% -> 88.26%     
client [57] (testset)   loss: 0.5849 -> 0.5239  accuracy: 88.89% -> 87.41%     
client [27] (testset)   loss: 0.6532 -> 0.7478  accuracy: 90.80% -> 88.74%     
client [78] (testset)   loss: 0.4459 -> 0.4407  accuracy: 92.29% -> 92.01%     
client [36] (testset)   loss: 0.4385 -> 0.4801  accuracy: 91.09% -> 90.52%     
client [88] (testset)   loss: 0.9445 -> 0.9960  accuracy: 82.18% -> 84.65%     
---------------------------- TRAINING EPOCH: 240 ----------------------------  
client [70] (testset)   loss: 0.6480 -> 0.5821  accuracy: 87.20% -> 88.80%     
client [35] (testset)   loss: 0.8641 -> 0.8520  accuracy: 84.62% -> 86.21%     
client [16] (testset)   loss: 0.6021 -> 0.5663  accuracy: 87.94% -> 88.69%     
client [80] (testset)   loss: 0.7815 -> 0.8522  accuracy: 89.18% -> 88.74%     
client [38] (testset)   loss: 0.5139 -> 0.5413  accuracy: 90.88% -> 89.42%     
client [78] (testset)   loss: 0.4885 -> 0.4569  accuracy: 92.01% -> 91.74%     
client [68] (testset)   loss: 0.6519 -> 0.7135  accuracy: 88.31% -> 86.29%     
client [11] (testset)   loss: 0.5397 -> 0.5465  accuracy: 88.15% -> 90.17%     
client [64] (testset)   loss: 0.4210 -> 0.4737  accuracy: 91.22% -> 88.51%     
client [82] (testset)   loss: 0.4276 -> 0.3521  accuracy: 86.81% -> 91.67%     
---------------------------- TRAINING EPOCH: 250 ----------------------------  
client [30] (testset)   loss: 0.4604 -> 0.4452  accuracy: 90.44% -> 91.91%     
client [27] (testset)   loss: 0.6546 -> 0.7637  accuracy: 89.20% -> 87.59%     
client [74] (testset)   loss: 0.4877 -> 0.6220  accuracy: 89.61% -> 88.31%     
client [45] (testset)   loss: 0.5560 -> 0.5714  accuracy: 89.73% -> 88.59%     
client [6]  (testset)   loss: 0.4059 -> 0.3819  accuracy: 93.83% -> 94.27%     
client [36] (testset)   loss: 0.4515 -> 0.4796  accuracy: 91.38% -> 91.67%     
client [63] (testset)   loss: 0.4524 -> 0.4497  accuracy: 86.61% -> 89.76%     
client [76] (testset)   loss: 0.2845 -> 0.4239  accuracy: 92.42% -> 90.15%     
client [83] (testset)   loss: 0.7095 -> 0.6999  accuracy: 85.33% -> 86.96%     
client [86] (testset)   loss: 0.7045 -> 0.5390  accuracy: 89.87% -> 89.87%     
---------------------------- TRAINING EPOCH: 260 ----------------------------  
client [83] (testset)   loss: 0.7356 -> 0.7796  accuracy: 86.41% -> 87.50%     
client [99] (testset)   loss: 0.6732 -> 0.6485  accuracy: 91.58% -> 91.23%     
client [74] (testset)   loss: 0.5568 -> 0.5675  accuracy: 89.61% -> 88.96%     
client [73] (testset)   loss: 0.3692 -> 0.3784  accuracy: 92.33% -> 92.33%     
client [29] (testset)   loss: 0.9176 -> 0.7486  accuracy: 83.65% -> 85.90%     
client [92] (testset)   loss: 0.9338 -> 0.8795  accuracy: 85.79% -> 86.32%     
client [6]  (testset)   loss: 0.4035 -> 0.3782  accuracy: 93.61% -> 95.37%     
client [61] (testset)   loss: 0.5540 -> 0.6885  accuracy: 90.76% -> 89.67%     
client [21] (testset)   loss: 0.5068 -> 0.5048  accuracy: 90.73% -> 91.39%     
client [67] (testset)   loss: 0.2776 -> 0.3770  accuracy: 90.58% -> 91.30%     
---------------------------- TRAINING EPOCH: 270 ----------------------------  
client [83] (testset)   loss: 0.7529 -> 0.8090  accuracy: 85.87% -> 86.96%     
client [32] (testset)   loss: 0.7127 -> 0.6910  accuracy: 85.59% -> 87.39%     
client [95] (testset)   loss: 0.7155 -> 0.6788  accuracy: 88.11% -> 89.19%     
client [61] (testset)   loss: 0.5637 -> 0.6977  accuracy: 90.76% -> 90.22%     
client [27] (testset)   loss: 0.6827 -> 0.7851  accuracy: 90.57% -> 88.51%     
client [25] (testset)   loss: 1.4117 -> 1.4085  accuracy: 83.33% -> 82.43%     
client [68] (testset)   loss: 0.6394 -> 0.6028  accuracy: 89.92% -> 88.31%     
client [34] (testset)   loss: 0.7277 -> 0.8344  accuracy: 85.28% -> 82.23%     
client [71] (testset)   loss: 0.3905 -> 0.3719  accuracy: 91.38% -> 90.52%     
client [89] (testset)   loss: 0.5771 -> 0.4570  accuracy: 87.37% -> 90.40%     
---------------------------- TRAINING EPOCH: 280 ----------------------------  
client [78] (testset)   loss: 0.5035 -> 0.4662  accuracy: 90.91% -> 91.74%     
client [81] (testset)   loss: 0.6167 -> 0.6693  accuracy: 86.29% -> 87.82%     
client [51] (testset)   loss: 0.7126 -> 0.7926  accuracy: 84.95% -> 87.38%     
client [54] (testset)   loss: 0.8794 -> 0.8850  accuracy: 83.83% -> 86.80%     
client [65] (testset)   loss: 0.7190 -> 0.6204  accuracy: 87.35% -> 89.71%     
client [41] (testset)   loss: 0.4160 -> 0.6036  accuracy: 91.21% -> 90.79%     
client [11] (testset)   loss: 0.5205 -> 0.5473  accuracy: 88.15% -> 90.46%     
client [85] (testset)   loss: 0.5150 -> 0.4872  accuracy: 88.51% -> 89.08%     
client [12] (testset)   loss: 0.2171 -> 0.3256  accuracy: 94.94% -> 94.30%     
client [23] (testset)   loss: 0.5964 -> 0.5796  accuracy: 90.68% -> 91.10%     
---------------------------- TRAINING EPOCH: 290 ----------------------------  
client [16] (testset)   loss: 0.6435 -> 0.5982  accuracy: 87.94% -> 86.68%     
client [65] (testset)   loss: 0.7275 -> 0.6433  accuracy: 87.65% -> 90.29%     
client [53] (testset)   loss: 1.0385 -> 0.9872  accuracy: 87.33% -> 84.00%     
client [58] (testset)   loss: 0.7401 -> 0.7674  accuracy: 86.98% -> 86.98%     
client [72] (testset)   loss: 0.5722 -> 0.6007  accuracy: 84.55% -> 88.62%     
client [7]  (testset)   loss: 0.5271 -> 0.4794  accuracy: 88.48% -> 88.89%     
client [71] (testset)   loss: 0.4053 -> 0.3956  accuracy: 91.38% -> 90.52%     
client [59] (testset)   loss: 1.1977 -> 0.9775  accuracy: 84.91% -> 87.42%     
client [86] (testset)   loss: 0.7618 -> 0.5789  accuracy: 88.99% -> 91.19%     
client [39] (testset)   loss: 0.7140 -> 0.6692  accuracy: 86.54% -> 87.02%     
---------------------------- TRAINING EPOCH: 300 ----------------------------  
client [99] (testset)   loss: 0.7160 -> 0.6834  accuracy: 89.82% -> 91.23%     
client [7]  (testset)   loss: 0.5286 -> 0.5180  accuracy: 88.89% -> 88.07%     
client [17] (testset)   loss: 0.7367 -> 0.7373  accuracy: 87.66% -> 87.23%     
client [64] (testset)   loss: 0.4185 -> 0.4168  accuracy: 91.22% -> 90.54%     
client [37] (testset)   loss: 0.8097 -> 0.8112  accuracy: 87.19% -> 86.70%     
client [29] (testset)   loss: 0.7938 -> 0.7213  accuracy: 86.22% -> 86.54%     
client [93] (testset)   loss: 0.5866 -> 0.5634  accuracy: 91.62% -> 92.20%     
client [73] (testset)   loss: 0.4069 -> 0.4046  accuracy: 91.10% -> 91.72%     
client [40] (testset)   loss: 0.5668 -> 0.4011  accuracy: 87.95% -> 92.41%     
client [76] (testset)   loss: 0.3025 -> 0.3945  accuracy: 92.42% -> 91.67%     
---------------------------- TRAINING EPOCH: 310 ----------------------------  
client [31] (testset)   loss: 0.6541 -> 0.6004  accuracy: 86.67% -> 88.00%     
client [89] (testset)   loss: 0.5680 -> 0.5476  accuracy: 87.37% -> 89.90%     
client [77] (testset)   loss: 0.7262 -> 0.6222  accuracy: 85.34% -> 89.15%     
client [90] (testset)   loss: 0.6016 -> 0.6040  accuracy: 90.75% -> 90.39%     
client [26] (testset)   loss: 0.6295 -> 0.6027  accuracy: 91.69% -> 91.69%     
client [50] (testset)   loss: 0.9047 -> 0.8936  accuracy: 87.60% -> 88.02%     
client [30] (testset)   loss: 0.4879 -> 0.4818  accuracy: 91.18% -> 91.18%     
client [70] (testset)   loss: 0.7054 -> 0.6682  accuracy: 87.60% -> 89.20%     
client [41] (testset)   loss: 0.4964 -> 0.5393  accuracy: 91.21% -> 89.96%     
client [99] (testset)   loss: 0.7312 -> 0.7001  accuracy: 91.23% -> 90.88%     
---------------------------- TRAINING EPOCH: 320 ----------------------------  
client [68] (testset)   loss: 0.6784 -> 0.6257  accuracy: 89.11% -> 87.90%     
client [70] (testset)   loss: 0.6819 -> 0.6331  accuracy: 88.00% -> 88.40%     
client [52] (testset)   loss: 0.6756 -> 0.5802  accuracy: 86.58% -> 88.86%     
client [1]  (testset)   loss: 0.7329 -> 0.6826  accuracy: 87.68% -> 87.68%     
client [2]  (testset)   loss: 0.6183 -> 0.5918  accuracy: 88.57% -> 87.86%     
client [67] (testset)   loss: 0.2614 -> 0.3229  accuracy: 91.30% -> 91.30%     
client [92] (testset)   loss: 0.9973 -> 1.0044  accuracy: 86.84% -> 86.32%     
client [35] (testset)   loss: 0.9299 -> 0.8680  accuracy: 84.88% -> 87.00%     
client [36] (testset)   loss: 0.4957 -> 0.4764  accuracy: 90.23% -> 90.80%     
client [64] (testset)   loss: 0.4455 -> 0.3966  accuracy: 90.54% -> 91.22%     
---------------------------- TRAINING EPOCH: 330 ----------------------------  
client [44] (testset)   loss: 0.5300 -> 0.4615  accuracy: 88.86% -> 89.67%     
client [6]  (testset)   loss: 0.4098 -> 0.3832  accuracy: 94.05% -> 95.37%     
client [12] (testset)   loss: 0.2158 -> 0.2627  accuracy: 95.57% -> 94.30%     
client [55] (testset)   loss: 0.8039 -> 0.7919  accuracy: 88.39% -> 87.74%     
client [29] (testset)   loss: 0.7834 -> 0.7123  accuracy: 85.58% -> 87.50%     
client [9]  (testset)   loss: 0.2626 -> 0.2412  accuracy: 93.57% -> 95.00%     
client [43] (testset)   loss: 0.8166 -> 0.7214  accuracy: 86.54% -> 88.46%     
client [77] (testset)   loss: 0.7266 -> 0.6129  accuracy: 85.63% -> 87.68%     
client [98] (testset)   loss: 0.6535 -> 0.6245  accuracy: 89.74% -> 91.45%     
client [78] (testset)   loss: 0.4943 -> 0.4771  accuracy: 92.01% -> 92.29%     
---------------------------- TRAINING EPOCH: 340 ----------------------------  
client [92] (testset)   loss: 1.0246 -> 0.9854  accuracy: 86.84% -> 86.84%     
client [80] (testset)   loss: 0.8389 -> 0.8370  accuracy: 89.61% -> 88.74%     
client [63] (testset)   loss: 0.4740 -> 0.5284  accuracy: 88.98% -> 88.19%     
client [76] (testset)   loss: 0.3067 -> 0.4087  accuracy: 92.42% -> 90.15%     
client [78] (testset)   loss: 0.5148 -> 0.4930  accuracy: 91.74% -> 92.84%     
client [25] (testset)   loss: 1.4867 -> 1.4804  accuracy: 81.53% -> 81.53%     
client [58] (testset)   loss: 0.7853 -> 0.8018  accuracy: 86.98% -> 86.05%     
client [13] (testset)   loss: 0.3789 -> 0.3645  accuracy: 91.77% -> 92.49%     
client [17] (testset)   loss: 0.7529 -> 0.7703  accuracy: 87.66% -> 87.66%     
client [38] (testset)   loss: 0.5563 -> 0.5902  accuracy: 90.51% -> 90.51%     
---------------------------- TRAINING EPOCH: 350 ----------------------------  
client [72] (testset)   loss: 0.6148 -> 0.6373  accuracy: 85.37% -> 87.80%     
client [82] (testset)   loss: 0.4493 -> 0.3628  accuracy: 90.28% -> 89.58%     
client [86] (testset)   loss: 0.7533 -> 0.6245  accuracy: 89.43% -> 89.87%     
client [51] (testset)   loss: 0.7661 -> 0.7841  accuracy: 84.95% -> 86.41%     
client [96] (testset)   loss: 0.3709 -> 0.3839  accuracy: 90.51% -> 91.77%     
client [42] (testset)   loss: 0.5330 -> 0.5323  accuracy: 88.85% -> 89.81%     
client [55] (testset)   loss: 0.7846 -> 0.7392  accuracy: 89.35% -> 89.03%     
client [13] (testset)   loss: 0.3853 -> 0.3629  accuracy: 91.77% -> 92.49%     
client [1]  (testset)   loss: 0.7187 -> 0.6661  accuracy: 87.68% -> 87.68%     
client [12] (testset)   loss: 0.2392 -> 0.2950  accuracy: 93.67% -> 94.30%     
---------------------------- TRAINING EPOCH: 360 ----------------------------  
client [68] (testset)   loss: 0.6971 -> 0.7244  accuracy: 88.71% -> 86.69%     
client [23] (testset)   loss: 0.6448 -> 0.5484  accuracy: 89.83% -> 90.68%     
client [46] (testset)   loss: 0.3174 -> 0.3159  accuracy: 91.98% -> 93.89%     
client [41] (testset)   loss: 0.5016 -> 0.5627  accuracy: 90.79% -> 90.38%     
client [25] (testset)   loss: 1.5807 -> 1.5403  accuracy: 82.43% -> 83.33%     
client [58] (testset)   loss: 0.7982 -> 0.8188  accuracy: 87.44% -> 86.98%     
client [14] (testset)   loss: 0.5457 -> 0.6000  accuracy: 90.00% -> 89.38%     
client [33] (testset)   loss: 0.9344 -> 0.8921  accuracy: 89.13% -> 90.22%     
client [85] (testset)   loss: 0.5501 -> 0.5383  accuracy: 89.66% -> 90.23%     
client [62] (testset)   loss: 0.5178 -> 0.4162  accuracy: 90.76% -> 90.76%     
---------------------------- TRAINING EPOCH: 370 ----------------------------  
client [98] (testset)   loss: 0.6822 -> 0.6784  accuracy: 89.32% -> 91.03%     
client [63] (testset)   loss: 0.5622 -> 0.4477  accuracy: 87.40% -> 90.55%     
client [70] (testset)   loss: 0.6915 -> 0.6323  accuracy: 88.40% -> 89.60%     
client [65] (testset)   loss: 0.8111 -> 0.6870  accuracy: 87.35% -> 89.71%     
client [14] (testset)   loss: 0.5925 -> 0.5909  accuracy: 88.75% -> 88.75%     
client [73] (testset)   loss: 0.4236 -> 0.4053  accuracy: 91.41% -> 91.72%     
client [34] (testset)   loss: 0.7889 -> 0.8244  accuracy: 83.25% -> 86.29%     
client [99] (testset)   loss: 0.7598 -> 0.7241  accuracy: 90.88% -> 91.58%     
client [69] (testset)   loss: 0.9215 -> 0.6333  accuracy: 83.62% -> 88.36%     
client [46] (testset)   loss: 0.3097 -> 0.3147  accuracy: 92.37% -> 94.27%     
---------------------------- TRAINING EPOCH: 380 ----------------------------  
client [99] (testset)   loss: 0.8220 -> 0.7674  accuracy: 90.18% -> 91.23%     
client [93] (testset)   loss: 0.6888 -> 0.6743  accuracy: 91.33% -> 91.33%     
client [11] (testset)   loss: 0.5765 -> 0.6158  accuracy: 89.02% -> 90.46%     
client [58] (testset)   loss: 0.8290 -> 0.8053  accuracy: 86.51% -> 86.51%     
client [81] (testset)   loss: 0.6587 -> 0.6529  accuracy: 87.31% -> 87.82%     
client [85] (testset)   loss: 0.5602 -> 0.5786  accuracy: 89.66% -> 89.66%     
client [89] (testset)   loss: 0.6295 -> 0.4985  accuracy: 86.87% -> 89.90%     
client [45] (testset)   loss: 0.6211 -> 0.6325  accuracy: 88.97% -> 89.73%     
client [8]  (testset)   loss: 0.7430 -> 0.6312  accuracy: 85.48% -> 86.56%     
client [68] (testset)   loss: 0.7036 -> 0.6773  accuracy: 89.11% -> 88.31%     
---------------------------- TRAINING EPOCH: 390 ----------------------------  
client [67] (testset)   loss: 0.2805 -> 0.3721  accuracy: 91.30% -> 90.58%     
client [72] (testset)   loss: 0.5967 -> 0.6417  accuracy: 87.80% -> 86.99%     
client [1]  (testset)   loss: 0.7880 -> 0.6788  accuracy: 88.38% -> 89.08%     
client [78] (testset)   loss: 0.5537 -> 0.5123  accuracy: 92.56% -> 92.29%     
client [83] (testset)   loss: 0.8291 -> 0.8087  accuracy: 85.87% -> 85.87%     
client [21] (testset)   loss: 0.5704 -> 0.5526  accuracy: 91.72% -> 91.39%     
client [56] (testset)   loss: 0.6805 -> 0.6563  accuracy: 88.60% -> 89.47%     
client [44] (testset)   loss: 0.6267 -> 0.5360  accuracy: 88.86% -> 89.95%     
client [92] (testset)   loss: 1.1283 -> 1.0529  accuracy: 86.84% -> 86.84%     
client [27] (testset)   loss: 0.8022 -> 0.8187  accuracy: 89.89% -> 89.43%     
---------------------------- TRAINING EPOCH: 400 ----------------------------  
client [10] (testset)   loss: 0.4927 -> 0.5191  accuracy: 88.21% -> 88.21%     
client [39] (testset)   loss: 0.7889 -> 0.7122  accuracy: 88.46% -> 87.50%     
client [65] (testset)   loss: 0.8334 -> 0.7139  accuracy: 87.65% -> 89.71%     
client [26] (testset)   loss: 0.7028 -> 0.6953  accuracy: 90.73% -> 91.69%     
client [19] (testset)   loss: 0.6508 -> 0.6823  accuracy: 89.58% -> 89.29%     
client [68] (testset)   loss: 0.7143 -> 0.6745  accuracy: 89.52% -> 88.31%     
client [41] (testset)   loss: 0.4906 -> 0.5539  accuracy: 92.05% -> 92.47%     
client [50] (testset)   loss: 0.9556 -> 0.9067  accuracy: 88.02% -> 89.67%     
client [75] (testset)   loss: 0.6847 -> 0.6297  accuracy: 89.64% -> 90.71%     
client [81] (testset)   loss: 0.6501 -> 0.6803  accuracy: 87.82% -> 87.31%     
Training... ---------------------------------------- 100% 0:24:38
Floco's average time taken by each global epoch: 0 min 3.67 sec.               
Floco's total running time: 0 h 24 m 38 s.                                     
==================== Floco Experiment Results: ====================            
Display format: (before local fine-tuning) -> (after local fine-tuning)        
 So if finetune_epoch = 0, x.xx% -> 0.00% is normal.                           
 Centralized testing ONLY happens after model aggregation, so the stats between
'->' are the same.                                                             
{                                                                              
    "100": {                                                                   
        "all_clients": {                                                       
            "test": {                                                          
                "loss": "0.5349 -> 0.0000",                                    
                "accuracy": "88.04% -> 0.00%"                                  
            }                                                                  
        }                                                                      
    },                                                                         
    "200": {                                                                   
        "all_clients": {                                                       
            "test": {                                                          
                "loss": "0.5864 -> 0.0000",                                    
                "accuracy": "88.61% -> 0.00%"                                  
            }                                                                  
        }                                                                      
    },                                                                         
    "300": {                                                                   
        "all_clients": {                                                       
            "test": {                                                          
                "loss": "0.6341 -> 0.0000",                                    
                "accuracy": "88.78% -> 0.00%"                                  
            }                                                                  
        }                                                                      
    },                                                                         
    "400": {                                                                   
        "all_clients": {                                                       
            "test": {                                                          
                "loss": "0.6990 -> 0.0000",                                    
                "accuracy": "88.83% -> 0.00%"                                  
            }                                                                  
        }                                                                      
    }                                                                          
}                                                                              
==================== Floco Max Accuracy ====================                   
all_clients:                                                                   
(test) before fine-tuning: 88.83% at epoch 400                                 
(test) after fine-tuning: 0.00% at epoch 100                                   
[0m