==================== Floco ====================                                
Experiment Arguments:                                                          
{
│   'method': 'floco',
│   'dataset': {
│   │   'name': 'mnist',
│   │   'client_num': 100,
│   │   'test_ratio': 0.25,
│   │   'val_ratio': 0.0,
│   │   'seed': 42,
│   │   'split': 'sample',
│   │   'IID_ratio': 0.0,
│   │   'monitor_window_name_suffix': 'mnist-100clients-0%IID-Dir(1.0)-seed42',
│   │   'alpha': 1.0,
│   │   'min_samples_per_client': 10
│   },
│   'model': {
│   │   'name': 'avgcnn',
│   │   'use_torchvision_pretrained_weights': True,
│   │   'external_model_weights_path': None
│   },
│   'optimizer': {
│   │   'lr': 0.01,
│   │   'dampening': 0,
│   │   'weight_decay': 0,
│   │   'momentum': 0,
│   │   'nesterov': False,
│   │   'name': 'sgd'
│   },
│   'mode': 'serial',
│   'parallel': {
│   │   'ray_cluster_addr': None,
│   │   'num_cpus': None,
│   │   'num_gpus': None,
│   │   'num_workers': 2
│   },
│   'common': {
│   │   'seed': 42,
│   │   'join_ratio': 0.1,
│   │   'global_epoch': 400,
│   │   'local_epoch': 5,
│   │   'batch_size': 32,
│   │   'reset_optimizer_on_global_epoch': True,
│   │   'straggler_ratio': 0,
│   │   'straggler_min_local_epoch': 0,
│   │   'buffers': 'global',
│   │   'client_side_evaluation': True,
│   │   'test': {
│   │   │   'client': {
│   │   │   │   'interval': 100,
│   │   │   │   'finetune_epoch': 0,
│   │   │   │   'train': False,
│   │   │   │   'val': False,
│   │   │   │   'test': True
│   │   │   },
│   │   │   'server': {
│   │   │   │   'interval': -1,
│   │   │   │   'train': False,
│   │   │   │   'val': False,
│   │   │   │   'test': False,
│   │   │   │   'model_in_train_mode': False
│   │   │   }
│   │   },
│   │   'verbose_gap': 10,
│   │   'monitor': None,
│   │   'use_cuda': True,
│   │   'save_log': True,
│   │   'save_model': False,
│   │   'save_learning_curve_plot': False,
│   │   'save_metrics': True,
│   │   'delete_useless_run': True
│   },
│   'floco': {
│   │   'endpoints': 10,
│   │   'tau': 10,
│   │   'rho': 0.1,
│   │   'pers_epoch': 0,
│   │   'lamda': 1
│   }
}
---------------------------- TRAINING EPOCH: 10 ----------------------------   
client [77] (testset)   loss: 0.2188 -> 0.1993  accuracy: 95.58% -> 94.78%     
client [81] (testset)   loss: 0.2789 -> 0.2626  accuracy: 94.55% -> 94.55%     
client [21] (testset)   loss: 0.2894 -> 0.2056  accuracy: 94.69% -> 95.58%     
client [68] (testset)   loss: 0.1727 -> 0.0982  accuracy: 96.11% -> 97.78%     
client [93] (testset)   loss: 0.2082 -> 0.2106  accuracy: 93.25% -> 94.84%     
client [31] (testset)   loss: 0.2005 -> 0.1792  accuracy: 94.64% -> 93.75%     
client [20] (testset)   loss: 0.2560 -> 0.1591  accuracy: 92.54% -> 94.30%     
client [59] (testset)   loss: 0.2288 -> 0.2059  accuracy: 93.75% -> 92.71%     
client [48] (testset)   loss: 0.1667 -> 0.1107  accuracy: 95.74% -> 95.74%     
client [34] (testset)   loss: 0.1903 -> 0.2231  accuracy: 95.27% -> 92.57%     
Projecting gradients ... 
---------------------------- TRAINING EPOCH: 20 ----------------------------   
client [69] (testset)   loss: 0.1807 -> 0.1451  accuracy: 93.98% -> 93.98%     
client [99] (testset)   loss: 0.2404 -> 0.2684  accuracy: 92.74% -> 92.18%     
client [67] (testset)   loss: 0.2190 -> 0.2222  accuracy: 94.87% -> 94.87%     
client [0]  (testset)   loss: 0.1603 -> 0.1264  accuracy: 95.45% -> 96.46%     
client [76] (testset)   loss: 0.0392 -> 0.0169  accuracy: 98.00% -> 100.00%    
client [41] (testset)   loss: 0.1712 -> 0.1610  accuracy: 95.83% -> 93.45%     
client [62] (testset)   loss: 0.1146 -> 0.1036  accuracy: 96.76% -> 96.22%     
client [2]  (testset)   loss: 0.1348 -> 0.0860  accuracy: 93.70% -> 96.85%     
client [14] (testset)   loss: 0.2595 -> 0.2762  accuracy: 93.98% -> 92.77%     
client [46] (testset)   loss: 0.1691 -> 0.1474  accuracy: 95.49% -> 94.74%     
---------------------------- TRAINING EPOCH: 30 ----------------------------   
client [24] (testset)   loss: 0.0902 -> 0.1076  accuracy: 94.74% -> 94.74%     
client [68] (testset)   loss: 0.0451 -> 0.0351  accuracy: 98.33% -> 98.89%     
client [57] (testset)   loss: 0.2652 -> 0.1990  accuracy: 91.71% -> 94.47%     
client [17] (testset)   loss: 0.1085 -> 0.1092  accuracy: 96.07% -> 96.07%     
client [54] (testset)   loss: 0.1419 -> 0.1426  accuracy: 94.94% -> 95.51%     
client [23] (testset)   loss: 0.0918 -> 0.1366  accuracy: 96.77% -> 96.77%     
client [35] (testset)   loss: 0.0468 -> 0.0299  accuracy: 98.80% -> 98.80%     
client [59] (testset)   loss: 0.1104 -> 0.1208  accuracy: 96.88% -> 95.83%     
client [31] (testset)   loss: 0.1151 -> 0.1070  accuracy: 96.43% -> 98.21%     
client [9]  (testset)   loss: 0.0837 -> 0.0931  accuracy: 96.26% -> 97.20%     
---------------------------- TRAINING EPOCH: 40 ----------------------------   
client [64] (testset)   loss: 0.0847 -> 0.0757  accuracy: 96.27% -> 97.10%     
client [33] (testset)   loss: 0.0911 -> 0.1539  accuracy: 97.87% -> 95.74%     
client [16] (testset)   loss: 0.1454 -> 0.1274  accuracy: 94.98% -> 93.61%     
client [44] (testset)   loss: 0.2117 -> 0.1577  accuracy: 96.39% -> 98.19%     
client [8]  (testset)   loss: 0.0525 -> 0.0740  accuracy: 99.39% -> 98.78%     
client [31] (testset)   loss: 0.1001 -> 0.0819  accuracy: 97.32% -> 99.11%     
client [47] (testset)   loss: 0.1176 -> 0.1103  accuracy: 97.17% -> 97.57%     
client [36] (testset)   loss: 0.0569 -> 0.0993  accuracy: 97.81% -> 97.27%     
client [20] (testset)   loss: 0.0906 -> 0.0698  accuracy: 97.37% -> 97.37%     
client [56] (testset)   loss: 0.1234 -> 0.1042  accuracy: 96.32% -> 97.37%     
---------------------------- TRAINING EPOCH: 50 ----------------------------   
client [4]  (testset)   loss: 0.1469 -> 0.1486  accuracy: 98.29% -> 97.14%     
client [60] (testset)   loss: 0.0712 -> 0.0889  accuracy: 97.83% -> 97.46%     
client [28] (testset)   loss: 0.0947 -> 0.1557  accuracy: 97.08% -> 95.62%     
client [25] (testset)   loss: 0.0857 -> 0.1077  accuracy: 98.10% -> 96.68%     
client [58] (testset)   loss: 0.0374 -> 0.0426  accuracy: 98.46% -> 97.95%     
client [44] (testset)   loss: 0.2086 -> 0.1757  accuracy: 95.18% -> 98.19%     
client [39] (testset)   loss: 0.0364 -> 0.0369  accuracy: 98.35% -> 98.90%     
client [29] (testset)   loss: 0.0606 -> 0.0391  accuracy: 97.39% -> 98.26%     
client [3]  (testset)   loss: 0.2480 -> 0.1998  accuracy: 96.52% -> 96.09%     
client [84] (testset)   loss: 0.0834 -> 0.0633  accuracy: 97.65% -> 97.65%     
---------------------------- TRAINING EPOCH: 60 ----------------------------   
client [21] (testset)   loss: 0.0995 -> 0.0676  accuracy: 97.35% -> 96.46%     
client [84] (testset)   loss: 0.0760 -> 0.0698  accuracy: 97.06% -> 98.24%     
client [10] (testset)   loss: 0.0715 -> 0.0833  accuracy: 98.68% -> 97.35%     
client [36] (testset)   loss: 0.0354 -> 0.0534  accuracy: 98.91% -> 97.81%     
client [65] (testset)   loss: 0.1354 -> 0.1255  accuracy: 95.88% -> 94.71%     
client [81] (testset)   loss: 0.1876 -> 0.2023  accuracy: 95.45% -> 95.45%     
client [79] (testset)   loss: 0.0973 -> 0.0555  accuracy: 96.77% -> 97.85%     
client [42] (testset)   loss: 0.1316 -> 0.1567  accuracy: 95.61% -> 93.86%     
client [11] (testset)   loss: 0.0406 -> 0.0688  accuracy: 98.45% -> 96.39%     
client [96] (testset)   loss: 0.0699 -> 0.0534  accuracy: 98.56% -> 98.09%     
---------------------------- TRAINING EPOCH: 70 ----------------------------   
client [8]  (testset)   loss: 0.0488 -> 0.0617  accuracy: 98.78% -> 98.78%     
client [53] (testset)   loss: 0.1096 -> 0.1100  accuracy: 97.32% -> 98.21%     
client [52] (testset)   loss: 0.0615 -> 0.0949  accuracy: 97.25% -> 97.25%     
client [42] (testset)   loss: 0.1217 -> 0.1459  accuracy: 93.86% -> 93.86%     
client [69] (testset)   loss: 0.0513 -> 0.0508  accuracy: 96.99% -> 97.59%     
client [59] (testset)   loss: 0.0642 -> 0.1010  accuracy: 97.40% -> 96.88%     
client [7]  (testset)   loss: 0.1069 -> 0.0431  accuracy: 95.83% -> 98.81%     
client [26] (testset)   loss: 0.0671 -> 0.0802  accuracy: 96.61% -> 98.31%     
client [49] (testset)   loss: 0.0298 -> 0.0101  accuracy: 98.15% -> 99.38%     
client [98] (testset)   loss: 0.0597 -> 0.0699  accuracy: 97.56% -> 95.93%     
---------------------------- TRAINING EPOCH: 80 ----------------------------   
client [98] (testset)   loss: 0.0560 -> 0.0643  accuracy: 98.37% -> 97.56%     
client [47] (testset)   loss: 0.0917 -> 0.0752  accuracy: 98.38% -> 97.98%     
client [21] (testset)   loss: 0.0870 -> 0.0609  accuracy: 96.46% -> 96.46%     
client [77] (testset)   loss: 0.0617 -> 0.0583  accuracy: 97.59% -> 97.59%     
client [95] (testset)   loss: 0.0919 -> 0.0955  accuracy: 97.07% -> 97.07%     
client [91] (testset)   loss: 0.0561 -> 0.0736  accuracy: 99.00% -> 98.00%     
client [14] (testset)   loss: 0.1567 -> 0.1902  accuracy: 95.18% -> 93.98%     
client [99] (testset)   loss: 0.1320 -> 0.1338  accuracy: 96.09% -> 96.09%     
client [20] (testset)   loss: 0.0779 -> 0.0906  accuracy: 98.25% -> 96.93%     
client [39] (testset)   loss: 0.0270 -> 0.0282  accuracy: 99.45% -> 98.90%     
---------------------------- TRAINING EPOCH: 90 ----------------------------   
client [52] (testset)   loss: 0.0489 -> 0.0821  accuracy: 97.25% -> 98.17%     
client [62] (testset)   loss: 0.0566 -> 0.0436  accuracy: 98.92% -> 98.92%     
client [71] (testset)   loss: 0.1400 -> 0.1302  accuracy: 95.81% -> 96.86%     
client [97] (testset)   loss: 0.0647 -> 0.0600  accuracy: 97.99% -> 97.99%     
client [30] (testset)   loss: 0.0645 -> 0.0660  accuracy: 96.89% -> 98.22%     
client [88] (testset)   loss: 0.0968 -> 0.0684  accuracy: 97.92% -> 97.58%     
client [60] (testset)   loss: 0.0480 -> 0.0596  accuracy: 98.55% -> 97.83%     
client [82] (testset)   loss: 0.0827 -> 0.0569  accuracy: 94.85% -> 97.94%     
client [91] (testset)   loss: 0.0553 -> 0.0653  accuracy: 99.00% -> 99.00%     
client [57] (testset)   loss: 0.2029 -> 0.1567  accuracy: 95.39% -> 95.39%     
---------------------------- TRAINING EPOCH: 100 ----------------------------  
client [31] (testset)   loss: 0.0396 -> 0.0360  accuracy: 99.11% -> 99.11%     
client [15] (testset)   loss: 0.0700 -> 0.0935  accuracy: 98.03% -> 97.04%     
client [71] (testset)   loss: 0.1277 -> 0.1319  accuracy: 96.34% -> 96.34%     
client [97] (testset)   loss: 0.0549 -> 0.0553  accuracy: 97.99% -> 97.99%     
client [53] (testset)   loss: 0.0903 -> 0.0922  accuracy: 97.32% -> 97.32%     
client [77] (testset)   loss: 0.0615 -> 0.0552  accuracy: 97.59% -> 97.59%     
client [76] (testset)   loss: 0.0090 -> 0.0060  accuracy: 100.00% -> 100.00%   
client [79] (testset)   loss: 0.0802 -> 0.0323  accuracy: 97.13% -> 98.21%     
client [28] (testset)   loss: 0.0572 -> 0.0769  accuracy: 97.08% -> 95.62%     
client [99] (testset)   loss: 0.1196 -> 0.1301  accuracy: 96.65% -> 96.09%     
---------------------------- TRAINING EPOCH: 110 ----------------------------  
client [97] (testset)   loss: 0.0611 -> 0.0561  accuracy: 97.99% -> 97.99%     
client [86] (testset)   loss: 0.0421 -> 0.0363  accuracy: 98.51% -> 98.51%     
client [34] (testset)   loss: 0.0637 -> 0.0446  accuracy: 97.97% -> 97.97%     
client [73] (testset)   loss: 0.1773 -> 0.1799  accuracy: 96.25% -> 95.83%     
client [5]  (testset)   loss: 0.0671 -> 0.0499  accuracy: 96.91% -> 97.53%     
client [96] (testset)   loss: 0.0669 -> 0.0475  accuracy: 99.04% -> 99.04%     
client [22] (testset)   loss: 0.0436 -> 0.0239  accuracy: 98.17% -> 99.09%     
client [60] (testset)   loss: 0.0418 -> 0.0484  accuracy: 98.91% -> 98.55%     
client [66] (testset)   loss: 0.1476 -> 0.1219  accuracy: 95.88% -> 96.91%     
client [83] (testset)   loss: 0.0857 -> 0.0993  accuracy: 97.61% -> 97.61%     
---------------------------- TRAINING EPOCH: 120 ----------------------------  
client [76] (testset)   loss: 0.0137 -> 0.0032  accuracy: 100.00% -> 100.00%   
client [65] (testset)   loss: 0.1338 -> 0.1431  accuracy: 95.88% -> 95.29%     
client [95] (testset)   loss: 0.0818 -> 0.0879  accuracy: 97.56% -> 97.07%     
client [17] (testset)   loss: 0.0504 -> 0.0605  accuracy: 97.82% -> 97.82%     
client [8]  (testset)   loss: 0.0372 -> 0.0466  accuracy: 99.39% -> 99.39%     
client [35] (testset)   loss: 0.0130 -> 0.0121  accuracy: 99.40% -> 99.40%     
client [98] (testset)   loss: 0.0353 -> 0.0484  accuracy: 98.37% -> 99.19%     
client [53] (testset)   loss: 0.0827 -> 0.0938  accuracy: 97.32% -> 97.32%     
client [43] (testset)   loss: 0.0870 -> 0.0881  accuracy: 98.20% -> 98.20%     
client [64] (testset)   loss: 0.0396 -> 0.0491  accuracy: 98.34% -> 98.34%     
---------------------------- TRAINING EPOCH: 130 ----------------------------  
client [21] (testset)   loss: 0.0811 -> 0.0507  accuracy: 97.35% -> 96.46%     
client [88] (testset)   loss: 0.0929 -> 0.0736  accuracy: 97.92% -> 97.92%     
client [38] (testset)   loss: 0.0686 -> 0.0637  accuracy: 98.03% -> 97.54%     
client [3]  (testset)   loss: 0.2259 -> 0.2278  accuracy: 96.09% -> 95.65%     
client [5]  (testset)   loss: 0.0667 -> 0.0522  accuracy: 97.53% -> 97.53%     
client [41] (testset)   loss: 0.0422 -> 0.0456  accuracy: 98.21% -> 98.21%     
client [7]  (testset)   loss: 0.0690 -> 0.0344  accuracy: 98.21% -> 98.21%     
client [37] (testset)   loss: 0.0782 -> 0.0769  accuracy: 98.28% -> 97.85%     
client [45] (testset)   loss: 0.0686 -> 0.0706  accuracy: 98.47% -> 98.08%     
client [47] (testset)   loss: 0.0940 -> 0.0873  accuracy: 98.38% -> 97.98%     
---------------------------- TRAINING EPOCH: 140 ----------------------------  
client [16] (testset)   loss: 0.1459 -> 0.1223  accuracy: 95.89% -> 95.89%     
client [11] (testset)   loss: 0.0249 -> 0.0414  accuracy: 99.48% -> 97.94%     
client [37] (testset)   loss: 0.0718 -> 0.0771  accuracy: 98.28% -> 97.85%     
client [41] (testset)   loss: 0.0405 -> 0.0436  accuracy: 98.21% -> 98.21%     
client [95] (testset)   loss: 0.0815 -> 0.0889  accuracy: 97.07% -> 96.59%     
client [53] (testset)   loss: 0.0986 -> 0.0990  accuracy: 96.43% -> 97.32%     
client [22] (testset)   loss: 0.0331 -> 0.0242  accuracy: 98.63% -> 99.54%     
client [25] (testset)   loss: 0.0598 -> 0.0637  accuracy: 99.05% -> 98.10%     
client [69] (testset)   loss: 0.0255 -> 0.0216  accuracy: 99.40% -> 98.80%     
client [46] (testset)   loss: 0.0212 -> 0.0177  accuracy: 99.25% -> 99.25%     
---------------------------- TRAINING EPOCH: 150 ----------------------------  
client [47] (testset)   loss: 0.0821 -> 0.0849  accuracy: 98.38% -> 98.38%     
client [69] (testset)   loss: 0.0204 -> 0.0188  accuracy: 100.00% -> 100.00%   
client [82] (testset)   loss: 0.0631 -> 0.0463  accuracy: 95.88% -> 98.97%     
client [45] (testset)   loss: 0.0660 -> 0.0625  accuracy: 98.47% -> 98.47%     
client [7]  (testset)   loss: 0.0692 -> 0.0244  accuracy: 98.81% -> 99.40%     
client [50] (testset)   loss: 0.0425 -> 0.0437  accuracy: 99.30% -> 99.30%     
client [35] (testset)   loss: 0.0066 -> 0.0078  accuracy: 100.00% -> 100.00%   
client [24] (testset)   loss: 0.0510 -> 0.0551  accuracy: 97.37% -> 97.37%     
client [15] (testset)   loss: 0.0710 -> 0.0747  accuracy: 98.03% -> 97.04%     
client [58] (testset)   loss: 0.0397 -> 0.0349  accuracy: 98.97% -> 98.97%     
---------------------------- TRAINING EPOCH: 160 ----------------------------  
client [48] (testset)   loss: 0.0157 -> 0.0262  accuracy: 100.00% -> 99.29%    
client [76] (testset)   loss: 0.0143 -> 0.0034  accuracy: 100.00% -> 100.00%   
client [67] (testset)   loss: 0.0702 -> 0.0866  accuracy: 97.44% -> 97.44%     
client [37] (testset)   loss: 0.0715 -> 0.0755  accuracy: 98.28% -> 97.42%     
client [58] (testset)   loss: 0.0358 -> 0.0373  accuracy: 98.46% -> 98.46%     
client [64] (testset)   loss: 0.0350 -> 0.0399  accuracy: 97.93% -> 98.34%     
client [77] (testset)   loss: 0.0505 -> 0.0386  accuracy: 97.59% -> 97.99%     
client [55] (testset)   loss: 0.1448 -> 0.0792  accuracy: 94.95% -> 96.97%     
client [12] (testset)   loss: 0.0225 -> 0.0448  accuracy: 98.94% -> 98.94%     
client [89] (testset)   loss: 0.1330 -> 0.1072  accuracy: 96.46% -> 97.35%     
---------------------------- TRAINING EPOCH: 170 ----------------------------  
client [84] (testset)   loss: 0.0632 -> 0.0616  accuracy: 97.65% -> 98.82%     
client [51] (testset)   loss: 0.1238 -> 0.1104  accuracy: 96.26% -> 96.26%     
client [8]  (testset)   loss: 0.0240 -> 0.0290  accuracy: 99.39% -> 99.39%     
client [18] (testset)   loss: 0.0030 -> 0.0027  accuracy: 100.00% -> 100.00%   
client [94] (testset)   loss: 0.0523 -> 0.0618  accuracy: 98.84% -> 98.84%     
client [81] (testset)   loss: 0.2019 -> 0.2271  accuracy: 97.27% -> 96.36%     
client [3]  (testset)   loss: 0.2010 -> 0.2290  accuracy: 97.39% -> 95.65%     
client [11] (testset)   loss: 0.0171 -> 0.0354  accuracy: 100.00% -> 97.94%    
client [95] (testset)   loss: 0.0876 -> 0.0887  accuracy: 97.07% -> 97.07%     
client [67] (testset)   loss: 0.0719 -> 0.0864  accuracy: 97.44% -> 98.29%     
---------------------------- TRAINING EPOCH: 180 ----------------------------  
client [21] (testset)   loss: 0.0589 -> 0.0450  accuracy: 97.35% -> 96.46%     
client [79] (testset)   loss: 0.0654 -> 0.0199  accuracy: 97.13% -> 99.28%     
client [58] (testset)   loss: 0.0335 -> 0.0363  accuracy: 98.97% -> 98.97%     
client [88] (testset)   loss: 0.0909 -> 0.0680  accuracy: 97.92% -> 97.58%     
client [46] (testset)   loss: 0.0240 -> 0.0192  accuracy: 99.25% -> 99.25%     
client [11] (testset)   loss: 0.0206 -> 0.0362  accuracy: 99.48% -> 97.94%     
client [55] (testset)   loss: 0.1306 -> 0.0956  accuracy: 95.96% -> 96.97%     
client [13] (testset)   loss: 0.1583 -> 0.1837  accuracy: 97.60% -> 97.60%     
client [31] (testset)   loss: 0.0244 -> 0.0252  accuracy: 98.21% -> 98.21%     
client [75] (testset)   loss: 0.0192 -> 0.0129  accuracy: 98.94% -> 100.00%    
---------------------------- TRAINING EPOCH: 190 ----------------------------  
client [19] (testset)   loss: 0.0140 -> 0.0076  accuracy: 99.41% -> 100.00%    
client [7]  (testset)   loss: 0.0612 -> 0.0265  accuracy: 98.21% -> 99.40%     
client [57] (testset)   loss: 0.2094 -> 0.1844  accuracy: 96.77% -> 95.85%     
client [13] (testset)   loss: 0.1724 -> 0.1900  accuracy: 97.60% -> 97.60%     
client [43] (testset)   loss: 0.0789 -> 0.0829  accuracy: 98.20% -> 98.20%     
client [91] (testset)   loss: 0.0381 -> 0.0464  accuracy: 99.00% -> 99.00%     
client [10] (testset)   loss: 0.0495 -> 0.0703  accuracy: 98.01% -> 98.01%     
client [64] (testset)   loss: 0.0295 -> 0.0369  accuracy: 98.34% -> 98.34%     
client [82] (testset)   loss: 0.0510 -> 0.0364  accuracy: 98.97% -> 98.97%     
client [22] (testset)   loss: 0.0380 -> 0.0252  accuracy: 98.63% -> 99.09%     
---------------------------- TRAINING EPOCH: 200 ----------------------------  
client [20] (testset)   loss: 0.0725 -> 0.0466  accuracy: 98.25% -> 98.25%     
client [23] (testset)   loss: 0.0564 -> 0.0602  accuracy: 97.85% -> 98.39%     
client [88] (testset)   loss: 0.0919 -> 0.0608  accuracy: 97.92% -> 97.92%     
client [98] (testset)   loss: 0.0178 -> 0.0244  accuracy: 99.19% -> 99.19%     
client [79] (testset)   loss: 0.0474 -> 0.0205  accuracy: 98.21% -> 98.92%     
client [21] (testset)   loss: 0.0633 -> 0.0426  accuracy: 97.35% -> 96.46%     
client [92] (testset)   loss: 0.1275 -> 0.1351  accuracy: 95.67% -> 96.15%     
client [56] (testset)   loss: 0.0459 -> 0.0447  accuracy: 97.89% -> 97.37%     
client [5]  (testset)   loss: 0.0432 -> 0.0404  accuracy: 98.15% -> 97.53%     
client [52] (testset)   loss: 0.0241 -> 0.0498  accuracy: 98.17% -> 99.08%     
---------------------------- TRAINING EPOCH: 210 ----------------------------  
client [67] (testset)   loss: 0.0681 -> 0.0917  accuracy: 97.44% -> 97.44%     
client [54] (testset)   loss: 0.1048 -> 0.1207  accuracy: 97.19% -> 96.63%     
client [14] (testset)   loss: 0.1351 -> 0.1609  accuracy: 97.59% -> 97.59%     
client [99] (testset)   loss: 0.0930 -> 0.0938  accuracy: 97.77% -> 97.21%     
client [36] (testset)   loss: 0.0098 -> 0.0110  accuracy: 100.00% -> 100.00%   
client [30] (testset)   loss: 0.0442 -> 0.0373  accuracy: 98.22% -> 99.56%     
client [38] (testset)   loss: 0.0740 -> 0.0808  accuracy: 98.52% -> 98.03%     
client [15] (testset)   loss: 0.0743 -> 0.0822  accuracy: 98.03% -> 97.54%     
client [6]  (testset)   loss: 0.0971 -> 0.1234  accuracy: 97.26% -> 97.26%     
client [53] (testset)   loss: 0.0818 -> 0.0793  accuracy: 97.32% -> 98.21%     
---------------------------- TRAINING EPOCH: 220 ----------------------------  
client [99] (testset)   loss: 0.0969 -> 0.0967  accuracy: 96.65% -> 97.21%     
client [6]  (testset)   loss: 0.0891 -> 0.1217  accuracy: 97.26% -> 96.58%     
client [83] (testset)   loss: 0.0827 -> 0.0835  accuracy: 97.13% -> 97.61%     
client [42] (testset)   loss: 0.1143 -> 0.1195  accuracy: 97.37% -> 96.49%     
client [34] (testset)   loss: 0.0742 -> 0.0539  accuracy: 97.30% -> 97.97%     
client [15] (testset)   loss: 0.0798 -> 0.0911  accuracy: 98.03% -> 97.04%     
client [47] (testset)   loss: 0.0941 -> 0.0789  accuracy: 98.38% -> 98.38%     
client [55] (testset)   loss: 0.1117 -> 0.0823  accuracy: 95.96% -> 96.97%     
client [51] (testset)   loss: 0.1335 -> 0.1477  accuracy: 96.26% -> 97.20%     
client [95] (testset)   loss: 0.0857 -> 0.0848  accuracy: 97.07% -> 96.59%     
---------------------------- TRAINING EPOCH: 230 ----------------------------  
client [71] (testset)   loss: 0.1566 -> 0.1464  accuracy: 96.86% -> 96.86%     
client [15] (testset)   loss: 0.0820 -> 0.0944  accuracy: 98.03% -> 97.04%     
client [33] (testset)   loss: 0.0386 -> 0.0777  accuracy: 99.29% -> 98.58%     
client [99] (testset)   loss: 0.0977 -> 0.0969  accuracy: 97.21% -> 97.21%     
client [90] (testset)   loss: 0.0688 -> 0.0588  accuracy: 98.58% -> 98.58%     
client [57] (testset)   loss: 0.2162 -> 0.1917  accuracy: 97.24% -> 95.85%     
client [27] (testset)   loss: 0.0275 -> 0.0322  accuracy: 98.82% -> 98.24%     
client [78] (testset)   loss: 0.1911 -> 0.1049  accuracy: 95.15% -> 96.36%     
client [36] (testset)   loss: 0.0097 -> 0.0114  accuracy: 99.45% -> 100.00%    
client [88] (testset)   loss: 0.0967 -> 0.0647  accuracy: 97.92% -> 97.92%     
---------------------------- TRAINING EPOCH: 240 ----------------------------  
client [70] (testset)   loss: 0.0117 -> 0.0102  accuracy: 99.58% -> 100.00%    
client [35] (testset)   loss: 0.0054 -> 0.0096  accuracy: 100.00% -> 99.40%    
client [16] (testset)   loss: 0.1712 -> 0.1434  accuracy: 96.35% -> 96.35%     
client [80] (testset)   loss: 0.0759 -> 0.0549  accuracy: 97.74% -> 98.11%     
client [38] (testset)   loss: 0.0731 -> 0.0648  accuracy: 98.52% -> 98.52%     
client [78] (testset)   loss: 0.1723 -> 0.1039  accuracy: 95.76% -> 96.36%     
client [68] (testset)   loss: 0.0114 -> 0.0032  accuracy: 99.44% -> 100.00%    
client [11] (testset)   loss: 0.0243 -> 0.0334  accuracy: 98.97% -> 98.97%     
client [64] (testset)   loss: 0.0309 -> 0.0287  accuracy: 98.76% -> 98.76%     
client [82] (testset)   loss: 0.0456 -> 0.0295  accuracy: 98.97% -> 98.97%     
---------------------------- TRAINING EPOCH: 250 ----------------------------  
client [30] (testset)   loss: 0.0431 -> 0.0378  accuracy: 98.22% -> 98.67%     
client [27] (testset)   loss: 0.0386 -> 0.0420  accuracy: 98.24% -> 98.24%     
client [74] (testset)   loss: 0.0402 -> 0.0619  accuracy: 98.75% -> 97.50%     
client [45] (testset)   loss: 0.0610 -> 0.0569  accuracy: 98.85% -> 98.85%     
client [6]  (testset)   loss: 0.0876 -> 0.1292  accuracy: 97.26% -> 95.89%     
client [36] (testset)   loss: 0.0099 -> 0.0130  accuracy: 100.00% -> 100.00%   
client [63] (testset)   loss: 0.0066 -> 0.0083  accuracy: 100.00% -> 99.35%    
client [76] (testset)   loss: 0.0147 -> 0.0059  accuracy: 98.00% -> 100.00%    
client [83] (testset)   loss: 0.0821 -> 0.0896  accuracy: 98.09% -> 97.61%     
client [86] (testset)   loss: 0.0267 -> 0.0358  accuracy: 98.51% -> 98.51%     
---------------------------- TRAINING EPOCH: 260 ----------------------------  
client [83] (testset)   loss: 0.0868 -> 0.0869  accuracy: 97.61% -> 98.09%     
client [99] (testset)   loss: 0.0897 -> 0.0906  accuracy: 97.21% -> 97.21%     
client [74] (testset)   loss: 0.0443 -> 0.0563  accuracy: 98.75% -> 97.50%     
client [73] (testset)   loss: 0.1900 -> 0.2001  accuracy: 96.67% -> 95.83%     
client [29] (testset)   loss: 0.0386 -> 0.0280  accuracy: 98.26% -> 99.13%     
client [92] (testset)   loss: 0.1247 -> 0.1265  accuracy: 95.67% -> 96.63%     
client [6]  (testset)   loss: 0.0889 -> 0.1217  accuracy: 97.26% -> 97.26%     
client [61] (testset)   loss: 0.0575 -> 0.0542  accuracy: 97.78% -> 97.78%     
client [21] (testset)   loss: 0.0577 -> 0.0424  accuracy: 97.35% -> 96.46%     
client [67] (testset)   loss: 0.0783 -> 0.0861  accuracy: 97.44% -> 97.44%     
---------------------------- TRAINING EPOCH: 270 ----------------------------  
client [83] (testset)   loss: 0.0852 -> 0.0869  accuracy: 98.09% -> 98.09%     
client [32] (testset)   loss: 0.0413 -> 0.0407  accuracy: 98.70% -> 98.70%     
client [95] (testset)   loss: 0.0941 -> 0.0908  accuracy: 97.07% -> 96.59%     
client [61] (testset)   loss: 0.0549 -> 0.0535  accuracy: 97.78% -> 98.33%     
client [27] (testset)   loss: 0.0307 -> 0.0384  accuracy: 98.82% -> 98.24%     
client [25] (testset)   loss: 0.0592 -> 0.0644  accuracy: 99.05% -> 98.10%     
client [68] (testset)   loss: 0.0116 -> 0.0046  accuracy: 99.44% -> 100.00%    
client [34] (testset)   loss: 0.0769 -> 0.0554  accuracy: 97.30% -> 97.30%     
client [71] (testset)   loss: 0.1524 -> 0.1511  accuracy: 96.86% -> 97.38%     
client [89] (testset)   loss: 0.1206 -> 0.0859  accuracy: 96.46% -> 97.35%     
---------------------------- TRAINING EPOCH: 280 ----------------------------  
client [78] (testset)   loss: 0.1741 -> 0.0971  accuracy: 95.76% -> 96.97%     
client [81] (testset)   loss: 0.2151 -> 0.2346  accuracy: 97.27% -> 97.27%     
client [51] (testset)   loss: 0.1279 -> 0.1139  accuracy: 96.73% -> 97.20%     
client [54] (testset)   loss: 0.1064 -> 0.1214  accuracy: 97.19% -> 96.63%     
client [65] (testset)   loss: 0.1254 -> 0.1458  accuracy: 96.47% -> 96.47%     
client [41] (testset)   loss: 0.0287 -> 0.0391  accuracy: 98.21% -> 98.21%     
client [11] (testset)   loss: 0.0199 -> 0.0351  accuracy: 99.48% -> 97.94%     
client [85] (testset)   loss: 0.0610 -> 0.0549  accuracy: 98.59% -> 98.59%     
client [12] (testset)   loss: 0.0148 -> 0.0314  accuracy: 99.47% -> 98.94%     
client [23] (testset)   loss: 0.0521 -> 0.0559  accuracy: 98.39% -> 98.39%     
---------------------------- TRAINING EPOCH: 290 ----------------------------  
client [16] (testset)   loss: 0.1752 -> 0.1374  accuracy: 96.35% -> 96.35%     
client [65] (testset)   loss: 0.1211 -> 0.1413  accuracy: 96.47% -> 96.47%     
client [53] (testset)   loss: 0.0654 -> 0.0627  accuracy: 97.32% -> 98.21%     
client [58] (testset)   loss: 0.0320 -> 0.0381  accuracy: 98.46% -> 98.46%     
client [72] (testset)   loss: 0.0271 -> 0.0349  accuracy: 98.80% -> 99.20%     
client [7]  (testset)   loss: 0.0602 -> 0.0341  accuracy: 98.21% -> 98.21%     
client [71] (testset)   loss: 0.1840 -> 0.1683  accuracy: 96.86% -> 96.34%     
client [59] (testset)   loss: 0.0340 -> 0.0632  accuracy: 97.92% -> 96.35%     
client [86] (testset)   loss: 0.0262 -> 0.0326  accuracy: 98.51% -> 99.25%     
client [39] (testset)   loss: 0.0126 -> 0.0135  accuracy: 99.45% -> 99.45%     
---------------------------- TRAINING EPOCH: 300 ----------------------------  
client [99] (testset)   loss: 0.0880 -> 0.0873  accuracy: 96.65% -> 97.21%     
client [7]  (testset)   loss: 0.0728 -> 0.0293  accuracy: 98.21% -> 98.81%     
client [17] (testset)   loss: 0.0486 -> 0.0533  accuracy: 98.25% -> 98.25%     
client [64] (testset)   loss: 0.0302 -> 0.0234  accuracy: 98.76% -> 99.17%     
client [37] (testset)   loss: 0.0551 -> 0.0627  accuracy: 98.28% -> 98.28%     
client [29] (testset)   loss: 0.0386 -> 0.0279  accuracy: 98.26% -> 99.13%     
client [93] (testset)   loss: 0.0383 -> 0.0448  accuracy: 99.21% -> 98.41%     
client [73] (testset)   loss: 0.2034 -> 0.2164  accuracy: 96.25% -> 95.83%     
client [40] (testset)   loss: 0.0556 -> 0.0113  accuracy: 99.20% -> 99.20%     
client [76] (testset)   loss: 0.0096 -> 0.0056  accuracy: 100.00% -> 100.00%   
---------------------------- TRAINING EPOCH: 310 ----------------------------  
client [31] (testset)   loss: 0.0164 -> 0.0143  accuracy: 99.11% -> 99.11%     
client [89] (testset)   loss: 0.1179 -> 0.0874  accuracy: 97.35% -> 98.23%     
client [77] (testset)   loss: 0.0494 -> 0.0374  accuracy: 97.99% -> 98.39%     
client [90] (testset)   loss: 0.0517 -> 0.0524  accuracy: 98.58% -> 99.29%     
client [26] (testset)   loss: 0.0381 -> 0.0314  accuracy: 98.73% -> 99.15%     
client [50] (testset)   loss: 0.0421 -> 0.0417  accuracy: 99.30% -> 99.30%     
client [30] (testset)   loss: 0.0416 -> 0.0324  accuracy: 98.22% -> 99.11%     
client [70] (testset)   loss: 0.0097 -> 0.0089  accuracy: 100.00% -> 100.00%   
client [41] (testset)   loss: 0.0322 -> 0.0395  accuracy: 98.21% -> 98.21%     
client [99] (testset)   loss: 0.0887 -> 0.0863  accuracy: 97.21% -> 97.21%     
---------------------------- TRAINING EPOCH: 320 ----------------------------  
client [68] (testset)   loss: 0.0146 -> 0.0044  accuracy: 99.44% -> 100.00%    
client [70] (testset)   loss: 0.0086 -> 0.0077  accuracy: 100.00% -> 100.00%   
client [52] (testset)   loss: 0.0098 -> 0.0299  accuracy: 100.00% -> 99.08%    
client [1]  (testset)   loss: 0.0653 -> 0.0826  accuracy: 98.54% -> 99.02%     
client [2]  (testset)   loss: 0.0753 -> 0.0623  accuracy: 97.64% -> 98.43%     
client [67] (testset)   loss: 0.0682 -> 0.0790  accuracy: 97.44% -> 97.44%     
client [92] (testset)   loss: 0.1125 -> 0.1146  accuracy: 95.67% -> 96.15%     
client [35] (testset)   loss: 0.0039 -> 0.0051  accuracy: 100.00% -> 100.00%   
client [36] (testset)   loss: 0.0067 -> 0.0068  accuracy: 100.00% -> 100.00%   
client [64] (testset)   loss: 0.0296 -> 0.0271  accuracy: 98.76% -> 98.34%     
---------------------------- TRAINING EPOCH: 330 ----------------------------  
client [44] (testset)   loss: 0.2303 -> 0.1959  accuracy: 97.59% -> 98.80%     
client [6]  (testset)   loss: 0.0657 -> 0.1050  accuracy: 97.95% -> 97.26%     
client [12] (testset)   loss: 0.0265 -> 0.0314  accuracy: 99.47% -> 98.94%     
client [55] (testset)   loss: 0.1116 -> 0.0969  accuracy: 95.96% -> 95.96%     
client [29] (testset)   loss: 0.0290 -> 0.0247  accuracy: 99.13% -> 99.13%     
client [9]  (testset)   loss: 0.0763 -> 0.0375  accuracy: 97.20% -> 99.07%     
client [43] (testset)   loss: 0.0828 -> 0.0809  accuracy: 98.20% -> 98.20%     
client [77] (testset)   loss: 0.0436 -> 0.0369  accuracy: 98.39% -> 98.39%     
client [98] (testset)   loss: 0.0124 -> 0.0175  accuracy: 100.00% -> 99.19%    
client [78] (testset)   loss: 0.1805 -> 0.1148  accuracy: 95.15% -> 96.36%     
---------------------------- TRAINING EPOCH: 340 ----------------------------  
client [92] (testset)   loss: 0.1067 -> 0.1081  accuracy: 96.63% -> 96.15%     
client [80] (testset)   loss: 0.0695 -> 0.0477  accuracy: 98.11% -> 98.11%     
client [63] (testset)   loss: 0.0059 -> 0.0091  accuracy: 100.00% -> 99.35%    
client [76] (testset)   loss: 0.0026 -> 0.0020  accuracy: 100.00% -> 100.00%   
client [78] (testset)   loss: 0.1639 -> 0.1167  accuracy: 95.76% -> 96.36%     
client [25] (testset)   loss: 0.0591 -> 0.0673  accuracy: 99.05% -> 98.58%     
client [58] (testset)   loss: 0.0387 -> 0.0396  accuracy: 98.46% -> 98.46%     
client [13] (testset)   loss: 0.1719 -> 0.1884  accuracy: 97.60% -> 97.60%     
client [17] (testset)   loss: 0.0465 -> 0.0564  accuracy: 98.25% -> 98.25%     
client [38] (testset)   loss: 0.0693 -> 0.0724  accuracy: 99.01% -> 98.52%     
---------------------------- TRAINING EPOCH: 350 ----------------------------  
client [72] (testset)   loss: 0.0245 -> 0.0310  accuracy: 98.80% -> 99.20%     
client [82] (testset)   loss: 0.0399 -> 0.0289  accuracy: 98.97% -> 98.97%     
client [86] (testset)   loss: 0.0238 -> 0.0316  accuracy: 98.51% -> 99.25%     
client [51] (testset)   loss: 0.1331 -> 0.1168  accuracy: 96.73% -> 97.20%     
client [96] (testset)   loss: 0.0575 -> 0.0447  accuracy: 99.04% -> 99.04%     
client [42] (testset)   loss: 0.1467 -> 0.1368  accuracy: 96.49% -> 96.49%     
client [55] (testset)   loss: 0.1237 -> 0.0819  accuracy: 95.96% -> 95.96%     
client [13] (testset)   loss: 0.1762 -> 0.1982  accuracy: 97.60% -> 97.60%     
client [1]  (testset)   loss: 0.0729 -> 0.0846  accuracy: 98.54% -> 99.02%     
client [12] (testset)   loss: 0.0198 -> 0.0324  accuracy: 98.94% -> 98.94%     
---------------------------- TRAINING EPOCH: 360 ----------------------------  
client [68] (testset)   loss: 0.0131 -> 0.0053  accuracy: 99.44% -> 99.44%     
client [23] (testset)   loss: 0.0498 -> 0.0503  accuracy: 98.39% -> 98.39%     
client [46] (testset)   loss: 0.0174 -> 0.0134  accuracy: 99.25% -> 99.25%     
client [41] (testset)   loss: 0.0255 -> 0.0368  accuracy: 98.81% -> 98.81%     
client [25] (testset)   loss: 0.0642 -> 0.0630  accuracy: 99.05% -> 98.58%     
client [58] (testset)   loss: 0.0385 -> 0.0409  accuracy: 98.46% -> 98.46%     
client [14] (testset)   loss: 0.1503 -> 0.1732  accuracy: 97.59% -> 97.59%     
client [33] (testset)   loss: 0.0422 -> 0.0754  accuracy: 98.58% -> 97.87%     
client [85] (testset)   loss: 0.0523 -> 0.0490  accuracy: 98.59% -> 98.59%     
client [62] (testset)   loss: 0.0688 -> 0.0554  accuracy: 98.92% -> 98.92%     
---------------------------- TRAINING EPOCH: 370 ----------------------------  
client [98] (testset)   loss: 0.0101 -> 0.0134  accuracy: 100.00% -> 100.00%   
client [63] (testset)   loss: 0.0067 -> 0.0089  accuracy: 100.00% -> 99.35%    
client [70] (testset)   loss: 0.0077 -> 0.0084  accuracy: 100.00% -> 100.00%   
client [65] (testset)   loss: 0.1251 -> 0.1547  accuracy: 96.47% -> 96.47%     
client [14] (testset)   loss: 0.1407 -> 0.1683  accuracy: 97.59% -> 97.59%     
client [73] (testset)   loss: 0.2029 -> 0.2102  accuracy: 96.67% -> 96.25%     
client [34] (testset)   loss: 0.0748 -> 0.0678  accuracy: 97.30% -> 97.30%     
client [99] (testset)   loss: 0.0906 -> 0.0878  accuracy: 97.21% -> 97.21%     
client [69] (testset)   loss: 0.0107 -> 0.0078  accuracy: 100.00% -> 100.00%   
client [46] (testset)   loss: 0.0182 -> 0.0126  accuracy: 99.25% -> 99.25%     
---------------------------- TRAINING EPOCH: 380 ----------------------------  
client [99] (testset)   loss: 0.0995 -> 0.0887  accuracy: 96.65% -> 97.21%     
client [93] (testset)   loss: 0.0408 -> 0.0412  accuracy: 99.21% -> 98.81%     
client [11] (testset)   loss: 0.0103 -> 0.0221  accuracy: 100.00% -> 98.45%    
client [58] (testset)   loss: 0.0399 -> 0.0429  accuracy: 98.46% -> 98.46%     
client [81] (testset)   loss: 0.2388 -> 0.2552  accuracy: 96.36% -> 97.27%     
client [85] (testset)   loss: 0.0488 -> 0.0478  accuracy: 98.59% -> 98.59%     
client [89] (testset)   loss: 0.1080 -> 0.0780  accuracy: 98.23% -> 98.23%     
client [45] (testset)   loss: 0.0586 -> 0.0539  accuracy: 98.85% -> 99.23%     
client [8]  (testset)   loss: 0.0366 -> 0.0358  accuracy: 98.78% -> 98.78%     
client [68] (testset)   loss: 0.0105 -> 0.0059  accuracy: 99.44% -> 99.44%     
---------------------------- TRAINING EPOCH: 390 ----------------------------  
client [67] (testset)   loss: 0.0736 -> 0.0828  accuracy: 97.44% -> 98.29%     
client [72] (testset)   loss: 0.0240 -> 0.0332  accuracy: 98.80% -> 99.60%     
client [1]  (testset)   loss: 0.0766 -> 0.0823  accuracy: 98.54% -> 99.02%     
client [78] (testset)   loss: 0.1692 -> 0.1060  accuracy: 96.36% -> 96.97%     
client [83] (testset)   loss: 0.0971 -> 0.0909  accuracy: 98.09% -> 98.09%     
client [21] (testset)   loss: 0.0471 -> 0.0399  accuracy: 99.12% -> 97.35%     
client [56] (testset)   loss: 0.0370 -> 0.0399  accuracy: 98.42% -> 97.89%     
client [44] (testset)   loss: 0.2498 -> 0.2188  accuracy: 97.59% -> 98.19%     
client [92] (testset)   loss: 0.1131 -> 0.1201  accuracy: 95.67% -> 96.15%     
client [27] (testset)   loss: 0.0238 -> 0.0372  accuracy: 98.82% -> 98.24%     
---------------------------- TRAINING EPOCH: 400 ----------------------------  
client [10] (testset)   loss: 0.0524 -> 0.0610  accuracy: 98.01% -> 98.68%     
client [39] (testset)   loss: 0.0140 -> 0.0159  accuracy: 99.45% -> 99.45%     
client [65] (testset)   loss: 0.1285 -> 0.1556  accuracy: 96.47% -> 96.47%     
client [26] (testset)   loss: 0.0409 -> 0.0372  accuracy: 99.15% -> 99.15%     
client [19] (testset)   loss: 0.0134 -> 0.0081  accuracy: 99.41% -> 99.41%     
client [68] (testset)   loss: 0.0075 -> 0.0049  accuracy: 99.44% -> 100.00%    
client [41] (testset)   loss: 0.0237 -> 0.0369  accuracy: 98.81% -> 98.81%     
client [50] (testset)   loss: 0.0435 -> 0.0433  accuracy: 98.94% -> 99.30%     
client [75] (testset)   loss: 0.0153 -> 0.0065  accuracy: 98.94% -> 100.00%    
client [81] (testset)   loss: 0.2424 -> 0.2540  accuracy: 97.27% -> 97.27%     
Training... ---------------------------------------- 100% 0:16:36
Floco's average time taken by each global epoch: 0 min 2.48 sec.               
Floco's total running time: 0 h 16 m 36 s.                                     
==================== Floco Experiment Results: ====================            
Display format: (before local fine-tuning) -> (after local fine-tuning)        
 So if finetune_epoch = 0, x.xx% -> 0.00% is normal.                           
 Centralized testing ONLY happens after model aggregation, so the stats between
'->' are the same.                                                             
{                                                                              
    "100": {                                                                   
        "all_clients": {                                                       
            "test": {                                                          
                "loss": "0.0739 -> 0.0000",                                    
                "accuracy": "97.86% -> 0.00%"                                  
            }                                                                  
        }                                                                      
    },                                                                         
    "200": {                                                                   
        "all_clients": {                                                       
            "test": {                                                          
                "loss": "0.0676 -> 0.0000",                                    
                "accuracy": "98.20% -> 0.00%"                                  
            }                                                                  
        }                                                                      
    },                                                                         
    "300": {                                                                   
        "all_clients": {                                                       
            "test": {                                                          
                "loss": "0.0686 -> 0.0000",                                    
                "accuracy": "98.24% -> 0.00%"                                  
            }                                                                  
        }                                                                      
    },                                                                         
    "400": {                                                                   
        "all_clients": {                                                       
            "test": {                                                          
                "loss": "0.0701 -> 0.0000",                                    
                "accuracy": "98.26% -> 0.00%"                                  
            }                                                                  
        }                                                                      
    }                                                                          
}                                                                              
==================== Floco Max Accuracy ====================                   
all_clients:                                                                   
(test) before fine-tuning: 98.26% at epoch 400                                 
(test) after fine-tuning: 0.00% at epoch 100                                   
[0m