==================== Floco ====================                                
Experiment Arguments:                                                          
{
│   'method': 'floco',
│   'dataset': {
│   │   'name': 'fmnist',
│   │   'client_num': 100,
│   │   'test_ratio': 0.25,
│   │   'val_ratio': 0.0,
│   │   'seed': 42,
│   │   'split': 'sample',
│   │   'IID_ratio': 0.0,
│   │   'monitor_window_name_suffix': 'fmnist-100clients-0%IID-Dir(1.0)-seed42',
│   │   'alpha': 1.0,
│   │   'min_samples_per_client': 10
│   },
│   'model': {
│   │   'name': 'avgcnn',
│   │   'use_torchvision_pretrained_weights': True,
│   │   'external_model_weights_path': None
│   },
│   'optimizer': {
│   │   'lr': 0.01,
│   │   'dampening': 0,
│   │   'weight_decay': 0,
│   │   'momentum': 0,
│   │   'nesterov': False,
│   │   'name': 'sgd'
│   },
│   'mode': 'serial',
│   'parallel': {
│   │   'ray_cluster_addr': None,
│   │   'num_cpus': None,
│   │   'num_gpus': None,
│   │   'num_workers': 2
│   },
│   'common': {
│   │   'seed': 42,
│   │   'join_ratio': 0.1,
│   │   'global_epoch': 400,
│   │   'local_epoch': 5,
│   │   'batch_size': 32,
│   │   'reset_optimizer_on_global_epoch': True,
│   │   'straggler_ratio': 0,
│   │   'straggler_min_local_epoch': 0,
│   │   'buffers': 'global',
│   │   'client_side_evaluation': True,
│   │   'test': {
│   │   │   'client': {
│   │   │   │   'interval': 100,
│   │   │   │   'finetune_epoch': 0,
│   │   │   │   'train': False,
│   │   │   │   'val': False,
│   │   │   │   'test': True
│   │   │   },
│   │   │   'server': {
│   │   │   │   'interval': -1,
│   │   │   │   'train': False,
│   │   │   │   'val': False,
│   │   │   │   'test': False,
│   │   │   │   'model_in_train_mode': False
│   │   │   }
│   │   },
│   │   'verbose_gap': 10,
│   │   'monitor': None,
│   │   'use_cuda': True,
│   │   'save_log': True,
│   │   'save_model': False,
│   │   'save_learning_curve_plot': False,
│   │   'save_metrics': True,
│   │   'delete_useless_run': True
│   },
│   'floco': {
│   │   'endpoints': 10,
│   │   'tau': 10,
│   │   'rho': 0.1,
│   │   'pers_epoch': 0,
│   │   'lamda': 1
│   }
}
---------------------------- TRAINING EPOCH: 10 ----------------------------   
client [77] (testset)   loss: 0.7522 -> 0.7196  accuracy: 72.50% -> 71.67%     
client [81] (testset)   loss: 0.7229 -> 0.5893  accuracy: 70.93% -> 78.41%     
client [21] (testset)   loss: 0.6305 -> 0.5375  accuracy: 79.75% -> 83.44%     
client [68] (testset)   loss: 0.8458 -> 0.8321  accuracy: 66.67% -> 66.67%     
client [93] (testset)   loss: 0.8877 -> 0.6968  accuracy: 63.28% -> 75.00%     
client [31] (testset)   loss: 0.8616 -> 0.5927  accuracy: 63.31% -> 78.78%     
client [20] (testset)   loss: 0.7098 -> 0.6421  accuracy: 72.86% -> 76.43%     
client [59] (testset)   loss: 0.4526 -> 0.3117  accuracy: 84.82% -> 86.39%     
client [48] (testset)   loss: 0.5865 -> 0.4157  accuracy: 83.66% -> 84.16%     
client [34] (testset)   loss: 0.6401 -> 0.4252  accuracy: 76.44% -> 84.29%     
Projecting gradients ... 
---------------------------- TRAINING EPOCH: 20 ----------------------------   
client [69] (testset)   loss: 0.4699 -> 0.4212  accuracy: 81.51% -> 81.51%     
client [99] (testset)   loss: 0.5100 -> 0.5558  accuracy: 83.44% -> 80.98%     
client [67] (testset)   loss: 0.4672 -> 0.4329  accuracy: 86.21% -> 83.33%     
client [0]  (testset)   loss: 0.5089 -> 0.9478  accuracy: 83.40% -> 70.21%     
client [76] (testset)   loss: 0.4354 -> 0.4110  accuracy: 84.92% -> 84.36%     
client [41] (testset)   loss: 0.6467 -> 1.0822  accuracy: 80.62% -> 68.99%     
client [62] (testset)   loss: 0.5373 -> 0.5743  accuracy: 82.14% -> 81.43%     
client [2]  (testset)   loss: 0.5576 -> 0.4771  accuracy: 78.32% -> 80.09%     
client [14] (testset)   loss: 0.3888 -> 0.2827  accuracy: 86.38% -> 88.73%     
client [46] (testset)   loss: 0.4687 -> 0.3609  accuracy: 85.82% -> 85.07%     
---------------------------- TRAINING EPOCH: 30 ----------------------------   
client [24] (testset)   loss: 0.3668 -> 0.3131  accuracy: 86.73% -> 89.38%     
client [68] (testset)   loss: 0.5451 -> 0.5311  accuracy: 81.94% -> 83.33%     
client [57] (testset)   loss: 0.3731 -> 0.3540  accuracy: 88.71% -> 87.90%     
client [17] (testset)   loss: 0.3950 -> 0.2766  accuracy: 85.20% -> 88.78%     
client [54] (testset)   loss: 0.2658 -> 0.2472  accuracy: 91.95% -> 93.68%     
client [23] (testset)   loss: 0.5822 -> 0.4402  accuracy: 79.22% -> 82.14%     
client [35] (testset)   loss: 0.3201 -> 0.3086  accuracy: 89.07% -> 89.40%     
client [59] (testset)   loss: 0.3570 -> 0.2267  accuracy: 88.48% -> 92.67%     
client [31] (testset)   loss: 0.5231 -> 0.5171  accuracy: 81.29% -> 81.29%     
client [9]  (testset)   loss: 0.5131 -> 0.4577  accuracy: 78.70% -> 82.84%     
---------------------------- TRAINING EPOCH: 40 ----------------------------   
client [64] (testset)   loss: 0.4570 -> 0.4578  accuracy: 85.63% -> 83.53%     
client [33] (testset)   loss: 0.3926 -> 0.4389  accuracy: 82.32% -> 85.35%     
client [16] (testset)   loss: 0.1879 -> 0.1542  accuracy: 95.24% -> 95.24%     
client [44] (testset)   loss: 0.2916 -> 0.3468  accuracy: 90.27% -> 88.11%     
client [8]  (testset)   loss: 0.4243 -> 0.6297  accuracy: 84.89% -> 77.70%     
client [31] (testset)   loss: 0.4874 -> 0.4943  accuracy: 82.01% -> 80.94%     
client [47] (testset)   loss: 0.2612 -> 0.2763  accuracy: 88.80% -> 88.80%     
client [36] (testset)   loss: 0.5198 -> 0.9216  accuracy: 78.72% -> 68.09%     
client [20] (testset)   loss: 0.4582 -> 0.4625  accuracy: 83.57% -> 80.00%     
client [56] (testset)   loss: 0.4702 -> 0.3668  accuracy: 85.27% -> 88.37%     
---------------------------- TRAINING EPOCH: 50 ----------------------------   
client [4]  (testset)   loss: 0.6887 -> 0.7408  accuracy: 72.19% -> 73.96%     
client [60] (testset)   loss: 0.3475 -> 0.2578  accuracy: 88.21% -> 91.70%     
client [28] (testset)   loss: 0.4245 -> 0.4454  accuracy: 84.16% -> 85.15%     
client [25] (testset)   loss: 0.3267 -> 0.3035  accuracy: 87.81% -> 87.10%     
client [58] (testset)   loss: 0.6097 -> 0.6545  accuracy: 79.27% -> 78.05%     
client [44] (testset)   loss: 0.2616 -> 0.2842  accuracy: 90.81% -> 88.65%     
client [39] (testset)   loss: 0.4524 -> 0.4498  accuracy: 83.10% -> 83.10%     
client [29] (testset)   loss: 0.4860 -> 0.5448  accuracy: 82.99% -> 78.23%     
client [3]  (testset)   loss: 0.4007 -> 0.4763  accuracy: 86.06% -> 84.06%     
client [84] (testset)   loss: 0.4656 -> 0.4050  accuracy: 85.53% -> 88.16%     
---------------------------- TRAINING EPOCH: 60 ----------------------------   
client [21] (testset)   loss: 0.3745 -> 0.3508  accuracy: 87.12% -> 88.34%     
client [84] (testset)   loss: 0.4659 -> 0.4091  accuracy: 89.47% -> 86.18%     
client [10] (testset)   loss: 0.2942 -> 0.2462  accuracy: 90.31% -> 92.86%     
client [36] (testset)   loss: 0.4952 -> 0.6446  accuracy: 81.56% -> 76.60%     
client [65] (testset)   loss: 0.3511 -> 0.3777  accuracy: 87.50% -> 88.54%     
client [81] (testset)   loss: 0.4926 -> 1.1310  accuracy: 83.70% -> 65.64%     
client [79] (testset)   loss: 0.3813 -> 0.3276  accuracy: 84.62% -> 86.88%     
client [42] (testset)   loss: 0.3665 -> 0.3517  accuracy: 86.67% -> 87.78%     
client [11] (testset)   loss: 0.3207 -> 0.3203  accuracy: 88.52% -> 89.34%     
client [96] (testset)   loss: 0.2990 -> 0.2826  accuracy: 89.20% -> 89.77%     
---------------------------- TRAINING EPOCH: 70 ----------------------------   
client [8]  (testset)   loss: 0.3918 -> 0.3819  accuracy: 86.33% -> 87.05%     
client [53] (testset)   loss: 0.3196 -> 0.3156  accuracy: 87.99% -> 90.11%     
client [52] (testset)   loss: 0.3558 -> 0.3108  accuracy: 84.18% -> 88.70%     
client [42] (testset)   loss: 0.3765 -> 0.4585  accuracy: 86.67% -> 85.56%     
client [69] (testset)   loss: 0.2885 -> 0.2904  accuracy: 89.04% -> 89.04%     
client [59] (testset)   loss: 0.2025 -> 0.1850  accuracy: 92.15% -> 92.67%     
client [7]  (testset)   loss: 0.3956 -> 0.4066  accuracy: 84.52% -> 82.58%     
client [26] (testset)   loss: 0.1760 -> 0.2253  accuracy: 94.69% -> 94.69%     
client [49] (testset)   loss: 0.3936 -> 0.4137  accuracy: 84.88% -> 83.72%     
client [98] (testset)   loss: 0.4615 -> 0.4514  accuracy: 84.07% -> 87.36%     
---------------------------- TRAINING EPOCH: 80 ----------------------------   
client [98] (testset)   loss: 0.4269 -> 0.4498  accuracy: 87.36% -> 87.36%     
client [47] (testset)   loss: 0.1926 -> 0.1796  accuracy: 92.00% -> 94.40%     
client [21] (testset)   loss: 0.3552 -> 0.3041  accuracy: 88.34% -> 88.34%     
client [77] (testset)   loss: 0.4668 -> 0.3850  accuracy: 79.17% -> 85.83%     
client [95] (testset)   loss: 0.3001 -> 0.2689  accuracy: 92.55% -> 90.68%     
client [91] (testset)   loss: 0.5056 -> 0.4568  accuracy: 80.75% -> 81.37%     
client [14] (testset)   loss: 0.2262 -> 0.1719  accuracy: 91.55% -> 94.84%     
client [99] (testset)   loss: 0.2831 -> 0.2725  accuracy: 89.57% -> 90.18%     
client [20] (testset)   loss: 0.3684 -> 0.3894  accuracy: 87.86% -> 85.71%     
client [39] (testset)   loss: 0.4098 -> 0.4517  accuracy: 85.45% -> 87.32%     
---------------------------- TRAINING EPOCH: 90 ----------------------------   
client [52] (testset)   loss: 0.3609 -> 0.3414  accuracy: 83.05% -> 87.01%     
client [62] (testset)   loss: 0.3249 -> 0.4582  accuracy: 89.29% -> 83.57%     
client [71] (testset)   loss: 0.2173 -> 0.2505  accuracy: 94.94% -> 91.14%     
client [97] (testset)   loss: 0.4973 -> 0.5312  accuracy: 82.93% -> 78.86%     
client [30] (testset)   loss: 0.2892 -> 0.9852  accuracy: 86.44% -> 64.41%     
client [88] (testset)   loss: 0.7555 -> 2.4156  accuracy: 77.60% -> 58.33%     
client [60] (testset)   loss: 0.2835 -> 0.2591  accuracy: 91.27% -> 91.70%     
client [82] (testset)   loss: 0.2082 -> 0.2234  accuracy: 90.48% -> 91.67%     
client [91] (testset)   loss: 0.4477 -> 0.4475  accuracy: 81.37% -> 80.75%     
client [57] (testset)   loss: 0.2156 -> 0.2774  accuracy: 95.16% -> 88.71%     
---------------------------- TRAINING EPOCH: 100 ----------------------------  
client [31] (testset)   loss: 0.4993 -> 0.4819  accuracy: 82.01% -> 82.37%     
client [15] (testset)   loss: 0.2386 -> 0.2229  accuracy: 91.46% -> 92.68%     
client [71] (testset)   loss: 0.2118 -> 0.2150  accuracy: 94.30% -> 93.04%     
client [97] (testset)   loss: 0.4687 -> 0.5136  accuracy: 83.74% -> 81.30%     
client [53] (testset)   loss: 0.2671 -> 0.2770  accuracy: 90.46% -> 90.11%     
client [77] (testset)   loss: 0.4368 -> 0.4140  accuracy: 80.83% -> 83.33%     
client [76] (testset)   loss: 0.2174 -> 0.2141  accuracy: 92.18% -> 91.62%     
client [79] (testset)   loss: 0.3272 -> 0.3431  accuracy: 88.69% -> 88.24%     
client [28] (testset)   loss: 0.3158 -> 0.3878  accuracy: 87.13% -> 87.13%     
client [99] (testset)   loss: 0.2734 -> 0.2338  accuracy: 93.87% -> 91.41%     
---------------------------- TRAINING EPOCH: 110 ----------------------------  
client [97] (testset)   loss: 0.4883 -> 0.4689  accuracy: 83.74% -> 82.11%     
client [86] (testset)   loss: 0.1997 -> 0.1946  accuracy: 92.11% -> 94.21%     
client [34] (testset)   loss: 0.2330 -> 0.2047  accuracy: 90.58% -> 91.10%     
client [73] (testset)   loss: 0.3698 -> 0.3379  accuracy: 87.92% -> 91.28%     
client [5]  (testset)   loss: 0.3177 -> 0.3443  accuracy: 89.17% -> 90.83%     
client [96] (testset)   loss: 0.2536 -> 0.2364  accuracy: 89.77% -> 92.05%     
client [22] (testset)   loss: 0.4303 -> 0.4112  accuracy: 87.68% -> 87.68%     
client [60] (testset)   loss: 0.2723 -> 0.2284  accuracy: 91.27% -> 93.01%     
client [66] (testset)   loss: 0.2168 -> 0.2429  accuracy: 91.38% -> 90.52%     
client [83] (testset)   loss: 0.5818 -> 1.2230  accuracy: 83.90% -> 73.03%     
---------------------------- TRAINING EPOCH: 120 ----------------------------  
client [76] (testset)   loss: 0.2120 -> 0.2046  accuracy: 92.18% -> 92.74%     
client [65] (testset)   loss: 0.3309 -> 0.3304  accuracy: 89.58% -> 91.15%     
client [95] (testset)   loss: 0.2748 -> 0.2582  accuracy: 93.17% -> 92.55%     
client [17] (testset)   loss: 0.2735 -> 0.1949  accuracy: 90.31% -> 94.39%     
client [8]  (testset)   loss: 0.3672 -> 0.3621  accuracy: 88.49% -> 89.21%     
client [35] (testset)   loss: 0.1826 -> 0.1904  accuracy: 92.72% -> 92.05%     
client [98] (testset)   loss: 0.4097 -> 1.5955  accuracy: 86.81% -> 74.18%     
client [53] (testset)   loss: 0.2492 -> 0.3210  accuracy: 90.11% -> 91.87%     
client [43] (testset)   loss: 0.1608 -> 0.1061  accuracy: 93.67% -> 96.20%     
client [64] (testset)   loss: 0.3190 -> 0.3132  accuracy: 89.82% -> 90.42%     
---------------------------- TRAINING EPOCH: 130 ----------------------------  
client [21] (testset)   loss: 0.3083 -> 0.3221  accuracy: 89.57% -> 88.96%     
client [88] (testset)   loss: 0.7375 -> 0.7181  accuracy: 77.08% -> 79.17%     
client [38] (testset)   loss: 0.5211 -> 0.4130  accuracy: 84.89% -> 87.77%     
client [3]  (testset)   loss: 0.2940 -> 0.3279  accuracy: 91.63% -> 88.45%     
client [5]  (testset)   loss: 0.3119 -> 0.3590  accuracy: 89.17% -> 90.00%     
client [41] (testset)   loss: 0.3304 -> 0.3243  accuracy: 89.92% -> 88.37%     
client [7]  (testset)   loss: 0.3108 -> 0.3553  accuracy: 88.39% -> 83.23%     
client [37] (testset)   loss: 0.2770 -> 0.2606  accuracy: 90.97% -> 92.90%     
client [45] (testset)   loss: 0.4071 -> 0.3187  accuracy: 85.32% -> 90.37%     
client [47] (testset)   loss: 0.2042 -> 0.1731  accuracy: 91.20% -> 95.20%     
---------------------------- TRAINING EPOCH: 140 ----------------------------  
client [16] (testset)   loss: 0.1423 -> 0.0999  accuracy: 94.18% -> 96.83%     
client [11] (testset)   loss: 0.2370 -> 0.2658  accuracy: 90.98% -> 90.16%     
client [37] (testset)   loss: 0.2728 -> 0.2829  accuracy: 92.26% -> 92.26%     
client [41] (testset)   loss: 0.3575 -> 0.6117  accuracy: 87.60% -> 79.07%     
client [95] (testset)   loss: 0.2665 -> 0.2404  accuracy: 92.55% -> 93.79%     
client [53] (testset)   loss: 0.2457 -> 0.2224  accuracy: 91.17% -> 92.23%     
client [22] (testset)   loss: 0.4188 -> 0.4204  accuracy: 89.13% -> 87.68%     
client [25] (testset)   loss: 0.3007 -> 0.2085  accuracy: 89.25% -> 92.47%     
client [69] (testset)   loss: 0.2189 -> 0.2358  accuracy: 93.15% -> 93.15%     
client [46] (testset)   loss: 0.3426 -> 0.3170  accuracy: 88.81% -> 89.55%     
---------------------------- TRAINING EPOCH: 150 ----------------------------  
client [47] (testset)   loss: 0.1698 -> 0.2034  accuracy: 92.00% -> 92.80%     
client [69] (testset)   loss: 0.2291 -> 0.2377  accuracy: 93.15% -> 91.78%     
client [82] (testset)   loss: 0.1562 -> 0.1833  accuracy: 94.64% -> 92.26%     
client [45] (testset)   loss: 0.4214 -> 0.3376  accuracy: 84.40% -> 87.16%     
client [7]  (testset)   loss: 0.2758 -> 0.3187  accuracy: 89.68% -> 85.81%     
client [50] (testset)   loss: 0.3293 -> 0.4067  accuracy: 88.28% -> 84.52%     
client [35] (testset)   loss: 0.1633 -> 0.1780  accuracy: 93.71% -> 92.38%     
client [24] (testset)   loss: 0.2426 -> 0.2739  accuracy: 89.38% -> 89.38%     
client [15] (testset)   loss: 0.2179 -> 0.2210  accuracy: 93.29% -> 92.68%     
client [58] (testset)   loss: 0.5116 -> 0.4974  accuracy: 80.89% -> 84.55%     
---------------------------- TRAINING EPOCH: 160 ----------------------------  
client [48] (testset)   loss: 0.2563 -> 0.1960  accuracy: 92.08% -> 95.05%     
client [76] (testset)   loss: 0.1791 -> 0.1958  accuracy: 92.74% -> 92.74%     
client [67] (testset)   loss: 0.2271 -> 0.2110  accuracy: 93.10% -> 93.68%     
client [37] (testset)   loss: 0.2815 -> 0.2610  accuracy: 93.55% -> 92.90%     
client [58] (testset)   loss: 0.5127 -> 0.4578  accuracy: 81.30% -> 84.55%     
client [64] (testset)   loss: 0.3048 -> 0.3195  accuracy: 90.42% -> 88.62%     
client [77] (testset)   loss: 0.3902 -> 0.3742  accuracy: 85.83% -> 84.17%     
client [55] (testset)   loss: 0.3269 -> 0.3623  accuracy: 90.73% -> 88.31%     
client [12] (testset)   loss: 0.5750 -> 0.7133  accuracy: 84.00% -> 79.00%     
client [89] (testset)   loss: 0.2947 -> 0.3131  accuracy: 91.24% -> 89.05%     
---------------------------- TRAINING EPOCH: 170 ----------------------------  
client [84] (testset)   loss: 0.3909 -> 0.3887  accuracy: 87.50% -> 90.13%     
client [51] (testset)   loss: 0.2605 -> 0.2677  accuracy: 90.71% -> 88.57%     
client [8]  (testset)   loss: 0.3364 -> 0.3527  accuracy: 89.21% -> 89.21%     
client [18] (testset)   loss: 0.2810 -> 0.3330  accuracy: 91.79% -> 91.79%     
client [94] (testset)   loss: 0.3263 -> 0.3145  accuracy: 88.46% -> 88.76%     
client [81] (testset)   loss: 0.3416 -> 0.2546  accuracy: 88.99% -> 91.63%     
client [3]  (testset)   loss: 0.3003 -> 0.3035  accuracy: 90.44% -> 90.04%     
client [11] (testset)   loss: 0.2366 -> 0.2857  accuracy: 90.16% -> 90.98%     
client [95] (testset)   loss: 0.2504 -> 0.2681  accuracy: 93.79% -> 91.93%     
client [67] (testset)   loss: 0.2112 -> 0.2088  accuracy: 93.68% -> 91.95%     
---------------------------- TRAINING EPOCH: 180 ----------------------------  
client [21] (testset)   loss: 0.3302 -> 0.3907  accuracy: 89.57% -> 88.34%     
client [79] (testset)   loss: 0.3350 -> 0.3239  accuracy: 88.69% -> 89.59%     
client [58] (testset)   loss: 0.5477 -> 0.4229  accuracy: 80.89% -> 86.99%     
client [88] (testset)   loss: 0.7865 -> 0.5523  accuracy: 77.60% -> 82.29%     
client [46] (testset)   loss: 0.3630 -> 0.3241  accuracy: 88.81% -> 89.55%     
client [11] (testset)   loss: 0.2751 -> 0.2769  accuracy: 90.16% -> 91.80%     
client [55] (testset)   loss: 0.3458 -> 0.3389  accuracy: 89.11% -> 88.71%     
client [13] (testset)   loss: 0.2652 -> 0.2642  accuracy: 91.58% -> 92.63%     
client [31] (testset)   loss: 0.4665 -> 0.3970  accuracy: 82.73% -> 87.77%     
client [75] (testset)   loss: 0.2317 -> 0.2852  accuracy: 91.03% -> 91.03%     
---------------------------- TRAINING EPOCH: 190 ----------------------------  
client [19] (testset)   loss: 0.1242 -> 0.1104  accuracy: 93.85% -> 96.15%     
client [7]  (testset)   loss: 0.2772 -> 0.2656  accuracy: 90.97% -> 89.03%     
client [57] (testset)   loss: 0.1818 -> 0.2071  accuracy: 93.55% -> 92.74%     
client [13] (testset)   loss: 0.2606 -> 0.2474  accuracy: 92.63% -> 92.63%     
client [43] (testset)   loss: 0.1145 -> 0.0764  accuracy: 93.67% -> 96.20%     
client [91] (testset)   loss: 0.4113 -> 0.4178  accuracy: 85.09% -> 81.37%     
client [10] (testset)   loss: 0.2096 -> 0.1696  accuracy: 93.88% -> 94.39%     
client [64] (testset)   loss: 0.2904 -> 0.2963  accuracy: 91.62% -> 90.42%     
client [82] (testset)   loss: 0.1322 -> 0.1241  accuracy: 95.24% -> 94.05%     
client [22] (testset)   loss: 0.4301 -> 0.3876  accuracy: 89.13% -> 88.41%     
---------------------------- TRAINING EPOCH: 200 ----------------------------  
client [20] (testset)   loss: 0.3415 -> 0.3659  accuracy: 88.57% -> 85.00%     
client [23] (testset)   loss: 0.3601 -> 0.2606  accuracy: 87.66% -> 92.21%     
client [88] (testset)   loss: 0.8468 -> 0.6320  accuracy: 76.04% -> 83.33%     
client [98] (testset)   loss: 0.3653 -> 0.5516  accuracy: 89.56% -> 85.16%     
client [79] (testset)   loss: 0.3479 -> 0.3267  accuracy: 88.69% -> 89.14%     
client [21] (testset)   loss: 0.3053 -> 0.2523  accuracy: 90.18% -> 90.80%     
client [92] (testset)   loss: 0.3698 -> 0.3431  accuracy: 87.84% -> 89.64%     
client [56] (testset)   loss: 0.3997 -> 0.3191  accuracy: 87.60% -> 88.37%     
client [5]  (testset)   loss: 0.3049 -> 0.2966  accuracy: 89.17% -> 90.00%     
client [52] (testset)   loss: 0.2906 -> 0.2418  accuracy: 87.01% -> 89.27%     
---------------------------- TRAINING EPOCH: 210 ----------------------------  
client [67] (testset)   loss: 0.1893 -> 0.2291  accuracy: 94.25% -> 90.80%     
client [54] (testset)   loss: 0.1260 -> 0.1211  accuracy: 94.25% -> 93.68%     
client [14] (testset)   loss: 0.1804 -> 0.1198  accuracy: 92.49% -> 96.71%     
client [99] (testset)   loss: 0.2380 -> 0.2539  accuracy: 91.41% -> 93.25%     
client [36] (testset)   loss: 0.3429 -> 0.3701  accuracy: 90.78% -> 88.65%     
client [30] (testset)   loss: 0.2304 -> 0.1701  accuracy: 92.37% -> 94.07%     
client [38] (testset)   loss: 0.5817 -> 0.3737  accuracy: 84.89% -> 89.93%     
client [15] (testset)   loss: 0.2101 -> 0.2032  accuracy: 93.29% -> 93.90%     
client [6]  (testset)   loss: 0.2626 -> 0.3292  accuracy: 89.77% -> 90.34%     
client [53] (testset)   loss: 0.2251 -> 0.2367  accuracy: 92.93% -> 92.93%     
---------------------------- TRAINING EPOCH: 220 ----------------------------  
client [99] (testset)   loss: 0.2461 -> 0.2495  accuracy: 89.57% -> 92.64%     
client [6]  (testset)   loss: 0.2755 -> 0.2936  accuracy: 90.91% -> 87.50%     
client [83] (testset)   loss: 0.5461 -> 0.3827  accuracy: 85.02% -> 87.27%     
client [42] (testset)   loss: 0.3082 -> 0.2831  accuracy: 85.56% -> 90.00%     
client [34] (testset)   loss: 0.2041 -> 0.1731  accuracy: 93.19% -> 93.19%     
client [15] (testset)   loss: 0.2208 -> 0.2106  accuracy: 93.29% -> 93.29%     
client [47] (testset)   loss: 0.1913 -> 0.1964  accuracy: 92.00% -> 93.60%     
client [55] (testset)   loss: 0.3155 -> 0.3427  accuracy: 90.32% -> 89.11%     
client [51] (testset)   loss: 0.3217 -> 0.2820  accuracy: 90.00% -> 87.86%     
client [95] (testset)   loss: 0.2353 -> 0.2365  accuracy: 93.17% -> 93.79%     
---------------------------- TRAINING EPOCH: 230 ----------------------------  
client [71] (testset)   loss: 0.2019 -> 0.2710  accuracy: 94.30% -> 92.41%     
client [15] (testset)   loss: 0.2106 -> 0.1898  accuracy: 93.29% -> 94.51%     
client [33] (testset)   loss: 0.2252 -> 0.2352  accuracy: 91.41% -> 91.41%     
client [99] (testset)   loss: 0.2466 -> 0.2732  accuracy: 92.64% -> 92.64%     
client [90] (testset)   loss: 0.2454 -> 0.1921  accuracy: 91.80% -> 91.80%     
client [57] (testset)   loss: 0.1719 -> 0.2042  accuracy: 94.35% -> 92.74%     
client [27] (testset)   loss: 0.3690 -> 0.3496  accuracy: 88.89% -> 90.12%     
client [78] (testset)   loss: 0.4541 -> 0.4160  accuracy: 84.48% -> 85.34%     
client [36] (testset)   loss: 0.3731 -> 0.4085  accuracy: 90.78% -> 90.07%     
client [88] (testset)   loss: 0.7667 -> 2.6137  accuracy: 77.08% -> 61.46%     
---------------------------- TRAINING EPOCH: 240 ----------------------------  
client [70] (testset)   loss: 0.2263 -> 0.2003  accuracy: 92.16% -> 93.73%     
client [35] (testset)   loss: 0.1707 -> 0.2113  accuracy: 93.05% -> 91.72%     
client [16] (testset)   loss: 0.0965 -> 0.0703  accuracy: 96.83% -> 96.83%     
client [80] (testset)   loss: 0.5008 -> 0.5103  accuracy: 85.93% -> 83.92%     
client [38] (testset)   loss: 0.6004 -> 0.3886  accuracy: 85.61% -> 88.49%     
client [78] (testset)   loss: 0.4653 -> 0.4412  accuracy: 83.62% -> 84.91%     
client [68] (testset)   loss: 0.4844 -> 0.5154  accuracy: 84.72% -> 83.33%     
client [11] (testset)   loss: 0.2217 -> 0.2629  accuracy: 90.98% -> 90.98%     
client [64] (testset)   loss: 0.3124 -> 0.2816  accuracy: 90.12% -> 91.02%     
client [82] (testset)   loss: 0.1084 -> 0.1417  accuracy: 96.43% -> 94.64%     
---------------------------- TRAINING EPOCH: 250 ----------------------------  
client [30] (testset)   loss: 0.2582 -> 0.2019  accuracy: 90.68% -> 93.22%     
client [27] (testset)   loss: 0.3369 -> 0.3418  accuracy: 88.89% -> 90.12%     
client [74] (testset)   loss: 0.3392 -> 0.4075  accuracy: 88.62% -> 84.43%     
client [45] (testset)   loss: 0.3607 -> 0.2872  accuracy: 88.99% -> 91.74%     
client [6]  (testset)   loss: 0.2496 -> 0.2780  accuracy: 89.77% -> 88.64%     
client [36] (testset)   loss: 0.3491 -> 0.6682  accuracy: 89.36% -> 82.27%     
client [63] (testset)   loss: 0.1825 -> 0.1416  accuracy: 91.67% -> 95.00%     
client [76] (testset)   loss: 0.1616 -> 0.1864  accuracy: 94.41% -> 92.74%     
client [83] (testset)   loss: 0.5190 -> 0.4158  accuracy: 85.39% -> 87.64%     
client [86] (testset)   loss: 0.2062 -> 0.1925  accuracy: 92.63% -> 94.21%     
---------------------------- TRAINING EPOCH: 260 ----------------------------  
client [83] (testset)   loss: 0.5499 -> 2.4230  accuracy: 85.02% -> 65.92%     
client [99] (testset)   loss: 0.2443 -> 0.2369  accuracy: 92.64% -> 92.64%     
client [74] (testset)   loss: 0.3652 -> 0.4000  accuracy: 88.62% -> 85.63%     
client [73] (testset)   loss: 0.3100 -> 0.2898  accuracy: 89.93% -> 90.60%     
client [29] (testset)   loss: 0.3658 -> 0.3601  accuracy: 88.44% -> 88.44%     
client [92] (testset)   loss: 0.3653 -> 0.3442  accuracy: 89.19% -> 88.74%     
client [6]  (testset)   loss: 0.2529 -> 0.2953  accuracy: 89.20% -> 91.48%     
client [61] (testset)   loss: 0.1686 -> 0.2028  accuracy: 91.74% -> 90.83%     
client [21] (testset)   loss: 0.2957 -> 0.2588  accuracy: 89.57% -> 91.41%     
client [67] (testset)   loss: 0.1821 -> 0.2161  accuracy: 95.40% -> 93.68%     
---------------------------- TRAINING EPOCH: 270 ----------------------------  
client [83] (testset)   loss: 0.5973 -> 0.7851  accuracy: 84.27% -> 79.03%     
client [32] (testset)   loss: 0.3247 -> 0.2565  accuracy: 88.98% -> 89.83%     
client [95] (testset)   loss: 0.2329 -> 0.2152  accuracy: 93.17% -> 93.79%     
client [61] (testset)   loss: 0.1737 -> 0.1951  accuracy: 92.66% -> 89.91%     
client [27] (testset)   loss: 0.3163 -> 0.4633  accuracy: 90.74% -> 85.80%     
client [25] (testset)   loss: 0.2127 -> 0.1845  accuracy: 91.76% -> 93.55%     
client [68] (testset)   loss: 0.4691 -> 0.5456  accuracy: 83.33% -> 81.94%     
client [34] (testset)   loss: 0.2184 -> 0.1579  accuracy: 91.10% -> 93.72%     
client [71] (testset)   loss: 0.2263 -> 0.2300  accuracy: 93.67% -> 93.04%     
client [89] (testset)   loss: 0.2673 -> 0.2134  accuracy: 91.24% -> 93.43%     
---------------------------- TRAINING EPOCH: 280 ----------------------------  
client [78] (testset)   loss: 0.4517 -> 0.5411  accuracy: 84.91% -> 84.48%     
client [81] (testset)   loss: 0.3669 -> 0.3035  accuracy: 90.31% -> 90.75%     
client [51] (testset)   loss: 0.3282 -> 0.2890  accuracy: 88.57% -> 89.29%     
client [54] (testset)   loss: 0.1269 -> 0.1266  accuracy: 95.98% -> 95.40%     
client [65] (testset)   loss: 0.3193 -> 0.3007  accuracy: 91.67% -> 93.23%     
client [41] (testset)   loss: 0.2860 -> 0.3125  accuracy: 91.47% -> 88.37%     
client [11] (testset)   loss: 0.2204 -> 0.2730  accuracy: 93.44% -> 91.80%     
client [85] (testset)   loss: 0.3277 -> 0.3337  accuracy: 87.97% -> 89.47%     
client [12] (testset)   loss: 0.5276 -> 0.6405  accuracy: 85.00% -> 79.00%     
client [23] (testset)   loss: 0.3337 -> 0.2677  accuracy: 89.29% -> 91.23%     
---------------------------- TRAINING EPOCH: 290 ----------------------------  
client [16] (testset)   loss: 0.1194 -> 0.0808  accuracy: 94.71% -> 97.35%     
client [65] (testset)   loss: 0.3174 -> 0.3112  accuracy: 92.19% -> 93.23%     
client [53] (testset)   loss: 0.2485 -> 0.3233  accuracy: 92.23% -> 92.58%     
client [58] (testset)   loss: 0.4920 -> 0.4325  accuracy: 84.15% -> 85.37%     
client [72] (testset)   loss: 0.3249 -> 0.9056  accuracy: 92.55% -> 86.96%     
client [7]  (testset)   loss: 0.2346 -> 0.2699  accuracy: 90.97% -> 90.32%     
client [71] (testset)   loss: 0.2220 -> 0.2435  accuracy: 93.67% -> 92.41%     
client [59] (testset)   loss: 0.1572 -> 0.1678  accuracy: 95.81% -> 93.19%     
client [86] (testset)   loss: 0.2192 -> 0.1772  accuracy: 93.16% -> 93.16%     
client [39] (testset)   loss: 0.3996 -> 0.4074  accuracy: 88.26% -> 88.73%     
---------------------------- TRAINING EPOCH: 300 ----------------------------  
client [99] (testset)   loss: 0.2617 -> 0.2461  accuracy: 90.18% -> 92.64%     
client [7]  (testset)   loss: 0.2615 -> 0.2589  accuracy: 91.61% -> 90.97%     
client [17] (testset)   loss: 0.2257 -> 0.1541  accuracy: 91.84% -> 94.39%     
client [64] (testset)   loss: 0.2750 -> 0.3382  accuracy: 92.51% -> 88.62%     
client [37] (testset)   loss: 0.3125 -> 0.2551  accuracy: 92.90% -> 94.19%     
client [29] (testset)   loss: 0.3594 -> 0.3644  accuracy: 88.44% -> 88.44%     
client [93] (testset)   loss: 0.3371 -> 0.3783  accuracy: 88.28% -> 88.28%     
client [73] (testset)   loss: 0.3385 -> 0.3025  accuracy: 89.26% -> 90.60%     
client [40] (testset)   loss: 0.1705 -> 0.1682  accuracy: 93.94% -> 93.18%     
client [76] (testset)   loss: 0.1440 -> 0.1600  accuracy: 93.30% -> 93.85%     
---------------------------- TRAINING EPOCH: 310 ----------------------------  
client [31] (testset)   loss: 0.4381 -> 0.3732  accuracy: 86.69% -> 88.49%     
client [89] (testset)   loss: 0.2520 -> 0.2252  accuracy: 91.97% -> 92.70%     
client [77] (testset)   loss: 0.4213 -> 0.3335  accuracy: 87.50% -> 90.00%     
client [90] (testset)   loss: 0.2339 -> 0.2807  accuracy: 91.26% -> 89.07%     
client [26] (testset)   loss: 0.2267 -> 0.2813  accuracy: 96.46% -> 92.04%     
client [50] (testset)   loss: 0.3307 -> 0.3631  accuracy: 89.12% -> 88.28%     
client [30] (testset)   loss: 0.2574 -> 0.1931  accuracy: 90.68% -> 92.37%     
client [70] (testset)   loss: 0.2301 -> 0.2115  accuracy: 91.76% -> 92.16%     
client [41] (testset)   loss: 0.2938 -> 0.5766  accuracy: 89.92% -> 81.40%     
client [99] (testset)   loss: 0.2320 -> 0.3118  accuracy: 90.80% -> 90.80%     
---------------------------- TRAINING EPOCH: 320 ----------------------------  
client [68] (testset)   loss: 0.4946 -> 0.5371  accuracy: 83.33% -> 80.56%     
client [70] (testset)   loss: 0.2015 -> 0.2044  accuracy: 92.55% -> 92.94%     
client [52] (testset)   loss: 0.3477 -> 0.2681  accuracy: 86.44% -> 91.53%     
client [1]  (testset)   loss: 0.1647 -> 0.2257  accuracy: 95.06% -> 95.06%     
client [2]  (testset)   loss: 0.3897 -> 0.4286  accuracy: 88.94% -> 88.05%     
client [67] (testset)   loss: 0.1958 -> 0.2199  accuracy: 92.53% -> 90.80%     
client [92] (testset)   loss: 0.3598 -> 0.3706  accuracy: 90.54% -> 88.74%     
client [35] (testset)   loss: 0.1569 -> 0.1780  accuracy: 94.37% -> 93.71%     
client [36] (testset)   loss: 0.4293 -> 0.4026  accuracy: 87.94% -> 90.07%     
client [64] (testset)   loss: 0.3053 -> 0.3124  accuracy: 91.02% -> 91.32%     
---------------------------- TRAINING EPOCH: 330 ----------------------------  
client [44] (testset)   loss: 0.3025 -> 0.3531  accuracy: 92.43% -> 91.89%     
client [6]  (testset)   loss: 0.2591 -> 0.3008  accuracy: 90.34% -> 90.34%     
client [12] (testset)   loss: 0.5519 -> 0.6520  accuracy: 82.00% -> 81.00%     
client [55] (testset)   loss: 0.3415 -> 0.3670  accuracy: 89.52% -> 89.92%     
client [29] (testset)   loss: 0.3951 -> 0.3813  accuracy: 87.07% -> 89.12%     
client [9]  (testset)   loss: 0.3714 -> 0.3989  accuracy: 88.17% -> 86.98%     
client [43] (testset)   loss: 0.0683 -> 0.0519  accuracy: 97.47% -> 96.20%     
client [77] (testset)   loss: 0.4135 -> 0.3197  accuracy: 89.17% -> 87.50%     
client [98] (testset)   loss: 0.4145 -> 0.4160  accuracy: 88.46% -> 90.11%     
client [78] (testset)   loss: 0.4704 -> 0.4268  accuracy: 84.91% -> 85.78%     
---------------------------- TRAINING EPOCH: 340 ----------------------------  
client [92] (testset)   loss: 0.3812 -> 0.3985  accuracy: 90.09% -> 89.19%     
client [80] (testset)   loss: 0.5577 -> 0.5878  accuracy: 86.43% -> 84.42%     
client [63] (testset)   loss: 0.1830 -> 0.1620  accuracy: 93.33% -> 92.50%     
client [76] (testset)   loss: 0.1623 -> 0.1683  accuracy: 94.97% -> 93.85%     
client [78] (testset)   loss: 0.4819 -> 0.4491  accuracy: 83.19% -> 85.78%     
client [25] (testset)   loss: 0.2462 -> 0.1844  accuracy: 90.68% -> 94.27%     
client [58] (testset)   loss: 0.5187 -> 0.7220  accuracy: 84.55% -> 80.89%     
client [13] (testset)   loss: 0.2506 -> 0.2385  accuracy: 92.63% -> 93.16%     
client [17] (testset)   loss: 0.2144 -> 0.1371  accuracy: 91.84% -> 95.41%     
client [38] (testset)   loss: 0.5325 -> 0.4311  accuracy: 88.49% -> 88.49%     
---------------------------- TRAINING EPOCH: 350 ----------------------------  
client [72] (testset)   loss: 0.3410 -> 0.3948  accuracy: 92.55% -> 91.30%     
client [82] (testset)   loss: 0.1122 -> 0.2185  accuracy: 95.83% -> 94.05%     
client [86] (testset)   loss: 0.2083 -> 0.1983  accuracy: 93.68% -> 93.16%     
client [51] (testset)   loss: 0.3138 -> 0.3235  accuracy: 90.00% -> 89.29%     
client [96] (testset)   loss: 0.2423 -> 0.2217  accuracy: 89.77% -> 93.75%     
client [42] (testset)   loss: 0.3555 -> 0.2143  accuracy: 87.78% -> 91.11%     
client [55] (testset)   loss: 0.3448 -> 0.3698  accuracy: 91.53% -> 89.92%     
client [13] (testset)   loss: 0.2530 -> 0.2414  accuracy: 93.16% -> 93.68%     
client [1]  (testset)   loss: 0.1555 -> 0.2349  accuracy: 95.06% -> 91.36%     
client [12] (testset)   loss: 0.5734 -> 0.6986  accuracy: 82.00% -> 81.00%     
---------------------------- TRAINING EPOCH: 360 ----------------------------  
client [68] (testset)   loss: 0.4791 -> 0.5477  accuracy: 83.33% -> 79.17%     
client [23] (testset)   loss: 0.3522 -> 0.2700  accuracy: 88.96% -> 91.23%     
client [46] (testset)   loss: 0.4313 -> 0.3332  accuracy: 88.81% -> 91.79%     
client [41] (testset)   loss: 0.2887 -> 0.5008  accuracy: 92.25% -> 85.27%     
client [25] (testset)   loss: 0.2110 -> 0.1848  accuracy: 92.83% -> 93.55%     
client [58] (testset)   loss: 0.5274 -> 0.4211  accuracy: 84.15% -> 86.99%     
client [14] (testset)   loss: 0.1718 -> 0.1016  accuracy: 94.84% -> 95.77%     
client [33] (testset)   loss: 0.2587 -> 0.2577  accuracy: 92.93% -> 91.92%     
client [85] (testset)   loss: 0.3093 -> 0.3276  accuracy: 88.72% -> 90.23%     
client [62] (testset)   loss: 0.3034 -> 0.3457  accuracy: 90.00% -> 87.14%     
---------------------------- TRAINING EPOCH: 370 ----------------------------  
client [98] (testset)   loss: 0.4041 -> 0.4295  accuracy: 89.01% -> 90.11%     
client [63] (testset)   loss: 0.2226 -> 0.1620  accuracy: 90.00% -> 92.50%     
client [70] (testset)   loss: 0.2280 -> 0.2215  accuracy: 91.76% -> 92.94%     
client [65] (testset)   loss: 0.3378 -> 0.3111  accuracy: 91.67% -> 93.23%     
client [14] (testset)   loss: 0.1597 -> 0.1137  accuracy: 93.43% -> 95.31%     
client [73] (testset)   loss: 0.3265 -> 0.4655  accuracy: 89.93% -> 83.22%     
client [34] (testset)   loss: 0.1815 -> 0.1491  accuracy: 93.19% -> 94.24%     
client [99] (testset)   loss: 0.2375 -> 0.2579  accuracy: 92.02% -> 92.64%     
client [69] (testset)   loss: 0.1766 -> 0.2061  accuracy: 92.47% -> 91.10%     
client [46] (testset)   loss: 0.4146 -> 0.3067  accuracy: 90.30% -> 91.04%     
---------------------------- TRAINING EPOCH: 380 ----------------------------  
client [99] (testset)   loss: 0.2526 -> 0.2798  accuracy: 92.02% -> 92.64%     
client [93] (testset)   loss: 0.3853 -> 0.3660  accuracy: 86.72% -> 89.06%     
client [11] (testset)   loss: 0.2307 -> 0.2300  accuracy: 92.62% -> 89.34%     
client [58] (testset)   loss: 0.5638 -> 0.5197  accuracy: 82.52% -> 86.18%     
client [81] (testset)   loss: 0.3454 -> 0.2964  accuracy: 90.75% -> 91.63%     
client [85] (testset)   loss: 0.3256 -> 0.3233  accuracy: 88.72% -> 88.72%     
client [89] (testset)   loss: 0.2494 -> 0.2288  accuracy: 92.70% -> 93.43%     
client [45] (testset)   loss: 0.3722 -> 0.3061  accuracy: 89.45% -> 90.37%     
client [8]  (testset)   loss: 0.3777 -> 0.3981  accuracy: 89.93% -> 89.93%     
client [68] (testset)   loss: 0.5362 -> 0.5462  accuracy: 83.33% -> 81.94%     
---------------------------- TRAINING EPOCH: 390 ----------------------------  
client [67] (testset)   loss: 0.1884 -> 0.2009  accuracy: 93.10% -> 92.53%     
client [72] (testset)   loss: 0.3769 -> 0.4017  accuracy: 90.68% -> 92.55%     
client [1]  (testset)   loss: 0.1500 -> 0.2476  accuracy: 95.06% -> 91.36%     
client [78] (testset)   loss: 0.4801 -> 0.4206  accuracy: 84.05% -> 87.07%     
client [83] (testset)   loss: 0.5654 -> 0.4145  accuracy: 86.14% -> 89.14%     
client [21] (testset)   loss: 0.3354 -> 0.2619  accuracy: 88.96% -> 92.02%     
client [56] (testset)   loss: 0.4173 -> 0.3473  accuracy: 90.70% -> 89.15%     
client [44] (testset)   loss: 0.3033 -> 0.3506  accuracy: 92.43% -> 90.27%     
client [92] (testset)   loss: 0.3815 -> 0.3992  accuracy: 90.09% -> 89.64%     
client [27] (testset)   loss: 0.3512 -> 0.3607  accuracy: 90.74% -> 90.12%     
---------------------------- TRAINING EPOCH: 400 ----------------------------  
client [10] (testset)   loss: 0.1701 -> 0.1637  accuracy: 94.90% -> 94.90%     
client [39] (testset)   loss: 0.3942 -> 0.5705  accuracy: 90.14% -> 88.26%     
client [65] (testset)   loss: 0.3371 -> 0.3093  accuracy: 92.19% -> 91.67%     
client [26] (testset)   loss: 0.2209 -> 0.2493  accuracy: 95.58% -> 95.58%     
client [19] (testset)   loss: 0.1027 -> 0.0827  accuracy: 94.62% -> 94.62%     
client [68] (testset)   loss: 0.5493 -> 0.5466  accuracy: 83.33% -> 81.94%     
client [41] (testset)   loss: 0.3335 -> 0.3422  accuracy: 88.37% -> 88.37%     
client [50] (testset)   loss: 0.3518 -> 0.3563  accuracy: 89.12% -> 89.54%     
client [75] (testset)   loss: 0.1912 -> 0.1460  accuracy: 92.31% -> 94.87%     
client [81] (testset)   loss: 0.3461 -> 0.2794  accuracy: 91.19% -> 91.19%     
Training... ---------------------------------------- 100% 0:16:52
Floco's average time taken by each global epoch: 0 min 2.52 sec.               
Floco's total running time: 0 h 16 m 52 s.                                     
==================== Floco Experiment Results: ====================            
Display format: (before local fine-tuning) -> (after local fine-tuning)        
 So if finetune_epoch = 0, x.xx% -> 0.00% is normal.                           
 Centralized testing ONLY happens after model aggregation, so the stats between
'->' are the same.                                                             
{                                                                              
    "100": {                                                                   
        "all_clients": {                                                       
            "test": {                                                          
                "loss": "0.3313 -> 0.0000",                                    
                "accuracy": "88.62% -> 0.00%"                                  
            }                                                                  
        }                                                                      
    },                                                                         
    "200": {                                                                   
        "all_clients": {                                                       
            "test": {                                                          
                "loss": "0.3000 -> 0.0000",                                    
                "accuracy": "90.09% -> 0.00%"                                  
            }                                                                  
        }                                                                      
    },                                                                         
    "300": {                                                                   
        "all_clients": {                                                       
            "test": {                                                          
                "loss": "0.3003 -> 0.0000",                                    
                "accuracy": "90.58% -> 0.00%"                                  
            }                                                                  
        }                                                                      
    },                                                                         
    "400": {                                                                   
        "all_clients": {                                                       
            "test": {                                                          
                "loss": "0.3194 -> 0.0000",                                    
                "accuracy": "90.80% -> 0.00%"                                  
            }                                                                  
        }                                                                      
    }                                                                          
}                                                                              
==================== Floco Max Accuracy ====================                   
all_clients:                                                                   
(test) before fine-tuning: 90.80% at epoch 400                                 
(test) after fine-tuning: 0.00% at epoch 100                                   
[0m