==================== FLUTE ====================                                
Experiment Arguments:                                                          
{
│   'method': 'flute',
│   'dataset': {
│   │   'name': 'medmnistC',
│   │   'client_num': 100,
│   │   'test_ratio': 0.25,
│   │   'val_ratio': 0.0,
│   │   'seed': 42,
│   │   'split': 'sample',
│   │   'IID_ratio': 0.0,
│   │   'monitor_window_name_suffix': 'medmnistC-100clients-0%IID-Dir(1.0)-seed42',
│   │   'alpha': 1.0,
│   │   'min_samples_per_client': 10
│   },
│   'model': {
│   │   'name': 'lenet5',
│   │   'use_torchvision_pretrained_weights': True,
│   │   'external_model_weights_path': None
│   },
│   'optimizer': {
│   │   'lr': 0.01,
│   │   'dampening': 0,
│   │   'weight_decay': 0,
│   │   'momentum': 0,
│   │   'nesterov': False,
│   │   'name': 'sgd'
│   },
│   'mode': 'serial',
│   'parallel': {
│   │   'ray_cluster_addr': None,
│   │   'num_cpus': None,
│   │   'num_gpus': None,
│   │   'num_workers': 2
│   },
│   'common': {
│   │   'seed': 42,
│   │   'join_ratio': 0.1,
│   │   'global_epoch': 400,
│   │   'local_epoch': 5,
│   │   'batch_size': 32,
│   │   'reset_optimizer_on_global_epoch': True,
│   │   'straggler_ratio': 0,
│   │   'straggler_min_local_epoch': 0,
│   │   'buffers': 'global',
│   │   'client_side_evaluation': True,
│   │   'test': {
│   │   │   'client': {
│   │   │   │   'interval': 100,
│   │   │   │   'finetune_epoch': 0,
│   │   │   │   'train': False,
│   │   │   │   'val': False,
│   │   │   │   'test': True
│   │   │   },
│   │   │   'server': {
│   │   │   │   'interval': -1,
│   │   │   │   'train': False,
│   │   │   │   'val': False,
│   │   │   │   'test': False,
│   │   │   │   'model_in_train_mode': False
│   │   │   }
│   │   },
│   │   'verbose_gap': 10,
│   │   'monitor': None,
│   │   'use_cuda': True,
│   │   'save_log': True,
│   │   'save_model': False,
│   │   'save_learning_curve_plot': False,
│   │   'save_metrics': True,
│   │   'delete_useless_run': True
│   },
│   'flute': {
│   │   'rep_round': 1,
│   │   'lamda1': 0.25,
│   │   'lamda2': 0.0025,
│   │   'lamda3': 0.0005,
│   │   'gamma1': 1,
│   │   'gamma2': 1,
│   │   'nc2_lr': 0.5
│   }
}
---------------------------- TRAINING EPOCH: 10 ----------------------------   
client [77] (testset)   loss: 2.3082 -> 2.2798  accuracy: 16.67% -> 16.67%     
client [81] (testset)   loss: 2.2814 -> 2.2417  accuracy: 35.14% -> 35.14%     
client [21] (testset)   loss: 2.3143 -> 2.2750  accuracy: 24.56% -> 24.56%     
client [68] (testset)   loss: 2.2185 -> 2.1714  accuracy: 31.11% -> 31.11%     
client [93] (testset)   loss: 2.1042 -> 2.0176  accuracy: 45.65% -> 45.65%     
client [31] (testset)   loss: 2.3934 -> 2.3484  accuracy: 5.56% -> 5.56%       
client [20] (testset)   loss: 2.3482 -> 2.3269  accuracy: 4.92% -> 18.03%      
client [59] (testset)   loss: 2.3317 -> 2.3017  accuracy: 24.14% -> 24.14%     
client [48] (testset)   loss: 2.3303 -> 2.3226  accuracy: 17.39% -> 17.39%     
client [34] (testset)   loss: 2.2430 -> 2.2081  accuracy: 31.15% -> 31.15%     
---------------------------- TRAINING EPOCH: 20 ----------------------------   
client [69] (testset)   loss: 2.3224 -> 2.3006  accuracy: 7.84% -> 29.41%      
client [99] (testset)   loss: 2.3023 -> 2.2906  accuracy: 20.51% -> 20.51%     
client [67] (testset)   loss: 2.3004 -> 2.2761  accuracy: 22.81% -> 22.81%     
client [0]  (testset)   loss: 2.2219 -> 2.1641  accuracy: 20.55% -> 20.55%     
client [76] (testset)   loss: 2.2456 -> 2.2225  accuracy: 27.78% -> 27.78%     
client [41] (testset)   loss: 2.2753 -> 2.2482  accuracy: 26.92% -> 26.92%     
client [62] (testset)   loss: 2.4229 -> 2.3901  accuracy: 3.45% -> 3.45%       
client [2]  (testset)   loss: 2.2958 -> 2.1658  accuracy: 49.40% -> 49.40%     
client [14] (testset)   loss: 2.2790 -> 2.2560  accuracy: 31.88% -> 31.88%     
client [46] (testset)   loss: 2.1944 -> 2.1415  accuracy: 48.94% -> 48.94%     
---------------------------- TRAINING EPOCH: 30 ----------------------------   
client [24] (testset)   loss: 2.4307 -> 2.4126  accuracy: 0.00% -> 0.00%       
client [68] (testset)   loss: 2.0696 -> 2.0408  accuracy: 31.11% -> 31.11%     
client [57] (testset)   loss: 2.2511 -> 2.2141  accuracy: 34.78% -> 34.78%     
client [17] (testset)   loss: 2.2433 -> 2.2078  accuracy: 32.00% -> 32.00%     
client [54] (testset)   loss: 2.2762 -> 2.2678  accuracy: 18.75% -> 18.75%     
client [23] (testset)   loss: 2.3146 -> 2.2998  accuracy: 20.59% -> 20.59%     
client [35] (testset)   loss: 2.2938 -> 2.2725  accuracy: 33.33% -> 33.33%     
client [59] (testset)   loss: 2.2605 -> 2.2433  accuracy: 24.14% -> 24.14%     
client [31] (testset)   loss: 2.2079 -> 2.1765  accuracy: 44.44% -> 44.44%     
client [9]  (testset)   loss: 2.3431 -> 2.3285  accuracy: 11.11% -> 11.11%     
---------------------------- TRAINING EPOCH: 40 ----------------------------   
client [64] (testset)   loss: 2.2855 -> 2.2726  accuracy: 20.00% -> 20.00%     
client [33] (testset)   loss: 2.1294 -> 2.1017  accuracy: 22.22% -> 22.22%     
client [16] (testset)   loss: 2.3841 -> 2.3649  accuracy: 6.67% -> 6.67%       
client [44] (testset)   loss: 2.3314 -> 2.3034  accuracy: 12.50% -> 12.50%     
client [8]  (testset)   loss: 2.0185 -> 2.0059  accuracy: 34.17% -> 34.17%     
client [31] (testset)   loss: 2.1558 -> 2.1326  accuracy: 44.44% -> 44.44%     
client [47] (testset)   loss: 2.1851 -> 2.1339  accuracy: 16.67% -> 16.67%     
client [36] (testset)   loss: 2.4100 -> 2.3771  accuracy: 4.08% -> 4.08%       
client [20] (testset)   loss: 2.2706 -> 2.2590  accuracy: 18.03% -> 18.03%     
client [56] (testset)   loss: 2.2500 -> 2.2345  accuracy: 32.73% -> 32.73%     
---------------------------- TRAINING EPOCH: 50 ----------------------------   
client [4]  (testset)   loss: 2.2618 -> 2.2434  accuracy: 30.19% -> 30.19%     
client [60] (testset)   loss: 2.3660 -> 2.3548  accuracy: 11.43% -> 11.43%     
client [28] (testset)   loss: 2.2653 -> 2.2559  accuracy: 12.33% -> 12.33%     
client [25] (testset)   loss: 2.3577 -> 2.3550  accuracy: 12.00% -> 12.00%     
client [58] (testset)   loss: 1.9217 -> 1.8973  accuracy: 42.47% -> 42.47%     
client [44] (testset)   loss: 2.3042 -> 2.2809  accuracy: 12.50% -> 12.50%     
client [39] (testset)   loss: 1.7956 -> 1.7295  accuracy: 53.77% -> 53.77%     
client [29] (testset)   loss: 2.0319 -> 2.0033  accuracy: 37.66% -> 37.66%     
client [3]  (testset)   loss: 2.3765 -> 2.3748  accuracy: 9.26% -> 9.26%       
client [84] (testset)   loss: 1.8723 -> 1.8454  accuracy: 38.53% -> 38.53%     
---------------------------- TRAINING EPOCH: 60 ----------------------------   
client [21] (testset)   loss: 2.2194 -> 2.1932  accuracy: 24.56% -> 24.56%     
client [84] (testset)   loss: 1.8302 -> 1.8100  accuracy: 38.53% -> 38.53%     
client [10] (testset)   loss: 2.4230 -> 2.4096  accuracy: 5.56% -> 5.56%       
client [36] (testset)   loss: 2.3286 -> 2.3051  accuracy: 4.08% -> 4.08%       
client [65] (testset)   loss: 2.1977 -> 2.1736  accuracy: 37.74% -> 37.74%     
client [81] (testset)   loss: 2.1436 -> 2.1254  accuracy: 35.14% -> 35.14%     
client [79] (testset)   loss: 2.2809 -> 2.2705  accuracy: 21.15% -> 21.15%     
client [42] (testset)   loss: 2.3643 -> 2.3542  accuracy: 5.36% -> 5.36%       
client [11] (testset)   loss: 2.1943 -> 2.1728  accuracy: 30.36% -> 30.36%     
client [96] (testset)   loss: 2.1874 -> 2.1718  accuracy: 30.36% -> 30.36%     
---------------------------- TRAINING EPOCH: 70 ----------------------------   
client [8]  (testset)   loss: 1.9901 -> 1.9827  accuracy: 34.17% -> 34.17%     
client [53] (testset)   loss: 2.1761 -> 2.1535  accuracy: 38.71% -> 38.71%     
client [52] (testset)   loss: 1.8576 -> 1.7995  accuracy: 57.14% -> 57.14%     
client [42] (testset)   loss: 2.3467 -> 2.3375  accuracy: 7.14% -> 7.14%       
client [69] (testset)   loss: 2.2033 -> 2.1922  accuracy: 29.41% -> 29.41%     
client [59] (testset)   loss: 2.2125 -> 2.2029  accuracy: 24.14% -> 24.14%     
client [7]  (testset)   loss: 2.1223 -> 2.1095  accuracy: 32.79% -> 32.79%     
client [26] (testset)   loss: 2.3411 -> 2.3255  accuracy: 22.81% -> 22.81%     
client [49] (testset)   loss: 2.2181 -> 2.1972  accuracy: 24.24% -> 24.24%     
client [98] (testset)   loss: 2.1147 -> 2.1047  accuracy: 37.74% -> 37.74%     
---------------------------- TRAINING EPOCH: 80 ----------------------------   
client [98] (testset)   loss: 2.1074 -> 2.0985  accuracy: 37.74% -> 37.74%     
client [47] (testset)   loss: 2.1000 -> 2.0599  accuracy: 16.67% -> 16.67%     
client [21] (testset)   loss: 2.1771 -> 2.1562  accuracy: 24.56% -> 26.32%     
client [77] (testset)   loss: 2.1758 -> 2.1612  accuracy: 16.67% -> 16.67%     
client [95] (testset)   loss: 2.0631 -> 2.0507  accuracy: 34.25% -> 34.25%     
client [91] (testset)   loss: 2.1941 -> 2.1811  accuracy: 37.93% -> 37.93%     
client [14] (testset)   loss: 2.1854 -> 2.1735  accuracy: 31.88% -> 31.88%     
client [99] (testset)   loss: 2.2544 -> 2.2453  accuracy: 20.51% -> 20.51%     
client [20] (testset)   loss: 2.2311 -> 2.2246  accuracy: 18.03% -> 18.03%     
client [39] (testset)   loss: 1.6592 -> 1.6224  accuracy: 53.77% -> 53.77%     
---------------------------- TRAINING EPOCH: 90 ----------------------------   
client [52] (testset)   loss: 1.8080 -> 1.7569  accuracy: 57.14% -> 57.14%     
client [62] (testset)   loss: 2.1639 -> 2.1468  accuracy: 41.38% -> 41.38%     
client [71] (testset)   loss: 2.2078 -> 2.1981  accuracy: 23.33% -> 23.33%     
client [97] (testset)   loss: 2.0820 -> 2.0617  accuracy: 25.76% -> 25.76%     
client [30] (testset)   loss: 2.3427 -> 2.3418  accuracy: 15.15% -> 15.15%     
client [88] (testset)   loss: 2.2596 -> 2.2495  accuracy: 15.79% -> 15.79%     
client [60] (testset)   loss: 2.3106 -> 2.3019  accuracy: 11.43% -> 11.43%     
client [82] (testset)   loss: 2.0534 -> 2.0425  accuracy: 40.30% -> 40.30%     
client [91] (testset)   loss: 2.1719 -> 2.1608  accuracy: 37.93% -> 37.93%     
client [57] (testset)   loss: 2.1512 -> 2.1340  accuracy: 34.78% -> 34.78%     
---------------------------- TRAINING EPOCH: 100 ----------------------------  
client [31] (testset)   loss: 1.9987 -> 1.9851  accuracy: 44.44% -> 44.44%     
client [15] (testset)   loss: 1.7266 -> 1.6954  accuracy: 61.04% -> 61.04%     
client [71] (testset)   loss: 2.1997 -> 2.1910  accuracy: 23.33% -> 23.33%     
client [97] (testset)   loss: 2.0358 -> 2.0206  accuracy: 25.76% -> 25.76%     
client [53] (testset)   loss: 2.1175 -> 2.1051  accuracy: 38.71% -> 38.71%     
client [77] (testset)   loss: 2.1639 -> 2.1504  accuracy: 16.67% -> 30.00%     
client [76] (testset)   loss: 2.1397 -> 2.1273  accuracy: 27.78% -> 27.78%     
client [79] (testset)   loss: 2.2585 -> 2.2527  accuracy: 21.15% -> 21.15%     
client [28] (testset)   loss: 2.2266 -> 2.2224  accuracy: 12.33% -> 12.33%     
client [99] (testset)   loss: 2.2395 -> 2.2311  accuracy: 20.51% -> 20.51%     
---------------------------- TRAINING EPOCH: 110 ----------------------------  
client [97] (testset)   loss: 2.0128 -> 2.0007  accuracy: 25.76% -> 25.76%     
client [86] (testset)   loss: 1.8940 -> 1.8745  accuracy: 48.44% -> 48.44%     
client [34] (testset)   loss: 2.0488 -> 2.0397  accuracy: 24.59% -> 24.59%     
client [73] (testset)   loss: 2.3345 -> 2.3321  accuracy: 12.28% -> 12.28%     
client [5]  (testset)   loss: 2.2032 -> 2.1958  accuracy: 26.09% -> 26.09%     
client [96] (testset)   loss: 2.1106 -> 2.1023  accuracy: 30.36% -> 30.36%     
client [22] (testset)   loss: 2.1251 -> 2.0975  accuracy: 46.00% -> 46.00%     
client [60] (testset)   loss: 2.2803 -> 2.2763  accuracy: 11.43% -> 11.43%     
client [66] (testset)   loss: 2.2357 -> 2.2302  accuracy: 19.05% -> 19.05%     
client [83] (testset)   loss: 2.2165 -> 2.2065  accuracy: 19.57% -> 19.57%     
---------------------------- TRAINING EPOCH: 120 ----------------------------  
client [76] (testset)   loss: 2.1038 -> 2.0946  accuracy: 27.78% -> 27.78%     
client [65] (testset)   loss: 2.1355 -> 2.1185  accuracy: 37.74% -> 37.74%     
client [95] (testset)   loss: 2.0340 -> 2.0271  accuracy: 34.25% -> 34.25%     
client [17] (testset)   loss: 2.1256 -> 2.1095  accuracy: 32.00% -> 32.00%     
client [8]  (testset)   loss: 1.9669 -> 1.9601  accuracy: 34.17% -> 34.17%     
client [35] (testset)   loss: 2.1392 -> 2.1299  accuracy: 33.33% -> 33.33%     
client [98] (testset)   loss: 2.0911 -> 2.0833  accuracy: 37.74% -> 37.74%     
client [53] (testset)   loss: 2.1006 -> 2.0916  accuracy: 38.71% -> 38.71%     
client [43] (testset)   loss: 1.5835 -> 1.5712  accuracy: 57.89% -> 57.89%     
client [64] (testset)   loss: 2.2336 -> 2.2272  accuracy: 20.00% -> 20.00%     
---------------------------- TRAINING EPOCH: 130 ----------------------------  
client [21] (testset)   loss: 2.1447 -> 2.1280  accuracy: 26.32% -> 26.32%     
client [88] (testset)   loss: 2.2200 -> 2.2159  accuracy: 22.81% -> 22.81%     
client [38] (testset)   loss: 2.2258 -> 2.2212  accuracy: 18.92% -> 18.92%     
client [3]  (testset)   loss: 2.3754 -> 2.3776  accuracy: 9.26% -> 9.26%       
client [5]  (testset)   loss: 2.1925 -> 2.1867  accuracy: 26.09% -> 26.09%     
client [41] (testset)   loss: 2.1138 -> 2.1010  accuracy: 26.92% -> 26.92%     
client [7]  (testset)   loss: 2.0936 -> 2.0837  accuracy: 32.79% -> 32.79%     
client [37] (testset)   loss: 2.0038 -> 1.9971  accuracy: 40.48% -> 40.48%     
client [45] (testset)   loss: 2.1965 -> 2.1850  accuracy: 34.78% -> 34.78%     
client [47] (testset)   loss: 2.0089 -> 1.9803  accuracy: 16.67% -> 16.67%     
---------------------------- TRAINING EPOCH: 140 ----------------------------  
client [16] (testset)   loss: 2.2501 -> 2.2393  accuracy: 26.67% -> 26.67%     
client [11] (testset)   loss: 2.0829 -> 2.0740  accuracy: 30.36% -> 30.36%     
client [37] (testset)   loss: 1.9911 -> 1.9881  accuracy: 40.48% -> 40.48%     
client [41] (testset)   loss: 2.1046 -> 2.0928  accuracy: 26.92% -> 26.92%     
client [95] (testset)   loss: 2.0197 -> 2.0149  accuracy: 34.25% -> 34.25%     
client [53] (testset)   loss: 2.0939 -> 2.0865  accuracy: 38.71% -> 38.71%     
client [22] (testset)   loss: 2.0786 -> 2.0568  accuracy: 46.00% -> 46.00%     
client [25] (testset)   loss: 2.3536 -> 2.3548  accuracy: 12.00% -> 12.00%     
client [69] (testset)   loss: 2.1418 -> 2.1357  accuracy: 29.41% -> 29.41%     
client [46] (testset)   loss: 1.9653 -> 1.9429  accuracy: 48.94% -> 48.94%     
---------------------------- TRAINING EPOCH: 150 ----------------------------  
client [47] (testset)   loss: 1.9187 -> 1.8997  accuracy: 16.67% -> 47.22%     
client [69] (testset)   loss: 2.1311 -> 2.1276  accuracy: 29.41% -> 29.41%     
client [82] (testset)   loss: 2.0192 -> 2.0108  accuracy: 40.30% -> 40.30%     
client [45] (testset)   loss: 2.1706 -> 2.1619  accuracy: 34.78% -> 34.78%     
client [7]  (testset)   loss: 2.0857 -> 2.0768  accuracy: 32.79% -> 32.79%     
client [50] (testset)   loss: 2.1397 -> 2.1331  accuracy: 29.87% -> 29.87%     
client [35] (testset)   loss: 2.1184 -> 2.1101  accuracy: 33.33% -> 33.33%     
client [24] (testset)   loss: 2.2486 -> 2.2391  accuracy: 36.00% -> 36.00%     
client [15] (testset)   loss: 1.6320 -> 1.6159  accuracy: 61.04% -> 61.04%     
client [58] (testset)   loss: 1.7664 -> 1.7601  accuracy: 42.47% -> 42.47%     
---------------------------- TRAINING EPOCH: 160 ----------------------------  
client [48] (testset)   loss: 2.2581 -> 2.2553  accuracy: 17.39% -> 17.39%     
client [76] (testset)   loss: 2.0829 -> 2.0748  accuracy: 27.78% -> 27.78%     
client [67] (testset)   loss: 2.1661 -> 2.1593  accuracy: 22.81% -> 22.81%     
client [37] (testset)   loss: 1.9868 -> 1.9851  accuracy: 40.48% -> 40.48%     
client [58] (testset)   loss: 1.7573 -> 1.7519  accuracy: 42.47% -> 42.47%     
client [64] (testset)   loss: 2.2168 -> 2.2117  accuracy: 20.00% -> 20.00%     
client [77] (testset)   loss: 2.1183 -> 2.1102  accuracy: 30.00% -> 30.00%     
client [55] (testset)   loss: 1.9420 -> 1.9339  accuracy: 42.62% -> 42.62%     
client [12] (testset)   loss: 2.0960 -> 2.0856  accuracy: 23.73% -> 23.73%     
client [89] (testset)   loss: 1.8535 -> 1.8507  accuracy: 46.88% -> 46.88%     
---------------------------- TRAINING EPOCH: 170 ----------------------------  
client [84] (testset)   loss: 1.7071 -> 1.7034  accuracy: 38.53% -> 38.53%     
client [51] (testset)   loss: 1.8354 -> 1.8337  accuracy: 47.42% -> 47.42%     
client [8]  (testset)   loss: 1.9401 -> 1.9353  accuracy: 34.17% -> 34.17%     
client [18] (testset)   loss: 2.3127 -> 2.3128  accuracy: 20.93% -> 20.93%     
client [94] (testset)   loss: 1.9555 -> 1.9447  accuracy: 31.71% -> 31.71%     
client [81] (testset)   loss: 2.0368 -> 2.0324  accuracy: 35.14% -> 35.14%     
client [3]  (testset)   loss: 2.3806 -> 2.3815  accuracy: 9.26% -> 9.26%       
client [11] (testset)   loss: 2.0552 -> 2.0475  accuracy: 30.36% -> 30.36%     
client [95] (testset)   loss: 2.0065 -> 2.0045  accuracy: 34.25% -> 34.25%     
client [67] (testset)   loss: 2.1608 -> 2.1544  accuracy: 22.81% -> 19.30%     
---------------------------- TRAINING EPOCH: 180 ----------------------------  
client [21] (testset)   loss: 2.1096 -> 2.0988  accuracy: 26.32% -> 26.32%     
client [79] (testset)   loss: 2.2410 -> 2.2440  accuracy: 21.15% -> 21.15%     
client [58] (testset)   loss: 1.7427 -> 1.7385  accuracy: 42.47% -> 42.47%     
client [88] (testset)   loss: 2.2102 -> 2.2079  accuracy: 22.81% -> 22.81%     
client [46] (testset)   loss: 1.9055 -> 1.8915  accuracy: 48.94% -> 48.94%     
client [11] (testset)   loss: 2.0490 -> 2.0425  accuracy: 30.36% -> 30.36%     
client [55] (testset)   loss: 1.9163 -> 1.9123  accuracy: 42.62% -> 42.62%     
client [13] (testset)   loss: 2.3366 -> 2.3385  accuracy: 22.22% -> 22.22%     
client [31] (testset)   loss: 1.9732 -> 1.9623  accuracy: 44.44% -> 44.44%     
client [75] (testset)   loss: 2.1762 -> 2.1726  accuracy: 22.22% -> 22.22%     
---------------------------- TRAINING EPOCH: 190 ----------------------------  
client [19] (testset)   loss: 2.1257 -> 2.1226  accuracy: 23.21% -> 23.21%     
client [7]  (testset)   loss: 2.0510 -> 2.0453  accuracy: 32.79% -> 32.79%     
client [57] (testset)   loss: 2.0880 -> 2.0860  accuracy: 34.78% -> 34.78%     
client [13] (testset)   loss: 2.3378 -> 2.3416  accuracy: 22.22% -> 22.22%     
client [43] (testset)   loss: 1.5372 -> 1.5298  accuracy: 57.89% -> 57.89%     
client [91] (testset)   loss: 2.1325 -> 2.1250  accuracy: 37.93% -> 37.93%     
client [10] (testset)   loss: 2.2669 -> 2.2589  accuracy: 38.89% -> 38.89%     
client [64] (testset)   loss: 2.2034 -> 2.1987  accuracy: 20.00% -> 20.00%     
client [82] (testset)   loss: 1.9899 -> 1.9865  accuracy: 40.30% -> 40.30%     
client [22] (testset)   loss: 1.9924 -> 1.9811  accuracy: 46.00% -> 46.00%     
---------------------------- TRAINING EPOCH: 200 ----------------------------  
client [20] (testset)   loss: 2.2006 -> 2.1962  accuracy: 18.03% -> 18.03%     
client [23] (testset)   loss: 2.2240 -> 2.2177  accuracy: 20.59% -> 20.59%     
client [88] (testset)   loss: 2.2085 -> 2.2063  accuracy: 22.81% -> 22.81%     
client [98] (testset)   loss: 2.0633 -> 2.0584  accuracy: 37.74% -> 37.74%     
client [79] (testset)   loss: 2.2443 -> 2.2461  accuracy: 21.15% -> 21.15%     
client [21] (testset)   loss: 2.0931 -> 2.0842  accuracy: 26.32% -> 26.32%     
client [92] (testset)   loss: 2.1804 -> 2.1759  accuracy: 26.47% -> 26.47%     
client [56] (testset)   loss: 2.1526 -> 2.1510  accuracy: 7.27% -> 7.27%       
client [5]  (testset)   loss: 2.1703 -> 2.1690  accuracy: 26.09% -> 26.09%     
client [52] (testset)   loss: 1.5108 -> 1.4963  accuracy: 57.14% -> 57.14%     
---------------------------- TRAINING EPOCH: 210 ----------------------------  
client [67] (testset)   loss: 2.1313 -> 2.1278  accuracy: 19.30% -> 19.30%     
client [54] (testset)   loss: 2.2702 -> 2.2746  accuracy: 18.75% -> 18.75%     
client [14] (testset)   loss: 2.1136 -> 2.1071  accuracy: 31.88% -> 31.88%     
client [99] (testset)   loss: 2.1835 -> 2.1783  accuracy: 20.51% -> 20.51%     
client [36] (testset)   loss: 2.1197 -> 2.1152  accuracy: 24.49% -> 24.49%     
client [30] (testset)   loss: 2.3457 -> 2.3471  accuracy: 15.15% -> 15.15%     
client [38] (testset)   loss: 2.2096 -> 2.2067  accuracy: 18.92% -> 18.92%     
client [15] (testset)   loss: 1.5933 -> 1.5832  accuracy: 61.04% -> 61.04%     
client [6]  (testset)   loss: 2.1055 -> 2.1019  accuracy: 21.54% -> 21.54%     
client [53] (testset)   loss: 2.0712 -> 2.0672  accuracy: 38.71% -> 38.71%     
---------------------------- TRAINING EPOCH: 220 ----------------------------  
client [99] (testset)   loss: 2.1754 -> 2.1688  accuracy: 20.51% -> 20.51%     
client [6]  (testset)   loss: 2.1012 -> 2.0987  accuracy: 21.54% -> 21.54%     
client [83] (testset)   loss: 2.1652 -> 2.1586  accuracy: 19.57% -> 19.57%     
client [42] (testset)   loss: 2.2822 -> 2.2826  accuracy: 7.14% -> 7.14%       
client [34] (testset)   loss: 2.0056 -> 2.0010  accuracy: 24.59% -> 24.59%     
client [15] (testset)   loss: 1.5858 -> 1.5782  accuracy: 61.04% -> 61.04%     
client [47] (testset)   loss: 1.8248 -> 1.8183  accuracy: 47.22% -> 47.22%     
client [55] (testset)   loss: 1.9127 -> 1.9075  accuracy: 42.62% -> 42.62%     
client [51] (testset)   loss: 1.8310 -> 1.8285  accuracy: 47.42% -> 47.42%     
client [95] (testset)   loss: 2.0024 -> 2.0009  accuracy: 34.25% -> 34.25%     
---------------------------- TRAINING EPOCH: 230 ----------------------------  
client [71] (testset)   loss: 2.1485 -> 2.1441  accuracy: 23.33% -> 23.33%     
client [15] (testset)   loss: 1.5803 -> 1.5742  accuracy: 61.04% -> 61.04%     
client [33] (testset)   loss: 1.9499 -> 1.9352  accuracy: 22.22% -> 22.22%     
client [99] (testset)   loss: 2.1684 -> 2.1632  accuracy: 20.51% -> 20.51%     
client [90] (testset)   loss: 2.0907 -> 2.0840  accuracy: 25.00% -> 25.00%     
client [57] (testset)   loss: 2.0793 -> 2.0813  accuracy: 34.78% -> 34.78%     
client [27] (testset)   loss: 1.9949 -> 1.9933  accuracy: 38.75% -> 38.75%     
client [78] (testset)   loss: 2.0079 -> 2.0004  accuracy: 22.73% -> 22.73%     
client [36] (testset)   loss: 2.1133 -> 2.1094  accuracy: 24.49% -> 24.49%     
client [88] (testset)   loss: 2.2042 -> 2.2031  accuracy: 22.81% -> 22.81%     
---------------------------- TRAINING EPOCH: 240 ----------------------------  
client [70] (testset)   loss: 2.2017 -> 2.2011  accuracy: 25.00% -> 25.00%     
client [35] (testset)   loss: 2.0828 -> 2.0782  accuracy: 33.33% -> 33.33%     
client [16] (testset)   loss: 2.1524 -> 2.1476  accuracy: 26.67% -> 26.67%     
client [80] (testset)   loss: 2.1354 -> 2.1340  accuracy: 38.18% -> 38.18%     
client [38] (testset)   loss: 2.2044 -> 2.2027  accuracy: 18.92% -> 18.92%     
client [78] (testset)   loss: 1.9975 -> 1.9931  accuracy: 22.73% -> 22.73%     
client [68] (testset)   loss: 1.8509 -> 1.8434  accuracy: 37.78% -> 37.78%     
client [11] (testset)   loss: 2.0221 -> 2.0168  accuracy: 30.36% -> 30.36%     
client [64] (testset)   loss: 2.1931 -> 2.1917  accuracy: 20.00% -> 20.00%     
client [82] (testset)   loss: 1.9735 -> 1.9711  accuracy: 40.30% -> 40.30%     
---------------------------- TRAINING EPOCH: 250 ----------------------------  
client [30] (testset)   loss: 2.3508 -> 2.3493  accuracy: 15.15% -> 15.15%     
client [27] (testset)   loss: 1.9938 -> 1.9925  accuracy: 38.75% -> 38.75%     
client [74] (testset)   loss: 2.0859 -> 2.0838  accuracy: 28.07% -> 28.07%     
client [45] (testset)   loss: 2.1225 -> 2.1142  accuracy: 34.78% -> 34.78%     
client [6]  (testset)   loss: 2.0981 -> 2.0953  accuracy: 21.54% -> 21.54%     
client [36] (testset)   loss: 2.1076 -> 2.1041  accuracy: 24.49% -> 24.49%     
client [63] (testset)   loss: 2.0820 -> 2.0776  accuracy: 31.67% -> 31.67%     
client [76] (testset)   loss: 2.0367 -> 2.0315  accuracy: 27.78% -> 27.78%     
client [83] (testset)   loss: 2.1520 -> 2.1516  accuracy: 19.57% -> 19.57%     
client [86] (testset)   loss: 1.7711 -> 1.7671  accuracy: 48.44% -> 48.44%     
---------------------------- TRAINING EPOCH: 260 ----------------------------  
client [83] (testset)   loss: 2.1533 -> 2.1493  accuracy: 19.57% -> 19.57%     
client [99] (testset)   loss: 2.1615 -> 2.1580  accuracy: 20.51% -> 20.51%     
client [74] (testset)   loss: 2.0825 -> 2.0790  accuracy: 28.07% -> 28.07%     
client [73] (testset)   loss: 2.3138 -> 2.3152  accuracy: 12.28% -> 12.28%     
client [29] (testset)   loss: 1.8539 -> 1.8520  accuracy: 37.66% -> 37.66%     
client [92] (testset)   loss: 2.1629 -> 2.1602  accuracy: 26.47% -> 26.47%     
client [6]  (testset)   loss: 2.0949 -> 2.0898  accuracy: 21.54% -> 21.54%     
client [61] (testset)   loss: 2.1812 -> 2.1792  accuracy: 26.67% -> 26.67%     
client [21] (testset)   loss: 2.0706 -> 2.0623  accuracy: 26.32% -> 26.32%     
client [67] (testset)   loss: 2.1219 -> 2.1193  accuracy: 19.30% -> 19.30%     
---------------------------- TRAINING EPOCH: 270 ----------------------------  
client [83] (testset)   loss: 2.1526 -> 2.1466  accuracy: 19.57% -> 19.57%     
client [32] (testset)   loss: 2.0233 -> 2.0190  accuracy: 30.43% -> 30.43%     
client [95] (testset)   loss: 2.0009 -> 1.9998  accuracy: 34.25% -> 34.25%     
client [61] (testset)   loss: 2.1758 -> 2.1765  accuracy: 26.67% -> 26.67%     
client [27] (testset)   loss: 1.9929 -> 1.9913  accuracy: 38.75% -> 38.75%     
client [25] (testset)   loss: 2.3648 -> 2.3679  accuracy: 12.00% -> 12.00%     
client [68] (testset)   loss: 1.8330 -> 1.8273  accuracy: 37.78% -> 37.78%     
client [34] (testset)   loss: 1.9940 -> 1.9931  accuracy: 24.59% -> 24.59%     
client [71] (testset)   loss: 2.1267 -> 2.1237  accuracy: 23.33% -> 23.33%     
client [89] (testset)   loss: 1.8406 -> 1.8386  accuracy: 46.88% -> 46.88%     
---------------------------- TRAINING EPOCH: 280 ----------------------------  
client [78] (testset)   loss: 1.9760 -> 1.9738  accuracy: 22.73% -> 22.73%     
client [81] (testset)   loss: 2.0117 -> 2.0100  accuracy: 35.14% -> 35.14%     
client [51] (testset)   loss: 1.8230 -> 1.8202  accuracy: 47.42% -> 47.42%     
client [54] (testset)   loss: 2.2743 -> 2.2791  accuracy: 18.75% -> 18.75%     
client [65] (testset)   loss: 2.0221 -> 2.0220  accuracy: 37.74% -> 37.74%     
client [41] (testset)   loss: 2.0241 -> 2.0182  accuracy: 26.92% -> 26.92%     
client [11] (testset)   loss: 2.0115 -> 2.0081  accuracy: 30.36% -> 30.36%     
client [85] (testset)   loss: 2.0671 -> 2.0654  accuracy: 29.33% -> 29.33%     
client [12] (testset)   loss: 2.0334 -> 2.0277  accuracy: 23.73% -> 23.73%     
client [23] (testset)   loss: 2.1858 -> 2.1814  accuracy: 20.59% -> 20.59%     
---------------------------- TRAINING EPOCH: 290 ----------------------------  
client [16] (testset)   loss: 2.1418 -> 2.1377  accuracy: 26.67% -> 26.67%     
client [65] (testset)   loss: 2.0197 -> 2.0173  accuracy: 37.74% -> 37.74%     
client [53] (testset)   loss: 2.0688 -> 2.0682  accuracy: 38.71% -> 38.71%     
client [58] (testset)   loss: 1.7170 -> 1.7148  accuracy: 42.47% -> 42.47%     
client [72] (testset)   loss: 1.7727 -> 1.7717  accuracy: 53.70% -> 53.70%     
client [7]  (testset)   loss: 2.0203 -> 2.0169  accuracy: 32.79% -> 32.79%     
client [71] (testset)   loss: 2.1242 -> 2.1212  accuracy: 23.33% -> 23.33%     
client [59] (testset)   loss: 2.1299 -> 2.1283  accuracy: 24.14% -> 24.14%     
client [86] (testset)   loss: 1.7581 -> 1.7552  accuracy: 48.44% -> 48.44%     
client [39] (testset)   loss: 1.4389 -> 1.4367  accuracy: 53.77% -> 53.77%     
---------------------------- TRAINING EPOCH: 300 ----------------------------  
client [99] (testset)   loss: 2.1570 -> 2.1512  accuracy: 20.51% -> 20.51%     
client [7]  (testset)   loss: 2.0152 -> 2.0121  accuracy: 32.79% -> 32.79%     
client [17] (testset)   loss: 2.0208 -> 2.0195  accuracy: 32.00% -> 32.00%     
client [64] (testset)   loss: 2.1867 -> 2.1863  accuracy: 20.00% -> 20.00%     
client [37] (testset)   loss: 1.9777 -> 1.9774  accuracy: 40.48% -> 40.48%     
client [29] (testset)   loss: 1.8407 -> 1.8353  accuracy: 37.66% -> 37.66%     
client [93] (testset)   loss: 1.7097 -> 1.7073  accuracy: 45.65% -> 45.65%     
client [73] (testset)   loss: 2.3138 -> 2.3138  accuracy: 12.28% -> 12.28%     
client [40] (testset)   loss: 2.1690 -> 2.1687  accuracy: 21.74% -> 21.74%     
client [76] (testset)   loss: 2.0219 -> 2.0173  accuracy: 27.78% -> 27.78%     
---------------------------- TRAINING EPOCH: 310 ----------------------------  
client [31] (testset)   loss: 1.9227 -> 1.9177  accuracy: 44.44% -> 44.44%     
client [89] (testset)   loss: 1.8365 -> 1.8352  accuracy: 46.88% -> 46.88%     
client [77] (testset)   loss: 2.0485 -> 2.0454  accuracy: 30.00% -> 30.00%     
client [90] (testset)   loss: 2.0512 -> 2.0501  accuracy: 25.00% -> 25.00%     
client [26] (testset)   loss: 2.2352 -> 2.2323  accuracy: 22.81% -> 22.81%     
client [50] (testset)   loss: 2.1123 -> 2.1106  accuracy: 29.87% -> 29.87%     
client [30] (testset)   loss: 2.3522 -> 2.3500  accuracy: 15.15% -> 15.15%     
client [70] (testset)   loss: 2.2025 -> 2.2030  accuracy: 25.00% -> 25.00%     
client [41] (testset)   loss: 2.0139 -> 2.0101  accuracy: 26.92% -> 26.92%     
client [99] (testset)   loss: 2.1516 -> 2.1486  accuracy: 20.51% -> 20.51%     
---------------------------- TRAINING EPOCH: 320 ----------------------------  
client [68] (testset)   loss: 1.8057 -> 1.8026  accuracy: 37.78% -> 37.78%     
client [70] (testset)   loss: 2.2030 -> 2.2051  accuracy: 25.00% -> 25.00%     
client [52] (testset)   loss: 1.4277 -> 1.4219  accuracy: 57.14% -> 57.14%     
client [1]  (testset)   loss: 2.3590 -> 2.3609  accuracy: 4.17% -> 4.17%       
client [2]  (testset)   loss: 1.7903 -> 1.7901  accuracy: 49.40% -> 49.40%     
client [67] (testset)   loss: 2.1080 -> 2.1062  accuracy: 19.30% -> 19.30%     
client [92] (testset)   loss: 2.1420 -> 2.1408  accuracy: 26.47% -> 26.47%     
client [35] (testset)   loss: 2.0633 -> 2.0599  accuracy: 33.33% -> 33.33%     
client [36] (testset)   loss: 2.0877 -> 2.0859  accuracy: 24.49% -> 24.49%     
client [64] (testset)   loss: 2.1874 -> 2.1857  accuracy: 20.00% -> 20.00%     
---------------------------- TRAINING EPOCH: 330 ----------------------------  
client [44] (testset)   loss: 2.1392 -> 2.1376  accuracy: 23.21% -> 23.21%     
client [6]  (testset)   loss: 2.0794 -> 2.0769  accuracy: 21.54% -> 21.54%     
client [12] (testset)   loss: 2.0141 -> 2.0095  accuracy: 23.73% -> 23.73%     
client [55] (testset)   loss: 1.8965 -> 1.8958  accuracy: 42.62% -> 42.62%     
client [29] (testset)   loss: 1.8261 -> 1.8248  accuracy: 37.66% -> 37.66%     
client [9]  (testset)   loss: 2.2526 -> 2.2530  accuracy: 13.33% -> 13.33%     
client [43] (testset)   loss: 1.5057 -> 1.5031  accuracy: 57.89% -> 57.89%     
client [77] (testset)   loss: 2.0467 -> 2.0436  accuracy: 30.00% -> 30.00%     
client [98] (testset)   loss: 2.0428 -> 2.0438  accuracy: 37.74% -> 37.74%     
client [78] (testset)   loss: 1.9686 -> 1.9673  accuracy: 22.73% -> 22.73%     
---------------------------- TRAINING EPOCH: 340 ----------------------------  
client [92] (testset)   loss: 2.1398 -> 2.1388  accuracy: 26.47% -> 26.47%     
client [80] (testset)   loss: 2.1255 -> 2.1272  accuracy: 38.18% -> 38.18%     
client [63] (testset)   loss: 2.0612 -> 2.0607  accuracy: 31.67% -> 31.67%     
client [76] (testset)   loss: 2.0125 -> 2.0089  accuracy: 27.78% -> 27.78%     
client [78] (testset)   loss: 1.9673 -> 1.9660  accuracy: 22.73% -> 22.73%     
client [25] (testset)   loss: 2.3735 -> 2.3752  accuracy: 12.00% -> 12.00%     
client [58] (testset)   loss: 1.7095 -> 1.7077  accuracy: 42.47% -> 42.47%     
client [13] (testset)   loss: 2.3577 -> 2.3619  accuracy: 22.22% -> 22.22%     
client [17] (testset)   loss: 2.0159 -> 2.0150  accuracy: 32.00% -> 32.00%     
client [38] (testset)   loss: 2.1953 -> 2.1943  accuracy: 18.92% -> 18.92%     
---------------------------- TRAINING EPOCH: 350 ----------------------------  
client [72] (testset)   loss: 1.7626 -> 1.7643  accuracy: 53.70% -> 53.70%     
client [82] (testset)   loss: 1.9575 -> 1.9574  accuracy: 40.30% -> 40.30%     
client [86] (testset)   loss: 1.7421 -> 1.7402  accuracy: 48.44% -> 48.44%     
client [51] (testset)   loss: 1.8168 -> 1.8157  accuracy: 47.42% -> 47.42%     
client [96] (testset)   loss: 2.0636 -> 2.0637  accuracy: 30.36% -> 30.36%     
client [42] (testset)   loss: 2.2672 -> 2.2638  accuracy: 7.14% -> 7.14%       
client [55] (testset)   loss: 1.8936 -> 1.8904  accuracy: 42.62% -> 42.62%     
client [13] (testset)   loss: 2.3615 -> 2.3656  accuracy: 22.22% -> 22.22%     
client [1]  (testset)   loss: 2.3640 -> 2.3647  accuracy: 4.17% -> 4.17%       
client [12] (testset)   loss: 2.0108 -> 2.0066  accuracy: 23.73% -> 23.73%     
---------------------------- TRAINING EPOCH: 360 ----------------------------  
client [68] (testset)   loss: 1.7995 -> 1.7975  accuracy: 37.78% -> 37.78%     
client [23] (testset)   loss: 2.1652 -> 2.1623  accuracy: 20.59% -> 20.59%     
client [46] (testset)   loss: 1.8151 -> 1.8131  accuracy: 48.94% -> 48.94%     
client [41] (testset)   loss: 2.0033 -> 2.0022  accuracy: 26.92% -> 26.92%     
client [25] (testset)   loss: 2.3810 -> 2.3822  accuracy: 12.00% -> 12.00%     
client [58] (testset)   loss: 1.7070 -> 1.7054  accuracy: 42.47% -> 42.47%     
client [14] (testset)   loss: 2.0905 -> 2.0887  accuracy: 31.88% -> 31.88%     
client [33] (testset)   loss: 1.8901 -> 1.8903  accuracy: 22.22% -> 22.22%     
client [85] (testset)   loss: 2.0571 -> 2.0556  accuracy: 29.33% -> 29.33%     
client [62] (testset)   loss: 1.9843 -> 1.9783  accuracy: 41.38% -> 41.38%     
---------------------------- TRAINING EPOCH: 370 ----------------------------  
client [98] (testset)   loss: 2.0432 -> 2.0410  accuracy: 37.74% -> 37.74%     
client [63] (testset)   loss: 2.0593 -> 2.0553  accuracy: 31.67% -> 31.67%     
client [70] (testset)   loss: 2.2045 -> 2.2050  accuracy: 25.00% -> 25.00%     
client [65] (testset)   loss: 2.0069 -> 2.0063  accuracy: 37.74% -> 37.74%     
client [14] (testset)   loss: 2.0893 -> 2.0856  accuracy: 31.88% -> 31.88%     
client [73] (testset)   loss: 2.3140 -> 2.3139  accuracy: 12.28% -> 12.28%     
client [34] (testset)   loss: 1.9738 -> 1.9734  accuracy: 24.59% -> 24.59%     
client [99] (testset)   loss: 2.1444 -> 2.1408  accuracy: 20.51% -> 20.51%     
client [69] (testset)   loss: 2.0834 -> 2.0806  accuracy: 29.41% -> 29.41%     
client [46] (testset)   loss: 1.8137 -> 1.8120  accuracy: 48.94% -> 48.94%     
---------------------------- TRAINING EPOCH: 380 ----------------------------  
client [99] (testset)   loss: 2.1414 -> 2.1373  accuracy: 20.51% -> 20.51%     
client [93] (testset)   loss: 1.7032 -> 1.7016  accuracy: 45.65% -> 45.65%     
client [11] (testset)   loss: 1.9909 -> 1.9880  accuracy: 30.36% -> 30.36%     
client [58] (testset)   loss: 1.7027 -> 1.7012  accuracy: 42.47% -> 42.47%     
client [81] (testset)   loss: 2.0018 -> 2.0010  accuracy: 35.14% -> 35.14%     
client [85] (testset)   loss: 2.0571 -> 2.0556  accuracy: 29.33% -> 29.33%     
client [89] (testset)   loss: 1.8312 -> 1.8306  accuracy: 46.88% -> 46.88%     
client [45] (testset)   loss: 2.0976 -> 2.0923  accuracy: 34.78% -> 34.78%     
client [8]  (testset)   loss: 1.9124 -> 1.9098  accuracy: 34.17% -> 34.17%     
client [68] (testset)   loss: 1.7903 -> 1.7879  accuracy: 37.78% -> 37.78%     
---------------------------- TRAINING EPOCH: 390 ----------------------------  
client [67] (testset)   loss: 2.1032 -> 2.1024  accuracy: 19.30% -> 19.30%     
client [72] (testset)   loss: 1.7590 -> 1.7606  accuracy: 53.70% -> 53.70%     
client [1]  (testset)   loss: 2.3643 -> 2.3692  accuracy: 4.17% -> 4.17%       
client [78] (testset)   loss: 1.9593 -> 1.9585  accuracy: 22.73% -> 22.73%     
client [83] (testset)   loss: 2.1293 -> 2.1323  accuracy: 19.57% -> 19.57%     
client [21] (testset)   loss: 2.0231 -> 2.0209  accuracy: 26.32% -> 26.32%     
client [56] (testset)   loss: 2.1285 -> 2.1276  accuracy: 7.27% -> 7.27%       
client [44] (testset)   loss: 2.1330 -> 2.1321  accuracy: 23.21% -> 23.21%     
client [92] (testset)   loss: 2.1377 -> 2.1366  accuracy: 26.47% -> 26.47%     
client [27] (testset)   loss: 1.9845 -> 1.9834  accuracy: 38.75% -> 38.75%     
---------------------------- TRAINING EPOCH: 400 ----------------------------  
client [10] (testset)   loss: 2.1354 -> 2.1328  accuracy: 38.89% -> 38.89%     
client [39] (testset)   loss: 1.4302 -> 1.4287  accuracy: 53.77% -> 53.77%     
client [65] (testset)   loss: 2.0018 -> 2.0024  accuracy: 37.74% -> 37.74%     
client [26] (testset)   loss: 2.2168 -> 2.2143  accuracy: 19.30% -> 22.81%     
client [19] (testset)   loss: 2.1008 -> 2.0999  accuracy: 23.21% -> 23.21%     
client [68] (testset)   loss: 1.7879 -> 1.7874  accuracy: 37.78% -> 37.78%     
client [41] (testset)   loss: 2.0004 -> 1.9966  accuracy: 26.92% -> 26.92%     
client [50] (testset)   loss: 2.1109 -> 2.1107  accuracy: 29.87% -> 29.87%     
client [75] (testset)   loss: 2.1530 -> 2.1528  accuracy: 22.22% -> 22.22%     
client [81] (testset)   loss: 2.0003 -> 1.9996  accuracy: 35.14% -> 35.14%     
Training... ---------------------------------------- 100% 0:08:44
FLUTE's average time taken by each global epoch: 0 min 1.30 sec.               
FLUTE's total running time: 0 h 8 m 44 s.                                      
==================== FLUTE Experiment Results: ====================            
Display format: (before local fine-tuning) -> (after local fine-tuning)        
 So if finetune_epoch = 0, x.xx% -> 0.00% is normal.                           
 Centralized testing ONLY happens after model aggregation, so the stats between
'->' are the same.                                                             
{                                                                              
    "100": {                                                                   
        "all_clients": {                                                       
            "test": {                                                          
                "loss": "2.0936 -> 0.0000",                                    
                "accuracy": "31.17% -> 0.00%"                                  
            }                                                                  
        }                                                                      
    },                                                                         
    "200": {                                                                   
        "all_clients": {                                                       
            "test": {                                                          
                "loss": "2.0335 -> 0.0000",                                    
                "accuracy": "31.38% -> 0.00%"                                  
            }                                                                  
        }                                                                      
    },                                                                         
    "300": {                                                                   
        "all_clients": {                                                       
            "test": {                                                          
                "loss": "2.0113 -> 0.0000",                                    
                "accuracy": "31.29% -> 0.00%"                                  
            }                                                                  
        }                                                                      
    },                                                                         
    "400": {                                                                   
        "all_clients": {                                                       
            "test": {                                                          
                "loss": "1.9997 -> 0.0000",                                    
                "accuracy": "31.33% -> 0.00%"                                  
            }                                                                  
        }                                                                      
    }                                                                          
}                                                                              
==================== FLUTE Max Accuracy ====================                   
all_clients:                                                                   
(test) before fine-tuning: 31.38% at epoch 200                                 
(test) after fine-tuning: 0.00% at epoch 100                                   
[0m