==================== FLUTE ====================                                
Experiment Arguments:                                                          
{
│   'method': 'flute',
│   'dataset': {
│   │   'name': 'mnist',
│   │   'client_num': 100,
│   │   'test_ratio': 0.25,
│   │   'val_ratio': 0.0,
│   │   'seed': 42,
│   │   'split': 'sample',
│   │   'IID_ratio': 0.0,
│   │   'monitor_window_name_suffix': 'mnist-100clients-0%IID-Dir(1.0)-seed42',
│   │   'alpha': 1.0,
│   │   'min_samples_per_client': 10
│   },
│   'model': {
│   │   'name': 'avgcnn',
│   │   'use_torchvision_pretrained_weights': True,
│   │   'external_model_weights_path': None
│   },
│   'optimizer': {
│   │   'lr': 0.01,
│   │   'dampening': 0,
│   │   'weight_decay': 0,
│   │   'momentum': 0,
│   │   'nesterov': False,
│   │   'name': 'sgd'
│   },
│   'mode': 'serial',
│   'parallel': {
│   │   'ray_cluster_addr': None,
│   │   'num_cpus': None,
│   │   'num_gpus': None,
│   │   'num_workers': 2
│   },
│   'common': {
│   │   'seed': 42,
│   │   'join_ratio': 0.1,
│   │   'global_epoch': 400,
│   │   'local_epoch': 5,
│   │   'batch_size': 32,
│   │   'reset_optimizer_on_global_epoch': True,
│   │   'straggler_ratio': 0,
│   │   'straggler_min_local_epoch': 0,
│   │   'buffers': 'global',
│   │   'client_side_evaluation': True,
│   │   'test': {
│   │   │   'client': {
│   │   │   │   'interval': 100,
│   │   │   │   'finetune_epoch': 0,
│   │   │   │   'train': False,
│   │   │   │   'val': False,
│   │   │   │   'test': True
│   │   │   },
│   │   │   'server': {
│   │   │   │   'interval': -1,
│   │   │   │   'train': False,
│   │   │   │   'val': False,
│   │   │   │   'test': False,
│   │   │   │   'model_in_train_mode': False
│   │   │   }
│   │   },
│   │   'verbose_gap': 10,
│   │   'monitor': None,
│   │   'use_cuda': True,
│   │   'save_log': True,
│   │   'save_model': False,
│   │   'save_learning_curve_plot': False,
│   │   'save_metrics': True,
│   │   'delete_useless_run': True
│   },
│   'flute': {
│   │   'rep_round': 1,
│   │   'lamda1': 0.25,
│   │   'lamda2': 0.0025,
│   │   'lamda3': 0.0005,
│   │   'gamma1': 1,
│   │   'gamma2': 1,
│   │   'nc2_lr': 0.5
│   }
}
---------------------------- TRAINING EPOCH: 10 ----------------------------   
client [77] (testset)   loss: 1.7658 -> 1.7058  accuracy: 36.55% -> 39.76%     
client [81] (testset)   loss: 1.9715 -> 1.9304  accuracy: 29.09% -> 29.09%     
client [21] (testset)   loss: 1.9841 -> 1.7449  accuracy: 69.91% -> 62.83%     
client [68] (testset)   loss: 1.6360 -> 1.5083  accuracy: 68.89% -> 68.33%     
client [93] (testset)   loss: 1.8560 -> 1.7886  accuracy: 44.44% -> 46.03%     
client [31] (testset)   loss: 1.9217 -> 1.8225  accuracy: 32.14% -> 32.14%     
client [20] (testset)   loss: 1.5280 -> 1.4550  accuracy: 62.28% -> 64.47%     
client [59] (testset)   loss: 1.9710 -> 1.7030  accuracy: 67.71% -> 50.00%     
client [48] (testset)   loss: 1.5714 -> 1.5191  accuracy: 44.68% -> 46.10%     
client [34] (testset)   loss: 1.8661 -> 1.8131  accuracy: 47.30% -> 45.27%     
---------------------------- TRAINING EPOCH: 20 ----------------------------   
client [69] (testset)   loss: 1.7915 -> 1.7350  accuracy: 31.93% -> 31.93%     
client [99] (testset)   loss: 1.6785 -> 1.6210  accuracy: 56.42% -> 55.31%     
client [67] (testset)   loss: 1.8597 -> 1.8025  accuracy: 26.50% -> 26.50%     
client [0]  (testset)   loss: 1.6750 -> 1.6130  accuracy: 55.56% -> 62.12%     
client [76] (testset)   loss: 1.4561 -> 1.3796  accuracy: 78.00% -> 80.00%     
client [41] (testset)   loss: 1.8407 -> 1.7756  accuracy: 36.31% -> 41.07%     
client [62] (testset)   loss: 2.0942 -> 1.6329  accuracy: 35.68% -> 51.35%     
client [2]  (testset)   loss: 2.0413 -> 1.5831  accuracy: 34.65% -> 51.97%     
client [14] (testset)   loss: 1.7972 -> 1.7423  accuracy: 39.76% -> 40.96%     
client [46] (testset)   loss: 1.7126 -> 1.6697  accuracy: 48.12% -> 48.87%     
---------------------------- TRAINING EPOCH: 30 ----------------------------   
client [24] (testset)   loss: 1.7500 -> 1.7154  accuracy: 48.25% -> 48.25%     
client [68] (testset)   loss: 1.3333 -> 1.2867  accuracy: 70.56% -> 71.67%     
client [57] (testset)   loss: 1.6876 -> 1.6414  accuracy: 41.94% -> 47.47%     
client [17] (testset)   loss: 1.9684 -> 1.9146  accuracy: 34.50% -> 34.93%     
client [54] (testset)   loss: 1.7510 -> 1.7134  accuracy: 61.80% -> 61.80%     
client [23] (testset)   loss: 1.9284 -> 1.6731  accuracy: 70.97% -> 48.39%     
client [35] (testset)   loss: 1.4826 -> 1.4354  accuracy: 47.90% -> 47.90%     
client [59] (testset)   loss: 1.6086 -> 1.5653  accuracy: 56.25% -> 57.81%     
client [31] (testset)   loss: 1.6537 -> 1.6199  accuracy: 45.54% -> 46.43%     
client [9]  (testset)   loss: 1.7418 -> 1.6957  accuracy: 45.79% -> 55.14%     
---------------------------- TRAINING EPOCH: 40 ----------------------------   
client [64] (testset)   loss: 1.6309 -> 1.5784  accuracy: 36.93% -> 45.23%     
client [33] (testset)   loss: 1.6601 -> 1.6393  accuracy: 39.01% -> 41.84%     
client [16] (testset)   loss: 1.4995 -> 1.4534  accuracy: 63.93% -> 67.12%     
client [44] (testset)   loss: 1.8061 -> 1.7166  accuracy: 36.75% -> 37.35%     
client [8]  (testset)   loss: 1.4615 -> 1.4334  accuracy: 59.76% -> 59.15%     
client [31] (testset)   loss: 1.5985 -> 1.5710  accuracy: 49.11% -> 50.89%     
client [47] (testset)   loss: 1.5530 -> 1.4994  accuracy: 65.59% -> 67.61%     
client [36] (testset)   loss: 1.5948 -> 1.5244  accuracy: 62.84% -> 63.93%     
client [20] (testset)   loss: 1.2942 -> 1.2578  accuracy: 72.37% -> 72.37%     
client [56] (testset)   loss: 1.6984 -> 1.6455  accuracy: 51.58% -> 53.68%     
---------------------------- TRAINING EPOCH: 50 ----------------------------   
client [4]  (testset)   loss: 1.8867 -> 1.8412  accuracy: 34.86% -> 44.57%     
client [60] (testset)   loss: 1.6861 -> 1.6343  accuracy: 47.83% -> 50.36%     
client [28] (testset)   loss: 1.7177 -> 1.6853  accuracy: 46.72% -> 47.45%     
client [25] (testset)   loss: 1.5896 -> 1.5412  accuracy: 49.76% -> 52.13%     
client [58] (testset)   loss: 1.2218 -> 1.1941  accuracy: 73.33% -> 73.33%     
client [44] (testset)   loss: 1.7205 -> 1.6598  accuracy: 37.95% -> 41.57%     
client [39] (testset)   loss: 1.7576 -> 1.7219  accuracy: 71.43% -> 74.18%     
client [29] (testset)   loss: 1.4370 -> 1.3939  accuracy: 60.00% -> 60.87%     
client [3]  (testset)   loss: 1.7242 -> 1.6720  accuracy: 40.43% -> 43.48%     
client [84] (testset)   loss: 1.4530 -> 1.4244  accuracy: 48.24% -> 48.82%     
---------------------------- TRAINING EPOCH: 60 ----------------------------   
client [21] (testset)   loss: 1.6376 -> 1.6014  accuracy: 63.72% -> 63.72%     
client [84] (testset)   loss: 1.4039 -> 1.3773  accuracy: 51.76% -> 53.53%     
client [10] (testset)   loss: 1.6557 -> 1.6196  accuracy: 50.33% -> 62.25%     
client [36] (testset)   loss: 1.4359 -> 1.3954  accuracy: 67.21% -> 68.31%     
client [65] (testset)   loss: 1.3634 -> 1.3278  accuracy: 63.53% -> 64.12%     
client [81] (testset)   loss: 1.8118 -> 1.7878  accuracy: 47.27% -> 47.27%     
client [79] (testset)   loss: 1.3267 -> 1.2882  accuracy: 57.35% -> 59.86%     
client [42] (testset)   loss: 1.4734 -> 1.4483  accuracy: 78.95% -> 78.07%     
client [11] (testset)   loss: 1.5654 -> 1.5193  accuracy: 53.09% -> 55.15%     
client [96] (testset)   loss: 1.5732 -> 1.5373  accuracy: 61.72% -> 63.64%     
---------------------------- TRAINING EPOCH: 70 ----------------------------   
client [8]  (testset)   loss: 1.3937 -> 1.3716  accuracy: 61.59% -> 62.20%     
client [53] (testset)   loss: 1.8724 -> 1.8392  accuracy: 58.93% -> 61.61%     
client [52] (testset)   loss: 1.5807 -> 1.5598  accuracy: 67.89% -> 68.81%     
client [42] (testset)   loss: 1.4298 -> 1.4069  accuracy: 78.07% -> 79.82%     
client [69] (testset)   loss: 1.5186 -> 1.4931  accuracy: 55.42% -> 57.23%     
client [59] (testset)   loss: 1.4753 -> 1.4421  accuracy: 61.46% -> 62.50%     
client [7]  (testset)   loss: 1.2222 -> 1.1950  accuracy: 61.90% -> 62.50%     
client [26] (testset)   loss: 1.3434 -> 1.3021  accuracy: 57.20% -> 61.44%     
client [49] (testset)   loss: 1.1236 -> 1.0871  accuracy: 62.35% -> 64.20%     
client [98] (testset)   loss: 1.6604 -> 1.6434  accuracy: 46.34% -> 46.34%     
---------------------------- TRAINING EPOCH: 80 ----------------------------   
client [98] (testset)   loss: 1.6431 -> 1.6244  accuracy: 46.34% -> 46.34%     
client [47] (testset)   loss: 1.4632 -> 1.4230  accuracy: 68.42% -> 70.04%     
client [21] (testset)   loss: 1.5814 -> 1.5539  accuracy: 64.60% -> 65.49%     
client [77] (testset)   loss: 1.4989 -> 1.4696  accuracy: 57.83% -> 59.04%     
client [95] (testset)   loss: 1.3794 -> 1.3546  accuracy: 63.41% -> 63.90%     
client [91] (testset)   loss: 1.5500 -> 1.5300  accuracy: 52.00% -> 52.00%     
client [14] (testset)   loss: 1.5944 -> 1.5647  accuracy: 57.83% -> 65.06%     
client [99] (testset)   loss: 1.5272 -> 1.5043  accuracy: 61.45% -> 62.01%     
client [20] (testset)   loss: 1.1665 -> 1.1430  accuracy: 78.51% -> 78.95%     
client [39] (testset)   loss: 1.6571 -> 1.6246  accuracy: 72.53% -> 73.63%     
---------------------------- TRAINING EPOCH: 90 ----------------------------   
client [52] (testset)   loss: 1.5614 -> 1.5454  accuracy: 67.89% -> 70.64%     
client [62] (testset)   loss: 1.2518 -> 1.2258  accuracy: 72.97% -> 72.97%     
client [71] (testset)   loss: 1.3628 -> 1.3409  accuracy: 49.74% -> 51.83%     
client [97] (testset)   loss: 1.3632 -> 1.3379  accuracy: 53.69% -> 56.38%     
client [30] (testset)   loss: 1.2698 -> 1.2426  accuracy: 71.56% -> 73.33%     
client [88] (testset)   loss: 1.2972 -> 1.2624  accuracy: 77.85% -> 78.55%     
client [60] (testset)   loss: 1.4482 -> 1.4140  accuracy: 60.14% -> 62.68%     
client [82] (testset)   loss: 1.3724 -> 1.3569  accuracy: 53.61% -> 54.64%     
client [91] (testset)   loss: 1.5182 -> 1.4980  accuracy: 53.00% -> 56.00%     
client [57] (testset)   loss: 1.5636 -> 1.5381  accuracy: 50.69% -> 50.69%     
---------------------------- TRAINING EPOCH: 100 ----------------------------  
client [31] (testset)   loss: 1.4086 -> 1.3949  accuracy: 58.04% -> 58.04%     
client [15] (testset)   loss: 1.7325 -> 1.7014  accuracy: 54.68% -> 55.67%     
client [71] (testset)   loss: 1.3458 -> 1.3251  accuracy: 52.36% -> 52.36%     
client [97] (testset)   loss: 1.3022 -> 1.2737  accuracy: 59.06% -> 60.40%     
client [53] (testset)   loss: 1.7622 -> 1.7357  accuracy: 66.07% -> 66.07%     
client [77] (testset)   loss: 1.4733 -> 1.4458  accuracy: 59.04% -> 60.24%     
client [76] (testset)   loss: 1.1642 -> 1.1401  accuracy: 82.00% -> 82.00%     
client [79] (testset)   loss: 1.2269 -> 1.1971  accuracy: 63.80% -> 63.80%     
client [28] (testset)   loss: 1.5566 -> 1.5346  accuracy: 50.36% -> 53.28%     
client [99] (testset)   loss: 1.4909 -> 1.4700  accuracy: 62.57% -> 62.57%     
---------------------------- TRAINING EPOCH: 110 ----------------------------  
client [97] (testset)   loss: 1.2583 -> 1.2413  accuracy: 60.40% -> 60.40%     
client [86] (testset)   loss: 1.6191 -> 1.5866  accuracy: 61.94% -> 62.69%     
client [34] (testset)   loss: 1.5668 -> 1.5480  accuracy: 59.46% -> 59.46%     
client [73] (testset)   loss: 1.5350 -> 1.5076  accuracy: 47.92% -> 48.75%     
client [5]  (testset)   loss: 1.3781 -> 1.3549  accuracy: 69.14% -> 70.99%     
client [96] (testset)   loss: 1.3307 -> 1.3068  accuracy: 74.64% -> 75.12%     
client [22] (testset)   loss: 1.3885 -> 1.3599  accuracy: 69.41% -> 71.23%     
client [60] (testset)   loss: 1.3317 -> 1.3048  accuracy: 68.48% -> 70.29%     
client [66] (testset)   loss: 1.3172 -> 1.2922  accuracy: 76.29% -> 76.80%     
client [83] (testset)   loss: 1.4948 -> 1.4663  accuracy: 56.94% -> 57.89%     
---------------------------- TRAINING EPOCH: 120 ----------------------------  
client [76] (testset)   loss: 1.0875 -> 1.0686  accuracy: 80.00% -> 80.00%     
client [65] (testset)   loss: 1.2784 -> 1.2511  accuracy: 65.29% -> 65.29%     
client [95] (testset)   loss: 1.3001 -> 1.2801  accuracy: 64.39% -> 64.39%     
client [17] (testset)   loss: 1.7600 -> 1.7232  accuracy: 40.17% -> 41.48%     
client [8]  (testset)   loss: 1.3213 -> 1.3011  accuracy: 64.63% -> 65.85%     
client [35] (testset)   loss: 1.2233 -> 1.2011  accuracy: 68.26% -> 68.26%     
client [98] (testset)   loss: 1.5948 -> 1.5772  accuracy: 46.34% -> 47.15%     
client [53] (testset)   loss: 1.7150 -> 1.6891  accuracy: 67.86% -> 67.86%     
client [43] (testset)   loss: 1.4804 -> 1.4521  accuracy: 65.77% -> 64.86%     
client [64] (testset)   loss: 1.4037 -> 1.3712  accuracy: 58.51% -> 58.92%     
---------------------------- TRAINING EPOCH: 130 ----------------------------  
client [21] (testset)   loss: 1.5389 -> 1.5155  accuracy: 68.14% -> 69.03%     
client [88] (testset)   loss: 1.1256 -> 1.1034  accuracy: 81.31% -> 82.01%     
client [38] (testset)   loss: 1.4357 -> 1.4097  accuracy: 69.95% -> 69.95%     
client [3]  (testset)   loss: 1.3894 -> 1.3684  accuracy: 67.83% -> 68.70%     
client [5]  (testset)   loss: 1.3361 -> 1.3127  accuracy: 70.99% -> 72.22%     
client [41] (testset)   loss: 1.5404 -> 1.5178  accuracy: 57.14% -> 58.33%     
client [7]  (testset)   loss: 1.1550 -> 1.1335  accuracy: 67.26% -> 68.45%     
client [37] (testset)   loss: 1.2615 -> 1.2290  accuracy: 72.53% -> 72.96%     
client [45] (testset)   loss: 1.4012 -> 1.3683  accuracy: 57.47% -> 58.24%     
client [47] (testset)   loss: 1.3657 -> 1.3371  accuracy: 70.85% -> 72.06%     
---------------------------- TRAINING EPOCH: 140 ----------------------------  
client [16] (testset)   loss: 1.2076 -> 1.1850  accuracy: 78.08% -> 79.00%     
client [11] (testset)   loss: 1.3024 -> 1.2786  accuracy: 68.04% -> 69.07%     
client [37] (testset)   loss: 1.1798 -> 1.1521  accuracy: 72.96% -> 73.39%     
client [41] (testset)   loss: 1.5207 -> 1.4990  accuracy: 58.33% -> 58.33%     
client [95] (testset)   loss: 1.2357 -> 1.2200  accuracy: 65.37% -> 66.34%     
client [53] (testset)   loss: 1.6948 -> 1.6674  accuracy: 67.86% -> 68.75%     
client [22] (testset)   loss: 1.3393 -> 1.3132  accuracy: 72.60% -> 72.60%     
client [25] (testset)   loss: 1.3937 -> 1.3717  accuracy: 65.40% -> 65.88%     
client [69] (testset)   loss: 1.3546 -> 1.3363  accuracy: 63.86% -> 64.46%     
client [46] (testset)   loss: 1.5188 -> 1.4949  accuracy: 53.38% -> 53.38%     
---------------------------- TRAINING EPOCH: 150 ----------------------------  
client [47] (testset)   loss: 1.2488 -> 1.2240  accuracy: 76.52% -> 77.73%     
client [69] (testset)   loss: 1.3242 -> 1.3066  accuracy: 66.87% -> 67.47%     
client [82] (testset)   loss: 1.3168 -> 1.3003  accuracy: 56.70% -> 55.67%     
client [45] (testset)   loss: 1.3148 -> 1.2869  accuracy: 60.92% -> 61.69%     
client [7]  (testset)   loss: 1.1361 -> 1.1149  accuracy: 68.45% -> 69.05%     
client [50] (testset)   loss: 1.2827 -> 1.2559  accuracy: 62.68% -> 64.44%     
client [35] (testset)   loss: 1.1801 -> 1.1609  accuracy: 70.66% -> 70.66%     
client [24] (testset)   loss: 1.4811 -> 1.4636  accuracy: 57.02% -> 57.89%     
client [15] (testset)   loss: 1.5973 -> 1.5708  accuracy: 61.58% -> 63.05%     
client [58] (testset)   loss: 0.9887 -> 0.9746  accuracy: 77.44% -> 78.46%     
---------------------------- TRAINING EPOCH: 160 ----------------------------  
client [48] (testset)   loss: 1.1672 -> 1.1470  accuracy: 67.38% -> 68.09%     
client [76] (testset)   loss: 1.0417 -> 1.0256  accuracy: 80.00% -> 80.00%     
client [67] (testset)   loss: 1.6036 -> 1.5867  accuracy: 43.59% -> 43.59%     
client [37] (testset)   loss: 1.1320 -> 1.1078  accuracy: 73.82% -> 75.54%     
client [58] (testset)   loss: 0.9667 -> 0.9537  accuracy: 78.97% -> 78.46%     
client [64] (testset)   loss: 1.2979 -> 1.2712  accuracy: 61.41% -> 63.49%     
client [77] (testset)   loss: 1.3606 -> 1.3380  accuracy: 67.47% -> 69.48%     
client [55] (testset)   loss: 1.4085 -> 1.3928  accuracy: 69.70% -> 69.70%     
client [12] (testset)   loss: 1.3089 -> 1.2897  accuracy: 61.38% -> 61.38%     
client [89] (testset)   loss: 1.3692 -> 1.3524  accuracy: 64.60% -> 65.49%     
---------------------------- TRAINING EPOCH: 170 ----------------------------  
client [84] (testset)   loss: 1.1494 -> 1.1376  accuracy: 67.65% -> 68.24%     
client [51] (testset)   loss: 1.2249 -> 1.2071  accuracy: 70.56% -> 70.09%     
client [8]  (testset)   loss: 1.2205 -> 1.2055  accuracy: 66.46% -> 65.85%     
client [18] (testset)   loss: 1.4617 -> 1.4501  accuracy: 64.06% -> 64.06%     
client [94] (testset)   loss: 1.3434 -> 1.3155  accuracy: 65.12% -> 66.28%     
client [81] (testset)   loss: 1.5714 -> 1.5538  accuracy: 54.55% -> 53.64%     
client [3]  (testset)   loss: 1.3048 -> 1.2875  accuracy: 71.74% -> 71.74%     
client [11] (testset)   loss: 1.2160 -> 1.1949  accuracy: 70.62% -> 70.62%     
client [95] (testset)   loss: 1.1435 -> 1.1294  accuracy: 69.76% -> 70.24%     
client [67] (testset)   loss: 1.5894 -> 1.5723  accuracy: 43.59% -> 45.30%     
---------------------------- TRAINING EPOCH: 180 ----------------------------  
client [21] (testset)   loss: 1.4881 -> 1.4685  accuracy: 70.80% -> 70.80%     
client [79] (testset)   loss: 1.0014 -> 0.9875  accuracy: 70.61% -> 71.68%     
client [58] (testset)   loss: 0.9271 -> 0.9170  accuracy: 78.97% -> 78.97%     
client [88] (testset)   loss: 1.0554 -> 1.0377  accuracy: 81.66% -> 81.66%     
client [46] (testset)   loss: 1.4449 -> 1.4240  accuracy: 57.14% -> 58.65%     
client [11] (testset)   loss: 1.1969 -> 1.1772  accuracy: 70.62% -> 71.65%     
client [55] (testset)   loss: 1.3370 -> 1.3256  accuracy: 70.71% -> 70.71%     
client [13] (testset)   loss: 1.3301 -> 1.3156  accuracy: 60.80% -> 60.00%     
client [31] (testset)   loss: 1.3679 -> 1.3539  accuracy: 58.93% -> 61.61%     
client [75] (testset)   loss: 1.1214 -> 1.1026  accuracy: 76.60% -> 76.60%     
---------------------------- TRAINING EPOCH: 190 ----------------------------  
client [19] (testset)   loss: 1.2916 -> 1.2749  accuracy: 61.18% -> 61.18%     
client [7]  (testset)   loss: 1.0370 -> 1.0206  accuracy: 75.60% -> 76.19%     
client [57] (testset)   loss: 1.4017 -> 1.3844  accuracy: 56.22% -> 58.53%     
client [13] (testset)   loss: 1.3087 -> 1.2947  accuracy: 62.40% -> 62.40%     
client [43] (testset)   loss: 1.3577 -> 1.3369  accuracy: 70.27% -> 70.27%     
client [91] (testset)   loss: 1.4461 -> 1.4287  accuracy: 57.00% -> 57.00%     
client [10] (testset)   loss: 1.2965 -> 1.2754  accuracy: 79.47% -> 79.47%     
client [64] (testset)   loss: 1.1731 -> 1.1530  accuracy: 67.22% -> 67.22%     
client [82] (testset)   loss: 1.2548 -> 1.2484  accuracy: 56.70% -> 62.89%     
client [22] (testset)   loss: 1.2202 -> 1.2007  accuracy: 73.97% -> 73.97%     
---------------------------- TRAINING EPOCH: 200 ----------------------------  
client [20] (testset)   loss: 1.0315 -> 1.0160  accuracy: 81.58% -> 82.46%     
client [23] (testset)   loss: 1.3842 -> 1.3598  accuracy: 55.38% -> 56.45%     
client [88] (testset)   loss: 1.0399 -> 1.0224  accuracy: 81.66% -> 81.66%     
client [98] (testset)   loss: 1.4713 -> 1.4593  accuracy: 53.66% -> 53.66%     
client [79] (testset)   loss: 0.9613 -> 0.9476  accuracy: 72.40% -> 72.40%     
client [21] (testset)   loss: 1.4596 -> 1.4414  accuracy: 70.80% -> 71.68%     
client [92] (testset)   loss: 1.3317 -> 1.3165  accuracy: 57.69% -> 58.65%     
client [56] (testset)   loss: 1.2103 -> 1.1946  accuracy: 77.89% -> 77.89%     
client [5]  (testset)   loss: 1.2071 -> 1.1873  accuracy: 74.69% -> 75.31%     
client [52] (testset)   loss: 1.3787 -> 1.3628  accuracy: 79.82% -> 79.82%     
---------------------------- TRAINING EPOCH: 210 ----------------------------  
client [67] (testset)   loss: 1.4839 -> 1.4706  accuracy: 53.85% -> 54.70%     
client [54] (testset)   loss: 1.3100 -> 1.2913  accuracy: 68.54% -> 68.54%     
client [14] (testset)   loss: 1.3783 -> 1.3616  accuracy: 72.29% -> 71.08%     
client [99] (testset)   loss: 1.3283 -> 1.3136  accuracy: 65.36% -> 66.48%     
client [36] (testset)   loss: 1.0012 -> 0.9878  accuracy: 81.97% -> 81.97%     
client [30] (testset)   loss: 1.0188 -> 1.0031  accuracy: 79.56% -> 78.67%     
client [38] (testset)   loss: 1.2833 -> 1.2631  accuracy: 73.89% -> 73.40%     
client [15] (testset)   loss: 1.5056 -> 1.4826  accuracy: 66.01% -> 67.49%     
client [6]  (testset)   loss: 1.3253 -> 1.3115  accuracy: 55.48% -> 55.48%     
client [53] (testset)   loss: 1.4989 -> 1.4782  accuracy: 71.43% -> 71.43%     
---------------------------- TRAINING EPOCH: 220 ----------------------------  
client [99] (testset)   loss: 1.2916 -> 1.2769  accuracy: 66.48% -> 66.48%     
client [6]  (testset)   loss: 1.3145 -> 1.3005  accuracy: 55.48% -> 55.48%     
client [83] (testset)   loss: 1.2723 -> 1.2541  accuracy: 71.77% -> 72.25%     
client [42] (testset)   loss: 1.2218 -> 1.2086  accuracy: 82.46% -> 82.46%     
client [34] (testset)   loss: 1.4289 -> 1.4136  accuracy: 63.51% -> 63.51%     
client [15] (testset)   loss: 1.4841 -> 1.4623  accuracy: 67.49% -> 67.49%     
client [47] (testset)   loss: 1.0690 -> 1.0536  accuracy: 82.19% -> 82.59%     
client [55] (testset)   loss: 1.3178 -> 1.3045  accuracy: 70.71% -> 71.72%     
client [51] (testset)   loss: 1.1838 -> 1.1651  accuracy: 70.56% -> 71.03%     
client [95] (testset)   loss: 1.0886 -> 1.0778  accuracy: 74.63% -> 74.63%     
---------------------------- TRAINING EPOCH: 230 ----------------------------  
client [71] (testset)   loss: 1.2177 -> 1.2039  accuracy: 59.69% -> 60.21%     
client [15] (testset)   loss: 1.4640 -> 1.4432  accuracy: 67.49% -> 67.98%     
client [33] (testset)   loss: 1.4376 -> 1.4220  accuracy: 56.03% -> 56.74%     
client [99] (testset)   loss: 1.2681 -> 1.2544  accuracy: 68.72% -> 68.72%     
client [90] (testset)   loss: 1.2943 -> 1.2755  accuracy: 68.09% -> 68.09%     
client [57] (testset)   loss: 1.2882 -> 1.2734  accuracy: 62.67% -> 62.67%     
client [27] (testset)   loss: 1.4592 -> 1.4425  accuracy: 65.29% -> 65.29%     
client [78] (testset)   loss: 1.0383 -> 1.0256  accuracy: 74.55% -> 75.15%     
client [36] (testset)   loss: 0.9782 -> 0.9668  accuracy: 81.97% -> 82.51%     
client [88] (testset)   loss: 0.9982 -> 0.9831  accuracy: 81.66% -> 81.66%     
---------------------------- TRAINING EPOCH: 240 ----------------------------  
client [70] (testset)   loss: 1.0641 -> 1.0527  accuracy: 80.00% -> 80.00%     
client [35] (testset)   loss: 1.0943 -> 1.0802  accuracy: 73.65% -> 73.65%     
client [16] (testset)   loss: 0.9732 -> 0.9618  accuracy: 82.65% -> 82.65%     
client [80] (testset)   loss: 1.1023 -> 1.0872  accuracy: 74.34% -> 74.72%     
client [38] (testset)   loss: 1.2303 -> 1.2132  accuracy: 72.91% -> 73.89%     
client [78] (testset)   loss: 1.0239 -> 1.0143  accuracy: 74.55% -> 75.15%     
client [68] (testset)   loss: 0.9249 -> 0.9094  accuracy: 78.33% -> 78.33%     
client [11] (testset)   loss: 1.0998 -> 1.0857  accuracy: 74.23% -> 74.23%     
client [64] (testset)   loss: 1.0762 -> 1.0601  accuracy: 71.37% -> 71.78%     
client [82] (testset)   loss: 1.2037 -> 1.1917  accuracy: 62.89% -> 60.82%     
---------------------------- TRAINING EPOCH: 250 ----------------------------  
client [30] (testset)   loss: 0.9429 -> 0.9338  accuracy: 80.44% -> 81.33%     
client [27] (testset)   loss: 1.4444 -> 1.4282  accuracy: 65.29% -> 65.29%     
client [74] (testset)   loss: 1.1306 -> 1.1180  accuracy: 80.00% -> 80.00%     
client [45] (testset)   loss: 1.1149 -> 1.0995  accuracy: 71.65% -> 71.26%     
client [6]  (testset)   loss: 1.2925 -> 1.2790  accuracy: 56.16% -> 57.53%     
client [36] (testset)   loss: 0.9585 -> 0.9467  accuracy: 82.51% -> 83.06%     
client [63] (testset)   loss: 1.0455 -> 1.0284  accuracy: 77.92% -> 78.57%     
client [76] (testset)   loss: 0.9362 -> 0.9239  accuracy: 82.00% -> 82.00%     
client [83] (testset)   loss: 1.2266 -> 1.2104  accuracy: 73.21% -> 74.64%     
client [86] (testset)   loss: 1.2756 -> 1.2561  accuracy: 76.12% -> 76.87%     
---------------------------- TRAINING EPOCH: 260 ----------------------------  
client [83] (testset)   loss: 1.2124 -> 1.1967  accuracy: 74.64% -> 74.16%     
client [99] (testset)   loss: 1.2461 -> 1.2332  accuracy: 69.27% -> 69.27%     
client [74] (testset)   loss: 1.1052 -> 1.0880  accuracy: 80.62% -> 80.62%     
client [73] (testset)   loss: 1.2341 -> 1.2193  accuracy: 67.92% -> 68.75%     
client [29] (testset)   loss: 1.0872 -> 1.0702  accuracy: 75.65% -> 75.65%     
client [92] (testset)   loss: 1.2506 -> 1.2368  accuracy: 64.90% -> 65.38%     
client [6]  (testset)   loss: 1.2715 -> 1.2589  accuracy: 58.22% -> 59.59%     
client [61] (testset)   loss: 0.9214 -> 0.9060  accuracy: 74.44% -> 74.44%     
client [21] (testset)   loss: 1.4099 -> 1.3937  accuracy: 72.57% -> 73.45%     
client [67] (testset)   loss: 1.4395 -> 1.4263  accuracy: 60.68% -> 61.54%     
---------------------------- TRAINING EPOCH: 270 ----------------------------  
client [83] (testset)   loss: 1.1987 -> 1.1839  accuracy: 74.64% -> 74.16%     
client [32] (testset)   loss: 1.3781 -> 1.3705  accuracy: 46.75% -> 45.45%     
client [95] (testset)   loss: 1.0694 -> 1.0585  accuracy: 73.66% -> 74.63%     
client [61] (testset)   loss: 0.8748 -> 0.8617  accuracy: 77.78% -> 78.33%     
client [27] (testset)   loss: 1.4298 -> 1.4141  accuracy: 65.29% -> 65.29%     
client [25] (testset)   loss: 1.2741 -> 1.2581  accuracy: 72.04% -> 72.99%     
client [68] (testset)   loss: 0.8741 -> 0.8615  accuracy: 78.89% -> 79.44%     
client [34] (testset)   loss: 1.3893 -> 1.3740  accuracy: 64.19% -> 64.19%     
client [71] (testset)   loss: 1.1508 -> 1.1392  accuracy: 64.40% -> 65.97%     
client [89] (testset)   loss: 1.2789 -> 1.2652  accuracy: 67.26% -> 67.26%     
---------------------------- TRAINING EPOCH: 280 ----------------------------  
client [78] (testset)   loss: 0.9718 -> 0.9635  accuracy: 74.55% -> 75.15%     
client [81] (testset)   loss: 1.4160 -> 1.4027  accuracy: 57.27% -> 57.27%     
client [51] (testset)   loss: 1.1128 -> 1.1005  accuracy: 70.09% -> 70.09%     
client [54] (testset)   loss: 1.2496 -> 1.2341  accuracy: 70.22% -> 70.22%     
client [65] (testset)   loss: 1.0271 -> 1.0138  accuracy: 77.06% -> 77.06%     
client [41] (testset)   loss: 1.2655 -> 1.2527  accuracy: 73.21% -> 73.21%     
client [11] (testset)   loss: 1.0602 -> 1.0453  accuracy: 76.29% -> 76.29%     
client [85] (testset)   loss: 1.4624 -> 1.4516  accuracy: 63.38% -> 63.38%     
client [12] (testset)   loss: 1.1651 -> 1.1509  accuracy: 74.60% -> 75.13%     
client [23] (testset)   loss: 1.2191 -> 1.2013  accuracy: 64.52% -> 65.05%     
---------------------------- TRAINING EPOCH: 290 ----------------------------  
client [16] (testset)   loss: 0.9426 -> 0.9311  accuracy: 83.56% -> 83.56%     
client [65] (testset)   loss: 1.0046 -> 0.9918  accuracy: 78.24% -> 78.82%     
client [53] (testset)   loss: 1.3596 -> 1.3426  accuracy: 75.89% -> 75.00%     
client [58] (testset)   loss: 0.8426 -> 0.8348  accuracy: 81.03% -> 80.51%     
client [72] (testset)   loss: 0.9404 -> 0.9283  accuracy: 77.60% -> 77.60%     
client [7]  (testset)   loss: 0.9284 -> 0.9170  accuracy: 80.36% -> 80.95%     
client [71] (testset)   loss: 1.1422 -> 1.1310  accuracy: 65.97% -> 65.97%     
client [59] (testset)   loss: 1.0527 -> 1.0408  accuracy: 75.00% -> 75.52%     
client [86] (testset)   loss: 1.2028 -> 1.1877  accuracy: 78.36% -> 79.10%     
client [39] (testset)   loss: 1.1403 -> 1.1309  accuracy: 80.22% -> 78.57%     
---------------------------- TRAINING EPOCH: 300 ----------------------------  
client [99] (testset)   loss: 1.2148 -> 1.2023  accuracy: 70.95% -> 70.95%     
client [7]  (testset)   loss: 0.9087 -> 0.8979  accuracy: 80.95% -> 80.95%     
client [17] (testset)   loss: 1.2227 -> 1.2087  accuracy: 71.62% -> 71.18%     
client [64] (testset)   loss: 0.9676 -> 0.9563  accuracy: 75.10% -> 75.52%     
client [37] (testset)   loss: 0.8993 -> 0.8875  accuracy: 80.26% -> 80.69%     
client [29] (testset)   loss: 1.0222 -> 1.0083  accuracy: 78.26% -> 79.13%     
client [93] (testset)   loss: 1.1579 -> 1.1419  accuracy: 81.75% -> 81.75%     
client [73] (testset)   loss: 1.1588 -> 1.1467  accuracy: 72.08% -> 72.50%     
client [40] (testset)   loss: 1.1855 -> 1.1743  accuracy: 69.60% -> 69.60%     
client [76] (testset)   loss: 0.8973 -> 0.8863  accuracy: 82.00% -> 82.00%     
---------------------------- TRAINING EPOCH: 310 ----------------------------  
client [31] (testset)   loss: 1.2455 -> 1.2364  accuracy: 66.07% -> 66.07%     
client [89] (testset)   loss: 1.2402 -> 1.2271  accuracy: 67.26% -> 67.26%     
client [77] (testset)   loss: 1.0750 -> 1.0638  accuracy: 74.70% -> 75.10%     
client [90] (testset)   loss: 1.1509 -> 1.1378  accuracy: 69.50% -> 70.21%     
client [26] (testset)   loss: 1.0256 -> 1.0102  accuracy: 72.03% -> 73.31%     
client [50] (testset)   loss: 1.0147 -> 1.0015  accuracy: 73.59% -> 73.94%     
client [30] (testset)   loss: 0.8860 -> 0.8774  accuracy: 81.78% -> 82.22%     
client [70] (testset)   loss: 1.0099 -> 0.9994  accuracy: 80.83% -> 80.83%     
client [41] (testset)   loss: 1.2215 -> 1.2101  accuracy: 73.81% -> 73.81%     
client [99] (testset)   loss: 1.2044 -> 1.1935  accuracy: 70.95% -> 70.95%     
---------------------------- TRAINING EPOCH: 320 ----------------------------  
client [68] (testset)   loss: 0.7867 -> 0.7776  accuracy: 82.22% -> 82.22%     
client [70] (testset)   loss: 0.9852 -> 0.9757  accuracy: 81.25% -> 81.25%     
client [52] (testset)   loss: 1.2582 -> 1.2471  accuracy: 79.82% -> 79.82%     
client [1]  (testset)   loss: 1.3517 -> 1.3341  accuracy: 72.20% -> 71.71%     
client [2]  (testset)   loss: 1.0571 -> 1.0434  accuracy: 75.59% -> 76.38%     
client [67] (testset)   loss: 1.3518 -> 1.3413  accuracy: 66.67% -> 66.67%     
client [92] (testset)   loss: 1.0979 -> 1.0877  accuracy: 75.00% -> 75.00%     
client [35] (testset)   loss: 1.0341 -> 1.0215  accuracy: 75.45% -> 75.45%     
client [36] (testset)   loss: 0.8667 -> 0.8594  accuracy: 84.70% -> 84.70%     
client [64] (testset)   loss: 0.9474 -> 0.9376  accuracy: 75.93% -> 75.52%     
---------------------------- TRAINING EPOCH: 330 ----------------------------  
client [44] (testset)   loss: 1.0683 -> 1.0564  accuracy: 74.70% -> 75.30%     
client [6]  (testset)   loss: 1.2053 -> 1.1944  accuracy: 66.44% -> 67.12%     
client [12] (testset)   loss: 1.1065 -> 1.0942  accuracy: 78.84% -> 79.37%     
client [55] (testset)   loss: 1.2489 -> 1.2361  accuracy: 71.72% -> 71.72%     
client [29] (testset)   loss: 0.9790 -> 0.9665  accuracy: 80.00% -> 81.74%     
client [9]  (testset)   loss: 1.2250 -> 1.2133  accuracy: 73.83% -> 73.83%     
client [43] (testset)   loss: 1.1923 -> 1.1795  accuracy: 80.18% -> 81.08%     
client [77] (testset)   loss: 1.0649 -> 1.0526  accuracy: 75.10% -> 75.90%     
client [98] (testset)   loss: 1.3194 -> 1.3101  accuracy: 61.79% -> 61.79%     
client [78] (testset)   loss: 0.9490 -> 0.9408  accuracy: 75.15% -> 75.15%     
---------------------------- TRAINING EPOCH: 340 ----------------------------  
client [92] (testset)   loss: 1.0736 -> 1.0648  accuracy: 75.96% -> 76.44%     
client [80] (testset)   loss: 1.0254 -> 1.0133  accuracy: 78.49% -> 78.87%     
client [63] (testset)   loss: 0.9634 -> 0.9502  accuracy: 79.22% -> 79.22%     
client [76] (testset)   loss: 0.8736 -> 0.8636  accuracy: 82.00% -> 82.00%     
client [78] (testset)   loss: 0.9434 -> 0.9368  accuracy: 75.15% -> 75.15%     
client [25] (testset)   loss: 1.2267 -> 1.2126  accuracy: 74.41% -> 74.41%     
client [58] (testset)   loss: 0.8137 -> 0.8065  accuracy: 81.03% -> 81.54%     
client [13] (testset)   loss: 1.1972 -> 1.1863  accuracy: 64.00% -> 64.00%     
client [17] (testset)   loss: 1.1496 -> 1.1388  accuracy: 74.67% -> 74.67%     
client [38] (testset)   loss: 1.0081 -> 0.9993  accuracy: 78.33% -> 78.33%     
---------------------------- TRAINING EPOCH: 350 ----------------------------  
client [72] (testset)   loss: 0.8535 -> 0.8439  accuracy: 80.80% -> 81.60%     
client [82] (testset)   loss: 1.1253 -> 1.1140  accuracy: 67.01% -> 67.01%     
client [86] (testset)   loss: 1.0946 -> 1.0814  accuracy: 84.33% -> 84.33%     
client [51] (testset)   loss: 1.0512 -> 1.0445  accuracy: 74.30% -> 72.90%     
client [96] (testset)   loss: 1.0008 -> 0.9902  accuracy: 84.21% -> 84.21%     
client [42] (testset)   loss: 1.1081 -> 1.0981  accuracy: 82.46% -> 83.33%     
client [55] (testset)   loss: 1.2069 -> 1.1974  accuracy: 73.74% -> 73.74%     
client [13] (testset)   loss: 1.1810 -> 1.1703  accuracy: 64.00% -> 64.00%     
client [1]  (testset)   loss: 1.3041 -> 1.2896  accuracy: 73.66% -> 75.12%     
client [12] (testset)   loss: 1.0959 -> 1.0844  accuracy: 78.84% -> 80.95%     
---------------------------- TRAINING EPOCH: 360 ----------------------------  
client [68] (testset)   loss: 0.7632 -> 0.7554  accuracy: 82.22% -> 82.22%     
client [23] (testset)   loss: 1.1095 -> 1.0957  accuracy: 72.04% -> 72.58%     
client [46] (testset)   loss: 1.1901 -> 1.1799  accuracy: 72.93% -> 73.68%     
client [41] (testset)   loss: 1.1728 -> 1.1626  accuracy: 75.00% -> 75.00%     
client [25] (testset)   loss: 1.1839 -> 1.1718  accuracy: 74.88% -> 74.41%     
client [58] (testset)   loss: 0.8026 -> 0.7974  accuracy: 81.54% -> 81.54%     
client [14] (testset)   loss: 1.2671 -> 1.2545  accuracy: 71.08% -> 71.08%     
client [33] (testset)   loss: 1.3157 -> 1.3025  accuracy: 66.67% -> 65.25%     
client [85] (testset)   loss: 1.4018 -> 1.3929  accuracy: 64.79% -> 64.79%     
client [62] (testset)   loss: 0.9283 -> 0.9167  accuracy: 77.84% -> 77.84%     
---------------------------- TRAINING EPOCH: 370 ----------------------------  
client [98] (testset)   loss: 1.2716 -> 1.2624  accuracy: 65.04% -> 65.85%     
client [63] (testset)   loss: 0.9364 -> 0.9255  accuracy: 79.22% -> 79.87%     
client [70] (testset)   loss: 0.9426 -> 0.9348  accuracy: 82.08% -> 82.50%     
client [65] (testset)   loss: 0.9541 -> 0.9433  accuracy: 80.00% -> 80.59%     
client [14] (testset)   loss: 1.2436 -> 1.2334  accuracy: 71.08% -> 71.08%     
client [73] (testset)   loss: 1.0973 -> 1.0873  accuracy: 73.75% -> 74.58%     
client [34] (testset)   loss: 1.2660 -> 1.2550  accuracy: 68.92% -> 68.92%     
client [99] (testset)   loss: 1.1676 -> 1.1572  accuracy: 70.95% -> 70.95%     
client [69] (testset)   loss: 1.0952 -> 1.0850  accuracy: 75.90% -> 75.90%     
client [46] (testset)   loss: 1.1815 -> 1.1707  accuracy: 73.68% -> 73.68%     
---------------------------- TRAINING EPOCH: 380 ----------------------------  
client [99] (testset)   loss: 1.1507 -> 1.1408  accuracy: 71.51% -> 71.51%     
client [93] (testset)   loss: 1.0993 -> 1.0839  accuracy: 82.94% -> 83.33%     
client [11] (testset)   loss: 0.9636 -> 0.9556  accuracy: 77.84% -> 77.84%     
client [58] (testset)   loss: 0.7834 -> 0.7763  accuracy: 81.54% -> 82.05%     
client [81] (testset)   loss: 1.2908 -> 1.2813  accuracy: 63.64% -> 64.55%     
client [85] (testset)   loss: 1.3962 -> 1.3860  accuracy: 64.79% -> 64.79%     
client [89] (testset)   loss: 1.1792 -> 1.1684  accuracy: 69.91% -> 70.80%     
client [45] (testset)   loss: 0.9871 -> 0.9765  accuracy: 75.48% -> 75.48%     
client [8]  (testset)   loss: 1.0530 -> 1.0437  accuracy: 72.56% -> 72.56%     
client [68] (testset)   loss: 0.7300 -> 0.7231  accuracy: 83.33% -> 83.33%     
---------------------------- TRAINING EPOCH: 390 ----------------------------  
client [67] (testset)   loss: 1.3101 -> 1.3007  accuracy: 69.23% -> 69.23%     
client [72] (testset)   loss: 0.8153 -> 0.8067  accuracy: 83.60% -> 83.20%     
client [1]  (testset)   loss: 1.2611 -> 1.2463  accuracy: 75.12% -> 75.61%     
client [78] (testset)   loss: 0.9101 -> 0.9034  accuracy: 75.15% -> 74.55%     
client [83] (testset)   loss: 1.0316 -> 1.0230  accuracy: 79.90% -> 79.90%     
client [21] (testset)   loss: 1.2779 -> 1.2663  accuracy: 75.22% -> 75.22%     
client [56] (testset)   loss: 0.9936 -> 0.9863  accuracy: 81.58% -> 81.58%     
client [44] (testset)   loss: 0.9870 -> 0.9769  accuracy: 78.31% -> 78.31%     
client [92] (testset)   loss: 1.0440 -> 1.0363  accuracy: 76.92% -> 77.40%     
client [27] (testset)   loss: 1.2809 -> 1.2686  accuracy: 68.82% -> 68.82%     
---------------------------- TRAINING EPOCH: 400 ----------------------------  
client [10] (testset)   loss: 0.9565 -> 0.9476  accuracy: 85.43% -> 86.09%     
client [39] (testset)   loss: 1.0708 -> 1.0596  accuracy: 79.12% -> 79.67%     
client [65] (testset)   loss: 0.9194 -> 0.9097  accuracy: 81.18% -> 81.18%     
client [26] (testset)   loss: 0.9155 -> 0.9041  accuracy: 77.97% -> 77.54%     
client [19] (testset)   loss: 1.0375 -> 1.0277  accuracy: 77.65% -> 77.65%     
client [68] (testset)   loss: 0.7180 -> 0.7115  accuracy: 83.33% -> 83.33%     
client [41] (testset)   loss: 1.1304 -> 1.1213  accuracy: 76.79% -> 77.38%     
client [50] (testset)   loss: 0.8789 -> 0.8717  accuracy: 78.52% -> 79.58%     
client [75] (testset)   loss: 0.9139 -> 0.9046  accuracy: 84.04% -> 84.04%     
client [81] (testset)   loss: 1.2636 -> 1.2553  accuracy: 65.45% -> 64.55%     
Training... ---------------------------------------- 100% 0:18:49
FLUTE's average time taken by each global epoch: 0 min 2.81 sec.               
FLUTE's total running time: 0 h 18 m 49 s.                                     
==================== FLUTE Experiment Results: ====================            
Display format: (before local fine-tuning) -> (after local fine-tuning)        
 So if finetune_epoch = 0, x.xx% -> 0.00% is normal.                           
 Centralized testing ONLY happens after model aggregation, so the stats between
'->' are the same.                                                             
{                                                                              
    "100": {                                                                   
        "all_clients": {                                                       
            "test": {                                                          
                "loss": "1.4083 -> 0.0000",                                    
                "accuracy": "62.72% -> 0.00%"                                  
            }                                                                  
        }                                                                      
    },                                                                         
    "200": {                                                                   
        "all_clients": {                                                       
            "test": {                                                          
                "loss": "1.2269 -> 0.0000",                                    
                "accuracy": "70.37% -> 0.00%"                                  
            }                                                                  
        }                                                                      
    },                                                                         
    "300": {                                                                   
        "all_clients": {                                                       
            "test": {                                                          
                "loss": "1.0984 -> 0.0000",                                    
                "accuracy": "75.13% -> 0.00%"                                  
            }                                                                  
        }                                                                      
    },                                                                         
    "400": {                                                                   
        "all_clients": {                                                       
            "test": {                                                          
                "loss": "1.0078 -> 0.0000",                                    
                "accuracy": "77.93% -> 0.00%"                                  
            }                                                                  
        }                                                                      
    }                                                                          
}                                                                              
==================== FLUTE Max Accuracy ====================                   
all_clients:                                                                   
(test) before fine-tuning: 77.93% at epoch 400                                 
(test) after fine-tuning: 0.00% at epoch 100                                   
[0m