==================== Local-only ====================                           
Experiment Arguments:                                                          
{
│   'method': 'local',
│   'dataset': {
│   │   'name': 'medmnistC',
│   │   'client_num': 100,
│   │   'test_ratio': 0.25,
│   │   'val_ratio': 0.0,
│   │   'seed': 42,
│   │   'split': 'sample',
│   │   'IID_ratio': 0.0,
│   │   'monitor_window_name_suffix': 'medmnistC-100clients-0%IID-Dir(1.0)-seed42',
│   │   'alpha': 1.0,
│   │   'min_samples_per_client': 10
│   },
│   'model': {
│   │   'name': 'lenet5',
│   │   'use_torchvision_pretrained_weights': True,
│   │   'external_model_weights_path': None
│   },
│   'optimizer': {
│   │   'lr': 0.01,
│   │   'dampening': 0,
│   │   'weight_decay': 0,
│   │   'momentum': 0,
│   │   'nesterov': False,
│   │   'name': 'sgd'
│   },
│   'mode': 'serial',
│   'parallel': {
│   │   'ray_cluster_addr': None,
│   │   'num_cpus': None,
│   │   'num_gpus': None,
│   │   'num_workers': 2
│   },
│   'common': {
│   │   'seed': 42,
│   │   'join_ratio': 0.1,
│   │   'global_epoch': 400,
│   │   'local_epoch': 5,
│   │   'batch_size': 32,
│   │   'reset_optimizer_on_global_epoch': True,
│   │   'straggler_ratio': 0,
│   │   'straggler_min_local_epoch': 0,
│   │   'buffers': 'global',
│   │   'client_side_evaluation': True,
│   │   'test': {
│   │   │   'client': {
│   │   │   │   'interval': 100,
│   │   │   │   'finetune_epoch': 0,
│   │   │   │   'train': False,
│   │   │   │   'val': False,
│   │   │   │   'test': True
│   │   │   },
│   │   │   'server': {
│   │   │   │   'interval': -1,
│   │   │   │   'train': False,
│   │   │   │   'val': False,
│   │   │   │   'test': False,
│   │   │   │   'model_in_train_mode': False
│   │   │   }
│   │   },
│   │   'verbose_gap': 10,
│   │   'monitor': None,
│   │   'use_cuda': True,
│   │   'save_log': True,
│   │   'save_model': False,
│   │   'save_learning_curve_plot': False,
│   │   'save_metrics': True,
│   │   'delete_useless_run': True
│   }
}
---------------------------- TRAINING EPOCH: 10 ----------------------------   
client [77] (testset)   loss: 2.0015 -> 2.0005  accuracy: 30.00% -> 30.00%     
client [81] (testset)   loss: 1.9979 -> 1.9949  accuracy: 35.14% -> 35.14%     
client [21] (testset)   loss: 2.3626 -> 2.0031  accuracy: 1.75% -> 26.32%      
client [68] (testset)   loss: 1.8131 -> 1.7653  accuracy: 37.78% -> 37.78%     
client [93] (testset)   loss: 1.6939 -> 1.6922  accuracy: 45.65% -> 45.65%     
client [31] (testset)   loss: 2.2768 -> 1.8710  accuracy: 44.44% -> 44.44%     
client [20] (testset)   loss: 2.1648 -> 2.1611  accuracy: 18.03% -> 18.03%     
client [59] (testset)   loss: 2.3735 -> 2.1502  accuracy: 12.64% -> 24.14%     
client [48] (testset)   loss: 2.2370 -> 2.2621  accuracy: 17.39% -> 17.39%     
client [34] (testset)   loss: 1.9673 -> 1.9322  accuracy: 24.59% -> 24.59%     
---------------------------- TRAINING EPOCH: 20 ----------------------------   
client [69] (testset)   loss: 2.0969 -> 2.0334  accuracy: 29.41% -> 29.41%     
client [99] (testset)   loss: 2.2572 -> 2.1069  accuracy: 20.51% -> 20.51%     
client [67] (testset)   loss: 2.1093 -> 2.1122  accuracy: 19.30% -> 19.30%     
client [0]  (testset)   loss: 1.7209 -> 1.7222  accuracy: 36.99% -> 36.99%     
client [76] (testset)   loss: 1.9307 -> 1.8901  accuracy: 27.78% -> 27.78%     
client [41] (testset)   loss: 2.0845 -> 1.9836  accuracy: 26.92% -> 26.92%     
client [62] (testset)   loss: 2.4015 -> 2.1995  accuracy: 0.00% -> 41.38%      
client [2]  (testset)   loss: 2.3692 -> 1.7987  accuracy: 1.20% -> 49.40%      
client [14] (testset)   loss: 2.0658 -> 2.0635  accuracy: 31.88% -> 31.88%     
client [46] (testset)   loss: 1.8164 -> 1.8342  accuracy: 48.94% -> 48.94%     
---------------------------- TRAINING EPOCH: 30 ----------------------------   
client [24] (testset)   loss: 2.1622 -> 2.1958  accuracy: 36.00% -> 36.00%     
client [68] (testset)   loss: 1.7585 -> 1.7756  accuracy: 37.78% -> 37.78%     
client [57] (testset)   loss: 2.0953 -> 2.1069  accuracy: 34.78% -> 34.78%     
client [17] (testset)   loss: 2.0084 -> 1.9958  accuracy: 32.00% -> 32.00%     
client [54] (testset)   loss: 2.3573 -> 2.4650  accuracy: 18.75% -> 18.75%     
client [23] (testset)   loss: 2.3600 -> 2.2505  accuracy: 23.53% -> 20.59%     
client [35] (testset)   loss: 1.9649 -> 1.9643  accuracy: 33.33% -> 33.33%     
client [59] (testset)   loss: 2.1000 -> 2.0999  accuracy: 24.14% -> 24.14%     
client [31] (testset)   loss: 1.8895 -> 1.8357  accuracy: 44.44% -> 44.44%     
client [9]  (testset)   loss: 2.3426 -> 2.3512  accuracy: 13.33% -> 13.33%     
---------------------------- TRAINING EPOCH: 40 ----------------------------   
client [64] (testset)   loss: 2.1779 -> 2.1822  accuracy: 20.00% -> 20.00%     
client [33] (testset)   loss: 1.8098 -> 1.8437  accuracy: 22.22% -> 22.22%     
client [16] (testset)   loss: 2.0608 -> 2.0331  accuracy: 26.67% -> 26.67%     
client [44] (testset)   loss: 2.1407 -> 2.1492  accuracy: 23.21% -> 23.21%     
client [8]  (testset)   loss: 1.9248 -> 1.9436  accuracy: 34.17% -> 34.17%     
client [31] (testset)   loss: 1.8559 -> 1.9164  accuracy: 44.44% -> 44.44%     
client [47] (testset)   loss: 1.7350 -> 1.7036  accuracy: 47.22% -> 47.22%     
client [36] (testset)   loss: 2.1117 -> 2.0750  accuracy: 24.49% -> 24.49%     
client [20] (testset)   loss: 2.2096 -> 2.1839  accuracy: 18.03% -> 18.03%     
client [56] (testset)   loss: 2.2942 -> 2.1720  accuracy: 7.27% -> 7.27%       
---------------------------- TRAINING EPOCH: 50 ----------------------------   
client [4]  (testset)   loss: 2.0227 -> 2.0262  accuracy: 30.19% -> 30.19%     
client [60] (testset)   loss: 2.2360 -> 2.2386  accuracy: 28.57% -> 28.57%     
client [28] (testset)   loss: 2.1887 -> 2.1895  accuracy: 12.33% -> 12.33%     
client [25] (testset)   loss: 2.4692 -> 2.4576  accuracy: 12.00% -> 12.00%     
client [58] (testset)   loss: 1.6828 -> 1.6878  accuracy: 42.47% -> 42.47%     
client [44] (testset)   loss: 2.1492 -> 2.1629  accuracy: 23.21% -> 23.21%     
client [39] (testset)   loss: 1.4033 -> 1.4063  accuracy: 53.77% -> 53.77%     
client [29] (testset)   loss: 1.7802 -> 1.7779  accuracy: 37.66% -> 37.66%     
client [3]  (testset)   loss: 2.3865 -> 2.4899  accuracy: 9.26% -> 9.26%       
client [84] (testset)   loss: 1.6381 -> 1.6633  accuracy: 38.53% -> 38.53%     
---------------------------- TRAINING EPOCH: 60 ----------------------------   
client [21] (testset)   loss: 1.9547 -> 1.9624  accuracy: 26.32% -> 26.32%     
client [84] (testset)   loss: 1.7152 -> 1.6722  accuracy: 38.53% -> 38.53%     
client [10] (testset)   loss: 2.1433 -> 2.0536  accuracy: 38.89% -> 38.89%     
client [36] (testset)   loss: 2.0606 -> 2.0690  accuracy: 24.49% -> 24.49%     
client [65] (testset)   loss: 2.0008 -> 2.0385  accuracy: 37.74% -> 37.74%     
client [81] (testset)   loss: 1.9989 -> 2.0019  accuracy: 35.14% -> 35.14%     
client [79] (testset)   loss: 2.2687 -> 2.2658  accuracy: 21.15% -> 21.15%     
client [42] (testset)   loss: 2.3091 -> 2.2558  accuracy: 7.14% -> 7.14%       
client [11] (testset)   loss: 1.9561 -> 1.9687  accuracy: 30.36% -> 21.43%     
client [96] (testset)   loss: 2.0841 -> 2.0878  accuracy: 30.36% -> 30.36%     
---------------------------- TRAINING EPOCH: 70 ----------------------------   
client [8]  (testset)   loss: 1.8907 -> 1.9086  accuracy: 34.17% -> 34.17%     
client [53] (testset)   loss: 2.1206 -> 2.0879  accuracy: 38.71% -> 38.71%     
client [52] (testset)   loss: 1.2791 -> 1.2935  accuracy: 57.14% -> 57.14%     
client [42] (testset)   loss: 2.2409 -> 2.2661  accuracy: 17.86% -> 7.14%      
client [69] (testset)   loss: 2.0273 -> 2.0160  accuracy: 29.41% -> 29.41%     
client [59] (testset)   loss: 2.1034 -> 2.1177  accuracy: 24.14% -> 24.14%     
client [7]  (testset)   loss: 1.9335 -> 1.9279  accuracy: 32.79% -> 32.79%     
client [26] (testset)   loss: 2.1761 -> 2.1771  accuracy: 22.81% -> 22.81%     
client [49] (testset)   loss: 1.9572 -> 1.9027  accuracy: 15.15% -> 24.24%     
client [98] (testset)   loss: 2.0583 -> 2.0567  accuracy: 37.74% -> 37.74%     
---------------------------- TRAINING EPOCH: 80 ----------------------------   
client [98] (testset)   loss: 2.0567 -> 2.0609  accuracy: 37.74% -> 37.74%     
client [47] (testset)   loss: 1.7172 -> 1.7138  accuracy: 47.22% -> 47.22%     
client [21] (testset)   loss: 1.9806 -> 1.9512  accuracy: 26.32% -> 26.32%     
client [77] (testset)   loss: 1.9805 -> 1.9779  accuracy: 30.00% -> 30.00%     
client [95] (testset)   loss: 1.9949 -> 2.0139  accuracy: 34.25% -> 34.25%     
client [91] (testset)   loss: 1.9861 -> 2.0048  accuracy: 37.93% -> 37.93%     
client [14] (testset)   loss: 2.0470 -> 2.0498  accuracy: 31.88% -> 31.88%     
client [99] (testset)   loss: 2.0667 -> 2.0730  accuracy: 10.26% -> 12.82%     
client [20] (testset)   loss: 2.1966 -> 2.1982  accuracy: 18.03% -> 18.03%     
client [39] (testset)   loss: 1.4077 -> 1.4028  accuracy: 53.77% -> 53.77%     
---------------------------- TRAINING EPOCH: 90 ----------------------------   
client [52] (testset)   loss: 1.2935 -> 1.2993  accuracy: 57.14% -> 57.14%     
client [62] (testset)   loss: 1.8772 -> 1.8717  accuracy: 41.38% -> 41.38%     
client [71] (testset)   loss: 2.0274 -> 2.0773  accuracy: 23.33% -> 23.33%     
client [97] (testset)   loss: 1.8688 -> 1.8637  accuracy: 25.76% -> 31.82%     
client [30] (testset)   loss: 2.3491 -> 2.3501  accuracy: 15.15% -> 15.15%     
client [88] (testset)   loss: 2.2054 -> 2.1706  accuracy: 22.81% -> 22.81%     
client [60] (testset)   loss: 2.2086 -> 2.1942  accuracy: 28.57% -> 28.57%     
client [82] (testset)   loss: 1.9452 -> 1.9346  accuracy: 11.94% -> 11.94%     
client [91] (testset)   loss: 2.0308 -> 2.0391  accuracy: 13.79% -> 13.79%     
client [57] (testset)   loss: 2.0898 -> 2.1056  accuracy: 34.78% -> 34.78%     
---------------------------- TRAINING EPOCH: 100 ----------------------------  
client [31] (testset)   loss: 1.8381 -> 1.8776  accuracy: 44.44% -> 44.44%     
client [15] (testset)   loss: 1.4923 -> 1.4726  accuracy: 61.04% -> 61.04%     
client [71] (testset)   loss: 2.0773 -> 2.0432  accuracy: 23.33% -> 23.33%     
client [97] (testset)   loss: 1.8609 -> 1.9641  accuracy: 25.76% -> 25.76%     
client [53] (testset)   loss: 2.0908 -> 2.0933  accuracy: 38.71% -> 38.71%     
client [77] (testset)   loss: 1.9779 -> 1.9774  accuracy: 30.00% -> 30.00%     
client [76] (testset)   loss: 1.9052 -> 1.8891  accuracy: 27.78% -> 27.78%     
client [79] (testset)   loss: 2.3032 -> 2.2936  accuracy: 21.15% -> 21.15%     
client [28] (testset)   loss: 2.1929 -> 2.1896  accuracy: 12.33% -> 12.33%     
client [99] (testset)   loss: 2.0670 -> 2.0793  accuracy: 12.82% -> 10.26%     
---------------------------- TRAINING EPOCH: 110 ----------------------------  
client [97] (testset)   loss: 1.8553 -> 1.8941  accuracy: 31.82% -> 25.76%     
client [86] (testset)   loss: 1.6996 -> 1.7469  accuracy: 48.44% -> 48.44%     
client [34] (testset)   loss: 1.9134 -> 1.9008  accuracy: 24.59% -> 24.59%     
client [73] (testset)   loss: 2.3329 -> 2.3319  accuracy: 12.28% -> 12.28%     
client [5]  (testset)   loss: 2.2842 -> 2.2018  accuracy: 26.09% -> 26.09%     
client [96] (testset)   loss: 2.0852 -> 2.0956  accuracy: 30.36% -> 30.36%     
client [22] (testset)   loss: 1.8600 -> 1.8502  accuracy: 46.00% -> 46.00%     
client [60] (testset)   loss: 2.1802 -> 2.1741  accuracy: 28.57% -> 28.57%     
client [66] (testset)   loss: 2.1764 -> 2.1771  accuracy: 19.05% -> 19.05%     
client [83] (testset)   loss: 2.1143 -> 2.1378  accuracy: 19.57% -> 19.57%     
---------------------------- TRAINING EPOCH: 120 ----------------------------  
client [76] (testset)   loss: 1.9102 -> 1.9016  accuracy: 27.78% -> 27.78%     
client [65] (testset)   loss: 1.9949 -> 2.0371  accuracy: 37.74% -> 37.74%     
client [95] (testset)   loss: 2.0082 -> 2.0023  accuracy: 34.25% -> 34.25%     
client [17] (testset)   loss: 2.0224 -> 2.0167  accuracy: 32.00% -> 32.00%     
client [8]  (testset)   loss: 1.8754 -> 1.8889  accuracy: 34.17% -> 34.17%     
client [35] (testset)   loss: 2.0049 -> 1.9889  accuracy: 33.33% -> 33.33%     
client [98] (testset)   loss: 2.0560 -> 2.0553  accuracy: 37.74% -> 37.74%     
client [53] (testset)   loss: 2.0863 -> 2.1013  accuracy: 38.71% -> 38.71%     
client [43] (testset)   loss: 1.5124 -> 1.4954  accuracy: 57.89% -> 57.89%     
client [64] (testset)   loss: 2.1859 -> 2.1895  accuracy: 20.00% -> 20.00%     
---------------------------- TRAINING EPOCH: 130 ----------------------------  
client [21] (testset)   loss: 1.9792 -> 2.0074  accuracy: 26.32% -> 26.32%     
client [88] (testset)   loss: 2.1928 -> 2.1664  accuracy: 15.79% -> 22.81%     
client [38] (testset)   loss: 2.1880 -> 2.1935  accuracy: 18.92% -> 18.92%     
client [3]  (testset)   loss: 2.4915 -> 2.4962  accuracy: 9.26% -> 9.26%       
client [5]  (testset)   loss: 2.1900 -> 2.1829  accuracy: 26.09% -> 26.09%     
client [41] (testset)   loss: 2.0152 -> 2.0172  accuracy: 26.92% -> 26.92%     
client [7]  (testset)   loss: 1.9298 -> 1.9356  accuracy: 32.79% -> 32.79%     
client [37] (testset)   loss: 1.9755 -> 1.9461  accuracy: 40.48% -> 40.48%     
client [45] (testset)   loss: 2.0325 -> 2.0560  accuracy: 34.78% -> 34.78%     
client [47] (testset)   loss: 1.7855 -> 1.6903  accuracy: 16.67% -> 47.22%     
---------------------------- TRAINING EPOCH: 140 ----------------------------  
client [16] (testset)   loss: 2.0365 -> 2.0375  accuracy: 26.67% -> 26.67%     
client [11] (testset)   loss: 1.9947 -> 2.0008  accuracy: 30.36% -> 30.36%     
client [37] (testset)   loss: 1.9347 -> 1.9581  accuracy: 40.48% -> 40.48%     
client [41] (testset)   loss: 2.0172 -> 2.0147  accuracy: 26.92% -> 26.92%     
client [95] (testset)   loss: 2.0054 -> 2.0123  accuracy: 34.25% -> 34.25%     
client [53] (testset)   loss: 2.1013 -> 2.0995  accuracy: 38.71% -> 38.71%     
client [22] (testset)   loss: 1.8429 -> 1.8598  accuracy: 46.00% -> 46.00%     
client [25] (testset)   loss: 2.4481 -> 2.4687  accuracy: 12.00% -> 12.00%     
client [69] (testset)   loss: 2.0219 -> 2.0262  accuracy: 29.41% -> 29.41%     
client [46] (testset)   loss: 1.8399 -> 1.8489  accuracy: 48.94% -> 48.94%     
---------------------------- TRAINING EPOCH: 150 ----------------------------  
client [47] (testset)   loss: 1.7067 -> 1.7380  accuracy: 47.22% -> 16.67%     
client [69] (testset)   loss: 2.0202 -> 2.0186  accuracy: 29.41% -> 29.41%     
client [82] (testset)   loss: 1.9556 -> 1.8913  accuracy: 11.94% -> 40.30%     
client [45] (testset)   loss: 2.0508 -> 2.0562  accuracy: 34.78% -> 34.78%     
client [7]  (testset)   loss: 1.9356 -> 1.9388  accuracy: 32.79% -> 32.79%     
client [50] (testset)   loss: 2.1487 -> 2.0813  accuracy: 29.87% -> 29.87%     
client [35] (testset)   loss: 2.0099 -> 2.0012  accuracy: 33.33% -> 33.33%     
client [24] (testset)   loss: 2.1947 -> 2.2023  accuracy: 36.00% -> 36.00%     
client [15] (testset)   loss: 1.4996 -> 1.4925  accuracy: 61.04% -> 61.04%     
client [58] (testset)   loss: 1.6743 -> 1.6735  accuracy: 42.47% -> 42.47%     
---------------------------- TRAINING EPOCH: 160 ----------------------------  
client [48] (testset)   loss: 2.2846 -> 2.2932  accuracy: 17.39% -> 17.39%     
client [76] (testset)   loss: 1.8848 -> 1.9020  accuracy: 27.78% -> 27.78%     
client [67] (testset)   loss: 2.0892 -> 2.0641  accuracy: 17.54% -> 17.54%     
client [37] (testset)   loss: 1.9445 -> 1.9391  accuracy: 40.48% -> 40.48%     
client [58] (testset)   loss: 1.6783 -> 1.6762  accuracy: 42.47% -> 42.47%     
client [64] (testset)   loss: 2.1834 -> 2.1834  accuracy: 20.00% -> 20.00%     
client [77] (testset)   loss: 1.9836 -> 1.9748  accuracy: 30.00% -> 30.00%     
client [55] (testset)   loss: 1.9030 -> 1.9019  accuracy: 42.62% -> 42.62%     
client [12] (testset)   loss: 1.8746 -> 1.8878  accuracy: 23.73% -> 23.73%     
client [89] (testset)   loss: 1.8732 -> 1.8686  accuracy: 46.88% -> 46.88%     
---------------------------- TRAINING EPOCH: 170 ----------------------------  
client [84] (testset)   loss: 1.6367 -> 1.6330  accuracy: 38.53% -> 38.53%     
client [51] (testset)   loss: 1.8295 -> 1.8005  accuracy: 47.42% -> 47.42%     
client [8]  (testset)   loss: 1.8826 -> 1.8735  accuracy: 34.17% -> 34.17%     
client [18] (testset)   loss: 2.3347 -> 2.3519  accuracy: 6.98% -> 20.93%      
client [94] (testset)   loss: 1.7914 -> 1.7747  accuracy: 31.71% -> 31.71%     
client [81] (testset)   loss: 2.0079 -> 2.0100  accuracy: 35.14% -> 35.14%     
client [3]  (testset)   loss: 2.3919 -> 2.3903  accuracy: 9.26% -> 9.26%       
client [11] (testset)   loss: 1.9890 -> 1.9899  accuracy: 30.36% -> 30.36%     
client [95] (testset)   loss: 2.0012 -> 2.0154  accuracy: 34.25% -> 34.25%     
client [67] (testset)   loss: 2.0641 -> 2.0757  accuracy: 17.54% -> 19.30%     
---------------------------- TRAINING EPOCH: 180 ----------------------------  
client [21] (testset)   loss: 1.9590 -> 1.9566  accuracy: 26.32% -> 26.32%     
client [79] (testset)   loss: 2.2766 -> 2.2871  accuracy: 21.15% -> 21.15%     
client [58] (testset)   loss: 1.6769 -> 1.6761  accuracy: 42.47% -> 42.47%     
client [88] (testset)   loss: 2.1786 -> 2.1894  accuracy: 22.81% -> 22.81%     
client [46] (testset)   loss: 1.8412 -> 1.8441  accuracy: 48.94% -> 48.94%     
client [11] (testset)   loss: 1.9899 -> 1.9955  accuracy: 30.36% -> 30.36%     
client [55] (testset)   loss: 1.9035 -> 1.9062  accuracy: 42.62% -> 42.62%     
client [13] (testset)   loss: 2.4464 -> 2.4938  accuracy: 22.22% -> 22.22%     
client [31] (testset)   loss: 1.8572 -> 1.8692  accuracy: 44.44% -> 44.44%     
client [75] (testset)   loss: 2.1775 -> 2.1650  accuracy: 24.07% -> 22.22%     
---------------------------- TRAINING EPOCH: 190 ----------------------------  
client [19] (testset)   loss: 2.1846 -> 2.1943  accuracy: 23.21% -> 23.21%     
client [7]  (testset)   loss: 1.9296 -> 1.9295  accuracy: 32.79% -> 32.79%     
client [57] (testset)   loss: 2.0804 -> 2.1039  accuracy: 34.78% -> 34.78%     
client [13] (testset)   loss: 2.4798 -> 2.4719  accuracy: 22.22% -> 22.22%     
client [43] (testset)   loss: 1.4895 -> 1.4925  accuracy: 57.89% -> 57.89%     
client [91] (testset)   loss: 1.9983 -> 2.0637  accuracy: 37.93% -> 13.79%     
client [10] (testset)   loss: 2.0965 -> 2.1006  accuracy: 38.89% -> 38.89%     
client [64] (testset)   loss: 2.1851 -> 2.1910  accuracy: 20.00% -> 20.00%     
client [82] (testset)   loss: 1.8886 -> 1.9047  accuracy: 40.30% -> 11.94%     
client [22] (testset)   loss: 1.8601 -> 1.8553  accuracy: 46.00% -> 46.00%     
---------------------------- TRAINING EPOCH: 200 ----------------------------  
client [20] (testset)   loss: 2.1969 -> 2.1907  accuracy: 18.03% -> 18.03%     
client [23] (testset)   loss: 2.1650 -> 2.1545  accuracy: 20.59% -> 20.59%     
client [88] (testset)   loss: 2.1894 -> 2.1540  accuracy: 22.81% -> 15.79%     
client [98] (testset)   loss: 2.0555 -> 2.0559  accuracy: 37.74% -> 37.74%     
client [79] (testset)   loss: 2.2860 -> 2.2800  accuracy: 21.15% -> 21.15%     
client [21] (testset)   loss: 1.9781 -> 1.9526  accuracy: 26.32% -> 26.32%     
client [92] (testset)   loss: 2.1119 -> 2.1006  accuracy: 26.47% -> 26.47%     
client [56] (testset)   loss: 2.1112 -> 2.1559  accuracy: 7.27% -> 7.27%       
client [5]  (testset)   loss: 2.2231 -> 2.2527  accuracy: 26.09% -> 26.09%     
client [52] (testset)   loss: 1.2657 -> 1.2650  accuracy: 57.14% -> 57.14%     
---------------------------- TRAINING EPOCH: 210 ----------------------------  
client [67] (testset)   loss: 2.0693 -> 2.0746  accuracy: 19.30% -> 19.30%     
client [54] (testset)   loss: 2.6478 -> 2.7668  accuracy: 18.75% -> 18.75%     
client [14] (testset)   loss: 2.0432 -> 2.0535  accuracy: 31.88% -> 31.88%     
client [99] (testset)   loss: 2.0847 -> 2.0668  accuracy: 10.26% -> 12.82%     
client [36] (testset)   loss: 2.0436 -> 2.0532  accuracy: 24.49% -> 24.49%     
client [30] (testset)   loss: 2.3572 -> 2.3604  accuracy: 15.15% -> 15.15%     
client [38] (testset)   loss: 2.1905 -> 2.1949  accuracy: 18.92% -> 18.92%     
client [15] (testset)   loss: 1.4894 -> 1.5183  accuracy: 61.04% -> 61.04%     
client [6]  (testset)   loss: 2.0238 -> 2.0364  accuracy: 21.54% -> 21.54%     
client [53] (testset)   loss: 2.0907 -> 2.0833  accuracy: 38.71% -> 38.71%     
---------------------------- TRAINING EPOCH: 220 ----------------------------  
client [99] (testset)   loss: 2.0625 -> 2.0797  accuracy: 20.51% -> 10.26%     
client [6]  (testset)   loss: 2.0364 -> 2.0254  accuracy: 21.54% -> 21.54%     
client [83] (testset)   loss: 2.1398 -> 2.1327  accuracy: 19.57% -> 19.57%     
client [42] (testset)   loss: 2.2865 -> 2.3034  accuracy: 17.86% -> 7.14%      
client [34] (testset)   loss: 1.9107 -> 1.9048  accuracy: 24.59% -> 24.59%     
client [15] (testset)   loss: 1.5183 -> 1.5115  accuracy: 61.04% -> 61.04%     
client [47] (testset)   loss: 1.7091 -> 1.7096  accuracy: 47.22% -> 47.22%     
client [55] (testset)   loss: 1.9032 -> 1.9035  accuracy: 42.62% -> 42.62%     
client [51] (testset)   loss: 1.8355 -> 1.8046  accuracy: 47.42% -> 47.42%     
client [95] (testset)   loss: 2.0033 -> 2.0015  accuracy: 34.25% -> 34.25%     
---------------------------- TRAINING EPOCH: 230 ----------------------------  
client [71] (testset)   loss: 2.0270 -> 2.0045  accuracy: 23.33% -> 23.33%     
client [15] (testset)   loss: 1.5115 -> 1.4835  accuracy: 61.04% -> 61.04%     
client [33] (testset)   loss: 1.7479 -> 1.8141  accuracy: 44.44% -> 22.22%     
client [99] (testset)   loss: 2.0684 -> 2.0810  accuracy: 20.51% -> 10.26%     
client [90] (testset)   loss: 1.9792 -> 1.9733  accuracy: 25.00% -> 25.00%     
client [57] (testset)   loss: 2.0861 -> 2.0829  accuracy: 34.78% -> 34.78%     
client [27] (testset)   loss: 1.9759 -> 1.9934  accuracy: 38.75% -> 38.75%     
client [78] (testset)   loss: 1.9193 -> 1.9259  accuracy: 22.73% -> 22.73%     
client [36] (testset)   loss: 2.0583 -> 2.0530  accuracy: 24.49% -> 24.49%     
client [88] (testset)   loss: 2.2035 -> 2.1941  accuracy: 22.81% -> 15.79%     
---------------------------- TRAINING EPOCH: 240 ----------------------------  
client [70] (testset)   loss: 2.2370 -> 2.2250  accuracy: 25.00% -> 25.00%     
client [35] (testset)   loss: 2.0438 -> 2.0236  accuracy: 33.33% -> 33.33%     
client [16] (testset)   loss: 2.0261 -> 2.0245  accuracy: 26.67% -> 26.67%     
client [80] (testset)   loss: 2.1647 -> 2.1802  accuracy: 38.18% -> 38.18%     
client [38] (testset)   loss: 2.1859 -> 2.1947  accuracy: 18.92% -> 18.92%     
client [78] (testset)   loss: 1.9104 -> 1.9205  accuracy: 22.73% -> 22.73%     
client [68] (testset)   loss: 1.7443 -> 1.7573  accuracy: 37.78% -> 37.78%     
client [11] (testset)   loss: 2.0112 -> 2.0060  accuracy: 30.36% -> 30.36%     
client [64] (testset)   loss: 2.1894 -> 2.1913  accuracy: 20.00% -> 20.00%     
client [82] (testset)   loss: 1.9059 -> 1.8888  accuracy: 40.30% -> 40.30%     
---------------------------- TRAINING EPOCH: 250 ----------------------------  
client [30] (testset)   loss: 2.3457 -> 2.3481  accuracy: 15.15% -> 15.15%     
client [27] (testset)   loss: 1.9934 -> 1.9859  accuracy: 38.75% -> 38.75%     
client [74] (testset)   loss: 1.9980 -> 2.0075  accuracy: 19.30% -> 19.30%     
client [45] (testset)   loss: 2.0362 -> 2.0460  accuracy: 34.78% -> 34.78%     
client [6]  (testset)   loss: 2.0480 -> 2.0501  accuracy: 21.54% -> 21.54%     
client [36] (testset)   loss: 2.0658 -> 2.0574  accuracy: 24.49% -> 24.49%     
client [63] (testset)   loss: 1.9797 -> 1.9853  accuracy: 31.67% -> 31.67%     
client [76] (testset)   loss: 1.9035 -> 1.8783  accuracy: 27.78% -> 27.78%     
client [83] (testset)   loss: 2.1439 -> 2.1312  accuracy: 19.57% -> 19.57%     
client [86] (testset)   loss: 1.6920 -> 1.6975  accuracy: 48.44% -> 48.44%     
---------------------------- TRAINING EPOCH: 260 ----------------------------  
client [83] (testset)   loss: 2.1312 -> 2.1300  accuracy: 19.57% -> 19.57%     
client [99] (testset)   loss: 2.0730 -> 2.0720  accuracy: 20.51% -> 20.51%     
client [74] (testset)   loss: 1.9961 -> 1.9974  accuracy: 28.07% -> 19.30%     
client [73] (testset)   loss: 2.3407 -> 2.3364  accuracy: 12.28% -> 21.05%     
client [29] (testset)   loss: 1.8126 -> 1.7616  accuracy: 37.66% -> 37.66%     
client [92] (testset)   loss: 2.1030 -> 2.1122  accuracy: 26.47% -> 26.47%     
client [6]  (testset)   loss: 2.0170 -> 2.0182  accuracy: 21.54% -> 21.54%     
client [61] (testset)   loss: 2.2181 -> 2.2623  accuracy: 26.67% -> 26.67%     
client [21] (testset)   loss: 1.9628 -> 1.9605  accuracy: 26.32% -> 26.32%     
client [67] (testset)   loss: 2.0860 -> 2.0789  accuracy: 19.30% -> 17.54%     
---------------------------- TRAINING EPOCH: 270 ----------------------------  
client [83] (testset)   loss: 2.1300 -> 2.1205  accuracy: 19.57% -> 19.57%     
client [32] (testset)   loss: 2.0271 -> 1.9952  accuracy: 30.43% -> 30.43%     
client [95] (testset)   loss: 2.0037 -> 2.0055  accuracy: 34.25% -> 34.25%     
client [61] (testset)   loss: 2.2080 -> 2.2114  accuracy: 26.67% -> 26.67%     
client [27] (testset)   loss: 1.9859 -> 2.0136  accuracy: 38.75% -> 38.75%     
client [25] (testset)   loss: 2.4742 -> 2.4610  accuracy: 12.00% -> 12.00%     
client [68] (testset)   loss: 1.7690 -> 1.7510  accuracy: 37.78% -> 37.78%     
client [34] (testset)   loss: 1.9140 -> 1.9092  accuracy: 24.59% -> 24.59%     
client [71] (testset)   loss: 2.0157 -> 2.0310  accuracy: 23.33% -> 23.33%     
client [89] (testset)   loss: 1.8870 -> 1.9488  accuracy: 46.88% -> 46.88%     
---------------------------- TRAINING EPOCH: 280 ----------------------------  
client [78] (testset)   loss: 1.9132 -> 1.9200  accuracy: 22.73% -> 22.73%     
client [81] (testset)   loss: 2.0112 -> 2.0162  accuracy: 35.14% -> 35.14%     
client [51] (testset)   loss: 1.7790 -> 1.7948  accuracy: 47.42% -> 47.42%     
client [54] (testset)   loss: 2.4815 -> 2.3454  accuracy: 18.75% -> 18.75%     
client [65] (testset)   loss: 2.0171 -> 1.9992  accuracy: 37.74% -> 37.74%     
client [41] (testset)   loss: 2.0156 -> 2.0164  accuracy: 26.92% -> 26.92%     
client [11] (testset)   loss: 1.9947 -> 1.9970  accuracy: 30.36% -> 30.36%     
client [85] (testset)   loss: 2.0471 -> 2.0496  accuracy: 29.33% -> 29.33%     
client [12] (testset)   loss: 1.8752 -> 1.9020  accuracy: 23.73% -> 23.73%     
client [23] (testset)   loss: 2.1982 -> 2.1934  accuracy: 20.59% -> 20.59%     
---------------------------- TRAINING EPOCH: 290 ----------------------------  
client [16] (testset)   loss: 2.0308 -> 2.0324  accuracy: 26.67% -> 26.67%     
client [65] (testset)   loss: 2.0070 -> 2.0002  accuracy: 37.74% -> 37.74%     
client [53] (testset)   loss: 2.0990 -> 2.0947  accuracy: 38.71% -> 38.71%     
client [58] (testset)   loss: 1.6771 -> 1.6821  accuracy: 42.47% -> 42.47%     
client [72] (testset)   loss: 1.8138 -> 1.7789  accuracy: 53.70% -> 53.70%     
client [7]  (testset)   loss: 1.9317 -> 1.9328  accuracy: 32.79% -> 32.79%     
client [71] (testset)   loss: 2.0310 -> 2.0259  accuracy: 23.33% -> 23.33%     
client [59] (testset)   loss: 2.1013 -> 2.1047  accuracy: 24.14% -> 24.14%     
client [86] (testset)   loss: 1.6931 -> 1.6945  accuracy: 48.44% -> 48.44%     
client [39] (testset)   loss: 1.4088 -> 1.4108  accuracy: 53.77% -> 53.77%     
---------------------------- TRAINING EPOCH: 300 ----------------------------  
client [99] (testset)   loss: 2.0732 -> 2.0751  accuracy: 10.26% -> 7.69%      
client [7]  (testset)   loss: 1.9277 -> 1.9311  accuracy: 32.79% -> 32.79%     
client [17] (testset)   loss: 2.0209 -> 2.0060  accuracy: 32.00% -> 32.00%     
client [64] (testset)   loss: 2.1891 -> 2.1876  accuracy: 20.00% -> 20.00%     
client [37] (testset)   loss: 1.9431 -> 1.9534  accuracy: 40.48% -> 40.48%     
client [29] (testset)   loss: 1.7709 -> 1.7781  accuracy: 37.66% -> 37.66%     
client [93] (testset)   loss: 1.7066 -> 1.7048  accuracy: 45.65% -> 45.65%     
client [73] (testset)   loss: 2.3393 -> 2.3360  accuracy: 12.28% -> 12.28%     
client [40] (testset)   loss: 2.1632 -> 2.1488  accuracy: 21.74% -> 21.74%     
client [76] (testset)   loss: 1.8831 -> 1.8804  accuracy: 27.78% -> 27.78%     
---------------------------- TRAINING EPOCH: 310 ----------------------------  
client [31] (testset)   loss: 1.8710 -> 1.8626  accuracy: 44.44% -> 44.44%     
client [89] (testset)   loss: 1.8604 -> 1.8491  accuracy: 46.88% -> 46.88%     
client [77] (testset)   loss: 1.9813 -> 1.9779  accuracy: 30.00% -> 30.00%     
client [90] (testset)   loss: 1.9835 -> 1.9762  accuracy: 25.00% -> 25.00%     
client [26] (testset)   loss: 2.1777 -> 2.1803  accuracy: 22.81% -> 22.81%     
client [50] (testset)   loss: 2.1192 -> 2.0935  accuracy: 29.87% -> 29.87%     
client [30] (testset)   loss: 2.3452 -> 2.3518  accuracy: 15.15% -> 15.15%     
client [70] (testset)   loss: 2.2249 -> 2.2182  accuracy: 25.00% -> 25.00%     
client [41] (testset)   loss: 2.0184 -> 2.0198  accuracy: 26.92% -> 26.92%     
client [99] (testset)   loss: 2.0751 -> 2.0610  accuracy: 7.69% -> 20.51%      
---------------------------- TRAINING EPOCH: 320 ----------------------------  
client [68] (testset)   loss: 1.7663 -> 1.7597  accuracy: 37.78% -> 37.78%     
client [70] (testset)   loss: 2.3112 -> 2.2650  accuracy: 25.00% -> 25.00%     
client [52] (testset)   loss: 1.2857 -> 1.3388  accuracy: 57.14% -> 57.14%     
client [1]  (testset)   loss: 2.4146 -> 2.3974  accuracy: 4.17% -> 12.50%      
client [2]  (testset)   loss: 1.7894 -> 1.7762  accuracy: 49.40% -> 49.40%     
client [67] (testset)   loss: 2.0943 -> 2.0856  accuracy: 19.30% -> 19.30%     
client [92] (testset)   loss: 2.1035 -> 2.1080  accuracy: 26.47% -> 26.47%     
client [35] (testset)   loss: 2.0145 -> 2.0155  accuracy: 33.33% -> 33.33%     
client [36] (testset)   loss: 2.0559 -> 2.0575  accuracy: 24.49% -> 24.49%     
client [64] (testset)   loss: 2.1877 -> 2.1868  accuracy: 20.00% -> 20.00%     
---------------------------- TRAINING EPOCH: 330 ----------------------------  
client [44] (testset)   loss: 2.1274 -> 2.1196  accuracy: 23.21% -> 23.21%     
client [6]  (testset)   loss: 2.0283 -> 2.0046  accuracy: 21.54% -> 21.54%     
client [12] (testset)   loss: 1.8805 -> 1.8813  accuracy: 22.03% -> 22.03%     
client [55] (testset)   loss: 1.9032 -> 1.9044  accuracy: 42.62% -> 42.62%     
client [29] (testset)   loss: 1.7710 -> 1.8016  accuracy: 37.66% -> 37.66%     
client [9]  (testset)   loss: 2.3376 -> 2.3684  accuracy: 13.33% -> 13.33%     
client [43] (testset)   loss: 1.4972 -> 1.4950  accuracy: 57.89% -> 57.89%     
client [77] (testset)   loss: 1.9779 -> 1.9799  accuracy: 30.00% -> 30.00%     
client [98] (testset)   loss: 2.0569 -> 2.0562  accuracy: 37.74% -> 37.74%     
client [78] (testset)   loss: 1.9288 -> 1.9249  accuracy: 22.73% -> 22.73%     
---------------------------- TRAINING EPOCH: 340 ----------------------------  
client [92] (testset)   loss: 2.1119 -> 2.1035  accuracy: 26.47% -> 26.47%     
client [80] (testset)   loss: 2.1509 -> 2.1587  accuracy: 38.18% -> 38.18%     
client [63] (testset)   loss: 1.9904 -> 1.9752  accuracy: 31.67% -> 31.67%     
client [76] (testset)   loss: 1.8844 -> 1.8906  accuracy: 27.78% -> 27.78%     
client [78] (testset)   loss: 1.9249 -> 1.9154  accuracy: 22.73% -> 22.73%     
client [25] (testset)   loss: 2.4624 -> 2.4624  accuracy: 12.00% -> 12.00%     
client [58] (testset)   loss: 1.6781 -> 1.6762  accuracy: 42.47% -> 42.47%     
client [13] (testset)   loss: 2.5048 -> 2.5191  accuracy: 22.22% -> 22.22%     
client [17] (testset)   loss: 2.0139 -> 2.0390  accuracy: 32.00% -> 32.00%     
client [38] (testset)   loss: 2.1847 -> 2.1888  accuracy: 18.92% -> 18.92%     
---------------------------- TRAINING EPOCH: 350 ----------------------------  
client [72] (testset)   loss: 1.7812 -> 1.7902  accuracy: 53.70% -> 53.70%     
client [82] (testset)   loss: 1.9613 -> 1.9299  accuracy: 11.94% -> 11.94%     
client [86] (testset)   loss: 1.6976 -> 1.6915  accuracy: 48.44% -> 48.44%     
client [51] (testset)   loss: 1.8064 -> 1.7903  accuracy: 47.42% -> 47.42%     
client [96] (testset)   loss: 2.0904 -> 2.0823  accuracy: 30.36% -> 30.36%     
client [42] (testset)   loss: 2.2728 -> 2.2808  accuracy: 7.14% -> 7.14%       
client [55] (testset)   loss: 1.9064 -> 1.9048  accuracy: 42.62% -> 42.62%     
client [13] (testset)   loss: 2.5329 -> 2.5001  accuracy: 22.22% -> 22.22%     
client [1]  (testset)   loss: 2.4059 -> 2.4247  accuracy: 12.50% -> 4.17%      
client [12] (testset)   loss: 1.8813 -> 1.8977  accuracy: 22.03% -> 23.73%     
---------------------------- TRAINING EPOCH: 360 ----------------------------  
client [68] (testset)   loss: 1.7799 -> 1.7868  accuracy: 37.78% -> 37.78%     
client [23] (testset)   loss: 2.1723 -> 2.1613  accuracy: 20.59% -> 20.59%     
client [46] (testset)   loss: 1.8775 -> 1.8577  accuracy: 48.94% -> 48.94%     
client [41] (testset)   loss: 2.0215 -> 2.0180  accuracy: 26.92% -> 26.92%     
client [25] (testset)   loss: 2.4812 -> 2.4661  accuracy: 12.00% -> 12.00%     
client [58] (testset)   loss: 1.6820 -> 1.6860  accuracy: 42.47% -> 42.47%     
client [14] (testset)   loss: 2.0554 -> 2.0498  accuracy: 31.88% -> 31.88%     
client [33] (testset)   loss: 1.8319 -> 1.7621  accuracy: 22.22% -> 44.44%     
client [85] (testset)   loss: 2.0857 -> 2.0399  accuracy: 29.33% -> 29.33%     
client [62] (testset)   loss: 1.9106 -> 1.9114  accuracy: 41.38% -> 41.38%     
---------------------------- TRAINING EPOCH: 370 ----------------------------  
client [98] (testset)   loss: 2.0564 -> 2.0564  accuracy: 37.74% -> 37.74%     
client [63] (testset)   loss: 1.9743 -> 1.9849  accuracy: 31.67% -> 31.67%     
client [70] (testset)   loss: 2.2107 -> 2.2330  accuracy: 25.00% -> 25.00%     
client [65] (testset)   loss: 2.0078 -> 2.0129  accuracy: 37.74% -> 37.74%     
client [14] (testset)   loss: 2.0442 -> 2.0539  accuracy: 31.88% -> 31.88%     
client [73] (testset)   loss: 2.3388 -> 2.3380  accuracy: 12.28% -> 21.05%     
client [34] (testset)   loss: 1.9111 -> 1.9039  accuracy: 24.59% -> 24.59%     
client [99] (testset)   loss: 2.0761 -> 2.0687  accuracy: 10.26% -> 20.51%     
client [69] (testset)   loss: 2.0162 -> 2.0193  accuracy: 29.41% -> 29.41%     
client [46] (testset)   loss: 1.8577 -> 1.8545  accuracy: 48.94% -> 48.94%     
---------------------------- TRAINING EPOCH: 380 ----------------------------  
client [99] (testset)   loss: 2.0745 -> 2.0723  accuracy: 10.26% -> 10.26%     
client [93] (testset)   loss: 1.7289 -> 1.7134  accuracy: 45.65% -> 45.65%     
client [11] (testset)   loss: 1.9985 -> 2.0070  accuracy: 30.36% -> 30.36%     
client [58] (testset)   loss: 1.6775 -> 1.6759  accuracy: 42.47% -> 42.47%     
client [81] (testset)   loss: 2.0201 -> 2.0139  accuracy: 35.14% -> 35.14%     
client [85] (testset)   loss: 2.0399 -> 2.0888  accuracy: 29.33% -> 29.33%     
client [89] (testset)   loss: 1.8589 -> 1.8837  accuracy: 46.88% -> 46.88%     
client [45] (testset)   loss: 2.0384 -> 2.0519  accuracy: 34.78% -> 34.78%     
client [8]  (testset)   loss: 1.8746 -> 1.8810  accuracy: 34.17% -> 34.17%     
client [68] (testset)   loss: 1.7239 -> 1.7402  accuracy: 37.78% -> 37.78%     
---------------------------- TRAINING EPOCH: 390 ----------------------------  
client [67] (testset)   loss: 2.0725 -> 2.0819  accuracy: 17.54% -> 19.30%     
client [72] (testset)   loss: 1.7731 -> 1.7958  accuracy: 53.70% -> 53.70%     
client [1]  (testset)   loss: 2.4485 -> 2.4292  accuracy: 4.17% -> 4.17%       
client [78] (testset)   loss: 1.9340 -> 1.9152  accuracy: 22.73% -> 22.73%     
client [83] (testset)   loss: 2.1469 -> 2.1267  accuracy: 19.57% -> 19.57%     
client [21] (testset)   loss: 1.9453 -> 1.9616  accuracy: 26.32% -> 26.32%     
client [56] (testset)   loss: 2.1335 -> 2.0987  accuracy: 7.27% -> 7.27%       
client [44] (testset)   loss: 2.1471 -> 2.1402  accuracy: 23.21% -> 23.21%     
client [92] (testset)   loss: 2.1084 -> 2.0989  accuracy: 26.47% -> 26.47%     
client [27] (testset)   loss: 2.0024 -> 2.0251  accuracy: 38.75% -> 38.75%     
---------------------------- TRAINING EPOCH: 400 ----------------------------  
client [10] (testset)   loss: 2.0962 -> 2.0915  accuracy: 38.89% -> 38.89%     
client [39] (testset)   loss: 1.4521 -> 1.4384  accuracy: 53.77% -> 53.77%     
client [65] (testset)   loss: 2.0287 -> 2.0074  accuracy: 37.74% -> 37.74%     
client [26] (testset)   loss: 2.1828 -> 2.1742  accuracy: 19.30% -> 22.81%     
client [19] (testset)   loss: 2.2239 -> 2.2255  accuracy: 23.21% -> 23.21%     
client [68] (testset)   loss: 1.7458 -> 1.7962  accuracy: 37.78% -> 37.78%     
client [41] (testset)   loss: 2.0176 -> 2.0171  accuracy: 26.92% -> 26.92%     
client [50] (testset)   loss: 2.1478 -> 2.0992  accuracy: 29.87% -> 29.87%     
client [75] (testset)   loss: 2.1674 -> 2.1367  accuracy: 24.07% -> 22.22%     
client [81] (testset)   loss: 2.0119 -> 2.0075  accuracy: 35.14% -> 35.14%     
Training... ---------------------------------------- 100% 0:07:02
Local-only's average time taken by each global epoch: 0 min 1.05 sec.          
Local-only's total running time: 0 h 7 m 2 s.                                  
==================== Local-only Experiment Results: ====================       
Display format: (before local fine-tuning) -> (after local fine-tuning)        
 So if finetune_epoch = 0, x.xx% -> 0.00% is normal.                           
 Centralized testing ONLY happens after model aggregation, so the stats between
'->' are the same.                                                             
{                                                                              
    "100": {                                                                   
        "all_clients": {                                                       
            "test": {                                                          
                "loss": "1.9861 -> 0.0000",                                    
                "accuracy": "30.64% -> 0.00%"                                  
            }                                                                  
        }                                                                      
    },                                                                         
    "200": {                                                                   
        "all_clients": {                                                       
            "test": {                                                          
                "loss": "1.9876 -> 0.0000",                                    
                "accuracy": "30.87% -> 0.00%"                                  
            }                                                                  
        }                                                                      
    },                                                                         
    "300": {                                                                   
        "all_clients": {                                                       
            "test": {                                                          
                "loss": "1.9868 -> 0.0000",                                    
                "accuracy": "31.39% -> 0.00%"                                  
            }                                                                  
        }                                                                      
    },                                                                         
    "400": {                                                                   
        "all_clients": {                                                       
            "test": {                                                          
                "loss": "1.9862 -> 0.0000",                                    
                "accuracy": "31.21% -> 0.00%"                                  
            }                                                                  
        }                                                                      
    }                                                                          
}                                                                              
==================== Local-only Max Accuracy ====================              
all_clients:                                                                   
(test) before fine-tuning: 31.39% at epoch 300                                 
(test) after fine-tuning: 0.00% at epoch 100                                   
[0m