==================== pFedFDA ====================                              
Experiment Arguments:                                                          
{
│   'method': 'pfedfda',
│   'dataset': {
│   │   'name': 'svhn',
│   │   'client_num': 100,
│   │   'test_ratio': 0.25,
│   │   'val_ratio': 0.0,
│   │   'seed': 42,
│   │   'split': 'sample',
│   │   'IID_ratio': 0.0,
│   │   'monitor_window_name_suffix': 'svhn-100clients-0%IID-Dir(1.0)-seed42',
│   │   'alpha': 1.0,
│   │   'min_samples_per_client': 10
│   },
│   'model': {
│   │   'name': 'avgcnn',
│   │   'use_torchvision_pretrained_weights': True,
│   │   'external_model_weights_path': None
│   },
│   'optimizer': {
│   │   'lr': 0.01,
│   │   'dampening': 0,
│   │   'weight_decay': 0,
│   │   'momentum': 0,
│   │   'nesterov': False,
│   │   'name': 'sgd'
│   },
│   'mode': 'serial',
│   'parallel': {
│   │   'ray_cluster_addr': None,
│   │   'num_cpus': None,
│   │   'num_gpus': None,
│   │   'num_workers': 2
│   },
│   'common': {
│   │   'seed': 42,
│   │   'join_ratio': 0.1,
│   │   'global_epoch': 400,
│   │   'local_epoch': 5,
│   │   'batch_size': 32,
│   │   'reset_optimizer_on_global_epoch': True,
│   │   'straggler_ratio': 0,
│   │   'straggler_min_local_epoch': 0,
│   │   'buffers': 'global',
│   │   'client_side_evaluation': True,
│   │   'test': {
│   │   │   'client': {
│   │   │   │   'interval': 100,
│   │   │   │   'finetune_epoch': 0,
│   │   │   │   'train': False,
│   │   │   │   'val': False,
│   │   │   │   'test': True
│   │   │   },
│   │   │   'server': {
│   │   │   │   'interval': -1,
│   │   │   │   'train': False,
│   │   │   │   'val': False,
│   │   │   │   'test': False,
│   │   │   │   'model_in_train_mode': False
│   │   │   }
│   │   },
│   │   'verbose_gap': 10,
│   │   'monitor': None,
│   │   'use_cuda': True,
│   │   'save_log': True,
│   │   'save_model': False,
│   │   'save_learning_curve_plot': False,
│   │   'save_metrics': True,
│   │   'delete_useless_run': True
│   },
│   'pfedfda': {
│   │   'eps': 0.0001,
│   │   'single_beta': False,
│   │   'local_beta': False,
│   │   'num_cv_folds': 2
│   }
}
---------------------------- TRAINING EPOCH: 10 ----------------------------   
client [77] (testset)   loss: 0.7613 -> 1.0825  accuracy: 77.71% -> 75.37%     
client [81] (testset)   loss: 0.8371 -> 0.7957  accuracy: 76.65% -> 74.62%     
client [21] (testset)   loss: 0.6283 -> 0.6018  accuracy: 83.44% -> 81.79%     
client [68] (testset)   loss: 0.8452 -> 0.8796  accuracy: 80.65% -> 75.00%     
client [93] (testset)   loss: 0.5779 -> 0.5991  accuracy: 86.99% -> 82.95%     
client [31] (testset)   loss: 0.8685 -> 0.4734  accuracy: 74.00% -> 84.67%     
client [20] (testset)   loss: 0.9676 -> 1.0694  accuracy: 72.53% -> 72.53%     
client [59] (testset)   loss: 0.8628 -> 0.9131  accuracy: 76.73% -> 71.70%     
client [48] (testset)   loss: 0.8341 -> 1.4654  accuracy: 74.19% -> 62.90%     
client [34] (testset)   loss: 1.0131 -> 0.9523  accuracy: 70.56% -> 72.59%     
---------------------------- TRAINING EPOCH: 20 ----------------------------   
client [69] (testset)   loss: 0.6078 -> 0.4821  accuracy: 82.33% -> 84.91%     
client [99] (testset)   loss: 0.4772 -> 0.4551  accuracy: 88.42% -> 88.42%     
client [67] (testset)   loss: 0.3725 -> 0.4055  accuracy: 86.96% -> 84.78%     
client [0]  (testset)   loss: 0.3386 -> 0.2522  accuracy: 90.87% -> 92.17%     
client [76] (testset)   loss: 0.3856 -> 0.4437  accuracy: 91.67% -> 90.91%     
client [41] (testset)   loss: 0.4904 -> 0.6103  accuracy: 86.61% -> 82.43%     
client [62] (testset)   loss: 0.4518 -> 0.6327  accuracy: 86.97% -> 85.29%     
client [2]  (testset)   loss: 0.5274 -> 0.5171  accuracy: 86.43% -> 85.36%     
client [14] (testset)   loss: 0.4350 -> 0.5415  accuracy: 90.00% -> 85.00%     
client [46] (testset)   loss: 0.4473 -> 0.3932  accuracy: 88.55% -> 87.40%     
---------------------------- TRAINING EPOCH: 30 ----------------------------   
client [24] (testset)   loss: 0.5635 -> 0.4587  accuracy: 81.03% -> 82.76%     
client [68] (testset)   loss: 0.6409 -> 0.6619  accuracy: 84.27% -> 84.27%     
client [57] (testset)   loss: 0.6470 -> 0.5753  accuracy: 84.44% -> 85.93%     
client [17] (testset)   loss: 0.7273 -> 0.8978  accuracy: 85.11% -> 82.55%     
client [54] (testset)   loss: 0.5594 -> 0.6173  accuracy: 85.15% -> 83.50%     
client [23] (testset)   loss: 0.4974 -> 0.5831  accuracy: 88.14% -> 83.05%     
client [35] (testset)   loss: 0.6097 -> 0.7355  accuracy: 83.82% -> 81.70%     
client [59] (testset)   loss: 0.6604 -> 0.5632  accuracy: 86.16% -> 85.53%     
client [31] (testset)   loss: 0.3440 -> 0.3841  accuracy: 90.67% -> 87.33%     
client [9]  (testset)   loss: 0.3261 -> 0.2204  accuracy: 90.36% -> 93.57%     
---------------------------- TRAINING EPOCH: 40 ----------------------------   
client [64] (testset)   loss: 0.3630 -> 0.3044  accuracy: 90.54% -> 91.89%     
client [33] (testset)   loss: 0.5781 -> 0.5353  accuracy: 87.23% -> 91.03%     
client [16] (testset)   loss: 0.5113 -> 0.4061  accuracy: 86.93% -> 87.94%     
client [44] (testset)   loss: 0.5046 -> 0.4455  accuracy: 89.13% -> 87.50%     
client [8]  (testset)   loss: 0.4910 -> 0.4801  accuracy: 88.71% -> 88.17%     
client [31] (testset)   loss: 0.4615 -> 0.3187  accuracy: 86.00% -> 88.67%     
client [47] (testset)   loss: 0.4429 -> 0.4321  accuracy: 90.42% -> 91.19%     
client [36] (testset)   loss: 0.4303 -> 0.3542  accuracy: 89.08% -> 90.80%     
client [20] (testset)   loss: 0.7902 -> 0.9266  accuracy: 81.32% -> 79.12%     
client [56] (testset)   loss: 0.5293 -> 0.4662  accuracy: 88.01% -> 88.89%     
---------------------------- TRAINING EPOCH: 50 ----------------------------   
client [4]  (testset)   loss: 0.4592 -> 0.3063  accuracy: 89.29% -> 89.29%     
client [60] (testset)   loss: 0.6097 -> 0.5654  accuracy: 84.80% -> 86.27%     
client [28] (testset)   loss: 0.4848 -> 0.4348  accuracy: 84.96% -> 86.59%     
client [25] (testset)   loss: 0.9771 -> 0.9117  accuracy: 80.18% -> 83.33%     
client [58] (testset)   loss: 0.5712 -> 0.6341  accuracy: 85.58% -> 83.26%     
client [44] (testset)   loss: 0.5058 -> 0.4439  accuracy: 89.40% -> 89.40%     
client [39] (testset)   loss: 0.6886 -> 0.5747  accuracy: 83.17% -> 85.58%     
client [29] (testset)   loss: 0.5647 -> 0.6303  accuracy: 83.97% -> 85.58%     
client [3]  (testset)   loss: 0.4783 -> 0.4426  accuracy: 90.03% -> 90.03%     
client [84] (testset)   loss: 0.4976 -> 0.4402  accuracy: 88.52% -> 88.52%     
---------------------------- TRAINING EPOCH: 60 ----------------------------   
client [21] (testset)   loss: 0.4486 -> 0.3908  accuracy: 88.41% -> 90.07%     
client [84] (testset)   loss: 0.4946 -> 0.3881  accuracy: 90.71% -> 91.80%     
client [10] (testset)   loss: 0.4831 -> 0.4621  accuracy: 86.67% -> 89.23%     
client [36] (testset)   loss: 0.3830 -> 0.3342  accuracy: 90.52% -> 92.53%     
client [65] (testset)   loss: 0.5099 -> 0.4533  accuracy: 87.65% -> 88.53%     
client [81] (testset)   loss: 0.5101 -> 0.5292  accuracy: 88.32% -> 88.83%     
client [79] (testset)   loss: 0.5233 -> 0.4541  accuracy: 88.32% -> 89.95%     
client [42] (testset)   loss: 0.4556 -> 0.3988  accuracy: 86.94% -> 88.85%     
client [11] (testset)   loss: 0.4473 -> 0.4198  accuracy: 89.60% -> 90.17%     
client [96] (testset)   loss: 0.4078 -> 0.4058  accuracy: 87.97% -> 87.34%     
---------------------------- TRAINING EPOCH: 70 ----------------------------   
client [8]  (testset)   loss: 0.4536 -> 0.5213  accuracy: 89.78% -> 86.56%     
client [53] (testset)   loss: 0.7553 -> 0.6801  accuracy: 88.00% -> 91.33%     
client [52] (testset)   loss: 0.5131 -> 0.6712  accuracy: 86.58% -> 83.04%     
client [42] (testset)   loss: 0.4638 -> 0.4058  accuracy: 87.58% -> 89.17%     
client [69] (testset)   loss: 0.4167 -> 0.3466  accuracy: 88.79% -> 90.52%     
client [59] (testset)   loss: 0.6671 -> 0.4902  accuracy: 88.05% -> 88.68%     
client [7]  (testset)   loss: 0.4157 -> 0.4195  accuracy: 90.12% -> 88.89%     
client [26] (testset)   loss: 0.4127 -> 0.4149  accuracy: 91.69% -> 90.73%     
client [49] (testset)   loss: 0.3131 -> 0.3540  accuracy: 91.93% -> 88.20%     
client [98] (testset)   loss: 0.3825 -> 0.3595  accuracy: 90.60% -> 91.88%     
---------------------------- TRAINING EPOCH: 80 ----------------------------   
client [98] (testset)   loss: 0.4027 -> 0.3694  accuracy: 89.74% -> 92.31%     
client [47] (testset)   loss: 0.3328 -> 0.3705  accuracy: 92.34% -> 91.95%     
client [21] (testset)   loss: 0.4202 -> 0.4177  accuracy: 90.40% -> 90.73%     
client [77] (testset)   loss: 0.4344 -> 0.4546  accuracy: 90.32% -> 88.86%     
client [95] (testset)   loss: 0.4160 -> 0.4561  accuracy: 91.62% -> 88.92%     
client [91] (testset)   loss: 0.2324 -> 0.2683  accuracy: 91.91% -> 93.06%     
client [14] (testset)   loss: 0.4908 -> 0.4510  accuracy: 90.00% -> 88.75%     
client [99] (testset)   loss: 0.4674 -> 0.4079  accuracy: 89.12% -> 92.98%     
client [20] (testset)   loss: 0.7856 -> 0.8350  accuracy: 86.81% -> 80.22%     
client [39] (testset)   loss: 0.6107 -> 0.5886  accuracy: 86.54% -> 86.06%     
---------------------------- TRAINING EPOCH: 90 ----------------------------   
client [52] (testset)   loss: 0.4656 -> 0.4835  accuracy: 88.35% -> 88.10%     
client [62] (testset)   loss: 0.3161 -> 0.2934  accuracy: 94.12% -> 93.28%     
client [71] (testset)   loss: 0.3415 -> 0.2882  accuracy: 89.66% -> 91.81%     
client [97] (testset)   loss: 0.4166 -> 0.3998  accuracy: 88.24% -> 88.77%     
client [30] (testset)   loss: 0.3879 -> 0.3419  accuracy: 92.65% -> 93.01%     
client [88] (testset)   loss: 0.6996 -> 0.6156  accuracy: 84.65% -> 88.61%     
client [60] (testset)   loss: 0.5297 -> 0.5076  accuracy: 86.27% -> 85.78%     
client [82] (testset)   loss: 0.5736 -> 0.4194  accuracy: 84.72% -> 88.89%     
client [91] (testset)   loss: 0.2448 -> 0.2700  accuracy: 93.06% -> 93.06%     
client [57] (testset)   loss: 0.5150 -> 0.4206  accuracy: 87.41% -> 89.63%     
---------------------------- TRAINING EPOCH: 100 ----------------------------  
client [31] (testset)   loss: 0.4682 -> 0.2432  accuracy: 88.67% -> 92.00%     
client [15] (testset)   loss: 0.4403 -> 0.4480  accuracy: 90.52% -> 90.05%     
client [71] (testset)   loss: 0.5152 -> 0.2562  accuracy: 86.21% -> 92.67%     
client [97] (testset)   loss: 0.5255 -> 0.3894  accuracy: 87.17% -> 88.24%     
client [53] (testset)   loss: 0.7069 -> 0.6780  accuracy: 88.00% -> 91.33%     
client [77] (testset)   loss: 0.4306 -> 0.4715  accuracy: 91.79% -> 89.15%     
client [76] (testset)   loss: 0.2788 -> 0.3581  accuracy: 95.45% -> 93.18%     
client [79] (testset)   loss: 0.4672 -> 0.4717  accuracy: 90.42% -> 90.65%     
client [28] (testset)   loss: 0.3953 -> 0.4686  accuracy: 89.02% -> 84.55%     
client [99] (testset)   loss: 0.4763 -> 0.4541  accuracy: 90.88% -> 92.63%     
---------------------------- TRAINING EPOCH: 110 ----------------------------  
client [97] (testset)   loss: 0.3824 -> 0.3911  accuracy: 87.70% -> 87.70%     
client [86] (testset)   loss: 0.5570 -> 0.5211  accuracy: 90.75% -> 88.99%     
client [34] (testset)   loss: 0.5495 -> 0.4393  accuracy: 85.79% -> 85.79%     
client [73] (testset)   loss: 0.3752 -> 0.3774  accuracy: 91.72% -> 92.33%     
client [5]  (testset)   loss: 0.5477 -> 0.7224  accuracy: 85.71% -> 84.24%     
client [96] (testset)   loss: 0.3954 -> 0.3491  accuracy: 89.87% -> 88.61%     
client [22] (testset)   loss: 0.6144 -> 0.5681  accuracy: 87.38% -> 88.92%     
client [60] (testset)   loss: 0.4779 -> 0.4090  accuracy: 86.27% -> 88.73%     
client [66] (testset)   loss: 0.3707 -> 0.3660  accuracy: 91.97% -> 91.97%     
client [83] (testset)   loss: 0.4726 -> 0.5059  accuracy: 86.41% -> 88.04%     
---------------------------- TRAINING EPOCH: 120 ----------------------------  
client [76] (testset)   loss: 0.2443 -> 0.3816  accuracy: 93.18% -> 92.42%     
client [65] (testset)   loss: 0.5465 -> 0.4150  accuracy: 87.65% -> 90.59%     
client [95] (testset)   loss: 0.4018 -> 0.3903  accuracy: 91.35% -> 91.89%     
client [17] (testset)   loss: 0.5833 -> 0.6201  accuracy: 88.51% -> 88.94%     
client [8]  (testset)   loss: 0.4535 -> 0.4655  accuracy: 90.32% -> 89.78%     
client [35] (testset)   loss: 0.5274 -> 0.5832  accuracy: 88.06% -> 88.06%     
client [98] (testset)   loss: 0.4367 -> 0.3775  accuracy: 90.17% -> 91.45%     
client [53] (testset)   loss: 0.7259 -> 0.6623  accuracy: 88.67% -> 91.33%     
client [43] (testset)   loss: 0.7401 -> 0.6477  accuracy: 89.42% -> 88.46%     
client [64] (testset)   loss: 0.2702 -> 0.2055  accuracy: 91.89% -> 93.24%     
---------------------------- TRAINING EPOCH: 130 ----------------------------  
client [21] (testset)   loss: 0.4469 -> 0.3906  accuracy: 91.39% -> 90.40%     
client [88] (testset)   loss: 0.6358 -> 0.6104  accuracy: 85.64% -> 87.62%     
client [38] (testset)   loss: 0.4012 -> 0.4164  accuracy: 91.24% -> 90.88%     
client [3]  (testset)   loss: 0.5295 -> 0.3829  accuracy: 88.32% -> 92.44%     
client [5]  (testset)   loss: 0.5696 -> 0.5459  accuracy: 86.70% -> 88.18%     
client [41] (testset)   loss: 0.4724 -> 0.4359  accuracy: 89.54% -> 92.05%     
client [7]  (testset)   loss: 0.4133 -> 0.3707  accuracy: 90.53% -> 90.53%     
client [37] (testset)   loss: 0.5932 -> 0.5448  accuracy: 88.67% -> 88.67%     
client [45] (testset)   loss: 0.4433 -> 0.5170  accuracy: 90.11% -> 89.35%     
client [47] (testset)   loss: 0.3448 -> 0.3545  accuracy: 93.10% -> 92.34%     
---------------------------- TRAINING EPOCH: 140 ----------------------------  
client [16] (testset)   loss: 0.4451 -> 0.4097  accuracy: 89.45% -> 92.21%     
client [11] (testset)   loss: 0.4731 -> 0.4029  accuracy: 90.17% -> 91.62%     
client [37] (testset)   loss: 0.5438 -> 0.5310  accuracy: 89.16% -> 89.16%     
client [41] (testset)   loss: 0.3970 -> 0.4198  accuracy: 90.79% -> 91.63%     
client [95] (testset)   loss: 0.4145 -> 0.3932  accuracy: 91.35% -> 93.24%     
client [53] (testset)   loss: 0.6973 -> 0.7122  accuracy: 90.67% -> 90.00%     
client [22] (testset)   loss: 0.6160 -> 0.5945  accuracy: 89.23% -> 89.54%     
client [25] (testset)   loss: 0.9254 -> 1.0387  accuracy: 83.78% -> 87.39%     
client [69] (testset)   loss: 0.4439 -> 0.3330  accuracy: 90.09% -> 91.81%     
client [46] (testset)   loss: 0.2232 -> 0.2000  accuracy: 93.13% -> 93.51%     
---------------------------- TRAINING EPOCH: 150 ----------------------------  
client [47] (testset)   loss: 0.3424 -> 0.3331  accuracy: 92.34% -> 93.49%     
client [69] (testset)   loss: 0.4227 -> 0.3362  accuracy: 90.52% -> 92.24%     
client [82] (testset)   loss: 0.6305 -> 0.4310  accuracy: 84.72% -> 88.89%     
client [45] (testset)   loss: 0.5027 -> 0.5944  accuracy: 90.11% -> 89.35%     
client [7]  (testset)   loss: 0.4266 -> 0.4028  accuracy: 91.77% -> 92.18%     
client [50] (testset)   loss: 0.4602 -> 0.4710  accuracy: 88.84% -> 90.50%     
client [35] (testset)   loss: 0.5364 -> 0.5809  accuracy: 87.27% -> 87.53%     
client [24] (testset)   loss: 0.3706 -> 0.3630  accuracy: 86.21% -> 89.66%     
client [15] (testset)   loss: 0.4447 -> 0.5021  accuracy: 89.57% -> 91.47%     
client [58] (testset)   loss: 0.5382 -> 0.6054  accuracy: 89.30% -> 85.58%     
---------------------------- TRAINING EPOCH: 160 ----------------------------  
client [48] (testset)   loss: 0.5153 -> 0.5267  accuracy: 86.77% -> 88.71%     
client [76] (testset)   loss: 0.2647 -> 0.3304  accuracy: 95.45% -> 92.42%     
client [67] (testset)   loss: 0.2661 -> 0.3600  accuracy: 93.48% -> 90.58%     
client [37] (testset)   loss: 0.6016 -> 0.5256  accuracy: 88.18% -> 89.16%     
client [58] (testset)   loss: 0.5411 -> 0.5576  accuracy: 87.44% -> 86.51%     
client [64] (testset)   loss: 0.3578 -> 0.2750  accuracy: 90.54% -> 93.24%     
client [77] (testset)   loss: 0.4077 -> 0.4162  accuracy: 90.62% -> 90.91%     
client [55] (testset)   loss: 0.4718 -> 0.4571  accuracy: 92.26% -> 90.97%     
client [12] (testset)   loss: 0.1634 -> 0.1772  accuracy: 94.94% -> 94.30%     
client [89] (testset)   loss: 0.4297 -> 0.3282  accuracy: 87.37% -> 90.40%     
---------------------------- TRAINING EPOCH: 170 ----------------------------  
client [84] (testset)   loss: 0.3671 -> 0.3254  accuracy: 91.26% -> 94.54%     
client [51] (testset)   loss: 0.4840 -> 0.5216  accuracy: 89.32% -> 87.86%     
client [8]  (testset)   loss: 0.4675 -> 0.5121  accuracy: 91.40% -> 91.40%     
client [18] (testset)   loss: 0.7069 -> 0.7135  accuracy: 86.93% -> 88.89%     
client [94] (testset)   loss: 0.5322 -> 0.5624  accuracy: 88.81% -> 87.00%     
client [81] (testset)   loss: 0.4485 -> 0.5032  accuracy: 90.36% -> 89.34%     
client [3]  (testset)   loss: 0.4996 -> 0.3709  accuracy: 88.32% -> 92.10%     
client [11] (testset)   loss: 0.4345 -> 0.4043  accuracy: 91.33% -> 92.49%     
client [95] (testset)   loss: 0.4756 -> 0.3987  accuracy: 90.54% -> 92.43%     
client [67] (testset)   loss: 0.2202 -> 0.3103  accuracy: 93.48% -> 92.75%     
---------------------------- TRAINING EPOCH: 180 ----------------------------  
client [21] (testset)   loss: 0.4151 -> 0.4035  accuracy: 91.39% -> 91.72%     
client [79] (testset)   loss: 0.5184 -> 0.4647  accuracy: 88.79% -> 90.19%     
client [58] (testset)   loss: 0.5308 -> 0.5248  accuracy: 89.30% -> 88.84%     
client [88] (testset)   loss: 0.6534 -> 0.6336  accuracy: 85.15% -> 88.61%     
client [46] (testset)   loss: 0.2532 -> 0.2097  accuracy: 94.27% -> 94.27%     
client [11] (testset)   loss: 0.4781 -> 0.4184  accuracy: 90.75% -> 92.20%     
client [55] (testset)   loss: 0.4771 -> 0.4570  accuracy: 90.65% -> 91.61%     
client [13] (testset)   loss: 0.2776 -> 0.3132  accuracy: 93.70% -> 93.70%     
client [31] (testset)   loss: 0.4282 -> 0.2732  accuracy: 90.00% -> 92.67%     
client [75] (testset)   loss: 0.4194 -> 0.4144  accuracy: 90.36% -> 90.00%     
---------------------------- TRAINING EPOCH: 190 ----------------------------  
client [19] (testset)   loss: 0.3160 -> 0.3660  accuracy: 92.56% -> 91.67%     
client [7]  (testset)   loss: 0.4255 -> 0.4175  accuracy: 92.59% -> 92.18%     
client [57] (testset)   loss: 0.4598 -> 0.4431  accuracy: 91.85% -> 93.33%     
client [13] (testset)   loss: 0.2940 -> 0.2980  accuracy: 93.46% -> 94.19%     
client [43] (testset)   loss: 0.9111 -> 0.8143  accuracy: 87.50% -> 89.42%     
client [91] (testset)   loss: 0.2403 -> 0.2181  accuracy: 93.06% -> 94.80%     
client [10] (testset)   loss: 0.5182 -> 0.5416  accuracy: 88.21% -> 89.23%     
client [64] (testset)   loss: 0.2745 -> 0.2186  accuracy: 91.89% -> 94.59%     
client [82] (testset)   loss: 0.5826 -> 0.4045  accuracy: 84.72% -> 88.19%     
client [22] (testset)   loss: 0.6095 -> 0.6012  accuracy: 89.23% -> 89.54%     
---------------------------- TRAINING EPOCH: 200 ----------------------------  
client [20] (testset)   loss: 0.8345 -> 0.7714  accuracy: 86.81% -> 83.52%     
client [23] (testset)   loss: 0.5175 -> 0.4276  accuracy: 90.25% -> 90.25%     
client [88] (testset)   loss: 0.6867 -> 0.6615  accuracy: 86.14% -> 87.62%     
client [98] (testset)   loss: 0.3605 -> 0.3836  accuracy: 90.17% -> 92.31%     
client [79] (testset)   loss: 0.4445 -> 0.4197  accuracy: 91.82% -> 91.82%     
client [21] (testset)   loss: 0.4395 -> 0.3742  accuracy: 90.40% -> 93.05%     
client [92] (testset)   loss: 0.6664 -> 0.5994  accuracy: 88.42% -> 90.53%     
client [56] (testset)   loss: 0.5863 -> 0.4710  accuracy: 89.77% -> 92.11%     
client [5]  (testset)   loss: 0.6027 -> 0.5693  accuracy: 86.21% -> 89.16%     
client [52] (testset)   loss: 0.5984 -> 0.4927  accuracy: 87.59% -> 88.61%     
---------------------------- TRAINING EPOCH: 210 ----------------------------  
client [67] (testset)   loss: 0.2084 -> 0.2814  accuracy: 94.20% -> 93.48%     
client [54] (testset)   loss: 0.5901 -> 0.7056  accuracy: 88.12% -> 87.46%     
client [14] (testset)   loss: 0.5762 -> 0.4974  accuracy: 91.88% -> 91.25%     
client [99] (testset)   loss: 0.4707 -> 0.4820  accuracy: 92.63% -> 92.98%     
client [36] (testset)   loss: 0.3684 -> 0.2544  accuracy: 91.95% -> 95.69%     
client [30] (testset)   loss: 0.3590 -> 0.3178  accuracy: 93.38% -> 93.38%     
client [38] (testset)   loss: 0.4470 -> 0.4809  accuracy: 90.15% -> 91.24%     
client [15] (testset)   loss: 0.4842 -> 0.5439  accuracy: 90.05% -> 90.52%     
client [6]  (testset)   loss: 0.3788 -> 0.3498  accuracy: 95.59% -> 95.81%     
client [53] (testset)   loss: 0.7508 -> 0.7199  accuracy: 88.67% -> 89.33%     
---------------------------- TRAINING EPOCH: 220 ----------------------------  
client [99] (testset)   loss: 0.5548 -> 0.4841  accuracy: 90.18% -> 92.98%     
client [6]  (testset)   loss: 0.3762 -> 0.3427  accuracy: 95.15% -> 95.15%     
client [83] (testset)   loss: 0.5191 -> 0.6256  accuracy: 86.96% -> 91.30%     
client [42] (testset)   loss: 0.4998 -> 0.4216  accuracy: 88.22% -> 90.76%     
client [34] (testset)   loss: 0.5010 -> 0.4715  accuracy: 86.80% -> 88.83%     
client [15] (testset)   loss: 0.5216 -> 0.5195  accuracy: 89.10% -> 89.57%     
client [47] (testset)   loss: 0.3144 -> 0.3123  accuracy: 92.72% -> 93.10%     
client [55] (testset)   loss: 0.3995 -> 0.4290  accuracy: 92.90% -> 91.94%     
client [51] (testset)   loss: 0.5093 -> 0.5088  accuracy: 89.32% -> 86.41%     
client [95] (testset)   loss: 0.4505 -> 0.4192  accuracy: 91.62% -> 92.43%     
---------------------------- TRAINING EPOCH: 230 ----------------------------  
client [71] (testset)   loss: 0.3548 -> 0.2705  accuracy: 93.53% -> 92.67%     
client [15] (testset)   loss: 0.5331 -> 0.5321  accuracy: 89.10% -> 88.63%     
client [33] (testset)   loss: 0.6511 -> 0.6215  accuracy: 90.49% -> 93.21%     
client [99] (testset)   loss: 0.5671 -> 0.5035  accuracy: 90.53% -> 92.98%     
client [90] (testset)   loss: 0.5341 -> 0.4565  accuracy: 89.68% -> 91.10%     
client [57] (testset)   loss: 0.4838 -> 0.4100  accuracy: 91.11% -> 91.85%     
client [27] (testset)   loss: 0.6477 -> 0.6476  accuracy: 89.66% -> 91.26%     
client [78] (testset)   loss: 0.3327 -> 0.3125  accuracy: 92.84% -> 92.56%     
client [36] (testset)   loss: 0.3467 -> 0.2460  accuracy: 91.67% -> 95.11%     
client [88] (testset)   loss: 0.5953 -> 0.5462  accuracy: 86.14% -> 90.10%     
---------------------------- TRAINING EPOCH: 240 ----------------------------  
client [70] (testset)   loss: 0.6633 -> 0.5030  accuracy: 88.80% -> 91.60%     
client [35] (testset)   loss: 0.5816 -> 0.6234  accuracy: 87.53% -> 88.33%     
client [16] (testset)   loss: 0.5899 -> 0.4347  accuracy: 89.70% -> 90.45%     
client [80] (testset)   loss: 0.7633 -> 0.9644  accuracy: 88.74% -> 89.18%     
client [38] (testset)   loss: 0.4573 -> 0.4304  accuracy: 92.34% -> 90.88%     
client [78] (testset)   loss: 0.3231 -> 0.3166  accuracy: 93.39% -> 94.77%     
client [68] (testset)   loss: 0.5344 -> 0.5600  accuracy: 88.31% -> 89.11%     
client [11] (testset)   loss: 0.4941 -> 0.4355  accuracy: 91.33% -> 92.49%     
client [64] (testset)   loss: 0.3398 -> 0.3262  accuracy: 90.54% -> 91.22%     
client [82] (testset)   loss: 0.6121 -> 0.4188  accuracy: 84.72% -> 90.28%     
---------------------------- TRAINING EPOCH: 250 ----------------------------  
client [30] (testset)   loss: 0.3588 -> 0.3105  accuracy: 93.75% -> 93.01%     
client [27] (testset)   loss: 0.6313 -> 0.6184  accuracy: 89.89% -> 92.18%     
client [74] (testset)   loss: 0.5004 -> 0.5331  accuracy: 90.91% -> 90.26%     
client [45] (testset)   loss: 0.5685 -> 0.5603  accuracy: 88.97% -> 90.87%     
client [6]  (testset)   loss: 0.3817 -> 0.3647  accuracy: 95.15% -> 95.15%     
client [36] (testset)   loss: 0.3097 -> 0.2442  accuracy: 92.82% -> 94.54%     
client [63] (testset)   loss: 0.3386 -> 0.2196  accuracy: 88.19% -> 91.34%     
client [76] (testset)   loss: 0.2267 -> 0.2815  accuracy: 95.45% -> 94.70%     
client [83] (testset)   loss: 0.5604 -> 0.6589  accuracy: 88.04% -> 89.67%     
client [86] (testset)   loss: 0.6330 -> 0.5629  accuracy: 90.75% -> 91.19%     
---------------------------- TRAINING EPOCH: 260 ----------------------------  
client [83] (testset)   loss: 0.5379 -> 0.5587  accuracy: 86.96% -> 90.22%     
client [99] (testset)   loss: 0.5963 -> 0.5292  accuracy: 91.93% -> 92.98%     
client [74] (testset)   loss: 0.4857 -> 0.5469  accuracy: 92.21% -> 89.61%     
client [73] (testset)   loss: 0.4383 -> 0.4191  accuracy: 92.02% -> 92.64%     
client [29] (testset)   loss: 0.5003 -> 0.4955  accuracy: 87.82% -> 88.78%     
client [92] (testset)   loss: 0.6628 -> 0.5812  accuracy: 88.95% -> 90.00%     
client [6]  (testset)   loss: 0.3852 -> 0.3256  accuracy: 95.59% -> 96.04%     
client [61] (testset)   loss: 0.3229 -> 0.4369  accuracy: 92.39% -> 91.85%     
client [21] (testset)   loss: 0.4791 -> 0.3705  accuracy: 90.73% -> 92.38%     
client [67] (testset)   loss: 0.2663 -> 0.2826  accuracy: 92.75% -> 92.75%     
---------------------------- TRAINING EPOCH: 270 ----------------------------  
client [83] (testset)   loss: 0.5463 -> 0.6175  accuracy: 88.59% -> 90.22%     
client [32] (testset)   loss: 0.4871 -> 0.4767  accuracy: 89.19% -> 88.29%     
client [95] (testset)   loss: 0.4946 -> 0.4636  accuracy: 90.81% -> 91.62%     
client [61] (testset)   loss: 0.3636 -> 0.4738  accuracy: 92.39% -> 91.30%     
client [27] (testset)   loss: 0.6562 -> 0.6261  accuracy: 90.57% -> 91.72%     
client [25] (testset)   loss: 0.9820 -> 1.0144  accuracy: 86.49% -> 86.94%     
client [68] (testset)   loss: 0.5438 -> 0.5326  accuracy: 88.31% -> 87.90%     
client [34] (testset)   loss: 0.5596 -> 0.5404  accuracy: 84.77% -> 87.82%     
client [71] (testset)   loss: 0.3545 -> 0.2300  accuracy: 92.67% -> 93.53%     
client [89] (testset)   loss: 0.4167 -> 0.3467  accuracy: 87.37% -> 89.39%     
---------------------------- TRAINING EPOCH: 280 ----------------------------  
client [78] (testset)   loss: 0.3474 -> 0.3246  accuracy: 92.84% -> 93.94%     
client [81] (testset)   loss: 0.4452 -> 0.4822  accuracy: 91.37% -> 90.36%     
client [51] (testset)   loss: 0.6380 -> 0.5738  accuracy: 87.86% -> 89.32%     
client [54] (testset)   loss: 0.6699 -> 0.7260  accuracy: 87.46% -> 88.12%     
client [65] (testset)   loss: 0.6384 -> 0.4264  accuracy: 86.47% -> 91.47%     
client [41] (testset)   loss: 0.4713 -> 0.4912  accuracy: 91.63% -> 92.05%     
client [11] (testset)   loss: 0.5020 -> 0.4413  accuracy: 90.75% -> 91.62%     
client [85] (testset)   loss: 0.4317 -> 0.3708  accuracy: 91.38% -> 92.53%     
client [12] (testset)   loss: 0.1610 -> 0.2142  accuracy: 96.84% -> 93.67%     
client [23] (testset)   loss: 0.5590 -> 0.5065  accuracy: 89.41% -> 92.37%     
---------------------------- TRAINING EPOCH: 290 ----------------------------  
client [16] (testset)   loss: 0.5543 -> 0.4073  accuracy: 89.45% -> 91.46%     
client [65] (testset)   loss: 0.5112 -> 0.4204  accuracy: 90.00% -> 91.47%     
client [53] (testset)   loss: 0.7433 -> 0.7285  accuracy: 88.67% -> 90.67%     
client [58] (testset)   loss: 0.5540 -> 0.5258  accuracy: 90.23% -> 89.30%     
client [72] (testset)   loss: 0.3204 -> 0.2790  accuracy: 89.43% -> 91.87%     
client [7]  (testset)   loss: 0.4774 -> 0.4660  accuracy: 92.18% -> 92.59%     
client [71] (testset)   loss: 0.3530 -> 0.2565  accuracy: 93.53% -> 93.10%     
client [59] (testset)   loss: 0.8963 -> 0.7578  accuracy: 89.31% -> 90.57%     
client [86] (testset)   loss: 0.6339 -> 0.5588  accuracy: 91.19% -> 91.63%     
client [39] (testset)   loss: 0.6256 -> 0.6341  accuracy: 87.02% -> 87.50%     
---------------------------- TRAINING EPOCH: 300 ----------------------------  
client [99] (testset)   loss: 0.5986 -> 0.5153  accuracy: 91.58% -> 91.93%     
client [7]  (testset)   loss: 0.5027 -> 0.4368  accuracy: 91.77% -> 91.77%     
client [17] (testset)   loss: 0.7443 -> 0.6798  accuracy: 90.21% -> 89.79%     
client [64] (testset)   loss: 0.3359 -> 0.2559  accuracy: 92.57% -> 93.92%     
client [37] (testset)   loss: 0.6683 -> 0.6272  accuracy: 88.67% -> 88.67%     
client [29] (testset)   loss: 0.4948 -> 0.5119  accuracy: 88.46% -> 88.46%     
client [93] (testset)   loss: 0.4101 -> 0.4066  accuracy: 93.06% -> 92.77%     
client [73] (testset)   loss: 0.4302 -> 0.4465  accuracy: 90.80% -> 92.33%     
client [40] (testset)   loss: 0.4046 -> 0.3589  accuracy: 93.30% -> 95.54%     
client [76] (testset)   loss: 0.2366 -> 0.3701  accuracy: 96.21% -> 92.42%     
---------------------------- TRAINING EPOCH: 310 ----------------------------  
client [31] (testset)   loss: 0.4473 -> 0.1960  accuracy: 90.67% -> 94.00%     
client [89] (testset)   loss: 0.3616 -> 0.2957  accuracy: 88.38% -> 92.93%     
client [77] (testset)   loss: 0.4811 -> 0.3825  accuracy: 90.03% -> 92.08%     
client [90] (testset)   loss: 0.4942 -> 0.4707  accuracy: 92.17% -> 92.17%     
client [26] (testset)   loss: 0.5956 -> 0.6302  accuracy: 91.37% -> 90.73%     
client [50] (testset)   loss: 0.4414 -> 0.4605  accuracy: 90.50% -> 90.91%     
client [30] (testset)   loss: 0.3640 -> 0.3202  accuracy: 95.22% -> 92.28%     
client [70] (testset)   loss: 0.6513 -> 0.5302  accuracy: 88.80% -> 90.40%     
client [41] (testset)   loss: 0.5570 -> 0.5218  accuracy: 90.38% -> 91.63%     
client [99] (testset)   loss: 0.5931 -> 0.5373  accuracy: 91.58% -> 92.63%     
---------------------------- TRAINING EPOCH: 320 ----------------------------  
client [68] (testset)   loss: 0.5888 -> 0.5139  accuracy: 86.69% -> 87.90%     
client [70] (testset)   loss: 0.7714 -> 0.5504  accuracy: 87.20% -> 91.20%     
client [52] (testset)   loss: 0.7049 -> 0.5235  accuracy: 88.10% -> 90.38%     
client [1]  (testset)   loss: 0.3950 -> 0.4138  accuracy: 91.55% -> 91.90%     
client [2]  (testset)   loss: 0.3868 -> 0.3648  accuracy: 91.07% -> 90.36%     
client [67] (testset)   loss: 0.1914 -> 0.2250  accuracy: 96.38% -> 96.38%     
client [92] (testset)   loss: 0.6427 -> 0.6723  accuracy: 90.53% -> 90.53%     
client [35] (testset)   loss: 0.6195 -> 0.5778  accuracy: 88.06% -> 88.86%     
client [36] (testset)   loss: 0.3856 -> 0.2658  accuracy: 92.24% -> 95.11%     
client [64] (testset)   loss: 0.3989 -> 0.3516  accuracy: 91.89% -> 92.57%     
---------------------------- TRAINING EPOCH: 330 ----------------------------  
client [44] (testset)   loss: 0.3921 -> 0.2970  accuracy: 91.30% -> 92.12%     
client [6]  (testset)   loss: 0.4224 -> 0.3586  accuracy: 94.27% -> 95.81%     
client [12] (testset)   loss: 0.2091 -> 0.2325  accuracy: 95.57% -> 94.30%     
client [55] (testset)   loss: 0.4042 -> 0.4349  accuracy: 91.29% -> 92.26%     
client [29] (testset)   loss: 0.4907 -> 0.5382  accuracy: 89.74% -> 88.78%     
client [9]  (testset)   loss: 0.2947 -> 0.1627  accuracy: 94.64% -> 96.79%     
client [43] (testset)   loss: 1.0947 -> 1.0581  accuracy: 85.58% -> 88.46%     
client [77] (testset)   loss: 0.5322 -> 0.3723  accuracy: 87.98% -> 92.38%     
client [98] (testset)   loss: 0.4538 -> 0.4200  accuracy: 90.17% -> 91.45%     
client [78] (testset)   loss: 0.3632 -> 0.3188  accuracy: 93.94% -> 94.77%     
---------------------------- TRAINING EPOCH: 340 ----------------------------  
client [92] (testset)   loss: 0.8632 -> 0.7294  accuracy: 88.95% -> 90.53%     
client [80] (testset)   loss: 0.7628 -> 0.9229  accuracy: 90.04% -> 87.88%     
client [63] (testset)   loss: 0.4122 -> 0.2597  accuracy: 88.19% -> 91.34%     
client [76] (testset)   loss: 0.2705 -> 0.2657  accuracy: 95.45% -> 92.42%     
client [78] (testset)   loss: 0.3740 -> 0.3342  accuracy: 93.11% -> 93.66%     
client [25] (testset)   loss: 1.0461 -> 1.2253  accuracy: 85.59% -> 86.49%     
client [58] (testset)   loss: 0.5864 -> 0.5654  accuracy: 89.30% -> 89.30%     
client [13] (testset)   loss: 0.3213 -> 0.3046  accuracy: 92.74% -> 93.95%     
client [17] (testset)   loss: 0.7143 -> 0.7149  accuracy: 90.21% -> 90.21%     
client [38] (testset)   loss: 0.4738 -> 0.4748  accuracy: 90.88% -> 91.24%     
---------------------------- TRAINING EPOCH: 350 ----------------------------  
client [72] (testset)   loss: 0.3754 -> 0.3208  accuracy: 89.43% -> 91.87%     
client [82] (testset)   loss: 0.7509 -> 0.5299  accuracy: 86.11% -> 91.67%     
client [86] (testset)   loss: 0.6816 -> 0.5891  accuracy: 91.19% -> 92.07%     
client [51] (testset)   loss: 0.5726 -> 0.5339  accuracy: 89.32% -> 90.78%     
client [96] (testset)   loss: 0.4338 -> 0.4780  accuracy: 89.24% -> 91.77%     
client [42] (testset)   loss: 0.5957 -> 0.4069  accuracy: 88.54% -> 91.72%     
client [55] (testset)   loss: 0.4429 -> 0.4278  accuracy: 93.23% -> 93.23%     
client [13] (testset)   loss: 0.3092 -> 0.2911  accuracy: 93.22% -> 93.70%     
client [1]  (testset)   loss: 0.3874 -> 0.3930  accuracy: 90.49% -> 93.31%     
client [12] (testset)   loss: 0.1951 -> 0.2655  accuracy: 95.57% -> 94.94%     
---------------------------- TRAINING EPOCH: 360 ----------------------------  
client [68] (testset)   loss: 0.5986 -> 0.5596  accuracy: 87.50% -> 88.31%     
client [23] (testset)   loss: 0.6247 -> 0.5586  accuracy: 89.83% -> 90.25%     
client [46] (testset)   loss: 0.3428 -> 0.2305  accuracy: 93.89% -> 95.42%     
client [41] (testset)   loss: 0.5862 -> 0.5829  accuracy: 91.21% -> 91.21%     
client [25] (testset)   loss: 1.1015 -> 1.1222  accuracy: 86.04% -> 85.14%     
client [58] (testset)   loss: 0.5985 -> 0.5726  accuracy: 90.23% -> 90.23%     
client [14] (testset)   loss: 0.7111 -> 0.6264  accuracy: 90.00% -> 90.62%     
client [33] (testset)   loss: 0.7805 -> 0.7526  accuracy: 91.58% -> 93.48%     
client [85] (testset)   loss: 0.4510 -> 0.4056  accuracy: 91.95% -> 92.53%     
client [62] (testset)   loss: 0.2689 -> 0.2669  accuracy: 94.96% -> 94.12%     
---------------------------- TRAINING EPOCH: 370 ----------------------------  
client [98] (testset)   loss: 0.4125 -> 0.4334  accuracy: 91.45% -> 91.03%     
client [63] (testset)   loss: 0.3881 -> 0.2095  accuracy: 88.19% -> 94.49%     
client [70] (testset)   loss: 0.7083 -> 0.5349  accuracy: 88.40% -> 90.80%     
client [65] (testset)   loss: 0.5889 -> 0.4670  accuracy: 89.12% -> 91.47%     
client [14] (testset)   loss: 0.6895 -> 0.6765  accuracy: 90.62% -> 91.25%     
client [73] (testset)   loss: 0.4670 -> 0.4848  accuracy: 91.72% -> 92.33%     
client [34] (testset)   loss: 0.6340 -> 0.5391  accuracy: 85.79% -> 87.82%     
client [99] (testset)   loss: 0.5894 -> 0.5595  accuracy: 91.58% -> 92.28%     
client [69] (testset)   loss: 0.5178 -> 0.4394  accuracy: 90.09% -> 90.95%     
client [46] (testset)   loss: 0.3397 -> 0.1995  accuracy: 93.51% -> 95.42%     
---------------------------- TRAINING EPOCH: 380 ----------------------------  
client [99] (testset)   loss: 0.6228 -> 0.5618  accuracy: 92.28% -> 91.58%     
client [93] (testset)   loss: 0.4274 -> 0.4390  accuracy: 93.64% -> 92.49%     
client [11] (testset)   loss: 0.5199 -> 0.4510  accuracy: 91.33% -> 93.06%     
client [58] (testset)   loss: 0.5741 -> 0.5607  accuracy: 89.30% -> 90.70%     
client [81] (testset)   loss: 0.5099 -> 0.4882  accuracy: 89.85% -> 92.39%     
client [85] (testset)   loss: 0.4189 -> 0.3898  accuracy: 91.38% -> 92.53%     
client [89] (testset)   loss: 0.4669 -> 0.3278  accuracy: 88.89% -> 92.42%     
client [45] (testset)   loss: 0.6785 -> 0.7168  accuracy: 90.11% -> 88.97%     
client [8]  (testset)   loss: 0.6169 -> 0.6181  accuracy: 91.40% -> 88.71%     
client [68] (testset)   loss: 0.6088 -> 0.5797  accuracy: 87.50% -> 88.71%     
---------------------------- TRAINING EPOCH: 390 ----------------------------  
client [67] (testset)   loss: 0.2457 -> 0.2364  accuracy: 93.48% -> 94.93%     
client [72] (testset)   loss: 0.3694 -> 0.3010  accuracy: 89.43% -> 91.06%     
client [1]  (testset)   loss: 0.3964 -> 0.4341  accuracy: 91.55% -> 91.20%     
client [78] (testset)   loss: 0.3407 -> 0.3236  accuracy: 93.94% -> 94.21%     
client [83] (testset)   loss: 0.6344 -> 0.6552  accuracy: 88.04% -> 91.30%     
client [21] (testset)   loss: 0.4415 -> 0.4002  accuracy: 92.38% -> 92.72%     
client [56] (testset)   loss: 0.7067 -> 0.5763  accuracy: 89.18% -> 90.94%     
client [44] (testset)   loss: 0.4048 -> 0.3285  accuracy: 90.49% -> 90.76%     
client [92] (testset)   loss: 0.7535 -> 0.6730  accuracy: 92.11% -> 91.58%     
client [27] (testset)   loss: 0.7432 -> 0.6909  accuracy: 89.66% -> 91.95%     
---------------------------- TRAINING EPOCH: 400 ----------------------------  
client [10] (testset)   loss: 0.5715 -> 0.5612  accuracy: 90.26% -> 90.77%     
client [39] (testset)   loss: 0.7829 -> 0.7569  accuracy: 85.10% -> 87.02%     
client [65] (testset)   loss: 0.6169 -> 0.4946  accuracy: 89.12% -> 91.18%     
client [26] (testset)   loss: 0.6033 -> 0.6179  accuracy: 90.73% -> 92.01%     
client [19] (testset)   loss: 0.3472 -> 0.3597  accuracy: 94.35% -> 92.86%     
client [68] (testset)   loss: 0.6158 -> 0.6019  accuracy: 88.71% -> 88.71%     
client [41] (testset)   loss: 0.5827 -> 0.6222  accuracy: 91.21% -> 91.63%     
client [50] (testset)   loss: 0.5831 -> 0.4600  accuracy: 90.08% -> 92.98%     
client [75] (testset)   loss: 0.4770 -> 0.4550  accuracy: 91.79% -> 91.79%     
client [81] (testset)   loss: 0.4613 -> 0.4440  accuracy: 91.37% -> 92.89%     
Training... ---------------------------------------- 100% 0:25:39
pFedFDA's average time taken by each global epoch: 0 min 3.52 sec.             
pFedFDA's total running time: 0 h 25 m 39 s.                                   
==================== pFedFDA Experiment Results: ====================          
Display format: (before local fine-tuning) -> (after local fine-tuning)        
 So if finetune_epoch = 0, x.xx% -> 0.00% is normal.                           
 Centralized testing ONLY happens after model aggregation, so the stats between
'->' are the same.                                                             
{                                                                              
    "100": {                                                                   
        "all_clients": {                                                       
            "test": {                                                          
                "loss": "1.4648 -> 0.0000",                                    
                "accuracy": "86.04% -> 0.00%"                                  
            }                                                                  
        }                                                                      
    },                                                                         
    "200": {                                                                   
        "all_clients": {                                                       
            "test": {                                                          
                "loss": "1.8603 -> 0.0000",                                    
                "accuracy": "86.24% -> 0.00%"                                  
            }                                                                  
        }                                                                      
    },                                                                         
    "300": {                                                                   
        "all_clients": {                                                       
            "test": {                                                          
                "loss": "2.1843 -> 0.0000",                                    
                "accuracy": "86.00% -> 0.00%"                                  
            }                                                                  
        }                                                                      
    },                                                                         
    "400": {                                                                   
        "all_clients": {                                                       
            "test": {                                                          
                "loss": "2.4476 -> 0.0000",                                    
                "accuracy": "85.71% -> 0.00%"                                  
            }                                                                  
        }                                                                      
    }                                                                          
}                                                                              
==================== pFedFDA Max Accuracy ====================                 
all_clients:                                                                   
(test) before fine-tuning: 86.24% at epoch 200                                 
(test) after fine-tuning: 0.00% at epoch 100                                   
[0m