==================== PSFL ====================                                 
Experiment Arguments:                                                          
{
│   'method': 'psfl',
│   'dataset': {
│   │   'name': 'medmnistC',
│   │   'client_num': 100,
│   │   'test_ratio': 0.25,
│   │   'val_ratio': 0.0,
│   │   'seed': 42,
│   │   'split': 'sample',
│   │   'IID_ratio': 0.0,
│   │   'monitor_window_name_suffix': 'medmnistC-100clients-0%IID-Dir(1.0)-seed42',
│   │   'alpha': 1.0,
│   │   'min_samples_per_client': 10
│   },
│   'model': {
│   │   'name': 'lenet5',
│   │   'use_torchvision_pretrained_weights': True,
│   │   'external_model_weights_path': None
│   },
│   'optimizer': {
│   │   'lr': 0.01,
│   │   'dampening': 0,
│   │   'weight_decay': 0,
│   │   'momentum': 0,
│   │   'nesterov': False,
│   │   'name': 'sgd'
│   },
│   'mode': 'sequential',
│   'parallel': {
│   │   'ray_cluster_addr': None,
│   │   'num_cpus': None,
│   │   'num_gpus': None,
│   │   'num_workers': 2
│   },
│   'common': {
│   │   'seed': 42,
│   │   'join_ratio': 0.1,
│   │   'global_epoch': 400,
│   │   'local_epoch': 5,
│   │   'batch_size': 32,
│   │   'reset_optimizer_on_global_epoch': True,
│   │   'straggler_ratio': 0,
│   │   'straggler_min_local_epoch': 0,
│   │   'buffers': 'global',
│   │   'client_side_evaluation': True,
│   │   'test': {
│   │   │   'client': {
│   │   │   │   'interval': 100,
│   │   │   │   'finetune_epoch': 0,
│   │   │   │   'train': False,
│   │   │   │   'val': False,
│   │   │   │   'test': True
│   │   │   },
│   │   │   'server': {
│   │   │   │   'interval': -1,
│   │   │   │   'train': False,
│   │   │   │   'val': False,
│   │   │   │   'test': False,
│   │   │   │   'model_in_train_mode': False
│   │   │   }
│   │   },
│   │   'verbose_gap': 10,
│   │   'monitor': None,
│   │   'use_cuda': True,
│   │   'save_log': True,
│   │   'save_model': False,
│   │   'save_learning_curve_plot': False,
│   │   'save_metrics': True,
│   │   'delete_useless_run': True
│   },
│   'psfl': {
│   │   'alpha': 0.0,
│   │   'CLS': False,
│   │   'ig_ratio': 0.99999,
│   │   'track': False,
│   │   'score': 'diff'
│   }
}
---------------------------- TRAINING EPOCH: 10 ----------------------------   
client [77] (testset)   loss: 416.8820 -> 76.7049   accuracy: 0.00% -> 15.00%  
client [81] (testset)   loss: 71.6953 -> 80.8190    accuracy: 9.46% -> 1.35%   
client [21] (testset)   loss: 54.6423 -> 92.5611    accuracy: 0.00% -> 15.79%  
client [68] (testset)   loss: 169.3764 -> 50.4589   accuracy: 0.00% -> 46.67%  
client [93] (testset)   loss: 76.8644 -> 5.2708 accuracy: 7.61% -> 0.00%       
client [31] (testset)   loss: 3.9298 -> 395.4100    accuracy: 2.78% -> 8.33%   
client [20] (testset)   loss: 450.0443 -> 17.1248   accuracy: 1.64% -> 9.84%   
client [59] (testset)   loss: 28.5468 -> 141.5427   accuracy: 8.05% -> 0.00%   
client [48] (testset)   loss: 144.1608 -> 147.5176  accuracy: 13.04% -> 8.70%  
client [34] (testset)   loss: 174.3228 -> 168.3153  accuracy: 0.00% -> 4.92%   
---------------------------- TRAINING EPOCH: 20 ----------------------------   
client [69] (testset)   loss: 103.9324 -> 58.2707   accuracy: 3.92% -> 17.65%  
client [99] (testset)   loss: 77.2127 -> 12.7823    accuracy: 0.00% -> 15.38%  
client [67] (testset)   loss: 9.4928 -> 273.3777    accuracy: 19.30% -> 3.51%  
client [0]  (testset)   loss: 127.4657 -> 69.6108   accuracy: 24.66% -> 20.55% 
client [76] (testset)   loss: 45.8668 -> 143.6554   accuracy: 27.78% -> 8.33%  
client [41] (testset)   loss: 181.2851 -> 45.6379   accuracy: 1.92% -> 1.92%   
client [62] (testset)   loss: 66.5489 -> 41.9581    accuracy: 3.45% -> 20.69%  
client [2]  (testset)   loss: 34.9398 -> 15.9391    accuracy: 3.61% -> 49.40%  
client [14] (testset)   loss: 22.6450 -> 11.0814    accuracy: 31.88% -> 14.49% 
client [46] (testset)   loss: 14.2441 -> 296.9016   accuracy: 14.89% -> 2.13%  
---------------------------- TRAINING EPOCH: 30 ----------------------------   
client [24] (testset)   loss: 94.6366 -> 18.1018    accuracy: 12.00% -> 4.00%  
client [68] (testset)   loss: 30.0611 -> 22.6649    accuracy: 4.44% -> 37.78%  
client [57] (testset)   loss: 28.9866 -> 79.5275    accuracy: 5.80% -> 5.80%   
client [17] (testset)   loss: 83.7220 -> 42.6315    accuracy: 0.00% -> 20.00%  
client [54] (testset)   loss: 41.6242 -> 92.0836    accuracy: 3.12% -> 0.00%   
client [23] (testset)   loss: 95.3844 -> 292.0073   accuracy: 20.59% -> 23.53% 
client [35] (testset)   loss: 362.3708 -> 53.8862   accuracy: 13.89% -> 13.89% 
client [59] (testset)   loss: 63.6296 -> 183.6950   accuracy: 12.64% -> 8.05%  
client [31] (testset)   loss: 204.8394 -> 11.4837   accuracy: 2.78% -> 2.78%   
client [9]  (testset)   loss: 31.9412 -> 93.3689    accuracy: 13.33% -> 4.44%  
---------------------------- TRAINING EPOCH: 40 ----------------------------   
client [64] (testset)   loss: 51.6147 -> 114.9788   accuracy: 8.57% -> 0.00%   
client [33] (testset)   loss: 114.4642 -> 90.8441   accuracy: 13.33% -> 6.67%  
client [16] (testset)   loss: 79.0972 -> 28.7147    accuracy: 0.00% -> 6.67%   
client [44] (testset)   loss: 26.8975 -> 36.7681    accuracy: 5.36% -> 8.93%   
client [8]  (testset)   loss: 54.5450 -> 58.6039    accuracy: 10.00% -> 4.17%  
client [31] (testset)   loss: 65.7638 -> 219.4804   accuracy: 5.56% -> 2.78%   
client [47] (testset)   loss: 112.1327 -> 49.3561   accuracy: 47.22% -> 0.00%  
client [36] (testset)   loss: 109.3816 -> 82.7461   accuracy: 0.00% -> 4.08%   
client [20] (testset)   loss: 69.0408 -> 100.7408   accuracy: 3.28% -> 19.67%  
client [56] (testset)   loss: 96.9273 -> 647.4121   accuracy: 1.82% -> 12.73%  
---------------------------- TRAINING EPOCH: 50 ----------------------------   
client [4]  (testset)   loss: 82.4886 -> 117.7155   accuracy: 30.19% -> 1.89%  
client [60] (testset)   loss: 97.1413 -> 115.2684   accuracy: 5.71% -> 11.43%  
client [28] (testset)   loss: 121.2152 -> 80.3390   accuracy: 4.11% -> 0.00%   
client [25] (testset)   loss: 71.1125 -> 55.7179    accuracy: 4.00% -> 12.00%  
client [58] (testset)   loss: 44.5261 -> 12.7049    accuracy: 20.55% -> 20.55% 
client [44] (testset)   loss: 9.3916 -> 10.5360 accuracy: 28.57% -> 23.21%     
client [39] (testset)   loss: 13.7565 -> 46.0502    accuracy: 1.89% -> 1.89%   
client [29] (testset)   loss: 47.8698 -> 17.9464    accuracy: 2.60% -> 15.58%  
client [3]  (testset)   loss: 23.4102 -> 358.9442   accuracy: 11.11% -> 9.26%  
client [84] (testset)   loss: 197.8732 -> 214.0537  accuracy: 5.50% -> 32.11%  
---------------------------- TRAINING EPOCH: 60 ----------------------------   
client [21] (testset)   loss: 28.4541 -> 55.9294    accuracy: 12.28% -> 15.79% 
client [84] (testset)   loss: 75.3513 -> 9.7083 accuracy: 5.50% -> 41.28%      
client [10] (testset)   loss: 14.4237 -> 112.4143   accuracy: 5.56% -> 5.56%   
client [36] (testset)   loss: 67.8304 -> 2.3884 accuracy: 4.08% -> 46.94%      
client [65] (testset)   loss: 3.5160 -> 96.0872 accuracy: 30.19% -> 0.00%      
client [81] (testset)   loss: 74.1662 -> 47.5381    accuracy: 1.35% -> 8.11%   
client [79] (testset)   loss: 68.1804 -> 17.9689    accuracy: 21.15% -> 0.00%  
client [42] (testset)   loss: 16.4832 -> 61.8871    accuracy: 5.36% -> 5.36%   
client [11] (testset)   loss: 67.1922 -> 86.3930    accuracy: 3.57% -> 3.57%   
client [96] (testset)   loss: 72.0280 -> 73.3203    accuracy: 0.00% -> 0.00%   
---------------------------- TRAINING EPOCH: 70 ----------------------------   
client [8]  (testset)   loss: 58.1321 -> 37.5699    accuracy: 4.17% -> 2.50%   
client [53] (testset)   loss: 39.3757 -> 103.7581   accuracy: 3.23% -> 1.61%   
client [52] (testset)   loss: 56.6783 -> 13.5087    accuracy: 1.79% -> 5.36%   
client [42] (testset)   loss: 12.5593 -> 18.1737    accuracy: 14.29% -> 5.36%  
client [69] (testset)   loss: 18.8828 -> 74.7625    accuracy: 17.65% -> 7.84%  
client [59] (testset)   loss: 66.5736 -> 112.2548   accuracy: 4.60% -> 1.15%   
client [7]  (testset)   loss: 95.4115 -> 20.0909    accuracy: 6.56% -> 3.28%   
client [26] (testset)   loss: 12.0932 -> 15.7926    accuracy: 19.30% -> 24.56% 
client [49] (testset)   loss: 18.4630 -> 30.0798    accuracy: 33.33% -> 12.12% 
client [98] (testset)   loss: 35.9007 -> 165.7899   accuracy: 3.77% -> 1.89%   
---------------------------- TRAINING EPOCH: 80 ----------------------------   
client [98] (testset)   loss: 118.9253 -> 13.7701   accuracy: 3.77% -> 9.43%   
client [47] (testset)   loss: 8.7805 -> 24.2928 accuracy: 23.61% -> 6.94%      
client [21] (testset)   loss: 44.8041 -> 212.7313   accuracy: 1.75% -> 1.75%   
client [77] (testset)   loss: 171.7711 -> 15.9422   accuracy: 10.00% -> 13.33% 
client [95] (testset)   loss: 12.3935 -> 48.6862    accuracy: 24.66% -> 13.70% 
client [91] (testset)   loss: 61.4786 -> 68.4485    accuracy: 3.45% -> 3.45%   
client [14] (testset)   loss: 46.1112 -> 60.7796    accuracy: 14.49% -> 13.04% 
client [99] (testset)   loss: 37.8444 -> 159.1353   accuracy: 10.26% -> 7.69%  
client [20] (testset)   loss: 141.8840 -> 27.6191   accuracy: 19.67% -> 14.75% 
client [39] (testset)   loss: 37.1521 -> 64.1598    accuracy: 5.66% -> 5.66%   
---------------------------- TRAINING EPOCH: 90 ----------------------------   
client [52] (testset)   loss: 38.1684 -> 73.8873    accuracy: 12.50% -> 0.00%  
client [62] (testset)   loss: 51.3510 -> 127.7236   accuracy: 10.34% -> 6.90%  
client [71] (testset)   loss: 126.5163 -> 38.7158   accuracy: 20.00% -> 13.33% 
client [97] (testset)   loss: 35.1002 -> 3.9466 accuracy: 10.61% -> 37.88%     
client [30] (testset)   loss: 3.9193 -> 142.8108    accuracy: 30.30% -> 7.58%  
client [88] (testset)   loss: 131.9629 -> 47.8225   accuracy: 12.28% -> 0.00%  
client [60] (testset)   loss: 48.6063 -> 42.9208    accuracy: 14.29% -> 0.00%  
client [82] (testset)   loss: 54.5078 -> 69.8089    accuracy: 0.00% -> 7.46%   
client [91] (testset)   loss: 43.2256 -> 191.6343   accuracy: 13.79% -> 3.45%  
client [57] (testset)   loss: 145.1335 -> 91.2070   accuracy: 1.45% -> 4.35%   
---------------------------- TRAINING EPOCH: 100 ----------------------------  
client [31] (testset)   loss: 40.1378 -> 69.2808    accuracy: 5.56% -> 5.56%   
client [15] (testset)   loss: 43.4377 -> 21.4109    accuracy: 1.30% -> 12.99%  
client [71] (testset)   loss: 43.1002 -> 31.0861    accuracy: 1.67% -> 0.00%   
client [97] (testset)   loss: 25.0884 -> 49.1854    accuracy: 3.03% -> 21.21%  
client [53] (testset)   loss: 40.4646 -> 26.3972    accuracy: 38.71% -> 3.23%  
client [77] (testset)   loss: 42.0546 -> 56.9633    accuracy: 5.00% -> 30.00%  
client [76] (testset)   loss: 56.0003 -> 21.5250    accuracy: 5.56% -> 8.33%   
client [79] (testset)   loss: 16.1882 -> 25.3973    accuracy: 19.23% -> 7.69%  
client [28] (testset)   loss: 23.7096 -> 69.8056    accuracy: 5.48% -> 16.44%  
client [99] (testset)   loss: 53.6889 -> 183.4751   accuracy: 23.08% -> 7.69%  
---------------------------- TRAINING EPOCH: 110 ----------------------------  
client [97] (testset)   loss: 48.0213 -> 30.4811    accuracy: 0.00% -> 0.00%   
client [86] (testset)   loss: 27.0012 -> 32.7012    accuracy: 10.94% -> 21.88% 
client [34] (testset)   loss: 51.4502 -> 30.3119    accuracy: 21.31% -> 8.20%  
client [73] (testset)   loss: 40.3709 -> 13.4265    accuracy: 10.53% -> 19.30% 
client [5]  (testset)   loss: 16.7476 -> 56.9686    accuracy: 13.04% -> 13.04% 
client [96] (testset)   loss: 39.8063 -> 60.8733    accuracy: 33.93% -> 5.36%  
client [22] (testset)   loss: 60.2179 -> 70.2137    accuracy: 0.00% -> 4.00%   
client [60] (testset)   loss: 60.6385 -> 46.9353    accuracy: 0.00% -> 11.43%  
client [66] (testset)   loss: 47.4686 -> 86.8924    accuracy: 10.71% -> 4.76%  
client [83] (testset)   loss: 74.4994 -> 23.6688    accuracy: 8.70% -> 13.04%  
---------------------------- TRAINING EPOCH: 120 ----------------------------  
client [76] (testset)   loss: 35.3382 -> 53.0941    accuracy: 33.33% -> 13.89% 
client [65] (testset)   loss: 57.3492 -> 32.9472    accuracy: 13.21% -> 7.55%  
client [95] (testset)   loss: 46.9253 -> 40.7696    accuracy: 12.33% -> 5.48%  
client [17] (testset)   loss: 54.0544 -> 14.0570    accuracy: 14.00% -> 22.00% 
client [8]  (testset)   loss: 19.2601 -> 152.1262   accuracy: 8.33% -> 4.17%   
client [35] (testset)   loss: 126.9726 -> 9.3738    accuracy: 13.89% -> 19.44% 
client [98] (testset)   loss: 8.8483 -> 9.8319  accuracy: 16.98% -> 13.21%     
client [53] (testset)   loss: 9.2441 -> 39.0904 accuracy: 25.81% -> 1.61%      
client [43] (testset)   loss: 31.5967 -> 4.5028 accuracy: 7.02% -> 67.54%      
client [64] (testset)   loss: 9.7450 -> 78.5880 accuracy: 27.14% -> 22.86%     
---------------------------- TRAINING EPOCH: 130 ----------------------------  
client [21] (testset)   loss: 200.8150 -> 65.5100   accuracy: 26.32% -> 1.75%  
client [88] (testset)   loss: 60.2970 -> 44.2302    accuracy: 1.75% -> 14.04%  
client [38] (testset)   loss: 46.3038 -> 26.6042    accuracy: 10.81% -> 10.81% 
client [3]  (testset)   loss: 27.0328 -> 211.2800   accuracy: 11.11% -> 18.52% 
client [5]  (testset)   loss: 310.4774 -> 84.5052   accuracy: 15.22% -> 8.70%  
client [41] (testset)   loss: 128.3255 -> 7.0537    accuracy: 1.92% -> 36.54%  
client [7]  (testset)   loss: 13.3337 -> 33.8401    accuracy: 16.39% -> 0.00%  
client [37] (testset)   loss: 22.9739 -> 67.5666    accuracy: 13.10% -> 1.19%  
client [45] (testset)   loss: 47.1391 -> 26.7012    accuracy: 17.39% -> 10.87% 
client [47] (testset)   loss: 28.8272 -> 33.1883    accuracy: 2.78% -> 16.67%  
---------------------------- TRAINING EPOCH: 140 ----------------------------  
client [16] (testset)   loss: 11.7437 -> 16.1698    accuracy: 43.33% -> 10.00% 
client [11] (testset)   loss: 21.1402 -> 6.4867 accuracy: 0.00% -> 44.64%      
client [37] (testset)   loss: 6.5883 -> 34.2909 accuracy: 48.81% -> 3.57%      
client [41] (testset)   loss: 27.9652 -> 25.7838    accuracy: 0.00% -> 17.31%  
client [95] (testset)   loss: 34.2573 -> 112.7551   accuracy: 5.48% -> 5.48%   
client [53] (testset)   loss: 131.3264 -> 47.9363   accuracy: 8.06% -> 1.61%   
client [22] (testset)   loss: 41.5726 -> 44.3143    accuracy: 10.00% -> 46.00% 
client [25] (testset)   loss: 60.6329 -> 84.1760    accuracy: 6.00% -> 18.00%  
client [69] (testset)   loss: 73.2879 -> 46.4450    accuracy: 17.65% -> 9.80%  
client [46] (testset)   loss: 37.2667 -> 61.0867    accuracy: 12.77% -> 6.38%  
---------------------------- TRAINING EPOCH: 150 ----------------------------  
client [47] (testset)   loss: 66.9788 -> 12.8107    accuracy: 0.00% -> 20.83%  
client [69] (testset)   loss: 29.1229 -> 10.4958    accuracy: 3.92% -> 41.18%  
client [82] (testset)   loss: 14.6751 -> 104.1731   accuracy: 28.36% -> 1.49%  
client [45] (testset)   loss: 87.3836 -> 45.0861    accuracy: 17.39% -> 17.39% 
client [7]  (testset)   loss: 46.0866 -> 85.6066    accuracy: 6.56% -> 4.92%   
client [50] (testset)   loss: 64.9233 -> 18.0684    accuracy: 6.49% -> 24.68%  
client [35] (testset)   loss: 20.4518 -> 22.6989    accuracy: 22.22% -> 11.11% 
client [24] (testset)   loss: 28.5559 -> 30.3445    accuracy: 8.00% -> 0.00%   
client [15] (testset)   loss: 31.9367 -> 16.0471    accuracy: 0.00% -> 20.78%  
client [58] (testset)   loss: 18.7382 -> 41.8500    accuracy: 36.99% -> 9.59%  
---------------------------- TRAINING EPOCH: 160 ----------------------------  
client [48] (testset)   loss: 83.3534 -> 434.1405   accuracy: 13.04% -> 4.35%  
client [76] (testset)   loss: 229.8012 -> 17.1432   accuracy: 30.56% -> 38.89% 
client [67] (testset)   loss: 30.9330 -> 155.5265   accuracy: 3.51% -> 3.51%   
client [37] (testset)   loss: 157.8399 -> 31.8674   accuracy: 1.19% -> 1.19%   
client [58] (testset)   loss: 39.3093 -> 4.3197 accuracy: 1.37% -> 49.32%      
client [64] (testset)   loss: 5.2005 -> 44.4228 accuracy: 38.57% -> 22.86%     
client [77] (testset)   loss: 37.7678 -> 41.9766    accuracy: 10.00% -> 5.00%  
client [55] (testset)   loss: 28.9579 -> 112.7199   accuracy: 4.92% -> 18.03%  
client [12] (testset)   loss: 186.1573 -> 34.1161   accuracy: 6.78% -> 0.00%   
client [89] (testset)   loss: 23.5364 -> 28.6875    accuracy: 3.12% -> 7.81%   
---------------------------- TRAINING EPOCH: 170 ----------------------------  
client [84] (testset)   loss: 197.7668 -> 10.6295   accuracy: 32.11% -> 20.18% 
client [51] (testset)   loss: 7.8926 -> 19.0135 accuracy: 35.05% -> 4.12%      
client [8]  (testset)   loss: 17.8710 -> 19.0247    accuracy: 10.83% -> 13.33% 
client [18] (testset)   loss: 15.0060 -> 141.4109   accuracy: 9.30% -> 20.93%  
client [94] (testset)   loss: 122.3457 -> 10.9112   accuracy: 31.71% -> 41.46% 
client [81] (testset)   loss: 25.0756 -> 5.5100 accuracy: 9.46% -> 44.59%      
client [3]  (testset)   loss: 15.1197 -> 8.3732 accuracy: 16.67% -> 11.11%     
client [11] (testset)   loss: 9.4920 -> 26.4665 accuracy: 0.00% -> 3.57%       
client [95] (testset)   loss: 19.6562 -> 47.6624    accuracy: 13.70% -> 13.70% 
client [67] (testset)   loss: 49.7280 -> 161.6583   accuracy: 3.51% -> 0.00%   
---------------------------- TRAINING EPOCH: 180 ----------------------------  
client [21] (testset)   loss: 88.1076 -> 74.9410    accuracy: 1.75% -> 10.53%  
client [79] (testset)   loss: 75.1013 -> 14.3753    accuracy: 23.08% -> 25.00% 
client [58] (testset)   loss: 14.9001 -> 12.2530    accuracy: 4.11% -> 30.14%  
client [88] (testset)   loss: 18.9370 -> 9.1271 accuracy: 19.30% -> 22.81%     
client [46] (testset)   loss: 9.3154 -> 49.1209 accuracy: 21.28% -> 14.89%     
client [11] (testset)   loss: 55.5614 -> 292.1953   accuracy: 1.79% -> 3.57%   
client [55] (testset)   loss: 213.1472 -> 111.1185  accuracy: 4.92% -> 1.64%   
client [13] (testset)   loss: 114.5152 -> 113.7452  accuracy: 5.56% -> 5.56%   
client [31] (testset)   loss: 133.7798 -> 428.5136  accuracy: 5.56% -> 2.78%   
client [75] (testset)   loss: 300.3525 -> 4.1151    accuracy: 9.26% -> 48.15%  
---------------------------- TRAINING EPOCH: 190 ----------------------------  
client [19] (testset)   loss: 24.2542 -> 73.5567    accuracy: 30.36% -> 16.07% 
client [7]  (testset)   loss: 95.7132 -> 36.7200    accuracy: 0.00% -> 18.03%  
client [57] (testset)   loss: 37.9496 -> 7.8915 accuracy: 5.80% -> 49.28%      
client [13] (testset)   loss: 12.7706 -> 43.9086    accuracy: 36.11% -> 8.33%  
client [43] (testset)   loss: 46.6117 -> 8.7315 accuracy: 1.75% -> 32.46%      
client [91] (testset)   loss: 22.7148 -> 160.2599   accuracy: 6.90% -> 3.45%   
client [10] (testset)   loss: 83.2553 -> 124.9075   accuracy: 5.56% -> 0.00%   
client [64] (testset)   loss: 108.5077 -> 69.4328   accuracy: 2.86% -> 22.86%  
client [82] (testset)   loss: 76.4131 -> 26.9793    accuracy: 11.94% -> 14.93% 
client [22] (testset)   loss: 48.0758 -> 10.3131    accuracy: 6.00% -> 26.00%  
---------------------------- TRAINING EPOCH: 200 ----------------------------  
client [20] (testset)   loss: 147.2151 -> 56.8031   accuracy: 14.75% -> 9.84%  
client [23] (testset)   loss: 45.7371 -> 12.6468    accuracy: 14.71% -> 26.47% 
client [88] (testset)   loss: 14.6049 -> 23.1665    accuracy: 15.79% -> 21.05% 
client [98] (testset)   loss: 22.8650 -> 58.7959    accuracy: 13.21% -> 1.89%  
client [79] (testset)   loss: 58.3914 -> 4.9912 accuracy: 23.08% -> 44.23%     
client [21] (testset)   loss: 2.8278 -> 11.1553 accuracy: 59.65% -> 42.11%     
client [92] (testset)   loss: 14.3910 -> 26.0832    accuracy: 25.00% -> 1.47%  
client [56] (testset)   loss: 20.3839 -> 63.4077    accuracy: 10.91% -> 1.82%  
client [5]  (testset)   loss: 70.1305 -> 53.3697    accuracy: 15.22% -> 10.87% 
client [52] (testset)   loss: 17.2762 -> 11.6801    accuracy: 57.14% -> 28.57% 
---------------------------- TRAINING EPOCH: 210 ----------------------------  
client [67] (testset)   loss: 109.2341 -> 63.0461   accuracy: 15.79% -> 0.00%  
client [54] (testset)   loss: 63.1029 -> 56.7160    accuracy: 6.25% -> 15.62%  
client [14] (testset)   loss: 45.8958 -> 30.9385    accuracy: 10.14% -> 18.84% 
client [99] (testset)   loss: 35.2158 -> 135.5402   accuracy: 20.51% -> 10.26% 
client [36] (testset)   loss: 143.9179 -> 36.5693   accuracy: 4.08% -> 18.37%  
client [30] (testset)   loss: 55.2082 -> 51.2363    accuracy: 13.64% -> 7.58%  
client [38] (testset)   loss: 54.9376 -> 67.4738    accuracy: 10.81% -> 8.11%  
client [15] (testset)   loss: 79.3560 -> 32.2357    accuracy: 0.00% -> 0.00%   
client [6]  (testset)   loss: 42.5014 -> 58.4964    accuracy: 12.31% -> 6.15%  
client [53] (testset)   loss: 64.4458 -> 34.5689    accuracy: 8.06% -> 1.61%   
---------------------------- TRAINING EPOCH: 220 ----------------------------  
client [99] (testset)   loss: 25.3976 -> 65.4376    accuracy: 10.26% -> 7.69%  
client [6]  (testset)   loss: 52.1021 -> 99.5767    accuracy: 21.54% -> 21.54% 
client [83] (testset)   loss: 115.7624 -> 11.8758   accuracy: 4.35% -> 13.04%  
client [42] (testset)   loss: 11.5282 -> 32.8981    accuracy: 42.86% -> 19.64% 
client [34] (testset)   loss: 25.9256 -> 14.1339    accuracy: 16.39% -> 19.67% 
client [15] (testset)   loss: 7.7770 -> 60.6052 accuracy: 48.05% -> 7.79%      
client [47] (testset)   loss: 63.3865 -> 32.8280    accuracy: 0.00% -> 1.39%   
client [55] (testset)   loss: 29.9593 -> 13.5193    accuracy: 4.92% -> 21.31%  
client [51] (testset)   loss: 18.5863 -> 29.8546    accuracy: 7.22% -> 5.15%   
client [95] (testset)   loss: 32.5236 -> 64.1119    accuracy: 15.07% -> 5.48%  
---------------------------- TRAINING EPOCH: 230 ----------------------------  
client [71] (testset)   loss: 233.5433 -> 64.1149   accuracy: 3.33% -> 13.33%  
client [15] (testset)   loss: 100.7169 -> 148.5908  accuracy: 7.79% -> 1.30%   
client [33] (testset)   loss: 199.7680 -> 14.7073   accuracy: 2.22% -> 53.33%  
client [99] (testset)   loss: 24.5621 -> 21.3788    accuracy: 28.21% -> 7.69%  
client [90] (testset)   loss: 20.7633 -> 6.7001 accuracy: 12.50% -> 43.18%     
client [57] (testset)   loss: 14.0111 -> 7.0848 accuracy: 15.94% -> 37.68%     
client [27] (testset)   loss: 7.5594 -> 6.8014  accuracy: 47.50% -> 40.00%     
client [78] (testset)   loss: 4.3582 -> 54.9464 accuracy: 48.48% -> 10.61%     
client [36] (testset)   loss: 47.9746 -> 64.6714    accuracy: 6.12% -> 4.08%   
client [88] (testset)   loss: 43.7806 -> 15.6015    accuracy: 14.04% -> 12.28% 
---------------------------- TRAINING EPOCH: 240 ----------------------------  
client [70] (testset)   loss: 6.5227 -> 279.3616    accuracy: 34.38% -> 25.00% 
client [35] (testset)   loss: 376.0297 -> 78.0138   accuracy: 13.89% -> 13.89% 
client [16] (testset)   loss: 86.5638 -> 38.7087    accuracy: 6.67% -> 6.67%   
client [80] (testset)   loss: 39.4791 -> 44.5392    accuracy: 3.64% -> 12.73%  
client [38] (testset)   loss: 43.7767 -> 101.4868   accuracy: 13.51% -> 8.11%  
client [78] (testset)   loss: 75.1599 -> 12.7784    accuracy: 9.09% -> 18.18%  
client [68] (testset)   loss: 11.9580 -> 187.9500   accuracy: 35.56% -> 4.44%  
client [11] (testset)   loss: 216.7023 -> 577.8378  accuracy: 0.00% -> 0.00%   
client [64] (testset)   loss: 629.6742 -> 173.1433  accuracy: 0.00% -> 22.86%  
client [82] (testset)   loss: 206.2391 -> 50.5445   accuracy: 11.94% -> 11.94% 
---------------------------- TRAINING EPOCH: 250 ----------------------------  
client [30] (testset)   loss: 66.7293 -> 22.6266    accuracy: 4.55% -> 3.03%   
client [27] (testset)   loss: 22.4950 -> 71.3621    accuracy: 2.50% -> 2.50%   
client [74] (testset)   loss: 76.7470 -> 45.9947    accuracy: 14.04% -> 14.04% 
client [45] (testset)   loss: 40.5145 -> 56.2896    accuracy: 17.39% -> 17.39% 
client [6]  (testset)   loss: 64.6941 -> 132.4244   accuracy: 21.54% -> 18.46% 
client [36] (testset)   loss: 166.9328 -> 13.1995   accuracy: 4.08% -> 6.12%   
client [63] (testset)   loss: 6.3572 -> 40.3139 accuracy: 41.67% -> 26.67%     
client [76] (testset)   loss: 26.6733 -> 9.2184 accuracy: 44.44% -> 47.22%     
client [83] (testset)   loss: 23.1553 -> 27.0386    accuracy: 10.87% -> 6.52%  
client [86] (testset)   loss: 40.2456 -> 9.5737 accuracy: 1.56% -> 43.75%      
---------------------------- TRAINING EPOCH: 260 ----------------------------  
client [83] (testset)   loss: 160.4909 -> 7.8550    accuracy: 8.70% -> 21.74%  
client [99] (testset)   loss: 6.9391 -> 67.4180 accuracy: 35.90% -> 5.13%      
client [74] (testset)   loss: 51.2348 -> 62.3633    accuracy: 7.02% -> 14.04%  
client [73] (testset)   loss: 72.5862 -> 59.2835    accuracy: 10.53% -> 14.04% 
client [29] (testset)   loss: 35.7715 -> 58.0698    accuracy: 20.78% -> 12.99% 
client [92] (testset)   loss: 146.3195 -> 6.6452    accuracy: 5.88% -> 13.24%  
client [6]  (testset)   loss: 8.6681 -> 30.2752 accuracy: 13.85% -> 24.62%     
client [61] (testset)   loss: 54.4054 -> 5.1322 accuracy: 13.33% -> 45.00%     
client [21] (testset)   loss: 5.8684 -> 41.5630 accuracy: 45.61% -> 3.51%      
client [67] (testset)   loss: 58.8342 -> 27.6572    accuracy: 3.51% -> 10.53%  
---------------------------- TRAINING EPOCH: 270 ----------------------------  
client [83] (testset)   loss: 81.4348 -> 6.9056 accuracy: 6.52% -> 13.04%      
client [32] (testset)   loss: 9.4661 -> 77.1221 accuracy: 2.17% -> 4.35%       
client [95] (testset)   loss: 62.9428 -> 49.9648    accuracy: 5.48% -> 13.70%  
client [61] (testset)   loss: 51.2056 -> 7.6821 accuracy: 5.00% -> 46.67%      
client [27] (testset)   loss: 7.1772 -> 33.0616 accuracy: 51.25% -> 2.50%      
client [25] (testset)   loss: 34.1659 -> 51.6586    accuracy: 10.00% -> 12.00% 
client [68] (testset)   loss: 54.3298 -> 8.5533 accuracy: 4.44% -> 46.67%      
client [34] (testset)   loss: 13.9362 -> 43.0976    accuracy: 16.39% -> 9.84%  
client [71] (testset)   loss: 37.8925 -> 13.7091    accuracy: 13.33% -> 31.67% 
client [89] (testset)   loss: 6.8750 -> 18.5206 accuracy: 43.75% -> 17.19%     
---------------------------- TRAINING EPOCH: 280 ----------------------------  
client [78] (testset)   loss: 31.7652 -> 2.5973 accuracy: 9.09% -> 53.03%      
client [81] (testset)   loss: 1.5181 -> 6.2735  accuracy: 68.92% -> 47.30%     
client [51] (testset)   loss: 15.6577 -> 4.1716 accuracy: 6.19% -> 48.45%      
client [54] (testset)   loss: 11.3087 -> 100.6636   accuracy: 15.62% -> 3.12%  
client [65] (testset)   loss: 91.8698 -> 157.2765   accuracy: 13.21% -> 3.77%  
client [41] (testset)   loss: 142.6699 -> 104.8675  accuracy: 7.69% -> 0.00%   
client [11] (testset)   loss: 130.1709 -> 35.4019   accuracy: 0.00% -> 1.79%   
client [85] (testset)   loss: 37.2212 -> 31.3281    accuracy: 1.33% -> 16.00%  
client [12] (testset)   loss: 28.1322 -> 95.3221    accuracy: 3.39% -> 0.00%   
client [23] (testset)   loss: 115.8577 -> 211.1705  accuracy: 0.00% -> 0.00%   
---------------------------- TRAINING EPOCH: 290 ----------------------------  
client [16] (testset)   loss: 13.8456 -> 73.8114    accuracy: 36.67% -> 6.67%  
client [65] (testset)   loss: 90.4963 -> 10.4663    accuracy: 11.32% -> 26.42% 
client [53] (testset)   loss: 9.8149 -> 24.5967 accuracy: 32.26% -> 3.23%      
client [58] (testset)   loss: 27.5427 -> 4.8043 accuracy: 4.11% -> 41.10%      
client [72] (testset)   loss: 6.3765 -> 26.8281 accuracy: 33.33% -> 3.70%      
client [7]  (testset)   loss: 34.4555 -> 18.3599    accuracy: 0.00% -> 22.95%  
client [71] (testset)   loss: 15.8170 -> 35.9894    accuracy: 20.00% -> 13.33% 
client [59] (testset)   loss: 34.9963 -> 10.1822    accuracy: 1.15% -> 18.39%  
client [86] (testset)   loss: 4.7466 -> 30.4274 accuracy: 37.50% -> 17.19%     
client [39] (testset)   loss: 28.6704 -> 10.5711    accuracy: 7.55% -> 10.38%  
---------------------------- TRAINING EPOCH: 300 ----------------------------  
client [99] (testset)   loss: 60.9883 -> 67.6669    accuracy: 7.69% -> 7.69%   
client [7]  (testset)   loss: 50.6729 -> 40.9161    accuracy: 6.56% -> 18.03%  
client [17] (testset)   loss: 41.8985 -> 60.9136    accuracy: 16.00% -> 2.00%  
client [64] (testset)   loss: 68.9422 -> 89.6742    accuracy: 0.00% -> 22.86%  
client [37] (testset)   loss: 112.0991 -> 49.1998   accuracy: 3.57% -> 13.10%  
client [29] (testset)   loss: 70.1652 -> 113.4144   accuracy: 2.60% -> 12.99%  
client [93] (testset)   loss: 213.1106 -> 0.6733    accuracy: 0.00% -> 86.96%  
client [73] (testset)   loss: 0.6440 -> 74.3594 accuracy: 84.21% -> 10.53%     
client [40] (testset)   loss: 65.5183 -> 7.0907 accuracy: 21.74% -> 23.91%     
client [76] (testset)   loss: 9.4215 -> 4.3009  accuracy: 13.89% -> 36.11%     
---------------------------- TRAINING EPOCH: 310 ----------------------------  
client [31] (testset)   loss: 9.9861 -> 31.8316 accuracy: 22.22% -> 2.78%      
client [89] (testset)   loss: 25.9736 -> 4.7774 accuracy: 10.94% -> 62.50%     
client [77] (testset)   loss: 7.3465 -> 3.3264  accuracy: 41.67% -> 48.33%     
client [90] (testset)   loss: 1.9737 -> 99.7487 accuracy: 59.09% -> 20.45%     
client [26] (testset)   loss: 106.1444 -> 2.9626    accuracy: 10.53% -> 57.89% 
client [50] (testset)   loss: 3.3542 -> 4.7278  accuracy: 49.35% -> 37.66%     
client [30] (testset)   loss: 6.9791 -> 65.3818 accuracy: 31.82% -> 16.67%     
client [70] (testset)   loss: 59.7978 -> 11.0619    accuracy: 9.38% -> 31.25%  
client [41] (testset)   loss: 14.1509 -> 46.4815    accuracy: 25.00% -> 1.92%  
client [99] (testset)   loss: 62.9177 -> 152.3435   accuracy: 7.69% -> 7.69%   
---------------------------- TRAINING EPOCH: 320 ----------------------------  
client [68] (testset)   loss: 6.3407 -> 2.5872  accuracy: 44.44% -> 55.56%     
client [70] (testset)   loss: 4.7786 -> 1145.8298   accuracy: 43.75% -> 25.00% 
client [52] (testset)   loss: 1970.1575 -> 59.9257  accuracy: 0.00% -> 0.00%   
client [1]  (testset)   loss: 59.0405 -> 301.5725   accuracy: 0.00% -> 12.50%  
client [2]  (testset)   loss: 243.6247 -> 31.0158   accuracy: 9.64% -> 0.00%   
client [67] (testset)   loss: 37.3041 -> 52.6775    accuracy: 1.75% -> 3.51%   
client [92] (testset)   loss: 59.7602 -> 20.0060    accuracy: 5.88% -> 5.88%   
client [35] (testset)   loss: 12.8154 -> 63.0815    accuracy: 27.78% -> 5.56%  
client [36] (testset)   loss: 62.5987 -> 5.3981 accuracy: 6.12% -> 42.86%      
client [64] (testset)   loss: 9.8772 -> 46.5383 accuracy: 32.86% -> 22.86%     
---------------------------- TRAINING EPOCH: 330 ----------------------------  
client [44] (testset)   loss: 28.1882 -> 6.0548 accuracy: 5.36% -> 41.07%      
client [6]  (testset)   loss: 7.3255 -> 6.6888  accuracy: 26.15% -> 44.62%     
client [12] (testset)   loss: 10.2311 -> 5.7689 accuracy: 22.03% -> 27.12%     
client [55] (testset)   loss: 3.4823 -> 43.9506 accuracy: 39.34% -> 18.03%     
client [29] (testset)   loss: 35.0127 -> 6.6664 accuracy: 14.29% -> 61.04%     
client [9]  (testset)   loss: 18.4460 -> 6.3574 accuracy: 17.78% -> 26.67%     
client [43] (testset)   loss: 5.4491 -> 23.0212 accuracy: 26.32% -> 13.16%     
client [77] (testset)   loss: 35.0401 -> 64.3432    accuracy: 5.00% -> 30.00%  
client [98] (testset)   loss: 94.6988 -> 48.7043    accuracy: 1.89% -> 1.89%   
client [78] (testset)   loss: 63.4014 -> 24.6451    accuracy: 6.06% -> 28.79%  
---------------------------- TRAINING EPOCH: 340 ----------------------------  
client [92] (testset)   loss: 108.5716 -> 35.3373   accuracy: 2.94% -> 4.41%   
client [80] (testset)   loss: 24.9591 -> 8.3469 accuracy: 5.45% -> 16.36%      
client [63] (testset)   loss: 7.8572 -> 2.5185  accuracy: 20.00% -> 60.00%     
client [76] (testset)   loss: 1.8070 -> 21.4331 accuracy: 69.44% -> 19.44%     
client [78] (testset)   loss: 19.6469 -> 21.6431    accuracy: 21.21% -> 21.21% 
client [25] (testset)   loss: 27.8554 -> 10.6855    accuracy: 8.00% -> 12.00%  
client [58] (testset)   loss: 7.1181 -> 18.9658 accuracy: 27.40% -> 23.29%     
client [13] (testset)   loss: 22.0199 -> 12.5057    accuracy: 16.67% -> 22.22% 
client [17] (testset)   loss: 16.6558 -> 34.7078    accuracy: 14.00% -> 2.00%  
client [38] (testset)   loss: 29.3934 -> 14.1110    accuracy: 16.22% -> 16.22% 
---------------------------- TRAINING EPOCH: 350 ----------------------------  
client [72] (testset)   loss: 89.5851 -> 23.4163    accuracy: 0.00% -> 14.81%  
client [82] (testset)   loss: 33.1753 -> 103.2194   accuracy: 17.91% -> 23.88% 
client [86] (testset)   loss: 95.3323 -> 10.2010    accuracy: 21.88% -> 29.69% 
client [51] (testset)   loss: 8.0735 -> 22.3021 accuracy: 37.11% -> 1.03%      
client [96] (testset)   loss: 27.6245 -> 12.8558    accuracy: 1.79% -> 23.21%  
client [42] (testset)   loss: 13.3385 -> 4.8018 accuracy: 39.29% -> 44.64%     
client [55] (testset)   loss: 6.0189 -> 3.9745  accuracy: 22.95% -> 47.54%     
client [13] (testset)   loss: 4.1271 -> 158.6906    accuracy: 55.56% -> 11.11% 
client [1]  (testset)   loss: 157.3457 -> 66.5366   accuracy: 8.33% -> 0.00%   
client [12] (testset)   loss: 69.9406 -> 32.6723    accuracy: 0.00% -> 22.03%  
---------------------------- TRAINING EPOCH: 360 ----------------------------  
client [68] (testset)   loss: 441.4042 -> 8.1541    accuracy: 13.33% -> 48.89% 
client [23] (testset)   loss: 15.9244 -> 14.0134    accuracy: 26.47% -> 8.82%  
client [46] (testset)   loss: 13.2509 -> 12.1338    accuracy: 2.13% -> 10.64%  
client [41] (testset)   loss: 12.6434 -> 58.1910    accuracy: 21.15% -> 3.85%  
client [25] (testset)   loss: 40.3872 -> 21.6846    accuracy: 14.00% -> 34.00% 
client [58] (testset)   loss: 36.7924 -> 7.0962 accuracy: 9.59% -> 58.90%      
client [14] (testset)   loss: 6.1818 -> 18.4329 accuracy: 56.52% -> 17.39%     
client [33] (testset)   loss: 18.4767 -> 30.0063    accuracy: 6.67% -> 22.22%  
client [85] (testset)   loss: 57.6692 -> 38.1650    accuracy: 4.00% -> 1.33%   
client [62] (testset)   loss: 36.0407 -> 19.2326    accuracy: 3.45% -> 17.24%  
---------------------------- TRAINING EPOCH: 370 ----------------------------  
client [98] (testset)   loss: 28.9654 -> 30.8211    accuracy: 3.77% -> 5.66%   
client [63] (testset)   loss: 25.8080 -> 11.7828    accuracy: 16.67% -> 15.00% 
client [70] (testset)   loss: 12.9413 -> 118.6477   accuracy: 18.75% -> 25.00% 
client [65] (testset)   loss: 104.9394 -> 13.4730   accuracy: 9.43% -> 5.66%   
client [14] (testset)   loss: 7.5594 -> 48.5093 accuracy: 31.88% -> 24.64%     
client [73] (testset)   loss: 33.6417 -> 52.9083    accuracy: 33.33% -> 10.53% 
client [34] (testset)   loss: 47.4644 -> 72.3197    accuracy: 11.48% -> 8.20%  
client [99] (testset)   loss: 47.1689 -> 22.9855    accuracy: 15.38% -> 17.95% 
client [69] (testset)   loss: 15.3249 -> 32.4273    accuracy: 31.37% -> 17.65% 
client [46] (testset)   loss: 32.2242 -> 4.3255 accuracy: 4.26% -> 46.81%      
---------------------------- TRAINING EPOCH: 380 ----------------------------  
client [99] (testset)   loss: 8.5892 -> 16.6592 accuracy: 30.77% -> 20.51%     
client [93] (testset)   loss: 11.4318 -> 9.9304 accuracy: 23.91% -> 23.91%     
client [11] (testset)   loss: 6.5585 -> 12.6190 accuracy: 39.29% -> 32.14%     
client [58] (testset)   loss: 16.5729 -> 25.4391    accuracy: 9.59% -> 20.55%  
client [81] (testset)   loss: 14.7775 -> 17.1871    accuracy: 16.22% -> 8.11%  
client [85] (testset)   loss: 21.0458 -> 39.3799    accuracy: 4.00% -> 16.00%  
client [89] (testset)   loss: 57.8661 -> 117.1770   accuracy: 9.38% -> 12.50%  
client [45] (testset)   loss: 123.2419 -> 12.5639   accuracy: 17.39% -> 4.35%  
client [8]  (testset)   loss: 10.2256 -> 32.1026    accuracy: 21.67% -> 34.17% 
client [68] (testset)   loss: 18.6812 -> 21.2091    accuracy: 44.44% -> 40.00% 
---------------------------- TRAINING EPOCH: 390 ----------------------------  
client [67] (testset)   loss: 16.0258 -> 254.7896   accuracy: 19.30% -> 0.00%  
client [72] (testset)   loss: 202.2781 -> 5.2750    accuracy: 3.70% -> 33.33%  
client [1]  (testset)   loss: 9.3343 -> 28.2827 accuracy: 37.50% -> 12.50%     
client [78] (testset)   loss: 24.6596 -> 25.7859    accuracy: 7.58% -> 25.76%  
client [83] (testset)   loss: 33.3943 -> 26.7897    accuracy: 13.04% -> 4.35%  
client [21] (testset)   loss: 21.0900 -> 16.1530    accuracy: 3.51% -> 26.32%  
client [56] (testset)   loss: 19.9093 -> 1.6324 accuracy: 16.36% -> 74.55%     
client [44] (testset)   loss: 4.6593 -> 3.0191  accuracy: 50.00% -> 51.79%     
client [92] (testset)   loss: 2.0945 -> 1.9358  accuracy: 60.29% -> 60.29%     
client [27] (testset)   loss: 3.3633 -> 7.9604  accuracy: 43.75% -> 20.00%     
---------------------------- TRAINING EPOCH: 400 ----------------------------  
client [10] (testset)   loss: 129.4985 -> 38.1379   accuracy: 0.00% -> 11.11%  
client [39] (testset)   loss: 29.8880 -> 0.4873 accuracy: 11.32% -> 87.74%     
client [65] (testset)   loss: 0.9541 -> 474.8569    accuracy: 83.02% -> 3.77%  
client [26] (testset)   loss: 340.6264 -> 64.3187   accuracy: 17.54% -> 3.51%  
client [19] (testset)   loss: 63.9166 -> 208.8499   accuracy: 5.36% -> 3.57%   
client [68] (testset)   loss: 198.2892 -> 60.7863   accuracy: 4.44% -> 4.44%   
client [41] (testset)   loss: 72.3225 -> 39.5928    accuracy: 9.62% -> 13.46%  
client [50] (testset)   loss: 39.5373 -> 48.0035    accuracy: 15.58% -> 9.09%  
client [75] (testset)   loss: 51.7175 -> 780.8121   accuracy: 3.70% -> 22.22%  
client [81] (testset)   loss: 478.8866 -> 31.4399   accuracy: 35.14% -> 17.57% 
Training... ---------------------------------------- 100% 0:06:54
PSFL's average time taken by each global epoch: 0 min 1.02 sec.                
PSFL's total running time: 0 h 6 m 54 s.                                       
==================== PSFL Experiment Results: ====================             
Display format: (before local fine-tuning) -> (after local fine-tuning)        
 So if finetune_epoch = 0, x.xx% -> 0.00% is normal.                           
 Centralized testing ONLY happens after model aggregation, so the stats between
'->' are the same.                                                             
{                                                                              
    "100": {                                                                   
        "all_clients": {                                                       
            "test": {                                                          
                "loss": "145.7955 -> 0.0000",                                  
                "accuracy": "9.26% -> 0.00%"                                   
            }                                                                  
        }                                                                      
    },                                                                         
    "200": {                                                                   
        "all_clients": {                                                       
            "test": {                                                          
                "loss": "8.8002 -> 0.0000",                                    
                "accuracy": "27.45% -> 0.00%"                                  
            }                                                                  
        }                                                                      
    },                                                                         
    "300": {                                                                   
        "all_clients": {                                                       
            "test": {                                                          
                "loss": "6.0298 -> 0.0000",                                    
                "accuracy": "25.63% -> 0.00%"                                  
            }                                                                  
        }                                                                      
    },                                                                         
    "400": {                                                                   
        "all_clients": {                                                       
            "test": {                                                          
                "loss": "60.5780 -> 0.0000",                                   
                "accuracy": "10.74% -> 0.00%"                                  
            }                                                                  
        }                                                                      
    }                                                                          
}                                                                              
==================== PSFL Max Accuracy ====================                    
all_clients:                                                                   
(test) before fine-tuning: 27.45% at epoch 200                                 
(test) after fine-tuning: 0.00% at epoch 100                                   
[0m