==================== PSFL ====================                                 
Experiment Arguments:                                                          
{
│   'method': 'psfl',
│   'dataset': {
│   │   'name': 'mnist',
│   │   'client_num': 100,
│   │   'test_ratio': 0.25,
│   │   'val_ratio': 0.0,
│   │   'seed': 42,
│   │   'split': 'sample',
│   │   'IID_ratio': 0.0,
│   │   'monitor_window_name_suffix': 'mnist-100clients-0%IID-Dir(1.0)-seed42',
│   │   'alpha': 1.0,
│   │   'min_samples_per_client': 10
│   },
│   'model': {
│   │   'name': 'avgcnn',
│   │   'use_torchvision_pretrained_weights': True,
│   │   'external_model_weights_path': None
│   },
│   'optimizer': {
│   │   'lr': 0.01,
│   │   'dampening': 0,
│   │   'weight_decay': 0,
│   │   'momentum': 0,
│   │   'nesterov': False,
│   │   'name': 'sgd'
│   },
│   'mode': 'sequential',
│   'parallel': {
│   │   'ray_cluster_addr': None,
│   │   'num_cpus': None,
│   │   'num_gpus': None,
│   │   'num_workers': 2
│   },
│   'common': {
│   │   'seed': 42,
│   │   'join_ratio': 0.1,
│   │   'global_epoch': 400,
│   │   'local_epoch': 5,
│   │   'batch_size': 32,
│   │   'reset_optimizer_on_global_epoch': True,
│   │   'straggler_ratio': 0,
│   │   'straggler_min_local_epoch': 0,
│   │   'buffers': 'global',
│   │   'client_side_evaluation': True,
│   │   'test': {
│   │   │   'client': {
│   │   │   │   'interval': 100,
│   │   │   │   'finetune_epoch': 0,
│   │   │   │   'train': False,
│   │   │   │   'val': False,
│   │   │   │   'test': True
│   │   │   },
│   │   │   'server': {
│   │   │   │   'interval': -1,
│   │   │   │   'train': False,
│   │   │   │   'val': False,
│   │   │   │   'test': False,
│   │   │   │   'model_in_train_mode': False
│   │   │   }
│   │   },
│   │   'verbose_gap': 10,
│   │   'monitor': None,
│   │   'use_cuda': True,
│   │   'save_log': True,
│   │   'save_model': False,
│   │   'save_learning_curve_plot': False,
│   │   'save_metrics': True,
│   │   'delete_useless_run': True
│   },
│   'psfl': {
│   │   'alpha': 0.0,
│   │   'CLS': False,
│   │   'ig_ratio': 0.999999,
│   │   'track': False
│   }
}
---------------------------- TRAINING EPOCH: 10 ----------------------------   
client [77] (testset)   loss: 0.1402 -> 0.0552  accuracy: 96.79% -> 98.39%     
client [81] (testset)   loss: 0.2144 -> 0.1338  accuracy: 95.45% -> 98.18%     
client [21] (testset)   loss: 0.0920 -> 0.0263  accuracy: 98.23% -> 99.12%     
client [68] (testset)   loss: 0.0554 -> 0.0129  accuracy: 98.33% -> 99.44%     
client [93] (testset)   loss: 0.0817 -> 0.0464  accuracy: 96.83% -> 98.02%     
client [31] (testset)   loss: 0.1097 -> 0.0532  accuracy: 96.43% -> 99.11%     
client [20] (testset)   loss: 0.1089 -> 0.0517  accuracy: 96.49% -> 98.25%     
client [59] (testset)   loss: 0.0425 -> 0.0559  accuracy: 97.92% -> 97.92%     
client [48] (testset)   loss: 0.0596 -> 0.0289  accuracy: 97.87% -> 99.29%     
client [34] (testset)   loss: 0.0469 -> 0.0513  accuracy: 98.65% -> 97.97%     
---------------------------- TRAINING EPOCH: 20 ----------------------------   
client [69] (testset)   loss: 0.0322 -> 0.0256  accuracy: 99.40% -> 98.19%     
client [99] (testset)   loss: 0.0961 -> 0.0594  accuracy: 97.21% -> 97.77%     
client [67] (testset)   loss: 0.0453 -> 0.0424  accuracy: 99.15% -> 99.15%     
client [0]  (testset)   loss: 0.0382 -> 0.0369  accuracy: 98.48% -> 98.99%     
client [76] (testset)   loss: 0.0023 -> 0.0022  accuracy: 100.00% -> 100.00%   
client [41] (testset)   loss: 0.0293 -> 0.0300  accuracy: 99.40% -> 99.40%     
client [62] (testset)   loss: 0.0528 -> 0.0254  accuracy: 98.38% -> 99.46%     
client [2]  (testset)   loss: 0.0667 -> 0.0580  accuracy: 97.64% -> 98.43%     
client [14] (testset)   loss: 0.1777 -> 0.1530  accuracy: 96.39% -> 96.39%     
client [46] (testset)   loss: 0.0328 -> 0.0141  accuracy: 98.50% -> 99.25%     
---------------------------- TRAINING EPOCH: 30 ----------------------------   
client [24] (testset)   loss: 0.0234 -> 0.0214  accuracy: 99.12% -> 99.12%     
client [68] (testset)   loss: 0.0270 -> 0.0042  accuracy: 98.89% -> 100.00%    
client [57] (testset)   loss: 0.1411 -> 0.0969  accuracy: 96.77% -> 98.16%     
client [17] (testset)   loss: 0.0612 -> 0.0306  accuracy: 97.82% -> 99.13%     
client [54] (testset)   loss: 0.0870 -> 0.0792  accuracy: 97.19% -> 98.88%     
client [23] (testset)   loss: 0.0538 -> 0.0504  accuracy: 98.92% -> 98.92%     
client [35] (testset)   loss: 0.0128 -> 0.0058  accuracy: 100.00% -> 100.00%   
client [59] (testset)   loss: 0.0214 -> 0.0346  accuracy: 98.96% -> 98.96%     
client [31] (testset)   loss: 0.0517 -> 0.0506  accuracy: 98.21% -> 98.21%     
client [9]  (testset)   loss: 0.0208 -> 0.0091  accuracy: 99.07% -> 100.00%    
---------------------------- TRAINING EPOCH: 40 ----------------------------   
client [64] (testset)   loss: 0.0268 -> 0.0119  accuracy: 98.34% -> 99.59%     
client [33] (testset)   loss: 0.0167 -> 0.0280  accuracy: 98.58% -> 99.29%     
client [16] (testset)   loss: 0.0558 -> 0.0471  accuracy: 97.72% -> 98.17%     
client [44] (testset)   loss: 0.2171 -> 0.1845  accuracy: 98.80% -> 99.40%     
client [8]  (testset)   loss: 0.0611 -> 0.0571  accuracy: 98.78% -> 98.78%     
client [31] (testset)   loss: 0.0410 -> 0.0391  accuracy: 98.21% -> 99.11%     
client [47] (testset)   loss: 0.0103 -> 0.0200  accuracy: 100.00% -> 99.19%    
client [36] (testset)   loss: 0.0036 -> 0.0200  accuracy: 100.00% -> 99.45%    
client [20] (testset)   loss: 0.0560 -> 0.0202  accuracy: 98.25% -> 99.12%     
client [56] (testset)   loss: 0.0107 -> 0.0119  accuracy: 98.95% -> 99.47%     
---------------------------- TRAINING EPOCH: 50 ----------------------------   
client [4]  (testset)   loss: 0.1624 -> 0.1458  accuracy: 97.71% -> 97.14%     
client [60] (testset)   loss: 0.0126 -> 0.0075  accuracy: 98.91% -> 100.00%    
client [28] (testset)   loss: 0.0091 -> 0.0128  accuracy: 99.27% -> 99.27%     
client [25] (testset)   loss: 0.1086 -> 0.0616  accuracy: 98.10% -> 98.58%     
client [58] (testset)   loss: 0.0133 -> 0.0145  accuracy: 98.97% -> 99.49%     
client [44] (testset)   loss: 0.2560 -> 0.2171  accuracy: 97.59% -> 98.80%     
client [39] (testset)   loss: 0.0084 -> 0.0119  accuracy: 99.45% -> 99.45%     
client [29] (testset)   loss: 0.0602 -> 0.0167  accuracy: 98.26% -> 99.13%     
client [3]  (testset)   loss: 0.0657 -> 0.0769  accuracy: 97.39% -> 97.83%     
client [84] (testset)   loss: 0.0147 -> 0.0115  accuracy: 99.41% -> 99.41%     
---------------------------- TRAINING EPOCH: 60 ----------------------------   
client [21] (testset)   loss: 0.0202 -> 0.0159  accuracy: 99.12% -> 99.12%     
client [84] (testset)   loss: 0.0071 -> 0.0097  accuracy: 99.41% -> 99.41%     
client [10] (testset)   loss: 0.0590 -> 0.0641  accuracy: 98.68% -> 99.34%     
client [36] (testset)   loss: 0.0067 -> 0.0258  accuracy: 100.00% -> 98.91%    
client [65] (testset)   loss: 0.0514 -> 0.0544  accuracy: 98.24% -> 98.24%     
client [81] (testset)   loss: 0.1109 -> 0.1321  accuracy: 98.18% -> 97.27%     
client [79] (testset)   loss: 0.0464 -> 0.0144  accuracy: 98.57% -> 99.64%     
client [42] (testset)   loss: 0.0384 -> 0.0293  accuracy: 98.25% -> 99.12%     
client [11] (testset)   loss: 0.0162 -> 0.0138  accuracy: 98.97% -> 99.48%     
client [96] (testset)   loss: 0.1207 -> 0.0488  accuracy: 97.13% -> 99.04%     
---------------------------- TRAINING EPOCH: 70 ----------------------------   
client [8]  (testset)   loss: 0.0312 -> 0.0366  accuracy: 98.78% -> 98.78%     
client [53] (testset)   loss: 0.0445 -> 0.0190  accuracy: 97.32% -> 99.11%     
client [52] (testset)   loss: 0.0009 -> 0.0003  accuracy: 100.00% -> 100.00%   
client [42] (testset)   loss: 0.0157 -> 0.0117  accuracy: 99.12% -> 99.12%     
client [69] (testset)   loss: 0.0328 -> 0.0146  accuracy: 98.19% -> 99.40%     
client [59] (testset)   loss: 0.0155 -> 0.0187  accuracy: 98.96% -> 98.96%     
client [7]  (testset)   loss: 0.0489 -> 0.0250  accuracy: 98.81% -> 99.40%     
client [26] (testset)   loss: 0.0189 -> 0.0082  accuracy: 98.73% -> 100.00%    
client [49] (testset)   loss: 0.0490 -> 0.0278  accuracy: 98.77% -> 98.77%     
client [98] (testset)   loss: 0.0039 -> 0.0084  accuracy: 100.00% -> 99.19%    
---------------------------- TRAINING EPOCH: 80 ----------------------------   
client [98] (testset)   loss: 0.0005 -> 0.0006  accuracy: 100.00% -> 100.00%   
client [47] (testset)   loss: 0.0047 -> 0.0079  accuracy: 100.00% -> 99.60%    
client [21] (testset)   loss: 0.0262 -> 0.0358  accuracy: 99.12% -> 99.12%     
client [77] (testset)   loss: 0.0511 -> 0.0336  accuracy: 98.80% -> 99.20%     
client [95] (testset)   loss: 0.0667 -> 0.0470  accuracy: 98.05% -> 98.05%     
client [91] (testset)   loss: 0.0170 -> 0.0160  accuracy: 99.00% -> 99.00%     
client [14] (testset)   loss: 0.2140 -> 0.2078  accuracy: 97.59% -> 96.39%     
client [99] (testset)   loss: 0.0209 -> 0.0164  accuracy: 99.44% -> 99.44%     
client [20] (testset)   loss: 0.0402 -> 0.0321  accuracy: 98.68% -> 99.12%     
client [39] (testset)   loss: 0.0079 -> 0.0114  accuracy: 99.45% -> 99.45%     
---------------------------- TRAINING EPOCH: 90 ----------------------------   
client [52] (testset)   loss: 0.0011 -> 0.0007  accuracy: 100.00% -> 100.00%   
client [62] (testset)   loss: 0.0325 -> 0.0139  accuracy: 99.46% -> 99.46%     
client [71] (testset)   loss: 0.1034 -> 0.0921  accuracy: 97.38% -> 97.38%     
client [97] (testset)   loss: 0.0225 -> 0.0116  accuracy: 99.33% -> 99.33%     
client [30] (testset)   loss: 0.0465 -> 0.0393  accuracy: 98.67% -> 99.11%     
client [88] (testset)   loss: 0.0569 -> 0.0532  accuracy: 97.92% -> 98.27%     
client [60] (testset)   loss: 0.0108 -> 0.0088  accuracy: 98.91% -> 99.64%     
client [82] (testset)   loss: 0.0319 -> 0.0304  accuracy: 98.97% -> 98.97%     
client [91] (testset)   loss: 0.0084 -> 0.0091  accuracy: 100.00% -> 100.00%   
client [57] (testset)   loss: 0.1257 -> 0.1165  accuracy: 97.70% -> 98.16%     
---------------------------- TRAINING EPOCH: 100 ----------------------------  
client [31] (testset)   loss: 0.0674 -> 0.0631  accuracy: 97.32% -> 97.32%     
client [15] (testset)   loss: 0.0558 -> 0.0561  accuracy: 98.52% -> 98.52%     
client [71] (testset)   loss: 0.0849 -> 0.0826  accuracy: 97.91% -> 97.91%     
client [97] (testset)   loss: 0.0223 -> 0.0188  accuracy: 99.33% -> 99.33%     
client [53] (testset)   loss: 0.0476 -> 0.0204  accuracy: 98.21% -> 99.11%     
client [77] (testset)   loss: 0.0464 -> 0.0277  accuracy: 98.80% -> 99.20%     
client [76] (testset)   loss: 0.0000 -> 0.0000  accuracy: 100.00% -> 100.00%   
client [79] (testset)   loss: 0.0143 -> 0.0120  accuracy: 99.28% -> 99.64%     
client [28] (testset)   loss: 0.0419 -> 0.0169  accuracy: 98.54% -> 99.27%     
client [99] (testset)   loss: 0.0491 -> 0.0131  accuracy: 97.77% -> 99.44%     
---------------------------- TRAINING EPOCH: 110 ----------------------------  
client [97] (testset)   loss: 0.0400 -> 0.0201  accuracy: 98.66% -> 99.33%     
client [86] (testset)   loss: 0.0090 -> 0.0030  accuracy: 100.00% -> 100.00%   
client [34] (testset)   loss: 0.0103 -> 0.0047  accuracy: 99.32% -> 100.00%    
client [73] (testset)   loss: 0.1459 -> 0.1453  accuracy: 98.33% -> 97.92%     
client [5]  (testset)   loss: 0.0565 -> 0.0274  accuracy: 98.77% -> 99.38%     
client [96] (testset)   loss: 0.0982 -> 0.0799  accuracy: 98.09% -> 98.09%     
client [22] (testset)   loss: 0.0875 -> 0.0708  accuracy: 99.09% -> 99.09%     
client [60] (testset)   loss: 0.0080 -> 0.0060  accuracy: 99.28% -> 100.00%    
client [66] (testset)   loss: 0.1336 -> 0.1061  accuracy: 98.45% -> 98.45%     
client [83] (testset)   loss: 0.0596 -> 0.0473  accuracy: 98.56% -> 98.56%     
---------------------------- TRAINING EPOCH: 120 ----------------------------  
client [76] (testset)   loss: 0.0000 -> 0.0000  accuracy: 100.00% -> 100.00%   
client [65] (testset)   loss: 0.0159 -> 0.0236  accuracy: 99.41% -> 98.82%     
client [95] (testset)   loss: 0.0641 -> 0.0345  accuracy: 98.54% -> 98.54%     
client [17] (testset)   loss: 0.0484 -> 0.0389  accuracy: 98.69% -> 99.13%     
client [8]  (testset)   loss: 0.0904 -> 0.0895  accuracy: 98.78% -> 98.78%     
client [35] (testset)   loss: 0.0151 -> 0.0091  accuracy: 99.40% -> 99.40%     
client [98] (testset)   loss: 0.0061 -> 0.0163  accuracy: 100.00% -> 99.19%    
client [53] (testset)   loss: 0.0168 -> 0.0092  accuracy: 99.11% -> 100.00%    
client [43] (testset)   loss: 0.0125 -> 0.0069  accuracy: 99.10% -> 100.00%    
client [64] (testset)   loss: 0.0237 -> 0.0154  accuracy: 98.76% -> 98.76%     
---------------------------- TRAINING EPOCH: 130 ----------------------------  
client [21] (testset)   loss: 0.0736 -> 0.0402  accuracy: 98.23% -> 99.12%     
client [88] (testset)   loss: 0.0498 -> 0.0473  accuracy: 98.62% -> 98.62%     
client [38] (testset)   loss: 0.0160 -> 0.0318  accuracy: 99.51% -> 99.51%     
client [3]  (testset)   loss: 0.0820 -> 0.0666  accuracy: 97.83% -> 97.83%     
client [5]  (testset)   loss: 0.0038 -> 0.0110  accuracy: 100.00% -> 99.38%    
client [41] (testset)   loss: 0.0092 -> 0.0267  accuracy: 100.00% -> 98.81%    
client [7]  (testset)   loss: 0.0303 -> 0.0112  accuracy: 98.21% -> 99.40%     
client [37] (testset)   loss: 0.0561 -> 0.0540  accuracy: 99.14% -> 98.71%     
client [45] (testset)   loss: 0.0348 -> 0.0474  accuracy: 99.23% -> 98.85%     
client [47] (testset)   loss: 0.0071 -> 0.0165  accuracy: 99.60% -> 99.60%     
---------------------------- TRAINING EPOCH: 140 ----------------------------  
client [16] (testset)   loss: 0.0898 -> 0.0665  accuracy: 98.63% -> 98.63%     
client [11] (testset)   loss: 0.1020 -> 0.0582  accuracy: 96.91% -> 97.94%     
client [37] (testset)   loss: 0.0571 -> 0.0435  accuracy: 99.14% -> 98.28%     
client [41] (testset)   loss: 0.0122 -> 0.0226  accuracy: 99.40% -> 98.81%     
client [95] (testset)   loss: 0.0628 -> 0.0408  accuracy: 98.05% -> 98.05%     
client [53] (testset)   loss: 0.0383 -> 0.0442  accuracy: 98.21% -> 99.11%     
client [22] (testset)   loss: 0.0571 -> 0.0526  accuracy: 98.63% -> 99.09%     
client [25] (testset)   loss: 0.0721 -> 0.0658  accuracy: 98.58% -> 98.58%     
client [69] (testset)   loss: 0.0121 -> 0.0119  accuracy: 99.40% -> 98.80%     
client [46] (testset)   loss: 0.0062 -> 0.0047  accuracy: 99.25% -> 100.00%    
---------------------------- TRAINING EPOCH: 150 ----------------------------  
client [47] (testset)   loss: 0.0031 -> 0.0043  accuracy: 100.00% -> 100.00%   
client [69] (testset)   loss: 0.0160 -> 0.0063  accuracy: 99.40% -> 100.00%    
client [82] (testset)   loss: 0.0284 -> 0.0248  accuracy: 98.97% -> 98.97%     
client [45] (testset)   loss: 0.0466 -> 0.0503  accuracy: 99.62% -> 99.23%     
client [7]  (testset)   loss: 0.0602 -> 0.0281  accuracy: 99.40% -> 99.40%     
client [50] (testset)   loss: 0.0741 -> 0.0454  accuracy: 98.59% -> 99.30%     
client [35] (testset)   loss: 0.0099 -> 0.0057  accuracy: 99.40% -> 99.40%     
client [24] (testset)   loss: 0.0323 -> 0.0268  accuracy: 99.12% -> 99.12%     
client [15] (testset)   loss: 0.0582 -> 0.0631  accuracy: 98.52% -> 98.52%     
client [58] (testset)   loss: 0.0015 -> 0.0035  accuracy: 100.00% -> 100.00%   
---------------------------- TRAINING EPOCH: 160 ----------------------------  
client [48] (testset)   loss: 0.0111 -> 0.0087  accuracy: 100.00% -> 100.00%   
client [76] (testset)   loss: 0.0000 -> 0.0000  accuracy: 100.00% -> 100.00%   
client [67] (testset)   loss: 0.0301 -> 0.0188  accuracy: 98.29% -> 98.29%     
client [37] (testset)   loss: 0.0415 -> 0.0424  accuracy: 98.28% -> 98.28%     
client [58] (testset)   loss: 0.0046 -> 0.0066  accuracy: 100.00% -> 100.00%   
client [64] (testset)   loss: 0.0017 -> 0.0012  accuracy: 100.00% -> 100.00%   
client [77] (testset)   loss: 0.0524 -> 0.0313  accuracy: 98.80% -> 99.20%     
client [55] (testset)   loss: 0.0524 -> 0.0220  accuracy: 96.97% -> 97.98%     
client [12] (testset)   loss: 0.0055 -> 0.0015  accuracy: 99.47% -> 100.00%    
client [89] (testset)   loss: 0.1499 -> 0.1374  accuracy: 97.35% -> 98.23%     
---------------------------- TRAINING EPOCH: 170 ----------------------------  
client [84] (testset)   loss: 0.0170 -> 0.0153  accuracy: 99.41% -> 99.41%     
client [51] (testset)   loss: 0.0092 -> 0.0086  accuracy: 99.53% -> 99.53%     
client [8]  (testset)   loss: 0.0375 -> 0.0317  accuracy: 98.17% -> 98.78%     
client [18] (testset)   loss: 0.0008 -> 0.0004  accuracy: 100.00% -> 100.00%   
client [94] (testset)   loss: 0.0684 -> 0.0641  accuracy: 99.22% -> 99.22%     
client [81] (testset)   loss: 0.1747 -> 0.1810  accuracy: 98.18% -> 97.27%     
client [3]  (testset)   loss: 0.0745 -> 0.0699  accuracy: 97.39% -> 97.39%     
client [11] (testset)   loss: 0.0219 -> 0.0208  accuracy: 98.45% -> 98.45%     
client [95] (testset)   loss: 0.0753 -> 0.0452  accuracy: 98.05% -> 98.05%     
client [67] (testset)   loss: 0.0168 -> 0.0133  accuracy: 99.15% -> 99.15%     
---------------------------- TRAINING EPOCH: 180 ----------------------------  
client [21] (testset)   loss: 0.0640 -> 0.0478  accuracy: 99.12% -> 99.12%     
client [79] (testset)   loss: 0.0316 -> 0.0181  accuracy: 99.28% -> 99.28%     
client [58] (testset)   loss: 0.0124 -> 0.0102  accuracy: 99.49% -> 99.49%     
client [88] (testset)   loss: 0.0547 -> 0.0497  accuracy: 98.62% -> 98.96%     
client [46] (testset)   loss: 0.0234 -> 0.0205  accuracy: 99.25% -> 99.25%     
client [11] (testset)   loss: 0.0353 -> 0.0257  accuracy: 99.48% -> 98.97%     
client [55] (testset)   loss: 0.0381 -> 0.0368  accuracy: 98.99% -> 98.99%     
client [13] (testset)   loss: 0.1639 -> 0.1841  accuracy: 96.80% -> 96.00%     
client [31] (testset)   loss: 0.0453 -> 0.0501  accuracy: 98.21% -> 98.21%     
client [75] (testset)   loss: 0.0162 -> 0.0148  accuracy: 98.94% -> 98.94%     
---------------------------- TRAINING EPOCH: 190 ----------------------------  
client [19] (testset)   loss: 0.0102 -> 0.0057  accuracy: 99.41% -> 100.00%    
client [7]  (testset)   loss: 0.0378 -> 0.0329  accuracy: 98.81% -> 98.81%     
client [57] (testset)   loss: 0.1290 -> 0.1278  accuracy: 97.70% -> 97.70%     
client [13] (testset)   loss: 0.1684 -> 0.1705  accuracy: 96.00% -> 96.00%     
client [43] (testset)   loss: 0.0207 -> 0.0178  accuracy: 99.10% -> 99.10%     
client [91] (testset)   loss: 0.0037 -> 0.0043  accuracy: 100.00% -> 100.00%   
client [10] (testset)   loss: 0.0723 -> 0.0823  accuracy: 99.34% -> 99.34%     
client [64] (testset)   loss: 0.0082 -> 0.0058  accuracy: 99.59% -> 100.00%    
client [82] (testset)   loss: 0.0325 -> 0.0315  accuracy: 98.97% -> 98.97%     
client [22] (testset)   loss: 0.0699 -> 0.0672  accuracy: 99.09% -> 99.09%     
---------------------------- TRAINING EPOCH: 200 ----------------------------  
client [20] (testset)   loss: 0.0555 -> 0.0434  accuracy: 98.68% -> 98.68%     
client [23] (testset)   loss: 0.0870 -> 0.0786  accuracy: 98.92% -> 98.92%     
client [88] (testset)   loss: 0.0469 -> 0.0487  accuracy: 98.96% -> 98.96%     
client [98] (testset)   loss: 0.0004 -> 0.0004  accuracy: 100.00% -> 100.00%   
client [79] (testset)   loss: 0.0222 -> 0.0131  accuracy: 99.28% -> 99.28%     
client [21] (testset)   loss: 0.0346 -> 0.0261  accuracy: 99.12% -> 99.12%     
client [92] (testset)   loss: 0.1338 -> 0.1370  accuracy: 98.08% -> 98.08%     
client [56] (testset)   loss: 0.0022 -> 0.0011  accuracy: 100.00% -> 100.00%   
client [5]  (testset)   loss: 0.0328 -> 0.0217  accuracy: 98.77% -> 99.38%     
client [52] (testset)   loss: 0.0013 -> 0.0005  accuracy: 100.00% -> 100.00%   
---------------------------- TRAINING EPOCH: 210 ----------------------------  
client [67] (testset)   loss: 0.0310 -> 0.0294  accuracy: 99.15% -> 99.15%     
client [54] (testset)   loss: 0.1164 -> 0.1112  accuracy: 97.75% -> 98.31%     
client [14] (testset)   loss: 0.2730 -> 0.2466  accuracy: 96.39% -> 96.39%     
client [99] (testset)   loss: 0.0361 -> 0.0268  accuracy: 98.88% -> 99.44%     
client [36] (testset)   loss: 0.0038 -> 0.0024  accuracy: 100.00% -> 100.00%   
client [30] (testset)   loss: 0.0674 -> 0.0620  accuracy: 98.67% -> 98.67%     
client [38] (testset)   loss: 0.0273 -> 0.0289  accuracy: 99.51% -> 99.51%     
client [15] (testset)   loss: 0.0897 -> 0.0753  accuracy: 98.03% -> 98.52%     
client [6]  (testset)   loss: 0.1252 -> 0.1530  accuracy: 97.95% -> 97.95%     
client [53] (testset)   loss: 0.0539 -> 0.0476  accuracy: 98.21% -> 98.21%     
---------------------------- TRAINING EPOCH: 220 ----------------------------  
client [99] (testset)   loss: 0.0233 -> 0.0141  accuracy: 98.88% -> 99.44%     
client [6]  (testset)   loss: 0.1545 -> 0.1736  accuracy: 97.95% -> 97.95%     
client [83] (testset)   loss: 0.0603 -> 0.0745  accuracy: 96.65% -> 97.61%     
client [42] (testset)   loss: 0.0181 -> 0.0140  accuracy: 99.12% -> 99.12%     
client [34] (testset)   loss: 0.0240 -> 0.0168  accuracy: 99.32% -> 99.32%     
client [15] (testset)   loss: 0.0864 -> 0.0771  accuracy: 98.52% -> 98.52%     
client [47] (testset)   loss: 0.0123 -> 0.0091  accuracy: 99.19% -> 100.00%    
client [55] (testset)   loss: 0.0336 -> 0.0465  accuracy: 97.98% -> 97.98%     
client [51] (testset)   loss: 0.0587 -> 0.0654  accuracy: 98.13% -> 97.66%     
client [95] (testset)   loss: 0.1200 -> 0.0766  accuracy: 98.05% -> 98.05%     
---------------------------- TRAINING EPOCH: 230 ----------------------------  
client [71] (testset)   loss: 0.0868 -> 0.0855  accuracy: 98.43% -> 98.43%     
client [15] (testset)   loss: 0.0688 -> 0.0647  accuracy: 99.01% -> 99.01%     
client [33] (testset)   loss: 0.0218 -> 0.0275  accuracy: 99.29% -> 99.29%     
client [99] (testset)   loss: 0.0281 -> 0.0251  accuracy: 98.88% -> 98.88%     
client [90] (testset)   loss: 0.0580 -> 0.0606  accuracy: 99.29% -> 99.29%     
client [57] (testset)   loss: 0.1277 -> 0.1280  accuracy: 97.70% -> 97.70%     
client [27] (testset)   loss: 0.0338 -> 0.0384  accuracy: 98.82% -> 98.82%     
client [78] (testset)   loss: 0.1469 -> 0.1323  accuracy: 96.36% -> 96.36%     
client [36] (testset)   loss: 0.0009 -> 0.0012  accuracy: 100.00% -> 100.00%   
client [88] (testset)   loss: 0.0395 -> 0.0423  accuracy: 98.96% -> 98.96%     
---------------------------- TRAINING EPOCH: 240 ----------------------------  
client [70] (testset)   loss: 0.0050 -> 0.0039  accuracy: 100.00% -> 100.00%   
client [35] (testset)   loss: 0.0038 -> 0.0019  accuracy: 100.00% -> 100.00%   
client [16] (testset)   loss: 0.0663 -> 0.0632  accuracy: 98.63% -> 98.63%     
client [80] (testset)   loss: 0.0443 -> 0.0457  accuracy: 98.87% -> 98.87%     
client [38] (testset)   loss: 0.0153 -> 0.0238  accuracy: 99.51% -> 99.51%     
client [78] (testset)   loss: 0.1718 -> 0.1654  accuracy: 96.36% -> 96.36%     
client [68] (testset)   loss: 0.0007 -> 0.0001  accuracy: 100.00% -> 100.00%   
client [11] (testset)   loss: 0.0567 -> 0.0294  accuracy: 98.45% -> 98.97%     
client [64] (testset)   loss: 0.0170 -> 0.0017  accuracy: 99.17% -> 100.00%    
client [82] (testset)   loss: 0.0441 -> 0.0428  accuracy: 98.97% -> 98.97%     
---------------------------- TRAINING EPOCH: 250 ----------------------------  
client [30] (testset)   loss: 0.0556 -> 0.0560  accuracy: 98.67% -> 98.67%     
client [27] (testset)   loss: 0.0348 -> 0.0456  accuracy: 98.82% -> 98.82%     
client [74] (testset)   loss: 0.0179 -> 0.0162  accuracy: 99.38% -> 99.38%     
client [45] (testset)   loss: 0.0331 -> 0.0399  accuracy: 99.62% -> 99.23%     
client [6]  (testset)   loss: 0.1237 -> 0.1744  accuracy: 97.95% -> 97.95%     
client [36] (testset)   loss: 0.0006 -> 0.0007  accuracy: 100.00% -> 100.00%   
client [63] (testset)   loss: 0.0023 -> 0.0075  accuracy: 100.00% -> 99.35%    
client [76] (testset)   loss: 0.0000 -> 0.0000  accuracy: 100.00% -> 100.00%   
client [83] (testset)   loss: 0.0935 -> 0.1023  accuracy: 97.61% -> 97.61%     
client [86] (testset)   loss: 0.0072 -> 0.0063  accuracy: 99.25% -> 99.25%     
---------------------------- TRAINING EPOCH: 260 ----------------------------  
client [83] (testset)   loss: 0.0921 -> 0.0901  accuracy: 97.61% -> 98.56%     
client [99] (testset)   loss: 0.0157 -> 0.0116  accuracy: 99.44% -> 99.44%     
client [74] (testset)   loss: 0.0164 -> 0.0134  accuracy: 99.38% -> 99.38%     
client [73] (testset)   loss: 0.1790 -> 0.1919  accuracy: 98.33% -> 97.92%     
client [29] (testset)   loss: 0.0314 -> 0.0298  accuracy: 99.13% -> 99.13%     
client [92] (testset)   loss: 0.1568 -> 0.1548  accuracy: 97.60% -> 98.08%     
client [6]  (testset)   loss: 0.1831 -> 0.1734  accuracy: 97.95% -> 97.95%     
client [61] (testset)   loss: 0.0528 -> 0.0492  accuracy: 98.89% -> 98.89%     
client [21] (testset)   loss: 0.0599 -> 0.0572  accuracy: 99.12% -> 99.12%     
client [67] (testset)   loss: 0.0276 -> 0.0129  accuracy: 99.15% -> 99.15%     
---------------------------- TRAINING EPOCH: 270 ----------------------------  
client [83] (testset)   loss: 0.0913 -> 0.1027  accuracy: 97.13% -> 97.13%     
client [32] (testset)   loss: 0.0014 -> 0.0011  accuracy: 100.00% -> 100.00%   
client [95] (testset)   loss: 0.0495 -> 0.0464  accuracy: 98.54% -> 98.54%     
client [61] (testset)   loss: 0.0699 -> 0.0589  accuracy: 98.89% -> 98.89%     
client [27] (testset)   loss: 0.0260 -> 0.0319  accuracy: 98.82% -> 98.82%     
client [25] (testset)   loss: 0.0801 -> 0.0763  accuracy: 98.58% -> 98.58%     
client [68] (testset)   loss: 0.0013 -> 0.0007  accuracy: 100.00% -> 100.00%   
client [34] (testset)   loss: 0.0135 -> 0.0155  accuracy: 99.32% -> 99.32%     
client [71] (testset)   loss: 0.1337 -> 0.1177  accuracy: 97.91% -> 98.43%     
client [89] (testset)   loss: 0.1797 -> 0.1517  accuracy: 98.23% -> 98.23%     
---------------------------- TRAINING EPOCH: 280 ----------------------------  
client [78] (testset)   loss: 0.1637 -> 0.1591  accuracy: 96.36% -> 96.36%     
client [81] (testset)   loss: 0.1716 -> 0.1740  accuracy: 97.27% -> 97.27%     
client [51] (testset)   loss: 0.0411 -> 0.0410  accuracy: 98.60% -> 98.13%     
client [54] (testset)   loss: 0.1216 -> 0.1079  accuracy: 97.75% -> 98.31%     
client [65] (testset)   loss: 0.0416 -> 0.0139  accuracy: 97.65% -> 99.41%     
client [41] (testset)   loss: 0.0183 -> 0.0195  accuracy: 99.40% -> 98.81%     
client [11] (testset)   loss: 0.0246 -> 0.0233  accuracy: 98.97% -> 98.97%     
client [85] (testset)   loss: 0.0006 -> 0.0006  accuracy: 100.00% -> 100.00%   
client [12] (testset)   loss: 0.0120 -> 0.0136  accuracy: 99.47% -> 99.47%     
client [23] (testset)   loss: 0.0900 -> 0.0841  accuracy: 98.92% -> 98.92%     
---------------------------- TRAINING EPOCH: 290 ----------------------------  
client [16] (testset)   loss: 0.0963 -> 0.0860  accuracy: 98.17% -> 98.17%     
client [65] (testset)   loss: 0.0094 -> 0.0096  accuracy: 100.00% -> 100.00%   
client [53] (testset)   loss: 0.0237 -> 0.0277  accuracy: 99.11% -> 99.11%     
client [58] (testset)   loss: 0.0126 -> 0.0137  accuracy: 99.49% -> 99.49%     
client [72] (testset)   loss: 0.0003 -> 0.0002  accuracy: 100.00% -> 100.00%   
client [7]  (testset)   loss: 0.0667 -> 0.0592  accuracy: 98.81% -> 98.81%     
client [71] (testset)   loss: 0.0937 -> 0.0924  accuracy: 98.43% -> 98.43%     
client [59] (testset)   loss: 0.0055 -> 0.0052  accuracy: 100.00% -> 100.00%   
client [86] (testset)   loss: 0.0014 -> 0.0013  accuracy: 100.00% -> 100.00%   
client [39] (testset)   loss: 0.0040 -> 0.0037  accuracy: 99.45% -> 100.00%    
---------------------------- TRAINING EPOCH: 300 ----------------------------  
client [99] (testset)   loss: 0.0207 -> 0.0164  accuracy: 99.44% -> 99.44%     
client [7]  (testset)   loss: 0.0492 -> 0.0495  accuracy: 98.81% -> 98.81%     
client [17] (testset)   loss: 0.0416 -> 0.0372  accuracy: 99.13% -> 99.13%     
client [64] (testset)   loss: 0.0056 -> 0.0040  accuracy: 99.59% -> 99.59%     
client [37] (testset)   loss: 0.0684 -> 0.0679  accuracy: 98.28% -> 98.28%     
client [29] (testset)   loss: 0.0127 -> 0.0096  accuracy: 99.13% -> 99.13%     
client [93] (testset)   loss: 0.0323 -> 0.0284  accuracy: 99.21% -> 99.21%     
client [73] (testset)   loss: 0.2040 -> 0.2047  accuracy: 98.75% -> 98.75%     
client [40] (testset)   loss: 0.0238 -> 0.0076  accuracy: 99.20% -> 99.20%     
client [76] (testset)   loss: 0.0000 -> 0.0000  accuracy: 100.00% -> 100.00%   
---------------------------- TRAINING EPOCH: 310 ----------------------------  
client [31] (testset)   loss: 0.0379 -> 0.0388  accuracy: 98.21% -> 98.21%     
client [89] (testset)   loss: 0.1892 -> 0.1821  accuracy: 98.23% -> 98.23%     
client [77] (testset)   loss: 0.0580 -> 0.0472  accuracy: 99.20% -> 99.20%     
client [90] (testset)   loss: 0.0479 -> 0.0490  accuracy: 99.29% -> 99.29%     
client [26] (testset)   loss: 0.0303 -> 0.0275  accuracy: 98.73% -> 99.15%     
client [50] (testset)   loss: 0.0785 -> 0.0590  accuracy: 98.24% -> 98.59%     
client [30] (testset)   loss: 0.0737 -> 0.0692  accuracy: 98.67% -> 98.67%     
client [70] (testset)   loss: 0.0025 -> 0.0027  accuracy: 100.00% -> 100.00%   
client [41] (testset)   loss: 0.0191 -> 0.0221  accuracy: 99.40% -> 99.40%     
client [99] (testset)   loss: 0.0246 -> 0.0214  accuracy: 98.88% -> 99.44%     
---------------------------- TRAINING EPOCH: 320 ----------------------------  
client [68] (testset)   loss: 0.0017 -> 0.0011  accuracy: 100.00% -> 100.00%   
client [70] (testset)   loss: 0.0038 -> 0.0036  accuracy: 100.00% -> 100.00%   
client [52] (testset)   loss: 0.0001 -> 0.0001  accuracy: 100.00% -> 100.00%   
client [1]  (testset)   loss: 0.0797 -> 0.0812  accuracy: 99.02% -> 99.02%     
client [2]  (testset)   loss: 0.0548 -> 0.0537  accuracy: 98.43% -> 98.43%     
client [67] (testset)   loss: 0.0313 -> 0.0269  accuracy: 98.29% -> 99.15%     
client [92] (testset)   loss: 0.1682 -> 0.1701  accuracy: 97.60% -> 97.60%     
client [35] (testset)   loss: 0.0022 -> 0.0013  accuracy: 100.00% -> 100.00%   
client [36] (testset)   loss: 0.0005 -> 0.0006  accuracy: 100.00% -> 100.00%   
client [64] (testset)   loss: 0.0070 -> 0.0063  accuracy: 99.59% -> 99.59%     
---------------------------- TRAINING EPOCH: 330 ----------------------------  
client [44] (testset)   loss: 0.3512 -> 0.3490  accuracy: 99.40% -> 99.40%     
client [6]  (testset)   loss: 0.1852 -> 0.1837  accuracy: 97.95% -> 97.95%     
client [12] (testset)   loss: 0.0069 -> 0.0070  accuracy: 99.47% -> 99.47%     
client [55] (testset)   loss: 0.0535 -> 0.0487  accuracy: 97.98% -> 97.98%     
client [29] (testset)   loss: 0.0490 -> 0.0432  accuracy: 99.13% -> 99.13%     
client [9]  (testset)   loss: 0.0686 -> 0.0610  accuracy: 97.20% -> 97.20%     
client [43] (testset)   loss: 0.0757 -> 0.0449  accuracy: 96.40% -> 97.30%     
client [77] (testset)   loss: 0.0598 -> 0.0464  accuracy: 99.20% -> 99.20%     
client [98] (testset)   loss: 0.0009 -> 0.0009  accuracy: 100.00% -> 100.00%   
client [78] (testset)   loss: 0.1727 -> 0.1666  accuracy: 96.36% -> 96.36%     
---------------------------- TRAINING EPOCH: 340 ----------------------------  
client [92] (testset)   loss: 0.1580 -> 0.1570  accuracy: 97.60% -> 97.60%     
client [80] (testset)   loss: 0.0522 -> 0.0487  accuracy: 98.87% -> 98.87%     
client [63] (testset)   loss: 0.0079 -> 0.0038  accuracy: 99.35% -> 100.00%    
client [76] (testset)   loss: 0.0000 -> 0.0000  accuracy: 100.00% -> 100.00%   
client [78] (testset)   loss: 0.1619 -> 0.1591  accuracy: 96.36% -> 96.36%     
client [25] (testset)   loss: 0.0868 -> 0.0792  accuracy: 98.58% -> 98.58%     
client [58] (testset)   loss: 0.0056 -> 0.0069  accuracy: 99.49% -> 99.49%     
client [13] (testset)   loss: 0.1787 -> 0.1808  accuracy: 96.00% -> 96.00%     
client [17] (testset)   loss: 0.0384 -> 0.0372  accuracy: 99.13% -> 99.13%     
client [38] (testset)   loss: 0.0175 -> 0.0198  accuracy: 99.51% -> 99.51%     
---------------------------- TRAINING EPOCH: 350 ----------------------------  
client [72] (testset)   loss: 0.0050 -> 0.0048  accuracy: 99.60% -> 99.60%     
client [82] (testset)   loss: 0.0181 -> 0.0180  accuracy: 98.97% -> 98.97%     
client [86] (testset)   loss: 0.0003 -> 0.0003  accuracy: 100.00% -> 100.00%   
client [51] (testset)   loss: 0.0278 -> 0.0270  accuracy: 98.13% -> 98.13%     
client [96] (testset)   loss: 0.1020 -> 0.0861  accuracy: 98.09% -> 98.56%     
client [42] (testset)   loss: 0.0217 -> 0.0212  accuracy: 99.12% -> 99.12%     
client [55] (testset)   loss: 0.0327 -> 0.0323  accuracy: 97.98% -> 97.98%     
client [13] (testset)   loss: 0.1964 -> 0.1969  accuracy: 96.00% -> 96.00%     
client [1]  (testset)   loss: 0.0866 -> 0.0831  accuracy: 99.02% -> 99.02%     
client [12] (testset)   loss: 0.0065 -> 0.0083  accuracy: 99.47% -> 99.47%     
---------------------------- TRAINING EPOCH: 360 ----------------------------  
client [68] (testset)   loss: 0.0015 -> 0.0012  accuracy: 100.00% -> 100.00%   
client [23] (testset)   loss: 0.1007 -> 0.0855  accuracy: 98.92% -> 98.92%     
client [46] (testset)   loss: 0.0015 -> 0.0023  accuracy: 100.00% -> 100.00%   
client [41] (testset)   loss: 0.0120 -> 0.0147  accuracy: 99.40% -> 99.40%     
client [25] (testset)   loss: 0.0878 -> 0.0856  accuracy: 98.58% -> 98.58%     
client [58] (testset)   loss: 0.0024 -> 0.0027  accuracy: 100.00% -> 100.00%   
client [14] (testset)   loss: 0.3079 -> 0.3049  accuracy: 96.39% -> 96.39%     
client [33] (testset)   loss: 0.0128 -> 0.0192  accuracy: 99.29% -> 99.29%     
client [85] (testset)   loss: 0.0004 -> 0.0004  accuracy: 100.00% -> 100.00%   
client [62] (testset)   loss: 0.0577 -> 0.0567  accuracy: 99.46% -> 99.46%     
---------------------------- TRAINING EPOCH: 370 ----------------------------  
client [98] (testset)   loss: 0.0009 -> 0.0009  accuracy: 100.00% -> 100.00%   
client [63] (testset)   loss: 0.0009 -> 0.0020  accuracy: 100.00% -> 100.00%   
client [70] (testset)   loss: 0.0106 -> 0.0095  accuracy: 99.58% -> 99.58%     
client [65] (testset)   loss: 0.0149 -> 0.0125  accuracy: 99.41% -> 99.41%     
client [14] (testset)   loss: 0.3033 -> 0.3027  accuracy: 95.18% -> 95.18%     
client [73] (testset)   loss: 0.2078 -> 0.2117  accuracy: 98.75% -> 98.75%     
client [34] (testset)   loss: 0.0107 -> 0.0092  accuracy: 99.32% -> 99.32%     
client [99] (testset)   loss: 0.0093 -> 0.0072  accuracy: 100.00% -> 100.00%   
client [69] (testset)   loss: 0.0082 -> 0.0051  accuracy: 99.40% -> 99.40%     
client [46] (testset)   loss: 0.0039 -> 0.0038  accuracy: 100.00% -> 100.00%   
---------------------------- TRAINING EPOCH: 380 ----------------------------  
client [99] (testset)   loss: 0.0240 -> 0.0217  accuracy: 99.44% -> 99.44%     
client [93] (testset)   loss: 0.0316 -> 0.0253  accuracy: 98.41% -> 98.81%     
client [11] (testset)   loss: 0.0341 -> 0.0341  accuracy: 98.45% -> 98.45%     
client [58] (testset)   loss: 0.0051 -> 0.0057  accuracy: 100.00% -> 99.49%    
client [81] (testset)   loss: 0.2008 -> 0.2032  accuracy: 98.18% -> 97.27%     
client [85] (testset)   loss: 0.0002 -> 0.0002  accuracy: 100.00% -> 100.00%   
client [89] (testset)   loss: 0.1752 -> 0.1739  accuracy: 98.23% -> 98.23%     
client [45] (testset)   loss: 0.0372 -> 0.0372  accuracy: 99.23% -> 99.23%     
client [8]  (testset)   loss: 0.0712 -> 0.0719  accuracy: 98.78% -> 98.78%     
client [68] (testset)   loss: 0.0021 -> 0.0013  accuracy: 100.00% -> 100.00%   
---------------------------- TRAINING EPOCH: 390 ----------------------------  
client [67] (testset)   loss: 0.0347 -> 0.0322  accuracy: 99.15% -> 99.15%     
client [72] (testset)   loss: 0.0002 -> 0.0002  accuracy: 100.00% -> 100.00%   
client [1]  (testset)   loss: 0.0952 -> 0.0949  accuracy: 99.02% -> 99.02%     
client [78] (testset)   loss: 0.1795 -> 0.1710  accuracy: 96.97% -> 96.36%     
client [83] (testset)   loss: 0.0936 -> 0.0940  accuracy: 97.61% -> 97.61%     
client [21] (testset)   loss: 0.0527 -> 0.0509  accuracy: 99.12% -> 99.12%     
client [56] (testset)   loss: 0.0010 -> 0.0011  accuracy: 100.00% -> 100.00%   
client [44] (testset)   loss: 0.3736 -> 0.3712  accuracy: 99.40% -> 99.40%     
client [92] (testset)   loss: 0.1588 -> 0.1592  accuracy: 98.08% -> 98.08%     
client [27] (testset)   loss: 0.0188 -> 0.0237  accuracy: 98.82% -> 98.82%     
---------------------------- TRAINING EPOCH: 400 ----------------------------  
client [10] (testset)   loss: 0.1204 -> 0.1197  accuracy: 98.68% -> 98.68%     
client [39] (testset)   loss: 0.0004 -> 0.0007  accuracy: 100.00% -> 100.00%   
client [65] (testset)   loss: 0.0228 -> 0.0185  accuracy: 98.82% -> 98.82%     
client [26] (testset)   loss: 0.0245 -> 0.0221  accuracy: 99.15% -> 99.15%     
client [19] (testset)   loss: 0.0033 -> 0.0028  accuracy: 100.00% -> 100.00%   
client [68] (testset)   loss: 0.0005 -> 0.0004  accuracy: 100.00% -> 100.00%   
client [41] (testset)   loss: 0.0147 -> 0.0171  accuracy: 99.40% -> 99.40%     
client [50] (testset)   loss: 0.0763 -> 0.0721  accuracy: 98.24% -> 98.59%     
client [75] (testset)   loss: 0.0111 -> 0.0110  accuracy: 99.47% -> 99.47%     
client [81] (testset)   loss: 0.2061 -> 0.2064  accuracy: 97.27% -> 97.27%     
Training... ---------------------------------------- 100% 0:14:59
PSFL's average time taken by each global epoch: 0 min 2.23 sec.                
PSFL's total running time: 0 h 14 m 59 s.                                      
==================== PSFL Experiment Results: ====================             
Display format: (before local fine-tuning) -> (after local fine-tuning)        
 So if finetune_epoch = 0, x.xx% -> 0.00% is normal.                           
 Centralized testing ONLY happens after model aggregation, so the stats between
'->' are the same.                                                             
{                                                                              
    "100": {                                                                   
        "all_clients": {                                                       
            "test": {                                                          
                "loss": "0.0498 -> 0.0000",                                    
                "accuracy": "98.83% -> 0.00%"                                  
            }                                                                  
        }                                                                      
    },                                                                         
    "200": {                                                                   
        "all_clients": {                                                       
            "test": {                                                          
                "loss": "0.0553 -> 0.0000",                                    
                "accuracy": "98.89% -> 0.00%"                                  
            }                                                                  
        }                                                                      
    },                                                                         
    "300": {                                                                   
        "all_clients": {                                                       
            "test": {                                                          
                "loss": "0.0560 -> 0.0000",                                    
                "accuracy": "98.97% -> 0.00%"                                  
            }                                                                  
        }                                                                      
    },                                                                         
    "400": {                                                                   
        "all_clients": {                                                       
            "test": {                                                          
                "loss": "0.0583 -> 0.0000",                                    
                "accuracy": "99.03% -> 0.00%"                                  
            }                                                                  
        }                                                                      
    }                                                                          
}                                                                              
==================== PSFL Max Accuracy ====================                    
all_clients:                                                                   
(test) before fine-tuning: 99.03% at epoch 400                                 
(test) after fine-tuning: 0.00% at epoch 100                                   
[0m