==================== FedDpa ====================                               
Experiment Arguments:                                                          
{
│   'method': 'feddpa',
│   'dataset': {
│   │   'name': 'medmnistC',
│   │   'client_num': 100,
│   │   'test_ratio': 0.25,
│   │   'val_ratio': 0.0,
│   │   'seed': 42,
│   │   'split': 'sample',
│   │   'IID_ratio': 0.0,
│   │   'monitor_window_name_suffix': 'medmnistC-100clients-0%IID-Dir(1.0)-seed42',
│   │   'alpha': 1.0,
│   │   'min_samples_per_client': 10
│   },
│   'model': {
│   │   'name': 'lenet5',
│   │   'use_torchvision_pretrained_weights': True,
│   │   'external_model_weights_path': None
│   },
│   'optimizer': {
│   │   'lr': 0.01,
│   │   'dampening': 0,
│   │   'weight_decay': 0,
│   │   'momentum': 0,
│   │   'nesterov': False,
│   │   'name': 'sgd'
│   },
│   'mode': 'sequential',
│   'parallel': {
│   │   'ray_cluster_addr': None,
│   │   'num_cpus': None,
│   │   'num_gpus': None,
│   │   'num_workers': 2
│   },
│   'common': {
│   │   'seed': 42,
│   │   'join_ratio': 0.1,
│   │   'global_epoch': 400,
│   │   'local_epoch': 5,
│   │   'batch_size': 32,
│   │   'reset_optimizer_on_global_epoch': True,
│   │   'straggler_ratio': 0,
│   │   'straggler_min_local_epoch': 0,
│   │   'buffers': 'global',
│   │   'client_side_evaluation': True,
│   │   'test': {
│   │   │   'client': {
│   │   │   │   'interval': 100,
│   │   │   │   'finetune_epoch': 0,
│   │   │   │   'train': False,
│   │   │   │   'val': False,
│   │   │   │   'test': True
│   │   │   },
│   │   │   'server': {
│   │   │   │   'interval': -1,
│   │   │   │   'train': False,
│   │   │   │   'val': False,
│   │   │   │   'test': False,
│   │   │   │   'model_in_train_mode': False
│   │   │   }
│   │   },
│   │   'verbose_gap': 10,
│   │   'monitor': None,
│   │   'use_cuda': True,
│   │   'save_log': True,
│   │   'save_model': False,
│   │   'save_learning_curve_plot': False,
│   │   'save_metrics': True,
│   │   'delete_useless_run': True
│   },
│   'feddpa': {
│   │   'fisher_threshold': 0.2
│   }
}
---------------------------- TRAINING EPOCH: 10 ----------------------------   
client [77] (testset)   loss: 2.0749 -> 1.9874  accuracy: 16.67% -> 30.00%     
client [81] (testset)   loss: 2.0027 -> 1.9964  accuracy: 35.14% -> 35.14%     
client [21] (testset)   loss: 2.3701 -> 2.1194  accuracy: 1.75% -> 26.32%      
client [68] (testset)   loss: 1.9094 -> 1.7787  accuracy: 37.78% -> 37.78%     
client [93] (testset)   loss: 1.7040 -> 1.6960  accuracy: 45.65% -> 45.65%     
client [31] (testset)   loss: 2.3693 -> 2.1358  accuracy: 5.56% -> 44.44%      
client [20] (testset)   loss: 2.1742 -> 2.1677  accuracy: 18.03% -> 18.03%     
client [59] (testset)   loss: 2.3854 -> 2.2142  accuracy: 12.64% -> 24.14%     
client [48] (testset)   loss: 2.2947 -> 2.2289  accuracy: 8.70% -> 17.39%      
client [34] (testset)   loss: 2.0072 -> 1.9313  accuracy: 31.15% -> 24.59%     
---------------------------- TRAINING EPOCH: 20 ----------------------------   
client [69] (testset)   loss: 2.2929 -> 2.1153  accuracy: 29.41% -> 29.41%     
client [99] (testset)   loss: 2.3253 -> 2.1984  accuracy: 20.51% -> 20.51%     
client [67] (testset)   loss: 2.1898 -> 2.0930  accuracy: 22.81% -> 19.30%     
client [0]  (testset)   loss: 1.8273 -> 1.7409  accuracy: 20.55% -> 36.99%     
client [76] (testset)   loss: 2.0804 -> 1.9244  accuracy: 27.78% -> 27.78%     
client [41] (testset)   loss: 2.2710 -> 1.9952  accuracy: 26.92% -> 26.92%     
client [62] (testset)   loss: 2.4063 -> 2.3578  accuracy: 3.45% -> 41.38%      
client [2]  (testset)   loss: 2.3538 -> 1.8151  accuracy: 49.40% -> 49.40%     
client [14] (testset)   loss: 2.0763 -> 2.0579  accuracy: 31.88% -> 31.88%     
client [46] (testset)   loss: 1.8855 -> 1.8075  accuracy: 48.94% -> 48.94%     
---------------------------- TRAINING EPOCH: 30 ----------------------------   
client [24] (testset)   loss: 2.3338 -> 2.2707  accuracy: 36.00% -> 36.00%     
client [68] (testset)   loss: 1.7782 -> 1.7648  accuracy: 37.78% -> 37.78%     
client [57] (testset)   loss: 2.0708 -> 2.0851  accuracy: 34.78% -> 34.78%     
client [17] (testset)   loss: 1.9921 -> 1.9955  accuracy: 32.00% -> 32.00%     
client [54] (testset)   loss: 2.3930 -> 2.5393  accuracy: 18.75% -> 18.75%     
client [23] (testset)   loss: 2.3578 -> 2.3234  accuracy: 23.53% -> 20.59%     
client [35] (testset)   loss: 2.0184 -> 1.9655  accuracy: 33.33% -> 33.33%     
client [59] (testset)   loss: 2.1188 -> 2.1027  accuracy: 24.14% -> 24.14%     
client [31] (testset)   loss: 1.9251 -> 1.8793  accuracy: 44.44% -> 44.44%     
client [9]  (testset)   loss: 2.2820 -> 2.3074  accuracy: 13.33% -> 13.33%     
---------------------------- TRAINING EPOCH: 40 ----------------------------   
client [64] (testset)   loss: 2.2050 -> 2.1837  accuracy: 20.00% -> 20.00%     
client [33] (testset)   loss: 1.8580 -> 1.8724  accuracy: 44.44% -> 35.56%     
client [16] (testset)   loss: 2.2953 -> 2.1444  accuracy: 26.67% -> 26.67%     
client [44] (testset)   loss: 2.2763 -> 2.1606  accuracy: 19.64% -> 23.21%     
client [8]  (testset)   loss: 1.8914 -> 1.8830  accuracy: 34.17% -> 34.17%     
client [31] (testset)   loss: 1.8820 -> 1.8828  accuracy: 44.44% -> 44.44%     
client [47] (testset)   loss: 1.8882 -> 1.7521  accuracy: 16.67% -> 16.67%     
client [36] (testset)   loss: 2.3070 -> 2.0896  accuracy: 24.49% -> 24.49%     
client [20] (testset)   loss: 2.1874 -> 2.1666  accuracy: 18.03% -> 18.03%     
client [56] (testset)   loss: 2.1627 -> 2.1023  accuracy: 7.27% -> 32.73%      
---------------------------- TRAINING EPOCH: 50 ----------------------------   
client [4]  (testset)   loss: 2.0760 -> 2.0285  accuracy: 30.19% -> 30.19%     
client [60] (testset)   loss: 2.3576 -> 2.3208  accuracy: 11.43% -> 28.57%     
client [28] (testset)   loss: 2.1651 -> 2.1880  accuracy: 31.51% -> 12.33%     
client [25] (testset)   loss: 2.3568 -> 2.4415  accuracy: 12.00% -> 12.00%     
client [58] (testset)   loss: 1.7230 -> 1.6791  accuracy: 42.47% -> 42.47%     
client [44] (testset)   loss: 2.1588 -> 2.1601  accuracy: 23.21% -> 23.21%     
client [39] (testset)   loss: 1.4126 -> 1.4020  accuracy: 53.77% -> 53.77%     
client [29] (testset)   loss: 1.8285 -> 1.7846  accuracy: 37.66% -> 37.66%     
client [3]  (testset)   loss: 2.3892 -> 2.4415  accuracy: 9.26% -> 9.26%       
client [84] (testset)   loss: 1.7609 -> 1.6567  accuracy: 38.53% -> 38.53%     
---------------------------- TRAINING EPOCH: 60 ----------------------------   
client [21] (testset)   loss: 2.0354 -> 1.9554  accuracy: 26.32% -> 26.32%     
client [84] (testset)   loss: 1.6863 -> 1.6463  accuracy: 38.53% -> 38.53%     
client [10] (testset)   loss: 2.3962 -> 2.3834  accuracy: 0.00% -> 0.00%       
client [36] (testset)   loss: 2.0983 -> 2.0651  accuracy: 24.49% -> 24.49%     
client [65] (testset)   loss: 2.0512 -> 2.0401  accuracy: 37.74% -> 37.74%     
client [81] (testset)   loss: 1.9808 -> 2.0047  accuracy: 35.14% -> 35.14%     
client [79] (testset)   loss: 2.2560 -> 2.2870  accuracy: 21.15% -> 21.15%     
client [42] (testset)   loss: 2.2658 -> 2.2606  accuracy: 7.14% -> 7.14%       
client [11] (testset)   loss: 2.0179 -> 1.9553  accuracy: 30.36% -> 30.36%     
client [96] (testset)   loss: 2.0791 -> 2.0755  accuracy: 30.36% -> 30.36%     
---------------------------- TRAINING EPOCH: 70 ----------------------------   
client [8]  (testset)   loss: 1.9281 -> 1.8874  accuracy: 34.17% -> 34.17%     
client [53] (testset)   loss: 2.0449 -> 2.0795  accuracy: 38.71% -> 38.71%     
client [52] (testset)   loss: 1.3374 -> 1.3699  accuracy: 57.14% -> 57.14%     
client [42] (testset)   loss: 2.2577 -> 2.2834  accuracy: 17.86% -> 7.14%      
client [69] (testset)   loss: 2.2147 -> 2.0391  accuracy: 17.65% -> 29.41%     
client [59] (testset)   loss: 2.1205 -> 2.1080  accuracy: 24.14% -> 24.14%     
client [7]  (testset)   loss: 1.9673 -> 1.9323  accuracy: 32.79% -> 32.79%     
client [26] (testset)   loss: 2.2541 -> 2.1929  accuracy: 19.30% -> 22.81%     
client [49] (testset)   loss: 1.9664 -> 1.9085  accuracy: 24.24% -> 24.24%     
client [98] (testset)   loss: 2.0595 -> 2.0459  accuracy: 37.74% -> 37.74%     
---------------------------- TRAINING EPOCH: 80 ----------------------------   
client [98] (testset)   loss: 2.1005 -> 2.0562  accuracy: 37.74% -> 37.74%     
client [47] (testset)   loss: 1.9019 -> 1.7404  accuracy: 16.67% -> 47.22%     
client [21] (testset)   loss: 1.9504 -> 1.9561  accuracy: 26.32% -> 26.32%     
client [77] (testset)   loss: 2.0012 -> 1.9909  accuracy: 30.00% -> 30.00%     
client [95] (testset)   loss: 1.9912 -> 1.9996  accuracy: 34.25% -> 34.25%     
client [91] (testset)   loss: 2.1163 -> 2.0493  accuracy: 13.79% -> 13.79%     
client [14] (testset)   loss: 2.0735 -> 2.0549  accuracy: 31.88% -> 31.88%     
client [99] (testset)   loss: 2.0787 -> 2.0616  accuracy: 12.82% -> 20.51%     
client [20] (testset)   loss: 2.2403 -> 2.1766  accuracy: 13.11% -> 18.03%     
client [39] (testset)   loss: 1.7484 -> 1.4169  accuracy: 53.77% -> 53.77%     
---------------------------- TRAINING EPOCH: 90 ----------------------------   
client [52] (testset)   loss: 1.6238 -> 1.2861  accuracy: 57.14% -> 57.14%     
client [62] (testset)   loss: 1.8791 -> 1.8705  accuracy: 41.38% -> 41.38%     
client [71] (testset)   loss: 2.0201 -> 2.0366  accuracy: 23.33% -> 23.33%     
client [97] (testset)   loss: 1.8530 -> 1.8970  accuracy: 31.82% -> 25.76%     
client [30] (testset)   loss: 2.3640 -> 2.3546  accuracy: 15.15% -> 15.15%     
client [88] (testset)   loss: 2.1865 -> 2.2123  accuracy: 22.81% -> 22.81%     
client [60] (testset)   loss: 2.2097 -> 2.1834  accuracy: 28.57% -> 28.57%     
client [82] (testset)   loss: 1.9311 -> 1.9385  accuracy: 11.94% -> 11.94%     
client [91] (testset)   loss: 1.9851 -> 2.0270  accuracy: 37.93% -> 13.79%     
client [57] (testset)   loss: 2.1184 -> 2.1006  accuracy: 34.78% -> 34.78%     
---------------------------- TRAINING EPOCH: 100 ----------------------------  
client [31] (testset)   loss: 1.8733 -> 1.8734  accuracy: 44.44% -> 44.44%     
client [15] (testset)   loss: 1.6305 -> 1.5296  accuracy: 61.04% -> 61.04%     
client [71] (testset)   loss: 2.0563 -> 2.0132  accuracy: 23.33% -> 23.33%     
client [97] (testset)   loss: 1.8548 -> 1.8962  accuracy: 25.76% -> 25.76%     
client [53] (testset)   loss: 2.0244 -> 2.0693  accuracy: 38.71% -> 38.71%     
client [77] (testset)   loss: 2.1311 -> 2.0006  accuracy: 16.67% -> 30.00%     
client [76] (testset)   loss: 1.9107 -> 1.9055  accuracy: 27.78% -> 27.78%     
client [79] (testset)   loss: 2.2532 -> 2.3115  accuracy: 21.15% -> 21.15%     
client [28] (testset)   loss: 2.1955 -> 2.1868  accuracy: 12.33% -> 12.33%     
client [99] (testset)   loss: 2.0823 -> 2.0633  accuracy: 20.51% -> 20.51%     
---------------------------- TRAINING EPOCH: 110 ----------------------------  
client [97] (testset)   loss: 1.8569 -> 1.8745  accuracy: 25.76% -> 25.76%     
client [86] (testset)   loss: 1.6697 -> 1.6902  accuracy: 48.44% -> 48.44%     
client [34] (testset)   loss: 1.9196 -> 1.9061  accuracy: 24.59% -> 24.59%     
client [73] (testset)   loss: 2.3311 -> 2.3134  accuracy: 12.28% -> 12.28%     
client [5]  (testset)   loss: 2.1832 -> 2.1837  accuracy: 26.09% -> 26.09%     
client [96] (testset)   loss: 2.0785 -> 2.0853  accuracy: 30.36% -> 30.36%     
client [22] (testset)   loss: 1.9019 -> 1.8931  accuracy: 46.00% -> 46.00%     
client [60] (testset)   loss: 2.2529 -> 2.2183  accuracy: 28.57% -> 28.57%     
client [66] (testset)   loss: 2.1743 -> 2.1766  accuracy: 19.05% -> 19.05%     
client [83] (testset)   loss: 2.1405 -> 2.1250  accuracy: 19.57% -> 19.57%     
---------------------------- TRAINING EPOCH: 120 ----------------------------  
client [76] (testset)   loss: 1.9156 -> 1.9162  accuracy: 27.78% -> 27.78%     
client [65] (testset)   loss: 2.0625 -> 2.0112  accuracy: 37.74% -> 37.74%     
client [95] (testset)   loss: 2.0216 -> 2.0124  accuracy: 34.25% -> 34.25%     
client [17] (testset)   loss: 2.3091 -> 2.0137  accuracy: 20.00% -> 32.00%     
client [8]  (testset)   loss: 2.0803 -> 1.8800  accuracy: 34.17% -> 34.17%     
client [35] (testset)   loss: 1.9775 -> 2.0031  accuracy: 33.33% -> 33.33%     
client [98] (testset)   loss: 2.2914 -> 2.0443  accuracy: 37.74% -> 37.74%     
client [53] (testset)   loss: 2.0419 -> 2.0734  accuracy: 38.71% -> 38.71%     
client [43] (testset)   loss: 1.8010 -> 1.5030  accuracy: 57.89% -> 57.89%     
client [64] (testset)   loss: 2.2045 -> 2.1861  accuracy: 17.14% -> 20.00%     
---------------------------- TRAINING EPOCH: 130 ----------------------------  
client [21] (testset)   loss: 2.0746 -> 1.9589  accuracy: 26.32% -> 26.32%     
client [88] (testset)   loss: 2.2109 -> 2.1677  accuracy: 15.79% -> 15.79%     
client [38] (testset)   loss: 2.2233 -> 2.1927  accuracy: 18.92% -> 18.92%     
client [3]  (testset)   loss: 2.4233 -> 2.4071  accuracy: 9.26% -> 9.26%       
client [5]  (testset)   loss: 2.1428 -> 2.2040  accuracy: 26.09% -> 26.09%     
client [41] (testset)   loss: 2.0709 -> 2.0339  accuracy: 26.92% -> 26.92%     
client [7]  (testset)   loss: 2.1877 -> 1.9553  accuracy: 8.20% -> 32.79%      
client [37] (testset)   loss: 1.9157 -> 1.9482  accuracy: 40.48% -> 40.48%     
client [45] (testset)   loss: 2.2718 -> 2.1107  accuracy: 34.78% -> 34.78%     
client [47] (testset)   loss: 1.9201 -> 1.7020  accuracy: 47.22% -> 47.22%     
---------------------------- TRAINING EPOCH: 140 ----------------------------  
client [16] (testset)   loss: 2.3900 -> 2.3793  accuracy: 6.67% -> 6.67%       
client [11] (testset)   loss: 2.3644 -> 2.3421  accuracy: 21.43% -> 21.43%     
client [37] (testset)   loss: 2.2765 -> 2.2316  accuracy: 40.48% -> 40.48%     
client [41] (testset)   loss: 2.3593 -> 2.3400  accuracy: 17.31% -> 26.92%     
client [95] (testset)   loss: 2.3402 -> 2.3060  accuracy: 34.25% -> 34.25%     
client [53] (testset)   loss: 2.3767 -> 2.3469  accuracy: 8.06% -> 38.71%      
client [22] (testset)   loss: 2.3581 -> 2.3297  accuracy: 46.00% -> 46.00%     
client [25] (testset)   loss: 2.3814 -> 2.3781  accuracy: 12.00% -> 12.00%     
client [69] (testset)   loss: 2.3775 -> 2.3639  accuracy: 0.00% -> 17.65%      
client [46] (testset)   loss: 2.3571 -> 2.3177  accuracy: 2.13% -> 48.94%      
---------------------------- TRAINING EPOCH: 150 ----------------------------  
client [47] (testset)   loss: 2.2473 -> 2.2123  accuracy: 47.22% -> 47.22%     
client [69] (testset)   loss: 2.3469 -> 2.3346  accuracy: 0.00% -> 29.41%      
client [82] (testset)   loss: 2.3244 -> 2.2943  accuracy: 11.94% -> 11.94%     
client [45] (testset)   loss: 2.3531 -> 2.3397  accuracy: 34.78% -> 34.78%     
client [7]  (testset)   loss: 2.3592 -> 2.3347  accuracy: 18.03% -> 32.79%     
client [50] (testset)   loss: 2.2879 -> 2.2635  accuracy: 29.87% -> 29.87%     
client [35] (testset)   loss: 2.3502 -> 2.3364  accuracy: 33.33% -> 33.33%     
client [24] (testset)   loss: 2.3671 -> 2.3580  accuracy: 0.00% -> 36.00%      
client [15] (testset)   loss: 2.2776 -> 2.2039  accuracy: 61.04% -> 61.04%     
client [58] (testset)   loss: 2.2419 -> 2.1979  accuracy: 42.47% -> 42.47%     
---------------------------- TRAINING EPOCH: 160 ----------------------------  
client [48] (testset)   loss: 2.3779 -> 2.3719  accuracy: 0.00% -> 0.00%       
client [76] (testset)   loss: 2.3448 -> 2.3275  accuracy: 27.78% -> 27.78%     
client [67] (testset)   loss: 2.3725 -> 2.3554  accuracy: 0.00% -> 19.30%      
client [37] (testset)   loss: 2.1986 -> 2.1630  accuracy: 40.48% -> 40.48%     
client [58] (testset)   loss: 2.1653 -> 2.1271  accuracy: 42.47% -> 42.47%     
client [64] (testset)   loss: 2.3246 -> 2.3142  accuracy: 22.86% -> 20.00%     
client [77] (testset)   loss: 2.3342 -> 2.3171  accuracy: 30.00% -> 30.00%     
client [55] (testset)   loss: 2.3555 -> 2.3183  accuracy: 42.62% -> 42.62%     
client [12] (testset)   loss: 2.3525 -> 2.3320  accuracy: 0.00% -> 22.03%      
client [89] (testset)   loss: 2.2291 -> 2.1787  accuracy: 46.88% -> 46.88%     
---------------------------- TRAINING EPOCH: 170 ----------------------------  
client [84] (testset)   loss: 1.9850 -> 1.9497  accuracy: 38.53% -> 38.53%     
client [51] (testset)   loss: 2.2041 -> 2.1429  accuracy: 47.42% -> 47.42%     
client [8]  (testset)   loss: 2.1560 -> 2.1255  accuracy: 34.17% -> 34.17%     
client [18] (testset)   loss: 2.3829 -> 2.3789  accuracy: 6.98% -> 6.98%       
client [94] (testset)   loss: 2.3242 -> 2.2877  accuracy: 31.71% -> 31.71%     
client [81] (testset)   loss: 2.2248 -> 2.2073  accuracy: 35.14% -> 35.14%     
client [3]  (testset)   loss: 2.3851 -> 2.3834  accuracy: 9.26% -> 9.26%       
client [11] (testset)   loss: 2.2888 -> 2.2697  accuracy: 21.43% -> 21.43%     
client [95] (testset)   loss: 2.1731 -> 2.1548  accuracy: 34.25% -> 34.25%     
client [67] (testset)   loss: 2.3362 -> 2.3206  accuracy: 19.30% -> 19.30%     
---------------------------- TRAINING EPOCH: 180 ----------------------------  
client [21] (testset)   loss: 2.3524 -> 2.3300  accuracy: 0.00% -> 26.32%      
client [79] (testset)   loss: 2.3391 -> 2.3311  accuracy: 21.15% -> 21.15%     
client [58] (testset)   loss: 2.0568 -> 2.0280  accuracy: 42.47% -> 42.47%     
client [88] (testset)   loss: 2.3201 -> 2.3099  accuracy: 15.79% -> 15.79%     
client [46] (testset)   loss: 2.2271 -> 2.1956  accuracy: 48.94% -> 48.94%     
client [11] (testset)   loss: 2.2787 -> 2.2612  accuracy: 21.43% -> 21.43%     
client [55] (testset)   loss: 2.2244 -> 2.1953  accuracy: 42.62% -> 42.62%     
client [13] (testset)   loss: 2.3706 -> 2.3680  accuracy: 22.22% -> 22.22%     
client [31] (testset)   loss: 2.3829 -> 2.3604  accuracy: 0.00% -> 44.44%      
client [75] (testset)   loss: 2.3124 -> 2.3026  accuracy: 22.22% -> 22.22%     
---------------------------- TRAINING EPOCH: 190 ----------------------------  
client [19] (testset)   loss: 2.2997 -> 2.2858  accuracy: 23.21% -> 23.21%     
client [7]  (testset)   loss: 2.3433 -> 2.3198  accuracy: 3.28% -> 32.79%      
client [57] (testset)   loss: 2.3405 -> 2.3150  accuracy: 34.78% -> 34.78%     
client [13] (testset)   loss: 2.3503 -> 2.3474  accuracy: 22.22% -> 22.22%     
client [43] (testset)   loss: 1.8713 -> 1.8100  accuracy: 57.89% -> 57.89%     
client [91] (testset)   loss: 2.3204 -> 2.3089  accuracy: 37.93% -> 37.93%     
client [10] (testset)   loss: 2.3312 -> 2.3260  accuracy: 38.89% -> 38.89%     
client [64] (testset)   loss: 2.3029 -> 2.2938  accuracy: 20.00% -> 20.00%     
client [82] (testset)   loss: 2.2105 -> 2.1914  accuracy: 11.94% -> 11.94%     
client [22] (testset)   loss: 2.3335 -> 2.3049  accuracy: 0.00% -> 0.00%       
---------------------------- TRAINING EPOCH: 200 ----------------------------  
client [20] (testset)   loss: 2.4191 -> 2.4028  accuracy: 0.00% -> 0.00%       
client [23] (testset)   loss: 2.4011 -> 2.3895  accuracy: 2.94% -> 2.94%       
client [88] (testset)   loss: 2.4077 -> 2.3920  accuracy: 0.00% -> 0.00%       
client [98] (testset)   loss: 2.2570 -> 2.2416  accuracy: 37.74% -> 37.74%     
client [79] (testset)   loss: 2.3411 -> 2.3339  accuracy: 21.15% -> 21.15%     
client [21] (testset)   loss: 2.3144 -> 2.2945  accuracy: 26.32% -> 26.32%     
client [92] (testset)   loss: 2.3247 -> 2.3124  accuracy: 26.47% -> 26.47%     
client [56] (testset)   loss: 2.3261 -> 2.3134  accuracy: 7.27% -> 7.27%       
client [5]  (testset)   loss: 2.3505 -> 2.3358  accuracy: 26.09% -> 26.09%     
client [52] (testset)   loss: 2.0614 -> 2.0116  accuracy: 57.14% -> 57.14%     
---------------------------- TRAINING EPOCH: 210 ----------------------------  
client [67] (testset)   loss: 2.2760 -> 2.2649  accuracy: 19.30% -> 19.30%     
client [54] (testset)   loss: 2.3323 -> 2.3244  accuracy: 18.75% -> 18.75%     
client [14] (testset)   loss: 2.2514 -> 2.2401  accuracy: 31.88% -> 31.88%     
client [99] (testset)   loss: 2.3128 -> 2.3059  accuracy: 20.51% -> 20.51%     
client [36] (testset)   loss: 2.2750 -> 2.2633  accuracy: 24.49% -> 24.49%     
client [30] (testset)   loss: 2.3741 -> 2.3705  accuracy: 15.15% -> 15.15%     
client [38] (testset)   loss: 2.3463 -> 2.3386  accuracy: 18.92% -> 18.92%     
client [15] (testset)   loss: 2.0652 -> 2.0075  accuracy: 61.04% -> 61.04%     
client [6]  (testset)   loss: 2.2444 -> 2.2327  accuracy: 21.54% -> 21.54%     
client [53] (testset)   loss: 2.2301 -> 2.2128  accuracy: 38.71% -> 38.71%     
---------------------------- TRAINING EPOCH: 220 ----------------------------  
client [99] (testset)   loss: 2.3280 -> 2.3207  accuracy: 20.51% -> 20.51%     
client [6]  (testset)   loss: 2.2612 -> 2.2488  accuracy: 21.54% -> 21.54%     
client [83] (testset)   loss: 2.2981 -> 2.2874  accuracy: 19.57% -> 19.57%     
client [42] (testset)   loss: 2.3675 -> 2.3611  accuracy: 7.14% -> 7.14%       
client [34] (testset)   loss: 2.2913 -> 2.2686  accuracy: 24.59% -> 24.59%     
client [15] (testset)   loss: 1.9792 -> 1.9306  accuracy: 61.04% -> 61.04%     
client [47] (testset)   loss: 2.0035 -> 1.9869  accuracy: 47.22% -> 47.22%     
client [55] (testset)   loss: 2.1240 -> 2.1030  accuracy: 42.62% -> 42.62%     
client [51] (testset)   loss: 2.0507 -> 2.0113  accuracy: 47.42% -> 47.42%     
client [95] (testset)   loss: 2.1130 -> 2.1017  accuracy: 34.25% -> 34.25%     
---------------------------- TRAINING EPOCH: 230 ----------------------------  
client [71] (testset)   loss: 2.3046 -> 2.2912  accuracy: 23.33% -> 23.33%     
client [15] (testset)   loss: 1.9682 -> 1.9225  accuracy: 61.04% -> 61.04%     
client [33] (testset)   loss: 2.2942 -> 2.2713  accuracy: 44.44% -> 44.44%     
client [99] (testset)   loss: 2.3071 -> 2.3002  accuracy: 20.51% -> 20.51%     
client [90] (testset)   loss: 2.3074 -> 2.2849  accuracy: 25.00% -> 25.00%     
client [57] (testset)   loss: 2.2087 -> 2.1964  accuracy: 34.78% -> 34.78%     
client [27] (testset)   loss: 2.1585 -> 2.1411  accuracy: 38.75% -> 38.75%     
client [78] (testset)   loss: 2.1933 -> 2.1764  accuracy: 22.73% -> 22.73%     
client [36] (testset)   loss: 2.2481 -> 2.2379  accuracy: 24.49% -> 24.49%     
client [88] (testset)   loss: 2.3011 -> 2.2930  accuracy: 22.81% -> 22.81%     
---------------------------- TRAINING EPOCH: 240 ----------------------------  
client [70] (testset)   loss: 2.3639 -> 2.3553  accuracy: 0.00% -> 25.00%      
client [35] (testset)   loss: 2.3659 -> 2.3504  accuracy: 2.78% -> 2.78%       
client [16] (testset)   loss: 2.2820 -> 2.2748  accuracy: 26.67% -> 26.67%     
client [80] (testset)   loss: 2.2600 -> 2.2485  accuracy: 38.18% -> 38.18%     
client [38] (testset)   loss: 2.3132 -> 2.3069  accuracy: 18.92% -> 18.92%     
client [78] (testset)   loss: 2.1555 -> 2.1414  accuracy: 22.73% -> 22.73%     
client [68] (testset)   loss: 2.1752 -> 2.1521  accuracy: 37.78% -> 37.78%     
client [11] (testset)   loss: 2.1932 -> 2.1808  accuracy: 30.36% -> 30.36%     
client [64] (testset)   loss: 2.2561 -> 2.2507  accuracy: 20.00% -> 20.00%     
client [82] (testset)   loss: 2.1313 -> 2.1185  accuracy: 11.94% -> 11.94%     
---------------------------- TRAINING EPOCH: 250 ----------------------------  
client [30] (testset)   loss: 2.3829 -> 2.3802  accuracy: 15.15% -> 15.15%     
client [27] (testset)   loss: 2.1185 -> 2.1046  accuracy: 38.75% -> 38.75%     
client [74] (testset)   loss: 2.2448 -> 2.2312  accuracy: 28.07% -> 28.07%     
client [45] (testset)   loss: 2.2744 -> 2.2637  accuracy: 34.78% -> 34.78%     
client [6]  (testset)   loss: 2.2381 -> 2.2267  accuracy: 21.54% -> 21.54%     
client [36] (testset)   loss: 2.2370 -> 2.2273  accuracy: 24.49% -> 24.49%     
client [63] (testset)   loss: 2.2410 -> 2.2260  accuracy: 31.67% -> 31.67%     
client [76] (testset)   loss: 2.2141 -> 2.2028  accuracy: 27.78% -> 27.78%     
client [83] (testset)   loss: 2.2807 -> 2.2717  accuracy: 19.57% -> 19.57%     
client [86] (testset)   loss: 1.9330 -> 1.9166  accuracy: 48.44% -> 48.44%     
---------------------------- TRAINING EPOCH: 260 ----------------------------  
client [83] (testset)   loss: 2.2696 -> 2.2607  accuracy: 19.57% -> 19.57%     
client [99] (testset)   loss: 2.2972 -> 2.2909  accuracy: 20.51% -> 20.51%     
client [74] (testset)   loss: 2.2445 -> 2.2314  accuracy: 28.07% -> 28.07%     
client [73] (testset)   loss: 2.3465 -> 2.3442  accuracy: 21.05% -> 21.05%     
client [29] (testset)   loss: 2.1688 -> 2.1374  accuracy: 37.66% -> 37.66%     
client [92] (testset)   loss: 2.3039 -> 2.2929  accuracy: 26.47% -> 26.47%     
client [6]  (testset)   loss: 2.2344 -> 2.2242  accuracy: 21.54% -> 21.54%     
client [61] (testset)   loss: 2.2515 -> 2.2414  accuracy: 26.67% -> 26.67%     
client [21] (testset)   loss: 2.2527 -> 2.2362  accuracy: 26.32% -> 26.32%     
client [67] (testset)   loss: 2.2427 -> 2.2334  accuracy: 19.30% -> 19.30%     
---------------------------- TRAINING EPOCH: 270 ----------------------------  
client [83] (testset)   loss: 2.2799 -> 2.2704  accuracy: 19.57% -> 19.57%     
client [32] (testset)   loss: 2.2150 -> 2.2000  accuracy: 30.43% -> 30.43%     
client [95] (testset)   loss: 2.1113 -> 2.1010  accuracy: 34.25% -> 34.25%     
client [61] (testset)   loss: 2.2168 -> 2.2103  accuracy: 26.67% -> 26.67%     
client [27] (testset)   loss: 2.1151 -> 2.1018  accuracy: 38.75% -> 38.75%     
client [25] (testset)   loss: 2.3925 -> 2.3903  accuracy: 12.00% -> 12.00%     
client [68] (testset)   loss: 2.1536 -> 2.1320  accuracy: 37.78% -> 37.78%     
client [34] (testset)   loss: 2.2442 -> 2.2244  accuracy: 24.59% -> 24.59%     
client [71] (testset)   loss: 2.2559 -> 2.2471  accuracy: 23.33% -> 23.33%     
client [89] (testset)   loss: 1.9767 -> 1.9589  accuracy: 46.88% -> 46.88%     
---------------------------- TRAINING EPOCH: 280 ----------------------------  
client [78] (testset)   loss: 2.1500 -> 2.1379  accuracy: 22.73% -> 22.73%     
client [81] (testset)   loss: 2.1186 -> 2.1099  accuracy: 35.14% -> 35.14%     
client [51] (testset)   loss: 1.9211 -> 1.9079  accuracy: 47.42% -> 47.42%     
client [54] (testset)   loss: 2.2972 -> 2.2936  accuracy: 18.75% -> 18.75%     
client [65] (testset)   loss: 2.1658 -> 2.1538  accuracy: 37.74% -> 37.74%     
client [41] (testset)   loss: 2.1470 -> 2.1379  accuracy: 26.92% -> 26.92%     
client [11] (testset)   loss: 2.1606 -> 2.1496  accuracy: 30.36% -> 30.36%     
client [85] (testset)   loss: 2.1814 -> 2.1703  accuracy: 29.33% -> 29.33%     
client [12] (testset)   loss: 2.2635 -> 2.2476  accuracy: 23.73% -> 23.73%     
client [23] (testset)   loss: 2.3128 -> 2.3051  accuracy: 2.94% -> 20.59%      
---------------------------- TRAINING EPOCH: 290 ----------------------------  
client [16] (testset)   loss: 2.2343 -> 2.2280  accuracy: 26.67% -> 26.67%     
client [65] (testset)   loss: 2.1570 -> 2.1483  accuracy: 37.74% -> 37.74%     
client [53] (testset)   loss: 2.1117 -> 2.1068  accuracy: 38.71% -> 38.71%     
client [58] (testset)   loss: 1.8805 -> 1.8678  accuracy: 42.47% -> 42.47%     
client [72] (testset)   loss: 1.9320 -> 1.9126  accuracy: 53.70% -> 53.70%     
client [7]  (testset)   loss: 2.1467 -> 2.1367  accuracy: 32.79% -> 32.79%     
client [71] (testset)   loss: 2.2492 -> 2.2409  accuracy: 23.33% -> 23.33%     
client [59] (testset)   loss: 2.2256 -> 2.2185  accuracy: 24.14% -> 24.14%     
client [86] (testset)   loss: 1.9052 -> 1.8926  accuracy: 48.44% -> 48.44%     
client [39] (testset)   loss: 1.5577 -> 1.5453  accuracy: 53.77% -> 53.77%     
---------------------------- TRAINING EPOCH: 300 ----------------------------  
client [99] (testset)   loss: 2.2870 -> 2.2812  accuracy: 20.51% -> 20.51%     
client [7]  (testset)   loss: 2.1387 -> 2.1295  accuracy: 32.79% -> 32.79%     
client [17] (testset)   loss: 2.0882 -> 2.0834  accuracy: 32.00% -> 32.00%     
client [64] (testset)   loss: 2.2216 -> 2.2188  accuracy: 20.00% -> 20.00%     
client [37] (testset)   loss: 2.0891 -> 2.0810  accuracy: 40.48% -> 40.48%     
client [29] (testset)   loss: 2.0396 -> 2.0207  accuracy: 37.66% -> 37.66%     
client [93] (testset)   loss: 1.8248 -> 1.8106  accuracy: 45.65% -> 45.65%     
client [73] (testset)   loss: 2.3178 -> 2.3164  accuracy: 21.05% -> 21.05%     
client [40] (testset)   loss: 2.2398 -> 2.2338  accuracy: 21.74% -> 21.74%     
client [76] (testset)   loss: 2.1811 -> 2.1714  accuracy: 27.78% -> 27.78%     
---------------------------- TRAINING EPOCH: 310 ----------------------------  
client [31] (testset)   loss: 2.1742 -> 2.1600  accuracy: 44.44% -> 44.44%     
client [89] (testset)   loss: 1.9720 -> 1.9563  accuracy: 46.88% -> 46.88%     
client [77] (testset)   loss: 2.2079 -> 2.1982  accuracy: 30.00% -> 30.00%     
client [90] (testset)   loss: 2.2719 -> 2.2550  accuracy: 25.00% -> 25.00%     
client [26] (testset)   loss: 2.3836 -> 2.3726  accuracy: 3.51% -> 3.51%       
client [50] (testset)   loss: 2.1888 -> 2.1827  accuracy: 29.87% -> 29.87%     
client [30] (testset)   loss: 2.3592 -> 2.3582  accuracy: 15.15% -> 15.15%     
client [70] (testset)   loss: 2.2865 -> 2.2819  accuracy: 25.00% -> 25.00%     
client [41] (testset)   loss: 2.1113 -> 2.1038  accuracy: 26.92% -> 26.92%     
client [99] (testset)   loss: 2.3124 -> 2.3052  accuracy: 0.00% -> 0.00%       
---------------------------- TRAINING EPOCH: 320 ----------------------------  
client [68] (testset)   loss: 1.9649 -> 1.9538  accuracy: 37.78% -> 37.78%     
client [70] (testset)   loss: 2.2346 -> 2.2310  accuracy: 25.00% -> 25.00%     
client [52] (testset)   loss: 1.6729 -> 1.6528  accuracy: 57.14% -> 57.14%     
client [1]  (testset)   loss: 2.4796 -> 2.4759  accuracy: 0.00% -> 0.00%       
client [2]  (testset)   loss: 1.8421 -> 1.8369  accuracy: 49.40% -> 49.40%     
client [67] (testset)   loss: 2.2215 -> 2.2140  accuracy: 19.30% -> 19.30%     
client [92] (testset)   loss: 2.2176 -> 2.2128  accuracy: 26.47% -> 26.47%     
client [35] (testset)   loss: 2.3051 -> 2.2930  accuracy: 0.00% -> 33.33%      
client [36] (testset)   loss: 2.2089 -> 2.2011  accuracy: 24.49% -> 24.49%     
client [64] (testset)   loss: 2.2424 -> 2.2377  accuracy: 20.00% -> 20.00%     
---------------------------- TRAINING EPOCH: 330 ----------------------------  
client [44] (testset)   loss: 2.2111 -> 2.2047  accuracy: 23.21% -> 23.21%     
client [6]  (testset)   loss: 2.1820 -> 2.1757  accuracy: 21.54% -> 21.54%     
client [12] (testset)   loss: 2.2743 -> 2.2573  accuracy: 0.00% -> 0.00%       
client [55] (testset)   loss: 2.0799 -> 2.0631  accuracy: 42.62% -> 42.62%     
client [29] (testset)   loss: 2.0033 -> 1.9886  accuracy: 37.66% -> 37.66%     
client [9]  (testset)   loss: 2.2841 -> 2.2811  accuracy: 13.33% -> 13.33%     
client [43] (testset)   loss: 1.6035 -> 1.5935  accuracy: 57.89% -> 57.89%     
client [77] (testset)   loss: 2.1465 -> 2.1398  accuracy: 30.00% -> 30.00%     
client [98] (testset)   loss: 2.2035 -> 2.1924  accuracy: 37.74% -> 37.74%     
client [78] (testset)   loss: 2.1156 -> 2.1063  accuracy: 22.73% -> 22.73%     
---------------------------- TRAINING EPOCH: 340 ----------------------------  
client [92] (testset)   loss: 2.2459 -> 2.2398  accuracy: 26.47% -> 26.47%     
client [80] (testset)   loss: 2.2205 -> 2.2094  accuracy: 38.18% -> 38.18%     
client [63] (testset)   loss: 2.1914 -> 2.1827  accuracy: 31.67% -> 31.67%     
client [76] (testset)   loss: 2.1580 -> 2.1493  accuracy: 27.78% -> 27.78%     
client [78] (testset)   loss: 2.1003 -> 2.0922  accuracy: 22.73% -> 22.73%     
client [25] (testset)   loss: 2.3819 -> 2.3806  accuracy: 12.00% -> 12.00%     
client [58] (testset)   loss: 1.8315 -> 1.8227  accuracy: 42.47% -> 42.47%     
client [13] (testset)   loss: 2.3290 -> 2.3275  accuracy: 22.22% -> 22.22%     
client [17] (testset)   loss: 2.1012 -> 2.0965  accuracy: 32.00% -> 32.00%     
client [38] (testset)   loss: 2.2489 -> 2.2464  accuracy: 18.92% -> 18.92%     
---------------------------- TRAINING EPOCH: 350 ----------------------------  
client [72] (testset)   loss: 1.8725 -> 1.8628  accuracy: 53.70% -> 53.70%     
client [82] (testset)   loss: 2.0271 -> 2.0226  accuracy: 40.30% -> 40.30%     
client [86] (testset)   loss: 1.8200 -> 1.8147  accuracy: 48.44% -> 48.44%     
client [51] (testset)   loss: 1.8887 -> 1.8821  accuracy: 47.42% -> 47.42%     
client [96] (testset)   loss: 2.1738 -> 2.1659  accuracy: 30.36% -> 30.36%     
client [42] (testset)   loss: 2.3760 -> 2.3708  accuracy: 7.14% -> 7.14%       
client [55] (testset)   loss: 2.0239 -> 2.0124  accuracy: 42.62% -> 42.62%     
client [13] (testset)   loss: 2.3315 -> 2.3314  accuracy: 22.22% -> 22.22%     
client [1]  (testset)   loss: 2.4662 -> 2.4635  accuracy: 4.17% -> 4.17%       
client [12] (testset)   loss: 2.1856 -> 2.1744  accuracy: 23.73% -> 23.73%     
---------------------------- TRAINING EPOCH: 360 ----------------------------  
client [68] (testset)   loss: 1.9590 -> 1.9487  accuracy: 37.78% -> 37.78%     
client [23] (testset)   loss: 2.2399 -> 2.2355  accuracy: 20.59% -> 20.59%     
client [46] (testset)   loss: 1.9344 -> 1.9244  accuracy: 48.94% -> 48.94%     
client [41] (testset)   loss: 2.1124 -> 2.1052  accuracy: 26.92% -> 26.92%     
client [25] (testset)   loss: 2.4140 -> 2.4113  accuracy: 12.00% -> 12.00%     
client [58] (testset)   loss: 1.8184 -> 1.8109  accuracy: 42.47% -> 42.47%     
client [14] (testset)   loss: 2.1533 -> 2.1487  accuracy: 31.88% -> 31.88%     
client [33] (testset)   loss: 2.1298 -> 2.1165  accuracy: 22.22% -> 22.22%     
client [85] (testset)   loss: 2.1609 -> 2.1534  accuracy: 29.33% -> 29.33%     
client [62] (testset)   loss: 2.2160 -> 2.2050  accuracy: 41.38% -> 41.38%     
---------------------------- TRAINING EPOCH: 370 ----------------------------  
client [98] (testset)   loss: 2.0935 -> 2.0899  accuracy: 37.74% -> 37.74%     
client [63] (testset)   loss: 2.1443 -> 2.1390  accuracy: 31.67% -> 31.67%     
client [70] (testset)   loss: 2.2439 -> 2.2422  accuracy: 25.00% -> 25.00%     
client [65] (testset)   loss: 2.1177 -> 2.1079  accuracy: 37.74% -> 37.74%     
client [14] (testset)   loss: 2.1831 -> 2.1769  accuracy: 31.88% -> 31.88%     
client [73] (testset)   loss: 2.3383 -> 2.3358  accuracy: 21.05% -> 21.05%     
client [34] (testset)   loss: 2.1939 -> 2.1792  accuracy: 24.59% -> 24.59%     
client [99] (testset)   loss: 2.2635 -> 2.2582  accuracy: 20.51% -> 20.51%     
client [69] (testset)   loss: 2.2338 -> 2.2265  accuracy: 29.41% -> 29.41%     
client [46] (testset)   loss: 1.9631 -> 1.9508  accuracy: 48.94% -> 48.94%     
---------------------------- TRAINING EPOCH: 380 ----------------------------  
client [99] (testset)   loss: 2.2244 -> 2.2203  accuracy: 20.51% -> 20.51%     
client [93] (testset)   loss: 1.8291 -> 1.8170  accuracy: 45.65% -> 45.65%     
client [11] (testset)   loss: 2.0947 -> 2.0873  accuracy: 30.36% -> 30.36%     
client [58] (testset)   loss: 1.7929 -> 1.7868  accuracy: 42.47% -> 42.47%     
client [81] (testset)   loss: 2.1718 -> 2.1566  accuracy: 35.14% -> 35.14%     
client [85] (testset)   loss: 2.1234 -> 2.1179  accuracy: 29.33% -> 29.33%     
client [89] (testset)   loss: 1.9107 -> 1.9041  accuracy: 46.88% -> 46.88%     
client [45] (testset)   loss: 2.1649 -> 2.1600  accuracy: 34.78% -> 34.78%     
client [8]  (testset)   loss: 2.0005 -> 1.9943  accuracy: 34.17% -> 34.17%     
client [68] (testset)   loss: 1.9745 -> 1.9623  accuracy: 37.78% -> 37.78%     
---------------------------- TRAINING EPOCH: 390 ----------------------------  
client [67] (testset)   loss: 2.2700 -> 2.2603  accuracy: 19.30% -> 19.30%     
client [72] (testset)   loss: 1.8076 -> 1.8030  accuracy: 53.70% -> 53.70%     
client [1]  (testset)   loss: 2.3964 -> 2.3964  accuracy: 4.17% -> 4.17%       
client [78] (testset)   loss: 2.0818 -> 2.0753  accuracy: 22.73% -> 22.73%     
client [83] (testset)   loss: 2.1885 -> 2.1854  accuracy: 19.57% -> 19.57%     
client [21] (testset)   loss: 2.1399 -> 2.1323  accuracy: 26.32% -> 26.32%     
client [56] (testset)   loss: 2.2281 -> 2.2227  accuracy: 7.27% -> 7.27%       
client [44] (testset)   loss: 2.2824 -> 2.2727  accuracy: 23.21% -> 23.21%     
client [92] (testset)   loss: 2.2034 -> 2.1997  accuracy: 26.47% -> 26.47%     
client [27] (testset)   loss: 2.0874 -> 2.0792  accuracy: 38.75% -> 38.75%     
---------------------------- TRAINING EPOCH: 400 ----------------------------  
client [10] (testset)   loss: 2.1946 -> 2.1912  accuracy: 38.89% -> 38.89%     
client [39] (testset)   loss: 1.5294 -> 1.5208  accuracy: 53.77% -> 53.77%     
client [65] (testset)   loss: 2.2986 -> 2.2772  accuracy: 1.89% -> 1.89%       
client [26] (testset)   loss: 2.5077 -> 2.4883  accuracy: 1.75% -> 1.75%       
client [19] (testset)   loss: 2.2280 -> 2.2188  accuracy: 23.21% -> 23.21%     
client [68] (testset)   loss: 2.0017 -> 1.9884  accuracy: 37.78% -> 37.78%     
client [41] (testset)   loss: 2.0712 -> 2.0663  accuracy: 26.92% -> 26.92%     
client [50] (testset)   loss: 2.1961 -> 2.1922  accuracy: 29.87% -> 29.87%     
client [75] (testset)   loss: 2.2077 -> 2.2019  accuracy: 22.22% -> 22.22%     
client [81] (testset)   loss: 2.0898 -> 2.0828  accuracy: 35.14% -> 35.14%     
Training... ---------------------------------------- 100% 0:33:43
FedDpa's average time taken by each global epoch: 0 min 4.68 sec.              
FedDpa's total running time: 0 h 33 m 43 s.                                    
==================== FedDpa Experiment Results: ====================           
Display format: (before local fine-tuning) -> (after local fine-tuning)        
 So if finetune_epoch = 0, x.xx% -> 0.00% is normal.                           
 Centralized testing ONLY happens after model aggregation, so the stats between
'->' are the same.                                                             
{                                                                              
    "100": {                                                                   
        "all_clients": {                                                       
            "test": {                                                          
                "loss": "2.0114 -> 0.0000",                                    
                "accuracy": "31.29% -> 0.00%"                                  
            }                                                                  
        }                                                                      
    },                                                                         
    "200": {                                                                   
        "all_clients": {                                                       
            "test": {                                                          
                "loss": "2.2426 -> 0.0000",                                    
                "accuracy": "23.16% -> 0.00%"                                  
            }                                                                  
        }                                                                      
    },                                                                         
    "300": {                                                                   
        "all_clients": {                                                       
            "test": {                                                          
                "loss": "2.1306 -> 0.0000",                                    
                "accuracy": "31.00% -> 0.00%"                                  
            }                                                                  
        }                                                                      
    },                                                                         
    "400": {                                                                   
        "all_clients": {                                                       
            "test": {                                                          
                "loss": "2.1465 -> 0.0000",                                    
                "accuracy": "27.82% -> 0.00%"                                  
            }                                                                  
        }                                                                      
    }                                                                          
}                                                                              
==================== FedDpa Max Accuracy ====================                  
all_clients:                                                                   
(test) before fine-tuning: 31.29% at epoch 100                                 
(test) after fine-tuning: 0.00% at epoch 100                                   
[0m