==================== FedDpa ====================                               
Experiment Arguments:                                                          
{
│   'method': 'feddpa',
│   'dataset': {
│   │   'name': 'emnist',
│   │   'client_num': 100,
│   │   'test_ratio': 0.25,
│   │   'val_ratio': 0.0,
│   │   'seed': 42,
│   │   'split': 'sample',
│   │   'IID_ratio': 0.0,
│   │   'monitor_window_name_suffix': 'emnist-100clients-0%IID-Dir(1.0)-seed42',
│   │   'emnist_split': 'byclass',
│   │   'alpha': 1.0,
│   │   'min_samples_per_client': 10
│   },
│   'model': {
│   │   'name': 'avgcnn',
│   │   'use_torchvision_pretrained_weights': True,
│   │   'external_model_weights_path': None
│   },
│   'optimizer': {
│   │   'lr': 0.01,
│   │   'dampening': 0,
│   │   'weight_decay': 0,
│   │   'momentum': 0,
│   │   'nesterov': False,
│   │   'name': 'sgd'
│   },
│   'mode': 'sequential',
│   'parallel': {
│   │   'ray_cluster_addr': None,
│   │   'num_cpus': None,
│   │   'num_gpus': None,
│   │   'num_workers': 2
│   },
│   'common': {
│   │   'seed': 42,
│   │   'join_ratio': 0.1,
│   │   'global_epoch': 400,
│   │   'local_epoch': 5,
│   │   'batch_size': 32,
│   │   'reset_optimizer_on_global_epoch': True,
│   │   'straggler_ratio': 0,
│   │   'straggler_min_local_epoch': 0,
│   │   'buffers': 'global',
│   │   'client_side_evaluation': True,
│   │   'test': {
│   │   │   'client': {
│   │   │   │   'interval': 100,
│   │   │   │   'finetune_epoch': 0,
│   │   │   │   'train': False,
│   │   │   │   'val': False,
│   │   │   │   'test': True
│   │   │   },
│   │   │   'server': {
│   │   │   │   'interval': -1,
│   │   │   │   'train': False,
│   │   │   │   'val': False,
│   │   │   │   'test': False,
│   │   │   │   'model_in_train_mode': False
│   │   │   }
│   │   },
│   │   'verbose_gap': 10,
│   │   'monitor': None,
│   │   'use_cuda': True,
│   │   'save_log': True,
│   │   'save_model': False,
│   │   'save_learning_curve_plot': False,
│   │   'save_metrics': True,
│   │   'delete_useless_run': True
│   },
│   'feddpa': {
│   │   'fisher_threshold': 0.99
│   }
}
---------------------------- TRAINING EPOCH: 10 ----------------------------   
client [77] (testset)   loss: 0.3965 -> 0.3899  accuracy: 86.05% -> 87.36%     
client [81] (testset)   loss: 0.3929 -> 0.3133  accuracy: 87.65% -> 90.63%     
client [21] (testset)   loss: 0.6060 -> 0.5011  accuracy: 80.79% -> 83.73%     
client [68] (testset)   loss: 0.4789 -> 0.3814  accuracy: 84.15% -> 87.94%     
client [93] (testset)   loss: 0.5935 -> 0.4709  accuracy: 81.19% -> 85.17%     
client [31] (testset)   loss: 0.5332 -> 0.4551  accuracy: 81.80% -> 84.11%     
client [20] (testset)   loss: 0.6383 -> 0.5323  accuracy: 79.84% -> 83.44%     
client [59] (testset)   loss: 0.4942 -> 0.3053  accuracy: 83.67% -> 91.06%     
client [48] (testset)   loss: 0.4762 -> 0.4248  accuracy: 86.34% -> 88.13%     
client [34] (testset)   loss: 0.4777 -> 0.4196  accuracy: 85.31% -> 85.85%     
---------------------------- TRAINING EPOCH: 20 ----------------------------   
client [69] (testset)   loss: 0.5091 -> 0.3976  accuracy: 84.88% -> 88.24%     
client [99] (testset)   loss: 0.6612 -> 0.5843  accuracy: 78.83% -> 83.04%     
client [67] (testset)   loss: 0.4670 -> 0.3765  accuracy: 87.00% -> 90.81%     
client [0]  (testset)   loss: 0.4881 -> 0.4457  accuracy: 85.39% -> 87.19%     
client [76] (testset)   loss: 0.6268 -> 0.4663  accuracy: 82.64% -> 86.84%     
client [41] (testset)   loss: 0.6299 -> 0.5489  accuracy: 80.06% -> 81.11%     
client [62] (testset)   loss: 0.6363 -> 0.3578  accuracy: 78.18% -> 89.79%     
client [2]  (testset)   loss: 0.5319 -> 0.3992  accuracy: 85.06% -> 88.77%     
client [14] (testset)   loss: 0.6135 -> 0.4987  accuracy: 82.50% -> 85.69%     
client [46] (testset)   loss: 0.4757 -> 0.3955  accuracy: 86.15% -> 87.04%     
---------------------------- TRAINING EPOCH: 30 ----------------------------   
client [24] (testset)   loss: 0.4566 -> 0.5019  accuracy: 83.80% -> 84.32%     
client [68] (testset)   loss: 0.4845 -> 0.4607  accuracy: 87.29% -> 88.93%     
client [57] (testset)   loss: 0.5144 -> 0.4080  accuracy: 86.89% -> 88.55%     
client [17] (testset)   loss: 0.6413 -> 0.5330  accuracy: 83.21% -> 86.20%     
client [54] (testset)   loss: 0.5529 -> 0.5196  accuracy: 82.53% -> 83.92%     
client [23] (testset)   loss: 0.7670 -> 0.4974  accuracy: 77.26% -> 86.87%     
client [35] (testset)   loss: 0.5229 -> 0.5212  accuracy: 85.89% -> 85.27%     
client [59] (testset)   loss: 0.3924 -> 0.3433  accuracy: 88.33% -> 90.60%     
client [31] (testset)   loss: 0.6092 -> 0.5586  accuracy: 82.01% -> 84.91%     
client [9]  (testset)   loss: 0.5970 -> 0.5102  accuracy: 83.48% -> 85.25%     
---------------------------- TRAINING EPOCH: 40 ----------------------------   
client [64] (testset)   loss: 0.4726 -> 0.4561  accuracy: 86.64% -> 89.06%     
client [33] (testset)   loss: 0.5479 -> 0.4645  accuracy: 84.86% -> 87.14%     
client [16] (testset)   loss: 0.6498 -> 0.6191  accuracy: 84.72% -> 84.65%     
client [44] (testset)   loss: 0.7493 -> 0.5949  accuracy: 80.98% -> 81.49%     
client [8]  (testset)   loss: 0.5049 -> 0.4791  accuracy: 86.22% -> 89.03%     
client [31] (testset)   loss: 0.6331 -> 0.5493  accuracy: 81.90% -> 85.56%     
client [47] (testset)   loss: 0.5292 -> 0.4323  accuracy: 85.28% -> 88.18%     
client [36] (testset)   loss: 0.4045 -> 0.3079  accuracy: 88.42% -> 91.70%     
client [20] (testset)   loss: 0.6348 -> 0.6218  accuracy: 81.75% -> 83.53%     
client [56] (testset)   loss: 0.5683 -> 0.5236  accuracy: 82.87% -> 84.63%     
---------------------------- TRAINING EPOCH: 50 ----------------------------   
client [4]  (testset)   loss: 0.4150 -> 0.3590  accuracy: 87.13% -> 89.93%     
client [60] (testset)   loss: 0.5535 -> 0.4820  accuracy: 85.50% -> 87.44%     
client [28] (testset)   loss: 0.5016 -> 0.4043  accuracy: 86.74% -> 89.83%     
client [25] (testset)   loss: 0.5443 -> 0.4357  accuracy: 84.87% -> 88.18%     
client [58] (testset)   loss: 0.4578 -> 0.5164  accuracy: 87.30% -> 87.70%     
client [44] (testset)   loss: 0.6851 -> 0.6057  accuracy: 80.34% -> 84.68%     
client [39] (testset)   loss: 0.4799 -> 0.4767  accuracy: 84.19% -> 85.54%     
client [29] (testset)   loss: 0.6056 -> 0.5337  accuracy: 82.83% -> 87.08%     
client [3]  (testset)   loss: 0.5117 -> 0.4413  accuracy: 84.31% -> 86.80%     
client [84] (testset)   loss: 0.5271 -> 0.5794  accuracy: 83.87% -> 85.40%     
---------------------------- TRAINING EPOCH: 60 ----------------------------   
client [21] (testset)   loss: 0.7383 -> 0.6228  accuracy: 82.83% -> 84.23%     
client [84] (testset)   loss: 0.6134 -> 0.5829  accuracy: 81.98% -> 84.61%     
client [10] (testset)   loss: 0.6106 -> 0.4777  accuracy: 86.14% -> 87.95%     
client [36] (testset)   loss: 0.3798 -> 0.3610  accuracy: 89.87% -> 91.15%     
client [65] (testset)   loss: 0.4737 -> 0.4621  accuracy: 88.47% -> 88.69%     
client [81] (testset)   loss: 0.5141 -> 0.4203  accuracy: 88.66% -> 90.52%     
client [79] (testset)   loss: 0.4081 -> 0.3957  accuracy: 90.27% -> 91.56%     
client [42] (testset)   loss: 0.5581 -> 0.4933  accuracy: 87.57% -> 89.27%     
client [11] (testset)   loss: 0.6210 -> 0.5697  accuracy: 86.35% -> 88.02%     
client [96] (testset)   loss: 0.5316 -> 0.4836  accuracy: 86.08% -> 87.62%     
---------------------------- TRAINING EPOCH: 70 ----------------------------   
client [8]  (testset)   loss: 0.6028 -> 0.5432  accuracy: 86.26% -> 88.70%     
client [53] (testset)   loss: 0.5118 -> 0.4543  accuracy: 87.76% -> 88.36%     
client [52] (testset)   loss: 0.6061 -> 0.5068  accuracy: 83.34% -> 87.06%     
client [42] (testset)   loss: 0.5505 -> 0.5147  accuracy: 86.80% -> 88.61%     
client [69] (testset)   loss: 0.5781 -> 0.5111  accuracy: 85.49% -> 88.12%     
client [59] (testset)   loss: 0.5411 -> 0.4383  accuracy: 88.46% -> 91.39%     
client [7]  (testset)   loss: 0.7438 -> 0.6254  accuracy: 80.69% -> 83.46%     
client [26] (testset)   loss: 0.4636 -> 0.4371  accuracy: 87.98% -> 90.20%     
client [49] (testset)   loss: 0.6072 -> 0.5229  accuracy: 81.22% -> 86.53%     
client [98] (testset)   loss: 0.6295 -> 0.6329  accuracy: 84.46% -> 85.87%     
---------------------------- TRAINING EPOCH: 80 ----------------------------   
client [98] (testset)   loss: 0.6191 -> 0.6647  accuracy: 85.27% -> 85.82%     
client [47] (testset)   loss: 0.6357 -> 0.5481  accuracy: 85.12% -> 87.34%     
client [21] (testset)   loss: 0.7165 -> 0.6991  accuracy: 82.87% -> 84.01%     
client [77] (testset)   loss: 0.5720 -> 0.5787  accuracy: 84.47% -> 86.76%     
client [95] (testset)   loss: 0.5645 -> 0.5148  accuracy: 88.25% -> 90.10%     
client [91] (testset)   loss: 0.7478 -> 0.6673  accuracy: 82.31% -> 84.45%     
client [14] (testset)   loss: 0.7520 -> 0.6929  accuracy: 83.41% -> 85.63%     
client [99] (testset)   loss: 0.8001 -> 0.7172  accuracy: 80.46% -> 83.36%     
client [20] (testset)   loss: 0.8161 -> 0.7497  accuracy: 80.33% -> 83.67%     
client [39] (testset)   loss: 0.5955 -> 0.5570  accuracy: 84.25% -> 84.92%     
---------------------------- TRAINING EPOCH: 90 ----------------------------   
client [52] (testset)   loss: 0.6060 -> 0.5338  accuracy: 84.66% -> 86.58%     
client [62] (testset)   loss: 0.5309 -> 0.5151  accuracy: 86.88% -> 90.08%     
client [71] (testset)   loss: 0.7036 -> 0.6705  accuracy: 84.20% -> 86.15%     
client [97] (testset)   loss: 0.6039 -> 0.5509  accuracy: 86.94% -> 88.35%     
client [30] (testset)   loss: 0.5891 -> 0.5936  accuracy: 86.14% -> 87.60%     
client [88] (testset)   loss: 0.6675 -> 0.5696  accuracy: 86.44% -> 87.29%     
client [60] (testset)   loss: 0.5861 -> 0.5563  accuracy: 85.70% -> 87.48%     
client [82] (testset)   loss: 0.6469 -> 0.5996  accuracy: 85.07% -> 87.20%     
client [91] (testset)   loss: 0.7531 -> 0.6884  accuracy: 82.50% -> 86.00%     
client [57] (testset)   loss: 0.5728 -> 0.5530  accuracy: 87.51% -> 88.07%     
---------------------------- TRAINING EPOCH: 100 ----------------------------  
client [31] (testset)   loss: 0.8306 -> 0.8115  accuracy: 80.85% -> 83.66%     
client [15] (testset)   loss: 0.6220 -> 0.5714  accuracy: 84.65% -> 84.65%     
client [71] (testset)   loss: 0.7364 -> 0.6503  accuracy: 82.86% -> 86.09%     
client [97] (testset)   loss: 0.5838 -> 0.5997  accuracy: 87.06% -> 88.96%     
client [53] (testset)   loss: 0.5325 -> 0.4951  accuracy: 88.24% -> 88.64%     
client [77] (testset)   loss: 0.6625 -> 0.6010  accuracy: 84.99% -> 87.55%     
client [76] (testset)   loss: 0.6808 -> 0.6257  accuracy: 84.99% -> 87.29%     
client [79] (testset)   loss: 0.4916 -> 0.4532  accuracy: 90.63% -> 90.58%     
client [28] (testset)   loss: 0.5395 -> 0.5263  accuracy: 88.92% -> 89.33%     
client [99] (testset)   loss: 0.8612 -> 0.7708  accuracy: 79.41% -> 82.78%     
---------------------------- TRAINING EPOCH: 110 ----------------------------  
client [97] (testset)   loss: 0.5984 -> 0.5891  accuracy: 85.90% -> 88.27%     
client [86] (testset)   loss: 0.5644 -> 0.5186  accuracy: 88.16% -> 89.38%     
client [34] (testset)   loss: 0.6892 -> 0.6956  accuracy: 84.29% -> 85.80%     
client [73] (testset)   loss: 0.6038 -> 0.5981  accuracy: 86.96% -> 88.30%     
client [5]  (testset)   loss: 0.5369 -> 0.5089  accuracy: 89.50% -> 90.40%     
client [96] (testset)   loss: 0.6657 -> 0.6688  accuracy: 84.78% -> 86.85%     
client [22] (testset)   loss: 0.7855 -> 0.7053  accuracy: 86.02% -> 87.46%     
client [60] (testset)   loss: 0.6656 -> 0.6188  accuracy: 86.47% -> 87.64%     
client [66] (testset)   loss: 0.6998 -> 0.5922  accuracy: 84.97% -> 86.56%     
client [83] (testset)   loss: 0.6633 -> 0.5595  accuracy: 85.06% -> 88.52%     
---------------------------- TRAINING EPOCH: 120 ----------------------------  
client [76] (testset)   loss: 0.6924 -> 0.6411  accuracy: 85.89% -> 87.49%     
client [65] (testset)   loss: 0.5419 -> 0.5350  accuracy: 87.82% -> 88.69%     
client [95] (testset)   loss: 0.5957 -> 0.5734  accuracy: 88.34% -> 89.01%     
client [17] (testset)   loss: 0.9184 -> 0.7761  accuracy: 82.14% -> 85.47%     
client [8]  (testset)   loss: 0.6694 -> 0.6122  accuracy: 84.20% -> 88.05%     
client [35] (testset)   loss: 0.7613 -> 0.7406  accuracy: 86.08% -> 85.71%     
client [98] (testset)   loss: 0.7715 -> 0.7455  accuracy: 84.16% -> 85.57%     
client [53] (testset)   loss: 0.5322 -> 0.5423  accuracy: 87.88% -> 88.40%     
client [43] (testset)   loss: 0.6032 -> 0.5191  accuracy: 86.62% -> 88.07%     
client [64] (testset)   loss: 0.5794 -> 0.5598  accuracy: 87.22% -> 89.18%     
---------------------------- TRAINING EPOCH: 130 ----------------------------  
client [21] (testset)   loss: 0.9042 -> 0.7720  accuracy: 83.37% -> 83.24%     
client [88] (testset)   loss: 0.6636 -> 0.6897  accuracy: 85.59% -> 86.59%     
client [38] (testset)   loss: 0.6940 -> 0.6343  accuracy: 86.36% -> 87.52%     
client [3]  (testset)   loss: 0.6682 -> 0.6347  accuracy: 84.45% -> 85.99%     
client [5]  (testset)   loss: 0.5595 -> 0.5352  accuracy: 87.71% -> 89.44%     
client [41] (testset)   loss: 0.8149 -> 0.7724  accuracy: 79.91% -> 82.46%     
client [7]  (testset)   loss: 0.7695 -> 0.7206  accuracy: 82.37% -> 84.09%     
client [37] (testset)   loss: 0.7897 -> 0.7263  accuracy: 80.76% -> 83.97%     
client [45] (testset)   loss: 0.6707 -> 0.6315  accuracy: 85.22% -> 86.44%     
client [47] (testset)   loss: 0.6701 -> 0.5736  accuracy: 86.67% -> 87.51%     
---------------------------- TRAINING EPOCH: 140 ----------------------------  
client [16] (testset)   loss: 0.8114 -> 0.7534  accuracy: 82.78% -> 85.28%     
client [11] (testset)   loss: 0.6750 -> 0.6969  accuracy: 83.93% -> 87.14%     
client [37] (testset)   loss: 0.8042 -> 0.7527  accuracy: 82.59% -> 83.84%     
client [41] (testset)   loss: 0.8001 -> 0.7757  accuracy: 79.85% -> 81.00%     
client [95] (testset)   loss: 0.6518 -> 0.6067  accuracy: 87.77% -> 89.30%     
client [53] (testset)   loss: 0.6233 -> 0.5689  accuracy: 86.37% -> 88.72%     
client [22] (testset)   loss: 0.8248 -> 0.7300  accuracy: 83.94% -> 87.12%     
client [25] (testset)   loss: 0.7427 -> 0.6327  accuracy: 85.94% -> 87.20%     
client [69] (testset)   loss: 0.6813 -> 0.7020  accuracy: 85.00% -> 86.82%     
client [46] (testset)   loss: 0.6368 -> 0.5826  accuracy: 86.34% -> 87.80%     
---------------------------- TRAINING EPOCH: 150 ----------------------------  
client [47] (testset)   loss: 0.7246 -> 0.7126  accuracy: 86.37% -> 87.59%     
client [69] (testset)   loss: 0.8130 -> 0.7518  accuracy: 85.41% -> 87.27%     
client [82] (testset)   loss: 0.8865 -> 0.8029  accuracy: 85.57% -> 86.25%     
client [45] (testset)   loss: 0.6993 -> 0.7174  accuracy: 86.53% -> 86.58%     
client [7]  (testset)   loss: 0.8301 -> 0.7795  accuracy: 82.94% -> 83.10%     
client [50] (testset)   loss: 0.5561 -> 0.5539  accuracy: 89.64% -> 91.05%     
client [35] (testset)   loss: 0.9142 -> 0.9142  accuracy: 83.92% -> 85.58%     
client [24] (testset)   loss: 0.8104 -> 0.7484  accuracy: 82.63% -> 83.33%     
client [15] (testset)   loss: 0.7191 -> 0.7091  accuracy: 83.51% -> 84.50%     
client [58] (testset)   loss: 0.6944 -> 0.7314  accuracy: 87.22% -> 88.53%     
---------------------------- TRAINING EPOCH: 160 ----------------------------  
client [48] (testset)   loss: 0.8023 -> 0.8388  accuracy: 85.08% -> 86.24%     
client [76] (testset)   loss: 0.7204 -> 0.7001  accuracy: 87.09% -> 88.29%     
client [67] (testset)   loss: 0.6285 -> 0.5700  accuracy: 88.47% -> 89.85%     
client [37] (testset)   loss: 0.8917 -> 0.8101  accuracy: 82.98% -> 83.90%     
client [58] (testset)   loss: 0.7313 -> 0.7108  accuracy: 87.48% -> 88.09%     
client [64] (testset)   loss: 0.6912 -> 0.6711  accuracy: 87.56% -> 88.37%     
client [77] (testset)   loss: 0.7545 -> 0.7131  accuracy: 85.58% -> 87.51%     
client [55] (testset)   loss: 0.7870 -> 0.7332  accuracy: 86.28% -> 87.32%     
client [12] (testset)   loss: 0.6370 -> 0.5788  accuracy: 88.10% -> 88.98%     
client [89] (testset)   loss: 0.6979 -> 0.6916  accuracy: 88.03% -> 88.61%     
---------------------------- TRAINING EPOCH: 170 ----------------------------  
client [84] (testset)   loss: 0.8102 -> 0.8763  accuracy: 84.97% -> 84.42%     
client [51] (testset)   loss: 1.1623 -> 1.1979  accuracy: 79.43% -> 80.47%     
client [8]  (testset)   loss: 0.8183 -> 0.7156  accuracy: 84.72% -> 88.47%     
client [18] (testset)   loss: 0.8409 -> 0.8153  accuracy: 85.05% -> 85.67%     
client [94] (testset)   loss: 0.8716 -> 0.7855  accuracy: 83.20% -> 84.73%     
client [81] (testset)   loss: 0.6330 -> 0.6580  accuracy: 88.61% -> 88.50%     
client [3]  (testset)   loss: 0.7810 -> 0.7867  accuracy: 85.76% -> 85.80%     
client [11] (testset)   loss: 0.8696 -> 0.7710  accuracy: 84.08% -> 87.43%     
client [95] (testset)   loss: 0.6747 -> 0.6684  accuracy: 88.49% -> 89.06%     
client [67] (testset)   loss: 0.6273 -> 0.5751  accuracy: 88.63% -> 89.85%     
---------------------------- TRAINING EPOCH: 180 ----------------------------  
client [21] (testset)   loss: 1.0257 -> 0.8683  accuracy: 83.42% -> 84.59%     
client [79] (testset)   loss: 0.6048 -> 0.6072  accuracy: 89.65% -> 90.85%     
client [58] (testset)   loss: 0.7501 -> 0.8037  accuracy: 87.65% -> 88.31%     
client [88] (testset)   loss: 0.8381 -> 0.7352  accuracy: 86.19% -> 87.44%     
client [46] (testset)   loss: 0.7467 -> 0.6671  accuracy: 85.83% -> 87.74%     
client [11] (testset)   loss: 0.8357 -> 0.8428  accuracy: 83.24% -> 86.59%     
client [55] (testset)   loss: 0.8290 -> 0.8071  accuracy: 87.11% -> 87.53%     
client [13] (testset)   loss: 0.6974 -> 0.6320  accuracy: 88.53% -> 90.25%     
client [31] (testset)   loss: 0.9605 -> 0.9698  accuracy: 82.46% -> 83.16%     
client [75] (testset)   loss: 0.7855 -> 0.7382  accuracy: 85.91% -> 87.82%     
---------------------------- TRAINING EPOCH: 190 ----------------------------  
client [19] (testset)   loss: 0.7378 -> 0.7187  accuracy: 88.24% -> 88.24%     
client [7]  (testset)   loss: 0.8969 -> 0.8726  accuracy: 82.37% -> 83.94%     
client [57] (testset)   loss: 0.8015 -> 0.8025  accuracy: 86.81% -> 87.77%     
client [13] (testset)   loss: 0.7181 -> 0.6856  accuracy: 89.47% -> 90.75%     
client [43] (testset)   loss: 0.7209 -> 0.6469  accuracy: 87.07% -> 88.81%     
client [91] (testset)   loss: 1.1153 -> 0.9480  accuracy: 81.46% -> 83.21%     
client [10] (testset)   loss: 0.8102 -> 0.7688  accuracy: 86.24% -> 87.36%     
client [64] (testset)   loss: 0.7903 -> 0.7231  accuracy: 86.36% -> 88.14%     
client [82] (testset)   loss: 0.9203 -> 0.9010  accuracy: 85.97% -> 86.61%     
client [22] (testset)   loss: 0.9254 -> 0.9024  accuracy: 85.56% -> 87.46%     
---------------------------- TRAINING EPOCH: 200 ----------------------------  
client [20] (testset)   loss: 1.1817 -> 1.0852  accuracy: 80.91% -> 82.38%     
client [23] (testset)   loss: 0.9468 -> 0.8526  accuracy: 84.76% -> 84.37%     
client [88] (testset)   loss: 0.8009 -> 0.7870  accuracy: 86.39% -> 87.14%     
client [98] (testset)   loss: 0.9523 -> 1.0046  accuracy: 84.29% -> 85.57%     
client [79] (testset)   loss: 0.6273 -> 0.6543  accuracy: 90.89% -> 90.72%     
client [21] (testset)   loss: 1.0615 -> 0.9304  accuracy: 84.01% -> 83.60%     
client [92] (testset)   loss: 0.8265 -> 0.8587  accuracy: 85.76% -> 86.52%     
client [56] (testset)   loss: 0.9178 -> 1.0089  accuracy: 81.97% -> 83.36%     
client [5]  (testset)   loss: 0.6512 -> 0.5880  accuracy: 88.99% -> 90.27%     
client [52] (testset)   loss: 0.8592 -> 0.7683  accuracy: 84.54% -> 86.52%     
---------------------------- TRAINING EPOCH: 210 ----------------------------  
client [67] (testset)   loss: 0.6835 -> 0.6764  accuracy: 88.76% -> 89.55%     
client [54] (testset)   loss: 0.8890 -> 0.9149  accuracy: 83.65% -> 84.36%     
client [14] (testset)   loss: 1.0017 -> 0.9674  accuracy: 83.36% -> 84.57%     
client [99] (testset)   loss: 1.0991 -> 1.0777  accuracy: 79.30% -> 81.94%     
client [36] (testset)   loss: 0.6667 -> 0.6316  accuracy: 89.73% -> 90.66%     
client [30] (testset)   loss: 0.7572 -> 0.7701  accuracy: 86.61% -> 87.21%     
client [38] (testset)   loss: 0.8306 -> 0.7560  accuracy: 86.42% -> 87.16%     
client [15] (testset)   loss: 0.7325 -> 0.7303  accuracy: 84.40% -> 84.40%     
client [6]  (testset)   loss: 0.8061 -> 0.7999  accuracy: 85.83% -> 86.05%     
client [53] (testset)   loss: 0.7452 -> 0.7239  accuracy: 86.53% -> 87.92%     
---------------------------- TRAINING EPOCH: 220 ----------------------------  
client [99] (testset)   loss: 1.1037 -> 1.1239  accuracy: 81.83% -> 83.15%     
client [6]  (testset)   loss: 0.8586 -> 0.8136  accuracy: 86.05% -> 86.28%     
client [83] (testset)   loss: 0.9555 -> 0.8050  accuracy: 84.84% -> 88.29%     
client [42] (testset)   loss: 0.8392 -> 0.8160  accuracy: 86.53% -> 87.73%     
client [34] (testset)   loss: 0.9692 -> 0.9441  accuracy: 83.86% -> 84.83%     
client [15] (testset)   loss: 0.7799 -> 0.8059  accuracy: 85.14% -> 84.06%     
client [47] (testset)   loss: 0.7877 -> 0.8180  accuracy: 85.79% -> 87.59%     
client [55] (testset)   loss: 0.9331 -> 0.8678  accuracy: 86.69% -> 87.11%     
client [51] (testset)   loss: 1.3235 -> 1.2531  accuracy: 79.85% -> 79.78%     
client [95] (testset)   loss: 0.7748 -> 0.7730  accuracy: 87.25% -> 89.20%     
---------------------------- TRAINING EPOCH: 230 ----------------------------  
client [71] (testset)   loss: 0.9220 -> 0.8822  accuracy: 84.69% -> 85.18%     
client [15] (testset)   loss: 0.7871 -> 0.8305  accuracy: 83.42% -> 83.56%     
client [33] (testset)   loss: 0.8638 -> 0.8159  accuracy: 83.75% -> 86.03%     
client [99] (testset)   loss: 1.1196 -> 1.1053  accuracy: 80.31% -> 83.41%     
client [90] (testset)   loss: 1.2101 -> 1.0533  accuracy: 79.39% -> 80.62%     
client [57] (testset)   loss: 0.8645 -> 0.8192  accuracy: 85.67% -> 88.47%     
client [27] (testset)   loss: 0.8960 -> 0.8885  accuracy: 83.47% -> 84.94%     
client [78] (testset)   loss: 0.7970 -> 0.7994  accuracy: 84.58% -> 85.71%     
client [36] (testset)   loss: 0.6904 -> 0.6457  accuracy: 88.66% -> 90.25%     
client [88] (testset)   loss: 0.9125 -> 0.8335  accuracy: 84.33% -> 86.14%     
---------------------------- TRAINING EPOCH: 240 ----------------------------  
client [70] (testset)   loss: 0.9135 -> 0.8955  accuracy: 85.72% -> 86.00%     
client [35] (testset)   loss: 1.0926 -> 1.0724  accuracy: 84.60% -> 85.52%     
client [16] (testset)   loss: 1.0949 -> 1.0557  accuracy: 83.89% -> 84.44%     
client [80] (testset)   loss: 0.9280 -> 0.8879  accuracy: 85.30% -> 86.30%     
client [38] (testset)   loss: 0.8619 -> 0.8563  accuracy: 86.73% -> 86.91%     
client [78] (testset)   loss: 0.8871 -> 0.8699  accuracy: 83.77% -> 84.85%     
client [68] (testset)   loss: 0.9131 -> 0.8933  accuracy: 86.99% -> 87.99%     
client [11] (testset)   loss: 0.9365 -> 0.9762  accuracy: 85.66% -> 87.09%     
client [64] (testset)   loss: 0.9033 -> 0.8468  accuracy: 86.87% -> 87.51%     
client [82] (testset)   loss: 1.0718 -> 1.0175  accuracy: 85.84% -> 86.34%     
---------------------------- TRAINING EPOCH: 250 ----------------------------  
client [30] (testset)   loss: 0.8945 -> 0.9036  accuracy: 86.40% -> 87.55%     
client [27] (testset)   loss: 0.9939 -> 0.8888  accuracy: 84.60% -> 84.98%     
client [74] (testset)   loss: 0.7188 -> 0.7636  accuracy: 88.46% -> 88.41%     
client [45] (testset)   loss: 0.8561 -> 0.8467  accuracy: 85.95% -> 87.17%     
client [6]  (testset)   loss: 0.9290 -> 0.9287  accuracy: 84.28% -> 86.55%     
client [36] (testset)   loss: 0.6840 -> 0.6976  accuracy: 89.59% -> 90.53%     
client [63] (testset)   loss: 0.7924 -> 0.7502  accuracy: 86.80% -> 89.08%     
client [76] (testset)   loss: 0.9527 -> 0.8281  accuracy: 86.49% -> 87.69%     
client [83] (testset)   loss: 0.9080 -> 0.8906  accuracy: 87.48% -> 88.38%     
client [86] (testset)   loss: 0.8056 -> 0.7744  accuracy: 87.90% -> 87.90%     
---------------------------- TRAINING EPOCH: 260 ----------------------------  
client [83] (testset)   loss: 0.9599 -> 0.9152  accuracy: 86.50% -> 87.98%     
client [99] (testset)   loss: 1.1966 -> 1.1416  accuracy: 80.88% -> 82.41%     
client [74] (testset)   loss: 0.8074 -> 0.7488  accuracy: 88.36% -> 88.72%     
client [73] (testset)   loss: 0.9338 -> 0.9141  accuracy: 86.85% -> 86.91%     
client [29] (testset)   loss: 1.1433 -> 1.0111  accuracy: 83.25% -> 84.16%     
client [92] (testset)   loss: 0.9077 -> 0.9997  accuracy: 85.41% -> 86.42%     
client [6]  (testset)   loss: 1.0231 -> 0.9764  accuracy: 84.17% -> 85.39%     
client [61] (testset)   loss: 0.9994 -> 0.9825  accuracy: 82.22% -> 82.61%     
client [21] (testset)   loss: 1.1231 -> 1.0602  accuracy: 81.79% -> 83.91%     
client [67] (testset)   loss: 0.6955 -> 0.6629  accuracy: 88.88% -> 90.35%     
---------------------------- TRAINING EPOCH: 270 ----------------------------  
client [83] (testset)   loss: 1.0877 -> 0.9405  accuracy: 86.05% -> 87.98%     
client [32] (testset)   loss: 1.0328 -> 1.0328  accuracy: 82.31% -> 82.49%     
client [95] (testset)   loss: 0.9270 -> 0.8570  accuracy: 85.68% -> 88.30%     
client [61] (testset)   loss: 0.9791 -> 0.9992  accuracy: 83.14% -> 83.92%     
client [27] (testset)   loss: 1.0009 -> 0.9503  accuracy: 85.02% -> 84.90%     
client [25] (testset)   loss: 0.9307 -> 0.8857  accuracy: 86.10% -> 87.00%     
client [68] (testset)   loss: 0.9065 -> 0.9124  accuracy: 85.64% -> 87.69%     
client [34] (testset)   loss: 1.0805 -> 1.0443  accuracy: 83.64% -> 83.96%     
client [71] (testset)   loss: 1.0213 -> 1.0469  accuracy: 84.37% -> 85.34%     
client [89] (testset)   loss: 0.9561 -> 0.9834  accuracy: 87.45% -> 87.84%     
---------------------------- TRAINING EPOCH: 280 ----------------------------  
client [78] (testset)   loss: 1.0049 -> 0.9874  accuracy: 84.40% -> 84.90%     
client [81] (testset)   loss: 0.8596 -> 0.8812  accuracy: 88.27% -> 89.34%     
client [51] (testset)   loss: 1.4786 -> 1.5016  accuracy: 80.54% -> 80.40%     
client [54] (testset)   loss: 1.1049 -> 1.0203  accuracy: 82.61% -> 83.25%     
client [65] (testset)   loss: 0.8278 -> 0.8167  accuracy: 87.86% -> 87.26%     
client [41] (testset)   loss: 1.0990 -> 1.1618  accuracy: 80.69% -> 80.27%     
client [11] (testset)   loss: 1.0057 -> 0.9831  accuracy: 85.66% -> 86.45%     
client [85] (testset)   loss: 0.8193 -> 0.7837  accuracy: 89.91% -> 89.60%     
client [12] (testset)   loss: 0.7611 -> 0.8002  accuracy: 87.91% -> 88.54%     
client [23] (testset)   loss: 1.0150 -> 1.0461  accuracy: 85.73% -> 85.11%     
---------------------------- TRAINING EPOCH: 290 ----------------------------  
client [16] (testset)   loss: 1.2259 -> 1.1196  accuracy: 84.17% -> 84.65%     
client [65] (testset)   loss: 0.8320 -> 0.8652  accuracy: 87.17% -> 87.47%     
client [53] (testset)   loss: 0.9247 -> 0.9006  accuracy: 86.33% -> 88.04%     
client [58] (testset)   loss: 1.0167 -> 1.0533  accuracy: 86.65% -> 87.35%     
client [72] (testset)   loss: 1.0929 -> 1.1885  accuracy: 84.55% -> 83.98%     
client [7]  (testset)   loss: 1.0665 -> 1.0624  accuracy: 82.68% -> 83.94%     
client [71] (testset)   loss: 1.1191 -> 1.0688  accuracy: 84.74% -> 85.01%     
client [59] (testset)   loss: 0.8226 -> 0.7580  accuracy: 89.08% -> 90.55%     
client [86] (testset)   loss: 0.8290 -> 0.8234  accuracy: 87.85% -> 88.20%     
client [39] (testset)   loss: 1.1238 -> 1.1528  accuracy: 83.02% -> 83.80%     
---------------------------- TRAINING EPOCH: 300 ----------------------------  
client [99] (testset)   loss: 1.3572 -> 1.2959  accuracy: 81.52% -> 82.83%     
client [7]  (testset)   loss: 1.0890 -> 1.1191  accuracy: 82.31% -> 83.73%     
client [17] (testset)   loss: 1.2457 -> 1.1636  accuracy: 84.74% -> 85.60%     
client [64] (testset)   loss: 0.9490 -> 0.9378  accuracy: 86.41% -> 88.08%     
client [37] (testset)   loss: 1.2409 -> 1.2084  accuracy: 80.56% -> 82.07%     
client [29] (testset)   loss: 1.2550 -> 1.2235  accuracy: 84.42% -> 84.42%     
client [93] (testset)   loss: 1.1892 -> 1.1515  accuracy: 83.50% -> 84.07%     
client [73] (testset)   loss: 0.9996 -> 0.9753  accuracy: 86.57% -> 86.69%     
client [40] (testset)   loss: 1.3413 -> 1.2840  accuracy: 78.92% -> 80.59%     
client [76] (testset)   loss: 0.9526 -> 1.0083  accuracy: 86.49% -> 87.34%     
---------------------------- TRAINING EPOCH: 310 ----------------------------  
client [31] (testset)   loss: 1.3327 -> 1.3926  accuracy: 81.15% -> 82.71%     
client [89] (testset)   loss: 1.1112 -> 1.0670  accuracy: 87.02% -> 87.50%     
client [77] (testset)   loss: 1.0984 -> 1.0703  accuracy: 86.61% -> 86.96%     
client [90] (testset)   loss: 1.2767 -> 1.2749  accuracy: 80.42% -> 81.31%     
client [26] (testset)   loss: 0.8400 -> 0.7978  accuracy: 89.31% -> 89.76%     
client [50] (testset)   loss: 0.7772 -> 0.7704  accuracy: 90.55% -> 90.85%     
client [30] (testset)   loss: 0.9840 -> 1.0445  accuracy: 86.70% -> 86.91%     
client [70] (testset)   loss: 1.0950 -> 1.0361  accuracy: 86.04% -> 86.75%     
client [41] (testset)   loss: 1.2767 -> 1.3177  accuracy: 79.28% -> 80.17%     
client [99] (testset)   loss: 1.3495 -> 1.3282  accuracy: 81.46% -> 82.41%     
---------------------------- TRAINING EPOCH: 320 ----------------------------  
client [68] (testset)   loss: 0.9438 -> 0.9749  accuracy: 87.39% -> 87.09%     
client [70] (testset)   loss: 1.0813 -> 1.0873  accuracy: 85.32% -> 86.24%     
client [52] (testset)   loss: 1.1486 -> 1.0766  accuracy: 84.48% -> 86.04%     
client [1]  (testset)   loss: 1.0346 -> 0.9409  accuracy: 89.23% -> 89.60%     
client [2]  (testset)   loss: 1.0424 -> 1.0511  accuracy: 87.40% -> 87.60%     
client [67] (testset)   loss: 0.8285 -> 0.8177  accuracy: 89.34% -> 89.76%     
client [92] (testset)   loss: 1.1787 -> 1.2386  accuracy: 87.02% -> 87.32%     
client [35] (testset)   loss: 1.3008 -> 1.2345  accuracy: 85.64% -> 86.08%     
client [36] (testset)   loss: 0.8463 -> 0.7755  accuracy: 90.21% -> 90.66%     
client [64] (testset)   loss: 1.0656 -> 1.0522  accuracy: 87.16% -> 87.45%     
---------------------------- TRAINING EPOCH: 330 ----------------------------  
client [44] (testset)   loss: 1.3132 -> 1.3190  accuracy: 81.94% -> 81.24%     
client [6]  (testset)   loss: 1.1458 -> 1.1152  accuracy: 85.45% -> 86.28%     
client [12] (testset)   loss: 0.9407 -> 0.8968  accuracy: 87.04% -> 88.35%     
client [55] (testset)   loss: 1.0655 -> 1.0369  accuracy: 87.68% -> 86.43%     
client [29] (testset)   loss: 1.2015 -> 1.2510  accuracy: 84.80% -> 85.01%     
client [9]  (testset)   loss: 1.2905 -> 1.2872  accuracy: 84.31% -> 85.07%     
client [43] (testset)   loss: 1.0022 -> 0.9455  accuracy: 86.87% -> 87.62%     
client [77] (testset)   loss: 1.1469 -> 1.1041  accuracy: 86.13% -> 87.20%     
client [98] (testset)   loss: 1.2871 -> 1.3118  accuracy: 83.43% -> 84.97%     
client [78] (testset)   loss: 1.0998 -> 1.0364  accuracy: 84.22% -> 85.26%     
---------------------------- TRAINING EPOCH: 340 ----------------------------  
client [92] (testset)   loss: 1.2313 -> 1.2227  accuracy: 85.01% -> 86.27%     
client [80] (testset)   loss: 1.0357 -> 1.0669  accuracy: 86.35% -> 86.89%     
client [63] (testset)   loss: 0.8938 -> 0.9117  accuracy: 88.40% -> 89.34%     
client [76] (testset)   loss: 1.1615 -> 1.0358  accuracy: 85.94% -> 87.04%     
client [78] (testset)   loss: 1.0305 -> 1.0603  accuracy: 83.68% -> 84.45%     
client [25] (testset)   loss: 1.0644 -> 0.9791  accuracy: 85.61% -> 86.71%     
client [58] (testset)   loss: 0.9978 -> 1.0670  accuracy: 86.38% -> 87.61%     
client [13] (testset)   loss: 0.9392 -> 0.8594  accuracy: 88.92% -> 89.70%     
client [17] (testset)   loss: 1.2875 -> 1.2289  accuracy: 84.83% -> 85.34%     
client [38] (testset)   loss: 1.0620 -> 1.0548  accuracy: 85.81% -> 86.79%     
---------------------------- TRAINING EPOCH: 350 ----------------------------  
client [72] (testset)   loss: 1.2071 -> 1.1933  accuracy: 84.99% -> 86.09%     
client [82] (testset)   loss: 1.2736 -> 1.3104  accuracy: 85.11% -> 85.88%     
client [86] (testset)   loss: 0.9312 -> 0.9465  accuracy: 87.98% -> 88.07%     
client [51] (testset)   loss: 1.6432 -> 1.6072  accuracy: 79.85% -> 80.95%     
client [96] (testset)   loss: 1.2403 -> 1.2357  accuracy: 84.38% -> 85.75%     
client [42] (testset)   loss: 1.0585 -> 0.9890  accuracy: 86.80% -> 87.29%     
client [55] (testset)   loss: 1.1834 -> 1.1350  accuracy: 86.54% -> 87.16%     
client [13] (testset)   loss: 0.9901 -> 0.9804  accuracy: 88.81% -> 88.64%     
client [1]  (testset)   loss: 0.9972 -> 0.9516  accuracy: 88.86% -> 89.12%     
client [12] (testset)   loss: 0.9271 -> 0.9394  accuracy: 85.91% -> 87.91%     
---------------------------- TRAINING EPOCH: 360 ----------------------------  
client [68] (testset)   loss: 1.0002 -> 0.9822  accuracy: 87.59% -> 87.84%     
client [23] (testset)   loss: 1.2047 -> 1.2495  accuracy: 83.74% -> 84.93%     
client [46] (testset)   loss: 1.1165 -> 1.0096  accuracy: 86.34% -> 87.17%     
client [41] (testset)   loss: 1.4494 -> 1.4793  accuracy: 78.76% -> 80.06%     
client [25] (testset)   loss: 1.0906 -> 1.0782  accuracy: 85.36% -> 86.79%     
client [58] (testset)   loss: 1.1014 -> 1.1032  accuracy: 86.38% -> 87.92%     
client [14] (testset)   loss: 1.3017 -> 1.3291  accuracy: 83.31% -> 84.27%     
client [33] (testset)   loss: 1.2605 -> 1.1364  accuracy: 84.24% -> 85.23%     
client [85] (testset)   loss: 0.8727 -> 0.8050  accuracy: 89.05% -> 90.15%     
client [62] (testset)   loss: 1.0578 -> 1.0021  accuracy: 87.35% -> 88.33%     
---------------------------- TRAINING EPOCH: 370 ----------------------------  
client [98] (testset)   loss: 1.2901 -> 1.3348  accuracy: 85.57% -> 85.06%     
client [63] (testset)   loss: 0.9289 -> 0.9138  accuracy: 89.69% -> 89.75%     
client [70] (testset)   loss: 1.2479 -> 1.1587  accuracy: 86.00% -> 86.67%     
client [65] (testset)   loss: 0.9526 -> 0.9849  accuracy: 87.91% -> 87.65%     
client [14] (testset)   loss: 1.3428 -> 1.3526  accuracy: 84.07% -> 84.57%     
client [73] (testset)   loss: 1.1356 -> 1.0633  accuracy: 86.18% -> 86.80%     
client [34] (testset)   loss: 1.3128 -> 1.2372  accuracy: 83.64% -> 83.15%     
client [99] (testset)   loss: 1.3533 -> 1.4247  accuracy: 81.10% -> 82.36%     
client [69] (testset)   loss: 1.1824 -> 1.1669  accuracy: 86.10% -> 86.94%     
client [46] (testset)   loss: 1.0821 -> 0.9862  accuracy: 85.96% -> 87.10%     
---------------------------- TRAINING EPOCH: 380 ----------------------------  
client [99] (testset)   loss: 1.3725 -> 1.4289  accuracy: 80.46% -> 81.89%     
client [93] (testset)   loss: 1.3273 -> 1.1976  accuracy: 83.38% -> 83.61%     
client [11] (testset)   loss: 1.2996 -> 1.2823  accuracy: 84.08% -> 86.10%     
client [58] (testset)   loss: 1.1660 -> 1.2232  accuracy: 86.16% -> 87.08%     
client [81] (testset)   loss: 1.1521 -> 1.1030  accuracy: 87.99% -> 88.89%     
client [85] (testset)   loss: 0.9425 -> 0.9156  accuracy: 89.72% -> 89.72%     
client [89] (testset)   loss: 1.1118 -> 1.0940  accuracy: 87.36% -> 86.87%     
client [45] (testset)   loss: 1.0840 -> 1.0435  accuracy: 86.39% -> 86.73%     
client [8]  (testset)   loss: 1.1607 -> 1.1340  accuracy: 85.98% -> 86.64%     
client [68] (testset)   loss: 1.0329 -> 1.0601  accuracy: 86.69% -> 88.09%     
---------------------------- TRAINING EPOCH: 390 ----------------------------  
client [67] (testset)   loss: 0.9533 -> 0.8705  accuracy: 89.13% -> 89.68%     
client [72] (testset)   loss: 1.2335 -> 1.2356  accuracy: 85.56% -> 85.08%     
client [1]  (testset)   loss: 1.0675 -> 1.0189  accuracy: 88.75% -> 89.02%     
client [78] (testset)   loss: 1.1719 -> 1.2594  accuracy: 83.99% -> 84.54%     
client [83] (testset)   loss: 1.1701 -> 1.1311  accuracy: 87.71% -> 88.07%     
client [21] (testset)   loss: 1.4668 -> 1.4053  accuracy: 82.96% -> 83.01%     
client [56] (testset)   loss: 1.5073 -> 1.5863  accuracy: 81.51% -> 82.42%     
client [44] (testset)   loss: 1.4450 -> 1.4273  accuracy: 80.92% -> 82.64%     
client [92] (testset)   loss: 1.3563 -> 1.3318  accuracy: 86.47% -> 87.12%     
client [27] (testset)   loss: 1.1769 -> 1.2089  accuracy: 84.81% -> 85.28%     
---------------------------- TRAINING EPOCH: 400 ----------------------------  
client [10] (testset)   loss: 1.2101 -> 1.1753  accuracy: 87.16% -> 87.55%     
client [39] (testset)   loss: 1.3393 -> 1.2833  accuracy: 84.59% -> 85.31%     
client [65] (testset)   loss: 1.0320 -> 1.0387  accuracy: 87.65% -> 88.21%     
client [26] (testset)   loss: 0.9704 -> 0.8897  accuracy: 89.55% -> 89.64%     
client [19] (testset)   loss: 1.0449 -> 1.0419  accuracy: 86.86% -> 87.97%     
client [68] (testset)   loss: 1.0439 -> 1.0809  accuracy: 88.04% -> 88.68%     
client [41] (testset)   loss: 1.6492 -> 1.4996  accuracy: 80.69% -> 81.42%     
client [50] (testset)   loss: 0.9058 -> 0.9230  accuracy: 89.74% -> 90.24%     
client [75] (testset)   loss: 1.1581 -> 1.1650  accuracy: 86.29% -> 87.15%     
client [81] (testset)   loss: 1.1440 -> 1.1274  accuracy: 88.27% -> 88.83%     
Training... ---------------------------------------- 100% 9:23:39
FedDpa's average time taken by each global epoch: 1 min 18.85 sec.             
FedDpa's total running time: 9 h 23 m 39 s.                                    
==================== FedDpa Experiment Results: ====================           
Display format: (before local fine-tuning) -> (after local fine-tuning)        
 So if finetune_epoch = 0, x.xx% -> 0.00% is normal.                           
 Centralized testing ONLY happens after model aggregation, so the stats between
'->' are the same.                                                             
{                                                                              
    "100": {                                                                   
        "all_clients": {                                                       
            "test": {                                                          
                "loss": "0.6603 -> 0.0000",                                    
                "accuracy": "85.01% -> 0.00%"                                  
            }                                                                  
        }                                                                      
    },                                                                         
    "200": {                                                                   
        "all_clients": {                                                       
            "test": {                                                          
                "loss": "0.8697 -> 0.0000",                                    
                "accuracy": "85.28% -> 0.00%"                                  
            }                                                                  
        }                                                                      
    },                                                                         
    "300": {                                                                   
        "all_clients": {                                                       
            "test": {                                                          
                "loss": "1.0646 -> 0.0000",                                    
                "accuracy": "85.53% -> 0.00%"                                  
            }                                                                  
        }                                                                      
    },                                                                         
    "400": {                                                                   
        "all_clients": {                                                       
            "test": {                                                          
                "loss": "1.2909 -> 0.0000",                                    
                "accuracy": "85.63% -> 0.00%"                                  
            }                                                                  
        }                                                                      
    }                                                                          
}                                                                              
==================== FedDpa Max Accuracy ====================                  
all_clients:                                                                   
(test) before fine-tuning: 85.63% at epoch 400                                 
(test) after fine-tuning: 0.00% at epoch 100                                   
[0m