==================== PSFL ====================                                 
Experiment Arguments:                                                          
{
│   'method': 'psfl',
│   'dataset': {
│   │   'name': 'emnist',
│   │   'client_num': 100,
│   │   'test_ratio': 0.25,
│   │   'val_ratio': 0.0,
│   │   'seed': 42,
│   │   'split': 'sample',
│   │   'IID_ratio': 0.0,
│   │   'monitor_window_name_suffix': 'emnist-100clients-0%IID-Dir(1.0)-seed42',
│   │   'emnist_split': 'byclass',
│   │   'alpha': 1.0,
│   │   'min_samples_per_client': 10
│   },
│   'model': {
│   │   'name': 'avgcnn',
│   │   'use_torchvision_pretrained_weights': True,
│   │   'external_model_weights_path': None
│   },
│   'optimizer': {
│   │   'lr': 0.01,
│   │   'dampening': 0,
│   │   'weight_decay': 0,
│   │   'momentum': 0,
│   │   'nesterov': False,
│   │   'name': 'sgd'
│   },
│   'mode': 'sequential',
│   'parallel': {
│   │   'ray_cluster_addr': None,
│   │   'num_cpus': None,
│   │   'num_gpus': None,
│   │   'num_workers': 2
│   },
│   'common': {
│   │   'seed': 42,
│   │   'join_ratio': 0.1,
│   │   'global_epoch': 400,
│   │   'local_epoch': 5,
│   │   'batch_size': 32,
│   │   'reset_optimizer_on_global_epoch': True,
│   │   'straggler_ratio': 0,
│   │   'straggler_min_local_epoch': 0,
│   │   'buffers': 'global',
│   │   'client_side_evaluation': True,
│   │   'test': {
│   │   │   'client': {
│   │   │   │   'interval': 100,
│   │   │   │   'finetune_epoch': 0,
│   │   │   │   'train': False,
│   │   │   │   'val': False,
│   │   │   │   'test': True
│   │   │   },
│   │   │   'server': {
│   │   │   │   'interval': -1,
│   │   │   │   'train': False,
│   │   │   │   'val': False,
│   │   │   │   'test': False,
│   │   │   │   'model_in_train_mode': False
│   │   │   }
│   │   },
│   │   'verbose_gap': 10,
│   │   'monitor': None,
│   │   'use_cuda': True,
│   │   'save_log': True,
│   │   'save_model': False,
│   │   'save_learning_curve_plot': False,
│   │   'save_metrics': True,
│   │   'delete_useless_run': True
│   },
│   'psfl': {
│   │   'alpha': 0.0,
│   │   'CLS': False,
│   │   'ig_ratio': 0.99,
│   │   'track': False
│   }
}
---------------------------- TRAINING EPOCH: 10 ----------------------------   
client [77] (testset)   loss: 0.4175 -> 0.4328  accuracy: 85.03% -> 84.95%     
client [81] (testset)   loss: 0.4367 -> 0.6274  accuracy: 82.55% -> 79.46%     
client [21] (testset)   loss: 0.9341 -> 0.5071  accuracy: 73.86% -> 83.33%     
client [68] (testset)   loss: 0.4570 -> 0.6210  accuracy: 85.44% -> 84.05%     
client [93] (testset)   loss: 0.7787 -> 0.5618  accuracy: 70.92% -> 81.02%     
client [31] (testset)   loss: 0.5391 -> 0.5664  accuracy: 80.95% -> 81.80%     
client [20] (testset)   loss: 0.6692 -> 0.5501  accuracy: 78.37% -> 80.95%     
client [59] (testset)   loss: 0.7146 -> 0.3191  accuracy: 84.68% -> 91.23%     
client [48] (testset)   loss: 0.5981 -> 0.4502  accuracy: 78.10% -> 85.24%     
client [34] (testset)   loss: 0.4807 -> 0.4521  accuracy: 82.94% -> 84.34%     
---------------------------- TRAINING EPOCH: 20 ----------------------------   
client [69] (testset)   loss: 0.4337 -> 0.3714  accuracy: 83.83% -> 87.23%     
client [99] (testset)   loss: 0.6259 -> 0.5150  accuracy: 77.51% -> 83.10%     
client [67] (testset)   loss: 0.4427 -> 0.3585  accuracy: 86.54% -> 89.30%     
client [0]  (testset)   loss: 0.4916 -> 0.4367  accuracy: 83.10% -> 85.97%     
client [76] (testset)   loss: 0.6639 -> 0.5020  accuracy: 79.24% -> 83.49%     
client [41] (testset)   loss: 0.5674 -> 0.5389  accuracy: 78.76% -> 80.48%     
client [62] (testset)   loss: 0.5194 -> 0.3839  accuracy: 86.71% -> 88.86%     
client [2]  (testset)   loss: 0.5552 -> 0.3647  accuracy: 83.51% -> 89.29%     
client [14] (testset)   loss: 0.5539 -> 0.4835  accuracy: 82.65% -> 83.86%     
client [46] (testset)   loss: 0.4541 -> 0.3845  accuracy: 83.99% -> 86.98%     
---------------------------- TRAINING EPOCH: 30 ----------------------------   
client [24] (testset)   loss: 0.4485 -> 0.4806  accuracy: 83.07% -> 82.81%     
client [68] (testset)   loss: 0.4567 -> 0.4162  accuracy: 85.74% -> 87.64%     
client [57] (testset)   loss: 0.4478 -> 0.3408  accuracy: 84.10% -> 88.55%     
client [17] (testset)   loss: 0.4834 -> 0.5010  accuracy: 84.44% -> 85.26%     
client [54] (testset)   loss: 0.5109 -> 0.4759  accuracy: 81.77% -> 83.57%     
client [23] (testset)   loss: 0.7342 -> 0.4501  accuracy: 82.83% -> 86.58%     
client [35] (testset)   loss: 0.5376 -> 0.5035  accuracy: 84.53% -> 85.21%     
client [59] (testset)   loss: 0.3837 -> 0.3308  accuracy: 88.62% -> 91.02%     
client [31] (testset)   loss: 0.5895 -> 0.5455  accuracy: 80.30% -> 83.06%     
client [9]  (testset)   loss: 0.5976 -> 0.4183  accuracy: 82.54% -> 85.19%     
---------------------------- TRAINING EPOCH: 40 ----------------------------   
client [64] (testset)   loss: 0.4004 -> 0.3880  accuracy: 87.39% -> 89.58%     
client [33] (testset)   loss: 0.4853 -> 0.4436  accuracy: 84.73% -> 86.22%     
client [16] (testset)   loss: 0.5412 -> 0.5017  accuracy: 81.74% -> 84.79%     
client [44] (testset)   loss: 0.6426 -> 0.5222  accuracy: 79.13% -> 82.71%     
client [8]  (testset)   loss: 0.4992 -> 0.4179  accuracy: 84.95% -> 87.39%     
client [31] (testset)   loss: 0.5636 -> 0.5044  accuracy: 81.70% -> 83.51%     
client [47] (testset)   loss: 0.4221 -> 0.3774  accuracy: 85.16% -> 88.01%     
client [36] (testset)   loss: 0.3983 -> 0.2641  accuracy: 86.07% -> 90.42%     
client [20] (testset)   loss: 0.5876 -> 0.5536  accuracy: 81.44% -> 81.04%     
client [56] (testset)   loss: 0.5051 -> 0.4685  accuracy: 83.23% -> 82.82%     
---------------------------- TRAINING EPOCH: 50 ----------------------------   
client [4]  (testset)   loss: 0.3676 -> 0.3485  accuracy: 87.29% -> 87.84%     
client [60] (testset)   loss: 0.4844 -> 0.4409  accuracy: 84.65% -> 86.11%     
client [28] (testset)   loss: 0.4857 -> 0.3613  accuracy: 85.01% -> 88.83%     
client [25] (testset)   loss: 0.4440 -> 0.4018  accuracy: 85.28% -> 86.79%     
client [58] (testset)   loss: 0.4607 -> 0.4429  accuracy: 87.43% -> 87.96%     
client [44] (testset)   loss: 0.5453 -> 0.5383  accuracy: 80.09% -> 80.86%     
client [39] (testset)   loss: 0.4630 -> 0.4306  accuracy: 83.35% -> 84.75%     
client [29] (testset)   loss: 0.5862 -> 0.5018  accuracy: 80.91% -> 85.06%     
client [3]  (testset)   loss: 0.5218 -> 0.4283  accuracy: 82.46% -> 86.35%     
client [84] (testset)   loss: 0.4791 -> 0.4764  accuracy: 85.83% -> 86.93%     
---------------------------- TRAINING EPOCH: 60 ----------------------------   
client [21] (testset)   loss: 0.5342 -> 0.5384  accuracy: 85.00% -> 84.69%     
client [84] (testset)   loss: 0.5299 -> 0.4916  accuracy: 85.52% -> 86.19%     
client [10] (testset)   loss: 0.5061 -> 0.4209  accuracy: 84.82% -> 88.14%     
client [36] (testset)   loss: 0.3613 -> 0.3181  accuracy: 88.17% -> 89.35%     
client [65] (testset)   loss: 0.4581 -> 0.3963  accuracy: 87.39% -> 88.73%     
client [81] (testset)   loss: 0.4459 -> 0.3426  accuracy: 87.93% -> 90.24%     
client [79] (testset)   loss: 0.3710 -> 0.3860  accuracy: 90.00% -> 91.12%     
client [42] (testset)   loss: 0.6093 -> 0.4460  accuracy: 82.58% -> 88.50%     
client [11] (testset)   loss: 0.4980 -> 0.4760  accuracy: 85.36% -> 86.84%     
client [96] (testset)   loss: 0.4453 -> 0.4085  accuracy: 85.75% -> 86.52%     
---------------------------- TRAINING EPOCH: 70 ----------------------------   
client [8]  (testset)   loss: 0.5567 -> 0.4865  accuracy: 86.40% -> 87.25%     
client [53] (testset)   loss: 0.4485 -> 0.3793  accuracy: 87.84% -> 89.28%     
client [52] (testset)   loss: 0.5526 -> 0.4522  accuracy: 83.82% -> 85.86%     
client [42] (testset)   loss: 0.4652 -> 0.4440  accuracy: 87.19% -> 87.35%     
client [69] (testset)   loss: 0.5138 -> 0.4331  accuracy: 85.13% -> 87.71%     
client [59] (testset)   loss: 0.4558 -> 0.3895  accuracy: 87.20% -> 90.81%     
client [7]  (testset)   loss: 0.5990 -> 0.5149  accuracy: 81.21% -> 83.94%     
client [26] (testset)   loss: 0.4158 -> 0.3742  accuracy: 88.34% -> 90.36%     
client [49] (testset)   loss: 0.5652 -> 0.4519  accuracy: 79.89% -> 86.35%     
client [98] (testset)   loss: 0.5494 -> 0.5227  accuracy: 83.99% -> 85.95%     
---------------------------- TRAINING EPOCH: 80 ----------------------------   
client [98] (testset)   loss: 0.5856 -> 0.5241  accuracy: 84.07% -> 86.17%     
client [47] (testset)   loss: 0.4640 -> 0.4266  accuracy: 85.49% -> 87.67%     
client [21] (testset)   loss: 0.6461 -> 0.6097  accuracy: 82.87% -> 83.82%     
client [77] (testset)   loss: 0.5560 -> 0.4591  accuracy: 82.50% -> 88.03%     
client [95] (testset)   loss: 0.5028 -> 0.4513  accuracy: 87.49% -> 89.58%     
client [91] (testset)   loss: 0.6780 -> 0.6158  accuracy: 81.85% -> 84.19%     
client [14] (testset)   loss: 0.5841 -> 0.5854  accuracy: 83.61% -> 84.12%     
client [99] (testset)   loss: 0.6487 -> 0.9362  accuracy: 82.15% -> 81.99%     
client [20] (testset)   loss: 0.7217 -> 0.6198  accuracy: 80.69% -> 82.96%     
client [39] (testset)   loss: 0.5382 -> 0.4885  accuracy: 83.41% -> 85.59%     
---------------------------- TRAINING EPOCH: 90 ----------------------------   
client [52] (testset)   loss: 0.5564 -> 0.4387  accuracy: 83.46% -> 86.40%     
client [62] (testset)   loss: 0.4981 -> 0.4848  accuracy: 85.08% -> 88.62%     
client [71] (testset)   loss: 0.5432 -> 0.5350  accuracy: 85.88% -> 86.63%     
client [97] (testset)   loss: 0.5406 -> 0.5023  accuracy: 86.08% -> 87.45%     
client [30] (testset)   loss: 0.5491 -> 0.4957  accuracy: 83.92% -> 87.17%     
client [88] (testset)   loss: 0.4873 -> 0.4558  accuracy: 86.69% -> 87.34%     
client [60] (testset)   loss: 0.5650 -> 0.5335  accuracy: 85.38% -> 86.43%     
client [82] (testset)   loss: 0.5433 -> 0.5215  accuracy: 86.06% -> 86.61%     
client [91] (testset)   loss: 0.6668 -> 0.6501  accuracy: 83.28% -> 83.93%     
client [57] (testset)   loss: 0.4890 -> 0.4484  accuracy: 87.55% -> 88.42%     
---------------------------- TRAINING EPOCH: 100 ----------------------------  
client [31] (testset)   loss: 0.7931 -> 0.7046  accuracy: 80.75% -> 84.26%     
client [15] (testset)   loss: 0.5430 -> 0.4949  accuracy: 85.19% -> 84.45%     
client [71] (testset)   loss: 0.5954 -> 0.5620  accuracy: 85.18% -> 86.20%     
client [97] (testset)   loss: 0.5781 -> 0.5425  accuracy: 85.73% -> 87.62%     
client [53] (testset)   loss: 0.5473 -> 0.4316  accuracy: 84.50% -> 88.48%     
client [77] (testset)   loss: 0.5863 -> 0.4978  accuracy: 82.73% -> 87.08%     
client [76] (testset)   loss: 0.6450 -> 0.6006  accuracy: 85.04% -> 86.09%     
client [79] (testset)   loss: 0.4804 -> 0.4202  accuracy: 88.36% -> 90.45%     
client [28] (testset)   loss: 0.5310 -> 0.5052  accuracy: 88.33% -> 88.60%     
client [99] (testset)   loss: 0.7598 -> 0.7418  accuracy: 82.10% -> 81.46%     
---------------------------- TRAINING EPOCH: 110 ----------------------------  
client [97] (testset)   loss: 0.6116 -> 0.5453  accuracy: 85.00% -> 87.75%     
client [86] (testset)   loss: 0.4778 -> 0.4862  accuracy: 87.72% -> 88.86%     
client [34] (testset)   loss: 0.6388 -> 0.5932  accuracy: 82.24% -> 85.64%     
client [73] (testset)   loss: 0.5250 -> 0.5205  accuracy: 86.74% -> 88.41%     
client [5]  (testset)   loss: 0.5740 -> 0.4403  accuracy: 87.26% -> 90.27%     
client [96] (testset)   loss: 0.6132 -> 0.6291  accuracy: 85.23% -> 86.04%     
client [22] (testset)   loss: 0.6929 -> 0.6504  accuracy: 84.46% -> 86.48%     
client [60] (testset)   loss: 0.6790 -> 0.6382  accuracy: 84.37% -> 85.54%     
client [66] (testset)   loss: 0.6520 -> 0.5493  accuracy: 84.09% -> 85.76%     
client [83] (testset)   loss: 0.5462 -> 0.4476  accuracy: 84.34% -> 88.47%     
---------------------------- TRAINING EPOCH: 120 ----------------------------  
client [76] (testset)   loss: 0.6632 -> 0.6348  accuracy: 85.29% -> 86.29%     
client [65] (testset)   loss: 0.5223 -> 0.4708  accuracy: 86.30% -> 88.39%     
client [95] (testset)   loss: 0.5427 -> 0.5259  accuracy: 87.96% -> 89.25%     
client [17] (testset)   loss: 0.7198 -> 0.6226  accuracy: 85.98% -> 84.53%     
client [8]  (testset)   loss: 0.5807 -> 0.5296  accuracy: 85.70% -> 88.00%     
client [35] (testset)   loss: 0.8101 -> 0.7037  accuracy: 83.73% -> 86.20%     
client [98] (testset)   loss: 0.7414 -> 0.6261  accuracy: 82.92% -> 85.31%     
client [53] (testset)   loss: 0.5396 -> 0.5030  accuracy: 88.12% -> 85.05%     
client [43] (testset)   loss: 0.5851 -> 0.5310  accuracy: 86.18% -> 86.97%     
client [64] (testset)   loss: 0.5826 -> 0.5401  accuracy: 88.20% -> 88.03%     
---------------------------- TRAINING EPOCH: 130 ----------------------------  
client [21] (testset)   loss: 0.7651 -> 0.6894  accuracy: 83.33% -> 83.24%     
client [88] (testset)   loss: 0.6216 -> 0.5798  accuracy: 85.19% -> 87.24%     
client [38] (testset)   loss: 0.7211 -> 0.6785  accuracy: 84.28% -> 87.09%     
client [3]  (testset)   loss: 0.6541 -> 0.6291  accuracy: 84.76% -> 85.13%     
client [5]  (testset)   loss: 0.4892 -> 0.5040  accuracy: 88.92% -> 90.46%     
client [41] (testset)   loss: 0.8800 -> 0.7601  accuracy: 78.97% -> 79.91%     
client [7]  (testset)   loss: 0.7044 -> 0.6513  accuracy: 81.00% -> 83.31%     
client [37] (testset)   loss: 0.7575 -> 0.7158  accuracy: 83.05% -> 83.70%     
client [45] (testset)   loss: 0.5798 -> 0.5230  accuracy: 85.42% -> 87.02%     
client [47] (testset)   loss: 0.5464 -> 0.4844  accuracy: 85.32% -> 87.80%     
---------------------------- TRAINING EPOCH: 140 ----------------------------  
client [16] (testset)   loss: 0.8352 -> 0.8103  accuracy: 81.11% -> 83.12%     
client [11] (testset)   loss: 0.7103 -> 0.6544  accuracy: 84.18% -> 85.76%     
client [37] (testset)   loss: 0.8354 -> 0.7738  accuracy: 82.00% -> 84.55%     
client [41] (testset)   loss: 0.8649 -> 0.7760  accuracy: 77.77% -> 80.58%     
client [95] (testset)   loss: 0.5980 -> 0.5762  accuracy: 88.34% -> 88.92%     
client [53] (testset)   loss: 0.5531 -> 0.4982  accuracy: 85.73% -> 87.76%     
client [22] (testset)   loss: 0.7102 -> 0.6852  accuracy: 84.17% -> 87.12%     
client [25] (testset)   loss: 0.6454 -> 0.5402  accuracy: 84.71% -> 88.14%     
client [69] (testset)   loss: 0.6496 -> 0.6081  accuracy: 84.92% -> 86.54%     
client [46] (testset)   loss: 0.6385 -> 0.5549  accuracy: 85.07% -> 88.37%     
---------------------------- TRAINING EPOCH: 150 ----------------------------  
client [47] (testset)   loss: 0.7038 -> 0.6477  accuracy: 86.12% -> 87.46%     
client [69] (testset)   loss: 0.7513 -> 0.6701  accuracy: 84.48% -> 87.07%     
client [82] (testset)   loss: 0.6931 -> 0.7208  accuracy: 85.47% -> 85.38%     
client [45] (testset)   loss: 0.6961 -> 0.6140  accuracy: 84.69% -> 86.68%     
client [7]  (testset)   loss: 0.6904 -> 0.6545  accuracy: 83.46% -> 84.56%     
client [50] (testset)   loss: 0.5403 -> 0.4942  accuracy: 89.53% -> 90.39%     
client [35] (testset)   loss: 0.9178 -> 0.8741  accuracy: 84.35% -> 83.98%     
client [24] (testset)   loss: 0.7523 -> 0.6877  accuracy: 80.76% -> 81.94%     
client [15] (testset)   loss: 0.6395 -> 0.6107  accuracy: 83.12% -> 84.25%     
client [58] (testset)   loss: 0.6716 -> 0.6497  accuracy: 87.08% -> 87.74%     
---------------------------- TRAINING EPOCH: 160 ----------------------------  
client [48] (testset)   loss: 0.7279 -> 0.7456  accuracy: 85.71% -> 86.40%     
client [76] (testset)   loss: 0.8115 -> 0.7332  accuracy: 85.59% -> 86.89%     
client [67] (testset)   loss: 0.6081 -> 0.5562  accuracy: 89.13% -> 88.88%     
client [37] (testset)   loss: 0.8632 -> 0.8455  accuracy: 82.40% -> 83.70%     
client [58] (testset)   loss: 0.7642 -> 0.7052  accuracy: 84.94% -> 87.87%     
client [64] (testset)   loss: 0.7191 -> 0.6724  accuracy: 86.99% -> 88.43%     
client [77] (testset)   loss: 0.8389 -> 0.6938  accuracy: 83.68% -> 87.55%     
client [55] (testset)   loss: 0.7822 -> 0.7122  accuracy: 84.30% -> 87.16%     
client [12] (testset)   loss: 0.6598 -> 0.6240  accuracy: 87.98% -> 88.67%     
client [89] (testset)   loss: 0.7581 -> 0.6926  accuracy: 86.44% -> 88.03%     
---------------------------- TRAINING EPOCH: 170 ----------------------------  
client [84] (testset)   loss: 0.9372 -> 0.9141  accuracy: 84.00% -> 84.54%     
client [51] (testset)   loss: 1.1144 -> 1.0457  accuracy: 78.81% -> 80.54%     
client [8]  (testset)   loss: 0.7967 -> 0.6937  accuracy: 85.61% -> 87.34%     
client [18] (testset)   loss: 0.7152 -> 0.7122  accuracy: 87.26% -> 87.37%     
client [94] (testset)   loss: 0.7512 -> 0.7046  accuracy: 81.51% -> 82.54%     
client [81] (testset)   loss: 0.6124 -> 0.5637  accuracy: 86.59% -> 88.83%     
client [3]  (testset)   loss: 0.8012 -> 0.7755  accuracy: 85.67% -> 85.67%     
client [11] (testset)   loss: 0.9353 -> 0.7904  accuracy: 83.14% -> 85.07%     
client [95] (testset)   loss: 0.7236 -> 0.6708  accuracy: 87.20% -> 89.77%     
client [67] (testset)   loss: 0.6179 -> 0.5621  accuracy: 89.64% -> 89.30%     
---------------------------- TRAINING EPOCH: 180 ----------------------------  
client [21] (testset)   loss: 0.9793 -> 0.8193  accuracy: 81.79% -> 84.19%     
client [79] (testset)   loss: 0.5796 -> 0.5574  accuracy: 88.63% -> 90.72%     
client [58] (testset)   loss: 0.8056 -> 0.7359  accuracy: 86.60% -> 87.61%     
client [88] (testset)   loss: 0.7437 -> 0.6952  accuracy: 85.29% -> 86.64%     
client [46] (testset)   loss: 0.7314 -> 0.6496  accuracy: 83.48% -> 87.48%     
client [11] (testset)   loss: 0.8505 -> 0.7621  accuracy: 84.43% -> 86.20%     
client [55] (testset)   loss: 0.8244 -> 0.8312  accuracy: 86.12% -> 86.43%     
client [13] (testset)   loss: 0.6416 -> 0.5878  accuracy: 87.87% -> 89.81%     
client [31] (testset)   loss: 0.9209 -> 0.8968  accuracy: 82.56% -> 84.01%     
client [75] (testset)   loss: 0.7819 -> 0.7568  accuracy: 86.67% -> 87.58%     
---------------------------- TRAINING EPOCH: 190 ----------------------------  
client [19] (testset)   loss: 0.7136 -> 0.7038  accuracy: 87.04% -> 88.47%     
client [7]  (testset)   loss: 0.8253 -> 0.7960  accuracy: 82.10% -> 83.41%     
client [57] (testset)   loss: 0.7001 -> 0.6819  accuracy: 88.29% -> 88.55%     
client [13] (testset)   loss: 0.7654 -> 0.6611  accuracy: 87.09% -> 89.53%     
client [43] (testset)   loss: 0.7292 -> 0.6959  accuracy: 86.42% -> 87.42%     
client [91] (testset)   loss: 0.8958 -> 0.8145  accuracy: 84.12% -> 84.45%     
client [10] (testset)   loss: 0.8081 -> 0.7798  accuracy: 85.31% -> 86.82%     
client [64] (testset)   loss: 0.8137 -> 0.7450  accuracy: 86.41% -> 88.43%     
client [82] (testset)   loss: 0.8539 -> 0.8555  accuracy: 85.29% -> 85.02%     
client [22] (testset)   loss: 0.9507 -> 0.8424  accuracy: 84.40% -> 86.89%     
---------------------------- TRAINING EPOCH: 200 ----------------------------  
client [20] (testset)   loss: 1.1399 -> 1.0638  accuracy: 79.53% -> 81.26%     
client [23] (testset)   loss: 0.8822 -> 0.8506  accuracy: 85.11% -> 85.96%     
client [88] (testset)   loss: 0.8145 -> 0.7092  accuracy: 85.79% -> 86.94%     
client [98] (testset)   loss: 0.8724 -> 0.8175  accuracy: 84.29% -> 86.25%     
client [79] (testset)   loss: 0.6836 -> 0.6490  accuracy: 89.47% -> 90.80%     
client [21] (testset)   loss: 1.0255 -> 0.9292  accuracy: 82.15% -> 83.10%     
client [92] (testset)   loss: 0.9160 -> 0.8827  accuracy: 83.76% -> 85.61%     
client [56] (testset)   loss: 1.0704 -> 1.0837  accuracy: 81.38% -> 81.51%     
client [5]  (testset)   loss: 0.6501 -> 0.6778  accuracy: 89.18% -> 89.63%     
client [52] (testset)   loss: 0.7231 -> 0.6800  accuracy: 85.44% -> 86.82%     
---------------------------- TRAINING EPOCH: 210 ----------------------------  
client [67] (testset)   loss: 0.7195 -> 0.6921  accuracy: 88.13% -> 89.51%     
client [54] (testset)   loss: 0.9431 -> 0.9168  accuracy: 82.13% -> 82.89%     
client [14] (testset)   loss: 1.0070 -> 0.9966  accuracy: 84.57% -> 84.27%     
client [99] (testset)   loss: 1.1102 -> 1.1081  accuracy: 82.15% -> 82.41%     
client [36] (testset)   loss: 0.6944 -> 0.6087  accuracy: 89.66% -> 91.01%     
client [30] (testset)   loss: 0.8461 -> 0.7958  accuracy: 86.74% -> 87.34%     
client [38] (testset)   loss: 0.8508 -> 0.8458  accuracy: 86.12% -> 87.52%     
client [15] (testset)   loss: 0.7517 -> 0.7103  accuracy: 84.45% -> 84.95%     
client [6]  (testset)   loss: 1.0403 -> 0.8533  accuracy: 81.63% -> 85.45%     
client [53] (testset)   loss: 0.7557 -> 0.7267  accuracy: 85.65% -> 88.28%     
---------------------------- TRAINING EPOCH: 220 ----------------------------  
client [99] (testset)   loss: 1.2422 -> 1.1868  accuracy: 81.15% -> 82.52%     
client [6]  (testset)   loss: 0.9122 -> 0.8991  accuracy: 84.73% -> 85.28%     
client [83] (testset)   loss: 0.8767 -> 0.7456  accuracy: 84.07% -> 88.02%     
client [42] (testset)   loss: 0.8890 -> 0.8772  accuracy: 85.82% -> 87.02%     
client [34] (testset)   loss: 0.8378 -> 0.8526  accuracy: 84.45% -> 85.48%     
client [15] (testset)   loss: 0.8178 -> 0.7400  accuracy: 82.77% -> 85.19%     
client [47] (testset)   loss: 0.8634 -> 0.8333  accuracy: 86.50% -> 87.46%     
client [55] (testset)   loss: 0.9655 -> 0.9199  accuracy: 84.93% -> 86.07%     
client [51] (testset)   loss: 1.2106 -> 1.1704  accuracy: 78.74% -> 79.85%     
client [95] (testset)   loss: 0.9056 -> 0.8034  accuracy: 85.11% -> 89.01%     
---------------------------- TRAINING EPOCH: 230 ----------------------------  
client [71] (testset)   loss: 0.9988 -> 0.8443  accuracy: 84.47% -> 86.04%     
client [15] (testset)   loss: 0.8119 -> 0.7578  accuracy: 84.11% -> 85.09%     
client [33] (testset)   loss: 0.8790 -> 0.8060  accuracy: 84.30% -> 85.72%     
client [99] (testset)   loss: 1.2099 -> 1.1826  accuracy: 80.09% -> 82.04%     
client [90] (testset)   loss: 1.0481 -> 1.0138  accuracy: 80.77% -> 82.00%     
client [57] (testset)   loss: 0.7689 -> 0.7417  accuracy: 87.46% -> 88.69%     
client [27] (testset)   loss: 0.9041 -> 0.8027  accuracy: 84.14% -> 85.70%     
client [78] (testset)   loss: 0.8324 -> 0.7800  accuracy: 83.77% -> 84.08%     
client [36] (testset)   loss: 0.7213 -> 0.6096  accuracy: 88.52% -> 91.32%     
client [88] (testset)   loss: 0.8442 -> 0.8004  accuracy: 86.34% -> 85.99%     
---------------------------- TRAINING EPOCH: 240 ----------------------------  
client [70] (testset)   loss: 0.9753 -> 0.9893  accuracy: 85.60% -> 86.56%     
client [35] (testset)   loss: 1.1793 -> 1.1066  accuracy: 84.17% -> 85.27%     
client [16] (testset)   loss: 1.2843 -> 1.1870  accuracy: 80.07% -> 83.33%     
client [80] (testset)   loss: 0.9733 -> 0.9449  accuracy: 86.44% -> 85.90%     
client [38] (testset)   loss: 0.9660 -> 0.9756  accuracy: 85.93% -> 86.67%     
client [78] (testset)   loss: 0.9024 -> 0.8643  accuracy: 84.27% -> 84.81%     
client [68] (testset)   loss: 0.8428 -> 0.8214  accuracy: 86.59% -> 87.09%     
client [11] (testset)   loss: 1.0029 -> 0.9347  accuracy: 82.41% -> 86.64%     
client [64] (testset)   loss: 0.8735 -> 0.8474  accuracy: 87.51% -> 88.60%     
client [82] (testset)   loss: 1.0124 -> 0.9579  accuracy: 85.02% -> 85.43%     
---------------------------- TRAINING EPOCH: 250 ----------------------------  
client [30] (testset)   loss: 0.9662 -> 0.9283  accuracy: 85.84% -> 86.78%     
client [27] (testset)   loss: 0.9543 -> 0.8772  accuracy: 84.10% -> 84.52%     
client [74] (testset)   loss: 0.7796 -> 0.6919  accuracy: 87.21% -> 88.67%     
client [45] (testset)   loss: 1.0022 -> 0.9112  accuracy: 85.46% -> 86.53%     
client [6]  (testset)   loss: 1.0254 -> 0.9688  accuracy: 82.79% -> 84.95%     
client [36] (testset)   loss: 0.6931 -> 0.6620  accuracy: 89.42% -> 91.15%     
client [63] (testset)   loss: 0.7030 -> 0.6745  accuracy: 89.11% -> 89.85%     
client [76] (testset)   loss: 1.0934 -> 0.9973  accuracy: 84.74% -> 86.49%     
client [83] (testset)   loss: 0.8186 -> 0.7855  accuracy: 86.77% -> 87.84%     
client [86] (testset)   loss: 0.7965 -> 0.7892  accuracy: 87.64% -> 86.81%     
---------------------------- TRAINING EPOCH: 260 ----------------------------  
client [83] (testset)   loss: 0.8925 -> 0.8418  accuracy: 86.41% -> 87.53%     
client [99] (testset)   loss: 1.2779 -> 1.2862  accuracy: 81.10% -> 81.62%     
client [74] (testset)   loss: 0.8121 -> 0.6953  accuracy: 86.85% -> 88.83%     
client [73] (testset)   loss: 0.9352 -> 0.8288  accuracy: 87.30% -> 88.13%     
client [29] (testset)   loss: 1.0923 -> 0.9958  accuracy: 83.73% -> 84.16%     
client [92] (testset)   loss: 0.9596 -> 1.0020  accuracy: 85.71% -> 85.96%     
client [6]  (testset)   loss: 0.9457 -> 0.9796  accuracy: 85.45% -> 85.61%     
client [61] (testset)   loss: 1.1449 -> 1.0612  accuracy: 82.09% -> 82.81%     
client [21] (testset)   loss: 1.1445 -> 1.0621  accuracy: 81.65% -> 82.83%     
client [67] (testset)   loss: 0.8973 -> 0.8001  accuracy: 88.17% -> 89.01%     
---------------------------- TRAINING EPOCH: 270 ----------------------------  
client [83] (testset)   loss: 0.9957 -> 0.8498  accuracy: 84.16% -> 87.98%     
client [32] (testset)   loss: 1.2282 -> 1.1118  accuracy: 79.10% -> 80.45%     
client [95] (testset)   loss: 0.9029 -> 0.8410  accuracy: 87.54% -> 88.92%     
client [61] (testset)   loss: 1.2252 -> 1.1608  accuracy: 81.76% -> 83.07%     
client [27] (testset)   loss: 0.9587 -> 0.9061  accuracy: 82.84% -> 85.02%     
client [25] (testset)   loss: 0.8881 -> 0.8126  accuracy: 85.16% -> 87.53%     
client [68] (testset)   loss: 0.9165 -> 0.9295  accuracy: 86.04% -> 87.14%     
client [34] (testset)   loss: 0.9472 -> 0.9601  accuracy: 85.37% -> 85.48%     
client [71] (testset)   loss: 1.0697 -> 1.0320  accuracy: 85.55% -> 85.88%     
client [89] (testset)   loss: 0.9871 -> 0.9155  accuracy: 85.86% -> 87.93%     
---------------------------- TRAINING EPOCH: 280 ----------------------------  
client [78] (testset)   loss: 1.0707 -> 1.0213  accuracy: 83.41% -> 84.67%     
client [81] (testset)   loss: 0.7991 -> 0.7950  accuracy: 88.61% -> 88.72%     
client [51] (testset)   loss: 1.5648 -> 1.5270  accuracy: 78.95% -> 78.95%     
client [54] (testset)   loss: 1.2013 -> 1.0748  accuracy: 82.93% -> 83.41%     
client [65] (testset)   loss: 0.8247 -> 0.7506  accuracy: 86.91% -> 87.78%     
client [41] (testset)   loss: 1.3029 -> 1.2396  accuracy: 77.56% -> 80.58%     
client [11] (testset)   loss: 1.0487 -> 1.0339  accuracy: 84.13% -> 85.90%     
client [85] (testset)   loss: 0.8009 -> 0.7330  accuracy: 90.40% -> 90.95%     
client [12] (testset)   loss: 0.8940 -> 0.8384  accuracy: 87.66% -> 88.29%     
client [23] (testset)   loss: 1.0797 -> 1.0380  accuracy: 83.51% -> 85.39%     
---------------------------- TRAINING EPOCH: 290 ----------------------------  
client [16] (testset)   loss: 1.3892 -> 1.3713  accuracy: 82.36% -> 82.71%     
client [65] (testset)   loss: 0.8417 -> 0.8050  accuracy: 86.91% -> 87.82%     
client [53] (testset)   loss: 0.9278 -> 0.9279  accuracy: 85.69% -> 87.64%     
client [58] (testset)   loss: 1.0221 -> 1.0322  accuracy: 86.65% -> 86.91%     
client [72] (testset)   loss: 1.1910 -> 1.1417  accuracy: 83.93% -> 84.55%     
client [7]  (testset)   loss: 1.1180 -> 1.1369  accuracy: 82.89% -> 83.05%     
client [71] (testset)   loss: 1.1217 -> 1.1318  accuracy: 85.01% -> 85.66%     
client [59] (testset)   loss: 0.7981 -> 0.7946  accuracy: 89.84% -> 91.02%     
client [86] (testset)   loss: 0.9778 -> 0.8918  accuracy: 84.94% -> 88.11%     
client [39] (testset)   loss: 1.2243 -> 1.1409  accuracy: 82.85% -> 83.91%     
---------------------------- TRAINING EPOCH: 300 ----------------------------  
client [99] (testset)   loss: 1.4755 -> 1.4262  accuracy: 80.46% -> 81.57%     
client [7]  (testset)   loss: 1.1855 -> 1.1268  accuracy: 81.27% -> 83.57%     
client [17] (testset)   loss: 1.2788 -> 1.2969  accuracy: 83.97% -> 85.64%     
client [64] (testset)   loss: 0.9751 -> 0.9705  accuracy: 87.62% -> 88.14%     
client [37] (testset)   loss: 1.3940 -> 1.4016  accuracy: 81.81% -> 82.46%     
client [29] (testset)   loss: 1.2477 -> 1.2209  accuracy: 82.72% -> 84.80%     
client [93] (testset)   loss: 1.2570 -> 1.2266  accuracy: 83.73% -> 83.44%     
client [73] (testset)   loss: 0.9350 -> 0.9289  accuracy: 87.19% -> 88.08%     
client [40] (testset)   loss: 1.2711 -> 1.2816  accuracy: 79.05% -> 79.05%     
client [76] (testset)   loss: 1.1419 -> 1.0970  accuracy: 84.49% -> 87.09%     
---------------------------- TRAINING EPOCH: 310 ----------------------------  
client [31] (testset)   loss: 1.3745 -> 1.3557  accuracy: 81.05% -> 84.01%     
client [89] (testset)   loss: 1.0796 -> 1.0343  accuracy: 87.98% -> 87.69%     
client [77] (testset)   loss: 1.1833 -> 1.1665  accuracy: 86.49% -> 86.41%     
client [90] (testset)   loss: 1.4238 -> 1.3949  accuracy: 80.72% -> 81.95%     
client [26] (testset)   loss: 0.8403 -> 0.7740  accuracy: 88.30% -> 89.76%     
client [50] (testset)   loss: 0.7852 -> 0.7996  accuracy: 90.09% -> 90.29%     
client [30] (testset)   loss: 1.0734 -> 1.0779  accuracy: 85.33% -> 86.61%     
client [70] (testset)   loss: 1.1084 -> 1.0759  accuracy: 85.88% -> 86.87%     
client [41] (testset)   loss: 1.4726 -> 1.4023  accuracy: 80.17% -> 80.48%     
client [99] (testset)   loss: 1.4935 -> 1.5215  accuracy: 81.10% -> 81.57%     
---------------------------- TRAINING EPOCH: 320 ----------------------------  
client [68] (testset)   loss: 1.0848 -> 1.0526  accuracy: 85.74% -> 87.09%     
client [70] (testset)   loss: 1.1685 -> 1.1308  accuracy: 85.44% -> 86.32%     
client [52] (testset)   loss: 1.1766 -> 1.0886  accuracy: 85.26% -> 85.92%     
client [1]  (testset)   loss: 0.9503 -> 0.9289  accuracy: 88.23% -> 88.91%     
client [2]  (testset)   loss: 1.0024 -> 0.9800  accuracy: 86.88% -> 88.25%     
client [67] (testset)   loss: 0.9819 -> 0.9747  accuracy: 88.42% -> 89.09%     
client [92] (testset)   loss: 1.3615 -> 1.3502  accuracy: 85.36% -> 85.31%     
client [35] (testset)   loss: 1.3755 -> 1.3237  accuracy: 84.35% -> 84.53%     
client [36] (testset)   loss: 0.8237 -> 0.7763  accuracy: 89.83% -> 91.22%     
client [64] (testset)   loss: 0.9976 -> 1.0068  accuracy: 88.60% -> 88.60%     
---------------------------- TRAINING EPOCH: 330 ----------------------------  
client [44] (testset)   loss: 1.6817 -> 1.6198  accuracy: 80.66% -> 81.24%     
client [6]  (testset)   loss: 1.1415 -> 1.1427  accuracy: 84.06% -> 84.95%     
client [12] (testset)   loss: 1.0034 -> 1.0075  accuracy: 86.66% -> 87.60%     
client [55] (testset)   loss: 1.0808 -> 1.0787  accuracy: 86.12% -> 86.38%     
client [29] (testset)   loss: 1.3459 -> 1.3180  accuracy: 83.25% -> 84.05%     
client [9]  (testset)   loss: 1.3013 -> 1.2834  accuracy: 84.66% -> 84.78%     
client [43] (testset)   loss: 0.9682 -> 0.9628  accuracy: 87.47% -> 87.47%     
client [77] (testset)   loss: 1.1599 -> 1.1180  accuracy: 85.82% -> 86.80%     
client [98] (testset)   loss: 1.2661 -> 1.1879  accuracy: 83.69% -> 85.14%     
client [78] (testset)   loss: 1.1309 -> 1.1235  accuracy: 83.99% -> 83.99%     
---------------------------- TRAINING EPOCH: 340 ----------------------------  
client [92] (testset)   loss: 1.4369 -> 1.3873  accuracy: 85.36% -> 85.41%     
client [80] (testset)   loss: 1.2931 -> 1.2710  accuracy: 85.00% -> 85.75%     
client [63] (testset)   loss: 0.9877 -> 0.8810  accuracy: 87.63% -> 89.34%     
client [76] (testset)   loss: 1.2822 -> 1.1960  accuracy: 85.24% -> 86.59%     
client [78] (testset)   loss: 1.2360 -> 1.1541  accuracy: 84.81% -> 84.49%     
client [25] (testset)   loss: 0.9832 -> 0.9678  accuracy: 85.81% -> 86.39%     
client [58] (testset)   loss: 1.1667 -> 1.1173  accuracy: 86.47% -> 86.82%     
client [13] (testset)   loss: 0.9178 -> 0.8831  accuracy: 88.81% -> 88.98%     
client [17] (testset)   loss: 1.3597 -> 1.3335  accuracy: 85.60% -> 85.81%     
client [38] (testset)   loss: 1.3308 -> 1.3461  accuracy: 85.26% -> 86.12%     
---------------------------- TRAINING EPOCH: 350 ----------------------------  
client [72] (testset)   loss: 1.4056 -> 1.3504  accuracy: 83.54% -> 84.55%     
client [82] (testset)   loss: 1.3437 -> 1.3313  accuracy: 85.43% -> 85.16%     
client [86] (testset)   loss: 1.0258 -> 1.0087  accuracy: 86.81% -> 87.77%     
client [51] (testset)   loss: 1.7709 -> 1.7581  accuracy: 78.19% -> 78.95%     
client [96] (testset)   loss: 1.1869 -> 1.2060  accuracy: 85.75% -> 87.09%     
client [42] (testset)   loss: 1.1583 -> 1.1444  accuracy: 85.82% -> 86.75%     
client [55] (testset)   loss: 1.2004 -> 1.1570  accuracy: 86.02% -> 86.28%     
client [13] (testset)   loss: 0.9250 -> 0.9310  accuracy: 88.75% -> 89.36%     
client [1]  (testset)   loss: 1.0397 -> 1.0303  accuracy: 88.23% -> 88.86%     
client [12] (testset)   loss: 1.0885 -> 1.0591  accuracy: 87.23% -> 87.73%     
---------------------------- TRAINING EPOCH: 360 ----------------------------  
client [68] (testset)   loss: 1.1354 -> 1.1484  accuracy: 86.79% -> 86.69%     
client [23] (testset)   loss: 1.3596 -> 1.2663  accuracy: 84.54% -> 85.39%     
client [46] (testset)   loss: 0.9787 -> 1.0289  accuracy: 87.29% -> 87.80%     
client [41] (testset)   loss: 1.6177 -> 1.5026  accuracy: 79.80% -> 80.74%     
client [25] (testset)   loss: 1.1133 -> 1.0632  accuracy: 85.12% -> 86.75%     
client [58] (testset)   loss: 1.1822 -> 1.1812  accuracy: 86.69% -> 86.82%     
client [14] (testset)   loss: 1.5790 -> 1.5579  accuracy: 82.80% -> 83.21%     
client [33] (testset)   loss: 1.2075 -> 1.1815  accuracy: 83.87% -> 85.48%     
client [85] (testset)   loss: 1.0090 -> 0.9551  accuracy: 89.78% -> 90.28%     
client [62] (testset)   loss: 1.0471 -> 1.0707  accuracy: 88.10% -> 88.91%     
---------------------------- TRAINING EPOCH: 370 ----------------------------  
client [98] (testset)   loss: 1.2870 -> 1.3239  accuracy: 84.88% -> 84.93%     
client [63] (testset)   loss: 0.9851 -> 0.9379  accuracy: 88.18% -> 89.01%     
client [70] (testset)   loss: 1.2697 -> 1.2328  accuracy: 85.48% -> 86.48%     
client [65] (testset)   loss: 1.0025 -> 0.9398  accuracy: 86.65% -> 87.60%     
client [14] (testset)   loss: 1.5420 -> 1.5146  accuracy: 83.06% -> 83.56%     
client [73] (testset)   loss: 1.0592 -> 1.0468  accuracy: 88.30% -> 88.52%     
client [34] (testset)   loss: 1.3702 -> 1.2827  accuracy: 84.56% -> 84.77%     
client [99] (testset)   loss: 1.6945 -> 1.7132  accuracy: 81.41% -> 81.67%     
client [69] (testset)   loss: 1.2058 -> 1.1851  accuracy: 85.53% -> 86.26%     
client [46] (testset)   loss: 1.0163 -> 1.0757  accuracy: 87.29% -> 87.74%     
---------------------------- TRAINING EPOCH: 380 ----------------------------  
client [99] (testset)   loss: 1.7640 -> 1.6904  accuracy: 81.10% -> 82.20%     
client [93] (testset)   loss: 1.4767 -> 1.3877  accuracy: 82.80% -> 83.61%     
client [11] (testset)   loss: 1.3393 -> 1.3063  accuracy: 83.39% -> 85.81%     
client [58] (testset)   loss: 1.3302 -> 1.2635  accuracy: 85.51% -> 87.35%     
client [81] (testset)   loss: 1.0529 -> 1.0091  accuracy: 87.21% -> 88.33%     
client [85] (testset)   loss: 0.9364 -> 0.9336  accuracy: 90.40% -> 90.89%     
client [89] (testset)   loss: 1.1518 -> 1.1688  accuracy: 87.93% -> 87.21%     
client [45] (testset)   loss: 1.2674 -> 1.2529  accuracy: 85.51% -> 86.00%     
client [8]  (testset)   loss: 1.1853 -> 1.1111  accuracy: 87.76% -> 88.89%     
client [68] (testset)   loss: 1.2613 -> 1.2385  accuracy: 85.69% -> 86.39%     
---------------------------- TRAINING EPOCH: 390 ----------------------------  
client [67] (testset)   loss: 1.0807 -> 1.0666  accuracy: 89.22% -> 88.93%     
client [72] (testset)   loss: 1.4295 -> 1.4177  accuracy: 84.73% -> 84.07%     
client [1]  (testset)   loss: 1.1224 -> 1.1178  accuracy: 88.07% -> 88.75%     
client [78] (testset)   loss: 1.3949 -> 1.2819  accuracy: 83.59% -> 83.54%     
client [83] (testset)   loss: 1.1475 -> 1.1045  accuracy: 86.50% -> 87.48%     
client [21] (testset)   loss: 1.5943 -> 1.5493  accuracy: 81.60% -> 83.14%     
client [56] (testset)   loss: 1.6584 -> 1.7003  accuracy: 81.47% -> 81.56%     
client [44] (testset)   loss: 1.8756 -> 1.8914  accuracy: 80.28% -> 80.22%     
client [92] (testset)   loss: 1.5022 -> 1.4834  accuracy: 85.91% -> 85.76%     
client [27] (testset)   loss: 1.2694 -> 1.2626  accuracy: 83.93% -> 84.77%     
---------------------------- TRAINING EPOCH: 400 ----------------------------  
client [10] (testset)   loss: 1.3418 -> 1.3219  accuracy: 86.38% -> 86.87%     
client [39] (testset)   loss: 1.4261 -> 1.3360  accuracy: 84.30% -> 84.08%     
client [65] (testset)   loss: 0.9672 -> 0.9902  accuracy: 86.25% -> 87.47%     
client [26] (testset)   loss: 1.0174 -> 0.9827  accuracy: 89.15% -> 89.31%     
client [19] (testset)   loss: 1.1464 -> 1.1574  accuracy: 87.08% -> 87.93%     
client [68] (testset)   loss: 1.2680 -> 1.2811  accuracy: 86.24% -> 86.29%     
client [41] (testset)   loss: 1.7847 -> 1.6380  accuracy: 79.54% -> 80.17%     
client [50] (testset)   loss: 0.9551 -> 0.9530  accuracy: 89.74% -> 89.94%     
client [75] (testset)   loss: 1.2500 -> 1.2673  accuracy: 87.20% -> 87.48%     
client [81] (testset)   loss: 1.0313 -> 1.0052  accuracy: 87.04% -> 88.44%     
Training... ---------------------------------------- 100% 2:40:52
PSFL's average time taken by each global epoch: 0 min 24.00 sec.               
PSFL's total running time: 2 h 40 m 52 s.                                      
==================== PSFL Experiment Results: ====================             
Display format: (before local fine-tuning) -> (after local fine-tuning)        
 So if finetune_epoch = 0, x.xx% -> 0.00% is normal.                           
 Centralized testing ONLY happens after model aggregation, so the stats between
'->' are the same.                                                             
{                                                                              
    "100": {                                                                   
        "all_clients": {                                                       
            "test": {                                                          
                "loss": "0.5785 -> 0.0000",                                    
                "accuracy": "84.69% -> 0.00%"                                  
            }                                                                  
        }                                                                      
    },                                                                         
    "200": {                                                                   
        "all_clients": {                                                       
            "test": {                                                          
                "loss": "0.8610 -> 0.0000",                                    
                "accuracy": "84.70% -> 0.00%"                                  
            }                                                                  
        }                                                                      
    },                                                                         
    "300": {                                                                   
        "all_clients": {                                                       
            "test": {                                                          
                "loss": "1.0996 -> 0.0000",                                    
                "accuracy": "85.22% -> 0.00%"                                  
            }                                                                  
        }                                                                      
    },                                                                         
    "400": {                                                                   
        "all_clients": {                                                       
            "test": {                                                          
                "loss": "1.3349 -> 0.0000",                                    
                "accuracy": "85.83% -> 0.00%"                                  
            }                                                                  
        }                                                                      
    }                                                                          
}                                                                              
==================== PSFL Max Accuracy ====================                    
all_clients:                                                                   
(test) before fine-tuning: 85.83% at epoch 400                                 
(test) after fine-tuning: 0.00% at epoch 100                                   
[0m