==================== PSFL ====================                                 
Experiment Arguments:                                                          
{
│   'method': 'psfl',
│   'dataset': {
│   │   'name': 'mnist',
│   │   'client_num': 100,
│   │   'test_ratio': 0.25,
│   │   'val_ratio': 0.0,
│   │   'seed': 42,
│   │   'split': 'sample',
│   │   'IID_ratio': 0.0,
│   │   'monitor_window_name_suffix': 'mnist-100clients-0%IID-Dir(1.0)-seed42',
│   │   'alpha': 1.0,
│   │   'min_samples_per_client': 10
│   },
│   'model': {
│   │   'name': 'avgcnn',
│   │   'use_torchvision_pretrained_weights': True,
│   │   'external_model_weights_path': None
│   },
│   'optimizer': {
│   │   'lr': 0.01,
│   │   'dampening': 0,
│   │   'weight_decay': 0,
│   │   'momentum': 0,
│   │   'nesterov': False,
│   │   'name': 'sgd'
│   },
│   'mode': 'sequential',
│   'parallel': {
│   │   'ray_cluster_addr': None,
│   │   'num_cpus': None,
│   │   'num_gpus': None,
│   │   'num_workers': 2
│   },
│   'common': {
│   │   'seed': 42,
│   │   'join_ratio': 0.1,
│   │   'global_epoch': 400,
│   │   'local_epoch': 5,
│   │   'batch_size': 32,
│   │   'reset_optimizer_on_global_epoch': True,
│   │   'straggler_ratio': 0,
│   │   'straggler_min_local_epoch': 0,
│   │   'buffers': 'global',
│   │   'client_side_evaluation': True,
│   │   'test': {
│   │   │   'client': {
│   │   │   │   'interval': 100,
│   │   │   │   'finetune_epoch': 0,
│   │   │   │   'train': False,
│   │   │   │   'val': False,
│   │   │   │   'test': True
│   │   │   },
│   │   │   'server': {
│   │   │   │   'interval': -1,
│   │   │   │   'train': False,
│   │   │   │   'val': False,
│   │   │   │   'test': False,
│   │   │   │   'model_in_train_mode': False
│   │   │   }
│   │   },
│   │   'verbose_gap': 10,
│   │   'monitor': None,
│   │   'use_cuda': True,
│   │   'save_log': True,
│   │   'save_model': False,
│   │   'save_learning_curve_plot': False,
│   │   'save_metrics': True,
│   │   'delete_useless_run': True
│   },
│   'psfl': {
│   │   'alpha': 0.0,
│   │   'CLS': False,
│   │   'ig_ratio': 0.99993,
│   │   'track': False
│   }
}
---------------------------- TRAINING EPOCH: 10 ----------------------------   
client [77] (testset)   loss: 0.1262 -> 0.0576  accuracy: 96.39% -> 98.39%     
client [81] (testset)   loss: 0.2189 -> 0.1528  accuracy: 93.64% -> 98.18%     
client [21] (testset)   loss: 0.1029 -> 0.0440  accuracy: 97.35% -> 97.35%     
client [68] (testset)   loss: 0.0634 -> 0.0183  accuracy: 97.78% -> 99.44%     
client [93] (testset)   loss: 0.0817 -> 0.0484  accuracy: 96.83% -> 97.62%     
client [31] (testset)   loss: 0.1242 -> 0.0580  accuracy: 94.64% -> 99.11%     
client [20] (testset)   loss: 0.0945 -> 0.0403  accuracy: 96.93% -> 98.68%     
client [59] (testset)   loss: 0.0561 -> 0.0662  accuracy: 97.92% -> 98.44%     
client [48] (testset)   loss: 0.0711 -> 0.0491  accuracy: 97.16% -> 98.58%     
client [34] (testset)   loss: 0.0476 -> 0.0505  accuracy: 97.97% -> 97.97%     
---------------------------- TRAINING EPOCH: 20 ----------------------------   
client [69] (testset)   loss: 0.0460 -> 0.0358  accuracy: 97.59% -> 98.19%     
client [99] (testset)   loss: 0.1052 -> 0.0616  accuracy: 97.21% -> 96.65%     
client [67] (testset)   loss: 0.0512 -> 0.0533  accuracy: 97.44% -> 98.29%     
client [0]  (testset)   loss: 0.0464 -> 0.0389  accuracy: 97.98% -> 98.99%     
client [76] (testset)   loss: 0.0058 -> 0.0059  accuracy: 100.00% -> 100.00%   
client [41] (testset)   loss: 0.0251 -> 0.0303  accuracy: 99.40% -> 98.81%     
client [62] (testset)   loss: 0.0628 -> 0.0266  accuracy: 98.92% -> 99.46%     
client [2]  (testset)   loss: 0.0716 -> 0.0518  accuracy: 98.43% -> 99.21%     
client [14] (testset)   loss: 0.1406 -> 0.1299  accuracy: 96.39% -> 96.39%     
client [46] (testset)   loss: 0.0328 -> 0.0156  accuracy: 98.50% -> 100.00%    
---------------------------- TRAINING EPOCH: 30 ----------------------------   
client [24] (testset)   loss: 0.0212 -> 0.0200  accuracy: 99.12% -> 99.12%     
client [68] (testset)   loss: 0.0251 -> 0.0059  accuracy: 98.89% -> 99.44%     
client [57] (testset)   loss: 0.1355 -> 0.1049  accuracy: 97.24% -> 97.70%     
client [17] (testset)   loss: 0.0695 -> 0.0338  accuracy: 97.38% -> 99.13%     
client [54] (testset)   loss: 0.0830 -> 0.0913  accuracy: 97.19% -> 98.31%     
client [23] (testset)   loss: 0.0480 -> 0.0442  accuracy: 98.92% -> 98.39%     
client [35] (testset)   loss: 0.0149 -> 0.0146  accuracy: 99.40% -> 99.40%     
client [59] (testset)   loss: 0.0307 -> 0.0471  accuracy: 97.92% -> 97.92%     
client [31] (testset)   loss: 0.0675 -> 0.0568  accuracy: 98.21% -> 98.21%     
client [9]  (testset)   loss: 0.0256 -> 0.0125  accuracy: 99.07% -> 99.07%     
---------------------------- TRAINING EPOCH: 40 ----------------------------   
client [64] (testset)   loss: 0.0239 -> 0.0125  accuracy: 99.17% -> 100.00%    
client [33] (testset)   loss: 0.0316 -> 0.0499  accuracy: 98.58% -> 99.29%     
client [16] (testset)   loss: 0.0570 -> 0.0461  accuracy: 98.17% -> 98.17%     
client [44] (testset)   loss: 0.1915 -> 0.1650  accuracy: 98.80% -> 98.80%     
client [8]  (testset)   loss: 0.0465 -> 0.0479  accuracy: 98.78% -> 99.39%     
client [31] (testset)   loss: 0.0303 -> 0.0345  accuracy: 99.11% -> 99.11%     
client [47] (testset)   loss: 0.0229 -> 0.0299  accuracy: 98.79% -> 98.38%     
client [36] (testset)   loss: 0.0053 -> 0.0249  accuracy: 100.00% -> 98.36%    
client [20] (testset)   loss: 0.0521 -> 0.0197  accuracy: 97.81% -> 98.68%     
client [56] (testset)   loss: 0.0084 -> 0.0133  accuracy: 100.00% -> 99.47%    
---------------------------- TRAINING EPOCH: 50 ----------------------------   
client [4]  (testset)   loss: 0.1464 -> 0.1351  accuracy: 97.14% -> 97.14%     
client [60] (testset)   loss: 0.0229 -> 0.0125  accuracy: 98.91% -> 99.64%     
client [28] (testset)   loss: 0.0036 -> 0.0119  accuracy: 100.00% -> 99.27%    
client [25] (testset)   loss: 0.1016 -> 0.0534  accuracy: 98.10% -> 99.05%     
client [58] (testset)   loss: 0.0132 -> 0.0106  accuracy: 98.97% -> 99.49%     
client [44] (testset)   loss: 0.2209 -> 0.1937  accuracy: 98.80% -> 98.80%     
client [39] (testset)   loss: 0.0162 -> 0.0238  accuracy: 99.45% -> 98.90%     
client [29] (testset)   loss: 0.0733 -> 0.0281  accuracy: 98.26% -> 98.26%     
client [3]  (testset)   loss: 0.0743 -> 0.0915  accuracy: 96.52% -> 96.96%     
client [84] (testset)   loss: 0.0157 -> 0.0151  accuracy: 98.82% -> 99.41%     
---------------------------- TRAINING EPOCH: 60 ----------------------------   
client [21] (testset)   loss: 0.0172 -> 0.0134  accuracy: 99.12% -> 99.12%     
client [84] (testset)   loss: 0.0096 -> 0.0126  accuracy: 99.41% -> 99.41%     
client [10] (testset)   loss: 0.0470 -> 0.0555  accuracy: 99.34% -> 99.34%     
client [36] (testset)   loss: 0.0106 -> 0.0151  accuracy: 100.00% -> 99.45%    
client [65] (testset)   loss: 0.0484 -> 0.0664  accuracy: 97.65% -> 98.24%     
client [81] (testset)   loss: 0.1343 -> 0.1447  accuracy: 97.27% -> 97.27%     
client [79] (testset)   loss: 0.0429 -> 0.0101  accuracy: 97.85% -> 100.00%    
client [42] (testset)   loss: 0.0712 -> 0.0511  accuracy: 97.37% -> 98.25%     
client [11] (testset)   loss: 0.0217 -> 0.0225  accuracy: 98.97% -> 98.97%     
client [96] (testset)   loss: 0.1380 -> 0.0435  accuracy: 97.13% -> 98.09%     
---------------------------- TRAINING EPOCH: 70 ----------------------------   
client [8]  (testset)   loss: 0.0455 -> 0.0491  accuracy: 98.78% -> 98.78%     
client [53] (testset)   loss: 0.0605 -> 0.0337  accuracy: 97.32% -> 98.21%     
client [52] (testset)   loss: 0.0012 -> 0.0005  accuracy: 100.00% -> 100.00%   
client [42] (testset)   loss: 0.0412 -> 0.0218  accuracy: 98.25% -> 99.12%     
client [69] (testset)   loss: 0.0391 -> 0.0173  accuracy: 97.59% -> 99.40%     
client [59] (testset)   loss: 0.0134 -> 0.0257  accuracy: 98.96% -> 98.44%     
client [7]  (testset)   loss: 0.0395 -> 0.0148  accuracy: 99.40% -> 99.40%     
client [26] (testset)   loss: 0.0181 -> 0.0090  accuracy: 99.15% -> 100.00%    
client [49] (testset)   loss: 0.0697 -> 0.0300  accuracy: 97.53% -> 98.77%     
client [98] (testset)   loss: 0.0054 -> 0.0072  accuracy: 100.00% -> 99.19%    
---------------------------- TRAINING EPOCH: 80 ----------------------------   
client [98] (testset)   loss: 0.0012 -> 0.0010  accuracy: 100.00% -> 100.00%   
client [47] (testset)   loss: 0.0065 -> 0.0151  accuracy: 100.00% -> 99.60%    
client [21] (testset)   loss: 0.0265 -> 0.0407  accuracy: 99.12% -> 99.12%     
client [77] (testset)   loss: 0.0549 -> 0.0298  accuracy: 98.80% -> 99.20%     
client [95] (testset)   loss: 0.0734 -> 0.0568  accuracy: 97.56% -> 97.07%     
client [91] (testset)   loss: 0.0147 -> 0.0159  accuracy: 99.00% -> 99.00%     
client [14] (testset)   loss: 0.2235 -> 0.2137  accuracy: 96.39% -> 96.39%     
client [99] (testset)   loss: 0.0279 -> 0.0215  accuracy: 99.44% -> 99.44%     
client [20] (testset)   loss: 0.0359 -> 0.0280  accuracy: 99.12% -> 98.68%     
client [39] (testset)   loss: 0.0269 -> 0.0190  accuracy: 99.45% -> 99.45%     
---------------------------- TRAINING EPOCH: 90 ----------------------------   
client [52] (testset)   loss: 0.0011 -> 0.0008  accuracy: 100.00% -> 100.00%   
client [62] (testset)   loss: 0.0301 -> 0.0128  accuracy: 98.38% -> 99.46%     
client [71] (testset)   loss: 0.1449 -> 0.1258  accuracy: 96.34% -> 97.38%     
client [97] (testset)   loss: 0.0254 -> 0.0164  accuracy: 98.66% -> 99.33%     
client [30] (testset)   loss: 0.0401 -> 0.0305  accuracy: 98.67% -> 99.11%     
client [88] (testset)   loss: 0.0456 -> 0.0458  accuracy: 97.92% -> 98.27%     
client [60] (testset)   loss: 0.0129 -> 0.0070  accuracy: 99.28% -> 99.64%     
client [82] (testset)   loss: 0.0236 -> 0.0276  accuracy: 98.97% -> 98.97%     
client [91] (testset)   loss: 0.0087 -> 0.0157  accuracy: 100.00% -> 99.00%    
client [57] (testset)   loss: 0.1044 -> 0.0976  accuracy: 98.62% -> 98.16%     
---------------------------- TRAINING EPOCH: 100 ----------------------------  
client [31] (testset)   loss: 0.0562 -> 0.0541  accuracy: 99.11% -> 99.11%     
client [15] (testset)   loss: 0.0677 -> 0.0696  accuracy: 98.52% -> 98.52%     
client [71] (testset)   loss: 0.1151 -> 0.1109  accuracy: 97.38% -> 97.38%     
client [97] (testset)   loss: 0.0297 -> 0.0281  accuracy: 99.33% -> 98.66%     
client [53] (testset)   loss: 0.0678 -> 0.0362  accuracy: 97.32% -> 99.11%     
client [77] (testset)   loss: 0.0418 -> 0.0256  accuracy: 99.20% -> 99.20%     
client [76] (testset)   loss: 0.0000 -> 0.0001  accuracy: 100.00% -> 100.00%   
client [79] (testset)   loss: 0.0277 -> 0.0160  accuracy: 98.57% -> 99.28%     
client [28] (testset)   loss: 0.0286 -> 0.0036  accuracy: 98.54% -> 100.00%    
client [99] (testset)   loss: 0.0694 -> 0.0292  accuracy: 97.77% -> 98.32%     
---------------------------- TRAINING EPOCH: 110 ----------------------------  
client [97] (testset)   loss: 0.0332 -> 0.0275  accuracy: 99.33% -> 98.66%     
client [86] (testset)   loss: 0.0020 -> 0.0008  accuracy: 100.00% -> 100.00%   
client [34] (testset)   loss: 0.0082 -> 0.0049  accuracy: 99.32% -> 100.00%    
client [73] (testset)   loss: 0.1505 -> 0.1513  accuracy: 97.92% -> 97.92%     
client [5]  (testset)   loss: 0.0478 -> 0.0201  accuracy: 99.38% -> 99.38%     
client [96] (testset)   loss: 0.0911 -> 0.0727  accuracy: 98.09% -> 98.09%     
client [22] (testset)   loss: 0.0946 -> 0.0716  accuracy: 99.09% -> 99.09%     
client [60] (testset)   loss: 0.0045 -> 0.0041  accuracy: 99.64% -> 100.00%    
client [66] (testset)   loss: 0.1200 -> 0.1032  accuracy: 97.42% -> 98.45%     
client [83] (testset)   loss: 0.0926 -> 0.0590  accuracy: 97.61% -> 98.09%     
---------------------------- TRAINING EPOCH: 120 ----------------------------  
client [76] (testset)   loss: 0.0000 -> 0.0000  accuracy: 100.00% -> 100.00%   
client [65] (testset)   loss: 0.0275 -> 0.0367  accuracy: 98.24% -> 97.65%     
client [95] (testset)   loss: 0.0609 -> 0.0364  accuracy: 98.05% -> 98.05%     
client [17] (testset)   loss: 0.0456 -> 0.0440  accuracy: 99.13% -> 99.13%     
client [8]  (testset)   loss: 0.0805 -> 0.0832  accuracy: 98.78% -> 98.78%     
client [35] (testset)   loss: 0.0204 -> 0.0132  accuracy: 99.40% -> 99.40%     
client [98] (testset)   loss: 0.0101 -> 0.0154  accuracy: 99.19% -> 99.19%     
client [53] (testset)   loss: 0.0341 -> 0.0155  accuracy: 98.21% -> 100.00%    
client [43] (testset)   loss: 0.0455 -> 0.0352  accuracy: 99.10% -> 99.10%     
client [64] (testset)   loss: 0.0193 -> 0.0124  accuracy: 99.17% -> 99.59%     
---------------------------- TRAINING EPOCH: 130 ----------------------------  
client [21] (testset)   loss: 0.0626 -> 0.0362  accuracy: 98.23% -> 99.12%     
client [88] (testset)   loss: 0.0380 -> 0.0392  accuracy: 98.96% -> 98.62%     
client [38] (testset)   loss: 0.0166 -> 0.0423  accuracy: 99.51% -> 99.51%     
client [3]  (testset)   loss: 0.0866 -> 0.0588  accuracy: 97.83% -> 98.26%     
client [5]  (testset)   loss: 0.0048 -> 0.0112  accuracy: 99.38% -> 99.38%     
client [41] (testset)   loss: 0.0079 -> 0.0302  accuracy: 100.00% -> 98.81%    
client [7]  (testset)   loss: 0.0185 -> 0.0114  accuracy: 98.81% -> 99.40%     
client [37] (testset)   loss: 0.0546 -> 0.0622  accuracy: 98.71% -> 97.85%     
client [45] (testset)   loss: 0.0373 -> 0.0509  accuracy: 98.85% -> 98.47%     
client [47] (testset)   loss: 0.0196 -> 0.0217  accuracy: 99.19% -> 99.60%     
---------------------------- TRAINING EPOCH: 140 ----------------------------  
client [16] (testset)   loss: 0.0718 -> 0.0579  accuracy: 98.63% -> 98.17%     
client [11] (testset)   loss: 0.1162 -> 0.0664  accuracy: 96.91% -> 97.94%     
client [37] (testset)   loss: 0.0467 -> 0.0495  accuracy: 99.57% -> 98.28%     
client [41] (testset)   loss: 0.0181 -> 0.0360  accuracy: 99.40% -> 99.40%     
client [95] (testset)   loss: 0.0494 -> 0.0430  accuracy: 99.02% -> 98.05%     
client [53] (testset)   loss: 0.0399 -> 0.0299  accuracy: 98.21% -> 99.11%     
client [22] (testset)   loss: 0.0724 -> 0.0663  accuracy: 99.09% -> 99.09%     
client [25] (testset)   loss: 0.0706 -> 0.0665  accuracy: 98.58% -> 98.58%     
client [69] (testset)   loss: 0.0155 -> 0.0151  accuracy: 99.40% -> 99.40%     
client [46] (testset)   loss: 0.0032 -> 0.0012  accuracy: 100.00% -> 100.00%   
---------------------------- TRAINING EPOCH: 150 ----------------------------  
client [47] (testset)   loss: 0.0043 -> 0.0066  accuracy: 100.00% -> 100.00%   
client [69] (testset)   loss: 0.0192 -> 0.0097  accuracy: 99.40% -> 99.40%     
client [82] (testset)   loss: 0.0265 -> 0.0259  accuracy: 98.97% -> 98.97%     
client [45] (testset)   loss: 0.0515 -> 0.0505  accuracy: 98.85% -> 98.85%     
client [7]  (testset)   loss: 0.0508 -> 0.0145  accuracy: 98.81% -> 99.40%     
client [50] (testset)   loss: 0.0842 -> 0.0518  accuracy: 98.24% -> 98.59%     
client [35] (testset)   loss: 0.0479 -> 0.0200  accuracy: 98.80% -> 99.40%     
client [24] (testset)   loss: 0.0104 -> 0.0085  accuracy: 99.12% -> 100.00%    
client [15] (testset)   loss: 0.0605 -> 0.0735  accuracy: 98.52% -> 98.52%     
client [58] (testset)   loss: 0.0027 -> 0.0027  accuracy: 100.00% -> 100.00%   
---------------------------- TRAINING EPOCH: 160 ----------------------------  
client [48] (testset)   loss: 0.0084 -> 0.0095  accuracy: 99.29% -> 99.29%     
client [76] (testset)   loss: 0.0000 -> 0.0000  accuracy: 100.00% -> 100.00%   
client [67] (testset)   loss: 0.0103 -> 0.0061  accuracy: 100.00% -> 100.00%   
client [37] (testset)   loss: 0.0397 -> 0.0475  accuracy: 98.71% -> 97.85%     
client [58] (testset)   loss: 0.0063 -> 0.0067  accuracy: 99.49% -> 100.00%    
client [64] (testset)   loss: 0.0027 -> 0.0017  accuracy: 100.00% -> 100.00%   
client [77] (testset)   loss: 0.0484 -> 0.0244  accuracy: 99.20% -> 99.20%     
client [55] (testset)   loss: 0.0663 -> 0.0348  accuracy: 97.98% -> 97.98%     
client [12] (testset)   loss: 0.0041 -> 0.0014  accuracy: 100.00% -> 100.00%   
client [89] (testset)   loss: 0.1844 -> 0.1409  accuracy: 97.35% -> 98.23%     
---------------------------- TRAINING EPOCH: 170 ----------------------------  
client [84] (testset)   loss: 0.0285 -> 0.0206  accuracy: 98.82% -> 98.82%     
client [51] (testset)   loss: 0.0141 -> 0.0129  accuracy: 99.53% -> 99.07%     
client [8]  (testset)   loss: 0.0422 -> 0.0384  accuracy: 98.17% -> 98.17%     
client [18] (testset)   loss: 0.0001 -> 0.0000  accuracy: 100.00% -> 100.00%   
client [94] (testset)   loss: 0.0669 -> 0.0663  accuracy: 99.22% -> 99.22%     
client [81] (testset)   loss: 0.1649 -> 0.1837  accuracy: 98.18% -> 97.27%     
client [3]  (testset)   loss: 0.0569 -> 0.0572  accuracy: 97.39% -> 97.39%     
client [11] (testset)   loss: 0.0276 -> 0.0265  accuracy: 98.45% -> 98.97%     
client [95] (testset)   loss: 0.0612 -> 0.0548  accuracy: 98.05% -> 97.56%     
client [67] (testset)   loss: 0.0103 -> 0.0105  accuracy: 100.00% -> 99.15%    
---------------------------- TRAINING EPOCH: 180 ----------------------------  
client [21] (testset)   loss: 0.0626 -> 0.0532  accuracy: 99.12% -> 99.12%     
client [79] (testset)   loss: 0.0207 -> 0.0072  accuracy: 99.64% -> 99.64%     
client [58] (testset)   loss: 0.0032 -> 0.0029  accuracy: 100.00% -> 100.00%   
client [88] (testset)   loss: 0.0392 -> 0.0414  accuracy: 99.65% -> 98.96%     
client [46] (testset)   loss: 0.0148 -> 0.0094  accuracy: 99.25% -> 100.00%    
client [11] (testset)   loss: 0.0457 -> 0.0382  accuracy: 98.45% -> 98.45%     
client [55] (testset)   loss: 0.0442 -> 0.0436  accuracy: 96.97% -> 96.97%     
client [13] (testset)   loss: 0.1920 -> 0.2186  accuracy: 96.80% -> 96.00%     
client [31] (testset)   loss: 0.0446 -> 0.0673  accuracy: 98.21% -> 98.21%     
client [75] (testset)   loss: 0.0193 -> 0.0152  accuracy: 99.47% -> 99.47%     
---------------------------- TRAINING EPOCH: 190 ----------------------------  
client [19] (testset)   loss: 0.0040 -> 0.0016  accuracy: 100.00% -> 100.00%   
client [7]  (testset)   loss: 0.0180 -> 0.0149  accuracy: 98.81% -> 98.81%     
client [57] (testset)   loss: 0.1070 -> 0.1042  accuracy: 98.62% -> 98.62%     
client [13] (testset)   loss: 0.1930 -> 0.1968  accuracy: 96.80% -> 96.80%     
client [43] (testset)   loss: 0.0243 -> 0.0216  accuracy: 98.20% -> 98.20%     
client [91] (testset)   loss: 0.0015 -> 0.0026  accuracy: 100.00% -> 100.00%   
client [10] (testset)   loss: 0.0509 -> 0.0888  accuracy: 99.34% -> 99.34%     
client [64] (testset)   loss: 0.0146 -> 0.0055  accuracy: 99.59% -> 100.00%    
client [82] (testset)   loss: 0.0172 -> 0.0167  accuracy: 98.97% -> 98.97%     
client [22] (testset)   loss: 0.0904 -> 0.0841  accuracy: 99.09% -> 99.09%     
---------------------------- TRAINING EPOCH: 200 ----------------------------  
client [20] (testset)   loss: 0.0608 -> 0.0438  accuracy: 98.68% -> 98.68%     
client [23] (testset)   loss: 0.0758 -> 0.0735  accuracy: 98.92% -> 98.92%     
client [88] (testset)   loss: 0.0355 -> 0.0378  accuracy: 99.65% -> 98.96%     
client [98] (testset)   loss: 0.0005 -> 0.0003  accuracy: 100.00% -> 100.00%   
client [79] (testset)   loss: 0.0223 -> 0.0126  accuracy: 98.92% -> 99.64%     
client [21] (testset)   loss: 0.0387 -> 0.0333  accuracy: 99.12% -> 99.12%     
client [92] (testset)   loss: 0.1476 -> 0.1533  accuracy: 97.60% -> 97.60%     
client [56] (testset)   loss: 0.0014 -> 0.0008  accuracy: 100.00% -> 100.00%   
client [5]  (testset)   loss: 0.0370 -> 0.0227  accuracy: 99.38% -> 99.38%     
client [52] (testset)   loss: 0.0001 -> 0.0001  accuracy: 100.00% -> 100.00%   
---------------------------- TRAINING EPOCH: 210 ----------------------------  
client [67] (testset)   loss: 0.0158 -> 0.0123  accuracy: 99.15% -> 99.15%     
client [54] (testset)   loss: 0.1183 -> 0.1094  accuracy: 98.31% -> 98.88%     
client [14] (testset)   loss: 0.2911 -> 0.2693  accuracy: 95.18% -> 95.18%     
client [99] (testset)   loss: 0.0406 -> 0.0273  accuracy: 98.32% -> 98.88%     
client [36] (testset)   loss: 0.0209 -> 0.0156  accuracy: 98.91% -> 98.91%     
client [30] (testset)   loss: 0.0732 -> 0.0584  accuracy: 98.67% -> 98.67%     
client [38] (testset)   loss: 0.0299 -> 0.0311  accuracy: 99.51% -> 99.51%     
client [15] (testset)   loss: 0.0896 -> 0.0793  accuracy: 98.03% -> 98.52%     
client [6]  (testset)   loss: 0.1147 -> 0.1662  accuracy: 97.95% -> 97.95%     
client [53] (testset)   loss: 0.0509 -> 0.0407  accuracy: 97.32% -> 98.21%     
---------------------------- TRAINING EPOCH: 220 ----------------------------  
client [99] (testset)   loss: 0.0344 -> 0.0298  accuracy: 98.32% -> 98.32%     
client [6]  (testset)   loss: 0.1519 -> 0.1667  accuracy: 97.95% -> 97.95%     
client [83] (testset)   loss: 0.0816 -> 0.1099  accuracy: 97.13% -> 97.61%     
client [42] (testset)   loss: 0.0203 -> 0.0178  accuracy: 99.12% -> 99.12%     
client [34] (testset)   loss: 0.0110 -> 0.0073  accuracy: 99.32% -> 99.32%     
client [15] (testset)   loss: 0.0866 -> 0.0822  accuracy: 98.52% -> 98.52%     
client [47] (testset)   loss: 0.0207 -> 0.0102  accuracy: 99.19% -> 99.60%     
client [55] (testset)   loss: 0.0648 -> 0.0628  accuracy: 96.97% -> 96.97%     
client [51] (testset)   loss: 0.0662 -> 0.0301  accuracy: 98.13% -> 98.13%     
client [95] (testset)   loss: 0.0371 -> 0.0314  accuracy: 98.54% -> 99.02%     
---------------------------- TRAINING EPOCH: 230 ----------------------------  
client [71] (testset)   loss: 0.1456 -> 0.1412  accuracy: 97.91% -> 97.91%     
client [15] (testset)   loss: 0.0904 -> 0.0845  accuracy: 98.52% -> 98.52%     
client [33] (testset)   loss: 0.0288 -> 0.0324  accuracy: 99.29% -> 99.29%     
client [99] (testset)   loss: 0.0188 -> 0.0189  accuracy: 99.44% -> 99.44%     
client [90] (testset)   loss: 0.0446 -> 0.0524  accuracy: 99.29% -> 99.29%     
client [57] (testset)   loss: 0.1171 -> 0.1080  accuracy: 98.16% -> 98.62%     
client [27] (testset)   loss: 0.0517 -> 0.0567  accuracy: 98.82% -> 98.82%     
client [78] (testset)   loss: 0.1683 -> 0.1443  accuracy: 96.36% -> 96.36%     
client [36] (testset)   loss: 0.0121 -> 0.0162  accuracy: 99.45% -> 99.45%     
client [88] (testset)   loss: 0.0329 -> 0.0340  accuracy: 98.96% -> 98.96%     
---------------------------- TRAINING EPOCH: 240 ----------------------------  
client [70] (testset)   loss: 0.0042 -> 0.0020  accuracy: 100.00% -> 100.00%   
client [35] (testset)   loss: 0.0054 -> 0.0035  accuracy: 99.40% -> 100.00%    
client [16] (testset)   loss: 0.0771 -> 0.0699  accuracy: 98.63% -> 98.17%     
client [80] (testset)   loss: 0.0450 -> 0.0491  accuracy: 99.25% -> 99.25%     
client [38] (testset)   loss: 0.0212 -> 0.0292  accuracy: 99.51% -> 99.51%     
client [78] (testset)   loss: 0.1836 -> 0.1681  accuracy: 95.76% -> 95.76%     
client [68] (testset)   loss: 0.0002 -> 0.0000  accuracy: 100.00% -> 100.00%   
client [11] (testset)   loss: 0.0819 -> 0.0389  accuracy: 96.91% -> 98.45%     
client [64] (testset)   loss: 0.0205 -> 0.0051  accuracy: 98.76% -> 99.59%     
client [82] (testset)   loss: 0.0484 -> 0.0388  accuracy: 98.97% -> 98.97%     
---------------------------- TRAINING EPOCH: 250 ----------------------------  
client [30] (testset)   loss: 0.0718 -> 0.0659  accuracy: 98.67% -> 98.67%     
client [27] (testset)   loss: 0.0563 -> 0.0760  accuracy: 98.82% -> 98.82%     
client [74] (testset)   loss: 0.0225 -> 0.0225  accuracy: 99.38% -> 99.38%     
client [45] (testset)   loss: 0.0335 -> 0.0370  accuracy: 99.23% -> 99.23%     
client [6]  (testset)   loss: 0.1360 -> 0.1807  accuracy: 97.95% -> 97.95%     
client [36] (testset)   loss: 0.0015 -> 0.0020  accuracy: 100.00% -> 100.00%   
client [63] (testset)   loss: 0.0003 -> 0.0006  accuracy: 100.00% -> 100.00%   
client [76] (testset)   loss: 0.0000 -> 0.0000  accuracy: 100.00% -> 100.00%   
client [83] (testset)   loss: 0.1233 -> 0.1220  accuracy: 97.61% -> 97.61%     
client [86] (testset)   loss: 0.0008 -> 0.0006  accuracy: 100.00% -> 100.00%   
---------------------------- TRAINING EPOCH: 260 ----------------------------  
client [83] (testset)   loss: 0.1039 -> 0.1044  accuracy: 98.09% -> 98.09%     
client [99] (testset)   loss: 0.0300 -> 0.0146  accuracy: 98.88% -> 98.88%     
client [74] (testset)   loss: 0.0220 -> 0.0197  accuracy: 99.38% -> 99.38%     
client [73] (testset)   loss: 0.1992 -> 0.2084  accuracy: 97.92% -> 97.50%     
client [29] (testset)   loss: 0.0480 -> 0.0483  accuracy: 99.13% -> 99.13%     
client [92] (testset)   loss: 0.1693 -> 0.1657  accuracy: 97.60% -> 97.60%     
client [6]  (testset)   loss: 0.1885 -> 0.1879  accuracy: 97.95% -> 97.95%     
client [61] (testset)   loss: 0.0507 -> 0.0464  accuracy: 98.89% -> 98.89%     
client [21] (testset)   loss: 0.0632 -> 0.0597  accuracy: 99.12% -> 99.12%     
client [67] (testset)   loss: 0.0164 -> 0.0054  accuracy: 99.15% -> 100.00%    
---------------------------- TRAINING EPOCH: 270 ----------------------------  
client [83] (testset)   loss: 0.0838 -> 0.0899  accuracy: 97.13% -> 98.56%     
client [32] (testset)   loss: 0.0041 -> 0.0027  accuracy: 100.00% -> 100.00%   
client [95] (testset)   loss: 0.0324 -> 0.0283  accuracy: 98.54% -> 98.54%     
client [61] (testset)   loss: 0.0581 -> 0.0507  accuracy: 98.89% -> 98.89%     
client [27] (testset)   loss: 0.0565 -> 0.0645  accuracy: 98.82% -> 98.82%     
client [25] (testset)   loss: 0.0751 -> 0.0614  accuracy: 98.58% -> 98.58%     
client [68] (testset)   loss: 0.0021 -> 0.0004  accuracy: 100.00% -> 100.00%   
client [34] (testset)   loss: 0.0077 -> 0.0106  accuracy: 99.32% -> 99.32%     
client [71] (testset)   loss: 0.1721 -> 0.1425  accuracy: 97.91% -> 98.43%     
client [89] (testset)   loss: 0.2038 -> 0.1987  accuracy: 98.23% -> 98.23%     
---------------------------- TRAINING EPOCH: 280 ----------------------------  
client [78] (testset)   loss: 0.1629 -> 0.1567  accuracy: 96.36% -> 96.36%     
client [81] (testset)   loss: 0.1567 -> 0.1606  accuracy: 98.18% -> 97.27%     
client [51] (testset)   loss: 0.0381 -> 0.0366  accuracy: 98.13% -> 98.13%     
client [54] (testset)   loss: 0.1104 -> 0.0963  accuracy: 98.31% -> 98.88%     
client [65] (testset)   loss: 0.0353 -> 0.0157  accuracy: 98.24% -> 99.41%     
client [41] (testset)   loss: 0.0253 -> 0.0255  accuracy: 98.81% -> 98.81%     
client [11] (testset)   loss: 0.0207 -> 0.0199  accuracy: 98.97% -> 98.97%     
client [85] (testset)   loss: 0.0010 -> 0.0009  accuracy: 100.00% -> 100.00%   
client [12] (testset)   loss: 0.0019 -> 0.0039  accuracy: 100.00% -> 100.00%   
client [23] (testset)   loss: 0.0946 -> 0.0834  accuracy: 98.92% -> 98.92%     
---------------------------- TRAINING EPOCH: 290 ----------------------------  
client [16] (testset)   loss: 0.1074 -> 0.0941  accuracy: 97.72% -> 98.17%     
client [65] (testset)   loss: 0.0134 -> 0.0133  accuracy: 99.41% -> 99.41%     
client [53] (testset)   loss: 0.0238 -> 0.0241  accuracy: 99.11% -> 99.11%     
client [58] (testset)   loss: 0.0156 -> 0.0147  accuracy: 98.97% -> 98.97%     
client [72] (testset)   loss: 0.0024 -> 0.0035  accuracy: 100.00% -> 99.60%    
client [7]  (testset)   loss: 0.0484 -> 0.0416  accuracy: 98.81% -> 98.81%     
client [71] (testset)   loss: 0.1445 -> 0.1434  accuracy: 97.91% -> 97.91%     
client [59] (testset)   loss: 0.0033 -> 0.0036  accuracy: 100.00% -> 100.00%   
client [86] (testset)   loss: 0.0004 -> 0.0003  accuracy: 100.00% -> 100.00%   
client [39] (testset)   loss: 0.0162 -> 0.0149  accuracy: 99.45% -> 99.45%     
---------------------------- TRAINING EPOCH: 300 ----------------------------  
client [99] (testset)   loss: 0.0270 -> 0.0189  accuracy: 98.88% -> 99.44%     
client [7]  (testset)   loss: 0.0457 -> 0.0447  accuracy: 98.81% -> 98.81%     
client [17] (testset)   loss: 0.0470 -> 0.0458  accuracy: 98.69% -> 98.69%     
client [64] (testset)   loss: 0.0021 -> 0.0016  accuracy: 100.00% -> 100.00%   
client [37] (testset)   loss: 0.0432 -> 0.0425  accuracy: 99.14% -> 99.14%     
client [29] (testset)   loss: 0.0444 -> 0.0359  accuracy: 99.13% -> 99.13%     
client [93] (testset)   loss: 0.0228 -> 0.0209  accuracy: 99.60% -> 99.60%     
client [73] (testset)   loss: 0.1985 -> 0.1995  accuracy: 98.75% -> 98.75%     
client [40] (testset)   loss: 0.0425 -> 0.0158  accuracy: 98.40% -> 99.20%     
client [76] (testset)   loss: 0.0000 -> 0.0000  accuracy: 100.00% -> 100.00%   
---------------------------- TRAINING EPOCH: 310 ----------------------------  
client [31] (testset)   loss: 0.0831 -> 0.0804  accuracy: 98.21% -> 98.21%     
client [89] (testset)   loss: 0.2177 -> 0.2139  accuracy: 98.23% -> 98.23%     
client [77] (testset)   loss: 0.0562 -> 0.0479  accuracy: 99.20% -> 99.20%     
client [90] (testset)   loss: 0.0338 -> 0.0353  accuracy: 99.29% -> 99.29%     
client [26] (testset)   loss: 0.0186 -> 0.0147  accuracy: 98.73% -> 99.58%     
client [50] (testset)   loss: 0.1063 -> 0.0887  accuracy: 98.24% -> 98.24%     
client [30] (testset)   loss: 0.0904 -> 0.0820  accuracy: 98.22% -> 98.22%     
client [70] (testset)   loss: 0.0028 -> 0.0020  accuracy: 100.00% -> 100.00%   
client [41] (testset)   loss: 0.0183 -> 0.0228  accuracy: 99.40% -> 99.40%     
client [99] (testset)   loss: 0.0372 -> 0.0293  accuracy: 98.88% -> 98.88%     
---------------------------- TRAINING EPOCH: 320 ----------------------------  
client [68] (testset)   loss: 0.0009 -> 0.0005  accuracy: 100.00% -> 100.00%   
client [70] (testset)   loss: 0.0022 -> 0.0016  accuracy: 100.00% -> 100.00%   
client [52] (testset)   loss: 0.0000 -> 0.0000  accuracy: 100.00% -> 100.00%   
client [1]  (testset)   loss: 0.0751 -> 0.0747  accuracy: 98.54% -> 99.02%     
client [2]  (testset)   loss: 0.0770 -> 0.0754  accuracy: 98.43% -> 98.43%     
client [67] (testset)   loss: 0.0241 -> 0.0166  accuracy: 98.29% -> 99.15%     
client [92] (testset)   loss: 0.1589 -> 0.1619  accuracy: 97.60% -> 97.60%     
client [35] (testset)   loss: 0.0152 -> 0.0137  accuracy: 99.40% -> 99.40%     
client [36] (testset)   loss: 0.0047 -> 0.0060  accuracy: 99.45% -> 99.45%     
client [64] (testset)   loss: 0.0022 -> 0.0015  accuracy: 100.00% -> 100.00%   
---------------------------- TRAINING EPOCH: 330 ----------------------------  
client [44] (testset)   loss: 0.3589 -> 0.3572  accuracy: 99.40% -> 99.40%     
client [6]  (testset)   loss: 0.2042 -> 0.2073  accuracy: 97.95% -> 97.95%     
client [12] (testset)   loss: 0.0021 -> 0.0022  accuracy: 100.00% -> 100.00%   
client [55] (testset)   loss: 0.0765 -> 0.0606  accuracy: 96.97% -> 96.97%     
client [29] (testset)   loss: 0.0629 -> 0.0547  accuracy: 99.13% -> 99.13%     
client [9]  (testset)   loss: 0.0523 -> 0.0449  accuracy: 97.20% -> 97.20%     
client [43] (testset)   loss: 0.0890 -> 0.0609  accuracy: 97.30% -> 97.30%     
client [77] (testset)   loss: 0.0491 -> 0.0396  accuracy: 99.20% -> 99.20%     
client [98] (testset)   loss: 0.0014 -> 0.0013  accuracy: 100.00% -> 100.00%   
client [78] (testset)   loss: 0.1706 -> 0.1653  accuracy: 96.36% -> 96.36%     
---------------------------- TRAINING EPOCH: 340 ----------------------------  
client [92] (testset)   loss: 0.1674 -> 0.1675  accuracy: 97.60% -> 97.60%     
client [80] (testset)   loss: 0.0540 -> 0.0493  accuracy: 99.25% -> 99.25%     
client [63] (testset)   loss: 0.0060 -> 0.0015  accuracy: 99.35% -> 100.00%    
client [76] (testset)   loss: 0.0000 -> 0.0000  accuracy: 100.00% -> 100.00%   
client [78] (testset)   loss: 0.1587 -> 0.1559  accuracy: 96.36% -> 96.36%     
client [25] (testset)   loss: 0.0756 -> 0.0586  accuracy: 99.05% -> 99.05%     
client [58] (testset)   loss: 0.0059 -> 0.0051  accuracy: 100.00% -> 100.00%   
client [13] (testset)   loss: 0.2470 -> 0.2494  accuracy: 96.00% -> 96.00%     
client [17] (testset)   loss: 0.0463 -> 0.0453  accuracy: 98.69% -> 99.13%     
client [38] (testset)   loss: 0.0270 -> 0.0278  accuracy: 99.51% -> 99.51%     
---------------------------- TRAINING EPOCH: 350 ----------------------------  
client [72] (testset)   loss: 0.0089 -> 0.0089  accuracy: 99.60% -> 99.60%     
client [82] (testset)   loss: 0.0132 -> 0.0132  accuracy: 98.97% -> 98.97%     
client [86] (testset)   loss: 0.0003 -> 0.0002  accuracy: 100.00% -> 100.00%   
client [51] (testset)   loss: 0.0350 -> 0.0318  accuracy: 98.13% -> 98.13%     
client [96] (testset)   loss: 0.0866 -> 0.0749  accuracy: 98.56% -> 99.04%     
client [42] (testset)   loss: 0.0343 -> 0.0341  accuracy: 99.12% -> 99.12%     
client [55] (testset)   loss: 0.0604 -> 0.0580  accuracy: 96.97% -> 96.97%     
client [13] (testset)   loss: 0.2496 -> 0.2505  accuracy: 96.00% -> 96.00%     
client [1]  (testset)   loss: 0.0763 -> 0.0703  accuracy: 98.54% -> 99.51%     
client [12] (testset)   loss: 0.0013 -> 0.0018  accuracy: 100.00% -> 100.00%   
---------------------------- TRAINING EPOCH: 360 ----------------------------  
client [68] (testset)   loss: 0.0004 -> 0.0003  accuracy: 100.00% -> 100.00%   
client [23] (testset)   loss: 0.0981 -> 0.0866  accuracy: 98.92% -> 98.92%     
client [46] (testset)   loss: 0.0040 -> 0.0052  accuracy: 100.00% -> 100.00%   
client [41] (testset)   loss: 0.0157 -> 0.0205  accuracy: 99.40% -> 99.40%     
client [25] (testset)   loss: 0.0717 -> 0.0666  accuracy: 99.05% -> 99.05%     
client [58] (testset)   loss: 0.0041 -> 0.0038  accuracy: 100.00% -> 100.00%   
client [14] (testset)   loss: 0.3326 -> 0.3291  accuracy: 95.18% -> 96.39%     
client [33] (testset)   loss: 0.0322 -> 0.0441  accuracy: 99.29% -> 99.29%     
client [85] (testset)   loss: 0.0018 -> 0.0015  accuracy: 100.00% -> 100.00%   
client [62] (testset)   loss: 0.0452 -> 0.0454  accuracy: 99.46% -> 99.46%     
---------------------------- TRAINING EPOCH: 370 ----------------------------  
client [98] (testset)   loss: 0.0009 -> 0.0009  accuracy: 100.00% -> 100.00%   
client [63] (testset)   loss: 0.0003 -> 0.0004  accuracy: 100.00% -> 100.00%   
client [70] (testset)   loss: 0.0045 -> 0.0044  accuracy: 100.00% -> 99.58%    
client [65] (testset)   loss: 0.0147 -> 0.0138  accuracy: 98.82% -> 99.41%     
client [14] (testset)   loss: 0.3395 -> 0.3374  accuracy: 96.39% -> 96.39%     
client [73] (testset)   loss: 0.2140 -> 0.2159  accuracy: 98.33% -> 98.33%     
client [34] (testset)   loss: 0.0037 -> 0.0035  accuracy: 100.00% -> 100.00%   
client [99] (testset)   loss: 0.0175 -> 0.0126  accuracy: 99.44% -> 99.44%     
client [69] (testset)   loss: 0.0018 -> 0.0020  accuracy: 100.00% -> 100.00%   
client [46] (testset)   loss: 0.0075 -> 0.0063  accuracy: 99.25% -> 99.25%     
---------------------------- TRAINING EPOCH: 380 ----------------------------  
client [99] (testset)   loss: 0.0394 -> 0.0304  accuracy: 98.88% -> 98.88%     
client [93] (testset)   loss: 0.0082 -> 0.0064  accuracy: 99.21% -> 99.60%     
client [11] (testset)   loss: 0.0398 -> 0.0398  accuracy: 98.45% -> 98.45%     
client [58] (testset)   loss: 0.0087 -> 0.0088  accuracy: 99.49% -> 99.49%     
client [81] (testset)   loss: 0.1918 -> 0.1947  accuracy: 98.18% -> 98.18%     
client [85] (testset)   loss: 0.0003 -> 0.0003  accuracy: 100.00% -> 100.00%   
client [89] (testset)   loss: 0.2257 -> 0.2259  accuracy: 98.23% -> 98.23%     
client [45] (testset)   loss: 0.0437 -> 0.0433  accuracy: 99.23% -> 99.23%     
client [8]  (testset)   loss: 0.0769 -> 0.0763  accuracy: 98.78% -> 98.78%     
client [68] (testset)   loss: 0.0003 -> 0.0002  accuracy: 100.00% -> 100.00%   
---------------------------- TRAINING EPOCH: 390 ----------------------------  
client [67] (testset)   loss: 0.0167 -> 0.0118  accuracy: 99.15% -> 99.15%     
client [72] (testset)   loss: 0.0032 -> 0.0035  accuracy: 99.60% -> 99.60%     
client [1]  (testset)   loss: 0.0784 -> 0.0774  accuracy: 99.02% -> 99.02%     
client [78] (testset)   loss: 0.1884 -> 0.1791  accuracy: 96.36% -> 96.36%     
client [83] (testset)   loss: 0.1089 -> 0.1103  accuracy: 97.61% -> 98.09%     
client [21] (testset)   loss: 0.0732 -> 0.0708  accuracy: 99.12% -> 99.12%     
client [56] (testset)   loss: 0.0020 -> 0.0020  accuracy: 100.00% -> 100.00%   
client [44] (testset)   loss: 0.3809 -> 0.3789  accuracy: 99.40% -> 99.40%     
client [92] (testset)   loss: 0.1697 -> 0.1717  accuracy: 97.60% -> 97.60%     
client [27] (testset)   loss: 0.0787 -> 0.0822  accuracy: 98.82% -> 98.82%     
---------------------------- TRAINING EPOCH: 400 ----------------------------  
client [10] (testset)   loss: 0.0875 -> 0.0872  accuracy: 99.34% -> 99.34%     
client [39] (testset)   loss: 0.0034 -> 0.0041  accuracy: 100.00% -> 99.45%    
client [65] (testset)   loss: 0.0237 -> 0.0172  accuracy: 98.82% -> 98.82%     
client [26] (testset)   loss: 0.0143 -> 0.0115  accuracy: 99.58% -> 99.58%     
client [19] (testset)   loss: 0.0014 -> 0.0010  accuracy: 100.00% -> 100.00%   
client [68] (testset)   loss: 0.0001 -> 0.0001  accuracy: 100.00% -> 100.00%   
client [41] (testset)   loss: 0.0226 -> 0.0267  accuracy: 99.40% -> 99.40%     
client [50] (testset)   loss: 0.1012 -> 0.0939  accuracy: 98.24% -> 98.24%     
client [75] (testset)   loss: 0.0120 -> 0.0115  accuracy: 99.47% -> 99.47%     
client [81] (testset)   loss: 0.2008 -> 0.2017  accuracy: 98.18% -> 98.18%     
Training... ---------------------------------------- 100% 0:15:01
PSFL's average time taken by each global epoch: 0 min 2.23 sec.                
PSFL's total running time: 0 h 15 m 1 s.                                       
==================== PSFL Experiment Results: ====================             
Display format: (before local fine-tuning) -> (after local fine-tuning)        
 So if finetune_epoch = 0, x.xx% -> 0.00% is normal.                           
 Centralized testing ONLY happens after model aggregation, so the stats between
'->' are the same.                                                             
{                                                                              
    "100": {                                                                   
        "all_clients": {                                                       
            "test": {                                                          
                "loss": "0.0499 -> 0.0000",                                    
                "accuracy": "98.76% -> 0.00%"                                  
            }                                                                  
        }                                                                      
    },                                                                         
    "200": {                                                                   
        "all_clients": {                                                       
            "test": {                                                          
                "loss": "0.0532 -> 0.0000",                                    
                "accuracy": "98.91% -> 0.00%"                                  
            }                                                                  
        }                                                                      
    },                                                                         
    "300": {                                                                   
        "all_clients": {                                                       
            "test": {                                                          
                "loss": "0.0588 -> 0.0000",                                    
                "accuracy": "99.03% -> 0.00%"                                  
            }                                                                  
        }                                                                      
    },                                                                         
    "400": {                                                                   
        "all_clients": {                                                       
            "test": {                                                          
                "loss": "0.0598 -> 0.0000",                                    
                "accuracy": "98.99% -> 0.00%"                                  
            }                                                                  
        }                                                                      
    }                                                                          
}                                                                              
==================== PSFL Max Accuracy ====================                    
all_clients:                                                                   
(test) before fine-tuning: 99.03% at epoch 300                                 
(test) after fine-tuning: 0.00% at epoch 100                                   
[0m