==================== SFL ====================                                  
Experiment Arguments:                                                          
{
│   'method': 'sfl',
│   'dataset': {
│   │   'name': 'mnist',
│   │   'client_num': 100,
│   │   'test_ratio': 0.25,
│   │   'val_ratio': 0.0,
│   │   'seed': 42,
│   │   'split': 'sample',
│   │   'IID_ratio': 0.0,
│   │   'monitor_window_name_suffix': 'mnist-100clients-0%IID-Dir(1.0)-seed42',
│   │   'alpha': 1.0,
│   │   'min_samples_per_client': 10
│   },
│   'model': {
│   │   'name': 'avgcnn',
│   │   'use_torchvision_pretrained_weights': True,
│   │   'external_model_weights_path': None
│   },
│   'optimizer': {
│   │   'lr': 0.01,
│   │   'dampening': 0,
│   │   'weight_decay': 0,
│   │   'momentum': 0,
│   │   'nesterov': False,
│   │   'name': 'sgd'
│   },
│   'mode': 'sequential',
│   'parallel': {
│   │   'ray_cluster_addr': None,
│   │   'num_cpus': None,
│   │   'num_gpus': None,
│   │   'num_workers': 2
│   },
│   'common': {
│   │   'seed': 42,
│   │   'join_ratio': 0.1,
│   │   'global_epoch': 400,
│   │   'local_epoch': 5,
│   │   'batch_size': 32,
│   │   'reset_optimizer_on_global_epoch': True,
│   │   'straggler_ratio': 0,
│   │   'straggler_min_local_epoch': 0,
│   │   'buffers': 'global',
│   │   'client_side_evaluation': True,
│   │   'test': {
│   │   │   'client': {
│   │   │   │   'interval': 100,
│   │   │   │   'finetune_epoch': 0,
│   │   │   │   'train': False,
│   │   │   │   'val': False,
│   │   │   │   'test': True
│   │   │   },
│   │   │   'server': {
│   │   │   │   'interval': -1,
│   │   │   │   'train': False,
│   │   │   │   'val': False,
│   │   │   │   'test': False,
│   │   │   │   'model_in_train_mode': False
│   │   │   }
│   │   },
│   │   'verbose_gap': 10,
│   │   'monitor': None,
│   │   'use_cuda': True,
│   │   'save_log': True,
│   │   'save_model': False,
│   │   'save_learning_curve_plot': False,
│   │   'save_metrics': True,
│   │   'delete_useless_run': True
│   }
}
---------------------------- TRAINING EPOCH: 10 ----------------------------   
client [77] (testset)   loss: 0.1825 -> 0.0561  accuracy: 95.58% -> 98.80%     
client [81] (testset)   loss: 0.2135 -> 0.1310  accuracy: 93.64% -> 98.18%     
client [21] (testset)   loss: 0.0987 -> 0.0264  accuracy: 98.23% -> 99.12%     
client [68] (testset)   loss: 0.0478 -> 0.0125  accuracy: 98.33% -> 99.44%     
client [93] (testset)   loss: 0.0786 -> 0.0481  accuracy: 97.22% -> 98.02%     
client [31] (testset)   loss: 0.1025 -> 0.0545  accuracy: 96.43% -> 98.21%     
client [20] (testset)   loss: 0.1007 -> 0.0486  accuracy: 96.93% -> 98.25%     
client [59] (testset)   loss: 0.0413 -> 0.0585  accuracy: 98.44% -> 97.92%     
client [48] (testset)   loss: 0.0622 -> 0.0309  accuracy: 97.87% -> 99.29%     
client [34] (testset)   loss: 0.0485 -> 0.0477  accuracy: 98.65% -> 98.65%     
---------------------------- TRAINING EPOCH: 20 ----------------------------   
client [69] (testset)   loss: 0.0260 -> 0.0247  accuracy: 99.40% -> 98.19%     
client [99] (testset)   loss: 0.1074 -> 0.0653  accuracy: 96.65% -> 97.77%     
client [67] (testset)   loss: 0.0498 -> 0.0494  accuracy: 99.15% -> 99.15%     
client [0]  (testset)   loss: 0.0326 -> 0.0394  accuracy: 98.99% -> 98.99%     
client [76] (testset)   loss: 0.0015 -> 0.0014  accuracy: 100.00% -> 100.00%   
client [41] (testset)   loss: 0.0302 -> 0.0308  accuracy: 99.40% -> 99.40%     
client [62] (testset)   loss: 0.0566 -> 0.0297  accuracy: 98.38% -> 98.92%     
client [2]  (testset)   loss: 0.0623 -> 0.0539  accuracy: 97.64% -> 97.64%     
client [14] (testset)   loss: 0.1721 -> 0.1482  accuracy: 96.39% -> 96.39%     
client [46] (testset)   loss: 0.0267 -> 0.0121  accuracy: 99.25% -> 99.25%     
---------------------------- TRAINING EPOCH: 30 ----------------------------   
client [24] (testset)   loss: 0.0292 -> 0.0279  accuracy: 99.12% -> 99.12%     
client [68] (testset)   loss: 0.0207 -> 0.0028  accuracy: 98.89% -> 100.00%    
client [57] (testset)   loss: 0.1363 -> 0.1018  accuracy: 96.77% -> 98.16%     
client [17] (testset)   loss: 0.0559 -> 0.0284  accuracy: 97.38% -> 99.13%     
client [54] (testset)   loss: 0.0803 -> 0.0770  accuracy: 97.19% -> 99.44%     
client [23] (testset)   loss: 0.0524 -> 0.0493  accuracy: 98.92% -> 98.92%     
client [35] (testset)   loss: 0.0160 -> 0.0078  accuracy: 99.40% -> 99.40%     
client [59] (testset)   loss: 0.0242 -> 0.0370  accuracy: 98.44% -> 98.44%     
client [31] (testset)   loss: 0.0496 -> 0.0490  accuracy: 98.21% -> 98.21%     
client [9]  (testset)   loss: 0.0178 -> 0.0067  accuracy: 100.00% -> 100.00%   
---------------------------- TRAINING EPOCH: 40 ----------------------------   
client [64] (testset)   loss: 0.0269 -> 0.0101  accuracy: 98.34% -> 99.59%     
client [33] (testset)   loss: 0.0133 -> 0.0243  accuracy: 100.00% -> 99.29%    
client [16] (testset)   loss: 0.0596 -> 0.0470  accuracy: 97.72% -> 98.17%     
client [44] (testset)   loss: 0.2110 -> 0.1858  accuracy: 99.40% -> 99.40%     
client [8]  (testset)   loss: 0.0639 -> 0.0624  accuracy: 98.78% -> 98.78%     
client [31] (testset)   loss: 0.0413 -> 0.0382  accuracy: 98.21% -> 99.11%     
client [47] (testset)   loss: 0.0098 -> 0.0162  accuracy: 100.00% -> 99.19%    
client [36] (testset)   loss: 0.0038 -> 0.0238  accuracy: 100.00% -> 98.91%    
client [20] (testset)   loss: 0.0634 -> 0.0242  accuracy: 97.81% -> 99.12%     
client [56] (testset)   loss: 0.0095 -> 0.0126  accuracy: 99.47% -> 98.95%     
---------------------------- TRAINING EPOCH: 50 ----------------------------   
client [4]  (testset)   loss: 0.1514 -> 0.1457  accuracy: 98.29% -> 97.14%     
client [60] (testset)   loss: 0.0135 -> 0.0093  accuracy: 99.28% -> 99.28%     
client [28] (testset)   loss: 0.0095 -> 0.0118  accuracy: 99.27% -> 99.27%     
client [25] (testset)   loss: 0.1140 -> 0.0567  accuracy: 97.16% -> 98.58%     
client [58] (testset)   loss: 0.0149 -> 0.0198  accuracy: 98.97% -> 99.49%     
client [44] (testset)   loss: 0.2450 -> 0.2116  accuracy: 98.19% -> 98.80%     
client [39] (testset)   loss: 0.0087 -> 0.0100  accuracy: 99.45% -> 99.45%     
client [29] (testset)   loss: 0.0552 -> 0.0145  accuracy: 98.26% -> 99.13%     
client [3]  (testset)   loss: 0.0641 -> 0.0817  accuracy: 96.96% -> 97.39%     
client [84] (testset)   loss: 0.0152 -> 0.0120  accuracy: 99.41% -> 99.41%     
---------------------------- TRAINING EPOCH: 60 ----------------------------   
client [21] (testset)   loss: 0.0207 -> 0.0141  accuracy: 99.12% -> 99.12%     
client [84] (testset)   loss: 0.0066 -> 0.0104  accuracy: 100.00% -> 99.41%    
client [10] (testset)   loss: 0.0522 -> 0.0585  accuracy: 98.68% -> 99.34%     
client [36] (testset)   loss: 0.0062 -> 0.0141  accuracy: 100.00% -> 99.45%    
client [65] (testset)   loss: 0.0474 -> 0.0487  accuracy: 98.24% -> 98.82%     
client [81] (testset)   loss: 0.1038 -> 0.1247  accuracy: 97.27% -> 97.27%     
client [79] (testset)   loss: 0.0435 -> 0.0137  accuracy: 99.28% -> 99.64%     
client [42] (testset)   loss: 0.0353 -> 0.0280  accuracy: 99.12% -> 99.12%     
client [11] (testset)   loss: 0.0181 -> 0.0177  accuracy: 98.97% -> 99.48%     
client [96] (testset)   loss: 0.1325 -> 0.0543  accuracy: 97.13% -> 98.09%     
---------------------------- TRAINING EPOCH: 70 ----------------------------   
client [8]  (testset)   loss: 0.0301 -> 0.0352  accuracy: 98.78% -> 98.78%     
client [53] (testset)   loss: 0.0350 -> 0.0210  accuracy: 98.21% -> 99.11%     
client [52] (testset)   loss: 0.0006 -> 0.0003  accuracy: 100.00% -> 100.00%   
client [42] (testset)   loss: 0.0204 -> 0.0138  accuracy: 99.12% -> 99.12%     
client [69] (testset)   loss: 0.0308 -> 0.0135  accuracy: 98.19% -> 99.40%     
client [59] (testset)   loss: 0.0162 -> 0.0224  accuracy: 98.96% -> 98.44%     
client [7]  (testset)   loss: 0.0394 -> 0.0192  accuracy: 98.81% -> 98.81%     
client [26] (testset)   loss: 0.0238 -> 0.0098  accuracy: 98.73% -> 99.58%     
client [49] (testset)   loss: 0.0369 -> 0.0195  accuracy: 98.77% -> 98.77%     
client [98] (testset)   loss: 0.0042 -> 0.0101  accuracy: 100.00% -> 99.19%    
---------------------------- TRAINING EPOCH: 80 ----------------------------   
client [98] (testset)   loss: 0.0006 -> 0.0006  accuracy: 100.00% -> 100.00%   
client [47] (testset)   loss: 0.0055 -> 0.0075  accuracy: 100.00% -> 99.60%    
client [21] (testset)   loss: 0.0200 -> 0.0285  accuracy: 99.12% -> 99.12%     
client [77] (testset)   loss: 0.0485 -> 0.0308  accuracy: 98.80% -> 99.20%     
client [95] (testset)   loss: 0.0705 -> 0.0490  accuracy: 98.05% -> 98.05%     
client [91] (testset)   loss: 0.0123 -> 0.0097  accuracy: 100.00% -> 100.00%   
client [14] (testset)   loss: 0.2346 -> 0.2241  accuracy: 97.59% -> 96.39%     
client [99] (testset)   loss: 0.0355 -> 0.0247  accuracy: 98.88% -> 99.44%     
client [20] (testset)   loss: 0.0373 -> 0.0303  accuracy: 98.68% -> 99.12%     
client [39] (testset)   loss: 0.0123 -> 0.0134  accuracy: 99.45% -> 99.45%     
---------------------------- TRAINING EPOCH: 90 ----------------------------   
client [52] (testset)   loss: 0.0010 -> 0.0014  accuracy: 100.00% -> 100.00%   
client [62] (testset)   loss: 0.0367 -> 0.0192  accuracy: 99.46% -> 99.46%     
client [71] (testset)   loss: 0.1094 -> 0.0945  accuracy: 96.86% -> 97.38%     
client [97] (testset)   loss: 0.0243 -> 0.0122  accuracy: 99.33% -> 99.33%     
client [30] (testset)   loss: 0.0400 -> 0.0338  accuracy: 98.67% -> 99.11%     
client [88] (testset)   loss: 0.0513 -> 0.0487  accuracy: 97.92% -> 98.27%     
client [60] (testset)   loss: 0.0104 -> 0.0107  accuracy: 99.64% -> 99.64%     
client [82] (testset)   loss: 0.0387 -> 0.0345  accuracy: 98.97% -> 98.97%     
client [91] (testset)   loss: 0.0087 -> 0.0089  accuracy: 100.00% -> 100.00%   
client [57] (testset)   loss: 0.1272 -> 0.1165  accuracy: 97.70% -> 98.16%     
---------------------------- TRAINING EPOCH: 100 ----------------------------  
client [31] (testset)   loss: 0.0607 -> 0.0560  accuracy: 97.32% -> 97.32%     
client [15] (testset)   loss: 0.0478 -> 0.0478  accuracy: 98.52% -> 98.52%     
client [71] (testset)   loss: 0.0837 -> 0.0790  accuracy: 97.91% -> 97.91%     
client [97] (testset)   loss: 0.0229 -> 0.0202  accuracy: 99.33% -> 99.33%     
client [53] (testset)   loss: 0.0330 -> 0.0122  accuracy: 98.21% -> 100.00%    
client [77] (testset)   loss: 0.0482 -> 0.0291  accuracy: 98.80% -> 99.20%     
client [76] (testset)   loss: 0.0000 -> 0.0000  accuracy: 100.00% -> 100.00%   
client [79] (testset)   loss: 0.0155 -> 0.0114  accuracy: 99.28% -> 99.64%     
client [28] (testset)   loss: 0.0513 -> 0.0193  accuracy: 98.54% -> 99.27%     
client [99] (testset)   loss: 0.0350 -> 0.0126  accuracy: 99.44% -> 99.44%     
---------------------------- TRAINING EPOCH: 110 ----------------------------  
client [97] (testset)   loss: 0.0377 -> 0.0249  accuracy: 99.33% -> 99.33%     
client [86] (testset)   loss: 0.0129 -> 0.0050  accuracy: 100.00% -> 100.00%   
client [34] (testset)   loss: 0.0172 -> 0.0082  accuracy: 99.32% -> 99.32%     
client [73] (testset)   loss: 0.1440 -> 0.1460  accuracy: 98.33% -> 98.33%     
client [5]  (testset)   loss: 0.0519 -> 0.0261  accuracy: 98.77% -> 99.38%     
client [96] (testset)   loss: 0.1146 -> 0.0905  accuracy: 98.09% -> 98.09%     
client [22] (testset)   loss: 0.0798 -> 0.0652  accuracy: 98.63% -> 99.09%     
client [60] (testset)   loss: 0.0029 -> 0.0023  accuracy: 100.00% -> 100.00%   
client [66] (testset)   loss: 0.1474 -> 0.1119  accuracy: 97.94% -> 97.94%     
client [83] (testset)   loss: 0.0808 -> 0.0625  accuracy: 98.09% -> 98.09%     
---------------------------- TRAINING EPOCH: 120 ----------------------------  
client [76] (testset)   loss: 0.0000 -> 0.0000  accuracy: 100.00% -> 100.00%   
client [65] (testset)   loss: 0.0180 -> 0.0243  accuracy: 99.41% -> 98.24%     
client [95] (testset)   loss: 0.0838 -> 0.0444  accuracy: 98.05% -> 98.54%     
client [17] (testset)   loss: 0.0483 -> 0.0402  accuracy: 98.69% -> 99.13%     
client [8]  (testset)   loss: 0.0780 -> 0.0822  accuracy: 98.78% -> 98.78%     
client [35] (testset)   loss: 0.0185 -> 0.0157  accuracy: 99.40% -> 99.40%     
client [98] (testset)   loss: 0.0039 -> 0.0135  accuracy: 100.00% -> 99.19%    
client [53] (testset)   loss: 0.0068 -> 0.0039  accuracy: 100.00% -> 100.00%   
client [43] (testset)   loss: 0.0127 -> 0.0078  accuracy: 99.10% -> 100.00%    
client [64] (testset)   loss: 0.0213 -> 0.0120  accuracy: 99.17% -> 99.17%     
---------------------------- TRAINING EPOCH: 130 ----------------------------  
client [21] (testset)   loss: 0.0595 -> 0.0394  accuracy: 99.12% -> 99.12%     
client [88] (testset)   loss: 0.0474 -> 0.0457  accuracy: 98.62% -> 98.62%     
client [38] (testset)   loss: 0.0183 -> 0.0420  accuracy: 99.51% -> 99.51%     
client [3]  (testset)   loss: 0.0928 -> 0.0610  accuracy: 97.83% -> 97.83%     
client [5]  (testset)   loss: 0.0029 -> 0.0107  accuracy: 100.00% -> 99.38%    
client [41] (testset)   loss: 0.0140 -> 0.0267  accuracy: 99.40% -> 99.40%     
client [7]  (testset)   loss: 0.0232 -> 0.0064  accuracy: 98.81% -> 99.40%     
client [37] (testset)   loss: 0.0576 -> 0.0498  accuracy: 98.71% -> 98.71%     
client [45] (testset)   loss: 0.0341 -> 0.0483  accuracy: 99.23% -> 98.85%     
client [47] (testset)   loss: 0.0092 -> 0.0187  accuracy: 99.60% -> 99.60%     
---------------------------- TRAINING EPOCH: 140 ----------------------------  
client [16] (testset)   loss: 0.0783 -> 0.0597  accuracy: 98.63% -> 98.63%     
client [11] (testset)   loss: 0.1065 -> 0.0718  accuracy: 96.91% -> 97.42%     
client [37] (testset)   loss: 0.0512 -> 0.0450  accuracy: 98.71% -> 98.71%     
client [41] (testset)   loss: 0.0207 -> 0.0280  accuracy: 99.40% -> 99.40%     
client [95] (testset)   loss: 0.0658 -> 0.0456  accuracy: 98.05% -> 98.54%     
client [53] (testset)   loss: 0.0260 -> 0.0333  accuracy: 99.11% -> 99.11%     
client [22] (testset)   loss: 0.0469 -> 0.0467  accuracy: 98.63% -> 98.63%     
client [25] (testset)   loss: 0.0730 -> 0.0663  accuracy: 99.05% -> 98.58%     
client [69] (testset)   loss: 0.0113 -> 0.0098  accuracy: 99.40% -> 99.40%     
client [46] (testset)   loss: 0.0048 -> 0.0038  accuracy: 100.00% -> 100.00%   
---------------------------- TRAINING EPOCH: 150 ----------------------------  
client [47] (testset)   loss: 0.0036 -> 0.0061  accuracy: 100.00% -> 100.00%   
client [69] (testset)   loss: 0.0155 -> 0.0066  accuracy: 99.40% -> 100.00%    
client [82] (testset)   loss: 0.0193 -> 0.0164  accuracy: 98.97% -> 98.97%     
client [45] (testset)   loss: 0.0411 -> 0.0432  accuracy: 99.62% -> 99.23%     
client [7]  (testset)   loss: 0.0479 -> 0.0293  accuracy: 99.40% -> 99.40%     
client [50] (testset)   loss: 0.0622 -> 0.0375  accuracy: 98.24% -> 99.30%     
client [35] (testset)   loss: 0.0296 -> 0.0121  accuracy: 98.80% -> 99.40%     
client [24] (testset)   loss: 0.0361 -> 0.0133  accuracy: 99.12% -> 99.12%     
client [15] (testset)   loss: 0.0513 -> 0.0585  accuracy: 99.01% -> 99.01%     
client [58] (testset)   loss: 0.0020 -> 0.0031  accuracy: 100.00% -> 100.00%   
---------------------------- TRAINING EPOCH: 160 ----------------------------  
client [48] (testset)   loss: 0.0138 -> 0.0100  accuracy: 100.00% -> 99.29%    
client [76] (testset)   loss: 0.0000 -> 0.0000  accuracy: 100.00% -> 100.00%   
client [67] (testset)   loss: 0.0326 -> 0.0284  accuracy: 98.29% -> 99.15%     
client [37] (testset)   loss: 0.0498 -> 0.0498  accuracy: 98.28% -> 98.71%     
client [58] (testset)   loss: 0.0042 -> 0.0048  accuracy: 100.00% -> 100.00%   
client [64] (testset)   loss: 0.0028 -> 0.0015  accuracy: 100.00% -> 100.00%   
client [77] (testset)   loss: 0.0521 -> 0.0351  accuracy: 99.20% -> 99.20%     
client [55] (testset)   loss: 0.0293 -> 0.0156  accuracy: 96.97% -> 98.99%     
client [12] (testset)   loss: 0.0060 -> 0.0044  accuracy: 100.00% -> 100.00%   
client [89] (testset)   loss: 0.1445 -> 0.1329  accuracy: 97.35% -> 98.23%     
---------------------------- TRAINING EPOCH: 170 ----------------------------  
client [84] (testset)   loss: 0.0173 -> 0.0151  accuracy: 99.41% -> 99.41%     
client [51] (testset)   loss: 0.0099 -> 0.0114  accuracy: 99.53% -> 99.07%     
client [8]  (testset)   loss: 0.0392 -> 0.0346  accuracy: 98.78% -> 98.78%     
client [18] (testset)   loss: 0.0050 -> 0.0029  accuracy: 100.00% -> 100.00%   
client [94] (testset)   loss: 0.0692 -> 0.0614  accuracy: 99.22% -> 99.22%     
client [81] (testset)   loss: 0.1906 -> 0.1943  accuracy: 97.27% -> 97.27%     
client [3]  (testset)   loss: 0.0676 -> 0.0683  accuracy: 97.83% -> 97.39%     
client [11] (testset)   loss: 0.0130 -> 0.0114  accuracy: 98.97% -> 98.97%     
client [95] (testset)   loss: 0.0689 -> 0.0517  accuracy: 98.05% -> 98.05%     
client [67] (testset)   loss: 0.0246 -> 0.0231  accuracy: 99.15% -> 99.15%     
---------------------------- TRAINING EPOCH: 180 ----------------------------  
client [21] (testset)   loss: 0.0700 -> 0.0566  accuracy: 99.12% -> 99.12%     
client [79] (testset)   loss: 0.0325 -> 0.0171  accuracy: 98.92% -> 99.28%     
client [58] (testset)   loss: 0.0207 -> 0.0165  accuracy: 99.49% -> 99.49%     
client [88] (testset)   loss: 0.0560 -> 0.0499  accuracy: 98.62% -> 98.62%     
client [46] (testset)   loss: 0.0184 -> 0.0155  accuracy: 98.50% -> 98.50%     
client [11] (testset)   loss: 0.0340 -> 0.0254  accuracy: 99.48% -> 98.97%     
client [55] (testset)   loss: 0.0378 -> 0.0367  accuracy: 98.99% -> 98.99%     
client [13] (testset)   loss: 0.1621 -> 0.1704  accuracy: 96.00% -> 96.00%     
client [31] (testset)   loss: 0.0385 -> 0.0348  accuracy: 98.21% -> 98.21%     
client [75] (testset)   loss: 0.0159 -> 0.0148  accuracy: 99.47% -> 99.47%     
---------------------------- TRAINING EPOCH: 190 ----------------------------  
client [19] (testset)   loss: 0.0165 -> 0.0088  accuracy: 99.41% -> 99.41%     
client [7]  (testset)   loss: 0.0294 -> 0.0254  accuracy: 98.81% -> 98.81%     
client [57] (testset)   loss: 0.1187 -> 0.1168  accuracy: 98.16% -> 98.16%     
client [13] (testset)   loss: 0.1693 -> 0.1696  accuracy: 96.80% -> 96.80%     
client [43] (testset)   loss: 0.0284 -> 0.0208  accuracy: 98.20% -> 99.10%     
client [91] (testset)   loss: 0.0027 -> 0.0037  accuracy: 100.00% -> 100.00%   
client [10] (testset)   loss: 0.0837 -> 0.0888  accuracy: 99.34% -> 99.34%     
client [64] (testset)   loss: 0.0094 -> 0.0065  accuracy: 99.59% -> 100.00%    
client [82] (testset)   loss: 0.0355 -> 0.0347  accuracy: 98.97% -> 98.97%     
client [22] (testset)   loss: 0.0560 -> 0.0553  accuracy: 99.09% -> 99.09%     
---------------------------- TRAINING EPOCH: 200 ----------------------------  
client [20] (testset)   loss: 0.0654 -> 0.0554  accuracy: 98.68% -> 98.68%     
client [23] (testset)   loss: 0.0902 -> 0.0826  accuracy: 98.92% -> 98.92%     
client [88] (testset)   loss: 0.0436 -> 0.0468  accuracy: 98.62% -> 98.96%     
client [98] (testset)   loss: 0.0003 -> 0.0003  accuracy: 100.00% -> 100.00%   
client [79] (testset)   loss: 0.0230 -> 0.0136  accuracy: 98.57% -> 99.28%     
client [21] (testset)   loss: 0.0302 -> 0.0223  accuracy: 99.12% -> 99.12%     
client [92] (testset)   loss: 0.1395 -> 0.1420  accuracy: 98.08% -> 98.08%     
client [56] (testset)   loss: 0.0026 -> 0.0012  accuracy: 100.00% -> 100.00%   
client [5]  (testset)   loss: 0.0355 -> 0.0242  accuracy: 98.77% -> 99.38%     
client [52] (testset)   loss: 0.0002 -> 0.0001  accuracy: 100.00% -> 100.00%   
---------------------------- TRAINING EPOCH: 210 ----------------------------  
client [67] (testset)   loss: 0.0279 -> 0.0270  accuracy: 99.15% -> 99.15%     
client [54] (testset)   loss: 0.1117 -> 0.1058  accuracy: 98.31% -> 98.31%     
client [14] (testset)   loss: 0.3010 -> 0.2838  accuracy: 95.18% -> 95.18%     
client [99] (testset)   loss: 0.0227 -> 0.0176  accuracy: 98.88% -> 99.44%     
client [36] (testset)   loss: 0.0042 -> 0.0027  accuracy: 100.00% -> 100.00%   
client [30] (testset)   loss: 0.0716 -> 0.0677  accuracy: 98.67% -> 98.67%     
client [38] (testset)   loss: 0.0321 -> 0.0351  accuracy: 99.51% -> 99.51%     
client [15] (testset)   loss: 0.0789 -> 0.0662  accuracy: 98.52% -> 98.52%     
client [6]  (testset)   loss: 0.1472 -> 0.1665  accuracy: 97.95% -> 97.95%     
client [53] (testset)   loss: 0.0347 -> 0.0318  accuracy: 98.21% -> 98.21%     
---------------------------- TRAINING EPOCH: 220 ----------------------------  
client [99] (testset)   loss: 0.0123 -> 0.0094  accuracy: 99.44% -> 100.00%    
client [6]  (testset)   loss: 0.1602 -> 0.1990  accuracy: 97.95% -> 97.95%     
client [83] (testset)   loss: 0.0692 -> 0.0793  accuracy: 97.61% -> 97.61%     
client [42] (testset)   loss: 0.0335 -> 0.0248  accuracy: 99.12% -> 99.12%     
client [34] (testset)   loss: 0.0283 -> 0.0165  accuracy: 99.32% -> 99.32%     
client [15] (testset)   loss: 0.0766 -> 0.0679  accuracy: 98.52% -> 98.52%     
client [47] (testset)   loss: 0.0136 -> 0.0109  accuracy: 99.19% -> 99.60%     
client [55] (testset)   loss: 0.0248 -> 0.0328  accuracy: 98.99% -> 98.99%     
client [51] (testset)   loss: 0.0577 -> 0.0716  accuracy: 98.60% -> 98.60%     
client [95] (testset)   loss: 0.0360 -> 0.0345  accuracy: 99.02% -> 99.02%     
---------------------------- TRAINING EPOCH: 230 ----------------------------  
client [71] (testset)   loss: 0.1018 -> 0.1020  accuracy: 98.43% -> 98.43%     
client [15] (testset)   loss: 0.0667 -> 0.0617  accuracy: 98.52% -> 98.52%     
client [33] (testset)   loss: 0.0176 -> 0.0204  accuracy: 99.29% -> 99.29%     
client [99] (testset)   loss: 0.0227 -> 0.0217  accuracy: 99.44% -> 99.44%     
client [90] (testset)   loss: 0.0550 -> 0.0557  accuracy: 99.29% -> 99.29%     
client [57] (testset)   loss: 0.1364 -> 0.1371  accuracy: 97.70% -> 98.16%     
client [27] (testset)   loss: 0.0310 -> 0.0348  accuracy: 98.82% -> 98.82%     
client [78] (testset)   loss: 0.1258 -> 0.1157  accuracy: 96.36% -> 96.36%     
client [36] (testset)   loss: 0.0025 -> 0.0028  accuracy: 100.00% -> 100.00%   
client [88] (testset)   loss: 0.0334 -> 0.0362  accuracy: 98.62% -> 98.96%     
---------------------------- TRAINING EPOCH: 240 ----------------------------  
client [70] (testset)   loss: 0.0090 -> 0.0079  accuracy: 99.58% -> 99.58%     
client [35] (testset)   loss: 0.0059 -> 0.0056  accuracy: 99.40% -> 99.40%     
client [16] (testset)   loss: 0.0680 -> 0.0654  accuracy: 99.09% -> 99.09%     
client [80] (testset)   loss: 0.0454 -> 0.0403  accuracy: 98.87% -> 98.49%     
client [38] (testset)   loss: 0.0218 -> 0.0279  accuracy: 99.51% -> 99.51%     
client [78] (testset)   loss: 0.1449 -> 0.1380  accuracy: 96.36% -> 96.36%     
client [68] (testset)   loss: 0.0011 -> 0.0002  accuracy: 100.00% -> 100.00%   
client [11] (testset)   loss: 0.0470 -> 0.0306  accuracy: 98.97% -> 99.48%     
client [64] (testset)   loss: 0.0304 -> 0.0025  accuracy: 98.76% -> 100.00%    
client [82] (testset)   loss: 0.0444 -> 0.0430  accuracy: 98.97% -> 98.97%     
---------------------------- TRAINING EPOCH: 250 ----------------------------  
client [30] (testset)   loss: 0.0690 -> 0.0680  accuracy: 98.67% -> 98.67%     
client [27] (testset)   loss: 0.0306 -> 0.0412  accuracy: 98.82% -> 98.82%     
client [74] (testset)   loss: 0.0264 -> 0.0232  accuracy: 99.38% -> 99.38%     
client [45] (testset)   loss: 0.0293 -> 0.0384  accuracy: 99.23% -> 99.23%     
client [6]  (testset)   loss: 0.1650 -> 0.2233  accuracy: 97.95% -> 97.95%     
client [36] (testset)   loss: 0.0020 -> 0.0021  accuracy: 100.00% -> 100.00%   
client [63] (testset)   loss: 0.0035 -> 0.0095  accuracy: 100.00% -> 99.35%    
client [76] (testset)   loss: 0.0000 -> 0.0000  accuracy: 100.00% -> 100.00%   
client [83] (testset)   loss: 0.1111 -> 0.1189  accuracy: 97.13% -> 97.13%     
client [86] (testset)   loss: 0.0103 -> 0.0086  accuracy: 99.25% -> 99.25%     
---------------------------- TRAINING EPOCH: 260 ----------------------------  
client [83] (testset)   loss: 0.1012 -> 0.1032  accuracy: 97.61% -> 97.61%     
client [99] (testset)   loss: 0.0160 -> 0.0136  accuracy: 99.44% -> 99.44%     
client [74] (testset)   loss: 0.0196 -> 0.0172  accuracy: 99.38% -> 99.38%     
client [73] (testset)   loss: 0.1907 -> 0.2017  accuracy: 98.33% -> 97.92%     
client [29] (testset)   loss: 0.0221 -> 0.0266  accuracy: 99.13% -> 99.13%     
client [92] (testset)   loss: 0.1450 -> 0.1403  accuracy: 98.08% -> 98.08%     
client [6]  (testset)   loss: 0.2109 -> 0.1978  accuracy: 97.95% -> 97.95%     
client [61] (testset)   loss: 0.0566 -> 0.0532  accuracy: 98.89% -> 98.89%     
client [21] (testset)   loss: 0.0661 -> 0.0631  accuracy: 99.12% -> 99.12%     
client [67] (testset)   loss: 0.0377 -> 0.0199  accuracy: 99.15% -> 99.15%     
---------------------------- TRAINING EPOCH: 270 ----------------------------  
client [83] (testset)   loss: 0.0985 -> 0.1208  accuracy: 97.61% -> 96.65%     
client [32] (testset)   loss: 0.0024 -> 0.0020  accuracy: 100.00% -> 100.00%   
client [95] (testset)   loss: 0.0527 -> 0.0481  accuracy: 99.02% -> 99.02%     
client [61] (testset)   loss: 0.0746 -> 0.0647  accuracy: 98.89% -> 98.89%     
client [27] (testset)   loss: 0.0238 -> 0.0308  accuracy: 98.82% -> 98.82%     
client [25] (testset)   loss: 0.0957 -> 0.0928  accuracy: 98.58% -> 98.58%     
client [68] (testset)   loss: 0.0013 -> 0.0005  accuracy: 100.00% -> 100.00%   
client [34] (testset)   loss: 0.0139 -> 0.0171  accuracy: 99.32% -> 99.32%     
client [71] (testset)   loss: 0.1405 -> 0.1291  accuracy: 97.38% -> 98.43%     
client [89] (testset)   loss: 0.1740 -> 0.1527  accuracy: 98.23% -> 98.23%     
---------------------------- TRAINING EPOCH: 280 ----------------------------  
client [78] (testset)   loss: 0.1441 -> 0.1385  accuracy: 96.36% -> 96.36%     
client [81] (testset)   loss: 0.1572 -> 0.1582  accuracy: 97.27% -> 97.27%     
client [51] (testset)   loss: 0.0374 -> 0.0338  accuracy: 97.66% -> 98.60%     
client [54] (testset)   loss: 0.1385 -> 0.1234  accuracy: 97.75% -> 98.31%     
client [65] (testset)   loss: 0.0814 -> 0.0150  accuracy: 97.65% -> 99.41%     
client [41] (testset)   loss: 0.0188 -> 0.0224  accuracy: 99.40% -> 99.40%     
client [11] (testset)   loss: 0.0219 -> 0.0198  accuracy: 98.97% -> 98.97%     
client [85] (testset)   loss: 0.0038 -> 0.0038  accuracy: 100.00% -> 100.00%   
client [12] (testset)   loss: 0.0113 -> 0.0179  accuracy: 99.47% -> 98.94%     
client [23] (testset)   loss: 0.0983 -> 0.0959  accuracy: 98.92% -> 98.92%     
---------------------------- TRAINING EPOCH: 290 ----------------------------  
client [16] (testset)   loss: 0.0933 -> 0.0805  accuracy: 98.17% -> 98.17%     
client [65] (testset)   loss: 0.0121 -> 0.0120  accuracy: 100.00% -> 100.00%   
client [53] (testset)   loss: 0.0167 -> 0.0197  accuracy: 99.11% -> 99.11%     
client [58] (testset)   loss: 0.0173 -> 0.0183  accuracy: 99.49% -> 99.49%     
client [72] (testset)   loss: 0.0002 -> 0.0001  accuracy: 100.00% -> 100.00%   
client [7]  (testset)   loss: 0.0515 -> 0.0443  accuracy: 98.81% -> 98.81%     
client [71] (testset)   loss: 0.1027 -> 0.1033  accuracy: 98.43% -> 98.43%     
client [59] (testset)   loss: 0.0064 -> 0.0062  accuracy: 99.48% -> 99.48%     
client [86] (testset)   loss: 0.0043 -> 0.0040  accuracy: 100.00% -> 100.00%   
client [39] (testset)   loss: 0.0032 -> 0.0030  accuracy: 100.00% -> 100.00%   
---------------------------- TRAINING EPOCH: 300 ----------------------------  
client [99] (testset)   loss: 0.0180 -> 0.0132  accuracy: 99.44% -> 99.44%     
client [7]  (testset)   loss: 0.0393 -> 0.0404  accuracy: 98.81% -> 98.81%     
client [17] (testset)   loss: 0.0415 -> 0.0389  accuracy: 99.13% -> 99.13%     
client [64] (testset)   loss: 0.0050 -> 0.0033  accuracy: 99.59% -> 100.00%    
client [37] (testset)   loss: 0.0742 -> 0.0741  accuracy: 98.28% -> 98.28%     
client [29] (testset)   loss: 0.0194 -> 0.0158  accuracy: 99.13% -> 99.13%     
client [93] (testset)   loss: 0.0358 -> 0.0322  accuracy: 99.21% -> 99.21%     
client [73] (testset)   loss: 0.2072 -> 0.2080  accuracy: 98.75% -> 98.75%     
client [40] (testset)   loss: 0.0311 -> 0.0138  accuracy: 99.20% -> 99.20%     
client [76] (testset)   loss: 0.0000 -> 0.0000  accuracy: 100.00% -> 100.00%   
---------------------------- TRAINING EPOCH: 310 ----------------------------  
client [31] (testset)   loss: 0.0318 -> 0.0321  accuracy: 98.21% -> 98.21%     
client [89] (testset)   loss: 0.1710 -> 0.1613  accuracy: 98.23% -> 98.23%     
client [77] (testset)   loss: 0.0614 -> 0.0531  accuracy: 99.20% -> 99.20%     
client [90] (testset)   loss: 0.0427 -> 0.0429  accuracy: 99.29% -> 99.29%     
client [26] (testset)   loss: 0.0280 -> 0.0265  accuracy: 98.73% -> 99.58%     
client [50] (testset)   loss: 0.0828 -> 0.0628  accuracy: 98.24% -> 98.59%     
client [30] (testset)   loss: 0.0747 -> 0.0720  accuracy: 98.67% -> 98.67%     
client [70] (testset)   loss: 0.0033 -> 0.0035  accuracy: 100.00% -> 100.00%   
client [41] (testset)   loss: 0.0236 -> 0.0256  accuracy: 99.40% -> 99.40%     
client [99] (testset)   loss: 0.0196 -> 0.0176  accuracy: 99.44% -> 99.44%     
---------------------------- TRAINING EPOCH: 320 ----------------------------  
client [68] (testset)   loss: 0.0020 -> 0.0014  accuracy: 100.00% -> 100.00%   
client [70] (testset)   loss: 0.0058 -> 0.0056  accuracy: 99.58% -> 99.58%     
client [52] (testset)   loss: 0.0000 -> 0.0000  accuracy: 100.00% -> 100.00%   
client [1]  (testset)   loss: 0.0812 -> 0.0811  accuracy: 99.02% -> 99.02%     
client [2]  (testset)   loss: 0.0403 -> 0.0385  accuracy: 99.21% -> 99.21%     
client [67] (testset)   loss: 0.0281 -> 0.0236  accuracy: 98.29% -> 99.15%     
client [92] (testset)   loss: 0.1697 -> 0.1712  accuracy: 97.60% -> 97.60%     
client [35] (testset)   loss: 0.0089 -> 0.0082  accuracy: 99.40% -> 99.40%     
client [36] (testset)   loss: 0.0006 -> 0.0006  accuracy: 100.00% -> 100.00%   
client [64] (testset)   loss: 0.0068 -> 0.0058  accuracy: 99.59% -> 99.59%     
---------------------------- TRAINING EPOCH: 330 ----------------------------  
client [44] (testset)   loss: 0.3518 -> 0.3493  accuracy: 99.40% -> 99.40%     
client [6]  (testset)   loss: 0.2117 -> 0.2101  accuracy: 97.95% -> 97.95%     
client [12] (testset)   loss: 0.0074 -> 0.0075  accuracy: 99.47% -> 99.47%     
client [55] (testset)   loss: 0.0360 -> 0.0313  accuracy: 98.99% -> 98.99%     
client [29] (testset)   loss: 0.0454 -> 0.0405  accuracy: 99.13% -> 99.13%     
client [9]  (testset)   loss: 0.0511 -> 0.0453  accuracy: 97.20% -> 98.13%     
client [43] (testset)   loss: 0.0565 -> 0.0372  accuracy: 97.30% -> 97.30%     
client [77] (testset)   loss: 0.0565 -> 0.0477  accuracy: 99.20% -> 99.20%     
client [98] (testset)   loss: 0.0002 -> 0.0002  accuracy: 100.00% -> 100.00%   
client [78] (testset)   loss: 0.1591 -> 0.1531  accuracy: 96.36% -> 96.36%     
---------------------------- TRAINING EPOCH: 340 ----------------------------  
client [92] (testset)   loss: 0.1535 -> 0.1524  accuracy: 97.60% -> 98.08%     
client [80] (testset)   loss: 0.0501 -> 0.0464  accuracy: 98.49% -> 98.49%     
client [63] (testset)   loss: 0.0078 -> 0.0053  accuracy: 99.35% -> 99.35%     
client [76] (testset)   loss: 0.0000 -> 0.0000  accuracy: 100.00% -> 100.00%   
client [78] (testset)   loss: 0.1466 -> 0.1431  accuracy: 96.97% -> 96.97%     
client [25] (testset)   loss: 0.1039 -> 0.0975  accuracy: 98.58% -> 98.58%     
client [58] (testset)   loss: 0.0082 -> 0.0099  accuracy: 99.49% -> 99.49%     
client [13] (testset)   loss: 0.1243 -> 0.1300  accuracy: 96.00% -> 96.00%     
client [17] (testset)   loss: 0.0444 -> 0.0425  accuracy: 99.13% -> 99.13%     
client [38] (testset)   loss: 0.0180 -> 0.0204  accuracy: 99.51% -> 99.51%     
---------------------------- TRAINING EPOCH: 350 ----------------------------  
client [72] (testset)   loss: 0.0011 -> 0.0009  accuracy: 100.00% -> 100.00%   
client [82] (testset)   loss: 0.0220 -> 0.0220  accuracy: 98.97% -> 98.97%     
client [86] (testset)   loss: 0.0016 -> 0.0015  accuracy: 100.00% -> 100.00%   
client [51] (testset)   loss: 0.0358 -> 0.0329  accuracy: 98.60% -> 99.07%     
client [96] (testset)   loss: 0.0959 -> 0.0876  accuracy: 98.56% -> 98.56%     
client [42] (testset)   loss: 0.0336 -> 0.0338  accuracy: 99.12% -> 99.12%     
client [55] (testset)   loss: 0.0264 -> 0.0268  accuracy: 98.99% -> 98.99%     
client [13] (testset)   loss: 0.1934 -> 0.1937  accuracy: 96.00% -> 96.00%     
client [1]  (testset)   loss: 0.0806 -> 0.0771  accuracy: 99.02% -> 99.02%     
client [12] (testset)   loss: 0.0073 -> 0.0094  accuracy: 99.47% -> 99.47%     
---------------------------- TRAINING EPOCH: 360 ----------------------------  
client [68] (testset)   loss: 0.0024 -> 0.0018  accuracy: 100.00% -> 100.00%   
client [23] (testset)   loss: 0.1087 -> 0.0959  accuracy: 98.92% -> 98.92%     
client [46] (testset)   loss: 0.0031 -> 0.0048  accuracy: 100.00% -> 100.00%   
client [41] (testset)   loss: 0.0148 -> 0.0167  accuracy: 99.40% -> 99.40%     
client [25] (testset)   loss: 0.1002 -> 0.0976  accuracy: 98.58% -> 98.58%     
client [58] (testset)   loss: 0.0031 -> 0.0034  accuracy: 100.00% -> 100.00%   
client [14] (testset)   loss: 0.3213 -> 0.3190  accuracy: 95.18% -> 95.18%     
client [33] (testset)   loss: 0.0148 -> 0.0204  accuracy: 99.29% -> 99.29%     
client [85] (testset)   loss: 0.0030 -> 0.0028  accuracy: 100.00% -> 100.00%   
client [62] (testset)   loss: 0.0628 -> 0.0632  accuracy: 98.92% -> 99.46%     
---------------------------- TRAINING EPOCH: 370 ----------------------------  
client [98] (testset)   loss: 0.0002 -> 0.0002  accuracy: 100.00% -> 100.00%   
client [63] (testset)   loss: 0.0011 -> 0.0029  accuracy: 100.00% -> 100.00%   
client [70] (testset)   loss: 0.0152 -> 0.0122  accuracy: 99.58% -> 99.58%     
client [65] (testset)   loss: 0.0141 -> 0.0127  accuracy: 99.41% -> 99.41%     
client [14] (testset)   loss: 0.3209 -> 0.3200  accuracy: 95.18% -> 95.18%     
client [73] (testset)   loss: 0.2111 -> 0.2147  accuracy: 98.75% -> 98.75%     
client [34] (testset)   loss: 0.0092 -> 0.0082  accuracy: 99.32% -> 99.32%     
client [99] (testset)   loss: 0.0069 -> 0.0055  accuracy: 99.44% -> 100.00%    
client [69] (testset)   loss: 0.0020 -> 0.0014  accuracy: 100.00% -> 100.00%   
client [46] (testset)   loss: 0.0098 -> 0.0096  accuracy: 99.25% -> 99.25%     
---------------------------- TRAINING EPOCH: 380 ----------------------------  
client [99] (testset)   loss: 0.0202 -> 0.0189  accuracy: 99.44% -> 99.44%     
client [93] (testset)   loss: 0.0325 -> 0.0266  accuracy: 98.81% -> 98.81%     
client [11] (testset)   loss: 0.0341 -> 0.0341  accuracy: 98.97% -> 98.97%     
client [58] (testset)   loss: 0.0080 -> 0.0085  accuracy: 99.49% -> 99.49%     
client [81] (testset)   loss: 0.1858 -> 0.1851  accuracy: 98.18% -> 98.18%     
client [85] (testset)   loss: 0.0014 -> 0.0013  accuracy: 100.00% -> 100.00%   
client [89] (testset)   loss: 0.1552 -> 0.1558  accuracy: 98.23% -> 98.23%     
client [45] (testset)   loss: 0.0323 -> 0.0344  accuracy: 99.62% -> 99.23%     
client [8]  (testset)   loss: 0.0661 -> 0.0672  accuracy: 98.78% -> 98.78%     
client [68] (testset)   loss: 0.0036 -> 0.0023  accuracy: 100.00% -> 100.00%   
---------------------------- TRAINING EPOCH: 390 ----------------------------  
client [67] (testset)   loss: 0.0347 -> 0.0312  accuracy: 99.15% -> 99.15%     
client [72] (testset)   loss: 0.0005 -> 0.0002  accuracy: 100.00% -> 100.00%   
client [1]  (testset)   loss: 0.0881 -> 0.0877  accuracy: 99.02% -> 99.02%     
client [78] (testset)   loss: 0.1591 -> 0.1501  accuracy: 96.36% -> 96.36%     
client [83] (testset)   loss: 0.1065 -> 0.1082  accuracy: 97.13% -> 97.61%     
client [21] (testset)   loss: 0.0526 -> 0.0505  accuracy: 99.12% -> 99.12%     
client [56] (testset)   loss: 0.0022 -> 0.0021  accuracy: 100.00% -> 100.00%   
client [44] (testset)   loss: 0.3676 -> 0.3652  accuracy: 99.40% -> 99.40%     
client [92] (testset)   loss: 0.1595 -> 0.1592  accuracy: 98.08% -> 98.08%     
client [27] (testset)   loss: 0.0289 -> 0.0340  accuracy: 98.82% -> 98.82%     
---------------------------- TRAINING EPOCH: 400 ----------------------------  
client [10] (testset)   loss: 0.1189 -> 0.1185  accuracy: 98.68% -> 98.68%     
client [39] (testset)   loss: 0.0001 -> 0.0002  accuracy: 100.00% -> 100.00%   
client [65] (testset)   loss: 0.0274 -> 0.0233  accuracy: 98.82% -> 98.82%     
client [26] (testset)   loss: 0.0257 -> 0.0240  accuracy: 99.58% -> 99.58%     
client [19] (testset)   loss: 0.0057 -> 0.0051  accuracy: 100.00% -> 100.00%   
client [68] (testset)   loss: 0.0006 -> 0.0006  accuracy: 100.00% -> 100.00%   
client [41] (testset)   loss: 0.0192 -> 0.0216  accuracy: 99.40% -> 99.40%     
client [50] (testset)   loss: 0.0789 -> 0.0747  accuracy: 97.89% -> 98.24%     
client [75] (testset)   loss: 0.0158 -> 0.0153  accuracy: 99.47% -> 99.47%     
client [81] (testset)   loss: 0.1964 -> 0.1953  accuracy: 97.27% -> 97.27%     
Training... ---------------------------------------- 100% 0:12:17
SFL's average time taken by each global epoch: 0 min 1.83 sec.                 
SFL's total running time: 0 h 12 m 17 s.                                       
==================== SFL Experiment Results: ====================              
Display format: (before local fine-tuning) -> (after local fine-tuning)        
 So if finetune_epoch = 0, x.xx% -> 0.00% is normal.                           
 Centralized testing ONLY happens after model aggregation, so the stats between
'->' are the same.                                                             
{                                                                              
    "100": {                                                                   
        "all_clients": {                                                       
            "test": {                                                          
                "loss": "0.0483 -> 0.0000",                                    
                "accuracy": "98.89% -> 0.00%"                                  
            }                                                                  
        }                                                                      
    },                                                                         
    "200": {                                                                   
        "all_clients": {                                                       
            "test": {                                                          
                "loss": "0.0559 -> 0.0000",                                    
                "accuracy": "98.84% -> 0.00%"                                  
            }                                                                  
        }                                                                      
    },                                                                         
    "300": {                                                                   
        "all_clients": {                                                       
            "test": {                                                          
                "loss": "0.0549 -> 0.0000",                                    
                "accuracy": "98.99% -> 0.00%"                                  
            }                                                                  
        }                                                                      
    },                                                                         
    "400": {                                                                   
        "all_clients": {                                                       
            "test": {                                                          
                "loss": "0.0582 -> 0.0000",                                    
                "accuracy": "98.97% -> 0.00%"                                  
            }                                                                  
        }                                                                      
    }                                                                          
}                                                                              
==================== SFL Max Accuracy ====================                     
all_clients:                                                                   
(test) before fine-tuning: 98.99% at epoch 300                                 
(test) after fine-tuning: 0.00% at epoch 100                                   
[0m