==================== SFL ====================                                  
Experiment Arguments:                                                          
{
│   'method': 'sfl',
│   'dataset': {
│   │   'name': 'svhn',
│   │   'client_num': 100,
│   │   'test_ratio': 0.25,
│   │   'val_ratio': 0.0,
│   │   'seed': 42,
│   │   'split': 'sample',
│   │   'IID_ratio': 0.0,
│   │   'monitor_window_name_suffix': 'svhn-100clients-0%IID-Dir(1.0)-seed42',
│   │   'alpha': 1.0,
│   │   'min_samples_per_client': 10
│   },
│   'model': {
│   │   'name': 'avgcnn',
│   │   'use_torchvision_pretrained_weights': True,
│   │   'external_model_weights_path': None
│   },
│   'optimizer': {
│   │   'lr': 0.01,
│   │   'dampening': 0,
│   │   'weight_decay': 0,
│   │   'momentum': 0,
│   │   'nesterov': False,
│   │   'name': 'sgd'
│   },
│   'mode': 'sequential',
│   'parallel': {
│   │   'ray_cluster_addr': None,
│   │   'num_cpus': None,
│   │   'num_gpus': None,
│   │   'num_workers': 2
│   },
│   'common': {
│   │   'seed': 42,
│   │   'join_ratio': 0.1,
│   │   'global_epoch': 400,
│   │   'local_epoch': 5,
│   │   'batch_size': 32,
│   │   'reset_optimizer_on_global_epoch': True,
│   │   'straggler_ratio': 0,
│   │   'straggler_min_local_epoch': 0,
│   │   'buffers': 'global',
│   │   'client_side_evaluation': True,
│   │   'test': {
│   │   │   'client': {
│   │   │   │   'interval': 100,
│   │   │   │   'finetune_epoch': 0,
│   │   │   │   'train': False,
│   │   │   │   'val': False,
│   │   │   │   'test': True
│   │   │   },
│   │   │   'server': {
│   │   │   │   'interval': -1,
│   │   │   │   'train': False,
│   │   │   │   'val': False,
│   │   │   │   'test': False,
│   │   │   │   'model_in_train_mode': False
│   │   │   }
│   │   },
│   │   'verbose_gap': 10,
│   │   'monitor': None,
│   │   'use_cuda': True,
│   │   'save_log': True,
│   │   'save_model': False,
│   │   'save_learning_curve_plot': False,
│   │   'save_metrics': True,
│   │   'delete_useless_run': True
│   }
}
---------------------------- TRAINING EPOCH: 10 ----------------------------   
client [77] (testset)   loss: 0.6225 -> 0.5171  accuracy: 85.92% -> 89.74%     
client [81] (testset)   loss: 0.9129 -> 0.5688  accuracy: 80.71% -> 88.83%     
client [21] (testset)   loss: 0.6872 -> 0.5032  accuracy: 84.11% -> 88.41%     
client [68] (testset)   loss: 0.7872 -> 0.6309  accuracy: 84.68% -> 86.69%     
client [93] (testset)   loss: 0.4065 -> 0.3340  accuracy: 89.60% -> 91.91%     
client [31] (testset)   loss: 0.6588 -> 0.3112  accuracy: 82.67% -> 90.67%     
client [20] (testset)   loss: 1.0798 -> 0.8257  accuracy: 73.63% -> 85.71%     
client [59] (testset)   loss: 0.7958 -> 0.4972  accuracy: 86.16% -> 88.68%     
client [48] (testset)   loss: 0.8532 -> 0.5377  accuracy: 75.81% -> 86.45%     
client [34] (testset)   loss: 0.8763 -> 0.5796  accuracy: 81.73% -> 85.79%     
---------------------------- TRAINING EPOCH: 20 ----------------------------   
client [69] (testset)   loss: 0.5340 -> 0.3955  accuracy: 87.93% -> 89.66%     
client [99] (testset)   loss: 0.7270 -> 0.4400  accuracy: 86.32% -> 91.23%     
client [67] (testset)   loss: 0.3546 -> 0.2278  accuracy: 90.58% -> 92.75%     
client [0]  (testset)   loss: 0.2545 -> 0.2237  accuracy: 94.78% -> 94.35%     
client [76] (testset)   loss: 0.3060 -> 0.2577  accuracy: 93.94% -> 93.18%     
client [41] (testset)   loss: 0.5561 -> 0.4975  accuracy: 90.38% -> 90.79%     
client [62] (testset)   loss: 0.4681 -> 0.3023  accuracy: 90.34% -> 93.28%     
client [2]  (testset)   loss: 0.4454 -> 0.3777  accuracy: 89.64% -> 89.64%     
client [14] (testset)   loss: 0.5989 -> 0.4143  accuracy: 88.75% -> 90.62%     
client [46] (testset)   loss: 0.3548 -> 0.2200  accuracy: 91.60% -> 93.89%     
---------------------------- TRAINING EPOCH: 30 ----------------------------   
client [24] (testset)   loss: 0.3435 -> 0.3545  accuracy: 89.66% -> 89.66%     
client [68] (testset)   loss: 0.7487 -> 0.5194  accuracy: 85.08% -> 88.71%     
client [57] (testset)   loss: 0.5868 -> 0.5159  accuracy: 88.15% -> 88.89%     
client [17] (testset)   loss: 0.6580 -> 0.5848  accuracy: 88.94% -> 90.21%     
client [54] (testset)   loss: 0.6775 -> 0.5564  accuracy: 84.82% -> 87.79%     
client [23] (testset)   loss: 0.8691 -> 0.4700  accuracy: 84.32% -> 92.80%     
client [35] (testset)   loss: 0.8951 -> 0.5430  accuracy: 82.23% -> 89.39%     
client [59] (testset)   loss: 0.8427 -> 0.6014  accuracy: 86.16% -> 89.94%     
client [31] (testset)   loss: 0.5384 -> 0.2278  accuracy: 86.67% -> 92.67%     
client [9]  (testset)   loss: 0.3205 -> 0.2069  accuracy: 93.21% -> 96.07%     
---------------------------- TRAINING EPOCH: 40 ----------------------------   
client [64] (testset)   loss: 0.4194 -> 0.3216  accuracy: 90.54% -> 92.57%     
client [33] (testset)   loss: 0.8693 -> 0.6571  accuracy: 87.50% -> 92.39%     
client [16] (testset)   loss: 0.6032 -> 0.3975  accuracy: 87.94% -> 92.71%     
client [44] (testset)   loss: 0.4585 -> 0.3122  accuracy: 90.22% -> 92.39%     
client [8]  (testset)   loss: 0.5839 -> 0.4565  accuracy: 86.02% -> 88.17%     
client [31] (testset)   loss: 0.5719 -> 0.1977  accuracy: 89.33% -> 95.33%     
client [47] (testset)   loss: 0.4461 -> 0.3114  accuracy: 91.57% -> 93.10%     
client [36] (testset)   loss: 0.6262 -> 0.3237  accuracy: 88.79% -> 94.83%     
client [20] (testset)   loss: 1.1975 -> 0.9870  accuracy: 83.52% -> 87.91%     
client [56] (testset)   loss: 0.6551 -> 0.4606  accuracy: 88.30% -> 91.81%     
---------------------------- TRAINING EPOCH: 50 ----------------------------   
client [4]  (testset)   loss: 0.3197 -> 0.2667  accuracy: 92.86% -> 93.57%     
client [60] (testset)   loss: 0.7828 -> 0.4122  accuracy: 85.78% -> 88.24%     
client [28] (testset)   loss: 0.8370 -> 0.3504  accuracy: 82.52% -> 92.68%     
client [25] (testset)   loss: 1.4750 -> 1.0941  accuracy: 81.08% -> 88.29%     
client [58] (testset)   loss: 0.6919 -> 0.5286  accuracy: 86.05% -> 88.37%     
client [44] (testset)   loss: 0.5074 -> 0.3286  accuracy: 89.40% -> 92.12%     
client [39] (testset)   loss: 0.5923 -> 0.5115  accuracy: 87.02% -> 88.46%     
client [29] (testset)   loss: 0.6088 -> 0.4932  accuracy: 87.18% -> 89.74%     
client [3]  (testset)   loss: 0.7127 -> 0.3078  accuracy: 87.29% -> 93.47%     
client [84] (testset)   loss: 0.4747 -> 0.3431  accuracy: 87.98% -> 91.80%     
---------------------------- TRAINING EPOCH: 60 ----------------------------   
client [21] (testset)   loss: 0.6098 -> 0.4687  accuracy: 89.74% -> 92.38%     
client [84] (testset)   loss: 0.6191 -> 0.4144  accuracy: 90.71% -> 91.80%     
client [10] (testset)   loss: 0.4976 -> 0.4150  accuracy: 90.26% -> 91.28%     
client [36] (testset)   loss: 0.5820 -> 0.3040  accuracy: 91.09% -> 95.40%     
client [65] (testset)   loss: 0.6148 -> 0.4760  accuracy: 88.82% -> 92.65%     
client [81] (testset)   loss: 0.6416 -> 0.4058  accuracy: 85.28% -> 90.86%     
client [79] (testset)   loss: 0.6729 -> 0.4570  accuracy: 88.08% -> 93.22%     
client [42] (testset)   loss: 0.7079 -> 0.4847  accuracy: 88.22% -> 89.49%     
client [11] (testset)   loss: 0.8753 -> 0.5269  accuracy: 86.42% -> 93.06%     
client [96] (testset)   loss: 0.4817 -> 0.3941  accuracy: 89.24% -> 91.14%     
---------------------------- TRAINING EPOCH: 70 ----------------------------   
client [8]  (testset)   loss: 0.7435 -> 0.6831  accuracy: 86.56% -> 87.63%     
client [53] (testset)   loss: 0.7332 -> 0.7206  accuracy: 90.00% -> 89.33%     
client [52] (testset)   loss: 0.5641 -> 0.4530  accuracy: 89.62% -> 91.39%     
client [42] (testset)   loss: 0.5239 -> 0.4564  accuracy: 90.45% -> 90.45%     
client [69] (testset)   loss: 0.5288 -> 0.3818  accuracy: 91.38% -> 92.67%     
client [59] (testset)   loss: 1.2815 -> 1.0358  accuracy: 86.79% -> 88.68%     
client [7]  (testset)   loss: 0.5051 -> 0.4915  accuracy: 91.77% -> 92.59%     
client [26] (testset)   loss: 0.7935 -> 0.5775  accuracy: 88.82% -> 91.69%     
client [49] (testset)   loss: 0.4176 -> 0.2146  accuracy: 90.06% -> 93.17%     
client [98] (testset)   loss: 0.4051 -> 0.3406  accuracy: 90.60% -> 93.16%     
---------------------------- TRAINING EPOCH: 80 ----------------------------   
client [98] (testset)   loss: 0.3919 -> 0.3374  accuracy: 91.88% -> 94.02%     
client [47] (testset)   loss: 0.3767 -> 0.3688  accuracy: 93.10% -> 93.49%     
client [21] (testset)   loss: 0.5946 -> 0.5673  accuracy: 89.74% -> 92.38%     
client [77] (testset)   loss: 0.5897 -> 0.4185  accuracy: 90.03% -> 92.67%     
client [95] (testset)   loss: 0.5888 -> 0.4169  accuracy: 91.62% -> 92.97%     
client [91] (testset)   loss: 0.4416 -> 0.2396  accuracy: 90.17% -> 94.80%     
client [14] (testset)   loss: 0.7266 -> 0.6331  accuracy: 91.25% -> 92.50%     
client [99] (testset)   loss: 0.7449 -> 0.5801  accuracy: 90.88% -> 92.28%     
client [20] (testset)   loss: 1.3378 -> 1.0947  accuracy: 85.71% -> 87.91%     
client [39] (testset)   loss: 0.7047 -> 0.6481  accuracy: 89.90% -> 89.42%     
---------------------------- TRAINING EPOCH: 90 ----------------------------   
client [52] (testset)   loss: 0.6726 -> 0.5311  accuracy: 88.10% -> 90.38%     
client [62] (testset)   loss: 0.5661 -> 0.3393  accuracy: 89.50% -> 94.54%     
client [71] (testset)   loss: 0.3812 -> 0.2359  accuracy: 92.24% -> 93.10%     
client [97] (testset)   loss: 0.6716 -> 0.6606  accuracy: 89.30% -> 91.44%     
client [30] (testset)   loss: 0.6566 -> 0.4583  accuracy: 91.18% -> 94.49%     
client [88] (testset)   loss: 0.9324 -> 0.8098  accuracy: 89.60% -> 90.59%     
client [60] (testset)   loss: 0.8075 -> 0.5077  accuracy: 85.78% -> 88.73%     
client [82] (testset)   loss: 0.8153 -> 0.7073  accuracy: 86.81% -> 91.67%     
client [91] (testset)   loss: 0.3432 -> 0.2419  accuracy: 88.44% -> 95.95%     
client [57] (testset)   loss: 0.4490 -> 0.4200  accuracy: 91.85% -> 92.59%     
---------------------------- TRAINING EPOCH: 100 ----------------------------  
client [31] (testset)   loss: 0.4627 -> 0.3048  accuracy: 91.33% -> 94.00%     
client [15] (testset)   loss: 0.7113 -> 0.6049  accuracy: 89.10% -> 91.00%     
client [71] (testset)   loss: 0.5531 -> 0.3494  accuracy: 90.95% -> 93.97%     
client [97] (testset)   loss: 0.7430 -> 0.7201  accuracy: 91.98% -> 91.98%     
client [53] (testset)   loss: 0.9906 -> 0.9956  accuracy: 88.67% -> 90.67%     
client [77] (testset)   loss: 0.8370 -> 0.5671  accuracy: 87.68% -> 90.62%     
client [76] (testset)   loss: 0.3989 -> 0.3910  accuracy: 96.21% -> 96.21%     
client [79] (testset)   loss: 0.6721 -> 0.5865  accuracy: 91.82% -> 92.52%     
client [28] (testset)   loss: 0.7319 -> 0.5985  accuracy: 89.84% -> 90.65%     
client [99] (testset)   loss: 0.5944 -> 0.5829  accuracy: 91.58% -> 93.68%     
---------------------------- TRAINING EPOCH: 110 ----------------------------  
client [97] (testset)   loss: 0.8686 -> 0.7051  accuracy: 90.91% -> 91.98%     
client [86] (testset)   loss: 0.7960 -> 0.6734  accuracy: 91.19% -> 92.95%     
client [34] (testset)   loss: 0.7264 -> 0.6064  accuracy: 87.82% -> 87.31%     
client [73] (testset)   loss: 0.5779 -> 0.5836  accuracy: 91.10% -> 91.10%     
client [5]  (testset)   loss: 0.8479 -> 0.6947  accuracy: 88.18% -> 90.64%     
client [96] (testset)   loss: 0.4430 -> 0.3984  accuracy: 90.51% -> 91.77%     
client [22] (testset)   loss: 0.7779 -> 0.7448  accuracy: 90.15% -> 91.69%     
client [60] (testset)   loss: 0.8643 -> 0.7176  accuracy: 87.75% -> 87.25%     
client [66] (testset)   loss: 0.5509 -> 0.5276  accuracy: 92.66% -> 93.12%     
client [83] (testset)   loss: 0.6767 -> 0.5971  accuracy: 88.04% -> 91.30%     
---------------------------- TRAINING EPOCH: 120 ----------------------------  
client [76] (testset)   loss: 0.3534 -> 0.3425  accuracy: 95.45% -> 96.21%     
client [65] (testset)   loss: 0.5860 -> 0.4915  accuracy: 89.41% -> 92.35%     
client [95] (testset)   loss: 0.5659 -> 0.4964  accuracy: 91.35% -> 92.43%     
client [17] (testset)   loss: 1.0115 -> 0.9647  accuracy: 91.06% -> 91.06%     
client [8]  (testset)   loss: 0.8417 -> 0.7540  accuracy: 87.10% -> 89.25%     
client [35] (testset)   loss: 0.6040 -> 0.5444  accuracy: 88.86% -> 90.45%     
client [98] (testset)   loss: 0.4899 -> 0.4059  accuracy: 91.45% -> 93.16%     
client [53] (testset)   loss: 1.1071 -> 1.0828  accuracy: 87.33% -> 88.00%     
client [43] (testset)   loss: 1.6983 -> 1.6005  accuracy: 86.54% -> 88.46%     
client [64] (testset)   loss: 0.3934 -> 0.3501  accuracy: 93.92% -> 93.24%     
---------------------------- TRAINING EPOCH: 130 ----------------------------  
client [21] (testset)   loss: 0.7360 -> 0.6246  accuracy: 89.74% -> 91.39%     
client [88] (testset)   loss: 1.2554 -> 0.9470  accuracy: 87.62% -> 91.58%     
client [38] (testset)   loss: 0.6033 -> 0.5857  accuracy: 91.24% -> 91.61%     
client [3]  (testset)   loss: 0.8413 -> 0.6436  accuracy: 88.66% -> 91.07%     
client [5]  (testset)   loss: 1.0066 -> 0.8105  accuracy: 85.71% -> 90.64%     
client [41] (testset)   loss: 0.5690 -> 0.6395  accuracy: 90.79% -> 92.05%     
client [7]  (testset)   loss: 0.6404 -> 0.5708  accuracy: 93.42% -> 93.42%     
client [37] (testset)   loss: 1.0436 -> 1.0754  accuracy: 89.66% -> 89.66%     
client [45] (testset)   loss: 0.8631 -> 0.7890  accuracy: 90.11% -> 89.73%     
client [47] (testset)   loss: 0.5480 -> 0.3488  accuracy: 92.34% -> 94.25%     
---------------------------- TRAINING EPOCH: 140 ----------------------------  
client [16] (testset)   loss: 0.7431 -> 0.5849  accuracy: 90.95% -> 92.96%     
client [11] (testset)   loss: 0.6193 -> 0.5181  accuracy: 91.33% -> 91.33%     
client [37] (testset)   loss: 0.9732 -> 0.8753  accuracy: 89.16% -> 89.66%     
client [41] (testset)   loss: 0.6229 -> 0.6007  accuracy: 93.72% -> 94.14%     
client [95] (testset)   loss: 0.5254 -> 0.4686  accuracy: 93.51% -> 94.05%     
client [53] (testset)   loss: 0.9630 -> 1.0222  accuracy: 89.33% -> 90.67%     
client [22] (testset)   loss: 0.9855 -> 0.8677  accuracy: 90.46% -> 89.85%     
client [25] (testset)   loss: 1.4877 -> 1.4112  accuracy: 89.19% -> 90.54%     
client [69] (testset)   loss: 0.7775 -> 0.5912  accuracy: 89.66% -> 93.10%     
client [46] (testset)   loss: 0.4401 -> 0.2863  accuracy: 91.60% -> 93.51%     
---------------------------- TRAINING EPOCH: 150 ----------------------------  
client [47] (testset)   loss: 0.4288 -> 0.4004  accuracy: 92.34% -> 92.72%     
client [69] (testset)   loss: 0.8269 -> 0.6252  accuracy: 90.52% -> 93.10%     
client [82] (testset)   loss: 1.1128 -> 0.8520  accuracy: 86.81% -> 90.28%     
client [45] (testset)   loss: 0.7476 -> 0.7400  accuracy: 90.49% -> 90.87%     
client [7]  (testset)   loss: 0.6445 -> 0.6703  accuracy: 91.77% -> 92.59%     
client [50] (testset)   loss: 0.8174 -> 0.6902  accuracy: 88.84% -> 89.67%     
client [35] (testset)   loss: 0.4841 -> 0.4543  accuracy: 90.98% -> 92.31%     
client [24] (testset)   loss: 0.4550 -> 0.4562  accuracy: 87.93% -> 87.93%     
client [15] (testset)   loss: 0.8315 -> 0.7935  accuracy: 90.52% -> 91.00%     
client [58] (testset)   loss: 0.7393 -> 0.6800  accuracy: 88.37% -> 88.84%     
---------------------------- TRAINING EPOCH: 160 ----------------------------  
client [48] (testset)   loss: 0.8343 -> 0.7800  accuracy: 88.06% -> 89.35%     
client [76] (testset)   loss: 0.3446 -> 0.3470  accuracy: 96.21% -> 96.21%     
client [67] (testset)   loss: 0.3671 -> 0.3091  accuracy: 93.48% -> 92.75%     
client [37] (testset)   loss: 1.0571 -> 1.0349  accuracy: 88.67% -> 90.15%     
client [58] (testset)   loss: 0.6918 -> 0.6642  accuracy: 89.30% -> 89.77%     
client [64] (testset)   loss: 0.4746 -> 0.4287  accuracy: 93.92% -> 95.27%     
client [77] (testset)   loss: 0.9013 -> 0.7317  accuracy: 88.56% -> 89.15%     
client [55] (testset)   loss: 0.5903 -> 0.5289  accuracy: 92.90% -> 94.84%     
client [12] (testset)   loss: 0.2959 -> 0.2307  accuracy: 96.20% -> 97.47%     
client [89] (testset)   loss: 1.0341 -> 0.7408  accuracy: 86.36% -> 90.91%     
---------------------------- TRAINING EPOCH: 170 ----------------------------  
client [84] (testset)   loss: 0.4922 -> 0.4845  accuracy: 93.44% -> 93.99%     
client [51] (testset)   loss: 0.9705 -> 0.7959  accuracy: 86.89% -> 90.29%     
client [8]  (testset)   loss: 0.9881 -> 0.9876  accuracy: 88.71% -> 88.17%     
client [18] (testset)   loss: 1.0311 -> 0.9387  accuracy: 88.24% -> 87.58%     
client [94] (testset)   loss: 0.8255 -> 0.6753  accuracy: 89.53% -> 91.70%     
client [81] (testset)   loss: 0.7531 -> 0.5885  accuracy: 90.86% -> 92.39%     
client [3]  (testset)   loss: 0.6780 -> 0.6498  accuracy: 91.75% -> 92.44%     
client [11] (testset)   loss: 0.9180 -> 0.7926  accuracy: 91.33% -> 92.77%     
client [95] (testset)   loss: 0.6040 -> 0.5557  accuracy: 92.97% -> 93.51%     
client [67] (testset)   loss: 0.2696 -> 0.2425  accuracy: 93.48% -> 95.65%     
---------------------------- TRAINING EPOCH: 180 ----------------------------  
client [21] (testset)   loss: 0.8231 -> 0.7123  accuracy: 91.39% -> 91.06%     
client [79] (testset)   loss: 0.7354 -> 0.6501  accuracy: 93.22% -> 92.99%     
client [58] (testset)   loss: 0.7773 -> 0.7124  accuracy: 89.30% -> 89.30%     
client [88] (testset)   loss: 1.1074 -> 1.0078  accuracy: 90.59% -> 91.58%     
client [46] (testset)   loss: 0.3931 -> 0.3286  accuracy: 93.51% -> 95.42%     
client [11] (testset)   loss: 0.8467 -> 0.7244  accuracy: 90.75% -> 90.75%     
client [55] (testset)   loss: 0.5293 -> 0.4767  accuracy: 93.55% -> 95.81%     
client [13] (testset)   loss: 0.3983 -> 0.3555  accuracy: 93.22% -> 94.43%     
client [31] (testset)   loss: 0.7381 -> 0.4771  accuracy: 91.33% -> 92.00%     
client [75] (testset)   loss: 0.8991 -> 0.7915  accuracy: 90.00% -> 92.14%     
---------------------------- TRAINING EPOCH: 190 ----------------------------  
client [19] (testset)   loss: 0.6360 -> 0.5731  accuracy: 90.48% -> 90.48%     
client [7]  (testset)   loss: 0.7256 -> 0.7337  accuracy: 92.18% -> 91.36%     
client [57] (testset)   loss: 0.6476 -> 0.6036  accuracy: 91.11% -> 91.11%     
client [13] (testset)   loss: 0.5174 -> 0.4253  accuracy: 92.98% -> 94.43%     
client [43] (testset)   loss: 2.0364 -> 1.9374  accuracy: 89.42% -> 88.46%     
client [91] (testset)   loss: 0.4445 -> 0.4195  accuracy: 92.49% -> 93.06%     
client [10] (testset)   loss: 0.7070 -> 0.6956  accuracy: 89.74% -> 91.28%     
client [64] (testset)   loss: 0.5489 -> 0.5296  accuracy: 93.92% -> 93.92%     
client [82] (testset)   loss: 1.0599 -> 1.0276  accuracy: 89.58% -> 90.28%     
client [22] (testset)   loss: 1.1459 -> 1.0737  accuracy: 90.15% -> 91.38%     
---------------------------- TRAINING EPOCH: 200 ----------------------------  
client [20] (testset)   loss: 1.4427 -> 1.3994  accuracy: 89.01% -> 89.01%     
client [23] (testset)   loss: 1.2109 -> 1.0394  accuracy: 88.56% -> 89.83%     
client [88] (testset)   loss: 1.4164 -> 1.2660  accuracy: 88.12% -> 90.59%     
client [98] (testset)   loss: 0.6413 -> 0.6152  accuracy: 91.88% -> 91.88%     
client [79] (testset)   loss: 0.6700 -> 0.6721  accuracy: 93.69% -> 93.46%     
client [21] (testset)   loss: 0.8155 -> 0.7060  accuracy: 90.73% -> 91.72%     
client [92] (testset)   loss: 1.4687 -> 1.4134  accuracy: 89.47% -> 88.42%     
client [56] (testset)   loss: 0.9744 -> 0.9470  accuracy: 90.35% -> 90.94%     
client [5]  (testset)   loss: 1.0466 -> 0.8907  accuracy: 87.68% -> 87.19%     
client [52] (testset)   loss: 0.8787 -> 0.8428  accuracy: 89.11% -> 89.87%     
---------------------------- TRAINING EPOCH: 210 ----------------------------  
client [67] (testset)   loss: 0.2978 -> 0.2929  accuracy: 95.65% -> 95.65%     
client [54] (testset)   loss: 1.0113 -> 0.9561  accuracy: 88.78% -> 89.11%     
client [14] (testset)   loss: 0.7185 -> 0.6923  accuracy: 92.50% -> 92.50%     
client [99] (testset)   loss: 0.9272 -> 0.8922  accuracy: 90.53% -> 91.58%     
client [36] (testset)   loss: 0.6521 -> 0.5689  accuracy: 94.54% -> 94.25%     
client [30] (testset)   loss: 0.6735 -> 0.6317  accuracy: 92.65% -> 93.38%     
client [38] (testset)   loss: 0.6784 -> 0.6227  accuracy: 91.24% -> 91.24%     
client [15] (testset)   loss: 0.8697 -> 0.8471  accuracy: 91.47% -> 92.42%     
client [6]  (testset)   loss: 0.6462 -> 0.6415  accuracy: 95.59% -> 96.26%     
client [53] (testset)   loss: 1.2246 -> 1.2233  accuracy: 91.33% -> 91.33%     
---------------------------- TRAINING EPOCH: 220 ----------------------------  
client [99] (testset)   loss: 1.0524 -> 1.0120  accuracy: 90.88% -> 91.58%     
client [6]  (testset)   loss: 0.7432 -> 0.7742  accuracy: 95.15% -> 95.59%     
client [83] (testset)   loss: 0.8522 -> 0.8252  accuracy: 91.85% -> 91.85%     
client [42] (testset)   loss: 0.9438 -> 0.8278  accuracy: 88.22% -> 90.76%     
client [34] (testset)   loss: 1.0628 -> 1.0651  accuracy: 86.29% -> 85.79%     
client [15] (testset)   loss: 0.8741 -> 0.7533  accuracy: 91.94% -> 92.42%     
client [47] (testset)   loss: 0.5030 -> 0.4779  accuracy: 93.87% -> 94.25%     
client [55] (testset)   loss: 0.6101 -> 0.5958  accuracy: 94.52% -> 94.84%     
client [51] (testset)   loss: 0.8382 -> 0.8022  accuracy: 89.81% -> 89.81%     
client [95] (testset)   loss: 0.7383 -> 0.7297  accuracy: 91.62% -> 91.89%     
---------------------------- TRAINING EPOCH: 230 ----------------------------  
client [71] (testset)   loss: 0.6189 -> 0.3797  accuracy: 92.67% -> 95.69%     
client [15] (testset)   loss: 1.0063 -> 0.9741  accuracy: 91.00% -> 91.00%     
client [33] (testset)   loss: 1.2611 -> 1.2286  accuracy: 92.12% -> 93.21%     
client [99] (testset)   loss: 1.2680 -> 1.0258  accuracy: 88.42% -> 90.18%     
client [90] (testset)   loss: 0.9093 -> 0.7808  accuracy: 90.39% -> 92.88%     
client [57] (testset)   loss: 0.6984 -> 0.6891  accuracy: 88.89% -> 88.89%     
client [27] (testset)   loss: 1.1710 -> 1.1030  accuracy: 90.80% -> 91.72%     
client [78] (testset)   loss: 0.5577 -> 0.5522  accuracy: 94.77% -> 94.21%     
client [36] (testset)   loss: 0.6762 -> 0.5810  accuracy: 93.10% -> 94.54%     
client [88] (testset)   loss: 1.4100 -> 1.2036  accuracy: 87.62% -> 89.60%     
---------------------------- TRAINING EPOCH: 240 ----------------------------  
client [70] (testset)   loss: 1.1985 -> 1.1893  accuracy: 89.20% -> 90.00%     
client [35] (testset)   loss: 0.5764 -> 0.6284  accuracy: 90.72% -> 90.98%     
client [16] (testset)   loss: 0.9972 -> 0.8780  accuracy: 89.95% -> 90.70%     
client [80] (testset)   loss: 0.9614 -> 0.9447  accuracy: 90.91% -> 90.48%     
client [38] (testset)   loss: 0.8314 -> 0.8133  accuracy: 90.88% -> 90.88%     
client [78] (testset)   loss: 0.6125 -> 0.5641  accuracy: 94.49% -> 94.21%     
client [68] (testset)   loss: 1.1718 -> 1.1100  accuracy: 87.90% -> 87.90%     
client [11] (testset)   loss: 0.8395 -> 0.7095  accuracy: 91.62% -> 92.20%     
client [64] (testset)   loss: 0.5571 -> 0.5259  accuracy: 93.92% -> 93.92%     
client [82] (testset)   loss: 1.2547 -> 1.2284  accuracy: 86.81% -> 88.19%     
---------------------------- TRAINING EPOCH: 250 ----------------------------  
client [30] (testset)   loss: 0.7208 -> 0.6760  accuracy: 95.22% -> 94.49%     
client [27] (testset)   loss: 1.0826 -> 1.0667  accuracy: 92.41% -> 92.18%     
client [74] (testset)   loss: 1.0253 -> 1.0116  accuracy: 88.96% -> 88.96%     
client [45] (testset)   loss: 0.9653 -> 0.9187  accuracy: 91.25% -> 90.87%     
client [6]  (testset)   loss: 0.7294 -> 0.7050  accuracy: 94.93% -> 95.37%     
client [36] (testset)   loss: 0.6048 -> 0.5247  accuracy: 93.10% -> 95.69%     
client [63] (testset)   loss: 0.4853 -> 0.4867  accuracy: 92.91% -> 92.91%     
client [76] (testset)   loss: 0.4731 -> 0.4647  accuracy: 95.45% -> 95.45%     
client [83] (testset)   loss: 0.7395 -> 0.7346  accuracy: 91.85% -> 91.85%     
client [86] (testset)   loss: 1.1130 -> 1.0723  accuracy: 93.39% -> 92.95%     
---------------------------- TRAINING EPOCH: 260 ----------------------------  
client [83] (testset)   loss: 0.7501 -> 0.7463  accuracy: 91.30% -> 90.76%     
client [99] (testset)   loss: 1.1575 -> 1.1336  accuracy: 89.82% -> 90.18%     
client [74] (testset)   loss: 1.1026 -> 1.0896  accuracy: 87.01% -> 87.01%     
client [73] (testset)   loss: 0.7328 -> 0.7213  accuracy: 93.56% -> 93.25%     
client [29] (testset)   loss: 0.9705 -> 0.9856  accuracy: 91.35% -> 91.67%     
client [92] (testset)   loss: 1.5835 -> 1.5085  accuracy: 90.53% -> 90.00%     
client [6]  (testset)   loss: 0.7266 -> 0.7054  accuracy: 94.71% -> 94.93%     
client [61] (testset)   loss: 0.6408 -> 0.6198  accuracy: 94.02% -> 95.11%     
client [21] (testset)   loss: 0.8884 -> 0.8182  accuracy: 90.73% -> 91.39%     
client [67] (testset)   loss: 0.4814 -> 0.3312  accuracy: 94.20% -> 96.38%     
---------------------------- TRAINING EPOCH: 270 ----------------------------  
client [83] (testset)   loss: 0.6833 -> 0.6775  accuracy: 90.76% -> 90.76%     
client [32] (testset)   loss: 0.7201 -> 0.6574  accuracy: 90.09% -> 89.19%     
client [95] (testset)   loss: 0.7246 -> 0.7105  accuracy: 93.78% -> 93.78%     
client [61] (testset)   loss: 0.5918 -> 0.5941  accuracy: 94.02% -> 93.48%     
client [27] (testset)   loss: 1.0625 -> 1.0612  accuracy: 92.18% -> 92.18%     
client [25] (testset)   loss: 1.9096 -> 1.8996  accuracy: 90.99% -> 90.99%     
client [68] (testset)   loss: 1.0222 -> 1.0238  accuracy: 88.31% -> 88.31%     
client [34] (testset)   loss: 1.0634 -> 1.0561  accuracy: 88.83% -> 89.34%     
client [71] (testset)   loss: 0.4666 -> 0.4486  accuracy: 94.83% -> 94.83%     
client [89] (testset)   loss: 0.7914 -> 0.7737  accuracy: 89.39% -> 89.90%     
---------------------------- TRAINING EPOCH: 280 ----------------------------  
client [78] (testset)   loss: 0.5567 -> 0.5474  accuracy: 94.49% -> 94.49%     
client [81] (testset)   loss: 0.6097 -> 0.6079  accuracy: 92.39% -> 91.37%     
client [51] (testset)   loss: 0.9497 -> 0.8688  accuracy: 87.86% -> 88.35%     
client [54] (testset)   loss: 1.1254 -> 1.0285  accuracy: 90.43% -> 90.43%     
client [65] (testset)   loss: 0.9989 -> 0.9426  accuracy: 88.82% -> 90.88%     
client [41] (testset)   loss: 0.7401 -> 0.7067  accuracy: 94.14% -> 93.72%     
client [11] (testset)   loss: 0.8517 -> 0.8035  accuracy: 91.33% -> 91.33%     
client [85] (testset)   loss: 0.8764 -> 0.8572  accuracy: 91.95% -> 91.95%     
client [12] (testset)   loss: 0.3400 -> 0.2720  accuracy: 96.20% -> 95.57%     
client [23] (testset)   loss: 1.4468 -> 1.3804  accuracy: 88.14% -> 88.56%     
---------------------------- TRAINING EPOCH: 290 ----------------------------  
client [16] (testset)   loss: 0.8698 -> 0.8722  accuracy: 91.96% -> 92.21%     
client [65] (testset)   loss: 0.9888 -> 0.9686  accuracy: 90.00% -> 90.29%     
client [53] (testset)   loss: 1.3992 -> 1.3971  accuracy: 89.33% -> 89.33%     
client [58] (testset)   loss: 0.7734 -> 0.7685  accuracy: 88.37% -> 88.37%     
client [72] (testset)   loss: 0.4481 -> 0.4341  accuracy: 91.06% -> 91.06%     
client [7]  (testset)   loss: 0.8662 -> 0.8611  accuracy: 92.59% -> 92.59%     
client [71] (testset)   loss: 0.5253 -> 0.5034  accuracy: 95.26% -> 95.26%     
client [59] (testset)   loss: 1.8776 -> 1.8773  accuracy: 88.68% -> 88.68%     
client [86] (testset)   loss: 1.0970 -> 1.0872  accuracy: 93.39% -> 93.39%     
client [39] (testset)   loss: 0.7357 -> 0.7263  accuracy: 89.42% -> 89.90%     
---------------------------- TRAINING EPOCH: 300 ----------------------------  
client [99] (testset)   loss: 1.1695 -> 1.1577  accuracy: 90.88% -> 91.58%     
client [7]  (testset)   loss: 0.8813 -> 0.8704  accuracy: 93.42% -> 93.42%     
client [17] (testset)   loss: 1.4582 -> 1.4497  accuracy: 89.79% -> 89.79%     
client [64] (testset)   loss: 0.5365 -> 0.5334  accuracy: 94.59% -> 94.59%     
client [37] (testset)   loss: 1.2280 -> 1.2271  accuracy: 89.66% -> 89.66%     
client [29] (testset)   loss: 0.9917 -> 0.9899  accuracy: 92.31% -> 92.31%     
client [93] (testset)   loss: 0.6180 -> 0.6029  accuracy: 93.64% -> 93.64%     
client [73] (testset)   loss: 0.8062 -> 0.7980  accuracy: 93.56% -> 93.87%     
client [40] (testset)   loss: 0.9123 -> 0.9030  accuracy: 91.96% -> 91.96%     
client [76] (testset)   loss: 0.5200 -> 0.5194  accuracy: 96.21% -> 96.21%     
---------------------------- TRAINING EPOCH: 310 ----------------------------  
client [31] (testset)   loss: 0.4673 -> 0.4608  accuracy: 92.00% -> 92.00%     
client [89] (testset)   loss: 0.8049 -> 0.8014  accuracy: 90.40% -> 90.40%     
client [77] (testset)   loss: 0.9421 -> 0.9299  accuracy: 90.03% -> 90.03%     
client [90] (testset)   loss: 0.9756 -> 0.9699  accuracy: 92.88% -> 92.88%     
client [26] (testset)   loss: 1.1510 -> 1.1433  accuracy: 92.33% -> 92.33%     
client [50] (testset)   loss: 0.7663 -> 0.7597  accuracy: 88.84% -> 89.67%     
client [30] (testset)   loss: 0.6947 -> 0.6915  accuracy: 94.85% -> 94.85%     
client [70] (testset)   loss: 1.3430 -> 1.3378  accuracy: 90.80% -> 90.80%     
client [41] (testset)   loss: 0.7567 -> 0.7566  accuracy: 93.72% -> 93.72%     
client [99] (testset)   loss: 1.2106 -> 1.2035  accuracy: 91.23% -> 91.23%     
---------------------------- TRAINING EPOCH: 320 ----------------------------  
client [68] (testset)   loss: 1.1078 -> 1.1091  accuracy: 88.31% -> 88.71%     
client [70] (testset)   loss: 1.3845 -> 1.3790  accuracy: 90.80% -> 90.80%     
client [52] (testset)   loss: 1.0292 -> 1.0131  accuracy: 91.65% -> 91.65%     
client [1]  (testset)   loss: 0.8352 -> 0.8356  accuracy: 91.55% -> 91.55%     
client [2]  (testset)   loss: 1.0323 -> 1.0314  accuracy: 91.07% -> 91.43%     
client [67] (testset)   loss: 0.4453 -> 0.4448  accuracy: 94.93% -> 94.93%     
client [92] (testset)   loss: 1.6747 -> 1.6744  accuracy: 91.05% -> 91.05%     
client [35] (testset)   loss: 0.6872 -> 0.6856  accuracy: 91.51% -> 91.51%     
client [36] (testset)   loss: 0.6484 -> 0.6385  accuracy: 94.54% -> 95.11%     
client [64] (testset)   loss: 0.5936 -> 0.5908  accuracy: 94.59% -> 94.59%     
---------------------------- TRAINING EPOCH: 330 ----------------------------  
client [44] (testset)   loss: 0.7067 -> 0.7060  accuracy: 91.58% -> 91.58%     
client [6]  (testset)   loss: 0.8067 -> 0.8040  accuracy: 95.59% -> 95.81%     
client [12] (testset)   loss: 0.2672 -> 0.2657  accuracy: 96.20% -> 96.20%     
client [55] (testset)   loss: 0.6480 -> 0.6435  accuracy: 94.84% -> 94.84%     
client [29] (testset)   loss: 1.0567 -> 1.0535  accuracy: 91.99% -> 91.99%     
client [9]  (testset)   loss: 0.4975 -> 0.4938  accuracy: 96.07% -> 96.07%     
client [43] (testset)   loss: 2.5895 -> 2.5885  accuracy: 87.50% -> 87.50%     
client [77] (testset)   loss: 0.9737 -> 0.9606  accuracy: 89.74% -> 90.32%     
client [98] (testset)   loss: 0.7613 -> 0.7586  accuracy: 93.59% -> 93.59%     
client [78] (testset)   loss: 0.5944 -> 0.5893  accuracy: 93.94% -> 93.94%     
---------------------------- TRAINING EPOCH: 340 ----------------------------  
client [92] (testset)   loss: 1.7828 -> 1.7788  accuracy: 91.05% -> 91.05%     
client [80] (testset)   loss: 1.0614 -> 1.0584  accuracy: 90.04% -> 90.04%     
client [63] (testset)   loss: 0.7636 -> 0.7572  accuracy: 92.13% -> 92.13%     
client [76] (testset)   loss: 0.5558 -> 0.5557  accuracy: 95.45% -> 95.45%     
client [78] (testset)   loss: 0.6030 -> 0.5977  accuracy: 93.94% -> 93.94%     
client [25] (testset)   loss: 2.1609 -> 2.1547  accuracy: 89.64% -> 89.64%     
client [58] (testset)   loss: 0.7860 -> 0.7854  accuracy: 91.16% -> 91.16%     
client [13] (testset)   loss: 0.5954 -> 0.5870  accuracy: 93.95% -> 93.95%     
client [17] (testset)   loss: 1.5375 -> 1.5331  accuracy: 89.79% -> 89.79%     
client [38] (testset)   loss: 0.8089 -> 0.8088  accuracy: 92.34% -> 92.34%     
---------------------------- TRAINING EPOCH: 350 ----------------------------  
client [72] (testset)   loss: 0.4405 -> 0.4357  accuracy: 90.24% -> 90.24%     
client [82] (testset)   loss: 1.3149 -> 1.3114  accuracy: 90.28% -> 90.28%     
client [86] (testset)   loss: 1.3107 -> 1.3066  accuracy: 92.51% -> 92.51%     
client [51] (testset)   loss: 0.9562 -> 0.9476  accuracy: 88.83% -> 88.83%     
client [96] (testset)   loss: 0.9097 -> 0.9080  accuracy: 91.77% -> 91.77%     
client [42] (testset)   loss: 0.9792 -> 0.9651  accuracy: 90.45% -> 90.45%     
client [55] (testset)   loss: 0.6646 -> 0.6616  accuracy: 94.84% -> 94.84%     
client [13] (testset)   loss: 0.6011 -> 0.5932  accuracy: 93.95% -> 93.95%     
client [1]  (testset)   loss: 0.8590 -> 0.8590  accuracy: 91.20% -> 91.20%     
client [12] (testset)   loss: 0.2769 -> 0.2756  accuracy: 96.20% -> 96.20%     
---------------------------- TRAINING EPOCH: 360 ----------------------------  
client [68] (testset)   loss: 1.1553 -> 1.1555  accuracy: 88.31% -> 88.31%     
client [23] (testset)   loss: 1.5064 -> 1.4980  accuracy: 88.98% -> 88.98%     
client [46] (testset)   loss: 0.4515 -> 0.4492  accuracy: 95.04% -> 95.04%     
client [41] (testset)   loss: 0.8018 -> 0.8020  accuracy: 93.72% -> 93.72%     
client [25] (testset)   loss: 2.1739 -> 2.1706  accuracy: 89.64% -> 89.64%     
client [58] (testset)   loss: 0.7941 -> 0.7935  accuracy: 91.16% -> 91.16%     
client [14] (testset)   loss: 0.8128 -> 0.8107  accuracy: 91.25% -> 91.88%     
client [33] (testset)   loss: 1.4791 -> 1.4776  accuracy: 91.58% -> 91.85%     
client [85] (testset)   loss: 0.9572 -> 0.9526  accuracy: 90.80% -> 90.80%     
client [62] (testset)   loss: 0.6798 -> 0.6708  accuracy: 92.86% -> 92.86%     
---------------------------- TRAINING EPOCH: 370 ----------------------------  
client [98] (testset)   loss: 0.7714 -> 0.7703  accuracy: 94.02% -> 94.02%     
client [63] (testset)   loss: 0.7696 -> 0.7646  accuracy: 92.13% -> 92.13%     
client [70] (testset)   loss: 1.4093 -> 1.4065  accuracy: 91.20% -> 91.20%     
client [65] (testset)   loss: 1.1193 -> 1.1091  accuracy: 89.71% -> 90.29%     
client [14] (testset)   loss: 0.8116 -> 0.8096  accuracy: 93.12% -> 93.12%     
client [73] (testset)   loss: 0.8344 -> 0.8334  accuracy: 93.87% -> 93.87%     
client [34] (testset)   loss: 1.2392 -> 1.2366  accuracy: 88.32% -> 88.32%     
client [99] (testset)   loss: 1.2970 -> 1.2923  accuracy: 90.88% -> 91.23%     
client [69] (testset)   loss: 0.9408 -> 0.9378  accuracy: 90.09% -> 90.09%     
client [46] (testset)   loss: 0.4703 -> 0.4667  accuracy: 95.04% -> 95.04%     
---------------------------- TRAINING EPOCH: 380 ----------------------------  
client [99] (testset)   loss: 1.3088 -> 1.3053  accuracy: 91.23% -> 91.23%     
client [93] (testset)   loss: 0.6532 -> 0.6474  accuracy: 93.93% -> 93.93%     
client [11] (testset)   loss: 0.9549 -> 0.9483  accuracy: 91.62% -> 91.62%     
client [58] (testset)   loss: 0.8110 -> 0.8105  accuracy: 91.63% -> 91.63%     
client [81] (testset)   loss: 0.7024 -> 0.7018  accuracy: 91.88% -> 91.88%     
client [85] (testset)   loss: 0.9698 -> 0.9667  accuracy: 90.80% -> 90.80%     
client [89] (testset)   loss: 0.8634 -> 0.8599  accuracy: 89.90% -> 89.90%     
client [45] (testset)   loss: 1.1267 -> 1.1232  accuracy: 91.63% -> 91.63%     
client [8]  (testset)   loss: 1.2862 -> 1.2846  accuracy: 89.25% -> 89.25%     
client [68] (testset)   loss: 1.1597 -> 1.1598  accuracy: 88.31% -> 88.31%     
---------------------------- TRAINING EPOCH: 390 ----------------------------  
client [67] (testset)   loss: 0.5122 -> 0.5114  accuracy: 93.48% -> 93.48%     
client [72] (testset)   loss: 0.4502 -> 0.4458  accuracy: 90.24% -> 90.24%     
client [1]  (testset)   loss: 0.8801 -> 0.8795  accuracy: 91.20% -> 91.20%     
client [78] (testset)   loss: 0.6082 -> 0.6050  accuracy: 93.94% -> 93.94%     
client [83] (testset)   loss: 0.8622 -> 0.8614  accuracy: 89.67% -> 89.13%     
client [21] (testset)   loss: 0.9777 -> 0.9729  accuracy: 90.40% -> 90.40%     
client [56] (testset)   loss: 1.1541 -> 1.1522  accuracy: 90.35% -> 90.35%     
client [44] (testset)   loss: 0.7440 -> 0.7420  accuracy: 91.85% -> 91.85%     
client [92] (testset)   loss: 1.7920 -> 1.7898  accuracy: 91.05% -> 91.05%     
client [27] (testset)   loss: 1.3150 -> 1.3133  accuracy: 91.72% -> 91.72%     
---------------------------- TRAINING EPOCH: 400 ----------------------------  
client [10] (testset)   loss: 0.9196 -> 0.9177  accuracy: 91.28% -> 91.28%     
client [39] (testset)   loss: 0.9133 -> 0.9110  accuracy: 89.42% -> 89.42%     
client [65] (testset)   loss: 1.1574 -> 1.1485  accuracy: 90.00% -> 90.00%     
client [26] (testset)   loss: 1.2251 -> 1.2200  accuracy: 92.01% -> 92.01%     
client [19] (testset)   loss: 0.8330 -> 0.8324  accuracy: 90.48% -> 90.48%     
client [68] (testset)   loss: 1.1699 -> 1.1701  accuracy: 88.31% -> 88.31%     
client [41] (testset)   loss: 0.8137 -> 0.8141  accuracy: 93.72% -> 93.72%     
client [50] (testset)   loss: 0.8115 -> 0.8083  accuracy: 90.91% -> 90.91%     
client [75] (testset)   loss: 0.9488 -> 0.9462  accuracy: 91.79% -> 92.14%     
client [81] (testset)   loss: 0.6960 -> 0.6957  accuracy: 91.88% -> 91.88%     
Training... ---------------------------------------- 100% 0:18:32
SFL's average time taken by each global epoch: 0 min 2.76 sec.                 
SFL's total running time: 0 h 18 m 32 s.                                       
==================== SFL Experiment Results: ====================              
Display format: (before local fine-tuning) -> (after local fine-tuning)        
 So if finetune_epoch = 0, x.xx% -> 0.00% is normal.                           
 Centralized testing ONLY happens after model aggregation, so the stats between
'->' are the same.                                                             
{                                                                              
    "100": {                                                                   
        "all_clients": {                                                       
            "test": {                                                          
                "loss": "0.7352 -> 0.0000",                                    
                "accuracy": "90.23% -> 0.00%"                                  
            }                                                                  
        }                                                                      
    },                                                                         
    "200": {                                                                   
        "all_clients": {                                                       
            "test": {                                                          
                "loss": "0.8179 -> 0.0000",                                    
                "accuracy": "91.34% -> 0.00%"                                  
            }                                                                  
        }                                                                      
    },                                                                         
    "300": {                                                                   
        "all_clients": {                                                       
            "test": {                                                          
                "loss": "0.9104 -> 0.0000",                                    
                "accuracy": "91.88% -> 0.00%"                                  
            }                                                                  
        }                                                                      
    },                                                                         
    "400": {                                                                   
        "all_clients": {                                                       
            "test": {                                                          
                "loss": "0.9841 -> 0.0000",                                    
                "accuracy": "91.94% -> 0.00%"                                  
            }                                                                  
        }                                                                      
    }                                                                          
}                                                                              
==================== SFL Max Accuracy ====================                     
all_clients:                                                                   
(test) before fine-tuning: 91.94% at epoch 400                                 
(test) after fine-tuning: 0.00% at epoch 100                                   
[0m